date,title,content
2024-12-07,물은 때로는 항생제…요로감염 겪은 여성에 항생제 사용 감소 효과 [건강한겨레],"미국 캘리포니아 대학교-샌프란시스코 연구진 연구 결과체중 감량, 신장 결석, 편두통, 저혈압 등에도 효과 확인요로 감염이 있는 여성들이 물을 많이 마시는 것은 항생제 사용을 예방하거나 감소시키고 효과가 있는 것으로 나타났다. 게티이미지뱅크물을 마시는 게 좋다는 것은 잘 알려진 건강상식이다. 미국 보건당국은 하루 8잔의 물을 먹으라고 권장한다. 그리고 많은 사람들이 그 권고를 따른다. 그런데 몸의 어떤 부분에 좋은지, 어떤 상황에서 좋은지를 구체적으로 아는 사람은 많지 않다.캘리포니아 대학교-샌프란시스코(UCSF) 연구진은 최근 연구 결과를 통해 비만에서 요로 감염까지 물을 먹어서 도움이 되는 질병이나 상태를 일목요연하게 정리했다.UCSF연구자들은 이용 가능한 증거를 체계적으로 모아서 살펴봤다. 그리고 충분한 물을 마시면, 체중 감량에 도움이 되고 신장 결석, 편두통, 요로 감염 및 저혈압을 예방할 수 있다는 결론을 내렸다.UCSF비뇨의학과 학과장이며 논문 책임저자인 벤자민 브레이어 박사는 “물 마시는 것처럼 간단한 활동에 대한 증거가 명확하지 않고, 물 마시는 것의 이점도 (상식적으로 널리 퍼져 있지만) 잘 확립되지 않았기 때문에 더 자세히 살펴보고 싶었다”고 설명했다. 그는 이어서 “엄격한 연구의 양은 제한적이었지만, 일부 특정 영역에서는 통계적으로 유의미한 이점을 찾을 수 있었다”며 “저희가 아는 한, 이번 연구는 물 소비의 이점을 임상 결과를 중심으로 광범위하게 평가한 최초의 연구”라고 밝혔다. 이 연구는 11월25일 세계적 학술지 ‘자마 네트워크 오픈’(JAMANetworkOpen)에 게재됐다 .연구 결과UCSF연구자들은 하루에 물을 6잔 더 마시는 것은 재발성 요로감염이 있는 여성에게 도움된다는 점을 확인했다. 요로 감염은 신장, 요관, 방광, 요도, 전립선 등 요로계에 미생물이 침입하여 염증성 반응을 유발하는 것을 의미한다.연구진은 요로 감염이 자주 재발하는 여성 중 하루 수분 섭취량이 1.5리터 미만인 여성의 경우, 수분 섭취량을 1.5리터 이상으로 늘어나면 증상이 완화되는 것으로 나타났다고 밝혔다. 수분 섭취량이 많으면 세균뇨 희석 및 홍조 개선, 상피세포 부착 억제 등 여러 메커니즘에 의해 요로 감염 위험이 감소한다는 것이다. 특히 39~43살의 젊은 여성에게는 물 섭취량을 늘리는 것은 항생제 사용을 예방하거나 감소시키고 항생제 내성을 예방할 수 있는 가치 있고 안전한 방법이라고 말했다.또 혈당 수치가 높은 당뇨병 환자의 경우, 하루에 물을 4잔 정도 더 마시면 도움이 된다고 한다. 또 1리터의 물을 8주 동안 식전에 마신 결과, 220~230mg/dL의 공복혈당(FBG)을 가진 당뇨병 환자의 공복혈당이 유의미하게 개선됐다고 한다. 연구진들은 “연구 결과 공복혈당 감소의 크기는 비교적 컸다”며 “당뇨병의 높은 유병률을 고려할 때 향후 연구에서는 약물 사용이나 체중 증가를 피하기 위한 저비용 치료 옵션으로 이를 추가로 조사할 수 있다”고 말했다.두통이 반복되는 성인들은 3개월 동안 물을 더 많이 마시면 ​​증상이 호전되는 것으로 나타났다.연구진은 이밖에 △성인은 하루에 약 6잔의 물을 마시면 체중 감량에 도움이 되며, △편두통을 예방하고, △당뇨병과 저혈압을 조절하고, 요로 감염을 예방하는 데 도움이 될 수 있다는 연구결과들도 찾아냈다. 또 물 섭취가 신장 결석을 예방하고 체중 감량에 도움이 된다도 찾아냈다. 물을 많이 마시는 것은 또한 저혈압을 앓는 청년들에게 도움이 되었다고 한다."
2023-07-27,"대우건설, 상반기 영업이익 28% 증가…이라크 토목 사업 덕 봐","상반기 경영실적 공시DL이앤씨, 영업이익 소폭감소 신규수주는 23% 증가서울 을지로4가 대우건설 사옥. 대우건설 제공대우건설과 디엘(DL)이앤씨가 올해 2분기 경영실적을 각각 발표했다. 대우건설은 영업이익이 지난해 동기보다 증가했고 디엘이앤씨는 신규 수주가 호조를 보였다.대우건설은 연결 기준 올해 2분기 영업이익이 2177억원으로 지난해 동기보다 152.0% 증가한 것으로 잠정 집계됐다고 27일 밝혔다. 순이익은 2041억원으로 321.7% 늘었다. 상반기 매출은 지난해 동기(4조6904억원) 대비 25.4% 증가한 5조8795억원, 영업이익은 지난해 동기(3077억원)보다 28.2% 증가한 3944억원이다.상반기 신규 수주액은 지난해 동기(7조7719억원) 대비 25.3% 감소한 5조8063억원이었다. 이는 연간 계획인 12조3천억원의 47.2%에 이른다. 올해 상반기 말 기준 수주잔고는 45조157억원로 연간 매출액 대비 4년여치 일감을 확보한 상태다. 대우건설 관계자는 “부동산 경기 침체, 원자재가 및 외주비 급등으로 인해 주택건축사업의 원가율이 상승했지만, 토목사업 부문의 이라크 알 포와 플랜트사업 부문의 나이지리아 액화천연가스(LNG) 트레인7 등 해외 대형 프로젝트의 매출이 본격화되며 이익이 늘었다”고 설명했다.디엘(DL)이앤씨(옛 대림산업)는 연결 기준 올해 2분기 영업이익이 719억원으로 지난해 동기보다 46.61% 감소한 것으로 잠정 집계됐다고 이날 밝혔다. 상반기 매출은 3조8206억원으로 지난해 동기(3조3917억원) 대비 13% 증가했지만 영업이익은 1620억원으로 지난해보다 소폭 줄었다.DL이앤씨가 시공하는 ‘여수~남해 해저터널’ 조감도.DL이앤씨 제공디엘이엔씨는 상반기 신규 수주가 5조5137억원으로 지난해 동기에 견줘 23% 증가했다. 토목부문에서 총 사업비 6974억원 규모의 ‘남해~여수 해저터널’을 수주했고 플랜트 사업부문은 에스오일(S-OIL)이 투자하는 역대 최대 규모 국내 석유화학사업인 ‘샤힌 프로젝트’ 중 1조4천억원 규모 패키지1 공사를 수주하는 등 성과가 있었다. 디엘이앤씨 관계자는 “이번 수주 실적에는 포함되지 않았지만 지난 5월 우선협상대상자로 선정된 6조3천억원 규모 ‘백현 마이스’ 도시개발사업 가운데 약 2조원이 3분기 중으로 인식될 전망”이라고 말했다."
2024-09-30,"강남구, 양재천에서 '건강걷기 체험행사' 개최","[한겨레] 강남구(구청장 조성명)는 10월4일 오후 1시30분부터 5시까지 양재천에서 건강걷기 체험행사를 개최한다. 400여 명의 구민이 약 6km(약 1만 보)를 걸으며 걷기 전후의 혈당 변화를 확인하고, 걷기 코스 중간에 마련된 6개의 건강 부스를 체험할 수 있다.이번 행사는 걷기의 실제 효과를 확인할 수 있도록 기획됐으며, 참가자들은 걷기 전후에 혈당을 측정해 변화를 비교할 수 있다. 평균적으로 혈당이 130mg/dl에서 106mg/dl로 감소하는 결과가 기대된다.건강걷기 체험부스. 강남구 제공걷기 코스는 영동3교 북단에서 시작해 영동5교 북단 방향과 영동4교 남단 방향으로 나뉘어 진행되며, 중간에는 △혈당 측정 △신체기능 자가분석 △이어테라피 △마음건강관리 등 다양한 건강체험 부스가 운영된다. 참가자들은 각 부스를 체험하며 스탬프를 모으면 소정의 상품을 받을 수 있다.조성명 구청장은  “강남의 걷기 명소인 양재천에서 개최하는 행사가 구민들에게 건강한 생활 습관을 체험할 기회를 제공하고, 걷기의 중요성을 몸소 느끼는 계기가 되길 바란다”며 “앞으로도 일상 속 건강한 생활습관을 만드는 다양한 프로그램을 확대해 나가겠다”고 말했다.서울앤 취재팀 편집"
2022-10-21,10월 20일 인사,⊙ 교육부 △국립국제교육원장(일반임기제) 류혜숙 ◇일반직 고위공무원 △박성수 임창빈 ◇부이사관 △정시영 최인엽⊙ ♣H8국토교통부 ◇국장급 임용 △국토지리정보원장 조우석⊙ 보건복지부 ◇과장급 △장관정책보좌관 박재준⊙ 환경부 ◇국장급 임용 △화학물질안전원장 박봉균 ◇과장급 △원주지방환경청 기획평가국장 배정한⊙ 질병관리청 <전보> ◇과장급 <과장> △결핵정책 최호용 △에이즈관리 민선녀⊙ 극지연구소 <부장> △인프라운영 장성호 △행정 김병록 △연구사업관리실장 장경국⊙DL그룹 <승진> ◇DL건설 부사장 △곽수윤 <임원> ◇DL케미칼 △엄재훈 ◇DL이앤씨 △임태빈 한승규 조호진 김동현 석재원 육심구 김창식 ◇DL건설 △이동근 안대승 권훈 이택권 김송환 ◇글래드 △서법광
2024-07-31,"삼성물산 시공능력 11년 연속 1위, HDC현산 1년 만에 10위권 복귀","DL이앤씨 6위 → 5위서울 강남구 개포주공1단지를 재건축한 ‘디에이치 퍼스티어 아이파크’ 전경. 시공사업단 제공부동산 프로젝트파이낸싱(PF) 위기가 여전한 가운데 건설업체의 시공능력 평가 순위 변동이 예년에 견줘 큰 것으로 나타났다.국토교통부가 31일 공개한 ‘2024년도 시공능력 평가’ 결과를 보면, 삼성물산이 시공능력 평가액 31조8536억원(토목·건축)으로 11년 연속 1위를 차지했다. 현대건설, 대우건설, 현대엔지니어링이 뒤를 이었다. 시공능력 평가란 발주자가 적절한 건설업체를 선정할 수 있도록 건설공사 실적과 경영 상태, 기술 능력, 신인도 등을 종합적으로 평가해 매년 7월 말 공시하는 제도다.올해 시공능력 평가 1~4위는 지난해와 같았으나 5위부터는 순위 변동이 있었다. 지난해 지하 주차장 붕괴 사고로 인천 검단 아파트 전면 재시공을 결정한 지에스(GS)건설은 지난해 5위에서 올해 6위로 순위가 한 계단 내려갔다. 반면 디엘(DL)이앤씨가 5위로 한 단계 올라갔다. 포스코이앤씨는 7위, 롯데건설은 8위, 에스케이(SK)에코플랜트는 9위로 지난해와 같았다.에이치디씨(HDC)현대산업개발은 2022년 1월 광주 아파트 붕괴사고 여파로 지난해 10위권 밖으로 밀려난 지 1년 만에 다시 10위권으로 재입성했다. 사고 이후 프로젝트파이낸싱(PF) 보증을 줄여나가고 자체 사업에 집중한 결과 올해 상반기 영업이익(954억원)이 전년 동기 대비 71% 증가하는 등 경영상태가 호전된 게 영향을 끼쳤다.11~15위권에서도 눈에 띄는 변화가 있었다. 한화가 지난해 12위에서 한 단계 오른 11위를 차지했고 지난해 10위였던 호반건설이 12위로 밀려났다. 호반건설은 2019년에 이어 지난해 두번째로 10위권에 든 바 있다. 또 두산에너빌리티(옛 두산중공업)는 산업·환경설비 업종에서 강세를 보이며 지난해보다 28계단 뛴 14위를 기록해 눈길을 끌었다. 그밖에 광주에 본사를 두고 있으면서도 최근 수도권에서 공격적인 주택사업을 벌이고 있는 제일건설이 지난해보다 한 계단 오른 15위를 차지했다."
2022-03-20,"세계 최장 현수교 ‘터키 차나칼레 대교’, 한국 기술력으로 당당한 위용","지난 18일 착공 4년만에 준공공사기간 1년7개월 앞당겨주탑간 거리 2023m로 세계 1위유럽과 아시아 잇는 관광명소 기대지난 18일 준공된 터키 차나칼레 대교.DL이앤씨 제공세계 최장 현수교인 터키의 ‘차나칼레 대교’가 한국 건설사들의 뛰어난 기술력으로 공사기간을 1년7개월 단축하며 준공됐다.DL이앤씨와SK에코플랜트는 지난 18일 터키 현지에서 김부겸 국무총리와 에르도안 터키 대통령, 발주처와 시공사 관계자들이 참석한 가운데 차나칼레 대교 개통식을 열었다고 20일 밝혔다.다르다넬스 해협을 사이에 두고 유럽과 아시아를 연결하는 이 교량은 차나칼레주의 랍세키(아시아 쪽)와 겔리볼루(유럽 쪽)를 잇는 구간으로, 세계적인 관광명소가 될 것으로 기대된다. 앞서 터키 정부는 공화국 건국 100주년인 2023년을 기념하기 위해 차나칼레에 주탑 간 거리가 2023ｍ인 세계 최장 현수교를 건설하기로 하고 세계 유수의 기업을 상대로 입찰에 나섰다. 이에 국내 최장 현수교인 ‘이순신대교’를 건설한DL이앤씨와SK에코플랜트가 ‘팀 이순신’을 구성해 2017년 일본 기업을 제치고 수주에 성공했다.2018년 4월 착공한 차나칼레 대교는 애초 2023년 10월이 준공 목표 시기였지만 우리 건설사들은 뛰어난 기술력으로 공사 기간을 1년7개월이나 단축했다. 총 공사비는 약 3조2천억원이며, 두 회사는 이 교량을 12년간 운영한 뒤 터키 정부에 이관하게 된다.차나칼레 대교가 공식 개통하면서 세계 최장 현수교 자리도 24년 만에 바뀌게 됐다. 기존 세계 최장 현수교는 1998년 준공한 일본 아카시 해협 대교로, 아카시 대교의 주탑 간 거리는 차나칼레 대교보다 32m 짧은 1991ｍ다.주탑과 주탑 사이에 설치한 케이블로 교량 상판을 끌어당기며 떠받치는 구조인 현수교는 현존 교량 가운데 시공 및 설계 기술의 난도가 가장 높은 구조물로, 우리 기업이 세계 최장 현수교를 건설한 것은 세계 최고의 기술력을 입증했음을 의미한다. 차나칼레 대교의 케이블은 강선 1가닥이 5.1톤의 하중을 지지해, 현존하는 케이블 중 최고의 인장강도(케이블이 끊어지기 직전까지 무게를 감당할 수 있는 능력)를 자랑한다. 또 다르다넬스 해협의 강풍을 이겨내기 위해 내풍 안정성에 최적화된 비행기 날개 모양의 상판을 설치했다. 높이 334ｍ에 이르는 주탑 역시 현존 현수교 중 가장 높다.이동희DL이앤씨 토목사업본부장은 “이순신대교로 세계에서 6번째로 현수교 기술 자립을 완성한DL이앤씨가 불과 10년 만에 세계 1위 현수교를 성공적으로 준공하게 되었다”고 말했다. 조정식SK에코플랜트 조정식 에코솔루션BU대표는 “유럽과 아시아를 연결하는 터키 유라시아해저터널과 보스포러스 3교에 이어 다시 한번 세계 최장 현수교를 건설하는 금자탑을 쌓았다”며 “한국 건설회사의 높은 기술력과 시공능력을 세계적으로 인정받게 됐다”고 말했다."
2024-06-25,성북구 “AI·IoT 기반 어르신 건강관리사업 효과 커”,"[한겨레] 성북구가 추진중인AI·IoT기반 어르신 건강관리사업이 만성질환 및 건강관리 행태 개선에 큰 효과를 거두고 있는 것으로 나타났다. 구는AI·IoT기반 어르신 건강관리사업 등록 후 6개월 경과자(522명)를 대상으로 사후 건강 스크리닝을 실시한 결과, 신체활동 개선율이 64.1%로 긍정적인 효과를 나타냈다고 밝혔다.사후 건강 스크리닝은 사업 참여 후 6개월이 지난 시점에서 △신체활동 실천현황 △식생활 실천현황 △고혈압 관리현황 △당뇨 관리현황 △허약평가 등 5개 분야에 대한 세부항목을 평가하는 것이며, 조사 결과 고혈압 및 당뇨 조절률이 증가하였으며 신체활동 및 식생활 개선 효과를 크게 보였다.성북구에 거주 중인 80대 초반의 어르신은 사업 참여시 당뇨병 전단계로 식후 혈당이 186mg/dL이었으나, 담당자의 지지와 격려에 힘입어 매일 미션을 철저히 수행하고 사업 참여 6개월 후 혈당이 125mg/dL까지 떨어졌다.성북구청 제공AI·IoT기반 어르신 건강관리사업이란 허약·만성질환 관리가 필요한 65세 이상 어르신을 대상으로ICT기술을 활용한 건강측정기기(손목활동량계, 체중계, 혈압계, 혈당계)를 대여해, 스마트폰 앱을 통해 6개월간 보건소 전문가의 비대면 맞춤형 건강관리 서비스를 제공하는 사업이다. 구는 사업 참여자들을 대상으로 만성질환 영양, 운동 관리 등 교육도 추진할 예정이다.성북구보건소 건강관리과(02-2241-6126~9)로 전화 신청을 통해 사업에 참여할 수 있으며, 만성질환 관리 및 생활 습관 개선이 필요한 성북구 거주 65세 이상 어르신이라면 누구나 신청할 수 있다.이동구 서울& 온라인팀장donggu@hani.co.kr"
2024-04-02,‘열폭주’ 전기차 배터리팩 2분 만에 뚫는다…화재진압 시스템 선봬,"DL이앤씨, 탱크테크와 손잡고‘전기차 화재 진압 시스템’ 개발건물용 전기차 화재진압 시스템 시연 모습.DL이앤씨 제공디엘(DL)이앤씨가 중소기업과 손잡고 세계 첫 건축물용 ‘전기차 화재진압 시스템’을 개발했다. 아파트 등의 주자창 전기차 충전소에서 차량 화재가 발생할 경우 신속한 진화를 통해 화재 피해를 줄일 수 있는 시스템이다.2일 디엘이앤씨에 따르면, 이 시스템은 화재를 자동으로 인지하고 진압을 지시하는 ‘중앙관제시스템’과 직접 화재를 진화하는 ‘진압장비’로 구성된다. 화재가 발생하면 중앙 관제시스템은 이를 감지해 화재가 발생한 차량이 있는 위치로 진압장비를 이동시키고, 진압장비는 차량 하부에서 차량의 배터리팩에 구멍을 뚫고 물을 분사한다.진압장비는 강력한 수압으로 터빈을 돌려 드릴을 작동시키며, 이 드릴은 별도의 전원 공급 없이 수압만으로도 2분 안에 차체 하부와 배터리팩에 구멍을 뚫고 물을 분사해 화재를 신속하게 진압한다.내연기관 차량과 달리 전기차는 화재 발생 시 배터리 온도가 섭씨 1천도 이상으로 급상승하는 ‘열폭주’ 현상을 보이며, 특히 전기차에 탑재된 배터리는 보호팩으로 덮여 있어 일반적인 소화 약제로는 진압이 어렵다는 점에 착안한 것이다. 디엘이앤씨는 현대자동차 성능테스트 및 방재시험연구원 ‘전기차 실물 차량 화재시험’을 통해 이 시스템의 성능 검증을 진행, 리튬이온과 리튬인산철 등 전기차 배터리 종류와 관계 없이 10분이면 화재를 완전히 진압할 수 있는 성능을 입증받았다고 밝혔다.이 시스템은 소화 장치에서 레일을 통해 진압장비를 화재 위치로 이동시키는 ‘이동식’ 외에 주차구역 하부에 소화 장치를 매립하는 ‘고정식’,소화전 형태로 보관할 수 있는 ‘수동식’ 등 세 가지 형태로 구성된다. 각 건축물 형태와 주차장 여건에 맞는 제품을 선택해 설치할 수 있다.디엘이앤씨는 부산 소재 선박 기자재 전문 중소기업인 탱크테크와 시스템을 공동 개발했다며 대기업과 중소기업 간 상생 협력의 모범 사례라고 밝혔다. 양사는 지난해 공동개발 업무협약 체결 후 신기술을 개발하고 공동 특허 출원 등을 통해 상용화에 성공했다. 디엘이앤씨는 ‘e편한세상’ 아파트 현장에 이 시스템을 시범 적용하는 방안을 검토 중이다. 신축 아파트의 경우 내년부터 전기차 충전시설을 총 주차면 수 대비 10% 이상 의무적으로 설치해야 해 관련 수요 증가도 예상된다."
