date,title,content
2023-06-19,원희룡 “DSR 완화 길어야 1년…계속 완화하면 갭투자 하라는 얘기”,"<연합뉴스> 인터뷰원희룡 국토교통부 장관이 16일 오후 서울 중구 국토발전전시관에서 연합뉴스 취재진과 인터뷰하고 있다. 연합뉴스원희룡 국토교통부 장관이 전세 보증금 상환 목적으로 임대인이 대출을 받을 때 총부채원리금상환비율(DSR) 규제를 완화해 적용할 기간은 ‘길어야 1년’이라고 밝혔다. 최근 나오는 ‘집값 바닥론’에 대해서는 “하방 압력이 여전해 추세 상승이란 데 동의하지 않는다”고 잘라 말했다.원 장관은 지난 16일 <연합뉴스>와 한 인터뷰에서 역전세로 인한 “보증금 차액에 대해 다음 계약 기간 때까지만 디에스아르 규제를 완화하는 방안에 대해 금융당국, 기획재정부와 검토하고 있다”며 “길어야 1년이다. 한꺼번에 터지는 것을 막기 위해 정부가 일시 개입하는 것이지, 앞으로 계속 완화해준다고 하면 ‘전세 끼고 집 사라’는 얘기밖에 안 된다”고 말했다.임대인 대출 규제 완화는 정부가 돈을 풀어 갭투기를 떠받치는 꼴이란 지적에 대해서는, “보증금 반환 목적에만 (대출금을) 쓰도록 할 것”이라고 강조했다. 규제 완화 덕에 대출을 받아 추가 주택 매수에 나서는 등 다른 대출금 용처가 생기지 않도록 제도를 설계하겠다는 뜻이다. 원 장관은 “대출금이 임차인에게 직접 가야 하고, 다음 세입자 보호를 위해 임대인 부담으로 보증금 반환 보증보험에 의무 가입해야 한다”고 했다.보증보험 가입시 전세가율(매매가 대비 전세가 비율) 요건이 현재 적용되는 90%보다 더 강화될 가능성도 열어뒀다. 원 장관은 “갭투자의 갭을 가급적 벌려 놓아야 임차인들의 보증금을 반환받을 권리를 더 안전하게 보호할 수 있다”며 “전세보증금 반환 보증보험 가입 때 전세가율(매매가 대비 전세가 비율) 몇 퍼센트 이상은 안 된다고 캡을 씌우면 지금처럼 전세가가 매개가를 넘거나 깡통전세가 되는 것은 막게 된다”고 말했다. 다만 원 장관은 “이는 재산권 문제이니 일방적으로 건드리진 않을 것이다. 철저한 공론화, 입법화를 (과정을) 거쳐야 할 것”이라고 했다.최근 집값 흐름과 관련해서는 “경착륙은 피했으나 ‘바닥이다 아니다’를 말하기엔 시기상조”라며 “대기 수요가 많은 지역에서 하락이 멈추거나 부분 상승이 있었던 것은 사실이다. 그러나 여기에 추격 매수가 따라오거나 투자 수요가 붙을 것이냐에 대해선 ‘아니다’라고 본다”고 말했다."
2023-06-18,KB금융연 “전세대출 DSR에 포함돼야…규제 완화는 신중을”,"남산에서 바라본 서울 시내 아파트 풍경. 연합뉴스전세자금대출을 총부채원리금상환비율(DSR) 산정에 포함해야 한다는 제언이 나왔다. 집값 거품과 전세시장의 취약성을 키우는 과도한 대출을 억제해야 한다는 취지다.케이비(KB)금융지주 경영연구소는 이런 내용을 담은 ‘전세제도의 구조적 리스크 점검과 정책제언’ 보고서를 18일 발간했다. 연구소는 “(정부의 전세사기 대책은) 주로 피해자 지원에 초점을 맞추고 있다”며 “이번 기회에 전세제도의 구조적 문제점을 파악하고 근본적인 개선 방안을 마련해야 한다”고 했다.일단 전세자금대출에 디에스알 규제를 적용해야 한다고 했다. 금융당국은 그동안 가계부채 관리를 강화하면서도 전세자금대출은 디에스알 산정에서 제외해왔다. 디에스알 규제의 취지는 차주가 자신의 소득으로 갚을 수 있는 만큼만 빚을 내도록 하는 것인데, 전세자금대출의 경우 차주가 계약기간 만료 때 돌려받는 전세보증금으로 상환하기 때문에 디에스알 한도를 둘 필요가 크지 않다는 논리였다.규제 사각지대에 있는 전세자금대출이 ‘갭투자’에 악용되면서 집값 거품을 키운다는 지적이 제기돼왔던 배경이다. 연구소는 “과도한 대출이 주택시장에 주는 부정적인 영향을 감안해 (전세자금대출을) 디에스알 산정에 포함하는 것을 검토할 필요가 있다”고 했다. 한국은행도 지난해 말 금융안정보고서에서 전세자금대출에 디에스알 규제를 차등 적용하는 방안을 검토할 필요가 있다고 제언한 바 있다.임대인의 전세보증금에 디에스알을 적용하는 방안도 거론했다. 전세보증금도 일종의 빚에 해당하는 만큼 적절한 한도 규제가 필요하다는 취지로 풀이된다. 연구소는 3주택 보유자의 주택담보인정비율(LTV)이 전세보증금을 포함해 70% 이상인 경우 디에스알 산정에 전세보증금도 포함하는 방안을 예시로 들었다.최근 거론되는 디에스알 규제의 일시적인 완화는 신중하게 접근해야 한다고 봤다. 정부는 전세보증금 반환 목적의 대출에 한해 디에스알 한도를 완화해주는 방안을 검토하고 있다. 역전세난 대책의 일환이다. 연구소는 “소득으로 감당 가능한 범위를 넘어서는 대출을 허용한다는 점에서 리스크가 증가할 수 있어 신중한 검토가 필요하다”며 “1억5천만원 한도 내에서 디에스알 적용 배제를 고려할 수 있다”고 했다."
2023-06-06,"[사설] 역전세난 핑계 DSR 완화, 갭투기 사후 지원하는 꼴","5일 오전 서울 시내에 설치되어 있는 주요 은행들의 현금인출기. 연합뉴스전셋값이 떨어져 기존 세입자의 전세보증금 반환에 어려움을 겪는 집주인을 대상으로 정부가 대출 규제 완화를 검토하고 있다. 이사를 떠나는 세입자로선 보증금을 제때 돌려받는 게 매우 중요한 일이긴 하다. 그러나 이를 핑계로 임대인에게 총부채원리금상환비율(DSR) 규제를 완화해서까지 대출 한도를 늘려주는 것은 선을 넘는 일이다. 필요하다면 세입자를 지원하면 된다. 무리한 갭투자를 한 투기꾼까지 지원하자고 가계부채 관리에 구멍을 내서는 안 된다.전셋값이 기존 세입자의 보증금보다 낮아지는 ‘역전세난’은 계속 심해지고 있다. 한국은행이 6일 내놓은 보고서를 보면, 전국의 잔존 전세계약 중 역전세 위험가구 비중이 1월 25.9%에서 4월 52.4%로 늘었고, 같은 기간 깡통전세 위험가구 비중도 2.8%에서 8.3%로 증가했다. 코로나 위기에 대응하여 초저금리 정책을 폈던 시기에 급등한 집값과 전셋값이 뒷걸음질을 하면서 일어나는 일이다. ‘전세사기’가 많았던 빌라나 다가구주택에서 역전세난이 더 심하다.그렇지만 집값이나 전셋값은 오르내리는 것이고, 그 리스크는 집주인이 져야 할 몫이다. 집주인은 계약 만료로 이사하는 세입자의 보증금을 제때 내줘야 할 의무가 있다. 그러지 못하면 손해도 배상해야 한다. 집주인은 이미 여러 상품이 나와 있는 전세보증금 반환 대출을 활용할 수 있다.정부는 이를 활용해도 반환할 보증금을 다 마련하지 못하는 집주인을 위해 대출 확대를 검토하겠다고 한다. 그렇다고 총부채원리금상환비율 규제를 풀어서까지 대출 한도를 늘려주는 것은 옳지 않다. 부풀어 오른 전세보증금을 지렛대 삼아 무리한 갭투자를 한 사람까지 사후 지원하는 꼴이 되기 때문이다. 세입자를 돕는 게 목적이라면, 제때 보증금을 돌려받지 못해 어려움을 겪는 세입자에게 직접 유동성을 지원하면 될 일이다.올해 1분기 들어 가계부채가 13조7천억원 감소한 것은 다행한 일이다. 그렇지만 우리나라 가계부채는 여전히 국내총생산(GDP) 규모를 뛰어넘고, 부채비율은 세계 주요국 가운데 가장 높다. 정부가 고금리에 따른 가계 고통 경감을 명분으로 특례보금자리론 등 정책 모기지를 공급하고 있어 2분기에는 가계대출이 다시 늘어날 가능성이 크다. 총부채원리금상환비율 규제만은 건드리지 말아야 한다. 여기에서 억제의 끈을 더 놓았다가는 나라 경제를 돌이킬 수 없는 위기에 빠뜨릴 수도 있음을 명심해야 한다."
2023-04-07,오피스텔 담보대출 한도 늘어난다…새 DSR 계산법 24일부터,"실제 상환액 반영토록 산정방식 개정지난해 서울 시내 한 오피스텔 모습. 연합뉴스이르면 오는 24일부터 오피스텔 담보대출 한도가 늘어난다. 오피스텔 담보대출에 적용되는 총부채원리금상환비율(DSR) 산정 방식이 실제 상환액을 반영하도록 개정되면서다.금융감독원은 7일 이 같은 내용을 뼈대로 하는 5개 금융권 감독업무 시행세칙 개정안을 사전예고한다고 밝혔다. 오는 17일까지 은행·보험·저축·여신전문금융사·상호금융 등 금융 업권별 시행세칙 개정안에 대해 사전예고 기간을 갖고 의견 수렴을 거쳐 이르면 오는 24일부터 시행에 들어간다. 앞서 정부는 지난달 29일 발표한 내수활성화 대책에서 오피스텔 담보 대출 디에스아르 산정 방식을 개정하겠다고 밝혔는데, 그 구체적인 내용이 공개된 것이다.이번 개정안의 핵심은 오피스텔 담보대출에도 일반 주택담보대출에 준하는 디에스아르 계산 방식을 적용하는 것이다. 기존에는 은행권에서 오피스텔 담보 대출 한도를 정할 때 상환 방식과 무관하게 대출 기간을 8년으로 일괄 상정해 계산했다. 개정안은 대출 기간을 실제 만기로 적용한다. 전액 분할 상환하는 경우, 기존에는 디에스아르를 계산할 때 이자에 대해서만 실제 만기를 적용해 실 상환액을 적용했다. 원금에 대해서는 만기를 8년으로 적용해 연간 상환액을 구했는데, 이를 현실화하겠다는 것이다. 일부를 분할 상환하는 경우에도 분할 상환하는 금액과 만기에 일시 상환하는 금액에 거치기간을 제외한 대출기간을 적용해 디에스아르를 계산한다. 거치기간은 일반 주담대와 동일하게 1년으로 제한한다. 일시상환은 현행 방식을 유지한다.과거에는 오피스텔 같은 비주택 담보 대출은 1년 단위로 계약을 맺고 연장하는 게 관행이어서 대출 한도를 넉넉하게 보장하고자 비주택 담보대출 평균 만기인 8년을 적용했던 것인데, 최근 들어 장기 분할 상환 비중이 늘면서 평균 만기가 길어졌다. 기존 디에스아르 산정 방식이 도리어 차주의 실제 상환 능력에 비해 한도를 낮추게 된 것이다.개정 시행세칙 적용 이후 오피스텔 담보대출을 받는 차주는 이전보다 한도가 높아질 전망이다. 지난해부터 은행권 가계 대출에 적용되는 디에스아르 40% 규제에 따라 연 소득 5천만원인 차주가 30년 만기 원리금균등상환 방식으로 오피스텔 담보 대출을 받는다고 하면, 금리가 5%이고 다른 대출이 없다는 가정 아래 기존엔 1억3천만원이던 한도가 3억1천만원까지 높아질 수 있다.금감원 관계자는 “오피스텔 담보대출의 장기분할 상환을 유도해 가계부채의 질적구조 개선 효과도 있을 걸로 기대한다”고 말했다."
2023-01-02,올해 부동산 정책도 ‘대출 규제 완화’…DSR은 유지한다,"지난달 7일 서울 63스퀘어에서 바라본 시내 아파트 모습. 연합뉴스금융당국이 새해에도 부동산 대출 규제 완화 기조를 이어갈 전망이지만, 총부채원리금상환비율(DSR)은 마지막 보루로 유지할 가능성이 큰 것으로 나타났다.2일 금융권에 따르면, 금융당국은 새해에도 부동산 시장의 연착륙을 유도하는 기조를 이어가겠지만, 디에스아르 규제는 현행 수준을 유지하겠다는 방침이다. 금융당국 관계자는 <한겨레>와 한 통화에서 “총부채원리금상환비율 규제 완화 방안은 논의 테이블에 아예 올라와 있지 않은 상황”이라고 강조했다.디에스아르는 소득에서 전체 금융부채 원리금 상환액이 차지하는 비율이다. 현재 전체 금융기관에서 빌린 돈이 1억원을 넘을 경우에는 연간 원리금 분할 상환액이 차주 연 소득의 40%를 넘지 않도록 하는 규제(비은행 50%)가 적용되고 있다. 개인의 상환능력을 따져 대출 한도를 제한하고, 전체 가계부채 증가를 억제하는 조처다.금융당국은 지난해 무주택자·1주택자에 대한 부동산 금융규제를 단계적으로 완화한 데 이어, 다주택자에 대한 세금·대출 규제까지 전방위적으로 풀어주겠다고 밝힌 바 있다. 정부는 지난해 12월 ‘2023년 경제정책방향'을 통해 올해 1분기 중 서울 등 규제지역 내 다주택자를 상대로 한 주택담보대출 금지 규제를 해제하고, 주택담보대출비율(LTV) 상한을 30%로 적용하겠다고 밝혔다. 부동산 시장 경착륙에 대한 우려가 깊어지자 다주택자를 통해 얼어붙은 주택 매수세의 회복을 기대해보겠다는 취지다.그러나 금융당국은 가계부채 관리를 위한 마지막 수단인 디에스아르 규제만큼은 틀어 쥐고 있겠다는 의지가 강한 것으로 보인다. 금융당국 입장에서는 엘티브이 등 부동산 금융규제를 풀어도 디에스아르만 그대로 유지하면 소득 대비 과도한 대출을 받는 문제를 방지할 수 있다.지난해 12월 김주현 금융위원장은 “부채가 많으면 외부 충격이 왔을 때 취약할 수밖에 없다”며 “이런 상황에서 디에스아르 규제를 완화하는 것은 지금 상황에서 맞지 않는 것 같다”고 말했다. 금융당국 관계자는 “디에스아르 규제는 차주, 즉 소비자 보호를 위한 규제로 쉽게 풀기가 어렵다”며 “지난 7~8년 동안 누적돼온 가계부채를 지속적으로 타이트하게 관리할 필요가 있다”고 밝혔다."
2022-02-03,"‘연소득 40%’ DSR, 저소득·청년·자영업자 영향 살펴야","이코노미 인사이트 _Economyinsight알기 쉬운 금융 이야기 l 총부채원리금상환비율(DSR) 적용2021년 12월22일 서울 종로구 광화문 시민열린마당에서 열린 ‘소상공인·자영업자 생존권 결의대회’.자영업자는 높은 원리금 상환 부담과 코로나19 영향 등으로 부채 구조가 상대적으로 취약하다. 연합뉴스정부가 가계대출 규제를 본격화하고 있다. 2022년 1월부터 가계의 은행권 대출금 합계가 2억원을 넘으면 차주별 총부채원리금상환비율(DSR) 40%(2금융권 50%)가 적용된다. 주택담보대출과 신용대출, 카드론 등을 합한 총대출금이 2억원을 초과할 경우 연간 상환하는 원금과 이자의 합계가 연소득의 40%를 초과할 수 없게 한 것이다. 이마저도 2022년 7월부터는DSR적용 대출 한도가 1억원으로 축소된다. 이 조처는 코로나19 대응을 위한 확장적 금융·통화 정책의 영향으로 가계부채가 빠르게 증가하면서 선제적인 리스크 관리를 위해 금융위원회가 2021년 4월 ‘가계부채 관리 방안’과 10월 ‘가계부채 관리 강화 방안’을 마련·시행했기 때문이다.제2금융권DSR비율 50%로 하향정부의 가계부채 관리 방안을 세부적으로 살펴보면, 우선 차입자의 상환능력 범위 내에서 대출이 이뤄지도록DSR적용 대상을 주택담보대출이나 신용대출 등 ‘항목별 적용’ 방식에서 ‘대출 총액’ 방식으로 전환하고, ‘만기일시상환’의 잠재적 리스크를 축소하기 위해 ‘분할상환’을 확대한다는 것이다. 또 대출이 상환능력 대비 과다 취급되지 않도록DSR산정 만기를 축소(신용대출의 경우 종전 10년에서 5년으로)하고, 상호금융이나 저축은행 등 제2금융권에 대해서도DSR적용 비율을 60%에서 50%로 하향 조정했다. 이에 더해 실수요자의 불편을 초래하지 않도록 2022년 가계대출 증가율을 ‘4~5%대’의 안정적인 수준으로 관리할 방침이다.DSR도입은 2017년 금융위원회가 금융기관의 가계대출 취급시 상환능력을 정확히 반영하도록 ‘금융회사 여신심사 선진화 방안’을 마련하면서부터다. 2018년부터 은행을 중심으로 시범운영했고 2019년에는 상호금융, 보험, 저축은행 등으로 확대됐다. 가계의 주택담보대출 취급시 적용하는 총부채상환비율(DTI)이 차주별 부채와 소득을 정확히 반영하지 못해 상환능력에 비해 대출이 과도(과소)하게 취급되는 경향이 있다는 점을DSR도입 이유로 지적했다. 글로벌 금융규제 협의체인 금융안정위원회(FSB), 유럽연합과 회원국의 금융시장을 감독하는 유럽은행감독청(EBA) 등이 채무상환 여력을 대출심사의 중요한 원칙으로 고려한다는 점도 거론했다.DSR도입이 소비 등 우리 경제에 미치는 영향은 어떻게 될까? 한국은행은 2021년 12월 금융안정보고서에 관련 분석 결과를 제시했다. 가계부채 데이터를 활용해 추정한 결과, 가계의 소비를 제약하는DSR임계수준이 45.9%로 2021년 3월 말 평균DSR(36.1%)를 상회하는 것으로 나타났다. 이에 따라 차주별DSR40%를 적용하더라도 대출받은 사람의 채무상환 부담이 소비를 제약하거나 경기침체를 촉발할 위험성은 낮다는 것이다. 다만 임계수준을 초과하는 차입자 비중은 전체의 6.3%에 불과하지만 저소득층과 20~30대 청년층은 각각 18.4%, 11.3%에 이른다. 게다가 금리 인상 등으로DSR가 큰 폭으로 상승(8%포인트)하는 경우를 가정해 임계수준 초과 차주의 비중 변화를 추정하면 고신용·고소득층은 영향이 크지 않지만, 저소득·청년층은 임계수준을 넘어서는 비중이 각각 27.7%, 19.7%로 가파르게 상승했다.자영업자도 높은 원리금 상환 부담과 코로나19 영향 등으로 부채 구조가 상대적으로 취약한 것으로 평가된다. 2021년 9월 말 자영업자 1인당 대출 규모(3.5억원)는 사업자금 조달 등에 따라 임금노동자 등 비자영업자(0.9억원)보다 많다. 자영업자의 부동산담보대출 비중(69.3%)은 비자영업자(55.7%)보다 높으며,DSR(37.1%)도 비자영업자(31.0%)를 상당폭 상회한다. 코로나19 충격을 완화하기 위해 시행된 원리금 상환유예가 예정대로 2022년 3월 종료될 경우 자영업자의DSR(41.3%)은 상당폭 오를 것으로 추정된다. 특히 숙박·음식(52.2%), 스포츠·여가(56.1%), 개인서비스업(65.9%) 등에서DSR가 높을 전망이다. 코로나19의 새로운 변이 발생과 재확산, 사회적 거리 두기 재강화 등으로 자영업자의 소득이 감소한 상황에서 금리가 오르고 부동산 가격이 조정될 경우 채무 상환능력이 줄어들면서 취약차주를 중심으로DSR규제를 감당하기 어려워질 수 있다.대내외 변화에 선제 대응해야2022년 미국은 기준금리를 서너 차례 인상할 것이라고 예고했다. 한국은행도 2021년 8월과 11월에 기준금리를 각각 0.25%씩 올린 데 이어 추가 인상 가능성이 커졌다. 또한 상환능력 중심의DSR규제가 본격화하면서 저소득·저신용 갭투자자, 다주택자 등 취약차주를 중심으로 대출한도가 줄어들면서 디레버리징(Deleveraging·자기자본 대비 차입 비율에서 차입 비율을 낮추는 것)이 진행될 가능성이 있다. 이로 인해 가계소비가 줄어들 경우 기업의 투자와 생산이 위축되고 다시 가계소득을 축소하는 악순환을 초래할 위험이 있다.DSR도입으로 갚을 수 있는 만큼만 빌리고, 처음부터 나눠 갚는 대출문화가 정착될 것으로 기대된다. 다만 상환능력 중심의 대출 관행을 정착시키는 과정에서 코로나19 영향, 기준금리나 환율 변동, 부동산시장 위축 등 대내외 리스크 요인을 점검하면서 대응해야 할 것이다.김용 금융전문가goldheader@hanmail.net"
2022-07-01,"오늘부터 생애최초 LTV 80%로 완화, 대출 1억 이상에 DSR 적용","오늘부터 바뀌는 ‘대출 규제’DSR3단계 규제 시작되지만긴급 생활자금 등 일부 예외시중은행 대출창구. 한겨레 자료사진1일부터 금융기관 대출 상환액이 연 소득을 과하게 넘지 않도록 하는 대출규제가 강화되는 한편, 생애최초 주택구매자 등 실수요자에 대한 주택담보대출 규제는 다소 완화된다.지난달 16일 금융위원회가 발표한 ‘새 정부 가계대출 관리방향 및 단계적 규제 정상화 방안’에 따르면, 7월1일부터 소득 수준을 넘는 과도한 가계부채 확대를 막기 위한 차주(개인) 단위 ‘총부채원리금상환비율(DSR) 3단계’ 규제가 시행된다. 전체 금융기관에서 빌린 돈이 1억원을 넘을 경우 연간 원리금 분할 상환액이 차주 연 소득의 40%를 넘지 않도록 하는 ‘디에스아르 40%(비은행권 50%) 규제’가 적용되는 것이다.예를 들어, 현재 4천만원 한도의 마이너스 통장(금리 연 4.58%·신용등급 2등급)을 가지고 있는 사람이 서울에서 시세 6억 원짜리 아파트를 사기 위해 금리 연 3.79%로 돈을 빌려 30년 동안 원리금 균등 분할 상환한다고 가정해보자. 이 사람은 지난 6월 말까지는 총 대출액이 2억원 초과 시 적용되는 디에스아르 40% 규제에 따라 대출을 1억6천만원까지 받을 수 있었는데, 7월부터는 대출 가능 금액이 1억1040만원으로 줄어든다.다만 정부는 당장 이달부터 디에스아르 규제 강화에 따라 실수요자의 생계자금 대출조차 지나치게 제약되는 상황을 막기 위해 규제 일부를 보완하기로 했다. 현재는 신용대출 한도가 ‘연 소득 범위 이내’로 제한돼 있지만 7월부터는 이런 제한이 폐지된다. 예컨대 소득이 1억원인 사람이 대출금리 연 5%에 5년 동안 신용대출을 받는다고 가정할 경우 현재는 한도가 1억원(디에스아르 25% 수준)밖에 나오지 않지만 이달부터는 디에스아르 40% 적용을 받더라도 대출한도가 연 소득의 1.6배 수준인 1억6천만원까지 나온다. 이뿐 아니라 긴급한 생활안정자금 목적으로 대출을 받으려는 것이 증명돼 여신심사위원회 승인을 받은 경우라면 총 대출액이 2억원을 넘지 않으면 디에스아르 40% 규제를 적용받지 않는다. 사실상 긴급 생활안정자금을 필요로 하는 이는 디에스아르 3단계 규제에서 제외해 주는 셈이다.이에 더해 7월부터는 생애 처음으로 주택을 구매하는 이들에 대한 총부채상환비율(LTV) 상한이 소득, 주택 가격, 지역과 상관없이 80%로 완화된다. 엘티브이가 완화되더라도 여전히 디에스아르 3단계 규제의 적용을 받긴 하겠지만 소득이 높은 이들 가운데 생애최초 주택구매자에 해당한다면 대출 한도가 오르는 효과를 누릴 수 있을 것으로 보인다. 최근까지는 주택을 구매한 적이 없는 무주택 가구의 경우 부부합산 연 소득이 1억원을 넘지 않고, 집값이 투기·투기과열지역의 경우 9억원, 조정대상지역 경우 8억원 이하라야 엘티브이(투기지역 60%, 조정대상지역 70%) 우대를 받을 수 있었다. 하지만 7월부터는 생애최초 주택구매자라는 조건만 맞추면 주택가격, 부부합산 소득 조건 등 상관없이 완화된 엘티브이 80% 우대조항을 적용받을 수 있다."
