date,title,content
2022-12-27,[7NEWS] “이러다 집에 잡아먹힌다”...年소득 60%가 주담대 상환금,"7NEWS뉴스레터 구독하기 ☞https://page.stibee.com/subscriptions/145557안녕하세요. 7NEWS입니다. 주택담보대출(주담대)을 받은 차주의 총부채원리금상환비율(DSR)이 평균 60%를 넘겼습니다. 대출받을 당시 당국의DSR40% 규제에 따라 대출 한도가 결정된 차주도 최근 금리 급등 여파로 이자부담액이 늘어DSR도 덩달아 오른 것으로 보입니다.지난 26일 한국은행은 3분기 기준 주담대 보유차주의 평균DSR이 3년6개월 만에 다시 60%를 돌파했다고 밝혔습니다. 소득의 60%가 부채 상환에 쓰이는 겁니다. 주담대 차주 평균DSR은 2019년 1분기에 60%가 넘었습니다. 그러나 2분기 들어 58.9%로 떨어진 뒤 2020년 1분기에는 55.2%까지 하락했습니다. 제로금리 시대가 막을 내리기 전까지는 줄곧 55%대였습니다. 그러다 금리가 인상되자 차주 평균DSR도 오르기 시작했습니다.주담대와 함께 신용대출도 받은 차주의 상황은 더 심각합니다. 한은은 지난 10월 말 기준으로 차주 평균DSR이 70%를 넘겼다고 보고 있습니다. 지난해 12월 65.9% 수준이던 수치는 지난 9월에 69.2%까지 오르며 70%선을 눈앞에 둔 상황이었습니다. 그리고 10월과 11월 금융통화위원회를 거치며 금리는 0.75%포인트 더 올랐습니다.일반적으로DSR이 70%를 넘는 차주는 소득에서 최저 생활비를 제하면 월마다 발생하는 원리금을 제대로 상환하지 못하는 것으로 평가됩니다. 또DSR상승은 연체율 증가로 이어져 금융시장의 위험 요인으로 작용합니다. 하지만 내년에도 금리인상 기조가 유지되고, 주택가격은 하락하고 있어 차주의 이자부담은 더 커질 것으로 보입니다.대출금리가 오르면서 과거 주택담보대출을 받았던 차주(대출받은 사람)의 총부채원리금상환비율(DSR)이 평균 60%를 돌파했다. 금융당국이 갚을 수 있는 만큼 대출을 실행하라는 취지로DSR40% 규제를 시행하고 있으나 급등한 금리로 규제가 무색해진 상황이다. /뉴스1상황이 이렇다보니 부동산 시장의 연착륙을 목표로 하던 정부도 되려 경착륙을 걱정해야 하는 상황입니다. 지난달 수도권 규제지역을 대부분 해제할 때만 해도 서울 및 인접지의 규제완화에는 조심스러운 입장이었지만, 이달 들어 서울 집값이IMF외환위기 때와 견줄 정도로 급락하며 분위기가 바뀌었습니다.지난 주 정부는 ‘2023년 경제정책방향’을 통해 내년 초 수도권에 남은 규제지역 중 일부를 해제하겠다는 방침을 밝힌 바 있습니다. 전문가들은 규제 완화 시 상대적으로 집값 불안 우려가 적고 집값 하락 폭이 큰 경기도 광명·하남과 서울 노원·도봉구를 가장 유력한 곳으로 꼽고 있는데, 강남권인 송파구도 규제지역에서 해제될 후보로 지목하고 있습니다.하지만 침체기에 직면한 시장이 되살아날지는 불투명합니다. 소득의 절반 이상이 부채 상환에 들어가고 있는데다 대출금리는 고공행진 중인데 누가 이 시기에 신규로 집을 매수할 수 있을까요. 인터넷 부동산 커뮤니티를 둘러보면 빠져나가는 월 상환금 때문에 생활이 곤란하다는 글을 어렵지 않게 찾아볼 수 있습니다. 다들 발등에 붙은 불 끄기에도 손이 모자란 상황입니다.숨막히는 이자 부담… 주담대 갚는데 年소득 60% 쏟아붓는다3분기 기준 주택담보대출의 평균DSR(총부채원리금상환비율)이 60.6%로 3년 6개월 만에 다시 60%를 넘어섰다. 주담대 대출자들이 평균적으로 연 소득의 60% 이상을 원리금 상환에 쓰고 있다는 뜻이다.기사보기北무인기, 은평까지 내려와 5시간 농락… 軍, 8년을 대비하고도 1대도 못 잡았다북한 군용 무인기 5대가 26일 서울 북부와 경기도 김포·파주, 인천 강화도 일대 등 우리 영공(領空)을 5시간 동안 침범했다. 우리 군은 전투기와 공격형 헬기를 출격시켜 경고 방송·사격에 이어 격추 작전을 하는 등 대응 조치에 나섰지만 북 무인기를 한 대도 격추하지 못했다.기사보기北, 국지도발 준비 가능성… 연평도 포격 前에도 무인기 띄워 정찰군사 전문가들은 북한이 추가 도발을 위해 김포·강화도와 수도권 지역 사진을 찍으며 정찰 활동을 했을 가능성을 제기하고 있다. 2010년 11월 연평도 포격 도발 전에도 북한은 무인기를 띄워 정찰 활동을 했을 것으로 군 당국은 파악하고 있다. 당시 북한은 우리 군 시설이 북에서 볼 때 산 뒤쪽에 있어 관측이 어려웠는데도 비교적 정확하게 위치를 파악해 포격을 가했다.기사보기내 목소리·사진까지 ‘재산’으로 보호받는다유명인뿐 아니라 일반인도 자신의 이름, 얼굴 사진, 목소리 등을 상업적으로 이용할 수 있는 권리를 신설하는 법 개정이 추진된다. 그동안 이 권리를 별도로 인정하는 법 조항이 없었고 판결도 엇갈려 권리 보호가 미흡하다는 지적이 있었다.기사보기공공기관 정원 1만2442명 감축정부가 내년부터 3년간 공공기관 정원을 1만2000명 정도 줄이기로 했다. 공공기관 정원 감축은 2009년 이후 14년 만이다. 정부는 정원 감축으로 연간 7600억원 수준의 인건비가 절감될 것으로 추산한다.기사보기靑 국정상황실이 ‘통계 빅브러더’였나문재인 정부에서 청와대 국정상황실이 지난해 가장 많은 사전 통계 자료를 받아간 것으로 26일 드러났다. ‘국가통계 조작’ 의혹을 조사하는 감사원은 업무 관련성이 떨어지는 정부 부처의 사전 통계자료 요구 부분을 들여다보고 있는 것으로 알려졌다. 통계 전문가들 사이에서는 “국정상황실이 통계청에서 생산하는 거의 모든 종류의 사전 통계에 접근하는 것은 통계를 사전 감시하는 것과 다름없다”는 지적이 나왔다.기사보기‘뇌 먹는 아메바’ 국내 첫 감염자 사망국내에서 처음으로 일명 ‘뇌 먹는 아메바’로 알려진 파울러자유아메바 감염이 확인됐다. 파울러자유아메바는 감염 시 치명적인 뇌수막염을 일으키는 병원성 높은 원충이다. 전 세계적으로 감염 사례는 드물지만, 일단 감염되면 증상 진행이 빠르고 사망에까지 이르게 한다. 다만 사람 간 전파는 되지 않는 것으로 알려져 있다.기사보기7NEWS뉴스레터 구독하기 ☞https://page.stibee.com/subscriptions/145557"
2022-12-26,숨막히는 이자 부담… 주담대 갚는데 年소득 60% 쏟아붓는다,"주택담보대출이 있는 대출자는 연 소득의 60% 이상을 대출을 갚는 데 쓰고 있는 것으로 조사됐다. 26일 서울 시내의 한 은행 외벽에 걸린 주택담보대출 금리 안내 현수막. /뉴스13분기 기준 주택담보대출의 평균DSR(총부채원리금상환비율)이 60.6%로 3년 6개월 만에 다시 60%를 넘어섰다. 주담대 대출자들이 평균적으로 연 소득의 60% 이상을 원리금 상환에 쓰고 있다는 뜻이다.26일 한국은행에 따르면, 2019년 1분기 60.2%였던 주담대 평균DSR은 2020년 1분기 55.2%까지 떨어졌지만, 한국은행의 기준금리 인상이 시작된 작년 3분기에 57.1%, 4분기 57.8%, 올 1분기 58.7%, 2분기 59.4% 등으로 상승하고 있다.지난 7월부터 주담대나 신용대출 등으로 받은 대출액이 1억원을 넘기면 개인별 연간 원리금 상환액이 연소득의 40%를 넘길 수 없다. 하지만 ‘DSR40%’ 기준으로 대출을 받고 대출액에 변동이 없더라도 대출 금리가 올라 이자 부담이 늘면DSR이 올라갈 수 있다.주담대와 신용대출을 동시에 받은 대출자의DSR은 더 악화됐다. 지난 10월 말 기준으로 70%를 넘어섰다. 주담대·신용대출 동시 보유 대출자의DSR은 작년 12월 65.9%, 올 들어 3월 66.9%, 6월 67.7%, 9월 69.2%로 계속 높아지고 있다.통상DSR이 70%를 넘어가면 소득에서 최저 생계비를 제외했을 때 원리금을 감당하기 어려운 것으로 간주한다. 주담대에 신용대출까지 받았다면 이미 원리금 상환에 어려움을 겪고 있을 가능성이 높다.자영업자들의 대출 이자 부담도 커지고 있다. 이날 한은이 김회재 더불어민주당 의원실에 제출한 ‘자영업자의 대출 금리 상승에 따른 이자 부담 변동 규모’에 따르면, 대출 금리가 1%포인트 오르면 자영업자 이자 부담은 연간 7조4000억원 늘어나는 것으로 추산된다. 자영업자 1인당 이자 부담 증가액은 평균 연간 238만원 늘어난다."
2022-12-19,年 4%대 장기고정금리로 5억까지 주택담보대출,"정책 주택대출 ‘특례 보금자리론’으로 통합, 대출 요건 완화내년에 정부가 세 가지 정책 모기지(주택 담보대출) 상품을 ‘특례 보금자리론’이라는 이름으로 통합해 운영하기로 했다. 1년간 한시적으로 운영하는 특례 보금자리론은 자격 요건을 대폭 완화해 내 집 마련 문턱을 낮췄다는 평가를 받는다. 또한 연 4%대 고정금리로 출시할 예정이라 고금리 시대를 맞아 실수요자들에게 이자 경감 혜택을 줄 것으로 보인다. 현재 변동금리형 주택 담보대출(이하 주담대) 금리는 연 6~7%에 이른다.서울 중구 한국주택금융공사 서울중부지사에서 한 시민이 상담을 받고 있다./뉴스1특례 보금자리론은 변동금리형 주담대를 장기·고정금리형으로 바꿔주는 안심전환대출과 가계 부채 구조 개선을 위해 장기·고정금리로만 원리금을 매달 갚는 데 중점을 둔 적격 대출을 보금자리론에 통합한 방식이다. 보금자리론은 연소득 7000만원 이하인 사람이 6억원 이하 소형 주택을 살 때 이용할 수 있는 정책 상품이다. 그동안 정책 모기지가 세 가지로 시행되다 보니 복잡할 뿐 아니라 대출 금리가 서로 달라 형평성 논란이 끊이지 않았다.지난 6일 금융위원회는 특례 보금자리론의 큰 틀만 공개했지만 벌써부터 뜨거운 관심을 받고 있다. 지금까지 공개된 주요 내용과 앞으로 유심히 지켜봐야 할 포인트를 짚어봤다.◇집값 9억 이하라면 소득 제한 없이 이용 가능특례 보금자리론은 집값이 9억원 이하라면 소득과 관계없이 최대 5억원까지 대출을 받을 수 있다. 현행 보금자리론 주택가격 상한인 6억원을 9억원까지로 높이고, 대출 한도는 3억6000만원에서 5억원으로 확대했다. 부부 합산 소득 7000만원까지였던 소득 기준은 아예 없앴다. 정책 모기지 이용 대상을 크게 늘린 것이다.무엇보다 소득을 따지지 않는다는 점이 파격적이다. 그간 소득 제한 때문에 정책 주담대 대상에서 제외됐던 맞벌이 부부들이 혜택을 볼 것으로 보인다. 주택 가격은 대출 신청일 기준의 시세로 판단한다. 따라서 주택 가격이 하락하는 추세인 점을 고려하면 시세 ‘9억’ 이하인 대상 주택이 내년 중 더 늘어날 수 있다.KB부동산에 따르면 지난달 서울 강북 14구 아파트 매매 평균 가격은 10억642만원, 수도권은 7억8746만원이었다.◇DSR적용 안 한다특히 특례 보금자리론은DSR(소득 중 모든 대출 원리금 상환 비율) 규제를 받지 않아 대출 한도를 늘리는 데 유리하다. 현재 총대출액이 1억원을 초과하면DSR규제가 적용돼 연간 원리금 상환액이 연 소득의 40%를 넘을 수 없는데, 특례 보금자리론은 이런 제한이 없다. 은행 주택 담보대출을 신청했을 때보다 대출 규모를 늘리는 효과를 볼 수 있다.김주현 금융위원장은 지난 15일 윤석열 대통령이 주재한 국정 과제 점검 회의에서 특례 보금자리론을 언급하며 “DSR규제의 적용을 받지 않기 때문에 집을 마련하는 분들이 굉장히 요긴하게 쓸 수 있는 제도”라고 설명했다.LTV(주택 가격 대비 대출금 비율) 기준은 추후 결정될 것으로 보인다.◇기존 정책 모기지 이용자도 갈아타기 가능특례 보금자리론은 통합 모기지 상품인 만큼 새로 집을 사려는 무주택자는 물론 고금리 변동형 주담대를 갖고 있는 1주택자와 전세 보증금을 반환해줄 용도로 주담대를 받으려는 1주택자 모두 이용할 수 있다. 역차별 논란을 피하기 위해 대출 용도와 무관하게 똑같은 금리를 적용한다.기존 보금자리론이나 적격 대출을 이용하고 있는 이들이 특례 보금자리론으로 갈아타는 것도 가능하다. 금리 수준을 지켜봐야겠지만 대출 한도 등 측면에서 특례 보금자리론이 더 유리할 수 있다.◇관건은 금리, 4%대 될 듯금리는 아직 확정되지 않았다. 금융 당국은 내년 보금자리론 적정 금리(6%대)보다 약 1.7~2%포인트 낮은 연 4%대로 맞추려 노력 중이다. 현재 안심전환대출 금리는 3.7~4%, 보금자리론은 4.25~4.55%(인터넷 신청시 0.1%포인트 우대), 적격 대출은 4.55~6.91% 수준이다.당장 오는 20일부터 적용되는 보금자리론 금리가 종전보다 0.5%포인트 올라 연 4.65~5.05% 수준이 된 것에 비춰보면, 특례 보금자리론 금리 역시 4%대 중후반이 될 가능성이 크다. 금융 당국은 예산 확보 상황과 조달 금리, 서민·실수요자 금리 부담 완화 가능성 등을 종합적으로 고려해 막판 조율 중이다.◇중도 상환 수수료 면제될까중도 상환 수수료 면제 여부도 관심이다. 장기 고정금리 대출에 대한 부담을 낮추는 데 효과적이기 때문이다. 정책 흥행을 가를 변수 중 하나로 꼽힌다. 앞서 올해 출시된 우대형 안심전환대출(집값 6억 이하·소득 1억 이하·대출 한도 3억6000만원)은 기존 대출을 갚을 때나 추후 안심전환대출을 조기 상환하고 일반 주담대로 갈아탈 때 모두 중도 상환 수수료를 면제해줬다.반면 기존 보금자리론과 적격 대출은 3년 이내에 중도 상환할 경우 대출 일수에 비례해 0.9%의 수수료를 매겼다. 금융권 관계자는 “고정금리 대환을 촉진하려면 중도 상환 수수료를 면제하는 것이 효과적일 것”이라고 말했다."
2024-09-26,"한은의 고민 “대출금리 0.25%p 낮추면, 서울 집값 0.83%p 더 오른다”","대출금리가 하락하면 사람들이 더 많이 돈을 빌리고, 집값은 더 오르게 될까. 한국은행의 분석은 ‘그렇다’는 것이다.한은은 대출금리가 0.25%포인트 하락하면 1년 이후 전국 주택가격 상승률이 0.43%포인트 더 오른다는 분석이 담긴 금융안정 상황보고서를 26일 발표했다. 한은의 분석에 따르면 같은 경우 서울 지역의 집값은 0.83%포인트 더 상승하게 된다. 금리 인하로 인한 서울 지역 집값 추가 상승률이 전국 평균의 2배에 가깝다는 것이다.한은은 보고서에서 “금리인하기에는 그간 증가해 왔던 부동산 프로젝트파이낸싱(PF) 리스크가 완화하고 취약차주의 연체율 하락과 같은 긍정적인 효과도 있다”면서도 “주택 가격 상승, 가계부채 증가 등 부정적인 영향이 커질 수 있는 점에 유의해야 한다”고 했다. 한은은 2년 전 “대출금리가 1%포인트 하락하면 1년 이후 가계대출 증가율이 0.6%포인트 정도 확대된다”고 분석한 적이 있다. 대출금리가 하락하면 할수록, 가계대출이 늘고 집값 상승폭도 커질 수밖에 없다는 것이다.미국 연방준비제도가 기준금리를 0.5%포인트 인하한데 이어, 한국은행도 10월이나 11월 금융통화위원회에서 기준금리를 인하할 가능성이 높아지고 있는 시점에서 한은이 내놓은 분석이다. 부진한 내수를 고려하면 기준금리를 내려야 하지만, 기준금리 인하가 집값 상승의 불쏘시개로 작용할 수 있다는 한은의 고민이 담겨 있다.25일 서울 남산을 찾은 관광객이 서울 시내 아파트단지를 바라보고 있다. 뉴스1한은은 기준금리 인하로 금융불균형이 심화할 수 있다고 지적했다. 금융불균형(financialimbalance)은 자산가격 상승을 동반한 부채 팽창을 의미한다. 낙관적인 전망으로 무장한 경제주체들이 빚을 늘리면서 자산가격이 상승하는 움직임이 계속되면 금융시스템이 갈수록 취약해지고, 이후 급격한 디레버리징(부채 축소)과 경기회복 지연으로 이어질 수 있다는 것이다. 한은은 2010년 이후 2차례의 기준금리 인하기에 금융불균형 축적 정도를 나타내는 금융취약성지수가 높아졌다고 했다.장용성 한은 금통위원은 “최근 수도권을 중심으로 주택가격 상승세가 지속되고 가계대출 증가세가 이어지면서 금융 불균형 축적 우려가 제기되고 있다”며 “거시건전성 정책 공조를 지속해야 한다”고 했다. 한은은 금리 인하 부작용을 최소화하기 위해 스트레스DSR(총부채원리금상환비율) 제도의 안착을 유도하고, 주택시장 및 가계부채 상황에 따라 언제든지 즉각 대응할 수 있도록 추가 조치를 미리 준비해야 한다고 했다.예를 들어 캐나다의 경우 작년 12월에LTV(집값 대비 대출 한도)를 80%에서 65%로 하향해 빚 규모를 줄이고, 프랑스의 경우 2022년 1월DSR한도를 35%이내로 제한하는 한편 주택담보대출 만기를 최장 25년으로 제한하는 등 각종 조치를 취했다는 것이다. 이런 국가들의GDP대비 가계부채 비율은 2021년을 정점으로 하락하고 있으며, 올해 들어 중앙은행들의 기준금리 인하 영향 등으로 그동안의 하락세가 주춤하지만 2022년 이후와 비교하면 크게 둔화했다고 한은은 소개했다."
2022-10-29,“15억 초과 주담대 규제 풀었다고? 빛좋은 개살구”라는 말 나오는 이유,"“부동산 대출 규제를 푼다지만, 총부채원리금상환비율(DSR) 때문에 빌릴 수 있는 돈은 별로 안 늘어납니다.”28일 오전 온라인 부동산 커뮤니티에서는 전날 정부가 비상경제민생회의에서 발표한 부동산 대출 규제 완화책에 대해 ‘빛 좋은 개살구일 수 있다’는 반응들이 쏟아졌다.무주택자 등의 주택담보대출비율(LTV)을 50%로 상향하고, 투기·투기과열지구 내 15억 초과 아파트의 주택담보대출을 허용하기로 했지만, 1억 이상 대출을 받는 경우 연간 원리금 상환액이 연 소득의 40%를 넘지 못하도록 하는DSR규제가 그대로 남아 있어 소득이 낮은 서민들의 대출 한도는 크게 늘어날 수 없는 구조라는 것이다.그동안 부동산 거래를 막는 ‘대못’으로 불린 두 가지 규제가 풀린다고 해도DSR과 고금리라는 허들을 넘어야 해 당장 주택 수요가 회복되기는 어렵다는 것이다.연봉 높을수록 대출 한도 증가 폭도 커…LTV완화해도DSR40% 걸림돌, 고소득자 아니면 대출에 큰 제약KB국민은행이 비상경제민생회의 부동산 대책에 따른 주택담보대출 한도 변화를 시뮬레이션한 결과, 고소득자일수록 유리한 것으로 나타났다.현행 규제에 따르면 14억원짜리 아파트 구입 시 연봉 7000만원인 대출자나 1억원인 대출자나 똑같이 4억6000만원만 빌릴 수 있지만LTV50% 완화 이후 대출 한도 증가 폭은 2억300만원이나 차이가 났다.14억원 아파트 구입 시 주택 담보대출 변화예컨대, 연봉 7000만원의 무주택자가 규제지역 내 시세 14억원의 아파트를 구입하는 경우 현재는 은행권 최대 주택담보대출(40년 원리금 균등분할상환, 연 4.8%) 한도가 4억6000만원이다. 9억원까지는LTV40%, 9억원 초과분에는 20%를 적용한 결과다. 이 경우 연간 원리금이 2589만원이어서DSR40%(2800만원) 기준도 충족한다.여기서, 정부 발표대로LTV가 50%로 높아지면 대출 한도가 집값의 절반인 7억원까지로 올라가지만,DSR규제를 통과해야 한다. 7억원을 모두 빌리게 되면 연간 원리금 상환액이 3939만원이 되는데, 연봉 7000만원인 대출자는 연간 원리금이 2800만원을 넘으면 안 돼 실제로는 4억9700만원까지만 빌릴 수 있다. 대출 한도가 현행보다 3700만원 정도 늘어나는 셈이다.반면, 연봉 1억원인 대출자는DSR상한이 4000만원이어서LTV한도인 7억원을 다 빌릴 수 있다. 이전보다 대출 한도가 2억4000만원이나 늘어나는 것이다. 즉 소득이 높을수록 규제 완화 효과를 더 많이 볼 수 있다. 연봉이 5000만원인 대출자는DSR규제에 묶여,LTV규제 완화 이후에도 현행과 동일하게 3억5500만원까지만 대출받을 수 있다.같은 조건에서 시세 16억원의 아파트를 구입한다고 가정해도 소득별 대출 한도 편차가 컸다. 현재는 주택 가격이 15억원을 초과하면 소득과 무관하게 은행 주택담보대출이 금지돼 있지만, 앞으로는LTV50%(8억원)·DSR40% 규제를 적용해 대출이 가능해진다.이 경우 연봉 5000만원인 대출자는 3억5500만원까지주택담보대출로 빌릴 수 있는 반면, 연봉 7000만원이면 4억9700만원, 1억 연봉이면 7억원으로 최대 대출 가능 금액이 불어나는 것으로 나타났다. 고소득자가 아니면DSR규제에 걸려 여전히 대출에 큰 제약이 있다.10년 만에 최고로 치솟은 금리도 부담…“대출규제 추가 완화를” 주장 나와금리가 급격히 오르고 있는 것도 주택 실수요자들에게는 부담이다. 한국은행에 따르면 지난달 예금은행이 취급한 신규 가계대출 평균 금리는 연 5.15%로 10년 2개월 만에 가장 높은 수준을 기록했다. 이 중 주택담보대출 금리 역시 연 4.79%로 2012년 5월 이후 10여 년 만에 최고치를 기록했다. 전월 대비 상승 폭(0.44%포인트)도 20년 만에 최대 수준이다.문제는 앞으로 당분간 금리가 더 뛸 수 있다는 점이다. 미국 연준의 금리 인상 기조에 맞춰 한국은행이 연 3.5% 수준까지 기준금리를 올릴 것으로 예상되기 때문에 주택담보대출 금리는 앞으로도 빠르게 오를 전망이다.이미KB국민·신한·하나·우리·NH농협 등 5대 은행의 주택담보대출 변동금리는 연 4.4~6.82%, 고정금리는 연 5.35~7.43% 수준으로 오른 상태다. 연내 주담대 최고금리가 8%에 육박할 것으로 보인다.고종완 한국자산관리연구원장은 “실수요자 위주의 거래는 다소 증가하겠지만, 금리 급등으로 인해서 이번 대출 규제가 시장에 미치는 영향력은 제한적일 것으로 전망된다”고 했다."
