date,title,content
2023-11-06,HD현대사이트솔루션 RE100 가입…건설기계 분야 세계 최초,"2040년까지 달성 목표HD현대건설기계 중국 강소법인 공장에 설치된 4MW급 태양광 패널.HD현대사이트솔루션에이치디(HD)현대사이트솔루션이 건설기계 분야에서는 세계에서 처음으로 아르이(RE)100에 가입했다고 6일 밝혔다. 자회사인 에이치디현대건설기계와 에이치디현대인프라코어도 함께 하기로 했다. 아르이100은 기업이 사용하는 전력 100%를 재생가능에너지로 충당하겠다는 캠페인이다.에이치디현대사이트솔루션과 에이치디현대건설기계, 에이치디현대인프라코어는 2040년까지 전체 필요 전력 100%를 재생에너지로 만든 전력으로 충당하기로 했다. 지난해 선언했던 목표 2045년에서 5년을 앞당긴 목표이다. 단계별로는 2026년 20%, 2030년 60%의 세부 계획을 수립해 추진한다.HD현대사이트솔루션 관계자는 “건설기계 제품군에서는 고객들이 아르이100 인증을 요구하는 경우가 많지 않고, 가입요건이 까다로워 가입 기업들이 그동안 없었던 것으로 보인다. 글로벌 기후위기 해결에 기여하고 지속가능한 가치를 창출하고자 하는 기업 전략에 따라 가입을 선제적으로 결정하게 됐다”고 말했다.에이치디현대사이트솔루션은 국내외 사업장의 에너지 효율화와 태양광 자가발전 구축, 재생에너지 전력구매계약(PPA) 활용 등을 통해 이런 목표를 달성하겠다고 밝혔다. 또 중국과 인도의 에이치디현대건설기계 사업장에는 태양광에너지를 도입했다. 중국법인은 지난해 11월부터 연간 생산작업에 필요한 전력의 절반에 해당하는 3800㎿h를 태양광으로 조달하고 있고, 인도법인은 9월부터 인근 유휴 부지에 태양광 발전 시설과 에너지 관리 시스템을 구축해 인도 생산공장 연간 전력 소모량의 70%를 공급받고 있다.조영철 에이치디현대사이트솔루션 대표이사는 “탄소중립과 친환경 재생에너지로의 전환은 기업 생존을 위한 필수 전략”이라며 “지속가능한 미래를 열도록 노력하겠다”고 말했다."
2023-11-13,HD현대 전동화센터 문 연다…“새로운 50년 이끌 비전”,"HD현대가 경기도 성남시HD현대 글로벌R&D센터(GRC)에서 ‘전동화센터’ 개소식을 가졌다. (오른쪽 다섯번째부터 왼쪽으로 정기선HD현대 부회장, 설승기 전동화센터 기술자문위원).HD현대 제공정기선 에이치디(HD)현대 부회장의 첫 행보는 ‘전동화 강화’다. 에이치디현대는 그룹 내 계열사별로 운영하던 전동화 연구조직을 전동화센터로 통합해 미래 역량 강화에 나선다.에이치디현대는 경기도 성남시 에이치디현대 글로벌알앤디센터(GRC)에서 전동화센터 개소식을 열었다고 13일 밝혔다. 그동안 에이치디한국조선해양의 전기제어연구실, 에이치디현대사이트솔루션의 전력전자개발팀, 에이치디현대일렉트릭의 전력시스템연구실이 에이치디한국조선해양 미래기술연구원 내 직속센터의 전동화센터로 통합된다. 설승기 서울대 전기정보공학부 교수가 전동화센터의 기술자문위원으로 위촉됐다.정기선 에이치디현대 부회장은 “그룹의 새로운 50년을 이끌어나갈 비전을 실현하기 위해서는 전동화 역량 확보가 필수적”이라며 “전동화 기술 개발과 연구 인력 확보로 에이치디현대의 전동화센터가 세계 최고 수준의 전동화센터로 거듭날 것을 기대한다”고 밝혔다. 정 부회장은 현대중공업에 대리로 입사한 지 14년 만인 지난 10일 부회장으로 선임됐다.에이치디현대는 전동화센터를 통해 무탄소 전기추진 선박과 굴착기 개발 등 핵심 사업의 차별화된 기술 우위를 확보해나간다는 목표이다. 이를 위해 조선해양, 건설기계 분야의 전동화 선행 기술과 핵심 부품 개발을 중심으로 연구를 진행해 핵심사업 전동화에 속도를 낸다는 계획이다.에이치디현대는 지난해 12월 그룹의 새 비전으로 ‘전동화, 자율화 기술과 디지털 플랫폼 기반 해양 모빌리티와 친환경 에너지 산업을 선도하겠다’는 포부를 밝힌 바 있다."
2023-11-10,"‘정몽준 아들’ 정기선 HD현대 사장, 부회장으로 승진","정기선HD현대 신임 부회장.HD현대 제공에이치디(HD)현대(옛 현대중공업) 총수 일가 3세인 정기선(41) 에이치디현대 사장이 부회장으로 승진했다. 정기선 사장은 정몽준 아산재단 이사장의 아들이다.에이치디현대는 10일 정기선 부회장 승진 등 그룹 사장단 인사를 단행했다고 밝혔다. 정 부회장은 2021년 10월 사장에 오른 지 2년 1개월 만에 승진했다. 에이치디현대는 “정기선 부회장은 세계 조선경기 불황으로 전사적 어려움에 처한 상황에서 회사의 체질개선과 위기 극복에 앞장섰으며, 선박영업과 미래기술연구원에 근무하면서 회사 생존을 위한 일감 확보와 기술개발을 통한 미래 준비에도 온 힘을 쏟았다”고 승진 이유를 설명했다.앞서 정 부회장은 2009년 현대중공업에 대리로 입사했다가 유학을 다녀와 2013년 현대중공업 경영기획팀 수석부장으로 회사에 복귀했다. 2015년 현대중공업 기획실 부실장, 2018년 현대중공업지주 경영지원실장, 사장을 거쳐 이날 부회장으로 선임됐다.이로써 2018년부터 한국조선해양 대표를 맡았던 가삼현 부회장과 현대중공업 대표를 맡았던 한영석 부회장은 올해 말까지 기존 업무를 마무리짓고 내년부터는 자문역으로 물러날 예정이다. 권오갑 에이치디현대 회장과 정 신임 부회장 체제로 새 최고경영진을 꾸린 셈이다.이날 인사에서는 에이치디현대인프라코어 오승현(58) 대표이사 부사장과 에이치디현대중공업 강영(58) 부사장이 각각 사장으로 승진했다. 강영 신임 사장은 현재 기업결합이 진행 중인 에스티엑스(STX)중공업의 인수 추진 태스크포스(TF)를 맡을 예정이다. 또 에이치디한국조선해양 김성준 부사장, 에이치디현대로보틱스 김완수 부사장, 에이치디현대케미칼 고영규 부사장이 각각 새 대표이사로 내정됐다.에이치디현대중공업 노진율 사장은 공동대표이사로서 안전 경영 및 동반성장을 담당한다. 이들 내정자는 향후 이사회와 주총을 거쳐 대표이사에 선임될 예정이다. 에이치디현대는 사장단 인사에 이어 조만간 후속 임원인사를 단행할 예정이다."
2023-11-08,HD현대인프라코어 ‘15층 높이 철거’ 굴착기 첫선,"고층 철거용 굴착기.HD현대인프라코어 제공에이치디(HD)현대인프라코어가 건물 15층 높이인 46ｍ에서 작업이 가능한 고층 철거용 굴착기를 8일 공개했다.현대인프라코어는 이날 국내 첫 130t급 철거용 굴착기 1호기를 아파트 현장에 납품했다고 밝혔다. 굴착기의 팔 역할을 하는 붐(boom)과 암(arm) 등 프론트 옵션 5개를 갖췄다. 이들 옵션은 작업공간의 높이와 용도에 따라 탈부착이 가능하다.현대인프라코어는 2019년 64t급 철거용 굴착기 출시를 시작으로 철거용 특수장비 시장에 진출했다. 이후 46t급, 120t급 제품을 선보였지만 130t급을 출시한 것은 처음이다. 회사 쪽은 “기존에는 중소형 굴착기를 건물 옥상에 올려 위에서부터 철거하는 방식이 사용됐지만, 철거용 붐과 암이 적용된 굴착기가 등장하면서 안전성이 높아졌고 장비도 대형화하고 있다”고 설명했다."
2023-09-12,"HD현대오일뱅크, 23년 만에 주유소 디자인 바꾼다","경기도 성남시 분당구에 위치한 지알시(GRC·에이치디현대그룹 사옥) 주유소 전경. 에이치디(HD)현대오일뱅크 제공.에이치디(HD)현대오일뱅크 주유소가 23년 만에 주유소 외부 디자인을 전면 교체한다.에이치디현대오일뱅크는 12일 로고 교체를 포함해 주유소의 전반적인 디자인을 전면적으로 바꾼다고 밝혔다.현대오일뱅크 관계자는 “에이치디현대오일뱅크 주유소의 상징색인 파란색에 에이치디(HD)현대의 상징색인 녹색을 더했다”며 “그룹의 상징인 포워드마크의 모양을 모티브로 앞으로 나아가려는 의지를 담았다”고 밝혔다.주유소의 ‘셀프(SELF)’ 표시, ‘엘피지(LPG)’ 로고, 서체도 바꿨다. 간판(폴사인), 기둥, 상호간판, 방화벽, 주유기에도 새로운 디자인을 입혔다.현대오일뱅크는 성남시 분당구에 있는 지알시(GRC·에이치디현대그룹 사옥) 주유소에 이같은 디자인을 처음 선보였다. 새 디자인은 전국 2700여개 현대오일뱅크 주유소와 충전소에 순차적으로 적용될 예정이다.지난해 12월 에이치디현대오일뱅크를 계열사로 두고 있는 현대중공업 그룹은 20년 만에 에이치디(HD)현대로 그룹명을 바꾸고 기업 이미지(CI)도 교체했다. 새 기업 이미지는 이전의 녹색 삼각형이 화살표 형태로 변화한 모습으로 ‘포워드마크’라 명명됐다. 이에 따라 올해 3월 현대오일뱅크도 에이치디현대오일뱅크로 사명을 바꿨다. 현대오일뱅크 관계자는 “직영, 자영 주유소 모두 디자인이 교체될 예정이고 관련 비용은 모두 에이치디현대오일뱅크가 부담한다”고 설명했다."
2023-10-16,‘경쟁 조선소 인력 유인·채용’ 제소 당한 HD현대…이직자만 400여명,"삼성중·한화오션 등서 2년반 동안 415명 이직공정위 11개월째 조사…“신속히 결과 내놔야”에이치디(HD)현대중공업의 초대형 암모니아 운반선 조감도. 에이치디현대중공업 제공.‘부당 인력 유인’ 혐의로 신고된 에이치디(HD)현대로 이직한 경쟁사 인력이 지난 2년 반 동안 400여명에 이르는 것으로 나타났다. 앞서 경쟁 업체들은 ‘인력을 부당하게 유인해 채용하고 있다’는 이유로 에이치디현대를 공정거래위원회에 제소한 바 있다.16일 국회 정무위원회 강민국 국민의힘 의원이 공정위에서 제출받은 ‘조선사 동종업계 이직현황’을 보면, 2021년부터 지난 5월까지 에이치디현대 소속 조선 3사(현대중공업·현대미포조선·현대삼호중공업)로 유입된 경력직은 415명이었다.회사별로는 삼성중공업 출신이 180명으로 가장 많았고, 한화오션(옛 대우조선해양)이 179명으로 비슷한 수준이었다. 이어 케이(K)조선과 대한조선이 각각 33명, 23명으로 뒤를 이었다. 이직자 대다수는 경력 10년 안팎의 실무자인 것으로 알려졌다.독점규제 및 공정거래에 관한 법률(공정거래법)은 경쟁사의 인력을 부당하게 유인·채용해 경쟁사의 사업활동을 방해하는 행위를 금지하고 있다. 이를 근거로 삼성중공업과 한화오션, 케이조선, 대한조선 등 4개 회사는 지난해 8월 ‘자사 인력을 부당하게 빼앗겼다’며 에이치디현대를 공정위에 신고했다.반면 에이치디현대는 경력직 채용은 정당한 절차로 진행했다고 맞섰다. 에이치디현대 관계자는 이날 ""부당 인력 유인은 사실이 아니고, 공정위에 신고서를 제출한 회사 상당수가 최근 신고를 철회한 것으로 알고 있다""고 말했다.공정위는 지난해 11월 조사에 들어갔지만, 지금까지 결과가 나오지 않은 상황이다. 강 의원은 “조선 인력이 부족한 상황에서 경쟁사가 키운 우수 인재를 빼가는 행위는 조선업 경기에 찬물을 끼얹을 수 있다. 공정위는 대형 조선사의 부당인력 유인행위를 신속히 조사해야 한다”고 말했다."
2023-09-07,HD현대 올해 수주 목표 달성…한화오션은 “선별 수주”,"한국조선해양, 초대형 암모니아 운반선 4척·6천억 원 수주에이치디(HD)현대중공업의 초대형 암모니아 운반선 조감도. 에이치디현대중공업 제공.에이치디(HD)한국조선해양이 초대형 암모니아 운반선 4척을 수주하면서 에이치디현대가 올해 수주 목표치를 초과 달성했다.에이치디(HD)현대의 조선중간지주사인 에이치디한국조선해양은 싱가포르에서 개최된 ‘가스텍 2023’ 행사에서 선주사 싱가포르 이피에스(EPS)사, 그리스 캐피탈(CAPITAL)사와 8만8000입방미터(㎥)급 암모니아 운반선 4척에 대한 건조계약을 체결했다고 7일 밝혔다. 모두 합해 6168억원 규모다.수주한 선박은 울산 에이치디현대중공업에서 건조해 2027년 하반기부터 순차적으로 두 선주사에 인도할 예정이다. 에이치디현대중공업은 “이번 계약에는 옵션 2척이 포함돼 추가 수주도 기대할 수 있다”고 말했다.에이치디현대 조선 계열사들은 이번 계약을 포함해 올해 현재까지 모두 122척, 159억4천만달러 규모를 수주한 상태다. 이는 올해 세워둔 연간 수주 목표량(157억4천만달러)를 초과 달성(101.3%)한 것으로, 3년 연속 수주 목표를 조기 달성한 것이기도 하다. 계열사별로 에이치디현대중공업은 71.8%, 현대미포조선은 89.5%, 현대삼호중공업은 225%의 수주 목표 달성률을 보였다.에이치디현대 쪽은 “메탄올, 엘엔지(LNG) 등 친환경 선박 수주 호조세에 힘입어 수주 목표를 달성할 수 있었다. 향후 고부가가치 선박 위주 선별수주를 이어가 수익성 제고에 힘쓸 계획”이라고 말했다.반면, 국내 다른 두 조선사는 아직 수주 목표를 달성하지 못한 상태다. 삼성중공업은 63억달러 규모를 수주해 목표(95억달러)의 66%를 달성했다. 한화오션(옛 대우조선해양)의 목표 달성률은 그보다 더 저조하다. 한화오션은 14억7천만달러를 수주해 목표(69억8천만달러) 대비 21%를 달성했다.이에 대해 한화오션 관계자는 “고부가가치 선박 위주로 선별 수주를 하자는 전략에 따른 것이다. 현재도 3년 반 정도의 수주 잔량이 쌓여있다”며 “울산급 배치(Batch)-Ⅲ 호위함 5·6번함 건조 사업 우선협상대상자로 선정된 성과 등은 아직 반영되지 않았다”고 설명했다. 김동관 한화 부회장은 지난 5일 폴란드에서 열린 국제방위산업전시회(MSPO2023)을 들러 안제이 두다 폴란드 대통령을 만난 뒤 7일 ‘가스텍 2023’을 찾아 각국 에너지 기업과 사업 협력을 논의했다."
2023-10-03,총수일가 지분 3.6%로 그룹 지배…두나무·HD현대는 0.5%도 안돼,"2023년 기업집단 주식소유현황 분석공정위가 2023년 공시대상기업집단의 주식소유현황을 분석한 결과 두나무(0.21%), 에이치디(HD)현대(옛 현대중공업그룹·0.47%), 카카오(0.51%), 에스케이(SK·0.51%) 순으로 총수일가 지분율이 낮았다. 클립아트코리아평균 3%대 지분으로 재벌총수 일가가 그룹 전체를 지배하는 구조가 여전한 것으로 나타났다. 국외 계열사 등을 통해 우회 지배력을 유지하는 사례도 계속되고 있다.공정거래위원회가 3일 발표한 2023년 공시대상기업집단 82곳의 주식소유현황 분석자료를 보면, 전체 공시대상기업집단의 평균 내부지분율은 61.7%로 집계됐다. 1년 전(76곳·60.4%)과 비교해 1.3%포인트 높아졌다. 내부지분율은 계열사 전체자본금 가운데 회사의 실질 주인인 총수(동일인)나 그와 관련된 친족·임원·계열사·비영리법인 등 이해관계인이 보유한 주식가액의 비중이다.전체 공시기업집단 중 총수가 있는 기업집단(72곳)의 평균 내부지분율은 61.2%로, 계열사 지분(53.3%)이 대부분을 차지했다. 총수일가 평균 지분율은 3.6%로 지난해보다 0.1%포인트 줄었다. 총수(동일인)와 친족 지분율이 각각 1.7%, 1.9%였다.2011년 이후 4%대를 유지하던 총수일가 지분율은 2019년부터 3%대로 내려왔다. 두나무(0.21%), 에이치디(HD)현대(옛 현대중공업그룹·0.47%), 카카오(0.51%), 에스케이(SK·0.51%) 순으로 총수일가 지분율이 낮았다.공익법인이나 국외 계열사를 활용해 지배력을 확대하는 경우도 늘고 있다. 총수가 있는 기업집단의 공익법인과 국외계열사가 출자한 국내 계열사는 각각 138곳, 84곳으로 전년 대비 6곳, 18곳이 늘었다. 금융·보험사가 출자한 비금융계열사는 66곳으로 지난해와 동일했다.총수 일가 보유지분이 20% 이상이거나 그 회사가 50%를 넘는 지분을 보유해 사익편취 규제대상으로 지정된 회사는 지난해보다 65곳 늘어난 900곳이다. 올해 새로 지정된 기업집단에서 규제대상 회사(107곳)가 대폭 늘어난 탓이다. 사익편취 규제대상 회사의 총수일가 평균 지분율은 16.97%로, 지난해(16.5%)보다 0.47%포인트 증가했다.홍형주 공정위 기업집단관리과장은 “총수일가가 적은 지분으로 기업집단 전체를 지배하는 구조가 지속되고 있고 국외계열사와 공익법인 등을 통한 우회적인 지배력 유지·강화 사례도 파악됐다”며 “기업집단의 편법적 지배력 확대 등에 대해 면밀히 모니터링할 계획”이라고 밝혔다."
2023-07-16,"HD현대, 수해 복구 장비·인력 지원… 성금 5억원 기부","소방당국은 16일 실종자 9명이 발생한 예천군에 소방인력 650여명, 군·경 400여명 등 인력 1000여명을 투입하고, 인명구조견 10두와 드론 5대도 동원해 수색 중이다. 경북소방본부 제공에이치디(HD)현대가 전국 각지에서 발생한 수해 복구를 지원하기 위해 성금 5억원을 기탁했다.에이치디(HD)현대1%나눔재단은 전국재해구호협회에 성금 5억원을 기탁한다고 16일 밝혔다. 에이치디(HD)현대건설기계와 에이치디(HD)현대인프라코어는 집중호우 피해지역의 복구를 돕기 위해 각각 10대씩 모두 20대의 굴착기와 인력을 지원하기로 했다.에이치디현대는 “이번 성금 기탁과 구호장비 지원은 이달 들어 계속되고 있는 폭우로 인해 주택 침수와 산사태가 이어지며 다수의 사상자와 이재민이 발생하는 등 피해가 커지는 데 따른 것”이라고 설명했다. 에이치디현대1%나눔재단 권오갑 이사장은 “임직원들의 급여 1%를 모아 마련한 성금이 어려움을 겪고 있는 분들에게 힘이 됐으면 한다”고 밝혔다.중앙재난안전대책본부(중대본)에 따르면 지난 9일부터 15일 오후 11시까지 호우 사망·실종자는 모두 36명으로 집계됐다. 이중 사망자는 산사태 피해가 컸던 경북 17명을 비롯해 충남 4명, 충북 4명, 세종 1명 등 26명이다. 중대본의 집계에는 충북 청주시 오송읍 지하차도 차량 침수사고 피해자 등은 포함되지 않았다. 이 사고로 현재까지 숨진 채 발견된 희생자는 7명이다."
2023-08-14,"HD현대중공업, 차기 호위함 입찰 ‘감점 탈락’ 가처분 신청","지난달 한화오션 선정에 반발…고충민원도 신청지난 6월7일 부산 해운대구 벡스코에서 열린 ‘2023 부산국제조선해양대제전'에서 참석자들이HD현대중공업이 개발 중인 차세대한국형 구축함(KDDX)과 한국형 항공모함, 무기체계 등을 살펴보고 있다. 연합뉴스에이치디(HD)현대중공업이 14일 방위사업청을 상대로 호위함 5·6번함 관련 ‘우선협상대상자 지위 확인 등을 위한 가처분 신청’을 서울중앙지방법원에 제기했다. 앞서 에이치디현대중공업은 기술점수에서 앞섰으나 함정 연구개발 자료 불법 촬영으로 인한 보안사고 감점을 적용 받아 호위함 5·6번함 수주에 실패했으나, 2년 사이 감점 규정이 3번 개정되며 입찰 경쟁에서 배제당했다며 가처분 신청으로 효력 정지에 나선 것이다. 국민권익위원회에 고충민원도 신청했다.지난달 방위사업청은 호위함 5·6번함 건조를 위한 우선협상대상자로 한화오션을 선정했다. 입찰에서 에이치디현대중공업은 기술점수에서는 한화오션을 앞섰으나, 2013년 함정 연구개발 자료를 불법으로 촬영하다 2020년 9월 유죄 판정을 받은 보안 사고를 이유로 감점(1.8점)을 받았다. 에이치디현대중공업은 방사청에 ‘기술경쟁에 근간을 둔 보안사고 감점 규정에 대한 재검토’를 요청하며 이의 제기를 신청했다. 그러나 지난 9일 ‘이상없음’ 답변을 받자 가처분 신청으로 맞섰다. 보안사고 감점 규정 관련 지침이 지난 2년여 사이 3차례나 개정되면서 입찰에서 배제되고 있다는 이유에서다.에이치디현대중공업은 이날 “직원 9명이 기소된 뒤 6개월 만인 2021년 2차 개정이 이뤄졌다. 또 9개월 뒤 ‘기소 후 1년간’ 적용되던 감점 규정이 ‘기소 후 3년’으로 연장되는 3차 개정이 이뤄졌다. 또 1년 뒤 ‘형 확정 후 3년’으로 수정돼 에이치디현대중공업에만 소급 적용됐다”면서 “현재 항소심이 진행 중이어서 ‘형 확정 후 3년’ 감점 규정을 적용할 경우 이 감점이 언제 끝날지 그 시기조차 가늠할 수 없다. 제도가 합리적으로 개정돼 공정 경쟁의 토대가 만들어지길 기대한다”고 밝혔다.2018년 3월 국민권익위원회와 민관합동 규제개선추진단은 ‘감점 기준이 지나치게 큰 비중을 차지해 기술 중심의 제안서평가 원칙에 어긋난다’며 방사청에 제도개선을 권고했다. 이후 2019년 9월 1차 개정이 이뤄졌다. 이후 2021년 3월과 같은 해 12월, 지난해 12월 2~4차 추가 개정되면서 최종적으로 ‘형 확정 후 3년’이라는 단서조항이 추가됐다."
2023-06-25,"HD현대, 사우디에 선박용 엔진공장 짓는다","중형엔진 ‘힘센엔진’ 첫 국외생산에이치디(HD)한국조선해양이 공동 투자해 사우디아라비아 라스 알 헤어에 건설하는 ‘마킨(MAKEEN)’ 엔진공장 조감도. 에이치디(HD)한국조선해양 제공에이치디(HD)현대가 사우디아라비아에 선박용 엔진공장을 짓는다.25일 에이치디(HD)현대의 조선 중간지주사 에이치디(HD)한국조선해양에 따르면, 이 업체가 사우디아람코 개발회사 및 사우디산업투자공사 두수르와 공동 투자해 2020년 설립한 엔진합작사 ‘마킨’이 사우디아라비아 라스 알 헤어에서 엔진공장 착공식을 했다.합작 엔진공장은 사우디아라비아 동부 주베일 인근 라스 알 헤어 지역의 킹살만 조선산업단지 내에 15만㎡(4만5천평) 규모로 지어진다. 마킨은 2025년 4분기부터 엔진 생산에 착수하게 되는데, 연간 최대 생산 능력은 선박용 대형엔진 30대, 중형엔진 235대, 선박용 펌프 160대로 추산된다.에이치디(HD)현대중공업이 독자 개발해 원천기술을 보유하고 있는 중형엔진 ‘힘센엔진’을 국외에서 생산하는 것은 이번이 처음이다. 힘센엔진은 중남미, 중동, 아시아 등 40여개국에 수출되고 있다. 선박용 중형엔진(발전) 분야 세계시장 점유율 40% 이상으로 1위를 차지하고 있다.에이치디(HD)한국조선해양은 “킹살만 조선산업단지에 에이치디(HD)한국조선해양과 사우디아람코개발회사, 사우디 국영 해운사인 바흐리 등이 합작해 건설 중인 아이엠아이(IMI·InternationalMaritimeIndustries) 조선소도 위치해 있어 시너지 효과가 기대된다”고 덧붙였다. 아이엠아이 조선소는 500만㎡ 규모의 중동지역 최대 조선소로 올해 말 준공을 목표로 하고 있다."
