date,title,content
2022-07-29,"현대중공업그룹 지주 HD현대, 매출과 영업이익 150%·570%씩 늘었다","사상 최대 실적 현대오일뱅크 영향HD현대현대중공업그룹 지주사인HD현대는 2분기 매출 15조7540억원, 영업이익 1조2359억원을 기록했다고 29일 밝혔다. 지난해 같은 기간보다 각각 149%, 570%씩 증가한 것이다. 지난해 2분기에는 후판가 인상으로 조선 계열사들이 조(兆) 가까운 적자를 기록했는데 올해는 실적이 좋아졌고, 정유부문의 매출과 수익성이 크게 향상된 덕분이다.HD현대측은 “인플레이션과 금리 인상, 러시아-우크라이나 전쟁의 장기화 등 글로벌 경기침체 위기에서도 주요 자회사들의 견고한 실적을 바탕으로 지난 분기 대비로도 매출은 39.5%, 영업이익은 53.5% 증가했다”고 밝혔다.주요 계열사 별로 살펴보면, 현대오일뱅크는 정제마진 개선과 유가 상승에 따른 재고평가 이익 등으로 매출 8조 8008억 원, 영업이익 1조 3703억 원을 기록했다. 지난해 같은 기간 대비 각각 78%, 415%씩 늘어난 것이다. 매출과 영업이익 모두 현대오일뱅크 창사 이래 분기 기준 역대 최대 규모다. 현대오일뱅크측은 “세계 각국의 대(對)러시아 제재에 따른 공급차질과 성수기 수요 증가로 정제마진이 개선되면서 최대 실적을 올렸다”고 밝혔다.건설기계부문인 현대제뉴인은 중국 봉쇄 등의 영향에도 불구하고 다양한 제품 라인업을 바탕으로 유럽, 북미 등 선진시장과 동남아 등 신흥시장을 공략하며 매출 2조 1167억원, 영업이익 1122억원의 실적을 기록했다.현대일렉트릭은 중동 시장 내 수주 확대와 선박용 제품 판매 증가에 힘입어 매출 5401억원, 영업이익 272억원을 기록했다. 이는 각각 전 분기 대비 53.5%, 62.9% 증가한 수치다.현대글로벌서비스도 친환경 선박 리트로핏과 선박 부품서비스 수주 호조에 힘입어 매출 3830억원, 영업이익 348억원의 실적을 기록했다. 현대로보틱스도 43억 원의 영업이익으로 흑자 전환에 성공했다.한국조선해양도 2분기 매출 4조 1886억 원, 영업손실 2651억 원의 실적을 발표했다. 매출은 선박 건조물량이 늘어나면서 전 분기 대비 7.2% 증가했으나, 영업이익은 강재가 상승을 비롯한 일회성 요인으로 전 분기에 이어 적자를 기록했다.현대중공업그룹 관계자는 “하반기 조선 부문에서 고부가가치선 건조 비중 증가에 따른 큰 폭의 실적 개선이 예상되고, 석유화학 사업의 본격적인 매출 및 순익 증대가 기대된다”며 “친환경 기술 개발과 시장 특성에 맞는 영업전략으로 견조한 실적을 이어갈 수 있도록 최선을 다할 것”이라고 말했다."
2024-04-19,대산공장서 바이오디젤 생산… HD현대오일뱅크 年 13만t,"HD현대오일뱅크 바이오 디젤 공장 전경./HD현대오일뱅크HD현대오일뱅크는 18일 충남 서산시 대산 공장 내에 연산 13만t 규모 바이오 디젤 전용 공장을 준공하고, 동·식물성 기름 등을 원료로 바이오 디젤 생산을 시작한다고 밝혔다.HD현대오일뱅크는 안정적 원료 공급망 확보를 위해 롯데웰푸드와 협력해 폐자원 순환 경제에도 동참한다. 롯데웰푸드에서 폐식용유 등 원료를 공급받아 이를 기반으로 바이오 디젤 제품을 생산한 뒤 롯데그룹 계열사 운송용 트럭 등에 다시 공급하는 방식이다."
2024-04-18,"HD현대, 유럽 해상풍력 시장 진출","HD현대중공업은 스코틀랜드 경제개발기구와 부유식 해상풍력 사업 협력을 위한 양해각서(MOU)를 체결하고 유럽 해상풍력 시장에 진출한다고 17일 밝혔다.해상풍력 구조물은 거친 해양 환경을 고려한 설계·제작이 필요해 해양 플랜트 제작 경험이 있는 조선사에 강점이 있다. 기존 조선소에서 신규 설비 투자 없이 바로 대형 구조물을 제작할 수 있어 사업을 다각화할 수 있는 블루오션으로 주목받고 있다.스코틀랜드 정부 산하 경제개발기구인 스코틀랜드 엔터프라이즈(SE), 하이랜드&아일랜드 엔터프라이즈(HIE)가 현지 재정 지원 방안을 모색하고,HD현대중공업은 부유식 해상 구조물 설계 및 제작 노하우를 공유하며 공급망 최적화 방안 등을 지원한다."
2024-03-21,"HD현대건설기계, 수단에 장비 60대 공급","아프리카 시장 100조원 전망에티오피아 등 판매 거점 넓혀HD현대건설기계는 아프리카 수단에서 34t(톤) 대형 굴착기 6대, 22t 중형 굴착기 36대 등 건설장비 60대 공급 계약을 체결했다고 20일 밝혔다. 회사 측은 “수단 내전으로 중단된 건설기계 무역이 지난해 재개된 뒤,HD현대건설기계가 글로벌 브랜드 중에서 가장 먼저 수단 시장에 재진입해 따낸 계약”이라고 했다.글로벌 리서치기관 ‘모도르 인텔리전스’에 따르면, 아프리카는 건설 시장이 올해 연 약 584억달러(약 78조원)에서 2029년 약 748억달러(약 100조원) 규모로 커질 것으로 전망된다.HD현대건설기계는 서아프리카 7국에 주변국 판매까지 담당할 광역 딜러를 지정했을 뿐 아니라 동아프리카 남수단, 에티오피아에서 신규 딜러 계약을 체결하는 등 판매 거점을 확대하고 있다."
2024-03-12,HD현대·네이버 ‘AI 동맹’… 선박 최적 경로 탐색 활용,"HD현대가 네이버와 손잡고 2억건 넘는 조선·해양 데이터베이스(DB)를 활용한 생성형AI(인공지능) 서비스 구축에 나선다.AI의 딥러닝(심층 학습) 등을 통해 최적 운항 경로 탐색, 탄소 저감 설루션(Solution) 등을 확대한다는 계획이다.HD현대와 네이버는 11일 세종시에 있는 네이버의 제2데이터센터 ‘각 세종’에서 ‘클라우드 전환 및AI사업화 추진’에 관한 업무 협약을 체결했다. 양 사는 우선HD현대가 보유한 2억건 이상 조선·해양DB에 네이버의 거대 언어 모델(LLM)AI‘하이퍼클로바X’를 적용해 생성형AI서비스를 구축해 활용하기로 했다.LLM은 문서와 그림 등 다양한 데이터에서 특정 의미와 패턴을 추출할 수 있는AI다. 조선·해양 사업에선 기존 선박 운항 경로를 학습해 날씨, 운항 경로 등 변수를 조합해 최적 경로를 탐색할 수 있고, 조선소 작업 현장 정보를 디지털 데이터로 가시화한 가상 ‘스마트 조선소’ 구축에도 활용할 수 있다.양 사는 또HD현대의 클라우드(가상 서버) 인프라 고도화,HD현대마린솔루션의 해양 디지털 애플리케이션 사업도 공동 추진하기로 했다. 정기선HD현대 부회장은 “네이버의 안정적인 클라우드 인프라와 검증된AI기술이HD현대의 미래 비전인 ‘오션 트랜스포메이션’을 앞당기는 촉매제가 될 것”이라고 했다."
2024-03-14,"‘우리 기술’ 차세대 이지스함, HD현대중공업 2번함 건조","지난 12일 울산 본사서 기공식1번함은 올 하반기 해군에 인도HD현대중공업은 지난 12일 울산 본사 특수선 야드(선박 건조장)에서 ‘정조대왕급(8200t) 차세대 이지스 구축함 2번함’ 기공식을 열었다고 13일 밝혔다. 구축함은 현대 해군에서 독자적으로 작전을 수행할 수 있는 군함으로 대함·대잠·방공 등 다용도로 사용된다. 이지스는 그리스 신화에서 제우스가 입고 있던 갑옷인 ‘이지스(aegis)’에서 유래한, 미 해군이 개발한 최신예 해상 전투 체계를 뜻한다.HD현대중공업이 건조해 2024년 말 해군에 인도 예정인 차세대 이지스 구축함(KDX-IIIBatch-II) 1번함 '정조대왕함'의 시운전 모습./HD현대 제공해군은 정조대왕급(8200t) 차세대 이지스 구축함 3척 도입을 진행 중인데, 모두HD현대중공업이 건조를 맡았다. 선도함(1번함)인 정조대왕함은 올해 하반기 해군 인도를 앞두고 시험 평가가 진행 중이다. 3번함은 올해 말 착공한다.현재 해군이 3척 운영 중인 국내 최초 이지스 구축함인 세종대왕급(7600t)보다 600t가량 커졌고 해군 이지스함 중 탄도미사일 요격 능력을 처음으로 갖췄다. 대잠수함 탐지 능력도 첨단 통합 소나(음파 탐지) 체계 등을 통해 3배가량 강화된다. 세종대왕급, 정조대왕급 이지스 구축함 모두 국내 기술로 독자 설계·건조했거나 진행 중이다.HD현대중공업 관계자는 “탄도미사일 탐지, 추적, 요격을 포함해 다양한 위협에 대응할 수 있어 한국형 미사일 방어 체계(KAMD)의 핵심 해상 전력이 될 것”이라고 밝혔다."
2024-03-08,"HD현대重, 동남아 공략… 필리핀에 기술사무소 열어","HD현대중공업은 필리핀에 해외 첫 특수선 사업 기술 사무소(엔지니어링 오피스)를 열고, 2030년 100억달러(약 13조 3000억원) 규모로 전망되는 동남아 함정(艦艇) 시장 공략을 강화한다고 7일 밝혔다.HD현대중공업은 지난 6일 필리핀 마닐라 보니파시오에 특수선 기술 사무소를 열었다. 특수선 사업과 관련해 해외에 부품 센터 등을 조성한 적은 있지만, 기술 지원 인프라 구축은 처음이다. 앞으로 특수선 사업부 소속 설계 엔지니어,MRO(유지·보수·운영), 영업 담당 직원들을 파견해 동남아 현지 수요에 최적화한 기술 지원 및 컨설팅을 제공한다는 계획이다.앞서HD현대중공업은 필리핀 정부가 해군 현대화와 전력 증강을 위해 추진한 ‘호라이즌’ 사업에서 호위함 2척(2016년), 초계함 2척(2021년), 원해경비함(OPV) 6척(2022년) 등 총 10척의 함정을 수주한 바 있다. 태평양과 아시아 관문에 있는 필리핀은 해군력 증강 수요가 크고, 태국·베트남 등 동남아 국가도 잠재 수요가 풍부한 지역으로 평가받는다.영국 군사정보 기업 제인스는 동남아 국가들의 해양 방산 지출 규모가 작년 80억달러에서 2030년 100억달러로 증가할 것으로 전망했다.HD현대중공업 주원호 특수선 사업부 대표는 “필리핀 특수선 엔지니어링 오피스는 동남아를 시작으로 글로벌 특수선 시장을 공략하기 위한 핵심 기지가 될 것”이라고 했다."
2024-03-05,"8조 차기구축함 소송 2R... 한화오션, ‘HD현대 임원 개입’ 추가 고발","양사 ‘군사기밀 유출사건’ 2R8조원 규모의 한국형 차기 구축함(KDDX) 수주 분수령인 한화오션과HD현대중공업의 ‘군사기밀 유출 사건’ 소송전이 2라운드로 접어들었다. 한화오션은 4일 유죄가 확정된HD현대중공업 직원 9명의 군사기밀 유출 사건과 관련해 당시 임원도 개입했을 수 있으니 추가로 수사해 달라며 경찰청 국가수사본부에 고발장을 제출했다.HD현대중공업 직원 9명은 2012년 10월부터 약 3년 동안 대우조선해양(현 한화오션)이 작성한 군사기밀을 몰래 취득해 서로 공유해 활용하다가 기무사령부(현 방첩사령부) 보안 감사에서 적발돼 국방부 검찰단 수사를 받았다. 이후 직원 9명이 재판에 넘겨져 모두 최종 유죄가 확정됐다.이로 인해HD현대중공업은 방사청 보안 규정에 따라 입찰할 때 보안 감점(-1.8점)을 우선 적용받았다. 이와 별개로 방사청 계약심의위에서 추가로 입찰 참가 자격 제한 제재까지 받으면 최대 5년 동안 해군 함정 사업에 참여할 수 없는 상황이었다. 당장 올 하반기 입찰이 예정된 약 7조8000억원 규모KDDX사업이HD현대중공업, 한화오션 양강 구도에서 사실상 한화오션으로 기울게 된다. 이 경우HD현대중공업 관련 사업은 존폐 갈림길에 설 판이었다.지난달 27일 방사청 계약심의위는 군사기밀 유출 사건과 관련해HD현대중공업이 해군 함정 사업에 입찰할 수 있는지를 심사했는데 ‘임원의 개입은 객관적 사실로 확인되지 않는다’는 이유 등으로 입찰할 수 있다고 의결했다. 회사 차원의 조직적 개입이 아니라 일부 직원의 불법행위로 판단한 것이다. 그러자 한화오션은 “국방부 검찰단의 사건 수사 기록을 확인한 결과 임원 개입 정황이 확인됐다”고 주장하면서 경찰 재수사를 요구하고 나섰다.한화오션은 “고위 임원의 명시적 또는 묵시적 지시나 관여 없이는, 수년간 여러 차례에 걸쳐 대담한 방법으로 군사기밀을 탈취해 회사 내부에 비밀 서버를 구축, 운영 관리하고, 수사를 회피하기 위한 대응 매뉴얼까지 작성하는 일련의 조직적인 범행이 일어나기 어렵다는 점은 상식을 가진 일반인이라면 누구나 손쉽게 추론 가능한 일”이라고 주장했다.HD현대중공업 관계자는 “법원 판결과 방사청의 두 차례 깊이 있는 심의 끝에 이미 종결된 사안”이라며 “K-방산 역량 강화에 집중할 때”라고 밝혔다."
2022-02-24,"현대중공업지주, 앞으론 HD현대라고 불러주세요","한국조선해양 지분 4.1% 매입HD현대현대중공업그룹의 지주회사인 현대중공업지주가 그룹 창립 50주년을 맞아 회사 이름을 ‘HD현대’로 바꾼다.현대중공업지주는 24일 이사회를 열어 이 같은 사명 변경 안건을 통과시켰다. 다음 달 28일 정기 주주총회에서 최종 확정할 계획이다.HD현대는 인간이 가진 역동적인 에너지(HumanDynamics)로 인류의 꿈(HumanDreams)을 실현하겠다는 의미다. 회사 측은 “투자 지주회사 이름에 중공업이 들어가있는 게 부자연스럽다는 판단에 따라 사명 변경을 추진했다”며 “제조업 중심 이미지에서 벗어나 미래 사업 분야의 신성장 동력을 적극적으로 발굴해 투자할 것”이라고 밝혔다.현대중공업지주는 최근 투자 분야를 다각화하고 있다. 선박 자율 운항 설루션 전문 회사 아비커스를 설립해 지난해 국내 최초로 선박 완전 자율 운항에 성공했고, 지난해 하반기에는 투자 전문 자회사인 현대미래파트너스를 통해 모바일 헬스케어 서비스 기업인 메디플러스솔루션을 인수했다. 한국투자공사(KIC)와 1조원 규모의 공동 투자를 위한 업무 협약도 체결했다.한편 이날 현대중공업지주는 자회사인 한국조선해양 주식 290만주(4.1%)를 총 2514억원에 매입했다. 이번에 매입한 주식은KCC가 보유한 191만주(2.7%)와 아산사회복지재단이 보유한 99만주(1.4%)로, 현대중공업의 한국조선해양 지분은 35.05%로 높아졌다. 회사 측은 “자회사에 대한 안정적인 경영권 확보와 책임 경영 실현을 위한 목적”이라고 밝혔다."
2024-02-28,"8조 규모 차기 구축함 사업, HD현대중공업 입찰 참여한다",방사청 “군 기밀 유출있었지만사업 계약하는 것엔 문제 없어”군사기밀 유출로 논란이 된HD현대중공업이 방위사업청의 사업 입찰 참가 자격 제재를 피했다. 이로써 8조원에 달하는 한국형 차기 구축함(KDDX) 사업은 물론 다른 사업에도 참여할 수 있게 됐다.방사청은 27일 계약심의위원회를 열고HD현대중공업에 대한 부정당 업체 제재 심의를 ‘행정지도’로 의결했다고 밝혔다. 앞서HD현대중공업 직원 9명은 2012년 10월부터 약 3년 동안 대우조선해양(현 한화오션)이 작성한KDDX관련 자료 등 군사기밀을 몰래 취득해 서로 공유해온 혐의로 유죄가 확정된 바 있다. 방사청은 이 건에 대해HD현대중공업이 군사기밀보호법을 위반했다는 점은 인정했지만 입찰 참가 자격을 제한하거나 과징금을 물릴 사안은 아니라고 봤다. 방사청은 “군사기밀보호법 위반이 국가계약법상 부정한 행위에 해당하지 않고 제척 기간도 지났다고 봤다”고 했다. 방사청은 이어 “HD현대중공업의 대표나 임원이 (입찰 제한의 근거가 되는) 청렴 서약을 위반해 개입했다는 객관적 사실도 확인되지 않았다”고 했다.HD현대중공업은 이로써 2030년까지 6000톤급 이지스함 6척을 건조하는 내용으로 예상 수주 금액만 7조8000억원에 달하는KDDX사업에 계속 참여할 수 있게 됐다.HD현대중공업은 이미 군사기밀 유출 사고로 방사청 입찰 때 보안 감점(-1.8점)을 받고 있는데 입찰 참가 자격 제한 제재를 받으면 최대 5년 동안 해군 함정 사업에 참여할 수 없는 상황이었다.HD현대중공업은 방사청 결정에 대해 “국내 함정 산업의 발전과 수출에 기여하겠다”는 입장을 내놨다. 반면 경쟁 업체인 한화오션 측은 “HD현대중공업의 기밀 탈취는 방산 근간을 흔드는 중대 비위”라고 반발했다.
2024-02-15,"법원 “HD현대건설기계, 하청업체 직원 27명 직고용해야”","HD현대건설기계의 하청업체 직원들이 근로자 지위 확인 소송에서 승소했다. 법원은 이 회사가 하청업체 직원 27명의 직접 고용하고, 밀린 임금 15억여원을 줘야 한다고 판단했다.15일 서울 서초구 서울중앙지법 앞에서 전국금속노동조합 현대중공업지부 사내하청지회 관계자 등이 현대건설기계 상대 근로자지위확인 소송 1심 판결에서 일부 승소 판결을 받은 뒤 입장 발표 기자회견을 하고 있다. /연합뉴스서울중앙지법 민사합의41부(재판장 정회일)는 15일 하청업체 직원 A씨 등 27명이HD현대건설기계를 상대로 낸 근로자지위 확인 등 청구 소송에서 원고 일부 승소 판결했다.A씨 등은HD현대건설기계 사내 하청업체에 입사해 2년 이상 근무했다. 이들은 “원·하청 업체가 맺은 도급계약은 근로자 파견계약이며, 파견법에 따라HD현대건설기계와의 직접고용 관계가 성립됐다”며 2021년 3월 소송을 냈다. 실질적으로HD현대건설기계의 지휘·감독을 받아 생산업무에 종사했다는 이유였다. 이들은HD현대건설기계가 다른 정규직 근로자들의 임금과 자신들이 사내 하청업체에서 받은 임금의 차액을 지급해야 한다고도 했다.반면,HD현대건설기계 측은 이들의 업무에 관해 지휘·명령한 적도 없고, 별도 작업집단으로 구성돼 자사 사업에 편입됐다고 볼 수도 없다고 주장했다.그러나 재판부는 “HD현대건설기계와 사내 협력업체 간 도급계약은 실질적으로 근로자 파견계약에 해당한다고 봐야 한다”라며 원고 주장 대부분을 받아들였다.재판부는 “HD현대건설기계는 사내 협력업체에 작업표준서와 제조 공정도 등을 전달했고, 이는 하청업체 직원들의 작업 순서와 방식을 상세하게 규정했다”고 판단했다.HD현대건설기계가 A씨 등 파견업체 직원들에게 구속력 있는 업무상의 지시를 내렸다는 것이다.또한 “A씨 등과HD현대건설기계 직원들의 공정 사이엔 밀접하고 유기적인 관련성이 있고, A씨 등은HD현대건설기계 직원들과 하나의 작업집단을 구성한다고 인식했다”고 판단했다."
2024-02-13,HD현대重 울산조선소서 근로자 1명 사망,"철제 구조물 무너져… 1명 부상고용부, 중대재해법 위반 조사12일 오후HD현대중공업 울산조선소 해양사업부 공장에서 철제 구조물이 무너지면서 근로자들이 깔려 1명이 숨지고, 1명이 중상을 입는 사고가 발생했다. 지난 2022년 4월 조선소 내 판넬2공장에서 가스로 철판 절단 작업을 하던 협력 업체 근로자가 폭발 사고로 숨진 데 이어 2년 만에 발생한 중대재해 사건이다.소방 당국에 따르면, 이날 오후 6시 57분쯤 “사람이 블록 밑에 깔렸다”는 119 신고가 접수됐다. 현장에 출동한 119 구조대는 오후 7시 16분쯤 철제 구조물에 깔려 있는 A씨를 구조했으나 이미 심정지 상태였다. B씨는 스스로 탈출했으나 갈비뼈가 골절되고 비장이 파열되는 부상을 당해 병원으로 옮겨졌다.이날 사고는 오후 6시 50분쯤 울산 동구 방어동HD현대중공업 해양사업부 공장에서 부유식 원유 생산 설비(FPS)를 제작하는 과정에서 발생했다. 소방당국은 “제작 도중 철제 구조물인 블록 하나가 빠지면서 위쪽 구조물이 무너져 내려 2명이 매몰됐다”고 밝혔다. 사고를 당한 근로자들은HD현대중공업과 계약한 외주 전문 업체 소속 근로자들인 것으로 파악됐다.이에 대해HD현대중공업 관계자는 “철제 구조물 일부가 원인을 알 수 없는 이유로 균형을 잃으면서 넘어진 것으로 파악됐다”며 “자세한 사고 경위와 원인을 파악 중이며, 추가 사고가 발생하지 않도록 안전 조치를 취하고 있다”고 말했다.한편, 경찰과 소방 당국은 사고 현장을 목격한 인근 근로자들을 상대로 정확한 사고 원인을 조사 중이고, 고용노동부는 중대재해처벌법 위반 여부를 조사 중인 것으로 전해졌다."
2024-02-12,HD현대중공업 울산조선소서 작업중 1명 사망,"HD현대중공업 울산조선소 전경./HD현대중공업지난해 중대재해가 나오지 않았던HD현대중공업 울산조선소에서 사망 사고가 났다. 이 조선소에선 2022년 4월 이후 1년 10개월 만에 중대재해가 발생했다. 중대재해(重大災害)는 사업장에서 사망자가 1명 이상 발생하는 등 재해 정도가 심한 산업재해를 말한다.12일 경찰 등에 따르면, 이날 오후 6시57분쯤 울산시 동구 방어동HD현대중공업 울산조선소 해양공장에서 선박 조립 부품인 대형 철제 ‘블록’에 깔린 60대 근로자 A씨가 사망했고, 50대 근로자 B씨는 중상을 입었다. A씨 등은 블록을 전문으로 옮기는 외부 용역업체 소속 근로자다.이날 블록을 옮기는 작업에 외부 업체 근로자 3명이 동원됐다. 높은 지점에서 수평으로 옮기던 블록이 알 수 없는 이유로 떨어져 A씨와 B씨를 덮쳤다. 거대한 블록에 깔린 A씨는 현장에서 사망했고, B씨는 갈비뼈가 부러지고 비장이 파열되는 등 중상을 입었으나 자력으로 탈출했다. 추락한 블록에서 벗어난 지점에 있던 C씨는 화를 면했다.“사람이 블록에 깔렸다”는 신고를 받고 출동한 119 대원은 이날 오후 7시 30분쯤 A씨 시신을 수습했다. 경찰은 목격자와 회사 측을 상대로 정확한 사고 원인을 조사하고 있다.앞서HD현대중공업에서는 2022년 4월 2일 중대재해가 발생했다. 사측은 지난달 16일 ‘지난해 중대재해 제로(0) 달성에 이어, 올해 중대재해 없는 1000일에 도전한다’고 보도자료로 밝혔으나, 채 한 달도 안 돼 중대재해가 일어났다."
