date,title,content
2023-09-17,정기선 HD현대 사장은 왜 직접 덴마크 코펜하겐을 방문했을까,"현대미포조선이 건조한 세계 최초 메탄올 추진 컨테이너선 ‘로라 머스크호’의 모습. 길이 172m,너비 32.2m,높이 16.8m다. 사진HD현대정기선HD현대 사장이 글로벌 조선·해운 시장에서 ‘친환경 보폭’을 넓히고 있다. 각국의 환경 규제에 선제 대응해 시장·기술 지배력을 확대하겠다는 뜻으로 풀이된다.HD현대는 정기선 사장이 최근 덴마크 코펜하겐에서 열린 2100TEU급 메탄올 추진 컨테이너 운반선 ‘로라 머스크호’ 명명식에 참석했다고 17일 밝혔다. 이 선박은 세계 2위 해운사인AP몰러-머스크(머스크)가HD현대에 발주한 19척의 메탄올 추진선 중 가장 먼저 건조됐다. 친환경 연료인 메탄올을 사용하는 세계 최초의 컨테이너 운반선이다. 앞서 머스크는 2040년까지 탄소중립 실현을 위해 메탄올 추진선 도입 계획을 발표한 바 있다.로라 머스크호는 울산 현대미포조선에서 건조를 마친 뒤 지난 7월 덴마크로 출발했다. 이후 약 2개월, 2만1500㎞의 항해 끝에 13일(현지시간) 코펜하겐에 도착했다. 머스크가 ‘해운의 새 시대를 연다’는 의미에서 명명식을 본사 소재지에서 열고 싶어했기 때문이다. 이에 따라 정 사장도 코펜하겐을 찾은 것이다. 이날 열린 명명식에는 정 사장과 로버트 머스크 우글라 머스크 이사회 의장, 우르줄라 폰데어라이엔 유럽연합(EU) 집행위원장 등이 참석했다.배 이름은 머스크 창업주의 아버지인 피터 머스크 몰러가 샀던 첫 번째 증기선(‘로라호’)에서 따왔다. 뱃머리와 선체에는 ‘제로(탄소중립)로 가는 길(AlltheWaytoZero)’이라는 슬로건을 새겼다. 머스크와HD현대의 오랜 인연도 눈길을 끌었다. 두 회사는 1987년 25만4000t급 초대형 원유 운반선 계약을 시작으로 현재까지 113억 달러(약 15조200억원) 규모, 123척의 선박 계약을 체결했다. 정 사장은 이날 “로라 머스크호가 탄소중립을 위한 중요한 이정표가 될 것으로 확신한다”며 “혁신적이고 선도적인 기술 개발로 그린오션 실현을 앞당길 것”이라고 말했다.정기선HD현대 사장(맨오른쪽)과 로버트 머스크 우글라 머스크 의장(오른쪽에서 둘째),우르줄라 폰데어라이엔EU집행위원장(넷째) 등 관계자들이 13일(현지시간) 로라 머스크호 명명식이 끝난 뒤 선실에서 기념촬영을 하고 있다. 사진HD현대정기선HD현대 사장(오른쪽)이 13일(현지시간) 덴마크 코펜하겐에 위치한 머스크 본사에서 로버트 머스크 우글라 의장과 만나 환담을 나눴다. 사진HD현대조선 업계에서 친환경 선박 건조 경쟁력은 생존을 위한 필수 조건이 돼 가고 있다. 유엔(UN) 산하 국제해사기구는 최근 당초 2050년까지 온실가스 배출 총량을 2008년 대비 50%까지 줄이기로 했던 계획을 100%로 높이는 데 합의했다. 그만큼 친환경 연료·엔진 기술 도입이 중요해진 것이다.HD현대는 세계에서 가장 많은 총 43척의 메탄올 추진 컨테이너선을 수주하는 등 친환경 분야에서 가장 앞선 업체로 꼽힌다.한편 정 사장은 이날 행사에 앞서 코펜하겐에 있는 만에너지솔루션을 찾아 연구개발(R&D) 설비를 둘러보고 협력방안을 논의했다.HD현대는 이 회사와 친환경 암모니아 추진 엔진을 공동 개발 중이다.HD현대 측은 “정 사장이 직접 덴마크 머스크 본사 등을 방문한 건 그만큼 친환경 선박 기술의 중요성이 커지고 있다는 의미”라며 “친환경 선박 시장 선점을 위한 움직임도 더 늘어날 것”이라고 말했다."
2024-07-31,HD현대마린엔진 출범…대표에 강영,선박용 엔진 및 부품을 생산하는STX중공업이HD현대의 계열사HD현대마린엔진으로 재출범한다.STX중공업은 30일 오전 임시주주총회에서 사명을 변경하는 정관 개정안과 신임이사 선임안을 통과시켰다고 이날 밝혔다. 대표이사엔 강영HD현대STX중공업 인수추진 총괄(사장)이 선임됐다. 강 대표는HD현대 그룹 내 대표적인 재무 전문가다.HD현대마린엔진은 안정적인 재무 관리를 기반으로 생산 기술 고도화에 힘쓴다는 계획이다.
2024-07-30,STX중공업의 새 이름은 HD현대마린엔진…첫 CEO는 재무통,"HD한국해양조선이STX중공업을 인수해HD현대마린엔진으로 재출범한다. 사진은HD한국조선해양의 석유화학제품 운반선의 시운전 모습. 연합뉴스선박용 엔진 및 부품을 생산하는STX중공업이HD현대의 계열사HD현대마린엔진으로 재출범한다.STX중공업은 30일 오전 임시주주총회에서 사명을 변경하는 정관 개정안과 신임이사 선임안을 통과시켰다고 이날 밝혔다. 대표이사엔 강영HD현대STX중공업 인수추진 총괄(사장)이 선임됐다.강 대표는HD현대 그룹 내 대표적인 재무 전문가로 손꼽힌다.STX중공업은 강 대표에 대해 “재경 분야 전문가로 최고재무책임자(CFO)를 역임하며 회사의 경영 안정성과 원가 절감에 기여했다”며 “전문경영인으로서 회사의 발전과 기업가치 제고에 크게 기여할 것으로 기대해 사내이사로 추천했다”고 밝혔다. 강 대표는 1992년HD현대중공업에 입사해 경영지원본부 회계담당 임원(상무), 경영부문장(전무), 재경본부장(부사장)을 역임했다.강영HD현대마린엔진 대표이사. 강 대표는 1992년HD현대중공업에 입사해 최고재무책임자(CFO) 등을 역임했다. 사진HD현대HD현대마린엔진은 안정적인 재무 관리를 기반으로 생산 기술 고도화에 힘쓴다는 계획이다. 그룹 내에서 선박 엔진을 생산하고 있던HD현대중공업은 대형 선박에 집중하고,HD현대마린엔진은 중소형 선박에 집중할 예정이다. 발전용 엔진을 생산하는HD현대엔진까지 포함해HD현대의 엔진 3사는 기술과 해외 유통망을 공유해 글로벌 선박 엔진 시장을 선도한다는 계획이다. 시장조사업체 글로벌인포메이션에 따르면 세계 선박 엔진 시장 규모는 매년 5.24%씩 성장해 2030년에 187억 5000만 달러(약 25조9537억원)에 이를 전망이다.HD현대의 중간 지주사HD한국조선해양이 31일 구주 매수와 신주 유상증자를 통해STX중공업 지분의 35.05%를 확보하면 모든 인수 절차가 마무리된다.HD현대 관계자는 “친환경 엔진 기술은 조선 산업의 탈 탄소 전환을 주도할 핵심 동력”이라며 “압도적인 기술력으로 글로벌 선박 엔진 시장에서 지위를 강화해 나갈 것”이라고 밝혔다."
2024-07-29,"HD현대마린솔루션, 역대 최대 규모 '장기 유지보수' 따냈다","HD현대, 메탄올 추진 초대형 컨테이너선 '아네 머스크호'.사진HD현대HD현대그룹의 해양 솔루션 기업HD현대마린솔루션이 역대 최대 규모의 선박 장기 유지보수 계약을 체결했다.HD현대마린솔루션은 29일 유럽 소재 선사와 6000만 달러(830억원) 규모의 선박 장기 유지·보수 서비스 공급 계약(LTSA,LongTermServiceAgreement)을 체결했다고 밝혔다. 단일 거래 기준 역대 최대 금액이다.이번 계약에 따라HD현대마린솔루션은 2029년까지 해당 선사 선단 소속 38척의 선박에 부품 및 기자재를 공급하고 전담 엔지니어를 통해 안정적인 유지·보수 서비스를 제공할 예정이다.선사 및 선주들은LTSA를 통해 부품 교체, 수리, 정비에 소요되는 시간을 최소화해 선박 가동 시간을 극대화하려는 전략을 취한다. 글로벌 선박 유지·보수 시장(AM,AfterMarket)은 연간 100억 달러(약 13조8300억원) 규모로 조선소로선 안정적인 수익을 올릴 수 있는 매출원으로 꼽힌다.이를 위해HD현대마린솔루션은 부품 및 기자재에 대한 미래 수요를 예측하고 재고 물량을 최적화하는 프로그램을 구축해 활용하는 한편,LTSA전담 조직과 해외법인을 통해 글로벌 영업을 강화하고 있다.HD현대는 상선뿐 아니라 함정 유지·보수(MRO) 사업에도 적극적으로 나서고 있다. 지난 11일엔HD현대중공업이 국내 최초로 미국 해군과 함정 정비 협약을 체결했다.HD현대마린솔루션 관계자는 “선박 운송량 증가에 따라AM시장의 안정적인 성장이 기대되는 만큼, 최적의 서비스와 품질을 통해 글로벌 선도 기업으로서의 지위를 유지해 나갈 것”이라고 말했다."
2024-07-29,"HD현대, 외국인 1호 ‘조선소 현장반장’ 탄생","울산지역 조선소 현장에 첫 외국인 반장이 등장했다. 주인공은HD현대중공업 조선소에서 근무하는 스리랑카 출신의 나린다 쿠마라(35·사진)다.28일HD현대중공업에 따르면 지난 4월 외국인 첫 현장 반장으로 선임된 쿠마라는 한국인 9명과 스리랑카 등 외국인 19명으로 이뤄진 도장부문 한 개 반을 이끌고 있다. 선박 도장 중 ‘터치업(붓 도장)’ 업무를 지휘하면서 위험 요소 파악, 작업 수칙 전달 등 팀원들의 안전을 책임진다. 쿠마라는 “스리랑카 팀원과는 자국어로, 다른 팀원과는 한국어로 소통하면서 안전하고 효율적인 업무 분위기를 만들기 위해 노력 중”이라고 말했다.HD현대중공업에 일하는 내·외국인 근로자는 사내 협력사 소속을 합해 3만2000여명이다. 이 가운데 외국인 근로자는 4500명 정도다. 쿠마라는 사내 협력사인 지우산업 소속이다.HD현대중공업 측은 “책임감 있는 모습에 동료들의 신임까지 얻고 있어, 외국인 1호 현장 반장으로 충실하게 제 역할을 잘 해주고 있다”고 분위기를 전했다.쿠마라는 2011년 혼자 한국에 왔다. 비전문취업(E-9)비자로, 울산지역 한 조선소(HD현대미포) 사내 협력사에서 근무를 시작했다. 그러다 2012년 현재의 사내 협력사로 이직, 10년 이상HD현대중공업 조선소에서 근무하고 있다. 선박 도장에 재능이 있던 그는 조선소 도장반에서 ‘코리안 드림’을 꿈꿨다. 바쁜 업무 중에도 한국어 공부는 빠뜨리지 않았다. 회사 사내 한국어 교육에 참여했고, 한국폴리텍대학에서 한국어를 배웠다. 그러다 보니 한국어 시험에서는 영주권 또는 귀화 자격 요건에 해당하는 최고등급(5단계)을 획득했다.도장 기술에 유창한 한국어 실력까지 갖춘 쿠마라는 지난해 9월 열린 ‘제20회 조선해양의 날’ 행사에서HD현대중공업 선행도장부 협력사 소속 외국인으로서 ‘우수조선해양인상’을 수상해 화제가 되기도 했다.HD현대중공업 관계자는 “한국어를 잘하고, 도장 기술 역시 뛰어나 현장을 통솔하기에 손색이 없다고 판단해 반장을 맡기게 됐다”고 말했다.현재 체류 기간 연장이 가능한 숙련기능인력(E-7) 비자를 가진 쿠마라는 조만간 한국에서 결혼해 가정을 꾸릴 계획이다. 그는 “스리랑카 등 다른 외국인 근로자들에게 제가 반장에 오른 노하우를 알려주고 싶다”며 “(한국에서) 열심히 하면 스스로 보람을 느끼고 그만한 대우를 충분히 받을 수 있다고 생각한다”고 말했다."
2023-07-16,"HD현대·GS리테일·BGF, 폭우 피해 지역에 성금·물품 전달","폭우 피해 지역에 전달될 생필품을 담은GS리테일 트럭. 사진GS리테일폭우로 큰 피해를 본 지역에 기업들의 복구 성금과 긴급 구호 물품 지원이 이어지고 있다.16일HD현대의 비영리 재단법인HD현대1%나눔재단은 희망브리지 전국재해구호협회에 수해복구 성금 5억원을 기탁한다고 밝혔다.HD현대건설기계와HD현대인프라코어는 집중호우 피해 지역의 복구를 돕기 위해 각각 10대씩 총 20대의 굴착기와 인력을 지원하기로 했다.권오갑HD현대1%나눔재단 이사장은 “폭우로 안타까운 피해를 보신 분들이 하루빨리 일상으로 복귀할 수 있도록 최선을 다할 것”이라며 “임직원 급여 1%를 모아 마련한 성금이 어려움을 겪고 있는 분들에게 힘이 됐으면 한다”고 말했다.GS리테일은 이날 대한적십자사 충북지사와 영주시청, 예천 군민체육센터에 생수 3000개와 초코파이, 에너지바 등으로 구성된 구호 물품을 전달했다고 밝혔다. 집중호우로 피해를 본 이재민과 구호 요원들에게 지급될 예정이다.GS리테일은 전국 각지의 매장을 중심으로 다양한 사회공헌 활동을 추진하고 있으며, 향후 폭우 피해 상황에 따라 추가 지원을 검토할 계획이다.국가 재난 긴급 구호활동인 ‘BGF브릿지’.사진BGFBGF리테일도 충남 논산과 금산, 충북 괴산, 청주 등에 생수와 라면, 이온음료 등 1000만원 상당의 구호 물품을 지원했다. 해당 지역은 400㎜가 넘는 많은 비가 내리면서 주택과 시설물이 파손돼 이재민이 발생했다.BGF리테일은 향후 비 피해 상황을 지속적으로 모니터링해 추가 지원을 검토하기로 했다. 양재석BGF리테일 커뮤니케이션실장은 “계속되는 폭우에 피해를 최소화하고 신속한 복구가 될 수 있도록 적극적인 지원에 나설 것”이라고 말했다."
2024-07-24,"HD현대, 미국 내 조선업 인재 키운다","HD현대가 국내와 미국에서 조선산업 전문 인재 육성에 나선다.HD현대는 22일(현지시간) 미국 미시간주에 위치한 맥콤 커뮤니티 대학에서 조선 부문 중간지주회사인HD한국조선해양이 미국 미시간대학교, 서울대학교와 ‘조선산업 인재육성을 위한 교육협력 업무협약(MOU)’을 했다고 밝혔다.이날 행사에는 신종계HD한국조선해양 기술자문, 조너선 페이지 미시간대학교 조선·해양 공학대 교수를 비롯해 카를로스 델 토로 미국 해군성 장관, 그레천 휘트머) 미시간주 주지사 등 미국 정부 관계자가 참석했다. 이번 협약은 카를로스 델 토로 장관이 지난 2월HD현대중공업 울산 본사를 방문,HD현대가 보유한 선박 건조 역량을 직접 확인한 후 협력을 요청해 이뤄졌다.협약에 따라HD현대와 서울대학교는 공동연구와 교육, 인턴십 프로그램 도입 등 미시간대학교와의 교육협력 방안을 모색할 예정이다. 또 매사추세츠 공과대학교(MIT), 버지니아 공과대학교(버지니아텍) 등 미국 내 다른 대학으로 협력 범위를 확대하는 방안도 검토 중이다.신종계HD한국조선해양 기술자문은 “조선 분야의 한미 교육협력은 미국 조선산업의 경쟁력 강화는 물론, 미국 함정MRO등 향후 가시화될 양국 간 사업 협력에도 긍정적인 효과를 미치게 될 것”이라며, “우리가 가진 기술력과 경험을 바탕으로 양국 조선산업 발전에 중추적 역할을 해나갈 수 있도록 노력하겠다”고 밝혔다."
2023-07-10,[Biz & Now] ‘시민 영웅’ HD현대아너상 후보 모집,"HD현대1%나눔재단이 첫 ‘HD현대아너상’ 후보를 모집한다고 9일 밝혔다.HD현대아너상은 소외계층을 위해 헌신하는 이들을 발굴하기 위해 제정됐다. 상금은 총 2억3000만원 규모로 대상과 최우수상(개인·단체), 특별상 등 총 4개 분야에서 시상한다. 5년 이상 관련 공적이 있어야 하며, 단체의 경우 정회원이 10명 이상이어야 한다."
2023-07-09,“숨은 영웅 찾습니다” 첫 HD현대아너상 후보 모집,"HD현대1%나눔재단이 첫 ‘HD현대아너상’ 후보를 모집한다고 9일 밝혔다.HD현대1%나눔재단CI.사진HD현대1%나눔재단HD현대아너상은 소외계층을 위해 헌신하는 이들을 발굴하기 위해 제정됐다. 상금은 총 2억3000만 원 규모로 대상과 최우수상(개인·단체), 특별상 등 총 4개의 상이 수여된다.지원하기 위해서는 5년 이상의 관련 공적이 있어야 하며, 단체의 경우 정회원이 10명 이상이어야 한다. 후보자 추천은 지방자치단체, 교육시설, 사회복지시설·단체 등의 장이 할 수 있다. 본인 추천도 가능하다. 다만 유사 공적 내용으로 최근 3년 이내 다른 기관의 수상 경력이 있는 경우 심사 대상에서 제외된다.서류 접수는 오는 10일부터 28일까지다. 최종 수상자는 9월 발표된다. 재단 관계자는 “사회적 책임을 다하고 사회공동체 발전에 지속적으로 기여하기 위한 노력을 이어 나갈 것”이라고 말했다."
2023-07-28,"[Biz & Now] HD현대, 주한 우크라대사와 재건사업 협력 논의","HD현대, 주한 우크라대사와 재건사업 협력 논의HD현대는 경기도 판교 글로벌연구개발센터에서 드미트로 포노마렌코 주한 우크라이나 대사와 우크라이나 재건 사업을 논의했다고 27일 밝혔다. 양측은 건설기계와 발전기용 엔진, 이동식 발전기 등 전력기 분야 협력을 논의했다. 포노마렌코(오른쪽) 대사와 조영철HD현대사이트솔루션 사장이 기념촬영을 하고 있다."
2023-06-09,"[Biz & Now] HD현대, 건조~폐선 탄소 보고서…정기선 “친환경 대전환”","HD현대, 건조~폐선 탄소 보고서...정기선 “친환경 대전환”HD현대의 조선 중간지주사인HD한국조선해양은 8일 노르웨이 오슬로에서 열린 조선해양박람회 ‘노르시핑(Nor-shipping) 2023’에 참가해 세계 선사·선급과 친환경 협약을 맺었다고 밝혔다. 협약에 따라 세계 최초로 원재료 조달부터 건조·운항·폐선까지 발생하는 탄소 배출량을 측정하고 결과를 담은 보고서도 발간한다. 정기선(사진 오른쪽)HD현대 사장은 “HD현대가 만드는 선박과 기술이 대양의 친환경 대전환을 이끄는 핵심 동력이 될 것”이라고 밝혔다."
2024-07-12,"수십조 걸렸다…""美군함 내가 고칠래"" HD현대∙한화의 경쟁","지난달 미국 핵추진 항공모함 '시어도어 루스벨트'(CVN-71)가 부산 남구 해군작전사령부 부산작전기지에서 출항하고 있다. 부산=송봉근 기자HD현대와 한화가 이번엔 함정 유지·보수·정비(MRO) 사업에서 경쟁하고 나섰다. 두 회사는 한국형 차기 구축함(KDDX) 수주를 두고 공방을 벌여왔다. 특수선 시장의 확대에는 한계가 있는 만큼, 기업들이 새 활로 찾기에 경쟁적으로 나서는 것으로 보인다.11일HD현대중공업은 국내 기업 중 처음으로 미국 해군보급체계사령부와 ‘함정정비협약’(MSRA)을 체결했다고 밝혔다. 이에 따라HD현대중공업은 향후 5년간 미국 해상 수송사령부 소속 지원함과 미 해군의 전투함에 대해MRO사업 입찰 참여 자격을 갖게 됐다. 주원호HD현대중공업 특수선사업대표는 “총 18척의 수출 함정을 건조한 기술력과 필리핀에서 축적한MRO사업 노하우를 바탕으로 미국 함정MRO시장에 연착륙할 계획”이라고 말했다.한화오션도 미 함정MRO사업에 진출하기 위해 노력 중이다. 지난달 국내 기업 중 처음으로 미국의 조선소를 인수했다. 한화 측이 인수한 필라델피아 필리조선소는 상선을 전문적으로 건조하는 곳이지만, 미 해군 소송함의 수리·개조 사업도 맡아왔다. 이번 인수로 미 함정MRO시장에서 거점을 마련했다는 평가다.HD현대중공업 울산조선소의 골라앗 크레인에서 선박을 건조중인 모습. 사진HD현대중공업함정은 평시에도 언제든 작전에 투입 될 수 있도록 최상의 상태를 유지하는 것이 중요하다.MRO업체는 유지·관리부터 첨단장비 업그레이드까지 수행하는 역할을 한다.세계 최대 방위산업 시장을 보유한 미국은 함정MRO를 두고 고민이 커지던 차였다. 미국의 선박 산업은 전통적으로 매우 폐쇄적인 시장이다. 1920년 제정된 미국 연안무역법(존스법)에 따라, 미 해상에서 군함 등 선박을 운용하려면 미국 조선소에서 건조·개조해야 한다. 덕분에 미국의 조선사들은 군함과 선박 건조를 독점하며 안정적으로 수익을 올렸지만, 이에 안주하다보니 코로나19 기간을 지나며 미국의 조선 경쟁력이 저하됐다.문제는 최근 미·중 갈등 등으로 미 해군 함정 가동률이 늘어나면서다. 미국 조선사만으로는MRO수용력이 한계에 도달하자, 미 정부는 해당 시장을 일부 개방하기로 했다. ‘보안 유지’가 중요한 방위산업 특성상, 미국의 우방 국가 중 조선업 역량 높은 한국이 시장에서 유리하다. 업계에 따르면 미국의 해군 함정MRO사업 규모는 세계 최대로, 연 20조원에 달하는 것으로 추정된다.한화오션 거제사업장에서 선박을 건조중인 모습. 사진 한화오션MRO의 경우 선박 전 주기에 거쳐 이어지기 때문에, 조선사가 장기적 수익을 확보할 수 있다는 것도 장점이다. 시장조사업체 모르도르인텔리전스에 따르면 전 세계 해군 함정MRO시장 규모는 올해 577억6000만 달러(약 79조6600억원)에서 2029년 636억2000만 달러(약 87조7400억원)까지 커질 것으로 전망했다.대한조선학회 미래위원회에 따르면 2030년 세계 함정시장 규모는 444억 달러(약 61조2500억원)에 이른다. 신규 군함 수주 확대에는 한계가 있고, 노후 함정에 대한 글로벌MRO수요는 늘어날 전망이다.HD현대는 이미 필리핀 해군의 함정MRO사업도 전개하고 있다. 한화는 호주의 방산 조선업체 ‘오스탈’ 인수를 추진하고 있다. 오스탈은 호주·미국 해군에 납품하고 있으며, 미국 앨라배마주 등에도 조선소를 두고 있다.‘세계의 경찰’인 미국의 군함MRO사업권을 따내는 건 신뢰할만한 기술력을 보증하는 상징적 의미도 있다. 향후 미 정부가 발주하는 함정·특수목적선·관공선 등 신조(新造) 등으로 사업영역을 넓힐 수도 있다. 두 회사는 미국에서의 성과를 바탕으로 향후 아시아·남미 등으로 사업을 확대할 계획이다.앞서HD현대중공업과 한화오션은 사업비 7조8000억원 규모의KDDX사업 선정을 두고 갈등해왔다. 함정 초안을 그리는 개념설계는 한화오션이, 무기 체계 등을 구체화한 기본설계는HD현대중공업이 각각 따냈는데 상세설계와 선도함 건조를 누가 맡느냐를 두고 벌이는 주도권 싸움이다.HD현대중공업 측은 “관례에 따라 기본설계 업체가 수의계약으로 사업을 수행해야 한다”는 입장이고, 한화오션은 “경쟁 입찰을 해야 한다”는 입장이다.한국형 구축함(KDDX) 사업 분쟁 일지 그래픽 이미지.전문가들은 글로벌 경쟁력을 갖춘 국내 방산 기업들이 치열한 경쟁을 벌이는 것으로 분석한다. 윤지원 상명대 국가안보학과 교수는 “K-방산에 새로운 시장이 필요했던 상황인데, 북미·중남미 등으로 외연 확장의 기반을 마련했다는 점이 의미 있다”면서도 “일본·호주의 조선업체도 시장확장에 나선 상황에서, 국내 기업 간 경쟁이 과열되는 건 우려스럽다. 결국은 초격차 기술력을 갖춘 기업이 시장의 선택을 받을 것”이라고 말했다."
2023-05-30,[Biz & Now] HD현대 ‘대학생 커리어 멘토링’ 행사,HD현대 ‘대학생 커리어 멘토링’ 행사HD현대는 최근 서울대 기계공학부 학생 150여 명을HD현대 글로벌R&D센터로 초청해 ‘커리어 멘토링’ 행사를 가졌다고 29일 밝혔다. 이날 행사에는 정기선HD현대 사장(뒷줄 왼쪽 다섯 번째)과 동문 선배인 이동욱HD현대사이트솔루션 사장이 참석해HD현대의 비전을 소개하고 학생들을 격려했다.HD현대의 ‘커리어 멘토링’은 지금까지 8차례 진행됐다. 같은 전공의 동문 선배 직원이 직접 멘토로 참여하는 게 가장 큰 특징이다.
