date,title,content
2023-10-18,K-바이오 ‘자가면역질환’ 도전,"치료제 시장 2년후 204조원 팽창개발 성공하면 조단위 매출 거뜬국제 자가면역질환 치료제 시장이 항암제에 버금가는 규모로 성장하면서 한국의 제약·바이오 기업들도 자가면역질환 치료제 개발에 적극적으로 뛰어들고 있다. 세계적으로 성공하면 ‘조 단위’ 매출을 올릴 수 있는 만큼 신약과 바이오시밀러 개발에 속도를 올리고 있는 것이다. 글로벌 시장조사 업체 리서치앤마켓에 따르면 2025년 전 세계 자가면역질환 치료제 시장 규모는 1530억달러(약 204조원)에 달할 것으로 전망된다.GC녹십자는 미 바이오 기업 이메타스 세러퓨틱스와 함께 자가면역질환 관련mRNA(메신저 리보핵산) 치료제 개발에 나섰다. 이메타스 세러퓨틱스는 선천성 면역 시스템을 조절하는 방식으로 암과 염증성 질환 치료제를 개발하고 있다.GC녹십자는 이메타스 세러퓨틱스의 플랫폼에 자사의mRNA치료제와 지질나노입자(LNP) 전달 플랫폼을 활용하면 자가면역질환 치료제 개발에 시너지를 낼 수 있을 것으로 보고 있다.대웅제약도 한올바이오파마와 함께 자가면역질환 치료제 파이프라인을 강화하고 있다. 최근 6개월 동안 자가면역질환 관련 특허 를 3건 등록해 특허를 모두 6건 확보했다. 대웅제약은 이중 표적 기전의 자가면역질환 치료제, 난치성 피부 자가면역질환 신약 등을 개발하고 있다. 중추신경계 자가면역질환에 사용할 수 있는 치료제 후보 물질을 발굴해 내년 상반기 공개할 계획이다.이 밖에도HK이노엔은 류머티즘관절염 치료제로 개발 중인 자가면역질환 신약을 아토피 피부염에도 활용할 수 있도록 적응증 확대를 위한 임상을 진행하고 있다. 한미약품도 자가면역성 질환인 ‘원발 담즙성 담관염(PBC)’에 대한 치료제를 개발 중이다.PBC는 담관이 파괴되면서 담관 폐쇄와 간조직 손상을 유발하는 질환이다.기존 블록버스터 자가면역질환 치료제의 자리를 대체하기 위한 바이오시밀러(바이오 의약품 복제약) 개발 경쟁도 치열하다. 전 세계 의약품 매출 1위는 미 제약사 애브비가 개발한 자가면역질환 치료제 ‘휴미라’다. 지난해 기준 27조6000억원의 매출을 기록한 블록버스터 의약품으로 류머티즘관절염이나 건선 등에 사용된다. 셀트리온의 휴미라 바이오시밀러 ‘유플라이마’는 미국에서 고농도 용량을 포함한 3종이 허가되면서 환자 연령 등에 따른 맞춤형 처방으로 점유율 확대에 나서고 있다. 삼성바이오에피스도 가격 경쟁력을 앞세운 ‘하드리마’를 미국서 판매하고 있다."
2023-07-23,"서울시, 집중호우 피해 특별재난지역에 총 6억원 지원","서울시가 대외협력기금을 활용해 집중호우 피해 특별재난지역으로 선포된 충북, 충남, 경북, 전북, 세종 지역에 총 6억원을 긴급 지원한다.대외협력기금이란 서울시가 국내 타지방자치단체 및 외국 지방정부와의 상호교류와 협력을 증진하기 위해 운용하는 기금이다.오세훈 서울시장이 지난 13일 서울 중구 서울시청 지하 재난안전상황실을 찾아 수도권 집중호우에 따른 수해 대비 상황을 점검하고 있다. /서울시 제공서울시는 23일 “집중호우로 인해 피해를 입은 지역 주민들의 조속한 일상생활 복귀를 위해 대외협력기금 6억원을 긴급 지원한다”고 밝혔다.앞서 서울시는 지난 17일부터 21일까지 청주·괴산·청양·공주·영주 등 11개 시·군에 아리수 약 6만병을 전달했었다. 이 밖에도 서울시는 서울시자원봉사센터 협력기업인HK이노엔의 도움을 받아 새싹보리음료 1만2000개를 피해지역에 제공하기로도 했다.또, 충북 괴산과 경북 예천의 요청에 따라 서울시 자원봉사센터에서 자원봉사자 230명을 수해 지역에 급파했다. 자원봉사자들은 수해 지역에서 세탁차 운영, 이재민 지원, 드론 수색 활동을 진행 중이다.오세훈 시장은 “역대급 폭우로 입은 피해는 우리 모두의 피해”라며 “서울시의 지원이 고통을 겪는 수해 지역 주민들에게 조금이나마 힘이 되길 바란다”고 했다."
2023-05-03,K바이오 1분기 기술수출 2조원 넘겼다,올 1분기 국내 바이오 기업들의 기술 수출 실적이 2조원을 돌파했다.올 들어 가장 먼저 수출 계약을 알린 지씨셀은 지난 1월 미국 아티바 바이오테라퓨틱스에 T세포 림프종 치료제 후보물질 ‘AB-205′를 기술 수출했다.AB-205는 동종 제대혈 유래 자연살해(NK) 세포 치료제다. 이어 이수앱지스가 면역항암제 옵디보의 바이오시밀러(바이오 복제약) ‘ISU106′을 러시아 알팜에 기술 이전했다.HK이노엔도 브라질 대형 제약사 유로파마와 위식도 역류 질환 신약 ‘케이캡정’의 기술 수출 계약을 체결했다.대웅제약은 씨에스파마슈티컬스(CSP)와 특발성 폐섬유종 신약 ‘베르시포로신’의 중화권 기술 수출 계약을 맺은 데 이어 지난 28일에도 미국 바이오 기업 비탈리바이오에 자가면역질환 치료제 후보물질을 기술 수출했다. 차바이오텍은 지난 3월 일본 아스텔라스의 자회사인 아스텔라스 재생의학센터(AIRM)와 기술 이전 계약을 체결하고AIRM에 망막색소상피세포(RPE)·배아세포 기술을 이전한다.올 1분기 최대 규모의 기술 수출 기업은 바이오오케스트라다. 한국제약바이오협회에 따르면 바이오오케스트라는 다국적 제약사와 최대 약 1조1050억원 규모의 기술 이전 계약을 체결했다.
2022-12-13,[경제계 인사] 삼성생명 외,▲삼성생명▷부사장 송상진 이완삼▷상무 권영임 권웅원 김선진 김혜진 변인철 이상헌 최종충 하걸희 허정무▲삼성화재▷부사장 구영민 김준하 최재봉▷상무 김민경 김범중 김태윤 오일석 윤종호 이용복 장효정 전경은 정동진 주종혁▲삼성카드▷부사장 김태선 양덕열▷상무 김현주 장철 조혜진▲삼성증권▷부사장 이찬우▷상무 백승목 천정환 한성주▲삼성자산운용▷상무 임태혁 조성섭▲삼성글로벌리서치▷부사장 신창목 이영국▷상무 권선제 오승원 이훈 홍정우▲호텔신라▷부사장 이정호▷상무 이재완▲제일기획▷부사장 윤영석▷상무 정용화 한보현▲에스원▷부사장 문남수 박현양 조영식▷상무 김병수 김송범 소택영 전진권 한부석▲연우코리아▷대표 박상용▲에치앤지▷대표 한상복▲북경콜마▷전무 김정호▲한국콜마▷상무 김형상 박병준▷상무대우 김충원 여민혁▲콜마비앤에이치▷상무 문재민 조영주▷상무대우 최민한▲HK이노엔▷상무 진경철 최명기 박상욱▷상무대우 김우성 최성욱 최광도▲무석콜마▷상무대우 박인기
2022-09-02,제약사의 변신… ‘스포츠’로 젊은층 공략한다,"지난달 28일 강원도 ‘강릉 아이스 아레나’에서 e스포츠 리그인 ‘리그 오브 레전드 챔피언스 코리아(LCK)’ 결승전이 열렸다.LCK는 ‘LoL(리그 오브 레전드)’을 주 종목으로 하는 한국 프로 게임 리그로,LoL은 내년 항저우 아시안게임 정식 종목으로 채택될 정도로 젊은 층에서 인기가 높은 게임이다. 재미있는 것은 이 행사에 전문의약 제약사인JW중외제약이 후원을 한 것. 1만명이 모인 이날 행사장의 대형 현수막과 경기 중계 화면에는JW중외제약의 기업 로고와 인공 눈물 제품 ‘프렌즈 아이드롭’ 로고가 노출됐다.JW중외제약 관계자는 “MZ세대를 포함한 젊은 게임 팬들에게 브랜드를 알리려고LCK의 공식 후원사로 참여하게 됐다”며 “행사장에 설치된JW중외제약 부스에 약 5000명이 다녀간 것으로 추정되며 홍보 효과를 톡톡히 봤다”라고 말했다.제약사들이 고령화된 이미지를 벗고 젊은 층을 적극적으로 공략하고 있다. 젊은 세대가 즐기는 게임이나 프로스포츠 구단 후원으로 대중에게 친숙하게 다가가는 방식이다. 제약 업계 관계자는 “그동안 제약사들이 병원이나 약국 대상 제품 홍보에 주력해왔다면 이제는 브랜드 자체를 알리려 하는 것”이라며 “특히 젊은 층에게 좋은 브랜드 이미지를 쌓아 미래의 잠재적인 고객으로 끌어들이려는 것”이라고 말했다.e게임·골프·야구 활발한 후원비타민 음료 ‘비타 500′으로 유명한 광동제약은 지난해 12월 e스포츠 게임단 ‘아프리카 프릭스’와 후원 계약을 체결하며 게임단 이름을 ‘광동 프릭스’로 변경했다. 제약사 이름이 e스포츠 게임단 이름에 들어간 첫 사례다. 선수단 유니폼과 경기장에 브랜드 로고가 노출되며, 소속 게임단의 초상권 사용 권한도 광동제약이 가진다. 지난달 29일 광동 프릭스는 인기 게임 ‘배틀그라운드’ 동아시아 지역 통합 대회에서 우승을 차지하며, 선수들의 유니폼에 새겨진 광동제약 로고도 덩달아 홍보가 됐다. 중견 제약 업체 휴온스는 지난 6월 리그 오브 레전드를 포함한 4개의 게임단을 운영하는DRX와 후원계약을 맺고 다양한 마케팅을 선보일 계획이다.특히 최근 젊은 층에서 인기인 골프 후원도 활발하다. 셀트리온홀딩스는 총상금 10억원 규모의 여자골프대회 ‘셀트리온 퀸즈 마스터즈’를 열고 있고, 휴온스는 골프단을 운영 중이다. 국내 1위 제약사인 유한양행은 지난 3월 여자 골프 김민주·이연서 선수를 후원한다고 밝혔다. 이들의 모자에는 유한양행의 유산균 제품인 ‘엘레나’가 적힌다. 유한양행 관계자는 “골프가 대중화되면서 젊은 층과 더 소통하기 위해서 후원에 나선 것”이라고 말했다.젊은 층의 건강 관심이 한몫제약사들은 종목을 가리지 않고 다양한 프로스포츠 후원에 나서고 있다.HK이노엔은 프로야구단 키움 히어로즈를 후원하며 구장 내에 숙취 해소제 광고를 하고 있다. 안국약품은KT위즈 프로야구단에 건강기능식품을 후원한다. 눈 피로 개선에 도움이 되는 제품과 혈압·콜레스테롤을 관리하는 건강기능식품이다. 셀트리온은 인천유나이티드 프로 축구단을 후원한다.이런 움직임은 젊은 층의 건강에 대한 관심도 한몫했다. 원래 제약사들은 의사의 처방을 받아야 하는 전문의약품이 주력이었다. 전문의약품은 의약 전문 매체가 아닌 신문이나TV같은 대중매체에는 광고조차 못 한다. 하지만 최근 제약사들은 전문의약품뿐 아니라 건강기능식품이나 헬스케어 관련 제품을 영역을 확대하면서 브랜드 알리기에 적극 나서고 있는 것이다. 특히 기업 브랜드의 이미지를 중요시하는 젊은 층의 마음을 사로잡기 위해 스포츠나 게임 후원에 나서고 있다. 한 업계 관계자는 “제약사들이 젊은 층을 겨냥해 ‘약만 파는 회사’가 아닌 ‘종합 헬스케어 회사’라는 브랜드 이미지를 만들려는 것”이라고 말했다."
2022-06-28,"셀트리온, 코로나 치료제 개발 중단...임상환자 채우기 어려워","인천에 있는 셀트리온 본사 건물.셀트리온이 코로나 복합 치료제의 임상 3상 시험을 중단했다. 백신 접종자가 늘어난 상황에서 오미크론 변이 출현 이후 규제기관이 요구하는 임상 환자수를 채우기 어려워졌기 때문으로 해석된다.셀트리온은 “오미크론 변이 이후 급변하고 있는 글로벌 코로나19 환경에 대응하기 위해 흡입형 칵테일 항체치료제의 임상시험과 상업화 준비를 잠정 중단하기로 결정했다”고 28일 밝혔다.◇임상 환자 모집 어렵고 긴급승인 혜택 사라져셀트리온은 코로나 항체치료제 ‘렉키로나’의 흡입형에 변이 바이러스 대응력이 뛰어난 후보항체 ‘CT-P63′물질을 더한 칵테일 흡입제 치료제를 개발해 루마니아 등 일부 국가에서 임상 3상 시험계획을 승인받았다. 하지만 셀트리온은 “글로벌 규제기관들이 요구하는 임상 3상 환자 규모가 예상보다 커지고 있어 사업 타당성이 미미할 것으로 판단했다”고 밝혔다.임상 1상은 안전성, 2상에서는 효능을 확인한다. 대규모 사람을 대상으로 하는 3상을 마쳐야 정식 의약품으로 등록받을 수 있다.셀트리온은 오미크론 하위 변이의 전 세계 확산과 백신처방 확대로 코로나바이러스의 풍토병 (엔데믹)전환이 급속도로 진행되고 있어 임상시험 환자 모집이 어려워졌다고 설명했다. 또 규제기관들이 본격적인 코로나 엔데믹 진입에 발맞춰 긴급승인과 같은 ‘패스트트랙’ 절차도 없애고 있는 점도 영향을 미쳤다고 덧붙였다.셀트리온은 “이번 개발 중단에도 불구하고 코로나19 팬데믹(대유행) 현황을 면밀히 모니터링하면서, 팬데믹 초기부터 구축해온 코로나19 대응 칵테일 후보항체군에 대한 관리와 연구는 지속하겠다”고 밝혔다.◇국내 코로나 치료제, 백신 개발 중단 잇따라코로나 치료제·백신 개발을 중단한 회사는 셀트리온만이 아니다. 지금껏 30곳 이상 회사가 임상 허가를 받고 개발에 나섰지만SK바이오사이언스만 코로나 백신 허가를 앞두고 있는 실정이다.백신도 12곳이 임상시험 승인을 받았지만SK바이오사이언스만 품목 허가를 신청한 상태다.HK이노엔은 지난 5월 코로나 백신의 국내 임상시험을 중단한다고 밝혔다. 제넥신은 지난 3월 백신 개발을 포기했고, 나머지 회사들도 초기 단계인 임상 1~2상에 머물러 있다. 유바이오로직스는 3상 중이다.코로나 치료제는 19곳이 임상 승인을 받았지만GC녹십자는 혈장 치료제 개발을 일찌감치 포기했고, 부광약품·일양약품 등도 먹는 치료제 개발을 중단했다. 큐리언트도 남아프리카공화국에서 진행하던 임상 2상을 지난 2월 중단했다. 식약처로부터 판매 승인을 받은 셀트리온 항체 치료제는 변이에 효과가 떨어진다는 이유로 국내 공급이 중단됐다.업계에서는 “제약·바이오 업체들이 코로나 치료제, 백신 개발로 주가를 띄우다가 상황이 바뀌자 잇따라 개발을 중단해 업계 전체 신뢰만 떨어뜨렸다”고 지적한다."
2024-09-06,술은 덜 마시는데 숙취해소제는 더 먹는다…K-주당 새 트렌드 [비크닉],"b.트렌드트렌드는 같은 시대를 살아가는 사람들의 욕망과 가치를 반영합니다. 예측할 수 없는 미래의 모호함을 밝히는 한줄기 단서가 되기도 하고요. 비크닉이 흘러가는 유행 속에서 의미 있는 트렌드를 건져 올립니다.서울 중구에 있는 한 편의점 계산대 앞에 진열된 숙취해소제. 사진 최승이편의점 계산대 앞에 놓인 상품을 보면 최근 소비의 흐름을 엿볼 수 있다. 과거엔 남녀노소 쉽게 살 만한 껌이나 사탕이 주를 이뤘다면 요즘은 변화가 눈에 띈다. 주당들을 겨냥한 숙취해소제가, 그것도 젤리부터 환까지 가지각색의 형태로 경쟁 중이다.목 좋은 자리에 위치한 만큼 판매도 날개를 달았다. 숙취해소제는 주로 편의점에서 소비(61%)되는데, 편의점 3사 매출은 코로나 회복 이후 33~50%가량 크게 늘었다(롯데멤버스 리서치플랫폼 ‘라임’·편의점 3사 조사).그래픽 박현아 디자이너전체 시장 규모 역시 커지고 있다. 시장조사기업 닐슨아이큐코리아 조사 결과, 지난해 시장 규모는 약 3500억원으로, 2019년 대비 약 30% 늘었다. 글로벌마켓인사이트(GMI)도 전세계 숙취해소제 시장 규모가 2022년 약 19억 달러(약 2조 5000억원)에서 2032년까지 약 68억 달러(약 9조원)로 커질 것이라고 예측했다.실제로 국내 주요 제조사의 매출도 늘고 있다.HK이노엔의 ‘컨디션’ 제품 매출은 2021년 390억원에서 2023년 620억원으로, 동아제약의 ‘모닝케어’는 같은 기간 75억원에서 95억원, 한독의 ‘레디큐’는 45억원에서 77억원으로 늘었다.그래픽 박현아 디자이너주목할 점은 숙취해소제 시장에 비례해 술 소비량도 늘어난 건 아니라는 점이다. 한국 1인당 주류 소비량은 2015년 이후 꾸준히 감소하고 있고, 코로나 이후 회복을 기대했던 주류 시장의 성장은 오히려 주춤하다. 국내 주류 3사의 주류 부문 매출은 소폭 늘었지만, 영업이익은 떨어졌다. 또 국내 주류 출고량도 줄었다. 국가통계포털 ‘e-나라지표’를 보면, 지난해 주류 출고량은 약 362만㎘로, 2022년도에 비해 약 2만㎘ 줄었다. 코로나 확산 이전인 2019년 출고량(384만㎘)도 회복하지 못했다.그래픽 박현아 디자이너그렇다면 술은 덜 마시면서 숙취해소제를 더 찾는 이유는 무엇일까. 일단 코로나 이후 젊은 세대를 중심으로 음주 문화가 달라졌기 때문이다. ‘부어라 마셔라’의 시대를 지나, 술을 적당히 즐기면서 건강을 유지하려는 ‘소버 라이프(SoberLife)’가 새로운 음주 트렌드가 됐다. 이은희 인하대 교수(소비자학)는 “요즘 젊은 세대는 회식을 기피하는 등 술자리를 자제하면서도 술을 마시더라도 건강을 챙기는 패턴을 보이는 점이 숙취해소제 시장 성장 요인”이라고 짚었다.이 소버 라이프를 이끄는 건 20·30세대다. 코리아리서치인터내셔널의 ‘키위서베이’ 조사에 따르면, 숙취해소제를 먹느냐는 질문에 20대의 53.5%, 30대 45.5%가 ‘그렇다’라고 답했다. 반면 50대는 39.4% 수준이었다. 롯데멤버스 조사에서도 숙취해소제 복용 경험을 묻는 말에 ‘주로 복용하는 편’이라고 답한 20대는 16%, 30대 15%로 나타났지만, 50대 이상은 5.3%에 그쳤다.CU편의점 내 숙취해소제 매출을 봐도 20·30세대가 전체 52.5%를 차지한다.출처: 키위서베이소비자에 맞춰 제품 형태도 다양해지고 있다. 기존 음료 형태 대신 환이나 젤리류 등 비음료형 상품이 크게 늘었다. 병 음료와 달리 간편하게 섭취할 수 있어서다. 동국제약은 지난 7월 입안에서 녹여 먹는 필름 제형의 ‘이지스마트’를 냈고, 종근당은 지난해 12월 스틱형 젤리 타입의 ‘깨노니’를 선보이면서 경쟁에 나섰다. 삼양사의 ‘상쾌환’,한독의 ‘레디튜 스틱’ 등도 추세에 동참했다. 박지혜HK이노엔 음료BM팀장은 “최근 타깃 고객을 25·35세대로 넓혔다”며 “휴대성과 맛을 중시하는 젊은 세대 니즈에 맞춰 비음료형 숙취해소제를 마케팅하고 있다”고 말했다.HK이노엔의 경우 2022년 ‘컨디션 스틱’ 신제품 발표 이후 비음료형 숙취해소제 매출이 23%에서 지난해 32%로 늘었다.HK이노엔은 2022년 컨디션 스틱 제품 발표 이후 비음료형 숙취해소제 매출이 23%에서 지난해 32%로 늘었다고 밝혔다. 사진HK이노엔한편 숙취해소제 시장이 빠르게 성장하고 있는 만큼 규제의 움직임도 보인다. 식약처는 지난해 6월 ‘숙취해소 표시·광고 실증을 위한 인체적용시험 가이드라인’을 발표했다. 내년 1월 1일부터 제품에 ‘숙취해소’라는 명칭을 쓰거나 광고하려면 인체 적용 시험 등을 거친 자료를 바탕으로 한국식품산업협의의 심의를 받아야 한다. 이에 제조사들도 발 빠르게 준비 중이다. 박 팀장은 “컨디션 제품은 이미 인체적용시험을 마쳤고, 다른 제품들도 연내 마칠 예정”이라고 했고, 동국 제약 관계자 역시 “신제품 이지스마트는 식약처 가이드라인을 충족한다”고 전했다."
