date,title,content
2022-03-04,관절염 치료제가 중증 코로나 잡는다...세계 최대 임상시험서 입증,"[사이언스샷]코로나 바이러스 이미지. 영국이 진행한 세계 최대 규모 임상시험에서 류머티즘 관절염 치료제가 중증 코로나 환자의 사망률을 더 줄일 수 있다는 임상시험 결과가 나왔다./Recoverytrial세계 최대 규모로 진행된 임상시험에서 관절염 치료제가 중증 코로나 환자의 사망률을 줄일 수 있다는 연구 결과가 나왔다. 이 약은 이미 국내외 의료 현장에서 코로나 환자 치료에 쓰고 있지만, 대규모 임상시험으로 약효가 검증되면서 처방이 더 늘 것으로 기대된다.영국 국립보건서비스(NHS)는 “코로나 치료제 무작위 평가 시험인 ‘리커버리 임상시험(Recoverytrial)’에서 먹는 류머티즘 관절염 치료제인 ‘바리시티닙(baricitinib)’이 코로나 입원 환자의 사망률을 13%까지 줄이는 것으로 나타났다”고 3일(현지 시각) 밝혔다. 연구 결과는 의학논문 사전 출판사이트인 메드아카이브에 공개됐다.리커버리 임상시험은 2020년부터 4만7000여명의 코로나 입원 환자를 대상으로 시판 중인 약물의 코로나 치료 효과를 알아보고 있다. 영국 전역 병원은 물론, 남아프리카공화국·가나·베트남·인도네시아·네팔 병원까지 참여했다.중증 코로나 환자의 사망률을 줄이는 효과가 확인된 바리시티닙은 미국 일라이 릴리가 류머티즘 관절염 치료제인 올루미언트로 판매하고 있다./Recoverytrial기존 약과 병용, 사망률 13% 더 낮춰바리시티닙은 인체 면역체계가 과도하게 작용해 정상세포까지 공격하는 것을 막는 약이다. 인체에서 야누스 인산화 효소를 억제해 과도한 면역반응을 조절한다. 이번 임상시험을 이끈 영국 옥스퍼드대의 마틴 랜드레이 교수는 “의사들이 현재 처방하고 있는 약에 바리시티닙을 추가하면 효과가 있다”고 밝혔다.연구진은 스테로이드 염증 치료제인 ‘덱사메타손(dexamethasone)’과 같은 기존 코로나 치료제에 바리시티닙을 추가하면 치료효과가 더 커지는 것을 확인했다. 코로나 입원 환자 4148명은 기존에 쓰던 약에 바리시티닙을 추가했고, 4008명은 기존 치료제만 적용했다. 그 결과 바리시티닙을 복용한 환자는 28일 후 12%에 해당하는 513명이 사망했고, 기존 치료제만 쓴 환자는 14%인 546명이 사망했다.전문가들은 이번 임상 결과가 코로나 환자 치료에 큰 도움을 줄 것이라고 평가했다. 미국 에모리 의대의 보구마 티탄지 박사는 “코로나 대유행이 끝나려면 아직 멀었고 앞으로도 환자 급증과 싸워야 한다”며 “바라시티닙으로 사망률을 더 줄일 수 있다면 고무적인 일”이라고 밝혔다.이전에도 바리시티닙이 코로나 치료에 효과가 있다는 소규모 임상시험 결과들이 나왔다. 연구진은 이번 대규모 임상시험과 앞서 8건의 임상시험까지 합치면 바리시티닙과 같은 야누스 인산화효소 억제제가 코로나 입원 환자의 사망률을 20% 줄일 수 있다고 밝혔다.앞서 중증 코로나 환자에 효과가 있는 것으로 확인된 류머티즘 관절염 치료제 토실리주맙. 스위스 로슈가 '악템라'라는 이름으로 판매하고 있다./Recoverytrial중증 코로나 치료 삼총사 완성리커버리 임상시험은 그동안 코로나 환자 치료에 획기적인 기여를 했다. 2020년 6월에는 코로나 입원 환자 6400여명을 대상으로 한 임상시험을 통해 염증 치료제인 덱사메타손이 인공호흡기를 쓰는 중증 환자의 사망을 최대 3분의 1 감소시키는 효과를 확인했다. 2021년 2월에는 덱사메타손 복용 환자에 류머티즘 관절염 치료제인 ‘토실리주맙(tocilizumab)’을 추가하면 중증 환자의 사망을 더 줄일 수 있다는 결과가 나왔다.옥스퍼드대의 랜드레이 교수는 “바리시티닙은 토실리주맙만큼 효과가 있다”고 밝혔다. 이제 중증 코로나 환자를 살릴 치료제 3총사가 완성된 셈이다. 최근 나온 미국 화이자의 항바이러스 코로나 치료제인 팍스로비드는 증상 발현 후 5일 이내 복용해야 효과가 있는 약이어서 중증 환자 치료에는 쓰지 않는다.중증 코로나 치료제 3가지는 모두 국내 의료 현장에서 쓰고 있다. 항바이러스제인 렘데시비르와 병용한다. 이번에 대규모 임상시험을 통해 약효가 입증돼 중증 코로나 환자 치료 현장에 더 많이 보급될 것으로 기대된다.세 가지 약은 모두 국내에서 판매되고 있다. 덱사메타손은 1957년 개발된 약으로 신일제약, 부광약품, 대원제약, 유한양행, 경동제약이 복제약을 생산하거나 판매 중이다. 화일약품은 덱사메타손 원료를 제조하는 업체다.스위스 로슈는 토실리주맙으로 류머티즘 관절염 치료제 ‘악템라’를 개발했다.JW중외제약이 국내 판권을 갖고 있다. 미국 식품의약국(FDA)은 지난해 6월 토실리주맙을 2세 이상 중증 코로나 환자에 쓸 수 있도록 허가했다.바리시티닙은 미국 일라이 릴리의 류머티즘 관절염 치료제인 ‘올루미언트’ 성분으로, 국내에서는 종근당이 판매하고 있다. 지난해 7월 미국FDA는 올루미언트를 코로나 단독 치료제로 승인했다."
2022-02-09,"이종호·현수환·정병표, 제3회 약업대상","이종호JW중외제약 명예회장과 정병표 전 대한약사회 총회의장, 현수환 동원약품 회장이 제3회 대한민국 약업대상 수상자로 선정됐다. 이 상은 대한약사회·한국제약바이오협회·한국의약품유통협회가 선정, 시상한다.이종호JW중외제약 명예회장현수환 ㈜동원약품 회장정병표 전 대한약사회 총회의장"
2022-03-22,"이종호 JW그룹 명예회장, 제3회 대한민국 약업대상 수상","이종호JW그룹 명예회장이종호JW그룹 명예회장이 ‘제3회 대한민국 약업대상’ 제약바이오 부문에서 수상했다.한국제약바이오협회는 22일 서울 서초구 제약회관에서 ‘제3회 대한민국 약업대상’ 제약바이오 부문 시상식을 열고 이종호 명예회장에게 상패와 부상을 수여했다고 밝혔다.제약바이오 부문에 선정된 이종호JW그룹 명예회장은 1969년 국내 최초이자 세계에서 두 번째로 합성 항생제 ‘리지노마이신’을 개발, 1973년 12월 영국약전에 수록되며 세계적으로 이름을 알렸다. 또 수액사업에 대한 지속적인 투자와 혁신의 결실로 2019년 자체 개발한 3체임버 종합영양수액 ‘위너프’ 완제품을 아시아권 제약사 최초로 유럽 시장에 수출하는 등 제약산업 발전에 기여한 공로를 인정받았다.이종호 명예회장은 “약업계를 대표하는 큰 상을 받게 된 것을 영광스럽게 생각한다”며 “앞으로도 우수한 인재육성과 적극적인 R&D 투자를 통해 지속 가능한 산업으로의 성장을 기대한다”고 말했다.한편 협회는 이날 시상식에 앞서 지난달 제77회 정기총회에서의 포상자 명단도 공개했다. 공로패는 이정희 유한양행 의장이 수상했으며, 보건복지부장관 표창에 ▲곽소연 일동제약 부장 ▲박중현 한미약품 전무 ▲오봉근 스위스 바젤투자청 한국대표 ▲공병준 유한양행 이사 ▲윤봉수 한국제약바이오협회 팀장, 식품의약품안전처장 표창에 ▲이계완 동국제약 소장 ▲김한곤 유한양행 팀장 ▲박상용SK바이오사이언스 매니저 ▲최재호 대원제약 부장 ▲이준희 보령홀딩스 상무 등이 이름을 올렸다.국회보건복지위원장 표창은 ▲박현진 대웅제약 본부장 ▲권송상 큐엘파마 부사장 ▲엄민상LG화학 책임 ▲유정재JW중외제약 부장 ▲한상현 동아제약 팀장이, 한국보건산업진흥원장 표창은 ▲강기훈 유한양행 과장 ▲강재구 코오롱제약 과장 ▲성기엽 동아쏘시오홀딩스 팀장 ▲박진하 한림제약 상무 ▲이도연 일동제약 상무, 한국제약바이오협회장 표창은 ▲김성진 경희대학교 교수 ▲이상우 제주대학교 교수 ▲김정민 아이이노 이사 ▲윤지희 한독 대리 ▲진창현SK바이오사이언스 팀장 ▲서지노 식품의약품안전처 연구원이 각각 수상했다."
2023-03-27,"JW중외제약, 혁신 탈모치료제 ‘JW0061’ 해외 첫 특허 등록","[중앙포토]JW중외제약은 체내 신호전달계의 일종인Wnt(윈트) 기반 표적 탈모 치료제 ‘JW0061’에 대해 러시아 특허청으로부터 특허를 취득했다고 27일 밝혔다. 이번 특허는Wnt신호전달 경로 기반의 탈모 치료제 신약 후보물질에 관한 것이다. ‘JW0061’의 물질 특허가 등록된 건 이번이 처음이다. 현재 한국을 비롯해 미국·유럽·일본·중국 등 10여 개국에서도 특허가 출원된 상태다.JW0061은 피부와 모낭 줄기세포에 있는Wnt신호전달 경로를 활성화해 모낭 증식과 모발 재생을 촉진하는 혁신 신약(First-in-Class) 후보물질이다. 안드로겐성 탈모증이나 원형 탈모증 등 다양한 탈모 증상에 효과적이고, 예방 효과도 우수할 것으로 기대된다.JW중외제약은 내년 상반기JW0061의 임상시험 개시를 목표로 하고 있다.JW중외제약 측은 “JW0061을 기존 탈모 치료제를 보완, 대체하는 새로운 혁신 신약으로 개발할 계획”이라고 말했다."
2024-07-22,"‘우간다 백발의사’ 유덕종 교수, 올해 JW성천상 수상자 선정","‘2024JW성천상 수상자’로 선정된 유덕종 에티오피아 세인트폴병원 밀레니엄 의과대학 교수. 사진JW홀딩스30여 년간 아프리카 의료 환경 개선과 현지 의료인 양성에 힘써온 유덕종(64) 에티오피아 세인트폴병원 밀레니엄 의과대학 교수가 올해JW성천상 수상자로 선정됐다.JW중외제약의 공익재단인JW이종호재단은 제12회JW성천상 수상자로 유 교수를 선정했다고 22일 밝혔다.JW성천상은 지난 2012년 고(故) 이종호 명예회장이JW중외제약의 창업자인 성천 이기석 선생의 ‘생명존중’ 정신과 철학을 계승·발전시키기 위해 제정했다. 인류의 복지 증진을 위해 음지에서 묵묵히 헌신·공헌하며 사회에 귀감이 되는 의료인을 발굴하고, 이를 통해 생명존중의 중요성을 널리 알리기 위한 취지다.중·고등학교 시절부터 슈바이처처럼 아프리카 의료 선교의 꿈을 키워온 유 교수는 30년 이상 우간다, 에스와티니(옛 스와질란드), 에티오피아 등에서 의료 활동을 해왔다. 1984년 경북대학교 의과대학을 졸업하고 내과에서 전공의 과정을 마친 유 교수는 1992년 한국국제협력단(KOICA) 1기 정부 파견 의사로 우간다 마케레레대학교 부속병원인 물라고병원에서 첫 근무를 시작했다.후천성면역결핍증(AIDS)으로 인한 합병증 환자 치료에 집중하던 그는 항생제, 수액뿐 아니라 혈압계, 체온계 등 기본 진단 장비도 부족한 낙후된 환경 속에서 체계적인 의료 시스템 도입을 추진했다. 2002년 우간다 수도 캄팔라에 베데스다 클리닉을 개원한 이 교수는 난민촌과 도서지역 등을 방문하며 무료 진료를 시행했다.2005년에는 물라고병원에 호흡기내과를 창설해 환자를 진료하며 의료진 양성에도 힘썼다. 2015년 에스와티니 기독대학에서 의대 설립 학장으로 활동하며 의대 교육과정을 구성하는 데 일조했다. 2016년에는 에티오피아 짐마대학병원에서 8년간 근무하며 에티오피아, 케냐, 우간다에서 무료로 환자를 진료하고 의학 기기를 기증하는 '코리아 에이드(KoreaAid)' 프로그램에 참여했다. 올해 3월부터는 에티오피아 수도 아디스아바바에 있는 세인트폴병원 밀레니엄 의과대학 호흡기 병동에서 환자를 진료하며 의료인 교육을 병행하고 있다.이성낙JW성천상위원회 위원장(가천의대 명예총장)은 “다양한 지역에서 현지 의료 시스템 개선과 의료인 양성을 이어가며 생명존중 정신을 계승하는 이 교수가JW성천상 제정 취지에 적합하다고 판단해 수상자로 선정했다”고 말했다. 올해JW성천상 시상식은 오는 9월 25일 경기도 과천시 소재JW사옥에서 열릴 예정이다."
2023-05-01,이종호 JW그룹 명예회장 별세…중외제약 신약 개발 이끌어,"이종호이종호(사진)JW그룹 명예회장이 30일 90세에 노환으로 별세했다. 고(故) 이종호 명예회장은 1945년 조선중외제약소(JW중외제약 전신)를 창립한 부친의 차남으로 1966년부터 회사 경영에 본격적으로 참여했다. 고인은 수액 산업을 키운 주역으로 1983년 중앙연구소 설립을 주도했다. 이후JW그룹은 국내 최초로 임상 3상 신약 1호 항생제 ‘큐록신’ 허가를 얻는 성과를 냈다. 고인의 장례는JW그룹 회사장으로 세브란스병원 장례식장에서 치러진다. 발인은 5월 3일 오전 7시, 장지는 경기 연천군 중면 횡산리 선영이다."
2022-04-04,제30회 JW중외박애상에 박상은 안양샘병원 미션원장,"박상은 효산의료재단 안양샘병원 미션원장이 제30회JW중외박애상 수상자에 선정됐다.JW중외박애상은 사회에서 박애정신을 구현하고 있는 의료인을 발굴하기 위해JW중외제약과 대한병원협회가 함께 제정한 상이다.박상은 안양샘병원 미션원장.JW중외제약 제공4일JW중외제약에 따르면 박 미션원장은 2001년 안양샘병원에 부임한 이후 병원장, 대표원장, 미션원장을 역임하며 의료 취약계층을 돕는 일에 앞장 선 공로를 인정 받았다.그는 2001년 '샘글로벌봉사단'을 설립해 소외 이웃을 위한 찾아가는 진료 봉사하고 있다. 봉사단은 매년 외국인 근로자 1000명에게 무료로 주말 진료를 하고 있다.2007년 사단법인 아프리카미래재단을 설립해 아프리카 극빈지역을 돌며 에이즈 예방사업, 영양강화사업 등도 진행했다.JW중외박애상과 함께 수여하는JW중외봉사상 수상자엔 선우성 울산의대 서울아산병원 교수, 양세원 서울대학병원 소아청소년과 명예진료교수가 선정됐다. 시상식은 오는 8일 오후 3시 30분 서울드래곤시티 호텔에서 열린다."
2023-02-20,이제 신약 개발도 AI 시대…‘물질’ 발굴부터 ‘합성'까지 뚝딱,"JW중외제약은 최근 독일 머크 라이프사이언스(머크)와 인공지능(AI)을 활용한 신약의 원료의약품 연구개발 업무협약을 체결했다. 머크는 신약 개발 초기 단계에서 화학 물질 합성방법을 빠르고 정확하게 분석·제시하는AI인 ‘신시아’를 보유한 글로벌 기업이다. 국내 제약사 중 머크의 신시아를 적용한 곳은JW중외제약이 처음이다.JW중외제약 측은 20일 이에 대해 “그동안 신약 연구에 집중됐던AI적용 분야를 원료합성 연구로 확대했다는 데 의의가 있다”고 설명했다. 신약 연구가 특정 질환에 대한 신약 물질 화합물(분자구조)을 찾는 과정이라면, 원료합성 연구는 이보다 한 걸음 더 나아가 신약 물질을 정제나 주사제로 만들어 내는 과정을 뜻한다.AI이미지. [중앙포토]━AI신약 개발 시장 2027년 40억 달러4차 산업혁명과 코로나19 팬데믹으로 촉발된 디지털 전환(DX) 흐름이 산업계 전반으로 확산하고 있다. 특히 최근 챗GPT이용자 폭증에서 보듯 일상에서AI활용은 대세가 되고 있다. 신약 개발 분야에도AI가 적극적으로 활용되고 있다. 한국과학기술정보연구원에 따르면AI신약 개발 시장 규모는 지난 2021년 4억 달러(약 5200억원)에서 2027년 40억 달러에 이를 전망이다.신약 개발 과정에서AI적용의 효과는 뚜렷하다. 통상 수만 가지 화합물을 일일이 찾고, 이를 실험용 약으로 만들어 임상 단계에 올릴 최종 신약 후보물질로 발굴하는 데는 5년 이상 걸리는 게 일반적이었다. 여기에AI플랫폼을 적용해 소요 시간과 비용을 줄이는 식이다.성과도 나오고 있다. 외신 등에 따르면, 홍콩 소재AI신약 개발업체인 인실리코메디신이 최근 자체 발굴한 특발성 폐섬유증(IPF) 약물 후보물질(INS018-055)의 임상 1상 결과 안전성에 별다른 문제가 없었다.AI가 이 물질을 찾는 데는 46일이 걸렸다. 일반적인 경우 신약 후보물질 발굴에만 평균 5년가량 소요된다.JW중외제약과 대웅제약, 유한양행 등 제약사들이 자체적으로AI기술을 도입하거나 국내·외 전문 기업과 협업해AI신약 개발에 적극 참여하는 이유다.━신약 개발AI적용 범위도 넓어져JW중외제약이 지난달 독일 머크 라이프사이언스와AI를 이용한 신약의 원료의약품 연구개발을 위한 업무협약을 체결했다. 진세호JW중외제약 원료연구센터장(왼쪽)과 이남구 머크 사이언스 앤 랩 솔루션 비즈니스 대표가 업무협약서에 서명하고 있다. [사진JW중외제약]신약 개발에 있어AI적용 영역도 꾸준히 넓어지고 있다. 기존 신약 연구에 있어서AI적용은 신약 후보물질, 즉 ‘단백질 구조(화합물)’를 찾거나, 기존 신약 후보물질이 다른 질환에도 효과(적응증)가 있는지를 알아보는 데에 집중됐었다.최근에는 신약 후보물질을 실제 원료로 만드는 ‘합성연구’로 활용 범위가 확대되고 있다. 일부 제약사들은 원료합성 업무를 24시간 로봇이 하는 환경도 구축하고 있다. 그동안 실제 합성 작업은 대부분 연구원의 손에 의존했으나 로봇이 이를 대체하는 ‘무인 랩’ 환경이 가능해지는 것이다. 이를 통해 관련 연구 기간이 획기적으로 단축될 것이란 기대다. 또 로봇이 단순·반복적인 합성 작업을 진행하는 동안 연구원은 합성 전략 수립 등 보다 고차원적이고 효율적인 연구에 집중할 수 있을 것으로 제약 업계는 보고 있다."
2023-04-12,심장병 환자 1만4000명 살렸다…게다가 한푼도 안 받은 의사,"JW중외제약은 제31회JW중외박애상 수상자로 박진식(53·사진) 혜원의료재단 세종병원 이사장을 선정했다고 12일 밝혔다.JW중외박애상은 사회에서 박애 정신을 구현하고 있는 의료인을 발굴하기 위해JW중외제약과 대한병원협회가 공동으로 제정한 상이다.박 이사장은 1995년 서울대 의과대학을 졸업하고 2008년부터 부천세종병원에 재직 중이다. 기획실장과 전략기획본부장, 병원장 등을 차례로 지냈다. 그는 ‘심장병 없는 세상을 위하여’라는 병원 설립 이념을 바탕으로 경제적 어려움으로 인해 제대로 치료받지 못하는 국내·외 심장병 환자들에게 새 삶을 선사하는 데 앞장섰다.박진식 혜원의료재단 세종병원 이사장. [사진JW중외제약]부천세종병원은 박 이사장을 비롯한 의료진의 나눔 실천을 통해 1983년 개원 이후 올해 2월까지 국내 1만2788명의 심장병 환자들을 대상으로 무료 수술을 시행했다. 같은 기간 중국과 베트남, 캄보디아 등 아시아 및 저개발 국가들을 대상으로 심장병 환아 무료 수술도 지원했다. 해외 어린이 무료 수술 건수는 1605건이다. 민간병원으로서는 최장 기간, 최다 환자 기록이다. 국내·외를 합쳐 총 1만4393명의 심장병 환자가 새 생명을 얻은 셈이다.박 이사장은 아시아 및 저개발 국가 의료진을 대상으로 연수 프로그램을 운영하는 등 선진 심혈관 질환 진단과 치료법도 전파 중이다. 현재까지 해외 의료진 200여 명이 연수에 참여했다. 또 50여 개 해외 의료기관과 협력관계를 맺었다.한편 이경원 경상국립대병원 교수와 권준덕 영서의료재단 아산충무병원 행정원장이JW중외봉사상 수상자로는 선정됐다. 시상식은 오는 14일 서울 소공동 롯데호텔에서 열린다."
2023-04-19,3㎝ 열대어가 사람과 80% 동일? 화이자도 나선 신약 개발법,"JW중외제약은 최근 열대어인 제브라피시(ZebraFish) 모델 전문 임상시험기관인 제핏과 업무협약(MOU)을 맺었다. 이에 따라JW중외제약은 앞으로 신약을 개발할 때 제브라피시를 비임상 시험(동물실험)에 사용할 계획이다.제브라피시는 열대어류로 사람과 유전적 구조가 80% 이상 동일하다. 또 시험비용을 포유류 대비 10분의 1 수준으로 낮출 수 있다. 신준녕 제핏 대표는 18일 “최근 미국 식품의약처(FDA) 및 각국 규제기관을 중심으로 제브라피시에 대한 관심도가 높아지고 있다”고 전했다.제브라피시를 활용해 비임상 시험(동물실험) 중인 제핏의 연구진. 열대어류인 제브라피시는 인간과 유전적 구조가 80% 이상 동일하다. [사진 제핏]K제약·바이오 업체들이 동물실험은 최소화하는 동시에 신약 개발 속도 높이기에 한창이다. 제브라피시를 비임상 시험에 사용하는 게 대표적이다. 그간 신약 개발 과정에서 동물실험은 필수로 여겨졌다. 동물실험을 통과한 약물이 사람을 대상으로 한 임상시험에 쓰인다.하지만 최근 분위기가 달라지고 있다. 동물실험에 성공한 약물 중 평균 9개는 정작 임상시험에서 실패해 동물실험 효과에 대한 비판이 제기돼 온 데다, 올해 1월 미국 정부가 연방 식품의약화장품법을 개정해 제브라피시 등 다양한 플랫폼에서 나온 연구 결과가 실제 약물 승인에 쓰일 수 있도록 하면서다.글로벌 제약업체들(빅 파마)은 이미 제브라피시를 폭넓게 사용 중이다. 노바티스나 화이자, 로슈 등이 대표적이다. 이들은 주로 약물 유효성과 안전성 검증 과정에서 제브라피시를 사용한다. 제약 업계 관계자는 “제브라피시는 성체가 3~4㎝ 정도로, 적은 약물로도 실험 결과를 신속히 낼 수 있어 연구 기간 단축에도 도움을 준다”고 말했다.━미니 장기 활용도 부상‘미니 장기’ ‘장기 유사체’라고 불리는 오가노이드(Organoid) 역시 동물실험 대체 유망주로 꼽힌다. 오가노이드는 줄기세포를 사람의 장기와 유사한 구조로 배양하거나 재조합해 만든다. 환자 개개인의 장기 조직뿐 아니라 이들의 구조·기능적 특이성도 재현할 수 있다. 동물실험을 대체하는 것은 물론 직접 사람을 대상으로 한 임상시험을 하지 않고도 결과를 어느 정도 예측할 수 있다.이런 장점 덕에 관련 시장도 빠르게 커지고 있다. 국가생명공학정책연구센터에 따르면 2019년 6억9000만 달러(약 9100억원) 수준이던 글로벌 오가노이드 시장은 오는 2027년 34억2000만 달러(약 45조8100억원) 규모로 연평균 22%씩 성장할 전망이다.사람의 줄기세포를 활용해 만드는 '장기 유사체'인 오가노이드의 발전 단계 설명. [그래픽 오가노이드사이언스]기업들도 발 빠르게 관련 투자에 나서고 있다. 오가노이드와 관련 한국콜마홀딩스는 바이오 플랫폼 기업인 넥스트앤바이오의 지분 약 40%를 보유 중이다. 오가노이드 관련 기술을 통해 신약 후보물질 효능 검증은 물론, 환자 맞춤형 항암제 개발 등에 나섰다. 씨젠의료재단도 지난해 8월부터 서울아산병원 내 스타트업인 온코클루와 오가노이드 기반 항암제 감수성 진단 검사법을 개발 중이다.GC녹십자의료재단도 지난해 8월부터 오가노이드 세포 배양 플랫폼 기술을 가진 엠비디와 손잡고 개인 맞춤형 암 치료 예후·예측 솔루션 관련 연구를 진행 중이다.박찬희JW중외제약 최고기술책임자(CTO)는 “동물실험 윤리 문제가 지속해서 불거지는 상황에서 제브라피시나 오가노이드 플랫폼을 활용한 연구는 계속 늘어날 수밖에 없다”고 말했다."
