date,title,content
2023-09-15,"살 빼주고, 모발 지켜주고…돈 쓸어담는 ‘해피 드러그’","덴마크 제약사 노보노디스크의 올해 2분기 매출은 전년 대비 약 32% 성장한 543억 크로네(약 10조6400억원)다. 이중 비만 치료제 매출은 103억 크로네로 전체의 19%다.미국 뉴욕거래소에 상장된 이 회사 주가는 13일(현지시간) 종가 기준 192.63달러, 시가총액은 6662억 달러(약 883조원)에 이른다. 비만 치료제 ‘위고비’의 인기에 힘입어 올해 들어 40% 이상 올랐다. 덕분에 루이뷔통모에헤네시(LVMH)를 제치고 유럽에서 시가총액이 가장 큰 기업이 됐다.정근영 디자이너‘해피 드러그(HappyDrug)’가 주목받고 있다. 해피 드러그는 비만이나 탈모 치료제처럼 삶의 질을 높여주는 약이다. 특정 질환에 대한 치료약과 달리 시장 확장성이 크다는 게 강점이다. 이날 제약 업계에 따르면 글로벌 비만 환자는 6억5000만 명에 이른다. 투자은행 모건스탠리는 비만 치료제 시장이 2030년 540억 달러(약 71조5900억원) 규모에 이를 것으로 내다봤다.최근 가장 주목받는 해피 드러그는 2021년 출시된 위고비다. 약을 만든 노보노디스크는 이미 비만 치료제 ‘삭센다’를 무기로 비만 치료제 시장의 절대 강자로 군림하고 있었다. 두 약품 모두GLP-1(글루카곤 유사 펩타이드-1)이라는 호르몬에 작용한다. 삭센다는 매일 한 번 주사를 맞아야 하지만, 위고비는 주 1회만 맞으면 된다.유명인들의 ‘경험담’도 인기를 부채질했다. 일론 머스크 테슬라 창업자가SNS를 통해 다이어트 성공 비결로 위고비를 언급한 게 대표적이다. 덕분에 월 4회 기준 최저 1300달러(약 172만원)라는 높은 가격에도 없어서 못 팔 정도다.노보 노디스크 주가미국 일라이릴리도 당뇨·비만 치료제인 ‘마운자로’의 선전 덕에 올해 2분기 전년 대비 28% 증가한 83억1200만 달러(약 11조217억원)의 매출을 올렸다. 이 중 비만 치료제 관련 매출은 9억7970만 달러(약 1조2991억원)에 이른다.해피 드러그 열풍은 국내에서도 마찬가지다. 한미약품은 지난 7월 당뇨병 치료제로 일주일에 한 번 주사 형태로 투여하는 ‘에페글레나타이드’의 적응증을 비만으로 변경해 국내 임상3상 계획(IND)을 식품의약품안전처에 제출했다.일동제약은 식약처로부터 대사성 질환 신약후보물질 ‘ID110521156’과 관련한 임상시험용 신약(IND)과 임상1상 시험 계획을 승인받았다. 이를 토대로 제2형 당뇨병과 비만 등을 타깃으로 한 신약을 개발할 계획이다.또 다른 해피 드러그인 탈모 치료제도 부상하고 있다. 비만 치료제가 ‘빼는 데’ 주력한다면 탈모 치료제는 ‘지키는 데’ 방점이 있다. 시장조사기관인 리서치앤마켓에 따르면 전 세계 탈모 치료제 시장 규모는 2020년 35억 달러(약 4조6400억원)에서 연평균 8.4%씩 성장해 2027년에는 62억 달러(약 8조2200억원)에 이를 것이란 분석이다.전 세계 탈모 치료제 시장의 절대 강자는MSD의 ‘프로페시아’다. 여기에 일라이릴리(바리시티닙 성분)와 미국 화이자(리틀레시 성분)가 최근 미국식품의약국(FDA)으로부터 원형 탈모 적응증 허가를 획득하고 도전을 준비 중이다.국내에서는JW중외제약이 새로운 탈모 치료제 ‘JW0061’을 개발 중이다. 종근당은 장기 지속형 탈모 주사제 ‘CKD843’의 임상1상을 진행 중이다. 바이오 기업 올릭스는 탈모 부위에만 투여하는 치료제(‘OLX104C’)의 호주 임상1상에 나섰다. 제약업계 관계자는 “많은 사람이 걱정하는 질환에 제약사의 연구 역량이 집중될 것”이라고 말했다."
2023-09-14,"머스크 살 뺀 비결…한달 172만원, 없어서 못파는 '해피 드러그'","덴마크 제약사인 노보노디스크의 올해 2분기 매출은 전년 대비 약 32% 성장한 543억 크로네(약 10조6400억원)다. 이중 비만 치료제 매출은 103억 크로네로 전체의 19%다.미국 뉴욕거래소에 상장된 이 회사 주가는 13일(현지시간) 종가 기준 192.63달러, 시가총액은 6662억 달러(약 883조원)에 이른다. 비만 치료제 ‘위고비’의 인기에 힘입어 올해 들어 40% 이상 올랐다. 덕분에 루이뷔통모에헤네시(LVMH)를 제치고 유럽에서 시가총액이 가장 큰 기업이 됐다.노보 노디스크가 개발한 비만 치료제 ‘위고비’.중앙포토‘해피 드러그(HappyDrug)’가 주목받고 있다. 해피 드러그는 비만이나 탈모 치료제처럼 삶의 질을 높여주는 약이다. 특정 질환에 대한 치료약과 달리 시장 확장성이 크다는 게 강점이다. 제약 업계에 따르면 글로벌 비만 환자는 6억5000만 명에 이른다. 투자은행 모건스탠리는 비만 치료제 시장이 2030년 540억 달러(약 71조5900억원) 규모에 이를 것으로 내다봤다.━일론 머스크도 다이어트 성공 비결로 꼽아최근 가장 주목받는 해피 드러그는 2021년 출시된 위고비다. 약을 만든 노보노디스크는 이미 비만 치료제 ‘삭센다’를 무기로 비만 치료제 시장의 절대 강자로 군림하고 있었다. 두 약품 모두GLP-1(글루카곤 유사 펩타이드-1)이라는 호르몬에 작용한다. 삭센다는 매일 한 번 주사를 맞아야 하지만, 위고비는 주 1회만 맞으면 된다.유명인들의 ‘경험담’도 인기를 부채질했다. 일론 머스크 테슬라 창업자가 자신의 소셜미디어(SNS)를 통해 다이어트 성공 비결로 위고비를 언급한 게 대표적이다. 덕분에 월 4회 기준 최저 1300달러(약 172만원)라는 는 높은 가격에도 없어서 못 팔 정도다.일론 머스크는 다이어트의 비결을 '단식'과 '위고비'라고 콕 찍어 말했다. 사진 일론 머스크 트위터미국 일라이릴리도 당뇨·비만 치료제인 ‘마운자로’의 선전 덕에 올해 2분기 전년 대비 28% 증가한 83억1200만 달러(약 11조217억원)의 매출을 올렸다. 이 중 비만 치료제 관련 매출은 9억7970만 달러(약 1조2991억원)에 이른다.해피 드러그 열풍은 국내에서도 마찬가지다. 한미약품이 비만 치료제 개발에 빠르게 다가서고 있다. 한미약품은 지난 7월 당뇨병 치료제로 일주일에 한 번 주사 형태로 투여하는 ‘에페글레나타이드’의 적응증을 비만으로 변경해 국내 임상3상 임상시험 계획(IND)을 식품의약품안전처(식약처)에 제출했다. 앞서 이 회사는 기존 당뇨병 임상3상에서 에페글레나타이드가 약 5%의 체중 감소 효과를 보였다고 밝힌 바 있다.일동제약은 식약처로부터 대사성 질환 신약후보물질 ‘ID110521156’과 관련한 임상시험용 신약(IND)과 임상1상 시험 계획을 승인받았다. 이를 토대로 제2형 당뇨병과 비만 등을 타깃으로 한 신약을 개발할 계획이다.━글로벌 탈모 시장 규모도 2027년에는 8조원대또 다른 해피 드러그인 탈모 치료제도 부상하고 있다. 비만 치료제가 ‘빼는 데’ 주력한다면 탈모 치료제는 ‘지키는 데’ 방점이 있다. 시장조사기관인 리서치앤마켓에 따르면 전 세계 탈모 치료제 시장 규모는 2020년 35억 달러(약 4조6400억원)에서 연평균 8.4%씩 성장해 2027년에는 62억 달러(약 8조2200억원)에 이를 것이란 분석이다. 대한탈모치료학회는 국내 탈모 인구를 약 1000만 명으로 추산한다.미용 의료기기. 연합뉴스전 세계 탈모 치료제 시장의 절대 강자는MSD의 ‘프로페시아’다. 여기에 일라이릴리(바리시티닙 성분)와 미국 화이자(리틀레시 성분)가 최근 미국식품의약국(FDA)으로부터 원형 탈모 적응증 허가를 획득하고 도전을 준비 중이다.국내에서는JW중외제약이 새로운 작용 방식의 탈모 치료제 ‘JW0061’을 개발 중이다.JW0061은 피부와 모낭 줄기세포에 있는 세포조절물질(Wnt)의 신호전달 경로를 촉진해 모낭 증식과 모발 재생을 촉진하는 방식이다. 종근당은 장기 지속형 탈모 주사제 ‘CKD843’의 임상1상을 진행 중이다. 바이오 기업 올릭스는 기존 탈모 치료제의 부작용을 최소화하기 위해 탈모 부위에만 투여하는 치료제(‘OLX104C’)의 호주 임상1상에 나섰다.제약 업계 관계자는 “시장성이 밝은 쪽으로 신약 개발이 활발하다”며 “당뇨나 탈모, 항암 등 대부분의 사람이 걱정하는 질환으로 제약사의 연구 역량도 집중될 것”이라고 말했다."
2023-05-26,국내 업체들 ‘아토피 신약’ 개발 줄 잇는다,JW중외제약은 아토피 피부염을 치료하는 신약 후보 물질인 ‘JW1601’을 개발 중이다. 기존과 달리 먹을 수 있는 약(경구 제형)이다.아토피 피부염의 주요 증상인 염증뿐 아니라 가려움증도 억제한다. 기술력도 인정받았다. 피부질환 전문 글로벌 제약사인 덴마크 레오 파마에 총 4억200만 달러에 기술 수출돼 현재 글로벌 임상이 진행 중이다.LG화학 역시 아토피 피부염 치료제 후보 물질인 ‘LC510255’를 중국과 한국에서 임상2상을 진행 중이다. 과민성 면역 기능 조정 단백질의 발현을 촉진하는 신약이다.아토피 피부염(아토피) 정복을 위한 국내 제약·바이오 기업들의 움직임이 빨라지고 있다. 국내 아토피 환자는 100만 명에 이른다. 전 세계에 1억 명 이상의 아토피 환자가 있을 것이란 추산도 나온다. 관련 치료제 시장도 꾸준히 성장하고 있다.시장조사기관인 글로벌데이터는 미국과 일본 등 G7 국가의 아토피 치료제 시장 규모는 내년 73억 달러 규모(약 9조6300억원)에 이를 것이라고 전망한다. 국내 시장만 봐도 한 해 5000억원 규모에 이른다.국내 업체들은 기존 글로벌 신약의 틈새를 효과적으로 공략 중이다.HK이노엔은 지난 3월 아토피 치료제인 ‘IN-A002’의 국내 임상 1상에 착수했다. 강스템바이오텍은 줄기세포 치료제로 아토피 치료제 개발에 나섰다. 업계에선 ‘퓨어스템-에이디주’에 대한 임상 3상이 조만간 마무리될 것이라고 전망한다. 이 회사는 지난해 8월 장기 추적연구의 중간결과를 발표하면서 투약 후 약 3년까지 안전성과 유효성을 확인했다고 밝힌 바 있다.
2023-02-08,'480만원' 때문에 매주 온몸 찔린다…희귀병 한살배기 눈물,"지난해 11월 조은별(29)씨 아들 다리에 멍이 든 모습이다. 조씨의 아들은 혈우병을 앓고 있다. [조씨 제공]지난해 2월 13일 태어나 곧 돌을 앞둔 조은별(29)씨의 아들은 혈우병 환자다. 혈우병은 혈액 내 응고인자가 부족해 출혈이 생길 경우 피가 멎지 않는 희귀병이다. 통상 주기적으로 응고인자를 넣어줘야 하는데 평생 주 2~3회 혈관주사를 맞아야 한다. 조씨의 아들은 생후 8개월 때부터 병원에 다녔다. 시작은 손등이나 발등이지만 주 2회씩 주사를 맞다 보면 더 놓을 데가 없어 발목과 손목, 목에 이르기까지 혈관을 찾을 수 있는 모든 부위를 돌아가면서 주사한다.조씨는 “혈관이 안 보이니까 손으로 만져가면서 하는데 찌른 데 또 찌르고, 옆에 한 번 더 찔러보고 하면 30분 이상 걸릴 때도 있다. 이제 아이가 의사 가운을 입은 사람만 보면 경기를 일으키고 주사를 놓기 전에 알코올 솜으로 손등을 닦는 것만으로도 자지러지게 운다”고 말했다.김경화(52)씨의 아들은 올해 고등학교 2학년이 된 혈우병 환자다. 돌이 지난 후 혈우병 진단을 받아 17년째 일주일에 두 번씩 혈관주사를 맞고 있다. 중학교 때부터는 병원에 가지 않고 스스로 혈관을 찾아 주사를 놓는다. 주사 자체는 눈 감고도 놓을 수 있지만, 워낙 장기간 맞아 혈관이 가늘고 딱딱해진 게 문제다. 이제는 바늘이 잘 들어가지 않아 몇 번씩 찌른 후에야 주사를 놓을 수 있다.━신약, A형 혈우병 환자 중 10%에게만 급여 적용지난해 11월 조은별(29)씨 아들이 혈우병 치료를 위해 혈관주사를 맞고 있다. [조씨 제공]이런 혈우병 환자들이 간절히 기다리는 치료제가 있다. 한 달에 한 번만 맞으면 되는 신약 ‘헴리브라’다. A형 혈우병 환자들에게 부족한 8번 응고인자를 몸에 직접 보충해주는 기존 치료제와 달리 헴리브라는 8번 인자 작용기전을 모방하게 해 효과를 내는 치료제다. 스위스 다국적 제약사 로슈의 자회사인 일본 주가이제약이 개발했다. 무엇보다 기존 치료제처럼 혈관을 찾아야 하는 고통 없이 독감 예방접종을 하듯 피하주사로 놓을 수 있다.헴리브라는 현재 A형 혈우병 환자 중에서도 ‘항체 환자’에게만 급여가 적용되고 있다. A형 혈우병 환자는 크게 기존 치료제에 내성을 가진 ‘항체 환자’와 내성이 없는 ‘비항체 환자’로 구분된다. 기존에 맞던 정맥주사 치료제에 내성이 생겨 효과를 볼 수 없는 항체 환자들은 건강보험 적용을 받아 헴리브라를 맞을 수 있지만 비항체 환자들은 헴리브라를 맞으려면 거액의 비용을 내야 한다. 2019년 기준 국내 A형 혈우병 환자 1746명 중 비항체 환자는 1589명으로 약 91%를 차지한다.조은별씨는 “현재 기존 치료제를 투약하는 데 한 달에 150만원 정도가 들어간다. 비급여로 헴리브라를 맞을 경우 480만원이라 3배 가까이 차이가 나 맞지 못하고 있다”고 말했다. 김경화씨는 “생활이 넉넉한 집들은 아이들 고통을 덜어주기 위해 비급여로 맞거나 비항체 환자에게까지 투여가 허용되는 외국으로 이민을 가기도 한다”라며 “우린 그럴 형편이 안 돼 온 가족이 급여화가 되기만을 간절히 바라고 있다”고 말했다.━“줄넘기·태권도 가능…삶의 질 자체가 달라”배한애(38)씨의 아들(5)이 놀이기구를 타며 활짝 웃고 있다. [배씨 제공]헴리브라를 투여한 이들은 가격도 가격이지만 효과도 기존 주사제보다 좋다고 말한다. 배한애(38)씨는 혈우병 항체 환자인 5살 난 아들이 헴리브라를 투여받으면서 삶의 질 자체가 달려졌다고 했다. 배씨의 아들은 2021년 9월부터 한 달에 한 번 헴리브라를 투여받고 있다. 배씨는 “기존 혈관주사를 맞을 때는 조그만 충격에도 출혈이 잘 생겨 어린이집이나 놀이터를 다니지 못했는데 이제는 한 달에 한 번만 주사를 맞고서도 일반 아이처럼 놀러 다니고, 줄넘기나 태권도도 한다”고 말했다. 그는 “기존에는 엉덩이 출혈이 걱정돼 의자에 앉는 것도 걱정됐는데 이제는 조그만 멍조차 들지 않으니 우리도 아이가 혈우병 환자인 걸 거의 잊은 채로 살고 있다”고 말했다.주사에 대한 공포도 줄었다고 한다. 배씨는 “치료제를 바꾼 지 1년 반이 넘었는데 아이가 병원에 가면 지금도 항상 ‘짧은 바늘(헴리브라)이야, 힘든 바늘(기존 혈관주사 치료제)이야’ 이렇게 물어본다. 짧은 바늘이라고 하면 생글생글 웃으면서 아무렇지 않게 맞곤 한다”고 말했다. 배씨는 “이미 우리 아이는 급여 적용을 받고 있지만 비항체 환자 부모들의 심경을 떠올리면 목소리를 안낼 수가 없다. 한국만 항체 환자, 비항체 환자를 나눠 급여 적용을 하는데 정부가 시간 끌기식의 검토를 멈추고 급여화에 적극 나서야 한다”고 주장했다. 미국이나 일본 등에서는 비항체 환자에 대해 급여화가 이뤄졌다.━심평원 “9일 약평위에서 논의 예정”건강보험심사평가원(심평원)은 이달 내로 헴리브라의 급여확대 여부를 두고 논의를 진행한다는 계획이다. 헴리브라를 국내에 유통하고 있는JW중외제약은 비항체 환자도 건강보험을 적용받을 수 있도록 지난 2020년 심평원에 급여를 신청했지만, 논의가 지지부진하게 이어지고 있다.심평원 관계자는 “2021년 전문가 자문회의에서 기존에 쓰고 있는 8인자 제재에 비해 헴리브라가 고가라 재정에 영향을 줄 수 있다는 점을 고려해 구체적인 급여 대상 범위나 우선순위 등을 논의할 필요가 있다는 의견이 제기됐다. 이후 임상 전문가 자문회의도 3차례 정도 진행해 검토를 이어갔다”라며 “오는 9일 있을 약제급여평가위원회에서 논의가 진행될 것으로 보인다”고 말했다. 약평위를 통과하게 되면 건강보험공단과 가격 협상을 하고 보건복지부 건강보험정책심의위원회를 거쳐 최종 약가가 고시된다."
2023-01-27,[부고] 김덕자씨 外,"▶김덕자씨 별세, 배동진씨(부산일보 서울경제팀장·한국자동차기자협회 감사) 모친상=26일 대구 경북대병원, 발인 28일 오전 9시. 053-200-6464▶김윤형씨(한국외국어대학교 명예교수) 별세, 김준범(GS칼텍스 트레이딩매니저)·범주(웰링턴 매니지먼트 홍콩 한국대표)·소현씨 부친상, 신우철씨(KB증권 전략자산운용부장) 장인상=25일 삼성서울병원, 발인 27일 오전 8시30분, 3410-3151▶박삼순씨 별세, 정보석씨(배우) 모친상=26일, 이대서울병원, 발인 28일 오전 8시, 1522-7000▶이성훈씨(전JW중외제약 부회장) 별세, 탁정자씨 남편상, 이유석(㈜크로스홀딩스 대표이사)·유상(㈜디오데오 대표이사)·유찬씨(㈜이코리아 대표이사) 부친상=25일 신촌세브란스병원, 발인 28일 오전 8시30분, 2227-75001▶임형두씨(전TBCTV제작국 부장·전SBS사우회장) 별세, 김동순씨 남편상, 임미경·연수씨 부친상, 김기정씨 장인상=25일 서울성모병원, 발인 28일 오전 6시45분, 2258-5940"
2022-09-22,"최영아 서울시립서북병원 센터장, 제10회 성천상 수상","JW그룹의 공익재단인 중외학술복지재단은 21일JW그룹 본사에서 제10회 성천상 시상식을 개최했다. 이종호 중외학술복지재단 이사장(JW그룹 명예회장)과 수상자인 최영아 서울시립서북병원 진료협력센터장이 기념촬영을 하고 있다. 사진JW그룹JW그룹의 공익재단인 중외학술복지재단은 지난 21일 서울 서초동 본사에서 제10회 성천상 시상식을 개최했다고 22일 밝혔다.제10회 성천상은 최영아 서울시립서북병원 진료협력센터장에게 수여됐다. 이날 시상식에서 최 센터장은 상금 1억 원과 상패를 전달받았다.1995년 이화여대 의과대학을 졸업한 최영아 센터장은 ‘의사는 병이 가장 많은 곳에 가야 한다’는 사명감을 바탕으로 2001년 내과 전문의 자격 취득 후 대학병원 교수직 제의를 사양하고 노숙인 무료 진료에 매진했다.2002년 최일도 목사와 함께 '다일천사병원'을 세우고 의무원장을 맡은 최 센터장은 병원 내 유일한 의사로서 매일 100명 이상의 노숙인을 돌봐왔다.이후에도 안정적인 의사의 삶을 누리는 대신 노숙인, 독거노인 등 의료취약계층을 위한 의료봉사를 이어간 공로를 인정받아 제10회 성천상 수상자로 선정됐다.최 센터장은 “성천상이 10주년을 맞은 뜻깊은 해에 수상자로 선정돼 영광이다”라며 “노숙인을 돌보는 일이 제게는 늘 익숙한 삶이지만 ‘의사는 환자 곁에 있어야 한다’는 마음으로 노숙인 진료를 이어가겠다”고 수상 소감을 밝혔다.성천상은JW중외제약 창업자인 고 성천 이기석 선생의 ‘생명존중’ 정신을 기려 사회에 본보기가 되는 참 의료인을 발굴하고자 2012년 제정했다. 음지에서 묵묵히 헌신하며 인류 복지 증진에 공헌한 참 의료인을 매년 1명씩 발굴하고 있다. 올해 10회를 맞았다."
2023-05-25,‘긁적긁적’ 국내에 100만 명…아토피 신약 개발에 ‘K제약’ 도전장,"JW중외제약은 아토피 피부염을 치료하는 신약 후보 물질인 ‘JW1601’을 개발 중이다. 기존과 달리 먹을 수 있는 약(경구 제형)이다. 아토피 피부염의 주요 증상인 염증뿐 아니라 가려움증도 억제한다. 기술력도 인정 받았다. 피부질환 전문 글로벌 제약사인 덴마크 레오 파마에 총 4억200만 달러에 기술 수출돼 현재 글로벌 임상이 진행 중이다. 이르면 올해 안에 결과가 나올 전망이다.LG화학 역시 아토피 피부염 치료제 후보 물질인 ‘LC510255’를 중국과 한국에서 임상2상을 진행 중이다. ‘LC510255’는 과민성 면역 기능 조정 단백질의 발현을 촉진하는 신약이다.25일 관련 업계에 따르면 아토피 피부염(아토피) 정복을 위한 국내 제약·바이오 기업들의 움직임이 빨라지고 있다. 국내 아토피 환자는 100만 명에 이른다. 2018년까지 90만 명 초반대였으나 소아·청소년을 넘어 성인으로 증가하고 있다. 전 세계에 1억 명 이상의 아토피 환자가 있을 것이란 추산도 나온다.그래픽=박경민 기자minn@joongang.co.kr관련 치료제 시장도 꾸준히 성장하고 있다. 시장조사기관인 글로벌데이터는 미국과 일본 등 G7 국가의 아토피 치료제 시장 규모는 내년 73억 달러 규모(약 9조6300억원)에 이를 것이라고 전망한다. 국내 시장만 봐도 한 해 5000억원 규모에 이른다.━아토피약 듀피젠트, 1000억원 이상 팔려아토피 치료는 유발 인자를 제거하고, 피부 장벽의 기능을 회복하는 게 핵심이다. 1차 치료제로 스테로이드를 많이 사용하지만, 부작용이 문제였다. 항히스타민제 역시 가려움 증상 개선 등에 효과가 약하다는 지적이 끊이지 않았다.최근엔 면역학 연구에 기반을 둔JAK억제제(과도하게 활성화된 면역 반응 조절) 등이 인기를 끌고 있다. 린버크(애브비), 올루미언트(릴리) 등이 대표적이다.여기에 생물학적 제제인 듀피젠트(사노피 아벤티스) 등이 성인 중증 아토피 시장에서 주목받고 있다. 듀피젠트는 지난해 국내에서만 1000억원어치 이상이 처방됐다. 듀피젠트의 경우 지난달부터 기존 18세 이상 성인에서 소아(만 6~11세) 및 청소년(만 12~17세)까지 급여 범위가 확대됐다. 환자들의 치료 접근성을 높이고 진료비 부담을 줄이도록 한 조치다. 제약 업계 관계자는 “뒤집어 생각하면 듀피젠트가 국내에서 그만큼 치료 효과를 보여줬다는 의미”라고 말했다.인체 내에서의 작용 방식은 다르지만, 린버크(애브비)와 올루미언트(릴리) 등도 복용 편의성과 상대적으로 저렴한 가격을 무기 삼아 국내에서 입지를 넓혀가고 있다. 다만 이들은 여드름과 대상포진 등 부작용 논란이 이어지고 있다.아토피 피부염 환자의 팔. [사진 이미지투데이]━패스트 팔로워 국내 업체도 연구개발 한창국산 업체들은 기존 글로벌 신약의 틈새를 효과적으로 공략 중이다.HK이노엔은 지난 3월 아토피 치료제인 ‘IN-A002’의 국내 임상 1상에 착수했다. 피부에 간편하게 바르는 것만으로 과도하게 활성화된 면역 반응을 줄일 수 있는 게 특징이다.강스템바이오텍은 줄기세포 치료제로 아토피 치료제 개발에 나섰다. 업계에선 ‘퓨어스템-에이디주’에 대한 임상 3상이 조만간 마무리될 것이라고 전망한다. 이 회사는 지난해 8월 장기 추적연구의 중간결과를 발표하면서 투약 후 약 3년까지 안전성과 유효성을 확인했다고 밝힌 바 있다. 제약 업계 관계자는 “아토피 관련 시장은 꾸준히 성장하는 만큼 국내 제약 업계의 도전도 계속 이어질 것”이라고 말했다."
