date,title,content
2024-11-12,분만유도제 독점 JW중외제약 또 “품절” 통보… 정부가 약가 40% 올려도 소용없어,"JW중외제약 '중외옥시토신주'대표적인 분만유도제로 꼽히는JW중외제약의 ‘옥시토신’ 의약품이 최근 공급 중단을 알리면서 분만 시술 등에 차질을 빚게 됐다는 지적이 나온다.12일 의료계에 따르면 경북 안동의 한 종합병원 산부인과 의사는 지난 10일 오후 소셜미디어에 “임신 및 출생 관련 산과(産科) 영역에서 아주 기본적으로 쓰이는 약인 옥시토신(자궁수축제)마저 제약사로부터 품절을 통보받았다”며 “본원에서 한 달여 간 쓰이는 옥시토신 주사제의 양이 150앰플인데 40앰플 남은 상태에서 품절 통보가 왔다”고 글을 올렸다.이와 함께 지난달 22일 제약사에서 병원에 보낸 약제 품절 공문이 찍힌 사진을 올렸다. 공문에는 “주원료 수급 차질로 인한 입고 지연으로 옥시토신주가 품절돼 내년 1월 중 공급을 재개할 예정”이라는 내용이 담겼다.그는 “보통 분만이 가장 많이 이뤄지는 시기가 연말 연초인데 이 시기에 약이 품절됐다”며 “너무나도 당연히 여겨지는 분만 관련 진료에서도 점점 과거로 되돌아가는 퇴행 현상이 발생하고 있다”고 했다.산과 영역에서 가장 흔히 시행하는 시술 중 하나가 유도 분만이다. 이때 자궁 수축을 일으키는 물질인 옥시토신을 쓴다. 국내에선JW중외제약, 유한양행 두 곳에서 이를 생산한다.약제 품절을 알린JW중외제약의 옥시토신 제품은 시장 점유율이 50% 이상으로 병원에서 가장 많이 쓰인다.JW중외제약은 지난해 8월 원료 공급이 어렵다며 중단을 알린 바 있다. 이후 보건복지부는 약가를 40% 올렸는데, 이번에 또 중단하겠다고 한 것이다.JW중외제약은 “지난 5일에 12월 두번째주까지 공급 재개를 앞당기겠다는 내용의 새 공문을 병원에 보냈다”고 말했다."
2023-10-19,100만원 처방하면 100만원 현금… JW중외제약에 사상 최대 리베이트 과징금 298억원,"100만원 처방하면 100만원 상당 현금 지급하고, 해외 학회 참가비 대납도JW중외제약 과천사옥 전경/JW중외제약 제공제약회사JW중외제약이 전국 병·의원 1500여 곳에 70억원 상당의 불법 리베이트를 제공한 혐의가 적발돼 298억원의 과징금을 물게 됐다.19일 공정위는JW중외제약에 불법 리베이트를 제공한 혐의로 298억원의 과징금을 매기고, 회사 법인과 신영섭 대표이사를 검찰에 고발했다고 밝혔다. 제약사의 불법 리베이트 사건 가운데 역대 최대 과징금이다. 공정위는 앞서 2007년에도 중외제약의 불법 리베이트를 적발해 33억원의 과징금을 부과한 바 있다.공정위에 따르면JW중외제약은 2014~2018년 자사에서 만든 의약품을 처방한 병·의원들에 22억원 상당의 현금을 제공했다. 100만원을 처방하면 100만원을 지원해주는 식이었다. 같은 기간 의료인 모임을 지원하거나 식사와 향응을 제공하는 데에도 6억원을 썼다. 의료인과 그 동반자들을 초대해 식사와 숙박 등을 지원한 심포지엄 총 24건에도 18억원가량을 들였다.공정위는 또JW중외제약이 자사 의약품 처방 증대를 목적으로 의료인들의 해외 학회 참가 경비 8400만원을 지원하고, 의료 관련 학회의 행사에 4000만원을 썼다고 봤다. 의료인들의 임상연구와 관찰연구 등에도 20억원가량을 지원했다고 했다. 제약사가 의약품 마케팅 차원에서 연구를 지원하는 것은 법으로 금지돼 있다.특히 공정위는JW중외제약이 본사 차원에서 조직적으로 불법 리베이트를 줬다고 봤다. 당시JW중외제약은 병·의원별 처방 금액 자료를 바탕으로 리베이트 대상을 추려낸 소위 ‘보물지도’를 만들어 맞춤형 지원 프로그램을 고안해 내기까지 했다. 그러면서 불법 리베이트가 드러나지 않도록 위장 회계 처리까지 했던 것으로 파악됐다. 리베이트 명목으로 제공한 현금은 ‘직원 업무 능률 향상차 식대’로 처리하고, 모임 지원은 ‘거래처 활동’,처방 증량은 ‘인지도 증진’ 등으로 바꾸는 식이라고 공정위는 설명했다.하지만JW중외제약은 “공정위가 문제 삼은 연구비 지원 내용은 환자 건강에 도움을 주려는 목적에서 시행했던 것”이라며 “연구 지원이 이뤄진 기간이 아닌 현재까지도 관련 제품 전체 매출에 영향을 끼쳤다고 판단해 과징금을 과도하게 산정한 것은 납득하기 어렵다”고 했다. 이어 “타 제약사 사례와 형평성을 잃은 조치로, 행정소송 등을 통해 대응하겠다”는 입장을 밝혔다."
2024-11-14,분만유도제 공급 중단… 예비 엄마들 불안하다,"‘점유율 70%’ 중외제약 생산 차질분만유도제의 공급이 일부 중단되면서 산부인과 등 의료 현장의 불안이 커지고 있다. 국내에서 2개 제약사가 분만유도제를 생산하는데, 시장점유율 70%에 이르는JW중외제약이 원료 수급난을 이유로 들며 공급을 최근 중단했다. 이 여파로 일부 병의원이 분만유도제를 구하지 못해 분만 시술 등에 차질을 빚었다. 필수 의약품 공급에 대한 정부와 제약사의 안이한 인식이 위기를 불렀다는 지적이 나온다.◇분만유도제 공급사 2곳뿐13일 건강보험심사평가원 의약품관리종합정보포털에 따르면,JW중외제약은 지난 1일 분만유도제 ‘중외옥시토신주’를 공급 부족 의약품으로 신고했다. 옥시토신을 성분으로 하는 분만유도제는 자궁 수축을 유발, 촉진한다. 출산 후 산모의 과다 출혈을 막는 데도 필요하다. 제약사가 생산을 중단하려면 60일 전에 식품의약품안전처에 보고해야 하는 ‘퇴장 방지 의약품’으로 지정돼 있다.그래픽=이진영국내에서 판매 중인 분만유도제는JW중외제약과 유한양행 주사제가 전부이고,JW중외제약이 70% 가까운 물량을 차지하고 있다.JW중외제약이 공급을 중단하자 유한양행에 평소보다 높은 수요가 몰리며 연쇄적으로 품귀 현상이 벌어진 것이다.JW중외제약 측은 “주원료를 인도에서 수입하고 있는데 선적 과정에서 문제가 생겨 공급을 중단했다”며 “다음 달 4일부터 분만유도제 공급을 재개하기로 했다”고 밝혔다. 유한양행은 14일부터 공급을 재개한다. 이에 대해 제약 업계는 지금처럼 낮은 약가(藥價)로는 생산 실익이 적어 이번 같은 공급 중단이 또 일어날 것으로 전망한다. 예컨대 스위스의 경우 분만유도제 약가는 1앰풀당 5000원에 달하고, 일본에서는 1000원 안팎에 책정되어 있다. 한국은 지난해 8월 중외옥시토신주 품귀 때 정부가 195원에서 273원으로 40% 인상했는데도 약값이 주요국의 절반에 미달한다. 식약처에 따르면,JW중외제약 유도분만제의 작년 매출은 1억4000만원이다. 제약 업계 관계자는 “분만유도제는 약값이 싼데 원료 수급과 위탁 생산 등 관리할 위험은 많아 채산성이 낮다”고 했다. 김재연 대한산부인과의사회장은 “비정상적으로 낮은 분만유도제 가격을 현실화하는 방안을 비롯해 근본적인 대책이 필요하다”고 했다.◇낮은 약가에 신약도 ‘K패싱’정부의 약가 정책은 건강보험 재정과도 관련 있다. 약가를 높일수록 건보 재정에 부담을 주기 때문에 동결 또는 낮추려는 것이다. 그럼에도 지나친 약가 인하 정책은 신약 공급에 부정적 영향을 끼쳐 국내 개발 신약이 한국 시장을 외면하는 상황도 벌어지고 있다. 예컨대SK바이오팜이 개발한 뇌전증(腦電症·간질) 신약 ‘세노바메이트’는 올해 3분기 미국에서 1133억원 매출을 기록했을 정도로 효능을 인정받았지만, 한국에서는 2026년쯤으로 출시 계획을 잡고 있다. 한국에서 신약 허가 신청을 하지 않은 이유가 낮은 약가 때문이라는 분석이 나온다. 낮은 약가로 결정되면 해외에서도 이를 기준 삼아 책정하기 때문에 불이익을 당한다는 것이다. 한국 출시를 고의로 건너뛰는 이른바 ‘K패싱’ 현상이 나타나는 것이다.동아에스티가 개발해 2014년 미국 식품의약국(FDA) 허가를 받은 항생제 ‘시벡스트로’도 유사한 사례다. 국내에서는 2015년 시판 허가를 받고도 2020년 허가를 자진 반납했다. 당시 약가가 미국의 3분의 1 수준으로 책정되자 국내 출시를 포기한 것이다. 이 약은 미국에서 지난해 약 600억원의 매출을 올렸다.유승래 동덕여대 약대 교수는 “약가 산정은 건보 재정에 직접적인 영향을 주기 때문에 신중하게 결정해야 한다”며 “그럼에도 당국이 낮은 약가에 너무 집착하면, 제약사들이 채산성 낮은 약품 생산을 꺼리고 신약 국내 출시도 기피하게 돼 피해가 결국 환자들에게 돌아간다”고 했다.☞분만유도제자궁 수축을 일으키는 약물인 옥시토신을 말한다. 자궁 수축을 유발·촉진해 태아가 자궁 밖으로 나오도록 한다. 출산 중 산모의 과다 출혈을 막는 효과도 있다."
2022-08-17,"중외제약, ‘롤챔스’ 공식 후원","JW중외제약은 세계적인 e스포츠 리그인 ‘리그 오브 레전드 챔피언스 코리아(LCK)’의 공식 후원사로 참여한다고 16일 밝혔다.LCK는 세계 최대 e스포츠인 ‘리그 오브 레전드’의 한국 프로 리그로, 10개 팀이 매년 2번의 리그를 치른다.JW중외제약은 내년까지LCK를 후원한다. 경기 중계방송을 비롯해LCK공식 경기장과 결승전 현장에서JW중외제약 기업 로고와 인공눈물 ‘프렌즈 아이드롭’ 로고가 노출된다."
2023-10-30,머리카락 잡는 자가 최후의 승자... 탈모시장 뛰어든 제약사들,"국내외 제약사들 ‘공격적 개발’‘초미세 바늘패치’까지 등장일러스트=김의균·Midjourney지난 25일JW중외제약은 마이크로니들(Microneedle) 연구 기업인 테라젝아시아와 탈모 치료제 공동 연구 협약을 체결했다. 마이크로니들은 머리카락 3분의 1 굵기의 미세한 바늘로 구성된 패치를 피부에 붙여 약물을 전달하는 기술이다.JW중외제약은 앞으로 테라젝아시아의 기술을 활용한 마이크로니들 탈모 치료제 개발에 나설 계획이다.국내외 제약 업체들이 마지막 남은 블록버스터 시장으로 꼽히는 탈모 치료제 개발에 공격적으로 뛰어들고 있다. 마이크로니들처럼 새로운 투약 방식을 도입하는가 하면, 기존 약물을 탈모 치료제로 전환하는 시도도 이어지고 있다. 면역 질환인 원형 탈모와 일반 탈모 치료제 모두에서 성과가 나타나고 있다. 시장조사업체 리서치앤마켓에 따르면 글로벌 탈모 치료제 시장 규모는 2020년 35억달러(약 4조7500억원)에서 2027년 62억달러까지 커질 전망이다.아토피 약이 탈모 치료제로 변신현재 글로벌 탈모 치료제 시장은 원형 탈모와 일반 탈모 모두 미국 머크(MSD)의 프로페시아와 영국 글락소스미스클라인(GSK)의 아보다트가 양분하고 있다. 나머지 약품도 대부분 이 두 약품의 성분을 복제했다. 두 약은 모두 탈모의 원인으로 꼽히는 5알파 환원 효소를 억제하는 방식으로 탈모를 치료한다. 문제는 5알파 환원 효소가 남성 호르몬과 밀접한 연관이 있어 성기능 장애 등 부작용이 있다는 점이다. 특히 태아 생식기에 영향을 줄 수 있어 가임기 여성은 접촉도 하지 말도록 권고한다. 약 복용을 중단하면 다시 탈모가 시작되는 등 지속력에 한계도 있다.이 때문에 제약 업체들은 새로운 기전의 탈모 치료제를 개발하고 있다. 원형 탈모 치료제 시장에서 대표적인 방식은 면역과 관련된JAK(야누스인산화효소) 신호 체계를 억제하는 약이다. 지금까지는 아토피 피부염, 류머티즘 관절염 등을 치료하는 데 쓰였던 약물을 탈모 치료용으로 개발한 것이다. 원형 탈모가 일반 탈모와 달리 면역 체계가 모낭을 공격해 발병하는 자가면역 질환이라는 점에 착안했다. 화이자의 원형 탈모 치료제 ‘리트풀로’는 지난 6월 미국 식품의약국(FDA) 허가를 취득했다. 이 약은 10대 청소년도 사용할 수 있는 것이 특징이다.JAK억제 탈모약으로 가장 먼저FDA승인을 받은 일라이릴리의 올루미언트는 이미 미국에서 판매 중이고, 애브비 또한JAK억제제 ‘린버크’를 탈모 치료제로 허가받기 위한 임상에 나섰다.그래픽=김의균국내 제약사도 속속 도전장국내 제약사들은 일반 탈모 시장을 공략하고 있다. 종근당과 대웅제약은 기존의 먹는 탈모 치료제를 지속력이 긴 주사제로 바꾸는 연구를 진행 중이다. 매일 복용하던 먹는 치료제를 주사제로 바꾸면 1~3개월에 1회 투약해도 같은 효과를 낸다. 대웅제약은 바이오 기업인 인벤티지랩, 위더스제약 등과 협력해 개발한IVL3001에 대해 최근 호주에서 임상 1, 2상을 완료했다. 종근당은CKD843 주사제에 대해 국내에서 임상 1상을 진행 중이다.아예 접근 방식을 바꾼 기업도 있다.JW중외제약은 탈모 원인 중 하나로 꼽히는 윈트(Wnt) 신호전달계를 활성화하는 방식의 신약 물질을 개발해 지난 7월 호주 특허청에서 물질 특허를 취득했다. 개발에 성공하면 남녀가 모두 사용할 수 있는 치료제가 될 것으로 기대된다. 바이오 기업 올릭스는 리보핵산(RNA) 간섭 기술을 활용한 탈모 치료제OLX104C를 개발 중이다. 이 약도 기존 치료제가 가진 성 기능 저하, 여성 환자 사용 불가 등의 한계를 극복할 수 있을 것으로 기대된다.기존에 알려지지 않았던 탈모 치료 물질에 대한 연구도 활발하다. 국제 학술지 네이처에는 최근 털이 난 점에서 추출한 분자 ‘오스테오폰틴’을 탈모 치료제로 활용할 수 있다는 연구 결과가 실리기도 했다. 연구 책임 저자인 막심 플리쿠스 미국 어바인 캘리포니아대 교수는 “오스테오폰틴은 자연적으로 인간이 가지고 있는 분자를 탈모 치료에 활용할 수 있다는 점이 강점”이라고 했다."
2023-09-20,“의료기기 산업이 신성장동력” 국내 제약사들 속속 진출,"급성장하는 국내 의료기기 시장국내 제약사들이 의료 기기를 신성장 동력으로 삼고 관련 사업을 확장하고 있다. 고령화와 함께 의료 기기에 접목할 인공지능(AI) 등 신기술이 발전하면서 의료 기기 산업이 급성장하고 있기 때문이다. 한국보건산업진흥원에 따르면, 2017년 6조1978억원이었던 국내 의료 기기 시장은 지난해 11조8782억원으로 두 배 가까이로 늘어났다.제약사들 입장에서 의료 기기는 기존 의약품 사업과 관련성이 커 시너지를 낼 수 있고 이미 구축해 둔 의약품 유통망을 통해 의료 기기를 판매할 수 있어 유리하다. 높은 의료 기기 기술을 보유한 스타트업들과 손잡거나 기존 의료 기기 사업을 재정비하고 있다.그래픽=이지원디지털·AI의료 기기 회사와 손잡아대웅제약은 다음 달부터 반지형 혈압 측정기 ‘카트BP’를 전국 병·의원에 유통할 예정이다. 카트BP는 디지털 헬스케어 스타트업 스카이랩스가 개발한 것으로, 24시간 혈압을 측정할 수 있다. 대웅제약이 보유한 고혈압, 고지혈증, 심부전 등 순환기계 의약품과 시너지를 낼 수 있을 것으로 기대하고 있다. 동아제약은 지난 6월 전자약 개발 기업 뉴아인과 편두통 완화 의료 기기의 국내 독점 판매 공급 계약을 체결했다. 이마에 붙여 미세전류 자극을 통해 편두통을 완화하는 의료 기기다. 동아제약 관계자는 “뉴아인과 편두통, 안구건조증 등 만성질환 치료 기술 연구와 임상도 협력한다”며 “의약품 사업에도 도움이 될 것”이라고 말했다.이처럼 제약사들은AI나 디지털 헬스케어 등 첨단 기술을 보유한 스타트업들과 손잡고 있다. 안국약품은 보행 관련 데이터를 취득할 수 있는 솔티드의 디지털 웨어러블 의료 기기 ‘뉴로게이트 인솔’을 판매한다. 솔티드는 삼성전자의 사내 벤처 육성프로그램 C랩 1기 스핀오프 기업이다. 안국약품은 뷰노의 안저 영상 판독 보조AI제품 국내 판매 공급 계약을 체결하기도 했다. 유한양행은AI기반 심전도계를 개발하는 휴이노에 50억원을 투자해 현재 2대 주주다.분산된 의료 기기 사업부 하나로제약사들은 자사 의료 기기 사업도 재정비하고 있다.JW중외제약은 올해 초 그룹 내JW바이오사이언스의 의료 기기 사업 부문을 양수했다.JW중외제약은 양수 이후 지난 6월 국내 최초로 ‘하이브리드 보육기(인큐베이터)’를 출시했다. 신생아의 발육이 정상적으로 이뤄질 수 있도록 산모의 체내와 유사한 환경을 제공하는 의료 기기다. 휴온스그룹도 지난해 휴온스메디케어와 휴온스메디컬을 합병해 휴온스메디텍으로 새롭게 출범했다. 분산돼 있던 의료 기기 사업을 합쳐 전문성과 경쟁력을 강화하겠다는 것이다.제약사들뿐 아니다. 의료 기기 사업은IT(정보 기술)·유통 대기업들도 눈독 들이는 분야다.LG전자는 지난해 주주총회에서 ‘의료 기기 제작 및 판매업’을 사업 목적에 추가하며 본격 의료 기기 사업에 뛰어들었다.LG전자는 만성 통증 완화 의료 기기 ‘LG메디페인’과 탈모 치료기 ‘LG프라엘 메디헤어’ 등을 보유하고 있다. 아모레퍼시픽과LG생활건강 역시 사업 목적에 의료 기기 관련 내용을 추가했다. 화장품 판매와 더불어 의료 기기로 뷰티 분야 사업을 넓히겠다는 구상이다.한 제약업계 관계자는 “의약품은 제품 출시에 10년이 넘게 걸리고 국내 제약사들은 신약 개발 역량도 선진국보다 떨어지기 때문에 당장 성과를 내기 어려운 상황”이라며 “IT와 제조 기술이 발달한 한국에서 제약사들의 의료 기기 사업 확대는 미래 먹거리뿐 아니라 캐시카우(현금 창출원)를 확보하는 데 도움이 된다”고 말했다."
2022-09-02,제약사의 변신… ‘스포츠’로 젊은층 공략한다,"지난달 28일 강원도 ‘강릉 아이스 아레나’에서 e스포츠 리그인 ‘리그 오브 레전드 챔피언스 코리아(LCK)’ 결승전이 열렸다.LCK는 ‘LoL(리그 오브 레전드)’을 주 종목으로 하는 한국 프로 게임 리그로,LoL은 내년 항저우 아시안게임 정식 종목으로 채택될 정도로 젊은 층에서 인기가 높은 게임이다. 재미있는 것은 이 행사에 전문의약 제약사인JW중외제약이 후원을 한 것. 1만명이 모인 이날 행사장의 대형 현수막과 경기 중계 화면에는JW중외제약의 기업 로고와 인공 눈물 제품 ‘프렌즈 아이드롭’ 로고가 노출됐다.JW중외제약 관계자는 “MZ세대를 포함한 젊은 게임 팬들에게 브랜드를 알리려고LCK의 공식 후원사로 참여하게 됐다”며 “행사장에 설치된JW중외제약 부스에 약 5000명이 다녀간 것으로 추정되며 홍보 효과를 톡톡히 봤다”라고 말했다.제약사들이 고령화된 이미지를 벗고 젊은 층을 적극적으로 공략하고 있다. 젊은 세대가 즐기는 게임이나 프로스포츠 구단 후원으로 대중에게 친숙하게 다가가는 방식이다. 제약 업계 관계자는 “그동안 제약사들이 병원이나 약국 대상 제품 홍보에 주력해왔다면 이제는 브랜드 자체를 알리려 하는 것”이라며 “특히 젊은 층에게 좋은 브랜드 이미지를 쌓아 미래의 잠재적인 고객으로 끌어들이려는 것”이라고 말했다.e게임·골프·야구 활발한 후원비타민 음료 ‘비타 500′으로 유명한 광동제약은 지난해 12월 e스포츠 게임단 ‘아프리카 프릭스’와 후원 계약을 체결하며 게임단 이름을 ‘광동 프릭스’로 변경했다. 제약사 이름이 e스포츠 게임단 이름에 들어간 첫 사례다. 선수단 유니폼과 경기장에 브랜드 로고가 노출되며, 소속 게임단의 초상권 사용 권한도 광동제약이 가진다. 지난달 29일 광동 프릭스는 인기 게임 ‘배틀그라운드’ 동아시아 지역 통합 대회에서 우승을 차지하며, 선수들의 유니폼에 새겨진 광동제약 로고도 덩달아 홍보가 됐다. 중견 제약 업체 휴온스는 지난 6월 리그 오브 레전드를 포함한 4개의 게임단을 운영하는DRX와 후원계약을 맺고 다양한 마케팅을 선보일 계획이다.특히 최근 젊은 층에서 인기인 골프 후원도 활발하다. 셀트리온홀딩스는 총상금 10억원 규모의 여자골프대회 ‘셀트리온 퀸즈 마스터즈’를 열고 있고, 휴온스는 골프단을 운영 중이다. 국내 1위 제약사인 유한양행은 지난 3월 여자 골프 김민주·이연서 선수를 후원한다고 밝혔다. 이들의 모자에는 유한양행의 유산균 제품인 ‘엘레나’가 적힌다. 유한양행 관계자는 “골프가 대중화되면서 젊은 층과 더 소통하기 위해서 후원에 나선 것”이라고 말했다.젊은 층의 건강 관심이 한몫제약사들은 종목을 가리지 않고 다양한 프로스포츠 후원에 나서고 있다.HK이노엔은 프로야구단 키움 히어로즈를 후원하며 구장 내에 숙취 해소제 광고를 하고 있다. 안국약품은KT위즈 프로야구단에 건강기능식품을 후원한다. 눈 피로 개선에 도움이 되는 제품과 혈압·콜레스테롤을 관리하는 건강기능식품이다. 셀트리온은 인천유나이티드 프로 축구단을 후원한다.이런 움직임은 젊은 층의 건강에 대한 관심도 한몫했다. 원래 제약사들은 의사의 처방을 받아야 하는 전문의약품이 주력이었다. 전문의약품은 의약 전문 매체가 아닌 신문이나TV같은 대중매체에는 광고조차 못 한다. 하지만 최근 제약사들은 전문의약품뿐 아니라 건강기능식품이나 헬스케어 관련 제품을 영역을 확대하면서 브랜드 알리기에 적극 나서고 있는 것이다. 특히 기업 브랜드의 이미지를 중요시하는 젊은 층의 마음을 사로잡기 위해 스포츠나 게임 후원에 나서고 있다. 한 업계 관계자는 “제약사들이 젊은 층을 겨냥해 ‘약만 파는 회사’가 아닌 ‘종합 헬스케어 회사’라는 브랜드 이미지를 만들려는 것”이라고 말했다."
2024-07-23,30년간 아프리카서 의술 펼친 유덕종 교수 ‘JW성천상’ 수상,"유덕종 에티오피아 세인트폴병원 밀레니엄 의과대학 교수. /JW중외제약유덕종(64) 에티오피아 세인트폴병원 밀레니엄 의과대학 교수가 22일 ‘제12회JW성천상 수상자로 선정됐다.JW성천상은JW중외제약의 창업자인 성천 이기석 선생의 ‘생명 존중’ 정신을 계승·발전시키기 위해 제정된 상으로, 공익 재단인JW이종호 재단이 시상한다. 유덕종 교수는 지난 30여 년간 우간다와 에스와티니, 에티오피아 등 아프리카의 의료 불모지에서 의술을 펼쳐온 공로를 인정받았다."
