date,title,content
2023-04-03,"행동주의 펀드 쓴잔, 국민연금은 실속… 희비 갈린 주총","KT&G·태광산업 등 7곳 중 5곳서 행동주의 펀드 표 대결 패배지난달 주주총회 시즌에서 ‘행동주의 펀드’와 국민연금의 희비가 엇갈렸다.배당금 인상 등 여러 주주 환원책을 들고 나와 개인 투자자들 환영을 받았던 행동주의 펀드들은 대부분 주총 표 대결에서 패배의 쓴잔을 마셨다. 반면, 국내 최대 기관 투자자인 국민연금은 투자한 기업의 주총에서 의안을 뜻대로 관철시키며 실속을 챙겼다.전문가들은 행동주의가 결실로 이어지려면 우호 세력이 더 탄탄히 구축돼야 한다고 말한다. 또 행동주의의 타깃이 된 기업이 테마주로 분류돼 주가가 급등락하는 투자 풍토도 지양돼야 한다고 조언한다. 행동주의는 적극적으로 회사 경영에 관여해 주주 가치를 높이는 투자 행위를 말한다.행동주의, 주총서 잇단 고배...SM·남양은 성공2일 금융투자업계에 따르면, 지난달 행동주의 펀드가 주주 제안을 내거나 특정 안건을 지지한 주요 기업 7곳(SM엔터테인먼트·KT&G·JB금융지주·태광산업·BYC·KISCO홀딩스·남양유업) 중SM·남양을 제외한 5곳에서 펀드가 고배를 들었다. 펀드는 사측의 소극적인 주주환원책을 비판하고, 제안을 주총에 상정시키기 위해 소송전도 불사했지만 대부분 사측 승리로 끝났다.KT&G는 안다운용·플래쉬라이트캐피탈파트너스(FCP)의 동시 공격을 막아냈다. 펀드의 현금 배당(주당 7867~1만원), 사외이사 증원 안건들은 부결됐다. 펀드가 핵심적으로 주장한 인삼공사 분리상장은 아예 주총 안건으로 채택되지도 못했다.트러스톤자산운용이 태광산업과BYC에 대해 제안한 배당 확대안은 주총에서 받아들여지지 않았다. 밸류파트너스가KISCO홀딩스에 제안한 자사주 매입, 얼라인파트너스가JB금융에 요청한 배당 안건도 표 대결에서 졌다.반면,SM주총에서는 얼라인파트너스가 지지한 이사진 선임안이 가결됐다. 얼라인은 올 초SM의 경영권 분쟁을 촉발시키며 ‘행동주의 열풍’에 불을 당긴 펀드다.지난달 31일 남양유업 주총에서도 차파트너스의 추천 인사(심혜섭 법률사무소 대표)가 소액주주 지지를 받아 감사위원에 선임되며 이사회 입성에 성공했다.‘큰손’ 국민연금,KT·금융지주 등서 승리행동주의 펀드들이 고전하는 동안 국민연금은 투자한 회사에서 적지 않은 영향력을 행사했다.KT사외이사 재선임에서는 사측이 제안한 표현명 전 롯데렌탈 사장에 대해 국민연금이 주총 전 반대 입장을 표명하자 표 전 사장이 주총 당일 사퇴했다. 반면 국민연금이 찬성한 ‘자사주 취득 시 매년 주총에서 보유 목적 보고 의무화’ 안건은 통과됐다.지난달 24일 우리금융 주총에서 국민연금이 동의한 임종룡 회장 선임안은 통과됐고, 같은 날KB금융의 이사진 선임안 10건도 국민연금 뜻대로 확정됐다.다만, 신한금융의 진옥동 회장 선임안은 국민연금의 반대 입장에도 불구하고 가결됐다. 재일교포와 외국인 주주들이 진 회장 선임안에 찬성표를 던진 것으로 알려졌다.행동주의 정착, 주주 연대 필수주주 행동주의가 뿌리 내리려면 다른 주주들과 연대를 강화하고, 펀드들도 투자에 책임 의식을 키워야 한다고 전문가들은 입을 모은다. 행동주의 펀드 홀로 기업의 행동을 바꿀 수 없으므로 다른 개인·기관 투자자 등 우호 세력을 만드는 노력을 기울여야 한다는 말이다.김준석 자본시장연구원 수석연구위원은 “우리 증시는 단기 투자를 주로 하는 개인 투자자 비중이 커 이들이 주총에 적극 개입할 동기가 크지 않다”고 지적했다. 개인 투자자들과 연대해서 국내 증시에서 136조원을 굴리는 국민연금 목소리만 부각되는 현실을 바꿔야 한다는 것이다.관치 논란이 일긴 했지만 주총을 앞두고 은행들이 주주환원책을 내놓은 것을 두고, 소액주주 목소리가 커지는 계기가 됐다는 평가가 나온다.행동주의 펀드의 ‘먹튀’ 가능성이 거론되는 가운데, 개인 투자자들이 행동주의 움직임을 ‘단타(초단기 투자)’의 소재로 보는 투자 문화도 바뀌어야 한다는 의견이 있다. 실제, 주총에서 펀드들 제안이 부결되자 직전 고점 대비 주가가 20% 넘게 하락하는 등 해당 기업들 주가는 크게 출렁였다. 기업 가치 개선을 통해 생긴 이익을 서로 나누는 건강한 분위기가 조성될 필요가 있다고 전문가들은 말한다."
2023-03-20,"거침없던 행동주의 펀드, 글로벌 의결권 자문사에 ‘발목’","ISS·글래스루이스, 주주제안 잇따라 반대… 주총 표대결 관심3월 주총 시즌을 맞아 회사 경영에 적극적으로 개입하는 행동주의 펀드의 움직임이 활발해진 가운데 글로벌 양대 의결권 자문사인ISS(InstitutionalShareholderServices)와 글래스루이스(GL)의 의견이 변수로 떠올랐다. 의결권 자문사는 의안 여러 건을 처리해야 하는 기관 투자자들을 대신해 의안을 분석하고 결정을 권고한다. 두 업체가KT&G와JB금융지주 등 이번 주총 시즌의 격전지로 꼽히는 기업들에 대한 행동주의 펀드 측의 주주제안에 엇갈린 의견을 제시하면서 기관 투자자들의 표가 기업 쪽으로 쏠릴 가능성이 제기된다.◇행동주의 펀드에 제동건 의결권 자문사들ISS는 최근 행동주의 펀드가 주주제안을 한 회사 중KT&G와 남양유업의 일부 안건에 대해서만 찬성 의견을 밝혔다. 반면JB금융지주,KISCO홀딩스,BYC등에 행동주의 펀드가 낸 주주제안에 대해서는 “충분한 이유나 근거를 제시하지 못하고 있다”며 반대했다.GL도JB금융지주 주주제안에 대해 “회사 측이 적절한 주주 환원을 추진하고 있다”며 반대를 권고 했다.앞서 얼라인파트너스자산운용은JB금융지주에 보통주 현금 배당 900원과 사외이사 선임을 주주제안으로 제출했다. 밸류파트너스자산운용과 소액주주연대는KISCO홀딩스에 500억원 규모의 자사주 매입과 감사 선임을 제안했고 트러스톤자산운용은BYC에 내부 거래 공정성 의혹 해소와 사외이사 선임, 주주 환원 확대 등을 요구했다.◇KT&G에 대해서는 엇갈린 의견다수의 행동주의 펀드가 주주제안을 내 주목받은KT&G의 경우 양 사의 의견이 갈렸다. 앞서 플래쉬라이트캐피탈파트너스는KT&G에 주당 1만원 배당, 자사 추천 사외이사 선임 등을 제안했다. 안다자산운용은KT&G의 사외이사 정원을 기존 6명에서 8명으로 증원할 것을 요구하며 자사 추천 사회 이사 선임, 배당금 증액 등을 제안했다.이에 대해ISS는 행동주의 펀드가 추천한 일부 사외이사 후보에 대한 찬성 의견을 밝히면서KT&G 측이 추천한 김명철·고윤성·임일순 후보자에 대해서는 반대해야 한다고 권고했다. 행동주의 펀드들의 자사주 매입, 배당 제안 등에도 찬성한다고 밝혔다. 반면GL은 “현재 행동주의 펀드의 제안이 충분한 설득력을 가지고 있다고 보기 어렵다”며KT&G 측의 손을 들어줬다.행동주의 펀드인 차파트너스가 현금 배당 보통주 2만원, 자사주 매입 등을 요구한 남양유업의 경우ISS는 “설득력 있는 근거가 부족하다”며 반대 의견을 권고했다. 다만 심혜섭 변호사를 감사로 선임하는 안에 대해서는 “이사회 내부 통제에 대한 우려를 완화할 수 있다”며 찬성을 권고했다.◇윤경림KT차기 대표 선임에는 ‘찬성’오는 31일KT주총에서 윤경림 사장을 차기 최고경영자(CEO)로 선임하는 안건에 대해서는 양대 의결권 자문사가 모두 찬성 의견을 냈다.KT차기CEO선출 논란은 지난해 12월 최대 주주(지분율 10.13%)인 국민연금이 구현모 현 대표의 연임 결정에 공개적으로 반대하면서 불거졌다. 이후KT이사회는 윤 후보를 새롭게 내세웠지만 여당은 윤 후보를 전임 대표의 ‘아바타’로 표현하며 비판하고 있다.ISS와GL은 최근 각각 보고서를 내고KT주주들에게 윤 사장이 “회사의 사업 계획을 주도할 자격이 있는 것으로 보인다”며 찬성을 권고했다. 서창석KT네트워크부문장 부사장과 송경민KTSAT대표의KT사내이사 선임 건에 대해서도 양 사 모두 찬성을 권고했다.반면 강충구, 여은정, 표현명 등 현 사외이사 재선임에 대해서는GL이 모두 찬성 의견을 권고한 반면ISS는 “사회 재직 중 주주의 이익을 위해 행동하지 않았다”며 반대 의견을 냈다.투자은행(IB)업계 관계자는 “해외 기관은 투자한 기업이 많은 만큼 주총 시즌에 몰리는 의안 수가 방대해 의결권 자문사의 의견을 따르는 경우가 많다”며 “국내 기관은 통상 기업과의 관계 등을 고려해 사 측 손을 들어주는 경향이 있지만, 올해는 행동주의 펀드들의 적극적인 움직임 때문에 결과를 예측하기가 어렵다”고 했다."
2023-03-20,"국제 의결자문사 가세로, 이번 주총 표 대결 치열해진다","세계 최대 의결권 자문사ISS가 윤경림KT차기 대표이사(CEO) 후보 선임 안건에 찬성 의견을 냈다. “CEO후보가 없다면 주주 가치뿐만 아니라 회사의 가치도 훼손될 수 있다”며 찬성 입장을 보였다. 앞서 또 다른 의결권 자문사 글래스루이스도 윤 후보의 선임에 찬성을 권고했다.ISS와 글래스루이스는 글로벌 기관 투자자를 대상으로 기업 주주총회 안건을 분석해 의결권 행사 가이드라인(지침)을 제시하고 있다.ISS는 최근 검찰에 구현모 현 대표와 윤 후보를 고발한 시민단체 ‘정의로운 사람들’의 주장도 보고서에서 다뤘다. 현대차가 구 대표의 형이 설립한 에어플러그를 인수할 당시KT와 구 대표, 윤 후보가 이에 관여했다는 의혹이 제기됐다고 소개했다. 지분 10.13%를 보유한 국민연금은 그동안CEO선임 절차의 공정성과 투명성을 강조하며 구 대표의 연임 등을 반대해왔다. 이에 따라 오는 31일 열리는KT주주총회에서 표 대결 가능성이 커졌다.주요 상장회사의 주총을 앞두고 의결권자문사가 태풍의 핵으로 떠올랐다. 글로벌 의결권자문사가 행동주의 펀드의 주주제안에 ‘반대’ 의견을 내는 등 목소리를 높이고 있다. 이에 따라 이번 달 열리는 주총에서 치열한 표 대결이 벌어질 가능성이 커졌다.19일 금융투자 업계에 따르면 세계 최대 의결권자문사인ISS는 보고서를 통해KISCO홀딩스와BYC,JB금융지주 등에 대한 주주제안에 모두 ‘반대’를 권고했다. 충분한 이유나 근거를 제시하지 못했다는 게 이유다. 다만KT&G와 남양유업 2곳에만 ‘일부 찬성’했다.밸류파트너스자산운용과 소액주주연대는KISCO홀딩스에 500억원 규모의 자사주 매입과 감사 선임 등을, 얼라인파트너스자산운용은JB금융지주에 보통주 현금배당 900원과 사외이사 선임을 주주 제안했다.FCP·안다자산운용은KT&G에 보통주 현금배당 각각 1만원, 7867원과 각기 다른 사외이사 선임 등을 주주제안으로 제출했다. 트러스톤자산운용은BYC에 내부거래 공정성 의혹 해소와 사외이사 선임, 주주환원 확대 등을 요구했다. 차파트너스는 남양유업에 현금배당 보통주 2만원, 자사주 매입, 감사 선임 등을 요구한 상황이다.글래스루이스도KISCO홀딩스를 제외한KT&G,JB금융지주 등 나머지 회사의 주주제안에 반대 의견을 냈다.KISCO홀딩스와KT&G에 대해서는ISS와 글래스루이스의 의견이 갈렸다.ISS는KISCO홀딩스 주주 제안에 전부 반대했다. 반면 글래스루이스는 “회사가 운전 자본을 너무 많이 가지고 있어 주주 제안한 자사주 매입 금액이 합리적”이라면서 “이사회가 회사의 자본 배분 문제를 충분히 해결하지 못했다는 점을 고려할 때 감사위원을 이사회에 선임할 합리적인 이유가 있다”며 찬성했다.조명현 고려대 경영학과 교수는 “해외 펀드의 한국 비중이 높지 않다 보니 한국 관련 인력이 적어, 주주제안 등을 심도 있게 들여다보지 않거나 사측이 ‘수정하겠다’고 하면 사측 제안에 힘을 싣는 경우가 많아 행동주의 펀드에 반대하는 경향도 크다”고 말했다.글로벌 의결권자문사의 결정은 외국계 기관의 표심에 상당 부분 영향을 줄 전망이다. 국내 의결권자문사인 서스틴베스트의 류영재 대표는 “해외에서 한국을 커버하는 의결권자문사가ISS와 글라스루이스 두 곳밖에 없다”며 “해외 펀드의 경우 해당 권고에 반대하기 위한 내부 절차가 복잡한 데다가, 주총 기간이라는 시간적 제한 때문에 그대로 따르거나 기권하는 경우가 많다”고 설명했다.이남우 연세대 국제대학원 교수는 “국내 기관도 지배구조 개선에 대한 공감대가 커진 데다 국내 자문사 의견을 받고 자체적으로 분석한 뒤 입장을 정하는 등 외국계 기관의 영향력은 전보다 줄었다”며 “주총에서 진검승부를 지켜봐야 할 것 같다”고 말했다."
2023-03-19,"치열해질 주총…국제 의결권자문사, 행동주의 주주제안에 반대","국내 주식시장을 뒤흔들던 행동주의 펀드들이 복병을 만났다. 글로벌 의결권자문사들이 행동주의 펀드의 주주제안에 ‘반대’ 의견을 내면서다. 이에 따라 이번 달 열릴 주주총회에서 치열한 표대결이 예상된다.19일 금융투자 업계에 따르면 세계 최대 의결권자문사인ISS는 보고서를 통해KISCO홀딩스와BYC,JB금융지주 등에 대한 주주제안에 모두 ‘반대’를 권고했다. 충분한 이유나 근거를 제시하지 못했다는 게 이유다. 다만KT&G와 남양유업 2곳에만 ‘일부 찬성’했다.밸류파트너스자산운용과 소액주주연대는KISCO홀딩스에 500억원 규모의 자사주 매입과 감사 선임 등을, 얼라인파트너스자산운용은JB금융지주에 보통주 현금배당 900원과 사외이사 선임을 주주제안했다.FCP·안다자산운용은KT&G에 보통주 현금배당 각각 1만원, 7867원과 각기 다른 사외이사 선임 등을 주주제안으로 제출했다. 트러스톤자산운용은BYC에 내부거래 공정성 의혹 해소와 사외이사 선임, 주주환원 확대 등을 요구했다. 차파트너스는 남양유업에 현금배당 보통주 2만원, 자사주 매입, 감사 선임 등을 요구한 상황이다.글래스루이스도KISCO홀딩스를 제외한KT&G,JB금융지주 등 나머지 회사의 주주제안에 반대 의견을 냈다.KISCO홀딩스와KT&G에 대해서는ISS와 글래스루이스의 의견이 갈렸다.ISS는KISCO홀딩스 주주 제안에 전부 반대했다. 반면 글래스루이스는 “회사가 운전 자본을 너무 많이 가지고 있어 주주제안한 자사주 매입 금액이 합리적”이라면서 “이사회가 회사의 자본 배분 문제를 충분히 해결하지 못했다는 점을 고려할 때 감사위원을 이사회에 선임할 합리적인 이유가 있다”며 찬성했다.KT&G의 경우ISS는 안다자산운용이 제안한 사외이사 증원에 찬성 입장을 밝혔다. 자사주 매입과 배당 제안 등에도 찬성 의견을 냈다. 다만, 안다운용의 추천 후보 중 이수형 변호사와 박재환 중앙대 교수에 대해서는 반대 의견을 추천했다. 반면 글래드루이스는KT&G 이사회가 제안한 모든 안건에 찬성표를 행사할 것을 권고했다.글로벌 의결권자문사의 결정은 외국계 기관의 표심에 상당 부분 영향을 줄 전망이다. 국내 대표적 의결권자문사인 서스틴베스트의 류영재 대표는 “해외에서 한국을 커버하는 의결권자문사가ISS와 글라스루이스 두 곳 밖에 없다”며 “해외 펀드의 경우 해당 권고에 반대하기 위한 내부 절차가 복잡한 데다가, 주총 기간이라는 시간적 제한 때문에 그대로 따르거나 기권하는 경우가 많다”고 설명했다.조명현 고려대 경영학과 교수는 “해외 펀드의 한국 비중이 높지 않다 보니 한국 관련 인력이 적어, 주주제안 등을 심도 있게 들여다보지 않거나 사측이 ‘수정하겠다’고 하면 사측 제안에 힘을 싣는 경우가 많아 행동주의 펀드에 반대하는 경향도 크다“고 말했다.주총에서 표 대결은 한층 격화할 전망이다. 이남우 연세대 국제대학원 교수는 “국내 기관도 지배구조 개선에 대한 공감대가 커진 데다 국내 자문사 의견을 받고 자체적으로 분석한 뒤 입장을 정하는 등 외국계 기관의 영향력은 전보다 줄었다”며 “주총에서 진검승부를 지켜봐야 할 것 같다”고 말했다.BYC에 대해 행동주의 캠페인을 하는 트러스톤 측은 “반대 의견을 낸 해외 의결권자문사와 달리 국내 자문사는 찬성 의견을 냈다”며 “해외 기관 투자자의 지분이 크지 않은 만큼, 주총에서 소액주주들을 얼마나 모으느냐가 중요할 것”이라고 말했다."
2023-04-03,"3월 주총서 10전 7패, 행동주의 펀드 “이제 시작일 뿐…”","지난달 주주총회(주총) 시즌을 뜨겁게 달궜던 행동주의 펀드가 기대에 못 미치는 성적표를 받아들었다. 대부분의 주주제안이 주총 표 대결에서 무릎을 꿇었다. 다만 전문가들은 ‘소액주주의 목소리’를 남긴 점은 높이 평가했다.중앙일보가 지난달 말 기준 주요 행동주의 펀드의 주주제안 주총 결과를 분석한 결과 10건 중 7건은 표 대결에서 패배했다. 승리를 거둔 곳은 3곳에 불과했고, 그 또한 일부 승리에 그쳤다. 주로 감사나 감사위원 선임 건이었다.그래픽=신재민 기자shin.jaemin@joongang.co.kr상법상 감사와 감사 선임의 경우 대주주도 의결권을 3%까지만 인정하기 때문에 소액주주가 표 대결에서 승리할 가능성이 상대적으로 높다. 31일 남양유업에 대한 차파트너스자산운용의 감사 선임안이 통과되며 일부 승리했다. 그러나 배당 확대 등 다른 안건은 부결됐다.트러스톤자산운용(이하 트러스톤)의 감사위원 겸 사외이사도 통과됐다. 다만 소액주주 측이 제안한 배당안은 부결됐다.얼라인파트너스(이하 얼라인)는SM엔터테인먼트를 둘러싼 하이브와 경영권 분쟁 끝에 카카오가 승기를 잡으며, 이사회 구성안을 포함한 주주제안을 주총에서 통과시킬 수 있었다.이 세 곳을 제외한 다른 행동주의 펀드의 주주행동은 사실상 실패했다. 안다자산운용·플래쉬라이트캐피탈파트너스(FCP)의KT&G에 대한 주주제안은 완패했다. 배당금 확대와 자사주 매입·소각, 사외이사 선임안 등을 두고 표 대결을 벌였지만, 결과는 국민연금이KT&G 이사회의 편을 들며 모두 부결됐다.BYC를 상대로 주주행동에 나선 트러스톤의 안건(배당금 증액·액면분할·감사위원 선임·자사주 취득)도 모두 부결됐다. 철강제품 개발업체KISCO홀딩스에 500억원 규모의 자사주 매입과 감사위원 선임을 요구한 밸류파트너스자산운용도 소액주주와 연대했지만 결국 고배를 마셨다. 배당 확대를 두고 주총에서 맞붙은JB금융지주와 얼라인의 대결도 사측의 승리로 끝났다.패배의 쓴잔을 든 행동주의 펀드는 국내 자본시장 환경에 대한 아쉬움을 드러냈다. 이상현FCP대표는 “솔직히 국민연금이 모든 안건에 반대표를 던질 줄 몰랐다”며 “연금을 책임지는 국민연금 수탁위가 주가를 떨어뜨리는 방향으로 의사 결정한다는 건 이해하기 어렵다”고 말했다. 태광산업에 주주제안을 한 트러스톤은 사측이 감사위원 선임과 관련해 분리선출 제도를 유리하게 바꿔가며 악용했다고 지적했다.기대한 만큼의 성과를 거두진 못했지만, 행동주의 펀드의 주주행동은 이제 시작일 수 있다. 올해 한 해로 끝나지 않는다는 말이다. 이상현FCP대표는 “KT&G 지분을 더 모아 다음 주총을 준비하겠다”며 “내년에 더 철저히 준비해 (주총에) 임할 것”이라고 말했다. 이창환 얼라인 대표도 “내년만이 아니라JB금융 이사회가 합리적인 자본 배치와 주주환원 정책 도입으로 저평가 문제를 해소할 때까지 계속할 것”이라고 강조했다.전문가들은 행동주의가 사측에 ‘소액주주의 목소리’란 중요한 신호를 보낸 점을 긍정적으로 평가했다. 이남우 연세대 국제대학원 객원교수는 “경영진에게 (주주의) 문제의식과 불만을 전달한 만큼 사측도 예전처럼 무시만 할 수는 없다는 점에서 행동주의 펀드의 주주행동이 국내 주식시장의 메기 역할을 했다는 점에서 의미가 있다”고 평가했다.조명현 고려대 경영학과 교수도 “올해 주총을 통해 문제가 있는 기업은 행동주의 펀드의 타깃이 될 수 있다는 걸 기업도 주주도 알게 됐다”며 “기업도 주총에서 이겼다고 끝낼 게 아니라 합리적 제안은 자발적으로 수용해 고쳐나가야 한다”고 말했다."
