date,title,content
2023-09-11,"국내 전기 이륜차·부품업체 “가자, 인도 1300만대 시장에”","모헤닉·KR모터스 등 속속 진출국내 전기 이륜차, 부품 업체들이 인도 이륜차 시장에 잇따라 뛰어들고 있다. 현대차 등 완성차 업체들에 이어 이륜차 업체가 인도 시장에 도전하는 것 역시 14억 인구를 바탕으로 한 인도의 시장 잠재력 때문이다.인도 자동차 시장에선 내연기관 차량의 경우도 이륜차나 소형차에서 중형, 대형으로 판매가 늘어왔다. 최근 진행되는 전기차로 변신하는 전동화 흐름도 비슷하게 전개돼 전기 이륜차부터 판매량이 증가할 것이란 분석이 많다.국내 이륜차 제조 업체인 모헤닉모터스는 인도 전기 이륜차 제조 업체 선닥과 인도 합작 법인을 세우고 전기 이륜차를 제조해 판매할 계획이다. 모헤닉모터스가 기술 부문을 맡고, 선닥이 제조를 맡는 방식이다. 모헤닉모터스 제품은 내연기관 이륜차와 비교해 공간 활용도가 늘고, 배달 시장을 겨냥해 보온, 보랭 기능도 옵션으로 제공할 예정이다. 또 다른 이륜차 제조 업체인KR모터스는 현대케피코,LG에너지솔루션과 기술 협력으로 만든 전기 이륜차 ‘이루션’을 내세워 인도 시장을 공략한다는 계획이다. 이루션의 가격은 500만원대다.이륜차 업체와 함께 배터리, 변속기 등 부품 업체들도 시장 문을 두드린다.LG에너지솔루션은 지난달 인도 이륜차 업체인 올라 일렉트릭,TVS모터에 배터리 납품 계약을 맺었다. 이들은 인도 등 이륜차 시장 본격 공략을 위해 기존의 충전 방식이 아닌 교체형 배터리 방식을 개발하고, 이를 전담할 독립 법인 ‘쿠루’도 세웠다.전기 변속기 제조 업체인 바이젠은 전기 이륜차용 7단 변속기를 최근 상용화했다며 수요가 늘어나는 인도 현지 이륜차 업체들과 부품 공급을 타진하고 있다고 전했다. 포스코도 2020년부터 인도의 이륜차 연료탱크 시장에 뛰어들어 부식과 마모에 강한 전기아연도금강판 등을 인도 업체에 수출하고 있다.인도 전기 이륜차 시장은 향후 10년간 계속해 확대될 가능성이 크다. 인도 중앙정부는 2030년까지 신차 이륜차 판매량 중 전기 이륜차의 비율을 80%까지 늘리겠다고 밝혔다. 이는 승용차(30%)와 비교해 월등히 높은 수치다. 글로벌 컨성틸 업체 베인 앤드 컴퍼니는 “인도 소비자들의 마음을 사로잡기 위해선 바퀴 2개 차량에 집중해야 한다”며 “2030년 인도의 전기 이륜차 판매량은 1300만 대에 달할 것”이라고 전망했다."
2022-11-24,"20대 기업, 재고 50% 늘고 영업이익 급감… 中企는 파산 늘어","금융 비용 느는데 이익 줄어 이중고아시아나항공은 올 3분기 3000억원의 순손실을 기록했다. 매출과 영업이익은 지난해 같은 기간보다 57%, 3000%씩 증가한 1조6800억원, 2000억원을 기록했지만, 각종 금융비용 증가로 전체적으론 마이너스 성적표를 거둔 것이다. 이 회사는 현재 자본 잠식 상태다. 아시아나항공 재무제표 상황이 좋지 않다 보니, 재계 일각에서는 대한항공과 합병이 이뤄져도 ‘승자의 저주’가 발생할 수 있다는 우려까지 나오고 있다.항공 업계뿐 아니라 금호타이어,HJ중공업,KR모터스도 계속되는 영업적자로 회사가 원래 가지고 있는 돈을 갉아먹는 자본 잠식 상태다. 고금리 상황에서 기업들이 치러야 할 금융 비용은 가파르게 늘고 있는데 이익은 쪼그라들고 있기 때문이다.그래픽=박상훈경영 지표 악화되는 20대 기업, 재고는 50% 늘고 영업이익은 25% 줄어국내 대표 기업들의 경영 지표도 급속하게 악화되고 있다. 글로벌 경기 침체로 주요 기업들의 영업이익은 급감하고, 재고는 빠른 속도로 쌓이고 있는 상황에서 자금 경색까지 겪자 위기감이 그 어느 때보다 높아지고 있다.본지가 매출 상위 20대 기업의 재고 자산을 분석한 결과, 지난해 3분기만 해도 재고 자산 총액이 145조3000억원이었지만 올 3분기 217조9000억원으로 50% 가까이 늘었다. 권태신 전경련 부회장은 “매출 상위 20대 기업은 국내에서 최우량 기업으로, 많은 중소·중견기업을 협력 업체로 두고 있다”며 “이들 기업의 재고가 1년 사이에 50% 늘었다는 것은 우리 산업계 전반에 상당한 악영향으로 작용할 수밖에 없다”고 말했다. 20대 기업 중 재고 자산이 줄어든 곳은 한 곳도 없었다. 삼성전자(51.6%)·SK하이닉스(122%)와 같은IT대기업뿐 아니라,LG화학(56.4%), 에쓰오일(48.7%), 기아(26.5%), 포스코홀딩스(26.2%) 등 다양한 업종에서 모두 급증했다.반면 영업이익은 급감했다. 20대 기업의 올 3분기 영업이익은 약 25조원으로 지난해 같은 기간(33조6000억원)보다 25% 이상 떨어졌다. 포스코홀딩스,SK하이닉스는 전년 동기 대비 각각 70, 60%씩 급감했고, 지난해 5300억원의 영업이익을 올렸던LG디스플레이는 7600억원 영업손실로 적자 전환했다.들어오는 돈은 줄고 재고만 쌓이다 보니 기업들 자금 사정 역시 급속하게 악화되고 있다. 부채비율은 치솟고 시중 자금까지 얼어붙자, 기업들은 ‘현금 확보’에 혈안이다. 롯데그룹을 비롯해, 현대백화점그룹·효성·한화 등 주요 대기업은 보유 주식·부동산·자회사 등 돈이 되는 것은 뭐든 팔고 있다. 투자 규모도 속속 축소하고 있다. 현대차·SK하이닉스는 투자를 줄이겠다고 공개적으로 밝혔고, 포스코그룹, 현대중공업, 한화 등도 비상 경영 체제에 돌입한 것으로 알려졌다.중소·중견은 더 어려워… 중기 대출 금리 5% 넘봐, 파산도 70여 건 늘어금리 등 각종 비용이 치솟으면서 상대적으로 자본이 부족한 중견·중소기업들의 어려움은 더 심하다. 대구 섬유 업체 대표 배모(63)씨는 “올 초 3%대였던 금리가 6~7%까지 늘어나면서 한 달 상환 이자도 500만원에서 1000만원으로 2배가 됐다”며 “도시가스·전기 요금 외에도 각종 화공 약품 등 원자재 가격이 줄줄이 올랐는데, 금리까지 오르니 돈줄이 계속 말라가고만 있다”고 했다. 배씨는 “가지고 있던 아파트를 처분하거나 담보로 잡아 추가로 돈을 빌리려 해도, 지역 은행들이 사양 산업이라는 이유로 난색을 표하더라”고 말했다.한국은행에 따르면 예금 은행 신규 취급액 기준 중소기업 평균 대출 금리는 지난해 9월 3.05%에서 올해 9월 4.87%까지 치솟았다. 2014년 1월 이후 8년 8개월 만의 최고치다. 올 들어 10월까지 법인 파산 건수도 817건으로 작년 10월까지 748건보다 69건 늘어났다.매출 1조원 이상의 중견기업들 역시 불필요한 자산을 처분하고 경영 효율화에 나서고 있다. 국내 대표적인 화장품 위탁생산 기업 코스맥스는 최근 미국 오하이오주 공장을 철수하고 자산을 매각하겠다고 밝혔다."
2022-04-15,오토바이도 부릉부릉 대신 ‘위잉’… 배터리로 달린다,"배달 늘자 전기이륜차 수요 폭발인도·동남아선 전기차 대안으로지난달 18일 서울 강남구 삼성동 코엑스에서 열린 ‘인터 배터리 2022’ 행사에서LG에너지솔루션 부스에는 배달 가방이 달린 전기이륜차가 등장했다. 전시 담당자가 이륜차 좌석 밑에서 배터리팩 2개를 꺼내 충전 스테이션의 빈 곳에 꽂자, 충전이 완료된 다른 배터리팩 2개가 자동으로 분리됐다. 충전된 배터리 팩을 이륜차에 넣자 ‘충전 완료’ 표시가 떴다.LG에너지솔루션 관계자는 “10초도 안 걸리는 교체식 배터리 충전으로 종일 주행이 가능하다”고 말했다. 이 전시를 통해LG에너지솔루션은 전기이륜차 충전 시장에 진출을 알렸다.전기이륜차가 전기차를 잇는 새로운 차세대 먹거리로 급부상하고 있다. 코로나 확산으로 배달·유통 관련 이륜차 수요가 크게 늘어난 데다, 막대한 소비 잠재력을 가진 인도·동남아에서는 전기이륜차가 고가 전기차의 대안으로 평가받고 있다. 전기차 시장의 테슬라 같은 절대 강자가 아직 없는 상황에서, 이륜차 전문 제조 업체들과 배터리 업체들이 치열한 시장 선점 경쟁을 벌이고 있다.이탈리아 스쿠터 제조사 피아지오가 출시한 전기 스쿠터 '베스파 일렉트로니카'.LG에너지솔루션의 이륜차 전용 배터리셀을 탑재했다. /피아지오전기차 대안, 전기이륜차전기이륜차 투자 붐이 가장 뜨거운 곳은 인도·동남아 지역이다. ‘인도의 우버’로 불리는 현지 최대 승차 공유 스타트업 올라는 ‘올라 일렉트릭 모빌리티’를 설립하고 전기이륜차 생산에 뛰어들었다. 지난해에는 소프트뱅크 등 글로벌 투자기관들로부터 2억달러(2450억원) 투자를 유치했고, 설립 5년 만에 기업 가치가 6조원에 달한다는 평가를 받는다.급성장의 원동력은 거대한 시장 규모다. 인도는 연간 이륜차 판매량 1500만대가 넘는 세계 최대 시장이다. 컨설팅 업체 맥킨지에 따르면 2030년이면 인도 전기이륜차 판매량도 1000만대에 달할 전망이다. 올라 일렉트릭은 인도에 연간 1000만대 전기이륜차 생산이 가능한 공장을 짓고 있다. 작년 말 전기이륜차 예약 주문을 온라인으로 받았는데 24시간 만에 주문 대수가 6만대를 돌파했다.지난달 미 나스닥에 상장한 대만의 이륜차 업체 고고로도 단번에 6000억원(5억달러)을 조달하면서, 중국·인도·인도네시아의 전기이륜차 시장 공략을 강화하고 있다. 고고로는 인도네시아에 거점을 둔 동남아 최대 모빌리티 기업 고젝과 손잡고 지난해 말 전기이륜차 500대를 시범 도입했다. 인도네시아는 지난해 이륜차 판매량이 2020년보다 38% 넘게 성장해 500만대를 넘겼다. 고고로와 고젝은 2030년까지 인도네시아 이륜차를 모두 전동화하겠다는 목표를 내걸었다.인도와 인도네시아 같은 이륜차 대국들은 대부분 평균 소득 수준이 1만달러 미만이다. 최소 4000만원대인 전기차를 구매하기 힘든 단계다. 이 때문에 인도·동남아 정부는 전기차 육성 계획을 펼치면서도 전기이륜차에 대한 보조금과 충전 인프라를 동시에 구축하는 투트랙 전략을 펼치고 있다.국내 중소 업체들도 주행거리 늘려 출시한국에서도 중소 오토바이 제조사들이 전기이륜차 시장에 뛰어들고 있다. 블루샤크코리아는 전기이륜차 블루샤크 R1을 이달 출시할 예정이다. 통신칩을 탑재해 주행 상태를 실시간으로 모니터링할 수 있고, 1회 충전 주행거리도 160km에 이른다. 모헤닉모터스도 올해 상반기 전기이륜차 팩맨을 출시할 계획이다.KR모터스는 현대케피코,LG에너지솔루션과 기술 협력으로 만든 ‘이루션’을 연내에 선보일 예정이다. 국내 이륜차 시장은 혼다, 야마하 등 일본 업체에 점유율 80%를 내준 상태지만, 토종 업체들은 전기이륜차 출시를 발판 삼아 시장점유율을 되찾겠다는 계산이다.국내 업체들로서는 중국산 부품에 대한 과도한 의존도를 낮추고 품질을 높이는 것이 관건이다. 국내 중소 업체들이 내놓은 전기이륜차 대부분은 중국산 부품을 가지고 조립만 하는 곳이 많아 순수 국산 제품은 20%가량에 그친다는 게 전문가들 분석이다. 김필수 대림대 자동차학과 교수는 “우리나라처럼 오르막이 많은 환경에선 주행거리뿐 아니라 주행 성능에도 초점을 두고 전동화가 이뤄져야 한다”고 말했다."
2024-03-29,[알립니다] ‘제40회 코오롱 마라톤’ 30일 경주를 달립니다,"조선일보사와 대한육상연맹,KBS,코오롱이 공동 주최하는 ‘제40회 코오롱 구간마라톤 대회’가 3월 30일(토) 경주에서 열립니다. 1985년에 시작한 이 대회는 황영조·이봉주·지영준·임춘애 등을 배출한 국내 최고 권위의 중·고교 육상 대회로, 배문고·서울체고 등 남녀 고교 21팀, 중학교 23팀이 출전해 기량을 겨룹니다. 엘리트 학생 선수가 아닌 일반 마라톤 동호인으로 구성된 ‘런크루’ 부문도 올해 정식 종목으로 확대됐고, 총 15팀이 참가합니다. 고교, 런크루 부문은 마라톤 풀코스인 42.195㎞를 6명이 이어 달리고, 중등부는 15㎞를 4명이 나눠 달립니다. 경기는KBS1TV가 생중계합니다.▲일시: 3월 30일(토) 오전 9시 30분▲코스: 경주 시내 일원(코오롱호텔 삼거리 출발)▲상금: <고등부> 남녀 단체 1위 1000만원, 2위 500만원, 3위 300만원, 4~6위 100만원 <중등부> 남녀 단체 1위 500만원, 2위 300만원, 3위 200만원, 4~6위 50만원 <런크루> 1위 300만원, 2위 200만원, 3위 100만원▲기록 포상금: 남고부 2시간 5분, 여고부 2시간 25분 이내 기록 세울 때 5000만원▲홈페이지:www.marathon.co.kr▲문의: 대회 본부 (02)3677-8872▲협찬: 코오롱모터스·우리은행·코오롱▲주최: 조선일보사·대한육상연맹·KBS·코오롱"
2022-11-22,상폐 위기 기업 더 늘어난다,"한국거래소는 지난 15일 차량용 블랙박스 ‘위니캠’ 제조사 컨버즈에 대해 상장폐지(이하 상폐) 기준에 해당한다고 판단했다. 15일 이내 이의 신청이 없으면 상폐 절차가 진행된다.이 회사가 상폐 위기에 몰린 이유는 적자가 누적되면서 자본금을 몽땅 까먹은 완전 자본잠식 상태에 빠졌기 때문이다. 2020년 10월 이 회사가 자본잠식 사실을 공시하자 거래소는 경영 개선 기회를 줬지만 결국 요건을 충족하지 못했다. 주주 게시판에는 “2년여에 걸쳐 희망 고문을 당했다”는 성토가 이어지고 있다.컨버즈처럼 자본잠식으로 상장폐지 갈림길에 서는 기업은 더욱 늘어날 전망이다. 한계기업이 치러야 할 금융비용은 가파르게 늘어나는데, 이익은 쪼그라들고 있기 때문이다. 금리 인상과 경기 침체, 자금시장의 경색이 한꺼번에 겹친 여파다.21일 한국거래소가 코스피 상장사의 3분기 보고서를 분석한 결과, 9개 상장사가 이미 자본잠식에 빠진 것으로 나타났다. 연말도 오기 전에 적자 누적으로 자본금을 까먹기 시작한 상장사가 등장하고 있다. 유가증권시장 상장 규정상 자본금 절반 이상이 잠식되면 관리종목으로 지정되고, 이런 상황이 2년 이상 이어질 경우 상폐 대상이 된다. 자본금이 전액 잠식된 회사는 곧바로 상폐 심사를 받는다.3분기 기준 자본잠식률이 가장 높은 코스피 상장사는 한화손해보험이다. 사옥 매각, 증자에 나서고 있지만 3분기 자본잠식률이 93.4%에 달했다.━한화손보 93% 아시아나 57%…자본 까먹는 상장사 줄잇는다다만 한화손보 관계자는 “내년부터 국제회계기준(IFRS17)을 적용하면 부채가 줄고 자본잠식 상태를 벗어날 수 있을 것”이라고 말했다.그래픽=신재민 기자shin.jaemin@joongang.co.kr항공업계의 위기도 심화하고 있다. 티웨이항공은 자본금이 66.9% 잠식됐고, 아시아나항공도 계열사 에어부산·에어서울을 포함한 연결 기준으로 자본금을 57.3% 까먹었다. 이 회사의 부채비율은 지난해 말 2410.6%였지만, 올해 3분기에는 1만298%까지 상승했다. 3분기 보고서를 검토한 삼일회계법인은 ‘계속기업 관련 중요한 불확실성’이 있다고 적시했다. 부실한 재무 상태로 인해 회사가 계속해 사업을 할 수 있을지 불확실하다는 판단이다.이만우 고려대 경영대학 명예교수는 “항공사는 영업으로 벌어들이는 현금(영업활동 현금 흐름)이 마이너스 상태로 기초체력 자체가 크게 나빠진 상황”이라며 “원화가치 하락으로 외화 부채가 늘어 자금 조달마저 어렵다 보니 이중고를 겪는 것”이라고 설명했다.부동산 시장 위축과 자금시장 경색의 여파도 커지고 있다. 건설사의 부동산 프로젝트파이낸싱(PF) 상환 부담이 커지고, 상장 계열사에까지 불똥이 튀면서다. 롯데케미칼은 지난 18일 1조1000억원 규모의 주주 배정 방식 유상증자를 결정했다고 공시했다. 일진머티리얼즈 인수 자금을 마련해야 하는 상황에서 롯데건설에 대규모 지원에 나서면서 자금 부담이 늘어난 영향이다. 재무 부담이 그룹 전반으로 확대되는 상황에서 하석주 롯데건설 대표이사는 정기 임원 인사를 앞두고 사의를 표명하기도 했다.관리종목 지정 기준에 해당하진 않지만,KR모터스(38.5%)·티비에이치글로벌(30.9%)·금호타이어(13.4%)·HJ중공업(7%)·평화산업(5.4%)·아센디오(3.5%) 등의 코스피 상장사도 부분 자본 잠식 상태를 드러냈다.전문가는 내년에는 영업으로 번 돈(영업이익)으로 이자도 못 갚는 한계기업도 빠르게 늘어날 것으로 내다보고 있다. 성태윤 연세대 경제학과 교수는 “물가가 계속 오르면 금리 인상이 불가피해 금융 부담은 지금보다 더 늘어날 것”이라며 “부채가 많은 기업의 상황은 더욱 나빠지고, 이런 기업에 투자한 금융시장 전반으로도 위험이 확산할 수 있다”고 우려했다.한계기업의 연쇄 부도를 막으려면 수익 구조 자체를 바꾸는 근본적 처방이 이뤄져야 한다는 점도 강조한다. 이만우 교수는 “한계기업이 금융 지원에 의존해 수명만 연장하게 하면, 결국 부실 규모만 키우게 된다”며 “정부는 이들 기업이 근본적인 사업 구조조정으로 이익률 자체를 높일 수 있도록 업종 전환을 유도해야 할 것”이라고 강조했다."
2022-11-21,자본금 까먹는 상장사 잇따라…‘돈 가뭄’에 한계기업 더 는다,"금리 인상으로 부채 부담이 커지면 한계 선상에 놓이는 기업도 늘어나게 된다.pixabay.한국거래소는 지난 15일 차량용 블랙박스 ‘위니캠’ 제조사 컨버즈에 대해 상장폐지 기준에 해당한다고 판단했다. 15일 이내 이의 신청이 없으면 상폐 절차가 진행된다. 이 회사가 상폐 위기에 몰린 이유는 적자가 누적되면서 자본금을 몽땅 까먹은 완전 자본잠식 상태에 빠졌기 때문이다. 지난 2020년 10월 이 회사가 자본잠식 사실을 공시하자 거래소는 경영 개선 기회를 줬지만 결국 요건을 충족하지 못했다. 주주 게시판에는 “2년여에 걸쳐 희망고문을 당했다”는 성토가 이어지고 있다.컨버즈처럼 자본잠식으로 상장폐지 기로에 서는 기업은 더욱 늘어날 전망이다. 한계 기업들이 치러야할 금융 비용은 가파르게 늘어나는데, 이익은 쪼그라들고 있기 때문이다. 금리 인상과 경기 침체, 자금시장의 경색이 한꺼번에 겹친 여파다.━3분기 코스피 상장사 9곳 자본잠식21일 한국거래소가 코스피 상장사들의 3분기 보고서를 분석한 결과, 9개 상장사가 이미 자본 잠식에 빠진 것으로 나타났다. 연말도 오기 전에 적자 누적으로 자본금을 까먹기 시작한 상장사가 등장하고 있는 것이다. 유가증권시장 상장 규정상 자본금 절반 이상이 잠식되면 관리종목으로 지정되고, 이런 상황이 2년 이상 이어질 경우 상폐 대상이 된다. 자본금이 전액 잠식된 회사는 곧바로 상폐 심사를 받는다.3분기 기준 자본잠식률이 가장 높은 코스피 상장사는 한화손해보험이다. 사옥 매각, 증자에 나서고 있지만, 3분기 자본잠식률이 93.4%에 달했다. 다만 한화손보 관계자는 “내년부터 국제회계기준(IFRS17)을 적용하면 부채가 줄고 자본잠식 상태를 벗어날 수 있을 것”이라고 말했다.항공업계의 위기도 심화하고 있다. 티웨이항공은 자본금이 66.9% 잠식됐고, 아시아나항공도 계열사 에어부산·에어서울을 포함한 연결 기준으로 자본금을 57.3% 까먹었다. 이 회사의 부채비율은 지난해 말 2410.6%였지만, 올해 3분기에는 1만298%까지 상승했다. 3분기 보고서를 검토한 삼일회계법인은 ‘계속기업 관련 중요한 불확실성’이 있다고 적시했다. 부실한 재무 상태로 인해 회사가 계속해서 사업을 할 수 있을지 불확실하다는 판단이다.이만우 고려대 경영대학 명예교수는 “항공사들은 영업으로 벌어들이는 현금(영업활동 현금흐름)이 마이너스 상태로 기초체력 자체가 크게 나빠진 상황”이라며 “원화가치 하락으로 외화 부채가 늘어 자금 조달마저 어렵다 보니 이중고를 겪는 것”이라고 설명했다.부동산 시장 위축과 자금시장 경색의 여파도 커지고 있다. 건설사의 부동산 프로젝트파이낸싱(PF) 상환 부담이 커지고, 상장 계열사에까지 불똥이 튀면서다. 롯데케미칼은 지난 18일 1조1000억원 규모의 주주 배정 방식 유상증자를 결정했다고 공시했다. 일진머티리얼즈 인수 자금을 마련해야 하는 상황에서 롯데건설에 대규모 지원에 나서면서 자금 부담이 늘어난 영향이다. 재무 부담이 그룹 전반으로 확대되는 상황에서 하석주 롯데건설 대표이사는 정기 임원 인사를 앞두고 사의를 표명하기도 했다.관리종목 지정 기준에 해당하진 않지만,KR모터스(38.5%)·티비에이치글로벌(30.9%)·금호타이어(13.4%)·HJ중공업(7%)·평화산업(5.4%)·아센디오(3.5%) 등의 코스피 상장사도 부분 자본 잠식 상태를 드러냈다.그래픽=신재민 기자shin.jaemin@joongang.co.kr━“내년 한계기업 더 는다…사업 구조조정 유도해야”전문가들은 내년에는 영업으로 번 돈(영업이익)으로 이자도 못 갚는 한계기업도 빠르게 늘어날 것으로 내다보고 있다. 성태윤 연세대 경제학과 교수는 “물가가 계속 오르면 금리 인상이 불가피해 금융 부담은 지금보다 더 늘어날 것”이라며 “부채가 많은 기업의 상황은 더욱 나빠지고, 이런 기업에 투자한 금융시장 전반으로도 위험이 확산할 수 있다”고 우려했다.한계기업의 연쇄 부도를 막으려면 수익 구조 자체를 바꾸는 근본적 처방이 이뤄져야 한다는 점도 강조한다. 이만우 교수는 “한계기업이 금융 지원에 의존해 수명만 연장하게 하면, 결국 부실 규모만 키우게 된다”며 “정부는 이들 기업이 근본적인 사업 구조조정으로 이익률 자체를 높일 수 있도록 업종 전환을 유도해야 할 것”이라고 강조했다."
