date,title,content
2024-03-27,"LG그룹, 5년간 100조원 국내에 투입한다","(주)LG는 이번 주주총회에서 중장기 투자계획을 공유했다.LG그룹 차원에서 2028년까지 5년 동안 약 100조원을 국내에 투입하겠다는 것이다.LG관계자는 “이는LG의 글로벌 총 투자 규모의 65%에 해당한다”고 말했다.LG는AI,바이오, 클린테크와 같은 미래 기술과 배터리, 자동차 부품, 차세대 디스플레이 등 성장 분야에 국내 투자액의 50%를 투자한다는 계획이다. 이번에 발표한 투자 재원의 약 55%를 R&D(연구개발)에 투입해 국내를 핵심 소재 연구개발과 스마트 팩토리 등 제조 핵심기지로 육성할 계획이라고 밝혔다.이번 주총에서 구광모 ㈜LG대표는 사내이사에, 이수영 사외이사는 감사위원회 위원에 재선임됐다. 구 대표는 “주력 사업은 전후방 산업의 변화를 면밀히 살피며, 사업 전반의 본원적 경쟁력 강화를 통해 어떠한 상황에서도 성과를 내는 단단한 사업 구조를 만들어 가겠다”며 “성장 사업은 고객과 시장이 요구하는 핵심 경쟁력을 조기에 확보하여 주력 사업화하고, 미래 사업은AI,바이오, 클린테크 분야를 중심으로 속도감 있게 추진하여 미래 포트폴리오의 한 축으로 키워가고자 한다”고 밝혔다.LG로고 /LG"
2024-03-27,"LG, R&D에 56조원 투자...한국을 첨단기술 메카로","여의도LG그룹 사옥/주완중 기자LG그룹이 올해부터 2028년까지 5년 동안 투자한다고 밝힌 102조원은 온전히 국내에 투입된다.LG관계자는 “같은 기간LG의 글로벌 총 투자 규모의 65%에 달하는 규모”라고 설명했다. 이번 투자로 3만5000~4만명의 고용 창출을 할 것으로 재계에서는 예상한다.LG가 27일 밝힌 내용에는 탈(脫)중국화 흐름과 글로벌 공급망 재편의 혼란기에LG가 고민한 한국 활용 전략이 담겨 있다는 해석이 나온다.LG는 2018년 취임한 구광모 회장이 그룹 미래 먹거리이자 신성장 동력으로 제시한 ‘ABC(AI·바이오·클린테크)’ 분야 등에 투자 재원의 50%인 50조원 이상을 투자한다는 계획이다. 구체적으로는 R&D(연구·개발)에만 56조원을 투자한다. 당초 계획은 2026년까지 48조원을 R&D에 투자한다는 것이었는데, 투자 금액이 늘었다. 중국, 신흥국 등과의 가격 경쟁, 미국 등의 생산 기지 이전 요구 등에 맞춰 해외 진출은 계속 진행하는 동시에 한국을 철저하게LG그룹의 R&D,최첨단 고부가 제품 생산 기지로 활용하겠다는 전략이다.이번 발표에선LG그룹의 미래 사업 전략도 담겼다.LG는 투자 재원 가운데 절반인 50조원 이상을 기존 주력 사업인 생활 가전, 디스플레이, 석유화학 등에 투자한다는 방침이다. 동시에LG는 같은 규모인 50조원 이상을AI,바이오, 클린테크 등의 미래 기술과 배터리, 자동차 부품, 차세대 디스플레이 등 성장 분야에 투입하겠다고 밝혔다.LG는 이번 투자 발표를 통해 미래 사업을 상징하는ABC분야에 확실한 ‘선택과 집중’의 의지도 담았다. 구광모 회장은 이날 (주)LG주주총회 영업보고서 인사말을 통해 “미래 사업은AI,바이오, 클린테크 분야를 중심으로 속도감 있게 추진해 미래 포트폴리오의 한 축으로 키워가고자 한다”고 말했다."
2024-11-10,LG Display unveils world’s first stretchable screen expanding up to 50%,"LGDisplayhasunveiledagroundbreakingstretchabledisplaythatcanexpandupto50%, aworld-firstinnovationthatshowcasesthecompany’sadvancementsinflexiblescreentechnologyanditspotentialapplicationsinindustriesfromfashiontomobility./LGDisplayLGDisplayannouncedthatithassuccessfullydevelopedtheindustry’sfirststretchabledisplaythatcanexpandupto50%ofitsoriginalsize.ThecompanyunveiledthedisplayonNov.8duringthefinalreviewmeetingofthegovernment-ledthestretchabledisplaydevelopmentprojectatLGScienceParkinSeoul,showcasingfiveyearsofresearchanddevelopmentachievements.Thestretchabledisplaytechnologyallowsthescreentobeexpanded,folded,andtwistedfreely.Lightweightandthin,itcanadheretoirregularsurfaces,suchasclothingorskin,openingpossibilitiesforbroadapplicationsacrosssectorsincludingfashionandmobility.ThestretchabledisplaytechnologydevelopedbyLGDisplay./LGDisplayThenewlyrevealedprototypefeaturesa 12-inchscreenthatcanexpandto18incheswhilemaintaininghighresolutionof100pixelsperinch(ppi)anddisplayingred,green,andblue(RGB)colors.Comparedtotheinitialprototypereleasedin2022,whichhadamaximumstretchabilityrateof20%,thislatestmodeldoublesthestretchabilityto50%,offeringgreaterflexibilityindisplaydesign.AnLGDisplayrepresentativenoted,“Weappliedseveralnewtechnologies,suchasenhancedcharacteristicsofaspecialsiliconsubstrateusedincontactlensesandanewwiringstructuredesign,toimproveflexibilitysignificantly.Thisexceedstheinitialtargetstretchabilityrateof20%setbythenationalproject.”"
2024-11-11,"[Minute to Read] Samsung, SK, Hyundai, and LG Expand U.S. relations as Trump returns","TheMinutetoRead(Weekdays)seriesprovidesaquickoverviewofsignificanteventsinKoreaeveryday,convenientlycondensedintoaone-minuteread.Here’sarecapofwhathappenedyesterday:Nov.10.SouthKorea’slargestconglomeratesaremovingswiftlytoreinforcetheirdiplomaticandbusinessstrategies,anticipatingstrongertieswiththeU.S.asformerPresidentDonaldTrumppreparestotakeofficeagaininJanuary./APYonhapNewsSamsung,SK,Hyundai,andLGExpandU.S.relationsasTrumpreturnsFollowingDonaldTrump’sconfirmedwinintheU.S.presidentialelection,SouthKorea’stopconglomerates—Samsung,SK,Hyundai,andLG—arebolsteringtheirU.S.tiesinanticipationofhisadministrationstartinginJanuary.Keyleaders,includingSamsung’sLeeJae-yongandSK’sCheyTae-won,areenhancingdiplomaticandpublicaffairsefforts,buildingconnectionswithTrumpallies,andplanningparticipationinmajorU.S.-Koreabusinessevents.TheFederationofKoreanIndustries(FKI)willplayabridgingrole,withleadersmeetinginWashingtonnextmonthtofurtherstrengthenbilateraleconomicrelations.ImHyun-taekwasoustedaspresidentoftheKoreanMedicalAssociation(KMA)onSaturdayfollowingano-confidencevotebytheorganization’srepresentatives,markingonlythesecondimpeachmentinKMA’shistory./News1KMAimpeachesPresidentImHyun-taekafter6monthsinofficeImHyun-taek,presidentoftheKoreanMedicalAssociation(KMA),wasimpeachedonNov.10afteravoteofno-confidencebytheassociation’scouncil,followingcriticismoverhishandlingofkeyissuesandallegedmisconduct.Im’ssix-monthtenurehasended,andanemergencyresponsecommitteewillmanagetheKMAuntilaby-electionforanewpresidentisheldwithin60days.ImisthesecondKMApresidenttobeimpeached,withthefirstbeingRohHwan-kyuin2014.AnexplosionatPOSCO’sPohangsteelplantsparkedafireearlySunday,sendingtremorsthroughnearbyneighborhoodsandinjuringoneworkerbeforefirefighterscontainedtheblazefivehourslater./Gyeongsangbuk-doFireDepartmentExplosionatPOSCOsteelplantsparksmassivefire,injuresworkerAfirebrokeoutearlySundayatPOSCO’sPohangsteelplantduetoanexplosionattheNo.3Finexplant,whichproducesmolteniron.Firefighterstookfivehourstoextinguishtheblaze,withoneworkersufferingsecond-degreeburnswhilecontainingtheflames.Theexplosionwasfeltinnearbyneighborhoods,andauthoritiesareinvestigatingthecauseandextentofthedamage.Oneminute,that’sallittakestoknowaboutKorea.Clickhere☞https://page.stibee.com/subscriptions/305897"
2024-11-06,LG·포스코·현대차… 양자컴에 기업도 사활,"[한국도 양자컴퓨터 시대] [下]지난달 29일 서울LG전자 서초R&D캠퍼스에서 임직원들이 양자 컴퓨터 응용 연구를 시연하는 모습. /김지호 기자국내 주요 기업들은 양자 컴퓨터를 주력 사업에 접목하기 위해 연구·개발에 속도를 내고 있다. 양자 컴퓨터가 아직 기술 성숙 단계에 접어들지 않았음에도 적극적으로 나서는 것이다.지난달 29일 서울 서초구에 위치한LG전자 서초R&D캠퍼스에서는 양자 컴퓨터를 활용해 수소 원자의 물성을 파악하는 가상 실험을 하고 있었다. 두 원자가 반응할 때 언제 가장 안정적인지 확인하기 위한 것이다.LG전자는 제품 설계나 신물질, 배터리, 디스플레이 개발 등 다양한 분야에서 양자 컴퓨터 활용 방안을 연구하고 있다. 김성혁LG전자 상무는 “제품 개발 과정에서 풀지 못했던 여러 난제를 양자 컴퓨터로 해결한다는 도전적 목표를 세웠다”고 했다.포스코홀딩스는 양자 컴퓨터를 활용해 친환경 제철에 사용되는 수소의 생산 공정 최적화와 이차 전지 소재 개발에 집중할 계획이다. 현대자동차는 자체 양자 컴퓨터 알고리즘을 개발하고 있다. 배터리 효율을 높이는 데 활용할 것으로 알려졌다.기업들이 양자 컴퓨터 도입에 적극 나서는 이유는 획기적 성능 때문이다. 수퍼 컴퓨터를 뛰어넘는 연산 속도와 에너지 효율로 기존에 넘지 못한 한계를 뛰어넘을 것으로 기대하는 것이다. 양자 컴퓨터는 제약·바이오, 소재, 금융, 물류 등 다양한 분야에 활용이 가능하고, 실제로 글로벌 기업들도 양자 컴퓨터를 속속 도입하고 있다. 에너지 기업 엑손모빌은 양자 컴퓨터를 활용해LNG선의 최적 경로를 찾고 있고, 보잉은 마그네슘 등 항공기의 무게를 줄일 수 있는 소재를 개발 중이다.HSBC는 금융 상품 포트폴리오를 만들거나 사기 예방 등에 양자 컴퓨터를 활용한다는 계획이다. 테크 업계 관계자는 “앞으로는 양자 컴퓨터 활용 여부가 기업의 경쟁력을 좌우할 것”이라며 “지금이라도 빠르게 양자 컴퓨터 역량을 확보하는 것이 중요하다”고 말했다."
2024-11-01,美타임지 ‘올해 최고발명품’ 삼성·LG전자 TV제품 선정,"LG전자는 세계 최초로 선보인 무선∙투명 올레드TV'LG시그니처 올레드T'와 초프리미엄 빌트인 가전 '시그니처 키친 스위트 콤비 월 오븐'이 미국 시사주간지 '타임'(TIME)이 선정한 '올해 최고 발명품'에 선정됐다고 31일 밝혔다. 이 제품은TV주변기기와 연결선은 모두 별도의 '제로 커넥트 박스'로 옮겨 선이 엉킬 염려가 없다. /LG전자삼성전자와LG전자의 제품이 미국 시사주간지 타임이 뽑은 ‘올해의 최고 발명품’에 선정됐다. 타임은 매년 혁신적인 제품과 서비스 200개를 선정해 발표한다.31일 타임은 소비자 가전, 인공지능(AI), 로봇, 의료 서비스 등 총 28개 부문에서 200개의 혁신 제품을 올해의 발명품으로 선정했다. 소비자 가전 부문에서는 삼성전자의 2024년형 네오QLED8KTV와LG전자의 세계 최초 무선·투명 올레드(OLED·유기발광다이오드)TV‘LG시그니처 올레드T’가 나란히 이름을 올렸다. 타임은 삼성의 네오QLED8KTV에 대해 “오래된 콘텐츠를 보다 선명하게 즐길 수 있도록AI기술을TV에 탑재했다”고 평가했다.LG전자의 ‘시그니처 올레드T’에 대해서는 “공중에 떠 있는 것처럼 보이는 투명한 화면이 미묘하게 매력적”이라고 평가했다. 삼성과LG의 제품 외에 화웨이의 두 번 접는 스마트폰 ‘메이트XT’와 가장 얇은 폴더블 스마트폰인 아너의 ‘매직V3′ 등 중국 제품들도 포함됐다."
2024-10-31,내부에 프리미엄 가전이… LG전자가 만든 농막 보니,"‘스마트코티지’ 본격 판매LG스마트코티지 본격 출시./LG전자LG전자가 가전과 냉난방공조(HVAC) 기술을 집약한 소형 모듈러 주택을 출시했다. 지방의 소규모 별장이나 주말농장용 농막(農幕)으로 활용될 수 있다.LG전자는 30일 ‘LG스마트코티지(LGSmartCottage)’ 공식 홈페이지를 열고 일반고객(B2C)과 기업∙단체고객(B2B)에 본격 판매한다고 밝혔다. 내부에는 식기세척기와 인덕션, 광파오븐, 정수기 등LG전자의 프리미엄 가전이 설치된다. 감시카메라와 전동 블라인드 등 다양한IoT(사물인터넷) 기기들도 설치돼 ‘LG씽큐 앱’으로 가전과IoT기기들을 통합 관리할 수 있다. 또 인공지능(AI)이 사용자와 일상언어로 대화하며IoT기기를 제어할 수 있다.또 건물에는 에너지 절감을 위해 히트펌프 냉난방공조 시스템이 적용되고, 지붕 부착형 태양광 패널을 옵션으로 선택할 수 있다. 빠르고 편리하게 지을 수 있는 것도 장점이다. 모듈 구조체와 창호, 배선, 욕실, 주방기구 등 자재의 70% 이상을 미리 제작한 뒤 배송해 만들어진다.LG전자는 “기존 철근콘크리트 공법 대비 공사 기간을 최대 50% 이상 단축할 수 있다”고 했다. 거실과 침실, 부엌, 욕실로 구성되고, 형태는 단층형과 2층형이 있다. 가격은 1억8000만원부터 시작한다."
2024-11-08,AI가 대신 전화받는다… LG유플 ‘익시오’ 공개,"대화 내용 실시간으로 보여주고보이스피싱 위험 감지해 경고도황현식 대표가 11월7일 기자간담회서AX추진 전략을 설명하고 있는 모습. /LG유플러스LG유플러스가 이용자의 스마트폰으로 걸려온 전화를 대신 받아주거나 통화 내용을 실시간 문자로 풀어서 보여주는 인공지능(AI) 통화 비서 앱 ‘익시오’를 7일 출시했다.우선 통화를 할 때 화면에서 ‘보이는 전화’ 버튼을 누르면 대화 내용을 실시간으로 풀어 글로 띄워준다. 회사 관계자는 “지하철처럼 시끄러운 장소에서 상대방 목소리가 잘 들리지 않을 때나 통화 도중 앞서 이야기한 내용을 확인하고 싶을 때 유용할 것”이라고 했다. 전화 받기 어려운 상황일 때는 ‘AI전화 대신 받기’ 버튼을 누르면AI가 미리 설정해 놓은 목소리로 전화를 대신 받아 기록을 해준다.통화 내용이 보이스피싱으로 의심되면 곧바로 경고해주는 기능도 있다. 보이스피싱범이 쓰는 패턴·키워드를AI에 학습시켰다. 통화 녹음·요약 기능도 제공한다. 회사 관계자는 “통화 데이터를 서버로 보내지 않고 스마트폰 자체에서 처리하는 온디바이스(내장형)로 구현했기 때문에 정보 유출 우려도 적다”고 했다. 익시오는 약 1만명의 고객에게 어떤 기능이 필요한지, 서비스 품질은 어떤지 의견을 물은 끝에 나왔다고 한다. 다만 현재는 아이폰용에서만 가능하고, 갤럭시(안드로이드)용은 내년 1분기 안에 나올 예정이다.황현식 대표는 이날 출시 기념 기자간담회에서 “고객이 원하는 건AI원천 기술이 아닌 실제 생활에서 사용할 수 있는 서비스”라며 “익시오처럼 고객이 생활에서 체감할 수 있는AI응용 서비스를 만드는 데 집중하겠다”고 했다.LG유플러스는 오는 2028년까지AI분야에 최대 3조원을 투자할 계획이다."
2024-12-28,공짜로 나눠준 ‘호외’ 신문지… “×만원에 구합니다”,"[아무튼, 주말]세상사 담긴 굿즈號外 챙기셨나요?특별판은 특별한 것이고, 특별함은 돈이 된다.“12월 4일 자 호외 구해요. 신문사 안 가립니다.” “12월 14일 자 탄핵소추안 가결 호외 구합니다! 가격 제시해주세요.” 최근 중고 거래 시장에서 잇따라 목격되는 구매 희망 게시글이다. 품목은 호외(號外) 신문지. 관심도 높은 대형 사건을 재빨리 알리기 위해 신문사마다 긴급 제작해 거리에 배포하는 호외가 일종의 ‘리미티드 에디션’으로 간주되면서 웃돈까지 붙어 거래되고 있는 것이다. 한 부당 5000~6000원이 가장 흔한데, 1만원 수준에 거래되는 경우도 적지 않다. 하루치 정보 전달의 소임을 다하고 재활용함으로 들어가곤 하던 신문지가 ‘컬렉션’의 새 품목이 돼가는 신(新)풍속도.웃돈 붙여… 2030 ‘호외 컬렉션’ 불붙다대통령 탄핵소추안이 국회 본회의를 통과한 지난 14일 오후 서울역에서 조선일보 호외가 시민들에게 배포되고 있다. 신문 제호 옆 검은색 네모 안에 '호외' 글씨가 적힌 이 신문지는 이른바 '역사 굿즈'가 됐다. /오종찬 기자호외의 재각광을 이끈 건 12·3 비상계엄 사태였다. 이튿날 서울 광화문·여의도 및 서울역 등 유동 인구 밀집 지역에 배포됐다. 2017년 3월 10일 박근혜 전 대통령 파면 결정 이후 7년 만의 호외였다. 지난 14일 윤석열 대통령 탄핵안이 국회 본회의를 통과하자 조선일보 등 전국지뿐 아니라 전남일보 등 지역지까지 또 한 번 호외를 발행했다. 열흘 새 호외가 두 차례나 뿌려진 이례적 상황. 이날 밤 여의도 국회의사당 일대 집회에 참여했던 한 20대 시민은 “평소 신문을 구독하지는 않지만 호외는 역사적 순간이 기록된 ‘굿즈’라는 생각이 들어 챙겼다”고 말했다.나라를 뒤흔든 소식이 담겼기 때문이다. 소설가 한강의 노벨문학상 수상도 마찬가지였다. 한국인 최초, 아시아 여성 최초의 쾌거. 한강의 모교 연세대 교내 신문 연세춘추는 노벨문학상 수상자 발표 이튿날인 지난 10월 11일, 호외 1700부를 발행했다. 기성 신문사가 아닌 학보사에서 호외를 내는 건 좀처럼 보기 어려운 광경. 과연 올해는 ‘호외의 해’였던 것이다. 그간 종이 신문과는 다소 거리가 있던 2030세대를 중심으로 호외 인증 및 소장 열기가 퍼져나갔다. 인스타그램에는 이미 ‘#호외’ 관련 1000건에 달하는 게시물이 올라와 있다. “드라마 말고 현실의 호외는 이번이 초면이네요.”소설가 한강이 올해 노벨문학상 수상자로 발표된 다음 날 연세대 학보사 연세춘추가 발행한 호외. /뉴스1온라인 뉴스가 보편화된 시대, 종이 신문이 지닌 물성(物性)의 가치가 다시 한번 확인됐다는 평가도 나온다. 서울대 언론정보학과 한규섭 교수는 “가장 뜨거운 역사적 격변이 기록된 증거이자 실질적으로 손에 쥘 수 있는 물건이라는 점에서 종이 신문에 ‘기념품’의 가치가 강화된 것”이라며 “젊은 세대의 ‘인증 문화’를 통해 그 순간과 현장에 내가 있었다는 기억의 증표로 활용되는 측면이 있다”고 했다. 수집하는 인간, 호모 콜렉투스를 자극했다는 것이다.호외의 역사, 갑오변란부터 월드컵까지그래픽=송윤혜비정규적으로 별도 배달돼 별배달(別配達)로도 불리던 호외, 그 역사는 100여 년 전으로 거슬러 올라간다. 조선신보가 1894년 7월 23일 자로 찍어낸 ‘일본군 경복궁 침범 사건(갑오변란)’ 호외가 국내 최초로 평가받는다. 조선신보는 일본인이 발행한 신문이었다. 한국인이 발행한 최초의 호외는 1898년 2월 19일 독립신문이 보도한, 미국 군함 메인호(號)가 쿠바 아바나항에서 폭침됐다는 소식이었다. 조선일보·동아일보가 창간한 1920년대부터 호외는 본격화됐다. 빗발친 건 1960년대였다. 습격, 납치, 화재, 북한…. 1969년에는 미국 우주선 아폴로11호의 달 착륙이 호외로 나오기도 했다. 인류 최초의 뉴스였기 때문이다.TV보급이 대중화되면서 잦아들었지만 호외는 계속됐다. 특히 급작스러운 지도자의 죽음, 호외의 가장 대표적인 존재 이유였다. 1979년 10월 27일 자 박정희 대통령 서거 호외가 대표적이다. 옆나라에서도 큰일이었다. 이날 발행된 일본 요미우리 호외 신문은 현재 50만원에 판매(중고나라)되고 있다.1994년 7월 8일 새벽, 북한 김일성이 사망했다. 다음 날 각 신문사는 ‘金日成 사망’ 다섯 글자가 대문짝만 하게 찍힌 긴급 호외를 발행했다. 얼마에 거래될까? 중고 거래 앱 번개장터에는 관련 호외 4종이 35만원에 매물로 나와 있다. 당대의 가장 생생한 사료. 1997 년 8월 6일 자KAL기 괌 추락 사고 호외 판매자는 이런 글을 남겨 놨다. “근대사를 수집하시는 분, 가치를 아시는 분께 추천 드립니다.”팬덤 자극… ‘야구 우승 특별판’도지난해 스포츠서울 10월 4일자LG트윈스 우승 특별판. 판매자는 1만원의 가격을 제시했다. /중고나라스포츠의 감격도 호외로 이어진다. 2002년 한·일 월드컵 4강 진출 호외에 이어, 2006년 독일 월드컵 당시에도 본선에서 맞붙은 프랑스와 1대1로 비겨 16강 진출 가능성이 높아지자 일부 신문사는 6월 19일 자 호외를 발행했다. 축구뿐 아니다. 지난해 10월 3일 프로야구팀LG트윈스가 29년 만의 정규 리그 우승을 차지하자, 다음 날 스포츠지(紙)가 동나는 소동이 벌어졌다. 호외는 아니었지만, 감동의 순간을 오래도록 간직하고픈LG팬들이 1면에 관련 소식이 실린 스포츠 신문을 ‘싹쓸이’ 했기 때문이다. 스포츠서울은 이틀 뒤 10월 4일 자 신문을 ‘특별판’으로 2000부 제작해 잠실구장에서 무료 배포하기도 했다. 선수단 사진과 1990·1994년 우승 당시 1면 사진이 지면 곳곳에 담긴, 일종의 팬 서비스였다.지난해 일본 닛칸스포츠가 발행한 인기 애니메이션 '주술회전' 관련 호외. 중고 호가가 4만원이 넘는다. /네이버스토어일본에서는 이 같은 팬심(心) 공략에 더 적극적이다. 지난해 9월 22일 일간지 닛칸스포츠가 만화 회사와 손잡고 판타지 애니메이션 ‘주술회전’ 호외를 제작해 도쿄 시부야 번화가 일대에 배포했다. 전날 밤 방영분에서 인기 캐릭터 ‘고죠 사토루’가 적에 의해 시부야역 내에 봉인됐다는 사실(?)을 전하는 특별판이었다. 역시 만화의 나라. 이날 1인 1부 한정 무료 배부된 이 호외 신문은 곧장 값이 뻥튀기돼 중고 시장에 쏟아져 나왔다. 현재 국내 중고 거래 플랫폼에는 4만2000원에 매물이 있다.패션이 된 신문지, 날개 돋치다신문 1면을 유명 스트리트 브랜드'Supreme'로고만으로 꾸민 뉴욕포스트 특별판이 가판대에 놓여있다. 순식간에 품절됐고, 고가에 중고 거래되고 있다. /뉴욕포스트 인스타그램미국 보수 성향의 타블로이드지 뉴욕포스트는 2018년 8월 13일 뉴욕 전역의 가판대에서 오전 7시 무렵 전량 품절 사태를 겪었다. 1면을 전부 비우고 ‘Supreme’(슈프림) 로고 하나만 넣은 파격 디자인 때문이다. 슈프림이 무엇인고 하니, 뉴욕 기반의 세계적 스트리트 의류 회사다. 옷·신발뿐 아니라 심지어 그냥 벽돌에도 ‘Supreme’로고만 박아 넣으면 실제 수십 만원에도 팔려나가는 컬트적 인기 브랜드. 보수 신문과 가장 젊은 패션의 상징이 만난 역사적인 협업, 50부짜리 신문 묶음을 통째로 사 가는 리셀러(reseller)가 부지기수로 등장한 이유였다.뉴욕포스트 발행인 제시 안젤로는 뉴욕타임스 인터뷰에서 “우리는 이것이 수집가의 아이템이 될 거라는 걸 알고 있었다”고 말했다. 당시 한 부 1달러에 판매된 이 신문지는 현재 5만~10만원 수준에 거래되고 있다. 작전에 성공한 것이다. 이후 미국 샌프란시스코 위클리는 2019년 10월,LA위클리는 지난해 2월 프런트 페이지를 ‘Supreme’로고만으로 채운 특별판(광고)을 내놨다. 이 신문지는 액자 보관용 인테리어 상품이 돼 팔리고 있다. 바야흐로 신문의 영역이 패션까지 확장한 것이다."
2024-03-06,‘LG 구겐하임상’ 美작가 슈리칭,"LG와 구겐하임 미술관이 2024년'LG구겐하임 어워드' 수상자로 슈리칭(ShuLeaCheang) 을 선정했다고 5일 밝혔다. 사진은 2024년'LG구겐하임 어워드' 수상자 슈리칭(ShuLeaCheang)./LG제공LG는 올해 ‘LG구겐하임 어워드’ 수상자로 대만 출신 미국 작가 슈리칭(70)을 선정했다고 5일 밝혔다. 슈리칭은 1990년대에 인터넷을 활용한 현대미술 장르인 ‘넷 아트(NetArt)’ 분야에서 선구자로 꼽히는 작가이다.LG구겐하임 어워드는LG가 미국 구겐하임 미술관과 함께 기술을 활용해 예술 활동을 펼치는 작가를 선정해 시상한다. 작년 첫 시상을 시작으로 2027년까지 매년 한 명의 작가를 선정해 10만 달러(약 1억3300만원)의 상금과 트로피를 준다.올해 수상자인 슈리칭은 뉴욕대에서 영화학 석사 학위를 받고 주로 미국과 유럽에서 활동하고 있다. 30년 넘게VR(가상현실), 코딩 등 신기술을 활용한 예술적 실험을 이어왔다는 평가다. 심사단은 “슈리칭은 형식에 얽매이지 않고, 다양한 기술을 활용한 실험적 예술을 펼쳤다”고 선정 이유를 밝혔다."
