date,title,content
2024-12-30,KTX에서 5G 느린 이유 있었네…5G 품질 미흡지역 전부 고속철도,"통신서비스 커버리지 점검 및 품질평가 결과대도시 농어촌 간 5G 속도 격차 1.7배평균 속도는 세계 주요 7개국 3배 이상서울 용산의 휴대폰 매장 앞으로 한 시민이 지나가고 있다. 뉴스1올해 국내 통신 3사의 5세대(G) 통신 전송속도는 지난해보다 9.2% 빨라졌다. 다만 5G 전국망 구축이 완료됐는데도 대도시와 농어촌 지역 간 5G 속도 격차가 1.7배에 달해 개선이 필요하다는 지적이 나온다.과학기술정보통신부(과기정통부)는 30일 통신서비스 커버리지 점검 및 품질평가 결과를 발표했다. 5G 다운로드 전송 속도는 3사 평균 1025.52Mbps로 지난해(939.14Mbps)에 비해 9.2% 빨라졌다. 해외 7개 주요국의 평균 다운로드 속도인 331.21Mbps(한국통신사업자연합회)보다는 3배 이상 빠른 수치다. 통신사별로는SK텔레콤(1064.54Mbps),KT(1055.75Mbps),LG유플러스 (956.26Mbps) 순이었다. 서울 등 대도시에선KT(1170.07Mbps)가SKT(1169.84Mbps)를 근소하게 앞서기도 했다.5G 전국망 구축이 완료됐지만 서울·6대 광역시와 농어촌의 차이는 여전히 해결되지 않은 것으로 나타났다. 과기정통부는 농어촌 지역의 5G 커버리지를 확대하기 위해 2021년부터 통신 3사가 지역을 나눠 통신망을 구축하고, 이를 다시 공동으로 활용하게 했다. 그러나 여전히 대도시의 5G 다운로드 속도(1121.54Mbps)에 비해 농어촌 속도(645.70Mbps)가 느린 것으로 나타났다. 지난해에 이어 올해도 격차가 1.7배에서 줄어들지 않았다. 이도규 과기정통부 통신정책관은 “이번 평가는 5G 전국망이 완성된 첫 해 발표하는 품질평가라는 점에서 의미가 있다”며 “농어촌 품질 격차가 확인된 만큼, 통신사의 지속적인 투자가 필요하다”고 밝혔다.고속 철도 구간에서 서비스 품질도 미흡한 것으로 나타났다. 전체 400개 점검지역 중 5G 서비스 품질 미흡 지역은 3사 평균 8.3개였는데, 모두KTX·SRT고속철도 구간이었다. 품질 미흡 지역은 전송 성공률(5G의 경우 12Mbps이상으로 전송 성공한 비율)이 90% 이하인 곳을 뜻한다.공원, 경기장 등 전국 1223개 공공장소에 무료로 제공하는 공공 와이파이(WiFi) 서비스에선LG유플러스가 다운로드(540.67Mbps)와 업로드(576.72Mbps) 속도 모두 1위를 기록했다.통신사별 5G 다운로드 전송속도 분포 그래프. 자료 과기정통부통신 3사가 공개하는 5G 커버리지 맵 정보와 총 600개 전국 행정동의 실제 커버리지 점검 결과를 비교한 결과에선KT맵정보에서 1개 지역만 과대 표시한 것으로 확인됐다. 지난해 3사 합산 8개였던 것에 비해 줄어든 수치다."
2024-09-26,"구광모 “가전 1등, 배터리 첫 양산...최고‧최초의 LG 역사 만들자”","“모두가 백색가전의 한계 말했지만, 30% 성장을 목표로 세워 글로벌 시장 1등 브랜드를 만들었다. 최고‧최초의 도전적 목표 세워LG미래에 기록될 역사를 함께 만들자.”구광모LG회장이 계열사 사장단 워크숍에서 이렇게 말했다.LG는 지난 25일 경기도 이천에 있는LG인화원에서 구 회장을 비롯한 계열사 최고경영자(CEO), 사업본부장 등 40여 명이 모여 최근 경영 환경에 대한 분석, 경쟁력 확보 방안 등을 논의하는 워크숍을 개최했다고 26일 밝혔다.지난 25일 경기도 이천LG인화원에서 진행된 사장단 워크숍에 참석한 구광모LG회장(왼쪽에서 두 번째).LG올해LG사장단 회의는 지난 3월 서울 마곡LG사이언스파크, 5월 평택LG전자 생산기술원에서 진행한 데 이어 이번이 세 번째다. 지난해까지만 해도 사장단 회의는 본사인 서울 여의도LG트윈타워에서 열렸지만, 올해부터 사업장 등을 찾아 자유롭게 토론하는 방식으로 바뀌었다.이날 구 회장은 “모두가 백색 가전의 한계를 말했지만, 우리는 백색 가전의 성장세 둔화 속에서도 5% 개선이 아닌 30% 혁신 성장을 목표로 세워 글로벌 가전 시장을 선도하는 1등 브랜드를 만들었다”고 자평했다. 이어 “사업 철수 이야기까지 있었던 배터리는 세계 최초 전기차 배터리를 양산하며 전기차 시대의 변곡점이 됐고 한국에서는 불가능할 것이라는 미국 식품의약국(FDA) 신약 승인을 최초로 해내며 한국 신약 산업 기반을 높이기도 했다”고 말했다.2003년 4월LG화학(옛LG생명과학)은 퀴놀론계 항균제(항생제)인 '팩티브'로FDA승인을 받았다.이날 워크숍에 모인 최고경영진은 전자를 비롯해 그룹 내 대부분 사업에서 변화가 필요하다는 데 동의했다. 특히 조주완LG전자 사장은 비약적으로 성장하는 중국 기업의 경쟁력에 대해 언급했다. 조 사장은 이달 초 독일 베를린에서 열린 국제가전박람회(IFA)에서 중국 기업들의 전시관을 둘러보고 느낀 바를 공유하며 “중국 기업들이 단순히 원가 경쟁력이나 전과정 자동화(SCM) 측면뿐 아니라 기술력, 디자인 등에서도 빠른 속도를 내며 위협적으로 성장하고 있다”고 말한 것으로 알려졌다.지난 25일 경기도 이천LG인화원에서 진행된 사장단 워크숍에 참석한 구광모LG회장(가운데줄 첫번째).LG차별적 경쟁력을 위한 계열사별 혁신 사례에 대한 점검과 토론도 진행됐다. 인공지능(AI) 기술을 적용해 고객 경험을 혁신한 사례,AI를 통해 일하는 방식을 바꾼 사례 등이다.LG전자는 생성AI기반 챗봇 등으로 일하는 방식을 바꿨다고 소개했다.LG디스플레이는AI기반 제조 공정 이상 감지 및 제어 시스템을,LG화학은 국내 최초 난임 치료 종합 지원 앱 개발과 세계 최초로 100% 재활용할 수 있는 폴리에틸렌(PE) 식음료 포장재 개발 사례를 공유했다고 한다.이날 최고경영진은AI수행비서가 주행 환경에 맞춰 차량 내부를 제어하는 공감 지능 모빌리티AI,AI가 통화 기록을 요약하고 일정을 제안하는AI기반 통화 서비스 등을 직접 체험했다. 구 회장은 “지금의LG는 세계 최고‧최초를 위한 목표를 세우고 도전해온 결과”라며 “기존에 해오던 방식을 넘어 최고‧최초의 도전적인 목표를 세워LG의 미래에 기록될 역사를 함께 만들어가자”고 당부했다."
2024-10-02,"금융당국, LG家 구연경 ‘미공개 정보 이용’ 검찰 통보","금융당국이 고(故) 구본무LG그룹 선대회장의 장녀인 구연경LG복지재단 대표가 미공개 정보를 이용해 주식을 취득했다는 의혹과 관련해 검찰에 통보하기로 했다.구연경LG복지재단 대표이사(왼쪽). 연합뉴스2일 금융위원회는 증권선물위원회를 열고 구 대표에 대해 자본시장법 위반 혐의로 검찰 통보 조치를 결정했다. 앞서 금융감독원은 구 대표가 지난해 코스닥 상장사인 바이오업체 A사의 주식 3만주를 취득하면서 발표되기 전 정보를 활용했다고 보고 이를 금융위로 넘겼다.A사는 심장 희귀질환 치료를 위한 신약 등을 개발하는 업체다. A사는 지난해 4월 블루런벤처스의 글로벌 성장 투자 플랫폼인BRV캐피탈 매니지먼트로부터 제3자 배정 유상증자를 통해 500억원을 조달했다는 사실을 공시했다. 투자를 결정한 인물은BRV캐피탈의 윤관 최고투자책임자(CIO)로, 구 대표의 남편이다.주당 1만8000원 수준이던 A사의 주가는 500억원 투자 유치 성공 발표 당일 16% 넘게 급등하면서 5만원대까지 치솟기도 했다. 검찰 통보가 이뤄지면 구 대표뿐 아니라 윤CIO에 대한 수사 여부 등도 검찰이 결정한다."
2024-12-31,"""희망퇴직 좀 시켜주세요"" 회사 멀쩡한데 퇴직런, 왜","‘명퇴와 다르다’ 고정관념 깨진 희망퇴직경제+“올해는 희망퇴직 비수기가 없었다.” 희망퇴직은 연말에 한다는 고정관념이 올해 완전히 깨졌다. 1년 내내 희망퇴직 계획을 내놓는 기업들이 나왔다. 업종도 다양했다. 심지어 한 해에 두 번 실시하는 기업도 있고, 사원급까지 대상자를 넓힌 기업들도 있다. 이런 대기업들은 “희망퇴직이 곧 실적 부진의 상징은 아니다”고 강조한다. “요즘은 희망퇴직을 서럽게 볼 일만은 아니다. 국제통화기금(IMF) 사태 때 명예퇴직하고는 다르다”는 주장도 한다. 진짜 그럴까? 희망퇴직이라 쓰고 ‘착한 해고’라 읽던, 금기어 아니었나.한 해에 두 번…일상화된 희망퇴직그래픽=주이안올 한 해 유통업계에선 대기업들이 다달이 돌아가며 희망퇴직 계획을 발표해, 연중 희망퇴직 소식이 끊이지 않았다. 지난해 창사 이후 첫 연간 적자(-469억원)를 기록한 이마트는 이달 두 번째 희망퇴직 신청을 받았다. 지난 3월 창사 후 첫 전사 희망퇴직을 받은 지 9개월 만이다. 대상은 15년 이상 근속 직원에서 10년 이상 근속 직원으로 대폭 늘었다. 유통가의 희망퇴직은 온·오프라인을 가리지 않았다. 11번가(3월), 롯데온(6월),SSG닷컴(7월), 롯데면세점(8월), G마켓(9월), 세븐일레븐(10월), 롯데호텔·신세계면세점(11월)까지 줄줄이 이어졌다. 롯데온은 연중 두 번째 희망퇴직을 실시하고 있다.중국과 경쟁하는 제조업들도 희망퇴직을 실시했다.LG디스플레이는 지난 6월 생산직군에 대해 희망퇴직을 실시한 데 이어 11월엔 사무직군에서 진행했다.SK온은 2021년 출범 이후 처음으로 지난 9월 희망퇴직을 받았다. 무급휴직을 하면 월급 대신 학비를 내주는 프로그램도 내놔 직원들 사이에 호응이 좋았다. 젊은 엔지니어 등 인재를 놓칠 수 없는 상황에서 단기적 비용을 줄이기 위한 묘안이다.정근영 디자이너두둑한 희망퇴직금은 ‘퇴직 런(run)’을 부르기도 한다. 12년 만에 대규모 희망퇴직을 실시한 엔씨소프트는 근속기간에 따라 최대 30개월치 월급 수준의 위로금을 지급했다. 위로금이 최대 3억원에 이를 것으로 알려지자 타사 직원들의 부러움을 샀다고 한다. 희망퇴직 신청 후 회사의 승인을 받아 퇴직을 확정한 직원이 400명을 넘는 것으로 알려졌다.지난 11월 발간된 『희망퇴직 매뉴얼: 준비에서 성공까지』에 따르면 2021년부터 지난해까지 ‘희망퇴직’ 관련 기사 수는 연간 많아야 1400건 정도였는데, 올해는 7월에만 관련 기사가 1600건을 넘어섰다. 저자인 오성호 피플그로스컨설팅 대표는 “1년에 두 번씩 하는 희망퇴직은 이례적”이라고 말했다.부진 상징 아니다? 근데 왜 늘어날까희망퇴직의 직접적인 이유는 기업의 실적 부진이다. 인건비 부담을 줄이겠다는 것. 그런데 전문가들은 희망퇴직이 늘어나는 이유를 하나 더 꼽는다. 기술 발전 속도가 빨라짐에 따라 기업엔 이전과 다른 역량을 지닌 새로운 인재가 필요하기 때문에 구조조정 수요가 생긴다는 분석이다. 이지만 연세대 경영학과 교수는 “기업은 태생적으로 ‘인력 신진대사’를 추구할 수밖에 없고, 앞으로도 법 테두리 내에서 희망퇴직을 최대한 활용하려고 할 것”이라고 말했다.‘평생직장’의 개념이 흐려지고 입사와 퇴사가 수시로 이뤄지는 고용 구조의 변화도 원인으로 꼽힌다. 몇 년 새 수시·경력 채용이 일반화하면서 현재 5대 그룹 중에서는 삼성만 유일하게 그룹 신입 공채를 유지하고 있다. 대기업들은 앞으로 희망퇴직이 더 확대될 것으로 전망했다. 익명을 요청한 대기업 인사담당자는 “해고가 어려운 한국 사회에서 희망퇴직은 기업의 마지막 옵션”이라며 “이직에 대한 거부감이 낮아진MZ세대를 중심으로 직원들이 희망퇴직을 먼저 요구하는 경우도 늘고 있다”고 말했다.희망자를 대상으로 ‘상시 퇴직’ 지원 프로그램을 운영하는 기업들도 속속 등장하고 있다. 50대 직원들을 대상으로 조기 퇴직 후 재취업을 위한 교육을 지원하는 곳들도 있다. 한 10대 그룹 인사담당자는 “상시 퇴직 프로그램은 인위적 인력 감축이 아닌 자율적인 퇴직을 돕는다는 취지”라며 “제2의 인생을 준비할 수 있도록 회사 차원에서 컨설팅을 지원하고 있다”고 말했다.“불안하다”vs“오히려 좋아”직원들 사이에서도 변화가 감지된다. 과거와 같이 희망퇴직이 ‘실패’가 아니라 다른 도전을 해 볼 기회라는 인식이 확산했기 때문. 최근 엔씨소프트에서 위로금 3억원을 받고 희망퇴직한 개발자 A씨(42)는 “원래도 이직 고민이 있던 차에 한 회사를 오래 다니는 것보다 더 나이가 들기 전에 새로운 도전을 해보고 싶어서 희망퇴직을 신청했다”고 말했다. 올해 한 이커머스 업체에서 희망퇴직한 30대 B씨는 “이 회사에 계속 다니면 안정적인 수입은 유지되겠지만, 안주하다 보면 연차와 나이가 (새로운 도전에) 약점이 될 수 있다고 판단했다”고 말했다.박경민 기자외국계 제약사에 다니는 C(38)씨는 본인이 희망퇴직을 신청했지만 회사로부터 거절당했다. C씨는 “희망퇴직 기회가 언제 올지 모르니 이참에 나가자 싶어서 신청했으나 회사가 승인을 안 해줬다”며 “‘나중에 퇴직금만 받고 나가라’는 뜻인가 싶어 섭섭했다”고 털어놨다.다만 채용 시장이 얼어붙은 경우 희망퇴직에 대한 불안감이 클 수밖에 없다. 정보기술(IT) 기업에 다니는 D씨(35)는 “요즘 직원들 사이에서 위로금 규모보다는 이직 시장 상황이 더 중요하다는 말이 나온다”며 “희망퇴직 후 쉬는 기간이 길어지면 재취업이 어려워진다는 불안감 때문”이라고 전했다. 유통업체에 다니는 40대 E씨는 “올해 ‘티메프’ 사태도 있었고, 대규모 희망퇴직이 이어지다 보니 취업 시장에서 공급이 많아졌다”고 했다. 한 유통업체에서 15년 근속 후 최근 희망퇴직한 40대 F씨는 “아직 국내 고용시장에서 ‘희망퇴직자는 재취업이 힘들 것’이라는 인식이 남아 있는 것 같다”고 말했다.‘나가면 지옥’ 생각 안 들도록희망퇴직이 인력 선순환 구조에 도움이 되려면 결국 ‘좋은 일자리’가 늘어나야 한다는 분석이 나온다. 정연승 단국대 경영학부 교수는 “현재 우리 경제의 문제는 새로운 산업이나 기업, 비즈니스 모델이 많이 만들어지지 않는다는 점”이라며 “경제의 역동성이 있어야 고용 시장도 유연해질 수 있다”고 말했다. 이어 “희망퇴직을 기업 내 인사 문제로만 생각하면 절대 해결이 안 된다”며 “결국 기업의 성장에 대한 문제고, 더 좋은 새 기회가 많아지면 희망퇴직이 확대되는 것도 문제되지 않는다”고 강조했다.직원들의 불안감을 줄이기 위해 ‘회사 나가면 지옥’이라는 생각을 덜 하게끔 제도를 만들어야 한다는 지적이 나온다. 이지만 교수는 “퇴직자가 재취업 시장에서 유리하려면 자신의 전문성을 키우는 작업이 필요한데, 이건 기존 회사 재직 중에 해야 한다”며 “기업들이 전문직 제도를 확대하는 등 인력 관리를 꼼꼼하게 할 필요가 있다”고 말했다.특히 희망퇴직을 구조조정 수단으로 남발하면 오히려 역효과가 날 수 있다. 오계택 한국노동연구원 선임연구위원은 “사람을 너무 자주 내보내면 기업 평판에 악영향을 줄 수 있고, 남은 직원들의 생산성이 떨어질 수 있다”고 짚었다. 그러면서 “희망퇴직을 실시했다가 정작 능력 있는 직원들이 퇴사하면 제도의 효과가 떨어지니 무조건 내보내는 게 답은 아니다”며 “노사 간 협의를 통해 임금 체계의 연공성을 줄이는 방식으로 해법을 찾아볼 수 있을 것”이라고 조언했다.인류 최고의 발명품 중 하나는 ‘기업’입니다. 기업은 시장과 정부의 한계에 도전하고 기술을 혁신하며 인류 역사와 함께 진화해 왔습니다. ‘기업’을 움직이는 진정한 힘이 무엇인지, 더중플이 더 깊게 캐보겠습니다.“‘이 금액’ 넘으면 통보된다” 회사 몰래 투잡족 명심할 것https://www.joongang.co.kr/article/25292848“승진을 왜 해? 재테크 공부” 45세 ‘만년 김대리’의 항변https://www.joongang.co.kr/article/25285839한국인 홀린 ‘청소 이모님’…184만원 중국 로보락 왜 센가https://www.joongang.co.kr/article/25281152중국 소는 쟁기질 은퇴했다, 세계 논밭 노리는 ‘아이언 소’https://www.joongang.co.kr/article/25291104"
2024-09-14,"음주운전 선수 이상영이었다, 동승자는 이믿음…고개 숙인 LG트윈스","LG트윈스 이상영. 뉴스1LG트윈스 투수 이상영(24)이 음주운전 사고를 낸 뒤 적발됐다.LG구단은 클린베이스볼센터에 신고했다.LG는 14일 ""음주운전으로 물의를 일으킨 이상영과 동승했던 이믿음(24)에 대해 사실 확인 후KBO클린베이스볼센터 신고하였으며 향후KBO상벌위원회의 징계 결과를 겸허히 수용하기로 결정했다""고 밝혔다.이상영은 14일 오전 6시 13분쯤 경기 성남 중원구 하대원동의 한 노상에서 음주운전을 하던 중 앞차량뒷 범퍼를 충격한 혐의를 받고 있다. 사고를 낸 뒤 피해 차주인 50대 남성 A씨에게 자신의 신분증을 확인시켜주고 연락처를 교환한 뒤 자리를 떠났다.이후 A씨는 이씨가 술을 마신 뒤 운전을 하다 사고를 냈다는 생각이 들어 112에 신고했다. 이씨는 이천시 신둔면 도봉졸음센터에서 경찰에 적발됐다. 당시 혈중알코올농도는 면허 취소 수준으로 나타났다.KBO리그 규정에 따르면 면허정지에 해당하는 경우 70경기 출장정지, 면허취소의 경우 1년 실격 처분, 2회 음주운전 발생 시 5년 실격 처분, 3회 이상 음주운전 발생 시에는 영구 실격 처분의 제재를 부과한다.이상영은 2019 신인 드래프트에서 2차 1라운드 전체 5순위로LG트윈스에 입단했다. 2021시즌 21경기에 등판하며 가능성을 보였고, 이후 군복무를 마쳤다. 올 시즌엔 예비 선발로 낙점돼 8경기에서 1패 1홀드 평균자책점 3.31을 기록했다.LG트윈스 사과문 전문LG트윈스는 구단 소속 이상영 선수의 음주운전과 동승했던 이믿음 선수와 관련하여 팬 여러분께 진심으로 사과드립니다.프로야구 선수로서의 사회적 책임과 자세에 대해 지속적인 교육과 함께 각별한 주의와 당부를 주었음에도 불구하고 음주운전 행위로 인해 법을 위반하고 팬들에게 실망감을 드리는 불미스러운 일이 발생하였습니다. 구단은 선수단 관리에 대한 책임을 다시한번 깊게 통감하고 있습니다.구단은 선수단 교육과 관리에 대한 부족한 부분을 다시 한번 점검하고, 향후 재발 방지를 위해 최선을 다하도록 하겠습니다.프로야구를 사랑하고 응원해 주시는 모든 팬들께 다시 한번 머리 숙여 사과드립니다."
2024-08-30,"LG씽큐, 앰비언트 링크 도입·간편 추가 서비스 확대 ‘제품 등록 간소화’","LG전자(대표이사 조주완)가LG프리미엄 가전이 제공하는 편리한AI기능을 누구나 쉽게 활용할 수 있도록 스마트홈 플랫폼 ‘LG씽큐(LGThinQ)’ 앱 제품 등록 절차를 간소화한다.LG씽큐는 사용자가 보유한 가전들의 사용 패턴을 분석하고 학습해 종합적인 홈 제어를 제공하고 있는LG전자의 스마트홈 플랫폼이다.LG가전을LG씽큐에 등록하면 맞춤형 사용 팁, 제품 이상 감지,AS등 다양한 콘텐츠를 제공받으며, 가전을 사용할수록 업그레이드되는 차별화된 스마트홈을 경험할 수 있다.LG전자는 복잡한 절차 없이LG씽큐 앱에 제품을 등록하는 ‘엠비언트 링크(AmbientLink)’ 기능을 도입하고 ‘간편 추가 서비스’를 확대 운영한다.먼저 엠비언트 링크 기능은 새로 구입한LG가전의 전원만 연결하면LG씽큐에 등록되어 있는 제품이 알아서 새 제품을 인식해 앱에 자동으로 연동하는 기능이다.이 기능은 고객이 구매한 제품의 일련번호와 수령 날짜가 등록된LG씽큐 서버의 ‘배송 정보 시스템’과 ‘생산 정보 시스템’의 고객정보를 미리 파악, 해당 정보를 토대로 제품이 설치되면 제품간 직접 통신 기술을 통해 새 제품을 인식하고LG씽큐 앱에 정보를 전달한다.여러 제품을 한꺼번에 구매한 경우에는 더욱 유용하다. 기존 등록된LG가전만 있다면 일일이 등록할 필요 없이 순차적으로 자동 등록된다. 또 집 네트워크 환경이 바뀌더라도 이 기능을 통하면 제품 한 개만 재등록 해도 나머지는 알아서 변경된다.또 엠비언트 링크뿐만 아니라 간편 추가 서비스를 통해서도LG전자는 제품 등록 절차를 간편화한다. 간편 추가 서비스는 제품이 집에 설치되면LG씽큐가 인수자 정보와 구매 제품 정보를 실시간으로 매칭해 연동한다. 설치기사가 제품 배송 처리를 완료하면 제품 인수자 명의의 씽큐 앱에 구매 제품이 자동으로 표기되고 ‘추가하기’ 버튼이 활성화되어 터치 한번으로 등록이 가능하다.간편 추가 서비스는LG베스트샵과LG전자 온라인 브랜드샵 등LG전자 공식 채널에서 구매한 고객들에게만 제공했었지만 올해 8월부터는 이마트, 하이마트, 전자랜드 등 다양한 ‘혼매(混賣)채널’에서LG전자 가전을 구매한 고객까지 확대 운영한다.LG전자 관계자는 “LG가전이 제공하는 다양한AI기능과 편의 서비스를 엠비언트 링크와 간편 추가 서비스 확대로 누구나 쉽게 경험할 수 있도록 했다”라며 “LG씽큐로 내 집 전체를 관리하며 차별화된 스마트홈 라이프를 누려보시길 바란다”고 말했다."
2024-08-27,물 없는 세탁기?…LG R&D 인재들 머리 맞댄다,"26일 서울 마곡LG사이언스파크에서 열린LG테크페어에서 직원들이LG이노텍의 차량용 카메라 모듈에 대한 설명을 듣고 있다. [사진LG]LG그룹 내 연구개발(R&D) 조직 구성원이 한자리에 모여 신기술을 공유하고 난제 해결을 위한 아이디어를 논의했다.LG그룹은 26일 서울 마곡에 위치한LG사이언스파크에서 ‘LG테크페어’ 행사를 열었다. 그간 계열사나 분야별 기술 교류는 자주 있었지만, 8개 계열사 R&D 구성원이 모두 모여 연구 현황을 공유하고 머리를 맞댄 것은 이번이 처음이다. 테크페어는 27일까지 이틀간 열린다.테크페어에서는LG가 미래 성장동력으로 점찍은 인공지능(AI)·바이오·클린테크, 이른바 ‘ABC’분야를 포함해 스마트 라이프 솔루션, 모빌리티, 소재·부품 등 6개 분야 60여 개의 전시 부스를 마련했다.AI에이전트를 탑재해 자연스러운 음성 대화로 집안 사물인터넷(IoT) 기기의 연결성을 강화한 ‘AI허브’,이산화탄소를 전환 공정 없이 원재료로 직접 활용하는 친환경 신소재 등 주요 과제를 공유하고 협업 기회를 모색하는 자리다. 또 물 없는 친환경 세탁기, 채혈 없는 혈당 측정 등 여러 R&D 난제를 해결하고 ‘게임 체인저’ 기술을 발굴하기 위해 계열사 간 융복합 R&D 워크숍을 진행한다. 김상배 미국 매사추세츠공대(MIT) 교수, 이상엽 한국과학기술원(KAIST) 부총장, 강기석 서울대 교수 등 외부 전문가도 초빙해 미래 기술 세미나를 연다.LG는 이날 테크페어를 시작으로 3주간LG사이언스파크에서LG구성원과 외부 파트너사, 스타트업, 지역 주민 등이 참여하는 문화·혁신·예술 축제 ‘LG스파크 2024’도 진행한다. 각 계열사의 디지털 트랜스포메이션(DX) 성과를 공유하는 ‘DX페어’,그룹 전체 소프트웨어 개발자들이 교류하는 ‘LG소프트웨어 개발자 콘퍼런스’,지역주민과 소상공인이 함께 어울려 소통하는 ‘컬처위크’가 잇따라 열린다.DX페어에서는 배경훈LGAI연구원장이 임직원을 대상으로 공개한 생성AI‘챗엑사원’을 소개할 예정이다."
