date,title,content
2024-12-30,"샤오미, 플래그십 폰·대형 TV 앞세워 한국 공략","삼성·LG전자와 본격 경쟁그래픽=이진영중국 샤오미가 다음 달 한국 시장에 플래그십 스마트폰을 시작으로TV등 고가 제품을 처음으로 출시한다. 그동안 선풍기·중저가폰 같은 가성비 제품을 주로 판매하던 샤오미가 이제 삼성전자(스마트 폰, 가전)·LG전자(가전) 아성인 국내 시장에서 본격 경쟁하겠다는 것이다. 이를 위해 2018년 국내 진출 이후 처음으로 한국 법인을 차리고, 오프라인 매장도 연다.IT업계에 따르면, 샤오미는 내달 초 한국에서 자사 플래그십 스마트 폰 ‘샤오미’ 시리즈를 정식 출시한다. 내달 중 한국 시장 진출 전략을 공개하고 점차TV등 가전 라인업을 확장한다는 계획이다. 테크 업계 관계자는 “가전에 이어 스마트폰까지 중국 업체들이 국내 프리미엄 시장에 도전장을 던지고 있다”며 “삼성·LG의 고민이 깊어질 것”이라고 했다.그래픽=이진영샤오미, 고급 스마트폰·가전 도전장2010년 설립된 샤오미는 2010년대 중반부터 ‘가성비’ 제품으로 알려지기 시작했다. 샤오미의 선풍기, 보조 배터리, 스마트 워치 등이 유려하고 깔끔한 디자인에 저렴한 가격으로 ‘대륙의 애플’ ‘대륙의 실수’라고 불리며 국내에서 소문을 탔다. 2018년부터 선풍기, 스마트 폰 등 주로 소형 제품을 온라인으로 국내서 판매하기 시작했다. 하지만 정식 대리점 사칭 문제가 일어나고 애프터 서비스(A/S)를 제대로 갖추지 못해 힘을 쓰지 못했다.그동안 글로벌 시장에서 샤오미는 디자인뿐 아니라OS(운영체제) 등 자체 기술력을 앞세워 스마트 폰을 주축으로 가전, 전기차 등으로 영역을 확장해갔다. 2019년 경쟁사 화웨이가 미국 제재로 주춤하면서 반사이익도 봤다. 2018년 3분기 기준 10%도 안 됐던 샤오미의 글로벌 스마트 폰 점유율은 올해 3분기 삼성(19%), 애플(17%)을 바짝 쫓는 14%까지 올라갔다(카운터포인트리서치).그래픽=이진영샤오미는 한국에서 ‘준프리미엄’ 시장을 노리는 전략을 세웠다. 삼성·LG가 다른 중국 가전 브랜드와 차별화를 주기 위해 고급화를 시도하며 제품 가격이 올라가고 있는데, 샤오미는 중저가와 고가 사이의 빈 영역을 공략하겠다는 것이다. 업계 관계자는 “고사양·고가 프리미엄군과 저사양·저가 보급형으로 양분된 시장에서 품질과 가격의 균형을 갖춘 중간 가격대 제품이 부재한 상황”이라고 했다.내달 초 국내 출시가 유력한 스마트 폰 ‘샤오미 15′는 사양이 기존 프리미엄 폰과 비슷하면서 가격은 저렴하다. 이 제품엔 글로벌 최초로 퀄컴의 최신AP(두뇌 역할을 하는 칩) ‘스냅드래곤 8 엘리트’가 탑재됐다. 이 칩은 내달 나올 삼성의 갤럭시 S25 시리즈에도 들어갈 예정이다. 갤럭시 S24 울트라보다 더 큰 용량의 배터리가 들어가면서도, 무게는 더 가벼운 것이 특징이다. 가격도 4499위안(약 90만원)부터 시작해 국내서 팔리는 동급 사양의 갤럭시, 아이폰보다 20% 이상 저렴할 것으로 보인다.대형TV등 가전 라인업도 확대할 계획이다. 현재 샤오미는 온라인을 통해 100만원대 이하TV를 판매하고 있다. 내년부터는 자사 프리미엄TV라인인 ‘샤오미S’같은 미니LEDTV를 국내에 본격 출시한다는 계획이다. 55인치 이상 중대형 모델이 주력으로, 가격대는 50만원대(중국 기준)부터 시작한다.그동안 문제로 지적됐던 A/S 등 고객 서비스도 강화한다. 현재 전국 14곳 정도인 A/S 센터를 더 늘릴 예정이다.中 가전 한국 속속 진출TV·로봇 청소기 같은 가전 분야에서 중국산 제품이 차츰 점유율을 늘려가자, 한국 시장에 직접 진출하는 중국 브랜드도 늘고 있다. 그동안 중국 가전 브랜드는 대리상 총판을 하거나 양판점, 마트에 제품을 공급하는 방식으로 제품을 판매했다.글로벌TV점유율 2위 중국TCL은 지난해 말 한국 법인을 설립하고 국내 시장에 본격 진출했다. 특히 100인치가 넘는 대형TV를 앞세워 프리미엄TV시장을 공략 중이다. 삼성·LG의 가전 위탁 생산을 주로 하던 중국 메이디(Midea·미디어)는 지난 7월 자체 브랜드를 달고 한국에 정식 진출했다. 최근에는 세탁기, 건조기를 본격 출시하며 백색 가전 시장에 도전장을 냈다. 일찌감치 한국서 프리미엄 로봇 청소기 브랜드 이미지를 구축한 중국 로보락은 압구정 갤러리아 백화점을 비롯해 전국 주요 백화점 27곳에 입점했다."
2024-12-26,"LG, 스탠드 아래 반려식물 싹 ‘틔운’다",[새해CES에 선보일 ‘가전의 미래’] ‘식물 가전’ 신제품 2종 공개LG전자가 가정용 식물 재배기 ‘틔운’에 조명과 스피커 기능을 탑재한 새 제품을 공개한다.LG전자는 내달 7일 미국 라스베이거스에서 개막하는 ‘CES2025′에서 인테리어 요소를 강조한 식물 재배 가전 ‘틔운’의 신제품 2종을 선보인다고 밝혔다./LG전자먼저 스탠드 조명 타입은 집 안의 스탠드 조명 중간 부분에 틔운을 배치한 디자인이다. 은은한 무드등으로 활용할 수 있는LED조명은 높이 조절이 가능해 기존 틔운에서 기르던 것보다 키가 큰 식물을 키울 수 있다는 게 장점이다. 협탁 타입은 스탠드 조명과 블루투스 스피커가 내장된 디자인으로 식물을 보며 음악을 감상할 수 있다. 이 제품들은 씨앗 키트를 장착하고 물과 영양제를 넣어준 뒤LED조명을 켜주기만 하면 간편하게 식물을 키울 수 있다. 씨앗 키트를 한 번에 4개까지 장착할 수 있어 다양한 식물을 동시에 재배할 수 있다.LG전자는 우선 스탠드 조명 타입의 틔운을 내년 하반기에 먼저 출시할 계획이다. 제품 가격은 미정이다.
2024-12-26,공학한림원 신입 회원 명단 공개...조주완 LG전자 사장 등 정회원에,"김기남 공학한림원 회장/한국공학한림원국내 공학기술 분야 최고 권위 단체인 한국공학한림원이 26일 2025년도 신입회원 명단을 발표했다. 공학한림원 회원은 기업, 대학, 기관(연구소) 등에서 국가 발전에 기여한 전문가들 중에서 추천을 받아 10개월간의 심사를 거쳐 선정된다.내년도 정회원으로 선정된 인원은 총 48명으로 산업계 23인, 학계 25인이다. 학계에서는 김영오 서울대 공대학장, 장길수 고려대 공대학장 등이 새롭게 선정되었고, 산업계에서는 안현SK하이닉스 개발총괄 사장, 조주완LG전자 대표이사 사장 등이 선정됐다. 이번 신입회원 선임에 따라 공학한림원의 정회원은 288인, 일반회원은 373인이 되었다.일반회원으로는 학계에서 34인, 산업계에서 35인 등 총 69인이 선정됐다. 학계에서는 김경수KAIST대외부총장, 문승욱 전(前) 산업부 장관 등이 포함되었고 산업계에서는 남석우 삼성전자DS부문 사장, 김동명LG에너지솔루션CEO등이 이름을 올렸다.공학한림원은 매년 상반기 후보자 발굴 및 추천 작업을 시작하며, 후보자 추천은 현 정회원만 가능하다. 학문적 업적뿐만 아니라 세계 최초 기술개발 업적, 특허, 인력양성, 산업발전 기여도 등 여러 분야에 걸친 업적 심사가 이루어진다. 회원은 정회원, 일반회원, 원로회원, 외국회원 등으로 구분 된다.공학한림원 김기남 회장은 “2025년 창립 30주년을 앞두고 있는 시점에서 회원 선정에 더욱 신중을 기하고 고심했다”며 “지난 30년을 되돌아보고 앞으로 30년간 한국 공학계를 이끌어 갈 수 있는 인사를 회원으로 모시기 위해 최선을 다했다”고 했다."
2024-12-21,"LG유플, 일부 해외사이트 접속 장애… “복구 완료”","/unsplashLG유플러스 이용자들이 나무위키 등 일부 해외 사이트 접속에 한때 장애를 겪었다. 현재는 복구가 완료돼 정상적으로 접속이 이뤄지고 있다.21일 통신업계에 따르면 전날 오후 10시쯤부터LG유플러스 이용자가 디스코드, 나무위키 등 일부 해외 사이트에 접속할 때 연결이 안 되거나 지연되는 문제가 발생했다. 온라인 커뮤니티에는 “해외 사이트 접속이 안 된다” “왜 접속이 안 되는지 아느냐” 같은 글이 올라왔다.해당 장애는LG유플러스 통신망 문제가 아닌, 인터넷중개사업자 트래픽 문제 때문에 발생한 것으로 알려졌다. 인터넷중개사업자는 통신사 망을 연결해 디스코드 같은 해외 콘텐츠 제공자(CP) 서비스를 국내 이용자에 안정적으로 전달하는 중간 역할을 한다.LG유플러스 관계자는 “21일 오전 11시20분쯤 복구기 완료돼 현재는 모든 서비스를 정상적으로 이용할 수 있다”고 했다."
2024-12-20,구광모 회장 “LG 없이는 상상할 수 없는 미래 세우자”,"신년사서 ‘구인회 창업정신’ 강조구광모<사진>LG그룹 회장이 19일 2025년 신년사를 발표하며 “LG없이는 상상할 수 없는 미래를 세우자”고 밝혔다. 특히 “남이 미처 하지 않은 것을 선택하라”는 구인회LG창업회장의 정신을 직원들에게 강조했다.구 회장은 이날 국내외LG직원 27만명에게 ‘안녕하세요 구광모입니다’라는 제목의 이메일로 영상 신년사를 보냈다.LG는 임직원들이 차분하게 한 해를 정리하고 새해를 준비하라는 취지에서 2021년 말부터 이듬해 신년사를 연말에 배포하고 있다.이날 구 회장이 가장 강조한 것은 ‘시작’이란 의미를 담은 ‘데이 1(Day1)’ 정신이다. 국내에선 경기 침체 조짐에 탄핵 등으로 정치적 혼란까지 커졌고 다음 달 미국에서 트럼프 정부가 출범하는 등 대내외 불확실성이 커진 상황에서,LG창업 때의 도전하는 마음을 갖자고 강조한 것이다.구 회장은 “LG의 시작은 고객에게 꼭 필요한 제품과 서비스를 제공하기 위한 것이었다”며 “이런 창업 정신에는 고객을 위한 도전과 변화의DNA가 있다”고 했다. 구인회 창업회장이 생전에 “국민 생활에 없어서는 안 될 것부터 착수하라. 남이 미처 하지 않은 것을 선택하라. 일단 착수하면 과감히 밀고 나가라”고 강조했던 것을 가리킨 것이다.구 회장은 이어 “새로운 영역에 도전하고 전에 없던 가치를 만든 순간들이 쌓여 지금의LG가 되었듯, 도전과 변화의DNA로 미래 고객에게 꼭 필요하고 기대를 뛰어넘는 가치를 드릴 것”이라고 했다.그는 또 “차별화된 고객 가치를 만드는 일은 쉽지 않고 실패에 대한 걱정과 두려움이 따를 수 있다”면서도 “우리가 다져온 고객을 향한 마음과 혁신의 기반 위에LG없이는 상상할 수 없는 미래를 세우자”라고 했다."
2024-12-16,"LG그룹, 연말 성금 120억원 기탁","하범종 ㈜LG경영지원부문장(사장, 왼쪽)이 지난 13일 서울 중구 사랑의열매 회관에서 김병준 사회복지공동모금회 회장에게 연말 이웃사랑성금을 전달하고 있다. /LGLG그룹이 연말 이웃 사랑 성금 120억원을 사회복지공동모금회에 기탁했다. 이 성금은 청소년 교육 사업, 취약 계층의 기초 생계 지원 및 주거·교육 환경 개선 등에 쓰일 예정이다.LG그룹은 1999년부터 올해까지 이웃 사랑 성금 약 2400억원을 사회복지공동모금회에 기탁했다. 하범종 ㈜LG경영지원부문장(사장)은 지난 13일 서울 중구 사랑의열매 회관에서 열린 성금 전달식에서 “앞으로도LG가 가진 역량을 바탕으로 지속적인 공익 사업을 펼쳐 사회에서 신뢰받는 기업이 되도록 노력하겠다”고 말했다."
2024-12-23,“TV로 즐기는 컬투쇼” ‘LG 라디오플러스’ 출시,"국내 440개·美선 1만개 채널 제공LG전자가 스마트TV로 라디오와 팟캐스트를 들을 수 있는 오디오 콘텐츠 서비스인 ‘LG라디오 플러스’를 자사 스마트TV플랫폼 ‘웹OS’에 탑재했다.LG라디오 플러스는 광고를 보고 오디오 콘텐츠를 무료로 듣는 서비스이다. 국내에서는 ‘슈카월드’ ‘두시탈출 컬투쇼’ 등 인기 팟캐스트 방송을 비롯해, 각종 실시간 라디오 및 음악 방송 등 440여 개의 채널을 제공한다. 미국에서는 ‘조 로건 익스피리언스’ ‘CNN라디오’ 등 현지 인기 채널 1만4500여 개를 이용할 수 있다. 웹OS6.0 이상이 탑재된TV에서 애플리케이션(앱)을 내려받으면 된다.LG전자는 기존 광고 기반 무료 스트리밍TV서비스 ‘LG채널’에 이어LG라디오 플러스로 스마트TV플랫폼 시장에서 콘텐츠와 광고사업 경쟁력을 강화한다는 전략이다."
2024-12-16,"“LG유플, AI스타트업과 시너지 창출”","홍범식 대표 부임 후 첫 ‘AI행보’“LG유플러스는 스타트업과 일을 가장 잘할 수 있는 회사, 스타트업이 가장 함께 일하고 싶은 회사로 나아가겠습니다.”홍범식(가운데)LG유플러스 대표가 지난 12일AI스타트업 대표들과 만나 파이팅을 외치는 모습. /LG유플러스LG유플러스 신임 대표로 선임된 홍범식 사장이 첫 행보로 ‘AI기술 협력’을 택했다. 15일LG유플러스에 따르면, 이달 초 부임한 홍 사장은 지난 12일 용산 사옥에서 열린 스타트업 행사 ‘쉬프트 데모데이(사업 발표회)’에 참석했다. 쉬프트는LG유플러스가 성장 가능성이 높은AI기술 스타트업을 선발해 시장에 안착할 수 있도록 지원하는 프로그램이다.컨설팅기업 베인앤컴퍼니코리아 대표 출신으로 지주사에서 성장 동력 발굴 업무를 맡았던 홍 사장이 스타트업과의 협력을 바탕으로 ‘AI주도권’ 확보에 나선 것으로 해석된다. 통신 업계 후발 주자인LG유플러스는 최근 인공지능(AI) 비서 ‘익시오’를 출시하는 등 시장 판도 바꾸기에 나선 상태다.이날 행사에선 최종 선발된 8곳의AI기술 기업(르몽, 오믈렛, 페어리, 토글캠퍼스, 스퀴즈비츠, 테크노매트릭스, 트릴리온랩스, 에임 인텔리전스)이 무대에 올라, 홍 사장을 비롯한LG임직원과 벤처캐피털 등 100여 명을 대상으로 사업 소개와 투자 유치에 나섰다.LG는 선발된 스타트업에 기술 개발과 사업화 지원, 투자 연결 등의 혜택을 제공한다.홍 사장은 “고객에게 감동을 주기 위해선 고객에 대한 이해와 혁신적인 기술이 필수”라며 “밝고 젊은 스타트업과의 기술 협력을 통해 시너지를 창출해 나갈 것”이라고 했다."
2024-12-16,"LG생건 자회사 코카콜라음료, 영업·물류 직원 대상 첫 희망퇴직","서울 시내 마트에 코카콜라가 진열되어 있다./뉴스1LG생활건강의 자회사인 코카콜라음료가 지난달 영업·물류직 고연령 직원들을 대상으로 희망퇴직을 진행한 것으로 알려졌다. 코카콜라음료의 희망퇴직은 2007년LG생활건강에 인수된 이후 처음이다.16일 식품업계에 따르면 코카콜라음료는 지난달 4일부터 18일까지 1971년 이전 출생한 영업·물류부서 근무 직원을 대상으로 희망퇴직 신청을 접수 받았다. 코카콜라음료는 연령별로 차등을 두고 0.5~2년치 기본 연봉을 퇴직 일시금으로 지급했다. 신청자에게 최대 4학기의 자녀 학자금도 지원하기로 했다.이번 희망퇴직은 음료 판매 채널이 온라인으로 바뀌면서, 오프라인 영업 담당자들과 물류 담당자들에 대한 인원 감축과 경영 효율화를 위한 것으로 분석된다.한편, 코카콜라음료는LG생활건강이 최대 주주로 있는 자회사로, 한국코카콜라로부터 생산된 음료 원액을 완제품으로 유통·판매하고 있다.LG생활건강은 작년 6월 희망퇴직을 한 차례 진행한 바 있다. 아직까지 추가적인 희망퇴직 계획은 없는 것으로 알려졌다."
2024-12-16,LG ‘모듈러 주택’이 SM엔터 연수원으로,"‘스마트 코티지’ 3동 공급LG전자가 소형 모듈러 주택 ‘LG스마트코티지’를SM엔터테인먼트 연수원에 공급했다고 15일 밝혔다.강원도SM엔터테인먼트 연수원에LG스마트 코티지가 설치됐다. 이 공간은SM엔터테인먼트 임직원 교육과 워크숍 공간으로 쓰일 예정이다. /LG전자스마트코티지는 모듈 구조체와 창호, 배선, 욕실, 주방기구 등 자재의 70% 이상을 미리 제작한 뒤 배송해 현장에서 최종 조립한다. 기존 철근 콘크리트 공법 대비 공사 기간을 최대 50% 단축할 수 있다. ‘LG스마트코티지’는 에너지 소비량을 줄일 수 있는 히트펌프 냉난방공조 시스템과AI가전을 기본 옵션으로 갖췄다.SM엔터테인먼트는LG스마트코티지를 임직원 교육과 워크숍 공간으로 활용할 예정이다. 단층형 모델 ‘모노’ 2대, 복층형 모델 ‘듀오’ 1대 등 3개 동을 설치한다.LG전자는 “지난 10월 스마트코티지 사업을 시작한 후 첫 B2B(기업 간 거래) 고객에 납품했다”고 밝혔다."
2024-12-18,삼성·LG전자 임원 600명 총집합… ‘가시밭길’ 새해 로드맵 짠다,"양사 이번주 글로벌 사업전략 회의삼성전자와LG전자가 이번 주 주요 경영진들이 모여 내년 사업 계획 수립을 위한 전략 회의를 연다. 삼성전자는 17일부터 사흘간 국내외 임원 약 300명이 참여한 가운데 사업 부문별 하반기 글로벌 전략 회의에 돌입했다.LG전자도 20일 임원 300여 명이 모여 확대 경영 회의를 개최한다. 재계 관계자는 “트럼프 2기 행정부가 들어서고 관세와 환율, 글로벌 수요 침체 등 어느 때보다 불확실성이 큰 상황”이라며 “이에 대비하기 위한 글로벌 공급망 재편과 대미 투자 등을 집중적으로 논의할 것”이라고 했다. 삼성전자는HBM(고대역폭 메모리) 기술 개발, 파운드리 고객 확보 등 반도체 전략과 온디바이스 인공지능(AI) 전략을 집중 점검한다.LG전자는 신사업과 글로벌 사업 전략 위주로 논의가 이뤄질 예정이다.그래픽=백형선내년 반등을 위한 방안 논의삼성전자는 17~18일 스마트폰·TV·생활가전을 담당하는DX부문 회의와 19일 반도체를 담당하는DS부문 회의가 예정돼 있다. 한종희DX부문장(부회장)과 전영현DS부문장(부회장)이 각각 해당 회의를 주관하며 국내외 임원 약 300명이 온·오프라인으로 참석한다. 업계 관계자는 “트럼프 당선인 취임 이후 내놓는 관세 정책에 따라 해외 생산 기지를 조정하거나 글로벌 공급망에 변화를 주는 방안도 회의에서 나올 것”이라고 했다.삼성전자는 지난달 1일 창립 55주년을 맞아 한종희·전영현 부회장 공동 명의 기념사에서 “임원진 모두가 사활을 걸고 본질인 기술 리더십을 더욱 강화해 한치의 부족함 없는 품질 경쟁력을 확보해야 한다”고 한 만큼, 이를 실천할 세부 내용을 집중적으로 논의한다. 반도체 부문은 11월에 이뤄진 인사에서 메모리사업부장과 파운드리사업부장이 전격 교체된 이후 처음 열린 글로벌 전략회의이다. 메모리 사업을 직접 맡은 전영현 부회장이 고대역폭메모리(HBM) 등AI반도체 개발 중장기 계획을 직접 챙길 예정이다. 파운드리 부문에선AI반도체 관련 국내외 주요 팹리스(설계 전문업체)를 고객으로 확보하는 방안을 점검한다. 업계 관계자는 “지난 5월 전 부회장이DS부문장을 맡은 후 준비해 온 삼성 반도체 위기 극복 방안을 공유하는 자리가 될 것”이라고 했다.지난해까지 적자를 기록한 삼성전자 가전 부문은 이번 회의에서 내년 흑자 전환을 목표로 내놓는다. 모바일 부문은 올해 폴더블 시장에서의 실적이 기대보다 낮아, 내년 초 출시될 플래그십 제품인 갤럭시S25 에 관한 전략을 집중적으로 논의할 예정이다. 올해 스마트폰으로는 처음으로AI를 탑재한 만큼, 내년에는 온디바이스(내장형)AI기술을 심화시키는 내용도 포함된다.TV부문은 세계 점유율 1위를 고수하고 있지만, 중국의 발 빠른 추격에 대비하는 전략을 내놓는다. 이 밖에 다음 달 미국 라스베이거스에서 열리는 세계 최대IT전시회 ‘CES2024′에 대한 최종 점검도 이뤄질 전망이다.트럼프 행정부 2기 대비하라LG전자는 20일 조주완 최고경영자(CEO) 주관으로 임원 약 300명이 모여 확대 경영 회의를 연다. 확대 경영 회의는 매년 상·하반기 국내외 경영 현황과 전략을 점검하는 자리다.이번 회의에서는 글로벌 사업 전략과 신사업에 대한 논의가 핵심 안건이다. 업계 관계자는 “내년은 예년과 달리 국내외 상황이 모두 급변하는 시기이기 때문에 여기에 대비한 다양한 가능성을 논의할 것”이라며 “지경학적 이슈, 경쟁 심화 등을 돌파하고 기회로 활용하기 위한 경영 전략과 추진 방안 등에 대해 논의할 것”이라고 했다. 또 구독 사업의 해외 확대, 기업 간 거래(B2B) 사업 강화 등을 통한 수익성 확보도 안건으로 다룰 예정이다.LG전자는 확대 경영 회의를 앞두고 17일 주주가치 제고를 위해 자사주를 내년 중 소각하기로 했다고 밝혔다. 소각 물량은 약 76만1000주로LG전자 전체 발행주식수의 0.5% 수준이다. 또 지난 6일 인도법인IPO를 위한 상장예비심사서류를 인도 증권거래위원회에 제출했다. 예비심사가 통과되면 내년에 본격적으로 인도 상장에 나서게 된다.두 회사뿐 아니라 재계는 최근 국내 상황과 트럼프 2기 출범으로 더욱 불확실해진 상황에 대비하기 위한 전략 마련에 고심하고 있다. 현대차그룹은 지난 12일 글로벌 권역본부장회의를 열었다. 장재훈 현대차 사장, 송호성 기아 사장 주재로 북미와 유럽, 중남미, 중국 등 주요 권역 본부장들이 모두 모여 지역별 판매 실적을 점검하고 향후 대응 방안 등을 논의했다. 최근 유동성 위기론에 시달린 롯데그룹은 연초 롯데지주 대표와 실장, 사업군 총괄 대표, 계열사 대표 등이 총출동하는 밸류크리에이션미팅(VCM·옛 사장단 회의)을 열고 위기 대응책, 사업 전략 등을 점검한다."
2024-12-21,"LG엔솔, 올들어 세번째 ESS 조 단위 수주 따내","배터리 제조사LG에너지솔루션이ESS(에너지 저장 장치) 사업에서 올해 세 번째 조(兆) 단위 수주를 따냈다. 전기차·배터리 캐즘(일시적 수요 정체)이라는 보릿고개를 넘기 위해 전기차 배터리 외에도 경쟁력 있는ESS등 사업에서 다각화를 꾸준히 이어간다는 전략이다.LG엔솔은 미국 자회사를 통해 신재생에너지 전문 사모펀드 운용사 ‘엑셀시오 에너지 캐피털’에 2026년부터 7.5GWh(기가와트시) 규모ESS를 공급하는 계약을 체결했다고 20일 밝혔다. 7.5GWh는 약 75만가구(4인 기준) 이상이 하루 동안 사용할 수 있는 전력량에 해당한다.ESS는 발전소에서 만든 전기를 저장했다가 필요할 때 공급하는 시스템으로, 불규칙하게 전기가 생산되는 태양광이나 풍력발전에서 필수 설비다. 북미·유럽 등에서ESS수요가 꾸준해 2028년까지 전력망을 중심으로 연평균 20% 이상 성장이 전망된다.LG엔솔은 이번 계약을 포함해 올해ESS사업에서만 따낸 조 단위 계약이 3건에 달한다. 지난 5월 한화큐셀과 4.8GWh규모, 지난 10월 미국 재생에너지 기업 테라젠과 최대 8GWh공급 계약을 체결했다. 이번까지 총 3건의 계약 수주 금액만 5조원대로 추산된다."
