date,title,content
2024-12-17,노출 강도 올리며 방송 정지 실험…네이버 '치지직' 찜찜한 1위,"사진 온라인 커뮤니티 캡처네이버의 라이브 스트리밍 플랫폼인 '치지직'이SOOP(구 아프리카TV)을 제치고 이용자 수 1위에 올랐다. 다만 선정적인 '벗방'(노출 방송) 등으로 논란이 계속되고 있는 건 풀어야 할 숙제로 거론된다.17일 모바일인덱스에 따르면 11월 기준 치지직과SOOP사용자 수는 각각 242만명, 240만명으로 나타났다. 불과 2만명 차이의 '접전'이지만 치지직이SOOP사용자 수를 앞섰다.지난해 12월 서비스를 출시한 치지직은 트위치의 국내 철수를 발판 삼아 성장세를 보였다. 이후 국내 라이브 스트리밍 시장의 기존 강자인SOOP과 치지직 사이 경쟁구도가 형성됐다.두 플랫폼은 '엎치락 뒤치락'하며 승부를 벌이고 있다. 지난 3월 앱 분석 서비스 와이즈앱·리테일·굿즈(와이즈앱)에 따르면 치지직은 아프리카TV앱 월간 사용자 수를 넘어섰다. 이후 4개월 만인 지난 7월엔 다시 아프리카TV가 치지직을 사용자 수를 제쳤는데, 지난 11월 또 다시 치지직이 1위로 올라선 것이다.그간 네이버는 ▶바이패스를 통한 시청 화질 개선 ▶파트너 스트리머의 음성을 활용한TTS▶빠른 다시 보기 ▶게임 아이템 지급 서비스 ▶E-스포츠 단독 중계를 통한 콘텐트 다양화 등 주요 기능을 순차적으로 선보이며 스트리머와 이용자를 끌어들이는 전략을 폈다.네이버는 앞으로 ▶스트리머 지원 확대 ▶서비스 고도화 등으로 성장세를 이어간다는 방침이다.특히 2025년부터 실시간 다시 보기 기능을 추가할 방침이다. 실시간 다시 보기가 도입되면 방송 중에도 원하는 지점으로 되돌아갈 수 있다. 또한 가장 많은 시청자 수를 나타낸 장면을 안내하는 다시 보기 하이라이트도 추가된다. 공식 게임 대회를 신설해 즐길 거리를 확대한다는 계획이다.치지직 콘텐트 제작 지원 프로그램 확대도 이뤄진다. 지금까지는 1인당 최대 3000만원씩 연 4회 신청이 가능했지만 앞으로 연 6회까지 신청할 수 있도록 해 스트리머가 더욱 창의적인 콘텐츠를 제작을 도울 방침이다. 미디어 기술력이 집중된 스튜디오를 구축해 버추얼 생태계 활성화를 유도하고, 스트리머가 제작한 굿즈를 스마트스토어에서 선보이기로 했다.사진 네이버 치지직 캡처━로그인 안 해도 벗방 시청 가능…네이버, 대책 속속 내놔다만 벗방 등으로 인한 논란은 해결해야 하는 과제다. 선정적 콘텐트에 대한 의존성 확대, 모니터링·규제 부실 등에 대한 비판이 꾸준히 제기되고 있어서다.지난 10월 24일 국회 과학기술정보방송통신위원회 소속 이정헌 더불어민주당 의원은 종합감사에서 ""네이버 치지직은 로그인 없이 스트리머 이름을 검색하면 속옷이나 가슴을 드러내거나 선정적인 춤을 추고 노골적인 말을 하는 영상을 별다른 제재 없이 관람할 수 있다""고 지적했다.실제로 일부 스트리머들은 노출 강도를 올리며 방송이 언제 정지되는지 실험을 하기도 했다. 수위와 관련한 규정이 명확하지 않아서다.또 범죄 전과가 있는 스트리머가 방송을 해 신고를 당하기도 했다. 온라인 커뮤니티 일간베스트저장소에서 유포한 것으로 알려진 고(故) 노무현 전 대통령이 회칼을 핥는 합성 사진을 방송에서 비춘 스트리머도 있었다.이에 대해 네이버는 ▶24시간 모니터링 시행 ▶인공지능(AI) 그린아이를 적용한 음란물 필터링 강화 ▶약관 개정 및 기능·기술 업데이트 등의 개선 방안을 내놨다. 이를 통해 사회적 논란을 일으킨 스트리머의 방송을 전면 금지하고, 라이브 중 부적절한 콘텐트를 내보내는 스트리머에게 주의 메시지를 발송하는 등의 조치를 취하고 있다."
2024-10-07,"""배우 이미지 나빠져""…수지 소속사, 옛 아프리카TV 소송 왜","배우 수지가 지난 6월 25일 인천 중구 상상플랫폼에서 진행된 제3회 청룡시리즈어워즈 핸드프린팅 행사에서 인사를 하고 있다. 뉴스1배우 수지 등이 소속된 매니지먼트 ‘숲’이 상호를 ‘SOOP(숲)’으로 변경한 인터넷 방송 플랫폼 아프리카TV를 상대로 낸 상표권 등 침해금지 가처분 신청을 법원이 받아들이지 않았다.7일 법원에 따르면 서울중앙지법 민사합의60부(재판장 임해지)는 지난 4일 주식회사 숲엔터테인먼트가 주식회사 숲을 상대로 제기한 상표권 등 침해금지 가처분 신청을 기각했다.재판부는 두 상호가 유사하다는 점은 인정했지만, 각자의 영업에 서로 밀접한 관련이 있다고 보기 어렵다고 판단했다.재판부는 “채권자와 채무자의 상호가 유사하다고 볼 여지는 있다면”서도 “채권자가 소속 연예인을 다루는 동영상 콘텐츠 등을 제작해 인터넷에 업로드하고 있으나 이는 채권자의 연예인 매니지업 등에 부수하는 것”이라고 했다.이어 “채권자, 채무자가 영위하는 영업의 성질, 내용, 방법, 수요자 범위의 차이 등에 비춰 보면 연예인 매니저업 등과 채무자가 영위하는 라이브 스트리밍 플랫폼 운영업이 각자 서로 밀접한 관련이 있다고 보기 어렵다”고 판단했다.혼동 가능성이 있다는 숲엔터테인먼트의 주장도 받아들여지지 않았다. 재판부는 “채권자가 제출한 자료만으로는 상호가 현저하게 널리 알려져 있거나 채권자에 대한 역혼동의 우려가 크다고 보기 부족하다”고 했다.또 “상표권 침해 여부에 관한 판단과 같이 연예인 매니저업과 라이브 스트리밍 플랫폼 운영업은 서비스의 성질, 내용, 제공 방법 등이 모두 달라 경업·경합 관계에 있다고 볼 수 없다” 판단했다.아프리카TV의 사명 변경은 지난 3월 정기 주주총회에서 확정됐다. 이후 주식 종목명 변경 상장을 했고, 현재 국내 서비스명도 ‘SOOP’으로 변경됐다.한편 매니지먼트 숲은 “2011년 4월 19일 설립 시부터 ‘숲엔터테인먼트’라는 상호를 사용해 왔고, ‘SOOP’등 표장에 대한 상표권을 보유하고 있다”며 “아프리카TV는 당사의 상표권, 상호권을 침해했고, 부정경쟁방지 및 영업비밀 보호에 관한 법률에서 금지하는 영업표지 혼동 행위 및 성과 도용 행위에도 해당한다”면서 지난 6월 법원에 가처분 신청을 냈다.매니지먼트 숲에는 배우 수지, 전도연, 공유, 공효진, 정유미, 서현진, 남주혁 등이 소속돼 있다."
2024-12-27,"마왕루야, 소아암 어린이·농가·취약계층 후원","버츄얼 종합게임 스트리머 '마왕루야'가 지난 12월 21일 생일을 맞아 두 가지 특별한 나눔 활동을 전개하며 감동을 주고 있다. 무엇보다 신인상, 게임본상 2관왕 수상의 영예를 안은 마왕루야가 팬 사랑에 보답하기 위해 마련한 특별 후원 활동으로 기대감을 모았다.마왕루야는 최근 한국 소아암재단에 300만 원을 기부하며 사회적 귀감이 됐다. 아울러'SOOPLIVE'에서 우리쌀 라이브 커머스를 진행하며 수익금 전액을 우리나라 농가와 취약계층을 위해 기부하는 선행을 이어갔다. 이번 활동은 마왕루야 팬클럽 '마룽이'가 함께 하며 나눔의 의미를 더했다.마왕루야는 지난 2022년부터 한국 소아암재단에 정기 후원을 이어오고 있다. 이어 올해 생일을 기념해 300만 원을 기부하며 선한 영향력을 꾸준히 나타내고 있다. 특히 마왕루야는 후원금이 소아암 환우와 그 가족들을 위한 정서지원사업에 사용되길 희망한다고 전했다. 이번 기부금은 마왕루야가 최근 진행한 ‘패스 오브 엑자일2(PathofExile2)’ 게임 광고 수익금의 일부로 마련됐다.특히 마왕루야는 팬들과 함께 건강한 밥상의 가치를 나누기 위해 우리쌀 라이브 커머스를 직접 진행했다. 그 결과 방송 시작 1분 만에 준비된 수량이 모두 완판되는 호응을 얻었다. 수익금 전액은 농가와 취약계층을 위한 기부금으로 활용될 예정이다.마왕루야는 디아블로4, 패스 오브 엑자일2 등RPG게임 하드코어 리그에서 두 번 연속 세계 랭킹 70위권에 이름을 올리며 조명을 받고 있다. 이러한 도전정신과 팬들의 응원 덕분에 선한 영향력을 확대할 수 있었다는 후문이다.마왕루야는 라이브 방송을 통해 ""건강한 밥상과 따뜻한 마음을 나눌 수 있어 정말 기쁘다""며 ""앞으로도 팬들과 함께 꾸준히 선한 영향력을 실천해 나갈 것""이라고 전했다."
2024-12-06,"크래프톤, 배틀그라운드 국제 e스포츠 대회 PGC 2024 개최","㈜크래프톤(대표 김창한)이PUBG: 배틀그라운드(이하 배틀그라운드)의 최상위 국제 e스포츠 대회인 ‘펍지 글로벌 챔피언십(PUBGGLOBALCHAMPIONSHIP,이하PGC) 2024’가 말레이시아 쿠알라룸푸르의 트로피카나 가든스 몰 컨벤션 센터에서 오는 9일부터 22일까지 개최된다.총상금은 기본 상금 150만 달러(약 21억 원)에PGC2024 기념 아이템 판매 수익의 25%가 추가돼 더욱 늘어나는 구조다. 상금은 대회 최종 순위에 따라 차등 분배한다. 우승팀 기본 상금은 50만 달러(약 7억 원)에 달하며, 대회MVP로 선정되는 선수에게는 1만 달러(약 1,400만 원)의 상금을 지급한다.PGC2024에는 '펍지 글로벌 시리즈(PGS)’ 포인트 상위 8개 팀을 비롯해 지역별PGC포인트 진출팀 15개 팀, 개최국 초청팀 1팀 등 총 16개 팀이 출전한다. 한국에서는 광동 프릭스, 티원(T1), 젠지가 국내PGC포인트 상위 팀 자격으로 대회에 출전한다.PGC2024 참가팀 명단PGC2024는 기존 그룹 스테이지를 대체하는 서킷 시스템을 처음으로 도입한다. 이를 통해 매 경기의 중요성을 높이고 선수들과 팬들의 몰입도를 강화한다.서킷 1은 지역별PGC포인트 진출팀 15개 팀과 개최국 초청팀 1개 팀 등 총 16개 팀으로 시작한다. 라운드 1에서는 하루 6개 매치 결과, 상위 12개 팀이PGS포인트 5~8위 4개 팀과 함께 라운드 2에 진출한다. 라운드 2에서도 하루 6개 매치를 치러 상위 12개 팀이 서킷 1 파이널에 진출한다. 이들 12개 팀은 서킷 1 파이널에서PGS포인트 순위 1~4위 4개 팀과 치열한 경쟁을 치른다. 이를 통해 총 24개 팀의 서킷 1 최종 순위가 확정된다.서킷 2와 서킷 3도 동일한 방식으로 진행된다. 직전 서킷에서 달성한 순위를 바탕으로 서킷 참가 순서가 결정되는데, 하위 16개 팀이 라운드 1에 참가하고, 상위 8개 팀이 4개 팀씩 순차적으로 라운드 2와 서킷 파이널에 나선다.서킷 스테이지 종료 후, 24개 팀 가운데 총 3번의 서킷 파이널의 합산 점수 상위 16개 팀이PGC2024 그랜드 파이널에 진출한다. 그랜드 파이널은 20일부터 22일까지 3일간 진행되며, 하루 6개 매치씩 총 18개 매치에서 가장 높은 순위를 달성한 팀이PGC2024의 챔피언에 오른다.PGC2024 그랜드 파이널 기간에는 다양한 이벤트를 즐기고 한정판 굿즈와 기념품을 획득할 수 있는 팬존이 경기장에서 운영된다. 21일과 22일에는 선수들을 직접 만날 수 있는 팬 미팅도 진행될 예정이다.이용자들은 공식 중계 채널에서 경기를 시청하거나 게임 내 미션을 수행하는 등 다양한 방법으로 투표 쿠폰을 획득해 ‘승자 예측 이벤트’에 참여할 수 있다. 승자 예측에 성공하면 대회 기간에만 한정 발행되는EP(e스포츠 포인트)를 획득하게 되며 이를 사용해 기념 아이템을 구입할 수 있다.또한 가상 시뮬레이션 e스포츠인 ‘PUBG판타지 리그’도 참여할 수 있다.PUBG판타지 리그는 실제 대회 출전 선수들로 가상의 팀을 구성해 등록한 뒤, 선수들의 실제 경기 성적에 따라 포인트를 획득하는 형태로 진행된다.PGC2024 판타지 리그 우승자 및 참가자에게는 다양한 보상이 주어진다.이 밖에도PGC2024의 공식 음원 ‘룰 더 그라운드(RuletheGround)’를 활용한 영상 제작 이벤트 등 다양한 이벤트에 참여해 풍성한 보상을 획득할 수 있다.PGC2024는 매 경기일 한국 시각 오후 8시부터 배틀그라운드 e스포츠 공식 유튜브,SOOP(숲), 치지직, 틱톡, 네이버 e스포츠 채널을 통해 중계된다. 국내외 배틀그라운드 파트너 스트리머들이 진행하는 중계방송에서도 경기를 시청할 수 있다.PGC2024를 비롯한 배틀그라운드 e스포츠에 대한 자세한 내용은 공식 홈페이지에서 확인할 수 있다."
2024-11-20,24억 벌고 은퇴 선언하더니…'이병헌 협박녀' 깜짝 근황,"사진 '김시원' 유튜브 캡처동영상을 유포하겠다고 협박하며 배우 이병헌에게 50억원을 요구해 실형을 선고받았던 걸그룹 글램 출신BJ김시원이 유튜브 활동을 재개했다.김시원은 지난 17일 자신의 유튜브 채널 '김시원'에 올린 영상을 통해 20년 지기 남자친구와 유튜브를 시작하게 된 계기를 밝혔다.영상 설명에는 ""세상의 풍파를 겪은 여자와 매일 죽음을 보는 그녀의 친구가 도전을 고민하는 이들에게 주는 메시지""라고 적혀 있었다.영상에서 김시원은 ""하고 싶은 게 있어도 저는 은근히 겁도 많고 미루는 경향이 있다. 그게 (시작이) 무서워서 그런 것""이라며 그런데 그것을 잡아주는 친구가 있어 유튜브를 시작하게 됐다고 말했다.이어 ""제 친구들은 뭘 하든 저를 믿고 지지해 준다. 특히 이 친구는 '네가 하는 거면 나는 좋다'고 말해주는 용기 있는 친구""라며 ""혼자라면 할 수 없었을 것""이라고 덧붙였다.그는 영상을 올리는 목적에 대해 ""'얘네도 잘사는데 나도 하고 싶은 거 다 하고 살아봐야겠다' 생각할 수 있도록 하는 게 취지""라며 ""단순히 재미가 아니라 도전이라는 메시지를 전하는 것이기에 긍정적으로 다가갔으면 좋겠다""고 강조했다.김시원은 해당 채널에 2022년 1월 영상을 끝으로 새 영상을 올리지 않고 있었다가 지난달 19일부터 영상을 다시 올리기 시작했다. 활동 재개 시점부터 현재까지 6개 영상이 올라와 있다.한편, 김시원은 2012년 걸그룹 글램에서 다희라는 이름으로 활동했다. 그는 2014년 배우 이병헌 등과 술을 마시며 몰래 촬영한 영상을 온라인에 유포하겠다며 50억원을 요구했다. 당시 동영상에는 음담패설 등이 담긴 것으로 전해졌다.이병헌은 경찰에 고소했고, 김시원은 공갈미수 혐의로 구속돼 1심에서 실형을 선고받았다. 하지만 항소심에서 징역 1년에 집행유예 2년으로 감형됐다.이 사건으로 글램은 해체했고, 한동안 아르바이트 등으로 생계를 이어갔던 그는 2018년 이름을 김시원으로 바꾼 뒤 인터넷 방송BJ로 활동했다. 그는BJ활동으로 2년 연속 아프리카TVBJ대상을 받는 등 많은 인기를 얻었으며, 지난해에는 약 24억원을 벌어들인 것으로 알려졌다.이후 지난 1월 김시원은 자신의SOOP(옛 아프리카TV) 채널 공지 게시판에 '모두 감사합니다'라는 제목으로 은퇴를 암시하는 손편지를 올렸다.당시 김시원은 ""너무 많은 일이 한꺼번에 일어나서 제가 좀 많이 지친 것 같다""며 ""모두에게 고마웠던 마음만 전하고 이젠 떠나고 싶다. 다시는 돌아오지 않을 것""이라고 적었다."
2024-10-14,"렐루게임즈, 지스타 2024서 '제1회 마법소녀 선발전' 결승전 연다","㈜크래프톤(대표 김창한) 산하의 크리에이티브 스튜디오 렐루게임즈(대표 김민정)가 다음달 15일 ‘지스타(G-STAR) 2024’에서 ‘제1회 마법소녀 선발전’의 결승전을 진행한다.제1회 마법소녀 선발전은 렐루게임즈가 개발한AI게임 ‘마법소녀 카와이 러블리 즈큥도큥 바큥부큥 루루핑(이하 마법소녀 루루핑)’으로 승부를 겨루는 공식 대회다. 대회 상금과 이벤트 상금을 포함해 총상금 600만 원을 걸고 진행된다. 이번 대회는 방송 시간, 구독자 등 일정 기준을 충족한 아프리카TVBJ,치지직 스트리머, 유튜버를 대상으로 진행되는 인플루언서 대회다.마법소녀 루루핑은 이용자가 마이크 입력 장치에 육성으로 마법 주문을 외쳐 상대방과 전투하는 방식으로 게임을 진행한다. 렐루게임즈가 자체 개발한AI음성 인식 기술이 목소리의 크기, 발음, 감정 등을 종합적으로 평가해 결과값을 주문의 대미지로 계산한다. 더 많은 대미지를 입혀 상대방의 정신력을 먼저 고갈시켜야 전투에서 승리할 수 있다.마법소녀 루루핑은 지난 5월 스팀에 얼리 액세스로 출시된 이후, 파격적인 콘셉트와 독창적인 게임성을 바탕으로 일반 이용자들은 물론 국내외 유명 인플루언서들의 뜨거운 호응을 받았다. 렐루게임즈는 이러한 성원에 힘입어 주식회사 숲(SOOP)과 협업해 이번 대회를 마련했다.대회 참가 신청은 10월 4일부터 18일까지 가능하다. 참가 신청자 가운데 일반 이용자들의 온라인 투표로 8명을 뽑아 11월 2일 오후 6시에 온라인 예선을 진행한다. 온라인 예선에서 가장 눈에 띄는 코스튬 플레이를 선보인 참가자에게는 50만 원의 상금이 수여된다.결승전 진출자 2인은 11월 15일 오후 2시 30분부터 부산 벡스코(BEXCO) 제1전시장 내 숲 부스에서 마지막 승부를 겨룬다. 유명 인플루언서인 우정잉과 단군이 각각 결승전의 해설과 캐스터를 맡는다. 대회 우승자는 상금 200만 원과 각종 부상을 획득하며, 2위부터 8위까지의 참가자들에게는 순위에 따라 300만 원의 상금을 차등 분배한다.결승전 이후에는 대회 관람객 중 2명을 뽑아 각각 대회 우승자, 우정잉과 한 팀을 이뤄 이벤트 매치를 진행할 예정이다. 이벤트 매치에 승리한 관람객에게는 50만 원의 상금을 지급한다.대회에 앞서 일반 이용자들을 대상으로 마법 주문 응모 이벤트를 18일까지 진행한다. 귀엽고 재치 있는 마법 주문을 13자 이내로 작성해 제출하면 된다. 제출된 마법 주문 가운데 내부 심사를 통해 채택된 마법 주문 5종은 추후 대회 참가자들이 실제로 외치게 된다. 채택된 응모자 5명에게는 마법소녀 루루핑 굿즈를 증정한다.한편, 렐루게임즈는 11월 14일부터 17일까지 지스타 2024 기간 동안 야외 전시 부스에서 마법소녀 루루핑의 체험 공간을 운영한다. 부스 관람객들은 체험 공간에서 마법소녀 루루핑의 ‘레전드 모드’와 ‘마법 대결 모드’를 시연할 수 있다. 레전드 모드는 게임에 사전 녹음된 목소리와 겨루는 모드이며, 마법 대결 모드는 다른 이용자와 실제로 대결할 수 있는 모드다.부스 관람객들은 현장에서 ‘마력 측정기’에 접속해 자신의 마력 점수를 측정할 수 있으며, 일정 점수를 넘기면 마법소녀 굿즈를 획득할 수 있다. 마력 측정기는 마법소녀 루루핑의 웹 버전으로,QR코드로 접속해 모바일 등 각종 휴대용 디바이스에서도 간편하게 마법 주문을 외치고 음성 전투를 즐길 수 있다.렐루게임즈는 오지큐(OGQ)와 협업해 10월 21일부터 27일까지 마법소녀 루루핑 굿즈 사전 예약 판매를 진행한다. 폰 케이스, 담요, 키링, 장패드, 마법봉 등 다양한 굿즈를 할인가에 사전 구매할 수 있으며, 지스타 2024 야외 전시 부스에서 수령할 수 있다.제1회 마법소녀 선발전의 모든 일정은 아프리카TV‘마법소녀 공식’ 방송국에서 생중계되며, 대회 참가 신청과 이벤트 응모도 해당 웹사이트에서 가능하다."
2024-07-08,"BJ 한명이 1년에 300억 수입…별풍선, 걸그룹도 뛰어들었다","그룹 러블리즈 출신 서지수. 아프리카TV캡처아프리카TVBJ(인터넷개인방송 진행자)가 지난해 별풍선 등으로 연 기준 역대 최대인 약 5000억원에 달하는 수익을 냈다.아프리카TV운영사인 ‘숲(SOOP)’이 최근 공개한 ‘2023ESG(환경·사회·지배구조) 리포트’에 따르면 지난해 아프리카TVBJ의 ‘스트리머 분배금’(별풍선 수수료·구독료 등)은 4761억원을 기록했다. 전년(3881억원) 대비 22.7% 늘었다.BJ들에게 지급하는 스트리머 분배금은 매년 증가하고 있다. 2018년 1531억원이었던 분배금은 2019년 1957억원, 2020년 2515억원, 2021년 3463억원으로 늘었다. 분배금의 약 90%는 별풍선 수익이 차지했다.현재 아프리카TV에서 활동하고 있는BJ수는 약 3만명으로 월 이용자는 200만명이 넘는 것으로 추산된다.BJ들의 주 수익원은 별풍선이다. 시청자가 별풍선을 쏘면 아프리카TV와BJ가 약 3 대 7 비율로 가져간다.상위권에 위치한BJ의 월수입은 5억~7억원에 달하는 것으로 알려졌다. 특히 아프리카TV인기BJ‘커맨더지코’는 지난해 300억원이 넘는 수입을 올린 것으로 알려졌다. 걸그룹 ‘크레용팝’ 출신BJ하이엘린(엘린)은 1년 2개월에 걸쳐 한 남성 팬으로부터 8억원어치의 별풍선을 받았다고 한다.러블리즈 출신 서지수는 아프리카TVBJ로 데뷔해 4시간 만에 300만원을 벌어들여 화제를 모은 바 있다.한편, 별풍선을 많이 받기 위한 일부BJ들의 행태로 아프리카TV는 과도한 연출과 노출 사행성 논란에 휘말렸고 부정적인 이미지를 벗어나지 못했다. 이에 아프리카TV는 13년간 이어오던 사명을 ‘숲’으로 바꾸고,BJ명칭도 ‘스트리머’(스트리밍을 하는 사람)로 바꿔 그간 가지고 있던 부정적 이미지 탈피를 위해 노력 중이다．"
