date,title,content
2024-12-18,"SOOP loses lead in streaming war, struggles to shake its image","SOOPlogo./SOOPSOOP,formerlyAfreecaTV,oncedominatedSouthKorea’slive-streamingscenebutisnowlosinggroundtoNaver’sCHZZK.WithinayearofitslaunchinDecember2023,CHZZKhassurpassedSOOPinmonthlyactiveusers(MAU),raisingquestionsaboutSOOP’sabilitytoshakeoffitscontroversialimage.AccordingtomobiledataanalysisplatformMobileIndex,SOOP’sMAUstoodat2.4millionlastmonth,slightlybehindCHZZK’s2.42million.CHZZKalsoedgedoutSOOPinappdownloads,with187,141newinstallationscomparedtoSOOP’s181,091duringthesameperiod.InresponsetoCHZZK’srapidrise,SOOPhasimplementedseveralchangestodefenditsposition.TheplatformrebrandedfromAfreecaTVtoSOOPinOctoberandrevampeditsuserexperience(UX)anduserinterface(UI).Lastmonth,SOOPlauncheditsglobalplatformtoexpanditsreachinternationally.OnDec.9,SeoSoo-gil,thecompany’sChiefBJOfficer,returnedasCEOafterthreeyearstospearheadeffortstostrengthenitsesportsbusinessandpursuenewventures.Ascreenshotofan""Excelbroadcast""streamedonSOOP./News1Despitetheseefforts,criticsarguethatSOOPhasstruggledtodistanceitselffromitslong-standingcontroversialreputation.Recently,theplatformhasfacedbacklashforallowingsexuallysuggestiveandviolentcontenton“Excelbroadcasts.”Excelbroadcasts,namedaftertheirspreadsheet-likeformat,displayreal-timedonationrankingsandBJ(broadcastjockey)standings.Whilepopularamongcertainaudiences,thesegroupbroadcastsoftenfeaturemultiplefemalestreamerssingingordancing,withcriticslikeningtheformatandatmospheretoanadultentertainmentvenue.Theterm“cyberroomsalon”hasbeenwidelyusedtodescribesuchprograms,sparkingpublicoutrage.AllegationssurroundingExcelbroadcastshavefurthertarnishedSOOP’simage.Lastyear,duringtheinvestigationofahigh-profileincidentinwhichaRolls-RoycerammedintopedestriansnearApgujeongStation,policeuncoveredevidencethattheperpetrator,affiliatedwithacriminalorganization,launderedillicitfundsthroughSOOP’sdonationsystem.Theschemeinvolvedconspiringwithafemalestreamertofunnelapproximately5billionwon($3.8million)indonations,splittingtheproceedsafterward."
2024-12-05,네이버도 뛰어 들었다. 버튜버가 뭐길래 [테키타카],"안녕하세요. 조선일보 테크 유튜브 ‘테키타카’의 안상현 기자입니다.각종 기술 이슈를 얇고 넓게 파헤치는 테키타카에서 이번 주 다룰 주제는 바로 ‘버튜버’입니다. 버튜버는 가상을 뜻하는 ‘버추얼’과 유튜버를 합친 말입니다. 유튜브나 치지직(네이버), 숲(SOOP) 같은 온라인 영상 플랫폼을 돌아다니다 보면 일본 애니메이션에서 볼법한 2차원 또는 3차원 가상 캐릭터로 방송을 진행하는 모습을 쉽게 찾아볼 수 있는데요./조선일보 유튜브 '테키타카'./조선일보 유튜브 '테키타카'.소수의 마니아층만 즐기던 버튜버 채널들은 최근 몇 년 사이 급격히 많아지며 단순 놀이 문화를 넘어 하나의 산업으로 성장하는 모습입니다. 버튜버들로 구성된 아이돌 그룹이 멜론 같은 주요 음원 스트리밍 차트를 장악하고, 오프라인 단독 콘서트를 열고 수만명의 팬을 동원할 정도로 성장했습니다. 이제는 지방자치단체도 공무원을 버튜버로 만들어 정책 활동을 홍보하고, 버튜버 원조 국가로 불리는 일본에선 버튜버 전문 기업들이 증시에 상장해 조 단위 시가총액을 자랑할 정도죠. 네이버 같은 국내 주요IT기업들도 관련 투자를 늘리고 있습니다.대체 버튜버가 뭐고, 왜 이토록 큰 인기를 끄는 걸까요. 상세한 내용은 영상에서 확인해주세요! 테키타카는 유튜브 채널 ‘테킷’에서 보실 수 있습니다./조선일보 유튜브 '테키타카'./조선일보 유튜브 '테키타카'."
2024-06-19,"공유·수지 소속사, 아프리카TV에 법적 대응 나선 이유","배우 수지. /매니지먼트 숲공유와 수지 등 유명 배우들이 소속된 것으로 유명한 카카오엔터테인먼트 산하 매니지먼트 숲이 인터넷 방송 플랫폼 아프리카TV를 상대로 법적 대응에 나섰다. 아프리카TV가 이미지 쇄신을 위해 사명을 ‘주식회사 숲(SOOP)’ 으로 변경하자, 소속 배우들이 이미지 등의 면에서 피해를 본다는 이유에서다.매니지먼트 숲은 18일 인스타그램 등 소셜미디어에 올린 공지에서 “최근 주식회사 아프리카TV가 상호를 ‘주식회사 숲’으로 변경하고 있는 것을 확인했다”며 “아프리카TV의 이러한 행위는 당사의 상표권, 상호권을 침해하는 행위”라고 했다. 그러면서 “부정경쟁방지 및 영업비밀 보호에 관한 법률에서 금지하고 있는 영업표지 혼동 행위 및 성과 도용 행위에도 해당한다”고 했다.숲은 “당사는 2011년 4월19일 설립 시부터 ‘숲엔터테인먼트’라는 상호를 사용하여 왔고, ‘주식회사 숲엔터테인먼트’,‘매니지먼트숲’,‘soop’표장에 대한 상표권을 보유하고 있다”고 덧붙였다.이에 따라 숲은 아프리카TV를 상대로 법정 대응에 나섰다. 숲은 “아프리카TV의 이와 같은 행위가 계속되는 경우 당사가 쌓아 온 명성과 소속 배우들의 이미지에도 부정적 영향을 주게 된다”며 “이에 금일 아프리카TV를 상대로 서울중앙지방법원에 상표권 등 침해금지 가처분 신청을 했다”고 했다. 이어 “주식회사 숲, ‘SOOP’표장을 사용하는 이벤트 및 행사, 숲트리머, 숲가락 등은 당사와 아무런 관계가 없음을 말씀드린다”며 “이에 혼동하지 마시고 불필요한 피해가 발생하지 않도록 각별한 주의를 부탁한다”고 했다.끝으로 “앞으로도 당사와 소속 배우들의 이익을 부당하게 침해하는 행위에 대해 단호하게 대응할 예정”이라고 했다.매니지먼트 숲 소속 배우들. /숲 홈페이지현재 매니지먼트 숲에는 수지, 공유, 공효진, 서현진, 전도연, 정유미, 김재욱, 이천희 등 국내 유명 배우들이 다수 소속돼 있다.아프리카TV는 일부BJ들의 일탈로 부정적 이미지가 각인돼, 이를 쇄신하고자 사명 변경을 일찌감치 고민했던 것으로 전해졌다.이와 관련, 정찬용 아프리카TV대표는 지난달 3월 29일 열린 정기 주주총회에서 사명 변경 확정 소식을 전하며 “라이브 스트리밍이라는 플랫폼 서비스가TV라는 인식 속에 갇혀 있지 않고, 더욱 펼쳐 나가기 위해 새로운 브랜딩이 필요하다고 생각했다”고 했다.한편 아프리카TV는 2013년 핵심 서비스와 사명을 일치화하는 통합 브랜드 구축을 진행한 이후 매년 연 평균 22%의 매출 성장을 기록하며 성장해 왔다. 2023년 매출액과 영업이익은 각각 3476억, 903억 원으로 이는 2013년 대비 7배, 21배 증가한 수준이·다. 현재 아프리카TV에서 활동하고 있는BJ수는 3만명가량으로 추산되며, 월 이용자수는 평균 200만명을 웃도는 것으로 알려졌다."
2024-11-20,"‘이병헌 협박’ 전 글램 멤버 다희, 은퇴 선언 후 공개한 깜짝 근황","그룹 글램 출신 인터넷 방송BJ김시원이 유튜버로 전향했다. /유튜브 채널 '김시원'배우 이병헌을 협박하며 50억원을 요구해 징역형을 선고받았던 그룹 글램 출신 인터넷 방송BJ김시원이 유튜버로 전향했다.김시원은 지난 17일 자신의 유튜브 채널 ‘김시원’에 20년 지기 친구와 유튜브를 시작하게 된 계기를 설명하는 영상을 올렸다.영상 업로드 설명란에는 “세상의 풍파를 겪은 여자와 매일 죽음을 보는 그녀의 친구가 도전을 고민하는 이들에게 주는 메시지”라고 적혀 있었다.김시원은 영상에서 “하고 싶은 게 있어도 저는 은근히 겁도 많고 미루는 경향이 있다. 그게 (시작이) 무서워서 그런 것이다. 그런데 그것을 잡아주는 친구였다”며 유튜브를 시작하게 된 배경을 설명했다.이어 “제 친구들은 뭘 하든 저를 믿고 지지해 준다. 특히 이 친구는 ‘너가 하는 거면 나는 좋다’고 말해주는 용기 있는 친구”라며 “혼자라면 할 수 없었을 것”이라고 했다.한편, 김시원은 2012년 아이돌 그룹 글램에서 다희라는 이름으로 활동했다. 그는 2014년 지인 모델과 함께 배우 이병헌과 술을 마시며 몰래 촬영한 사적 동영상을 인터넷에 유포하겠다며 50억원을 요구했다. 당시 동영상에는 음담패설 등이 담긴 것으로 전해졌다. 이병헌은 경찰에 고소했고, 김시원은 공갈미수 혐의로 구속됐다. 1심에서 실형을 선고 받았지만 이후 항소심에서 징역 1년에 집행유예 2년으로 감형받았다. 이 사건으로 글램은 해체했다.한동안 아르바이트 등으로 생계를 이어갔던 그는 2018년 이름을 김시원으로 개명해 인터넷 방송BJ로 복귀했다. 그는BJ로 활동하며 2년 연속 아프리카TVBJ대상을 받는 등 많은 인기를 얻었으며, 작년 약 24억원을 번 것으로 알려졌다. 올해 1월 초 김시원은 자신의SOOP(옛 아프리카TV) 채널 공지 게시판에 ‘모두 감사합니다’라는 제목으로 손 편지를 올리고 은퇴를 암시했다."
2024-04-19,‘치지직’ 227만명 vs ‘아프리카TV’ 248만명,"라이브 스트리밍 1위 다툼 치열다음 달 9일 정식 서비스 개시를 앞두고 있는 네이버의 라이브 스트리밍(streaming) 플랫폼 ‘치지직’이 최근 짧은 영상(숏폼) 서비스를 추가하기로 했다. 네이버에서 처음으로 선보이는 서비스인 만큼 화제성이 높은 숏폼을 통해 빠르게 시청자를 확보하기 위해서다. 국내 라이브 스트리밍 점유율 1위를 지키고 있는 ‘아프리카TV’는 치지직의 도전에 맞서 ‘글로벌 카드’를 꺼내들었다. 올해 2분기 태국 등 동남아 시장에서 라이브 스트리밍 서비스를 시작한다. 해외 사업을 통해 압도적인 시청자를 확보해 네이버 ‘치지직’을 따돌리겠다는 전략이다.국내 라이브 스트리밍 시장을 두고 ‘치지직’과 ‘아프리카TV’의 본격적인 승부가 시작됐다. 라이브 스트리밍은TV나 라디오 등 전통 매체가 아닌 인터넷을 통해 방송을 송출하는 서비스를 의미한다. 국내 점유율 1위였던 글로벌 스트리밍 플랫폼 ‘트위치’가 지난 2월 통신사들과 인터넷망 사용료 갈등으로 한국 시장에서 철수한 뒤, 그 자리를 차지하기 위해 두 플랫폼이 공격적으로 나서고 있다. 라이브 스트리밍 업계 관계자는 “그동안 틈새시장으로 여겨지던 국내 라이브 스트리밍 시장이 개화기를 맞은 상황”이라고 했다. 특히 K콘텐츠에 대한 글로벌 시청자들의 관심이 큰 만큼, 국내에서 성공하면 해외시장 진출을 위한 단단한 입지를 다질 수도 있다. 시장조사 업체 스태티스타는 글로벌 라이브 스트리밍 시장이 2027년까지 매년 8.3%씩 성장해 1377억달러(약 190조원)에 이를 것으로 전망했다.그래픽=김현국트위치 빈자리를 차지하라지난해 12월 베타(시범) 서비스를 시작하며 라이브 스트리밍 시장에 뛰어든 치지직은 그동안 국내 시장을 장악했던 트위치의 대체자로 떠오르며 빠르게 성장하고 있다. 모바일 빅데이터를 제공하는 모바일 인덱스에 따르면, 네이버 ‘치지직’은 지난달 227만명의 월간 활성 이용자(MAU·한 달 한 번 이상 이용자)를 모은 것으로 나타났다. 베타 서비스를 시작할 당시 130만명 수준이던MAU가 넉 달 만에 100만명 가까이 늘어난 것이다. 실제로 치지직은 트위치 이용자를 흡수하며 몸집을 키우고 있다. 트위치의 주 연령층이 10대였고, 주로 게임 방송을 시청했기 때문에 비슷한 성향의 이용자가 모인 치지직으로 몰린 것으로 풀이된다.아프리카TV는 ‘충성 시청자’를 앞세워 수성에 나서고 있다. 1인당 월평균 사용 일수는 두 플랫폼이 비슷하지만 사용 시간은 아프리카TV가 15.9시간으로 치지직의 9.8시간보다 많다. 아프리카TV는 스포츠 ‘편파 중계’ 등 충성도가 높은 콘텐츠를 강화하며 이용자들을 확보해 나가고 있다. 아프리카TV에는 3040세대가 주로 모이며 게임보다는 축구 등 스포츠 콘텐츠가 더 인기를 끌고 있는 것으로 알려졌다.치지직VS아프리카TV치지직과 아프리카TV간 경쟁은 앞으로 더 치열해질 전망이다. 두 회사가 모두 시청자를 끌어들이기 위해 새로운 서비스를 준비하고 있기 때문이다.치지직은 커뮤니티, 쇼핑, 간편 결제 등 네이버의 다양한 서비스와 연계해 시너지를 극대화하는 전략을 추진하고 있다. 치지직에서 방송을 하는 스트리머(방송인)가 네이버 카페에서 커뮤니티를 운영하면서 숏폼을 올리고, 시청자들은 네이버 페이로 방송에 나오는 상품을 결제하는 등 치지직을 중심으로 각 서비스 이용자를 모으겠다는 것이다. 네이버는 이를 통해 동영상 분야에서 아프리카TV를 넘어 유튜브와 경쟁한다는 밑그림을 그리고 있다.아프리카TV는 서비스 개편을 통해 체질 개선에 나서고 있다. 지난달 사명을 ‘숲(SOOP)’으로 바꾸며 ‘욕설’ ‘선정성’ 등 기존의 부정적인 이미지에서 벗어나는 의지를 밝혔다. 또 스트리머를 후원하는 ‘별풍선’ 기반의 수익 구조를 광고 등으로 다각화하면서 안정적인 기반을 마련한다는 계획이다. 라이브 스트리밍 콘텐츠 중에서 가장 인기가 높은 ‘게임 방송’의 영향력을 높이기 위해 글로벌 e스포츠 경기를 독점 생중계하고 유명 게임 스트리머를 영입하며 시청자층을 넓히고 있다.☞라이브 스트리밍 (livestreaming)인터넷을 통해 방송을 실시간 송출하는 서비스를 의미한다. 이 서비스를 제공하는 플랫폼을 통해 스트리머(방송인)가 다수의 시청자를 대상으로 스포츠와 게임, ‘먹방’같은 콘텐츠를 생방송하고, 시청자는 채팅으로 방송에 참여한다. 플랫폼 업체들은 시청자들이 스트리머에게 제공하는 ‘별풍선’ 등의 후원금에 대한 수수료와 광고로 수익을 얻는다."
2024-10-21,"BJ 집 문 열릴 때까지 13시간 기다린 스토커, 무단침입 모습 보니",BJ조예리씨가 공개한 무단침입 피해 관련 영상. 문 뒤에 숨어 있던 남성(왼쪽)이 문이 열리자 집 안으로 들어가려 하는 모습. /온라인커뮤니티숲(SOOP·옛 아프리카TV)에서 스트리머로 활동 중인BJ조예리(20)씨가 스토킹 피해를 호소하며 자신의 집에 무단침입하는 남성의 모습이 담긴 영상을 공개했다.조씨는 지난 18일 자신의 인스타그램을 통해 “인스타에 올리기 힘든 끔찍한 일을 당했다”며 건물 복도에 설치된 감시카메라(CCTV) 영상을 올렸다.영상을 보면 현관문이 살짝 열리자 문 뒤에 숨어 있던 한 남성이 문틈을 비집고 무단침입을 시도한다. 그 뒤 현관문을 두고 실랑이 하는 듯 문이 여닫히길 반복한다. 집 주인은 이 남성을 문 밖으로 밀쳐내려 했지만 결국 실패해 문이 완전히 닫혔다.조씨는 “내가 문을 열고 나올 때까지 13시간 동안 집 앞에서 기다리다 문을 열고 나서는 순간 현관문 뒤에서 가해자가 튀어나왔다”며 “살려달라고 소리치는 제 입을 막고 저와 실랑이를 벌인 뒤 집 안으로 저를 세게 밀쳐 넘어뜨렸다”고 했다.이어 “그 후에는 인스타에 올리기 힘든 끔찍한 일들을 안에서 당했다”고 주장했다.그는 “조작한 거 아니냐고 하시는데 경찰 측에서 증거 자료로 채택한 8월28일 촬영된 조작 아닌 원본 자료”라고 했다. 가해자의 신원에 대해서는 밝히지 않았다.영상을 본 네티즌들은 “13시간이나 집앞에서 기다렸다가 들어오는데 무슨 수로 피하나” “너무 무섭고 소름끼친다” “반드시 잡아야 한다” 등의 반응을 보였다.스토킹 행위는 2021년 10월21일부터 시행된 ‘스토킹 범죄의 처벌 등에 관한 법률(스토킹 처벌법)’에 따라 처벌받는다. 이는 그간 스토킹 행위를 엄중하게 처벌하지 못하는 경범죄 처벌법의 한계를 극복하고자 도입됐다.이후 2022년 9월 ‘신당역 살인사건’이 발생하면서 스토킹 처벌법의 한계에 관한 지적이 대두되자 피해자의 의사 없이는 처벌하지 않는 ‘반의사 불벌’ 조항을 폐지하고 온라인 스토킹 유형을 추가하는 등의 방향으로 법률이 개정됐다.검찰에 따르면 이 법 위반으로 검찰에 입건된 피의자는 지난해에만 1만438명으로 집계됐으며 올해도 8월까지 8881명이 피의자로 입건됐다.서울에서는 2019년부터 올해 6월까지 5년간 혼자 사는 여성을 노린 주거침입 성범죄가 246건 발생한 것으로 집계됐다.BJ조예리. /인스타그램
2023-12-20,‘침착맨’도 네이버 ‘치지직’에 떴다... 트위치 철수하자 빈자리 쟁탈전,"네이버, 게임 개인 방송 ‘치지직’ 첫선시범 운영… 내년 상반기 서비스검색 서비스 등과 연계 내세워아프리카TV도 이용자 유치 총력19일 시범 운영을 시작한 네이버의 게임 스트리밍 플랫폼 '치지직' 화면. 침착맨, 릴카 등 유명 스트리머들이 시범 방송을 하고 있다. /치지직 캡처19일 낮 12시에 시작한 네이버의 게임 스트리밍(개인 방송) 플랫폼 ‘치지직’에서 진행된 웹툰 작가 출신 유명 스트리머(방송인) 침착맨 개인 방송은 시청자 1만5000여 명이 지켜봤다. 이날 시범 서비스를 개시한 이 서비스에는 낮 시간에도 약 6만5000명이 접속해 30여 명의 스트리머가 진행하는 개인 방송을 즐겼다. 네이버 관계자는 “아직 첫날이지만 서비스가 끊기지 않고 방송 품질도 괜찮다는 호평이 많다”며 “순차적으로 추가 기능을 선보일 계획”이라고 했다.국내 스트리밍 점유율 1위를 차지하던 아마존닷컴의 플랫폼 트위치(Twitch)가 국내 시장에서 철수하면서 국내 스트리밍 플랫폼 시장에 지각 변동이 일고 있다. 트위치는 “한국의 망 사용료가 부담된다”는 이유로 내년 2월 27일부터 한국 사업을 접는다. 업계 1위의 빈자리를 차지하기 위해 새로 시장에 진입한 네이버와 점유율 2위 아프리카TV사이의 경쟁이 본격화한 것이다.네이버는 지난 5일 직원들을 대상으로 치지직의 비공개 시험을 시작한 데 이어 타 방송 플랫폼에서 팔로어 1만명 이상을 보유한 일부 스트리머에게 방송 권한을 부여하면서 시범 운영에 나섰다. 치지직은 개인 방송을 네이버의 여타 서비스와 연계할 수 있다는 점을 강점으로 내세운다. 네이버 검색, 게임판, 네이버카페, 클립 등과 연계해 방송 콘텐츠를 확장할 수 있다는 것이다. 스트리밍 서비스에 가장 핵심적인 수익 모델인 후원을 위한 재화인 ‘치즈’도 네이버페이로 구매할 수 있다. 네이버는 20일부터 스트리머 게임 대회인 ‘자낳대’ 후원과 방송 송출을 통해 본격적으로 트위치 이용자와 스트리머들을 유치하고 내년 상반기 서비스를 정식 출시할 계획이다.트위치와 스트리밍 시장을 양분했던 아프리카TV역시 사명까지 변경하며 이용자 유치에 나선다. 서수길 전 아프리카TV대표는 내년 3월 아프리카TV의 이름을 ‘숲(SOOP)’으로 바꾸고, 사명도 아프리카TV에서 ‘숲코리아’로 변경한다는 계획을 밝혔다. 욕설, 노출 등이 많은 부적절한 방송이 만연하다는 이미지를 개선하기 위함이다. 트위치에서 방송한 시간도 최대 400시간까지 인정해주고, 트위치 계정을 아프리카TV와 연동하는 기능도 추가했다.스트리밍 시장을 둘러싼 경쟁이 격화하는 이유는 시장 규모가 날로 커지고 있기 때문이다. 시장조사 업체 스태티스타에 따르면 전 세계 게임 스트리밍 시장 규모는 올해 116억9000만달러(약 15조3431억원)에서 2028년 182억2000만달러로 증가할 전망이다. 아프리카TV역시 올 3분기 매출 879억원을 기록해 분기 역대 최대 매출을 기록했다. 김하정 다올투자증권 연구원은 “국내 트위치 스트리머를 영입하고 유저 트래픽을 성공적으로 확보하면 치지직의 사업 가치는 1조원을 넘어설 수 있다”고 했다."
2022-07-30,단돈 9000원이면 BTS가 놀던 ‘인더숲’ 평창집에서 하룻밤!,"[아무튼, 주말]/에어비앤비“이 정도면 성(castle) 아닌가?”방탄소년단의 멤버 진이 감탄한 그대로다. 서울에서 차로 두 시간 반 정도 달리면, 나무가 우거진 숲을 지나, 유럽의 하얀 성 같은 저택이 나온다. 방탄소년단이 소속사 하이브의 자체 예능인 ‘인더숲BTS편 시즌 2′ 평창편 촬영을 위해 머물렀던 곳이다./에어비앤비저택 마당에는 바닥에 ‘인 더 숲(Inthesoop)’이라는 글자가 적힌 수영장이, 그 위엔 진이 누워 휴식을 취하던 유니콘 튜브가 그대로 떠 있다. 그 옆에서 뷔는 방탄소년단의 첫 빌보드 1위 곡 ‘다이너마이트’를 물뿌리개를 마이크 삼아 불렀다. 그 뒤로 정국이 뛰어놀던 트램폴린과, 밤(정국의 반려견)이 뛰어다니던 농구코트도 보인다./에어비앤비저택 유리 외벽에는 멤버들의 사인이, 문을 열고 들어가니 제이홉이 시즌 1에서 직접 만들었던 고무동력기가 환영 인사를 건넨다. 제이홉을 동심의 세계로 빠지게 만들었던 그 비행기다.그 뒤로는 지민이 출출한 멤버들을 위해 야식으로 짜장라면을 끓이고, 방탄의 공식 셰프 슈가가 떡볶이를 만들던 주방이 있다. 거실에는 일곱 멤버가 앉아 밥과 야식을 먹던 식탁이 놓여 있다. 의자도 그대로 일곱 개, 리더RM의 자리 뒤에 걸려 있던 슈가의 그림만 방탄소년단의 사진으로 교체됐다./에어비앤비거실 옆방으로 들어가니 정국이 감미로운 목소리로 정승환의 ‘너였다면’을 부른 노래방 기기가 나온다. 많은 아미들이 “마이크라도 되고 싶다”며 외치게 만들었던 장면이다./에어비앤비방 오른쪽에는 쳇 베이커에 흠뻑 빠진 뷔가 연습하던 트럼펫과 슈가가 창의적인 작곡을 상상하며 치던 기타가 놓여 있다. 그 옆엔 방탄소년단의 빌보드 1위 곡 ‘다이너마이트’와 ‘버터’ 악보가 놓여 있다. 뷔처럼 그림을 그릴 수 있게 하얀색 캔버스도 놓여 있다./평창=이혜운 기자다시 거실로 나와 주방 왼쪽으로 들어가면 숨겨진 방 하나가 나온다. 파워랙과 덤벨로 가득 찬 운동 방이다. 최근 몸 만들기에 재미를 붙인RM이 요청해 만들었다. 지민이 틈틈이 찾아 웨이트 트레이닝을 하던 곳이다./에어비앤비복층 계단 위로 올라가면RM이 요청한 독서 방이 나온다. 책장에 꽂힌 빼곡한 책들, 천체망원경이 그대로 놓여 있다. 제이홉이 즐겨 찍던 폴라로이드 사진기도 보인다. 방송과 다른 점은 이곳에 놓인 2인용 침대다.에어비앤비는 다음 달 29일부터 30일까지 1박 2일간 이곳에서 숙박할 수 있는 예약 기회를 한국을 포함한 전 세계 게스트들을 대상으로 공개한다. 숙소 이용을 위한 예약 금액은 방탄소년단 멤버 7명을 상징하는 7달러(약9000원)이다.이곳에서 숙박을 원하는 사람은 다음 달 2일 오전 11시부터 에어비앤비 홈페이지(airbnb.com/inthesoopbts)에서 예약할 수 있다. 한국의 평창까지 오가는 여행 경비는 게스트가 직접 부담해야 하지만, 강원도KTX평창역에서 ‘인더숲BTS편 ‘평창’ 촬영지’ 사이 20분간의 왕복 차량 편은 제공된다.이곳에서의 숙박 기회는 이번 단 한 번뿐이다. 두 명의 게스트(예약자 1명과 동반자 1명)는 방송에 등장했던 가구와 편의시설을 비슷하게 경험할 수 있는 공간을 이용하게 된다. 방송에서처럼 레이싱 경주를 벌이며 스트레스를 풀어볼 수 있는RC카가 마련돼 있다. 방송에서 “우주 최고의 맛”이란 표현으로 감탄사가 나왔던 한우 숯불구이로 배를 든든하게 채우고, 떡볶이, 크로플도 맛볼 수 있다.하이브의 음악 뮤지엄 ‘하이브 인사이트(HYBEINSIGHT)’ 뮤지엄샵에서만 판매하는 방탄소년단의 음악적 아버지 방시혁이 만든 뱅앤베이커스의 에그 타르트도 맛볼 수 있다. 에어비앤비 관계자는 “이번 기회를 놓친 아쉬움을 달래기 위해 주변 숙소에서 머물며 이 공간을 방문할 수 있는 또 다른 기회를 조만간 공개할 예정”이라고 말했다."
