date,title,content
2024-10-22,"“아파트, 아파트” 로제 술게임에 푹 빠지자…YG PLUS 이틀째 급등","미국 팝스타 브루노 마스와 록 밴드 사운드 기반의 협업곡을 선보인 블랙핑크 로제. /더블랙레이블블랙핑크 멤버 로제가 팝가수 브루노 마스와 함께 발매한 신곡 ‘아파트(APT)’의 전세계적 흥행에YGPLUS주가가 이틀째 급등세를 나타내고 있다.22일 한국거래소에 따르면YGPLUS주가는 이날 오전 11시20분 기준 전 거래일 대비 23.42% 오른 4295원에 거래되고 있다.YGPLUS는 전날 상한가로 장을 마쳤다.같은 시각 로제 소속사YG엔터테인먼트는 전일 대비 3.01% 오른 3만9300원에 거래되고 있다.YGPLUS는YG엔터테인먼트의 음원 유통을 맡고 있는 자회사로, 지난 18일 공개된 ‘아파트’ 유통을 맡고 있다.이 곡은 로제가 한국의 술자리 게임인 ‘아파트 게임’을 소재로 대중음악계 슈퍼스타인 브루노 마스와 함께 불렀다.음원 발매 전인 지난 9월 로제는 프랑스 파리에서 열린 명품 ‘생로랑’ 애프터 파티에서 해외 패션계 유명 인사들과 함께 ‘아파트 게임’을 즐기는 모습을 공개해 화제를 모으기도 했다.중독적인 훅(Hook·후렴구)가 인상적이라는 평가를 받은 이 곡은 국내 주요 음원 차트 1위는 물론 스포티파이 데일리 톱 송 글로벌 1위, 미국 1위를 기록했다. 유튜브에 올라온 공식 영상은 3일 만에 8000만뷰를 돌파했다."
2024-10-24,거대한 ‘아파트’ 몸값… 음원 유통 YG PLUS 주가 81% 초고속 상승,"미국 팝스타 브루노 마스와 록 밴드 사운드 기반의 협업곡을 선보인 블랙핑크 로제. /더블랙레이블블랙핑크 멤버 로제와 미국 가수 브루노 마스가 함께 부른 노래 ‘아파트(APT.)’가 지난 18일 발표되고 나서 전 세계적으로 큰 인기를 끌자 음반 유통사 및 엔터테인먼트주 주가도 함께 오르고 있다. 특히 블랙핑크 소속사인YG엔터테인먼트 자회사이자 음원 유통사인YGPLUS주가가 급등했다. 23일 한국거래소에 따르면YGPLUS는 전일 대비 10.5% 급등한 4995원에 거래를 마쳤다. 장중 한때 전일 대비 상승률 26.7%까지 기록했다.YGPLUS는 21·22일에도 연속으로 급등해 지난 5일간 주가 상승률이 81%에 달한다.YG엔터테인먼트의 주가도 동반 상승 중이다. 23일YG엔터테인먼트 주가는 4만1700원으로 전일보다 2.9% 상승했다. 전날에도 이 회사 주가는 6.1% 올랐다.YG엔터테인먼트 주가가 종가 기준으로 4만원을 넘긴 것은 지난 7월 1일 이후 3개월 만이다.K팝의 전반적인 인기가 확장되리라는 기대감으로 한국의 다른 엔터테인먼트사 주가까지 상승 곡선을 타는 중이다.SM엔터테인먼트 주가는 23일 7만1600원으로 전날보다 2.6% 상승했다. 5일간 상승률은 8.5%다.JYP엔터테인먼트 주가 역시 이날 전일 대비 2.9% 상승(종가 5만2900원)했다. 입대했던BTS멤버가 하나둘 제대 중인 하이브는 주가가 23일 1.1% 하락했지만, 지난 5일 기준으론 8.0% 상승했다."
2024-10-23,YG PLUS soars nearly 80% after BLACKPINK Rosé's hit tops global charts,"YGPLUSstocksurgednearly80%inthreedays,drivenbytheglobalsuccessof“APT.,” anewsinglefeaturingBLACKPINK’sRoséandBrunoMars.By9:55a.m.onOct.23,YGPLUSwastradingat4,660won,up3.1%,afterpeakingat5,170wonearlierintheday.ThestockevenhitthedailypricelimitonOct.21and22.BLACKPINK'sRoséisseeninastillfromthemusicvideofor""APT.,"" asinglereleasedincollaborationwithglobalpopstarBrunoMarsonOct.18, 2024./TheBlackLabelThecompany,responsibleformusicdistributionforYGEntertainment,ishandling“APT.,”whichtoppedSpotify’sglobalandU.S.charts.Themusicvideogarnered82millionviewsinjustfourdaysonYouTube,nearing100million."
2024-10-24,"[Minute to Read] Hyundai’s landmark IPO in India raises $3.3B, plans EV and export growth","TheMinutetoRead(Weekdays)seriesprovidesaquickoverviewofsignificanteventsinKoreaeveryday,convenientlycondensedintoaone-minuteread.Here’sarecapofwhathappenedyesterday:Oct.23.Fromleft,HyundaiMotorPresidentChangJae-hoon,HyundaiMotorGroupChairmanEuisunChung,andNationalStockExchangeofIndiaCEOAshishChauhanparticipateintheceremonialbellringingtomarkthelistingofHyundaiMotorIndiaonOct.22, 2024./HyundaiMotorGroupHyundai’slandmarkIPOinIndiaraises$3.3B,plansEVandexportgrowthHyundaiMotorIndiawentpublicontheIndianstockmarketonOct.22,raising$3.3billionthroughitsinitialpublicoffering(IPO),thelargestinIndianstockmarkethistory.HyundaiaimstousethefundstostrengthenitspositioninIndia’sboomingautomotivemarketandenhanceresearchanddevelopment(R&D)effortsinelectricvehiclesandsoftware.TheIPOunderscoresHyundai’splanstodevelopIndiaasaglobalmanufacturinghubforexportstoEuropeandSoutheastAsia,shiftingfocusfromRussiaandChina.However,sharesdropped7.16%onitsfirsttradingday,withconcernsoverpricingleadingtoasubduedretailinvestorresponse.KakaodebutsnewAIassistantKananaforhyper-personalizedmessagingKakaohasintroducedanewAIservice,“Kanana,”thatenhancespersonalizedconversationswithinitsmessagingplatform.UnveiledattheIf(KakaoAI) 2024conference,KananaoperatesasaseparateappfromKakaoTalk,offeringanAIassistantnamed“AIMate,”whichcanengageinone-on-oneorgroupchats.Itanalyzesconversationcontextsandprovidestailoredresponses,suchassummarizingchatsorrecommendinglocations.DespitetheseAIadvancements,Kakaofacesongoingchallenges,includinglegalissuesinvolvingtopexecutives,aheftyfineforKakaoMobility,andinvestigationsintoallegedfinancialmisconductanddatabreaches.BLACKPINK’sRosé,BrunoMarsboostYGPLUSstocknearly80%in3DdysYGPLUSstocksurgednearly80%inthreedaysfollowingtheglobalsuccessof“APT.,” anewsinglefeaturingBLACKPINK’sRoséandBrunoMars.BythemorningofOct.23,thestockwastradingat4,660won,afterpeakingat5,170wonearlierintheday,withsignificantgainsonOct.21and22.YGPLUS,responsibleformusicdistributionforYGEntertainment,sawthesuccessof“APT.”reflectedinitsstockprice,asthesongtoppedSpotify’sglobalandU.S.chartsanditsmusicvideoneared100millionviewsonYouTube.Oneminute,that’sallittakestoknowaboutKorea.Clickhere☞https://page.stibee.com/subscriptions/305897"
2024-08-12,S. Korea’s top entertainment firms fined for unfair idol merch sales practices,"ParkMin-young,headofthee-CommerceTeamattheKoreaFairTradeCommission,announcedsanctionsincludingcorrectiveorders,warnings,andfinesagainstfourcompanies—WEVERSECOMPANY,SMBrandMarketing,YGPLUS,andJYP360—forviolationsofthee-CommerceActrelatedtothesaleofidolmerchandise,duringapressconferenceattheGovernmentComplexSejongonAug9. /News1OnAugust11,theKoreaFairTradeCommission(FTC)announcedthatithadissuedcorrectionordersandleviedfinestotaling10.5millionwon(approximately$7,699)againstfourcompanies—WEVERSECOMPANY,YGPLUS,SMBrandMarketing,andJYP360—forviolatingthee-CommerceAct.ThesecompaniesaresubsidiariesofSouthKorea’sfourmajorentertainmentagencies:HYBE,YGEntertainment,SMEntertainment,andJYP.TheFTCfoundthatthesecompaniesunilaterallyshortenedtheperiodduringwhichconsumerscouldexchangeorreturnproducts,suchasidolmerchandiseandalbums.Undercurrentlaw,consumersareentitledtorequestanexchangeorrefundwithinsevendaysofpurchaseforasimplechangeofmindandwithinthreemonthsiftheproductisdefective.However,thecompaniesinquestionlimitedtheexchangeorrefundperiodtojustsevendays,evenincaseswheretheproductwasfaulty.Theyalsoinformedcustomersthatexchangesorrefundswouldnotbepossibleifthepackagingwasdamaged.Moreover,thesecompanieslabeledproductssoldthroughpre-ordersas‘custom-made,’adesignationthatallowedthemtorestrictexchangesandrefundsfurther.Ininstanceswhereproductcomponentsweremissing,thecompaniesdidnotofferimmediaterefunds.Instead,theyrequiredcustomerstorecordavideooftheunboxingprocessandsubmititwiththeirclaim,effectivelyplacingtheburdenofproofontheconsumer.ArepresentativefromtheFTCstated,“Itissignificantthatweidentifiedandcorrectedtheseillegalpracticesintheentertainmentindustry,whichprimarilytargetsteenagers—themainconsumersofidolmerchandise—whomaynotbefullyawareoftheirrightsunderthee-CommerceAct.Wewillcontinuetocloselymonitorforviolationsinareasthatimpactteenagers,suchasidolmerchandise,andwillenforcestrictpenaltiesforanyrepeatoffenses.”"
2024-08-13,[Minute to Read] Hyundai reveals EV battery makers amid growing safety concerns,"TheMinutetoRead(Weekdays)seriesprovidesaquickoverviewofsignificanteventsinKoreaeveryday,convenientlycondensedintoaone-minuteread.Here’sarecapofwhathappenedyesterday:Aug.12.HyundaiMotorCompanyhasbecomethefirstSouthKoreanautomakertofullydisclosebatterymanufacturersforitsEVmodels,amoveexpectedtoinfluenceotherbrandslikeKiaandBMW,amidrisingconsumerconcernsfollowingaMercedes-BenzEVfireandthegovernment'spushfortransparency./News1HyundairevealsEVbatterymakersamidgrowingsafetyconcernsHyundaiMotorCompanyhasbecomethefirstdomesticautomakerinSouthKoreatofullydisclosethebatterymanufacturersfor13ofitsHyundaiandGenesiselectricvehicle(EV)modelsinresponsetorisingconsumerconcernsaboutEVsafety.ThismovefollowsarecentfireinvolvingaMercedes-BenzEV,whichhighlightedtheimportanceoftransparencyregardingbatterysources.Hyundairevealedthat,asidefromonemodelusingabatteryfromChina’sCATL,allitsotherEVsareequippedwithbatteriesfromSKOnandLGEnergySolution.Otherautomakers,includingKiaandBMW,areexpectedtofollowsuit,withtheS.Koreangovernmentpushingforfulldisclosureofbatterymanufacturersstartingnextyear.IllustratedbyKimHyun-kookS.KoreaovertakenbyChinainOLEDmarketforthefirsttimeChinesedisplaycompanieshavesurpassedSouthKoreaintheglobalOLEDpanelmarketforthefirsttime,capturinga 49.7%shareinthefirstquarterofthisyear,whileS.Korea’ssharefellto49%.Thismarksasignificantshift,asS.KoreahadpreviouslydominatedthemoreadvancedOLEDsector.TherapidprogressofChinesecompanies,drivenbytheirlargedomesticmarketandgovernmentincentives,hascreatedintensecompetitionforS.Koreanfirms.Expertswarnthatwithoutnewtechnologiestomaintaintheiredge,S.KoreancompaniesrisklosingtheirdominanceintheOLEDmarket,similartotheirexperiencewithLCDs.ParkMin-young,headofthee-CommerceTeamattheKoreaFairTradeCommission,announcedsanctionsincludingcorrectiveorders,warnings,andfinesagainstfourcompanies—WEVERSECOMPANY,SMBrandMarketing,YGPLUS,andJYP360—forviolationsofthee-CommerceActrelatedtothesaleofidolmerchandise,duringapressconferenceattheGovernmentComplexSejongonAug9. /News1S.Korea’stopentertainmentfirmsfinedforunfairidolmerchsalespracticesTheKoreaFairTradeCommission(FTC)finedfourentertainmentcompanysubsidiaries—WEVERSECOMPANY,YGPLUS,SMBrandMarketing,andJYP360—atotalof10.5millionwon($7,662.39)forviolatingthee-CommerceAct.Thesecompanies,affiliatedwithmajoragencieslikeHYBEandSMEntertainment,illegallyshortenedtheexchangeandrefundperiodsforidolmerchandise,evenincasesofdefectiveproducts.Theyalsolabeledpre-orderedproductsas“custom-made”tofurtherlimitconsumerrightsandrequiredcustomerstosubmitvideoproofformissingcomponents.TheFTCemphasizedtheimportanceofprotectingteenagers,theprimaryconsumersofidolmerchandise,andwarnedofstrictpenaltiesforrepeatoffenses.Oneminute,that’sallittakestoknowaboutKorea.Clickhere☞https://page.stibee.com/subscriptions/305897"
