date,title,content
2024-05-03,‘김빠진’ 밸류업…수혜라던 금융주 고개 숙였다,"━기대 못미친 당국 발표이르면 다음 달부터 상장사들이 ‘밸류업(기업가치 제고) 공시’에 나선다. 코스피·코스닥 상장사는 자율적으로 기업가치 수준을 점검하고, 이를 제고하는 방안을 한국거래소에 연 1회 등 주기적으로 공시할 수 있다. 2일 금융위원회는 한국거래소, 자본시장연구원 등 유관기관과 기업 밸류업 지원방안 2차 세미나를 열고 이같은 내용을 담은 ‘기업가치 제고(밸류업) 계획’ 가이드라인(초안)을 내놨다.기업가치 제고 계획 공시는 한마디로 상장사의 ‘밸류업 종합보고서’다. 이번 가이드라인은 ▶기업개요 ▶현황진단 ▶목표설정 ▶계획수립 ▶이행 평가 ▶소통 등 목차별 작성방법을 제시했다.특히 한국이 벤치마킹한 일본 밸류업 프로그램과 달리 비(非)재무지표를 기업가치 제고를 위한 핵심지표 중 하나로 꼽았다. 주가순자산비율(PBR), 주주자본비용(COE), 자기자본이익률(ROE) 같은 재무지표뿐이 아니라 지배구조 같은 비재무적 요소까지 개선돼야 ‘코리아 디스카운트’가 해소될 수 있다는 게 금융당국의 설명이다. 예컨대 쪼개기 상장(모자회사 중복 상장), 오너 일가의 일감 몰아주기 등 사회적 비판이 나오는 사안에 대해선 미리 주주들과 소통하라는 취지다.투자자는 상장사의 밸류업 ‘목표설정’과 ‘계획수립’ 단계에 관심이 많다. 가이드라인은 기업들이 ‘ROE3년 평균 10% 이상 달성’처럼 계량화된 수치로 중장기 목표를 제시하라고 권장한다. ‘계획수립’ 단계에선 기업은 기업가치 제고를 위한 연구개발(R&D) 확대, 사업 포트폴리오 개편, 자사주 소각과 배당, 비효율적 자산 처분 등 구체적인 계획을 세워야 한다. 기업의 목표 설정(예측정보)에 대해선 면책 제도를 적용한다. 상장사가 목표 달성에 실패했더라도 예측에 대한 합리적인 근거를 제시했다면 ‘불성실 공시’ 제재 대상에 포함되지 않는다.다만 이번 밸류업 가이드라인은 ‘강제성’이 없다. 상장사의 밸류업 공시 참여 여부는 물론 핵심지표 선정 등 작성 방법도 기업의 자율의사에 맡겼다. 대신 모범 납세자 선정 우대 등 인센티브(당근)가 기업의 참여를 이끌 유인책이다. 문제는 시장에서 기대하는 ‘당근’인 세제지원 방안이 구체적으로 나오지 않았다는 점이다.김민국VIP자산운용 대표는 “너무나 많은 공시 항목을 제시하면서 선택과 자율에 맡긴다고 하니 ‘구색맞추기’가 될 가능성이 높다”고 말했다.증시도 일단 실망감을 드러내는 모습이다. 그동안 밸류업 수혜주로 지목됐던 보험·금융·증권 업종은 이날 일제히 주가가 하락했다.김영일 대신증권 리서치 센터장은 “이날 가이드라인 발표는 세제 혜택 구체화 등을 기대했던 시장의 눈높이에는 미치지 못했다”며 “결국 배당소득 분리과세나 일본처럼 개인종합자산관리게좌(ISA) 활성화를 위한 혜택 등으로 개인 투자자들을 움직여야 시장도 호응할 것”이라고 말했다.반면 산업계는 환영하는 모습이다. 이날 세미나에 기업 측 대표로 참석한 박현수 고영테크놀러지 경영기획실장은 “‘PBR(주가순자산비율) 1배’와 같은 강제적인 기준을 주면 기업은 형식적으로만 맞출 수밖에 없다”며 “중·장기계획을 갖고 관념을 바꿔나가는 방향에 동의한다”고 말했다.이남우 연세대 국제대학원 교수(한국기업거버넌스포럼 회장)는 “중장기적으로 밸류업 프로그램이 성공하려면 정부의 세제 혜택과 국민연금의 지원사격이 뒷받침돼야 한다”고 말했다.한편, 이날 발표된 가이드라인은 최종 의견 수렴을 거쳐 5월 중 확정될 계획이다."
2024-05-02,"밸류업 발표, 증시는 하락...당국 “자율이 최선” vs 시장 “실효성 없어”","금융당국이 증시 부양을 위한 ‘기업 밸류업(가치제고)’ 가이드라인을 공개했지만 시장은 기대에 못 미친다는 평가를 내놨다. 구체적인 세제 혜택 내용이 빠졌고, 공시 여부와 방식 모두 기업 자율에 맡겨 실효성이 떨어진다는 이유다.김소영 금융위원회 부위원장이 2일 '기업밸류업 지원방안 2차 세미나'에 참석해 축사하고 있다. 사진 한국거래소금융위원회와 한국거래소가 2일 발표한 ‘기업가치 제고 계획 가이드라인’의 골자는 이른바 ‘밸류업 공시’다. 이는 기업들이 투자자가 관심 있을 법한 정보와 미래 계획을 중점적으로 모아 제시하는 일종의 ‘투자 종합 정보 보고서’다.다만, 밸류업 공시는 ‘선택과 자율’에 방점이 찍혔다. 공시를 할 지부터, 기업가치 개선 여부를 판단할 핵심지표, 목표설정 방법까지 모두 기업이 정하게 했다. 공시의 비재무지표 부문에는 ‘쪼개기상장(이중상장)’과 ‘터널링(대주주가 비상장 개인회사로 이익을 이전하는 수법)’ 등 기업의 예민한 지배구조 관련 사항도 들어있지만, 이 역시 기업이 선택해 공시하지 않아도 된다.정부는 강제로 기업들을 움직이는 것 보다 자율에 맡기는 게 장기적으론 효과적일 거란 판단이다. 박민우 금융위 자본시장국장은 “기업이 좋은 계획을 내놔 충실히 이행한다면 그만큼 투자 자금이 모일 것이고, 이런 선례가 나오면 참여 기업이 더 많아질 것”이라며 “차차 선순환 구조를 만드는 게 목표”라고 말했다.이날 발표에는 기업에 대한 벌칙(패널티)이나 세제 혜택과 같은 추가 인센티브는 없었다. 그러다 보니 시장에선 실효성이 떨어질 거란 우려도 만만치 않다.김민국VIP자산운용 대표는 “너무나 많은 공시 항목을 제시하면서 선택과 자율에 맡기다고 하니 ‘구색맞추기’가 될 가능성이 높다”며 “기관투자자도 어떤 지표를 어떻게 투자에 활용해야 할지 판단이 어려운데, 당국이 말하는 투자 선순환이 일어날 수 있을지 의문”이라고 말했다.2일 오후 서울 중구 하나은행 딜링룸 현황판에 코스피 종가가 표시돼있다.   이날 코스피 종가는 전장보다 8.41포인트(0.31%) 내린 2,683.65, 코스닥지수는 전 거래일보다 1.45포인트(0.17%) 내린 867.48에 거래를 마쳤다. 연합뉴스실제 이날 열린 ‘기업 밸류업 지원방안 2차 세미나’에서 이왕겸 미래에셋자산운용 책임투자전략센터장은 “기존 지속가능경영보고서만 해도 기업마다 비재무 이슈를 제각각 적고 있어 비교가 불가능하다”며 “밸류업 공시에서도 지표를 신중하게 선별해 공시할 필요가 있다”고 지적했다.증시도 일단 실망감을 드러내는 모습이다. 그동안 밸류업 수혜주로 지목됐던 보험·금융·증권 업종은 이날 일제히 주가가 하락했다. 보험에서는DB손해보험이 4.11% 하락했고 금융에선KB금융지주가 4.37%, 증권에서도 한화투자증권이 6.35% 밀렸다.김영일 대신증권 리서치 센터장은 “이날 가이드라인 발표는 세제 혜택 구체화 등을 기대했던 시장의 눈높이에는 미치지 못했다”며 “결국 배당소득 분리과세나 일본처럼 개인종합자산관리게좌(ISA) 활성화를 위한 혜택 등으로 개인 투자자들을 움직여야 시장도 호응할 것”이라고 말했다.반면 산업계는 환영하는 모습이다. 이날 세미나에 기업 측 대표로 참석한 박현수 고영테크놀러지 경영기획실장은 “‘PBR(주가순자산비율) 1배’와 같은 강제적인 기준을 주면 기업은 형식적으로만 맞출 수 밖에 없다”며 “중‧장기계획을 갖고 관념을 바꿔나가는 ‘선순환구조’ 방향에 동의한다”고 말했다. 익명을 요청한 다른 기업 관계자도 “기업마다 상황이 달라 1~2개 강제 조항만 주면 제대로 실천하기가 어렵다”면서 “가이드라인이 아주 자세하고 기업들이 선택할 수 있게 여러 안을 제시해줘서 긍정적으로 봤다”고 했다."
2023-12-18,"[건강한 가족] ‘100년 역사’ 참의사 양성 요람, 미래 의학 교육 산실로 재도약","의대 탐방 고려대 의과대학연구 역량 강화 융합형 인재 양성실용해부센터 등 수준 높은 시설의사과학자 양성 프로그램도 제공뿌리를 잘 내린 나무일수록 좋은 열매를 맺는다. 의사도 마찬가지다. 비옥한 교육 환경에서 양질의 자양분을 받아야 사회에 기여할 전인적 의사로 거듭날 수 있다. 이런 의미에서 고려대 의과대학은 의학 교육의 표본이자 참의사 양성의 요람으로 통한다. 일찌감치 전통과 혁신을 결합한 교육과정을 통해 국내를 대표하는 의학 교육기관으로 자리매김했다. 여기서 끝이 아니다. 고려대 의대는 2028년 개교 100주년을 앞두고 새로운 도약을 준비하고 있다. 최근 33대 고려대 의과대학장으로 취임한 편성범 재활의학과 교수가 변화의 선봉에 섰다. 편 학장은 “전 주기 의사과학자 양성 프로그램과 연구 인프라 확충을 통해 미래 의학을 이끄는 의과대학으로 재도약하겠다”고 강조했다.고려대 의대의 역사는 일제 강점기인 1928년으로 거슬러 올라간다. 당시 의료 혜택을 받지 못한 여성을 돌보기 위해 세워진 ‘조선여자의학강습소’는 오늘날 고려대 의대의 뿌리가 됐다. 이후 1938년 경성여자의학전문학교가 문을 열면서 여의사 양성의 꽃을 피웠다. 1971년 비로소 고려대 의과대학명을 굳혔으며, 산업화 시대에는 의료 소외지역이던 서울 구로와 경기도 안산에 대학병원을 세웠다. 생명 존중과 인류애를 바탕으로 의학 교육 본연의 길을 걸어온 발자취다. 이러한 민족·박애 정신은 고려대 의대 곳곳에 뿌리를 내렸다. 편성범 고려대 의과대학장은 “고려대 의대는 ‘사회적 약자를 위한 인술, 민족을 위한 의료’를 실천하며 의료 기술과 인성, 연구 역량을 두루 갖춘 전인적 의사 양성을 주도해 왔다”고 강조했다.5개 캠퍼스 체제 교육·연구 인프라 강화고려대 의대가 ‘의학 교육의 산실’로 꼽히는 데는 그만한 이유가 있다. 첫째는 유기적인 교육과정이다. 기초-심화-몰입의 단계적 교과과정으로 기초의학부터 임상의학, 첨단 미래 의학까지 모든 걸 아우른다. 고려대 의대는 융합 교육의 목적으로 심화 교육과정(EnrichmentStream)을 신설했다. 재학생들은 공학·경영학 등 관심 있는 학문 분야를 듣고 넓은 시각에서 진로를 탐색할 수 있다. 편 학장은 “6년제 교과과정을 도입하는 일도 준비하고 있다”며 “기초의학과 임상의학을 통합해 학제 다양화를 이루면서 의학 교육의 융통성과 연속성을 도모할 계획”이라고 설명했다.둘째는 수준 높은 교육 시설이다. 고려대 의대는 5개의 캠퍼스 체제를 구축했다. 안암병원·구로병원·안산병원이 각각 교육병원으로서 캠퍼스 구실을 한다. 이와 함께 청담 고영캠퍼스와 정릉 메디사이언스 파크도 교육·연구 기능을 수행한다. 2014년에 지상 7층 규모로 지어진 문숙의학관은 기초연구의 중심이 되는 곳이다. 예방의학·생화학·해부학·미생물학·생리학 등 기초의학 분야 교실과 연구실, 세미나실 등이 모여 있다. 아시아 최초로 가상해부대와 로봇시뮬레이터를 갖춘 실용해부센터도 개소했다. 이어 카데바(해부용 시신) 수술실, 현미경 수술실을 설치하는 등 교육·연구에 최적화된 인프라를 갖췄다. 각 캠퍼스에 학생들이 실제 병원과 동일한 환경에서 진료 실습을 할 수 있는 시뮬레이션센터도 마련돼 있다. 2018년엔 의대 개교 90주년을 기념해 ‘스마트 러닝 공간’을 담당할 의학도서관을 새롭게 단장했다. 편 학장은 “제1의학관도 증축·리모델링을 거쳐 창의적인 학습과 소통이 가능한 공간으로 재탄생했다”며 “대형 강의실과 통합실습실, 미디어 랩, 학생 자치활동 공간과 복지시설을 확충해 학업 환경을 개선했다”고 말했다. 특히 정릉 메디사이언스 파크는 미래 의사 양성과 다학제 연구를 수행하는 전초기지로 꼽힌다. 내년 완공 예정인 ‘정몽구 백신혁신센터’에선 백신 원천 기술 개발과 후보 물질 유효성 평가, 전임상 연구 등 감염병 백신 개발을 위한 연구가 적극적으로 이뤄질 예정이다.의학 교육·연구 지원 확대해 성과 주도셋째는 다채로운 지원 프로그램이다. 고려대 의대는 의대생부터 전임의까지 전 주기적 의사과학자 양성 프로그램을 제공한다. 특히 ‘선도 의사과학자 육성장학금’은 국내 최고의 지원율을 자랑한다. 고려대의료원에 재직 중인 전공의나 임상강사가 의사과학자 양성 과정 중 하나인 고려대 대학원에 진학하면 입학금 50%와 등록금 80%를 지원받을 수 있다. 학생들의 연구 역량 강화를 돕는 학생연구회 프로그램도 활발히 운영되고 있다. 학생연구회는 지도교수와 학생 연구팀이 1년간 연구 활동을 수행하는 식으로 이뤄진다. 학생들에게는 장학금과 연구비가 지원된다. 편 학장은 “2010년부터 시작된 학생연구회는 지난해까지 176명의 교수와 485명의 학생이 참여해 60편 이상의 논문을 국제학술지에 발표하며 큰 성과를 도출했다”고 말했다.마지막은 적극적인 국제 교류 시스템이다. 고려대 의대는 세계연구중심대학 연합체인 ‘Universitas21’(U21)의 국내 유일 회원대학이다. 이를 통해 국제적으로 표준화된 보건의료 교과과정을 도입했다. 연구 중심의 국제 교류 프로그램을 실시하면서 국내 의학 교육의 표준을 만들어가고 있다는 평가다. 2017년에는 세계 유수의 8개 의대와 함께 ‘GlobalAllianceofMedicalExcellence’(GAME)라는 국제 의학 교육 및 연구 협의체를 창립했다. 세계 의과대학 간 공동 연구와 학술 교류로 공동의 발전을 도모하기 위해서다. 매년 많은 해외 의대생이 임상 실습을 위해 고대 의대를 방문한다. 편 학장은 “고대 의대는 100년 역사의 숭고함과 의료 본질을 지켜 미래 의학 교육의 패러다임을 제시하고자 한다”고 강조했다.“의대 사명은 ‘좋은 의사’ 길러내는 것…명문 의과대학 대명사 만들겠다”인터뷰 편성범고려대 의과대학장고려대 의과대학은 2028년 개교 100주년을 앞두고 있다. 고려대 의대는 시대 변화에 따라 교육과정을 혁신하면서 국내 의학 교육의 ‘롤 모델’을 제시해 왔다. 최근 33대 고려대 의과대학장으로 취임한 편성범(사진) 학장은 의대 안팎으로 변화와 혁신을 위한 힘을 쏟고 있다. 학사 제도 개편과 정릉 메디사이언스 파크 조성 등 미래 의학 교육에 필요한 환경을 구축하는 일에 여념이 없다. 편 학장을 만나 고려대 의대의 미래상을 들었다.Q : 취임 소회를 전해 달라.A :“의대 100주년을 앞둔 상태에서 학장으로 임명됐다. 개인적으로는 영광이다. 유구한 역사를 통해 고려대 의대가 더 크게 인정받을 기회가 생겨서 감사하다. 의대의 사명은 ‘좋은 의사’를 길러내는 것이다. 교육과 연구, 사회 기여라는 세 가지 핵심 역할을 잘 해내고 싶다. 또한 자랑스러운 역사 정립을 통해 100주년을 아름답게 완성하고자 한다.”Q : 어떤 의사를 양성하려 하는가.A :“고려대 의대는 의술과 연구 역량뿐 아니라 인성을 갖춘 의사를 양성하기 위해 노력하고 있다. 특히 인성은 교육으로 가르치는 데 한계가 있다. 지적 역량과 함께 인성, 윤리성, 의사소통 능력을 갖춘 학생을 먼저 발굴하는 게 가장 효과적이다. 이에 따라 의대 선발 인재상을 새롭게 정립했다. ▶윤리의식과 책임감을 겸비한 인재 ▶창의적이고 유연한 사고를 갖춘 인재 ▶공선사후 정신을 갖춘 글로벌 리더로 성장할 인재가 우리 대학에서 추구하는 인재상이다. 이를 위해 2024학년도 수시 계열적합전형에 인·적성 심층 면접을 도입했다.”Q : 앞으로의 계획이 궁금하다.“의대 구성원에게 자부심을 부여하는 일이 급선무다. 단기적으로는 2028년까지 고려대 의대의 100년 역사를 정리해서 하나의 역사책으로 펴낼 계획이다.2년 후엔 교육과정을 혁신적으로 개편해 우리만의 차별성 있는 커리큘럼을 개발하고자 한다. 중·장기적으로는 의학 교육과 연구 인프라 고도화를 이끌어갈 생각이다. 지금도 연구력이 뛰어나지만, 외부 평가에서도 좋은 결과를 낼 수 있도록 노력할 방침이다. 궁극적으로는 전 세계에서 고려대 의대가 명문 의과대학이라는 대명사가 될 수 있게 인지도를 쌓아가겠다.”Q : 의대 진학을 희망하는 학생에게 조언해 달라.A :“좋아하는 일과 하고 싶은 일을 찾는 것이 중요하다. 의사가 되려고 하는 이유가 무엇인지 깊게 고민해 봐야 한다. 평생 환자를 치료하면서 공부할 마음의 준비가 돼 있는지 자신의 적성과 성향을 잘 파악해야 한다.”"
2023-01-18,"고려대 정진택 총장, 연세대 명예교육학박사 학위 수여","정진택 고려대학교 총장이 17일 연세대학교 연세‧삼성학술정보관 장기원국제회의실에서 명예교육학박사 학위를 받았다.연세대는 고려대 정진택 총장이 공학자로서 교육과 학문 발전에 탁월한 공헌을 하며 국가의 지속가능한 발전을 위한 교육의 새로운 패러다임을 구축한 공로를 인정해 명예교육학박사 학위를 수여했다. 정 총장은 2019년 3월 고려대 제20대 총장으로 취임한 후, ‘새로운 가치를 만들어가는 사람 중심의 고려대학교’의 기치 아래 디지털 대전환이라는 문명사적 과제를 능동적으로 수행하고 대학의 미래상을 구축하면서 우리 사회가 나아갈 방향을 제시하는 혁신의 여정을 이어왔다.미래 사회를 선도할 창의융합형 인재를 양성하기 위한 ▲참여형 스마트 캠퍼스 구축(데이터 기반 탄소중립체계 확립, 블록체인 기반 모바일 신분증 발급, 모바일 통합 앱 신설, 메타버스 캠퍼스 구축) ▲첨단 학과 신설(인공지능대학원, 데이터과학과, 스마트보안학부, 융합에너지공학과, 스마트도시학부, 미래모빌리티학부, 지능형반도체공학과) ▲교육조직 개편(교육혁신팀, 대학원혁신본부 신설) ▲산학협력 강화(반도체공학과, 배터리-스마트팩토리학과, 차세대통신학과, 스마트모빌리티학부, 융합반도체공학과) ▲교육혁신 프로그램 추진 등 다양한 노력을 기울여 교육혁신을 이끌었다.창의 인재 양성 및 연구를 위한 인프라 구축에도 심혈을 기울여 메디 사이언스 파크, 청담 고영캠퍼스, 과학도서관·대학원도서관 리노베이션, 정운오IT교양관 착공, 인문사회관 건축 기금 조성 등 탁월한 업적을 남겼다.사회적 책임과 시대적 소명을 다하기 위한 다양성위원회, 넥스트노멀위원회,ESG위원회, 사회공헌원, 백신혁신센터, 통일융합연구원, 고령사회연구원, 의료원 사회공헌사업본부 등의 기구를 신설하며 적극적인 사회 공헌을 실천해 왔다.아울러 한국공학한림원 부회장, 한국사립대학총장협의회장, 한국대학스포츠협의회장, 서울시 캠퍼스타운정책협의회장, 한국대학교육협의회 부회장, 과학기술정보통신부 제5차 과학기술기본계획수립위원회위원장, 대학규제개선협의회 위원장을 역임하며 다방면에서 사회와 국가의 발전에 기여하고 있다.대내외 요직에서 책무를 다함과 동시에 뛰어난 연구 업적도 일구고 있다. 2012년 지식경제부장관 산학협동 유공자상과 대한기계학회 우수논문상을 수상했으며, 2013년에는 한국유체기계학회 학술상을 수상했다. 그 밖에도 한국유체기계학회 회장과 부회장, 대한기계학회 열공학 부문 회장과 부회장, 한국연소학회 이사, 한국자동차공학회 이사와 영문저널 편집위원 등 학회 활동을 해오고 있다. 또한, 2021년 미국 미네소타대 ‘국제 리더십 어워드’를 수상했고, 2022년에는 일본 와세다대에서 명예이학박사 학위를 수여받았다.고려대 역사상 첫 공과대학 출신 총장인 정진택 총장은 공학자로서 교육과 학문 발전에 탁월한 공헌을 하며 전문지식의 현실 반영에 크게 기여했으며 고려대를 창의적 미래 인재를 양성하며 세계를 변화시키는 대학으로 큰 도약을 이루게 했다. 또한, 활발한 대외활동 업무를 수행하며 국가의 지속가능한 발전을 위한 교육의 새로운 패러다임을 구축했다.이날 학위수여식에서 연세대 서승환 총장은 환영사를 통해 “양교는 대한민국 사학 명문으로서 한 세기 동안 선의의 경쟁과 우정으로 스스로의 발전을 도모했으며, 우리 사회의 성장과 흐름을 같이했다”며 “고려대학교의 20대 총장으로 재임하면서 디지털 대전환의 과제를 성공적으로 수행했고 대학을 향한 사회적 책임을 다하며 창의적 인재 양성이라는 목표를 향해 고려대학교를 이끌어 오신 정진택 총장님의 명예 박사학위 수여를 함께 축하해 주시기 바란다”고 전했다.고려대 정진택 총장은 답사를 통해 “오늘 이 명예 박사학위는 개인적으로는, 공학 연구자이자 교육자 그리고 대학 행정가로서 노력을 경주해 온 지금까지의 제 삶에 대한 커다란 격려이기에 무엇보다 영예롭다” 라며 “고려대학교 책임자의 입장에서는 연세대학교와 고려대학교, 고려대학교와 연세대학교가 함께 쌓아온 오랜 우정과 협력의 또 하나의 결실이자, 앞으로도 영원히 교류하고 함께 발전할 것을 약속하는 상징이기에 더욱 소중하다.”고 감사의 뜻을 전했다.또한 정 총장은 “고려대학교와 연세대학교가 지금까지 선의의 경쟁을 통해 우정과 신뢰를 쌓아온 것처럼 앞으로도 관계의 힘을 더욱 키워간다면,한국은 물론 세계의 대학 교육을 변화시키고, 나아가 인류의 미래를 여는 소중한 가치를 만들어 낼 것이라고 확신한다”고 말했다.연세대 박승한 연구부총장 겸 대학원장은 추천사를 통해 ""탁월한 학자 및 교육자로서 새로운 대학의 미래상을 구축하고, 지속 가능한 국가 발전 및 창의적 인재 양성을 위한 대학 교육 혁신을 이끌어 오셨을 뿐만 아니라 사회공헌을 통한 대학의 사회적 책임과 소명 실천에서도 훌륭한 성과를 이뤄 오신 고려대 정진택 총장에게 명예교육학박사 학위수여를 추천한다""고 밝혔다."
2022-03-10,[부고] 윤기섭씨 外,"▶윤기섭씨 별세, 정훈영씨(기호일보 경기본사 본부장) 장모상=9일 마산의료원, 발인 11일, 055-249-1700▶최정선씨 별세, 이정린씨(전북도의회 문화건설안전위원장) 모친상=9일 남원의료원, 발인 11일, 063-620-1140▶최재일씨(전 한국관광공사 부장) 별세, 최영은(㈜고영 차장)·혜은·유진씨(㈜유진컴 대표) 부친상, 정상록(SKSUPEX추구협의회 부사장)·유상민씨(㈜애드라인 대표) 장인상=9일 삼성서울병원, 발인 11일, 3410-3151"
