date,title,content
2023-11-30,[인사] 대통령 직속 디지털플랫폼정부위원회 외,▲대통령 직속 디지털플랫폼정부위원회▷디지털플랫폼정부추진단 기획총괄과장 고광덕▲교육부▷강원대 안종호 ▷순천대 대외협력과장 김규환▷전북대 입학과장 조의정▷장관실 김병철▷인재정책실 서우성▲행정안전부◇과장급 전보▷기획인프라과장 신민필▷홍보담당관 박대민▷새마을금고혁신지원단장 이경수▷대통령기록관 행정기획과장 김지은▲산업통상자원부◇과장급 전보▷김제자유무역지역관리원장 배기환▲특허청▷기획조정관 김지수▷산업재산보호협력국장 정인식▷산업재산정보국장 이인수▷특허심사기획국장 신상곤▷특허심판원 심판장 문삼섭 박미영▷국제지식재산연수원장 임진홍▷기계금속심사국장 박재훈▲금융감독원◇국·실장 전보▷기획조정국장 김성욱▷인사연수국장 박지선▷정보화전략국장 위충기▷법무실 국장 정은정▷감독총괄국장 김형원▷금융시장안정국장 이 진▷제재심의국장 김욱배▷금융안전국장 백규정▷디지털혁신국장 곽범준▷IT검사국장 진태종▷보험감독국장 서영일▷은행검사1국장 김형순▷은행검사2국장 한 구▷중소금융감독국장 이종오▷중소금융검사2국장 이호진▷중소금융검사3국장 허진철▷기업공시국장 오상완▷조사1국장 이승우▷조사2국장 장창호▷회계감독국장 이 석▷금융소비자보호총괄국장 이길성▷상품심사판매분석국장 이준교▷금융민원국장 문형진▷분쟁조정1국장 원희정▷민생침해대응총괄국장 홍석린▷연금감독실장 정해석▷감사실 국장 고영집▷감찰실 국장 이영로▷부산울산지원장 서정보▷대구경북지원장 김철호▷인천지원장 구본경▷경남지원장 윤영준▷전북지원장 이 훈▷동경사무소장 이명규◇국·실장 직위 부여▷공보실 국장 이행정▷국제업무국장 겸 금융중심지지원센터 부센터장 박시문▷비서실장 노영후▷금융그룹감독실장 김국년▷가상자산감독국장 이현덕▷가상자산조사국장 문정호▷보험리스크관리국장 이태기▷보험검사1국장 홍영호▷보험검사2국장 김경수▷보험검사3국장 권재순▷은행검사3국장 김시일▷외환감독국장 임종건▷여신금융감독국장 김은순▷자산운용감독국장 임권순▷금융투자검사2국장 김재형▷금융투자검사3국장 최상두▷공시심사실장 조치형▷조사3국장 임형조▷공매도특별조사단 실장 김회영▷회계감리1국장 신규종▷회계감리2국장 류태열▷감사인감리실장 권영준▷분쟁조정2국장 박상규▷분쟁조정3국장 박현섭▷보험사기대응단 실장 정제용▷자금세탁방지실장 박상현▷금융교육국장 김필환▷광주전남지원장 황인협▷대전충남지원장 안승근▷제주지원장 박동원▷강원지원장 홍장희▷충북지원장 류길상▷강릉지원장 최길성▷런던사무소장 박정은◇국·실장 유임▷총무국장 최강석▷비상계획실장 백승필▷은행감독국장 정우현▷금융안정지원국장 김충진▷중소금융검사1국장 이현석▷자본시장감독국장 서재완▷금융투자검사1국장 김진석▷자본시장특별사법경찰 실장 권영발▷금융사기대응단 국장 임정환▷뉴욕사무소장 박용호▷북경사무소장 정관성▷프랑크푸르트사무소장 채문석▷하노이사무소장 박종춘▲중앙그룹◇부사장 승격▷SLL제작부문 대표이사 박준서◇상무 신규 선임▷중앙일보 모바일서비스본부장 김영훈▷중앙일보M& P 대표이사 최회준▷휘닉스호텔앤드리조트 영업마케팅본부장 장재영◇직책 보임▷중앙홀딩스 경영관리실장 겸 콘텐트리중앙 지주부문 대표이사 남중권▷중앙홀딩스 경영감사담당 김영일▷중앙홀딩스 미래전략실 사업개발담당 서성인▷스튜디오아예 사업본부장 이동희▷스튜디오아예 제작본부장 겸JTBC예능제작본부장 임정아▷SLL경영지원실장 김진규▷메가박스 경영지원실장 겸 미디어링크 대표이사 남주현▷플레이타임중앙 대표이사 이재원▷콘텐트리중앙 경영전략실장 박철한
2022-12-15,[인사] 기획재정부 외,▲기획재정부◇국장급▷국유재산심의관 윤석호▲과학기술정보통신부◇과장급 전보▷디지털신산업제도과장 조민영▷소프트웨어산업과장 장두원▲행정안전부◇과장급 전보▷재난구호과장 박남기▲보건복지부◇과장급▷국립장기조직혈액관리원 혈액안전감시과장 김준년▷코로나바이러스감염증-19 중앙사고수습본부 방역총괄반 방역총괄팀장 임혜성▷통합돌봄추진단장 지원근무 방석배▲금융감독원◇국실장 전보▷기획조정국장 박지선▷금융시장안정국장 정우현▷생명보험검사국장 윤영준▷은행검사1국장 박충현▷은행검사2국장 백규정▷은행검사3국장 김정렬▷외환감독국장 이진▷저축은행검사국장 이현석▷기업공시국장 안승근▷기획조사국장 고영집▷회계감리1국장 윤정숙▷금융소비자보호총괄국장 이영로▷금융상품심사분석국장 김범수▷금융교육국장 이상아▷분쟁조정1국장 구본경▷분쟁조정3국장 황승기▷감사실 국장 양진호▷대구경북지원장 윤덕진▷광주전남지원장 조철▷대전충남지원장 김명철▷인천지원장 박형준▷경남지원장 박중수▷강릉지원장 엄일용▷뉴욕사무소장 박용호▷런던사무소장 이훈◇국실장 승진▷총무국장 서영일▷공보실 국장 이태호▷국제업무국장 겸 금융중심지지원센터 부센터장 이준교▷정보화전략국장 진태종▷법무실 국장 김욱배▷디지털금융혁신국장 김부곤▷금융데이터실장 김충진▷자금세탁방지실장 이재석▷보험감독국장 문형진▷손해보험검사국장 원희정▷보험리스크제도실장 정해석▷상호금융국장 정미선▷여신금융검사국장 이호진▷금융투자검사국장 김진석▷자산운용검사국장 김형순▷펀드신속심사실장 민봉기▷공시심사실장 오상완▷특별조사국장 한재혁▷회계감리2국장 이목희▷감사인감리실장 김택주▷민생금융국장 이명규▷연금감독실장 김봉균▷포용금융실장 허진철▷금융사기전담대응단 실장 임정환▷부산울산지원장 양진태▷제주지원장 유진혁▷전북지원장 유현석▷강원지원장 한홍규▷충북지원장 석준원▷북경사무소장 정관성▷하노이사무소장 박종춘▲한국전력거래소◇승진▷전력시장본부장 김상일▷경영지원처장 송석돈▷계통혁신처장 최홍석▷기획처 전략기획팀장 유석▷기획처 성과혁신팀 부장 신용선▷시장혁신처 수소시장팀장 정선호▷시장운영처 시장고객총괄팀장 정창현▷정보기술처 계통시스템팀장 이봉길▷중앙전력관제센터 중앙관제부장 정태영◇전보▷경영지원처장 송석돈▷계통혁신처장 최홍석▷시장운영처장 황봉환▷전력신사업처장 안병진▷정보기술처장 김광호▷경인지사장 전경희▷KPX교육연구원장 박인석 ▷감사실장 김광철▷시장감시실장 빈철원▷기획처 전략기획팀장 유석 ▷경영지원처 인사노무팀장 조세철▷경영지원처 재무경영팀장 김염형 ▷안전관리실 안전총괄팀장 한지연▷전력정책처 전력기술팀장 이호승 ▷시장혁신처 수소시장팀장 정선호▷시장운영처 시장고객총괄팀장 정창현▷스마트그리드실 기술사업팀장 전재룡▷정보기술처 계통시스템팀장 이봉길▷중앙전력관제센터 수급운영팀장 신기준▷중앙전력관제센터 송전운영팀장 류헌수▷중앙전력관제센터 수요예측팀장 허성일 ▷중앙전력관제센터 중앙관제부장 김진학▷중앙전력관제센터 중앙관제부장 최석민▷기획처 전략기획팀 전략부장 이자겸▷경영지원처 인사노무팀 인사급여부장 문준상▲전북도▷교육소통협력국장 나해수▲매일신문▷뉴스국장 김수용▷논설위원 김교영▷광고국장 김종헌▷문화사업단장 오영호▷뉴스국 부국장 모현철 ▷서울취재본부장 이호준▷대구권 본부장 정욱진
2022-08-26,[인사] 국무조정실·국무총리비서실 외,▲국무조정실·국무총리비서실◇과장급 신규 선임▷국제개발협력본부 대외협력과장 신희선▲행정안전부◇국장급▷지방세정책관 진명기▷재난복구정책관 박천수▲산업통상자원부◇국장급 전보▷수소경제정책관 김선기▲보건복지부◇과장급 승진▷글로벌백신허브화추진단 한미파트너십지원팀장 신은경▲고용노동부◇국장급 전보▷대변인 최현석▷노동시장정책관 정경훈▷고용지원정책관 임영미▷직업능력정책국장 권태성▷근로기준정책관 박종필▷근로감독정책단장 양정열◇과장급 전보▷의정부지청장 김연식▲해양수산부◇국장급 전보▷국립수산과학원 서해수산연구소장 이승환◇과장급 전보▷해양영토과장 임채호▲금융감독원◇국실장 전보▷기획조정국장 안승근▷감독총괄국장 이창운▷감독조정국장 정우현▷제재심의국장 서재완▷보험감독국장 박지선▷생명보험검사국장 박동원▷은행감독국장 김준환▷특수은행검사국장 박충현▷저축은행감독국장 이길성▷저축은행검사국장 최길성▷자본시장감독국장 황선오▷기업공시국장 박용호▷조사기획국장 고영집▷자본시장조사국장 이승우▷금융소비자보호총괄국장 최광식▷금융민원총괄국장 서정보▷분쟁조정1국장 홍장희▷보험사기대응단 실장 조정석▷감사실 국장 김학문▷감찰실 국장 이주현▷전북지원장 김충우 ◇국실장 직위 부여▷인적자원개발실 국장 김성욱▷글로벌시장국장 겸 금융중심지지원센터 부센터장 백규정▷법무실 국장 황승기▷비서실장 한구▷금융데이터실장 곽범준▷금융그룹감독실장 김형원▷손해보험검사국장 박상규▷신용감독국장 홍석린▷여신금융감독국장 이종오▷상호금융국장 박현섭▷여신금융검사국장 이진▷자본시장특별사법경찰 실장 권영발▷자산운용감독국장 최강석▷전문사모운용사전담검사단장 김진석▷공시심사실장 장창호▷특별조사국장 김정렬▷회계조사국장 윤정숙▷연금감독실장 권성훈▷신속민원처리센터 국장 홍영호▲배재대◇2급 승진▷사무처장 겸 생활관장 김욱환◇4급 승진▷학술정보지원팀 채희석◇5급 승진▷재무회계팀 박은석◇부처장급 ▷사무처 부처장 겸 시설안전관리센터장 전인호▷대학일자리플러스본부 취창업지원센터장 최홍규◇팀장급▷대학혁신지원사업팀장 겸 성과관리센터 전략평가팀장 김정택▷AI·SW사업팀장 겸 지역지능화혁신인재양성사업단 사업팀장 배희재▷생활관 운영팀장 조혜숙▷국제학생교류팀장 채경천▷학생성장지원팀장 겸 학생복지팀장 류수영▷교수학습지원센터 교육지원팀장 겸 신기술공유대학사업단 사업팀장 정창덕▲뉴시스◇승진▷편집심의담당 부국장 박상권▷산업2부장 장시복◇발령▷편집부장 겸 심의위원 최남호▷정치부장 겸 심의위원 남상훈▷산업부장 원종태▲KBS▷공영방송50주년사업추진단장 임기순▷전략기획실 대외협력국 2023ABU서울총회추진단장 김완수▷제작1본부 협력제작국CP연종우
2022-03-09,[부음] 송한경 별세 외,"▲송한경별세,구윤철국무조정실장 모친상=8일15시30분 창원파티마병원, 발인 10일8시30분, (055)270-1900▲안남숙별세,유춘남·유춘화한국예탁결제원 혁신금융부 수석위원 모친상=8일8시 서울 청구성심병원, 발인 10일7시, (02)352-4445▲임영환별세,임단하·임원식국회의원 보좌관 부친상=8일8시 남양주한양병원, 발인 10일6시, (031)529-4440▲조연재별세,윤양수충청투데이 청양주재 부장 모친상=7일17시 충남 청양농협장례식장, 발인 11일10시, (041)942-4600▲최재일前 한국관광공사 부장 별세,김엄자남편상,최영은고영 근무·최혜은·최유진유진컴 대표 부친상,정상록SKSUPEX추구협의회 부사장·유상민애드라인 대표 장인상=8일13시15분 삼성서울병원, 발인 11일7시, (02)3410-3151"
2024-04-07,31.3% 역대 최고 사전투표율…'호고영저' 여야 어디에 유리?,"5~6일 진행된 22대 국회의원 선거의 사전투표율이 역대 총선 최고치인 31.3%를 기록했다. 4년전 21대 총선(26.7%)을 4.6%포인트 웃돌아 이 의미를 두고 정치권 셈법도 분주해지고 있다. 정권 심판의 열망이 반영된 결과라는 야권 기대와, 위기감을 느낀 보수 유권자의 결집이라는 여권 희망이 혼재돼 있다.이재명(왼쪽 사진) 더불어민주당 대표가 6일 경기 이천 중앙로문화의거리에서 엄태준 경기이천 후보 지지유세를 하고 있다. 오른쪽 사진은 국민의힘 한동훈 비상대책위원장이 7일 충남 공주시 공주대학교 후문 앞에서 정진석 후보 지지를 호소하는 모습. 중앙포토특히 호남 유권자의 적극적 투표와 영남 유권자의 소극적 투표에 따른 ‘호고영저’ 현상이 눈길을 끈다. 전국 17개 시도 중 전남(41.2%)의 사전투표율이 가장 높았고 이어 전북(38.5%)·광주(38.0%)이 2,3위였다. 반면 대구(25.6%)는 투표율이 가장 낮았고, 경북(30.8%)·경남(30.7%)도 평균 투표율을 밑돌았다.민주당 관계자는 “정권에 비판적인 호남은 물론 야권 지지세가 강한 세종(36.8%)의 사전투표율이 네 번째로 높다는 것은 심판론의 열기가 번졌다는 의미”라고 주장했다. 하지만 국민의힘 관계자는 “호고영저는 윤석열 대통령이 승리한 2년 전 대선 사전투표에서도 나타난 일반적 투표 경향”이라고 했다. 당시 대선 사전투표율 상위 3개 지역은 전남(51.5%), 전북(48.6%), 광주(48.3%)였고, 대구(33.9%)는 뒤에서 두 번째로 이번 총선과 엇비슷했다.신재민 기자사전투표소에 어떤 지지층이 더 많이 왔는지를 두고도 여야는 다른 분석을 내놓고 있다. 야권은 지역구 여론조사 등에서 나타난 민주당의 우세와 비례 정당인 조국혁신당의 돌풍을 근거로 야권 지지층의 결집에 무게를 둔다. 서울 지역에 출마한 민주당 후보는 “이재명 대표 체제의 민주당에 표를 줄 생각이 없던 진보 유권자도 조국혁신당에 표를 주려고 사전투표소를 찾았다”며 “현장에서 이런 분위기를 피부로 느낄 수 있다”고 주장했다. 박상병 정치평론가는 “윤 대통령의 국정 지지율이 30%대로 낮기 때문에 이른바 ‘샤이 보수’의 결집을 기대하기가 힘든 상황”이라고 분석했다.하지만 여권에서는 '야권 200석'에 대한 위기감이 보수 유권자의 결집을 이끌었다는 분석을 내놓고 있다. 국민의힘 재선 의원은 통화에서 “선거관리위원회의 부실 관리와 부정선거 의혹 등으로 사전투표에 반감이 컸던 보수 유권자가 달라졌다”며 “이번 사전투표소에는 고령층 유권자도 상당수 보였다”고 설명했다.상대적으로 사전투표를 많이 하던 20·30대 유권자의 성향이 과거에 비해 보수화되었다는 점도 변수다. 엄경영 시대정신연구소장은 “민주당에 반감이 큰 청년층이 얼마나 사전투표소를 찾았는지도 관건”이라고 말했다.제22대 총선 사전투표 첫날인 5일 소중한 한표를 행사하려는 유권자들이 부산 연제구청 2층 대강당에 마련된 사전투표소 앞에 줄서서 차례를 기다리고 있다. 송봉근 기자최종 투표율이 2020년 총선 투표율(66.2%)을 넘을지도 관심 사항이다. 전문가들은 총선 투표율이 65%를 넘기면 야권, 55%에 못 미치면 여권이 유리하다고 본다. 2020년 총선에서 민주당은 180석을 획득해 103석인 미래통합당(현 국민의힘)과 77석 차이였다. 반면 투표율이 54.2%였던 2012년 총선에서는 새누리당(현 국민의힘)이 152석으로 민주통합당(127석)을 앞섰다.과거 총선에선 사전투표율이 전체 투표율을 견인했다. 2016년 총선의 사전투표율은 12.2%였고, 전체 투표율은 58.0%였다. 2020년 총선에서는 사전투표율이 26.7%로 오르고, 전체 투표율도 66.2%로 올랐다. 이를 근거로 민주당 관계자는 “야권 제3지대 열풍에 심판론 열기까지 고려하면 지난 총선보다 총투표율이 올라갈 것”이라고 예측했다.하지만 사전투표율이 전체 투표율을 견인하는 공식은 2022년 대선에서는 적용되지 않았다. 당시 대선 사전투표율(36.9%)은 역대 최고였고, 2017년 대선(26.1%)보다 10.9%포인트나 높았다. 하지만 최종 투표율은 2022년 대선(77.1%)이 2017년 대선(77.2%)보다 오히려 0.1%포인트 가량 낮았다. 민주연구원 부원장을 지낸 최병천 신성장경제연구소장은 “사전투표율이 오른 것은 유권자가 3일간 나눠 투표하는 ‘분산 투표’에 익숙해진 결과”라며 “이번 최종 투표율이 66%를 넘기기는 쉽지 않을 것”이라고 관측했다."
2024-04-22,[새로운 시작 인천·경기] 대한민국 미래 먹거리 마련 … 세계 최고 반도체 중심도시 건설에 박차,"경기 용인특례시도로망 구축, 전문인력양성 등 계획SK하이닉스·삼성전자 팹 부지조성20여 년 걸쳐 300만 개 일자리 창출이상일 용인특례시장(왼쪽 둘째)이 반도체클러스터 산업단지에 전력을 공급하기 위한 수직구 터널 공사 현장을 둘러보고 있다. [사진 용인시]이상일 용인시장이 제3차 범정부 추진지원단 회의에서 교통 인프라 확충 등을 건의하고 있다.용인특례시는 ‘함께 만드는 미래 용인 르네상스’를 시정 비전으로 내걸고 세계 최고 반도체 중심도시 건설에 박차를 가하고 있다. 처인구 이동·남사읍 첨단 시스템반도체 국가산업단지와 원삼면 용인반도체클러스터 일반산업단지 등의 대형 프로젝트를 진행하면서다.해당 시설은 향후 20여 년에 걸쳐 300만 개 이상 일자리를 창출할 경기 남부 반도체 메가 클러스터의 중심이 될 전망이며, 용인시는 주변에 도로망과 철도망을 구축하고 반도체 마이스터고등학교를 비롯한 전문 인력 양성 시스템까지 갖춘다는 계획이다. 이상일 용인특례시장은 “중세도시 피렌체가 문예 부흥 운동으로 불리는 르네상스로 이탈리아를 강성하게 만든 것처럼 반도체 산업 경쟁력을 강화해 대한민국의 미래 먹거리를 마련하려는 것”이라고 전했다.첨단 시스템반도체 국가산업단지와 용인반도체클러스터는 정부가 지난해 3월 조성하겠다고 밝힌 ‘세계 최대 반도체 메가 클러스터’의 두 축이다. 윤석열 대통령이 지난 1월 경기 남부를 관통하는 세계 최대 반도체 메가 클러스터 조성에 622조원 투자가 예상된다고 밝힌 가운데 502조원이 용인에, 그중에서도 두 산업단지에 482조원이 투자된다.이동·남사읍 첨단 시스템반도체 국가산업단지 규모는 747만㎡로 올해 초 초단기 완공으로 화제가 된 대만TSMC의 일본 구마모토 1공장 부지(21만㎡)의 35.6배에 달한다. 원삼면 용인반도체클러스터는 415.6만㎡로 구마모토 1공장의 19.8배다.SK하이닉스의 팹(Fab) 4기가 들어설 용인반도체클러스터에선 내년 3월 1기 팹(Fab) 착공에 대비해 지금 한창 부지조성 공사를 진행 중이다. 이곳에 1차로 신축될 건축물은 연면적 367만㎡로 인천공항 1·2터미널을 합한 면적의 2배가 넘는다. 1기 팹만도 160만㎡나 되며, 79만㎡ 규모 생산지원시설(9동), 71만㎡ 규모 사무실(2동), 37만㎡의 상생협력센터, 20만㎡의 기숙사 등이 함께 건설된다.삼성전자가 6기의 팹을 건설할 첨단 시스템반도체 국가산단도 속도를 내고 있다. 한국토지주택공사(LH)가 사업 시행을 맡아 지난 17일 국토교통부에 산업단지계획 승인을 신청했다. 산단 계획이 승인되면 곧바로 토지 보상과 조성이 이뤄진다. 이와 관련해 윤석열 대통령은 지난 9일 반도체 현안 점검 회의에서 2026년 부지조성 공사를 시작할 수 있도록 환경영향평가, 보상 등의 절차도 2배 이상 속도를 내 시간을 단축하라고 강조한 바 있다.반도체 메가 클러스터는 두 산업단지를 중심으로 인근의 기존 메모리 팹과 소·부·장, 설계, 패키징 등 반도체 기업 및 관련 연구기관 등이 어우러져 시너지를 내도록 조성된다. 용인반도체클러스터협력화단지에 50개, 첨단 시스템반도체 국가산업단지에 150개 등 200여 소·부·장, 설계기업이 입주해 협업하게 된다. 용인반도체클러스터에는 이미 분양 대상 37필지 가운데 31필지에 주성엔지니어링, 원익IPS,솔브레인 등 29사가 입주하겠다며 시와 협약을 마친 상태다.용인이 세계 최대·최고 반도체 메가 클러스터의 중심으로 자리매김하면서 두 산업단지 인근에도 반도체 기업들이 속속 모여들고 있다. 기흥 미래첨단산업단지에는 국내 대표적 반도체 장비업체인 ㈜세메스가 자리 잡았고, 세계적 반도체 장비회사인 램리서치는 오는 7월 한국 본사를 R&D센터가 있는 기흥구 지곡동으로 옮길 예정이다. 세계 4대 반도체 장비업체로 꼽히는 도쿄일렉트론의 한국 법인 도쿄일렉트론코리아는 처인구 원삼면 원삼일반산단에 R&D센터를 건립할 예정이다. 반도체 검사장비 업체 ㈜고영테크놀로지는 올 하반기 서울 본사와 지주회사를 수지구 상현동 고영테크놀로지R&D센터로 통합·이전하며, 반도체 핵심 소재인EUV블랭크 마스크와 펠리클 업체인 에스앤에스텍은 첨단 시스템반도체 국가산단 인근 용인테크노밸리 일반산단에 오는 7월 신규 공장을 준공할 예정이다."
