date,title,content
2022-02-14,"[건강한 가족] “병원 전체가 참여하는 전주기적 초협진으로, 말기·재발 암 극복 나서”","인터뷰곽정면 고려대안암병원 대장항문외과 교수곽정면 교수는 “대장암의 진단·치료·관리에 병원 구성원 전체가 참여하는 초협진을 통해 암 환자의 치료 성적을 극대화할 수 있다”고 말했다. 김동하 객원기자대장암은 유전적·환경적 요인이 복합적으로 얽혀 발병한다. 위험도를 고려해 검진 간격을 조절하고 수술·항암제·방사선 등 최적의 치료법을 결정하는 것은 환자 생명과 삶의 질을 담보하는 핵심 요소다. 고려대 안암병원 대장암협진팀이 ‘초(超)협진’ 진료를 시작하게 된 배경이다. 암의 진단과 치료, 관리 등 전주기에 병원 전체가 적극적으로 참여해 환자의 치료 성적을 끌어올린다. 곽정면(49) 대장항문외과 교수(과장)는 “대장암에서 치료가 불가능한 ‘말기’의 개념은 사라지게 될 것”이라고 말했다.Q : 대장암 발병률이 증가하고 있다.“대장암 발병에는 유전적 요인과 식습관, 불규칙한 생활 패턴 등이 복합적으로 영향을 미친다. 우리나라의 경우 소고기·돼지고기나 햄·소시지 같은 가공육 섭취량의 증가가 환자 증가를 견인하고 있다. 전체 대장암의 10%는 ‘MLH1’이나 ‘APC’등 특정 유전자 변이로 인한 유전성 대장암으로, 동일 환경에서도 암이 발병할 위험이 상대적으로 크다. 가족력이 있거나 다발성 용종이 발견된 경우라면 젊은 나이라도 유전자 검사를 받고 정기 검진, 운동·식단 관리를 시작하는 게 바람직하다.”Q : 치료법도 발전하고 있다.“대장암의 치료는 진단 시 병기에 좌우된다. 크기가 작고 주변 조직에 퍼지지 않은 상태(0~2기)라면 수술이 우선이다. 우리 병원의 경우 복강경·로봇을 활용해 절개 없이 암을 제거하는 최소침습 수술을 주로 적용한다. 특히 직장암은 골반 안쪽에 위치해 수술 시 시야·공간 확보가 어려운데, 얇고 섬세한 로봇팔을 이용하면 직장을 최대한 보존할 수 있어 환자의 삶의 질 향상에도 도움된다. 병원에서 직장암 수술 후 인공항문을 만드는 비율은 5% 미만에 불과하다. 대장 주변의 림프샘으로 암이 전이된 3기 역시 수술과 표적·면역 항암제, 방사선 치료를 통해 80% 이상 완치가 가능하다. 문제는 암을 뒤늦게 발견하거나 재발한 경우다.4기는 멀리 떨어진 다른 장기로 암이 퍼진 상태라 수술로 모두 없애기도, 항암제나 방사선 치료만으로 완치하기도 어렵다. 수술 후 재발한 대장암도 대부분 4기로 치료 난도가 높다.”대장암 4기 또는 재발 환자는 전체의 20%에 달할 만큼 환자가 적지 않다. 병기나 환자 건강 상태에 맞춰 치료법을 결정하지만 외과 의사는 수술을, 종양내과는 항암 치료를 권하는 등 의견이 엇갈리는 경우가 많아 환자·보호자는 혼란에 빠진다. 이런 문제를 해결하는 것이 다학제 협진이다. 대장항문외과·소화기내과·종양내과·방사선종양학과 등 관련 진료과가 한데 모여 최상의 치료 방침을 결정하는 진료 시스템이다.Q : 최근 다학제 협진을 발전시킨 ‘초협진’ 개념을 국내 최초로 제시했다.“다학제 협진은 수술, 항암제, 방사선 치료 가운데 암을 가장 확실하고 효과적으로 치료할 수 있는 ‘무기’를 찾는 과정이다. 예컨대 종전에 치료를 포기했던 환자도 항암·방사선 치료로 암의 크기와 공격력을 줄인 다음 각 분야의 외과 전문의가 수술하면 완치까지 기대할 수 있다. 초협진은 종전에 진단·치료에 국한한 다학제 협진을 예방·관리의 전 과정까지 확대한 것이다. 의료진과 병원 구성원 모두가 참여하는 진정한 환자 중심 진료 시스템이라고 할 수 있다. 풍부한 다학제 협진 경험과 디지털 헬스케어 인프라를 토대로 기존의 다학제 협진의 한계를 뛰어넘자는 의미를 담았다.”Q : 초협진의 특징이 궁금하다.“첫째, 시간·공간을 뛰어넘는 다학제 협진을 진행할 예정이다. 고려대의료원은 클라우드 기반의 정밀의료 병원정보시스템(P-HIS)을 통해 안암·구로·안산 병원과 청담고영캠퍼스가 연결돼 있다. 암 환자의 진단 정보를 언제, 어디서나 실시간으로 파악하고 의견을 나눌 수 있다. 초진 환자도 진료를 받는 즉시 다학제 협진이 가능하다. 별도로 시간을 내 모이지 않는 만큼 의료진의 참여도를 높일 수 있고, 병원 방문에 따른 환자의 불편함은 줄일 수 있을 것이다. 둘째, 암 환자의 전주기적 관리를 시작한다. 유전자 검사 대상부터 의료진이 소통해 결정하고 경제적인 어려움을 겪을 땐 사회사업팀, 치료 후 관리는 집중영양치료팀이 협진에 참여하는 등 병원 구성원 모두가 환자 치료에 나선다. 올해 대장암을 시작으로 희소 암까지 적용 대상을 넓혀 보다 많은 환자가 초협진의 혜택을 받을 수 있게 시스템을 구축할 예정이다.”Q : 향후 계획은 무엇인가.“현재 초협진의 성공적인 정착을 위해 각 분야의 전문가들이 모여 아이디어를 내고, 이를 구현할 수 있는 기술을 개발·발굴하는 데 힘쓰고 있다. 특히 고령의 대장암 환자의 치료 참여율을 높이기 위해 스마트폰 앱처럼 어려운 기술을 대체할 다른 플랫폼이 없을지 적극적으로 탐색하고 있다. 이런 경험이 고려대의료원이 추구하는 ‘스마트 병원’을 구현하는 데도 도움이 될 것이라고 생각한다.”"
2024-10-27,"현실 퀴어 드라마 ‘대도시의 사랑법’…BL과 다른 반응, 왜?","드라마 ‘대도시의 사랑법’ 포스터. 티빙 제공대도시 서울에 사는 퀴어 소설가는 어떤 모습으로 사랑할까? 어딘가 특별할 것 같지만 드라마 ‘대도시의 사랑법’ 속 ‘고영’(남윤수)의 연애는 그렇지 않다. 운명이라 믿고 상대에게 빠져들었지만 이내 사소한 이유로 투닥거린다. 자신에게 매달리는 남자를 서툴게 밀어내기도, 상대에게 호되게 덴 뒤 방황하기도 한다. 여느 이성애자와 다를 바 없이 고영은 알콩달콩하고 찌질하고 애틋한 연애를 거치며 성숙해진다.소설집 ‘대도시의 사랑법’이 영화에 이어 드라마로 재탄생했다. 지난 21일 공개된 티빙 드라마 ‘대도시의 사랑법’은 작가 지망생 고영이 여러 남자를 만나며 삶과 사랑을 배워가는 이야기를 8부작으로 담았다. ‘재희’,‘우럭 한점 우주의 맛’,‘대도시의 사랑법’,‘늦은 우기의 바캉스’ 등 소설 4편을 드라마화했다. 원작자 박상영 작가가 각본을 맡았고 ‘8월의 크리스마스’의 허진호 감독, ‘키친’의 홍지영 감독, ‘아기와 나’의 손태겸 감독, ‘같은 속옷을 입는 두 여자’의 김세인 감독 등 한국영화아카데미 출신 영화감독들이 연출로 참여했다.퀴어 판타지 아닌 있는 그대로의 모습1~2화 ‘미애’는 ‘재희’를 드라마화한 것으로, 고영의 절친이자 동거인 미애(이수경)와의 우정을 이야기한다. 3~4화 ‘우럭 한점 우주의 맛’은 암 투병 중인 엄마에 대한 복합적인 감정과 알 수 없는 남자 영수(나현우)와의 연애를, 5~6화 ‘대도시의 사랑법’은 바텐더 규호(진호은)와의 단란한 연애와 이별 이야기다. 7~8화 ‘늦은 우기의 바캉스’에선 고영이 전 연인을 추억하며 상실감을 느낀다.앞서 개봉한 영화가 ‘게이 남사친’과 자유분방한 ‘여사친’의 우정에 초점을 맞췄다면, 드라마는 좀 더 본격적으로 성소수자의 사랑을 이야기한다. “판타지화하고 대상화한 퀴어의 모습이 아니라 현실에 가까운 그대로의 모습”이라는 박상영 작가의 설명처럼, 고영의 사랑은 마냥 낭만적이기보다는 현실적이다. 5~6화 ‘대도시의 사랑법’에서 고영과 규호가 약속 시간에 늦거나 음식 취향이 맞지 않아 사소하게 다투는 모습, 권태기를 극복하고자 노력하는 모습 등은 누구나 연애를 하며 겪어봤을 법한 순간들이다. 3~4화 ‘우럭 한점 우주의 맛’에서 연인이 못났다는 것을 알면서도 놓지 못하는 모습도 마찬가지다. 허진호 감독은 “남녀가 사랑하는 것과 남남 혹은 여여의 사랑이 비슷하다고 생각하며 만들었다”고 말했다.드라마 ‘대도시의 사랑법’의 한 장면. 메리크리스마스 제공동시에 성소수자로서 겪는 혐오와 아픔도 곳곳에서 드러난다. 3~4화 ‘우럭 한점 우주의 맛’에서는 고영이 동성 친구와 입을 맞추는 것을 본 엄마가 고영을 정신병원에 입원시키는 일화가 나온다.고영을 연기한 남윤수의 도전 역시 주목할 만하다. 넷플릭스 드라마 ‘인간수업’에서 일진 고등학생 연기로 눈도장을 찍은 남윤수는 발랄한 성격을 가졌으면서도 만남과 이별을 반복하며 쓸쓸함을 느끼는 고영의 모습을 담담하게 표현해냈다.동성애 혐오 민원에 몸살…‘비엘’과 다른 반응, 왜?드라마 ‘대도시의 사랑법’은 공개 전 동성애 혐오 민원에 몸살을 앓기도 했다. 동성 연인끼리 대화를 하거나 입을 맞추는 장면 등이 포함된 예고편이 유튜브와 포털 사이트에 지난 7일 공개됐다가 항의를 받아 12일 비공개 처리된 것이다. 동성애를 혐오하는 이들이 “동성애를 미화하고 조장한다”며 문화체육관광부와 티빙 등에 항의 전화를 한 결과다. 박상영 작가는 예고편이 내려가자 사회관계망서비스(SNS)에 글을 올려 “모 단체에 좌표 찍히고 관련 부서 민원 폭탄 들어간 덕분에 공식 예고편을 모두 내리게 됐다”며 “부아가 치밀어 밤새 한숨도 못 잤다. 혐오의 민낯은 겪어도 겪어도 도무지 익숙해지지가 않는다”고 토로하기도 했다.똑같이 동성애를 다루더라도 고정팬이 많은 ‘비엘’(BL·boylove) 장르에 비해 퀴어 서사가 이런 혐오 민원에 쉽게 노출된다. 비엘은 남성 간의 사랑을 현실과 동떨어진 판타지에 가깝게 연출한 반면 퀴어물은 성소수자의 삶과 정체성을 정면으로 응시하기 때문이다. ‘메이드 인 루프탑’ 등 퀴어 영화와 비엘 드라마 ‘신입사원’을 연출한 바 있는 김조광수 감독은 한겨레와의 통화에서 “비엘은 현실을 다루는 것처럼 보이지만 러브 판타지에 가까워서 좀 더 편하게 소구할 수 있다”며 “반면 퀴어는 다분히 현실을 담는다. 나아가 현실을 바꿔보려는 노력들을 장르 안에서 하다 보니 거부감을 보이는 것 같다. 또 드라마는 영화에 비해 조금 더 폭넓게 대중을 만날 수 있는 장르이기 때문에 더욱 반발이 나오는 것으로 보인다”고 짚었다."
2024-11-04,이런 게이는 없었다…‘대도시의 사랑법’ 남윤수의 ‘연애법’,"티빙 드라마서 주인공 고영 역배우 남윤수. 메리크리스마스·빅스톤스튜디오 제공티빙 드라마 ‘대도시의 사랑법’은 성소수자 작가 고영이 경험하는 네차례 연애 이야기를 다룬다. 배우 남윤수는 여러 남자와 연애하며 상처받고 성숙해지는 고영을 표현했다. 대중 매체에선 게이를 간드러진 콧소리의 새침한 캐릭터로 단순화할 때가 많지만, 남윤수의 연기는 틀에 갇혀 있지 않다. 친구와 함께일 때는 발랄하고, 회사에서는 무미건조하며, 연인과는 다정하다. 일상을 살아가는 여느 누구와 다르지 않다.지난 1일 서울 종로구 삼청동의 한 카페에서 만난 남윤수는 “(원작 소설과 드라마 각본을 집필한) 박상영 작가님을 만났을 때 제가 이 캐릭터를 어떻게 표현하면 좋을지 물었더니 ‘윤수씨 모습처럼만 보여주면 된다’는 답이 다였다”며 “그 얘기를 듣고 ‘하고 싶은 대로 하면 되겠다’고 생각했다. 실제로 이입하고 내 감정으로 연기했다”고 말했다.그가 집중한 것은 성소수자보다 사랑 자체의 감정이다. 남윤수는 “청춘 하면 불꽃처럼 팡 터졌다가 사라지는 게 떠오르는데, 그런 사랑의 감정을 계속 보여주려고 했다”고 말했다. 그는 이어 “(성소수자 배역에 대한) 부담은 전혀 없었다”며 “연기일 뿐이고 내가 하고 싶은 것을 하는 것이다. 오히려 이런 좋은 작품을 저한테 준다는 게 믿기지 않았다”고 강조했다.드라마 ‘대도시의 사랑법’ 한 장면. 메리크리스마스 제공남윤수는 작품 준비를 위해 서울 이태원 게이 클럽을 여러 차례 방문했다. 그는 “촬영 전 게이 클럽이나 인근 골목을 여러번 갔다. 거기서 팬이라는 사람도 만나고 아는 친구도 만났다. 실제로 게이 친구들도 만나고 그랬다”고 전했다. 이런 노력이 효과가 있었는지 박상영 작가로부터 ‘명예 게이’라는 수식어도 얻었다. 그는 “다행히 많은 분들이 그렇게 생각해주셔서 감사하다”며 “사실 ‘성소수자들이 안 좋게 생각하면 어쩌나’ 하는 마음도 있었다. 최대한 과하지 않게 보여주려고 했다”고 말했다.‘대도시의 사랑법’은 공개 전 동성애 혐오 민원에 몸살을 앓기도 했다. 동성 연인끼리 대화하거나 입 맞추는 장면 등이 포함된 예고편이 지난달 7일 공개됐다가 일부 사람들의 항의를 받고 12일 비공개 처리된 것이다. 반대로 응원 메시지 또한 쏟아졌다. 남윤수는 “최근 2∼3주 동안 1분에 3∼4개씩 (응원) 메시지가 왔다”며 “‘우리 일상을 보여줘서 고맙다’ ‘눈물 난다’ 같은 반응들이 기억에 남는다. 특히 브라질에서 메시지가 많이 와서 신기했다”고 말했다. 또 “의외로 여성분들에게서 메시지가 많이 왔다. 퀴어라는 점보다는 누군가의 10년 연애 기록을 보고 느낀 울림을 전하신 것 같다”고 덧붙였다.드라마에서 고영을 거쳐간 4명의 연인 중 가장 기억에 남는 이는 누구일까? 남윤수는 “(세번째로 나오는) 규호”라고 답하고는 “남규 등 여러 사랑을 경험한 뒤 성장해서 만난 사람이 규호니까, 사랑이 더 애틋하지 않겠나”라고 이유를 설명했다."
2024-09-09,LG 등 대기업으로의 취업문 ‘활짝’…탁월한 취업률 강점,"연재 ㅣ ○○ 전문가, 이 대학 이 전공!연암공과대 스마트소프트웨어학과(SAP전공)LGCNS와 산학협력으로 설립된SAP전공은 재학 기간 동안 업계 최고 수준의 실무 교육 경험을 쌓을 수 있는 것이 강점이다. 연암공과대 제공연암공과대 스마트소트프웨어학과는 4차 산업혁명 시대를 선도하는 소프트웨어 전문가 육성을 목표로 설립됐다. 2017년 3+1(4년)의 학사학위 전공심화과정을 개설했으며, 2024년부터는LGCNS,SAPKorea와 산학협력을 통해 차세대ERP(전사적 자원관리) 전문가 육성을 목표로SAP(기업용 애플리케이션 소프트웨어)전공을 신설했다.SAP전공은 재학기간 동안 업계 최고 수준의 실무 교육 경험을 쌓을 수 있는 것이 강점이다. 올해 2학기부터는SAP프로젝트,ERPSim,Fiori,SAPUI5 등의 커리큘럼을 도입했다.SAP국제공인 자격증 취득을 위한 특별과정 개설을 앞두고 있어, 졸업과 동시에 현장 전문가로 활약이 가능한 경쟁력 갖춘 인재 배출 시스템을 확고하게 구축했다.김경선씨(SAP전공)는 “LG를 비롯한 많은 국내 기업들이SAP을 도입하고 있지만,SAP아카데미 교육비가 비싸고 실습할 수 있는 (SAP)서버를 구하기 힘들어 학생 신분으로SAP을 배우기에는 진입장벽이 너무 높았다”며 “학과 내에SAP과정이 심화과정으로 개설돼 있는 만큼SAP개발자를 꿈꾸는 이들에게는 최고의 선택지가 될 수 있을 것”이라고 말했다.LGCNS와 산학협력으로 설립된SAP전공은 재학 기간 동안 업계 최고 수준의 실무 교육 경험을 쌓을 수 있는 것이 강점이다. 연암공과대 제공스마트소프트웨어학과 교육과정은 코딩, 사이버보안, 클라우드서비스 등 복합적·실무적 능력을 갖출 수 있도록 구성돼 있다. 주요 과목으로 컴퓨터 네트워크 및 운영체계,IT보안, 융합AI프로젝트, 현장 중심AI프로젝트, 프로그램 코딩 기초, 프로그래밍 언어활용, 애플리케이션 테스트 수행, 앱프로그래밍,AI알고리즘, 4차 산업기술, 시스템 보안 운영, 보안장비 운영, 모의해킹 등을 배운다.재학 중 정보처리산업기사(과정평가형), 정보보호산업기사, 네트워크관리사, 데이터분석준전문가(ADsP),OCAJP,AWSFoundational,Google.AssociateCloudEngineer등의 자격증 취득이 가능한 교육과정도 운영 중이다. 학생들이 졸업 후 응용프로그램 개발 및 운영, 모바일 애플리케이션(앱) 개발 및 운영, 서버 및 시스템 보안 솔루션 운영, 네트워크 보안 장비 운영, 보안 관제 및 컨설팅, 빅데이터 운영 및 분석, 스마트 장비 및 시스템 운영 등 다양한 분야로 진출할 수 있도록 하기 위함이다.학생 참여형 프로젝트 중심의 수업, 멘토링 제도도 활발하게 운영되고 있다. 강경미씨(SAP전공)는 “빅데이터 처리나 프로그램 개발 시에는 팀별·팀원 간 역할을 명확히 분담하고 책임 있게 역할을 수행해야 한다”며 “프로젝트 중심 수업과 멘토링 제도는 프로그램 개발자를 꿈꾸는 이들에게 꼭 필요하다”고 말했다.LGCNS와 산학협력으로 설립된SAP전공은 재학 기간 동안 업계 최고 수준의 실무 교육 경험을 쌓을 수 있는 것이 강점이다. 연암공과대 제공SAP전공을 포함한 스마트소트프웨어학과는 뛰어난 취업률을 자랑한다. 2023년 취업률은 전문학사 80%, 학사학위 전공심화과정 95.7%에 달한다.LG가 연암공과대를 설립한 만큼LG계열사(SW회사)로의 취업문이 활짝 열려 있다. 학과 차원에서LG계열사를 비롯한 관련 업체와의 산학협력 네트워크 구축과 확대를 위해 노력한 결과다. 김범준SAP전공 담당교수는 “올해 더 높은 취업률이 예상된다”고 전망했다.그동안 맺은 산학협력 현황을 보면 △2019년 미디어로그(LG유플러스 자회사), 비즈테크파트너스(LGCNS자회사, 현비즈테크아이) △2020년 클라우드그램, 데이터솔루션, 엔시스템즈, 메타빌드, 유알피시스템, 아이티센, 다산네트웍스, 코리아퍼스텍 △2021년 티에스라인, 와이즈인포텍, 소프트아이텍, 스마트소셜 △2024년LGCNS,SAPKorea등 내로라하는 회사들이 총망라돼 있다.김범준 교수는 “LG전자,LGCNS,LGU+,LG디스플레이,LG이노텍, 미디어로그, 비즈테크파트터스 등LG계열사는 물론 인밸류비즈, 시앤지원, 3S소프트, 고영테크놀러지, 시스노바, 쌍용정보통신, 클로잇,IMP컨설팅, 신한 아이타스, 에스엠디 시스템 등 산학협약 소프트웨어 개발 전문기업체, 정부 및 관공서 취업을 희망한다면 우리 학과를 주목해달라”고 말했다."
2024-05-22,세계 첫 인공지능 규제법 다음달 발효…‘생체정보 인식’ 전면 금지,"EU법안 최종 확정…발표 6개월 뒤 시행위험도 따라 규제…강력 처벌 규정도 마련마르그레테 베스타게르 유럽연합 경쟁 담당 수석 부집행위원장(왼쪽)과 티에리 브르통 유럽연합 내부 시장 담당 집행위원이 2021년 4월 인공지능 규제 방안을 밝히는 기자회견을 하고 있다. 브뤼셀/EPA연합뉴스(☞한겨레 뉴스레터 H:730 구독하기. 검색창에 ‘한겨레 h730’을 쳐보세요.)유럽연합(EU)이 세계에서 처음으로 마련한 인공지능(AI) 규제법이 최종 확정돼 다음달 발효된다. 이에 따라 폐회로텔레비전(CCTV)을 이용한 안면 인식 같은 실시간 생체 정보 인식 시스템이 올해 중으로 전면 금지된다.유럽연합 회원국들로 구성된 이사회가 21일(현지시각) 인공지능법안을 최종 승인했다고 로이터 통신 등이 보도했다. 이날 승인된 법안은 지난해 12월 유럽연합 회원국들이 합의하고 지난 3월13일 유럽의회를 통과한 것이다.입법 절차가 마무리됨에 따라 이 법은 다음달 발효되며, 구체적인 첫 조처는 발효 6개월 뒤부터 시행된다. 전면 시행 시기는 발효 24개월 뒤인 2026년 중반이다.이 법은 인공지능 기술을 위험도에 따라 4등급으로 나누고, 위험도가 특히 높은 2개 등급의 기술은 전면 금지하거나 엄격하게 규제하는 걸 뼈대로 한다.인권을 심각하게 위협하는 일부 기술은 ‘용납할 수 없는 위험’으로 분류돼, 법 시행 6개월 뒤부터 전면 금지된다. △어린이에게 위험한 행동을 조장하는 음성 인식 장난감 같은 인지 조작 시스템 △행동이나 사회·경제적 지위 등에 따라 사람을 분류하는 ‘사회 평가’ 시스템 △생체 인식과 사람 분류 시스템 △실시간·원격 생체 정보 인식 시스템이 여기에 해당한다.다만, 정부의 법 집행기관이 실종자 수색이나 테러 공격 대응과 같은 중대 범죄 수사를 위해 특정 기간 동안 제한된 장소에서 실시간 생체 정보 인식 시스템을 사용하는 것은 예외적으로 허용된다.‘고위험’ 기술로 분류된 시스템들은 판매 전과 사용 기간 중 지속적인 위험 평가를 해야 한다. 시민들이 이런 시스템에 대해 불만을 제기하고 인공지능 시스템에 근거해 이뤄진 결정에 대한 해명을 요구하는 것도 가능해진다. 이 등급으로 분류된 시스템은, 중요 기반시설 관리·운영 시스템, 교육 시스템, 고용 관리 시스템, 이주·국경 통제 시스템, 법률 지원 시스템 등이다. 장난감, 항공기, 차량, 의료기기와 같이 안전 규제 대상 제품에 쓰이는 인공지능 기술도 ‘고위험’ 기술로 분류됐다.챗지피티(GPT)와 같은 생성형 인공지능 서비스는 고위험 기술로 분류되지 않았으나, 투명성 의무가 부과된다. 생성형 인공지능을 이용해 만든 콘텐츠는 별도로 표시해야 하며, 저작권 위반을 방지하는 장치도 마련되어야 한다. 생성형 인공지능 가운데 체계적인 위험을 제기할 수 있는 ‘고영향력’ 시스템은 별도의 평가를 거쳐야 하며 심각한 사고가 발생하면 유럽연합에 보고해야 한다.강력한 처벌 규정도 함께 마련됐다. 법 위반이 적발될 경우, 750만유로(약 111억원) 또는 전세계 매출의 1.5%부터 최대 3500만유로(약 518억8천만원) 또는 전세계 매출의 7%까지 과징금이 부과된다.유럽연합의 인공지능법은 2021년 처음 제안됐으며, 이듬해 11월 챗지피티가 등장하고 인공지능의 부작용에 대한 우려가 커지면서 입법 논의가 빨라졌다. 로이터 통신은 이 법이 자율적 규제 방식을 취하는 미국보다 훨씬 포괄적인 규제를 담고 있다며 이 법이 전세계에 인공지능 규제의 기준을 제시할 것으로 예상된다고 지적했다.마티외 미셸 벨기에 디지털 장관은 성명을 내어 “세계 최초로 제정된 이 획기적인 법은 전세계적인 기술 과제에 대응하는 것”이라며 “인공지능법을 통해 유럽은 새로운 기술을 다룸에 있어서 신뢰, 투명성, 책임을 강조한다”고 말했다."
