date,title,content
2024-07-10,집중호우에 국가유산도 피해 속출…가장 오랜 목조 건물 석축 붕괴,"국보 ‘안동 봉정사 극락전’ 주변 석축 붕괴집중호우로 국보 '안동 봉정사 극락전' 건물 뒤쪽 토사가 흘러내리고 석축이 무너졌다. 사진 국가유산청우리나라에서 가장 오랜 목조 건물로 추정하는 국보 ‘안동 봉정사 극락전’이 최근 내린 비로 건물 뒤쪽 토사가 흘러내리고 석축이 무너졌다. 극락전이 있는 봉정사는 통도사ㆍ부석사 등과 함께 2018년 유네스코 세계유산 ‘산사, 한국의 산지 승원’에 등재된 바 있다. 국가유산청에 따르면 지난달 29일 이후 집중 호우로 인한 국가유산 관련 피해는 10일 오후 4시 기준 23건이다.보물 '부여 대조사 석조미륵보살입상' 불상 아래쪽 흙더미가 무너져 내렸고 수각과 명부전 일부가 파손됐다. 사진 국가유산청국보 ‘완주 화암사 극락전’ 보호구역 경계에 있는 토사가 흘러내려 현재 주변 출입이 제한되고 있다. 국가유산청은 배수관을 정비하고 복구에 나설 예정이다. 보물 ‘부여 대조사 석조미륵보살입상’은 불상 아래쪽 흙더미가 무너져 내렸고 수각과 명부전 일부가 파손된 것으로 확인됐다. 관할 지역돌봄센터 관계자들이 현장에 출동해 긴급 조치 중이다.천연기념물 '성주 경산리 성밖숲'에서는 왕버들 나무(43호)가 쓰러졌다. 사진 국가유산청사흘간 기록적인 양의 비가 쏟아진 부여 일대에서는 사적 ‘부여 나성’을 비롯해 능안골 고분군, 가림성 등 곳곳에서 피해가 발생했다. 나이가 300~500년 정도로 추정되는 왕버들 59그루가 자라는 천연기념물 ‘성주 경산리 성밖숲’에서는 왕버들 나무(43호)가 쓰러졌다. 국가민속문화유산인 성주 한개마을의 담장 일부도 무너졌다."
2022-06-09,"수의 입은 송해 마지막인사…뽀빠이 이상용 ""국보 도둑맞은 기분""","대구 달성군 송해공원 내 송해기념관 앞에 마련된 임시분향소. 연합뉴스고인의 마지막 모습은 고요했다.고 송해 선생이 마지막 맨 얼굴로 대중에 인사를 했다. 오후 2시부터 몸을 씻고 수의로 갈아입은 고인은 연한 개나리색 수의를 입은 채 맑은 낯빛으로 누워있었다. 늘 끼고 있던 안경도 벗은 채 눈을 감고 누워있는 고 송해 선생의 입은 당장이라도 ""여러분 안녕하십니까""를 말할 듯 반쯤 벌어져 있었다.━""워낙 국민적인 분이라…"" 입관 전 마지막 인사9일 송해 선생의 입관식 전, 송해 선생과 생전 연이 있던 승가의 추도와 함께, 송해 선생의 큰딸이 다니는 교회에서 온 목사의 입관예배가 잇달아 진행됐다. 염이 끝난 뒤 누워있는 고인의 주위에 딸과 손녀 등 가족과 목사, 스님 등이 한 방에 모여 고인을 추모했다. 김정연 기자오후 3시부터 가족과 마지막 인사를 마친 뒤, 3시 30분쯤 시작된 이날 입관식에는 불교와 기독교가 모두 참여해 고인을 배웅했다. 고인의 큰딸이 다니는 그사랑교회의 고상섭 목사의 주도로 추모예배를 마친 뒤, 고인과 생전에 연이 있던 경북 청도 용천사의 지거스님이 목탁을 치며 마지막 송가를 불렀다. 고인의 큰딸은 추모예배가 끝난 뒤 뒤로 물러나 목탁 소리를 들으며 눈물을 훔치기도 했다.고인의 마지막 모습은 유족 측의 결정으로, 9일 급하게 공개가 결정됐다. 염습이 끝난 뒤 입관 전 추모 절차를 잠시 언론에 공개하기로 한 배경에 대해 유족 측 관계자는 ""워낙 국민적인 분이어서 가족들도 장례 절차 공개에 대해 고민하던 차에, 엄영수 코미디협회장이 의견을 냈고 유재철 염장이가 여러 사례를 알려주며 공개가 결정됐다""고 설명했다.━""만원짜리 이만큼씩 갖고 다녀, 어려운 사람 주려고""2008년 서울 여의도광장에서 열린 추석특집 '전국노래자랑' 녹화 당시 고 송해 선생의 모습. 송해 선생을 실은 운구차는 10일 새벽 발인 후 서울 종로구 송해길에 위치한 상록회 사무실과, 34년간 '전국노래자랑'을 함께한KBS본관을 둘러본 뒤 대구 달성군 장지로 떠난다. 중앙포토지난 8일 세상을 떠난 고인의 장례는 3일장으로 치러진다. 이틀째인 9일도 그를 기억하는 수많은 사람들이 서울대병원 장례식장에 마련된 빈소를 찾았다. 방송인 최불암·유재석·전현무·김국진을 비롯해 오후에 비를 뚫고 고인을 찾은 코미디언 김민경·유민상·홍윤화, 이미자·태진아·장윤정·인순이·이찬원 등 가요계 후배들도 고인의 마지막길을 배웅했다.오전에 빈소를 찾은 전원주는 약 1시간 30분간 빈소에 머물다 오후에서야 자리를 떴다. 그는 “선생님과는 몇십년간 공연을 같이 하고, 가짜 결혼도 올린 사이라 연이 많다”며 “많이 격려해주시고 힘들어도 참아라, 참아라 해주셨다”며 울먹였다. 그러면서 “늘 만원짜리를 이만큼씩 가지고 다니다가 길에 어려운 사람이 있으면 다 나눠주셨고, 원주도 그러고 살아라, 벌벌떨지 말고 쓰며 살아라, 하셨다”며 ""선생님 99세까지 88하게 사세요' 했다가 혼난 적 있지만, 100세까지 사실 줄 알았는데… 좋은 데 가서 내려다보고 응원해주셨으면 한다""고 말했다.약 30분간 빈소에 머문 태진아는 “1월KBS‘여러분 고맙습니다, 송해’ 녹화로 뵌 게 마지막”이라며 “저는 아부지, 아버님 하고 불렀고, 유별나게 따뜻하게 대해주시던 분인데 실감이 안난다”라며 말문을 잇지 못했다. 그러면서 “가요계뿐만 아니라 모든 연기자, 연예계 전체의 정말 큰 별이 하늘나라로 가셨다”며 “아버님 편안하게 다 내려놓으시고 하늘나라에서는 잘 계셨으면 좋겠다”고 덧붙였다. ‘할담비’ 지병수씨도 ""마지막으로 한 달 전쯤에 뵈었는데 '형님 건강하세요' 했더니 '동생 걱정하지마' 하셨는데…""라며 ""아들과 사모님도 볼 수 있고, 좋은 데 가셨을 것""이라고 말했다.━떨린 목소리 뽀빠이 ""'못볼 것 같다' 하시더니…국보를 도둑맞은 기분""'뽀빠이' 이상용은 ""송해 선생님은 국보다, 국보를 도둑맞은 기분""이라며 ""장례식장을 수십년 다녔지만 오늘같이 허망한 건 처음""이라고 말했다. ""20일 전쯤 마지막 연락을 했는데, '못볼 것 같다' 하셨는데 진짜로…"" 라며 한동안 말을 잇지 못한 그는 ""제가 데뷔했을 때 저에게 '키 큰 사람 이기는 법은 책 보는 거다, 머리로 이기자'하셔서 여태까지 책 읽게 해주신 분""이라며 ""시청자 여러분 이제 심심하시겠다, 하지만 송해 선생님은 여러분 마음 속에 살아계시리라 믿는다""고 말하며 자리를 떴다.1927년 황해도 연백군에서 태어난 고인은 지난 8일 서울 강남구 도곡동 자택에서 세상을 떠났다. 희극인장으로 치러지는 장례는 3일간 이어지며, 발인은 10일 오전 5시, 장지는 대구광역시 달성군 송해공원 인근 묘소다. 10일 오전 코미디언과 가족 등이 모인 영결식 뒤, 고인이 매일 출근하던 종로구 낙원동 연예인 상록회 사무실과 '전국노래자랑'을 했던KBS본관을 지나 대구로 내려가, 아내와 아들이 누운 곳 옆에 영면할 예정이다.0초0초광고 후 계속됩니다.다음 동영상subjectauthor취소수의 입은 송해 마지막인사…뽀빠이 이상용 ""국보 도둑맞은 기분""중앙일보재생3,230재생 (space/k)재생01:570:00:00재생 (space/k)재생음소거 (m)음소거00:00/01:57실시간설정전체 화면 (f)해상도자동 480p자막사용 안함재생 속도1.0x (기본)인기 구간 표시해상도자동 (480p)1080pHD720pHD480p360p270p144p자막설정사용 안함옵션글자 크기배경색재생 속도0.5x1.0x (기본)1.5x2.0x죄송합니다. 문제가 발생했습니다. 다시 시도해 주세요.도움말음소거 상태입니다.도움말라이선스디버그 정보 다운로드고화질 재생이 가능한 영상입니다.설정에서 해상도를 변경해보세요.더 알아보기00:00"
2022-03-17,"블록체인, 국보 지분 51% 기부…낯선 방식에 미술계 뒤숭숭","케이옥션에 전시된 국보 금동삼존불감. 블록체인을 기반으로 한 공동 투자조합이 인수했다. [뉴스1]지난 1월 국보로 사상 첫 경매 매물로 나왔던 ‘금동삼존불감’(이하 삼존불감·국보 73호)이 간송미술관의 품에 머무르게 됐다. 금동삼존불감을 사들인 블록체인 커뮤니티 ‘헤리티지 다오(DAO)’가 소유권의 51%를 간송미술문화재단에 기부하기로 하면서다. 수십억원에 달하는 문화재를 산 뒤 소유권을 다시 재단에 기부한 낯선 구매자에 문화계가 들썩이고 있다.헤리티지DAO에 참여한 56인 중 한 명이자 이번 경매와 계약을 주도한 김경남(LeonKim) 참여자를 16일 단독 인터뷰했다. 재미동포인 그는 싱가포르에 본사를 둔DAO플랫폼인 크레용(Crayon)의 대표다.‘탈(脫)중앙화 자율 조직’의 앞글자를 딴DAO는 블록체인을 기반으로 한 공동투자조합이다. 기존의 전통적인 조직처럼 대표나 관리자 혹은 부서가 존재하지 않고, 개인이 자유롭게 모여 자율적으로 운용되는 것이 특징이다. 구성원 투표를 통한 민주적 방식으로 의사를 결정한다. 최근에는 우주탐사나 미공개 영화 대본 인수를 추진하는 등 활동 범위를 넓히고 있다.국보인 삼존불감을 사들인 헤리티지DAO에는 총 56명이 ‘기여자(Holder)’로 참여했다. 간송미술관이 내놓은 국보 금동계미명삼존불입상(이하 계미명불상)과 삼존불감이 지난 1월 27일 케이옥션에 나온다는 소식에, 김 대표가 국보 구매를 위한 헤리티지DAO모집글을 1월 23일 웹사이트에 올린 게 시작이었다.다오(DAO)의 조직 구조와 특징그는 “(글을 올린 지) 하루 만에 600이더리움이, 일주일 만에 900이더리움이 모였다”며 “지난 1월 31일 케이옥션과 구두 계약했다”고 말했다. 이더리움 시세가 들쑥날쑥하지만 당시 가격으로 따지면 약 32억원에 달하는 금액이었다. 경매에서DAO가 국보를 낙찰받은 세계 최초의 사례라는 게 김 대표의 설명이다.이처럼 짧은 시간에 이 정도의 돈이 모일 수 있었을까. 그는 “참여자 56명은 국보가 팔린다는 사실과 삼존불감이 경매를 통해 개인의 손에 들어가면 대중이 향유할 수 없게 된다는 안타까움을 공유했다”며 “블록체인과 암호화폐 커뮤니티에서는 공감만 얻는다면 돈은 문제가 되지 않는다”고 말했다.컨스티튜션DAO가 소더비 옥션에 나온 미국 헌법 초판 인쇄본을 구매하기 위해 4000만 달러(약 478억2000만원)가량의 이더리움 모금에 성공했지만 헤지펀드 관계자가 4320만 달러에 낙찰받으며 실패했다.국보인 삼존불감을 사들인 뒤 다시 간송미술관에 기부했지만 문화계의 시선은 곱지만은 않다. 싱가포르 법인이 구매자로 등장하면서 해외에 국보가 팔린 게 아니냐는 우려도 나온다. 김 대표는 “기여자 중에는 외국인도, 한국인도 있다”며 “법률상 문화재를 취득하려면 법인이 필요해 내가 대표로 있는 ‘볼트랩스’라는 싱가포르 법인 이름으로 계약한 것”이라고 설명했다.헤리티지DAO가 산 삼존불감은 간송미술관에 남아 전시될 예정이다. 헤리티지DAO가 문화재 지분의 51%를 기부하고 관리 감독을 간송미술관에 맡기기로 했기 때문이다. 간송미술문화재단은 이날 “헤리티지DAO가 삼존불감이 본래 있던 곳에 영구히 보존되면서 전시 등에 활발히 활용될 수 있도록 재단에 기탁했다”고 밝혔다.거액을 들여 사들인 문화재의 지분 반수 이상을 기부하는 게 쉽게 이해되지는 않는다는 반응에 그는 “DAO의 특성을 이해하면 당연한 선택”이라고 강조했다. 그는 “모든 걸 투표로 결정하는 만큼 삼존불감을 다시 되파는 선택도 투표로 가능하지만, 구매 전부터 과반이 넘는 지분을 간송미술관에 기부해 국보를 다시 되팔 수 없는 구조로 하자고 결정했다”고 강조했다.헤리티지DAO가 공개한 사이트(snapshot.org/#/heritagedao.eth)에서 케이옥션 계약부터 기부까지의 모든 과정이 투표를 통해 이뤄지고 있는 것을 확인할 수 있다.간송을 대리하는 법무법인 이제의 권국현 변호사는 “헤리티지DAO는 삼존불감을 간송의 후손 개인이 아닌 간송미술문화재단에 기부하겠다는 의사를 밝혔다”며 “이렇게 되면 개인이 국보를 되팔 수 없고, 문화재청의 관리를 받게 된다”고 설명했다. 기부가 마무리되면 삼존불감의 소유자도 간송미술문화재단 외 1인으로 바뀌게 될 것으로 보인다. 기부는 아직 서명까지 이뤄지지는 않았다. 간송 측은 “마지막 의견 조율 단계에 있어 다음 주 초 기부 관련 서류 작업이 완료될 것”이라고 전했다.헤리티지DAO는 삼존불감을 당장 상업적으로 활용할 계획은 없다는 입장이다. 대체불가토큰(NFT) 사업권 대가로 간송 측에 소유권 일부를 넘겼다는 문화계 등의 의혹에 대해서도 “당장 삼존불감NFT를 발행할 계획도 없다”고 밝혔다.김 대표는 “기여자가 당장의 금전적 이익을 바라고 한 일이 아니다”며 “다만NFT세계관에서 다양하게 활용할 수 있을지 기대한다”고 말했다. 메타버스 게임 샌드박스에 삼존불감을 전시하거나 다른 메타버스 세계에 삼존불감을 3D로 재현해 올려 감상하는 방안 등을 고민하고 있다고 덧붙였다.김 대표는 “간송미술관에 삼존불감이 다시 전시되는 것도 의미 있지만, 다양한NFT세상을 통해 삼존불감을 해외에 알려 한국의 국보가 재평가받기를 바란다”고 밝혔다."
2022-03-15,"국보 73호 금동삼존불감, 암호화폐 투자자 모임이 샀다","서울 강남구 신사동 케이옥션 사옥 내 전시 중인 국보 금동삼존불감. 뉴스1국가지정문화재 국보인 간송미술재단 소장품 불교 유물 국보 제73호인 금동삼존불감의 소유권이 암호화폐 투자자 모임으로 넘어간 것으로 전해졌다.15일 문화재청 홈페이지에 따르면 금동삼존불감 소유자가 간송 후손을 지칭하는 기존 ‘전***’에서 ‘볼***’로 바뀌었다. 다만 소재지와 관리자는 이전처럼 ‘간송미술관’과 ‘간송미술문화재단’이다. 간송 후손이 누군가에게 불감 소유권을 넘겼으나, 새 주인이 불감을 가져가지 않았거나 기탁한 것으로 추정된다. 기탁은 소유권을 완전히 넘기는 기증과 달리 물품 관리를 맡기는 행위를 뜻한다.문화계 관계자에 따르면 한국과 교포를 중심으로 구성된 탈중앙화 자율조직 다오(DAO,DecentralizedAutonomousOrganization)가 금동삼존불감을 매입했다. 간송미술재단은 지난 1월 재정난을 이유로 국보를 경매에 내놓았지만 유찰된 바 있다. 당시 추정가는 최소 28억 원 정도로 알려졌다.’다오’는 중앙화된 주체의 관리나 감독 없이, 공동의 목표를 추구하는 사람들이 자발적으로 결집해 암호화폐로 자본을 모으고 조직을 운영해나가는 온라인 공동체다.암호화폐 기반의 투자 자본이 국보를 매입한 것은 이번이 처음이다. 이들은 소유권을 구입해 간송미술관에 다시 기증해 전시할 계획으로 알려졌다.문화계 관계자는 “다오가 공익을 위해 불감을 기증하기로 해 소유자가 다시 간송 측으로 등록 될 것”이라고 밝혔다. 대신 다오는NFT발행 등 가상의 권리를 얻을 것으로 전망된다."
2024-06-27,[유홍준의 문화의 창] 부산박물관의 수집가 전,"유홍준 본사 칼럼니스트·명지대 미술사학과 석좌교수우리나라에는 국립박물관이 14곳이나 있다. 서울의 국립중앙박물관을 비롯하여 역사 도시인 경주, 부여, 공주, 진주, 김해, 나주, 익산 등 일곱 곳과 광주, 전주, 대구, 청주, 제주, 춘천 등 대도시 여섯 곳에 있다. 그런 중 부산박물관은 국립이 아니라 시립이다. 이는 위상의 차이가 아니라 우리나라 제2도시로서 부산의 문화적 역량과 자존심을 말해준다.1978년에 개관한 부산박물관은 현재 동래의 복천박물관, 영도의 동삼동패총전시관, 기장의 정관박물관 등 3개의 분관을 거느리고 있다. 지금 부산박물관에서는 ‘수집가 전(傳)’(7월 7일까지)이라는 아주 보기 드문 특별전이 열리고 있다. 여기에는 부산의 대표적인 미술애호가 가문인 화승과 눌원 두 곳과, 부산과 연고 있는 삼성과 아모레퍼시픽의 2대째 이어가는 컬렉션 중 대표작들이 전시되었다.부산의 문화 자존심 시립 박물관화승·눌원·삼성·아모레 작품 전시해방 이후 부산 애호가들 큰 활약일본서 역수입된 문화재 회수도김두량 ‘삽살개’,1743년, 35x45㎝, 종이에 먹. [사진 부산박물관]‘기차표 고무신’으로 유명한 동양고무공업사를 창업한 고 현수명 회장은 부산박물관에 단원 김홍도, 추사 김정희, 백자항아리 등 명품 60여 점을 기증하여 국립박물관과 맞먹는 수준을 갖게 하였다. 대를 이은 현승훈 회장은 기업을 ‘나이키’의 화승으로 발전시키고 금정산 자락에 화승원이라는 아름다운 정원을 꾸미며 국토를 가꾸고 있는데, 그의 소장품 중 ‘백자달항아리’는 수화(樹話) 김환기가 소장했던 전설적인 명품이며, 영조대왕의 화제(畵題)가 쓰여 있는 김두량의 ‘삽살개’는 서양화법까지 구사된 조선후기 사실화풍의 극치를 보여준다.‘해표 식용유’로 유명한 동방유량 설립자인 고 신덕균 회장은 눌원재단을 세워 부산의 문화예술 진흥에 크게 기여해 오고 있는데, 대를 이은 신성수 이사장은 당대의 안목으로 ‘미술감상 9단’이라 불릴 정도다. 눌원재단의 ‘예안김씨 가전(家傳) 계회도 3폭’(보물)은 임진왜란 이전 조선 산수화의 높은 품격을 유감없이 보여주는 진귀한 작품으로, 계회도의 예술적 가치가 높이 평가되지 않던 시절 순전히 안목으로 수집한 대표적인 예이다. 미수(眉叟) 허목의 전서(篆書) ‘애군우국(愛君憂國)’(보물)은 글씨가 이토록 조형적이고 힘 있고 아름다운가 감탄을 자아내게 하는 명작이다.이번 전시회에 삼성과 아모레퍼시픽의 소장품이 함께 전시된 것은 ‘백설표 설탕’의 제일제당과 ‘ABC포마드’의 태평양화학이 모두 6·25전쟁 때 피난지 부산에서 창업했기 때문이다. 고 이건희 회장이 소장했던 단원 김홍도의 ‘삼공불환도’(보물)는 삼정승 벼슬하고도 바꾸지 않는다는 전원에서의 평화로운 삶을 그린 단원 말년의 대표적인 대작이다. 심전(心田) 안중식이 1915년에 전라도 영광 풍경을 그린 10곡 병풍은 파노라마식 전개로 보는 이를 압도한다. 아모레퍼시픽의 ‘십장생 10곡병풍’,‘해상군선도 10곡병풍’,‘요지연도 8곡병풍’은 채색이 화려한 궁중장식화의 백미이며, ‘백자달항아리’(보물)는 국보·보물로 지정된 백자달항아리 중 중량감이 넘치는 것으로 유명하다.돌이켜 보건대, 8·15해방 후 부산은 고미술품의 성지였다. 일본인들이 사 간 미술품들이 부산을 통해 역수입되었고, 6·25전쟁 이후 용두산 아래 동광동 거리에는 고서적상과 함께 보고사, 만복사 등 고미술상들이 줄지어 있었다. 동아대학교를 설립한 정재환 박사는 이를 열정적으로 수집하여 석당박물관에는 국보 2점, 보물 12점을 비롯한 2만여 점이 소장되고 있어 고려대, 이화여대와 함께 3대 대학박물관으로 꼽히고 있다.부산은 미술품 수집가의 층이 두터웠다. 치과의사 강덕인, 소아과의사 김위상, 부산시립박물관장을 지낸 박경원 등의 회화 도자기 수집품들이 기존에 발행된 한국미술도록에 ‘부산 개인 소장’으로 소개되어 있다. ‘백자넥타이병’이라는 애칭을 갖고 있는 ‘백자철화끈무늬병’(보물)을 국립중앙박물관에 기증한 고 서재식 회장도 부산은행장 시절에 수집활동을 하였다. 한국생사그룹의 고 김지태 회장은 부산시립박물관이 개관될 때 ‘금동보살입상’(국보)을 기증하였다. 미술품 수집은 구체적인 문화재 환수이자 보존이었던 것이다. 그래서 이번 특별전은 부제를 ‘수집의 즐거움, 공감의 기쁨’이라고 했다.지난 20일 제1회 선원의 날 선포를 기념하여 ‘선원들을 위한 나의 문화유산 답사기’ 강연을 마친 뒤 부산박물관의 특별전을 정은우 관장, 신성수 9단과 관람하고 있자니 관객들이 모여들어 우리의 대화를 엿듣고 있었다. 내친김에 나는 즉석 도슨트 역할을 하면서 우리 고미술의 아름다움을 한껏 전도하였다. ‘서울공화국’에서는 누릴 수 없는 안복이었다.유홍준 본사 칼럼니스트·명지대 미술사학과 석좌교수"
