date,title,content
2022-09-27,'뼈까지 녹인다'는 구미 불산 누출 10년..노후산단 사고는 계속된다,"2012년 9월 27일CCTV를 통해 확인된 경북 구미 화공업체 불산가스 누출 당시 상황. 가스가 순식간에 누출되면서 작업자를 뒤덮고 있다. 연합뉴스2012년 9월 구미 불산사고2012년 9월 27일 오후 3시 43분쯤 경북 구미시 산동면(현 산동읍) 구미산업단지. 이곳 한 업체 에 있는 20t짜리 탱크로리에서 뿌연 기체가 솟구쳤다. 탱크 위에 올라가 있던 근로자 1명의 얼굴과 몸은 순식간에 기체에 휩싸였다. 기체에 노출된 근로자를 비롯해 공장 직원 5명이 숨졌다. 탱크 바깥으로 누출된 이 기체는 플루오린화 수소 가스, 일명 ‘불산 가스’였다.━맹독성 모른 채 대처…주민 1만2000명 병원행사고는 불산을 물에 희석시키기 위해 탱크에서 불산을 빼내는 작업을 하다 발생했다. 밸브와 호스를 연결하기 전 밸브와 호스 레버가 모두 잠긴 채로 작업을 해야 하는데, 레버를 잠그지 않고 밸브와 마개를 여는 순간 불산이 기화해 뿜어져 나왔다. 이 사고로 누출된 불산은 약 8t으로 파악됐다.사고 발생 직후 신고를 접수한 경찰과 소방당국은 곧바로 현장에 출동하는 한편 경찰청과 구미시·대구지방환경청 등 관련기관에 사고 사실을 통보했다. 경찰 40여 명과 소방관 180여 명이 구조 작업에 투입됐다. 그때까지만 해도 소방당국과 경찰은 화학약품을 취급하는 업체에서 종종 일어나는 일반적 저장탱크 폭발·누출 사고로 생각했다.불산 맹독성이 알려진 것은 출동 2시간 50여 분이 지난 오후 7시쯤이었다. 그 전까지 구조 요원들이 안전장비를 제대로 착용하지 않은 것은 물론 대피했던 주민들을 다시 집으로 돌려보내는 등 초동대처가 미흡했다. 정부는 사고 발생 12일 만인 10월 8일 불산 누출 지역을 특별재난지역으로 선포했다.불산은 벽돌 청소, 반도체 마이크로 칩 가공, 가죽 태닝, 알루미늄 생산, 소화기 제조 등 많은 산업분야에서 사용되는 약품이다. 부식성이 매우 강하고 유독성을 가진 무색의 액체다. 습기와 접촉하면 극도의 부식성 액체인 불화수소산을 형성하고, 다량 노출되면 인체 조직에 빠르게 침투한 후 전신 독성을 유발할 뿐 아니라 뼈를 녹이고 심장과 폐를 손상시켜 사망에 이르게 한다.경북 구미 불산가스 누출로 막대한 피해가 발생한 산동면 봉산리에서 2012년 10월 8일 경북도 관계자들이 과수 피해를 조사하고 있다. 연합뉴스누출된 불산 가스는 업체 주변으로 번져 주민 1만2000여 명이 병원진료를 받고 121㏊ 규모의 농작물이 고사했다. 가축 4000여 마리도 폐사했다. 주민 보상액은 380억원에 달했다. 이듬해인 2013년에도 예년 평균의 7배인 87건의 화학사고가 일어나면서 ‘화학물질관리법’ 제정으로 이어졌다.━산단 중대사고 아직도 이어져대한민국 화학물질사고 역사상 기록으로 남을 만한 구미 불산 가스 누출 사고가 일어난 지 10년이 흘렀다. 불산 가스 누출 사고를 계기로 화학물질 위험성에 대해 경각심이 높아지고 유해화학물질 관리와 대응 체계를 명문화한 법도 제정됐지만, 전국 산업단지에서는 화재·폭발 사고가 끊이지 않는다.지난 22일에는 전남 여수국가산단 금호화학석유에서 시클로헥산 등 액체 혼합물 가스가 유출돼 14명이 흡입하는 사고가 발생했다. 지난달 31일엔 울산미포국가산단SK지오센트릭 폴리머 공장에서 폭발사고가 발생해 원청 직원 4명과 협력사 직원 3명이 크게 다쳤다.지난 5월 19일 오후 울산시 울주군 온산공단 에쓰오일 울산공장에서 폭발로 대형 화재가 발생해 소방당국이 진화 작업을 벌이고 있다. 연합뉴스산업단지에서 발생하는 큰 사고의 절반 이상은 20년 이상 노후 산단에서 발생한다. 이 때문에 노후 산단을 체계적으로 관리·감독해야 한다는 목소리가 커지고 있다.더불어민주당 김회재 의원(전남 여수시을)이 한국산업단지공단으로부터 제출 받은 ‘산단 연혁별 중대사고 현황’ 자료에 따르면 2017년부터 올해 2월 현재까지 6년간 한국산업단지공단이 관리하는 64개 산단에서 산업재해, 화학사고, 화재·폭발사고 등 중대사고가 126건 발생했다. 이 중 조성 20년 이상 노후 산단의 중대사고가 123건이었다.━“노후 산단 안전·유지관리 특별법 필요”이 기간 중대사고로 인한 사상자는 230명으로 나타났다. 조성 20년 이상 노후 산단 사상자가 226명으로 전체의 98.3%를 차지했다. 반면 조성 20년 미만인 산단의 사상자는 4명에 그쳤다.산업단지 중대사고 발생건수 및 인명피해. 자료 김회재 의원실일각에선 사업주뿐 아니라 정부와 지자체도 산단 사업장 노후 설비 관리책임을 지도록 특별법을 만들어야 한다는 목소리가 나온다. 구미YMCA는 “노후 산단 특성상 사고가 대형화로 이어질 수 있는 만큼 노후 산단과 시설은 특별하게 별도로 관리할 필요가 있다”라며 “특별법 제정으로 정부·지자체·기업·시민 공동의 노력으로 안전한 산업단지를 조성해야 한다”고 했다."
2022-06-30,경영 성적표 1위 이재용…영업이익 1475% 급증한 총수 누구,"유럽 출장을 마친 이재용 삼성전자 부회장이 지난 18일 서울김포비즈니스항공센터를 통해 귀국하고 있다. [뉴시스]국내 대기업 총수들의 지난해 경영 성적표를 내본 결과 이재용 삼성전자 부회장이 매출과 영업이익, 당기순이익, 고용 규모에서 1위를 차지한 것으로 나타났다.기업분석업체인 한국CXO연구소는 30일 ‘2021년도 그룹 총수 경영 성적표 분석’ 결과를 발표했다. 조사 대상은 공정거래위원회가 올해 지정한 자산 5조원이 넘는 76개 대기업 집단 중 올해 신규 편입된 곳을 제외한 58개 그룹이다.조사 결과 이재용 부회장은 그룹 전체 매출을 비롯해 영업이익, 당기순이익, 고용 규모 등 4개 항목에서 1위를 차지했다. 삼성의 지난해 그룹 전체 매출 규모는 378조7400억원으로, 조사 대상 58개 그룹 전체 매출(1596조원)의 23.7%에 달했다.[자료 한국CXO연구소]또 지난해 삼성의 전체 영업이익 규모는 42조5512억원, 순익은 41조원으로 58개 그룹 전체 영업이익의 36.3%, 전체 순익의 42.5%를 차지했다. 지난해 삼성의 전체 고용 인원은 26만6854명이었다. 이는 58개 그룹 전체 직원 수(142만5682명)의 18.7% 수준이다.이 부회장에 이어 정의선 현대차그룹 회장과 최태원SK그룹 회장이 매출 톱 3에 이름을 올렸다. 정 회장과 최 회장이 기록한 작년 그룹의 매출 규모는 각각 211조원, 169조원이었다. 영업이익과 순익 항목에서는 최 회장이 각각 19조9849억원, 18조4059억원으로 2위를 차지했다.지난해 그룹 전체 고용 규모에서는 정 회장과 구광모LG그룹 회장이 각각 2위, 3위를 차지했다. 현대차그룹과LG그룹의 고용 규모는 각각 17만4952명, 15만8791명이었다.전년 대비 그룹 전체 매출 증가율 1위는 정창선 중흥건설 회장이 기록했다. 2020년 3조1516억원이었던 그룹 매출은 지난해 11조6633억원으로 270.1% 올랐다. 업계 선두권은 대우건설을 인수하면서 외형이 급증해서다.매출 증가율에선 김상열 호반건설 회장(92.1%)이 2위, 박찬구 금호석유화학 회장(67%) 3위였다.전년 대비 그룹 전체의 영업이익 증가율 1위는 조원태 한진그룹 회장이 차지했다. 코로나19로 인해 2020년 870억원에 그쳤던 그룹의 영업이익은 지난해 1조3705억원으로 1475% 급증했다.[자료 한국CXO연구소]그룹 순익 증가율에서는 정태순 장금상선 회장이 1위에 올랐다. 장금상선의 경우 그룹 전체 순익 규모가 2020년 223억원에서 지난해 1조6718억원으로 7373.4% 증가했다. 이어 허창수GS그룹 회장(2119%), 장세주 동국제강 회장(1229.9%)도 1년 새 그룹 순익 내실이 1000%를 상회했다.이번 조사 대상 58개 그룹 중 전년 대비 그룹 전체 매출과 영업이익, 순이익을 모두 30% 이상 증가시킨 총수는 9명이었다. 정태순 장금상선 회장, 장세주 동국제강 회장, 김홍국 하림 회장, 김범수 카카오 창업자, 우오현SM(삼라마이다스) 회장, 박찬구 금호석유화학 회장, 정창선 중흥건설 회장, 김윤 삼양 회장, 김상열 호반건설 회장이다.[자료 한국CXO연구소]"
2022-03-23,코시국에 '1억 클럽' 2.6배 늘었다…평균연봉 1억 넘는 21곳 어디,"새해 첫 출근일인 지난 1월 2일 오전 서울 영등포구 여의도동에서 직장인들이 출근하는 발걸음을 재촉하고 있다. 중앙포토직원 평균 연봉이 1억원을 넘은 이른바 '1억 클럽'에 해당되는 국내 대기업 수가 2년간 2배 넘게 늘었다는 조사 결과가 나왔다. 또 연봉 상승률을 고려하면 올해는 31곳 가량이 1억 클럽의 범주에 들 것으로 전망됐다.전국경제인연합회 산하 한국경제연구원은 매출액 100대 비금융업 상장사 중 2019∼2021년 3개년 사업보고서가 공개된 기업 85개 사를 대상으로 조사한 결과, 직원 평균 연봉이 1억원을 넘는 기업은 총 21곳이었다고 23일 공개했다.2019년 8곳, 2020년 10곳이었던 것을 감안하면 각각 2.6배, 2.1배 증가한 것이다.한경연에 따르면 지난해 직원 평균 연봉이 1억원을 넘은 100대 기업은 삼성전자,SK텔레콤, 에쓰오일,LG화학, 삼성물산, 롯데케미칼, 삼성SDI,삼성전기, 금호석유화학, 삼성SDS,네이버, 삼성엔지니어링, E1,LX인터내셔널(구LG상사), 팬오션,SK㈜, 기아, 포스코, 포스코인터내셔널,HMM,대한유화 등 총 21곳이었다.이중SK텔레콤은 1억6200만원으로, 조사대상 중 직원 평균 연봉이 가장 높은 곳으로 나타났다. 이는 작년에 비해 34%나 뛰어오른 수치다. 이어 삼성전자 (1억4400만원), 네이버(1억2900만원), 삼성SDS(1억1900만원) 등의 순이었다.직원 평균연봉 ‘1억 클럽’에 든 대기업 수. 그래픽=신재민 기자shin.jaemin@joongang.co.kr'1억 클럽'에 가입하는 대기업 수는 매년 늘고 있다. 2019년 직원 평균 연봉이 1억원을 넘은 기업은 삼성전자와 에쓰오일, 삼성물산,SK텔레콤, 한화솔루션, 삼성SDS,LG상사(현LX인터내셔널), 대한유화 등 8곳에 불과했다.2020년에는 한화솔루션과 삼성SDS가 빠지고, 포스코인터내셔널과 금호석유화학, 네이버, E1이 새롭게 이름을 올리면서 '1억 클럽' 수는 10곳으로 늘었다.2021년에는 포스코와LG화학, 롯데케미칼,HMM,삼성SDI,삼성전기, 삼성엔지니어링, 팬오션, 기아,SK㈜, 삼성SDS등 11곳이 추가됐다.2019년 대비 지난해 '1억 클럽'에 신규 가입한 상장사 14곳 중 3곳은 '화학물질 및 화학제품 제조업'을 영위하는LG화학과 롯데케미칼, 금호석유화학이었다. 신종 코로나바이러스 감염증(코로나19) 여파로 도매 및 상품중개업(포스코인터내셔널·E1)과 수상 운송업(HMM·팬오션) 기업도 각각 2곳씩 추가됐다. 다만 2019년 '1억 클럽' 기업이었던 한화솔루션은 직원 고용 증가로 평균 급여가 크게 줄어들면서 국내 4대 화학사 중 유일하게 2020년과 지난해 이름을 올리지 못했다.한경연은 지난 3년간 연봉 증가율 등을 고려한 결과 올해에는 '1억 클럽' 가입 기업 수가 31곳으로 늘 것으로 추정했다. 코로나19 혜택을 받은LG전자와 현대모비스, 만도, 동국제강, 현대건설, 아모레퍼시픽 등이 올해 새롭게 '1억 클럽'에 이름을 올릴 것으로 전망된다.한경연 김용춘 고용정책팀장은 ""금융사나 3년치 사업보고서가 확보되지 않은 카카오 같은IT·플랫폼업체까지 포함할 경우 직원 평균 연봉이 1억원 이상인 기업은 훨씬 늘어날 것""이라고 말했다."
2022-03-09,개미 눈치 본다…한주에 5만원 '역대급 배당금' 기업 어디,"주식 차트 이미지. [셔터스톡]본격적인 정기주주총회 시즌을 앞두고 상장사들이 배당금을 크게 늘리고 있다. 동학 개미의 목소리가 커지고, 최근 국내 증시가 휘청거리자 기업들이 주주환원 정책 기조가 보다 뚜렷해지는 모습이다.주요 대기업 중에는 효성그룹이 눈에 띈다. 효성티앤씨는 보통주 한 주에 5만원을 현금 배당할 계획이다. 2020년 주당 5000원에서 10배로 늘렸다. 배당금 총액이 2157억원이다. 주요 상장사 중 주당 배당금이 가장 많이 늘었다. 효성첨단소재도 주당 배당금 1만원을 지급하겠다고 공시했다.효성티앤씨는 스판덱스 수요 급증에 힘입어 지난해 1조4237억원의 영업이익을 기록했다. 재계에선 효성티앤씨의 실적이 좋기도 했지만 조현준 효성그룹 회장과 조현상 부회장의 사내이사 선임 추진과 연결 지어 해석하기도 한다. 효성티앤씨와 효성첨단소재는 오는 17일 주총을 앞두고 각각 조 회장과 조 부회장의 사내이사 선임 안건을 공시했다.다만 여론이 부담이다. 경제개혁연대는 8일 논평을 통해 두 사람의 과거 처벌 전력을 거론하며 “사내이사 후보로 부적절하다. 국민연금 등 기관투자가와 주주들은 해당 안건에 대해 반대해야 한다”고 주장했다.효성 측은 “지난해 효성티앤씨가 순이익이 많이 났기 때문에 배당금을 늘린 것”이라고 설명했다. 오너 일가가 계열사 사내이사로 추가로 나서는 데 대해선 “대규모 설비 증설을 계획하는 등 보다 빠른 결정으로 사업을 키우겠다는 뜻”이라고 말했다.효성. [연합뉴스]금호석유화학은 25일 주총을 앞두고 보통주는 주당 1만원, 우선주는 주당 1만50원으로 역대 최고액의 배당안을 통과시켰다. 전년도의 보통주 주당 4200원, 우선주 주당 4250원 배당과 비교하면 2배 이상 늘렸다.이는 회사 측과 경영권 분쟁 중인 박철완 전 금호석화 상무의 주주제안을 의식한 배당안으로 해석됐다. 박찬구 금호석유화학 회장의 조카인 박 전 상무는 지난달 주주제안을 발송하며 회사 경영에 복귀하겠다는 의지를 밝혔다. 박 전 상무는 금호석화 주식 8.5%를 보유한 개인 최대주주로 특수관계인 지분까지 합치면 10.22%를 갖고 있다. 박찬구 회장은 특수관계인을 포함해 14.9%의 지분을 확보하고 있다.박 전 상무는 보통주 주당 1만4900원, 우선주 주당 1만4950원의 배당을 제안했다. 회사 측은 “이럴 경우 배당금 총액은 4184억원으로 지난 3개년도(2018~2020년) 배당 총액의 2배가 넘는 수준으로, 안정적이고 예측 가능한 수준의 주주환원을 지향하는 회사의 정책과 괴리가 있다”고 반박했다.금호석유화학 지분구조. 그래픽=김영옥 기자yesok@joongang.co.kr지배구조 관련 이슈가 있는 기업도 배당에 적극적이다. 카카오는 주당 53원, 총 230억원을 배당금으로 사용하기로 했다. 설립 후 첫 배당이다. 또 향후 3년간 잉여현금흐름의 15~30%를 재원으로 이 중 5%를 현금배당, 10~25%를 자사주 매입과 소각에 투입하기로 했다. 시장에선 최근 계열사 경영진의 ‘스톡옵션 먹튀’ 논란 이후 주가가 30%가량 하락하자 주주환원 정책을 제시한 것으로 풀이한다.이 밖에도ESG(환경·사회·지배구조) 강화 기조 속에서 지난해 경영 실적이 개선된 기업 등이 배당 확대에 나서고 있다.SK하이닉스는 주당 1540원으로 배당금을 결정했다. 전년 대비해 30% 이상 늘린 액수다. 포스코 역시 배당금을 전년 대비해 두 배 올렸다.기업데이터연구소CEO스코어에 따르면 국내 상장사 중 지난달 28일까지 배당을 발표한 853개사 중 배당금을 전년보다 늘린 기업은 66.6%(568곳)이다. 1조원 이상 배당 기업은 삼성전자와 현대자동차, 포스코, 기아,KB금융,SK하이닉스, 신한지주 등 7곳이다. 지난해엔 삼성전자가 유일했다. 상장사들의 전체 배당금 규모는 40조원을 넘어설 것으로 관측된다.김우찬 고려대 경영학과 교수는 “한국 기업들의 배당 성향은 미국‧유럽‧중국보다 낮고, 낮은 배당 성향은 한국 증시 저평가의 원인 중 하나”라면서도 “주주 입장에서는 세금을 내야 하는 배당보다는 주가 상승을 선호하는 것도 사실이어서 기업은 여러 방향으로 주주환원을 위해 노력해야 할 것”이라고 말했다."
2022-03-25,"박찬구, 주총서 '조카의 난' 진압…표대결서 30%P 넘게 압승","박찬구 금호석화 회장(왼쪽)과 박철완 전 상무. [중앙포토]‘조카의 반란’은 또다시 실패로 끝났다. 지난해에 이어 올해도 되풀이된 금호석유화학 내 삼촌과 조카의 주주총회 표 대결에서 삼촌인 박찬구(74) 금호석화 회장이 조카이자 개인 최대주주인 박철완(44) 전 금호석화 상무에게 완승했다.금호석화는 25일 서울 중구 시그니쳐타워에서 정기 주주총회를 열었다. 당초 오전 9시 시작될 예정이었지만 참석 주주와 의결권 위임, 검표 작업에 시간이 걸려 1시간 30분 늦게 개회했다. 전체 의결권 주식 수 약 2504만7000주 중 출석한 주식 수는 약 1705만7000주(약 68.1%)였다. 주총 현장에는 약 70여 명의 주주가 직접 참석했다.이번 주총에선 박 전 상무가 이익배당, 사외이사·감사위원 선임을 두고 별도의 주주제안을 제출해 박 회장의 회사안과 맞붙었다. 표결 결과 이익배당 안건에서는 회사안(보통주 1주당 1만원)이 68.6%의 찬성률로 최종 의결됐다. 박 전 상무가 제안한 배당안(보통주 1주당 1만4900원)은 31.9%의 찬성률로 부결됐다.사외이사 안건에선 회사가 추천한 박상수 경희대 명예교수, 박영우 환경재단 기획위원 선임 안건이 71%의 찬성률로 의결됐다. 박 전 상무가 제안한 안건은 29%의 찬성률로 부결됐다. 감사위원 선임 안건 역시 72.6%의 찬성률로 회사가 추천한 박상수 경희대 명예교수가 최종 선임됐다. 이날 주총은 개회 후 1시간 30분 만에 끝났다.━표 대결서 30%p 이상 격차…국민연금 표 주효박 회장과 박 전 상무 측 지분율 차이는 5% 미만이다. 박 회장 측은 본인 지분 6.73%에 아들 박준경 부사장(7.21%), 딸 박주형 전무(0.98%) 지분을 합해 총 14.92%를 보유하고 있다. 박 전 상무는 지분 8.58%를 보유하고 있고, 특수관계인 지분까지 합치면 지분율은 10.22%다. 박 전 상무는 박찬구 회장의 형인 고(故) 박정구 전 금호그룹 회장의 1남 3녀 중 외아들이다.그러나 박 회장은 이날 여러 안건에서 30%포인트 이상의 격차로 승리했다. 여기엔 국민연금의 찬성표가 주효하게 작용했다는 분석이다. 국민연금은 금호석화의 지분 6.82%를 보유 중이다. 앞서 국민연금은 이익배당 안건에 대해 “향후 중장기 투자 계획 등을 고려할 때 금호석화 이사회가 낸 이익배당 안건이 더 적정한 수준”이라고 평가했다. 이사회 교체 시 회사 경영의 불확실성이 커질 것을 소액주주들이 우려했다는 말도 있다.박 전 상무는 지난해에 이어 이번에도 고배를 마셨다. 지난해 주총 때도 배당, 사내·사외이사 선임 등에 관한 주주 제안을 냈지만 표 대결에서 밀렸다. 박 전 상무는 이후 ‘충실 의무 위반’ 등의 이유로 금호석화에서 해임됐다.금호석유화학 지분구조. 그래픽=김영옥 기자yesok@joongang.co.kr박 전 상무 “필요하면 임시 주총 소집할 것”주총 이후 박 전 상무는 공식 입장문을 내 “제가 부족한 탓에 대다수의 지지를 끌어내지 못해서 죄송하다”고 밝혔다. 그는 “승부를 떠나 국민연금이 현 경영진의 법적 책임, 불법 취업 상태 등 고려하지 않은 점은 아쉬움이 남는다”며 “회사가 전자투표제를 도입하지 않아 성원을 보내주신 개인주주의 표를 모으는 데 한계가 있었다”고 주장했다.박 전 상무는 “박찬구 회장이 불법 취업 상태에서 작년 상반기에만 38억원이 넘는 연봉을 수령하는 것 역시 회사의 임직원들과 주주의 입장에서 이해하기 어려운 일”이라고 재차 강조했다. 또한 “배당금은 약속드린 대로 연결 기준 30%를 향후에 계속 제안할 것”이라며 “회사가 발표한 1500억원의 자사주 매입 및 소각은 내년 주총을 앞둔 시점에서가 아닌 올해 안에 실행되길 회사 측에 요청한다”고 했다.박 전 상무는 “이번 주주 제안으로 건전한 주주 문화 실현 가능성을 증명하는 작은 성과를 거두었다”고 자평하며 “필요하면 임시 주총을 소집해 주주 의사를 대변할 것”이라고 밝혔다. 그는 “회사가 약속한 신규 사업에 대한 투자가 실행되는지 계속 주시할 것”이라며 “계속해서 자사주 장기 보유, 과소 배당 등 비친화적 주주환원 정책을 바로잡기 위해 최대주주로서 책임에 최선을 다할 것”이라고 강조했다. 향후에도 갈등의 불씨는 남아있는 셈이다.━경영 승계 관련 주주 질문에 백종훈 대표 “금시초문”한편 이날 주총에선 소액주주들의 질문 공세도 눈길을 끌었다. “주가가 많이 하락했다. 자사주 소각 생각이 궁금하다. 탄소나노튜브도 주주에게 설명해달라. ”(주주 정모씨), “건자재 전략과 우크라이나발 원가 관리 계획을 듣고 싶다”(최모씨), “음극재 바인더 관련 보도, 중국 자동차 타이어 교체 주기 보도가 있던데 사실이냐, 언론플레이냐”(이모씨) 등의 질문이 이어졌다.금호석유화학이 25일 서울 중구 시그니쳐타워에서 정기 주주총회를 열었다. [사진 금호석유화학]이에 대해 백종훈 금호석화 대표는 “주가에 대해선 죄송하다”며 “라텍스라는 전 세계 1위 품목 판매가 좋았음에도 주가 반영이 안 됐다”고 해명했다. 자사주 정책에 대해선 “(소각목적 자사주 매입금액인) 1500억원이 적다는 의견이 있는데 장기 투자를 감안해야 하기 때문에 지켜봐 달라”고 언급했다. 탄소나노튜브(CNT)에 대해선 “앞으로LG에너지솔루션, 삼성SDI등에 공급할 계획”이라고 언급했다.원가 관리 계획에 대해선 “상승된 원료 가격을 제품 가격에 연동시켜 차익 부분을 해소 시켜 나가려고 하는 데 시차가 있어 손익이 나빠질 것으로 보인다”면서도 “2분기에는 만회하려고 할 거다. 러시아에서 유럽으로 수출하던 합성 고무는 수출 규제로 거꾸로 유럽 고객이 우리에게 물량 문의를 하고 있어 반사이익이 예상된다”고 강조했다.한 주주는 “주가가 부진한 이유가 경영 승계와 관련된 것 아니냐는 인식이 많다. 해명할 부분이 있나”라고 물었다. 그러자 백 대표는 “금시초문이라 특별히 드릴 말씀이 없다. 사실과 전혀 무관한 이야기 같다”며 “시중에 떠도는 단편적인 이야기일 뿐이라고 생각한다”고 일축했다."
