date,title,content
2022-12-22,"대기업들, 종무식 생략하고 9일간 연말 휴가","[NOW]  미국·유럽처럼 장기휴가 권장㈜LG와LG전자,LG화학 등LG그룹 주요 계열사는 23일 올해 업무를 마무리하고 다음 날부터 연말 휴가에 들어간다. 오는 26일부터 30일까지 권장휴가를 실시해, 불가피한 업무가 있는 직원을 제외하고는 최대 9일간의 휴가에 들어가는 것이다. 이를 위해 구광모LG그룹 회장은 지난 20일 재계 총수 중 가장 먼저 내년 신년사를 발표했다.주요 대기업들이 연말 종무식을 생략하고, 크리스마스를 전후로 장기 휴가에 돌입한다. 워라밸(일과 삶의 균형)을 중시하는 사회적 분위기와 맞물려 연말연시에는 대부분 휴가를 떠나는 ‘서구식 집중 휴가제’가 국내 기업 사이에서도 점점 확산되는 것이다. 종무식을 위해 12월 마지막 날까지 출근하던 기업들의 풍경이 점점 옛날 얘기가 되고 있다.SK그룹 주요 계열사들도 이번 주부터 장기 휴무에 들어가고 있다. 연말 인사와 조직 개편을 모두 끝마친CEO(최고경영자)들이 먼저 연말 휴가를 떠나면서 임직원들도 자유롭게 연말연시 휴가를 쓰는 분위기다.LS그룹은 남은 연차를 소진하기 위해 다음 주부터 연말 장기 휴가를 떠나도록 권장하고 있다.LS그룹이 연말 권장 휴가제를 도입한 것은 이번이 처음이다.재계 관계자는 “기업 입장에서는 어수선한 연말 분위기에 근무 효율성이 떨어지기 때문에 휴가를 가는 것이 비용 절감 측면에서 효과적”이라며 “임직원 입장에서도 만족도가 높아 연말 휴가를 적극 권장하는 기업은 앞으로 계속 증가할 것”이라고 말했다.‘연말 휴가 제도’가 국내 기업에 잇달아 도입되고 있다.현대자동차는 창립기념일(29일) 휴무를 하루 미뤄 29일에 올해 업무를 마무리하고 30일에는 전사적으로 쉴 계획이다. 현대자동차와 기아는 내년 1월 2일에도 노사협약에 따라 본사와 연구소가 휴무에 들어간다. 현대차 임직원들은 연말연시에 ‘4일 휴가’를 떠나는 것이다.롯데그룹도 지주사를 비롯한 주요 계열사들이 오는 30일 전체 휴무 외에도 연말에 남은 연차를 모두 쓰도록 권장하고 있다. 이마트 역시 마지막 근무일인 30일을 리프레시 데이로 지정해 쉴 계획이다. 한화그룹 계열사인 한화시스템은 ‘단체휴가’라는 이름으로 마지막 주 전체 휴무를 독려하고 있다. 금호석유화학도 23일로 올해 업무를 끝마치고 다음 주 전사적으로 휴무에 들어간다. 24시간 가동돼야 하는 공장의 근무자에 대해서는 휴무에 따른 연차 보상을 지급할 예정이다.반면 비상 경영에 들어간 삼성그룹은 연말 장기 휴가와는 거리가 먼 분위기다. 삼성전자는 22일 반도체 부문 글로벌 전략회의, 23일 베트남 R&D센터 개소식 같은 행사가 이어지고 내년 초 세계 최대 가전·IT전시회 ‘CES2023′도 예정돼 있어 상당수 임직원들이 연말에도 출근한다. 23일 지급될 하반기 목표달성장려금(TAI·옛PI)도 예년보다 적어질 것으로 알려져, 임직원들로선 연말 분위기를 내기 힘든 상황이다.인력난에 시달리는 중소기업들도 연말연시 휴가는 ‘그림의 떡’이다. 한 중소기업 사장은 “휴가로 한 명이 빠지면 대체할 사람이 여의치 않아 연차 휴가도 제대로 쓰지 못하는 경우가 허다하다”며 “이런 상황에서 장기 휴가는 엄두도 못 낸다”고 말했다."
2022-11-17,하이닉스·현대차 투자축소… 증권계는 감원 돌입,"기업들 ‘생존 모드’ 돌입글로벌 경기 침체로 영업이익 등이 뚜렷한 하강 곡선을 그리기 시작하면서 기업들은 ‘생존 모드’에 돌입했다. 고용과 투자를 줄이면서 최악의 상황에 대비 태세를 갖추기 시작했다세종시 정부세종컨벤션센터(SCC) 에서 열린 '2022년 세종 청년취업박람회'를 찾은 청년 구직자들이 채용공고 현황을 살펴보고 있다. ⓒNews1 김기남 기자우선, 투자 계획이 줄줄이 재조정되기 시작됐다. 메모리 반도체 업황 악화로 올해 3분기 영업이익이 전년 동기 대비 60.3% 급감한SK하이닉스는 내년 시설 투자 규모를 올해의 절반 이하로 줄일 계획이다. 4조원 이상을 투자해 청주 공장에 신설하려고 했던 반도체 라인 증설 계획도 보류했다. 현대자동차 또한 당초 9조2000억원이었던 올해 투자 규모를 8조9000억원으로 낮췄다.화학 업계도 투자 속도를 조절하고 있다. 금호석유화학은 의료용 장갑 원료로 사용되는 주력 제품인NB라텍스 증설 투자 종료 시점을 기존 2023년 12월 31일에서 2024년 4월 30일로 늦췄다. 원자재 가격 상승과 환율 상승으로 투자 비용이 늘어난 데다 원자재 조달도 어려워 투자 일정을 바꾼 것으로 알려졌다.감원 바람도 분다. 3분기 이익이 지난해에 비해 반 토막(-52%) 난 증권 업종이 가장 먼저 감원에 들어갔다. 케이프투자증권이 법인부와 리서치사업부를 폐지한 데 이어, 이베스트투자증권도 기업금융(IB) 부문 감원을 검토 중이다.대한상공회의소 산하 연구기관인 지속성장이니셔티브(SGI)는 내년 취업 증가율이 0.5%에 그칠 것으로 봤다. 올해 취업증가율(2.7%)보다 크게 낮아지는 것이다. 김천구 대한상의SGI연구위원은 “내년에는 기업들이 수익성 악화 등으로 채용 규모를 축소하고 구조 조정을 할 가능성이 커 구직난이 심해질 수 있다”고 했다."
2024-12-25,"[사설] 석유화학 구조조정, 탄핵 정국에 실기할까 걱정","최상목 부총리 겸 기획재정부 장관이 23일 서울 종로구 정부서울청사에서 열린 경제관계장관회의 겸 산업경쟁력강화 관계장관회의에서 발언하고 있다. 연합뉴스━업계 자율에만 맡기지 말고 정부가 더 적극 나서야━정책 컨트롤타워 부재…국조실이 관계 부처 독려를정부가 그제 글로벌 공급 과잉으로 적자에 허덕이고 있는 석유화학 업계의 구조조정 방안을 발표했다. 경쟁력을 높이기 위해 업계의 자율적인 사업 재편과 친환경·고부가가치 전환을 유도하는 내용이다. 석유화학 구조조정은 늦은 감이 있다. 중국·중동에서 석유화학 설비가 급증했고, 더 싸고 효율적으로 범용 제품을 쏟아낸 지 이미 오래다. 일본과 유럽은 일찌감치 점진적인 구조조정을 통해 설비 축소에 들어갔다. 2010년 대비 2023년 석유화학 설비 규모를 일본은 15%, 유럽연합(EU)은 9% 줄였다. 하지만 같은 기간 한국은 70% 늘렸다. 일본·유럽은 고부가가치 제품을 키웠지만 한국은 나프타분해설비(NCC) 같은 범용 제품에 몰려 있다. 업계의 자율적인 구조조정은 그다지 성공적이지 못했다.석유화학은 지난해 우리나라 주요 수출품 5위를 기록한 주력 산업이다. 그런데도LG화학·롯데케미칼·한화솔루션·금호석유화학 등 석유화학 ‘빅4’의 올 들어 3분기까지 누적 영업손실은 5000억원대에 달한다. 석유화학 업황의 어려움은 일시적이라기보다 구조적이다. 글로벌 공급과잉 규모는 지난해 4400만t에서 2028년 6100만t까지 늘어날 것이라고 한다. 범용 제품을 줄이고 고부가가치 제품을 키우는 사업 재편 없이는 중장기적으로 생존이 힘들다. 석유화학뿐 아니라 철강·전자·디스플레이 등 중국산 범용 제품에 밀리는 분야가 한둘이 아니다. 지난 9월 무역협회는 “반도체를 빼면 중국이 한국을 다 따라잡았거나 추월했다”는 진단을 내리기도 했다.시장 자율의 구조조정을 지원하는 것을 넘어서 정부가 좀 더 적극적으로 업계와 머리를 맞대고 구조조정을 독려할 필요가 있다. 대규모 장치산업인 석유화학의 특성을 고려할 때 기업 스스로 사업부나 공장 단위 매각을 하는 게 쉽지 않다. 그렇다고 정부가 주도하는 ‘빅딜’이 꼭 정답은 아니다. 과거 정부가 직접 지휘했거나 채권단을 앞세워 배후에서 영향력을 행사했던 자동차·반도체·해운 빅딜은 시간이 지날수록 평가가 박해졌다. 하지만 회사마다 이해관계가 첨예하게 엇갈리는 구조조정을 업계 자율에만 맡기는 것도 답이 될 수 없다. 사업 재편의 유인책을 강화하는 동시에 업계 구조조정을 압박하고 독려하는 정부의 역할이 필요하다.일각에선 나중에 책임질 일은 피하려는 정부의 보신주의를 지적하기도 한다. 구조조정에는 강력한 컨트롤타워의 교통정리가 필요하다. 탄핵 정국에 정부가 역할을 제대로 할지 걱정된다. 개점휴업 상태인 대통령실을 대신해 국무조정실이 적극적으로 나서 부처 간 이견을 조정하고 구조조정을 강력하게 독려하는 역할을 해야 한다. 정부 어디선가 누군가는 할 일을 해야 한다."
2024-10-22,"플랜코리아·금호석유화학, ‘푸른꿈 자람터’ 환경개선사업 참여","지난 5월 국제구호개발NGO플랜코리아와 첫 사회공헌 활동을 시작한 금호석유화학이 여아들을 위한 위생 지원(생리대)과 함께 지역아동센터에서 보호받고 있는 아이들을 더 나은 환경에서 생활하고 공부할 수 있도록 지원하는 ‘푸른꿈 자람터’ 환경개선사업에 참여했다. 올해 사회공헌 활동은 경기도 광주, 광명, 수원, 파주 등 4개소의 지역아동센터에서 진행됐다.금호석유화학은 이번에 지역아동센터4개소의 환경 개선을 위해 약 30명의 임직원이 직접 자원봉사에 참여하여 센터환경 개선작업 참여와 대청소를 진행했다.지난 17일 파주지역 아동센터 봉사활동에서는 현판 전달식을 진행하며 2024년 사회공헌 활동을 정리하기도 했다.2024년 봉사활동은 지난 21일 마지막 센터 환경개선활동을 끝으로 마무리됐다. 금호석유화학은 플랜코리아와 함께 아동복지시설에 대한 지속적인 지원을 이어 나갈 예정이다.플랜코리아의 ‘푸른꿈 자람터’ 지원사업은 아동복지시설을 대상으로 환경개선을 포함한 다양한 교육 및 정서지원 프로그램을 제공한다. 플랜코리아와 금호석유화학의 이번 사회공헌 활동은 지역사회와의 협력 및 아동들의 삶의 질 향상에 기여하는 의미 있는 발걸음으로, 기업의 사회적 책임을 다하는 모습이 더욱 부각되고 있다.플랜코리아 관계자는 “주요 기업들이 플랜코리아와 함께하는 사회공헌활동의 중요성을 재조명하고 있으며, 앞으로도 지속적인 관심과 참여가 이루어지길 기대한다.”고 전했다."
2024-04-22,"다와, 금호석유화학과 탄소중립 실천 위한 업무협약 체결","㈜다와는 금호석유화학의 친환경 및 기후변화 대응을 위한 기후캠페인인 ‘다시불러 텀블러’를 위해 반들이 시스템 업무협약을 체결했다. 이번 협약은 금호석유화학 본사에서 진행되었으며, 임직원의 친환경·기후변화 대응 의식고취와 환경부 한국환경공단 탄소중립 녹색생활 실천포인트 활성화를 목표로 하고 있다.금호석유화학 남정우 상무(왼쪽) ㈜다와 배병철 대표(오른쪽)업무협약 체결 후 기념촬영을 하고 있다. (사진제공=금호석유화학)??‘다시불러 텀블러’ 기후캠페인은 금호석유화학 사내 환경교육 플랫폼인 “KKPC그린캠퍼스”의 일환으로, 텀블러 사용을 장려하여 일상 속에서 탄소 저감을 독려한다. (주)다와는 자체 개발한 블록체인 기반 탄소 저감QR스티커를 제공하여, 탄소저감QR스티커가 부착된 텀블러를 사용할 때마다 탄소 저감량을 측정하고 성과로 환산할 수 있게 한다.금호석유화학 임직원은 제휴된 카페에서 텀블러를 사용함으로써 일상의 탄소중립 실천노력을 한국환경공단의 탄소중립 실천포인트로 전환할 수 있다. ㈜다와의 반들이 시스템을 통하여 탄소 저감량이 실시간 모니터링되며, 이를 통해 금호석유화학의 탄소저감성과를 명확히 수치화 할 수 있다.(주)다와는 환경부와 한국환경공단의 탄소중립 녹색생활실천포인트 시스템을 제공하는 선정 기업으로, 자체 개발한 블록체인 기술을 활용하여 생활 속에서의 탄소 저감을 촉진한다. 이 기술을 통해 실적을 제공받는 기업들은 온실가스 저감실적으로 활용할 수 있으며, 나아가ESG기준원에 블록체인 기반의 탄소 저감 데이터를 감축실적으로 활용할 수 있다.금호석유화학의 안전환경기획실 남정우 상무는 ""‘다시불러 텀블러’ 기후캠페인은 개인의 탄소발자국을 줄이는 동시에 금호석유화학과 지역사회에 긍정적인 변화를 이끌어 탄소중립 목표달성에 기여할 수 있는 중요한 발걸음이다. 이번 협약을 통해 도입된 반들이 시스템은 탄소중립 노력을 보다 투명하게 만들며, 모든 임직원이 기후변화 대응 활동에 적극 참여하도록 동기를 부여하고 있다."" 라고 밝혔다.㈜다와-금호석유화학의 ‘다시불러 텀블러’ 기후캠페인은 탄소중립 실천을 통해서 기후 위기 극복에 적극적으로 참여하는 모습을 보여주고 있다."
2024-03-04,금호석화 ‘조카의 난’ 재현되나…차파트너스 “자사주 전량 소각하라”,"금호석유화학 그룹이 또다시 분쟁에 휩싸였다. 박찬구 금호석유화학 회장의 조카인 박철완 전 상무가 행동주의를 표방하는 사모펀드(PEF) 운용사 차파트너스자산운용(차파트너스)에 지분을 위임하고 주주제안에 나서면서다.차파트너스는 4일 서울 여의도 서울국제금융센터(IFC)에서 ‘금호석유화학 주주제안 기자간담회’를 열고 주주제안 세부 내용을 공개했다. 이날 차파트너스는 이달 임기가 만료되는 김경호KB금융지주 이사회 의장을 금호석유 감사위원회 사외이사로 추천했다.이어 자기주식 소각을 이사회가 아닌 주주총회에서 할 수 있도록 하는 정관 변경과 2년에 걸쳐 자사주 전량 소각을 요구했다. 금호석화는 지난해 말 기준 18.4%(약 525만주)의 자사주를 보유한 상태다. 차파트너스의 금호석화 지분은 0.03%에 불과하다. 하지만 최근 박철완 전 상무와 관계인들의 지분을 위임받아 지분을 10.8% 수준으로 끌어올린 상황이다.박찬구 금호석화 회장(왼쪽)과 박철완 전 상무. 중앙포토박철완 전 상무는 박찬구 명예회장의 조카다. 2021년 1월 박찬구 회장과 지분 공동보유와 특수관계 해소를 선언한 뒤 회사를 상대로 경영권 분쟁을 벌여왔다. 이후 박 전 상무는 ▶배당 확대 ▶본인의 사내이사 추천 ▶본인에게 우호적인 사외이사 및 감사 추천 등을 골자로 한 주주제안을 제기했지만, 주총 표 대결에서 완패했다.차파트너스 측은 ‘조카의 난 3라운드’라는 해석을 일축했다. 김형균 차파트너스 본부장은 “(앞선 경영권 분쟁과 달리) 차파트너스는 사외이사 1인만을 제안했고 자사주 소각 등 주주환원에 초점을 맞췄다”고 강조했다. 이어 “지난 주주제안은 현 경영진과 박 전 상무 중 누가 더 경영능력이 있는지가 판단 요소였다면, 이번에는 무엇이 더 주주에게 이익이 되는 제안인 지가 핵심”이라고 덧붙였다.관건은 누가 외국인과 국민연금과 소액주주의 표를 얻을 지다. 박찬구 회장 측의 지분율은 15.7%로 차파트너스 측(10.8%)과 약 4~5%포인트 차이가 난다. 소액주주(25%) 외국인(20%) 국민연금(9.2%)의 표심에 따라 결과가 뒤바뀔 수 있는 차이다.차파트너스 측은 이사 선임의 경우, 감사위원 선임 시 대주주 의결권 행사 한도를 3%로 제한하는 상법을 활용하면 표 대결에서 승산이 있다고 자신했다. 자사주 소각 역시 앞서 국민연금 등의 선례를 볼 때 표를 얻을 수 있다고 주장했다. 김형균 본부장은 “지난 한 해 국민연금은 노보노디스크 등 해외 투자기업의 정기주총 자사주 소각 안건에 대해 모두 찬성표를 던졌다”며 “국내 기업에 대해선 찬성 안 하면 모순”이라고 주장했다. 최근 정부가 ‘기업 밸류업 프로그램’을 추진하면서 일반주주 친화적 분위기가 형성된 것도 유리한 점으로 꼽았다.다만, 시장에서는 이번 금호석화에 대한 주주 행동이 차파트너스의 주장대로 일반주주를 위한 행동주의인지, 박 전 상무의 경영권 분쟁의 일환인지 의구심도 제기된다.  박철완 전 상무가 행동주의 펀드에 지분 위임한 배경에 대해 주가를 올린 뒤 지분을 처분하려는 게 아니냐는 의혹도 있다. 이에 대해 김 본부장은 “(박철완은) 개인 최대주주라서 공시 의무가 있기 때문에 시장에서 파는 건 어렵고, 경영권이 없으므로 매수 주체를 찾는 것도 마땅치 않을 것”이라고 말했다."
2023-03-22,"[Biz & Now] 금호석유화학, 1000억원 규모 자사주 취득 후 소각 결정","금호석유화학은 1000억원 규모의 자기주식취득 신탁계약 체결을 결정했다고 21일 밝혔다. 계약기간은 이달 21일부터 9월 20일까지로, 계약 종료 후 취득한 주식은 전량 소각한다. 금호석화는 또 1464억원을 투입해 보통주 주당 5400원, 우선주 주당 5450원의 이익배당을 하기로 했다. 올해 금호석유화학의 자사주 취득 금액과 배당총액을 합산하면 총 2464억원이다. 백종훈 금호석유화학 대표는 “주주가치 제고를 위해 최선을 다할 것”이라고 말했다."
2023-11-03,"[Biz & Now] 박찬구 금호석화 명예회장, 6개월 만에 경영 일선 복귀","올해 광복절 특별사면으로 복권된 박찬구 금호석유화학그룹 명예회장이 금호미쓰이화학 대표에 취임하며 경영 일선에 복귀했다. 지난 5월 경영진에게 회장직에서 물러나겠다는 뜻을 밝힌 지 6개월 만이다. 금호미쓰이화학은 1989년 금호석유화학과 일본 미쓰이화학이 50대 50으로 설립한 회사다. 박 명예회장은 금호아시아나그룹 창업주인 고(故) 박인천 회장의 4남으로, 1976년 한국합성고무(현 금호석유화학)에 입사해 47년간 석유화학 업계에 몸담았다."
2022-07-21,"금호석유화학, 박준경 부사장 사내이사 선임… 3세 경영 본격화","박준경 금호석유화학 사내이사(부사장) [금호석유화학 제공]박찬구 금호석유화학 회장의 아들인 박준경 영업본부장 부사장이 사내이사로 선임됐다.금호석유화학은 21일 서울 중구 시그니쳐타워스 동관에서 열린 임시주주총회에서 사측의 안건이 모두 가결됐다고 밝혔다.이날 주총에는 박 부사장의 사내이사 신규 선임 안건과 함께 권태균·이지윤 사외이사 신규 선임안이 상정됐다.회사 관계자는 “회사 안건이 사실상 만장일치에 가까운 절대적인 찬성을 얻어 승인됐다”며 “수년째 경영권 분쟁을 유도해왔던 주주 박철완과 그 가계의 특수관계인 지분 약 10%를 제외하고, 나머지 의결권 지분의 99%는 회사 측 안에 찬성한 것”이라고 밝혔다.이에 따라 금호석유화학은 3세 경영체제로의 전환이 본격화될 전망이다.이날 박 부사장은 “당사 경영진과 전 임직원은 한마음 한뜻으로 주주가치 제고라는 기업 본연의 역할에 집중할 것”이라고 말했다.금호석유화학은 “경영권 분쟁이라는 외부의 우려와 프레임에서 벗어나 보다 나은 실적 달성을 위해 노력할 것”이라며 “그동안 외부의 지속된 흠집내기 시도에도 지속적으로 현명한 판단을 내려주신 주주들께 감사드린다”고 했다."
2023-03-08,"공정위, 금호석유 박찬구 회장 고발…처남일가 4개 계열사 누락","금호석유화학 그룹 박찬구 회장. 금호석유화학 제공공정거래위원회는 대기업집단 지정을 위한 자료 제출 과정에서 처남 일가가 보유한 회사를 계열사에서 누락한 혐의를 받는 금호석유화학 그룹 박찬구 회장을 검찰에 고발하기로 했다고 8일 밝혔다.기업집단 금호석유화학의 동일인인 박 회장은 2018∼2021년 공정위에 대기업집단 지정을 위한 자료를 제출하면서 지노모터스, 지노무역, 정진물류, 제이에스퍼시픽 등 4개사를 누락한 것으로 조사됐다.지노모터스와 지노무역은 박 회장의 첫째 처남과 그 배우자·자녀들이 지분 100%를, 정진물류와 제이에스퍼시픽은 둘째 처남과 그 배우자·자녀들이 지분을 100% 보유한 회사여서 지정자료에 포함됐어야 한다.공정위는 박 회장과 금호석유화학㈜ 회장부속실, 지정자료 제출 담당자 모두 누락된 4개사의 존재를 오랜 기간 알고 있었던 점, 지분율만으로도 계열사 여부를 쉽게 판단할 수 있었던 점 등을 고려해 자료 허위 제출에 대한 인식 가능성이 상당했다고 판단했다.또 일부 회사의 누락 기간이 6년에 달하고 이를 통해 공시 의무·사익편취 규제 등 경제력 집중 억제 시책 적용을 피한 점, 3000만원 상당의 중소기업 세제 혜택을 받은 점 등을 고려할 때 중대성도 상당하다고 봤다.민혜영 공정위 기업거래정책과장은 ""지정자료 제출 의무를 이 정도로 경시하고 방기하는 경우는 흔치 않다""며 ""계열사 누락 행위는 경제력 집중 억제 시책의 근간을 훼손한다""고 말했다.공정위는 누락 사실을 공정위가 먼저 인지했고 공정위가 2021년 지정자료 보완을 요청해 정진물류가 계열사임을 인지할 수 있었던 점, 공정위 조사 협조가 미흡했던 점 등을 고려해 박 회장을 검찰에 고발하기로 했다고 설명했다.이에 대해 금호석유화학은 이날 ""금호아시아나그룹과의 계열 분리 및 대기업집단 지정 과정에서 실무자가 법령상 계열사를 혼동해 누락한 것""이라며 ""업무 관련성이나 거래 관계가 일절 없었고 일감 몰아주기·승계를 위한 계열사 은폐가 아니었다""는 입장을 밝혔다.그러면서 ""누락된 회사들은 금호석유화학 그룹과 아무런 관계가 없는 회사임을 공정위도 인정해 계열사에서 제외했다""며 ""회사는 재발 방지를 위해 전담 부서를 신설하고 인력을 보강했다""고 덧붙였다.금호석유화학은 공정위가 지정자료 허위 제출에 대한 조사를 시작한 뒤 친족독립경영에 따른 계열 제외를 신청해 인정받았다.박 회장은 2018∼2021년 지정자료 제출 때 친족 17명과 4개 비영리법인도 누락했으나 이 부분은 경고 조치됐다."
