date,title,content
2022-03-20,1003원→46만원 스톡옵션 대박…신동빈 제친 연봉 1위 누구,"김효섭 전 크래프톤 대표. 지난해 스톡옵션 행사이익을 포함해 총 218억원의 보수를 받은 것으로 집계됐다.김효섭 전 크래프톤 대표와 이완재SKC사장이 지난해 보수를 가장 많이 받은 기업인으로 집계됐다. 이는 오너경영인인 신동빈 롯데그룹 회장(3위)과 정의선 현대자동차그룹 회장(5위)보다 많은 액수다.━보수 100억 넘는 기업인 4명20일 기업데이터연구소CEO스코어에 따르면 지난 17일까지 사업보고서를 제출한 기업의 개인별 보수 총액을 조사한 결과 지난해 5억원 이상 받은 기업인은 총 1088명으로 집계됐다. 2019년에는 1709명, 2020년에는 1857명이었다.보수가 100억원을 넘는 기업인은 4명이었다. 보수 총액 상위 ‘톱10’ 중에는 오너 일가가 5명, 전문경영인이 5명이었다. 이번 집계는 순수 보수총액 기준으로, 퇴직소득·퇴직소득한도초과액은 제외하고 주식매수선택권(스톡옵션) 행사이익은 포함했다.이에 따르면 김효섭 전 크래프톤 대표의 지난해 보수총액은 218억500만원이었다. 그는 2020년 10억4200만원(596위)을 받았으나 지난해 스톡옵션 행사로 1위로 올라섰다.김 전 대표는 네오위즈와 블루홀 등을 거쳐 크래프톤 대표이사를 지냈다. 블루홀 초기부터 합류해 크래프톤으로 사명을 변경하고, 회사가 성장하는 데 크게 기여했다는 평이다. 그는 재임 중 스톡옵션으로 4만1500주(당시 행사가격 1003원)를 받았고, 퇴사하면서 이를 매도했다. 매도 당시 주가는 46만9000원으로, 행사이익은 198억9000만원에 이른다.이완재SKC사장도 스톡옵션 행사이익 192억4800만원을 포함해 총 213억2700만원을 받아 2위에 올랐다. 이 사장은SKE&S 등SK그룹의 에너지 계열사에서 주로 근무했고, 그룹 내에서 신사업 발굴 전문가로 통한다.2021년 기업인 보수 상위권 누가 차지했나( 퇴직소득 제외시). 그래픽=김은교kim.eungyo@joongang.co.kr━스톡옵션 빼면 신동빈 1위이어 보수총액이 많은 이는 신동빈 롯데그룹 회장(146억8700만원)이다. 스톡옵션을 뺀 보수만 따지면 신 회장이 1위다. 롯데케미칼 등 6개 기업의 보수 합계액으로, 아직 사업보고서가 공개되지 않은 롯데물산과 호텔롯데까지 합산하면 보수총액은 더 늘어날 수 있다. 4위는 조정우SK바이오팜 사장(117억4000만원)이었다. 2020년(11억4700만원)에 비해 105억9300원 올랐다.정의선 현대자동차그룹 회장(87억7600만원)과 김기남 삼성종합기술원 회장(86억4400만원), 조현준 효성그룹 회장(79억7500만원), 박문덕 하이트진로 회장(78억2500만원), 류진 풍산그룹 회장(77억6200만원), 강정구 삼성증권 영업지점장(68억5500만원)이 5~10위에 올랐다. 강정구 영업지점장의 경우 급여는 7800만원이지만 상여금이 67억6300만원으로 기타 근로소득까지 포함하면 대표이사인 장석훈 사장(23억1200만원)보다 보수를 많이 받았다.━퇴직소득 합산하면 정몽구 1위2021년 기업인 보수 상위권 누가 차지했나(퇴직소득 포함시). 그래픽=김은교kim.eungyo@joongang.co.kr퇴직소득을 합산하면 정몽구 현대차그룹 명예회장의 보수가 302억3400만원(퇴직소득 297억6300만원)으로 1위에 올랐다. 고(故) 신춘호 농심 전 회장이 퇴직소득 171억8100만원을 포함해 175억700만원을 받아 4위, 서정진 셀트리온 명예회장이 퇴직소득 126억9300만원을 포함해 134억4500만원을 받아 6위를 기록했다.또 삼성전자 고동진·김현석 전 사장과 김상균 전 법무실장도 퇴직소득을 포함하면 톱10 안에 들었다. 고동진·김현석 고문은 50억원 이상의 퇴직소득을 받아 각각 118억3800만원, 103억3400만원을 받아 7위와 9위에 올랐다. 김상균 전 법무실장도 퇴직소득(37억7500만원) 포함 시 95억6900만원으로 10위를 차지했다.한편 2020년 집계에서는 김택진 엔씨소프트 대표가 184억1400만원을 받아 1위에 오른 바 있다. 올해는 아직 사업보고서가 공개되지 않아 이번 집계에 포함되지 않았다.━직원당 평균 급여 1억 넘긴 회사 늘어한편 직원 평균 보수 총액이 1억원을 넘긴 회사도 늘고 있다. 20일까지 사업보고서를 낸 회사들의 지난해 직원 1인 평균 급여액을 본지가 확인한 결과 국내 4대 석유화학사 중 평균 연봉 1억원이 넘은 기업은 2020년 1곳(금호석유화학)에서 지난해 3곳으로 2곳(LG화학·롯데케미칼) 늘었다. 지난해 사상 최대 실적을 거둔데다 다른 곳보다 근속 연수 등이 긴 게 주요인으로 꼽힌다.화학사 1인 평균 급여액 변화. 그래픽=김은교kim.eungyo@joongang.co.kr포스코와 메리츠화재도 지난해 직원 1인 평균 급여액이 1억을 넘긴 ‘꿈의 직장’으로 나타났다."
2022-03-10,"좌장 이석준이 이끌고, '소주성' 비판 김소영은 경제 책사","윤석열 대통령 당선인의 경제 ‘싱크탱크’는 대체로 관료·학계·정치 세 분야에 나눠 포진했다. 박근혜 정부 등 이전 정부에서 일했거나 문재인 정부의 경제·산업 정책에 비판적이었던 전문가 그룹들이 주로 참여했다.━좌장 이석준, 경제 책사 김소영이석준 전 국무조정실장. 연합뉴스윤 당선인의 경제 공약 전반을 이끌었던 인물로 우선 이석준 전 국무조정실장이 꼽힌다. 윤석열 캠프 초기 좌장 역할을 했던 이 전 실장은 뼈대를 잡은 인물이다. 이후 선대위 축소 과정에서 물러났지만, 윤 당선인과 신뢰 관계가 굳건하다는 전언이다. 박근혜 정부 시절 국무조정실장을 비롯해 기획재정부 2차관·예산실장 등을 거친 정통 관료인 이석준 전 실장은 차기 정부에서도 경제부총리 등 핵심 보직을 맡을 후보로 거론된다.이 전 실장이 정책 전반을 조율했다고 한다면, 실제 윤 당선인이 펼칠 경제 정책을 만든 인물로 김소영 서울대 경제학부 교수가 우선 언급된다. 윤 당선인이 내세운 ‘성장과 복지의 선순환’의 밑그림을 그린 인물이다. 문재인 정부의 ‘소득주도성장(소주성)’을 비판해 이름을 알린 김 교수는 국가 주도 정책이 민간 활력을 떨어뜨렸다고 보고 민간 일자리 창출, 규제 개혁, 고용 유연화 등을 담은 정책 등을 설계했다.한국금융연구원장 출신인 윤창현 국민의힘 의원은 김 교수와 손을 맞춰 경제 정책 전반을 다듬었다. 금융 분야 전문가인 윤 의원은 윤 당선인의 대출규제 완화 등 금융 정책에 주로 관여했다.━부동산·복지·원전 전문가도 참여윤석열 당선인 경북 울진군 신한울 3,4호기 건설중단 현장을 방문, 탈원전 정책 전면 재검토와 신한울 3,4호기 건설 즉각 재개 등 원자력 공약을 발표했다. 윤 당선인 탈원전 폐지 정책에는 탈원전에 반대해 온 원자력 관련 전문가 그룹이 조언한 것으로 알려졌다. 연합뉴스박근혜 정부에서 국토교통부 1차관을 지낸 김경환 서강대 경제학부 교수는 이번 대선 최대 쟁점이었던, 부동산 분야에서 윤 당선인을 도왔다. 실무·이론 둘 다 겸비한 김 교수는 윤 당선인의 ‘원가 주택’과 재건축·재개발 규제 완화, 보유세 인하 등의 정책을 주도해 만들었다.부동산과 함께 관심 사안이었던 에너지 정책은 주한규 서울대 핵공학과 교수가 키를 잡았다. 원자력 발전 확대를 주장해 온 주 교수는 윤 당선인의 문 정부 탈원전 정책 폐지 정책에 관여했다. 또 복지 분야에서는 안상훈 서울대 사회복지학과 교수가 핵심 역할을 담당했다. 안 교수는 현금성 지원보다는 사회서비스 확충을 통해 윤 당선인 경제 정책의 핵심 키워드인 복지와 성장의 선순환을 이뤄야 한다고 본다.━추경호·강석훈·윤희숙 하마평추경호 국민의힘 원내수석부대표. 중앙포토이 밖에도 기재부와 한국개발연구원(KDI) 출신 정치인이 윤 당선인을 도울 가능성이 높다. 우선 기재부 출신 당내 인사 중에서는 원내 수석부대표인 추경호 의원이 먼저 거론된다. 박근혜 정부 기재부 2차관 출신이 추 의원은 행정과 정치 경험이 둘 다 있어 차기 경제부총리 후보로 물망에 오른다. 또 역시 윤 당선인을 도운KDI출신의 윤희숙·이혜훈 전 의원도 경제 분야에 중용될 가능성이 있는 것으로 알려졌다. 장·차관 경험은 없지만, 강석훈 전 청와대 경제수석도 입각 가능성이 거론된다.━재계는 악연…서울법대·충암고 인맥 주목2017년 4월 이재용 삼성전자 부회장 공판에 참석하는 박영수 특검(오른쪽부터)과 윤석열 당시 수사팀장. 윤 당선인은 검사로 재직할 당시 대기업 관련 수사에 많이 참여해, 재계와는 다소 껄끄러운 관계인 것으로 알려져 있다. 연합뉴스재계는 검사 출신으로 대기업 수사를 주로 해 온 윤 당선인과 악연이 많다. 2017년 국정농단 사건 때 특별검사팀 수사팀장이었던 윤 당선인은 이재용 삼성전자 부회장에게 뇌물공여 혐의로 구속기소 했다. 또 2012년 서울중앙지검 특수1부장 시절에는 최태원SK그룹 회장을 계열사 자금 횡령 혐의로 수사해 불구속기소 했다. 2006년 1000억원 대 비자금 관련 사건으로 구속기소 된 정몽구 현대차 회장 수사에도 당시 대검 중수부에 파견된 윤 당선인이 수사를 이끌었다.악연만 있는 것은 아니다. 윤 당선인의 대학과 고교 인맥은 재계 소통 창구로 꼽힌다. 우선 손경식CJ회장 겸 한국경영자총협회 회장은 윤 당선이 서울대 법대 20년 선배다. 손 회장과 공식 행사 등에서 교류한 윤 당선인 지난해 12월 10일 재계 첫 방문지로 경총 간담회를 찾기도 했다.윤 당선인의 충암고 인맥도 있다. 옥경석 한화 기계부문 사장 겸 한화정밀기계 사장, 김태준 아워홈 사장, 차인혁CJ올리브네트웍스 대표이사, 최영무 삼성글로벌리서치 삼성사회공헌업무총괄 사장, 전준영 삼성전자DS부문 구매팀 팀장, 서정곤 부산롯데호텔 대표이사 전무 등이 꼽힌다. 충암고 출신으로 학계 인맥인 박종구 초당대 총장은 금호그룹 창업주 박인천 회장의 막내아들이다. 박삼구 전 금호아시아나그룹 회장과 박찬구 금호석유화학 회장이 박 총장 형이다. 기자 출신으로 쿠팡 커뮤니케이션 총괄 부사장을 지낸 김영태 씨는 윤 캠프에서 정책본부 커뮤니케이션 실장을 맡았다."
2022-03-24,"국민연금, SK 최태원 이사 선임 반대…하나금융 함영주는 찬성","국민연금. 뉴스1국민연금이SK정기 주주총회에서 최태원SK그룹 회장의 사내이사 선임 건에 대해 반대하기로 했다.국민연금기금 수탁자책임 전문위원회는 24일 제6차 위원회를 열고 하나금융 등 총 16개사의 정기주주총회 안건에 관한 의결권 행사 방향을 심의해 이같이 결정했다.국민연금은 오는 29일 열리는SK정기 주주총회 안건 중 사내이사 최태원 선임에 대해 ""기업가치 훼손 및 주주권익 침해 이력이 있다""고 보고 반대했다.국민연금은 함영주 하나금융그룹 사내이사 선임 건은 찬성했다. 앞서 국내외 의결권 자문기관은 재판·제재 문제가 있는 함영주 이사 선임안에 반대할 것을 권고했다.국민연금은 오는 25일 열리는 하나금융 정기 주주총회 안건 중 이사 보수한도 및 특별공로금 지급은 과다하다고 판단해 반대했지만, 그 외 안건에는 모두 찬성했다.우리금융 주총 안건 중 사외이사 송수영 선임 건도 중요한 지분·거래관계 등에 있는 회사의 상근임직원 등 이해관계를 따져 반대했다.사외이사 노성태·박상용·장동우와 감사위원회 위원이 되는 사외이사 정찬형, 감사위원 노성태·장동우 선임 건, 그리고 이사 보수 한도 건에도 반대했다.국민연금은KB금융 정기 주주총회 안건 중 사외이사 김영수 선임에 대해 ""중요한 지분·거래 관계 등에 있는 회사의 상근임직원에 해당하는 등 이해관계가 있다""며 반대를 결정했다.한편 국민연금은 카카오 주총 안건 중 '이사회 내 보상위원회 결의로 특별공로금을 지급한다'는 내용의 이사 퇴직금 지급규정 개정안에 대해서도 ""이사회 결의사항으로 유지함이 적절하다""며 반대표를 행사하기로 했다. 그 외 안건은 모두 찬성했다.넷마블과 관련해서는 김준현의 사외이사 선임 및 감사위원회 위원 선임 건에도 ""중요한 지분·거래관계 등에 있는 회사의 상근임직원에 해당한다""며 반대했고, 이사 보수 한도에 대해서도 반대했다.아울러KCC글라스 안건 중 '정관에서 명칭 등을 정하지 않은 이사회 내 위원회를 이사회 결의로 설치한다'는 정관 일부 변경안은 ""이사회 기능을 약화할 우려가 있다""며 반대했다.금호석유화학의 현금배당 안건과 관련해서는 주주제안(보통주 1만4900원·우선주 1만4950원)보다 이사회안(보통주 1만원·우선주 1만50원)이 중장기 투자계획 등을 고려할 때 더 적정하다며 이사회안에 찬성, 주주제안에는 반대했다.또 사외이사 박상수·박영우, 감사위원 박상수 선임에는 찬성하고, 사외이사 이성용·함상문, 감사위원 이성용 선임에는 반대했다.DGB금융의 이사 보수 한도, 한국투자금융의 임원퇴직위로금 지급 규정, 한국앤컴퍼니의 사내이사 조현범 선임 건에도 반대했다. 셀트리온 안건에는 모두 찬성했다.HDC현대산업개발의 사외이사 권인소 선임과HDC사내이사 정경구 선임,SK이노베이션 기타비상무이사 장동현 선임과 동국제강 사내이사 장세욱 선임에도 각각 반대했다."
2022-11-03,화학물질 제조업체 10곳 중 한 곳은 누출로 인한 산업·시민재해 유발 위험,"2012년 경북 구미의 한 업체에서 불산가스가 누출돼 지역사회가 큰 피해를 입었다.CCTV를 통해 확인된 불산가스 누출 당시 상황. 가스가 순식간에 누출되면서 작업자를 뒤덮고 있다. 연합뉴스2월 10일 경남 창원 두성산업에서 근로자 16명이 급성 화학 중독을 일으켰다. 제품 세척 공정 도중 화학물질에 노출됐다. 검찰은 대표이사를 중대재해처벌법 위반 혐의로 기소했다. 중대재해법이 발효된 뒤 이 법이 적용된 첫 기소다.지난해 1월에는LG디스플레이 파주공장에서 화학물질이 누출돼 7명이 다쳤다. 올해 9월에는 금호석유화학에서 화학물질이 누출돼 14명이 치료를 받았다.10년 전인 2012년 9월에는 구미산업단지에서 불산이 누출돼 주민 1만2000여 명이 병원 신세를 져야 했다. 과수원을 비롯한 농가도 큰 피해를 입었다.화학물질로 인한 사고는 이처럼 대형화하는 경향이 있다. 그러나 아직도 화학물질을 다루는 기업들이 안전에 소홀한 것으로 나타났다. 고용노동부의 감독 결과다.고용부는 지난 4월부터 3개월가량 화학물질을 제조·수입하는 사업장 1348개소를 대상으로 자율점검을 실시했다. 이행실태 자율점검표를 배포하고 안전조치를 제대로 시행하고 있는지 자체적으로 점검해 결과를 보고토록 했다. 2만8266건의 물질안전보건자료를 제출받았다.이를 토대로 고용부는 법 위반이 의심되는 214개소를 추렸다. 이들 업체를 대상으로 감독한 결과 121개소에서 법 위반 사실을 적발했다.사업주가 반드시 해야 하는 의무 조치인 근로자 대상 특수건강검진을 아예 빼먹거나 작업장 내 유해물질을 수시로 제거하는 국소배기장치 성능을 유지하지 않은 업체가 23개나 됐다. 심지어 화학물질 취급 경고 표시조차 없거나(30.6%) 근로자를 대상으로 한 취급 교육도 하지 않은 곳(21.5%)도 수두룩했다.이렇게 되면 화학물질을 다루는 도중에 자칫하면 물질 누출 등으로 대규모 중독 사태가 빚어질 수 있다. 누출된 화학물질이 지역사회에 퍼지면 시민재해로 비화할 수도 있다.고용부는 6개소의 8건을 사법처리하고, 120개소에 대해서는 2억4969만원의 과태료를 부과했다."
2024-03-22,금호석화 ‘3차 조카의 난’ 또 실패…주주제안 모두 부결,"금호석유화학은 22일 제47기 정기주주총회를 개최했다. 금호석유화학 제공박찬구 금호석유화학 회장의 조카인 박철완 전 금호석유화학 상무가 행동주의펀드와 손잡고 경영권 공격에 나섰으나 패배했다. 박 전 상무 쪽이 제안한 안건들이 주주총회에서 모두 부결되거나 폐기됐다.금호석유화학은 22일 제47기 정기 주주총회를 열고 정관 일부 변경의 건과 감사위원회 위원이 되는 사외이사 최도성(한동대 총장) 선임 건 등 7개 안건을 가결했다.정관 일부 변경 안건은 자사주 처분·소각 사항을 이사회가 결의하도록 하며 신기술 도입, 전략적 제휴, 합작회사의 설립, 재무구조 개선, 운영자금 조달, 임직원에 대한 보상 및 기타 회사의 경영권 목적 등을 종합적으로 고려해야 한다는 내용이다. 정관 일부 변경 안건은 의결권 있는 주식의 74.6%가, 사외이사 선임 안건은 76.1%가 각각 찬성했다.반면 금호석유화학의 개인 기준 최대주주인 박 전 상무(지분 9.01%)의 주주 권한을 위임받은 차파트너스자산운용이 제안한 안건은 모두 부결·폐기됐다. 차파트너스는 △주총 결의로 자사주 소각 △기존에 보유한 자사주(524만8834주) 100% 소각 △김경호 케이비(KB)금융지주 이사회 의장 사외이사 선임 등을 주주제안으로 내놨다. 특히 자사주 100% 소각의 경우 “소액주주 권익 침해를 개선해야 한다”는 근거를 들었으나 안건은 부결됐다. 그 대신 금호석유화학 쪽은 향후 보유 자사주의 50%(262만주)를 3년간 순차적으로 소각하기로 했다.박철완 전 금호석유화학 상무. 연합뉴스이날 주총 결과에는 국민연금의 결정이 큰 영향을 미쳤다. 9.08% 지분을 가진 국민연금은 금호석유화학 쪽의 손을 들었다. 국민연금 수탁자책임 전문위원회는 전날 자사주 100% 소각 안건은 반대, 사외이사 선임 건은 최도성 후보 찬성으로 의결권 행사를 결정했다.업계에서는 박 전 상무의 경영권 공격이 또 실패로 돌아갔다는 평가가 나온다. 박 전 상무는 고 박정구 금호그룹 회장의 장남이자 박찬구 금호석유화학 회장의 조카다. 박 전 상무는 지난 2021년 주총에서도 자신의 사내이사 선임 등을 직접 주주제안했으나 실패했다. 2022년 주총에서도 이익 배당, 사외이사·감사위원 선임 등을 주주제안했지만 부결됐다. 지난해에는 금호석유화학그룹과 오씨아이(OCI)그룹이 합작법인을 설립하면서 315억원 규모의 자사주를 상호 교환하자 이를 경영권 방어 목적이라고 주장하며 처분 무효소송을 냈지만 패소했다.한편 금호석유화학 주가는 박 전 상무가 차파트너스와 손을 잡았다고 밝힌 지난달 15일부터 3영업일 동안 2만5400원(18.6%)이 오른 16만1500원(19일 종가)까지 기록했지만, 그 후 다시 내림세로 바뀌어 이날 14만300원에 장을 마감했다."
2023-03-08,"공정위, 박찬구 금호석유화학  회장 고발…친족 계열사 보고 누락","‘살수차 수출’ 지노모터스 등 처남일가 계열사 4곳금호석유화학. 연합뉴스공정거래위원회가 총수일가 보유 4개 계열회사의 신고를 누락해 지정자료를 허위로 제출한 박찬구 금호석유화학 회장을 검찰에 고발하기로 했다. 박 회장이 빠뜨린 계열사 4곳 중에는 살수차 등 시위 진압용 장비를 만들어 타이·이란 등에 수출한 지노모터스 등이 포함됐다.공정위는 8일 대기업 집단 금호석유화학의 총수(동일인)인 박찬구 회장이 2018∼2021년에 기업집단 지정자료를 제출하면서 소속회사 ㈜지노모터스, ㈜지노무역, ㈜정진물류, ㈜제이에스퍼시픽 등 4개사를 누락한 행위를 적발해 고발한다고 밝혔다. 공정위는 대기업 총수의 계열사 누락·허위 신고에 대해 ‘인식 가능성’과 ‘중대성’에 따라 고발 여부를 결정하는데, 이번 건은 박 회장이 누락된 회사를 인지하고도 고의로 배제했다고 판단한 것이다.누락된 4개사는 박 회장의 처남 일가가 지분을 100% 보유한 회사들이다. 2018∼2020년 지정자료에서 누락된 지노모터스와 지노무역은 박 회장의 첫째 처남 일가가 지분을 100% 갖고 있었다. 정진물류와 제이에스퍼시픽(2018년 청산 종결로 간주)도 둘째 처남 일가가 지분을 100% 보유했다. 이 가운데 지노모터스는 특장차 제조사다. 2020년 타이 민주화 운동이 벌어졌을 때 시위대를 진압하는 데 지노모터스가 만든 ‘한국산 살수차’가 동원된 사실이 드러나 논란이 인 바 있다.공정위는 앞서 박 회장에게 친족 회사에 대한 계열사 여부를 확인해달라고 요청한 점을 들어 계열사 누락의 ‘고의성’을 주장했다. 공정위는 “(박 회장은) 2021년 지정자료 제출 과정에서 친족 회사에 대한 계열회사 여부를 확인 요청받은 뒤 내부적으로 검토하고도 둘째 처남이 보유한 정진물류를 은폐했다”고 지적했다. 공정위는 △박 회장이 지정자료에 대해 직접 보고를 받고 인감날인 및 자필서명을 해온 점 △금호석유화학 회장부속실에서 총수 친족들이 보유한 회사 정보를 관리해오고 있던 점 △금호석유화학 지정자료 제출 담당자 역시 친족들이 누락된 4개사를 보유하고 있었던 사실을 인지한 점 등도 강조했다. 누락된 회사들이 그동안 공시 의무 등 규제를 피해왔고 일부는 중소기업에 적용되는 세제 혜택을 받은 점도 사안의 ‘중대성’을 키웠다.금호석유화학 쪽은 ‘실무자의 혼동’으로 인한 실수라고 주장했다. 금호석유화학 관계자는 “2016년 갑작스러운 계열분리 및 대기업집단지정 당시 실무자가 법령상 계열회사 혼동으로 누락된 사항이다. 공정위도 이들 4개사를 금호석유화학 및 계열사와 아무런 관계가 없는 회사로 보고 친족독립경영 인정을 통해 계열제외 조치를 했다”며 “일감 몰아주기나 승계를 위한 계열회사 은폐 등 업무 관련성 및 거래관계는 일절 없었다. 재발방지를 위한 전담부서를 신설하고 인력을 보강했다”고 밝혔다. 앞서 금호석유화학은 2018년에도 임원이 보유하고 있던 청해소재를 계열회사에서 누락해 공정위 ‘경고’를 받은 바 있다."
