date,title,content
2024-12-05,"현대차 노조 '정권 퇴진' 부분 파업..노동계 ""불법 파업 우려""","민주노동조합총연맹 전국금속노동조합 소속 현대차지부와 한국지엠지부가 5일 오후 2시부터 나란히 2시간 파업에 돌입한다. 사진 뉴스1현대차와 한국지엠 노동조합이 5일부터 이틀간 부분 파업에 돌입한다. 상급단체인 민주노총 금속노조의 지침에 따라 지역별로 열리는 윤석열 퇴진 집회에 참여하기 위해서다. 기아도 확대간부 파업에 돌입한다.5일 노동계에 따르면 민주노총 현대차지부는 비상계엄을 선포했던 윤석열 대통령 퇴진을 요구하며 파업에 돌입한다. 현대차 노조는 이날 소식지를 통해 ""전 조합원이 5일과 6일 주·야간 각 2시간씩 파업한다”고 밝혔다.다만 이번 파업은 목적이나 절차에서 불법 가능성이 크다는 게 노동계의 시작이다. 노동계 관계자는 “노조가 파업에 들어가기 위해서는 노동위원회 조정 절차를 거치고 조합원 찬반 투표가 필요한데 이 과정이 없었다""며 절차상 문제를 지적했다. 이어 “근로조건 향상이라는 쟁의행위 목적에도 부합하지 않는 것으로 보인다”고 말했다.현대차 노조는 근무조별로 1조는 오후 1시 30분부터 오후 3시 30분까지, 2조는 오후 3시 30분부터 5시 30분까지 파업에 돌입한다. 상시주간과 일반직, 남양연구소와 판매직, 서비스직, 모비스 등은 퇴근 2시간 전 파업한다.파업 이틀 차인 7일엔 현대차 노조 간부들만 특근을 거부하고 서울 광화문에서 열리는 금속노조 결의대회에 참가할 예정이다. 기아는 부분파업에 나서지 않고, 노조 간부들만 집회에 참여하기로 했다.민주노총 한국지엠지부도 전반조가 오후 1시 40분부터 3시 40분까지 2시간, 후반조가 오후 10시 20분부터 두시간씩, 고정 주간조와 사무직은 오후 3시부터 5시까지 총파업에 돌입한다.완성차 업체의 파업 선언은 상급 단체인 금속노조 지침에 따른 것이다. 금속노조는 4일 서울에서 중앙집행위원회를 열고 윤석열 대통령이 퇴진하지 않을 경우 오는 11일부터 무기한 전면파업에 나선다는 방침을 정했다. 세부 지침 등은 10일 다시 중앙집행위를 열어 정할 계획이다.현대차 노조는 4일 성명서를 내고 “위법적인 계엄령을 선포한 행위는 국민을 상대로 한 선전포고이기에 반드시 책임을 물을 것”이라고 비판했다.완성차 업계에서는 이번 부분 파업으로 인한 생산 차질은 제한적일 것으로 보고 있다. 향후 주말 특근으로 생산량은 맞출 수 있다는 설명이다. 완성차 업계 관계자는 “이번 파업이 근로 조건 향상이라는 쟁의 행위에 부합하지 않는 정치 파업인 만큼 회사 측이 법적 조처를 할지 여부는 추후 상황을 지켜봐야 할 것”같다고 말했다."
2024-12-11,현대차그룹 239명 승진 인사 실시…40대 신규 임원 비율 4년 만에 2배,"현대차그룹이 역대 최고 실적을 경신할 가능성이 큰 가운데 239명에 대한 승진 인사를 실시했다. 승진 규모는 지난해(252명)보다 13명 줄었지만 성과에 대한 보상, 미래 리더십 육성을 기조에 따라 40대 임원들을 발탁했다.10일 현대차그룹은 현대차 73명, 기아 43명, 현대모비스 20명 등 승진 인사를 발표했다. 자동차부문과 비자동차부문에서 각각 194명·45명이 승진했다. 올해 신규임원(상무) 181명과 더불어, 부사장·전무 53명, 사장 4명, 부회장 1명 등이다. 현대차그룹은 “회사·사업별 성과 기여도에 대한 면밀한 검증을 강화함에 따라 지난해와 유사한 수준의 규모로 진행했다”고 밝혔다.현대차에선 최고재무책임자(CFO) 겸 최고전략책임자(CSO)인 이승조(55) 전무가 재무 목표를 초과 달성한 성과를 인정받아 부사장으로 승진했다. 기업활동(IR) 담당 임원인 구자용(61) 전무도 글로벌 3대 신용평가사로부터 A등급을 획득한 성과에 따라 부사장 승진했다. 현대차·기아의 배터리 연구개발(R&D)을 총괄하는 김창환(50) 전동화에너지솔루션담당과 한동희(51) 전동화시험센터장이 각각 전무에서 부사장으로 승진했다.기아에선 글로벌사업관리 본부장인 이태훈(56) 전무가 부사장으로 승진했고, 미국 판매 법인 재무 총괄 등을 역임한 김승준(52) 상무가 전무로 승진하며 최고재무책임자(CFO)에 보임됐다.올해 신규 선임된 임원 중 40대 비중은 41%로, 4년 전(2020년 21%)의 2배 수준이다. 최연소 상무 승진자는 1982년생(42세)인 송현 현대내장디자인실장과 주시현 로보틱스지능소프트웨어팀장이다. 이번 인사에서 그룹 내 여성 임원 승진자는 총 11명으로 지난해(4명)의 3배로 늘었다."
2024-11-23,"현대·기아차, 미국서 전기차 20만8000여대 리콜","현대자동차 아이오닉5. 사진 현대차현대자동차와 기아자동차가 충전 제어 장치 결함으로 미국에서 전기차 20만8000여대를 리콜(결함 보상)한다.22일(현지시간)AP통신은 전날(21일) 나온 미 도로교통안전국(NHTSA) 리콜 보고서를 인용하며 이같이 보도했다.리콜 보고서에 따르면 현대차의 리콜 대상 차량은 2022∼2024년형 아이오닉5, 2023∼2025년형 아이오닉6, 2023~2025년형 제네시스GV6·GV70, 2023~2024년형 G80 등 14만5235대다. 기아차는 2022~2024년형EV6 6만2872대를 리콜한다.미 도로교통안전국(NHTSA) 리콜 보고서. 사진 보고서 캡처이들 차량에서 문제가 된 건 통합 충전 제어 장치(ICCU)다.ICCU는 전기차와 하이브리드 차량에서 충전과 전력 관리를 담당하는 핵심 전자 제어 시스템이다. 이 장치의 트랜지스터가 손상돼 12V(볼트) 배터리 충전이 중단될 수 있으며, 이로 인해 사고 위험이 높아질 우려가 있다.보고서는 ""현대차와 기아 딜러는 문제가 되는 장치를 점검하고 필요하다면 이들 기기를 교체하는 한편 소프트웨어를 업데이트할 예정""이라고 밝혔다.오는 12월과 내년 1월쯤 리콜 대상 차량 소유자들은 편지로 관련 통보를 받을 것이라고AP통신은 전했다."
2024-11-24,"기아·LG전자·삼성전자, 美포브스 ‘엔지니어 위한 최고 기업’…1위는 어디","포브스 선정 ‘미국 내 엔지니어를 위한 최고 기업’.사진 포브스 홈페이지 캡처미국의 경제 전문매체 포브스가 선정한 ‘미국 내 엔지니어를 위한 최고 기업’에 기아와LG전자, 삼성전자가 나란히 이름을 올렸다.24일 업계에 따르면 포브스는 최근 시장조사업체 스태티스타와 함께 엔지니어를 위한 최고 기업 상위 175곳의 명단을 발표했다.이번 조사는 미국 내에서 직원 1000명 이상 규모 사업장을 운영하는 기업의 현직 엔지니어 2만2000여명을 대상으로 경쟁력 있는 보상과 복리후생 수준, 전문 역량 개발 기회, 근무 유연성 등을 종합적으로 평가해 이뤄졌다.포브스는 “현재 미국 노동시장에서 엔지니어 수요는 사상 최고치를 기록하고 있다”며 “특히 소프트웨어, 전기공학, 로봇공학 등 첨단 분야의 기술을 보유한 엔지니어가 부족한 상황”이라고 조사 배경을 설명했다.상위 175곳 중 국내 기업은 기아(53위),LG전자(64위), 삼성전자(71위) 등 3곳이 포함됐다.업계 관계자는 “국내 기업이 현지 고용시장 내 높은 평판을 인정받은 것”이라며 “현지 고용시장이 수요와 공급의 불균형을 겪는 상황이어서 기업의 영향력과 평판을 평가하는 이번 조사 결과에 의미가 있다”고 말했다.미국 뉴저지주LG전자 북미법인 신사옥. 사진LG전자이번 조사에서 1위는 소니가 차지했다. 이어 애플과 구글, 마이크로소프트(MS), 미국 항공우주국(NASA) 순으로 뒤를 이었다.미쉐린 그룹과 미국 최대 송전망 건설사인 번스 앤 맥도널, 일론 머스크의 우주기업 스페이스X,소프트웨어 기업 인튜이트(Intuit), 에너지 인프라 기업 셈프라 등도 상위 10위권 내에 이름을 올렸다.최근 위기를 겪고 있는 반도체 기업 인텔은 14위, 인공지능(AI) 칩 선두주자 엔비디아는 20위를 각각 차지했다."
2024-11-03,"현대차·기아, 국내 신용평가 3사서 ‘올 트리플 A’","서울 서초구 양재동 현대차·기아 본사. 사진 현대차그룹현대차·기아가 국내 주요 신용평가회사 3곳으로부터 모두 최고 신용 등급을 받았다. 글로벌 자동차 시장에서의 경쟁력을 인정받았다는 평가다.3일 현대차·기아에 따르면 한국기업평가(한기평)가 지난 1일 두 회사의 신용등급을AAA로 상향했다.AAA등급은 한기평의 20개 신용등급 중 가장 높다. 또 기아는 같은 날 나이스신용평가(나신평)로부터AAA등급을 받았다.한기평은 현대차에 대해 “글로벌 자동차 시장에서 파워트레인별 경쟁력을 보유하고 있다. 본질적인 수익구조 개선, 우호적 환율 효과 등에 힘입어 시장 평균 이상의 높은 수익성을 유지할 것”이라고 밝혔다. 기아에 대해 한기평과 나신평은 “하이브리드차·전기차·내연기관차 등 다양한 시장수요에 대처 가능한 기술력과 생산역량이 업계 최상위 수준”이라며 “지속적인 투자로 시장 변화 대응력이 더욱 강화될 수 있을 것”이라고 했다.앞서 현대차는 지난 4월 나신평과 지난 9월 한국신용평가(한신평)로부터 각각 ‘AAA’평가를 받았다. 기아는 지난 9월 한신평으로부터 ‘AAA’평가를 받았다. 국내에서 한기평·나신평·한신평은 3대 신용평가회사로 평가받는다. 이로써 현대차·기아는 국내 3대 신용평가회사로부터 나란히AAA평가를 받게 된 것이다.신용평가는 투자자가 돈을 빌려줄 때 원리금을 약속한 대로 돌려받을 가능성을 평가하는 것이다. 상위 등급을 받을 경우 투자 유치가 용이해진다. 자금 조달 시 적용 금리도 낮아져 금융 비용을 절감할 수 있다. 현대차·기아는 최근 글로벌 3대 신용평가회사인 무디스·스탠더드앤푸어스(S&P)·피치 등으로부터 ‘A’등급을 받기도 했다.현대차·기아는 “최근 글로벌 3대 신용평가회사로부터 신용등급 ‘A’를 획득한 데 이어, 국내 신용평가회사 3곳에서도 모두 최고수준 신용등급을 받으며 국내·외에서 우수한 재무 안정성을 인정받았다”며 “앞으로도 재무건전성과 수익성을 지속해서 강화해 안정적인 경영 환경을 유지해 나갈 것”이라고 말했다."
2024-11-01,"자연임신 ‘오둥이’ 가정…기아, 카니발 9인승 선물","30일 기아 정원정 부사장(왼쪽)이 자연 임신을 통해 다섯 쌍둥이를 출산한 사공혜란·김준영 부부에게 카니발 9인승을 전달했다. [뉴스1]기아는 국내에서 처음으로 자연 임신을 통해 다섯 쌍둥이를 출산한 김준영(31)·사공혜란(30)씨 부부에게 ‘더 2025 카니발’ 9인승 차량을 선물했다고 31일 밝혔다.기아는 지난 30일 경기 동두천시청에서 기아 국내사업본부장 정원정 부사장, 박형덕 동두천시장, 김준영·사공혜란 부부가 자리한 가운데 차량 전달식을 열었다. 동두천시에 사는 이들 부부 사이에서는 자연 임신으로 잉태된 남자 아이 3명과 여자 아이 2명이 9월 20일 태어났다.기아는 아울러 경기북부 공동모금회를 통해 총 3000만원 상당의 성금을 동두천시에 전달했다. 성금은 동두천시의 다자녀 가구를 대상으로 한 차량 관련 물품 및 육아용품 지원 사업에 활용될 예정이다."
2024-10-30,연말 판매·수익 다 잡겠다…‘타·팰’ 승부수 띄운 현대차·기아,"현대차·기아가 연말을 앞두고 신형 픽업트럭과 스포츠유틸리티차량(SUV) 신제품을 앞세워 판매량 끌어올리기에 나선다. 신차 효과로 연말까지 수익률과 판매량이라는 두 마리 토끼를 잡겠다는 계획이다.타스만기아는 29일(현지시간) 사우디 제다에서 열린 2024 제다 국제 모터쇼에서 기아 브랜드 최초의 픽업트럭 ‘타스만’을 공개했다. 타스만은 국내를 포함해 미국·스웨덴·호주·중동 등 다양한 지역에서 오프로드 특화 성능, 내구성, R&H(Ride&Handling), 트레일링 안정성, 도하 등 1777종의 시험을 4년에 걸쳐 1만8000회 이상 진행했다.타스만은 가솔린 2.5 터보 엔진과 8단 자동 변속기를 조합해 최고 출력 281마력(PS)을 낸다. 기아는 타스만을 내년 상반기 국내 출시를 시작으로 호주, 중동, 아프리카 등 글로벌 시장에 순차적으로 내놓을 예정이다.연말까지 대형SUV출시도 이어진다. 현대차는 12월 팰리세이드 완전변경 모델을 선보인다. 신형 팰리세이드는 지난 2018년 1세대 출시 이후 6년 만에 나오는 2세대 모델이다. 이번 2세대 모델의 가장 큰 특징은 디젤 엔진이 사라지고 하이브리드 모델이 추가된다는 점이다. 현대차그룹의 차세대 하이브리드 시스템인TMED-Ⅱ가 처음 적용된다.2021 콘셉트카 아이오닉9현대차는 전기차 캐즘(일시적 수요 정체) 속에서도 대형 전기SUV출시를 이어간다. 현대차는 다음 달 미국 로스앤젤레스에서 열리는LA오토쇼에 참가해 아이오닉9을 최초 공개할 예정이다. 아이오닉9은 지난 2021년 11월LA오토쇼에서 공개한 콘셉트 차량 ‘세븐’ 기반의 차량으로 기아EV9과 동일한E-GMP플랫폼에서 생산한다. 배터리는SK온의 99.8kWh용량의 신형 배터리를 사용할 것으로 전망된다. 현대차는 현재 시험 가동 중인 미국 조지아공장에서 아이오닉9를 생산할 예정이다.팰리세이드자동차업계에선 대형SUV인 2세대 팰리세이드와 아이오닉9이 국내뿐 아니라 북미에서 높은 인기를 끌 것으로 예상한다. 미국 시장은 전통적으로SUV가 강세인 데다, 큰 차를 선호한다. 이 밖에 기아는 준중형SUV스포티지의 상품성 개선 모델인 ‘더 뉴 스포티지’도 연내에 출시할 예정이다.현대차·기아가 연말에SUV를 3대나 몰아서 출시하는 이유는 수익성 때문이다.SUV는 일반 승용차 대비 가격이 상대적으로 높아 하이브리드 차량과 함께 고부가 차종으로 분류된다. 현대차·기아는 완성차 업계 비수기인 4분기에SUV신차 출시로 분위기 반전을 노리고 있다."
2024-10-29,"현대차·기아, 신형 픽업트럭에 SUV까지 출격…연말 반등 성공할까","현대차ㆍ기아가 연말을 앞두고 신형 픽업트럭과 스포츠유틸리티차량(SUV) 신제품을 앞세워 판매량 끌어올리기에 나선다. 신차 효과로 연말까지 수익률과 판매량이라는 두 마리 토끼를 잡겠다는 계획이다.기아는 29일(현지시간) 사우디 제다에서 열린 2024 제다 국제 모터쇼에서 기아 브랜드 최초의 픽업트럭 ‘타스만’을 공개했다.기아가 29일(화) 사우디 제다에서 열린 ‘2024 제다 국제 모터쇼(이하 제다 모터쇼)’ 보도발표회에서 브랜드 최초의 정통 픽업 ‘더 기아 타스만(TheKiaTasman,이하 타스만)’을 공개했다. 사진 기아타스만은 국내를 포함해 미국·스웨덴·호주·중동 등 다양한 지역에서 오프로드 특화 성능, 내구성, R&H(Ride&Handling), 트레일링 안정성, 도하 등 1777종의 시험을 4년에 걸쳐 1만8000회 이상 진행했다.타스만은 가솔린 2.5 터보 엔진과 8단 자동 변속기를 조합해 최고 출력 281마력(PS), 최대 토크 43.0킬로그램중미터(kgf·m)를 확보했다. 타스만은 동급 최대 수준인 약 1173리터(L)의 저장 공간에 최대 700kg을 적재할 수 있으며 한국 기준 표준 팔레트(1100x1100mm)도 수납할 수 있다.기아는 타스만을 내년 상반기 국내 출시를 시작으로 호주, 중동, 아프리카 등 글로벌 시장에 순차적으로 내놓을 예정이다.━‘SUV3총사’ 하반기 출시연말까지 대형SUV출시도 이어진다. 현대차는 12월 팰리세이드 완전변경 모델을 선보인다. 신형 팰리세이드는 지난 2018년 1세대 출시 이후 6년 만에 나오는 2세대 모델이다.이번 2세대 모델의 가장 큰 특징은 디젤 엔진이 사라지고 하이브리드 모델이 추가된다는 점이다. 현대차그룹의 차세대 하이브리드 시스템인TMED-II가 처음 적용된다.TMED-II는 구동과 발전 역할을 맡는 2개의 모터를 기반으로 연료 효율성을 크게 향상한 시스템이다.현대차는 전기차 캐즘(일시적 수요 정체) 속에서도 대형 전기SUV출시를 이어간다. 현대차는 다음 달 미국 로스앤젤레스에서 열리는LA오토쇼에 참가해 아이오닉9을 최초 공개할 예정이다.아이오닉9은 지난 2021년 11월LA오토쇼에서 공개한 콘셉트 차량 ‘세븐’ 기반의 차량으로 기아EV9과 동일한E-GMP플랫폼에서 생산한다. 배터리는SK온의 99.8kWh용량의 신형 배터리를 사용할 것으로 전망된다. 현대차는 현재 시험 가동 중인 미국 조지아공장에서 아이오닉9를 생산할 예정이다. 가격 경쟁력을 높여 현지 판매를 확대할 방침이다.자동차업계에선 대형SUV인 2세대 팰리세이드와 아이오닉9이 국내뿐 아니라 북미에서 높은 인기를 끌 것으로 예상된다. 미국 시장은 전통적으로SUV가 강세인 데다, 큰 차를 선호한다.기아는 3년 만에 선보이는 스포티지의 상품성 개선 모델 '더 뉴 스포티지(ThenewSportage)'의 티저 이미지와 영상을 24일 공개했다. 사진 기아이밖에 기아는 준중형SUV스포티지의 상품성 개선 모델인 ‘더 뉴 스포티지’도 연내에 출시할 예정이다. 스포티지는 글로벌 누적 판매 760만대를 기록한 기아의 대표 모델이다. 기아는 이달 중순 티저 이미지를 통해 더 뉴 스포티지의 전·후면부에 적용된 램프 디자인과 차량 실루엣을 부분적으로 공개한 데 이어, 다음 달 디자인과 상세 사양, 가격 등 세부 정보를 공개할 예정이다.━고부가가치SUV판매 집중현대차·기아가 연말에SUV를 3대나 몰아서 출시하는 이유는 수익성 때문이다.SUV는 일반 승용차 대비 가격이 상대적으로 높아 하이브리드 차량과 함께 고부가 차종으로 분류된다. 현대차·기아는 완성차 업계 비수기인 4분기에SUV신차 출시로 분위기 반전을 노리고 있다.독일 바이에른주 뮌헨 외곽 지방 국도에서 촬영한BMW신형 뉴 X3 외관. 사진 연합뉴스수입차 업체들 역시SUV모델에 공들이고 있다. 연초부터SUV라인업을 늘린BMW는 지난달까지 누적SUV등록 대수 2만1985대를 기록하며 수입SUV시장에서 1위에 올랐다. 2위는 벤츠(1만6972대), 3위는 테슬라(1만3981)가 차지했다. 올해 9월 누적 기준 수입SUV등록 대수가 2만대를 돌파한 곳은BMW가 유일하다."
2024-10-28,"기아, 다문화 가정 지원 ‘하모니움’…노들섬 페스티벌로 시작","'하모니움 페스티벌'에 참여한 시민들이 다문화 사회에 필요한 가치를 털실로 연결하는 '키워드 아트월'을 체험하는 모습. 사진 기아기아의 다문화 가정 지원 사업인 ‘하모니움’이 본격 활동을 시작했다. 기아는 다문화 가정의 청소년 자립, 사회적 인식 개선을 지원하기 위해 하모니움을 출범하며 첫 행사로 지난 26일 서울 노들섬에서 ‘하모니움 페스티벌’을 개최했다. 하모니움은 조화를 뜻하는 ‘하모니’와 새싹이 돋는다는 의미의 ‘움트다’를 합성해 지은 이름이다.야외 무대인 ‘하모니존’에선 ‘차이를 넘어 공존으로’를 주제로 토크 콘서트가 열렸다. 한국에서 다문화 가정을 꾸리고 있는 방송인 알베르토 몬디(40)와 강남(37)이 자신의 경험담을 시민들과 나누는 시간이었다.이어 같은 곳에서 ‘서로 다른 소리가 만드는 하나의 큰 울림’을 강조하는 야외 음악회를 열어 가수 존박과 남성그룹 스윗소로우가 공연했다.'하모니움 페스티벌'에 모인 시민들. 사진 기아행사장엔 다문화 배경 참가자들이 만든 상품으로 꾸려진 벼룩시장이 섰다. 또 방명록 등 체험형 전시를 열어 다문화에 대한 이해를 높였다.기아는 하모니움 페스티벌을 시작으로 영상 캠페인 등 다문화 가정에 대한 사회적 인식 개선 사업을 펼칠 계획이다. 기아 관계자는 “다문화 청소년이 건강한 사회 구성원으로 성장해 긍정적인 변화를 불러일으킬 수 있도록 지원하겠다”고 말했다. 내년부터 기아는 연간 50명의 다문화 청소년을 대상으로 사회·경제 강의, 코딩·영상기획 등 실무 교육을 제공한다. 지원 대상 청소년들은 진로 설계와 관련한 인턴십 프로그램에 참여할 수 있고 진로·심리 상담, 동기부여 특강도 받을 수 있다."
