date,title,content
2024-04-01,중소·중견기업에 11조원 금융 지원,"금융위원회는 4월 1일부터 중견·중소기업을 위한 11조원 이상의 금융 지원 프로그램이 가동된다고 31일 밝혔다. 특히 일시적인 유동성 부족을 겪고 있거나 경영난이 예상되는 기업들은 대출 금리를 대폭 할인받을 수 있다.먼저 산업은행과 5대 은행(KB국민·신한·하나·우리·NH농협)은 신성장 분야로 신규 진출하거나 투자 확대를 원하는 중견기업을 위해 6조원 규모의 저금리 대출 프로그램을 출시한다. 성장 잠재력이 높은 9대 테마, 284개 품목으로 구성된 ‘혁신성장공동기준’의 품목을 생산·활용하는 중견기업이 대상이다.IBK기업은행과 5대 은행은 5조원 규모의 ‘중소 법인 기업 대상 금융 비용 경감 특별 프로그램’을 운영한다. 정상적인 영업을 하고 있지만, 이자 부담이 큰 기업을 대상으로 1년간 이자 부담을 경감해준다. 정상 영업 중인 중소기업이 연 5%를 초과하는 금리로 대출받은 경우 1회에 한해 최대 1년간 대출금리를 연 5%까지 감면해준다. 최대 감면 폭은 2%포인트다.최근 1년간 일시적인 유동성 위험에 직면했거나 직면할 것으로 ‘예상’되는 기업도 금융 지원을 받을 수 있다. 위기를 겪을 것으로 예상되는 기업이란 정상 기업이지만 전기 대비 매출액이 10% 이상 감소했거나, 수입보다 지출이 많고 신용위험평가에서 B등급을 받을 것으로 주채권 은행이 판단한 기업을 말한다. 올해 신청한 기업들에 대해서는 1년간 주요 시중은행의 조달 금리 수준(연 3%대)으로 금리를 낮춰 신속한 정상화를 지원한다."
2024-04-14,시청률 70% ‘결혼행진곡’ 연출가 전세권 별세,"‘현대연극 꽃피운 텃밭’ 극단 新協서 10·13·15대 대표 지내2020년 6월 9일 서울 은평구 자택에서 인터뷰한 극단 신협 전세권 전 대표. 이해랑연극상 특별상 수상자. /김지호 기자한국 현대연극을 꽃피운 텃밭과 같았던 극단 ‘신협(新協)’의 전 대표 전세권(85) 연출가가 14일 오전 9시47분 별세했다.1950년 국립극장 전속극단으로 출발한 신협은 이해랑, 김동원, 백성희, 장민호, 최은희 등 당대 최고 연출가·배우들이 활동하며 한국 리얼리즘 연극의 큰 물줄기를 형성한 연극 단체. 전세권은 신협 연수생으로 이해랑 선생에게 연극을 배워 조연출로 시작한 뒤, 10·13·15대 대표와 신협동우회장을 지냈다. 70여편의 연극·뮤지컬을 연출하고, 방송사PD로도 ‘형사’ ‘산유화’ 등 인기 드라마를 만들었다. 2020년 이해랑연극상 특별상을 받았다.“이해랑 선생은 영혼의 아버지”전세권은 평소 “이해랑 선생은 영혼의 아버지, 신협은 마음의 고향”이라고 말했다. 중학교 3학년 때, 그의 아버지가 서울 불광동 2층 양옥집 데려가더니 연극 연출가 이해랑 선생에게 인사를 시켰다. “이제 이 아이는 제 자식이 아니고 선생의 자식입니다. 연극인으로 키우십시오.” 이렇게 말한 뒤 아버지는 혼자 집에 돌아가버렸다. 까까머리 중학생 소년은 집에 돌아가 “도대체 무슨 말씀이냐”고 펑펑 울면서 따졌다. 생전의 그는 “그 때부터 신협은 내 고향, 이해랑 선생은 영혼의 아버지가 됐다”고 했다. 함경도 북청 출신인 전세권의 할아버지는 아버지를 서울로 데려와 12년간 물지게를 지면서 공부시켰다. 하지만 공부를 마친 아버지는 유랑극단을 만들어 전국을 떠돌았다. 전세권은 “아버지가 해방 뒤 인쇄소 사업으로 큰돈을 벌었지만 연극을 향한 꿈을 잊지 못하셨던 것 같다”고 했다. 그에겐 일찌감치 아버지로부터 이어진 연극의 피가 흐르고 있었던 셈이다.우리 연극을 꽃피운 텃밭, ‘신협’‘신협’은 1950년 ‘민족 연극예술의 수립과 창조’를 목표로 설립된 국립극장의 전속극단. 우리 연극의 아버지와 같은 인물인 이해랑과 김동원을 비롯, 백성희, 장민호, 최은희, 황정순 등 당대의 최고 배우와 스태프들이 신협에서 함께 연극을 만들었다. 우리 현대 연극을 꽃피운 텃밭과도 같았던 극단이다. ‘모든 신파적 요소를 제거하고 진정한 사실주의 연극’을 표방하며 셰익스피어, 사르트르, 몰리에르, 실러, 테네시 윌리엄스, 아서 밀러, 유진 오닐, 헨릭 입센, 소포클레스 등의 외국 작품 뿐 아니라 대부분의 작품을 신협에서 상연한 동랑 유치진 선생과 차범석 선생 등 국내 최고 작가들의 최고 작품을 무대에 올렸다.1951년 극단 신협이 대구에서 초연한 '햄릿'.왼쪽부터 최무룡, 김복자, 김동원, 황정순. /이필동, '새로쓴 대구연극사'29살에 국립극단 ‘이민선 연출6·25전쟁 때 그는 부산 피란촌 학교를 다녔다. 당시 중앙중·고와 보성중·고가 함께 수업을 했다. 보성의 교감은 훗날 홍익대 미대 학장을 지내는 화가 이마동 선생, 중앙의 교감은 연세대 철학과 교수를 지내는 김형석 선생이었다. 영어를 가르친 김형석 선생은 햄릿, 맥베스, 오셀로 같은 셰익스피어 작품 얘기를 많이 들려줬다. 19살 때 신협 연구생으로 들어가 이해랑 선생의 조연출로 현장에서 연극을 배웠다. 연극을 하는 틈틈이 시나리오를 썼다. 1962년엔 조선일보 신춘문예 시나리오 부문 가작 당선작이 당대의 인기 배우 김승호, 황정순과 아역으로 안성기가 출연한 영화 ‘지게꾼’으로 만들어졌다. 당시 영화의 신문광고엔 ‘조선일보 신춘문예 가작 당선작’이라는 광고 문구가 선명하다. 1966년엔 29살의 나이로 국립극단 작품 ‘이민선’의 당당한 연출가가 됐다. 이 작품의 첫 표를 산 사람이 스승 김형석 선생이었다.관객 난입 인기 뮤지컬 ‘카니발 수첩’그에 앞서 1965년에는 이해랑 선생의 뜻에 따라 ‘젊은 신협’ 성격의 극단 ‘제3극장’을 만들었다. 음악과 무용, 연극이 어우러지는 뮤지컬을 지향했다. 뮤지컬 ‘새우잡이’와 ‘카니발 수첩’을 연출한 것도 이 때였다. 특히 ‘카니발 수첩’은 장마철 명동 입구 기업은행 본점에서 국립극장(지금의 명동예술극장)까지 우산 쓴 관객이 장사진을 칠 정도로 흥행에도 성공했다. 마지막날 입장 못한 관객들이 국립극장 유리창을 깨고 극장 안으로 들이닥쳐, 무대 주변과 객석 복도까지 모두 점령하고 관람할 정도의 인기였다. 전세권은 60여 년 간 70여 편의 연극을 연출했다.장미희·한진희 ‘결혼행진곡’ 시청률 70%문화공보부 특채로KBS드라마PD로 들어가TBC를 거쳐 다시KBS에서 퇴임할 때까지 드라마 380여편을 연출했다. 장미희와 한진희가 주연한 국내 방송 최초의 주말 연속극 ‘결혼행진곡’이 평균 70%가 넘는 시청률을 기록하고, ‘수사반장’과 쌍벽을 이뤘던 수사물 ‘형사’,유동근 전인화가 출연한 ‘산유화’ 등 숱한 히트작을 만들었다.전세권의 몸은 방송국에 있었지만, 마음은 늘 무대를 향했다. 그에겐 신협의 이름으로 연극을 무대에 올리는 것이 이해랑 선생의 뜻을 받드는 길이었다. 이해랑 선생과 연극계 어른들이 그에게 신협을 맡겼다. 극단 대표를 맡은 뒤엔 방송사PD월급을 담보로 대출을 받아 연극 16편을 무대에 올렸다. 동덕여대 겸임교수를 할 땐 교수 월급을 담보로 은행 대출을 받아 또 연극을 했다.지난 3월엔 연극학자 유민영 교수와 함께 국내 최장수 극단 신협(新協)이 걸어온 길을 정리한 책 ‘극단 신협 1947~2023′(스타북스)을 펴냈다.유족은 부인 박옥련씨와 아들 인환 영화감독, 딸 인경씨, 사위 박정혁 미쓰이소꼬코리아 차장. 발인 16일 7시, 장례미사 16일 8시 명동성당, 장지 용인천주교공원묘원. (02)2072-2020"
2024-04-20,"김어준, 충정로 사옥 건물 70억에 매입…28층 주상복합 재개발 예정","딴지그룹 법인 명의로 매입김어준이 대표이사로 재직방송인 김어준씨가 대표로 있는 ‘주식회사 딴지그룹’이 사옥으로 쓰던 건물을 70억원 대에 매입한 것으로 나타났다. 사옥은 향후 28층짜리 주상복합으로 재개발 될 예정인 서울 서대문구 충정로3가의 재개발 구역 안에 있다. 딴지그룹은 인터넷 매체 딴지일보 등을 운영 중이며, 김씨는 사옥에서 유튜브 방송을 진행한다.방송인 김어준씨. /겸손은 힘들다 뉴스공장 유튜브20일 등기부등본에 따르면 딴지그룹은 작년 9월 임차료를 내며 사용하던 충정로3가 사옥과 토지를 법인 명의로 매입했다. 김씨는 지난 2012년 4월 이 법인의 사내이사에 취임했고, 지난 2022년 11월에는 대표이사 자리에 올랐다. 딴지그룹이 사들인 사옥은 ‘마포로5구역 제2지구 도시정비형 재개발구역’ 내 건물이다. 서울시 도시계획위원회가 작년 6월 이 구역에 대한 재개발 정비계획을 수정 가결한 직후, 건물 매입에 나선 것이다.1970년 지어진 이 건물은 1~5층(연면적 1285㎡) 규모로 근린생활시설과 사무실, 수위실 등으로 구성돼 있다. 거래 가액은 73억2538만원이다. 딴지그룹 사옥의 건물·토지 가격의 시세가 100억원에 달할 것이란 업계 예상에 비해서는 저렴한 가격에 매수했다는 분석이 나온다. 딴지그룹은 2016년부터 해당 건물을 사옥으로 사용해 연 수억원씩 임차료를 내왔다고 한다.딴지그룹은 건물 매입을 위해 70억원가량을 대출 받은 것으로 추정된다. 등기부등본에 따르면 중소기업은행은 작년 11월 해당 건물에 딴지그룹을 채무자로 근저당권을 설정했다. 채권최고액은 84억원으로 나타났다. 업계에서는 채권최고액은 대출 금액의 110~120% 수준으로 정하고 있다.한편, 해당 건물이 속한 마포로5구역 제2지구 도시환경정비사업 조합설립추진위원회는 다음달 18일 총회를 열고 재개발 조합설립 안건을 논의하기로 한 것으로 전해졌다. 계획안에는 국내 최고령 아파트로 알려진 ‘충정아파트’가 포함된 마포로5구역 제2지구에 지하 5층~지상 28층 2개 동에 공동주택 192가구와 근린생활시설 등으로 구성된 주상복합(연면적 4만2000㎡)을 조성하는 내용이 담겼다. 사업은 공공재개발로 추진된다."
2024-03-29,행동주의 펀드 ‘절반의 승리’,"KT&G·JB금융 주총 ‘찻잔 속 태풍’행동주의 펀드의 공세가 거셌던KT&G,JB금융 등의 주주총회가 28일 열렸다. 이날 행동주의 펀드들은 ‘절반의 승리’를 거뒀다. 행동주의 펀드는 주주 권익 보호와 기업 가치 제고를 주장하며 기업 경영에 적극적으로 관여하려는 펀드를 가리킨다.이날KT&G 주총에선 새 대표이사 사장에 방경만(53) 후보가 최종 선임됐다. 앞서 방 후보의 사장 선임에 행동주의 펀드인 플래쉬라이트 캐피탈 파트너스(FCP)와 최대 주주인 기업은행이 거세게 반대했다. 그러나 이날 방 후보는 가장 많은 표(8409만7688표)를 받아 사장이 됐다. 2대 주주인 국민연금이 방 후보의 손을 들어줬기 때문이다.행동주의 펀드인FCP도 성과가 없진 않았다.FCP와 기업은행이 함께 사외이사로 제안한 손동환 성균관대 교수가 두 번째로 높은 득표수(5660만3958표)로 선임됐기 때문이다. 이에 따라 양 진영 인사들이 한 이사회에서 공생하게 됐다. 이날 집중투표제가 적용돼 주주들은 주당 2표를 원하는 후보에게 몰아줄 수 있었다.이날 열린JB금융 주총에서JB금융과 행동주의 펀드인 얼라인파트너스의 표 대결에서도 양쪽 다 ‘절반의 승리’를 거뒀다. 2대 주주인 얼라인이 제시한 ‘비상임이사를 2인으로 증원하는 건’은 부결됐지만, 얼라인이 제안한 후보 중 김기석·이희승 후보가 득표수 1·2위로 이사회 진입에 성공했기 때문이다.이것도 ‘집중투표제’로 주주들이 주당 선임하려는 이사 수만큼 의결권을 받은 후 원하는 후보에게 몰아줄 수 있었기 때문이다. 얼라인 측은 “김기석 사외이사의 선임은 국내 금융지주 역사상 주주 제안을 통해 이사로 선임된 첫 사례”라며 “집중투표제의 중요성과 효과를 잘 보여주는 사례”라고 말했다.올해 주총 시즌에 행동주의 펀드는 정부의 ‘밸류업(가치 상승)’ 프로그램을 등에 업고 거센 공세를 보일 것으로 예상됐으나, ‘찻잔 속 태풍’으로 끝났다는 평가가 나오고 있다. 28일 한국거래소에 따르면, 올해 행동주의 펀드가 주주 제안을 한 기업은 34곳이다. 2022년(28곳)보다는 늘었지만, 지난해(44곳)보다는 줄었다."
2024-03-28,美 北미사일 개발 겨냥 제재…北인사 6명·외국기관 2곳 추가,"북한IT근로자 고용 기업 및 은행 등 제재IT외화벌이 통해 탄도미사일 프로그램 조달조 바이든 미 행정부는 27일 북한 국적자 및 러시아·아랍에미리트 등에 위치한 관련 기관들에 대한 제재를 발표했다. 이는 북한이 계속해서 대량살상무기(WMD) 개발에 나서고 있는 데 대한 대응 조치라고 미 정부는 밝혔다. 북·러가 포탄 등 무기 교류를 통해 밀착하는 상황을 경계하는 미 정부는 러시아 기관도 제재 대상에 올리면서 양국에 대한 압박 수위를 끌어올리는 모양새다.북한 김정은이 24일 조선인민군 근위 서울류경수제105땅크(탱크)사단과 산하 제1땅크장갑보병연대를 시찰했다고 조선중앙TV가 25일 보도했다. /조선중앙TV뉴시스미 재무부는 이날 해외자산통제관리국(OFAC)의 특별지정제재대상(SDN) 명단에 북한 인사 한철만, 전연근, 정성호, 오인준, 리동혁, 유부웅 등 6명을 올렸다고 밝혔다. 이와 함께 러시아 블라디보스토크에 등록된 ‘알리스 유한책임회사’와 아랍에미리트(UAE) 두바이에 있는 ‘파이오니어 벤콘트 스타 부동산’ 등 기관 2곳을 제재 명단에 추가했다.SDN에 등재된 개인들은 미국 내 자산이 동결되고 미국 여행이나 미국 기업들과의 거래가 금지된다.SDN으로 지정된 기관과 거래하는 개인과 기업 또한 세컨더리 제재에 따라 불이익을 받을 수 있다.이번 제재 대상에 오른 북한 인사들은 북한 은행 관계자들과IT근로자들인 것으로 나타났다. 그리고 러시아와UAE에 있는 기업들은 이들 북한IT근로자들을 고용한 기업들이라고 미 재무부는 밝혔다. 북한은 대량살상무기와 탄도미사일 개발 비용을 마련하기 위해 미국을 비롯한 전 세계 기업들을 속여 프리랜서IT노동자로 일을 시켜왔다. 주로 중국과 러시아에서 수천 명의IT노동자들이 북한 정부의 감독 하에IT프리랜서로 활동하고 있다는 게 미 당국의 분석이었다. 재무부는 “이들은 북한 정권에 필수적인 외화벌이를 해왔다”며 “주로 러시아와 중국에 위치한 기업 등을 통해 활동하는 이들은 불법 자금을 제재를 회피하면서 이동시켜 북한의 불법 대량살상무기 및 탄도 미사일 프로그램에 자금을 조달해왔다”고 했다.한미 당국은 북한이 해외 각지에서IT노동자들을 파견해 외화 벌이를 하는 것을 막기 위해 공조해왔다. 작년 5월엔 수천명의IT근로자가 신원과 거주지, 국적을 숨기고 위조 서류를 이용해 일자리를 얻으려 한 사실을 파악하고 이와 관련해 새로운 대북 제재를 발표하기도 했다. 브라이언 넬슨 재무부 차관은 “미국은 한국 등 파트너들과 함께 국제 금융 시스템을 보호하고 북한의 불법 무기 프로그램 자금 조달을 막기 위한 조치를 계속 취해 나갈 것”이라고 했다.조선일보 국제부가 픽한 글로벌 이슈! 뉴스레터 구독하기 ☞https://page.stibee.com/subscriptions/275739국제퀴즈 풀고 선물도 받으세요! ☞https://www.chosun.com/members-event/?mec=n_quiz"
2024-03-19,기업 기후 위기 대응에 정부·민간 ‘맞손’ … 2030년까지 452조원 공급한다,"/뉴스 1기업들이 기후 위기 대응에 나설 수 있도록 정부와 정책금융기관, 5대 시중은행(KB국민·신한·하나·우리·NH농협)이 2030년까지 총 452조원의 금융지원에 나선다.19일 오전 금융위원회는 김주현 금융위원장 주재로 김상협 2050 탄소중립·녹색성장 위원회 민간위원장, 한화진 환경부 장관 등이 참석한 가운데 5대 은행장 및 정책금융기관장과 간담회를 개최하고 이 같은 내용의 기후위기 대응을 위한 금융지원 확대 방안을 발표했다. 유럽연합(EU)의 탄소 국경조정제도, 탄소배출 품목에 대한 규제 강화 등 탄소 중립 관련 규제에 제대로 대응하지 못할 경우 수출 중심인 우리 경제에 악영향이 예상되기 때문이다.이날 간담회에서 김주현 위원장은 “오늘날 우리가 마주한 전례 없는 기후변화는 우리 기업의 경쟁력뿐만 아니라 우리 미래세대를 위해서라도 꼭 풀어야 할 과제”라면서 “정부, 정책금융기관, 은행이 협업을 통해 기후 위기에 대응하는 의미 있는 첫 걸음마를 내딛게 됐다”고 말했다.우선 산업은행·수출입은행·기업은행·신용보증기금·기술보증기금 등 정책금융기관이 2030년까지 총 420조원의 정책금융을 공급한다. 과거 5년간 정책금융기관은 연평균 36조원의 ‘녹색 자금’을 공급해왔는데, 이를 연평균 60조원으로 67% 늘려 2030년까지 총 420조원을 공급하겠다는 것이다. 이를 통해 2030년까지 정부의 온실가스 감축 목표치인 2억9100만톤의 29.5%인 8597만톤의 온실가스를 줄일 수 있을 것이라는 게 금융위의 예상이다.아울러 기업의 청정에너지 수요가 증가할 것으로 예상돼 태양광·풍력·해상풍력 등 신재생에너지 발전시설 증설을 위해 5대 은행과 산업은행이 9조원을 출자해 ‘미래에너지펀드’를 조성한다. 정책금융기관들은 14조원 규모의 후순위 대출을 공급하기로 했다. 이는 2030년까지 신재생에너지 발전시설 증설을 위해 추정되는 자금 188조원을 만들기 위한 마중물 역할을 하게 된다. 나머지 자금은 신재생에너지 사업자와 연기금·자산운용사 등의 모험자본으로 충당한다는 게 금융위의 계획이다. 이에 따라 풍력 등 신재생에너지 발전 비중이 현행 9.2%에서 2030년 21.6%까지 확대될 것으로 정부는 기대하고 있다.이 밖에도 정부는 2030년까지 재생에너지, 탄소 포집, 수소에너지, 온실가스 고정, 친환경 패키징 등 기후기술 분야에 9조원을 투자하기로 했다. 기업은행과 5대 은행이 2030년까지 3조원 규모의 기후기술펀드를 조성하고, 혁신성장펀드에서 5조원을, 성장사다리펀드에서 1조원을 각각 끌어올 계획이다. 기후기술 분야는 앞으로 연평균 24.5%씩 성장할 것으로 기대되는 분야지만, 초기 경제성 부족으로 기술 개발이 쉽지 않은 분야다. 이 때문에 기후기술 산업분야에서 우리나라는 선진국과 기술격차가 3년가량 벌어져 있다."
