date,title,content
2024-10-13,"기아대책, 결연아동 축구대회 ‘호프컵’ 개최...6년 전 참가 아동은 국가대표 됐다","코로나19 유행으로 6년만에 개최과테말라·잠비아 등 10개국 160여명 참가지난 10일 서울 마포구 월드컵 보조경기장에서NGO희망친구 기아대책이 개최한 '2024 호프컵(HOPECUP)'의 예선전이 열렸다./강지은 기자10일 오전 10시쯤 서울 마포구 월드컵 보조경기장에서는 부르키나파소와 에콰도르 등 남녀 어린이 선수가 섞여 축구 경기를 벌이고 있었다. 관중석에서는 “가자! 부르키나파소!”라는 함성과 둔둔, 잼배 등 전통 악기를 이용한 응원 소리가 들려왔다.경기 시작 10분만에 첫 골이 들어가자 선수들이 환호하며 양팔을 하늘로 뻗고 기뻐했다. 이날 밀착 수비를 선보이며 부르키나파소를 5대 1의 승리로 이끈 사누 니코뎀(17)군은 “한 골 한 골 넣을 때마다 짜릿했다”며 “우리 팀은 이미 우승할 준비가 다 돼 있다”고 했다.이날은 국제구호개발NGO희망친구 기아대책이 주최한 해외 결연아동 축구대회 ‘2024 호프컵(HOPECUP)’의 예선전 첫 경기가 열리는 날이었다. 호프컵은 열악한 환경에서 끼니 걱정와 힘든 노동에 시달리는 결연아동들을 한국으로 초청해 다양한 경험을 제공하고자 기아대책이 지난 2016년부터 마련한 경기다. 이전에는 2년마다 열렸지만 코로나19 유행으로 최근 6년간 열리지 않았다. 이번에 열린 세 번째 호프컵에는 과테말라·잠비아 등 10개국의 160여명의 어린이가 참가했다.국제구호개발NGO희망친구 기아대책이 지난 8일 8일 장충체육관에서 ‘2024 호프컵(HOPECUP)’의 개회식을 열고 본격적인 경기에 돌입했다./기아대책호프컵에 참가하는 대부분의 결연아동에게는 이번 한국 방문이 첫 해외여행이다. 비행기를 타는 것도 처음인 경우가 많다. 그래서 참가 아동들은 몇 달 전부터 비행기에서 주의할 점, 에스컬레이터 타는 법 등을 배우고 심지어 계단을 오르는 법을 배우기도 한다. 일부 지역에서는 1층짜리 건물만 있어 계단은 없기 때문이다.과거 호프컵에 참여했던 아동 중에서는 국가대표 축구선수가 된 결연아동도 있다. 지난 2018년 경기에 참가한 몽골의 샤랑게렐 졸자야(19)씨와 키르기스스탄의 누르볼 박티베코프(21)다. 이들은 각국의 국가대표로서 각각 미드필더, 공격수 포지션을 맡고 있다. 이들은 기아대책의 호프컵이 축구선수로서 첫 국제 경기였다며 그 당시를 잊지 못한다고 했다.이들은 10년이 넘도록 축구선수를 꿈꿔왔지만 가정형편이 좋지 않았다고 했다. 샤랑게렐씨는 “시각장애가 있는 홀어머니과 동생들을 챙기며 훈련을 이어왔다”며 “연습을 마치면 집으로 돌아갈 교통비가 없어 집까지 1시간 가까이 걸어가기 일쑤였다”고 한다.기아대책의 결연아동이었던 샤랑게렐 졸자야씨가 국가대표로서 축구경기에 참가한 모습./기아대책박티베코프씨 또한 교육 환경이 마땅치 않아 설탕과 맥주를 만드는 공장에서 운영해준 어린이 축구팀에서 꿈을 키워왔다고 했다. 기아대책은 이들에게 후원자를 연결해주고 10여년간 지원을 이어왔다. 음식은 물론 이들이 신을 축구화와 운동복을 지원했다.이들이 후원 단체에 감사한 것은 무엇보다 응원과 격려였다고 말했다. 샤랑게렐씨는 10년간 후원자와 편지를 주고받았다. 그는 “훈련이 고되어 눈물이 나든 성적이 좋아 기쁘든 후원자에게 모든 이야기를 털어놨고 후원자 또한 내게 소소한 이야기를 나눴다”며 “딸에게 건네듯 이야기를 나눠준 후원자 덕에 수줍음 많고 자신감 없던 아이에서 축구선수로 거듭났다”고 했다.박티베코프씨는 지난해 9월 한국에서 열린AFCU-23 아시안컵 예선전에 참가했는데, 당시 자신을 보러온 기아대책 직원들을 잊지 못한다고 했다. 그는 “떨리는 마음으로 경기장에 들어섰을 때 관중석에서 내 이름이 박힌 플래카드를 들고 응원하는 사람들이 있었다”며 “키르기스스탄에서부터 나를 도와준 직원들이 내가 기가 죽지 않도록 응원하러 달려온 것이었다”고 회상했다.지난해 9월 한국에서 열린AFC-U아시안컵 예선전에 참가한 박티베코프씨가 자신의 후원자인 문공현씨를 비롯해 기아대책 직원들과 기념 사진을 촬영하고 있다./기아대책박티베코프씨는 “호프컵이 내 축구 인생의 첫 해외 경기”였다며 “‘1등을 하고 말겠다’며 다짐했지만 결국 3등을 하고 펑펑 울기도 할 만큼 내겐 큰 전환점이었다”고 했다. 샤랑게렐씨 또한 “개막식 때 몽골 국기를 앞세우고 박수를 받으며 내가 자국을 대표했던 순간은 국가대표가 된 지금도 잊지 못한다”며 “올해 참가하는 수많은 아이들도 한국에서 열리는 호프컵으로 꿈을 찾아가길 바란다”고 했다."
2024-02-01,"기아, 포스코 이어  ‘형님’ 현대차까지 제쳤다... 시총 6위 오른 이유는","주가 5% 급등 시총 41조3703억원배당 확대 등 주주환원 정책 영향기아가 31일 유가증권 시장에서 시가총액(주당 가격X상장 주식수) 규모로 현대차를 앞섰다. 기아가 2000년 현대차그룹에 인수된 이후 처음 있는 일이다. 투자자들이 기아가 배당 확대 등 주주 환원 정책에서 현대차보다 더 좋은 조건을 제시했고, 현재 자동차 시장에서 인기인SUV등에 더 특화돼 있어 단기간 주가 상승 여력이 많다고 판단했다는 분석이 나온다.이날 유가증권시장에서 기아 주가는 10만2900원으로 전날보다 5% 오르며 시가총액이 41조3703억원이 됐다. 현대차(우선주 제외)는 이날 주가가 2.42% 오른 19만4600원으로 장을 마쳤다. 시가총액은 41조1640억원이었다. 최근 기아의 주가 상승세는 뚜렷하다. 기아는 1월 초 시총 순위 8위였지만, 최근 한 달간 포스코홀딩스에 이어 현대차까지 제치며 6위가 됐다.그래픽=조선디자인랩 정다운증권가에서는 기아 주가 상승에 대해 주주 환원 정책 덕이라는 분석이 많다. 지난 25일 실적을 발표하며 현대차와 기아는 결산 배당금으로 각각 8400원, 5600원을 책정했다. 당일 종가 기준으로 배당률이 기아가 6%로 현대차(4.5%)보다 높다.기아는 또 오는 3월 중순까지 5000억원 규모의 자사주를 매입한 뒤 50%를 소각한다고 했다. 단기간 대량의 자사주를 소각하는 만큼 투자자 입장에서 주가가 크게 떨어질 우려를 덜게 되는 셈이다. 반면 현대차는 4% 수준의 자사주를 매년 1%씩 3년간 소각하겠다는 기존 발표를 재확인하기만 했다. 현대차와 기아는 모두 지난해 역대급 매출·영업이익을 냈다. 그런데도 주가 흐름에 차이가 있는 것은 두 회사 역할 자체가 전략적으로 달라지는 면도 영향을 주고 있다는 분석도 나온다. 현대차그룹 내에서 똑같이 차를 생산·판매하는 것이 아니라 세부 전략 방향이 달라지고 있다는 것이다. 현대차의 경우 최근 실적 발표 등에서 전기차는 물론 소프트웨어가 중심인 자동차(SDV·SoftwareDefinedVehicle)나 수소차 등 중장기 전략에 집중하는 전략을 내놨다. 반면 기아는 최근 인기인SUV판매에 더 특화돼있는 데다, 미래 핵심 전략으로 추진 중인PBV(목적 기반 차량·PurposeBuiltVehicle)를 내년 경기 화성 공장에서 대량 생산하는 등 사업이 가시권에 들었다는 것도 차이점이다."
2024-01-31,"아우가 형님 넘었다... 기아, 현대차 제치고 시총 6위","서울 서초구 양재동 기아자동차 사옥/기아자동차 제공주주 환원책 발표 이후 주가가 급등한 기아가 31일 현대차 시가총액을 앞질렀다. 현대차가 기아를 인수하면서 현대차는 ‘형님’,기아는 ‘아우’에 비유됐는데 2001년 이후 처음으로 아우가 형님을 뛰어넘은 것이다.31일 한국거래소에 따르면 이날 기아 주가는 이날 전날 대비 5% 상승한 10만2900원으로 장을 마감했다. 종가 기준 역대 최고가다. 이로써 기아 시총은 41조3703억원으로 같은 그룹사 현대차(41조1640억원)를 뛰어넘어 코스피 시총 6위에 올랐다. 현대차도 이날 2.4% 상승한 19만4600원으로 거래를 마쳤지만 기아의 최근 주가 상승세를 따라가지 못했다.그래픽=조선디자인랩 정다운기아 주가는 최근 나온 주주환원책에 힘입어 질주하고 있다. 최근 2주 사이 15%나 올랐다.지난해 역대 최대 실적을 낸 기아는 올해 5000억원 규모의 자사주를 매입하고 이중 절반을 상반기 중 소각하는 내용의 주주환원책을 발표했다. 나머지 자사주도 올해 3분기 경영목표를 달성할 경우 소각할 방침이다. 결산 배당액의 경우 기존 대비 2100원 오른 5600원(배당률 6.0%·배당성향 25%)으로 정했다.이에 외국인은 이날도 기아 주식을 797억원어치 사들였다. 최근 5거래일 연속 순매수 중이다.반면 현대차는 지난해 기아 보다 3조원 가량 더 많은 영업이익을 거뒀지만 기아 대비 낮은 수준인 4000억 규모의 자사주 매입·소각 방침을 밝혔다.업계에선 금융당국이 추진하고 있는 ‘기업 밸류업 프로그램’이 향후 기아 주가에 더 긍정적인 영향을 미칠 수 있다고 보고 있다. 금융당국은 국내 증시 저평가 문제를 해소하기 위해 주가순자산비율(PBR)이 1 미만인 종목들에 개선책을 요구할 방침이다. 기아는PBR이 0.9배로 낮은 수준이라 추가 주주환원 가능성이 제기된다."
2024-02-26,"기아  SUV ‘니로’ 판매량, 글로벌 누적 100만대 돌파","기아의 친환경SUV니로가 글로벌 누적 판매 100만대를 돌파했다. 지난 2016년 출시 후 8년 만인데 10대 중 8대가 해외에서 팔렸다. 니로는 애초부터 내연기관 모델을 제외하고 하이브리드, 플러그인하이브리드, 전기차 등 친환경 모델로만 출시된 차다. 친환경 동력계에 가격 대비 성능을 인정받으며 유럽 등 해외에서 더 큰 인기를 끌었다.25일 기아에 따르면 니로는 올 1월까지 100만8000대 이상 판매됐다. 전체 판매량 중 80% 이상인 81만3458가 해외에서 판매됐고, 이 중 절반이 넘는 46만6112대가 친환경차를 선호하는 유럽에서 팔렸다. L(리터)당 20.8km를 기록할 정도로 뛰어난 연비, 소형차임에도 넉넉한 공간, 2000만원대 중·후반의 가격 등이 인기 요인으로 꼽힌다."
2024-01-26,"벤츠·BMW와 어깨 나란히… 현대차·기아, 26조원 번 비결","매출 262조원, 첫 두 자릿수 영업 이익률… 창사 이래 최고 실적현대차 울산 공장 전용 부두… 선적 대기 중인 수출 차량 지난 23일 현대차 울산 공장에 있는 자동차 전용 부두에 선적 대기 중인 수출 차량들이 늘어서 있다. 현대차·기아는 작년 매출 약 262조원에 영업이익 약 27조원을 기록해 창사 후 최대 실적을 냈다./게티이미지코리아현대차·기아가 지난해 매출 262조4720억원, 영업이익 26조7348억원을 기록했다. 창사 이래 최고 실적이다. 특히 기업 핵심 수익성 지표인 영업이익률이 10.2%로 역대 처음으로 두 자릿수를 기록했다. 글로벌 전기차 아이콘 테슬라(작년 9.2%)를 웃돈 것은 물론 고급차BMW와 메르세데스 벤츠와 어깨를 나란히 한 수준이다. 또 다른 한국 대표 기업인 삼성전자가 2008년 이후 최악의 실적으로 부진한 빈자리를 자동차 산업이 메운 것이다.자동차 산업 역사상 ‘200억달러’(약 26조7300억원) 안팎의 이익을 낸 사례 자체가 보기 드물다. 2021~2022년 세계 1위 도요타가 연 2조7000억엔(약 24조4000억원), 2위 폴크스바겐그룹이 같은 시기 2년 연속 연 200억유로(약 29조원) 이상의 이익을 낸 것 정도가 있다.거기다 730만대를 팔면서 이익률이 두 자릿수를 기록하는 것도 희귀한 사례다. 도요타와 폴크스바겐 역시 2021~2022년 영업이익률이 8~9%였고, 두 자릿수 영업이익률을 수년간 유지해온 테슬라나BMW·벤츠 모두 판매량이 글로벌 200만대 안팎 수준이다. 국내 완성차 업계 관계자는 “작년은 도요타 정도가 엔저 효과가 더해지면서 현대차·기아와 비슷하거나 소폭 앞서는 실적을 냈을 것”이라며 “기아가 기록한 영업이익률 11.6%는 세계 최고 수준으로 보인다”고 했다.역대급 실적을 낸 가장 큰 비결은 전기차 외에 다양한 차종을 내놓은 것이 꼽힌다. 미래 먹거리로 앞세우는 전기차는 막상 시장이 주춤했지만, 하이브리드,SUV등 ‘대체재’가 충분했다는 것이다. 또 이런 제품을 고물가 속에서도 효율 좋게 생산하는 원가 경쟁력이 높아진 것도 핵심 요인으로 거론된다.그래픽=박상훈SUV·하이브리드에서 돈 벌었다최근 4~5년간 전기차 바람을 일으킨 테슬라는 전기차 침체의 역풍을 맞았다. 24일(현지 시각) 실적 발표에서 작년 4분기 영업이익이 20억6400만달러로 전년 동기 대비 47%가 줄었다고 밝힌 것이다. 주춤한 전기차 판매를 되살리고자 잇따라 차값을 큰 폭으로 낮춘 것이 독이 됐다.반면 전기차 대신 하이브리드·SUV등 제품이 풍성했던 현대차·기아는 역대급 실적을 냈다. 현대차·기아는 지난해 730만4282대를 판매했는데, 현대차의 경우 하이브리드(37만3941대)가 전년 대비 56%나 판매가 늘었다. 또 제네시스를 포함해SUV비중이 전체 판매량의 57.1%까지 늘어났다. 기아도 비슷하다. 전기차 판매량 증가율은 전년 대비 15%였지만 하이브리드는 21%나 더 팔렸다.SUV와 밴 등RV(레저용 차량) 비중이 70%에 육박한다.또SUV와 하이브리드의 경우 현대차·기아의 원가 경쟁력이 최고 수준까지 높아져 있다는 평가를 받는다. 미국 등 주요 자동차 시장에서는 고물가로 업계 전반적으로 차값이 크게 오른 상태다. 그런데 현대차·기아는 해외에서 판매하는 주력 제품 모두 10년 넘게 만들어온 차가 대부분이다. 부품 공급이나 생산 공정이 최적화되어 있어 비슷한 가격에 팔아도 다른 기업보다 더 수익성이 좋은 구조라는 것이다.당초 작년 하반기부터는 실적 상승세가 꺾일 것이란 전망이 많았다. 하지만 최대 시장인 미국 경제가 호조를 보였고, 현대차·기아가 특히 미국에서 사상 처음으로 판매 4위로 올라서는 등 미국 시장에서 성공을 거둔 것이 비관적인 전망을 넘어선 요인이 됐다는 평가다.”올해도 자신 있다”는데, 변수도 많다현대차·기아는 지난해 역대급 실적을 올렸는데도 올해 목표를 더 높게 잡았다. 현대차는 작년보다 판매량이 0.6% 증가한 424만대, 매출 증가율 4~5%를 달성하겠다고 했다. 기아도 지난해와 비교해 판매량 목표는 3.6% 더 늘어난 320만대, 매출은 1.3% 증가한 101조1000억원, 영업이익은 3.4% 많은 12조원으로 잡았다.세계적인 전기차 시장 둔화에도 최대 시장인 미국 소비가 견조하게 이어지고 내연기관차와 하이브리드 판매가 지역별로 더 늘어날 것이라고 예상했기 때문이다. 전기차 수요가 줄면서 배터리 가격이 떨어지며 재료비가 줄고 연초 환율이 1달러당 1300원을 계속 웃돌고 있는 것도 수익에 도움이 될 수 있다는 것이다.반면 자동차업계 안팎에서는 경기 침체의 강도가 예상보다 더 셀 경우 목표 달성이 쉽지 않을 수 있다는 우려도 있다. 현대차·기아 모두 작년 4분기 판매량·영업이익이 예상치를 소폭 밑돈 것으로 나타났는데, 업계에서는 이를 경기 침체 영향권에 접어드는 신호 아니냐는 분석도 있다. 현대차그룹 내부에서도 한국과 중국, 유럽은 판매가 작년보다 줄어들 것으로 예상하고 있는 상황이다. 전기차 시장 침체가 이어지는 것도 주요 변수다."
2024-01-25,"현대차·기아, 지난해 역대 최대 실적…테슬라 이익률 제쳤다","서울 서초구 양재동 현대자동차, 기아 본사 빌딩 모습/뉴스1현대차·기아가 지난해 창사 이래 최대 매출과 영업이익을 기록했다. 특히 기업 이익의 핵심 지표인 영업이익률 부문에서 10.2%를 기록해 역대 처음으로 두 자릿수 이익률을 나타냈다. 24일(현지 시각) 실적을 발표한 미국 전기차 업체 테슬라(9.2%)를 웃도는 수치다.현대차·기아는 지난해 매출 262조4720억원, 영업이익 26조7348억원을 기록했다고 25일 밝혔다. 2022년 보다 각각 14.5%, 56.7% 늘어난 수치다. 현대차가 매출 162조6636억원과 영업이익 15조 1269억원을 나타냈고, 기아가 매출 99조 8084억원, 영업이익 11조6079억원을 기록했다.이 같은 호실적은 하이브리드, 전기차 등 친환경차와SUV등 고가(高價) 차량 판매가 늘어났기 때문이다. 현대차·기아는 지난해 730만4282대를 판매했다. 현대차의 경우 하이브리드(37만3941대)와 전기차(26만8758대)를 중심으로 한 친환경차 판매가 69만5382대로 전년보다 37.2% 증가했다.SUV도 227만대가 팔리며 전체 판매에서 차지하는 비중이 2022년 51.5%에서 53.9%로 늘었다. 기아도 하이브리드차가 전년 대비 20.8% 증가한 30만6000대, 전기차는 15.3% 증가한 18만2000대가 팔렸다.이로 인해 기업의 핵심 이익 지표로 불리는 ‘영업 이익률’도 대폭 개선됐다. 현대차·기아는 지난해 10.2%의 영업이익률을 기록해 테슬라(9.2%)를 제쳤다. 2022년 현대차·기아의 영업이익률은 7.5%였다. 벤츠 등 럭셔리카 업체를 제외하면 대중 브랜드 중엔 도요타(10.5%) 정도만 현대차·기아에 앞선다.현대차·기아는 올해 판매 목표를 744만대(현대차 424만대, 기아 320만대)로 잡았다. 매출과 영업이익은 현대차가 전년 대비 4~5%, 8~9% 성장을 목표로 세웠고, 기아는 각각 1.3%, 3.4% 상승을 올해 목표로 설정했다."
2024-01-24,"“전기차 9종 입맛대로”… 현대차·기아, 테슬라 맹추격","올해 美 생산 늘려 ‘2위 굳히기’연간 판매도 10만대 돌파 목표“앞으로 현대차·기아가 테슬라의 강력한 경쟁자가 될 것이다.”지난 17일(현지 시각) 월스트리트저널(WSJ)은 작년 현대차·기아가 미국에서 처음으로 전기차 판매 2위에 오른 것을 두고 이같이 보도했다. 선두 테슬라와는 아직 격차가 크지만 적극적인 투자로 전통 자동차 기업 가운데에서는 가장 도드라진 성과를 내고 있다는 것이다.기아현대차·기아는 지난해 미국에서 순수 전기차 9만4340대를 팔아 전년 동기 대비 판매량이 63% 늘어났다. 테슬라(약 65만대)와의 격차는 아직 크지만, 이른바 전통 자동차 기업이자 미국 업체인GM(제너럴모터스·7만5883대)과 포드(7만2608대)를 2만대 안팎 앞섰다.현대차·기아는 올해는 미국 현지 생산을 더 확대해 테슬라 추격에 나선다. 미국 현지에서 생산된 전기차에 대해 보조금을 주는 인플레이션 감축법(IRA)을 통해 가격 경쟁력을 높일 계획이다. 연간 전기차 판매량 10만대를 훌쩍 넘기는 것은 물론, 시장점유율 2위를 지키는 게 목표다.우선EV9<사진>이 2분기 중 기아 조지아 공장에서 현지 생산될 예정이다. 그 밖의 다른 차종도 추가로 현대차·기아의 현지 공장에서 생산하는 방안을 검토 중이다. 연말쯤에는 현대차그룹의 첫 해외 전기차 전용 공장인 ‘메타플랜트 아메리카(HMGMA)’가 조지아주에서 가동을 시작한다. 보조금으로 가격 경쟁력이 높아질 전기차가 많아진다는 뜻이다.단 5종의 전기차를 일반 소비자들에게 파는 테슬라와 달리 현대차·기아는 소형차부터 고급차까지 9종을 판매하고 있다는 것도 강점이다. 권위 있는 상을 통해 품질도 인정받고 있다. 기아EV9과EV6는 올해와 작년 ‘북미 올해의SUV’로 뽑혔고, 현대차 아이오닉5와 아이오닉6는 2022년과 2023년 ‘월드카 어워즈’에서 세계 올해의 자동차 상을 잇따라 받았다."
2024-11-04,"기아, 연식변경 K5 출시...가성비 모델 추가했다","기아가 세단 K5의 연식변경 모델 ‘The2025 K5′를 4일 출시했다고 밝혔다.세단 K5의 연식변경 모델'The2025 K5' / 기아신형 K5는 기존 대비 안전 및 편의 사양을 확대 적용했다. 전체 트림(세부 모델)에 글로브 박스LED조명, 실내 소화기 등을 기본 탑재했다. 또, 프레스티지 트림 이상에서 기존 선택 사양으로 운영되던 운전대 진동 경고 기능 등을 기본으로 적용했다.또, 2.0 가솔린 모델에 신규 엔트리 트림인 ‘스마트 셀렉션’을 추가했다. 기존 엔트리 트림이었던 프레스티지 트림의 일부 사양을 간소화, 그보다 100만원 안팎 저렴한 가격에 판매된다.신형 K5의 판매 가격은 2.0 가솔린 기준, 스마트 셀렉션 트림이 2766만원이다. 그 다음 고급 트림인 프레스티지는 2851만원, 최고급 트림인 시그니처는 3601만원이다."
