date,title,content
2024-10-10,삼성전자 ‘세계 최고직장’ 1위 내줬다…포브스 선정 3위,"1위MS…엔비디아 22위·TSMC218위로 껑충지난 8일 서울 서초구 서초동 삼성전자 서초사옥. 정용일 선임기자yongil@hani.co.kr삼성전자가 미국 경제지 포브스가 선정하는 ‘세계 최고의 직장’ 1위 자리를 5년 만에 내줬다. 반도체 실적 악화 등 회사 안팎의 위기감이 높아지는 것과 무관치 않아 보인다.포브스가 지난 8일 공개한 ‘세계 최고의 직장’ 평가 결과를 보면, 삼성전자는 올해 주요 글로벌 기업 가운데 3위를 차지했다. 앞서 2020∼2023년 4년 연속 1위에 선정됐으나 올해 순위가 두 계단 하락한 것이다.포브스는 독일 여론조사기관인 스태티스타와 협력해 세계 6개 대륙 중 2곳 이상에서 직원 1천명 이상을 고용한 다국적 기업 직원 30만명 이상을 대상으로 설문 조사해 48개국에 있는 기업 850개의 순위를 발표했다. 응답자들은 가족이나 친구에게 회사를 추천할 의향이 있는지와 급여, 인재 개발, 원격 근무 조건 등을 기준으로 회사를 평가했다.올해 1위는 미국 마이크로소프트, 2위는 구글 모기업인 알파벳이 각각 차지했다. 반면 이전까지 1위였던 삼성전자는 올해 3위로 미끄러졌다. 삼성전자는 올해 창사 이래 첫 파업, 노동자 방사선 피폭 사고, 인도 현지 가전 공장 파업 등과 더불어 최근 전영현 부회장의 반도체 실적 부진 사과문까지 나오는 등 안팎으로 적잖은 변화를 겪고 있다.미국 경제지 포브스 누리집 갈무리삼성전자에 이어 미국 소프트웨어 기업인 어도비가 4위에 올랐고, 독일 베엠베(BMW) 그룹, 델타항공, 에어버스, 이케아, 레고그룹, 아이비엠(IBM) 등 미국과 유럽 기업들이 나머지 10위권을 싹쓸이했다.반면 지난해 4위였던 미국 애플은 올해 15위로 내려갔다. 국내 기업 중에선 케이비(KB)금융그룹이 지난해 48위에서 올해 11위로 뛰어올랐다. 신한금융그룹(92위), 기아(108위), 아이비케이(IBK)기업은행(123위), 현대차(137위), 네이버(148위), 에스케이(SK)그룹(153위), 엘지(LG)(171위) 등은 100위 안팎에 머물렀다.인공지능(AI) 반도체 시장을 이끄는 미국 엔비디아는 지난해 154위에서 올해 22위로 순위가 수직으로 상승했고, 세계 1위 파운드리(반도체 수탁 생산)인 대만 티에스엠시(TSMC)도 지난해 534위에서 올해 218위로 올랐다."
2024-10-02,"금융위, 미정산 사태 ‘알렛츠’ 피해 판매자에게도 자금 지원","알렛츠 누리집 갈무리금융당국이 정산지연 사태를 일으키며 제2의 티메프로 불렸던 쇼핑몰 ‘알렛츠’ 피해 판매자에게도 금융지원을 하기로 했다. 알렛츠는 인테리어 제품 등을 판매하던 온라인 플랫폼으로 판매자에게 7월 대금을 정산하지 않은 채 8월에 영업 종료를 공지한 바 있다.금융위원회는 2일 “알렛츠 정산지연 피해자에게도 오는 4일부터 기존대출·보증을 만기연장·상환유예를 할 예정이다. 정책금융기관 유동성 지원프로그램의 지원대상에도 포함하겠다”고 밝혔다. 공정위의 현장조사 결과 알렛츠의 미정산 규모는 약 170억원으로 파악된 바 있다.알렛츠 정산지연으로 피해를 보거나 피해가 예상되는 기업은 기존대출·보증에 최대 1년의 만기연장·상환유예를 받을 수 있다. 정산지연 대상기간인 7월 이후에 매출이 있는 판매자가 보유한 금융권 사업자 또는 법인대출이 대상이다.사업자와 관계없는 주택담보대출이나 개인신용대출 등 가계대출은 제외된다. 만기연장 및 상환유예를 지원받기 위해서는 원리금 연체, 폐업 등 부실이 없어야 한다. 알렛츠의 미정산으로 예상하지 못한 자금경색이 발생하여 불가피하게 대출금을 연체한 기업은 예외다.정책금융기관의 유동성 지원 프로그램 대상에도 포함된다. 오는 4일부터 미정산 금액을 한도로 기업은행-신용보증기금은 최대 30억원, 소상공인시장진흥공단은 최대 1억5천만원까지 지원한다.아울러 금융위는 “티메프 미정산 사태로 마련한 긴급경영안전자금에 일부 잔여분이 발생한 중소벤처기업진흥공단이 알렛츠 피해 판매자에게도 오는 10일부터 자금을 지원한다”고 밝혔다.기업은행-신용보증기금 프로그램은 전국 99개 신용보증기금 지점을 통해 신청할 수 있다. 소진공·중진공 프로그램은 소상공인정책자금 누리집(ols.semas.or.kr), 중소기업정책자금 누리집(www.kosmes.or.kr)을 통해 신청할 수 있다.금융위는 “금융권은 8월7일부터 지난달 26일까지 티메프 피해 판매자 1423건(1699억원)의 대출에 최대 1년간의 만기연장·상환유예를 적용했다. 정책금융기관(소진공·중진공·신용보증기금-기업은행)은 8월9일부터 지난달 26일까지 모두 1266건(1930억원)의 유동성 프로그램을 집행했다”고 밝혔다."
2024-09-30,“깐깐한 규정에 대출 거절”…티메프 피해기업 금융지원 실효성 의문,"서울 강남구 티몬 본사의 모습. 연합뉴스티메프(티몬·위메프) 사태로 9천만원의 피해를 본 미용용품 생산 업체 대표 서아무개(50)씨는 긴급안정자금을 받기 위해 지난달 말 신용보증기금(신보)에 문의했지만, 대출을 거절당했다. 서씨는 “최근 대표가 바뀌었을 경우, 나머지 주주들의 신용도까지 평가해야 한다고 했다. 내 신용점수는 괜찮은데, 주주의 점수가 낮다는 이유로 대출을 못 받았다”고 했다.정부가 티메프 판매대금 정산지연 피해업체를 위해 신보 등을 통해 긴급자금을 지원하겠다고 밝혔지만, 대출 기준이 깐깐한 탓에 실효성이 낮다는 지적이 나온다.30일 조승래 의원(더불어민주당)이 신보에서 받은 ‘이커머스(티메프) 특례보증 관련 현황’을 보면, 지난 8월9일부터 9월24일까지 업체 228곳에 812억3천만원(231건)의 긴급안정자금이 대출된 것으로 나타났다. 한도(3천억원)의 27% 수준이다. 금융위원회는 지난 7월29일 티메프 정산 지연으로 일시적 자금 유동성 위기에 직면한 중소기업이 낮은 금리로 신규자금을 조달할 수 있도록 신용보증기금과 아이비케이(IBK)기업은행을 통해 최소 3천억원의 대출 프로그램을 신설해 긴급 자금을 지원하겠다고 밝힌 바 있다.티메프 피해를 본 소상공인들은 “정부의 유동성 지원이라고 해서 기대했는데 대출 문턱이 높다”고 말한다. 용산 전자상가 매장을 운영하는 정아무개(45)씨는 티메프 사태로 60억원 가량의 피해를 봤지만 신보 대출을 받지 못했다고 했다. 정씨는 “갚아야 할 물품대금이 있다거나, 이미 신보 채무가 있다는 이유 등으로 대출을 거절당하기 일쑤”라며 “용산 디지털 가전 업체 26곳이 티메프 사태로 1200억원대 피해를 봤는데, 신보에서 대출받은 금액은 합쳐서 70~80억원 수준”이라고 말했다.문의 건수와 실제 대출 건수를 비교해봐도 차이가 크다. 조 의원이 받은 자료를 보면, 지난 7월부터 9월20일까지 티메프 긴급안정자금 관련해 469건의 문의가 콜센터에 접수된 것으로 나타났다. 실제 대출 건수는 231건이다. 조 의원은 “티메프 피해자들을 구제한다면서 까다로운 조건을 제시하는 정책은 그야말로 탁상행정”이라고 지적했다."
2024-09-08,‘인터파크쇼핑·AK몰’ 미정산 피해기업도 대출 만기연장 등 지원,"티몬·위메프(티메프) 피해 판매자와 소비자들이 지난달 18일 오후 서울 종로구 금융위원회 앞에서 ‘검은 우산 집회’를 열고 피해자 구제를 위한 특별법 제정을 촉구하고 있다. 연합뉴스정부가 티메프(티몬+위메프)뿐만 아니라 인터파크쇼핑과 에이케이(AK)몰에서 미정산 피해를 입은 기업에 대해서도 9일부터 대출·보증 만기연장 등 지원에 나선다.중소벤처기업부와 금융위원회는 8일 “인터파크쇼핑과 에이케이몰의 정산지연 피해기업도 9일부터 기존대출·보증 만기 연장과 상환유예 및 정책금융기관 유동성 지원프로그램의 지원대상에 포함한다”고 밝혔다. 지난달 21일 경제관계 장관회의에서 인터파크쇼핑과 에이케이몰의 미정산에 따른 피해 지원방안을 강구하기로 한 뒤, 공정거래위원회 현장 조사 결과 미정산 규모가 약 800억원에 이르는 것으로 확인되면서 나온 후속 조처다.이에 따라 인터파크쇼핑·에이케이몰의 정산지연으로 피해를 보거나, 피해가 예상되는 기업은 기존 대출·보증의 만기를 연장하거나 상환유예(최대 1년)를 받을 수 있다. 지원을 받으려면 원리금 연체·폐업 등 부실이 없어야 하지만, 미정산으로 불가피하게 대출금을 연체한 기업은 7월10일부터 9월9일 사이에 발생한 연체가 있어도 지원할 계획이다.피해기업과 판매자들은 티메프 피해자들과 동일하게 정책금융기관의 유동성 지원도 신청할 수 있다. 기업은행-신용보증기금 프로그램은 최대 30억원 이내 한도에서 3.3∼4.4% 금리의 대출을 지원한다. 소상공인시장진흥공단은 최대 1억5000만원 이내에서 2.5% 금리로 대출을 지원할 예정이다.한편, 지난달 7일부터 이달 4일까지 티메프 피해기업 지원 현황을 집계한 결과, 1262건(1559억)의 대출이 만기가 연장되거나 상환이 유예된 것으로 나타났다. 또 정책금융기관에서는 총 1470(2735억원)건의 신청을 받아 891건(1336억원)의 자금을 집행했다. 평균 대출 금액은 중소벤처기업진흥공단 2억9000만원, 소상공인시장진흥공단은 3800만원, 기업은행-신용보증프로그램은 3억6000만원이었다.인터파크쇼핑과 에이파크몰은 큐텐그룹 계열사인 인터파크커머스 산하 플랫폼으로 티메프 사태 뒤 심각한 자금난을 겪어왔다."
2024-08-12,"티메프 피해 업체, 긴급자금 747건·1483억원 신청","서울 강남구 티몬 본사 건물. 연합뉴스티몬·위메프 미정산 사태로 피해를 입은 중소기업·소상공인들이 정부의 긴급경영안정자금에 747건, 1483억원을 신청한 것으로 나타났다.중소벤처기업부는 지난 9일 접수를 시작한 소상공인시장진흥공단(소진공) 긴급경영안정자금에 11일 오후 6시 기준으로 352건, 153억원이 신청됐으며, 중소벤처기업진흥공단(중진공) 긴급경영안정자금에는 395건, 1330억원이 신청됐다고 12일 밝혔다.미정산 금액을 한도로 소진공은 1억5천만원, 중진공은 10억원 이내에서 지원한다. 금리는 각각 3.51%, 3.40% 수준이다. 소진공은 은행을 통한 간접대출을 소진공 직접대출로 전환해 자금 지원에 속도를 낸다는 방침이다.중기부는 “소진공 자금을 1700억원 규모로 운영할 예정임에 따라 앞으로도 소진공 자금에 대한 신청·접수를 계속 받을 계획”이라고 밝혔다. 다만, 애초 300억원 규모로 운영할 예정이었던 중진공 자금의 접수는 마감하고, 이미 접수된 건을 가능한 범위 안에서 최대한 지원하기 위한 방안을 검토하기로 했다.티몬·위메프 미정산 피해 중소기업들은 중진공 자금 이외에도 기업은행과 신용보증기금의 협약 프로그램(3000억원 이상)을 이용할 수 있다. 신용보증기금 지점(전국 99곳)에서 특례보증을 신청하면, 신용보증기금의 보증심사 뒤 기업은행에서 자금을 공급하는 방식으로 지원된다. 자세한 사항은 신용보증기금(1588-6565)이나 기업은행(1566-2566)으로 문의하면 된다.소진공 자금은 소상공인정책자금 누리집(ols.semas.or.kr)과 전국 77개 지역센터에서 신청·접수받고 있으며, 자금이 소진될 때까지 주말을 포함해 접수받을 예정이다."
2024-08-06,"정부, 티메프 피해기업 금융지원…7일부터 만기연장·상환유예","긴급경영자금 신청·접수는 9일부터지난달 26일 티몬·위메프 판매대금 정산 지연 사태로 인한 피해자들이 서울 강남구 티몬 신사옥에 몰려가 항의하고 있다. 연합뉴스티몬·위메프 판매대금 정산지연 피해를 입은 업체에 대한 정부 금융지원이 이번 주부터 이뤄진다.금융위원회와 중소벤처기업부는 6일 이번 사태와 관련해 정책금융기관의 유동성 지원 신청을 7일부터 받는다고 밝혔다.먼저 정산 지연으로 피해를 입은 기업들은 기존 대출·보증에 대해 최대 1년의 만기연장과 상환유예를 적용받을 수 있다. 티몬·위메프의 정산 지연 대상 기간인 5월 이후에 매출이 있는 기업이라면 모두 대상이 된다. 다만, 사업자와 관계없는 주택담보대출이나 개인신용대출 등 가계대출은 제외된다. 티몬·위메프의 매출채권을 기반으로 ‘선정산대출’을 취급하고 있던 은행(신한·국민·SC제일은행)도 정산 지연으로 인한 연체를 막을 수 있도록 대출기간을 연장하고 상환을 유예해준다.기업은행과 신용보증기금은 ‘3천억원+@’ 규모의 유동성을 지원한다. 미정산 금액을 한도로 최대 30억원 이내에서 이뤄진다. 업체당 3억원까지는 보증심사를 간소화해 공급하되, 피해 금액이 3억∼30억원일 경우 기업당 한도사정을 거쳐 금액이 일부 제한될 수 있다. 신용보증기금 지점에 특례 보증을 신청하면 보증심사 후 기업은행에서 대출을 지원하는 방식으로 운영된다. 일반 중소기업 대출보다 1%포인트 이상 낮은 최저 3.9∼4.5% 금리가 적용된다.또 중소기업벤처진흥공단(중진공)과 소상공인시장진흥공단(소진공)은 오는 9일부터 2천억원 규모의 긴급 경영안정자금 신청을 받는다. 미정산 금액을 한도로 중진공은 한도 10억원, 소진공은 1억5천만원 이내에서 지원한다. 금리는 각각 3.40%, 3.51% 수준이다. 소진공은 은행을 통한 간접대출을 소진공 직접대출로 전환해 자금 지원에 속도를 낸다는 방침이다.실제 자금 집행은 심사 등을 거쳐 이달 중순부터 이뤄질 전망이다. 정부는 티몬·위메프 정산 지연 규모를 2745억원(7월31일 기준)으로 파악하고 있지만, 정산 기한이 남은 6~7월 거래분을 포함하면 피해 규모는 약 3배 정도 더 많을 것으로 정부는 내다보고 있다."
2024-07-29,‘티메프’ 피해 소상공인에 저금리 대출 등 5600억 긴급 지원,"지난 25일 서울 강남구 티몬 본사 앞에서 환불을 원하는 피해자들이 우산을 쓰고 사측을 기다리고 있다. 연합뉴스정부가 티몬‧위메프 정산지연 사태로 피해를 본 소상공인을 돕기 위해 최소 5600억원 규모의 자금 지원에 나선다. 피해 판매자는 기존 대출 만기가 최대 1년까지 연장된다.금융위원회는 29일 ‘티몬‧위메프 정산지연 피해업체 금융지원 회의’를 열어 △기존대출 만기연장 △상환 유예 △긴급자금 지원(최소 5600억원 규모) 계획 등을 밝혔다.금융위와 중소벤처기업부는 금융권과 정책금융기관에 정산지연 피해업체를 대상으로 기존 대출의 만기연장 및 상환유예를 요청했다. 금융권과 정책금융기관은 최대 1년의 만기연장 등의 지원을 통해 협조하기로 했다. 케이비(KB)국민은행, 에스시(SC)제일은행 등 선정산대출 취급기관도 기존 대출의 만기 연장에 협조하기로 했다. 판매업체는 연체사실이 등록되거나 신용평가점수가 하락할 위험을 덜 수 있다.금융위는 피해 소상공인을 돕기 위해 최소 5600억원을 조성한다. 신용보증기금과 아이비케이기업은행은 최소 3000억원 규모의 보증부 대출 프로그램을 신설해 긴급 자금을 지원할 예정이다. 티몬·위메프의 대금 정산지연으로 일시적 자금 유동성 위기에 직면한 피해 중소기업이 낮은 금리로 신규 자금을 조달할 수 있게 된다.중소벤처기업부는 중소기업벤처진흥공단과 소상공인시장진흥공단의 긴급경영안정자금 프로그램을 활용해 피해 소상공인 및 피해 중소기업에 2000억원 규모로 정책자금(융자)을 지원한다. 지원절차 등 세부내용은 8월 중 별도 공지할 예정이다. 문화체육관광부는 여행사 등 관광사업자를 대상으로 600억원 규모의 대출 이차보전사업(2.5~3.0%포인트)를 운영할 예정이다.이날 회의에는 금융당국, 정책금융기관(산업은행, 아이비케이(IBK)기업은행, 중소벤처기업진흥공단, 소상공인시장진흥공단, 신용보증재단중앙회, 신용보증기금, 기술보증기금), 금융권 협회(손해보험협회, 생명보험협회, 여전협회, 저축은행중앙회, 상호금융중앙회), 선정산대출 취급기관(케이비(KB)국민은행, 에스시(SC)제일은행) 등이 참석했다.금융위는 금감원, 중소벤처기업부, 금융유관기관 및 업권별 협회 등으로 긴급대응반을 구성해 티몬·위메프의 정산 지연으로 인한 기업의 피해상황을 점검할 계획이다."
