date,title,content
2024-11-11,전세금 보증 등 정책금융 1900조 육박…국가채무보다 빨리 늘었다,"공공기관이 내주는 대출‧보증 등 정책금융의 규모가 빠른 속도로 불어나고 있다. 정책금융 급증이 가계 대출 증가의 원인 중 하나로 지목되면서 제동 장치가 필요하다는 지적이 나오고 있다.11일 국회예산정책처에 따르면 금융공공기관의 정책금융(대출‧보증‧보험‧투자) 잔액은 지난해 말 기준 1868조4000억원에 이른다. 전년보다 86조원(4.8%) 증가한 규모다. 같은 해 국가채무(중앙정부 기준·1092조5000억원)의 1.71배 수준이다.김주원 기자문제는 정책금융이 불어나는 속도가 과도하게 빠르다는 점이다. 5년 전과 비교하면 정책금융은 50.4%(625조8000억원) 증가했다. 9년 전(2014년·849조9000억원)에 비해서는 119.8%(1018조5000억원) 늘어나며 같은 기간 국가채무 증가 속도(117.2%)보다 빨랐다.정책금융은 보증과 대출이 대부분을 차지한다. 이 가운데 절반가량을 차지하는 보증은 5년 전 대비 57.2% 증가하며 전체 정책금융 증가를 견인했다. 보증에서 늘어난 금액 대부분은 전세보증금반환보증 등을 공급하는 주택도시보증공사(HUG)에서 발생하고 있다.HUG의 보증 규모는 매년 늘어나는 중이다. 올해도 정부는HUG가 보증 공급을 지속할 수 있도록 4조7000억원을 출자했다. 앞으로도HUG가 공급하는 보증은 더 커질 전망이다. 최근HUG는 전세사기 등으로 인한 보증사고가 급증하자 자본 확충을 위해 최대 7000억원 규모의 채권(신종자본증권) 발행을 시도하려다 금융당국의 제동으로 관련 절차를 중단하기도 했다.정책대출도 5년 새 43.7% 증가했다. 대출 중에서는 중소기업은행 대출과 함께 한국주택금융공사(HF) 대출이 큰 폭으로 늘었다. 결국 부동산 관련 보증‧대출이 전체 정책금융 증가를 끌어올리고 있다는 의미다.정책금융은 주거 복지나 수출기업 지원 등 정책적 수요가 많아지면 함께 커지게 된다. 하지만 최근 가계부채 급증의 주범으로 정책대출이 지목되며 증가세에 제동을 걸어야 한다는 의견도 제기되고 있다. 총부채원리금상환비율(DSR) 규제가 적용되지 않는 일부 정책대출 등에 어느 정도 규제가 필요하다는 이야기다. 김병환 금융위원장은 지난달 10일 국정감사에서 “정책금융 증가 속도는 줄여야 하겠지만 크게 둔화하면 저소득층의 주택 마련이나 전세에 영향을 줄 수 있어 전반적으로 균형을 잡아가겠다”고 했다. 이와 관련해 강인수 숙명여대 경제학과 교수는 “대출 등 정책금융을 규제를 통해 조이면 가계부채 증가를 일부 통제할 수는 있을 것”이라면서도 “가계부채 속도를 둔화하려는 노력과는 별개로 청년·신혼부부 등 실수요자 피해가 발생하지 않도록 규제 수위를 조정해야 하겠다”고 말했다.늘어난 정책보증‧대출이 부실화해서 공공기관이 손실을 본다면 이는 결국 정부 재정에 부담으로 이어질 수밖에 없다. 이에 국회에서는 정책금융 공급의 연간 증가율에 제한을 거는 법안이 발의된 상태다. 유동수 더불어민주당 의원은 “정책금융 공급 총액의 증가는 정부의 재정건전성에 영향을 미칠 가능성이 있다”며 공공기관운영법 개정안을 내놓았다. 정책금융 공급 총액 증가율이 전년 대비 5%를 넘지 못하게 하고, 정책금융 공급 현황을 반기마다 국회에 제출하도록 하는 내용이다. 김상봉 한성대 경제학과 교수는 “우선 정책대출에DSR규제 등을 적용하면 정책금융 총 증가율은 바로 둔화할 수 있다”며 “부작용이 큰 정책금융은 속도 조절을 하면서 통제할 필요가 있다”고 말했다."
2024-10-28,"""월 50만원 5년 부었더니…"" 1027만원 얹어주는 '대박 적금' 정체","오영주 중소벤처기업부 장관(왼쪽에서 두 번째)이 28일 서울 구로구IBK기업은행 구로동지점을 방문해 중소기업 재직자 우대 저축공제 첫 가입자인 중소기업 재직자 및 기업대표를 비롯한 관계자들과 기념 촬영을 하고 있다. 중소벤처기업부 제공중소기업 재직자의 자산 형성을 돕는 연 이율 13.5%의 적금 상품이 출시됐다. 중소기업 근로자의 장기 재직을 유도해 인력난을 해소하기 위한 정책의 일환이다. 다만, 전문가들은 중소기업의 경쟁력을 높이기 위한 구조적인 접근을 병행해야 한다고 말한다.중소벤처기업부는 28일 서울 구로구IBK기업은행 구로동지점에서 ‘중소기업 재직자 우대 저축공제’ 출시 행사를 열었다고 밝혔다. 이날 행사에 참석한 오영주 중기부 장관과 김성태IBK기업은행장은 첫 가입자의 가입을 축하하고 중소기업 재직자를 격려했다. 오 장관은 “중소기업계는 ‘기승전 인력’이라고 할 정도로 인력 수급의 어려움을 호소하고 있는데, 이번 정책이 중소기업의 인력난 해소에 도움이 되길 기대한다”라고 말했다.━“연 최대 13.5% 금리 효과”중소기업 저축공제는 중소기업 재직자가 월 10만~50만 원을 납입하면 기업이 납입 금액의 20%를 지원하고, 은행이 최대 5% 우대 금리를 적용하는 상품이다. 정부는 기업 지원금에 대한 소득세와 법인세를 감면한다. 가입자가 월 50만원씩 5년 동안 3000만원을 납입하면 기업 지원금과 세제 혜택을 더해 4027만원을 돌려받는다. 중기부는 연 13.5% 적금에 가입해 5년 동안 34%의 수익을 올리는 효과가 있다고 밝혔다. 중소기업 재직자는 기업과 월 납입 금액 등을 협의한 다음 기업은행이나 하나은행에서 저축 공제 상품에 가입할 수 있다.일각에선 이번 저축 공제가 종전 상품보다 혜택이 부족하단 지적이 나왔다. 지난 8일 국회 산업통상자원중소벤처기업위원회의 중기부 국정감사에서 이종배 국민의힘 의원은 “이번 상품은 정부 지원금이 없고 근로자 부담만 늘렸다”라며 “청년이 중소기업에 취업하고 장기 재직할 수 있게 유도할 수 있을지 의문”이라고 말했다. 지난해 출시된 ‘청년 재직자 내일채움공제 플러스’는 가입자가 3년 동안 600만원을 납입하면 기업과 정부가 각각 600만원씩 지원하는 상품이다.오영주 중소벤처기업부 장관이 지난달 19일 서울 중구 은행회관에서 열린 '중소기업 재직자 우대 저축공제 업무협약식'에서 발언하고 있다. 중소벤처기업부 제공중기부는 종전 상품의 저조한 가입률 문제를 해결하기 위해서 기업 부담을 줄였단 입장이다. 지난해 청년 내일채움공제 플러스 가입자는 5465명으로 당초 가입목표(1만5000명)의 36.5% 수준에 그쳤다. 중기부 관계자는 “내일채움공제는 기업의 지원금 부담이 커 참여하는 중소기업이 적었다”라며 “(이번 재직자 우대 저축공제에선) 중소기업 부담을 줄인 대신 우대 금리를 적용해 더 많은 기업과 근로자가 참여할 수 있게 했다”라고 말했다.정부 지원 방식에 대해선 민간이 주도해야 지속성이 높다고 설명했다. 정부의 직접 지원은 재정 상황에 따라 내용이 바뀔 가능성이 크단 것이다. 중기부 관계자는 “정부 재정이 어려울 땐 사업이 축소될 수밖에 없다”라며 “정책이 지속하려면 정부 지원에 의존하기보단 민간이 주도해야 한다”라고 말했다.━“중기 일자리, 구조적인 접근 필요해”전문가들은 중소기업 재직자의 자산 형성 지원뿐만 아니라 중소기업과 대기업 간 격차를 줄이기 위한 노력이 필요하다고 지적한다. 정세은 충남대 경제학과 교수는 “대기업에 취업할 수 있다면 저축공제 혜택 받겠다고 중소기업에 가는 사람은 없을 것”이라며 “대기업과 중소기업 간 격차를 줄이기 위한 거시적인 접근을 병행해야 한다”라고 말했다.하준경 한양대 경제학부 교수는 “중소기업 일자리는 임금이나 조직 문화 등 청년 눈높이에 맞지 않는 부분이 많다는 게 문제”라며 “저축공제가 중소기업 인력 문제에 약간의 도움은 될 순 있지만, 근본적인 해결책이 아닌 만큼 근로 환경을 개선하기 위한 고민을 해야 한다”라고 말했다."
2024-10-29,[Biz & Now] 중기 재직자 우대 저축공제 출시,"중소기업 재직자의 자산 형성을 돕는 연 이율 13.5%의 적금 상품이 출시됐다. 중소벤처기업부는 28일 서울 구로구IBK기업은행 구로동지점에서 ‘중소기업 재직자 우대 저축공제’ 출시 행사를 열었다고 밝혔다. 이날 행사에 참석한 오영주 중기부 장관과 김성태IBK기업은행장은 첫 가입자의 가입을 축하하고 중소기업 재직자를 격려했다. 중소기업 저축공제는 중소기업 재직자가 월 10만~50만 원을 납입하면 기업이 납입 금액의 20%를 지원하고, 은행이 최대 5% 우대 금리를 적용하는 상품이다."
2024-10-29,한국ESG평가원 “KB금융·신한·현대차·KT·우리금융 최고 'S'등급”,"KB금융그룹 본사 전경.KB금융·신한금융·현대차·KT·우리금융지주 등 5개 기업이 한국ESG평가원이 주관한 2024년 정례 상장 대기업ESG평가에서 최우수 S등급을 받았다.한국ESG평가원은 28일 이 같은 내용을 담은ESG평가 결과를 발표했다.ESG평가원은 2021년부터 지속가능경영 보고서를 발표하는 상장 대기업 중 상위 100개사를 선정해ESG평가를 실시하고 있다. S등급을 받은 곳의 점수는KB금융지주 82.1점, 신한금융 81.4점, 현대자동차 80.6점,KT80.4점, 우리금융 80.1점 등으로 집계됐다.5개사에 이어SK㈜·하나금융지주· 네이버·삼성전자·기아·현대모비스·SK텔레콤·KT&G·SK하이닉스·삼성생명·삼성물산 등 11개 기업은 A+ 등급을 받았다.LG전자·포스코홀딩스·IBK기업은행·아모레퍼시픽·LG에너지솔루션·SK이노베이션·미래에샛증권·롯데지주·현대건설·LG생활건강·한화생명 등 22개사는 A등급이었다.ESG평가원은 평가 등급을 S(80점~), A+(75점~), A(70점~), B+(65점~), B(60점~), C+(55점~), C(55점 미만) 등 7개로 구분한다.이번 평가에는 올해 8~9월 발표된 국내 상장회사들의 지속가능경영보고서와 기업지배구조보고서, 그리고 언론에 보도된 논란 이슈 등이 종합 반영됐다. 100개사의ESG종합 점수는 평균 69.5점으로 전년보다 0.6점 상승한 것으로 나타났다. 이는 B+등급에 해당한다.ESG요소별 평균 점수는 환경(E) 65.3, 사회(S) 70.9, 거버넌스(G) 69.9 등이었다.KB금융은 지난해 3위에서 올해 1위로 올라섰다. 신한금융도 전체 2위를 기록하는 등 금융지주사들이ESG경영을 선도하는 모습을 보였다. 현대차는 A등급에서 S등급으로 두 단계 상승해 전체 3위를 기록했고, 기아 10위, 모비스 11위로  A+이상 16개 기업 중 현대차그룹 기업은 3곳이 포함됐다. 지난해 평가에서 최고 등급인 S등급을 받았던SK와 삼성전자는 올해 나란히 A+등급으로 한 계단씩 내려갔다현대자동차 3분기 영업이익 3조5천809억원...작년 대비 6.5%↓ 〈이 기사는 2024년 10월 24일 17시 00분 전에는 제작 목적 외의 용도, 특히 인터넷(포털사이트, 홈페이지 등)에 노출해서는 안됩니다. 엠바고 파기시 전적으로 귀사에 책임이 있습니다.〉   (서울=연합뉴스) 이정훈 기자 = 현대자동차는 연결 기준 올해 3분기 영업이익이 3조5천809억원으로 지난해 동기보다 6.5% 감소한 것으로 잠정 집계됐다고 24일 공시했다.   매출은 42조9천283억원으로 작년 동기 대비 4.7% 증가했다. 순이익은 3조2천59억원으로 3% 줄었다.   이번 영업이익은 연합인포맥스가 집계한 시장 전망치 3조8천291억원을 6.5% 하회했다.   사진은 이날 서울의 한 현대차 매장. 2024.10.24uwg806@yna.co.kr(끝)  〈저작권자(c) 연합뉴스, 무단 전재-재배포,AI학습 및 활용 금지〉ESG종합점수 기준으로는 S등급 5개사, A+등급 11개사, A등급 22개사, B+등급 45개사, B등급 15개사, C+ 2개로 C등급은 없었다. 손종원 한국ESG평가원 대표는 “한국을 대표하는 100대 기업의 전반적ESG등급과 스코어가 상향되고 있다”라며 “ESG경영 마인드의 확산으로 S(소셜)부문을 중심으로 종합지수는 꾸준한 상승세가 나타나고 있지만 G(지배구조) 부문의 성과는 쉽게 개선되지 않고 있다”고 말했다."
2024-10-25,쥐꼬리 퇴직연금 수익률…수수료만 1조4000억 챙긴 금융사,"김영옥 기자퇴직연금 규모가 400조원을 넘어선 가운데 쥐꼬리 수익률에도 금융사들은 지난해 수수료로 1조4000억원을 챙긴 것으로 나타났다.25일 금융감독원이 통합연금포털에 올린 퇴직연금 비교공시 자료에 따르면 확정급여형(DB)ㆍ확정기여형(DC)ㆍ개인형 퇴직연금(IRP) 등 퇴직연금을 맡아서 관리ㆍ운용하는 42개 금융사(보험사 16개ㆍ은행 12개ㆍ증권사 14개)가 지난해 거둬들인 연간 수수료 수입은 1조4211억8600만원으로 집계됐다.금융사별로는KB국민은행이 1774억1900만원으로 가장 많은 수수료 수입을 올렸다. 뒤를 이어 신한은행(1699억1300만원)과 삼성생명(1419억2800만원), 하나은행(1308억1900만원), 우리은행(1170억1100만원),IBK기업은행(1075억2200만원), 미래에셋증권(962억2500만원) 순이었다.퇴직연금제도는 ‘근로자퇴직급여보장법’에 따라 사용자는 급여의 8.33%를 보험료로 떼어 민간 금융기관에 맡겨야 한다. 금융사가 이를 운용해 발생한 수익을 가입자(회사나 근로자 개인)에게 돌려주는 구조다. 이 과정에서 민간 금융사는 가입자에게 제공하는 서비스에 대한 수수료를 받는다.수수료는 운용관리ㆍ자산관리ㆍ펀드 총비용 등으로 나뉜다. 이 중 펀드 총비용은 수익 발생 여부와 관계없이 가입자의 투자 금액에서 원천징수하는 구조라 금융사의 알짜 수익원으로 분류된다. 향후 수수료는 퇴직연금 적립금에 차등 요율 방식이나 단일 요율 방식 등 일정 비율로 부과하기에 적립금 규모가 커질수록 더 불어날 수 있다.2005년 12월 도입한 퇴직연금은 10년 뒤 적립금이 147조원으로 늘었다. 이후 2018년 190조원, 2020년 256조원, 지난해 382조4000억원으로 급격히 증가했다. 올해 3분기 기준 400조878억원 규모로 커졌다. 퇴직연금 적립금 규모는 연평균 약 9.4% 성장하고 있어 2033년엔 940조원에 달해 1000조원 시대가 멀지 않았다는 전망도 나온다.시간이 지날수록 늘어나는 적립금과 달리 퇴직연금 성적표(수익률)는 저조하다. 고용노동부와 금감원 등에 따르면 지난해 말 기준 최근 5년간 퇴직연금 수익률은 2.35%, 10년 동안 올린 수익은 2.07%에 그친다. 그나마 이 정도를 기록한 것은 주식시장 강세 등의 영향으로 지난해 수익률(5.25%)이 2022년(0.02%) 대비 크게 개선되면서다. 국민연금의 연평균 수익률은 물론 물가상승률조차 따라가지 못하는 실정이다.국민연금은 2017년부터 2021년까지 5년간 연평균 수익률이 7.63%를 기록했다. 같은 기간 퇴직연금 수익률은 1.94%로 국민연금 수익률의 4분의 1 수준에 그쳤다.다만, 퇴직연금 수익률이 부실한 것은 적립금 대부분이 여전히 원금이 보장되는 안전자산에 쏠린 영향이 크다. 지난해 원리금 보장형 적립금 규모는 333조3000억원으로 전체의 87.2%를 차지했다. 퇴직금 가입자의 상당수가 투자 손실 우려에 예ㆍ적금에 자금을 묻어두고 있다는 의미다.더욱이 정부가 지난해 효율적인 자산재분배(리밸런싱)으로 수익률을 높이기 위해 사전지정운용제도(디폴트옵션)를 도입했지만, 가입자의 87%(487만명)가 초저위험 등급에 몰려 있는 것으로 나타났다.한국투자신탁운용 강성수 솔루션담당 상무는 “퇴직연금은 은퇴 후 노후에 필요한 자금을 준비하는 상품”이라며 “중장기적인 시각으로 실적배당형(원리금비보장) 상품 비중을 늘리고, 글로벌 자산 배분을 고려해 변동성을 낮추는 방향으로 퇴직금을 굴려야 한다”고 조언했다."
2024-10-22,"반효진·김예지 파리 사격 영웅, 뒤늦게 포상금 받는다…얼마?","2024 파리 올림픽 사격 선수단. 왼쪽부터 사격 25ｍ 속사권총 은메달 조영재, 10m 공기권총 은메달리스트 김예지, 10m 공기권총 금메달리스트 오예진, 10m 공기소총 금메달리스트 반효진, 25ｍ 권총 금메달리스트 양지인. 연합뉴스2024 파리 올림픽에서 역대 최고 성적을 내고도 대한사격연맹으로부터 포상금을 받지 못했던 사격 메달리스트들이 뒤늦게 포상금을 받는다.대한사격연맹은 최근 대의원총회를 열어 연맹 진흥기금에서 재원을 마련해 메달리스트와 지도자에게 총 3억2100만원을 지급하기로 결의했다. 이 중 3억1500만원은 선수와 지도자가 받는 올림픽 포상금이고, 나머지 600만원은 올림픽 출전권을 확보한 선수에게 돌아갈 금액이다.연맹 규정에 따르면 올림픽 금메달 선수 포상금은 5000만원, 은메달은 2000만원, 동메달은 1000만원이다. 지도자 포상금은 선수의 절반인 2500만원(금메달), 1000만원(은메달), 500만원(동메달)이다.당초 사격연맹은 신명주 전 회장이 지난 6월 취임 당시 약속한 3억원의 출연금으로 올림픽 포상금을 지급할 예정이었다. 하지만 신 전 회장은 운영 중인 병원 직원의 임금이 체불됐다는 사실이 알려지며 약속했던 액수를 출연하지 않고 사퇴했다.사격연맹은 신 전 회장이 사퇴할 당시 구두로 출연금 지급을 약속받았지만, 올림픽 포상금 지급이 시급하다고 판단해 진흥기금을 쓰기로 했다. 사격연맹은 1980년대부터 연맹 진흥기금을 적립하기 시작해 현재 약 16억5000만원 가량 모은 것으로 알려졌다.연맹 진흥기금을 꺼내 쓰려면 상급 기관인 대한체육회의 승인이 필요하다. 사격연맹은 대한체육회 국정감사가 끝나면 승인 절차를 밟은 뒤 이르면 다음 달 선수들에게 포상금을 지급한다는 계획이다.한국 사격은 파리 올림픽에서 금메달 3개와 은메달 3개를 획득하며 역대 최고 성적을 냈다. 대구체고 2학년 반효진은 여자 공기소총 10ｍ에서 금메달을 따내며 역대 한국 하계올림픽 100번째이자 최연소 금메달의 주인공이 됐다.양지인(한국체대)은 25ｍ 권총에서 개최국 프랑스의 카밀 예드제예스키와 슛오프(동점 상황에서 추가로 총이나 활을 쏘는 것) 접전을 벌인 끝에 금메달을 목에 걸었다.오예진(IBK기업은행)과 김예지(임실군청)는 여자 공기권총 10ｍ 결선에서 다툰 끝에 각각 금메달과 은메달을 얻었다. 김예지는 오예진과의 금메달 경쟁에서 밀렸지만 이후SNS에 '냉철한 사격수' 면모를 보인 경기 영상이 올라오며 일약 스타가 됐다.박하준(KT)과 금지현(경기도청)은 공기소총 혼성 은메달로 파리 올림픽 한국 선수단 첫 메달을 수확했다. 국군체육부대 소속으로 올림픽에 나선 조영재는 속사권총 은메달을 따 조기 전역 자격을 충족했으나, 마지막까지 병역 의무를 소화하고 지난달 만기 제대했다."
2024-09-27,“피벗 땐 가계대출 늘 것”…은행들 대출금리 선제적 인상,"━대출총량 관리 자구책가계대출 증가세 관리에 나선 은행권에서 금리를 추가로 상향 조정하는 움직임이 나타나고 있다. 최근 은행들은 대출모집인을 통한 주택담보대출을 제한하는 등 대출 문턱을 더욱 높이고 있다.26일 금융권에 따르면 우리은행은 다음 달 2일부터 주담대 금리를 0.15~0.2%포인트 인상한다. 아파트 외 연립주택·다세대주택과 오피스텔 담보대출 금리도 0.1~0.2%포인트 올린다. 전세대출 금리도 0.2%포인트 인상하기로 했다.신한은행도 다음 달 4일부터 주담대 금리를 0.1~0.2%포인트 인상한다는 방침이다. 전세자금대출 금리는 더 큰 폭으로 오른다. 보증기관에 따라 인상 폭이 달라지는데, 한국주택금융공사가 보증하는 대출의 경우 0.1~0.45%포인트 오른다. 서울보증보험과 주택도시보증공사가 보증하는 상품은 각각 0.3%포인트, 0.1~0.4%포인트 인상된다.앞서IBK기업은행도 다음 달 2일부터 주담대 금리를 0.3~0.55%포인트 인상하고, 전세대출 금리도 0.3%포인트 올리겠다고 밝혔다.NH농협은행은 24일부터 신용대출에 적용되는 우대금리를 0.1~0.3%포인트 축소했다.대출 절차를 까다롭게 하는 조치도 이어지고 있다. 신한은행은 27일부터 대출모집인을 통한 주담대·전세대출, 집단잔금대출의 접수를 한시적으로 중단한다. 대출모집인은 은행과 위탁계약을 맺고 대출자를 연결해주는 법인·상담사를 뜻한다. 대출모집인을 통한 접수가 중단되면서 금융소비자는 영업점을 방문하거나 모바일 앱을 통해서만 대출을 받을 수 있게 됐다. 우리은행도 다음 달부터 모집인 대출을 제한한다. 신한은행은 집을 담보로 생활비를 대출받는 ‘생활안정자금 목적 주담대’ 상품을 신규로 내줄 때는 지점이 아닌 본부 승인을 받는 안도 내놨다.이는 연방준비제도(Fed)의 ‘빅컷(한 번에 기준금리 0.50%포인트 인하)’ 이후 시장금리가 하락해 대출금리가 덩달아 떨어지는 상황을 선제적으로 대비한 움직임으로 풀이된다. 연내 한국은행의 기준금리 인하까지 이어질 경우 전반적인 주택 매수 심리와 대출 수요가 커지면서 가계부채 증가세에 다시 불이 붙을 수 있어서다. 은행들은 가계대출 증가세가 안정화될 때까지 한시적으로 관리 조치를 이어간다는 방침이다.하지만 은행권 내부에서는 난처한 기색도 감지된다. 연일 고강도 대책을 내놓으면서 대출을 옥죄고는 있지만, 시장금리를 역행하는 인위적인 조치 등에는 한계가 있다는 것이다. 주담대 변동금리 산정의 기준이 되는 코픽스(자금조달비용지수)는 8월 기준 3.36%로 2년여만의 최저치를 기록한데다, 석 달 연속 하락세다.한 시중은행 관계자는 “대출 문턱이 아무리 높아져도 주택 가격 상승에 대한 기대가 잡히지 않으면 주담대는 늘어날 수밖에 없다”며 “정부의 부동산 대책보다는 금융권의 조치가 우선되고 있는 것 같아 안타깝다”고 말했다.정부의 거시건전성 정책이 동반되지 않으면 내년 들어 가계대출 증가세가 다시 고개를 들 수 있다는 지적도 나온다. 향후Fed의 기준금리 인하가 이어져 시장금리가 떨어지면 대출 수요를 인위적으로 관리하는 데에는 한계가 있어서다. 석병훈 이화여대 경제학과 교수는 “내년 초 은행별 가계대출 한도가 리셋(reset)되면 눌려있던 ‘영끌’ 수요가 폭발할 가능성도 배제할 수 없다”고 지적했다."
