date,title,content
2024-12-27,"“시중은행 연봉 1억 넘는데, 왜 우린 8000만원이냐”... 기업은행 사상 첫 총파업","기은 노조 독자적 파업은 1961년 창립 이후 처음서울 중구IBK기업은행 본사. /뉴스1IBK기업은행 노조가 “임금을 올려달라”며 27일 사상 처음으로 단독 파업에 들어갔다.27일 기업은행에 따르면, 오전 10시 기준 영업점 직원의 약 55%인 약 3200여명이 파업에 참여하고 있다. 노조는 오전 10시 30분 기업은행 본점 앞에서 집결해 집회를 진행한 뒤 정부서울청사까지 가두행진을 벌일 계획이다. 일단 파업은 오늘 하루만 한다는 계획이다.노조는 “차별 임금을 철폐하고 체불임금을 받기 위해 총파업을 진행한다”며 “은행과 정부가 요구를 수용하지 않는다면 2·3차 총파업을 통해 은행 업무를 모두 마비되게 할 것”이라는 입장이다. 기업은행 노조가 독자적인 방식으로 파업을 진행한 건 1961년 창립 이후 이번이 처음이다.기업은행은 노조는 시중은행 직원보다 적은 임금을 받고 있다는 점을 파업 이유로 들었다. 금융감독원에 따르면,KB국민·신한·하나·우리 등 4대 시중은행의 작년 말 기준 평균 연봉은 1억 1368만원이다. 기업은행(8528만원)보다 약 2800만원이 많은 수준이다. 국책은행인 기업은행은 정부의 공무원 임금 가이드라인을 적용받는다.기업은행 노조는 “고금리 장기화로 기업은행이 매년 최대 실적을 기록하고 있지만 정작 직원들은 시중은행보다 훨씬 더 적은 임금을 받고 있다”며 “정당한 수당마저도 제대로 지급하지 않고 있다”고 주장한다.이번 총 파업으로 오늘은 기업은행 지점에서 업무 마비가 불가피할 것으로 전망된다. 이날 오전 9시 서울 종로구 한 기업은행 지점 창구에는 직원 1명만 출근해있었다. 원래는 6명이 업무를 보는 곳이다. 정문에는 “기업은행 노조의 파업이 예정되어 있어, 은행 업무처리 시간이 지연되거나 일부 업무가 제한될 수 있다”, “고객 양해 부탁드린다”는 내용의 공지사항이 붙어있었다."
2024-12-30,“1000명 대기 중”... 연말정산 앞두고 기부 사이트 접속 급증,"“10만원 쓰고 13만원 이득 챙기자”연말 고향사랑기부제 관심 급증[왕개미연구소]2024년 귀속 연말정산 준비를 하려는 직장인들이 한꺼번에 몰리면서 30일 고향사랑기부제 사이트 접속 지연 현상이 빚어졌다.이날 오후 행정안전부가 운영하는 고향사랑기부제 사이트인 ‘고향사랑e음’은 대기자 수가 1000명을 넘어섰다. 오는 31일까지 기부를 완료해야만 내년 1월 연말정산에서 절세 혜택을 받을 수 있기 때문에 접속자들이 한꺼번에 몰린 것으로 풀이된다. 행정안전부에 따르면, 지난해 고향사랑기부제 모금액의 40%가 연말에 집중됐다.30일 연말정산을 준비하는 직장인들이 한꺼번에 몰리면서 고향사랑e음 사이트 접속 지연이 하루 종일 빚어졌다./고향사랑e음40대 회사원 이모씨는 “회사 동료가 10만원 기부하면 전액 세액공제 받으면서 답례품으로 돼지 목살을 2kg어치 받았다고 해서 해보려고 한다”면서 “답례품 품목을 보니까 한우뿐만 아니라 쌀, 생선, 김치, 딸기, 장어, 젓갈, 참기름 등 무척 다양해서 둘러보는 재미가 있다”고 말했다.고향사랑기부제는 직장인이 주민등록상 주소지 외의 지자체에 기부하면 세액공제 혜택과 함께 기부금의 30% 상당 답례품을 받는 제도다. 대다수 직장인들은 10만원 기부를 선택한다. 연말정산 때 전액 돌려받는 액수가 10만원이 최대 금액이기 때문이다. 10만~500만원은 세액공제(16.5% 지방세 포함) 혜택을 받는다.기부금은 연말정산 간소화 서비스에 자동으로 반영되기 때문에 소비자는 별도의 영수증 등록 절차 없이 세액공제를 받을 수 있다.2024년 1월 1일부터 12월 31일까지 기부한 금액 중 10만원까지는 전액 공제되고, 10만원 초과 금액에 대해선 16.5%의 세액공제가 적용된다./고향사랑e음✅일본은 15년 만에 1조엔 돌파올해로 시행 2년째를 맞은 한국의 고향사랑기부제는 일본이 지방소멸 극복방안의 하나로 시도해 성공한 고향납세제(ふるさと納税)를 본따서 만든 것이다. 개인이 2000엔 이상 원하는 지역에 기부하면 답례품(기부액의 30% 이내)과 세액공제 혜택을 받을 수 있다.일본은 제도 시행 15년 만인 지난해 고향납세 기부액이 1조엔(약 9조3248억원)을 넘어섰다. 고향납세로 주민세 공제를 받은 사람은 전년 대비 107만명 증가한 1000만2000명으로 역대 최대를 기록했다.한국은 작년에 고향사랑기부금으로 651억원을 모았다. 행정안전부에 따르면, 올해는 작년보다 더 금액이 늘어날 전망이다. 지난 30일까지 기부금은 약 800억원으로, 전년 동기 대비 23% 늘었다.행정안전부 관계자는 “기부자에게는 답례품 포인트가 지급되는데, 5년간 유효하다”면서 “기부 시점 이후에도 언제든지 답례품 신청이 가능하므로 대기자 수가 상대적으로 적은 연초에 접속하면 빠르게 신청할 수 있다”고 말했다.그래픽=조선디자인랩 이연주✅민간 플랫폼, 이달부터 본격 가동고향사랑기부제는 이달부터 민간 플랫폼 참여에 본격 시동이 걸리면서 날개를 달 전망이다. 업계 관계자는 “일본에서도 고향납세제가 원래는 관(官) 주도였다가 2014년 민간에 개방하면서 폭발적으로 성장했다”면서 “한국 역시 민간 플랫폼들의 참여가 늘어나면서 기부가 더욱 활성화될 것”이라고 말했다.현재 민간 플랫폼으로는 ‘위기브’와 ‘놀고팜’ 등이 있고,KB국민은행, 신한은행, 하나은행,IBK기업은행,NH농협은행 등 은행들도 서비스 제공을 시작했거나 계획 중이다.그런데 민간 플랫폼을 통해서 납세자가 기부하면 일정 수수료(약 10%)가 일부 플랫폼의 몫으로 돌아간다. 이에 대해 수수료 부담을 지적하는 목소리도 있지만, 플랫폼이 적극적으로 홍보 활동을 벌이는 점을 고려하면 타당하다는 반박도 있다.실제로 ‘위기브’는 12월 기부자 전원에게 2000원 상당의 포인트를 지급하고, 추첨을 통해 다이슨청소기 등 선물을 주는 이벤트도 진행 중이다. 페이코 사이트를 통해서 접속해 기부하면 5000원 어치 포인트도 추가로 얻을 수 있다.민간 플랫폼에 최근 참여한 A지자체 고향기부사랑제 담당자는 “작은 식당이 배달 플랫폼을 통해서 더 많은 손님들을 확보하듯, 지자체 입장에선 수수료가 들더라도 홍보가 더 많이 되는 것도 중요하다”면서 “작년보다 기부 참여자 수가 크게 늘어나서 민간 플랫폼 효과를 톡톡히 보고 있다”고 말했다."
2024-07-07,[단독] 반도체·바이오 지원하라고 했더니 담보 잡고 돈빌려준 산업·기업 은행,"정부가 반도체·바이오·이차전지 등 첨단 산업 육성을 위한 금융 지원을 하기로 했지만, 이를 수행한 국책은행은 기술 신용대출보다 담보 대출을 훨씬 많이 한 것으로 나타났다. 기술력이 있어도 부동산같은 담보가 없는 기업들은 정부의 정책자금 지원을 받기가 어려웠던 것이다.삼성전자 직원들이 경기 화성시 반도체 공장에서 실리콘 웨이퍼를 들여다보고 있다. /삼성전자7일 국민의힘 윤영석 의원이 산업은행, 기업은행 등에서 받은 자료에 따르면 작년 1월부터 올해 4월 사이 정책금융 기관들은 반도체·바이오·이차전지 등 국가 첨단 전략산업 기업에 9조6180억원의 담보대출을 실행했다. 반면 이 기업들의 기술력을 평가해 돈을 빌려주는 기술 신용 대출 금액은 3조3170억원에 그쳤다. 담보대출의 3분의 1 수준이다. 특히 반도체·바이오 분야는 기술 신용 대출이 7530억원으로 담보대출(3조8002억원)의 5분의 1에 불과했다. 첨단 기술 기업에 대해 기술력보다는 주로 부동산 등의 담보가 있는지와 담보 가치를 따져서 대출을 지원한 것이다.첨단 전략산업 기업에 정부가 담보를 잡고 빌려주는 돈의 이자는 연 4.7~4.8%였다. 기술 신용 대출 이자는 연 5.1~5.4% 정도로 담보대출보다 0.3~0.7%포인트 높았다.정부의 첨단 전략산업 금융 지원이 담보대출에 편중돼 있어서 경쟁력을 갖춘 혁신 기업의 성장이 지체될 수 있다는 지적이 나온다. 윤 의원은 “기술력 평가, 기술 담보 능력에 기반한 기술 신용 보증 등의 간접 지원을 강화하고, 정책금융 기관의 기술 심사 능력을 높여 기술 신용 대출을 적극 실행해야 한다”고 말했다."
2024-03-28,"기업은행에 SOS 요청한 中企, 1년 새 2.5배 급증","작년 1074社… 고금리에 자금난지난해IBK기업은행에 구조조정을 요청한 중소기업이 1년 새 2.5배 급증한 것으로 나타났다. 경기가 둔화하고 고금리 기조가 이어지면서 빚 상환에 추가 자금 지원이 필요한 중소기업이 크게 늘어난 것으로 보인다.27일IBK기업은행에 따르면 지난해 12월 말 기준 기업은행이 운영하는 ‘구조조정 프로그램’에 신규 지원한 기업은 1074개다. 전년 421개 대비 2.5배쯤 늘었다. 기업은행의 지원 규모도 2022년 1조1000억원에서 지난해 2조7000억원으로 1조6000억원 늘었다. 이는 기업은행 창립 이래 최대 규모다. 기업은행 관계자는 “경영이 어려운 기업이 부실 발생 전 선제적으로 지원하여 규모가 증가했다”고 설명했다.‘구조조정 프로그램’은 부실 징후가 있지만 정상화가 가능한 기업에 대해 채무조정과 신규 자금 지원 등 금융권 공동 혹은 단독으로 구조조정을 지원하는 프로그램이다. 부실 징후가 있는 기업이란 통상적인 자금차입 외에 추가적인 자금 유입 없이는 정상적 채무이행이 어려운 상태에 놓인 기업을 말한다.중소기업의 경영난 심화는 각종 지표를 통해서도 확인된다. 금융감독원의 ‘국내은행의 부실채권 비율’에 따르면 지난해 말 중소기업의 부실채권 비율은 0.64%로 전년 대비 0.11%포인트 올랐다. 같은 기간 대기업 부실채권 비율이 0.01%포인트 오른 점을 감안하면 상승폭이 훨씬 컸다. 보험사의 경우도 마찬가지다. 지난해 말 보험사의 중소기업 부실채권 비율은 전년보다 1.04%포인트 오른 1.33%였는데, 같은 기간 대기업 부실채권은 0.03%에서 0.08%로 소폭 오르는 데 그쳤다.한국은행에 따르면 지난 1월 신규 취급액 기준 예금은행의 중소기업 대출 금리는 평균 연 5.28%로 2022년 10월 이후 16개월 연속 연 5% 선을 유지하고 있다."
