date,title,content
2023-04-20,“나만 빼고 다 달렸네...” 2000% 수익 인증샷에 ‘코닥둥절’ 증후군 [왕개미연구소],"올해 34% 상승하며 전세계 1위 찍은 코스닥지수코스닥 개인 매수금액 6조 중에서 절반은 빚[왕개미연구소]“경기 전망도 나쁘고 해서 코스닥은 금방 꺾일 줄 알았는데...”코닥둥절(코스닥 세계 1위+어리둥절) 시대를 맞아 개인 투자자 간에 온도차가 커지고 있다. 올해 코스닥지수는 19일까지 34% 상승해 전세계 주요국 증시 중 상승률 1위를 기록했다. 같은 기간 형님격인 코스피 상승률(15%)을 압도하는 건 물론이고, 미국 나스닥지수(17%)와도 격차가 크다.올해 1분기 증시에서 ‘코닥둥절’을 만들어낸 주인공은 개미들이다. 연초부터 지난 19일까지 코스닥 시장에서만 5조4000억원 어치 주식을 샀고, 20일에도 5400억원 어치 주식을 사모았다.코스닥 시장은 20일 기준 전체 시가총액이 420조원으로, 코스피(2022조원)의 5분의 1 수준에 불과하다. 증권업계 관계자는 “코스닥은 중소기업 상장사들이 대부분으로, 비즈니스 성숙도가 아직 높지 않은 곳”이라며 “개인 순매수 금액이 5400억원이라는 말은 코스피에서 2조5000억원 넘게 주식을 산 것이나 마찬가지”라고 말했다.개인들은 코스닥 시장에서 특히 2차 전지 종목에 집중 베팅했다. 20일 한국거래소에 따르면, 올해 개인들의 코스닥 순매수 상위 7개 종목은 전부 2차 전지 관련이었다. 개인들이 2차 전지 관련 코스닥 종목에 넣은 돈은 모두 3조1145억원(TOP7 기준)이었는데, 이는 전체 코스닥 순매수 금액의 58%에 달한다.가뜩이나 유동성이 마른 상황에서 특정 종목으로만 돈이 쏠렸기 때문에 주가는 거침없이 올랐다. 유튜브에서 특정인이 적극적으로 몇 개 종목을 홍보하면서 자금 쏠림은 더욱 가속화했다. 호재가 있더라도 단기간 주가가 지나치게 급등한 종목에는 공매도(주가 하락에 베팅)가 끼어들고 주가 하락으로 이어지곤 하는데, 이런 주식 시장의 ‘국룰’도 통하지 않았다. 이달 기준 코스닥 시장의 일평균 공매도 거래대금은 역대 최대인 3585억원을 기록했다.개인들의 최애 종목인 에코프로는 연초 이후부터 지금까지 450% 급등해 그야말로 ‘인생역전 끝판왕 주식’으로 떠올랐다. 2위인 에코프로비엠 역시 200% 넘게 올랐고, 나노신소재 역시 올해 상승률이 100%에 육박한다.지난 10일 한 온라인 주식 커뮤니티에 올라온 에코프로 주주의 계좌 수익률 인증샷. 이날 에코프로 종가는 72만2000원이었고, 다음날인 11일에는 82만원까지 올랐다.1분기(1~3월) 주식 투자 성과는 2차 전지 주식을 갖고 있느냐 아니냐가 갈랐다. 온라인 주식 커뮤니티에는 ‘흙수저인데 에코프로로 10억 벌어 퇴사하고 내 오랜 꿈인 식당을 차리려 한다’,‘2000프로 달성~ 에코프로 임직원분들 감사드립니다’는 등 온갖 인증글이 연이어 올라왔다. 전부 포모(FOMO·나만 혼자 소외되는 불안) 증후군을 유발하는 내용들이다. 주부들이 모여 있는 맘카페조차 “이제 꺾이겠지 하면서도 2차 전지만 계속 오르는데, 지금이라도 들어가야 하느냐”는 질문글이 가득하다.코스닥이 오르면 오르는대로, 떨어지면 떨어지는대로, 개인 매수세는 꺾이지 않고 있다. 20일 코스닥지수는 전날보다 2.6% 하락해 900선이 깨져 885.71에 마감했다. 하지만 이날도 개인들은 코스닥 시장에서 5400억원 어치 주식을 사모으며 방어에 나섰다. 50대 회사원 A씨는 “총알이 다 떨어져서 더이상 주식을 살 수가 없는데, 다른 사람들은 총알이 어디서 이렇게 계속 나오는지 궁금하다”고 말했다.고물가에 주식 살 돈은 어디에서 오는가 궁금하겠지만, 올해 코스닥 매수 금액의 절반은 ‘빚’이었다. 박소연 신영증권 연구원은 “올해 개인 코스닥 순매수는 5조4000억원인데 신용융자 증가액이 2조6000억원으로 48%를 차지한다”면서 “ 코스닥을 좋게 보고 리스크 테이킹(위험 부담)을 하는 사람들이 많다는 의미이지만 그만큼 과열 징후가 있는 것이므로 주의해야 한다”고 말했다.⇒코스닥 신용잔고 추이 그래프(위)를 보면, 언제 무너져도 이상하지 않을 만큼 기울기가 아찔하다.실제로 2020~2021년과 비교하면, 코스닥에서 투기성 베팅 징후는 더욱 뚜렷해진다. 20일 신영증권에 따르면, 2020년과 2021년 코스닥 개인 순매수 금액은 각각 16조3000억원, 10조9000억원이었다. 하지만 빚투 증가분은 각각 4조4000억원, 1조4000억원에 불과했다. 은행에서 돈을 빼내서 증시로 가져온 이른바 ‘순수한 현금 매수’가 많았다는 의미다.에코프로 주가가 급등하면서 최대 주주인 이동채 상임고문의 주식 평가액이 최태원SK그룹 회장과 구광모LG그룹 회장보다 많아졌다.CXO연구소에 따르면, 이 고문의 주식 재산 평가액은 지난달 말 기준 2조5031억원이었다./뉴시스편득현NH투자증권WM마스터스 전문위원은 “은행 손실에 따른 대출 축소, 기업 이익과 소비자 구매력 감소, 지정학적 긴장감 등 금융시장에 변동성을 유발할 요인들이 꾸준히 쌓이고 있는데 아직 명확하게 보이지 않는다며 무시하는 투자자들이 많다”면서 “이런 변수들은 파괴력이 크기 때문에 과도한 빚투나 이익 창출력이 부족한 기업에 대한 투자는 서서히 정리하는 것이 바람직하다”고 조언했다."
2022-06-30,LG엔솔 美공장 재검토 소식에… 배터리 업종 동반 급락,"서울 영등포구 여의도 파크원에 입주한LG에너지솔루션 본사 로비. /뉴스1전기차 배터리 업종 전망이 밝지 않다는 우려가 확산되면서 관련 주식들이 줄줄이 하락했다. 29일 전기차 배터리 분야 선두 기업인LG에너지솔루션 주가는 전날보다 4.63% 하락한 39만1500원에 장을 마감했다. 주가가 40만원 밑으로 떨어진 것은 5월 12일(38만8000원) 이후 처음이다.이 회사의 최대 주주인LG화학 주가는 7.02%나 떨어져, 이날 코스피 시총 상위 10개 기업 중 최대 낙폭을 기록했다.LG엔솔 공급망과 연계되어 있는 코스닥 상장사 엘앤에프(-7.20%)와 나노신소재(-2.74%)도 동반 하락했다.LG엔솔 경쟁사인 삼성SDI의 주가도 1.89% 하락한 57만원을 기록했고, 전기차 배터리 핵심 소재인 양극재를 생산하는 코스닥 상장사 에코프로비엠도 주가가 하루 만에 5.08% 떨어졌다.업계 1위인LG엔솔의 미국 투자 계획 전면 재검토가 이날 전기차 배터리 관련 기업들 주가 하락의 방아쇠를 당긴 것으로 보인다.LG엔솔 측은 올해 3월 미국에 1조7000억원을 들여 배터리 공장을 짓기로 했지만, 최근 고물가·고환율 여파로 투자비가 2조원대 중반까지 불어날 것으로 보고 계획을 수정하기로 했다.김현수 하나금융투자 애널리스트는 “2025~2026년 예상 시장 점유율은LG엔솔이 44.4%로 다른 기업들과 대비해서도 압도적”이라며 “LG엔솔이 그만큼 공격적인 증설로 시장 지배력을 확보할 가능성이 높다는 것이지만, 한편으로는 전체 시장 규모 대비 과도한 증설을 계획하고 있다는 의미로도 해석할 수 있다”고 했다.증권가에서는 “전기차 배터리 생산 여건이 단기에 좋아지기는 어렵다”고 보고 있다. 배터리 핵심 원재료들의 가격 상승세가 지속되고, 반도체 공급망 차질도 당분간 이어질 가능성이 높기 때문이다.장정훈 삼성증권 애널리스트는 “지난해 급등했던 배터리 재료 가격 상승세가 올해도 지속됐는데, 리튬은 작년부터 지난달까지 806%, 니켈은 74%나 올랐다”며 “지금까지는 최종 소비자들에게 이 비용들을 전가했지만 앞으로도 계속 전가할 수 있을지 의문”이라고 말했다."
2024-10-25,KERI 창립 48주년 기념식,"한국전기연구원 김남균 원장(오른쪽)이 기관 창립 48주년 기념식에서 모범직원상 수상자들과 기념 사진을 찍고 있다.한국전기연구원(KERI)이 24일(목) 창원본원 대강당에서 임직원 및 가족과 함께하는 ‘창립 48주년 기념식’을 개최했다.김남균 원장은 창립기념사를 통해 “통상적인 가족의 개념을 넘어 연구원 동료도 또 하나의 가족이라는 생각으로 공동의 목표와 비전을 향해 달려가야 한다”라며 “원장 취임 이후 다양한 방식으로 연구원 직원과 소통했고, ‘칭찬합시다 사내 게시판’ 신설 등을 통해 서로를 아끼고 응원하는 긍정적인 업무 환경을 구축하려 했다”라고 전했다. 이어 올해 새롭게 입사하거나 결혼한 사람, 대외 큰 상을 받은 직원을 소개하며KERI가족이 다 같이 축하할 수 있는 자리를 마련했다.김 원장은 이어 “휴가 사용 장려, 일-생활 균형 캠페인 진행 등KERI가족을 위한 많은 노력을 기울였고, 그 결과 여성가족부로부터 ‘가족친화인증’을 받았다”라고 밝히며 “앞으로 대학과의 벽 허물기, 유관기관·기업 간MoU체결 및 국제협력 등 더욱 넓은 범위의 가족과 함께하여 연구원이 크게 성장할 수 있도록 만들자”라고 당부했다.마지막으로 김 원장은 기관 명칭인 ‘KERI’와 유산의 영어 명칭인 ‘HERITAGE’를 합친 신조어인 ‘케리티지(KERITAGE)’를 제시하며, “선배 가족이 남겨준 훌륭한 성과와 탄탄한 기반으로 인해 지금의 연구원이 존재하는 만큼, 우리도 미래KERI가족에게 자랑스러운 유산을 남길 수 있도록 열심히 달려가자”라면서 지속 가능한 가족 공동체 정신을 강조하며 창립기념사를 마무리했다.이날 기념식에서는 국가과학기술연구회 이사장상을 비롯해 모범직원상, 청렴상, 장기근속상(10~40년), 안전관리 우수연구실 시상식도 같이 진행됐다. 특히 올해 행사는 ‘케리티지(KERITAGE)’ 슬로건에 맞게 예년과 달리 임직원 가족도 초청하여 연구원 견학 투어, 축하 공연을 함께 즐기는 시간을 가졌다.한편,KERI는 과학기술정보통신부 국가과학기술연구회 산하 전기전문 정부출연연구기관으로, 대한민국 전기공업 및 전력사업 진흥을 위해 1976년 12월 29일 설립됐다. 현재 경남 창원에 소재한 본원 외에 3개의 지역조직(안산, 의왕, 광주)이 있으며, 인력은 약 800명이다. 주요 업무 분야로는 전력망 및 신재생에너지, 친환경 전력기기, 전기모빌리티 및 산업응용 기술, 나노신소재 및 배터리, 전력반도체, 전기의료기기, 전력기기 국제공인 시험인증 등이 있다."
2024-08-16,"중앙대-한국기계연구원, 인력 양성 및 연구 협력 협약","협약식 단체 기념사진중앙대학교(총장 박상규)가 우수 연구인력을 양성하고, 협력 연구를 추진하기 위해 한국기계연구원(KIMM)과 손을 맞잡았다.중앙대는 13일 ‘학연 교류 활성화와 상호 발전을 위한 중앙대학교-한국기계연구원 학연 교류 협약식’을 서울캠퍼스 210관(본관) 3층 총장단 회의실에서 개최했다고 16일 밝혔다.협약식에는 류석현 원장을 비롯해 송동근 친환경에너지연구본부장, 유병민 행정본부장 등KIMM관계자들이 참석했다. 이현순 학교법인 중앙대학교 이사장과 박상규 총장, 성맹제 연구부총장, 장승환 공과대학장, 장항배 연구처장 등 중앙대 관계자들이 외빈들을 맞이했다.이번 협약을 통해 중앙대와KIMM은 공동연구과제 기획을 통한 도전적인 연구과제 수주, 공동 연구 수행 등에 힘을 모으기로 했다. 인공지능(AI), 첨단로봇, 에너지, 초정밀장비, 반도체장비, 나노 신소재, 의료장비, 국제물류 등 첨단 과학기술 분야 전반에서 교육·연구·산학협력을 아우르는 우수 연구인력·정보 교류를 통해 상생 발전을 도모하는 것이 목표다.양 기관은 연구 역량을 극대화할 수 있도록 빠른 시일 내 상호 학연교수 임용을 시행할 예정이다. ▲공동연구과제 기획 ▲연구과제 수주 ▲융합연구 사업 수행 ▲연구인력 상호 교류 ▲현장실습·교육 기회 제공 ▲연구·교육 정보 교류 ▲논문 공동지도 ▲글로벌 연구 네트워크 구축 등 다양한 협력 사례도 선보일 계획이다.이현순 이사장은 “중앙대와KIMM이 도전적이고 창의적인 연구 협력에 뜻을 같이하게 된 것을 기쁘게 생각한다. 양 기관의 발전과 국가 미래 성장 동력 확보에 힘쓰겠다”고 말했다.박상규 총장은 “KIMM과 같은 훌륭한 연구기관과의 학연 교류는 대학의 경쟁력을 높이는 데 있어 매우 큰 힘이 된다. 이번 협약을 통해 연구중심대학 중앙대의 연구 역량을 강화하고, 우수 연구인력 양성에도 매진하고자 한다. 양 기관이 함께 발전하는 좋은 계기가 되길 기대한다”고 했다."
2024-08-09,"세종대, 과기부 글로벌 기초연구실 지원사업 2개 과제 선정","세종대 전경세종대학교(총장 엄종화)가 과학기술정보통신부와 한국연구재단이 주관하는 ‘2024년도 글로벌 기초연구실 지원사업(BRL,BasicResearchLaboratory)’ 2개 과제에 선정돼 약 27.5억 원의 연구비를 지원받는다.‘글로벌 기초연구실 지원사업’은 국가 기초연구 역량을 강화하고자 소규모 연구그룹을 지원하는 정부재정지원사업이다. 미래 우리나라 과학기술을 선도할 우수 연구자를 양성하기 위해 심화형, 융합형, 개척형 등 3개 유형을 기반으로 연구팀을 선정하며, 총 과제수 962개 중 이번에 145개 과제가 신규로 선정됐다.이번에 공학/소재(심화형) 분야에 선정된 세종대 나노신소재공학과 김기범 교수(연구책임자)와 홍성환, 박혜진 교수(공동연구원) 연구팀은 ‘금속 소재의 기계적·광학적 특성과 결함과의 상관관계 규명을 위한 기초연구실’을 주제로 연구를 진행할 예정이다.향후 3년간 연구팀은 구리 기반 합금의 합금 조성 및 공정 온도 변수에 따른 적층결함 에너지 제어를 통해 합금의 구조적 결함을 제어하고, 변형 시 발생하는 기계적 결함 제어를 통해 금속 소재 내 형성된 결함의 특성과 기계적·과학적 특성에 대한 상관관계를 규명할 계획이다. 이 기술은 금속 소재의 강도 및 색상을 제어할 수 있는 새로운 메커니즘 규명 및 제어 기술 확보를 통해 합금/공정/특성 예측 기술 개발을 가능하게 할 것으로 기대된다.김기범 교수는 “기존의 금속 소재의 기계적 특성 또는 광학적 특성 각각의 독립적인 연구 분야를 융합해 금속 소재의 미세조직/결함 특성과 기계적/광학적/부식 특성과 상관관계에 대한 새로운 연구영역을 제시하는 도전적인 주제”라며, “세종대 내 첨단소재 분야 전문가 및 금속재료 분야 국제 저명 연구자인 오스트리아MontanuniversitätLeoben재료과학과J.Eckert교수 그룹과의 공동 연구를 통해 세계적인 수준의 성과를 목표로 하고 있다”고 말했다.이번 사업의 기반생명(심화형) 부분에 선정된 세종대 스마트생명산업융합학과 진중현 교수(연구책임자)와 공동연구원 김현욱 교수(바이오산업자원공학과)와 김경도, 박현승 교수(스마트생명산업융합학과) 연구팀은 ‘파이토케미칼 기반 디지털육종연구실’을 주제로 연구를 진행한다.이번 연구에서 연구팀은 기능성식물 유래 천연물과 지방산의 대사를 조절하는 메커니즘을 밝히고, 중요 천연 기능성물질의 화학적 구성요소가 특정화된 식물 종자를 개발한다. 이를 위해, 식물유전육종학, 생물정보학, 분자생물학 및 합성생물학 각 분야의 전문가가 협력해, 간세포 기능 활성과 관련된 실리마린(silymarin)을 함유하고, 고품질 식용유 국내 생산의 대안으로 활용될 수 있는 밀크씨슬(흰무늬엉겅퀴)을 연구의 소재로 삼았다.연구팀은 세계 최초로 국내 자생형 밀크씨슬의 표준 유전체를 네이쳐 자매지인ScientificData에 발표하고, 다수의 밀크씨슬의 유전체 분석 및 유전자 발현 연구 등을 수행한 경험을 바탕으로, 유독 밀크씨슬에서만 실리마린이 생성되는 과정을 밝히고, 기존 밀크씨슬 오일의 한계였던 산폐가 심한 오메가-6 생성 메커니즘을 연구하고 있다. 유전체 정보와 이미지-AI분석 등을 디지털기반 품종개발 방법으로 특정화된 유전자 정보를 활용해, 실리마린과 지방산 대사경로 조절을 통해 변형하는 것도 연구 방법에 포함했다. 이번 연구를 통해, 식물 유래 유용 천연물 성분의 지표 성분을 특정화하고 부가가치가 높은 우수한 종자를 개발할 수 있는 전략을 수립하는 데 도움을 줄 것으로 기대된다.진중현 교수는 “우리가 밀크씨슬을 선택한 이유는 주요 성분인 실리마린의 해외의존도가 높은데, 숙취해소 및 면역 등 시장 가치가 높은데, 자기 꽃가루를 활용하여 번식하는 종자형 약용작물이고, 유전체 구조가 비교적 단순하여, 과학적 유전육종 기술 적용의 모범을 보일 수 있다”며, “세종대는 첨단육종-생물정보학-분자생물학-합성생물학으로 연결되는 전문가 구성을 확보했고, 파이토케미칼 연구의 세계적 연구집단들과의 글로벌 공동 연구를 통해 세계적 선도그룹으로 성장할 것을 목표로 하고 있다”고 포부를 밝혔다.이번 사업에 선정된 세종대 2개 연구팀은 2024년 8월 1일부터 2027년 4월 30일까지 2년 9개월 동안 각 사업별로 약 13.75억 원의 연구비를 지원받아 관련 연구를 수행하게 된다."
