date,title,content
2023-07-28,"ETRI, 일본 기술 대비 95% 전력 절감한 반도체 패키징 기술 개발","ETRI연구진이 반도체 공정을 살펴보는 모습./ETRI국내 연구진이 반도체 패키징 분야의 핵심원천 신소재 기술 개발에 성공했다. 향후 자율주행, 데이터센터 등 고성능이 필요한AI반도체 제조의 핵심 소재기술로 사용될 전망이다.한국전자통신연구원(ETRI)은 28일 자체 보유한 나노 소재기술을 이용해 반도체 공정에 필요한 신소재를 개발했다고 밝혔다. 이 기술은 기존 일본이 보유한 기술 대비 95% 전력 절감이 가능한 반도체 칩렛 패키징 기술이다.연구진이 개발한 기술은 반도체 웨이퍼에 연구원이 개발한 신소재인 비전도성 필름(NCF)을 붙인 후 타일처럼 생긴 칩렛에 면 레이저를 조사(照射)해 경화하는 총 3단계로 이뤄진다. 그동안 반도체 업계에서는 첨단 반도체 패키징 공정에 주로 일본 소재를 사용해 왔다. 하지만 공정이 총 9단계를 거치는 등 복잡하고 다양한 장비가 사용되며 높은 전력소모, 청정실 유지비용, 유해물질 배출 등이 큰 단점이었다. 기존기술로는 칩렛 집적기술이 요구하는 수십 마이크로미터(㎛) 크기의 칩간 연결통로라 할 수 있는 접합부의 세척 불가능, 상온에서 접합의 필요성 등이 적용하기 어렵다는 단점도 있었다.반도체 공정 모습./ETRI연구팀이 개발한 기술은 자체 보유한 나노소재 설계기술과 나노신소재를 활용했다. 개발한 공정은 첨단 반도체 웨이퍼 기판에 개발한 나노 신소재를 적용한 후 다양한 웨이퍼에서 제작된 칩렛으로 타일을 만들어 1초 정도의 면 레이저를 쏘아서 접합 공정을 완성하고 후경화 공정으로 완료된다. 연구진이 개발한 기술은 공정이 간단해 전체 생산라인을 기존 20미터(m)이상을 4미터로 즉, 20%로 줄일 수 있다. 질소 가스도 필요 없어 유해물질이 발생하지 않는 장점도 있다.미국의 마이크로LED관련 스타트업은 물론 첨단 반도체 분야의 세계적인 파운드리 회사가 공정성과 신뢰성 평가를 진행하고 있어 향후 우수 평가시 3년 내 상용화가 가능할 것으로 전망하고 있다.ETRI는 향후 반도체 디스플레이 업체가 필요로 하는 저전력·친환경 공법에 이 기술을 적용할 수 있을 것으로 기대한다."
2023-12-19,‘배터리 아저씨’ 정계 진출… 내년 총선 앞두고 신당 창당,"박순혁 “가칭 ‘금융개혁당’ 비례 2번으로 출마”일명 ‘배터리 아저씨’라고 불리는 박순혁씨/뉴스1이차전지 분야 투자를 조언해 개인 투자자들로부터 큰 인기를 얻은 일명 ‘배터리 아저씨’ 박순혁 전 금양 홍보이사가 정계 진출을 선언했다.19일 금융투자업계에 따르면 박씨는 선대인 선대인경제연구소장과 손잡고 금융개혁을 기치로 내건 신당 창당에 나선다. 내년 1월 초를 목표로 가칭 ‘금융개혁당’ 창당 준비위원회를 정식으로 출범시킬 계획이다. 두 사람이 공동대표를 맡아 4월 총선에 비례대표 후보 5~6명을 내기로 했다.비례대표 1번은 상징성이 있는 인물로 국민 추천을 받고, 박씨는 비례 후보 2번으로 나설 예정이다. 비례 3번은 박씨의 팬카페 ‘박지모(박순혁 지키는 모임)’ 의장 신미숙씨가, 4번은 한국주식투자자연합회(한투연) 정의정 대표가 받을 것으로 알려졌다. 비례대표 후보 5번으로는 그간 공매도 이슈를 집중적으로 취재해온 20대 증권부 기자를 염두에 두고 있다고 한다.박씨는 “정부의 공매도 제도 개선 노력이 교착에 빠진 상태”라며 “이에 직접 나서서 개혁을 이뤄내야겠다는 뜻을 품게 됐다”고 말했다. 공매도 제도 개혁의 동력을 얻기 위해 정치권에 뛰어들게 됐다는 뜻이다. 그러면서 박씨는 “사실상 증권사 등 업자들과 짬짜미를 하고 있는 금융감독원·한국거래소가 정치적 통제를 받도록 하는 공약도 낼 예정”이라고 했다.박씨는 대한투자신탁 애널리스트, 메가마이다스투자자문 본부장 등을 거쳤고 올해 상반기 이차전지주 열풍을 주도했다. 금양 홍보 이사 신분으로 유튜브와 각종 언론에 등장해 에코프로·에코프로비엠·포스코홀딩스·포스코퓨처엠·LG에너지솔루션·LG화학·SK이노베이션·나노신소재 등 8종의 이차전지 대표주를 추천해 당시 개인 투자자들로부터 큰 신임을 얻었다."
2023-12-14,메타버스 구현 위한 XR 핵심 기술 개발 나서는 등 연구 역량 입증,"[2024QS아시아대학평가] 세종대학교세종대 반도체시스템공학과 임유승 교수(가장 왼쪽) 연구팀이 반도체 소자 공정 과정을 살펴보고 있다./세종대 제공세종대학교(총장 배덕효)가 영국 글로벌 대학평가 기관QS(QuacquarelliSymonds) 발표 ‘2024QS아시아대학평가’에서 아시아 76위를 기록했다. 2020년 83위, 2021년 81위, 2022년 79위에 이어 올해는 3계단 오른 76위로 꾸준한 상승세를 보였다.세종대는 올해도 연구의 우수성을 의미하는 논문당 피인용수 부문에서 두각을 나타냈다. 아시아에서는 지난해 23위에서 2계단 상승한 21위, 국내에서는 2위를 차지했다. 국제화 부문에 속한 국제연구협력 항목에서도 세종대는 92.1점으로 아시아 36위, 국내 2위를 기록했다. 국제연구협력에서 90점대 이상을 받은 국내 대학은 서울대(95.1점)와 세종대 두 곳뿐이다.세종대의 우수한 연구력은 논문의 질(質)로 세계대학을 평가하는 ‘2023 라이덴대학평가’에서 처음 국내 1위를 차지하는 성과로도 이어졌다. 이는 모두 세종대가 차세대 선도학과를 육성하며 창의적 연구 환경 조성을 위해 노력해 온 결과이다.첨단 공학계열로의 혁신적 패러다임 전환… ‘세종 테크놀로지’ 구축창립 83주년인 세종대는 ‘2030년 글로벌 100대 대학 진입’을 목표로 경쟁력 강화에 나서고 있다. 이를 위해 ▲세종 아너스 프로그램 운영 ▲교육기자재 고도화 사업 ▲디자이노베이션 활용 등 융합시대에 걸맞게 교육 방법을 혁신했다.세종대는 차세대 선도학과 육성을 통한 창의적 융합인재 양성, 우수 교수진의 파격적인 연구 성과로 글로벌 경쟁력을 강화하고 있다.특히 1990년대부터 시도한 첨단 공학계열로의 혁신적 패러다임 전환을 통해 ‘세종 테크놀로지’를 만들어가고 있다. 우선 차별화된 연구 성과를 보여주는 바이오생명공학·나노신소재공학·물리천문학뿐만 아니라 양자원자력·건설환경공학 등 경쟁력 있는 전공을 구축했다. 또한 소프트웨어융합대학 내AI(인공지능)·빅데이터·자율주행·메타버스 등에 이르는 첨단전공을 전진 배치했다. 특히 2019년 대양AI센터 건립으로AI+X(인공지능융합) 인프라를 갖추며 세종대는AI중심대학으로 한층 더 발돋움하게 됐다. 인공지능-빅데이터연구센터는 빅데이터와 기술적 뿌리를 같이하는AI기술에 대한 기업 수요가 증가함에 따라 핵심기술 활용의 폭을 넓히고 있다.한편, 올해 신설된 반도체시스템공학과는 10년 내 국내 최고 수준의 반도체 학과로 성장한다는 비전을 수립했다. 이를 위해 ▲고용연계형 계약학과 추진 ▲반도체 고급 인력 양성을 위한 학·석사 연계 과정 확대 ▲우수 산학협력기업 확대 등의 전략을 추진하고 있다.초실감XR연구센터 등 뛰어난 연구 역량으로 각종 국책사업 선정세종대는 규모 있는 국책 사업에 연이어 선정되며 뛰어난 연구 역량을 입증했다. 특히 지난해는 다양한 신기술 관련 연구의 비전과 미래를 확인하는 의미 있는 한 해였다.세종대 초실감XR연구센터는 과학기술정보통신부·정보통신기획평가원의 ‘대학ICT연구센터사업(ITRC)’ 등 석·박사 인재양성사업에 선정돼 메타버스 구현을 위한XR(확장현실) 핵심 기술 개발에 나서고 있다. 산업통상자원부 주최, 한국진흥원 주관의 신기술 분야 ‘융합 디자인 전문인력 양성사업’에도 최종 선정됐다. 디자인이노베이션 전공을 주축으로 지능기전공학부·컴퓨터공학과·바이오융합공학전공·패션디자인학과가 ‘커넥티드 디자인 교육단’을 구성했다. 세종대 탄수화물소재연구소는 9년간 연구비 58억원을 지원받는 교육부 ‘대학중점연구소 사업’을 수행 중이다.총장 배덕호또한, 과학기술정보통신부 ‘미래우주교육센터’와 방위사업청 ‘방위산업 계약학과 지원사업’ 주관대학으로 선정됐다. 해당 2개 사업에 동시 선정된 대학은 세종대가 유일하다. 세종대 금속유기화합물 첨단소재응용 핵심연구지원센터는 교육부 ‘기초과학 연구역량강화사업’에서 핵심연구지원센터 조성지원 사업과 연구 장비 구축지원 사업에 동시 선정됐다. 지난해 6월부터 6년간 연구비 약 41억원을 지원받는다.올해 역시 낭보가 이어졌다. 지난 5월, 과학기술정보통신부 ‘가상융합세계(메타버스) 융합대학원 사업’에 선정된 것이다. 세종대는 프로젝트 중심형 교과 운영을 통해 고급 인재를 양성할 계획이다.한편, 국제연구협력 분야에서 높은 평가를 받고 있는 세종대는 2018년 과학기술정보통신부 ‘해외우수연구기관유치사업(GRDC)’의 일환으로 ‘세종대 그래핀연구소(GRI)-미국 텍사스 포토닉스 센터(TPC) 국제공동연구센터’를 운영 중이다.세종대 관계자는 “학연·지연이 아닌 논문 업적과 연구 과제 중심으로 우수한 교원을 채용하고, 상위 학술지 게재 논문에 대한 지원도 강화하고 있다”며 “이러한 노력이 여러 분야 평가에서 구체적 성과로 나타나고 있다”고 전했다."
2023-08-05,‘배터리아저씨’ 박순혁 주식 계좌 공개...어느 종목 얼만큼 샀나,"박순혁 전 금양 이사가 배터리 산업을 둘러싼 오해를 풀고 정확한 정보를 공유하는 것이 중요하다고 강조하고 있다. /조선비즈에코프로 등 2차전지 주식 전도사인 ‘배터리아저씨’ 박순혁 전 금양 홍보이사가 자신의 주식 잔고를 공개했다.지난 3일 오후 유튜브 채널 ‘웅달책방’에 올라온 영상에서 박 전 이사는 자신의 지난 7월30일 기준 주식 계좌 잔고를 공개했다. 2차전지 종목만으로 구성된 그의 전체 수익률은 85.50%. 4억5000만원을 투자해 총 3억8500여만원의 수익을 거두고 있는 것으로 나타났다. 주식 잔고는 8억3660만원을 넘겨 있었다.투자 비중 가장 높은 건 ‘2차전지ETF’박 전 이사는 올해 2차전지주 급등을 견인한 유명인사다. 유튜브와 각종 언론을 통해 에코프로, 에코프로비엠, 포스코홀딩스, 포스코퓨처엠,LG에너지솔루션,LG화학,SK이노베이션, 나노신소재 등 8종의 2차전지 대표 주식을 추천했고, 실제로 해당 종목들은 대부분 올해 눈부신 상승세를 보여줬다.에코프로 +967%, 에코프로비엠 +307%, 포스코퓨처엠 +151%, 포스코홀딩스 +118% 등으로 2차전지 투자 광풍을 주도했다.'배터리아저씨'로 불리는 박순혁 전 이사가 공개한 주식 잔고(지난 7월30일 기준)/유튜브 채널 '웅달책방' 화면캡쳐.이날 공개된 영상에 따르면, 박 전 이사는 그간 추천했던 8종의 2차전지주 가운데 포스코퓨처엠을 제외한 7개 기업에 투자하고 있었다.여기에 2차전지 양극재 기업에 집중 투자하는 미래에셋의ETF(상장지수펀드) ‘TIGER2차전지소재Fn’에도 최근 2억원 가까이 투자한 것으로 나타났다. 투자금 비중이 44%로 가장 높다. 7월 출시된 이ETF는 에코프로비엠 등 양극재 관련 기업에 대한 투자 비중이 90%로 국내 상장된 2차전지ETF중 가장 높다.그 다음으로 박 전 이사는 포스코홀딩스(5141만원)와 에코프로비엠(5131만원), 에코프로(5078만원) 등 3곳에 고르게 나눠 투자했다. 이어LG화학에 약 4500만원,LG에너지솔루션과SK이노베이션에 각 2000만원, 나노신소재에 1200만원 가량을 투자하고 있다.이중 수익률이 가장 높은 것은 단연 ‘황제주(1주당 100만원이 넘는 주식)’인 에코프로였다. 평균 단가 16만9272원에 매입해 수익률이 552.20%에 달했다. 보유 수량은 300주. 현재 주식 평가가치는 2억8041만원이었다.포스코홀딩스 수익률(+90.21%)도 양호하다. 연초 약 27만원이었던 주가는 7월에 장중 76만원을 돌파할 정도로 가파른 상승세를 탔다. 평균 22만원에 산 에코프로비엠도 현재 주당 40만원선을 넘겨 수익률이 81.83%을 내고 있었다.박 전 이사는 분산투자의 중요성을 강조했다. 그는 주식 계좌를 공개한 유튜브 방송에서 “에코프로에 몰빵(올인)하면 되지 않느냐는 얍삽한 생각을 제발 버리시길 바란다”며 “한 종목에 특별히 힘을 실어줄 수는 있지만 그 비율이 40%를 안 넘겨야 하고 5~10개 종목에 분산투자를 해야 한다”고 말했다.그가 주식계좌를 공개한 것은 이번이 처음은 아니다. 지난 4월 한 언론과 인터뷰하면서도 자신의 계좌를 공개했었다. 그 당시엔 2차전지ETF를 제외한 배터리 7종목에 8500만원을 투자하고 있었다. 그러나 2차전지 주식들이 본격적인 상승세를 타자 불과 3개월여만에 투자금을 4억5000만원 정도로 5배 넘게 늘린 것으로 나타났다. 물론 해당 주식계좌 외에 다른 증권사 계좌가 더 있을 가능성도 있다.박순혁은 누구?대구 출신의 박순혁(52) 전 이사는 연세대 경영학과 졸업 후 대한투자신탁(현 하나증권)에 입사해 30여년간 애널리스트, 자문사 운용본부장 등으로 활동했다. 작년부터는 2차전지 회사인 ㈜금양의 홍보이사로 자리를 옮겼다. 활발한 방송 활동을 펼치며K-배터리 8개 종목의 성장 가능성을 강조했고, 실제로 이들 종목이 눈에 띄는 상승률을 나타내며 개인 투자자들 사이에서 엄청난 인기를 끌었다. 일명 ‘배터리아저씨’란 별칭도 얻었다.그러나 소속 회사인 금양의 자사주 매각 공시 이전에 관련 계획을 유튜브 방송에서 먼저 공개한 게 문제가 됐다.한국거래소는 금양을 공시위반으로 제재했고, 이를 계기로 부담을 느낀 박 전 이사는 지난 5월 사표를 내고 회사를 떠났다.그럼에도 팬덤은 더 공고해졌다. 그를 신뢰하는 개인 투자자들은 5월 말 팬카페를 만들어 박 전 이사에게 지지를 보냈다.네이버에 개설된 박 전 이사 팬카페 ‘박순혁 지키는 모임(박지모)’엔 현재 6300여명이 가입해 활동 중이다. 이들은 ‘개인투자자의 권익보호를 위해 홀로 전쟁 중이신 박순혁 이사님을 응원하고 지지하는 모임’이라고 단체 성격을 설명하고 있다.지난 5월 말 네이버에 개설된 박순혁 전 이사 팬카페/화면캡쳐"
2023-09-20,6조 규모 반려동물 시장 바이오업계서도 눈독,반려동물 신약 개발 투자 늘어관절염 약·항암제 등 속속 개발국내 제약 바이오 기업들이 반려동물 의약품 시장에 뛰어들고 있다. 반려동물 양육 인구가 급증하며 글로벌 반려동물 시장 규모가 2027년 6조원대까지 늘어날 것으로 전망되자 반려동물 의약품 시장의 주도권을 잡기 위한 제품 개발에 속도를 높이고 있는 것이다.유한양행은 18일 반려동물 골관절염에 사용하는 주사제인 ‘애니콘주’를 출시했다. 애니콘주는 폴리뉴클레오타이드 성분의 골관절염 주사제로 관절강 내 탄성을 유지해 관절의 마찰을 줄여주는 효과를 낸다. 유한양행은 지난 2021년 국내 제약사 중 처음으로 반려견 치매 치료제 ‘제다큐어’를 출시한 이후 지속적으로 반려동물 의약품에 투자하고 있다.대웅제약은 반려동물 의약품 자회사 ‘대웅펫’을 통해 국산 36호 신약 엔블로정(DWP16001)을 반려견용 당뇨병 치료제로 개발하기 위한 연구를 진행하고 있다. 대웅제약은 지난 2021년 엔블로정의 동물용 치료제 개발 가능성을 확인한 뒤 지난해 말 반려견 대상 당뇨병 치료 효과와 안전성을 확보했다. 엔블로정이 반려견을 위한 경구용 치료제로 출시되면 인슐린 주사를 대신할 수 있어 치료 접근성이 개선될 것으로 전망된다.박셀바이오가 개발 중인 동물용 항암제 ‘박스루킨-15′도 품목 허가 신청을 앞두고 있다. 박스루킨-15는 반려견의 유전체 정보를 바탕으로 설계돼 지난 2021년 농림축산식품부에 품목허가를 신청했지만 추가 보완 자료가 필요하다는 의견을 받았다. 이후 임상을 재설계해 림프종과 유선종양 적응증을 대상으로 각각 60마리의 임상을 진행했으며 현재 유선종양 시험을 완료했다.이 밖에도GC녹십자홀딩스 자회사인 그린벳은 최근 나노 신소재 개발 기업 씨투씨소재와 동물용 의약품 및 보조 제품 개발을 위한 협력을 진행한다고 밝혔다. 난치성 혈관 질환 치료제를 개발하는 큐라클도 안전성평가연구소 반려동물신약개발사업단과 반려동물용 신부전 치료제 공동 개발을 위한 기술 계약을 체결했다. 큐라클은 인체 의약품으로 개발 중인 혈관내피기능장애 차단제를 반려동물 신부전 치료제로 확대해 적용할 계획이다.
2023-03-02,[인사] 과학기술정보통신부 외,▲과학기술정보통신부◇과장급 전보▷방송진흥기획과장 구본준▷원자력연구개발과장 정민원▷연구성과일자리정책과장 이은영▷정보보호기획과장 김경우▷성과평가정책과장 김영은▷과학기술정보분석과장 최미정▷부산전파관리소장 박성진▷대구전파관리소장 김기제▷제주전파관리소장 박춘배▷위성전파감시센터장 이봉호▷중앙전파관리소 전파관리과장 정일성▷서울전파관리소 이용자보호과장 김문정▷국립전파연구원 지원과장 김희원▷〃 정보통신적합성평가과장 신홍순▷〃 정보운영과장 이윤호▷우주전파센터장 나현준▷인터넷진흥과장 김단호▷네트워크안전기획과장 김국현▲을지대의료원▷경영기획처장 송현◇의정부을지대병원▷외과계부원장 송병주▷내과계부원장 손병관▷기획실장 조정만▷기획실 부실장 곽재만◇대전을지대병원▷진료 제2부원장 최유정▷교육수련부 과장 유대선▷기획실 부실장 김재국▷국제진료소장 이중선▷외과 과장 장제호▷소아청소년과 과장 김주영▷혈액종양내과 과장 황인환▲건국대◇교무위원▷국제대학장 겸 언어교육원장 염재웅◇전임교원▷인권센터 성평등상담실장 윤소현▷건축대학 건축학부장 황현종▷공학교육연구소장 권지향▷IPP듀얼공동훈련센터장 배성준▷국제대학 국제교양교육센터장 정이윤▷상허교양대학 교양교육센터장 겸 교양연구평가센터장 박삼헌◇팀·실장▷예산팀장 윤병현▷장학복지팀장 이우형▷현장실습지원센터장 홍정희▷인사팀장 문병헌▷대학원 행정실장 박근춘▷산업대학원 행정실장 이필우▷언론홍보대학원 행정실장 겸KU미디어 행정실장 조은원▷정보통신대학원 행정실장 이영일▷수의과대학 행정실장 김도형▷KU융합과학기술원 행정실장 공종국▷상허기념도서관 학술지원팀장 겸 법학전문도서관 법학학술정보팀장 온한상▷산학협력단 연구기획팀장 강우종▷〃 기술사업화팀장 겸BRIDGE+사업팀장 조병철▷캠퍼스타운사업단 캠퍼스타운사업센터장 장성수▷일우헌 행정실장 조주연▲서울시립대▷교학부총장 및 일반대학원장 송오성▷교무처장 박훈▷입학처장 장금주▷학생처장 및 대학보건소장 황선환▷기획처장 임정하▷연구처장 및 산학협력단장 정연두▷미래혁신원장 김철한▷인권센터장 이현정▷중앙도서관장 김석▷국제교육원장 송지희▷생활관장 임남희▷평생교육원장 배영수▷대학언론사주간 권영희▷교무부처장 및 출판부장 김혁▷입학부처장 김진호▷학생부처장 및 학생미래지원센터장 신인철▷기획부처장 박찬▷연구부처장 및 산학협력부단장 최용준▷미래혁신부원장 이동규▷전산정보원 부원장 박승부▷평생교육원 부원장 이재준▷체육관장 진주연▷공과대학장 김정현▷자연과학대학장 조윤희▷도시과학대학장 김강수▷예술체육대학장 신재휴▷자유융합대학장 정용국▷디자인전문대학원장 정진우▷국제도시과학대학원장 이신▷공과대학 부학장 김민호▷자연과학대학 부학장 김성곤▷도시과학대학 부학장 김충호▷예술체육대학 부학장 김성곤▷자유융합대학 부학장 강성모▷일반대학원 부원장 장영준▷디자인전문대학원 부원장 이푸로니▷국제도시과학대학원부원장 박준▷도시과학빅데이터AI연구원장 전종준▷반부패시스템연구소장 금재덕▷도시방재안전연구소장 김강수▲세종대▷교육대학원장 권현수▷인문과학대학장 이병진▷호텔관광대학장 조미혜▷대양휴머니티칼리지학장 이희원▷국어국문학과장 김승구▷일어일문학과장 김도형▷중국통상학과장 노성호▷역사학과장 우은진▷행정학과장 곽창규▷미디어커뮤니케이션학과장 임종수▷경영학부장 이희수▷수학과장 문동호▷화학과장 원종옥▷바이오산업자원공학전공 주임교수 김현욱▷전자정보통신공학과장 김재호▷소프트웨어학과장 박상일▷지능기전공학과장 정철▷건축학과장 심재현▷건설환경공학과장 권현한▷지구자원시스템공학과장 박상은▷기계공학과장 이민형▷우주항공공학과장 심형섭▷나노신소재공학과장 최택집▷나노신소재공학 주임교수 김성규▷패션디자인학과장 김민지▷영화예술학과장 박철▷조리외식경영학과 식품조리학전공 주임교수 이승주▷일반대학원 한국어교육과정 주임교수 심지영▷대학원 해양시스템융합공학과 주임교수 이근화▷교육대학원 교학부장 정은주▷교육대학원 인공지능융합교육 전공 주임교수 신승협▷산업대학원 부동산·자산관리학 주임교수 임재만▷교수학습개발센터장 장혜원▷교육과정평가센터장 최필수▷미적분학 주임교수 이언경▷GlobalHTMPrograms주임교수 권우석▷창업지원단장 황보현▷교무부처장 이수정▷학생지원부처장 이동규▷산학협력부단장 김성한▷입학부처장 고영대▷글로벌컴퓨터공학 주임교수 김문석▷음악과 외국인 주임교수 위정민▷공학교육인증 토목공학심화 프로그램(학과)PD교수 송지현▷공학교육인증 에너지자원공학심화 프로그램(학과)PD교수 배태석▷공학교육인증 나노신소재공학심화 프로그램(학과)PD교수 송희조▷공학교육인증 컴퓨터공학심화 프로그램(학과)PD교수 문현준▷SejongHonorsProgram지도교수 신원재▷뉴미디어퍼포먼스 융합전공 주임교수 최은경▷비즈니스 애널리틱스융합전공 주임교수 윤호정▷미래교육원 컬리너리 스쿨(SCIA) 주임교수 김성국▷인권/성평등센터장 김기범▲JTBC◇보임▷재무팀장 신희준▲조선일보◇차장대우 승진▷사회정책부 박세미
