date,title,content
2023-10-27,한국전기연구원 창립 47주년 기념식 개최,"한국전기연구원(KERI)이 창립 47주년을 맞아 전 직원과 함께하는 창립기념식을 26일(목) 개최했다. 이번 행사는 지난 1월 취임한 제15대 김남균 원장이 맞는 첫 최번째 창립기념식이다.김남균 원장은 창립기념사를 통해 “KERI는 지난 반세기 가까운 기간 동안 우리나라 전력산업 발전에 기여한 국내 유일의 전기전문 연구기관”이라며 “최근에는 미래 전기화(Electrification) 시대를 선도할 핵심 기술 개발을 통해 대한민국의 차세대 성장 동력을 책임지고 있다”라고 밝혔다.또한, 연구원의 지난 대표성과로 ▲정전 시간 최소화를 실현한 ‘한국형 배전자동화 시스템(KODAS)’ ▲전력 수급 안정화에 공헌한 ‘765kV전력설비 국산화’ ▲원전 신뢰성·안전성·가용도 향상을 가져온 ‘원전 계측제어 시스템’ ▲대정전 방지 및 전력 생산 최적화에 기여한 ‘전력계통운영시스템(EMS) 국산화’ ▲전기차 전비 10% 이상 높이는 ‘탄화규소(SiC) 전력반도체 상용화 기술’ 개발 등을 언급했다.이어 “올해 이차전지, 3D프린팅, 항공모빌리티, 공작기계 등 분야에서의 연구 성과가 두드러졌고, 시험인증 부문에서도 초고압직류송전(HVDC) 시험 인프라 구축, 시험성적서 통용 국가 확대 등 좋은 결과가 있었다”라고 전하며 “행정에서도 인적자원개발(BestHRD) 최우수기관 인증, 대한민국SNS대상 최우수기관 선정이 기관의 위상을 크게 높였다”며 직원들의 공로를 치하했다.김 원장은 “우리가 그동안 잘 해왔지만, 이제는 더 나아가 국가에 아주 큰 이로움을 주고, 국민이 자랑스러워할 수 있는 초대형 성과를 창출할 시기다”라고 밝히며 “사람들이KERI를 생각하면 바로 떠오를 수 있는 인지도 높은 기술 개발이 필요하다”면서 ‘KERI큰기술’ 개발 도전을 강조했다.큰기술을 “명칭 그대로 파급효과가 크고 넓은 성과”라고 정의한 김 원장은 “큰기술이 원장 임기 동안 나오지 못할 수도 있고, 세대를 이어 수십 년 걸릴 수도 있겠지만, 모두가 열심히 도전하고, 그 노력을 서로 응원하며, 훗날 성공을 함께 기뻐하고 누리는 조직문화를 만들고 싶다”라며 직원들의 적극적인 동참을 당부했다.마지막으로 김 원장은 “전기화 시대를 맞아 우리는 세상을 바꿀 수많은 기회를 맞이할 것”이라며 “대한민국 전기·전력 기술을 책임지는 ‘KERI人’의 소명을 다할 수 있도록, 끊임없이 고민하고, 새롭고 넓은 시각으로 최선을 다해 주길 바란다”라며 창립기념사를 마무리했다.이날 기념식에서는 국가과학기술연구회 이사장상을 비롯해 모범직원상, 청렴상, 장기근속상, 안전관리 우수연구실 시상식도 같이 진행됐다.한편KERI는 과학기술정보통신부 국가과학기술연구회 산하 전기전문 정부출연연구기관으로, 대한민국 전기공업 및 전력사업 진흥을 위해 1976년 12월 29일 설립됐다. 현재 경남 창원에 소재한 본원 외에 3개의 지역조직(안산, 의왕, 광주)이 있으며, 인력은 약 800여명이다. 주요 업무 분야로는 전력망 및 신재생에너지, 친환경 전력기기, 전기추진 및 산업응용(전동기, 로봇,AI등) 기술, 나노신소재 및 배터리, 전력반도체, 전기 의료기기, 전력기기 국제공인 시험인증 등이 있다."
2023-07-22,"""개미에겐 종교""…939% 폭등 황제주, 믿음으로 더 오른다?","━증권가 에코프로 광풍K-배터리 혁명인가, 광기인가. 에코프로 신드롬이 증권가를 뒤흔들고 있다. 그도 그럴 것이 연초 11만원으로 출발한 주가가 지난 18일 종가 기준 111만8000원을 기록하며 국내에서 가장 비싼 황제주에 등극했다. 에코프로는 현재 국내 증시에서 유일한 황제주이기도 하다. 황제주는 주가가 100만원이 넘는 주식을 이른다. 코스닥시장에선 지난 2007년 9월 동일철강이 110만2800원을 찍으며 황제주에 등극한이래 16년 만에 에코프로가 바통을 이어받았다. 21일 현재 에코프로는 종가 기준 사상 최고가를 재차 경신해 114만3000원으로 거래를 마쳤다. 연초 대비 상승률(종가기준)은 무려 939%에 달한다.에코프로는 전기차 배터리의 핵심 소재인 양극재를 생산하는 에코프로비엠, 에코프로에이치엔 등을 자회사로 거느리고 있다. ‘전기차’ 훈풍을 타고 가속페달을 밟고 있다. 에코프로그룹의 시가총액은 60조원을 넘어섰다. 올해 들어 시총이 5배나 불어나며 19일 기준 삼성(622조7430억원),LG(237조8593억원),SK(160조293억원), 현대차(126조6329억원), 포스코(93조5425억원) 등 5대 그룹에 이어 6위로 올라섰다. 그러나뜨거운 관심만큼 논란도 많다. 개인 투자자들의 소문으로 주가가 오르는 ‘밈 주식’이란 평가와 더불어 소외증후군(FOMO·FearofMissingOut)에 따른 추격 매수를 경고하는 목소리도 적잖다. 한 주식 전문가는 “기업 분석을 통한 합리적인 예측이 무의미해질 정도로 폭등했다”며 “일종의 ‘종교’와 같은 경지에 있다”고 말했다.개미들 “공매도 세력 물리치자”에코프로의 질주는 올해 2월부터 본격적으로 시작됐다. 1월만 해도 11만~12만원 선을 오가던 주가는 2월 들어 급등세를 타기 시작했다. 2월 말 종가 기준 28만5000원→3월 말 49만500원→4월 말 73만원으로 매달 약 50~70%의 폭풍 상승세를 보였다. 미국 인플레이션 감축법(IRA)의 최대 수혜 분야로 2차전지 산업에 대한 성장 기대감이 커지고 있던 데다, ‘배터리 아저씨’로 불리는 박순혁 전 금양 이사 등이 유튜브와 각종 세미나에서 국내 2차전지 기업의 경쟁력을 설파하며 불이 붙었다.에코프로는 ‘2차전지’ 대장주로 꼽힌다. 2차전지 핵심인 양극재 생산부터 폐배터리 리사이클링 등에 이르기까지 전 과정을 일괄적으로 해낼 수 있는 계열사 체계를 구축했다는 점 등에서 전망이 밝다. 특히 핵심 자회사인 에코프로비엠은 글로벌 삼원계 양극재 생산 1위 업체다. 에코프로 매출은 양극재 사업을 시작한 2004년 75억원에서 18년 만인 지난해 5조원으로 660배 이상 커졌다.그래픽=남미가 기자nam.miga@joongang.co.kr이러한 성장성에도 증권업계는 ‘과열주의보’를 내렸다. 매도 의견을 거의 내지 않는 증권업계에서 지난 4~5월 잇따라 과열 경고를 보냈다. 하나증권은 4월 리포트에서 “끝까지 이성의 끈을 놓쳐선 안 된다. 소외증후군에 따른 매수 및 회피를 모두 경계한다”며 적정 가치에 대한 면밀한 검토를 당부했다. 삼성증권은 “순자산가치(NAV) 대비 50% 프리미엄을 받는 현저한 고평가 상황 지속되고 있다”며 목표주가를 40만원으로 제시했다. 이날(5월2일) 주가를 73만3000원으로, 시세 대비 목표주가가 45%나 낮춘 셈이다.대관식을 앞두고 증권가에서는 황제가 될 주식은 아니라는 분석을 잇달아 내놓은 것이다. 에코프로는 이같은 악재에 50만원대 초반까지 밀리기도 했지만, 6월 말 이후 다시 오름세를 회복했다. 미국 전기차업체인 테슬라의 깜짝 실적 발표가 에코프로 주가에도 날개를 달아줬다. 테슬라의 2분기 차량 인도 규모가 전년 동기 대비 83%(47만대)나 급등했다는 소식이 전해진 6월 30일 에코프로 주가는 20.42% 급등했다.다음 달 에코프로가MSCI(모건스탠리캐피털인터내셔널) 한국 지수 구성 종목에 편입되면 주가가 더 뛸 수 있다는 기대도 있다. 시가총액 규모가 크고 유동주식 비율이 높아 편입이 유력하다는 분석이다. 김동영 삼성증권 연구원은 “현재 시점에서 편입 기준을 충족하는 종목은 에코프로, 한화오션, 금양,JYP엔터테인먼트”라며 “에코프로는 편입 기준 금액을 크게 상회하고 있어서 편입이 확실시 된다”고 했다. 에코프로가 이러한 예측대로MSCI편입에 성공하면 개인 투자자뿐 아니라 외국인들의 매수세가 강해져 주가는 더 오를 가능성이 있다.다만 이러한 호재를 반영하더라도, 현재 주가는 적정 수준을 넘어섰다는 우려가 적지 않다. 올해 들어서는 에코프로그룹의 실적은 주춤한 상태다. 지주사인 에코프로는 올해 2분기 연결 재무제표 기준 매출 2조132억원, 영업이익 1664억원을 기록했다. 매출이익은 전년 대비 63.4% 증가했지만, 영업이익은 2.1% 감소한 수치다. 증권가 전망치(컨센서스)도 크게 밑돌았다. 에코프로 관련 2분기 추정 실적을 증권사 중 유일하게 제시한 삼성증권 예상치 대비 각각 7.5%, 26% 하회한다. 핵심 계열사인 에코프로비엠이 리튬 가격 하락 여파로 판가 하락을 겪으며 수익성이 낮아진 것으로 분석된다.에코프로 주가수익비율 800배 달해그래픽=남미가 기자nam.miga@joongang.co.kr한국거래소에 따르면 에코프로의 주가수익비율(PER)은 19일 기준 798.74배에 달한다. 코스닥지수의 평균PER은 50.99배다. 기업 펀더멘털(기초체력)에 비해 주가가 이미 과도하게 상승해 향후 흐름을 예측하기 어렵다는 시각이 지배적이다. 한 증권사 리서치센터장은 “다음 분기 혹은 길어도 내년 실적에 대한 기대를 주가에 반영하는 게 일반적인데, 에코프로는 2030년 실적까지 끌어온 수준”이라며 “2000년도IT버블 때IT만 붙으면 주가가 올라갔던 것처럼, 2차전지에 대한 맹목적인 테마장세로 보인다”고 말했다. 한 주식 전문가는 “에코프로가 투자자들 사이에서 거의 신격화되면서 큰 변동성을 갖고 거래되는 것”이라며 “개인 투자자들 사이에 에코프로에 대한 믿음이 있는 한 급등세는 지속될 가능성이 있다”고 말했다. 이미 논리적으로 설명할 수 있는 수준을 넘어섰음에도, 달궈진 심리에 따라 주가는 더 치솟을 수 있다는 관측이다.이달 에코프로의 ‘황제주’ 등극은 개미 군단(개인 투자자 연합)이 외국인 공매도 세력을 이겨냈다는 애국 운동(?)이라는 해석도 나온다. 20일 한국거래소에 따르면 상반기 개인 투자자들은 에코프로 주식을 무려 1조4769억원이 넘게 순매수했다. 반면 외국인은 6512억원어치, 기관은 8057억원어치 순매도했다. 외국인과 기관의 매도 물량을 개인들이 받아낸 셈이다. 그런데 이달 들어 외국인들의 움직임이 달라졌다. 이달 들어 20일까지 외국인은 에코프로 주식을 5494억원치 사들였다. 특히 지난 18일JP모간이 에코프로 8만7126주를 매수하면서 ‘쇼트 스퀴즈’ 현상이 아니냐는 관측이 나오고 있다.JP모간은 에코프로의 ‘공매도 잔고 대량보유자’로 110만원을 넘긴 에코프로를 하루에 8만주 넘게 대량 매수한 것은 이례적으로 볼 수밖에 없다는 것이다. 쇼트 스퀴즈란 주가 하락을 기대했던 공매도 투자자가 주가 상승 압박을 못 이겨내고 주식을 다시 매수하는 현상을 의미한다.이제 시장의 관심사는 에코프로가 ‘왕관의 무게’를 견뎌내느냐로 모아진다. 박순혁 전 금양 이사는 추가 상승에 무게를 둔다. 그는 최근 한 경제 유튜브에서 “현재 에코프로의 공매도 금액이 대략 1조2000억~1조3000억원 정도인데, 이 규모가 2000억~3000억원으로 떨어질 때까지는 계속 쇼트 스퀴즈에 의한 상승이 나타날 것”이라고 주장했다. 그는 연초 『K-배터리 레볼루션』이라는 책을 내고 유튜브 방송 등에서 에코프로를 비롯한 2차전지 8종목을 공개 추천해왔다. 에코프로와 에코프로비엠을 비롯해LG에너지솔루션·SK이노베이션·LG화학·포스코퓨처엠·포스코홀딩스·나노신소재 등이다. 지난 상반기 이들 종목의 주가는 포스코퓨처엠(94.44%), 나노신소재(55.74%) 등 8종목 모두 상승했다. 이와 같이 족집게 전망을 내놓은 덕에, 개인 투자자들은 과열을 경고하는 증권업계보다 상승을 주장하는 박 전 이사의 목소리에 더 귀를 기울였다.향후JP모간보다 에코프로의 공매도 잔고가 더 많은 모건스탠리, 메릴린치, 골드만삭스 등에서 쇼트 스퀴즈가 나올 경우 주가는 더 오를 수도 있다는 기대감이 나온다. 20일 한국거래소에 따르면 에코프로와 에코프로비엠의 공매도 잔고는 코스닥 1·2위에 올라있다. 에코프로의 공매도 잔고는 17일 기준 131만주(1조3094억원)로, 전체 주식의 4.92%가 공매도로 잡혀 있다. 한 금융투자업계 관계자는 “지금이라도 에코프로를 사야 하냐는 문의가 많은데, 삼성전자가 10만원 바라볼 때나 테슬라가 300달러 넘볼 때도 똑같은 질문을 받았다”며 “그런 질문들이 나올 때가 거의 예외없이 고점이었던 시점”이라며 신중한 투자를 당부했다. 최근 에코프로의 기록적인 과속질주에 개인 투자자 일부는 매도세로 돌아서는 양상이다. 황제주에 오른 지난 18일 이후 3일간 개인 투자자들은 2134억원을 순매도했다."
2023-05-11,"2023학년도 주요 대학 수시 이공계 경쟁률, 지능기전 분야 하락","세종대학교 학생부교과전형은 지역균형을 기준으로 함지난 2023학년도 주요대학 수시 학생부교과 이공계학과 경쟁률을 분석한 결과 한양대, 중앙대 등은 전년보다 다소 하락한 반면 세종대는 상승한 것으로 나타났다.인공지능 분야 경쟁률을 보면 한양대 데이터사이언스학부는 2.2%포인트, 중앙대AI학과는 16.2%포인트 하락했으나 세종대 인공지능학과는 0.11%포인트, 국민대 인공지능학부는 3.55%포인트 상승했다.원자력 분야의 경우도 한양대 원자력공학과는 학생부교과전형에서 전년 대비 경쟁률이 0.4%포인트 소폭 하락한 반면 세종대 양자원자력공학과는 3.83%포인트, 경희대 원자력공학과는 1.57%포인트 각각 상승했다.지능기전 분야 학생부교과전형 경쟁률은 건국대 스마트운행체공학과 11.16%포인트, 세종대 지능기전공학부 0.09%포인트, 국민대 미래모빌리티학과 3.4%포인트 등 전반적으로 하락했다.신소재 분야 주요대학의 학생부교과전형 경쟁률은 전년 대비 하락했으나 세종대 나노신소재공학과의 경쟁률은 1.72%포인트 소폭 상승했다."
2023-05-24,"세종대, 2023년도 수시 학생부전형 교과등급 전년比 올라","세종대학교가 2023학년도 수시 입시 결과를 발표했다.2022학년도 수시모집 학생부교과전형 교과등급 평균과 비교해 2023 수시모집에서는 입시 결과가 상승한 것으로 나타났다.인문계열은 2.42등급에서 0.32등급 상승한 2.10등급으로, 자연계열은 2.39등급에서 0.22등급 상승한 2.17등급였다. 전체 모집단위 기준으로는 2022학년도 2.40등급에서 2023학년도 2.15등급으로 0.25등급 상승했다.인문계열에서는 미디어커뮤니케이션학과가 0.47등급, 경제학과가 0.56등급, 역사학과가 0.81등급 상승했다. 자연계열에서는 양자원자력공학과가 0.52등급, 나노신소재학과가 0.43등급 상승하는 등 입시 결과 상승 폭이 컸다.계열별로는 인문계열에서는 미디어커뮤니케이션학과 1.89등급, 자연계열에서는 생명시스템학부가 1.82등급으로 학생부교과 등급이 가장 높았다.박재우 세종대 입학처장은  “세종대학교는 학생들의 창의성을 존중하고 학문의 질과 실용성을 동시에 제고하는 노력을 하고 있다. 이는 최근 국내외 각종 대학 평가에서 우수한 성과와 좋은 입시결과로 이어지고 있다. 이러한 결과에 안주하지 않고 항상 새로운 세종대학교와 경쟁하기 위한 노력과 진화를 끊임없이 추구할 것”이라고 말했다."
2022-11-14,"한양대 배터리특허 대기업 이전…영남대, 논문 피인용 2위 [2022 대학평가]","━교수연구 부문바이러스로 암세포를 죽이는 항암치료제를 만드는 기업인 진메디신의 연구실. 진메디신은 한양대 윤채옥 생명공학과 교수가 자체 개발 기술로 교내에서 창업했다. 사진 한양대 산학협력단지난 2월 한양대(서울)는 국내 대기업에 배터리 기술 특허를 양도하고 수백억 원의 기술이전료를 받았다. 2차전지의 용량과 출력을 획기적으로 높이는 하이니켈 양극재 관련 특허다. 구체적인 액수를 공개할 수 없지만, 국내 대학에서 100억 원이 넘는 기술이전은 매우 드문 사례다.선양국 한양대 에너지공학과 교수는 대규모 기술이전의 비결로 산학협력단의 도움을 꼽았다. 2003년 국내 대학 최초로 만든 한양대 산학협력단은 지난해부터 2차 전지 분야 선두주자인 선 교수의 기술이전을 기획하고 기업과 협상을 전담해왔다. 변중무 한양대 산학협력단장은 “교수의 연구 결과물을 산업에서 활용할 수 있도록 돕는 것도 우리 시대 대학의 중요한 역할”이라고 말했다.2022년 중앙일보 대학평가에서 한양대는 교수연구 부문 5위에 올랐다. 특히 과학기술 교수당 산학협력 수익(2위)과 기술이전 건당 수입액(2위)이 많았다. 실험실의 성과가 산업으로 이어지고 있다는 의미다.━‘외국어 노하우 기술화’ 한국외대, ‘영상 압축 기술’ 경희대많은 대학이 실용적인 기술 개발에 힘을 쏟고 있다. 종합평가 대상 45개 대학의 기술이전 수입액 총합은 2020년 681억원에서 2021년 851억원으로 크게 올랐다. 한 대학 관계자는 “최근 국내 대학들이 그동안 소홀했던 기술사업화에 앞다퉈 투자하고 있어 액수가 더 커질 것”이라고 말했다.진호 경희대 우주과학과 교수팀이 대한민국 최초 달 탐사선 '다누리'에 탑재된 자기장 측정기를 보고 있다. 경희대는 기술 사업화 실적과 논문 성과를 바탕으로 교수연구 부문 7위에 올랐다. 사진 경희대한국외대는 이공계 규모가 작지만 외국어 관련 기술로 많은 수익을 올렸다. 한국외대가 가르치는 45개 언어 중 우크라이나어, 스웨덴어, 이탈리아어 등에 대한 노하우를 공대 교수들이 기술화하는 식으로 저작권 및 지식재산권 수입을 올리고 있다. 또 네이버와 외국어 사전을 개발하고, 인공지능 기업과 협업해AI가 여러 언어를 구사하도록 하는 기술을 개발하기도 했다.경희대도 기술 특허로 많은 수익을 올리고 있다. 박광훈 컴퓨터공학과 교수는 차세대 고효율 동영상 압축기술 국제표준 특허를 확보했다. 지난해 세계 최초로 고효율 비디오의 압축 능력을 2배로 확장한 기술을 선보여 올해 4월까지 누적 로열티 수익만 53억 원을 기록했다.━연세대, 교수당 교외연구비 1위연구 경쟁력이 높은 대학은 연구비 지원이 많다는 공통점이 있다. 특히 반도체나 인공지능(AI) 등 미래 기술 분야에 강한 대학이 강세를 보이고 있다.연세대(서울)는 교수들이 기업, 정부 등에서 수주한 연구비가 크게 늘고 있다. 교수당 교외연구비가 지난 2021년 평가에서 3위였다가 올해 1위로 올랐다. 이를 바탕으로 세계적으로 주도할 수 있는 연구 분야를 집중적으로 지원하는 ‘연세 시그니처 연구클러스터 사업’에 착수했다. 에너지 소재, 인공지능, 기후위기, 행정학, 경영학 등 다양한 분야의 13개 연구팀에게 최장 5년간 125억 원을 지원한다.연세대는 지난해 평가 대비 모든 학과의 연구비가 상승했다. 김지현 연세대 연구처장은 “교내외 공동연구를 진행하면서 연구력이 지속해서 향상되고 있다. 연구 과제 수주가 많아지면서 연구비가 꾸준히 증가하는 추세”라고 설명했다.━논문당 피인용TOP3, 세종·영남·광운대지난달 18일 오후 2시 서울 광진구 세종대 연구실에서 명승택 나노신소재공학과 교수가 산소, 수분 농도 조절이 가능한 연구 상자 앞에 서 있다. 편광현 기자교수연구 부문에서‘국제학술지 논문당 피인용’ 지표는 논문의 평균적인 질을 측정한다. 논문의 양은 적어도 질이 높은 대학이 상위에 오를 수 있다.세종대는 2년 연속 논문당 피인용 1위를 기록하며 연구 부문 6위에 올랐다. 논문 수가 많지 않은 편이지만 나노신소재공학, 호텔경영학 분야 등의 성과가 특히 우수했다. 명승택 나노신소재공학과 교수의 '나트륨 이온 전지의 현재와 미래' 논문, 류기상 호텔관광외식경영학부 교수 등이 쓴 호스피털리 연구 관련 논문 등의 피인용 성과가 국제적으로 인정 받았다.논문당 피인용 2위인 영남대는 박주현(전기공학과), 류정호(신소재공학부) 교수 등 ‘스타 교수’의 활약이 돋보였다. 영남대 교수들은 학교의 연구지원 제도와 외국인 석박사생 선발을 질 좋은 논문의 원동력으로 꼽는다. 영남대는 지난해 공학 계열 외국인 교수 수가 가장 많이 늘어난 대학이기도 하다. 류정호 교수는 “교내 연구 환경이 좋다. 수준 높은 글로벌 인재가 연구진으로 함께 참여하는 것도 강점”이라고 말했다.논문당 피인용 3위인 광운대는 적극적인 연구 인센티브 제도를 도입했다. 지난해부터SCI,KCI급 논문이 피인용될 때마다 장려금을 주는 제도를 신설했다.박재영 광운대 전자공학과 교수가 연구진과 함께 있는 모습. 박 교수는 체온, 심전도, 맥박을 동시에 실시간 모니터링할 수 있는 멀티센서 패치를 들어보이고 있다. 사진 광운대━중앙대AI융합연구…‘AI영어교육’ 논문도 발표중앙대는 인문사회 국내논문당 피인용(5위)에서 좋은 성과를 내면서 교수 연구 부문 10위에 올랐다. 중앙대는 최근 인공지능(AI)과 소프트웨어를 중심으로 하는 융합 연구와 교육에 주력하고 있다. 예를 들어 이장호 중앙대 영어교육과 교수가 참여한 논문 ‘영어 교과 보조 도구로서의AI챗봇 분석 연구’는 인문사회 분야 논문으로는 드물게 국내외 학술지에서 우수한 성과를 냈다. 이 교수는 “양보다 질을 강조하는 중앙대 연구 지원 정책이 큰 도움이 됐다”고 말했다.이장호 중앙대 영어교육과 교수가 자신의 저서 옆에 서있다. 이 교수는 올해에만 국제적으로 인정받는 사회과학논문인SSCI급 논문 9편을 게재했다. 사진 중앙대올해 평가에서 논문 관련 지표는 네이버의 글로벌 연구 평가 서비스인 '스칼리틱스(Scholytics)'를 통해 산출했다. 유봉석 네이버 서비스운영총괄은 “팬데믹으로 의료진들이 현장으로 나가면서 국내 의학 분야 논문 비중이 예전보다 크게 줄었다”며 “올해 평가에서는 의대가 없어도 다른 분야에서 좋은 성과를 낸 대학이 높은 점수를 받았다”고 분석했다."
