date,title,content
2023-09-13,정치 테마주 주의… 선거 직전엔 급락하더라,"증시 지지부진에 단기 차익 노려총선 7개월이나 남았는데 과열초전도체, 신소재 맥신(Mxene), 양자컴퓨터 등 과학 테마주에 이어 정치 테마주가 들썩이고 있다. 지명도가 높은 한동훈 법무장관과 관련됐다고 소문난 기업들이 테마주로 묶여 주가가 급등하는 것이다.사외이사가 한 법무장관과 서울대 법대, 컬럼비아대 로스쿨 동문이라 ‘한동훈 테마주’로 분류되는 코스닥 상장 의료AI기업 ‘노을’은 지난달 28일부터 이달 8일까지 10거래일동안 주가가 두배 가까이(99%) 올랐다. 같은 기간 태양금속(33%)과 나우IB·부방(이상 15%), 극동유화(9%) 등 다른 한동훈 테마주도 크게 뛰었다. 태양금속은 회장이 한 장관과 같은 청주 한씨라는 이유로, 부방과 극동유화는 사외이사가 서울대 동문이라는 이유로 한동훈 테마주에 편입됐다.반면, 재판 등 법적 부담이 커진 이재명 더불어민주당 대표 관련주는 힘을 받지 못하고 있다. 에이텍과 이스타코는 대선 직전 해였던 2021년 고점 대비 70~90% 가량 빠진 상태다.LCD디스플레이 상품 제조업체인 에이텍은 대표가 성남창조경영CEO포럼 운영위원이었다는 이유로 성남시장 출신인 이재명 대표 테마주로 분류됐다. 부동산 관련 업체인 이스타코는 지난 대선 당시 이 대표의 부동산 공약 관련주로 꼽혀 주가가 급등했었다.전문가들은 정치 테마주 투자에 유의해야 한다고 지적한다. 정작 해당 정치인과의 연관성이 불분명한 경우가 많다는 이유에서다. 국회의원 총선거(내년 4월)를 7개월이나 앞둔 시점에 정치 테마주가 과열되는 것도 이례적이다. 증권가에선 “증시가 횡보하는 국면에서 단기 차익을 노린 투자자들이 끊임없이 테마를 찾는 과정에서 정치 테마가 주목받은 것으로 보인다”고 했다.이런 테마주는 변동성도 크다. 한동훈 테마주 중 대장주격이었던 오파스넷은 올 들어 지난달 25일까지 130% 상승해 고점을 찍었으나 이후 8거래일만에 20% 하락했다.자본시장연구원이 작년 2월 발표한 ‘20대 대통령 선거 정치테마주 현상에 대한 소고’ 보고서에 따르면 정치 테마주는 여론 조사 지지율 등락이나 정치적 이벤트에 따라 급등락을 반복하다가 선거 직전(선거일 기준 13~24거래일 전)부터 급락하는 흐름을 보였다."
2024-09-05,미국 또 침체 공포…코스피 2600 붕괴,"미국발 ‘R(Recession·경기 침체)의 공포’가 다시 고개를 들면서 뉴욕증시가 급락하는 등 글로벌 증시가 크게 흔들렸다. 4일 코스피는 전장보다 3.15% 빠진 2580.8로 마감하며 2600 아래로 주저앉았다. 코스닥 지수도 3.76% 내린 731.75를 기록했다. 지난달 5일 ‘블랙 먼데이’ 이후 한 달 만의 최대 낙폭이다. 유가증권시장에서 65조원, 코스닥 시장에서 14조원 등 하루에만 총 79조원이 증시에서 증발했다.시장에서는 미국 경제의 경착륙을 걱정하는 목소리가 커지고 있다. R의 공포를 키운 건 미국 노동절 연휴가 끝난 직후 나온 제조업 경기 위축 신호였다. 3일(현지시간) 미국 공급관리자협회(ISM)가 집계한 지난달 제조업 구매관리자지수(PMI)는 47.2로 예상치(47.5)를 밑돌았다.━Fed,이달 빅컷 가능성 41%…내일 고용지표가 분수령4일 코스피가 전일 대비 83.83포인트(3.15%) 내린 2580.80으로 마감했다. 사진은 이날 서울 중구 하나은행 본점 딜링룸 모습. [연합뉴스]이 수치가 50 아래면 경기가 위축됐다는 것을 뜻하는데, 이는 미국 제조 업황이 다섯 달 하강 국면에 있음을 뜻한다. 이날 S&P글로벌이 발표한 별도의 8월 제조업PMI도 두 달 연속 50을 밑돌았다.시장이 이 지표에 민감한 건 고용 창출에 대한 기여도 때문이다. 제조업 침체는 고용 감소→소비여력 하락→경기 침체로 이어질 수 있다. 세계 증시를 뒤흔들었던 한 달 전 블랙 먼데이도 잇따른 제조업 지표 부진 신호에 이은 고용 지표 부진으로 촉발됐다.이에 더해 애틀랜타연방은행은 이날 국내총생산(GDP) 증가율 예측 모델인 ‘GDP나우’를 통해 올해 3분기GDP증가율 예측치를 지난달보다 0.5%포인트 낮춘 2%로 제시했다.ISM제조업 조사위원회의 티머시 피오레 위원장은 “연방준비제도(Fed)의 통화정책과 선거 불확실성으로 기업들이 투자를 미루면서 수요가 억눌린 상태”라고 짚었다.김영옥 기자최근 중국과 유로존의 부진한 성장 전망까지 맞물려 미국 경기 침체 우려가 글로벌 증시를 짓눌렀다. 뉴욕증시에서 S&P500 지수는 2.12%, 다우존스산업평균지수는 1.51% 내렸다. 기술주 중심의 나스닥 지수(-3.43%)는 최근 인공지능(AI) 회의론과 맞물려 하락 폭이 더 컸다. 지난달 5일 이후 가장 큰 하락 폭이다.이날 코스피 종목은 937개 중 862개가 하락세로 마감했다. 삼성전자는 전날보다 3.5% 내리며 가까스로 7만원에 멈춰섰고,SK하이닉스는 8% 급락하는 등 반도체주의 타격이 컸다. 미국 법무부의 반독점법 위반 혐의 조사 착수 등으로 엔비디아 주가가 9.5% 빠지며 반도체 투자 심리가 얼어붙은 영향이 컸다. 네이버(-4.7%), 카카오(-5.7%) 등 주요 종목 대부분도 코스피보다 더 크게 하락했다. 4일 달러당 원화가치는 전날 대비 0.80원 하락한(환율 상승) 1342.20원에 거래를 마감했다.국제유가WTI70달러…연중 최저치일본 닛케이255지수(-4.2%), 대만 자취안지수(-4.5%), 중국 상하이종합주가지수(-0.67%), 홍콩 항셍지수(-1.1%) 등 아시아 주요 증시도 일제히 하락했다.전문가들은 미국발 경기 침체 우려에 더해AI거품론, 엔캐리 트레이드(저렴한 엔화로 산 해외자산을 되파는 현상) 청산 우려 등이 복합적으로 작용한 결과라고 분석했다. 글로벌 투자은행(IB) 모건스탠리는 최근 보고서에서 글로벌 반도체 기업의 매출 증가율이 올 3분기에 고점(21%)을 기록하고 4분기부터 18%로 하락할 것으로 예측했다. 모건스탠리는 “AI산업 투자 랠리는 영원하지 않다. 결국 반도체 공급이 수요를 따라잡는 순간이 올 것”이라고 말했다.다시 떨어진 코스피국제유가도 맥을 못 췄다. 10월 인도분 서부텍사스산원유(WTI)는 전장 대비 3.21달러(4.36%) 내린 배럴당 70.34달러에 거래를 마치며 연중 최저치를 기록했다.미국의 침체 우려가 과도하다는 지적도 나온다. 시장이 특정 데이터에 과도하게 반응한다는 것이다. 특히 제조업의 경우 미국GDP에서 차지하는 비중이 11% 정도로 크지 않다. 양준석 가톨릭대 경제학과 교수는 “미국 노동시장이 약해지고 있다는 것은 사실이지만Fed의 실업률 장기 목표(4.1%)에서 크게 벗어나지 않고 있다”며 “아직 경기 침체를 우려할 정도는 아니다”고 말했다.증시 급락은 실제로 경기 침체 우려 가능성이 커졌기보다는 투자 심리가 악화한 탓이라는 평가가 나온다. 시선은 오는 6일 발표되는 8월 비농업 고용 지표에 쏠린다. 이 지표는 지난달 예상치(18만5000명)를 크게 밑돈 11만4000건을 기록하며 경기 침체 우려를 촉발했다. 월가에선 신규 고용이 10만 명 이하로 나오거나 실업률이 4.4~4.5%로 오르면Fed가 빅컷(기준금리 0.5%포인트 인하)에 나설 것으로 본다. 3일 시카고상품거래소(CME) 페드워치에 따르면 9월FOMC에서Fed가 기준금리를 0.5%포인트 인하할 가능성은 41%로 1주일 전보다 5%포인트 올랐다.박광남 미래에셋증권 디지털리서치팀장은 “미국 경기가 그렇게 나쁘지 않은 것으로 나타난다면 빅컷과 큰 폭의 달러 약세 가능성도 작아져 투자 심리도 회복될 수 있을 것”이라고 전망했다. 4일 미국 구인·이직 보고서, 5일 8월ISM비제조업PMI,6일 8월 고용보고서가 발표될 예정이다.이창용 한은총재, 금리인하 신중 입장 유지미국이 빅컷에 나선다면 이는 한국은행이 금리 인하 시점을 놓쳤다는 평가로 이어질 수 있다. 그간 정치권과 한국개발연구원(KDI) 등 연구기관은 내수 부진을 이유로 한은의 금리 인하가 필요하다는 의견을 개진해 왔다. 그러나 이창용 한은 총재는 “물가 안정 측면에서는 기준금리 인하를 충분히 고려할 수 있는 시기가 됐다”면서도 “금융 안정 등을 봐서 어떻게 움직일지 적절한 타이밍을 생각해 볼 때”란 신중한 입장을 유지했다. 불어나는 가계부채와 집값 급등세 때문에 인하 카드를 꺼내지 못하고 있다는 의미로 해석된다."
2024-04-16,‘깜짝 소비’에 더 멀어진 美 ‘피벗’…올해 금리인하 3→2→1번 ‘뚝’,"강한 경기 지표에 미국 경제가 둔화 없이 ‘노랜딩(nolanding·무착륙)’ 할 수 있다는 전망이 높아지고 있다. 기대했던 기준금리 인하 전망도 크게 후퇴하면서, 고금리 고통이 기약 없이 길어질 거란 우려가 나온다.━깜짝 소매판매에 美GDP전망 상향15일(현지시간) 미국 상무부는 지난달 소매판매가 전월 대비 0.7%(속보치 기준) 늘어난 7096억 달러(약 988조8200억원)로 집계됐다고 발표했다. 이는 다우존스 전문가 전망치(0.3%)를 크게 웃도는 수치다. 같은 날 발표한 지난 2월 소매판매 증가율 확정치(0.8%)도 기존 잠정치(0.6%)보다 상향됐다. 변동성이 큰 자동차를 뺀 근원 소매판매도 지난달 전월 대비 1.1% 상승하며 시장 예상치(0.5%)를 뛰어넘었다.신재민 기자내수가 전체 국내총생산(GDP)의 약 3분의 2를 차지하는 미국은 매월 발표하는 이 소매판매가 경기 상황을 가늠하는 핵심 지표로 꼽힌다. 강한 소매판매 영향에 미국 애틀랜타 연방준비은행이 발표하는 경제성장률 전망인 ‘GDP나우’는 1분기 미국GDP예상치를 2.4→2.8%(전기 대비 연율)로 올렸다.━소비 강세에 물가 상승률 확대 우려미국 경기가 여전히 확장세에 있다는 증거는 이뿐만이 아니었다. 앞서 5일(현지시간) 발표한 미국 비농업 일자리는 전월 대비 30만3000개가 늘어나면서 시장 전망치(20만개)를 크게 넘어섰다. 10일(현지시간) 발표한 지난달 미국 소비자물가지수(CPI)도 전년 동월 대비 3.5% 오르면서 역시 예상치(3.4%)를 웃돌았다.미국의 한 마트에서 한 여성이 옷을 고르고 있다.AP=연합뉴스미국 가계가 견조한 소비력을 보이면서, 향후 물가 상승률도 높게 유지될 가능성이 커졌다. 소매판매 세부 13개 항목 중 서비스 소비를 의미하는 식당·주점을 제외하면 12개는 상품과 관련돼 있다. 그동안 미국의CPI상승률 둔화를 이끌었던 것은 상품 물가의 하락이었지만, 관련 소비가 늘면 그만큼 물가도 다시 올라갈 가능성이 높다. 김일혁KB증권 연구원은 “미국의 통화 긴축에도 불구하고 소비가 좀처럼 약해지지 않고, 오히려 물가 부담이 낮아지면서 수요가 다시 살아나고 있다”고 짚었다.━금리 인하 전망 1번으로…인상 시나리오까지물가 상승세가 쉽사리 꺾이지 않을 거란 전망에 시장도 기준금리 인하 기대감을 낮추는 분위기다. 시카고상품거래소(CME) 페드워치는 소매판매 지표 발표 직후 미국 연방준비제도(Fed)가 올해 9월에서야 기준금리 인하를 시작하고, 횟수도 한 번에 그칠 확률이 가장 높다고 예상했다. 원래 시장에서는Fed가 6월에 첫 번째 인하를 시작해 올해 총 세 번 기준금리를 낮출 거라고 봤다. 하지만 지난달CPI상승률이 높게 나오면서, 올해 금리 인하 전망이 두 번으로 후퇴했다가 이번에는 한 번으로 다시 낮아졌다.제이미 다이먼JP모건 회장. [로이터]미국 내에서는 기준금리를 오히려 더 올려야 한다는 주장까지 나온다. 글로벌 투자은행(IB)UBS는 고객들에게 보낸 서한에서 “미국 물가 상승률이 2.5% 위에서 고착되면Fed가 내년 초 금리 인상을 재개할 것”이라면서 “기준금리가 내년 중반에는 6.5%까지 높아질 수 있다”고 했다. 월가 황제로 불리는 제이미 다이먼JP모건체이스 최고경영자(CEO)도 주주들에게 보낸 연례 서한에서 “기준금리 8% 이상 시나리오까지 준비하고 있다”고 했다.━시장 금리는 이미 오름세, 美 10년 국채 4.6%기준금리 전망과 상관없이 시장 금리는 이미 고금리 장기화(Higherforlonger)를 반영하기 시작했다. 대표적 글로벌 장기 금리 벤치마크인 미국 국채 10년물 금리는 이날 전 거래일 대비 0.8%포인트 급등하면서, 4.6%까지 올랐다. 미국 국채 10년물 금리는 높은 미국 소매판매 지표 소식이 전해지면서 장 중 한때 4.65%까지 치솟았다.미국 기준금리 인하 가능성이 점점 낮아지는 가운데, 유럽을 중심으로 비(非) 미국 국가들이 기준금리 인하를 먼저 시작하는 이른바 ‘탈동조화’ 현상도 우려된다. 미국이 아닌 국가들이 금리를 먼저 내리면, 달러 강세가 강화돼 환율을 중심으로 한국 경제 부담이 더 커질 수 있다.석병훈 이화여대 경제학과 교수는 “중동 전쟁으로 에너지 가격이 높아지는 가운데 미국의 강한 소비까지 이어지면, 물가 상승률을 잡기 쉽지 않을 것”이라면서 “결국Fed도 기준금리 인하 강도를 낮출 수밖에 없는데, 이에 따른 환율 및 경기 불안에 대비해야 한다”고 했다."
2023-04-12,"'긴축 종료' 힘 실린다…미국 3월 물가 5% 상승, 2년래 최저치","제롬 파월 미 연방준비제도(Fed) 의장. 로이터미국의 3월 소비자물가지수(CPI)가 1년 전보다 5.0% 올랐다. 상승률이 5%대로 낮아진 건 18개월 만이다. 이는 또 2021년 5월 이후 2년 만에 최저 수준이기도 하다. 시장에선 미 연방준비제도(Fed)가 다음달 ‘베이비스텝(기준금리 0.25%포인트 인상)’을 끝으로 긴축 사이클을 멈출 것이라는 관측이 우세하다.12일(현지시간) 미국 노동통계국은 지난달 미국CPI가 지난해 3월과 비교해 5.0% 상승했다고 밝혔다. 올해 2월CPI상승률(6.0%)보다 1%포인트 낮아졌다. 2021년 9월(5.4%) 이후 18개월 만에 5%대 상승률이다. 전월 대비로는 0.1% 올랐다.전문가들이 예상한 전년 대비 지난달CPI상승률은 5%대 초반이었다. 월스트리트저널(WSJ)과 블룸버그는 5.1%를 제시했다. 미국 클리블랜드 연방준비은행(연은)의 ‘인플레이션 나우캐스팅’의 전망은 5.22%다. 미국CPI는 지난해 6월에 전년 대비 9.1% 올라 41년 만에 가장 큰 폭으로 올랐다. 이후Fed의 금리 인상으로 지난달까지 9개월 연속으로CPI상승률이 하락하고 있다.그래픽=김영옥 기자yesok@joongang.co.kr3월 전년 대비CPI가 둔화한 데는 지난해 러시아의 우크라이나 침공 영향으로 국제유가가 급등했던 기저 효과도 있다. 지난해 3월CPI가 전년 대비 8.5% 수준으로 크게 올랐기 때문이다. 미국의 물가 둔화 흐름이 계속될지는 더 지켜봐야 한다는 의견이 나온다. 최근 주요 산유국 협의체인OPEC플러스(+)의 감산 계획 때문이다. 안나 웡 블룸버그 수석이코노미스트는 “유가가 계속해서 오른다면, 앞으로 몇 개월 동안 디스인플레이션(disinflation,인플레이션 둔화)을 상쇄할 수 있다”고 말했다.단기 변동성이 큰 에너지와 식료품을 제외한 ‘근원CPI’는 3월에 전년 대비 5.6% 올랐다. 2월(5.5%)보다 0.1%포인트 소폭 올랐다. 전월 대비로는 0.4% 상승했다. 전문가들은 물가 안정 여부를 판단할 때 장기적 추세의 물가지수를 보여주는 근원CPI를 많이 참고한다. 근원CPI추세가 꺾이지 않아 물가 상승 압박이 계속되면 ‘끈적한 물가(stickyinflation)’라고 표현한다.시장은 5월 미 연방공개시장위원회(FOMC)에서 기준금리를 0.25%포인트 높일 것으로 보고 있다. 인플레이션이Fed의 목표인 2%에 비하면 여전히 높고, 미 고용시장도 견조한 것으로 나타났기 때문에 ‘마지막 인상’에 나설 것이란 전망이다. 미국에서 3월 비농업 신규 고용은 23만6000명 늘었다. 2월(32만6000명)보다는 둔화했지만, 20만 명을 웃돌고 있다. 3월 실업률(3.5%)도 사실상 완전고용 수준이다.한국은행에 따르면 월가 투자은행(IB)들은 미국의 최종 정책금리 수준을 지금보다 0.25%포인트 높은 5.0~5.25%로 전망하고 있다.Fed가 5월에 베이비스텝을 밟은 뒤 금리 인상을 마무리할 것으로 본다는 의미다. 미 실리콘밸리은행(SVB) 파산 전에는 투자은행들이 두세 차례 추가 인상을 점쳤지만, 은행위기와 경기침체 우려로 ‘5월 정점론’이 우세해졌다.Fed고위 인사들의 신호는 엇갈리고 있다. 오스탄 굴스비 시카고 연은 총재는 은행위기 충격에 대한 평가가 끝날 때까지는 “추가 금리 인상에 신중해야 한다”고 말했다. 반면 존 윌리엄스 뉴욕 연은 총재는 “인플레이션을 확실히 낮추기 위해 할 일이 남았다”고 했다. 시장의 관심은 13일(한국시간) 나올 3월FOMC의사록에 쏠린다.SVB사태 이후 첫FOMC의사록에서Fed의 통화정책 향방을 가늠해 보려는 것이다."
2023-04-13,미국 3월 소비자물가 5% 상승…긴축 종료 힘 실린다,"미국 일리노이주 버펄로 그로브의 수퍼마켓. 3월 미 소비자물가가 1년 전보다 5% 올라 2년 만에 최저 상승률을 기록했다. [AP=연합뉴스]미국의 3월 소비자물가지수(CPI)가 1년 전보다 5.0% 올랐다. 상승률이 5%대로 낮아진 건 18개월 만이다. 이는 또 2021년 5월 이후 2년 만에 최저 수준이기도 하다. 시장에선 미 연방준비제도(Fed)가 다음 달 ‘베이비스텝’(기준금리 0.25%포인트 인상)을 끝으로 긴축 사이클을 멈출 것이라는 관측이 우세하다.12일(현지시간) 미국 노동통계국은 지난달 미국CPI가 지난해 3월과 비교해 5.0% 상승했다고 밝혔다. 올해 2월CPI상승률(6.0%)보다 1%포인트 낮아졌다. 2021년 9월(5.4%) 이후 18개월 만에 5%대 상승률이다. 전월 대비로는 0.1% 올랐다.전문가들이 예상한 전년 대비 지난달CPI상승률은 5%대 초반이었다. 월스트리트저널(WSJ)과 블룸버그는 5.1%를 제시했다. 미국 클리블랜드 연방준비은행(연은)의 ‘인플레이션 나우캐스팅’의 전망은 5.22%다. 미국CPI는 지난해 6월에 전년 대비 9.1% 올라 41년 만에 가장 큰 폭으로 올랐다. 이후Fed의 금리 인상으로 지난달까지 9개월 연속CPI상승률이 하락하고 있다.그래픽=김영옥 기자yesok@joongang.co.kr3월 전년 대비CPI가 둔화한 데는 지난해 러시아의 우크라이나 침공 영향으로 국제유가가 급등했던 기저 효과도 있다. 지난해 3월CPI가 전년 대비 8.5% 수준으로 크게 올랐기 때문이다. 미국의 물가 둔화 흐름이 계속될지는 더 지켜봐야 한다는 의견이 나온다. 최근 주요 산유국 협의체인 석유개발기구플러스(OPEC+)의 감산 계획 때문이다. 안나 웡 블룸버그 수석이코노미스트는 “유가가 계속 오르면, 앞으로 몇 개월 동안 디스인플레이션(disinflation,인플레이션 둔화)을 상쇄할 수 있다”고 말했다.단기 변동성이 큰 에너지와 식료품을 제외한 ‘근원CPI’는 3월에 전년 대비 5.6% 올랐다. 2월(5.5%)보다 되레 0.1%포인트 올랐다. 전월 대비로는 0.4% 상승했다. 장기적 물가 추세를 보여주는 근원CPI가 꺾이지 않았다는 것은 여전히 ‘끈적한 물가(stickyinflation)’ 상태가 지속되고 있다는 의미다.고용도 여전히 견조하다. 미국에서 3월 비농업 신규 고용은 23만6000명 늘었다. 2월보다 둔화했지만, 여전히 20만 명을 웃돌고 있다. 3월 실업률(3.5%)도 완전고용 수준이다. 그럼에도CPI가 5%대로 내려옴에 따라 ‘긴축 종료’에 힘이 실리고 있다.시장은 5월Fed가 연방공개시장위원회(FOMC)에서 기준금리를 0.25%포인트 높일 것으로 보고 있다. 인플레이션이Fed의 목표인 2%에 비하면 여전히 높고, 미 고용시장도 견조한 것으로 나타났기 때문에 ‘마지막 인상’에 나설 것이란 전망이다.미 투자은행(IB)들은 미국의 최종 정책금리 수준을 지금보다 0.25%포인트 높은 5.0~5.25%로 전망하고 있다.Fed가 5월에 베이비스텝을 밟은 뒤 금리 인상을 마무리할 것으로 본다는 의미다. 미 실리콘밸리은행(SVB) 파산 이후 은행 위기와 경기 침체 우려로 ‘5월 정점론’이 우세해졌다.Fed내부에선 신호가 엇갈리고 있다. 오스탄 굴스비 시카고 연은 총재는 은행 위기 충격이 해소될 때까지는 “추가 금리 인상에 신중해야 한다”고 말했다. 반면에 존 윌리엄스 뉴욕 연은 총재는 “물가를 확실히 낮추기 위해 할 일이 남았다”고 했다."
