date,title,content
2023-01-12,‘2023 대한민국 브랜드 명예의전당’ 부문별 수상자는? ②,"국내 대표 싱크탱크 산업정책연구원(IPS)은 지난 한 해 동안 산업별로 소비자에게 가장 사랑받은 브랜드를 발표했다. 올해는 금융/통신/자동차/공공, 가전/소비내구재, 유통/교육/생활서비스 등 총 9개 분야에서 44개 기업·기관의 54개 브랜드를 선정했다. ‘대한민국 브랜드 명예의전당’은 소비자에게 사랑받은 제품과 서비스를 선정해 글로벌 시장에서 우리 산업이 나아갈 방향을 제시하고 있다. 아래는 수상 브랜드.━풍부한 연무량과 청소 불편 해소로 호평 얻어궐련형 전자담배 ㈜KT&G,릴(lil) ★★★★★㈜KT&G의 릴(lil)이 ‘2023 대한민국 브랜드 명예의전당’ 궐련형 전자담배 부문에서 수상했다. 5년 연속이다.국내 대표 궐련형 전자담배 브랜드 ‘릴’은 지난 2017년 국내에서 첫선을 보인 뒤 편의성과 휴대성에서 소비자의 호평을 받으며 출시 1년 만에 100만 대 넘게 판매했다. 이후 ‘릴 하이브리드’와 신제품 ‘릴 에이블’까지 포트폴리오를 확장하고 있다. 릴 시리즈 디바이스 누적 판매량은 지난해까지 국내에서만 500만 대를 넘어섰다.KT&G는 ‘릴’ 시리즈를 앞세워 국내 궐련형 전자담배 스틱 시장 점유율 1위(지난해 3분기 편의점 판매량 기준 48.5%)에 올랐다. 점유율 상승을 견인한 ‘릴 하이브리드 2.0’은 카트리지와 전용스틱(MIIX)을 동시에 사용하는KT&G만의 독자 플랫폼으로, 풍부한 연무량과 청소 불편 해소 등이 소비자에게 좋은 반응을 얻고 있다.해외시장 저변도 확대하고 있다. 2020년 1월 글로벌 담배기업 필립모리스 인터내셔널(PMI)과 ‘릴’의 해외 판매를 위한 제품 공급계약을 체결해 지난해 12월까지 전 세계 31개국 진출했다.━과학적인 데이터 통해 피부 고민별 솔루션 제시더마코스메틱 ㈜고운세상코스메틱, 닥터지(Dr.G) ★★★★★㈜고운세상코스메틱의 닥터지(Dr.G)가 ‘2023 대한민국 브랜드 명예의전당’ 더마코스메틱 부문에서 수상했다. 5년 연속이다.닥터지는 과학적인 데이터를 중심으로 성분을 철저하게 검토해 피부 고민별 솔루션을 제시하는 정통 더마코스메틱 브랜드다. 대표 제품으로는 〉브라이트닝 필링 젤 〉레드 블레미쉬 클리어 수딩 크림 〉그린 마일드 업 선 플러스 등이 있다.그중에서 ‘블랙 스네일 크림’은 누적 판매량 2800만 개(2017년 3월~2022년 9월)를 돌파하며 국민 안티에이징 크림으로 주목받고 있다. 블랙 스네일 20%와 프로폴리스를 함유해 보습·영양·미백·주름개선·리프팅을 한 번에 관리할 수 있다. 미백 및 주름개선 기능성을 인정받았으며, 피부 안티에이징 인체적용시험과 피부자극테스트를 마쳤다. 쫀쫀한 크림 제형으로 요즘처럼 추운 겨울철에 사용하기 좋다. 2023년부터는 닥터지 자사몰, 네이버 브랜드 스토어 등 온라인에서도 구입할 수 있다.━다양한 시책으로 귀농귀촌 선도하는 대표 도시로귀농귀촌도시 전남 고흥군, 귀농귀촌1번지 고흥 ★★★★★전남 고흥군의 귀농귀촌1번지 고흥이 ‘2023 대한민국 브랜드 명예의전당’ 귀농귀촌도시 부문에서 수상했다. 5년 연속이다.고흥군은 전국 최초로 지자체가 직접 운영하는 ‘귀농귀촌 행복학교’를 열고 귀촌희망 도시민 대상 사전 교육과 임시거주시설을 제공했다. 100억원 조성을 목표로 추진한 내사랑 고흥기금 목표액을 조기 달성해 〉귀향청년 정착장려금 〉주택수리비 지원 〉청년농부 임차료 지원 〉가업승계 청년지원 〉청년창업도전 프로젝트 사업 등의 재원으로 활용하고 있다. 또한 〉청년 문화·예술 취미 동아리 〉청년부부출산축하 아이안심용품 지원과 같은 신규 시책을 추진해 귀향 청년층 유입에 박차를 가해왔다.고흥군은 민선 8기 귀농귀촌 공약으로 〉고흥청년 ‘리턴 고흥’ 프로젝트 〉‘고흥! 3달 살아보고 정착하고’ 추진 〉귀농어인의 집 확대 조성 등을 추진해 ‘10년 후 고흥인구 10만’의 기반을 확고히 구축할 계획이다.공영민 군수는 “앞으로도 귀농귀촌을 선도하는 대표 도시로 ‘행복 고흥’을 만들기 위해 다양한 시책들을 적극적으로 추진하겠다”고 밝혔다.━알파세대 위해AI기술 접목한 맞춤형 교육 제시AI학습 ㈜웅진씽크빅, 웅진스마트올 ★★★★㈜웅진씽크빅의 웅진스마트올이 ‘2023 대한민국 브랜드 명예의전당’AI학습 부문에서 수상했다. 4년 연속이다.웅진씽크빅은 디지털 기술 및 디바이스와 밀접하게 자라는 알파세대를 위해 전 과목에AI기술을 접목, 맞춤형 교육 과정을 제시하고 있다.웅진씽크빅은 2014년 업계 최초로 스마트패드와 독서를 결합한 ‘웅진북클럽’을 선보이며 국내 스마트학습 시장을 만들어냈다. 당시 웅진북클럽은 출시 8개월 만에 회원 수 10만 명을 넘어섰다. 스마트패드에 책과 학습지를 담은 웅진북클럽이 출시되며 실물 책과 종이학습지 학습이 주류였던 교육시장의 패러다임이 스마트교육으로 전환됐다. 이후 웅진씽크빅은 독자적인AI기술력을 구축하며 전 과목AI학습 ‘웅진스마트올’을 비롯해 ‘AI수학’ ‘AI책읽기’ ‘매쓰피드’ 등을 지속해서 선보이고 있다.한편 웅진씽크빅은 총 39건(2022년 10월 기준)으로 업계 최다 에듀테크 특허를 보유하고 있다.━사용자 취향과 니즈에 맞춰 샤워기 필터 교체 가능필터샤워기 ㈜씨앤투스, 아에르 콰트로 샤워기㈜씨앤투스의 아에르 콰트로 샤워기가 ‘2023 대한민국 브랜드 명예의전당’ 필터샤워기 부문에서 수상했다.‘아에르 콰트로 샤워기’는 사용자의 취향과 니즈에 맞춰 필터를 교체할 수 있는 것이 특징이다. 필터는 항균 세디먼트 필터, 카본 필터, 비타민 복합 필터,UF필터 등 총 4가지가 있다.항균 세디먼트 필터는 눈에 보이지 않는 5㎛(마이크로 미터) 크기의 녹과 이물질 등 미세 불순물을 거르고 수돗물 속 세균 증식을 99.9% 억제한다. 카본 필터는 활성탄의 강력한 흡착력을 활용해 불순물은 물론 잔류염소와 물 냄새까지 없애준다. 3가지 향으로 출시된 비타민 복합 필터는 비타민C 1만mg을 함유한 고농축 비타민 겔로 피부 보습력을 강화해주고,UF필터는 정수기에 사용되는 고성능 필터가 가진 0.1㎛의 미세한 기공으로 미세 플라스틱까지 깨끗하게 제거한다.━SW코딩,AI등 미래기술 기반의 디지털 교육 선봬청소년 코딩교육 ㈜네패스, 코코아팹㈜네패스의 코코아팹이 ‘2023 대한민국 브랜드 명예의전당’ 청소년 코딩교육 부문에서 수상했다.‘코코아팹’은 소프트웨어(SW)코딩, 인공지능(AI) 등 미래기술 기반의 디지털 교육은 물론 국내 유수의 기관·기업과 함께 교육 프로그램을 선보이고 있다. 대표적으로SK하이닉스 사회공헌 프로그램 ‘SK하인슈타인’,과학기술정보통신부 ‘강원SW미래채움’ 등이 있으며, 이를 통해 2022년 한 해에만 3만5000명이 넘는 초·중·고등학생들이 교육을 받았다.코코아팹은 디지털 기술 자체보다는 창의적으로 문제를 해결해 나가는 과정에 초점을 맞추고 있다. 최근엔 ‘디지털새싹 캠프’ 운영기관으로 선정돼 2023년 1~2월 겨울방학기간 동안 강원, 서울, 경기, 충북지역의 청소년을 대상으로SW,AI교육 캠프를 진행하고 있다."
2024-09-03,"'세계 톱10' 대만 5곳, 한국 0…패키징 혁명, K반도체의 위기 왜 [반도체 패키징 혁명]","이재용 삼성전자 회장이 지난해 2월 17일 충남 삼성전자 천안캠퍼스를 찾아 패키지 라인을 둘러보고 사업전략을 점검하고 있다. 사진 삼성전자# 지난 3월 중국 상하이 반도체 전시회에 간 국내 패키징 장비 업체 대표는 깜짝 놀랐다. 멀리서 ‘한국OO사 장비구나’ 생각했는데, 가까이서 보니 중국 브랜드가 붙어 있었기 때문이다. 이후 국내 소재·부품·장비(소부장) 대표들이 모이면 “10년 안에 우리 다 망하겠다”는 탄식이 나왔다.# 젠슨 황 엔비디아 최고경영자(CEO)는 지난 6월 대만 전자박람회 컴퓨텍스에서 “TSMC를 둘러싼 생태계는 풍부하고 패키징 기술은 놀랍다”며 계속 대만에 투자하겠다고 했다. 그러나 고대역폭메모리(HBM)를 공급하는SK하이닉스와 삼성전자에 대해서는 “메모리 공급업체 그 이상도 이하도 아니다”라고 일축했다.반도체의 꼬리가 몸통을 흔드는 ‘패키징 혁명’이 시작됐다. 칩을 3나노(㎚·1㎚=10억 분의 1m) 이하로 작게 만드는 미세화 기술이 한계에 이르면서, 로직·메모리·센서 등 다양한 칩 여러 개를 쌓고 묶어 성능을 높이는 패키징 기술이 인공지능(AI) 반도체와 고성능 컴퓨팅(HPC)의 열쇠가 됐다. 그간 경시됐던 반도체 후(後)공정인 패키징이 혁신의 최전선이 된 것이다. 보스턴컨설팅그룹(BCG)은 최근 보고서에서 “첨단 패키징에서 가치를 창출하는 기업 위주로, 기존 반도체 산업 구도가 급격히 바뀔 것”이라고 분석했다. 중국이 패키징 소부장 국산화에 국가 역량을 쏟아붓고, 첨단 패키징에 뛰어난 세계 1위 파운드리(위탁생산) 대만TSMC앞에 엔비디아·애플 같은 빅테크가 긴 줄을 선 이유다.지난 3월 엔비디아 기술 콘퍼런스GTC에서 젠슨 황 엔비디아CEO가 차세대AI가속기인 그래픽처리장치(GPU) B200을 소개하고 있다. B200에는SK하이닉스가 생산한HBM3E 8개가 탑재되는데,TSMC의 첨단 패키징 기술인CoWos를 적용해 결합한다.AFP=연합뉴스TSMC의 모바일 어플리케이션 프로세서(AP)용 첨단 패키징 기술InFo를 사용해 제조한 애플의APA17프로. 현재 아이폰15프로에 탑재됐다. 사진 애플한국은 이 혁명의 주체가 아닌 제물이 될 판이다. 첨단 기술에서 밀린 한국의 세계 패키징 시장 점유율은 6%(2021년)에서 4.3%(2023년)로 낮아졌고, 올 상반기 반도체 증시 랠리가 이어지는 중에도 국내 후공정 대표주자 네패스·하나마이크론 주가는 도리어 하락했다. 한 국내 소부장 임원은 “한국HBM이 잘 나간다지만 이를AI반도체에 부착하는 첨단 패키징은 모두 대만에서 이뤄지며, 국내 장비 업체 10곳 중 8곳은 매출이 줄었다”라고 말했다. 산업통상자원부 자료에 따르면 삼성전자와SK하이닉스는 첨단 패키징 핵심 소재·장비의 95% 이상을 해외에 의존한다.차준홍 기자‘초융합’ 없어 ‘초격차’도 없다첨단 패키징은 소재의 화학·전기적 특성과 장비·공정이 어우러져야 해, 반도체 기업과 소부장의 긴밀한 협력이 중요하다. 그러나 강사윤 한국마이크로및패키징학회장은 “국내 패키징 업체는 연구개발(R&D)에서 R(연구) 없이 D(개발, 생산)만 하고 있는 현실”이라고 말했다. 국내 패키징 업체는 다수가 소수 원청(삼성전자·SK하이닉스) 물량을 나눠받는 구조라 메모리 업황에 따라 휘청이고, 첨단 기술에 투자할 여력도 부족하다는 것. 김남석LB세미콘 대표는 “첨단 패키징은 고객사가 원할 때 개발하기 시작하면 늦기에 먼저 투자 해야 하는데, 중견기업이 홀로 위험을 감수하기에는 벅차다”라고 말했다.패키징 업계에서 20년간 종사한 최봉석 작가(『반도체 산업의 숨은 거인들』 저자)는 “대만은 세계 1위 패키징 업체ASE는 물론 작은 회사도 고객사가 수십 곳에 달하는데, 국내 패키징 업체는 고객사 1곳에 매출의 70~90%까지 의존한다”라며 “한국은 여러 기업이 해외 고객사를 공동 유치하는 식으로, 규모의 경제를 이뤄야 능동적 R&D가 가능하다”라고 말했다.메모리 위주, 수직계열화로 성장한 한국 반도체 업계가 수평 협업에 약하다는 지적도 나온다. 한 국내 소재 업체 임원은 “애플용 칩 패키징 회의에는 대만 패키징 업체인ASE와 기판 업체 유니마이크론, 소재 업체와 애플 본사 담당자까지 다 모이는데 한국에선 하청에 지시만 할 뿐”이라고 말했다. 한국 반도체 산업이 소통·협력의 ‘초융합’에 실패해 기술 ‘초격차’를 상실하고 있다는 진단이다.첨단은 美, 저가는 동남아로… 뻥 뚫린 韓 패키징박경민 기자첨단 패키징의 핵심 고객은 엔비디아·마이크로소프트(MS) 같은 빅테크다. 이 시장을 무기로 미국 정부는 첨단 패키징 기술을 자국으로 빨아 들이고 있다.SK하이닉스는 미국 인디애나에HBM용 첨단 패키징 생산기지를 건설하고 퍼듀대학과 R&D 협력에 38억 7000만 달러(약 5조 2000억 원)를 투자한다고 지난 4월 밝혔다. 삼성전자도 미국 텍사스 테일러에 첨단 패키징 라인을 검토 중이다.범용 반도체용 전통 패키징은 동남아가 강세다. 미중 갈등으로 글로벌 반도체 공급망이 재편되면서, 말레이시아·베트남 등으로 투자가 몰린다. 지난 5월 말레이시아 안와르 이브라힘 총리는 53억 달러(약 7조410억원) 반도체 투자 계획을 밝히며 “설계·패키징·테스트 등 6만 명의 반도체 엔지니어를 양성하겠다”라고 말했다. 현재 세계 반도체 패키징 시장의 13%인 자국 몫을 늘리겠다는 것이다. 이미 인텔이 70억 달러(9조5600억원)를 투자해 말레이시아 페낭에 패키징 시설을 운영 중이다.차준홍 기자첨단 기술로 가는 길은 멀고 전통 일감은 빠져나가니, 국내 패키징 업체들이 모인 충청도는 지역 경제와 일자리가 흔들릴 위기다. 국내 한 패키징 업체 대표는 “우리가 원하는 방향과 정확히 반대로 글로벌 반도체 공급망이 재편되고 있다”라고 말했다. 이병훈 포스텍 교수는 “인건비 등 비용에서 국내 전통 패키징 경쟁력이 사라지고 있어서, 첨단 패키징을 키워야 한다”라고 말했다.국내에 패키징을 강화하려면 장소·인력 문제도 풀어야 한다. 지난달 대만TSMC는 대만 타이난의 공장을 인수해 첨단 패키징 기지로 삼겠다고 밝혔는데, 이곳은 최첨단 반도체를 생산하는 남부과학단지와 인접해 있다. 그러나 한국은 경기도 화성·용인·평택 등 기존 팹이 위치한 수도권에는 각종 규제로 클린룸을 늘리기 쉽지 않다. 지방으로 내려가자니 인력 수급이 난항이다. 삼성전자가 첨단 패키징 연구진을 천안으로 내려보내자 상당수가 경쟁사의 수도권 근무지로 이직한 것으로 알려졌다. 충남의 한 패키징 업체 관계자는 “신입사원 교육에서 허허벌판에 놓인 공장을 보고 실망해 바로 퇴사하는 직원도 많다”라며 “청년층이 지방에 거주하기 위해서는 개별 기업의 노력을 넘어 정부 차원의 인프라 지원이 절실하다”라고 말했다.경기도 평택에 위치한LB세미콘의 팹 내부. 박해리 기자이 기사 어떠세요?한동훈도 이재명도OK,반도체특별법 '급물살'…AI지원법은 ‘물음표’ [반도체 패키지 혁명]https://www.joongang.co.kr/article/25275360한국 신기술 개발해도 검증도 못해…대만은 정부가 밀어준다 [반도체 패키지 혁명]https://www.joongang.co.kr/article/25275360"
2023-08-03,"기술교육대, 하계방학 반도체 전문인력 양성과정 수료식","한국기술교육대학교 3단계 산학연협력 선도대학 육성사업단(LINC3.0사업단)은 2일 한기대, 충북대, 공주대 학생 13명이 참여한 2023학년도 하계방학 ‘반도체 전문인력 양성과정 4기’ 수료식을 가졌다.‘반도체 전문인력 양성과정’은 한기대가 12대 국가전략 기술이자 충남도 지역 특화산업인 반도체분야 전문인력 양성을 위해 한기대 내 우수 인프라를 활용, 타 대학과 공유·협업을 목적으로 지난해부터 이번까지 총 12회 째 운영하고 있다. 방학 기간에 3일 과정으로 운영하며 교육 비용은LINC3.0사업으로 지원하고 있다.해당 과정은 한기대 온라인평생교육원 플랫폼에서 반도체 온라인 컨텐츠를 선행 학습한 후, 반도체기술장비교육센터(SETEC) 교육장에서 반도체소자 강의를 수강하고, 반도체 클린룸 인프라에 설치된 반도체 공정 및 분석장비 실습 등 ‘플립러닝(FlippedLearning.온라인 선학습 후 강의장 교육) 형태로 운영됐다. 교육 마지막 날인 2일에는 충북 괴산의 반도체 전문기업 네패스라웨 견학을 통해 현장실무를 체험했다.교육에 참여한 한기대 임나연 학생(에너지신소재화학공학부 4학년)은 “온라인으로 사전 학습을 하고 클린룸 실습을 통해 공정 순서 등을 실제로 배우니 반도체 학습에 큰 도움이 됐다”고 소감을 말했다.한기대 민준기LINC3.0 사업단장은 “앞으로도 한국기술교육대학교가 보유한 우수한 온·오프라인 교육 인프라를 활용, 창의적 사고와 능동적 실천 능력을 지닌 실천공학기술자 양성을 위해 대학 간 공유·협업을 활성화하고 국가와 지역산업 발전에 공헌하겠다”고 포부를 밝혔다."
2022-05-24,구미대에 채용설명회 쇄도···올해만 최소 15회 열릴 듯,"구미대학교(총장 정창주) 학생들을 채용하려는 기업체 채용설명회가 5월에만 6개 기업이 줄을 잇고 있다.24일 구미대 본관 4층 강당에서는LG이노텍 채용설명회가 열렸다. 5월 들어 현대해상화재보험과 에코프로비엠에 이어 3번째다.이날LG이노텍 채용설명회에는 200여 명의 재학생이 참가해 학생들의 취업 대한 열기를 실감케 했다. 모집분야는 광학솔루션사업부, 기판소재사업부 등으로 기계, 전기, 전자 계열 학생들 중심으로 참가했다.지난해 구미대에서 열린 기업체 채용설명회는 포스코,LS전선, 피엔티 등 총 10회가 열렸다. 기업체 설명회는 5~6월, 9~10월에 주로 열린다.구미대 인재개발처에서는 올해 기업체 채용설명회를 최소 15회 이상으로 예상하고 있다.구미대 인재개발처 백민수 교수는 “지난해부터 공학 및 상경 계열 학생들을 채용하려는 기업들이 늘고 있는 것이 특징”이라고 말했다. 이어 올해 채용설명회를 열거나 협의 중인 기업으로LG이노텍,LG디스플레이,LGBCM,CJ제일제당, 포스코, 포스코케미컬, 카카오모빌리티,SK실트론, 삼성중공업, 효성티엔씨, 코오롱인더스트리,LS전선 등 대기업과 에코프로비엠, 엘앤에프, 네패스, 피엔티, 원익QnC,앰코테크놀로지코리아, 홈플러스,SSLM,주광정밀 등이 있다고 설명했다.이어 5월말까지 주광정밀, 원익QnC,엠코테크놀로지코리아의 채용설명회도 예정되어 있다. 6개 기업이 이번 채용설명회에서 채용하려는 학생들은 100여 명에 이른다.이승환 구미대 인재개발처장은 “최근 4차 산업에서 글로벌 경쟁력을 갖춘 국내 기업들이 투자를 공격적으로 확대하고 있어 기술인력 수요가 한층 늘고 있다”며 “대기업을 비롯 우수한 중견기업들과 밀착형 산학협력을 통해 현장 맞춤형 실무인재를 양성하는데 최선을 다하겠다”고 밝혔다."
2023-10-09,국내 최고 수준의 교육 환경…학사학위 전공심화과정 인가,"연재 ㅣ ○○ 전문가, 이 대학 이 전공!대림대 반도체학과대림대 반도체학과는 최근 학사학위 전공심화과정 신규 인가를 받아 2024학년도부터 운영할 예정이다. 전문학사 3년 과정을 마치고 1년 동안 진행되는 학사학위 전공심화과정을 수료하면 4년제와 동등한 학사학위가 주어진다. 사진은 대림대 반도체학과 학생들이 수업을 받고 있는 모습. 대림대 제공인공지능, 빅데이터,VR/AR등 신기술 등장으로 일상생활 전반에 차세대 반도체를 탑재한 디지털 기술이 속속 적용되고 있다. 대림대 반도체학과는 이런 4차 산업혁명 시대의 변화를 주도하기 위해 2017년부터 반도체장비전공트랙을 운영하기 시작했으며, 최근 반도체학과를 신설해 차세대 반도체 분야 인재양성에 주력하고 있다. 반도체 관련 대기업 출신 교수진 7명을 확보해 반도체 장비 제조·유지보수, 반도체 생산, 회로설계, 테스트 및 계측에 대한 특화 교육을 하고 있다.2021년에 288㎡ 규모의 반도체 클린룸을, 2022년에는 반도체VR실습실과AR교육 체계를 구축해 ‘국내 최고 수준의 차세대 반도체 선도 전문학과’로서의 면모를 갖춰나가고 있다. 또한 산업현장에서 사용되는 반도체 설계 프로그램을 도입하고, 산업계로부터 실제 장비를 기증받아 교육에 활용하는 등 현장 중심 교육과정을 운영하고 있다.국내 반도체 기업의 인재양성 프로그램을 벤치마킹해 차세대 반도체 수요맞춤형 특화 교육모델인D-SEM(DaelimSemiconductorEducationModel)도 구축했다.D-SEM은 교육과정의 현장성 제고를 위해 산업체 전문가와 교원이 공동으로 하는 산학협동 강의와 산업체 현장에서 강의가 진행되는 현장교육,VR/AR및 영상을 활용하는 콘텐츠 활용 교육, 직무역량수준 인증제 등의 교육 체계로 구성돼 있다.반도체학과 학생들은 1학년 1학기 공통과정을 이수한 뒤 2학기에 희망에 따라 반도체장비전공과 반도체디자인전공을 선택하게 된다. 반도체장비전공은 국내 주요 반도체 장비 산업체와 반도체 생산 대기업에, 반도체디자인전공은 반도체 설계 업체 및 반도체 패키징, 테스트 전문업체에 취업한다.2학년부터는 산업체 전문가와 함께 산업 현장 문제 해결 프로젝트인 캡스톤디자인을 3회 수행한다. 그 결과를 직무능력성과 발표회에서 발표해 반도체 산업체와 학생을 양방향으로 매칭한 후 채용연계형 표준현장실습으로 연계하는SEMI-PUP프로그램을 운영해 취업의 질과 학생 및 산업체의 만족도를 동시에 충족시키고 있다.2017년 한국반도체산업협회와 반도체장비전공트랙 운영 협약을 시작으로 구축된 20여 개의 반도체 산업체 거버넌스를 기반으로 2021년에는 스태츠칩팩코리아, 앰코코리아, 네패스 등과 인재양성 협약을 맺는 등 폭넓은 협력체계를 구축했다. 2023년부터는 한국공기청정협회 지원으로 클린룸 운영관리자 양성 프로그램을 운영하는 한편EUV장비 생산업체인ASML에서 포토 공정 및 장비에 대한 특강을 지원받는 교육과정도 운영 중이다.한국공학교육인증원으로부터 공학기술교육(ETAC) 인증을 획득한 대림대 반도체학과는 국제적으로 인정받은 명실상부한 반도체 전문인력 양성 대학이다. 졸업생은 삼성전자,SK하이닉스, 서울반도체, 주성엔지니어링, 동진세미캠,SK실트론 등 국내 유수 대기업 취업 시 서류전형에서 우대를 받을 뿐 아니라 국제적으로 워싱턴 어코드 회원국의 졸업생과 동등한 자격을 가지게 돼 해외 유수 반도체 기업 취업 시 혜택을 받을 수 있다.최근에는 학사학위 전공심화과정 신규 인가를 받았으며, 2024학년도부터 운영할 예정이다. 전문학사 3년 과정을 마치고 1년 동안 진행되는 전공심화과정을 수료하면 4년제와 동등한 학사학위를 받을 수 있다.김상용 학과장은 “반도체 산업체의 수요를 바탕으로 실습 중심 교육을 하고 있으며, 학생들이 산업체가 요구하는 실력을 갖추도록 자격증 취득 등 자격 기반 교육과 함께 직무역량수준 인증제도를 운영하고 있다”며 “2023년 2월 졸업자 취업률이 96%(자체조사 기준)로 특화 교육의 효과가 나타나고 있으며 앞으로도 양질의 교육을 통해 학생과 기업 모두가 만족할 수 있는 차세대 반도체 전문기술인재를 양성하겠다”고 밝혔다."
