date,title,content
2024-01-19,"""류현진이 엉덩이 때려…임혜동, 장난 영상으로 3.8억 뜯었다""","연예매체 디스패치가 전 야구선수 임혜동씨가 미국 프로야구에서 활약하는 류현진씨로부터 3억8000만원을 요구해 받아낼 때 사용한 엉덩이 구타 영상에 대해 보도했다. 한때는이 영상을 친분을 과시하는 수단으로 활용했다는 것이다.미국 메이저리그 프로야구 김하성(28·샌디에이고 파드리스) 선수에게 폭행 피해를 입었다고 주장하는 후배 임혜동씨(27)가 지난달 20일 서울 강남경찰서에 피고소인 신분으로 소환 조사를 받기위해 출석하고 있다.뉴스1임씨는 2022년 류씨의 한국 로드매니저를 맡았다. 임씨는 류씨의 형이 운영하는 에이전트 회사 '에이스펙' 소속이었다.보도에 따르면 2022년 1월 임씨는 호텔에서 류씨를 비롯한 여러 선수와 코치와 술자리를 했다. 만취 상태에서 류씨는 골프채로 임혜동의 엉덩이를 때렸다. 임씨가 속옷을 내리자 류씨가 골프채로 임씨의 엉덩이를 사이를 압박하기도 했다. 이같은 장면은 영상에 촬영됐다. 디스패치는 이같은 행위가 술자리 장난처럼 받아들여졌다고 당시 분위기를 전했다.또 디스패치에 따르면 임씨는 이 영상을 주위에 보여주며 류씨와 친분을 과시하기도 했다. 야구선수 A씨는""(임혜동이) 내게도 자랑한다면서 (동영상을) 전송했었다. 친하다고 자랑하던 영상이 협박용으로 쓰일지 상상도 못했다""며 ""100억원을 받을 거라 말하는 모습에 손절했다""고 매체에 전했다.그러나 임씨는 지난해 3월 류씨에게 영상을 보내고 ""성적 수치심이 든다""며 보상을 요구했다. 류씨는 3억8000만원을 건넸다. 임씨는 돈을 받는 과정에서 ""언론에 알리겠다""는 식의 발언을 되풀이한 것으로 알려졌다.한편 메이저리거 김하성(28·샌디에이고)을 협박한 혐의로 고소당해 경찰 조사를 받고 있는 임씨는 명예훼손 혐의 고소사건에 대해서도 피고소인 조사를 받기 위해 19일 경찰에 출석했다.김씨는 지난달 12일 임씨에 대해 ""다수의 인터뷰를 통해 김하성 선수 관련 허위 사실을 유포하고 거짓 증거 사진을 언론에 제보했다""며 정보통신법상 명예훼손 혐의로 추가 고소했다.임씨가 김하성 선수를 협박한 혐의에 대해 수사하고 있는 경찰은 임씨가 류씨에게도 수억원을뜯은 걸로 보고 18일 오후 공갈 혐의로 구속영장을 신청했다.임씨는 2015년 넥센 히어로즈에 입단했지만 1군으로 경기를 뛰지는 못했고 2016년 방출됐다."
2023-12-08,"김하성 ""오후에 입장 발표""…고소한 후배 선수 임혜동이었다","미국 메이저리그(MLB)에서 활약 중인 김하성(28·샌디에이고 파드리스). 연합뉴스미국 메이저리그(MLB)에서 활약 중인 김하성(28·샌디에이고 파드리스)이 프로야구OB모임 일구회가 매년 개최하는 일구상시상식에 불참했다.김하성은 후배 야구 선수로부터 공갈 협박을 당했다며 경찰에 고소장을 제출한 상태로, 자신에게 쏟아지는 관심이 부담스러운 탓인지 일구회 측에 양해를 구했다고 한다.일구회는 김하성을 특별 공로상 수상자로 선정했고, 김하성은 8일 서울 강남구 청담동 리베라호텔에서 열린 2023 뉴트리디데이 일구상 시상식에 참석할 예정이었다.김하성은 올 시즌MLB포지션별 최고 수비수에게 주는 골드 글러브(유틸리티 부문)를 받아 최고의 한 해를 보냈다. 한국 선수가 골드 글러브를 수상한 건 김하성이 최초이며, 아시아 출신 내야수 첫 수상이기도 하다.하지만 김하성은 시상식을 하루 앞둔 7일 ""협박당해 돈을 뜯겼다""며 과거 국내 팀 동료였던 키움(옛 넥센) 히어로즈 출신 선수를 경찰에 고소했고, 이날 시상식에는 참석하지 않았다.김하성 측은 대리 수상자도 시상식 현장에 보내지 않았다. 대신 ""일구회 선배님들이 주신 의미 있는 자리에 참석하지 못해서 아쉽다. 죄송하고 감사하다""는 소감만 미리 전달했다.사회자는 김하성이 특별 공로상 수상자로 선정됐다는 사실만 짧게 전했고, 시상자로 무대에 올랐던 정근우는 ""올 시즌은 유틸리티로 골드 글러브를 받았지만, 내년은 유격수로 받는 김하성 선수가 되었으면 한다""고 말했다.김하성 소속사인 서밋 매니지먼트는 김하성이 시상식에 불참한 데 대해 ""관련 사안에 대해 공식적으로 입장을 밝히지 않은 상황이라 부득이하게 시상식에 나가지 못했다""면서 ""법률 대리인이 이날 오후 입장을 발표할 것""이라고 예고했다.서밋 매니지먼트는 앞서 ""김하성은 후배 선수로부터 지속해서 공갈과 협박을 받았다""며 ""경찰에 고소장을 제출했고, 6일 경찰서에 출석해 고소인 조사를 마쳤다""고 밝힌 바 있다.━'피소' 후배는 임혜동…직접 얼굴과 이름 공개김하성이 경찰에 고소한 후배 선수는 임혜동씨인 것으로 드러났다. 김하성은 2014년 넥센(현 키움) 히어로즈에 입단했고, 전 야구 선수인 임씨는 이듬해인 2015년 같은 팀에 들어왔다.투수 출신인 임씨는KBO리그 1군에 한 경기도 출전하지 못하고 팀을 떠났다. 이후 2018년부터 2021년까지 김하성의 로드 매니저를 하며 관계를 이어 온 것으로 알려졌다.임씨는 지난 7일TV조선에 자신의 얼굴과 이름을 공개하면서 ""술만 먹으면 (김하성이) 상습적으로 폭행했다. (최근) 2년 동안 연락한 적이 없고 금전 요구를 단 한 번도 하지 않았다""고 주장했다.임씨는 '김하성 폭행 증거'라며 채널A에 관련 사진을 공개하기도 했다. 이에 대해 디스패치는 8일 ""'가정 폭력의 현실'이 '김하성 폭행 증거'로 둔갑했다""고 보도했다.디스패치는 과거 김하성과 임씨가 주고받은 메신저 대화 내용을 증거로 들었다. 이 대화에서 임씨는 김하성에게 ""가정 폭력의 현실""이라며 사진을 여러 장 보냈다. 임씨는 또 ""아빠가 먼저 욕했어요""라고 말하기도 했다.디스패치는 ""임씨가 돈이 떨어지자 또 다른 야구인들을 협박 타깃으로 삼았다""며 ""임씨가 어떤 방식으로 유명 야구선수를 위협하고 갈취했는지 추가로 밝힐 예정""이라고 전했다."
2023-12-08,"김하성 측 ""상습폭행 사실이면 고소하라, 무고 책임 물을 것""","샌디에이고 김하성이 지난달 20일 한국인 최초 골드글러브 수상 기자회견에서 소감을 말하고 있다. 뉴시스후배 선수를 폭행했다는 논란을 받고 있는 메이저리거 김하성(28·샌디에이고 파드리스)이 법무법인을 통해 공식입장을 내놓았다. 문제가 된 상습폭행은 사실무근이라고 항변하면서 법적 조치의 당위성을 역설했다.법무법인 최선은 8일 “여러 매체를 통해 보도된 바와 같이 김하성은 후배인 전 프로야구 선수를 공갈 및 공갈미수 혐의로 최근 고소했고, 경찰 조사를 마쳤다”면서 “2021년 당시 상대 선수는 김하성이 군인 신분인 점을 이용해 김하성을 협박했고 합의금 명목의 돈을 요구했다”고 밝혔다.이 법무법인은 이어 “김하성은 상대 선수가 자신에게 직간접적으로 연락하거나 불이익한 일체의 행위 등을 하지 않는 조건으로 돈을 지급했다. 그럼에도 상대 선수는 또다시 김하성에게 연락하는 등 합의사항을 위반하는 행위를 반복했다”면서 “김하성은 추가 피해를 방지하고자 형사 고소를 하게 됐다. 이와 별도로 합의 위반에 따른 민사소송 및 가압류를 진행했다”고 덧붙였다.2021년은 김하성이 메이저리그로 진출한 시기다. 2018년 자카르타-팔렘방 아시안게임에서 금메달을 따 병역 면제 혜택을 받은 김하성은 그해 12월 예술체육요원으로 훈련소에 입소했다. 예술체육요원은 기초군사훈련만 받으면 2년 10개월 동안 본래 생업에 종사하며 대체 복무를 인정받을 수 있다. 다만 이 기간 법적 문제를 일으키면 현역병으로 다시 복무해야 할 수도 있다.김하성과 후배 선수는 넥센 히어로즈 선후배 사이다. 투수 출신인 후배는 2015년 입단했다. 1군 기록은 없고, 은퇴 후에는 김하성의 에이전시 소속 매니저로 일했다.김하성이 지난 7일 이 선수에게 공갈과 협박을 당했다며 경찰에 고소한 사실이 알려지자, 후배 선수는 몇몇 인터뷰를 통해 “김하성의 매니저로 일할 당시 김하성에게 일방적으로 꾸준히 폭행당했다”고 주장했다.김하성의 수비 장면.AP=연합뉴스법무법인 최선은 “상대 선수는 본인 주장이 사실이라면 정식으로 고소장을 제출하라. 김하성은 성실히 결백함을 밝힐 것이며, 허위 내용 고소에 대해서는 무고의 책임을 철저히 묻겠다”고 강조했다.아울러 “허위의 사실과 조작된 증거 사진을 언론에 제보한 행위는 추가 고소를 진행하겠다”고 덧붙였다.올해 내셔널리그 유틸리티 골드글러브를 받으며 연말을 장식한 김하성은 이날 특별공로상 수상이 예정된 일구대상 시상식에는 불참했다."
2023-11-13,프런트·코치 거쳐 마침내 LG 우승 감독으로…'한풀이 명장' 염경엽,"우승이 확정되는 순간 염경엽(55)LG트윈스 감독의 눈은 촉촉했다. 지도자로서 가장 높은 자리에 오르기까지 고난의 세월이 주마등처럼 뇌리를 스친 듯했다.LG염경엽 감독(오른쪽에서 2번째)이 11일 한국시리즈 4차전에서 3점 홈런을 터트린 오지환(왼쪽)과 함께 기쁨의 세리머니를 하고 있다. 뉴스1LG는 13일 서울 잠실구장에서 열린 한국시리즈 5차전에서 6-2로KT위즈를 이겼다.LG는 2번 타자·중견수 박해민이 3회 말 2타점 선제 2루타를 터뜨려 승기를 잡았다. 박해민은 또 3-0으로 앞선 4회 초 2사 1, 2루의 위기에선 다이빙캐치로 실점을 막았다. 3타수 2안타 2타점을 올린 박해민은 데일리MVP로 선정됐다. 선발투수 케이시 켈리는 5이닝 1실점 호투로 승리투수가 됐다.한국시리즈 4승 1패를 기록한LG는 29년 만에 통산 세 번째 우승(1990, 94, 2023년)을 차지했다. 경기 내내LG팬들의 노란 물결과 환호성으로 잠실구장은 떠나갈 듯했다.LG선수들은 관중에게 큰절을 했다.염경엽 감독은 야구 명문 광주일고와 고려대를 졸업하고, 태평양 돌핀스에 입단했다. 하지만 프로에선 '수비만 잘하는 유격수'였다. 통산 타율은 0.195. 한국시리즈에서 주전으로 나선 건 1994년이 유일하다.LG가 마지막으로 우승했던 바로 그때다. 당시를 회상한 염 감독은 ""그때LG가 태평양보다 강했다""며 ""이렇게 내가LG감독이 될 줄은 꿈에도 몰랐다""고 했다.캐나다 이민까지 생각했지만, 프로에서 10년을 채운 뒤 유니폼을 벗었다. 코치가 되고 싶었지만, 기회가 오지 않았다. 프런트로 입사해 매니저, 외국인 담당, 스카우트, 운영팀을 거쳤다. 2008년 현대 유니콘스 해체 후LG로 옮길 때의 보직도 스카우트였다. 당시 입단한 선수 중 한 명이 오지환이다.LG선수들이 13일 29년 만의 한국시리즈 우승을 차지한 뒤 기뻐하며 세리머니를 하고 있다. 연합뉴스2009년 염경엽은 마침내 수비코치로 현장에 복귀했다. 3년 뒤엔 넥센으로 옮겨 주루코치를 거쳐 감독이 됐다. 44세 때였다. 공부하는 지도자였던 염 감독은 히어로즈를 강팀으로 만들었다. 부임 첫해 포스트시즌 진출에 성공했고, 3년 째엔 한국시리즈까지 나섰다.SK와이번스(현SSG) 포함, 6시즌 동안 5번이나 팀을 가을야구로 이끌었다.탁월한 선수단 운영 능력 덕분에 '염갈량(염경엽+제갈량)'이란 별명이 붙었다. 하지만 2014년 준우승이 그의 최고 성적이었다. 지난해 11월LG지휘봉을 잡은 염 감독은 '무조건 정규시즌 1위를 차지해야 한다'고 생각했다.해답은 '토털 베이스볼'이었다.LG의 전력은 이미 강했지만, 더 강한 백업 선수와 불펜을 만들기 위해 노력했다. 유영찬·백승현·박명근 등 빠른 공을 던지는 신진급 투수들을 중용했다. 아울러 선발 투수들은 무한 경쟁을 시켰다. 고정된 지명타자를 두는 대신 체력 안배를 위해 여러 선수가 돌아가면서 출전했다.철저한 준비는 결과로 이어졌다. 홀드왕 정우영과 세이브왕 고우석이 고전했지만,LG불펜은 강했다. 믿었던 에이스 케이시 켈리가 초반에 부진했고, 후반엔 플럿코가 이탈했지만, 임찬규가 데뷔 후 최고 성적을 냈다. 꾸준히 준비했던 김윤식이 살아났고, 선발로 전환한 이정용도 성공을 거뒀다. 정교함과 힘을 갖춘LG타선은 팀 타율, 득점 1위에 올랐다.LG선수들이 13일 29년 만의 한국시리즈 우승을 차지한 뒤 기뻐하며 트로피 세리머니를 하고 있다. 뉴스1염 감독은 선수들에게 전폭적인 믿음을 보냈다. 부진해도 선수 스스로 탈출할 때까지 기다렸다. 홍창기는 ""감독님은 시즌 중에 컨디션이 나쁠 때도 '네가 할 수 있는 걸 하라'고 격려해주셨다""고 했다. 켈리는 자신을 기다려준 염 감독에게 여러 차례 고마움을 표시했다.LG는 정규시즌 9경기를 남기고 우승을 확정 지었다. 휴식일 이동하던 차량에서 우승 소식을 접한 염 감독은 ""잠실에서 팬들 앞에서 우승했다면 눈물이 났을 텐데…""라며 껄껄 웃었다.LG는 한국시리즈 파트너를 기다리는 4주를 허투루 보내지 않았다. 무려 6번의 연습 경기를 가졌다. 염 감독은 ""한국시리즈에 직행한 팀은 1·2차전 경기 감각이 떨어진다. 다소 힘들었지만, 선수들이 우승을 위해 열심히 했다""고 말했다. 그리고 다섯 경기 만에 마침내 우승 트로피를 들어 올렸다."
2023-06-29,‘2023 국가서비스대상’ 영광의 부문별 수상자는? – 생활 일반②,"산업정책연구원(IPS)은 ‘2023 국가서비스대상(6thNationalServiceAwards)’을 통해 46개 기업/기관 55개 서비스를 선정했다.국가서비스대상은 매년 한 해 동안 부문별로 소비자들에게 가장 많이 선택받은 서비스를 평가해 소비자들에게 올바른 가이드를 제공하는 한편, 국내 경제 발전과 서비스 산업 경쟁력 향상에 기여하기 위해 마련된 시상제도로, 올해로 6회째를 맞이했다.이번에도 금융과 통신, 의료를 비롯해, 생활일반, 가전, 공공, 레저관광, 유통, 교육 등 총 9개 분야에 걸쳐 55개 우수 서비스가 수상의 영예를 안았다. 아래는 생활 일반부문 수상브랜드.━최고의 경쟁력 갖춘 친환경 에너지화학기업주유소 에쓰-오일㈜, 에쓰-오일(S-OIL) ★★★★★★에쓰-오일(S-OIL)㈜이 ‘2023 국가서비스대상’ 주유소 부문 대상에 선정됐다. 6년 연속이다.에쓰-오일은 ‘최고의 경쟁력과 창의성을 갖춘 친환경 에너지화학기업’의 비전 2030을 목표로 한 최적의 사업 포트폴리오를 구축한 점과 경쟁사보다 한발 앞선 대규모 시설 투자, 체계적인ESG경영 등에서 높은 성과를 인정받아왔다. 시대 정신을 반영한 브랜드 진정성과 ‘좋은 기름’을 모토로 일관된 품질 철학에 기반해 광고 캠페인과 캐릭터 마케팅을 꾸준히 전개해 왔다. 브랜드 마스코트이자 소통 의지를 상징하는 캐릭터 ‘구도일’은 마케팅 활동과 채널에서 전방위적으로 활동하고 있고, 소셜미디어로 활동 영역을 넓히고 있다.크리에이터 ‘구도일’이 주유소, 공연장, 전시행사 등 소비자들이 있는 곳이면 어디든 찾아가는 ‘구도일이 간다’와 ‘구도일의오일로그’ 영상은 매월 1~2편씩 유튜브(GOODOILTV)에 노출되고 있다. 또한 유명 가수, 인기 캐릭터, 셀럽 등과 협업해 고객들에게 특별한 브랜드 경험을 제공하고 있다.━고객 편의성과 혜택 강화 위해 앱 대폭 개편모바일 주유 앱 에쓰-오일㈜,MYS-OIL에쓰-오일㈜의MYS-OIL이 ‘2023 국가서비스대상’ 모바일 주유 앱 부문 대상에 선정됐다.에쓰-오일은 최근 고객 편의성과 혜택 강화에 초점을 맞춰 ‘MYS-OIL앱’을 대폭 개편했다. ‘MYS-OIL앱’은 디자인 측면에서는 고객 중심의 사용자환경·경험(UI·UX)을 제공해 편의성은 물론 타사와 차별화된 기능에 대한 접근성을 개선했다.또한 단골의 가치 증대를 위해 회원 등급(4단계)에 따라 특화된 혜택을 제공하고 있다. 특히VIP등급 고객에게는 정유사 최대 수준인 1L당 4원의 보너스포인트를 적립해주고, 별도 이벤트 혜택도 주고 있다. 정유사 최초로 고객들이 앱에서 전자영수증을 받을 경우 탄소중립 실천 포인트를 제공하고 있다. 최근에는 신용카드 없이도 신용카드, 포인트, 모바일 상품권 등의 복합결제가 한번에 되는 빠른주유(S-OILPay) 서비스를 신규 도입해 비자는 물론 주유소에서도 결제 절차를 간소화할 수 있게 했다.━충전 이력 등 스마트폰 앱 통해 손쉽게 확인전기차 배터리 관리 앱 ㈜LG에너지솔루션,B-Lifecare㈜LG에너지솔루션의B-Lifecare가 ‘2023 국가서비스대상’ 전기차 배터리 관리 앱 부문 대상에 선정됐다.B-Lifecare는 잔여 주행거리와 배터리의 노화 상태, 충전 이력 등을 스마트폰 앱을 통해 손쉽게 확인할 수 있는 배터리 관리 서비스다. 자동차 서비스센터에서도 확인할 수 없던 배터리의 건강 상태를 파악하고, 동일 차종과 동일 연식의 전기차들과 비교해 자신의 차량 배터리가 어느 수준인지도 확인할 수 있다.B-lifecare는 개인별 운행 및 충전 습관 분석, 배터리 스트레스 관리 점수 등의 정보를 제공해 배터리의 효율적인 관리를 돕고, 소비자가 장기적으로 안전하게 전기차를 사용할 수 있도록 배터리 평가 진단 서비스를 지원하고 있다. 차량으로부터 상시 수집된 배터리 데이터를AI모델링, 빅데이터 알고리즘 등을 통해 분석해 배터리의 노화 상태와 수명, 충전 스케줄 및 주행 가이드 등을 제공한다.━타이어 업계 최초 비대면 방문 장착 서비스타이어종합서비스 넥센타이어㈜, 넥스트레벨 ★★★★넥센타이어㈜의 넥스트레벨이 ‘2023 국가서비스대상’ 타이어종합서비스 부문 대상에 선정됐다. 4년 연속이다.넥센타이어는 2015년 업계 최초 타이어 렌털 서비스인 ‘넥스트레벨’을 론칭했다. 타이어 구매를 어렵고 복잡하게 생각하는 소비자들의 의견을 청취해 2021년부터 상품 및 가격을 단순화했다. 또한 계약 기간에 소비자 과실에 의한 파손 및 조기 마모일 경우에도 타이어를 무상 교체해주는 ‘무상보증제도’ 혜택도 적용했다.타이어 렌털뿐 아니라 가까운 렌털 전문점에 방문해 타이어 상태 및 공기압 점검 등을 정기적으로 받아볼 수 있도록 ‘넥스트레벨 체크’ 서비스도 함께 제공한다. 2020년 3월엔 소비자가 원하는 장소와 시간에 직접 찾아가 타이어를 교체해주는 ‘넥스트레벨GO’서비스도 출시했다. 국내 타이어 업계 최초의 비대면 방문 장착 서비스로, 서울·경기 등 수도권을 시작으로 서비스 가능 지역을 확대하고 있다.━모든 기업에 최적화된 전문 산업 인재 소개글로벌 인재채용 컨설팅RobertWaltersKorea★★★RobertWaltersKorea(로버트 월터스 코리아)가 ‘2023 국가서비스대상’ 글로벌 인재채용 컨설팅 부문 대상에 선정됐다. 3년 연속이다.전 세계 31개국에서 4400여 명의 임직원이 근무하고 있는 로버트 월터스는 세계 유수의 다국적 기업, 중소기업, 스타트업에 최고 인재를 찾는 모든 기업에 최적화된 인재 채용 서비스를 제공한다. 사회초년생부터 C레벨 임원직까지 전 직급 구직자에겐 이직 컨설팅을 통한 커리어 개발을 지원하며, 기업 고객에겐 인사 어드바이스 및 인재 채용 솔루션을 통해 기업 니즈에 맞는 경력 및 전문성을 갖춘 산업 인재를 소개한다.최근에는ESG경영에 대한 이해를 높이고 사회적 가치DEI(Diversity·Equity·Inclusion)의 중요성을 강조하기 위해 인사 담당자를 위한 세미나 개최 및 컨설팅을 통해 조직문화 트렌드에 대한 인사이트를 제공하고 있다.━공공부문부터 민간기업까지 사업범위 확대채용관리 솔루션 ㈜휴스테이션, 라비스(RAVIS)㈜휴스테이션의 라비스(RAVIS)가 ‘2023 국가서비스대상’ 채용관리 솔루션 부문 대상에 선정됐다.휴스테이션은 지난 2017년 설립되어HR전문가와IT개발자가 함께하는 회사다.HR분야 전문성을 바탕으로 국내에서 활발하게 사업을 전개하고 있다. 지난해 정보통신부와 한국지능정보화사회진흥원(NIA)이 주관하는 ‘공공부문 이용SaaS개발·검증 지원사업’에 선정돼 2년 연속 사업을 진행하고 있다. 올해는 ‘중소기업 클라우드 서비스 보급·확산 사업’의 서비스 공급기업으로 선정돼 민간기업 영역까지 사업범위를 확대하고 있다.휴스테이션이 선보인 라비스는 빠르게 변화하는 채용 트렌드에 부합하도록 기획 단계에서부터 채용의 공정성과 지원자, 평가자, 인사 담당자의 업무 효율성을 고려해 개발됐다. 지난 2021년 상용화 이후, 약 100여 개 기업과 약 15만 명의 누적 입사 지원자가 활용했다."
2023-07-25,‘형이 왜 거기서 나와’…김하성 파울볼 맨손으로 잡은 관중,"사진 방송화면 캡처전직 메이저리거 강정호(36)가 절친한 후배 김하성(28·샌디에이고 파드리스)의 경기를 관중석에서 지켜보다 파울공을 잡는 모습이 포착됐다.강정호는 25일(한국시간) 미국 캘리포니아주 샌디에이고의 펫코파크에서 열린 2023 메이저리그(MLB) 샌디에이고 파드리스와 피츠버그 파이리츠의 경기에서 관중석으로 날아온 파울공을 맨손으로 잡았다.관중들 사이에 앉아있던 강정호는 공이 날아오자 벌떡 일어나 왼손을 쭉 뻗었고, 그대로 공을 낚아챘다. 심상치 않은 포구에 주변에 있던 사람들은 환호했고, 공을 잡으려던 관중들은 다소 아쉬운 표정을 지어보였다.현지 중계진에 눈에도 강정호의 ‘캐치’는 눈에 띄었다. 현지 중계방송 캐스터는 “이 팬을 보세요. 야구선수 같지 않나요?”라더니 “피츠버그에서 뛰었던 강정호”라며 웃었다.스포츠 전문 매체인 디애슬레틱도 소셜미디어 계정에 강정호가 공을 낚아채는 영상 화면을 캡처해 올린 뒤 “피츠버그에서 뛰었던 강정호가 25일 샌디에이고와 피츠버그의 경기에서 관중석에 앉아있었다”며 “그리고 파울공을 한 손으로 잡았다”고 설명했다.넥센 히어로즈(현 키움)에서 뛰며KBO리그 최고 유격수로 활약한 강정호는 2015년부터 2019년까지MLB피츠버그에서 뛰었다.피츠버그의 주전 내야수로 자리를 잡았던 강정호는 2016년 12월 음주운전 사고를 일으켰고 과거에도 음주운전을 한 사실이 드러나면서 선수 생활에 제동이 걸렸다.강정호는 지난해 4월KBO리그 복귀를 시도했으나 한국야구위원회(KBO)는 이를 불허했다. 결국 강정호는 복귀를 포기하고 불명예스럽게 은퇴했다. 그는 현재 미국 캘리포니아주에서 야구 아카데미를 운영 중이다.강정호는 이날 넥센에서 한솥밥을 먹었던 후배 김하성을 응원하기 위해 경기장을 찾은 것으로 보인다.김하성은 이날 시즌 13,14호 홈런을 몰아치며 강정호가 가진MLB한 시즌 최다 홈런 기록(21개)에 다가섰다."
