date,title,content
2022-03-04,"“우크라행 화물, 우회하라 터키로” 또 하나의 워룸, 물류 컨트롤센터","국내외 1000여 기업 물류 책임지는 삼성SDS판교캠퍼스지난 2일 삼성SDS판교캠퍼스 내 글로벌컨트롤센터(GCC). 가로 7.3m,세로 1.4m 대형 스크린에 러시아 쪽으로 향하는 선박 수백대가 표시됐다. 화면 중앙에는 ‘전쟁-레벨3-2022-02-25′이라는 비상경고 표시와 함께 전쟁 상황과 영향 범위를 보여주는 동심원 여러 개가 나타났다. 화면 속 컨테이너선을 클릭해 보니 러시아와 유럽으로 향하는 전자기기, 레진(플라스틱 원료), 각종 기계부품이 실려 있다는 정보가 나왔다. 삼성SDS의 물류사업을 총괄하는 오구일 부사장은 “실시간으로 현지 상황 데이터가 수집되면,AI(인공지능)가 도착 시간을 예측하고 문제가 생길 경우 우회 경로를 파악해 고객사와 곧바로 협의에 들어간다”며 “이곳은 전 세계 1000여 기업의 물류를 책임지는 워룸(WarRoom)”이라고 했다. 이날GCC에서는 우크라이나 남부 오데사항으로 가던 화물은 육상운송으로 전환해 터키를 거쳐 폴란드로 우회시켰고, 시베리아 횡단철도로 이동하던 화물은 우크라이나 대신 벨라루스와 폴란드 철도 노선으로 목적지를 변경했다.전세계 화물선·화물열차 정보 한눈에 - 지난 2일 경기도 성남시 삼성SDS판교캠퍼스에 있는 글로벌컨트롤센터에서 물류사업부 직원들이 전쟁 중인 우크라이나와 러시아 인근 물류 상황을 점검하고 있다. 이곳은 전 세계 1000여 기업 고객의 물류 흐름을 24시간 추적해 실시간으로 대응하는 물류 '워룸(Warroom)'이다. /고운호 기자러시아로 향하던 화물,AI가 실시간으로 우회시켜코로나 팬데믹(대유행)이 초래한 물류 대란에 러시아의 우크라이나 침공까지 더해지면서 글로벌 공급망이 위기를 맞았다. 전 세계 물류 흐름이 연쇄적으로 동맥경화를 일으키면서 인플레이션까지 초래하고 있다. 최근 물류 업계에서는AI·로봇·블록체인 같은 최신 기술로 이러한 문제를 풀려는 기업들이 주목받고 있다. 투자금도 몰린다. 글로벌 시장조사업체 피치북에 따르면 물류 기술 기업에 대한 글로벌 투자액은 2017년 60억달러(약 7조2228억원)에서 지난해(1~3분기) 243억달러(약 29조2523억원)로 늘었다.약 36평(119㎡) 규모인GCC안에서는 치열한 분석과 예측이 계속됐다. 오늘 도착해야 할 자재가 미리 도착하면 창고 보관비가 들고, 다음날 도착하면 지연비용을 물어야 하기 때문에 톱니바퀴 맞물리듯 정시에 모든 게 이뤄져야 한다는 것이다. 지난해 매출 13조6300억원 가운데 8조원가량을 물류사업에서 올린 삼성SDS는 물류 전 과정에IT를 접목했다. 컨테이너에는IoT(사물인터넷)를 접목해 문이 함부로 열리는지 감시하고, 빛에 민감한 화물은 센서로 광량을 실시간 점검한다. 네덜란드에 있는 2만평 규모의 초대형 물류창고에서는AI가 화물 상자를 어떤 방향으로, 어느 순서로 쌓는 것이 효율적인지 레고 맞추듯 하나하나 코치를 해준다. 삼성SDS관계자는 “그동안 베테랑 직원이 감으로 하던 일을 이제 신참 직원도 스마트 글라스를 쓰고AI의 지도를 받아 척척 할 수 있다”고 했다. 삼성SDS는 지난해 8월부터 중소·중견 기업을 타깃으로 한 물건 포장부터 배송까지 전 물류 과정을 간소화한 원스톱 물류 플랫폼(첼로 스퀘어) 사업도 시작했다.글로벌 공급망 위기, 기술로 해결유연한 공급망 확보가 핵심 경쟁력이 되면서 발이 묶인 기업들을 구하려는 물류 스타트업도 각광을 받고 있다. 기존 물류회사들은 기술기업들을 적극적으로 인수해 혁신을 꾀하고 있다. 2016년 창업한 토종 디지털 물류 스타트업 로지스팟은 마치 앱으로 택시를 부르듯이 10만여 대의 화물차를 예약하고 관리하는 서비스를 제공한다. 번거로운 팩스·메일 작업 없이 앱으로 위치 추적, 물품 상태 확인이 실시간으로 가능하다. 퍼시스·레노버·넥센타이어 등 700여 기업고객을 두고 있다. 배달 대행 스타트업들도 모세혈관처럼 퍼진 배달 라이더 네트워크를 활용한 물류 사업에 나섰다. 바로고·부릉·생각대로 배달대행 3사는 도심 골목골목에 소규모 자체 물류센터를 두고 배달 라이더가 음식을 배달하듯 물품을 배송하는 ‘라스트마일 물류’를 신사업으로 밀고 있다.해외에서는 물류로봇과 공급망을 유연하게 해주는 기술이 뜨고 있다. 캐나다 스타트업 어태보틱스는 물류창고에 상하좌우로 움직이는 자동화 로봇을 접목했다. 기존 로봇이 오직 수평으로만 움직이며 물건을 날랐다면, 어태보틱스 로봇은 여러 방향으로 움직이며 공간을 효율적으로 쓸 수 있게 해준다는 것이다. 미국 완성차업체 제너럴모터스(GM)는 지난해 물류사업 진출을 선언하고 물류 스타트업 브라이트드롭을 설립했다. 전동화 팰릿(화물 운반대)과 이를 원격 관리하는 소프트웨어를 개발한다."
2024-11-21,"지연∙황재균, 조정 끝 이혼 확정…결혼 2년 만에 남남 됐다",그룹 티아라 멤버 겸 배우 지연(왼쪽)·kt위즈 소속 프로야구선수 황재균. 사진 지연 인스타그램 캡처그룹 티아라 멤버 겸 배우 지연(31)과kt위즈 소속 프로야구선수 황재균(37)이 법원에서 조정을 거친 끝에 법적으로 이혼이 확정됐다.21일 뉴시스에 따르면 지연과 황재균이 제기한 이혼 사건 조정이 전날 서울가정법원에서 성립됐다. 조정 과정에서 양측은 재산분할 등을 합의한 것으로 보이나 자세한 사항은 알려지지 않았다.이날 조정기일에 두 사람은 따로 출석하지 않았고 이들의 소송대리인만 법원에 출석한 것으로 전해졌다.앞서 지연의 법률대리인은 지난달 5일 공식 입장을 내고 “양측은 서로의 다름을 극복하지 못해 별거 끝에 이혼에 합의하고 절차 진행을 위해 서울가정법원에 이혼 조정 신청서를 접수한 상황”이라고 밝혔다.지연은 법률대리인을 통해 “좋지 않은 소식으로 인사드리게 돼 죄송하다”며 “서로 합의 하에 이혼을 위한 조정 절차를 진행하게 됐다”고 했다.그러면서 “빠르게 입장 표명하지 못한 점 너른 양해를 부탁드린다”며 “향후 더 좋은 모습으로 인사드릴 수 있도록 노력하겠다”고 덧붙였다.황재균도 “성격 차이로 인해 고심 끝에 별거를 거쳐 이혼하기로 합의했다”며 “이미 서울가정법원에 이혼 조정 신청서를 제출했고 조정 절차를 거쳐 원만하게 마무리할 예정”이라고 밝혔다.이어 “비록 부부로서의 인연이 끝났지만 서로의 가는 길을 앞으로도 응원하고 지지할 것”이라며 “팬분들께 실망하게 해 드린 점 다시 한번 죄송하게 생각하며 무분별한 추측 및 보도는 자제해 주길 정중히 부탁드린다”고 했다.지연과 황재균은 2022년 2월 연애 6개월 만에 결혼을 발표하고 그해 12월 결혼했다.지연은 2009년 걸그룹 티아라로 데뷔 후 ‘거짓말’ ‘롤리폴리’ ‘왜 이러니’ 등의 히트곡을 냈다. 지연은 배우로도 활동하며 드라마 ‘공부의 신’ ‘드림하이2’ 등에 출연했다.황재균은 2006년 프로 무대에 데뷔했다. 넥센과 롯데를 거쳐 현재는kt위즈 소속이다. 국가대표 3루수 출신으로 2021년 처음으로 한국시리즈에서 우승했다.
2024-10-12,주유구에도 열쇠구멍 달렸다…80년대 '포니2' 탈 수 있는 이곳,"주말車담현대차의 최초 모델 코티나(앞)와 첫 수출 차량인 포니(뒤). 최선욱 기자10일 오후 서울 논현동 도산공원사거리에 위치한 ‘현대모터스튜디오 서울’.이곳에 전시된 1980년대 차 포니2에 사람들의 눈길이 쏠렸다. 몇몇 남성들은 문을 열어보기도 하고 운전석에 앉아 기념 촬영도 했다. 회전식 창문 손잡이와 카세트테이프 슬롯, 열쇠구멍 달린 주유구 등이 관람객들 사이에서 특히 인기였다. 당시엔 없던 넥센타이어를 장착한 것만 빼고는 40년 전 그 모습 그대로의 포니2다.“직접 문 열어서 타보세요. 그것도 다 감성이고 경험이니까요.”(현장 직원)한 방문객은 조수석에 앉아 20~30분간의 시승도 즐겼다. 엔진 소리가 요즘 차량보다 꽤 컸지만, 옛날 차의 느낌을 더욱 살려주는 듯 했다.시승객을 기다리는 포니2. 사이드미러가 보닛 앞에 달린 게 특징이다. 최선욱 기자‘올드 카’ ‘클래식 카’ 등으로 불리는 옛 현대차를 한 자리에서 보고 만질 수 있는 공간이 마련됐다. 현대자동차가 1967년 설립 후 누적 생산 1억대를 기념하기 위해 개최한 ‘다시, 첫걸음:Onestepfurther’전시(11월 10일까지)에서다.전시장에 들어서면 이 회사 최초의 조립 생산 모델인 ‘코티나 마크2’가 서 있다. 포드 제품을 조립한 것이었는데, 함께 전시된 당시 판촉물의 홍보 문구는 ‘여러분은 포드의 가족이 되시지 않으시렵니까?’다. 지금은 현대차의 세계 판매량 순위(3위)가 포드(7위)보다 앞서지만, 당시는 현대차가 미국 포드의 위상에 기대 조립차를 판매하던 때였다. 누군가가 메모한 코티나(배기량 1600cc)의 가격도 적혀있다. '계약금 50만원, 인도금 80만원'.코티나 판매용 안내책자 일부. 최선욱 기자코티나 판매용 안내책자 일부. 최선욱 기자이 코티나를 조립하는 데 필요한 공장을 건립하기 위해 현대차는 울산 땅에 대한 매립 허가를 받아야 했다. 1967년 10월 건설부장관으로부터 받은 울산시 염포동에 대한 매립공사실시계획인가증엔 사업자 현대건설의 대표이사로 고(故) 정주영(1915~2001) 현대그룹 선대회장의 이름이 적혀있다.코티나 옆엔 1976년 에콰도르에 수출돼 택시로 쓰인 포니가 전시돼 있었다. 포니는 한국 최초의 자동차 수출 모델이었다. 5대의 포니를 배에 실으며 시작된 한국 자동차 수출의 역사는 국가유산청 기록물로도 남아있다. 전시장엔 “우리가 보낸 것은 단지 5대의 포니 뿐만이 아니다. 세계를 향한 우리의 꿈도 함께 실려갔던 것이다”는 정세영 전 현대차 회장의 소감도 함께 소개돼있다.현대차 광고가 실린 중앙일보 1983년 1월 24일자 1면. 최선욱 기자현대차는 사내 임직원이 남긴 업무 기록들도 일부 공개했다. 이 중 코티나 생산 당시 일했던 김형준 전 감사의 녹취록 문서엔 그때의 고충이 고스란히 담겨있다.“그때 교통이 상당히 불편했다. 고속도로도 없고 트럭으로 오는 게 힘들어서 대개 기차로 (필요 부품을) 부친 것 같다. 우리가 울산 기차역으로 가서 찾아오고 했다.”현대차의 엔진 자체 기술 개발 단계 때 만들어진 보안 문서. 최선욱 기자현대차 울산공장을 짓기 위해 받은 인가증. 당시 현대건설은 현재의 청계광장 인근에 있었고 대표이사는 고 정주영 선대회장이었다. 최선욱 기자1990년대 초 엔진 국산화의 꿈을 이룬 기록도 현대차는 비중있게 전시했다. 특히 ‘CONFIDENTIAL’(기밀문건) 도장이 찍힌 ‘α-PROJECT개발현황’ 문건이 공개돼 있어 눈길을 끌었다. 1989년 12월 용인 마북리연구소에서 작성한 연비 개선 시험 결과 데이터를 적어둔 문서다. 현재 마북연구소는 현대차그룹의 수소연료전지 개발을 맡고 있다.이곳에선 첫 독자 설계 차량 쏘나타, 자동화 공정의 첫 결과물이었던 엘란트라, 독자 개발엔진을 탑재한 스쿠프 등도 볼 수 있다. 이밖에 아이오닉 5·6 등 현재의 주력 차종도 함께 전시돼 있다. 지성원 현대차 브랜드마케팅본부 전무는 “차 한 대에 집약된 숨겨진 노력과 시간을 고객과 함께 돌아보고자 마련한 자리”라고 설명했다."
2024-09-28,"회삿돈 횡령한 히어로즈 전 부사장, 이장석 돈 떼먹어 실형 확정","남궁종환 전 프로야구 넥센 히어로즈(현 키움 히어로즈) 부사장이 과거 횡령 사건의 공범인 이장석 전 대표에게 빌린 돈을 갚지 않은 혐의로 실형을 확정받았다.28일 법조계에 따르면 대법원 2부(주심 권영준 대법관)는 사기 혐의로 기소된 남궁 전 부사장에게 징역 1년을 선고한 원심판결을 지난달 1일 확정했다.남궁 전 부사장은 2017년 “횡령액 변제에 쓰려고 한다”며 이 전 대표에게서 3억1000만원을 빌린 후 갚지 않은 혐의로 2021년 11월 재판에 넘겨졌다.당시 두 사람은 회사 장부를 조작해 2010∼2015년 회삿돈 약 21억원을 횡령한 혐의로 1심 재판을 받고 있었다.횡령 사건으로 이 전 대표는 징역 3년 6개월, 남궁 전 부사장은 징역 3년에 집행유예 4년을 각각 확정받았다.이후 출소한 이 전 대표가 돈을 받지 못했다며 남궁 전 부사장을 고소했다.다시 법정에 서게 된 남궁 전 부사장은 3억 1000만원이 빌린 돈이 아니라 이 전 대표의 요청으로 회사 사무실 금고에 넣어둔 자기 돈을 가져온 것이라고 주장했다.그러나 1심 법원은 이 주장을 받아들이지 않고 징역 1년을 선고했다.남궁 전 부사장은 항소한 뒤 돈을 갚겠다며 “조금만 더 시간을 달라”고 요청했지만 선고일까지 변제가 완료되지 않아 2심에서도 징역 1년을 선고받고 법정에서 구속됐다.그는 재차 불복했으나 대법원 역시 2심 판결에 잘못이 없다고 보고 상고를 기각했다."
2024-07-28,"잘나가던 'K타이어' 끼익?…캐즘에 운임·고무값 상승, 고민 커진다","지난 4월 서울국제생산제조기술전(SIMTOS)에서 타이어 교체 로봇이 새 타이어 장착 시연을 하고 있는 모습. 뉴스1호실적을 내고 있음에도 국내 타이어업계의 고민은 커지고 있다. 전기차 캐즘(일시적 수요 정체)에 원자잿값·운임까지 상승 움직임을 보이면서다. 글로벌 시장도 만만치 않은 상황이어서 K타이어의 새로운 성장전략이 필요하다는 분석이 나온다.28일 금융정보업체 에프앤가이드와 증권가에 따르면 올 2분기 국내 타이어 3사(한국·금호·넥센)의 합산 영업이익 추정치는 지난해 같은 기간보다 63% 높다. 한국타이어(한국타이어앤테크놀로지)의 2분기 영업이익 추정치는 3977억원, 금호타이어와 넥센타이어는 각각 1539억원·579억원이다. 3사 합산 매출 추정치도 지난해 같은 기간보다 5% 증가했다〈그래픽 참조〉.김경진 기자타이어 3사는 지난해부터 고부가가치 상품을 확대하며 질주를 이어왔다. 스포츠유틸리티차(SUV)·전기차 시장 확대로 고마진 제품의 판매량이 늘었기 때문이다. 통상 전기차는 차량 중량이 무거워서 전기차용 타이어가 일반 타이어보다 가격이 높고, 마진율도 높다. 여기에 2~3년 전 전기차의 판매량이 확 늘어난 점을 감안하면, 타이어 교체 주기가 돌아오며 수요가 늘었다. 연초만 해도 타이어 3사는 전기차 타이어 비율을 전체 생산량의 10~25%까지 확대할 방침 세우기까지 했다. 현재는 5~15% 수준이다.하지만 고물가·고금리로 글로벌 신차 시장도 축소됐고, 전기차 캐즘까지 확산하면서 상황이 급변하고 있다. 여기에 연초보다 원자재인 고무 가격과 운임 등이 오르면서 수익성이 줄었다. 지난 26일 기준으로 고무값(국제 선물계약 가격)과 해상운임은 연초보다 각각 5%·82% 올랐다. 이달 초엔 고무값은 연초보다 14%, 해상운임은 97%까지 치솟기도 했다.김경진 기자김경진 기자원자잿값과 운임 등의 반영 시차를 고려하면 당장 실적에 영향이 없더라도, 연초 세웠던 경영계획을 변경해야 할 처지에 놓인 것이다. 한 업계 관계자는 “원·부자재와 해상운임 상승은 실제 반영까지 시차가 있고, 현재의 변화는 커버 가능한 수준이라 매출과 수익률에 당장 큰 영향을 주지는 않을 것”이라면서도 “중·장기적으로는 회사 경영에 영향이 미치는 만큼 시장 상황을 예의주시하고 있다”고 말했다.업황 불확실성이 커지다 보니 해외 시장 확대도 고민이다. 업계에 따르면 글로벌 타이어 시장은 미쉐린(프랑스)·브릿지스톤(일본)·컨티넨탈(독일)·굿이어(미국) 등 4사가 절반가량을 차지하고 있다. 3사가 노리는 시장은 북미·유럽 등 선진국 시장이다. 한국타이어는 중국(3곳)·헝가리·인도네시아·미국 등에 공장을 가동 중이다.중국(3곳)·미국·베트남 등에 생산기지를 두고 있는 금호타이어는 조만간 동유럽에 생산기지를 건립할 계획이다. 지난해 이 회사의 타이어매출 중 유럽 비중은 24%로 미국(30%) 다음으로 컸다. 하지만 별도의 생산기지가 없어 운임 부담이 컸다.넥센타이어는 당초 예정했던 북미 생산거점 신설을 두고 고민을 거듭하고 있다. 이 회사는 중국·체코에 공장을 가동 중인데, 북미공장을 세워 가장 큰 타이어 시장인 미국 진출을 노려왔지만, 비용 상승 등으로 기존 계획을 변경했다. 지난 5월 “검토 과정에서 건설비·인건비 등 상승으로 기타 글로벌 지역 공장 설립을 검토하고 있다”고 공시했다. 넥센타이어 측은 대체지역으로 중남미·동남아 등을 후보군으로 두고 손익을 따지고 있다고 한다.내수 시장을 기반으로 성장해온 중국 타이어 회사들의 맹추격도 만만치 않다. 타이어 제조 기술력이 높아지고 있는 데다가, 활동영역을 넓힌 비야디(BYD) 등 중국산 전기차를 등에 업고 글로벌 시장으로 속속 나가고 있다. 업계에 따르면 중국 타이어회사ZC루버는 글로벌 9위 수준이다. 한국타이어(7위)가 소폭 앞서고 있지만, 금호(15위)·넥센(20위) 등은 뒤져있다는 평가다.장문수 현대차증권 연구원은 “중국을 제외하곤 글로벌 시장에서 신차용 타이어의 성장이 둔화하고 있어, 견조했던 교체용 타이어 수요 효과를 경감시키고 있다. 특히 미국 타이어 수요가 둔화하는 가운데, 중국 브랜드와 동남아산 타이어가 늘며 가격 하락 압력이 있는 상황”이라며 “해상 운임비의 상승은 국내 타이어사 비용 구조에 더 민감해 하반기 수익성에 영향이 커질 것”이라고 전망했다."
2024-08-31,"법원 ""'연락 않겠다' 합의 어긴 임혜동, 김하성에 8억원 줘야""","메이저리거 김하성 선수에게 거액을 뜯어낸 혐의를 받는 전 야구선수 임혜동. 뉴시스공갈 혐의를 받는 전 야구선수 임혜동(28)이 메이저리거 김하성(29·샌디에이고 파드리스)에게 합의 조건 위반에 따라 8억원을 줘야 한다고 법원이 판단했다.31일 법조계에 따르면 서울중앙지법 민사합의25부는 지난 30일 김하성이 임혜동을 상대로 제기한 위약벌 청구 소송에서 ""피고는 원고에게 8억원을 지급하라""고 선고했다.두 사람은 선후배 사이로 2021년 2월 서울 강남의 한 술집에서 몸싸움을 벌인 게 분쟁의 계기가 됐다. 임혜동은 당시 병역 특례를 받는 군인 신분인 김하성에게 합의금을 요구했다.김하성은 향후 직간접적으로 연락하거나 불이익한 행위를 하지 않는 조건으로 4억원을 줬다. 하지만 임혜동이 이후에도 연락해 오는 등 합의 사항을 어기자 김하성은 지난해 말 공갈 혐의로 그를 형사 고소하고, 민사 재판으로도 위약벌 청구 소송을 제기했다.수사를 진행한 서울 강남경찰서는 지난 1일 공갈·공갈미수 혐의가 인정된다고 보고 임혜동을 검찰에 송치했다.임혜동은 2015년 프로야구 넥센(현 키움) 히어로즈에 투수로 입단했지만 1군에 데뷔하지 못하고 이듬해 팀을 떠났다."
2024-07-29,전기차 캐즘에 원자재·운임까지 상승…잘 달리던 K타이어 고심,"호실적을 내고 있음에도 국내 타이어업계의 고민이 커지고 있다. 전기차 캐즘(일시적 수요 정체)에 원자잿값·운임까지 상승 움직임을 보이면서다.김경진 기자28일 금융정보업체 에프앤가이드와 증권가에 따르면 올 2분기 국내 타이어 3사(한국·금호·넥센)의 합산 영업이익 추정치는 지난해 같은 기간보다 63% 늘었다. 한국타이어(한국타이어앤테크놀로지)의 2분기 영업이익 추정치는 3977억원, 금호타이어와 넥센타이어는 각각 1539억원·579억원이다. 3사 합산 매출 추정치도 지난해 같은 기간보다 5% 증가했다.김경진 기자타이어 3사는 지난해부터 스포츠유틸리티차(SUV)·전기차용 고부가가치 상품을 확대하며 질주를 이어왔다. 전기차용 타이어는 일반 타이어보다 마진율이 높다. 여기에 2~3년 전 전기차의 판매량이 확 늘어난 점을 감안하면, 타이어 교체 주기가 돌아오며 수요가 늘었다.김경진 기자하지만 고물가·고금리로 글로벌 신차 시장이 축소됐고, 전기차 캐즘까지 확산하면서 상황이 급변하고 있다. 여기에 원자재인 고무 가격과 운임 등이 오르면서 수익성이 줄었다. 지난 26일 기준으로 고무값(국제 선물계약 가격)과 해상운임은 연초보다 각각 5%·82% 올랐다.내수 시장을 기반으로 성장해온 중국 타이어 회사들의 맹추격도 만만치 않다. 타이어 제조 기술력이 높아지고 있는 데다가, 비야디(BYD) 등 중국산 전기차를 등에 업고 글로벌 시장으로 속속 나가고 있다. 업계에 따르면 중국 타이어회사ZC루버는 글로벌 9위 수준이다. 한국타이어(7위)가 소폭 앞서고 있지만, 금호(15위)·넥센(20위) 등은 뒤져있다는 평가다."
2024-08-01,‘김하성 공갈 혐의’ 임혜동과 전 소속사 팀장 불구속 송치,"미국 프로야구 김하성(샌디에이고 파드리스)을 공갈 협박 및 명예훼손한 혐의를 받는 야구선수 임혜동. 연합뉴스‘술자리 폭행’ 사건으로 메이저리거 김하성(29·샌디에이고 파드리스)에게 거액을 뜯어낸 혐의를 받는 전 야구선수 임혜동(28)이 검찰에 넘겨졌다.1일 경찰에 따르면 서울 강남경찰서는 지난달 23일 임씨를 공갈, 공갈미수 혐의로 검찰에 불구속 송치했다.또한 범행을 공모한 혐의(공갈)를 받는 에이전시 팀장 박모씨도 함께 송치됐다.임씨는 2021년 2월 서울 강남의 한 술집에서 김씨와 술을 마시다 몸싸움을 벌인 뒤 이를 빌미로 합의금 명목으로 두 차례에 걸쳐 4억원을 받아낸 혐의를 받는다.당시 임씨는 김씨가 소속된 에이전시에서 매니저로 일하고 있었다.임씨는 이후에도 김씨에게 추가로 돈을 요구했으나 김씨가 이를 거부한 것으로 알려졌다.경찰은 지난 1월과 6월 두 차례에 걸쳐 임씨에 대한 구속영장을 신청했으나 법원이 방어권 행사 등의 필요성을 들어 기각했다.지난해 말 김씨 측 고소장을 접수한 경찰은 수사 과정에서 임씨가 프로야구 선수 류현진(한화 이글스·37)에게서도 유사 수법으로 현금 3억 8000만원을 받은 의혹도 제기됐다. 포착했다. 다만 류씨 측은 경찰의 피해자 진술 요구에 응하지 않는 상태라 혐의에서 제외된 것으로 알려졌다.한편 임씨는 2015년 넥센(현 키움) 히어로즈에 투수로 입단했던 전 프로야구 선수로, 1군에 데뷔하지 못한 채 이듬해 팀을 떠났다."
