date,title,content
2022-07-25,‘인공지능 대가’가 무보수로 신약개발 연구소장 맡은 까닭은,"김선 목암생명과학연구소 소장(오른쪽)과 신현진 부소장이 21일 경기도 용인시 목암생명과학연구소에서 인공지능을 활용한 신약 개발에 대해 설명하고 있다. 김경록 기자김선(60) 서울대 컴퓨터공학과 교수는 지난 4월 목암생명과학연구소 소장으로 부임했다. 세계적인 인공지능(AI) 석학으로 꼽히는 김 교수의 인사 소식은 제약 업계에서 화제가 됐다. 1984년GC녹십자가 설립한 비영리 연구재단인 목암연구소가‘AI신약’ 개발을 선언하면서 이뤄진 파격 영입이어서다.지난 21일 경기도 용인에 있는 목암연구소에서 만난 김 소장과 신현진(49) 부소장은 “목암연구소가 앞으로AI신약 개발 생태계를 구축하는 데 큰 역할을 하는 게 목표”라고 밝혔다. 김 소장은AI전문가이자 서울대 생물정보연구소장을 지내면서 학술·교육 측면에서 세계 최고 성과를 낸 것으로 유명하다. 신 부소장은 전기공학과 의생명정보학을 전공한 뒤 미국 다케다제약에서 10여년간 근무했다.김 소장은AI신약에 대해 “말 그대로 신약 개발 과정에AI를 접목하는 것”이라고 설명했다. “예컨대 축적된 실험 데이터를AI가 학습하게 해 가상의 실험을 보다 빠르고 다양하게 진행해 성공 가능성이 더 큰 가설을 찾아낼 수 있습니다. 신약을 개발하는 비용과 시간도 크게 줄일 수 있지요.”영국 엑센시아는AI를 활용해 강박장애 치료제를 개발하는 기간을 4~5년 단축하기도 했다. 시장조사업체 마켓인사이트에 따르면AI신약 개발 시장 규모는 2024년께 40억 달러(약 5조2000억원)에 이를 전망이다.김선 목암생명과학연구소 소장이 21일 경기도 용인시 목암생명과학연구소에서 앞으로 연구개발 계획을 밝히고 있다. 김경록 기자김 소장이 제시하는 첫 번째 미션은 융합형 인재 육성이다. 이를 위해 목암연구소는 서울대AI연구원과 함께 16주 동안 박사학위 소지자나 박사과정 수료자에게 약학·생명과학·AI·생물정보학·AI신약 개발 등 5개 분야를 무료로 교육하는 프로그램을 운영한다. 김 소장은 “세계적으로도 이런 시도는 처음일 것”이라며 “교육 이수자들은 자신의 전공 분야 외에 다른 분야의 전문가와 만나 마치 레고블록 쌓기처럼 새로운 성(城)을 쌓는 연구를 추진할 수 있다”고 자신했다.연구소 자체적으로 신약 개발 활동도 추진한다. 신 부소장은 “독성이 낮으면서 효능이 뛰어난 유전자 치료제, 메신저리보핵산(mRNA) 백신, 항체 같은 바이오 의약품 개발에 적용할 수 있는 기술을 연구한다”고 말했다.경기도 용인시 목암생명과학연구소 전경. [사진 목암생명과학연구소]김 소장은 서울대의 겸직 제한 규정 때문에 무보수로 연구소장 직무를 수행하고 있다. 이에 대해 김 소장은 “AI신약 개발은 마라톤처럼 묵묵히 가야 하는 분야”라며 “당장의 성과에 매달리지 않는 비영리 기구로서 목암연구소의 가치와 부합했다. 대신 파격적인 연구 지원을 약속받았다”고 답했다.목암연구소는 세계 최초로 신증후군 출혈열 백신을, 세계 두 번째로 수두 백신과 4가 독감 백신 등을 개발했다. 김 소장 영입을 계기로 바이오AI연구소로 새로 태어나기 위해 기존 60~70명의 연구원을 외부로 재배치했다. 대신 생물정보학 분야 연구원을 새로 영입했다. 신진우KAIST교수, 강재우 고려대 교수 등 외부 전문가 그룹과도 협업 중이다.김 소장은 “내년 50억원, 내후년 100억원가량 투자해 연구 인력을 30~40명으로 늘리고, 각 분야 전문가들과 꾸준히 협업해 목암연구소를 산업계와 학계,AI와 신약 개발을 잇는 연구 산실로 만들겠다”고 포부를 밝혔다."
2022-07-12,'감기 조심하세요' 판매 1위 판피린도 10월부터 12.5% 인상,"물가 상승세가 뚜렷한 가운데 감기약 판매 1위 제품인 '판피린'의 가격 인상이 예고됐다.12일 제약업계에 따르면 동아제약은 10월 1일자로 마시는 감기약 판피린의 약국 공급가를 12.5% 인상한다.판피린 광고. 동아제약 사이트2017년 9월 이후 5년 2개월 만인 이번 가격 인상에 대해 동아제약 측은 ""약국과 소비자들을 고려해 가격 인상을 최대한 늦춰왔지만, 원재료 및 인건비 등 지속해서 비용이 상승해 불가피하게 가격 인상을 결정하게 됐다""고 밝혔다.이에 따라 시중 약국의 판매가도 인상될 것으로 보인다. 현재 약국에서는  판피린(20㎖) 5병이 들어간 박스 상품을 약 2500원∼3000원에 판매한다.'감기 조심하세요'라는 광고로 친숙한 판피린은 1961년 출시된 감기약이다. 의약품 시장조사 기관 아이큐비아의 감기약 부문 판매액 기준으로 2011년부터 2020년까지 10년 연속 판매 1위를 기록하고 있다.판피린은 현재 약국용 액상 제형과 편의점용 알약 제형 등 두 가지 종류다. 이번 가격 인상은 약국에 공급하는 판피린이 대상으로, 편의점용 알약의 공급가 역시 동일한 시기에 비슷한 수준으로 인상할 계획이다.올해 들어 일양약품의 '원비디',일동제약의 '아로나민씨플러스',GC녹십자의 파스 '제놀쿨' 등의 약국 공급가가 일제히 올랐다. 광동제약도 대표 제품인 '쌍화탕'의 가격 인상을 검토 중이다."
2022-06-28,"엔데믹의 두 얼굴...백기 든 셀트리온, 백신 내는 SK바사","SK바이오사이언스 연구원이 코로나19 백신 개발을 위해 연구를 진행하고 있다. [사진SK바이오사이언스]코로나19의 풍토병화로 국내 제약·바이오 기업이 잇따라 백신·치료제 개발 중단을 발표한 가운데 한쪽에서는 백신 출시가 초읽기에 들어갔다. 업계 전문가들은 코로나19 백신·치료제 개발에는 양면성이 있다며 ‘묻지마 투자’와 ‘주가 띄우기’에 따른 시장 교란을 경계해야 한다고 지적한다.28일 셀트리온은 개발 중이던 코로나19 흡입형 칵테일 항체치료제의 임상시험을 중단한다고 밝혔다. 흡입형 칵테일 항체치료제는 코로나19 항체치료제인 흡입형 렉키로나(CT-P66)에 일부 국가에서 오미크론 변이에 효과를 보인 치료제 후보물질CT-P63을 추가한 제품이다. 셀트리온은 일부 국가에서 이 제품의 글로벌 임상 3상 계획을 승인받았지만 이를 진행하지 않기로 했다.셀트리온 관계자는 “오미크론 변이의 전 세계 확산과 백신 처방 확대로 코로나 바이러스의 풍토병 전환이 급속도로 진행되고 있다”며 “글로벌 규제기관이 요구하는 임상 3상 환자 규모도 예상보다 커져 사업 타당성이 미미할 것으로 판단했다”고 말했다. 규제기관들이 긴급승인 같은 패스트트랙 절차를 지양하면서 임상 환경이 까다로워졌다는 게 회사 측 설명이다.━“엔데믹 전환으로 임상 환경 까다로워져”인천시에 있는 셀트리온 사옥. [사진 셀트리온]코로나19 사태가 엔데믹(감염병의 풍토병화) 상황으로 접어들면서 백신·치료제 개발을 중단하는 사례가 이어지고 있다. 주요 원인으로는 시장성 저하, 임상 대상 모집의 어려움, 임상 환경 변화 등이 꼽힌다.제넥신과HK이노엔은 각각 올 3월, 5월 코로나19 백신 개발 중단을 발표했다. 제넥신은 백신 후보물질GX-19N의 인도네시아 임상 2·3상 계획과 아르헨티나 부스터샷(추가접종) 개발용 임상 신청을 철회하며 “세계가 ‘위드 코로나’ 체제로 돌입하면서 백신의 긴급사용승인 필요성이 낮아진 데다 3차 접종이 시행되면서 부스터샷 백신 수요가 줄었다”고 배경을 밝혔다.━SK바사, 백신 출시 초읽기 들어가지난해 7월 식품의약품안전처로부터 코로나19 백신 개발을 위한 임상 1상 승인을 받은HK이노엔 역시 “국내 성인 대다수가 백신 접종을 완료해 면역력을 확보한 데다 엔데믹 전환 등 외부 환경이 크게 변해 개발을 중단했다”고 설명했다. 치료제 부문에서도 일양약품·GC녹십자·부광약품 등이 개발을 멈췄으며, 큐리언트는 중증환자가 줄면서 임상 대상자 모집이 어려워졌다는 이유로 남아프리카공화국에서의 임상 2상을 자진 중단했다.그래픽=전유진yuki@joongang.co.kr반면, 개발을 이어가고 있는 기업들도 있다. 현재 식약처의 승인을 받아 백신과 치료제를 임상 시험 중인 기업은 각각 7곳, 19곳이다. 이 중SK바이오사이언스(SK바사)의 코로나19 백신 스카이코비원이 품목허가를 앞두고 있다. 27일 식약처는 중앙약사심의위원회가 스카이코비원의 안전성과 효과성 등을 논의한 결과 품목허가 할 수 있다는 의견을 받았다고 밝혔다. 마지막 단계인 식약처 최종점검위원회의 허가를 받으면 하반기 ‘국산 1호’ 코로나19 백신으로 출시될 전망이다.━“체력 쌓은 것”vs“시장 교란 우려”안재용SK바사 대표는 지난 3월 기업공개(IPO) 1주년 기념 간담회에서 “아직 전 세계 인구의 36% 정도는 코로나19 백신 1차 접종도 하지 못했다”며 엔데믹 상황에서도 경쟁력이 있다고 자신감을 보였다. 코로나19 치료제를 개발 중인 한 바이오 기업 임원 역시 “시장 분위기가 수그러들어 고민이지만 엔데믹으로 전환을 위해서는 국산 치료제 개발이 필요하다고 생각한다”고 개발 완주 의지를 밝혔다.이승규 한국바이오협회 부회장은 “팬데믹 초기 백신 플랫폼이나 기본 기술이 전무한 상태에서 도전과 경험을 통해 정부와 민간이 해야 할 일을 인지하게 된 것은 긍정적이다. 튼튼한 체력을 쌓은 것”이라면서도 “묻지마 투자가 시장에 부정적 영향을 줄 수 있어 기업들도 주가에 부화뇌동하지 말고 도덕성을 강화해야 한다”고 말했다."
2022-06-08,근육통에 붙이던 파스도 오른다…비타민 등 10% 가격 인상,"일동제약은 아로나민씨플러스의 공급가를 10% 인상하기로 했다. 사진=일동제약 홈페이지 캡처비타민과 파스 등 대중적으로 쓰이는 일반의약품의 가격이 대거 인상된다.8일 제약업계에 따르면, 일동제약은 비타민 아로나민 시리즈 중 하나인 '아로나민씨플러스'의 공급가를 10% 인상하기로 했다.원자재 가격 인상과 유통 비용 증가 등 전반적인 원가가 상승한 데 따른 조치로, 올 3분기 중 적용될 예정이다. 아로나민씨플러스 기준으로 10년 만의 가격 인상이다.이에 따라 약국에서 판매되는 가격도 오를 전망이다. 약국은 약사가 일반의약품 가격을 자율적으로 결정해 판매할 수 있는 곳이어서, 소비자가 약국에서 지불하는 일반의약품 가격은 약국별로 다르다.GC녹십자는 파스 '제놀쿨'의 공급가를 10% 가량 인상하기로 했다. 사진=GC녹십자GC녹십자는 관절통 등에 쓰는 파스인 '제놀쿨'의 공급가를 10% 가량 올린다. 인상 시기는 7∼8월께가 유력하지만시점이 아직 확정되지는 않았다.이밖에 광동제약도 한방 원료 등 원가 상승에 따라 대표 제품인 마시는 일반의약품 '쌍화탕'의 가격 인상을 검토 중이다.지난달에는 일양약품이 마시는 자양강장제 '원비디'의 가격을 큰 폭으로 올렸다."
2022-01-28,‘대한민국 브랜드 명예의 전당’ 56개 브랜드 수상,"대한민국 브랜드 명예의 전당산업정책연구원(IPS)이 주최하고 산업통상자원부, 중앙일보가 공동후원하는 ‘2022 대한민국 브랜드 명예의 전당’에서 삼성전자,LG전자, 신한카드, 신한은행, 현대자동차,KT,하나은행,SK증권, 에쓰-오일, 넷플릭스,KT&;G,투썸플레이스, 오비맥주,GC녹십자, 동국제약 등 총 48개 기업(기관) 56개 브랜드가 수상했다. 전체 수상 브랜드는 다음과 같다.‘2022 대한민국 브랜드 명예의 전당’ 선정 브랜드"
2024-11-29,11월30일 인사,⊙ 행정안전부 ◇과장급 <전보> △지능정부기반과장 심진홍 △사회재난정책〃 정승진 △〃전략지원〃 배상원 △농축산해양재난대응〃 이선무 △행정한류담당관 이정석 △정부청사관리본부 서울청사관리소 관리과장 서현덕⊙ 통계청 ◇국장급 <전보> △통계교육원장 김보경⊙ 특허청 ◇일반직 고위공무원 <전보> △국제지식재산연수원장 허재우⊙ 우정사업본부 <승진> ◇부이사관 △예금사업단 예금대체투자과장 최충봉 ◇과학기술서기관 △경영기획실 노사협력담당관실 최홍성 △디지털혁신담당관실 김기영 △우정사업조달센터 건축설계과장 변상우 △전북지방우정청 우정사업국 우정계획〃 송승룡 ◇서기관 △우편사업단 물류기획과 진연희 △〃 우편사업과 김용환 △예금사업단 금융총괄과 이규성 △〃 예금증권운용과 이맹호 △준법감시담당관실 홍명환 △운영지원과 김명옥 <과장> △서울지방우정청 우정사업국 우편물류 최선희 △〃 동서울우편집중국 물류총괄1 이유경 △경인지방우정청 우정사업국 우정계획 이옥수 △〃 화성동탄우체국 우편물류 박서현 △충청지방우정청 우정사업국 우편물류 박미자 △전남〃 〃 우정계획 박래진 △강원〃 〃 〃 이철⊙ 한국기자협회 <승진> △편집국장 김고은 <전보> △편집국 선임기자 김성후⊙ 헤럴드 ◇헤럴드경제 편집국 <에디터> △신문제작부문 산업 박세환 △〃 정치국제 조용직 △〃 사회문화 신상윤 △뉴스콘텐츠부문 부문장 겸 금융부장 권남근 △〃 문화부 선임기자 조범자 <부장> △뉴스콘텐츠부문 산업 한석희 △〃 사회 겸 전국 정순식 △〃 정책 한희라 △〃 건설부동산 성연진 △〃 국제 천예선 ◇코리아헤럴드 편집국 △뉴콘텐츠부 총괄에디터 이선영 △뉴콘텐츠부장 최희석⊙ 일간스포츠 △경제산업부장 이현아⊙ 딜사이트미디어 <승진> 딜사이트 △편집국장 이진철 △금융증권부 부국장 안경주 △〃 금융팀 차장 주명호 △정보서비스본부 정보서비스1부 차장 박수희 <보임> △논설위원실장 박종인 △온라인총괄 겸 디지털테크부 부국장 김진욱 △산업1부장 직무대행 김민기 △〃2〃 〃 이성희 딜사이트경제티브이 <승진> △대표이사 겸 보도본부장 이규창 △산업부 부국장 이호정 △증권부장 김동호 <보임> △금융부 부국장 임지수⊙ 아이엠(iM)증권 ◇센터장 <보임> △강남WM정재훈 △여의도〃 이영우 △서울금융 주은화 <전보> △대구WM박보현 △부산〃 최준호 △부산중앙〃 김성건 △창원〃 이현석 ◇부서장 <전보> △Wholesale금융상품부장 전병길⊙ 삼성전자 ◇DX부문 <승진> △부사장 김기환 김연정 김윤호 김지윤 김창태 김형재 노경래 박정미 박정호 부민혁 서정아 송방영 양익준 양준철 이귀호 이대성 이상직 장소연 정승목 지혜령 최병희 함선규 홍주선 △상무 강종호 김동수 김두현 김상준 김상하 김성현 김성훈 김영상 김원겸 김의송 김지훈 김진만 김진철 김창수 김철회 류철우 류호열 문태화 박명훈 박상욱 박승일 박정일 박혜린 서재홍 석지원 성종훈 송승호 송정은 신무섭 신재영 엄훈섭 예장희 옥신우 윤원재 이두환 이문근 이병국 이상빈 이선교 이선일 이지연 이태선 이형철 인우성 임수현 장용일 장윤형 정택정 정희범 조성욱 차지호 채수연 최종구 최준일 최중훈 하지훈 한기욱 한상원 함민기 홍재석 홍정우Sitthichoke(시티촉) <선임> △Master최지환 ◇DS부문 <승진> △부사장 강희성 권오겸 권혁준 김용성 김종훈 김준석 박재성 배승준 유상민 이상현 이화성 임성수 △상무 고상도 고종현 권민호 권영호 김길섭 김도형 김우일 김재현 김형수 남인호 노대용 문광진 박일한 박재헌 백상훈 심재황 안덕민 윤창빈 은형래 이경우 이인학 이창수 임경욱 임지운 전중원 조영민 조원희 채교석 최종성 홍창표 <선임> △Master김병성 김비오 김선호 김영식 김정길 박미라 박재현 박정헌 이기준⊙ 케이티(KT) <승진> △전무 김병균 유용규 이원준 이종식 정재욱 △상무 권갑석 김유태 박세근 박철호 박태호 방대혁 손정엽 송영태 송창석 신영운 오성민 윤영균 이경채 이정수 이진권 임혜진 정찬호 지승훈 지영근 최영 최광철 최동렬 함형민 △상무보 김거종 김민석 김선욱 김수용 김종혁 김종훈 김준래 김형호 노민수 노승민 문경필 문종문 민경원 박민우 박창우 배신규 서건웅 서현수 성병곤 손창화 송민상 신관식 신훈식 윤용호 윤진아 이규정 이민석 이영관 이재만 이종섭 이형욱 임지희 장대성 전관용 전승배 정다운 정민철 정윤필 최광섭 형준희 ◇그룹사 <승진> △전무 박성열 조일 △상무 나도현 서대석 박복이 박현배 배한철 한수경⊙ 지시(GC)녹십자홀딩스 <대표이사 내정> △GC케어 겸 유비케어 김진태 △GC녹십자MS김연근 △GCCell원성용 △GCCL조관구 <승진> △GC녹십자EM대표이사 박충권 △GC경영관리본부장 허진성 <선임> △GC경영관리본부 기획조정담당 노형주 △〃DT추진실장 박정민 △〃 총무비서〃 이상수 ◇GC녹십자 △국내영업부문PC본부장 유성곤 △생산〃 음성공장장 김문배 △R&D〃MSAT본부장 차경일 △QM실QAUnit장 박천보 △GC녹십자MS글로벌사업본부장 양윤정 △GC녹십자EMFM사업〃 안종근 △〃 건설〃 이학준⊙ 삼성바이오에피스 <승진> △상무 강대성 길지훈 봉기태⊙ 삼성바이오로직스 <승진> △부사장 케빈 샤프 △상무 유성철 송인섭 이태희 황인찬 송영석⊙ 금호건설·금호익스프레스·KG◇금호건설 △전무 양기승 △상무 고중길 김찬식 김태우 용현철 이경만 이현수 △상무대우 강대식 김창영 백승표 이재열 ◇금호익스프레스 △상무 홍대영 ◇KG△상무 윤영돈⊙ 태영건설 <승진> ◇상무 △현장관리본부장 박상준 ◇상무보 △안전보건실장 심현황 <보임> △기술영업본부장 임태종⊙DB제조서비스그룹 <선임>DBINC△상무 김한상DB하이텍 △상무 심재환⊙ 태광그룹 <승진> 태광산업 ◇부사장 △지원본부장 오용근 ◇상무 △기획실장 황태영 △아라미드공장장 성정훈 ◇상무보 △설비관리실장 김세윤 △재무담당 임정교 △홍보부장 김정식 티시스 ◇사장 △대표이사 유태호 ◇전무 △IT사업본부장 이재석 흥국생명 ◇상무 △영업지원실장 조학래 △리스크관리〃 신봉열 흥국화재 ◇상무보 △전략영업본부장 허재필 흥국자산운용 ◇상무보 △준법감시실장 김상태 예가람저축은행 ◇상무보 △기업금융본부장 이정환HK금융파트너스 ◇상무보 △영업본부장 오완섭 티알엔 ◇상무보 △TV사업부장 노석⊙ 동국제강그룹 <선임> 동국홀딩스 ◇전무 △전략실장 신용준 동국제강 ◇전무 △기획실장 곽진수 ◇이사 △지원실장 이현희 △마케팅〃 박언수 △포항공장 생산담당 정영봉 △당진〃 관리〃 최채원 <승진> ◇사장 △대표이사 최삼영 ◇전무 △인천공장장 이찬희 <보직변경> ◇상무 △봉강영업담당 권오윤 △포항공장장 김상재 △당진〃 박병규 ◇이사 △형강영업담당 이윤노 △당진공장 생산담당 조종원 동국씨엠 <선임> ◇전무 △구매실장 겸 동국제강 구매실장 장선익 ◇이사 △기술연구소장 최우찬 <아주스틸PMI추진단> △영업담당 안상우 △생산〃 김현철 △기획〃 박남수 △지원〃 권영주 <승진> ◇사장 △대표이사 박상훈 △아주스틸PMI추진단장 이현식 ◇전무 △기획실장 김도연 ◇상무 △부산공장 생산담당 남돈우 <보직변경> ◇상무 △부산공장장 정수환 ◇이사 △구매실 구매담당 겸 지원실장 김한기 △영업실장 김진영 인터지스 <선임> ◇이사 △P&L사업본부 운영담당 박경국 <보직변경> ◇상무 △P&L사업본부장 정광식 △유통물류〃 정태현 ◇이사 △P&L사업본부 영업담당 김동훈 △물류운영본부장 강기형 동국시스템즈 <보직변경> ◇이사 △경영지원본부장 겸 그룹지원본부장 하귀훈⊙ 유니드 <승진> ◇전무 △CA사업부장 유세영 ◇상무 △중국법인 부총재 이태영 <선임> ◇상무보 △울산공장장 배용상 <전보> ◇부사장 △생산기술 부문CTO김상배 ◇전무 △중국법인 법인장 조경득 유니드글로벌상사 <승진> ◇부사장 △사업본부 본부장 이희현⊙ 넥센타이어 <승진> △사장 김현석 ◇비즈니스 그룹장 △글로벌영업 김대중 △〃생산 김철준 △중앙연구소 김종명 △경영지원 구본형 △비즈니스 부문장 김영두 조제현 이성필 김형진 장홍주 허성필
