date,title,content
2023-05-04,"'폭락 직전 매도' 김익래 다우키움그룹 회장 사퇴…""605억 사회환원""","SG(소시에테제네랄) 증권 창구를 통해 나온 매물 폭탄으로 대규모 주가 하락 사태 직전 주식을 매도한 의혹을 받는 김익래(73) 다우키움그룹 회장이 4일 전격 사퇴했다. 다우데이타 주식을 매각해 얻은 차익도 사회에 환원하겠다고 했다.김 회장은 이날 여의도 키움증권 사옥에서 대국민 사과 기자회견을 열고 이번 사태에 연루된 데 대한 책임을 지고 그룹 회장과 키움증권 이사회 의장에서 물러나겠다고 밝혔다. 그는 “높은 도덕적 책임이 요구되는 기업인으로서, 한 그룹의 회장으로서 사회적 물의를 일으킨 점 머리 숙여 사과드린다""고 말했다.김익래 다우키움그룹 회장이 4일 오후 서울 여의도 키움증권 본사에서 최근 발생한 외국계 증권사 소시에테제네랄(SG)증권발 주가 폭락 사태와 관련해 기자회견하며 고개 숙이고 있다. 연합뉴스김 회장은 여러 차례 고개를 숙이면서도 법적인 책임에 대해서는 부인했다. 그는 ""최근 주식 매각에 대해 제기된 악의적인 주장에 대해 객관적인 자료로 소명하고자 했으나 논란은 여전히 계속되고 있다""며 ""지금과 같은 상황은 주주와 이해관계자를 포함한 모든 국민 여러분께 부담을 드리는 일이라 생각한다""고 말했다. 그러면서 ""매도 과정에 법적인 문제가 없었다 하더라도 이번 사태로 모든 분께 상실감을 드린 것에 대해 책임을 통감하고 사퇴를 결심하게 됐다""고 설명했다.김 회장은 다우데이타 주식 140만주를 매각해 얻은 605억원은 사회에 환원하겠다고도 했다. 김 회장은 ""향후 금융당국과 수사기관의 조사에 숨김과 보탬 없이 적극적이고 성실한 자세로 임하겠다""고 말했다.김 회장의 이번 사퇴는 대형 증권사 오너로서 이번 사태에 연루된 것만으로도 그룹 차원으로 문제가 퍼질 수 있기 때문에 결단을 내린 것으로 풀이된다.김익래 다우키움 회장이 4일 오후 서울 영등포구 여의도 키움증권 본사에서 대국민 사과 기자회견을 하고 있다. 김 회장은 다우키움그룹 회장직과 키움증권 등기이사장직에서 사퇴하고 다우데이타 주식 140만주를 매각해 현금화한 605억원은 사회에 전액 환원하기로 한다고 밝혔다. 뉴스1앞서 외국계 증권사SG증권 창구에서 지난달 24일부터 대규모 매도 물량이 쏟아져 김 회장이 최대주주로 있는 다우데이타를 포함한 8개 종목 주가가 연일 폭락했다. 이번 사태의 핵심 인물로 지목되는 라덕연 R&K홀딩스 대표는 폭락 2거래일 전 다우데이타 주식 140만주를 시간외매매로 처분한 김 회장을 배후로 지목하고 있다. 상속 문제로 주가 상승이 달갑지 않은 김 회장 측이 라 대표의 매수 목적을 알고, 일부러 주가를 하락시켜 반대매매를 유도했다는 게 라 대표의 주장이다.이에 대해 키움증권 고위 관계자는 기자 회견 이후 중앙일보 취재진과 만나 ""이미 김 회장의 아들이 2년 전 지배구조의 정점에 최대 주주가 됐다""며 ""라 대표는 일반적으로 최대주주가 주가가 내려갔을 때 상속하는 게 세금 측면에서 유리하다는 일반적인 내용으로 호도하고 있다""고 반박했다. 피해자 보상과 관련해서 검토되는 부분이 있느냐는 질의에 이 관계자는 ""범죄자가 보상해야 한다""며 선을 그었다.벤처 1세대 김 회장은 한국IBM에서 직장생활을 시작해 1986년 다우기술을 창업했다. 이후 1992년 다우데이터, 1997년 다우엑실리콘, 1999년 다우인터넷 등을 설립하며 정보통신업을 확대했다. 본격적으로 금융업에 진출한 건 2000년 키움닷컴증권을 인수하면서다.다우키움그룹 지배구조는 오너일가가 지분을 보유한 이머니를 주축으로 ‘다우데이타→다우기술→키움증권’ 등으로 이어진다. 김 회장은 지난 2021년 다우데이터 지분 200만주를 자녀에게 증여하는 등 경영권 승계를 준비하고 있었다."
2024-06-23,"내 번호 어떻게 알았지? ""고수익 보장"" 이런 문자 급증한 이유[팩플]","IT회사 직원 손모(37)씨는 최근 하루에도 8~10건씩 날아오는 스팸 문자에 스트레스를 받고 있다. 고수익을 보장하겠다며 주식 클럽에 가입하라는 내용부터 범칙금이 처리되지 않았다거나 수십만원의 해외 결제가 이뤄졌다는 스미싱(휴대전화 문자메시지를 이용한 피싱)까지 종류도 다양하다. 손 씨는 스팸 차단을 해도 번호만 바꿔서 계속 날아온다고 토로했다. 그는 “010으로 시작하는 휴대전화 번호로 문자가 오면 업무랑 관련이 있을까 매번 확인하게 된다”며 “웹사이트에 잘 가입하지도 않았는데 최근 들어 유독 스팸 문자가 크게 늘었다”고 말했다.참여연대 민생희망본부 회원들이 20일 오후 서울지방경찰청 앞에서 기자회견을 열고 최근 홍수처럼 쏟아지는 스팸문자 사태의 주요행위자인 '성명불상자'를 대상으로 경찰과 방송통신위원회에 각각 개인정보보호법 위반 및 정보통신망 보호법 위반 혐의가 없는지 수사의뢰하고 있다. 뉴스1무슨 일이야최근 스팸 문자가 급증했다. 23일 더불어민주당 황정아 의원이 방송통신위원회로부터 제출받은 ‘휴대전화 스팸신고 및 탐지 현황’ 자료에 따르면 올해 1~5월 월평균 휴대전화 스팸 건수는 3372만건에 달한다. 이는 지난해 월평균 건수(2462만건)보다 36.9% 늘어난 수준이다. 이달 들어서는 증가 폭이 더 커졌다. 한국인터넷진흥원(KISA)에 따르면 이달 1~17일 스팸 신고 건수는 2796만건으로 지난달 같은 기간(1988만건)보다 40.6% 증가했다.김영옥 기자스팸 문자 유통 구조는스팸 문자는 대부분(지난해 하반기 기준 97.9%) 대량 문자 발송서비스를 통해 유통된다. 국내 발송이 81.2%, 해외 발송이 16.7%다. 국내 대량 문자는 통상 3단계 경로로 발송된다. 대량 문자를 발송하려는 사업자나 개인이 문자재판매사(1178개사)에 이를 의뢰하고, 문자재판매사가 문자중계사에 넘기는 식이다.KT와LG유플러스는 이동통신사이자 문자중계사를 겸한다. 문자중계사는 이들 외에도SK브로드밴드, 다우기술, 인포뱅크 등 총 10개 사업자가 있다.김영옥 기자여기서 대량 문자를 발송하는 주체는 주로 문자재판매사다. 이들이 문자 발송 시스템으로 대량 발송을 수행하고, 문자중계사는 사후적으로 문제가 됐을 때 이들에게 페널티를 주거나 계약을 해지하는 관리 역할을 한다. 문자중계사는 문자재판매사에 대한 관리·감독 의무가 있지만, 그렇다고 문자재판매사가 발송하는 문자 내용과 이용자 동의 여부를 일일이 확인해 불법 스팸을 차단하지는 못한다. 통신비밀보호법에 저촉될 수 있어서다.한국인터넷진흥원왜 최근 유독 늘었나KISA는 일부 문자재판매사의 문자 발송 시스템이 해킹된 게 아닌지 살펴보고 있다. 불법 스팸 급증의 원인이 될 수 있어서다. 특히 문자재판매사 상당수가 특정 문자 발송 시스템을 같이 쓰고 있어 피해 규모를 키웠을 가능성도 있다. 정원기KISA디지털이용자보호단장은 “해킹에 의해 스팸 발송되는 사례는 처음은 아니지만, 최근 들어서는 그 규모가 커진 것으로 추정하고 있다”며 “문자재판매사들이 특정 문자 발송 시스템을 많이 쓰고 있어 피해를 키웠을 가능성도 있다”고 말했다.이런 상황을 인지한 방통위는KISA와 함께 20일부터 긴급 현장 조사에 나섰다. 불법 스팸 문자 발송률이 높은 문자중계사와 문자재판매사의 법적 의무 위반 여부를 조사하기 위해서다. 현장 조사 과정에서 불법 스팸 발송이 확인되거나, 이를 방조하거나 필요한 조처를 다 하지 않은 경우 정보통신망법에 따라 과태료 처분하거나 경찰에 고발할 예정이다. 또 문자 발송 시스템 해킹, 발신 번호 거짓 표시, 개인정보 침해 등 추가 피해가 확인될 경우 관계 기관과 공동 대처할 계획이다.근본적 대책은 없나불법 스팸 예시. 방송통신위원회정부도 불법 스팸을 차단하기 위해 대책을 강화하고, 업계도 자정 노력을 기울이고 있다. 방통위는 이달부터 문자재판매사의 전송 자격을 강화하는 ‘대량문자 발송 사업자 자격인증제’를 시행한다. 또 다수·중복 신고된 문자 스팸의 발신번호는 블랙리스트로 설정해 차단하기로 했다. 통신 업계에서도 스팸에 자주 활용되는 키워드가 들어간 문자 발송을 제한하는 조치 등을 취하고 있다.하지만 해킹이나 국외 전송, 번호 변작(070을 010으로 조작), 대포폰 발송 등 불법적인 스팸 발송 경로를 모두 차단하기는 역부족이다. 때문에 수신자가 스팸 문자를 차단하는 방식을 ‘네거티브’ 방식에서 ‘포지티브’ 방식으로 강화할 필요가 있다는 의견도 나온다. 수신자가 거부한 스팸 문자만 받지 않도록 하는 게 아니라 동의한 광고성 문자만 받도록 하자는 것이다. 김명주 서울여대 정보보호학과 교수는 “수신자가 동의한 문자만 받도록 정부 정책을 강화할 필요가 있다”며 “대량 문자 발송자가 광고성 문자 수신에 동의를 받을 때 이용자의 개인 정보가 어디로 넘어가는 지도 구체적으로 명시하도록 해야한다”고 말했다.더중앙플러스: 스팸문자 싹 거르는 법주식, 코인 리딩방 광고는 물론 대출, 도박, 택배 사칭까지. 온종일 스팸 전화와 문자가 이어집니다. 아무리 차단해도 좀비처럼 살아나는 스팸, 덜 받을 방법 없을까요. 원치 않는 전화·문자 스팸에서 해방되는 법, 팩플이 집중 분석했습니다. 자세한 내용이 궁금하시다면, 기사 링크를 복사해 주소창에 붙여넣으세요.“나 뽑아줘” 총선 좀비 문자…폰에서 이거 치면 싹 거른다https://www.joongang.co.kr/article/25235185"
2024-03-15,"영림원소프트랩, 프로젝트 업종 대상 통합정보시스템 구축전략 세미나 성료","세미나 현장사진ERP전문 기업 영림원소프트랩(대표이사 권영범, 060850)이 프로젝트 관리 시스템(ProjectManagementSystem,PMS) 업종을 위한 '통합정보시스템 구축전략' 세미나를 성황리에 마쳤다고 15일 밝혔다.이번 세미나는 경기도 광명시에 위치한 테이크호텔에서 70여명의 기업 경영정보시스템 분야 전문가들이 참석했으며, 시연 위주로 진행되어 매우 유익했다는 평을 얻었다.주요 연사로는 솔코 이정무 상무, 영림원소프트랩 심영근 상무, 다우기술 이민석 차장이 나서 각각 ▲솔리드웍스PDM(ProductDataManagement,제품정보관리) 솔루션 소개 및BOM(BillofMaterial,자재명세서) 관리방안 ▲프로젝트ERP(EnterpriseResourcePlanning,전사적 자원관리) 솔루션 소개 및 활용방안 ▲다우오피스 그룹웨어와ERP연계 사례를 발표했다.마지막 세션에서는 영림원소프트랩 심영근 상무와 솔코 이정우 상무가 ▲통합정보시스템(PDM+ERP+그룹웨어) 운영 방안에 대해 합동 발표를 하며 참석자들의 관심을 끌었다.ERP,PDM,그룹웨어를 하나의 시스템처럼 통합할 수 있으며, 이는 ▲장비 ▲설치산업 ▲IT▲서비스 ▲건설 엔지니어링 등 모든 수주 산업에 적용할 수 있다. 이렇게 새로 패키지화 한 건설엔지니어링 시스템은 업무의 유기성 및 효율성 향상 효과가 뛰어나 시장 반응이 뜨겁다는 것이 업계 의견이다.세미나 참석자 상당 수는 “자료 위주의 발표로 진행되는 일반적인 세미나와 달리 실 사례와 함께 데모 시연 위주로 전개된 부분이 유익했다”며, “직접 시스템을 살펴봄으로써 디지털 전환을 위한 실질적인 지침을 제시 받은 것 같다”고 전했다.심영근 영림원소프트랩PMS사업부 상무는 “기업의 경영정보시스템 전문가들이 시장 변화에 보다 유연하게 대응할 수 있도록 현실적인 방안을 제시하는 세미나를 기획했다”며, “하반기에는IT와 서비스 업종을 대상으로 유용한 정보를 얻어갈 수 있는 자리를 준비할 예정”이라고 전했다."
2023-07-28,"[단독]경영권 승계 불법 있었나…檢, 키움 김익래 父子 압색","소시에테제네랄(SG) 증권발 주가폭락 사태를 수사하는 서울남부지검이 다우키움그룹 경영권 승계 과정에서 불법 행위가 있었다는 정황을 포착하고 28일 김익래(73) 전 다우키움그룹 회장과 아들인 김동준 키움인베스트먼트 대표의주거지 등을 압수수색한 것으로 확인됐다.━SG사태 직전 대량 매도…시세조종 공범으론 안봐김익래 전 다우키움그룹 회장이 지난 5월4일 오후 서울 여의도 키움증권 본사에서 외국계 증권사 소시에테제네랄(SG)증권발 주가 폭락 사태와 관련해 기자회견하고 있다. 이 자리에서 김 전 회장은 주가폭락 사태에 대한 법적 책임은 없다는 점을 명확히 하면서도 주식 대량매도와 관련해 사과하고 매각대금 605억원을 사회에 환원하기로 약속했다. 연합뉴스.28일 증권가와 법조계에 따르면 금융·증권범죄합동수사부(부장 단성한) 합수1팀(팀장 이승학)은 지난 4월 이후 주가폭락 사건를 수사하면서 김 전 회장 측이경영권 승계를 준비하면서 키움증권 전략경영실을 동원해 주가를 관리하고, 이 때 내부정보 등을 이용한 정황(자본시장법 위반 혐의)을 포착했다고 한다. 이날 압수수색은 그 과정의 불법 여부를 확인하기 위한 것으로, 대상지엔 키움그룹 전략경영실 직원들의 주거지도 포함됐다.주가폭락 사태 당시 김 전 회장은 주가폭락 2거래일 전인 지난 4월 20일 시세조종 의혹 종목 중 하나인 다우데이타 지분 140만주를 처분해 605억원의 상당을 거둬들이면서 검찰 수사선상에 올랐다. 하지만 검찰은 아직 김 전 회장을 주가폭락 사태 주범으로 꼽히는 라덕연(42·구속기소) R투자자문사 대표의 자본시장법상 위반 혐의(시세조종 등)의 공범으로 보고 있지는 않다고 한다.━키움그룹 승계 과정 어땠나28일 소시에테제네랄(SG)증권발 주가 폭락 사태 관련 압수수색이 진행중인 서울 영등포구 여의도 키움증권 본사 모습. 뉴스1.그동안 진행된 키움그룹의 승계작업에선 ㈜이머니→다우데이타→다우기술→키움증권→키움인베스트먼트 등으로 이어지는 지배구조에서 ㈜이머니의 지분을 늘려온 것이 핵심으로 꼽힌다. 다우데이타의 최대 주주가 ㈜이머니(31.56%)이고, ㈜이머니의 최대 주주는 2011년부터 김 전 회장에서 장남인 김동준 대표로 바뀌었다. 지난 5월 기준 김동준 대표의 ㈜이머니 지분은 33.13%다.김 전 회장은 2020년 코로나19 팬데믹으로 주가가 하락했던 시기에도 다우데이타 주식을 ㈜이머니에 집중 매각했고, 2021년엔 다우데이타 주식 200만주를 아들인 김동준 대표에게 120만주, 딸인 김진현씨와 김진이 키움자산운용 상무에게 40만주씩 증여하기도 했다. 김 전 회장은 지난 4월 20일 140만주 매각을 통해 기존 다우데이타 지분 보유 비율을 26.66→23.01%로 더욱 줄였다. 김동준 대표는 ㈜이머니의 최대주주인 한편, 다우데이타 지분도 6.53% 직접 보유하고 있다.키움그룹이 공시대상 기업집단으로 지정된 건 2019년 5월부터인 만큼 그 이전 내부거래나 지분정리 과정에서 불법이 이뤄졌을 가능성도 제기된다. 또 지난 4월 20일 김 전 회장의 140만주 매각과 관련해 키움 측은 “2021년 자녀들에게 주식을 증여하면서 발생한 증여세 재원을 마련하기 위해 (김 전 회장이) 일부 지분을 매도한 것”이라고 설명했는데 당시 자녀들의 증여세 재원을 아버지의 지분 매각으로 마련하는 것 자체가 편법이라는 지적도 나왔었다.━김동준 대표, 라덕연 측과 인연 의혹…검찰 “압색과 무관”소시에테제네랄(SG)증권발 폭락 사태와 관련 지난 5월 검찰에 구속기소된 라덕연 R투자자문사 지난 5월1일 서울시내에서 한 언론사와 인터뷰를 하고 있다. [연합뉴스]한편 1984년생인 김동준 대표는 키움인베스트먼트와 함께 키움PE대표도 겸임하고 있다. 2009년 삼일회계법인에 입사했고, 2014년 다우기술 사업기획팀 차장, 2016년 다우기술 이사, 2017년 다우데이타 상무, 2018년 다우데이타 전무로 승진했다. 김 대표는 주가폭락 사태 초기 라덕연 대표 일당의 H투자자문사 영업이사이자 라 대표가 운영하던 E 경영컨설팅 업체 감사 김모(40)씨와 친분이 있다는 의혹이 제기됐으나, 해당 의혹과 이날 압수수색은 관련 없다는 게 검찰의 반응이다.키움증권 관계자는 “압수수색 혐의(승계 관련)와 관련해선 자세히 들은 바 없고, 다만 라덕연씨의 자본시장법 위반 혐의의 공범이라는 차원은 아닌 것으로 안다”며 “수사 중이라 자세한 입장을 밝히기는 어렵지만 성실히 수사에 임할 예정”이라고 말했다.김 전 회장 측은 주가 폭락사태 직후 법무법인 화우·지평을 선임하고 지난 5월부터는 배성범 전 법무연수원장(고검장)과 문찬석 전 광주지검장(검사장)을 변호인단에 추가해 검찰 수사에 대비해 왔다. 배 전 고검장은 금융정보분석원(FIU) 심사분석실장, 금융위원회 자본시장조사단 조사기획관으로 파견돼 근무한 뒤 서울중앙지검장을 역임했다. 문 전 검사장은 서울중앙지검 증권범죄합동수사단장과 서울남부지검 2차장검사를 거쳐 광주지검장을 지냈다."
2022-03-06,"영화 '접속'에 나온 PC통신 유니텔, 26년만에 사업 접는다","전도연 한석규 주연의 영화 '접속'의 한장면이다.1997년 영화 ‘접속’에서 배우 한석규와 전도연을 이어준PC통신 유니텔이 26년만에 역사 속으로 사라진다.6일IT업계에 따르면 유니텔은 최근 웹사이트 게시판 공지를 통해 6월 30일 서비스를 종료한다고 밝혔다.유니텔은 천리안, 하이텔, 나우누리, 넷츠고 등과 함께 1990년대PC통신 서비스를 제공한 업체 중 하나다. 인터넷이 확산되면서 2015년 6월 이후로는 국내 유일의PC통신 서비스로 남아 있었다. 유료 서비스를 주력 상품으로 내세웠지만 대형 포털 등과 경쟁에서 밀려 큰 성과를 내지 못한 것으로 전해졌다.[사진 유니텔 홈페이지 캡처]유니텔은 “웹 포털사이트로 변경해서 현재까지 고객들에게 서비스를 제공해 왔으나 부득이하게 서비스를 종료하게 됐다”며 “그동안 이용해 준 고객들에게 진심으로 감사드리며, 서비스를 지속해 제공해드리지 못해 아쉽고 죄송한 마음을 금할 수 없다. 고객들의 너그러운 양해를 부탁드린다”고 말했다.유니텔은 1996년 삼성SDS의 사업부문으로서PC통신 서비스를 시작해 2000년 독립법인이 됐다. 이해진 네이버 글로벌투자책임자(GIO)와 김범수 카카오 의장이 삼성SDS재직 시절 유니텔 사업에 몸 담기도 했던 것으로 알려져 있다. 이후 삼성SDS에 재인수된 사업부문을 제외한 채PC통신 서비스 업체로 남았다가 다우기술에 인수된 뒤 사명을 유니텔네트웍스로 바꿨고 2008년 다우기술에 흡수합병됐다.유니텔은 웹툰, 영화, 문자, 팩스, 메일알리미 등 유료 제휴서비스는 전체 서비스 종료일보다 앞서 오는 31일 종료하고 3월분 요금을 다음달 1일 청구한다고 설명했다. 영화 결제는 이달 24일 종료된다.[사진 유니텔 홈페이지 캡처]유니텔은 “그동안 고객 자료에 대한 백업 기간을 충분히 제공해 드리기 위해 최선을 다하겠다”며 “기존에 수신ㆍ발신했던 메일은PC로 백업해 다운로드받을 수 있다”고 말했다."
