date,title,content
2024-11-01,"증권사들, 삼성전자 목표주가 줄줄이 내려…“5세대 메모리 불확실”","“단기 상승 어려워”삼성 로고. 한겨레 자료사진증권사들이 삼성전자의 5세대 고대역폭메모리(HBM3E) 납품을 둘러싼 불확실성을 이유로 줄줄이 목표 주가를 내렸다. 증권사들은 단기간에 주가가 오르긴 어려울 것으로 내다봤다.1일 한국투자증권은 삼성전자의 목표 주가를 기존 9만6000원에서 8만3000원으로 내리면서 회사가 고대역폭메모리 5세대 개선 제품을 추가로 준비하겠다고 언급한 것과 관련해 “내부 인증 및 신규 샘플에 대한 고객사 인증 작업이 필요한 만큼 양산 일정이 지연되고 판매 계획이 수정될 수밖에 없을 것”이라며 “메모리에서 고대역폭메모리 판매 확장이 경쟁사보다 지연되고 파운드리 수요 회복 시점이 예상보다 늦어지면서 당분간 실적 기대감을 갖기 어려울 것으로 판단한다”라고 밝혔다.다수의 국내 증권사들이 이처럼 삼성전자에 대한 ‘매수’ 의견은 그대로 두면서도 목표 주가를 내렸다. 공통된 이유로는 주요 고객사인 엔비디아에 대한 5세대 고대역폭메모리 납품과 관련해 ‘불확실성’이 여전하다는 점을 들었다.한화투자증권은 목표 주가를 기존 9만5000원에서 9만원으로 내리면서 “영업이익 역성장의 주원인은 반도체(DS) 부문에서의 일회성 비용 반영 때문”이라면서도 이를 제외하더라도 “아쉬운 실적”이라고 했다. 그러면서 “내년 메모리 업황이 수요 성장은 둔화하는 반면 공급 성장은 올해보다 확대되면서 둔화 구간으로 진입할 것으로 예상한다. 범용 메모리 가격 상승 모멘텀이 현저히 둔화할 것으로 예상하는 만큼 고대역폭메모리 시장에서 경쟁사와의 격차 축소가 중요할 것으로 판단한다”고 덧붙였다. 이어 “12단 제품과HBM4등 차세대 제품에서 경쟁사와의 시장 진입 시점에 여전히 격차가 존재하는 만큼 낙관적 판단을 하기엔 이른 시점”이라면서 추가 하락 리스크에 대해서는 제한적이라면서도 단기간 안에 추세가 상승하기도 어렵다고 했다.전날인 31일 삼성전자의 발표를 보면, 올 3분기(7∼9월)에 매출은 79조원으로 전 분기 대비 6.8% 늘었지만 영업이익은 9조2000억원으로 시장 예상치(10조8000억원)를 밑돌았다. 특히 반도체 부문은 매출 29조2700억원, 영업이익 3조8600억원을 기록했는데, 매출은 전 분기보다 2.5% 늘긴 했지만, 영업이익이 40.2% 급감했다.신한투자증권도 목표 주가를 9만5000원에서 9만원으로 하향 조정했다. 이들은 “5세대 고대역폭메모리 8단 테스트 통과 소식은 긍정적이나 12단 공급 시점은 경쟁사 대비 지연”되고 있다며 “단기 실적 기대감은 낮아졌다. 긴 호흡으로 접근할 필요가 있다”라고 했다. 그밖에도 예상을 밑도는 피시와 모바일 업황 회복 속도, 구형 메모리 수요 둔화, 비메모리 부진 등 단기 우려를 언급하고 경쟁이 심화하는 디스플레이, 티브이·가전 시장까지 단기 실적 기대감이 축소되는 점도 주가 하향의 이유로 들었다.대신증권은 목표주가를 8만5000원으로 15% 낮추면서 “5세대 고대역폭메모리 개선 제품을 통한 공급 개시는 매우 긍정적 요인이나 향후 수주 물량 및 공급 타임라인에 대한 부분이 중요할 것으로 판단하다”라고 했다. 에 다올투자증권은 기존 11만원에서 9만3000원으로, 교보증권은 9만원으로 각각 목표 주가를 내렸다.이날 삼성전자는 전날(5만9200원)보다 0.34% 하락한 5만9000원으로 장을 시작해 오후 1시 현재는 5만8000원 후반대에서 횡보 중이다."
2022-07-20,"토스, 3000억 투자 유치…기업가치 8조5000억","알토스벤처스·굿워터·그레이하운드 등 참여“글로벌 핀테크 앱들보다 매출 총이익률 높고B2B 중심 수익모델 안정적” 투자 이유 설명비바리퍼블리카 제공핀테크 서비스 ‘토스’를 운영하는 비바리퍼블리카가 8조5000억원의 기업가치를 인정받아 3000억원 규모의 투자를 유치했다.비바리퍼블리카는 이달 중 3000억원 규모의 투자를 유치하기로 했다고 20일 밝혔다. 비바리퍼블리카에 초기부터 투자한 알토스벤처스가 1000억원을 추가로 투입하며 이번 투자를 주도했고, 굿워터·그레이하운드 등 해외 벤처캐피털과 케이디비(KDB)산업은행·광주은행·다올인베스트먼트·미래에셋증권 등 국내 기관투자자들도 참여했다. 이번 투자에서 토스는 8조5000억원의 기업가치를 인정받았다. 지난 6월 투자 유치 때 기업가치를 8조2000억원으로 인정받은 것에 견줘 평가액이 상승했다. 비바리퍼블리카 관계자는 “토스의 지난해 매출 총이익률은 70% 수준으로, 글로벌 핀테크 앱들의 매출 총이익률이 40∼50%에 그친 것에 비해 높은 편이며, 매출의 90% 이상이 은행·보험사 등과의 기업간 거래(B2B)에서 나오는 등 수익 구조가 비교적 탄탄하다고 평가받았다”고 말했다.투자은행(IB) 업계에 따르면 비바리퍼블리카는 오는 8월 4000억원 가량의 투자를 추가로 유치할 것으로 보인다. 이에 따라 비바리퍼블리카 기업 가치는 최대 9조2000억원까지 뛰어오를 전망이다. 비바리퍼블리카 관계자는 “국내외 기관투자자 수요가 많아 두 차례에 걸쳐 진행하게 됐다”며 “현재 투자 논의 중인 기관의 참여 여부가 최종 확정되면 8월 중 유치를 마무리할 것”이라고 설명했다."
2024-10-30,"검찰, 직무 정보 이용한 증권사 임직원 무더기 기소","서울중앙지검. 한겨레 자료사진직무상 알게 된 정보를 이용해 사익을 챙긴 메리츠증권 전직 임직원들이 무더기로 재판에 넘겨졌다.서울중앙지검 조세범죄조사부(부장 이진용)는 30일 메리츠증권 임직원 6명과 다올투자증권 직원 1명을 자본시장법 위반 혐의 등으로 불구속 기소했다고 30일 밝혔다.메리츠증권 팀장인 김아무개씨 등은 코스닥에 상장된 ㄱ사의 전환사채 발행 관련 정보를 알게 된 뒤 지인 명의로 법인을 세운 뒤 25억원가량의 ㄱ사 전환사채를 인수해 이자와 전환차익 등 9억9천만원가량의 이익을 얻은 혐의를 받는다. 또 가족 등의 명의로 허위 용역을 진행한 것처럼 속여 법인세 1억원을 포탈한 혐의도 받고 있다.검찰은 지난 7월에도 메리츠증권 임직원들이 직무상 알게 된 정보를 이용해 불법 대출을 알선한 범행에 대해서도 재판에 넘겼다. 전직 메리츠증권 아이비(IB)사업본부장 박아무개씨는 부동산 매각 관련 정보를 취득한 뒤 이를 매수하기 위해 부하 직원 2명에게 대출 알선을 부탁하고 그 대가로 8억5천만원을 제공한 혐의를 받는다.서울중앙지검은 “금융기관 임직원들의 불법행위에 대하여 법과 원칙에 따라 계속 엄정하게 대응하여 자본시장 신뢰회복을 위하여 계속 수사해 나갈 예정”이라고 밝혔다.*편집자주: 공소장에 담긴 피고인의 혐의는 재판을 거쳐 무죄, 혹은 유죄로 최종 판단을 받게 됩니다. 최종 확정판결 전까지 피고인은 무죄로 추정됩니다."
2023-12-06,"30조 ‘부동산 PF’ 브릿지론, 만기연장 버티기…내년에 터질라","신평사, 내년부터 본격 정리 전망고금리 길어지면 30~50% 손실5일 남산에서 바라본 서울 시내 모습. 연합뉴스국내 금융업의 ‘뇌관’으로 꼽히는 부동산 프로젝트파이낸싱(PF·피에프) 부실이 내년부터 본격적으로 정리될 것이라는 신용평가사의 전망이 나왔다. 고금리 시절이 길어지는 가운데 만기연장으로 그동안 버텨온 30조원 규모 브릿지론의 경우 많게는 절반가량이 최종 손실 처리될 거라는 추산도 나온다.이혁준 나이스신용평가 금융평가본부장은 6일 서울 여의도 페어몬트호텔에서 열린 에스앤피(S&P)와 나이스신용평가 공동 세미나(‘부채의 무게’)에서 “브릿지론에 대출을 내어 준 금융사의 손실이 불가피하다. 고금리가 길어질 경우 브릿지론의 30∼50%는 최종 손실로 이어질 것으로 본다”고 말했다.브릿지론은 부동산 개발사업 과정에서 토지 매입 등 초기 단계에 필요한 자금을 대는 대출을 말한다. 다음 단계인 본피에프와 비교해 예상 수익이 많지만 그만큼 위험도 크다. 이 본부장은 “기준금리 조기 인하와 부동산시장 회복을 전제로 브릿지론의 만기가 연장돼 왔는데 기대가 무산됐다”며 “토지 비용을 낮추지 않으면 사업성 확보가 불가능해, 브릿지론 토지의 경매·공매 압력이 커질 것”이라고 설명했다.금융당국에 따르면 올해 6월 말 기준 전체 금융권의 부동산 피에프 대출 잔액은 133조1천억원이다. 앞서 정부는 올해 4월부터 피에프 대주단 협약을 가동해 만기연장을 유도하고 있다. 다올투자증권에 따르면 지난 9월 말 기준으로 국내 전체 금융권에서 약 30조원 규모의 브릿지론이 만기연장으로 버티고 있으며, 이를 본피에프로 전환하기 위해서는 60조원 상당의 자금이 필요할 것으로 추산된다.부동산 피에프 부실은 사업성이 떨어지는 비수도권 지역이나 중·후순위 대출이 많은 업종을 중심으로 신용등급에 악영향을 주게 된다. 전체 금융업권 가운데서는 증권·캐피탈·부동산신탁·저축은행 등이 상대적으로 하방 압력이 클 것으로 나이스신용평가는 내다봤다.이날 세미나에서 김대현 에스앤피 상무는 “증권업과 저축은행의 위험이 상대적으로 크다고 판단한다”며 “대형 증권사나 은행 계열사인 증권사는 잠재적 리스크로부터 잘 대처해나갈 수 있지만 피에프 익스포저가 큰 중소형 회사는 어려움에 직면할 가능성이 있다”고 전했다. 최근 들어 피에프 관련 기업에 대한 신용등급 하향도 잇따르고 있다. 지난달 한국기업평가는 중소형 증권사인 다올투자증권과 하이투자증권의 신용등급 전망을 내려잡았고, 한국신용평가와 나이스신용평가도 엠캐피탈의 신용등급 전망을 최근 하향 조정했다.다만 부실이 한꺼번에 손실을 확정하면 전체 경제에 충격이 될 수 있는 만큼 당국이 최대한 연착륙을 유도할 것이라는 전망이다. 이 본부장은 “올해와 같은 방식(만기연장 등 위험 이연)으로 내년까지 더 끌고 갈 수 없다고 본다. 사업성이 도저히 안 나오는 사업장은 부실을 터뜨려야 한다”면서도 “사업성이 아주 낮은 사업장부터 단계적으로 터질 것이고 시간이 꽤 걸리는 작업으로 생각한다. 손실이 나올 수 있지만 경착륙으로 이어지지는 않고, 정부가 핸들링(감당)할 수 있는 수준일 것으로 본다”고 말했다."
2024-10-21,4대 금융지주 3분기도 실적 ‘햇살’ 전망…대출 늘고 밸류업 기대 ‘쑥’,"서울 시내에 설치된 현금자동입출금기(ATM) 모습. 연합뉴스주요 금융지주가 올해 3분기(7∼9월)에도 호실적을 이어갈 거란 전망이 나온다. 금리인하로 순이자이익(NIM) 감소가 불가피하지만 대출 성장이 부정적 효과를 상쇄할 것이란 전망이다. 시장에서는 밸류업(기업가치 제고) 정책에 따른 수혜 역시 이어질 거란 예상이 나온다.21일 금융정보업체 에프앤가이드를 보면, 4대 금융지주(케이비·신한·하나·우리)의 3분기 합산 지배주주순이익(연결 기준) 컨센서스(증권사 전망치)는 4조7347억원으로 지난해 3분기보다 7.1% 증가할 것으로 예상된다. 증권가에서는 1분기 주가연계증권(ELS), 2분기 부동산 프로젝트파이낸싱(PF) 사태와 같은 일회성 요인이 사라지면서 “무난한 3분기”(대신증권 7일 보고서)가 될 것으로 본다.이들 금융지주 실적은 대개 ‘은행업’ 성적표에 좌우된다. 일반적으로 금리인하기에 접어들면 은행 이익의 핵심인 순이자이익이 감소하면서 전체 실적에도 부정적 영향을 미친다. 한국은행의 기준금리 인하는 10월 들어 본격적으로 시작됐지만, 이미 한은의 금리 인하 가능성을 많게는 세 번(0.75%포인트)까지 반영한 수준으로 시장금리가 떨어져 있는 상태였다.하지만 가계부채가 7∼8월 중 큰 증가세를 보였던 데다가, 은행들이 가계부채 증가 속도를 제어하기 위해 금리 인상에 나서면서 부정적 효과를 일부 상쇄했을 거란 분석이 나온다. 최근에는 기업대출의 증가세도 눈에 띈다. 에스케이(SK)증권은 지난달 24일 보고서에서 “최근 금융당국 가계부채 관리방안 등의 영향으로 코픽스 등 대출 기준금리 하락에도 가계대출 금리가 상승하는 점은 향후 마진에 일부 긍정적 영향을 미칠 것으로 예상한다”고 전했다. 케이비금융은 오는 24일, 신한금융과 우리금융은 25일, 하나금융은 29일 차례로 3분기 실적을 발표할 예정이다.시장에서는 호실적과 함께 지난해 말부터 금융주를 크게 밀어 올렸던 밸류업 기대감도 이어지고 있다. 한국거래소가 9월 발표한 ‘코리안 밸류업 지수’에서 케이비금융과 하나금융지주가 제외됐지만 ‘전화위복’이 가능할 거란 분석도 나온다. 밸류업 지수는 발표 직후부터 시장 기대감을 충분히 반영하지 못했다는 비판을 받았고 거래소는 연내 구성종목 변경(리밸런싱)을 검토하겠다고 밝힌 상태다. 이 때문에 당초 밸류업 지수에 포함되지 않았던 것이 계속 악재로 인식되기보다는, 조기 리밸런싱에 포함되려는 기업들의 노력에 따라 호재가 될 수 있단 평가다.한국투자증권은 4일 보고서에서 “코리아 밸류업 지수는 은행 업종 관점에서는 다소 아쉬운 결과지만, 개별 은행의 주주환원과 수익성 개선 추세는 유효하다는 측면에서 부정적 효과는 제한적일 것”이라며 “연내 지수 구성종목의 조기 변경 가능성 등은 긍정적인 대목”이라고 설명했다.비은행 금융지주도 긍정적 평가가 나온다. 케이비(KB)·다올투자증권 등은 투자은행(IB) 부문 개선 등을 근거로 이달 중 한국금융지주의 목표주가를 상향 조정했다. 꾸준히 ‘밸류업 모범생’으로 꼽혀온 메리츠금융지주는 이달 들어 주가가 10만원 선으로 올라섰고 시가총액 역시 20조원을 돌파했다."
2024-09-25,9월26일 궂긴 소식,"◆ 박승일(승일희망재단 공동대표)씨 별세: 성자(승일희망재단 상임이사)명희씨 동생=25일 오전 11시 분당서울대병원. 발인 27일 오전 7시30분. (031)787-1500.◆ 윤태규씨 별세: 이득우씨 남편, 석상(신성씨앤피 대표이사) 미애 미순 선희 숭상(다올투자증권 홍보팀 이사)씨 부친, 천정근 최보근씨 장인, 이미경 이원희씨 시부=25일 낮 12시14분 태안보건의료원. 발인 27일 오전 7시. (041)671-5302.◆ 고옥순씨 별세: 기주순 동호(우리은행 기업투자금융부문 부문장) 승수 만숙 인숙 애란 수연씨 모친, 박주현 양수연씨 시모, 신동빈 박병식씨 장모=24일 오후 7시 삼성서울병원. 발인 27일 오전 5시45분. (02)3410-6915.◆ 윤순화씨 별세: 홍세열 태열씨 모친, 심인숙(한국ESG기준원장) 김은경씨 시모=24일 오전 6시43분 서울아산병원. 발인 26일 오전 8시40분. (02)3010-2000."
2024-01-24,“부동산 PF 관리 실패 증권사 경영진에 책임 묻겠다”,김주현 금융위원장(가운데)과 이복현 금융감독원장(오른쪽)이 24일 서울 여의도 금융투자협회에서 개최한 증권업계 간담회에서 국민 자산형성 지원을 위한 증권업계의 역할과 증권업계의 신뢰제고 방안 등을 논의하고 있다. 금융위 제공이복현 금융감독원장이 부동산 프로젝트파이낸싱(PF) 리스크 관리에 실패해 시장을 흔드는 증권사에는 책임을 묻겠다고 경고했다. 특히 피에프로 인한 유동성 문제가 반복적으로 발생하는 증권사를 향해서는 존폐 문제를 거론했다.김주현 금융위원회 위원장과 이복현 금융감독원장은 24일 증권사 10곳 대표이사 등과 함께 증권업계 간담회를 열었다. 간담회에서는 부동산 피에프 리스크 관리가 주로 거론됐다. 이 원장은 “증권사의 부동산 피에프 리스크가 금융시장 불안요인으로 작용하지 않도록 최고경영자(CEO)가 직접 리스크 관리에 만전을 기해달라”고 했다. 부실한 사업장은 신속하게 정리하고 관련 충당금도 충분히 쌓아달라고 재차 주문했다.일부 증권사가 어려움에 빠져 시장 전체가 흔들릴 경우에는 책임을 묻겠다고도 했다. 이 원장은 “일부 회사의 리스크 관리 실패가 금융시장에 충격 요인으로 작용할 경우에는 해당 증권사와 경영진에 엄중하고 합당한 책임을 물을 수밖에 없다”고 했다. 그러면서 “위기 때마다 반복됐던 유동성 부족 상황이 또 다시 발생하는 금융회사는 그 지속가능성에 의문을 가질 수밖에 없다”고 했다. 최근 시장에서는 다올투자증권과 에스케이(SK)증권 등이 부동산 피에프로 인해 재무안정성 문제를 겪을 가능성이 있다고 보고 있다.부동산 시행사의 자기자본비율 규제 도입 가능성도 거론했다. 이 원장은 “(기획재정부 쪽에서 20%로 얘기를 했는데) 저희와 정밀하게 협의된 건 아니다”라면서도 “방향성에 대해서는 생각이 같다”고 말했다. 이어 “20%가 아니라 오히려 100%에 가까운 정도로 자기 책임이 될 수 있는 상태에서 시행·개발하지 않는 건 바람직하지 않다고 생각한다”며 “부동산 시장 정립을 위해서 금융권에서 할 수 있는 건 강도 높게 할 것”이라고 했다.
2024-01-10,"부동산PF 정보로 500억 챙긴 증권사 임원, 검찰에 넘겨져","금융감독원 전경. 신소영 기자한 증권사의 부동산 프로젝트파이낸싱(PF) 담당 임원이 업무상 알게 된 부동산 개발 정보를 이용해 500억원가량의 이익을 올린 것으로 나타났다.금융감독원은 5개 증권사를 상대로 한 부동산 피에프 기획검사 결과를 10일 발표했다. 메리츠증권과 하이투자증권, 다올투자증권, 이베스트투자증권, 현대차증권이 검사를 받았다. 증권사는 시행사와 시공사, 대주단 사이에서 대출기관 주선을 조율하거나 직접 대출·채무보증을 취급하는 등 중간자적 역할을 한다. 이번 검사는 이 과정에서 담당 임직원이 사익을 추구했을 가능성을 염두에 둔 것이다.ㄱ증권사의 임원 ㄴ씨는 2020∼2021년 피에프 업무를 하면서 알게 된 사업장의 개발 정보를 이용해 500억원의 이익을 올린 것으로 확인됐다. ㄴ씨는 본인이 사실상 지배하고 있는 회사를 통해 시행사의 최대주주가 발행한 전환사채(CB)를 수천만원에 사들였다. 이후 시행사에 본 피에프 2천억원을 주선해준 뒤, 해당 대출금을 받아간 용역사에 전환사채를 약 500억원에 팔아넘겼다. ㄴ씨가 대출 주선을 통해 전환사채 매입 대금을 사실상 마련해준 셈이다. ㄴ씨의 행위는 자본시장법에서 금지하는 직무관련 정보 이용에 해당할 소지가 있다.ㄴ씨는 일하면서 알게 된 사업장에 개인적으로 돈을 빌려주고 이자를 받아내기도 했다. 특히 ㄱ증권사가 향후 대주단으로 참여할 것으로 확정된 사업장을 노렸다. 시행사가 ㄱ증권사에서 빌린 돈으로 ㄴ씨에게 상환할 수 있다는 계산이 선 것이다. ㄴ씨는 회사 등을 통해 시행사 여러 곳에 700억원을 개인적으로 빌려주고 이자·수수료 명목으로 총 40억원을 받아갔다. 이 중 일부는 이자제한법상 최고 금리인 연 20%를 초과한 경우였다.직접 부동산을 사들여 시세차익을 본 사례도 적발됐다. ㄷ증권사 임원 ㄹ씨는 일하다가 알게 된 부동산 임대 피에프 정보를 부동산 투자에 활용했다. 가족회사를 통해 900억원어치의 부동산을 취득해 임대했으며, 이 중 3건을 처분해 100억원 상당의 매매차익을 올렸다. 금감원은 이들 임원 등을 검찰에 통보했으며 제재 조치도 추진할 계획이라고 밝혔다."
2024-02-13,2월 14일 인사,⊙ 산업통상자원부 <전보> ◇과장급 △무역안보심사과장 오종희⊙ 고용노동부 <전보> ◇과장급 △직업건강증진팀장 신욱균 △중앙노동위원회 기획총괄과장 손성길⊙ 해양수산부 <전보> ◇국장급 △어촌양식정책관 서정호⊙ 행정중심복합도시건설청 △차장 엄정희⊙ 서울신문 △전국부장 이두걸 △신문유통팀장 신명식⊙ 아시아투데이 △편집국 사회2부 편집위원 최효극 △〃 편집총괄부장 손치배⊙ 한남대 △비서실장 황선남 △감사〃 이장순 △산학협력단장 김운중 △IPP일학습 사업〃 황철호 △캠퍼스혁신파크 사업〃 원구환⊙ 다올투자증권 <선임> △리스크심사실장 전무 이종서⊙ 마스턴투자운용 △전략기획 부문 부대표 윤자경⊙ 지시(GC)녹십자 △RED(초기연구개발)본부장 마성훈
