date,title,content
2024-08-19,착한 기업이 돈도 잘 번다…ESG 우등생 '공시 감별법',"수백쪽ESG공시 ‘핵심 포인트’경제+45.21%. 2015년 10월부터 지난해 말까지ESG(환경·사회·지배구조) 평가 등급이 우수한(AA·A) 코스피 상장기업의 누적 주가수익률이다. 같은 기간 코스피 상승률을 11%포인트 넘게 앞질렀다. 1억원을 코스피 상장사에 고루 투자했다면 약 8년 동안 3415만원을 벌 수 있었는데,ESG등급이 우수한 기업에 투자했다면 그보다 1100만원을 더 벌 수 있었다는 의미다.ESG가 연기금·기관투자가 등 ‘큰손’ 투자자의 핵심 참고 지표로 부상하면서 정부도ESG공시를 강화했다. 이제는ESG우등생을 찾아내는 게 주식 투자의 기본 방정식이 된 걸까.ESG우등생 감별법을 알아봤다.ESG우량칩 9년 수익률 코스피보다 11%P 앞서기업의ESG성과는 ‘지속가능경영보고서’의 형태로 매년 6~8월 한국거래소ESG포털이나 각사 홈페이지에 공시된다. 현재는 자율공시로 운영하지만, 내년엔 의무공시 시점의 윤곽이 나올 전망이다. 한국회계기준원은 의무공시 시행에 대비해 지난 4월 말 공시 기준 초안을 발표했고, 연내 최종 기준을 확정할 계획이다.기업은 당장 공시 부담을 호소한다.ESG뿐 아니라 지배구조·밸류업 등 새롭게 등장한 공시가 계속 늘어서다. 반대로 투자자 입장에선 이득이다. 기업이 외부에 알려야 할 게 많아진다는 건 투자자가 참고할 정보가 늘어난다는 걸 의미한다.김영희 디자이너공시가 늘어도 이용할 줄 모르면 무용지물이다. 중앙일보 머니랩은 개인투자자도 쉽게 접근할 수 있도록 ‘신생 공시 대해부’에 나섰다. 여기선ESG공시를 집중 해부해본다.ESG등급 평가기관 서스틴베스트의 방법론을 중심으로 우량기업과 비우량기업의 차이는 어디서 생기는지 살폈다. 투자자가ESG공시에서 무엇을 중점적으로 봐야 하는지도 정리했다. 단타만 칠 생각이 아니라면ESG를 고려한 투자는 장기 주가 수익률에 긍정적 결과를 안겨줄 것으로 본다.ESG등급은AA(탁월)·A(매우 우수)·BB(우수)·B(양호)·C(보통)·D(취약)·E(매우 취약) 등 총 7가지로 나뉜다. 지난해에는 총 1270곳의 상장·비상장 기업이 서스틴베스트로부터ESG평가를 받았고, 이 중 416곳(32.8%)이AA·A 등급을 받았다. 서스틴베스트는 한국ESG기준원·한국ESG연구소와 함께 국내 3대ESG평가기관으로 꼽힌다.기업이 평가받는ESG세부 항목은 총 111개(환경 36개, 사회 34개, 지배구조 41개)에 달한다. 또 개별 업종과 영위 사업에 따라 더 중요하게 평가받는 항목도 다르다. 예를 들어 자동차·자본재·에너지·소재 등 전통적인 굴뚝산업은 환경 분야 평가 가중치가 25%에 달하지만 탄소 배출량이 적은 미디어·엔터테인먼트·은행 등은 10%에 불과하다.정근영 디자이너시험에서 국영수처럼 모든 기업에 중요한 항목도 있다. 먼저 환경 분야에선 기존 제품을 친환경 제품으로 개선하고 있는지가 가장 중요하다. 식음료 기업이 플라스틱 용기 대신 종이 소재 용기를 만들어 제품을 판매하거나, 자동차 기업이 친환경 엔진을 장착한 차를 내놓는 사례가 여기에 해당한다. 일종의 ‘환경 분식(粉飾)’이라고 할 수 있는 그린워싱(Greenwashing·친환경적인 것처럼 위장하는 기업행동) 사례가 나타나는 것도 주로 이런 항목이다. 이 밖에 친환경 연구개발(R&D), 온실가스·폐기물 배출 저감 성과, 환경 사고 예방과 대응, 에너지 절감 성과 등도 가중치가 높은 항목이다.사회 분야에선 상생 취지에서 협력사 대상 사회적 기준 수립 여부, 노사 문화 우수 기업, 평균 근속연수, 고객 정보보호 전담 조직 구축, 여성 직원 수 비율 등이 중요한 평가 항목으로 꼽힌다. 잦은 노사 분규가 손익에 미치는 영향이 큰 자동차·자동차부품, 항공·운송 업종 등은 원만한 노사 관계를 유지하느냐에 높은 가중치를 둔다.지배구조 측면에선 매출액 대비 특수관계인 매출액이 가장 중요한 평가 요소다. 본래 실력보다는 관계사 등 특수관계인에 밀어내기식으로 얻은 매출이 많을수록 지배구조가 취약하다고 보는 것이다. 이사 보수 변동의 적정성, 과소배당 여부, 주주총회 공시 시기, 이사회의 사외이사 구성 현황 등도 중요한 평가 항목이다.ESG등급·가중치가 핵심…‘착한 척’ 그린워싱 주의를ESG등급이AA인 기업의 지속가능경영보고서를 찾아보면 이런 항목에서 돋보이는 실적을 공시한다.SK텔레콤(AA)의 경우, 지난해 온실가스 총배출량은 114만9240t(이산화탄소 환산량)으로 기존 목표치(122만7222t)보다 온실가스 배출량을 더 줄였다. 신한지주(AA)도ESG우등생이다. 이 회사는 10년 연속DJSI월드지수에 편입했다.김영희 디자이너반대로 가중치가 높은ESG평가 항목에서 이렇다 할 성과를 보이지 못하면 낮은 등급을 피할 수 없다. E(매우 취약)나 D(취약) 등급을 받은 기업 중엔 지속가능경영보고서 자체를 공시하지 않은 곳도 수두룩하다.ESG등급이 저조한 기업은 기관투자가의 투자 대상에서 배제될 가능성이 커, 주가 상승 기대도 낮아질 수 있다.참치로 유명한 동원수산(E)은 온실가스 관리는 물론 사회공헌 활동과 윤리 경영 등에서 저조하다는 평가를 받았다. 카시트 제조업체SG글로벌(E)은 온실가스 관리 능력이 미흡하고 근로자 안전과 보건, 관계사 거래와 윤리경영 등에서도 미흡해 최하 등급을 받았다. 이 밖에 티웨이항공 지주사인 티웨이홀딩스(D), 카지노·레저업체 파라다이스(D), 키움증권의 최대주주 다우기술(D) 등도ESG등급이 미흡했다.연기금 등 기관투자가뿐 아니라 개인도ESG우수기업에 주목해야 하는 이유는 이 기업들이 본업에서의 사업 성과도 높을 확률이 높기 때문이다. 글로벌 컨설팅업체 맥킨지가 2017년부터 5년간 글로벌 주요 기업의 매출 성장률을 조사한 결과,ESG경영 우수 기업은 연평균 6.4%를 기록해 그렇지 않은 기업보다 1.7%포인트 더 높았다.전문가들 “ESG는 대세” 올 최대 변수 ‘미국 대선’ESG투자는 코로나19가 확산한 2020년 이후 뒷걸음질쳤다. 전 세계ESG펀드 자금은 지난해 4분기에만 25억 달러(약 3조5000억원) 규모가 빠져나갔다. 러시아의 우크라이나 침공, 고금리 등 거시경제 불안과 기업의 그린워싱에 따른 신뢰성 문제가 도마 위에 오른 탓이다. 그러나 기후변화 문제가 더욱 심화하고, 기업의 사회적 책임을 중요하게 생각하는 소비자·투자자들이 늘어나면서 장기적으로는ESG투자가 대세가 될 것이란 데에는 전문가 사이에서도 이견이 없다.앞으로 지속가능경영보고서 공시가 의무화하면 액티브(Active)형ESG상장지수펀드(ETF) 투자도 활성화할 전망이다. 손서원 삼성증권 연구원은 “저탄소 구조 전환을 위한 투자 비율이 높은 종목(기업)을 선택하거나 이에 따라 투자 비중을 조절하는 액티브형ESGETF의 역할이 중요해질 수 있다”고 예상했다.ESG투자에서도 올해 눈여겨볼 사건은 미국 대선이다. 특히 도널드 트럼프 공화당 후보는 반(反)ESG성향을 드러낸다. 백영찬 상상인증권 연구원은 “트럼프 후보는 화석연료 사용 확대를 최우선 과제로 삼고 있다”며 “그가 대통령에 당선하면 온실가스 배출량이 크게 증가할 수 있고 반ESG법안 증가로ESG투자에 역풍이 불 것”이라고 전망했다.당신의 돈에 관한 모든 이야기, 투자 인사이트를 드립니다. 돈 되는 '머니 정보' 더중플에서 더 많이 확인할 수 있습니다.여기 주주되면 큰일납니다…496개 뒤졌다, 최악의 기업https://www.joongang.co.kr/article/25267165“개잡주 무빙” 오명 벗는다…한국 바이오주에 온 기회들https://www.joongang.co.kr/article/25270833100만원 '황제주' 돌아오나…미국까지 도와주는 이 업종https://www.joongang.co.kr/article/25270379한일 연금 전문가의 공통 지적…70세까진 일해라, 연금 노터치!https://www.joongang.co.kr/article/25268573트럼프 “팔지마” 해리스는 “…” 비트코인, 그래서 살까 말까https://www.joongang.co.kr/article/25267492"
2024-04-21,'큰손'도 2차전지株 부진에 눈물…국민연금 주식평가액 1.7조 증발,"올해 들어 국민연금의 주식 평가액이 지난해 말 대비 1조7000억원가량 감소한 것으로 나타났다. 2차전지 대형주의 주가가 줄줄이 하락한 영향이 컸다.지난 17일 서울 서대문구 국민연금공단 서울북부지역본부 종합상담실 모습. 뉴스121일 금융정보업체 에프앤가이드에 따르면 국민연금이 5% 이상 지분을 보유한 공시 대상 상장사는 지난 17일 기준 276개사, 주식 평가액은 총 138조6238억원으로 집계됐다. 지난해 12월 29일(282개사, 140조2793억원)과 비교해 종목 수는 6개 감소했고, 평가액은 1조6555억원(1.2%) 줄었다.코스피 2차전지 주요 종목의 주가 부진이 국민연금의 주식 평가액을 끌어내렸다. 지난해 말부터 지난 17일까지 국민연금 보유 종목 중 평가액 감소 폭 2~6위는 2차전지 종목이었다.LG에너지솔루션(-8525억원)을 비롯해POSCO홀딩스(-7290억원),LG화학(-6416억원), 포스코퓨처엠(-4744억원), 삼성SDI(-4663억원) 등이다.이들 종목에 대한 국민연금 지분율은 지난해 말 대비 현재까지 동일하다. 이들 종목의 주가 하락 폭만큼 주식 평가액이 줄어든 것이다.LG에너지솔루션 주가는 연초 이후 14.7% 떨어졌다.POSCO홀딩스는 25.7%,LG화학은 24.7%, 포스코퓨처엠은 30.6%, 삼성SDI는 18.2% 각각 내렸다.지난해 말 대비 국민연금 보유 주식 중 평가액 감소 폭이 가장 컸던 종목은NAVER다. 9956억원이 줄었다. 이 기간 국민연금 보유 지분율도 1.11%포인트 감소했다.반면 평가액이 가장 많이 증가한 종목은SK하이닉스였다. 지난해 말과 비교해 2조1399억원이 증가했다. 지분율 7.9%는 그대로 유지됐다.SK하이닉스 주가는 연초 이후 26.3% 올랐다. 삼성바이오로직스(6578억원),HMM(5065억원), 현대차(4989억원), 한미반도체(4713억원) 등의 평가액도 많이 늘었다.국민연금이 올해 1분기에 5% 이상 지분 보유 종목으로 신규 편입한 코스피 상장사는HMM,포스코인터내셔널, 엘앤에프, 다우기술, 경동나비엔, 케이씨텍, 자화전자 등이다. 코스닥 시장에선 대주전자재료, 에이비엘바이오, 엠로, 칩스앤미디어 등이 국민연금 5% 이상 지분 보유 종목에 새로 포함됐다.반면LG디스플레이, 쌍용C&E,SK가스, 이오테크닉스, 아프리카TV,심텍, 와이지엔터테인먼트 등에 대한 국민연금 지분율은 5% 미만으로 감소했다."
2023-04-27,다우키움 회장 '605억 차익' 논란…주가 폭락 직전 지분 팔았다,[사진 키움증권]SG(소시에테제네랄)증권 창구를 통한 '매물 폭탄'으로 인한 무더기 하한가 사태의 여진이 이어지는 가운데 김익래 다우키움그룹 회장의 다우데이터 보유 지분 매각이 논란이 되고 있다. 주가조작 세력 등이 가담한 하한가 사태로 다우데이터가 폭락하기 이틀 전 지분 일부를 처분해 605억원의 차익을 거뒀기 때문이다.김익래 다우키움그룹 회장. 중앙포토.27일 금융감독원 전자공시시스템에 따르면 김 회장은 지난 20일 시간외매매로 다우데이터 140만주를 주당 4만3245원에 팔았다. 이번 매각으로 김 회장은 605억원을 확보했다. 김 회장의 보유 지분은 26.66%에서 23.01%로 3.65%포인트 줄었다.시장에서 논란이 되는 건 김 회장의 지분 매도 시점이다. 다우데이터 주가는 김 회장의 주식 매각 직전(20일 종가) 4만6500만원에서 27일 1만6490원으로 65% 폭락했다. 지난 24일부터SG증권 창구를 통해 주식이 쏟아지면서 이틀 연속(24·25일) 가격제한폭까지 하락한 영향이다.김 회장은 공교롭게도 주가 폭락 직전 지분을 매각해 수익을 손에 쥘 수 있었다. 지난 20일 기준 다우데이터 주가(4만6500원)는 김 회장이 지분 매각에 나서기 1년 전(종가기준 1만4100원)보다 3.3배로 가파르게 뛰었다.시장의 이런 의혹과 관련해 다우키움그룹 측은 김 회장의 지분 매각과 무더기 하한가 사태와는 연관이 없다고 선을 그었다. 자녀 증여를 고려한 지분 매각이라는 얘기다.다우키움그룹 관계자는 “주가가 4만원대로 안정화된 상태에서 (승계작업을 고려한) 상속·증여 재원 마련을 위해 지분 일부를 매각한 것으로 알고 있다”며 “공교롭게도 매각 시기가 폭락 직전이었을 뿐 (정보를) 알고 팔았다는 시장의 억측이 당황스럽다”고 전했다.현재 다우키움그룹의 지배구조는 ‘다우데이터→다우기술→키움증권’ 등으로 이어진다. 다우데이터가 다우키움그룹의 최상단에 있는 기업이다. 김 회장은 지난 2021년 다우데이터 지분 200만주를 자녀에게 증여했다.
2023-09-05,"“김익래 벌금형 받아도, 키움증권 경영권엔 문제없다”","키움증권의 경영권에 시장의 관심이 쏠리고 있다. 소시에테제네랄(SG) 증권발 주가 폭락 사태 관련 수사를 받는 김익래 전 다우키움그룹 회장의 수사 결과에 따라 키움증권의 ‘최대주주 적격성’ 문제가 불거질 우려 때문이다. 시장에는 김 전 회장이 벌금형 이상을 받을 경우 관련법에 따라 의결권이 제한돼 경영권이 흔들리고, 최악의 경우 키움증권 매각으로 이어질 수 있다는 소문까지 돌았다.금융감독원도 내부 검토에 나선 것으로 확인됐다. 금감원 고위 관계자는 “해당 조사와 처분이 키움증권의 경영권에 영향을 미치는지 내부 검토를 했다”며 “김 전 회장이 키움그룹 최대주주가 아닌 만큼 (경영권에는) 영향이 없는 것으로 실무부서에서 확인했다”고 설명했다.현행 금융회사 지배구조법에 따르면 최대주주가 최근 5년 이내에 조세범 처벌법, 공정거래법 등 금융 관련 법령 위반으로 벌금형 이상의 처벌을 받으면, 금융당국이 시정 명령을 내리거나 10% 이상 보유 주식에 대한 의결권이 최대 5년간 제한된다. 금융회사 지배구조법 32조 등에 따르면 최대주주의 자격 심사 등 대상은 최대주주 중 최다출자자 1인을 말한다. 최다출자자 1인이 법인일 경우에는, 해당 법인의 최다출자자 1인이 개인이 될 때까지 따져서 선정한다.이 기준을 적용하면 키움증권의 최대주주는 김 전 회장의 장남인 김동준 키움인베스트먼트 대표가 된다. 다우키움의 지배구조는 ㈜이머니→다우데이타→다우기술→키움증권→키움인베스트먼트다. ㈜이머니의 최다출자자 1인이 김 대표(33.13%)라서다.하지만 키움증권이 꿈꾸는 초대형 투자은행(IB) 인가 심사는 다르다. 금융회사 지배구조법과 자본시장법은 새로운 사업의 인가를 내줄 때는 최대주주가 아닌 ‘대주주 적격성’을 따지기 때문이다."
2023-09-04,"[단독] ""김익래 벌금형 받아도, 키움증권 경영권엔 문제없다"" | 대주주 적격성 팩트체크","기업 오너가 상장회사 최대 리스크가 됐다. 최근 일부 오너가 자본시장법 위반 혐의로 수사 선상에 오르며 대주주 적격성 등의 논란에 휩싸이면서다. 금융회사 지배에는 까다로운 자격이 요구되는 만큼, 향후 관련 혐의 처분에 따라 경영권이나 회사 사업이 흔들릴 수 있다는 우려도 있다. 하지만 관련법을 따져보면 이런 우려가 과도할 수 있다. 고차방정식만큼 복잡한 대주주 적격성 문제를 하나씩 풀어봤다.━①김익래 회장 ‘최대주주’ 아니라 경영권 문제는 없어〈YONHAPPHOTO-4399〉 주가 폭락 기자회견 하는 김익래 다우키움그룹 회장   (서울=연합뉴스) 김익래 다우키움그룹 회장이 4일 오후 서울 여의도 키움증권 본사에서 최근 발생한 외국계 증권사 소시에테제네랄(SG)증권발 주가 폭락 사태와 관련해 기자회견하고 있다. 2023.5.4 [연합뉴스TV제공. 재판매 및DB금지]photo@yna.co.kr/2023-05-04 19:42:58/ 〈저작권자 ⓒ 1980-2023 ㈜연합뉴스. 무단 전재 재배포 금지.〉시장의 관심이 쏠리는 건 키움증권이다. 소시에테제네랄(SG) 증권 발 주가 폭락 사태 관련 수사를 받는 김익래 전 다우키움그룹 회장의 수사 결과에 따라 키움증권의 ‘최대주주 적격성’ 문제가 불거질 우려 때문이다. 시장에는 김 전 회장이 벌금형 이상을 받을 경우 관련법에 따라 의결권이 제한돼 경영권이 흔들리고, 최악의 경우 키움증권 매각으로 이어질 수 있다는 소문까지 돌았다.이런 소문에 금융감독원도 내부 검토에 나선 것으로 확인됐다. 금감원 고위 관계자는 “해당 조사와 처분이 키움증권의 경영권에 영향을 미치는지 내부 검토를 했다”며 “김 전 회장이 키움그룹 최대주주가 아닌 만큼 (경영권에는) 영향이 없는 것으로 실무부서에서 확인했다”고 설명했다.현행 금융회사 지배구조법에 따르면 최대주주가 최근 5년 이내에 조세범 처벌법, 공정거래법 등 금융 관련 법령 위반으로 벌금형 이상의 처벌을 받으면, 금융당국이 시정 명령을 내리거나 10% 이상 보유 주식에 대한 의결권이 최대 5년간 제한된다.이때 ‘최대주주’와 ‘대주주’는 다른 개념이다. 금융회사 지배구조법 32조 등에 따르면 최대주주의 자격 심사 등 대상은 최대주주 중 최다출자자 1인을 말한다. 최다출자자 1인이 법인일 경우에는, 해당 법인의 최다출자자 1인이 개인이 될 때까지 따져서 선정한다.이 기준을 적용하면 키움증권의 최대주주는 김 전 회장의 장남인 김동준 키움인베스트먼트 대표가 된다. 다우키움의 지배구조는 ㈜이머니→다우데이타→다우기술→키움증권→키움인베스트먼트다. ㈜이머니의 최다출자자 1인이 김 대표(33.13%)라서다. 따라서 김 전 회장이 벌금형을 받아도 의결권 제한 등의 경영권 문제는 발생하지 않는다는 게 금융당국의 설명이다.━②키움증권 초대형IB인가 대주주 적격성에는 빨간불(서울=뉴스1) 유승관 기자 = 28일 소시에테제네랄(SG)증권발 주가 폭락 사태 관련 압수수색이 진행중인 서울 영등포구 여의도 키움증권 본사 모습.  서울남부지검 금융·증권범죄합동수사본부(단성한 부장검사)는 이날SG증권발 주가 폭락 사태에 연루된 의혹을 받는 김익래 전 다우키움그룹 회장을 피의자 신분으로 입건하고 키움증권 및 김 전 회장 자택 등을 동시 압수수색하고 있다고 밝혔다. 2023.7.28/뉴스1하지만 키움증권이 꿈꾸는 초대형 투자은행(IB) 인가 심사는 다르다. 금융회사 지배구조법과 자본시장법은 새로운 사업의 인가를 내줄 때는 최대주주가 아닌 ‘대주주 적격성’을 따지기 때문이다.금융회사 지배구조법 2조 6호 등에 따르면 대주주는 최대주주와 달리 특수관계인을 다 포함하는 개념이다. 금감원 측은 “김 전 회장이 회장직은 그만뒀지만, 대주주를 심사할 때는 ‘사실상 지배’ 개념까지 본다”며 “최다출자자가 김동준 대표라 해도 김 전 회장이IB인가 신청 시 심사 대상이 될 가능성이 상당히 높다”고 설명했다.━③카카오 김범수 ‘개인’이냐 ‘기관’이냐에 따라 향방 달라져김범수또 다른 오너 리스크로 골머리를 앓고 있는 곳은 카카오와 김범수 전 이사회 의장이다. 금감원은 지난달SM엔터테인먼트 주가 시세조종 혐의와 관련해 김 전 의장의 사무실 등을 압수수색했다.카카오는 인터넷은행인 카카오뱅크(카뱅)를 가지고 있어 대주주 적격성 문제는 더 민감하다. 카카오가 인터넷은행 대주주 적격성을 잃을 경우 카뱅에 대한 지배력을 잃을 수 있어서다.무엇보다 해당 사안은 김 전 회장과 키움증권과 다른 측면이 있다. 처벌을 받는 주체에 따라 결과가 달라진다. 인터넷은행 특례법에 따르면 인터넷은행 대주주(한도초과보유주주)는 ‘최근 5년 간 금융관련법령, 공정거래법, 조세범 처벌법, 특정경제범죄 가중처벌법 등을 위반해 벌금형 이상에 해당하는 형사 처벌을 받은 사실 없어야’ 한다.문제는 법제처가 2019년 카뱅 출범 당시 김범수 전 의장 ‘개인’이 대주주 적격성 심사 대상이 아니라는 해석을 내놓은 데 있다. 당시 카카오 대주주인 김 전 의장이 공정거래법 위반 혐의로 기소된 것이 문제가 되자 금융당국이 법제처에 유권해석을 요청했고, 법제처는 카카오 최대주주지만 카뱅 주식을 직접 보유하지 않은 만큼 대주주 적격성 심사 대상에서 제외된다는 취지의 유권해석을 내렸다.즉, 이번에도 주가 시세 조종 관련 처분이 김 전 의장 ‘개인’에게 내려지냐 카카오 ‘법인’에 내려 지냐에 따라 ‘대주주 적격성’ 심사 결과는 달라질 수 있다.금융당국 고위관계자는 “2019년 이후 유권해석의 변경이나 은행법 개정이 없었기 때문에 법제처 해석에 따라 이번에도 김 전 의장은 대주주 적격성 심사 대상이 아닐 것으로 보인다”고 말했다.금감원 특사경 측은 “수사 중인 사안인 만큼 해당 사건이 김 전 의장 개인인지, 카카오 법인에 대한 조사인지 밝힐 수 없다”는 입장이다.하지만 금융당국은 지난 5월 자본시장법 위반 조사를 지켜봐야 한다는 이유로 카뱅이 신청한 마이데이터 허가를 보류했다. 금융위 측 관계자도 “처벌 대상이 김 전 의장 개인이냐, 카카오 법인이냐에 따라 대주주 적격성 심사 결과가 달라질 수 있는 건 맞다”며 “금융위 입장에서는 조사나 처벌 대상이 현재로써는 누구인지 알 수 없으므로 결과를 기다리는 것”이라고 말했다.카카오가 벌금형 이상을 받아도 금융당국 판단에 따라 인터넷은행 대주주 지위를 유지할 수도 있다. 벌금형 전력이 있어도 금융당국이 ‘경미한 사안’으로 판단할 경우 예외로 인정한다는 조항이 달려 있기 때문이다."
