date,title,content
2022-10-17,204만 카카오 개미들 “오늘 증시가 두렵다”,"먹통 사태에 ‘검은 월요일’ 우려15일 오후 경기 성남시 분당구 삼평동SK판교캠퍼스에서 화재가 발생해 관계자들이 복구 작업을 위해 현장으로 들어서고 있다. 이날 오후 카카오 등 데이터 관리 시설이 입주해있는 이 건물 지하에서 불이 나면서 카카오톡, 카카오택시 등 일부서비스에 장애가 빚어지고 있다./뉴스1“월요일이 오지 않으면 좋겠습니다.”카카오에 투자한 ‘개미’들은 주말 내내 노심초사하는 모습을 보였다. 15일 오후 발생한 카카오 데이터센터 화재로 장시간 서비스가 중단되면서 카카오의 데이터 관리에 문제점이 드러났기 때문이다. 16일 카카오 투자 관련 커뮤니티와 종목 토론 게시판 등에서 개인 투자자들은 “17일 월요일 증시가 열리면 카카오 주가가 크게 떨어지는 것 아니냐” “검은 월요일이 될 것”이라는 우려가 잇따르고 있다.한 포털 사이트의 카카오 종목 토론 게시판에는 카카오 화재가 발생한 15일 오후 3시부터 다음 날 오후 3시까지 24시간 동안 8000여 개에 달하는 게시 글이 올라왔다. 통상 장이 열리지 않는 주말에는 100여 건 올라오고 평일에도 500여 건의 글이 올라오는데, 이번 주말에는 게시 글이 폭증한 것이다. “이번 주에는 주가가 또 반 토막 나겠다” “자사주 소각하랬더니 건물을 소각하면 어떻게 하냐” “쪼개기 상장만 하더니 서버는 안 쪼개고 뭐했느냐” 등 대부분 부정적인 주가 전망과 카카오에 대한 불만 섞인 내용들이었다.개미, 한 달간 카카오 1561억 순매수… 주가는 27%↓카카오 주가는 1년 넘게 수직 낙하하고 있다. 작년 6월 24일 장중 17만3000원까지 올랐던 카카오는 지난 10월 13일 4만7300원까지 내려앉았다. 올해 들어서도 반 토막이 난 상태다. 데이터 센터 화재 전날이었던 14일에는 주가가 8.67% 급등하면서 개미들의 기대감이 커졌지만, 하루 만에 기업을 휘청이게 만드는 악재를 만나게 된 것이다.최근 한 달간 카카오를 집중 매수해온 개미들에게는 화재 소식이 청천벽력 같은 악재로 받아들여졌다. 한국거래소에 따르면, 최근 1개월(9월 14일~10월 14일)간 개인 투자자들은 카카오를 1561억원어치 순매수한 것으로 집계됐다. 상장사 중에서는 네이버(8121억원), 삼성전자(4083억원)에 이어 셋째로 많은 규모다. 올해 6월말 기준 카카오 소액주주는 204만명에 달한다. 작년 말(192만명)보다 12만명가량 증가했는데, 현재는 더 늘어났을 것으로 보인다.국내 증시가 불안한 흐름을 보이는 가운데 개인들은 다른 종목을 팔더라도 카카오의 반등을 기대하며 저점 매수에 나선 것으로 풀이된다. 하지만 개인들의 매수세에도 불구하고 카카오의 하락세는 멈추지 않았다. 최근 한 달간 카카오 주가는 7만원(9월 13일 종가)에서 5만1400원으로 27% 떨어졌다.전문가들은 당분간 카카오의 주가 회복이 쉽지 않을 것으로 내다보고 있다. 최근 현대차증권(10만4000원→9만원), 이베스트투자증권(10만5000원→7만4000원), 한화투자증권(11만원→8만5000원), 다올투자증권(10만원→6만3000원),NH투자증권(11만원→7만8000원),SK증권(11만원→7만4000원) 등이 목표주가를 내렸다.동반 추락 ‘카카오 4총사’ 자사주 소각·매입 나서끝 모를 주가 급락세에 카카오를 비롯한 카카오뱅크, 카카오페이, 카카오게임즈 등 ‘카카오 4총사’들은 자사주 소각·매입 등 긴급 처방을 통해 급한 불을 꺼보겠다는 계획이다. 최근 이 4개 회사는 연일 신저가를 기록 중이다. 카카오뱅크 주가는 작년 말 5만9000원에서 이달 14일 1만7500원으로 올해 들어서만 무려 70.3% 하락했다. 같은 기간 카카오페이는 79.3%, 카카오게임즈 주가는 58% 떨어졌다.카카오는 연내 약 3000억원 규모의 자사주 소각을 진행하기로 했다. 정확한 시점 등에 대해 언급하지 않고 있지만, 3분기 실적을 발표하는 다음 달께 좀 더 구체화한 내용이 나올 거란 전망이 많다.카카오뱅크의 윤호영 대표는 지난 7일 대표 명의의 메시지에서 “최근 주가 하락에 대해 주주분들께 진심으로 죄송하다”며 “자사주 매입과 소각 등 주주 환원 정책을 검토하겠다”고 밝혔다. 그러면서 카카오뱅크의 임원 12명이 지난 6일과 7일 이틀에 걸쳐 자사주 총 5만685주를 매입하기도 했다.카카오페이도 신원근 대표를 비롯한 임직원이 이 회사의 주식 매입을 하고 있다. 카카오게임즈는 ‘쪼개기 상장’ 논란을 일으킨 자회사 라이온하트스튜디오의 상장을 철회했다."
2023-08-08,일주일 빌리면 이자 안 받기도… ‘빚투’ 부추기는 증권사들,"신용 금리 인하로 대출 경쟁KB증권은 지난 2일부터 신용대출인 신용거래융자 금리를 60일간 연 4.2%로 인하하는 이벤트를 시작했다. 종전에는 대출 기간에 따라 연 4.9~9.1%로 차등 적용하던 금리를 신규 고객 등에 한해 일괄적으로 대폭 낮춰주는 것이다. 다른 증권사들 금리(최고 연 9.6%)의 절반 수준이다.다올투자증권도 지난달부터 신규·휴면 고객 신용융자 이율을 6개월간 연 3.99%로 확 낮췄다. 대신증권은 지난 6월부터 1~7일 단기 신용융자 이자를 아예 받지 않고 있다. 이자 부담이 큰 90일 이상 신용융자 금리는 0.25%포인트 내렸다.그래픽=백형선증권사들이 신용융자 고객을 유치하기 위해 대출 금리 인하 마케팅에 적극 나서고 있다. ‘이차전지’ ‘초전도체’ 등 테마주가 급등하며 개인들의 ‘빚투(빚을 내 투자)’가 증가하자 영업 기회로 삼는 것이다.올해 초 16조원이던 국내 증시 신용융자거래 잔액은 최근 20조원대로 불었다. 2거래일 후 갚아야 반대매매를 당하지 않는 ‘초단기 대출’인 미수금도 지난달 말 7200억원을 넘기며 1월 말(1847억원)의 4배가 됐다.대출금리 인하는 고객 입장에선 혜택이지만, 부작용이 우려된다는 지적도 나온다. 대출받은 돈으로 주식을 ‘단타’로 매매하는 거래가 급증하는 상황에서 증권사들의 대출 이벤트가 ‘빚투’를 더욱 자극할 수 있다는 것이다. 신용융자로 매수한 주식이 주가 하락으로 반대매매될 경우, 주가 하락을 더 가속해 증시 변동성이 확대될 수도 있다.“비대면 신용융자 금리가 대면보다 비싸다니”일부 증권사는 대면 고객보다 비대면 신용융자 고객에게 더 비싼 금리를 매기고 있는 것으로 나타났다. 비용이 절감되는 비대면 금융 거래 고객에겐 금리나 수수료를 낮춰주는 게 상식적인데 거꾸로 이자를 더 받고 있는 것이다. 은행이 모바일 전용 대출 상품에 더 낮은 금리를 매기는 것과 대조적이다.예컨대 한국투자증권은 16~30일 기준 신용융자시 대면 고객에겐 연 7.9%를, 비대면 고객에겐 9.5%를 받는다. 무려 1.6%포인트 차다.다른 대형 증권사들도 다르지 않다. 삼성증권은 대면 고객에겐 연 8.7%, 비대면 고객에겐 그보다 높은 연 9.2%를 적용하고 있다. 미래에셋증권과NH투자증권도 비대면 신용거래융자 금리가 대면 고객보다 각각 1.3%포인트, 1%포인트씩 더 높았다.김득의 금융정의연대 대표는 “비대면 채널을 통한 대출 고객 유입이 많다 보니 ‘돈벌이’를 위해 오히려 더 높은 금리를 책정하고 있는 것 아닌가 의심된다”고 했다. 황세운 자본시장연구원 선임연구위원은 “전산 구축 비용이 반영되면서 비대면 대출 고객들에게 더 높은 금리를 받고 있는 과도기적 현상일 수 있다”며 “당연히 비대면 대출 금리는 대면일 때보다 낮아야 한다”고 말했다. 이에 대해 한 증권사는 “자사의 고객 관리 전략에 따른 것일 뿐”이라고 설명했다.커지는 증권사 ‘이자 장사’ 논란신용공여도 증권사의 업무 중 하나이긴 하지만, 과도한 이자마진 논란은 계속되고 있다. 올 초엔 증권사들이 한국증권금융에서 연 3.02%(작년 9월 기준) 금리로 자금을 조달(융자)해 고객들에겐 최고 연 10% 안팎 고금리로 대출하는 식으로 지나친 ‘이자 장사’를 하고 있다는 비판이 제기됐다. 국회 정무위원회 양정숙 의원은 “5대 은행 예대마진(예금금리와 대출금리의 차)이 0.97~1.83%포인트인 데 반해 증권사는 그보다 최대 6배 높은 수익을 추구하고 있는 것”이라며 “대출 시 주식 등 확실한 담보를 설정하면서 높은 금리를 적용하는 것을 이해할 수 없다”고 지적했다. 여론의 비판이 거세지자 증권업계는 신용융자 최고 금리를 연 10% 아래로 내렸다.주요 증권사의 이자 수익은 3년 새 2배로 급증한 것으로 나타났다. 금투협회에 따르면 삼성증권의 경우 2020년 1분기 227억원이었던 신용거래융자 이자 수익이 지난 1분기엔 545억원이 돼 2.4배로 늘었다.KB증권(2.2배)과 미래에셋증권(2.1배),NH(2.08배), 한국투자(2.02배) 등도 비슷한 규모로 늘었다. 이렇게 불어난 신용거래융자 이자 수익은 증권사 분기 순이익의 20% 이상을 차지한다."
2022-08-30,오히려 비싼 전기차 유지비… 아직은 이 차에 밀린다,"29일 다올투자증권은 전기차와 하이브리드차의 총소유비용을 분석했다. ‘총소유비용’(TCO·TotalCostofOwnership)은 차를 처음 살 때 지불하는 비용에 소유하는 기간 동안 필요한 연료비·정비비·보험료·보유세를 모두 더한 것이다. 전기차 소유 비용이 높아지면 소비자는 구매를 꺼릴 수밖에 없다.분석 결과, 현대차의 최신 중형 전기 세단 ‘아이오닉6′를 10년간 소유하며 8만㎞ 주행할 경우 총비용은 구매 가격(5200만원)에 전기료·유지비·보유세 등(1540만원)을 포함해 6740만원이었다. 그랜저 3.3 가솔린 모델(6675만원)보다 높았다. 총소유비용이 가장 낮은 건 그랜저 하이브리드로 6210만원에 그쳤다.원자재 가격 상승으로 전기차 핵심 부품인 배터리 가격이 급등하자, 전기차가 가솔린이나 하이브리드 자동차보다 가성비가 뛰어날 것이라는 대전제가 흔들리고 있다. 이에 따라 고유가와 맞물려 하이브리드 자동차 시대가 상당 기간 지속될 것이라는 전망이 나온다.치솟는 전기차 총소유비용 부담, 기업·소비자 모두 커져완성차 업체는 최근 전기차 가격을 계속 올리고 있다. 원자재 값을 거의 실시간 반영하며 3개월 만에 국내 판매 가격을 1000만원 올린 테슬라는 말할 것도 없고, 현대차도 지난달 아이오닉5 가격을 연식 변경, 배터리 용량 증대를 이유로 가격을 310만~430만원 올렸다. 포드는 이달 초 전기 픽업트럭 F150 라이트닝 가격을 6000~8500달러(약 810만~1150만원) 올린 데 이어, 26일(현지 시각) 주력 전기차 머스탱 마하E 가격도 3000~8475달러 인상했다. 포드는 “상당한 재료 비용 증가와 주요 공급망에 대한 지속적인 부담, 빠르게 변화하는 시장 상황 때문”이라는 이유를 들었다.여기에 전기료·보험료 인상, 보조금 축소 기조까지 더해지며 전기차 소유비용 상승을 부추기고 있다. 한전은 천문학적 적자가 지속되자 전기차 충전 요금 할인 특례를 완전 폐지했고 이에 따라 다음 달 급속 충전 요금이 11~12% 인상된다. 최근 러시아 천연가스 공급난으로 에너지 대란을 겪는 독일·프랑스는 연초 대비 전기료가 3배 뛰었다. 이에 따라 유럽은 전기차 판매 증가율이 최근 눈에 띄게 둔화되는 추세다. 최근 보험사들은 전기차 수리비가 비싸다는 이유로 안 그래도 내연기관 대비 비싼 전기차 보험료를 더 올리려는 움직임을 보이고 있다.보조금은 계속 축소되고 있다. 우리 정부는 2012년 1500만원이던 한 대당 국고 보조금을 계속 줄여 올해는 700만원만 주고 있다. 내년엔 더 축소될 것으로 보인다. 여기에 전기차는 보증 기간(현대차의 경우 10년)이 지난 후 배터리를 교체할 경우 약 2000만원의 추가 비용이 발생할 가능성까지 존재한다.길어지는 ‘과도기’… 하이브리드 뜻밖의 ‘생명연장’ 존재감 높아져전기차 총소유비용의 증가는 전기차 수요 둔화로 이어질 가능성이 높다. 완성차 업체들은 규모의 경제를 달성하기 위해 수익이 남지 않는 전기차에 막대한 투자를 단행해왔지만 딜레마에 빠질 수밖에 없다. 하이브리드차가 중요한 캐시카우 역할을 할 것이란 분석이 나오는 이유다.현재 하이브리드차를 연간 250만대 팔고 있는 도요타는 과도기에 가장 큰 반사이익을 누릴 것으로 관측된다. 실제 도요타는 하이브리드 자동차 판매 호조에 힘입어 작년 회계연도(2021년 4월~2022년 3월)에 사상 최대인 28조원의 순이익을 냈다.일본차 업계를 추격하며 일찍부터 하이브리드차 기술을 개발해온 현대차그룹도 유리한 고지에 서 있다. 현대차·기아는 지난해 36만대의 하이브리드차를 판매했고, 지속적으로 생산량을 늘리고 있다. 2025년엔 유럽의 탄소 배출 규제(탄소 배출량 81g/㎞ 이하)를 충족할 수 있는 차세대 하이브리드 시스템 출시를 목표로 하고 있다.이호근 대덕대 교수는 “고유가가 지속되면서 하이브리드차의 수요는 더 증가하고 있다”며 “전기차에만 올인한 독일·미국 자동차 업계보다 오랫동안 하이브리드 기술을 개발해온 한국·일본 자동차 업계가 과도기 수익 창출에 더 유리한 지위를 선점할 수 있다”고 말했다."
2022-07-29,"‘2200억 횡령’ 오스템임플란트 주가, 1년 전 수준 복귀","서울 강서구에 있는 오스템임플란트 중앙연구소의 모습. /뉴스1올 초 2200억원 규모의 직원 횡령 사건으로 100일 넘게 거래정지를 당하며 상장폐지 위기에까지 몰렸던 오스템임플란트(이하 오스템) 주가가 상승하고 있다. 2분기 실적이 호전된 것이 영향을 미친 것으로 보인다. 지난 4월 말 거래 재개 이후 10%를 넘었던 하락분을 모두 만회했다. ‘상장사 사상 최대 규모’의 횡령 범죄로 업계에 충격을 줬지만, 반년여 만에 회복하는 모습이다.28일 한국거래소에 따르면, 오스템의 27일 종가는 11만3600원으로 4거래일(21~27일) 연속 상승세를 보였다. 합계 상승폭이 약 20%였다. 올 초 115일 동안 거래정지를 당했다 풀린 지난 4월 28일 종가(11만2000원)를 다시 넘어선 것이다. 한창 상승세였던 1년 전 주가(12만100원)에도 거의 근접한 수준이다.최근 주가 상승은 지난 25일 발표된 2분기 실적의 영향이 컸다. 오스템의 2분기 영업이익은 562억원으로, 전년 동기 대비 64%나 증가했다. 중국과 러시아 등에서 매출이 크게 늘었기 때문이다. 임플란트 업계의 ‘대장주’인 오스템이 오르니 업계 2위 덴티움도 같은 기간(21~27일) 10%가량 상승하는 등 관련주가 되살아나고 있다.증권사들은 오스템의 전망을 긍정적으로 보고 있다. 삼성증권은 “중국, 러시아에서 (임플란트) 실수요 확대가 진행 중이며 미국에서도 꾸준한 성장을 보여주고 있다”며 목표 주가를 16만원으로 잡았다. 다올투자증권도 최근 목표가를 기존 13만원에서 16만원으로 올렸다."
2022-04-27,“베이징만 바라봤는데…” 펄어비스 주주들 ‘검수완박’ 공포 [왕개미연구소],"게임업체 펄어비스 주주들에겐 27일이 말 그대로 ‘검수완박(검은 수요일 완전 박살)’이었다.이날 펄어비스는 전날보다 24.3% 하락한 7만4200원에 마감했다. 장중 한때 26% 가까이 하락해 7만2700원까지 떨어졌다. 전날 미국 증시 하락 여파로 코스닥지수가 하루에 1.64% 하락하는 등 전체적인 시장 분위기가 좋지 않았지만, 코스닥 시가총액 4위(5조원)인 펄어비스의 하락세는 더욱 거셌다.이날 펄어비스 거래량은 680만주에 육박하면서 폭증했다. 개인들이 매수하면서 주가 급락을 필사적으로 막아보려 했지만, 기관이 995억원, 외국인이 419억원 어치 순매도하면서 주가를 끌어 내렸다.전날 중국 시장에 처음 선보인 펄어비스의 ‘검은사막 모바일’의 매출 성적이 예상보다 저조하다는 평이 나온 것이 주가 급락 원인이었다. 출시 첫날인 26일, 검은사막 모바일은 애플 앱스토어 인기 순위 1위에는 올랐지만, 매출 지표에서는 중위권 수준에 머물렀다.중국판 검은사막 모바일. /펄어비스 제공증권업계 관계자는 “검은사막 모바일이 중국에서 출시되면 바로 매출 상위 탑5 안에 들 것이란 기대가 있었는데, 막상 뚜껑을 열어 보니 30위권 안팎에서 움직여서 실망감이 커졌다”고 말했다. 재야의 고수들 운영자는 “가격이 충분히 싸지면 매수 관점이겠지만 비싸다 싶을 땐 다시 생각해 봐야 한다”면서 “베이징을 향해 기도만 하던 주식이었는데 성과가 좋게 나오지 않으면 백약이 무효해진다”고 평했다.김하정 다올투자증권 연구원은 “전날 출시된 검은사막 모바일의 중국 버전 초기 매출 성과가 매우 부진하게 나타나고 있다”면서 “회사 측에서는 반등 가능성이 있다고 기대하고 있지만 트래픽 지표상으로는 쉽지 않아 보인다”고 말했다./그래픽=이연주 조선디자인랩 기자지난해 6월 중국에서 판호(중국 내 게임 서비스 허가권)를 받았던 펄어비스는 작년 11월에 장중 14만5200원까지 주가가 오르면서 급등했다. 하지만 이달 신작 출시를 앞두고, 주가 하락에 베팅하는 공매도가 급증했다. 1년 전만 해도 45억원 안팎이던 펄어비스 공매도 잔액은 22일 기준 3760억원까지 불었다. 코스닥 시장에서 공매도 잔액 기준 1위로, 2위인 에코프로비엠(2715억원)보다 훨씬 많다. 펄어비스의 지난해 매출액은 4037억원, 영업이익은 430억원이었다."
2023-04-28,"SG증권發 주가 폭락, 나흘새 8조 증발 “가수·의사 등 1000명이 전주 역할”","금융 당국 관계자들이 27일 오전 서울 강남구의 ‘SG증권 사태’ 관련 사무실을 압수 수색한 뒤 관련 압수품을 차량에 싣고 있다. 주가 조작 세력은 당국이 조사에 돌입하자 급히 특정 회사의 주식을 처분했고, 이들 종목의 시가 총액은 나흘 만에 8조원 이상 감소했다. /뉴스1금융 당국과 경찰은 27일 주가조작 의혹이 불거진 ‘SG증권발 주가 폭락 사태’ 관련 전방위 압수 수색에 나섰다. 이번 사태는 지난 24일 선광, 하림지주 등 8종목이 외국계 증권회사인 ‘소시에테제네랄(SG)’발 매물로 폭락하면서 불거졌다. 주가조작 세력이 이 종목들의 가격을 인위적으로 끌어올린 정황을 금융 당국이 포착하고 조사에 착수했는데, 이를 눈치챈 일당이 급히 주식을 매도해 주가가 폭락했을 가능성이 거론됐다. 8종목 주가는 나흘간 최대 75%가량 폭락했고, 시가총액은 8조원 이상 감소했다.금융위 자본시장조사총괄과는 이날 주가조작 세력으로 지목된 H투자컨설팅 업체 서울 사무실과 이 업체 명의로 된 S골프연습장, 업체 관계자의 주거지 등을 압수 수색했다. 금융 당국은 이들이 미리 짜고 주식을 높은 가격에 사주는 수법(통정매매)으로 주가를 끌어올린 정황을 발견한 것으로 알려졌다.앞서 25일 서울 강남경찰서는 문제의 주가조작 세력이 미등록 투자 자문 업체를 운영해 ‘자본시장법’을 위반한 것으로 보고 수사에 나섰다. 경찰은 H투자컨설팅 업체 사무실에서 휴대전화 200여 대를 압수했다. 경찰은 주가조작 세력이 이 휴대전화를 통해 ‘전주(錢主)’들의 명의로 개설한 증권 계좌로 시세조작을 한 것으로 보고 있다. 서울남부지검 금융증권범죄합동수사단도 24일 주가조작 세력 일당으로 의심되는 10명을 출국 금지 조치했다.이들 일당에게 투자해 사실상 ‘전주’ 역할을 했던 이들은 자신들도 피해를 봤다며 소송을 준비 중이다. 이들을 대리할 예정인 변호사는 본지 통화에서 “1000명 정도가 손해를 봤고 이 중 300명 정도는 의사라는 말도 있다”며 “청담동 전주들, 의사 등 전문직도 있고 손해액이 10억~100억원으로 다양하다”고 했다. 그러나 법조계에서는 “‘전주’ 역할을 한 사람들이 공범이었을 가능성도 있다”는 말이 나왔다. 주가조작 세력에게 돈을 맡긴 전주들이 주가가 올라 평가이익이 발생했을 때에는 가만히 있다가, 주가가 폭락하자 피해자라고 주장하고 나섰기 때문이다. 다만 전주들이 수익 창출 방법은 알지 못하고 주가 조작 일당의 ‘고수익 투자’라는 선전에 넘어갔을 가능성도 있다.이런 식으로 투자한 사람 중에는 가수 임창정씨 등 연예인도 다수 있는 것으로 전해졌다. 임씨는 “30억원을 투자했는데 지금은 1억8900만원이 남아 있다”고 주장하고 있다. 연예인들에게 투자를 권유한 이로는 S골프연습장의 임원인 골프 강사 안모씨가 거론된다. 남부지검은 사안의 중대성을 고려해 이번 사안을 ‘패스트트랙’으로 조만간 이첩받을 예정이다.사건이 수면 위로 드러난 건 지난 24일 주식시장에서 다올투자증권, 하림지주, 다우데이타, 세방, 삼천리, 대성홀딩스, 서울가스, 선광 8종목이 별다른 요인 없이 동시에 하한가를 기록하면서다. 급락 원인으로 외국계 증권사인SG증권의 차액결제거래(CFD) 계좌에서 발생한 대량 매도가 지목됐다. 이후 주가가 급락하자 이 계좌에 돈을 빌려준 증권사들이 대규모 반대매매(대출금 상환을 위해 담보로 잡은 주식을 강제매각하는 것)에 나서며 하락 폭을 키웠다는 분석이다.이 종목들은 대부분 작년부터 꾸준히 주가가 올랐다. 나흘 연속 하한가를 기록한 서울가스의 주가는 작년 4월 20일 18만3500원에서 지난 21일 46만7500원으로 1년 새 155% 올랐다. 같은 기간 삼천리는 358%, 대성홀딩스는 124%, 선광은 136% 상승했다. 그러나 서울가스는 4연속 하한가를 맞으며 27일 주가가 11만2700원으로 1년 전보다 오히려 39%가량 하락한 상태다.이들 종목은 꾸준히 주가가 오르는 과정에서 ‘소형 가치주’로 소문 나 개인 투자자들의 피해도 우려된다. 해당 기업들의 공시에 따르면 지난해 연말 기준 8종목의 소액주주 비율은 평균 30.43%다. 빚을 내서 투자한 개인들의 비율이 높은 것도 문제다. 지난 21일 기준으로 8종목의 평균 신용잔고율(대출받아 투자한 비율)은 10.29%로 유가증권시장 평균(0.98%)의 10배에 달했다.8종목을 담은 펀드의 수도 많아 피해는 더욱 확대될 전망이다. 금융정보 업체 에프앤가이드에 따르면 지난해 연말 기준 상장지수펀드(ETF)를 포함해 전체 105개 펀드가 해당 종목들을 담고 있다."
