date,title,content
2024-08-22,"세계 2000대 기업, 신규 진입하는 한국 기업 적어","세계 2000대 기업에 신규 진입한 한국 기업 수가 다른 주요국에 비해 적다는 분석이 나왔다.대한상의는 미 경제지 포브스가 지난 6월 발표한 ‘2024 세계 2000대 기업 명단(Global2000)’을 분석했다.한국 기업은 61개가 등재됐는데, 미국, 중국, 일본, 인도, 영국에 이어 6위를 기록했다. 한국 기업 61개 중 10년전인 2014년 명단에는 없었던 신규진입 기업은 16개였다. 비율로는 26.2%에 그쳐 전체 평균 33.8%에 낮았다. 2000대 기업중 676개가 신규 진입한 것이다. 신규 진입한 기업이 많은 나라는 중국(59.3%), 인도 (42.3%), 미국(37.5%) 순이었다.포브스는 매출, 순이익, 자산, 시가총액을 종합해 선정해 순위를 매긴다. 글로벌 시장 내 기업의 위치를 보여주는 종합 지표다.◇한국 기업들, 하위권에 집중한국 기업 대부분은 2000대 기업 중 하위 순위에 머물렀다. 우리나라 기업 61개 중 9개인 14.7%만 상위 500등 안에 포함됐다. 특히 50위권에는 삼성전자(21위)가 유일하게 포함됐다.500등 안에 든 9개 기업은 삼성전자, 현대차(93위), 기아(234위),KB금융그룹(250위), 신한금융그룹(304위), 하나금융그룹(411위), 포스코(412위), 현대모비스(465위), 삼성물산(493위)이다.이는 중국, 일본, 미국 등 기업 등재 수가 많은 국가들 뿐 아니라, 우리보다 등재 기업 수가 적은 독일 보다도 낮은 수치다. 독일은 50개 기업이 등재됐고, 이중 18개가 500등 안에 들었다. 반면 1001~2000등에 들어간 기업의 비중은 우리나라가 60.7%로 주요국 중에 가장 높았다.상위 500등 내에 있는 기업을 국가별로 보면, 미국이 약 3분의1인 176개로 가장 많았다. 뒤를 이어 중국, 일본, 영국, 프랑스, 캐나다, 독일, 인도, 스위스 순이다. 우리나라는 9개로 주요 10개국 중 가장 적었는데, 이는 총 등재기업 수로는 6위를 기록한 것에 비해 저조한 수치다.특히 2000위 안에 든 한국 기업 61개중 벤처에서 시작한 기업들은 네이버(909위), 다우기술(1731위), 카카오뱅크(1816위), 카카오(1851위) 등 4개뿐이었다.대한상의는 “독일의 상위권 기업에는 세계적인 자동차 업체 외에도IT,기계, 금융 등 다양한 분야의 글로벌 기업이 있었다”며 “우리나라도 다양한 분야에서 더 많은 글로벌 기업을 키워내기 위한 노력이 필요하다”고 말했다.◇한국 기업의 평균 순이익은 10.6억달러, 주요 10개국 중 꼴찌기업의 수익성을 나타내는 척도인 순이익도 우리나라가 주요국에 비해 낮은 것으로 나타났다. 등재 기업 수로는 한국이 61개로 6위였으나, 국가별 등재 기업의 순이익을 모두 합한 전체 순이익 규모는 우리나라가 649억달러로 전체 12위로 떨어졌다. 이는 미국(순이익 1.8조달러), 중국(6021억달러), 일본(2790억달러) 뿐 아니라, 우리보다 등재 기업 수가 적은 캐나다(1104억달러), 독일(1017억달러), 프랑스(1439억달러) 보다 낮다.등재기업의 평균 순이익을 계산해보면 우리나라는 10.6억 달러로 주요 10개국 중 가장 낮았다. 전체 평균인 22.5억 달러의 절반 수준이다. 주요국에 비해 우리나라에 수익성이 높은 글로벌 기업의 수가 부족하다는 것을 보여준다. 김현수 경제정책팀장은 “첨단 산업 경쟁이 치열한 지금, 한 국가가 보유한 세계적 기업의 수는 곧 국가 경쟁력과 직결된다”며 “우리경제의 역동성을 높이고, 다양한 산업분야에서 더 많은 글로벌 스타 기업이 등장하기 위해선 기업의 성장을 지원하는 제도적 환경을 만들기 위한 노력이 필요하다”고 말했다."
2024-04-05,국민 1인당 한달에 불법 스팸 13통씩 수신,"작년 상반기보다 4통 증가일러스트=조선디자인랩 정다운지난해 하반기 국민 1인당 불법 스팸 수신 건수가 월평균 13.49통에 달한 것으로 조사됐다. 작년 상반기보다 4.19통 증가한 수치로, 특히 문자 불법 스팸이 큰 폭으로 증가했다. 방송통신위원회와 한국인터넷진흥원(KISA)은 이런 내용을 담은 ‘2023년 하반기 스팸 유통 현황’을 5일 발표했다.불법 스팸 1인당 13.49통불법 스팸 수신량 조사는 지난해 하반기 전국 휴대전화·이메일 사용자 3000명(12~69세)을 대상으로 이뤄졌다. 조사 결과 1인당 월평균 수신량은 13.49통으로 상반기 대비 4.19통 증가한 것으로 나타났다.이 가운데 문자 스팸이 상반기 5.23통에서 하반기 8.91통으로 큰 폭으로 늘었다. 이메일 스팸 역시 2.12통에서 3.11통으로 증가했다. 다만 휴대전화 음성 스팸은 1.95통에서 1.47통으로 줄었다.그래픽=조선디자인랩 이연주문자 스팸 내용을 보면 주식·재테크 등 금융 관련 스팸이 5.09통으로 가장 많았고, 2위는 도박(2.05통) 관련이었다. 두 유형이 전체의 80%를 차지했다. 이밖에는 로또·복권, 부동산, 교육·학원·유학, 건강정보, 취업·창업, 통신가입 권유 등이었다.이메일 스팸의 경우 작년 하반기에 상반기 대비 늘어나긴 했지만 최근 5년을 보면 감소 추세를 보이고 있다. 내용을 보면 의약품 관련이 1.93통으로 가장 많았고, 이어 성인(0.17통)·도박(0.16통) 등 순이었다.이용자 신고·기관 탐지 2억건 넘어이용자가KISA에 신고하거나KISA가 자체적으로 탐지한 스팸은 작년 하반기 총 2억651만 건으로 상반기(1억1034만건)보다 87.2% 증가했다. 방통위는 “작년 상반기 휴대전화 스팸 신고 기능을 개선해 신고 건수가 늘어난 부분도 있다”고 설명했다.휴대전화 문자 스팸이 1억8509만건으로 가장 많았다. 대량문자 발송 서비스를 통한 스팸이 대부분인 가운데, 국외발 문자 스팸 비율이 상반기 14.2%에서 하반기 16.7%로 늘었다. 방통위는 “국내 업체 규제 강화로 국내발송은 지속적으로 감소하는 반면 규제를 피한 국외 발송은 증가하는 추세”라고 했다.문자 스팸 광고 유형별로는 도박(47.4%), 불법대출(20.7%), 금융(11.5%), 성인(6.5%), 부동산(4.8%), 스미싱(3.4%) 등 순으로 비중이 높았다.그래픽=조선디자인랩 이민경이메일 스팸 신고·탐지는 하반기 총 1652만 건으로 전반기 대비 241.3% 증가했다. 특히 루마니아를 경유한 이메일 스팸 비중이 0.3%에서 12.3%로 많이 증가한 것으로 나타났다. 이어 미국, 일본, 독일, 프랑스 등 순으로 많았다.삼성 핸드폰서 ‘스팸문자함’ 서비스방통위는 불법 스팸 노출 피해를 줄이기 위해 삼성전자와 협력해 이달 중 삼성전자 휴대전화 단말기에서 ‘스팸문자함’ 시범 서비스를 시작할 예정이다. 이메일 ‘스팸 메일함’처럼 스팸으로 의심되는 문자를 가려내 별도 문자함에 저장해두는 방식이다. 스팸 문자가 오면 자동으로 스팸 문자함으로 보내진다.또 상반기 중 문자 메시지 전송 자격을 인증받은 사업자만 대량 문자를 발송할 수 있는 ‘전송자격인증제 자율운영’ 시스템도 구축한다. 인터넷을 이용해 대량문자전송서비스(웹 발신 문자)를 제공하는 문자재판매사는 반드시 서비스 시작 전 문자중계사업자로부터 전송자격 인증을 받아야 한다.지난달 기준 문자중계사업자는KT·LG유플러스·SK브로드밴드·다우기술·인포뱅크 등 9곳이고, 문자재판매사는 1175개에 달한다."
2023-04-22,"79조 손실 올들어 만회했다는 국민연금, 무슨 종목 샀길래","전북 전주의 국민연금공단 건물./뉴스1지난해 최악의 수익률을 보였던 국민연금이 올해 1분기 국내외 증시 훈풍에 힘입어 손실을 대부분 만회한 것으로 알려졌다. 국민연금은 지난해 글로벌 금리 인상으로 인한 주식시장 약세 속에 연간 -8.22% 운용 수익을 기록했다. 평가손실액은 79조 6000억원에 달했다.이런 손실을 만회하기 위해 국민연금이 주목한 종목은 무엇이었을까. 22일 금융정보업체 에프앤가이드가 이달 11일 기준으로 국민연금이 5% 이상 대량 지분을 보유한 상장사를 집계한 결과 국민연금은 레저, 항공운수, 해상운수 등 종목에 대한 지분을 늘리며 엔데믹(endemic·감염병의 풍토병화) 대응에 나선 것으로 나타났다.부동산PF위험 노출 우려? 금융주 축소국민연금은 지난해 4분기 들고 있던 종목 289개 종목 중 올해 1분기 85개 종목에 대한 투자를 축소한 것으로 나타났다. 반면 투자를 확대한 종목은 56개, 신규로 5% 이상 대량 보유 종목에 편입한 종목은 18개로 투자 종목 축소 경향성이 더 컸다.지난해 4분기 보유 종목 중 축소 비중이 컸던 분야는 보험, 상업은행, 게임, 식료품, 전기 장비 등이었다. 보험에서는 지난해 4분기 6.1% 지분을 보유하고 있던 메리츠화재가 상장 폐지되면서 제외됐고 삼성화재(8.71%→7.71%), 현대해상(11.62%→11.25%),DB손해보험(10.32%→10.12%), 삼성생명(6.87%→6.86%) 등에 대한 지분을 축소했다. 보험사들은 금리 인상기에 투자하기 좋은 것으로 평가되고, 실제 지난해 실적도 좋았지만 이미 실적 개선에 대한 기대가 반영됐다는 판단 속에 다른 주식과의 매력도를 비교하는 과정에서 비중을 줄인 것이 아니냐는 분석이 나온다.상업은행주 중에서는 은행은 지난 4분기 대량보유종목 9개 중DGB금융(10.05%→8.78%),JB금융(8.21%→7.17%), 우리금융(7.86%→6.84%),BNK금융(9.48%→8.47%)에 대한 지분을 축소했다. 은행주 중에서는 신한지주에 대한 지분만 7.96%에서 8.01%로 확대했다. 한 금융투자업계 관계자는 “특히 지방은행에 대한 비중을 줄인 것이 눈에 띄는데 미국 실리콘밸리은행 파산 사태를 염두에 뒀을 수 있고, 국내에서는 부동산PF노출 문제 등을 고려한 것일 수 있다”고 했다.이 밖에 국민연금이 공개매수에 참여한 것으로 알려진SM엔터테인먼트를 포함해 현대에너지솔루션,KT&G,테이팩스, 나노신소재, 더네이쳐홀딩스, 하이록코리아, 다우기술, 동원시스템즈,SK디앤디, 와이지-원, 대신증권,SK디스커버리, 인텍플러스,CJ프레시웨이, 대주전자재료, 큐리언트, 파크시스템스, 영풍, 천보, 카카오페이 등의 상장사 지분을 5% 미만으로 낮췄다.2023년 1분기 국민연금 5% 이상 지분 보유 신규 편입 종목레저·항공·해운, 코로나 타격 종목 확대투자를 확대한 분야는 코로나 펜데믹 시기 타격이 컸던 레저, 해상운수, 항공운수 등이었다. 외국인 관광객이 늘어나고 해외 여행객도 급증하는 엔데믹 시기에 발맞춘 것으로 볼 수 있다.레저 분야에서는 지난해 주가가 크게 떨어졌던 쏘카와 롯데관광개발이 새롭게 5% 이상 대량 지분 보유 종목이 됐다. 세븐럭 카지노를 운영하는GKL에 대한 지분을 8.94%에서 10.54%로 1.6%포인트 늘렸고 하나투어 지분도 6.52%에서 8.67%로 2.15%포인트 대폭 확대했다.운송량이 늘며 항공과 해운주의 전망도 긍정적으로 내다본 것으로 파악된다. 제주항공의 지분을 6.04%에서 8.11%로 확대했고, 진에어의 지분은 7.31%에서 10.66%로 3% 이상 늘렸다. 한진칼 지분도 5.06%로 늘려 신규 5% 이상 지분 보유 종목에 포함됐다. 해상운수 분야에서는 지난해 4분기 들고 있던 2 종목(대한해운, 팬오션)의 지분을 모두 1% 가량 확대했다.자동차부품과 의료기기에 대한 투자를 확대한 것도 확인됐다. 국민연금은 지난해 4분기 보유하고 있던 13개 자동차부품 종목 중 5개에 대한 투자를 확대했고 1종목만 축소했다. 한국앤컴퍼니(6.01%→6.18%), 현대위아(9.73%→10.05%),HL만도(11.04%→11.4%), 한국단자(11.31%→11.79%), 넥센타이어(6.06%→7.07%) 등이다.의료장비 중에서는 맥아이씨에스가 신규 대량 지분 보유 종목에 올랐고 인터로조(10.93%→11.29%), 덴티움(8.36%→9.96%), 레이(5.32%→7.33%) 등에 대한 투자를 확대했다. 이 중 덴티움, 레이는 임플란트 관련 회사로 이 분야 1위인 오스템임플란트가 상장 폐지되면서 반사이익을 얻을 것으로 기대한 것이 아니냐는 추측이 나온다."
2024-09-04,"다우기술·중앙일보엠엔피, 전략적 업무 제휴 협약식","다우기술 김정우 커머스부문장(좌)과 중앙일보엠앤피 최회준 대표이사(우)는 3일 중앙일보엠앤피 본사에서 전략적 업무 제휴 협약을 체결했다. 이번 협약으로 양사는 △사방넷 서비스 기존 및 신규 고객을 대상으로 한 공동 영업 및 모집 △양사의 인프라를 활용한 물류 협업 상품 개발 △양사의 플랫폼을 활용한 홍보/마케팅 협업 등을 추진하며, 공동 목표를 달성하고 지속 가능한 파트너십을 유지해 나갈 계획이다"
2024-12-16,"한국 배당주 전수조사했다, 황제주·귀족주 순위 대공개","한국 배당주, 미국 기준으로 첫 전수조사경제+-6.4%vs16.9%. 올 한 해(1월 2일~12월 3일) 코스피 대비 고배당주 주가가 얼마나 선전했는지 극명하게 보여주는 숫자다. 코스피가 6.4% 하락할 때, 코스피 고배당50 지수(코스피 종목 중 배당수익률이 높은 50개 종목 주가를 종합한 지수)는 16.9% 올랐다. 고배당주 인기는 올해 내내 압도적이었던 셈이다. 증시 전문가들은 고배당주 수익률이 내년에도 좋을 것으로 전망한다. 배당주 수익률은 경기 전망이 어두울수록 상대적으로 양호한 모습을 보이기 때문이다. 증시 전반이 침체할 때도 우량 배당주 주가는 상대적으로 덜 떨어지는 이점도 있다.오뚜기·농심·동서·유한양행·현대백…국가부도 위기서도 배당 늘린 ‘황제’미국 증시에선 이미 오래전부터 배당주 투자 문화가 자리 잡았다. 역사와 전통 있는 배당주도 많아 이들을 따로 일컫는 용어도 있다. 50년 넘게 매년 배당금을 늘려온 배당왕족주(DividendKings), 스탠더드앤드푸어스(S&P)500 구성 종목 중 25년 이상 매년 배당금을 늘려온 배당귀족주(DividendAristocrats), 10년 넘게 배당금을 늘리고 풍부한 현금 유동성을 갖춘 배당성취자(DividendAchievers) 등이다.정근영 디자이너머니랩이 국내 최초로 이 기준들을 한국에 적용해 봤다. 금융정보업체 에프앤가이드와 한국상장사협의회가 보유한 데이터와 각 사 사업보고서 등을 활용해 국내 증시 대표 기업들인 ‘KRX300’ 편입 기업의 2000년 이후 현금 배당금과 재무지표를 전수조사했다. 그런 다음 개인투자자가 한눈에 알아볼 수 있도록 배당황제주·배당왕족주·배당귀족주·배당개근주로 나눠 ‘배당 우등생’ 목록을 작성했다.코스피와 같은 종합주가는 경기선행지수와 비슷하게 가는 경향이 있다. 경기선행지수는 실제 경기보다 약 6개월 먼저 움직이는데, 증시도 실물경제를 한발 앞서 반영하기 때문이다.특이하게도 고배당주 주가 흐름은 예외다. 고배당주 수익률은 경기선행지수와 반대로 움직이는 경향이 있다. 경기 침체가 예상되면  투자자는 이를 대비하기 위해 현금흐름이 안정적인 배당주를 찾는다. 반대로 경기 호황이 예상되면 배당주보다 더 큰 시세차익을 기대할 수 있는 성장주(미래 이익 성장이 기대돼 현재 가치보다 주가가 높게 형성된 종목)를 찾게 돼 배당주에 대한 관심은 상대적으로 줄어든다.국내 상장기업의 현금배당 총액은 2020년부터 크게 늘었다. 2011년 ‘코스피200’ 편입 기업의 연간 현금배당금 총액은 13조1563억원이었지만, 지난해에는 37조7160억원으로 불어났다. 정부의 기업가치 제고(밸류업) 정책은 이런 흐름을 가속할 전망이다. 신희철iM증권 연구원은 “밸류업 정책 논의 속에서 배당주 관심도가 커졌고, 올해 예상 배당수익률(주당 배당금/주가)이 3%가 넘는 코스피 상장사에는 외국인 투자가 지속적으로 유입되고 있다”고 설명했다.SK텔레콤·현대차 등 29곳은 ‘왕족’…하나금융·다우기술 등 ‘귀족’도 24곳국가부도 위기에도 배당 늘린 ‘황제주’=국내 우량 배당주의 최고봉은 ‘배당황제주’다. 머니랩은 최근 20년 이상 어떤 상황에서도 현금배당금을 줄이지 않고 증액했거나, 유지한 기업을 배당황제주로 이름 붙였다.정근영 디자이너국내 상장사 중 가장 오래 배당금을 증액·유지한 기업은 오뚜기와 농심이다. 이들의 배당금 증액·유지 기간은 30년에 달한다. 동서식품을 계열회사로 둔 동서도 29년간 배당금을 줄이지 않았다. 이들은 1997년 외환위기, 2002년 카드채 부실 사태, 2008년 글로벌 금융위기, 2010년 유럽 재정위기, 2020년 코로나19 위기 등을 거치면서도 꾸준히 배당금을 늘렸다. 유한양행과 현대백화점도 배당금 증액·유지 기간이 각각 24년, 22년에 달해 배당황제주에 이름을 올렸다.이들 기업은 재무건전성도 양호하다. 현대백화점을 뺀 4개 기업 모두 올 3분기 부채비율(부채총계/자본총계)이 100%도 되지 않고, 유동비율(유동자산/유동부채)도 100%를 훌쩍 넘는다. 특히 동서는 부채비율 3.7%에 유동비율은 1719.7%로 모든 배당주를 통틀어 가장 우수한 재무건전성을 자랑했다. 이들 모두 배당수익률은 2%대 이하로 높은 편은 아니지만, 꾸준한 배당을 기대할 수 있다는 장점이 있다.김경진 기자경제위기 빼고 20년 유지…배당왕족주= 주요 경제 위기를 제외하고 20년 이상 배당금을 증액·유지한 기업을 한국의 ‘배당왕족’으로 꼽았다.김경진 기자우선LS·LG·SK·한화 등 대기업 지주사들이 대거 배당왕족주로 선정됐다. 또 한국 제조업을 대표하는 삼성전자·현대차·현대제철 등도 이름을 올렸다. 매년 고배당주 명단에서 빠지지 않는KT&G와 신한지주·NH투자증권·키움증권 등 금융주도 포함됐다. 신한지주의 배당수익률은 3.27%로 신한은행 정기예금 이자율(기본금리 2.6%)보다 높아 은행 예금보다 주식에 투자하는 게 낫다는 평가가 나올 정도다.배당왕족 중 가장 배당수익률이 높은 종목은SK텔레콤으로 5.9%에 달했다. 반도체 부품 제조사 리노공업은 부채비율 6.9%에 유동비율 1131.9%로 전체 우량 배당주 중 동서 다음으로 우수한 재무건전성을 자랑했다.주가 하락해 배당수익률 높을 수도…건전성·수익성 지표 함께 체크해야강산이 변해도 안 줄였다…배당귀족주= ‘배당귀족주’는 경제 위기 시기를 제외하고 10년 넘게 배당금을 증액·유지한 종목으로 뽑았다. 대표 종목으로는GS·CJ·두산 등 대기업 지주사들과 통신주인LG유플러스, 금융주인 하나금융지주·삼성카드·KB금융 등이 포함됐다. 정보기술(IT) 플랫폼 대표 종목인 네이버와 카카오도 배당귀족주에 이름을 올렸다.정근영 디자이너20년 넘게 잊은 적 없다…배당개근주= 배당금을 들쭉날쭉하게 책정한 시기도 있었지만 20년 이상 빠짐없이 배당한 종목을 ‘배당개근주’로 선정했다. 이들 기업 중에선 배당수익률이 6%가 넘는 우량주도 눈에 띈다. 한온시스템(7.76%), 현대해상(7.56%), 기업은행(6.49%), 코리안리(6.35%) 등이다. 삼성그룹 내 금융주인 삼성생명·화재·증권 등은 모두 배당개근주에 포함됐다.정근영 디자이너‘진국’ 배당주를 고르려는 배당주 투자자가 가장 먼저 확인하는 건 배당수익률이다. 배당수익률이 최소한 3% 이상은 돼야 외국인 매수세가 유입되기도 쉽다. 그러나 주의할 점은, 배당금을 늘려서가 아니라 주가가 떨어져 배당수익률이 높아진 건 아닌지 반드시 확인해야 한다.부채비율·유동비율 등 대표적인 재무건전성 지표도 확인해야 한다. 기업이 적극적으로 주주 배당을 하려면 자금을 영업하는 데 쓰고, 부채를 갚는 데 쓰고 난 뒤에도 남아도는 현금이 많아야 한다. 전설적인 투자가 워런 버핏이 가장 좋아하는 투자 지표로 잉여현금흐름을 꼽는 이유도 여기에 있다. 잉여현금흐름이란 영업으로 벌어들인 현금(영업활동 현금흐름)에서 사업에 필수적인 설비투자 지출액(CAPEX)을 빼고 남은 현금으로, 기업은 이 돈을 바탕으로 현금배당 액수를 정한다.주당순이익(EPS) 등 수익성이 더 좋아질 여지가 있는지도 확인해야 한다. 수익성이 과거보다 후퇴하는 상황이라면 적극적으로 주주 배당을 늘리기 쉽지 않기 때문이다. 증권가에선 이런 관점에서LG유플러스·SK텔레콤·KT&G 등 전통적인 배당주와 금융주,LG·HDC현대산업개발·한국타이어앤테크놀로지·네이버·에스엘 등을 투자 유망한 배당주로 꼽는다.조재운 대신증권 연구원은 “시장 반등 가능성이 낮은 환경에선 배당 중심의 투자 전략이 유리하기 때문에 재무건전성과 수익성 전망이 양호하면서 안정적인 배당을 유지하는 종목의 선호도가 높아질 것”이라고 관측했다.당신의 돈에 관한 모든 이야기, 투자 인사이트를 드립니다. 돈 되는 '머니 정보' 더중플에서 더 많이 확인할 수 있습니다.JP모간 “AI수혜주 바뀔 것”…한국 반도체 힌트 담겼다https://www.joongang.co.kr/article/25296573계엄 위기가 ‘밸류업 시험대’…월가 전문가들이 본 K증시https://www.joongang.co.kr/article/25298509올 수능 1등급 받은 ‘추론AI’…‘탈 엔비디아’ 시나리오 나왔다https://www.joongang.co.kr/article/25295728“월 40만원이 40억 된다” 1조 부자 된 청소부 비결https://www.joongang.co.kr/article/25293806"
