date,title,content
2022-07-11,"구미대, 대구 동성로핫축제 체험부스 인기몰이","구미대학교가 8일 대구 동성로에서 열린 ‘2022 동성로핫축제’의 체험부스에 참가해 다양한 체험행사를 선보였다.동성로축제의 일환으로 올해 처음 썸머축제로 개최된 동성로핫축제는 8일부터 10일까지 3일간 열린다.옛 대구백화점 앞 거리에 마련된 체험부스에는 구미대 4개 학과 30여 명이 참여했다.헤어메이크업네일아트과의 ▲헤어스타일링 ▲붙임버리 ▲네일아트 체험, 의료뷰티맞춤화장품과의 ▲디지털 피부진단 ▲향카드 제작 ▲천연비누 제작 체험 부스에는 여성은 물론 시민들의 발길이 이어졌다.비주얼게임컨텐츠스쿨과 신설학과인 웹툰애니메이션스쿨이 마련한 ‘웹툰&게임캐릭터 드로잉’ 체험부스에는 청소년들이 대거 몰리며 큰 인기를 모았다.이날 구미대 천무응원단은 중앙무대에서 치어리딩 공연을 펼쳐 관객의 뜨거운 박수를 받았다. 천무응원단은 치맥페스티벌에서 개막식 공연 등 매일 2회, 동성로핫축제 매일 1회 공연으로 바쁜 일정을 소화하고 있다.신혜경 구미대 대외협력처장은 “대프리카로 유명한 대구지만 시민들의 적극적인 호응과 젊은이들의 뜨거운 열정이 무더위를 잊는 멋진 축제를 만든 것 같다”며 “우리 학생들이 열심히 준비한 만큼 축제에 참여한 많은 시민들에게 즐거움과 추억을 가득 전해주길 바란다”고 말했다.동성로핫축제는 대구의 대표적 축제인 치맥페스티벌(6~10일)과 파워풀대구페스티벌(9~10일)과 함께 3개 축제가 동시에 열려 지역 축제의 열기를 한껏 끌어올리고 있다."
2022-02-12,"대구 뜬 홍준표·이준석 브로맨스…양손 번쩍들며 ""오직 윤석열""","이준석 국민의힘 대표와 홍준표 선거대책본부 상임고문이 '보수의 심장' 대구를 찾아 원팀행보를 보였다. 지난해 말까지만 해도 윤석열 대선후보와 파열음을 빚던 두 사람은 한목소리로 ""오직 2번 윤석열""을 외치며 정권교체를 위해 의기투합했다.이 대표와 홍 상임고문은 12일 오후 7시 30분쯤 대구 중구 동성로를 함께 찾아 40분간 약 300m 거리를 걸으며 시민들에게 정권교체의 필요성을 강조했다.이준석 국민의힘 대표와 홍준표 선대본 상임고문이 12일 오후 대구 중구 동성로를 함께 찾아 지지자들에게 손을 들어 인사하고 있다. 연합뉴스홍 상임고문은 시민들에게 ""정권교체를 이번에는 꼭 좀 했으면 좋겠다""며 ""우리 윤석열 후보를, 대구·경북뿐만 아니라 대한민국 젊은이들이 2번으로 통일해주시면 청년들에게 꿈과 희망 있는 나라 되도록 하겠다""고 말했다.그러면서 ""우리 후보 모시고 대구 와서 대구·경북의 현안들에 대해서 약속을 받고 우리가 집권하게 되면 대구·경북의 모든 현안을 5년 이내에 바로 처리할 수 있도록 하겠다""고 덧붙였다.또 ""그동안 침체하고 어려웠던 대구 경북이 다시 한번 활기를 되찾고, 다시 도약하고 새롭게 대한민국의 중심이 될 수 있도록 제가 이준석 대표와 함께 열심히 노력하도록 하겠다""고 했다.이 대표는 옛 대구백화점 앞 광장에 잠시 멈춰서 ""홍준표를 사랑하는 대구시민 여러분 윤석열도 사랑하시죠. 이준석을 아껴 주시는 대구시민 여러분 윤석열을 사랑하시죠""라며 ""지금까지 문재인 정부에서 대한민국 국민을 이렇게, 저렇게 갈라치기를 했다""고 목소리를 높였다.이어 ""대한민국 정치에서 동서를 갈라치고 세대의 분열을 조장하는 그런 정치가 사라지고 비슷한 고민하는 사람끼리 힘을 합쳐야 하지 않겠습니까""라며 정권교체를 위한 지지를 호소했다.두 사람은 유세가 끝난 뒤SNS로 옮겨가 '브로맨스'(?)를 과시하기도 했다. 홍 상임고문이 ""유세장에 갔더니 밤인데도 1000여명이 모인 가운데 이 대표의 육성 연설은 카랑카랑했다""며 ""이번 대선의 씬스틸러로 충분한 자질이 보인다""고 이 대표를 치켜세웠다.이 대표는 홍 상임고문의 글을 공유하며 ""홍 상임고문님 모시고 동성로 다녀왔더니 (홍 상임고문을) 보러온 분들로 동성로가 인산인해였다""며 ""앞으로도 잘 모시겠다. 감사하다""고 했다.한편 이날 두 사람은 선거법에 따라 마이크를 사용하지 않고 육성으로만 시민들을 향해 연설했다. 두 사람을 보기 위해 몰린 지지자와 시민들이 뒤엉켜 동성로 일대가 한때 혼잡을 빚기도 했다.0초0초광고 후 계속됩니다.다음 동영상subjectauthor취소대구 뜬 홍준표·이준석 브로맨스…양손 번쩍들며 ""오직 윤석열""중앙일보재생1,526재생 (space/k)재생02:330:00:00재생 (space/k)재생음소거 (m)음소거00:00/02:33실시간설정전체 화면 (f)해상도자동 480p자막사용 안함재생 속도1.0x (기본)인기 구간 표시해상도자동 (480p)1080pHD720pHD480p360p270p144p자막설정사용 안함옵션글자 크기배경색재생 속도0.5x1.0x (기본)1.5x2.0x죄송합니다. 문제가 발생했습니다. 다시 시도해 주세요.도움말음소거 상태입니다.도움말라이선스디버그 정보 다운로드고화질 재생이 가능한 영상입니다.설정에서 해상도를 변경해보세요.더 알아보기00:00"
2024-04-12,“기억은 힘이 세다” 세월호 10주기…대구시민이 되새기는 그날,"13일 대구 중구 동성로에서 세월호 참사 10주기 대구시민대회가 열린다. 대구416연대 제공세월호 참사 10주기를 앞두고 대구에서 다양한 추모 행사가 열린다.‘세월호 참사 10주기 대구시민위원회’는 12일 “세월호 참사가 발생한 지 벌써 10년이 됐다. 세월호 참사 진상규명, 책임자 처벌, 생명존중 안전사회 건설을 위해 함께 했던 모두의 마음을 모아 추모 행사를 연다”고 밝혔다. 이 단체는 세월호 참사 10주기를 맞아 대구416연대 등 100개 단체, 개인 571명이 꾸린 연대체다.12일 하루 동안 대구시 중구 독립영화전용관 오오극장에서 ‘세월호 10주기 특별전’이 열린다. 세월호 참사, 대구 지하철 참사 등 사회적 참사를 다룬 영화 ‘세월: 라이프 고즈 온’,세월호 참사 10주기를 다룬 다큐멘터리 ‘세 가지 안부’ 등을 상영한다. 이날 저녁 7시 수성구 덕호아트홀에선 세예모(세월호를 기억하는 대구 예술인 모임)가 ‘다시 시작되는 노래’를 주제로 클래식 공연을 연다.13일 중구 동성로 시지브이(CGV)대구한일극장∼옛 대구백화점 앞 거리에선 대규모 추모 행사가 열린다. 오후 2시부터 4시까지 세월호 참사를 기억하고 추모하는 ‘생명·안전 거리 부스’가 차려진다. 이곳에선 추모의 노란 바람개비 만들기, 안전 사회를 바라는 인증샷 찍기 등을 할 수 있다. 오후 5시부터 옛 대구백화점 앞 광장에서 ‘진실·책임·생명·안전을 위한 대구시민대회’가 열린다. 대구시민대회에선 지난 10년을 기억하는 노란색 대형 종이배가 띄워질 예정이다.참사 당일인 16일엔 오전 11시부터 저녁 7시까지 시지브이(CGV)대구한일극장∼옛 대구백화점 앞 거리에 추모 분향소가 마련된다.세월호 참사 10주기를 앞두고 대구에서 다양한 추모 행사가 열린다. 대구416연대 제공"
2023-05-17,대구서 ‘군’에 끌려가 모진 고문…“5·18 정신 전국화해야 사회 통합”,"당시 시위 중 체포된 대학생 김균식씨지난 12일 대구시 중구 5·18민주화운동부상자회 경상·강원지부 사무실에서 <한겨레>와 만난 김균식 지부장. 김규현 기자“피범벅 된 나를 밟고 또 짓밟는데, 그 사람들 충혈된 눈동자와 살기 띤 얼굴이 아직도 기억납니다.”지난 12일 대구시 중구 5·18민주화운동부상자회 경상·강원지부 사무실에서 <한겨레>와 만난 김균식(65) 지부장은 43년 전 기억을 힘겹게 떠올렸다. 1980년 5월14일 오후 계명대 재학생이던 김 지부장은 대구 중구 옛 대구백화점 본점 앞 광장에서 시위를 벌이다 같은 학교 총학생회장 배희진(69)과 함께 체포됐다. 처음 70일가량은 모진 고문에 시달렸다고 한다. “옷부터 벗기기 시작하더니 무릎을 꿇린 뒤, 무릎 사이에 각목을 끼우고 양쪽에 올라타 사정없이 밟아댔습니다. 토하고, 기절하고, 다시 깨어나기를 반복했습니다.” 그는 결국 포고령 위반 및 소요죄로 징역 2년을 선고받았다.김 지부장이 체포되던 날 대구백화점 앞에서는 “비상계엄 철폐” 등을 요구하는 경북대·계명대·영남대 3개 대학의 연합 시위가 계획돼 있었다고 한다. 계명대생 700여명은 이날 오후 3시께 대구백화점 앞에 가장 먼저 도착했지만 순식간에 진압당했다. 지휘부가 체포됐다는 소식을 들은 학생들은 곧장 남부경찰서로 몰려가 “구속 학생 석방하라”, “전두환 물러가라” 등을 외치며 시위를 이어갔다. 하지만 당시 김씨와 총학생회장이 붙잡혀간 곳은 제50보병사단 연병장이었다.“평소 경찰은 시민들이 지나갈 수 있는 길을 열어줬는데, 그때는 사방을 빈틈없이 에워싸고 ‘토끼몰이’ 하듯 달려들어 진압봉을 휘둘렀습니다.” 그는 당시 시위 진압 주체가 경찰이 아닌 군인이라고 기억했다.1980년 5월14일 계명대 학생들이 교문 밖으로 진출을 시도하는 모습을 찍은 <매일신문>의 사진 보도. 5·18민주화운동부상자회 경상·강원지부 제공그날의 3개 대학 연합 시위는 실패로 돌아갔다. 경북대, 영남대 학생들도 각각 거리시위에 나서 대구 중심가까지 진출했지만, 교수들 설득에 대부분 학교로 돌아갔다. 계명대 지도부가 연행됐다는 소식에 일부 학생들만 남아 시내에서 산발적인 시위를 벌였다. 국가기록원 자료를 보면, 당시 50사단으로 연행된 이들은 147명인데, 여기엔 민간인 56명이 포함됐다. 계명대에는 15일 자정 전국 첫 휴교령이 내려졌다.김 지부장은 1998년 5·18국가유공자로도 인정받았다. 그는 “5·18민주화운동의 시공간적 범위를 ‘80년 5월’과 ‘전국’으로 확장해야 한다”고 강조한다. “광주·전남에 견줄 바는 아니지만, 타지역에서 겪은 육체적·정신적 고통은 상당했습니다. 대구·경북의 80년 5월 투쟁을 기록으로 남기고 싶습니다. 이렇게 5·18 정신을 확장해야 사회통합도 가능합니다.”"
2023-04-10,"세월호 참사 9주기…대구4·16연대, 기억과 약속 주간 선포","대구4·16연대는 10일 오전 대구시청 동인청사 앞에서 기자회견을 열어 “안전 사회를 향해 반드시 진실을 밝히겠다. 세월호 참사 9주기 기억과 약속 주간을 선포한다”고 밝혔다. 김규현 기자세월호 참사 9주기를 앞두고 대구에서 ‘기억과 약속 주간’ 행사가 열린다.대구4·16연대는 10일 오전 대구시청 동인청사 앞에서 기자회견을 열어 “안전 사회를 향해 반드시 진실을 밝히기 위한 ‘세월호 참사 9주기 기억과 약속 주간’을 선포한다”고 밝혔다. 이들은 “2014년 4월16일 이전과 이후를 다르게 만들려고 다짐하고 분투했지만 안전한 사회를 향한 기대는 지난해 10월29일 이태원 참사 앞에 무너지고 말았다. 우리는 반복되는 사회적 참사의 고리를 끊기 위해 참사로 눈물 흘리는 모든 분과 함께하겠다”고 말했다.이들은 또 “세월호 참사의 진실을 밝히려는 싸움은 아직 끝나지 않았으며, 국가의 존재 이유와 책임을 묻는 과정이 여전히 진행 중이다. 우리는 세월호참사의 진상 규명과 책임자 처벌을 위한 활동을 멈추지 않겠다. 정부와 국회에 사회적참사특별조사위원회 활동 결과에 따른 후속 조처를 요구하고 이행 여부를 지켜볼 것”이라고 강조했다.정금교 대구4·16연대 공동대표는 “애도로 보내야 할 지난 9년은 투쟁의 기간이었다. 더는 세월호 참사를 분노로 기억하지 않길 바란다. 정부가 제대로 된 진상 규명을 하고, 안전한 사회를 약속할 때 우리는 비로소 온전히 추모할 수 있다”고 말했다.‘기억과 약속 주간’은 9일부터 16일까지다. 이들은 대구 도심 곳곳에 세월호 참사를 추모하는 펼침막을 건다. 15일에는 대구시 중구 동성로 옛 대구백화점 앞에서 ‘세월호 참사 9주기 대구시민대회’를 연다. 15∼16일에는 이곳에 추모 분향소를 마련한다.지난달 29일 대구4·16연대는 씨지브이대구한일극장에서 ‘4·16가족극단 노란리본’의 연극 도전기를 담은 다큐멘터리 영화 ＜장기자랑＞ 시사회를 열었다. 지난 2일에는 세월호 참사 가족들과 함께 시민 66명이 ‘리멤버 0416 마라톤’을 꾸려 대구국제마라톤대회에 참가했다."
2022-04-15,“다시 돌아온 여덟번째 봄” 전국 곳곳서 세월호 8주기 행사,"광주여고 학생들이 세월호 참사 희생자들을 잊지 않겠다며 만든 노란 리본. 광주시민상주모임 제공세월호 참사 8주기를 맞아 희생자를 추모하고 기억하는 행사가 전국 곳곳에서 열린다.4·16세월호참사가족협의회와 4·16연대는 15일 경기도 안산문화광장(썬큰광장)에서 4·16안산시민연대와 함께 <세월호참사 8주기 기억문화제-다시, 빛>을 진행한다. 체험행사, 청소년 참여행사, 기억문화제 등을 마련했다. 1000명의 시민합창단과 뮤지컬 배우들이 함께 꾸민 주크박스 합창뮤지컬 <다시, 빛>도 공연한다. 16일에는 안산 화랑유원지 제3주차장에서 ‘세월호참사 8주기 기억식’이 열리고, 안산 단원구 교육원 앞 4·16 광장에서는 4·16민주시민교육원이 ‘기억 공감 음악 여행’ 공연을 한다.16일 세월호가 침몰했던 전남 진도 맹골수도 바다에서는 선상 추모식이 열린다. 지난 10일 1차 추모식에 이어 두번째로 열리는 이날 선상 추모식엔 유족 40여명이 참석한다. 이들은 추모식을 한 뒤 목포해경 부두에 도착해 목포 신항 세월호 거치 장소에서 묵념과 헌화 행사를 한다. 목포 신항에선 세월호 8주기 기억식이 열리고, 광주·전남지역 세월호 활동가 등은 전남 진도 ‘팽목 세월호 기억공간’ 앞에서 ‘세월호 기억공간 지키기 캠페인’을 한다.제주도교육청이 14일부터 29일까지 세월호 참사를 기억하고 추모하기 위한 ‘세월호 8주기 추모 기간’으로 정하고 교육청 1층 로비에 노란 리본이 달린 나무와 화분을 비치해 추모공간을 만들었다. 제주도교육청 제공천주교 광주대교구 정의평화위원회도 17일 오후 3시 전남 목포시 산정동 성당에서 세월호 참사 8년 기억 미사를 봉행한다. 목포 원도심 갤러리나무에선 30일까지 ‘기억의 봄, 열다’전을 연다. 광주시민상주모임은 광주시 동구 5·18민주광장에 세월호 참사 희생자를 기리는 시민분향소를 설치해 17일까지 운영한다.세월호가 향하던 제주에서는 15일 제주시 봉개동 세월호 제주기억관에서 ‘우리는 세월호를 노랑노랑해with청소년’ 추모 행사가 시작됐다. 17일까지 이어지는 추모 행사는 분향소 운영과 함께 전시, 공연, 영화제, 먹을거리 부스와 청소년 체험부스 등이 마련됐다.16일 서울시의회 앞에서는 ‘생명안전 사회를 향한 굳센 연대 세월호 참사 8주기 서울시민 촛불 문화제’가 열린다. 서울시의회 앞에는 지난해 7월 광화문광장 정비공사로 철거된 세월호 기억공간이 임시로 설치돼 있다. 같은날 대전현충원 순직공무원묘역에서는 세월호 참사 때 순직한 10명의 교사와 세월호 구조헬기 추락사고로 숨진 5명의 소방관을 추모하는 기억식이 진행된다.광주시 동구 5·18민주광장에 설치된 세월호 참사 희생자를 기리는 시민분향소. 광주시민상주모임 제공세월호 부산대책위원회는 15일 부산진구 서면 쥬디스태화쇼핑몰 근처의 하트 조형물 사거리에서 세월호 참사 8주기 부산시민문화제 ‘다시 피는 꽃으로, 여덟 번째 봄’을, 대구4.16연대는 같은날 중구 동성로 옛 대구백화점 앞 광장에서 ‘세월호 참사 8주기 기억·약속·책임 대구시민대회’를 연다. ‘세월호 참사8주기 추모제 경남 준비위원회’도 16일 창원시 성산구 상남동 분수광장에서 ‘기억·약속·책임’을 주제로 추모문화제를 마련했다.한편 경기도교육청은 4월 한 달을 세월호 추모 기간으로 정하고 남북부 청사와 직속 기관, 교육지원청, 학교 등에서 노란 리본 달기, 추모글 남기기, 학생 교육 활동 등 추모 행사를 진행 중이다. 제주도교육청, 부산시교육청, 강원도교육청, 대구시교육청도 각각 세월호 참사 추모주간을 운영해 다양한 추모 행사를 열고 있다."
2022-04-13,“다시 돌아온 여덟번째 봄” 세월호 8주기 대구서도 추모 물결,"15일∼16일 동성로에서 시민 분향소 운영13일 세월호 참사 8주기를 앞두고 대구시내 곳곳에 추모 펼침막이 걸렸다. 김규현 기자“다시 돌아온 여덟번째 봄, 우리는 여전히 너희들을 기억해.”세월호 참사 8주기를 앞두고 대구시내 거리 곳곳에 희생자를 추모하는 펼침막이 걸렸다.대구4.16연대는 13일 “세월호 참사 8주기 기억과 약속의 주간을 선포한다. 세월호 참사 진상규명 완수와 책임자 처벌로 피해자들의 고통을 매듭짓고, 생명과 일상이 지켜지는 안전한 사회에서 살아갈 수 있기를 기원하는 대구시민들의 염원을 담아 8주기 추모 행사를 준비했다”고 밝혔다.이들은 15일 낮 12시부터 16일 저녁 7시까지 대구 중구 동성로 옛 대구백화점 앞 광장에서 세월호 참사 희생자 추모 분향소를 운영한다. 15일 저녁 7시에는 같은 장소에서 ‘세월호 참사 8주기 기억·약속·책임 대구시민대회’를 연다. 이 자리에는 단원고 2학년5반 고 오준영 학생의 아버지 오홍진씨가 함께한다. 17일에는 대구 중구 바보주막에서 세월호 참사 8주기 부활절 연합 예배를 열고, 21일에는 대구 중구 대구4.16연대 사무실에서 4.16재단이 발간한 <세월호 참사 판결·특수단 1차 수사결과 비평집> 북콘서트를 연다. 22일에는 대구 중구 대구시민공익활동지원센터 상상홀에서 ‘노동자와 시민의 생명과 안전을 위한 지방정부의 역할’이라는 주제로 토론회를 열 예정이다.대구시교육청도 11일부터 16일까지 세월호 참사 8주기 추모 주간으로 정하고, 노란 리본과 추모 배너 등을 설치하라고 각 학교에 안내했다.대구4.16연대는 오는 15일 대구시 중구 동성로 옛 대구백화점 앞 광장에서 세월호 참사 8주기 대구시민대회를 연다.글·사진 김규현 기자gyuhyun@hani.co.kr"
