date,title,content
2022-11-01,대구백화점 본점 매각 결렬... 2000억원대 잔금 지불 못해,"지난해 6월 30일 대구백화점 본점 앞에서 시민들이 백화점의 마지막 모습을 담기 위해 셀카를 찍고 있다./뉴시스대구 번화가 동성로의 상징이었던 대구백화점(대백) 본점 매각이 무산됐다. 지역 대표 백화점으로 만남의 장소였던 대백은 대형 백화점 진출 등으로 매출이 줄고 코로나 직격탄을 맞으면서 지난해 6월 문을 닫았다. 이후 대백 측은 본점 및 부지 매각을 위해 부동산 개발업체와 자산 양수도 계약을 체결했지만, 업체 측에서 대금 지불을 제대로 하지 못하면서 계약이 결렬됐다.대구백화점은 “부동산 개발업체인 ‘제이에이치비홀딩스’와 체결했던 매각 계약이 결렬됐다”고 1일 밝혔다. 지난 1월 제이에이치비홀딩스는 대백과 자산 양수도 계약을 맺고 2125억원에 대백 본점과 부지를 매수하기로 했다. 당시 제이에이치비홀딩스는 계약금 50억원을 지불했고, 올해 6월까지 중도금 300억원, 11월까지 잔금 1775억원을 지급하기로 했다.하지만 제이에이치비홀딩스는 예정했던 기한까지 중도금을 납부하지 않았다. 이 업체는 “중도금을 잔금과 함께 지급하겠다”며 계약 내용을 변경했으나, 지난달 31일로 정정한 기한에도 돈을 지불하지 않았다고 한다. 결과적으로 대백 측은 먼저 지급된 계약금 50억원만 받은 셈이 됐다.본점 매각이 결렬되면서 대백 측이 구상했던 신규 사업 투자도 일정 부분 차질을 빚게 됐다. 대구백화점 관계자는 “중도금 등 지급 일정을 두 차례 가량 연기해줬지만 업체 측이 기한을 지키지 않아 계약이 결렬됐다”면서 “새로운 매수자를 찾아 본점 매각을 진행할 방침”이라고 말했다.대백은 지난 1944년 고(故) 구본흥 명예회장이 창업한 ‘대구상회’를 전신으로 둔 향토백화점이었다. 1969년 대구 동성로에 문을 연 대백 본점은 당시 대구 최고층인 지하 1층, 지상 10층 건물로 자리잡으며 동성로 시대를 열었다. 대구 시민들이 약속을 할 때 “대백에서 만나자”고 할 만큼 상징적 장소가 됐다.2002년 대백 본점은 단일 점포로 2700억원이 넘는 매출을 올렸다. 하지만 이후 대구에 롯데백화점, 신세계백화점 등이 들어서면서 매출이 1000억원 아래로 떨어졌고, 결국 지난해 6월 문을 닫았다. 현재 대백의 명맥은 중구 대봉동에 위치한 ‘대백프라자’가 잇고 있다. 본점이 폐점하면서 대백프라자는 대구에 남은 마지막 향토 백화점이 됐다."
2022-01-20,대구백화점 본점 매각됐다...철거 뒤 개발 예정,"매각돼 철거될 운명인 대구백화점 본점 전경. /연합뉴스대구 번화가인 동성로의 상징이자 대구 유통업계를 선도했던 대구백화점(대백) 본점 건물과 토지가 매각돼 곧 철거될 전망이다.대구백화점은 20일 공시를 통해 중구 동성로 본점 건물과 토지를 2125억원에 제이에이치비홀딩스에 양도한다고 밝혔다. 이는 대백의 자산 총액 대비 약 41% 수준이다.메수자 측인 제이에이치비홀딩스는 전국 상가MD,컨설팅, 시행을 전문으로 하는 제이에이치비개발을 모태로 한 기업으로 주로 주상복합 시행을 통해 수익을 거두는 회사로 알려졌다.양도기준일과 등기예정일은 오는 11월30일이다. 제이에이치비홀딩스측은 이후 건물을 철거한 뒤 주상복합건물이나 오피스텔로 개발할 예정이다. 제이에이치비홀딩스 측은 “대구시와 중구의 발전을 위한 형태로 개발 사업을 진행할 것”이라고 밝혔다.대구백화점 본점은 수익성 악화 등으로 개점 52년만인 지난해 7월부터 잠정 휴업에 들어갔다.대구백화점 본점은 1969년 대구 중구 동성로 중심부에 건립된 10층짜리 대형 백화점으로 영업을 시작해 1993년에는 대구백화점 프라자점을 여는 등 대구지역 유통업계의 전성시대를 열었다. 그러나 롯데백화점, 현대백화점, 신세계백화점 등 이른바 빅3사 백화점이 대구에 잇따라 진출하면서 영업부진 등쇠락의 길을 걸었다.대구백화점 측은 “본점 건물을 매각, 금융 부채를 상환하고 무차입 경영을 통해 재무구조 및 경영을 효율화 함으로써 지역 유통업계 대표주자로서 역사를 이어갈 것”이라고 밝혔다. 본점 건물은 매각됐지만 중구 명덕로 대구백화점 프라자점은 남아 영업 중이다."
2024-04-10,"롯데, 매장 오픈 4개월만에 “나가라”… 법원 “손해배상해야”","롯데쇼핑 로고./롯데쇼핑롯데아울렛과 1년간 매장 운영 계약을 맺었다가 4개월 만에 철수 통보를 받은 매장 관리자가 손해배상 소송을 내 1심에서 승소했다.서울중앙지법 민사50단독 최미영 판사는 지난 3일 매장 매니저 A씨가 롯데아울렛 운영사인 롯데쇼핑을 상대로 낸 손해배상 소송에서 “A씨에게 8500만원을 지급하라”고 승소 판결을 내렸다. 롯데 측이 일방적으로 계약을 해지하지 않았으면 매니저가 남은 기간 벌 수 있던 소득을 보전해줘야 한다는 취지다.A씨는 2021년 11월 롯데아울렛 진주점과 1년간 판매 위탁 계약을 맺고 매니저로서 한 매장을 관리하기로 했다. A씨가 한 달에 올리는 매출에 비례해 아울렛이 수수료를 지급하는 구조였다. A씨는 매장을 정상적으로 운영하며 매달 1100만~1200만원가량 수수료를 받았다.그런데 2022년 2월 롯데 측은 갑자기 매장 철수를 결정하고 A씨에게 “다음 달 31일까지 매장에서 퇴거해달라”고 요구했다. 매장 운영 4개월 만에 계약을 해지한 것이다. 이에 A씨는 근무하지 못한 8개월치 소득(8500만원)에 대한 손해배상 청구 소송을 냈다.재판의 쟁점은 계약 해지 시 A씨와 합의가 있었는지 여부였다. 롯데쇼핑의 임원은 매장 철수 5일 전 A씨에게 “힘내세요”라는 문자를 보냈고, A씨는 “해지 통보에 막막했지만 그동안 감사했고 문제없이 잘 마무리하겠다”는 취지로 답했다. 롯데쇼핑은 이를 근거로 A씨의 ‘사전 서면 동의’를 얻은 것이라고 했다. 롯데쇼핑은 또 매니저가 일할 수 있는 대체 근무지를 제시하는 등 계약 해지로 인한 피해를 최소화하려 했지만 A씨가 이를 거절했다고 주장했다.그러나 법원은 A씨의 손을 들어줬다. 재판부는 “A씨가 계약 해지 통지 전후에 명시적으로 해지에 동의한다는 의사를 표시한 적은 없다”며 “A씨가 매장 철수 절차에 협력한 것은 우월적 지위에 있는 롯데쇼핑의 요구를 거절하기 어려웠기 때문”이라고 했다. A씨가 임원에게 보낸 메시지에 대해서도 “계약 해지 통보에 동의한 것으로 확대해석하기 어렵다”고 했다.재판부는 A씨의 피해를 줄이려 했다는 롯데쇼핑의 주장도 받아들이지 않았다. 롯데쇼핑은 A씨가 일하던 진주 아울렛에서 100㎞ 넘게 떨어진 대구의 백화점 매장을 대체 근무지로 제시한 것으로 나타났다. 재판부는 “기존보다 현저히 먼 매장에서의 근무 등은 원래 계약에 따라 제공했어야 할 (진주점에서의) 근무와 동일하다고 볼 수 없다”며 “A씨가 이를 거절했다고 해서 롯데쇼핑의 배상 책임을 제한할 필요는 없다”고 했다."
2023-12-23,자선냄비도 ‘명당’이 있다,"[아무튼, 주말][아무튼, 레터]자선냄비딸랑딸랑 종소리가 들렸다. 맹추위에 몸을 움츠리고 걷다가 빨간 구세군 자선냄비를 보았다. 12월은 전통적으로 기부의 계절. 자선냄비는 가장 오래된 모금 방식이다. 행인 대부분은 그 앞을 바삐 지나갔지만 몇몇은 지폐를 꺼내 냄비에 넣었다. 그 모습을 보다가 몇 가지 궁금한 게 떠올라 구세군에 전화를 걸었다.자선냄비라는 원시적인 모금방식은 송금·ARS전화 같은 방식에 밀릴 것 같지만 그렇지 않다. 구세군은 “최근 3년간 거리 모금액(작년 기준 23억원)은 꾸준히 늘고 있다”고 답했다. 자선냄비를 열어 보면 1000원권이 68%로 가장 많고 1만원권(21%), 5000원권(10%) 순이다. ‘모금 명당’도 있는지 묻자 “수도권에서는 서울 명동성당, 잠실 트레비 분수, 강남 고속터미널이 1~3위다. 지방에서는 유동인구가 많은 부산 서면 롯데백화점, 대구 롯데백화점에서 모금이 잘 된다”고 했다.자선냄비의 첫 종소리는 1891년 미국 샌프란시스코에서 울렸다. 배가 좌초하는 바람에 난민이 된 1000여 명을 도울 궁리를 하던 한 구세군 사관이 큰 쇠솥을 들고 부두로 나갔다. 이런 글씨를 써붙였다. ‘이 국솥을 끓게 합시다(Keepthepotboiling)!’자선냄비라는 온정(溫情)의 시작이었다. 얼마 지나지 않아 성탄절에 어려움을 당한 이들에게 따뜻한 식사를 줄 만큼의 기금이 마련됐다. 한국에는 1928년 12월 서울 명동에 자선냄비가 등장했다. 그해 서울 20여 곳에서 당시 화폐로 846.67원이 모였다. 빨간색은 예수의 피를 상징한다.12월 한 달 동안 전국 330여 곳에서 자선냄비 캠페인을 하고 있다. 현금을 거의 들고 다니지 않는 시대다. 거리 모금에서 모바일 결제 등 디지털 모금이 차지하는 비율은 1%라고 했다. 기자 초년 시절에 구세군 사관을 취재한 적이 있다. 누가 자선냄비에 돈을 넣는지 궁금했다. “말쑥한 옷차림을 한 행인은 대부분 휙 지나갑니다. 허름하게 입은 사람들이 주머니 정을 베풀지요.”서울 명동 거리에서 구세군이 자선냄비 모금 활동을 하고 있다. /연합뉴스※QR코드에 휴대폰을 갖다 대거나, 인터넷 주소창에https://page.stibee.com/subscriptions/145743을 넣으면 구독 창이 열립니다. ‘이메일 주소’와 ‘존함’을 적고 ‘구독하기’를 누르면 이메일로 뉴스레터가 날아갑니다."
2022-09-19,일제강점기 대구 문화예술인 활동 조명...아동문학가 윤복진 유족 자료 기증,"윤복진의 1936년 당시 모습. /대구시일제강점기 작사가이자 아동문학가로 활동한 윤복진(1907~1991)의 유족들이 일제강점기를 포함한 근대기 대구 문화예술인들의 활동상을 조명할 수 있는 귀중한 자료들을 대거 대구시에 기증했다. 이 자료들은 그동안 윤복진의 유족들이 소장해 왔으나 대구시의 아카이브 자료 확충에 보태라며 기증한 것이다.윤복진은 대구에서 태어나 일본 호세이 대학교를 나왔으며 일제강점기와 해방기를 통틀어 윤석중과 함께 최고의 아동문학가로 평가받는 인물. 그러나 6·25전쟁 와중에 월북, 해금된 1988년까지는 일부 전문가를 제외하고는 모르고 잊혀졌던 비운의 문학가다.이번에 기증한 자료에는 윤복진의 육필노트, 필사악보 등을 비롯해 박태준 작곡, 윤복진 작사에 대구가 낳은 천재화가 이인성이 표지화를 그린 ‘물새발자옥’(1939), 윤복진이 펴낸 ‘동요곡보집’ ‘초등동요유희집’(1931), ‘현제명작곡집’(1933) 등 1920~40년대 악보집들이 다수 포함돼 있다. 이 가운데 ‘동요곡보집’은 1920년대 이름난 작사·작곡가들의 곡 35곡이 수록돼 있지만 그동안 내용이 공개되지 않은 귀중한 자료로 평가되고 있다.최남선의 '백팔번뇌' 초판본. /대구시특히 1936년 발행된 우리나라 최초의 월간 음악 평론잡지 ‘음악평론’ 4월호(윤복진 평론 게재), 1946년 창간된 아동잡지 ‘아동’ 창간호, 최남선의 ‘백팔번뇌’(1926) 등의 초판본 도서들도 있다. 대부분의 자료에는 윤복진의 친필 사인이 적혀 있다.윤복진은 일제강점기와 해방기를 통틀어 윤석중과 함께 최고의 아동문학가로 평가받는 인물이다.10대 후반이었던 1925년 방정환의 추천으로 ‘어린이’를 통해 등단한 이후 윤석중 등과 동인 활동을 하며 전국적으로 이름을 알렸다. 또 박태준, 홍난파, 박태현, 정순철 등 당대 유명 작곡가들이 윤복진의 가사에 곡을 붙였다. 박태준과는 4권의 동요집을 함께 냈던 사이다.뿐만 아니라 음악 평론, 영화와 무용 평론 활동을 활발하게 벌이는 한편 화가 이인성과 김용조, 대구 무영당백화점대표 창립자 이근무 등과도 친분이 깊었다.문화예술계에서는 이번 자료 기증으로 윤복진과 일제강점기 대구를 중심으로 활동한 문화예술인들에 대한 관심이 높아질 것으로 기대하고 있다.박희준 대구시 문화체육관광국장은 “유족이 오랜 세월 소중히 보관하시던 자료들을 대구시에 기증해 주셔서 감사드린다”며 “일제강점기 대구의 주요 문화적 거점을 중심으로 전국의 예술인들이 교유한 이야기를 찾아내 훌륭한 문화적 자원으로 재창조할 수 있을 것으로 기대한다”고 말했다."
2022-05-29,"“배가 볼록, 축하해요”… 손예진·현빈, 사진 한 장에 임신설","소속사 “배우 개인적 부분이라 확인 어렵다”배우 손예진이 29일 공개한 근황. /인스타그램동갑내기 배우 손예진·현빈(40) 부부가 결혼 두 달여 만에 임신설에 휩싸였다. 소속사 측은 “사생활이라 확인이 어렵다”며 말을 아꼈지만, 톱스타 커플답게 국내외 팬들의 관심이 쏟아지고 있다.손예진은 29일 인스타그램에 “잘 지내고 계시죠? 맛있는 점심 드시고 행복한 주말 보내세요”라는 짧은 글과 함께 사진 두 장을 공개했다. 하얀색 원피스를 입고 반려견과 산책하는 모습, 벤치에 앉아 휴식을 취하는 모습이 담긴 근황이었다.임신설은 바로 이 사진 두 장에서 시작됐다. 한 네티즌이 “배가 나왔네요. 임신 축하해요”라는 댓글을 달면서부터다. 원피스 차림인 손예진의 배 부분이 볼록 올라와 있는 것을 보고 임신을 추측한 것이었다. 그러자 게시글에는 “축하한다” “두 사람의 2세가 궁금하다” 등의 글이 쏟아졌고 해외 팬들 역시 아기와 하트 이모티콘 등을 올리며 축하 인사를 전했다.손예진·현빈 부부의 결혼식 모습. /뉴스1손예진·현빈 부부의 결혼식 모습. /뉴스1다만 소속사 측은 “배우의 개인적인 부분이기 때문에 확인하기 어렵다”며 조심스러운 입장을 보였다.손예진과 현빈은 지난 3월 31일 부부의 연을 맺었다. 2년 열애 끝에 맺은 결실이었다. 국내에서 가장 활발히 활동하는 배우이자,tvN드라마 ‘사랑의 불시착’을 함께 하며 한류를 이끌었기에 두 사람의 만남은 국내외에서 큰 화제를 불러 모았다.‘세기의 결혼’으로 불렸던 결혼식은 처음부터 끝까지 시선 집중이었다. 손예진의 어머니가 대구 한 백화점에서 1200만원대 예단 보석함을 구매했다는 사실이나, 결혼식 입장권 역할을 한 청첩장 디자인이 언론에 보도될 정도였다. 식장이었던 서울 광진구 그랜드워커힐 호텔 애스톤 하우스도 소셜미디어상에서 눈길을 끌었다.손예진·현빈 부부가 지난달 28일 신혼여행을 마치고 인천국제공항으로 귀국한 모습. /뉴스1미국으로 신혼여행을 떠난 후에도 화제성은 이어졌다. 한 중국 네티즌이 미국 뉴욕에서 포착한 손예진·현빈 부부의 사진을 공개하면서다. 이들의 결혼식을 대대적으로 보도했던 중국 매체 시나 연예는 미국에서 길거리 데이트를 즐기는 두 사람의 사진을 보도하기도 했다."
