date,title,content
2023-07-18,동성로를 버스킹 성지로…홍대처럼 ‘핫플’로 만든다,"대구 중구 동성로 곳곳에 ‘임대’ 안내문이 붙어 있다. 백경서 기자지난 13일 오전 대구 중구 동성로. 큰길 모퉁이에 있는 대형 상가도, 3층짜리 건물도 텅 비어 있었다. 골목길에 들어서자 한 집 건너 한 집꼴로 공실이었다. 쇼윈도엔 ‘임대’ 광고만 눈에 들어왔다. 동성로 ‘노른자위’에 위치한 옛 대구백화점(본점) 건물도 팔리지 않아 덩그러니 남아 있다. 대구백화점은 경기침체 여파에 2021년 문을 닫았다.동성로에서 13년 동안 옷과 구두를 팔아왔다는 김모(43)씨는 “신종 코로나바이러스 감염증(코로나19) 이후 회복이 거의 안 됐다”며 “그나마 유동인구는 다소 늘고 있지만, 온라인 쇼핑이 활성화하면서 우리 같은 로드샵 상인은 겨우 버티는 상황”이라고 말했다.한국부동산원 통계자료에 따르면 올해 1분기 대구 동성로 공실률은 중대형 상가 19.5%, 소규모 상가 14.2%, 집합 상가 11.1%로 대구 지역 평균보다 높았다. 중대형 상가는 5곳 중 1곳은 비어 있다는 의미다.동성로에서 부동산업을 하는 이준호 동성로상인회장은 “이자가 오르는 데도 장사가 잘 안되니 무작정 임대료를 올릴 수 없는 상황이다”라고 했다.대구시에 따르면 동성로는 1960년대 이후 40여 년 이상 쇼핑 중심지였다. 유동인구가 몰리니 음식점·술집·노래방 등이 줄줄이 들어섰다. ‘먹고, 마시고, 노는 게 모두 가능’한 대구 대표 상권으로 불렸다. 하지만 2000년대 이후 주변에 작은 상권이 여럿 형성되면서 명성에 조금씩 금이 가기 시작했다. 특히 온라인 플랫폼에 기반을 둔 전자상거래 발달은 동성로 쇼핑상가에 큰 타격을 줬다. 여기에 코로나19로 유동인구가 급격히 감소하면서 상업·판매시설을 중심으로 공실이 급증했다는 게 대구시 설명이다.대구시는 동성로 명예 회복과 침체한 도심 활력을 되찾기 위해 ‘동성로 르네상스 프로젝트’를 추진하기로 했다. 우선 내년까지 동성로 일대 1.16㎢를 대구 첫 관광특구로 지정한다. 젊은 층이 몰리는 ‘서울 홍대 거리’처럼 만들겠다는 복안이다. 서울 홍대 일대 1.13㎢는 2021년 12월 관광특구로 지정됐다. 관광특구로 지정되면 관광사업 등과 관련한 규제가 없거나 완화되고, 매년 30억원 정도 예산이 지원된다. 공터 내 공연·음식 제공 등이 가능해지고 관광객 유치에 기금도 투입할 수 있다. 대구시는 동성로를 글로벌 쇼핑 관광지와 버스킹 성지로 만들 계획이다.이 프로젝트에는 전문기관 컨설팅과 상인회 대상 사업설명회를 통한 상권 활성화 세부 전략도 포함됐다. 또 대구시는 도심 공실을 활용해 대구경북권 대학 도심캠퍼스를 도입해 젊은이를 모으고, 중앙로 대중교통전용지구도 경찰과 협의해 일부 해제할 방침이다. 동성로 대구백화점은 적극적인 상권 활성화 사업으로 매각 여건이 크게 개선될 것으로 기대하고 있다. 매각과정에서 걸림돌이 있다면 관련 규제 개선도 적극적으로 검토할 예정이다. 홍준표 대구시장은 “동성로를 온라인으로 대체할 수 없는 도심 상권 특유의 볼거리·놀 거리·즐길 거리를 제공하는 공간으로 재편하겠다”고 말했다.이준호 동성로 상인회장은 “지난 4월 홍 시장이 동성로를 둘러봤을 때 상인회에서 요구한 개선방안이 있다. 대구시가 이걸 프로젝트에 담아줬다고 생각한다”면서 “주차장을 늘리고 대구백화점 매각 문제도 해결됐으면 하는 게 상인들 바람”이라고 말했다."
2023-07-15,"상가 5곳 중 1곳 빈 동성로, ‘대구의 홍대거리’로 변신한다","곳곳에 '임대' 광고가 붙어있는 대구 중구 동성로 모습. 대구=백경서 기자13일 오전 대구 중구 동성로. 큰길 모퉁이에 있는 대형 상가도, 3층짜리 건물도 텅 비어 있었다. 골목길에 들어서자 한 집 건너 한 집꼴로 공실이었다. 쇼윈도엔 ‘임대’ 광고만 눈에 들어왔다. 동성로의 ‘노른자위’에 위치한 옛 대구백화점(본점) 건물도 매각이 이뤄지지 않아 현재 덩그러니 남아 있다. 대구백화점은 경기침체 여파에 2021년 문을 닫았다.━코로나19 회복 더딘 대구 동성로동성로에서 13년 동안 옷과 구두를 팔아왔다는 상인 김모(43)씨는 “신종 코로나바이러스 감염증(코로나19) 이후 회복이 거의 안 됐다”며 “그나마 유동인구는 다소 늘고 있지만, 온라인 쇼핑이 활성화하면서 우리 같은 로드샵 상인들은 겨우 버티는 상황”이라고 말했다.대구 중구 동성로의 옛 대구백화점 본점. 2021년 폐업 뒤 건물이 매각되지 않고 남아 있다. 대구=백경서 기자한국부동산원 통계자료에 따르면 올해 1분기 대구 동성로 공실률은 중대형 상가 19.5%, 소규모 상가 14.2%, 집합 상가 11.1%로 대구 지역 평균보다 높았다. 중대형 상가의 경우 5곳 중 1곳은 비어 있다는 의미다. 동성로에서 부동산업을 하는 이준호 동성로상인회장은 “이자가 오르는 데도 장사가 잘 안되니 무작정 임대료를 높일 수 없는 상황이다”며 “임차인도, 임대인도 너무 힘들다”고 하소연했다.대구시에 따르면 동성로는 1960년대 이후 40여 년 이상 쇼핑 중심지였다. 유동인구가 몰리니 자연히 음식점, 술집, 노래방 등이 줄줄이 들어섰다. ‘먹고, 마시고, 노는 게 모두 가능’한 대구 대표 상권으로 불렸다. 하지만 2000년대 이후 도시 안에 크고 작은 상권들이 여럿 형성되면서 그 명성에 조금씩 금이 가기 시작했다. 특히 온라인 플랫폼에 기반을 둔 전자상거래 발달은 동성로 쇼핑상가에 큰 타격을 줬다. 여기에 코로나19 발생으로 유동인구가 급격히 감소하면서 상업·판매시설을 중심으로 공실이 급증했다는 게 대구시 설명이다.대구지역에 코로나19 사태가 터진 2020년 2월 27일 육군 제50사단 장병들이 대구 중구 동성로 일대에 투입돼 소독작전을 실시하고 있다. 뉴스1━동성로 대구 첫 관광특구 지정한다대구시는 동성로의 명예 회복과 침체한 도심의 활력을 되찾기 위해 ‘동성로 르네상스 프로젝트’를 추진하기로 했다. 우선 내년까지 동성로 일대 1.16㎢를 대구 첫 관광특구로 지정한다. 젊은 층이 몰리는 ‘서울 홍대 거리’처럼 만들겠다는 복안이다. 서울 홍대 일대 1.13㎢는 2021년 12월 관광특구로 지정된 바 있다. 문화체육부의 관광특구로 지정되면 관광사업 등과 관련된 관계 법령의 규제가 없거나 완화되고, 매년 30억원 규모의 예산이 지원된다. 공터 내 공연·음식 제공 등이 가능해지고 관광객 유치에 기금도 투입할 수 있다. 대구시는 동성로를 글로벌 쇼핑 관광지와 버스킹 성지로 만들 계획이다.이 프로젝트에는 전문기관 컨설팅과 상인회 대상 사업설명회를 통한 상권 활성화의 세부 전략도 포함됐다. 또 대구시는 도심 공실을 활용해 대구경북권 대학 도심캠퍼스를 도입해 젊은이들을 모으고, 중앙로 대중교통전용지구도 경찰과 협의해 일부 해제할 방침이다. 동성로 대구백화점의 경우 적극적인 상권 활성화 사업으로 매각 여건이 크게 개선될 것으로 기대하고 있다. 매각과정에서 걸림돌이 있다면 관련 규제 개선도 적극적으로 검토할 예정이다.홍준표 대구시장은 “동성로를 온라인으로 대체할 수 없는 도심 상권 특유의 볼거리·놀 거리·즐길 거리를 제공하는 새로운 공간으로 재편해 도심을 되살리겠다”고 말했다.이준호 동성로 상인회장은 “지난 4월 홍 시장이 동성로를 둘러봤을 때 상인회에서 요구한 개선방안이 있다. 대구시가 이걸 프로젝트에 담아줬다고 생각한다”면서 “장기적으로는 주차장을 늘리고 대구백화점 매각 문제도 해결됐으면 하는 게 상인들의 바람이다”고 말했다."
2023-04-12,상폐 가능성 있는데 42곳이 공시 누락…못 믿을 사업보고서,"지난 10일 여행 전문업체 롯데관광개발 주가가 이날 하루에만 11% 폭락했다. 감사보고서에 ‘계속 기업 관련 중대한 불확실성’ 강조사항이 적시됐다는 사실이 뒤늦게 알려지면서다. 해당 사항은 외부감사인(회계법인)이 과다 부채나 현금 유동성 부족 등으로 지속가능한 기업 운영이 어려울 수 있다고 강조한 내용이다. ‘투자 유의’ 메시지를 전하는 핵심 정보인 만큼 규정상 사업보고서 본문에 기재해야 하지만, 이를 누락한 것이다.이처럼 투자상 중요한 정보를 누락 공시한 기업이 적지 않다. 중앙일보가 10일까지 ‘2022 사업연도 사업보고서’를 제출한 코스피·코스닥 상장사 2456곳의 사업보고서를 전수조사한 결과, 총 42곳이 외부감사 관련해 작성 규정을 어긴 채 사업보고서를 공시했다.그래픽=박경민 기자minn@joongang.co.kr회계장부를 신뢰할 수 없다는 감사인의 의견인 비적정 감사의견(한정·의견거절)을 아예 기재하지 않거나, 비적정 감사의견이 제시된 근거, 계속 기업 관련 불확실성 등 핵심 강조사항을 누락한 곳도 상당수였다.‘계속 기업 관련 불확실성’을 누락한 상장사는 대구백화점·롯데관광개발·상상인인더스트리 등 31곳이었다. ‘비적정 감사의견 지적사항’을 누락한 곳은KH건설·KH전자·버킷스튜디오 등 21개사였다. 이를 모두 누락한 회사는 카프로·일정실업·KH필룩스 등 10곳이나 됐다.사업보고서 내 외부감사 관련 공시는 투자 판단에 있어 신호등 역할을 한다. 기업의 재무 건전성과 투명한 자금 운영 등을 회계법인이 감사한 결과인 만큼 기업의 체질과 건전성을 판단할 수 있는 지표여서다.금융감독원에 따르면 감사의견으로 적정을 받더라도 계속 기업 불확실성이 지적된 상장사는 향후 상장 폐지되거나 비적정 감사의견을 받을 확률(13.3%)이 지적을 받지 않은 기업(2.1%)에 비해 약 6배 높았다. 금융당국이 올해 계속 기업 불확실성 관련 사항 누락 여부를 점검하겠다고 밝힌 배경이다.금감원의 기업공시 서식작성기준에 따르면 비적정 감사의견을 받은 상장사는 사업보고서 본문(Ⅴ. 회계감사인의 감사의견 등)에 관련 지적사항과 재무제표에 미치는 영향을 요약해 기재해야 한다. 이런 내용이 없을 때만 ‘해당 사항 없음’ 등으로 표기해야 한다. 또 ‘계속 기업 관련 중요한 불확실성’ 관련 사항도 감사보고서 강조사항 등에 기재해야 한다.강대준 인사이트파트너스 회계사는 “감사의견 적정은 재무제표가 회계기준에 맞게 작성됐다는 의미이지, 부실기업 여부를 알려주는 의견이 아니다”며 “적정 의견을 받았더라도 계속 기업 관련 불확실성 강조사항이 적시된 기업은 향후 기업 경영 상황이 악화할 가능성이 크기 때문에 반드시 확인하고 투자해야 한다”고 말했다."
2022-11-28,성금 아닌 라면 넣었다…대구에 퍼진 '키다리 아저씨 점빵' 정체,"'점빵'을 통해 이웃돕기가 한창인 대구. 사진은 키다리 나눔점빵의 모습. 사진 대구시대구에는 매년 적게는 2300여만 원, 많게는 1억원 이상을 익명으로 기부한 ‘키다리 아저씨’가 있다. 오랜 기간 신분을 숨겨오던 키다리 아저씨는 최근 박무근(73) 미광전업 대표이사로 밝혀졌다. 그는 27년간 20억 9000만원을 기부한 공로로 이달 초 국민훈장 동백장을 받았다.키다리 아저씨 이웃돕기 정신을 이어받은 대구 '기부·나눔 점빵'이 주목받고 있다. 연말이 다가오면서 너도나도 점빵을 통해 이웃돕기에 동참하고 있기 때문이다. 점빵은 점포, 즉 가게를 뜻하는 ‘점방(店房)’을 소리 나는 발음 그대로 쓴 것이다. 대구지역 사투리라 할 수 있다.'점빵'을 통해 이웃돕기가 한창인 대구. 사진은 키다리 기부점빵의 기부함 모습. 사진 대구시대구 점빵은 '키다리 기부점빵'과 '키다리 나눔점빵'으로 나뉘어 있다. 키다리 기부점빵은 현금 등 성금은 받지 않는다. 쌀·김·라면·비누 같은 식품과 실생활 용품만을 익명으로 기부받아 이웃에게 전한다.대구시, 백화점 등에 기부점빵 기부함 설치대구시는 지난해 7월 지역 마트와 백화점 등 7곳의 유통업체에 기부점빵 기부함을 설치했다. 주민이 마트 등에서 장을 보면서 식품이나 생필품을 하나둘 더 구매해 이 기부함에 넣도록 하자는 취지다.'점빵'을 통해 이웃돕기가 한창인 대구. 사진은 키다리 기부점빵의 기부함 모습. 사진 대구시지난 20일 대구 수성구 이마트 만촌점을 찾은 이모(56·여)씨는 장을 보면서 라면을 더 사서 기부함에 넣었다. 그는 ""연말 이웃에게 작은 보탬이라도 됐으면 해서 몇 봉지 더 샀다""고 말했다.기부함에는 어린이가 슬쩍 넣고 간 듯 사탕이 기부함에 담기기도 한다. 자전거나 킥보드가 기부함 옆에 세워져 있고, 유아용 내복이나 새 속옷이 들어있을 때도 있다. 대구시 측은 ""연말이 다가오면서 기부품이 더 다양해지고 늘었다""며 ""기부함 한 곳당 한 달에 30만 원어치 담기는 정도에서 최근 150만 원어치가 모이기도 한다""고 전했다. 이들 기부품은 저소득 가정에 나눠준다.나눔점빵도 이웃에 큰 버팀목지난해 2월 처음 등장한 키다리 나눔점빵 역시 어려운 이웃에게 든든한 버팀목이 되고 있다. 나눔점빵은 슈퍼마켓 등을 중심으로 대구에 11곳이 있다.'점빵'을 통해 이웃돕기가 한창인 대구. 사진은 키다리 나눔점빵의 모습. 사진 대구시나눔점빵에서는 특히 생활이 어려운 이웃에 물품을 나눠준다. 기초생활수급자 등이 읍면동사무소에서 3만원 상당의 이용권을 받아 나눔점빵을 찾으면 해당 금액만큼 생필품을 받을 수 있다. 기초생활수급자가 아니어도 경제적인 어려움을 설명하고 도움을 요청하면 이용권을 준다. 생필품 보따리에는 떡국 떡· 치약·설탕·미역 국밥·햇반·컵라면 등이 들어있다. 이와 별도로 결식 위기 가정은 나눔점빵을 찾아가 매월 2만 원어치 생필품을 직접 골라서 가져갈 수도 있다. 지금까지 나눔점빵을 이용한 결식 위기 주민은 7700명 정도다.대구시 관계자는 ""나눔점빵은 지난해 1만1600장의 이용권을 발행해 경제적 위기에 직면한 이웃을 챙겼고, 올해도 지난 10월까지 9420장의 이용권을 발행한 상태""라고 말했다.키다리 아저씨에 이웃 돕는 점빵들까지 있는 대구는 이웃돕기에 말 그대로 '진심'인 곳이다. 이를 보여주듯 신종 코로나바이러스 감염증(코로나 19) 확산 속에서도 지난해 대구사회복지공동모금회 사랑의 온도탑은 124도. 목표액(90억5000만원)을 초과해 112억1000여만원을 성금을 모았다. 대구사회복지공동모금회는 다음 달 1일 국채보상운동기념공원에서 '희망 2023 나눔 캠페인' 출범식을 연다. 올해 모금 목표액은 100억원이다."
2022-10-09,"""이틀 전부터 줄 섰어요""…판교 에르메스가 불지핀 '명품전쟁'","9일 오전 10시 경기도 성남에 있는 현대백화점 판교점. 에르메스가 지난 7일 문을 열자 입장을 대기하는 손님은 어림잡아 100명이 넘었다. 이날 오전 8시부터 줄을 섰다는 A씨는 “이미 30~40명이 먼저 도착해 있었다”며 “선착순 10명 안에 들어야 가방 구경이라도 할 텐데”라며 아쉬워했다.9일 오전 경기도 성남시 현대백화점 판교점 에르메스 매장 앞에 대기 줄이 길게 늘어서 있다. 유지연 기자━8년 만에 신규 점포, 줄 서서 입장경기권 최초이자, 국내 백화점 매장 중 최대 규모(580㎡·약 175평)인 현대백화점 판교점 에르메스 매장이 화제 몰이 중이다. 지난 2014년 롯데백화점 에비뉴엘점 이후 8년 만에 신규 점포로 오픈 이틀(5일) 전부터 백화점 앞에 진을 치는 진풍경이 연출됐다. 8~9일 연휴 기간 내내 백화점 앞에서 100여 명이 대기하는 일이 반복됐다. 온라인 명품 커뮤니티에는 “새벽 2시부터 줄서기 아르바이트를 세워 간신히 5등 안쪽으로 입장했다” “아침 10시에 왔는데 오늘 안에는 못 들어갈 것 같다” 같은 게시글이 올라왔다.현대백화점 판교점 에르메스 매장 오픈을 알리는 안내문. 사진 에르메스 홈페이지이들이 이토록 에르메스 매장에 들어가기 위한 경쟁을 하는 이유는 무엇일까. 오픈 초기인 만큼 다른 매장에서는 구하기 어려운 인기 제품을 살 수 있을 거란 기대감에서다. 에르메스는 인기 제품, 특히 가방의 경우 매장마다 재고가 충분치 않아 ‘오픈런(매장 개점 시간을 기다리다가 달려가 구매한다는 의미)’이 아니면 구할 수 없는 경우가 많다.━판교 현대, ‘에루샤’ 품는 8번째 백화점 될까현대백화점 판교점에 에르메스가 입점한다는 소식은 지난해 초부터 나왔다. 지난 2020년 연매출 1조74억원으로 국내 백화점 중 최단 기간인 5년 만에 ‘1조 클럽’에 가입하면서다. 3대 명품 브랜드로 꼽히는 에르메스·샤넬의 경우 매출이 확인되지 않은 신규 점포에 입점하지 않는 것이 불문율로 통한다. 현대 판교점은 지난해에도 1조2413억원의 매출을 올려 전국 5위 백화점으로 자리매김했다.지난해 5월에는 샤넬 임원진이 매장 출점을 위해 현대 판교점을 둘러본 것으로 확인되면서 ‘에루샤(에르메스·루이뷔통·샤넬)’를 모두 유치하는 경기권 최초 백화점이 될 것이라는 전망이 나왔다. 현대백화점 관계자는 샤넬 입점에 대해 “아직은 (샤넬 측과) 협의 중”이라고 말했다. 현재 ‘에루샤’가 모두 입점한 백화점으로는 롯데백화점 잠실점, 신세계백화점 본점·강남점·대구점·센텀시티점, 현대백화점 압구정본점, 갤러리아 명품관 7곳에 불과하다.그래픽=김경진 기자capkim@joongang.co.kr━불황에도 ‘명품’은 된다…매출 비중 높아져백화점 업계에서 ‘에루샤 파워’는 설명이 필요 없다. 지난해 연매출 1조원을 돌파한 백화점 11곳 중 ‘에루샤’ 모두를 보유한 점포 7곳이 모두 포함됐다. 대구 신세계백화점의 경우 지난해 3월 3대 명품을 갖춘 이후 연간 매출 신장률이 전년 대비 51.3%에 달했다. 업계에서는 이들 3대 명품 브랜드의 매출이 백화점 총 매출의 10%가량을 차지하는 것으로 파악하고 있다.이번 ‘판교 에르메스 오픈런’은 고물가와 경기 침체 우려에도 명품에 대한 열기가 식지 않았음을 보여준다. 실제로 백화점 매출에서 명품이 차지하는 비중은 갈수록 높아지고 있다. 신세계백화점 전체 매출 중 명품 비중은 2019년 16.7%에서 2020년 20.9%, 지난해 25.7%로 매해 증가 추세다.한 명품 업계 관계자는 “지역별 매장 총량을 엄격하게 지켜왔던 명품 업체들도 조금씩 신규 매장 출점을 고려하는 분위기”라며 “국내 명품 시장이 그만큼 커졌고, 반짝 호황으로 끝나지 않을 것이라는 의미”라고 말했다."
2022-01-15,18만원 운동화 사려고 역주행…나이키 '오픈런' 긴박했던 풍경,"[사진 유튜브 캡처]선착순으로 판매되는 정가 17만9000원짜리 나이키 운동화를 사기 위해 수십명의 사람들이 에스컬레이터를 역주행하는 등 긴박한 상황이 담긴 영상이 공개돼 논란이 일고 있다.지난 14일 유튜브에는 '대구 신세계 나이키 조던 골프 오픈런 영상(중국 아님)'이란 제목의 1분 분량의 영상이 등록됐다.영상 속 사람들은 대구 신세계백화점이 오픈하자 무질서하게 건물 2층에 위치한 나이키 골프 용품 판매장으로 향하고 있다. 선착순으로 판매되는 나이키 운동화 '에어 조던 1로우'를 사기 위해서다. 해당 매장에는 당일 100켤레의 운동화가 입고됐다.영상에 따르면 해당 매장으로 연결되는 3개의 에스컬레이터 중 매장이 있는 2층으로 연결되는 곳은 두 군데다.하나는 1층에서 2층으로 올라오는 방향이고, 다른 하나는 3층에서 2층으로 내려오고 있다. 나머지 하나는 2층에서 3층으로 올라가는 방향이다.영상 속 사람들은 3곳의 에스컬레이터를 통해 2층으로 향했다. 역주행 방향으로 에스컬레이터를 이용한 사람들이 쏟아진 것이다.수백명의 사람들이 한순간에 한 지점으로 몰렸고 영상을 촬영한 것으로 추정되는 인물은 ""좀비 실사판"" ""너무 무섭다"" ""아까 어떤 여자 박았다""라며 무질서한 상황을 전했다.커뮤니티 등에는 ""10시 30분 백화점 개방과 함께 모든 사람이 좀비처럼 폭주"" ""신발 하나에 목숨을 걸었다"" ""10시 넘어 문을 개방할 것이라는 직원의 통보와 함께QR코드 체크하는 줄이 붕괴됨"" 등의 글이 게시됐다.이날 나이키는 대구 신세계점을 포함한 전국의 40여곳의 매장에서 해당 운동화를 선착순으로 판매했다. 운동화는 매장 마다 100켤레 전후로 입고됐다.강원도 춘천에 위치한 나이키골프 매장 관계자는 ""117족이 들어와 하루 만에 다 팔렸다""고 말했다. 울산 한 백화점에 입점한 매장 측도 ""전날 95족이 들어와 1시간 만에 매진됐다""며 ""추가 입고 계획은 전혀 없다""고 했다.'나이키 오픈런' 상황을 두고 네티즌들은 ""선착순으로 판매한 나이키 잘못"" ""사고 싶은 마음은 이해하지만 에스컬레이터 역주행은 선 넘었네"" ""신발 사는 모습이 이렇게 기괴할 일인가"" 등 의견을 내놓았다.한편 백화점 입장 시QR코드 체크가 제대로 이뤄지지 않았다는 지적에 대해 대구 신세계백화점 측은 ""기다리는 고객들을 상대로 개점 10분 전에QR코드를 찍도록 조치했다""고 말했다."
