date,title,content
2022-01-15,‘농구황제 조던’ 골프화 때문에…영하 10도에 전국서 ‘나이키 노숙’ 속출 [라인업],"래플(추첨)·드롭(기습발매)·캠핑(줄서기) 이끈 나이키14일 한정판 ‘조던 골프화’ 출시, 2030 열광발매 첫날 18만→60만원대 손바뀜#에그스토리: 세상의 모든 줄서기, 라인업!지난 14일 오전 대구 신세계백화점에서 벌어진 '나이키 조던 골프화' 오픈런 영상이 소셜미디어를 통해 확산하고 있다. /유튜브 캡처13~14일 나이키 '조던 1 로우G'골프화 쇼핑에 나선 사람들이 온라인 운동화 커뮤니티에 인증한 사진들이다. /네이버 카페 '나이키매니아'14일 오전 6시30분 서울 도곡동의 ‘나이키 골프’ 매장. 영하 10도의 날씨에 ‘스니커 캠핑족’들이 풍찬노숙을 하고 있었다. ‘농구 황제’ 마이클 조던의 나이키 골프화인 ‘조던 1 로우G’(판매가 17만9000원)가 매장에 풀리는 날이었다.13~14일 나이키 '조던 1 로우G'골프화 쇼핑에 나선 사람들이 온라인 운동화 커뮤니티에 인증한 사진들이다. /네이버 카페 '나이키매니아'패딩·장갑·털모자·부츠로 중무장을 하고 서성이던 회사원 정모(31)씨는 “코로나 팬데믹 이후 골프에 흠뻑 빠졌다”며 “조던 골프화가 나온다는 말에 반차를 내고 캠핑에 나섰다”고 했다. 낚시 의자에 앉아있던 대학생 박모(22)씨는 “골프는 못 치지만, 득템하면 수십만원 프리미엄이 붙는다고 해서 나왔다”고 했다.나이키 '조던 1 로우G'골프화. 이번에 나온 골프화는 에어 조던 시리즈 중에서 가장 클래식하고 상징적인 디자인을 차용했다. /나이키농구의 신, 갑자기 골프화는 왜?농구 황제가 농구화가 아닌 골프화를 만든다는 건, 조던을 잘 모르는 사람이라면 갸우뚱할 만한 소식이다. 과장을 좀 보태면 영국 유명 셰프 고든 램지가 뼈다귀 해장국집을 차리거나, ‘골프 황제’ 타이거 우즈가 갑자기 테니스화를 출시하는 느낌이다.농구 황제 마이클 조던의 골프 스윙. /게티이미지하지만 조던은 뭘 해도 조던. 사실 그는 현역 때부터 골프 마니아였다. 시카고 불스 시절, 리그 경기가 있는 날에도 36홀 라운딩을 돌았고, 2019년에는 미국 플로리다에 자신의 등번호 23을 딴 호화 골프장 ‘그로브 23’을 열었다. 이 농구의 신(神)은 “내가 골프에 빠진 건 가장 플레이하기 어려운 종목이기 때문”이라면서, 초보 골퍼들의 마음을 어루만지기도 했다.농구 황제 마이클 조던(왼쪽)이 '골프 친구'인 미국 빌 클린턴 전 대통령과 2009년 필드에서 공을 치고 있다. /AP불 같은 승부욕으로 유명한 조던이 과거 빌 클린턴 미국 전 대통령과 골프를 친 일화도 유명하다. 월스트리트저널에 따르면 조던은 필드에서도 농구 코트처럼 18홀 내내 ‘경쟁자’ 클린턴 뒤를 쫓으며 도발했다. ‘나이스 샷’이라는 덕담 대신 “어린 소녀처럼 친다”며 상대의 멘탈을 흔들었다. 이처럼 조던과 골프 사이에는 나름대로 ‘스토리텔링’ 소재가 있다.게다가 요즘은 업종과 업태별 경계가 흐려지는 이른바 ‘빅 블러(BigBlur)’ 현상이 확산하고 있어, ‘이종(異種)’ 결합형 상품도 쏟아지는 상황. 조던의 ‘부캐’(부캐릭터)를 살린 골프화는 이런 소비 트렌드를 반영한 제품으로도 볼 수 있다.“공격적인 상대든, 방어적인 상대든나는 언제나 그에 반응하며 플레이한다.하지만 골프를 치는 건마치 거울을 보며 경기하는 것 같다.완벽에 가까워지기 위해나 자신과 끊임없이 싸우는 기분이다.조던이 말하는 ""나에게 골프란?""”농구 황제 스토리를 다룬 다큐멘터리 '마이클 조던: 더 라스트 댄스'의 한 장면. /넷플릭스전국에 속출한 ‘나이키 노숙자’▼대구 신세계백화점 ‘조던 골프화’ 오픈런 현장 영상(※소리를 켜고 보세요.)0초0초광고 후 계속됩니다.다음 동영상subjectauthor취소‘농구황제 조던’ 골프화 때문에…영하 10도에 전국서 ‘나이키 노숙’ 속출 [라인업]조선일보재생1,639재생 (space/k)재생00:410:00:00재생 (space/k)재생음소거 (m)음소거00:00/00:41실시간설정전체 화면 (f)해상도자동 480p자막사용 안함재생 속도1.0x (기본)인기 구간 표시해상도자동 (480p)480p360p270p144p자막설정사용 안함옵션글자 크기배경색재생 속도0.5x1.0x (기본)1.5x2.0x죄송합니다. 문제가 발생했습니다. 다시 시도해 주세요.도움말음소거 상태입니다.도움말라이선스디버그 정보 다운로드고화질 재생이 가능한 영상입니다.설정에서 해상도를 변경해보세요.더 알아보기00:00그런 조던 골프화가 14일 아침 출시된다는 소식이 알려지면서, 2030 남성을 중심으로 전투 쇼핑이 시작됐다. 13일 밤부터 전국 30여개 나이키 골프 매장 앞에는 신상 포획을 노리는 노숙 텐트가 들어섰다. 발매 당일 나이키 온라인 쇼핑몰은 접속자 폭주로 금세 먹통이 됐다. 온라인 운동화 커뮤니티 ‘나이키매니아’ 회원들은 기자가 새벽에 찾았던 서울 도곡동 매장뿐 아니라, 전국 매장 상황을 실시간으로 중계했다.13~14일 나이키 '조던 1 로우G'골프화 쇼핑에 나선 사람들이 온라인 운동화 커뮤니티에 인증한 사진들이다. /네이버 카페 '나이키매니아'‘대구 매장 헬(hell·지옥)파티. 싸움났음.’‘영등포 난리도 아님. 앞에서 싸움!’‘의정부, 한 사람 뛰기 시작하면서 개판.’‘일산 솔드아웃.’….13~14일 나이키 '조던 1 로우G'골프화 쇼핑에 나선 사람들이 온라인 운동화 커뮤니티에 인증한 사진들이다. /네이버 카페 '나이키매니아'그들은 왜 열광하는 걸까. 신발이 좋아서 10년 근무한 대기업을 그만두고 운동화 유튜브 채널 ‘와디의 신발장’을 운영 중인 와디(40·본명 고영대)씨는 이렇게 설명했다.“나이키가 조던 골프화를 출시한 건 이번이 처음은 아니에요. 몇 년 전까지만 해도 반응이 미지근 했죠. 그런데최근 리셀(resell·재판매) 시장에서 가격이 치솟기 시작했어요. 어린 시절 농구화와 농구 선수의 역사에 관심을 가졌던 사람들이나이가 들면서 골프를 치기 시작했거든요.나이키도 이런 수요를 읽고, 가장 상징적인 모델인 조던 1 시카고 골프화를 출시한거죠.”13~14일 나이키 '조던 1 로우G'골프화 쇼핑에 나선 사람들이 온라인 운동화 커뮤니티에 인증한 사진들이다. /네이버 카페 '나이키매니아'와디씨 말처럼 2017년에 출시된 ‘조던1 레트로 골프 클릿 시카고’는 얼마 전 국내 리셀 플랫폼에서 209만원에 거래됐다. 이번에 나온 ‘조던 1 로우G’역시 같은 플랫폼에서발매 3시간 만에 240여 켤레가 평균 63만4000원(최고가 80만원)에 재판매됐다. 노숙으로 획득한 운동화를 판매가(17만9000원)보다 3.5배 높은 금액에 되팔아, 평균 45만5000원의 수익을 낸 것이다.14일 오전 나이키 골프화 '조던 1 로우G'가 발매된지 30여분 만에 한 리셀 플랫폼에서 수십만원 프리미엄이 붙어 판매되고 있다. /네이버 크림나이키 폭풍질주, 유니클로 꺾어나이키는 지난해 국내 패션시장에 새로운 기록을 세웠다. 2021 회계연도(2020년 6월~2021년 5월) 기준 매출이 전년 대비 12.3% 증가한 1조4522억원을 달성하며, 국내 패션 단일 브랜드로는 가장 많은 연 매출을 올렸다. 이전까지는 일본 패션 브랜드 유니클로가 2019 회계연도(2018년 9월~2019년 8월)에 기록한 1조3780억원이 최대치였다.13~14일 나이키 '조던 1 로우G'골프화 쇼핑에 나선 사람들이 온라인 운동화 커뮤니티에 인증한 사진들이다. /네이버 카페 '나이키매니아'이런 열풍은 한국만의 상황은 아니다. 나이키 글로벌 전체 매출 역시 전년 대비 19% 증가한 445억달러(약 52조원)를 기록했다. 미국 투자회사 구겐하임은 올해 가장 좋은 투자 종목으로 나이키를 꼽았다. 유통업계는 이 마케팅 명가(名家)가 코로나 승자로 떠오른 비결을 분석 중이다. △'아마존’에 맞서는 소비자 직접판매(D2C) 파워 △'조던’으로 대표되는 강력한 스토리텔링 △다품종소량생산(한정판)을 통한 희소가치 창출 △발 빠른 디지털 전환 전략 등이 꼽힌다.13~14일 나이키 '조던 1 로우G'골프화 쇼핑에 나선 사람들이 온라인 운동화 커뮤니티에 인증한 사진들이다. /네이버 카페 '나이키매니아'14일 새벽 영하 10도, 나이키 노숙 현장에선 브랜드가 가진 강력한 힘을 직관적으로 느낄 수 있었다. ‘자발적’ 줄 서기는 젊은 소비자와 브랜드를 끈끈하게 엮는 도구가 된다. 신상 발매 정보를 알아내려고 홈페이지와 매장을 수시로 드나들고, 출시일에 맞춰 애타게 기다리는 체험을 통해 많은 충성 고객이 탄생해왔다. 우리는 브랜드의 노예인가, 욕망의 주체인가. 나이키 스니커즈는 “오는 15일에 에어 조던 4, 18일에 덩크 로우 할로윈 한정판을 추첨 판매한다”고 밝혔다.1월 13~14일 나이키 '조던 1 로우G'골프화 쇼핑 현장. /한경진 기자·네이버 카페 '나이키매니아'[세상의 모든 줄서기, 라인업!] 다시보기천만원 들고 백화점 개구멍 찾는 ‘샤넬 노숙자들’☞주소https://url.kr/m37xjz아침 9시부터 줄...삼각지 고깃집서 4년째 ‘갈비 오픈런’ 하는 이유☞주소https://url.kr/lztg3i"
2023-07-25,"대구 스파크랜드, 동성로 ‘핫플’로 만든다","땅집고, ‘리징 컨설팅’ 계F&B 브랜드 등 유치해 활성화복합문화공간으로 재탄생 작업대구시 동성로에 있는 대형 상업 시설 ‘스파크랜드’.땅집고 공간기획센터와 리징 계약을 맺고 복합 문화 공간으로 변신을 꾀할 계획이다./㈜도원땅집고 공간기획센터가 대구의 핵심 상권으로 꼽히는 중구 동성로 일대 대형 상업시설 ‘스파크랜드’에 대한 임대차(leasing·리징) 컨설팅 계약을 맺고 유명 음식점과 액티비티 시설 등을 유치해 핫플레이스 만들기에 나선다. 리징이란 상업용 건물에 경쟁력 있는 임차인을 입점시켜 상권을 활성화하는 것이다.땅집고 공간기획센터는 지난 20일 스파크랜드 소유주인 ㈜도원과 리징 컨설팅 계약을 맺었다고 24일 밝혔다. 스파크랜드는 대지면적 3543㎡, 연면적 2만2766㎡로 2020년 1월 개장했다. 건물 꼭대기층에 대관람차를 설치해 대구 명물로 자리잡았다.그래픽=김현국동성로 대표 쇼핑몰인 대구백화점 본점이 2021년 6월 폐점하면서 이를 대체할 시설로도 주목받았다. 다만 스파크랜드 개장 시기가 코로나 팬데믹과 맞물리면서 일시적으로 어려움을 겪었지만 올 들어 동성로 일대 상권이 살아나면서 유동인구가 다시 늘고 있다. 이동경 도원 대표는 “동성로가 여전히 대구 핵심 상권이긴 하지만 과거에 비해 상대적으로 유동 인구가 줄고 시대적 흐름을 따라가지 못하는 측면도 있다”며 “스파크랜드가 활성화하면 동성로 상권 전체에 새 바람을 일으키는 계기가 될 것으로 기대한다”고 말했다.땅집고 공간기획센터는 스파크랜드에 전국적인 인지도를 갖춘 F&B(식음료) 브랜드와 엔터테인먼트 기업을 유치해 동성로를 대표하는 복합문화공간으로 만들 계획이다. 지상 3~4층에 이른바MZ세대가 선호하는 F&B 브랜드를 입점시켜 유동 인구를 끌어모을 예정이다. 또 젊은층에게 인기있는 액티비티 기업도 입점에 관심을 보이고 있어 협의를 진행 중이다. 박진수 땅집고 공간기획센터 부장은 “스파크랜드는 놀거리가 많지만 집객 효과가 있는 먹을거리가 상대적으로 부족한 편”이라며 “건물 내 식당가에 최신 트렌드를 반영한 음식점, 카페 등 F&B브랜드를 입점시켜 자녀를 둔 가족부터MZ세대까지 모여드는 ‘핫플레이스’로 만들 것”이라고 말했다."
2023-07-06,"‘대구의 심장’, 관광특구된다...대구 동성로 르네상스 프로젝트 발표","대구시는 6일 동인청사 브리핑룸에서 '동성로 르네상스 프로젝트' 구상안을 발표했다./뉴스1대구 번화가 동성로 일대가 관광 특구로 지정될 전망이다.대구시는 6일 ‘동성로 르네상스 프로젝트’를 발표하면서 내년까지 동성로와 서성로, 남성로와 북성로 등 시내 4성로 일대 1.16㎢(35만여평)를 대구 최초 관광 특구로 지정·고시하겠다고 밝혔다.동성로는 지난 1960년대 이후 대구의 대표 상권으로 자리매김했지만, 2000년대 이후 대구시 곳곳에 별도 상권이 들어서고, 온라인 쇼핑이 발달하면서 공실이 발생하는 등 침체를 겪었다. 시는 관광·문화 산업을 개발하고 공간 개편 및 골목경제 활성화를 통해 ‘제2의 동성로 시대’를 열겠다는 방침이다.시는 먼저 동성로 곳곳에 버스킹 및 플리마켓 인프라를 조성해 청년들의 행사 공간으로 만들 계획이다. 현재 동성로 관광안내소로 쓰이는 구 중앙파출소 건물은LED전광판 등을 활용한 5층 규모의 미디어아트 관광 명소로 거듭날 전망이다. 구 중앙파출소 건물이 과거 대구백화점과 함께 대구 7080세대의 약속 장소로 쓰인 점에 착안했다. 야시골목과 로데오거리 등 주요 지점에도 이색포토존이 설치된다.청년들을 위한 공간도 지원된다. 대구시는 청년 인구 유입과 공실 문제 해결을 위해 군위·경산·하양·구미 소재 대학들을 위한 ‘도심 캠퍼스 타운’을 동성로 일대에 조성할 예정이다. 도심 캠퍼스 타운은 대학 특성과 지역 특색에 맞게 배치된다. 가령 공구골목이 있는 북성로엔 공대, 문학관이 있는 향촌동엔 인문대, 동성로 및 로데오거리엔 예술대 캠퍼스가 배치되는 식이다.이밖에도 근대건축물을 활용한 실험적 공간인 ‘청년 아지트’,공실을 단기 임대할 수 있는 ‘도심 공실 임대 디지털 플랫폼’도 조성된다. 동성로 뮤직 페스타, 동성로 청년 문화제 등 청년에게 특화된 다양한 축제도 추가로 기획될 예정이다.동성로 일대 공간 구조도 개편된다. 시는 먼저 올해 내로 경찰과 협의해 중앙로 대중교통전용지구 일부 구간을 해제해 일반 차량 통행을 허가할 계획이다. 현재 대중교통전용지구는 택시와 버스 등 대중교통만 다닐 수 있도록 제한돼있으나, 시는 구간 해제를 통해 대구 동·서간 단절을 막고 중앙로에 대한 접근성을 강화하겠다는 취지다.2·28 기념중앙공원을 비롯한 도심공원도 공연·전시를 할 수 있도록 리모델링되고, 공원을 잇는 산책길도 조성한다. 활용도가 낮았던 부지 역시 녹지공간·문화공간 등으로 특색있게 꾸며진다.한편 시는 해마다 악화되는 동성로 상권 현황과 문제 요인을 분석한 뒤, 상권 활성화 전략을 수립할 계획이다. 5년간 최대 60억원을 투입하는 중소벤처기업부의 ‘상권 활성화 사업’을 통해 동성로에 유럽풍 노천 카페 거리를 비롯한 거점 공간을 조성하는 등 골목 경제를 부활시키겠다는 목표다.홍준표 대구시장은 “동성로는 과거 대한민국의 문화를 선도했던 대구의 심장”이라면서 “온라인으로 대체할 수 없는 도심 상권의 즐길 거리를 제공해 동성로를 국내 최고의 거리로 만들겠다”고 말했다."
2022-02-13,"손잡은 홍준표·이준석, 대구서 “윤석열로 정권교체” 호소","이준석 국민의힘 대표(왼쪽)와 홍준표 의원이 12일 오후 대구 중구 동성로 옛 대구백화점 앞 광장에서 시민들을 향해 손을 들어 인사하고 있다. /뉴스1국민의힘 이준석 대표와 홍준표 선거대책본부 상임고문이 대구를 찾아 윤석열 대선후보 지지를 호소했다.그동안 윤 후보와 마찰을 빚었던 이 대표와 홍 상임고문은 12일 오후 7시30분쯤 대구 중구 동성로를 함께 찾아 약 40분간 거리를 걸으며 시민들에게 정권교체의 필요성을 강조했다.홍 상임고문은 시민들에게 “정권교체를 이번에는 꼭 좀 했으면 좋겠다”면서 우리 윤석열 후보를, 대구·경북뿐만 아니라 대한민국 젊은이들이 2번으로 통일해주시면 청년들에게 꿈과 희망 있는 나라 되도록 하겠다”고 말했다.이어 “그동안 침체하고 어려웠던 대구 경북이 다시 한번 활기를 되찾고, 다시 도약하고 새롭게 대한민국의 중심이 될 수 있도록 제가 이준석 대표와 함께 열심히 노력하도록 하겠다”면서 “우리가 집권하게 되면 대구·경북의 모든 현안을 5년 이내에 바로 처리할 수 있도록 하겠다”고 했다.이 대표는 옛 대구백화점 앞 광장에서 “홍준표를 사랑하는 대구시민 여러분 윤석열도 사랑하시죠”라며 “이준석을 아껴 주시는 대구시민 여러분 윤석열을 사랑하시죠”라고 외쳤다.그러면서 “지금까지 문재인 정부에서 대한민국 국민을 이렇게, 저렇게 갈라치기 했다”며 “대한민국 정치에서 동서를 갈라치고 세대의 분열을 조장하는 그런 정치가 사라지고 비슷한 고민하는 사람끼리 힘을 합쳐야 하지 않겠습니까”라고 했다."
2024-07-17,"경일건설, EDS 사옥 신축공사 첫 삽","경일건설(대표 이종연)이 금호워터폴리스 산단에EDS㈜ 사옥 신축공사 첫 삽을 뜬다고 11일 밝혔다.경일건설이 시공하는EDS신규 사옥이 들어설 금호워터폴리스 산업단지는 대구시에서 기회발전특구로 지정된 곳이다. 기회발전특구로 지정되면 지방에 대규모 투자를 유치할 수 있도록 지방정부와 투자협약을 체결한 기업을 대상으로 세제감면, 규제특례 등의 혜택을 받을 수 있다.금호워터폴리스는 대구시의 서남부권에 치우친 제조산업단지와 동부권의 디지털 집적단지를 연결하는 중간 거점으로, 수성알파시티와 대구국가산단에 이어 지역의 ‘제조-디지털 벨트’ 완성을 위해 반드시 필요한 도심권 핵심거점이라고 할 수 있다.EDS㈜는 2009년 설립된 이래 5G 광통신망 구축에 필요한 핵심부품 개발과 미래 청정 에너지인 태양광 고효율 에너지 저장장치를 생산, 공급하는 기업으로 친환경 스마트팜 사업에서도 앞서가는 기술력을 선보이고 있다. 금번에 금호워터폴리스 산업단지에 사옥을 신축해 더욱 안정된 거점을 기반으로 사업을 전개해나갈 예정이다.발주처 관계자는 ""현재 어려운 경기 상황에서도 경일건설의 안정된 기반과 풍부한 시공경험을 고려하여 시공사로 선택하게 되었다""고 설명했다.한편 1963년 설립한 60년 전통의 경일건설은 대구백화점, 동산병원, 어린이회관 등 대구를 상징하는 랜드마크를 비롯하여 다양한 건축시공 경험을 보유한 금탑산업훈장을 수훈한 중견기업이다."
2024-01-05,당원 3만4000명 모집한 ‘이준석 신당’…6일 대구 거리 당원 모집,"가칭 ‘개혁신당’의 창당 작업을 주도하고 있는 이준석 전 국민의힘. 사진은 이 전 대표가 지난달 27일 서울 노원구의 한 갈빗집에서 국민의힘 탈당 기자회견을 하고 있는 모습. 뉴스1가칭 ‘개혁신당’의 당원이 3만명을 넘어섰다고 5일 신당을 이끄는 이준석 전 국민의힘 대표가 밝혔다. 이로써 신당은 창당을 위한 최소 요건도 충족하게 됐다.신당의 정강정책위원장을 맡고 있는 이 전 대표는 이날 오전 페이스북에 “현재 당원 가입 현황”이라며 17개 시·도별 당원 가입 숫자를 게시했다. 지난 3일 오전부터 온라인 당원 가입을 받기 시작해 이틀 만인 이날 오전 현재 전국의 당원 숫자가 3만2745명에 달했다. 지역별로는 서울(8155명)·부산(1983명)·인천(1764명)·대구(2016명)·경기(9722명)·경북(1448명)·경남(1487명) 등 7곳에서 당원이 1000명을 넘어섰다. 이기인 신당 공동창당준비위원장은 이날 오후 국회에서 기자들과 만나 “13시까지 3만4000명이 넘는 당원이 가입했다”며 “(당원 가입) 홈페이지 개설 18시간 만에 중앙당과 5개의 시·도당 창당 요건을 충족했고, 지금까지 8개의 시·도당 창당이 가능해졌다”고 밝혔다.정당법에 따르면 중앙선거관리위원회에 정당 등록을 하려면 ‘1000명 이상의 당원을 가진 시·도당이 5개 이상’이어야 하는 만큼 창당을 위한 물리적 조건을 신당이 이미 갖춘 셈이다. 신당은 이달 중순까지 창당 작업을 마무리하겠다는 계획이다.이기인 위원장은 이날 “대한민국 역사상 가장 건실한 그리고 가장 빠른 창당의 역사라고 평가하고 싶다”고 말했다. 이준석 전 대표는 전날 “종이로 된 입당 원서를 한 장도 받지 않고 중앙당 창당 기준을 넘어선 전무후무한 시도”라며 “곧IT에 익숙하지 않은 세대, 아직 시각장애인용 페이지가 준비되지 않아 가입하지 못한 분들을 위해 종이 입당원서도 준비해서 병행하도록 하겠다”고 밝혔다.문병호(가운데) 국민의힘 서울 영등포갑 당협위원장 등이 5일 서울 여의도 국회 소통관에서 가칭 ‘개혁신당’ 입당 기자회견을 하고 있다. 뉴스1신당의 세 불리기도 시작됐다. 국민의힘 서울 영등포갑 당협위원장이던 문병호 전 의원과 대통합민주신당 출신 안영근 전 의원, 천강정 전 국민의힘 경기도당 의료정책위원장 등 12명은 이날 오후 국회에서 기자회견을 열고 신당 합류를 선언했다. 문 전 의원은 “기득권 거대 양당이 주도해온 기성 정치권은 민생의 위기를 해결할 어떠한 효과적인 대안과 방책도 내놓지를 못하고 있다”며 “국민이 바라는 정치 교체, 세대 교체, 제도 개혁을 반드시 이뤄내 위기의 대한민국을 구하겠다”고 밝혔다.이 전 대표와 ‘천아인’(천하람·허은아·이기인) 등 신당 지도부는 6일엔 보수 성향이 강한 대구를 찾아 길거리 당원 모집에 나선다. 이들은 오후 3시 30분 수성못 상화동산 입구에서 1시간 30분 동안, 오후 6시 동성로 대구백화점 앞에서 1시간 동안 각각 당원 모집 운동을 벌일 예정이다.보수 진영 내의 경쟁자인 국민의힘을 향해서도 각을 세우고 있다. 윤석열 대통령이 5일 이른바 ‘쌍특검법’(김건희 여사 주가조작 특검법, 대장동 50억 클럽 의혹 관련 특검법)에 대한 재의요구(거부권)를 하자 이 전 대표는 페이스북에 “거부권은 방탄권이 아니다”라고 일갈했다. 이어 “김건희 특검은 아내를 버릴 수 없어서 그런 것이라고 하지만 50억 클럽의 특검에까지 거부권을 쓰는 이유가 무엇이냐”며 “왜 정부가 50억 클럽의 쉴드(방어)를 치는 것이냐”고 적었다."
