date,title,content
2024-05-31,명지대 ‘차세대반도체 전문 인력 양성사업’에 선정,"명지대학교(총장 유병진)가 산업통상자원부가 지원하고 한국반도체산업협회가 주관하는 ‘차세대반도체소부장후공정 전문인력 양성사업’에 선정되었다고 밝혔다. 본 사업의 연구책임자 직은 김유빈 명지대 반도체공학과 교수가 역임하게 되었다.이번 ‘차세대반도체소부장 전문인력양성’ 사업은 반도체 소부장(소재·부품·장비) 및 후공정 분야의 인력 부족 상황을 타개하기 위해 기획되었다. 대학과 산업계의 협력하에 미래 반도체 산업을 선도할 석·박사 전문인력 양성하는 게 이번 사업의 주목적이다.명지대는 이번 사업 선정으로 ‘반도체 장비 분야’ 석·박사 전문인력 양성을 위해 2029년까지 약 30억 원의 사업비를 지원받게 된다. 본 사업에 참여하는 명지대 학생은 반도체 소부장 및 후공정 분야의 요소 기술에 대한 이론을 전수 받을 예정이다. 그뿐만 아니라 학생들은SK하이닉스, 대덕전자,YC,한국알박 등 반도체 관련 대표 기업이 참여하는 산학 프로젝트를 수행하면서 실무 역량을 배양할 기회를 얻게 된다.유병진 명지대 총장은 “명지대학교는 첨단 반도체산업 인재 양성의 시급성을 인식하고 2023년에 반도체공학과 학사과정과 석·박사 대학원 과정을 동시에 신설하였고, 수도권 대학 중 3개 대학만 선정한 반도체특성화대학 지원사업에 이어 이번 석·박사 인재양성사업에 선정되었다”며 “명지대학교는 반도체 소부장 및 후공정 분야 학부부터 대학원까지 인력 양성을 책임지는 핵심 대학으로 성장하게 되었다. 국가 전략기술 확보에 기여할 우수한 인재 양성을 위해 대학 차원의 지원도 아끼지 않겠다.”고 의지를 밝혔다.한편, 명지대는 23년 교육부가 추진하는 ‘반도체특성화대학 지원사업’에도 수도권-비수도권 동반 성장형 사업에 선정되었다. 이에 명지대는 4년간 약 280억 원을 지원받아 반도체 소부장 및 후공정 분야 학부 인력 양성에 매진하고 있다."
2022-01-23,‘3억+α 판매’ 삼성 갤럭시 도전에...덩달아 주목받는 부품사,"서울 서초구 삼성전자 서초사옥 내 딜라이트에 전시된 갤럭시 시리즈. [연합뉴스]삼성전자가 지난해 스마트폰 사업 부진을 딛고 올해 ‘3억+알파(α) 판매’에 도전한다. 삼성전자가 갤럭시 판매 확대 전략에 나서면서 ‘러닝메이트’인 부품업체들의 실적도 반등할 것이란 전망이 나온다.지난해 글로벌 스마트폰 시장 점유율 [카운터포인트리서치]━스마트폰 시장 1위 힘겹게 지킨 삼성지난해 삼성전자는 힘겹게 글로벌 스마트폰 시장 1위를 지켰다. 시장조사업체인 카운터포인트리서치에 따르면, 삼성전자의 지난해 전 세계 스마트폰 시장 점유율은 18.9%로 1위를 유지했다. 하지만 2위 애플(17.2%)과 점유율 격차는 1%포인트대로 좁혀졌다.특히 판매량 기준 성장률이 상대적으로 부진했다. 지난해 갤럭시 판매량은 전년 대비 0.9% 증가했다. 아이폰12‧13 시리즈가 연이어 흥행한 애플은 같은 기간 25.5% 늘었다. 시장 3위에 오른 샤오미는 판매량을 35.1% 늘렸고, 오포(4위)와 비보(5위)는 각각 32.8%, 25.2% 증가했다.한 증권사 스마트폰 담당 연구원은 “베트남 공장 생산 차질이 장기화했다면 삼성전자는 더 부진한 성적표를 받았을 것”이라며 “갤럭시 판매량이 정체되며 부품업체 실적과 주가도 부진했다”고 말했다.지난해 주요 스마트폰 브랜드의 전년 대비 소매 판매 증가율. [카운터포인트리서치]━갤럭시 호조로 부품업체 실적 개선 전망절치부심에 나선 삼성전자는 올해 스마트폰 시장 공세를 강화한다는 방침이다. 내부적으론 3억2000만 대 안팎의 판매 목표치를 세운 것으로 알려졌다. 시장조사업체와 금융투자업계 전망 역시 3억 대 안팎에 몰려 있다.삼성전자의 주요 부품업체들도 다시 주목받고 있다. 박강호 대신증권 연구원은 “올해 1분기 및 연간 판매량 증가로 삼성전자향 스마트폰 부품업체의 매출과 이익이 개선될 전망”이라고 밝혔다.특히 전년 대비 판매량이 2배가량 증가할 것으로 기대되는 폴더블폰, 2월 초 공개되는 갤럭시S22 시리즈, 5G 비중을 늘리고 성능을 높인 보급형 갤럭시A‧M 시리즈 흥행이 부품 업체 실적을 좌우할 전망이다.그래픽=신재민 기자shin.jaemin@joongang.co.kr━인터플렉스·덕산네오룩스 등 주목삼성 갤럭시의 서플라이 체인(공급망)에 속해 있는 업체 중 디스플레이 부문에선 인터플렉스와 덕산네오룩스, 솔루션첨단소재 등이 수혜를 받을 것으로 보인다. 특히 S펜 기능에 필수적인 ‘디지타이저’를 공급하는 인터플렉스가 주목받는다.김운호IBK투자증권 연구원은 “디지타이저 적용 모델이 갤럭시S 시리즈로 확대되고 있다”며 “올해 상반기에는 갤럭시S22 출시 효과를 얻으며 연간 디지타이저 매출이 전년 대비 3개 가까이 증가할 것”으로 내다봤다. 스마트폰의 유기발광다이오드(OLED) 패널 침투율이 늘면서 덕산네오룩스 등도 실적이 개선될 전망이다.갤럭시S22 추정 이미지 [렛츠고디지털]━카메라에선 엠씨넥스·와이솔 등 수혜카메라 부문에선 파트론과 엠씨넥스, 파워로직스, 나무가, 자화전자, 재영솔루텍, 동운아나텍, 옵트론텍 등이 주목받는다.고의영 하이투자증권 연구원은 “올해가 갤럭시 3억 대 판매 회복의 원년이 된다면 대표적인 카메라모듈 업체인 파트론에 긍정적으로 작용할 것”이라고 밝혔다. 오현진 키움증권 연구원은 “갤럭시 A시리즈 상단 모델까지만 적용됐던 손떨림보정부품(OIS) 기능이 저가형 A시리즈까지 확대가 예상되면서 엠씨넥스는 전년 대비 2배 이상의 물량 확대가 예상된다”고 말했다.통신부품 분야에선 와이솔과PI첨단소재 등의 실적 개선이 기대된다. 박강호 연구원은 와이솔에 대해 “삼성전자의 스마트폰 판매 확대 전략 속에 고성능 필터의 신규 매출이 반영되면서 와이솔의 수익성이 개선될 것”이라고 밝혔다. 인쇄회로기판(PCB) 분야에선 코리아서키트‧디에피‧대덕전자‧심텍 등이 갤럭시 판매량 확대에 힘입어 동반 성장할 것으로 전망된다."
2024-03-20,尹 “기업가 존경받는 나라 만들겠다” 최태원·이재용·정의선·구광모·신동빈 한자리,"윤석열 대통령이 20일 서울 영등포구 63컨벤션센터에서 열린 제51회 상공의 날 기념식에서 '자유주의 경제시스템에서 기업활동의 자유와 국가의 역할' 주제로 특별강연을 하고 있다. 대통령실통신사진기자단=뉴시스윤석열 대통령은 20일 “상공인의 성공이 국가의 성공""이라며 ""기업가가 가장 존경받는 나라를 만들겠다”고 약속했다.윤 대통령은 이날 오후 서울 여의도 63컨벤션센터에서 열린 ‘제51회 상공의 날 기념식’ 특별강연에서 이같이 말했다. 이날 강연 주제는 ‘자유주의 경제시스템에서 기업활동의 자유와 국가의 역할’이었다. 윤 대통령이 기업인들을 대상으로 강연을 한 것은 취임 후 처음이다.윤 대통령은 ‘가장 기업 하기 좋은 나라’ '기업가가 가장 존경받는 나라'를 만들기 위해서는 글로벌스탠다드에 맞는 기업환경 구축이 선행되어야 한다며 ▶노동 개혁 ▶규제 혁파 ▶가업승계 개선 ▶독과점 해소 ▶성장 사다리 구축 등 정책과제를 흔들림 없이 추진하겠다고 말했다.더불어 기업의 사회적 책임도 당부했다. 윤 대통령은 “자유는 동전의 양면처럼 반드시 책임과 윤리가 따르는 것”이라며 “기업도 사회 공동체의 일원으로서 노동권 보호, 저출산 문제, 지역균형발전 등 사회적 이슈에 관심을 두고 동참해 달라”고 요청했다.안덕근(앞줄 왼쪽부터) 산업통상자원부 장관, 이재용 삼성전자 회장, 정의선 현대차그룹 회장, 구광모LG그룹 회장이 20일 서울 영등포구 63컨벤션센터에서 열린 제51회 상공의 날 기념식에서 윤석열 대통령의 특별강연을 듣고 있다.대통령실통신사진기자단=뉴시스윤 대통령은 이날 강연에서 이승만·박정희 전 대통령과 이병철·정주영 전 회장들의 업적도 언급했다.윤 대통령은 “이승만 대통령이 놓은 레일 위에 박정희 대통령의 기관차가 달렸다는 말처럼 두 대통령의 위대한 결단이 오늘의 번영을 이룬 토대가 됐다”고 말했다.이어 “우리가 기억해야 할 위대한 기업인들도 있다”며 이병철 전 삼성그룹 회장, 정주영 전 현대 그룹 회장의 업적도 기렸다.윤 대통령은 “섬유에서 비료로, 다시 전자에서 반도체로 시대를 앞서간 이병철 회장의 혜안이 오늘의 삼성과 대한민국을 만들었다”고 말했다.정 전 회장에 대해선 “1971년 조선소 건설을 계획했을 때 500원짜리 지폐를 꺼내 거북선 그림을 보여주며 우리는 500년 전인 1500년대에 이미 이러한 철갑선을 만들었다고 설득해서 차관을 받아냈다”고 했다.또 윤 대통령은 이날 정부의 정책 방향 등에 대해 설명하며 “이념 편향적인 정책이 우리 경제를 흔들기도 한다”며 “탈원전 정책이 대표적”이라고 말하기도 했다.이날 행사에는 최태원SK그룹 겸 대한상공회의소 회장을 비롯해 이재용 삼성전자 회장, 정의선 현대자동차 회장, 구광모LG회장, 신동빈 롯데 회장 등 주요 기업인들이 모두 참석했다.정부 측은 안덕근 산업통상자원부 장관, 대통령실에서는 이관섭 비서실장, 성태윤 정책실장, 박춘섭 경제수석, 박상욱 과학기술수석 등이 자리했다.한편 올해 상공의 날에는 208명의 유공자에게 정부포상이 수여됐다. 이영희 삼성전자 사장, 신영환 대덕전자 대표이사 등 9명은 금탑산업훈장 등 정부포상을 받았다."
2023-03-23,"“어려울수록 함께”…삼성, 208개 협력사와 ‘상생협력데이’ 열어","삼성전자가 23일 수원 라마다 호텔에서 협성회 회원사들과 함께 '2023년 상생협력데이'를 개최했다. 앞서 열린 협성회 정기총회에서 협성회 회장인 김영재 대덕전자 대표가 인사말을 하고 있다. 사진 삼성전자삼성전자가 23일 협력회사 협의회(협성회) 회원사 200여 곳과 ‘2023년 상생협력데이’ 행사를 열고 동반성장과 기술·교육 확대, 고용·사회공헌 활성화를 다짐했다.협성회는 1981년 삼성전자의 1차 협력회사 39곳이 모여 설립한 단체로, 현재는 회원사가 208곳으로 늘었다. 이들은 2012년부터 상생협력데이를 통해 서로 소통하면서 동반성장 의지를 다져왔다. 코로나19로 2019년 이후 열지 못하다 이번에 4년 만에 재개됐다.이날 행사는 23일 경기도 수원 라마다 호텔에서 열렸다. 행사에는 한종희 삼성전자 부회장을 비롯한 주요 경영진과 김영재 협성회 회장(대덕전자 대표) 등 회원사 관계자 220여 명이 참석했다. 삼성전자·삼성디스플레이는 품질·생산 혁신 등에서 성과를 거둔 최우수·우수 협력업체 30곳,ESG(환경·사회·지배구조) 우수 협력사 2곳, 공정거래 우수 협력사 2곳 등 총 34곳을 시상했다.한종희 부회장은 “어려울 때일수록 움츠리기보다 실력을 키워 근원적 경쟁력 확보에 노력해 달라”며 “공급망 전체의 생존을 위해ESG경영에도 동참해 달라”고 당부했다. 김영재 협성회장은 “삼성전자와의 상생협력을 바탕으로 지속적인 혁신 활동과 기술 개발로 위기를 극복하자”며 “특히 인공지능(AI) 기반 스마트 팩토리와 저탄소 녹색 성장에 기초한ESG경영을 중장기 계획에 따라 치밀하게 준비해야 한다”고 말했다.지난해 말 기준 협성회 회원 기업 208곳의 총매출은 약 70조원, 고용인원은 29만2000여 명에 달한다. 삼성전자는 올해 온실가스 감축, 공급망 실사법 대응 등ESG경영 관련 교육 프로그램 22개 과정을 신설했다. 또 우수 기술 설명회, 보유 특허 개방 등 다양한 상생 활동을 2·3차 협력회사까지 확대해 시행하고 있다.삼성전자 관계자는 “‘협력회사의 경쟁력이 삼성의 경쟁력과 직결된다’는 기조 아래 2004년 국내 기업 최초로 협력회사 전담 조직을 신설하는 등 다양한 상생 활동을 하고 있다”고 말했다."
2023-03-24,"삼성전자 협력사 200여곳, 한자리 모여 동반성장 확인","삼성전자는 23일 수원에서 협성회 회원사들과 함께 ‘상생협력데이’를 열었다. [사진 삼성전자]삼성전자가 23일 협력회사 협의회(협성회) 회원사 200여 곳과 ‘2023년 상생협력데이’ 행사를 열고 동반성장과 기술·교육 확대, 고용·사회공헌 활성화를 다짐했다.협성회는 1981년 삼성전자의 1차 협력회사 39곳이 모여 설립한 단체로, 현재는 회원사가 208곳으로 늘었다. 이들은 2012년부터 상생협력데이를 통해 서로 소통하면서 동반성장 의지를 다져왔다. 코로나19로 2019년 이후 열지 못하다 이번에 4년 만에 재개됐다.이날 경기도 수원 라마다 호텔에서 열린 행사에는 한종희 삼성전자 부회장을 비롯한 주요 경영진과 김영재 협성회 회장(대덕전자 대표) 등 회원사 관계자 220여 명이 참석했다. 삼성전자·삼성디스플레이는 품질·생산 혁신 등에서 성과를 거둔 최우수·우수 협력업체 30곳,ESG(환경·사회·지배구조) 우수 협력사 2곳, 공정거래 우수 협력사 2곳 등 총 34곳을 시상했다.한종희 부회장은 “어려울 때일수록 움츠리기보다 실력을 키워 근원적 경쟁력 확보에 노력해 달라”며 “공급망 전체의 생존을 위해ESG경영에도 동참해 달라”고 당부했다. 김영재 협성회장은 “인공지능(AI) 기반 스마트 팩토리와 저탄소 녹색 성장에 기초한ESG경영을 중장기 계획에 따라 치밀하게 준비해야 한다”고 말했다.지난해 말 기준 협성회 회원 기업 208곳의 총매출은 약 70조원, 고용인원은 29만2000여 명에 달한다. 삼성전자는 올해 온실가스 감축, 공급망 실사법 대응 등ESG경영 관련 교육 프로그램 22개 과정을 신설했다. 또 우수 기술 설명회, 보유 특허 개방 등 다양한 상생 활동을 2·3차 협력회사까지 확대해 시행하고 있다."
