date,title,content
2023-07-18,반도체 소부장株 가파른 상승… 업황 회복 신호일까,"이수페타시스·한미반도체 등 한달새 76~111%나 올라국내 반도체 소부장(소재·부품·장비) 기업들의 주가가 최근 한 달 사이 가파르게 오르고 있다. 한국거래소에 따르면 지난 한 달(14일 기준)ETF(상장지수펀드) 상승률 상위 5위 중에 반도체 관련ETF가 2개 포함됐다. ‘KBSTARFn5G테크(19.09% 상승·2위)’와 ‘SOL반도체소부장Fn(14.22% 상승·4위)’이다. 이들ETF의 상승세는 삼성전자 같은 반도체 대형주보다 한미반도체·이수페타시스·대덕전자 등 국내 중견·중소 소부장 기업들이 견인했다.챗GPT와 같은 초거대 인공지능(AI) 시대가 본격적으로 열리고 그래픽처리장치(GPU)·고대역폭메모리(HBM) 등 고성능 반도체 수요가 증가하면서, 반도체 산업에 대한 시장의 관심이 커진 탓이다. 미국GPU설계 업체 엔비디아는 시가총액 1조 달러를 최근 돌파한 데 이어, 지난 14일 사상 최고가를 찍었다. 국내 소부장 기업 중엔 이수페타시스 주가가 지난 한 달 사이 111% 올랐고, 에스티아이(88%)·피에스케이홀딩스(88%)·한미반도체(76%) 등이 크게 올랐다. 모두 반도체 특정 공정에 대해선 세계 수준의 기술력을 갖고 있는 기업들이다. 증권가와 반도체 업계에선 “그동안 침체됐던 반도체 업황 회복의 신호탄”이라는 기대가 나오지만, “시장 기대감에서 비롯된 단기 과열”이라는 우려도 함께 나오고 있다.그래픽=양인성그래픽=양인성후공정 장비·회로기판 업체 주목시가총액 4조원을 돌파한 한미반도체는 대표적인 반도체 후공정 장비 업체다. 웨이퍼 한 판으로 생산된 반도체를 개별 제품으로 절단하거나 서로 다른 반도체를 접합해 이어 붙이는 장비를 만드는데, 최근HBM수요가 증가하면서 한미반도체 장비에 대한 관심도 커지고 있다.AI반도체 핵심 부품인HBM은 여러 칩을 접합해 만드는 구조라 접합 장비 수요가 커질 것이라는 기대감이 주가에 반영된 것이다. 에스티아이와 피에스케이홀딩스의 후공정 장비도HBM같은 차세대 반도체에 쓰일 가능성이 높다는 분석이 나오면서 주가가 크게 올랐다.반도체 소부장 기업들은 수천억원대의 꾸준한 매출과 지속적인 성장세, 높은 해외 매출 비중을 갖고 있다. 이수페타시스는 통신장비·서버에 들어가는 회로기판을 만드는 기업으로, 수출 비중이 90%에 이른다. 본래 노키아·시스코와 같은 해외 통신장비 업체가 주요 고객이었지만 올초 구글·엔비디아·마이크로소프트(MS)에AI반도체용 기판을 납품하기 시작하면서 주가가 크게 올랐다. 이수페타시스 매출은 지난해 6430억원으로 2021년 대비 37% 올랐고, 에스티아이도 지난해 매출 4224억원을 기록해 전년(3195억원) 대비 32% 올랐다.GPU·AI반도체가 세계적으로 각광을 받고, 이 반사이익을 누릴 수 있는 기술을 갖고 있는 국내 반도체 소부장 강소기업에 시장의 돈이 몰린다는 분석이 나온다.“기대감 선반영, 실적으로 증명해야”국내 반도체 소부장 주가 상승 랠리를 두고, 침체됐던 세계 반도체 시장에 다시 활기가 돌기 시작했기 때문이라는 분석도 나온다. 미국의 반도체 업황 지수에 해당하는 필라델피아 반도체 지수도 지난 2개월 사이 약 20% 상승했다. 시가총액이 크고 주가 움직임이 무거운 삼성전자나SK하이닉스 대신 시가총액이 작은 소부장 중견기업 주가가 먼저 올랐다는 것이다. 국민연금도 반도체 관련 주식을 사모으면서, 국민연금이 올해 2분기(4~6월) 5% 이상 지분을 보유해 공시 대상에 새로 편입한 상장사는 티이엠씨,LX세미콘,ISC,이오테크닉스, 인텍플러스, 하나마이크론 등 반도체주가 다수를 차지했다.하지만 일각에선 반도체 소부장 관련주의 일제 상승을 두고 “지나친 기대감으로 과열된 랠리”라는 분석도 나온다. 미국 반도체 주요 주가 상승률을 살펴보면 엔비디아 주가가 작년 대비 160% 이상 오른 데 비해, 퀄컴·인텔 주가는 오히려 작년 대비 약 20%씩 하락한 상태다. 반도체 주가는 기업별로 천차만별인데, 한국 반도체 소부장 업종에 ‘묻지마’ 오름세가 나타난 것 아니냐는 지적도 나온다. 최유준 신한투자증권 연구원은 “최근 반도체 업종의 주가 상승은 감산·업황 회복이 주가에 선반영 된 것으로 보인다”며 “미국 수출 등 실적으로 증명해야 주가 상승세가 계속될 것”이라고 했다."
2022-06-16,[부음] 김복자 별세 외,"▲김복자별세,고인석캐나다 거주·고창우한국건축구조기술사회 회장 모친상=14일13시19분 삼성서울병원, 발인 17일7시, (02)3410-6915▲김창열별세,김종필내일신문 이사·김종승·김은주·김종명부친상,정대희장인상,장미경·정주희·이은화시부상=15일4시50분 충남대병원, 발인 17일7시20분, (042)280-6461▲박종한前 단국대 무역학과 종신대우교수 별세,정미숙남편상,박동석·박윤수부친상=15일0시40분 삼성서울병원, 발인 17일9시30분, (02)3410-6909▲서남수별세,박재승유일엔지니어링건축사사무소 부회장·박재은서울시향 이사·박재영(주)대덕전자 실장·박재민前 (주)푸른저축은행 상무 모친상,노규형리서치앤리서치 대표·임홍철연세대 건축학과 교수 장모상=15일9시56분, 서울성모병원, 17일7시10분, (02)2258-5922▲한갑수前 남원초등학교 교장 별세,이선순남편상,한동원성남시약사회장·한동연前 광주지방국세청장·한동일전주관광호텔 꽃심 대표·한동문(주)ATP대표·한승희부친상,이동원장인상,박혜영·박미라·박영신·권순영시부상=14일17시 분당서울대병원, 발인 17일6시, (031)787-1501"
2022-04-12,금리 뛰면 빛 보는 빚 적은 기업은 어디?,"서울 남산에서 바라본 국내 주요기업 사옥 모습. /연합뉴스미국 연방준비제도의 5월 빅스텝(0.5%포인트 인상) 예상, 14일 한국은행 금융통화위원회의 기준금리 결정을 앞두고 채권 시장이 요동치고 있다.지난달 중순 이후 11일까지 국고채 2년물 금리가 1%포인트에 육박하는 0.972%포인트 치솟았고, 덩달아 같은 기간 회사채(3년 만기AA-등급) 금리도 0.911%포인트 오르면서 기업 자금 조달 시장에 비상벨이 울리고 있다.우량 기업들은 일찌감치 저금리에 자금 조달을 해뒀지만, 그렇지 않은 기업들은 회사채 발행이 어려워지면서 급전을 고금리 대출에 의존할 수밖에 없는 상황. 코로나 팬데믹 후 2년여간 수면 아래 잠겨 있던 한계기업 부실화 문제가 ‘금리 발작’을 맞아 서서히 수면 위로 드러날 기세다. 전문가들은 이런 때일수록 빚이 적고 이자보상배율이 높은 탄탄한 기업을 골라 투자하라고 조언한다.회사채 금리 기록적 급등… “앞으로 더 오른다”국고채 3년물 금리가 10년여 만에 최고치를 돌파하면서 회사채 금리도 가파르게 뛰는 중이다. 통상 ‘무위험 채권’인 국고채 금리가 뛰면 각 기업이 발행하는 회사채 금리는 국고채 금리 상승폭에 기업별 위험도를 반영한 만큼 얹어 더 뛰어오른다. 경기가 나빠 기업 영업 전망이 악화되면 회사채와 국고채 금리 차인 신용 스프레드가 커지면서 기업 자금 조달이 더욱 불리해진다. 지금이 딱 그런 때다.올 들어 본격적인 금리 인상이 시작되면서 회사채 시장도 바짝 얼어붙었다. 금융투자협회 집계치를 보면 올 들어 이달 11일까지 회사채 거래 대금은 57조6000억원으로 작년 같은 기간 대비 약 30% 수준으로 위축됐다. 회사채 발행 시장의 기준이 되는 무보증 3년물AA-등급 금리는 연초 연 2.460%에서 이달 11일 연 3.813%가 됐고, 같은 기간BBB-등급 금리는 연 8.316%에서 연 9.638%로 뛰었다. 금리가 뛴 만큼 기업들의 이자 부담도 커지는 셈이다. 이런 상황이 부담스러운 기업들은 회사채 발행을 줄이고 있다. 지난달 회사채 발행액은 2월 대비 1조원 가까이 줄어든 7조9170억원이었다. A등급인 엔에스쇼핑(NS홈쇼핑)은 최근 3년물 900억원 모집에 나섰지만 200억원 확보에 그쳐 700억원의 미매각이 발생하기도 했다.앞으로가 문제다. 채권시장 전문가들은 당분간 금리 상승 기조가 계속될 것으로 보고 있다. 이한구 금융투자협회 채권부 전문위원은 “3년물 국채 금리가 3%대까지 올라간 상황에서 투자자들이 굳이 크레딧물(회사채)을 살 이유가 없는 상황”이라며 “우량 기업들은 유보 이익도 많고 미리 채권 발행을 통해 자금을 빌려놨겠지만, 한계기업들은 그렇지 못하다. 기업별 양극화가 더욱 심해질 것”이라고 전망했다.“빚 적고 이자보상배율 높은 기업 골라야”투자자 입장에선 이런 때일수록 부채 부담이 낮은 기업에 투자하는 게 유리하다. 부채비율이 낮고, 영업이익을 이자비용으로 나눈 ‘이자보상배율’이 높은 기업을 찾으라는 것이다.한국투자증권은 일단 코스피 상장사 중 부채비율이 200% 이상이거나 이자보상배율이 1.5배를 밑도는 기업은 투자 대상 리스트에서 지우라고 조언한다. 부채비율이 200%가 넘는 기업은 전체의 14.1%, 이자보상배율 1.5배 이하 기업은 9.7% 수준이다.반대로 시가총액이 5000억원 이상으로 어느 정도 규모가 있으면서 부채비율이 낮고 이자보상배율은 높은 기업, 여기에 올해 영업이익이 가시적으로 늘어날 것으로 예상되는 기업들을 추렸더니 롯데정밀화학, 고려아연, 대덕전자, 한일시멘트, 삼양식품 등(이상 부채비율 낮은 순)이 꼽혔다. 같은 기준에서 삼성전자나HMM,DL(대림) 등도 순위에 들었다.김대준 한투증권 연구원은 “이 기업들은 보유 채권의 잔존 만기 측면에서 원리금 상환 부담이 매우 낮고, 동시에 영업 측면에서도 꾸준히 이익을 낼 것으로 기대된다”면서 “지금처럼 비용 증가 압박이 큰 상황에서 안정적인 수익을 낼 수 있는 종목이 유리하다”고 설명했다."
2024-03-20,"尹, 상공의 날 특강 “그릇된 이념·포퓰리즘이 경제 어렵게”","윤석열 대통령이 20일 서울 영등포구 63컨벤션센터에서 열린 제51회 상공의 날 기념식에서 '자유주의 경제시스템에서 기업활동의 자유와 국가의 역할' 주제로 특별강연을 하고 있다. /뉴시스윤석열 대통령은 20일 제51회 상공의 날 기념식에 참석해 ‘자유주의 경제시스템에서 기업활동의 자유와 국가의 역할’을 주제로 특별 강연을 했다. 윤 대통령이 기업인들을 대상으로 강연을 한 것은 취임 후 처음이다.윤 대통령은 서울 영등포구 63컨벤션센터에서 열린 기념식에서 자유시장경제의 의미와 중요성, 정부의 정책 방향 등에 관해 설명했다.윤 대통령은 “이승만 대통령이 놓은 레일 위에 박정희 대통령의 기관차가 달렸다는 말처럼 두 대통령의 위대한 결단이 오늘의 번영을 이룬 토대가 됐다”고 했다.윤 대통령은 두 전직 대통령과 함께 “우리가 기억해야 할 위대한 기업인들도 있다”면서 이병철 전 삼성그룹 회장, 정주영 전 현대 그룹 회장의 업적도 기렸다. 윤 대통령은 “섬유에서 비료로, 다시 전자에서 반도체로 시대를 앞서간 이병철 회장의 혜안이 오늘의 삼성과 대한민국을 만들었다”고 했다.또 “정주영 회장은 1971년 조선소 건설을 계획했을 때 500원짜리 지폐를 꺼내 거북선 그림을 보여주며 우리는 500년 전인 1500년대에 이미 이러한 철갑선을 만들었다고 설득해서 차관을 받아냈다”고 했다.윤 대통령은 “정치 이념적 왜곡과 선동이 만연하며 이념 편향적인 정책이 우리 경제를 흔들기도 한다”며 “자유시장 경제 체제에 대한 이해 부족, 그리고 그릇된 이념에 사로잡힌 무원칙과 포퓰리즘이 우리 경제의 어려움을 가중시켜 왔다”고 했다.윤 대통령은 전임 문재인 정부의 탈원전 정책에 대해 “탈원전 정책을 밀어붙여 원전 생태계를 무너뜨린 결과로 그 피해가 우리 산업과 국민 전체에게 돌아갔다”고 했다.또 “지금 우리의 노동 현장은 결코 정상적인 상황이 아니다. 이념으로 무장한 기득권 노조 카르텔로 인해 노동 현장에 불법이 판을 치고 노동시장 이중 구조가 심화하면서 힘없는 미조직 근로자들은 오히려 더 열악한 처지로 내몰리고 있다”고 했다.윤 대통령은 “재정 만능주의에 빠진 무분별한 포퓰리즘으로 불과 5년 만에 400조원이 늘어 1000조원을 넘어서고 있다”며 “정부는 선심을 쓰고 청구서는 미래 세대에게 넘겨버린 것”이라고 했다.올해 상공의 날에는 총 208명의 유공자에게 정부포상이 수여됐고, 윤 대통령은 이날 이영희 삼성전자 사장, 신영환 대덕전자 대표이사 등 9명에게 금탑산업훈장 등 정부포상을 친수했다.기념식에는 최태원 대한상공회의소 회장 등 경제단체장과 이재용 삼성전자 회장, 정의선 현대차 회장, 구광모LG회장, 신동빈 롯데 회장 등 주요 기업인, 중소 상공인 대표 등 1000여 명이 참석했다."
2024-03-21,이영희·신영환 ‘금탑산업훈장’,"이영희 신영환이영희 삼성전자 사장, 신영환 대덕전자 대표이사가 20일 산업통상자원부와 대한상공회의소가 개최한 ‘제51회 상공의 날 기념식’에서 금탑산업훈장을 받았다. 이종호 피피아이파이프 회장, 어성철 한화시스템 대표, 주종대 고려제강 대표, 김철중SK아이이테크놀로지 대표는 은탑산업훈장을, 정원석 엘지마그나이파워트레인 대표, 서용철 신흥정밀 대표, 임대재 이맥솔루션 대표는 동탑산업훈장을 받았다."
2024-12-11,"3000건 특허왕 LG전자 CTO, AI 메모리 길 뚫은 30대 교수 해동상 수상","김병훈LG전자CTO부사장(왼쪽)과 김형진 한양대 신소재공학부 교수(오른쪽)가 각각 제 34회 해동기술상과 해동젊은공학인상 수상자로 선정됐다. 사진 대한전자공학회3000건 이상 핵심 표준 기술을 발명한 김병훈LG전자 최고기술책임자(CTO), 인공지능(AI) 메모리의 난제를 푼 김형진 한양대 신소재공학부 교수가 올해 해동상을 받는다.11일 대한전자공학회는 제 34회 해동기술상 수상자로 김CTO를, 해동젊은공학인상 수상자로 김 교수를 각각 선정했다고 밝혔다.대덕전자 설립자인 고(故) 김정식 회장이 1991년 제정한 해동상은 국내 전자‧정보‧통신 분야의 권위 있는 상으로 꼽힌다. 대한전자공학회 주관에 해동과학문화재단 후원으로 전자공학 및 산업계 인재에게 해동상을, 만 40세 이하 인재에 해동젊은공학인상을 수여한다.올해 해동기술상을 받는 김CTO는 지난 20여년 동안 반도체·통신·로봇 등에서 차세대 표준 기술을 개발해 연구개발(R&D) 혁신을 이끈 공로를 인정받았다. 전자공학회는 “김CTO는 다수의 표준 핵심 특허를 확보하고 1만5000건 이상의 연구 피인용 횟수를 기록하는 등 대한민국 기술의 국제 위상과 영향력을 높였다”라고 선정 이유를 밝혔다.퀄컴 등 글로벌 반도체 기업을 거쳐 지난 2008년LG전자에 합류한 김CTO는 2021년부터는LG전자CTO를 맡아 5G·6G 통신,AI,로봇, 반도체, 모빌리티, 차세대 컴퓨팅 등 R&D를 총괄하고 있다.LG전자는 지난 11월에는 차량용 증강현실(AR) 내비게이션 선행 특허로 특허청 주관 ‘2024 특허기술상’ 세종대왕상(대상)을 받기도 했다. 김CTO개인적으로도 국내외 3000여 건 특허를 출원해 지난 5월 발명의날 행사에서 최고상인 금탑산업훈장을 받았다.김형진 교수는 반도체 소자 공정 및 특성 평가와 메모리 소자를 활용한 컴퓨팅 시스템 분야의 연구 성과를 인정받아 해동젊은공학인상 수상자로 선정됐다. 전자공학회는 “김 교수는 103편(주저자 62편)의 논문을SCI급 학술지에 게재하고 반도체 소자 최고 학술대회에서 발표했으며, 김 교수의 연구 결과는 기존 메모리 기술이 해결해야 했던 에너지 효율·속도 문제를 개선해AI반도체 기술에 활용될 것으로 기대된다”라고 선정 이유를 밝혔다.해동상 시상식은 오는 13일 오후 6시 그랜드인터컨티넨탈 서울 파르나스에서 열린다.한편, 지난 2021년 신설돼 올해 4회째인 해동반도체공학상은 박명재SK하이닉스 부사장(기술상)과 강석형 포항공대 전자전기공학과 교수(학술상)가 수상했다."
2024-12-12,김병훈 LG전자 CTO·김형진 교수 ‘해동상’,"대한전자공학회는 11일 제34회 해동기술상 수상자로 김병훈(왼쪽 사진)LG전자 최고기술책임자(CTO), 해동젊은공학인상 수상자로 김형진(오른쪽) 한양대 신소재공학부 교수를 선정했다고 밝혔다.해동상은 대덕전자 설립자인 고(故) 김정식 회장이 1991년 제정했다. 대한전자공학회 주관하고 해동과학문화재단 후원한다.전자공학회는 “김CTO는 다수의 표준 핵심 특허를 확보하고 1만5000건 이상의 연구 피인용 횟수를 기록하는 등 대한민국 기술의 국제 위상과 영향력을 높였다”라고 설명했다.퀄컴 등을 거쳐 2008년LG전자에 합류한 김CTO는 2021년부터는LG전자CTO를 맡아 5G·6G 통신,AI,로봇, 반도체, 모빌리티, 차세대 컴퓨팅 등 R&D를 총괄하고 있다.전자공학회는 또 “김 교수는 103편(주저자 62편)의 논문을SCI급 학술지에 게재했다”며 “그의 연구 결과는 기존 메모리 기술이 해결해야 했던 에너지 효율·속도 문제를 개선해AI반도체 기술에 활용될 것으로 기대된다”고 밝혔다."
2024-03-20,"삼성전자 첫 여사장 이영희, 금탑훈장 수상…상공의 날 최고 영예","윤석열 대통령이 20일 서울 영등포구 63컨벤션센터에서 열린 제51회 상공의 날 기념식에서 '자유주의 경제시스템에서 기업활동의 자유와 국가의 역할' 주제로 특별강연을 하고 있다. 대통령실사진기자단이영희 삼성전자 사장과 신영환 대덕전자 대표이사가 올해 상공의 날 최고 영예인 금탑훈장을 받았다.대한상공회의소(대한상의)는 20일 서울 63컨벤션 센터에서 ‘제51회 상공의 날 기념식’을 갖고, 국가경제 발전에 기여한 기업인 212명에게 산업훈장과 산업포장, 대통령 표창 등을 수여했다.기념식에는 윤석열 대통령을 비롯해 최태원 대한상의 회장(SK그룹 회장)과 안덕근 산업통상자원부 장관, 이재용 삼성전자 회장, 정의선 현대차그룹 회장, 구광모LG그룹 회장, 신동빈 롯데그룹 회장 등 국내외 상공인 1200여명이 참석했다.안덕근 산업부 장관(왼쪽부터), 이재용 삼성전자 회장, 정의선 현대차 회장, 구광모LG그룹 회장 등이 20일 서울 영등포구 63컨벤션센터에서 열린 제51회 상공의 날 기념식에서 윤석열 대통령의 '자유주의 경제시스템에서 기업활동의 자유와 국가의 역할'을 주제로 한 특별 강연을 들으며 박수치고 있다. 연합뉴스이날 윤 대통령은 ‘자유주의 경제시스템에서 기업활동의 자유와 국가의 역할’을 주제로 한 특별강연을 했다. 윤 대통령은 “자유는 동전의 양면처럼 반드시 책임과 윤리가 따르는 것”이라며 “기업도 사회 공동체의 일원으로서 노동권 보호, 저출산 문제, 지역균형발전 등 사회적 이슈에 관심을 두고 동참해 달라”고 요청했다. 또 상공인의 성공이 국가의 성공이라며 기업가가 가장 존경받는 나라를 만들겠다고 약속했다. 윤 대통령이 상공의 날 행사에 참석한 것은 취임 후 처음이다. 과거 문재인 전 대통령, 박근혜 전 대통령, 이명박 전 대통령도 재임 기간 상공의 날 행사에 참석한 바 있다.최태원 회장은 기념사에서 “상공인들은 저출산 극복, 지역 경제 살리기, 잠재성장률을 제고, 전략 산업 육성을 통한 경제안보 강화 등을 한국경제가 직면한 과제로 꼽았다. 기업이나 정부가 혼자 힘으로 해결책을 찾기는 어렵고 팀플레이가 필요한 과제”라며 “정부는 기업이 맘껏 뛸 수 있도록 제도적으로 판을 깔아주시고, 기업은 자유로운 환경 속에서 과감한 투자와 혁신 활동으로 성과를 이뤄내야 한다”고 말했다.윤석열 대통령이 20일 서울 영등포구 63컨벤션센터에서 열린 제51회 상공의 날 기념식에서 이영희 삼성전자 사장에게 금탑산업훈장을 수여한 뒤 기념촬영하고 있다. 대통령실사진기자단이날 최고 영예인 금탑산업훈장을 받은 이영희 삼성전자 사장은 2017년부터 삼성전자의 글로벌 마케팅을 총괄하며 브랜드 가치를 글로벌 5위로 성장시켰고, 고객 중심 혁신 등으로 전 세계 시장에서 삼성의 브랜드 위상을 높인 점을 인정받았다. 2022년 말 삼성전자 최초 여성 사장으로 승진하며 여성 리더십의 역할과 위상을 강화했다는 평가를 받는다.신영환 대덕전자 대표는 2020년 5월 대표이사로 취임해 인공지능(AI)·5G 등 첨단 디지털 산업에 대응하여 초미세회로 기판 기술을 개발하는 등 업계를 선도했다. 메모리 시장에서 더블데이터레이트(DDR)4에서DDR5로의 수요 변화를 일찍이 예측하고 박판 및 미세회로 기술을 선행 개발하여 국내 메모리 반도체 기업의 세계 시장 석권에 밑거름 역할을 했다.은탑산업훈장은 어성철 한화시스템 대표, 주종대 고려제강 대표, 이종호 피피아이파이프 회장, 김철중SK아이이테크놀로지 대표가 받았다. 동탑산업훈장에도 정원석 엘지마그나이파워트레인 대표, 서용철 ㈜신흥정밀 대표, 임대재 ㈜이맥솔루션 대표가 수상의 영예를 안았다.윤석열 대통령이 20일 서울 여의도 63컨벤션센터에서 열린‘제51회 상공의 날 기념식’에서 신영환 대덕전자 대표이사에게 금탑산업훈장을 수여하고 있다. 대통령실사진기자단"
