date,title,content
2024-12-20,에르메스 등 장애인 고용 의무 안 지킨 328개 업체 공개,"지난 2022년 현대백화점 판교점의 에르메스 쇼윈도/조선DB정부가 장애인 고용 의무를 다하지 않은 사업체 328개 명단을 20일 공개했다. 정부와 지자체, 공공기관의 경우 의무 고용률인 3.6% 미만, 민간 업체는 1.55% 미만이면 공개 대상이다.20일 고용노동부에 따르면, 올해 공개된 사업체 수는 전년에 비해 28% 감소했다. 그러나 여전히 장애인을 한 명도 고용하지 않거나 10년 이상 고용 의무를 다하지 않는 곳도 있었다. 대표적인 게 명품 업체 에르메스다. 405명의 상시 근로자를 고용한 에르메스코리아는 12명의 장애인 고용 의무가 있지만, 단 한 명도 고용하지 않았다. 까르띠에, 피아제, 몽블랑 등이 속한 리치몬트코리아는 1393명의 상시 근로자가 근무하지만, 장애인은 단 2명(0.14%)만 일하고 있다. 리치몬트코리아는 10년 이상 장애인 의무 고용 비율을 지키지 않는 업체 중 하나였다.지자체 중에선 충북 음성군·강원 화천군·전남 영암군 등이, 공공기관 및 출자·출연법인 중엔 한국기상산업기술원·재단법인전주문화재단·재단법인 남양주시복지재단 등이 이름을 올렸다. 민간에서는 제조업체인 더블유씨피(0%)와 신성통상(0.18%), 종근당(0.3%), 오케이저축은행(0.47%) 등이 장애인 고용 의무를 다하지 않은 것으로 나타났다."
2022-07-08,"얼어붙은 공모주 시장, 이차전지發 훈풍 부나","성일하이텍·새빗켐 등 상장 나서폐배터리 재활용 업체인 성일하이텍 등 이차전지 관련 업체들이 잇따라 기업공개(IPO)에 나선다. 증권가에선 금리 인상과 원자재 값 상승, 러시아의 우크라이나 침공 장기화 등으로 얼어붙은IPO시장에서 이차전지 업체들이 증시 반등의 기폭제 역할을 할 수 있을지 기대하고 있다.성일하이텍은 오는 11일부터 수요예측을 거쳐 18일부터 일반 공모청약(공모 희망가 4만700~4만7500원)을 진행한다. 이 업체는 전기차 폐배터리에서 코발트·탄산리튬·니켈·망간·구리 등을 추출한다. 이를 통해 한 해 전기차 10만대 분량의 배터리를 생산할 수 있는 소재를 만들며 기술력에서 국내에서 가장 앞선 것으로 평가받는다. 지난해 매출액은 1472억원으로 전년 659억원 대비 123% 증가했고, 영업이익(169억원)도 흑자 전환했다. 성일하이텍은 상장 후 주가가 10% 이상 내리면 주간사가 공모가의 90% 수준에서 주식을 되사주는 ‘환매청구권’도 적용된다.또 다른 폐배터리 재활용 업체 새빗켐은 20일부터 수요예측을 진행한다. 니켈과 코발트, 망간 등을 분해해 판매하거나 정제해 양극재 원재료로 판매한다. 지난해 매출액 334억원, 영업이익 55억원을 기록했다.이차전지 분리막을 개발·생산하는 더블유씨피, 이차전지 제조 장비용 부품사인 에이치와이티씨도 상장 절차에 돌입했다. 더블유씨피는 헝가리에 7억 유로(9200억)를 투자해 이차전지 분리막 공장을 증설한다는 계획을 지난달 발표했다. 에이치와이티씨는 이차전지 제조 장비용 초정밀 부품을 생산한다. 지난 1분기 영업이익률이 21%에 이른다. 더블유씨피는 다음달 1일, 에이치와이티씨는 오는 21일부터 수요예측을 진행한다.올해 국내IPO시장은LG에너지솔루션이 114조원을 끌어모으며 성공적으로 상장한 지난 1월만 해도 훈풍이 불었으나 이후 현대엔지니어링,SK쉴더스, 윈스토어 등 대어급들이 잇따라 상장 계획을 철회했다. 상반기 상장한 기업은 30곳으로 지난해 상반기 40곳에 비해 25% 줄었다."
2022-10-05,"카뱅 -48%, 크래프톤 -57%… 공모株 ‘반토막 행진’","대어급선 ‘SK바사’만 공모가 상회올IPO신청, 작년대비 17개 감소증시 하락세가 이어지면서 투자자들이 몰렸던 공모주도 외면받고 있다. 지난해 상장한 ‘대어급 공모주’ 5종목 중 4종목의 주가가 반 토막 났고, 올해 대어급으로 꼽혔던 공모주들은 연이어 흥행에 실패하는 모습이다.지난해 당시 최대 증거금(81조 원)으로 화제가 됐던SK아이이테크놀로지는 4일 종가 기준 주가가 5만5200원으로 공모가(10만5000원) 대비 47% 하락했다. 마찬가지로 지난해 투자자들이 몰렸던 카카오뱅크는 공모가 3만9000원에서 현재가 2만350원으로, 카카오페이는 공모가 9만원에서 현재가 4만9350원으로 각각 47.8%, 45.1% 하락했다. 지난 1월 주가가 처음으로 공모가 대비 40% 이상 떨어져 청산 기준가 아래로 내려갔던 크래프톤의 경우 현재가가 21만 4000원으로 공모가(49만 8000원) 대비 57% 하락한 상태다. 지난해 상장한 대형주 중 현재 주가가 공모가를 상회하거나 유지하는 기업은SK바이오사이언스(공모가 6만5000원) 정도로 손에 꼽는다.상황이 이렇다 보니 올해 기업공개(IPO) 시장은 위축된 모습이다. 3일 한국거래소에 따르면 올해 3분기까지 신규 상장한 기업은 총 48사로 지난해 동기 대비 17개 감소한 것으로 나타났다. 누적IPO공모 금액은 약 15조2366억원으로 지난해 같은 기간 14조5000억원보다 늘었지만 올해 1월 상장한 ‘최대어’LG에너지솔루션 공모금액을 제외하면 2조4000억원대에 그친다.지난달 30일 상장한 올해 하반기 공모주 ‘대어’ 더블유씨피(WCP)도 첫날부터 고전을 면치 못했다. 이날WCP의 시초가는 공모가 대비 10% 낮은 5만4000원으로, 종가는 이보다도 1만2300원 낮아진 4만1700원이었다. 지난 8월 상장한 유니콘 기업(기업가치 1조원 이상의 스타트업) 쏘카 또한 현재가가 1만6500원으로 공모가 2만 8000원 대비 41% 하락했다."
2023-08-01,오전 오르다 오후 줄줄이 하락... 2차전지주 급반전 배경엔,"경영진 자사주 매각 공시에 동반 급락에코프로비엠 청주 오창 본사 전경.1일 주식시장에서 이차전지 관련 종목들이 줄줄이 하락세로 마감했다. 코스닥 대장주인 에코프로비엠이 전일 대비 2.51% 내린 40만8500원에 장을 마쳤고, 최근 연일 신고가 행진을 이어온 금양도 4.53% 하락한 15만1900원에 장을 마감했다. 이 밖에 엘앤에프(-3.88%)와 포스코홀딩스(-3.27%), 더블유씨피(-3.02%) 등 다른 이차전지주들까지 전일 대비 크게 밀린 채 거래를 마쳤다. 에코프로비엠의 지주사인 에코프로만 거의 유일하게 0.08% 오른 120만8000원에 거래를 종료해 ‘황제주(주가 100만원이 넘어가는 주식)’의 자존심을 지켰다.전날에 이어 이날 오전까지만 해도 대부분 상승세를 보인 이차전지 종목들은 오후가 되며 분위기가 180도 바뀌었다. 에코프로비엠과 금양 고위 임원들이 지난달 27일 주가가 급락하기 직전에 자사주를 대거 팔아치웠다는 공시 내용이 나온 게 직격탄이었다. 통상 임원 등 경영진의 자사주 매각은 주가가 고점이라는 신호로 해석된다. 가뜩이나 이차전지 주가가 지나치게 과열된 것 아니냐는 우려가 제기되는 가운데, 고위 임원들의 자사주 매각이라는 악재까지 겹치면서 투자 심리를 위축시킨 것으로 보인다.이날 금융감독원 전자공시에 따르면, 에코프로비엠의 서준원 전무, 김홍관 전무, 박지영 상무, 이경섭 상무 등 임원 4명은 지난달 27~28일에 걸쳐 자사주 5790주, 약 26억원 규모를 장내 매도했다. 국내 증시에선 매도 체결일 2거래일 후에 결제하는 것을 고려하면 이들이 매도 주문을 낸 시점은 지난달 25~26일로 추정된다. 27일 에코프로비엠 주가는 17.25%나 급락했는데 그 직전에 자사 주식을 대량 처분한 것이다. 특히 지난 26일은 에코프로비엠이 장중 50만원을 사상 처음으로 돌파하며 신고가를 세운 날이다. 이에 앞서 최문호 에코프로비엠 사장도 지난달 13일 자사주 7억8380만원어치를 장내 매도한 바 있다.비슷한 시기, 금양 임원도 주가 급락 직전 자사주를 판 것으로 나타났다. 금감원 공시에 따르면, 금양 허재훈 상무는 지난달 27일(결제일 기준), 보유 주식 4만주(약 60억원어치)를 장내 매도했다. 실제 매매 체결일로 추정되는 25일, 금양은 장중 신고가 기록을 갈아치우고 있었다. 허 상무의 주식 처분 단가는 주당 15만1615원으로 25일 장중 최고가(15만7000원)에 근접한 수준이다. 공교롭게도 해당 지분 매도 직후인 27일 금양 주가는 22.4%나 빠졌다.이차전지 섹터를 대표하는 두 기업 임원진의 주식 현금화 소식이 잇따라 전해지면서 개인들의 투자 심리는 얼어붙고 있다. 다만 증권가에선 “임원진이 주가가 고점일 때 일부 차익 실현에 나선 것을 지나치게 확대해석할 필요는 없다”는 지적도 나온다. 이날KB증권은 에코프로비엠의 목표 주가를 기존 16만원에서 50만원으로 올렸다. 전기차에 대한 양극재 출하량이 늘어날 것으로 예상한다는 이유다."
2023-07-03,검증에만 최소 4년…‘K-분리막’도 급성장 “2030년 100억 달러”,"국내 배터리 3사의 분리막 수요가 크게 늘며 2030년께는 100억 달러(약 13조1000억원) 규모를 넘어설 것이란 전망이 나왔다. 글로벌 전기차 시장이 급성장하면서 배터리와 함께 그 주요 부품인 분리막 역시 대거 필요해지고 있어서다.LG에너지솔루션 공장 전경. 사진 충북도3일 시장조사업체SNE리서치에 따르면LG에너지솔루션·삼성SDI·SK온 등 국내 배터리 3사의 분리막 수요(금액 기준)는 올해부터 2030년까지 연평균 17% 성장해 104억 달러(약 13조6000억원)에 달할 전망이다.이에 따라 이들 업체에 분리막을 공급하고 있는 국내 제조사인SK아이이테크놀로지(SKIET)와 더블유씨피 역시 몸집을 불릴 것으로 관측된다. 분리막은 배터리의 양극과 음극이 닿지 않도록 해 폭발을 방지하는 핵심 부품인데, 안전과 직결돼 있어 기술 장벽이 높다. 분리막 공급 업체를 변경하려면 완성차 업체의 승인을 받기까지 최소 4년가량 걸려 시장을 선점한 업체의 성장세가 가파를 것으로 보인다.분리막의 주요 원료인 폴리에틸렌(PE)과 폴리프로필렌(PP)이 석유화학 분야에서 널리 쓰이는 범용 수지인 덕에 원료 가격 변동에 큰 영향을 받지 않는다는 점도 관련 제조업체들의 성장을 견인하는 동력이다.중국 창저우에 있는SK아이이테크놀로지 분리막 생산 공장 전경. 사진SK아이이테크놀로지현재SK온은SK계열사인SKIET에서, 삼성SDI는 더블유씨피에서 주로 분리막을 공급받고 있다.LG에너지솔루션의 경우 일본 도레이와 긴밀한 관계지만 소형 배터리에 대해선 더블유씨피에서 분리막을 수급 중이다.해외 배터리 업체에서 추가 수주를 받을 가능성이 커지고 있다.SKIET는 폴란드에, 더블유씨피는 헝가리에 각각 분리막 생산라인을 가동·구축 중이며 올해 안으로 북미 진출을 타진하고 있다.━대규모 자금 조달 나선 배터리 3사한편 국내 배터리 업체들은 부쩍 대규모 자금을 조달하는 데 팔을 걷어붙이고 있다. 전 세계적으로 전기차 시장이 성장하고 있는 데다 미국 인플레이션감축법(IRA) 시행까지 맞물려 배터리 공장 역시 쉴 새 없이 돌아가고 있어서다.김철중SK아이이테크놀로지(SKIET) 사장이 지난 3월 중국 창저우시에 위치한 생산공장을 방문해 관계자들과 생산 시설을 둘러 보고 있다. 연합뉴스최근LG에너지솔루션은 첫 회사채를 발행해 흥행에 성공했다. 수요 예측에 4조7200억 이 몰려 당초 신고 금액인 5000억원의 두 배 규모인 1조원으로 발행 금액이 최종 확정됐다.SK온도 최근 잇달아 대규모 투자를 유치했다. 이 회사의 모기업인SK이노베이션은 지난달 싱가포르계 신규 재무적 투자자(FI)로부터 4억 달러(약 5200억원)를 끌어들인 바 있다. 지난 5월에는MBK컨소시엄 및 사우디아라비아SNB캐피털을 통해 1조2400억원 규모의 상장 전 지분 투자를 유치하기도 했다. 이 밖에도 글로벌 채권 시장, 유럽 공적 수출신용기관(ECA), 미국 에너지부 등 각종 기관을 통한 정책지원 자금 등을 통해 재원을 확보 중이다.업체들은 이렇게 끌어들인 자금으로 생산 능력을 확대하고 연구개발(R&D) 능력을 키우는 데 투입할 계획이다.LG에너지솔루션은 회사채 발행으로 확보한 1조원 중 1000억원은 양극재 등 원재료를 구매하는 데 쓰고, 나머지 9000억원은 스텔란티스·현대차그룹·혼다 등과 만든 북미 합작법인에 대한 투자 자금으로 쓸 예정이다.R&D 투자 역시 매년 늘리는 추세다.SK온 역시 미국·유럽·중국 등에 있는 전기차 배터리 공장의 생산 능력 확대에 공격적으로 자금을 투입한다고 밝혔다."
2023-07-10,“북미 분리막 시장 2030년엔 7조원”…한국 업체가 석권할 듯,"글로벌 전기차 시장이 급성장하며 북미 배터리 분리막 시장이 2030년께는 7조원 가까이 커질 것이라는 전망이 나왔다. 국내 분리막 기업들의 성장세 역시 가파를 것으로 보인다.중국 창저우에 있는SK아이이테크놀로지 분리막 생산 공장 전경. 사진SK아이이테크놀로지10일 시장조사기관SNE리서치는 북미 전기차 배터리 분리막 시장 규모가 지난해 7억3000만 달러(약 9500억원)에서 2030년 53억1000만 달러(약 6조9000억원)까지 연평균 28%씩 성장할 것이라고 밝혔다.이런 상황 속에서 국내 주요 분리막 업체인SK아이이테크놀로지(SKIET)와 더블유씨피가 북미 시장을 석권할 가능성이 매우 크다고SNE리서치는 내다봤다. 북미에는 습식 분리막 제조 업체가 거의 없다시피한데, 배터리의 핵심 부품인 분리막은 안전과 직결돼 있어 기술 장벽이 매우 높기 때문이다.이 회사 관계자는 “미국 인플레이션감축법(IRA) 시행으로 중국 분리막 업체들의 북미 진출이 사실상 막혔다는 점도 국내 업체들에겐 도움이 될 수 있다”고 기대했다."
