date,title,content
2023-04-22,"79조 손실 올들어 만회했다는 국민연금, 무슨 종목 샀길래","전북 전주의 국민연금공단 건물./뉴스1지난해 최악의 수익률을 보였던 국민연금이 올해 1분기 국내외 증시 훈풍에 힘입어 손실을 대부분 만회한 것으로 알려졌다. 국민연금은 지난해 글로벌 금리 인상으로 인한 주식시장 약세 속에 연간 -8.22% 운용 수익을 기록했다. 평가손실액은 79조 6000억원에 달했다.이런 손실을 만회하기 위해 국민연금이 주목한 종목은 무엇이었을까. 22일 금융정보업체 에프앤가이드가 이달 11일 기준으로 국민연금이 5% 이상 대량 지분을 보유한 상장사를 집계한 결과 국민연금은 레저, 항공운수, 해상운수 등 종목에 대한 지분을 늘리며 엔데믹(endemic·감염병의 풍토병화) 대응에 나선 것으로 나타났다.부동산PF위험 노출 우려? 금융주 축소국민연금은 지난해 4분기 들고 있던 종목 289개 종목 중 올해 1분기 85개 종목에 대한 투자를 축소한 것으로 나타났다. 반면 투자를 확대한 종목은 56개, 신규로 5% 이상 대량 보유 종목에 편입한 종목은 18개로 투자 종목 축소 경향성이 더 컸다.지난해 4분기 보유 종목 중 축소 비중이 컸던 분야는 보험, 상업은행, 게임, 식료품, 전기 장비 등이었다. 보험에서는 지난해 4분기 6.1% 지분을 보유하고 있던 메리츠화재가 상장 폐지되면서 제외됐고 삼성화재(8.71%→7.71%), 현대해상(11.62%→11.25%),DB손해보험(10.32%→10.12%), 삼성생명(6.87%→6.86%) 등에 대한 지분을 축소했다. 보험사들은 금리 인상기에 투자하기 좋은 것으로 평가되고, 실제 지난해 실적도 좋았지만 이미 실적 개선에 대한 기대가 반영됐다는 판단 속에 다른 주식과의 매력도를 비교하는 과정에서 비중을 줄인 것이 아니냐는 분석이 나온다.상업은행주 중에서는 은행은 지난 4분기 대량보유종목 9개 중DGB금융(10.05%→8.78%),JB금융(8.21%→7.17%), 우리금융(7.86%→6.84%),BNK금융(9.48%→8.47%)에 대한 지분을 축소했다. 은행주 중에서는 신한지주에 대한 지분만 7.96%에서 8.01%로 확대했다. 한 금융투자업계 관계자는 “특히 지방은행에 대한 비중을 줄인 것이 눈에 띄는데 미국 실리콘밸리은행 파산 사태를 염두에 뒀을 수 있고, 국내에서는 부동산PF노출 문제 등을 고려한 것일 수 있다”고 했다.이 밖에 국민연금이 공개매수에 참여한 것으로 알려진SM엔터테인먼트를 포함해 현대에너지솔루션,KT&G,테이팩스, 나노신소재, 더네이쳐홀딩스, 하이록코리아, 다우기술, 동원시스템즈,SK디앤디, 와이지-원, 대신증권,SK디스커버리, 인텍플러스,CJ프레시웨이, 대주전자재료, 큐리언트, 파크시스템스, 영풍, 천보, 카카오페이 등의 상장사 지분을 5% 미만으로 낮췄다.2023년 1분기 국민연금 5% 이상 지분 보유 신규 편입 종목레저·항공·해운, 코로나 타격 종목 확대투자를 확대한 분야는 코로나 펜데믹 시기 타격이 컸던 레저, 해상운수, 항공운수 등이었다. 외국인 관광객이 늘어나고 해외 여행객도 급증하는 엔데믹 시기에 발맞춘 것으로 볼 수 있다.레저 분야에서는 지난해 주가가 크게 떨어졌던 쏘카와 롯데관광개발이 새롭게 5% 이상 대량 지분 보유 종목이 됐다. 세븐럭 카지노를 운영하는GKL에 대한 지분을 8.94%에서 10.54%로 1.6%포인트 늘렸고 하나투어 지분도 6.52%에서 8.67%로 2.15%포인트 대폭 확대했다.운송량이 늘며 항공과 해운주의 전망도 긍정적으로 내다본 것으로 파악된다. 제주항공의 지분을 6.04%에서 8.11%로 확대했고, 진에어의 지분은 7.31%에서 10.66%로 3% 이상 늘렸다. 한진칼 지분도 5.06%로 늘려 신규 5% 이상 지분 보유 종목에 포함됐다. 해상운수 분야에서는 지난해 4분기 들고 있던 2 종목(대한해운, 팬오션)의 지분을 모두 1% 가량 확대했다.자동차부품과 의료기기에 대한 투자를 확대한 것도 확인됐다. 국민연금은 지난해 4분기 보유하고 있던 13개 자동차부품 종목 중 5개에 대한 투자를 확대했고 1종목만 축소했다. 한국앤컴퍼니(6.01%→6.18%), 현대위아(9.73%→10.05%),HL만도(11.04%→11.4%), 한국단자(11.31%→11.79%), 넥센타이어(6.06%→7.07%) 등이다.의료장비 중에서는 맥아이씨에스가 신규 대량 지분 보유 종목에 올랐고 인터로조(10.93%→11.29%), 덴티움(8.36%→9.96%), 레이(5.32%→7.33%) 등에 대한 투자를 확대했다. 이 중 덴티움, 레이는 임플란트 관련 회사로 이 분야 1위인 오스템임플란트가 상장 폐지되면서 반사이익을 얻을 것으로 기대한 것이 아니냐는 추측이 나온다."
2022-09-08,“내가 사장 될 이름인가” 1000社 대표 중 같은 이름 8명,"기업분석전문 한국CXO연구소가 추석 앞두고 1000대 기업CEO의 이름과 월별 출생 현황을 조사한 결과 가장 많은 이름은 ‘영준’으로 조사됐다고 8일 밝혔다. 1000대 기업 대표이사 중 8명이 ‘영준’이라는 이름을 쓰고 있었다. 매출액 순으로 살펴보면 롯데케미칼 이영준 대표이사를 비롯해 현대건설 윤영준 사장, 오뚜기 함영준 회장, 에스엠 탁영준 대표이사, 더네이쳐홀딩스 박영준 대표이사, 이수페타시스 서영준 대표이사, 삼양홀딩스 이영준 대표이사, 국보디자인 이영준 대표이사였다. ‘정훈’(7명), ‘용석‧승우’(각6명), ‘재호’(5명)가 뒤를 이었다.한국CXO연구소가장 많은 성은 김씨로 270명이었다. 이씨가 197명, 박씨가 88명, 정씨가 73명, 최씨가 67명이었다. 1000대 기업CEO중에는 1월에 태어난 경우가 150명(11.1%)으로 가장 많았다. 이어 8월(134명, 9.9%), 3월생(132명, 9.8%) 순이었다. 반면 4월생은 90명(6.7%)으로 가장 적었고, 12월생(91명, 6.7%)과 6월생(98명, 7.3%)도 100명 미만이었다."
2022-12-14,"엔데믹 등굣길 특수 잡아라, 벌써부터 ‘책가방 대전’","신학기 대목을 앞두고 책가방 대전이 한창이다. 캐릭터를 활용한 디자인부터 재활용 소재로 만든 책가방, 모노그램 디자인까지 다양하 다. [사진 각 사]2023 토끼해 신학기를 앞두고 아동 패션 업계가 들썩이고 있다.13일 관련 업계에 따르면 주요 포털 사이트에서 ‘초등학생 책가방’ 검색량이 증가하고 있다. 보통 11월부터 조금씩 증가하기 시작해, 1월에서 2월 사이 가장 높다. 올해 초에는 대면 수업이 재개되면서 관련 매출이 한 차례 뛴 것으로 나타났다. 더네이쳐홀딩스 내셔널지오그래픽 관계자에 따르면 원격수업을 하던 지난해 11~2월에 비해, 올해 같은 기간 신학기 아동 책가방 매출이 481% 늘었다.신학기 대목을 앞두고 책가방 대전이 한창이다. 캐릭터를 활용한 디자인부터 재활용 소재로 만든 책가방, 모노그램 디자인까지 다양하 다. [사진 각 사]이에 최근 ‘내셔널지오그래픽’ ‘MLB키즈’ ‘블랙야크 키즈’ ‘빈폴 키즈’ ‘디스커버리 익스페디션’ ‘닥스 키즈’ 등 주요 아동 패션 브랜드가 일제히 신학기 책가방 라인업을 공개했다. 주로 저학년을 위한 책가방은 ‘경량화’에, 고학년은 ‘수납력’에 초점을 맞춘 것이 특징이다. 삼성물산 패션부문의 빈폴 키즈는 브랜드 상징인 토끼 캐릭터 ‘빙키’를 활용한 시리즈 상품을 선보였다. 빈폴 키즈 신학기 책가방은 올해 12월 기준(1~13일) 전년 동기 대비 20% 이상 매출이 늘었다.신학기 대목을 앞두고 책가방 대전이 한창이다. 캐릭터를 활용한 디자인부터 재활용 소재로 만든 책가방, 모노그램 디자인까지 다양하 다. [사진 각 사]헤지스 키즈는 우주에서 영감을 받은 ‘챌린저 라인’을 출시, 오로라를 연상시키는 터치LED와 야광 패턴을 더해 아이들의 상상력과 호기심을 자극한다.MLB키즈는 주로 명품 가방 등에 활용하는 모노그램(두개 이상 글자를 겹친 도안) 디자인을 더한 책가방을 냈다. 고급 자카드(무늬 직조 직물) 소재에 모노그램 패턴을 더하고, 골드 리벳(못), 키링 등으로 장식한 것이 특징이다. 아동용 책가방을 둘러싼 시장 경쟁은 점차 치열해지고 있다. 무엇보다 가방과 신발 주머니 등 세트 가격이 평균 20만원대를 웃도는 등 고급화 트렌드가 뚜렷하다."
2022-12-13,'20만원 책가방' 불티난 이유…아이 한명에 8명이 돈 쓴다,"2023년 토끼해 신학기를 앞두고 아동 패션 업계가 들썩이고 있다. 신학기는 내년 3월이지만 관련 용품을 미리 준비하거나 연말 선물로 마련하는 경우가 많아 이맘때가 성수기여서다.신학기 대목을 앞두고 아동 패션 브랜드의 책가방 대전이 한창이다. 토키 캐릭터 '빙키' 모티브의 가방을 내 놓은 빈폴 키즈. 사진 삼성물산13일 관련 업계에 따르면 주요 포털 사이트에서 ‘초등학생 책가방’ 검색량이 증가하고 있다. 보통 11월부터 증가하기 시작해 1~2월 사이가 가장 높다. 더네이쳐홀딩스 내셔널지오그래픽에 따르면 원격 수업을 하던 지난해 11월~2월에 비해 올해 초 같은 기간 신학기 아동 책가방 매출이 481% 늘었다. 내년에는 실내외에서 마스크를 벗는 완전 엔데믹도 예상돼 업계 기대감이 더하다.네이버 랩스에서 '초등학생 책가방'의 2021년 12월에서 2022년 12월 사이 검색량 추이. 해당 검색어가 검색된 횟수를 일별, 주별, 월별 각각 합산하여 조회기간 내 최다 검색량을 100으로 설정하여 상대적인 변화를 나타낸다. 올해 12월 구간의 검색량이 가장 높게 나타났다.━저학년은 ‘경량화’,고학년은 ‘수납력’최근 ‘내셔널지오그래픽’ ‘MLB키즈’ ‘블랙야크 키즈’ ‘빈폴 키즈’ ‘디스커버리 익스페디션’ ‘닥스 키즈’ 등 주요 아동 패션 브랜드가 일제히 신학기 책가방 라인업을 공개했다. 주로 저학년을 위한 책가방은 경량화에, 고학년은 수납력에 초점을 맞춘 게 특징이다. 내셔널지오그래픽은 저학년용으로 경량 책가방 ‘뉴비’를, 고학년용으로 18L 용량과 2단 분리 주머니로 수납 기능을 높인 ‘옵티머스’ ‘네오’를 출시했다.내셔널지오그래픽은 노란 네모와 로고와 산뜻한 색감이 매력인 신제품을 8종 내놨다. 사진 더네이쳐홀딩스재활용 소재를 사용하는 등 지속가능성에 초점을 맞춘 제품도 등장했다. 디스커버리는 모든 신제품에PET병을 재활용한 친환경 섬유 소재인 ‘에코-테크’를 사용했다. 세균 번식을 억제하는 항균 안감을 적용해 마스크 같은 소지품도 청결하게 보관할 수 있도록 했다는 설명이다.━스팽글·LED등 책가방도 톡톡 튀게캐주얼한 느낌의 아웃도어 브랜드 가방과 달리 패션 브랜드 책가방은 주로 각진 형태로 클래식한 느낌을 풍기는 제품이 많다. 여기에 올해는 스팽글(반짝거리는 작은 조각), 오로라 컬러 등 톡톡 튀는 디자인을 더한 제품들이 대거 출시돼 눈길을 끈다.올해는 파스텔톤에 스팽클,LED등 반짝이는 소재를 활용한 디자인이 눈에 띈다. 사진 서양네트웍스삼성물산 패션부문의 빈폴 키즈는 브랜드 상징인 토끼 캐릭터 ‘빙키’를 활용한 시리즈 상품을 선보였다. 반짝거리는 소재와 오로라 컬러 스팽글 디자인으로 사랑스러움을 더했다는 설명이다. 빈폴 키즈 신학기 책가방은 올해 12월 기준(1~13일) 전년 동기 대비 20% 이상 매출이 늘었다.헤지스 키즈는 우주에서 영감을 받은 ‘챌린저 라인’을 출시, 오로라를 연상시키는 터치LED와 야광 패턴을 더해 아이들의 상상력과 호기심을 자극한다.아이들의 호기심을 자극하는 우주 소재 디자인을 선보인 헤지스 키즈. 사진 헤지스 키즈━명품 디자인 더한 책가방도어른용 못지 않은 고급스러운 디자인의 제품도 눈에 띈다.MLB키즈는 주로 명품 가방 등에 활용하는 모노그램(두 개 이상 글자를 겹친 도안) 디자인을 더한 책가방을 냈다. 고급 자카드(무늬 직조 직물) 소재에 모노그램 패턴을 더하고, 골드 리벳(못), 키링 등으로 장식한 것이 특징이다. 아이들을 위한 가방이다 보니 기능에도 신경을 썼다. 야간에 빛을 받으면 반사하는 효과가 있는 소재를 전면에 부착하고, 멜빵 부문에는 호신용 호루라기도 더했다.고급스러운 모노그램 패턴 디자인을 선보인MLB키즈. 사진 F&F출산율 저하로 취학 아동 수가 갈수록 줄어들고 있는 상황에도 아동용 책가방을 둘러싼 시장 경쟁은 치열해지고 있다. 무엇보다 가방과 신발 주머니 등 세트 가격이 20만원대에 육박하는 등 고급화 트렌드가 뚜렷하다. 유아동 패션 업계는 부모와 친·외가 조부모는 물론, 이모·삼촌까지 아이 한 명에게 8명이 지갑을 여는 이른바 ‘에잇 포켓(eightpocket)’ 시장이기도 하다.임지연 삼성패션연구소장은 “키즈 신학기 책가방은 남·여아 간 스타일 차이가 뚜렷하게 나타나고 있다”며 “남아는 실용성, 내구성을 중시한 상품이 주를 이루고, 여아는 귀여운 디자인에 재미까지 주는 상품이 인기를 끌고 있다”고 분석했다. 이어 “가성비를 갖추면서도 차별화한 디자인이 적용된 아이템이 주목 받고 있다”고 덧붙였다."
2022-09-08,1000대 기업 CEO 이름 중 가장 흔한 이름은? ‘영준’ ‘정훈’ ‘용석’ 순,"1000대 기업CEO성(姓)씨 비중TOP10. 자료 한국CXO연구소국내 1000대 기업 최고경영자(CEO) 가운데 ‘영준’이란 이름을 가진CEO가 가장 많은 것으로 나타났다.기업분석전문 한국CXO연구소는 국내 1000대 기업의 올해 반기보고서에 등재된CEO급 1350명을 대상으로 한 ‘2022년 1000대 기업 대표이사 이름 및 월별 출생 현황 조사’ 결과를 8일 발표했다.조사 결과 국내 1000대 기업에서는 김(金)씨 성을 가진CEO가 270명(20%)으로 가장 많았다. 이어 이(李)씨가 197명(14.6%), 박(朴)씨 88명(6.5%)이었다. 또 정(鄭)씨(73명·5.4%), 최(崔)씨(67명·5%) 조(趙)씨(45명·3.3%), 강(姜)씨(35명·2.6%) 등이 뒤를 이었다.이 같은 결과는 국내 성씨별 인구와 무관치 않다. 2015년 기준 통계청이 발표한 인구총조사 결과에 의하면 김씨 성을 쓰는 국민은 1000만명이 넘어 21.5%로 비중이 가장 컸다. 이어 이씨 14.7%, 박씨 8.4%, 최씨 4.7%, 정씨 4.3%, 강씨 2.4%, 조씨 2.1%, 윤(尹)씨 2.1% 순으로 100만명이 넘었다.1000대 기업 내 동일 이름 최다CEO현황. 자료 한국CXO연구소이름의 중간 글자로는 ‘영’이 들어간CEO가 72명으로 가장 많았다. 한자는 ‘永(길 영)’을 쓰는 경우가 18명으로 가장 많았다. 이어 榮(영화·꽃 영) 15명, 英(꽃부리·뛰어날 영) 13명 순으로 조사됐다. ‘영’자 다음으로는 성(62명), 재(58명), 정(53명), 상(46명), 동(44명), 종(43명) 등의 글자를 가운데 이름에 많이 사용하고 있었다.이름의 마지막에는 ‘호’가 들어간CEO가 61명으로 가장 많았으며, 그중 한자는 ‘浩(넓을 호)’를 쓰는 경우가 16명으로 가장 많았다. 이어 석(57명), 수(55명), 영(46명), 식·환(각 44명), 준(42명), 규(40명) 순으로 파악됐다. ‘鎬(호경 호)’도 15명으로 비교적 많은 편에 속했다.다만 실제 ‘김영호(金永鎬)’라는 한자 이름을 쓰는CEO는 한 명도 없다고CXO연구소는 전했다.성(姓)에 상관없이 가장 많이 사용하고 있는 이름은 ‘영준’이었다.이영준 롯데케미칼 대표이사, 함영준 오뚜기 회장, 탁영준 에스엠 대표이사, 박영준 더네이쳐홀딩스 대표이사, 서영준 이수페타시스 대표이사, 이영준 삼양홀딩스 대표이사, 이영준국보디자인 대표이사 등 1000대 기업 대표이사 중 8명이 ‘영준’이라는 이름을 쓰고 있었다.‘정훈(7명)’,‘용석·승우(각 6명)’,‘재호(5명)’ 등의 이름을 사용하는CEO도 비교적 많은 편에 속했다.1000대 기업CEO성(姓)씨 비중TOP10. 자료 한국CXO연구소조사 대상CEO들이 많이 태어난 달은 1월(150명·11.1%)이었고 8월(134명·9.9%), 3월생(132명·9.8%) 순으로 많았다. 4월생(90명·5.4%)이 가장 적었고 12월생(91명·6.7%)과 6월생(98명·7.3%)도 100명 미만이었다."
