date,title,content
2024-03-19,몸값 뛰는 ADC에 삼성도 도전장…잭팟 노리는 국내・외 바이오기업,"지난달 16일 이재용 삼성전자 회장이 삼성바이오로직스 인천사업장에 있는ADC(Antibody-drugconjugate,항체-약물 접합체) 제조시설 건설 현장에서 관계자의 설명을 듣고 있다. 사진 삼성전자글로벌 바이오 기업들이 미래 먹거리로 점찍은 항체·약물 접합제(ADC) 기술 시장에서 국내 기업들이 발 빠른 추격전을 벌이고 있다. 기술 개발과 시설 투자에 속도를 내며 급성장하는 시장에 올라타는 중이다. 특히 미국과 중국 갈등이 바이오 산업까지 확산하며ADC위탁개발생산(CDMO) 분야에서 국내 기업의 반사이익도 예상된다.━삼성, 美ADC기업 브릭바이오에 투자삼성물산과 삼성바이오로직스, 삼성바이오에피스가 공동 출자한 ‘라이프 사이언스 펀드’는 19일 미국 바이오의약품 개발 기업인 브릭바이오에 투자를 결정했다고 밝혔다. 구체적인 투자 규모는 공개하지 않았다. 지난 2021년 결성된 라이프 사이언스 펀드는 삼성이 생명과학 분야 신기술과 사업 개발을 위해 조성한 벤처 투자 펀드로 운용 규모는 2420억원이다.2019년 설립된 브릭바이오는 인공 아미노산을 활용해 단백질을 특정 위치에 결합하는 기술을 보유하고 있다.ADC와 유전 질환 치료용 아데노연관바이러스(AAV) 등이 이 기업의 장점이다. 앞서 라이프 사이언스 펀드는 스위스 아라리스 바이오텍과 국내 에임드바이오 등의ADC기술 기업에도 투자했다. 이재용 삼성전자 회장은 지난달 삼성바이오로직스 인천사업장을 방문해ADC상업 생산 공장 건설현장을 둘러본 뒤 “현재 성과에 만족하지 말고 더 과감하게 도전할 것”을 주문하기도 했다.━빅파마가 주목하는ADC지난 2019년 영국 아스트라제네카와 일본 다이이찌산쿄가 공동 개발한 유방암 치료제 ‘엔허투’.사진 한국다이이찌산쿄지난해 하반기 이후 국내외 바이오 업계는ADC시장 선점을 위해 자본과 기술력을 집중적으로 투입하고 있다. 시장 조사기관 마켓유에스에 따르면 전 세계ADC시장 규모는 올해 85억 달러에서 연평균 17.5%씩 성장해 2032년 347억 달러로 커질 전망이다.ADC는 암세포를 찾아내는 항체에 약물을 결합해 정상 세포가 아닌 암세포만 선택적으로 공격할 수 있어 차세대 항암 기술로 각광받고 있다. 미국 화이자는 지난해ADC개발 기업인 시젠을 430억 달러(약 56조3000억원)에 인수하며 바이오 인수합병(M&A) 시장에 불을 지폈다. 미국 애브비(이뮤노젠 인수), 독일 머크(머사나테라퓨틱스) 등도ADC파이프라인(신약개발 프로젝트) 확보전에 뛰어들었다. 지난 2019년 영국 아스트라제네카와 일본 다이이찌산쿄가 공동 개발한 유방암 치료제 ‘엔허투’는 지난해 25억 달러(약 3조3000억원)의 매출을 올리며 글로벌 블록버스터ADC로 떠올랐다.━국내 바이오 기업도 도전장김영희 디자이너국내 바이오 기업들도 기술 개발과 위탁 생산 ‘투트랙’으로ADC시장에 나서고 있다.ADC초기 기술 분야에서 국내 기업들은 경쟁력을 인정받고 있다. 레고켐바이오사이언스는 지난해 12월 미국 얀센과 17억 달러(약 2조2000억원) 규모의ADC기술 이전 계약을 체결하며 잭팟을 터뜨렸다. 레코켐은 이전에도 미국 암젠, 중국 포순제약과ADC관련 대형 계약을 체결한 바 있다. 또 다른 국내ADC개발기업 피노바이오는 지난해 미국 컨쥬게이트바이오, 셀트리온과 기술 이전 계약을 체결했고, 인투셀도 지난해 스위스ADC테라퓨틱스와ADC플랫폼 물질 이전 계약을 맺었다. 전통 제약기업도 도전장을 던지고 있다. 동아에스티·종근당·삼진제약 등은ADC연구개발(R&D) 조직을 인수하고 후보물질 개발에 속도를 내고 있다.━미·중 갈등이 국내 시장에 호재 될까삼성바이오로직스, 롯데바이오로직스,SK팜테코 등은 위탁개발생산(CDMO) 시장에서 기회를 노리고 있다. 특히 지난 6일 미국 상원 국토안보위원회가 미국 내 중국 바이오 기업의 사업 활동을 제한하는 내용을 담은 생물보안법을 통과시키며 국내CDMO기업에 반사이익도 기대할 수 있게 됐다.해당 법안은 미 의료기관 등이 중국 베이징유전체연구소(BGI)와 계열사 컴플리트 지노믹스, 우시 앱텍,CDMO계열사 우시바이오로직스 등이 제조한 제품이나 서비스를 사용하는 것을 금지하고 있다. 우시바이오로직스는 스위스 론자, 삼성바이오로직스에 이어 글로벌 3위 규모CDMO기업으로ADC신약 위탁생산에서 강점을 보여왔다. 우시바이오로직스의 매출의 절반은 미국으로부터 발생하는 것으로 알려졌다.오기환 한국바이오협회 바이오경제연구센터장은 “중국 바이오기업에 대한 미국의 제재가 계속 이어진다면 중국의 위탁생산 사업과 신약개발 역량이 영향을 받을 수밖에 없다”고 전망했다. 바이오업계 관계자는 “ADC가 항암 시장의 주류로 떠오르고 있어 향후 시장이 더 크게 형성될 것으로 보인다”며 “국내 바이오 기업들로서는 기술 개발과 위탁 생산 양쪽에서 해외 매출을 높일 좋은 기회가 될 것”이라고 내다봤다."
2023-11-17,종근당 1.7조 기술수출…카피약 위주 ‘K제약’ 달라졌다,"종근당이 지난 6일 글로벌 제약사인 노바티스에 최대 13억500만 달러(약 1조7302억원) 규모의 초대형 기술 수출을 하는 ‘잭팟’을 터뜨렸다. 각종 퇴행성 질환에 작용하는HDAC(히스톤탈아세텔화효소) 억제제 계열의 신약 후보물질인 ‘CKD-510’의 글로벌 개발·상업화 권리를 넘기는 내용이다.같은 날 국내 바이오벤처 오름테라퓨틱은 미국계 글로벌 제약사 브리스톨 마이어스 스쿼브(BMS)와 급성 골수성 백혈병 치료제 후보물질 ‘ORM-6151’을 기술 이전하는 계약을 맺었다. 총계약 규모는 1억8000만 달러(약 2300억원)였다.김경진 기자시장의 눈길을 끈 건 계약금 규모였다. 계약금은 권리를 반환받더라도 돌려줄 필요가 없다. 종근당은 8000만 달러(약 1000억원)를, 오름테라퓨틱은 1억 달러(약 1300억원)를 각각 받았다. 16일 제약 업계 관계자는 “통상 계약금은 총 계약의 5% 내외로, 그 이상이면 좋은 조건으로 평가하며 후보물질의 가치를 객관적으로 반영하는 기준으로 삼는다”며 “종근당은 총 계약 규모의 6.1%를, 오름테라퓨틱은 55.6%를 각각 계약금으로 선수령했다. 그만큼 가치를 인정받은 것”이라고 말했다. 두 회사 모두 계열 내 최초의 혁신 신약인 ‘퍼스트 인 클래스(First-in-Class)’ 후보물질의 가치를 높게 평가받아서다.‘카피약만 만든다’는 비아냥 섞인 평가를 받아왔던 국내 제약 업계가 ‘세계 최초의 신약’ 개발에 공격적으로 나서고 있다. 신약은 타깃에 대한 최초의 약물인 ‘퍼스트 인 클래스’와 계열 내 최고의 약물을 의미하는 ‘베스트 인 클래스(Best-in-Class)’로 나뉜다. 그간 국산 신약 중에선 세계 시장에서 인정받는 ‘베스트 인 클래스’가 왕왕 있었지만, ‘퍼스트 인 클래스’는 전무한 상황이었다.‘퍼스트 인 클래스’는 개발 난도가 매우 높지만, 블록버스터로 진입하면 막대한 부가가치를 누릴 수 있다. 1980년대 초반 연 매출 10억 달러 수준이었던 글락소스미스클라인(GSK)은 위궤양 치료제 ‘잔탁’을 개발하면서 다국적 제약사로 도약했다. 전인미답의 약을 개발할 경우 그만큼 보상이 크단 의미다.퍼스트 인 클래스 신약의 가치는 더 커지고 있다. 미국 식품의약국(FDA)이 지난해 승인한 37개 신약 중 22개(약 59%)가 난치성 암 및 심혈관 질환, 유전 희귀 질환에 대한 퍼스트 인 클래스 신약이었다.국내 제약사들 역시 일제히 퍼스트 인 클래스 혁신 신약 개발에 뛰어들고 있다.JW중외제약은 자체 구축한 데이터 사이언스 플랫폼을 통해 항암·면역질환·재생의학 분야의 신약후보물질을 내놓고 있다. 최근에는 표적 탈모치료제(‘JW0061’)와 표적 항암제(‘JW2286’)를 개발, 내년 임상 개시를 앞두고 있다.대웅제약 역시 ‘특발성 폐섬유증’ 치료를 목표로 ‘베르시포로신(DWN12088)’을 연구 중이다. 섬유증의 원인인 콜라겐의 과도한 생성을 억제하는 신규 기전의 후보물질로 기대된다. 동아에스티도 타깃 면역항암제 후보물질(‘DA-4511’)에 대한 연구에 힘을 쏟고 있다. 면역세포의 면역 기능을 높이고 암 세포에 대한 공격 기능을 강화하는 방식이다. 제약 업계 관계자는 “결국 퍼스트 인 클래스 신약을 개발할 수 있는 제약사만이 실제 글로벌 신약 시장에서 수익을 낼 수 있는 구조로 가고 있다”고 말했다."
2023-11-16,카피약은 잊어라…K-제약 ‘퍼스트 인 클래스’ 전략으로 대박,"종근당이 지난 6일 글로벌 빅파마인 노바티스에 최대 13억500만 달러(약 1조7302억원) 규모의 초대형 기술 수출을 하는 ‘잭팟’을 터뜨렸다. 각종 퇴행성 질환에 작용하는HDAC(히스톤탈아세텔화효소) 억제제 계열의 신약 후보물질인 ‘CKD-510’의 글로벌 개발·상업화 권리를 넘기는 내용이다.종근당 효종연구소 연구원들이 신약후보 물질 구조를 분석하고 있다. 사진 종근당같은 날 국내 바이오벤처 오름테라퓨틱은 미국계 글로벌 제약사 브리스톨 마이어스 스쿼브(BMS)와 급성 골수성 백혈병 치료제 후보물질 ‘ORM-6151’을 기술 이전하는 계약을 맺었다. 총계약 규모는 1억8000만 달러(약 2300억원)였다.시장의 눈길을 끈 건 계약금 규모였다. 계약금은 권리를 반환받더라도 돌려줄 필요가 없다. 종근당은 8000만 달러(약 1000억원)를, 오름테라퓨틱은 1억 달러(약 1300억원)를 각각 받았다. 16일 제약 업계 관계자는 “통상 계약금은 총 계약의 5% 내외로, 그 이상이면 좋은 조건으로 평가하며 후보물질의 가치를 객관적으로 반영하는 기준으로 삼는다”며 “종근당은 총계약 규모의 6.1%를, 오름테라퓨틱은 55.6%를 각각 계약금으로 선수령했다. 그만큼 가치를 인정받은 것”이라고 말했다. 두 회사 모두 계열 내 최초의 혁신 신약인 ‘퍼스트 인 클래스(First-in-Class)’ 후보물질의 가치를 높게 평가받아서다.━“카피약만 만든다”는 옛날얘기‘카피약만 만든다’는 비아냥 섞인 평가를 받아왔던 국내 제약 업계가 ‘세계 최초의 신약’ 개발에 공격적으로 나서고 있다. 신약은 타깃에 대한 최초의 약물인 ‘퍼스트 인 클래스(First-in-Class)’와 계열 내 최고의 약물을 의미하는 ‘베스트 인 클래스(Best-in-Class)’로 나뉜다. 그간 국산 신약 중에선 세계 시장에서 인정받는 ‘베스트 인 클래스’가 왕왕 있었지만, ‘퍼스트 인 클래스’는 전무한 상황이었다.‘퍼스트 인 클래스’는 개발 난도가 매우 높지만, 블록버스터로 진입하면 막대한 부가가치를 누릴 수 있다. 1980년대 초반 연매출 10억 달러 수준이었던 글락소스미스클라인(GSK)은 위궤양 치료제 ‘잔탁’을 개발하면서 다국적 제약사로 도약한 바 있다. 전인미답의 약을 개발할 경우 그만큼 기대할 수 있는 보상이 크단 의미다.━FDA신약 중 59%는 ‘퍼스트 인 클래스’ 신약김경진 기자퍼스트 인 클래스 신약의 가치는 점점 더 커지고 있다. 미국 식품의약국(FDA)가 지난해 승인한 37개 신약 중 22개(약 59%)가 난치성 암 및 심혈관 질환, 유전 희귀 질환에 대한 ‘퍼스트 인 클래스’ 신약이었다.국내 제약사들 역시 일제히 퍼스트 인 클래스 혁신 신약 개발에 뛰어들고 있다.JW중외제약은 자체 구축한 데이터 사이언스 플랫폼을 통해 항암·면역질환·재생의학 분야의 신약후보물질을 지속해서 내놓고 있다. 최근에는 표적 탈모치료제(‘JW0061’)와 표적 항암제(‘JW2286’)를 개발, 내년 임상 개시를 앞두고 있다.JW중외제약은 혁신신약 개발 성공률을 높이기 위해 후보물질을 발굴하는 신약연구뿐만 아니라 원료합성연구까지AI(인공지능) 기술을 접목하고 있다. 사진JW중외제약대웅제약 역시 ‘특발성 폐섬유증’ 치료를 목표로 ‘베르시포로신(DWN12088)’을 연구 중이다. 섬유증의 원인인 콜라겐의 과도한 생성을 억제하는 신규 기전의 후보물질로 기대된다. 이와 관련해 지난 1월 중화권 기업과 기술수출 계약을 체결한 바 있다. 동아에스티도 타깃 면역항암제 후보물질(‘DA-4511’)에 대한 연구에 힘을 쏟고 있다. 면역세포의 면역 기능을 높이고 암 세포에 대한 공격 기능을 강화하는 방식이다.익명을 원한 제약 업계 관계자는 “결국 퍼스트 인 클래스 신약을 개발할 수 있는 제약사만이 실제로 글로벌 신약 시장에서 수익을 낼 수 있는 구조로 가고 있다”며 “막대한 개발 비용이 들지만, 반대로 자체 파이프라인을 토대로 한 새 물질이 없으면 생존 자체가 어려워지는 상황”이라고 말했다."
2022-11-04,필러·캡슐부터 CDMO까지…유럽에 K바이오 알렸다,"삼성바이오로직스 직원이 1일(현지시간) 독일 프랑크푸르트에서 열린 국제의약품박람회 행사장 내 자사 부스에서 방문객들에게 기업 경쟁력을 설명하고 있다. [사진 삼성바이오로직스]코로나19 유행이 잦아들면서 1~3일(현지시간) 독일 프랑크푸르트에서 열린 국제의약품박람회(CPHI2022)는 활기를 되찾은 모습이었다.CPHI는 원료의약품(API)과 임상시험수탁(CRO)·위탁생산(CMO), 설비·포장 등 제약·바이오 관련한 모든 분야를 다루는 세계 최대 규모의 의약품 전시회다. 올해는 170개국에서 2500여 개 업체가 참가했다. 한재덕 한미약품 주임은 “지난해보다 방문객이 1.5배는 되는 듯하다”며 “코로나19 이전 분위기를 완전히 회복했다”고 말했다.올해는 단연 ‘K-제약·바이오’가 주목받았다. 한국에서는 대형 의약품 위탁개발생산(CDMO) 기업을 포함해 62개 기업이 참여했다. 지난해의 3배에 달한다.삼성바이오로직스(삼바)는 238㎡(약 72평) 규모의 대형 부스를 차리고 인천 송도 4공장 가동에 따른 생산능력 확대와 고품질, 생산 유연성 등의 경쟁력을 자랑했다. 케빈 샤프 삼바 글로벌영업센터 상무는 “삼바는 10년 만에 세계 위탁생산(CMO) 물량의 30%에 달하는 60만4000L의 생산능력을 갖췄다”고 말했다.SK그룹의CDMO회사인SK팜테코와 롯데바이오로직스(롯바)도 부스를 꾸렸다. 셀트리온은 처음 단독 부스를 운영하면서 항체 바이오시밀러 제품과 후속 파이프라인(신약 개발 프로젝트)을 위한 파트너를 물색했다. 요그 알그림SK팜테코 신임 최고경영자(CEO)는 “세포·유전자 치료제(CGT)를 신사업으로 추가해 2026년까지 20억 달러(약 2조8000억원) 매출로 글로벌 빅5CDMO로 성장하겠다”고 말했다. 롯바는 국내·외 주요 글로벌 제약사 등과 미팅하면서CDMO사업자로서 인지도를 높이고, 고객사 확보에 나섰다.동아에스티·유한양행·한미약품 같은 대형 제약사와 중견 제약·바이오 업체들도 적극적으로 해외 마케팅에 나섰다. 국내 유일의 의약품용 캡슐 기업이자 세계 3위인 서흥은 유럽에서 규제하는 이산화타이타늄 첨가제를 뺀 ‘오로라 캡슐’로 많은 고객 문의를 받았다. 최용희 한국의약품수출입협회 팀장은 “한국 제약사들은 항생제·항암제 원료의약품이나 완제의약품 수출에 특화돼 있다”며 “최근 휴온스의 필러 등 ‘K-뷰티’ 관련 제품들이 꾸준히 주목받고 있다”고 설명했다."
2024-08-06,"법원, ‘리베이트 제약회사’ 약값 강제 인하 타당…“건강보험 등 부담 줘”","게티이미지뱅크병원 등에 리베이트를 제공한 제약사에 대해 정부가 약값 인하 처분을 하는 것은 타당한 조처라는 법원의 판결이 나왔다.서울행정법원 행정5부(재판장 김순열)는 제약회사 동아에스티가 보건복지부 장관을 상대로 낸 약제 상한금액 조정처분 취소 소송에서 원고 패소 판결을 내렸다고 6일 밝혔다.동아에스티와 임직원들은 2009년~2012년 병원 원장과 의사 등에게 3433차례에 걸쳐 44억원가량의 리베이트를 제공한 혐의로 2016년 대법원서 유죄 판결이 확정됐다. 2013~2014년에는 1억2000만원 규모의 리베이트를 제공해 2017년 부산지법 동부지원에서도 유죄 판결을 확정받았다.이에 보건복지부는 유통질서를 어지럽힌 약제의 상한금액을 조정할 수 있는 국민건강보험법과 관련 규정 등을 근거로 2018년 9월 동아에스티의 약제 130개의 상한 금액을 평균 6.54% 인하하라고 고시했다. 하지만 동아에스티는 ‘인하율 산정 방법이 잘못됐다’며 이 처분의 취소를 구하는 행정소송을 제기했고 2019년 11월 1심 법원은 ‘복지부가 약가 인하율에 산정에서 재량권을 일탈했다’며 해당 처분을 취소하는 판결을 내렸다. 이는 2021년 4월 대법원에서 확정됐다.하지만 동아에스티는 2007년부터 2017년까지 62억원 규모의 리베이트를 제공한 혐의로 2019년 7월 다시 대법원에서 다시 유죄 확정판결을 받았다. 복지부는 3건의 형사 재판 결과를 종합해 122개 동아에스티 약제에 대한 상한금액을 평균 9.63% 인하하는 내용을 2022년 4월 다시 고시했다. 동아에스티는 재차 이를 취소해달라는 소송을 제기하며 “특정 의료기관에 리베이트를 제공했다고 그 의료기관에서 처방된 모든 약제가 리베이트 대상이었다고 볼 수는 없다”며 부당금액 산정 시 특정 약제들을 제외해야 한다고 주장했다.하지만 재판부는 “리베이트가 특정 의약품의 판매촉진을 위하여 제공된 것임을 확인할 수 있는 객관적 자료가 없는 경우, 리베이트는 포괄적으로 그 회사가 취급하는 모든 의약품의 판매촉진을 위하여 제공되었다고 봄이 타당”하다며 동아에스티 쪽의 주장을 받아들이지 않았다. 이어 “리베이트 관행을 근절하지 못하면, 의약품의 선택이 리베이트 제공 여부에 따라 좌우될 우려가 있고, 그 비용은 의약품 가격에 전가되어 결과적으로 소비자와 건강보험 재정에 부담을 줌으로써 사회적 비용이 증가할 수밖에 없다”며 “원고가 주장하는 불이익보다 이 사건 처분으로 달성하려고 하는 약가의 합리적 조정, 리베이트의 근절이라는 공익이 더 중대하므로, 이 사건 처분은 비례의 원칙을 위반하였다고 볼 수 없다”고 판단했다."
2024-10-10,체형 등 반영한 ‘한국인 맞춤형 비만 치료제’ 목표 [건강한겨레],"국내 제약사, 위고비 틈새시장 경쟁비만약 위고비 열풍이 부는 가운데, 국내 제약회사도 발걸음이 빨라지고 있다. 사진은 한 시민이 항아리 둘레 크기를 측정하면서 비만 극복 의지를 상징적으로 보여주는 모습. 곽윤섭 기자‘한미약품’ ‘유한양행’ ‘동아에스티’ 등 국내 제약·바이오 업체들도 비만치료제 시장에 도전장을 내고 있다. 대체로 위고비 대비 체중 감량 효과를 개량하거나 복용 편의성, 근육 손실, 요요현상 등을 개선해 경쟁력을 확보하는 전략을 세우고 있다.한미약품은 지난해 9월 ‘H.O.P프로젝트’를 가동하며 5종의 비만치료제 파이프라인을 개발 중이다. 가장 속도가 빠른 것은 국내에서 임상 3상이 진행 중인 ‘에페글레나타이드’다. 독자적인 장기 지속형GLP-1 유사체 생산 기술을 활용해 한국인의 체형과 체중을 반영한 ‘한국인 맞춤형’ 치료제를 개발할 계획이다. 2027년 상용화가 목표다. 임상 1상 중인 ‘HM15275’ 역시 근육 손실을 최소화하면서도 25% 이상의 체중 감량 효과가 기대돼 주목받는다.유한양행은 ‘YH34160’의 미국 임상 1상을 준비 중이다.GLP-1 계열과 유사한 식욕 억제 효과를 내지만, 췌장 베타세포가 아닌 뇌 시상하부 부위에서 작용한다. 전임상 단계에서 11.9%의 체중 감량 효과를 냈고GLP-1 유사체와 병행 투여가 가능한 것도 강점이다.동아에스티는 미국 자회사 ‘뉴로보파마슈티컬스’를 통해 ‘DA-1726’의 글로벌 임상 1상을 진행 중이다.GLP-1 수용체와 글루카곤 수용체에 동시에 작용하는 이중 작용제로, 요요현상이 비교적 적다는 점을 경쟁력으로 내세운다.편의성에 초점을 맞춘 곳도 있다. ‘대원제약’과 ‘라파스’는 피부에 붙이는 비만약 ‘DW-1022’를 함께 개발 중이다. 마이크로니들 기술을 활용한 패치 형태로 성분은GLP-1 유사체인 세마글루타이드를 사용한다. 이달 임상 1상 투약을 마무리하고 결과를 분석 중이다. 중국에서 위고비의 특허권이 만료하는 2026년까지 상용화하는 것이 목표다.‘일동제약’은 자회사 유노비아를 통해 먹는 알약 형태의GLP-1 작용 비만치료제 ‘ID110521156’의 후속 임상 1상에 나섰다. 지난해 9월부터 단일 용량상승시험(SAD)을 수행한 데 이어 다중용량상승시험(MAD)에 착수했다.최지민 객원기자"
