date,title,content
2024-01-10,‘유도탄 암 치료제’ 국내도 개발 경쟁,"셀트리온·종근당·삼바 등기술 확보와 지분투자 나서올해 국내 제약·바이오사들의 항체·약물 접합체(ADC) 개발 경쟁이 뜨거워질 전망이다.ADC는 항체에 약물을 붙여 암세포를 직접 표적으로 삼아 치료하는 기술이다.셀트리온, 종근당, 동아에스티, 삼성바이오로직스 등 국내 대형 제약사들이ADC신약 개발에 뛰어들었고, 바이오 기업들 도전도 이어지고 있다. 지난달 26일 레고켐바이오는ADC후보 물질을 미국 얀센에 2조2000억원에 기술 이전하는 계약을 체결해 주목받았다.종근당은 네덜란드 바이오 기업 시나픽스에서ADC플랫폼 기술을 도입한 데 이어 올해 본격적으로ADC항암제 개발에 나선다.동아에스티는 지난달 20일ADC개발 기업 앱티스(AbTis)를 인수했다고 밝혔다. 동아에스티는 앱티스의 3세대ADC링커 플랫폼 기술과 파이프라인을 활용해 신성장 동력을 확보한다는 계획이다.셀트리온과 삼성바이오로직스는 인수·합병(M&A) 대신 지분 투자로ADC기술 확보에 나섰다. 셀트리온은 지난해 초 직간접 투자를 통해 영국ADC개발사 익수다세러퓨틱스의 최대 주주가 됐다. 이미 지난 2022년 국내ADC개발사인 피노바이오와 타깃 15개에 대한ADC플랫폼 기술 이전 계약을 체결한 셀트리온은 올해 본격적인ADC신약 개발에 들어간다.삼성바이오로직스와 삼성물산, 삼성바이오에피스는 공동으로 1700억원을 출자해 국내ADC개발 기업 ‘에임드바이오’에 지분 투자를 결정했다. 삼성바이오로직스는 올해ADC치료제 생산 시설 구축에 나선다는 계획이다. 또 알테오젠, 에이비엘바이오, 삼진제약,SK팜테코, 롯데바이오로직스 등이ADC개발에 나섰다.ADC시장은 꾸준한 성장이 예측되고 있다. 시장조사 업체 리서치앤드마켓스에 따르면, 세계ADC의약품 시장은 2022년 59억달러(약 7조7000억원)에서 2026년 131억달러(약 17조2000억원)로 연평균 22% 성장할 것으로 전망된다."
2024-11-21,"질주하는 K제약, 트럼프 시대 더 속도 낸다","삼성바이오로직스, 잇단 대형 계약으로 年 수주액 5조 넘어삼성바이오로직스 연구원이 인천 송도에 있는 생산 시설에서 바이오 의약품 설비를 살펴보고 있다. 삼성바이오로직스는 설립 후 처음으로 연 수주액 5조원을 넘겼다고 20일 밝혔다. /삼성바이오로직스삼성바이오로직스가 글로벌 제약 기업들과 대형 계약을 연달아 체결하면서 2011년 설립 이후 처음으로 연간 수주액 5조원을 넘어섰다. 20일 삼성바이오로직스는 유럽 소재 제약사와 총 6억6839만달러(약 9304억원) 규모의 위탁 생산(CMO) 계약을 맺었다고 공시했다. 앞서 지난 7월 미국 제약사와 1조4600억원 계약을 수주한 삼성바이오로직스는 10월에는 아시아 제약사와 1조7000억원의 역대 최대 규모 계약을 따냈다. 이번에도 1조원에 가까운 대규모 계약을 수주해 올해 누적 수주액이 5조2922억원으로 불었다. 이는 지난해 총 수주액 3조5009억원보다 50% 이상 늘어난 규모다.역대 최대 실적을 낸 이 회사를 비롯해 국내 제약·바이오 기업들이 ‘트럼프 2기’를 앞두고 바이오 의약품 위탁 개발 생산(CDMO)과, 바이오 복제약 개발에 박차를 가하고 있다. 두 달 후 취임하는 도널드 트럼프 미국 대통령 당선인이 중국 견제를 강화하고 약가(藥價) 인하에 나설 때 예상되는 반사이익을 누리기 위해서다.그래픽=박상훈바이오 보안법 등 트럼프 효과 기대삼성바이오로직스는 올해 3분기까지 3조2909억원 매출을 올렸다. 전년 같은 기간에 비해 26% 늘어난 규모다. 국내 제약·바이오 기업 중 최초로 연 매출 4조원을 기록할 전망이다. 삼성바이오로직스의 핵심 경쟁력은 생산능력이다. 현재 1~4공장에서 60만4000L의 생산능력을 갖췄는데, 내년 4월에는 5공장이 완공돼 78만4000L로 생산 규모가 늘어난다. 세계 1위인 론자(78만L)와 비슷한 수준이다. 삼성바이오로직스 관계자는 “글로벌 상위 제약사 20곳 중 17곳을 고객사로 확보하고 있다”며 “올해만 11건의 수주 계약을 체결해 역대 최대 수주 성과를 냈다”고 했다.미·중 갈등으로 인한 반사이익도 기대된다. 미국 의회가 발의한 ‘바이오 보안법’은 미국 기관·기업과 중국 바이오 기업의 거래를 제한하는 법안인데 트럼프 행정부가 출범하면 입법에 속도가 붙을 것으로 전망된다. 이 법이 시행되면CDMO세계시장 점유율 2위인 중국 우시바이오로직스는 늦어도 2032년까지 미국 시장에서 퇴출된다. 이 빈자리를 삼성바이오로직스가 차지할 수 있다는 기대가 나오는 배경이다. 존 림 삼성바이오로직스 대표는 지난 6월 “(바이오 보안법 제정 논의가 시작된 이후) 우리에게 오는 수주 관련 문의가 2배는 늘어난 것 같다”고 밝혔다.국내 다른 제약사들도CDMO시장에 뛰어들고 있다. 대웅바이오는 지난 9월 바이오 공장을 완공하며CDMO진출을 예고했고, 유한양행·한미약품·보령 등도CDMO사업에 힘을 쏟고 있다. 휴온스도 최근 바이오 의약품 전문 기업 팬젠을 인수하며CDMO사업에 출사표를 던졌고,SK바이오사이언스도 독일의 백신 위탁 생산 기업 지분을 인수하며 백신CDMO사업에 진출했다.바이오 복제약 노리는 제약사바이오 시밀러(바이오 의약품 복제약)를 주력으로 하는 국내 제약 회사들은 트럼프 2기의 수혜를 기대하고 있다. 앞서 트럼프 1기 때 의료비 절감을 위해 비싼 오리지널 약 대신 저렴한 바이오 시밀러 시장을 활성화했었는데, 이 기조를 2기 때 이어갈 가능성이 크기 때문이다. 내년 출범하는 트럼프 행정부가 의료비 절감을 위해 ‘약가 인하’에 나설 것으로 기대되면서, 국내 기업들의 바이오 시밀러 분야가 더욱 활성화될 전망이다.지금까지 미 식품의약국(FDA)이 허가한 바이오 시밀러 61종 중 14종이 한국에서 개발한 것이다. 미국에 이어 둘째로 많은FDA허가 바이오 시밀러를 낸 것이다.FDA허가 바이오 시밀러는 셀트리온이 5종, 삼성바이오에피스가 8종이다. 동아에스티도 지난달 자가면역질환 치료제 스텔라라의 바이오 시밀러 ‘이뮬도사’의FDA허가를 받고 글로벌 출시를 준비 중이다.셀트리온은 “바이오 시밀러 사용을 독려하는 방향으로 산업 환경이 변화할 것으로 분석된다”며 “트럼프 2기 때 판매량 확대를 이끌 기회가 만들어질 것”이라고 했다. 셀트리온은 연내 자회사 형태로 공장을 확보해CDMO사업에도 진출하겠다는 계획이다.바이오 업계 관계자는 “트럼프 2기를 맞아CDMO와 바이오 시밀러 분야를 중심으로 국내 업체에도 큰 기회가 찾아올 것으로 보인다”면서도 “바이오 보안법의 경우 시행까지 기간이 많이 남았고 국내 업체들은 미국 내 생산 시설이 없는 경우가 많아 장기적인 전략이 필요하다”고 했다.☞CDMO(위탁 개발 생산)CDMO는 고객사의 주문을 받아 바이오 의약품을 대신 개발하고 생산까지 하는 것을 뜻한다. 반도체의 파운드리(위탁 생산)와 비슷한 개념이다. 제약·바이오 업체들은 생산 인프라 구축에 드는 비용을 절감하고 연구·개발(R&D) 효율을 높이기 위해CDMO기업과 계약을 맺는다.CDMO기업은 ‘의약품 위탁 개발(CDO)’과 ‘의약품 위탁 생산(CMO)’을 구분해 별도로 수주하는 경우도 있다."
2024-11-20,케이캡·펙수클루·자큐보… ‘위장약 삼국지’ 시작됐다,"HK이노엔,FDA허가까지 계획대웅제약은 종근당과 ‘공동전선’제일약품, 가격 경쟁력을 무기로국내 제약 업체들의 ‘3세대 위장약’ 경쟁이 격화하고 있다. 위장약은 작용 기전과 효능에 따라 1~3세대로 구분하는데, 1세대는 위산을 직접 중화하는 제산제를 주로 말하고 2세대는 히스타민 수용체를 차단해 위산 분비를 줄이는 경우를 말한다. 3세대 위·식도 역류 질환 치료제는 ‘칼륨 경쟁적 위산 분비 억제제(P-CAB)’가 주목받고 있다. 칼륨의 작용을 방해해 위산 분비를 막는 방식으로 기존 치료제 대비 약효가 길고 편의성이 좋아 시장점유율이 빠르게 늘고 있다. 이 시장을 선점한HK이노엔과 이를 바짝 추격하던 대웅제약이 경쟁하고 있었는데, 후발 주자인 제일약품까지 합류하면서 ‘3파전’이 본격화하는 모양새다.국내P-CAB시장 점유율 1위는HK이노엔의 ‘케이캡’이다. 2019년 30호 신약으로 국내 출시된 케이캡은 누적 처방액 6500억원을 넘기면서HK이노엔의 실적을 견인하고 있다. 케이캡 매출은 출시 후 연평균 8.8% 늘어났다.HK이노엔은 케이캡 출시 후 종근당과 공동 판매를 진행해 왔으나, 올해 초 파트너를 보령으로 교체했다. 케이캡 판매 호조에 힘입어 보령 매출도 크게 올랐다. 업계에 따르면HK이노엔은 케이캡의 미 식품의약국(FDA) 허가까지 계획하고 있다.케이캡의 뒤를 대웅제약의 ‘펙수클루’가 쫓고 있다. 34호 신약으로 2022년 7월 출시해 누적 처방액 1200억원을 넘겼다. 특히 올해는HK이노엔과 결별한 종근당과 손잡고 공동 판매 전선을 확대하고 있다. 업계에선 종근당이 케이캡 판매를 통해 쌓은 경험과 영업망을 펙수클루에 활용한다면 시너지가 클 것으로 본다.최근에는 제일약품의 자큐보가 합류했다. 제일약품은 지난달 1일 국산 37호 신약 자큐보를 출시했다. 후발 주자인 만큼 가격 경쟁력을 갖췄다는 평을 받는다. 자큐보의 보험 약가가 20㎎ 정당 911원으로, 케이캡(1300원)·펙수클루(939원)보다 저렴하다. 첫 달 약 5억원의 처방액을 기록했다. 판매는 제일약품과 동아에스티가 함께 맡는다.HK이노엔, 대웅제약, 제일약품은 시장점유율을 두고 경쟁하는 한편,P-CAB제제의 시장을 키우겠다는 계획이다. 제약 업계 관계자는 “P-CAB제제는 빠른 효과 발현 및 긴 약효 지속성 등의 특장점이 경쟁 제품 간 상당 부분 겹친다는 점에서 영업, 마케팅 분야에서 차별화가 중요하다”며 “각 사의 판매 전략이P-CAB제제의 전반적인 성장세로 이어질 것으로 예상된다”고 했다."
2024-11-14,분만유도제 공급 중단… 예비 엄마들 불안하다,"‘점유율 70%’ 중외제약 생산 차질분만유도제의 공급이 일부 중단되면서 산부인과 등 의료 현장의 불안이 커지고 있다. 국내에서 2개 제약사가 분만유도제를 생산하는데, 시장점유율 70%에 이르는JW중외제약이 원료 수급난을 이유로 들며 공급을 최근 중단했다. 이 여파로 일부 병의원이 분만유도제를 구하지 못해 분만 시술 등에 차질을 빚었다. 필수 의약품 공급에 대한 정부와 제약사의 안이한 인식이 위기를 불렀다는 지적이 나온다.◇분만유도제 공급사 2곳뿐13일 건강보험심사평가원 의약품관리종합정보포털에 따르면,JW중외제약은 지난 1일 분만유도제 ‘중외옥시토신주’를 공급 부족 의약품으로 신고했다. 옥시토신을 성분으로 하는 분만유도제는 자궁 수축을 유발, 촉진한다. 출산 후 산모의 과다 출혈을 막는 데도 필요하다. 제약사가 생산을 중단하려면 60일 전에 식품의약품안전처에 보고해야 하는 ‘퇴장 방지 의약품’으로 지정돼 있다.그래픽=이진영국내에서 판매 중인 분만유도제는JW중외제약과 유한양행 주사제가 전부이고,JW중외제약이 70% 가까운 물량을 차지하고 있다.JW중외제약이 공급을 중단하자 유한양행에 평소보다 높은 수요가 몰리며 연쇄적으로 품귀 현상이 벌어진 것이다.JW중외제약 측은 “주원료를 인도에서 수입하고 있는데 선적 과정에서 문제가 생겨 공급을 중단했다”며 “다음 달 4일부터 분만유도제 공급을 재개하기로 했다”고 밝혔다. 유한양행은 14일부터 공급을 재개한다. 이에 대해 제약 업계는 지금처럼 낮은 약가(藥價)로는 생산 실익이 적어 이번 같은 공급 중단이 또 일어날 것으로 전망한다. 예컨대 스위스의 경우 분만유도제 약가는 1앰풀당 5000원에 달하고, 일본에서는 1000원 안팎에 책정되어 있다. 한국은 지난해 8월 중외옥시토신주 품귀 때 정부가 195원에서 273원으로 40% 인상했는데도 약값이 주요국의 절반에 미달한다. 식약처에 따르면,JW중외제약 유도분만제의 작년 매출은 1억4000만원이다. 제약 업계 관계자는 “분만유도제는 약값이 싼데 원료 수급과 위탁 생산 등 관리할 위험은 많아 채산성이 낮다”고 했다. 김재연 대한산부인과의사회장은 “비정상적으로 낮은 분만유도제 가격을 현실화하는 방안을 비롯해 근본적인 대책이 필요하다”고 했다.◇낮은 약가에 신약도 ‘K패싱’정부의 약가 정책은 건강보험 재정과도 관련 있다. 약가를 높일수록 건보 재정에 부담을 주기 때문에 동결 또는 낮추려는 것이다. 그럼에도 지나친 약가 인하 정책은 신약 공급에 부정적 영향을 끼쳐 국내 개발 신약이 한국 시장을 외면하는 상황도 벌어지고 있다. 예컨대SK바이오팜이 개발한 뇌전증(腦電症·간질) 신약 ‘세노바메이트’는 올해 3분기 미국에서 1133억원 매출을 기록했을 정도로 효능을 인정받았지만, 한국에서는 2026년쯤으로 출시 계획을 잡고 있다. 한국에서 신약 허가 신청을 하지 않은 이유가 낮은 약가 때문이라는 분석이 나온다. 낮은 약가로 결정되면 해외에서도 이를 기준 삼아 책정하기 때문에 불이익을 당한다는 것이다. 한국 출시를 고의로 건너뛰는 이른바 ‘K패싱’ 현상이 나타나는 것이다.동아에스티가 개발해 2014년 미국 식품의약국(FDA) 허가를 받은 항생제 ‘시벡스트로’도 유사한 사례다. 국내에서는 2015년 시판 허가를 받고도 2020년 허가를 자진 반납했다. 당시 약가가 미국의 3분의 1 수준으로 책정되자 국내 출시를 포기한 것이다. 이 약은 미국에서 지난해 약 600억원의 매출을 올렸다.유승래 동덕여대 약대 교수는 “약가 산정은 건보 재정에 직접적인 영향을 주기 때문에 신중하게 결정해야 한다”며 “그럼에도 당국이 낮은 약가에 너무 집착하면, 제약사들이 채산성 낮은 약품 생산을 꺼리고 신약 국내 출시도 기피하게 돼 피해가 결국 환자들에게 돌아간다”고 했다.☞분만유도제자궁 수축을 일으키는 약물인 옥시토신을 말한다. 자궁 수축을 유발·촉진해 태아가 자궁 밖으로 나오도록 한다. 출산 중 산모의 과다 출혈을 막는 효과도 있다."
2024-06-26,암세포만 콕 집어 피폭… 착한 방사성 의약품이 뜬다,"‘방사성 의약품’ 글로벌 경쟁 치열식품의약품안전처는 최근 스위스 제약업체 노바티스가 개발한 전립선암 치료 의약품 ‘플루빅토’를 허가했다. 플루빅토는 전립선암에 많이 발현되는 ‘전립선 특이막 항원(PSMA)’에 방사성 동위원소인 루테튬-177을 결합시켜 암 세포를 없애는 ‘방사성 의약품’이다. 암세포에 직접 치료용 방사성 물질을 보내 암을 파괴하는 것이다. 플루빅토는 2022년 미국 식품의약국(FDA) 허가를 받았고, 지난해에는 매출 9억8000만달러(약 1조3600억원)를 기록한 블록버스터 의약품이다. 별다른 치료법이 없던 전이성 전립선암을 치료하는 표준 치료제로 자리 잡았다.그래픽=이진영차세대 항암제로 꼽히는 ‘방사성 의약품’ 개발을 위한 세계 제약 바이오 업계의 경쟁이 치열하다. 방사성 의약품은 특정 암 종양에만 들러붙는 물질에 방사성 동위원소를 탑재해 암을 진단하거나 치료하는 의약품이다. 암 세포만 피폭시켜 암을 치료하는 것이다. 과거에는 특정 질환을 진단하는 방사성 의약품이 많았지만, 최근에는 암 치료제 개발에 속도가 붙고 있다. 글로벌 시장조사 기관 프레시디던스 리서치에 따르면, 방사성 의약품 시장은 2022년 52억달러(약 7조원) 규모에서 10년간 연평균 10.2% 성장해 137억달러 규모까지 성장할 전망이다.방사성 의약품이 암세포를 죽이는 과정을 표현한 모식도 /그래픽=이진영글로벌 대형 제약사들 개발 경쟁방사성 의약품은 합성 의약품, 바이오 의약품에 이은 ‘3세대 약품’으로 주목받는다. 방사성 물질을 체내에 직접 투입하기 때문에 치료 효과가 기존 의약품보다 월등히 높다. 방사성 동위원소의 양이 절반으로 줄어드는 반감기도 치료용의 경우는 1주일~1개월, 진단용은 수 시간 정도에 불과하다. 반복 복용으로 약효가 떨어지는 약물 내성(耐性)이 강하지 않다는 장점이 있다. 이 분야에서 제일 앞서가는 기업은 노바티스다.FDA가 허가한 방사성 의약품 3종 중 2종이 노바티스 치료제다. 앞서 노바티스는 2017년 프랑스의 ‘어드밴스드 액셀러레이터 애플리케이션스’를 38억달러에 사들였고, 이듬해에는 미국의 ‘엔도사이트’를 21억달러에 인수했다. 이 기업들의 방사성 의약품 기술을 활용한 노바티스는 2018년 신경내분비 종양 치료제 ‘루타테라’와 전립선암 치료제 ‘플루빅토’ 개발에 성공했고,FDA허가를 받았다.그래픽=이진영다른 글로벌 빅파마(bigpharma·대형 제약사)들도 관련 업체들을 인수하면서 방사성 의약품 신약 개발에 나서고 있다. 일라이릴리는 지난해 10월 ‘포인트바이오파마’를 14억달러에 사들이면서 방사성 의약품 파이프라인(신약 연구 개발 프로젝트)을 강화했고, 액티스 온콜로지와도 11억6000만달러 규모의 방사성 의약품 공동 개발 계약을 체결했다. 전립선암 치료제를 출시해 노바티스의 플루빅토와 경쟁하는 한편, 다양한 질병을 표적하는 방사성 의약품을 개발하겠다는 포석이다. 지난해 12월 브리스톨마이어스스큅(BMS)은 방사성 의약품 개발 회사 ‘레이즈바이오’를 41억달러에 인수했다. 코로나 백신으로 유명한 아스트라제네카도 지난 3월 캐나다 ‘퓨전 파마슈티컬스’를 24억달러에 사들이고 방사성 의약품을 개발 중이다.국내 바이오텍과 정부도 전략 수립국내 제약 바이오 기업들도 진단과 치료 분야에서 방사성 의약품 개발에 속도를 내고 있다.SK바이오팜은 방사성 의약품을 신사업 동력으로 선정해 3년 내에 임상에 들어간다는 계획을 세웠고, 동아에스티도 계열사인 앱티스를 통해 방사성 의약품 개발을 추진하고 있다. 퓨쳐켐 역시 전립선암 치료제 후보 물질에 대해 임상 2상을 진행하고 있다. 듀켐바이오는 알츠하이머 진단을 위한 방사성 의약품 수요가 늘 것으로 기대하고 있다.정부도 방사성 의약품 기업 및 유관 기관 등과 지원 전략을 수립하고 있다. 바이오 업계 관계자는 “이미 글로벌 빅파마들은 전문 기업들을 인수하면서 글로벌 시장을 선점하고 있다”며 “국내에도 진단 등에서 두각을 나타내고 있는 방사성 의약품 업체가 있는 만큼, 빠르게 생태계를 키워 글로벌 시장으로 진출해야 한다”고 했다.☞방사성 의약품특정 암 종양에만 들러붙는 물질에 방사성 동위원소를 탑재해 암을 진단하거나 치료하는 의약품. 환자 몸속에 투여하면 암세포에만 방사선을 내보내 암 조직을 파괴한다."
2023-07-22,[부음] 방광일 별세 외,"▲방광일별세,유영숙배우자상,방수영LG이노텍 미국법인장·방미영동아에스티 임상개발실장·방경라부친상,전상욱우리금융저축은행 대표·이민수민플러스치과 원장 장인상,이재희시부상=20일16시40분 서울아산병원, 발인 23일7시40분, (02)3010-2000▲이정영별세,이영희前 연합뉴스 부산취재본부장 부친상=20일20시50분 경남 양산부산대병원, 발인 23일9시, (055)372-4447▲장석열별세,설동호대전시교육감 장모상=20일4시 국립중앙의료원, 발인 22일6시, (02)2260-7114"
