date,title,content
2022-01-21,‘4세대 실손보험’으로 안 바꿔주는 얌체 보험사들,"판매중단 보험사 14곳 중 10곳적자를 이유로 실손보험 판매를 중단한 14개 보험사 가운데 10개사가 기존 가입자들을 보험료가 저렴한 ‘4세대 실손보험’으로 전환시켜 주지 않고 외면하고 있어 눈총을 받고 있다.20일 보험업계에 따르면, 2011년 이후 실손보험 신규 판매를 중단한 14개 보험사(생보 11개사, 손보 3개사) 가운데 기존 가입자들을 지난해 7월부터 출시된 ‘4세대 실손보험’으로 바꿔주는 보험사는 신한라이프,KDB생명,ABL생명, 동양생명 등 4곳뿐이다. 나머지 10곳은 전환을 거부하거나, 아직 구체적인 전환 일정을 내놓지 않고 있다. 4세대 실손보험은 비급여 치료에 대해 보험금을 얼마나 받아갔는지를 따져 보험료가 할증되거나 할인되는 상품이다. 1~3세대형보다 보험료가 저렴하다는 특징이 있다.판매를 중단한 14개사의 실손보험 고객은 모두 과거 1~3세대형 가입자로, 기존 계약은 유지할 수 있다. 하지만 해마다 큰 폭으로 오르는 실손보험료 부담에 시달리는 일부 1~3세대 고객들이 4세대 상품으로 바꾸고 싶어도 방법이 여의치 않다는 점이 문제다. 원래 가입한 보험사에서 4세대로 전환시켜 주지 않으면 기존 1~3세대 가입자는 해지 후 4세대 실손보험을 제공하는 다른 보험사에 새로 가입해야 한다. 하지만 최근 실손보험 가입 심사가 까다로워 50대 이상은 받아주지 않는 경향이 있어 애로를 겪을 수 있다.게다가 정부 방침에 따라 올해 6월까지 1~3세대 실손보험 가입자가 4세대로 갈아탈 때 보험료를 1년간 50% 깎아주는 혜택도 다른 보험사로 갈아타면 누릴 수 없다. 전환 시 할인은 같은 보험사 내에서만 적용되기 때문이다. 금융 당국 관계자는 “소비자 보호 차원에서 원하는 1~3세대 실손보험 고객은 모두 4세대로 전환할 수 있는 방법을 마련하라고 보험사들에 권고하고 있지만 강제하기 어렵다는 점이 고민”이라고 말했다.이와 관련 손해보험협회에서는 실손보험 판매를 중단한AIG손보,ACE손보,AXA손보 3개사 모두 오는 4월 무렵부터는 기존 실손보험 고객들을 대상으로 4세대로 전환할 수 있도록 준비중이라고 밝혔다."
2024-02-29,창사이래 최대실적으로 리더십과 전문성 증명한 동양생명 저우궈단 대표,"동양생명이 지난 27일 새 국제회계기준(IFRS17)을 적용한 2023년 별도기준 당기순이익이 전년 동기 대비 204.8% 증가한 2,957억원을 기록했다고 밝혔다.이번 실적은 동양생명 창사이래 최대실적으로, 동양생명은 이에 대해 ""시장 변화에 대한 전략적 대응 및 회사 체질 개선을 위해, 건강보험 포트폴리오를 확대하고 상품 경쟁력을 강화하는 등 보장성 보험 확대 전략을 추진했던 것이 주효했다""고 밝혔다.동양생명은IFRS17 도입으로 보험계약마진(CSM) 확보가 중요해진 상황에서 지난 2022년부터CSM확대에 유리한 건강보험 등 보장성 상품 판매를 확대하였고, 그 결과 2023년 보장성 연납화보험료(APE)는 전년대비 79.4% 늘어난 6,301억원을 기록했으며, 이에 힘입어 지난해 총 보험계약마진(CSM) 역시 전년대비 34.6% 증가한 7,602억원을 달성했다.투자부문에서도 급변하는 금융환경에서 적극적인 운용자산 리밸런싱을 통해 2023년 전체 운용자산이익률은 3.83%을 기록, 전년비 1.17%p 상승했으며, 신지급여력비율(K-ICS)도 전년대비 39.8%p 개선된 192.9%로 안정적 지급여력비율을 유지했다.지난 2017년 이후 역성장의 길을 걷던 동양생명의 이 같은 성장 뒤에는 저우궈단 대표의 리더십이 있었다는 것이 업계의 일반적인 평이다. 지난 2022년 취임한 저우궈단 대표는 동양생명의 전략과 비즈니스 모델, 타깃에 대한 재정의가 우선적으로 선행돼야 한다고 판단, 지난 재임기간동안 지속가능한 성장 기반 구축을 위한 조직 정교화 관리에 집중했다.또 장기주의, 지속가능, 소통강화, 준법경영, 이익공유 등 5대 원칙을 바탕으로 저우 대표는 디지털 금융 환경에서의 경쟁력 강화를 위해ISP를 추진하는 등IT부문에 대한 투자를 확대했으며, 지속가능한 미래성장기반 구축을 위해 전사 기구 조직 고도화와 파트제 확대 등을 통해 미들백 오피스의 역량을 강화했다. 이와 더불어 장기 이익 증대 및 고령화 사회에 맞춰 건강 보험 포트폴리오를 확대하며 상품 경쟁력을 강화하여, 2023년 보장성 보험 매출이 전년대비 79% 증가하는 등 건강보험 판매 전문회사로서 입지를 공고히 했다.저우궈단 대표는 회사 내실 다지기는 물론 ‘회사가 창출한 이익은 임직원과 공유해야 한다’는 신념을 바탕으로 직원들의 임금과 복지 향상을 위해서도 노력한 것으로 알려졌다. 업계에 따르면, 지난해 동양생명은 업계 최고 수준의 임금 인상률을 결정했으며, 이달 초 역대 최대 실적에 걸맞은 성과급을 지급하기도 했다.이에 대해 보험업계 한 관계자는 “저우궈단 대표 취임 이후 본업 경쟁력을 바탕으로 동양생명 실적과 주가가 개선되며 장기 성장을 위한 성장 기반을 구축했다는 평이다”며, 이어 “저우궈단 대표가 다진 기반을 통해 향후 성장이 지속될 지 업계의 관심이 주목된다”고 전했다.이 같은 호실적에도 불구하고 저우궈단 대표는 건강상 이유로 지난 28일 사임한 것으로 알려졌다. 이에 대해 동양생명 관계자는 “지속성장이 가능한 사업모델과 경쟁력 있는 미들백 오피스 구축 등 임기 전 동양생명에서 이루고자 했던 바를 어느 정도 완수했다는 판단 아래 사임을 결정하신 것이다”고 설명했다."
2024-01-24,"동양생명, 로봇업무자동화 시스템 도입","동양생명 전경동양생명이 로봇프로세스자동화(RoboticProcessAutomation,RPA) 시스템을 업무 곳곳에 도입하며, 디지털 전환을 주도하고 있다.RPA는 사람이 컴퓨터로 하는 반복적인 업무를 로봇소프트웨어를 통해 자동화하는 기술로, 최근 디지털 혁신에 대한 관심이 높아지면서RPA에 대한 관심도도 함께 증대되고 있는 추세다.동양생명은 먼저 이를 모바일·온라인 자금세탁방지(Anti-MoneyLaundering,AML) 재검증 수행 작업에 도입했다. 금융회사는 고객과 거래 시 고객의 신원을 확인, 검증하고 실제 소유자 거래 목적 자금 원천을 확인해야 한다. 동양생명은 자금세탁방지 차원에서 고객 신원 확인 업무를 여러 부서에서 처리하고 있는데,RPA시스템 도입 전에는 직원 한 명이 고객 50여 명의 신원 재확인을 위해 매일 2~3시간을 소요해야 했다. 이를 연간으로 환산하면 약 720시간의 시간이 투입되는 셈. 하지만, 이미지 파일에서 글씨를 읽어내는OCR기능을 통해 신분증 이미지 분류 작업을 자동화한RPA프로세스를 구현하여 고객 신원 확인 업무에 소요되는 시간이 50시간으로 단축됐다.또 대출 고객 전자서명 복호화 작업에도 적극 활용 중이다. 복호화란 암호화된 값을 다시 원래의 값으로 변환하는 것으로 고객 정보를 송수신하는데 필수적으로 적용되는 기술이다. 동양생명은 암호화된 고객 인증 결과 값을 복호화하여 실제 대출을 신청한 고객이 맞는 지 확인하고 있는데RPA시스템 도입 전에는 이를 위해 투입되는 시간이 연간 300시간이었다면,RPA시스템 도입으로 해당 업무에 소요되는 시간은 연간 1시간으로 대폭 단축됐다.동양생명 관계자는 “RPA시스템 도입을 통해 단순 업무에 투입되는 시간이 대폭 줄여 직원들이 보다 핵심 업무에 집중할 수 있게 했다”며, 이어 “앞으로도RPA사내경진대회,RPA정보 공유를 위한NewsLetter발간 등 활성화 프로그램을 운영할 예정이며, 이를 통해 직원들 스스로 업무의 효율성과 생산성을 높일 수 있는 기반을 마련하겠다”고 전했다.한편 동양생명은 지난 2021년 11월 네이버 클라우드와 손잡고 보험 및 퇴직연금 서비스를 클라우드 기반 ‘CLOVAAiCall’솔루션에 접목해 고객들의 상담 문의에 인공지능(AI)을 통한 응대가 가능하도록 설계된 소통 창구인AI컨택센터를 오픈, 상담 직원들의 업무 효율성과 고객 편의성을 증대시키기도 했다."
2024-08-29,우리금융 “동양·ABL생명 인수”…‘1.5조짜리 딜’ 당국 승인이 변수,"손태승 전 우리금융지주 회장 관련 부당대출 의혹을 수사 중인 검찰이 우리은행 등을 압수수색에 나선 가운데 지난 27일 우리은행 본점에서 검찰 관계자가 박스를 들고 나오고 있다. [연합뉴스]우리금융그룹이 동양생명보험주식회사·ABL생명보험주식회사 인수를 결정했다. 이달 1일 우리투자증권을 출범한 데 이어 비은행 포트폴리오를 강화하는 행보다. 다만 인수가 마무리되려면 금융당국의 최종 승인이 필요하다는 점이 막판 변수로 꼽힌다.28일 우리금융은 이사회를 열어 인수를 결의하고 주식매매계약(SPA)을 했다고 밝혔다. 인수지분과 가격은 동양생명 75.34%·1조2840억원,ABL생명 100%·2654억원으로 총 1조5493억원 규모다. 앞서 우리금융은 자본비율에 영향을 받지 않는 인수가로 1조9000억원 수준을 언급한 바 있다.동양생명은 국내 22개 생보사 중 수입보험료 기준 6위 대형 보험사로 꼽힌다. 지난해 기준 총자산 33조원, 당기순이익 3000억원 규모를 나타냈다. 우리금융이 두 보험사를 인수해 출범하는 보험사는 업계 5~6위를 노려볼 만한 규모를 갖추는 셈이다.우리금융은 그간 5대 금융지주(KB국민·신한·하나·우리·NH농협) 가운데 유일하게 보험사를 보유하고 있지 않아, 다수 보험사를 인수대상으로 검토해왔다. 이번 인수로 비은행 부문 수익 규모가 확대되면 90%를 넘나드는 은행 의존도가 개선돼 주주가치 제고에도 도움이 될 수 있다는 게 우리금융 입장이다. 우리금융은 “이달 1일 출범한 우리투자증권과 함께 은행, 증권, 보험 등을 아우르는 종합금융그룹 사업 포트폴리오가 완성되며 계열사 간 연계 영업도 활성화될 것”이라고 밝혔다.마지막 변수는 금융당국 승인이다. 최근 불거진 전임 회장 관련 부적정 대출 의혹이 대주주 적격성 심사에 악영향을 미칠 수 있어서다. 만일 금융당국이 부적정 대출 사안에 대해 우리은행뿐 아니라 우리금융에도 제재를 가한다면 인수는 물 건너갈 수 있다. 금융회사 지배구조 감독규정에 따르면 금융회사가 다른 금융회사의 최대주주가 되려면 최근 1년간 기관경고 조치 등을 받은 사실이 없어야 한다. 통상 대주주 적격성 심사에 소요되는 시간은 신청일로부터 3~6개월이다.우리금융 관계자는 “이번SPA체결은 보험사 인수를 위해 첫 단추를 끼운 것”이라며 “최종 인수까지는 금융당국의 승인 등이 남아있는 만큼 앞으로 심사절차에 성실하게 임하겠다”고 말했다."
2024-08-28,"우리금융, 동양생명·ABL생명 1.5조에 인수…금융당국 승인이 변수","우리금융그룹이 동양생명보험주식회사‧ABL생명보험주식회사 인수를 결정했다. 이달 1일 우리투자증권을 출범한 데 이어 비은행 포트폴리오를 강화하는 행보다. 다만 인수가 마무리되려면 금융당국의 최종 승인이 필요하다는 점이 막판 변수로 꼽힌다.28일 우리금융은 이사회를 열어 인수를 결의하고 주식매매계약(SPA)을 체결했다고 밝혔다. 인수지분과 가격은 동양생명 75.34%‧1조2840억원,ABL생명 100%‧2654억원으로 총 1조5493억원 규모다. 앞서 우리금융은 자본비율에 영향을 받지 않는 인수가로 1조9000억원 수준을 언급한 바 있다.동양생명은 국내 22개 생보사 중 수입보험료 기준 6위 대형 보험사로 꼽힌다. 지난해 기준 총자산 33조원, 당기순이익 3000억원 규모를 나타냈다. 우리금융이 두 보험사를 인수해 출범하는 보험사는 업계 5~6위를 노려볼 만한 규모를 갖추는 셈이다.우리금융은 그간 5대 금융지주(KB국민·신한·하나·우리·NH농협) 가운데 유일하게 보험사를 보유하고 있지 않아, 다수 보험사를 인수대상으로 검토해왔다. 이번 인수로 비은행 부문 수익 규모가 확대되면 90%를 넘나드는 은행 의존도가 개선돼 주주가치 제고에도 도움이 될 수 있다는 게 우리금융 입장이다. 우리금융은 “이달 1일 출범한 우리투자증권과 함께 은행, 증권, 보험 등을 아우르는 종합금융그룹 사업 포트폴리오가 완성되며 계열사 간 연계 영업도 활성화될 것”이라고 밝혔다.마지막 변수는 금융당국 승인이다. 최근 불거진 전임 회장 관련 부적정 대출 의혹이 대주주 적격성 심사에 악영향을 미칠 수 있어서다. 만일 금융당국이 부적정 대출 사안에 대해 우리은행뿐 아니라 우리금융에도 제재를 가한다면 인수는 물 건너갈 수 있다. 금융회사 지배구조 감독규정에 따르면 금융회사가 다른 금융회사의 최대주주가 되려면 최근 1년간 기관경고 조치 등을 받은 사실이 없어야 한다. 통상 대주주 적격성 심사에 소요되는 시간은 신청일로부터 3~6개월이다.우리금융 관계자는 “이번SPA체결은 보험사 인수를 위해 첫 단추를 끼운 것”이라며 “최종 인수까지는 금융당국의 승인 등이 남아있는 만큼 앞으로 심사절차에 성실하게 임하겠다”고 말했다."
2023-09-05,"동양생명, 젊은 관리자 육성 위한 조직개편 단행","동양생명이 영업ㆍ상품 역량을 강화하고, 젊은 관리자 육성 위한 파트제를 확대하는 등 지속 성장을 위한 동력을 마련했다.보험업계에 따르면 동양생명은 지난달 중순 조직개편을 단행하고 기존 5부문 4본부 35팀 11파트 1선수단을 5부문 5본부 35팀 46파트 1센터 1선수단(장애인 스포츠 선수단,AngelWing) 체계로 정비하였다.동양생명 측은 이번 기구조직 개편에 대하여 지속가능한 미래성장기반 구축 및 경영전략 달성을 위한 부서별 역할과 책임 강화에 중점을 두었으며, 특히 지속성장을 위한 관리자 육성과 부서별 업무 고도화를 목표로 팀 산하 파트를 확대했다고 밝혔다.이번 기구조직 개편 내용을 구체적으로 살펴보면, 상품전략팀을 상품전략본부로 승격시켜 향후 건강보험 강화를 위한 상품전략 역량 강화를 꾀하였으며 기존CPC부문은 영업부문으로 변경하고 영업채널 경쟁력 강화와 업무 지원 확대 등 영업력 극대화를 골자로 부문 산하의 각 영업본부를 개편하였다.또한 기존IT본부는 디지털본부로 변경하고IT의사결정 체계를 일원화하였는데 이는 신속한 의사결정으로 급변하는 금융 환경에 보다 적극적으로 대응하고 디지털 경쟁력을 강화하려는 회사의 의지가 반영된 것으로 해석된다.자산운용부문은 보다 전문적인 자산운용을 위해D.CIO(DeputyChiefInvestmentOfficer)를 새로 선임하고 자산군별 특성에 따른 투자역량 강화를 위한 파트들을 신설하였다. 동양생명의 올해 상반기 운용자산 이익률은 전년동기대비 1.34%포인트 상승한 4.38%였는데 이번 조직개편을 통해 하반기에도 높은 자산운용성과를 이어 나갈 것으로 예상된다.동양생명은 지난 2022년 2월 저우궈단 사장 취임 이후 보장성 보험 중심의 영업 전략과 적극적인 자산운용 전략을 앞세워 올해 상반기에는 새국제회계기준(IFRS17)을 적용한 당기순이익이 전년 동기 대비 117% 증가한 2002억원을 기록하였으며, 상반기 보장성 연납화보험료(APE)는 지난해 같은 기간보다 68.4% 증가한 3145억원을 달성한 바 있다.동양생명 측은 “이번 조직개편을 통해 책임과 권한을 기반으로 운영되는 파트제를 확대한 만큼, 역동적인 회사를 만들기 위한 발판이 마련되었다”며, “젊고 유능한 관리자 풀을 두텁게 육성하여, 회사의 지속성장 기반을 지속적으로 만들어 갈 것”이라고 말했다."
2024-06-27,"우리금융, 보험업 재진출…동양·ABL생명 인수 추진","우리금융그룹이 10년 만에 보험업에 재진출한다. 임종룡 우리금융 회장 취임 이후 염원해온 비은행 분야 경쟁력 강화 방안의 일환이다.26일 우리금융에 따르면 최근 중국 다자보험그룹과 양해각서(MOU)를 체결하고 동양생명과ABL생명 인수를 위한 실사에 착수할 예정이라고 밝혔다. 다자보험은 동양생명과ABL생명의 최대 주주다. 양측은 현재 최종 가격 산정 절차에 들어갔으며, 정확한 매각 가격은 아직 확정되지 않았다.3월 말 기준 동양생명 자산(32조4402억원)과ABL생명 자산(17조4707억원) 합계는 총 49조9109억원으로 삼성·교보·한화·신한라이프·NH농협생명에 이어 여섯 번째다. 만약 인수가 계획대로 추진된다면 자산 규모 6위의 신생 생명보험사가 탄생하는 것이다. 우리금융은 지난 2014년 우리아비바생명을 매각한 이후 보험사를 소유한 적이 없다.또 우리금융 측은 현재 예비입찰이 진행 중인 롯데손해보험 인수에도 여전히 참여한다는 방침이다. 우리금융 측 관계자는 “롯데손해보험 공개매각 예비입찰에도 참여해 현재 본 입찰을 앞두고 있다”면서 “실사 결과를 토대로 최종 의사결정을 할 예정”이라고 밝혔다.우리금융은 그동안 높은 은행 비중에서 벗어나 종합금융그룹으로 탈바꿈하기 위해 노력해 왔다. 대표적으로 최근 한국포스증권과 우리종합금융을 합병하는 방식으로 증권업 진출을 결정하고, 현재 감독 당국의 승인절차를 밟고 있다. 이번 보험업 진출까지 성공하면 비은행 사업 분야 포트폴리오가 어느 정도 완성될 전망이다.우리금융 관계자는 “롯데손해보험과 마찬가지로 동양생명·ABL생명도 인수 대상의 하나로서 인수·합병을 검토 중이나, 현재 구체적으로 결정된 바는 없으며, 향후 진행 상황에 따라 공시나 보도자료를 통해 상세하게 알릴 예정”이라고 밝혔다."
2024-06-26,"우리금융, 동양·ABL생명 인수 추진…10년 만에 보험업 재진출","우리금융그룹이 10년 만에 보험업에 재진출한다. 임종룡 우리금융 회장 취임 이후 염원해온 비은행 분야 경쟁력 강화 방안의 일환이다.우리금융그룹. 연합뉴스26일 우리금융에 따르면 최근 중국 다자보험그룹과 양해각서(MOU)를 체결하고 동양생명과ABL생명 인수를 위한 실사에 착수할 예정이라고 밝혔다. 다자보험은 동양생명과ABL생명의 최대 주주다. 양측은 현재 최종 가격 산정 절차에 들어갔으며, 정확한 매각 가격은 아직 확정되지 않았다.3월 말 기준 동양생명 자산(32조4402억원)과ABL생명 자산(17조4707억원) 합계는 총 49조9109억원으로 삼성· 교보·한화·신한라이프·NH농협생명에 이어 여섯 번째다. 만약 인수가 계획대로 추진된다면 자산 규모 6위의 신생 생명보험사가 탄생하는 것이다. 우리금융은 지난 2014년 우리아비바생명을 매각한 이후 보험사를 소유한 적이 없다.또 우리금융 측은 현재 예비입찰이 진행 중인 롯데손해보험 인수에도 여전히 참여한다는 방침이다. 우리금융 측 관계자는 “롯데손해보험 공개매각 예비입찰에도 참여해 현재 본 입찰을 앞두고 있다”면서 “실사 결과를 토대로 최종 의사결정을 할 예정”이라고 밝혔다.우리금융은 그동안 높은 은행 비중에서 벗어나 종합금융그룹으로 탈바꿈하기 위해 노력해 왔다. 대표적으로 최근 한국포스증권과 우리종합금융을 합병하는 방식으로 증권업 진출을 결정하고, 현재 감독 당국의 승인절차를 밟고 있다. 이번 보험업 진출까지 성공하면 비은행 사업 분야 포트폴리오가 어느 정도 완성될 전망이다.우리금융 관계자는 “롯데손해보험과 마찬가지로 동양생명·ABL생명도 인수 대상의 하나로서 인수·합병을 검토 중이나, 현재 구체적으로 결정된 바는 없으며, 향후 진행 상황에 따라 공시나 보도자료를 통해 상세하게 알릴 예정”이라고 밝혔다."
2023-03-16,주식 투자자수 1400만명 넘었다…638만명 선택한 회사는 어디,"삼성전자 주총 입장하는 주주들. 연합뉴스작년 하락장에도 상장사 주주가 전년보다 4.1% 증가하고, 삼성전자 주주는 14% 늘어나 638만명을 넘긴 것으로 나타났다.16일 한국예탁결제원은 2022년 12월 결산 상장법인 2509개사의 중복 소유자를 제외한 실제 주식 소유자가 1441만명으로 전년 대비 4.1% 증가했다고 밝혔다.1인당 평균 소유종목은 5.85종목으로 전년보다 1.8% 줄었고, 1인당 평균 소유주식 수는 7688주로 0.8% 감소했다.소유자 구성을 보면 개인소유자가 1424만명(98.8%)으로 대부분이었고, 법인소유자 4만3000명(0.3%), 외국인소유자 3만3000명(법인)(0.2%) 등이었다.소유주식 수는 개인소유자 561억주(50.7%), 법인소유자 407억주(36.7%), 외국인소유자 133억주(12.0%) 순이었다.유가증권시장에서는 법인소유자의 소유주식 수가 271억주(44.2%)로 가장 많았고, 코스닥시장에서는 개인소유자의 소유주식 수가 322억주(67.4%)로 최다였다.그래픽=신재민 기자shin.jaemin@joongang.co.kr회사별로는 삼성전자 소유자 수가 638만755명으로 가장 많았다.특히 삼성전자는 작년 한해 주가가 30%가량 하락해 연말 종가가 5만5300원으로 떨어졌지만, 주주 수는 전년(561만4490명) 대비 13.6%나 증가했다.2∼3위인 카카오(191만8321명→206만6529명), 현대차(117만8677명→120만9826명) 주주 수도 소폭 늘었다.코스닥시장에서는 카카오게임즈(29만3904명), 셀트리온헬스케어(27만7691명), 에코프로비엠(22만5308명) 순으로 주주가 많았다.외국인 소유 비율이 50% 이상인 회사는 33개사로 전년 대비 1개사가 줄었다.유가증권시장에서 동양생명보험(82.0%),S-OlL(77.3%), 락앤락(77.1%) 순으로 외국인 소유 비율이 높았다.그래픽=신재민 기자shin.jaemin@joongang.co.kr개인투자자는 40대가 327만명(22.9%)으로 가장 많았고, 소유주식 수는 50대가 192억주(34.2%)로 가장 많은 것으로 집계됐다.성별로는 남성이 743만명(52.2%), 여성이 681만명(47.8%)으로 비슷했으나 소유주식 수는 남성이 399억주(71.1%)로 여성 (162억주·28.9%)보다 두 배 이상 많았다.상장법인 소유자의 지역별 분포는 경기도가 379만명(26.3%)으로 가장 많았고, 서울 355만명(24.6%), 부산 88만명(6.1%) 등의 순이었다.거주지·성별·연령대별 소유자 분포로 보면 경기도 수원시 거주 40대 남자가 4만5400명으로 가장 많았다. 경기도 용인시 거주 40대 여자(4만3800명), 경기도 수원시 거주 40대 여자(4만3800명)가 뒤를 이었다.소유주식 수가 가장 많은 거주지·성별·연령대는 서울 강남구 거주 50대 남자(11억8000만주)였다. 이어 같은 지역에 거주하는 60대 남자가 9억4000만주, 경기 성남시 거주 50대 남자가 7억7000만주를 소유 중인 것으로 나타났다."
