date,title,content
2023-04-27,"동아에스티, 1분기 매출 12% 줄어든 1351억원","동아에스티./동아에스티동아에스티는 1분기 매출이 1351억 원, 영업이익이 67억 원을 기록했다고 27일 밝혔다. 각각 전년보다 12%와 15.3% 감소했다.동아에스티는 “ETC(전문의약품) 부문이 성장했지만 해외사업 부문이 지난해보다 감소해 매출이 감소했다”고 했다. 매출원가 및 판관비가 감소했지만 연구·개발(R&D) 비용이 16.5% 증가하며 영업이익은 감소했다.R&D 부문에서는 스텔라라 바이오시밀러 ‘DMB-3115′는 지난해 11월 미국·유럽 등 총 9국에서 글로벌 임상 3상을 종료했다. 동아에스티는 “지난 1월 스텔라라 대비 치료적 동등성을 입증했다”며 “상반기 내 미국과 유럽에 허가 신청을 준비 중이다”라고 했다. 작년 12월 자회사로 편입된 뉴로보 파마슈티컬스를 통해 당뇨병·비알콜성 지방간염 치료제 ‘DA-1241′를 개발 중이다. 과민성 방광 치료제 ‘DA-8010′은 국내 임상 3상 진행 중이다. 중장기적으로 항암, 면역∙퇴행성뇌질환을 타겟으로 신약을 개발할 계획이다."
2022-03-29,[경제계 인사] 동아에스티 대표이사에 김민영,동아에스티는 28일 정기 주총과 이사회를 열고 김민영(50) 사장을 단독 대표이사로 선임했다고 밝혔다. 동아에스티는 이로써 엄대식·한종현 각자 대표 체제에서 김 사장 단독 대표 체제로 바뀐다.
2024-12-24,"‘세계 3위 경쟁력’ 한국, 매출 1조원 신약에 도전","25년 만에 모두 38종 개발지난 12일 비마약성 진통제 ‘어나프라주’가 식품의약품안전처 허가를 받으면서 국내 38호 신약이 등장했다. 이로써 1999년SK케미칼의 1호 국산 신약 ‘선플라주’가 탄생한 뒤 25년 동안 국산 신약이 총 38종 나왔다.국산 신약은 국내에서 신물질 발굴에서 임상시험까지 연구·개발(R&D)이 이뤄진 신약을 말한다. 올해는 어나프라주와 자큐보정이 국산 신약 허가를 받았고, 앞서 31호 신약으로 허가받은 유한양행의 폐암 치료제 렉라자는 지난 8월 미 식품의약국(FDA) 허가를 받아 화제가 됐다.내년 첫 신약 후보는올해는 국산 신약 2종이 나왔다. 지난 4월 식약처는 제일약품의 신약 자회사 온코닉테라퓨틱스가 개발한 위식도 역류 질환 치료제 ‘자큐보정’을 품목 허가했다. 37호 신약이다. 자큐보는 ‘3세대 위장약’으로도 불리는 ‘칼륨 경쟁적 위산 분비 억제제(P-CAB)’다. 칼륨의 작용을 방해해 위산 분비를 막는 방식이다. 기존 치료제 대비 약효가 길고 편의성이 좋아 시장점유율이 빠르게 늘고 있다. 앞서HK이노엔의 케이캡정(30호), 펙수클루정(34호)도P-CAB으로 신약 허가를 받았다. 이처럼 제3세대 위장약을 출시한 제약사들은 시장점유율을 두고 경쟁하는 한편,P-CAB시장을 빠르게 키워나갈 전망이다.지난 12일 38호 신약으로 식약처 허가를 받은 비보존제약의 ‘어나프라주(성분명 오피란제린)’는 수술 후 중등도 이상의 급성 통증 조절을 위해 사용하는 주사제다. 기존 마약성 또는 비스테로이드성 소염 진통제와는 다른 기전을 가진 새로운 치료제다. 기존에 중증도 이상 통증에 사용할 수 있는 약은 마약성 진통제(오피오이드 계열)뿐이었다. 펜타닐 등 오피오이드 계열 진통제는 강한 중독성으로 인해 오남용과 불법 유통 등 사례가 늘면서 미국에서는 심각한 사회문제를 초래했다. 비보존제약은 “신약 ‘어나프라주’가 진통제 대비 부작용이 낮고 중독 위험이 없으면서 빠른 진통 효과를 보인다”고 설명했다.그래픽=이진영내년을 기대하는 39호 신약 후보로는 동아에스티의 과민성 방광 치료제DA-8010과 임상 3상 진행 중인LG화학의 통풍 치료 신약 티굴릭소스타트가 꼽힌다.DA-8010은 지난 5월 국내 임상 3상을 마무리했지만 통계적 유의성을 확보하지는 못했다. 동아에스티는 개발 중단을 확정하지는 않고 추가적인 평가 후 개발 방향을 결정한다는 계획이다.LG화학의 티굴릭소스타트는 임상 3상 2건 중 1건을 성공했고, 나머지 1건의 임상시험을 진행 중이다. 통풍 원인인 요산을 생성하는 효소 ‘잔틴 옥시다제’의 발현을 억제하는 약물이다.올라간 경쟁력, 절차도 개선업계에선 국내 기업들의 신약 경쟁력이 일정 수준까지 올라온 것으로 본다. 국가임상시험지원재단이 제약 정보 기업 사이트라인(Citeline) 통계를 인용한 결과를 보면, 국내 제약·바이오 기업은 미국(1만1200개), 중국(6098개)에 이어 셋째로 많은 3233개의 파이프 라인(R&D 중인 신약 개발 프로젝트)을 보유하고 있다. 지난해 파이프 라인은 2917개로 미국·중국·영국에 이은 4위였는데, 1년 만에 파이프 라인을 약 11% 늘리며 한 계단 올라선 것이다. 지난해 국내 제약사의 R&D 비용은 약 3조2000억원으로 1년 사이 약 32％ 증가하기도 했다.신약 R&D가 늘면서 신약 허가 기간도 대폭 짧아질 전망이다. 식약처는 내년 신약 품목 허가 수수료를 현재 883만원에서 4억1000만원으로 현실화하는 대신, 심사 인력을 늘리고 절차를 효율화해 신약 허가에 걸리는 기간을 420일에서 295일로 줄이겠다고 밝혔다. 제약 업계 관계자는 “국내에서도 렉라자를 포함해 글로벌 시장에서 두각을 나타낼 수 있는 신약들이 등장하고 있다”며 “기업 투자와 함께 정부 차원의 R&D 지원, 규제 개선 등이 동반된다면 1조원 이상 매출을 내는 국산 ‘블록버스터’ 신약도 꿈이 아닐 것”이라고 했다."
2024-12-24,주사에서 ‘먹는 약’으로 비만 치료제 경쟁 후끈,"머크, 中제약사 신약 물질 사들여미국 뉴저지의 머크 본사 정문. /로이터 뉴스1미국계 글로벌 제약사 머크가 중국 제약사의 비만 치료 신약 물질을 사들이며 경구용(먹는 약) 비만 치료제 경쟁에 본격적으로 뛰어들었다.GLP-1(글루카곤유사펩타이드-1) 계열 블록버스터급 비만 치료제를 내놓은 노보노디스크와 일라이릴리에 도전장을 던진 것이다. 이들뿐 아니라 화이자와 아스트라제네카 등 대형 국제 제약사들도 앞서 경구용 비만 치료제 개발에 나서 경쟁이 더욱 치열해질 전망이다.머크는 지난 18일 중국의 한소제약과 최대 20억달러(약 2조9000억 원) 규모의 라이선스 계약을 맺고 신약 후보 물질 ‘HS-10535′에 대한 권리를 확보했다고 밝혔다. 머크는 선수금으로 1억1200만달러를 지급하고 앞으로 신약 개발이 진행되는 단계에 따라 로열티를 더 지급한다. 이번 계약으로 머크는 이 후보 물질을 신약으로 개발하고 향후 중국을 제외한 전 세계 시장에서 제조·판매할 수 있게 됐다. 한소제약은 중국 내 상업화 권리를 보유한다.한소제약이 기술 수출에 성공한 신약 후보 물질은 선풍적 인기를 끌고 있는 노보노디스크의 비만 치료제 ‘위고비’와 같은GLP-1 계열 치료제다.GLP-1은 음식을 먹었을 때 장에서 분비되는 호르몬의 유사체로, 혈당 조절에 필요한 인슐린 분비를 늘리는 방식으로 식욕을 억제해 체중을 줄이는 효과가 있다.북미와 유럽 등의 비만 치료제 시장에서 각축전을 벌이고 있는 위고비와 일라이릴리의 ‘젭바운드’는 모두 주 1회 투약하는 주사 방식 약물이다. 현재 비만 치료제 신약 개발의 초점은 월 1회 주사 등으로 투약 간격을 더욱 늘리거나, 먹는 약처럼 투약 방식을 간편하게 만드는 등 편의성을 개선하는 데 맞춰져 있다.이번 머크의 후보 물질 기술 이전은 다소 늦은 진입이라는 평도 나온다. 이미 노보노디스크가GLP-1 계열의 경구형 당뇨 치료제 ‘리벨서스’를 시장에 내놨고, 일라이릴리도 먹는 약 방식의 비만 치료제 임상 3상 결과를 기다리고 있기 때문이다. 로슈 또한 지난 7월 먹는 약 형태의 비만 치료제 임상 1상 시험에서 유의미한 효과를 확인했다고 밝혔고, 화이자도 1일 1회 복용하는 비만 치료제를 개발 중이다. 국내에서도 한미약품과 대웅제약, 동아에스티 등이 투약 주기를 월 1회로 늘리거나, 경구 복용할 수 있는 비만 치료제를 개발 중이다."
2024-12-20,암세포 잡는 유도미사일 ‘ADC’… 국내 제약·바이오 업계서 개발 경쟁 치열,"삼성바이오로직스, 전용 생산 시설 연내 완공키로셀트리온, 2029년까지ADC신약 상용화 목표GC녹십자, 이중 항체ADC공동 개발 계약 맺어암세포를 잡는 ‘유도미사일’로 불리는 항체·약물 접합체(ADC)를 둘러싼 국내 제약·바이오 업계의 개발 경쟁이 치열해지고 있다.ADC는 항체에 약물을 붙여 정확히 암세포에만 전달하는 치료 기술이다. 일반 세포에 가해지는 악영향은 줄이고 치료 효과는 극대화할 수 있어, 글로벌 항암제 시장의 핵심으로 떠오르고 있다. 글로벌 시장조사 기관 이벨류에이트에 따르면, 지난해 100억달러(약 14조원) 규모였던ADC시장 규모는 2028년 280억달러로 급성장할 전망이다. 국내 기업들도ADC시장에 합류하기 위해 연구·개발(R&D)에 사활을 걸고 있다.항체는 암세포 표면의 항원을 인식하고 결합해 독성을 없앤다.ADC는 이처럼 길잡이 역할을 하는 항체에 약물(페이로드)을 링커로 연결해 특정 암세포만을 공격하게 된다.ADC의 개념을 적용한 첫 약물은 1970년대 개발됐다. 이후 아스트라제네카와 다이이찌산쿄가 공동 개발한 유방암ADC치료제 ‘엔허투’가 압도적인 효능을 보이면서 세계ADC개발 열풍을 이끌었다.아직 국내에서 개발된ADC치료제는 없지만 국내 제약·바이오 업계에서는 생산 시설과 파이프라인을 구축하고 있다. 삼성바이오로직스는 연내 완공을 목표로ADC전용 생산 시설을 신설하고 있다. 고객사와 계약을 맺어 의약품을 생산하는 위탁 개발 생산(CDMO)이 주력인 만큼, 최대 500L 규모 생산 설비를 구축해ADC수요에 대응하겠다는 것이다. 셀트리온은 지난달 국제 콘퍼런스에서 각각 폐암과 방광암을 타깃으로 하는ADC치료제 2종의 개발 성과를 공개했다. 2029년까지ADC신약을 상용화하겠다는 목표다.동아에스티는 지난해ADC전문 업체 앱티스를 인수했다. 앱티스는 위암 치료제 ‘AT-211′을 개발하고 있다. 지난달GC녹십자는 카나프테라퓨틱스와 이중 항체ADC공동 개발 계약을 체결했다. 리가켐바이오는 지난해 미국 얀센과 2조원 규모의ADC항암제LCB84의 기술 이전 계약을 맺었고, 이달 고형암 치료제LNCB74의 미국 임상 1상 시험 계획(IND) 승인을 받았다."
2023-06-28,제약사들 “바이오 시밀러 진출”,"종근당·동아에스티 등 가세바이오기업과의 경쟁 더 치열합성 의약품을 주력으로 사업하던 국내 전통 제약사들이 바이오 시밀러(바이오 의약품 복제약) 시장에 도전하고 있다. 일찍이 시밀러 사업을 시작해 전 세계 시장에서 성과를 둔 셀트리온과 삼성바이오에피스 등 국내 바이오 기업들을 따라잡겠다는 것이다. 업계에서는 “국내 바이오 기업에 전통 제약사까지 가세하며 시밀러 시장에서의 경쟁이 더 치열해질 것으로 보인다”고 했다.종근당은 안과 질환 치료제 ‘루센티스’의 바이오 시밀러 ‘루센비에스’를 출시했다. 빈혈 치료제인 ‘네스프’의 바이오 시밀러 ‘네스벨’에 이어 두 번째 바이오 시밀러를 선보이는 데 성공했다. 동아에스티는 자가면역 질환 치료제 ‘스텔라라’ 바이오 시밀러 ‘DMB-3115′를 개발 중이다. 의약품 통계 자료인 아이큐비아에 따르면 스텔라라의 글로벌 매출은 95억5200만달러(약 12조5000억원)다. 전 세계 시장의 1%만 가져와도 1000억원 정도를 벌어들일 수 있는 셈이다. 동아에스티의 지난해 매출은 6353억원이다. 동아에스티는 “임상부터 출시까지 모두 글로벌 진출에 초점을 맞추고 진행하고 있다”고 했다.전통 제약사들은 해외 진출에 속도를 내고 있다. 종근당은 네스벨을 일본에 판매하고 있으며, 중동 6국과 동남아 3국에도 진출할 예정이다.LG화학도 자가면역질환 치료제 ‘엔브렐’의 바이오 시밀러 ‘유셉트’를 일본에 판매해 최근 일본 시장 점유율 40%를 넘어섰다. 동아에스티는 다국적 제약 기업인 ‘인타스’와 파트너십을 맺었다. 인타스는 인도계 회사로 전 세계 85국에 판매망을 보유하고 있고, 바이오 시밀러 13개를 상용화한 경험이 있다.다만 업계에서는 전통 제약사들이 바이오 시밀러 시장 진출 ‘노하우’가 없다는 점은 걸림돌이라고 지적한다. 내수 시장에서 복제약 위주로 영업을 벌여왔던 전통 제약사 입장에서는 큰 비용이 들어가는 데다 생산부터 판매까지 경험이 부족하다는 것이다. 업계 관계자는 “경험 부족이라는 한계에도 불구하고 전통 제약사들이 도전하는 것은 좁은 국내 시장을 넘어 전 세계적으로 성장하는 바이오 시밀러를 새로운 미래 먹거리로 점찍었기 때문이다”라고 말했다."
2024-08-14,"美서 1000억 팔린 국산 신약, 국내선 못사는 이유","심평원, 약가 지나치게 낮게 책정… ‘코리아 패싱’ 불러SK바이오팜이 자체 개발해 미국에 출시한 뇌전증(腦電症·간질) 신약 ‘세노바메이트(제품명 엑스코프리)’의 올해 2분기 매출이 전년 동기 대비 66% 늘어난 1052억원으로 집계됐다. 세노바메이트의 분기 매출이 1000억원을 넘어선 것은 처음이다. 13일SK바이오팜에 따르면, 세노바메이트는 지난해 2708억원 매출을 올린 데 이어 올해는 1분기(909억원)와 2분기(1052억원)에 분기 매출 기록을 잇따라 경신하고 있다. 2020년 5월 미국 시판 이후 4년간 매출액은 총 7263억원이다. 뇌 신경세포가 이상을 일으켜 발작을 일으키는 뇌전증 치료에서 세노바메이트는 뛰어난 효능으로 ‘게임 체인저’라는 평가를 받고 있다. 다른 약을 복용해도 발작이 멈추지 않던 난치성 환자를 대상으로도 발작 조절 효과를 보여 미국에서 현존 최고 뇌전증 치료제로 꼽히는 것이다. 하지만 한국에서는 이 약이 나오지도 않았다. 국내 바이오 회사가 개발한 신약인데 처방받지 못하는 상황이 벌어지자 “차라리 수입이라도 해달라”는 환자들 요구가 커지고 있다.그래픽=박상훈한국에서 안 파는 한국 신약세노바메이트는 2019년 11월 미 식품의약국(FDA), 2021년 1월 유럽의약품청(EMA)의 허가를 받았다. 그런데 한국에선 아직 허가 신청조차 하지 않았다. 아시아인을 대상으로 한 임상이 끝나지 않았다는 이유를 들고 있지만, 제약 바이오업계는 한국의 낮은 신약 약가 때문인 것으로 보고 있다. 한국에서 먼저 허가를 받으면 해외에서도 한국의 약가 수준을 기준으로 가격이 결정되는데, 한국에서 책정되는 약값이 워낙 낮아 일부러 허가를 미뤘다는 것이다.한국의 신약 약가는 경제협력개발기구(OECD) 평균 대비 절반 수준에 그치는 것으로 알려져 있다. 건강보험심사평가원이 환자 편익과 재정 부담 등을 고려해 약가를 낮춰온 영향이다. 물론 약값이 싸면 단기적으로 환자 입장에서 좋을 수 있다. 하지만 장기적으로는 글로벌 신약의 국내 출시가 늦어지는 문제가 생긴다. 한국에서 신약을 낮은 가격에 출시하면 다른 나라와의 가격 협상에서 불리해지는 만큼, 신약을 한국에서 가장 나중에 출시하는 현상을 초래하는 것이다. 허경 대한뇌전증학회 이사장(세브란스병원 신경과 교수)은 “미국에서 세노바메이트는 1알에 5만~6만원, 유럽에선 평균적으로 7000~9000원 정도 가격인데 국내에선 3000원대가 될 것으로 추정된다”며 “약가를 무조건적으로 낮게 책정하는 것은 한국 출시를 미루는 ‘코리아 패싱’을 심화해 오히려 환자들의 고통을 키우는 것”이라고 했다.국내외 제약업체가 개발한 신약들이 낮은 약가로 인해 쉽사리 국내 시장에 진입하지 못하고 도입까지 걸리는 시간도 길어 환자들의 불이익은 커지고 있다. 실제로 미국제약협회에 따르면 글로벌 신약이 보험 급여 적용까지 걸리는 기간은 한국이 46월로 미국(4월)의 11배, 일본(17월)의 2배 이상이다. 글로벌 신약의 1년 내 도입률도 5%로OECD평균(18%)에 크게 못 미친다. 신약을 홀대하는 정책이 글로벌 대형 제약사는 물론이고 한국 제약사들도 국내 시장을 외면하게 한다는 지적이 나온다그래픽=박상훈세노바메이트의 국내 출시는 2026년 이후에 이뤄질 전망이다.SK바이오팜은 판권 계약을 맺은 동아ST를 통해 2026년 건강보험(건보) 급여를 등재한다는 목표다.정부, 약가 더 낮추나국내에서 판매되지 않는 국산 신약은 세노바메이트뿐이 아니다. 동아에스티가 개발해 지난 2014년 6월FDA허가를 받은 수퍼항생제 ‘시벡스트로’ 역시 지난해 글로벌 4460만달러(약 611억원) 매출을 올리는 등 판매가 활발하다. 국내에서도 2015년 식약처로부터 시판 허가를 받고 건보 급여도 등재했지만 결국 2020년 허가를 자진 반납했다.국내 약가가 미국의 3분의 1 수준으로 책정되자 아예 국내 시장에서 철수한 것이다.SK바이오팜의 수면장애 신약 수노시 역시 국내 출시 계획이 없다.제약업계에선 정부가 추진 중인 ‘외국약가 비교 재평가’ 제도에 대한 우려도 크다. 외국약가 비교 재평가는 국내에서 유통되는 의약품 2만2920개 품목의 가격을 주요 8국을 기준으로 인하하는 제도다. 제도의 주 대상이 국내 제약업계의 캐시카우인 제네릭(복제약)인 만큼, 연구·개발비 투자가 위축될 수도 있다는 지적이 나온다. 업계 관계자는 “다른 국가들의 약가와 비교해 국내 의약품의 가격을 적정한 수준으로 조정하겠다는 취지지만 결국은 약가를 낮추겠다는 것”이라며 “글로벌 제약사들의 코리아 패싱이 더욱 심해지고, 수익성 저하로 신약 연구·개발(R&D) 환경도 악화될 것으로 우려된다”고 했다."
2024-06-05,5.1m 배양기 12개에 세포 가득… 美中 갈등 틈새 노리는 삼바의 승부수,"국내 바이오, 위탁개발생산에 속도… 삼성바이오로직스 제4공장 르포삼성바이오로직스 4공장지난달 13일 인천 송도국제도시의 삼성바이오로직스 제4 공장 2층에 들어서자 유리벽 너머로 사람 키만 한 배양기(바이오 리액터) 12개가 줄줄이 늘어서 있었다. 공장 바닥에 매립된 부분을 포함하면 높이 5.1m에 달하는 이 기기에서 바이오 의약품용 세포가 배양된다. 바로 옆에는 의약품 원료들이 이동하는 은색 파이프와 부설 기기들이 서로 구불구불 복잡하게 얽혀 있었다. 조금이라도 오염되면 치명적인 문제를 일으킬 수 있는 바이오 의약품의 특성상, 모든 제조 과정이 밀폐형 시스템으로 이뤄져 있다. 총 길이가 216㎞에 달하는 파이프는 모두 미세하게 기울어져 있어 원료가 고이는 것을 방지한다. 삼성바이오로직스 관계자는 “제4 공장은 단일 공장으로는 세계 최대인 연 24만L의 생산 규모를 갖췄다”며 “파이프 구조만 봐도 다른 업체들이 벤치마크할 수 있기 때문에 공장 내부는 고객사에도 공개하지 않는다”고 했다.국내 바이오 기업들이 위탁개발생산(CDMO) 시장 공략에 속도를 내고 있다.CDMO는 고객사의 위탁을 받아 의약품을 대신 개발·생산하는 것을 말한다. 글로벌 제약 바이오 시장에서 비용 절감과 개발 효율을 추구하는 바이오 기업이 증가하면서CDMO산업도 급성장하고 있다. 여기에 미국 의회는 세계 4위 규모의 중국CDMO인 우시 바이오로직스를 규제 대상으로 명시한 ‘바이오 보안법’을 발의해 연내 공포가 유력하다. 국내 바이오 업계는 반사이익을 기대하며 적극적인 고객 유치에 나서고 있다.그래픽=김성규삼성바이오,내년 78만L로 규모 확대시장조사 업체 프로스트앤드설리번에 따르면 2022년 202억8000만달러(약 27조8000억원)였던 글로벌CDMO시장 규모는 2028년 477억달러로 2배 이상 성장할 전망이다. 현재 스위스의 론자, 미국의 서모피셔 사이언티픽과 캐털런트 등이 1~3위로 앞서가고 있다. 우시 바이오로직스와 4~5위를 다투는 삼성바이오로직스의 승부처는 생산 능력이다.지난해 6월 제4 공장이 완전 가동에 들어간 데 이어, 내년 4월에는 제5 공장까지 완공해 78만4000L로 생산 규모를 확대할 계획이다. 론자의 내년 추정 생산 능력 79만L에 육박하는 규모다. 삼성바이오로직스가 2032년까지 제6~8 공장을 완공하면, 총 132만4000L의 생산 능력을 갖추게 된다. 실적도 호조를 보이고 있다. 지난해 3~4분기에는 분기 매출이 각 1조원을 넘긴 데 이어, 올 1분기에도 매출 9469억원을 기록하면서 1분기 기준 역대 최대치를 기록했다. 올해는 연매출 4조원이 목표다.바이오 보안법이 시행되면 우시 바이오로직스는 2032년 전에 미국에서 사실상 퇴출된다. 이에 따른 추가 수요를 흡수하기 위해 삼성바이오로직스는 기술 개발 속도를 앞당기고 있다. 지난 4일 삼성바이오로직스는 바이오 위탁 개발 플랫폼인 ‘에스-텐시파이(S-Tensify)’를 공개했다. 첨단 배양 기술을 통해 고농도의 바이오 의약품 초기 개발을 지원하는 기술이다. 바이오업계 관계자는 “우시바이오로직스는 초기 위탁 개발에 강점이 있는 반면, 삼성바이오로직스는 대규모 위탁 생산에 강하다”며 “새로운 위탁 개발 플랫폼을 출시해 우시의 고객들을 끌어오려는 포석”이라고 했다.美·中 갈등 반사이익 기대삼성바이오로직스뿐 아니다. 국내CDMO기업들은 지난 3일(현지 시각) 미국에서 막을 올린 ‘2024 바이오 인터내셔널 컨벤션’에 참가해 새로운 기회를 찾고 있다. 롯데바이오로직스는 미국에 증설 중인 항체약물접합체(ADC) 생산 시설과 현재 착공 중인 송도 공장 등을 내세우며 현지 고객사에CDMO생산 능력을 알리고 있다.SK바이오팜과SK바이오사이언스는 이 행사에서 처음으로 홍보관을 열었고, 동아 에스티팜은 핵산 치료제CDMO기술력을 알렸다.허혜민 키움증권 연구원은 “바이오 보안법이 의회 전체회의와 대통령 서명을 앞둔 상황에서 중국 업체와 계약을 맺고 있는 고객사들은 이미 다른CDMO를 찾고 있다”며 “국내CDMO업체에 반사 수혜와 낙수 효과가 기대되므로 미 식품의약국(FDA), 유럽 의약품기구(EMA) 등 승인 경험과 생산 능력 확보 등이 필요할 것”이라고 했다.☞CDMO(위탁개발생산)CDMO(ContractDevelopmentandManufacturingOrganization)는 고객사의 주문을 받아 바이오 의약품을 대신 개발하고 생산하는 것을 뜻한다. 의약품 위탁 생산인CMO와 의약품 위탁 개발인CDO로 나뉜다. 제약·바이오 업체 입장에선 개발 효율이 높고 비용을 절감할 수 있다."
