date,title,content
2022-11-06,보험·카드·캐피털까지…고금리와 신뢰 위기에 유동성 마른다,"레고랜드 사태가 불붙인 '돈맥경화'와 신뢰의 위기가 금융권 전반으로 퍼지고 있다. 증권사를 넘어 보험사와 카드사, 캐피탈사 등 제2금융권에도 위험 신호가 감지되고 있다. 보험사는 신종자본증권의 조기상환 일정을 연기하고, 유동성 마련을 위해 고금리 저축보험 상품을 잇달아 출시하고 있다. 자금조달이 어려워진 캐피탈사는 자동차 할부 금융 신규 영업을 줄이고 있다.국민의힘과 금융당국이 함께하는 민생금융점검 당정협의회가 6일 오후 서울 여의도 국회에서 열렸다. 회의 시작 전 김주현 금융위원장(왼쪽)과 이복현 금융감독원장이 대화하고 있다. 김성룡 기자보험사의 자본확충 압박은 커지고 있다. 시장금리가 오르고 채권시장에 자금이 마르며 자본 확충을 위해 발행한 신종자본증권 조기상환 리스크가 커지고 있다. 흥국생명이 지난 9일로 예정된 5억 달러 규모의 외화 신종자본증권의 조기상환 일정을 연기한 데 이어,DB생명도 오는 13일로 예정됐던 300억원 규모의 신종자본증권 조기상환 일정을 미뤘다. 신종자본증권에 대한 조기상환이 불발된 건 2009년 우리은행의 후순위채 이후 13년 만이다.신종자본증권은 영구채(永久債)로 분류돼 회계상 자본으로 인정을 받을 수 있다. 보험사들이 자기자본비율(BIS)을 높이기 위해 발행을 늘려온 이유다. 하지만 최근의 시장 여건이 만만치 않다 보니 조기상환 일정 연기 등이 발생하고 있다.한국기업평가에 따르면 내년 중 조기상환 일자가 돌아오는 보험사의 자본성증권은 4조4000억원 규모다. 내년 2분기에만 2조1100억원의 조기상환 일자가 도래한다. 자체 자금으로 조기상환 자금을 조달하거나 신규 채권을 발행해야 하는데 시장 여건이 여의치 않다.특히 흥국생명발 신뢰 위기가 현실화되며 한국 기업 등이 발행한 해외채권 가격이 급락하고 있다. 2025년 9월 조기상환 만기인 동양생명 신종자본증권 가격은 지난달 말 83.4달러에서 지난 4일 52.4달러로 떨어졌다. 한국 금융사 등이 발행한 해외채권에 대한 투자심리 악화로 수요가 줄고, 줄어든 수요를 끌어들이려 금리를 더 높아질 수밖에 없다.한국기업평가는 지난 4일 보고서를 통해 “해외 채권시장에서의 한국물에 대한 신뢰도 하락은 불가피해 보인다”며 “흥국생명의 조기상환 연기 사례로 인해 차환 여건이 더욱 악화해 한국 기업들의 조기상환 연기 물량이 증가할 가능성이 커지고 있다”고 분석했다.그래픽=박경민 기자minn@joongang.co.kr시중은행의 예·적금 금리 인상도 보험사를 압박하는 요인이다. 저축성보험의 해약이 증가하며 보험금을 내줄 돈을 마련하기 위한 유동성 자산 수요가 늘어서다. 보험업계에 따르면 '빅3 생보사'(삼성·한화·교보)가 연말까지 충당해야 할 자금만 6조4000억원 규모다.보험업계 관계자는 “저축성 보험 해지가 늘면서 자금 수요가 많이 증가한 데다 최근 채권금리 급등으로 중소형사는 물론 대형사들도 유동성 관리가 꽤 빡빡해진 상황”이라고 말했다.자금 확충을 위해 연 5%대 고금리 저축보험 상품을 내놓는 보험사들도 잇따르고 있다.ABL생명이 연 5.4% 금리 상품을 출시했고,IBK연금보험도 연 5% 저축보험을 내놨다. 보험업계에 따르면 한화생명 등 대형사도 연 5% 중반의 금리를 제공하는 저축보험 출시를 검토하고 있다. 저축보험은 일시납이 많아 한 번에 수천억 원의 자금을 끌어올 수 있다.보험업계 고위관계자는 “아직 시중에 풀린 유동성이 많기 때문에 유동성 문제는 고금리 저축보험을 발행해 관리할 수 있는 상황”이라며 “금리 인상으로 보유 채권에 대한 평가손실이 커진 만큼 채권 시장이 얼어붙어 추가 채권 발행을 통한 자금조달 부담 등이 커진 게 더 큰 위험 요인”이라고 말했다.그래픽=박경민 기자minn@joongang.co.kr카드사와 캐피탈사 등 여신전문회사(여전사)의 고민도 커지고 있다. 이들 여전사는 수신(예금) 기능이 없어 채권 발행 등을 통해 돈을 빌려야만 자금을 조달할 수 있다. 수신금리를 올려 시중에 풀린 유동성을 흡수해 자금을 조달할 수 있는 은행이나 저축은행, 보험사 등에 비해 유동성 관리가 어려울 수밖에 없다.한국은행도 지난 9월 금융안정보고서에서 “기준금리 인상 영향이 실물 경제와 자본시장에 파급하면서 증권사·여전사의 단기차입자금 차환리스크 등 신용·유동성 리스크가 커질 가능성이 있다”고 지적했다.여전사의 자금 조달 여건은 악화하고 있다. 여전채 금리(AA-,3년물 기준)는 올해 초 연 2.634%에서 지난 4일 6.285%까지 뛰어올랐다. 카드사와 캐피탈사 등이 발행하는 기타금융채의 순발행액은 지난해 14조8213억원에서 올해에는 7조9133억원(11월 4일 기준)으로 쪼그라들었다. 신용등급인AAA로 연 5%가 넘는 금리를 앞세운 한전채가 쏟아진 영향이다.레고랜드 사태로 단기자금 시장이 꽁꽁 얼어붙으면서 기업어음(CP) 등을 통한 자금 조달도 어려워졌다. 91일물CP금리는 지난달 19일(4.02%)에서 지난 4일 4.88%로 치솟았다. 세계금융위기 당시인 2009년 1월(연 5.0%) 이후 13년 9개월 만에 최고를 기록했다.돈이 마르면 신규 영업을 줄이고, 보유 자산에서 회수한 돈으로 차입금을 갚아야 한다. 이미 일부 카드·캐피탈사들이 자금 조달의 어려움으로 자동차 할부금융 서비스를 줄이고 있다. 여신금융업계 관계자는 “일부 회사는 금리를 높여 사실상 ‘디마케팅’(고객 구매를 의도적으로 줄이는 마케팅)에 나서고 있다”고 말했다.그래픽=박경민 기자minn@joongang.co.kr게다가 프로젝트 파이낸싱(PF) 등 부동산과 기업 대출이 늘며 빌려준 돈을 회수하는 것도 어려워졌다. 나이스신용평가에 따르면 캐피탈사의 총자산 중PF와 투자금융 비중은 2014년 말 각각 3.4%, 7.2%였는데 지난 6월 11.5%와 12.1%로 늘어났다. 이들 자산은 만기가 긴 데다, 부동산 경기 등 자산시장이 꽁꽁 얼어붙으며 회수에도 쉽지 않다.한국신용평가도 지난 9월 보고서에서 “취급자산의 축소를 통한 유동성 대응 및 자산유동화를 통한 대체자금 조달이 녹록하지 않은 상황”이라며 “현재의 유동성 리스크가 2008년 세계금융위기 당시처럼 단기간 내에 회복할 가능성은 제한적일 것으로 판단된다”고 지적했다.금융당국도 불안의 불씨를 크기 위해 전방위 대응에 나섰다. 금융당국은 은행, 보험, 카드, 캐피탈사 등과 연쇄적으로 시장 점검 회의를 열고 있다. 각종 유동성 규제를 일시적으로 완화해주는 등의 대책을 내놓고 있다. 최대 20조원 규모의 채권시장 안정펀드(채안펀드)를 통해 자금경색이 심한 여전채 매입도 개시했다.금융당국 관계자는 “금리 인상기를 맞아 보험사 등의 유동성 관리가 과거보다는 어려워진 건 사실”이라면서도 “보험사의 경우 내년 중 새 회계제도가 도입되는 데다 정부의 대책이 효과를 발휘해 시장의 심리가 안정을 찾으며 상황이 점차 개선될 수 있다고 본다”고 말했다."
2022-11-01,"한화생명금융서비스, 피플라이프 인수…초대형 GA로 영업채널 강화","한화생명의 판매전문 자회사인 한화생명금융서비스가 대형 법인보험대리점(GA)인 ‘피플라이프’를 인수한다. 이번 인수로 한화생명은 보험설계사 규모를 2만5000여명으로 불리며 영업 채널을 더욱 강화하게 됐다.한화생명한화생명금융서비스는 1일 피플라이프 인수를 위한 주식매매계약(SPA)을 체결했다고 밝혔다. 피플라이프는 공정거래위원회의 기업결합심사 승인 등을 거쳐 한화생명금융서비스의 자회사로 편입될 예정이다.피플라이프는 2003년 삼성생명 출신인 현학진 현 피플라이프 회장이 설립했다. 지난해 연간 매출액 3031억원, 영업이익 121억원을 기록한 업계 6위권의 대형GA다. 2018년GA업계 최초의 내방형 점포인 ‘보험클리닉’을 선보였다. 현학진 회장 및 특수관계인이 지분 62.9%를, 재무적투자자(FI)인 코스톤아시아가 32.2%를 보유하고 있다.이번 인수로 한화생명의 판매조직은 설계사 2만5000명 규모로 불어났다. 기존 한화생명금융서비스(1만8565명)에 한화라이프랩(2223명) 등에 피플라이프 소속 설계사(3760명)을 합한 숫자다. 올해 상반기 매출도 5000억원이 넘어서며 2위GA업체인 지에이코리아(3214억원) 등과의 격차도 벌리게 됐다.한화생명 여승주 대표이사는 “피플라이프 인수는 초우량GA로 도약하기 위한 성장 전략의 일환”이라며 “이번 인수를 통해 영업 전문성을 더욱 강화하고, ‘함께 멀리’의 경영철학을 바탕으로 고객의 삶에 새로운 가치를 더하는 최적의 금융서비스를 제공해 나가겠다”고 밝혔다.한화생명이 추진하는 제판분리(제조·판매 분리)도 힘을 받게 됐다. 한화생명은 지난해 4월 국내 생명보험업계 빅3(삼성·한화·교보) 중 최초로 제판분리에 나섰다. 제판분리를 하면 보험사는 상품 개발과 자산 운용에 집중하고, 판매사는 금융자문수요 증가와 효율적 고객 접점 확보 등에 적극 대응할 수 있다. 신한라이프와 미래에셋생명, 동양생명, 푸르덴셜생명 등도 제판분리를 진행했다.한화생명 관계자는 “미국과 일본 등에서는 이미 제조와 판매조직을 분리하는 이른바 ‘제판분리’가 대세로 자리 잡았다”며 “금번 피플라이프 인수를 계기로GA산업 전반의 체질과 경쟁력을 강화될 것으로 기대한다”고 말했다.한화생명금융서비스의 신임 최고경영자(CEO)로 내정된 한화생명 이경근 보험부문장(부사장). 한화생명한화생명금융서비스의 신임 최고경영자(CEO)에는 이경근 한화생명 보험부문장(부사장)이 내정됐다. 이 부사장은 1991년 한화생명에 입사한 뒤 보험영업과 관련한 주요 보직인 지점장과 지역단장, 지역본부장, 보험부문장을 모두 거친 보험영업 전문가라는 평가다. 피플라이프의 인수위원회 위원장은 한화생명금융서비스의 구도교 대표이사가 선임됐다."
2022-09-22,"은행 예·적금과 비슷한 저축보험…보험사, 4%대 상품 잇달아 출시","생명보험사가 판매하는 저축보험 상품도 금리 4% 시대가 열렸다. 미국 연방준비제도(Fed)의 긴축으로 시장금리가 가파르게 뛴 영향이다.21일 보험업계에 따르면 푸본현대생명·한화생명·흥국생명 등은 연 4%가 넘는 확정금리 저축보험을 출시했다. 만기 5년짜리 상품으로 보험료를 한 번에 납입하는 일시납 상품이다. 해당 상품 금리는 푸본현대생명 연 4%, 한화생명 4%, 흥국생명 4.2% 등이다. 올해 초만 해도 생명보험사들의 저축보험 상품의 금리는 연 1~2% 수준에 불과했다.저축보험은 목돈 마련을 위한 은행 정기 예·적금과 비슷하지만, 사망보장 등 보험 성격도 가미된 상품이다. 통상 만기 전 가입자가 사망할 경우 그동안 쌓인 적립금에 납입금액의 10% 안팎을 더 얹어 돌려준다. 주로 은행을 통해 판매(방카슈랑스)가 이뤄진다.다만 보험상품인 만큼 납입금에서 사업비와 위험보험료를 차감한 뒤 남은 금액에 이자를 제공한다. 한화생명의 저축보험 상품의 경우 상품 가입 후 7개월이 지나야 납입한 원금을 회복할 수 있다. 만약 5000만원을 납입한 뒤 만기 5년을 채우면 5950만6917원(40세 여성 기준·세전)을 돌려받을 수 있다. 저축은행의 평균 예금금리(연 3.74%)를 적용해 5년 만기 정기예금을 들었을 때의 이자 수익(935만원)보다 15만원가량 많다.금리가 뛰며 이들 저축보험 상품에는 목돈이 몰리고 있다. 푸본현대생명은 지난달 29일 상품을 출시한 뒤 3영업일 만에 판매 한도인 5000억원을 모두 채웠다. 한화생명도 지난 13일 출시 후 7000억원이 넘는 상품을 판매했다. 지난 16일 상품을 내놓은 흥국생명도 20일까지 2500억원 어치를 판매했다.보험업계에 따르면 동양생명도 연 4.5%의 확정금리를 제공하는 저축보험 상품 출시를 준비하고 있다. 생명보험사 관계자는 “한 보험사에서 금리가 더 높은 새 상품을 내놓으면, 곧장 이전 상품의 판매가 급감하는 등 0.1%포인트 금리 차에도 뭉칫돈이 옮겨가고 있다”고 말했다.저축보험 금리가 오르는 건 경쟁상대인 은행권의 정기예금 금리가 3%대로 훌쩍 뛰면서다.시중은행 정기예금 중 금리가 가장 높은 우리은행의WON플러스예금의 경우 1년 만기 상품의 금리가 연 3.59%이다. 우대금리를 모두 받을 경우 금리가 연 3.89%로 올라간다.게다가 2010년대 초반 보험사들이 경쟁적으로 판매했던 저축성 보험상품의 만기가 속속 도래하며, 이들 자금을 재유치하려는 보험사 간 경쟁도 금리를 끌어올리고 있다. 고금리 저축성보험 상품을 출시하는 보험사는 역마진 우려는 없다는 입장이다. 이들 금리확정형 상품의 경우 일시납이 많은 데다, 만기도 5·10년 등으로 짧다."
2022-09-21,금리 뛰니 4%대 저축보험 출시 경쟁…은행 예금보다 나을까?,"생명보험사가 판매하는 저축보험 상품도 금리 4% 시대가 열렸다. 미국 연방준비제도(Fed)의 긴축으로 시장금리가 가파르게 뛴 영향이다.21일 보험업계에 따르면 푸본현대생명·한화생명·흥국생명 등은 연 4%가 넘는 확정금리 저축보험을 출시했다. 만기 5년짜리 상품으로 보험료를 한 번에 납입하는 일시납 상품이다. 해당 상품 금리는 푸본현대생명 연 4%, 한화생명 4%, 흥국생명 4.2% 등이다. 올해 초만 해도 생명보험사들의 저축보험 상품의 금리는 연 1~2% 수준에 불과했다.시장금리가 뛰며 생명보험사들도 연 4%대 금리를 제공하는 저축보험 판매를 시작했다. 셔터스톡저축보험은 목돈 마련을 위한 은행 정기 예·적금과 비슷하지만, 사망보장 등 보험 성격도 가미된 상품이다. 통상 만기 전 가입자가 사망할 경우 그동안 쌓인 적립금에 납입금액의 10% 안팎을 더 얹어 돌려준다. 주로 은행을 통해 판매(방카슈랑스)가 이뤄진다. 다만 보험상품인 만큼 납입금에서 사업비와 위험보험료를 차감한 뒤 남은 금액에 이자를 제공한다.한화생명의 저축보험 상품의 경우 상품 가입 후 7개월이 지나야 납입한 원금을 회복할 수 있다. 만약 5000만원을 납입한 뒤 만기 5년을 채우면 5950만6917원(40세 여성 기준·세전)을 돌려받을 수 있다. 이자 외에 기한에 따른 유지보너스 등을 포함한 금액이다.저축은행의 평균 예금금리(연 3.74%)를 적용해 5년 만기 정기예금을 들었을 때의 이자 수익(935만원)보다 15만원가량 많다. 다만 추가납입 시 사업비 등을 제하지 않는 경우도 많아 이자 수익이 더 올라갈 수 있다.금리가 뛰며 이들 저축보험 상품에는 목돈이 몰리고 있다. 푸본현대생명은 지난달 29일 상품을 출시한 뒤 3영업일 만에 판매 한도인 5000억원을 모두 채웠다. 한화생명도 지난 13일 출시 후 7000억원이 넘는 상품을 판매했다. 지난 16일 상품을 내놓은 흥국생명도 20일까지 2500억원 어치를 판매했다.보험업계에 따르면 동양생명도 연 4.5%의 확정금리를 제공하는 저축보험 상품 출시를 준비하고 있다. 생명보험사 관계자는 ""한 보험사에서 금리가 더 높은 새 상품을 내놓으면, 곧장 이전 상품의 판매가 급감하는 등 0.1%포인트 금리 차에도 뭉칫돈이 옮겨가고 있다""고 말했다.보험사의 저축보험 금리가 오르는 건 경쟁상대인 은행권의 정기예금 금리가 3%대로 훌쩍 뛰면서다. 시중은행 정기예금 중 금리가 가장 높은 우리은행의WON플러스예금의 경우 1년 만기 상품의 금리가 연 3.59%이다. 우대금리를 모두 받을 경우 금리가 연 3.89%로 올라간다.한·미 기준금리 인상 전망 그래픽 이미지. [자료제공=한국은행, 미국연방준비제도(Fed)]게다가 2010년대 초반 보험사들이 경쟁적으로 판매했던 저축성 보험상품의 만기가 속속 도래하며, 이들 자금을 재유치하려는 보험사 간 경쟁도 금리를 끌어올리고 있다. 보험업계 관계자는 “특히 중소형 보험사의 경우 고금리를 제공하더라도 이런 자금을 재유치해야 유동성 등의 문제를 해소할 수 있다”고 말했다.당시 세법개정으로 2013년 2월부터 저축성 보험의 보험차익(수익)에도 세금을 물게 제도가 바뀌며 제도 변경 전인 2012년 저축성 보험 판매가 크게 늘었다. 금융감독원에 따르면 2012년 회계연도(2012년 4월~2013년 3월) 중 생명보험사의 초회 보험료 수입은 30조7000억원으로 2011년(15조1000억원)보다 두 배 이상 급증했다.보험사는 그동안 고금리 저축성보험으로 역마진에 시달렸다. 1990년 말~2000년대 초 연 5% 이상 고금리 금리확정형 보험을 팔았는데, 이후 저금리가 이어지며 보험금 지급을 위해 쌓아야 하는 돈이 보험료를 운용해 얻는 수익보다 커지며 이차(利差)역마진을 봐왔다. 지광운 군산대 법학과 교수 따르면 지난해 9월 기준 생명보험사의 이차역마진은 2조2000억원으로 추산된다.그래픽=박경민 기자minn@joongang.co.kr고금리 저축성보험 상품을 출시하는 보험사는 역마진 우려는 없다는 입장이다. 이들 금리확정형 상품의 경우 일시납이 많은 데다, 만기도 5·10년 등으로 짧다. 게다가 미국 연방준비제도(Fed)의 긴축으로 국고채나 우량 회사채 등의 금리도 큰 폭으로 뛰었다. 21일 기준 국고채 5년물과 10년물 금리는 각각 연 3.905%와 연 3.891%이다.생명보험사 관계자는 “납입한 보험료 대부분을 안정적인 국고채 등에 투자하고, 일부만 수익이 높은 자산에 투자할 경우 판매수수료 등을 제하고도 이차역마진 없이 수익을 볼 수 있는 상황”이라고 말했다."
2022-05-29,최근 5년여간 금융권 임직원 1000여억원 빼돌려…환수율 11.6%,"서울 여의도 금융감독원. 연합뉴스지난 5년여간 금융권 임직원의 횡령액이 1000여억원에 달하지만, 환수율은 11.6%에 불과한 것으로 나타났다.29일 금융감독원이 국민의힘 강민국 의원에게 제출한 자료에 따르면 2017년부터 2022년 5월까지 금융권에서 횡령을 한 임직원은 174명으로 횡령 규모는 1091억8260만원에 달했다.연도별 횡령액은 2017년 89억8870만원, 2018년 55억7290만원, 2019년 84억7370만원, 2020년 20억8280만원, 2021년 152억6580만원, 2022년은 5월 중순까지 687억9760만원이었다.업권별로 살펴보면 횡령한 임직원의 수는 은행이 91명으로 가장 많았고 보험 58명, 증권 15명, 저축은행 7명, 카드 3명 순이었다.횡령액 규모 또한 은행이 808억3410만원으로 최다였으며 저축은행(146억8040만원), 증권(86억9600만원), 보험(47억1600만원), 카드(2억5600만원)가 뒤를 이었다.이 기간 업권별로 횡령 임직원 수가 가장 많은 은행은 하나은행으로 17명이었고 보험은 동양생명(8명), 저축은행은 참저축은행(2명), 증권사는NH투자증권(4명)이 가장 많았다.지난 5년여간 금융권에서 환수한 횡령액은 127억1160만원으로 전체 횡령액의 11.6%에 그쳤다.저축은행의 횡령액 환수율이 5.7%로 업권 중에서 가장 낮았으며 은행이 8.4%, 보험이 23.2%, 증권이 43.2%였다."
