date,title,content
2023-10-27,'역도 영웅' 차관 장미란 재산 6.9억…평창 땅·원주 상가 얼마,"정기석 국민건강보험공단 이사장. 뉴스1정기석 국민건강보험 이사장이 27일 관보를 통해 공개되는 재산신고 대상자 가운데 가장 많은 92억원 가까이 신고했다. 부부 예금액만 40억원이 넘는다. 역도 국가대표 선수 출신인 장미란 문화체육관광부 2차관은 강원 땅과 상가 등을 더해도 재산이 7억원 조금 안 되는 것으로 나타났다. 이번 공개 땐 9000만원짜리 빈티지 오디오 등 이색재산(김채환 국가공무원인재개발원장)도 눈길을 끈다.━10월 수시공개 대상자 94명정부공직자윤리위원회가 이달 공개한 대상자들은 지난 7월 2일부터 8월 1일까지 임용·승진한 고위 공직자와 퇴직자 등 94명이다.우선 정기석 건보 이사장의 경우 7월 10일 임명됐다. 임용 전엔 한림의대 교수, 질병관리본부장 등을 지냈다. 정 이사장 신고재산은 모두 91억8164만원이다. 주요 재산으로는 ‘똘똘한 두 채’가 있다. 본인 명의 서울 강남구 역삼동 다가구 주택(대지 127.65㎡·건물 298.37㎡)을 12억1250만원에, 부인과 공동 명의로 된 서초구 서초동 아파트(153.9㎡)를 14억4800만원에 각각 신고했다. 부부 예금액을 더하면, 40억3987만원에 달한다. 주식부자이기도 하다. 동양생명(7만3000주)을 비롯해 부부가 12억9109만원 상당 주식을 갖고 있다.김홍일 국민권익위원장(사진 오른쪽). 뉴스1윤석열 대통령 검사시절 상사였던 김홍일 국민권익위원장은 모두 61억5159만원을 신고했다. 이번 신고대상자 중 재산신고액이 세 번째로 많다. 김 위원장은 강북 집값을 이끄는 용산 아파트를 부인과 공동명의로 보유 중이다. 서빙고동 아파트(167㎡) 재산신고액은 21억4700만원이다. 김 위원장 예금액도 만만치 않다. 차녀를 포함한 가족 예금액이 36억1935만원이다.장미란 문화체육관광부 2차관. 연합뉴스━은괴, 3000만원짜리 자개탁자·의자올림픽 금메달리스트인 장미란 문체부 2차관은 재산 신고액이 상대적으로 적다. 6억9345만원이다. 강원 평창군 대관령 땅(1068㎡) 3필지 1억4275만원과 강원 원주시 무실동 상가 2동(각각 대지 3.7㎡·건물 6.1㎡) 1억8400만원, 용인 처인구 아파트(84.9㎡) 2억8000만원 등을 신고했다. 용인 아파트는 전세다. 장 차관은 직전까지 용인대 교수를 지냈다. 장 차관은 주식을 갖고 있지 않다. 예금으론 1억6538만원을 신고했다.이색재산을 신고한 공직자도 있다. 김영근 재외동포협력센터장 모친과 부인은 미국 버지니아주에 단독주택을 한 채씩 보유 중이다. 건물 면적은 135~165㎡, 가격은 5억2000만원, 6억5000만원이다. 김채환 국가공무원인재개발원장은 빈티지 오디오(9000만원)를 신고했다. 턴테이블(1947년), 스피커(1950년) 등으로 구성돼 있다. 김 원장은 자개 탁자 및 의자(3000만원), 은괴·은화(2000만원)도 보유하고 있다."
2023-08-16,"보험사, 상반기 ‘5대 은행’만큼 벌었다…사회공헌 압박 거세질 듯","보험사들이 올해 상반기에 ‘5대 은행’만큼 순익을 거둔 것으로 나타났다. 보험업계에 대한 사회공헌 요구가 거세질 것으로 예상된다.16일 금융권에 따르면 올해 상반기 손해보험사와 생명보험사의 연결 기준 순이익은 8조여원으로 역대급 실적을 올린 것으로 분석됐다. 손해보험사가 4조6000여억원, 생명보험사가 3조4000여억원의 순이익을 냈다. 이는 5대 은행의 올해 상반기 순이익 8조969억원과 비슷한 수준이다.손보사의 경우 삼성화재의 상반기 순이익이 1조2176억원으로 가장 많았다. 이어DB손해보험(9181억원), 메리츠화재(8390억원), 현대해상(5780억원),KB손해보험(5252억원), 한화손해보험(1837억원),NH농협손해보험(1413억원), 롯데손해보험(1129억원) 순이었다. 생명보험 업계에서는 삼성생명의 상반기 순이익이 9742억원으로 가장 많았고 한화생명(7037억원), 교보생명(6715억원), 신한라이프(3117억원), 미래에셋생명(1987억원), 동양생명(1861억원),NH농협생명(1415억원)이 뒤를 이었다.그간 보험사들은 은행ㆍ카드사보다 사회 공헌에 상대적으로 인색했다는 비판이 적지 않았다. 금융당국의 ‘팔비틀기’가 작용했다지만, 은행권은 ‘이자 장사’ 논란이 일자 올해부터 3년간 10조 이상의 사회공헌 프로젝트를 추진하기로 했다. 카드사들도 이복현 금융감독원장의 방문을 계기로 소상공인과 취약 차주를 지원하기 위한 1조8000여억원 규모의 상생 금융 방안을 내놨다.반면 보험사의 경우 기존 사회공헌위원회 등을 통한 상생 금융 활동을 이어가는 데 그쳤다. 새로운 지원책은 한화생명이 ‘2030 목돈 마련 디딤돌 저축보험’을 내놓은 게 거의 유일하다. 은행ㆍ카드사가 기존 사회 공헌 외에 추가로 대규모 지원책을 내놓고 있는 것과 대비된다는 게 금융권에서 나오는 지적이다.이에 올해 자동차보험료 인하나 취약층을 위한 특별 보험 상품 출시에 대한 금융당국 등의 압박이 커질 전망이다. 올해 태풍과 폭우 속에서도 자동차보험 손해율이 양호한 데다, 역대급 실적까지 거둬 보험료를 하락 압박이 거세질 것으로 보이기 때문이다."
2023-02-14,고금리 나비효과…생명보험사 곳간 비어간다,"60대 남성 A씨는 2013년 2월 한 생명보험사의 저축성보험인 일시납 즉시연금보험에 가입해 5억원을 맡겼다. 즉시연금은 보험료를 한 번에 내는 대신 만기까지 원금을 보장해주고, 다음 달부터 이자를 연금형태로 수령하는 상품이다. A씨는 당시 10년 만기 상품에 가입했는데 공시이율이 연 4.6%일 때는 월 150만원을 수령할 수 있었다. 비과세 혜택까지 감안하면 더 많은 수익을 거둔 셈이다. 하지만 10년 만기를 앞둔 현재 공시이율은 연 3% 초반으로 떨어졌다. A씨는 “향후 기준금리 인상 여부에 따라 상대적으로 금리가 높은 시중은행이나 저축은행으로 자금을 옮길지 고민하고 있다”고 말했다.그래픽=차준홍 기자cha.junhong@joongang.co.kr한국은행이 기준금리를 급격하게 인상하면서 생명보험업계의 유동성에 노란불이 켜졌다. 지난해 말부터 저축성보험 해약 등이 잇따르면서 중소형 생보사들을 중심으로 현금 곳간이 비기 시작한 것이다. 13일 금융감독원이 국회 정무위원회 소속 유의동 국민의힘 의원실에 제출한 자료에 따르면 지난해 22개 주요 생보사의 저축성보험(이하 퇴직연금·연금저축 제외) 환급금은 53조3916억원에 달했다. 전년 대비 약 17조원(46.5%) 급증한 규모다. 환급금과 보험금, 배당금 등을 모두 더한 지급 규모는 60조원에 이를 거란 관측이 나온다.만기를 채워 환급해준 금액은 14조2186억원이었는데 중도에 해지한 금액도 39조1730억원이나 됐다. 생계형 중도해지도 물론 있겠지만, 원금손실을 감수하면서까지 더 높은 이자를 주는 은행으로 옮긴 돈이 적잖았다는 의미다. 지난해 11월까지만 해도 은행권 정기예금 금리 수준은 연 5%대에 달했다.문제는 올해도 상황이 녹록지 않다는 점이다. 22개 생보사가 판매했던 저축성보험 중 올해 만기가 도래하는 보험금은 총 12조8359억원으로 추산됐다. 업계 1위인 삼성생명이 3조2793억원으로 가장 규모가 컸고, 이어 농협생명(1조9812억원), 한화생명(1조9392억원), 동양생명(1조5670억원), 교보생명(9592억원), 흥국생명(6473억원) 순이었다. 여기에 중도 해지 가능성까지 고려하면 생보사가 부담해야 할 환급금은 더 늘어날 수 있다.그래픽=차준홍 기자cha.junhong@joongang.co.kr한 생보업계 관계자는 “금융당국이 수신 경쟁 자제를 권고하면서 은행으로의 ‘머니무브’가 좀 잦아들었지만, 우려를 불식시킬 정도는 아닌 것 같다”며 “각 보험사에서 고금리 저축보험을 판매하거나 채권을 내다 파는 방식으로 현금 곳간을 채우면서 일단 급한 불을 껐는데, 당분간은 상황을 예의주시해야 할 것 같다”고 말했다.보험사들은 고객들이 낸 보험료를 주식, 채권, 부동산 등에 투자해 수익을 내기 때문에 자산가치가 오르는 시기에는 환급금 규모가 커도 문제가 되지 않는다. 하지만 최근처럼 자산가치가 떨어지는 시기엔 부담이 될 수 있다. 현재 유동성에 경고등이 켜진 것도 지난해 기준금리가 급격히 치솟으면서 보험사가 보유 중인 채권 가격은 내려가고, 주가와 집값 또한 떨어진 영향이 크다.그러자 지난해 1~3분기 일부 보험사는 연 5%를 상회하는 고금리 확정형 저축성 상품을 출시하는 등 긴급 자금조달에 나섰다. 생명보험협회에 따르면 저축성보험으로 불리는 생사혼합보험의 지난해 1~11월 초회보험료(최초 납입 보험료)는 13조5969억원으로 전년 동기(3조6492억원) 대비 272.6% 불어났다. “고금리 막차 상품”이라는 식의 ‘절판 마케팅’도 횡행했다. 하지만 이런 식의 ‘급한 불 끄기’는 5년, 10년 후 또 다른 유동성 위기로 이어질 수 있다는 지적이 나온다.이석호 한국금융연구원 선임연구위원은 “지난해 레고랜드발 채권시장 경색에 이어 고금리·고물가·저성장 기조가 유지되면서 생보업계가 힘든 시기를 보내고 있다”며 “향후 이런 상황에 대비하기 위해선 저축성보험 비중을 줄이고 온라인판매 플랫폼을 활성화하는 등 돌파구를 찾아야 할 것”이라고 말했다."
2023-02-13,생보사 유동성 리스크 노란불...올해 만기 돌아오는 저축성보험만 13조,"60대 남성 A씨는 2013년 2월 한 생명보험사의 저축성보험인 일시납 즉시연금보험에 가입해 5억원을 맡겼다. 즉시연금은 보험료를 한 번에 내는 대신 만기까지 원금을 보장해주고, 다음 달부터 이자를 연금형태로 수령하는 상품이다. A씨는 당시 10년 만기 상품에 가입했는데 공시이율이 연 4.6%일 때는 월 150만원을 수령할 수 있었다. 비과세 혜택까지 감안하면 더 많은 수익을 거둔 셈이다. 하지만 10년 만기를 앞둔 현재 공시이율은 연 3% 초반으로 떨어졌다. A씨는 “향후 기준금리 인상 여부에 따라 상대적으로 금리가 높은 시중은행이나 저축은행으로 자금을 이동할지 고민하고 있다”고 말했다.한국은행이 기준금리를 급격하게 인상하면서 생명보헙업계의 유동성에 노란불이 커졌다. 지난해 말부터 저축성보험 해약 등이 잇따르면서 중소형 생보사들을 중심으로 현금 곳간이 비기 시작한 것이다. 13일 금융감독원이 국회 정무위원회 소속 유의동 국민의힘 의원실에 제출한 자료에 따르면 지난해 22개 주요 생보사의 저축성보험(이하 퇴직연금ㆍ연금저축 제외) 환급금은 53조3916억원에 달했다. 전년 대비 약 17조원(46.5%) 급증한 규모다. 환급금과 보험금, 배당금 등을 모두 더한 지급 규모는 60조원에 이를 거란 관측이 나온다.그래픽=차준홍 기자cha.junhong@joongang.co.kr만기를 채워 환금해준 금액은 14조2186억원이었는데 중도에 해지한 금액도 39조1730억원이나 됐다. 생계형 중도해지도 물론 있겠지만, 원금손실을 감수하면서까지 더 높은 이자를 주는 은행으로 옮긴 돈이 적잖았다는 의미다. 지난해 11월까지만 해도 은행권 정기예금 금리 수준은 연 5%대에 달했다.문제는 올해도 상황이 녹록지 않다는 점이다. 22개 생보사가 판매했던 저축성보험 중 올해 만기가 도래한 보험금은 총 12조8359억원으로 추산됐다. 업계 1위인 삼성생명이 3조2793억원으로 가장 규모가 컸고, 이어 농협생명(1조9812억원), 한화생명(1조9392억원), 동양생명(1조5670억원), 교보생명(9592억원), 흥국생명(6473억원) 순이었다. 여기에 중도 해지 가능성까지 고려하면 생보사가 부담해야 할 환급금은 더 늘어날 수 있다.한 생보업계 관계자는 “금융당국이 수신 경쟁 자제를 권고하면서 은행으로의 ‘머니무브’가 좀 잦아들었지만, 우려를 불식시킬 정도는 아닌 것 같다”며 “각 보험사에서 고금리 저축보험을 판매하거나 채권을 내다 파는 방식으로 현금 곳간을 채우면서 일단 급한 불을 껐는데, 당분간은 상황을 예의주시해야 할 것 같다”고 말했다.그래픽=차준홍 기자cha.junhong@joongang.co.kr보험사들은 고객들이 낸 보험료를 주식, 채권, 부동산 등에 투자해 수익을 내기 때문에 자산가치가 오르는 시기에는 환급금 규모가 커도 문제가 되지 않는다. 하지만 최근처럼 자산가치가 떨어지는 시기엔 부담이 될 수 있다. 현재 유동성에 경고등이 커진 것도 지난해 기준금리가 급격히 치솟으면서 보험사가 보유 중인 채권 가격은 내려가고, 주가와 집값 또한 떨어진 영향이 크다.그러자 지난해 1~3분기 일부 보험사는 5%를 상회하는 고금리 확정형 저축성 상품을 출시하는 등 긴급 자금조달에 나섰다. 생명보험협회에 따르면 저축성보험으로 불리는 생사혼합보험의 지난해 1~11월 초회보험료(최초 납입 보험료)는 13조5969억원으로 전년 동기(3조6492억원) 대비 272.6% 불어났다. “고금리 막차 상품”이라는 식의 '절판 마케팅'도 횡행했다. 하지만 이런 식의 ‘급한 불 끄기’는 5년ㆍ10년 후 또 다른 유동성 위기로 이어질 수 있다는 지적이 나온다.이석호 한국금융연구원 선임연구위원은 “지난해 레고랜드발 채권시장 경색에 이어 고금리ㆍ고물가ㆍ저성장 기조가 유지되면서 생보업계가 힘든 시기를 보내고 있다”며 “엎친 데 덮친 격으로 안 좋은 일들이 동시에 닥친 거라지만 향후 이런 상황에 대비하기 위해선 저축성보험 비중을 줄이고 온라인판매 플랫폼을 활성화하는 등 돌파구를 찾아야 할 것”이라고 말했다."
2022-11-08,"[사설] ‘돈맥경화’는 신뢰의 위기, 확산 차단해야","흥국생명이 7일 외화 신종자본증권의 조기상환권(콜옵션)을 당초 예정대로 행사하기로 했다. 시장 불안을 잠재우기 위해서다. 사진은 3일 서울 종로구 흥국생명 본사 모습. [연합뉴스]━증권·보험·카드·캐피털 2금융권 자금 비상━둔촌주공·흥국생명처럼 사안별 대응 중요제2금융권과 기업의 돈줄이 마르는 ‘돈맥경화’ 현상이 이어지고 있다. 레고랜드 사태에 이어 흥국생명과DB생명 등 보험사들이 신종자본증권의 조기상환 일정을 미루겠다고 밝히면서 채권시장에 찬바람이 불고 있다. 부동산 호황기에 부동산 프로젝트 파이낸싱(PF) 시장에 많이 투자한 증권사, 고금리에 저축형 상품이 빠져나가 자본 확충에 여념이 없는 보험사, 수신 기능이 없어 채권으로 자금을 조달해야 하는 카드사와 캐피털사 등 주로 제2금융권에서 불안감이 커지고 있다.5년 전에 5억 달러 규모로 발행한 흥국생명 증권의 만기는 30년이지만 5년이 지나면 돈을 일찍 갚을 권리(콜옵션)를 흥국생명이 갖고 있다. 대부분 5년 뒤에 옵션을 행사해 왔기에 시장에서는 사실상 만기 5년짜리 채권으로 여겼는데 투자자들의 기대에 부응하지 못하면서 사달이 난 것이다.특히 흥국생명의 신종자본증권은 외화표시채여서 비슷한 한국물 가격을 떨어뜨리는 등 대외신인도에도 나쁜 영향을 미쳤다. 2025년 9월 조기상환 만기인 동양생명 신종자본증권 가격은 지난달 말 83.4달러에서 지난 4일 52.4달러로 떨어졌다. 해외시장에서 한국물 수요가 줄면 국내 기업이 해외에서 달러를 빌리기 위해 더 높은 금리를 제시할 수밖에 없다.이재명 더불어민주당 대표는 그제SNS에 ‘살얼음판 같은 자금시장 경색, 땜질 처방으론 안 됩니다’라는 글을 올려 흥국생명 사태를 언급했다. 그는 “당장 내년에 만기가 돌아오는 외화채권 규모가 35조원에 달한다”며 선제적인 대응을 주문했다. 한은은 물가를 잡겠다고 금리를 올리는데 정부는 시장에 유동성을 공급하는 일관성 없는 단기 대책을 쓰고 있다고 비판했다.총론으론 맞는 말 같지만 각론에서 현실감이 떨어진다. 지금은 거래 상대방을 믿지 못해 거래를 못 하는 신뢰의 위기다. 당국이 사안별로 필요한 정보를 제공하는 등 적극적으로 나서면 풀 수 있는 문제가 꽤 있다. 지난달 7000억원 차환에 성공한 서울 둔촌주공 재건축조합이 대표적이다. 시장 기능이 작동하지 않아 막힌 곳은 하나하나 뚫어줘야 한다. 이런 것까지 땜질 처방이라고 비판해선 안 된다.‘제2의 레고랜드’ 소리를 들었던 흥국생명 사태도 다행히 정부와 발행사인 흥국생명이 머리를 맞대고 해결 방안을 찾았다. 흥국생명이 당초 예정대로 9일 조기상환을 하기로 했다. 상환자금 대부분은 흥국생명이 자체 자금으로 조달하고 시중은행과 보험사 등이 흥국생명이 발행하는 환매조건부채권(RP)을 매입해 지원하는 방식이다. 당국은 금융 불안 요인 하나하나 긴장감을 갖고 대처해야 한다. 각론에서 실패하면 번듯한 총론도 빛 좋은 개살구일 뿐이다."
2022-11-07,“돈 구하기 어려워졌다” 보험·카드·캐피털사도 비상,"레고랜드 사태가 불붙인 ‘돈맥경화’와 신뢰의 위기가 금융권 전반으로 퍼지고 있다. 증권사를 넘어 보험사와 카드사, 캐피털사 등 제2금융권에도 위험 신호가 감지되고 있다. 보험사는 신종자본증권의 조기상환 일정을 연기하고, 유동성 마련을 위해 고금리 저축보험 상품을 잇따라 출시하고 있다. 자금 조달이 어려워진 캐피털사는 자동차 할부금융 신규 영업을 줄이고 있다.보험사의 자본 확충 압박은 커지고 있다. 시장금리가 오르고 채권시장에 자금이 마르며 자본 확충을 위해 발행한 신종자본증권 조기상환 리스크가 커지고 있다. 흥국생명이 지난 9일로 예정된 5억 달러 규모의 외화 신종자본증권 조기상환 일정을 연기한 데 이어,DB생명도 오는 13일로 예정됐던 300억원 규모의 신종자본증권 조기상환 일정을 미뤘다. 신종자본증권에 대한 조기상환이 불발된 건 2009년 우리은행의 후순위채 이후 13년 만이다.그래픽=박경민 기자minn@joongang.co.kr신종자본증권은 영구채(永久債)로 분류돼 회계상 자본으로 인정받을 수 있다. 보험사가 자기자본비율(BIS)을 높이기 위해 발행을 늘려온 이유다.한국기업평가에 따르면 내년 중 조기상환 일자가 돌아오는 보험사의 자본성 증권은 4조4000억원 규모다. 내년 2분기에만 2조1100억원의 조기상환 일자가 도래한다. 자체 자금으로 조기상환 자금을 조달하거나 신규 채권을 발행해야 하는데 시장 여건이 여의치 않다.특히 흥국생명발 신뢰 위기가 현실화하며 한국 기업 등이 발행한 해외채권 가격이 급락하고 있다. 2025년 9월 조기상환 만기인 동양생명 신종자본증권 가격은 지난달 말 83.4달러에서 지난 4일 52.4달러로 떨어졌다. 한국 금융사 등이 발행한 해외채권에 대한 투자심리 악화로 수요가 줄고, 줄어든 수요를 끌어들이려 금리를 더 높일 수밖에 없다.한국기업평가는 지난 4일 보고서를 통해 “해외 채권시장에서의 한국물에 대한 신뢰도 하락은 불가피해 보인다”며 “흥국생명의 조기상환 연기 사례로 인해 차환 여건이 더욱 악화해 한국 기업의 조기상환 연기 물량이 증가할 가능성이 커지고 있다”고 분석했다.생명보험 빅3, 연말까지 6조4000억 필요그래픽=박경민 기자minn@joongang.co.kr시중은행의 예·적금 금리 인상도 보험사를 압박하는 요인이다. 저축성 보험의 해약이 증가하며 보험금을 내줄 돈을 마련하기 위한 유동성 자산 수요가 늘어서다. 보험업계에 따르면 ‘빅3 생보사’(삼성·한화·교보)가 연말까지 충당해야 할 자금만 6조4000억원 규모다.보험업계 관계자는 “저축성 보험 해지가 늘면서 자금 수요가 많이 증가한 데다 최근 채권금리 급등으로 중소형사는 물론 대형사도 유동성 관리가 꽤 빡빡해진 상황”이라고 말했다.자금 확충을 위해 연 5%대 고금리 저축보험 상품을 내놓는 보험사도 잇따르고 있다.ABL생명이 연 5.4% 금리 상품을 출시했고,IBK연금보험도 연 5% 저축보험을 내놨다. 보험업계에 따르면 한화생명 등 대형사도 연 5% 중반의 금리를 제공하는 저축보험 출시를 검토하고 있다.보험업계 고위관계자는 “아직 시중에 풀린 유동성이 많기 때문에 유동성 문제는 고금리 저축보험을 발행해 관리할 수 있는 상황”이라며 “금리 인상으로 보유 채권에 대한 평가손실이 커진 만큼 채권시장이 얼어붙어 추가 채권 발행을 통한 자금 조달 부담 등이 커진 게 더 큰 위험 요인”이라고 말했다.당국 “내년 새 회계제도 도입, 개선될 것”그래픽=박경민 기자minn@joongang.co.kr카드사와 캐피털사 등 여신전문회사(여전사)의 고민도 커지고 있다. 이들 여전사는 수신(예금) 기능이 없어 채권 발행 등을 통해 돈을 빌려야만 자금을 조달할 수 있다. 수신금리를 올려 시중에 풀린 유동성을 흡수해 자금을 조달할 수 있는 은행이나 저축은행, 보험사 등에 비해 유동성 관리가 어려울 수밖에 없다.여전사의 자금 조달 여건은 악화하고 있다. 여전채 금리(AA-,3년물 기준)는 올해 초 연 2.634%에서 지난 4일 6.285%까지 뛰어올랐다. 카드사와 캐피털사 등이 발행하는 기타금융채 순발행액은 지난해 14조8213억원에서 올해는 7조9133억원(11월 4일 기준)으로 쪼그라들었다. 신용등급AAA로 연 5%가 넘는 금리를 앞세운 한전채가 쏟아진 영향이다.레고랜드 사태로 단기자금 시장이 꽁꽁 얼어붙으면서 기업어음(CP) 등을 통한 자금 조달도 어려워졌다. 91일물CP금리는 지난달 19일 4.02%에서 지난 4일 4.88%로 치솟았다. 세계 금융위기 당시인 2009년 1월(연 5.0%) 이후 13년9개월 만에 최고를 기록했다.돈이 마르면 신규 영업을 줄이고, 보유 자산에서 회수한 돈으로 차입금을 갚아야 한다. 이미 일부 카드·캐피털사는 자동차 할부금융 서비스를 줄이고 있다. 여신금융업계 관계자는 “일부 회사는 금리를 높여 사실상 ‘디마케팅’(고객 구매를 의도적으로 줄이는 마케팅)에 나서고 있다”고 말했다.금융 당국은 각종 유동성 규제를 일시적으로 완화해 주는 등의 대책을 내놓고 있다. 최대 20조원 규모의 채권시장 안정펀드(채안펀드)를 통해 자금 경색이 심한 여전채 매입도 개시했다.금융 당국 관계자는 “보험사의 경우 내년 중 새 회계제도가 도입되는 데다 정부의 대책이 효과를 발휘해 시장의 심리가 안정을 찾으며 상황이 점차 개선될 수 있다고 본다”고 말했다."
