date,title,content
2022-11-22,"공정위에 꼬리 내린 애플, ""국내 앱 과다 수수료 자진시정""","서울 신사동 가로수길 애플 매장의 로고 모습. 뉴스1애플이 해외 앱개발사보다 국내 앱개발사에 수수료를 더 많이 부과해오다 공정거래위원회가 조사에 착수하자 꼬리를 내렸다. 내년 1월까지 자진 시정해 해외 앱개발사와 같은 방식으로 바꾸기로 했다.다만 공정위는 자진 시정 이전까지 애플이 법을 위반했는지에 대해 계속 조사할 예정이다. 공정위는 구글이 앱개발사들에 자사 앱마켓에만 앱을 출시하도록 강요한 혐의에 대해서도 조만간 심의를 진행해 제재 여부와 수위를 결정할 계획이다.한기정 공정거래위원장은 22일 경기도 판교 테크노밸리에 위치한 엔씨소프트를 찾아 앱개발 업계 간담회를 열고 애플의 수수료 문제 자진 시정 방침을 전했다.한 위원장은 “지난 9월 애플이 해외 앱개발사와는 달리 국내 앱개발사에 대해서만 앱마켓 수수료를 부당하게 부과한다는 문제가 제기돼 공정위가 신속히 조사에 착수했는데, 최근 애플이 문제가 된 행위를 내년 1월까지 스스로 시정하겠다는 의사를 알려왔다”고 설명했다.애플은 국내 앱 개발사에는 부가가치세분(10%)이 포함된 최종소비자가격을 기준으로 앱마켓 수수료를 30% 부과하고, 해외 앱개발사(국내 소비자 대상으로 앱을 판매하는 해외 거주 개발사)에는 최종소비자가격에서 부가세분을 제외한 공급가액 기준으로 수수료를 부과한 것으로 확인됐다. 해외 앱개발사는 30%의 수수료만 부담한 반면, 국내 앱개발사는 사실상 33%의 수수료를 내온 셈이다. 한국모바일게임협회는 이같은 방식으로 2015~2020년 3500억원을 더 가져갔다고 지적했다.이에 공정위가 애플코리아를 상대로 현장 조사를 벌이고 미국 본사 소속 임원과 면담을 진행하자 애플은 ‘국내 앱개발자에게도 공급가액을 기준으로 수수료를 부과하도록 약관 수정ㆍ시스템 변경 작업을 내년 1월 말까지 완료하겠다’는 의사를 공정위에 전했다.다만 한 위원장은 “(자진시정) 그 이전에 벌어진 위법 상태에 관련해선 조사하고 심의할 것”이라며 “애플 측에서 자진시정안을 마련한 상황은 반갑다. 자진시정 이행 여부와 경과 등을 살펴 종합적으로 살펴보겠다”고 말했다.애플은 이날 공식 입장 자료를 통해 이같은 변경 방침을 밝히면서 “애플은 대한민국 앱 개발자들의 협업 역사에 자부심을 느끼며, 개발자들에게 항상 세계적인 수준의 도구와 기술을 제공함으로써 그들의 사업이 전 세계 애플 스토어에서 성장할 수 있도록 지원하고 있다”고 호소했다.한 위원장은 간담회에서 “게임사에 대해 경쟁 앱마켓에 앱을 출시하지 못하도록 방해한 혐의에 대해서는 조사를 마무리하고 조만간 심의를 진행할 예정”이라고도 밝혔다.구글이 넥슨, 엔씨소프트, 넷마블 등 국내 게임사에 자사 앱마켓인 플레이스토어에만 앱을 출시하도록 강요한 사건에 대해 곧 심의에 착수해 제재 여부와 수위를 결정하겠다는 의미다.구글은 이 사건 조사 과정 중 공정위를 상대로 심사자료 열람ㆍ복사 거부 처분 등을 취소하라며 소송을 제기했지만 지난달 서울고법이 원고 패소 판결을 내린 바 있다.인앱결제 의무화 문제에 대해서는 “작년 전기통신사업법이 개정되면서 위반 여부를 방송통신위원회가 조사하고 있고 공정위도 관계부처와 긴밀히 협조하면서 공정거래법 위반 여부에 대해 심도있게 살펴볼 예정”이라고 말했다.한 위원장은 “앱마켓 생태계의 역동성과 혁신을 지속적으로 뒷받침하려면 앱마켓 사업자의 독점력 남용행위가 적기에 시정될 필요가 있다”며 “공정위는 앱 마켓 시장에서의 공정한 경쟁 기반을 조성하기 위해 다방면으로 노력하고 있다”고 말했다.이날 간담회에는 이정헌 넥슨코리아 대표이사, 안용균 엔씨소프트 전무, 김성철 넷마블 경영임원, 양지을 티빙 대표이사, 김동훈 드림어스컴퍼니 대표이사, 최혁재 스푼라디오 대표이사가 참석했다.참석자들은 공정위에 앱마켓 사업자의 인앱결제 시스템 관련 이슈나 과다한 수수료 부과 등의 애로사항에 적극적으로 대응해달라고 요청했다."
2022-03-30,"[Biz & Now] 빗썸메타, 대기업서 90억원 시드라운드 투자 유치","암호화폐 거래소 빗썸 자회사 빗썸메타는LGCNS,CJ올리브네트웍스, 드림어스컴퍼니(SK그룹 계열사) 등 대기업으로부터 총 90억원의 시드 라운드(초기 자금) 투자를 유치했다고 29일 밝혔다. 빗썸메타는 메타버스 플랫폼 구축,NFT마켓플레이스 개발 등을 위해 만든 빗썸 자회사다. 조현식 빗썸메타 대표는 “각 영역 최고 기업과 전략적 파트너십을 통해 글로벌 생태계 구축을 위한 핵심 기술과 콘텐트를 확보하게 됐다”고 말했다."
2022-08-25,"대구한의대, 베트남 화장품 뷰티 박람회 참가","대구한의대학교 산학협력단은 경북지역의 우수한 화장품을 세계시장 진출을 지원하기 위해 8월 24일부터 26일까지 3일간 베트남 호찌민에서 개최되는 ‘2022 코스모뷰티 베트남 화장품 뷰티 박람회’에 참가하고 있다.이커머스, 소셜네트워크 등 온라인마켓을 필두로 초고속 성장중인 베트남 뷰티시장에 경북지역의 우수한 화장품을 홍보하고, 지역 강소기업의 판로확대를 지원하기 위함이다. 박람회에는 지역의 우수 뷰티기업 6개사(제이랩스, 더나은컴퍼니, 알래스카드림, 라사, 코스엠, 비엘바이오텍)가 보유한 42개 제품이 전시되고 있으며, 체험행사를 통한K-뷰티의 우수성을 홍보 중이다.이번 박람회에 참가한 주식회사 제이랩스는 베트남 프리미엄 뷰티시장 네트워크를 보유한HOMNAYBEAUTY사와 미화 75만 달러 수출계약을 체결하는 등 전시기간 중 총 미화 100만 달러 수출계약을 체결하는 쾌거를 어루었다.주식회사 제이랩스는 경상북도 및 경산시가 지원하는 화장품산업 경쟁력 강화사업을 통해 시장지배력이 강한 우수제품을 개발하였으며, 공공기술을 이전 받아 미래창조과학부 지정 연구소기업으로 등록된 지역의 강소화장품 기업이다.연구소기업이 자체 증류추출공법을 통해 식물 본연의 향을 피부에 전달하는 비건·클린뷰티브랜드 오리진어스를 필두로 다양한 화장품원료 및 화장품을 개발함으로써 천연 화장품 시장에서 새로운 카테고리를 열어가고 있다.아울러, 대구한의대학교LINC3.0사업단에서 운영 중인 캡스톤디자인 및 현장실습 등의 산학연 연계 교육과정과 연계한 다양한 기업지원프로그램도 준비되었다.참여기업과 대학이 쌍방향 산학협력강화를 위하여 마련된 프로그램을 통해 제품 홍보 및 수출 상담지원, 사용 후기 조사 분석을 통한 제품개발 방향성 제시, 유사 경쟁 제품 분석을 통한 제품 경쟁력 강화 등 박람회 참가 이후 세계시장 진입을 위한 다양한 자료가 기업들에게 전달되어 추가 성과도 기대된다.대구한의대학교 총장 변창훈은 “그간 경상북도 및 경산시의 지원을 통하여 지역의 뷰티기업이 안정적인 시장진입을 위한 우수제품 개발과 마케팅 역량을 갖추었으며, 이를 통한 결실로 수출계약을 체결할 수 있었다. 앞으로도 대구한의대학교는LINC3.0사업,K-뷰티비즈니스학과 등 지역기업들이 성장할수 있는 각종 산학협력프로그램 개발과 전문인력 양성에 노력 할 것”이라며 경북지역 뷰티 산업의 육성과 강소기업들의 성장을 지원하겠다고 말했다."
2022-11-08,"[뉴스AS] 음악 스트리밍 서비스, 재생에너지 100% 언제쯤?","플로 2030년, 멜론·바이브 2040년, 지니 2050년 목표다양한 음악 스트리밍 앱의 모습. 김효실 기자전세계 케이팝 팬들이 모인 기후행동 플랫폼 ‘케이팝포플래닛’(KPOP4PLANET,지구를 위한 케이팝)은 지난 9월 멜론, 지니뮤직, 플로, 바이브, 벅스 등 음악 스트리밍 플랫폼 기업들의 문을 두드렸다. 앞서 케이팝포플래닛은 이들 기업을 상대로 친환경 스트리밍(실시간 재생)을 요구하는 ‘멜론은 탄소맛’ 캠페인을 벌였다. 이 캠페인에 참여 의사를 밝힌 케이팝 팬이 1만여명을 넘기자, 케이팝포플래닛은 팬들의 청원과 성명서를 각 기업에 전달했다.이 캠페인의 골자는 ‘음악 스트리밍도 기후위기의 주요 원인인 탄소 배출과 연결되어 있다’는 사실을 널리 알리고, 기업의 책임 있는 조치를 촉구하는 것이다. 2019년 카일 디바인과 맷 브레넌의 공동 연구를 통해, 온라인 스트리밍이 시디(CD)와 엘피(LP) 못지않게 지구에 악영향을 준다는 사실이 드러났다. 실물 앨범 시대에서 스트리밍 시대로 넘어간 뒤 플라스틱 사용량은 줄어든 반면, 클라우드 서비스로 음악을 저장·처리하는 전력 사용량이 늘었기 때문이다. 글로벌 음악 스트리밍 기업인 스포티파이, 유튜브뮤직, 애플뮤직이 수년 전부터 재생에너지 전환을 포함한 탄소배출 줄이기에 나선 이유다.케이팝포플래닛은 글로벌 업체들에 견줘 상대적으로 기후위기 대응이 더딘 국내 음원 서비스들을 상대로 다음 조치들을 요구했다. △재생에너지 100% 음원파일 상품 출시 △현재 데이터센터에서 사용하고 있는 재생에너지 비율 공개 △2030년 재생에너지 100% 전환 계획 등이다. 기업들은 어떤 답변을 내놨을까?케이팝포플래닛의 ‘멜론은 탄소맛’ 캠페인에 참여한 케이팝 팬들의 음악 스트리밍 앱 리뷰 모습. 케이팝포플래닛 제공8일 <한겨레> 취재를 종합하면, 케이팝포플래닛이 청원·성명서를 전달한 5곳 가운데 답변을 보낸 곳은 네이버(바이브 운영)와 카카오엔터테인먼트(멜론 운영) 2곳이다. 드림어스컴퍼니(플로 운영)는 케이팝포플래닛이 청원·성명서를 전달하기 전에 케이팝포플래닛 쪽에 입장을 전했으며, 그 뒤에는 응답이 없었다. 케이팝포플래닛의 청원에 응답하지 않은 지니뮤직, 플로, 벅스 쪽의 입장은 <한겨레>가 따로 듣고 취합했다.먼저, 5곳 모두 ‘기후위기 대응이 필요하다’는 케이팝포플래닛의 문제의식에는 공감한다고 했다. 벅스를 운영하는 엔에이치엔(NHN)벅스는 <한겨레>에 “(케이팝포플래닛의 청원·성명서와 관련한) 담당자를 확인한 후 전달하는 과정이 일부 늦어졌지만, 현재 관련 내용을 심도 있게 살펴보고 저희가 할 수 있는 일들을 논의하며 답변을 준비 중인 단계”라며, “친환경에 대한 목소리에 깊이 공감하고 있으며, 이를 실천하기 위한 구체적인 방안들을 모색하고 있다”고 답했다. 카카오엔터테인먼트는 케이팝포플래닛에 “(케이팝포플래닛의) 우려에 대해 깊이 공감하고 있으며, 전지구적 차원의 기후 행동에 동참해달라는 요청도 무거운 책임감을 느끼며 동감하고 있다”고 전했다.재생에너지 전환 목표를 명확하게 밝힌 곳은 카카오엔터테인먼트(멜론 운영), 네이버(바이브 운영), 케이티(KT,지니뮤직 모회사), 드림어스컴퍼니(플로 운영) 4곳이었다. 이 가운데 멜론, 바이브, 지니뮤직은 모두 모회사인 카카오, 네이버, 케이티의 아르이100(RE100) 가입 또는 가입 계획에 자회사로서 동참한다는 입장이다. 아르이100은 2050년까지 기업이 사용하는 전력량을 100% 재생에너지로 전환한다는 목표를 내세운 글로벌 캠페인이다. 케이티 쪽은 <한겨레>에 “지난 6월 아르이100에 가입한 뒤 실행 계획을 수립 중이며, 전 그룹사 동참을 목표로 하고 있다”고 말했다. 아직 자회사·계열사 차원의 실행 계획까지는 진척되지 않았다는 의미다.국제 캠페인 아르이100이나 정부의 탄소중립 달성 목표 시점은 2050년이다. 네이버와 카카오는 이보다 10년을 당겨 2040년까지 탄소중립을 달성하겠다고 밝혔다. 네이버 쪽은 “네이버의 엔터 서비스인 바이브와 나우(NOW)도 네이버의 이러한 로드맵에 의해 재생에너지 100% 전환을 진행할 예정”이라는 입장이다. 카카오엔터테인먼트(멜론 운영) 쪽은 “카카오 공동체 차원의 이에스지(ESG) 계획을 이행하는 것은 물론, 탄소 배출을 줄일 수 있는 클라우드 이전 등 다양한 방안들을 검토 중”이라고 밝혔다.드림어스컴퍼니(플로 운영) 쪽은 “지난 7월 아마존웹서비스(AWS)의 클라우드로 데이터센터를 전면 이전했다. 아마존웹서비스 클라우드는 에너지 소비 및 탄소 배출량을 80%까지 줄일 수 있다고 산출했으며, 2030년까지 운영 방식을 100% 재생 에너지로 조달하겠다고 했다”고 밝혔다. 플로는 아마존웹서비스의 재생에너지 전환 목표·계획에 맞춰 2030년에 재생에너지 100% 전환을 이룬다는 의미다.케이팝포플래닛 캠페이너들이 지난 6월18일 서울 잠실 올림픽주경기장에서 열린 ‘제28회 드림콘서트’ 현장에서 ‘멜론은 탄소맛’ 캠페인을 벌이는 모습. 케이팝포플래닛 제공엔에이치엔벅스는 명확한 재생에너지 전환 목표나 시점을 밝히지 않았다. 다만 엔에이치엔벅스 쪽은 “엔에이치엔의 데이터센터(NCC1)을 이용하고 있으며, 이 데이터센터는 친환경·고효율 데이터센터를 목표로 지속 가능한 기술 개발에 앞장서고 있다”며, “최근 엔에이치엔은 환경·에너지경영 시스템 국제 표준 규격인 아이에스오(ISO) 14001과 아이에스오 50001 인증을 동시에 획득했다”고 전했다. 또한 “재생에너지와 관련한 부분은 준비 중”이라고 덧붙였다.케이팝포플래닛 이다연 캠페이너는 이러한 기업들 답변에 대해 “대부분의 스트리밍 플랫폼들이 ‘계획을 세우고 있다’는 입장만 발표해 글로벌 기업들보다 소극적으로 대응하고 있다. 네이버, 카카오, 케이티 등은 자사 에너지 사용 계획은 구체적이지만 엔터 서비스인 스트리밍 플랫폼과 관련해서는 구체적인 내용이 없는 상황”이라며 “전세계적으로 심각해지고 있는 기후위기, 데이터센터 전력사용량 증가 속도 등에 견주면 재생에너지 도입은 너무나 더디다”고 말했다.이 캠페이너는 또한 “플로가 데이터센터를 이전해 2030년부터 재생에너지 100%를 달성한다는 건 케이팝 팬들과 같은 일반인 입장에서는 쉽게 알 수 없는 내용이다. 기후위기에 대해 진심으로 걱정하고 있는 사람들이 어떤 기업이 어떤 기후행동에 동참하고 있는지 알 수 있도록 관련 내용을 더 적극적으로 알려주시면 어떨까 하는 생각이 든다”고 덧붙였다.5시간 이상 음악을 듣는다면CD보다 스트리밍의 탄소배출이 더 많다는 연구 결과도 있다. 에너지트래커아시아 누리집 갈무리.기업의 의지와 노력도 중요하지만, 국가적 뒷받침이 필요하다는 의견도 있다. 임동아 네이버 이에스지 이사는 지난달 27일 열린 국회 세미나에서 “(재생에너지 100% 전환을 위해) 사옥 및 데이터센터(IDC)에 대한 재생에너지 확보를 지속적으로 이행 중이나, 국내 재생에너지의 생산 및 공급 환경이 너무 열악하여 안정적인 확보에 어려움이 있다”며 “재생에너지의 사용이 우리나라 전체에 확대되도록 국가적인 노력이 필요하다고 생각한다”고 말했다."
2024-08-19,"‘마왕, 내게로 와줘’…신해철 10주기 공연 열린다","10월26~27일 영종도 인스파이어 아레나신해철. 한겨레 자료사진‘마왕’ 신해철의 10주기를 기리는 추모 공연이 열린다.공연기획사 넥스트유나이티드와 드림어스컴퍼니는 “오는 10월26∼27일 인천 영종도 인스파이어 아레나에서 ‘마왕 10th: 고스트 스테이지’ 공연을 연다”고 19일 밝혔다.이번 공연은 2014년 위 축소 수술 등을 받은 뒤 불의의 의료 사고로 세상을 떠난 고 신해철의 10주기를 추모하기 위해 동료 선후배 음악가들이 모여 준비했다. 주최 쪽은 “신해철의 음악성과 철학을 다양한 장르의 음악과 퍼포먼스 무대로 재해석해 보여줄 예정”이라고 했다.1988년 엠비시(MBC) 대학가요제에서 그가 리더로 있던 그룹 무한궤도가 대상을 받으며 가요계에 데뷔한 신해철은 이후 솔로 활동을 거쳐 록 밴드 넥스트(N.EX.T)의 리더이자 프론트맨, 메인 보컬로서 1990년대와 2000년대 대중음악계를 풍미했다. 특히 시사 토론 프로그램의 패널로 나설 정도로 직설적이고 통찰력 있던 그의 언변은 지금도 쇼트폼으로 재생산되면서 많은 영향력을 끼치고 있다.‘마왕 10th: 고스트 스테이지’.넥스트유나이티드 제공공연 티켓은 오는 26~28일 예매 사이트 인터파크티켓을 통해 출연진이 알려지지 않은 상태의 블라인드 티켓으로 먼저 오픈한다. 출연진과 추가 티켓 오픈 일정은 추후 순차적으로 공지할 예정이다."
2023-01-03,K팝팬 5만명이 뽑은 ‘2022 최악의 스트리밍’ 1위 멜론…왜?,"케이팝포플래닛, ‘재생 에너지 전환 계획’ 평가 투표케이팝 팬 5만여명 참여 결과, 1위 멜론 2위 벅스“시장 점유율 높으니 기후행동에도 앞장서주길”다양한 음악 스트리밍 앱의 모습. 김효실 기자케이팝 팬들이 ‘2022 최악의 음악 스트리밍 기업’으로 멜론(카카오엔터테인먼트)을 뽑았다는 설문 조사 결과가 나왔다. 선정 기준은 각 기업이 기후위기 대응을 위한 재생 에너지 전환 계획을 얼마나 잘 짰는지를 본 것이다.3일 <한겨레> 취재를 종합하면, 케이팝 팬들이 모인 기후행동 플랫폼 ‘케이팝포플래닛’(KPOP4PLANET,지구를 위한 케이팝)은 지난해 12월 ‘워스트 스트리밍 어워드 2022’을 진행했다. 앞서 케이팝포플래닛은 지난해 여름부터 멜론, 지니뮤직, 플로, 바이브, 벅스 등 음악 스트리밍 플랫폼 기업들을 상대로 친환경 스트리밍을 요구하는 ‘멜론은 탄소맛’ 캠페인을 벌여왔다. 음악 스트리밍도 기후위기의 주요 원인인 탄소 배출과 연결되어 있다는 사실을 알리고, 기업들의 책임 있는 행동을 요구하기 위해서다.케이팝포플래닛은 캠페인에 동참하는 팬 1만여 명의 서명을 모아 각 기업에 전달했고, 각 기업은 지난해 11월 이에 대한 공식 답변을 내놨다.(▶관련 기사: [뉴스AS] 음악 스트리밍 서비스, 재생에너지 100% 언제쯤?) 답변에는 플로 2030년, 멜론·바이브 2040년, 지니는 2050년까지 재생에너지 100% 전환을 목표로 한다는 계획 등이 담겼다. ‘워스트 스트리밍 어워드 2022’는 케이팝포플래닛이 이러한 기업들의 답변을 케이팝 팬들과 ‘놀이’처럼 공유하려는 취지에서 후속 캠페인 성격으로 기획됐다. 이다연 케이팝포플래닛 캠페이너는 <한겨레>에 “(각 기업의) 공식 답변 내용을 어떻게 팬분들께 잘 전달드릴 수 있을까 고민하다가 연말이 다가와 시상식 형식을 계획하게 됐다”고 말했다.케이팝포플래닛 제공케이팝포플래닛 제공케이팝포플래닛은 사회관계망서비스(SNS) 계정을 통해 각 기업의 기후 행동 계획을 요약해서 전하면서, 이 가운데 ‘최악의 계획을 내놓은 곳에 투표해달라’고 요청했다. 투표가 진행된 지난해 12월10~17일, 한국 케이팝 팬 2만8181명과 해외 케이팝 팬 2만4701명 등 총 5만2822명의 이용자가 참여했다.투표 결과 케이팝 팬들은 멜론(카카오)을 1위(한국 47%, 해외 57.1%), 벅스(엔에이치엔벅스)를 2위(한국 38.3%, 해외 17.9%)로 꼽았다. 이어 3, 4위는 한국 팬들의 경우 케이티 계열인 지니뮤직(8.5%), 네이버 계열 바이브(6.2%), 해외 팬들은 바이브(13.7%), 지니뮤직(11.3%) 순으로 집계됐다. 드림어스컴퍼니가 운영하는 플로의 경우 2030년까지 재생에너지 100%를 사용한다고 응답해 투표 선택 항목에서 제외했다.‘최악의 계획을 내놓은 곳’ 1위로 꼽힌 멜론은 모회사인 카카오의 재생 에너지 전환 계획에 따라 2040년까지 탄소중립을 달성하겠다고 밝힌 바 있다. 2위를 한 엔에이치엔벅스는 명확한 재생 에너지 전환 목표나 시점을 밝히지 않았다. 이다연 캠페이너는 “각 기업의 재생 에너지 사용 계획을 확인해보면 벅스가 가장 분발해야 하지만, 멜론이 시장 점유율이 가장 높은데도 앞장서서 적극적인 계획을 내놓지 않고 있는 상황”이라며 “많은 케이팝 팬분들이 시장 점유율 1위의 멜론이 스트리밍 시장의 책임감을 갖고 좀 더 구체적인 재생 에너지 사용 계획을 내놓기를 바라는 뜻에서 멜론에 투표해주신 것 같다”고 풀이했다.케이팝포플래닛 제공케이팝포플래닛은 지난해 12월27일 투표 결과를 각 기업에 전자우편으로 전달했다. 3일 오후 기준으로 바이브를 운영하는 네이버와 벅스 쪽에서 “향후 더 노력하겠다”는 내용의 답변을 보내왔다. 이다연 캠페이너는 “(향후에도) 케이팝 팬들이 탄소 배출 없는 깨끗한 음악을 들을 수 있을 때까지 지속적으로 스트리밍 기업에 재생 에너지 사용을 요구할 예정”이라고 말했다.그는 또한 “2023년은 스트리밍 캠페인을 진행하면서, 지속가능한 콘서트를 위한 캠페인도 진행할 예정이다. 코로나 팬데믹 이후 케이팝 콘서트가 재개되고 있는데, 기후위기 시대에 대응해 탄소를 적게 배출하는 지속가능한 콘서트가 필요하다는 목소리가 케이팝 팬들 사이에서 높아지고 있다”며 “케이팝콘서트가 탄소배출을 줄이기 위해 노력한다면 케이팝의 위상도 높아지면서 전 세계 콘서트 문화의 많은 변화를 만들 수 있을 것”이라고 덧붙였다."
