date,title,content
2023-02-10,BTS·뉴진스와 NCT·에스파가 한 둥지로?… K팝 어벤져스 탄생하나,"하이브,SM인수땐 공동 기획 가능K팝 어벤져스가 탄생할 것인가.왼쪽 상단부터 시계 방향으로BTS,NCT127, 에스파, 뉴진스. /SM,하이브 제공하이브의SM인수가 성사된다면, 전 세계 K팝 기록을 새로 쓰고 있는 대형 간판 스타들이 한 둥지 안으로 모일 수 있게 된다. 그간 빌보드 메인 앨범 차트 ‘빌보드 200′ 정상에 올라선 K팝 가수는 2018년 방탄소년단(BTS·소속사 하이브), 2019년 수퍼엠(SM), 2022년 스트레이키즈(JYP)와 블랙핑크(YG), 2023년TXT(투모로우바이투게더·하이브) 순이다. 이 중BTS와 수퍼엠,TXT의 자체 음반 제작이 한 울타리 안에서 가능해지는 것이다. 상대적으로 역사가 짧은 하이브가SM이 90년대 말H.O.T.S.E.S.등 1세대 K팝 그룹 때부터 쌓아온IP(지식재산권)를 활용하고, 대신SM소속 가수의 해외 진출을 돕거나 글로벌 공동 오디션을 개최하는 청사진도 거론된다.SM과 하이브의 팬 플랫폼 ‘디어유 버블’과 ‘위버스’의 결합은 이들의 매출을 뒷받침하는 팬덤의 총 크기를 더욱 키울 전망이다. 위버스는 블랙핑크 등 78팀, 디어유 버블은 트와이스·스트레이키즈 등 아티스트 380팀이 입점해 있다. 자사뿐 아니라JYP와YG소속 대표 그룹들까지 대거 이 플랫폼을 이용 중으로 위버스는 월간 700만 명 이용자, 디어유버블은 누적 유료 구독자 120만 명을 보유 중이다.공연계에선 특히 이들 플랫폼의 결합으로 ‘대박 공연’ 수익 분기점으로 꼽히는 ‘5만명 이상 스타디움급 공연’이 가능한 간판스타가 얼마나 증가할지 주목한다. ‘5만명’은 하이브가 위버스를 중심으로 진행 중인 ‘더 시티 프로젝트’의 안정적인 수익 분기점으로도 알려졌다. 위버스를 이용하는 팬덤이BTS등 하이브 산하 뮤지션의 공연이 열린 도시로 모여들고,BTS굿즈와 테마호텔 등에 소비를 하는 방식으로 수익을 창출하는 프로젝트다. 국내에선 잠실종합운동장 주경기장이 스타디움급으로 꼽히는데, 하이브는BTS,SM은NCT127·엑소·H.O.T.를 이 무대에 세웠다.SM이 2013년부터 열어온 자사 뮤지션들의 합동 콘서트 ‘SM타운’도 지난해부터 일본 등에서 1일 기준 약 5만명에 달하는 관객을 모으고 있다.하이브의 ‘피독’,SM의 ‘유영진’과 ‘켄지’ 등 각 사의 대표 작곡가들이 방시혁-이수만 결정에 적극 응할지도 주요 관심사다. 활발한 곡 수급은 K팝의 ‘핵심 경쟁력’으로도 불리기 때문이다. 이날 작곡가 유영진은 “그(이수만)의 프로듀싱 없는SM은 진정한SM이 아니다”며 이수만의 결정에 전적으로 따르겠다는 입장을 밝혔다."
2023-02-10,SM 2대 주주 오르는 카카오 “양측 강점 살려 전방위 시너지 효과”,"글로벌 음원 시장·팬 플랫폼 시장 손잡고 공략한다카카오 산하 스타쉽엔터테인먼트의 아이돌 '아이브'./스타쉽엔터테인먼트최근SM엔터테인먼트의 지분 9.05%를 인수하며 2대 주주에 오르는 카카오가 10일 “양사의 강점을 결합해 향후 전방위적인 사업 시너지를 보여드리겠다”는 입장을 밝혔다. 이날 카카오는 음원·팬 플랫폼 등 기술 면에서의 협업 뿐 아니라 향후SM과 함께 글로벌 K팝 아티스트를 함께 기획하고 데뷔시키겠다는 계획까지 공개했다.IT업계에서는 “사업 계획이 이렇게 구체적이고 길게 공개된건 드문일”이라며 “SM지분 경쟁에 하이브라는 강력한 경쟁자가 나타나면서, 카카오가SM와의 오랜 인연을 토대로 시너지를 내겠다는 점을 강조하고 나선 것”이라는 평가가 나온다.카카오, “SM과는 오랜 인연…시너지 공고히 할 것”10일 배재현 카카오 투자총괄대표는 투자자를 대상으로 한 콘퍼런스콜(전화 회의)에서 나온 “SM과 카카오 서비스의 시너지 및 사업 협업은 어떻게 이뤄지는가”에 대한 질문에 이렇게 답변했다. “카카오와SM엔터테인먼트는 오랜 시간에 걸쳐 협력 논의를 해왔고, (지분 인수로) 각자의 강점인 플랫폼과IT기술,IP파워를 결합한 시너지를 공고히 하게 됐다”는 것이다.카카오엔터테인먼트 산하 스타쉽엔터테인먼트 소속 아이돌 몬스타엑스./유튜브그는 “보다 구체적으로는 먼저 글로벌 음원 유통사업에서 협력을 강화할 예정”이라고 했다. 카카오의 자회사인 카카오엔터테인먼트는 현재 국내 최대 음원 스트리밍 서비스인 ‘멜론’을 운영하고 있는데다, 아이유·몬스타엑스·더보이즈 등 유명 가수와 배우들을 망라하는 연예기획사를 소유하고 있기도 하다. 배 대표는 “양사가 보유한IP와 카카오의 음원 유통 경쟁력을 바탕으로 글로벌 음원 유통 시장에서 영향력을 확대하는 협력 방안을 논의 중”이라며 “글로벌 음원 수익이 양사 모두에게 극대화할 것으로 기대된다”고 했다.카카오,SM과 손잡고 차세대 K팝 아티스트 키운다SM과 공동으로 K팝 아티스트를 데뷔시키겠다는 계획도 공개했다. 배 대표는 “미국·일본 등 해외에 있는 인재 발굴 네트워크를 사용해 글로벌 매니지먼트 사업을 추진하고, 공동으로 신규 K팝 아티스트를 데뷔시키겠다”고 했다. 카카오는 여기다 아이돌 사업과 카카오의 웹툰·웹소설 및 캐릭터·굿즈 사업과도 시너지를 낼 수 있다는 입장이다. 실제로SM의 최대 경쟁사이자, 현재SM지분 쟁탈전에 뛰어든 하이브는 라인의 캐릭터 사업을 운영하는 라인프렌즈와 함께BTS캐릭터인 ‘BT21′을 출시해 인기를 끌었고, 네이버웹툰에서BTS멤버들을 주인공으로 한 웹툰을 연재한 바 있다.BTS와 라인프렌즈가 협업한 캐릭터BT21./라인프렌즈이렇게 탄생한 K팝 신인 아이돌은 처음부터SM의 자회사가 운영하는 거대한 팬 플랫폼 ‘디어유’에 입점해 글로벌 팬층과 소통할 수 있게될 전망이다. 디어유는 올들어 엔씨소프트가 운영하던 팬 플랫폼 ‘유니버스’를 흡수해 덩치를 키워가고 있는 앱으로, 아이돌과 대화를 나눌 수 있는 ‘버블’이라는 서비스를 제공하고 있다. 이는 네이버의 ‘브이라이브’를 인수하며 세를 키운 하이브의 팬 플랫폼 ‘위버스’의 대항마로 꼽히고 있다.디어유 버블 서비스 화면/디어유 제공SM의 2대 주주가 된 카카오는 향후 디어유에 기존 카카오 산하에 있던 유명 아이돌들을 입점시키겠다는 계획이다. 팬 플랫폼의 경쟁력은 사실상 유명한 연예인을 얼마나 품고 있는가에서 오는데, 양사가 손을 잡고 아티스트 라인업을 빠르게 확대하겠다는 것이다.배 대표는 이어 “IT역량 측면에서도 카카오가 보유한 기술력을 기반으로 적극 지원에 나설 것”이라고 했다. 또 “카카오가 만들고 있는 서울 아레나에서SM엔터테인먼트의 대형 아티스트 콘서트를 진행 할 수 있다”며 “향후 카카오의AI,메타버스, 블록체인 기술을 활용해 미래 사업을 공동으로 준비할 것”이라고 했다."
2023-02-18,하이브 공화국 vs 카카오 제국... “오만·분열로 망한 J팝처럼 될라”,"[아무튼, 주말]SM경영권 파동의 전말과공룡싸움이 부를 K팝 미래“콘서트요? 나도 누구보다 하고 싶은 사람이긴 한데. 아휴 몰라, 회사가 뒤숭숭해 가지고.”지난 13일 새 앨범 ‘킬러’ 발매를 기념해 라이브 방송을 하던 그룹 ‘샤이니’의 멤버 키는 “콘서트를 열어달라”는 팬들의 요청에 이같이 말했다.현재 대중음악계는 “뒤숭숭하다”는 표현이 가장 정확하다. 가수도, 팬도,SM엔터테인먼트도, 하이브도 마찬가지다. 방탄소년단(BTS)의 소속사 하이브가SM1대 주주인 이수만 전 총괄 프로듀서의 지분 대부분을 인수한다고 밝힌 다음 날,SM블라인드 앱에는 이 같은 글이 올라왔다. “선생님,SM의 역사를 함께한 임직원들의 피와 눈물, 허탈함을 4228억원과 맞바꾸시고 지금 행복하십니까?” ‘하이브+이수만’ 대 ‘카카오+현 경영진’으로 나뉜 직원 투표에서는 후자를 지지하는 쪽이 85%로 압도적이었다.여론이 심상치 않자 하이브 박지원 대표는 13일 전 직원들을 대상으로 설명회를 가졌다. “SM의 레거시(유산)를 존경한다. 독립성을 보장한다. 이수만 경영도 없다.”이제 봄이 오면 K팝 초석을 닦은 1세대 기업SM은 하이브 혹은 카카오의 품에 안긴다.SM이 파산해서가 아니라, 매출 7015억원대(2021년 기준) 기업이 경영권 다툼 과정에서 경쟁사로 넘어가는 것이다. 왜 이런 일이 발생한 걸까.네이버-카카오의 플랫폼 전쟁이 불씨시작은 네이버와 카카오의 플랫폼 대전이었다. 경쟁이 치열해진 양대 플랫폼 회사는 팬덤이 강한 연예인IP(지식재산권)가 필요했다. 네이버는 브이라이브를, 카카오는 멜론과 카카오엔터를 운영 중이었지만 역부족이었다.그 무렵 빅히트에서 하이브로 이름을 바꿔 2020년 10월 상장한 방시혁 의장이 등장했다. 그는 자체 팬커뮤니티인 ‘위버스’를 네이버 같은 플랫폼 회사로 키우고 싶었다. 여기서 서울대 86학번인 이해진 네이버GIO와 91학번인 방시혁 하이브 의장이 손을 잡는다. 네이버의 브이라이브를 위버스에 넘기고, 하이브의IP사업은 네이버와 함께하는 것이다. 현재 위버스의 2대 주주도 네이버다. 양현석의YG엔터테인먼트도 ‘하이브-네이버 연합’에 합류한다.급해진 건 카카오였다. 플랫폼은 규모의 산업이다. 가장 큰 곳이 모두를 먹는 승자독식(勝者獨食)이다. 이미 아이유가 있는 이담엔터테인먼트, 걸그룹 아이브를 배출한 스타쉽 등이 있었지만 팬덤 화력에서는 역부족이었다. 카카오는 2021년 유희열이 있는 안테나, 2022년 박재범의 모어비전 등의 인수와 투자를 진행하며 세를 늘린다. 2022년 3월에는 창업자인 김범수 의장이 물러나고 투니버스·CJENM등에서 30년 넘게 콘텐츠 사업을 한 김성수 대표를 신임 이사회 의장으로 앉힌다. 누가 봐도 콘텐츠 사업에 무게 중심을 두겠다는 의지였다. 그러나 2023년 카카오 엔터테인먼트의 상장을 위해선 마지막 한 개의 퍼즐이 필요했다.행동주의 흙수저 이창환의 등판SM은 단순한 연예기획사가 아니다. 엑소 등의 아이돌그룹뿐 아니라 계열사 키이스트와SMC&C를 통해 유해진, 강호동 같은 스타들을 보유한 데다 ‘효리네 민박’ ‘장사의 신’ 등 예능과 드라마도 제작하는 거대 콘텐츠 회사다. 2020년 2월엔 ‘디어유’라는 팬 플랫폼을 열고 상장까지 완료했다. ‘디어유’는JYP엔터테인먼트도 지분을 23.3% 갖고 있다.플랫폼 간의 대전 속에SM창업자이자 대주주인 이수만 총괄프로듀서가 자신의 지분 18.53%를 아들들에게 물려주지 않고 팔겠다며 시장에 내놓는다. 이 지분을 갖기 위해 하이브,CJ,카카오가 뛰어들었다. 당시만 해도 이 총괄은 “하이브에는 팔 생각이 없다”고 말했다. 첫 매각 진행은CJ와 6300억원에서 진행됐지만 김범수의 카카오가 7900억원을 부르며 분위기는 바뀌었다. 그러나 2022년 7월 카카오 이사진의 반대로 협상가는 6000억원으로 쪼그라들고, 지분 협상은 진전 없이 흘러갔다.이때 이창환 얼라인파트너스 대표가 등판한다. 이 대표는 홀어머니와 생활보호대상자로 살면서도 18세 때KBS‘퀴즈! 대한민국’에서 최연소 영웅으로 등극해 화제를 모았다가 서울대 경영학과에 입학한 인물이다. 이후 미국 3대 사모펀드 중 하나인KKR을 거쳐 행동주의 펀드 ‘얼라인파트너스’를 창업했다. 그리고 2021년 9월 처음SM지분을 사들인다.이 대표가SM지분을 사들이기 시작한 건 K팝의 확장 가능성과, 상대적으로 저평가된SM주가 때문이었다. 현재 4대 연예기획사를 매출순으로 나열하면 하이브>SM>YG>JYP이지만, 영업이익과 주가순으로 하면 하이브>JYP>SM>YG순이다. 이 대표는SM의 저평가 이유가 ‘오너 리스크’,즉 이수만 때문이라고 봤다. 그래서 정보 공개를 통해 이수만의 개인 회사 ‘라이크 기획’이SM매출의 6%를 떼어가고, 2092년까지 음원 수익의 로열티 6%를 이수만 개인이 수령한다는 사실들을 밝혀낸다. 매출의 6%는 영업이익의 40%에 달하는 금액. 이 과정에서SM직원들의 배신감이 컸다고 한다. 여기에 걸그룹 ‘갓 더 비트’의 실적 저조, 에스파의 ‘걸스’ 앨범 실패 등으로 이수만·유영진 등 기존SM사단의 프로듀싱 능력에 대한 우려의 목소리도 커졌다.그러자 이성수·탁영준 등SM현 경영진은 이수만이 없는SM3.0을 준비한다. 카카오 측은 현 경영진으로 협상 상대를 바꿨고,SM의 경영권과 독립성을 지켜주는 조건으로 신주 및 전환 사채 발행을 통해 2대 주주로 들어오게 된다.치료차 미국에 있었던 이수만은 자신이 배제되는 상황을 전혀 몰랐다. 급히 귀국한 이수만은 최대 주주의 동의 없이 결정된 신주 발행 및 전환사채 발행은 금지라며 가처분 신청에 들어간다. 그러나 가처분 신청 결과는 신주·전환사채 발행일인 다음 달이 돼야 나온다. 3월에는 이창환 얼라인 대표가 새 기타비상무이사로 영입되는 주주총회도 열린다. 이미 흐르기 시작한 강물은 막을 수 없는 법. 여기서 이수만은 아예 물줄기를 틀어버리기로 결심한다. 라이벌 방시혁에게 자신의 지분 중 3%만 남기고 14.8%를 4228억원에 넘긴 것이다.하이브 공화국? K팝 다양성 잃을까 우려현재 하이브는SM총지분의 39.8% 확보를 목표로 주당 12만원에 공개 매수에 나섰다. 카카오는 가처분 신청 관련 법원의 판결을 기다려야 하지만 영향권 행사를 위해선 추가 매수에 들어가야 한다. 이제부터는 하이브와 카카오의 지분 확보 싸움이다.두 공룡의 전쟁은 K팝의 지각 변동을 예고한다. 그동안 이수만 지분을 두고CJ와 카카오가 난항을 겪은 건 프로듀서권과 경영 보장 문제 때문이었다. 그래서 이 총괄이 방 의장에게 지분을 예상보다 싼 가격에 판 것을 두고 ‘두 가지는 보장받은 것’이란 설이 지배적이었다. 그러나 박지원 하이브 대표는 “이수만의 경영 참여나, 프로듀싱 참여는 없다. 로열티도 더는 가져가지 않는다”고 못 박았다. 그는 “SM의 독립성을 보장하겠다. 하이브는 이미 멀티 레이블 체제를 증명해냈다”고도 했다.현재 하이브는 2019년 ‘쏘스뮤직’ 인수를 시작으로 2020년 ‘플레디스’,2021년 저스틴 비버가 있는 ‘이타카’,최근엔 힙합 가수 릴 베이비가 있는 ‘QC’등을 인수해 멀티 레이블로 운영 중이다. 만약 하이브가SM인수에 성공한다면 K팝 시장은 2022년 기준으로 음반 판매 상위 15개 가수 중 9개가 하이브 계열이 된다. 특히, 팬덤이 강해IP사업이 쉬운 보이그룹 중에서는 역대 상위 20개 앨범 중 19개가 하이브 계열이다. 그야말로 ‘하이브 공화국’이다.SM과 하이브가 합쳐질 때의 장점은 세계 무대에서 경쟁할 수 있는 거대 레이블의 탄생이다.CNN은 “글로벌 빅3 주요 레코드 레이블인 소니, 유니버설, 워너뮤직과 어깨를 나란히 할 수 있다”고 전망했다. 반대로 ‘한국판 자니스 사무소’가 될 수도 있다. J팝이 잘나가던 시절, 기타가와 히로무가 1962년 세운 ‘자니스 사무소’는 보이그룹 ‘스맵’ ‘킨키 키즈’ ‘V6′ 등을 모두 가지고 1990년대 방송계와 연예계를 휘두르던 권력이었다. 거대해진 권력은 2010년대 들어 내부 파벌 싸움이 발생하고, 유튜브 등 뉴미디어를 따라잡지 못한 상황에서, K팝이 세력을 넓히자 힘을 잃기 시작했다. 익명을 요구한 음악계 관계자는 “거대해진 하이브에 누가 목소리를 낼 수 있겠느냐”며 “음악이 문화임을 잊은 채, 돈으로만 보는 현재 시각들이 안타깝다. 가장 중요한 건 아티스트와 팬. 다양한 기획사들이 경쟁하며 파이를 키우던 K팝이 힘을 잃을까 봐 걱정”이라고 했다."
2024-09-03,"189국에 생중계 AI가 자막, 나만의 VR 콘서트도","K팝에IT더한 ‘엔터테크’ 급성장빅크 아이돌라디오 시즌4 스트리밍 화면. /빅크엔터테크(엔터테인먼트와 테크의 합성어) 스타트업 ‘빅크’는 최근 자사 플랫폼을 통해TV에서 생중계하지 않는 한 방송국 주최 ‘가요대전’을 생중계했다. 이 가요대전을 189국 570만명의 팬들이 시청했다. 빅크는 글로벌 팬들을 위해 과거 전문 속기사들이 맡았던 실시간 영상 자막 번역에 인공지능(AI)을 도입해 영어·태국어·인도네시아어 등 8국 언어로 서비스했다. 자체 개발한 라이브 기술을 통해 인터넷 인프라가 나쁜 지역에서도 끊김 없이 생중계가 가능하게 했다. 장영방 빅크 이사는 “K팝 팬 70%가 인터넷 취약 국가에 거주하는 만큼 K팝의 글로벌 확장을 위한 라이브 스트리밍 기술이 더욱 중요해지고 있다”고 했다.엔터테인먼트에 인공지능(AI), 메타버스, 모션캡처 등IT가 결합된 ‘엔터테크’ 산업이 빠르게 성장하고 있다. 팬덤 문화가 강한 K팝이 글로벌로 나아가면서,AI번역과 가상현실(VR) 등 해외 팬들을 위한 기술이 필요해지고 있기 때문이다.VR콘서트를 제작해 유통하는 ‘어메이즈VR’은 첨단 촬영 기법에AI기술을 더해 가수들이 미래 도시나 외계 행성을 배경으로 콘서트를 연 것 같은 몰입감을 제공한다. 관객들은 영화관에서VR헤드셋을 착용하고 고화질 영상과 서라운드 음향 시스템을 통해 콘서트장 1열보다 가까운 거리에서 이를 관람한다. 지금까지 에스파, 카이, 투머로우바이투게더 등 인기 가수들의 공연이VR콘텐츠로 제작됐다.IT를 활용해 아티스트와 팬들이 직접 소통하는 방식도 다양해지고 있다.SM엔터테인먼트 계열사 디어유가 운영하는 ‘버블’은 아티스트와 1대1 대화를 나누는 서비스를 제공한다. 버블은 아티스트가 작성한 메시지에 사용자의 이름, 애칭, 기념일 등을 자동으로 반영해 개인 맞춤형 메시지를 전달한다.AI를 활용해 ‘가상의 아이돌’을 만드는 산업도 더 활발해지고 있다. 넷마블은AI와 컴퓨터 그래픽을 활용해 만들어진 가상 아이돌 그룹 ‘메이브’를 데뷔시켰다. 이들의 움직임을 더 자연스럽게 하기 위해 모션캡처 기술도 활용된다. 이렇게 탄생한 가상 아이돌 ‘플레이브’는 데뷔 1년 만에 지상파 음악 방송 1위에 오르기도 했다."
2023-03-13,"카카오는 SM과, 네이버는 하이브 손잡고 K팝 재편","엔터업계 경쟁력 낮았던 카카오, 단숨에 핵심 기획사로 급부상카카오와 하이브가 12일SM지분 확보 경쟁을 끝내기로 전격 합의하면서, 가요계에선 ‘K팝 과점 체제’가 재편될 것이라는 전망이 나온다.IT공룡인 네이버와 카카오가 하이브와SM의 손을 견고하게 잡고 K팝 시장을 주도할 것이라는 전망이 나온다. 특히 K팝 시장에서 활약도가 가장 낮았던 카카오엔터의 역할이 대폭 커졌다는 분석이다. 하이브와SM,카카오가 각각 추구해오던 이른바 ‘팬 플랫폼’ 활성화 계획도 ‘윈윈 전략’으로 선회했다.12일 가요계 관계자들에 따르면 하이브는 카카오에SM경영권을 넘기는 대신SM가수들의 ‘하이브 팬플랫폼 위버스 입점’과 연예인 일상 및 공연 중개 플랫폼인 ‘네이버 브이라이브 활용’ 방안을 중점 협의했다. 위버스는 하이브가 네이버(위버스 지분 49% 보유)와 함께 추진하고 있는 핵심 사업이다. 월간 이용자 약 840만명인 위버스 플랫폼을 통하면 연예인들의 스케줄과 팬 메시지를 독점 유통할 수 있고, 굿즈(캐릭터 제품) 판매와 공연 실황 온라인 중계를 통해 팬 가입자를 끌어모을 수 있다. 향후SM소속 가수들이 위버스에 합류하면 플랫폼이 크게 활성화될 것으로 기대된다.SM도 협업으로 얻는 이득이 더 많다.SM은JYP가 18.9% 지분을 갖고 있는 팬-연예인 간 채팅 서비스 ‘디어유 버블(유료 구독자 120만명)’,뮤지션 공연 실황 중계 플랫폼 ‘비욘드 라이브’를 운영 중이지만 전체 가입자 숫자는 위버스에 비해 현저히 떨어진다. 특히 비욘드 라이브는 운영 초창기 이용자 1억명 수준의 네이버 ‘브이라이브’를 이용해 팬층을 다졌지만, 지난해 브이라이브가 하이브에 인수되면서 관계가 단절됐다. 이번 협의로 돌파구를 찾을 수 있게 됐다.카카오엔터는 ‘K팝 콘텐츠가 빈약한 K팝 기획사’란 오명을 벗고 단숨에 가요계 핵심 기획사로 부상하게 됐다. 업계에선 이번 협의로 다시 살아난SM-카카오엔터의 사업협력계획서에 눈길이 쏠리고 있다. 카카오의 음원 스트리밍 서비스 ‘멜론’을 통한SM가수들의 음원·음반 및 공연 티켓 유통,SM-카카오엔터의 북미 합작법인 설립 등 다양한 합작 사업 계획이 담겨 있다. 카카오엔터는 웹툰 등 자사의IP플랫폼을 활용해SM뿐 아니라 하이브와도 협력할 길이 열렸다. 대중음악평론가 김도헌씨는 “아이브(스타쉽엔터), 아이유(이담엔터) 등 인기 소속 가수가 없었던 건 아니지만 카카오엔터는 그동안 ‘K팝 경쟁력’은 가장 낮은 것으로 평가받아 왔다”면서 “이번 협의로 하이브와 맞먹는 수준으로 올라설 발판이 마련됐다”고 말했다."
