date,title,content
2022-04-27,데뷔곡 음원 1위…대형회사 아닌데 대박난 신인 걸그룹 정체,"지난해 말 데뷔한 6인조 가상 걸그룹 '이세계 아이돌'(이세돌)은 음원 사이트 1위, 뮤직비디오 조회 수 580만회의 기록을 세웠다. [사진 유튜브 캡처]데뷔곡 발표와 동시에 음원 사이트 1위, 뮤직비디오 조회 수 580만 회를 달성한 신인 아이돌이 있다. 바로 한국 첫 버추얼(virtual·가상의) 걸그룹 ‘이세계 아이돌’(이세돌)이다.1990년대 사이버 가수 아담과 류시아가 화제만 되고 바로 사라진 것과 다르게 이들은 실제 팬 동원력이 상당하다. 메타버스(Metaverse) 투자 붐을 타고 이세돌 같은 버추얼 가수가 잇달아 등장해 가요계에 도전장을 내고 있다. 하이브·SM·JYP·YG등 4대 기획사가 메타버스에 경쟁적으로 투자하면서 미래 아이돌이 뛸 발판을 키우는 이유다.━이세돌 데뷔곡, 벅스·가온 차트 1위에스파(aespa) 멤버와 그들의 가상현실 아바타 '아이'.[사진SM]이세돌은 유명 게임 유튜버인 ‘우왁굳’이 직접 기획한 프로젝트를 통해 만들어진 6인조 걸그룹이다. 지난해 8월 결성해 같은 해 12월 디지털 싱글 ‘리와인드’(RE:WIND)로 데뷔했다. 웬만한 ‘사람 신인 아이돌’은 진입조차 힘든 멜론 차트에서 36위, 벅스 1위, 가온 차트 다운로드 부문 1위 등의 기록을 세웠다. 뮤직비디오 영상 조회 수는 580만회를 넘어섰다.이세돌 멤버들은 가상 인물은 아니다. 대중에 공개하는 모습만 메타버스 속 캐릭터일 뿐, 목소리와 성격은 실재 인물의 정체성 그대로다. 즉, 가상 비주얼 뒤엔 주인공(본캐)이 있다. ‘얼굴 없는’ 가수 또는 요즘 예능에서 유행하는 ‘부캐(부캐릭터)’에 가깝다. 특이한 점은 작곡, 편곡 등 전문성이 필요한 분야에는 해당 분야를 잘 아는 팬이 제작에 참여한다는 것이다. 마치 게임 ‘프린세스 메이커’처럼 사용자가 아이돌을 자발적으로 키우는 방식이기 때문에 ‘팬심’과 소유욕이 남다르다.━하이브·네이버 손잡고 ‘위버스 2.0’ 출범엔터4사의 메타버스·NFT주요사업 현황. 그래픽=김영옥 기자yesok@joongang.co.kr기업도 아닌 개인의 메타버스 K팝 아이돌 성공은 이 시장의 잠재력을 보여준다. 성장 가능성에 힘입어 엔터업계에서도 일찌감치 메타버스와 대체불가토큰(NFT)을 미래 먹거리로 점찍었다.하이브는 지난달 주주서한에서 “올해 위버스 플랫폼 고도화와 게임·스토리·NFT사업에서의 팬 경험 확대 또한 실체로 증명해 보이겠다”는 청사진을 밝혔다. 올해 안으로 네이버 ‘V라이브’와 통합한 팬 플랫폼 ‘위버스 2.0’을 선보인다는 계획이다. 위버스는 팬들과 스타가 직간접적으로 소통할 수 있는 플랫폼이다. 팬플랫폼은 메타버스의 일종으로 하이브는 이를 온라인 상점(위버스숍)과 연동해 매출을 올리고 있다.SM과JYP는 지난해 상장한 자회사 디어유의 ‘버블’을 통해 아티스트 메시징 서비스 고도화에 힘쓰고 있다. 디어유는 마치 내가 좋아하는 스타와 1:1로 메시지를 나누는 느낌을 받을 수 있는 플랫폼이다.JYP,하이브,YG3사 모두 최근 네이버Z의 메타버스 플랫폼  ‘제페토’에도 투자했다.━위버스 매출 3년 만에 20배 성장BTS가 팬과 소통하는 팬 플랫폼 '위버스'.[사진 위버스 캡처]지난 2월 공개된 하이브의 지난해 실적을 살펴보면 지식재산권(IP), 라이선싱과 플랫폼 사업 등 아티스트의 간접참여형 매출이 전체의 58.3%를 차지했다. 이는 음원, 공연, 광고 같은 직접참여형매출(41.7%)을 앞지른 성적이다. 아티스트가 현실 세계에서 노래하고 춤추며 올리는 소득보다 그를 모델로 한 캐릭터나 아바타가 가상의 공간에서 버는 금액이 더 클 수 있다는 의미다.계열사별 매출을 보면 하이브 본사는 2021년 5414억원의 매출을 올렸다. 같은 기간 메타버스 중심 계열사인 위버스컴퍼니의 매출은 2587억원이었다. 위버스가 하이브의 절반 수준으로 자란 것이다. 속도는 더 놀랍다. 위버스 매출은 2018년에는 144억원에 불과했는데 3년 만에 20배 가까이 불어났다.SM과JYP의 메타버스 플랫폼 디어유(버블)은 지난해 매출 400억 원, 영업이익은 132억 원으로 흑자 전환했다. 위버스보다 규모는 작지만, 전년 대비 매출이 206% 오르며 빠르게 성장하고 있다.미래에셋증권에 따르면, 글로벌 메타버스 플랫폼 시장은 2024년까지 연 10%씩 성장해 약 3000억달러(약 376조원) 규모에 이를 전망이다. 같은 기간 음원 시장 성장률(4%)을 두배 넘게 웃도는 속도다. 오프라인과 메타버스 플랫폼을 결 합한 하이브리드 형태의 콘서트는 공연 시장의 마진율을 48%에서 63%로 끌어올릴 전망이다.송범용 미래에셋증권 연구원은 “엔터사가 메타버스 플랫폼 내 유의미한 매출을 창출하기 위해서는 보유 아티스트 라인업과 모객력이 중요하다”며 “앞으로 메타버스와 결합한 콘서트와 가상 굿즈 판매 등을 통해 신성장 동력을 얻을 것”이라고 말했다."
2022-09-10,"커피 한잔값 썼더니…한밤12시 ""자니?"" 덕질하던 그 스타였다","배우 이동욱이 지난 5일 자정 보낸 유니버스 프라이빗 메시지 화면. 사진 인터넷 캡처“오늘도 고마웠고 덕분에 행복했어.”‘배구 여제’ 김연경 선수의 ‘찐팬’인 김현혜(37)씨는 지난달 전남 순천에서 열린 여자프로배구대회 흥국생명 경기를 관람한 뒤 그에게 이런 메시지를 받았다. 김씨가 지난 2월부터 월 4500원을 내고 이용 중인 ‘스포츠 버블’ 어플리케이션을 통해서다. 그는 이용료에 대해 “월 4500원, 커피 한잔 값이라 큰 부담은 없다”며 “더 자주 소통할 수 있다면 월 45000원이어도 아깝지 않을 것 같다”고 했다.지난 1월 서비스를 시작한 ‘버블 포 스포츠’는 스포츠 스타가 팬들을 위해 직접 작성하는 프라이빗한 메시지를 1대1 채팅 형태로 팬들에게 전송해주는 ‘팬덤 플랫폼’이다. 팬 역시 스타에게 답장을 보낼 수 있는데 스타에게는 단체 채팅방 형태로 팬들의 메시지가 노출된다. 버블은 배우나 유튜브 크리에이터 등 다른 아티스트들이 참여하는 플랫폼도 운영하고 있다.배구 여제 김연경 선수, 배우 이동욱. 사진 상하이SNS,웰메이드직장인 이모(35)씨는 요즘 ‘이동욱 프메’의 늪에 빠져 있다. 배우 이동욱은 지난달부터 유니버스 어플리케이션의 프라이빗 메시지 기능을 통해 팬들과 활발히 소통하기 시작했다. 이씨는 “사실 원래 이동욱 팬은 아니었는데 요즘 새로운 매력을 발견하고 빠져들었다”며 “월 구독료 7900원이 적은 돈은 아니지만 어느새 그와 프메로 소통하는게 삶의 낙이 됐다”고 말했다.디어유의 ‘버블’,엔씨소프트의 ‘유니버스’ 등 새로운 팬 플랫폼이MZ세대의 팬심을 자극하며 성장하고 있다. 올해 2분기 디어유는 매출액 116억원, 영업이익 35억원을 기록해 각각 지난해 같은 기간보다 22.5%, 0.8% 증가했다. 현재 버블 구독자 수는 150만명이며 이용자의 80%이상은 10~20대다. 유니버스도 지난 2월 기준 한국, 미국, 일본, 인도네시아 등 전세계 233개국에 서비스하며 출시 1년 만에 글로벌 2100만 다운로드를 기록했다.━""이 맛에 '덕질'"" ""설렌다""...지갑 여는MZ사진 유니버스 어플리케이션 화면 캡처MZ세대가 이같은 유료 소통 창구에 지갑을 여는 이유는 뭘까. 우선 1대1 메시지처럼 노출되는 형식이다보니 이용자들은 스타가 먼저 말을 걸어주는 느낌을 받을 수 있다. 이동욱은 지난 5일 자정 “자? 아직 안자네” “촬영 끝나고 집에 가는 길인데 잘자라고 인사하려고” 라는 메시지를 남겼다. 이를 본 네티즌들은 “전남친에게 연락온 줄 알았다” “이렇게 설레게 해도 되나” 등의 반응을 보였다.김연경 선수의 버블을 구독 중인 김씨는 “김연경 선수의 한국 무대 공식 복귀전을 보러갔는데 덕분에 행복했다고 말해주니 ‘아 이래서 덕질을 하는구나’ 싶었다”며 “미국으로 전지훈련을 갔을 때도 팬들이 궁금해할까봐 근황 사진을 올려주는 등 바쁜 와중에도 소통하려는 모습이 감동을 준다”고 말했다.공식 미디어나SNS를 통해 불특정다수에게 제공되던 메시지와 달리 연예인 본인의 생각이나 진솔함이 잘 드러나서 새로운 면모를 발견하게 되는 효과가 있다는 분석도 나온다. 40대인 이동욱은 10대 팬들에게 “오빠말고 삼촌이나 아저씨로 불러라” “숙제 도와줄게” 등 소탈한 모습을 보이는가 하면 “나의 성공은 너의 사랑이 없었으면 소용없다” “이 공간만큼은 다들 행복하고 즐거웠으면 좋겠다” 등 감동과 위로의 메시지를 전해 호응을 얻기도 했다.━소통 빈도에 따라 이용자 만족도 천차만별가수 강다니엘이 지난 7월 19일 오후 인천 중구 파라다이스시티에서 열린 ‘제1회 청룡시리즈어워즈(BluedragonSeriesAwards)’에서 포즈를 취하고 있다. 뉴스1다만 아티스트의 소통 빈도에 따른 만족도 격차, 접속 장애와 같은 시스템 불안정 등은 한계로 꼽힌다. 최근엔 정제되지 않은 대화가 외부에 노출돼 논란이 되는 해프닝이 벌어지기도 했다. 가수 강다니엘은 지난 7월 유니버스 프라이빗 메시지를 통해 케이블채널 엠넷 ‘스트릿 맨 파이터’MC합류 소감을 말하던 중 “솔직히 말하면 남자들이라 너무 편하다. 행복해 기 안 빨려서”라고 말했다. 앞서 진행한 ‘스트릿 우먼 파이터’의 여성 출연자들이 부담스러웠다는 취지여서 성별 갈등을 조장한다는 논란이 제기되자 강다니엘은 “본의를 지나치게 과장되게 표현해 불필요한 오해를 불러일으켜 송구스럽다”고 사과했다.팬덤 플랫폼들이 이용약관을 통해 ‘유료 콘텐트 외부 유출’을 금지하고 있지만 원천봉쇄하기는 어려운 실정이다. 이용자들은 트위터나 인스타그램 등 개인SNS에 #프메 #버블 등 해시태그를 달고 스타와의 대화 내용을 인증하거나 감상을 남기면서 또다른 팬덤문화를 형성하고 있다.입소문을 타서 이용자가 확대되는 측면도 있다보니 팬덤 플랫폼이 소극적으로 대응하는 것 아니냐는 해석도 나온다.━커피 한두잔 값이라지만...덕질도 돈 있어야 하는 시대월 1만원 수준이라곤 하지만 유료 서비스가 부담스러운 팬들에게는 소외감을 줄 수 있다는 지적도 있다. 팬덤 플랫폼 안에서는 프라이빗 메시지 서비스 외에도 유료 이용자들만 볼 수 있는 독점 콘텐트 제공, ‘굿즈’와 앨범 판매 등이 이뤄지고 있다. 과거의 ‘덕질’은 좋아하는 아티스트의 사진으로 필통을 만든다거나 방 안에 브로마이드를 붙이는 수준이었지만 이제는 팬덤 플랫폼을 통해 돈을 써야만 진정한 덕질이 가능하다는 말까지 나오는 추세다.정덕현 대중문화평론가는 “팬덤 마케팅은 이미 다양한 분야에서 이뤄지고 있는데 이러한 커뮤니케이션 플랫폼도 그 중 하나로 일상에 침투하고 있다”며 “팬덤 소비의 영역에서 적정선을 넘는 수준의 비용을 치르게 한다거나 서비스 수준이 기대치에 미치지 못하면 불만이 나올 수밖에 없을 것”이라고 말했다."
2024-05-29,"김호중 논란 와중에…이특 ""음주운전 강인 15년 자숙, 용서 좀""","'슈퍼주니어' 멤버 강인. 연합뉴스그룹 슈퍼주니어 이특이 “용서를 부탁드린다”며 과거 음주 운전 및 폭행 사건 논란으로 자숙 중인 전 멤버 강인을 두둔했다. 가수 김호중이 음주 운전 뺑소니 혐의로 구속된 상황에 나온 발언이라 논란이 일고 있다.이특의 발언은 지난 26일 서울 모처에서 열린 려욱과 아리의 결혼식에서 나왔다.온라인상에는 이날 결혼식 현장을 담은 여러 개의 영상 및 사진이 올라왔다. 공개된 사진 속에는 희철, 이특, 시원, 은혁, 신동 등 슈퍼주니어의 현 멤버들뿐 아니라 이전 멤버인 강인과 기범, 한경 등도 참석해 이목을 모았다.특히 이날 사회를 맡은 이특은 “여러분들은 지금 활동보다 자숙을 더욱 길게 한 강인의 모습을 만나보고 계신다”고 강인을 언급했다 이어 “강인이에게 용서를 부탁드린다. 활동기간 5년에 자숙 기간 15년을 겪고 있는 강인의 모습이었다”고 말했다.또 이특은 “행복하고 좋은 날이니까 안아주시고 사랑주시고 강인이도 먹고 살 수 있게 많이들 도와주셨으면 좋겠다”고 했다. 하객들은 이특의 발언에 대해 박수로 화답했다.하지만 네티즌들은 반응은 차가왔다. “그 좋은 날을 빌어서 왜 범죄자를 두둔하는거냐”, “결혼식장이 해명식장이냐”, “범죄가 한두 건이냐고”, “자숙할만 하니까 한 거 아닌가?” 등의 부정적 여론이 우세했다.슈퍼주니어 려욱 결혼식 사진. 온라인커뮤니티앞서 강인은 2009년 음주 후 행인과 폭행 시비로 도마에 올랐다. 같은 해 10월에는 음주운전 뺑소니 사고를 일으켜 벌금 800만원의 약식명령을 선고받아 활동을 중단했다.군 복무 이후 슈퍼주니어 정규 6집으로 복귀한 강인은 지난 2016년 5월 서울 강남구 신사동에서 음주운전을 하다 가로등을 들이받는 사고를 내 벌금 700만원을 선고받았다.이외에도 강인은 예비군 훈련 무단 불참, 여자친구 폭행 논란 등에 휩싸여 결국 2019년 팀에서 탈퇴했다.강인. 디어유 캡처SM엔터테인먼트 자회사인IT개발사 디어유에 따르면 강인은 28일 팬과 아티스트가 1대1 형태로 프라이빗 메시지를 주고받을 수 있는 유료 소통 플랫폼인 ‘버블’을 시작한다.이에 일각에서는 강인이 연예계로 복귀하려고 하는 것이 아니냐는 추측이 나오고 있다."
2024-04-09,"""쥐새X처럼 숨지마"" 일침 날렸다…사생팬 카톡 박제한 아이돌","그룹NCT의 중국인 멤버인 런쥔(사진 왼쪽)이 사생팬으로부터 받은 카카오톡 메시지를 유료 팬 소통 애플리케이션인 '버블'을 통해 공개하고 일침을 가했다. 사진 뉴스1, 온라인 커뮤니티 캡처그룹NCT의 중국인 멤버인 런쥔이 자신의 개인적인 연락처로 접근한 사생팬의 메시지를 유료 팬 소통 애플리케이션에 공개하고 ""자기 인생이나 살아라""라면서 일침을 가했다.런쥔은 지난 7일 유료 팬 소통 앱인 '디어유 버블(버블)'을 통해 사생팬으로부터 받은 카카오톡(카톡) 메시지를 공개했다.메시지에 따르면 사생팬은 런쥔에게 카톡 메시지를 보내 ""아이돌들 살기 너무 편해졌다. 돈은 돈대로 벌고, 외모는 외모대로 가지고, 연애는 또 연애대로 하고 라이브는 X같고 늘 생각도 없으며 그 전 세대 마냥 독기도 없다. 그냥 느긋함. 다시 (휴대)폰 없애라, 그냥""이라며 비판적인 말을 쏟아냈다.이에 런쥔은 자신의 법률대리인의 연락처를 알려주는 듯 하면서 ""쥐새X처럼 숨어서 타이핑이나 하지 말고 할 말 있으면 얼굴 보면서 변호사랑 같이 얘기하자""며 ""이 분에게 연락해서 하고 싶은 말 하세요""라고 답장했다.그룹NCT의 중국인 멤버인 런쥔이 사생팬으로부터 받은 카카오톡 메시지를 유료 팬 소통 애플리케이션인 '버블'을 통해 공개하고 일침을 가했다. 사진 온라인 커뮤니티 캡처런쥔은 같은 날 이 카톡 대화 내용을 캡처해 버블에 공유했다. 그러면서 장문의 메시지를 통해 ""아이돌도 사람이다. 자기 인생이나 잘 살자""라면서 사생팬을 저격하는 듯한 발언을 했다.런쥔은 버블에서 ""아이돌도 사람이야, 힘듦을 느껴. 이 많도(말도) 안 돼는(되는) 스케줄 속에서 살아보기나 하고 판단하는 거니? 보여지는 건 당연히 얘쁘고(예쁘고) 아름다워야지. 그래야 다 같이 에너지를 얻으니까""라고 했다.이어 ""그리고 꿈을 열심히 쫓차가다가보면(쫓아가다 보면) 언젠가 돈은 따라오게 되어 있어. 세상에 돈 안 버는 직업도 있나?""라며 ""자기 인생 제대로 살아갑시다. 상관 없는 사람 건들지 말고 시간 랑비(낭비) 하지 말고, 그 시간 있으면 마음 갈아앉이고(가라앉히고) 차분해지는 법부터 배우세요. 상관 없는 사람에게 화풀이 하지 말고""라고도 했다.네티즌들은 ""사생팬의 저 카톡 메시지는 극히 일부분일 것이다. 강하게 경고한 것 잘했다"", ""얼마나 시달렸으면 저렇게 얘기했겠나. 사생팬들은 사라져야 한다""라며 런쥔을 응원했다. 다만 일부 팬들은 ""왜 상관 없는 다수의 팬이 런쥔의 훈계를 들어야 하나""라며 비판적인 반응을 보이기도 했다.이에 런쥔은 ""죄송하다. 여기서는 시즈니(NCT의 팬덤 명)와 좋은 얘기만 해야 하는데 생각이 짧았다""라고 사과했다.강원래, 김송 부부가 채널A '금쪽 상담소' 출연 이후 받은 악성 메시지를 공개했다. 사진 강원래 인스타그램 캡처한편 최근 연예인들이 안티팬이나 사생팬을 공개적으로 저격하며 자제를 당부하는 사례가 늘고 있다.최근에는 가수 강원래·김송 부부가 한 안티팬으로부터 받은 악성 인스타그램DM(다이렉트메시지)을 공개하고 ""우리는 잘 살고 있으니 당신들이나 잘 하라""라고 응수하기도 했다.강원래의 인스타그램에 따르면 안티팬으로 보이는 네티즌은 강원래에게 ""진짜 정신병자다"", ""자기 자식 망치고 있는 인간"" 등 강원래를 헐뜯는 내용이 가득한DM을 보냈다. 앞서 강원래 부부는 지난 2일 채널A '오은영의 금쪽상담소'에 출연했는데, 방송 이후 일부 네티즌들로부터 ""강원래가 강압적 태도를 보이는 게 불편하다""는 반응이 나왔다.이에 김송은 인스타그램을 통해 ""우리 부부 비난할 시간에 당신들 가정 좀 돌보라. 지나친 관심은 독이고 오지랖""이라면서 악플러에 대한 일침을 가했다."
2024-01-21,‘하이브·SM·YG·JYP’ K팝 ETF 출시…이르면 1분기 상장,"지난해 11월19일(현지시간) 미국LA에서 열린 ‘2023 빌보드 뮤직 어워즈’에서 데뷔 1년 4개월 만에 ‘톱 글로벌K-팝 아티스트’를 수상한 뉴진스. K팝 걸그룹 최초로 시상식 공연을 펼쳤다. 사진 빌보드국내 4대 연예기획사 하이브,SM엔터테인먼트,YG엔터테인먼트,JYP엔터테인먼트 등에 투자 자금 대부분을 투입하는 첫 상장지수펀드(ETF)가 출시된다.21일 업계에 따르면 한국투자신탁운용은 국내에서는 처음으로 엔터테인먼트 회사에만 투자는 ‘ACEKPOP포커스ETF’를 이르면 1분기 상장한다.이ETF는 기초자산의 95%를SM엔터(25.75%), 하이브(25.64%),JYP엔터(24.46%),YG엔터(18.36%) 등 4대 기획사로 채웠다.나머지 5%도 걸그룹 ‘(여자)아이들’의 소속사 큐브엔터(1.14%),SM의 플랫폼 디어유(0.94%), ‘마마무’ 소속사 알비더블유(0.93%) 등 K팝 산업 관련주다.앞서 국내 증시에 상장된 미디어·엔터테인먼트 관련 테마ETF는 ▶TIGER미디어컨텐츠 ▶KODEX미디어&엔터테인먼트 ▶HANAROFnK-POP&미디어 등 총 3개다. 이들 상품의 4대 엔터주 비중은 10~60% 수준에 불과하다.한투운용 관계자는 “4대 기획사의 합산 매출액은 최근 3년간 평균 35% 늘었고 이 같은 성장세는 올해에도 지속될 전망”이라고 내다봤다."
2023-07-10,"엑소 수호 ""조금 실수해도 조롱""…뮤지컬 '실력 논란' 심경 토로","지난달 20일 오후 서울 종로구 세종문화회관 대극장에서 열린 뮤지컬 '모차르트!'프레스콜에서 볼프강 모차르트 역을 맡은 그룹 엑소의 수호가 공연 일부를 시연하고 있다. 연합뉴스그룹 엑소(EXO) 수호가 뮤지컬 '모차르트!'프레스콜 이후 불거진 실력 논란에 대해 불편한 심경을 토로했다.수호는 최근 팬 커뮤니티 플랫폼 디어유 버블을 통해 ""우리 팬분들이 아니어도 일반 관객 여러분, 많은 배우분, 기자님들도 극찬해주신 제 공연을 왜 '현재 반응 안 좋은 수호 뮤지컬'이라는 글로 저를 폄하하려는 걸까요""라며 속상한 마음을 드러냈다.앞서 수호는 지난달 20일 진행된 뮤지컬 '모차르트!'의 프레스콜에서 감기몸살 증상으로 불참한 김희재를 대신해 '왜 나를 사랑하지 않나요'를 불렀다. 예정에 없던 뮤지컬 넘버를 소화한 것이다.프레스콜 무대가 공개된 이후 각종 온라인 커뮤니티에는 수호의 실력에 대해 비판하는 글이 올라왔다.이에 대해 수호는 ""제가 조금만 실수해도 지금 이렇게 조롱하고 비하당할 게 그려지기에 정신적으로 너무 힘들었다""며 ""(일부 네티즌들이) 실수한 부분만 편집해서 쇼츠로 만들어 조롱하고 비하하는 것도 봤다""고 털어놨다.이어 ""프레스콜 때 김희재 배우가 갑작스럽게 당일에 참여하지 못하게 되면서 부르는 넘버도 바뀌고 더 긴장되어 '왜 나를 사랑하지 않나요'를 제 성에도 차지 못하게 부른 건 저도 지금도 아쉽다""며 ""그래서'K-909'(JTBC예능 프로그램)에서 다시 한번 선곡해서 불렀다. 어떻게 불렀는지는 2주 후에 그들도 들어볼 수 있겠죠""라고 말했다.그는 ""그럼에도 제가 부족함이라고 생각하고, 무대로 증명해 보이겠다 생각하고 묵묵히 연기하고 노래하고 있다""고 덧붙였다.한편 수호는 오는 8월 22일까지 서울 세종문화회관 대극장에서 공연하는 뮤지컬 '모차르트!'의 주인공 볼프강 모차르트 역으로 무대에 선다.그는 뮤지컬 '더 라스트 키스','웃는 남자',이번 '모차르트!'까지 뮤지컬 배우로도 활동하고 있다."
