date,title,content
2023-09-02,"""그리워"" 애 타는 '추억의 맛'…23년 전 음료까지 재출시된다","서울 한 대형마트 시식대에서 불닭볶음탕면을 선보이고 있다. 사진 삼양식품최근 소비자들 사이에서 ‘추억의 맛’을 찾는 수요가 늘면서 단종 후 재출시한 먹거리들이 인기다. 좋아하는 상품과 브랜드를 적극적으로 소비하는 ‘팬슈머’(팬+컨슈머)의 영향력이 커지자 식품 업계는 적극적으로 재출시 요청에 화답하고 있다.2일 삼양식품에 따르면 지난 6월 재출시한 ‘불닭볶음탕면’은 3개월 만에 600만 개 넘게 팔렸다. 2016년 국내·외 동시 출시했던 이 제품은 초기 반응이 해외에서 더 좋았고, 삼양식품은 주력 상품에 집중하기 위해 국내에선 판매를 중단했다. 2018년엔 봉지면을, 지난해엔 용기면을 단종했다.이후 삼양식품 공식 홈페이지에는 불닭볶음탕면을 재출시해 달라는 글이 1000건 넘게 올라왔다. 불닭 맛에 마늘의 풍미를 추가한 걸쭉한 국물로 마니아층이 탄탄해서다. 삼양식품 관계자는 “소비자들의 지속적인 요청으로 재판매를 결정한 첫 상품”이라며 “재출시 초반부터 기대를 뛰어넘는 판매 추이를 보인다”고 말했다.롯데웰푸드가 맛과 품질을 업그레이드한 ‘립파이 초코’를 8년 만에 재출시했다. 사진 롯데웰푸드롯데웰푸드가 8년 만에 재출시한 ‘립파이초코’도 100일 만에 180만 케이스 넘게 팔리며 인기를 끌고 있다. 2006년 처음 나온 립파이는 2015년 단종됐으나 소비자들 요청으로 지난 5월 다시 출시됐다. 롯데웰푸드 관계자는 “소비자들의 반가움과 더불어 업그레이드된 맛과 품질이 인기로 이어졌다”며 “기존 비스킷 아랫면에 초콜릿을 코팅해 부드러우면서 달콤한 맛을 더했다”고 말했다.농심켈로그가 추억의 시리얼 ‘허니첵스’를 재출시했다. 사진 농심켈로그팬슈머와의 소통이 매출로 연결된다는 점이 확인되자 식품 업계는 재출시 상품을 잇달아 내놓고 있다. 농심켈로그는 2018년 단종했던 시리얼 ‘허니첵스’를 최근 다시 내놓았다. 농심켈로그 관계자는 “2020년 소비자 요청에 따라 ‘첵스 파맛’을 출시한 데 이어 또 한 번 팬슈머에 응답했다”고 말했다. 롯데마트·슈퍼에서 단독 판매한다.정식품도 지속적인 고객 요청에 따라 ‘녹차 베지밀’을 재출시했다. 2000년 출시 이후 2010년 단종될 때까지 2억2500만 개 이상 팔렸을 정도로 인기를 끌었던 제품이다. 정식품은 창립 50주년을 맞아 23년 전 출시했던 녹차 베지밀의 맛을 똑같이 구현한 제품을 한정 판매한다.정식품이 ‘녹차 베지밀’을 재출시하고 한정 판매한다. 사진 정식품업계 관계자는 “예전에는 판매량이나 비용 문제로 단종했던 제품을 다시 내놓는 것을 부담스러워하는 분위기였지만, 최근엔 마니아층이 적극적으로 목소리를 내면서 재출시가 트렌드가 됐다”며 “소비자들의 향수를 자극하면서도 개선된 품질을 선보여야 꾸준한 인기를 얻을 수 있을 것”이라고 말했다."
2023-08-07,폭염에 아이스크림 가격까지 '부담'…10% 넘게 올랐다,"지난 6월 30일 서울 성동구 이마트24 본점에서 롯데웰푸드 아이스크림이 판매되고 있다. 뉴스1지난달 아이스크림 물가 상승률이 10%를 웃돌며 폭염 속 소비자들의 부담이 커지고 있다.7일 통계청 국가통계포털에 따르면 7월 아이스크림 소비자물가지수는 118.99로 지난해 동월 대비 10.7% 올랐다. 이는 전체 물가 상승률 2.3%의 4.7배에 달하는 수치다.아이스크림 물가 상승률은 지난 3월 13.7%까지 치솟아 글로벌 금융위기 시기인 2009년 5월(14.3%) 이후 최고를 기록했다.그러나 이후 4월 10.5%, 5월 5.9%로 둔화하는 듯싶더니 6월 9.4%로 다시 반등했고, 지난달엔 10% 선을 다시 넘어섰다.아이스크림 물가 상승은 빙과업체들이 원·부자재 가격, 인건비, 물류비, 전기·가스요금 등의 인상을 이유로 아이스크림 제품 가격을 올린 탓이다.롯데웰푸드는 지난 2월 스크류바, 돼지바, 수박바 등의 할인점·일반슈퍼 공급가를 올렸다. 빙그레도 2월부터 메로나와 비비빅, 슈퍼콘 등의 가격을 인상했고, 빙그레의 자회사인 해태아이스크림은 누가바, 쌍쌍바, 바밤바, 호두마루 등의 가격을 올렸다. 롯데웰푸드는 지난달에는 스크류바를 비롯해 돼지바, 수박바 등의 편의점 공급가를 25% 인상했다.주요 편의점이 롯데웰푸드의 공급가 인상에도 소비자 판매 가격은 올리지 않기로 했지만, 일시적인 조치여서 아이스크림 가격 부담은 더 커질 것이란 전망이 나온다.이는 지난달 라면과 빵, 과자의 물가 상승률이 다소 주춤한 것과는 대조적이다. 지난달 라면의 물가 상승률은 10.0%로 전월 대비 3.4%포인트 내렸다. 빵 물가 상승률은 8.1%로 3.4%포인트, 스낵과자는 8.1%로 2.4%포인트 각각 하락했다. 이는 주요 라면·제과·제빵업체들이 정부 권고에 따라 가격을 일제히 내린 데 따른 것이다."
2023-08-24,화제·재미·가성비·스테디셀러…빅 사이즈에 지갑을 여는 이유 [쿠킹],"그랜드·점보·자이언트·빅·트렌타. 요즘 화제가 되는 제품의 이름 옆에 붙여진 단어들이다. 읽는 법은 다르지만, 뜻은 같다. 바로 '대용량'이다. 일반적인 컵보다 용량이 2.5배 커진 음료수, 8.5인분으로 확 커진 컵라면, 마시멜로 함량을 12% 늘린 초코파이, 중량을 1.5배 키운 배 커진 삼각김밥까지, 몸집을 키운 제품이 화제다.최근 화제인 제품은 '그랜드' '점보' '빅' 등 큰 사이즈라는 공통점이 있다. [사진 롯데웰푸드]대용량·재미 키워드 내세운 편의점‘거거익선(巨巨益善)’ 흔히TV화면이 클수록 몰입성이 높아져 좋다는 뜻으로 쓰이는 말인데, 올해는 식품업계에서 자주 등장하고 있다. 트렌드의 포문을 연 건 편의점이다. 소비 침체가 이어지는데도 불구하고, 편의점은 성장세를 보이며 주목받고 있다. 산업통상자원부가 집계한 업태별 매출 구성비에 따르면 올 상반기 국내 유통시장에서 백화점 매출 비중은 17.6%, 편의점은 16.6%, 대형마트는 13.3%로 나타났다. 2021년 대형마트 매출 규모를 넘어선 데 이어 이젠 백화점을 바짝 추격하고 있다. 백화점이나 마트보다 접근성이 뛰어난 장점을 내세운 편의점은 트렌드에 발 빠르게 대응하며 영향력을 넓히고 있다.실제로 소용량 다품종 위주의 판매 전략을 유지해온 편의점은 소비자의 지갑이 닫히자 ‘대용량’‘재미’ 등의 키워드를 내세우며 소비자의 관심을 끌고 있다.CU가 압구정 로데오의 인기 카페인 ‘이웃집 통통이’와 협업해 출시한 약과 쿠키는, 다른 약과보다 훨씬 큰 크기를 내세웠는데 판매 시작 5일 만에 초도 물량 10만 개가 팔리며 인기를 끌었다. 품절템으로 화제를 모은GS25의 점보도시락은 기존 86g인 팔도 도시락 대비 용량을 8.5배 키운 729g 초대형 컵라면이다. 이 제품은GS25가 팔도의IP를 확보해 선보인 단독 상품이다. 유튜브와 인스타그램엔 점보도시락을 먹는 모습을 인증하는 게시물이 연달아 올라왔다. 인기에 힘입어, 품귀 현상을 빚었고 온라인 중고시장에선 정가보다 2~3배 비싼 가격에 거래됐다. 점보도시락은 처음부터 ‘화제성’에 주목해 개발했다. 점보도시락을 기획한 이진우GS25가공식품팀MD는 “먹방 콘텐트에 열광하는 트렌드를 반영해 선보인 점보라면은 용기면 매출 1위에 등극하는 등 폭발적 인기를 이어가고 있다”며 “앞으로도 기존의 상품 영역을 벗어나 기발하고 이색적인 상품을 개발해 가는 데 주력할 것이다”라고 말했다.팬이 없다면 빅 마케팅도 소용없다최근 누적 판매 1억병을 돌판한 '야쿠르트 그랜드'는 기존 제품보다 4배 큰 대용량이다. [사진hy]그렇다면 사이즈만 키우면 모두 성공할까. 물론 아니다. 경기가 어려울 때 사람들은 오히려 소용량 제품을 선호한다. 남아서 버리는 대신, 필요한 만큼만 사기 때문이다. 인기를 끄는 대용량 제품엔 공통점이 있다. 바로 고객의 높은 충성도다. 마케팅 전문가 윤세노씨는 “대용량 제품 출시는 기업 입장에서 봤을 때 판매율이 높고, 고객의 충성도가 높은, 즉 자신 있는 제품일 때 유용한 전략”이라고 설명했다. 이미 팬이 있는 제품이었을 때, 성공 가능성도 커지기 때문이다.hy의 ‘야쿠르트 그랜드’가 대표적인 사례다. 2015년 기존 제품보다 4배 큰 대용량으로 출시했는데, 당시SNS를 통해 입소문이 나며 일평균 7만병씩 팔렸고 첫해에만 1500만병이 팔렸다. 이후에도 꾸준히 찾는 사람이 늘며 최근 누적 판매량이 1억병을 돌파했다.소비자의 목소리도 제품의 몸집을 키운다. 팬(Fan)과 소비자(consumer)를 합한 ‘팬슈머(Fansumer)'의 영향력은 최근 몇 년 사이 꾸준히 주목받고 있는 식품업계의 키워드다. 단종되었던 제품이 소비자의 요구에 재출시되거나 업그레이드되기도 한다. 기업은 신제품을 출시하는 것보다, 실패 위험은 줄이면서 소비자의 만족도를 높일 수 있기에 윈윈이다. 오뚜기는 올해 4월 기존 컵누들 소컵보다 중량을 1.6배 늘린 '컵누들 큰컵'을 출시했다. 컵누들은 국내 최초의 당면 형태 용기 라면으로, 녹두 당면을 사용해 일반 용기라면 대비 낮은 칼로리와 다양한 맛을 즐길 수 있어, ‘다이어트’를 위한 제품으로 꾸준히 인기를 이어왔다. 이와 함께 온라인에는 ‘1개로는 부족하다’ ‘더 많은 양으로 든든하게 즐기고 싶다’ 등 소비자의 요구가 꾸준히 올라왔다. 이에 오뚜기가 제품 출시 20년 만에 ‘큰컵’으로 응답한 것이다.기본 제품의 중량을 1.6배 늘린 오뚜기 컵누들 큰컵. [사진 오뚜기]잘파세대 공략, 롯데 초코파이새로운 소비자를 찾아 나설 때도 크기는 차별 포인트가 된다. 롯데웰푸드는 지난 4월 무게를 40g으로 늘린 ‘빅 사이즈 초코파이’를 선보였다. 대형마트, 할인점 등에서 파는 초코파이류 제품 중에 최고 크기 수준이다. 제품 리뉴얼 뒤엔 소비자 조사 결과가 있었다. 롯데웰푸드는 초코파이에 대한 브랜드를 진단하고, 인지도 조사와 개선 사항 등 다양한 요소에서 소비자 조사를 했는데 그 결과 디저트 시장을 이끄는 새로운 소비층인 1020 잘파(Z+α)세대가 상대적으로 자사 제품을 선호한다는 것을 알았다. 그 결과 파이 시장의 주 고객인 중년층에서 벗어나 잘파세대 공략에 나서며 크기를 키운 것이다. 증량과 함께 맛도 개선했다. 마시멜로 부분을 중점적으로 키움으로써, 한입 물었을 때 입 안에서 포만감이 만족스럽게 느껴질 수 있도록 한 것이다.마시멜로 함량을 12% 늘린 롯데 초코파이. [사진 롯데웰푸드]가성비는 대용량 제품의 인기의 주요 원인이다. 식품 마케터 황여정씨는 ""경기 침체로 소비자의 지갑이 닫힌 시기엔 새로운 상품을 기획하는 것보다는 스테디셀러 아이템의 사이즈에 변화를 줘서SNS에서 바이럴되도록 만드는 전략이 효과적일 수 있다""라고 설명했다. 특히 기록적인 폭염과 고물가 이어진 올여름, 음료 시장은 대용량 제품에 주목했다. 갈증 해소를 위해 시원한 커피를 찾는 사람이 늘었는데, 이왕이면 여러 잔을 사는 대신 용량이 큰 제품을 사서 종일 마시는 것이다. 윤세노씨는 “하루에 커피를 한잔 마시는 사람보다는 2~3잔 마시는 사람이 많은데, 이때 조금 더 비용을 지불하고 용량이 큰 제품을 사서 여유 있게 즐기는 것이 더 합리적으로 느껴질 것”이라고 설명했다. 스타벅스 코리아는 지난 15일부터 아이스 커피를 트렌타 사이즈로 판매하기 시작했다. 개점 24주년을 맞아 9월까지 콜드 브루, 자몽 허니 블랙 티, 딸기 아사이 레모네이드 스타벅스 리프레셔 등 3종을 30온스(887mL)의 대용량으로 한정 판매하기로 했는데, 출시 약 3주 만에 누적 판매 60만잔을 돌파하는 등 인기를 끌자 아이스 커피로 확대한 것이다.송정 기자song.jeong@joongang.co.kr"
2023-08-24,"40주년 맞은 돼지바, 패션 브랜드 ‘도야지바르송’으로 재탄생","도야지바르송 패션용품과 돼지바. 사진 롯데웰푸드롯데웰푸드는 빙과 브랜드 ‘돼지바’ 출시 40주년을 맞아 ‘도야지바르송’이라는 패션 브랜드를 론칭하고 굿즈(기획상품)를 제공한다고 24일 밝혔다.도야지바르송은 ‘도야지(돼지)+바’와 해외 유명 패션 브랜드 느낌이 나는 ‘르송’ 조합해 만든 이름으로, 당초 콘셉트만 준비된 가상의 브랜드였다. 티저와 화보 공개 뒤 소셜미디어(SNS)에서 큰 반응에 얻어 실제 제작으로 이어졌다. 돼지바의 특징인 세 가지 색상(브라운·화이트·레드)을 이번 가을 트렌드에 맞게 재해석했다. 종류는 트렌치코트·볼캡·타비슈즈 세 가지다.이벤트 참여를 통해 도야지바르송 굿즈를 받을 수 있다. 돼지바와 함께 탄생 40주년을 축하하는 인증샷을 찍은 후 자신의 인스타그램 채널에 이벤트 참여 해시태그와 함께 업로드하면 된다. 10월 초 추첨을 통해 도야지바르송 의류를 증정할 계획이다. 롯데웰푸드 관계자는 “도야지바르송 굿즈는 유명 의류 브랜드 수준으로 꼼꼼한 검수를 거쳐 완성도 높게 제작할 계획”이라고 말했다.도야지바르송 패션용품. 사진 롯데웰푸드"
2023-07-01,편의점까지 가격 내리자…‘역시 공정위’ 얘기 나오는 이유 [현장에서],"편의점 업계가 7월1일로 예정된 롯데웰푸드 아이스크림 가격 인상을 보류하기로 결정한 것에 이어 자체 브랜드(PB) 상품도 가격을 인하하거나 동결할 방침이다. 30일 서울 성동구 이마트24 본점에서 롯데웰푸드 아이스크림이 판매되고 있다. 뉴스1“유통사까지 가격 인하에 나서니 더 힘듭니다. 유통사가 갑이고 제조사는 을이니 따를 수밖에 없잖습니까.”(A식품사 관계자)“경쟁사가 가격을 낮추니 우리도 발맞추기는 하는데, 유통 생태계까지 교란되는 느낌입니다.”(B유통사 관계자)최근 식품 업체에 이어 편의점들이 가격 인하에 나선 데 대해 관련 업계 일각에선 우려 목소리를 냈다. 어떤 이는 “오래 지속할 수 없는 쇼”라고 꼬집었다.더욱이 편의점 4사의 ‘이례적인’ 가격 인하 릴레이는 지난달 29일 시작됐다.GS25가 1일로 예정돼 있던 롯데웰푸드 아이스크림 제품 15종에 대한 판매 가격을 ‘당분간’ 인상하지 않기로 하면서다.식품 제조사가 공급가를 올리겠다고 했는데, 유통사가 “소비자 판매 가격을 올리지 않겠다”고 한 ‘보기 드문’ 사례다. 앞서 롯데웰푸드는 지난 4월부터 편의점에 공급되는 아이스크림 가격을 올리기로 했다가 정부의 가격 인상 자제 권고에 인상을 보류한 상태였다.그러다 3개월 만에 “더는 원가 부담을 감내하기 어렵다”며 가격 인상을 시행할 방침이었다. 하지만GS25가 판매 가격을 동결하겠다고 하면서 롯데웰푸드로선 민망한 상황이 됐다. 식품 업계 관계자는 “빙그레와 해태 등 경쟁사들은 진작 아이스크림 가격을 올렸는데 롯데웰푸드는 정부 방침에 맞춰 가격 인상을 늦췄다가 오히려 난처해진 셈”이라고 말했다.이후CU·세븐일레븐·이마트24도 롯데웰푸드 아이스크림 가격 동결을 결정했다. 업계 관계자는 “편의점 업계에선 한 업체가 하면 다른 업체도 울며 겨자 먹기로 따라갈 수밖에 없는 구조”라고 말했다.편의점 가격 인하 릴레이는 지난달 30일에도 이어졌다.CU·세븐일레븐이 과자·우유 등 자체 브랜드(PB) 상품 가격을 내리기로 하면서다.CU와 세븐일레븐 모두 중소 협력사의 공급가 조정 없이 자체 마진을 줄여 가격을 인하한다는 방침이다.CU가 물가 안정화에 동참하기 위해 유통 업계에서는 처음으로PB상품의 가격 인하를 결정했다고 30일 밝혔다. 원재료 가격 인상 등으로 가격 조정이 여의치 않은 중소 협력사들의 부담을 낮추기 위해 납품처의 공급가에 대한 조정 없이CU의 자체적인 마진을 축소해 진행한다는 설명이다. 사진CU일각에선 이 같은 편의점의 ‘결단’이 최근 이어진 공정거래위원회 조사와 무관치 않다고 보고 있다. 앞서 공정위는 지난 5월 이후CU·GS25에 이어 이마트24에 대한 현장조사에 나섰다. 지난해 11월 발표한 유통분야 거래 관행 서면 실태조사를 토대로 편의점의 판촉 비용 부당 전가 등을 점검하겠다면서 ‘칼’을 빼든 것이다.업계에선 세븐일레븐도 조사를 받을 거라고 예상한다. 아직 조사 결과는 발표되지 않았지만 편의점으로선 공정위 눈치를 보며 정부의 물가안정 방침에 최대한 협조하는 모습을 보이려고 할 수밖에 없다는 말이 나온다.앞서 지난달 27~29일 농심·삼양식품·오뚜기·롯데웰푸드·SPC등이 이달부터 일부 라면·과자·빵 값을 4.5~5.1% 내리기로 한 데도 정부의 공정위 담합 조사 거론이 큰 영향을 미쳤다는 게 정설이다. 한덕수 국무총리는 지난달 21일 국내 물가 동향과 관련해 “원료(가격)는 많이 내렸는데 객관적으로 제품값이 높은 것에 대해선 경쟁을 촉진하도록 공정거래위원회가 담합 가능성도 들여다보고 유통 구조도 면밀히 살펴야 한다”고 말한 바 있다.신재민 기자식품·유통 업계가 “소비자 부담을 최소화하고자” 진행하는 가격 인하는 소비자에게 기쁜 소식이어야 한다. 하지만 기업들 속사정과 실제 소비자에게 얼마나 도움이 될지, 앞으로 얼마나 지속 가능할 지를 생각하면 뒷맛이 쓰다."
2023-06-29,편의점도 '물가 안정' 동참…아이스크림값 인상 보류,"뉴스1정부의 물가 안정 기조에 따라 식품업계가 잇따라 제품 가격을 내리고 있는 가운데, 편의점도 가격 인하에 동참한다.편의점GS25는 롯데웰푸드 아이스크림 제품 15종에 대한 판매 가격 인상을 보류하기로 했다고 29일 밝혔다.롯데웰푸드는 다음 달부터 스크류바와 돼지바, 수박바 등 아이스크림의 편의점 공급가를 25% 인상하기로 했다.그러나GS25는 롯데웰푸드의 공급가 인상에도 당분간 해당 아이스크림 제품의 소비자 판매가격은 올리지 않기로 했다.최근 정부의 물가 안정 기조에 발맞춰 소비자 부담을 낮추기 위한 차원이다.이에 따라GS25에서 돼지바와 스크류바, 수박바, 죠스바 등의 가격은 지금처럼 1200원으로 유지된다. 빠삐코 등 튜브류 아이스크림 가격도 1500원으로 동결된다.CU와 세븐일레븐, 이마트24도롯데웰푸드 아이스크림 가격 동결을 결정했다.CU는 10종, 세븐일레븐은 13종, 이마트24는 14종의 가격을 당분간 올리지 않기로 했다.한편 식품업계 가격 조정에 따라 편의점에서 다음 달 1일부터 라면과 스낵류의 소비자 판매가도 낮아진다.신라면 1봉지의 편의점 가격은 현재 1000원에서 950원으로, 새우깡은 1500원에서 1400원으로 인하된다."
2023-07-07,날씨 더워지니…아이스크림값 다시 팍팍 올린다,"지난달 아이스크림 물가상승 폭이 다시 커진 것으로 나타났다. 빙과 업체들은 라면·제과·제빵 업체와 달리 제품 가격 인하에는 동참하지 않고 있다.6일 통계청 국가통계포털에 따르면 6월 아이스크림의 소비자물가지수는 119.98로 지난해 동월 대비 9.4% 상승했다. 아이스크림 물가상승률은 지난 3월 13.7%로 글로벌 금융위기 당시인 2009년 5월(14.3%) 이후 약 14년 만에 가장 높았다. 이후 4월 10.5%, 5월 5.9%로 둔화했으나 지난달 상승 폭이 다시 커졌다.빙과 업체들이 지난해에 이어 올해도 아이스크림 가격을 인상하면서 물가상승률은 더욱 높아질 수 있다. 롯데웰푸드와 빙그레, 빙그레의 자회사인 해태아이스크림 등 빙과 업체들이 지난해에 이어 올해 2월부터 제품 가격을 잇달아 인상했는데, 대형마트·슈퍼마켓·편의점 등 유통 채널에 따라 순차적으로 적용되는 편이다.롯데웰푸드는 올해 2월 스크류바·돼지바 등 할인점·일반슈퍼 공급가를 올렸다. 빙그레도 2월부터 메로나·비비빅 등 가격을 인상했고, 해태아이스크림은 누가바·쌍쌍바 등의 가격을 올렸다. 이번 달에는 롯데웰푸드가 스크류바·돼지바 등 편의점 공급가를 25% 인상했다. 편의점들이 가격을 인상하지 않기로 했지만 일시 조치여서 아이스크림 가격 부담은 다시 커질 수 있다.빙과 업체들은 원·부자재 가격 상승과 인건비와 물류비, 전기·가스요금 인상 등을 가격 인상 이유로 내세우고 있다. 올해 하반기 예정된 우유 원유(原乳) 가격 협상이 마무리되면 아이스크림 가격 추가 인상 가능성도 있다.게다가 여름은 빙과 업체들에 성수기라 가격을 좀처럼 내리지 않는다. 빙그레의 경우 연결 기준 지난해 3분기 매출액(3906억원)은 연간 매출의 30.8%였으며, 영업이익(258억원)은 65.4%를 차지했다.이는 최근 주요 라면 업체와 제과·제빵 업체가 정부의 물가 안정 시책에 맞춰 제품 가격을 잇달아 내린 것과는 대조적인 모습이다. 이날CJ푸드빌이 운영하는 뚜레쥬르는 이달 내로 단팥빵·크림빵 등 제품 15종 가격을 평균 5.2% 인하한다고 밝혔다. 경쟁 업체인 파리바게뜨는 지난달 28일에 평균 5% 수준 가격 인하 계획을 발표한 바 있다.CJ푸드빌 관계자는 “밀가루 외 다른 원·부재료 가격 상승, 생산과 유통 전반 부대비용 상승으로 부담이 큰 상황이지만 물가 안정에 동참하고자 가격 인하를 결정했다”고 설명했다. 이번 가격 조정에 따라 소보로빵·단팥빵·크림빵 등 가격이 개당 100~200원 내려간다. 뚜레쥬르가 제품 가격을 인하한 것은 2010년 이후 13년 만이다."
