date,title,content
2023-10-22,전방위 물가제어 나선 정부…일각선 '금리 인상' 정공법 요구도,"장영진 산업통상자원부 1차관(가운데)이 20일 서울 마포구 전자회관에서 공산품·유통업체 대표가 참석한 가운에 '민생물가 안정을 위한 공산품 가격 점검회의'를 주재하고 있다. 산업부 제공치솟는 물가를 잡기 위한 정부의 시장 개입이 전방위로 거세지고 있다. 농림축산식품부는 20일 한훈 차관이 주재한 주요 식품기업 대표 간담회를 열었다. 간담회 형식을 띠었지만, 정부가 물가 안정 협조를 당부하는 자리였다.CJ제일제당·오뚜기·농심·롯데웰푸드·SPC·동원F&B·오리온·삼양·해태제과·풀무원·동서식품·매일유업·LG생활건강·대상·빙그레·샘표식품 등 국내 대표 식품회사 16곳 대표와 주요 임원이 참석했다.같은 날 산업통상자원부는 장영진 1차관이 주재한 ‘공산품 가격 점검 회의’를 열었다. 이 자리엔 전자정보통신산업진흥회·자동차산업협회·타이어산업협회·패션산업협회·체인스토어협회·편의점산업협회·프랜차이즈산업협회 등 주요 제조·유통 협회 임원진이 참석했다. 제조 업계뿐 아니라 유통업체까지 불러 물가 안정 협조를 당부했다.전날인 19일엔 농식품부가 정부세종청사에 이마트·롯데마트·홈플러스 등 대형마트 3사를 불러 “원가 절감, 생산성 향상 등을 통해 가격 인상 요인을 최소화해달라”고 요구했다. 제조업체뿐 아니라 유통업체까지 전방위로 물가 안정을 압박하는 모양새다. 간담회에 참석한 한 업체 임원은 “현 정부가 출범한 뒤 ‘물가 안정에 협조해달라’는 요청이 많았지만 최근 들어 훨씬 직설적으로 ‘가격 인상을 자제하라’는 압박이 거세졌다”고 말했다지난 16일 서울의 한 주유소, 휘발윳값이 L당 1795원이다. 뉴스1정부가 기업을 압박하는 건 물가 상황판에 경고등이 켜지면서다. 지난달 물가상승률은 3.7%를 기록했다. 5개월 만에 최대치다. 최근 국제유가가 급등하면서다. 석병훈 이화여대 경제학과 교수는 “이스라엘과 팔레스타인 무장 정파 하마스와 전쟁이 터지며 중동 정세가 불안해졌다”며 “미국을 중심으로 고금리 장기화 기조가 이어지는 것도 물가 상승을 부추겼다”고 말했다. 이어 “연말 3%대 초반 물가상승률을 기대한 정부 전망이 어긋날 수 있다”고 덧붙였다.문제는 뾰족한 해결책이 없다는 것이다. 그동안 물가를 잡기 위해 정부는 주로 전기·가스·수도·교통 등 공공요금을 억제하는 대책을 앞세웠다. 하지만 공공요금은 올 초에 이미 일제히 올랐다. 내년 4월 총선을 앞둔 상황이라 더 올리기 쉽지 않다. 최근 농·축·수산물 할인 지원이나 김장철을 앞두고 배추·천일염 공급을 확대하는 등 단기 물가 대책만 쏟아진 이유다.‘비상 상황’인 만큼 세계 각국은 통상에서 벗어난 특단의 대책을 꺼내기 시작했다. 국제유가에 민감한 미국 정부는 지난달 석유·가스 기업에 기름값 인하를 압박하며 “연간 지급하던 310억 달러(약 41조8000억원) 규모 세액 공제 혜택을 내년부터 없앨 수 있다”고 밝혔다.프랑스 정부는 약 6개월간 주유소 등 유류 유통업체가 휘발유·경유를 매입가보다 싸게 팔 수 있도록 허용하는 내용의 법안을 추진 중이다. 경쟁을 유도해 주유소가 손해를 보더라도 기름값을 낮추겠다는 취지다. 영국은 1973년 이후 시행하지 않은 ‘식료품 가격 상한제’ 부활까지 검토하고 있다.한미 기준금리 추이 그래픽 이미지. [자료제공=한국은행, 미국연방준비제도(Fed)]하지만 세계 각국의 비상 대책은 금리 인상을 하고도 물가가 잡히지 않자 낸 후속 조치다. 미국의 기준금리는 5.25~5.5%, 유럽연합(EU)은 4.5%, 영국은 5.25%다. 이달까지 6연속 동결한 한국의 기준금리(3.5%)와 격차가 크다. 게다가 한국이 선제적으로 기준금리를 올렸을 당시와 달리 글로벌 고금리 장기화 추세가 수그러들 기미가 보이지 않는다.국내 금리 동결 기조가 불러온 부작용도 가시화하고 있다. 2분기 기준 가계부채는 1862조8000억원으로 전 분기보다 10조원 가까이 불어났다. 한국의 기준금리가 더 오르지 않을 것이라는 생각에 일부에서 빚을 내 부동산·주식 투자에 나서는 이른바 ‘영끌빚투’가 고개를 든 영향으로 풀이된다.외환보유액은 지난달 기준 4141억2000만 달러로 전달 대비 41억8000만 달러 감소했는데, 이 달러 대비 원화가치가 1400원대로 떨어졌던(환율은 상승) 지난해 10월(4140억1000만 달러) 이후 11개월 만에 가장 낮다. 금리 동결은 경쟁력을 상실한 한계 기업들의 퇴출을 막는 등 다른 경제·사회적 비용도 키우고 있다.이 때문에 고통스럽더라도 물가를 잡으려면 금리 인상이란 ‘정공법’으로 가야 한다는 목소리가 최근 나오고 있다. 하준경 한양대 경제학과 교수는 “기준 금리를 올릴 경우 저성장이 심화하고 가계부채 상환 부담이 가중할 거란 우려가 있지만, 못지않게 장기간 금리 동결에 따른 부작용과 사회적 비용이 커졌다”며 “결정을 미룰수록 부담이 커지는 만큼 물가 안정 차원뿐 아니라 가계부채 등 경제 건전성을 관리하는 측면에서도 금리 인상을 검토할 시기가 왔다”고 말했다.이창용 한은 총재는 19일 금융통화위원회 직후 열린 기자간담회에서 “금통위원 6명 중 5명이 금리를 3.75%로 올릴 가능성을 열어둬야 한다는 의견을 냈다”며 “중동 사태가 심화해 물가가 오를 경우 금리 기조를 바꾸자는 견해를 심각하게 받아들이고 있다”고 말했다.하지만 수출ㆍ소비 위축을 감수하면서 한은이 금리를 올리는 것은 쉽지 않다. 특히 이자 부담이 커지면 일부 한계 차주와  동산 프로젝트 파이낸싱(PF) 등을 중심으로 대출 ‘폭탄’이 터질 수 있다는 점에서 한은의 고민은 크다. 조영무LG경영연구원 연구위원은 “미국 등 선진국 경기 둔화 가능성이 커지는 가운데 한은이 금리를 올려 경기를 더 얼어붙게 하기는 쉽지 않을 것”이라고 내다봤다."
2023-10-16,초코파이 아시아 시장 패권 놓고 ‘50년 라이벌’ 오리온·롯데 격돌,"오리온과 롯데가 초코파이 패권을 놓고 아시아 시장에서 격돌하고 있다. 두 회사가 각각 ‘초코파이’(1974년), ‘쵸코파이’(1978년)라는 이름으로 초코파이를 출시한 지 50년 가까이 되도록 라이벌전이 이어지고 있다.차준홍 기자15일 업계에 따르면 롯데웰푸드는 최근 인도 남부 첸나이주에 세 번째 초코파이 생산 라인을 본격 가동했다. 인도에서 롯데 초코파이 매출은 2021년 500억원에서 2022년 650억원으로 30% 증가했다. 수요가 급증하자 롯데는 300억원을 투입해 기존 공장을 증설했다.롯데는 베트남 남부 빈즈엉에서도 초코파이를 직접 생산한다. 지난달 베트남 하노이에서 개장한 복합 상업단지 ‘롯데몰 웨스트레이크’ 곳곳에는 초코파이 팝업 스토어를 열어 ‘부치(Bouchee)’라는 고급 제품을 선보이기도 했다.베트남은 오리온이 지난 20년 동안 공들여 온 시장이다. 베트남 내 오리온 초코파이 매출은 지난해 1200억원을 기록했다. 오리온 관계자는 “초코파이는 베트남 파이 시장에서 70% 가까운 점유율을 차지하며 ‘국민 파이’로 자리매김했다”고 전했다. 오리온 초코파이의 중국·베트남·인도 합산 매출은 2021년 3190억원에서 지난해 3740억원으로 17.2% 증가했다.오리온과 롯데는 1980년대부터 국내에서 포장 디자인과 제품 이름을 두고 충돌했다. 롯데는 처음에 ‘쵸코파이’를 상품명으로 쓰다가 “‘초코파이’ 상표에 독점 사용권이 없다”는 법원 판결에 이름을 바꿨다. 양사는 90년대에는 러시아와 중국에서도 상표권으로 다퉜다.두 회사는 최근엔 과감한 투자와 철저한 현지화에 힘쓰고 있다. 현지인들에게 익숙한 과일 맛을 첨가하거나, 돼지고기를 먹지 않는 이슬람 소비자들을 위해 소에서 나오는 젤라틴을 사용해 할랄 인증을 받는 식이다."
2023-09-15,협력사 챙기고 내수 살리고…대기업들 통큰 한가위 선물,"오는 28일부터 이어지는 추석 연휴를 앞두고 주요 대기업이 ‘내수 살리기’에 팔을 걷어붙였다. 원자재 대금 결제, 상여금 지급 등 자금 수요가 일시적으로 몰리면서 중소기업이나 소상공인이 어려움을 겪는 시기에 선제적으로 지원에 나선 것이다. 특히 올해는 일본 원전 오염수 방류 이슈에 고물가, 불경기가 맞물린 상황에서 주요 대기업은 대금 지급일을 예년보다 앞당기고 금액을 늘리는 한편, 다양한 내수 진작에 나설 예정이다.14일 업계에 따르면 삼성은 삼성전자·삼성전기·삼성SDI·삼성물산 등 11개사가 참여해 협력사 물품대금 1조4000억원을 조기 지급한다. 회사별로 당초 지급일보다 최대 열흘 앞당겼다.올해는 온·오프라인에서 임직원을 대상으로 열리는 ‘추석맞이 장터’에 제주 옥돔, 고등어, 법성포 영광 굴비 등 수산물 품목을 400여 종류로 늘렸다. 삼성 관계자는 “어민들을 돕기 위해 당초 계획보다 수산물 품목을 3배 늘렸다”고 설명했다.삼성은 또 그룹 임직원 대상으로 명절 기간에 국내로 여행을 떠나라는 캠페인을 진행한다. 이를 위해 임직원에게 관광 명소와 행사, 휴양시설 등 여행 정보를 제공하고, 전국 맛집 지도를 만드는 행사도 연다.이날LG전자·LG디스플레이·LG화학·LG에너지솔루션 등 8개 계열사도 총 1조2000억원 규모의 협력사 납품대금을 최대 18일 앞당겨 추석 연휴 전에 지급한다고 밝혔다. 조기 지급 규모는 지난해 추석보다 2500억원 늘어났다.특히LG전자는 협력사들이 전년 대비 절반 이상 낮은 특별 금리로LG전자 상생협력펀드에서 자금을 조달해 금융 비용 부담을 덜 수 있게 했다.LG디스플레이는 경기 파주와 경북 구미의 사업장 주변 저소득 가정과 복지관에 식료품 등을 지원하며,LG이노텍도 사업장이 있는 마곡·평택·안산 지역 소외 계층과 사회복지관 등에 음식과 선물 등을 전달할 예정이다.포스코 역시 거래하는 기업들의 자금 부담을 덜어주기 위해 추석 연휴 전 5일 간 매일 거래 대금을 지불할 계획이며, 약 4000억원 규모가 될 것으로 예상한다. 계열사인 포스코E&C는 중소 협력사들에 오는 16일부터 내달 3일까지 797억원을 조기 결제할 예정이다.롯데그룹은 오는 25일까지 협력사들에 약 5900억원의 대금을 조기 지급한다. 롯데웰푸드·롯데백화점·롯데칠성음료·롯데케미칼 등 24개 계열사가 동참하며, 중소 협력사 1만800여 곳이 대상이다. 오뚜기는 주문자위탁생산(OEM) 업체, 원료 업체, 포장 업체 등 32곳에 대금 126억원을 공식 지급일보다 50여 일 앞당겨 조기 지급했다."
2023-09-14,"‘전국 맛집지도’까지 만들었다…기업들, 추석 내수살리기 총력","오는 28일부터 이어지는 추석 연휴를 앞두고 주요 대기업이 ‘내수 살리기’에 팔을 걷어붙였다. 원자재 대금 결제, 상여금 지급 등 자금 수요가 일시적으로 몰리면서 중소기업이나 소상공인이 어려움을 겪는 시기에 선제적으로 지원에 나선 것이다. 특히 올해는 일본 원전 오염수 방류 이슈에 고물가, 불경기가 맞물린 상황에서 주요 대기업은 대금 지급일을 예년보다 앞당기고 금액을 늘리는 한편, 다양한 내수 진작에 나설 예정이다.지난 13일 오후 부산 중구 자갈치시장에서 수산물 원산지표시점검반이 수산물 원산지 표시 및 수입 수산물 유통 이력 등을 특별점검하고 있다. 연합뉴스━“여행·간담회도 국내 명소에서 하세요”14일 업계에 따르면 삼성은 삼성전자·삼성전기·삼성SDI·삼성물산 등 11개사 참여해 협력사 물품대금 1조4000억원을 조기 지급한다. 회사별로 당초 지급일보다 최대 열흘 앞당겼다.올해는 온·오프라인에서 임직원을 대상으로 열리는 ‘추석맞이 장터’에 제주 옥돔, 고등어, 법성포 영광 굴비 등 수산물 품목을 400여 종류로 늘렸다. 전체 상품의 4분의 1을 차지한다. 삼성 관계자는 “최근 수산물 수요가 줄어들어 어려움을 겪는 어민들을 돕기 위해 당초 계획보다 수산물 품목을 3배 늘렸다”고 설명했다.삼성 직원들이 '추석 맞이 온라인 장터'에서 국내산 수산물을 둘러보고 있다. 삼성은 수산물 소비 촉진을 위한 사회적 노력에 동참하는 차원에서 올해 추석 장터에서 판매하는 수산물 품목을 대폭 확대했다. 사진 삼성전자삼성은 또 그룹 임직원 대상으로 명절 기간에 국내로 여행을 떠나라는 캠페인을 진행한다. 이를 위해 임직원에게 관광 명소와 행사, 휴양시설 등 여행 정보를 제공하고, 전국 맛집 지도를 만드는 행사도 연다. 부서별 회식이나 간담회도 사업장 인근에 있는 명소나 지역 맛집에서 하도록 권장할 방침이다.━LG,1조2000억 조기 지급, 저리로 자금 지원도이날LG전자·LG디스플레이·LG화학·LG에너지솔루션 등 8개 계열사도 총 1조2000억원 규모의 협력사 납품대금을 최대 18일 앞당겨 추석 연휴 전에 지급한다고 밝혔다. 조기 지급 규모는 지난해 추석보다 2500억원 늘어났다.특히LG전자는 협력사들이 전년 대비 절반 이상 낮은 특별 금리로LG전자 상생협력펀드에서 자금을 조달해 금융 비용 부담을 덜 수 있게 했다.LG디스플레이는 경기 파주와 경북 구미의 사업장 주변 저소득 가정과 복지관에 식료품 등을 지원하며,LG이노텍도 사업장이 있는 마곡·평택·안산 지역 소외 계층과 사회복지관 등에 음식과 선물 등을 전달할 예정이다.LG헬로비전은 경기도 김포 장애인복지관에 식료품, 생필품 등을 담은 ‘사랑의 마음 나눔 꾸러미’를 전했다.LG관계자는 “추석 명절을 맞아 자금 수요가 늘어나는 협력사를 돕기 위해 납품대금을 앞당겨 지급키로 했다”며 “상생결제 시스템 확대 등 협력사에 도움이 되는 다양한 상생 활동을 늘릴 방침”이라고 말했다.이종호 과학기술정보통신부 장관이 지난 14일 오전 부산광역시 중구 부산우체국을 방문, 수산물 소비촉진을 장려하며 김, 멸치 등 수산건어물을 구매하고 있다. 사진 과학기술정보통신부포스코 역시 거래하는 기업들의 자금 부담을 덜어주기 위해 추석 연휴 전 5일 동안 매일 거래 대금을 지불할 계획이며, 약 4000억원 규모가 될 것으로 예상된다. 계열사인 포스코E&C는 중소 협력사들에 오는 16일부터 내달 3일까지 797억원을 조기 결제할 예정이다.롯데그룹은 오는 25일까지 협력사들에 약 5900억원의 대금을 조기 지급한다. 롯데웰푸드·롯데백화점·롯데칠성음료·롯데케미칼 등 24개 계열사가 동참하며, 중소 협력사 1만800여 곳이 대상이다.롯데는 중소 협력사의 경쟁력을 높이기 위해 해외 판로 개척 지원 사업도 하고 있다. 이달 롯데지주를 포함한 유통 6개사가 인도네시아에서 ‘대한민국 브랜드 엑스포 인 자카르타’를 열게 대표적이다.오뚜기는 주문자위탁생산(OEM) 업체, 원료 업체, 포장 업체 등 32곳에 대금 126억원을 공식 지급일보다 50여 일 앞당겨 조기 지급했다. 오뚜기 관계자는 “대금 조기 지급으로 협력사의 자금 부담이 해소되길 바란다”고 말했다."
2023-09-21,"미래를 위한 트렌디한 선택, 지속가능에 도전하자","한 달 내내 비가 내리는 것을 보고 채식을 결심했다는 아이돌 출신 연예인. 동물보호를 위해 동물 실험 등을 하는 화장품, 가죽제품 등의 상업광고 출연 중단을 선언한 유명 연예인.유명 셀럽들이 너도 나도 환경보호를 위한 자신만의 소견을 펼치며 환경보호는 또 하나의 트렌드가 돼가고 있다. 후대를 위해 지구를 아끼고 지키는 것이 트렌드가 된 지금, 당신을 얼마나 트렌드에 동참하고 있는가.트렌디한 환경보호에 동참하고 싶다면 후대를 생각하는 생산방식으로 콩을 생산하고 이를 보증하는 규약을 만들어 지속가능성을 지켜나가고 있는 미국 대두 농가들에게 주목해보자.100년이 넘는 가업을 이어오며 물려받은 땅을 후대에게 재대로 물려주기 위해 나의 편리함 보다는 땅을 보존하는데 골몰하며 대두를 생산하는 미국 농가들을 직접 만나 그들이 생각하는 지속가능성에 대해 들어보고 그들이 지구를 지켜나가는 방법을 살펴보자.━미래를 위해 ‘지속가능’을 선택한 사람들1980년과 2015년 사이 미국 농가의 대두 생산량은 96% 증가한 반면 생산활동에 사용된 에너지량은 1부셸당 42% 감소한 것으로 나타났다.생산량을 두 배로 늘리는 동안 사용되는 에너지는 반으로 줄인 것이다. 이는 미국의 대두 농가들이 여타의 국가들과 달리 지속가능한 생산방식을 채택하고 있기 때문이다.200년 이상 가족농장을 운영하고 있는 윌리엄 맥네어 미국대두협회(U.S.SoybeanExportCouncil,이하USSEC) 이사는 “다른 국가에서 생산한 대두와 미국 대두의 가장 큰 차별점은 지속가능성”이라며 “농업인의 입장에서도 지속가능성이 중요하며 이것은 마케팅 요소나 유행이 아닌 다음 세대에 경작지를 물려줘야 하기 때문에 당연히 선택하는 가장 중요한 가치”라고 설명했다.2대가 대두와 옥수수를 경작하는 인디애나폴리스에 위치한 하웰농장은 여의도 네 개 면적의 대규모 농장이다. 미국의 명문 프린스턴 대학을 졸업한 아들 아담 하웰 씨가 가업을 물려받으며 하웰농장은 지속가능성에 더욱 골몰하고 있다.2세인 아담 하웰 씨는 “나는 물론 내 아이들까지도 원한다면 농장을 물려줄 생각으로 미래를 위한 지속가능한 농업을 실천하고 있다”며 “화학제품 등을 덜 쓰고 최소로 작업을 하는 무경운 농법 등 지속가능한 농업을 통해 환경은 물론 경영 효율개선에도 도움을 받고 있다”고 말했다,━세계가 주목하고 있는 ‘미국대두 지속가능성 인증 로고’미국대두협회는 미국 대두의 지속가능성을 보증하는 프로토콜(SSAP)을 통해 미국 대두의 지속가능성을 보존·관리하고 있다.SSAP는 미국 전역을 단위로 지속가능한 대두 생산을 검증하는 프로그램으로 제3자의 감사를 실시하는 종합적 접근법이다.SSAP를 통해 생산된 미국대두를 사용한 제품들에 한해 사용되는 미국대두 지속가능성 인증 로고(SustainableU.S.Soy,이하SUSS)는 현재 전 세계 900여 개의 제품에 사용되고 있다.SUSS로고는 대두유, 두부, 장류, 두유 등 대두 가공품 중 지속가능한 방식으로 생산된 대두를 60% 이상 사용했을 때만 부착할 수 있다.지속가능성에 역점을 두고 2020년 도쿄 올림픽을 치러냈던 일본의 경우SUSS로고를 가장 많이 활용하고 있는 국가다. 일본은 18개 이상의 기업이 주요 수입 식료품과 소비자 제품을 포함해 380개 이상의 제품에서SUSS로고를 사용하고 있다. 일본은 낫토, 두부, 두유 제품뿐 아니라 된장 등 다양한 제품에서SUSS로고를 사용하고 있다. 특히 올해부터 일본 최대 유통업체 중 하나인 세븐일레븐 자체 브랜드 제품에SUSS로고를 부착하기 시작해 향후SUSS로고의 활용도는 더욱 높아질 것으로 보인다.대만 역시 두부, 볶음 두부나 건두부 등 다양한 콩을 이용한 식료품에서 로고를 사용하고 있다.최근 우리나라에서도ESG경영이 화두로 떠오르면서 식품회사들의 지속가능성 전쟁이 시작됐다. 식품업계에서는 원료에서부터 지속가능한 방식으로 생산된 미국산 대두를 채택해SUSS로고를 받는 업체들도 늘어나고 있다. 선발 주자는 롯데웰푸드로 2021년 고올레산 대두유제품에 지속가능성 인증 로고를 사용한 바 있다.그 바톤을 이어받은 곳은 사조대림으로 지난해 지속가능한 식품 생산에 참여하며SUSS로고를 8가지 장류 제품에 부착했다. 1945년 서대양주식회사로 시작한 사조대림은 수산자원의 남획과 고갈로 대한민국에서 가장 먼저 ‘지속가능성’을 고민한 기업 중 한 곳으로 이미 2021년 식용유 투명페트병 적용을 시작으로 지난해 캔햄 제품의 플라스틱 캡을 모두 제거, 탄소줄이기에 동참하는 등 조용하지만 빠른 지속가능성을 실천하고 있다. 사조대림의 가장 큰 지속가능성 동참은 대표 장류 제품들에 미국산 대두를 사용,SUSS로고를 부착했다는 것이다. 국내에서 생산되는 두부와 장류의 원료가 대부분 수입산으로 그중에서도 사조대림은 지속가능성 인증을 받은 미국산 대두를 선택, 원료에서부터 지속가능을 실천하고 있는 것이다.김상훈 사조대림 사장은 “과거부터 ‘지속가능한 경영’을 목표로 달려온 사조대림은 미국대두협회의SUSS로고를 대표 식품들에 부착, 소비자들에게 지속가능의 가치를 전달하고자 한다”며 “우리 가족들이 먹는 것이라고 생각하고 식품을 생산하면서 우리 아이들이 살아갈 미래 사회를 위해 노력하는 것은 책무로 알고 기업의 미래를 만들어 가겠다”고 말했다."
