date,title,content
2023-11-02,혼인신고 21일뒤 부인 사망…'금오도 추락사' 남편 12억 받는다,"지난 2018년 12월 31일 오후 전남 여수 금오도 한 선착장 앞바다에 빠진 승용차 인양 모습. 차에 홀로 타고 있던 40대 여성이 숨졌다. 해경은 당시 보험설계사 남편이 보험금을 목적으로 재혼한 부인을 살해하려고 사고를 가장해 자가용을 바다에 빠트린 것으로 결론내렸다. 사진 여수해양경찰서부둣가에 기어 중립 상태로 정차한 자동차가 물에 빠져 탑승한 아내가 사망했다면 남편은 사망보험금을 받을 수 있을까.대법원 2부(주심 천대엽 대법관)는 2일 ‘전남 여수 금오도 사망사건’으로 알려진 익사 사건의 남편 A씨가 보험사 3곳을 상대로 낸 보험금 소송에서 A씨의 손을 들어준 원심을 확정한다고 밝혔다. A씨가 받을 수 있게된 보험금은 12억원에 달한다.━9월 인연, 10월 보험가입, 12월 혼인신고‧사망금오도 사망사건은 2018년 12월 31일 전남 여수 금오도 여천항에 중립기어 상태로 세워져있던 자동차가 굴러내려가 바다에 빠지면서, 차 안에 타있던 여성 B씨가 사망한 사건이다. B씨는 A씨의 아내로, 새해 일출을 보기 위해 함께 바닷가를 찾았다가 변을 당했다.A씨와 B씨는 만난 지 3개월만에 혼인신고를 한 부부 사이였다. A씨는 1988년부터 장의차, 레커차, 트레일러, 관광버스 등 각종 운전업무에 종사하다가 2018년 9월 보험설계사로 채용돼 일하던 사람이고, B씨는 A씨가 방문한 식당 주인이었다. 이들은 각자 여자친구, 남편이 있었지만 2018년 9월 말~10월 초 연인관계로 발전했고, B씨는 10월~11월에 걸쳐 총 12억원의 사망보험 3개에 가입했다. B씨는 12월 6일 남편과 이혼한 뒤 10일 A씨와 혼인신고를 했고, 13일 곧장 보험 3개의 수익자를 기존 ‘법정상속인’에서 ‘A씨’로 변경하고 18일 뒤 숨졌다.━1심 “확률 극히 낮다” 0원,  2심 “배제할 수 없다” 12억원대법원 전경, 뉴스1살인죄로 기소된 A씨는 1심에서 무기징역을 선고받았지만, 2심에서 ‘살인 무죄, 교통사고처리특례법상 과실치사 유죄’만 인정돼 금고 3년형을 받았고 2020년 9월 대법원에서 그대로 확정됐다. A씨는 살인 무죄가 확정된 뒤인 2020년 10~11월 메리츠화재해상보험을 상대로 10억원, 롯데손해보험에 1억원, 신협중앙회에 1억원의 보험금을 달라며 소송을 냈다.지난해 12월 1심 재판부는 “A씨가 고의로 이 사고를 발생시켰다는 점을 인정할 수 있는 고도의 개연성이 있다”며 보험사들의 보험금 지급의무가 면책된다고 보고 원고 패소 판결했다. 자동차가 자연스럽게 굴러떨어지기 위해서는 항구에서 특정 위치·특정 방향에 세워진 뒤 바퀴도 일렬로 정렬되어 있어야 하는데, 이 확률이 극히 낮다는 판단이다. 사망보험금을 최대한으로 늘려 보험 계약을 잇따라 체결한 것에 대해서도 “상당히 이례적인 부분”이며, “자녀들을 두고 보험수익자를 A씨로 변경한 경위도 납득하기 어렵다”고 평가했다. 사고가 우연히 발생했을 가능성은 극히 낮다고 본 것이다.그러나 지난 6월 2심 서울고등법원 민사13부(문광섭 부장판사)는 “우연히 사고가 발생했을 가능성을 배제할 수 없다”는 이유로 A씨가 청구한 보험금 12억원을 모두 줘야 한다고 판단했다. 여러 정황이 “고의로 이 사건 사고를 발생시켰을 개연성을 뒷받침하기는 하지만, A씨가 B씨를 살해했다고 인정하기엔 부족하다”는 것이다. 대법원은 2일 원심 판단에 잘못이 없다며 2심의 논리를 그대로 확정했다.보험사들은 “A씨가 보험금 부정취득을 목적으로 다수의 보험계약을 부정하게 체결했다” “보험계약 당시 입력한 정보가 거짓이다”며 상법상 계약취소 사유에 해당한다고 주장했다. 또 “A씨가 보험사 직원으로 이 사건 계약서를 거짓으로 쓴 과실이 있으니, 손해배상 책임과 상계해 보험금을 지급하지 않아도 된다”는 주장도 폈지만 모두 받아들여지지 않았다. 다만 소송을 처음 제기한 2020년을 기준으로 지연손해금을 지급하라고 한 2심의 계산 부분만 ‘2심 선고일인 2023년 6월 17일부터 계산하라’고 고쳐 선고했다."
2023-08-16,"보험사, 상반기 ‘5대 은행’만큼 벌었다…사회공헌 압박 거세질 듯","보험사들이 올해 상반기에 ‘5대 은행’만큼 순익을 거둔 것으로 나타났다. 보험업계에 대한 사회공헌 요구가 거세질 것으로 예상된다.16일 금융권에 따르면 올해 상반기 손해보험사와 생명보험사의 연결 기준 순이익은 8조여원으로 역대급 실적을 올린 것으로 분석됐다. 손해보험사가 4조6000여억원, 생명보험사가 3조4000여억원의 순이익을 냈다. 이는 5대 은행의 올해 상반기 순이익 8조969억원과 비슷한 수준이다.손보사의 경우 삼성화재의 상반기 순이익이 1조2176억원으로 가장 많았다. 이어DB손해보험(9181억원), 메리츠화재(8390억원), 현대해상(5780억원),KB손해보험(5252억원), 한화손해보험(1837억원),NH농협손해보험(1413억원), 롯데손해보험(1129억원) 순이었다. 생명보험 업계에서는 삼성생명의 상반기 순이익이 9742억원으로 가장 많았고 한화생명(7037억원), 교보생명(6715억원), 신한라이프(3117억원), 미래에셋생명(1987억원), 동양생명(1861억원),NH농협생명(1415억원)이 뒤를 이었다.그간 보험사들은 은행ㆍ카드사보다 사회 공헌에 상대적으로 인색했다는 비판이 적지 않았다. 금융당국의 ‘팔비틀기’가 작용했다지만, 은행권은 ‘이자 장사’ 논란이 일자 올해부터 3년간 10조 이상의 사회공헌 프로젝트를 추진하기로 했다. 카드사들도 이복현 금융감독원장의 방문을 계기로 소상공인과 취약 차주를 지원하기 위한 1조8000여억원 규모의 상생 금융 방안을 내놨다.반면 보험사의 경우 기존 사회공헌위원회 등을 통한 상생 금융 활동을 이어가는 데 그쳤다. 새로운 지원책은 한화생명이 ‘2030 목돈 마련 디딤돌 저축보험’을 내놓은 게 거의 유일하다. 은행ㆍ카드사가 기존 사회 공헌 외에 추가로 대규모 지원책을 내놓고 있는 것과 대비된다는 게 금융권에서 나오는 지적이다.이에 올해 자동차보험료 인하나 취약층을 위한 특별 보험 상품 출시에 대한 금융당국 등의 압박이 커질 전망이다. 올해 태풍과 폭우 속에서도 자동차보험 손해율이 양호한 데다, 역대급 실적까지 거둬 보험료를 하락 압박이 거세질 것으로 보이기 때문이다."
2023-07-14,"이번 집중호우로 침수차 437대…보험사, 긴급 견인 확대","올여름 장마로 발생한 침수 차량이 수백 대에 이르는 것으로 나타났다. 보험사는 견인 차량을 추가로 확보하는 등 비상 대응에 나섰다.14일 보험업계에 따르면 지난달 27일부터 이달 13일 오전 9시까지 삼성화재·현대해상·DB손해보험·메리츠화재·KB손해보험·롯데손해보험 등 손해보험사에 침수 피해 등으로 접수된 차량은 총 437대였다. 추정 손해액은 39억9700만원에 이른다. 특히 12일 오전부터 13일 오전까지만 80대가 넘는 차량이 폭우로 침수 피해를 봤다.폭우가 쏟아진 14일 오후 1시쯤 전북 김제시 백구면의 한 도로에서 차량 침수로 고립된 시민을 소방대원이 구조하고 있다. 전북소방본부=연합뉴스당분간 장마가 이어지며 전국에 비를 뿌릴 것으로 예상되는 만큼 앞으로 피해는 더욱 커질 수 있다. 지난해에도 중부 지방을 중심으로 집중호우가 내려 피해가 발생했다. 올해 손해보험사는 장마철이 시작되기 전부터 비상대응 체제를 가동해 왔다.우선 손해보험협회와 보험사는 지방자치단체와 함께 둔치 주차장 차량을 위한 알림 비상연락체계를 운영 중이다. 지자체 담당자가 한강 둔치 등 침수 우려 지역에 주차한 차량의 번호를 공유하면 보험사가 보험 가입 여부를 조회해 차주에게 긴급 대피를 안내하거나 견인 조치한다.집중호우 기간 보험사는 각각 비상팀을 운영하며 추가 인력과 차량 투입을 준비하고 있다.KB손해보험은 갑작스러운 집중호우로 출동 서비스가 급증하는 등 비상 상황이 발생하면 인력 투입을 늘려 비상캠프를 운영할 예정이다. 현대해상도 기상과 현장 상황에 대한 수시 보고 체계를 가동하고, 침수 피해 증가에 대비한 보상센터 연락망 업데이트, 침수차량 집결지 정비 등을 실시했다.보험사는 침수 위험 지역에 안내 문자나 알림톡을 활용해 예방 지원에도 참여 중이다.DB손해보험은 상습적으로 침수 피해가 있거나 집중호우 예상 지역에 거주하는 가입 고객에게 안내 문자를 발송하고, 상습 침수 지역에 대한 순찰을 강화하고 있다. 삼성화재는 차량 침수 피해를 줄이기 위해 집중호우로 인한 긴급상황이 발생했을 때 고객 동의를 받고 관공서와 공조해 침수 위험 차량을 안전한 곳으로 이동시키는 침수 예방 비상팀을 운영한다."
2023-05-05,"보험·인뱅, 10대~MZ세대 잡아라…시장 포화, 신규 고객 확보 차원","출생인구가 줄고 금융시장이 포화하면서 금융회사들이 신규 고객 확보를 위해 10대~MZ세대에 공을 들이고 있다.5일 금융권에 따르면 한화생명은 이달 1일 ‘한화생명 평생친구 어른이(어른+어린이)보험’을 출시했다. 생명보험업계에서는 최초로 기존 어린이보험의 최대 가입 나이(만 30세)보다 더 많은 만 35세까지 가입할 수 있게 했다.이에 앞서 롯데손해보험이 지난해 어린이보험 최대 가입 나이를 30세에서 35세로 늘렸고, 올해 3월KB손해보험의 ‘KB금쪽같은 자녀보험Plus’,4월DB손해보험ㆍ메리츠화재 등이 가입연령을 기존 0∼30세에서 0∼35세로 늘렸다.보험사들은 장기 보장성 시장이 포화인 상황에서 성장하는 어린이 보험의 수요층을 넓히기 위해 가입 연령을 확대하는 것으로 풀이된다. 어린이보험은 상대적으로 고객층의 가입 연령대가 낮고 장기간 유지하기 때문에 수익성이 높다. 보험업계에 따르면 메리츠화재ㆍ삼성화재ㆍ현대해상ㆍKB손해보험ㆍDB손해보험 등 5개사의 작년 어린이보험 원수보험료는 5조8256억원으로 2018년(3조5534억원) 대비 64% 늘었다. 올해 1분기 5개사 원수보험료는 1조5415억원으로, 이 추세가 이어진다면 올해 5개사 합산 보험료가 6조원을 돌파할 것으로 예상된다.보험업계 관계자는 “출생인구가 줄어 어린이 보험 가입 대상이 줄었다”며 “청년의 사회진출 연령이 높아지면서 과거보다 높은 연령대에서도 저렴하고 혜택이 많은 어린이보험에 대한 수요가 늘었다”고 설명했다. 다만 성인 가입자가 늘어남에 따라 어린이보험 손해율이 증가하면 결국 향후 기존 어린이 보험 고객의 보험료가 늘어나거나 혜택이 줄어드는 등 간접적인 피해가 생길 수 있다는 지적도 나온다.현대해상과 삼성화재는 어린이 보험 가입 나이를 확대하는 대신 2030세대를 위한 보험상품을 내놨다. 현대해상은 지난달 20ㆍ30세대에 특화해 가성비를 높인 ‘#굿앤굿2030종합보험’을 출시했다. 삼성화재는 30대 고객 전용 건강보험인 ‘내돈내삼’(내 돈으로 직접 가입하는 내 삼성화재 건강보험)을 출시했다.3일 강릉 안목해변을 찾은 수학여행단이 시원한 바닷바람을 맞으며 즐거운 추억을 만들고 있다. [연합뉴스]인터넷전문은행에선 10대 고객 확보에 적극적이다. 카카오뱅크가 운영하는 만 14∼18세 청소년 대상 선불전자지급 서비스인 카카오뱅크 미니(mini) 가입자 수는 지난달 말 기준 약 174만명을 기록했다. 카카오뱅크 미니는 2020년 10월 출시된 청소년 전용 선불전자지급서비스로, 최대 50만원 한도로 충전해 편의점, 배달음식 결제, 대중교통 이용 등에 사용할 수 있다. 2020년 말 59만명이던 가입자 수는 2021년 말 115만명, 지난해 말 161만명으로 가파르게 늘었다.카카오뱅크 김석 최고운영책임자(COO)는 지난 3일 1분기 실적발표 콘퍼런스콜에서 “3분기 미니 대상 고객을 확대해 더 많은 청소년에게 금융 생활을 제공할 것”이라고 밝혔다.토스의 어린이ㆍ청소년용 선불카드인 ‘유스카드’는 지난달 말까지 누적 발급량 107만장을 돌파했다. 토스가 2021년 12월 출시한 유스카드는 만 7∼16세 대상 충전식 카드다. 선불 전자지급 수단인 토스머니와 연동해 체크카드처럼 사용할 수 있다. 편의점CU에서 현금을 충전하는 방식으로도 이용할 수 있다. 만 7∼18세 토스 사용자는 지난달 말 194만명을 돌파했다."
2023-02-23,"고액 성과급 켕겼나…보험업계, 자동차 보험료 최대 2.5% 인하","고액 성과급 지급 논란 속에 주요 손해보험사들이 다음 주부터 자동차 보험료를 최대 2.5% 내리기로 했다.22일 보험업계에 따르면 메리츠화재는 오는 27일 책임 개시 건부터 개인용 자동차 보험료를 2.5% 인하한다.보험사 순이익 및 성과급KB손해보험은 오는 25일, 현대해상과DB손해보험은 오는 26일부터 개인용 자동차 보험료를 각각 2.0% 인하하고 삼성화재는 오는 27일 2.1% 내린다.롯데손해보험은 지난달 1일부터 개인용 자동차 보험료를 2%, 업무용은 5.6% 내렸다.2021년 말 기준 자동차 보험 가입 차량은 2400만대에 달하는 만큼 자동차 보험료는 국민의 일상생활에 밀접하게 연관돼 있다.손보사에 들어오는 자동차 보험료는 연간 20조원이 넘는다.손보사들은 지난해 4~5월에도 고물가에 따른 고객의 경제적 고통 분담에 동참하라는 정치권의 압박을 받고 자동차 보험료를 1.2~1.3% 내린 바 있다.손보사들은 지난해에 이어 이번 자동차 보험료 인하로 할 수 있는 최대한의 성의 표시를 했다는 분위기다.하지만 최근 은행 등의 ‘성과급 잔치’로 여론이 악화하면서 금융권에 대한 사회 공헌 요구가 커지는 데다 자동차보험 손해율도 개선된 만큼 연내 보험료를 더 내리는 방안이 검토될 가능성이 크다.31개 손보사는 지난해 6조여원에 달하는 순이익으로 역대 최고 실적을 거둬 수천억원의 성과급을 지급하고 있다.이와 관련, 금융위원회와 금융감독원 등 금융당국은 올해 자동차 보험료의 합리적 책정을 유도하면서 보험료 할인 및 할증 제도 개선 방안을 추진할 예정이다."
2023-02-22,"보험업계, 고액 성과급 논란 속 車보험료 최대 2.5% 인하","사진Pixabay고액 성과급 지급 논란 속에 주요 손해보험사들이 다음 주부터 자동차 보험료를 최대 2.5% 내리기로 했다.22일 보험업계에 따르면 메리츠화재는 오는 27일 책임 개시 건부터 개인용 자동차 보험료를 2.5% 인하한다.KB손해보험은 오는 25일, 현대해상과DB손해보험은 오는 26일부터 개인용 자동차 보험료를 각각 2.0% 인하하고 삼성화재는 오는 27일 2.1% 내린다.롯데손해보험은 지난달 1일부터 개인용 자동차 보험료를 2%, 업무용은 5.6% 내렸다.2021년 말 기준 자동차 보험 가입 차량은 2400만대에 달하는 만큼 자동차 보험료는 국민의 일상생활에 밀접하게 연관돼 있다.손보사에 들어오는 자동차 보험료는 연간 20조원이 넘는다.손보사들은 지난해 4∼5월에도 고물가에 따른 고객의 경제적 고통 분담에 동참하라는 정치권의 압박을 받고 자동차 보험료를 1.2∼1.3% 내린 바 있다.손보사들은 지난해에 이어 이번 자동차 보험료 인하로 할 수 있는 최대한의 성의 표시를 했다는 분위기다.하지만 최근 은행 등의 '성과급 잔치'로 여론이 악화하면서 금융권에 대한 사회 공헌 요구가 커지는 데다 자동차보험 손해율도 개선된 만큼 연내 보험료를 더 내리는 방안이 검토될 가능성이 크다.31개 손보사는 지난해 6조여원에 달하는 순이익으로 역대 최고 실적을 거둬 수천억원의 성과급을 지급하고 있다."
2023-01-26,"대형 손보 5개사, 다음달 말부터 車보험료 인하","대형 손해보험 5사가 다음달 말부터 일제히 자동차 보험료를 내린다.26일 손해보험업계에 따르면 삼성화재,DB손해보험, 현대해상,KB손해보험, 메리츠화재는 다음달 25~27일 책임개시 건부터 보험료를 2.0~2.5%를 인하할 예정이다.KB손해보험은 다음달 25일 개인용 자동차보험의 책임 개시 건부터 보험료를 2.0% 내린다.DB손해보험과 현대해상은 다음달 26일 개인용 자동차보험의 책임개시 건부터 각각 2.0%, 메리츠화재는 다음달 27일 책임 개시 건부터 2.5%를 인하한다. 삼성화재는 정확한 날짜를 공개하지 않았지만 이들 손해보험사와 유사한 시기에 개인용 자동차 보험료를 2.0% 내리기로 했다.손해보험사 관계자는 ""대형 손해보험사들을 중심으로 내달 말에 2% 정도 자동차 보험료를 내리기 시작하면 중소형 손해보험사들도 동참할 것으로 보인다""고 말했다.앞서 손해보험 중소형사인 롯데손해보험은 손해보험사 중 제일 먼저 지난 1일 개인용 자동차보험 책임개시 건부터 보험료를 2.0% 내린 바 있다."
2022-12-23,"[Biz & Now] 손보업계, 내년 자동차보험료 2.0~2.9% 내리기로","주요 손해보험사들이 내년도 자동차보험 보험료를 2%대 인하하기로 했다. 22일 손해보험업계에 따르면 삼성화재,DB손해보험, 현대해상,KB손해보험 등 대형 4사는 내년 개인용 자동차보험 보험료 인하율을 2.0%로 정했다. 5위권인 메리츠화재는 내년 보험료 2.5% 인하 방침을 결정했고, 롯데손해보험은 내년도 보험료를 2.9% 내리기로 했다."
2022-12-22,"내년 자동차보험료 최대 2.9% 내린다…""경제적 고통 분담""","자동차보험 자료사진. 사진 셔터스톡주요 손해보험사들이 내년도 자동차보험 보험료를 2%대 인하하기로 결정했다.22일 손해보험업계에 따르면 삼성화재,DB손해보험, 현대해상,KB손해보험 등 대형 4사는 내년 개인용 자동차보험 보험료 인하율을 2.0%로 정했다.전날KB손보와 현대해상이 2.0% 인하를 결정했고, 이날DB손보가 같은 수준의 보험료 인하 방침을 알렸다. 삼성화재와 한화손해보험도  인하율을 2.0%로 확정했다.메리츠화재는 2.5%, 롯데손해보험은 2.9% 내리기로 해 보험업계에서 인하 폭이 가장 컸다.보험업계는 고물가에 따른 고객의 경제적 고통 분담에 동참할 필요가 있다는 데 공감대를 형성했고 이것이 각사의 보험료 인하 결정으로 이어졌다고 설명했다.손보업계 관계자는 ""거리두기 종료로 교통량이 늘어난 데다 보험원가 상승이 예상되지만 최근 어려운 경제 여건과 고금리·고물가를 고려해 고객들의 경제적 부담을 분담하고자 인하를 결정했다""고 말했다.인하된 보험료는 대체로 내년 2월 말 이후 책임개시 계약부터 적용되며, 정확한 적용 시기는 회사에 따라 다를 수 있다.앞서 손보업계는 지난해 4∼5월에도 거리두기로 인한 교통량 감소와 법규 강화에 따른 사고 감소로 손해율이 개선된 점을 반영해 자동차 보험료를 1.2∼1.3% 인하한 바 있다."
2022-12-18,말 많던 보험료 조정…자동차 2% 내려가고 실손 9% 올라간다,"내년 자동차 보험료가 최대 2%대 내려갈 전망이다. 사진 셔터스톡내년 자동차 보험료는 최대 2%대 내려가지만, 실손보험은 최대 9%대까지 오를 전망이다.18일 보험업계 등에 따르면 삼성화재와 현대해상,DB손해보험 등 손해보험사들과 생·손보협회는 내주 자동차 보험료와 실손보험료 조정 결과를 단계적으로 내놓을 것으로 보인다.금융당국 관계자는 ""보험업계가 자율적으로 동참해 논의가 순조롭게 이뤄지고 있으며 내주 중후반쯤 자동차 보험료와 실손보험료 조정 폭이 나올 것""이라고 말했다.자동차 보험료의 경우 손해보험사들은 당초 1% 인하를 고려했으나, 국민의힘 등 정치권이 강력한 불만을 피력하자 삼성화재 등 대형사들도 동참해 최대 2%대까지 인하할 예정이다. 중형 손해보험사인 롯데손해보험과 메리츠화재는 각각 최대 2.9%와 최대 2.5%까지 인하하는 방안을 검토하고 있다.이들 손해보험사의 자동차 보험료 인하가 발표되면 준비 절차를 거쳐 내년 2월 가입 고객부터 순차적으로 적용될 예정이다.손해보험업계 관계자는 ""정치권의 압박이 거세 대형 손해보험사들도 자동차 보험료를 기존 방안보다 더 내리는 쪽으로 갈 수밖에 없는 상황""이라면서 ""손해보험사들이 보험료를 평균 2% 내외 인하할 것""이라고 전했다.실손보험 내년 인상률은 최대 9%대 수준으로 묶기로 했다. 사진 셔터스톡매년 2조원대 적자로 10%대 보험료 인상을 추진해오던 실손보험은 서민 생활의 부담과 물가 상승 우려를 반영해 내년 인상률을 최대 9%대 수준으로 묶기로 했다. 이 인상률은 내년 1월부터 곧바로 적용될 예정이다.실손보험은 보험을 든 고객이 병원 치료 시 부담한 의료비의 일정 금액을 보장하는 보험 상품으로, 가입자만 지난 3월 기준 3977만명에 달한다.하지만 과잉 진료 급증으로 1~4세대 실손보험의 손해율은 지난해 132.5%에 이어 올해는 120%대 중후반을 기록할 것으로 추정된다. 손해율이 100%를 넘는다는 건 보험사들이 실손보험에서 적자를 낸다는 의미다.실손보험료는 2017년 20.9% 인상된 뒤 2018년과 2019년엔 동결됐고 2020년에는 6∼7%, 지난해에는 10∼12% 올랐다.한 손해보험사 관계자는 ""역대급 수익을 내는 보험사들이 고객의 경제적 부담을 외면한다는 비난이 적지 않고 실손보험 또한 이런 상품을 설계한 보험사들의 잘못도 적지 않다는 비판도 있어 이런 분위기를 종합적으로 고려했다""고 덧붙였다."
