date,title,content
2022-12-08,정치권 압박에 차보험료 최대 2%대까지 인하 검토… 실손보험 두자릿수 인상도 어려울 듯,"내년부터 자동차 보험료를 최대 2%대까지 낮추는 방안이 검토되고 있다. 정치권이 고물가에 따른 서민의 고통을 덜어주자는 취지에서 보험료 조정에 제동을 걸고 있어서다.매년 2조원대 적자를 내는 실손보험 또한 두 자릿수 인상이 어려운 분위기다. 역시 정치권의 부정적인 분위기가 영향을 미치고 있다.사고 손상 차량 자동차사고. 사진pixabay8일 보험업계에 따르면 국민의힘 등 정치권이 최근 당정 협의 등을 통해 자동차 보험료 1%대 인하 추진에 대해 강한 불만을 피력하자 손해보험사들과 금융당국이 인하 폭 확대를 놓고 고심 중이다.자동차 보험료는 손해보험사들이 자율적으로 결정한다. 그러나 2000만명이 가입됐을 정도로 국민의 일상과 밀접하게 관련돼 있고, 물가에 대한 영향도 있어 금융위원회와 금융감독원이 업계와 협의를 통해 상생하는 방안을 도출해야 하는 상황이다.삼성화재와DB손해보험, 현대해상,KB손해보험 등 대형 4개사는 자동차 보험료의 1%대 인하를 추진하고 있지만, 롯데손해보험은 최대 2.9%, 메리츠화재는 최대 2.5%까지 인하하는 방안을 검토하고 있는 것으로 알려졌다.메리츠화재가 손해보험업계 5위라는 점을 고려하면 메리츠화재의 2%대 자동차 보험료 인하 추진은 대형 4개사에도 인하 폭을 2%대로 확대해야 한다는 압력으로 작용할 전망이다.보험업계 관계자는 “정치권의 기본 입장은 보험사가 최대 이익이 나는 상황에서 자동차 보험료를 1%대만 내려서는 안 된다는 것”이라면서 “자동차보험 손해율도 80%대 수준으로 양호하니 보험료를 2%대 수준까지는 인하해야 한다는 요구가 강하다”고 말했다.앞서 삼성화재 등 일부 손해보험사는 코로나19 장기화에 따른 차량 운행량과 사고의 감소로 자동차보험 손해율이 개선된 효과를 반영해 지난 4∼5월에 개인용 자동차 보험료를 1.2∼1.3% 내린 바 있다.10%대 보험료 인상을 추진해오던 실손보험은 서민 생활의 부담과 물가 상승 우려로 두 자릿수 인상이 쉽지 않은 상황이다.실손보험은 보험을 든 고객이 병원 치료 시 부담한 의료비의 일정 금액을 보장하는 보험 상품으로, 가입자만 지난 3월 기준 3977만명에 달한다.하지만 과잉 진료 급증으로 1~4세대 실손보험의 손해율은 지난해 132.5%에 이어 올해는 120%대 중후반을 기록할 것으로 추정된다. 손해율이 100%를 넘는다는 건 보험사들이 실손보험에서 적자를 낸다는 의미다.보험사의 실손보험 적자 규모는 2020년 2조5000억원, 지난해 2조8000억원을 기록했고 올해도 2조원대 적자가 우려되는 상황이다.실손보험료는 2017년 20.9% 인상된 뒤 2018년과 2019년엔 동결됐고 2019년과 2020년에는 6~7%, 지난해에는 10~12% 올랐다.한 손해보험사 관계자는 “실손보험료 인상률이 손해율에 반드시 비례해서 가는 건 아니다”라면서 “정치권에서 10%대 인상에 부정적이어서 두 자릿수 인상은 쉽지 않은 분위기”라고 말했다."
2022-12-09,"성일종 ""빅4 손해보험사, 자동차보험료 인하 동참해야""","성일종 국민의힘 정책위의장이 9일 서울 여의도 국회에서 열린 원내대책회의에서 모두 발언을 하고 있다. 뉴스1성일종 국민의힘 정책위의장은 일부 손해보험사들의 자동차보험료 인하 움직임을 거론하며 '빅4 손해보험사'에 자동차보험류 인하 동참을 촉구했다.성 의장은 9일 원내대책회의에서 ""시장의 85%를 차지한 '빅4 손해보험사'는 자동차보험료 인하에 대해 특별한 입장을 내놓지 않고 있다""며 ""업계 5위권인 메리츠화재가 자동차보험료를 최대 2.5%, 롯데손해보험은 2.9% 수준으로 인하할 것을 적극 검토하고 있다고 한다""고 밝혔다.성 의장이 지목한 '빅4 손보사'는 업계 1위 삼성화재를 비롯해 현대해상,DB손해보험,KB손해보험이다. 시장에선 이들 손보사가 사실상 자동차보험료의 가격 결정권을 주도한다고 보고 있다.성 의장은 ""대부분의 국민이 자동차를 소유하고 있고, 자동차보험을 필수로 들어야 하는 상황에서 자동차보험료 인하는 민생 부담 완화에 중요한 부분""이라고 강조했다.그러면서 보험료 인하 방침을 밝힌 메리츠화재 등에 대해 ""당의 자동차보험료 인하 요청에 공감하고, 국민 고통 분담에 동참해 주신 손보사에 감사의 말씀을 드린다""고 말했다.이어 ""국민이 자동차보험에 대한 부담을 덜고 가계 주머니에 조금이나마 희망이 깃들 수 있도록 더 많은 손해보험사가 동참해 주시기를 다시 한번 요청한다""고 촉구했다."
2022-04-19,"보험료 낮추고, 지급은 빨리…'부실 논란' 환경책임보험 바뀐다","지난 2012년 경북 구미 화공업체에서 발생한 불산가스 누출 당시 상황. 가스가 순식간에 누출되면서 작업자를 뒤덮고 있다.  [연합뉴스]부실 운용 논란을 빚은 환경책임보험이 오는 6월부터 대폭 개선된다. 환경부는 20일DB손해보험 컨소시엄과 새로 개편한 3기 환경책임보험사업 약정을 체결하고, 향후 2년간(올해 6월~2024년 5월) 운영을 맡긴다고 밝혔다.2012년 경북 구미 불산가스 유출 사고를 계기로 6년 전 도입한 환경책임보험은 각 기업이 혹시 모를 대형 환경사고에 대비해 의무 가입하는 정책보험이다. 유해 화학물질 배출 가능성이 있는 사업장 약 1만5000곳이 대상으로, 민간 보험사가 운용을 담당한다. 최근 4년간(2016년 7월~2020년 5월) 기업들이 납부한 누적 보험료만 3290억원에 달한다.하지만 지난해 국정감사에서 보험사 과다이익, 보험금 지급 장기화, 보상 실적 저조 같은 문제점들이 쏟아졌다. 환경책임보험 담당 보험사들이 수백억 원의 수익을 거둔 반면, 사고에 대한 신속한 피해 배상과 지속가능한 경영 보장이란 도입 취지가 흐려졌다는 지적이 나왔다. 당시 국감에서 노웅래 더불어민주당 의원은 ""당초 취지에서 벗어나 기업들 보험료로 민간 보험사 배만 불리고 있다""고 밝혔다.지난해 12월 여수국가산업단지 내 화학물질 제조공장이 폭발하면서 화재가 발생한 현장에서 소방관들이 폭발한 탱크를 식히는 작업을 하고 있다. 뉴스1이에 따라 환경부는 지난해 말부터 환경책임보험 제도를 본격적으로 손질하고 나섰다. 개정 작업을 거쳐 6월부터 새로 적용할 보험 약정에 따르면 보험사가 사고 보험금을 지급하고 남은 보험료를 공공자금인 환경오염피해구제계정에 적립하게 됐다. 평상시 사고 발생률이 낮지만, 대형 사고가 발생하면 한꺼번에 많은 재정이 투입되는 환경 오염 피해 특성을 감안해 보험사 측 과다이익을 공적 용도로 모아놓는 것이다.보험금 지급 시기는 대폭 빨라진다. 사고 신고가 접수되면 보험사가 한 달 내에 손해 사정을 실시해 보험금 지급 여부를 결정해야 한다. 지금까진 사고 조사 기간이 발생일로부터 평균 482일에 달할 정도로 느렸지만, 이를 대폭 앞당긴 것이다. 결정 후엔 7일 내로 보험금을 지급해야 한다.손해 사정 업무엔 한국환경산업기술원 등이 참여하면서 공정성도 강화됐다. 피해자나 피보험자가 보험금에 이의를 제기할 때는 전문가, 관계기관 등으로 구성된 사고보상협의회(5명 이상 구성)가 보험금을 재검토한다. 이에 따라 사고 보험금을 받는 기업이 늘어날 것으로 보인다.반면 기업들의 재정 부담은 한층 낮아진다. 영세한 위탁처리·소규모 사업장 등에 적용되는 최저보험료(연간)는 기존 10만원에서 1만5000원으로 인하된다. 전체 사업장 기준 보험료율도 평균 24% 낮아질 예정이다.향후 2년간 보험을 운용할 새 사업자는DB손해보험이 대표 보험사를 맡고, 농협손해보험·AIG손해보험·메리츠화재해상보험·롯데손해보험이 참여하는 식이다. 이들 회사가 보험 약정을 성실하게 이행하지 않으면 환경부에서 약 8억4000만원 이하의 위약금도 새로이 부과할 수 있다. 정부의 관리·감독이 강화된다는 의미다.박용규 환경부 환경보건국장은 ""이번 제도 개선으로 기업들은 보험료 부담이 줄고, 보험사는 안정적으로 보험을 운영할 수 있다. 정부도 대형 환경사고에 더 잘 대비할 수 있게 됐다""라고 밝혔다."
2022-06-22,"사모펀드의 100대 기업 보유지분, 10년간 7.2%p 늘어나","10년 전보다 사모펀드와 국민연금이 보유한 대기업의 지분은 늘고 오너의 지분은 줄어든 것으로 조사됐다.전경련. 중앙포토전국경제인연합회(전경련)가 22일 공개한 '2011년 대비 2021년 자산 100대 기업 주요 주주 지분 변동 조사'에 따르면 100대 기업의 지분을 5% 이상 보유한 주요 주주의 지분을 조사한 결과 사모펀드의 보유 지분이 2011년 평균 14.4%에서 2021년 21.6%로 7.2%포인트(p) 늘어났다.같은 기간 국민연금의 지분도 7.4%에서 8.7%로 1.3%p 높아졌다. 반면 오너 지분은 43.2%에서 42.8%로 0.4%p 낮아졌다. 2021년 기준 사모펀드나 자산운용사 등이 최대 주주인 6개사의 경우 최대 지분이 2011년 43.6%에서 2021년 60.0%로 16.4%p 늘었다.이를 두고 전경련은 정부가 기업 인수합병(M&A)과 자금조달을 활성화한다는 명목으로 사모편드 규제를 완화하면서 금융자본의 기업경영 참여가 늘어난 것이라고 해석했다.2011년과 2021년 최대주주 평균 지분 변동 [제공 전경련]국민연금 또는 정부가 최대 주주인 기업도 최대 주주의 보유지분이 같은 기간 각각 1.4%p,0.6%p 늘어났다. 반면 최대 주주가 오너인 기업의 경우는 같은 기간 최대 주주의 지분이 2011년 43.2%에서 42.8%로 0.4%p 낮아졌다.전경련은 사모펀드가 기업의 협력 파트너에서 경영권 위협 세력으로 변모할 수 있다고 주장했다. 전경련에 따르면 지난 10년간 조사대상 100곳 중 경영권이 변경된 기업은 모두 10곳으로 이 중 4곳(롯데손해보험, 유안타증권, 대우건설,SK증권)을 사모펀드가 인수했다.교보생명과 어피니티컨소시움과의 분쟁에서 보듯 초기엔 재무 투자자로서 경영자에게 우호적이다가 주주 간 계약을 빌미로 경영권을 위협한 사례가 나오고 있다고 전경련은 밝혔다.특히 정부가 사모펀드에 대해 투자대상 기업의 의결권 있는 주식을 10% 이상 취득한 뒤 6개월 이상 보유하도록 하는 자본시장법상 '10% 보유의무 룰'을 지난해 폐지하면서 이런 경향이 심화할 것이라고 전경련은 예상했다.유환익 전경련 산업본부장은 ""정부가 자본시장법 시행령을 개정해 국민연금이나 사모펀드의 기업경영 참여를 유도하고 있으나 차등의결권과 같은 경영권 방어 수단이 필요하다는 기업의 의견은 외면하고 있다""며 ""대등한 경쟁을 위한 제도적 개선이 필요하다""고 주장했다."
2024-12-12,개인정보 ‘꼼수 수집’ 손해보험사 4곳에 과징금 92억원,"현대해상화재보험 누리집 갈무리고객 개인정보를 ‘꼼수’로 수집한 뒤 이를 마케팅에 활용한 주요 자동차 손해보험사들이 과징금 92억여원을 물게 됐다.개인정보보호위원회는 12일 전날 전체회의에서 개인정보보호법을 위반한 현대해상화재보험과 악사(AXA)손해보험 등 12개 손해보험사에 과징금 및 시정명령 처분을 의결했다고 밝혔다.개보위 제재 대상에 포함된 손해보험사는 현대해상화재보험, 악사손해보험, 하나손해보험, 엠지(MG)손해보험, 롯데손해보험, 삼성화재해상보험, 디비(DB)손해보험, 케이비(KB)손해보험, 메리츠화재해상보험, 한화손해보험, 흥국화재해상보험, 캐롯손해보험 등이다.개보위는 조사 결과 현대해상화재보험, 악사손해보험, 하나손해보험, 엠지손해보험 등 4개 기업에 92억770만원의 과징금을 부과했다. 이들 업체는 상품 소개를 위한 동의란에 ‘미동의’ 의사를 표시한 이용자들을 상대로 선택 변경을 유도하는 팝업창(재유도 팝업창)을 운영했다. 하지만 팝업창에 ‘상품 소개 항목에 동의’라는 모호한 문구만 기재했기 때문에 고객들은 마케팅 활용을 위한 개인정보 제공·수집 등에 동의한다는 걸 제대로 알 수 없었다. 그 결과 이용자가 재유도 팝업창에서 ‘확인’(동의) 버튼을 누르면, 개인정보 수집·이용뿐만 아니라 개인정보의 제3자 제공 및 광고성 정보 수신을 모두 승인한 것으로 처리됐다.현대해상화재보험, 악사(AXA)손해보험, 하나손해보험, 엠지손해보험 등 4개 업체가 고객 개인정보를 ‘꼼수’로 수집하기 위해 운영한 동의 변경 재유도 팝업창. 개인정보보호위원회 제공4개 손해보험사가 이런 방식으로 재유도 팝업창을 운영하는 동안 이용자의 마케팅 동의율은 최대 30%포인트(31.42%→61.71%) 급증했다. 보험사가 수집한 고객 개인정보는 자동차보험뿐만 아니라 운전자보험, 건강보험, 치아보험 등 해당 업체의 다른 보험 마케팅에도 활용됐는데, 개보위는 이 과정에서 회사 개인정보보호책임자(CPO)의 검토 등 내부 통제가 제대로 작동하지 않은 점도 확인했다.또 이들 4개 업체를 포함한 12개 보험사는 ‘자동차 보험료 계산 서비스’를 제공하면서 이용자의 이름, 주민등록번호, 휴대전화번호를 수집했다. 이들 보험사들은 고객이 보험료 계산을 중단하거나 계산 뒤 계약을 체결하지 않은 경우에도 법적 근거 없이 수집한 개인정보를 1년간 보유해 개보위의 시정명령 처분을 받았다. 1년 넘게 이용자 정보를 파기하지 않은 롯데손해보험의 경우 과태료 540만원이 부과됐다.개보위는 “적법한 동의를 받기 위해서는 정보 주체에게 명확히 알리고 자유롭게 결정권을 행사하도록 해야 한다”며 “개인정보보호책임자는 개인정보 유출 방지를 위한 안전 조처와 함께 적법한 개인정보 처리를 위한 내부통제시스템 구축해야 한다”고 했다."
2024-12-30,"미니보험, 3천원으로 닌텐도 수리비 보장받자","세상 쓸모있는 경제 정보1290원으로 책 읽다 생긴 ‘질환’도 보장게티이미지뱅크“엄빠차 빌려 타다 사고 나도 완벽하게 수습하는 법”(롯데손해보험 운전자 보험)“플렉스한 가전제품 보호하는 방법”(롯데손해보험 가전제품 수리 보험)보험사들이 청년층 소비자를 잡기 위해 미니보험(소액단기보험)을 속속 내놓고 있다. 보장 범위나 보험기간이 일반적인 보험에 비해 적은 만큼 보험료가 1만원 내외로 저렴하다. 기존 보험보다 상품 구조가 단순하고 무진단·무심사로 곧바로 가입할 수 있다.롯데손해보험은 미니보험에 가입할 수 있는 플랫폼 ‘앨리스(alice) 보험’을 운영하고 있다. 앨리스에서는 산후우울증 등으로 건강관리에 어려움을 겪는 여성을 위한 ‘마이팜 알파맘보험’,노트북·태블릿·스마트워치·플레이스테이션·닌텐도 등의 고장이나 파손 때 수리비를 최대 5년까지 보장하는 ‘안심가전보험’ 등에 가입할 수 있다. 보험료는 적게는 1천원부터 최대 1만원대로 저렴한 편이다. 각 보험에는 “내 가족의 행복한 삶을 지키는 방법”, “영끌한 내 재산 애프터서비스 연장법” 등 보험에 대해 쉽게 알 수 있도록 직관적인 문구가 붙었다.(한겨레 ‘오늘의 스페셜’ 연재 구독하기)엔에이치(NH)농협생명의 미니보험 가운데서는 ‘검진쏘옥엔에이치용종진단보험’과 ‘환경쏘옥엔에이치이(e)독감케어보험’이 인기다. 각각 3대 기관(위·십이지장·대장) 용종 진단 시 보험금 10만원, 독감 진단 후 항바이러스제 처방 때 보험금 20만원을 지급하는 상품이다. 보험료는 적게는 600원에서 많게는 몇천원이다.특정한 취미에 특화된 보험도 있다. 한화손해보험은 골프를 좋아하는 청년 세대를 위해 ‘한화백돌이홀인원보험’을 선보였다. 골프를 즐기던 중 사고 등으로 부상을 입은 경우 보장하는 보험인데 한번 가입으로 최대 10년까지 보장받을 수 있다. 골프장 방문 때 매번 가입할 필요가 없다는 것이 장점이다. 보험료도 월 2000~3000원대 수준으로 저렴하고, 홀인원 때 100만원을 받는 특약도 추가할 수 있다.캐롯손해보험은 축구·테니스·낚시·골프·등산·달리기 등 18가지 레저 활동 중에 발생하는 사고를 보장하는 ‘스마트온(ON)레저상해보험’을 판매하고 있다. ‘오전 9시부터 오후 2시까지 등산’ 등 보장 종목과 시간을 입력하면 된다. 하루에 여러 종류의 레저활동을 해도 모두 보장된다. 취미활동을 위해 차로 이동하는 경우에 발생한 상해도 보장된다. 1회 보험료는 946원부터 시작한다.미니보험은 구조가 단순한 만큼 트렌드에 맞춰 빠르게 상품을 선보일 수 있다는 점도 특징이다. 지난달 교보생명은 한강 작가의 노벨문학상 수상 뒤 불어닥친 ‘독서 열풍’에 발맞춰 책을 읽다가 겪을 수 있는 각종 질환을 보장하는 ‘교보e독서안심보험’을 선보였다. 안구·근육·관절장애나 척추 관련 질환을 보장한다. 이러한 질환을 진단받고 치료 목적으로 수술받는 경우 연간 1회에 한해 수술보험금을 10만원(가입금액 1000만원 기준 수술 1회당)까지 지급한다. 보험료는 40살 남성을 기준으로 1회 1290원 수준이다. 기프티콘을 자주 주고받는 청년층 소비 습관에 맞게 보험을 타인에게 선물하는 것도 가능하다. 삼성 마음모아 미니생활보험, 미니독감보험 등은 이름과 성별만 알면 최대 30명에게 보험을 선물할 수 있다.보험사들이 미니보험에 집중하는 이유는 미래 고객을 잡기 위해서다. 미니보험은 핵심보장만 제공해 일반적인 보험보다 상품 구조 이해가 쉽고 가입 과정도 간단하다. 이를 통해 보험 접근 문턱을 낮추겠다는 것이다. 보험사 관계자는 “미니보험은 보험료가 저렴해 보험사로서 실익이 없는 편이다”라며 “저렴한 비용으로 보장된다는 긍정적인 인식을 청년층에게 심어준다면 향후 다른 보험 상품으로 가입이 이어질 것으로 기대하고 있다”고 말했다."
2022-12-22,내년 자동차보험료 2%대↓…DB손보 2.0%↓∙롯데손보 2.9% ↓,"손해보험사들이 연달아 자동차보험료 2%대 인하를 발표했다. 연합뉴스디비(DB)손해보험과 롯데손해보험 등도 자동차보험료 2%대 인하 행렬에 동참했다. 주요 보험사들은 올해 상반기 보험료 인하에 이어 내년 초에도 2%대 인하를 약속했다.디비손보는 22일 개인용 자동차보험료를 2% 인하하기로 했다고 밝혔다. 내년 2월26일부터 1인당 보험료는 평균 1만7000원정도 낮아지게 된다. 디비손보 관계자는 “코로나19 방역 완화로 사고율이 증가하고 정비요금도 오르는 등 보험원가가 오를 것으로 보이지만, 고물가에 따른 국민 고통을 분담한다는 차원에서 자동차 보험료를 인하하기로 했다”고 말했다. 롯데손보도 이날 자동차보험료를 2.9% 인하하고 내년 1월1일부터 적용한다고 밝혔다. 삼성화재는 자동차보험료를 2% 인하할 것으로 알려졌다. 앞서 케이비(KB)손보와 현대해상은 지난 21일 자동차보험료를 2% 인하한 바 있다.손보사(자동차보험 판매사 11곳, 캐롯손보 제외)의 올 1~11월 누계 평균 손해율은 85.2%다. 자동차보험 손해율은 발생손해액을 경과보험료로 나눈 비율로 수치가 낮으면 보험사 손해가 적다는 의미다. 보험업계에서는 적정손해율을 80%가량으로 보고 있다. 삼성∙현대·디비∙케이비 등 손해보험사 ‘빅4’의 평균 자동차보험 손해율은 79.6%다."
2024-08-15,"“10대 손해보험사 금융배출량, 연간 국내 온실가스 배출량의 4%”","기후솔루션 분석기후솔루션, 경남환경운동연합 등 국내 환경단체 활동가들이 지난 2월29일 서울 종로구 세종문화회관 계단에서 세계 보험사의 기후 대응을 촉구하는 ‘세계 액션 주간’ 퍼포먼스를 하고 있다. 연합뉴스국내 10대 손해보험사의 금융배출량이 연간 국내 온실가스 배출량의 4%를 차지한다는 환경단체 분석이 나왔다. 승용차 565만대의 연간 배출량에 해당하는 규모다.비영리 환경단체 기후솔루션은 국내 10대 손해보험사(삼성화재·디비(DB)손해보험·현대해상·메리츠화재·케이비(KB)손해보험·한화손해보험·롯데손해보험·흥국화재·농협손해보험·하나손해보험)의 금융배출량을 산출한 결과 연 2600만톤에 이른다고 15일 밝혔다. 이같은 규모는 국가 온실가스 배출량(2021년 기준)의 4%에 해당하는 양으로, 국민연금이 투자한 국내 주식자산의 금융배출량(2600만톤)과 비슷한 수준이다.금융배출량은 금융회사가 화석연료 등 관련 산업에 투자하거나, 이러한 산업에 금융상품을 제공하면서 간접적으로 발생하는 온실가스 배출량을 의미한다. 온실가스를 배출하는 기업에 얼마나 투자했는지 등을 합산해 계산한다.또 10대 손해보험사의 ‘보험배출량’은 최근 4년간(2020~2023) 연평균 40만톤 수준이다. 디비손보가 13만3778톤으로 가장 많고, 삼성화재(9만5922톤), 케이비손보(5만3822만톤), 현대해상(3만9154톤), 메리츠화재(3만5843톤) 등이 뒤를 이었다. 보험배출량은 보험사가 보험을 판매한 석탄화력발전소의 온실가스 배출량만 토대로 집계한 것으로 금융배출량보다는 범위가 좁다.고동현 기후솔루션 기후금융팀장은 “국내 손해보험사들은 기후위기를 가속화시키면서, 그로 인해 손실 위험도 커지는 악순환에 빠져들고 있다”며 “석탄발전에 대한 운영보험 중단을 시작으로, 화석연료 산업에 대한 투자와 보험 판매를 줄여가야 한다”고 말했다."
