date,title,content
2024-11-29,[경제계 인사] 롯데웰푸드 외,▲롯데웰푸드▷전무 배성우▷상무 진헌탁 최인태 최호형 ▲롯데칠성음료▷상무 정용주 ▲롯데지알에스▷상무 이승주 ▲롯데상사▷상무 이세호 ▲롯데쇼핑◇백화점사업부▷전무 김원재▷상무 강우진 윤우욱 정동필◇마트사업부▷상무 신수경 ▲코리아세븐▷상무 문대우 ▲롯데하이마트▷상무 김보경 ▲한국에스티엘▷전무 김진엽 ▲에프알엘코리아▷전무 정현석 ▲롯데케미칼◇기초소재사업▷상무 권조현 김해철 유승용 윤종규◇첨단소재사업▷상무 권기혜 이한수 ▲롯데정밀화학▷상무 윤희용 ▲롯데이네오스화학▷상무 성규철 ▲LCTitan▷상무 장선표 ▲롯데엠시시▷상무 이태환 ▲롯데알미늄▷상무 정창명 ▲호텔롯데▷상무 권정근 ▲롯데건설▷전무 고용주▷상무 강민종 차길봉 한정호 홍상균 ▲롯데렌탈▷전무 김경봉▷상무 이광호 이규필 ▲롯데이노베이트▷전무 김경엽▷상무 이원종 ▲롯데글로벌로지스▷상무 권순근 ▲롯데물산▷상무 신창훈 ▲캐논코리아▷상무 전형준 ▲롯데미래전략연구소▷상무 이승환 ▲롯데바이오로직스▷상무 임태형 ▲롯데지주▷부사장 임성복▷전무 김동하 박왕근 최영준▷상무 변영오 심형섭 장병철▲효성굿스프링스▷부사장 김태형 ▲㈜효성▷전무 이태근 이반석 김용근▷상무A 정성훈▷상무B 정홍주 조부영 ▲효성티앤씨▷전무 안준모 이인덕▷상무A 손해성 장기수 김성수 유소라 유상훈▷상무B 전신우 엄기용 이현호 ▲효성화학▷전무 조성민▷상무A 차경용 김후원 ▲효성중공업▷전무 한상태 이창호▷상무A 이해정 이주은 조현철▷상무B 정재훈 박성원 ▲효성티앤에스▷상무A 이훈 정상윤 김건오▷상무B 차진환
2024-11-01,롯데웰푸드 3분기 영업이익 760억원…작년보다 5.7% 줄어,서울의 한 대형마트에 진열된 롯데웰푸드 제품의 모습. /뉴스1롯데웰푸드는 올해 3분기 연결기준 1조 785억원의 매출을 거뒀다고 1일 공시했다. 이는 전년 동기 대비 0.7% 감소한 수치다. 영업이익은 5.7% 줄어든 760억원을 기록했다.국내 사업의 매출은 1.7% 감소했다. 식자재 채널 합리화 등 영업구조 개선 활동의 영향을 받았다. 최근 급등한 카카오 가격의 여파로 영업이익도 1.4% 줄었다.글로벌 사업은 전체 매출이 4.4% 늘었다. 파이와 캔디류가 포함된 인도 건과 부문의 성장이 카자흐스탄 등지에서의 부진을 덜어냈다. 다만 글로벌 사업 역시 카카오 원가 부담의 영향으로 영업이익이 22.9% 낮아졌다.
2024-11-28,"롯데 계열사 대표 18명 교체, 전체의 31%... 3세 신유열 부사장 승진 [명단]","롯데그룹이 28일 정기 임원인사를 단행했다. 신동빈 회장의 장남이자 롯데그룹 3세인 신유열 미래성장실장이 부사장으로 승진했다.롯데는 이날 롯데지주 포함 37개 계열사 이사회를 열고 2025년 정기 임원인사를 단행했다고 밝혔다. 임원인사 결과 롯데그룹 전체 임원 규모는 지난해 말 대비 13% 줄었으며, 58개 계열사 가운데 18개 계열사의 대표이사를 교체했다.그룹 차원의 체질 개선과 쇄신을 위해 임원 22%가 퇴임했다. 그 결과 임원 규모는 지난해 말 대비 13% 축소됐다. 코로나 시기인 2021년 임원인사보다 더욱 큰 폭이다.신유열 전무, 부사장 승진신동빈 회장의 장남인 롯데지주 미래성장실장 신유열 전무는 부사장으로 승진하며 경영 전면에 나선다. 신 부사장은 롯데지주 미래성장실장과 롯데바이오로직스 글로벌전략실장을 겸임했다. 올해 본격적으로 신사업과 글로벌사업을 진두지휘할 예정이다. 바이오CDMO등 신사업의 성공적 안착과 핵심 사업의 글로벌 시장 개척을 본격적으로 주도할 전망이다.신유열 롯데지주 미래성장실장 /롯데신 부사장은 2022년 롯데스트레티직인베스트먼트(LSI) 대표이사, 롯데파이낸셜 대표이사 등 투자 계열사 대표직을 역임했다. 롯데케미칼 동경지사, 롯데지주 미래성장실, 롯데바이오로직스 글로벌전략실 등에서 근무했다.‘비상경영’ 롯데, 대표이사 31% 교체롯데는 이번 인사에서 경영 체질을 근본적으로 바꾸고 성과에 대한 엄정한 책임을 묻는데 집중했다고 밝혔다. 그 결과 전체 58개 계열사 가운데 31%(18명)의 대표이사가 교체됐다. 실장까지 포함하면 교체된 전체CEO는 21명이다. 앞서 롯데는 지난 8월 비상경영에 돌입했다.롯데 화학군은 총 13명의CEO중 지난해 선임된 롯데알미늄, 롯데에너지머티리얼즈,LCUSA의 대표를 제외한 10명이 교체된다. 롯데 화학군HQCTO(기술전략본부장) 황민재 전무가 부사장으로 승진해 롯데케미칼 첨단소재 대표이사로, 롯데이네오스화학 대표이사 정승원 전무가 부사장으로 승진해 롯데정밀화학 대표이사로 기용됐다. 롯데 측은 “내부에서 검증된 인재들을CEO로 인선해 롯데 화학군의 사업 혁신을 선도하고 조직의 변화를 이끌겠다”고 밝혔다.롯데 화학군은 임원도 큰 폭으로 세대교체가 이뤄졌다. 약 30%에 달하는 롯데 화학군 임원들이 퇴임한다. 특히 60대 이상 임원의 80%가 경영 일선에서 물러난다. 롯데 측은 “롯데 화학군의 대대적인 쇄신을 위한 인사 조치”라고 밝혔다.호텔롯데는 법인내 3개 사업부(롯데호텔, 롯데면세점, 롯데월드) 대표이사가 전부 물러났다. 롯데면세점은 롯데지주HR혁신실 기업문화팀장 김동하 상무가 전무로 승진해 신임 대표이사로, 롯데월드는 권오상 신규사업본부장 전무가 신임 대표이사로 내정됐다.롯데월드타워 전경/롯데그룹 제공김동하 전무는 1997년 롯데웰푸드(옛 롯데제과)로 입사 후 롯데 정책본부 개선실, 롯데슈퍼 전략혁신부문장 등을 역임했으며, 2022년부터 롯데지주 기업문화팀장을 맡아 그룹 노무와 생산성 관리를 책임졌다. 앞서 롯데면세점은 올해 6월 비상경영체제를 선포했다.권오상 전무는 1994년 롯데백화점으로 입사한 뒤 2013년부터 12년간 롯데월드의 전략 · 신사업 · 마케팅 · 개발 등을 책임져 온 테마파크 전문가다. 최근에는 롯데월드의 글로벌 사업 확장을 위해 베트남과 동남아 현지에 맞는 비즈니스 모델을 직접 기획, 추진해왔다.롯데지주 이동우 부회장을 비롯해 롯데 식품군 총괄대표 이영구 부회장과 롯데 유통군 총괄대표 김상현 부회장 및 주요 식품 · 유통 계열사의CEO는 유임된다. 롯데지주 이동우 부회장은 위기 관리를 총괄하며 그룹의 변화 방향과 속도를 점검하게 됐다. 롯데 식품군과 유통군은 현재 추진하고 있는 사업 전략의 일관성을 유지하되, 올해 중 가시적 성과를 내기 위해 사업실행력을 높인다는 방침이다.롯데지주에서는 경영혁신실장 노준형 부사장이 사장으로 승진했다. 또 롯데지주의 경영혁신실과 사업지원실이 통합돼 그룹사 비즈니스 구조조정과 혁신의 중심축 역할을 수행하게 됐다. 롯데 측은 “롯데그룹 전반의 사업 포트폴리오를 조정하고, 강력한 혁신 드라이브를 추진하고자 한다“며 “신규 조직은 노 사장을 중심으로 그룹 컨트롤타워 역할을 강화해 각 계열사 혁신을 가속화해 나갈 계획”이라고 밝혔다.1968년생인 노 사장은 2002년 롯데이노베이트(옛 롯데정보통신)에 입사 후 경영지원부문장, 전략경영본부장 등을 역임했다. 2021년 대표이사에 부임한 뒤 메타버스, 전기차 충전, 자율주행 등의 신사업과 그룹IT·DT사업을 주도했다. 노 사장은 전략 · 기획 · 신사업 전문가로 기존 사업의 역량 제고 및 그룹의 사업 포트폴리오를 고도화할 적임자로 평가받아 2023년부터 롯데지주 경영혁신실장으로 재임 중이다.롯데케미칼에서는 첨단소재 대표이사 이영준 부사장이 사장으로 승진해 롯데 화학군 총괄대표를 맡는다. 이 사장은 1991년 삼성종합화학에 입사한 후 제일모직 케미칼 연구소장, 삼성SDIPC사업부장을 거친 뒤 2016년 롯데그룹에 합류했다. 롯데케미칼 첨단소재PC사업본부장과 첨단소재 대표이사를 역임하며 제품 포트폴리오를 고부가제품 중심으로 강화하는 한편 주요 거래선을 지속적으로 확대해 축소되는 판매량과 스프레드에 효율적으로 대응했다는 성과를 인정 받았다.롯데 측은 “이 사장은 화학과 소재 분야 전문가로, 사업과 조직의 체질을 바꿔 롯데 화학군 전반의 근본적 경쟁 우위를 확보할 인물로 평가받는다“며 ”기초화학 중심 사업을 고부가가치 스페셜티 중심 사업구조로 신속하게 전환하는 작업을 진두지휘할 것”이라고 밝혔다.롯데 화학군을 이끌었던 이훈기 사장은 일선에서 용퇴한다. 이 사장은 롯데지주 경영혁신실장 재임 시 추진했던 일부 M&A 및 투자와 화학군 실적 부진에 대한 책임을 지고 물러나겠다는 뜻을 밝힌 것으로 알려졌다.롯데지주 사업지원실장 정호석 부사장은 호텔롯데 대표이사로 내정됐다. 정 부사장은 롯데 그룹사의 전략 수립을 지원하고 경영 리스크를 관리해온 경영 전문가다. 1991년 롯데알미늄(옛 롯데기공)에 입사한 뒤 롯데 정책본부 운영실, 롯데물산 기획개발부문장, 롯데지주REVA(부동산 관리)팀장을 역임했다. 2022년부터 롯데지주 사업지원실을 이끌며 롯데그룹의 수익성 중심 경영을 추진해왔다.70년대생CEO전면 배치롯데는 70년대생CEO를 전면 배치해 세대 교체를 추진했다. 롯데 측은 “경영 역량과 전문성이 검증된 내부 젊은 인재들의 그룹 내 역할을 확대해 사업 경쟁력을 강화하고 신사업 추진 속도를 높이겠다”고 밝혔다.롯데면세점 김동하 대표이사(1970년생), 롯데이노베이트 김경엽 대표이사(1970년생), 롯데엠시시 박경선 대표이사(1970년생),LCTitan장선표 대표이사(1970년생), 롯데케미칼 첨단소재 황민재 대표이사(1971년생), 롯데이네오스화학 성규철 대표이사(1971년생), 한국에스티엘 윤우욱 대표이사(1971년생), 에프알엘코리아 최우제 대표이사(1974년생), 아사히 최준영 대표이사(1973년생), 롯데중앙연구소 윤원주 연구소장(1974년생), 롯데벤처스 김승욱 대표이사(1974년생), 롯데베르살리스엘라스토머스 김해철 대표이사(1974년생) 등 12명이 신임CEO로 배치됐다.한편 60대 이상 임원들은 퇴진했다. 60대 롯데 계열사 대표이사 8명 (35%)이 퇴진했으며, 전체 60대 이상 임원의 50% 이상이 퇴임하게 됐다.롯데는 글로벌 경쟁력을 보유한 외부 전문가 영입 기조를 유지하기로 했다. 롯데바이오로직스는 다음 달 11일자로 글로벌 바이오 전문가를 새로운 대표로 영입한다. 롯데바이오로직스는 지난해 7월 인천송도국제도시 바이오 캠퍼스 1공장을 착공했으며, 2027년 상업생산을 목표로 착실히 사업을 진행 중이다. 롯데 측은 “신임 대표가 바이오CDMO전문성과 글로벌 네트워크를 기반으로 사업 역량을 키우고 의약품 수주 확대를 주도해 롯데 바이오 사업을 성공적으로 안착시킬 것으로 기대하고 있다”고 밝혔다.롯데는 연말 정기적으로 단행해온 정기 임원인사 체제를 수시 임원인사 체제로 전환한다는 계획을 밝혔다. 글로벌 경영 불확실성에 유연하게 대처하고 사업의 속도감과 실행력을 높인다는 취지다. 롯데 측은 “성과 기반의 적시·수시 임원 영입과 교체를 통해 경영 환경을 극복하겠다는 방침”이라고 밝혔다.※아래는 2025년 롯데그룹 정기임원 인사 명단.◼ 대표이사 및 단위조직장 승진화학군 총괄대표 兼 롯데케미칼㈜ 기초소재사업 대표이사 사장 이영준롯데지주㈜ 경영혁신실장 사장 노준형롯데케미칼㈜ 첨단소재사업 대표이사 (내정) 부사장 황민재롯데정밀화학㈜ 대표이사 (내정) 부사장 정승원롯데지주㈜ 커뮤니케이션실장 부사장 임성복롯데지주㈜ 미래성장실장 兼 롯데바이오로직스㈜Global전략실장 부사장 신유열㈜호텔롯데 롯데면세점 대표이사 (내정) 전무 김동하롯데이노베이트㈜ 대표이사 전무 김경엽롯데피플네트웍스 대표 상무 최인태한국에스티엘㈜ 대표이사 (내정) 상무 윤우욱롯데베르살리스엘라스토머스㈜ 대표이사 (내정) 상무 김해철롯데이네오스화학㈜ 대표이사 (내정) 상무 성규철LCTitan대표이사 상무 장선표◼ 대표이사 및 단위조직장 보임㈜호텔롯데 대표이사 (내정) 부사장 정호석㈜호텔롯데 롯데월드 대표이사 (내정) 전무 권오상롯데벤처스㈜ 대표이사 (내정) 전무 김승욱롯데중앙연구소 연구소장 상무 윤원주롯데엠시시㈜ 대표이사 (내정) 상무 박경선롯데지에스화학㈜ 대표이사 상무 정종식㈜롯데아사히주류 대표이사 (내정) 상무보 최준영에프알엘코리아㈜ 대표이사 (내정) 상무보 최우제◼ 승진[롯데웰푸드㈜]전무 배성우상무 진헌탁, 최인태, 최호형상무보 강성택, 김미송, 권영일, 황자영[롯데칠성음료㈜]상무 정용주상무보 신해모, 우태식, 이주한[롯데지알에스㈜]상무 이승주상무보 김진우[롯데상사㈜]상무 이세호상무보 김세련[롯데쇼핑㈜ 백화점사업부]전무 김원재상무 강우진, 윤우욱, 정동필상무보 김동섭, 박상우, 박준홍, 유현권[롯데쇼핑㈜ 마트사업부]상무 신수경상무보 김동호, 심영석, 표정수[롯데쇼핑㈜ e커머스사업부]상무보 김장훈, 정진욱[㈜코리아세븐]상무 문대우상무보 이동은[롯데홈쇼핑]상무보 김연수[롯데하이마트㈜]상무 김보경상무보 정상국[한국에스티엘㈜]전무 김진엽[에프알엘코리아㈜]전무 정현석[롯데멤버스㈜]상무보 강성진[롯데케미칼㈜ 기초소재사업]부사장 황민재상무 권조현, 김해철, 유승용, 윤종규상무보 김영번, 김재호, 김주익, 김철수, 박성준, 박성진, 박진의, 박재선, 배지훈[롯데케미칼㈜ 첨단소재사업]사장 이영준상무 권기혜, 이한수상무보 강태곤, 고성욱, 안재석[롯데정밀화학㈜]상무 윤희용상무보 최병욱, 황석민[롯데에너지머티리얼즈㈜]상무보 조성욱[롯데이네오스화학㈜]부사장 정승원상무 성규철상무보 정재규[LCTitan]상무 장선표[롯데엠시시㈜]상무 이태환[롯데알미늄㈜]상무 정창명상무보 이상엽[㈜호텔롯데]상무 권정근상무보 양재혁[㈜호텔롯데 롯데면세점]상무보 심재우[㈜호텔롯데 롯데월드]상무보 이해열[롯데건설㈜]전무 고용주상무 강민종, 차길봉, 한정호, 홍상균상무보 김명준, 김종태, 이승환, 최정일[롯데렌탈㈜]전무 김경봉상무 이광호, 이규필상무보 정동주[롯데이노베이트㈜]전무 김경엽상무 이원종상무보 김경장, 이창윤, 이환희, 전숭녕, 추경일[롯데글로벌로지스㈜]상무 권순근상무보 강병윤, 안재용, 이용감[롯데캐피탈㈜]상무보 홍종성[롯데물산㈜]상무 신창훈[롯데에이엠씨㈜]상무보 김민영[㈜대홍기획]상무보 박승규, 한근조[캐논코리아㈜]상무 전형준상무보 김희준[롯데미래전략연구소㈜]상무 이승환[롯데자산개발㈜]상무보 김정원[롯데바이오로직스㈜]상무 임태형[롯데지주㈜]사장 노준형부사장 신유열, 임성복전무 김동하, 박왕근, 최영준상무 변영오, 심형섭, 장병철상무보 김민성, 박상섭"
2023-06-29,"편의점 주요 4사, 롯데웰푸드 아이스크림 25% 인상 ‘보류’키로...식품 업계 가격 인하에 동참","지난 25일 서울 시내 한 편의점에 진열된 아이스크림.  /연합뉴스식품 업계의 가격 인하 러시에 편의점 업계도 ‘가격 동결’로 동참하는 모양새다.편의점CU,GS25, 세븐일레븐, 이마트24 등 주요 4사는 7월 1일로 예정됐던 롯데웰푸드 아이스크림 인상을 한시적으로 보류하고 가격을 동결하기로 했다고 29일 밝혔다.제조사가 공급가격을 올린 제품을 소비자들에겐 기존 가격 그대로 팔기로 결정, ‘사실상 인하’에 나선 것이다.롯데웰푸드는 다음달 1일부터 스크류바, 돼지바, 수박바 등 아이스크림 15종의 편의점 공급가를 25% 인상하기로 한 바 있다. 올해 초 인상안을 밝혔으나 시행하지 않고 보류했다가 이번에 원래 예정했던 대로 값을 올리는 것이다.GS25는 현재 롯데웰푸드가 인상을 예정한 15종 전부를 취급하고 있고,CU는 10종, 세븐일레븐은 13종, 이마트24는 14종을 취급 중이다. 네 편의점은 각각 취급 상품 전부를 동결한다.이로써 이들 편의점에선 돼지바와 스크류바 등 바(bar)류 아이스크림 가격이 1200원, 빠삐코 등 튜브류 아이스크림은 1500원으로 유지된다.GS25 관계자는 “여름철 성수기를 앞두고 정부의 물가 안정 기조에 맞춰 소비자 부담을 낮추기 위한 조치”라고 했다."
2024-09-09,[모닝] 韓·日 롯데 협업,"해외 日 롯데 공장서도 한국 ‘빼빼로’ 만들기로신동빈 롯데그룹 회장이 한일 롯데 식품회사가 협력해 연매출 1조원의 글로벌 메가 브랜드를 육성하자며 첫 번째로 한국의 '빼빼로'를 선정했다. 신 회장은 한일 롯데 식품 계열사 경영진과 최근 벨기에, 폴란드의 글로벌 식품 생산거점을 찾아 현장을 점검하고 한일 식품사 시너지 창출을 통한 글로벌 경쟁력 확보 방안을 논의했다. 사진은 신동빈 롯데 회장(오른쪽 두 번째)이 벨기에 신트니클라스 소재의 길리안 생산 공장을 점검하는 모습. /롯데그룹롯데의 대표 과자 제품인 ‘빼빼로’를 일본롯데가 해외에서 운영하는 공장에서도 생산한다. 빼빼로의 글로벌 매출을 늘리기 위해 한일 양국의 롯데가 협업하는 것이다. 예를 들어, 베트남에서는 일본 롯데가 2020년 롯데웰푸드로부터 인수한 공장에서 빼빼로를 만드는 식이다. 지난해 롯데웰푸드가 생산한 빼빼로는 국내외에서 약 2000억의 매출을 올렸는데, 이를 1조원까지 늘린다는 계획이다.롯데그룹은 지난 3일 폴란드 바르샤바에서 열린 신동빈 회장 주재 ‘원롯데 식품사 전략회의’에서 이 같은 내용을 논의했다고 8일 밝혔다. 일본롯데는 빼빼로와 비슷한 ‘톳포’라는 제품을 만드는 데 같은 라인을 활용해 빼빼로를 생산할 것으로 보인다. 롯데는 빼빼로 글로벌 매출을 늘리기 위해 베트남·인도 등 기존 진출 국가를 집중적으로 공략하고, 한일 롯데가 공동으로 소싱 및 마케팅 활동을 펼쳐 신규 해외 시장도 개척한다는 방침이다.롯데그룹 관계자는 “장기적으로는 한국 롯데가 운영하는 공장에서 일본롯데 제품까지 생산하는 방안도 검토 중”이라고 했다.롯데웰푸드 미국 뉴욕 타임스퀘어 전광판의 뉴진스 빼빼로 글로벌 캠페인 옥외광고. /롯데"
2024-06-30,‘제로 아이스크림’ 쏟아지는 올여름… 롯데 수박바·빙그레 더위사냥 등 인기 제품도 ‘제로’로 출시,"탄산음료·소주에 이어 아이스크림에도 ‘제로 열풍’이 불면서 올해 여름은 ‘제로 아이스크림’ 각축전이 벌어질 전망이다. 롯데웰푸드는 지난 4월 출시한 죠스바·스크류바 제로에 이어 최근 씨없는 수박바 제로를 출시했다. 경쟁 상대인 빙그레 역시 더위사냥·싱귤탱귤 등 인기 제품을 ‘제로 슈거(설탕이 들어가지 않은 제품)’로 출시하겠다고 나섰다.롯데웰푸드는 지난 28일 씨없는 수박바 제로를 출시하고 자사 홈페이지를 통해 구입이 가능하다고 밝혔다. 지난 4월 출시된 죠스바와 스크류바 제로 칼로리 제품이 6월 말까지 2000만개가 팔릴 정도로 큰 인기를 끌자 후속 제품을 개발한 것이다. 롯데웰푸드 관계자는 “최근 10년 새 출시된 자사 아이스크림 중 가장 인기가 많은 수준”이라고 했다.롯데웰푸드가 지난 28일 출시한 아이스크림 '씨없는 수박바' 제로 칼로리 제품. /롯데웰푸드빙그레 역시 인기 제품인 더위사냥과 싱귤탱귤의 ‘제로 버전’을 7월 출시한다. 단 이 아이스크림들은 제조 과정에서 유지방이 들어가기 때문에 완전한 0칼로리는 어렵고, 설탕을 대체당으로 바꾼 ‘제로 슈거’ 제품이 될 예정이다. 빙그레는 앞서 자사 제품 파워캡을 제로 슈거 버전으로 내놔 시장 반응을 탐색한 후, 시장의 반응이 좋자 이번에는 더위사냥·싱귤탱귤 등 스테디 셀러 제품으로 범위를 넓힌 것이다. 빙그레의 자회사인 해태아이스크림 역시 지난 4월 폴라포를 제로 슈거 제품으로 출시했고, 28일에는 얼음컵 아이스크림인 ‘아이스가이’의 제로 칼로리 제품을 새로 선보였다.빙그레의 자회사 해태아이스크림이 출시한 얼음컵 아이스크림 '아이스가이'의 제로 칼로리 제품. /빙그레편의점에서도 칼로리가 낮은 저당 아이스크림의 인기가 많다.CU에 따르면CU에서 팔리는 아이스크림 300여종 중 저당 아이스크림 브랜드인 랄라스윗 제품이 아이스크림 매출 1, 3, 4, 9위를 차지하고 있다. 가격대가 개당 3000원 이상이기 때문에 일반 아이스크림보다 비싸 매출 순위가 높기도 하지만, 똑같이 프리미엄 아이스크림 제품으로 통하는 하겐다즈·나뚜루 등의 브랜드보다 더 인기를 끌고 있다.국내 아이스크림 업계는 출산율 저하 등으로 소비가 부진한 내수 시장에서 제로 아이스크림이 하나의 돌파구가 될 수 있다고 보고 있다. 업계 관계자는 “현재 내수 소비가 부진한 상황에서 제로 아이스크림에 대한 시장 반응이 예상 외로 뜨겁다”며 “제품 개발 자체는 설탕을 대체당으로 바꾸면 되는 것이기 때문에, 앞으로도 제로 칼로리 아이스크림이 계속해서 출시될 전망”이라고 했다."
2024-06-24,"신영자 롯데재단 의장, 롯데 계열사 지분 잇따라 매각… 상속세 재원 추정","롯데그룹 창업주 고(故) 신격호 명예회장의 장녀 신영자 롯데재단 의장이 롯데쇼핑, 롯데지주, 롯데웰푸드 지분을 최근 잇따라 매각했다. 신 의장은 상속세 납부를 위해 지분을 매각한 것으로 전해졌다.신영자 롯데재단 의장 /롯데재단롯데지주는 신영자 롯데재단 의장이 지난달 30일, 이달 17일과 20일 세 차례에 걸쳐 총 132만2230주를 매도했다고 24일 공시했다. 매각대금은 331억원으로, 이를 통해 신 의장의 롯데지주 지분은 343만4000여주(3.27%)에서 211만2000여주(2.01%)로 줄었다.롯데웰푸드도 이날 신 의장이 지난달 30일부터 세 차례 매도와 한 차례 매수로 총 9만5803주를 매각했다고 공시했다. 매각대금은 146억원이다. 신 의장의 롯데웰푸드 지분은 23만6000여주(2.51%)에서 14만939주(1.49%)로 줄었다.신 의장은 앞서 지난달 14일부터 25차례에 걸쳐 롯데쇼핑 주식을 사고팔며 총 21만10주를 매각했다. 이 금액 역시 대략 140억원 규모다.신 의장이 3사 지분을 매각해 647억원 규모의 현금을 마련한 것은 상속세 납부를 위한 조치로 전해졌다. 2020년 1월 신격호 명예회장 사망 후 상속인인 신영자 의장·신동주SDJ코퍼레이션 회장·신동빈 롯데그룹 회장·신유미 전 호텔롯데 고문 중 신동빈 회장이 회사별 상속 지분의 41.7%, 신영자 의장이 33.3%를 각각 상속받았다. 신동빈 회장과 신영자 의장은 연부연납 방식으로 상속세를 5년간 분할 납부하기로 한 것으로 알려졌다.신 의장은 롯데장학재단·롯데삼동복지재단·롯데복지재단의 이사장을 모두 맡아 운영하다 2018년 사임했다. 현재 딸인 장혜선씨가 롯데장학재단·롯데삼동복지재단 이사장을 맡고 있다."
