date,title,content
2023-08-24,[부음] 강순원 별세 외,"▲강순원별세,류제돈롯데물산 대표·류제우前 롯데케미칼 수석·류제영·류제옥·류제희모친상,강만원두막 대표·황진선前 서울신문 논설위원·최인호前 현대자동차 부장 장모상=22일14시 이대서울병원, 발인 25일8시, (02)6986-4451▲권오현前 불교방송 전무 별세,권미숙부친상,오명재장인상,전상은시부상=22일11시24분 일산 동국대병원, 발인 24일7시, (031)961-9400▲안근수별세,안상덕·안상미대한빙상경기연맹 이사·안상애부친상,이문기SBS스포츠기획부 차장 장인상=22일23시5분 대구 허병원, 발인 25일9시, (053)522-4300▲유표석前 신용보증기금 강동지점장 별세,손청자남편상,유한옥삼성물산 상사부문 프로·유한주LG화학 책임 부친상,구민선·박현진시부상=22일9시52분 삼성서울병원, 발인 25일8시, (02)3410-6920▲이남순별세,김명희·김경희·김춘길TV조선 항저우 아시안게임 기획단 총감독·김금희·김은희모친상,장순일·김성일·임재섭·이정기장모상,조현순시모상=22일17시10분 쉴낙원 인천장례식장, 발인 25일9시, (032)548-1009▲이상훈별세,박태진CS무태센터 대표 장인상=23일13시15분 대구 새동산병원, 발인 25일11시, (053)527-4447"
2023-09-08,尹·조코위 정상회담 “‘특별 전략적 동반자 관계’ 강화”,"윤석열 대통령과 부인 김건희 여사가 8일(현지 시각) 인도네시아 자카르타 대통령궁에서 열린 공식환영식에서 조코 위도도 대통령 내외와 함께 걷고 있다. /연합뉴스윤석열 대통령은 8일(현지 시각) 인도네시아 자카르타에서 조코 위도도(조코위) 인도네시아 대통령과 정상회담을 하고 실질적·전략적 협력 기반을 강화하기로 했다.윤 대통령은 인도네시아 대통령궁에서 진행된 정상회담에서 조코위 대통령에게 “올해 수교 50주년을 맞은 한국과 인도네시아는 정치·사회·문화 다방면에서 괄목할만한 관계를 이어오고 있다”며 “핵심 파트너인 인도네시아와 함께 인도·태평양 지역의 자유, 평화, 번영을 위한 기여 방안을 함께 모색하길 희망한다”고 말했다.이어 “인도네시아는 엄청난 경제 성장 역량을 갖춘 아세안 선도국이며 자유 민주주의와 시장경제 질서를 토대로 확실하게 보장된 법치주의를 실현하고 있다”며 “그런 점에서 대한민국의 아세안, 인태 지역 핵심 협력국이 될 수밖에 없다”고 했다.조코위 대통령도 “수교 50주년을 축하한다”며 “이는 양국 관계에 아주 중요한 의미를 갖고 있다”고 했다.양 정상은 회담이 끝난 후 ‘산업협력 양해각서(MOU)’ ‘농업기계화 및 농업기반시설 협력 파트너십 기술약정’ ‘전기차 생태계 조성 협력에 관한MOU’‘할랄식품 협력MOU’서명식을 진행했다.윤 대통령은 아세안(동남아국가연합) 관련 정상회의 참석차 지난 5일부터 인도네시아를 공식 방문했다. 이번 방문은 작년 7월 조코위 대통령의 공식 방한에 대한 답방 성격도 있다.대통령실은 이번 정상회담을 통해 ‘외교·안보 분야 전략적 협력 증진’ ‘방산 협력의 공고화’ 등의 성과를 얻었다고 밝혔다.양 정상은 외교·안보 전략적 협력과 관련해 ‘특별 전략적 동반자 관계’ 강화 필요성에 대한 공감대를 구축했다. 또 올해 1월 발효된 한·인니 포괄적 경제동반자협정(CEPA)을 기반으로 교역·투자를 지속 확대하기로 했다.‘전기차 생태계 조성 협력’MOU체결을 통해 아세안 전기차 허브로 부상 중인 인도네시아와 전기차·배터리 산업 생태계 구축 협력을 강화했다.또 ‘할랄 식품 협력’MOU를 통해 최대 무슬림 국가인 인도네시아에K-푸드 수출 확대 기반을 조성했다.인도네시아 수도 이전 사업에 발맞춰 탄소중립 정수장 구축, 상하수도 및 터널 건설사업 등 인프라 분야 협력도 증진하기로 했다.윤 대통령과 조코위 대통령은 방산 파트너십을 한층 더 심화하기로 했다. 특히 전투기 공동개발(KF-21·IF-X) 사업의 성공적 마무리를 위한 양국 정상 차원의 공동 의지를 재확인했다고 대통령실은 밝혔다. 인도네시아는 한국KT-1(군용 훈련기),T-50(고등훈련기)의 첫 수출국이자 유일한 잠수함 수출 대상국이면서 아세안 지역 최대 방산 수출대상국이다.윤 대통령은 포스코, 현대자동차, 롯데케미칼, 한국타이어 등 현지에 진출한 2000여 개 한국 기업의 핵심기술 보호와 시장선점 지원을 위해 지식재산권, 특허분야MOU를 체결했다.양 정상은 2024년 한국어교육원 신설 추진, 정부 초청 장학사업 및 대학생 교류 프로그램 추진 등 교육 분야 교류 강화 기반도 구축하기로 했다.윤 대통령은 이번 정상회담에서 조코위 대통령에게 2030세계박람회(엑스포) 부산 유치를 위한 지원도 요청했다."
2023-09-08,尹·조코위 “전투기 공동개발” 8조원대 사업 재확인,"韓·인도네시아 정상회담윤석열 대통령과 김건희 여사가 8일 인도네시아 자카르타 대통령 궁에서 조코 위도도 인도네시아 대통령 내외와 작별하기 전 환담을 나누고 있다. 3박 4일간 인도네시아 순방을 마친 윤 대통령은 이날 20국(G20) 정상회의가 열리는 인도 뉴델리로 이동했다./연합뉴스8일(현지 시각) 인도네시아 자카르타의 대통령궁에서 열린 윤석열 대통령과 조코 위도도 대통령의 정상회담에서는 ‘할랄 식품 협력 양해각서(MOU)’가 체결됐다. 올해 1월 발효된 한·인도네시아 포괄적 경제동반자협정(CEPA)을 기반으로, 세계 최대 할랄 시장인 인도네시아에 K푸드 수출 확대 기반을 마련한 것이다. 한국이 할랄MOU를 체결한 국가로UAE에 이어 두 번째다. 양국이 정상회담을 계기로 신시장 창출과 공급망 협력 등을 한층 구체화하는 모습이다.윤 대통령은 이날 “수교 50주년을 맞은 한국과 인도네시아는 정치, 경제, 사회, 문화 등 다방면에서 괄목할 만한 관계 발전을 이루어왔다”며 “전기차, 배터리, 스마트 시티 등 미래 산업 분야에서 양국 협력을 계속 확대해 나가기를 기대한다”고 했다. 조코위 대통령은 “수교 50주년이 양국 관계에 아주 중요한 의미가 있다”고 했다.회담이 끝난 뒤 양 정상이 자리한 가운데 ‘할랄 식품 협력’을 비롯해 ‘산업 협력’ ‘농업 기계화 및 농업 기반 시설 협력’ ‘전기차 생태계 조성 협력’MOU서명식이 진행됐다. 특히 한국은 아세안(동남아국가연합) 전기차 허브로 부상하고 있는 인도네시아와 인프라·인력·연구개발(R&D)·제도 등 4대 분야에서 협력하기로 했다. 조만간 자카르타에 완공되는 ‘한·인니 e모빌리티 협력센터’를 통해 국산 전기차와 전기 이륜차, 충전기 등을 시범 보급한다.윤 대통령은 조코위 대통령이 추진 중인 수도 이전 사업에 대해 많은 한국 기업이 참여할 수 있도록 긴밀히 협력하자고 했다. 인도네시아는 오는 2045년까지 40조원 예산을 들여 수도를 자카르타에서 동칼리만탄으로 이전한다. 이에 맞춰 탄소 중립 정수장 구축, 상하수도 및 터널 건설 사업 등 인프라 분야에 대한 구체적 협력 사업이 가속될 전망이다. 양국은 작년 7월 조코위 대통령 방한 때 ‘수도 이전 협력MOU’도 체결했었다.양국 정상은 ‘특별 전략적 동반자 관계’ 심화를 위해 국방, 방산 협력을 더욱 공고히 해 나가기로 했다. 양국은 2015년부터 2026년까지 8조1000억원 사업비를 공동 부담해 전투기를 공동 개발하는KF-21(IF-X) 사업을 진행 중이다. 대통령실은 “전투기 공동 개발 사업의 성공적 마무리를 위한 양국 정상 차원의 공동 의지를 재확인했다”고 밝혔다. 인도네시아는 한국KT-1(군용 훈련기),T-50(고등 훈련기)의 첫 수출국이자 유일한 잠수함 수출 대상국이기도 하다.윤 대통령은 수입물량 제한 등 인도네시아에 진출한 한국 기업들의 애로 사항을 전달하며 적극적인 관심과 지원을 요청했고, 조코위 대통령은 각별한 관심을 가지고 살펴보겠다고 했다. 인도네시아에는 포스코, 현대자동차, 롯데케미칼, 한국타이어 등 2000여 개 기업이 진출해 있다.한국 특허청과 인도네시아 지식재산청은 이날 ‘특허 우선 심사 협력’MOU등을 체결했다. 한 국가에서 특허 등록을 받을 경우, 이를 상대국에 제출해 우선 심사받을 수 있는 제도다. 인도네시아가 ‘특허 우선 심사 협력’MOU를 체결한 국가는 일본이 유일했다.양 정상은 2024년 인도네시아 내 한국어 교육원 신설, 정부 초청 장학 사업 및 대학생 교류 프로그램을 추진하기로 했다. 윤 대통령은 조코위 대통령에게 2030 세계박람회(엑스포) 부산 유치를 위한 지원도 요청했다.김건희 여사는 이날 조코위 대통령 부인 이리아나 위도도 여사와 문화 교류, 전통 의상 등을 주제로 대화하며 친교의 시간을 가졌다고 이도운 대변인이 전했다. 김 여사는 이리아나 여사가 다시 한국을 방문하기를 고대한다며 “K팝을 좋아하는 인도네시아 대통령 부부 자녀들이 역동적인 한국 문화를 느낄 기회가 있을 것”이라고 했다. 이리아나 여사는 이틀 전 만찬에서 김 여사가 착용한 인도네시아 전통 의류인 바틱 스카프와 잘 어울릴 것 같다며 바틱 클러치를 기념으로 건넸다."
2023-09-04,‘쓰레기로 만든 열분해유’ 정작 국내 사용은 불법… 규제가 발목 잡아,"다른 미래 산업도 마찬가지지만 재활용 플라스틱 산업에서도 시대에 뒤떨어진 규제, 낙후된 산업 생태계가 가장 큰 장애 요인이다.우선 세계에서 가장 앞선 기술력을 갖춰 ‘쓰레기에서 뽑는 기름’인 열분해유는 현행법상 국내에서 사용하면 불법이다. 석유사업법에선 폐플라스틱을 화학적으로 재활용해 만든 열분해유는 석유 정제 공정에 원료로 투입할 수 없도록 돼 있다.산업 생태계도 아직은 후진적이다. 재활용 플라스틱 사업 성공을 위해선 폐플라스틱이 필요하다. 정유 시장에 석유가 필요한 것과 마찬가지다. 지난해 유럽에선 “새 페트보다 비싼 재활용 페트가 등장했다”는 보도가 나올 만큼 폐플라스틱의 중요성은 커지고 있다. 그런데 ‘도시 유전(油田)’ 역할을 해줘야 할 쓰레기 수거·선별 업체들은 대부분 영세하다. 가정에서 재활용을 잘해도 업체에서 제대로 관리하지 못해 재활용률이 떨어지기도 한다. 이로 인해 기업들은 대규모, 최첨단 설비를 갖추고도 ‘소중한’ 원료인 폐플라스틱과 비닐을 제대로 공급받기 어렵다. 정부의 영세 업체 기술 지원과 관리가 시급한 이유다. 김평중 한국석유화학협회 본부장은 “지자체별 폐기물 시설 고도화와 대형화도 필요하다”고 지적했다.현재 기업들은 각 사가 알아서 물량 확보에 나서고 있다.SK지오센트릭은 2021년 사내에 ‘R-인프라’(R-infra) 팀을 신설하고, 전국 쓰레기장부터 뒤졌다. 팀원 8명은 쓰레기 수거장을 돌며 재활용률을 확인하고, 물량 선점을 위해 협력할 수거 업체를 수소문했다.LG화학, 롯데케미칼 등 타 업체들도 ‘재활용 캠페인’을 펼치고 지자체, 쓰레기 수거 업체와 협력을 늘리고 있다."
2023-08-16,"305개 기업 실적, 2분기에도 ‘작년의 반토막’","총 영업이익 23조원 그쳐… 본지가 업종별 분석해보니대한민국 대표 기업들의 실적이 올해 1분기 반 토막 난 데 이어, 2분기에도 연이어 반 토막이 났다. 15일CEO스코어가 매출 500대 기업 중 전날까지 반기 보고서를 낸 305사의 실적을 집계한 결과, 2분기 총 영업이익은 23조원으로 전년 동기(52조원)의 절반에도 못 미쳤다. 지난 1분기(25조원)에도 전년 동기(50조원)의 반 토막이었다.본지가 업종별로 분석한 결과, 부진의 핵심으로 거론됐던 반도체만 망가진 게 아니었다. 우리 주력 산업인 석유화학·정유·철강·건설·제약·유통 등 대다수 업종이 극심한 불황을 겪고 있었다. 특히 중국 시장 의존도가 높은 석유화학·철강 산업은 부진이 장기화될 조짐을 보이고 있다. 그나마 미국 등의 영향을 받는 자동차·조선·배터리 산업이 선방했지만 전체 실적을 견인하기엔 역부족이었다.그래픽=박상훈◇반도체만 문제? 석유화학·정유·철강 등도 불황상장사 중 14일까지 반기 보고서를 제출한 305사의 올 2분기 영업이익은 전년 동기 대비 29조원 감소했는데, 이 중 20조5000억원은 삼성전자(13조4000억원)·SK하이닉스(7조1000억원)의 이익이 줄었기 때문이다. 반도체 양대 시장인 중국·미국의 수요 부진이 지속되며 업계의 감산에도 D램 가격이 하락한 영향이 컸다.여기에 작년 상반기까지 선방했던 국내 핵심 산업인 석유화학·정유, 해운, 철강 등의 이익 상황까지 심각하다. 올 2분기 석유화학·정유 업종에서만 10조3238억원, 해운·운송에서 3조2239억원, 철강에서 8978억원이 줄었다. 대표적 화학 업체인 롯데케미칼은 770억원,LG화학 석화 부문은 127억원 적자를 냈다. 글로벌 스태그플레이션(물가 상승+소비 감소)으로 수요는 감소하는데, 중국 업체들과의 경쟁은 더 치열해졌기 때문이다. 작년 유가 상승으로 역대급 실적을 냈던GS칼텍스와SK에너지는 올 2분기 유가 하락으로 정제 마진이 급감, 2조원대 손실을 내며 적자 전환했다. 지난해 코로나 엔데믹 직후, 공급 부족에 따른 해운 운임 급등으로 사상 최대 실적을 냈던HMM도 올 2분기엔 수요가 한순간에 사라지면서 이익이 95%(2조7769억원) 날아갔다.이 밖에도 건설(-5560억원), 제약(-3545억원), 카드·캐피탈(-2117억원), 식음료(-1932억원), 상사(-1771억원), 생활용품(-1441억원), 서비스(-1402억원), 증권(-892억원), 유통(-64억원)까지 대다수 업종의 이익이 줄었다.그나마 이익을 늘린 곳은 중국 외 시장을 겨냥한 자동차·부품과 조선·기계·설비, 배터리 업종이다. 자동차·부품 업종은 미국·유럽 시장에서 판매를 늘린 현대차·기아의 사상 최대 실적 효과로 전년 동기 대비 이익이 3조3623억원 늘었다. 최근 수퍼사이클에 접어든 선박 시장에서 한국 업체들이 유럽 선사에서 친환경 선박을 대거 수주하며 조선·기계·설비(1조3011억원) 업종 이익도 늘었다. 미국 전기차 시장을 공략해 집중 투자한 배터리·에너지(2007억원) 분야도 성장했다. 개별 기업으로는 현대차·기아(2조4271억원), 삼성중공업(3147억원),LG에너지솔루션(2650억원), 현대모비스(2604억원) 등이 수조, 수천억원씩 이익이 늘었다. 하지만 이것만으론 ‘반 토막 실적’에서 벗어나기에 역부족이었다.◇'차이나 쇼크’ 우려로 하반기 반등도 어려워최근 중국의 대형 부동산 기업들이 부도 위기에 처하고, 소비자물가 상승률이 마이너스를 기록하는 등 ‘차이나 쇼크’ 우려가 커지고 있어 하반기 반등도 쉽지 않다는 전망까지 나오고 있다. 삼성전자에 따르면 지난해 삼성전자 매출(212조원)에서 중국(59조원)의 비율이 28%로 미국(58조원)과 비슷하다. 그런데 중국 시장이 회복은커녕 더 악화되는 조짐을 보이자 증권가는 ‘반도체 3분기 회복설’을 ‘4분기 회복설’로, 심지어 ‘내년 1분기 회복설’로 보는 보고서까지 나오는 상황이다. 특히 최근 삼성전자와SK하이닉스는 감산에도 불구하고 반도체 재고가 6월 말 기준, 50조원을 넘었다(삼성 33조6896억원,SK16조4202억원). 작년 말 대비 각각 15.9%, 4.8% 늘어난 것으로 6개월 만에 5조원 이상 늘었다. 업계 관계자는 “반도체는 중국 모바일 수요 비중이 커 샤오미·오포·레노버 등이 사줘야 하는데, 중국 경기가 죽으면 쉽지 않다”고 말했다.중국 시장 의존도가 40%에 달하는 석유화학 업종은 악화 일로를 걷고 있다. 문지영 대외경제정책연구원 중국경제통상팀장은 “중국 시장이 회복된다 해도, 중국 석유화학업계의 자급력이 높아지고 있어 중국만 바라보는 전략은 유효 기간이 끝났다”고 말했다.주원 현대경제연구원 실장은 “중국에서 레버리지로 급등했던 부동산 거품이 정부의 대출 규제와 탈중국 흐름으로 꺼지고 있는데, 일본의 ‘잃어버린 20년’처럼 장기화될 가능성은 낮다”며 “최근 중국이 유커(관광객)를 한국 등에 보내기로 하고 외국 기업 유치책도 내놓으며 변화 조짐이 있어 미중 갈등 전개 상황에 따라 경기가 개선될 여지도 있다”고 말했다."
2023-06-22,"마크롱, 한국 재계 총수들에 “에너지·바이오 투자해달라”","에마뉘엘 마크롱 프랑스 대통령과 최태원 대한상의 회장을 비롯한 8개 그룹 회장단이 21일(현지시간) 프랑스 파리 엘리제궁에서 기념촬영 하고 있다. 왼쪽부터 김동관 한화그룹 부회장, 정의선 현대차 그룹 회장, 구광모LG그룹 회장, 이재용 삼성전자 회장, 최태원 대한상의 회장(SK그룹 회장), 류진 풍산그룹 회장, 조현상 효성그룹 부회장, 조원태 한진그룹 회장. /대한상의 제공2030 부산 엑스포 유치 행사를 위해 프랑스 파리를 방문중인 8개 그룹 회장단은 21일 엘리제궁에서 에마뉘엘 마크롱 프랑스 대통령과 면담을 가졌다. 이재용 삼성전자 회장, 최태원SK회장, 정의선 현대차그룹 회장, 구광모LG회장과 김동관 한화 부회장, 조원태 대한항공 회장, 조현상 효성 부회장, 류진 풍산그룹 회장 등이 초청됐다.마크롱 대통령은 프랑스가 자국 투자 매력도 강화를 위해 추진 중인 경제·사회 개혁 정책(AttractivenessReforms)에 대해 발표하며 에너지, 미래 교통수단, 의료·바이오 등 미래 전략산업에 대한 투자 계획 등을 설명하고 우리 기업들의 관심과 참여를 독려했다.이성우 대한상공회의소 국제통상본부장은 “마크롱 대통령은 2017년 취임 이후 법인세 인하, 행정절차 간소화 등 기업친화적 정책을 꾸준히 추진해왔고 덕분에 한국은 지난 5년간 550건 이상의 투자를 통해 총 41억 달러를 프랑스에 투자했다”며 “이번 면담은 프랑스 정부 지원 하에 우리 기업들이 더욱 적극적으로 프랑스에 진출 및 투자할 수 있는 계기가 될 것”이라고 밝혔다.최태원 대한상공회의소 회장을 비롯한 8개 그룹 회장단이 21일(현지시간) 프랑스 파리 엘리제궁에서 에마뉘엘 마크롱 프랑스 대통령과 면담을 하고 있다. /대한상의한편, 대한상의는 21일(현지시각) 프랑스 파리에서 프랑스산업연맹인MEDEF(메데프) 인터내셔널과 ‘한-프랑스 비즈니스 라운드 테이블(BRT)’을 공동 개최했다고 22일 밝혔다.양측은 에너지 및 기술 분야 협력을 중심으로 양국 기업간 중장기적 협력 방안에 대한 심도 있는 논의가 이뤄졌다. 대한상의와MEDEF인터내셔널은MOU를 체결해 양국 경제 및 산업 분야 교류 등 상호 협력을 확대해 나가고 기업들이 원활히 활동할 수 있도록 민간소통채널 역할을 수행하기로 했다.한국측에선 우태희 대한상공회의소 상근부회장, 박승희 삼성전자 사장, 이형희SK커뮤니케이션위원회 위원장, 송호성 기아 대표이사 사장, 조주완LG전자 사장, 김교현 롯데그룹 화학군 총괄대표 및 롯데케미칼 대표이사 부회장, 정탁 포스코인터내셔널 대표이사, 가삼현HD현대 대표이사 부회장, 강호성CJ경영지원 대표, 우기홍 대한항공 대표이사 사장, 정상철 큐에너지 대표이사, 유영상SK텔레콤 대표이사, 김동욱 현대차 부사장 등 기업 주요 인사 13명이 참석했다.에마뉘엘 마크롱 프랑스 대통령과 최태원 대한상공회의소 회장이 21일(현지시간) 프랑스 파리 엘리제궁에서 환담하고 있다. 이날 한국 8개 그룹 회장단은 마크롱 대통령과 면담을 가졌다. /뉴시스프랑스측에선 스테판 이스라엘MEDEF인터내셔널 한불재계회의 위원장, 필립 르포르 주한 프랑스 대사, 파스칼 카그니 프랑스무역투자진흥청장, 프랑수아 재코 에어리퀴드 대표이사, 알렉산드르 아키에르 아코르 수석부사장, 프랑수아 푸르니에HTL바이오테크놀로지 대표이사 등 정부 및 기업인 대표 17명이 참석했다.우태희 대한상의 상근부회장은 “한국과 프랑스는 137년간 경제, 외교, 문화 등 다방면에서 협력해온 파트너로서 작년에는 양국 교역 규모가 사상 최대치를 기록했다”며 “프랑스는 ‘프랑스 2030′이라는 투자계획 아래 에너지, 반도체, 배터리, 바이오 등 차세대 산업을 전략적으로 육성 중인데 이는 한국 기업들이 강점을 가진 분야”라며 “양국 기업간 에너지 및 기술 분야 등에서의 협력을 더욱 확대해 나갈 것”이라고 말했다."
2023-07-04,"롯데에너지머티리얼즈 “동박시장 급성장, 2028년 하이엔드 동박 점유율 30% 목표”","동박전문 업체 일진머티리얼즈 인수 후 새로 출범한 롯데에너지머티리얼즈가 2025년 20조원 수주를 목표로 전기차 배터리용 고부가가치 동박 사업을 확대한다고 밝혔다. 전기차, 배터리 시장 확대에 따라 2025년 약 10조원대 시장까지 커질 것으로 전망하는 동박 시장을 선점한다는 계획이다.김연섭 롯데에너지머티리얼즈 대표이사가 4일 오전 서울 송파구 롯데호텔 서울에서 열린 롯데에너지머티리얼즈 출범 기자간담회에서 사업 비전 및 성장 전략에 대해 발표하고 있다./뉴스1롯데에너지머티리얼즈는 4일 잠실 롯데호텔월드에서 ‘사업비전 및 성장전략’을 설명하는 기자간담회를 열고 4대 핵심 성장 전략을 발표했다.롯데에너지머티리얼즈는 이날 핵심 성장 전략으로 초격차 기술력을 우선 꼽았다. 국내 최초로 동박 국산화에 성공하며 쌓은 기술 노하우를 바탕으로, 현재 초극박, 고강도, 고연신(소재가 늘어나는 정도) 조건을 달성한 하이브리드 제품을 생산하고 있다. 김연섭 롯데에너지머티리얼즈 대표는 “고강도와 고연신은 동시 달성하기 어려운 조건, 업계에서 유일한 기술을 보유하고 있다”며 “올해 수주 잔고 목표는 15조원, 2025년까지 20조원을 목표로 글로벌 하이엔드 동박 1위 기업이 되겠다”고 했다.향후 회사는 전북 익산에 있는 생산공장을 신규제품 개발에 집중하는 R&D 기술 거점으로 활용한다는 계획이다. 진입 장벽이 낮은 범용 제품이 아니라 향후 고부가가치 제품 생산에 초점을 맞춘다.또 다른 성장 전략으로 ‘글로벌 거점 확대’도 추진한다. 현재 추진 중인 말레이시아 5,6 공장 증설 후 2024년부터 본격 양산에 돌입한다. 올해 기준 6만t 규모인 글로벌 생산능력도 2028년 24만t까지 늘릴 예정이다. 미국의IRA(인플레이션 감축법), 유럽연합(EU)의 핵심원자재법(CRMA) 등에 대응하기 위해 현지화 전략도 추진한다. 유럽 거점 지역인 스페인 공장 시설도 애초 규모보다 2배 이상 확대를 검토하고 있다.롯데그룹 화학군과 시너지를 통해 동박 외 차세대 배터리 소재 개발도 확대한다. 회사 관계자는 “고체전해질, 3세대 실리콘 복합 음극활물질,LFP양극활물질 등 미래 사업을 위한 다양한 연구개발도 진행 중”이라고 설명했다.앞서 롯데케미칼은 작년 2조7000억원을 투자해 세계 4위 동박 업체인 ‘일진머티리얼즈’를 인수했다. 동박은 머리카락 굵기의 30분의 1 수준 두께 10㎛(마이크로미터) 내외의 얇은 구리막으로 이차전지 핵심소재인 음극재를 코팅하는 재료다. 최근에는 배터리 용량을 키우기 위해 동박을 더 얇게 만드는 경쟁이 이뤄지고 있다.SNE리서치에 따르면 동박 시장 수요는 2021년 26만 5000t에서 2025년 74만 8000t으로 연평균 23%씩 성장할 것으로 전망한다. 약 10조원 시장이다."
