date,title,content
2023-12-06,12월7일 인사,⊙ 롯데그룹 <승진> ◇대표이사 및 단위조직장 △식품군 총괄대표 부회장 이영구 △롯데쇼핑 백화점사업부 사장 정준호 △롯데지주 경영개선실장 사장 고수찬 △〃 재무혁신〃 〃 고정욱 △〃 사업지원실장 부사장 정호석 △〃 미래성장실장 겸 롯데바이오로직스 글로벌전략실장 전무 신유열 △롯데지알에스 대표이사 부사장 차우철  △롯데캐피탈 〃 〃 추광식 △롯데정보통신 대표이사 전무 고두영 △롯데바이오로직스 〃 〃 이원직 △롯데헬스케어 대표이사 상무 우웅조 <보임> ◇대표이사 및 단위조직장 △화학군 총괄대표 사장 이훈기 △롯데지주ESG경영혁신실장 부사장 노준형 △롯데쇼핑 e커머스사업부 대표 부사장 박익진 △롯데물산 대표이사 부사장 장재훈 △코리아세븐 대표이사 전무 김홍철 △LCUSA〃 〃 김진엽 △씨텍 〃 〃 손태운 △롯데알미늄 〃 〃 최연수 △롯데에이엠씨 〃 〃 김소연 △부산롯데호텔 대표이사 상무 홍성준 △롯데건설CM사업본부 대표 상무 김진 △재단법인 롯데문화재단 〃 〃 김형태 롯데웰푸드 <승진> △상무 김대원 김덕범 김준연 조경운 황성욱 △상무보 구자성 김도형 김재훈 위세량 유경 이기훈 이진수 임석범 롯데칠성음료 △전무 나한채 △상무 오세록 이종곤 진달래 하용연 △상무보 임승석 최준영 롯데지알에스 △상무 이원택 △상무보 송진욱 롯데네슬레코리아 △상무 이창환 롯데중앙연구소 △상무 윤원주 △상무보 정원석 롯데쇼핑 백화점사업부 △상무 김혜라 서용석 이청연 조석민 △상무보 김지수 최용현 최우제 최형모 김범창 김종성 이영노 롯데쇼핑 마트사업부 △상무 강혜원 김진성 조정욱 △상무보 류지호 송양현 윤창국 롯데쇼핑 e커머스사업부 △상무 이재훈 추대식 △상무보 김대흥 코리아세븐 △상무보 박찬호 손상연 이진형 롯데홈쇼핑 △상무 송재희 정윤상 △상무보 이동규 조윤주 롯데하이마트 △상무 박상윤 윤용오 △상무보 김창희 박정환 롯데멤버스 △상무보 이대성 롯데케미칼 기초소재사업 △상무 곽기섭 김철중 이범희 정종식 조진우 △상무보 김상훈 김영현 박정규 이재균 조정훈 김익수 김형주 윤차중 주세형 롯데케미칼 첨단소재사업 △전무 박진현 △상무 신승식 신우철 △상무보 김재경 박진석 지준호 롯데정밀화학 △상무 김상원 △상무보 박일행 롯데에너지머티리얼즈 △상무보 김세용 김훈 롯데알미늄 △상무 손병삼 △상무보 김두섭 호텔롯데 △상무 신인협 이정주 △상무보 김현령 안영삼 호텔롯데 롯데면세점 △상무 이정민 이준영 △상무보 김원식 호텔롯데 롯데월드 △전무 권오상 △상무 고정락 롯데건설 △전무 박영천 △상무 신만수 유재용 장지영 △상무보 백승엽 성화승 이동진 이동혁 이재영 임웅정 현세인 홍종수 롯데건설CM사업본부 △상무보 류원상 롯데렌탈 △상무 손명정 신상훈 △상무보 안성빈 최현우 롯데정보통신 △상무 박종남 △상무보 신현호 오실묵 오혜영 윤성준 롯데글로벌로지스 △상무 정석기 △상무보 정진영 롯데캐피탈 △상무 김두한 △상무보 김경래 김남희 최만호 롯데물산 △상무 윤재성 △상무보 이상훈 대홍기획 △상무 양수경 △상무보 이광현 롯데컬처웍스 △상무 장민호 캐논코리아 △상무보 정근석 롯데미래전략연구소 △상무 조기영 △상무보 안중인 롯데바이오로직스 △상무 하종수 △상무보 강주언 롯데지주 △전무 김승욱 주우현 △상무 김재권 김종근 백철수 △상무보 강규홍 강병훈 김석철 김수년 박현용 정성윤 정용주⊙ 코닝정밀소재 <승진> ◇상무 △한상진
2023-06-20,‘굴뚝’ 내다파는 석유화학…수익성 떨어지자 배터리·반도체로,"울산시 남구 석유화학공단의 모습. 연합뉴스대표적인 굴뚝 업종인 석유화학 회사들의 변신에 속도가 붙고 있다. 이차전지·반도체 소재 등 신사업 분야로의 확장을 위해 상대적으로 수익성과 성장성이 떨어지는 기존 화석연료 관련 사업 부문 매각이 활발하다.19일 금융감독원 전자공시와 업계 말을 종합하면, 엘지(LG)화학은 전라북도 익산의 양극재 공장 설비와 부지 매각을 추진 중이다. 연간 생산능력이 적은 공장은 정리하고 구미공장(생산능력 약 6만톤)과 청주공장(약 7만톤)으로 사업을 집중하려는 포석에서다. 또 보유 중인 엘지에너지솔루션 지분 중 약 2%도 매각할 것으로 알려졌다. 노우호 메리츠증권 연구원은 “전세계에 생산기지 마련을 위한 투자 재원 확보가 필요하다”고 풀이했다.에스케이씨(SKC)는 최근 자회사 에스케이피유코어 매각을 결정했다. 현재 복수의 회사들과 매각 협상이 진행 중이다. 이 회사는 폴리우레탄 관련 사업을 전담하는 에스케이씨 계열사다. 이미 에스케이씨는 지난해 필름·가공 사업을 국내 사모펀드 운용사인 한앤컴퍼니에 1조6천억원을 받고 매각한 바 있다. 비주력 사업 매각이 빠르게 진행되는 모양새다. 에스케이씨 쪽은 “친환경·이차전지·반도체 소재 분야 주력 회사로 전환하기 위해 전통 사업들을 정리하고 있다”고 말했다. 매각 자금은 반도체 패키징 사업에 쓸 예정이다.앞서 롯데케미칼도 지난 1월 국외 자회사인 롯데케미칼파키스탄(LCPL) 보유지분 전량(75.01%)을 약 2천억원에 팔아치웠다. 롯데케미칼은 지난해 배터리 음극재의 핵심 소재(동박) 업체인 일진머티리얼즈를 인수하는 등 2차전지 관련 사업 비중을 늘리는 중이다.신사업 진출을 위한 자금 마련이란 이유 외에도 전통 분야의 수익 악화도 이런 움직임을 추동하는 주요 원인이다. 석유화학기업들은 2021년 이후 중국의 코로나19 방역 봉쇄 영향으로 구조적인 수요 부진에다 유가 상승에 따른 수익성 악화에 어려움을 겪어 왔다. 올해 들어서도 중국의 ‘리오프닝 효과’가 기대에 미치지 못하면서 어려움이 지속되는 모양새다.노국래 엘지(LG)화학 석유화학사업본부장은 19일 직원들에게 “경쟁력이 없는 한계 사업에 대해서는 구조조정을 늦출 수 없는 상황”이라며 “장기 가동 중지, 사업 철수, 지분매각, 합작법인(JV) 설립 등을 통해 사업 구조를 재편하고 이에 따른 인력 재배치를 추진하겠다”고 메일을 보냈다. 엘지화학 석유화학 부문은 수익성 악화로 지난해 4분기 영업손실 1660억원에 이어 올해 1분기에도 영업손실 508억원을 기록한 바 있다.삼성증권이 지난달 말 발표한 보고서를 보면 “2020년 이후 순수화학 회사와 배터리 소재 사업으로 확장한 화학 회사 간 기업 가치 차별화도 눈여겨볼 지점”이라고 분석했다. 실제 배터리 사업을 직접 하거나 자회사로 둔 엘지화학과 에스케이씨의 기업가치(시가총액 기준)는 최근 2년 새 증가했으나 순수 화학회사인 롯데케미칼과 대한유화 등의 기업가치는 하락했다. 업계 관계자는 “한국 제품 수입을 많이 해온 중국의 석유화학제품 자급률이 높아지면서 세계 성장률과 유사하게 성장을 구가해 왔던 석유화학업계의 과거 공식이 깨지고 있다”며 “업체들이 새 먹거리를 찾기 위해 기존 사업 비중을 낮추거나 자산을 매각하는 주된 이유”라고 말했다."
2023-06-30,CGV·SK이노 주가 흔든 자금조달 증자…계열사 ‘위험 전이’ 촉각,"재무사정 악화로 증자 등 자금 조달 나섰지만계열사에도 부담 줄 것이란 시장 우려 불붙여게티이미지코리아최근 주요 대기업 계열사들의 대규모 유상증자나 신용등급 강등이 잇따르고 있다. 계열사들의 재무 구조 악화가 연쇄적으로 그룹 전반에 미칠 영향에 대해 투자자들이 촉각을 곤두세우는 모습이다.지난주 씨제이(CJ) 씨지브이(CGV)와 에스케이(SK)이노베이션은 대규모 유상증자 계획을 연달아 발표했다. 에스케이이노베이션은 지난 23일 1조1777억원 규모의 유상증자를 추진한다고 공시했다. 조달 자금은 시설자금, 채무상환자금, 타법인 증권 취득자금 등으로 쓰일 예정이다. 이번 유상증자는 주주배정후 실권주 일반공모로 추진되는데, 지분 34.9%를 보유한 최대주주인 에스케이가 증자에 얼마나 참여할지는 아직 밝혀지지 않은 상태다.투자자들은 이번 에스케이이노베이션 유상증자가 그룹 전체에 끼칠 영향을 예의주시하고 있다. 유상증자 발표 다음 거래일인 지난 26일 에스케이이노베이션 주가는 6.08% 급락했는데, 에스케이의 주가 역시 4.17%나 떨어졌다.앞서 지난 20일 씨제이 씨지브이의 유상증자 계획 발표도 전체 그룹 주가를 흔들었다. 현재 상장 주식수의 1.5배를 웃도는 7470만주를 새로 발행하는 5700억원 규모의 유상증자(주주배정후 실권주 일반공모)와 약 4500억원으로 자체 평가한 씨제이 보유 주식(씨제이 올리브네트웍스 지분 100%)을 현물출자한다는 게 발표 내용이다. 조달 자금은 채무상환과 시설·운영자금에 쓰인다.유상증자 계획이 발표된 다음 날인 21일 씨지브이 주가는 21.1% 급락했고, 씨제이와 씨제이제일제당도 각각 4.99%, 5.31% 하락했다. 다만 씨지브이의 지분을 48.5% 갖고 있는 씨제이는 이번 유상증자에 600억원만 참여할 예정이다.롯데그룹도 계열사 무보증사채의 신용등급이 줄줄이 강등돼 우려를 낳고 있다. 한국기업평가와 한국신용평가, 나이스신용평가 등 국내 3대 신용평가사들은 최근 정기평가에서 롯데케미칼의 신용등급을AA+(등급전망은 부정적)에서AA(안정적)로, 롯데지주의 신용등급을AA(부정적)에서AA-(안정적)로 하향 조정했다. 롯데쇼핑이 발행한 롯데지주 연대보증채 신용등급도AA(부정적)에서AA-(안정적)로 내려왔다.나이스신용평가는 지난 20일 펴낸 보고서에서 “롯데케미칼은 영업창출 현금 규모의 축소와 대규모 투자자금 소요로 인한 재무 부담 증가 등을 감안해 장기신용등급을 조정했고, 롯데지주는 롯데케미칼의 신용도 하락과 자회사 지분투자 증가에 따른 재무 부담 확대 등을 고려해 (신용등급을) 조정했다”고 밝혔다.대기업의 경우 상대적으로 재무 상황이 우량한 계열사가 어려움에 빠진 다른 계열사의 구원투수로 등판하는 경우가 많다. 이 때문에 특정 계열사의 여건이 나빠졌을 때 자연스럽게 다른 계열사로도 부담이 옮겨갈 위험이 존재하며, 때로는 구원투수를 자처한 기업의 소수주주와 지배주주 간 갈등으로 번지기도 한다.이상호 자본시장연구원 연구위원은 “우량 계열사의 지원을 통해 위험의 전이를 막을 수 있다는 면에서 긍정적인 부분이 있다”면서도 “다만 시장 투자자들은 한 계열사의 상황이 안 좋아졌을 때 우량 계열사의 기업 가치도 할인해서 볼 가능성이 있다”고 말했다."
2024-03-20,롯데 신동빈 지난해 보수 177억1500만원…신세계 정용진 37억,"신 회장 호텔·물산 포함 200억 넘어 ‘연봉 킹’ 오를 듯신동빈 롯데그룹 회장(왼쪽 사진)과 정용진 신세계그룹 회장. 각사 제공신동빈 롯데그룹 회장이 지난해 롯데지주와 4개 계열사에서 보수로 177억1500만원을 받은 것으로 나타났다. 사업보고서를 공개하지 않은 계열사 보수까지 포함하면 총액은 200억을 넘어설 것으로 보인다. 지난해에 이어 ‘보수 1위’에 올라설 것이 확실시된다. 신 회장은 지난해 총 189억800만원을 받았다.20일 금융감독원 전자공시시스템 사업보고서를 보면, 신 회장은 지난해 롯데지주에서 급여 38억3천만원과 상여 26억1700만원, 복리후생비 200만원 등 모두 64억4900만원을 받았다. 또 롯데케미칼에서 38억3천만원, 롯데쇼핑에서 19억원, 롯데웰푸드에서 24억4300만원, 롯데칠성음료 30억9300만원 등을 받았다. 5개 회사에서 받은 보수만 따져도 지난해에 견줘 15%정도 늘어난 수준이다.신 회장은 비상장사인 호텔롯데와 롯데물산에서도 급여를 받고 있다. 사업보고서가 아직 공개되지 않은 이들 기업의 보수까지 더하면 신 회장의 연봉이 200억을 넘을 것이라는 전망이 나온다. 신 회장은 2022년 호텔롯데에서 21억2200만원, 롯데물산에서 13억8500만원을 받은 바 있다.한편, 신세계그룹 정용진 회장은 지난해 이마트에서 급여 19억8200만원, 상여 17억1700만원 등을 포함해 모두 36억9900만원을 받았다. 지난 2022년 36억1500만원보다 8400만원(2.3%) 증가한 수준이다.정 회장의 모친인 이명희 신세계그룹 총괄 회장과 부친 정재은 신세계그룹 명예회장은 지난해 이마트에서 각각 30억6500만원을 받았다. 이 총괄회장 부부의 경우, 앞서 신세계에서 받은 연봉은 공개되지 않았다. 사업보고서에는 보수총액이 5억원을 넘는 등기임원과 회사 내 보수총액 상위 5위에 들며 그 규모가 5억원 넘는 미등기임원만 공시된다. 지난해엔 미등기임원인 이 총괄회장 부부의 연봉 순위가 5위권 밖으로 밀린 탓에 공시 대상에서 빠졌다."
2024-03-20,"롯데, 사외이사 이사회 의장·선임사외이사제 도입","“거버넌스 혁신 통해ESG경영 강화” 설명롯데그룹이 계열사 이사회에 ‘사외이사 이사회 의장’과 ‘선임사외이사’ 제도를 도입한다고 밝혔다. 그룹의 양대 축인 유통·화학 사업이 시장 변화에 뒤쳐지고 있다는 지적이 나오고 있는 가운데, ‘외부’ 시선을 가진 이사의 목소리를 강화하려는 것으로 풀이된다. 다만 신동빈 회장이 사내이사로 있는 롯데그룹 지주회사 ㈜롯데지주의 이사회에는 사외이사 의장 대신 선임사외이사제부터 도입한다고 밝혔다.롯데그룹은 20일 보도자료를 내어 “롯데는 ‘사외이사 이사회 의장’과 ‘선임사외이사’ 제도를 도입해 경영 투명성 강화와 사외이사 독립성 제고에 나서는 등 거버넌스를 혁신하기로 했다”고 밝혔다. 선임사외이사 제도 등은 국내 대기업 가운데 삼성그룹과 에스케이(SK)그룹의 일부 계열사만 도입해 시행중이다.롯데는 그룹 내 비상장사인 롯데지알에스(GRS)와 대홍기획에 먼저 사외이사 이사회 의장을 도입한다. 국내 기업에서는 일반적으로 대표이사가 이사회 의장 직을 맡는 경우가 많은데, 이를 사외이사에게 넘기는 것이다. 시장에서는 사외이사가 의장을 맡으면 이사회 독립성이 높아질 수 있다고 본다. 롯데 관계자는 “사외이사 의장은 대표이사의 경영활동 전반을 견제하고 감독하게 된다”고 설명했다. 롯데는 비상장사에 먼저 도입한 뒤 상장사 전체로 확대해 나가는 방안을 검토하기로 했다.롯데지주, 롯데웰푸드, 롯데쇼핑, 롯데케미칼, 롯데렌탈, 롯데칠성, 롯데하이마트, 롯데정밀화학, 롯데정보통신, 롯데에너지머티리얼즈 등 10개 상장사에는 ‘선임 사외이사 제도’를 도입한다. 선임사외이사 제도는 사내이사가 이사회 의장을 맡을 경우, 사외이사를 대표하는 선임 사외이사를 임명해 견제·균형을 도모하는 제도다. 선임사외이사는 사외이사 전원으로 구성되는 사외이사회를 단독으로 소집할 수 있다. 이를 통해 경영진에 현안보고 요구 및 의견을 제시하는 중재자 역할을 하고 경영진을 견제·감독하는 역할을 한다.롯데 관계자는 “금융권에서 선임사외이사 제도를 의무화하고 있지만, 일반 기업은 의무사항이 아니다. 롯데는 이 제도를 상장사에 선제적으로 도입하고 추후 비상장사로도 확대할 계획”이라고 설명했다. 각 상장사의 선임사외이사는 주주총회가 끝난 뒤 진행되는 이사회에서 선임할 예정이라고 롯데는 밝혔다."
2023-02-01,기업들 ‘온실가스 감축’ 역주행…상위 50대 3년새 5.9% 늘어,"매출액 대비 배출량은 5.6%↓포스코 최다…삼성전자 증가율 최고‘2030년 40% 감축’ 국가목표 무색게티이미지뱅크국내 대기업들의 온실가스 배출량이 국가온실가스감축목표(NDC)를 설정한 2018년 이후 되레 증가한 것으로 나타났다. 다만, 매출액 대비 배출량은 감소 추세로 분석됐다.1일 기업분석연구소 리더스인덱스가 온실가스 배출량이 많은 상위 50대 기업을 분석한 결과를 보면, 이들 기업의 온실가스 배출량은 2021년 2억7277만t으로 2018년(2억5765만t)보다 5.9% 늘었다. 같은 기간 국내 전체 온실가스 배출량은 7억2760만t에서 6억7960만t으로 6.6% 감소했다. 온실가스 배출량 상위 기업은 국가온실가스종합정보센터 자료와 각 기업 사업보고서 등을 토대로 조사(발전 공기업 제외)한 것이다.다만, 매출액 1억원당 온실가스 배출량은 2018년 평균 28.5t에서 2021년 26.9t으로 5.6% 감소했다. 매출액 1억원당 배출량은 33개 기업이 감소했고, 17개 기업은 증가했다. 지난해 3월 시행된 탄소중립기본법에 따라 기업들은 2030년까지 온실가스 배출량을 2018년 대비 40% 이상을 의무적으로 감축해야 한다.가장 많은 온실가스를 배출하는 포스코의 배출량은 2018년 7312만t에서 2021년 7848만t으로 7.3% 증가했다. 다만, 매출액 1억원당 배출량은 8.6% 감소했다. 이어 현대제철(2849만t), 삼성전자(1449만t), 쌍용씨앤이(1061만t), 에쓰오일(1004만t), 엘지화학(902만t), 지에스칼텍스(845만t), 현대오일뱅크(751만t), 롯데케미칼(706만t), 에스케이에너지(670만t) 순으로 배출량이 많았다. 상위 10개 기업 중 쌍용씨앤이·에스케이에너지를 두 곳을 빼곤 2018년 대비 배출량이 모두 늘었다. 같은 기간 포스코·쌍용씨앤이·엘지화학은 매출액 1억원당 배출량이 감소했다.삼성전자는 온실가스 배출량 증가율이 가장 높았다. 삼성전자의 배출량은 2018년 1077만t에서 2021년 1449만t으로 34.5% 증가했고, 매출액 1억원당 배출량도 17.3% 늘었다. 현대제철(26.5%), 현대오일뱅크(21.5%), 롯데케미칼(20.0%) 등도 온실가스 배출량이 20% 이상 증가했다. 같은 기간 온실가스 배출량이 가장 많이 감소한 기업은 오씨아이(-42.2%)였고, 이어 엘지디스플레이(-28.6%), 디비메탈(-21.6%), 에스케이지오센트릭(-20.0%) 순이었다."
2023-01-23,"직장인 ‘웃고 울리는’ 우리사주…참여해도 걱정, 안해도 걱정","지난해 주식 급변동에 크래프폰·카카오페이 등 손실이달 말 보호예수 끝나는LG엔솔 직원 ‘행복한 고민’올해 자금시장 악화로 유상증자 기업 늘어날 전망고금리·경기 악화 등으로 직장인 고민에 빠져클립아트코리아 제공롯데케미칼 이진건(가명) 차장은 최근 우리사주조합에 배정된 유상증자에 참여할지 막판까지 고민했다. 주당 발행가는 14만3천원으로 올 1월 주가인 17만∼18만원보다 꽤 낮지만, 대출금으로 참여해야 했기 때문이다. 대출 변동금리는 5.02%이고 회사에서 1년간 이자 2%포인트는 지원해주기로 했다. 현 주가보다 낮지만 대출로 참여해야 돼 결국 포기했다. 지난 19일 마감한 우리사주조합 청약에는 60%가량만 참여한 것으로 알려졌다.이 차장처럼 유상증자는 직장인에게 큰 고민거리다. 기업은 상장이나 유상증자를 할 경우 직원들에게 우리사주조합을 통해 새 주식 발행 물량의 20%를 우선 배정해야 한다. 유상증자가 롯데케미칼처럼 유동성 위기 등 어려움에 처했을 때 자금을 수혈하려고 사용되는 경우가 많다. 더욱이 새 주식을 받아도 1년간 주식을 팔 수 없다. 막상 팔 수 있게 될 때는 신주 공모가보다 낮은 경우도 있어 우리사주가 손실을 낳기도 한다.올해는 유상증자에 나설 기업이 많을 것으로 예상된다. 경기 상황이 좋지 않아 외부 자금을 수혈해야 하는 기업이 많기 때문이다. 황세운 자본시장연구원 선임연구위원은 “2년 연속 적자를 내는 등 한계기업이 올해 많아져 유상증자를 하는 기업이 상당할 것”이라고 말했다. 고금리 시대에 돈을 빌려 유상증자에 참여할지 고민하는 직장인이 더 많아질 수밖에 없는 셈이다.주가 변동이 컸던 지난해에 우리사주를 받은 직장인들의 희비가 엇갈렸다. 크게 손실을 본 곳은 크래프톤과 카카오뱅크, 카카오페이 등이다. 크래프톤은 2021년 8월 상장했고 직원들은 우리사주로 1인당 평균 278주를 받았다. 공모가는 49만8천원이었는데, 지난해 8월 1년간의 보호예수가 풀린 뒤 25만원대로 팔 경우 손해를 볼 처지였다. 올 들어선 더 떨어져 20일 17만2500원으로 마감했다. 공모가의 3분의 1 수준이다.카카오뱅크와 카카오페이도 마찬가지다. 카카오뱅크는 2021년 8월6일 상장 첫날 공모가 3만9천원 대비 178.9%나 주가가 뛰며 순조로운 출발을 했지만 지난해 폭락했다. 카카오페이도 같은해 11월3일 상장 첫날 19만3천원으로 공모가(9만원) 대비 114.4% 급등하면서 장을 마쳤지만, 20일 6만6100원으로 추락했다. 억대의 우리사주를 배정받은 직원들은 한때 수억원의 수익을 냈다고 환호했지만, 막상 보호예수 기간이 풀린 뒤에는 공모가보다 낮아 고민에 빠져야 했다.반면 엘지(LG)에너지솔루션 직원들의 분위기는 다르다. 오는 27일부터 우리사주로 받은 엘지에너지솔루션 주식을 팔 수 있게 되면서, 더 갖고 있을지 혹은 이익을 실현할지 고민 중이다. 이 회사의 한 임원은 “임직원들이 작게는 1억원에서 많게는 5억원까지 우리사주로 신주를 받았다”며 “현재 공모가 30만원보다 크게 올라 이익 실현을 할 것인지, 회사 성장 가능성을 믿고 계속 보유할지 고민하는 이들이 많다”고 말했다. 지난 20일 종가는 46만9500원이었다.회사가 어려워 실시한 유상증자에 참여했다가 한때 큰 손실을 봤지만, 나중에 회복한 경우도 있다. 에이치엠엠(HMM) 임진경(가명) 책임은 한때 우리사주로 큰 손실을 봤다가 2021년 주가가 급반등하면서 많이 회복했다. 현대상선 시절이던 2000년대 중반 이후 해운업이 어려워지면서 거의 해마다 실시하는 유상증자에 참여했다가 한때 수천만원 손해를 봤다. 그는 “2008년 수천만원을 넣었다가 2015년엔 1억원 넘게 유상증자에 참여했다”며 “회사 대출 지원을 포함해 수억원을 넣었는데 계속 주가가 떨어져 팔지도 못하고 보유해 2019년까지 큰 손실을 기록하다 2021년에야 주가가 반등해 회복할 수 있었다”고 말했다.황세운 선임연구위원은 “지난해 주식시장이 크게 변동하면서 손실을 본 경우가 있지만, 평균적으론 우리사주로 수익을 낸 경우가 손실을 본 경우보다 많다”고 말했다. 이어 “회사로서는 회사 성장과 임직원의 이해를 동일한 방향으로 놓는다는 측면에서 우리사주의 긍정적인 역할을 기대할 수 있다”며 “투자 측면에선 회사 정보에 밝은 임직원들이 회사 비전과 자신의 자금 사정 등을 고려해 판단해야 한다”고 말했다."
