date,title,content
2024-12-23,롯데 재무개선에 속도… 땅 팔고 헬스케어 철수,"영통 롯데마트 부지 870억에 매각백화점 매각도 검토, 현금 확보롯데마트CI./롯데마트최근 ‘유동성 위기설’이 불거진 롯데그룹이 중장기 전략에 맞지 않는 사업을 정리하고 유휴 자산을 매각하는 등 재무 개선에 속도를 내고 있다.22일 롯데에 따르면, 롯데는 지난 9월 폐점한 경기도 수원 롯데마트 영통점 부지를 870억원에 매각하는 계약을 최근 체결했다. 계약은 잔금 지급 등의 절차를 거쳐 내년 6월쯤 마무리된다. 롯데마트 관계자는 “영통점 매각 대금은 노후 점포 리뉴얼과 내년 신규 출점하는 천호점, 구리점에 투입할 계획”이라고 밝혔다.롯데는 유동성 위기설을 잠재우기 위해 불필요한 사업을 정리하고 현금 확보에 적극적으로 나서는 모습이다. 지난 6일에는 국내 렌터카 업계 1위인 롯데렌탈을 홍콩계 사모펀드(PEF)에 매각해 1조5729억원을 확보했다. 신성장 사업 가운데 하나로 추진해온 개인 맞춤형 건강관리 플랫폼 ‘롯데헬스케어’도 사업성이 적다는 판단하에 연내 서비스를 종료하기로 했다. 추가 자금 확보를 위해 롯데백화점 부산 센텀시티점, 호텔 브랜드 ‘L7′과 ‘시티’를 매각하는 방안도 검토하고 있다.위기설의 발단이 된 롯데케미칼의 회사채 조기 상환 위험은 일단 해소됐다. 롯데는 지난 19일 사채권자 집회를 열고 채권자들이 대출금을 조기에 회수할 수 있도록 한 재무 특약을 조정했다. 사채권자들의 신뢰를 얻기 위해 롯데는 그룹의 상징인 롯데월드타워를 담보로 세웠다.롯데케미칼은 본격적으로 사업구조 개편에 나설 방침이다. 현재 60% 이상을 차지하는 기초 화학 포트폴리오 비율을 2030년까지 30% 이하로 줄이고, 첨단 소재와 정밀화학·전지소재·수소에너지 등의 사업 비중을 높이기로 했다."
2024-12-07,"롯데렌탈 매각… 롯데그룹, 1조6000억 확보","홍콩계 사모펀드 어피니티에 경영권 지분 56% 넘기기로… 비상경영 전환 후 첫 자산 매각롯데렌탈이 운영하는 롯데렌터카 서울역 지점 전경. /롯데렌탈국내 렌터카 업계 1위인 롯데렌탈이 홍콩계 사모펀드(PEF) 운용사 어피니티에쿼티파트너스(어피니티)에 매각된다. 롯데그룹은 6일 호텔롯데와 부산롯데호텔이 보유한 롯데렌탈 경영권 지분 총 56.2%를 매각하는 내용의 양해각서(MOU)를 어피니티와 체결했다고 밝혔다. 최근 ‘유동성 위기설’이 나돈 롯데는 이번 매각으로 1조5729억원을 확보하게 됐다. 롯데 측은 “롯데렌탈은 업계 1위로 우수한 수익성을 유지하고 있었으나 렌탈업 성격이 그룹의 장기 전략과 맞지 않는다는 판단에 따라 매각했다”며 “이번 매매 대금은 호텔롯데 등의 차입금 상환과 글로벌 진출을 위한 재원으로 활용될 것”이라고 밝혔다.이번 매각은 롯데가 지난 8월 비상경영체제로 전환한 이후 첫 자산 매각이다. 롯데는 핵심 사업인 유통과 화학 부문 실적이 부진한 데 더해 롯데케미칼 등 계열사에서 유동성 위기설이 불거졌다. 롯데 측은 “당장 유동성에 아무 문제가 없다”며 담보로 그룹 상징인 롯데월드타워를 제공하는 결정까지 내렸다. 롯데는 추가 자금 확보를 위해 롯데백화점 부산 센텀시티점, 호텔 브랜드 ‘L7′과 ‘시티’ 등을 매각하는 방안을 검토하고 있다.어피니티는 올해 8월 업계 2위인SK렌터카에 이어 1위 롯데렌탈까지 운영하게 됐다. 향후 3년은SK렌터카와 롯데렌탈을 별도 법인으로 운영할 예정이다."
2024-11-27,롯데케미칼 특약 조정 담보로 그룹 상징 ‘롯데월드타워’ 제공,"롯데가 롯데케미칼 특약 조정 담보로 그룹의 상징인 롯데월드타워를 제공한다고 27일 밝혔다. 롯데케미칼 일부 공모 회사채의 재무 특약 미준수 사유가 발생하자, 그룹 핵심 자산인 롯데월드타워를 담보로 제공해 시장 우려를 불식시키겠다는 것이다.지난 21일 롯데케미칼 일부 공모 회사채의 사채관리계약 조항 내 재무 특약을 미준수해 기한이익상실(EOD) 원인 사유가 발생했다. 롯데케미칼은 사채권자들과 협의를 통해 특약 사항 조정에 나선다는 방침을 세웠다. 롯데는 특약 사항을 조정하기 위해 은행보증을 택했다. 은행보증을 통해 롯데케미칼 회사채의 신용도를 강화한다는 것이다.롯데케미칼 1대 주주인 롯데지주는 실물 자산이 없기 때문에 2대 주주인 롯데물산이 나섰다. 롯데물산은 롯데월드타워의 토지와 건물을 포함한 지분 100%를 갖고 있다. 롯데케미칼의 2대 주주인 롯데물산이 이사회를 통해 롯데월드타워를 담보로 제공하기로 결정한 것으로 전해졌다. 롯데월드타워의 현재 가치는 6조원 이상으로 알려졌다. 롯데는 “그룹 차원의 강력한 시장 안정화 의지를 담은 대책”이라며 “최근 불거진 위기설에 대해 그룹이 직접 나서 책임지고 이를 해결하겠다는 방침”이라고 설명했다.롯데케미칼은 다음달 19일 사채권자 집회를 소집해 사채관리계약 조항 내 재무 특약을 없애는 방안을 논의할 계획이다.롯데월드타워 전경./롯데 제공"
2024-05-02,"롯데케미칼, 국내 최대 컴파운딩 공장 착공","율촌 산업단지에 연산 50만t 규모롯데케미칼이 지난달 30일 전남 율촌산업단지에 국내 최대 규모 컴파운딩 공장 착공식을 열었다고 1일 밝혔다. 컴파운딩은 두 개 이상 플라스틱 소재를 최적의 조합으로 섞어 기능을 향상하는 작업이다.롯데케미칼의 자회사 삼박LFT가 짓는 이 공장은 연산 약 50만t 규모로 국내 최대 컴파운딩 소재 공장이다. 가전제품·휴대폰·노트북 등IT기기에 사용되는 고부가 합성수지(ABS), 폴리카보네이트(PC)를 내년 하반기부터 생산하게 되며, 이후 추가 투자를 통해 70만t까지 확대한다. 총 투자 금액은 4500억원이다. 삼박LFT는 기존 충남 아산·예산 공장에서 자동차·전기전자용 복합재(LFT)와 복합수지(TPO) 등 특수 컴파운딩 소재를 만들어왔는데 이번에 새 품목을 추가한 것이다. 롯데그룹은 삼박LFT를 첨단 소재 생산 전담 회사로 육성한다는 방침이다. 롯데케미칼은 글로벌 수요 부진과 중국의 공급과잉 등에 따른 업황 악화로 지난 2년간 1조원의 적자가 누적됐다. 최근 중국 범용 제품 공장을 모두 정리하고, 고부가가치 소재 생산을 확대하며 사업 구조를 재편 중이다."
2024-05-01,"롯데케미칼, 전남 율촌산단에 국내 최대 컴파운딩 공장 착공","롯데케미칼 자회사 삼박LFT가 전남 율촌 산단 내에 신규 컴파운딩 공장을 착공했다고 1일 밝혔다. 지난달 30일 진행된 착공 행사에서 김영록 전남도지사(앞줄 왼쪽 4번째부터), 이훈기 롯데케미칼 총괄대표이사, 노관규 순천시장, 이영준 롯데케미칼 첨단소재사업 대표 등이 기념 촬영하고 있다. /롯데케미칼 제공롯데케미칼이 지난 30일 전남 율촌산단에서 자회사인 삼박LFT의 신규 컴파운딩 공장 착공식을 진행했다고 1일 밝혔다. 내년 하반기 가동이 목표다.컴파운딩은 두개 이상의 플라스틱 소재를 최적의 조합으로 섞어 새로운 기능을 구현하는 고부가가치 플라스틱을 만들어내는 작업이다.신규 공장이 완공되면 고부가합성수지(ABS), 폴리카보네이트(PC) 등 약 50만t 규모의 국내 최대 컴파운딩 소재 생산 규모를 갖추게 된다. 이후 추가 투자를 통해 향후 이를 70만t까지 확대한다는 계획이다. 계획된 총 투자 금액은 4500억원이다.삼박LFT는 기존 충남 아산·예산 공장에서는 자동차·전기전자용 복합재(LFT)와 복합수지(TPO)등 기능성 특수 컴파운드 소재를 생산하고, 율촌 신규 공장에서는 가전 제품과 휴대폰·노트북 등 정보기술(IT) 기기 등에 사용되는ABS·PC컴파운딩 소재를 생산해 효율성을 높인다는 계획이다. 롯데그룹은 삼박LFT를 그룹 화학사업 중 ‘첨단소재 생산’을 전담하는 회사로 육성한다는 방침이다.이훈기 롯데케미칼 총괄대표는 “율촌산단에 2026년까지 약 3000억원 이상을 투자해 국내 최대 규모인 연산 50만t의 컴파운드 생산 공장을 구축해 글로벌 넘버원 기능성 첨단소재 기업으로 도약할 것”이라고 말했다.롯데케미칼은 석유화학 업황 악화로 지난 2년간 1조원의 적자가 누적됐다. 지난해 범용 제품을 생산하는 중국 공장을 모두 정리하고, 고부가가치 첨단소재 중심으로 사업 구조 재편중이다."
2024-03-06,"롯데케미칼, 말레이시아 생산기지 롯데케미칼타이탄 매각 타진","롯데케미칼CI.국내 2위 석유화학 기업인 롯데케미칼이 말레이시아에 있는 생산기지인 롯데케미칼타이탄(LC타이탄) 매각을 추진하고 있는 것으로 알려졌다.롯데케미칼은 국내외 석유화학 기업 및 대형 사모펀드(PEF) 등을 대상으로 말레이시아에 있는LC타이탄 매각을 위해 인수자 물색에 나선 상태다.LC타이탄은 롯데케미칼이 지분 74.7%를 보유한 말레이시아 증시 상장사다. 주요 생산 품목은 석유화학 제품의 원료가 되는 에틸렌, 폴리에틸렌(PE), 폴리프로필렌(PP) 등이다.LC타이탄은 2010년대 중후반까지 매년 3000억~5000억원가량의 이익을 냈고, 2017년 인수가격의 2.5배 가치(시가총액 4조원)로 상장했다. 하지만 한국 석유화학 제품 최대 수입국이던 중국이 에틸렌, 프로필렌 등 기초 화학소재 자급화에 나선 영향으로 2022년 2분기부터 적자를 냈다. 현재 기업 가치는 7400억원 정도로 알려졌다."
2024-11-29,"롯데, CEO 18명 한꺼번에 바꿨다","창사 이후 최대 규모 임원 인사그래픽=김하경롯데그룹이 28일 창사 이래 최대 규모의 임원 인사를 단행했다. 롯데 내부 기준으로 계열사 58곳 가운데 3분의 1에 가까운 18곳의 대표이사를 한꺼번에 교체했다. 대표이사가 교체된 계열사에는 롯데케미칼, 롯데면세점, 호텔롯데 등 주요 계열사도 일부 포함됐다. 롯데그룹 전체 임원의 22%는 이번 인사로 퇴임했다. 롯데그룹 신동빈 회장의 아들 신유열(38) 롯데지주 미래성장실장(전무)은 부사장으로 승진했다.롯데그룹은 올 들어 주력 계열사가 실적 부진에 시달리며 롯데지주, 롯데케미칼, 롯데면세점 등이 잇따라 비상 경영 체제에 돌입했다. 재계에서는 롯데가 이번 인사를 통해 전면적인 쇄신에 돌입했다는 평가를 내놓고 있다. 롯데는 “고강도 쇄신을 통해 경영 체질을 본질적으로 혁신하고 구조 조정을 가속화하겠다는 단호한 의지를 반영했다”고 밝혔다.그래픽=김하경화학CEO13명 중 10명 교체롯데그룹은 앞서 2022년 12명, 지난해 14명의CEO를 바꾼 데 이어 올해 18명의CEO를 한꺼번에 바꾸는 초대형 인사 쇄신을 단행했다. 최근 3년간 계열사CEO대부분을 교체한 셈이다. 특히 올해는 그룹 실적 악화의 주원인이자 그룹 핵심 계열사인 화학과 호텔에서 대거 교체가 이뤄졌다. 이번 인사로 임원도 대폭 줄어 전체의 22%가 퇴임했다.롯데그룹에서 유통과 함께 양대 산맥으로 꼽히는 화학군은 이번에 인사 폭이 특히 컸다. 화학군에는 롯데케미칼, 롯데정밀화학 등이 포함된다. 화학군CEO13명 가운데 지난해 선임된 롯데알미늄, 롯데에너지머티리얼즈,LCUSA의 대표를 제외한 10명이 동시에 교체됐다. 화학군 임원 가운데 30%가 퇴임했다. 롯데 화학군을 이끌었던 이훈기 사장은 1년 만에 물러났다. 2015~2019년 매년 1조원이 넘는 영업이익을 올리던 롯데케미칼은 올해 1~3분기 누적 적자가 6600억원에 달한다. 면세점까지 맡고 있는 호텔롯데 역시 롯데면세점은 물론 롯데호텔, 롯데월드 등 3개 사업부 대표이사가 전부 교체됐다.반면 롯데지주 이동우 부회장, 롯데 유통군 총괄대표 김상현 부회장, 롯데건설 박현철 부회장, 롯데 식품군 총괄대표 이영구 부회장 등 4명의 부회장단은 전원 유임됐다. 신동빈 회장이 계열사 대표를 대거 교체하면서도 부회장단에 신뢰를 표명하는 방식으로 그룹 경영의 중심을 잡으려 했다는 해석이 나왔다.노준형 롯데지주 경영혁신실장(부사장)은 사장으로 승진했다. 노 사장은 경영혁신실과 사업지원실을 통합해 그룹의 컨트롤타워 역할을 하는 신규 조직을 이끌게 됐다. 이영준 롯데케미칼 첨단소재 대표이사 부사장은 사장으로 승진해 롯데 화학군 총괄대표를 맡는다. 롯데 관계자는 “이 사장은 롯데케미칼 기초소재 대표이사를 겸임해 기초 화학 중심 사업을 고부가가치 스페셜티 중심 사업 구조로 전환하는 작업을 진두지휘한다”고 설명했다. 롯데 화학군HQCTO(기술전략본부장) 황민재 전무는 부사장으로 승진해 롯데케미칼 첨단소재 대표이사로, 롯데이네오스화학 대표이사 정승원 전무는 부사장으로 승진해 롯데정밀화학 대표이사로 기용됐다. 롯데그룹의 경영 리스크를 관리해 온 정호석 롯데지주 사업지원실장(부사장)은 호텔롯데 대표이사로 내정됐다. 정 부사장은 호텔뿐 아니라 롯데월드, 롯데면세점을 포함한 호텔롯데 법인을 총괄 관리하는 법인 이사회 의장도 맡는다.신유열 전무, 부사장 승진신동빈 회장의 아들 신유열 전무는 이날 인사에서 부사장으로 승진했다. 신 부사장은 2022년 상무보에서 상무로 승진했고, 작년 전무로 승진한 데 이어 3년 연속 승진 인사에 이름을 올렸다. 신 부사장은 2022년 롯데스트레티직인베스트먼트 대표이사, 롯데파이낸셜 대표이사 등 투자 계열사 대표직을 맡았고, 롯데지주 미래성장실장과 롯데바이오로직스 글로벌전략실장도 겸임하고 있다. 롯데 관계자는 “신 부사장은 본격적으로 신사업과 글로벌 사업을 진두지휘한다”고 설명했다.롯데는 이번 대규모 인사에 앞서 이미 체질 개선에 돌입한 상황이다. 백화점과 마트, 슈퍼, 홈쇼핑 등이 속한 롯데쇼핑은 15년 만에 7조6000억원 규모의 보유 토지 자산에 대한 재평가를 한다. 15년 사이 폭등한 부동산 가격이 반영돼 부채 비율 축소, 신용도 개선 등 재무 건전성을 높일 수 있다고 기대하는 것이다. 재계 관계자는 “자산 재평가로 자산 가치가 늘어나면 각종 세금 부담도 늘어나는데, 롯데가 재무 건전성을 높이기 위해 결단을 내린 것으로 보인다”고 말했다. 롯데는 27일 롯데케미칼 회사채에 은행 보증을 추가해 안정성을 강화하며 담보로 그룹의 상징인 롯데월드타워를 제공하는 결정을 내리기도 했다. 롯데월드타워의 현재 가치는 6조원 이상으로 알려졌다. 롯데 측은 “그룹 핵심 자산인 롯데월드타워를 은행권에 담보로 제공해 롯데케미칼 유동성에 문제가 없다는 메시지를 시장에 전달한다는 의미”라고 설명했다."
