date,title,content
2023-01-02,"[Biz & Now] 롯데손보, 자동차보험료 인하 스타트","1일 보험업계에 따르면 롯데손해보험은 이날 책임개시 계약부터 개인용 자동차 보험료는 2%, 업무용 자동차 보험료는 5.6%씩 각각 인하했다. 손해보험업계 관계자는 “보험사들이 올해에 자동차 보험료를 인하하겠다고 발표했기 때문에 롯데손해보험을 시작으로 2월 말까지 타사들도 보험료 인하 시행에 나서게 될 것”이라고 말했다."
2024-10-17,고객에 보험설계 맡기니 3만명 호응…역발상 금융상품 뜬다,"━고객참여형 금융상품 호평회사원 박맑은(45)씨는 지난 4월 롯데손해보험(롯데손보)의 영업 지원 플랫폼인 ‘원더’를 통해 보험설계사 자격증을 땄다. 원더는 고객이 보험설계사 자격증을 취득하게 하고, 이후 비대면으로 영업도 할 수 있게 설계·청약·고객관리를 지원하는 새로운 개념의 서비스다. 원래 부업에 관심이 많았던 박씨는 원더를 통하면 회사에 다니면서도, 보험 영업 활동을 함께 할 수 있다는 말에 끌렸다. 특히 본인과 가족 및 지인들의 보험을 직접 가입하면, 설계사 수수료를 받을 수 있다는 점도 매력으로 다가왔다.박씨는 두 달간의 공부를 통해 보험설계사 자격증을 딴 후 자신과 가족들의 보험을 가입하면서 첫 달 약 300만원의 수수료를 수입으로 얻었다. 이후에도 친척과 지인 등의 보험 가입을 도와주며 한 달에 약 70만~100만원의 부수입을 거두고 있다. 박씨는 “내 가족 보험을 내가 알고 설계하니 믿을 수 있다는 것이 가장 큰 장점”이라며 “거기에 수수료까지 나와 일종의 ‘N잡러(여러 가지 직업을 가진 사람)’로 활동할 할 수 있어 만족하고 있다”고 설명했다.고객을 직접 유치하기보다 참여시키는 ‘역발상’ 금융 상품이 호응을 얻고 있다. 특히 새로운 고객층을 발굴해야 하는 업계 ‘후발주자’들이 이런 역발상 상품으로 신규 수요를 더 창출하고 있다. 롯데손보의 원더는 지난해 12월 처음 출시한 이후 지난달까지 3만8807명의 회원을 확보했다. 롯데손보에서 기존에 활동하는 보험설계사가 5000명가량임을 고려하면, 기대 이상의 뜨거운 반응을 얻은 것이다.특히 이 기간 원더에 가입한 회원의 약 40%는 30·40대 젊은 층인 것으로 나타났다. 롯데손보 관계자는 “보험설계사를 주로 50대 이상 중·장년층이 많이 취득한다는데, 원더는 참여형 상품이다 보니 예상외로 젊은 층의 호응이 더 큰 것 같다”고 설명했다. 원더가 인기를 끌자 메리츠화재도 지난 2월에 비대면 영업 플랫폼인 ‘메리츠 파트너스’를 출시해 고객의 보험설계사 업무를 지원하고 있다.토스뱅크가 지난 7월에 출시한 ‘도전통장’도 고객 참여를 끌어내는 대표적 역발상 상품으로 평가받는다. 도전통장은 개설 뒤 1만원 보증금 예치하고, 평일 5일간 고객이 설정해둔 시간(6시·7시·8시·9시)에 일어나 출석에 성공하면 보너스 이자를 받을 수 있는 예금이다. 하지만 보너스 이자는 모두에게 주지 않는다. 전체 참가자들이 모은 보증금 총액에 대한 보너스 이자 전체를 일찍 일어나기에 성공한 고객 중 한 사람을 추첨으로 뽑아 몰아준다. 고객이 번거롭게 정해진 과업을 수행해야 이자를 더 받을 수 있는 상품인데도, 지난달까지 55만6000 계좌가 만들어지며 인기를 끌었다.특히 도전통장에 가입한 사람 중 절반에 가까운 44.7%는 인터넷전문은행이 익숙하지 않은 50대 이상이 차지했다. 토스뱅크 관계자는 “중장년층을 중심으로 최근 ‘앱테크(애플리케이션을 활용한 재테크)’ 열풍이 커지고 있는데, 도전통장도 그런 맥락에서 50대 이상 고객에게 어필을 한 것 같다”면서 “아침에 일찍 일어난다는 자기 목표도 달성하면서, 돈까지 벌 수 있다는 점이 새로운 재미를 준 것”이라고 설명했다.서용구 숙명여대 경영학과 교수는 “상품을 사거나 계약을 체결하는데 고객 참여를 늘리면 해당 상품에 대한 고객 몰입도가 높아지게 된다”면서 “최근 역발상 상품들은 이런 특성을 반영한 것”이라고 설명했다."
2024-10-16,일찍 일어나야 '보너스 이자' 준다…50만 계좌 끌어낸 '역발상',"회사원 박맑은(45)씨는 지난 4월 롯데손해보험(롯데손보)의 영업 지원 플랫폼인 ‘원더’를 통해 보험설계사 자격증을 땄다. 원더는 고객이 보험설계사 자격증을 취득하게 하고, 이후 비대면으로 영업도 할 수 있게 설계·청약·고객관리를 지원하는 새로운 개념의 서비스다. 원래 부업에 관심이 많았던 박씨는 원더를 통하면 회사에 다니면서도, 보험 영업 활동을 함께 할 수 있다는 말에 끌렸다. 특히 본인과 가족 및 지인들의 보험을 직접 가입하면, 설계사 수수료를 받을 수 있다는 점도 매력으로 다가왔다.박씨는 두 달간의 공부를 통해 보험설계사 자격증을 딴 후 자신과 가족들의 보험을 가입하면서 첫 달 약 300만원의 수수료를 수입을 얻었다. 이후에도 친척과 지인 등의 보험 가입을 도와주며 한 달에 약 70~100만원의 부수입을 거두고 있다. 박씨는 “내 가족 보험을 내가 알고 설계하니 믿을 수 있다는 것이 가장 큰 장점”이라며 “거기에 수수료까지 나와 일종의 ‘N잡러(여러 가지 직업을 가진 사람)’로 활동할 할 수 있어 만족하고 있다”고 설명했다.━고객이 직접 보험 설계…역발상 상품에 3만명 호응고객을 직접 유치하기보다 참여시키는 ‘역발상’ 금융 상품이 호응을 얻고 있다. 특히 새로운 고객층을 발굴해야 하는 업계 ‘후발주자’들이 이런 역발상 상품으로 신규 수요를 더 창출하고 있다.롯데손보 원더롯데손보의 원더는 지난해 12월 처음 출시한 이후 지난달까지 3만8807명의 회원을 확보했다. 롯데손보에서 기존에 활동하는 보험설계사가 5000명가량임을 고려하면, 기대 이상의 뜨거운 반응을 얻은 것이다..특히 이 기간 원더에 가입한 회원의 약 40%는 30·40대 젊은 층인 것으로 나타났다. 롯데손보 관계자는 “보험설계사를 주로 50대 이상 중·장년층이 많이 취득한다는데, 원더는 참여형 상품이다 보니 예상외로 젊은 층의 호응이 더 큰 것 같다”고 설명했다. 원더가 인기를 끌자 메리츠화재도 지난 2월에 비대면 영업 플랫폼인 ‘메리츠 파트너스’를 출시해 고객의 보험설계사 업무를 지원하고 있다.━일찍 일어나야 보너스 이자…두 달 만에 50만 계좌토스뱅크가 지난 7월에 출시한 ‘도전통장’도 고객 참여를 끌어내는 대표적 역발상 상품으로 평가받는다. 도전통장은 개설 뒤 1만원 보증금 예치하고, 평일 5일간 고객이 설정해둔 시간(6시·7시·8시·9시)에 일어나 출석에 성공하면 보너스 이자를 받을 수 있는 예금이다. 하지만 보너스 이자는 모두에게 주지 않는다. 전체 참가자들이 모은 보증금 총액에 대한 보너스 이자 전체를 일찍 일어나기에 성공한 고객 중 한 사람을 추첨으로 뽑아 몰아준다. 고객이 번거롭게 정해진 과업을 수행해야 이자를 더 받을 수 있는 상품인데도, 지난달까지 55만6000 계좌가 만들어지며 인기를 끌었다.토스뱅크 도전통장. 토스뱅크특히 도전통장에 가입한 사람 중 절반에 가까운 44.7%는 인터넷전문은행이 익숙하지 않은 50대 이상이 차지했다. 토스뱅크 관계자는 “중장년층을 중심으로 최근 ‘앱테크(애플리케이션을 활용한 재테크)’ 열풍이 커지고 있는데, 도전통장도 그런 맥락에서 50대 이상 고객에게 어필을 한 것 같다”면서 “아침에 일찍 일어난다는 자기 목표도 달성하면서, 돈까지 벌 수 있다는 점이 새로운 재미를 준 것”이라고 설명했다.전문가들은 금융사가 적극적으로 다가가는 전통적 방식의 영업이 아니라, 고객이 직접 참여하고 수행해야 하는 이런 역발상 상품들이 오히려 새로운 충성 고객을 만들 수 있다고 지적한다. 서용구 숙명여대 경영학과 교수는 “마케팅 적으로도 상품을 사거나 계약을 체결하는데 고객 참여를 늘리거나, 과정을 어렵게 만들면 고객이 해당 상품에 대한 몰입도가 높아지게 된다”면서 “그러면 오히려 고객이 상품 구매에 적극 나서면서 계약이 더 쉬워지는데, 최근의 이런 역발상 상품들은 그런 수요를 노린 것”이라고 설명했다."
2024-06-27,"우리금융, 보험업 재진출…동양·ABL생명 인수 추진","우리금융그룹이 10년 만에 보험업에 재진출한다. 임종룡 우리금융 회장 취임 이후 염원해온 비은행 분야 경쟁력 강화 방안의 일환이다.26일 우리금융에 따르면 최근 중국 다자보험그룹과 양해각서(MOU)를 체결하고 동양생명과ABL생명 인수를 위한 실사에 착수할 예정이라고 밝혔다. 다자보험은 동양생명과ABL생명의 최대 주주다. 양측은 현재 최종 가격 산정 절차에 들어갔으며, 정확한 매각 가격은 아직 확정되지 않았다.3월 말 기준 동양생명 자산(32조4402억원)과ABL생명 자산(17조4707억원) 합계는 총 49조9109억원으로 삼성·교보·한화·신한라이프·NH농협생명에 이어 여섯 번째다. 만약 인수가 계획대로 추진된다면 자산 규모 6위의 신생 생명보험사가 탄생하는 것이다. 우리금융은 지난 2014년 우리아비바생명을 매각한 이후 보험사를 소유한 적이 없다.또 우리금융 측은 현재 예비입찰이 진행 중인 롯데손해보험 인수에도 여전히 참여한다는 방침이다. 우리금융 측 관계자는 “롯데손해보험 공개매각 예비입찰에도 참여해 현재 본 입찰을 앞두고 있다”면서 “실사 결과를 토대로 최종 의사결정을 할 예정”이라고 밝혔다.우리금융은 그동안 높은 은행 비중에서 벗어나 종합금융그룹으로 탈바꿈하기 위해 노력해 왔다. 대표적으로 최근 한국포스증권과 우리종합금융을 합병하는 방식으로 증권업 진출을 결정하고, 현재 감독 당국의 승인절차를 밟고 있다. 이번 보험업 진출까지 성공하면 비은행 사업 분야 포트폴리오가 어느 정도 완성될 전망이다.우리금융 관계자는 “롯데손해보험과 마찬가지로 동양생명·ABL생명도 인수 대상의 하나로서 인수·합병을 검토 중이나, 현재 구체적으로 결정된 바는 없으며, 향후 진행 상황에 따라 공시나 보도자료를 통해 상세하게 알릴 예정”이라고 밝혔다."
2024-06-26,"우리금융, 동양·ABL생명 인수 추진…10년 만에 보험업 재진출","우리금융그룹이 10년 만에 보험업에 재진출한다. 임종룡 우리금융 회장 취임 이후 염원해온 비은행 분야 경쟁력 강화 방안의 일환이다.우리금융그룹. 연합뉴스26일 우리금융에 따르면 최근 중국 다자보험그룹과 양해각서(MOU)를 체결하고 동양생명과ABL생명 인수를 위한 실사에 착수할 예정이라고 밝혔다. 다자보험은 동양생명과ABL생명의 최대 주주다. 양측은 현재 최종 가격 산정 절차에 들어갔으며, 정확한 매각 가격은 아직 확정되지 않았다.3월 말 기준 동양생명 자산(32조4402억원)과ABL생명 자산(17조4707억원) 합계는 총 49조9109억원으로 삼성· 교보·한화·신한라이프·NH농협생명에 이어 여섯 번째다. 만약 인수가 계획대로 추진된다면 자산 규모 6위의 신생 생명보험사가 탄생하는 것이다. 우리금융은 지난 2014년 우리아비바생명을 매각한 이후 보험사를 소유한 적이 없다.또 우리금융 측은 현재 예비입찰이 진행 중인 롯데손해보험 인수에도 여전히 참여한다는 방침이다. 우리금융 측 관계자는 “롯데손해보험 공개매각 예비입찰에도 참여해 현재 본 입찰을 앞두고 있다”면서 “실사 결과를 토대로 최종 의사결정을 할 예정”이라고 밝혔다.우리금융은 그동안 높은 은행 비중에서 벗어나 종합금융그룹으로 탈바꿈하기 위해 노력해 왔다. 대표적으로 최근 한국포스증권과 우리종합금융을 합병하는 방식으로 증권업 진출을 결정하고, 현재 감독 당국의 승인절차를 밟고 있다. 이번 보험업 진출까지 성공하면 비은행 사업 분야 포트폴리오가 어느 정도 완성될 전망이다.우리금융 관계자는 “롯데손해보험과 마찬가지로 동양생명·ABL생명도 인수 대상의 하나로서 인수·합병을 검토 중이나, 현재 구체적으로 결정된 바는 없으며, 향후 진행 상황에 따라 공시나 보도자료를 통해 상세하게 알릴 예정”이라고 밝혔다."
2024-01-23,"20년 경력 치과의사, 2주만에 새내기 보험설계사 된 비결은?","20년 이상 경력의 치과의사 박준선 씨가 환자를 진료하고 있다. [사진 롯데손해보험]서울 은평구에서 20년 넘게 치과의원을 운영해 온 치과의사 박준선(51)씨는 1월부터 ‘새내기 보험설계사’로 투잡을 시작했다. 롯데손해보험이 지난해 12월 출시한 설계사 애플리케이션(앱) ‘원더’를 통해서다. 박씨는 “특별히 책상 앞에 앉아 공부할 시간을 내지 않고도 병원에서 환자 예약이 없는 시간이나 차량 이동 중에 동영상 강의를 듣거나 모의고사 콘텐트를 활용했다”고 말했다. 이렇게 공부하면서 쌓인 50만 포인트는 설계사 시험 합격과 동시에 현금으로 전환된다.박씨가 가진 무기는 전문성이다. 그는 “당장 치아에 이상이 없지만, 치주 상태가 좋지 않거나 약한 치아인 분들에게 치아보험을 권유해 향후 치과 치료에 대비할 수 있도록 할 생각”이라며 “환자와 병원이 윈윈(win-win)하는 방법”이라고 말했다. 이어 “부동산중개업을 하는 분들이 화재보험을, 자동차 정비사가 자동차보험을, 사회복지사가 간병보험을 소개하는 식으로 전문성을 지닌 보험설계사들이 더 많아질 수 있을 것”이라고 기대했다.원더앱은 지난해 12월 3일 롯데손해보험이 출시한 보험설계사 영업 지원 플랫폼으로 설계사가 사무실에 출근할 필요 없이 교육·설계·청약·고객관리에 이르는 영업의 전 과정을 휴대전화 하나로 완수할 수 있는 것이 특징이다. 예비 설계사들을 위해선 모의고사 등 교육 콘텐트를 통해 설계사 시험에 등장하는 주요 개념을 쉽게 이해하고 학습할 수 있도록 지원한다. 초보 설계사를 위한 ‘쉬운 설계’ 기능, 우수설계사의 노하우를 공유 받을 수 있는 ‘노하우 공유’ 기능도 담았다.박씨처럼 본업 외 부업을 하는 ‘N잡러’는 계속 늘고 있다. 중앙일보가 통계청 경제활동인구조사 마이크로데이터를 분석한 결과 본업 외에 부업을 하는 근로자 수는 지난해 12월 54만8900명으로 전년 동월 기준 역대 최대다. 박씨는 “인생의 반을 치과의사로 살았는데 나이 50이 되어 치과 밖 세상은 어떨까 호기심이 생겼다”며 “직업 갱년기를 겪다가 원더앱을 통해 그간 무지했던 금융·보험 분야를 공부하며 보험설계사가 되고 싶다는 결심을 하게 됐다”고 밝혔다. 그러면서 “지난해 수능을 본 제 아들과 아내도 저를 따라 보험설계사 자격을 취득했다”며 “경제적 자유를 꿈꾸는 N잡러들에게 보험설계사 부업을 추천하고 싶다”고 덧붙였다."
2024-01-22,"20년 경력 치과의사, 2주만에 새내기 보험설계사 된 비결","20년 이상 경력의 치과의사 박준선(51)씨가 환자를 진료하고 있다. 사진 롯데손보서울 은평구에서 20년 넘게 치과 의원을 운영해 온 치과의사 박준선(51)씨는 1월부터 ‘새내기 보험설계사’로 투잡을 시작했다. 롯데손해보험이 지난해 12월 출시한 설계사 애플리케이션(앱) ‘원더’를 통해서다. 박씨는 “특별히 책상 앞에 앉아 공부할 시간을 내지 않고도 병원에서 환자 예약이 없는 시간이나 차량 이동 중에 동영상 강의를 듣거나 모의고사 콘텐트를 활용했다”고 말했다. 이렇게 공부하면서 쌓인 50만 포인트는 설계사 시험 합격과 동시에 현금으로 전환된다.박씨가 가진 무기는 전문성이다. 그는 “당장 치아에 이상이 없지만 치주 상태가 좋지 않거나 약한 치아인 분들에게 치아보험을 권유해 향후 치과 치료에 대비할 수 있도록 할 생각”이라며 “환자와 병원이 윈윈(win-win)하는 방법”이라고 말했다. 이어 “부동산중개업을 하는 분들이 화재보험을, 자동차 정비사가 자동차보험을, 사회복지사가 간병보험을 소개하는 식으로 전문성을 지닌 보험설계사들 더 많아질 수 있을 것”이라고 기대했다.사진 롯데손보원더앱은 지난해 12월 3일 롯데손해보험이 출시한 보험설계사 영업 지원 플랫폼으로 설계사가 사무실에 출근할 필요 없이 교육ㆍ설계ㆍ청약ㆍ고객관리에 이르는 영업의 전 과정을 휴대전화 하나로 완수할 수 있는 것이 특징이다. 예비 설계사들을 위해선 모의고사 등 교육 콘텐트를 통해 설계사 시험에 등장하는 주요 개념을 쉽게 이해하고 학습할 수 있도록 지원한다. 초보 설계사를 위한 ‘쉬운 설계’ 기능, 우수설계사의 노하우를 공유 받을 수 있는 ‘노하우 공유’ 기능도 담았다.박씨처럼 본업 외 부업을 하는 ‘N잡러’는 계속 늘고 있다. 중앙일보가 통계청 경제활동인구조사 마이크로데이터를 분석한 결과 본업 외에 부업을 하는 근로자 수는 지난해 12월 54만8900명으로 전년 동월 기준 역대 최대다. 박씨는 “인생의 반을 한눈팔지 않고 치과의사로 살았는데 나이 50이 되어 치과 밖 세상은 어떨까 호기심이 생겼다”며 “다른 삶을 선택할 용기가 없어 일종의 ‘직업 갱년기’를 겪다가 원더앱을 통해 그간 무지했던 금융ㆍ보험 분야를 공부하며 보험설계사가 되고 싶다는 결심을 하게 됐다”고 밝혔다. 그러면서 “지난해 수능을 본 제 아들과 아내도 저를 따라 보험설계사 자격을 취득했다”며 “경제적 자유를 꿈꾸는 N잡러들에게 보험설계사 부업을 추천하고 싶다”고 덧붙였다."
2023-05-24,"""3대가 내 고객"" 국내 최고령 97세 보험설계사의 영업비밀","국내 최고령 보험설계사로 알려진 김성길(97) 씨가 지난 3월14일 롯데손해보험 경남사업본부에서 ‘평생직업 100세시대 롤모델’로 선정된 후 기념 촬영을 하고 있다. 사진 롯데손보“100세까지 일하는 게 목표인데 언제 천당 갈진 모르죠. 제 두 발이 움직일 때까지 열심히 해볼 생각입니다.”경남 마산에서 롯데손해보험 전속 보험설계사로 일하는 김성길(97)씨는 매일 이런 다짐과 함께 하루를 시작한다. 김씨는 1979년 롯데손보의 전신인 대한화재 동마산 영업소장으로 입사해 45년째 영업 현장을 누비는 이른바 ‘워킹 시니어’다. 국내 최고령 보험설계사로 알려져 있다.김씨는 매일 오전 5시에 일어나 아침 식사를 챙겨 먹는다. 회사로 출근하거나 고객을 만날 땐 양복에 운동화 차림으로 집을 나선다. 가까운 거리는 최대한 걷기 위해서다. 김씨는 “‘약식동원(藥食同源)’이란 말처럼 밥이 보약”이라며 “규칙적인 식사와 운동이 제 건강 비결”이라고 말했다.그는 1926년 경남 마산에서 태어나 고향을 떠나본 적이 없는 ‘마산 토박이’다. 1945년 학교 졸업 후 세무 공무원, 유원산업(구 동양주류 주식회사) 경리과에서 근무하다 지인의 추천으로 보험업에 발을 들였다. 김씨는 “예전에는 보험을 판다고 하면 선입견 때문에 무시하거나 동정하는 사람들이 많았다”며 “‘불쌍하다’며 돈 몇장 쥐여주고 다시 오지 말라고 했을 땐 눈물이 나기도 했다”고 회고했다.하지만 한번 신뢰가 쌓인 고객은 놓치는 법이 없었다. 김씨는 “보험업을 오래 하다 보니 3대에 걸쳐 보험을 들어주는 경우도 생긴다”며 “젊을 때 만난 고객과 함께 늙어가고, 그 고객의 자녀가 장성하는 모습을 지켜보는 게 삶의 낙”이라고 말했다.'대한민국 1호 야구인'이기도 한 김성길(97) 씨가 2018년 10월 7일 창원 마산야구장에서 열린NC다이노스 홈경기에서 시타를 하고 있다. 사진NC다이노스한달 수입이 어느 정도인지 묻자 김씨는 “영업비밀”이라며 껄껄 웃었다. 대신 보험설계사는 나이 제한이 없고 시간에 구애받지 않아도 된다는 게 큰 장점이라고 했다. 김씨는 “왕성하게 활동하던 시절엔 하루에 42건 보험 계약을 성사시킨 적도 있는데, 이제 그때만큼은 아니지만 가끔 가족에게 맛있는 음식을 대접할 정도는 된다”며 “자식에게 용돈 타 쓰다 보면 마치 짐이 되는 것 같아 주눅 들기 쉬운데 이 나이까지 경제활동을 한다는 것 자체가 스스로에게 큰 힘이 된다”고 말했다.김씨는 21세에 ‘마산 대표팀’으로 선발돼 각종 전국 대회에 출전한 ‘대한민국 1호 야구인’이기도 하다. 당시 야구대회 ‘도시대항전’이 있었는데 최초로 출전한 야구인들이 모두 작고하고 혼자 남았다. 선수 은퇴 후인 1960년대 중반에는 직장생활을 하면서 무학국민학교 야구부 감독을 맡아 10년 가까이 무보수로 아이들을 가르쳤다. 1984~1985년 경남야구협회장을 맡았고, 1986년엔 육순 잔치를 마산야구장에서 하기도 했다. 김씨는 “선수 시절엔 100m를 12초대에 뛰었다”며 “야구로 다진 체력이 오래 일할 수 있는 비결이기도 하다”고 말했다.국내 최고령 보험설계사로 알려진 김성길(97) 씨가 지난 3월14일 롯데손해보험 경남사업본부에서 ‘평생직업 100세시대 롤모델’로 선정된 후 직원들과 함께 기념 촬영을 하고 있다. 사진 롯데손보롯데손보는 지난 3월 김씨를 ‘평생직업 100세 시대 롤모델’로 선정했다. 백수석 롯데손보 경남사업본부장은 ""수많은 보험설계사를 봐왔지만 일에 대한 열정이 정말 남다르신 분""이라며 “보험설계사들이 정직하게 일하면 고객들에게 힘이 될 수 있다는 신념을 가지고 오랜 기간 일해 오셨다는 게 다른 직원들에게 많은 귀감이 되고 있다”고 말했다.김씨의 도전은 현재진행형이다. 그는 “가족들은 ‘이제 좀 쉬라’고 만류하지만, 건강만 허락한다면 계속 일하고 싶다”며 “경험은 돈으로 살 수 없는 최고의 자산이기 때문에 나이 들었다고 포기하지 말고 하고 싶은 일을 계속 찾기 바란다”고 했다."
