date,title,content
2024-05-01,중동보다 중국이 더 밉다…'악' 소리나는 석유화학업계 시름,"중국발 공급 과잉 여파에 국내 석유화학업계가 침체의 늪에서 좀체 헤어 나오지 못하고 있다. 지난 10여 년간 중국이 관련 설비를 대폭 증설하며 값싼 제품을 쏟아낸 여파가 크다.30일LG화학은 지난 1분기(연결기준) 매출 11조6094억원, 영업이익 2646억원을 기록했다고 공시했다. 지난해 같은 기간 대비 매출은 18.7%, 영업이익은 67.1% 감소했다. 석유화학 부문에서만 312억원의 영업손실이 발생했다.LG화학은 “지정학적 리스크에 따른 원료가 상승 압박이 컸지만, 나프타 래깅(원재료 투입 시차) 효과와 비용 절감을 지속해 전 분기 대비 적자 폭이 줄었다”고 밝혔다.이달 1분기 실적을 공시할 롯데케미칼도 성적이 좋지 못할 전망이다. 증권업계에선 1분기 매출 5조588억원, 영업손실 1171억원을 예상한다. 이 전망대로라면 지난해 같은 기간 대비 매출은 2.6% 증가하지만, 1000억원이 넘는 적자가 발생한다.앞서 29일 1분기 실적을 공시한SK이노베이션은 국제 유가 상승에 따른 재고평가이익이 반영되고, 정제마진(원유와 원유로 만든 제품 간 가격 차이)에 힘입어 흑자를 기록했다. 그러나 배터리 사업의 부진은 이어졌다.SK이노베이션의 1분기 매출은 18조8551억원, 영업이익은 6247억원으로, 지난해 같은 기간보다 매출은 1.5% 감소했지만 영업이익은 66.6% 늘었다. 배터리 자회사인SK온은 매출 1조6836억원, 영업손실 3315억원으로 적자를 벗어나지 못했다.울산 남구에 조성된 석유화학단지 전경. 뉴스1석유화학은 석유를 가공할 때 발생하는 물질인 나프타 등을 이용해 플라스틱 같은 합성 원료를 만드는 산업이다. 대개 유가가 치솟으면 수익성이 떨어져 실적 부진에 시달리지만, 이번 위기는 중국 영향이 크다. 중국은 2010년 들어 석유화학 자급화를 선언하고 범용 다운스트림 제품 증설에 나섰고 중간원료(PX)‧기초유분 증설도 진행하고 있다. 값싼 석유화학제품을 자국에 공급하고 남은 물량은 동남아시아 등지에 팔고 있다.한국 입장에선 수요가 확 줄어든 셈이다. 한국은 중국에 2019년 1801만t의 석유화학제품을 수출했지만, 지난해 1470만t으로 감소했다. 4년 만에 수출량이 18.4%가량 줄었다. 생산량도 줄고 있다. 석유화학업계에 따르면 국내 석유화학업체의 지난해 나프타분해설비(NCC) 평균 가동률은 70% 선이다. 2년 만에 가동률이 20%포인트 떨어졌다.LG화학은 지난해 여수NCC2공장 가동을 6개월간 중단했다.단가는 낮아지고 있다. 산업통상자원부에 따르면 나프타 평균 가격(지난달 말 기준)은 톤(t)당 717달러다.NCC에서 나프타를 통해 생산하는 기초원료인 에틸렌 가격은 t당 900달러 수준이다. 석유화학업계에선 업황을 드러내는 기본 지표로 꼽는 에틸렌 스프레드(에틸렌 가격-나프타 가격)가 300달러를 넘어야 손익 분기점을 넘는다고 보는데 현재 180달러 수준에 불과하다.업체들도 위기에서 벗어나기 위해 고심하고 있다. 우선 인력 조정에 나섰다.LG화학은 생산기술직을 대상으로 희망퇴직을 진행하고 있다. 롯데케미칼은 플라스틱 원료인 페트를 생산하는 울산공장 직원들을 재배치하는 방안을 검토하고 있다. 지난해 중국 범용 석유화학제품을 생산하는 롯데삼강케미칼, 롯데케미칼자싱을 중국 파트너사에 매각했다.김영희 디자이너중국이 만들기 어려운 고부가 제품으로 무게 중심을 옮기고 있다.LG화학은 태양광 필름용 소재인 폴리올레핀엘라스토머(POE) 증설을 통해 시장 확대를 꾀하고 있다.POE는 고부가 합성수지로,LG화학이 자체 개발한 고유의 촉매(메탈로센)를 사용해 고무와 플라스틱 성질을 모두 지닌POE를 생산한다. 신학철LG화학 부회장(대표이사)은 연초 신년사를 통해 “고성장·고수익 중심의 지속가능한 포트폴리오로 전환, 모든 사업의 고부가화를 추진하고 저수익 사업의 수익성을 개선하자”고 당부했다.롯데케미칼도 현재 50% 수준인 고부가 제품 비중을 2032년까지 60%로 확대할 방침이다. 석유‧석탄 같은 화석연료를 대체할 수 있는 청정 수소에도 눈을 돌리고 있다. 오는 2030년까지 총 6조원을 투자해 120만t 규모의 청정 수소를 생산하고, 연 매출 5조원을 달성하겠다는 계획이다. 지난해 초 한국과학기술원(KAIST)과 탄소중립연구센터를 설립하고 올해 말까지 연구비 20억원을 투자하기로 했다. 폐플라스틱 열분해‧수전해를 통한 청정 수소 생산과 단가 최적화, 탄소배출량 저감 기술 개발에 집중하고 있다.SK이노베이션도SK온의 글로벌 생산설비 증설 시점을 탄력적으로 운영, 속도 조절에 나선다."
2024-02-27,"실크로드시앤티, 탄소중립 건설소재 개발 나선다","김지상 한국콘크리트학회장, 황진구 롯데케미칼 대표, 토어스톤 노왁 씨카코리아 대표, 박혁호 실크로드시앤티 대표(왼쪽부터)가 26일 탄소중립 건설소재 개발 업무협약(MOU)을 체결한 뒤 기념촬영을 하고 있다. 사진 실크로드시엔티콘크리트 혼화제 전문기업 실크로드시앤티는 롯데케미칼, 씨카코리아, 한국콘크리트학회와탄소중립건설소재 개발을 위한 산학연 4자 업무협약(MOU)을 체결했다고 26일 밝혔다.이번 업무협약을 3개사는 탄소중립건설소재 연구개발(R&D) 연합을 구성해 신기술을 개발하며, 학회는 기술 자문과 인증을 지원한다. 실크로드시앤티는 100억원을 투자해 경기 용인시 기흥연구소에 ‘탄소중립R&D 센터’를 운영할 계획이다.건설업계에서는 전 세계적인 탄소중립 정책 시행에 맞춰 시멘트를 플라이애시, 고로슬래드 같은 다른 재료로 대체하는 저탄소화를 진행 중인데, 이에 최적화된 건설소재를 개발하는 게 이번 협약의 핵심이다.회사 관계자는 “국내 시멘트 탄소배출량이 연간 2200만t으로 추정되는데, 건설소재 개발이 마무리되면 930만t을 감소할 것으로 전망된다”고 밝혔다. 이는 국내 총 탄소배출량의 1.5%에 해당하는 수치로, 약 8000억원의 경제효과가 발생하는 셈이다.롯데케미칼은 지난해RE100 가입을 비롯한ESG경영 실천에 앞장서고 있는 만큼 탄소중립을 위한 건설 신소재 개발에 집중할 계획이다. 매출액 15조원의 세계 최대 건설소재 기업인 씨카는 글로벌 네트워크를 기반으로 한국을 넘어 세계적인 탄소중립 실현에 기여한다는 방침이다."
2024-01-30,"신동빈 ""잘 안되는 사업은 매각…신성장 영역으로 사업 전환 추진""","신동빈 롯데 회장이 “부진한 사업은 매각하고, 4개 신성장 영역으로 그룹의 사업 교체를 추진하겠다”고 밝혔다.신 회장은 30일 일본 요미우리신문과의 인터뷰에서 그간 롯데 그룹의 사업 전략이었던 기업 인수·합병(M&A) 정책을 바꿔 “인수뿐 아니라 매각도 진행할 것”이라고 경영 전략의 변화를 직접 설명했다. 또 “바이오테크놀로지와 메타버스 등 4개의 신성장 영역을 정해 신규 사업으로의 전환을 추진하고 있다”고 밝혔다. 롯데에 따르면 신 회장이 언론과 직접 인터뷰한 것은 지난 2020년 3월 니혼게이자이 신문과의 인터뷰 이후 4년만이다.신동빈 롯데그룹 회장━‘적극 인수합병’→’부실 사업 매각’ 전환신 회장은 한국 롯데의 성장 과정에 M&A와 상장이 크게 기여했다는 취지의 질의에 자신이 처음 한국 롯데 경영에 뛰어든 호남석유화학(롯데케미칼의 전신)의 예를 들었다. 신 회장은 “호남석유화학 상무에 취임한 1990년 당시 회사가 작았지만, 1991년 상장해 투자를 이끌고, 에틸렌 센터를 건설하는 등 사업을 확대해왔다”고 설명했다. 이어 “백화점·수퍼 사업을 하고 있어 편의점을 인수했고, 탄산음료 사업에 타사의 주류 사업을 인수하는 등 지금까지 60개의 크고 작은 회사를 인수했다”고 말했다. 롯데는 2009년 두산으로부터 주류사업을, 2022년에는 편의점 미니스톱을 인수하는 등 활발한 인수합병 전략으로 몸집을 불려왔다.하지만 신 회장은 “지금은 정책을 바꿨다”며 “몇 년을 해도 잘 안 되는 사업은 다른 회사가 하는 것이 직원들에게도 좋을 것”이라 말하며 “일부 사업을 매각할 것”이라고 밝혔다. 롯데는 일본 롯데리아를 현지 외식 업체에 팔았고, 롯데케미칼은 고부가 사업에 집중하겠다며 비핵심 해외 사업으로 분류한 파키스탄 자회사 지분을 매각하겠다는 계획을 내놓기도 했다.롯데정보통신이 오는 9일부터 12일(현지시간)까지 미국 라스베이거스에서 열리는 세계 최대 가전·정보기술(IT) 전시회'CES2024' 첫날 메타버스 플랫폼 '칼리버스'를 정식 출시한다고 3일 밝혔다. 연합뉴스신 회장은 롯데가 사업 전환을 추진 중인 신성장 영역도 언급했다. 그가 꼽은 4개 영역은 바이오테크놀로지, 메타버스, 수소에너지와 이차전지 소재 분야다. 롯데바이오로직스는 미국BMS사의 시러큐스 공장을 인수하고 인천 송도에 바이오 메가플랜트를 건설하는 방식으로 바이오산업에 뛰어들었다. 롯데정보통신은 이달 미국에서 열린 ‘소비자가전쇼(CES) 2024’에서 메타버스 플랫폼 칼리버스를 공개했다. 롯데케미칼은 미래 사업으로 수소에너지 사업과 배터리 소재 사업을 추진하고 있다.━해외 사업에 '지정학' 고려…동남아 진출롯데몰 웨스트레이크 하노이 단지 전경. 하노이 최대 호수인 서호(西湖·사진 위쪽)와 홍강에 둘러싸여 있다. 사진 롯데쇼핑지난 몇 년간 롯데를 둘러싼 ‘역풍’에 대한 입장도 밝혔다. 롯데는 2017년 정부 요청에 따라 경북 성주의 골프장 부지를 주한미군 사드(THAAD·고고도미사일방어체계) 부지로 제공했다가 중국의 강한 반발에 부딪혔다. 신 회장은 “중국에 백화점과 수퍼마켓, 음료·제과 공장 등이 있었지만, (사드) 부지 제공에 대한 중국의 반발로 철수했다”며 “향후에는 지정학적 문제를 포함해 검토할 수밖에 없다고 생각한다”고 말했다. 중국 진출의 ‘아픈 경험’을 바탕으로 해외 사업 확장 시 주변 국제 정세를 중요하게 고려하는 등 신중할 수밖에 없다는 의미로 풀이된다. 이후 롯데는 중국 대신 베트남·인도네시아 등 동남아 국가로의 진출에 적극적으로 나섰다. 신 회장은 지난 18일 열린 롯데그룹VCM(ValueCreationMeeting)에서 베트남 하노이에 개장한 ‘롯데몰 웨스트레이크 하노이’를 시장 선도 모델로 꼽는 등 베트남 사업에 힘을 싣고 있다. 형 신동주SDJ코퍼레이션 회장과의 경영권 분쟁에 대해서는 “경영권 싸움은 끝났고, 퍼블릭 컴퍼니로 거듭나겠다”고 언급했다."
2024-01-19,신동빈 “경영환경 예측 불가…어느 때보다 민첩대응 중요”,"고(故) 신격호 롯데 창업주의 별세 4주기를 하루 앞둔 18일 서울 송파구 롯데월드타워에서 열린 추도 행사에 신동빈 롯데 회장(맨앞) 및 임직원이 참석해 있다. 이날 함께 열린 ‘2024년 상반기 롯데VCM(옛 사장단 회의)’에서 그룹 경영계획 및 중장기 전략 논의가 이뤄졌다. [사진 롯데지주]신동빈 롯데 회장이 불확실한 경영환경 속에서 지속성장을 이루기 위한 전략으로 실행력 강화를 제시했다. 상반기 그룹 경영 계획을 논의하는 사장단 회의에서다. 경기 침체 속에서 대내외적 변화에 민첩하게 대응하라는 주문으로 풀이된다.롯데는 18일 서울 롯데월드타워에서 2024년 상반기VCM(ValueCreationMeeting·옛 사장단 회의)을 열고 중장기 전략을 논의했다. 회의에는 신 회장과 이동우 롯데지주 부회장, 김상현 유통HQ부회장, 박현철 롯데건설 부회장, 이훈기 롯데케미칼 사장, 정준호 롯데백화점 사장 등이 자리했다. 신 회장 장남인 신유열 롯데지주 미래성장실장은 지난해 상반기부터 회의에 참석했다.김주원 기자신 회장은 올해 국내 경제의 저성장과 글로벌 경기 침체, 국내외 정치적 이벤트 등으로 과거보다 더 예측 불가능한 한 해가 될 것이라고 평가했다. 그는 “그룹 전체가 경영환경 변화를 주시하며 민첩하게 대응하는 것이 그 어느 때보다 중요하다”고 당부했다. 이어 어려움 속에서도 지속가능 성장을 통한 기업가치 제고라는 경영 목표를 달성하기 위해 어떤 변수에도 대응할 수 있는 철저한 준비와 강력한 실행력이 필요하다고 강조했다. 신 회장은 “미래를 위해 혁신하지 않으면 파괴의 대상이 될 수 있다”며 “혁신의 기회가 있다면 실패를 두려워하지 말고 강력히 실행해 달라”고 요청했다.이날 메시지에서 롯데의 위기의식이 엿보인다. 롯데그룹 전체 매출의 60%를 차지하는 핵심축인 화학과 유통 부문은 최근 몇 년간 고전하고 있다. 롯데쇼핑 매출은 2020년 16조1844억원에서 2021년 15조5736억원, 2022년 15조4760억원으로 3년 연속 줄었다. 금융정보업체 에프앤가이드에 따르면 지난해 역시 14조6794억원으로 감소한 것으로 추정된다. 다만, 영업이익 추정치는 4758억원으로 2022년(3862억원)보다 늘었다. 한 유통업계 관계자는 “코로나19 사태가 끝나면서 오프라인으로 소비 수요가 돌아오고 있지만 기대에 미치지 못했다”고 말했다.김주원 기자온라인 시장으로 확장도 쉽지 않았다. 2020년 론칭한 이커머스 롯데온은 출범 이후 적자에서 벗어나지 못하고 있다. 지난해 3분기 기준 320억원의 매출을 냈지만 230억원의 영업손실을 냈다. 빅데이터 플랫폼 모바일인덱스에 따르면 지난해 12월 쇼핑 앱 월간활성이용자 수(MAU) 순위에서 롯데온은 16위(점유율 6.4%)였다. 1위인 쿠팡(79.58%)은 물론 11번가·알리익스프레스·지마켓·GS홈쇼핑·테무·이마트 등에 뒤졌다.그룹의 ‘효자’로 꼽히던 롯데케미칼은 2022년 7630억원 영업적자를 기록했다. 증권가는 지난해에도 롯데케미칼이 실적을 회복하지 못했을 것으로 예상한다. 우크라이나 전쟁에 따른 유가 변동, 중국의 석유화학 자급률 상승 등이 원인으로 작용했다.롯데는 글로벌 시장 확대와 지속적 투자로 위기를 타개할 방침이다. 신 회장은 올해 경영방침으로 ▶산업 내 선도적 입지 확보 ▶글로벌 사업 확장 ▶경쟁력 확보를 위한 투자 ▶종합적 리스크 관리를 꼽았다. 또 “베트남 쇼핑몰 중 최단기간 매출 1000억원 달성이 예상되는 롯데몰 웨스트레이크 하노이처럼 시장을 선도할 수 있는 사업모델을 만들어달라”고 주문했다. 글로벌 사업과 관련해서는 “성장 기회가 있는 국가라면 진출과 시장 확대를 적극적으로 검토하라”면서도 “불확실성이 큰 시기인 만큼 상황에 따라 유연하게 대응할 수 있는 준비가 필요하다”고 당부했다."
2023-09-22,신동빈 “베트남과 인니서 활발하게 활동”…장남 신유열도 언급,"22일 베트남 하노이에서 신동빈 롯데그룹 회장이 롯데몰 웨스트레이크 하노이에서 그랜드 오픈을 맞아 인사말을 하고 있다. 사진 롯데쇼핑롯데쇼핑이 베트남에 조성한 현지 최대 규모의 상업 복합단지 ‘롯데몰 웨스트레이크 하노이’가 22일 전면 개장했다.롯데쇼핑은 이날 오전 신동빈 롯데그룹 회장과 김상현 롯데 유통군 부회장, 정준호 롯데백화점 대표를 비롯해 최영삼 주베트남 한국대사, 쩐 시 타인 하노이시 인민위원장과 부이 쑤언 둥 베트남 건설부 차관 등 현지 고위 관계자가 참석한 가운데 오픈 기념식을 열었다. 신 회장의 장남으로 경영 수업에 나선 신 회장의 장남 신유열 롯데케미칼 상무도 귀빈석에 앉아 있다가 가위로 기념띠를 자르는 행사에 참여했다.━22일 베트남 하노이 롯데몰 공식 개장신 회장은 인사말에서 “롯데몰 웨스트레이크는 쇼핑몰‧마트뿐 아니라 문화 콘텐트인 시네마‧아쿠아리움, 호텔·오피스‧레지던스까지 갖춘 시설”이라며 “아름다운 도시 하노이의 랜드마크로 자리매김해 지역 경제와 베트남 발전에 기여할 수 있기를 기대한다”고 말했다. 이어 “베트남과 롯데그룹 간 우호적 관계를 바탕으로 베트남의 발전에 롯데가 항상 함께하겠다”고 강조했다.22일 베트남 하노이 롯데몰 웨스트레이크 하노이에서 참석자들이 개관식을 맞아 기념띠를 가위로 자르고 있다. 왼쪽부터 부이 쑤언 둥 베트남 건설부 차관, 김기문 중소기업중앙회 회장, 최영삼 베트남 대사, 신동빈 롯데그룹 회장, 쩐 씨 따잉 베트남 하노이 인민위원장, 도안 반 비엣 베트남 문체부 차관. 사진 롯데쇼핑신 회장은 이날 행사에 참석한 주요 인사와 함께 쇼핑몰·마트를 둘러봤다. 이어 호텔 1층 로비에서 취재진과 만나 “우리가 핵심적으로 생각하고 있는 베트남·인도네시아에서 앞으로 유통업을 비롯해 여러 분야에서 활발하게 활동하고 싶다”고 밝혔다. 신유열 상무가 행사에 참석한 의미를 묻자 “(신유열 상무가) 현재 여러 가지를 공부하고 있다”며 “앞으로도 유통을 포함해 국내외 사업 현장을 전반적으로 살펴 나갈 계획”이라고 답했다.━“아들 신유열, 여러 공부하고 있어”신동빈 회장과 신유열 상무가 공식 행사에 같이 모습을 드러낸 건 지난 3월 베르나르 아르노 루이뷔통모에헤네시(LVMH) 회장 방한 행사 이후 6개월 만이다. 신 상무는 지난해 8월 신 회장이 응우옌 쑤언 푹 베트남 국가주석을 면담할 당시에도 동행했다. 그는 일본에서 대학을 나와 미국 컬럼비아대 경영대학원(MBA)을 졸업한 뒤 노무라증권 싱가포르 지점과 일본 롯데 근무를 거쳐 지난해 5월 롯데케미칼에 합류했다.22일 베트남 하노이 롯데몰 웨스트레이크 하노이에서 참석자들이 개관식을 맞아 줄을 가위로 자르고 있다. 왼쪽부터 김준영 롯데프라퍼티스하노이 법인장, 신유열 롯데케미칼 상무, 정준호 롯데백화점 대표이사, 김상현 롯데유통군 부회장. 김민상 기자롯데쇼핑은 지난 17년간 동남아에서 지속적으로 사업을 확장해왔으며 현재 베트남·인도네시아 등지에서 백화점 3개, 마트 66개, 복합몰 1개 등을 운영하고 있다. 베트남에는 1996년 진출한 이래 백화점‧마트‧호텔‧시네마 등 총 19개 계열사가 호찌민‧하노이‧다낭 등 전국 각지에서 사업을 하고 있다.롯데몰 웨스트레이크는 2016년부터 하노이의 전통 부촌이자 신도시 개발이 이뤄지고 있는 떠이호(西湖)에서 부지 개발에 들어갔다. 사업비로 6억4300만 달러(약 8500억원)를 투입했다. 지난 7월 연면적 약 35만4000㎡(약 10만7000평) 규모 롯데몰 웨스트레이크를 사전 개장한 뒤 주요 시설을 시범 운영해왔다.0초0초광고 후 계속됩니다.다음 동영상subjectauthor취소신동빈 “베트남과 인니서 활발하게 활동”…장남 신유열도 언급중앙일보재생1,288재생 (space/k)재생00:260:00:00재생 (space/k)재생음소거 (m)음소거00:00/00:26실시간설정전체 화면 (f)해상도자동 480p자막사용 안함재생 속도1.0x (기본)인기 구간 표시해상도자동 (480p)1080pHD720pHD480p360p270p144p자막설정사용 안함옵션글자 크기배경색재생 속도0.5x1.0x (기본)1.5x2.0x죄송합니다. 문제가 발생했습니다. 다시 시도해 주세요.도움말음소거 상태입니다.도움말라이선스디버그 정보 다운로드고화질 재생이 가능한 영상입니다.설정에서 해상도를 변경해보세요.더 알아보기00:00"
2024-04-19,롯데 신동빈 “세계 최고 품질의 동박 만들어야”,"신동빈 회장(오른쪽 둘째)이 지난 17일 말레이시아에 있는 롯데에너지머티리얼즈 스마트팩토리에서 동박 제품을 살펴보고 있다. [사진 롯데지주]신동빈 롯데그룹 회장이 지난달 전기차 충전기 사업장을 찾은 데 이어 말레이시아의 2차전지 소재 생산 기지를 방문하며 신사업 경영에 속도를 내고 있다.18일 롯데지주에 따르면 신 회장은 전날 말레이시아 사라왁주 쿠칭에 있는 롯데에너지머티리얼즈 스마트팩토리를 찾아 2차전지 소재 사업을 점검했다. 또 현지 임직원을 격려하며 본원적 경쟁력 강화를 통한 시장 선도를 당부했다. 신 회장은 현장에서 “말레이시아의 입지적 장점을 활용해 원가 경쟁력을 더욱 높이고, 세계 최고 품질의 동박(구리막)을 생산할 수 있도록 노력해달라”고 말했다.신 회장은 지난달 롯데이노베이트(옛 롯데정보통신) 자회사 이브이시스의 스마트팩토리 청주 신공장을 방문해 전기차 충전기 사업 현안을 챙겼다. 이번 방문에는 이훈기 롯데 화학군 총괄대표와 김연섭 롯데에너지머티리얼즈대표가 함께 했다.2차전지 소재는 롯데의 주요 신성장 사업군 중 하나다. 지난해 롯데케미칼은 국내 최초 동박 국산화에 성공한 일진머티리얼즈를 2조7000억원에 인수하고 사명을 롯데에너지머티리얼즈로 변경했다. 롯데에너지머티리얼즈는 2019년부터 말레이시아에서 구리를 얇게 펴서 만드는 음극재 소재인 동박을 생산하고 있다.동박은 8㎛(마이크로미터) 이하의 얇은 두께가 특징으로 2차전지 음극재 집전체를 만드는 데 쓰인다. 말레이시아 스마트팩토리는 지난해 말 5·6 공장을 준공하며 연간 동박 생산량 규모를 6만t으로 늘렸다. 회사의 전체 동박 생산량 중 75%에 해당한다. 5·6공장은 올해 하반기부터 본격 양산을 시작할 예정이다. 롯데에너지머티리얼즈는 전북 익산과 말레이시아에서 생산시설을 가동하고 있으며 향후 유럽·북미 시장에 대응하기 위해 스페인과 미국에 동박 공장 건설을 추진 중이다."
