date,title,content
2024-12-04,"11월 폭설에 스키어 몰렸다…""이게 돼?"" 반전 노린 스키장 어디","때아닌 11월 폭설로 스키어만 신났다. 11월 28일 강원도 평창군이 적설량 31㎝를 기록한 덕분에 이튿날 동시에 개장한 휘닉스파크와 모나 용평의 방문객은 개장 첫날부터 최상급 설질을 경험했다. 올겨울은 어느 스키장에서 스키 타고 눈 놀이를 즐길까. 주요 스키장 이용법을 소개한다.━스키 즐긴 뒤 재즈공연 감상엔데믹 이후 회복세를 보이긴 했지만, 최근 10여년간 스키장 이용객은 꾸준히 감소했다. 해마다 스키장 한두 곳이 폐장했고, 슬로프 일부만 개장하는 스키장이 많았다. 올겨울은 분위기 반전이 기대된다. 스키장 대부분이 ‘모든 슬로프 개방’을 발표했다. 휘닉스파크 관계자는 “올겨울 시즌권 판매량이 지난해보다 15% 증가했다”며 “대학생 시즌권 판매량이 7% 늘어난 게 이례적”이라고 말했다.애니메이션 캐릭터 '씰룩'과 제휴를 맺은 휘닉스파크. 사진은 콘도 블루동 1층. 최승표 기자요즘 스키장은 다양한 놀 거리와 먹거리를 내세운다. 휘닉스파크는 이달 19일까지 투숙하는 이용객에게 눈 놀이 시설인 ‘스노빌리지’ 입장권을 준다. 스노빌리지는 애니메이션 캐릭터 ‘씰룩’과 제휴를 맺어 볼거리도 강화했다. 휘닉스파크는 스키를 탄 뒤 즐기는 시간 ‘아프레 스키’에도 공을 들인다. 이달 19일부터 1월 26일까지 휘닉스호텔 1층 아베토에서 김가온밴드 등 유명 뮤지션의 공연을 감상하며 다과도 즐길 수 있다.11월 29일 스키장 개막을 기념해 이벤트를 진행한 모나 용평. 사진 모나 용평이달 4일 개장하는 평창 알펜시아리조트는 4~5일 이틀간 리프트권을 1만5000원에 판매하고 스포츠 장비를 1만원에 빌려준다. 알펜시아에서는 '광장포차'를 가봐야 한다. 홀리데이 인 리조트 앞 대형 포장마차에서 맥주를 즐기고 버스킹 공연도 감상할 수 있다. 모나 용평은 11년 연속 ‘월드 스키 어워즈’ 베스트 스키장상 수상을 기념한 객실 패키지를 선보였다. 리조트 1박과 2인 리프트권을 포함해 11만원부터다. 스키장 곳곳에 마련한 포토존에서 촬영한 기념사진을SNS에 올리면 추첨을 통해 숙박권도 준다.━헬멧 착용은 필수평창의 스키장 3곳을 제외한 나머지 스키장도 순차적으로 개장한다. 홍천 비발디파크는 5일, 정선 하이원리조트와 춘천 엘리시안 강촌은 6일부터 스키어를 맞는다.하이원 워터월드는 국내 워터파크 중에서 실내 면적이 가장 넓다. 백종현 기자하이원리조트에서는 온 가족이 스키 말고도 눈 놀이와 물놀이를 원 없이 즐길 수 있다. 오는 23일 개장 예정인 2만여㎡ 규모의 '스노우월드'에서는 래프팅 썰매, 얼음 미끄럼틀 등을 탈 수 있고, 국내 최대 실내 워터파크 ‘하이원 워터월드’에서는 바데풀 같은 스파 시설을 갖춰 언 몸을 녹이기에 좋다.비발디파크는 개장 첫날부터 오후 11시까지 야간 스키를 운영한다. 오는 20일부터는 오후 11시부터 오전 3시까지 이어지는 심야 스키를 시작한다. 올겨울 비발디파크에서 스키를 타려면 헬멧을 꼭 써야 한다. 안전을 위해서다. 헬멧 대여료는 3000원이다. 곤지암리조트·하이원리조트 등은 일찌감치 헬멧 착용을 의무화했다.11월 27일 폭설로 뒤덮인 강원도 춘천 엘리시안 강촌 스키장 풍경. 사진 엘리시안리조트‘인생 사진’을 건지고 싶다면 엘리시안 강촌을 주목하자. 엘리시안 강촌은 전속 사진가가 주말마다 슬로프에서 이용객 수백 명의 사진을 촬영해 홈페이지 ‘현장 스케치’ 코너에 올려준다. 스키를 타면서 휴대전화로 사진을 찍기 쉽지 않은 까닭에 높은 호응을 얻고 있다.곤지암리조트 스키하우스 앞에 설치될 예정인 곤지암 베어. 겨울이면 대형 곰 앞에서 기념사진을 찍는 사람이 많다. 사진 곤지암리조트.이달 둘째 주 주말 개장 예정인 곤지암리조트는 슬로프에 다양한 변신을 꾀한다. 초·중급자도 정상부터 활강을 즐길 수 있도록 파노라마 슬로프를 확대하는 게 대표적이다. 펀 슬로프 존은 ‘눈 언덕’ 코스를 추가해 재미를 더했다. 스키 하우스 앞 ‘눈 내리는 스키 마을’은 인증사진 명당이다. 8m 높이의 곤지암 스키 베어 조형물과 자작나무가 조화를 이룬 모습을 선보일 예정이다."
2024-03-16,[포토타임] 서해수호 55용사 기리는 '서해수호 걷기대회' 열려,"오늘의 국내 주요 뉴스 사진(전송시간 기준)을 한눈에 파악할 수 있도록 실시간 업데이트합니다.■      오후 3:00서해수호 55용사 기리는 '서해수호 걷기대회' 열려목숨 바쳐 서해를 지켜낸 55명의 용사들의 숭고한 나라사랑 정신을 기리는 제9회 서해수호의 날(22일)을 엿새 앞둔 16일 국립대전현충원에서 ‘서해수호 걷기대회’가 열렸다. 이날 걷기대회에 참가한 시민들이 서해수호 55용사를 상징하는 총 5.5㎞구간 중 한 곳인 천안함46용사묘역에 도착, 전사자들을 추모하고 있다. 서해수호의 날(매년 3월 넷째 금요일)은 제2연평해전(2002년6월29일)과 천안함 폭침(2010년3월26일), 연평도 포격전(2010년11월23일) 등 우리나라 서해에서 발생한 북한과의 3대 교전중 전사한 55명의 장병들을 추모하는 법정기념일이다. 걷기대회 참가 시민들은 이날 보훈동산을 출발해 현충탑과 천안함46용사묘역, 한주호 준위 묘소, 제2연평해전묘역, 연평도 포격전 전사자묘역을 차례로 찾아 합동 참배했다.프리랜서 김성태프리랜서 김성태프리랜서 김성태■      오후 2:40메이저리거 김하성, 윤석열 대통령과 타격 배틀?샌디에이고 파드리스는 16일 오후 12시45분부터 서울 용산어린이공원에서 유소년 야구 플레이볼 클리닉을 진행했다. 한국인 메이저리거 김하성, 고우석을 비롯한 샌디에이고 선수들과 파드리스 투수 출신인 박찬호가 이 행사에 함께했다. 선수들이 아이들에게 티볼과 투구 그립을 알려주던 도중 깜짝 손님이 등장했다. 바로 윤석열 대통령. 야구팬으로 잘 알려진 윤 대통령이 한국을 방문한 파드리스 선수단을 찾은 것이다. 김하성의 타격 시범을 지켜보던 윤 대통령은 타석에서 직접 배트를 휘둘러보기도 했다.연합뉴스연합뉴스■      오후 1:0015m 물웅덩이를 건너라, '발왕水플래시' 이색 이벤트 열려봄기운이 완연한 16일 강원 평창군 모나용평(용평스키장)에서 물웅덩이를 스키·스노보드로 건너는 이색 이벤트인 '발왕水플래시'가 열렸다. 이 행사는 모나용평에서 시즌 말에 진행하는 이벤트 대회로 슬로프에서 속도를 내고 내려오다가 15m 길이의 물 웅덩이를 건너가면 다음 시즌 모나용평 시즌권을 주는 대회다. 이날 행사엔 공룡과 푸바오 등 이색 복장의 참가자들이 눈길을 끌었다.공룡 코스프레를 한 스노보더가 물웅덩이를 건너고 있다. 연합뉴스섹소폰을 든 스노보더가 물웅덩이를 건너고 있다. 연합뉴스푸바오 복장의 스키어가 물웅덩이를 건너고 있다. 연합뉴스■      오전 12:00제주 찾은 25개국 주한대사들, 올레길 걷고 삼다수 마시고봄기운이 완연한 16일 오전 제주 서귀포시 법환포구 앞에 20여명의 외국인들이 모였다. 이들은 제주도가 대한민국 시도지사협의회와 협업한 '주한외교단 초청 제주정책문화 연수사업' 참가자들이다. 이번 연수에는 아세안, 유럽, 아프리카 등을 비롯해 25개국 주한대사들이 참여했다. 연수 둘째날인 이날 주한대사들은 제주올레 7코스 일부 구간을 걷기위해 모였다. 이날 제주 하늘은 잔설이 남은 한라산 백록담이 선명하게 보일만큼 맑았고 푸른 바다에는 내리쬐는 봄 햇살이 부서져 마치 하얀 보석이 쏟아진 듯했다. 주한대사들은 제주의 아름다운 자연환경에 감탄하며 서로 사진을 찍어주는 등 즐거운 시간을 보냈다. 로돌프 파스퀠레 온두라스 대사는 ""제주에 온 것은 이번이 처음인데 환대해 주셔서 너무 감사하다""며 ""아름다운 풍경과 함께 바닷길을 걸을 생각에 설렌다""고 말했다.뉴스1뉴스1■      오전 10:40전국 20개 의대교수 비대위 ""25일부터 사직서 제출""전국 의과대학 교수들이 이달 25일 이후 대학별로 사직서를 제출하기로 뜻을 모았다. 다만 교수들은 사직서를 내더라도 환자 진료에는 최선을 다하겠다는 입장이다. 전국 20개 대학이 모인 전국 의과대학 교수 비상대책위원회(비대위)는 15일 저녁 온라인 회의를 열고 이렇게 결의했다. 회의에 참여한 의대는 강원대·건국대·건양대·계명대·경상대·단국대·대구가톨릭대(서면 제출)·부산대·서울대·아주대·연세대·울산대·원광대·이화여대·인제대·전북대·제주대·충남대·충북대·한양대 등이다.뉴스1연합뉴스"
2024-03-30,폭설에 스키장 다시 열렸다…벚꽃∙눈꽃 동시에 즐기는 축제,"지난해 4월 2일 강원 강릉시 경포 일원에 만개한 벚꽃 위로 밤 사이 눈이 내린 대관령이 보이고 있다. 올해는 경포 일원은 아직까지 벚꽃이 피지 않은 상황이다. [뉴스1]━골목상권 활성화에 큰 도움될 것이번 주말 강원도 대표 관광지를 찾는다면 벚꽃과 눈꽃을 함께 감상할 수 있다. 강릉시 교1동 솔올택지 일원에는 지난 28일부터 벚꽃 축제인 ‘2024 솔올블라썸 축제’가 열리고 있다.교1동 주민자치회가 주최하는 이번 축제는 31일까지 계속된다. 문화예술 공연이 열리고 거리마켓, 벚꽃 포토존 등이 운영된다. 강릉시 강남동 일대에서도 31일까지 ‘새봄맞이 축제’가 개최된다. 남산공원 일대에서 열리는 이 축제에서는 밴드 공연과 트로트 가수 초청공연, 관노가면극 등이 펼쳐진다.당초 29일 개막 예정이던 강릉의 대표 벚꽃 축제 ‘경포 벚꽃 축제’는 벚꽃 개화가 늦어지면서 다음 달 5∼10일로 1주일 연기됐다. 강릉시 관계자는 “봄을 맞아 진행되는 꽃 축제가 골목상권에 활기를 불어넣고 있다”며 “지역경제 활성화에 큰 도움이 될 것으로 기대한다”고 말했다.강원 평창군 대관령면 용평스키장인HJ매그놀리아용평호텔앤리조트(모나용평)는 최근 내린 폭설에 30일과 31일 이틀간 스키장을 재개장하기로 했다. [사진 모나용평]━폭설에 2개 슬로프 오후 1시까지 운영이런 가운데 강릉에서 자동차로 30분 거리에 있는 평창군 대관령면 용평스키장인HJ매그놀리아용평호텔앤리조트(모나용평)는 최근 폭설이 내리자 30일과 31일 이틀간 스키장을 재개장하기로 했다. 강원기상청에 따르면 대관령면엔 지난 19~20일 24.1㎝, 25~26일 19.7㎝의 눈이 내려 스키장과 주변 산이 눈으로 뒤덮였다. 이틀간 여는 슬로프는 레인보우1과 레인보우 파라다이스 등 2개 슬로프다. 운영시간은 오전 9시부터 오후 1시까지다.박성규 총지배인은 “최근 20㎝ 정도 눈이 내리면서 슬로프 상태가 괜찮아 지난 24일 문을 닫았던 스키장을 재개장하기로 결정했다”며 “봄의 길목에서 뜻밖의 즐거움을 선사해 줄 수 있을 것으로 기대한다”고 말했다. 주말 스키장 이용 요금은 시즌패스 소지자와 객실 및 골프 회원은 무료고, 일반 고객은 리프트 2만원, 렌탈 1만원이다.올해 처음으로 벚꽃축제가 열리는 속초에서는 이번 주엔 설산을, 다음 주엔 벚꽃과 눈꽃을 함께 보는 이색 축제를 즐길 수 있을 전망이다. 속초시는 30~31일, 4월 6~7일 나흘 동안 영랑호 일대에서 ‘영랑호 벚꽃축제’를 개최한다. 당초 속초시는 30~31일 이틀간 축제를 열 계획이었지만 벚꽃 개화가 늦어져 2주간 주말 축제를 진행하기로 했다. 현재 영랑호는 벚꽃이 피지 않았지만, 영랑호에서 보이는 설악산은 최근 내린 눈이 산 전체를 뒤덮으면서 장관을 이루고 있다.강원 속초 영랑호에서 바라본 설악산이 울산바위 모습. [사진 속초시]강원 삼척시는 지난 29일부터 다음 달 14일까지 ‘제20회 삼척 맹방 유채꽃 축제’를 개최한다. [사진 삼척시]━푸른 동해와 유채꽃ㆍ벚꽃 함께 감상김연설 시민소통팀장은 “현재 영랑호 벚꽃은 아직 몽우리 상태”라며 “다음 주쯤엔 활짝 핀 벚꽃과 눈꽃으로 장관을 이룬 설악산을 함께 볼 수 있을 전망”이라고 말했다. 모래 퇴적물 등이 해안 입구를 막아 형성된 석호(潟湖)인 영랑호는 봄이면 7㎞에 달하는 둘레길을 따라 벚꽃이 만개한다. 축제장에서는 버스킹 공연과 오픈마켓·포토존·요가 등 다양한 체험 행사가 예정돼있다.이와 함께 유채꽃밭이 유명한 삼척시에서도 지난 29일부터 다음 달 14일까지 ‘제20회 삼척 맹방 유채꽃 축제’가 개최된다. 삼척시 근덕면 상맹방리 유채꽃밭에서 2002년 첫선을 보인 삼척 맹방 유채꽃 축제는 매년 30만명 이상이 찾은 삼척 대표 봄꽃 축제다. 올해는 ‘유쾌한 봄! 너랑 나랑 노랑 유채꽃과 함께~’를 주제로 펼쳐진다.축제 기간 축구장(7140㎡) 9개에 달하는 벌판이 노란 유채꽃으로 물든다. 이곳에선 푸른 동해와 노란 유채꽃, 새하얀 벚꽃이 한데 어우러진 모습을 감상할 수 있다."
2024-11-30,“스키 타기 딱 좋아요” 대설 속 강원 스키장 본격 개장,"휘닉스평창 직원들이 개장을 축하하는 행사를 하고 있다. 사진 휘닉스평창 제공기습 한파와 함께 이례적으로 많은 눈이 쏟아지면서 본격적인 겨울 추위가 찾아왔다. 이러한 가운데 30일 겨울시즌에 돌입한 강원지역 스키장을 비롯해 설경 명소 등에 인파가 몰려 겨울 정취를 즐겼다.전날 초·중급자용 핑크 슬로프를 개장한 모나용평에는 전날 3000명이 찾은 데 이어 이날에도 오후 2시 현재 연인과 친구, 가족 단위 스키어 등 2000여명이 몰려 개장 첫 주말 은빛 설원을 누볐다.같은 날 스키장 문을 연 평창 휘닉스파크도 전날 5000여명이 방문한 데 이어 이날 오후 3시까지 4200여명이 찾아 은빛 설원을 질주했다.스키어를 비롯해 관광객들은 스키장 곳곳에서 다양한 공연을 즐길 수 있는 아프레스키를 찾아 즐겁게 지냈다.스키장을 찾은 이용객들이 슬로프를 기다리고 있다. 사진 모나 용평 제공이밖에 평창 알펜시아리조트는 오는 12월 4일, 강원랜드가 운영하는 하이원리조트와 춘천의 엘리시안 강촌 리조트는 12월 6일 스키장을 개장할 예정이다. 원주의 오크밸리리조트는 12월 14일부터 올겨울 스키장 운영을 본격화한다.지난 26∼28일 평창 31.7㎝, 원주 29.3㎝, 홍천 21.4㎝, 미시령 12.5㎝ 등의 눈이 내리면서 등산객과 관광객 등이 대관령 선자령을 비롯해 치악산, 인제 자작나무 숲 등 도내 설경 명소를 찾아 정취를 만끽했다."
2023-01-29,[포토타임] 한파도 못말려... 40만명 찾은 평창송어축제,"오늘의 국내 주요 뉴스 사진(전송시간 기준)을 한눈에 파악할 수 있도록 실시간 업데이트합니다.■      오후 5:00한파도 못말려... 40만명 찾은 평창송어축제29일 오후 평창군 진부면 오대천 일원에서 열린‘제14회 평창송어축제'를 찾은 방문객이 얼음낚시를 즐기고 있다. 코로나19 여파로 3년 만에 열린 이번 축제는 기록적인 한파에도 불구하고 연인원 40만명이 방문하는 큰 성공을 거두었다. 설 연휴 기간 평창송어축제위원회는 ‘꽝 없는 송어 증정 이벤트’를 여는 등 다양한 이벤트로 큰 호응을 얻기도 했다.사진 평창군사진 평창군사진 평창군■      오후 3:20구름 관중 가득찬V-리그 올스타전... 김연경·신영석은 최다 팬 투표흥국생명 김연경과 한국전력 신영석이 29일 오후 인천 부평구 인천삼산월드체육관에서 열리는 프로배구 '도드람 2022~2023V-리그 올스타전’ 올스타 최다 팬 투표 시상식에서 신무철KOVO사무총장과 기념 촬영을 하고 있다. 이번 올스타전은MZ세대 트렌드를 반영해 1995년 출생 전후의 남자부M-스타와Z-스타, 1996년 출생 전후의 여자부M-스타와Z-스타로 구성됐다. 4년 만에 정상화된 올스타전은 6000여석 전석 매진됐다.연합뉴스뉴스1뉴스1뉴스1뉴스1■      오후 2:00코로나19 공중보건 비상사태 해제되나...WHO30일 발표코로나19 신규 확진자가 1만8871명으로 집계된 29일 오후 서울 송파구 올림픽공원 평화의문 광장 임시선별검사소에서 의료진이 검체를 채취하고 있다. 세계보건기구(WHO)는 오는 30일 코로나19에 대한 공중보건 비상사태(PHEIC) 해제 여부를 공개할 예정이다.WHO가 비상사태를 해제하면 코로나19의 감염병 등급이 떨어진다. 이어 확진자 격리 기간 단축 등 여러 방역 규제가 순차적으로 완화될 전망이다. 한국 정부도 이에 맞춰 방역 조치를 조정할 계획이다.뉴시스■      오후 1:00입춘 기다리는 매화입춘(立春)을 엿새 앞둔 29일 부산 남구 동명대학교 본관 앞 정원에 매화꽃이 개화했다. 기상청은 오늘 서울 낮 기온이 영상 4도까지 오르는 등 6일 만에 영상권을 회복하겠다고 예보했다. 이어 추위가 누그러지면서 큰 추위 없는 예년 이맘때 겨울 날씨가 이어지겠다고 전망했다.송봉근 기자■      오전 11:50제2회 화이트 스페이스 배 산악스키 대회 용평서 열려... '산악스키' 2026 동계올림픽 정식 종목 채택29일 강원도 모나파크 용평리조트에서 열린 '제2회 화이트 스페이스 스키모 첼린지' 산악스키 대회 참가자들이 슬로프를 향해 출발하고 있다. 2026년 밀라노-코르티나 동계올림픽 정식종목으로 채택된 산악스키는 자신의 체력으로 산을 오르는 업힐과 알파인 스키와 같이 슬로프를 내려오는 다운힐 코스 구간을 빠르게 완주하는 순서로 순위를 정하는 종목이다. 2026년 동계올림픽에서는 (남녀스프린트, 인디비주얼, 남녀릴레이) 5개 금메달이 걸려있다.사진 화이트 스페이스사진 화이트 스페이스사진 화이트 스페이스■      오전 11:00순백의 조각 축제... 태백산 눈축제 찾은 관광객들29일 강원 태백시 태백산국립공원당골광장에서 진행 중인 '제30회 태백산 눈축제'에서 관광객들이 즐거운 겨울 추억을 만들고 있다. 지난 27일 개막한 태백산 눈축제는 태백산 국립공원 당골광장과 황지연못 일원에서 오는 31일까지 진행된다. 코레일은 눈축제 기간 동안 서울과 부산, 대전 등에서 태백을 오가는 임시 관광 열차를 운행하고 있다.연합뉴스연합뉴스연합뉴스■      오전 10:00실내 마스크 의무 착용 해제D-1지난 2020년 10월 도입된 실내 마스크 착용 의무 조치가 27개월 만에 권고로 전환된다. 29일 오전 서울 중구 지하철 1호선 서울역 승강장에 실내 마스크 권고 관련 안내문이 설치되어 있다. 30일부터 대중교통수단 실내, 감염취약시설, 의료기관 등을 일부 시설을 제외한 실내에서 마스크 착용 의무가 부분 해제된다. 다만 감염취약시설 중 입소형 시설, 의료기관·약국, 대중교통수단에서는 마스크를 착용해야 한다. 대형마트, 백화점, 쇼핑몰 등에서는 마스크를 쓰지 않아도 되지만 대형마트 내에 있는 약국에서는 마스크를 써야 한다.뉴시스뉴시스뉴시스■   2023.01.29   오전 9:00휘발유 오르고 경유 내리고... 좁혀진 가격 차휘발유 가격 상승세와 경유 가격 하락세가 이어지고 있는 29일 오전 서울 시내 한 주유소 유가정보 안내판에 표시된 휘발유와 경유의 가격이 리터당 50원의 차이를 보이고 있다. 이날 한국석유공사 유가정보시스템 오피넷에 따르면 전국평균 휘발유 리터당 가격은 1572.55원, 경유는 1648.94원이다.뉴시스"
