date,title,content
2024-03-02,‘보복 스키족’ 증가에 스키상품 매출 급증...60대 이상 실버 스키족도 크게 늘어,"코로나 엔데믹에 스키장 다시 찾아60대 이상 증가율 200% 웃돌아지난달 24일 최근 폭설이 내려 설질이 좋아진 스키장에 많은 스키어가 찾아 겨울스포츠를 즐기고 있다.연합뉴스코로나 엔데믹에 따라 ‘보복 스키족’이 크게 늘어나며 올겨울 스키장 매출이 급증했다.2일 전자상거래업체 티몬에 따르면 지난해 9월 1일부터 올해 1월 말까지 스키 시즌권과 대여 상품을 포함한 스키 관련 상품 거래액은 전년 같은 기간과 비교해 200% 늘었다. 위메프에서는 539% 급증한 것으로 집계됐다. 코로나 시기 스키장을 제대로 이용하지 못했던 아쉬움을 풀려는 이른바 ‘보복 스키족’이 늘며 판매량을 끌어올린 것으로 풀이된다.티몬이 지난해 9월 선보인 ‘X5 시즌패스’와 같이 주요 스키장들이 이커머스 플랫폼과 공동으로 판매한 통합시즌권이 매출 증가를 이끌었다. 모나 용평리조트·하이원리조트·웰리힐리파크·엘리시안 강촌·에덴밸리리조트 등 5개 스키장을 무제한 이용할 수 있고, 19세 이하 자녀도 무료 동반이 가능해 인기를 끈 ‘X5 시즌패스’는 판매 첫날에만 1만7000여명이 몰리며 매출이 74억원에 달했다.60대 이상 ‘실버 스키족’도 크게 늘었다. 티몬에서 연령대별 스키 상품 거래액 증가율을 보면 70대가 690%, 80대 이상이 580%로 1∼2위를 차지했다. 이외에 60대 164%, 50대 212%, 30대 127%, 20대 56%씩 늘었다. 티몬에 따르면 60대 이상 전체 거래액 증가율은 221%로 집계됐다.티몬 관계자는 “엔데믹을 맞아 대표 겨울 스포츠인 스키에 대한 관심이 높아지면서 남녀노소 불문하고 스키장을 즐겨 찾았다”며 “특히 어르신들은 오랜만에 자녀 세대와 함께 가족 단위로 스키를 즐기는 수요가 많았던 것으로 보인다”고 말했다."
2024-01-08,‘최고령 스키어’ 98세 할아버지의 질주,"이근호씨, 60세 때 스키 입문해지금도 매일 5시간씩 즐겨이근호 이사장이 모나 용평 스키장에서 질주하고 있다. 작은 사진은 최근 인터뷰한 모습. /정병선 기자“100세요? 앞으로 5년은 더 탈 것 같은데요.”2024년 새해 첫날 모나 용평 스키장. 중상급자가 타는 레인보 파라다이스 코스에서 만난 이근호(98) 설해재단 이사장은 지친 기색 하나 없었다. 설원을 가르며 슬로프를 내려오는 모습은 젊은이 못지않았다. 이 이사장은 “폐부 깊숙이 들어오는 찬 바람의 느낌은 최고”라며 “지금 당장 젊은이는 물론 60세 이상 퇴직자들에게도 스키를 권하고 싶다”고 했다. 1926년생인 이 이사장은 7일 98세 생일을 맞았다.이 이사장의 스키 인연은 대구 계성고 동기 김재현 전 쌍용그룹 부회장(2013년 작고)이 1983년 제12대 대한스키협회 회장을 맡은 뒤 그에게 협회 부회장(1983~1987년)을 권유하면서다. 미국 새너제이에서 대학을 졸업하고 귀국했는데 스키협회의 외국어 구사 인력이 없어 국제 업무를 볼 사람이 마땅치 않자 이 이사장을 영입한 것이다. 이 이사장은 “스키를 타본 적도 없었는데 덜컥 스키판에 발을 디딘 배경이다”고 했다. 그는 이듬해 사라예보 동계올림픽 대비 대표팀 단장을 맡아 프랑스 그르노블 전지훈련장에서 스키를 처음 신었다. 나이 60세였다.“선수들이 전부 훈련을 나가면 스키를 못 타 혼자 외톨이가 됐지요. 바로 현지 스키 학교에 등록해 스키를 배웠지요.” 계성중 재학 시절 유도 선수로 이름을 날렸고 유도, 농구, 축구, 탁구 등 못하는 운동이 없을 정도로 만능 스포츠맨이었던 그는 협회 직원으로 스키를 못 탄다는 사실을 들키고 싶지 않았다.이내 스키에 빠져들었다. 그는 외국 스키 교본을 번역하며 전문가 수준이 됐다. 일본에서 1급 스키 지도자 자격증까지 땄다. 해마다 스키 시즌이면 용평 스키장을 찾아 살다시피 했다. 국내 시즌이 끝나면 남반구 뉴질랜드로 날아가 스키를 탔다. 77세에 건강 문제로 폐 한쪽을 떼어냈고. 90세에는 갈비뼈가 부러지기도 했지만, 포기하지 않았다.이 이사장은 장수의 비결을 묻자 “스키를 타며 하체를 단련한 덕이다”라고 했다. 이 이사장의 허벅지는 60대 수준. 그는 “요즘도 스키를 5시간 전후로 타고, 비시즌에는 2시간 이상 사이클링 머신을 타면서 하체를 단련한다”고 했다.그의 목표는 “매년 2월 미국에서 90세 이상 실버 스키어들이 모이는 클럽 대회에서 우승한 뒤 최장수 스키어로 남고 싶다”고 했다. 그는 “미국에 94세 스키어가 있지만 내 나이는 없다”며 “지금 상태라면 5년 정도는 더 탈 것 같다”고 엄지 척을 했다.해운업에 종사하던 이 이사장은 사업을 접고 2003년 자신의 호(설해·雪海)를 딴 장학재단을 설립해 스키 선수들을 지원하고 있다. 국내 스키 유망주와 각종 국제대회 메달리스트에게 매년 5000만원의 격려금을 전달하는데 이미 10억원을 넘겼다.신달순 용평 스키장 대표는 “이 이사장을 위해 시즌권은 물론 스키 타는 데 불편하지 않도록 모든 배려를 하고 있다”며 “이근호 이사장의 스키 타는 현역 최장수 할아버지 기네스북 등재를 추진하고 있다”고 했다./용평=정병선 기자"
2024-01-08,‘최고령 스키어’ 98세 할아버지의 질주,"이근호씨, 60세 때 스키 입문해지금도 매일 5시간씩 즐겨이근호 이사장이 모나 용평 스키장에서 질주하고 있다. 작은 사진은 최근 인터뷰한 모습. /정병선 기자“100세요? 앞으로 5년은 더 탈 것 같은데요.”2024년 새해 첫날 모나 용평 스키장. 중상급자가 타는 레인보 파라다이스 코스에서 만난 이근호(98) 설해재단 이사장은 지친 기색 하나 없었다. 설원을 가르며 슬로프를 내려오는 모습은 젊은이 못지않았다. 이 이사장은 “폐부 깊숙이 들어오는 찬 바람의 느낌은 최고”라며 “지금 당장 젊은이는 물론 60세 이상 퇴직자들에게도 스키를 권하고 싶다”고 했다. 1926년생인 이 이사장은 7일 98세 생일을 맞았다.이 이사장의 스키 인연은 대구 계성고 동기 김재현 전 쌍용그룹 부회장(2013년 작고)이 1983년 제12대 대한스키협회 회장을 맡은 뒤 그에게 협회 부회장(1983~1987년)을 권유하면서다. 미국 새너제이에서 대학을 졸업하고 귀국했는데 스키협회의 외국어 구사 인력이 없어 국제 업무를 볼 사람이 마땅치 않자 이 이사장을 영입한 것이다. 이 이사장은 “스키를 타본 적도 없었는데 덜컥 스키판에 발을 디딘 배경이다”고 했다. 그는 이듬해 사라예보 동계올림픽 대비 대표팀 단장을 맡아 프랑스 그르노블 전지훈련장에서 스키를 처음 신었다. 나이 60세였다.“선수들이 전부 훈련을 나가면 스키를 못 타 혼자 외톨이가 됐지요. 바로 현지 스키 학교에 등록해 스키를 배웠지요.” 계성중 재학 시절 유도 선수로 이름을 날렸고 유도, 농구, 축구, 탁구 등 못하는 운동이 없을 정도로 만능 스포츠맨이었던 그는 협회 직원으로 스키를 못 탄다는 사실을 들키고 싶지 않았다.이내 스키에 빠져들었다. 그는 외국 스키 교본을 번역하며 전문가 수준이 됐다. 일본에서 1급 스키 지도자 자격증까지 땄다. 해마다 스키 시즌이면 용평 스키장을 찾아 살다시피 했다. 국내 시즌이 끝나면 남반구 뉴질랜드로 날아가 스키를 탔다. 77세에 건강 문제로 폐 한쪽을 떼어냈고. 90세에는 갈비뼈가 부러지기도 했지만, 포기하지 않았다.이 이사장은 장수의 비결을 묻자 “스키를 타며 하체를 단련한 덕이다”라고 했다. 이 이사장의 허벅지는 60대 수준. 그는 “요즘도 스키를 5시간 전후로 타고, 비시즌에는 2시간 이상 사이클링 머신을 타면서 하체를 단련한다”고 했다.그의 목표는 “매년 2월 미국에서 90세 이상 실버 스키어들이 모이는 클럽 대회에서 우승한 뒤 최장수 스키어로 남고 싶다”고 했다. 그는 “미국에 94세 스키어가 있지만 내 나이는 없다”며 “지금 상태라면 5년 정도는 더 탈 것 같다”고 엄지 척을 했다.해운업에 종사하던 이 이사장은 사업을 접고 2003년 자신의 호(설해·雪海)를 딴 장학재단을 설립해 스키 선수들을 지원하고 있다. 국내 스키 유망주와 각종 국제대회 메달리스트에게 매년 5000만원의 격려금을 전달하는데 이미 10억원을 넘겼다.신달순 용평 스키장 대표는 “이 이사장을 위해 시즌권은 물론 스키 타는 데 불편하지 않도록 모든 배려를 하고 있다”며 “이근호 이사장의 스키 타는 현역 최장수 할아버지 기네스북 등재를 추진하고 있다”고 했다./용평=정병선 기자"
2023-10-27,"모나 용평, 고용노동부 주최 ‘2023년 웰니스컬리지(Wellness College)’ 성료","㈜HJ매그놀리아용평호텔앤리조트(이하 모나 용평)가 ‘2023년도 웰니스컬리지(WellnessCollege)’를 성황리에 마무리했다.웰니스 컬리지는 고용노동부가 주최하고 모나 용평과 웰니스 교육기업 산소발자국이 함께 운영하는 웰니스 전문가 양성교육 사업으로, 현재 1기에서 7기까지 총 404명의 웰니스 전문가를 배출하였다. 또한 해당 사업은 지난 2022년도에 고용노동부 장관상을 수상하기도 했다.웰니스컬리지는 미취업 청년을 대상으로 4주간의 비대면 교육과 3박 4일 모나 용평에서 합숙 훈련으로 마무리된다. 특히 최근 유망 산업인 웰니스와 마음챙김 분야에 필요한 직무 훈련과 실무 경험 기회를 제공한다. 웰니스컬리지는 우수한 강사진과 체계적인 커리큘럼으로 올해 진행된 4기에서 7기까지의 교육은 평균만족도(만족, 매우만족 비율) 97%, 모집 경쟁률이 5:1에 육박할 만큼 매우 인기있는 프로그램이다.특히 산소발자국이 진행한 4주간의 온라인 교육은 웰니스 프로그램의 특수성에도 불구하고 온라인에 최적화된 교육 시스템을 통해 참여자들이 효과적으로 실습할 수 있도록 구성하였다. 웰니스 각 분야에서 최고 수준의 강사진에 의해 요가, 사운드배스(Sound-Bath), 숲 치유, 아로마 테라피와MSC(MindfulSelfCompassion),ACT(Acceptanceandcommitmenttherapy),SIY(SearchInsideYourself),MBSR(Mindfulness-basedstressreduction),MSL(MindfulSelfLeadership),MBSP(Mindfulness-basedStrengthsPractice) 등 마음챙김과 관련된 과학적 웰니스 프로그램을 한 자리에서 만날 수 있다.마지막 5주차에는 온라인에서 학습하였던 내용을 토대로 모나 용평에서 3박 4일 합숙 교육이 진행된다. 이때 웰니스 관광지에서 필요한 웰니스 프로그램을 직접 개발하고 발표하는 팀 프로젝트가 진행된다. 이로써 청년들의 취업역량을 강화하는 동시에 웰니스 분야를 선도하는 전문가적 소양을 갖추게 된다.모나 용평 관계자는 “웰니스 컬리지를 통해 양성된 웰니스 전문가들이 향후 웰니스 분야의 주축이 될 것으로 기대한다”며, “앞으로도 우수한 인재를 지속적으로 양성하고 지원하겠다”고 말했다."
2024-07-22,"모나 용평 ‘용평밸리’ 출범, 신규 사업 추진","모나 용평 주식회사(이하 모나 용평)가 ‘용평밸리 주식회사’(이하 용평밸리)를 새롭게 출범했다.모나 용평은 동계올림픽 개최지인 평창과 용평을 글로벌 랜드마크로 육성하기 위해 기존의 레저 산업 외 ‘용평밸리’를 출범해 식품 사업을 중심으로 새로운 웰빙 상품의 기준과 문화 형성을 위한 신규 사업을 새롭게 시작한다.신달순 대표이사는 ‘용평밸리’의 비전과 목표를 공유하며, 고객에게 건강한 라이프스타일과 행복을 제공하기 위한 다양한 계획을 발표했다. ‘용평밸리’는 식품뿐만 아니라 친환경 의류와 식물성 뷰티제품·스킨케어 등 비식품 사업으로도 점차 사업 영역을 확대하고, 해외 진출을 통해 한류 제품을 전 세계에 선보일 계획이다.특히 이번 신규 사업과 관련해 배우 이영애가 투자에 참여했다. 배우 이영애는 신달순 대표의 공익적 기업 철학과 건강한 문화 발전에 이바지하겠다는 신념을 높이 평가해 이번 사업에 함께 하게 됐다.평창동계올림픽 홍보대사 등 강원도와 각별한 인연을 맺고 있는 배우 이영애는 드라마 ‘대장금’을 통해 전통 한식의 매력을 전 세계에 알리며 큰 인기를 끌었고, 최근에는 ‘의녀대장금’의 후속작 촬영 소식으로 다시 한 번 주목받고 있다. 이외에도 2013년 서울대학교와 함께 사회적 공익기업인 ‘리아SNU’를 설립해 회사 이익을 사회적 약자를 위해 의료와 장학지원 사업에 기부하고 있는 것으로 알려졌다.신달순 대표이사는 “용평밸리는 판매수익 증진을 통해 지역경제 활성화에 기여하고, 수익의 일부는 지역사회에 환원하겠다라는 목표가 제1의 경영철학”이라며, “이를 위해 모든 제품 개발에는 발왕산 지역의 천연 특산물을 활용해 고객 건강에 기여하고 지역주민, 지역기업과 상호 협력을 통해 균형 있는 지역경제 발전과 상생을 추구한다”고 강조했다.한편 모나 용평은 2020년 식품사업부를 신설하고 발왕산수국차, 자일리톨 등 천연감미료를 활용해 설탕, 아스파탐 등 인공 화학 첨가물이 없는 건강한 음식을 개발하며 사업을 확장해왔다. 올해 출시 예정인 ‘용평밸리’의 제품으로는 건강 편의식 ‘매운 황태라면’,‘발왕산 수국차 울금 즉석밥’,‘기품은 유기농 발왕산 수국차RTD음료’ 등이 있다.현재 서울대학교 그린바이오 과학기술연구원, 국민대학교 바이오발효융합학과, 선문대 식품공학·영양학부, 경남제약 등 다양한 연구기관 및 친환경 지역업체와 협력해 혁신적인 연구와 개발을 진행 중이다. 또한 발왕산 식품연구소를 설립해 고객이 직접 친환경, 친건강 식품 관련 체험을 하고 소통할 수 있는 플랫폼을 제공할 계획이다."
2024-12-06,"때 이른 폭설, 날아보자","지난달 29일 강원도 평창 휘닉스파크와 모나 용평이 개장하면서 스키 시즌이 개막했다. [사진 휘닉스파크]지난주 내린 폭설로 강원도 산지는 아직도 겨울왕국 분위기다. 11월 28일 강원도 평창군이 적설량 31㎝를 기록한 덕분에 이튿날 동시에 개장한 휘닉스파크와 모나 용평의 방문객은 개장 첫날부터 최상급 설질을 경험했다. 올겨울, 어느 스키장에서 스키 타고 눈 놀이를 즐길까. 주요 스키장 이용법을 소개한다.휘닉스파크 등 슬로프 전면 개장휘닉스파크는 애니메이션 캐릭터 ‘씰룩’과 제휴를 맺었다. [사진 휘닉스파크]엔데믹 이후 회복세를 보이긴 했지만, 최근 10여년간 스키장 이용객은 꾸준히 감소했다. 해마다 스키장 한 두 곳이 폐업했고, 슬로프 일부만 개장하는 스키장이 많았다.올겨울은 분위기 반전이 기대된다. 전국의 스키장이 ‘모든 슬로프 개방’을 발표했다. 휘닉스파크 관계자는 “올겨울 시즌권이 지난해보다 15% 더 팔렸다”며 “대학생 시즌권 판매량이 7% 늘어난 게 이례적”이라고 말했다.강원도 평창·정선처럼 수도권에서 먼 지역의 스키장은 하룻밤 이상 여유롭게 방문하는 게 좋다. 하여 스키장마다 다양한 이벤트와 즐길 거리, 먹거리로 스키어를 유혹한다. 휘닉스파크는 이달 19일까지 투숙하는 이용객에게 눈 놀이 시설 ‘스노 빌리지’ 입장권을 준다. 스노 빌리지는 애니메이션 캐릭터 ‘씰룩’과 제휴를 맺어 흥미를 더한다. 요즘 스키장은 스키를 탄 뒤 즐기는 시간을 뜻하는 ‘아프레 스키’에도 공을 들인다. 이달 19일부터 1월 26일까지 휘닉스호텔 1층 라운지에서는 김가온밴드를 비롯한 유명 뮤지션의 공연을 감상하며 다과를 즐길 수 있다.모나 용평은 11년 연속 ‘월드 스키 어워즈’ 베스트 스키장상 수상을 기념한 객실 패키지를 선보였다. 리조트 1박과 2인 리프트권을 포함해 11만원부터다. 알펜시아를 찾는다면 ‘광장포차’를 가봐야 한다. 홀리데이 인 리조트 앞 대형 포장마차에서 맥주를 즐기고 버스킹 공연도 감상할 수 있다.국내 최대 규모의 실내 워터파크인 하이원 워터월드. [사진 각 스키장]6일 개장하는 하이원리조트는 스키 초보나 가족 여행객이 찾기에 좋다. 4.2㎞에 달하는 최장 슬로프도 경사가 완만하고 한산한 편이다. 오는 23일 개장 예정인 2만여㎡ 규모의 ‘스노우 월드’에서는 래프팅 썰매, 얼음 미끄럼틀 등을 탈 수 있고 국내 최대 실내 워터파크 ‘하이원 워터월드’에서 물놀이와 스파를 즐길 수 있다.스키 즐긴 뒤 재즈·버스킹·워터파크지난달 말, 중부 지방에 폭설이 내리면서 설국이 된 엘리시안 강촌. [사진 각 스키장]강원도 홍천과 춘천, 경기도 광주의 스키장은 ‘접근성 좋은 수도권’이라는 입지 조건을 강조한다. 가까운 만큼 대중교통으로 찾아가거나 자정이 넘어서도 스키를 즐길 수 있다.비발디파크는 5일 개장과 함께 오후 11시까지 야간 스키를 운영한다. 오는 20일에는 오후 11시부터 오전 3시까지 이어지는 심야 스키도 시작한다. 올겨울 비발디파크에서 스키를 타려면 헬멧을 꼭 써야 한다. 안전을 위해서다. 곤지암리조트·하이원리조트 등은 일찌감치 헬멧 착용을 의무화했다.엘리시안 강촌에서 스키를 타면 인생 사진을 건질 수 있다. 6일 개장하는 엘리시안 강촌은 전속 사진가가 주말마다 슬로프에서 이용객 수백 명의 사진을 촬영해 홈페이지 ‘현장 스케치’ 코너에 올려준다. 스키 타면서 휴대전화로 사진을 찍는 게 쉽지 않은 까닭에 호응이 높다.곤지암리조트의 상징인 곤지암 스키 베어. [사진 각 스키장]이달 14일 개장 예정인 곤지암리조트는 슬로프에 변화를 준다. 초·중급자도 정상부터 활강을 즐기도록 파노라마 슬로프를 확대하는 게 대표적이다. 펀 슬로프 존은 ‘눈 언덕’ 코스를 추가해 재미를 더한다. 스키 하우스 앞 ‘눈 내리는 스키 마을’은 인증사진 명당이다. 8m 높이의 ‘곤지암 스키 베어’ 캐릭터를 배치할 예정이다."
2023-10-05,"모나용평 신달순 대표이사, ‘은탑산업훈장’ 수상","㈜HJ매그놀리아용평호텔앤리조트(이하 '모나용평')의 신달순 대표이사가 문화체육관광부의 주관 아래 진행된 제50회 관광의 날 기념식에서 은탑산업 훈장을 수상했다. 이 행사는 매년 세계 관광의 날을 기념해 문화체육관광부에서 주최하는 것으로, 올해는 4일 서울 롯데호텔 크리스탈볼룸에서 개최되었다.신달순 대표이사는 20년 이상의 관광 분야CEO로서, 웰니스관광,ESG경영 도입 등 관광트렌드를 선도하며 관광산업 발전에 이바지한 공로를 인정받아 세계 관광의 날을 맞아 관광 분야 최고의 훈장을 수여받게 되었다. 겨울연가, 도깨비 등 한류문화의 초석을 만들었으며 2018 평창 동계올림픽의 성공적 개최를 통해 전 세계인들에게 대한민국의 우수한 문화를 알리는 계기를 만들었다. 특히 모나용평에 위치한 발왕산을 활용하여 관광 스토리텔링 등 다양한 콘텐츠 개발로 강원도를 대표하는 관광지로 발돋움 시켰다.신달순 대표이사는 이전에 신세계 센트럴시티 메리어트호텔 대표를 역임한 적이 있으며 현재는 모나 용평 호텔앤리조트, 파인리즈리조트, 그리고 세일여행사의 대표이사를 맡고 있다.신달순 대표이사는 “많이 부족함에도 불구하고 작은 성과를 국가로부터 인정받아 기쁘다“며 ”앞으로도 더욱 열심히 한국 관광산업발전을 위해 노력하겠다“라고 밝혔다."
