date,title,content
2023-06-04,"""日 기업 5배 출연, 韓 기업 국제기여 미흡 너무 아쉽다""","5주년 맞은 라이트재단 손명세 이사장 인터뷰손명세 국제보건기술연구기금(라이트재단) 이사장. 사진 라이트재단""국내 진단기기 업체나 제약·바이오 기업이 우리 재단과 협업해 세계 공중보건 향상에 참여하길 기대합니다. 그리하게 되면 기업의 힘만으로 진입하기 어려운 나라에 진출할 수 있는 단비와 같은 기회를 얻게 될 것입니다.""손명세 국제보건기술연구기금(라이트재단·RIGHTFoundation) 이사장은 2일 중앙일보 인터뷰에서 이렇게 강조했다. 국제보건기술연구기금은 2018년 보건복지부와 빌&멜린다 게이츠 재단, 9개 국내 제약 바이오기업이 공동 출연해 설립한 최초의 민관협력 비영리재단이다. 중·저소득국가의 감염병 분야 보건 형평성 증진을 위한 백신과 치료제, 진단기기 제품 연구 개발을 지원한다. 공동 출연한 국내 기업은SK바이오사이언스,LG화학,GC녹십자, 종근당, 제넥신,KT,에스디바이오센서, 유바이오로직스, 바이오니아이다.빌&멜린다 게이츠 재단과 한국 정부가 손 잡고 라이트재단을 만들면서 국제적인 주목을 받았다. 제네바에 본부를 둔 국제기구인 ‘혁신적 진단기기 재단(FoundationforInnovativeNewDiagnostics·FIND)’이 먼저 라이트재단에 감염병 분야의 진단기기 공동기금 출연을 제안해 왔으며 순조롭게 진행하고 있다. 손 이사장은 ""국제사회에서 한국과 공중보건 분야에 협력하자는 요청이 이어지고 있다""고 말했다. 손 이사장은 라이트재단 설립 5주년을 맞아 한국의 위상을 강화할 방안을 제시했다.Q : 그동안 어떤 성과를 냈나.A :우리 재단이 지원한 7개의 백신 및 진단기기 관련 제품들이 2023~2028년 세계보건기구(WHO)의 사전인증(WHOPQ)을 받게 될 것으로 예상한다. 인증받은 제품은 국제보건분야 최대 구호기금인 글로벌펀드(GlobalFund)와 세계백신면역연합(GAVI), 기타UN조달 체계 등 글로벌 보건 공공 조달 시장에 진입해 세계 중·저소득국가에 공급될 예정이다.Q : 감염병 예방은 얼마나 진행했나.A :호흡기계 감염병, 결핵과 말라리아 및 소외 열대 질환 등 15개 감염병 분야 45개 과제를 지원하고 있다. 한국의 감염병 예방, 진단, 치료 기술을 중·저소득 국가에 맞는 실질적이고 효과적인 지원을 하고 있다. 이런 발전에 힘입어 우리 재단 2기 사업에 정부와 빌&멜린다 게이츠 재단이 지원금을 2배로 증액했다.Q : 우리 기업이 얼마나 성장했나.A :우리나라 진단 기기 산업은 최근 5년 연평균 8.3% 성장했다. 체외 진단이 52.1%를 차지한다. 식약처에 따르면 2021년 의료기기 무역수지 흑자가 전년 대비 44% 증가해 3조 7489억 원을 기록했다. 코로나19 진단 검사 관련 품목의 성장 덕분이다. 우리 기업이 세계 시장을 이끌면서 글로벌 공중보건 향상의 주역이 될 기회가 찾아왔다.손 이사장은 ""글로벌 공중보건 수준을 높이는 데 한국 기업의 역할을 확대하려면 공적개발원조(ODA)에 투입되는 기금을 확대하는 것이 무엇보다 중요하다""고 강조한다. 손 이사장은 일본 국제보건혁신기술기금(GHITFund,GlobalHealthInnovationandTechnologyFund)의 발전 속도에 한국 라이트재단이 뒤처지고 있다고 지적한다. 일본GHIT는 정부(후생성과 외무성), 일본 제약 바이오 업계, 빌&멜린다 게이츠 재단이 10년 전 조성한 기금이다.GHIT에는 20여개 일본 제약·바이오 기업이 참여한다. 출연 기금도 라이트재단의 5배가 넘는 4억 달러(5300억 원, 2023~2027년 기준)에 육박한다. 다케다, 시오노기, 후지필름,YahooJapan,Zoom등이 참여한다. 최근 영국의 대표적인 글로벌 기여 공공기금인 웰컴트러스트가 2000만 달러를 추가로 출연했다.Q : 라이트재단은 뭘 도울 수 있나.A :한국 보건 기업, 제약업계의 기술력을 빌&멜린다 게이츠 재단과 국제기구에 제공하고, 국제 조달 시장에 우리 기업이 쉽게 진입할 수 있도록 지원한다. 기업이 글로벌 무대로 나아가서 시장을 확대하도록 돕는다.손 이사장은 ""국내 다른 국제보건 관련 기관과 협업을 추진할 예정""이라며 ""여러 기관의 노하우·네크워크와 우리 재단의 국제적 네트워크가 결합하면 한국 보건산업 역량을 폭발적으로 성장시킬 수 있다'고 말했다.연세대 의대 명예교수인 손 이사장은 국제보건 전문가이다.WHO국제보건규칙 (IHR) 개정위원회 위원, '더 나은 미래를 위한 반기문 재단' 운영위원을 맡고 있다.WHO집행이사회 부의장, 유엔에이즈계획 (UNAIDS) 특별보좌관, 유네스코 국제생명윤리위원회 (IBC) 위원, 아시아태평양공중보건학회 (APACPH) 회장, 건강보험심사평가원 원장 등을 지냈다."
2023-03-15,[리셋 코리아 포커스] 미·중 기술패권 돌파할 비책은 혁신 스타트업 창업,"이종호(오른쪽 셋째) 과 기 정 통 부 장관이 지난 7일 서울 상암동 중앙일보에서 열린 리셋코리아 포커스 좌담회에서 분과위원들과 토론하고 있다. 김종호 기자미·중 기술패권 경쟁의 본격화로 글로벌 공급망 재편이 가속화하면서 한국 경제에 위기감이 짙어졌다. 설상가상 미국에서 시작한 기준금리의 급격한 인상이 한국을 비롯한 전 세계로 이어지면서 시장이 얼어붙고 있다. 한국 경제의 버팀목인 반도체 수출이 급감하면서 무역수지 적자와 성장률 하락 등 곳곳에서 적신호가 켜지고 있다. 대한민국 경제는 어디로 가는 걸까. 각 부처 장·차관과 중앙일보 국가개혁 프로젝트 리셋코리아의 위원들이 정책 현안을 논의하는 리셋코리아 포커스가 지난 7일 이종호 과학기술정보통신부 장관을 초청해 글로벌 공급망 재편 시대 한국 경제의 갈 길을 물었다.이 장관은 “연구·개발(R&D)에 기반한 딥테크(deep-tech) 혁신 스타트업 창업이야말로 지금 같은 위기 시대에 한 국가의 다음 먹거리를 만들어 내는 중요한 해법”이라며 “딥테크 스타트업이 세계적 경쟁력을 가진 강소기업으로 성장할 수도 있고, 대기업의 체질을 바꿔놓을 수도 있다”고 강조했다. 이 장관은 교수 시절 개발한 3차원 반도체 설계 기술인 핀펫 특허로 유명하다. 인텔이 이 장관의 핀펫 특허기술을 썼고, 삼성전자는 이 장관과의 특허 소송에서 패소하면서 거액의 합의금을 물어야 했다.이번 리셋코리아 포커스 혁신창업분과 좌담회에는 분과장을 맡은 김경환 성균관대 글로벌창업대학원장을 비롯해 분과위원인 김선우 과학기술정책연구원 박사, 남민우 다산네트워크 회장, 문미성 경기도 경제과학원 본부장, 박한오 바이오니아 대표, 배중면KAIST기계공학과 교수가 참여했다.연구를 미래 먹거리로 이어야딥테크 창업이 성공확률 높아창업은 지방 소멸 막는 방법기술탈취 배상 3배서 더 높여야5년간 딥테크 분야에 15조원 투자 계획▶김경환=과기정통부가 추진하고 있는 올해 R&D 투자의 방향에 대해 말해 달라.▶이종호=지난 1월 ‘스케일업 투자전략’을 발표했다. R&D의 성과를 높이고 경제가 성장하려면 딥테크 기반의 창업과 스케일업(scale-up)이 중요하다. 대학이나 정부 출연 연구소에서 시작한 실험실 수준의 기술이 제대로 꽃을 피우려면 시작품에서부터 시제품·조달까지 체계적 지원이 필요하다. 딥테크 유니콘 기업 창출을 위해 범부처 차원에서 5년간 국가전략기술 등 딥테크 분야에 15조원을 투자할 계획이다.▶배중면=왜 대학·출연연 창업인가. 창업보다 연구에 집중해야 하는 것 아니냐는 목소리도 크다.▶이종호=거부감을 이해한다. 좋은 논문을 쓰는 것도 바람직한 일이다. 국가의 위상과 과학기술 능력을 나타내는 지표다. 하지만 우리나라는 지금껏 이쪽으로 너무 치우쳐 있었다는 느낌이 든다. 이제는 연구한 결과를 가지고 미래 먹거리를 만들 수 있는 쪽으로 가야 한다. R&D에 기반한 딥테크로 창업을 할 경우 경쟁자가 없고, 성공할 확률이 일반 창업보다 훨씬 더 높다.▶남민우=연구자들은 대개 창업을 두려워한다. 연구 성과가 창업으로 이어지도록 독려하고, 규제도 풀어줘야 하는데.▶이종호=교수나 연구자가 연구성과를 사업화하는 것을 도와주는 문화나 제도가 아직 미흡한 측면이 있다. 평가 시스템도 창업보다 논문·특허 등 실적 위주인 데다, 대학 출연연 내에 기술이전과 창업을 전문적으로 지원하는 조직도 부족한 게 현실이다. 교수·학생·연구자들이 창업했다가 실패하더라도 불이익 없이 다시 학교·연구소로 복귀할 수 있도록 하는 등 창업 관련 제도를 유연하게 정비할 필요가 있다. 과기정통부는 ‘연구성과확산촉진법’ 제정을 통해 연구자가 연구성과를 가지고 쉽게 창업할 수 있는 법적 근거를 마련하려고 한다.‘한국형 아이코어 사업’ 성과 주목▶문미성=기술 이전과 사업화 측면에서 연구개발 투자의 성과가 낮다는 비판이 여전히 많다. 과기정통부가 대안으로 내놓은 ‘임무달성 중심의 연구개발성과평가’는 무엇인가.▶이종호=임무 중심 R&D는 탄소 중립 등 국가가 당면한 문제를 해결하기 위해 기술개발 중심의 R&D를 넘어서 명확한 기한이 있는 임무 목표를 설정하고 문제를 해결해 나가는 시스템이다. 평가체계 역시 논문·특허 등 산출 지표를 활용해 기술 성과와 효율성 중심으로 등급을 매기던 기존 평가에서 벗어나 연구개발의 목표가 되는 임무의 진행 상황과 달성 가능성을 진단하는 방식이다.▶박한오=혁신 창업이 전국적으로 활성화하기 위해서는 지방의 혁신 창업 붐도 중요하다. 수도권 이남은 인재 구하기도 어렵고, 액셀러레이터와 같은 관련 생태계도 너무 부족하다.▶이종호=안타까운 현실이다. 지방 소멸이라는 위기를 극복하고, 지역의 활력을 되찾기 위해서라도 범부처 차원의 정책 역량을 결집하는 게 필요하다. 전국 19개 연구개발 특구를 통해 지역의 대학·연구소 중심의 창업 촉진과 기업성장을 지원하려고 하고 있다. 지역 스스로도 특화된 과학기술 중장기 계획을 수립할 필요가 있다.▶김선우=과기정통부는 대학·대학원생들이 공공연구 성과를 활용해 창업해보는 ‘한국형 아이코어 사업’도 진행 중인데.▶이종호=2015년부터 최근까지 총 580개 창업 탐색팀이 참여해 이 중 219개 창업 기업이 설립됐다. 누적 고용창출 1481명, 투자유치 3198억원의 성과를 냈다.▶최준호=최근 대기업의 스타트업 기술 탈취 문제가 이슈가 되고 있는데.▶이종호=현재는 대기업이 중소기업 기술 탈취를 하게 되면 3배를 물어내야 하는 것으로 알고 있다. 하지만 중소기업·스타트업 입장에서 3배 수준의 징벌적 배상은 약하다고 생각한다. 또 다른 측면으론 스타트업들도 이젠 민간 기술 이전 전담조직의 도움을 받는 등 기술에 대한 특허를 잘 이용해 애매하게 당하지 않도록 노력해야 한다. 물론 스타트업이 특허를 잘 지킬 수 있도록 도와주는 시스템도 필요하다.·딥테크(deeptech): 기존에 없던 과학적 발견으로 만들어진 모방이 쉽지 않고, 파급력이 큰 기술.·스케일업(scale-up): 스타트업이 기술이나 제품·서비스·생산 등의 규모를 확대하는 것을 의미.·유니콘(unicorn): 기업 가치가 1조원 이상이고 창업한 지 10년 이하인 비상장 스타트업."
2023-02-02,"영림원소프트랩, 경동제약과 통합업무 IT시스템 구축계약 체결","경동제약은 1975년에 설립한 의약품 전문 기업으로, 90여 종에 이르는 전문의약품을 비롯해 우수한 품질의 원료의약품 및 일반의약품을 생산해 국민 건강에 기여하고 있다.경동제약은 영림원소프트랩의 ‘K-시스템 에이스’ 도입을 통해 영업, 물류, 구매, 생산 및 인사, 회계, 원가 등 기업 전반의 프로세스를 재정의하고CRM,LIMS등을 연계해 통합업무 환경을 구축함으로써 사업환경 변화에 대응할 수 있는IT시스템을 확보할 예정이다.김응주 영림원소프트랩 상무는 “경동제약은 이번ERP구축 프로젝트를 통해 기업경영을 혁신하고자 하는 의지가 매우 강했다”며, “K-시스템 에이스의 제약산업에 표준화된 프로세스를 적용하고 수년간 축적된 데이터를 효과적으로 활용할 수 있는 기반을 마련함으로써 경동제약이 경영목표를 달성할 수 있도록 적극 지원하겠다”고 전했다.경동제약 관계자는 “회사의 특성상ERP시스템에 요구되는 사항들이 많은 편”이라며, “다수의 제약산업군 레퍼런스와 컨설턴트의 업무 경험 및 전문성에 신뢰를 느껴 영림원소프트랩을 선택하게 됐다”고 말했다.영림원소프트랩은 삼진제약, 한화제약, 보령바이오파마, 바이오니아 등 국내 유수의 제약·바이오 기업에 맞춤형ERP를 구축하고 안정적인 서비스를 제공하고 있다.권영범 영림원소프트랩 대표는 “약 50년 가까이 국민보건 향상에 기여해온 경동제약의ERP구축 프로젝트를 진행돼 매우 고무적”이라며, “그간 꾸준히 관계를 형성해 온 만큼, 지속적인 모니터링과 분석을 통한 제약·바이오 산업 맞춤형 서비스 제공에 힘쓰겠다”고 전했다."
2023-01-19,[사랑방] 박제근 교수 등 4명 ‘포스코청암상’,"박제근포스코청암재단은 18일 올해 포스코청암상 수상자를 발표했다. 과학상에 박제근(사진) 서울대 물리·천문학부 교수, 교육상에 최재천 이화여대 석좌교수, 봉사상에 서정화 열린여성센터 원장, 기술상에 박한오 바이오니아 대표가 각각 선정됐다. 시상식은 오는 4월 열린다."
2023-01-18,‘포스코청암상’ 박제근·최재천·서정화·박한오 수상자,"오는 4월 포스코센터 시상식왼쪽부터 박제근 교수·최재천 석좌교수·서정화 원장·박한오 대표이사. 포스코청암재단 제공포스코청암재단은 18일 올해 ‘포스코청암상’ 수상자로 ‘과학상’ 박제근 서울대 물리·천문학부 교수, ‘교육상’ 최재천 이화여대 석좌교수, ‘봉사상’ 서정화 열린여성센터 원장, ‘기술상’ 박한오 바이오니아 대표이사를 각각 선정했다.박 교수는 ‘2차원 자성체’ 분야의 기존 이론을 입증할 수 있는 새로운 자성 반데르발스 물질을 세계 최초로 발견했다. 최 교수는 생태학자이자 진화생물학자로 기후변화 위기를 알리는 미래지향적인 환경생태과학의 대중화와 시민교육에 앞장서 왔다. 서 원장은 가장 소외된 복지 사각지대인 ‘여성 노숙인’을 위해 24년간 헌신했다. 박 대표는 1992년 바이오 벤처기업 바이오니아를 창업한 이래 30여년간 유전자 합성∙증폭∙추출 시약과 관련 장비 개발에 성공했다.수상자에게는 부문별로 상금 2억원씩을 준다. 시상식은 오는 4월 서울 포스코센터에서 열린다."
2023-04-05,4월6일 알림,"◇ 한국전기안전공사는 지난 3일 신재생에너지 안전 강화를 위해 노르웨이 에너지기술연구원과 ‘신재생에너지 국제 공동연구 협력체제 구축을 위한 업무협약’을 체결했다. 두 기관은 이번 협약을 통해 국제공동연구개발 협력체계 구축, 신재생에너지 분야 연구 및 기술 협력 등을 해나간다.◇ 한국사회복지협의회(회장 김성이) 전국푸드뱅크와 엘지(LG)생활건강(대표이사 이정애), 대상(대표이사 임정배)은 4일 한국사회복지회관에서 저소득 아동에게 식품, 생활필수품, 문구류 등을 지원하기 위한 꿈드림팩 사업 착수식을 했다. 올해 2회차를 맞은 지역아동센터 저소득가정 아동 지원 ‘꿈드림팩’ 사업은 작년 1000여 명의 아동에게 5회, 5000세트를 지원했으며 올해는 2000여 명의 아동에게 7회, 1만4000세트를 지원했다.◇ 한신대(총장 강성영)는 5일 교육부와 전국 17개 시도교육청, 한국과학창의재단이 주최하는 2023년도 상반기 디지털새싹 캠프 주관기관에 선정됐다. 이번 선정으로 한신대는 약 11억2천만원 사업비를 지원받게 됐으며, 초중고 학생이 디지털 자산(digitalasset)과AI아트엔진 교육을 통해AI기반 콘텐츠 활용능력과 디지털 경제에 대한 소양을 갖출 수 있도록 ‘디지털 경제와 아트코딩 캠프’를 올해 4월∼6월 운영한다.◇ 국립 5·18 민주묘지 관리소는 5일 이달의 5·18민주유공자로 고 정윤식씨를 선정했다. 5·18 민주화운동 당시 시민군으로 활동한 고인은 항쟁 마지막 날인 27일 옛 전남도청을 사수하다 진압군에 체포됐다.◇ 행정중심복합도시건설청은 5일 국립박물관단지 통합운영지원센터 제1대 이사장에 정갑영(68) 전 한국문화관광연구원장을 임명했다.◇ 제주사회복지공동모금회는 5일 서귀포 출신 재일동포 오익종(85) 동신포리마 회장으로부터 이웃돕기 성금 1억원을 기부받았다. 오 회장은 중학생 시절까지 고향인 서귀포에서 지내다가 고등학생 때부터 일본에서 생활하고 있는 재일제주인으로, 충남 홍성군에 있는 제조회사 동신포리마 등을 운영하고 있다.◇ 국립중앙과학관은 가족과 함께하는 과학소풍 ‘과학으로 설레나, 봄'을 오는 8~9일 연다. 전시관과 야외전시장에 다양한 프로그램이 마련된다. 누리집(science.go.kr)참고.◇ 포스코청암재단은 5일 서울 포스코센터에서 제 17회 ‘2023 포스코청암상' 시상식을 개최했다. 재단은 박제근 서울대 물리천문학부 교수에게 과학상을, 최재천 이화여대 석좌교수에게 교육상을, 서정화 열린여성센터 원장에게 봉사상을, 박한오 바이오니아 대표이사에게 기술상을 수상하고 각각 상금 2억원을 수여했다.◇ 세계한인회총연합회(회장 심상만)는 지난 4일 서울아산병원 건강검진센터(소장 최재원)와 건강검진 의료서비스 제공을 위한 업무협약을 맺었다. 재외동포 건강 증진을 위한 협약으로 각국 한인회 임원 등은 검진 우선 서비스와 할인 혜택을 제공받게 된다.◇ 질병관리청과 소방청은 6일 오후 전남 여수 라마다호텔에서 ‘제6차 급성심장정지 구급품질 향상 워크숍'을 개최한다. 급성심장정지 환자의 생존율을 높이기 위한 구급품질 개선 전략을 논의한다.◇ 과학기술정보통신부와 한국연구재단은 5일 ‘4월 과학기술인상' 수상자로 한국과학기술원(KAIST) 수리과학과 강문진 교수를 선정했다. 압축성 오일러 방정식의 충격파에 관한 문제를 1차원 공간에서 최초로 해결해 현대수학의 오랜 난제 해결에 필요한 핵심적 이론을 제시한 공로를 인정받았다.◇ 서울시는 5일 자아 탐색과 진로 모색을 지원하는 ‘청년인생설계학교' 올해 첫 참여자 200명을 모집한다. 올해 1기 프로그램은 새달 1일부터 5주간 서울시 소재 7개 청년공간에서 운영된다. 참가 신청은 서울청년포털 ‘청년몽땅정보통'(youth.seoul.go.kr)에서 오는 6일 오전 10시부터 18일 오후 5시까지 할 수 있다.◇ 에스케이(SK)이노베이션은 5일 ‘전국 발달장애인 음악축제(GMF)' 예선 참가자를 모집한다. 하트-하트재단이 주최하고SK이노베이션 등이 후원하는GMF는 발달장애인의 음악적 재능을 발굴하기 위한 전국 최대 발달장애인 음악 축제다. 예선 접수는 새달 31일까지다. 하트-하트재단 공식 홈페이지에서 참가신청서를 내려받아 작성한 뒤 연주 동영상 등과 함께 이메일로 제출하면 된다. 본선 공연은 오는 9월 26일 건국대 새천년관 대공연장에서 열린다."
