date,title,content
2023-11-02,파타고니아 역사상 가장 따뜻한 옷은 해양 플라스틱으로 만들었다[박건형의 홀리테크],"저렴하고 편리한 플라스틱의 역습… 줄이지 않으면 잡혀먹힌다파타고니아는 환경 보호를 위해 ""이 재킷을 사지 마세요""라는 역설적인 마케팅 전략을 사용했다.홀리테크 뉴스레터 구독하기 ☞https://page.stibee.com/subscriptions/80905플라스틱의 악영향을 지적하는 목소리가 높습니다. 썩지 않는 플라스틱이 환경오염의 주범이라고 하더니 미세 플라스틱이 야생 동물을 죽음으로 몰아가고 사람의 건강에도 치명적이라는 연구가 잇따라 나오고 있습니다. 유엔환경계획(UNEP)에 따르면 매년 4억3000만톤의 플라스틱이 생산됩니다. 지구 상에 있는 모든 인류의 무게를 합친 것보다 훨씬 더 많은 양입니다. 특히 이 가운데 3분의 1은 버려지기 전까지 사용되는 시간이 몇 초 또는 몇 분 정도에 그칩니다. ‘일회용’이라는 것이죠.일회용 플라스틱 문제는 알면 알수록 당황스럽습니다. 컨설팅업체 맥킨지에 따르면 모든 플라스틱의 4분의 1 이상은 포장에 사용되는데, 이 플라스틱은 95%가 한 번 사용하면 폐기됩니다. 포장용 플라스틱 생산과 폐기에 들어가는 비용은 매년 1200억 달러(약 162조2800억원)에 이릅니다. 낭비도 이런 낭비가 없습니다.친환경을 표방하는 아웃도어 브랜드 파타고니아는 중남미와 아시아 해안에 밀려오는 플라스틱 쓰레기를 수집해 고성능 실로 재활용하는 '바이오닉' 사의 섬유로 재킷을 만든다. /조선일보DB·파타고니아  그래픽=김의균플라스틱 없이 살 수 없는 세상플라스틱이 불러오는 수많은 폐해를 해결할 수 있는 가장 간단한 방법은 플라스틱을 사용하지 않는 겁니다. 하지만 불가능한 일이죠. 실제로 갈수록 더 많은 플라스틱이 생산되고 있습니다. 현존하는 모든 플라스틱의 절반이 지난 20년 동안 만들어졌습니다. 미국 매사추세츠공과대(MIT)에서 발간하는 테크놀로지 리뷰는 “플라스틱 생산량은 매년 약 5% 증가해, 2050년이면 현재 총량의 3배인 340억톤의 플라스틱이 생산될 것”이라고 했습니다. 경제협력개발기구(OECD)의 지난해 보고서는 플라스틱의 72%가 매립되거나 환경에 버려진다고 지적합니다. 지금까지 생산된 플라스틱의 19%가 소각됐고 단 9% 만이 재활용됐습니다. 이 통계가 시사하는 바가 있습니다. 플라스틱 생산량을 줄이는 것이 현실적으로 힘들다면, 재활용 비율을 높여 순환하도록 해야 한다는 겁니다. 버려지거나 매립되는 플라스틱을 다시 생산에 최대한 활용할 수 있다면 생산량이 늘어나더라도 총량은 늘어나지 않는 효과를 거둘 수 있다는 겁니다.이미 이런 구상을 실천에 옮기는 기업들이 있습니다. 2000년대 초반부터 에버레인, 로시스 등 여러 의류와 신발 업체들이 재활용 플라스틱 소재를 사용하기 시작했습니다. 유칼립투스와 메리노울 처럼 플라스틱을 대체할 소재를 찾아 한때 선풍적인 인기를 끌었던 올버즈도 있습니다.지구 환경을 위해 ‘물질주의’에 대해 고민을 하고 있는 배우 리어나도 디캐프리오. 환경운동가이기도 한 그는 올버즈의 가치와 철학에 공감하며 직접 투자자로 나서 ‘미래를 위한 패션브랜드’로서의 올버즈의 가능성을 높이 평가하며 가치관을 소비자들에게 공유하고 있다. /올버즈 제공'우리 유일한 주주는 지구’이 분야에서 독보적인 위치를 자랑하는 기업이 바로 아웃도어 브랜드 파타고니아입니다. 보슬보슬한 ‘플리스’로 유명한 파타고니아는 지속가능성과 친환경 두 가지 철학을 꾸준히 지켜 왔습니다. “목적은 지구, 사업은 수단”이라는 모토를 내세우죠. 2011년 파타고니아는 미국 최대 쇼핑 이벤트 ‘블랙 프라이데이’에 “우리 옷을 사지 마라”는 광고를 내걸었습니다. ‘소비자에게 구매를 재고할 것을 장려하지 않으면서 환경 변화를 위해 일한다고 말하는 것은 위선’이라는 이유였습니다. 무분별한 소비보다는 보다 적고, 신중한 소비가 필요하다는 겁니다. 파타고니아 창립자 이본 쉬나드는 2022년 “파타고니아는 공개 기업이 아닌 목적 기업”이라며 파타고니아의 유일한 주주가 지구라고 선언했습니다. 회사의 의결권 주식 전부를 비영리 신탁회사에 기부했습니다. 당시 가치 4조2000억원에 이르는 주식이었습니다. 이후 파타고니아는 회사 사업을 위해 필수적인 재투자 비용을 제외하면 모든 이익을 환경 위기 해결에 사용하도록 하고 있습니다.그래픽=김의균거창한 목표와 과거의 경영활동을 나열하는 것보다 파타고니아가 이번 가을에 내놓은 신상품으로 파타고니아의 노력을 설명하는 쪽이 더 명확할 것 같습니다. 899달러의 ‘스톰섀도우 파카’라는 이 제품은 파타고니아 역사상 가장 따뜻한 재킷으로 원료는 해양 플라스틱입니다.바이오닉·고어텍스와 협업해 신소재 개발해양 플라스틱으로 만든 파타고니아의 신제품/파타고니아파타고니아는 바이오닉이라는 재활용 플라스틱 업체와 협업했습니다. 바이오닉은 중남미와 아시아 해안에서 밀려오는 플라스틱을 수집해 코스타리카 코바노에 있는 시설로 옮깁니다. 그다음 이 재료를 고성능 실로 변환합니다. 파타고니아와 바이오닉이 해양 플라스틱에 집중한 이유는 지상에서 정상적인 경로로 수집된 플라스틱, 예를 들어 페트병 같은 경우에는 이미 음료 회사 등에서 손쉽게 재활용할 수 있기 때문입니다. 반면 해양 플라스틱의 경우 먼지, 비, 소금 등에 오염돼 정제가 힘들고 손상된 경우도 많습니다. 그만큼 가공도, 우수한 소재로 재활용하기도 어렵다는 것이죠.바다에서 수거한 미세 플라스틱/ 오리건주립대작업을 총괄한 파타고니아 글로벌 제품 디렉터 마크 리틀은 “우리는 파괴적인 변화를 일으키고 싶었다”면서 “바이오니아, 첨단 섬유 회사 고어텍스와 함께 방풍·방수 기능이 있는 재킷용 외부 소재를 만들었다”고 했습니다. 이 과정에서 세 회사는 기존 재활용 플라스틱 섬유와는 다른 선택을 합니다. ‘영원히 분해되지 않는 화학물질’을 제거하기로 한 거죠. 고어텍스와 같은 회사들은 지금까지 강력한 방수 기능을 구현하기 위해 이런 화학물질을 필수적으로 사용해왔습니다. 하지만 파타고니아는 고어텍스를 설득해 공정에서 해당 물질을 제거하고도 같은 성능을 내는 ‘확장 폴리에틸렌(ePE)’이라는 새로운 구조를 만들어 냈습니다.글로벌 100대 브랜드 평판 1위기술전문 매체 패스트컴퍼니는 “파타고니아의 재킷은 지속 가능한 소재의 혁신이 얼마나 진행됐는지를 보여준다”면서 “재활용 섬유는 순수 섬유보다 효과적이지 않았던 시절이 있었지만, 이제 해양 플라스틱 폐기물로도 충분한 진보를 이뤄냈다”고 했습니다. 파타고니아는 이 재킷의 내구연한이 최소 10년이라고 자신합니다. 단순히 상징적인 의미에서의 친환경이 아니라 옷이라는 가장 기본적인 정체성부터 스타일, 내구성까지 모두 해결했다는 것이죠. 남들이 하지 않는 수고를 아끼지 않는 파타고니아의 사업은 순조로울까요. 파타고니아의 지난해 매출은 15억 달러, 이익은 2억910만 달러에 이릅니다. 나이키 같은 초대형 패션 기업에 비할 바는 아니지만, 수익에 목을 매지 않는 기업으로는 주목할 만한 실적입니다. 파타고니아는 올해 미국 여론조사업체 해리스폴이 미국 소비자들을 대상으로 한 글로벌 100대 브랜드 평판에서 1위를 차지했습니다. 철학에 공감하는 소비자만큼 고마운 동반자가 또 있을까요.홀리테크 뉴스레터 구독하기 ☞https://page.stibee.com/subscriptions/80905"
2023-11-02,최고 따뜻한 신상 파카… 그게 재활용 가장 힘든 해양 플라스틱이라네요,"[WEEKLYBIZ][박건형의 홀리테크] ‘파타고니아’의 친환경 고집WEEKLYBIZ뉴스레터 구독하기 ☞https://page.stibee.com/subscriptions/146096플라스틱의 악영향을 지적하는 목소리가 높습니다. 썩지 않는 플라스틱이 환경오염의 주범이라고 하더니 미세 플라스틱이 야생동물을 죽음으로 몰아가고 사람의 건강에도 치명적이라는 연구가 잇따라 나오고 있습니다. 유엔환경계획(UNEP)에 따르면 매년 4억3000만톤의 플라스틱이 생산됩니다. 지구상에 있는 모든 인류의 무게를 합친 것보다 훨씬 많은 양입니다. 특히 이 가운데 3분의 1은 버려지기 전까지 사용되는 시간이 몇 초 또는 몇 분 정도에 그칩니다. ‘일회용’이라는 것이죠. 맥킨지에 따르면 모든 플라스틱의 4분의 1 이상은 포장에 사용되는데, 이 플라스틱은 95%가 한 번 사용하면 폐기됩니다. 포장용 플라스틱 생산과 폐기에 들어가는 비용은 매년 1200억달러(약 162조2800억원)에 이릅니다. 낭비도 이런 낭비가 없습니다.친환경을 표방하는 아웃도어 브랜드 파타고니아는 중남미와 아시아 해안에 밀려오는 플라스틱 쓰레기를 수집해 고성능 실로 재활용하는 ‘바이오닉’사의 섬유로 재킷을 만든다./조선일보DB·파타고니아플라스틱 없이 살 수 없는 세상가장 간단한 해결책은 플라스틱을 사용하지 않는 겁니다. 하지만 불가능한 일이죠. 실제로 갈수록 더 많은 플라스틱이 생산되고 있습니다. 현존하는 모든 플라스틱의 절반이 지난 20년 동안 만들어졌습니다.MIT테크놀로지리뷰는 “플라스틱 생산량은 매년 약 5% 증가해, 2050년이면 현재 총량의 3배인 340억톤이 생산될 것”이라고 했습니다. 경제협력개발기구의 지난해 보고서는 플라스틱의 72%가 매립되거나 환경에 버려진다고 지적합니다. 지금까지 생산된 플라스틱의 19%가 소각됐고 단 9%만이 재활용됐습니다. 이 통계가 시사하는 바가 있습니다. 플라스틱 생산량을 줄이는 것이 현실적으로 힘들다면, 재활용 비율을 높여 순환하도록 해야 한다는 겁니다. 버려지거나 매립되는 플라스틱을 다시 활용할 수 있다면 생산량이 늘어나도 총량은 늘어나지 않는 효과를 거둘 수 있습니다.이런 구상을 실천에 옮기는 기업들이 있습니다. 2000년대 초반부터 에버레인, 로시스 등 여러 의류와 신발 업체가 재활용 플라스틱 소재를 사용하기 시작했습니다. 유칼립투스와 메리노 울처럼 플라스틱 대체 소재를 찾아 한때 선풍적인 인기를 끌었던 올버즈도 있습니다.'우리 유일한 주주는 지구’이 분야에서 독보적인 기업이 바로 아웃도어 브랜드 파타고니아입니다. 보슬보슬한 ‘플리스’로 유명한 파타고니아는 지속 가능성과 친환경 두 가지 철학을 지켜 왔습니다. ‘목적은 지구, 사업은 수단’이라는 모토를 내세우죠. 2011년 파타고니아는 미국 최대 쇼핑 이벤트 ‘블랙 프라이데이’에 “우리 옷을 사지 마라”는 광고를 내걸었습니다. ‘소비자에게 구매를 재고할 것을 장려하지 않으면서 환경 변화를 위해 일한다고 말하는 것은 위선’이라는 이유였습니다. 파타고니아 창립자 이본 쉬나드는 2022년 “파타고니아는 공개 기업이 아닌 목적 기업”이라며 파타고니아의 유일한 주주가 지구라고 선언했습니다. 회사의 의결권 주식 전부를 비영리 신탁 회사에 기부했습니다. 당시 가치 4조2000억원에 이르는 주식이었습니다. 이후 파타고니아는 회사 사업을 위해 필수적인 재투자 비용을 제외하면 모든 이익을 환경 위기 해결에 사용하도록 하고 있습니다.거창한 목표와 과거의 경영 활동을 나열하는 것보다 파타고니아가 이번 가을에 내놓은 신상품으로 파타고니아의 노력을 설명하는 쪽이 더 명확할 것 같습니다. 899달러의 ‘스톰섀도 파카’라는 이 제품은 파타고니아 역사상 가장 따뜻한 재킷으로 원료는 해양 플라스틱입니다.파타고니아는 환경 보호를 강조하기 위해 “우리 옷을 사지 말라”는 도발적인 광고 문구를 썼다.바이오닉·고어텍스와 협업해 신소재 개발파타고니아는 바이오닉이라는 재활용 플라스틱 업체와 협업했습니다. 바이오닉은 중남미와 아시아 해안에서 밀려오는 플라스틱을 수집해 코스타리카 코바노에 있는 시설로 옮깁니다. 그다음 이 재료를 고성능 실로 변환합니다. 파타고니아와 바이오닉이 해양 플라스틱에 집중한 것은 지상에서 정상적인 경로로 수집된 플라스틱, 예를 들어 페트병 같은 경우에는 이미 음료 회사 등에서 손쉽게 재활용할 수 있기 때문입니다. 반면 해양 플라스틱의 경우 먼지, 비, 소금 등에 오염돼 정제가 힘들고 손상된 경우도 많습니다. 그만큼 가공도, 우수한 소재로 재활용하기도 어렵다는 것이죠.작업을 총괄한 파타고니아 글로벌 제품 디렉터 마크 리틀은 “우리는 파괴적인 변화를 일으키고 싶었다”면서 “바이오니아, 첨단 섬유 회사 고어텍스와 함께 방풍·방수 기능이 있는 재킷용 외부 소재를 만들었다”고 했습니다. 이 과정에서 세 회사는 기존 재활용 플라스틱 섬유와는 다른 선택을 합니다. ‘영원히 분해되지 않는 화학물질’을 제거하기로 한 거죠. 고어텍스 같은 회사들은 지금까지 강력한 방수 기능을 구현하고자 이런 화학물질을 필수적으로 사용해 왔습니다. 하지만 파타고니아는 고어텍스를 설득해 공정에서 해당 물질을 제거하고도 같은 성능을 내는 ‘확장 폴리에틸렌(ePE)’이라는 새로운 구조를 만들어 냈습니다.그래픽=김의균글로벌 100대 브랜드 평판 1위기술 전문 매체 패스트컴퍼니는 “파타고니아의 재킷은 지속 가능한 소재의 혁신이 얼마나 진행됐는지를 보여준다”면서 “재활용 섬유는 순수 섬유보다 효과적이지 않았던 시절이 있었지만, 이제 해양 플라스틱 폐기물로도 충분한 진보를 이뤄냈다”고 했습니다. 파타고니아는 이 재킷의 내구연한이 최소 10년이라고 자신합니다. 단순히 상징적인 의미에서의 친환경이 아니라 옷이라는 가장 기본적인 정체성부터 스타일, 내구성까지 모두 해결했다는 것이죠. 남들이 하지 않는 수고를 아끼지 않는 파타고니아의 사업 성적표는 어떨까요. 파타고니아의 지난해 매출은 15억달러, 이익은 2억910만달러에 이릅니다. 나이키 같은 초대형 패션 기업에 비할 바는 아니지만, 수익에 목매지 않는 기업으로는 주목할 만한 실적입니다. 파타고니아는 올해 미국 여론조사 업체 해리스폴이 미국 소비자들을 대상으로 한 글로벌 100대 브랜드 평판에서 1위를 차지했습니다. 철학에 공감하는 소비자라는 고마운 동반자가 함께하고 있다는 겁니다.WEEKLYBIZ뉴스레터 구독하기 ☞https://page.stibee.com/subscriptions/146096"
2023-04-05,포스코청암상 시상식...과학상 박제근 서울대 교수 등 4명 수상,"포스코청암재단은 5일 서울 대치동 포스코센터에서 제17회 ‘2023 포스코청암상’ 시상식을 개최했다.박제근 서울대 물리천문학부 교수(과학상)와 최재천 이화여대 석좌교수(교육상), 서정화 열린여성센터 원장(봉사상), 박한오 바이오니아 대표(기술상)가 상을 받았다. 수상자에게는 각각 상패와 상금 2억원을 준다.포스코청암재단이 5일 포스코센터에서 제17회 ‘2023 포스코청암상’ 시상식을 열었다. 왼쪽부터 박제근 서울대 물리천문학부 교수, 최재천 이화여대 석좌교수, 서정화 열린여성센터 원장, 박한오 ㈜바이오니아 대표이사, 김선욱 포스코청암재단 이사장. [사진 포스코]김선욱 포스코청암재단 이사장은 이날 행사에서 “포스코청암재단은 우리 사회가 지키고 따라야 할 보편적 가치와 존중하고 널리 알려야 할 귀감을 제시함으로써 풍요롭고 아름다운 세상을 만들어 나가는 일에 최선을 다하겠다”라고 말했다.과학상 수상자인 박제근 교수는 세계 최초로 ‘2차원 자성체’ 분야의 기존 이론을 입증할 수 있는 새로운 자성 반데르발스 물질을 발견함으로써, 양자정보 소재 합성 연구분야에서 독보적인 연구영역을 구축했다. 이를 기반으로 전기적∙자기적 성질 조절이 가능한 ‘차세대 광소자 기술’을 세계 최초로 구현하며 환경친화적 신소재 개발 가능성을 제시했다.교육상을 받은 최재천 석좌교수는 생명과학분야 융합 교육 분야에서 ‘통섭’의 새로운 교육의 방향성을 제시하며 학문 간 소통으로 우리 사회의 갈등을 풀어내는 새로운 교육의 방향성을 제시해 왔다.봉사상 수상자인 서정화 원장은 20여 년간 복지 사각지대에 놓인 여성 노숙인 자활을 위한 상담 활동과 의료서비스 지원, 직업훈련 및 일자리 알선 활동 등 여성 노숙인 지원 시스템 구축에 핵심적 역할을 해왔다.박한오 대표는 1992년 국내 1호 바이오벤처인 바이오니아를 창업한 이래 국내 최초로 유전인자(DNA) 합성·증폭 ·추출시약 및 관련 장비를 국산화한 성과를 평가받았다."
2022-06-02,"기업은 인력난인데,  외국인 박사 60% 취업정보 없어 탈 한국","━국내 300개 기업 대상 외국인 이공계 석ㆍ박사 인재 수요 조사UST-한국과학기술연구원(KIST) 스쿨 외국인 유학생 다샤 부락. 벨라루스 출신으로 나노-정보융합 전공 통합과정을 밟고 있다. [사진UST]대전 대덕특구에 자리잡은 ‘한국 바이오벤처 1호’ 바이오니아는 최근 회사가 급성장하고 있지만, 연구개발과 글로벌사업개발 인력이 부족해 어려움을 겪고 있다. 국내 대학들에서 석ㆍ박사 인력이 적지 않게 배출되고 있지만,  글로벌 역량을 갖춘 인재들이 중소 벤처기업으로 제대로 공급이 안 되고 있기 때문이다. 박한오 바이오니아 대표는 “정부가 수십년동안 세금을 투자해 국제 경재력을 갖춘 출연연에서 키운 외국인 학생들이 지역의 벤처기업에 취업하면 연구개발 뿐만 아니라 글로벌 시장으로 진출하는데 중요한 역할을 할 수 있는데 이런 것들이 잘 이루어지지 않아서 아쉽다”고 호소했다.수원 광교에서 원자현미경을 만드는 코스닥 상장기업 파크시스템스의 박상일 대표는 “세계와 어깨를 나란히 하는 첨단 연구장비를 만드는 기업이지만 여전히 고급 R&D 인력을 구하기 힘들다”며“국내 유학을 마친 외국인 석ㆍ박사 자원을 찾을 수 있는 마당이 있다면 지금이라도 달려가서 뽑고 싶다”고 말했다.최근 첨단산업 분야를 중심으로 고급 연구ㆍ개발(R&D) 인력 부족이 심각해지고 있지만, 국내 이공계 대학 출신 외국인 박사의 60% 가까이가 졸업 후 한국 땅을 떠나는 것으로 나타났다. 또 국내 중소벤처기업들은 외국인 유학생을 고용하고 싶어하지만 정보가 부족해 이들을 잡지 못하는 것으로 조사됐다.과학기술연합대학원대학교(UST)와 한국산업기술진흥협회(KOITA)가 2일 공동으로 국내 300개 기업을 대상으로 외국인 이공계 석ㆍ박사 인재에 대한 기업 수요를 조사ㆍ분석한 결과를 발표했다. 300개 기업에는 대기업 6개(2%), 중견기업 13개(4%), 중소기업 185개(62%), 벤처기업 96개(32%)가 포함됐다.외국인 인력 미활용 이유조사에 따르면 300개 기업 중 약 24%인 73개 기업은 외국인 연구인력을 채용하고 있으며, 기업당 평균 외국인 채용은 2명이었다. 학력별로는 학사 1.1명, 석사 0.6명, 박사 0.3명으로 나타났다. 이중 국내 유학생 출신 외국인은 35% 수준인 0.7명이다. 외국인 유학생을 연구개발에 활용하는 이유는 내국인 연구인력 부족(43%), 해외시장 진출 업무에 활용(43%), 국내 인력 대비 전문성 및 능력 우수(33%) 등이 제시되었다.외국인 연구인력 미채용 기업은 조사 대상 기업의 76%로, 주요 미채용 사유는 국내의 외국인 유학생에 대한 정보 부족(43%), 내국인 연구인력으로 충분(외국인 연구인력 필요성 없음, 17%), 한국어 의사소통의 어려움(15%), 행정적 비용 및 제약(9%) 등을 응답하였다. 반면, 외국인 연구인력 미채용 기업의 60%가 향후 외국인 연구인력을 채용할 계획이 있다고 개방적 입장을 나타냈고, 선호 학력은 석사급(61%), 학사급(47%), 박사급(27%) 순으로 나타났다. 외국인 연구인력 활용 전공 분야는 전기ㆍ전자ㆍ컴퓨터가 52%로 가장 높았고, 화학ㆍ생명과학ㆍ환경이 21%, 인문ㆍ사회과학이 12%, 그리고 의료ㆍ약학ㆍ보건학, 기계, 재료 등이 각각 8% 수준으로 뒤를 이었다..조사 대상기업의 69%는 외국인 연구인력을 현재보다 확대해야 한다고 응답했다. 이들 기업은 외국인 연구인력 채용정보 부족을 가장 큰 어려움으로 꼽았다. 그 밖에 외국인 채용에 시간과 비용, 내부적인 노력이 국내 연구인력 대비 추가소요 부담을 애로점으로 응답했고, 이에 대한 정책적 지원방안으로 외국인 연구인력 인재 데이터베이스 구축 및 서비스 제공(32%), 채용 보조금 지원(26%), 고용비자 발급조건과 절차 대폭 완화(20%) 등이 제시됐다.국내 이공계 대학원생은 총 8만6562명이며 이중 약 10%인 8321명이 외국인 유학생이다. 그러나 한국직업능력연구원 조사에 따르면 총 2767명의 국내 박사학위 취득 외국인 유학생 중 국내 취업 비율은 42%였으며, 나머지 58%는 자국으로의 귀국 또는 해외 취업 등으로 진로를 이어갔다.국내 대학원 중 외국인 유학생 비중이 가장 높은 곳은 국가연구소대학원인 과학기술연합대학원대학교(UST)다. 재적생의 약 34%(약 450명)가 외국인 유학생으로, 국내 이공계 대학원 평균인 10%를 크게 넘어선다.UST의 경우 외국인 석ㆍ박사 우수 인재와 국내 기업 간 채용을 연결하는 유링크(U-LINK;LinkwithKorea) 사업을 2019년부터 운영하고 있지만, 이번 조사에도 나타났듯 아직도 적지 않은 기업들이 채용정보 부족을 호소하고 있다.UST-한국화학연구원(KRICT) 스쿨에서 나노재료공학 박사과정을 졸업한 베트남 출신HoangQuocViet박사가 연구실에서 실험을 하고 있다.[사진UST]엑셀러레이터 펜벤처스의 송명수 대표는 “싱가포르는 외국인 국비 장학생의 경우 석사 학위 후 3년, 박사는 5년을 자국 내 기업에 의무적으로 근무하게 한다”며 “한국내 대학 교수들 중 일부는 외국인 대학원 제자들이 국내에 취업하기 보다 모국으로 돌아가 교수로 활동하기를 더 원하는 실정”이라고 말했다.류석현 과학기술연합대학원대학교(UST) 산학협력단장은 “미국이 세계 최강인 이유는 글로벌 인재들이 대학과 기업으로 몰려들어 핵심인재가 되어왔기 때문”이라며“한국은 세금을 들여 외국인 유학생을 교육하고도 산업현장에 제대로 활용하지 못하고 있다”고 말했다.류 단장은 “일부에서는 대졸 취업난이 심각한데 무슨 외국인 유학생 일자리를 걱정하느냐는 말을 하지만 굳이 미국 사례를 들지 않더라도 인공지능(AI)ㆍ반도체 등 첨단산업 분야는 고급 R&D 인력 부족 현상이 심각하다”며“이들은 내국인 연구인력과 달리 중소기업 취업에 대한 거부감도 적다”고 덧붙였다."
2023-04-06,[사랑방] 제17회 포스코청암상 시상식,"제17회 포스코청암상 시상식포스코청암재단(이사장 김선욱)이 5일 서울 대치동 포스코센터에서 제17회 포스코청암상 시상식을 열었다. 왼쪽부터 박제근 서울대 교수, 최재천 이화여대 석좌교수, 서정화 열린여성센터 원장, 박한오 ㈜바이오니아 대표이사, 김 이사장."
