date,title,content
2023-07-06,"檢, '5종목 하한가' 주식카페 운영자 구속영장…359억 부당이득 혐의","서울 양천구 소재 서울남부지방검찰청. 뉴스15개 주식 종목 하한가 사태의 배후로 지목된 온라인 주식정보 카페 운영자가 구속 기로에 섰다.서울남부지검 금융·증권범죄합동수사부(부장 단성한)는 최근 동일산업 등 5개 종목 주가폭락 사태와 관련해 강모(52)씨 등 3명에 대해 6일 사전 구속영장을 청구했다고 이날 밝혔다.강씨는 시세조종으로 359억원 상당의 부당이득을 취득한 혐의(자본시장법 위반)를 받는다. 주가가 폭락한 5개 종목은 강씨가 운영하는 주식정보 카페 ‘A투자연구소’에서 매수 추천 종목으로 자주 언급되던 종목이다검찰은 강씨가 친누나와 지인 등 4명과 공모해 2020년 1월부터 지난 5월까지 수십 개의 계좌를 동원해 5개(동일산업·동일금속·대한방직·만호제강·방림) 종목에 대한 주문을 수천회 반복하는 방법으로 주가를 조작했다고 보고 있다.검찰은 지난 3일부터 사흘 연속 강씨를 피의자 신분으로 불러 주식 매매 과정의 위법 여부를 조사했다. 지난달 15일과 16일에는 강씨의 경기도 용인시 자택과 서울 강남구 사무실을 압수수색하고, 강씨가 사고로 입원해 있던 분당서울대병원에서 휴대전화와 노트북 속 주식 거래 관련 자료를 확보했다. 당시 압수수색 영장에는 시세조종으로 취득한 부당이익이 약 104억원이라고 적시됐으나 추가 조사 과정에서 규모는 359억원까지 늘어났다.다만 강씨는 조사에서 자신의 혐의를 전부 부인한 것으로 전해졌다. 각 회사의 경영권을 확보하려고 지분을 매수하는 과정에서 교차매매가 이뤄졌을 뿐, 인위적으로 주가를 띄운게 아니라는 취지다.강씨는 카페에 올린 글과 언론 인터뷰 등을 통해 “소액주주운동 차원에서 오랜 기간 주식을 사들여왔을 뿐 시세조종 등 주가조작에 관여한 적은 없다”며 혐의를 거듭 부인해 왔다."
2023-07-05,"[단독]檢, 5개 종목 주가조작 혐의 주식정보카페 운영자 소환","서울남부지검이 동일산업 등 5개 종목에 대한 주가조작 혐의를 받는 네이버 주식정보 공유 카페 운영자 강모씨를 최근 피의자 신분으로 불러 조사했다. 사진은 서울 신정동 서울남부지검 본관 로비의 모습. 연합뉴스검찰이 동일산업 등 5개 주식 종목 하한가 사태의 배후로 지목된 네이버 주식정보 공유 카페 ‘B투자연구소’ 운영자 강모(52)씨를 최근 소환해 조사한 것으로 5일 파악됐다.서울남부지검 금융·증권범죄합동수사부(부장 단성한)는 지난 3·4일에 이어 이날도 강씨를 피의자 신분으로 불러 조사하고 있다. 강씨는 친누나와 지인 등 4명과 공모, 2020년 1월부터 지난 5월까지 수십개의 계좌를 동원해 5개(동일산업·동일금속·대한방직·만호제강·방림) 종목에 대한 주문을 수천회 반복하는 방법으로 주가를 조작한 혐의(자본시장법상 시세조종)를 받는다.검찰과 금융당국은 이들 5개 종목 관련 불공정거래 의심 첩보를 접수하고 수개월 전부터 강씨 등의 거래 행태를 주시해 왔다. 한국거래소는 하한가 사태 직후 이들 종목의 거래를 정지했다. 검찰도 하한가 사태 다음 날인 지난달 15일부터 이틀에 걸쳐 강씨의 경기도 용인시 자택과 서울 강남구 사무실 등을 압수수색하고, 강씨가 사고로 입원해 있던 분당서울대병원에서 휴대전화와 노트북 속 주식 거래 관련 자료를 확보했다. 압수수색영장에는 강씨 등이 5개 종목에 대한 시세조종으로 104억원의 부당이득을 거뒀다는 내용이 적시됐다.강씨는 검찰 조사에서 자신에게 제기된 혐의를 모두 부인했다고 한다. 소액주주운동가를 자처해 온 강씨는 검찰이 수사에 착수한 뒤부터 줄곧 뜻이 맞는 이들과 5개 회사의 경영권을 확보하려고 지분을 매수하는 과정에서 교차매매가 이뤄졌을 뿐이라고 주장해 왔다. 통정매매를 통해 인위적으로 주가를 띄워 부당이득을 취하려는 시세조종 행위가 아니라는 취지다. 강씨는 이날 중앙일보와 통화에서 “차익 실현은커녕 대량 매수한 주식이 폭락해 엄청난 손실만 입었다”며 “혐의 기간 중 주가 상승 대부분은 프로그램 매수로 촉발됐는데 검찰이 누명을 씌우고 있다”고 주장했다. 검찰은 강씨에 대한 구속영장 청구 여부도 검토 중이다.강씨는 2017년 5월 4개(대한방직·삼양통상·아이에스동서·조광피혁) 종목에 대한 같은 혐의로 구속기소된 이력이 있다. 그는 당시에도 ▶소액주주운동 과정의 우연한 교차매매이고 ▶실제 시세조종을 통해 차익을 거둔 게 거의 없다는 점을 강조했다. 그러나 법원은 강씨가 지인과 주고받은 통화·메시지의 내용과 관련자 진술, 실제 주식 거래내역 등을 비교해 통정매매를 인정했다. 그러면서 시세조종 행위의 경우 차익 실현 등 이익 취득 여부와 무관하게 죄가 성립한다며 지난해 12월 강씨에게 징역 2년, 집행유예 3년, 벌금 4억원을 확정했다.동일산업 등 5개 종목은 지난 3일 거래가 재개됐지만, 일부 종목은 재차 하한가를 기록하는 등 폭락했다. 시장에서는 주식을 담보로 대출을 내준 일부 증권사가 반대매매에 나섰다는 분석이 나왔다."
2023-07-03,동일산업 등 '동시 하한가' 5종목…거래 재개되자 매물 던졌다,"사진 셔터스톡동일산업 등 무더기 하한가를 기록하며 거래가 정지됐던 5개 종목이 거래 재개 첫 날인 3일 개장 직후 또다시 하한가로 직행했다.이날 동일산업과 동일금속, 방림, 대한방직은 장 시작과 함께 하한가를 찍었다.만호제강은 하한가를 기록한 뒤 낙폭을 줄이며 오전 9시 20분 기준 전 거래일 대비 1만1000원(-24.02%) 하락한 3만4800원에 거래 중이다.2주만에 거래가 재개되면서 무더기 매물이 쏟아지는 모습이다.이들 5개 종목은 지난 4월 소시에테제네랄(SG)증권발 무더기 하한가 사태 이후 금융당국이 유사한 유형의 불공정 거래를 조사하는 과정에서 주가 조작 의혹이 불거졌다.이에 지난 달 14일 무더기로 하한가를 기록했고, 이튿날인 15일부터 매매거래가 정지됐다.검찰은 금융당국이 제공한 자료를 바탕으로 이들 종목의 주가조작 의혹 혐의자에 대해 출국 금지와 압수수색 및 기소 전 추징보전 명령 등 투자자 보호 차원의 조처를 내렸다."
2024-05-23,‘23년 닫힌 공간’ 열어 만든 꽃밭정원서 “주민들 웃음꽃 피어나”,"[한겨레] [커버스토리]영등포구, 2001년 기부채납 받은 땅에 ‘문래동 꽃밭정원’ 조성작가의 정원, 황톳길, 모래놀이터…“전 세대 모두 즐거운 공간”최호권 구청장 “젊은 영등포 향한 정원도시 출발점 삼을 것”가로변, 골목길 등 일상 곳곳 정원 확대‘마을정원사 양성’ 등 정원문화도 확산영등포공원에선 ‘정원 소풍’ 축제 열어최호권 영등포구청장이 지난 17일 오후 영등포구 문래동에 있는 ‘문래동 꽃밭정원’에서 학교 수업을 마치고 정원에 온 중고등학생들의 놀이기구를 밀어주고 있다. 최 구청장은 2001년 기부채납 받은 뒤 창고로 쓰이던 땅을 23년 만에 꽃밭정원으로 조성해 주민들에게 돌려줬다“여기 꽃밭정원은 영등포에 터를 잡은 주민들이 문래동을 사랑한 흔적입니다.”지난 17일 오후 영등포구 문래동에 위치한 ‘문래동 꽃밭정원’.최호권 영등포구청장이 지난 5월8일 문을 연 꽃밭정원의 의미를 짚은 표지 ‘문래동 꽃밭정원 이야기’를 읽어 내려갔다. 꽃밭정원 입구에 세워진 표지판에 새겨진 글은 최 구청장이 직접 쓴 것이다.표지판 너머 약 2천 평 규모의 정원 곳곳에서는 성별·나이 구분 없는 다양한 구민들의 밝은 웃음소리가 들려왔다. 새 정원은 이런 다양한 웃음을 모두 품을 만큼 다채롭고 조화롭게 꾸며졌다. 어린이를 위한 청결 ‘모래놀이터’와 상상력 풍부한 놀이기구 △성인을 위한 운동기구 △여러 가지 교육 프로그램을 제공하는 ‘정원문화센터’ △정원 작가들의 상상력이 듬뿍 담긴 ‘작가의 정원’ △겨울에도 푸르른 ‘사계절 잔디마당’ 그리고 △습식과 건식으로 구성된 ‘맨발 황톳길’등 갖가지 시설이 빼곡 자리잡고 있다.최 구청장이 이 꽃밭정원을 ‘문래동 사랑’이라 한 것은 일제강점기부터 이어지는 문래동의 오랜 역사와 변천 과정을 배경 삼은 것이다.“꽃밭정원 자리는 문래동의 오랜 역사를 담은 현장입니다. 산업화 시대의 상징 중 하나인 ‘미싱을 돌리던’ 대표적 장소였지요.”최 구청장 말대로 1930년대 문래동에는 동양방적, 종연방적 등 여러 방적 공장이 생겨났다. 이에 해방 뒤인 1952년 동 이름을 우리 식으로 바꿀 때 문래동이 됐다. 방적기계를 상징하는 ‘물레’를 변형해 ‘문래’(文來)가 됐다는 설이 유력하다. 그러므로 문래는 최 구청장의 말대로 “미싱을 돌려서 동생들 공부시키고 부모님을 부양했던 애틋한 여공들의 마음을 담은 이름” 이기도 하다.한 어머니가 어린아이와 함께 꽃밭정원을 걷고 있다.꽃밭정원 자리는 그중에서도 대표적 방적회사인 옛 방림방적 자리였다. 방림방적은 재일동포 기업가 서갑호(1915~1976) 회장이 1962년 설립한 회사로 규모가 20만 평 정도에 이르는 큰 기업이다. 방림방적은 2000년대 들어 설비를 지방으로 이전하고, 아파트 등을 지었다. 현재 꽃밭정원 터는 이런 과정에서 방림방적이 2001년 4천 평을 영등포구에 기부채납한 곳이다.문제는 기부채납 받은 땅이 20년이 넘게 구청 사업부서 자재창고로 쓰이는 등 제대로 활용되지 못했다는 점이다. 더욱이 자재창고 둘레는 약 5m 높이의 가림막으로 가려져 있어 지역의 공기마저 답답하게 만들었다.변화가 시작된 것은 2022년 제8회 전국동시지방선거였다. 당시 영등포에는 자재창고와 가림막을 없애달라는 주민 민원이 많았다고 한다. 최 구청장은 항상 그 민원을 염두에 두고 있다가 “지난해 4월 전남 순천에서 열린 ‘2023 순천만국제정원박람회’를 방문해 정원의 효용성을 눈여겨보면서 낡은 자재창고를 정원으로 바꾸면 좋겠다는 영감을 얻었다”고 한다.이후 진행은 일사천리였다. 최 구청장은 곧 구의회 사업보고 및 구민 설명회 등을 진행했고, 서울시로부터 시비 23억5천만원의 지원금을 따냈다. ‘문래동 사랑’ ‘영등포 사랑’의 마음들이 하나로 모여 큰 힘을 발휘한 것이다. 이를 바탕으로 지난해 10월부터 가림막을 없애고 본격적으로 정원 조성에 나섰다.아이들과 함께 맨발 황톳길을 걷는 어머니들.‘문래동 꽃밭정원’이 지난 8일 문을 열자 문래동 주민들의 일상이 크게 바뀌었다. 기피하고 돌아가던 장소가 이제 생활의 중심이 됐다. 지난 17일 꽃밭정원에서 만난 위봉한(71), 김광순(65) 부부는 22개월 된 손녀 수아를 데리고 매일 꽃밭정원을 찾는다. 세 사람이 모두 기분 좋은 체험을 할 수 있기 때문이다. 김광순씨는 수아의 상황을 가장 먼저 고려했다. 김씨는 “요즘 많은 놀이터에 모래가 없다”며 “소독된 청결한 모래놀이터가 있어서 수아가 촉감놀이를 하는 데 정말 좋은 장소”라고 말했다. 위봉한씨는 “이곳에서 매일 황톳길을 걸은 뒤 세족장에서 깨끗이 씻으면 마음까지 시원해지는 느낌”이라고 말했다. 기자가 “이렇게 매일 손녀와 함께 공원에 오시면 부부 금슬이 더 좋아지겠다”고 하자 두 사람은 밝은 웃음으로 답했다.꽃밭정원 가장자리를 한 바퀴 돌도록 만들어진 맨발 황톳길은 특히 어른들에게 인기가 많아 이용자들이 멀리서도 찾아온다. 당산1동에서 어린이집 보조교사로 일하는 최순자(71)씨는 매일 일이 끝나면 자전거를 타고 꽃밭정원 황톳길을 찾는다. 이날도 황톳길을 10바퀴 돌고 난 최씨는 땀으로 촉촉해진 얼굴로 “대한민국에서 좋다는 황톳길은 거의 다 가봤다”며 “가까운 곳에 이런 좋은 황톳길이 생겨 생활에 활기가 도는 것 같다”고 말했다. 4살 된 선우를 데리고 나온 선우 엄마도 “파주에 사는 선배가 꽃밭정원 황톳길에 가보고 싶다고 해서 함께 정원을 찾았다”고 말했다.문래동 꽃밭정원은 남녀노소 누구나 즐겨 찾는 곳이지만, 아마도 이곳을 찾는 ‘가장 어린 방문객’은 정원에서 5분 거리에 있는 ‘문래자이어린이집’의 1~2살배기 원아들일 것이다. 김정아(51) 문래자이어린이집 원장은 “이제 막 걷기 시작한 아이들과 함께 멀리 떨어진 공원을 가기가 어려웠다”며 “꽃밭정원이 생겨서 실외활동에 큰 도움이 된다”고 말했다. 김 원장은 “꽃밭정원은 안전하고 가깝고 모래놀이터와 황톳길까지 있어서 앞으로 주 2회 정도 야외 활동을 하게 될 것 같다”고 말했다.한 구민이 ‘작가의 정원’에 핀 꽃을 사진 찍고 있다. 꽃밭정원에는 정원작가가 기획한 작가의 정원이 3개 조성돼 있다.꽃밭정원을 시민들의 힘으로 잘 유지하겠다는 다짐의 목소리도 들린다. 김미자(69) 영등포구의 자원봉사연합회 회장은 “구민들이 꽃밭정원을 스스로 아끼는 모습을 보이도록 자원봉사자들도 활동을 더욱 열심히 할 것”이라며 “가령 규정을 모른 채 반려견과 함께 황톳길을 걷거나 모래놀이터에 어른이 들어가는 일이 없도록 주민들에게 잘 알려나갈 계획”이라고 말했다. 영등포 주민들의 꽃밭정원 사랑이 깊어지면서 지난 16일에는 문래동에 있는 14개 직능단체 대표들이 공동으로 최호권 구청장에게 감사패를 전달했다. 꽃밭정원에서 최구청장에게 감사패를 직접 전달한 최균범 문래동 주민자치위원회 위원장은 “23년간 닫혀 있던 공간을 이렇게 ‘멋진 정원’으로 만들어주셨다는 점에서 14개 직능단체가 만장일치로 의견을 모아 감사패를 전달했다”고 말했다. 하지만 문래동 꽃밭정원은 ‘멋진 정원’의 종착점이 아니라 출발점이다. 영등포구가 본격적으로 추진할 ‘정원도시 영등포’의 모델이기 때문이다. 최 구청장은 “문래동 꽃밭정원은 문래동의 변화를 넘어 영등포가 정원도시로 변화하는 시작을 알리는 상징”이라며 “앞으로 공원, 가로변, 골목길, 교통섬, 마을마당 등 일상 곳곳에 정원을 확대해 영등포구를 젊은 도시, 건강 힐링도시로 만들어가겠다”고 했다. 영등포구는 우선 5월24~26일 ‘정원소풍’이라는 이름으로 영등포역 뒤편에 있는 영등포공원에서 첫 번째 정원축제를 연다. 최구청장은 ‘정원소풍’에 대해 “구민이 참여한 공감정원, 가족 화분 만들기, 구민사랑 콘서트 등 다양한 문화행사를 통해 정원의 가치를 구민들에게 널리 알려나가는 역할을 할것”이라고 말했다.꽃밭정원과 정원 근처의 아파트 모습. 높이 5m의 가림막으로 둘러싸인 공간이 정원으로 바뀌면서 주변 주민들의‘생활의 중심’이 됐다영등포구의 정원 사업을 총괄하고 있는 정성문 영등포구청 푸른도시과 과장은 “앞으로 해마다 정원축제를 개최할 예정”이라며 “정원축제를 통해 영등포구에 있는 오래된 공원들의 시설을 새롭게 바꿔나갈 것”이라고 말했다. 정 과장은 또 “큰 정원뿐만 아니라 작은 자투리땅이라도 주민들이 자연을 느낄 수 있게 꾸밀 것”이라며 “가로수길을 활용한 보행 정원, 안양천 등지에 만들어놓은 황톳길을 활용한 수변 정원, 경로당·복지관에 조성하는 실버 정원, 학생들을 위한 스쿨 정원 등 생활 밀착형 정원”들을 점차 확대해나갈 예정이라고 했다. 정 과장은 또 “현재 문래동 꽃밭정원과 영등포공원 등 2곳에 설치된 정원문화센터를 내년에 2곳 더 늘릴 예정”이라며 “센터를 중심으로 마을정원사 양성 교육 등 각종 교육을 해 정원 문화를 넓혀나갈 예정”이라고 했다. 최호권 구청장은 “문래동 꽃밭정원을 출발점으로 한 정원도시 영등포 사업을 통해 구민들이 5분 거리에서 녹지를 접할 수 있는 5분 녹지생활권을 만들어나가겠다”고 밝혔다. 올해 신년사에서 “2024년을 젊은 영등포를 향해 힘차게 도약하는 원년으로 삼겠다”고 밝힌 최 구청장은 “젊은 영등포를 이루는 데는 하이테크와 같은 첨단도 중요하지만 녹색의 삶도 필수”라며 “‘빨간 꽃 노란 꽃’ 등 각종 꽃이 만발한 영등포를 만들기 위해 더욱 힘쓸 것”이라고 말했다. 최 구청장의 다짐 위로 문래동 꽃밭정원을 찾은 주민들의 웃음소리가 끊이지 않고 들렸다.김보근 선임기자사진 정용일 선임기자서울살이 길라잡이 서울앤(www.seouland.com) 취재팀 편집"
2023-06-14,또 무더기 하한가…제2의 주가조작 우려에 시장 출렁,"클립아트코리아주식시장에서 또 ‘무더기 하한가’ 사태가 발생해 금융당국이 긴급 점검에 들어갔다. 한 네이버 투자 카페 회원들의 주식 매도 물량이 영향을 준 것으로 파악된다. 제 2의 주가조작 사태를 우려한 시장은 출렁였다.14일 유가증권시장에서 방림, 동일산업, 만호제강, 대한방직과 코스닥시장에서 동일금속 등 총 5개 종목의 주가가 비슷한 시각에 하한가로 떨어지는 일이 벌어졌다. 이들 종목은 이날 오전 내내 약세를 보이다가 방림 주가가 오전 11시46분께 가장 먼저 하한가(-29.90%)로 내려갔고, 이어 동일금속 주가가 11시57분 -30% 폭락했다. 동일산업(-30%)과 만호제강(-29.97%), 대한방직(-29.96%) 주가는 낮 12시10∼15분께 차례로 하한가에 진입했다.투자자들 사이에서는 곧바로 공통점이 없는 5개 종목이 동시에 하한가를 쳤고, 이들 주가가 장기간 꾸준히 상승했다는 점에서 제2의 주가조작 사태가 터진 것 아니냐는 우려가 터져 나왔다. 지난 4월 유가증권시장과 코스닥시장에서 8개 종목의 무더기 하한가 사태가 갑자기 발생했는데, 이 종목들도 약 3년간 주가가 상승하다가 동시에 폭락한 바 있다. 검찰과 금융당국은 주가조작 세력의 개입을 조사 중이다.이날 하한가를 보인 5개 종목도 그간 주가가 급등했다. 한 예로 만호제강 주가는 올해 들어(1월2일∼5월30일) 129.5% 상승했고, 동일금속도 올해(1월2일∼4월28일) 72.65% 올랐다.다만 이번 사건은 소시에테제네랄(SG)증권처럼 공통 매도 창구가 없다는 점에서 이전처럼 차액결제거래(CFD)의 허점을 노린 시세조종은 아닌 것으로 추정된다. 대신 네이버의 한 주식 정보 카페가 연루돼 있다는 얘기가 나온다. 5개 종목이 해당 카페에서 추천된 종목들이기 때문이다.네이버 카페 ‘바른투자연구소’의 강기혁 소장은 <한겨레>와 한 통화에서 “소시에테제네랄발 하한가 사태가 터지고 난 뒤로 증권사들이 대출을 중단했다. 이후에 (같이 주주행동주의를 하던 사람들 가운데) 주식을 팔겠다는 사람이 많아 설득하거나 물량을 매수해 왔다. 최대한 노력하다 여력이 안 돼 매도 물량이 나온 것”이라고 했다. 이어 해당 종목들의 주가가 급상승한 이유에 대해서는 “일부러 주가를 올린 것이 아니라 행동주의를 위해 우호 지분을 모으는 과정에서 주가가 올라간 것”이라고 해명했다. 강씨는 주가조작 혐의로 지난해 12월 대법원에서 징역 2년에 집행유예 4년, 벌금 4억원의 유죄 판결이 확정된 바 있다.금융당국은 불공정거래 여부를 점검하고 나섰다. 한국거래소는 5개 종목에 대해 15일부터 매매거래를 정지하고 조회공시를 요구했으며, 3개 종목(동일금속, 방림, 만호제강)은 투자주의 종목으로 지정했다.이날 코스피는 전 거래일보다 0.72%(18.87) 하락한 2619.08에 마감했다. 코스닥지수는 전 거래일 대비 2.79%(24.98) 내려간 871.83에 장을 마쳤다. 최유준 신한투자증권 연구원은 “국내 증시는 전일 반도체 관련 호재의 선반영과 2차전지 관련주의 전반적인 약세로 낙폭이 확대됐다”며 “일부 소형주의 하한가 기록도 투자 심리에 영향을 줬다”고 밝혔다."
