date,title,content
2023-07-04,"지난달 동시 하한가 5종목, 거래 재개하자 또 폭락","4종목은 하한가, 다시 거래중지지난달 15일 매매거래 정지된 여의도KRX한국거래소 홍보관 모니터에 떠 있는 5종목 주가 현황. /뉴시스지난달 무더기 하한가를 기록해 거래정지됐던 5종목 중 4곳이 거래 재개 첫날 다시 하한가로 추락했다. 3일 서울 증시에서 동일산업·동일금속·대한방직·방림은 개장하자마자 가격 제한폭(-30%)까지 떨어져 하한가로 장을 마감했다. 만호제강은 28.7% 폭락세로 시작했지만 이후 하락폭이 줄며 10.6% 하락한 채 장 마감했다.한국거래소는 지난달 14일 5종목이 동시에 하한가를 기록하자 다음 날인 15일부터 30일까지 해당 종목에 대한 거래를 정지시켰다. 지난 4월 말 발생한 ‘SG증권발 폭락 사태’ 같은 연속 하한가 사태를 막기 위한 조치였다.SG사태 당시 일부 종목은 최장 4거래일 연속 하한가를 맞았었다.증권가에서는 빚투(빚내서 투자) 비중이 높은 일부 종목이 추가로 하락할 가능성이 있다고 보고 있다. 돈을 빌려준 증권사들이 대출 손실을 최소화하기 위해 담보로 잡고 있던 주식을 매각하는 반대매매를 할 수 있기 때문이다. 종목별 신용 비중(전체 주식 중 대출을 끼고 산 주식의 비율)은 대한방직(6.48%)·동일금속(5.57%)·방림(5.37%)·동일산업(3.79%) 순이다. 신용 비중이 1.26%로 낮은 만호제강만 하한가 행렬에서 벗어난 상태다.하지만 일각에서는 검찰이 주가조작 혐의 계좌들에 대해 ‘기소 전 추징 보전’ 조치를 취했기 때문에 추가 폭락 가능성이 높지 않다는 시각도 있다. ‘기소 전 추징 보전’은 피의자가 기소 전에 범죄 수익을 처분하지 못하도록 하는 조치로, 주가조작 세력이 주식을 팔지 못하게 하는 것이다.검찰은 이번 5종목 하한가 사태와 관련, 온라인 주식카페 운영자 강모(52)씨 등 관련자들을 출국 금지하고, 강씨의 주거지를 압수 수색해 주식 거래 관련 자료를 확보했다. 강씨는 시세 조종으로 104억원 부당이득을 취한 혐의를 받고 있다. 강씨는 “소액주주 운동 차원에서 오랜 기간 주식을 사들여 왔을 뿐 시세 조종 등 주가조작에 관여하지 않았다”는 입장이다."
2023-06-14,제2의 SG증권발 사태?... 동일산업 등 5종목 무더기 하한가,"동일산업·대한방직 등 폭락… 오늘부터 무기한 거래 정지14일 동일산업·대한방직·만호제강·방림(이상 코스피)과 코스닥 상장사 동일금속 등 5종목 주가가 하한가로 추락해 금융 당국이 조사에 착수하고, 해당 종목들의 거래를 15일부터 무기한 정지하기로 했다. 지난 4월 말 다우데이타 등 8종목이 최장 나흘 연속으로 무더기 하한가를 기록했던 ‘SG증권발 주가 폭락 사태’와 유사한 주가조작 사건 아니냐는 의혹이 제기된다.이 종목들의 주가는 이날 오전 10~11시쯤 갑자기 떨어지기 시작해 1~2시간 만에 가격 제한 폭인 30%까지 급락했다. 주식시장에선 “온라인 주식 투자 카페 운영자인 강모(52)씨가 회원들을 동원해 이 종목들을 꾸준히 매집해 오다가 한꺼번에 팔아 가격이 급락한 것 아니냐”는 주장이 나왔다. 회원이 6000여 명에 달하는 이 카페에는 하한가를 맞은 종목들을 추천하는 글이 다수 올라와 있다. 강씨는 이날 언론 인터뷰에서 “증권사들이 카페 회원들에게 신용 융자(대출) 연장을 해주지 않아 회원들이 해당 종목들을 팔았고, 이 때문에 주가가 하락했다”는 취지로 말했다.한국거래소는 투자자 보호를 위해 5종목에 대해 ‘해제 필요시’까지 사실상 무기한으로 거래를 정지했다. 하한가 사태가 연일 이어지는 것을 막으려는 조치다.금융감독원은 이날 폭락 사태가 시세조종 등 불공정 거래와 관련됐는지에 대해 긴급 점검에 착수했다. 앞서 ‘SG사태’에 대한 검찰 수사 결과, 라덕연(구속 기소) H투자자문사 대표 등 주가조작 일당의 시세조종 혐의가 있었던 것으로 드러났다. 라씨 일당은 시세조종이 쉬운 중소형주를 타깃으로 삼아 2~3년간 꾸준히 주가를 올렸는데, 14일 폭락 종목들도 비슷한 측면이 있다.이날 폭락 종목들은 철강(동일산업·만호제강), 건설기계 부품(동일금속), 섬유 소재(대한방직·방림) 등으로 업종이 나뉘었지만, 모두 시가총액이 1000억~3000억원대로 중소형주에 속한다. 또 대주주 비율이 높아 유통 가능한 주식 비율이 30~50%대로 비교적 낮다는 것도SG사태 때 폭락한 종목들과 공통점이다. 시세조종 세력이 상대적으로 적은 자금만 가지고도 손쉽게 주가를 올릴 수 있는 종목들인 것이다.실제 이 종목들 주가는 지난 2020년부터 3년여간 꾸준히 올랐다. 만호제강 주가는 지난 2020년 1월 2일 1만5750원에서 폭락 직전인 지난 13일 6만5400원으로 4배 이상으로 뛰었다. 같은 기간 다른 4종목의 주가 상승률도 168~282%에 이른다.다만 이번 폭락은SG사태와 달리 차액결제거래(CFD)를 통하지 않았고, 팔자 주문이 대량으로 나온 창구도 특정 외국계 증권사가 아니라 다수의 국내 증권사였다는 차이점이 있다.CFD거래란 투자자가 원금의 2.5배만큼 주식 매매를 주문한 뒤 나중에 시세 차액만 정산하는 고위험 상품이다.한편 이날 폭락한 종목들을 추천해 온 주식 투자 카페 운영자 강씨는 지난 2014~2015년 조광피혁 등 여러 종목의 시세를 조종한 주가조작 혐의로 기소돼 작년 대법원에서 징역 2년에 집행유예 4년, 벌금 4억원이 확정됐다."
2022-03-01,[부음] 김도열 별세 외,"▲김도열별세,민영규연합뉴스 부산취재본부 부장 장인상=28일15시 부산 해운대백병원, 발인 3일8시20분, (051)893-4444▲김용배별세,유태호소프톤엔터테인먼트 대표 모친상=27일8시 서울아산병원, 발인 2일6시30분, (02)3010-2000▲김우기前 고용노동부 산재심사위원회 위원장 별세,김지성근로복지공단 과장·김남경·김지영부친상=28일11시55분 서울아산병원, 발인 3일7시,(02)3010-2000▲박경순별세,이형세전북경찰청장 장모상=27일23시 원광대병원, 발인 2일9시, (063)280-8110▲신경애별세,조병제·조도제차우모터스 대표·조욱제제이케미칼 대표·조양제방림네오텍스 전무·조교제실버프리 대표·조옥순·조옥화·조옥희모친상,서재희방림 회장·박명렬前 울산시청 서기관·송재화코빅스 대표 장모상=27일3시30분 양산부산대병원, 발인 2일6시, (055)372-4447▲장향열별세,김철前 대우건설 상무·김찬前 한국사학진흥재단 사무총장·김옥고양초 교사·김식TS식스티즈 부사장 모친상,박시종성균관대 사회복지대학원 교수 장모상=28일7시 신촌세브란스병원, 발인 3일10시, (02)2227-7500▲정해근별세,정문섭부산정보산업진흥원 원장·정태섭·정지유부친상,박영규장인상,김진시부상=27일22시22분 부산 수장례식장, 발인 2일5시30분, (070)4015-3186"
2024-07-01,평창 도로서 말 4마리 도로 활보...1시간 만에 포획,"1일 오후 강원 평창 한 도로에서 말들이 도로를 활보하는 소동이 벌어졌다. 사진은 사고 지점을 지나는 시민이 차 안에서 찍은 말들의 모습. /연합뉴스말 운반 차량이 넘어지는 바람에 말들이 도로를 활보하는 소동이 벌어졌다.1일 오후 4시 57분쯤 강원 평창군 방림면 일대 도로에서 말 4마리를 싣고 가던 4.5톤 마이티 화물차가 전도되는 사고가 났다.이 사고로 운반 차량 운전자인 40대 A씨가 가벼운 상처를 입고, 말들이 차량 밖으로 나와 도로를 배회했다.사고 지점 일대에는 일시적인 혼잡이 빚어지기도 했다. 목격자들은 “말들이 도로에서 돌아다니는 바람에 교통 체증이 있었다”고 말했다.신고를 받고 출동한 경찰과 소방 당국은 차량을 통제하고 도로를 쏘다니는 말들을 가둬 놓는 등 이날 오후 6시쯤 안전조치를 마쳤다.경찰은 A씨를 상대로 정확한 사고 경위 등을 조사하고 있다."
2024-06-10,"최호권 영등포구청장 “지방자치의 핵심, 주민이 원하는 것 정책 반영해야”","침수원인 분석해 상습침수지역 수해 철저 대비”중앙정치·당론에 흔들리기보다 ‘공익의 대변자’로”지난달 29일 서울행복플러스 취재팀과 인터뷰 중인 최호권 영등포구청장. 그는 ""진정한 지방자치에 이르는 길은 주민들을 직접 만나 의견을 듣는 것""이라고 했다. /영등포구“구청장의 자리는 오직 구민을 위해 일하는 자리임을 절실히 느꼈습니다.”30여년 전 행정고시 패스 후 중앙부처를 마다하고 서울시를 택했던 최호권(61) 영등포구청장은 지난 2년이 ‘지방자치’를 실현하기 위한 시간이었다고 했다. 최 구청장은 주민의 요구를 정책에 반영하는 것을 지방자치의 핵심으로 보고, 2년간 관내 18개동과 경로당 170곳을 돌며 직접 구민의 이야기를 들었다. 그는 “의회에 예산안을 제출하거나 조례 개정을 할 때 근거가 되는 것이 주민의 목소리”라며 “이를 구정에 반영하는 것이 기초자치단체장의 의무”라고 강조했다.최 구청장은 취임 한 달만인 2022년 8월 기록적인 폭우를 경험하며 지방자치의 중요성을 더욱 체감했다고 했다. 당시 시간당 111m의 기록적인 폭우가 쏟아지며 영등포구는 주택 4109가구와 상가 1807개가 침수되는 등 막대한 피해를 입었다. 최 구청장은 “신길6동 등 침수 피해 현장에서 주민들의 삶이 무너지는 것을 직접 봤다”며 “기초자치단체장은 주민 안전을 책임지고 비상재난과 응급상황에 대처하는 최후의 보루라는 생각이 들었다”고 말했다.지난달 29일 양평1동 빗물펌프장 현장 점검에 나선 최호권 구청장이 펌프장 현황을 설명하고 있다. /영등포구최 구청장은 폭우 사태로부터 약 4개월 뒤인 2022년 12월부터 ‘침수원인분석 및 대책수립 용역’을 실시했다. 지난 3월부터는 완료된 용역을 바탕으로 침수 대비책 마련에 나섰다. 상습침수지역인 문래동은 하수관로 높낮이 차이로 빗물이 역류하는 문제를 파악해 시비 44억원을 들여 정비공사에 들어갔다. 그러나 반지하 주택이 다수인 대림동 일대(855-1번지)는 사실상 재개발 밖에는 답이 없던 상황. 최 구청장은 서울시의 재개발사업인 ‘신속통합기획’을 떠올렸다. 그는 “신속통합기획 선정 기준에 미달됐던 대림동이었지만 상습침수지역에는 가점을 부여해야 한다고 지속적으로 건의했다”고 했다. 그 결과 2022년 12월 대림동은 신속통합기획 최종 대상지로 선정됐다. 앞으로 이곳에는 지상 35층, 1000세대 이상 규모의 주거단지가 들어선다. 영등포구는 각종 주민 편의시설뿐 아니라 1만5000톤 규모의 저류시설을 만들어 침수를 사전 차단한다는 계획이다.올여름 평년보다 많은 비가 예보된 가운데 수해 예방 시스템도 철저히 갖추고 있다. 먼저 일반 빗물받이보다 5배나 큰 규모로 빗물을 빠르게 배수하는 연속형 빗물받이를 지난해 205개에 이어 올해 66개를 추가로 설치했다. 집중 호우 시 배수구역 내 빗물을 하천 등으로 방류하는 빗물펌프장 8곳은 점검을 마쳤다. 수문을 비롯해 유수지·저류조 등은 정기적으로 살피고 있다. 주민들의 변화도 놀랍다. 최 구청장은 “주민들이 나서서 빗물받이를 청소하는 등 수해 예방에 힘쓰고 있다”고 했다. 최 구청장이 직접 나서서 주민들을 만나고 설득한 결과다.최호권 구청장이 지난달 16일 영등포구 문래동 꽃밭정원에서 주민대표로부터 감사패를 전달받은 뒤 기념촬영을 하고 있다. /영등포구23년간 방치되다시피 했던 문래동 공공부지도 주민들의 의견을 반영해 꽃이 어우러지는 ‘문래동 꽃밭정원’으로 탈바꿈시켰다. 방림방적이 영등포의 발전을 위해 기부채납한 부지에 시비 23억원과 아시아산림협력기구(AFoCO) 등으로부터 받은 지원금 등으로 정원을 조성했다. 최 구청장은 “주변 아파트에 거주하는 주민이 고층에서 찍은 꽃밭정원 사진을 보내주기도 했다”며 “꽉 막혀있던 공간을 아름다운 정원으로 되돌려줘 고맙다는 말을 자주 듣는다”라고 말했다. 실제로 문래동 주민자치위원회 등은 최 구청장에게 ‘문래동 꽃밭정원’ 조성에 감사하는 감사패를 전달하기도 했다. 앞으로 문래동 공공부지에는 ‘영등포 문래 예술의전당’이 추가로 들어서 꽃밭정원과 함께 주민들의 명소로 떠오를 전망이다.최 구청장은 임기 후반기에도 ‘지방자치’를 뿌리내리기 위해 더욱 노력하겠다고 했다. 중앙정치나 당론에 휘둘리지 않고 ‘공익의 대변자’로 흔들림 없이 가겠다는 것이다. 그는 지방자치를 이루기 위한 핵심요인으로 일자리와 교통을 꼽았다. 이에 따라 경부선 철도 지하화와 문래동 기계금속단지 이전 등에 집중할 계획이다. 과학인재 양성에도 힘쓰고 있다. 최근에는 관내 초중학교 학생 2만명에게 국립과천과학관 등 국공립 과학관에서 사용할 수 있는 이용권을 제공하기로 했다. 국립과천과학관 단장을 역임했던 최 구청장이 아이디어를 내 직접 추진한 사업이다.“국민이 어려울 때 기댈 수 있고 힘이 되어주는 지방자치단체가 되기를 바라는 마음이 간절합니다.” 최 구청장은 2022년 출간한 저서 ‘지방자치의 꿈’에 이 같이 적었다. 그가 30여년 전 공직사회에 처음 발을 내디뎠을 때 꾸었을 ‘지방자치의 꿈’은 그의 바람대로 조금씩 현실에 닿고 있다."
2024-06-10,"영등포에 쇳가루 대신 꽃가루 날린다… 23년 방치 문래동 공공부지, 꽃밭정원·문화공간으로","꽃밭정원 지난달 8일부터 개장‘문래 예술의 전당’ 2030년 준공 목표지난달 8일 개장한 영등포구 문래동 꽃밭정원 전경. /영등포구23년간 방치됐던 문래동 공공부지가 영등포구의 노력으로 활력을 찾고 있다.문래동 공공부지(문래동3가 55-6번지)는 재일 교포 사업가인 故 서갑호(1915~1976) 회장이 세운 ㈜방림방적이 ‘영등포 발전을 위해 써달라’며 2001년에 기부채납한 땅이었다. 그러나 20년 넘게 울타리에 막혀 구청 사업부서 자재창고로 쓰이는 등 적절히 활용되지 못했다.이에 영등포구는 시비 23억원 등을 지원받아 최근 이 부지를 주민을 위한 힐링공간인 ‘문래동 꽃밭정원’으로 재탄생시켰다. 지난달 8일 개장한 꽃밭정원에는 라일락, 데이지, 팽나무, 백리향, 로즈메리, 라벤더 등 다양한 식물을 심고 맨발 황톳길과 어린이 놀이터 등을 꾸렸다.주민들은 새로 들어선 공공정원에 만족감을 나타내고 있다. 연령대에 맞춘 다양한 시설을 갖춰 남녀노소 누구나 찾는 생활 명소가 됐다는 평가를 받는다. 이를 증명하듯 지난달 16일에는 문래동 주민자치위원회 등 주민들이 최호권 구청장에게 ‘문래동 꽃밭정원’ 조성에 대한 감사의 의미를 담은 감사패를 전달했다.꽃밭정원을 제외한 나머지 부지에는 현재 도시텃밭을 운영 중이다. 이곳에는 앞으로 ‘영등포 문래 예술의 전당’이 들어선다. 지난해 영등포구가 서울시 예산 22억5000만원을 확보해 기본계획 수립 등을 마쳤다. 현재는 투자심사 진행 중으로 2027년 착공해 2030년 준공하는 것이 목표다.영등포구는 예술의 전당을 일상에서 문화와 예술을 접할 수 있는 ‘구민 참여형 열린 공간’으로 만들겠다는 구상을 밝혔다. 이를 위해 1300여석의 대공연장과 300석의 소규모 다목적홀 등을 갖출 계획이다. 또 전 구민을 위한 문화교육시설을 비롯해 50m 길이의 8레인 수영장과 피트니스 센터도 마련한다. 문래 예술창착촌 작가 등 지역 예술인에게는 저렴한 비용으로 활동할 수 있는 창작공방 등을 제공하고, 영등포공원 내 문화학교를 이전해 다양한 문화예술 강좌도 운영하기로 했다.한편 서울을 거대 정원도시로 만들겠다는 오세훈 서울시장의 정책에 화답하듯 자치구들이 앞다퉈 정원도시 경쟁에 나선 가운데 영등포구는 ‘정원도시 영등포’를 선언하며 선두주자로 떠올랐다. 이번 ‘문래동 꽃밭정원’이 정원도시 조성의 첫 단추다. 최호권 구청장은 최근 서울시청에서 열린 기자간담회에서 “영등포는 산이 없고, 쇳가루 날리는 철공소가 밀집된 낡고 오래된 구도심의 이미지가 강했다”며 “정원도시를 조성해 영등포의 이미지를 획기적으로 바꾸겠다”고 강조한 바 있다."
2024-02-08,말다툼 하다 아내 살해한 80대 구속,"경찰 로고. /조선DB부부싸움을 하다 아내를 살해한 80대가 구속됐다.광주 남부경찰서는 아내를 둔기로 때려 살해한 혐의(살인)로 A(84)씨를 구속했다고 8일 밝혔다.A씨는 지난 6일 오전 9시 23분쯤 광주 남구 방림동 한 다세대주택에서 아내  B(81)씨를 둔기로 때려 숨지게 한 혐의를 받는다.A씨는 치매약을 복용하고 있었고, B씨와 말다툼을 벌이다가 범행을 저지른 것으로 조사됐다.A씨는 자녀의 신고로 출동한 경찰에 붙잡혔다.A씨는 범행 후 자해를 하던 중 자녀들에게 연락해 범행 사실이 드러난 것으로 전해졌다."
