date,title,content
2023-06-15,"檢, 5개 종목 주가폭락 수사…주식카페 운영자 폰·노트북 압수","검찰이 지난 14일 발생한 5개(동일산업·동일금속·대한방직·만호제강·방림) 주식 종목의 하한가 사태에 대한 수사에 나섰다.15일 법조계에 따르면, 서울남부지검 금융·증권범죄합동수사부(부장 단성한)는 이번 주가폭락 사태의 배후로 지목된 네이버 주식정보 공유 카페 ‘B투자연구소’ 운영자 강모(52)씨를 출국금지하고 이날 자택을 압수수색했다. 강씨가 입원해 있던 분당서울대병원에서 강씨의 휴대전화와 노트북 등도 확보했다. 앞서 검찰은 금융당국과 공조 아래 주가폭락 이전부터 해당 종목을 대상으로 한 불공정거래 행위를 예의주시해 왔다. 그러던 중 5개 종목 중 일부 종목에 대한 소액주주운동을 벌여 온 강씨가 비정상적 거래에 연루된 정황을 포착한 것으로 파악됐다.서울남부지검 금융증권범죄합동수사부가 동일산업 등 코스피 4개 종목, 동일금속 등 코스닥 1개 종목 등에 대한 주가조작 의혹과 관련해 배후로 지목된 인터넷 주식정보 카페 운영자 강기혁씨를 출국금지하고 수사에 나섰다. 사진은 서울 신정동 서울남부지검 본관 로비의 모습. 연합뉴스강씨는 과거 주가조작 혐의로 처벌받은 전력이 있다. 서울남부지검은 2017년 5월 강씨를 4개(대한방직·삼양통상·아이에스동서·조광피혁) 종목의 주가를 조작해 차익을 거둔 혐의(자본시장법상 시세조종)로 구속기소했다. 2014년 2월부터 2015년 8월까지 이들 4개 종목에 대한 약 1만회의 통정매매·물량소진 수법으로 주가를 2.5~3.7배 띄운 뒤 보유 주식을 처분해 약 200억원의 부당이득을 거둔 혐의였다. 법원은 이 같은 혐의를 일부 인정해 강씨에 대해 징역 2년, 집행유예 3년, 벌금 4억원을 선고했고, 지난해 12월 대법원에서 확정됐다.강씨는 2000년대부터 소액주주운동 활동으로 이름을 알렸다. 그는 2015년 3월 삼양통상 주주총회에서 소액주주 지분을 모아 자신이 내세운 대기업 출신 비상근감사가 선임되는 성과를 거두기도 했다. 그러나 당시 선임됐던 감사 강모씨도 2017년 5월 강씨의 주가조작 공범으로 기소돼 나란히 유죄가 확정됐다.강씨는 이날 자신이 운영하는 카페에 글을 올려 “어이없고 황당한 루머” “시장의 억측”이라고 의혹을 부인했다. 그는 “동일산업·동일금속은 2011년, 대한방직은 2013년부터 카페에 수많은 리포트를 게재한 종목이지만 현재 카페 회원들 중 세 종목을 보유한 경우는 5% 미만이고, 만호제강과 방림은 이 카페에 제대로 추천한 적도 없다”며 “어제의 하락은SG사태(소시에테제네랄증권발 주가조작 사건) 이후 소형주에 대한 무차별적 대출 제한과 만기 연장조차 해 주지 않는 증권사들의 만행으로 촉발됐다”고 주장했다. 그러면서 “제 두 딸을 비롯해 큰누나, 작은매형, 처형까지 반대매매로 깡통계좌가 되게 된 상황”이라고 덧붙였다.한편, 한국거래소는 전날 약 30%의 낙폭으로 하한가를 기록한 동일산업 등 5개 종목의 거래를 이날 정지했다. 이들 5개 상장사는 이날 조회공시를 통해 “불공정거래와 관련해 확인된 사항이 없다” “보도된 내용과 무관하다” 등의 입장을 내놨다."
2023-06-15,"무더기 하한가 재발에, 이복현 ""5개 종목 이미 파악""","‘소시에테제네랄(SG) 사태’가 나타난 지 두 달도 안 돼 무더기 하한가 사태가 빚어지자 금융당국이 즉각 시세조종 의혹을 확인하기 위한 시장 조사에 나섰다.이복현 금감원장과 김주현 금융위원장이 15일 국회 정무위원회 전체회의에서 대화하고 있다. 김현동 기자금감원은 우선 연루 의혹이 불거진 카페 커뮤니티 등에 대한 조사에 착수했다. 이복현 금융감독원장은 15일 국회 정무위원회에 참석해 네이버 주식정보 공유 카페 ‘B투자연구소’ 가 이번 주가 폭락 사태의 배후로 지목된 것과 관련해 “그런 소문 내지는 추측이 있어 관련 사실관계를 파악하고 있다”고 말했다.금융당국은 이번 사태를 주도했다는 의혹을 받는 카페 운영자 강모(52)씨를 비롯해 카페 및 해당 기업에 대한 대면 및 현장 조사를 벌인다는 계획이다. 또 유사투자자문업자 홈페이지, 블로그, 카페 등의 게시물에 위법 사항이 없는지도 살펴볼 계획이다. 금감원 관계자는 “5개 종목 하한가 사태와 관련됐다고 지목된 카페를 포함해 불법 행위 의혹이 있는 홈페이지, 카페 등을 두루 살펴볼 것”이라고 말했다.이와 관련 서울남부지검 금융·증권범죄합동수사부는 강씨를 출국금지했다. 이 원장은 “해당 건과 관련해 금융위원회와 금감원 및 검찰과 거래소와 함께 수사와 조사를 진행 중”이라며 “빠르게 결과를 말씀드릴 것”이라고 했다.김현서 디자이너강씨는 혐의를 부인하고 있다. 그는 이날 카페에 올린 글에서 “동일산업·동일금속은 2011년, 대한방직은 2013년부터 카페에 수많은 리포트를 게재한 종목이지만 현재 카페 회원 중 세 종목을 보유한 경우는 5% 미만이고, 만호제강과 방림은 이 카페에 제대로 추천한 적도 없다”며 “어제의 하락은SG사태 이후 소형주에 대한 무차별적 대출 제한과 만기 연장조차 해 주지 않는 증권사들의 만행으로 촉발됐다”고 주장했다.앞서 금감원은 전날 주식시장에서 하한가를 기록한 동일산업‧만호제강‧동일금속‧대한방직‧방림 등 5개 종목에 대해 매매 정지 조치를 했다. 지난 4월말SG증권 창구에서 매물이 쏟아지며 8개 종목의 무더기 하한가 사태가 일어난 당시 대비 신속히 조처를 했다. 당시에는 4개 종목이 사흘 내리 하한가를 기록했었다. 이미 동일산업 등 5개 종목에 대해 주가 폭락 이전부터 상황을 예의주시한 결과라는 게 금융당국의 설명이다.이 원장은 “SG사태 이후 이상거래 적발 시스템을 회피하는 행위 등을 파악하는 과정에서 해당 종목을 챙기며 사실관계를 파악하고 있었다”라며 “SG사태 때의 경우 장기간 하한가로 인한 손해가 있었지만 이번에는 당국이 어느 정도 사실을 파악하고 있었기 때문에 신속하게 매매 정지를 했다”고 말했다.이와 함께 금감원은 연말까지 불공정거래 특별 단속을 강화하기로 하고, 관련 조사 인력을 늘리기로 했다. 이 원장은 이날 ‘금융상황점검회의’를 주재하며 “증시 교란 행위 우려를 불식시키고 투자자 신뢰를 제고할 수 있도록 6월 중 조사전담인력 확충 및 조직개편을 실시했다”며 “7월 추가 증원을 통해 불공정거래 조사역량을 강화하는 한편, 연말까지 불법리딩방 등 특별 단속을 차질 없이 진행하겠다”고 밝혔다.금감원은 이달에 기획조사·자본시장조사·특별조사국 등 3개 조사 부서를 조사 1·2·3국 체제로 전환하고 17명의 인력을 충원했는데, 다음 달 중으로 조사전담 인력 8명을 추가 증원한다. 금감원은 또 투자설명회 현장 단속, 유사투자자문업자에 대한 일제·암행 점검 등을 통한 불공정거래 특별단속 활동도 강화한다는 방침이다."
2023-06-15,"“또 SG 사태?” 5종목 무더기 하한가, 주가 조작 의혹도…매매 거래 정지","SG증권(소시에테제네랄) 창구를 통해 쏟아진 매물로 인한 무더기 하한가 사태와 유사한 일이 14일 증시에서 벌어졌다. 유가증권시장 상장사인 방림과 동일산업, 만호제강, 대한방직 등 4개 종목과 코스닥 종목인 동일금속 등 5개 종목이 비슷한 시각에 하한가로 진입했다.한국거래소에 따르면 방림이 이날 오전 11시 46분께 가장 먼저 하한가로 폭락했고, 동일금속도 11시 57분에 하한가를 기록했다. 이어 동일산업과 만호제강, 대한방직은 12시 10~15분 사이에 하한가로 진입했다.지난 4월 말 차액결제거래(CFD)로 인한 무더기 하한가 사태가 빚어진 이후 한 달 반 만에 비슷한 상황이 벌어진 것이다. 시장에서는 과거 시세조종으로 형을 선고받았던 한 투자카페를 배후로 의심하고 있다.현재까지 하한가 관련 원인은 밝혀지지 않고 있지만, 시장에서는 주가 조작 의혹이 커지고 있다. 이들 다섯 종목의 주가가 최소 몇 달간 꾸준히 오르다 무더기 하한가를 맞은 점이 지난 4월의 ‘라덕연 사태’를 연상시킨다는 것이다.이날 한국거래소는 관련 5개 종목에 대해 조회공시를 요구했으며 해제 필요시까지 매매거래를 정지하기로 했다. 금융감독원도 “같은 시간대 가격이 급락한 부분에 대해서는 시세 조종 등 불공정 행위가 있을 수 있다고 보고 거래소와 함께 살펴보고 있다”고 밝혔다.시장에서는 ‘바른투자연구소’라는 네이버 카페의 운영진을 배후로 의심하고 있다. 지난 2021년 10월 서울고법 형사7부는 자본시장과 금융투자업에 관한 법률 위반 등 혐의로 이 카페 개설자 강 모(50) 씨의 항소심에서 징역 2년의 집행유예 4년, 벌금 4억원을 선고했다."
2023-04-04,"""줬다 빼앗다니, 우리가 우습나""…제2 세종문화회관, 화난 문래동","서울 영등포구 문래동으로 낙점됐던 ‘제2 세종문화회관(제2 세종)’ 후보지가 지난달 갑자기 여의도공원으로 바뀌었다. 오세훈 서울시장의 핵심 사업인 ‘그레이트 한강 프로젝트'와 맞물리면서다. 이에 문래동 주민들은 반발하고 있다.지난달 31일 '제2 세종문화회관' 건립 예정지였던 서울 영등포구 문래동 옛 방림방적 공장 부지에 가림막이 설치돼 있다. 나운채 기자━“줬다가 뺏는 것 같아” 실망한 문래동지난달 31일 영등포구 문래역. 이곳에서 5분 정도 걸으면 옛 제2 세종 건립 후보지(1만3000㎡)가 나온다. 과거 방림방적 공장 부지였다. 사면(四面)을 빙 둘러 설치된 가림막엔 ‘2025년 12월 제2 세종문화회관 개관 예정’이란 안내문이 적혀있었다. 하지만 첫 삽도 뜨지 못한 채 ‘텃밭’으로 쓰고 있다.부지 인근 횡단보도엔 국민의힘과 더불어민주당이 내건 현수막이 걸려 있었다. 제2 세종 이전 관련, 최호권 영등포구청장 지지와 규탄 문구가 보였다.이곳 주민 A씨(60대)는 “‘시설을 주겠다’고 하다 다시 뺏는 느낌”이라고 말했다. 이곳에서 10년 넘게 카페 등을 운영했다는 B씨는 “제2 세종 방문객이 우리 가게도 찾지 않을까 하는 기대가 있었다”며 “(선거 때만) 표심을 위한 정책이 아니었나 의심된다”고 했다. 회원 수가 3만명 정도인 지역 커뮤니티에선 “주민을 우습게 보는 게 너무 화가 난다”라거나 “의견 수렴도 없이 시장과 구청장 하고 싶은 대로 하면 끝인가” 등 댓글이 잇따랐다.지난달 31일 '제2 세종문화회관' 건립 예정지였던 서울 영등포구 문래동 옛 방림방적 공장 부지 인근 횡단보도에서 각각 최호권 영등포구청장을 지지하거나 규탄하는 내용의 현수막이 걸려 있다. 나운채 기자━구유지 무상사용 여부, 떠오른 쟁점제2 세종 문래동 건립은 2019년 12월 서울시가 계획을 발표하면서 급물살을 타는 듯했다. 서울 도심과 강남권에 집중된 공연장 인프라 불균형을 해소하겠단 취지였다. 고(故) 박원순 서울시장과 채현일 영등포구청장 때다. 그러나 지난해 오세훈 서울시장-최호권 구청장이 취임하면서 기류가 바뀌었다. 특히 방림방적 부지가 구 소유 부지인 게 문제가 됐다.영등포구는 제2 세종을 짓기 위해 구 소유 땅을 시가 반영구적으로 무상사용하는 것을 승인하기 어렵다고 봤다. 공유재산 및 물품관리법(공유재산법)상 토지 무상사용은 최대 5년 동안 가능하고, 그 뒤론 유·무상 여부를 다시 심사받아야 한다. 이에 서울시로선 대규모 공연장 건축물이 들어서야 하는 해당 부지를 사들이거나 시유지를 맞교환해야 하는 부담을 안게 됐다. 서울시 관계자는 “영등포구가 관내 더 넓은 시(市)유지에 제2 세종을 건립하는 방안을 건의했고, 제2 세종이 갖는 위상 등을 종합적으로 검토해 (여의도 공원으로) 이전 결정을 하게 됐다”고 설명했다.지난 2019년 12월 서울시가 발표한 서울 영등포구 문래동 ‘제2세종문화회관’ 예상 조감도의 모습. [자료 서울시]━“정치적 상황”vs“구민에 돌려줘”제2 세종의 문래동 건립 무산은 정치 환경 변화가 영향을 미쳤다는 지적도 나온다. 채현일(민주당) 전 구청장은 중앙일보와 통화에서 “제2 세종 문래동 건립은 이전부터 충분히 검토했기에 아무런 문제가 없었다”며 “현 구청장이 (건립을) 철회한 게 문제”라고 주장했다.이에 최호권(국민의힘) 구청장은 “공유재산 문제는 과거부터 구의회 등에서 문제로 지적하던 사안”이라며 “구유지인데도 구민에게 돌아오는 이익이 거의 없다는 점을 알면서도 (문래동 건립)이 강행된 것”이라고 반박했다. 최 구청장은 “(제2 세종) 여의도공원 이전으로 수천억원어치 땅을 구민이 되돌려받게 됐다”고 했다. 문래동 부지엔 구립 복합 문화시설이 들어설 예정이다.서울시가 지난달 9일 발표한 '그레이트 한강 프로젝트'에서 서울 여의도공원에 들어설 제2 세종문화회관의 모습 조감도. [자료 서울시]━제2 세종, 기존보다 1.8배 크게서울시는 여의도공원에 연면적 23만㎡ 규모로 제2 세종을 지을 계획이다. 기존 시설보다 1.8배 크며 2026년 첫 삽을 뜨는 게 목표다."
2022-09-27,"車 3대 불질러놓고…""날 왜 찾나"" 경찰에 먼저 전화 건 방화범","“왜 나를 찾습니까?”지난 26일 오후 11시 20분쯤 광주 남구 방림지구대에 한 통의 전화가 걸려왔다. 광주 남구 방림동의 한 골목길에 주차된 차량에서 불이 난 이후 30분가량 지난 시점이었다.최근 남구 일대에서는 늦은 밤 주차된 차량만 골라 불을 지르는 연쇄 방화 사건이 잇달아 발생했다. 방화범을 추적 중이던 경찰은 이 전화가 유력한 용의자 김모(42)씨의 전화라는 걸 단숨에 알아차렸다.경찰은 지난 23일 오전 1시쯤 광주 남구 봉선동 한 도로변에서 전소된 차량 후미에서 옷가지가 탄 흔적을 보고 방화를 의심, 관내 거주 동종 전과자 중 수법이 비슷한 김씨를 용의자로 보고 주변을 탐문했다.포위망이 좁혀 오자 압박감을 느낀 김 씨는 지구대에 전화했고, 경찰은 즉시 번호를 조회해 김씨가 백운동에 있는 한 공중전화에서 전화를 걸었다는 사실을 파악했다. 경찰은 자수하라고 설득하는 등 김씨와 자연스럽게 대화를 이어가며 시간을 끌었고, 김씨는 10분 만에 출동한 경찰에 붙잡혔다.김 씨는 지난 23~26일 봉선동에서의 첫 방화 이후 도주했고, 백운동ㆍ방림동에서 차량 두 대에 추가로 불을 질렀다. 인명피해는 없었지만, 경찰 추산 3000만원의 재산피해가 발생했다.김씨는 경찰 조사에서 “스트레스를 풀기 위해 불을 저질렀다”고 진술한 것으로 전해졌다."
2024-08-20,“전기차에서 연기가!” 지하 아파트 119 출동…알고보니 매연,"지난 13일 오전 인천 연수구 송도2동 행정복지센터 주차장에서 열린 전기자동차 화재대응 민·관 합동 교육에서 소방관들이 질식소화포와 전기차 수조탱크를 이용한 전기차 화재 진압 모의 시연을 하고 있다. 연합뉴스아파트 지하 주차장의 차량 매연을 착각해 전기차 화재로 오인 신고해 소방당국이 출동하는 소동이 빚어졌다.20일 광주 남부소방서 등에 따르면 이날 오전 9시께 광주광역시 남구 방림동 한 아파트 지하 주차장에서 “전기차에서 연기가 난다”는 주민 신고가 119상황실에 접수됐다.신고받고 출동한 소방당국이 현장 확인한 결과 연기는 전기차가 아닌 다른 차량에서 나왔던 매연인 것으로 파악됐다. 소방당국은 주차장 내 화재 차량은 없는 것으로 확인했다.불이 난 상황이 아니었는데도 아파트 주민 10여명이 소란에 놀라 집 밖으로 나오기도 했다.지하 주차장 폐쇄회로(CC)TV를 확인한 소방당국은 해당 사안을 오인 신고로 판단하고 다른 화재 요인은 없는지 살핀 뒤 현장에서 철수했다.남부소방서 관계자는 “미세하게 연기가 나긴 했어도 화재 징후는 없었다”고 말했다.앞서 이달 1일 오전 인천 서구 청라동 한 아파트 지하주차장에 세워진 벤츠 전기차에서 폭발 화재가 나 8시간20분 만에 진화됐다. 이 불로 입주민 등 22명이 단순 연기를 흡입했으며, 차량 87대가 불에 타고 793대가 그을리는 큰 불편을 겪었다. 이를 계기로 전기차를 기피하려는 ‘포비아’(공포증) 움직임이 확산하고 있다."
2024-08-14,"대프리카 뺨친 광프리카…""끔찍"" 동남아 유학생도 치 떨었다","광주시내 폭염 취약지역으로 꼽히는 남구 방림동의 고물상 주변 모습. 천권필 기자""  동남아시아는 비가 오면 잠깐 시원해지는데 광주는 그런 게 전혀 없어요. 너무 더워서 못 견디겠어요.  ""광주광역시에서 10년째 유학 중인 말레이시아인 케리(34)씨는 올여름을 나기가 유독 힘들다고 했다. 밤 10시에 강아지와 산책하러 나가도 열대야 탓에 금세 집에 돌아와 에어컨을 켠다. 그는 “말레이시아에서는 그래도 밤에는 시원했는데 여기는 자정에 나가도 똑같이 더워서 끔찍하다”며 “올해 더위는 정상적이지 않은 것 같다”고 말했다.━온도·습도 동시에 상승 ‘더위의 가속화’광주시내 폭염 취약지역으로 꼽히는 남구 방림동 일대. 천권필 기자말레이시아 출신 유학생이 놀랄 정도인 이번 폭염의 원인 중 하나는 습도다. 2000년대 이후 한반도의 기온과 습도가 동시에 오르면서 체감 더위의 기세가 가파르게 상승하고 있는 것으로 조사됐다. 윤진호 광주과학기술원 교수팀이 2000년부터 지난해까지 국내 59개 기상청 관측소의 기온 및 습도를 분석한 결과다.윤 교수에 따르면, 습구온도(공기중 상대습도를 반영한 온도)는 최근 12년(2012~2023년) 여름 평균 25.93도로 과거 12년(2000~2011년)의 24.95도보다 1도가량(0.98도) 올랐다. 온난화로 인한 최고기온 증가폭(0.72도)보다 1.4배 빠른 상승 추세다.습구온도가 높으면 땀을 통해 열을 식히기 어려워 열사병 같은 심각한 건강 문제를 유발한다. 전문가들은 통상 습구온도 35도가 되면 인간의 자체 냉각 시스템이 한계에 도달하는 것으로 보고 있다. 올여름도 습한 폭염과 열대야로 인해 12일까지 지난해보다 많은 2407명의 온열질환자가 발생하고 21명이 사망했다. 가축도 70만 마리 이상이 찜통더위를 견디지 못하고 폐사했다.윤 교수는 “21세기 이후 한반도와 중국 해안 지역, 일본을 중심으로 습구온도가 기온보다 가파르게 상승하는 현상이 뚜렷하게 확인되고 있다”며 “동아시아 쪽으로 북태평양고기압 세력이 강해지면서 남서풍을 따라 수증기 유입이 많아진 데다 한반도 주변 해수면 온도가 높은 것도 원인”이라고 설명했다.━“비 오면 더 힘들다” 찜통폭염에도 파지 줍는 노인들광주광역시 남구 방림동에서 한 노인이 폭염 속에 리어카를 끌고 파지를 줍고 있다. 천권필 기자고온다습한 남서풍의 영향을 많이 받는 습한 도시일수록 더위의 강도는 더 강해졌다. 최근 ‘광프리카(광주+아프리카)’로 불리는 광주광역시가 대표적이다.30년 이상 된 노후 주택이 밀집돼 있고 노령 인구까지 많은 광주시의 구도심 지역은 찜통폭염에 사실상 무방비 상태다. 도시 열섬 현상을 완화하기 위한 녹지가 부족해 열기가 빠져나가지 못하고 쌓인다. 광주 남구 방림동의 한 고물상에는 숨도 쉬기 어려운 무더위 속에서도 노인들이 리어카에 파지를 가득 채워 왔다. 온열지수를 측정해보니 32를 기록해 ‘매우위험(31 이상)’ 기준을 초과했다.유모씨(80)는 “비가 와도 더위가 식지 않고 땅에서 습기가 올라와 더 힘들다”며 “마스크에 금세 땀이 차서 하루에 3개씩 갈아 쓰면서 파지를 주우러 다닌다”고 말했다. 고물상 주인도 “더위를 견디지 못하고 쓰러지는 노인도 있다”고 했다.━체감 폭염일수 30년새 2.5배 증가 “광주는 습식 사우나”정근영 디자이너광주의 무더위는 데이터로도 입증된다. 기상청으로부터 이달 7일을 기준으로 최근 10년간(2015~2024년) 전국 66개 지역의 여름철(5~9월) 체감온도 자료를 받아 비교해보니, 광주가 29.52도로 1위를 차지했다. 강원 태백시(24.94도)와 비교하면 5도 가까이 높았다. 이어 전북 전주·대전·경북 구미가 뒤를 이었다. 대구는 11위에 그쳤다. 체감온도는 기온과 습구온도 등을 토대로 인간이 느끼는 더위를 수치로 계산한 것이다.체감 33도 이상을 기록한 폭염일수 역시 광주는 최근 5년(2020~2024년) 평균 30.6일로 30년 전(1990~1994년)보다 2.5배 증가했다. 같은 기간 1.5배 늘어난 대구(25.6일)를 역전했다.광주 및 대구의 체감 33도 이상 폭염일수 비교. 기상청 제공김연수 광주연구원 연구위원은 “대구가 건식 사우나라면 광주는 습식 사우나에 비유할 수 있다”며 “해안가에 가까워 남서풍 영향을 많이 받고 강수량도 많아서 체감온도로 보면 광주가 훨씬 더 덥다고 볼 수 있다”고 설명했다.시에서는 도심 내 인공 그늘막을 늘리는 등 강력해진 폭염에 대비하기 위해 다양한 대책을 내놓고 있다. 하지만, 습한 폭염으로 인한 열 스트레스를 막기에는 한계가 있다는 지적이다. 특히 폭염 대책이 가장 더운 낮 시간대에 집중돼 열대야 등 밤까지 이어지는 열기에 대한 대비책이 시급하다. 김 연구위원은 “온열 질환자가 낮뿐만 아니라 아침과 밤에도 발생하고 있다. 24시간 일하는 택배 기사 등 야간 근로자들의 온열질환을 예방할 수 있는 폭염 대책도 필요하다”고 말했다.━“열 스트레스로 3000조 손실”…도시 내열화 시급전 세계적으로도 심각해지는 열 스트레스에 대비해 도시의 내열화(Heat-proof)가 필요하다는 경고가 나온다. 국제노동기구(ILO)는 최근 발표한 보고서에서 열 스트레스의 영향으로 노동 생산성이 저하되면서 2030년까지 세계 경제에 2조 4000억 달러(3289조 원)의 손실을 가져올 것으로 예상했다.안토니우 구테흐스 유엔 사무총장은 최근 “점점 더 치명적인 폭염으로 수십억 명의 사람들이 극심한 더위에 직면하고 있다”며 “도시 설계를 통해 온도를 낮추고, 냉방 기술의 효율성을 높이는 등 상승하는 기온에 맞서야 한다”고 했다."
