date,title,content
2023-07-06,"검찰, ‘5종목 하한가’ 주식카페 운영자 구속영장",서울남부지검 /뉴스1검찰이 ‘5개 종목 하한가 사태’와 연루됐다는 의혹을 받는 주식정보 카페 운영자 강모(52)씨 등에 대해 6일 구속영장을 청구했다.서울남부지검·금융위원회·금융감독원 합동수사팀은 이날 동일산업·동일금속·만호제강·대한방직·방림 등 5개 종목에 대해 시세조종 행위를 한 혐의(자본시장법 위반)를 받는 강모씨 등 3명에 대해 사전구속영장을 청구했다고 밝혔다.검찰에 따르면 강씨 등은 2020년 1월부터 지난 5월까지 해당 종목들의 주문을 반복하며 통정거래 등 시세조종 행위로 359억원 상당의 부당이득을 취득한 혐의를 받는다.강씨는 하한가 사태의 배경으로 지목된 네이버 주식카페의 운영자다. 이 카페에서 강씨는 주가가 폭락한 5개 종목을 추천하는 등 자주 언급했다고 한다.강씨는 지난 2014년~2015년 조광피혁 등 여러 종목의 시세를 조종한 혐의로 기소돼 지난해 징역 2년·집행유예 4년·벌금 4억원을 선고받은 전력이 있다.검찰과 금융당국은 주가 폭락에 앞서 불공정 거래 여부를 주시해왔다. 하한가 사태 이튿날인 지난달 15일 강씨 사무실을 압수수색하며 강제수사에 들어갔다.
2023-06-16,‘5종목 하한가’ 온라인 카페 운영자 출국금지,"5개 종목 무더기 하한가 사태와 관련, 15일 서울남부지검이 시세조종 의혹을 받는 온라인 주식카페 운영자 강모(52)씨를 비롯한 관련자들을 출국금지했다.또 강씨의 주거지를 압수 수색해 주식 거래 관련 자료를 확보했다.동일산업·만호제강·대한방직·방림·동일금속 등 5종목 주가는 지난 14일 가격 제한 폭(-30%)까지 급락했다. 모두 시가총액 1000억~3000억원대 중소형주인 데다 대주주 지분율이 높아 시세 조종 대상이 되기 쉬운 공통점이 있는 종목들이다. 5종목의 거래는 투자자 보호를 위해 15일부터 무기한 정지됐다.강씨는 2012년부터 네이버의 주식카페인 B투자연구소에 이번에 폭락한 종목들을 추천하는 내용을 포함해 2000건 넘는 글을 올렸다. ‘만호제강, 최대 주주와 소수 주주가 함께 승자가 되는 법’ ‘동일금속 전년 대비 영업이익 568% 증가 공시’ 등의 글이었다.강씨는 이날 본지 통화에서 “카페 회원들과 증권사 대출을 받아 투자했는데SG증권발 주가 폭락 사태 이후 증권사들이 대출을 연장해주지 않는 바람에 회원들이 견디지 못하고 주식을 팔게 된 것”이라며 증권사들에 책임을 돌렸다. “3년 전부터 증권사 대출을 끼고 총 300억원을 투자했지만 다 날리고 빚만 100억원이 됐다. 두 딸을 비롯해 큰누나, 작은 매형, 처형까지 반대매매로 인해 깡통계좌가 됐다”고도 했다."
2023-04-18,주차 차량에 연쇄 방화 40대 항소심서도 실형,"법원 로고. /조선DB도심에 주차된 차량에 상습적으로 불을 지른 혐의로 기소된 40대가 항소심에서도 실형을 선고받았다. 광주고법 형사1부(재판장 박혜선)는 일반자동차 방화 혐의로 기소돼 1심에서 징역 2년6개월을 선고받은 40대 남성 A씨의 항소를 기각했다고 18일 밝혔다.A씨는 지난해 9월23~26일 3차례에 걸쳐 광주광역시 남구 봉선동·백운동·방림동에 주차된 차량 3대에 잇따라 불을 지른 혐의로 기소됐다. 이 불로 인명피해는 발생하지 않았지만 차량이 모두 불타 경찰서 추산 3000만원의 재산피해가 발생했다.A씨는 자신이 신고한 절도 피해 사건을 경찰이 제대로 수사하지 않는다고 생각해 헌옷 수거함에서 의류 등을 꺼내 쌓은 뒤 무작위로 고른 차량에 불을 지른 것으로 조사됐다. A씨는 앞서 같은 종류의 범죄를 수차례 저질러 6차례 징역형을 선고받았다.항소심 재판부는 “피해자들의 재산 피해가 비교적 크고, 공공에 대한 위험도 적지 않았다”며 “동종 범행의 누범기간에 범행하고 피해 회복을 위한 충분한 노력을 했다고도 보이지 않는다”고 밝혔다."
2023-02-10,"“에너지 산단에 기업 29개 입주 예정, 경제 활력 불어넣겠다”","[기초단체장에게 듣는다] 김병내 광주 남구청장광주남구는 그동안 교육·문화 분야에 행정력을 집중해 왔다. ‘광주교육1번지’로 각광받는 봉선·진월지구, 역사문화 자원이 풍부한 양림동 일대가 주된 무대였다. 그러나 최근 백운광장의 고가도로가 철거된 이후 광장 일대가 획기적으로 변하고, 대촌동 일대에는 산업단지가 들어서고 있다. 재선한 김병내(49) 광주남구청장은 지난 8일 본지 인터뷰에서 “사람과 경제가 집중되도록 백운광장 일대를 크게 변모시키고 있다”며 “산업단지 조성과 기업 유치를 통해 불모지였던 경제에 활력을 불어넣겠다”고 밝혔다.-’핫플’ 백운광장 일대에 어떤 변화가 있는가.“사람과 문화, 경제가 어우러진 공간으로 바뀌고 있다. 이달 중 구청사에 초대형 미디어월을 선보인다. 역동적인 다양한 콘텐츠를 선보이게 된다. 백운광장 앞에서 진월동과 남광주역 푸른길 산책로가 끊어져 있다. 연말까지 산책로를 연결하는 브리지(206m)를 개통하겠다. 도시철도 2호선이 완공되면 백운광장역에서 남구청사와 산책로 양방향으로 자유롭게 이동할 수 있다.”-산업지대로도 변모하는 것 같다.“대촌 지역 도시첨단산단이 작년 완공됐고, 75%가량 분양됐다. 바로 옆 에너지밸리산단도 오는 6월 마무리되는데, 57%가량 분양했다. 첨단산단에는 한국전기연구원, 한국기초과학지원연구원 등이 입주했고, 연료전지 분야 기업 등이 추가로 들어올 예정이다. 에너지산단에는 29개 기업이 입주를 준비 중이다. 두 산단이 자유경제구역으로 지정되었다. 에너지 분야 클러스터로서 면모를 갖추고 있다. 관련 기업들을 적극 유치해 안정적인 일자리를 창출하겠다.”-양림동 등 역사자원을 어떻게 활용할 것인가.“2018년부터 200억원을 들여 도시재생사업을 추진하고 있다. 주민어울림센터, 문화교류센터, 공영주차장을 세웠다. 올해에는 거리책방도 조성한다. ‘굿모닝 양림 축제’와 ‘크리스마스 트리 문화축제’까지 더하겠다. 송하동에선 실감콘텐츠큐브가 문을 열었다. 문화산업 경쟁력을 강화하는 핵심 시설인 이 큐브와 양림동, 아시아문화전당으로 이어지는 관광로드를 구축해 활력을 불어넣겠다.”-생활인프라 구축도 필요하다.“곳곳에 도서관이나 주차장, 문화센터 등을 연계한 시설 등을 짓고 있다. 노대동에 가족사랑 나눔센터, 자활센터, 효천문화복합 커뮤니티 센터를 짓고 있다. 방림2동과 사직동에 생활문화센터 등을 건립 중이다. 월산근린공원에 장애인과 비장애인이 함께 이용하는 반다비 체육관, 도심야영장, 탐방길도 조성한다. 지난해 문을 연 진월종합운동장에 이어 국민체육센터를 세우고 있다.” 권경안 기자"
2022-10-07,[방방곡곡] 나무 600만그루 심어 제주 도심에 숲 조성,"제주 도심지에 600만 그루를 심어 도심숲을 조성한다.제주도는 앞으로 5년간 663억원의 예산을 들여 참꽃나무와 상수리나무 등 600만 그루의 나무를 제주시와 서귀포시 도심지에 심을 계획이라고 6일 밝혔다.제주 도심에 600만 그루의 나무를 심게 되면 2만6100t의 탄소를 흡수하고 승용차 1만875대의 배출가스를 감축하는 효과가 있다고 제주도는 설명했다.우선 도시바람길숲, 복지시설 나눔숲, 녹색쌈지숲 등 다양한 유형의 도시숲 확충을 위해 228만5000 그루를 심는다. 또 2023년부터 제주시 서부공원에 기후 대응 도시숲 8만㎡를 조성하는 등 장기 미집행 도시공원에 연차적으로 23만1000그루를 심는다.특히 국유림과 공유림, 오름 등 곳곳에 분포된 삼나무를 다른 나무로 대체해 심는다. 제주에는 삼나무가 4340만㎡에 걸쳐 자라고 있다. 이를 효율적으로 활용할 수 있는 상수리나무, 참식나무, 붉가시나무 등 향토수종으로 10여 년에 걸쳐 바꿔나갈 계획이다. 상수리나무는 소나무보다도 탄소 흡수력이 1.8배나 높고 표고버섯 재배용 목재로도 많이 사용돼 주민들의 소득 증대에도 기여할 것으로 제주도는 보고 있다.다만, 사려니숲길과 절물휴양림 등 관광자원화되었거나, 감귤 과수원 방림으로 활용되는 삼나무는 베지 않고 보존할 계획이다.허문정 제주도 환경보전국장은 “올해는 제주 인공조림 100주년을 맞는 해로 녹색 도시 정책을 추진하고 있다”며 “제주 도심지에 활력과 생명력을 유지하도록 체계적이고 효율적으로 숲을 조성하고 관리하겠다”고 말했다."
2022-07-15,"광주 2호선 개통 3년 늦어질 듯… 시민들, 교통난에 분통","시장직 인수위 “전임 때 공사 지연 알려지지 않아”광주시가 시 도시철도 2호선 1단계 구간 일부인 동구 필문대로상에 복공판을 설치, 공사하고 있다. 시민들은 특히 출퇴근 때 교통 불편을 심하게 겪고 있다. /연합뉴스“지하철 개통이 늦어진다니, 그게 무슨 소리죠?”광주광역시 북구 두암동에 사는 김모(58) 씨는 14일 “시내 도로가 공사판인데 언제까지 공사를 계속한다는 것이냐”고 목소리를 높였다. 그는 2023년쯤 지하철 2호선이 개통되는 것으로 알고, 2호선이 지나가게 되는 남구 방림동으로 오는 9월 이사할 예정이다. 그는 공사에 따른 불편은 감수하겠다고 생각했지만 개통이 3년 이상 늦어진다는 소식을 듣고는 분통을 터뜨렸다.광주광역시는 2019년부터 도시철도 2호선 1단계 공사를 벌이고 있다. 현재 공사 진척도는 38%다. 1단계 구간을 6공구로 나눠 공사하고 있다. 1단계 구간은 차량 기지(서구 유덕동)~시청~상무역~월드컵 경기장~백운광장~조선대~광주역(17.0㎞)이다. 상무대로(서구 상무역~운천저수지)는 9차로 중 세 차로에 차단 시설과 복공판을 설치, 지하에 철제 기둥을 박거나 흙을 파내고 있다. 상무대로를 비롯, 필문대로(북구 풍향동 사거리~동구 학동 남광주 교차로), 월드컵 경기장(서구 풍암동), 백운광장(남구 백운동) 일대 등 시내 곳곳에서 공사가 벌어져 시민들이 교통 불편을 겪고 있다.지금까지 광주시는 지하철 2호선(총연장 41.84㎞)을 오는 2024년까지 완공한다는 계획(총사업비 2조2008억원, 국비 60%, 시비 30%, 지방채 10%)으로 3단계로 나눠 추진해왔다. 1단계는 2023년, 2~3단계는 2024년까지 완공할 예정이었다. 2단계는 광주역~전남대~일곡지구~첨단지구~수완지구~운남지구~차량기지(20.0㎞), 3단계는 백운광장~효천지구(4.84㎞)이다.그동안 시민들은 완공 시기를 개통 시기로 받아들여 왔다. 그러나 오는 20일까지 활동하는 광주시장직인수위가 이 계획은 ‘실현 불가능’하다고 진단했다. 인수위는 시정 전반에 대한 평가·진단을 하면서 전임 시장 때부터 추진돼온 지하철 2호선 건설 사업이 지연될 수 있는데 그동안 시민들에게 알려지지 않았다고 밝혔다. 인수위는 “지하철 건설을 담당한 실무 부서와 함께 종합 진단한 결과 1단계는 2025년 말 완공한 뒤 1년간의 모의 주행 기간을 거쳐 2026년 이후 개통이 가능하다”고 밝혔다. 최소 3년이 지연된다는 것이다. 인수위는 2단계는 5년 이상 늦어지고, 3단계는 타당성 검토 후 재결정될 것으로 보여 착공 여부조차 불투명하다고 지적했다.이처럼 공기가 지연되는 데는 여러 이유가 있다. 1단계는 일부 구간(광주천 통과 구간)을 당초 계획 7m에서 12m로 더 깊이 파야 하고, 여러 구간에서 예상치 못했던 통신선로·상수관로 등 장애물이 돌출했다. 이에 따라 공법을 바꾸느라 공사가 늦어지고, 공사비 증가분도 확보되지 않아 공기 지연을 부채질하고 있다.2단계 구간은 착공도 못 하고 있다. 정부와 협의를 통해 사업비를 확정해야 하는데 아직 못했기 때문이다. 계획대로라면 최소 1년 6개월 이전에 사업비를 확정해야 했다. 2단계 구간 중, 당초 지상 구간이었던 첨단지구 교차로, 임방울대로 일부, 광신대교(영산강 통과 구간) 등 세 구간(3.1㎞)을 지하화하기로 설계도 변경했다. 시 도시철도건설본부는 “설계 변경, 자재·인건비를 포함한 물가 상승분 등을 반영해 최소 7000억원 증액이 필요하다”고 했다. 당초 계획된 총사업비 2조2008억원을 크게 늘려야 한다는 뜻이다. 3단계 지선 구간은 사업비 2022억원 가운데 현재 5억원밖에 확보되지 않았다.2호선 개통 시기가 늦어지게 됐다는 진단이 알려지자, 시민들은 불만을 드러내고 있다. 특히 3단계 구간 부근에 사는 시민들은 “지하철이 안 될 수도 있는 것 아니냐”고 우려하고 있다. 상무지구에서 음식점을 운영하는 윤모(54)씨는 “공사 때문에 통행 불편으로 손님이 떨어져 힘든데 더 참아야 하느냐”고 했다. 공인중개사 김모(59)씨는 “2호선 구간에서 역세권을 형성할 것으로 보고 부동산을 거래했던 시민들은 크게 실망하고 있다”고 말했다. 광주시는 “올해 예산을 확보하고 공사 기간을 최대한 앞당기도록 노력하겠다”고 밝혔다."
2022-07-14,전남대병원서 뇌사자 4명 잇따라 장기 기증… 10명에 ‘새 생명’,"최근 전남대병원에서 장기 기증을 한 생전의 장영근(우측) 씨와 동생 주섭씨. /전남대병원 제공광주광역시 남구 방림동과 봉선동 일대에서 폐지를 주우며 동네 청소까지 하던 장영근(67) 씨는 지난 달 6일 자전거를 타다 쓰러져 뇌사 판정을 받았다. 그는 환자 2명에 신장을 기증, 새생명을 선물하고 떠났다.장씨의 동생 주섭(64)씨는 “형님이 돌아가신 후 동네 편의점에 들렀더니, 주민 분들이 ‘형님이 안보여 걱정했다’며 안부를 물었고, 함께 슬퍼해줬다”며 “평생 공장에서 일하고 폐지를 주우며 동생의 학비까지 보태준 착한 형님이 하늘나라에서 편히 쉬셨으면 좋겠다”고 했다.전남대병원에 따르면, 장씨를 비롯해 최근 뇌사 판정을 받은 50~60대 기증자 4명이 모두 10명에게 새 생명을 선물하고 세상을 떠났다.김양신(58)씨는 지난달 13일 집에서 쓰러진 채로 발견된 후 뇌사에 빠졌다. 가족들이 장기기증에 동의해 같은 달 17일 3명의 환자들에게 간장과 신장을 기증했다. 김씨의 동생 양민(57)씨는 “형님과 명절에TV를 보다가 장기기증과 관련된 프로그램을 시청하며 ‘기증이 의미있겠다’라고 했던 말씀이 떠올라 병원 측 제안에 동의했다”고 말했다.또, 엄모(여·55) 씨와 김모(60) 씨도 각각 지난 달 3명과 2명에게 간장과 신장 등을 기증했다.전남대병원 장기이식센터 최수진나(이식혈관외과 교수) 소장은 “장기 이식을 기다리고 있는 대기자가 연간 4만명이고, 대기 중에 사망하는 환자는 하루에 6명 가량”이라며 “누군가의 생명을 잇는 장기 기증 문화가 더욱 확산됐으면 좋겠다”고 말했다."
2023-06-30,"‘무더기 하한가’ 동일산업 등 5종목, 다음주부터 거래 재개","금융위원회 내부 (금융위원회 제공) 2021.4.14/뉴스1최근 무더기 하한가 사태를 맞았던 동일산업 등 5개 종목에 대한 매매거래 정지가 다음주부터 풀린다.금융위원회와 한국거래소는 30일 “다음달 3일부터 동일산업, 대한방직, 만호제강, 방림, 동일금속 등 5개 종목에 대한 매매거래 정지 조치를 해제하기로 했다”고 밝혔다.지난 14일 이들 5개 종목은 장중에 갑자기 급락해 모두 하한가를 기록했고, 거래소는 다음날인 15일부터 해당 종목에 대한 거래를 정지시켰다. 지난 4월 발생한 ‘SG증권발 폭락 사태’같은 연속 하한가 사태를 막기 위한 조치였다.당시 하한가 사태 배후에 시세조종 세력이 있다는 의혹이 일었고, 이후 검찰은 이 의혹의 핵심 인물인 온라인 주식카페 운영자 강모(52)씨를 비롯한 관련자들을 출국금지했다. 또 강씨의 주거지를 압수 수색해 주식 거래 관련 자료를 확보했다.금융당국 관계자는 “향후에도 금융당국 및 한국거래소는 유관기관 간 긴밀한 협업을 통해 시장질서 교란세력에 대해 단호히 대응하는 등 투자자 보호 및 주식시장 안정을 위해 최선의 노력을 다하겠다”고 말했다."
2023-06-28,주가 폭락한 그 회사들… 증권사는 3년간 한번도 안 들여다봤다,"올해 주가 폭락 기업들 대부분 해당… 깜깜이 투자가 사태 키워국내 상장사 10곳 중 6곳 꼴로 지난 1년 동안 증권가의 애널리스트 보고서가 전무(全無)했던 것으로 나타났다. 애널리스트 보고서는 투자자 입장에서 회사의 주가가 적정한지를 판단할 수 있는 기준 역할을 한다. 상당수 투자자들이 전문가들의 분석이 없는 기업에 깜깜이 투자를 하고 있는 셈이다.지난 4월 8개 종목이 최장 나흘 연속 폭락한 ‘SG증권발 폭락 사태’나 지난 14일 발생한 ‘5종목 하한가 사태’의 피해자들도 이런 ‘정보의 공백’ 상태에서 시세조종 세력에 현혹됐을 가능성이 높다. 금융투자 업계에선 “작전 세력에 언제든 이용당할 수 있는 종목들이 도처에 지뢰처럼 깔려있다”는 말이 나온다.일러스트=백형선그래픽=백형선그래픽=백형선그래픽=백형선대형·인기 주에 쏠리는 보고서27일 금융정보업체 에프앤가이드에 따르면, 지난 1년간 국내 증권사들의 애널리스트 보고서가 1건이라도 나온 회사는 1035곳으로 전체 상장사(2598곳)의 약 40%에 그쳤다. 같은 기간 10건 이상의 보고서가 나온 곳은 362곳(14%)에 불과했다. 한 달에 한 번 정도로 현재 주가가 적정한지 체크할 수 있는 상장사가 전체의 7분의 1도 안 된다는 뜻이다.애널리스트 보고서는 삼성전자 같은 대형 주나 각 업종의 대표 종목에 쏠려 있었다. 보고서 숫자 상위 1~5위는 삼성전자(247건),LG에너지솔루션(182건),SK하이닉스(180건),LG전자(169건),LG이노텍(160건)이었다. 또 보고서 수 상위 10종목 가운데LG이노텍과 엔씨소프트를 제외한 8종목은 모두 시가총액이 10조원 이상이었다.LG이노텍과 엔씨소프트는 각각IT부품과 게임 업종의 대표 주다.반면 거래량이 작은 중소형 주들은 대체로 보고서가 적거나 아예 없었다. 최근 주가 조작의 타깃이 된 종목들이 대표적이다. 지난 14일 하한가를 맞은 5종목(동일산업·동일금속·방림·대한방직·만호제강)의 경우 주가가 오르기 시작한 2020년 초부터 3년여 동안 보고서 수가 ‘제로(0)’였다. 지난 4월 무더기 하한가를 맞은 8종목 중에서도 4종목(대성홀딩스, 세방, 선광, 다우데이타)은 최근 4년간 분석 보고서가 없었다.매도 의견은 0.07%에 불과종목 보고서엔 해당 업종을 오랫동안 분석해 온 애널리스트가 주가수익비율(PER), 주가순자산비율(PBR) 등 전문 지표를 기초로 산출한 ‘목표(적정) 주가’가 기재되고, 투자자는 이를 바탕으로 투자 여부를 판단한다. 보고서가 없는 종목은 풍문이나 소셜미디어에 도는 일방적 주장에 따라 주가가 출렁이게 된다.SG사태와 관련, 주가조작 혐의로 구속 기소된 라덕연씨는 투자 설명회에서 “핵폭탄처럼 모든 (추천) 종목이 오를 것”이라고 주장했다. 한 증시 전문가는 “주가 조작 세력이 일부러 ‘정보 부족’ 종목을 노리는 것”이라고 말했다.보고서에 기업 주가가 너무 비싸다는 ‘매도 의견’이 거의 없다는 점도 문제다. 강병원 더불어민주당 의원실 자료에 따르면, 작년 1년간 국내 증권사들이 발간한 종목 보고서 총 4329건 가운데 매도 의견을 낸 것은 3건(0.07%)에 불과했다. 회사채 발행이나 기업공개(IPO), 인수합병(M&A) 등 기업들에 금융 서비스를 제공하는 증권사들이 ‘잠재적 고객’인 기업에 불리한 보고서를 내지 않는 관행 때문이다.일부 애널리스트는 보고서를 이용해 부정한 돈을 벌기도 한다. 금융감독원 자본시장 특별사법경찰은 증권사 애널리스트 A씨의 부정거래 혐의를 수사해 기소 의견으로 검찰에 송치했다고 27일 밝혔다. A씨는 본인이 ‘매수 보고서’를 내기 전에 해당 종목 주식을 샀다가, 보고서 발간 후 주가가 오르면 파는 방식으로 5억원 넘는 부당이득을 챙긴 혐의다.모든 애널리스트들이 불법에 동조하거나 침묵하는 것은 아니다. 유진투자증권의 황성현 연구원은 작년 11월 삼천리에 대해 ‘매도 보고서’를 냈다. 당시 삼천리 주가가 약 38만원일 때 목표 주가를 3분의 1 수준인 11만원으로 대폭 낮춘 것이다. 삼천리는 지난 4월SG증권발 무더기 하한가 사태 때 주가가 폭락한 종목 중 하나다. 황 연구원은 본지 통화에서 “삼천리는 가스 유통업체로 한국가스공사와 일반 소비자 사이에서 중간 마진을 챙기는 사업이라, 성장성이 제한돼 있다”며 “당시 비합리적인 수준으로 주가가 올라 소신대로 의견을 쓴 것”이라고 했다."
2023-06-18,"검찰 “5종목 주가폭락 사태 카페 운영자, 104억원 부당이득”","지난 14일 오후 12시쯤 비슷한 시간대에 하한가를 기록한 동일산업, 만호제강, 대한방직, 동일금속, 방림 종목에 대해 금융당국이 15일부터 해제 필요시까지 매매 거래를 정지했다. 방림, 만호제강, 동일금속 3개 종목은 소수 계좌 거래 집중에 따른 투자주의 종목으로도 지정했다./뉴시스검찰은 ‘5개 종목 무더기 하한가 사태’와 관련해 시세조종 의혹을 받는 강모(52)씨가 104억원의 부당 이익을 취한 것으로 추정 중이라고 18일 밝혔다. 서울남부지검은 지난 15~16일 강씨의 주거지와 사무실을 압수수색하면서 영장에 이 같은 혐의 사실을 적시한 것으로 알려졌다.온라인 주식정보 카페 운영자인 강씨는 카페 회원들에게 폭락한 종목들을 매수하도록 권유해왔던 것으로 알려졌다. 강씨가 지목한 동일산업·만호제강·대한방직·방림·동일금속 등 5종목 주가는 지난 14일 가격 제한 폭(-30%)까지 급락했다. 모두 시가총액 1000억~3000억원대 중·소형주인 데다 대주주 지분율이 높아 시세 조종 대상이 되기 쉬운 공통점이 있는 종목들이다.강씨는 지난 2014년~2015년 조광피혁 등 여러 종목의 시세를 조종한 혐의로 기소돼 지난해 징역 2년·집행유예 4년·벌금 4억원을 선고받은 전력이 있다.검찰 관계자는 “강씨 등에 대한 수사 사안이 급박해 104억원 부당이익 등은 현 단계에서 추정적으로 적시한 것”이라며 “수사가 진행됨에 따라 부당이득의 규모와 범행 시기 등은 변동될 수 있다”고 밝혔다."
