date,title,content
2022-03-29,김종섭 서울대 총동창회장,"김종섭(75) 스페코·삼익악기 그룹 회장이 28일 서울 삼성동 코엑스에서 열린 서울대학교 총동창회 정기총회에서 29대 총동창회장으로 선출됐다. 1970년 서울대 사회복지학과를 졸업한 김 회장은 1979년 아스팔트 플랜트 기업인 스페코를 창업했고, 2002년엔 삼익악기를 인수했다. 그는 대한적십자사 부총재, 서울대 총동창회 상임부회장 등을 지내며 적십자와 서울대 장학 사업 등에 약 140억원을 기부했다."
2024-02-15,[경제포커스] ‘자사주 소각’ 더 촉진하려면,"기업엔 경영권 방어 ‘방패’소액주주에겐 ‘새 창’ 부여‘한국 증시 제값 받기’엔증시 제도 선진화도 필요윤석열 대통령이 지난달 2일 서울 여의도 한국거래소에서 열린 2024 증권ㆍ파생상품시장 개장식에 참석했다. 정부는 '코리아 디스카운트 해소를 위해 이달 중 기업의 주주 환원을 독려하는 내용의 '기업 밸류업' 프로그램을 발표할 예정이다.삼성물산 1조원대,SK이노베이션 7936억원, 기아 5000억원, 하나금융지주 3000억원, 우리금융지주 1364억원,HD현대인프라코어 560억원… 주요 상장 기업들이 대규모 자사주 소각 계획을 잇달아 발표하고 있다. 정부가 ‘코리아 디스카운트’ 해소를 위해 기업에 주주 환원을 독려하는 ‘기업 밸류업’ 계획을 준비 중인데, 기업들이 보조를 맞춰 선제적으로 자사주 소각 방침을 밝히고 있는 것이다.현재 국내 2499개 상장 기업이 보유한 자사주는 63조원어치에 이른다. 기업들이 자사주를 대량 보유 중인 이유는 경영권 방어 수단이 되기 때문이다. 자사주는 의결권이 없지만, 자사주를 백기사(우호 주주)에게 매각하면 의결권이 살아나 경영권 방어 무기로 쓸 수 있다. 2003년SK가 소버린 펀드로부터 경영권 공격을 받았을 때, 2015년 삼성물산이 엘리엇과 싸울 때 자사주를 활용해 경영권 방어에 성공한 바 있다.기업의 자사주 소각은 주주 환원 확대라는 측면에서 바람직하다. 주식 물량을 줄여 기존 주주에게 주식을 배당하는 것과 유사한 효과를 낳기 때문이다. 하지만 자사주 소각은 기업 경영권 방어력과 미래 투자 여력을 해치는 부작용을 초래할 수 있다. 이런 우려를 불식하고 기업들이 경영권 방어에 대한 걱정 없이 자사주 소각에 적극 나설 수 있도록 제도를 정비할 필요가 있다.대부분의 선진국은 적대적 기업 인수합병(M&A)이나 경영권 침해 시도가 있을 때, 대주주에게 시가보다 싼 가격에 신주를 발행하는 ‘포이즌 필’이나, 특정 주주의 주식에 더 많은 의결권을 부여하는 ‘차등의결권’,주식 수량과 관계없이 거부권 행사 권리를 가진 ‘황금주’ 같은 제도를 운영하고 있다. 페이스북 창업자 마크 저커버그는 20% 지분으로 60% 의결권을 행사하며 경영권을 지킨다. 워런 버핏은 200배의 차등의결권으로 버크셔해서웨이의 경영권을 보호하고 있다. 171년 전통의 미국 피아노 제조 기업 스타인웨이는 2010년 한국의 삼익악기와 헤지펀드로부터 경영권 공격을 받았을 때 포이즌 필로 막아냈다. 주요국 가운데 이 같은 경영권 방어 수단이 하나도 없는 나라는 한국뿐이다.기업에 경영권 방어를 위한 새 방패를 제공한다면 소액주주들에겐 기업의 전횡에 제동을 걸 ‘새 창’을 줘야 형평에 맞을 것이다. 주가 조작, 회계 분식 등 기업의 일탈에 소액주주가 대응할 수 있는 대표적 무기는 집단소송이다. 그런데 2005년 제도 도입 후 20년이 흘렀는데 지금까지 증권 집단소송은 11건에 불과하다. 제도의 장벽이 너무 높기 때문이다.증권 집단소송은 법원에 소송 허가 신청서를 제출하고 허가를 받아야 시작할 수 있다. 기업이 이의 제기(즉시 항고)를 하면 집단소송의 대상이 되는지를 놓고 1심, 2심, 대법원까지 3차례 재판을 받아야 소 제기 여부가 결정된다. 사실상 6심제인 셈이다. 2011년 방송·통신장비업체 씨모텍의 주가조작 사건의 경우 피해자들이 집단소송을 제기하고 대법원 확정판결을 받기까지 9년이나 걸렸다. 집단소송의 경우 피해자가 증거를 제시해야 하는데 기업이 협조를 거부하면 증거 자료 확보가 거의 불가능하다. 선진국에선 주주가 요구하면 기업이 관련 자료를 제공해야 하는 ‘증거 개시 제도’를 통해 소액주주의 집단소송을 돕는다. 우리도 소액주주에게 이런 창을 제공할 필요가 있다.한국 증시 밸류업을 기대하며 외국인 투자금이 서울로 흘러들고 있다. 호기를 잘 살리려면 기업과 소액주주가 더 좋은 ‘창’과 ‘방패’를 갖도록 증시 제도도 선진화해야 한다. 자사주 소각이 더 활발해지고 코리아 디스카운트도 완화될 것이다."
2022-02-28,"서울 문리대 동창 3만불, 펨코 1000만원, 파병 문의도… 우크라 응원 물결","27일 서울 중구 주한러시아대사관 인근에서 재한 우크라이나인들이 러시아의 우크라 침공을 규탄하는 반전 시위를 벌이고 있다. /연합뉴스러시아의 침공에 맞서 결사항전 중인 우크라이나를 향해 세계 각국에서 응원 목소리가 높아지는 가운데, 국내에서도 우크라이나를 향한 응원 분위기가 달아오르고 있다.서울대 문리과대학 동창회가 러시아 침공에 맞서고 있는 우크라이나에 3만 달러(약 3600만원)를 기부하기로 했다. 커뮤니티 사이트에는 우크라이나 대사관을 통한 성금 ‘인증’이 여기저기서 이뤄진다. 포털사이트에는 “파병을 원한다”는 글까지 올라왔다. 해외에서는 미국·영국·프랑스·독일 등은 물론 러시아 주요도시에서도 블라디미르 푸틴 러시아 대통령을 규탄하는 반전 시위가 벌어진다.송금 화면 인증하고, 신뢰할만한 기부처 공유서울대 문리과대학 동창회장을 맡고 있는 김종섭 삼익악기 회장은 “27일부터 동창회 차원에서 우크라이나 성금 모금이 시작됐으며, 만 하루도 지나지 않아 1만달러가 넘게 모였다”고 28일 밝혔다.김 회장은 “일단 1차 목표액을 3만달러로 잡았으며, 이 금액이 도달하는대로 주한 우크라이나 대사관을 통해 기부금을 전달하겠다”고 했다. 이어 “우리 역시 6·25 때 북한의 남침으로 어려움을 겪다가 여러 나라에서 도움을 받았다”며 “러시아 침공을 받은 우크라이나 사태를 보면서 남일 같지 않다고 생각하던 중 동창회 차원에서 나서서 돕자는 목소리가 나와 기부금 모집을 시작하게 됐다”고 했다.서울대 문리과대학동창회는 전신인 경성제국대학 문과와 이과 계열 졸업생을 포함해 1947년 7월 결성된 단체다. 문리과대학 소속의 각 학과가 인문대학, 사회과학대학, 자연과학대학으로 분할돼 침체를 겪다가 2020년 6월 김 회장을 동창회장으로 선출하면서 활동을 재개했다.김 회장은 공익기관과 비영리기관, 대학에 꾸준한 기부활동을 하고 있다. 서울대 문리과대학 총동창회장과ROTC동문회장, 대한적십자사 부총재, 비정부기구(NGO) 코피온 이사장 등을 통해 공익적 활동을 이어왔다.소셜미디어와 여러 온라인 커뮤니티에는 우크라이나 정부 공식 트위터 계정에 올라온 게시물을 공유한 글이 올라왔다. ‘우크라이나 군대를 지원하기 위해 돈을 기부해달라’ ‘우크라이나를 지원하고 러시아의 침략을 규탄하기 위해 거리 시위에 나서 달라’ 등의 호소가 담긴 게시물이었다.온라인 커뮤니티에 우크라이나 기부 인증이 올라오고 있다./온라인 커뮤니티실제 여러 네티즌이 기부에 동참했고, 그 중 일부는 ‘인증샷‘까지 남기고 있다. 국내 유명 온라인 커뮤니티 ‘에펨코리아’에는 “에펨코리아와 많은 사용자는 우크라이나 전쟁을 반대한다” “인도적 지원을 위해 우크라이나 적십자에 약 1000만원($8350)을 기부했다”는 글과 함께 송금 화면 캡처 이미지가 올라왔다.‘믿을 수 있는 기부처’를 정리해놓은 게시물도 유행이다. 본인 기부를 인증한 어느 네티즌은 우크라이나 정부 외에 적십자, 유엔난민기구 등을 통한 기부 방법을 소개하며 “국내 유엔난민기구를 통해 우크라이나 긴급구원을 보내면 연말정산도 가능하다”고 안내했다.이 밖에도 네티즌들은 우크라이나를 도울 수 있는 직간접적인 방법을 찾아 나섰다. 2013년 전역한 군인이라고 밝힌 한 네티즌은 네이버에 “우크라이나로 파병을 가고 싶다. 우크라이나를 위해 직접적으로 도움 줄 수 있는 방법이 있느냐”고 물었고, 또 다른 네티즌은 “15살인 제가 간접적이라도 우크라이나를 도와줄 수 있는 방법이 있느냐”고 적었다.각국서 우크라 응원·모금… 할리우드 스타들 앞장러시아의 우크라이나 침공이 시작된 이래, 서방 주요 도시에서는 푸틴 대통령을 규탄하고, 우크라이나에 힘을 보태려는 시위가 잇따르고 있다. 영국, 이탈리아, 루마니아, 터키, 호주, 아르헨티나, 브라질, 멕시코, 페루 등에서도 수천 명이 집결했다. 전쟁 당사국인 러시아에서도 수십개 도시에서 반전(反戰) 시위가 열렸고, 1000여명이 체포됐다.할리우드 스타들과 유명 인사들도 앞장선다.미국 캘리포니아 주지사를 지냈던 영화 ‘터미네이터’의 주연 배우 아놀드 슈워제네거는 트위터에 글을 올려 “나는 우크라이나 사람들과 함께 한다. 우리의 마음을 아프게 한 비극과, 동시에 우리에게 감동을 준 우크라이나 국민들의 용기에 초점을 맞춰야 한다”며 “나는 전쟁이 끝난 후 점령된 나라에서 자라는 것이 어떤지 잘 알고 있다. 전쟁의 여파에서 모두가 고통을 겪는다. 아무도 이길 수 없다”고 말했다.왼쪽부터 배우 밀라 요보비치, 아놀드 슈워제네거, 애쉬튼 커쳐/인스타그램팝스타 마일리 사이러스는 인스타그램 스토리를 통해 “우크라이나가 침공됐다는 소식을 듣고 마음이 아팠다”고 말했다. 그는 과거 키예프에서 뮤직비디오를 촬영했던 경험을 언급하면서 “그때 정말 놀라운 경험을 했다. 두 팔 벌려 저를 환영해줬던 지역사회에 영원히 감사할 것”이라고 했다. 이어 “나는 이번 침공으로 영향을 받은 모든 우크라이나 사람들과, 폭력의 즉시 중단을 촉구하는 글로벌 커뮤니티와 연대한다”고 썼다.우크라이나 출신 배우 밀라 요보비치도 러시아를 향해 비판의 목소리를 냈다. 요보비치는 26일 인스타그램에 성명을 올리고 “내 고향 우크라이나에서 벌어진 일에 가슴이 아프다. 내 조국과 국민들이 폭격을 당하고 있고, 가족들과 친구들이 이를 피해 숨어있다”고 했다.팝스타 아리아나 그란데도 “우리는 러시아의 우크라이나 공격으로 인해 삶에 영향을 받을 개인 및 가족들과 함께 한다”고 했고, 할리우드 배우 애쉬튼 커쳐도 “우크라이나를 지지한다”는 글을 트위터에 올렸다. 배우 맨디 무어도 우크라이나를 돕자는 내용의 기사를 공유하고 “”내 마음은 우크라이나 국민과 함께 한다”고 적었다.27일(현지시각) 독일 베를린에선 러시아의 우크라이나 침공을 항의하고 우크라이나 국민과의 연대를 보여주기 위해 10만여명의 시민들이 모여 대규모 시위를 벌였다. 스위스 베른에선 2만여명이 모여 우크라이나 지지 집회를 열었다.영국, 이탈리아, 루마니아, 터키, 호주, 아르헨티나, 브라질, 멕시코, 페루 등에서도 수천 명의 사람들이 모여 우크라이나에 힘을 보탰고 전쟁 당사국인 러시아에서도 정부를 비판하는 대규모 집회가 열렸다.국내에선 재한 우크라이나인과 러시아인이 반전 시위를 열었다. 우크라이나인 200여명은 지난 27일 서울 중구 러시아 대사관 앞에서 ‘평화를 원한다’ ‘푸틴은 전쟁을 멈추라’고 외치며 한국 시민들의 연대와 지원을 요청했다. 러시아인들도 서울 종로구 보신각 앞에서 반전 집회를 열었다."
2022-03-30,[사랑방] 중소기업중앙회 外,◆중소기업중앙회(회장 김기문)는 29일 부산동부수퍼마켓협동조합에서 중소상공인들의 유통물류 비용을 절감하기 위해 건립한 ‘부산동부중소유통공동도매물류센터’ 개소식을 개최했다.◆승명호 동화그룹·한국일보 회장이 29일 고려대학교 교우회 제34대 회장으로 취임했다.◆한국외대는 지난 28일 권순한 ㈜소이상사 회장이 모교인 한국외대에 학교발전기금 2억원을 기부했다고 전했다. 누적 기부액은 총 12억6100만원에 이른다.◆고 이규종 경희대 명예교수의 부인 김인선 여사가 장학금 20억을 경희대에 기부했다. 경희대는 이 기부금으로 고인의 아호를 딴 ‘운연(雲淵)장학기금’을 조성한다고 지난 28일 전했다.◆서울대 총동창회는 지난 28일 정기총회에서 김종섭 스페코·삼익악기 그룹 회장을 제29대 회장으로 선출했다.
2022-02-24,"대한민국ROTC중앙회, 'ROTC중앙회 포럼' 창립","22일 서울 소공동 롯데호텔에서 열린ROTC중앙회 포럼.ROTC중앙회 제공대한민국ROTC중앙회(회장 박식순)는 사회 각 분야에서 활동하고 있는ROTC리더들로 구성한'ROTC중앙회 포럼'을 창립했다.22일 서울 소공동 롯데호텔에서 열린 발대식 겸 포럼에선ROTC중앙회 대표 임원 299명이 참석했다.이날ROTC중앙회 포럼은 유재은 우리자산신탁 회장을 포럼 회장에 위촉했다. 아울러 상임고문에 김종섭 삼익악기그룹 회장, 최용도 도준해운 대표이사, 이준식 전 사회부총리를 위촉하고 문승동 정무부회장, 구본환 실무부회장, 조현배 대외협력부회장을 선임했다.박식순 중앙회장은 ""ROTC는 지난 61년 동안 현역시절에는 호국의 간성으로, 전역 후에는 정치, 경제, 문화, 예술, 교육 등 각계각층에 포진해 국가 발전을 이끌어온 문무겸비의 리더그룹""이라며 ""4차 산업혁명과 코로나 시대, 그리고 미국과 중국으로 대표되는 국제 정세 속에, 각 분야의ROTC대표 리더들을 모아ROTC중앙회 포럼을 구성하여ROTC와 대한민국 발전을 견인하겠다”고 말했다.박 회장은 “앞으로ROTC중앙회 포럼은 분기별로 개최하며, 4월에는 차기 정부의 주요인사를 모실 계획”이라고 덧붙였다.이날 행사에서는 서울시 통합방위협의회 의장인 오세훈 서울시장이 ‘2022년 서울시정 방향’에 대해, 북한전문가 남성욱 고려대 교수가 ‘미·중 갈등시대의 동북아정세 및 남북관계 전망’에 대해 강연을 했다."
2024-06-25,"‘데뷔 55주년’ CM송 장인 김도향, 초심 찾아 전국 소극장 투어","29일 서울 삼익악기 엠팟홀서 두번째 공연가수 김도향. 스윗뮤직 제공‘바보처럼 살았군요’ 등 히트곡과 스크류바 등 수많은 시엠(CM)송을 탄생시킨 가수 김도향이 데뷔 55주년을 기념하는 소극장 전국투어 프로젝트 ‘더 55’를 진행한다.김도향은 1970년 포크 듀오 투코리언스로 데뷔했다. “난 참 바보처럼 살았군요”라는 가사로 유명한 ‘바보처럼 살았군요’를 비롯해 ‘벽오동 심은 뜻은’ ‘언덕에 올라’ 등 히트곡을 냈다. 그는 시엠송을 무려 3천여곡이나 만들어 ‘시엠송의 대부’로도 불린다. 스크류바(이상하게 생겼네 롯데 스크류바), 월드콘(설명 필요 없고 일단 맛을 봐요), 뽀삐(우리 집 강아지 뽀삐 우리 집 화장지 뽀삐), 아카시아껌(아름다운 아가씨 어찌 그리 예쁜가요), 삼립호빵(찬 바람이 싸늘하게 두 뺨을 스치면), 맛동산(맛동산 먹고 즐거운 파티) 등 노래가 그의 손에서 탄생했다.올해 팔순을 맞은 김도향은 ‘80대 청년’으로 불릴 만큼 여전히 왕성한 활동을 펼치고 있다. 내년에 데뷔 55주년을 맞는 그는 “지금이 김도향 음악인생의 가운데”라며 “그 중심에 뚜렷한 점 하나를 찍고 싶다”고 말한다. 데뷔 초기 순수하고 진지했던 초심으로 돌아가 팬들을 찾아가겠다는 뜻에서 마련한 것이 소극장 전국투어 프로젝트다.가수 김도향의 데뷔 55주년을 기념하는 소극장 전국투어 프로젝트 ‘더 55’ 포스터. 스윗뮤직 제공지난 5월11일 인천에서 첫 공연을 한 데 이어, 오는 29일 오후 5시 서울 강남 논현동 삼익악기 엠팟홀에서 두번째 공연을 한다. 150석 규모의 작은 소극장에서 선착순 예매 관객 100여명과 함께한다. 자신의 히트곡은 물론, ‘서른 즈음에’(김광석), ‘그대 그리고 나’(소리새), ‘마이 웨이’(프랭크 시나트라), ‘왓 어 워더풀 월드’(루이 암스트롱) 등 유명 가요와 팝송도 부른다. 추억의 시엠송들도 들려준다.김도향은 내년까지 ‘더 55’ 프로젝트를 이어간다. 매달 한두 차례 전국 관객들을 찾아가 만난다. 이밖에 다양한 기획과 시도를 펼칠 것이라고 소속사는 전했다."
2023-11-02,11월 3일 궂긴 소식,"◆ 김동익(전 중앙일보 대표이사)씨 별세: 이혜경씨 남편, 성연 정현(애플 동남아 기술매니저) 상현(이노비드 부사장)씨 부친, 조은주 이경미씨 시부, 이현재(사업)씨 장인=1일 오후 11시 삼성서울병원. 발인 4일 오전 6시. (02)3410-6905.◆ 이영근씨 별세: 상혁 상규 윤정씨 부친, 임석현(한화생명 전략기획실장 전무)씨 장인=2일 오전 삼성서울병원. 발인 4일 오전 7시15분. (02)3410-6908.◆ 윤설용씨 별세: 김숭희씨 남편, 준덕(하나금속 소재개발부장) 현선(영국 그리니치대 교수) 윤진(삼익악기 전무)씨 부친, 이은경 은현영씨 시부, 김경화(스티븐슨 하워드 대표)씨 장인, 채림 영서씨 조부, 김우상 김시본씨 외조부=30일 오후 3시 서울성모병원. 발인 3일 오전 8시30분. (02)2258-5951.◆ 김영순씨 별세: 표승렬(한국농어촌공사 차장)씨 모친, 최진국(태영건설 전무)씨 장모=1일 오후 8시 연세대세브란스병원. 발인 4일 오전 5시40분. (02)2227-7547.◆ 곽세량(서울도시가스 제43지역관리소장)씨 별세: 황숙배씨 남편, 영훈 미정씨 부친, 이정은씨 시부, 김성준씨 장인=2일 오전 1시21분 연세대세브란스병원. 발인 4일 오전 11시. (02)2227-7566."
2022-12-30,13년간 복직투쟁 콜텍 해고노동자 ‘재춘언니’ 임재춘씨 별세,"다큐영화 <재춘언니>에서 연극 ‘햄릿’의 여주인공 오필리아로 등장한 고 임재춘씨. 시네마달 제공2007년 정리해고 이후 13년동안 국내 최장기 복직 투쟁했던 임재춘씨가 30일 세상을 떠났다고 유족들이 전했다. 향년 59.1963년 충남 공주에서 태어난 고인은 1983년부터 경기도 의정부 성음악기, 1985년 삼익악기에서 악기를 만들었다. 1986년부터 덕영산업에서 일했으나, 1987년 콜텍이 인수하면서 기타를 만들게 됐다.2007년 콜텍이 국내 공장을 폐쇄하면서 정리해고 통보를 받고 복직투쟁에 나섰다. 서울 강서구 콜텍 본사, 여의도, 광화문 등을 거치며 단식 투쟁, 고공 농성 등을 이어왔다. 2009년 11월 서울고등법원이 “회사 전체의 경영사정을 종합 검토해 정리해고 당시 경영상 큰 어려움이 있었다고 볼 수 없다”고 판결했다.그러나 2012년 ‘회사에 경영상 긴박한 위기가 있었다고 보기 어렵더라도, 장래에 닥칠 위기에 대처할 필요가 있다’는 대법원 판결이 났고, 파기환송심을 거쳐 2014년 회사 쪽의 손을 들어준 해당 판결이 확정됐다.결국 2019년 42일간의 단식농성을 벌인 끝에 회사로부터 정리해고에 대한 유감 표명과 명예복직, 조합원 25명에 대한 보상금 지급 등의 타결을 이끌어냈다.2022년 3월 그의4644일 투쟁을 기록한 다큐영화 <재춘언니>(이수정 감독)가 개봉되어 화제가 되기도 했다. ‘재춘언니’는 농성장에서 연극 <햄릿>을 올리고 어쿠스틱 기타 경연대회와 밴드 공연을 여는가하면 청소도 하고 밥도 짓는 그에게 인천지역 여성노동자들이 불러준 별칭이다.유족은 자녀 애란·초란씨가 있다. 빈소는 건양대학교병원장례식장, 발인 내달 1일 오전 7시30분. (042)600-6666"
