date,title,content
2023-07-11,"4개그룹이 진주 한동네서 싹텄다, 47국서 찾아온 ‘K산업화 성지’","삼성·LG·GS·효성 발원 진주 승산마을세계중기협회 47국 150명 몰려“한마을서 시작된 800조 매출...영화 같다”‘한국 기업가 정신 포럼’에 쏠린 관심 - 10일 진주시 내동면 능력개발관 대강당에서 열린 ‘K기업가 정신 국제 포럼’에 참가한 외국인들이 개회식을 지켜보다가 스마트폰을 꺼내 행사 사진을 찍고 있다. 이날 포럼에선 서양의 기업가 정신과 K기업가 정신을 비교하는 세션도 진행됐다. 해외 학자들은 “기업의 사회적 책임이 부각되는 현재, 공동체를 우선한 K기업가 정신에 해답이 있다”고 했다. /진주시10일 인구 34만명의 중소도시 경남 진주에 있는 한 대강당은 세계 47국에서 온 외국인 150여 명으로 북적였다. 이날 오전 진주시 내동면 능력개발관 대강당에서 열린 ‘K기업가정신 국제포럼’에 참가하기 위한 학자·기업인·학생들이다. 이 행사는 진주시와 세계중소기업협의회(ICSB)가 “삼성·LG·GS·효성 창업주의 ‘사업보국(事業報國)’ 철학이 진주에서 발원했다”는 사실을 알리기 위해 공동 기획한 행사다.ICSB는 1955년 미국에서 설립돼 90국 5000여 명의 회원을 거느린 비영리 단체다. 주로 학자, 기업인으로 구성됐는데 ‘유엔 세계 중소기업의 날’을 제정하는 데 기여하기도 한 곳이다.ICSB회장인 아이만 타라비시 조지워싱턴대 경영학과 교수는 작년 한 행사에 참가하기 위해 한국을 찾았다가 “진주에 가면 한국 최대 기업인 삼성의 이병철 창업주를 비롯해LG구인회,GS허만정, 효성 조홍제 창업주가 동시대에 교류한 마을이 있다”는 말을 듣고 진주를 찾았고, 진주시와 이 포럼을 함께 준비했다. 타라비시 교수는 “대기업 4사가 어떻게 한 거리(samestreet)에서 시작할 수 있었는지, 할리우드 영화 시나리오 같은 이야기”라며 “기업의 사회적 책임이 더 커진 현재, 한국과 진주의 ‘K기업가정신’이 ‘한강의 기적’,‘K팝’처럼 더 주목받고 있다”고 말했다. 김기찬 가톨릭대 교수는 “1960년대 가장 가난했던 한국은 한강의 기적을 이뤄내고 세계에서 가장 혁신적인 나라로 인정받고 있다”며 “이는 예부터 이웃과 나라, 그리고 사람을 소중하게 생각했던 우리만의 독특한 기업가정신이 발현된 것으로, 해외 학자들이 학문적으로 연구하려는 움직임이 있다”고 말했다.10일 ‘K기업가정신’ 국제포럼에서 주목받은 진주시 지수면 ‘승산마을’은 ‘한국 산업화의 성지’라는 찬사를 받는 곳이다. 한국 경제의 중추를 이루는 삼성·LG·GS·효성의 1세대 기업인들이 동시대에 한곳에서 교류한 것은 세계적으로도 유례를 찾기 어렵다.그래픽=백형선이들이 일군 기업들은 한국 경제를 지탱하는 핵심으로 성장했다. 삼성 일가는 삼성·CJ·신세계·한솔,LG일가는LG·LS·LX·LIG·LF·아워홈,GS그룹 일가는GS·삼양통상·삼양인터내셔날·승산·새로닉스·코스모, 효성 일가는 효성·한국앤컴퍼니(한국타이어)를 운영 중이다. 이 중 삼성·신세계·CJ·LG·LX·LS·GS·효성·한국타이어·한솔 등 10개 그룹의 매출(2022년 말·대기업 집단 지정 기준,CXO연구소)은 800조원(약 6100억달러)으로, 전 세계GDP순위 23위인 스웨덴(6274억달러)과 맞먹는다.포럼 개최를 주도한 아이만 타라비시 세계중소기업협의회(ICSB) 회장은 “호수와 산을 낀 진주의 지리적 위치, 유서 깊은 유교 전통뿐 아니라 실천주의 유학을 실현한 남명 조식 선생의 사상까지 더해져 어디서도 찾을 수 없는 독특한 경제 생태계를 이뤘다”며 “진주는 5년 후, 10년 후에는 한국 기업가정신의 모태 도시로 더 주목받을 것”이라고 말했다.◇사업보국, 인화단결… ‘나라와 사람이 우선’포럼에선 한국 1세대 창업주들이 개인보다 이웃과 나라를 더 걱정했다는 공통점에 많은 학자와 기업인들이 주목했다. 이병철 삼성 창업주는 생전에 “모든 것은 나라가 기본이다. 나라가 잘되어야 기업도 잘되고 국민이 행복해질 수 있다”고 했다. 그는 ‘사업보국’을 평생의 신념으로 삼았고, 여기에 더해 ‘인재 제일, 합리 추구’를 경영 철학으로 삼았다. 구인회 회장 역시 “물고기가 물을 떠나서 살 수 없다”며 “나라의 백년대계(百年大計)에 보탬이 되어야 기업이 영속할 수 있다”고 말했다. 특히 그가 강조한 ‘인화단결’은LG의 전통이 됐다.그래픽=양인성그래픽=양인성허만정 선생은 평소 “돈은 개미같이 부지런히 모으되, 의로운 일에는 크게 써야 한다”고 말하면서 자신은 해진 신발을 신고 다니면서 독립운동 조직 백산상회에 자금을 댔다. 구씨와 허씨가 시작한 동업은 2005년 허씨 일가가GS그룹을 분리해 나올 때까지 50년간 지속됐다.효성의 창업주 조홍제 회장은 평소 “도리에 어긋나는 길을 가는 기업은 반드시 망한다”고 확신했고, 국리민복(國利民福)과 숭덕광업(崇德廣業·덕을 높이고 업을 넓힌다)을 경영 철학으로 삼았다.9일 승산마을 투어에 이어, 10일 K기업가정신 국제포럼에 참가한 이탈리아 대학생 가에타노 데 로사씨는 “삼성,LG같은 한국의 글로벌 기업에 대해서는 이미 알고 있었지만 기업가정신에 대해서는 사실 생소했는데, 이번에 좋은 기회를 가졌다”고 말했다. 필리핀에서 식품 업체를 운영하는 비엘 호세씨는 “단순히 이윤만 추구하는 게 아니라 사회와 국가를 우선에 뒀던 한국 기업가정신에 감명받았다”고 말했다.◇진주시, ‘한국 기업가정신’ 관광 벨트 조성진주시는 산업화 초기부터 ‘공동체’와 ‘사람’에 주목했던 한국의 기업가정신을 세계 곳곳에 확산시키기 위해 K기업가정신 관광 벨트를 조성한다는 계획이다.이병철·구인회가 다닌 초교의 ‘부자 나무’ 앞에서 - ‘K기업가정신 국제포럼’ 참가자들이 지난 9일 옛 지수초등학교(현 K기업가정신센터) 소나무 앞에서 기념사진을 찍었다. 삼성 이병철 창업주와LG구인회 창업주가 다닌 이 학교의 소나무는 부자의 기운을 받을 수 있다는 이유로 ‘부자 나무’로 불린다. 올해 처음 열린 K기업가정신 국제포럼을 찾은 47국 출신 150여 외국인은 삼성·LG·GS·효성 창업주들이 교류한 승산마을을 둘러봤다. /진주시먼저 인구 감소로 폐교돼 9년간 텅 빈 채로 방치돼 있던 지수초등학교를 ‘K기업가정신 교육센터’로 고쳐 지난해 4월 문을 열었다. 지난 1년여간 4만여 명이 이곳을 찾았다. 진주시는 승산마을과 “3대 거부가 나온다”는 전설이 내려오는 남강의 ‘솥바위’,경남 의령 정곡면 이병철 회장 생가와 경남 함안 군북면 조홍제 회장 생가까지 남강에 인접해 있는 장소들을 묶어 ‘진주 남강 부자 로드’를 조성해 관광 벨트로 만든다는 계획이다. 조규일 진주시장은 “한국의 기업가정신을 세계에 확산하는 일은 진주시만의 일이 아니고, 진주시만의 힘으로는 부족한 만큼, 정부의 지원이 절실하다”고 말했다."
2022-10-19,구인회·허만정처럼… 부자 기운 받아볼까,"[Mytown] ‘재계 거인들의 고향’ 진주 승산마을마을 담벼락 5㎞ 따라 걷다보면LG·GS창업주 등 생가 줄줄이경남 진주시 지수면 승산마을 전경. 진주시는LG,GS등 우리나라를 대표하는 기업 창업주들이 여러 명 나고 자란 승산마을을 관광테마마을로 조성하는 사업을 추진하고 있다. 이 마을에는LG창업주 구인회 생가(왼쪽 점선)와GS창업주 허만정 생가(오른쪽 점선) 등이 있다. /신현종 기자지난 13일 오후 경남 진주시 지수면 승산마을. 산으로 둘러싸인 조용한 시골 마을은 평일임에도 방문객의 발길이 이어졌다. 대구, 부산, 대전, 전남 목포 등 전국 각지에서 온 이들은 마을을 둘러보며 하나같이 “신기하다”는 감탄사를 터뜨렸다. 마을을 둘러싼 약 5㎞ 길이의 담벼락을 따라 한발 한발 떼다 보면 ‘LG창업주 구인회 생가’ ‘GS창업주 허만정 생가’ 등이 줄지어 나타난다. 마을 곳곳에 자리한 고택(古宅)들은 국내 굴지의 기업을 일으킨 창업주들이 나고 자란 곳이다. 대구에서 부모와 함께 왔다는 홍영지(38)씨는 “워런 버핏이 산다는 미국 네브래스카주 오마하에 전 세계 투자자와 여행객들이 좋은 기운을 받으러 가는데, 우리나라에도 그에 못지 않은 곳이 있는 것이 신기하다”고 말했다.이곳은 예부터 만석꾼 부자가 많이 나 ‘진주는 몰라도 승산은 안다’는 말이 있을 만큼 부자마을로 통했다. 마을에 있는 옛 지수초등학교(현K-기업가정신센터)는 수많은 기업인이 동문수학(同門修學)한 것으로 유명하다. 한국경영학회는 2018년 “국내 대표기업 창업주들이 한 마을에서 배출된 것은 세계적으로도 유례를 찾기 어려운 유산”이라며 진주시를 ‘대한민국 기업가정신 수도’로 선포했다. 조규일 진주시장은 “승산마을과 옛 지수초등학교를 기업가정신을 배우고 창업의 꿈을 키울 수 있는 경제교육의 요람이자 관광 콘텐츠로 육성할 방침”이라고 했다.기업 창업주들 다녔던 지수초, K기업가정신센터로 변모1921년 개교한 옛 지수초등학교는 학생수 감소로 2009년 폐교 후 10여 년간 방치되다가 지난 3월 ‘K-기업가정신센터’라는 이름으로 다시 문을 열었다.K-기업가정신센터는 중소벤처기업진흥공단(중진공)과 진주시가 국·도·시비 등 약 60억원을 들여 조성한 미래 기업인 양성 및 창업 교육기관이다. 전시실, 교육장, 전문도서관과 체험센터로 이뤄져 있다. 개소 후 약 6개월간 580여 명의 기업인·예비 창업자·대학생들이 찾아 교육을 받았다.이병철·구인회 함께 심은 ‘부자소나무’ -K-기업가정신센터로 바뀐 옛 지수초등학교를 찾은 관광객들이 ‘부자소나무’ 앞에서 기도를 하고 있다. 이 소나무는 지수초를 다닌 이병철 삼성 창업주와 구인회LG창업주가 함께 심은 것으로 알려졌다. /신현종 기자시골마을 폐교가 국내 유일의 ‘K-기업가정신센터’로 탈바꿈한 것은 이 학교 출신 기업인들 때문이다. 진주시와 지수초에 따르면LG창업주인 구인회 회장과 삼성 창업주인 이병철 회장이 한때 이곳에서 함께 공부했다. 구 회장은 승산마을이 고향이고 이 회장은 승산마을 인근 의령군이 고향이다. 지수초에는 두 사람이 개교 때인 1921년 함께 심은 것으로 알려진 ‘부자소나무’도 있다.산골의 작은 초등학교를 빛낸 재계 인물은 이들뿐만 아니다. 구철회(LG그룹 창업 고문), 허정구(삼양통상 명예회장), 허준구(GS건설 명예회장), 구자경(LG그룹 명예회장) 회장 등이 모두 지수초등학교 출신이다. 1980년대 초 당시 100대 기업 회장 중 30명이 지수초와 인근 승산마을 출신으로 알려지면서 “재계의 산실(産室)”로도 불렸다.이충도 지수초등학교 총동문회 사무총장은 “경남을 대표하는 조선의 유학자 남명 조식 선생의 ‘경의(敬義)사상(내적 수양을 통해 마음을 바르게 하고, 배운 바를 과감하게 실천하는 정신)’이 오늘날 ‘자기성찰’ ‘개척정신’ ‘실천주의’ 등으로 이어지면서 많은 기업인을 배출했다”며 “K-기업가정신센터를 통해 미래 기업인을 육성해 나가길 기대한다”고 말했다.기업가정신 활용한 관광 테마 마을 추진진주시는 승산마을과 옛 지수초를 중심으로 ‘대한민국 기업가정신 수도 구축’ 사업을 벌이고 있다.K-기업가정신센터 운영 등 1단계가 기업가정신 교육 확산이라면, 2단계는 이를 관광 산업에 접목해 사람을 끌어들이는 방향으로 추진한다. 이를 위해 진주시는지난 2018년부터 승산마을을 관광 테마 마을로 조성하는 사업을 추진하고 있다. 승산마을 내 기존 한옥을 매입해 리모델링한 한옥 숙박시설과 체험시설을 지난 6월부터 운영 중이다. 방문객 편의를 위해 마을 입구에 주차장도 조성했다. 진주시는 올 연말까지 문화탐방로, 복합문화공간 조성, 스마트투어 프로그램 개발 등의 사업을 마무리한다는 계획이다.‘대한민국 기업가정신 국립역사관(가칭)’ 건립을 위한 준비 작업도 진행 중이다. 진주시는 최근 관련 용역을 발주하면서 사업 타당성 조사에 착수했다. 역사관은 진주 출신 기업가들은 물론 대한민국 산업화의 역사와 기업의 성장 과정 등이 담긴 소장품과 자료를 전시하고 기업가정신과 관련한 각종 연구 등을 하게 된다. 진주시는 역사관 건립에 예산 약 450억원 정도가 들 것으로 추산하고 있다.지외식 진주시 일자리경제과장은 “‘대한민국 기업가정신 수도 진주’라는 타이틀에 걸맞게 기업가정신센터 프로그램을 강화하고, 지수면을 기업가정신 관광 테마 마을로 만들어 관광객들이 찾도록 할 것”이라고 했다./진주=김준호 기자"
2023-06-15,"檢, 5개 종목 주가폭락 수사…주식카페 운영자 폰·노트북 압수","검찰이 지난 14일 발생한 5개(동일산업·동일금속·대한방직·만호제강·방림) 주식 종목의 하한가 사태에 대한 수사에 나섰다.15일 법조계에 따르면, 서울남부지검 금융·증권범죄합동수사부(부장 단성한)는 이번 주가폭락 사태의 배후로 지목된 네이버 주식정보 공유 카페 ‘B투자연구소’ 운영자 강모(52)씨를 출국금지하고 이날 자택을 압수수색했다. 강씨가 입원해 있던 분당서울대병원에서 강씨의 휴대전화와 노트북 등도 확보했다. 앞서 검찰은 금융당국과 공조 아래 주가폭락 이전부터 해당 종목을 대상으로 한 불공정거래 행위를 예의주시해 왔다. 그러던 중 5개 종목 중 일부 종목에 대한 소액주주운동을 벌여 온 강씨가 비정상적 거래에 연루된 정황을 포착한 것으로 파악됐다.서울남부지검 금융증권범죄합동수사부가 동일산업 등 코스피 4개 종목, 동일금속 등 코스닥 1개 종목 등에 대한 주가조작 의혹과 관련해 배후로 지목된 인터넷 주식정보 카페 운영자 강기혁씨를 출국금지하고 수사에 나섰다. 사진은 서울 신정동 서울남부지검 본관 로비의 모습. 연합뉴스강씨는 과거 주가조작 혐의로 처벌받은 전력이 있다. 서울남부지검은 2017년 5월 강씨를 4개(대한방직·삼양통상·아이에스동서·조광피혁) 종목의 주가를 조작해 차익을 거둔 혐의(자본시장법상 시세조종)로 구속기소했다. 2014년 2월부터 2015년 8월까지 이들 4개 종목에 대한 약 1만회의 통정매매·물량소진 수법으로 주가를 2.5~3.7배 띄운 뒤 보유 주식을 처분해 약 200억원의 부당이득을 거둔 혐의였다. 법원은 이 같은 혐의를 일부 인정해 강씨에 대해 징역 2년, 집행유예 3년, 벌금 4억원을 선고했고, 지난해 12월 대법원에서 확정됐다.강씨는 2000년대부터 소액주주운동 활동으로 이름을 알렸다. 그는 2015년 3월 삼양통상 주주총회에서 소액주주 지분을 모아 자신이 내세운 대기업 출신 비상근감사가 선임되는 성과를 거두기도 했다. 그러나 당시 선임됐던 감사 강모씨도 2017년 5월 강씨의 주가조작 공범으로 기소돼 나란히 유죄가 확정됐다.강씨는 이날 자신이 운영하는 카페에 글을 올려 “어이없고 황당한 루머” “시장의 억측”이라고 의혹을 부인했다. 그는 “동일산업·동일금속은 2011년, 대한방직은 2013년부터 카페에 수많은 리포트를 게재한 종목이지만 현재 카페 회원들 중 세 종목을 보유한 경우는 5% 미만이고, 만호제강과 방림은 이 카페에 제대로 추천한 적도 없다”며 “어제의 하락은SG사태(소시에테제네랄증권발 주가조작 사건) 이후 소형주에 대한 무차별적 대출 제한과 만기 연장조차 해 주지 않는 증권사들의 만행으로 촉발됐다”고 주장했다. 그러면서 “제 두 딸을 비롯해 큰누나, 작은매형, 처형까지 반대매매로 깡통계좌가 되게 된 상황”이라고 덧붙였다.한편, 한국거래소는 전날 약 30%의 낙폭으로 하한가를 기록한 동일산업 등 5개 종목의 거래를 이날 정지했다. 이들 5개 상장사는 이날 조회공시를 통해 “불공정거래와 관련해 확인된 사항이 없다” “보도된 내용과 무관하다” 등의 입장을 내놨다."
2023-07-05,"[단독]檢, 5개 종목 주가조작 혐의 주식정보카페 운영자 소환","서울남부지검이 동일산업 등 5개 종목에 대한 주가조작 혐의를 받는 네이버 주식정보 공유 카페 운영자 강모씨를 최근 피의자 신분으로 불러 조사했다. 사진은 서울 신정동 서울남부지검 본관 로비의 모습. 연합뉴스검찰이 동일산업 등 5개 주식 종목 하한가 사태의 배후로 지목된 네이버 주식정보 공유 카페 ‘B투자연구소’ 운영자 강모(52)씨를 최근 소환해 조사한 것으로 5일 파악됐다.서울남부지검 금융·증권범죄합동수사부(부장 단성한)는 지난 3·4일에 이어 이날도 강씨를 피의자 신분으로 불러 조사하고 있다. 강씨는 친누나와 지인 등 4명과 공모, 2020년 1월부터 지난 5월까지 수십개의 계좌를 동원해 5개(동일산업·동일금속·대한방직·만호제강·방림) 종목에 대한 주문을 수천회 반복하는 방법으로 주가를 조작한 혐의(자본시장법상 시세조종)를 받는다.검찰과 금융당국은 이들 5개 종목 관련 불공정거래 의심 첩보를 접수하고 수개월 전부터 강씨 등의 거래 행태를 주시해 왔다. 한국거래소는 하한가 사태 직후 이들 종목의 거래를 정지했다. 검찰도 하한가 사태 다음 날인 지난달 15일부터 이틀에 걸쳐 강씨의 경기도 용인시 자택과 서울 강남구 사무실 등을 압수수색하고, 강씨가 사고로 입원해 있던 분당서울대병원에서 휴대전화와 노트북 속 주식 거래 관련 자료를 확보했다. 압수수색영장에는 강씨 등이 5개 종목에 대한 시세조종으로 104억원의 부당이득을 거뒀다는 내용이 적시됐다.강씨는 검찰 조사에서 자신에게 제기된 혐의를 모두 부인했다고 한다. 소액주주운동가를 자처해 온 강씨는 검찰이 수사에 착수한 뒤부터 줄곧 뜻이 맞는 이들과 5개 회사의 경영권을 확보하려고 지분을 매수하는 과정에서 교차매매가 이뤄졌을 뿐이라고 주장해 왔다. 통정매매를 통해 인위적으로 주가를 띄워 부당이득을 취하려는 시세조종 행위가 아니라는 취지다. 강씨는 이날 중앙일보와 통화에서 “차익 실현은커녕 대량 매수한 주식이 폭락해 엄청난 손실만 입었다”며 “혐의 기간 중 주가 상승 대부분은 프로그램 매수로 촉발됐는데 검찰이 누명을 씌우고 있다”고 주장했다. 검찰은 강씨에 대한 구속영장 청구 여부도 검토 중이다.강씨는 2017년 5월 4개(대한방직·삼양통상·아이에스동서·조광피혁) 종목에 대한 같은 혐의로 구속기소된 이력이 있다. 그는 당시에도 ▶소액주주운동 과정의 우연한 교차매매이고 ▶실제 시세조종을 통해 차익을 거둔 게 거의 없다는 점을 강조했다. 그러나 법원은 강씨가 지인과 주고받은 통화·메시지의 내용과 관련자 진술, 실제 주식 거래내역 등을 비교해 통정매매를 인정했다. 그러면서 시세조종 행위의 경우 차익 실현 등 이익 취득 여부와 무관하게 죄가 성립한다며 지난해 12월 강씨에게 징역 2년, 집행유예 3년, 벌금 4억원을 확정했다.동일산업 등 5개 종목은 지난 3일 거래가 재개됐지만, 일부 종목은 재차 하한가를 기록하는 등 폭락했다. 시장에서는 주식을 담보로 대출을 내준 일부 증권사가 반대매매에 나섰다는 분석이 나왔다."
2023-06-16,"‘5종목 하한가 사태’…검찰, 주식카페 운영자 압수수색","검찰이 14일 발생한 5개(동일산업·동일금속·대한방직·만호제강·방림) 주식 종목의 하한가 사태에 대한 수사에 나섰다. 15일 서울남부지검 금융·증권범죄합동수사부(부장 단성한)는 이번 주가폭락 사태의 배후로 지목된 네이버 주식정보 공유 카페 ‘B투자연구소’ 운영자 강모(52)씨를 출국금지하고 이날 자택을 압수수색했다. 강씨가 입원해 있던 분당서울대병원에서 강씨의 휴대전화와 노트북 등도 확보했다. 앞서 검찰은 금융당국과 공조 아래 주가폭락 이전부터 해당 종목을 대상으로 한 불공정거래 행위를 예의주시해 왔다. 그러던 중 5개 종목 중 일부 종목에 대한 소액주주운동을 벌여 온 강씨가 비정상적 거래에 연루된 정황을 포착한 것으로 파악됐다.2000년대부터 소액주주운동 활동으로 이름을 알리기도 한 강씨는 과거 주가조작 혐의로 처벌받은 전력도 있다. 검찰은 2017년 5월 강씨를 4개(대한방직·삼양통상·아이에스동서·조광피혁) 종목의 주가를 조작해 200억원의 부당이득을 거둔 혐의(자본시장법상 시세조종)로 구속기소했다. 법원은 강씨에 대해 징역 2년, 집행유예 3년, 벌금 4억원을 선고했고, 지난해 12월 대법원에서 확정됐다.강씨는 이날 자신이 운영하는 카페에 글을 올려 “어이없고 황당한 루머” “시장의 억측”이라고 의혹을 부인했다. 그는 “동일산업·동일금속은 2011년, 대한방직은 2013년부터 카페에 수많은 리포트를 게재한 종목이지만 현재 카페 회원들 중 세 종목을 보유한 경우는 5% 미만이고, 만호제강과 방림은 이 카페에 제대로 추천한 적도 없다”며 “어제의 하락은SG사태(소시에테제네랄증권발 주가조작 사건) 이후 소형주에 대한 무차별적 대출 제한과 만기 연장조차 해주지 않는 증권사들의 만행으로 촉발됐다”고 주장했다. 그러면서 “제 두 딸을 비롯해 큰누나, 작은매형, 처형까지 반대매매로 깡통계좌가 되게 된 상황”이라고도 했다. 한국거래소는 전날 약 30%의 낙폭으로 하한가를 기록한 동일산업 등 5개 종목의 거래를 이날 정지했다. 이들 5개 상장사는 “불공정거래와 관련해 확인된 사항이 없다”는 입장을 내놨다.한편 금융당국도 강씨를 비롯해 카페, 해당 기업 등을 상대로 대면 및 현장 조사를 벌인다는 계획이다. 금감원 관계자는 “5개 종목 하한가 사태와 관련됐다고 지목된 카페를 포함해 불법 행위 의혹이 있는 곳을 두루 살펴볼 것”이라고 말했다. 이날 국회 정무위에 출석한 이복현 금감원장은 “SG사태 이후 이상거래 적발 시스템을 회피하는 행위 등을 파악하는 과정에서 해당 종목을 챙기며 사실관계를 파악하고 있었다”며 “SG사태 때의 경우 장기간 하한가로 인한 손해가 있었지만 이번에는 당국이 어느 정도 사실을 파악하고 있었기 때문에 신속하게 매매 정지를 했다”고 말했다. 이와 함께 금감원은 연말까지 불공정거래 특별단속을 강화하기로 하고, 관련 조사 인력을 늘리기로 했다. 이 원장은 이날 ‘금융상황점검회의’를 주재하며 “증시 교란 행위 우려를 불식시키고 투자자 신뢰를 제고할 수 있도록 6월 중 조사전담인력을 확충하고 조직개편을 했다”며 “7월 추가 증원을 통해 특별단속을 차질 없이 진행하겠다”고 밝혔다."
