date,title,content
2022-09-26,"부총리도 짱구는 못말려…삼양, 과자 가격 15.3% 인상","삼양식품 “사또밥·짱구·뽀빠이 등 가격 조정”추경호 부총리 민생물가 공개 경고 안 먹혀삼양식품에서 판매 중인 짱구. 삼양식품 누리집 갈무리추경호 부총리 겸 기획재정부 장관까지 나서서 물가안정을 위해 가격 인상 자제를 요청했지만, 식품업계의 인상 도미노는 계속 이어질 전망이다. 삼양식품은 라면을 제외한 과자 제품의 가격을 15.3% 인상할 예정이라고 26일 밝혔다.삼양식품 관계자는 이날 <한겨레>에 “사또밥, 짱구, 뽀빠이 등 3개 과자 제품의 편의점 가격을 각 15.3%씩 인상할 계획”이라며 “아직 구체적인 인상 시기는 협의 중이다”고 말했다. 이번 가격 인상으로 편의점에서 판매하는 이들 스낵 가격은 각각 1300원에서 1500원으로 오른다. 삼양식품이 제조하는 과자는 이들 3종이 전부이며, 라면 가격은 아직 인상할 계획이 없다는 것이 삼양 쪽 설명이다.삼양라면, 불닭볶음면 등 라면이 주력 제품인 삼양식품은 수출액 비중이 70%에 이른다. 삼양은 올 2분기 매출 2553억원, 영업이익 273억원을 기록해, 전년 동기 대비 매출은 73%, 영업이익은 92% 증가하는 호실적을 냈다. 삼양식품 관계자는 “라면은 해외 매출 비중이 커 환차익이 발생하는 등 가격 인상 요인이 상대적으로 적지만, 과자는 오직 국내 판매에만 의존하고 있어 가격을 올릴 수밖에 없는 실정”이라며 “소맥·팜유·밀가루 등 원자재와 물류비 가격의 인상이 압박요인으로 작용하고 있다”고 말했다. 이어 “라면 역시 아직 상황을 지켜볼 여력은 있지만, 가격을 인상하지 않겠다는 뜻은 아니다”라고 덧붙였다.삼양식품에서 판매 중인 사또밥. 삼양 누리집 갈무리최근 삼양식품을 제외한 주요 라면 제조사들은 줄줄이 가격 인상 대열에 합류했다. 업계 1위인 농심은 지난 15일부터 라면 출고가격을 평균 11.3% 인상했다. 신라면은 10.9%, 너구리는 9.9% 각각 올려, 편의점 기준으로 신라면은 1천원이 됐다. 팔도 역시 다음달 1일부터 라면 12종의 가격을 평균 9.8% 인상한다. 팔도비빔면 9.8%, 왕뚜껑 11.0%, 틈새라면빨계떡은 9.9% 오른다. 오뚜기 역시 다음달 10일부터 라면 가격을 평균 11.0% 올린다. 대형마트 판매가 기준으로 진라면은 620원에서 716원으로, 진비빔면은 970원에서 1070원으로 각각 인상된다.앞서 추경호 부총리는 지난 19일 민생물가 점검회의에서 “식품업계의 가격 인상으로 가계 부담이 커지고 있다”며 “부당한 가격 인상이 나타나지 않도록 현안 분야별로 담합 등 불공정행위 여부를 소관 부처와 공정거래위원회가 합동 점검하겠다”고 공개적으로 경고하고 나섰다. 이어 방기선 기획재정부 1차관 역시 지난 23일 제9차 비상경제차관회의에서 “최근의 곡물 가격 안정세 등을 고려해 업계에서도 가격 인상 최소화 등 상생의 지혜를 발휘해 주시기를 당부드린다”고 강조했다.하지만, 정부의 ‘공개 경고’도 약발이 먹히지 않는 모양새다. 삼양식품 관계자는 “(가격 인상) 시가가 애매한 부분이 있다는 지적에 공감한다”며 “정부의 방침을 무시할 순 없지만, 오르는 원부자재 가격의 압박을 더이상 견딜 방법이 없다”고 호소했다."
2022-10-21,삼양라면·불닭볶음면도 오른다…평균 9.7% 인상,"다음달 7일, 불닭볶음면 936→1020원삼양라면 700→768원삼양이 다음달 7일부터 13개 브랜드 라면 제품 가격을 평균 9.7% 인상한다. 삼양라면 누리집 갈무리결국 삼양 라면마저….농심에서 시작된 ‘라면 가격 인상’이 팔도와 오뚜기를 거쳐 삼양에까지 미쳤다. 삼양식품은 다음달 7일부터 불닭볶음면과 삼양라면 등 13개 브랜드 제품 가격을 평균 9.7% 인상한다고 21일 밝혔다.이번 인상으로 봉지면 기준 불닭볶음면과 삼양라면 가격은 각각 8.7%와 9.3% 오른다. 대형마트 판매 가격은 불닭볶음면 1봉지에 936원에서 1020원으로 84원이 오르고, 삼양라면은 700원에서 768원으로 68원 인상된다.삼양식품 관계자는 “밀가루·팜유 등 주요 수입 원자재뿐 아니라 물류비 등 생산 비용이 급증해 원가 부담이 가중됐다”며 “그간 수출 확대를 통해 이를 감내해왔지만, 국내 사업 적자 규모가 누적되고 하반기 상황이 더 악화돼 불가피하게 가격을 인상하게 됐다”고 말했다. 이어 “고객들의 장바구니 물가에 부담을 드리게 돼 송구스럽게 생각하며, 더 좋은 품질로 보답하겠다”고 덧붙였다.삼양이 다음달 7일부터 13개 브랜드 라면 제품 가격을 평균 9.7% 인상한다. 삼양라면 누리집 갈무리삼양이 이날 가격 인상을 발표함으로써 주요 라면 회사 4곳이 모두 가격을 인상한 셈이 됐다. 앞서 농심이 지난달 15일 신라면·짜파게티 등 라면 출고 가격을 평균 11.3% 인상한 데 이어 팔도 역시 이달 1일부터 12개 브랜드 라면 제품 가격을 평균 9.8% 올렸다. 오뚜기도 지난 10일 라면 가격을 평균 11.0% 인상한 바 있다."
2024-12-05,"기아, 250억달러 역대 최대 수출…수출의탑 수상","무역의날 맞아 수상한덕수 국무총리가 5일 서울 강남구 코엑스에서 열린 무역의 날 기념식에서 축사하고 있다. 연합뉴스창립 80주년을 맞은 기아가 올해 역대 최대 수출 실적을 달성하며 2년 연속 ‘수출의탑’을 수상했다.기아는 5일 서울 삼성동 코엑스에서 열린 제61회 무역의 날 기념식에서 지난해에 이어 2년 연속 수출의 탑을 수상했다고 밝혔다. 기아는 지난해 7월부터 올해 6월까지 250억달러를 수출하며 1545개 수출의탑 수상 기업 중 1위 자리에 올랐다.수출의탑은 기업의 수출 실적이 특정 구간을 넘어서는 신기록을 경신할 때 수여하는 상이다. 한국무역협회는 매년 12월 5일 무역의날을 기념해 이 상을 수여한다.송호성 사장은 “어려운 경영 환경 속에서도 지속적인 글로벌 브랜드 경쟁력 강화 노력으로 올해도 수상하게 돼 매우 기쁘게 생각한다”며 “앞으로도 지속 가능한 성장을 이뤄낼 수 있도록 최선을 다하겠다”고 밝혔다.이날 시상식에선 자동차 관련 기업들 약진이 두드러졌다. 1억불 이상 수출의탑 수상 기업 55곳 중 17개사가 자동차와 자동차 부품, 이차전지 기업이었다. 전기차 배터리 소재 기업인 포스코퓨처엠 등이 20억불 수출의탑을 받았다.의료기기와 의약품 식품 기업도 지난해 5곳에서 올해 12개사로 크게 늘었다. 국외에서 선풍적인 인기를 끈 불닭볶음면 제조사 삼양식품은 7억불 수출의탑을 수상했다.무역의날 기념식에는 2022년과 2023년 두 해 연속 윤석열 대통령이 참석한 바 있다. 올해는 한덕수 국무총리가 기념식에 나와 축사를 했다. 올해 수출은 전년 동월 대비 매달 증가하는 추세를 유지하고 있지만, 월별 수출 증가율은 지난 7월 고점을 찍은 뒤 11월 1.4%까지 내려온 상황이다."
2024-09-02,"수십년 먹던, 그 라면이 새롭다…‘팝업 스토어’까지 연다","지난달 30일 찾은 서울 신사동 퓨전 한식주점 춘식당. 농심은 올해 짜파게티 출시 40주년을 맞아 춘식당과 함께 ‘짜파게티 다이닝 클럽’을 지난달 23일부터 운영하고 있다. 박지영 기자(☞한겨레 뉴스레터 H:730 구독하기.검색창에’h:730’을 쳐보세요.)‘農心(농심) 삼선 짜장면 -SOUP팀. 1982.3.18’,‘현 짜장면을 품질 개선하여 소비자가 요구하는 제품을 만들기 위함’지난달 30일 찾은 서울 신사동 퓨전 한식주점 춘식당의 한쪽 벽면에는 42년 전 지금의 짜장라면 ‘짜파게티’를 개발하기 위해 농심 직원들이 손수 적은 개발 노트들이 전시돼 있었다. 농심은 올해 짜파게티 출시 40주년을 맞아 춘식당과 함께 ‘짜파게티 다이닝 클럽’을 지난달 23일부터 운영하고 있다. ‘두부 마파짜파’,‘짜파육슬’,‘짜파자냐’ 같은 짜파게티 소스를 응용한 메뉴를 맛볼 수 있다.춘식당을 운영하는 최수영(41)씨는 “기존 주 고객이 30∼40대 직장인인데 어렸을 때 짜파게티를 먹었던 향수를 불러일으킬 수 있도록, 짜파게티 고유의 맛을 해치지 않으면서도 젊은 고객에게는 트렌디하게 다가가기 위해 메뉴 개발에 고심했다”고 말했다.짜파게티 보다 4살 어린 오뚜기의 ‘진라면’도 오는 22일까지 한시적으로 운영하는 이른바 ‘팝업 스토어’를 연다. 젊은층이 많이 찾는 서울 용산구 씨지브이(CGV) 용산아이파크몰점 내 음식을 즐기는 공간인 씨네펍(CINEPUB)에서 ‘해피냠냠 라면 가게’를 운영한다. 오뚜기 대표 제품인 진라면 순한맛, 마라 짜슐랭 등 모두 4종의 라면을 맛볼 수 있다.라면 시장에서 부동의 1·2위를 달리는 농심과 오뚜기가 젊은층을 사로잡기 위해 각종 협업과 팝업 스토어에 열을 올리는 이유는 무엇일까. 업계에선 최근 삼양식품의 ‘불닭볶음면’이 젊은층 사이에서 신라면과 진라면을 빠르게 추격하고 있다는 점을 꼽는다. 갈수록 다양한 라면 브랜드들이 나오는 상황에서, 활발한 마케팅으로 새로운 소비층을 사로잡아야 둔화한 국내 시장을 키우고 업계 선두 자리를 지킬 수 있다는 판단이다.지난 5월 여론조사 기관 한국갤럽이 발표한 ‘가장 좋아하는 라면 브랜드’ 설문조사 결과를 보면, 전 연령대에서 신라면이 35%로 1위를 차지했지만, 선호도는 2004년(49%)에 비해 하락한 것으로 나타났다. 특히 삼양식품의 불닭볶음면 선호도는 13~18살 사이에선 12%를 차지하며, 신라면(25%)과 진라면(15%)를 바짝 쫓고 있는 것으로 나타났다.온라인 에스엔에스(SNS)상 숏폼 챌린지 등으로 국외 매출을 폭발적으로 끌어올린 삼양식품의 불닭면 시리즈 사례처럼, 각종 협업과 팝업 스토어가 홍보 효과로 이어져 수출까지 끌어올릴 수 있다는 점도 이유로 꼽힌다. 국내 연간 라면 매출액(소매점 기준)은 2020년 2조5834억원, 2021년 2조1721억원, 2022년 2조3326억, 2023년 2조3898억원으로 성장세가 둔화하고 있는 상황이다.농심은 지난달 낸 반기보고서에서 “국내 라면 시장은 인구 구조 및 생활패턴의 변화로 인해 양적으로 저성장 추세에 있어 제품의 편리성 강화 및 고급화를 통해 질적 성장에 총력을 기울이고 있다”며 “국내 수요의 한계를 극복하기 위해 해외사업을 적극 추진하고 있다”고 밝히기도 했다. 지난달 30일 농심은 부산 녹산공업단지에 동남아와 유럽 지역 수출을 전용으로 하는 생산 공장을 새로 짓는다고 밝혔다.오는 22일까지 서울 용산구 씨지브이(CGV) 용산아이파크몰점에서 오뚜기의 ‘해피냠냠 라면 가게’가 운영된다. 오뚜기 제공42년 전 지금의 짜장라면 ‘짜파게티’를 개발하기 위해 농심 직원들이 손수 적은 개발 노트. 박지영 기자"
2024-07-16,"‘3배 매운 맛’ 불닭볶음면, 아직 덴마크선 못 먹을 맛","덴마크 정부, 3종 중 ‘3X’뺀 2종만 리콜 해제전 세계적인 관심을 끌고 있는 삼양식품의 불닭볶음면이 마트에 진열돼 있다. 연합뉴스‘불닭면, 덴마크 리콜 족쇄 풀렸다!’삼양식품은 16일 덴마크 정부가 불닭볶음면 제품 3종 중 2종에 대한 리콜 조처를 15일(현지시각) 해제했다고 밝혔다. 자칫 유럽연합 전체로 번져 불닭 볶음면 인기에 찬물을 끼얹을까 우려했던 리콜 사태가 한 달 만에 해결 국면을 맞게 된 셈이다.리콜 조처가 해제된 제품은 핵불닭볶음면 2×스파이시와 불닭볶음탕면 등 2종이다. 가장 매운 핵불닭볶음면 3×스파이시 제품에 대한 리콜 조처는 유지돼 판매 금지가 계속된다.앞서 덴마크 수의식품청은 지난달 11일 “불닭볶음면 3종의 캡사이신 함량이 지나치게 높아 소비자가 급성 중독을 일으킬 위험이 있다”며 리콜 조처를 내렸다. 덴마크 수의식품청은 “제품을 갖고 있다면 폐기하거나 구매한 매장에 반품해달라”고 당부했다.덴마크 당국의 리콜 조처가 취해진 뒤 비비씨(BBC), 에이피(AP)통신, 워싱턴포스트, 가디언 등 세계 언론들은 이 사실을 보도했으며, 일부 언론이 직접 시식 시연까지 보이면서 불닭볶음면에 대한 관심이 오히려 높아지기도 했다. 당시 불닭볶음면 관련 키워드는 구글 검색량에서 역대 최대를 기록하기도 했다.덴마크 수의식품청의 리콜 명령 내용. 덴마크 수의식품청 누리집 갈무리삼양식품은 “덴마크 수의식품청의 불닭볶음면 캡사이신 측정법에 오류가 있다”며 국내 공인기관의 측정 자료를 포함한 반박 의견서를 제출하는 등 적극 대응에 나섰다. 식품의약품안전처 역시 삼양식품과 함께 대응방안을 모색하고 덴마크 수의식품청에 공식 서한을 전달했다. 지난달 30일엔 국장급 실무진으로 구성된 현장 대응팀을 덴마크에 파견해 불닭볶음면 위해 평가를 재실시할 수 있도록 했다.삼양식품에 따르면, 민관 공동 대응으로 덴마크 수의식품청은 식약처에 공식 서한을 보내 리콜 해제에 관해 설명했으며, 해당 2종은 현지에서 바로 판매가 재개됐다고 한다.핵불닭볶음면 3×스파이시 제품은 리콜 조처가 계속 유지되는 것에 대해 삼양식품은 “(리콜 조처가 해제되도록) 계속 노력하겠다”는 원론적 입장을 밝히면서도 판매 전략 수정 가능성도 내비쳤다. 이 상품이 국내에서는 판매되지 않고 국외에서만 판매되는데다, 판매량이 그렇게 많지는 않아 굳이 계속 판매를 고집할 이유는 없다는 판단에서다.삼양식품 관계자는 “이번 이슈를 통해 전 세계 국가별 매운맛에 대한 기준을 다시 한 번 살펴보게 됐다. 불닭볶음면이 케이-푸드 수출의 대표 브랜드인 만큼 향후 더 체계적이고 안전한 제품을 선보이겠다”고 밝혔다."
2024-06-23,"불닭, 구글 검색량 역대 최고…전화위복된 ‘덴마크 리콜’?","전 세계 사람들에게 한국인의 ‘매운맛’을 수출한 삼양식품의 불닭볶음면은 2023년 국외 매출액만 8천억원이 넘는다. 연합뉴스리콜에도 ‘내가 제일 잘나가?’덴마크 정부가 삼양식품의 불닭볶음면 제품 3종에 대해 리콜(회수) 명령을 한 이후 되레 불닭면에 대한 관심이 증가한 것으로 나타났다. ‘노이즈 마케팅’ 효과를 톡톡히 보는 셈이다.23일 구글 검색 트렌드를 보면, 전 세계에서 ‘불닭’ 키워드 검색량은 이달에 역대 최고를 기록했다. 검색량이 지난해 10월의 2배, 작년 3월의 4배 수준이다.이달 구글 검색량이 최대였던 것은 덴마크 리콜 발표 직후인 지난 12일이었다. 앞서 덴마크 수의학·식품청(DVFA)은 지난 11일 삼양식품의 핵불닭볶음면3×스파이시 등 3종의 캡사이신 수치가 높아 급성 중독 위험이 있다며, 현지 시장에서 회수하도록 명령했다. 매운 정도를 나타내는 스코빌지수가 일반 불닭볶음면은 4400 정도인데 견줘 2×핵불닭은 8800, 3×핵불닭은 1만2천이다. 2×핵불닭과 3×핵불닭은 한국에서는 판매되지 않고 해외로만 수출된다.덴마크 수의학·식품청 누리집 갈무리삼양식품은 덴마크의 리콜 이후 이 사태가 전세계로 번지지 않을까 전전긍긍했지만, 덴마크의 리콜 조치 뒤 비비시(BBC), 에이피(AP) 등 외신이 이 소식을 보도하면서 불닭면은 더욱 화제를 모았다. 워싱턴포스트는 지난 19일 “덴마크 판매 금지로 불닭이 더욱 주목받고 있다” “관련 키워드가 태그된 게시물이 3억6천만건에 이른다”고 전하기도 했다.한편, 삼양식품은 지난 19일 국내 공인기관에 의뢰해 캡사이신양을 측정한 뒤 덴마크 정부에 반박 의견서를 제출했다. 제품 전체 중량이 아닌 액상 스프 중량만으로 캡사이신양을 계산해야 한다는 논리다. 삼양식품 쪽은 “덴마크 수의식약청은 캡사이신 함량을 계산할 때, 전체 중량인 140g을 기준으로 봉지당 113㎎으로 계산했는데, 불닭볶음면의 면에는 캡사이신이 들어있지 않고 스프에만 들어있어 스프중량(31.8g)을 기준으로 계산해야 한다”며 “이렇게 계산하면 라면 한 봉지당 총 캡사이신 함량은 덴마크 정부가 발표한 것의 4분의 1 수준에 불과하다”고 설명했다."
2024-06-14,"“핵불닭면, UN 매운맛 기준 ‘미디움’인데…” 리콜 퍼질라 걱정","삼양식품 “국가 공인기관에 캡사이신 함량 분석 의뢰”앞서 미국 틱톡커 “불닭면 탓 신장결석” 주장전 세계 사람들에게 한국인의 ‘매운맛’을 수출한 삼양식품의 불닭볶음면은 2023년 국외 매출액만 8천억원이 넘는다. 연합뉴스덴마크 식품 당국이 삼양의 수출 효자 상품인 ‘핵불닭볶음면’ 등 일부 제품을 리콜 조처하면서 삼양식품은 다른 나라로까지 이 사안이 번지지 않을까 전전긍긍하는 모양새다. 불닭면 인기에 힘입어 지난 2022년 밀양 제1공장에 이어 지난 3월 밀양 제2공장 설립에 나서는 등 생산라인 증설에 나선 삼양으로서는 대응책 마련에 부심 중이다.14일 삼양식품에 따르면, 이 회사는 덴마크 수의학·식품청(DVFA)의 리콜조처에 맞서 본격적인 대응 방법 모색에 나섰다. 삼양식품 관계자는 “불닭면을 전 세계에 수출 중이지만, 이런 이유(급성 중독을 일으킬 위험 등)로 리콜조치를 받은 것은 처음이다. 유럽연합 식품법규 내 캡사이신 함량에 관한 명확한 규정이 없다”며 “현재 국가 공인 검사기관에 캡사이신 함량에 대한 분석을 의뢰했으며, 공식 검사 결과와 현지 관련 규정을 면밀히 파악 후 이번 리콜 조치를 해결하고자 노력하겠다”고 밝혔다.앞서 덴마크 식품당국은 삼양식품의 불닭 시리즈 제품 중 ‘핵불닭볶음면 3배 매운맛’ 등 3종에 대해 “캡사이신 함량이 너무 높아 소비자가 급성 중독을 일으킬 위험이 있다”며 “제품을 갖고 있다면 폐기·반품해달라”고 리콜 명령을 내렸다.덴마크 수의학·식품청 누리집 갈무리유럽연합 식품법규 내 캡사이신 함량에 관한 명확한 규정은 없다. 업계에서는 유엔(UN)에서 고추의 매운맛을 구분 지은 범주를 참고할 수 있다고 설명한다. 유엔 기준에 따르면, 매운맛을 나타내는 스코빌지수는 마일드, 미디움, 핫, 엑스트라핫 등 4등급으로 나뉘는데, 이번에 문제가 된 삼양의 핵불닭면 등 3종의 스코빌지수는 미디움 범주에 속한다는 설명이다. 이는 할라피뇨 고추와 비슷한 수준이다.불닭볶음면의 인기가 날로 높아지면서 앞서 에스엔에스(SNS)에서도 한차례 소동이 일었다. 지난 4월 미국 워싱턴주에 사는 한 틱톡커 루시 모라드(24)가 “불닭볶음면을 먹고 신장 결석이 생겼다”고 주장하면서다. 그는 ‘불닭, 편히 잠드소서. 그립겠지만 내 신장은 너를 그리워하지 않을 거야’(riptobuldak,illmissyoubutmykidneyswont)라는 글과 함께 영상을 올렸는데, 조회 수가 1800만회를 넘어섰다. 그는 불닭볶음면에 빠져 6개월 동안 매주 먹었고, 복통·경련 증상으로 응급실을 찾은 결과 신장 결석으로 확인됐다고 주장한 바 있다.틱톡커 루시 모라드가 병원에 입원한 영상. 틱톡 갈무리업계에서는 캡사이신 급성 중독이나 신장 결석은 관련 제품을 웬만큼 먹어서는 발생하지 않는다고 지적한다. 식품업계 한 관계자는 “불닭면 정도 맵기면 하루에 몇 개씩 수개월~수년간 먹어야 나트륨 과다 섭취 등의 문제로 신장결석이 생길 우려가 있다”며 “단순히 매운 음식을 먹었다고 건강에 해롭다고 볼 수 없다”고 말했다.삼양식품은 이번 논란이 혹시라도 유럽연합에 속한 다른 나라로 옮겨붙을까 전전긍긍하고 있다. 이름을 밝히길 꺼린 삼양 관계자는 “일단 유럽 사람들이 매운 음식을 잘 섭취하지 않는 탓에 이런 논란이 벌어진 것으로 판단하고 있다”며 “혹시라도 다른 나라로 논란이 옮겨갈까 봐 적극 대응할 계획”이라고 말했다.삼양식품 주가는 지난 3월 국외시장서 불닭볶음면 인기에 20만원을 돌파한 뒤 급격히 올라 14일 오후 66만9000원에 거래되고 있다."
2024-06-12,"“핵불닭볶음면 급성 중독 위험. 폐기하시오”…덴마크, K매운맛 리콜","‘핵불닭볶음면 2배 매운맛’ 등 3종“캡사이신 너무 많아 급성 중독 위험”네티즌들 토론…“덴마크인은 후추도 맵대”전세계 사람들에게 한국인의 ‘매운맛’을 수출한 삼양식품의 불닭볶음면은 2023년 국외 매출액만 8천억원이 넘는다. 연합뉴스(☞한겨레 뉴스레터 H:730 구독하기.검색창에’h:730’을 쳐보세요.)덴마크가 세계적 인기를 끌고 있는 한국 삼양식품의 인기 제품 ‘불닭볶음면’ 3가지 맛을 리콜하기로 했다.덴마크 정부가 11일(현지시각) 삼양라면의 ‘핵불닭볶음면 3배 매운맛’(Buldak3xSpicy&HotChicken) ‘핵불닭볶음면 2배 매운맛’(2xSpicy&HotChickenandHotChickenStew) ‘불닭볶음탕면’(HotChickenStew)에 대해 리콜을 발표하고, 소비자들에게도 해당 제품을 폐기할 것을 권고했다고 영국 비비시(BBC) 방송이 보도했다.덴마크 수의학·식품청 누리집 갈무리덴마크 수의학·식품청 누리집을 보면, 관계 당국은 “단일 봉지에 들어있는 캡사이신의 함량이 너무 높아 소비자가 급성 중독을 일으킬 위험이 있다”며 이런 내용을 발표했다. 덴마크 수의학·식품청은 “제품을 갖고 있다면 폐기하거나 구매한 매장에 반품해달라”며 지나치게 매운 음식을 먹으면 어린이에게 해롭다고 알렸다. 비비시는 특정 사건으로 인해 덴마크 당국이 이런 조처를 하게 됐는지 알려지지 않았다고 부연했다.비비시는 해당 공지가 매운 음식을 좋아하는 덴마크인들로부터 토론 거리가 됐다며 “많은 이들이 덴마크인들이 향신료에 대한 내성이 약하다고 주장했다”고 밝혔다. 예컨대 토론 사이트인 ‘레딧’의 라면 포럼에 이 내용이 공유된 뒤 “나는 맛없는 빵가루를 입힌 새우에 약간의 후추를 뿌리는 것이 너무 맵다고 생각하는 덴마크 친구가 있었다. 그들이 이 라면을 독이라고 생각하는 것이 놀랍지 않다”는 댓글이 올라와 많은 누리꾼의 공감을 얻고 있다고 소개하기도 했다.비비시는 삼양식품의 해당 제품이 다른 나라에서 이런 내용의 ‘안전 경고’를 받은 적은 없는 것으로 보인다고 덧붙였다.불닭볶음면은 미국에서 품귀 현상까지 빚어질 정도로 전세계적 인기를 끌고 있다. 이런 호응에 힘입어 삼양식품 매출 가운데 해외 매출의 비중은 올해 1분기 75%로 지난해 1분기(64%)보다 11%포인트나 뛰었다. 삼양식품은 이날 입장을 내어 “해당 제품의 품질에 문제가 있어 리콜 조치한 것이 아니라, 너무 매워 문제를 일으킬 소지가 있다며 덴마크 식약처에서 자체적으로 리콜 조치한 것으로 파악된다”며 “현재 해당 제품들은 전세계에 수출 중이나, 이런 이유로 리콜 조치를 받은 것은 이번이 처음이다. 현지 관련 규정 등을 면밀히 파악해 이번 리콜 조치에 대응해 나갈 계획”이라고 밝혔다."
