date,title,content
2022-03-28,끝나지 않은 ‘매운맛 전쟁’…신흥 강자는?,"왕뚜껑으로 유명한 팔도가 최근 내놓은 컵라면이 화제다. 검은색 바탕에 빨간색 테두리, 고추 그림이 여러 개 그려진 뚜껑만 봐도, 매운 라면이라는 걸 한 눈에 알 수 있다. 이름 그 자체도 ‘킹뚜껑’이다. 이 라면은 베트남 하늘초와 청양고추를 베이스로 스프를 만들어 짜릿하게 매운맛을 낸 것이 특징이다.킹뚜껑‘킹’은 요즘 젊은 세대 사이에서 많이 쓰이는 접두어다. 주로 엄청 화가 났다는 걸 표현할 때 ‘킹 받는다’고 쓴다. 이런 용례에 비춰보면 킹뚜껑도 진짜 ‘킹 받을’ 정도로 매운 왕뚜껑이라는 뜻이다. 엄청 매운 라면이라는 이름처럼 킹뚜껑의 스코빌 지수(Scovillescale)는 1만2000SHU에 달한다. 매운맛 매니아들 사이에서 가장 인기가 높은 불닭볶음면의 스코빌 지수인 4404SHU와 비교하면 세 배 가량 맵다. 불닭볶음면 중에서도 가장 매운 제품이라는 핵불닭볶음면(1만SHU)과 비교해 봐도 훨씬 맵다. 팔도는 국내 컵라면 가운데서는 킹뚜껑이 가장 맵다고 밝혔다.왕뚜껑의 매운맛 버전인 킹뚜껑은 2022년 1월 첫 출시됐다. 킹뚜껑은 출시 이후 엄청 매운 라면이라는 입소문을 타면서 한 달만에 초도물량 150만개가 전부 팔려 나갔다. 엄청난 인기로 150만개를 추가로 앵콜 판매했을 때도 역시 한 달만에 완판됐다.MZ세대를 중심으로는SNS상에서 킹뚜껑을 맛본 사람들의 후기가 유행처럼 번지기도 했다.팔도는 킹뚜껑 외에 2022년 2월 원조 매운 라면격인 틈새라면의 새로운 제품인 ‘틈새라면 매운짜장’과 ‘틈새라면 매운카레’ 등 신제품 2종을 출시했다. 샘표 역시 자사의 스테디셀러 제품인 ‘질러 육포’에 매운맛을 더한 ‘질러 직화풍BBQ핫칠리’ 맛을 새로 출시했다. 이 제품은 불에 바로 구운 듯한 육포에 고추의 화끈한 매운맛을 입힌 제품이다. 여기에 불닭볶음면을 만든 삼양식품이 2022년 3월 말 ‘불닭짬뽕’과 ‘불닭스리라차’를 새로 출시할 예정이라 간편하게 조리해 먹을 수 있는 매운맛 식품의 종류는 더 늘어날 예정이다. 불닭짬뽕은 고기육수에 불닭소스를 더운 국물라면 제품이며 맵기는 그나마 불닭라면 중에서는 ‘양반’으로 평가 받는 ‘까르보불닭볶음면’과 비슷한 수준인 것으로 전해졌다. 불닭스리라차는 불닭소스에 글로벌 핫소스인 스리라차의 맛을 더한 볶음면 제품이다.‘매운 고추를 고추장에 찍어 먹는 한국인’ 매운맛 사랑 여전2012년 불닭볶음면 흥행부터 매운맛 제품 끊이지 않아‘선 넘었다’는 매운맛 아이스크림까지 나와우리나라에서 이렇게 매운맛 식품들이 인기를 끄는 이유를 두고 누군가는 필연이라고 평가했다. 애초에 그냥 먹기도 매운 고추를 자연스럽게 고추장에 찍어먹으며, 다른 어느 나라보다도 고춧가루가 들어간 빨간 음식이 유독 많은 데다, 매운 음식을 잘 먹는 것을 자랑내지는 자부심으로 여기는 일명 ‘맵부심(매운맛 음식도 잘 먹는다는 자부심)’을 부리는 사람들이 많은만큼 그럴 만도 하다는 것이다.실비김치를 먹어 보는 개그우먼 신봉선과 안영미(왼쪽 사진), 송주불냉면을 먹은 유튜버 ‘쯔앙’매운 음식은 2012년 삼양식품이 내놓은 불닭볶음면이 대성공을 거두면서 마라탕, 실비김치, 송주불냉면의 유행 등으로 이어졌다. 특히 불닭볶음면은 유튜브 등을 통해 불닭볶음면 챌린지라는 세계적 유행을 만들어낼 정도로 인기였다. 이 유행을 타고 불닭볶음면의 매출은 2012년 75억원에서 2019년 4100억원으로 크게 증가했다.매운맛이 워낙 인기가 좋다 보니 매운맛 제품의 라인업이 늘어나다 못해, 달콤함의 대명사인 아이스크림까지 매운맛에 점령 당했다. 2021년 롯데제과는 국내 최초로 매운맛 아이스크림인 ‘찰떡아이스 매운 치즈떡볶이’ 제품을 한정판으로 출시했다. 할라피뇨 성분이 들어간 주황색 떡 안에 매운맛 쿠키가 박혀 있는 크림체다치즈 아이스크림을 넣은 제품이었다.빙그레도 매운맛 승부에 도전장을 내고 기존 붕어싸만코에 불닭소스를 첨가한 ‘멘붕어싸만코(정신을 차리기 어려운 상황이라는 뜻의 ‘멘붕’이라는 단어에 붕어싸만코 제품명을 더한 이름)’를 출시했다.2021년에는 2022년보다 더 자극적인 제품들이 많았다.CU편의점은 스코빌 지수가 220만SHU에 달하는 캐롤라이나 리퍼 고추를 넣은 ‘뉴 자이언트 왓더맵 떡볶이’를 내놨었고, 미니스톱은 스코빌지수 1만444SHU의 ‘불마왕볶음면’을 출시했다. 미니스톱은 스코빌 지수가 35만SHU에 달하는 ‘지옥불카레’를 내놓으면서 매운맛을 즐기는 이들의 구미를 당기게 했다.김치 브랜드 대상 종가집은 불타는 매운맛을 살린 ‘핵매운 김치’와 알싸한 마늘 맛이 강렬한 ‘마늘듬뿍김치’를 내놨다. ‘열탄불고기’와 ‘7분 김치찌개’로 유명한 새마을식당은 매운맛을 강조한 ‘용암에 빠진 열탄불고기’를 출시하기도 했다. 이 제품은 베트남 건고추를 넣어 만든 소스를 이용해 매운맛이 강하면서도 먹을수록 입안이 얼얼해진다는 특징을 가지고 있다.매운맛 제품 많기도 하지만 그만큼 잘 팔려스트레스 해소에 좋지만, 위 건강 위해 적당히 먹어야붉닭볶음면매운맛 제품이 시장에 많이 나오는 이유는 유행 탓도 있지만, 매운맛 자체가 잘 팔리는 제품의 특성 가운데 하나라는 분석도 있다. 실제 이마트가 2021년 매출을 분석해 내놓은 자료를 보면 매운맛을 찾는 수요가 직전 해에 비해 증가한 것으로 나타났다. 대표적인 매운맛 제품인 ‘불닭·핵불닭’ 소스의 2021년 매출은 전년 대비 16.8% 증가했다. 같은 기간 와사비와 칠리, 고추장의 매출은 각각 27.6%, 15.5%, 5.4% 올랐다. 특히 봉지 라면의 경우에는 2021년 매출이 전년보다 1% 가까이 늘었지만, 불닭볶음면과 틈새라면, 앵그리 너구리 등 매운 라면만으로 좁혀 보면 매출 신장률은 7%로 껑충 뛴다.매운맛은 많이 먹을 경우 위와 장 등에 자극을 줄 수 있어 적당히 먹어야 하지만 순기능도 있다. 무엇보다 스트레스 해소에 좋다. 매운맛은 미각이 아닌 통각으로 인지하는데, 반사적으로 이 고통을 덜기 위해 뇌하수체 전엽에서 엔돌핀(Endorphin·EndogeneousMorphine)을 분비하기 때문이다. 엔돌핀은 통증을 억제하는 호르몬으로 기분을 좋게 만든다. 대표적인 매운 음식인 고추에는 비타민C가 일반 과일보다 많으며 지방과 당을 연소해 다이어트에 효과가 있는 것으로 알려졌다. 고추에 들어있는 캡사이신 성분이 항산화 역할과 함께 암세포의 생장을 방해한다는 연구결과도 있다.☞스코빌 지수스코빌 지수는 고추에 포함된 캡사이신의 농도를 계량화한 것으로, 맵기를 표현하는 단위(ScovilleHeatUnit,SHU)다. 캡사이신이 없는 고추의SHU는 0이다. 청양고추의SHU는 1만~3만 수준이다.SHU가 가장 높은 식품으로는 인도의 부트 졸로키아 고추, 중국의 트리니다드 스코피언 부치 티 고추 등이 있다. 이들 고추의SHU는 85.5만~318만으로 알려져 있다."
2022-03-09,벌써 막오른 ‘비빔면 전쟁’,"팔도 맵지 않은 신제품 출시… 농심 배홍동 비빔면 1위 도전비빔면 제품들. /농심·삼양식품·팔도대표적인 여름철 제품인 비빔면 시장 경쟁이 벌써부터 치열해지고 있다. 비빔면은 보통 추위가 풀리는 3월부터 소비가 증가하기 때문에 주요 업체들의 시장 선점을 위한 마케팅 전쟁이 이때부터 본격화된다. 국내 비빔면 시장은 2015년 757억원에서 작년 1500억원 수준으로 거의 배로 커졌다.비빔면 시장 1위인 팔도는 이달 초 신제품 2종을 출시했다. 맵지 않은 비빔면으로, 기존 비빔면과 달리 고소한 맛을 강조했다. 각각 들깨 소스와 발효 간장을 기본 양념으로 사용했다. 팔도 관계자는 “신제품을 통해 맵지 않은 비빔면 시장을 적극적으로 공략하겠다”고 말했다. 지난 1월엔 기존 제품보다 양을 20% 늘린 팔도비빔면 용기면을 내놨고, 비빔면 봉지면도 양을 늘려 내놓을 계획이다.지난해 출시한 배·홍고추·동치미로 만든 배홍동 비빔면의 흥행에 힘입어 비빔면 시장 2위에 오른 농심은 올해도 배홍동 비빔면을 내세워 비빔면 시장 1위에 도전한다는 계획이다. 이를 위해 온·오프라인 마케팅 활동을 대폭 강화할 방침이다.삼양식품은 기존 비빔면 대비 양을 21% 늘린 ‘비빔밀면’을 지난달 22일 출시했다. 감자 전분을 배합해 쫄깃한 식감을 구현했다. 회사 관계자는 “현재 판매되고 있는 국내 비빔면 제품 가운데 가장 양이 많다”고 했다. 삼양식품은 신제품 출시와 함께 기존 열무비빔면 생산도 재개했다. 오뚜기는 진비빔면을 리뉴얼해 선보인다는 계획이다."
2024-08-08,美서 출시됐는데 인기 폭발… 한국으로 역수출된다는 K 라면,"오뚜기가 미국에서만 판매되던 수출 전용 제품 ‘보들보들 치즈볶음면 매운맛’을 국내에 정식 출시한다. 2022년 4월 미국에서 출시된 이 제품이 국내 여행객이나 소비자들 사이에서 인기를 끌자 국내 출시를 결정한 것이다.오뚜기 관계자는 “해당 제품을 맛보기 위해 해외에서 제품을 구매하거나 역직구를 하는 소비자들이 늘고 있다”며 “해외 전용 제품을 국내에서 정식 출시하는 것은 보들보들 치즈볶음면이 처음”이라고 했다. 오뚜기에 따르면 해당 제품 현지 판매량은 2022년 출시 당시 매달 평균 2000여 박스(박스당 30개입)에서 올해에는 매달 평균 3500박스까지 늘었는데, 이에 따라 국내에서도 제품 경쟁력이 충분하다고 판단한 것이다.보들보들 치즈볶음면 매운맛. /오뚜기오뚜기의 ‘보들보들’ 시리즈는 2010년 국내에서 처음 출시됐다가 2년만에 단종됐고, 이후 수출 전용으로 전환돼 10여년간 해외에서 꾸준한 매출 성장세를 보이고 있다. 치즈라면(봉지라면·컵라면)과 치즈볶음면의 두 종류가 해외에서 판매되고 있다. 이번에 출시된 제품은 치즈볶음면 중에서도 매운맛을 더한 제품으로, 매운맛을 나타는 지표인 스코빌 지수는 4500SHU에 달한다. 삼양식품 불닭볶음면과 비슷한 수준이다.오뚜기는 이 제품을 오는 13일부터 네이버쇼핑 생방송을 통해 선보일 계획이다. 이후 오뚜기몰 등 다양한 온라인 쇼핑몰을 통해 구매할 수 있다."
2024-07-24,“엔비디아보다 더 뛰었다”… 코스피 상승률 1~2위 종목은,"HD일렉, 장중 37만4500원 찍어올 들어 355% 급등, 상승률 1위[왕개미연구소]HD현대일렉트릭 변압기 스마트 공장에서 작업자들이 키오스크를 통해 도면을 확인하고 있다. 기사 내용과 무관함. /HD현대일렉트릭 제공전기 전압을 바꿔주는 변압기 관련 주식들이 올해 최고의 전성기를 누리고 있다. 한국거래소에 따르면, 올해 코스피 상승률 1~2위 종목들이 전부 변압기 관련주였다. 신재생에너지와 전기차 확대, 인공지능(AI) 데이터센터 증설 등 미국을 중심으로 전력 인프라 구축 수요가 늘어나면서 변압기 업체들의 실적이 급상승한 영향이다.24일 유가증권 시장에서 변압기 대장주로 꼽히는HD현대일렉트릭(이하HD일렉)은 전날보다 5.6% 상승한 36만5500원에 마감했다. 장중 37만4500원을 찍으면서 2017년 상장 이후 역대 최고가를 기록했다.HD일렉은 연초 이후 이날까지 355% 오르면서 800여 코스피 종목 중 상승률 1위를 기록 중이다.전날HD일렉이 발표한 2분기(4~6월) 영업이익은 전년 동기 대비 257% 증가한 2100억원이었다. 상반기(1~6월) 누적 영업이익은 3388억원으로, 이미 지난해 연간 영업이익(3152억원)을 넘어섰다. 금융정보업체 에프앤가이드가 집계한 시장 전망치(1243억원)도 훨씬 웃돈다.HD일렉은 지난 2017년HD현대중공업에서 분사했을 때만 해도 적자 기업이어서 그룹 내 입지가 좁았지만, ‘전력 수퍼사이클’이 찾아오면서 7년 만에 그룹 내 핵심 계열사로 부상했다. 외국인은 올해HD일렉 주식을 1조원 넘게 사 모았다. 상장 이후 지난 7년간 외국인의 순매수 금액은 1년에 많아 봤자 1500억원이었다. 업계 관계자는 “외국인들은 돈 되는 곳은 기막히게 잘 찾아내는 것 같다”고 평했다.한편, 올해 코스피 상승률 1~5위 중 삼양식품(211%)을 빼면, 나머지 4종목은 모두 전기 관련 업체였다(LS일렉트릭 259%, 대원전선 208%, 삼화전기 192%). 이들 종목은 모두 미국AI반도체 기업인 엔비디아의 올해 주가 상승률(145%)을 압도한다.오는 11월 미국 대선에서 친환경 정책에 비우호적인 도널드 트럼프 전 대통령이 승리하더라도 전력 기기 업계의 호황은 지속될 것이라는 분석이 나온다.이민재NH투자증권 연구원은 “미국 대선 결과와 무관하게 전력망 투자는 계속될 것으로 보인다”며 “전력 수요가 늘어나는 상황에서 안정적이고 값싼 전력망 구축 등은 필수적이라서 정책적 지원도 이어질 것”이라고 말했다.전기 설비 관련 상장지수펀드(ETF)도 속속 나오고 있다. 이달에만KodexAI전력핵심설비,Kodex미국AI전력핵심인프라,KoActAI인프라액티브,SOL미국AI전력인프라 등 4종이 새로 나왔다."
2024-07-10,“1억 넣었는데 月 200만원 받았다”... 특별 배당에 투자자 깜짝,"[여의도 황금손] ②김남호 타임폴리오운용 펀드매니저상가가 없어도, 투잡을 뛰지 않아도 매달 꼬박꼬박 현금이 통장에 꽂힌다면? 월(月) 배당 상장지수펀드(ETF)는 이런 로망을 품은 사람들을 위한 상품이다. 주로 채권과 배당주에 투자하는데, 운용 수익의 일부를 매달 투자자에게 분배금 형태로 나눠준다. 고정 수입이 끊긴 은퇴 생활자들이 생활비 재원으로 주목하면서 월 배당ETF시장은 현재 10조원 규모로 커졌다.이달 현재 국내에서 거래되는 월 배당ETF는 총 67개다. 배당이 많고 배당 주기가 짧은 미국 증시에 투자하는 상품들이 대부분이다. 그런데 타임폴리오운용의 ‘KOREA플러스배당액티브ETF(이하 배당액티브)’는 지난 2022년 9월 국내 증시에 투자하는 첫 월 배당 상품으로 데뷔했다. 매달 원금의 0.5%씩, 연 6% 배당을 내걸었다.이ETF는 출시 당시만 해도 “한국 증시는 잘 오르지 않고 배당 수익률도 신통치 않은데 월 배당 약속을 지킬 수 있겠느냐”는 우려가 많았다. 하지만 기우였다. 출시 이후 배당액티브 수익률은 지난 5일 49%에 달했고, 연 6%인 배당 수익을 재투자했다고 가정하면 수익률은 67%에 달한다. 같은 기간 코스피200 지수 상승률(36%)의 2배 수준이다.배당액티브의 운용을 맡고 있는 30대 펀드매니저 김남호 부장은 “지난 5일 배당액티브ETF가 사상 최고가를 찍으면서 사실상 모든 가입자의 계좌가 플러스(+)를 기록했다”면서 “배당 재원이 많이 쌓여서 지난 달엔 1% 보너스 배당까지 추가로 지급했다”고 말했다.박스권에서 움직이는 척박한 국내 증시 상황에서 어떻게 모든 투자자가 플러스 수익을 챙기게 된 걸까. 김남호 매니저의 얘기를 들어봤다.김남호 타임폴리오운용 부장은ETF로만 10년째 한우물을 파고 있는 30대 펀드매니저다. 뉴욕주립대 수학과를 졸업했다. 김 부장은 “투자자들에게 초과 성과를 안겨준다는 건 짜릿한 일”이라며 “꾸준하게 개미처럼 성실하게 올라가는 월배당 상품으로 만들겠다”고 했다./이경은 기자–어떻게 투자 승률을 높였나.“월 배당 상품은 초과 성과를 내지 못하면, 원금을 일부 헐어 현금을 내줄 수밖에 없다. 안정적인 배당주로만 포트폴리오를 구성하면 원금을 까먹지 않으면서 월 0.5% 배당 약속을 지키기 어렵다. 그래서 매니저가 적극적으로 종목을 골라 운용하는 액티브ETF라는 특성을 살려 포트폴리오 색깔을 빠르게 바꿔 초과 수익을 노렸다. 강세장에서는 적극적으로 주도주를 편입시키고, 배당 시즌에는 고배당주를, 실적 시즌엔 대형 수출주를 매매하는 식이다. 주가가 과열되었다고 생각되면 투자 비율을 과감히 축소했다.”–공수 전환이 매우 빠른 것 같다.“그렇다. 마치 카멜레온처럼 포트폴리오 색깔이 거의 매달 바뀐다. 가령 인공지능(AI) 테마는 글로벌 메가트렌드이기 때문에 일단 사두고 버티면 수익을 낼 확률이 높다. 배당 역시 장기간 통용될 중요한 테마이지만, 주가가 횡보하는 지루한 구간이 있게 마련이다. 액티브ETF매니저의 역량은 이런 시기에 발휘된다. 오를 만한 종목이나 테마를 길목 지키듯 미리 사서, 좋은 타이밍이 오길 기다린다. 수익률이 떨어지는 걸 방치하지 않고, 주가가 오를 만한 종목을 적극적으로 매매해 수익을 좇는다.”그래픽=이진영–지금은 어떤 테마에 주목하는가.“정부가 추진하는 밸류업(기업 가치 제고) 정책에 주목하고 있다. 밸류업이 잘 정착되면 외국인 투자가 더 늘어나고 한국 증시는 그야말로 퀀텀 점프 할 수 있을 것이라고 본다. 정부가 발표한 것처럼 3분기(7~9월) 중에 ‘코리아 밸류업 지수’가 나온다면, 해당 지수를 추종하는 자금이 몰리면서 편입 종목들의 주가는 크게 오를 것이다. 유입되는 자금 규모가 대략 1조원 이상일 것이라고 예상하고 있다. 주가가 많이 오른IT(정보 기술)주 등의 비율을 줄이고, 그 대신 밸류업 수혜를 받을 종목들을 발굴해 대응할 생각이다.”–최근 1% 특별 배당이 화제였다.“지난 달 K푸드 열풍이 불면서 보유 중이던 삼양식품 주가가 크게 올랐다(6개월간 188% 상승). 라면 등의 수출 실적이 좋아 주가가 더 오를 것이라고 보고 비율을 미리 늘렸는데, 예상이 적중했다. 덕분에 1% 특별 배당까지 할 수 있었다. 만약 1년 전에 1억원어치 매수한 투자자라면, 1회성 특별 배당이 더해져서 이달 초 약 200만원의 현금이 지급됐을 것이다. 부모님과 친척들 모두 (내가 운용하는 이 상품을) 매수해 보유 중인데 깜짝 보너스에 매우 기뻐하셨다.”"
2024-06-29,“더 더 더 더 맵게!”... 맵부심에 속 버리는 한국,"[아무튼, 주말]시장은 ‘맵게 더 맵게’ 경쟁“스읍, 하, 스읍, 하아아.... 맵긴 한데 부족해요. 더 맵게 해주세요!”대한민국은 지금 맵파민(매운맛+도파민)에 빠졌다. 더 자극적이고 강렬한 맛을 원하고 있다. 세계적으로도 한국의 맛은 고추장, 고춧가루 맛으로 통할 정도로 K푸드 중심에 매운 음식이 자리 잡았다. 불티나게 팔리는 삼양식품 불닭볶음면 3종이 ‘캡사이신 수치가 높아 급성 중독 위험이 있다’는 이유로 덴마크 시장에서 회수되는 상황까지 벌어졌으니 아이고, 맵다 매워.유튜버 ‘맵하니’가 스코빌지수 2만3000SHU인 지옥맛 불만두를 먹고 있다. 매운 음식을 위주로 먹방을 진행, 작년부터 구독자가 급격히 늘었다. 약 30만명. 매운 음식을 먹고도 맵지 않다고 평가하는데, 이 채널PD는 늘 이 말을 믿고 따라 먹다 고통을 호소한다./유튜브그런데도 소비자는 더 매운맛을 원하고, 시장은 그 욕구를 반영해 제품을 쏟아내고 있다. 밀크티에 떢볶이 소스를 버무린 펄을 얹어 팔고, 연일 ‘열’ ‘불’ ‘핫’ ‘땡초’ 등을 붙이며 누가 더 매운가 경쟁하기 바쁘다. ‘괴식’이라고 조롱해도 상관없다. 잘 팔리면 그만이니까. 소비자는 여름도 왔겠다, 내 주머니 사정은 좋지 않은데 물가는 오르겠다, 스트레스까지 겹치니 ‘이열치열’이다. 오늘도 매운 음식을 찾아 식당을 고르고 배달앱을 켠다. 속이 빨갛다 못해 검게 타들어 가고 있다는 걸 망각한 채.매운 음식 먹방 챌린지 같은 영상은 유튜브, 인스타그램 등 소셜미디어(SNS)에 널려 있다. “살려줘” “실명 위기” “사장님이 절대 못 먹을 거래요” “지옥불 경험” “기네스북에 오른 세계 1위 고추로 만든 짬뽕” “먹다가 기절” “각서 쓰고 먹는 열짜장” 등 클릭을 유도하는 섬네일만 봐도 매워서 입에 침이 고일 지경이다.신길동 짬뽕, 신대방삼거리 디진다돈까스, 송주 불냉면 등 전국 3대 매운맛 식당은 마니아층에서 유명하다. 자칭 ‘맵고수(매운 거 잘 먹는 사람)’인 인플루언서가 이곳에서 너무 매워 1리터짜리 우유를 몇 개나 먹어치웠다는 후일담이 넘쳐난다. 그런데도 이들을 따라 지갑을 여는 소비자들로 이 식당들은 오픈런을 해야 할 만큼 문전성시다. 이러니 카레, 만두, 파스타, 닭발, 김밥 같은 음식을 파는 가게도 1단계부터 10단계, 더 심하게는 원자폭탄급 맛, 사망 맛이라고 홍보하며 그 뒤를 쫓아가고 있다.치킨, 햄버거, 과자, 라면 등을 파는 프랜차이즈, 식품 업계도 앞다퉈 맵게 더 맵게 경쟁 중이다. 매운맛은 2020년을 전후로 ‘불닭볶음면’이 대박을 친 이후 식품업계의 메가 트렌드로 자리 잡았다. 시간이 지날수록 소비자들이 원하는 매운 강도가 세지는 경향을 보이고 있다. 1980년대 출시된 농심 신라면의 스코빌지수(맵기 척도로 캡사이신 농도를 계량화한 수치)가 1300SHU였는데, 40년이 흐른 지금 3400SHU까지 올라갔다. 소비자 입맛이 얼마나 많이 자극적으로 변해왔는지. 최근엔 염라대왕라면 2만1000SHU,극한체험 틈새라면 1만5000SHU등 ‘3배 매운 불닭볶음면’ 1만3000SHU보다 ‘더 매움’을 자랑하는 라면들도 시장에 데뷔하고 있다. 매운맛 열풍이 한국만의 현상은 아닌 것 같다. 미국에서도 코카콜라가 매운맛 콜라를, 스타벅스가 매콤한 칠리파우더를 첨가한 음료를 선보였다.업계에는 “경기가 안 좋으면 매운 음식이 더 잘 팔린다”는 말이 있다. 매운맛을 내는 캡사이신은 아드레날린과 엔도르핀을 분비해 일시적 스트레스 해소에 도움을 준다고 알려져 있다. 매운 게 잘 팔리면 그 사회의 스트레스 지수가 높아지고 있다는 뜻일 수도. 그러나 최근엔 “핵심 소비층인MZ의 맵부심(매운맛+자부심) 영향이 큰 것 같다”는 분석이 많다.유행도 좋지만 건강은 꼭 챙기면서 먹어야 한다. 세상에서 가장 매운 과자로 유명한 미국 업체의 ‘파퀴 원칩’.빨간색 해골이 그려진 관 모형의 포장 박스에서 느껴지듯 이 과자 한 조각의 맵기는 220만SHU.이걸 먹고 작년 미국의 한 10대가 기절한 뒤 사망했는데 사인은 심폐정지였다. 얼마나 맵겠냐고 쉽게 먹었다가 목숨을 잃은 것. 우리나라 유튜버들이 원칩 챌린지에 도전한 영상도 쉽게 찾을 수 있다. 당시 이 과자는 결국 판매가 중단됐었다. 최근엔 미국 10대가 1600만SHU인 트러블버블껌을 씹다 화상으로 병원에 입원을 했다든가, 중국 여성이 매운 마라탕을 먹고 인후통과 호흡 곤란으로 사망했다는 뉴스도 나왔다. 매운맛에 목숨까지 걸 일인가?"
