date,title,content
2023-08-02,"500대 중견기업, 대기업보다 상반기 순고용 증가율 앞서…자화전자 1위","올해 상반기 국내 상장 중견기업들은 지난해 말 대비 0.9% 늘어난 2080명을 순고용한 것으로 나타났다. 같은 기간 순고용 인원이 0.6% 늘어난 대기업보다 증가율이 0.3%포인트 높았다.서울 남산에서 바라본 도심의 주요 기업체 건물./ 연합뉴스2일 기업데이터연구소CEO스코어는 500대 상장 중견기업의 국민연금 가입자 기준 고용현황을 조사한 결과, 올 상반기 순고용이 지난해 말 대비 0.9% 늘었다고 밝혔다. 상반기 상장 중견기업의 국민연금 가입자격 신규 취득자는 2만7927명, 상실자는 2만5847명으로 순증가 인원은 2080명이었다.이에 따라 상반기 기준 500대 상장 중견기업의 총 고용 인원은 22만2696명을 기록해 순고용 증가율은 0.9%였다. 대기업보다 0.3%포인트가 높았다.기업별로는 고사양 카메라 모듈용 핵심부품 등 전자부품을 제조하는 자화전자(472명)가 가장 많았고, 메가스터디교육(268명), 티웨이항공(229명) 등이 뒤를 이었다.자화전자는 작년 말 1923억원을 투자해 구미국가산업단지에 애플 납품용 ‘광학식 손 떨림 보정 부품(OIS)’ 생산 공장을 설립해 신규 고용이 늘어난 영향으로 분석됐다. 티웨이항공은 코로나 엔데믹(감염병의 풍토병화)에 따라 노선 확대를 위해 부기장, 객실승무원, 항공정비사 등 여러 직군에서 신입·경력 채용을 확대했다.순고용 인원이 가장 많이 줄어든 곳은 통신장비 케이스 전문 제조업체 서진시스템으로 157명 감소했다. 그외 서울바이오시스(-90명) △SUN&L(-87명) △네패스(-85명) △서울반도체(-84명) △쌍용정보통신(-83명) △펄어비스(-81명) △코스메카코리아(-75명) △씨젠(-75명) △피에이치에이(-74명) 등 바이오,IT분야 업종의 순고용 감소가 두드러졌다."
2023-06-23,"한국, 베트남과 MOU 111건 역대최다 체결... 교역 2배로","韓·베트남 600여명 한자리에추경호 경제부총리와 응우옌 찌 중 베트남 기획투자부 장관이 23일(현지시간) 하노이 베트남 주석궁에서 한-베트남 정상 임석하에 열린 협정서명식에서 '한-베트남EDCF·EDPF를 통한 경제협력에 관한 양해각서'를 체결하고 있다. 2023.06.23. 뉴시스23일 오후 4시 30분(현지 시각) 베트남 하노이의JW메리어트 호텔은 한국과 베트남 정·재계 인사 600여 명으로 발 디딜 틈이 없었다. 윤석열 대통령의 국빈 방문을 계기로 한국과 베트남이 맺은MOU(양해각서) 111건 체결식 때문이었다.MOU가 너무 많아 시간을 줄이려 기념식을 5건씩 한꺼번에 진행했다. 양국 기업인 10명이 양해각서를 들고 나와 양국 주무 장관들 옆에서 기념촬영을 반복하는 식으로 진행했다. 근데 이마저도 30분을 예상했는데 실제는 40분 넘게 걸렸다. 이날 성사된MOU111건은 우리나라 역대 대통령 해외 순방 성과 중 최대 규모다. 이전 기록은 박근혜 전 대통령의 2016년 이란 방문 당시 66건이었다. 정부 관계자는 “111건의 체결식을 1분씩만 해도 111분(1시간 51분)이 걸려 행사를 어떻게 진행할지 고민이 많았다”며 “대표적인 몇 건만 기념식을 하자는 의견도 있었지만, 모두 의미 있는MOU이기 때문에 한꺼번에라도 나와 기념촬영을 하기로 했다”고 말했다.베트남을 국빈 방문한 윤석열 대통령과 보 반 트엉 베트남 국가주석이 23일(현지시간) 하노이 베트남 주석궁에서 열린 협정 서명식을 하고 있다. /뉴시스이날 맺은MOU111건에는IT·자동차·조선·철도·석유·건설·철강·식품·바이오·의료기기·소프트웨어·법률·디지털교육·콘텐츠·방산·원전·항공·탄소중립에너지 등 우리 기업들이 주력하는 20여 업종이 총망라돼 있다. 기업도SK·GS·HD현대·두산 등 대기업부터 서울반도체·야놀자 같은 중소기업·스타트업까지 참여했다. 재계 관계자는 “베트남은 인건비가 한국의 10분의 1로 중국보다 저렴하고 한국에 호의적이라 탈중국 공급망 구축을 위한 핵심 지역으로 떠오르고 있다”며 “각종 기업들이 대거 진출하고 있어MOU가 그만큼 많았던 것”이라고 말했다. 특히 그동안 우리 기업에 불모지나 다름없던 베트남 방위산업과 에너지 인프라 시장에 진출이 가시화된 게 큰 의미라는 평가다.이날KAI(한국항공우주)는 베트남 최대 통신 기업 비에텔그룹 산하 항공연구소VTX와 베트남 헬기 수요를 발굴하고 회전익(헬기 날개)의 개발과 생산을 협력하기로 했다. 섬이 많아 항공 수요가 많은 베트남 시장에 국산 항공기 진출 기회가 생긴 것이다.비즈니스 포럼 참석한 정·재계 인사들 - 23일(현지 시각) 베트남 하노이JW메리어트 호텔에서 열린 ‘한·베트남 비즈니스 포럼’에 양국 600여 명의 정·재계 인사들이 참석해 한·베트남 새로운 30년을 위한 협력을 약속했다. 왼쪽부터 최태원 대한상의 회장(SK회장), 이창양 산업부 장관, 이재용 삼성전자 회장, 정의선 현대차 회장, 구광모LG회장, 신동빈 롯데 회장, 김동관 한화 부회장, 정기선HD현대 사장, 추경호 경제부총리, 구자열 무역협회장. /연합뉴스베트남 전력 인프라 구축에도 참여한다.GS에너지와 수출입은행은 베트남 최대 자산 운용사 비나캐피털과 손을 잡고 베트남 롱안성에 3GW(기가와트) 규모의 초대형LNG발전소 설립 프로젝트를 추진하기로 했다. 한국수력원자력(한수원)은 베트남원자력연구원과 원자력과 소형모듈원자로(SMR) 협력을 하기로 했다. 2016년 베트남 정부가 원전 도입을 취소하면서 위축됐던 양국 기술 교류가 재개되면, 원전 수출 기회도 마련될 전망이다. 이 밖에 한국가스공사와SK·두산 등도LNG발전, 친환경 연료 전환 등 베트남과 광범위한 에너지 협력을 하기로 했다. 재계 관계자는 “전력 인프라나 방산 진출은 국가 간 고도의 신뢰 관계가 있어야 가능한데 이번 대통령 방문을 계기로 성사된 것”이라고 말했다.앞서 이날 양국 정부는 2030년까지 상호 교역액을 작년의 2배 수준인 연 1500억달러(약 197조원)로 확대하자고 약속했다.이날 양국 정상과 4대 그룹 총수 등 양국 정·재계 600명이 어울린 ‘한·베트남 비즈니스 포럼’도 같은 장소에서 열렸다. 이와 별도로 손경식 경총 회장은 보 반트엉 베트남 국가주석을 만났다."
2022-11-04,"中 코로나로 폭스콘 공장 폐쇄, 아이폰 생산 큰 차질","아이폰14 생산 30% 감소 전망국내 협력업체도 영향 불가피애플 아이폰의 최대 생산 기지인 중국 정저우 폭스콘 공장이 코로나로 폐쇄되면서 최신 아이폰 14 시리즈 생산에 큰 차질을 빚게 됐다. 이 공장은 아이폰 14의 80%, 프리미엄 제품인 14 프로의 85% 이상을 생산하는 곳으로, 봉쇄 여파로 11월 아이폰 생산량이 30% 감소할 것이라는 전망까지 나온다. 특히 캐시카우인 아이폰 14 프로 시리즈의 전 세계 공급이 달리는 와중에 중국발 악재가 겹치면서 2일(현지 시각) 뉴욕 증시에서 애플 주가는 3.73% 급락했다. 11곳에 이르는 애플의 한국 부품 공급 업체들도 영향이 불가피할 전망이다.중국 당국은 폭스콘 공장이 위치한 허난성 정저우시 산업단지에 대해 2일 정오부터 7일간 폐쇄 명령을 내렸다. 로이터 등에 따르면 이번 조치는 정저우시에서 코로나 환자가 하루 만에 95명에서 359명으로 급증한 데 따른 것이다. 대만에 본사를 둔 폭스콘은 애플 아이폰의 최대 조립 생산 업체로, 정저우 공장이 최대 생산 기지다.앞서 정저우시는 코로나 확산으로 시 전역을 완전 봉쇄했으나, 폭스콘 공장만은 가동을 허용해온 상황이었다. 아이폰 14 출시 두 달도 안 된 상황에서 폭스콘은 근로자 출퇴근을 금지하고, 외부와 차단한 채 생산을 계속해왔다. 근로자들은 공장에서 숙식하며 아이폰을 생산했다. 하지만 지속되는 봉쇄에 불만을 가진 일부 근로자들이 공장을 탈출하는 사태가 벌어졌고, 중국 소셜미디어에는 짐과 이불을 들고 고속도로와 밀밭을 가로질러 달리는 이들의 모습을 담은 영상과 사진이 잇따라 올라왔다. 폭스콘은 이 같은 불만을 잠재우려 보너스를 4배로 늘리는 비상 조치를 취했지만, 결국 공장 폐쇄를 피하지 못한 것이다.애플은 선전을 포함한 중국 내 폭스콘 공장을 통해 정저우 공장의 공백을 최대한 메운다는 입장이지만, 성수기인 4분기를 앞둔 상황에서 타격이 클 수밖에 없는 처지다. 애플의 한국 협력사들도 영향이 불가피해졌다. 애플의 2021회계연도 공급망 목록에 따르면 삼성전자·SK하이닉스·LG화학·LG디스플레이·LG이노텍·LX세미콘·삼성SDI·서울반도체·영풍그룹·덕우전자·범천정밀 등 11곳이 애플과 거래 중이다. 반도체와 디스플레이, 카메라 부품,MLCC(적층 세라믹 콘덴서) 등 다양한 분야에 걸친다.애플이 지난달 아이폰 14 시리즈 증산 계획을 철회하면서 이미 한 차례 충격을 받은 상황에서, 중국 현지 봉쇄 리스크가 계속될 경우 부품 공급에 차질을 빚을 것이라는 우려도 나온다. 일단 국내 기업들은 “당장은 큰 문제가 없다”는 입장이다. 메모리 반도체 같은 경우에는 통상 3~4개월 전에 납품을 완료하고, 국산 디스플레이나 카메라 모듈이 들어가는 14 프로 시리즈는 애플이 최대 가용 인원을 동원해 생산 차질을 최소화할 것으로 전망되기 때문이다.이번 사태를 계기로 애플의 탈중국 행보는 더욱 가속화할 것으로 보인다. 애플은 올해 9월 인도에서 아이폰 14를 조립하고 있다고 공식 발표했다. 그동안 인도에서는 저가형 아이폰만 생산해왔는데, 자사 플래그십 생산 기지를 중국에서 인도로 옮겨가고 있는 것이다."
2022-11-03,애플 中 최대 생산기지 코로나로 폐쇄… 아이폰14 생산 비상,"“한국 협력사 피해는 적을 듯”2일 오후 서울 시내 애플스토어 외벽에 걸린 아이폰14프로 광고./뉴스1애플 아이폰 주요 생산 기지인 중국 정저우 공장이 코로나로 폐쇄되면서 최신 모델인 아이폰 14시리즈 생산에 차질을 빚을 전망이다. 이 공장은 아이폰 14 80%, 14프로 85% 이상을 생산하는 애플의 핵심 생산기지다. 직전까지 이어지던 부분 봉쇄 여파까지 겹치면서 애플의 11월 아이폰 생산량이 30% 감소할 것이라는 전망까지 나온다. 특히 프리미엄 모델인 14프로 시리즈가 전세계에서 공급 부족을 겪는 가운데, 애플에 비상이 걸린 것이다. 한편 봉쇄 소식이 전해지자, 뉴욕증시에서 애플 주가는 전날보다 3.73% 떨어졌다.애플 최대 생산기지, 7일간 봉쇄중국 폭스콘 노동자들이 도보로 도주하는 모습(트위터 캡처).2일(현지시각) 로이터 등 외신에 따르면 중국 당국은 이날 정오부터 허난성 정저우시 폭스콘 공장이 있는 산업단지에 대해 7일간 폐쇄 명령을 내렸다. 코로나 환자가 하루만에 95명에서 359명으로 늘어난 데 따른 조치다.앞서 정저우 시 정부는 코로나 확산으로 정저우 일대 완전봉쇄를 단행했으나, 폭스콘 공장은 그대로 가동을 허가해놓은 상황이었다. 폭스콘은 근로자 출퇴근을 금지하고, 외부와 차단한 채 생산을 계속해왔다. 근로자들은 24시간 공장에서 숙식을 해결하며 아이폰을 생산해왔지만, 지속되는 봉쇄로 불만을 가진 일부 근로자들이 공장에서 탈출하는 사태가 벌어지기도 했다. 중국 소셜미디어에는 직원들이 짐과 이불을 들고 고속도로와 밀밭을 가로질러 달리는 영상과 사진이 속속 올라왔다. 폭스콘도 직원 불만을 잠재우기 위해 보너스를 4배로 늘리는 비상조치를 취한 것으로 전해졌다.대만에 본사를 둔 폭스콘은 애플 아이폰의 최대 조립생산 업체다. 정저우 폭스콘 공장은 아이폰 14 시리즈 80%를, 14 프로 시리즈 85%를 생산하는 것으로 알려졌다. 특히 아이폰 14 신제품이 출시된지 두 달도 안된 시점에서, 공급망 차질은 애플에게 큰 타격이 될 전망이다.국내 협력사 영향은 적을 듯팀 쿡 애플CEO가 애플 제품을 만드는 대만 폭스콘 공장을 방문한 모습.한편 국내 협력사 영향은 적을 것이라는 전망이다. 메모리 반도체 같은 경우에는 통상 3~4개월 전에 납품을 완료하고, 국산 디스플레이나 카메라 모듈이 들어가는 14 프로 시리즈는 애플이 최대 가용인원을 동원해 생산 차질을 최소화 할 것으로 전망되기 때문이다.아이폰 14 프로 시리즈는 현재 전세계적으로 수요가 폭증하고 있는 상황이다. 애플이 불경기 속에서 이윤을 많이 남길 수 있는 프리미엄 라인인 14프로 시리즈는 어떻게든 생산량을 맞출 것이라는 관측이 나오는 것이다.애플의 2021회계연도 공급망 목록에 따르면 삼성전자·SK하이닉스·LG화학·LG디스플레이·LG이노텍·LX세미콘·삼성SDI·서울반도체·영풍그룹·덕우전자·범천정밀 등 11곳이 애플과 거래 중이다.IT업계 관계자는 “애플 중국 공장 폐쇄는 지난해와 올해도 산발적으로 겪었던 리스크”라며 “반도체도 재고가 충분한 상황이며, 디스플레이와 카메라 모듈도 14 프로용이 대부분이라 당장 큰 영향은 받지 않을 것으로 보인다”고 했다."
2024-12-27,"서울반도체, 필립스에 특허소송 승소","발광다이오드(LED) 전문기업인 서울반도체는 필립스와 특허소송에서 승소했다고 26일 밝혔다.독일 특허법원은 지난 17일(현지시간) 필립스 측이 서울반도체를 상대로 제기한 특허무효소송에서 서울반도체가 보유한 ‘CRI70’(색 재현율 70%) 기술 특허가 유효하다고 결론 내렸다.CRI70은 가정·차량용 조명, 백라이트 등에 사용되는 기술이다.이에 따라 필립스는 유통사 콘래드 일렉트로닉를 통해 2017년 3월부터 7년간CRI70기술을 적용, 판매한 제품을 전량 회수한 뒤 파기해야 한다. 이 명령을 위반하면 건당 25만 달러의 벌금을 부과 받는다.서울반도체 측은 “특정 제품을 지목한 게 아니라 특허 기술을 침해한 모든 제품에 효력이 발생해 조명·자동차·전자 등 완제품 시장에 100조원 이상 파급이 있을 것”이라고 말했다."
2024-08-16,[백우진의 돈의 세계] 일본 노벨상 학자와 서울반도체의 동행,"백우진 경제칼럼니스트·글쟁이㈜ 대표나카무라 슈지(中村修二)는 아웃사이더였다. 그가 전자공학 전공으로 석사까지 마친 곳은 도쿠시마(德島)대학교. 명문에는 한참 못 미친다. 1979년 입사한 회사는 니치아(日亞)화학공업. 중소기업이었다. 그는 반도체 특허를 다수 출원했으나 돈이 되지 않았다.그는 꺾이지 않는다. 1988년, 아예 아주 높은 목표를 새로 잡는다. 다들 고개를 저은 고휘도 청색 발광다이오드(LED) 개발이었다. 1993년 마침내 세계 최초로 이를 만들어낸다. 회사는 이 품목으로 연간 10억 달러 넘게 매출을 올리게 됐다. 그러나 그가 받은 대가는 형편없었다. 그는 1999년 회사를 박차고 나와 미국 캘리포니아주립대 산타바바라 캠퍼스 교수가 된다. 2001년 회사를 상대로 직무발명 보상 소송을 건다.이정훈 서울반도체 대표는 고려대에서 물리학을 전공했다. 석사 학위를 받고 제일정밀공업과 삼신전기를 거쳐 1992년 서울반도체를 인수한다.LED를 주력 품목으로 삼아 1990년대 100억 원대이던 매출을 2003년 1200억 원대로 키운다. 더 도약하기 위한 전기를 2004년 1월 마련한다. 나카무라 교수와 기술협약을 체결한 것. 당시 니치아화학 소송 건이 진행 중이었다. 자신을 최고로 인정하는 서울반도체에 나카무라 교수의 마음이 움직이지 않았을까. 나카무라 교수와 니치아화학은 2005년 1월 법원이 제시한 8억4000만엔에 합의한다. 그는 2014년 노벨물리학상의 영예도 안게 된다. 이후에도 서울반도체와 공동연구 및 교류를 이어온다.서울반도체가 니치아화학의LED백라이트 분야 아성을 깼다. 최근 발표된 지난해 점유율에서 1위에 올랐다. 니치아화학 출신 나카무라 교수가 준 도움이 상당히 작용한 성과가 아닐까 싶다.‘세계 1위’를 향한 과정에서 적자가 지속되는 경우도 있다. 서울반도체는 7분기 연속 손실을 보다가 지난 2분기에 흑자로 전환했다.백우진 경제칼럼니스트·글쟁이㈜ 대표"
2023-04-19,"[Biz & Now] 볼보 EX90, 서울반도체 LED조명 ‘썬라이크’ 채택","서울반도체는 자연광 발광다이오드(LED) 조명기술 ‘썬라이크’가 볼보의 신형 전기차SUVEX90에 채택됐다고 18일 밝혔다. 썬라이크는 서울반도체가 처음 개발해 양산하는 빛 기술이다. 자연 빛을 그대로 재현해 인체의 생체리듬을 지키고 근시 개선, 세포 재생, 기억력 향상 등의 효과가 있다는 게 회사 측 설명이다. 이번에 자동차에는 처음으로 적용했다. 서울반도체 관계자는 “볼보의 또 다른 전기차인 폴스타3에도 적용할 계획”이라고 말했다."
2023-04-18,"볼보 EX90, 서울반도체 LED조명 ‘썬라이크’ 채택","서울반도체는 18일 볼보의 신형 전기차SUVEX90에 '썬라이크'가 채택됐다고 밝혔다. 사진 서울반도체서울반도체는 자연광 발광다이오드(LED) 조명기술 ‘썬라이크’가 볼보의 신형 전기차SUVEX90에 채택됐다고 18일 밝혔다. 썬라이크는 서울반도체가 세계에서 처음으로 개발해 양산하는 빛 기술이다. 자연 빛을 그대로 재현해 인체의 생체리듬을 지키고 근시 개선, 세포재생, 기억력 향상 등의 효과가 있다는 게 회사 측의 설명이다. 이번에 자동차 중 처음으로 적용됐다.단 피젯 볼보 컬러·소재 책임자는 “썬라이크LED의 스펙트럼이 햇빛과 유사해EX90의 천연 소재와 고급 목재 데코를 색상 왜곡 없이 더욱 선명하게 돋보이게 한다”고 말했다.서울반도체 관계자는 “색상과 질감표현이 중요한 이탈리아 폼페이 유적지 벽화 등 세계적인 대형 박물관·미술관이 썬라이크를 채택해 사용하고 있다”며 “또 다른 전기차 폴스타3에도 적용을 앞두고 있다”고 덧붙였다."
2024-10-14,특허로 골리앗들과 맞짱…백전무패 이뤄낸 ‘LED 독종’,"━국내 강소기업 서울반도체잊을 만하면, 특허 전쟁에서 승소했다는 소식을 전하며 건재함을 드러내는 기술 기업이 있다.LED(발광다이오드) 전문 기업 서울반도체(대표 이정훈·사진)다. 최근 이 회사는 유럽 특허청 항소재판부의 판결을 끝으로 대만LED업체 ‘에버라이트’와 7년간 벌인 16차례 소송에서 모두 이겼다고 밝혔다. 올해 초에는 글로벌 정보기술(IT) 대기업인 아마존을 상대로 스마트 조명 기술 관련 특허 소송을 제기해 국내외에서 주목을 받기도 했다.13일 서울반도체 관계자는 유럽 특허청 판결에 대해 “노와이어(NoWire)LED기술이 유럽 모든 국가에서 특허를 인정받게 된 것이라 의미가 깊다”라고 설명했다. 노와이어LED기술은 전선(와이어)과 패키징 없이LED소자를 만드는 것으로, 초소형과 고효율을 장점으로 한다. 제네시스GV80과 아우디A4 차량의 헤드램프에도 이 기술이 쓰였다.지난 10일에는 유럽통합특허법원(UPC)이 독일 대형 유통사인 엑스퍼트 이커머스의 판매 제품이 서울반도체의 와이캅 기술을 침해했다며, 유럽 8개국에 관련 제품 판매 금지와 폐기 처분을 명령했다.1992년 설립된 서울반도체는 글로벌LED시장에서 일본 니치아와 독일 오스람에 이은 세계 3위 업체다. 지난해 매출 7억8400만 달러(약 1조506억원)를 기록했다.LED제품과 관련 솔루션을 제공하는 광(光) 반도체 전문 기업이다. ‘특허 경영’으로LED시장을 평정하겠단 창업자 이정훈 대표의 목표에 따라 특허 확보에도, 특허 침해 시 소송에도 적극적이다.시작은 2006년 세계 1위LED기업인 일본 니치아가 제기한 소송부터였다. 니치아 소송에서 이긴 이후 현재까지 8개국에서 진행된 103건(9월 기준)의 특허 소송에서 서울반도체는 모두 이겨  백전 무패의 기록을 이어가는 중이다. 2020년LED전구와LEDTV등을 두고 필립스와 벌인 소송에서도 연거푸 이기자, 업계에선 다윗이 골리앗을 이긴 것이란 평가가 나왔다. 미국 ‘특허 괴물’로 불리는 다큐먼트 시큐리티 시스템즈(DSS)와도 4년간 싸워 2021년 최종 승리했으며, 일본 렌즈 제조기업인 엔플라스와는 6년 분쟁서 승기를 잡았다.서울반도체는 지난해 12월부터 지난 6월까지 5차례에 걸쳐 월스트리트저널(WSJ)과 파이낸셜타임스(FT) 등에 광고를 냈다. “Birthisnotfair,butopportunitymustbefair”라는 문구가 적힌, 즉 ‘출생은 불공정해도, 기회는 공정해야 한다’는 내용의 광고다. 직원들에 따르면, 이 대표는 평소 “특허가 기울어진 운동장을 평평하게 하며, 작은 기업도 거대한 기업으로 클 기회를 준다”라고 강조해왔다고 한다. 이정훈 대표가 ‘특허 침해 기업을 모두 뿌리 뽑을 때까지 머리카락을 자르지 않겠다’고 선언한 일화는 업계서도 유명하다.기술력에 대한 자신 없이는 하기 어려운 행보다. 서울반도체에 따르면, 회사는 매년 매출액의 10%인 1억 달러 정도를 연구개발(R&D)에 투자한다. 현재 회사가 보유한 특허가 1만8000여개, 그중에서 이정훈 대표 개인 특허가 269건이다. 서울반도체만의 독보 기술인 썬라이크(자연광 스펙트럼에 가장 가깝게 만든LED), 와이캅 등이 그렇게 나왔다. 지난해 국가전략기술로 지정된 마이크로LED기술과 관련해 서울반도체가 보유한 특허는 1000여 개에 이른다. 이 대표는 지난 8월 2분기 실적발표회에서 “우리의 특허를 피해 마이크로LED를 만드는 것은 불가능”이라고 자신했다."
