date,title,content
2024-07-17,7월18일 인사,⊙ 수협중앙회 <승진> ◇팀장급 <팀장> △ICT전략실ICT경제 김진 △어업양식지원부 양식지원 양건우 △상호금융여신지원부 여신제도 황은미 △판매사업부 온라인사업 김환종 △전남본부 공제보험사업단장 최정환 <전보> ◇부장급 <부장> △상호금융여신지원 송효진 △판매사업 김선태 △무역사업 문희준 △부산본부장 윤경식 ◇팀장급 <팀장> △기획조정실 세무지원 조은이 △상호금융기획본부 상호금융기획 김창우 △정책보험부 보험제도 황재영 △경제기획부 자회사지원 임근성 △자금운용본부 운용전략 조경연 △조합감사실 감사3 김영삼△감사실 일반감사1 권성수△수산경제연구원 경영조사실장 김희정  △준법감시실 소비자보호단장 박용규⊙ 서울보증보험 <전보> ◇부서장 △서초지점 권동진 △종로지점 박정훈 △양재지점 임진호 △역삼지점 윤홍열 △구로디지털지점 강만성 △강남지점 박유홍 △금융영업부 조지영 △강북신용지원단 박종선 △영등포지점 임현구 △서울보상1센터 최근호 △천안지점 이주용 △창원지점 윤승현 △매출채권보험부 이준호 △안산지점 김태수 △서산지점 김응권 △송무지원단 배상일 △안양지점 오세호 △강릉지점 김홍석 △부산신용지원단 이종탁 △이천지점 안치원 △리스크관리실 김종우 △일산지점 박진용 △구미지점 신준규 △심사2부 윤성곤 △충주지점 조대현 △김해지점 이상준 △채널지원부 추승우 △인재개발부 송민수 △법인영업부 양원호 △전략영업부 전영선 △기업회생부 최후중 △대전충청본부 수석 최동묵 △영남보상센터 김현보 △포항지점 조홍채 △해외영업부 김정진 △혁신영업센터 조원석 △심사1부 박인규 △해외사업부 한상선 <본부 수석> △인천경원 최두현 △서울강북 김종찬  △부산경남 김영철 △서울강남 최응서 △대구울산경북 서주미 △광주호남 전경영⊙ 뉴스케이프 △자동차&라이프에디터 권진욱
2024-03-04,"‘최대30만원’ 전세보증보험 보증료 지원, 전연령층으로 확대","서울 마포구 공덕동 일대 단독주택, 빌라촌. 김혜윤 기자unique@hani.co.kr전세보증금반환보증 보증료 환급(최대 30만원) 대상이 청년층에서 모든 연령대로 확대된다.국토교통부는 4일 “전세보증금반환보증 가입을 유도해 전세사기 피해를 방지하고자 지난해부터 시행한 전세보증금반환보증 보증료 지원 사업 대상을 이날부터 청년층에서 전체 연령으로 확대한다”고 밝혔다. 이 사업은 정부가 소득, 보증금 요건 등을 충족하는 보증보험 가입자에게 보증료 전액 또는 일부를 지원하는 사업이다. 지금까지는 각 시·도가 조례로 정한 청년 연령 기준(전남·강원은 만 45살 이하, 그 외 지역 만 39살 이하)에 따라 청년층으로 인정되는 경우에만 지원해 왔다.소득 요건은 연령대 등에 따라 조금씩 다르다. 청년층은 기존대로 보증보험 가입자의 연소득이 5천만원 이하인 경우 지원 대상이 된다. 이번에 새롭게 추가된 ‘청년외’ 연령대는 연소득이 6천만원 이하인 경우에만 지원 대상이다. 만약 ‘청년외’ 보증보험 가입자가 기혼자라면 가입자와 배우자의 연소득 합산액이 6천만원 이하여야 한다. 단, 신혼부부(신청일 기준 혼인신고일 7년 이내·연령 무관)에 한해서는 연소득 기준이 7500만원 이하다.국토부는 “지원 대상이 되는 보증도 기존엔 신청년도 신규가입 보증에서, 이날부터는 신청일 기준 유효한 보증으로 확대한다”고 밝혔다.보증료 지원을 받으려면 신청인이 주택도시보증공사(HUG)·한국주택금융공사(HF)·에스지아이(SGI)서울보증보험을 통해 보증가입을 하고 보증료를 납부한 뒤 임차 주택 주소지 관할 시·군·구청 등에 방문 또는 온라인으로 지원 신청을 해야 한다. 각 지방자치단체 심사를 거쳐 지원 대상으로 확정되면 납부한 보증료의 90%(최대 30만원)를 돌려 받을 수 있다. 청년·신혼부부인 경우엔 보증료의 100%(최대 30만원)가 환급된다."
2023-07-19,“따따블 가자” 다시 불붙는 공모주…‘첫날 급등’ 스팩주 변동성 주의,"언스플래시상장 첫날 가격 제한 폭이 확대되고 기업 가치가 ‘조 단위’에 이르는 대어급들이 상장에 나서면서 기업공개(IPO) 시장에 훈풍이 불고 있다. 하지만 변동성이 커진 만큼 투자에 유의가 필요하다는 조언도 나온다.18일 한국거래소에 따르면, 올해 상반기 상장한 기업은 모두 61곳으로 지난해 상반기(48곳)보다 27.08% 늘었다. 개인투자자들 사이에서 공모주 열풍이 불었던 2021년 상반기(59곳)를 소폭 웃도는 수준이다. 마켓컬리, 올리브영 등 굵직한 기업이 상장 계획을 거둬 들였던 지난해 연말 및 올해 연초와는 사뭇 달라진 분위기다.상장 기업 수가 많아지고 있는 가운데 제도 변화도 투자자들의 관심을 불러모으고 있다. 지난달 26일부터 신규 상장 종목의 공모가가 그대로 시초가가 되고, 상장 첫날의 가격 제한 폭이 60∼400%로 확대되는 유가증권·코스닥시장 업무규정 시행세칙이 시행되고 있어서다. 기존에는 공모가의 90∼200% 내에서 시초가가 결정되고, 장이 열린 뒤 다른 종목과 마찬가지로 상하 30% 범위 내에서만 가격이 움직일 수 있었다.기존 제도에서는 공모주 투자자가 얻을 수 있는 최대 수익률이 160%였는데, 이제는 일명 ‘따따블’(공모가의 4배 상승)로 갈 경우 최대 300%까지 수익률을 낼 수 있다. 제도가 바뀐 후 상장된 종목 중에서는 시큐센과 필에너지 주가가 상장 첫날 공모가 대비 각각 205%, 237.06% 상승 마감했다. 이노시뮬레이션과 알멕도 각각 133.33%, 99% 올라 마감했다.두산로보틱스, 서울보증보험 등 기업가치가 ‘조 단위’로 평가되는 대어급들이 상장을 준비하고 있다는 점도 기업공개 시장의 기대를 키우고 있다. 두산그룹 계열사인 두산로보틱스와 서울보증보험은 지난달 유가증권시장 상장예비심사를 신청한 상태다.※ 이미지를 누르면 크게 볼 수 있습니다.일각에서는 기업공개 시장 훈풍을 두고 당일 변동성을 주의해서 투자할 필요가 있다는 지적도 나온다. 주가가 그만큼 크게 출렁일 수 있다는 것이다. 케이비(KB)증권은 지난 14일 낸 보고서에서 “신규 상장 종목에 대한 가격 제한 폭 확대는 거래량 증가와 변동성 확대로 이어질 가능성이 크다”고 평가했다.다만, 거래소는 바뀐 제도로 의도했던 가격 발견 기능은 잘 이뤄지고 있다고 본다. 기존에는 상장 당일뿐 아니라 그 다음 날까지 연속 상한가를 가는 경우가 많았는데, 첫날 가격 폭이 확대되면서 상장 다음 날의 등락률이 비교적 작아졌다는 것이다.거래소 관계자는 “코스닥 시장을 분석한 결과, 제도 개선 이후 상장 당일의 회전율이 시장 평균이나 제도 변경 전보다 높게 나타났다”며 “과거엔 상한가 도달로 사실상 거래가 중단되면서 회전율이 낮았으나 제도 개선으로 투자자의 지속적인 거래 기회가 보장되면서 회전율이 높아진 것으로 분석된다”고 말했다.실질적인 기업 가치가 없는 상태인 스팩주의 가격 널뛰기는 신중하게 살펴볼 필요가 있다. 스팩(기업인수목적회사)은 향후 기업의 인수를 염두에 두고 상장하는 페이퍼컴퍼니로, 이달 6일 상장한 교보14호스팩은 상장일 장중 399%(공모가 대비)까지 폭등한 뒤 240.50% 상승으로 마감한 바 있다. 이후 12일 상장한 디비(DB)금융스팩11호도 상장일 343%까지 오른 뒤 121.75% 상승 마감했다.이효섭 자본시장연구원 금융산업실장은 “지난해 말부터 위축됐던 기업공개 시장이 각국 중앙은행들의 통화긴축 종료 기대감 속에서 활기를 찾고 있다. 가격 제한 폭 완화로 일반투자자의 관심이 증가한 것도 하나의 요인으로 보인다”며 “다만 스팩주가 상장 첫날 급등하는 등 제도 개선의 부작용으로 볼 만한 현상이 있어 지켜볼 필요가 있다”고 말했다."
2023-07-06,7월7일 궂긴 소식,"◆ 정만열씨 별세: 규홍(서울보증보험 서초지점장) 규호(한국무역보험공사 홍보부장) 영미(글루칸 수석연구원)씨 부친, 이동섭(경운대 교수)씨 장인, 구현정 박은주씨 시부=5일 오후 7시35분 경북 구미장례식장. 발인 8일 오전 9시. (054)443-5445.◆ 고경민(아메바컬쳐 대표)씨 별세: 임석(국립중앙의료원 보건의료본부장)씨 동생=6일 0시40분 서울성모병원. 발인 8일 오전 6시40분. (02)2258-5963.◆ 배종수씨 별세: 황현숙씨 남편, 요한 수현씨 부친, 강재웅(<파이낸셜뉴스> 중기벤처부 차장)씨 장인=6일 오후 2시 상계백병원. 발인 8일 오후 3시. (02)950-1493."
2023-01-06,"‘깡통전세’ 위험 안 알렸다면…“중개사, 세입자에 손해 배상”","전세 사기 피해자들이 속출한 것으로 알려진 인천시 미추홀구 한 아파트 창문에 구제 방안을 촉구하는 현수막이 걸려 있다. 연합뉴스건물이 경매로 넘어가 전세보증금을 잃게 된 세입자에게 ‘깡통전세’ 위험성 등을 제대로 고지하지 않은 공인중개사가 손해를 배상해야 한다는 법원 판결이 나왔다.서울중앙지법 민사87단독 반정우 부장판사는 세입자 ㄱ씨가 공인중개사와 서울보증보험을 상대로 낸 손해배상 청구 소송 1심에서 최근 원고 일부 승소로 판결했다고 6일 밝혔다.재판부는 “공인중개사와 서울보증보험이 공동으로 A씨에게 4000만원을 지급하라”고 판결했다. ㄱ씨가 돌려받지 못한 보증금 1억원의 40％에 해당하는 금액이다. ㄱ씨는 2015년 8월 서울 구로구의 한 건물에 있는 방을 보증금 1억원을 내고 2년간 임차했다. 이 건물에는 약 70개의 방이 있었고, ㄱ씨가 계약할 당시 그보다 먼저 확정일자를 받은 임차인들의 임대차 보증금은 약 29억원이었다. 채권최고액 합계 22억여원의 근저당권도 설정돼 있었다.ㄱ씨는 2017년 8월 임대차 계약을 갱신했지만, 이 건물과 부지는 2018년 1월 경매에 넘겨졌다. 매각대금 약 49억원이 근저당권자와 선순위 임차인 등에게 먼저 배당되면서 ㄱ씨는 한 푼도 변제받지 못했다.재판부는 “공인중개사가 성실하게 중개해야 할 의무를 위반했다”며 ㄱ씨에게 손해를 배상할 책임이 있다고 판단했다. 공인중개사는 중개대상물 확인·설명서에 ㄱ씨보다 선순위 임차인의 임대차 보증금이나 최우선 변제권이 있는 소액임차인의 발생 가능성에 대해 전혀 기재하지 않았는데, 이러한 정보를 ㄱ씨가 알았다면 임대차 계약을 체결하지 않았을 가능성이 크다는 이유에서다.다만 “ㄱ씨가 해당 건물의 시가나 권리관계 등을 조사·확인해서 자신의 임대차 보증금 회수가 불가능하거나 곤란할 수 있는 위험성을 따져보아야 했는데 이를 소홀히 한 사실을 인정할수 있다”며 배상범위를 40%로 제한했다."
2024-11-19,"국회 운영위, ‘국감 불출석’ 김건희 여사 등 고발","윤석열 대통령의 아세안 정상회의 참석에 동행한 김건희 여사가 2024년 10월9일(현지시간) 라오스 비엔티안 왓타이 국제공항에 도착해 환영나온 라오스 쪽 인사와 대화하고 있다. 연합뉴스국회 운영위원회가 19일 전체회의를 열어 야당 주도로 김건희 여사 등 증인 10여명을 국정감사 불출석, 증언 거부, 국회 모욕 등의 이유로 고발하기로 했다.운영위가 이날 의결한 ‘2024년도 국정감사 증인 고발의 건’ 가운데 8명은 국감 불출석이 고발 사유다. 김 여사를 비롯해 국민의힘 공천 개입 의혹 핵심 인물인 김영선 전 의원, 대통령실 ‘김건희 라인’으로 지목된 이원모 대통령실 공직기강비서관, 황종호 행정관, ‘김건희 라인’이 있다고 주장한 김대남 전 서울보증보험 상근감사위원 등이 포함됐다.‘음주운전 봐주기 징계 처분 의혹’과 관련해 증인으로 채택됐으나 당시 정직 상태이며 국외 체류 중이라는 이유로 출석하지 않은 강기훈 대통령실 선임행정관도 고발 대상이 됐다. 김 여사와 이 비서관, 강기훈·황종호 행정관 4명에 대해서는 동행명령 거부도 사유에 추가됐다.대통령 관저 이전 의혹과 관련해 증인으로 채택됐으나 불출석한 박희영 서울 용산구청장, 김용현 국방부 장관도 이날 고발 대상이 됐다. 이충상·김용원 국가인권위원회 상임위원은 각각 증언 거부와 국회 모욕을 사유로 고발 대상이 됐다.국민의힘 의원들은 “민주당이 일방적이고 편파적인 국감 증인 고발을 이어가는 데 대해 국민의힘 의원 전원은 결단코 동의 못 한다”며 반발했다. 강명구 국민의힘 의원은 “법제사법위원회에서도 벌써 고발된 증인들을 운영위에서까지 고발하는 것은 과도한 고발권 남용”이라며 “이재명 대표 1심 판결에 대한 보복이라고밖에 생각이 들지 않는다”고 말했다.19일 오전 열린 국회 국회운영위원회 전체회의에서 더불어민주당 소속 박찬대 위원장이 질의하고 있다. 연합뉴스"
2022-01-26,1월27일 알림,"왼쪽부터SK하이닉스 김동섭 대외협력 사장·김해주 이천노조위원장·이석희 대표이사, 사회복지공동모금회 조흥식 회장,SK하이닉스 강국모 청주노조위원장. 사회복지공동모금회 제공◇SK하이닉스는 지난 24일 임직원 성금을 모아 사회복지공동모금회에 ‘행복나눔기금'으로 21억여원을 전달했다. 기부금은 ‘행복GPS’,‘실버프렌드’ 등 사회문제 해결 사업과 ‘하인슈타인’,‘행복ITZone’등 미래 인재 육성 사업을 포함한 모두 6개 분야에 쓰인다. 누적 기부액은 275억원에 이른다.대한적십자사 제공◇ 대한적십자사(회장 신희영)는 26일 ‘사할린 동포 지원에 관한 특별법’에 따라 지난해 귀국 후 첫 설날을 맞는 사할린 동포 영주귀국자에게 설 선물 589세트를 전달했다.부영그룹 제공◇ 부영그룹은 지난 24·25일 자매결연을 맺은 6개 군부대(공군방공관제사령부, 공군방공유도탄사령부, 육군 1, 8군단, 육군 22, 25사단)에 과자 선물 2600세트를 전달했다. 2000년부터 23년동안 전달한 누적 위문품은 8만6300세트(약 6억4000만원)에 이른다.왼쪽부터 강수성, 이시원 작가. 한국극작가협회 제공◇ 한국극작가협회는 26일 2022년 대한민국 극작가상 수상자로 강수성 작가를 선정했다. 강 작가는 1975년 중앙일보 신춘문예로 등단해 경남문학상, 경남연극제 희곡상 등을 받았다. ‘오늘의 극작가상' 수상자로는 이시원 작가가 뽑혔다. 시상식은 29일 서울 대학로 한국극작가협회 연습실에서 열리는 ‘제5회 극작가의 밤' 행사에서 한다.문상헌 수석부회장. 한국음반산업협회 제공◇ 한국음반산업협회는 26일 신임 수석 부회장으로 음반제작자 출신 문상헌 이사를 임명했다. 문 수석 부회장은 1990년 서세원미디어로 대중문화예술업계에 입문, 다양한 엔터테인먼트를 이끌며 신효범, 최재훈, 박남정 등의 매니지먼트를 맡았다.주임환 새 회장. 3·15의거기념사업회 제공◇ 3·15의거기념사업회는 25일 대의원총회에서 제17대 회장으로 주임환 부회장을 선출했다. 주 신임 회장은MBC경남 보도국장, 3·15의거기념사업회 부회장, 경남도공익사업선정위원장 등을 지냈으며, 새달 열릴 제29차 정기총회부터 2년 임기를 시작한다.왼쪽부터 정진택 총장과 장현국 대표. 고려대 제공◇ 위메이드(대표 장현국)는 25일 고려대와 암호화폐 기부 협약을 맺고, 10억원 상당의 암호화폐 위믹스를 대학발전기금으로 전달했다. 고려대는 창의 인재 양성을 위한 미래 교육과 블록체인 기술을 포함한 연구·학술 활동 등에 기부금을 사용할 계획이다.◇ 한신대(총장 강성영)는 지난 21일 오산중앙청소년문화의집(관장 박은수)과 오산종합사회복지관(관장 한진) 사업 수탁기관으로 최종 선정되어 산학협력단에서 계속 운영을 맡게 됐다. 산학협력단은 오산중앙청소년문화의집도 2027년까지 약 35억 규모로 운영한다.◇ 롯데물산은 24일 설을 맞아 서울 송파구청에 ‘복(福)나눔 쌀'을 전달했다. 기부물품은 25∼6일 송파구 관내 소년소녀가장과 홀몸노인 등 1004가구에 전달된다.◇ 한신공영은 지난 21일 서울 강남구 개포동 구룡마을에서 임직원과 이들의 자녀 등 40여명이 참석한 가운데 한부모 가정, 저소득층, 홀몸 어르신 등에게 연탄 1600장을 배달했다.◇ 코오롱그룹은 26일 임직원들이 소아암 환아 가족들을 지원하기 위해 지난해 동안 모은 헌혈증 350장을 한국백혈병어린이재단에 기증했다. 코오롱 임직원들은 2013년부터 여름·겨울 매년 두 차례씩 단체 헌혈을 진행해왔으며, 누적 기부 헌혈증은 약 5800장이다.◇ 산업은행은 24일 설을 앞두고 ‘KDB따뜻한 동행’ 51호 후원 대상으로 노숙인 등 소외계층에게 무료 급식을 제공하는 ‘민들레국수집’과 무료 진료를 제공하는 ‘요셉의원’에 2천만원씩 모두 4천만원을 전달했다.◇ 아름다운가게는 24일 새해 첫 나눔캠페인으로 전국 110여개 매장을 통해 5천여명의 소외이웃에게 생필품과 쌀 등으로 구성된 나눔보따리를 전달했다.◇ 케이뱅크는 서울 중구청과 함께 24일 중구지역 어르신 등 300명에게 ‘설 맞이 명절 꾸러미’를 전달했다. 꾸러미는 지역 경제 활성화를 위해 중구 내 전통시장에서 구매한 떡국떡, 사골곰탕, 현미유과 등 설 명절 음식으로 구성됐다.◇ 제너시스비비큐는 26일 설을 맞아BBQ가정간편식(HMR) 2만3천개를 광주중앙푸드뱅크, 하남푸드뱅크 등 13곳의 지역 푸드뱅크에 전달했다. 이들 제품은 홀몸 어르신, 기초생활보장 수급자, 결손가정 등 취약 계층에 전달될 예정이다.◇ 대한항공은 26일 오후 서울 강서구에 소외계층을 위한 ‘사랑의 쌀' 3000㎏(10㎏ 300포)을 기증했다. 기부물품은 구가 선정한 홀몸 어르신, 소년소녀가장, 장애인 등 취약계층 300가구에 전달될 예정이다. 대한항공이 2004년부터 19년동안 후원해 온 쌀 누적량은 92t(톤)에 이른다.◇ 한진부산컨테이너터미널은 26일 사회복지공동모금회에 성금 1억원을 기탁했다. 기부금은 부산·경남지역 위기가정 지원과 사회적 약자 돌봄, 코로나19 극복 사업에 쓰인다.◇ 하나은행은 26일 홀몸 어르신과 저소득층 아동 1천명에게 먹을거리와 생필품이 담긴 ‘행복상자’를 전달했다. 물품 구성에는CU편의점이 함께 했으며, 어르신용 행복상자에는 떡국·즉석밥·죽·약과 등 11가지 물품을, 아동용 행복상자에는 과자·젤리·스티커북 등 완구류를 포함한 12가지 물품을 달리해 담았다.◇ 예금보험공사(사장 김태현)와 서울보증보험(대표이사 유광열)은 26일 한국사회복지관협회에 지역사회 방한물품 지원사업을 위한 기부금을 전달했다. 후원금은 전국 종합사회복지관 58개 곳을 통해 2300여 소외가정의 방한 물품 지원에 쓰인다.◇ 한국파스퇴르연구소는 코트디부아르 국립혈액원과 26일 ‘생물자원 공유·활용을 통한 감염병 연구역량 강화'를 목표로 양해각서를 맺었다. 두 기관은 코로나19, 지카 바이러스, 뎅기열 바이러스 등 고위험 감염병과 한국의 연구개발 역량을 접목하기 위해 생물 자원을 확보·교류를 중심으로 공동연구, 교육·훈련, 연구역량 강화 지원에 상호 협력키로 했다.◇ 부산오페라단연합회는 지난 24일 금정문화회관에서 창립총회를 열고, 초대 회장으로 솔오페라단 이소영 단장을 선임했다. 연합회는 부산오페라하우스 개관을 앞두고 관련 단체간 정보 교류 등을 맡는다.◇ 국립민속박물관은 26일 <한국생업기술사전: 어업 편>을 발간했다. 두 권으로 구성된 <한국생업기술사전: 어업 편>에는 어업뿐만 아니라 어촌 제의나 생활·문화와 관련된 표제어도 수록됐다. 표제어는 어로기술, 어구, 어선, 작업장, 수산 가공물, 어로조직, 의례, 자료, 문화재, 제도, 용어, 국가중요어업유산으로 나뉜다. 새로 뜻풀이를 작성한 표제어는 모두 462개이며, 80여 명이 집필했다. 사진 800여 장도 실었다. 누리집(folkency.nfm.go.kr)에서 다양한 정보를 확인할 수 있다.◇ 제작사 에이콤은 26일 국내 대표 창작 뮤지컬 <영웅>과 한국어 공연 10돌을 맞은 <레미제라블>의 새로운 주인공을 찾는 오디션 일정을 발표했다. <영웅>은 오는 12월LG아트센터 마곡과 2023년 3월 블루스퀘어에서 공연할 주인공의 오디션 서류 마감을 새달 14일까지 한다. 에이콤 누리집(acommusical.com) 참조. 내년 10월 막을 올리는 <레미제라블>의 오디션 접수는 새달 21일까지 한다. 영국 오리지널 제작진이 내한해 3주 동안 오디션을 진행하고, 최종 후보에 오른 배우들의 영상을 매킨토시에게 보내 최종 낙점하게 된다. 레미제라블 코리아 누리집(lesmis.co.kr) 참조.◇FNC엔터테인먼트는 새달 3일부터 23일동안 신예 발굴을 위해 전국 22개 도시를 순회하는 ‘FNC씨티 투어 오디션'을 한다. 2003∼2011년생이라면 보컬, 랩, 댄스, 연기, 비주얼 등 5개 분야에 지원할 수 있다. 오디션 해당일 시작 전 한 시간 동안만 선착순으로 현장 접수를 받는다. 개인과 단체 모두 지원 가능하나, 합격자 선정은 개별로 이뤄진다. 누리집(fncent.com/b/aud_notice/51639) 참조.◇ 전북법조기자단은 25일 오후 전주지검 내 전주지역범죄피해자지원센터에 성금 100만원을 전달했다. 기부금은 범죄 피해로 어려움을 겪고 있는 이들을 위해 쓰일 예정이다. 법조기자단은 전북 전주 지역 14개 신문·통신·방송사의 법원·검찰 담당 기자들로 구성되어 있다.◇ 인천시 서구는 25일 지역화폐 ‘서로e음' 애플리케이션으로 모금한 1328만원을 인천사회복지공동모금회에 전달했다. 모금액은 가정폭력 피해를 겪은 모녀 가정과 치료비가 필요한 가정, 홀몸 어르신 한과 나눔 사업 등에 쓰일 예정이다.◇ 서울 성북경찰서는 25일 새해를 맞아 소외계층 지역주민 51명에게 900만원 상당의 쌀·라면 등 생필품을 전달하는 ‘우리 동네·우리 이웃' 사랑의 나눔 행사를 했다."
