date,title,content
2024-08-12,"광 반도체 전문 서울반도체 흑자 전환, 8분기 만","영업이익 40억원 기록서울반도체 로고. /서울반도체글로벌 광 반도체 전문 기업 서울반도체가 8분기 만에 흑자 전환에 성공했다. 서울반도체는 조명, 자동차, 디스플레이에 적용되는LED(발광다이오드) 제품과 관련 설루션 기술 등을 개발하는 회사다.12일 서울반도체는 올해 2분기 매출 2830억원, 영업이익 40억원을 기록했다고 밝혔다. 전년 동기 대비 매출(2552억원)은 10.9% 성장했고, 영업이익은 21억원 적자에서 흑자로 전환했다.서울반도체의 2분기 실적 개선은 글로벌 경제의 불확실성과 국내 시장 침체에도 불구하고 수익성이 높은 자동차 조명 부분의 매출 성장에 따른 것으로 분석된다. 서울반도체는 지난 3월 현대차그룹 제네시스GV80의 헤드램프에 세계 최초로 와이어가 없는 광 반도체 와이캅 기술을 공급한다고 발표했다. 서울반도체 관계자는 “내부적으로 원가 절감 노력 등을 통해 비용을 크게 줄인 것도 주효했다”고 설명했다.서울반도체는 올해 3분기 매출은 전년 동기 대비 6% 성장한 2900억~3100억원으로 내다봤다. 서울반도체는 지난해 세계LED백라이트 시장에서 점유율(매출 기준) 16.5%로 처음 1위에 올랐다."
2022-08-23,서울반도체 기술 탈취한 대만 기업... 항소심도 벌금 6000만원,"국내 1위 발광다이오드(LED) 업체 서울반도체가 자사 직원 3명을 매수해 기술을 탈취한 대만 기업 에버라이트에게 항소심에서도 승리를 거뒀다. 지난 6월 수원지방법원은 부정경쟁방지보호법 및 산업기술의 유출 방지 및 보호에 관한 법률(산업기술보호법) 위반 혐의로 기소된 에버라이트의 항소심에서 벌금 6000만원의 원심 판결을 확정했다. 해외 기업으로는 최고 액수의 벌금형이라는 게 서울반도체 측 설명이다.경기도 안산의 서울반도체 본사 /서울반도체에버라이트는 서울반도체 전 상무·실장 등 3명을 매수해 서울반도체의 자동차LED기술을 탈취한 혐의로 2018년 재판에 넘겨졌다. 에버라이트는 고액 연봉을 제시하며 영업 비밀 유출을 요구했고, 해당 직원들은 업무용 노트북으로 회사 시스템에 접속해 영업 비밀을 드라이브에 저장한 뒤 휴대전화로 사진을 찍어 기술을 유출했다. 이들은 에버라이트에서 근무하며 고객사 상대로 서울반도체PPT템플릿을 그대로 가져다가 발표하는 과정에서 서울반도체 직원에게 적발됐다.1심에서 유죄 판결을 받은 에버라이트는 항소했다. 하지만 재판부는 서울반도체의 기술이 영업비밀일 뿐만 아니라 국가산업기술보호법상의 첨단기술에 해당한다고 봤고, 산업기술유출 부정 취득 혐의를 추가적으로 인정했다. 원심과 형량은 같지만 원심에서는 부정경쟁방지법 위반 혐의만 적용했었다. 기술을 빼돌린 서울반도체 전직 임직원에게는 징역 2년에 집행유예 2~3년을 선고했다. 직접 기술을 빼돌린 직원 3명에 더해 해외 법인인 에버라이트까지 벌금형을 선고받은 것은 드문 사례다.에버라이트가 유출을 시도한 기술은 자동차용 미니LED를 생산하기 위한 핵심 기술 와이캅(WICOP)이다.LED칩을 패키지 공정 없이 기판에 직접 장착할 수 있는 기술로, 기존 기술보다 패키지 사이즈를 12분의 1까지 줄일 수 있다. 이 때문에 마이크로LED,미니LED를 생산하기 위해선 이 기술이 꼭 필요하다. 서울반도체는 이 기술을 개발하기 위해 10년간 5600억원을 들였다.TV,스마트폰, 태블릿 등 디스플레이 제품에서도 널리 사용되고 있고, 2020년 전 세계TV생산량 약 2억대 중 약 20%에 와이캅 기술이 채택됐다.서울반도체는 국내 기업 중에서도 자사 특허 침해에 적극적으로 대응하고 있는 기업이다. 최근에는 유럽 4위 전자제품 유통업체 독일 콘라드일렉트로닉 상대로 한 특허 침해 소송에서 승소했다. 콘라드일렉트로닉스가 서울반도체의 스마트폰용 플래시LED기술을 무단으로 침해했는데, 독일 만하임지방법원이 이를 인정해 해당 스마트폰의 판매를 멈추고 전량 회수하도록 판결한 것이다. 서울반도체와 자회사 서울바이오시스는 2003년 이후 특허 소송에서 99전 99승을 거뒀다.이정훈 서울반도체 대표는 “지식재산은 대한민국이 경제강국으로 도약할 수 있는 발판이자 젊은 창업자들이 생존하고 발전하며, 더 나은 삶을 위한 유일한 수단”이라며 “기술 도둑질 등의 탈법을 일삼는 나쁜 기업들은 반드시 공개돼야 할 것”이라고 했다."
2023-07-24,"국내 최초 ‘메타버스’ 개념 도입, 반도체 가상현실 실습","한국공학대학교국내 최대 규모의 나노반도체공학과를 운영하는 한국공대 학생들이 실습에 매진하고 있다. 한국공대는 우수한 교육 성과와 함께 높은 취업률을 자랑한다. / 한국공대 제공한국공학대학교(총장 박건수)는 1997년 산업통상자원부가 설립한 4년제 산학협력 특성화 공과대학이다. 지난해 3월 ‘더 나은 미래를 함께 만드는 공학기술 선도대학’이라는 목표하에 새로운 대학 발전 비전(TUKorea1.0)을 선포했다. 이와 함께 대학 체계를 미래 첨단산업 특화 분야 중심으로 개편 중이다.국내 최대 나노반도체공학과…국내 최초로 ‘메타버스’ 개념 도입해 가상현실 실습안승언 나노반도체공학과 학과장특히 한국공대는 현재 370여 명이 재학 중인 나노반도체공학과를 운영하고 있다. 입학정원이 90명으로, 국내 최대 규모다. 반도체 전문가로 구성된 우수한 교수진, 산학협력을 통해 축적된 반도체 실습 인프라가 자랑이다. 미래융합연구소와 나노반도체융합센터는 대학 실습실에서 접하기 어려운 고가의 장비를 교육에 직접 활용한다. 이로써 현장 적응력이 뛰어난 실무형 인재를 양성하고 있다.또 한국공대는 국내 대학 최초로 가상현실 실습에 메타버스 개념을 도입했다. 국내 최대 개인형 부스(20석 규모)의VR실습실(몰입형 가상현실 실습교육) ‘FUTUREVRLAB’을 구축했다. 메타버스 실습실에서는 반도체 관련 ‘전자기학’과 ‘반도체 공정설계’ 등 가상현실 콘텐츠를 개발해 운영했다. 그 결과 참여 학생 90% 이상이 교육에 만족했다.나노반도체공학과 학생들은 대외 학술대회에서 우수한 성적을 내고 있다. 2021년에는 나노영챌린지에서 과학기술정보통신부 장관상을 받았다. 한국전기전자재료학회 캡스톤디자인 경진대회에서는 지난해와 올해 2년 연속 대상을 차지했다. 이러한 우수한 교육성과 덕에 나노반도체공학과 졸업생들은 지난해 기준 전국대학 평균 취업률인 64.2%보다 높은 73%를 기록하고 있다. 특히 삼성전자 등 반도체 대표 기업에 취업하는 졸업생 비율이 매우 높아, 취업의 질적인 부분이 향상되고 있다.다채로운 교육과정으로 ‘반도체 전문인력 배출’ 목표에 박차한국공대는 지난해 ‘더 나은 미래를 함께 만드는 공학기술 선도대학’이라는 대학 발전 비전(TUKorea1.0)을 선포했다. 이와 함께 대학 체계를 미래 첨단산업 특화 분야 중심으로 개편 중이다. / 한국공대 제공한국공대는 지난해 반도체 분야 산업경쟁력 강화를 위한 ‘반도체 전공트랙’에도 선정됐다. 지난 2017년부터는 한국반도체산업협회·협약기업·대학들과 함께 협의체로 운영하던 수요 기반 장비제어(S/W) 중심 ‘반도체 장비 전공트랙’을 ‘반도체 공정시스템 전공트랙’으로 확대 개편했다. 아울러 나노반도체공학과·메카트로닉스공학부·전자공학부 등 대학 내 반도체 관련 학과가 협업해 21개 반도체 전문 컨소시엄 기업과 현장수요 맞춤형 교육과정을 개발·운영한다.지난 6월 한국공대 나노반도체공학과는 우수한 교육 인프라와 산학협력 모델의 우수성을 인정받아 교육부가 주관하고 한국산업기술진흥원에서 지원하는 ‘첨단산업 인재양성 부트캠프 사업’에 선정됐다. 이번 사업으로 향후 5년간 총 70억원의 정부 재정지원을 확보했다. 한국공대는AP시스템·테스 등 27개의 반도체 관련 참여 기업과 현장 수요 맞춤형 교육과정을 개발·운영하고, 현장실습·인턴십·산학프로젝트도 공동으로 추진한다.한국공대는 또한 중소 산업현장의 재직자 역량 강화와 효율적 운영을 위해 계약학과 등의 다양한 교육과정·방법 개발에 힘쓰고 있다. 2009년부터 현재까지 서울반도체와 함께 화합물반도체공학과를 개설해 서울반도체 임직원 대상 학부·대학원 과정으로 반도체 분야 재직자 역량도 강화했다. 올해부터 중소벤처기업부가 지원하는 반도체 분야 중소기업 계약학과로 선정돼, 중소기업 재직자 대상 반도체기계시스템공학과를 개설해 운영 중이다.한국공대는 지난 6월 경기도와 삼성전자·SK하이닉스 등이 참여한 반도체 인재 양성을 위한 산·학·연·관 공동협약에 참여했다. 이로써 경기도 반도체 산업 전문 인력을 양성하기 위한 반도체 공유대학에 선정되기도 했다. 올해 한국공대는 세경고(경기도 파주시) 학생 대상으로 반도체 공정 실습 강의를 진행했다. 서울시교육청 인증 고교학점제(4학점) 프로그램으로 진행되는 서울로봇고교 학생 대상 반도체진로캠프는 올해까지 3회에 걸쳐서 진행되며, 참여 학생과 교사의 만족도가 높다.한국공대는 2025년까지IT반도체융합대학을 신설한다는 계획이다."
2023-03-18,서울·용인·인천… 반도체高 유치 열풍,"서울에 반도체 마이스터고(산업 수요 맞춤형 고교) 설립이 추진된다. 서울교육청 관계자는 “특성화고 중 마이스터고 전환을 희망하는 학교 신청을 받고 있는데 관심이 뜨겁다”며 “서울은 대학이 많아 전문교육에 유리한 데다, 경기도권에 반도체 공장이 많아 전문 인력 공급에 최적”이라고 말했다. 일반 특성화고에도 반도체 전문 교육을 강화해 2031년까지 서울에서만 반도체 전문 인력 4050명을 양성하는 게 목표다.정부가 15일 경기도 용인시 처인구 남사읍 710만㎡ 일대를 국가산업단지로 지정하고 민간 투자를 바탕으로 한 세계 최대 규모 ‘첨단 시스템반도체 클러스터’를 조성하겠다고 밝혔다. 사진은 이날 대규모 시스템 반도체 국가산업단지로 지정된 경기 용인시 처인구 남사읍 일대. 2023.3.15/뉴스1전국 지자체와 시도교육청이 반도체 고졸 인력 양성에 팔을 걷어붙이고 나섰다. 한국반도체산업협회에 따르면, 고졸 반도체 전문 인력 수요는 2021년 4만4000명에서 2031년 7만8000명으로 증가할 전망이다. 하지만 현재 우리나라 마이스터고 54곳 중 반도체 마이스터고는 2010년 개교한 충북반도체고가 유일하다.교육부는 2025년 3월 개교를 목표로 올해 전국 3~4곳에 반도체 마이스터고를 선정할 계획이다. 교육부 관계자는 “반도체 인력 수요가 늘고 있는 만큼 반도체 마이스터고 지정을 추진하고 있는데 요건과 기준 등을 묻는 시도교육청의 문의 전화가 빗발치고 있다”고 말했다.지자체 중 가장 적극적인 건 경기도 용인시다. 용인시는 반도체 인재양성팀을 꾸리고 도교육청 등과 ‘마이스터고 지정 신청을 위한 추진단’까지 구성했다. 추진단은 용인 처인구 백암고 운동장 2만1000㎡ 규모 부지에 300억원을 들여 반도체고 신설을 추진하고 있다. 시스템제어학과와 반도체소프트웨어학과 2개 과, 총 196명 정원으로 운영할 계획이다. 도교육청 관계자는 “SK하이닉스가 120조원을 투자해 첨단 공장을 짓기로 한 데 이어 최근 삼성도 300조원을 투자하기로 한 만큼 용인 지역 반도체 인력 수요가 급증해 전문가 육성이 시급하다”고 말했다.인천시와 충남도도 반도체 고졸 인재 양성 계획을 밝혔다. 인천시교육청은 기존 인천정보과학고등학교를 마이스터고로 전환할 예정이다. 충남도는 내포신도시에 반도체와 모빌리티 인재를 집중적으로 양성할 영재고를 설립할 계획이라고 밝혔다."
2024-05-22,美 특허청은 그를 에디슨과 함께 ‘명예의 전당’에 올렸다,"[한국 과학의 선구자들] ⑪ 모스펫 발명한 강대원 [끝]인류가 가장 많이 만들어낸 인공 구조물은 모스펫(MOSFET·금속-산화층-반도체 전계 효과 트랜지스터)이라는 반도체다. 통계에 따르면 2018년까지 1.3X10²²개의 모스펫이 만들어졌다. 스마트폰에서부터 인공지능에 이르기까지 현대 문명에 없어서는 안 될 존재가 바로 모스펫인데, 이를 발명한 사람은 한국인 물리학자 강대원이다. 모스펫으로 조그만 칩 하나에 수많은 트랜지스터를 집적하며 비로소IT산업이 꽃피기 시작했다. 그가 아니었으면 반도체 혁명은 불가능했을 것이다.1946년 탄생한 세계 최초의 전자식 범용 컴퓨터 에니악(ENIAC)은 진공관을 사용했다. 1만8000개의 진공관이 장착된 이 장치는 집채만 한 크기에 무게는 30톤이 넘었다. 소비 전력도 엄청나 인근 도시 전기 공급에 문제가 생길 정도였다. 이를 해결하며 등장한 반도체가 트랜지스터다. 1947년 등장한 트랜지스터는 컴퓨터 크기를 300분의 1, 소비 전력은 1500분의 1로 줄였다. 트랜지스터를 발명한 미국 벨 연구소의 윌리엄 쇼클리, 존 바딘, 월터 하우저 브래튼 세 사람이 노벨 물리학상을 받은 것은 이 때문이다. 여기에 또 하나 결정적 기술이 등장한다. 1958년 미국의 잭 킬비는 여러 전자 부품을 한 칩에 넣을 수 있는 집적회로(IntegratedCircuit·IC)를 개발한다. 잭 킬비 역시 이 공로로 노벨 물리학상을 받았다.미국 오하이오 주립대 캠퍼스에서 어린 딸과 나란히 손을 잡고 서 있는 강대원 박사. 1955년 미국 유학길에 오른 강대원은 오하이오 주립대에서 4년 만에 박사 학위를 받았다. 1959년 벨 연구소에 들어간 그는 입사 1년 만인 1960년 반도체 소자의 집적도를 높여 작은 면적에 많은 트랜지스터를 넣을 수 있는 모스펫 원리를 구현하는 발표를 했다. /대한민국 과학기술 유공자 공훈록이 무렵 미국 유학 중이던 강대원은 새롭게 떠오르는 반도체를 주목했다. 1931년 서울에서 태어난 그는 경기중, 경기고를 월반해 가며 서울대학교 물리학과에 입학했다. 대입 검정시험에 합격했을 때 불과 17세였다. 그의 아버지는 진주중, 진주고 교장을 거쳐 보성고 교장, 부산사범대학 초대 총장을 지낸 강정용이다. 1928년 도쿄고등사범학교 수학과를 졸업한 강정용의 동기로는 역사를 전공한 함석헌이 있다. 6·25전쟁이 일어나자 해병대에서 복무한 강대원은 1955년 미국 유학길에 올라 4년 만에 오하이오 주립대에서 박사 학위를 받았다. 졸업 후 그의 선택은 당시 반도체 혁신을 이끌던 벨 연구소였다. 1959년 입사한 강대원은 1년 만인 1960년 세계를 뒤흔든 발표를 한다. 모스펫이었다.모스펫은 반도체 소자의 집적도를 높여 더 작은 면적에 훨씬 많은 트랜지스터를 넣을 수 있는 기술이다. 게다가 소비 전력도 훨씬 줄일 수 있다. 오래전부터 모스펫 원리는 알려져 있었지만, 실제 구현하는 방법을 찾지 못하고 있었다. 당시 반도체 회로의 소형화, 집적화가 요구되면서 모스펫 개발이 절실했다. 바로 이때 신입 연구원 강대원이 최초로 동작하는 모스펫을 세상에 보인 것이다. 오늘날 최신 반도체에는 500억개가 넘는 트랜지스터가 들어가니, 무려 500억개의 진공관을 작은 칩 하나에 넣을 수 있게 된 셈이다. 강대원의 모스펫이 스마트폰과 인공지능을 가능하게 한 것이다.강대원은 한발 더 나아갔다. 벨 연구소에서 팀장이 되어 후속 연구에 박차를 가했다. 1967년 또 세상을 놀라게 하는 결과를 발표한다. 전원을 꺼도 저장된 데이터가 사라지지 않는 플로팅 게이트 기술을 개발한다. 현재 우리가 일상에서 쓰는USB와 대형 저장 장치에 쓰이는 낸드 플래시 메모리는 강대원 박사의 플로팅 게이트 기술로 만들어진 것이다. 이 기술 역시 세상을 바꾸었다. 지워지지 않는 메모리는 나중에 디지털 카메라 시대를 열어 100년이 넘는 전통 필름 카메라 업체들을 사라지게 했다.MP3 플레이어의 등장은 오디오 시장을 바꾸어 카세트테이프와CD를 대체했다.이제 세계 전자 업계에서 강대원을 모르는 사람이 없었다. 1975년 강대원은 미국 프랭클린 연구소의 스튜어트 밸런틴 메달을 받았다. 미국 건국의 아버지 벤저민 프랭클린을 기념하는 이 연구소는 메달 수상자를 엄격히 선정한다. 이 메달을 받은 인물들만 보아도 강대원의 업적이 가지는 의미를 알 수 있다. 수상자에는 아인슈타인과 스티븐 호킹, 그리고 반도체 개척 공로로 노벨상을 받은 윌리엄 쇼클리, 잭 킬비 등이 있다. 세계적 과학자만 받는 이 메달 수상자 중 105명이 노벨상을 받았다.1988년 강대원이 벨 연구소를 은퇴하자, 일본 최대IT회사NEC가 글로벌 연구 센터를 미국에 설치하며 그를 초빙했다. 이곳에서도 계속 새로운 연구를 시도하던 강대원은 1992년 학회를 마치고 돌아가던 길에 대동맥류 파열로 급사한다. 향년 61세였다. 많은 이가 그가 조금 더 오래 살았더라면 노벨상을 받았을 것이라고 말한다. 트랜지스터와 반도체 집적회로로 노벨상을 받았으니 다음 순서가 모스펫이 될 가능성이 높았기 때문이다. 지난 2000년 잭 킬비는IC로 노벨상을 받으며 오늘날 반도체 산업이 이렇게나 엄청난 규모로 성장한 것은 강대원의 모스펫 덕분이라고 했다.2009년 미국 특허청은IC개발 50주년을 기념해 ‘무어의 법칙’ 창시자이자 인텔 창업자인 고든 무어, 공동 창업자인 앤드루 그로브와 함께 강대원을 명예의 전당에 올렸다. 앞서 명예의 전당에 오른 인물로는 에디슨, 벨, 라이트 형제, 노벨 등이 있는데, 강대원 박사가 이들과 나란히 자리한 것이다. 2014년 서울대학교 반도체공동연구소에 그의 흉상이 세워졌고, 2017년 한국반도체학술대회는 ‘강대원상’을 제정했다. 그는 오늘날 세계 반도체 산업을 가능하게 만든 선구자다.한국 반도체 산업의 시작강대원 박사가 모스펫과 플로팅 게이트를 발명하던 무렵, 우리나라 현실은 첨단 산업과 거리가 멀었다. 무엇을 할 수 있을지 모색하던 강대원 박사는 한국을 방문하곤 했지만, 국내 반도체 기반은 허약했다. 반면 일본에서 강 박사는 반도체 연구로 노벨물리학상을 받은 일본 학자 에사키 레오나 박사와 동급 대접을 받았다. 그만큼 당시 한국과 일본의 격차는 컸다. 하지만 그의 영향을 받은 후배들이 결국 한국에 반도체 산업을 일으킨다. 그중에는 강대원 박사의 3년 후배인 강기동 박사가 있다.1959년 강기동 박사 결혼식. 왼쪽이 강기동 박사 부부, 오른쪽이 강대원 박사 부부. 강대원 박사 부부는 신부의 웨딩드레스를 장만해 주고, 피로연 식사도 준비해 주었다. 강대원의 경기고, 서울대 후배인 강기동은 1974년 경기 부천에‘한국반도체주식회사’를 설립해 한국 반도체의 선구자로 불린다. /강기동 박사 자서전1958년 강대원이 박사과정으로 있던 오하이오 주립대에 경기고, 서울대 후배 강기동이 도착했다. 이휘소와 경기고 동기였던 강기동은 강대원과 마찬가지로 반도체 산업에 눈을 돌리고 있었다. 1962년 박사 학위를 받은 강기동은 이미 벨 랩에서 명성을 떨치던 선배 강대원과 진로를 상담했다. 강기동 박사가 결혼할 때 강대원 박사의 아내가 신부 들러리로 나설 정도로 가까운 사이. 반도체 공정이 더 중요하다고 생각한 강기동은 생산 현장을 배울 수 있는 모토롤라에 입사한다.1974년 강기동 박사는 모험을 감행한다. 강대원은 시기상조라고 우려했지만, 강기동은 직접 한국에 반도체 공장을 짓기로 한다. 반도체 생산 기술을 한국에 이식하기 위해 강기동은 최신 3인치 웨이퍼로 반도체 칩을 양산하는 공장을 세운 것이다. 이렇게 자본금을 무려 100만달러 들여 부천에 세운 회사가 ‘한국반도체주식회사’다. 하지만 막대한 자금이 필요한 반도체 사업은 쉽지 않았다. 결국 삼성이 1977년 이 공장을 인수한다. 1983년 미국, 일본에 이어 한국이 세계 세 번째로 64K D램을 만든 것이 바로 이 부천 공장이다. 한국의 반도체 신화는 이렇게 시작되었다.‘한국 과학의 선구자들’ 연재를 마칩니다. 독자 여러분과 민태기 박사께 감사드립니다."
2022-05-30,"김건희 팬클럽 계정에 공개된 尹 집무실 그림들, 작가의 정체는","윤석열 대통령과 김건희 여사가 27일 용산 대통령 집무실 의자에 나란히 앉아 있다. /페이스북 건희사랑윤석열 대통령 부인 김건희 여사가 지난 27~28일 용산 대통령실 청사의 대통령 집무실을 들른 사실이 ‘건희 사랑’ 페이스북 계정을 통해 공개되면서 뒤늦게 알려졌다. 이를 통해 윤 대통령의 5층 집무실 모습도 공개됐다.29일 공개된 집무실 사진에는 두 장의 그림이 담겼다. 김 여사 옆 벽에 걸린 작품은 발달장애 화가인 작가 김현우(픽셀 킴)의 ‘퍼시잭슨 수학드로잉’ 작품이다. 파랑과 노랑, 주황 바탕에 김 작가 특유의 수학 공식이 빼곡하게 그려졌다.윤석열 대통령이 21일 서울 용산 대통령실 청사 집무실에서 조 바이든 미국 대통령과 단독환담을 마친 후 그림에 대해 설명하고 있다. /뉴시스윤 대통령은 지난 21일 한·미정상회담 단독 환담을 마친 후 조 바이든 미국 대통령에게 이 그림을 보여주면서 “원천기술의 근본은 수학이다. 원천 기술 분야에서 협력을 잘 해 나가자”라고 제안했다고 한다. 바이든 대통령도 웃으면서 긍정적으로 화답한 것으로 전해졌다.원천 기술 협력에 관한 이야기를 꺼내면서도 장애인 정책에 대한 생각도 함께 전할 수 있는 소재로 해당 그림을 활용한 것이라고 당시 대통령실 관계자는 설명했다.윤 대통령 옆 테이블에 놓인 작은 액자 그림 역시 발달장애 작가의 작품이다. 강예진 작가의 ‘엄마 좋아’라는 작품으로, 엄마 말과 아기 말이 입을 맞대는듯한 형상 뒤로 화려한 타일 무늬가 배치됐다.윤 대통령은 후보 시절이던 지난 1월 예술의전당에서 진행된 한국 발달장애 아티스트 특별초대전을 관람했다. 관람을 마친 후 전시된 작품이 그려진 엽서와 도록을 구매했는데, 집무실에 놓인 그림은 이때 구매한 엽서 중 하나다.강예진 작가의 '엄마 좋아'./발달장애예술인 초대특별전(ACEP) 2022 홈페이지윤 대통령은 지난 25일 취임식에서 함께 연단에 올랐던 ‘국민희망대표’ 19인을 용산 집무실에 초청한 자리에서 그림들을 직접 소개한 바 있다.윤 대통령은 김 작가의 그림에 관해 “이 그림은 다운증후군이 있는 지적장애인이 그린 그림인데, 수학을 소재로 한 수학드로잉”이라며 “제 집무실에도 있고 서울대학교 반도체공학연구소에도 있는데, 제가 앞으로 우리 산업의 가장 중요한 반도체 산업의 고도화를 최우선에 두고 일하겠다는 것”이라고 설명했다.또 두 그림의 배치를 두고는 “다운증후군, 정신지체환자에 대해 대통령이든 공학도든 늘 관심을 가져야 한다는 뜻에서 비슷한 그림을 배치했다”고 했다."
