date,title,content
2023-08-02,"500대 중견기업, 대기업보다 상반기 순고용 증가율 앞서…자화전자 1위","올해 상반기 국내 상장 중견기업들은 지난해 말 대비 0.9% 늘어난 2080명을 순고용한 것으로 나타났다. 같은 기간 순고용 인원이 0.6% 늘어난 대기업보다 증가율이 0.3%포인트 높았다.서울 남산에서 바라본 도심의 주요 기업체 건물./ 연합뉴스2일 기업데이터연구소CEO스코어는 500대 상장 중견기업의 국민연금 가입자 기준 고용현황을 조사한 결과, 올 상반기 순고용이 지난해 말 대비 0.9% 늘었다고 밝혔다. 상반기 상장 중견기업의 국민연금 가입자격 신규 취득자는 2만7927명, 상실자는 2만5847명으로 순증가 인원은 2080명이었다.이에 따라 상반기 기준 500대 상장 중견기업의 총 고용 인원은 22만2696명을 기록해 순고용 증가율은 0.9%였다. 대기업보다 0.3%포인트가 높았다.기업별로는 고사양 카메라 모듈용 핵심부품 등 전자부품을 제조하는 자화전자(472명)가 가장 많았고, 메가스터디교육(268명), 티웨이항공(229명) 등이 뒤를 이었다.자화전자는 작년 말 1923억원을 투자해 구미국가산업단지에 애플 납품용 ‘광학식 손 떨림 보정 부품(OIS)’ 생산 공장을 설립해 신규 고용이 늘어난 영향으로 분석됐다. 티웨이항공은 코로나 엔데믹(감염병의 풍토병화)에 따라 노선 확대를 위해 부기장, 객실승무원, 항공정비사 등 여러 직군에서 신입·경력 채용을 확대했다.순고용 인원이 가장 많이 줄어든 곳은 통신장비 케이스 전문 제조업체 서진시스템으로 157명 감소했다. 그외 서울바이오시스(-90명) △SUN&L(-87명) △네패스(-85명) △서울반도체(-84명) △쌍용정보통신(-83명) △펄어비스(-81명) △코스메카코리아(-75명) △씨젠(-75명) △피에이치에이(-74명) 등 바이오,IT분야 업종의 순고용 감소가 두드러졌다."
2024-07-13,"[아무튼, 픽] 연극 ‘맥베스’ 외","[아무튼, 주말] ※주말 오락 3선▶연극 ‘맥베스’이 셰익스피어 비극의 주인공은 사람이 아니다. 걷잡을 수 없는 욕망이다. 맥베스(황정민) 장군은 승전 후 돌아오는 길에 세 마녀로부터 “장차 왕이 되실 분”이라는 예언을 듣고 고뇌한다. 덩컨왕을 죽이고 왕좌를 차지하지만 죄의식은 결코 사라지지 않는다. 인간의 어두운 욕망은 400년 전이나 지금이나 그대로다. 배우 김소진, 송일국, 송영창, 남윤호 등 출연. 양정웅 연출로 13일 개막해 8월 18일까지 국립극장 해오름극장에서 공연한다.▶예능 ‘서진이네2′서진이네가 아이슬란드에 2호점을 열었다. 장마와 더위에 지친 시청자를 얼음과 오로라의 나라로 데려간다. 메뉴는 꼬리곰탕, 갈비찜, 돌솥비빔밥. 베테랑 사장(이서진)의 지휘 아래 정유미의 디테일, 박서진의 멀티태스킹, 최우식의 잔망, 고민시의 성장기가 더해진다. K푸드의 매력과 위상이 얼마나 달라졌는지 실감하게 된다. 어제의 셰프가 오늘의 홀 매니저가 되는 새로운 시스템. ‘육각형 인턴’이 합류하면서 시청률도 상승세다. 본방은 금요일, 재방은 토요일.▶서울국제무용콩쿠르 특별 갈라올해 서울국제무용콩쿠르는 11국 980명(해외 420명)이 참가해 발레, 현대무용, 민족춤, 안무 부문에서 실력을 겨루고 있다. 폐막식 이튿날인 18일 오후 2시와 8시에 세계 정상급 무용단에서 활동하는 이전 콩쿠르 수상자들을 중심으로 마포아트센터에서 ‘특별 갈라 공연’을 올린다. 8월 2일 광주 아시아문화전당, 8월 14일 대구문화예술회관에서는 이 콩쿠르를 거쳐 성장한 신예 무용수들을 주축으로 ‘주니어 갈라 공연’이 잡혀 있다."
2023-07-28,"前 광주시장 “호남, 민주당 버릴 수 있다”… 與는 호남행","민주당 이용섭 “野엔 전략도혁신도 도덕성도 비전도 없어…자기 이익만 챙기는 삼류 정치”더불어민주당 출신 이용섭 전 광주광역시장은 27일 “지금의 민주당에는 전략도, 혁신도, 도덕성도, 비전도 없다”며 “광주도 민주당이 달라지지 않으면 언제든 민주당을 버릴 수 있다”고 말했다. 행정자치부·건설교통부 장관을 거쳐 18·19대 국회의원(광주 광산을)을 지낸 이 전 시장은 “지금 민주당에는 김대중의 통합의 정치, 노무현의 혁신 정신을 찾아보기 어렵다”며 쓴소리를 했다. 이 전 시장은 현재 민주당 당적을 유지하고 있다.이 전 시장은 이날 본지에 “민주당이 달라져야 하는 건 분명하고, 독과점 체제의 현 양당 체제에도 기대를 걸기 어렵다”며 “일종의 ‘메기 효과’를 노리기 위해서라도 혁신 신당이 나와야 한다”고 말했다. 그는 특히 민주당 텃밭인 광주 여론이 좋지 않다면서 “현역 의원들을 다시 찍겠다는 비율은 12~13% 수준이고, 지난 지방선거 투표율은 37%에 그쳤다”고 했다.이 전 시장은 최근 민주당의 모습이 민생·서민 중심으로 중도를 아우르던 과거의 민주당과 달라졌다고 봤다. 그는 “(민주당과 국민의힘의) 독과점이 견고해지면서 오만해지고 국민을 두려워하지 않고 자기들의 이익만 챙기는 삼류 정치로 가버렸다”며 “의원들의 자질 문제도 있지만 시스템과 제도의 문제가 더 크다. 괜찮은 사람도 (정치에) 들어가면 다 망가진다”고 했다. 최근 일련의 ‘돈 봉투’ ‘코인’ 사태 등을 우회적으로 지적한 것으로 보인다. 그러면서 ‘민주당 혁신’도 제도와 시스템 혁신에 중점을 둬야 한다고 했다.이 전 시장은 ‘신당’ 가능성에 대해 “공천을 받기 어려운 사람들이 자기 생존을 위해 만드는 정당이 아니라 가치 중심의 정책 신당을 만들어야 한다”며, 국민의힘을 포함해 여야를 아우를 수 있어야 한다고 봤다. 그는 조국 전 법무장관을 위시한 ‘호남 신당 창당설’에 대해서는 “코미디 같은 얘기”라고 했다. 이 전 시장은 윤석열 대통령에게도 “진영을 뛰어넘어 경청하고 삼고초려하는 모습을 보여야 한다”며 쓴소리를 했다.전북지사 손잡은 김기현 - 김기현(왼쪽) 국민의힘 대표가 27일 전북 부안군 새만금 세계스카우트잼버리 현장에서 더불어민주당 소속 김관영 전북지사와 손을 잡고 웃고 있다. /국민의힘민주당 일각에서 이런 ‘호남 위기론’이 나오는 가운데, 국민의힘은 호남 공략 ‘서진(西進) 정책’을 이어가는 모습이다. 김기현 대표는 이날 군산시 새만금개발청을 찾아 현장 최고위원회의를 열고 “국민의힘이 호남 지역 국민들에게 볼매(볼수록 매력 있는 사람)로 인정받을 수 있도록 최선의 노력을 다하겠다”며 “제 지역구보다도 많이 오지 않았나 할 만큼 호남 지역에 대한 행보를 해왔다”고 말했다. 김 대표는 취임 직후 첫 현장 최고위를 전북 전주에서 열었고, 취임 100일을 앞둔 지난달 중순에도 광주의 산업 현장을 찾았다. 시도순회 예산정책협의회를 가장 먼저 연 곳도 호남이었다. 투자 유치도 강조했다. 그는 “2013년 새만금청이 설립됐는데 지금까지 8조1000억원의 투자 유치가 있었지만 그중 80%가 넘는 6조6000억원에 달하는 규모는 윤석열 정부에서 이뤄진 것”이라고 했다.국민의힘은 호남에 공들이는 것이 수도권 표심까지 확장될 수 있다고 보고 있다. 광주 출신 김가람 최고위원은 “국민의힘이 호남을 포기하고 호남에서 도망치면 호남 출신 수도권 시민들도 국민의힘을 포기할 것”이라며 “호남을 포기하면 수도권을 잃을 것이고 수도권을 잃으면 우리가 무슨 염치로 영남에 갈 수 있겠나”라고 말했다."
