date,title,content
2024-10-13,세계 1위랑 붙어도 끄떡없다…백전무패 신화 '특허 독종'의 질주,"잊을 만하면, 특허 전쟁에서 승소했다는 소식을 전하며 건재함을 드러내는 기술 기업이 있다.LED(발광다이오드) 전문 기업 서울반도체다. 최근 이 회사는 유럽 특허청 항소재판부의 판결을 끝으로 대만LED업체 ‘에버라이트’와 7년간 벌인 16차례 소송에서 모두 이겼다고 밝혔다. 올해 초에는 글로벌 정보기술(IT) 대기업인 아마존을 상대로 스마트 조명 기술 관련 특허 소송을 제기해 국내외에서 주목을 받기도 했다.13일 서울반도체 관계자는 유럽 특허청 판결에 대해 “디스플레이 성능은 물론 사용자 안전까지 획기적으로 높인 노와이어(NoWire)LED기술이 유럽 모든 국가에서 특허를 인정받게 된 것이라 의미가 깊다”라고 설명했다. 노와이어LED기술은 전선(와이어)과 패키징 없이LED소자를 만드는 것으로, 초소형과 고효율을 장점으로 한다. 제네시스GV80과 아우디A4 차량의 헤드 램프에도 이 기술이 쓰였다.지난 10일에는 유럽통합특허법원(UPC)이 독일 대형 유통사인 엑스퍼트 이커머스의 판매 제품이 서울반도체의 와이캅 기술을 침해했다며, 유럽 8개국에 관련 제품 판매 금지와 폐기 처분을 명령했다. 서울반도체 관계자는 “UPC판결 중 가장 많은 국가에 판매금지 등이 내려진 것”이라며 “해당 기술을 사용하는 모든 제품으로 특허권을 포괄적으로 인정한 획기적 결과”라고 했다.서울반도체 전경. 사진 서울반도체━백전무패 신화 계속1992년 설립된 서울반도체는 글로벌LED시장에서 일본 니치아와 독일 오스람에 이은 세계 3위 업체다. 지난해 매출 7억8400만 달러(약 1조506억원)를 기록했다. 조명과 자동차, 디스플레이에 적용되는LED제품과 관련 솔루션을 제공하는 광(光) 반도체 전문 기업이다. ‘특허 경영’으로LED시장을 평정하겠단 창업자 이정훈 대표의 목표에 따라 특허 확보에도, 특허 침해시 소송에도 적극적이다. 중소·중견기업으로선 특허 소송에 휘말리는 것 자체가 존폐의 위기가 될 수 있지만, 서울반도체는 2000년대 초반부터 백전무패의 기록을 이어가고 있다.시작은 2006년 세계 1위LED기업인 일본 니치아가 제기한 소송부터였다. 급성장하는 한국 중소기업의 싹을 자르려는 시도였다. 그러나 니치아 소송에서 이긴 이후 현재까지 8개국에서 진행된 103건(9월 기준)의 특허 소송에서 서울반도체는 모두 이겼다. 2020년LED전구와LEDTV등을 두고 필립스와 벌인 소송에서도 연거푸 이기자, 업계에선 다윗이 골리앗을 이긴 것이란 평가가 나왔다. 미국 ‘특허 괴물’로 불리는 다큐먼트 시큐리티 시스템즈(DSS)와도 4년간 싸워 2021년 최종 승리했으며, 일본 렌즈 제조기업인 엔플라스와는 6년 분쟁서 승기를 잡았다. 서울반도체 관계자는 “100건이 넘는 송사에서 번번이 승소하자 직원들은 피로감보다 자부심과 성취감을 느낀다”라고 말했다.차준홍 기자━특허 소송 백전백승, 비결은서울반도체는 지난해 12월부터 지난 6월까지 5차례에 걸쳐 월스트리트저널(WSJ)과 파이낸셜타임스(FT) 등에 광고를 냈다. “Birthisnotfair,butopportunitymustbefair”라는 문구가 적힌, 즉 ‘출생은 불공정해도, 기회는 공정해야 한다’는 내용의 광고다. 직원들에 따르면, 이 대표는 평소 “특허가 기울어진 운동장을 평평하게 하며, 작은 기업도 거대한 기업으로 클 기회를 준다”라고 강조해왔다고 한다. 특허를 사수하는 게 단순한 기술 보호 차원을 넘어, 공정한 경쟁과 창의적 혁신을 위한 것이라는 얘기다. 이정훈 대표가 ‘특허 침해 기업을 모두 뿌리 뽑을 때까지 머리카락을 자르지 않겠다’고 선언한 일화는 업계서도 유명하다. 글로벌 기술 전시회나 실적 발표회에 긴 생머리를 질끈 묶고 등장하는 모습은 그의 트레이드마크가 됐다. 일본 니치아와의 소송 땐 꼭 이기겠다는 의지로 회사 로비 바닥과 직원들 의자에 니치아 로고를 깔아 밟고 앉는 이벤트도 벌였다.영국 파이낸셜타임스에 게재한 광고. 사진 서울반도체물론 기술력에 대한 자신 없이는 하기 어려운 행보다. 서울반도체에 따르면, 회사는 매년 매출액의 10%인 1억 달러 정도를 연구개발(R&D)에 투자한다. 현재 회사가 보유한 특허가 1만8000여개, 그중에서 이정훈 대표 개인 특허가 269건이다. 서울반도체 관계자는 “개발직군 직원 개개인의 목표에 특허 아이디어 제출 항목을 넣어 관리하고 있다”라며 “대표이사부터 말단 사원까지 모두 발명에 몰두하는 분위기”라고 전했다. 서울반도체만의 독보 기술인 썬라이크(자연광 스펙트럼에 가장 가깝게 만든LED), 와이캅 등이 그렇게 나왔다.올해1월 팀장 워크샵에서 발표하는 이정훈 대표. 사진 서울반도체지난해 국가전략기술로 지정된 마이크로LED기술과 관련해 서울반도체가 보유한 특허는 1000여 개에 이른다. 마이크로LED는 디스플레이나 조명 등에 쓰는 초소형LED로, 기존LED보다 작으면서도 밝기와 색재현성, 전력 효율이 뛰어나다. 이정훈 대표는 지난 8월 2분기 실적발표회에서 “우리의 특허를 피해 마이크로LED를 만드는 것은 불가능”이라고 자신했다. 업계에 따르면 기존 디스플레이는 마이크로LED로 대체될 전망으로, 향후 10년 내 디스플레이 시장의 20%를 차지(300억 달러)할 것으로 보인다.지난 3월 서울반도체와 아마존 소송 소식을 다룬WSJ기사. 사진 서울반도체서울반도체의 무패 신화는 언제까지 계속될까. 현재 30여 건 소송이 진행 중이다. 서울반도체가 아마존을 상대로 제기한 소송을 소개한WSJ는 지난 3월 보도에서 “이 회사는 5년간 미국, 독일, 프랑스, 네덜란드에서 여러 회사를 상대로 특허 침해에 대해 15건의 가처분 결정을 받아냈다”라며 이 회사의 소송전에 주목했다. 지난 8월 실적발표회 때 아마존과의 소송에 대해 질문이 나오자 이정훈 대표는 “잘 (해결) 될 것 같다”고 말했다."
2022-01-08,특허소송때마다 머리 기른다…CES서 장발 휘날린 대표의 포부,"이정훈 서울반도체 대표가 7일(현지시간) 미국 라스베이거스에서 열린 소비자가전쇼(CES2022)에 마련한 자사 부스에서 살균 솔루션 '바이오레즈' 기술을 설명하고 있다. 최은경 기자광반도체 전문기업 서울반도체가 미국 라스베이거스에서 열린 세계 최대 가전‧정보기술(IT) 전시회인 소비자가전쇼(CES2022)에서 미래 자동차 발광다이오드(LED) 기술을 선보였다.서울반도체가 5~7일(현지시간) 열린 행사에서 고해상도 마이크로 디스플레이 ‘와이캅mc’,지능형 헤드램프 ‘와이캅ADB’,차량용 살균 솔루션 ‘바이오레즈’ 등을 공개했다. 와이캅mc는 자율주행차에서 차량과 사물 간 통신을 할 수 있게 한다. 마이크로 디스플레이 기술을 이용해 기존 디스플레이보다 10배 이상의 밝기를 구현했다.와이캅ADB는LED칩 크기와 간격의 최소화로 정교한 개별 점등이 가능해 전방에서 운행하는 차량이나 반대 차선에서 마주 오는 차량의 주행 상황에 맞춰 정밀하게 헤드램프를 제어해준다. 자동차 실내 공간의 바이러스와 유해균 제거를 위한 바이오레즈 기술은 서울반도체가 특히 자랑하는 기술이다.━‘바이오레즈’ 글로벌 완성차에 납품회사 측은 이 기술로 실내 바이러스를 10분 안에 90% 이상 살균할 수 있다며 이달 중으로 관련 솔루션을 글로벌 완성차 업체에 공급할 예정이라고 설명했다. 서울반도체는 이날 자연광에 가장 가깝게 만든 조명 기술인 ‘썬라이크’도 소개했다.7일(현지시간) 미국 라스베이거스에서 열린 소비자가전쇼(CES2022)에 마련된 서울반도체 부스. 최은경 기자이정훈 서울반도체 대표는 현지에서 기자간담회를 열고 “지난해 매출은 1조3000억원 규모로 올해 두 자릿수 성장을 기대한다”며 “2025년까지 세계 발광다이오드(LED) 시장 1위 기업이 되겠다”고 포부를 밝혔다. 현재는 일본 니치아, 독일 오스람이 수위권이다.이 대표는 이어 “연간 매출의 10%가량을 연구개발(R&D)에 투자해와 기술력 유지에 문제가 없다”며 “앞으로는 마케팅 투자를 브랜드를 알리는 데 주력하겠다”고 덧붙였다.그는 이번CES에서도 트레이드 마크인 긴 은발의 헤어 스타일을 뽐냈다. 그가 머리를 기르는 것은 특허와 관련 있다. 서울반도체는 1만4000여 개에 달하는 특허로 기술력을 입증해왔다. 그만큼 글로벌 기업들과 특허 소송도 많이 겪었다.이 대표는 소송이 진행되면 꼭 승소하겠다는 의지를 표현하기 위해 머리를 기른다고 한다. 최근 80여 건의 특허 소송에서 승소했으며 20여 개 회사와 분쟁 중이다. 이 대표는 “부당한 특허 공격에 엄정하게 대응하고 있다”고 강조했다."
2024-09-25,[국민을 위한 국민의 기업] 신성장 동력 확보 위한 대규모 국제 공동 R&D 프로젝트 시동,"한국산업기술진흥원6대 첨단산업 분야 44개 과제 선정2028년까지 6840억원 투자 지원MIT등 글로벌 최고 연구기관 참여“해외 원천기술 확보해 초격차 유지”지난 6월 열린 한미 첨단산업 기술협력포럼에서 민병주 한국산업기술진흥원장(왼쪽 첫째) 등이 참석한 가운데 ‘글로벌 산업기술협력 센터’ 현판 수여식이 열렸다. 양국 주요 관계자들이 사전 환담을 하고 있는 모습. [사진 한국산업기술진흥원]국내 기업들과 글로벌 최우수 연구기관들이 공동 연구를 통해 미래 신성장 동력을 확보하기 위한 대규모 국제 공동 연구개발(R&D) 프로젝트가 올해 처음으로 시작됐다. 산업통상자원부와 한국산업기술진흥원(이하KIAT)은 세계 최초·최고의 성과를 낼 수 있는 고난도 기술 개발을 목표로 오는 2028년까지 향후 5년간 총 6840억원을 투자해 국제 공동 R&D 과제를 지원한다. 이달 초 바이오, 반도체, 로봇, 이차전지, 미래 모빌리티, 디스플레이 등 6대 첨단산업 분야를 중심으로 44개 과제를 1차로 선정했다.━초저전력 반도체칩,AI로봇 시스템 등 개발이번에 발굴·선정된 과제들은 대부분 기술적 난도가 있어 당장 상용화하기는 어렵지만, 연구개발을 거치면 5~10년 후 미래에 본격적으로 시장이 열릴 것으로 기대되는 기술들이다. 이 중 시스템반도체 설계 전문기업 자람테크놀로지가 미국 소프트웨어 업체 뉴멘타와 손잡고 인간 뇌의 작동 방식 그대로 구현하는 초저전력 반도체칩 개발에 나서 이목을 끈다.뉴멘타는 뇌의 신호 처리 방식을 모방하는 뉴로모픽 알고리즘과 관련한 기술력을 보유하고 있는 업체다. 자람테크놀로지가 구상하는 저전력 반도체칩은 에너지 효율을 대폭 개선하는 신기술로 꼽힌다.휴머노이드 로봇 상용화를 앞당길 로봇 손 개발 과제도 주목받는다. 국내 로봇 전문기업인 로보티즈와 미국 매사추세츠공대(MIT)가 의기투합해 인간 수준의 조작 성능과 물리적 지능을 가진 인공지능 로봇 시스템을 개발하는 것이 목적이다. 로봇 손이 인간의 손처럼 정밀하게 힘을 제어하기 위해서는 촉각 센서와 관절 꺾임, 쥐는 힘 등 여러 가지 부분에서 개발해야 할 기술 개수가 많다. 한층 진보한 로봇 손이 개발되면 농업 자동화, 물류업, 제조업 등 미래 공장의 모습이 획기적으로 바뀔 전망이다.이 밖에 이차전지 분야에서는 나노인텍이 독일 프라운호퍼와 협력해 차세대 배터리 제조 공정을 개발한다. 건식 기반의 공정 기술은 습식 공정 대비 에너지 소비는 절반으로 줄고 비용도 20%가량 줄일 수 있어 저비용 친환경을 실현할 수 있는 차세대 기술로 평가받는다. 기존 습식 공정은 한국도 강점이 있지만, 현재 가장 완성도 높은 건식 공정 기술을 보유하고 있는 독일과 협력한다면 초격차 확보가 가능할 것으로 예상된다.과제 선정을 담당한 민병주KIAT원장은 “한국이 앞서나가는 첨단산업 분야에 해외 기관들이 보유한 원천기술을 결합해 미래 신시장을 선점하는 게 이번 프로젝트의 목표”라고 설명했다.━북미 등 총 22개국 205개 기관 참여이번 과제 공모에는 509개 국내 기업·기관이 참여한 가운데 해외 협력 파트너로 참여한 기관들의 관심도 뜨거웠다. 북미·유럽·아시아 등 총 22개국 205개 기관이 247개 과제를 접수해 평균 경쟁률 5.6대 1을 기록했다.MIT,하버드 의대, 케임브리지대, 스탠퍼드대, 프라운호퍼 연구소, 프랑스 국립과학연구센터, 스웨덴 금속연구소, 취리히 연방 공과대학교 등 세계적으로 주목받는 연구기관들도 나섰다. 특히 지난해 노벨화학상을 수상한 문지 바웬디 교수(MIT)와 2014년 노벨물리학상 수상자 나카무라 슈지 교수를 비롯해 세계 최고 수준의 석학들이 다수 참여했다.치열한 평가를 거친 결과 총 7개국 47개 기관이 국내 103개 기관과 공동 연구의 기회를 얻었다. 국내에서는 동진쎄미켐, 한올바이오파마, 유진로봇, 서울반도체,HD현대중공업 등 69개 기업을 포함해 서울아산병원과 출연연, 전문연구소, 대학 등 총 103개 기관이 참여한다.이처럼 한국이 주도하는 국제 공동연구 과제 선발에 세계 최정상급 연구기관들이 파트너로 참여하려면 기술 협력이 가능한 분야를 선정하고, 현지 기관의 기술 협력 수요를 발굴하는 초기 세팅이 매우 중요하다. 또한 이번 글로벌 R&D 프로젝트에 참여하면 국내 연구자들을 현지 연구 기관에 파견할 수도 있기에 이들의 현지 적응을 지원하고 최적의 연구 파트너를 연계해 매칭하는 협력 채널도 필요하다.지난 4월 산업기술 국제협력 자문위원회 발족식에서 관계자들이 기념촬영을 하고 있다.이에KIAT는 지난 4월 산업기술 국제협력 자문위원회를 발족시킨 데 이어 ‘글로벌 산업기술협력센터’를 만들었다. 글로벌 산업기술협력센터는 첨단산업 분야 국내 기업의 기술 협력 수요가 많은 해외 대학과 연구소에서 공동 R&D와 인력 교류를 지원할 현지 창구 역할을 하게 된다.올해 미국 5곳(MIT,존스홉킨스대, 예일대, 조지아텍, 퍼듀대), 독일 1곳(프라운호퍼 연구소) 등 총 6곳이 선정됐으며,KIAT는 오는 2027년까지 12곳으로 확대할 방침이다.민병주KIAT원장은 “소규모로 파편화된 연구로는 첨단산업 분야 선도 기술을 빠르게 확보하는 데 한계가 있기 때문에 중장기 대규모로 연구 과제의 전략성을 강화했다”며 “국내 기업이 해외 첨단 원천기술을 확보해 글로벌 초격차를 유지하도록 지원하겠다”고 말했다."
2024-10-03,[단독] 삼성 ‘방사선 피폭’ 중대재해 결론 못 내리는 노동부,"최초엔 ‘중대재해 해당’ 판단하곤삼성 “이의절차 밟겠다” 의견내자노동부 본부서 한달 넘게 검토만5년전 피폭사고 대응과 사뭇 달라삼성전자 기흥사업장지난 5월 삼성전자 기흥사업장에서 발생한 방사선 피폭 사고로 인해 노동자 2명이 입은 ‘방사선 화상’이 ‘중대재해’인지를 두고 논란이 지속되는 가운데, 고용노동부가 지난 8월에는 해당 재해를 ‘중대재해’로 판단한 것으로 확인됐다. 그러나 노동부는 중대재해가 아니라는 삼성전자의 주장에 한달 넘게 결론을 내지 못하고 있다.3일 국회 환경노동위원회 소속 이용우 더불어민주당 의원이 공개한 방사선 피폭 사고 관련 삼성전자의 변호인 의견서와 노동부 설명을 종합하면, 노동부 경기지청은 지난 8월27일 삼성전자에 산업안전보건법(산안법)에 따른 ‘중대재해 발생 보고’를 요청한 것으로 파악됐다.산안법은 3개월 이상 요양이 필요한 부상자가 동시에 2명 이상 발생한 재해를 ‘중대재해’로 보고, 사업주에게 노동부 보고 의무를 부과한다. 경기지청은 해당 재해를 ‘부상’으로 보고, 재해가 발생한 지 석달이 되는 8월27일까지 노동자들이 완치되지 못하자 ‘중대재해 발생 보고’를 요청한 것이다.그러나 삼성전자는 사흘 뒤인 8월30일 경기지청에 변호인 의견서를 내어 중대재해 발생 보고를 “보류”하겠다는 뜻을 밝혔다. 삼성전자는 노동자들이 입은 방사선 화상이 ‘부상’이 아닌 ‘질병’이라며, 중대재해가 아니라고 주장했다.삼성전자는 “중대재해 발생 미보고에 따른 과태료 처분을 내린다면 이의절차를 통해 중대재해 해당성을 객관적으로 판단받고자 한다”며 “중대재해임을 전제로 조사가 진행될 경우 여론의 반응 등으로 인한 사업 운영에 미치는 영향이 지대하고 회복이 어려울 것”이라고 밝혔다.이후 경기지청은 노동부 본부에 중대재해 해당 여부에 대한 검토를 의뢰했지만, 한달이 넘도록 결론을 못 내리고 있다. 노동부의 판단이 미뤄지면서 삼성전자에 대한 산업안전보건 감독도 이뤄지지 못한 상태다. 노동부의 이 같은 조처는 2019년 7월 발생한 서울반도체 방사선 피폭 사고 때 와는 사뭇 다르다. 당시 노동부는 서울반도체 하청노동자들의 방사선 피폭 사고 발생 사실이 알려지자 작업중지명령을 내린 뒤, 조사 착수 석달여 뒤인 그해 12월 원·하청 법인과 안전관리자를 산안법 위반 혐의로 검찰에 기소 의견으로 송치했다.이용우 의원은 “과거 서울반도체 피폭 사고와 달리 삼성전자에 대한 조사·수사가 늦어지고 있다”며 “노동부가 판단을 미룰수록 삼성의 눈치를 본다고 생각할 수밖에 없다”고 말했다."
2023-10-09,국내 최고 수준의 교육 환경…학사학위 전공심화과정 인가,"연재 ㅣ ○○ 전문가, 이 대학 이 전공!대림대 반도체학과대림대 반도체학과는 최근 학사학위 전공심화과정 신규 인가를 받아 2024학년도부터 운영할 예정이다. 전문학사 3년 과정을 마치고 1년 동안 진행되는 학사학위 전공심화과정을 수료하면 4년제와 동등한 학사학위가 주어진다. 사진은 대림대 반도체학과 학생들이 수업을 받고 있는 모습. 대림대 제공인공지능, 빅데이터,VR/AR등 신기술 등장으로 일상생활 전반에 차세대 반도체를 탑재한 디지털 기술이 속속 적용되고 있다. 대림대 반도체학과는 이런 4차 산업혁명 시대의 변화를 주도하기 위해 2017년부터 반도체장비전공트랙을 운영하기 시작했으며, 최근 반도체학과를 신설해 차세대 반도체 분야 인재양성에 주력하고 있다. 반도체 관련 대기업 출신 교수진 7명을 확보해 반도체 장비 제조·유지보수, 반도체 생산, 회로설계, 테스트 및 계측에 대한 특화 교육을 하고 있다.2021년에 288㎡ 규모의 반도체 클린룸을, 2022년에는 반도체VR실습실과AR교육 체계를 구축해 ‘국내 최고 수준의 차세대 반도체 선도 전문학과’로서의 면모를 갖춰나가고 있다. 또한 산업현장에서 사용되는 반도체 설계 프로그램을 도입하고, 산업계로부터 실제 장비를 기증받아 교육에 활용하는 등 현장 중심 교육과정을 운영하고 있다.국내 반도체 기업의 인재양성 프로그램을 벤치마킹해 차세대 반도체 수요맞춤형 특화 교육모델인D-SEM(DaelimSemiconductorEducationModel)도 구축했다.D-SEM은 교육과정의 현장성 제고를 위해 산업체 전문가와 교원이 공동으로 하는 산학협동 강의와 산업체 현장에서 강의가 진행되는 현장교육,VR/AR및 영상을 활용하는 콘텐츠 활용 교육, 직무역량수준 인증제 등의 교육 체계로 구성돼 있다.반도체학과 학생들은 1학년 1학기 공통과정을 이수한 뒤 2학기에 희망에 따라 반도체장비전공과 반도체디자인전공을 선택하게 된다. 반도체장비전공은 국내 주요 반도체 장비 산업체와 반도체 생산 대기업에, 반도체디자인전공은 반도체 설계 업체 및 반도체 패키징, 테스트 전문업체에 취업한다.2학년부터는 산업체 전문가와 함께 산업 현장 문제 해결 프로젝트인 캡스톤디자인을 3회 수행한다. 그 결과를 직무능력성과 발표회에서 발표해 반도체 산업체와 학생을 양방향으로 매칭한 후 채용연계형 표준현장실습으로 연계하는SEMI-PUP프로그램을 운영해 취업의 질과 학생 및 산업체의 만족도를 동시에 충족시키고 있다.2017년 한국반도체산업협회와 반도체장비전공트랙 운영 협약을 시작으로 구축된 20여 개의 반도체 산업체 거버넌스를 기반으로 2021년에는 스태츠칩팩코리아, 앰코코리아, 네패스 등과 인재양성 협약을 맺는 등 폭넓은 협력체계를 구축했다. 2023년부터는 한국공기청정협회 지원으로 클린룸 운영관리자 양성 프로그램을 운영하는 한편EUV장비 생산업체인ASML에서 포토 공정 및 장비에 대한 특강을 지원받는 교육과정도 운영 중이다.한국공학교육인증원으로부터 공학기술교육(ETAC) 인증을 획득한 대림대 반도체학과는 국제적으로 인정받은 명실상부한 반도체 전문인력 양성 대학이다. 졸업생은 삼성전자,SK하이닉스, 서울반도체, 주성엔지니어링, 동진세미캠,SK실트론 등 국내 유수 대기업 취업 시 서류전형에서 우대를 받을 뿐 아니라 국제적으로 워싱턴 어코드 회원국의 졸업생과 동등한 자격을 가지게 돼 해외 유수 반도체 기업 취업 시 혜택을 받을 수 있다.최근에는 학사학위 전공심화과정 신규 인가를 받았으며, 2024학년도부터 운영할 예정이다. 전문학사 3년 과정을 마치고 1년 동안 진행되는 전공심화과정을 수료하면 4년제와 동등한 학사학위를 받을 수 있다.김상용 학과장은 “반도체 산업체의 수요를 바탕으로 실습 중심 교육을 하고 있으며, 학생들이 산업체가 요구하는 실력을 갖추도록 자격증 취득 등 자격 기반 교육과 함께 직무역량수준 인증제도를 운영하고 있다”며 “2023년 2월 졸업자 취업률이 96%(자체조사 기준)로 특화 교육의 효과가 나타나고 있으며 앞으로도 양질의 교육을 통해 학생과 기업 모두가 만족할 수 있는 차세대 반도체 전문기술인재를 양성하겠다”고 밝혔다."
