date,title,content
2022-03-16,전세대출 이자 5% 육박… 지방은행 두드려 보세요,"4대은행, 1년새 1%p 넘게 올라… 우대금리 등 꼼꼼히 따져봐야직장인 전모(29)씨는 최근 전셋집을 옮기려 시중은행 대출을 알아보다가 금리가 오른 것을 보고 깜짝 놀랐다. 2년 전에는 연 2.9%로 전세 대출을 받았는데 지금은 주거래은행을 포함한 대부분 은행이 4% 안팎이었기 때문이다. 이자 걱정이 커진 전씨는 대출상담사를 통해 전세 대출 금리가 조금이라도 싼 곳을 찾기 시작했다.은행권 전세 대출 금리가 가파르게 오르면서 최고 금리가 5%에 육박했다. 15일KB국민·신한·하나·우리 등 4대 시중은행의 전세 대출 금리는 연 3.38~4.82%로 1년 전(연 2.31~3.71%)보다 상단이 1.11%포인트 올랐다. 기준금리 인상 등으로 시중금리가 상승한 데다 은행들이 우대금리를 축소하고 가산금리를 올리는 방식으로 대출금리를 올렸기 때문이다. 이날 은행연합회가 발표한 2월 기준 신규 취급액 코픽스(COFIX·자금조달비용지수)는 1.70%로 전월 대비 0.06%포인트 상승했다. 1년 전(0.83%)보다는 0.87%포인트나 올랐다. 이를 반영해 조만간 대출금리는 더 오를 전망이다.공시 사이트 통해 은행별 금리 꼼꼼히 따져봐야전세 대출은 취급하는 은행과 보증 기관에 따라 금리 차가 크기 때문에 요건 등을 잘 비교해보는 게 좋다. 은행연합회와 주택금융공사 공시에 따르면, 은행 14곳 가운데 최근 1주일 새 취급한 전세 대출(주금공 보증) 금리가 가장 낮은 카카오뱅크(연 2.74%)와 가장 높은 대구은행(연 3.92%)의 격차는 1.18%포인트나 된다. 대체로 인터넷 전문 은행이 시중은행보다 전세 대출 금리가 낮은 편이다. 케이뱅크는 평균 2.94%이고 지방은행인 광주은행과 전북은행도 각각 3.16%, 3.30%로 4대 은행보다 금리가 낮다.또 은행마다 급여 이체 실적 등에 따른 우대금리 조건이 다르기 때문에 자신의 상황에 맞춰 골라야 한다. 지난 11일NH농협은행은 모바일 전세 대출 영업을 재개하면서 우대금리를 최고 0.4%포인트에서 최고 0.7%포인트로 상향했다.대출 비교 플랫폼 ‘핀다’에서는 정책 상품을 포함해 주금공과 서울보증보험, 주택도시보증 등 보증 기관에서 신청 가능한 상품을 한꺼번에 조회해볼 수 있다. 대출받으려는 주택 주소와 개인 정보 등을 입력하면 된다. 다만 대출 신청은 각 금융사에서 해야 한다.틈새 노리는 지방은행시중은행의 대출금리가 오르자 최근 지방은행들은 틈새시장을 겨냥해 전세 대출 ‘특판’을 내놓고 있다. 가계 대출 총량 한도가 여유 있는 연초인 만큼, 전국을 무대로 공격적 영업에 나선 것이다. 먼저 대구은행은 지난 1일부터 담보 대출 비교 플랫폼 ‘뱅크몰’에서 자사 ‘무방문 전세 대출’을 신청할 경우 신용 등급과 무관하게 무조건 연 3.44%를 적용해주는 이벤트를 진행하고 있다. 신용 등급이 낮아 1금융권 이용 시 높은 금리를 물어야 하는 고객들이 혜택을 볼 수 있다. 1000억원 한도로 선착순 판매 중이다. 부산은행도 지난달 23일부터 6000억원 한도로 주택 관련 대출 특판을 시작했다. 부산은행이 선정한 신규 입주 예정 사업장의 세입자가 전세 대출을 받을 경우 차주에게 0.3%포인트 우대금리를 추가로 제공한다. 이를 적용하면 전세 대출 금리는 최저 연 3.55%로 내려간다.전세 대신 월세 택했다면 카드 납부 방법도5%에 바짝 다가선 시중은행 전세 대출 금리 탓에 일부 차주는 전세 대신 월세를 택하기도 한다. 서울 아파트 전·월세 전환율(보증금을 월세로 전환할 때 적용되는 비율)이 4.1%임을 감안하면, 신용 등급이 낮은 차주의 경우 전세 대출 이자보다 월세가 훨씬 싸기 때문이다.이렇게 늘어난 월세족을 겨냥, 카드로 월 200만원까지 월세를 납부할 수 있는 서비스도 있다. 신한카드와 삼성·우리·현대카드가 금융 당국에서 혁신 금융 서비스로 지정받아 시작한 것으로 계좌에 잔액이 없어도 카드로 월세를 납부하고 결제일에 대금을 납부할 수 있다. 대출이 아니어서 신용 등급에 영향이 없고, 임대인이 사업자 등록을 할 필요도 없어 간편하다. 수수료 1%는 임대인과 임차인이 협의해 부담한다."
2022-07-11,전세 보증금 떼 먹는 사기 늘자… 대검  “구속 수사하라”,"대검찰청/뉴스1대검찰청은 11일 계획적·적극적으로 전세 보증금을 가로채는 전세 사기 사건에 대해 원칙적으로 구속 수사를 할 것을 전국 검찰청에 지시했다고 밝혔다.대검에 따르면 2019~2021년8월HUG(주택도시보증공사)와SGI(서울보증보험)에 접수된 전세 보증금 미반환 사고는 8130건이며, 피해액은 총 1조 6000억원 상당이다. 그 중 3억원 이하 전세 보증금 떼 먹기 사건 건수가 89%에 이르는 등 ‘2030청년’과 ‘서민’의 피해가 늘어나고 있다고 대검은 밝혔다.대검은 “‘검찰 사건 처리 기준’에 따라 기망 수법이 계획적·적극적인 경우 등 원칙적으로 구속 수사하라”고 전국 검찰청에 지시했다. 또 수사·공판 과정에서 피해자가 전세금을 마련한 경위, 전세금이 피해자 재산에서 차지하는 비중, 피해 회복 여부 등 구체적인 양형 사유를 수집·제출하고, 죄에 상응한 형이 선고될 수 있도록 적극적으로 항소하며, 전세 사기를 저지른 이들의 은닉재산을 추적해 피해자의 피해 회복을 지원하라고 지시했다.앞서 서울중앙지검은 지난 5월 31일 수도권 빌라들을 자기 돈 투자 없이 ‘갭투자’ 방식으로 사들인 뒤 전세 세입자들에게 보증금을 돌려주지 않은 ‘세 모녀 전세 사기 사건’의 피의자인 모친 김모씨를 구속 기소했다. 전세 사기 사건의 첫 구속 기소 사례다. 김씨는 30대 두 딸 명의로 빌라 136채를 사들여 임차인을 모집해 놓고 세입자들에게 보증금을 돌려주지 않는 등 전세 사기를 한 혐의를 받고 있다. 앞서 서울경찰청 강력범죄수사대는 지난 1월 김씨와 두 딸을 검찰에 송치했다. 검경 수사 결과, 이 사건으로 피해를 입은 이는 136명, 보증금 약 298억원으로 조사됐다.대검은 국토교통부 인스타그램 ‘부동산 전세사기 수법 대처는 어떻게?’,캠코(www.kamco.or.kr) 홈페이지의 ‘전세사기 피해 이렇게 예방하세요’,깡통전세 피해예방 상담센터(consult.kapanet.or.kr)의 ‘깡통전세 유형 및 예방법’ 등을 참고해 전세 사기를 미리 예방하라고도 권고했다."
2023-09-13,"서울보증보험, 금융위에 기업공개 위한 증권신고서 제출","서울보증보험은 금융위원회에 유가증권시장 상장을 위한 증권신고서를 제출하고 본격적인 공모 절차에 돌입한다.서울보증보험 상장은 작년 7월 금융위원회 산하 공적자금관리위원회가 ‘서울보증보험 지분(예금보험공사 보유) 단계적 매각 추진’ 계획을 발표하면서 추진됐다. 서울보증보험은 지난 8월 22일 한국거래소로부터 상장예비심사 승인 결과를 통보받은 바 있다.서울보증보험은 이번 공모를 통해 최대 주주 예금보험공사(사장 유재훈)의 보유지분 중 전체 발행주식의 10%(6,982,160주)를 구주 매출할 계획이다.1주당 희망공모가 범위는 3만9500원에서 5만1800원으로, 총 공모규모는 2757억~3676억원이다. 이번 공모를 위해 평가된 서울보증보험의 기업가치는 2조 7580억원에서 3조 6168억원 수준으로 제시됐다.서울보증보험은 다음 달 13일부터 19일까지 국내외 기관투자자를 대상으로 수요예측을 실시해 공모가를 최종 확정한 후, 같은 달 25일과 26일 이틀간 청약을 진행할 예정으로, 11월 3일 매매거래가 개시될 예정이다. 공동대표 주관사는 미래에셋증권과 삼성증권이 맡고 있다.서울보증보험은 1969년 설립 후 개인과 기업의 경제활동에 필요한 각종 이행보증은 물론, 신원보증, 휴대전화 할부보증, 중금리 대출보증, 전세자금 대출보증 등 다양한 상품을 제공하는 국내 유일한 종합보증기업으로,ICISA(국제신용보험‧보증보험협회) 회원사 원수보험료 기준 글로벌Top4 규모의 보증회사이다.서울보증보험은 실적 및 재무건전성 대비 합리적인 가격과 50% 이상의 배당 성향을 주요 투자 하이라이트로 내세워 상장을 추진하고 있다.일반보험사와는 달리 보증시장의 경우 경제성장 및 산업 고도화에 따라 지속적인 성장을 이어오고 있다. 실제 지난 5년간 국내 경제성장률은 실질 국내총생산 기준으로 연평균 3.2% 성장한 반면, 국내 보증시장의 경우 보증잔액 기준으로 연평균 9.5% 성장하고 있다.서울보증보험은 동 기간 보증 잔액이 연평균 10.4% 증가했다. 기존 국내 보증산업의 안정적인 성장에 더해 신용정보 및 평가, 디지털 기반 신상품, 해외 영업, 채권추심 등을 통해 추가적인 성장동력 확보가 가능하다는 평가다.서울보증보험은 2022년 연결재무제표 기준 자기자본 5조 411억원, 매출액 2조 6363억원, 당기순이익 5685억원이며, 연간 보증공급금액은 약 323조원 수준이다. 총자산수익률(ROA)은 5.8%로 국내 손해보험업계에서 20년 연속 1위이다. 지급여력비율은 올해 상반기 기준으로 업계 최고 수준인 411.7%이다. 또한 S&P,Fitch등 글로벌 신용평가기관으로부터 각각 A+,AA-신용등급을 보유하고 있다.서울보증보험은 희망공모가 범위 기준으로 예상 시가총액이 2조 7,580억원에서 3조 6,168억원이다. 서울보증보험의 ‘23년 상반기 연결재무제표 기준 자본총계가 4조 8,158억원임을 감안하면 주가순자산비율(PBR)은 0.57~0.75배에 불과하다. 국내 유일한 종합보증보험사로서 우량한 실적과 재무건전성을 보이고 있는 점에서 시장친화적인 가격대라는 평가가 나온다.특히, 서울보증보험과 규모가 비슷한 코파스(프랑스)의 경우 2023년 상반기 자본총계 기준 0.97배 수준의 가격에서 주가가 형성되어 있다. 서울보증보험은 원수 보험료 기준으로 코파스와GlobalTop3~4위를 다투고 있다.서울보증보험 주식은 배당주로 평가된다. 따라서 배당주로서의 장점이 투자자들에게 가장 큰 세일즈 포인트가 될 것으로 보인다. 서울보증보험은 올해 상반기까지 12년 연속으로 배당을 실시했다. 지난해 기준 업계 최고 수준인 50.2%의 배당 성향을 보였다. 최근 5년간 주주환원율은 평균 40.9%로 국내 증시에 상장된 손해보험사의 평균인 18.9%보다 월등히 높은 수준이다.서울보증보험은 향후에도 기존의 배당성향 50%를 유지하거나 상향한다는 목표하에 지속적으로 배당 재원을 확대하겠다는 계획으로, 연말을 상장 시점으로 잡은 것도 배당 매력 강조에 유리할 전망이다.2017년에 상장했던ING생명의 경우에도 해외 투자기관들이 높은 배당 성향과 재무적인 안정성에 높은 점수를 준 바 있다. 시장관계자는 “서울보증보험의 주관사단도ING생명의IPO를 벤치마킹해 해외 세일즈에 공을 들이는 모습”이라며, “해외 기관들 입장에서는 서울보증보험의IPO딜은 매력적인 투자처로 여겨질 수 있다.”고 말했다.서울보증보험은 오는 19일부터 해외 및 국내 투자자를 대상으로 딜로드쇼를 진행할 예정이다. 지난 3월에도 상장주관사인 미래에셋증권, 삼성증권과 함께 홍콩, 싱가포르 등에서NDR(NonDealRoadshow)을 연 바 있다. 이후 내달 중순까지 국내외 투자자들을 만나고, 최고 투자책임자, 애널리스트 등 그룹간담회를 진행할 계획이다."
2024-10-07,"'한동훈 공격 사주' 의혹 김대남, SGI서울보증 감사직 사퇴","김대남 전 대통령실 선임행정관. 중앙포토한동훈 국민의힘 대표에 대한 '공격 사주' 의혹이 제기된 김대남 전 대통령실 행정관이SGI서울보증 감사직을 사퇴했다.7일 금융권에 따르면 김대남SGI서울보증 상임감사위원은 이날 사직서를 제출했다.김 전 행정관은 7·23 국민의힘 전당대회를 앞두고 유튜브 채널 '서울의소리'에 ""김건희 여사가 한동훈 후보 때문에 죽으려고 한다. 이번에 잘 기획해서 치면 여사가 좋아할 것""이라고 말했다. 이에 한 대표에 대한 공격을 사주했다는 논란이 일었다.논란이 커지자 대통령실 일각에서도 ""김 전 행정관이 거취를 고민해야 한다""고 지적했다.김 전 행정관은 지난해 10월 대통령실을 퇴직했다. 이후 올해 8월 수억원대 연봉을 받는SGI서울보증보험 상임감사위원으로 임명돼 '낙하산' 논란이 불거지기도 했다."
2022-12-05,치솟는 금리에 ‘깡통주택’ 속출… '전세보증금' 지킬 방법은,"치솟는 금리, ‘거래 절벽’으로 인한 집값 하락 영향이 세입자까지 옥죄고 있다. 전세 보증금을 떼일 수 있는 이른바 ‘깡통 주택’이 늘고 있어서다. 깡통 주택은 전세 보증금이 집값과 빚의 차액을 초과하는 집을 말한다. 경매로 넘어가면 전세 보증금을 회수하기 어렵다.집값에 이어 전셋값이 하락하면서 전세 보증금을 돌려 받지 못하는 '깡통 주택'이 늘고 있다. 뉴스1한국은행은 올해 들어서만 기준금리를 2.25%포인트 올렸다. 기준금리가 3.25%까지 오른 건 2012년 6월 이후 10년 5개월 만이다. 기준금리가 뛰면서 대출금리도 빠르게 올라 1년 사이 이자 부담이 두배로 늘었다. 한은에 따르면 시중은행의 평균 주택담보대출 금리(신규취급액 기준)는 지난해 1분기 연 2.67% 수준이었다. 하지만 지난 3분기엔 연 4.43%까지 상승했다. 현재 시중은행의 주담대 금리는 최저 5% 선, 최고 7% 선이다.이 때문에 주택 거래가 끊기고 집값은 하락세다. 서울부동산정보광장에 따르면 지난해 11월 한 달간 서울에서 거래된 아파트는 1360가구였지만, 지난달은 466가구에 그쳤다. 1년 새 거래량이 65% 감소했다. 사실상 전세 보증금이 전 재산인 세입자 입장에선 고민이 크다. 전세 계약이 끝났는데도 집주인이 전세 보증금을 돌려주지 않으면 그야말로 오도 가도 못하는 상황에 부닥칠 수 있어서다.그래픽=김경진 기자capkim@joongang.co.kr주택도시보증공사(HUG)에 따르면HUG가 집주인 대신 세입자에게 전세 보증금을 지급한 변제액은 올해 들어 9월까지 6466억원으로, 이미 지난해 변제액(5790억원)을 넘어섰다. 2018년엔 792억원에 불과했다. 반환 보증 사고 건수도 연초 이후 9월까지 3050건으로 지난해(2799건)보다 많다. 2018년(372건)의 8배 수준이다.5일 금융감독원은 세입자가 전세보증금을 지킬 수 있는 방법을 소개했다. 전세 계약을 할 때는 우선 전세가율(매매가 대비 전셋값 비율)부터 살펴야 한다. 전셋값이 매매가의 80%를 넘으면 깡통 주택이 될 위험이 크기 때문이다. 특히 막 완공한 신축 빌라는 매매가 시세를 가늠하기 쉽지 않지만, 주변 부동산 중개업소를 방문하면 대략적인 시세를  파악할 수 있다. 등기부 등본도 확인해야 한다. 등기상 전세 보증금보다 우선순위인 근저당 금액이 많다면 전세 계약을 다시 한번 고려해야 한다. 특히 다가구 주택인 경우 더 꼼꼼히 살펴야 한다.그래픽=김경진 기자capkim@joongang.co.kr계약할 때 이런 사항을 확인했어도 전세 계약이 끝날 시점에 집주인이 전세 보증금을 돌려주지 못하는 경우가 생긴다. 요즘같이 전셋값이 하락할 경우 집주인이 새 세입자에게 받을 전세 보증금이 이전보다 적은 경우다. 차액을 마련하지 못했다며 전세 보증금의 일부만 주거나 집주인의 세금 체납이나 자금 사정 악화 등 변수도 있다.금감원은 이런 경우를 대비해 ‘전세보증금 반환 보증’에 가입할 것을 권고했다. 전세보증금 반환 보증은 전세 보증금을 돌려받지 못하는 세입자를 보호하기 위해 주택금융공사‧주택도시보증공사‧서울보증보험 등 보증기관에서 판매하는 상품이다. 집주인이 전세 보증금을 돌려주지 않으면 이들 보증 기관에서 대신 세입자에게 전세 보증금을 지급한다. 가입하려면 보증기관의 심사를 거쳐야 하고 보증료는 세입자가 낸다.각 보증기관별 전세 보증금 반환 보증 . 금감원전세보증금 반환 보증에 가입하려면 주택 유형이나 보증 금액, 할인 여부를 고려해야 한다. 예컨대 주택금융공사와 주택도시보증공사는 신혼부부‧다자녀‧저소득‧장애인‧고령자라면 보증료를 할인한다. 고가 주택이라면 서울보증보험을 찾으면 된다. 금감원은 “전세보증금 반환 보증은 집주인 동의 없이 가입할 수 있고 전세 계약 기간의 절반이 지나기 이전에 가입할 수 있는 만큼 유리한 보증기관을 합리적으로 선택하면 된다”고 조언했다."
2022-09-26,"산업부, ‘지방 투자 기업 부담 경감’ 위해 보조금 보험료율 25% 인하",뉴스1산업통상자원부는 26일 지방투자 기업의 부담 경감을 위해SGI서울보증과 협의해 지방투자촉진보조금의 이행보증보험료율을 25% 인하하기로 했다고 밝혔다.지방투자촉진보조금은 수도권 기업의 지방 이전 또는 지방 신·증설 투자 시 투자비의 일정 비율을 보조금으로 지원하는 것으로 올해 정부 예산으로 1922억원이 책정됐다보조금 수혜 기업은 투자 및 고용 목표를 충족하지 못할 경우 보조금의 전부 또는 일부를 반납해야 하며 이를 담보하기 위해 이행보증보험에 가입해야 한다.내달 4일부터 이행보증보험 가입 기업의 보험료율이 현재 연 2.041%에서 1.531%로 0.510%p 하향 조정된다.이 경우 기업의 보험료 절감액은 최근 1년(지난해 7월~올해 6월)간 가입한 기업을 기준으로 연간 55억원 규모로 추산된다.지역투자 기업 보증 혜택. 사진 산업통상자원부황수성 산업부 산업혁신성장실장은 “이번 보험료율 인하로 기업의 부담을 크게 덜 수 있음은 물론 기업의 지방투자 확대에도 긍정적 영향을 미칠 것”이라고 말했다.한국산업단지공단은 이날 오후 대구 본사에서SGI서울보증과 보험료율 인하를 포함해 산업단지 입주 기업의 지속적 애로 해소 및 편의 도모를 위한 업무협약을 체결한다.
