date,title,content
2023-09-25,"총수일가 회사 부당 지원…공정위, 세아창원특수강 고발","세아그룹 세아창원특수강이 총수 일가 개인 회사를 부당하게 지원한 사실이 드러나 수십억 원의 과징금을 물고 검찰에 고발 조치 됐다.공정거래위원회는 세아창원특수강이 계열사CTC에 원재료인 스테인리스 강관을 상당히 낮은 가격으로 판매한 행위(공정거래법상 부당 지원·총수 일가 사익 편취 규정 위반)에 대해 시정 명령과 과징금 32억7600만원(잠정)을 부과하고 세아창원특수강을 고발하기로 했다고 25일 밝혔다. 과징금은 세아특수강에 21억2200만원,HPP에 11억5400만원이 각각 부과됐다.유성욱 공정거래위원회 기업집단감시국장이 25일 세종시 정부세종청사에서 기업집단 '세아' 계열회사들의 부당내부거래 행위에 대해 시정명령 및 과징금 32억 원을 부과하기로 결정했다며 세부 내용을 설명하고 있다. 연합뉴스공정위에 따르면 세아그룹 창업주의 아들인 이태성 세아홀딩스 사장은 세아홀딩스 체제에 대한 지배력을 강화하려는 목적으로 2014년 본인이 지분을 100% 소유한HPP를 설립하고, 이듬해CTC를 인수하게 했다.CTC를 통해 현금을 벌어들여HPP가 세아홀딩스 지분을 취득하게 하기 위해서다.이후 2016년부터 세아창원특수강은 다른 고객사들에 비해 상당히 낮은 가격에 스테인리스 강관을 판매했다. 2016년 1분기부터 2019년 2분기까지CTC에 정상 할인(1㎏당 400원)보다 이례적으로 높은 할인(분기당 300t 이상 구매 시 1㎏당 1000원)을 제공한 것으로 조사됐다. 이를 위해CTC만 달성할 수 있는 방식으로 물량 할인 제도(QD)를 설계해 시행했는데, 다른 기업에는 이런 할인이 존재한다는 사실을 알리지도 않았다.그 결과CTC는 26억5000억원 상당의 원재룟값을 절약했을 뿐 아니라, 완제품 가격 경쟁력을 확보해 재인발(강관의 외경과 두께를 줄이는 가공) 업계 매출액 1위 사업자로 올라섰다. 반면CTC에 대한 세아창원특수강의 영업이익률은 2014년 30.5%, 2015년 20.2%에서 2016년 -5%로 급감했다.CTC가 적자를 보지 않도록 세아창원특수강이 대신 영업 적자를 감수한 것이다.유성욱 공정위 기업집단감시국장은 ""물량 할인제도라는 외형을 갖췄더라도 계열사 지원을 목적으로 설계·시행되는 등 그 자체가 합리성이 없는 것이라면 부당 내부거래에 해당할 수 있음을 확인한 것""이라며 ""대기업 집단 계열사들이 특수관계인 개인 회사를 지원함으로써 궁극적으로 특수관계인에게 부를 이전시키고 특수관계인 계열회사에 대한 지배력을 강화한 행위를 적발·제재했다는 의의가 있다""고 했다."
2024-11-25,"K철강이 베트남산?…미국, 우회덤핑 수출 조사","포스코의 베트남 법인(포스코베트남)이 미국에 수출하는 철강 제품에 대해 미 정부가 우회덤핑 조사를 하고 있는 것으로 24일 확인됐다. 한국산 철강은 매년 지정된 양(쿼터)만큼 미국에서 관세 면제를 받는데, 이를 초과한 물량에 대해선 제품가의 25%를 관세로 내야 한다. 포스코가 이를 회피하기 위해 일부 제품을 베트남산으로 꾸며 수출했다고 미정부가 의심하는 것이다. 철강업계와 통상당국은 이 사건에 대한 판단이 트럼프 2기(내년 1월 20일 출범) 정부에서 내려질 가능성이 크다고 보고 대책 마련에 나섰다.이에 대한 최근 논의는 22일 ‘미 신정부 출범 대비 철강산업 영향 점검’ 간담회에서 열렸다. 서울 강남구 역삼동 한국기술센터에서 개최된 간담회엔 안덕근 산업통상자원부 장관과 포스코·현대제철·세아홀딩스 등 업계 고위관계자들이 모였다. 안 장관은 모두발언에서 “(트럼프) 신정부의 정책 변화에 따른 업계의 고민이 클 것”이라며 “업계와 정부가 ‘원팀’이 돼 철저히 준비한다면 오히려 기회로 작용할 수 있을 것”이라고 말했다.모두발언 뒤 비공개로 진행된 발표에선 ‘미국 대선 결과에 따른 철강 산업 영향-미중 갈등 영향 중심으로’라는 제목의 문건이 정부 측에 제출됐다. 포스코그룹의 싱크탱크 조직인 포스코경영연구원이 만든 5쪽짜리 문건이다.여기엔 ‘미국의 한국산 철강 대상 베트남 우회덤핑 조사개시 3건’이라는 내용이 담겨있었다. “미국이 중국산 철강 제품의 우회수출 기지로 베트남을 지목하고 조사를 강화하고 있다”는 내용에 이어 나온 설명이었다. 미국은 2016년엔 중국산 철강재의 베트남 우회 수출 의혹을 두고 포스코베트남을 조사한 적이 있었는데, 이번엔 한국산 철강재까지 그 대상으로 지목한 것이다.한국이 미국으로 수출하는 철강재는 해마다 263만t까지 관세 면제 혜택을 받는다. 트럼프 1기 정부가 2018년 철강을 국가 안보 연관 물품으로 해석해, 한국으로부터의 철강 수입량 관세 면제 쿼터를 그렇게 정했다. 그 이전까지 한국의 대미 철강 수출량은 340만~440만t이었지만, 이 조치 이후 250만t대로 떨어진 상태다. 이 때문에 트럼프 2기 정부가 이번 베트남 우회 수출 의혹 등을 명분으로 쿼터 감축과 같은 추가 조치를 내릴 수 있다는 게 업계의 걱정이다.이 자리에선 또 멕시코를 우회 경로로 한 제품에 대해 미국이 감시에 나선 상황에 대해서도 논의됐다. 멕시코산 제품은 ‘미국-멕시코-캐나다 협정’(USMCA)에 따라 관세 혜택을 받는데, 최근 미국은 중국 전기차 회사가 멕시코를 생산 기지로 활용해 관세 장벽을 피하려는 것으로 보고 ‘멕시코산 자동차 수입관세 100%’ 등을 예고한 상태다."
2024-11-24,"'트럼프 관세폭탄' K철강 불똥?…美, 베트남 우회 덤핑 수출 조사","미 대선 기간이던 지난 10월 도널드 트럼프 당시 공화당 후보가 펜실베이니아 지역 철강 노동자들 앞에서 유세하던 모습.AP=연합뉴스포스코의 베트남 법인(포스코베트남)이 미국에 수출하고 있는 철강 제품에 대해 미 정부가 우회덤핑 조사를 하고 있는 것으로 24일 확인됐다. 한국산 철강은 매년 지정된 양(쿼터)만큼 미국에서 관세 면제를 받는데, 이를 초과한 물량에 대해선 제품가의 25%를 관세로 내야 한다. 포스코가 이를 회피하기 위해 일부 제품을 베트남산으로 꾸며 수출했다고 미 정부가 의심하는 것이다. 철강업계와 통상당국은 이 사건에 대한 판단이 트럼프 2기(내년 1월 20일 출범) 정부에서 내려질 가능성이 크다고 보고 대책 마련에 나섰다.이에 대한 최근 논의는 22일 ‘미 신정부 출범 대비 철강산업 영향 점검’ 간담회에서 열렸다. 서울 역삼동 한국기술센터에서 개최된 간담회엔 안덕근 산업통상자원부 장관과 포스코·현대제철·세아홀딩스 등 업계 고위관계자들이 모였다. 안 장관은 모두발언에서 “(트럼프) 신정부의 정책 변화에 따른 업계의 고민이 클 것”이라며 “업계와 정부가 ‘원팀’이 돼 철저히 준비한다면 오히려 기회로 작용할 수 있을 것”이라고 말했다.모두발언 뒤 비공개로 진행된 발표에선 ‘미국 대선 결과에 따른 철강 산업 영향-미중 갈등 영향 중심으로’라는 제목의 문건이 정부 측에 제출됐다. 포스코그룹의 싱크탱크 조직인 포스코경영연구원이 만든 5쪽 짜리 문건이다.━2016년에 이어 또 우회덤핑 조사여기엔 '미국의 한국산 철강 대상 베트남 우회덤핑 조사개시 3건'이라는 내용이 담겨있었다. “미국이 중국산 철강 제품의 우회수출 기지로 베트남을 지목하고 조사를 강화하고 있다”는 내용에 이어 나온 설명이었다. 미국은 2016년엔 중국산 철강재의 베트남 우회 수출 의혹을 두고 포스코베트남을 조사한 적이 있었는데, 이번엔 한국산 철강재까지 그 대상으로 지목한 것이다.22일 열린 철강 업계 간담회에서 모두발언하는 안덕근 산업통상자원부 장관. 사진 산업부한국이 미국으로 수출하는 철강재는 해마다 263만톤(t)까지 관세 면제 혜택을 받는다. 트럼프 1기 정부가 2018년 철강을 국가 안보 연관 물품으로 해석해, 한국으로부터의 철강 수입량 관세 면제 쿼터를 그렇게 정했다. 그 이전까지 한국의 대미 철강 수출량은 340만~440만t이었지만, 이 조치 이후 250만t대로 떨어진 상태다. 이 때문에 트럼프 2기 정부가 이번 베트남 우회 수출 의혹 등을 명분으로 쿼터 감축과 같은 추가 조치를 내릴 수 있다는 게 업계의 걱정이다.이 자리에선 또 멕시코를 우회 경로로 한 제품에 대해 미국이 감시에 나선 상황에 대해서도 논의됐다. 멕시코산 제품은 ‘미국-멕시코-캐나다 협정’(USMCA)에 따라 관세 혜택을 받는데, 최근 미국은 중국 전기차 회사가 멕시코를 생산 기지로 활용해 관세 장벽을 피하려는 것으로 보고 ‘멕시코산 자동차 수입관세 100%’ 등을 예고한 상태다. 이에 대해 포스코경영연구원은 “‘포스코멕시코’가 미국내 자동차 회사에 공급하는 아연도강판에 한국산 냉연소재를 사용하면USMCA기준을 충족하지 못해 관세 부담을 질 수 있다”고 우려했다.정부와 업계는 트럼프 정부를 상대로 한국산 제품 수출이 미 경제에 도움이 된다는 점을 설득할 계획이다. 또 철강 세부 품목별로 미국의 정책 변화가 미치는 영향이 다르기 때문에 민관 협의체를 만들어 현지 동향을 면밀히 모니터링하고 시나리오별 대응 전략을 만들 필요가 있다는 데 뜻을 같이 했다. 이날 간담회에서 서강현 현대제철 사장은 기자들에게 “(철강 수출) 쿼터를 잘 유지해달라고 얘기할 생각”이라며 “현대차그룹은 미국에 신공장까지 지어서 철강 수요가 늘어나고 있다. 현지 투자를 어필하려고 한다”고 말했다."
2024-09-27,신유빈 옆 그녀 누구지…애경家 3세 '재계 인플루언서' 도전장,"채문선 탈리다쿰 대표(왼쪽)와 신유빈 탁구선수. 사진 유튜브'TalithaKoum탈리다쿰' 캡처애경그룹 오너가 3세인 채문선(37) 탈리다쿰 대표가 유튜브에 도전한다. 탈리다쿰은 한국 탁구 국가대표 신유빈이 브랜드 앰배서더(홍보 대사)로 있는 프리미엄 비건 뷰티 브랜드다.27일 재계 등에 따르면 채 대표는 최근 탈리다쿰 유튜브 채널에 ‘채문선의 달리다꿈’ 코너를 열고 대중과 소통을 시작했다. 이 코너는 매주 금요일 오후 6시 공개될 예정이다.채 대표는 지난 13일 공개된 영상에서 “탈리다쿰 브랜드가 5년이 됐는데 5년 됐는지 많이들 모르더라. (브랜드를) 많이 알리고 싶었다”라며 유튜브에 출연하게 된 배경을 밝혔다. 그는 “새로운 코너를 통해 탈리다쿰을 어떻게 만들었는지, 제가 어떻게 사는지 등을 공유하고 싶다”라며 “출근하는지도 많이 물어봐서 그 오해를 풀고 싶다. 정말 열심히 일하고 있다”고 말했다.채문선 대표(왼쪽)와 신유빈. 사진 유튜브'TalithaKoum탈리다쿰' 캡처최근엔 이 채널에서 브랜드 앰배서더로 지난 1년간 활동한 신유빈과 함께한 영상도 공개됐다. 채 대표와 신유빈은 이날 한 패션 전문잡지 화보 촬영을 같이했다.영상에서 신유빈은 채 대표를 처음 만났던 당시에 대해 “(채 대표) 머리가 당시 단발이었는데 너무 예뻤다”고 돌이켰다. 앞으로 계획에 대해선 “매일 운동하고, 앞에 있는 시합 준비하면서 열심히 경기를 준비하겠다”고 다짐했다.사진 유튜브'TalithaKoum탈리다쿰' 캡처채 대표는 “2024 파리 올림픽이 끝나고 탁구에 관심을 많이 가져주는데 탁구를 일상처럼 즐겨줬으면 좋겠다. 그래야 2028년 (로스앤젤레스) 올림픽에서 유빈이가 이런 걸 잘한다고 느낄 수 있다”고 말했다. 그는 대한탁구협회 부회장을 지낸 이력이 있다.신유빈(왼쪽)과 채문선 대표. 사진 유튜브'TalithaKoum탈리다쿰' 캡처1986년생인 채 대표는 장영신 애경그룹 회장의 손녀이자 채형석 애경그룹 총괄부회장의 장녀다. 예원학교를 졸업하고 미국 맨해튼 음대에서 성악을 전공했다. 이후 매일유업 외식사업부와 애경산업 마케팅 직무 등을 거쳤다.지난해 11월 신유빈(오른쪽)이 채문선 대표로부터 브랜드 앰배서더 위촉장을 받은 뒤 포즈를 취하고 있다. 신유빈은 해당 브랜드 앰배서더로 오는 10월까지 활동한다. 연합뉴스채 대표는 세아그룹 오너 3세인 이태성 세아홀딩스 대표(당시 상무)와 2013년 결혼해 세 자녀를 두고 있다. 결혼·출산 뒤 할머니와 아버지가 일군 회사로 돌아가는 대신 2019년 탈리다쿰 창업이라는 도전을 택했다. 탁구협회 부회장이던 지난 4월엔 부산 벡스코에서 열린 부산세계탁구선수권 대회에서 남편과 함께 한국 선수들을 응원하는 모습이 포착되기도 했다.채 대표는 유튜브에서 “CEO(최고경영자)로서, 엄마로서 열심히 살고 있다. 저처럼 열심히 사는 많은 분이 공감하는 유튜브를 만들겠다”고 말했다."
2024-03-05,"세아홀딩스, 국내 첫 ‘윤리적인 기업’ 선정","세아홀딩스가 5일 국내 기업 가운데 처음으로 글로벌 기업윤리 평가기관 에티스피어가 주관하는 ‘2024 세계에서 가장 윤리적인 기업’으로 선정됐다고 밝혔다. 세아홀딩스와 함께 인텔·노키아·소니·마스타카드·로레알·화이자 등 전 세계 136개 기업이 올해 윤리적인 기업 명단에 들어갔다.에티스피어는 2006년부터 세계에서 가장 윤리적인 기업을 매년 선정하고 있다. △윤리문화 △환경, 사회 및 거버넌스(ESG) 관행 △윤리 및 컴플라이언스 프로그램 △다양성, 평등 및 포용 △강력한 가치사슬에 대해 평가를 한다. 에티스피어는 수집된 데이터는 전문가들이 질적 분석을 한다고 밝혔다. 올해 윤리적인 기업 명단에 오른 기업은 2019년부터 2024년 1월까지 글로벌 기업들의 비교 지수를 12.3% 포인트 초과 달성한 기업들이라고 설명했다.세아홀딩스는 컴플라이언스 운영위원회 협의체 구축과 준법·윤리 경영을 위한 다양한 프로그램을 도입한 게 이같은 평가를 받은 배경이라고 설명했다. 이태성 세아홀딩스 사장은 “성숙한 윤리 문화를 만들어가는 경영진과 임직원들이 함께 노력해 온 결과”라며, “강도 높은 준법·윤리경영을 실천하며 이해 관계자들에게 선한 영향력을 미칠 수 있는 회사로 성장하겠다”고 밝혔다."
2023-09-25,"세아그룹, 총수 일가 3세 이태성에 이익 몰아주기…과징금·고발 조처","공정위, 세아홀딩스 부당내부거래 제재…총수일가 개인회사에 손실 보며 제품 공급이태성 세아홀딩스 사장. 세아 제공세아그룹이 총수 일가의 지배력 강화를 위해 손실을 보면서까지 계열사에 낮은 가격으로 제품을 공급했다가 적발돼 공정거래위원회로부터 과징금 32억7600만원을 부과받았다. 부당지원의 주체인 세아창원특수강 법인은 고발됐지만, 구체적인 증거를 확보하지 못해 총수 일가인 이태성 세아홀딩스 사장은 고발하지 못했다.유성욱 공정위 기업집단감시국장은 25일 브리핑에서 “세아그룹의 세아창원특수강은 다른 경쟁사 대비 상당히 낮은 가격으로 스테인리스 강관을 판매하는 방법으로 계열사인 시티시(CTC)를 부당 지원해 시정명령과 과징금 32억7600만원을 부과받았다”고 밝혔다. 시티시는 두꺼운 스테인리스 강관(파이프)을 구매한 뒤 길게 잡아당겨 외경과 두께를 줄여 판매하는 회사다. 세아그룹 3세인 이태성 사장은 세아홀딩스 지배력 강화를 위해 2014년 설립한 개인회사 에이치피피(HPP,투자·컨설팅업)를 통해 2015년 11월 시티시를 인수했다.이 사장은 인수를 마친 뒤 세아창원특수강으로부터 부당 지원을 받기 시작했다. 여기에는 ‘물량할인’(QD,QuantityDiscount) 제도가 활용됐다. 구매자가 특정 물량 이상 구매할 때 큰 폭의 할인을 제공하는 제도다. 세아창원특수강의 할인은 시티시의 주력 제품인 반도체·코일튜브용 강관에만 적용됐고, 시티시만이 달성 가능한 물량 수준인 분기별 300t 이상을 구매할 때만 제공됐다.공정거래위원회 제공세아창원특수강은 2016년 1분기부터 2019년 2분기까지 강관 총 4422t을 정상 가격 대비 600원 낮은 ㎏당 1천원 할인을 적용해 시티시에 26억5천만원의 과다한 이익을 제공했다. 이는 가격 경쟁력으로 이어져 시티시의 매출도 급상승했다.시티시 매출은 92억원(2015년)에서 2016년 153억원, 2017년 263억원으로 두 배 이상 불어났고, 2018년부터 매출액 기준 업계 1위 회사가 됐다. 세아그룹 쪽 내부 문건에 ‘국내 반도체 튜브의 경우, 미터(m)당 단가 1원 차이에도 예민하게 반응’한다고 적혀있어, 이례적인 할인폭이 시티시의 가격 경쟁력을 높여 매출 증대에 큰 영향을 줬음을 알 수 있다.반면 세아창원특수강은 손해를 봤다. 세아창원특수강은 시티시가 계열회사에 편입하기 전에는 20∼30%의 영업이익률을 유지했지만, 물량할인을 시행 뒤에는 영업이익률이 -5%로 급감했다. 이태성 사장은 시티시를 통해 확보한 현금을 활용해 세아홀딩스 지분 9.38%를 에이치피피를 통해 매입해 지배력을 강화했다. 기업집단 계열사들이 총수 일가 개인회사를 지원하는 방식으로 총수 일가에 부를 이전시키고 지배력을 강화한 것이다.공정위는 세아홀딩스(21억2200만원)와 에이치피피(11억5400만원)에는 시정명령과 과징금을, 이태성 사장에게는 시정명령을 부과했다. 유성욱 국장은 “(이태성 사장이) 지시 관여한 사실이 객관적 자료는 확인되지 않아 법인까지만 고발했다”고 말했다.한편, 세아홀딩스는 이번 공정위 결정에 대해 “공정위 의결서를 받는 대로 세부 내용을 면밀히 검토해 기존 소명 내용의 부족한 부분을 검토하고 회사의 입장을 성실히 소명하겠다”고 말했다."
2024-03-07,기업 사외이사 겸직하는 비상임위원…“문제 없다”는 공정위,"시민단체 “이해충돌” 지적에 공정위 “직업선택 자유도 존중해야”공정거래위원회. 한겨레 자료 사진국내 화장품 기업인 아모레퍼시픽이 조성진 공정거래위원회 비상임위원을 사외이사로 재선임하기로 하면서 조 위원을 둘러싼 이해충돌 논란이 일고 있다. 기업의 불공정거래행위를 조사하고 제재하는 공정위 위원이 규율 대상인 기업체 사외이사로 활동을 이어가면, 공정위 의결의 공정성과 신뢰성을 훼손할 수 있다는 점에서다. 공정위는 법적으로 문제가 없다는 입장이다.경제개혁연대는 7일 논평을 내어 “아모레퍼시픽은 오는 15일 정기주주총회 안건으로 조 위원을 사외이사 후보로 재선임하는 안건을 상정할 예정”이라며 “시장 감독업무를 수행하는 공정위 비상임위원의 기업체 사외이사 선임은 부적절하다”고 밝혔다.앞서 조 위원은 지난해 3월 임기 3년의 공정위 비상임위원으로 위촉된 바 있다. 서울대 경제학부 교수인 그는 아모레퍼시픽 사외이사로 활동 중에 공정위 비상임위원으로 위촉됐고, 곧바로 세아홀딩스 신규 사외이사로도 선임됐다.논란이 이는 대목은 조 위원이 공정위 비상임위원으로 규제 대상 기업 사외이사로 활동하고 있지만, 공정거래법에는 이런 활동을 제약하는 별도의 규정이 없다는 점이다. 공무원 신분이 아닌 비상임위원의 경우, 금지되는 활동은 정당가입과 정치운동뿐이다. 이 때문에 비상임위원으로 위촉된 뒤에도 기업체 사외이사로 선임되는 일이 이어지고 있다.공정위는 문제 없다는 태도다. 공정위 핵심 관계자는 “위원들은 본인 관련 법인이나 사건이 있으면 제척·기피·회피신청을 한다. (비상임위원이 사외이사로 활동하더라도) 관련 업무처리에 영향을 미치지 않는다”고 밝혔다. 공정위의 또 다른 관계자도 “오랜 시간 걸려서 열심히 기업을 조사해놓고 이해충돌 문제가 빚어지면 무용지물이 되기에 위원들이 자신과 조금이라도 관련이 있으면 제척이나 회피신청을 한다. 직업선택의 자유도 있는 만큼 (비상임위원들에게) 사외이사 활동 등을 못하게 하기도 어렵다”고 했다.이는 공정위와 마찬가지로 합의제 행정기관인 금융위원회와 증권선물위원회의 관행과는 거리가 멀다. 경제개혁연대 쪽은 “금융위원회법에도 비상임위원에게는 겸직 금지 규정이 적용되지 않지만, 현재 금융위와 증선위 비상임위원 가운데 기업체 사외이사를 겸직하는 경우는 없다”며 “감독 기능을 수행하는 위원회 경우, 비상임위원에게도 상임위원 수준의 겸직 금지의무를 부과하는 방안이 필요하다”고 말했다.한편 한겨레는 조 위원의 입장을 듣기 위해 연락을 취했지만, 조 위원은 취재에 응하지 않았다."
