date,title,content
2023-11-08,"신원식 국방, 국회 예결위 회의 중 ‘주식 1000주 매도’ 카톡 확인 논란","국방부 “회의前 메시지 받고 답장이후 다른 문자 함께 재확인한 것”신원식 국방부 장관이 7일 오후 국회 예산결산특위 도중 주식 매도 관련 메시지를 확인하고 있다. /뉴스핌7일 국회 예산결산특별위원회에 참석한 신원식 국방부 장관이 회의장에서 주식 거래 문자를 확인한 장면이 언론에 포착됐다. 국방부는 “거래는 예결위 시작 전에 이뤄졌고, 다른 문자 메시지를 보는 과정에서 해당 문자를 재확인한 것”이라고 했다.신 장관은 이날 오후 3시 37분쯤 국회 예결위 전체회의에서 주식 매도 관련 메시지를 봤고, 이 장면이 사진 기자 카메라에 찍혔다. 신 장관은 ‘솔루스만 매도 1000주 24250원 사모님 767주 24250원’이라는 메시지에 ‘네. 장 마감 후 어제처럼 총액 보내주세요’라고 답장했다.신 장관은 장관 후보자 시절이던 지난달 국회에 자신과 배우자, 자녀 재산으로 총 19억3000만원을 신고했다. 이중 솔루스첨단소재, 테슬라, 애플 등의 주식을 보유했다고 신고했다. 신 장관이 받은 메시지 내용인 ‘솔루스만 매도’는 솔루스첨단소재 주식을 팔았다는 뜻이다. 솔루스첨단소재는 배터리·전자소재 등을 생산하는 업체다.신 장관은 국회의원이었던 2021년 솔루스첨단소재 주식을 1000주 보유했다고 신고했다가, 작년엔 1000주를 전부 팔았다고 신고했다. 신 장관 배우자는 2021년과 작년 재산 신고 땐 솔루스첨단소재 주식을 갖고 있지 않았다. 이후 올해 3월 재산 신고에서 신 장관 자신은 솔루스첨단소재 주식을 3933주, 배우자는 1767주를 새로 산 것으로 돼 있다.7일 열린 국회 예산결산특별위원회 전체회의에 출석한 신원식 국방부 장관./뉴스1국방부는 이에 대해 “모 매체가 사진으로 보도한 국방부 장관 휴대폰 화면은 모 증권사의 위탁 대리자가 주식 거래 결과를 문자로 보내온 것”이라면서 “해당 문자는 오늘(7일) 아침 09시 35분에 수신하고 09시 45분에 답신한 것으로, 이는 예결위 전체회의가 시작되기 전이었다”고 해명했다. 예결위는 이날 오전 10시 시작됐다. 그러면서 “예결위 중 직접 주식 거래를 한 것이 아니며, 업무 관련 내용을 포함하여 많은 문자 메시지를 확인하는 과정에서 해당 문자를 재확인한 것”이라고 했다."
2024-03-29,[경제계 인사] 아우디코리아 사장 스티브 클로티 외,"아우디코리아 사장 스티브 클로티폭스바겐그룹코리아는 아우디코리아 신임 사장에 스티브 클로티를 선임했다고 28일 밝혔다.진흥기업 대표이사 김태균효성의 건설 계열사 진흥기업은 신임 대표이사에 김태균 부사장을 선임했다고 28일 밝혔다.태영건설 각자대표이사 최금락·최진국태영건설은 28일 정기 주총을 열고 최금락TY홀딩스 부회장과 최진국 태영건설 사장을 각자 대표이사로 선임했다.솔루스첨단소재 대표이사 곽근만솔루스첨단소재는 곽근만 유럽 통합 법인장을 신임 대표이사로 선임했다고 28일 밝혔다. 진대제 대표이사와 각자대표를 맡는다.코스맥스 대표 최경코스맥스는 28일 이사회를 열고 심상배 코스맥스 대표(부회장)를 코스맥스 차이나 대표로, 최경 코스맥스 차이나 대표(부회장)를 코스맥스의 새 대표로 선임했다."
2023-09-26,상저하고? 상장사들 3분기 실적 전망 또 낮아져,"6월 30%, 이번엔 3% 줄어서울 서초구 삼성전자 본사.  /뉴스1다음 달 국내 기업들의 3분기(7~9월) 실적 발표를 앞두고 유가증권시장(코스피) 상장사들의 실적 전망이 계속 하향 조정되고 있다.25일 금융 정보 업체 에프앤가이드에 따르면, 지난 21일 현재 증권사 3곳 이상이 실적을 전망한 코스피 상장사 174곳의 3분기 영업이익 전망 합계는 42조2797억원이었다. 지난 6월 말 나온 전망(43조5862억원)과 비교해 3% 가까이 준 것이다. 6월 전망도 연초와 비교했을 때 30% 낮아졌는데 그 흐름이 이어지고 있다.코스피 174사 중 증권사 영업이익 전망 평균(컨센서스)이 6월 말보다 내려간 기업은 103사였다. 흑자 전망이 감소한 경우는 96사였다. 현대미포조선(-98%)의 감소 폭이 가장 컸고, 롯데케미칼(-76%)·한화오션(-68%)·콘텐트리중앙(-66%)·엔씨소프트(-61%) 등 순이었다. 적자 폭이 확대되는 기업은 5사(LG디스플레이·넷마블·솔루스첨단소재·한샘·SK바이오팜), 적자 전환은 2사(SKC·대한유화)였다.반도체 업황 회복이 지연되면서 삼성전자의 실적 전망 평균도 악화하고 있다. 연초 증권사들은 삼성전자가 3분기에 7조8000억원대 영업이익을 거둘 것으로 전망했으나, 지난 6월 말엔 3조6000억원대로 낮아졌고, 지난 21일 2조5324억원까지 내려왔다. 이달 들어 키움(1조3940억원)·IBK투자(1조4730억원)·유진투자(1조6000억원)·KB(1조8000억원)·한화투자(1조9500억원) 등 1조원대 영업이익을 전망하는 경우도 나왔다.그러나 수출이 반등하기 시작했고,IT제품 수요가 연말에 회복될 것으로 기대되며 반도체 업황도 4분기부터 개선될 것으로 보는 전망 역시 여전히 강하다."
2023-05-25,"中, 저가 배터리로 EU 점유율 2년새 2배로… 1위 한국 맹추격","[김기훈의 경제프리즘] 한·중 배터리 전쟁한국과 중국의 배터리 제조업체들이EU(유럽연합)에서 본격적인 시장 쟁탈전을 벌이고 있다. 사진은 우르줄라 폰 데어 라이엔EU집행위원장이 지난 5월 15일 벨기에 브뤼셀의EU본부에서 기자회견을 갖고 있는 모습./AP연합뉴스한국과 중국의 기업들이 중국에 이어 세계 2위 배터리 시장인EU(유럽연합 27개국)에서 전쟁을 시작했다. 한국이 선점하고 있는 상황에서 중국 기업들이 정부의 지원을 받으며 맹추격해 빠르게 시장을 잠식하고 있기 때문이다. 시장점유율 1위인 한국과 2위인 중국이 정면 대결하는 양상이다.특히 중국은 미국의 규제로 미국 수출길이 막히자, 대안으로EU시장 개척에 필사적이다.EU도 미국과 달리 늘어나는 배터리 수요를 충족하기 위해 중국 기업의 투자유치에 적극적이어서 한국 기업들의 수성 작업이 갈수록 어려워질 전망이다.한국을 대표하는 배터리제조업체인LG에너지솔루션. 유럽에서 중국의 공격이 거세지면서 수성에 온 힘을 기울이고 있다. 사진은 서울 영등포구 여의도 파크원의LG에너지솔루션 본사 로비./뉴스1세계 최대 배터리 생산업체인 중국의CATL.수주도 받기 전에 유럽에 먼저 공장을 짓는 대담한 시도를 하고 있다. 사진은 지난 4월 18일 중국 상하이 모터쇼 내CATL전시장./로이터 연합뉴스폭증하는 유럽 시장EU는 세계 2위의 전기차 판매국이자 배터리 수요 대국이다. 특히 전기차 배터리를 탄소중립 시대의 전략 산업으로 적극 육성하고 있어서 배터리 수요가 지속적으로 증가하고 있다.컨설팅회사 매킨지에 따르면 전세계 리튬이온 배터리 수요는 2022년 700GWh(기가와트시)에서 매년 33%씩 증가해 2030년에는 4.7TWh(테라와트시)로 증가할 전망이다. 이 가운데EU는 2030년 전세계 수요의 23%를 차지해 중국(43%)에 이어 2위를 기록할 것으로 예상된다.유럽 완성차업체들은 전기차 생산에 박차를 가하고 있지만, 전기차용 배터리 자급률은 매우 낮다. 사진은 지난 2021년 6월 8일 독일 드레스덴에서 한 운전자가 폭스바겐의 전기차ID.3를 충전하고 있는 모습./로이터 연합뉴스이러한 폭발적인 수요에 맞추기 위해 독일·폴란드·헝가리·스페인 등은 2030년까지 배터리 셀 제조공장 62곳, 소재 부품 공장 22 곳을 건설할 예정이다. 이들 국가들은 해외 배터리 기업 유치를 위해 대규모 보조금 및 세제 혜택을 제공하고 있어서 투자 여건도 좋은 편이다.시장 선점한 한국한국 기업은 일찍 유럽에 진출해 에너지 밀도와 주행거리 면에서 우수한 삼원계 양극재 분야에서 시장을 장악했다. 2017년LG에너지솔루션이 폴란드 브로쵸와프에서 5GWh공장을 가동한 것을 시작으로,SK온(헝가리), 삼성SDI(헝가리)가EU현지에서 공장을 확장중이다. 또SKIET,솔루스첨단소재, 포스코홀딩스, 성일하이텍, 에코프로비엠 등 10여개 소재 부품기업들이 공장을 가동 중이거나 신설할 계획이다.한국 배터리 기업들은 독일, 헝가리, 폴란드 등에 현지 공장을 갖고 있다. 사진은 한국SK이노베이션의 자회사인SK온의 헝가리 코마롬 공장./SK이노베이션그래픽=조선디자인랩 이민경2022년 기준 한국의EU전기차 배터리 시장 점유율은 63.5%. 한국 기업들이 유럽 현지에 공장을 세운 덕에 한국에서 유럽에 수출되는 배터리 소재인 양극재의 수출도 큰 폭으로 증가하고 있다. 예컨대 지난 2022년EU에 수출한 주요 수출품목 중 양극재와 배터리가 각각 1위와 4위를 차지했다.중국의 맹공중국은 미국의 규제로 미국 시장 진입이 어려워지자 막대한 자금력과 정부 지원을 배경으로EU시장 공략에 나서고 있다. 중국 완샹그룹이 2017년에 체코의 오스트라바에서 공장 가동에 들어간 것을 비롯해, 저장난양, 궈타이화롱 등이 독일과 폴란드에서 가동중이다.또 세계 최대 배터리 제조업체인CATL은 현재 독일에 14GWh공장을 세워 독일 자동차 회사인 메르세데스-벤츠와BMW에 납품하고 있으며, 오는 2028년까지 독일과 헝가리의 생산능력을 200GWh규모로 확대할 예정이다. 고션하이테크,SVOLT,엔비전AESC도 독일, 프랑스, 스페인에 2030년까지 모두 146GWh규모의 5개 공장을 짓는다.중국 배터리업체CATL의 독일 아른슈타트공장./폴-필립 브라운, 로이터 연합뉴스그래픽=조선디자인랩 이민경한국의 삼원계 배터리와 달리 중국의 주력품인LFP(리튬인산철) 배터리는 품질은 떨어지지만 가격이 20~30% 정도 저렴하다. 또 중국의 배터리 제조 장비 평균 가격도 한국의 약 80% 수준이다. 중국업체들은 이 가격경쟁력을 무기로 유럽 전기자동차 뿐 아니라 전기자전거 같은 소형 저가 이동기구 시장도 공략하고 있다.무역협회 국제무역통상연구원 김희영 연구위원은 “배터리 공장은 먼저 수주를 받은 뒤에 대규모 자본을 투입해야 하는 시설”이라며 “CATL헝가리 공장의 경우 완성차 업체의 수주도 받지 않은 상태에서 공장부터 짓는 대담한 시도를 하고 있다”고 말했다.좁혀지는 한·중 격차시장조사업체SNE리서치에 따르면 한국의EU배터리 시장 점유율은 2020년 68.2%에서 2022년 63.5%로 하락했다. 같은 기간 중국의 점유율은 16.8%에서 34.0%로 2년만에 배로 늘어났다.중국의EU시장 점유율이 빠르게 늘어나고 있는 이유는 한국 기업은 미국과EU에 동시에 투자를 진행하고 있는 반면, 중국 기업은 미국 진출이 어려워지면서EU에 집중 투자하고 있기 때문이다. 2021년 중국 배터리 업체의 유럽 공장시설 투자액은 33억 유로(약 4조7000억원)로, 중국 전체 해외투자의 3분의 1에 달하는 것으로 알려졌다.전문가들은 중국이EU진출에 사활을 걸고 있는 만큼 향후 한국 기업들의 입지가 점점 좁아질 가능성이 크다고 우려하고 있다. 세계 시장의 50% 이상을 장악하고 있는 중국에 맞서, 매년 33%씩 성장하는 한국 배터리 산업(골드만삭스 추정)의 역동성을 살리기 위해서는EU시장 점유율 확보가 절실하다고 보고 있다.최선집 월드클래스기업협회 고문은 “중국 정부가 자국 기업에 각종 세금과 장려금을 지원하면서 해외 진출을 독려하고 있다”며 한국 정부도 이에 상응하는 대응책을 마련해야 한다”고 말했다.“향후 1~2년이 세계 배터리 판도 좌우...대규모 자금 지원해야”장상식 국제무역통상연구원 실장 인터뷰장상식 한국무역협회 국제무역통상연구원 동향분석실장장상식 국제무역통상연구원 동향분석실장은 “전기차 시장이 급격히 팽창하면서 1~2년 내에 완성차 기업의 배터리 제휴 기업 선정이 본격화될 예정”이라며 “그 결과에 따라 5~6년 후 세계 배터리 산업의 판도가 좌우될 것”이라고 예상했다. 그는 또 “배터리 제조업은 완성차 업체의 수주를 받은 뒤 그 수요에 맞추기 위해 현지에 공장을 세워 대규모 설비투자를 해야 하는 산업”이라며 “유럽 완성차 업체의 수요에 대응하기 위해서는 현지시장 진출이 필수적”이라고 말했다.장 실장은 “납품을 위해서는 대규모 투자가 선행되어야 하지만 우리기업들은 투자자금 부족으로 인해 유럽의 배터리 수요 증가에 신속하게 대응하기 어려운 상황”이라고 진단했다. 연간 20GWh(기가와트시) 규모의 생산설비 구축시 약 2조~2조5000억원의 설비투자가 필요하다고 설명했다. 따라서 한국 기업들이EU시장에 적극 진출할 수 있도록 정부가 수출입은행 신용제공 한도와 투자세액 공제를 확대하고, 배터리 제조에 사용되는 핵심광물의 안정적 확보와 비축에도 나서야 한다고 강조했다.한-중 배터리 전쟁에서 이기려면 중국 정부의 자국 기업 지원에 상응해 한국 정부도 적극적인 자금과 세제 지원에 나서야 한다고 전문가들은 이야기한다. 지난 3월 15일 서울 강남구 코엑스에서 열린 배터리 산업 전시회 '인터배터리 2023'을 찾은 관람객들이 전기차 배터리를 살펴보고 있다./뉴스1장 실장은 또 한국 기업이EU에 진출할 경우 회원국별로 투자 여건과 우대 정책이 달라 이를 전략적으로 활용할 필요가 있다며 독일·헝가리·폴란드·스웨덴 등 4개국을 추천했다.독일은 폭스바겐, 메르체데스-벤츠,BMW등 완성차 업체 접근이 용이하며, 특히EU내에서 완성차 시장 점유율이 55%에 달한다. 헝가리는 법인세율이 9%로EU내에서 가장 낮다.EU의 평균 법인세율은 21.5%이다.유럽 진출을 모색하는 한국 배터리 기업들은 전기료가 상대적으로 저렴한 스웨덴을 후보지로 고려해 볼만 하다고 전문가들은 추천한다. 사진은 스웨덴의 수도 스톡홀름 시내./요나탄 스벤슨 글라트(위키피디아, 2016년 9월 21일)폴란드는 25세 미만 인구가 전체 인구의 약 25%를 차지해 젊고 숙련된 인력을 보유하고 있다. 스웨덴은 국내에서 생산되는 에너지 중 신재생에너지의 비중이 97%에 달해EU내에서 전기료가 가장 낮고, 환경 규제 측면에서도 유리하다고 장 실장은 추천했다.장 실장은 “EU차원에서 지원하고 있는 프로젝트에EU역내 기업과 동반 참여하거나 합작 기업을 설립하는 등의 진출 방식도 고려해 볼 필요가 있다”고 덧붙였다."
2022-10-12,세계 4위 동박 업체 일진머티리얼즈… 롯데케미칼 품으로,"지분 53% 2조7000억에 인수이차전지 핵심소재 투자 늘려롯데케미칼이 전기차 배터리 핵심 소재인 동박(銅箔) 제조 업체 일진머티리얼즈를 인수한다.롯데케미칼은 11일 롯데 배터리 머티리얼즈USA(롯데케미칼의 미국 사업 지주사)가 일진머티리얼즈 지분 53.3%를 2조7000억원에 인수하는 주식 매매 계약을 체결했다고 밝혔다. 국내와 해외 공정 거래 당국의 기업 결합 신고를 마치면 인수 절차가 최종 마무리된다.일진머티리얼즈는 세계 4위 동박 업체로, 한국과 말레이시아 공장에서 매년 6만t의 동박을 생산하고 있다. 2027년까지 말레이시아·스페인·미국 등에 공장을 지어 생산능력을 연 23만t까지 늘릴 계획이다. 삼성SDI등 주요 배터리 제조 업체에 동박을 납품하고 있고, 올 상반기 매출 3885억원, 영업이익 468억원을 거뒀다.동박은 배터리의 음극재를 코팅하는 소재로, 동박 품질이 떨어질 경우 배터리 화재가 발생할 수 있다. 최근에는 배터리 용량을 키우기 위해 동박을 더 얇게 만드는 경쟁이 불붙고 있다. 일진머티리얼즈는 현재 주로 사용되는 8µm(마이크로미터·100만분의 1m) 두께부터 반도체 정밀 부품에 들어가는 1µm 두께까지 다양한 두께의 동박을 생산할 수 있는 기술력을 갖추고 있다.롯데그룹 김교현 화학군 총괄대표는 “일진머티리얼즈는 세계 최초로 초고강도 동박 개발에 성공할 만큼 우수한 기술력을 가지고 있다”며 “롯데그룹 화학군은 선택과 집중을 통해 전지 소재 사업 역량을 높이는 데 최선을 다할 것”이라고 했다.롯데그룹 화학군의 롯데케미칼·롯데정밀화학·롯데알미늄은 최근 다양한 전지 소재 사업에 투자를 이어오고 있다. 롯데케미칼은 분리막 생산과 배터리 전해액 유기용매 공장을 건설하고 있고 롯데정밀화학은 이차전지 필수소재인 양극박 공장을 지난해 헝가리에 준공했다. 두 회사는 지난 7월 합작사를 꾸려 미국 현지에도 양극박 공장을 건설하기로 했다. 롯데정밀화학 역시 국내 3위 동박 생산 업체 솔루스첨단소재에 2900억원을 투자했다."
2022-06-23,유럽 전기차 배터리 잡겠다… 신동빈의 승부수,"유럽 유일의 ‘양극박’ 전용 공장헝가리에 1100억원 추가 투자아일랜드선 2030부산박람회 홍보지난 21일 아일랜드 더블린에서 열린 소비재포럼에 참석한 신동빈(오른쪽) 회장이 2030부산세계박람회 유치 홍보를 하고 있다. /롯데그룹롯데그룹은 “유럽 출장 중인 신동빈 회장이 헝가리 터터바녀 산업단지 롯데 클러스터 내에 있는 롯데알미늄 공장에 1100억원을 추가 투자하기로 결정했다”고 22일 밝혔다. 1200억원을 투자해 지난해 8월 공장을 준공한 지 1년도 안 돼 증설 계획을 밝힌 것이다. 롯데알미늄 헝가리 공장은 전기차 배터리로 사용되는 2차전지용 양극박을 생산하는 곳으로, 이번 투자가 이뤄지면 생산량이 2배로 늘어나게 된다. 롯데는 전기차 배터리의 핵심 부품으로 꼽히는 알루미늄 양극박 생산을 늘려 유럽 전기차 시장을 선점한다는 계획이다.롯데그룹에 따르면, 신 회장은 지난 18일 롯데알미늄 헝가리 공장을 방문해 다음 달부터 본격적으로 양산하는 양극박 시제품을 직접 확인했다. 롯데알미늄 헝가리 공장은 유럽 유일의 양극박 전용 생산 공장으로, 연간 1만8000t 규모의 양극박을 생산할 수 있다. 신 회장의 롯데알미늄 헝가리 공장 방문은 이번이 처음이다. 신 회장은 초기 투자 금액(1200억원)과 이번 투자 금액(1100억원)을 합한 수준을 넘어서는 3단계 투자도 검토하고 있는 것으로 알려졌다.롯데 클러스터는 롯데 계열사들의 유럽 시장 진출 교두보 역할을 하는 곳으로, 롯데케미칼·롯데알미늄 공장이 들어서 있다. 롯데정밀화학과 롯데알미늄이 3000억원을 투자한 솔루스 첨단 소재의 음극박(2차전지 소재) 생산 공장도 가까이 있다. 롯데건설은 이곳에서 국내 물류 전문업체와 함께 헝가리 최대 규모의 물류센터 건립도 추진하고 있다.한편 신 회장은 앞서 지난 21일 아일랜드 더블린에서 열린 소비재 포럼 글로벌 서밋에 참석해 펩시코, P&G,월마트, 레베 등 글로벌 기업의 최고경영자들과 만나 2030부산세계박람회 홍보 활동도 펼쳤다. 롯데는 다음 달로 예정된 올해 하반기 사장단 회의를 부산에서 개최한다. 롯데 주요 계열사 대표 및 지주사 임원 100여 명이 한자리에 모이는 사장단 회의를 서울에 있는 계열사나 인재개발원이 아닌 곳에서 여는 것은 이번이 처음이다. 롯데는 “하반기 사장단 회의에서 2030부산세계박람회 유치를 위한 계열사들의 지원 방안을 고민할 것”이라고 말했다."
2022-04-01,“동 트기 전이 가장 어둡다” 여기 꾹 참고 투자해 보라,"[방현철 박사의 머니머니] 급성장 앞뒀다는 수소 경제 밸류 체인에 주목할 이유1일 오후 5시 조선일보의 경제 유튜브 채널 ‘조선일보 머니’와 조선닷컴을 통해 공개된 ‘방현철 박사의 머니머니’에선 육동휘KB자산운용ETF컨설팅실장과 함께 ‘수소 경제 전망과 투자법’이라는 주제로 얘기를 나눠봤습니다. 육 실장은 2011년부터 10년 넘게ETF(상장지수펀드) 업계에서 활동을 하고 있습니다.KB운용은 지난 2월 전 세계 수소 경제 기업에 투자하는ETF(상장지수펀드)인 ‘KBSTRAR글로벌 수소 경제IndexxETF’등을 출시하는 등 수소 경제 관련 투자 상품들을 내놓고 있습니다.육 실장은 “2020년 수소 생산 시장 규모는 약 1억t 수준으로 화석연료 에너지 시장의 2% 수준이지만 2050년에는 10%까지 확대될 것으로 전망된다”며 향후 크게 성장할 수소 시장을 선점하기 위한 투자를 해야 한다고 했습니다. 또 우리나라의 경우 수소차가 2015~2020년 연 70% 가까운 성장을 하고 있는 것도 주목해야 한다고 했습니다. 게다가 국내에서 수소차를 생산하는 현대차 그룹 뿐 아니라SK,현대중공업 등 대기업들이 이 시장에 들어오고 있는 것도 눈 여겨 봐야 한다고 했습니다. 최근 러시아의 우크라이나 침공 이후 러시아산 석유, 천연가스 등을 꺼리게 된 미국과 유럽은 수소를 장기적인 에너지 대안의 하나로 검토하고 있기도 합니다.육 실장은 생산, 운송, 활용 등 수소 경제 밸류 체인에서 주목할 만한 국내 기업들도 소개했습니다. 예컨대 수소 연료 전지 분야에서 앞서고 있는 두산퓨얼셀, 수소 저장 탱크 등을 만드는 일진하이솔루스, 수소 저장 용기에 쓰이는 소재를 개발하고 있는 효성첨단소재 등의 기술력은 관심을 가져볼 만 하다는 것입니다. 다만 아직 한국 기업들은 수소 생산 분야에서는 뒤쳐져 있다고 했습니다. 태양광, 풍력 등 친환경 에너지로 물을 전기 분해해서 생산하는 ‘그린 수소’의 경우 선진국들과 기술 격차가 5~7년 정도 난다는 것입니다.육 실장은 수소 경제에 투자할 때는 개별 기업을 골라 투자할 경우에는 변동성이 클 수 있다고 했습니다. 그래서 변동성을 줄이고 수소 경제를 전반적으로 아우르는 투자를 하기 위해서ETF로 투자하는 것을 권했습니다.ETF는 여러 기업 주식을 묶음으로 투자해서 증시에 상장해 놓은 투자 상품이기 때문에 초보 투자자들도 쉽게 접근할 수 있는 특징이 있습니다.육 실장은 현재 수소 경제를 한 마디로 “동 트기 전이 가장 어둡고 춥다”라고 비유했습니다. 해가 뜨면 급하게 밝아지듯이 급성장을 기대할 수 있는 시장이라는 것입니다. 육 실장은 “예측하기는 어렵지만, 올해나 내년쯤 수소 경제가 만개할 수 있다”고 했습니다. 육 실장은 “좋은 기술을 갖고 있는 산업, 미래에 발전 지향적인 산업에 대해서는 조금은 꾹 참고 장기적인 안목으로 접근할 필요가 있다”고 했습니다.‘방현철 박사의 머니머니’는 화·수·금요일 오후 5시 시장분석, 자산운용, 재테크 전문가, 증권가 고수들의 목소리를 듣는 시간입니다. 영상은 경제 유튜브 채널 ‘조선일보 머니’와 조선닷컴을 통해서 공개됩니다."
