date,title,content
2022-02-09,"3년만에 흑자 낸 LG엔솔, 웃지 못하는 까닭은","니켈·코발트 등 원자재값 폭등에3~4분기 매출은 4조원대에 그쳐실적 개선에도 성장세 주춤국내 1위 배터리업체인LG에너지솔루션이 지난해 글로벌 전기차 수요가 빠르게 증가하면서 3년 만에 흑자를 기록했다. 그러나 원자재 가격 상승, 차량용 반도체 공급 부족으로 인한 자동차 생산 차질로 지난 4분기 실적이 주춤하면서 성장에 제동이 걸린 모습이다. 배터리 업계에선 이 같은 흐름이 올해 상반기까지 이어질 수 있다는 우려의 목소리가 나오고 있다.한편 지난달 27일 상장한LG에너지솔루션이 투자 자금을 빨아들이는 증시 블랙홀 역할을 하면서 다른 배터리 관련주가 일제히 하락세를 보이고 있다.LG엔솔 배터리 사업 흑자 전환 성공LG에너지솔루션은 지난해 연간 매출 17조8519억원, 영업이익 7685억원을 기록했다고 8일 밝혔다. 매출은 전년 대비 42% 증가했고 영업이익은 2018년 이후 3년 만에 흑자를 기록했다.LG에너지솔루션 관계자는 “차량용 반도체 공급 부족, 주요 원자재 가격 상승으로 인해 매출 목표였던 18조9000억원에는 다소 못 미쳤지만 글로벌 전기차 수요가 증가하고 생산성 개선 노력을 바탕으로 전년보다 매출이 크게 늘었다”고 말했다.이처럼LG에너지솔루션이 연간 실적으로는 크게 개선된 수치를 발표했지만 분기별로 보면 성장세가 주춤하는 분위기다. 이 회사는 지난해 2분기 매출 5조1310억원, 영업이익 7242억원을 달성했다. 하지만 3~4분기에는 매출이 4조원대에 그쳤다. 3분기에는 3727억원의 영업손실을 냈고, 4분기 영업이익은 757억원에 그쳤다. 전기차 배터리 화재에 따른GM리콜 충당금을 빼더라도 지난해 3분기 영업이익은 2510억원으로 2분기 대비 크게 줄었다.이 회사의 분기별 영업이익이 감소하고 있는 것은 니켈·코발트와 같은 핵심 원자재 가격이 폭등했기 때문으로 분석된다. 실제 니켈 가격은 지난해 2월 t당 1만7954달러에서 지난 7일 2만3650달러로 올랐다. 코발트 가격도 같은 기간 t당 4만5195달러에서 7만715달러로 급등했다. 배터리 업계 관계자는 “전기차 확산과 함께 주요 원자재 품귀 현상이 발생해 가격이 오르고 있다”면서 “원자재 가격 인상분을 배터리 판매가에 모두 반영할 수 없기 때문에 영업이익이 감소할 수밖에 없는 구조”라고 말했다.SK온도 지난해 4분기에만 영업손실 3098억원을 기록했고, 삼성SDI도 4분기 배터리 부문 영업이익이 1202억원으로 3분기 대비 40.4% 감소했다. 올 상반기에도 원자재 가격 상승, 물류비 인상, 차량용 반도체 부족 문제가 이어질 것으로 전망된다.LG엔솔 주가 폭등에 우려의 목소리도한편 지난달 27일LG에너지솔루션이 상장한 이후 다른 배터리 관련 회사들의 주가는 하락세를 벗어나지 못하고 있다. 삼성SDI는LG에너지솔루션 상장 전날인 지난달 26일 63만3000원에서 8일 55만6000원으로 12% 하락했고, 같은 기간 배터리 소재 기업인 솔브레인은 25만700원에서 23만4100원으로,SKC도 14만7500원에서 14만1500원으로 떨어졌다.LG에너지솔루션이 증시 자금을 대거 흡수하고 있기 때문으로 분석된다. 특히 연기금 등 기관은 지난달 27일부터 8일까지LG에너지솔루션 주식 3조7398억원어치를 매수했다. 반면 나머지 배터리 관련주들은 공매도의 대상이 되고 있다. 지난달 27일 이후 지난 7일까지 공매도 거래 대금 순위에서 삼성SDI(1142억원), 소재 분야의 엘엔에프(1090억원)·포스코케미칼(510억원) 등 배터리 관련주들이 상위권을 차지하고 있다. 향후 주가가 하락할 가능성에 베팅하는 투자자가 그만큼 많다는 얘기다.일각에선LG에너지솔루션의 적정 기업 가치에 대한 논란도 일고 있다. 한 증권업계 관계자는 “LG에너지솔루션 주가는 상장 효과에 따른 투자 심리 과열이 아니냐는 우려도 나오고 있다”고 말했다."
2022-04-30,[부음] 서동열 前 공군참모총장 별세 외,"서동열 前 공군참모총장서동열(88·사진) 제18대 공군참모총장이 29일 별세했다. 1956년 공군사관학교 제4기로 임관해 1987년 6월부터 약 2년간 공군총장을 지냈다. 보국훈장 통일장, 수교훈장 광화대장을 받았다. 유족은 아내 박은덕씨, 주환·주호씨 등 2남이다. 빈소는 삼성서울병원.▲고휘영별세,이정희남편상,고동식양재미디어 대표·고동희·고동진TK엘리베이터 본부장 부친상,박영수솔브레인 부사장 장인상,조재남·김현정시부상=29일6시18분 중앙보훈병원, 발인 1일8시, (02)2225-1004▲김무임별세,유일석前 현대중공업 이사 아내상,유정수서울열린의원 원장·유명희前 산업통상자원부 통상교섭본부장·유수경뱅뒤솔레유 대표·유연주모친상,정태옥前 국회의원·안요섭LGCNSD&A사업부 책임·신민규삼성물산건설부문 프로 장모상,허정윤시모상=27일2시21분 한양대병원, 발인 30일7시30분, (02)2290-9452▲김학준前 충주지방노동사무소장 별세,김상철삼성물산 부장·김현주EBSPD·김민희처브라이프생명 부장 부친상,우종관제주대 물리학과 교수 장인상=28일17시55분, 서울아산병원, 1일8시20분, (02)3010-2000▲이창호별세,이재호SK텔레콤 스포츠운영팀 부장 부친상=29일3시 건국대병원, 발인 1일6시30분, (02)2030-7902▲최일경前 선엔지니어링종합건축사무소 부회장 별세,주송매남편상,최은영·최성호경우시스테크 상무 부친상,방철환(주)저스트그린 연구개발팀장 장인상,정현진시부상,최민기·최재원조부상=29일0시30분 아주대병원, 발인 1일8시, (031)219-4581"
2024-09-18,17세가 재산 2000억…미성년 주식부자 1위 '금수저' 누구,"곽동신 한미반도체 부회장. 사진 한미반도체곽동신 한미반도체 부회장의 17세 아들이 약 2000억원어치 주식을 보유해 미성년 주식 부자 1위에 올랐다.18일 금융정보업체 에프앤가이드에 따르면 지난 12일 기준 주식 평가액 기준으로 곽동신 부회장의 17세 아들이 보유한 한미반도체 주식 가치는 약 2005억6100만원이다. 곽 부회장 아들이 보유한 한미반도체 주식 수는 197만7921주로 19세 미만 미성년자가 보유한 주식 가운데 가장 가치가 높다.한미반도체는SK하이닉스에 고대역폭메모리(HBM) 생산 핵심 장비인 열압착(TC)본더를 공급하는 반도체 업체다. 한미반도체 주가는 인공지능(AI) 대장주 미국 엔비디아 수혜주로 거론되면서 올해 63.65% 급등했다.국내 상장사 주식을 10억원 이상 보유한 미성년자는 총 90명으로 집계됐다. 50억원 이상을 보유한 미성년자가 19명, 100억원 이상을 보유한 미성년자가 11명이다.반도체 소재기업 솔브레인 정지완 회장의 11세 손녀는 솔브레인을 포함한 3개 상장사 주식을 321억원어치 보유해 미성년 주식 부자 2위에 올랐다. 정 회장 손녀는 지난해 연말 기준으로는 487억원어치 주식을 보유하고 있었지만 일부를 내다 팔면서 보유 가치가 약 34% 줄었다.이어 김정규 타이어뱅크 회장의 18세 자녀가 바이오 기업 파멥신 유상증자에 참여해 이 회사 주식 191억원어치를 보유한 것으로 집계됐다.이 밖에도 한미그룹 창업주인 고(故) 임성기 회장의 10대 손주 3명은 한미사이언스 주식을 각각 약 140억~168억원 규모로 보유하고 있다. 임 전 회장은 손주들이 어릴 때부터 한미사이언스 주식을 증여했다.또 전종수 에코아이 최대주주의 13~18세 자녀가 각각 137억 원, 정지선 현대백화점그룹 회장의 17세 딸이 현대그린푸드 주식 116억 원 등 100억 원 이상 주식을 보유하고 있는 것으로 나타났다.10억 원 이상 보유 미성년자 주주 중 최연소는 이수완 덕산테코피아 대표의 2022년생 자녀였다. 이 대표의 2022년생 자녀는 22억 원에 달하는 주식을 갖고 있다.또 엄정헌 한일철강 회장의 손주들로 추정되는 4세, 6세, 7세, 9세 주주도 각각 16억∼17억원 상당의 주식을 보유 중이다."
2023-05-16,"수원대, 수원과학대 업무협약 체결","수원대학교와 수원과학대학교는 솔브레인과 반도체 분야 인재양성 및 정부지원 사업에 대한 협력을 위해 15일 수원대학교 본관 대회의실에서 업무협약을 체결하였다.3개 기관은 이번 협약을 통해 반도체 특성화대학 지원 및 첨단산업 인재양성 부트캠프 등 반도체 분야 정부지원 사업을 공동으로 추진하고, 인재양성을 위한 상호 긴밀한 협력관계를 구축하기로 했다.이를 위해 ▲반도체 분야 우수 인재 유치를 위한 인턴, 채용 등 취업 연계 프로그램 협력 ▲현장형 인재 양성을 위한 기업협업 교과 공동 개발 및 운영 협력 ▲반도체 분야 정부지원   사업 유치를 위한 협력 등을 협약했다.수원대학교 임경숙 총장은 ”본교는 중장기 발전계획으로 반도체를 특성화할 예정으로, 반도체 분야에서 선도적인 역할을 하고 있는 솔브레인(주)와의 협약을 통해 현장형 교육을 도입하고, 기업 수요에 적합한 실무형 인재 양성을 위한 기반을 마련하게 협력을이“이라며 ”솔브레이 가진 비전과 목표에 수원대학교와 수원과학대학교가 공동으로 참여하여 발전적인 방향으로  이끌어 가길 희망한다“고 말했다.솔브레인 노환철 대표는 ”반도체 기업은 우수한 인력을 적기에 확보하는데 어려움이 있고, 채용인력에 대해 별도의 교육과정을 운영하고 있는데, 이번 협약을 통하여 현장형 인재가 양성되면 인력의 안정적인 공급과 교육에 대한 부담이 적어질 것으로 예상되어, 수원대학교와 긴밀하게 협력하여 앞으로 다방면으로 산학협력을 확대해 나가겠다“고 말했다.솔브레인은 선진기술의 국산화와 우리기술의 세계화를 기치로 반도체, 디스플레이, 이차전지 등 국내 주요 첨단산업의 태동기부터 성장한 기업으로 2020년 대한민국 기술대상에서 대통령상을 수상하는 등 국내 최첨단 소재 기술개발 분야에서 선도적인 역할을 해오고 있다."
2024-08-05,"다와, 탄소저감 시스템 참여 기업·기관에 인증서 발급","㈜다와에서 개발한 반들이 탄소저감QR스티커를 활용하여 탄소저감 데이터량 확보에 참여하고 있?는 지자체와 공공기관㈜다와는 환경부 한국환경공단의 탄소중립실천포인트 협약을 통해 생활 속 탄소저감량을 기준으로 탄소저감 인증 데이터를 제공하는 시스템을 보급하고 있다.(사진)㈜다와에서 개발한 반들이 탄소저감QR스티커를 활용하여 탄소저감 데이터량 확보에 참여하고 있는 지자체와 공공기관.탄소저감 실적 인증서 데이터는 김해시, 울산광역시 중구, 인천광역시 중구, 한국동서발전, 한국에너지공단, 안전보건공단, ㈜금호석유화학, ㈜솔브레인, 등 다양한 지자체와 공기업, 기업들에 도입되고 있다.㈜다와의 시스템에 참여한 지자체, 공공기관, 기업, 개인의 탄소저감량은 7월 말 기준 총 16,716,961kg의CO2e 를 줄이는 효과를 보였다. 이는 30년 산 소나무 2,533그루를 심은 것과 같은 효과로, 생활 속에서 실천한 탄소저감의 성과를 보여준다.㈜다와의 반들이 시스템을 통해 한국환경공단으로 전송된 탄소중립실천포인트 실적을 바탕으로 현금 입금된 데이터를 통해 탄소저감 데이터를 제공하고, 이를 통해 탄소저감 인증서가 발급된다. ㈜다와의 탄소저감QR스티커를 활용한 시스템은 블록체인 기술을 적용해 사용 이력을 투명하게 관리한다. 이를 통해 기업들은ESG환경 분야 실적을 외부에 공표할 수 있으며, 사내 탕비실이나 카페에 반들이 시스템을 설치해 추가적으로 정량적인 탄소저감 데이터 실적을 제공받을 수 있다㈜다와의 탄소저감 시스템은 개인 텀블러, 다회용기, 리필스테이션 등을 사용하는 제휴처와 활용된다. 사용자가 텀블러에 부착된 반들이QR스티커를 스캔하면, 이용 데이터가 ㈜다와의 시스템을 통해 한국환경공단으로 전송된다. 이를 통해 개인 사용자는 연간 최대 7만 원, 참여 매장은 최대 15만 원의 현금을 한국환경공단으로부터 직접 입금받을 수 있다.반들이 시스템을 통한 탄소저감 실천에 참여하면, 이용할 때마다ESG포인트(ESGP)가 적립된다. 적립된ESGP포인트는 온라인 오프라인 제휴처에서 할인 결제 수단으로 사용할 수 있다. 이 시스템은 경제적 혜택뿐만 아니라 참여 브랜드의ESG환경분야 사회공헌 이미지 강화,ESG실적 공표 등의 장점을 통해 기업의ESG경영 실천을 촉진하고 있다.지난 5년간 생활 속 탄소저감 실천 방법을 연구 개발해 온 ㈜다와는 해당 분야에서 최고의 특허와 기술을 보유하고 있다. 이를 바탕으로 생활 속 탄소저감량을 수치화하는 기술로 시스템을 보급하며, 다음 세대에게 깨끗한 환경을 제공하는 데 앞장서고 있다."
2024-04-22,[새로운 시작 인천·경기] 대한민국 미래 먹거리 마련 … 세계 최고 반도체 중심도시 건설에 박차,"경기 용인특례시도로망 구축, 전문인력양성 등 계획SK하이닉스·삼성전자 팹 부지조성20여 년 걸쳐 300만 개 일자리 창출이상일 용인특례시장(왼쪽 둘째)이 반도체클러스터 산업단지에 전력을 공급하기 위한 수직구 터널 공사 현장을 둘러보고 있다. [사진 용인시]이상일 용인시장이 제3차 범정부 추진지원단 회의에서 교통 인프라 확충 등을 건의하고 있다.용인특례시는 ‘함께 만드는 미래 용인 르네상스’를 시정 비전으로 내걸고 세계 최고 반도체 중심도시 건설에 박차를 가하고 있다. 처인구 이동·남사읍 첨단 시스템반도체 국가산업단지와 원삼면 용인반도체클러스터 일반산업단지 등의 대형 프로젝트를 진행하면서다.해당 시설은 향후 20여 년에 걸쳐 300만 개 이상 일자리를 창출할 경기 남부 반도체 메가 클러스터의 중심이 될 전망이며, 용인시는 주변에 도로망과 철도망을 구축하고 반도체 마이스터고등학교를 비롯한 전문 인력 양성 시스템까지 갖춘다는 계획이다. 이상일 용인특례시장은 “중세도시 피렌체가 문예 부흥 운동으로 불리는 르네상스로 이탈리아를 강성하게 만든 것처럼 반도체 산업 경쟁력을 강화해 대한민국의 미래 먹거리를 마련하려는 것”이라고 전했다.첨단 시스템반도체 국가산업단지와 용인반도체클러스터는 정부가 지난해 3월 조성하겠다고 밝힌 ‘세계 최대 반도체 메가 클러스터’의 두 축이다. 윤석열 대통령이 지난 1월 경기 남부를 관통하는 세계 최대 반도체 메가 클러스터 조성에 622조원 투자가 예상된다고 밝힌 가운데 502조원이 용인에, 그중에서도 두 산업단지에 482조원이 투자된다.이동·남사읍 첨단 시스템반도체 국가산업단지 규모는 747만㎡로 올해 초 초단기 완공으로 화제가 된 대만TSMC의 일본 구마모토 1공장 부지(21만㎡)의 35.6배에 달한다. 원삼면 용인반도체클러스터는 415.6만㎡로 구마모토 1공장의 19.8배다.SK하이닉스의 팹(Fab) 4기가 들어설 용인반도체클러스터에선 내년 3월 1기 팹(Fab) 착공에 대비해 지금 한창 부지조성 공사를 진행 중이다. 이곳에 1차로 신축될 건축물은 연면적 367만㎡로 인천공항 1·2터미널을 합한 면적의 2배가 넘는다. 1기 팹만도 160만㎡나 되며, 79만㎡ 규모 생산지원시설(9동), 71만㎡ 규모 사무실(2동), 37만㎡의 상생협력센터, 20만㎡의 기숙사 등이 함께 건설된다.삼성전자가 6기의 팹을 건설할 첨단 시스템반도체 국가산단도 속도를 내고 있다. 한국토지주택공사(LH)가 사업 시행을 맡아 지난 17일 국토교통부에 산업단지계획 승인을 신청했다. 산단 계획이 승인되면 곧바로 토지 보상과 조성이 이뤄진다. 이와 관련해 윤석열 대통령은 지난 9일 반도체 현안 점검 회의에서 2026년 부지조성 공사를 시작할 수 있도록 환경영향평가, 보상 등의 절차도 2배 이상 속도를 내 시간을 단축하라고 강조한 바 있다.반도체 메가 클러스터는 두 산업단지를 중심으로 인근의 기존 메모리 팹과 소·부·장, 설계, 패키징 등 반도체 기업 및 관련 연구기관 등이 어우러져 시너지를 내도록 조성된다. 용인반도체클러스터협력화단지에 50개, 첨단 시스템반도체 국가산업단지에 150개 등 200여 소·부·장, 설계기업이 입주해 협업하게 된다. 용인반도체클러스터에는 이미 분양 대상 37필지 가운데 31필지에 주성엔지니어링, 원익IPS,솔브레인 등 29사가 입주하겠다며 시와 협약을 마친 상태다.용인이 세계 최대·최고 반도체 메가 클러스터의 중심으로 자리매김하면서 두 산업단지 인근에도 반도체 기업들이 속속 모여들고 있다. 기흥 미래첨단산업단지에는 국내 대표적 반도체 장비업체인 ㈜세메스가 자리 잡았고, 세계적 반도체 장비회사인 램리서치는 오는 7월 한국 본사를 R&D센터가 있는 기흥구 지곡동으로 옮길 예정이다. 세계 4대 반도체 장비업체로 꼽히는 도쿄일렉트론의 한국 법인 도쿄일렉트론코리아는 처인구 원삼면 원삼일반산단에 R&D센터를 건립할 예정이다. 반도체 검사장비 업체 ㈜고영테크놀로지는 올 하반기 서울 본사와 지주회사를 수지구 상현동 고영테크놀로지R&D센터로 통합·이전하며, 반도체 핵심 소재인EUV블랭크 마스크와 펠리클 업체인 에스앤에스텍은 첨단 시스템반도체 국가산단 인근 용인테크노밸리 일반산단에 오는 7월 신규 공장을 준공할 예정이다."
2024-04-18,포브스 선정 한국 부자 순위 바뀌었다…1위는 누구,"이재용 삼성전자 회장이 지난 2월 6일 오후 김포국제공항을 통해UAE수도 아부다비로 출국하고 있다. 뉴스1미국 경제매체 포브스가 선정하는 한국 50대 부자 순위에서 이재용 삼성전자 회장이 처음으로 1위를 차지했다.17일(현지시간) 포브스는 2024년 한국의 50대 자산가 순위에서 이 회장의 순자산이 115억 달러(약 15조 8100억원)로 1위로 집계됐다고 밝혔다. 포브스가 매년 발표하는 이 순위에서 이 회장이 1위를 차지한 건 이번이 처음이다. 이 회장의 지난해 순위는 2위(80억 달러)였다.포브스는 “삼성전자가 엔비디아의AI컴퓨팅에 사용되는 메모리 칩을 개발한다는 소식에 삼성전자 주가가 올랐다”며 “올해 자산 가치가 가장 크게 상승한 인물”이라고 소개했다.2위는 자산이 97억 달러(약 13조 3300억원)로 평가된 김병주MBK파트너스 회장이었다. 아시아 최대 규모 사모펀드를 운영하는 김 회장은 지난해에는 신규 투자 등으로 재산이 늘며 이 회장을 제치고 1위를 차지했다.3위는 서정진 셀트리온 명예회장(75억 달러·10조 3100억원)이었으며, 4위는 조정호 메리츠금융지주 회장(62억 달러·8조 5200억원)이 차지했다. 5위는 정몽구 현대차그룹 명예회장(46억 달러·6조 3200억원)이었다.6~10위는 김범수 카카오 의장, 홍라희 전 리움미술관장, 곽동신 한미반도체 부회장, 권혁빈 스마일게이트 최고비전제시책임자(CVO), 정의선 현대차그룹 회장이 올랐다.김병주MBK파트너스 회장이 서울 광화문 사무실에서 좋아하는 책들을 놓고 포즈를 취하고 있다. 김 회장은 2024 포브스 선정 한국 50대 부자에서 2위를 차지했다. 사진MBK파트너스자산 상승률이 가장 큰 사람은 조정호 메리츠금융지주 회장이다. 조 회장은 순자산이 82% 증가하며 지난해 9위에서 올해 4위로 순위가 뛰었다. 메리츠금융지주는 지난해 상장 자회사였던 메리츠화재와 메리츠증권을 편입해 재상장했다.올해 50위 부자에 새로 포함된 사람은 4명이었는데, 이 중 3명은 반도체 관련 기업 인물이었다. 8위를 차지한 곽동신 한미반도체 부회장(39억 달러·5조 3600억원)과 이채윤 리노공업 사장(35위), 정지완 솔브레인 회장(48위)이 그 주인공이다. 이밖에 바이오기업인 알테오젠의 박순재 대표(23위)가 새로 명단에 올랐다.포브스는 지난해 한국 코스피는 아시아에서 최악의 성적을 기록했지만, 인공지능(AI)과 반도체 투자 열풍으로 인해 한국 50대 부자의 총자산이 지난해 1060억 달러에서 올해 1150억 달러로 늘었다고 분석했다."
2022-01-21,LG엔솔 청약 환불금 100조 풀린다…이 뭉칫돈 수혜주는 이것,"114조원. 국내 기업공개(IPO)의 역사를 다시 쓴LG에너지솔루션(LG엔솔) 일반 청약에 몰려든 돈이다. 이제 시장의 관심은 수십조원에 달할 청약 환불금이 어디로 향하느냐로 쏠린다.LG엔솔의 청약금 환불은 오는 21일 실행된다. 환불액도 수십조원에서 100조원에 이를 전망이다.LG엔솔로 몰려든 뭉칫돈의 다음 목적지는 어디일까. 시장에 남아 다른 기업 투자로 이어진다면 ‘2차전지 관련주’가LG엔솔의 수혜주가 될 수 있다는 게 증권가의 전망이다. 이재선 하나금융투자 연구원은 “LG엔솔의 경우 파이낸셜타임스스톡익스체인지(FTSE)와 모건스탠리캐피털인터내셔널(MSCI) 지수 조기 편입이 거의 확실시되고 있다”며 “편입 전까지 추종 수요가 생긴다면 교체 매매 수요가 발생하는LG화학과 2차전지 상장지수펀드(ETF)에 들어가 있는 기업의 수급에 우호적일 수 있다”고 말했다.조짐이 이미 일부 보인다. 전기자동차 및 전자 제품에 필수적으로 들어가는 부품용 소재 관련 기업인 대주전자재료의 주가는 20일 전날보다 9.83% 급등했다.LG화학(6.58%)과 삼성SDI(4.08%), 솔브레인(5.99%), 에코프로비엠(4.12%), 엘앤에프(3.71%) 등도 줄줄이 상승했다.환불금이 또 다른IPO청약 투자로 이어질 수 있을지도 관심이다. 다음 달 3~4일 현대엔지니어링 일반 청약이 진행된다. 현대오일뱅크와 마켓컬리, 쏘카 등 대어급IPO도 올해 이어질 예정이다.114조원 중 상당액이 다시 빠져나갈 수도 있다. ‘빚투(빚내서 투자)’ 비중도 상당했다고 예상돼서다. 은행권에 따르면 청약 첫날인 지난 18일KB국민·신한·하나·우리·NH농협은행의 마이너스통장 잔액은 50조7200억원으로 전날보다 1조3718억원 급증했다."
