date,title,content
2022-02-08,"명암 엇갈린 대선 테마주··· 수소는 ‘흐림’, 원전은 ‘맑음’","3일 오후 서울 여의도KBS공개홀에서 열린 <방송 3사 합동 초청> 2022 대선 후보 토론에서 더불어민주당 이재명 대선 후보가 기념 촬영을 마친 뒤 자리로 돌아가고 있다. 오른쪽은 국민의힘 윤석열 대선 후보./2022.02.03 국회사진기자단대선 테마주로 주목받는 수소경제 관련주와 원자력발전 관련주의 희비가 엇갈리고 있다. 수소주들은 거의 대부분 연초 후 마이너스 수익률에서 벗어나지 못하고 있는 반면, 원전주들은 상당수 오름세를 보이고 있다.증시에서 수소주와 원전주는 각각 더불어민주당 이재명 후보, 국민의힘 윤석열 후보와 관련된 테마주로 불린다. 이 때문에 “주식시장은 현재까지 윤 후보의 손을 들어주는 모양새”라는 해석이 나온다.이 후보는 문재인 정부의 핵심 경제·환경 정책인 수소경제를 미래 산업 핵심으로 내세우는 반면, 윤 후보는 원자력발전의 필요성을 강조하고 있다. 지난 3일TV토론에서 이 후보는 “미래 산업의 핵심은 재생에너지고 재생에너지의 중심은 수소가 될 것”이라고 말했다. 윤 후보는 지난달 페이스북에 ‘탈원전 백지화 원전 최강국 건설’이라는 한 줄 공약을 내세웠다.원전 대선 테마주 맑음원전주 강세의 원인은 여러 가지다. 우선 유럽연합(EU)이 지난 2일 원전 투자를 친환경(녹색) 활동으로 분류하는 ‘지속 가능한 금융 녹색분류체계(Taxonomy·택소노미)’안을 확정했다. 원전을 친환경 에너지로 보는 의견이 사실상EU의 인정을 받은 셈이다. 한국 정부가 탈원전 정책을 펴며 작년 말 한국형 녹색분류체계(K택소노미)에서 원전을 제외한 것과 정반대의 흐름이다.EU택소노미는EU가 2050년까지 탄소 중립을 실현하는 데 필요한 친환경 활동의 기준이 된다. 탄소 중립은 온실가스 순 배출량이 ‘0′이 되도록 하는 것을 말한다.여기에 최근 대선 후보 여론조사에서 윤 후보 지지율이 이 후보를 앞서는 것으로 나오자 원전주들이 힘을 받고 있다. 원전 감시 제어 시스템 개발사 우리기술은 연초 후 7일까지 주가가 19% 올라 원전주 가운데 성적이 가장 좋았다. 보성파워텍(15%)·에너토크(12%)·오르비텍(6%) 등 다른 원전주의 수익률도 양호했다. 같은 기간 코스피는 8%, 코스닥지수는 13% 떨어졌다. 연초 후 하락했던 한전기술·일진파워 등 일부 원전주는 이달 들어 상승 반전하고 있다.수소 관련주들은 흐림반면 작년 9월 현대차·SK·포스코가 공동 의장을 맡는 수소기업협의체(코리아H2비즈니스서밋)까지 발족하며 뜨거웠던 수소경제는 식고 있다. 올해 수소연료전지차의 세계 판매량 전망치는 2만여 대로 전기차(600만대)의 300분의 1 수준이다. 메르세데스-벤츠와 폴크스바겐, 혼다 등 글로벌 자동차 회사들이 수소차 개발·생산을 중단한다고 밝혔다. 현대차도 작년 말 수소차 프로젝트를 일시 멈추기로 했다.수소경제 지침이 될 ‘수소경제 육성 및 수소 안전 관리에 관한 법(수소법)’ 개정안은 국회 문턱도 넘지 못하고 있다. 수소 생산 과정에 원전 활용을 포함시켜야 한다는 야당과 이를 반대하는 여당이 대립하고 있기 때문이다. 기업들은 43조원 실탄을 마련해 놓고도 관련 법 제정이 늦어져 속만 태우고 있다.수소 연료 탱크 제조사 효성첨단소재는 연초 후 7일까지 주가가 28% 하락했다. 두산퓨얼셀·일진하이솔루스·상아프론테크(이상 -23%)·에스퓨얼셀(-22%) 등이 20% 넘게 떨어졌다. 대부분의 수소주 수익률은 연초 후 마이너스를 기록 중이다.대선 테마 급등락 주의해야대선 분위기에 휩쓸려 주식들의 부침이 커지자 투자에 유의해야 한다는 경고도 나온다. 금융위원회는 18대(2012년)·19대(2017년) 대선의 사례를 분석해 “선거일이 다가올수록 대선 테마주의 주가가 급락했다”고 지적했다. 선거 전에 급등을 했더라도 실체가 없어 곧 거품이 꺼졌다는 말이다.개인 투자자 19명이 공모해서 대선 테마주 중 상한가 조짐이 보이는 종목을 선정한 후 대규모 매수 주문을 상한가에 제출하는 ‘상한가 굳히기’와 상한가로 낸 매수 호가를 체결 없이 취소하는 ‘허수 호가 제출’ 등으로 시세를 조종해 차익을 얻으려다 금융 당국에 적발돼 수사기관에 넘겨진 경우도 있었다.전문가들은 특별한 이유 없이 풍문만으로 거래가 급증한다면 이미 단타 매매 등 투기 세력의 공격 대상일 가능성이 높다고 지적한다. 이미 주가가 급등한 종목의 추종 매수는 자제하고, 대선 테마주 투자 전 금감원·한국거래소 공시시스템에서 실체를 반드시 확인하라고 전문가들은 조언한다."
2022-01-03,"26년 만에 ‘얼굴’ 바꾼 두산, 또다른 사정 있었네","두산그룹의 새CI.[사진 두산]두산그룹이 3일 새 기업아이덴티티(CI)를 공개했다. 1996년 그룹 창립 100주년을 맞아 발표했던 기존CI를 26년 만에 바꾼 것이다. 세 개의 네모 꼴로 이뤄진 일명 ‘3색 블록(쓰리 스퀘어)’이 사라지고, ‘인데버 블루(EndeavourBlue)’라고 이름 붙인 파란색을 썼다. ‘인데버’는 노력, 분투라는 뜻이다.두산그룹 관계자는 “올해 창업 126주년을 맞는 제일 오래된 기업이지만 가장 빠르게 변화하는 두산의 새로운 미래를 향한 혁신 의지가 반영됐다”며 “과거 틀을 벗어나 역동적이고 민첩하게 움직이며 변화에 유연하게 대응하는 새로운 두산의 모습을 상징한다”고 설명했다.사실 기존CI에 있던 3색 블록은 단순한 모양이 아니었다. 두산이 과거 담당했던 사업 영역을 의미했다. 1996년 5월 29일자 중앙일보는 “두산은…(중략) 새 도약을 선언했다. 이번에 제정된 새CI는 정보유통, 생활문화, 기술소재 등 3개의 주력 기업군을 상징하기 위해 3개의 사각형 모양을 하고 있다”고 적고 있다. 두산은 당시OB맥주 등 식음료와 유통 등까지 사업 영역이 뻗어 있었다.1996년 두산CI의 의미를 다룬 기사. [1996년 5월 29일자 중앙일보 캡처]두산그룹 옛CI.[사진 두산]하지만 현재는 에너지, 중장비, 중공업 등이 주력이다. 박정원 두산그룹 회장은 2일 신년사에서  “더 큰 도약을 위해 새롭게 시작하자”며 수소연료전지, 트라이젠, 수소터빈 등 수소 사업을 비롯해 협동로봇, 수소드론, 물류 자동화 솔루션 등 두산의 새로운 비즈니스에 힘을 싣겠다는 뜻을 강하게 밝혔다.구조조정도 마무리 단계다. 두산은 2020년 6월 채권단과 재무구조 개선을 위한 약정을 맺고 긴급자금 3조원을 지원받았다. 이후 클럽모우CC(1850억원), 네오플럭스(730억원), 두산타워(8000억원), 두산모트롤BG(4530억원), 두산솔루스(현 솔루스첨단소재, 6986억원), 두산인프라코어(현 현대두산인프라코어, 8500억원) 등 우량자산을 잇달아 매각했다. 두산 측은 올 상반기중 재무약정 졸업이 가능할 것으로 보고 있다.두산 관계자는 “CI변경은 여러 매각이 일단락되고 새롭게 거듭나려는 상황과 무관치 않다”고 말했다.CI작업은 두산 내부 브랜드팀에서 담당했다고 한다. 두산 관계자는 새CI색상에 대해 “인간적이면서 신뢰를 주는 색상이어서 사람과 세상을 향해 따뜻함을 지닌 두산의 모습을 표현한다”며 “새로운 일을 힘껏 노력해서 한다는 뜻이 담겼다”고 덧붙였다."
2023-11-07,"'매도 1000주' 신원식, 국회서 주식 카톡 포착…""회의 시작 전""","신원식 국방부 장관이 7일 국회 예산결산특별위원회 전체회의에 출석해 주식거래 관련 카카오톡 메시지를 확인하는 장면이 언론에 포착됐다. 국방부는 ""회의 중 주식 거래를 한 것이 아니다""라고 해명했다.신원식 국방부 장관이 7일 서울 여의도 국회에서 열린 예산결산특별위원회 전체회의에서 의원 질의에 답하는 모습. 뉴스1국방부는 이날 출입기자들에게 보낸 공지 문자를 통해 ""(신 장관은) 국회 예산결산특별위원회 전체 회의 중 주식 거래를 한 것이 아니다""라며 ""업무 관련 내용을 포함해 많은 문자 메시지를 확인하는 과정에서 해당 문자를 재확인한 것""이라고 밝혔다.뉴스핌이 이날 보도한 사진에 따르면 신 장관은 국회 예결위 전체회의가 진행 중이던 이날 오후 3시 37분쯤 주식 관련 카카오톡 메시지를 확인했다. 신 장관이 수신한 메시지에는 '솔루스만 매도 1000주 2만4250원, 사모님 767주 2만4250원'이라고 쓰여 있다. 이에 신 장관은 '네 장 마감 후 어제처럼 총액 보내주세요'라고 답했다.메시지에 등장하는 '솔루스'는 코스피에 상장된 '솔루스첨단소재'로 추정되며 2차 전지 소재를 만드는 기업이다.이와 관련, 국방부는 ""모 매체에서 사진으로 보도한 국방부 장관의 휴대폰 화면은 모 증권사의 위탁 대리자가 주식 거래 결과를 문자로 보내온 것""이라며 ""해당 문자는 7일 아침 9시 35분에 수신하고 9시 45분에 답신한 것으로, 이는 예결위 전체회의가 시작되기 전이었다""고 설명했다.신 장관도 이날 예결위에서 관련 질의에 ""주식 거래를 한 건 전혀 아니다""라며 ""담당자가 저에게 그냥 카톡을 보낸 것""이라고 답했다."
2023-09-16,"유인촌, 압구정 현대 등 162억 재산 신고…배우자 명의로 90억","신원식, 배우자·자녀 등 19억 신고국방부 장관 후보자에 지명된 신원식 국민의힘 의원(왼쪽부터), 문화체육관광부 장관 후보자에 지명된 유인촌 대통령실 문화체육특별보좌관. 뉴스1유인촌 문화체육관광부 장관 후보자가 자신과 배우자 재산으로 총 162억6000만원을 신고했다. 신원식 국방부 장관 후보자는 자신과 배우자, 자녀의 재산으로 총 19억 3000만원을 신고했다.16일 국회에 제출된 인사청문요청안에 따르면 유 후보자는 자신 명의로 71억9000만원, 배우자 명의로 90억7000만원의 재산이 각각 있다고 신고했다.유 후보자는 서울 강남구 압구정동 현대아파트(28억7000만원·144.7㎡)와 3000만원 상당의 경기도 여주시 임야를 보유했다.재산 중 가장 큰 비중을 차지한 것은 주식으로, 34억2000만원이었다. 14억5000만원의 예금과 9700만원어치의 용평리조트 콘도 회원권도 재산으로 신고됐다.배우자는 현재 유 후보자의 주소지인 서울 성동구 트리마제 아파트(45억원·152.1㎡)를 보유했다.서울 중구에 있는 8억2000만원 상당의 상가도 재산으로 신고했다. 예금은 28억5000만원, 주식은 7억4000만원어치를 보유했다. 새서울레저 콘도 회원권(1억2000만원)도 재산 목록에 올랐다.유 후보자의 두 아들은 독립 생계유지를 이유로 재산 신고에서 제외됐다. 유 후보자와 두 아들 모두 육군 병장으로 만기 전역했다.신원식 후보자는 자신과 배우자, 자녀의 재산으로 총 19억3000만원의 재산을 신고했다.신 후보자는 본인 명의로 3억8천00만원, 배우자 명의로 15억6700만원의 재산을 각각 신고했다.재산 중 가장 큰 비중을 차지한 것은 배우자 명의의 서울 성동구 옥수동 아파트 전세권(8억5000만원)이었다.신 후보자는 솔루스첨단소재, 테슬라, 애플 등의 증권 2억9300만원과 예금 9700만원을 보유한 것으로 확인됐다.배우자는 예금(4억4000만원), 서울 용산구 한남동 아파트(1억7100만원),GV70 자동차(6100만원) 등을 재산으로 신고했다.차녀의 경우 2000만원의 채무가 있었다. 장녀의 경우 인사청문요청안에 별도의 사유 없이 '등록 제외'라고 기재됐다."
2022-06-23,신동빈 ‘유럽 배터리 시장 선점’…헝가리 양극박 공장에 1100억 더,"신동빈 롯데그룹 회장(왼쪽)이 독일 유통사 레베(REWE) 회장과의 미팅에서 2030부산세계박람회 유치 지지를 부탁했다. [사진 롯데지주]신동빈 롯데그룹 회장이 유럽 전기차 배터리 사장 공략을 위해 2차전지용 양극박 사업에 1100억원 추가 투자를 결정했다.  롯데알미늄 헝가리 공장의 양극박 생산 규모를 2배로 늘리는 조치다.22일 롯데지주에 따르면 신 회장은  최근 헝가리 터터바녀 산업단지에 조성된 롯데 클러스터를 방문했다. 그는 다음 달 본격 양산을 앞둔 롯데알미늄 공장을 찾아 시제품을 직접 확인했다. 이 자리에서 신 회장은 유럽 전기차 시장을 선점할 수 있도록 1100억원을 추가 투자해 양극박 생산 규모를 늘리기로 결정했다. 롯데 클러스터에 위치한 롯데알미늄 헝가리 공장은 연간 1만8000t 규모의 2차전지용 양극박을 생산할 수 있는 유럽 유일의 양극박 전용 공장이다. 양극박은 2차전지의 용량과 전압을 결정하는 양극활물질을 지지하는 동시에 전자의 이동 통로 역할을 하는 소재로 열전도성이 높아 전지 내부의 열 방출을 돕는 역할을 한다.헝가리 롯데 클러스터에는 롯데케미칼과 롯데알미늄 공장뿐 아니라 롯데정밀화학과 롯데알미늄이 3000억원을 투자한 솔루스첨단소재의 음극박 생산공장도 인접해 있다. 롯데건설은 국내 물류 전문업체와 공동 투자해 단일 물류창고 기준으로 헝가리 최대 규모 물류센터를 개발 중이다.한편, 신 회장은 지난 21일 아일랜드 더블린에서 열린CGF(TheConsumerGoodsForum) 글로벌 서밋에 참석해 글로벌 소비재 경영진을 비롯한 포럼 참석자들을 대상으로 2030부산세계박람회(엑스포) 유치 홍보 활동을 펼쳤다.CGF는 세계인의 더 나은 삶을 위한 논의와 지식공유의 장을 마련한다는 취지로 1953년 설립된 소비재 업계의 글로벌 협의체로 세계 70여 개국, 400여 개 소비재 제조사 및 유통사가 참여하고 있다. 신 회장은 2015년 이후 7년 만에 직접 참석했다."
2022-06-22,신동빈 유럽 전기차 배터리 시장 정조준…양극박 1100억 추가 투자,"신동빈 롯데그룹 회장이 유럽 전기차 배터리 사장 공략을 위해 2차전지용 양극박 사업에 1100억원 추가 투자를 결정했다.  롯데알미늄 헝가리 공장의 양극박 생산 규모를 2배로 늘리는 조치다.22일 롯데지주에 따르면 신 회장은  최근 헝가리 터터바녀 산업단지에 조성된 롯데 클러스터를 방문했다. 그는 다음달 본격 양산을 앞둔 롯데알미늄 공장을 찾아 시제품을 직접 확인했다. 이 자리에서 신 회장은 유럽 전기차 시장을 선점할 수 있도록 1100억원을 추가 투자해 양극박 생산 규모를 늘리기로 결정했다. 롯데 클러스터에 위치한 롯데알미늄 헝가리 공장은 연간 1만8000t 규모의 2차전지용 양극박을 생산할 수 있는 유럽 유일의 양극박 전용 공장이다. 양극박은 2차전지의 용량과 전압을 결정하는 양극 활물질을 지지하는 동시에 전자의 이동 통로 역할을 하는 소재로 열전도성이 높아 전지 내부의 열 방출을 돕는 역할을 한다.신동빈 롯데그룹 회장(맨 오른쪽)이 21일 아일랜드 더블린에서 열린 국제 소비재기업 협의체 '소비재포럼'(CGF)에서 2030 부산세계박람회(엑스포) 유치 홍보 활동을 하고 있다.연합뉴스헝가리 롯데 클러스터에는 롯데케미칼과 롯데알미늄 공장뿐 아니라 롯데정밀화학과 롯데알미늄이 3000억원을 투자한 솔루스첨단소재의음극박 생산공장도 인접해 있다. 롯데건설은 국내 물류 전문업체와 공동 투자해 단일 물류창고 기준으로 헝가리 최대 규모 물류센터를 개발 중이다.━2030부산세계박람회 유치 광폭 행보한편, 신 회장은 지난 21일 아일랜드 더블린에서 열린CGF(TheConsumerGoodsForum) 글로벌 서밋에 참석해 글로벌 소비재 경영진을 비롯한 포럼 참석자들을 대상으로 2030부산세계박람회 유치 홍보 활동을 펼쳤다.CGF는 세계인의 더 나은 삶을 위한 논의와 지식공유의 장을 마련한다는 취지로 1953년 설립된 소비재 업계의 글로벌 협의체로 세계 70여 개국, 400여 개 소비재 제조사 및 유통사가 참여하고 있다. 신 회장은 2015년 이후 7년 만에 직접 참석했다.신동빈 롯데그룹 회장이 독일 유통사 레베(REWE) 회장과의 미팅에서 2030부산세계박람회 유치 지지를 부탁했다. [사진 롯데지주]신 회장은 펩시코, P&G,월마트, 레베 등 글로벌 그룹 최고경영자들과 가진 비즈니스 미팅에서도 2030부산세계박람회를 홍보하며 유치 지원에 힘을 실었다. 롯데지주 관계자는 “전세계 소비재 시장에서 영향력을 끼치고 있는 글로벌 기업인들에게 2030 부산세계박람회 유치 활동에 대한 인지도를 높여 성공적인 개최에 도움이 될 것”이라고 기대했다.신 회장은 7월 중 예정된 하반기VCM(ValueCreationMeeting.옛 사장단회의)을 부산에서 열고 부산엑스포 유치를 위한 계열사들의 지원 방안을 모색할 계획이다. 1년에 두 차례 열리는VCM은 롯데 주요 계열사 대표와 지주사 임원 100여명이 모여 그룹이 나아갈 방향을 공유하는 자리다. 부산에서 열리는 것은 이번이 처음이다.앞서 지난 4일 신동빈 회장은 베어즈베스트 청라에 설치된 부산엑스포 유치기원 포토월을 방문해 “2030부산세계박람회가 성공적으로 유치될 수 있도록 롯데도 힘을 보태겠다”라고 밝혔다. 2030부산세계박람회 유치를 위한 릴레이 응원 캠페인 ‘함께해요 이삼부’에도 동참하며 “글로벌 전시 역량뿐만 아니라 풍부한 관광자원, 항구도시 특유의 개방적이고 포용적인 문화까지 갖춘 부산이 월드엑스포 개최 최적지라고 생각한다”고 말했다."
2022-02-22,‘영끌’해 채권단 졸업 앞두고…반도체회사 인수 나선 박정원의 승부수,"주요 계열사 매각 등을 통해 3조원을 상환해 채권단 관리에서 ‘졸업’을 앞둔 두산그룹이 이번엔 ‘사자’에 나섰다. 대상은 반도체 후공정 테스트 회사인 테스나다. 그동안 그룹의 핵심 계열사인 두산중공업을 지키기 위해 ‘방어’에 주력하던 박정원 두산그룹 회장이 ‘공격’으로 전환하는 첫 사업이란 점에서 의미가 크다.박정원 두산그룹 회장. [사진 두산]━채권단 졸업 앞두고 테스나 인수 추진두산은 22일 공시를 통해 “테스나 인수를 검토 중이나 아직 구체적으로 확정된 사항이 없다”고 밝혔다. 하지만 업계에선 두산의 테스나 인수가 유력한 것으로 관측하고 있다. 인수 금액은 4600억원 정도인 것으로 알려졌다. 테스나는 삼성전자·SK하이닉스를 고객사로 둔 반도체 후공정 테스트 분야 1위 업체다. 지난해 매출 2043억원, 영업이익 525억원을 기록했다.테스나를 인수하게 되면 두산은 주류·식품 등 소비재 중심에서 건설·중공업 등 중후장대 산업에 이어, 친환경·첨단 산업으로 또 한 번 사업 포트폴리오 재편에 나서게 된다.두산 그룹이 매각한 주요 자산. 그래픽= 전유진yuki@joongang.co.kr앞서 두산은 2020년 4월 두산중공업이 유동성 위기를 겪자 채권단으로부터 3조6000억원을 긴급 지원받는 대신 3조2000억원 규모의 재무구조 개선안을 제출했다. 이에 따라 두산은 최근 2년간 두산타워(8800억원)부터 두산인프라코어·두산솔루스·클럽모우골프장 등 주요 계열사를 매각해 왔다. 재계에서 ‘영끌(영혼까지 끌어모음)’했다는 평가가 나오는 이유다.여기에 박정원 회장 등 오너경영인 일가가 보유하고 있던 두산퓨얼셀 지분 23%를 두산중공업에 무상 증여해 재무구조를 추가로 개선했다. 경영 실적도 좋아졌다. 두산은 지난해 매출 13조7282억원, 영업이익 9588억원을 기록했다. 금융권에선 두산이 이르면 이달 내 채권단 관리 체제를 종료할 것으로 전망하고 있다. 이 경우 두산은 채권단 관리를 22개월 만에 종료하는 ‘최단기 졸업생’이 된다.━박정원 회장 “더욱 공격적으로 나아가자”이런 상황에서 테스나 인수 추진은 의미가 크다. 박 회장이 그동안 위축됐던 그룹 위상을 다시 키우겠다는 의지를 밝힌 셈이어서다. 기존 주력 사업과 연관성이 적은 반도체 분야 진출이라는 점에서 포트폴리오 재편이 본격화했다는 분석도 나온다.두산 주가. 그래픽= 전유진yuki@joongang.co.kr박 회장은 신년사에서 “‘변화 속에서 기회를 찾는다’는 긍정적 마인드로 더욱 공격적으로 나아가자”며 신사업군의 본격적인 성장, 수소 사업 선도, 혁신적 기술과 제품 개발 등을 주요 실행 목표로 제시했다. 구체적으로 그는 “협동 로봇, 수소 드론, 물류자동화 솔루션 부문 등이 의미 있는 성장세를 보였고 이제는 본격 성장 가도에 올라설 때”라며 “두산이 새롭게 진출한 의약품 보관용 첨단소재 사업과 같이 새 성장동력을 찾는 일에도 부단한 노력을 기울이자”고 말했다. 그룹의 새 성장 동력으로 로봇·수소·첨단 소재 등 친환경·첨단 산업을 제시한 셈이다.━친환경에너지·첨단IT로 포트폴리오 재편두산의 포트폴리오 재편 노력은 지난해부터 이어져 왔다. 두산은 지난해 4월 각 계열사의 수소 사업 전문 인력을 모아 ‘수소TFT’를 신설했다. 외부 전문기관과 손잡고 세계 수소 시장 동향을 살피겠다는 취지다.두산그룹은 올 초 미국 라스베이거스에서 열린CES2022에서 트라이젠(Tri-Gen)시스템과 드론, 로봇, 자동화 무인장비 등을 전시했다. [연합뉴스]지난해 11월엔 포트폴리오 총괄 조직을 신설했다. 김도원 전 보스턴컨설팅그룹 서울 대표 파트너가 사장으로 영입됐다. 김 사장은 그룹 전반의 비즈니스 비전과 전략을 수립하고 사업 구조를 재편하는 역할을 맡고 있다.여기에다 올 초 미국 라스베이거스에서 열린 소비자가전쇼(CES2022)에서 트라이젠(수소·전기·열 동시 생산) 시스템, 드론, 로봇 등을 선보였다. 글로벌 무대에서 그룹의 신사업 방향성을 제시한 것이다.최남곤 유안타증권 연구원은 “두산이 부실을 털어내고 재무구조를 개선하는 과정에서 자의반 타의반으로 포트폴리오가 재편됐다”며 “두산중공업을 중심으로 친환경 에너지 사업을 키우는 한편, 지주사는 로봇·물류·전자 소재 등 정보기술(IT) 분야에 집중하는 전략을 펼치는 것으로 평가된다”고 말했다."
