date,title,content
2024-04-18,"삼성 이재용, 포브스 ‘韓 50대 부자’서 처음 1위 오른 이유는","반도체 회사 3곳 대표 신규 진입포브스가 매년 발표하는 대한민국 50대 부자 순위에서 2024년 이재용 삼성전자 회장이 자산 115억달러(약 15조9000억원)로 처음으로 1위에 올랐다. 작년 1위 김병주MBK파트너스 회장을 제쳤다.포브스는 삼성전자가 엔비디아와 메모리칩을 개발하고 있다는 소식에 주가가 올랐고, 이 회장의 자산 가치도 상승했다고 분석했다. 50위 부자에 새로 포함된 인물은 4명이었는데, 이 중 3명은 반도체 관련 기업 인물이었다. 포브스는 지난 2일 주식시장 장 마감을 기준으로, 기업 사업 보고서 등 자료를 기반으로 자산 가치를 평가했다. 자체 조사에서 주식 재산을 주요 자산 평가로 삼고 부동산, 미술품 등은 정확히 파악되지 않는 경우도 있다.이재용 삼성전자 회장이 작년 10월 19일 경기도 삼성전자 기흥캠퍼스를 찾아 차세대 반도체 R&D 단지 건설 현장을 점검하고 있다./삼성전자최근 몇 년간 국내 부자 순위 1위는 자수성가형 부자들이 차지해왔다. 2021년 서정진 셀트리온 명예회장, 2022년 김범수 카카오 의장, 작년 김병주 회장이 1위를 기록했다.김병주 회장은 올해 자산 97억달러(약 13조4100억원)로 평가돼 2위를 기록했다. 3위는 서정진 셀트리온 명예회장(75억달러)이었다. 이어 4위 조정호 메리츠금융지주 회장(62억달러), 5위 정몽구 현대차그룹 명예회장(46억달러) 순이었다.아시아 최대 규모 사모펀드MBK의 김병주 회장./김지호 기자6~10위는 김범수 카카오 의장, 홍라희 전 리움미술관장, 곽동신 한미반도체 부회장, 권혁빈 스마일게이트 최고비전제시책임자(CVO), 정의선 현대차그룹 회장이 기록했다.올해 새로 50위 안에 진입한 인물은 4명이었다. 곽동신 한미반도체 부회장(8위·39억달러), 박순재 알테오젠 대표(23위·14억3000만달러), 이채윤 리노공업 사장(35위·10억달러), 정지완 솔브레인 회장(48위·8억달러)이었다. 바이오기업 알테오젠을 제외하고 3곳은 모두AI반도체 관련 기업이었다.반도체 장비기업 한미반도체 곽동신 부회장은 창업주 고(故) 곽노권 회장의 아들이다. 반도체 장비 국산화에 성공한 한미반도체는 ‘비전플레이스먼트’ 장비에서 세계 시장 점유율을 차지하며 국내 대표 반도체 중견기업으로 성장했다.이채윤 사장은 리노공업 창업주다. 반도체 테스트에 쓰이는 프로브 핀(탐침)과 소켓을 국내 최초로 개발해 테스프 핀인 ‘리노핀’을 국내외 1020여개 회사에 납품하고 있다.AI가 탑재된 스마트폰과 노트북 출시가 이어지면서 올해 업황이 더 좋을 것으로 전망된다.정지완 솔브레인 회장도 창업주다. 무역회사인 ‘테크노무역’을 설립해 이후 반도체·디스플레인 소재 기업 솔브레인으로 키워냈다. 삼성전자,SK하이닉스 등에 여러 반도체 소재를 공급하고 있다.포브스는 작년 한국의 증시는 아시아에서 최악의 성적을 거뒀음에도 인공지능(AI)과 반도체 투자 열풍 영향으로 한국 50대 부자의 총자산이 2023년 1060억달러에서 올해 1150억달러(약 159조400억원)로 증가했다고 분석했다."
2022-02-05,"‘소부장 독립선언’ 2년, 일본 의존 더 심해졌다","일본이 반도체·디스플레이 핵심 소재 3종에 대한 한국 수출 규제를 강화하는 경제 보복 조치를 내린 것은 2019년 7월. 당시 정부는 일본으로부터 ‘소부장(소재·부품·장비) 자립’을 선언하고 대대적인 기술 개발 지원, 관련 기업 육성책을 발표했다. 그로부터 2년이 지난, 지난해 7월 문재인 대통령은 소부장 성과 보고대회를 열고 “일본의 기습 공격에 맞서 소부장 자립을 이뤄냈다”고 했다.SK하이닉스 직원들이 반도체 생산라인을 점검하고 있다./sk하이닉스하지만 4일 본지가 최근 4년간 정부 무역통계를 분석한 결과, 지난해 일본에서 수입한 소부장은 무역 분쟁 이전인 2018년보다 오히려 증가한 것으로 나타났다. 2018년 대일본 소부장 수입액은 381억달러(45조7000억원)였다. 2019년 일본이 경제 보복 조치를 단행하자 329억달러로 잠시 주춤했던 수입액은 이듬해 340억달러로 반등했고, 지난해엔 395억달러로 치솟았다.전체 소부장 수입액 가운데 일본이 차지하는 비중은 2018년 18.3%에서 지난해 15.9%로 소폭 감소했다. 하지만 여기에는 작년 반도체 경기가 유례없는 호황을 맞으며 전체 소부장 수입액이 2018년에 비해 20%나 증가한 영향이 더 크다. 국내 소재·장비 업계에서도 “일본 업체가 한국이나 제3국에 세운 공장을 통해 한국으로 수출하는 우회로를 택하면서 ‘대일본 수입’ 통계에서 빠진 착시 효과가 있다”고 지적한다. 실제로 지난 2019년 일본이 ‘한국에 비수를 꽂았다’고 내세운 반도체 핵심 소재 3종에 대한 일본 의존도는 여전히 절대적이다.한국반도체디스플레이기술학회장인 박재근 한양대 교수는 “국내 소부장 기술과 기업을 육성해야 한다는 전제는 맞지만, 기술 강국들을 상대로 단기간에 성과를 낸다는 것은 사실상 불가능한 얘기”라며 “특정 국가를 배제하는 방식이 아니라 합작 법인과 투자 유치 등 현실적 대안을 모색해야 한다”고 했다.삼성반도체도,LG배터리도… 일본산 소재·장비 끊기면 생산 스톱-日이 장악한 핵심 기술… 갈 길 먼 소부장 국산화국내 1위 배터리업체인LG에너지솔루션은 액체 화학물질인 배터리를 안정적으로 포장하는 핵심 소재 ‘알루미늄 파우치 필름’을 일본의DNP와 쇼와덴코라는 두 업체에서 수입하고 있다. 2019년 일본이 반도체·디스플레이 핵심 소재 3종의 한국 수출 규제에 나서자,LG도 재빨리 대체 공급망 확보에 나섰다.LG에너지솔루션 관계자는 “국내와 중국 업체를 접촉해 제품 테스트도 진행하고, 납품을 받으려고 여러 방면으로 알아봤다”고 했다.하지만LG는 여전히 세계시장의 70%를 과점한 두 일본 업체의 제품을 쓰고 있다. 여러 파우치 필름을 테스트해 봤지만 가격과 성능 모두 기준에 미달해 양산(量産)이 도저히 불가능하다는 판단을 내린 것이다. 이 밖에도 2차 전지의 전극을 안정화시키는 양극·음극 바인더, 전해액 첨가제, 동박(銅箔·종이처럼 얇게 만든 구리) 제조 설비 등 일본에 절대적으로 의존하는 제품이 여전히 많다. 이항구 자동차연구원 연구위원은 “국내 기업들이 국산화에 나서고 있긴 하지만, 노벨 화학상 수상자를 수차례 배출한 일본이 핵심 기술 특허를 상당수 장악하고 있는 상황”이라고 했다. 일본의 기술 특허를 피해가면서 소부장 국산화를 하는 게 말처럼 쉽지 않다는 이야기다.文은 국내 소부장 기업 격려했지만… - 2020년 7월 문재인 대통령이 이천SK하이닉스 사업장을 방문해 소재·부품·장비 기술 개발 현황과 성과를 보고받은 뒤, 박수를 치고 있다. 정부는 2019년 7월‘소부장 독립’을 선언하고 각종 지원 정책을 펼쳤지만 지난해 일본으로부터의 소부장 수입액은 오히려 증가했다. /연합뉴스정부 “해외 대체 공급망 발굴”… 알고 보니 일본 업체 해외 공장2019년 일본의 수출 규제 품목 3종 중 하나였던 ‘포토레지스트’는 일본 수입 의존도가 2018년 93.2%에서 지난해 79.5%로 줄었다. 대체 공급망인 벨기에를 발굴해 포토레지스트 수입액을 10배 이상 크게 늘렸기 때문이다. 지난해 벨기에 수입 비율은 15.8%를 차지했다. 정부는 ‘일본 의존도를 줄인 성과’로 발표했다. 하지만 이를 두고 일본 경제지 니케이는 “한국의 포토레지스트 벨기에 수입분은 일본JSR의 벨기에 공장에서 제조된 것”이라며 “기만적인 수치 발표”라고 보도했다. 제조 국가만 바뀌었을 뿐 여전히 일본 업체의 제품이라는 것이다.역시 규제 대상이었던 고순도 불화수소는 솔브레인, 이엔에프테크놀로지 등 일부 국내 기업이 국산화에 성공했다. 제조 기술력을 확보해 양산까지 했지만, 여전히 일본 그늘에서 자유롭지 못하다. 고순도 불화수소 생산을 위한 원료 수급부터, 제조에 이르기까지 모든 관련 업체가 일본 화학 회사와 지분을 섞은 합작사이기 때문이다. 솔브레인은 일본 스텔라케미파·마루젠케미칼과 함께 세운 훽트에서 원료를 공급받고, 이엔에프테크놀로지의 고순도 불화수소 제조 계열사인 팸테크놀로지는 일본 모리타케미칼(지분 32%) 등과 함께 세운 것이다.소재뿐 아니라 반도체 장비도 日 의존 높아세계 반도체 1위 기업인 삼성전자도 일본 장비가 없으면 공정(工程)에 큰 차질이 생긴다. 예를 들어, 초미세 공정인 나노(㎚·1나노는 머리카락 굵기의 10만분의 1) 단위의 반도체 공정을 진행하는 데 필수적인 극자외선(EUV) 검사 장비는 일본의 레이저텍이 세계에서 유일하게 생산한다. 레이저텍의 최대 수출 국가도 한국이다. 이 밖에도 도쿄일렉트론, 에바라제작소 등 반도체 특수 공정에 필요한 장비를 전문적으로 생산하는 일본 업체가 많다. 반도체업계 관계자는 “삼성전자 담당자와 반도체 장비 공급망 리스크에 대해 이야기했는데, ‘일본 장비 기업에서 100% 독립은 현재로서는 불가능하다’는 답이 돌아왔다”고 말했다.대외경제정책연구원 조사에 따르면, 반도체용 레이저 절단기는 최근 2년 연속 일본에서 100% 수입했고, 포토레지스트 도포·현상기, 반도체 웨이퍼 식각 등을 위한 분사기, 웨이퍼를 개별 칩으로 절단하는 기기 모두 일본 수입 비율이 90%가 넘는다. 정형곤 대외경제정책연구원 선임연구위원은 “2020년에 반도체 제조 장비 수입 품목을 전수조사한 결과, 일본 수입 의존도가 70%가 넘는 품목이 22개였다”며 “일본이 장비 분야에도 수출 규제를 걸 경우 큰 타격이 불가피하다”고 했다.이와중에… 일본 기업들, 한국에 공장 짓고 ‘메이드 인 코리아’로 국적 세탁일본 소부장 기업들은 최근 한국에 직접 공장을 짓거나, 한국 기업과 합작 회사를 만들어 설비를 들여오는 방식으로 투자를 확대하고 있다. 한일 양국 외교 관계 악화로 인한 리스크를 회피하는 일종의 우회 전략인 셈이다. 이렇게 생산되는 소재·부품·장비는 ‘메이드 인 코리아’로 분류되는 데다, 원료를 들여와 한국에서 가공하는 방식이라면 일본 정부의 규제로부터도 자유롭기 때문이다.SK지오센트릭(옛SK종합화학)은 지난해 12월 일본 화학기업 도쿠야마사와 합작법인을 설립하고 1200억원을 들여 울산에 공장을 짓겠다고 발표했다. 이 공장은 2024년부터 반도체 웨이퍼 세척 소재로 쓰이는 고순도 용제를 연간 3만t씩 생산할 계획이다. 일본 대표 화학사인 스미토모화학은 작년 9월 한국에 100억엔(1040억원) 이상을 투자해 포토레지스트 제조 공장을 신설하기로 했다. 그동안 스미토모화학은 오사카 생산분을 한국에 수출했지만, 앞으로는 일본에서 원료를 들여와 한국 공장에서 제조해 출하하겠다는 방침이다.일본 반도체 소재·장비 강소기업들은 일본의 수출 규제 훨씬 이전부터도 삼성전자·SK하이닉스 등 글로벌 톱 반도체 제조사가 있는 한국에 공장을 세우거나 투자해왔다. 그런데 2019년 일본 정부의 소부장 수출 규제가 일본 기업들의 이런 행보를 가속화시키고 있다. 일본 경제산업성 산하 아시아경제연구소에 따르면 2011년 이후 일본 반도체 소재·장비 기업이 직접 투자 혹은 합작법인 형태로 한국에 공장을 세우는 사례는 한 해 평균 1건 정도였다. 그런데 2019년 7월 이후 발표된 일본 회사들의 한국 공장 신·증설 건수만 총 5건이었다.대표적으로 2012년 한국에 진출한TOK(도쿄오카공업)는 핵심 품목인 포토레지스트가 일본 정부의 수출 규제 대상 품목에 오르자, 한국 송도 공장을 증설해 포토레지스트를 제조해 납품하고 있다. 한국 법인의 연 매출이 1700억원(2020년 기준)을 넘을 정도로 규모가 크다. 일본 소부장 기업이 한국에서도 상당한 규모의 투자와 고용을 하고 있는 것이다."
2024-07-12,"이영훈 목사, 저출생 해결 공로로 훈장 받아","HD현대·부영·하나금융·전남道·조계종·본지 등도 대통령 표창11일 서울 중구 웨스틴조선호텔에서 보건복지부 주최로 열린 ‘제13회 인구의 날’ 기념행사에서 저출생 고령화 등 인구 문제 해결에 기여한 공로로 이영훈 여의도순복음교회 담임목사가 국민훈장 모란장을 받았다. 이 담임목사는 가족 가치를 널리 알리는 범종교계 캠페인을 추진하고, 아동‧자립준비청년‧다문화가족 지원 등에 헌신한 공로를 인정받았다.11일 서울 중구 웨스틴조선호텔에서 열린 '제13회 인구의 날' 기념행사에서 대통령 표창 수상자들이 조규홍(가운데) 보건복지부 장관과 함께 기념 촬영을 하고 있다. 앞줄 왼쪽부터 (표창을 든) 남궁훈HD한국조선해양 전무, 이희범 부영그룹 회장, 오정택 하나금융지주 부사장, 김웅년 복지부 서기관, 박성용씨, 조 장관, 박현수 한미글로벌 전무, 묘장 대한불교조계종 사회복지재단 대표, 박창환 전라남도 경제부지사, 신은진 조선일보 사회정책부장, (뒷줄 맨 오른쪽) 안준용 기자. /장련성 기자안정용 구면농장 대표와 김경락 한화제약 대표는 국민포장을 받았다. 안 대표는 전북 정읍에서 여덟 남매를 키우면서 지역 아동들에게 장학금 등을 지원해왔다. 김 대표는 주4일제 도입, 자녀양육수당 지급 등에 앞장섰다.HD현대, 부영, 하나금융지주, 한미글로벌, 대한불교조계종 사회복지재단, 전라남도, 본지 등 단체 7곳과 박성용·김웅년씨는 대통령 표창을 받았다. 본지는 2018년부터 ‘아이가 행복입니다’ 캠페인을 전국적으로 진행해 저출생 극복에 힘쓴 공로를 인정받았다.재단법인 솔브레인나눔재단 등 단체 5곳과 윤태열 남경엔지니어링 대표 등 5명은 국무총리 표창을 받았다. 강정민 연세대 조교수 등 45명과 단체 5곳은 복지부 장관 표창을 받았다.조규홍 복지부 장관은 “결혼, 출산, 양육, 일·가정 양립을 위한 제도적 지원을 강화하면서, 문화와 사회 인식 변화를 이끌어낸다면 인구 위기도 극복할 수 있을 것”이라고 했다."
2024-02-21,“이차전지 테마주 꺼진 줄 알았는데”...올들어 300% 폭등한 이 종목,"그래픽=조선디자인랩 정다운작년 이차전지 투자 열풍을 주도했던 ‘에코프로 형제주’(에코프로와 에코프로비엠)가 내리막길을 걷고 있는 와중에도 초강세를 보이고 있는 이차전지 소재주가 있다. 이차전지 핵심 소재 ‘전해액’ 전문기업인 엔켐 주가는 올들어서만 300% 넘게 폭등해 코스닥 시가총액 4위에 등극했다.또다른 전해액 생산·판매업체 솔브레인홀딩스 주가도 급등 중이다. 올해 1월2일 4만4350원에서 지난 20일 8만5400원으로 92% 뛰었다. 에코프로 형제주가 작년 여름 고점 대비 반토막 신세인 점을 감안하면 이차전지주 안에서도 ‘극과 극’ 장세가 연출되고 있는 것이다.엔켐 주가는 그야말로 파죽지세다. 작년 11월 6만원대였던 주가가 3개월 만에 34만원대로 폭등했다. 새해 들어선 상승세가 더 가팔라졌다. 연초 이후에만 325% 오르며 고공행진하고 있다. 21일에도 3%대 안팎 오름세를 보이고 있다. 한 증권업계 관계자는 “공매도마저 중단되며, 주가에 브레이크가 걸리지 않는 상태”라고 했다. 한국거래소가 지난 14일 엔켐을 투자경고종목으로 지정했지만, 주가는 아랑곳 않고 상승 중이다.이렇게 엔켐 주가를 밀어올리는 원동력은 미국 인플레이션방지법(IRA)의 수혜 기대감이다. 올 초IRA해외우려기업(FEOC) 세부지침 시행으로 경쟁사인 중국 전해액 기업들의 미국 진입이 어려워졌다.투자자들은 그 수요를 엔켐이 거의 전량 대체할 것으로 보고 있다. 2022년 글로벌 생산량의 50% 이상을 장악한 글로벌 전해액 공급업체 톱3 모두 중국업체로 엔켐은 4위다. 중국 물량 규제의 반사이익이 예상되는 이유다. 엔켐은 2019년 선제적으로 미국에 진출, 조지아에 공장을 가동 중이다.특히 ‘개미’들의 폭풍 매수가 주가를 밀어올리고 있다. 최근 한 달 간 개인은 엔켐을 1820억원 가까이 순매수했다. 이 기간 코스닥 순매수 1위다. 작년 이차전지 투자 열풍을 이끌었던 주식 유튜버 상당수는 엔켐을 ‘신(新) 주도주’로 지목하며 추격매수를 권하고 있다.증권가에선 과열 우려가 나오고 있다. 유진투자증권 한병화 연구원은 “지난 1년간 셀 상위 10개 업체의 주가는 평균 29% 하락했지만 소재 상위 8개 업체는 평균 144% 급등했다”며 “소재업체들의 고객사가 셀 업체라는 점을 감안하면 주가가 정반대로 움직이는 것은 상식적으로 납득하기 힘들다”고 지적했다.국내 이차전지주는 글로벌 전기차 수요 둔화와 리튬 가격 하락의 직격탄을 맞아 작년 고점 대비 주가가 반토막 난 상태다.21일 에코프로 주가는 전일 대비 2.3% 하락한 58만6000원에 거래되고 있다. 이는 작년 7월 장중 최고점(153만9000원)의 반토막이다. 에코프로비엠 역시 작년 고점(58만4000원)의 절반인 24만원대로 내려앉았다. 포스코홀딩스는 작년 고점 대비 43% 빠졌다.다만 지난달 이차전지 양극재 수출 물량이 전월 대비 개선세로 돌아선 것을 들어 이차전지 업황이 바닥을 찍었다는 긍정적 전망도 나오고 있다."
2023-06-26,‘소부장 자립’ 선언 4년… 對日 수입액은 더 늘어,"반도체 장비 국산화율 2%p 증가… 일부 소재는 중국 의존도 커져2019년 7월 일본이 포토레지스트, 불화수소, 플루오린 폴리이미드 등 반도체·디스플레이 핵심 소재 3종에 대한 한국 수출 규제를 강화하는 경제 보복 조치를 내렸다. 당시 문재인 정부는 ‘소부장(소재·부품·장비) 자립’을 선언했다. 이후 4년간 일부 소재를 국산화하는 성과도 있었지만 오히려 대일본 수입액은 크게 늘면서 무역 적자는 심화됐고, 일부 소재는 일본 대신 중국 의존도가 강화된 것으로 나타났다.수출 규제 소재였던 고순도 불화수소는 솔브레인, 이엔에프테크놀로지 등 일부 국내 기업이 국산화에 성공했다. 포토레지스트도 삼성전자와 동진쎄미켐이EUV노광 공정에 사용할 수 있는 포토레지스트를 개발했다. 하지만 국산화 정도는 여전히 미미하다. 지난해 산업통상자원부는 국내 반도체 장비의 국산화율이 20%, 소재는 50%에 그친다고 봤다. 2017년 각 18.2%, 50.3%과 차이가 없었다.25일 본지가 최근 4년간 정부 무역통계를 분석한 결과 지난해 일본에서 수입한 소부장은 무역 분쟁 이전인 2018년보다 오히려 증가하고 무역수지는 악화되고 있다. 2018년 381억달러(약 50조)였던 우리나라의 대일본 소부장 수입액은 2019년 일본이 경제 보복 조치를 단행한 이후 329억 달러로 잠시 주춤했다가 이듬해 340억달러로 반등했다. 지난해는 395억달러로 역대 최대를 기록했다. 이에 따라 대일 소부장 무역 적자는 2019년 186억9000만달러에서 지난해 249억3000만달러로 증가했다.다만 수입국 다변화에는 일부 성공하면서 불화수소의 경우 수출 규제 이전인 2018년 41.9%에 달했던 대일본 수입 비중이 지난해 7.7%까지 떨어졌다. 대신 이 자리를 채운 건 중국이다. 지난해 우리나라의 불화수소 대중국 수입 비중은 80%에 달한다.수출 다변화로 비용도 상승했다. 포토레지스트의 경우 국내 기업들은 일본산 대신 벨기에 소재 일본 합작법인을 통해 우회 조달하기 시작했다. 하지만 벨기에산 소재 수입단가는 일본산의 5.4배에 달했다."
