date,title,content
2022-01-20,"LG엔솔 환불금 100조 풀린다...2차전지주 들썩, 증권사 이벤트도","LG에너지솔루션이 일반 청약에서 114조원 넘는 증거금을 모으며 흥행 역사를 새로 쓴 가운데 이제 시장의 관심은 청약 환불금이 어디로 향할지에 쏠리고 있다. 사진은LG엔솔 청약 첫날인 18일 오전 서울 마포구KB증권 한 지점에서 고객이 대기하는 모습. 연합뉴스114조원. 국내 기업공개(IPO)의 역사를 다시 쓴LG에너지솔루션(LG엔솔) 일반 청약에 몰려든 돈이다. 이제 시장의 관심은 주식 배정이 끝난 뒤 수십조원에 달할 청약 환불금이 어디로 향하느냐로 쏠린다. 환불금이 증시 언저리에서 머물면 미국의 긴축 우려와 기관 매도세 등으로 비실대는 국내 증시에 ‘보약’이 될 수도 있어서다.LG엔솔의 청약금 환불은 오는 21일 실행된다. 배정한 물량만큼의 금액을 제외한 증거금이 반환된다. 균등 배정에 신청한 경우 1주(공모가 30만원) 안팎을 받을 것으로 예상되는 만큼, 150만원의 증거금(최소 청약주수인 10주 가격의 절반)에서 주식 수만큼 가격을 제한 금액을 돌려받게 된다.지난 18~19일LG엔솔 일반 청약이 가능한 7개 증권사((KB증권·신한금융투자·대신증권·미래에셋증권·하나금융투자·신영증권·하이투자증권))에 114조1066억원의 증거금이 몰려든 만큼 환불액도 수십조원에서 100조원에 이를 전망이다.19일 서울 영등포구 신한금융투자 본사 영업점을 찾은 시민들이 청약 접수 상담을 받고 있다. 뉴스1LG엔솔로 몰려든 뭉칫돈의 다음 목적지는 어디일까. 시장에 남아 다른 기업 투자로 이어진다면 '2차전지 관련주'가LG엔솔의 수혜주가 될 수 있다는 게 증권가의 전망이다.이재선 하나금융투자 연구원은 “LG엔솔의 경우 파이낸셜타임스스톡익스체인지(FTSE)와 모건스탠리캐피털인터내셔널(MSCI) 지수 조기 편입이 거의 확실시되고 있다”며 “편입 전까지 추종 수요가 생긴다면 교체 매매 수요가 발생하는LG화학과 2차전지 상장지수펀드(ETF)에 들어가 있는 기업의 수급에 우호적일 수 있다”고 말했다.이미 조짐이 나타나고 있다. 전기자동차 및 전자 제품에 필수적으로 들어가는 부품용 소재 관련 기업인 대주전자재료의 주가는 20일 전날보다 9.83% 급등했다.LG화학(6.58%)과 삼성SDI(4.08%), 솔브레인(5.99%), 에코프로비엠(4.12%), 엘앤에프(3.71%) 등의 주가도 줄줄이 상승했다.개인투자자가 꼽은 수혜주도 이런 흐름과 맞닿아 있다. 업비트 운영사인 두나무가 1월 셋째 주 증권 애플리케이션 ‘증권플러스’를 통해LG엔솔 수혜주를 묻는 설문에서 나라엠앤디와 나인테크가 뽑혔다고 20일 밝혔다.3604명이 참여한 이번 조사에서LG화학(분할전)의 핵심 배터리팩 공급사인 나라엠앤디는 69%,LG엔솔에 2차전지 장비를 공급하는 나인테크는 31%의 지지를 받았다.지난해 6월 서울 강남구 코엑스에서 열린 배터리 전문 전시회 '인터배터리 2021'에서 참관객들이LG에너지솔루션 부스를 둘러보고 있다. 연합뉴스오는 27일 코스피 시장에 입성하는LG엔솔이 증시에 성공적인 데뷔를 하면 환불금이 또 다른IPO청약 투자로 이어질 수 있다. 당장 설 연휴가 지난 다음 달 3~4일 현대엔지니어링 일반 청약이 진행된다. 현대오일뱅크와 마켓컬리, 쏘카 등 대어급IPO도 올해 이어질 예정이다.증권사들은 100조원 가량의 환불금을 유치하기 위한 각종 이벤트에 나서고 있다. 신한금융투자는 20일 공모주 환불금 재투자 이벤트를 시작했다. 이번달 공모주 청약을 신청한 고객 중 단기사채나 장외채권, 공모기타파생결합사채(DLB), 신탁 상품 등 금융상품에 투자하면 추첨으로 1만~10만원의 백화점 상품권을 준다.KB증권은 중개형 개인종합자산관리계좌(ISA) 가입한 고객에게 1인당 최대 100만원 한도로 '세전 연 5.0% 특판' 매수 기회를 준다.'KBable발행어음 신규고객 특별 제공 이벤트'도 진행한다. 발행어음 12개월물은 연 3.2%, 발행어음 6개월물은 연 2.8%의 수익률을 제공하고 한도가 다할 때까지 선착순으로 가입을 받는다.114조원에 이르는 자금 이동이LG엔솔 반짝 효과로 그칠 수도 있다.LG엔솔 청약 자금 중 ‘빚투(빚내서 투자)’ 비중도 상당했다고 예상돼서다. 은행권에 따르면 청약 첫날인 지난 18일KB국민·신한·하나·우리·NH농협은행의 마이너스통장 잔액은 50조7200억원으로 전날보다 1조3718억원 급증했다.금리 상승기인 만큼 이자 부담이 커지면서 환불금이 들어오면 바로 대출 상환에 나설 수 있다. 81조원의 증거금이 몰렸던 지난해 4월SK아이이테크놀로지(IET) 청약 당시에도, 5월 초 증거금 환불 이뤄진 뒤 한 달 만에 약 8조원의 대출금이 상환되며 전체 금융권 가계대출이 7년 4개월 만에 처음으로 감소세로 돌아섰다."
2023-06-12,"삼성전자 10% 뛸 때 20% 뛰었다, 소부장 히든 챔피언은…","━반도체 소·부·장 분석국내 증시의 주도주가 달라졌다. 올봄 2차전지 관련주가 시장을 끌고 왔다면 여름엔 반도체 섹터가 새로운 주도주로 떠오르고 있다. 한국거래소가 삼성전자 등 국내 대표 반도체 기업 15곳의 주가를 지수화한 ‘KRX반도체TOP15’ 지수는 최근 한 달 동안 10.4% 뛰었다. 같은 기간 2.1% 오른 코스피에 비하면 수익률이 5배가량 높았다.머니랩은 ‘반도체=삼성전자’라고 생각하는 개인투자자를 위해 반도체 소부장 섹터를 집중적으로 탐구했다. 증권가가 주목하는 반도체 소부장 기업은 반도체 공정에서 핵심 기술을 공급하는 곳이다. 웨이퍼 제작부터 금속 배선까지의 작업을 하는 곳을 전(前) 공정 기업, 그 이후 테스트와 패키징 작업을 담당하는 곳을 후(後) 공정 기업이라고 한다.그래픽=김영희 02@joongang.co.kr머니랩은 증권가에서 적극 ‘매수’ 의견을 제시하는 주요 반도체 전후 공정 기업을 소개한다. 물론 특정 종목을 매수 추천하는 것은 아니라는 점을 분명히 밝힌다.증권가의 관심을 한 몸에 받는 반도체 소부장 기업은 대체로 재무건전성이 매우 우량하다. 머니랩이 올 1분기 보고서를 분석한 15개 기업 중 13곳은 부채비율(부채총계/자본총계)이 100%가 안 된다. 또 현금 유동성을 나타내는 유동비율(유동자산/유동부채)도 12곳이 200%가 넘는다. 반도체 업황 악화에 고금리 환경을 맞았지만, 상당수가 잘 버티고 있다고 짐작할 수 있다.그래픽=김영희 02@joongang.co.kr반도체 소부장 기업의 수익성의 경우 ‘반도체의 겨울’이라 일컬어지는 올해에는 전반적으로 전년 대비 악화할 것으로 예상되는 곳이 많다. 증권업계 예상치를 보면 15곳 중 9곳이었다. 그러나 반도체 업황이 호황 국면에 접어들 것으로 예상되는 내년에는 15곳 모두 영업이익이 반등할 것으로 전망된다.그래픽=신재민 기자shin.jaemin@joongang.co.kr증권가에서 주목하는 기업도 내년도 실적 성장률이 가파른 곳들이다. 한국투자증권은 최선호주로 유진테크를, 차선호주로 피에스케이를 꼽았고,HPSP와 주성엔지니어링도 관심을 기울일 만한 종목으로 삼았다.유진테크는 증착 공정에서 웨이퍼에 금속 박막을 형성하는 장비를 제조하는 기업이다. 올해 매출의 70%는 삼성전자 쪽에서 나오고 있는데 삼성전자의 디램·낸드·파운드리 생산라인 모두에 제품을 공급하고 있다. 채민숙 한국투자증권 연구원은 “내년 이후에는 삼성전자 안에서 점유율을 높인 상태에서SK하이닉스의 장비 투자도 회복하면 이익 증가가 더 크게 나타날 수 있다”고 말했다.그래픽=김영희 02@joongang.co.kr피에스케이는 포토 공정에서 노광 작업을 한 뒤 남은 포토레지스트(PhotoRegist·빛을 쬐었을 때 형질이 변하는 물질) 제거에 쓰이는 드라이스트립 장비 제조사다. 세계 시장 점유율 1위를 기록 중이다. 한국투자증권은 이 회사의 내년도 영업이익이 전년 대비 56.9% 증가할 것으로 전망한다.HPSP는 이온 주입 공정에 쓰이는 고압 수소 가열·냉각(Annealing) 장비를 세계 최초로 개발한 기업이다. 고압 수소를 이용하면 기존과는 다르게 400도 이하의 온도에서 가열·냉각이 가능하다. 고온으로 인한 웨이퍼 손상을 막을 수 있다. 채민숙 연구원은 “고압 수소는 폭발성이 있어 장비 개발이 어렵고, 고객사 인증도 까다롭기 때문에HPSP의 독점력은 상당 기간 지속할 것”이라고 했다.그래픽=신재민 기자shin.jaemin@joongang.co.kr주성엔지니어링은 국내에서 증착 공정에 사용되는 박막 형성 장비ADL을 가장 먼저 개발한 기업이다. 유진투자증권은 이 회사의 내년도 영업이익이 전년 대비 164% 증가할 것으로 예상한다. 이승우 유진투자증권 연구원은 “미국과 대만 지역에 새로운 고객사를 확보하고 비메모리 분야에서 새롭게 장비 매출이 발생하는 등 고객사와 제품 라인업이 계속 확대될 것”이라고 밝혔다.합성쿼츠계의 ‘신흥 강자’로 거론되는 비씨엔씨도 기대주 중 한 곳이다. 조대형DS투자증권 연구원은 “미국 인텔사 쪽에서 발생하는 합성쿼츠의 올해 매출은 전년 대비 5배 이상 성장할 것으로 기대된다”며 “올 하반기부터 본격적으로 실적이 성장할 것”이라고 전망했다. 이 밖에 증권가가 주목하는 기업들로 원익IPS,파크시스템스, 한미반도체, 넥스틴, 티씨케이, 솔브레인 등도 있다.반도체 소부장 기업 주가 흐름은 대체로 삼성전자·SK하이닉스 등과 비슷하게 움직인다는 게 증시 전문가들의 분석이다. 주가 흐름이 비슷하다면 ‘차라리 대장주 삼성전자 주식을 사지, 뭐하러 소부장주에 투자하냐’고 반문할 수도 있겠다. 하지만 주가 반등 국면에서는 시가총액 규모가 작은 소부장주의 반등 폭이 더 클 수 있다. 실제로 지난 한 달(5월 4일~6월 4일) 삼성전자 주가가 10.9% 오를 때,HPSP는 22.5% 상승했고, 비씨엔씨와 한미반도체도 각각 21.3%, 18.4% 올랐다.이승우 연구원은 “올해 반도체 소부장주 대부분은 영업 실적이 좋지 않을 것으로 예상하는 데도 주가가 올랐다”며 “올 연말이나 내년부터 반도체 경기 사이클 전환이 시작될 것이란 기대감이 선반영되기 시작한 것”이라고 설명했다."
2024-12-01,저축은행 절반 3분기 연체율 10% 웃돌아…구조조정 가시화,"금융당국, 이달 2곳에 적기시정조치…인수합병 신호탄 될 수도저축은행중앙회 제공국내 저축은행 중 절반가량의 연체율이 지난 9월말 현재 10%를 웃돈 것으로 나타났다. 부동산 프로젝트파이낸싱(PF) 부실화의 직격탄을 저축은행들이 맞고 있기 때문이다. 금융당국은 건전성이 취약한 저축은행을 중심으로 한 구조조정을 예고하고 있다.1일 저축은행중앙회 공시를 보면, 국내 저축은행 79곳 중 36곳(45.6%)의 연체율이 9월말 현재 10% 이상이다. 안국저축은행이 19.4%(총여신 2176억원)로 연체율이 가장 높고 유니온(16.3%·2676억원)·스카이(15.8%·3983억원)·라온(15.8%·965억원)·드림(15.2%·2845억원)·영진(15.21%·1833억원)·상상인저축은행(15.06%·1조8331억원) 순이었다. 1년 전만해도 연체율이 10%를 웃돈 저축은행은 14곳(17.7%)에 머문 바 있다.또다른 여신건전성 지표인 ‘고정이하여신(부실채권) 비율’이 20%를 웃돈 곳은 4곳이다. 솔브레인저축은행은 부실채권비율이 36.9%로, 비교 대상 저축은행 중 가장 높았다. 총여신 1366억원 중 504억원이 3개월 이상 연체됐거나 돌려받지 못한 채권으로 분류됐다는 뜻이다. 안국(24.8%)·대아(23.7%)·상상인(22.3%)도 모두 부실채권비율이 20%를 웃돌았다. 저축은행중앙회 쪽은 “부동산 시장 및 경기회복 지연으로 연체 지표 관리에 어려움을 겪고 있다. 부실채권 매각·상각 등 자구 노력을 지속하고 있다”고 설명했다.당국도 시장 재편을 위한 발걸음에 속도를 내고 있다. 당장 이달 중 2곳에 대한 적기시정조치를 내릴 예정이다. 앞서 금융감독원은 최근 부실 우려 저축은행에 대한 경영실태평가를 진행한 바 있다. 적기시정조치를 받게 될 저축은행은 당국의 요구 사항을 맞추기 위해 자구노력에 나서게 된다. 자칫 인수&합병 시장에 매물로 나올 수도 있다. 이와 관련 오케이(OK)금융그룹은 이달 중 상상인저축은행에 대한 실사 작업에 들어간다. 상상인저축은행의 3분기 말 기준 국제결제은행 기준 자기자본비율(10.23%)이 금융당국 권고기준(11%)을 밑돈다."
2022-09-07,9월8일 궂긴소식,"◆ 김종선(전 <중도일보> 편집국장)씨 별세: 태원 순태 세태(전 한국수력원자력 품질보증실장) 희태 춘태 인태 주태 옥태씨 부친, 이홍룡 이춘호 이일주(충남 공주문화원장) 임형호(전 한국수자원공사 인사처장) 이태연(전 충남 금산교육장) 황창연(UPC대표)씨 장인, 석소행 김경숙씨 시부=7일 0시40분 대전성모병원. 발인 9일 오전 9시. (042)220-9972.◆ 강선영씨 별세: 이병순씨 남편, 병헌 은주 은숙 은자 은경씨 부친, 김봉석(솔브레인홀딩스 전무) 조재용 최호철 지재성씨 장인=6일 오후 10시5분 연세대세브란스병원. 발인 8일 오전 6시. (02)2227-7556.◆ 김귀녀씨 별세: 김명선(강원도 행정부지사)씨 모친=6일 오후 7시30분 속초보광병원. 발인 8일 오전 8시. (033)633-7444.◆ 전제동씨 별세: 응표 순희 미경 혜경 미희씨 부친, 이재열(전 충남지방경찰청장) 김태환(한국이민정책학회 명예회장) 김민철(문테크 부장) 이하걸(선보정밀 대표) 씨 장인=6일 오후 10시32분 삼척의료원. 발인 9일 오전 7시. (033)570-7450.◆ 김남두(전 멀티캠퍼스 감사)씨 별세: 이재인씨 남편, 영래(에이셀테크놀로지스 마케팅총괄) 희래(<매일경제신문> 경제부 기자)씨 부친=7일 오전 11시30분 강릉아산병원. 발인 9일 오전. (033)610-5981.◆ 황희종(전 순천 매산고 교사)씨 별세: 영상(공군 소령) 은상(부천 역곡초 교사)씨 부친, 이희재(공무원)씨 시부=7일 오후 1시23분 전남 순천 성가롤로병원. 발인 9일 오전 10시. (061)900-4450."
2022-04-29,4월 30일 궂긴 소식,"◆ 서동열(제18대 공군참모총장)씨 별세: 박은덕씨 남편, 주환 주호씨 부친=29일 오후 2시 삼성서울병원. 발인 2일 오전 10시30분. (02)3410-3151.◆ 최일경(선엔지니어링종합건축사무소 부회장)씨 별세: 주송매씨 남편, 성호(경우시스테크 상무·한국사랑나눔공동체 이사) 은영씨 부친, 정현진씨 시부, 방철환씨 장인=29일 오전 0시30분 수원 아주대병원. 발인 1일 오전 8시. (031)219-4581.◆ 고휘영씨 별세: 이정희씨 남편, 동식(<양재미디어> 대표) 동희 동진(TK엘리베이터 본부장)씨 부친, 조재남 김현정씨 시부, 박영수(솔브레인 부사장)씨 장인=29일 오전 6시18분 중앙보훈병원. 발인 1일 오전 8시. (02)2225-1004.◆ 이창오씨 별세: 재호(SK텔레콤 스포츠운영팀 부장) 상아 민아씨 부친=29일 오전 3시 건국대병원. 발인 1일 오전 6시30분. (02)2030-7902."
