date,title,content
2023-05-25,삼성전자와 강남집은 파는 거 아니라더니… [왕개미연구소],"삼성전자, 작년 3월 이후 처음으로 장중 주가 7만원 찍어삼성전자 주식에 대한 개미 호감도도 전년보다 43% 상승“너도 나도 삼성전자 주식 사달라고 증권사에 줄설 때가 아니라, 삼성전자 같은 잡주로 언제 돈 벌겠냐고 2차전지 사라고 욕할 때가 매수 타이밍 아니겠어요.”(투자자 A씨)“작년 이맘때 삼성전자 주가 7만원 깨졌을 때 싸다고 생각해 샀다가 5만원대까지 내려서 마상(마음 상처)이 심했거든요. 그래서 얼마 전 원금되자마자 팔았는데, 칠만전자를 찍었네요. 조금만 버틸 걸...”(투자자 B씨)25일 삼성전자 주가가 14개월래 처음으로 장중 7만원을 찍은 가운데, 개인 투자자들 사이에서 희비가 엇갈리고 있다. 이날 삼성전자는 전날보다 2% 넘게 올라 장중 7만원을 찍었다. 삼성전자 주가가 7만원대에서 거래를 마쳤던 직전 시점은 작년 3월 31일(종가 7만200원)이었다. 전날 미국 뉴욕증시에서 반도체 기업인 엔비디아가 호실적을 발표하면서 시간외거래에서 28% 폭등한 것이 호재였다.이날 오전부터 삼성전자 주식에는 외국계 증권사를 통한 강한 매수세가 쏟아졌고, 종가는 전날 대비 0.44% 오른 6만8800원이었다.이재용 삼성전자 회장이 4월 27일(현지시간) 워싱턴DC미 국무부에서 열린 국무장관 주최 국빈오찬에서 참석하고 있다./연합뉴스✅외국인, 98년 이후 삼성전자 최대 순매수삼성전자 주가 급등으로 웃고 있는 건, 연초부터 삼선전자 주식 사재기에 나섰던 외국인 투자자다. 코로나 이후 지난 2020년부터 3년 연속 삼성전자 주식을 팔기만 했던 외국인은 올해는 180도 달라진 모습을 보이고 있다.25일 한국거래소에 따르면, 연초 이후 24일까지 외국인 순매수 금액(11조3641억원)의 81%가 삼성전자(9조1983억원)를 사는 데 쓰였다. 그야말로 폭풍급 매수다. 만약 이런 기세가 쭉 이어진다면, 1년 기준 역사상 최대 순매수 기록으로 남게 된다. 이전 삼성전자 외국인 순매수 기록은 지난 2009년 4조4000억원이다.삼성전자 외국인 투자자 보유율도 1년여 전 수준도 회복했다. 25일 한국거래소에 따르면, 삼성전자 외국인 보유율은 지난 25일 기준 52.18%로 집계됐다. 외국인 보유율이 52%대에 들어선 건 지난해 3월 이후 처음이다.반면 ‘삼성전자와 강남아파트는 파는 게 아니다’라며 ‘삼전 장투’를 다짐했던 개인들은 올해 7조6000억원 어치 삼성전자 주식을 내다 팔았다. 기관도 같은 기간 1조4000억원 어치 삼성전자 주식을 순매도했다.김동원KB증권 연구원은 “올해 삼성전자에 대한 외국인 순매수 규모는 한국거래소가 통계를 집계한 1998년 이후 최대치”라며 “충분한 반도체 생산능력과 풍부한 현금을 확보한 삼성전자가 이번 반도체 다운사이클 이후 승자가 될 가능성이 높고, 하반기부터 반도체 수급 개선이 이뤄질 것이란 기대감이 거대한 머니무브를 일으켰다”고 말했다. 이밖에 달러 약세, 원화 강세로 외국인 투자자 입장에선 환차익을 기대할 수 있다는 것도 투자 매력을 높였다는 지적이다.박소연 신영증권 이사는 “탈중국 자금이 한국이나 대만 등 여타 신흥국으로 재배분되는 상황에서 지금 당장 업황 개선 기미는 없지만 향후 반도체 경기가 좋아질 것이란 의미에서 선제적인 베팅이 많았던 것으로 보인다”고 말했다.삼성전자 주식에 대한 최근 1년간(2022.5~2023.5) 호감도도 직전 1년에 비해 더 좋아졌다. 25일 조선일보 [왕개미연구소]가 데이터앤리서치에 의뢰해 20만여개 온라인 포스팅을 분석해보니, 최근 1년간 삼성전자 순호감도(긍정 점수에서 부정 점수를 뺀 것)는 42.58%로, 직전 1년(29.88%)에 비해 12.7%포인트 상승했다. 백분율로 환산하면 호감도가 42.7%나 높아진 것이다.개별 종목에 대한 호감도 증가는 향후 주가 방향성이 좋아질 것이라고 예측할 수 있는 신호다. 데이터앤리서치 관계자는 “삼성전자 주식에 대한 온라인 포스팅을 매수와 매도로 나눠 분석해 봤더니, 최근 1년 동안 삼성전자 주식을 사겠다는 글은 직전 1년 전에 비해 6.4% 늘었지만 팔겠다는 글은 14.3% 감소했다”면서 “삼성전자 주가 전망에 대한 투자자들의 인식이 긍정적으로 바뀌었다고 유추할 수 있다”고 말했다.글로벌 경제 상황이 불확실하기 때문에 삼성전자의 양호한 주가 흐름이 계속될 지는 지켜봐야 한다는 의견도 나온다. 홍춘욱 프리즘투자자문 대표는 “금리 인하 가능성이 높아질 때 성장주는 가치주에 비해 뛰어난 성과를 보이는데 이런 측면에서 삼성전자에 매수가 몰리는 것으로 보인다”면서 “한국 반도체 수출금액지수는 구리값에 약간 후행하는 모습을 보이는데, 최근 구리값이 뚝뚝 떨어지고 중국향 수요 기대도 무너지고 있는 만큼 한국 반도체 제품 가격 반등이 지속될 수 있을지는 지켜봐야 한다”고 말했다."
2023-06-21,500대 기업 감사보수 4년 새 2배로 늘어…“신외감법 도입으로 비용 부담 커져”,"작년 국내 500대 대기업의 감사용역 보수가 4년 전과 비교해 100% 이상 증가한 것으로 나타났다. 증가율이 500%를 넘는 기업도 5곳이나 나왔다.21일 기업데이터연구소CEO스코어가 발표한 국내 500대 기업 중 308곳의2018~2022년 감사현황 조사에 따르면, 작년 감사용역 보수액은 2949억4500만원으로 2018년보다 107.9%(1530억9900만원) 증가했다. 같은 기간 감사시간은 179만7471시간에서 272만1213시간으로 51.4% 늘었다.CEO스코어가가 분석한 500대 기업의 최근 5개년 감사 보수 현황 /그래픽=조선디자인랩 이연주감사용역 보수가 2배 이상 늘어난 기업은 195곳(63.3%)이었고, 감사시간이 2배 이상 증가한 곳은 79곳(25.6%)이었다.CEO스코어는 신외감법 시행이 감사보수는 급증하고 감사시간은 그만큼 늘지 않는 현상에 영향을 미쳤다고 분석했다.CEO스코어 관계자는 “기업 감사용역 보수가 자산 성장 폭보다 지나치게 커 과다 지출을 조장한다는 지적이 제기되고 있다”고 했다.2018년 시행된 이른바 ‘신외부감사법’에 따라 기업은 내부회계관리제도에 대해서도 의무적으로 외부 감사를 받아야 한다. 또, 상장사는 일정 기간 정부가 지정한 회계법인을 선임해야 한다. 이후 기업들 사이에선 “감사 법인 선택권이 없고, 감사 기간과 비용도 법인이 정하는 대로 따라야 하는 부담이 늘었다”는 불만이 이어졌다.기업별로는 삼성전자 감사용역 보수가 가장 많이 늘었다. 2018년 44억원에서 작년 84억2400만원으로 40억2400만원(91.5%) 부담이 커졌다. 이어 삼성생명(22억9800만원),SK하이닉스(22억5000만원), 우리은행(22억1400만원), 한국전력(20억5400만원),LG전자(19억5000만원) 등 순으로 증가액이 많았다.감사용역 보수 증가율은 애경케미칼(638.6%)이 가장 높았다. 2018년 7000만원에서 작년 5억1700만원으로 급증했다. 크래프톤(595.8%), 한화손해보험(525.3%), 신영증권(521.2%),GS리테일(500.7%) 등도 감사용역 보수 증가율이 높았다.한편, 작년 4대 회계법인이 벌어들인 감사보수액은 삼일(812억9500만원), 삼정(786억6800만원), 한영(706억800만원), 안진(401억3900만원) 순으로 많았다."
2023-05-23,“드디어 3D 악재 물리쳤다” 버핏도 베팅한 바이재팬 왜 [왕개미연구소],"日 닛케이, 33년 만에 3만1000선 돌파엔저·버핏 효과로 외국인 바이재팬[왕개미연구소]1990년은 동서로 분단되어 있던 독일에서 재통일이 이뤄지고, 이라크가 쿠웨이트를 침공하는 등 국제 정세가 격변하던 시기였다. 일본에선 활활 타오르던 경제가 조금씩 붕괴되는 조짐이 나타나기 시작한 첫 해이기도 했다.닛케이평균은 바로 직전인 1989년에 종가 기준 3만8915.87을 찍으며 사상 최고치를 기록했다. 하지만 연초부터 주가가 조금씩 흔들리더니 연말엔 2만3800선까지 급락했다. 당시 일본 최고 관청인 오쿠라쇼(大蔵省)가 집값 급등 대책으로 부동산 융자 총량 규제를 실시한 것이 영향을 미쳤다. 역대급 거품이 꺼지는 가운데, ‘버블 경제’라는 말이 유행어가 됐다.소련의 공산주의 체제 붕괴에 잇따라 독일 통일이 추진되면서 1989년에 이 장벽은 다 철거되고 브란덴부르크문을 중심으로 한 약간의 부분만 기념물로 남겨졌다. 1989년 베를린 장벽에 모여든 수천 명의 독일 시민들./조선DB그런데 바로 올해 5월, 일본 증시가 기세등등했던 옛 영광을 되찾을 기세다. 지난 22일 일본 닛케이평균은 종가 기준 3만1000선을 돌파했다. 1990년 7월 이후 약 33년 만에 처음이다. 23일 종가는 전날보다 0.42% 하락한 3만957선에 마감했지만, 장중에는 3만1352까지 오르는 등 상승세가 이어졌다.올해 초 2만5700선에서 시작한 닛케이평균은 이날까지 20% 올랐다. 같은 기간 한국 코스피 상승률은 15% 정도다.예상치 못한 주가 상승세에 일본 언론들은 “드디어 일본 주식이 3D 악재를 물리쳤다”면서 놀라움을 감추지 못하고 있다. 3D 악재는 디플레이션(Deflation), 인구감소(Demography), 부채(Debt)의 영어 앞 글자에서 따온 것으로, 일본 증시의 상승을 방해하는 3가지 변수다.✅“없으면 더 위험” 바이재팬 열기“대만보다는 일본에 투자하는 것이 더 편하다(morecomfortablewithinvestmentsinJapanthanTaiwan)”(워런 버핏, 5월 6일 주총에서)올해 일본 증시를 끌어올린 주인공은 워런 버핏과 같은 해외 투자자들이다. 이런 현상은 데이터를 봐도 뚜렷하게 나타난다. 2021~2022년 매도세를 보였던 해외 투자자들은 올해는 4조엔(약 38조원) 가까운 자금을 퍼부으며 ‘바이재팬 모드’다. 반면 최근 2년간 사자 행진을 이어왔던 일본 개인 투자자들은 올해 주식을 팔고 있다.영국 파이낸셜타임스(FT)는 지난 20일 ‘일본이 다시 위용을 되찾은 비결(HowJapangotitsswaggerback)’이라는 기사를 게재했다.FT는 “일본의 1분기(1~3월) 실질 국내총생산(GDP)은 전 분기보다 0.4% 증가해 시장 예상치를 웃돌았다”면서 “4월 물가상승률은 3.4% 올라 중앙은행 물가 목표치(2%)를 13개월째 상회하고 있다”고 말했다.일본 기업들의 실적이 전체적으로 탄탄하고 향후 전망도 밝다는 점, 또 연이은 금리 인상으로 다른 나라는 경제 감속이 우려된다는 점 등도 일본으로 머니무브가 일어나는 배경이다. 글로벌 증시에선 “일본 주식을 보유하지 않는 것이 지금은 리스크”라는 말까지 나온다.편득현NHWM마스터즈 전문위원은 “올해 일본 증시는 엔화 기준으로 20% 이상 급등해 세계 최고 수준의 수익률을 기록 중“이라며 “기업 호실적 같은 소재는 소진되어 추가 상승을 기대하기 어려울 만큼 급등했다는 점은 유의해야 한다”고 말했다. 편 전문위원은 이어 “일본 증시가 더 상승하려면 엔화 강세가 나타나야 하는데, 하반기쯤 예상되는YCC(일본 정부의 금리 통제) 종료가 매수 타이밍일 수 있다”고 덧붙였다.지난 19~21일 열린 히로시마 G7(7국) 정상회의가 성공적으로 마무리되면서 기시다 후미오 일본 총리 지지율은 크게 상승했다. 사진은 지난 19일 G7 정상회의에 참여한 각국 정상들./연합✅높아지는 주주친화 기대감“왜 주가가 이렇게 싼가. 개선 계획을 제출하라”올해 일본에선 이례적인 증시 부양 정책이 등장했다. 바로 도쿄증권거래소가 주가순자산비율(PBR) 1배를 밑도는 상장사들을 대상으로 개선책을 마련하라고 통지한 것이다.PBR은 주당 순자산(장부가격)으로 주가를 평가하는 것이다.PBR이 1배 미만이면 회사를 청산할 때보다 가치가 낮으므로, 주가는 싸다는 의미다.지난달 닛케이신문 보도에 따르면, 일본의 주요 상장사 500곳 중 43%가PBR1배 미만이다. 미국(S&P500) 5%, 유럽(유로스톡600) 24%보다 훨씬 많다.도쿄거래소가 칼을 빼들자,PBR1배 미만인 저평가 기업들을 중심으로 자사주 매입과 배당 확대와 같은 주주 환원책이 쏟아지고 있다. 한국인들에게도 익숙한 브랜드인 시티즌시계(CitizenWatch)는 주주 환원 일환으로 자사주를 매입하고 있는데, 규모가 전체의 25.6%에 달한다. 대규모 자사주 매입에 힘입어 올해 시티즌시계 주가는 37% 상승했다. 이밖에 다이이치생명홀딩스, 미쓰비시상사, 다이닛폰인쇄 등 다수 기업들이 자사주 매입에 동참했다.김학균 신영증권 리서치센터장은 “과거에 벌어둔 게 많지만 미래 성장성이 낮은 기업은 저평가 받고PBR도 낮아지는데 일본 증시가 바로 그런 상황”이라며 “왕년에 벌어둔 뭉칫돈을 능력 없는 기업이 갖고 있기보다는 배당 형태로 나눠주면 주주들의 소득이 되고 결국 사회에 돈이 돌게 된다”고 말했다.✅한국이 배울 점은 없나그런데 한국도 일본처럼PBR1배 미만인 저평가 상장사들이 적지 않다. 23일 한국거래소에 따르면, 이달 기준PBR1배 미만 기업은 코스피와 코스닥 합쳐 약 900곳이다. 비율로 따지면 38%로, 결코 적지 않은 수준이다. 주식시장에 상장만 시켜 놓고 주주 가치 제고는 외면하고 저PBR상태로 방치하는 기업들이 많다는 얘기다. 저PBR기업 증가는 코리아 디스카운트 원인이 되며, 투자자들을 떠나게 한다.한국거래소 관계자는 “일본거래소가PBR1배 미만 기업에 개선책을 요구한 것은 세계적으로 사례를 찾기 힘든 이례적인 것이며 금융시장에선 이해하지 못하는 내용”이라며 “기업의 실제 가치는 시장에서 평가되는 것이 시장 경제이며, 거래소는 기업들이 제대로 된 평가를 받을 수 있도록 정책적 지원이나 홍보를 해나가겠다”고 말했다."
2023-06-05,"실물경기와 괴리 커지는 자산시장, 코주부 계속 웃을까","[조선경제Why] 경기전망 안 밝은데 때이른 반등 이유는지난 2일 서울 중구 하나은행 명동점 딜링룸 전광판에 코스피 지수가 전 거래일 대비 32.19포인트(1.25%) 상승한 2601.36을 나타내고 있다. 코스피가 종가 기준으로 2600선을 넘어선 것은 지난해 6월9일 이후 처음이다./뉴스1지난 2일 코스피가 2601.36포인트로 마감하며 거의 1년 만에 2600선을 뚫었다. 최근 1년간 줄곧 하락하기만 했던 서울 아파트 가격은 5월 넷째 주와 다섯째 주 2주 연속으로 직전 주보다 올랐다. 비트코인과 이더리움 등 주요 가상 화폐 가격도 올 들어 60%씩 뛰었다.3대(大) 투자처인 주식·부동산·가상 화폐 가격이 일제히 오름세다. 급격한 금리 인상 후폭풍으로 실물경제는 침체 국면에 들어섰는데, 코(코인)·주(주식)·부(부동산) 가격은 ‘걱정의 벽(wallofworry·가격이 더 오르기 힘들 것이라는 비관적 전망들)’을 타고 오르며 실물과의 괴리가 점점 더 벌어지고 있다.그래픽=김성규걱정의 벽 타고 오르는 코·주·부작년 말 대부분의 시장 전문가들이 올해 시장을 전망하면서 ‘상저하고(上低下高·상반기에 부진하고 하반기에 회복된다는 뜻)’를 얘기했지만, 전망은 빗나갔다. 코스피는 작년 말보다 16.3% 올랐고, 코스닥은 28%가량 급등했다. 세계 주요국 증시도 비슷한 흐름이다. 미국 S&P500(11.5%), 나스닥(26.5%), 일본 닛케이225(20.8%), 유로STOXX50(14%) 등도 두 자릿수대 상승세를 보이는 ‘상고(上高)’ 형국이다. 위험 자산의 극단에 있는 가상 화폐 상승세는 더 가파르다. 이달 2일까지 비트코인은 64%, 이더리움은 58% 급등했다.지난해 미국 연준을 필두로 각국 중앙은행들이 금리를 빠르게 올리자 위험자산 가격은 일제히 폭락했었다. 그런데 금리 인상 속도가 가팔라져 경기가 식어간다는 각종 징후가 뚜렷해질수록 시장 투자자들은 오히려 반겼다. 경기가 고꾸라지기 직전까지 가면 중앙은행들은 금리 인상을 멈추고 곧 인하에 들어갈 것으로 기대한 것이다. 금리가 곧 내릴 것이라는 기대 속에 금리에 민감한 테크·기술주들이 올해 주가 상승을 주도하는 게 그 방증이다. 올해 S&P500이 10% 이상 올랐지만, 애플·엔비디아·테슬라 등 7개 대형 테크주가 40% 이상 올랐을 뿐 이들을 뺀 나머지 493개 종목 상승률은 1%에 불과하다.고금리 직격탄을 맞았던 부동산 시장도 꿈틀대고 있다. 한국부동산원이 집계한 전국 주간 아파트 가격동향조사를 보면 서울 아파트 값은 5월 넷째 주 0.03%, 다섯째 주 0.04% 등 2주 연속 상승세를 기록했다. 작년 5월 마지막 주를 기점으로 51주 연속 하락세였던 서울 아파트 값 흐름이 바뀌기 시작했다는 평가다. 미국은 상업용 부동산 우려가 여전하지만, 주택가격(S&P 케이스-실러 주택가격지수)은 2·3월 두 달 연속 오르면서 바닥을 찍었다는 평가가 나온다.발 빠른 투자냐, 헛된 기대냐일부에선 금리 인하로 경기가 나아질 것까지 멀리 내다보는 발 빠른 투자란 평가도 나오지만, 한편에선 헛된 기대일 수 있다는 지적도 나온다.뜨거운 금융시장과 달리 실물경제는 침체 초입에 서 있기 때문이다. 6개월 뒤 경기 흐름을 내다 보기 위해 재고, 건설 수주액, 수출입 물가, 구인·구직 비율, 소비자 심리 등을 따져 산출하는 경기선행지수 순환변동치는 2년 전부터 꺾이기 시작했다. 작년 8월부터는 기준점인 100을 밑돌고 있다. 이 지수가 100보다 낮다는 것은 경기 수축 국면이란 뜻이다.주원 현대경제연구원 경제연구실장은 “보복 소비 덕분에 1분기 경기가 일시적인 호조를 보였지만, 현재 우리 경제는 경착륙 시작 국면에 있는 것으로 판단된다”면서 “하반기에도 고금리가 계속돼 가계 구매력이 약화되면 소비의 경기 침체 방어가 한계를 보일 것”이라고 우려했다.제롬 파월 연준 의장, 이창용 한국은행 총재 등 각국 중앙은행 수장들은 ‘곧 금리 인상이 끝나고 인하가 시작될 것’이라는 시장 기대에 찬물을 붓듯 “연내 인하는 없다”는 입장을 밝히고 있다. 유럽중앙은행(ECB)은 6·7월 금리를 연거푸 더 올릴 수 있다는 전망도 나온다.박소연 신영증권 투자전략이사는 “올해 상승을 이끈 반도체와AI(인공지능) 관련주, 국내에선 배터리주 등을 빼면 나머지 종목은 거의 상승하지 않았거나 상승세가 미미하다”면서 “금리 조기 인하 전망이 사라지는 하반기엔 지금 같은 가격 반등이 이어지지 않을 수 있다”고 했다."
2023-04-24,코스닥 개인 순매수액의 44%가 ‘빚투’...“후폭풍 주의”,"개인투자자 일러스트/조선일보지난 달부터 국내 주식시장이 개인투자자들의 매수세로 상승곡선을 그리고 있는 가운데 특히 개인 투자세가 강한 코스닥시장에서 개인투자자 순매수액의 절반 가량이 ‘빚투(빚내서 투자)’인 것으로 나타났다. 한국투자증권이 지난 21일 신용 융자(대출)를 일시 중단한 데 이어 다른 증권사들도 대출 중단을 검토하는 것으로 알려져 투자자들의 주의가 요구된다.코스닥 신용거래융자, 개인 순매수액 44%23일 금융투자협회에 따르면 지난 21일까지 올해 코스닥시장의 신용거래융자 잔고 증가분은 2조7008억원이다. 같은 기간 개인이 코스닥에서 순매수한 금액이 6조1278억원인 점을 고려하면 순매수 금액의 44%가 빚투였던 셈이다.신용 융자란 투자자가 증권사로부터 돈을 빌려 주식을 사고, 해당 주식을 담보로 맡기는 제도다. 주식의 담보 가치가 빌린 돈의 일정 비율(통상 140%) 이하로 떨어지면 증권사가 원금 회수를 위해 주식을 강제로 처분할 수 있다.코스닥시장의 신용거래융자 잔고는 지난해 말 7조 7609억 원에서 올해 들어 꾸준히 오르더니 지난 11일에는 10조원 선을 돌파했다. 21일 기준으로는 10조 461억원으로 코스피의 신용융자잔액(9조 8245억 원)보다 크다. 올해 코스닥의 신용거래융자 잔고가 코스피를 넘어선 것은 지난달 8일로 2020년 11월 17일 이후 2년여 만이다. 코스닥에는 주가가 상대적으로 낮은 중소형주가 몰려 있어 신용 융자 잔액은 통상 주가가 비싼 코스피가 더 크다. 그러나 지난 2019~2020년 같은 증시 활황기에는 중소형 종목 주가가 오르며 코스닥의 신용 융자가 더 많아지기도 한다.그러나 올해는 2019~2020년과도 다르다는 것이 전문가들의 의견이다. 박소연 신영증권 연구원은 “2020년과 2021년 코스닥시장 신용융자 증가액은 개인 순매수대금의 27%, 12.8%에 불과했다”며 “신용융자가 늘긴 했어도 예탁금 증가가 동반된 현금매수가 훨씬 많았다”고 설명했다. 이어 “올해처럼 신용융자 증가액이 개인 순매수대금의 절반을 차지하고 있다는 것은 단기 레버리지 베팅이 코스닥시장 강세에 큰 영향을 미쳤다는 의미”라며 “갑작스럽게 신용융자가 청산되는 상황이 오면 후폭풍이 클 수도 있다”고 했다.'빚투’ 너무 늘자, 증권사 “대출 일시 중단”이처럼 개인들이 신용 대출을 일으켜 투자하는 금액이 커지자 한국투자증권이 지난 21일 대출 일시 중단을 선언했다. 주요 증권사가 신용 융자를 막은 것은 올해 들어 한투가 처음이다.자본시장법에 따르면 자기자본 3조원 이상 증권사는 개인 고객들에 대해 자기자본 규모 이상의 신용 공여를 할 수 없다. 통상 증권사들은 신용 위험을 피하기 위해 법상 기준보다 더 적은 금액을 신용 공여 한도로 설정한다.금투 업계에서는 대형사인 한투가 신용 융자를 중단한만큼 다른 증권사들도 신용 융자 중단을 선언할 수 있다는 전망이 나온다.IBK투자증권도 지난 10일 한국증권금융으로부터 자금을 받아 투자자들에게 대출해주는 유통융자 주문을 중단했다. 키움증권은 신용 대출 시 담보에서 주식이 차지하는 비중을 기존 40~55%에서 30~45%로 낮췄다."
2023-05-08,[부음] 양륭 연세대 생명공학과 명예교수 별세 외,"▲양륭연세대 생명공학과 명예교수 별세,기경자남편상,양현·양진부친상,여재훈장인상,임소영시부상=6일5시30분 신촌세브란스병원, 발인 8일11시, (02)2227-7560▲이신분별세,안민석더불어민주당 국회의원 모친상=7일14시 쉴낙원 오산동탄장례식장, 발인 9일9시30분, (031)966-1009▲이주헌서울시립대 행정학과 교수 별세,유영은남편상,이주호동생상=5일3시 서울성모병원, 발인 9일8시, (02)2258-5940▲이재룡별세,이창호프로 바둑기사 부친상=6일18시40분 전북대병원, 발인 9일7시30분, (063)250-2443▲최준식신영증권 고문 별세,윤석진남편상,최병욱사업·최선영·최성윤미국 거주·최원석미국 거주 부친상,김영석연세대학교 명예교수·배리 딕슨미국 거주 장인상,김명경·리베카최미국 거주 시부상=6일2시34분 신촌세브란스병원, 발인 8일10시20분, (02)2227-7550"
