date,title,content
2024-08-15,"밸류업 공시, 한국은 0.5% 일본 10%…기업들 눈치게임 중 [밸류업 반년]","김병환 금융위원장(왼쪽)이 지난 12일 오전 서울 여의도 한국거래소에서 열린 기업 밸류업 상장기업 간담회에서 발언하고 있다. 연합뉴스정부가 코리아 디스카운트(한국증시 저평가)를 해소하겠다며 내놓은 ‘기업 밸류업(가치제고)정책’이 시행된 지 반년이 지났다. 늘어나는 자사주 소각이나 배당 확대 등 변화의 조짐이 보인다. 하지만 소액주주에게 일방적으로 불리한 기업들의 헐값 합병과 상장 폐지 등 밸류업에 역행하는 움직임도 이어지고 있다. 특히 ‘밸류업 자율공시’를 한 기업은 손가락에 꼽을 정도여서 기업들이 여전히 눈치보기 중이라는 지적이 나온다.정근영 디자이너14일 한국거래소에 따르면 올 들어 지난 8일까지 상장사들의 자사주 매입은 2조5000억원 수준으로 지난해 동기 대비 약 25.1% 증가했다. 같은 기간 현금 배당은 39조8000억원 규모로 5% 소폭 증가했다. 특히 기업들의 자사주 소각은 8조7100억원 규모로 전년 2조800억원보다 무려 318% 늘었다. 기업이 자사주를 소각하면 시중에 유통되는 주식 수가 감수해 기존 주주들의 주식 가치가 커진다. 자사주 소각은 자본금을 줄여 기업의 자기자본이익률(ROE)을 높이는 효과도 있어 강력한 밸류업 방안으로 꼽힌다.하지만 밸류업 정책의 핵심이라 볼 수 있는 ‘밸류업 공시’는 미진한 상황이다. 한국거래소에 따르면 이날 기준으로 밸류업 자율공시를 한 곳은 키움증권·에프앤가이드·콜마홀딩스·메리츠금융지주·신한지주·우리금융지주 등 6개 뿐이다. 조만간 밸류업 공시를 하겠다는 예고공시를 한 기업도KB금융·DB하이텍·HK이노엔·콜마비앤에이치·BNK금융지주·카카오뱅크·KT&G·컴투스 등 8곳에 그치고 있다. 2584(코스피 844개, 코스닥 1740개)개 기업 중 약 0.5%만 공시에 참여한 것이다. 일본에서 4개월 동안 약 10%가 넘는 기업이 밸류업 공시에 동참한 것과 비교하면 저조한 수치다.정근영 디자이너한 운용사 매니저는 “밸류업 공시를 한 기업 중에는 목표 숫자만 제시하고 구체적인 이행 방법 등은 밝히지 경우가 많고, 기존에 발표했던 내용을 재탕한 경우도 보인다”고 말했다.한편으론 일부 변화가 감지된다는 긍정적인 평가도 나온다. 박소연 신영증권 연구원은 “늘어난 자사주 소각이나 배당은 확실히 기업들이 주주환원 분위기를 신경 쓰는 모습”이라며 “소액주주의 목소리가 커진 만큼 주주환원 강화는 거스를 수 없는 흐름”이라고 설명했다.최준철VIP자산운용 대표는 “우리금융지주가 밸류업 공시에서 총 주주환원율을 40% 이내와 40% 초과로 나눠 시나리오별로 주주환원 계획을 세운 점이 인상적”이라며 “기업들이 단기가 아닌 중·장기적 주주환원책을 내고 있는 점도 긍정적인 흐름”이라고 말했다. 일례로 롯데렌탈은 최근 실적발표에서 3년 간 당기순이익을 30% 배당에 쓰고 10%는 자사주 매입 및 소각에 쓰겠다고 밝혔다.한 증권사WM(자산관리)센터 관계자는 “최근 지방 중견 기업들 중에서도 밸류업 설명을 요청하는 곳이 많다”며 “상속이 끝난 기업들은 주가나 기업 평가를 끌어올릴 기회라고 판단하는 것 같다”고 분위기를 전했다.특히 기업들은 밸류업 공시를 하지 않을 경우 투자자들이 배당소득세 분리과세와 저율과세 등 세재개편안의 혜택을 받지 못하다는 점, 밸류업 지수에 포함되지 않을 경우 투자자에게 외면받을 수 있다는 점 등을 민감하게 받아들이고 있다. 금융당국은 코스피와 코스닥을 포함해 최소 100개 이상 기업을 편입시켜 오는 9월 중으로 밸류업 지수를 발표할 계획이다.정은보 한국거래소 이사장이 지난 6월24일 오후 서울 영등포구 한국거래소에서 열린 '상장기업 사내·사외이사 대상 기업 밸류업 설명회'에서 개회사를 하고 있다. 사진 한국거래소다만 높아진 시장의 눈높이와 정책 이행 압박에 부담을 호소하는 기업들도 적지 않다. 김춘 상장사협의회 본부장은 “기업들 입장에선 최소 3년이상의 중장기적인 발표를 해야 하는 만큼 준비 기간도 필요하고, 최근 경기나 기업 업황도 좋지 않아 부담이 큰 게 사실”이라며 “결국 지배주주의 결정이 중요한데, 아직까지는 주가나 기업가치를 올릴 큰 유인을 못 느끼는 것 같다. 변화에는 꾸준한 소통과 설득이 필요한 만큼 시간이 걸릴 수밖에 없다”고 말했다.신장훈 삼정KPMG밸류업지원센터장은 “주주환원은 결국 기업의 현금이 나가는 일이라 것이라 경영진의 공감대가 형성돼야 한다”며 “기업들이 ‘피어 프레셔(Peerpressure·동종기업으로부터 받는 압박)’를 느끼면서도 먼저 공시하거나 공시 이후 내용을 지키지 못해 부정적 평가를 받는 걸 두려워 하고 있다”고 전했다.업계 관계자와 전문가들은 올 하반기부터 밸류업 공시가 본격화할 것으로 전망한다. 한 밸류업 정책 관계자는 “100개가 넘는 기업에 설명을 다녔는데 내년도 사업 계획을 세우는 시점인 4분기에 하겠다는 곳들이 많았다”며 “코스피 200개 기업의 절반 이상이 올해 안에 (공시)하리라 본다”고 말했다.정근영 디자이너이 같은 상황에서 금융당국과 시장은 밸류업 정책을 둘러싼 여야 간 이견에 우려를 나타내고 있다. 밸류업의 실질적인 성패가 달린 세제혜택은 국회 합의 없이는 시행되기 어렵다. 무엇보다 밸류업이 성공하려면 금융당국과 한국거래소 뿐 아니라 기획재정부(세재), 법무부(상법), 고용노동부(퇴직연금), 국민연금(스튜어드십코드) 등 관련 기관의 협력이 필요한데, 컨트롤타워가 보이지 않는다는 지적도 나온다.진성준 더불어민주당 정책위의장이 지난달 30일 서울 여의도 국회에서 정책현안 기자간담회를 열고 ″윤석열 정부의 밸류업 프로젝트 한계를 뛰어넘는 코리아 부스터 프로젝트를 추진하겠다″고 밝히고 있다. 오른쪽은 김남근 의원. 뉴스1이효섭 자본시장연구원 연구위원은 “일본은 밸류업 이행을 위해 총리 직속으로 ‘새로운 자본주의 실현 협회의’를 만들고, 총리가 매달 참석하는 회의를 29번이나 열었다”며 “한국도 밸류업이 차질없이 진행돼 효과를 내려면 대통령실 직속의 컨트롤타워를 만들고 여야가 함께 참여해 논의해야 한다”고 강조했다."
2024-08-22,"[속보] 한은, 기준금리 13연속 동결…올해 성장률 전망은 하향 조정","이창용 한국은행 총재가 22일 서울 중구 한국은행에서 열린 금융통화위원회를 주재하고 있다. 사진공동취재단한국은행이 13회 연속 기준금리를 동결했다.22일 한은 금융통화위원회(금통위)는 서울 중구 본관에서 통화정책방향회의를 열고 기준금리를 현 수준(3.50%)에서 동결한다고 밝혔다. 한은은 지난해 1월 기준금리를 0.25%포인트 인상한 뒤, 1년 7개월째 금리 수준을 묶어두고 있다. 이는 역대 최장 기간 금리 동결이다.이는 최근 집값 상승세와 가계부채 증가세를 고려한 결정으로 풀이된다. 지난 14일 기준 5대 시중은행(KB국민·신한·하나·우리·NH농협은행) 가계대출 잔액은 719조9178억원으로, 이달 들어서만 4조1795억원 늘었다. 한국부동산원에 따르면 지난달 서울 주택(아파트‧연립‧단독주택) 매매가격지수는 전월보다 0.76% 올라, 4년 7개월 만에 가장 큰 상승폭을 나타냈다.이창용 한은 총재는 지난달 기자간담회에서 “금리 인하의 시점에 대해서 잘못된 시그널로 (시장) 기대를 너무 키워 주택 가격 상승을 촉발하는 그런 정책은 하지 말아야 한다는 데에 금통위원 모두 공감했다""고 전한 바 있다. 지난달 금통위 의사록에 따르면 위원들은 ""금리 인하가 경제의 구조조정 노력을 되돌리거나 일부 지역의 부동산 가격 상승을 촉발하는 계기가 되서는 안된다""는 입장을 나타냈다.다만 고금리‧고물가 장기화에 내수 부진이 이어지자 일각에선 한은의 기준금리 인하 필요성도 제기된다. 미 연방준비제도(Fed)의 다음달 기준금리 인하가 가시화하면서 환율 부담도 일부 덜어낸 상황이다. 시장에선 한은이 다음 금통위가 열리는 10월에 금리 인하를 단행할 수 있다고 본다. 조용구 신영증권 연구원은 ”Fed의 9월 금리 인하가 이뤄지면 한은은 내수 부문과 취약 경제주체를 고려해 10월에 한 차례 금리 인하를 단행할 명분과 분위기가 형성될 것“이라고 내다봤다.한은은 이날 수정 경제 전망도 발표했다. 올해 연간 경제성장률을 2.4%로 지난 5월 전망치(2.5%)보다 하향 조정했다. 내년 경제성장률은 2.1%로 내다봤다. 연간 소비자물가상승률은 올해와 내년 각각 2.5%·2.1%로 전망됐다.정근영 디자이너김경진 기자"
2024-08-05,"온갖 악재 한꺼번에 맞았다…코스피 2500선 붕괴, 235조원 증발","40대 직장인 하 모씨는 “8월이 시작하자마자 ‘검은 금요일(2일)에 이어 ‘검은 월요일(5일)’까지 투자금 수천만원이 이틀새 날아갔다”며 “한반도에 전쟁이 난 것도 아닌데 이렇게 허무하게 손실을 보니 역시 국장(한국 주식시장)에는 투자하는 게 아니란 생각이 든다”고 말했다.5일 코스피는 전장 대비 234.64포인트(8.77%) 하락한 2,441.55에 장을 마쳤다. 사진은 이날 여의도KB국민은행 딜링룸 모습. 연합뉴스━R공포K-증시 강타…코스피 ‘최악의 날’‘R(Recession·경기침체)’의 공포가 국내 주식시장을 강타했다. 5일 코스피 지수는 전 거래일 대비 8.77% 하락한 2441.55에 거래를 마쳤다. 하루치 하락률로는 2001년 9월 12일(-12.02%) 이후 5번째, 지수 낙폭(234.64포인트)으로는 사상 최고치다. 그야말로 국내 증시는 ‘최악의 하루’를 보냈다. 오전 중 코스피·코스닥 시장에 사이드카가 발동됐고, 오후엔 양쪽 시장에 모두 서킷 브레이커가 발동됐다. 코스피 시장의 서킷 브레이커는 1998년 도입 이후 6번째, 코스닥은 2001년 10월 이후 역대 10번째다. 대장주인 삼성전자는 전 거래일대비 무려 10.3% 하락하며 7만1400원에 거래를 마쳤다.이날 코스피 시가총액은 약 192조원, 코스닥 시가총액은 약 43조원이 날아갔다. 하루 만에 국내 증시에서 235조원이 증발한 셈이다.국내 뿐 아니라 아시아 증시도 ‘초토화’됐다. 일본 닛케이225와 대만의 가권(자취안) 지수가 각각 12.4%, 8.35%씩 하락했다.0초0초광고 후 계속됩니다.다음 동영상subjectauthor취소온갖 악재 한꺼번에 맞았다…코스피 2500선 붕괴, 235조원 증발중앙일보재생293재생 (space/k)재생01:000:00:00재생 (space/k)재생음소거 (m)음소거00:00/01:00실시간설정전체 화면 (f)해상도자동 480p자막사용 안함재생 속도1.0x (기본)인기 구간 표시해상도자동 (480p)720pHD480p360p270p144p자막설정사용 안함옵션글자 크기배경색재생 속도0.5x1.0x (기본)1.5x2.0x죄송합니다. 문제가 발생했습니다. 다시 시도해 주세요.도움말음소거 상태입니다.도움말라이선스디버그 정보 다운로드고화질 재생이 가능한 영상입니다.설정에서 해상도를 변경해보세요.더 알아보기00:00전문가들은 미국발 경기침체 공포와 빅테크발 인공지능(AI) 거품론이 시장을 연타하면서 ‘패닉 셀링(투매)’이 일어난 것으로 보고 있다. 여기에 이스라엘에 대한 이란의 보복 공격 가능성도 위험 자산 회피 심리에 불을 붙였다. 블룸버그는 이날 “글로벌 주식 하락은 경제 전망, 지정학적 위험, 인공지능에 대한 막대한 투자가 이 기술을 둘러싼 과대 광고에 부응할지 의문에 대한 우려를 반영했다”고 분석했다.직접적인 도화선이 된 건 지난 4일(현시시간) 미국 노동부가 발표한 고용 보고서다. 7월 미국의 실업률은 4.3%로 전월대비 0.2%포인트 올랐다. 이는 2021년 10월(4.6%) 이후 2년9개월 만에 가장 높은 수준이다. 7월 비농업 일자리는 전월대비 11만4000명 느는데 그쳐 시장 예상치(17만6000명)를 크게 밑돌았다. 임금 상승률도 전년대비 4.8% 증가하는데 그쳐 3년 만에 가장 낮은 증가율을 보였다.특히 미국에서 경기침체의 지표로 쓰이는 ‘샴의 법칙(SahmRule)’에 따라 공포감이 더욱 확산했다. 이는 미 연방준비제도(Fed) 이코노미스트였던 클라우디아 샴 박사가 고안한 법칙으로, 미국 실업률의 최근 3개월 평균치가 지난 1년 최저치보다 0.5%포인트 이상 높으면 경기침체에 접어든 것으로 판단하는 이론이다. 세인트루이스 연방준비은행에 따르면 현재 이 수치는 0.53%포인트에 달한다.강현기DB금융투자 연구원은 “미국은 민간소비가 국가 경제의 70%를 차지하고 민간소비의 60%를 임금이 지탱하고 있어 ‘고용→임금소득→소비→고용’이 흔들리기 시작하면 피드백 작용에 의해 고용 시장 악화가 가속한다”며 “이를 통해 볼 때 미국 경기는 침체의 초입에 있고 최근 나타난 주식 시장의 하락은 이제 시작됐다고 봐야 한다”고 전망했다.신재민 기자━엔비디아가 이끈AI칩 생태계 ‘흔들’여기에 엔비디아가 쏘아올린 ‘AI거품론’도 투심을 급속하게 냉각시킨 요소로 꼽힌다. 4일 로이터는 정보기술 “엔비디아가 설계 결함으로 인해 신제품(B200) 출시를 3개월 이상 지연시킬 수 있다. 이는 마이크로소프트(MS), 구글, 메타에도 영향을 미칠 수 있다”고 보도했다. B200은 엔비디아의 H100의 성능을 뛰어넘는 차세대AI칩이다.그동안 엔비디아는 고객사에 대한 납품 실적을 앞세워AI고점 우려를 불식시키며 관련 업종의 주가를 이끌어 왔다. ‘엔비디아가 멱살 잡고 간다’는 말까지 나왔다. 하지만 대장주의 신제품 출시가 늦어지면,MS·구글·메타의AI데이터센터 투자 계획에도 변동이 생길 수밖에 없다. 또 이 제품에 들어갈 5세대 고대역폭메모리(HBM3E)를 공급할 예정인SK하이닉스 등 국내 반도체 생태계도 영향을 받을 수 있다. 이런 우려로 지난 2일 주요 기술주로 구성된 나스닥 지수는 2.43%, 필라델피아반도체 지수는 5.18% 하락했다. 이 여파로 5일 삼성전자는 10.3%,SK하이닉스는 9.87% 하락했다.노근창 현대차증권 리서치센터장은 “엔비디아 신제품 사이클에 대한 불신이 생기자 그동안 경기 흐름과 무관하게 주가가 올랐던 반도체 공급망 기업의 주가가 흔들리기 시작했고, 전체 지수에 영향을 미친 것”이라며 “엔비디아가 2분기 실적발표(28일 예정)에서 시장의 우려를 불식시키기 전까진 반도체 및 한국 증시에 부정적인 영향이 지속할 것”이라고 분석했다.워런 버핏이 이끄는 버크셔해서웨이가 2분기 동안 보유하고 있는 애플 지분을 절반 가까이 팔았다는 소식도 빅테크 투심에 영향을 미친 것으로 보인다. 미국 반도체 기업 인텔 역시 2일 ‘어닝 쇼크’를 기록하며 주가가 50년 만에 가장 큰 폭으로 떨어졌다.김영옥 기자━엔캐리 트레이드 청산, 美 대선…변동성 커질듯이런 와중에 투자자들 사이에선 위험 자산을 회피하려는 성향이 나타나면서 안전 자산인 엔화 가치가 상승하고, 이에 따른 엔캐리 트레이드 청산(저렴한 엔화로 산 해외 자산을 되파는 현상)이 본격화하면서 글로벌 증시 변동성이 커지고 있다는 분석도 나온다. 박소연 신영증권 연구원은 “단기적으로 엔·달러 환율 저점이 글로벌 주식시장의 1차 바닥을 결정하는 변곡점이 될 수 있어 환율을 면밀하게 관찰할 필요가 있다”고 말했다.‘검은 금요일’과 ‘검은 월요일’을 잇따라 겪고 난 시장은 향후 전망도 조심스러운 입장이다. 삼성증권은 이날 단기(3개월) 주식 비중에 대한 의견을 ‘확대’에서 ‘중립’으로 변경하고, 현금 비중을 확대할 것을 제안했다. 유승민 삼성증권 글로벌투자전략팀장은 “경기 침체가 도래할 가능성은 높지 않지만, 미국의 경기 모멘텀이 둔화할 것이라는 우려는 당분간 지속할 것”이라며 “이란·이스라엘도 지난 4월보다는 높은 강도의 군사적 충돌이 우려되는 상황인 데다 미국 대선 혼란도 큰 변동성의 요인”이라고 분석했다.다만 증권가에선 현재 국내 기업의 실적과 향후Fed의 대응 등을 감안할 때 현재의 낙폭은 과도하다는 분석도 나온다. 이경민 대신증권 연구원은 “현재 코스피 지수는 경기 침체 공포 심리의 영향으로 선행PER(주가수익비율)이 초저평가 권역에 진입했다”며 “경기침체 공포가 진정되는 상황에서 연내 세 번 금리 인하 가능성이 유지된다면 증시에는 우호적인 분위기로 전환될 수 있다”고 전망했다. 다만 그는 “미국 공급관리협회(ISM) 서비스업 지수나 신규 실업수당 청구 건수 등 경기침체와 관련한 지표들을 확인해가며 대응해야 한다”고 조언했다.국내 증시가 이례적인 낙폭을 기록하자 대통령실도 긴급 점검에 나섰다. 윤석열 대통령은 이날부터 여름휴가에 들어갔지만 증시 관련 긴급 보고를 받는 등 직접 현안을 챙긴 것으로 알려졌다. 최상목 경제부총리 겸 기획재정부 장관은 6일 오전 ‘F4(Finance4)’라고 불리는 거시경제금융회의를 개최할 예정이다. 회의에는 이복현 금융감독원장, 이창용 한국은행 총재, 김병환 금융위원장이 참석한다. 회의에선 미국 등 주요국 시장 상황을 분석하고, 국내 시장 안정을 위한 대응 방안을 종합적으로 논의할 계획이다."
2024-08-08,쿠팡 분기매출 첫 10조…과징금 탓에 적자 전환,"쿠팡이 지난 2분기 매출 10조원을 돌파했지만, 300억원대 영업적자를 기록했다. 공정거래위원회가 검색 알고리즘 조작 등을 이유로 부과한 과징금 추정액 1630억원을 실적에 반영한 영향이다. 쿠팡은 2022년 3분기 첫 분기 흑자를 낸 이후 8개 분기 만에 다시 분기 적자로 돌아섰다.7일 쿠팡주식회사의 모회사 쿠팡Inc가 미국 증권거래위원회(SEC)에 제출한 2분기 실적 보고서에 따르면, 쿠팡은 매출 10조357억원(73억2300만달러), 영업적자 342억원(2500만달러)를 기록했다. 2분기 평균 환율 1370.44원을 적용한 값이다. 매출은 지난 1분기 9조4505억원(71억1400만달러)보다 2억 달러 이상 늘었고, 지난해 동기보다는 30% 증가했다. 그러나 영업이익은 지난 1분기에 이어 2개 분기 연속 하락세를 이어갔다.거랍 아난드 쿠팡 최고재무책임자(CFO)는 실적 발표 이후 콘퍼런스 콜에서 “이번 분기 판매관리비가 지난해 동기 대비 6%포인트 늘었는데, 파페치 관련 구조조정 비용과 한국 공정위가 조사 결과로 발생한 과징금 추정치 약 1630억원(1억2100만달러)가 반영된 결과”라고 말했다.다만 쿠팡은 기업의 수익성 및 재무건전성을 보여주는 지표인 매출총이익이 지난해 2분기 대비 41% 증가했고, 매출총이익률도 29.3%로 전년동기 대비 3.1%포인트 증가했다고 밝혔다. 분기 영업 적자지만 수익성 개선 흐름은 더 강화됐다는 취지다. 서정연 신영증권 연구원은 “2분기에 쿠팡의 마진 개선이 두드러졌다”며 “다만 신사업 등 비용 부담으로 전년 수준의 영업이익 규모를 회복하는 데는 시간이 걸릴 것”이라고 분석했다.이날부터 기존에 쿠팡의 유료 회원 서비스를 이용해온 고객의 ‘와우멤버십’ 가격이 4990원에서 7890원으로 결제된다. 지난 4월 신규 가입 비용을 올리며 예고한 58% 인상이다."
2024-08-08,"미국 기침하면 털썩, 오를 땐 찔끔…코스피 ‘저평가의 늪’","“미국이 기침을 하면 한국은 감기에 걸린다.”외부 변수에 지나치게 취약한 한국 증시를 가리키는 말이다. 정부가 연초부터 국내 주식시장 활성화 정책을 추진하고 있지만 이달 들어 코스피·코스닥 시장이 급등락을 반복하면서 한국 증시의 근본적인 체질 강화가 시급하다는 지적이 나온다.정근영 디자이너7일 한국거래소에 따르면 이날 코스피는 전일 대비 1.83% 상승한 2568.41에 장을 마쳤다. 코스피는 ‘블랙 먼데이’였던 지난 5일 8.77% 급락했지만 6일 3.3% 상승에 이어 이날도 1%대 상승에 그쳤다. 코스닥 지수 역시 2.14%(748.54) 올라 지난 5일 무려 11.3% 떨어진 지수를 회복하는 데는 역부족이었다. 일본 닛케이지수가 12.4%(5일) 폭락한 뒤 10%(6일) 넘게 뛰고 이날도 상승세를 이어간 것과 대조적이다. ‘오를 때는 찔끔, 내릴 때는 폭삭’이란 국내 증시의 꼬리표가 다시 확인된 셈이다.실제 코스피의 연초 대비 수익률은 8월 7일 종가 기준 -3.8%다. 일본 닛케이지수(5.41%), 대만 가권(자취안) 지수(19.28%)가 연초 대비 플러스 수익률을 기록한 것에 비하면 초라한 성적표다.차준홍 기자전문가들 사이에선 며칠 사이 요동치는 국내 증시가 ‘코리아 디스카운트’(저평가)의 현실을 보여주는 단면이라는 분석이 나온다. ▶낮은 영업이익률 ▶‘밸류업’(기업가치 제고) 기대감 하락 ▶탄탄하지 못한 수급 환경 등이 복합적으로 맞물린 결과라는 지적이다.이남우 한국기업거버넌스포럼 회장은 “시장은 일본·대만·미국이 오를 때 충분히 오르지 못하다가 빠질 때는 또 같이 빠지는데, 회복은 더디면서 (주요국 증시와) 상승률이나 밸류에이션 격차가 더욱 커지고 있다”며 “‘이익의 질’이 좋지 않고 더 근본적으로는 거버넌스(지배구조)가 좋지 않은 기업을 중심으로 더 빨리 (주가가) 빠지는 경향을 보였다”고 진단했다.에프앤가이드에 따르면 2023년 말 기준 국내 기업 영업이익률은 지난 10년간 유가증권시장 상장사의 경우 5.56%→5.39%로, 코스닥 상장사는 4.48%→3.36%로 쪼그라들었다. 이마저도 연도별로 보면 영업이익률에 큰 편차가 있다.김영옥 기자올 초부터 이어진 밸류업 기대감이 실망감으로 바뀐 점도 외국인의 ‘셀 코리아’를 부추기는 요소다. 이찬형 페트라자산운용 부사장은 “기업들이 밸류업에 역행하는 행태를 보이면서 글로벌 증시가 다 같이 빠지는 시기에 (외국인 투자자들이) 주저 없이 주식 처분에 나선 것”이라고 말했다. 두산에너빌리티에서 두산밥캣을 인적 분할한 뒤 두산로보틱스의 완전 자회사로 편입하겠다고 밝힌 두산그룹이 대표적인 사례다. 외국인은 두산그룹이 계열사 재편안을 발표한 직후인 12일부터 이달 7일까지 두산밥캣 주식 약 2390억원어치를 순매도했다.취약한 수급 환경도 장애물이다. 이효섭 자본시장연구원 금융산업실장은 “국민연금은 국내 주식 비중을 줄이고 있고, 퇴직연금은 안전자산으로만 쏠리는 데다 개인들도 단타 위주로만 국내 주식시장에 접근하고 있다”면서 “장기적인 투자 기반이 부족한 것이 국내 증시의 한계”라고 지적했다. 박소연 신영증권 연구원은 “일본과 비교했을 때 한국의 주가 반등이 더딘 이유는 장기 자금 유입이 부족한 신흥국 증시의 한계 때문”이라며 “코리아 디스카운트 해소를 위해서는 중기적으로MSCI선진국 지수 편입이 필요하다”고 강조했다."
