date,title,content
2024-12-31,"신영증권, 올해도 반성문… “중국 기업 약진 간과했다”","올해 주식시장을 마감하면서 한 증권사 리서치 센터가 45쪽짜리 장문 반성문을 써내서 화제가 되고 있다.30일 신영증권 리서치 센터는 김학균 리서치 센터장 등 16명의 연구원 이름으로 ‘2024년 나의 실수’라는 제목의 반성 리포트를 발간했다. 신영증권 리서치 센터는 2년 전부터 매년 시장이나 산업 예측 과정에서 부족했던 점을 돌아보며 실수를 반성하는 리포트를 내고 있다.김학균 센터장은 올해 가장 큰 실수로 중국 기업들의 약진을 간과했다는 점을 꼽았다. 그는 “일본 자동차 업체 혼다와 닛산의 합병 추진과 독일 폴크스바겐의 공격적 구조 조정은 결국 중국차 부상에 대한 자구책으로 볼 수 있다“면서 “중국은 기술 혁신뿐만 아니라 덤핑 공세로도 한국을 압박하고 있다”고 했다.그는 이어 “미국 도널드 트럼프 대통령 당선인의 관세 부과 협박에 맞서기 위해 중국 당국이 의도적으로 용인하고 있는 듯한 위안화 약세도 한국 경제에는 부담”이라고 했다.반도체 업종 역시 중국 기업들의 거센 추격이 연초 전망을 빗나가게 한 요인으로 꼽혔다. 박상욱 반도체 담당 연구원은 “예상보다 메모리 반도체 가격 하락이 가팔랐다”며 “중국을 간과했던 것이 문제”라고 했다. 박 연구원은 “미국의 제재로 중국 반도체 업체의 생산능력이 제한될 것으로 봤지만, 중국 업체의 D램 출하량이 추정치를 웃돌았다”고 했다.박소연 주식 전략 담당 연구원은 “올해 정부의 밸류 업(기업 가치 개선) 프로그램이 연초부터 뜨겁게 달아올랐지만 식는 속도도 빨랐다”며 “중복 상장·배당 기피 등 한국 주식시장에 50년 넘게 누적되어 왔던 문제들을 과소평가한 것 같다”고 반성했다."
2023-12-28,“美 재정폭주·포퓰리즘 예상 못했다” 신영증권의 반성문,"김학균 신영증권 리서치센터장“(투자 전략 수립에서) 금리 인상에 따른 경제 여파는 과도하게 걱정한 반면, 포퓰리즘과 재정 지출의 영향은 과소평가했다.”28일 신영증권 리서치센터가 올해 주식시장을 마감하면서 빗나간 시장 전망에 대한 ‘반성문’ 성격의 보고서를 냈다. 작년에 이어 두 번째다. 김학균 센터장과 13명의 애널리스트는 ‘2023년 나의 실수’란 제목의 42쪽짜리 보고서에 솔직한 자기반성을 담았다. ‘아니면 말고식’ 증권가 리그래픽=양인성포트가 난무하는 상황에서 예측의 정확도를 높이기 위한 애널리스트들의 용기 있는 고백이 눈길을 끌고 있다.보고서를 낸 배경에 대해 김 센터장은 주주서한에서 늘 자신의 실수를 언급하는 워런 버핏 버크셔 해서웨이 회장을 언급하며 “우리가 버핏과 같은 레전드(전설적 인물)는 아니지만, 그렇기에 더욱 그의 태도를 존경하고 배우려고 할 따름이다. 같은 실수를 반복하지 않기 위해 2023년 전망을 복기한다”고 했다.”미국 경제 이렇게 뜨거울 줄이야”김 센터장은 올해 경제 전망에서 가장 크게 어긋난 부분이 미국 경제에 대한 예측이었다고 짚었다. 그는 “경착륙이든 연착륙이든 올해 미국 경제의 둔화가 불가피하고, 그 결과 미국 증시가 다른 증시 대비 초과 수익을 기록하지는 못할 것이라 전망했다”고 했다. 미국 성장률은 1% 초반에 그칠 것으로 봤다.그러나 예측은 빗나갔다. 올해 미국 성장률은 2.4~2.5%쯤으로 전망된다. 증시도 주요 선진국 중 상승세가 가장 두드러진다. 미 나스닥은 44%, S&P500은 25%나 올랐다.그래픽=양인성김 센터장은 “바이든 행정부가 연준(중앙은행)의 긴축 효과를 상쇄하는 공격적 재정 지출을 강행할 수 있다는 상상력을 발휘하지 못했다”며 “코로나 팬데믹 이후 미국에서 정부의 재정 지출을 통제하는 제어 장치가 여야를 막론하고 작동하지 않고 있다는 점을 간과했다”고 했다. 2022년 중간선거에서 ‘작은 정부’를 지향하는 공화당이 하원을 장악했기 때문에 바이든 행정부의 지출에 제동을 걸 것이라고 예상한 게 실수였다는 뜻이다. 그는 “정치와 지정학적 통찰의 중요성이 커지고 있다”고 했다.신영증권 리서치센터가 28일 올해 증시를 되돌아보며 펴낸 보고서.”관성대로 움직이지 않는 시장”다른 애널리스트들도 자신의 분석 영역에서 어떤 판단 미스(실수)가 있었는지 돌아봤다. 중국 담당 성연주 연구위원은 예상보다 하반기 중국 경기가 살아나지 않은 데 대해 “부동산 경기 회복과 금융시장 안정(미국 금리)이라는 두 가지 전제 조건이 틀렸기 때문”이라며 “특히 중국 정부의 부동산 민영기업 구조조정은 예상보다 정말 찐이었다(강도 높았다는 뜻)”고 했다.회사채 시장을 분석하는 이경록 연구위원은 “빠르면 올 1분기 중 강세 전환이 가능할 것으로 봤지만 시장은 2022년 11월 하순부터 훨씬 급속히 회복됐다”며 “시장은 예상했던 것보다 빠르고 격하게 반응한다는 사실을 또다시 경험했다”고 했다.이차전지 시장을 낙관했던 박진수 연구위원은 예상이 빗나간 데 대해 “수요 둔화에 대한 우려가 일부 감지됐음에도 연중 지속됐던 원자재 가격, 소재·배터리 판매 가격 등의 상승 기조가 일정 수준 유지될 것으로 기대했던 탓”이라고 했다.건설 담당 박세라 연구위원은 우려보다 건설주(株)가 선방한 데 대해 “정부의 유동성 지원 대책과 더불어 1·3부동산 대책, 특례보금자리론 대출 실시 등으로 시장이 빠르게 안정화됐다”며 “시장의 대응력 등 동적인 전망에 보다 힘써야겠다”고 했다. 비트코인이 나 홀로 독주하는 가상 화폐 시장에 대해 임민호 연구위원은 “과거 관성대로 비트코인과 다른 가상 자산의 가격이 순차적으로 상승할 것으로 단순화하는 오류를 범했다”고 했다.내년 시장 전망은?이런 교훈을 토대로 한 내년 증시 전망은 어떨까. 신영증권은 코스피가 2300~2730의 박스권에서 움직일 것으로 내다봤다. 김 센터장은 “우리나라는 경기 순환형 종목이 많기 때문에 내년 성장률이 급격히 개선되지 않는 한 박스권에서 등락을 거듭하는 장세가 될 것”이라고 했다.추천 종목으로는 그간 소외됐던 반도체 중소형주와 제약, 의료 관련주를 꼽았다. 미국 증시 투자 전략으로는 “이미 많이 오른 대형 기술주보다는 저평가된 중소형주들이 좀 더 나을 것”이라고 했다."
2024-12-27,"경영난 G마켓… 신세계, 결국 알리바바와 손잡아","알리바바와 합작사 설립하기로그래픽=양진경신세계그룹의 경영 위기를 불러온 원인 중 하나인 이커머스 계열사 G마켓이 실적 부진 끝에 중국 기업 알리바바와 함께 돌파구를 찾는 선택을 했다. 신세계그룹은 26일 알리바바 인터내셔널과 조인트벤처(합작회사)를 설립한다고 밝혔다. 두 회사는 5대5로 출자해 2025년 합작 법인을 설립하는데, 신세계그룹은 G마켓을 현물 출자한다. G마켓은 알리익스프레스 코리아와 함께 새로 만들어지는 합작법인의 자회사로 편입된다.국내 1세대 이커머스 기업인 G마켓은 티메프(티몬·위메프) 사태를 일으킨 것으로 지목된 구영배 큐텐 대표가 지난 2000년 창업했다. 국내 1위 이커머스 기업이었던 G마켓은 2009년 당시 세계 최대 온라인 경매 기업인 이베이에 1조6000억원에 인수됐다. 신세계그룹은 지난 2021년 G마켓을 운영하던 이베이 코리아 지분 80.01%를 3조4404억원에 인수했다. 신세계그룹 역사상 최대 규모 인수였다. 신세계그룹은 온라인 유통 분야까지 세를 확장하기 위해 G마켓 인수에 총력을 기울였지만, 기대와 달리 G마켓은 실적 부진이 계속됐다. 결국 신세계그룹은 G마켓 인수 3년 6개월 만에 G마켓을 떼어내 한국 시장에서 세를 확대하려는 알리바바와 합작 법인을 설립하는 방법을 택했다.그래픽=양진경실적부진 이어진 G마켓2021년 당시 신세계그룹은 G마켓을 인수하며 “신세계그룹이 디지털 그룹으로 전환하는 시발점이 될 것”이라는 포부를 밝혔다. 하지만 G마켓은 신세계 인수 첫해인 2021년 43억원 흑자를 기록한 뒤로는 매년 적자를 기록하고 있다. 2022년 654억원, 작년 321억원 적자를 기록했다. 올해도 3분기까지 341억원 적자를 낸 것으로 나타났다. 유통업계 관계자는 “신세계가 G마켓을 인수할 시점에 이미 쿠팡의 광폭 행보가 본격화했다”며 “이커머스 업계가 모바일 중심으로 재편되고 있는데, G마켓은 시대의 흐름에 빠르게 따라가지 못하며 고전했다”고 말했다.오프라인 유통 국내 1위인 신세계에도 이베이 코리아 인수금 3조4404억원은 적지 않은 부담이었다. 신세계는 자산 매각을 통해 이베이 코리아 인수 대금을 확보한 것으로 알려졌다. 현금과 현금성 자산이 동원됐고, 이마트 가양점, 이마트 베트남 등을 매각해 자금을 확보했다. 이 외에도 부동산 자산을 추가 매각하거나 담보대출을 받은 것으로 알려졌다. 유통 업계 관계자는 “당시에도 신세계가 너무 과한 금액을 주고 인수했다는 말이 나왔다”며 “G마켓을 통해 온라인 유통으로 세를 확대하겠다는 의지가 강했던 것으로 보인다”고 말했다.알리바바와 합작 택한 신세계재계에서는 신세계의 G마켓 인수가 그룹 전체를 흔들어놨다는 평가가 많다. 지난해 이마트는 12년 만에 첫 적자를 기록했다. 이커머스 업체들이 대형 마트 영역으로 여겨졌던 신선 식품 부문까지 사업을 확대하면서 경쟁력에서 밀렸다는 분석이 나왔다. 이커머스 기업들이 득세하는 상황에서 이마트가 야심 차게 인수한 G마켓은 오히려 신세계그룹의 실적 부진을 부채질했다. 지난 3월 서정연 신영증권 연구원은 ‘컬리와 이마트’라는 보고서에서 “이마트는 온라인과 오프라인 중 어느 쪽에 힘을 실어야 할지 여러 해 갈팡질팡하는 모습을 보였다”며 “쿠팡에 대항하고자 G마켓·옥션을 무리하게 인수했지만 물류 통합을 이뤄내지 못하는 바람에 영업권 상각과 손상차손으로 회계 장부를 얼룩지게 만들고 있다”고 지적했다.이마트는 지난 3월에는 창사 이래 처음으로 희망퇴직을 단행했다. 이달에는 두 번째 희망퇴직을 실시했다. G마켓 역시 지난 9월 근속 2년 이상 정규직 직원을 대상으로 희망퇴직을 실시했다. 재계 관계자는 “소비 위축과 불황이 장기화하고 있는 현재의 위기 상황에서 돌이켜보면 신세계가 G마켓을 인수하면서 쓴 돈이 정말 아까울 수밖에 없다”고 말했다.신세계그룹은 지난 6월 G마켓을 이끌 새 대표로 정형권(51) 전 알리바바 코리아 총괄을 영입했다. 정 대표는 중국 최대 온라인 쇼핑몰 기업인 알리바바 그룹의 한국 지사 총괄 겸 알리페이 유럽·중동·코리아 대표를 지냈다. 정 대표가 부임한 지 채 반년이 되지 않아 신세계는 정 대표의 친정인 알리바바와 합작법인을 만드는 결정을 내렸다.신세계그룹은 G마켓을 현물 출자하는 방식으로 알리바바와 합작회사를 설립한다. 출자 비율은 5대5로 같다. 합작회사의 자회사로 들어가는 G마켓과 알리익스프레스 코리아는 현재와 마찬가지로 독립적으로 플랫폼을 운영한다고 한다. 이번 합작을 두고 시장에서는 신세계그룹이 G마켓을 매각하기 위한 사전작업이 아니겠느냐는 반응도 나온다. 신세계그룹은 “G마켓 판매자들은 알리바바의 강점인 글로벌 네트워크를 활용해 전 세계에 새로운 판로가 생기게 된다”며 “판매자들의 거래 규모가 확대돼 규모의 경제를 달성하게 되면 소비자 혜택 확대로 이어지게 될 것”이라고 말했다."
2024-03-15,"100억 주식 상속 ‘아버지 유언장’, 증권사가 지급 거절...무슨 일?","[다시보는 2024 재테크 박람회]15일 오전 ‘조선일보 머니’와 조선닷컴을 통해 ‘다시보는 2024 재테크 박람회’가 공개됐다. 국내 최대 규모 재테크 행사로 자리잡은 이번 박람회는 작년 12월 22~23일 이틀간 서울 대치동 세텍(SETEC)에서 열렸다. 주식·채권·부동산 투자 전략, 절세, 노후 대비, 상속, 자녀 경제 교육 등 다양한 분야에서 국내 최고 전문가들이 혼란스러운 2024년 투자 시장에서 자산을 지키고 불려갈 수 있는 묘안을 제시한 알짜 강연들을 ‘조선일보 머니’를 통해 순차적으로 공개한다이날 공개된 ‘다시보는 2024 재테크 박람회’는 오영표 신영증권 본부장(변호사)이 ‘신탁을 활용한 창의적 상속·증여’를 주제로 강연한 영상이다. 그는 변호사이자 법학박사로 2004년 대우증권(현 미래에셋증권) 사내 변호사를 시작으로 2015년부터 신영증권에서 가족신탁을 담당하며 3000여 명 고객의 상속·증여, 가업 승계를 조언했다.오영표 신영증권 본부장이 작년 12월 '2024 재테크 박람회'에서 강연하고 있다./포토그래퍼 이정림오 본부장은 “돈은 잘 버는 것도 중요하지만 잘 쓰고, 잘 보존하고, 슬기롭게 승계하는 것이 더 중요하다”며 “낭비벽 있는 자녀가 상속 재산을 탕진할까 걱정되거나 평화롭고 안정적인 상속·증여를 원한다면 가족신탁이 필요하다”고 말했다. 가족신탁은 노후 자금 마련, 자산 및 가업 승계, 상속 분쟁 예방, 증여 재산 보존 등을 목적으로 자산을 가진 위탁자와 금융회사·법률가 등 수탁자가 맺는 계약이다. 위탁자가 명의까지 포함해 재산에 대한 일체 권한을 완전히 수탁자에게 맡기는 ‘재산 관리 도구’다.사망 전 남기는 ‘유언장’이 공증을 받았더라도 인정을 못 받는 경우가 발생할 수 있다고 지적했다. 그는 “100억원 상당 주식을 물려준다는 아버지 유언장을 들고 증권사를 찾아갔지만, 증권사가 주식 지급을 거절한 경우도 있었다”며 “돌아가신 분이 마지막에 쓴 유언장만 유효한데 이를 입증하려면 상속인 전원 동의까지 필요하기 때문”이라고 말했다. 유언장은 전산으로 조회가 안되는 등 제도적으로 미미한 점이 많아 집행이 제대로 되지 않는다는 것이다.이 밖에도 바람직한 가족신탁 활용 사례와 50억 자산가가 자녀에게 증여할 때 21억원 가량 세금을 덜 낸 방법 등 보다 자세한 내용은 ‘조선일보 머니’와 조선닷컴에서 영상으로 확인할 수 있다.➡️네이버 등 포털사이트에서 오영표 본부장 강연을 영상으로 보시려면 다음 링크를 복사해서 접속해 보세요.https://youtu.be/Kyl07_dzKoQ"
2022-01-19,"“LG엔솔 청약, 1주라도 더 받자” 대신·하이투자·신영 유리 [왕개미연구소]","19일 오후 4시 마감사상 최대어인LG에너지솔루션 일반투자자 공모주 청약 마지막 날인 19일 오전 서울 영등포구 신한금융투자 본사 영업점을 찾은 시민들이 청약 접수 상담을 받고 있다./뉴스원“어제 청약했는데 다른 증권사가 더 유리해 보여요. 지금 갈아타도 되나요?”(30대 공모주 투자자 이모씨)LG에너지솔루션 청약 마감일인 19일, 단 1주라도 더 받기 위한 막판 눈치싸움이 쳐지고 있다. 온라인 주식 커뮤니티에서는 대출을 조금이라도 더 많이, 더 싸게 받기 위한 팁이 공유되고, 어느 증권사에서 청약해야 유리한 지 실시간 정보를 주고 받는 등 마치 대입 정시 원서 접수일처럼 치열하다.증권업계에 따르면, 이날 오전 11시까지 몰린 돈은 약 57조원, 청약 참여 건수는 311만건에 달했다. 전날 32조원이 몰렸고 이날 오전 1시간 만에 25조원이 들어온 셈인데, 청약 마감 시간(오후 4시)을 고려하면, 종전 청약 증거금 1위인SKIET(81조원)는 가볍게 뛰어넘을 전망이다.여의도 증권맨들은 “대한민국에 이렇게 놀고 있는 돈이 많다니 정말 놀랍다”고 혀를 내두르고 있다. 이날 오전 11시 기준KB증권에 가장 많은 증거금인 30조2500억원이 모였고, 신한금융투자(10조900억원), 대신증권(9조500억원), 미래에셋증권(4조6600억원), 하나금융투자(1조5500억원), 신영증권(8200억원), 하이투자증권(7600억원) 순이다.이날 청약 마감 시간인 오후 4시를 앞두고, 투자자들의 관심은 7개 증권사 중 어디에서 참여하는 것이 가장 유리한가에 쏠려 있다.공모주 투자 전문가 박현욱(필명 슈엔슈)씨는 “청약 당일 계좌 개설이 되지 않는 증권사(대신, 신영, 하이투자)에서 참여하는 것이 그나마 유리하다”면서 “특히 미래에셋증권은 균등 배정이라고 해도 1주도 받지 못할 수 있으니 가급적 다른 증권사로 갈아타는 게 좋다”고 말했다.실제로 이날 오전 11시 균등배정 기준으로 대신증권에서 청약하면 최대 3주, 하이투자증권 2.9주, 신영증권 2.57주까지 기대할 수 있는 반면, 미래에셋증권은 0.35주에 불과해 빈손이 될 확률이 높다. 미래에셋증권은 공모주 청약 물량이 22만주 정도로 적지만 고객 수가 많다 보니 경쟁률이 치열하다고 박씨는 설명했다.따라서 미래에셋증권에서 청약을 신청했다면 지금이라도 다른 증권사로 갈아타는 게 낫다. 19일 오후 4시까지는 A증권사에서 B증권사로 갈아타는 것이 자유롭다.KB증권, 신한금융투자, 미래에셋증권, 하나금융투자의 경우에는 19일 청약 당일에도 비대면 계좌 개설이 가능하다. 기존 청약을 취소한 후에 새로 다시 청약하면 된다. 단 갈아타기 과정에서 중복 청약이 되지 않도록 최종 확인은 필수다.박씨는 이어 “최종 100조원 정도 증거금이 들어올 것으로 예상되는데, 이를 기준으로 해서 1억원 청약 배정 물량을 추정해보면 5~7주(균등배정 0~2주, 비례배정 5주)가 예상된다”면서 “균등 배정도 증권사별로 받을 물량이 차이나는 만큼, 단 1주라도 더 받고 싶다면 잘 따져보는 게 좋다”고 말했다."
2022-12-29,“올해 세가지 오판했다” 한 증권사의 32쪽 장문의 반성문,"신영증권 10명의 애널리스트 반성보고서 내세계 유명 애널리스트들도 올해 줄줄이 ‘낭패’29일 서울 명동 하나은행에서 직원들이 증시 및 환율 지수를 모니터하고 있다. 올해 마지막 거래일인 이날 코스피는 전날보다 44.05포인트(1.93%) 내린 2,236.40에 거래를 마쳤다./연합40년 만의 인플레이션, 아무도 예상 못했던 러시아의 우크라이나 침공 등 예측 불허의 변수들로 출렁인 올해 주식시장을 마감하면서 한 증권사 리서치센터가 32페이지짜리 장문의 반성문을 내놨다.29일 신영증권 리서치센터는 김학균 센터장과 9명의 연구원 이름으로 ‘2022년 나의 실수’라는 제목의 반성 리포트를 발간했다. 김 센터장은 반성문을 낸 이유에 대해 “때로는 맞히고, 때로는 틀리는 게 애널리스트의 일이지만, 지나간 실수로부터 배우지 못하면 앞으로의 전망을 잘할 수 없지 않겠느냐”고 했다.”연준을 잘못봤다”가장 큰 실수는 중앙은행들의 통화 긴축이 장기화될 가능성이 크지 않다고 본 것이라고 했다. 그는 “작년 12월 15일 연방준비제도가 연방공개시장위원회(FOMC) 정례회의에서 기준금리를 동결했고, 올해 말 기준금리는 연 0.75~1% 정도로 예측했다”면서 금리 인상이 이렇게 급격할 줄 몰랐다고 했다. 연준의 실제 행보는 완전히 달랐다. 3월(0.25%포인트 인상)을 제외하고 빅스텝(0.5%포인트 인상) 두 번, 자이언트 스텝(0.75%포인트 인상)은 연속 네 번 단행해 기준금리를 연 4.25~4.5%까지 끌어올렸다.둘째 실수는 러시아가 우크라이나 침공을 감행할 것이라 생각하지 못했던 점을 꼽았다. 셋째는 중앙은행들이 인플레 억제뿐만 아니라 금융 안정도 중요하게 고려할 것이라고 예측했던 점이라고 했다. 그는 “2008년 금융 위기 이후 글로벌 경제는 사상 유례없는 과잉 부채를 경험하게 된 만큼 중앙은행들이 인플레이션 억제뿐 아니라 금융 안정을 중요하게 고려해 인플레이션을 어느 정도 용인할 것으로 봤다”고 했다.해외 유명 애널리스트들도 줄줄이 ‘헛발질’올해 세계 경제를 강타한 글로벌 인플레이션과 그에 따른 중앙은행들의 급격한 기준 금리 인상 행진은 세계 경제 대통령으로 불리는 제롬 파월 연준 의장도 예상하지 못했던 일이다. 그는 작년 7월 “인플레이션은 일시적일(transitory) 것”이라고 했고, 작년 말에도 “2022년 말 물가상승률은 2% 정도일 것”이라고 했지만, 지난달 미국 소비자물가 상승률은 7.1%로 집계됐다. 김 센터장은 “작년 11월 미국의 물가상승률이 6.8%로 높아져 있었고, 물가 상승이 또 다른 물가 상승을 부르는 인플레이션의 속성을 제대로 보지 못했다고 했다.해외에서도 유명 애널리스트들이 올해 줄줄이 큰 곤욕을 치렀다. 대표적인 인물이 마르코 콜라노빅JP모건 수석전략가다.JP모건은 세계 시가총액 1위 금융회사로, 콜라노빅은JP모건의 얼굴이라고 할 수 있는 인물이다. 그는 올 연말 S&P500 지수가 5050포인트까지 오를 것이라는 장밋빛 전망을 했었다. 현재 S&P500 지수는 이보다 25% 낮다.또 다른 유명 애널리스트인 존 스톨츠푸스 오펜하이머 수석투자전략가도 연말 S&P500 지수 전망치를 5300포인트까지 높여 잡았다가 입장을 바꿨다. 두 사람 모두 지금은 비관적 전망을 내놓고 있다. 콜라노빅이 예측하는 내년 말 S&P500 전망치는 4200포인트, 스톨츠푸스는 4400포인트다. 블룸버그통신은 29일 “월가의 대표적인 ‘빅네임’들이 올해 기록적 인플레이션이 시장을 어떻게 뒤집을지 인식하지 못해 잔인한 심판을 받았다”고 보도했다.내년 코스피 2100~2600 예상올해의 학습효과 때문일까. 전문가 중 내년 시장을 장밋빛으로 내다보는 용감한 사람을 찾아보기 어렵다. 대부분의 국내 증권사들은 잘해야 2600포인트 선이 될 것으로 예상한다. 올해보다 10%대 상승하는 수준이라고 보는 것이다.김학균 센터장은 “경제 펀더멘털(기초체력)이 여전히 좋지 않지만, 주가에 이미 상당 부분 반영돼 있기 때문에 2100포인트 밑으로 내려가진 않을 것으로 본다”며 “오히려 상승 동력이 좀 더 세지 않나 생각한다”고 했다. 그는 “(내년에도) 헛스윙이 분명히 또 나올 것”이라며 “매년 한 해를 마무리하는 정례 작업으로 반성문을 낼까 한다”고 했다."
