date,title,content
2023-12-05,현대차·기아 ‘제60회 무역의 날’ 최고 수출탑…구자열 “내년엔 무역 흑자”,"윤석열 대통령이 5일 서울 강남구 코엑스에서 열린 제60회 무역의날 기념식에서 장재훈 현대자동차 대표에게 300억불 수출의 탑을 친수한 뒤 기념촬영을 하고 있다. 연합뉴스현대자동차와 기아가 나란히 역대 최대 수출 실적을 올리며 ‘최고 수출의 탑’을 수상했다.한국무역협회(무협)는 5일 서울 삼성동 코엑스에서 ‘제60회 무역의 날’ 기념식을 열었다. 무역의 날은 지난 1964년 사상 첫 1억 달러 달성을 기념해 제정됐다.올해 기념식 슬로건은 ‘수출입국(輸出立國) 60년, 다시 뛰는 대한민국!’이었다. 구자열 무협 회장은 “우리 수출은 그동안의 부진에서 벗어나 하반기부터 반등의 모멘텀을 되찾았다”며 “내년에는 정보기술(IT) 수요 회복에 힘입어 수출이 안정적인 성장세를 지속하고 무역수지 흑자를 이어갈 것”이라고 전망했다. 이어 “수출의 질적 성장을 위한 노력이 기업 투자와 일자리 창출로 이어져 한국 경제의 선순환을 이루게 될 것”이라고 강조했다.장재훈 현대자동차 사장(왼쪽)과 송호성 기아 사장이 5일 서울 강남구 삼성동 코엑스에서 열린 제60회 무역의 날 기념식에서 '수출의 탑' 수상 후 기념촬영을 하고 있다. 사진 현대차그룹이날 행사에서는 현대차가 최고상인 ‘300억불 수출의 탑’을 받았다. 수출의 탑은 단일 법인의 수출 실적이 신기록을 세울 때 주는 상이다.현대차는 지난해 7월부터 올해 6월까지 310억 달러(약 40조7000억원)어치의 수출을 기록해 전년 대비 29.6% 증가했다. 기아 역시 같은 기간 235억 달러(약 30조9000억원) 수출로 ‘200억불 수출의 탑’을 수상했다. 이번 수상은 현대차가 200억불 수출의 탑, 기아가 150억불 수출의 탑을 각각 수상한 2012년 이후 11년 만이다.이어LG이노텍이 100억불, 삼성SDI가 60억불 수출의 탑을 각각 수상하는 등 총 1704개사가 상을 받았다. 올해 수출의 탑 수상 기업의 91%는 중소기업이었으며, 산업별로는 자동차·2차전지·방위산업·원자력발전 관련 기업의 약진이 두드러졌다.수출 유공자 부문에서는 손보익LX세미콘 대표, 전세호 심텍 회장, 오석송 메타바이오메드 대표, 윤종찬 비엠티 대표이사가 각각 금탑산업훈장을 수훈하는 등 총 596명이 해외 시장 개척과 수출 확대에 앞장선 공로로 정부 포상 및 표창을 받았다. 기업인 80명은 무협 회장 표창을 받았다."
2024-12-25,"증권사들, 4분기 상장사 64% 목표주가 낮춰","‘유상증자’ 이수페타시스 50.1%↓ 가장 큰폭24일 오후 서울 중구 하나은행 본점 딜링룸에서 딜러가 업무를 보고 있다. 연합뉴스증권사들이 4분기 국내 경기 둔화 우려와 트럼프 2기 행정부의 관세 인상 불안감 등을 이유로 상장사 10곳 중 6곳 꼴로 목표주가를 낮춘 것으로 나타났다.25일 금융정보업체 에프앤가이드 집계를 보면, 증권사 3곳 이상이 목표주가를 제시한 281개 종목 중 지난 9월 말에 견줘 20일 현재 목표주가가 하향 조정된 종목이 63.7%에 이르는 179개로 나타났다. 목표주가가 상향 조정된 종목은 100개(35.6%)에 그쳤다. 2곳은 같은 수준을 유지했다.목표주가(목표가격)는 증권분석가가 기업의 내재가치와 시장 여건을 분석하여 일정 기간 안에 도달 가능성이 높다고 생각하는 주가 수준을 말한다.목표주가가 가장 큰폭으로 떨어진 종목은 이수페타시스였다. 평균 목표주가가 지난 9월 말 6만7250원에서 이달 3만3571원으로 50.1% 떨어졌다. 4분기 실적 전망이 나빠진 가운데, 이차전지 소재 기업 제이오 인수를 위한 대규모 유상증자 결정에 투자 위험이 부각된 까닭이다. 케이비(KB)증권은 11월27일 목표가격을 6만원에서 3만1천원으로 낮췄다.화장품 기업인 씨앤씨인터내셔널이 13만5천원에서 8만6429원으로 36.0% 낮아져 하향 조정폭이 두번째로 컸고, 인쇄회로기판업체인 심텍의 목표주가가 3만2천원에서 2만603원으로 35.6% 떨어져 그 뒤를 이었다.목표주가 하락률 상위 10개 종목 중 4개는 반도체 관련 기업, 3개는 화장품 관련 기업이었다. 반도체는 범용 메모리 수요 부진 등에 수익성 악화 우려로, 화장품 업종은 중국 소비 경기 침체와 미국 화장품 수출 정점 통과 우려가 반영된 영향으로 풀이된다.반면에 4분기 들어 평균 목표주가가 가장 큰폭으로 오른 종목은 엔터테인먼트 기업인 디어유로, 9월 말 3만3천원에서 이달 4만5375원으로 37.5% 상향 조정됐다. 비소세포폐암 치료제 ‘레이저티닙'(제품명 렉라자)의 미국 출시에 이어 다른 지역 출시가 기대되는 유한양행의 목표가가 34.4% 올라 뒤를 이었다. 방산주인 한화에어로스페이스는 32%, 현대로템은 25% 올랐다."
2024-03-20,3월21일 궂긴 소식,"◆ 김영진(전 진도그룹 회장)씨 별세: 김영옥씨 남편, 윤주 희주 희진씨 부친, 임효숙씨 시부=19일 오전 7시 서울대병원. 발인 21일 오전 11시30분. (02)2072-2092.◆ 이근실(서울 강북구 샘교회 원로목사)씨 별세, 허영화씨 남편, 창식(정동교회 담임목사) 삼열(연세대 행정학과 교수)씨 부친, 이숙영 최경희씨 시부=19일 오후 8시32분 연세대브란스병원. 발인 22일 오전 6시. (02)2227-7500.◆ 김원범(6·25 참전용사)씨 별세: 태윤(한양대 행정학과 교수) 태준 태석씨 부친, 윤지영 권예리 한준아씨 시부=20일 오전 6시43분 한양대병원. 발인 22일 오전 5시40분. (02)2290-9459.◆ 박영조씨 별세: 곽길자씨 남편, 종운(대한법률구조공단 사무총장) 대운 소영씨 부친=19일 오후 4시40분, 광주 빛장례식장. 발인 22일 오전 8시. (062)452-4000.◆ 서소암씨 별세: 하동평(전 민주통평 고양시 협의회장) 동현(전 현대로템 기술연구소 부장) 삼종(전남경찰청 감찰계장)씨 모친=20일 오전 4시20분, 국민건강보험공단 일산병원. 발인 22일 오전 4시. (031)900-0444.◆ 이진호씨 별세: 전경숙 혜숙 원배(심텍 경영지원센터장·전무)씨 모친, 송인협 최용규(전 서울신문 논설위원·전 대전시 정무수석비서관)씨 장모=19일 오후 6시48분 대전성모병원. 발인 21일 오전 10시. (042)220-9980."
2024-11-10,상장사 셋 중 한 곳 ‘어닝쇼크’…내년 ‘3년 연속 세수결손’ 비상,"서울 하나은행 본점 딜링룸 모습. 연합뉴스기업들의 3분기 실적 발표가 막바지 수순에 접어든 가운데, 현재까지 실적을 내놓은 상장사 3곳 가운데 1곳이 ‘어닝쇼크’를 기록한 것으로 나타났다. 3년 연속 법인세수 결손이 가시화되고 있다는 지적이 나온다.상장사 3곳 중 1곳 어닝쇼크10일 금융정보업체 에프앤가이드 자료를 보면, 증권사 3곳 이상이 실적 추정치(전망치)를 내놓은 코스피·코스닥 상장사 가운데 지난 7일까지 3분기 연결 실적을 발표한 기업은 모두 165곳이다. 이 가운데 57곳(34.6%)의 영업이익이 추정치를 10% 이상 밑도는 ‘어닝 쇼크’를 기록했다. 어닝쇼크는 아니더라도 영업이익이 전망치보다 낮게 나온 기업은 30곳(18.18%)이며 적자 확대 또는 적자 전환한 기업은 15곳(9.09%)이다.반면, 시장 추정치를 넘는 영업이익을 낸 상장사는 63곳(38.18%)에 그쳤다. 이 가운데 36곳(26.67%)만이 전망치를 10% 이상 웃도는 ‘어닝 서프라이즈’를 나타냈다. 이에 따라 조사대상 상장사 165곳의 3분기 영업이익 실적치와 추정치는 각각 47조2353억원, 50조1516억원으로 그 차이가 약 2조9천억원(5.8%) 남짓 났다. 어닝 쇼크를 기록한 상장사 57곳만 좁혀보면 실적치와 추정치 간 차이는 약 3조4천억원(20.6%)에 이른다.영업이익 실적치와 추정치 간 가장 큰 차이를 보인 기업은 반도체 관련 상장사였다. 반도체 및 통신기기용 인쇄회로기판(PCB)를 만드는 심텍(-95.9%)이 조사 대상 상장사 중 실적치와 추정치 간 괴리가 가장 컸으며 시총 1위인 삼성전자도 괴리율이 14.7%에 이르렀다. 원익머트리얼즈(-33.7%)와 해성디에스(-42.4%) 등 반도체 관련 기업의 실적 괴리도 두 자릿수에 이르렀다. 추정치(187억원)보다 92.7% 작은 14억원의 영업이익을 낸 포스코퓨처엠 등 이차전지 소재 업체들도 실적 괴리율이 높았다. 에코프로비엠과 엘앤에프도 적자가 예상보다 확대됐다.내년에도 법인세수 비상조사대상 상장사 중 3분의 1이 어닝쇼크를 기록하고 절반 남짓(약 62%)의 실적이 예상치를 밑돈 것으로 나타나면서 당장 내년 법인세수에 비상이 걸렸다는 평가가 나온다.정부는 지난 9월 국회에 제출한 ‘2025년 예산안’에서 내년에 걷힐 법인세수를 88조5천억원으로 추산한 바 있다. 이는 올해 법인세수가 약 15조5천억원 결손이 날 것으로 보고 재추계한 추정값(약 62조2천억원)보다 약 26조3천억원 더 많다. 반도체 등 주요 기업이 속한 업종의 경기가 급반등할 것으로 기대하고 세수 전망을 올려잡은 셈이다.이런 까닭에 상장사들의 3분기 실적 부진은 내년 법인세수도 정부 예상보다 덜 걷힐 공산이 커 보인다. 특히 상장사들은 상대적으로 사정이 좋은 기업들이라는 점에서 비상장 기업들의 실적은 좀 더 부진한 게 아니냐는 해석이 나온다. 낙관적 경제 전망과 그에 따른 세수 결손, 나아가 파행적 재정 운용이 내년에도 되풀이될 가능성이 높아지고 있다."
2022-07-12,정보통신기술 강국? 삼성·하이닉스 빼면…,"세계 100대ICT기업 2곳뿐SDI·네이버·카카오 200위권하드웨어→소프트웨어 중심 이동조 바이든 미국 대통령이 2021년 4월12일(현지시각) 백악관에서 화상으로 열린 ‘반도체와 공급망 회복에 관한 최고경영자(CEO) 정상회의’에서 반도체 웨이퍼를 들어 보이고 있다. 워싱턴/AP연합뉴스세계 100대 정보통신기술(ICT) 기업 중 한국 기업은 2개뿐이며 하드웨어 쏠림 현상이 뚜렷한 것으로 나타났다.12일 전국경제인연합회(전경련)가 글로벌 기업분석 데이터베이스 에스앤피캐피털(S&PCapitalIQ)을 기반으로 조사한 결과를 보면, 시가총액 기준으로 세계 100대ICT기업 중 국내 기업은 삼성전자(9위)와 에스케이(SK)하이닉스(56위) 2곳이 포함됐다. 미국 기업이 56개로 가장 많았고, 이어 중국 9개, 일본 8개, 인도 4개, 네덜란드 4개, 대만 3개 업체가 100위권에 올랐다.200대 기업으로 넓혀보면 한국 기업은 삼성에스디아이(114위), 네이버(120위), 카카오(133위) 등이 포함됐다. 중국은 27개, 일본 17개, 대만 6개가 200위권에 올랐다.반도체 업종만 따져보면 세계 100대 기업에 한국은 에스케이하이닉스(11위)와 에스케이스퀘어(63위) 2개사가 올랐다. 에스케이스퀘어는 에스케이하이닉스의 모회사인 투자기업이다. 기술 하드웨어 업종으로 분류되는 삼성전자를 포함하면 3개사다. 반도체 업종 100대 기업에 중국은 41개, 미국은 31개, 대만은 15개 기업이 이름을 올렸다. 200위권으로 넓히면 디비(DB)하이텍(132위), 리노공업(140위), 엘엑스(LX)세미콘(153위), 심텍(185위) 등이 포함됐다.세계 100대ICT기업을 업종별로 구분해보면, 반도체 기업이 가장 많았고 이어 앱 소프트웨어, 데이터 서비스, 시스템 소프트웨어,IT컨설팅 업체 순이었다. 통신 기업은 국가 기간산업 성격이 강해 국제 비교의 의미가 떨어져 순위에서 제외했다고 전경련은 밝혔다.상위 5대 업종을 코로나19 발생 이전과 비교해보면, 삼성전자·애플 등 하드웨어·스토리지 업종 순위가 4위에서 9위로 떨어지고, 대신에 어도비·줌 등 시스템 소프트웨어 업종이 그 자리를 차지했다. 시스템 소프트웨어 100대 기업에 한국은 더존비즈온(74위)과 안랩(82위)이 이름을 올렸다. 이 분야에서 미국은 34개, 중국 32개, 이스라엘 6개, 일본 5개 업체가 100위권에 올랐다.전경련은 “코로나19 이후 하드웨어의 시대가 가고 소프트웨어 경쟁력이 높아졌으며 디지털 전환이 가속화되는 추세로 보여진다”며 “한국의 정보통신기술 기업들은 여전히 전자부품과 반도체 등 제조 하드웨어 중심이어서 소프트웨어 경쟁력으로 재편되는 과정에서 그 입지가 줄어들 전망”이라고 밝혔다."
