date,title,content
2023-02-19,BTS 리더도 먼저 갔다…'조선 병풍'에 2030 열광하는 까닭,"아모레퍼시픽미술관 '조선 병풍'전민간, 궁중 병풍, 자수 병풍 51종장승업의 '홍백미도' 압도감 눈길아모레퍼시픽미술관에서 '화성원행도 8폭 병풍'을 보고 있는 관람객들. 사진 이은주 문화선임기자장승업이 그린 '홍백매도'(왼쪽)과 김규진의 '묵죽도'를 보는 관람객. 사진 이은주 문화선임기자'조선, 병풍의 나라 2' 전시가 열리는 아모레퍼시픽미술관 지하 1층 전시장.[사진 아모레퍼시픽미술관]왕실의 권위를 드러내는 '일월오봉도' 병풍을 보고 있는 관람객들. 사진 이은주 문화선임기자지난 18일 오후 1시 30분. 서울 용산 아모레퍼시픽미술관 입구에 10여 명이 줄지어 섰다. 예매 관람객은 입장권을 찾았고, 일부 관람객은 현장에서 입장권을 구매했다. 전시를 보기 위해 미술관 안으로 들어가는 사람들 대부분은 20~30대였다.지하 1층 전시장 안에서 관람객들은 자신이 가져온 블루투스 헤드폰을 머리에 쓰거나 귀에 이어폰을 꽂고 작품 해설을 들으며 전시를 보았다. 미술관 애플리케이션을 다운로드 받아 각자 따로 작품 해설을 듣는 것이다. 이들이 다 같이 마주한 것은 조선 시대 병풍, 지난달 26일 개막한 '조선, 병풍의 나라 2' 전시 현장이다.2018년에 열린 '조선, 병풍의 나라'에 이어 5년 만에 열리고 있는 후속 전시에 젊은 관람객이 몰리고 있다. '미술애호가'로 유명한 방탄소년단(BTS) 리더RM은 개막 1주차에 전시장을 찾았고, 대학생과 회사원은 물론 심지어 10대 고교생까지 줄이어 전시를 찾고 있다. '고미술=어르신용'이라는 통념이 깨지고 있다.━개성 넘치는 민간 병풍'백납도 10폭 병풍'(1907) 중 고양이 그림.[사진 아모레퍼시픽미술관]'백수도 10폭 병풍'에 그려진 동물 그림 중 일부. [사진 아모레퍼시픽미술관]청나라 귀족들의 사냥 모습을 담은 '호렵도 8폭 병풍'(18세기), 『삼국지연의』와 『구운몽』의 장면을 묘사한 '고사인물도 8폭 병풍'(19세기 후반~20세기 전반)이 타임머신처럼 관람객을 옛 공간으로 이끈다.━축원과 낙원의 꿈'일월반도도 12폭 병풍' (19세기). 그림 속 복숭아는 길상의 의미다. [사진 아모레퍼시픽미술관]상상 속 궁궐을 그린 '한궁도 6폭 병풍. 나무가 점묘법으로 그려져 있다. [사진 아모레퍼시픽미술관]축원을 담은 궁중 병풍엔 현실보다는 판타지 세상 풍경을 담은 그림이 많다. '곽분양행락도 8폭 병풍'(19세기)가 대표적인 예다. 이 병풍은 중국 당나라 명장 곽자의(697~781)의 생일 연회를 묘사한 것으로, 8폭에 펼쳐진 풍경 자체가 사람들이 꿈꾸는 낙원 그 자체다. 85세까지 장수하며 많은 자식을 거느리고 평생 부귀와 복을 누린 그의 일생은 부귀공명, 수복장생의 상징으로 19세기 궁중 혼례용 병풍으로 쓰였다고 한다. 이국적인 건축물들이 눈에 띄는 '한궁도 6폭 병풍'(19세기 후반~20세기 초) 역시 신선들이 살 것 같은 상상 속 궁궐 풍경이다.1795년 정조가 아버지 사도세자의 묘소가 있는 화성에 행차한 모습을 담은 '화성원행도 8폭 병풍'(19세기 후반~20세기 초), 1902년 고종이 51세가 되며 열었던 4월의 궁중 잔치를 묘사한 그림 '임인진연도 10폭 병풍'은 웅장하고 화려했던 궁중 행사의 모습으로 왕실의 권위를 드러낸다.━관람객 압도하는 장승업 그림이상범의 '귀로 10폭 병풍'의 일부 모습. [사진 아모레퍼시픽미술관]장승업의 '홍백매도 10폭 병풍'(19세기 후반)도 관람객의 탄성을 자아내는 대표 작품 중 하나다. 대담하게 화면을 좌우로 채운 나뭇가지가 꿈틀거리는 생명력과 기개를 보여준다. 근대 병풍 중에선 가로 5m에 육박하는 청전 이상범이 마흔 살에 그린 '귀로 10폭 병풍'(1937)이 압권이다.━폐기물 줄인 전시장가벽을 없애고 일부는 재활용이 가능한 철제 구조물로 작품을 배치한 전시장. [사진 아모레퍼시픽미술관]이번 전시는 미술관 본래 공간을 있는 그대로 드러내고, 작품과 관람객 사이를 최대한 좁힌 공간 디자인도 남다르다. 임시 벽을 전혀 사용하지 않았고, 일부 작품은 아예 공사장에서 쓰이는 철제 구조물을 사용해 선보였다. 폐기물을 줄이기 위한 시도다. 병풍과 진열 유리 사이 간격을 5㎝ 미만으로 줄여 관람객이 병풍 그림의 각 부분을 상세히 볼 수 있게 한 것도 획기적이다.━왜 2030이 열광? 공간, 조명, 디테일그런데도 젊은 관람객이 조선 병풍 전시에 몰리는 현상은 매우 특이하다. 전시장에서 만난 이가연(대학원생)씨는 ""아모레퍼시픽 미술관 전시는 특히 감각적인 조명과 디스플레이로 유명하다""며 ""그런데 직접 와보니 작품 배치가 박물관과는 달리 정말 현대적이어서 놀랐다""고 말했다.실제로 현장에서 만난 관람객들은 미술관 건물 자체의 독특함과 작품의 디테일을 함께 즐길 수 있는 전시 디자인을 큰 장점으로 꼽았다. 이 미술관은 세계적인 건축가 데이비드 치퍼필드(69)가 설계한 아모레퍼시픽 사옥 지상1층과 지하1층에 자리한 것으로, 스펙터클한 공간감을 보여주는 로비부터 관람객을 압도한다. 전시장 규모도 천장 높이가 5m가 훌쩍 넘는 규모에 개방감이 남다르다. 박수연(직장인)씨는 ""이 미술관은 오늘 처음 와봤는데 공간이 굉장히 현대적이어서 놀랐다""며 ""병풍과 함께 새로운 공간을 경험하는 즐거움이 컸다""고 말했다. 서현정(직장인)씨는 ""우리가 흔히 보던 병풍이 아니어서 모두 신기했다. 아주 작은 것도 정교하고 재미있게 표현한 것이 놀랍고 신비스러웠다""고 말했다.편지혜 큐레이터는 ""RM이 오기 전부터 어르신들보다는 젊은 친구들이 압도적으로 많이 오고 있어 놀랐다""며 ""각각 탄성을 자아낼 요소가 있는 작품들, 그리고 병풍을 돋보이게 해주는 전시 디자인이 가장 큰 인기 요인인 것 같다""고 말했다. 편 큐레이터는 이어 ""2030 세대 사이에 레트로·빈티지 풍조에 대한 유행이 전통문화에 대한 관심으로 확장된 것 같다. 새로운 공간과 고미술 전시라는 테마가 그들에게 새롭게 다가간 것으로 보인다""고 말했다. 전시는 4월 30일까지. 유료 관람."
2023-02-03,주력시장 중국 소비 둔화에…K뷰티 작년 ‘창백한 성적표’,"국내 화장품 업계 양대 산맥인LG생활건강과 아모레퍼시픽이 지난해 나란히 부진한 경영 성적표를 받았다. 특히LG생활건강의 매출은 18년 만에 역성장했다. 주력인 중국 시장에서 소비 둔화 직격탄을 맞으면서다.2일LG생활건강은 지난해 매출 7조1858억원, 영업이익 7111억원을 기록했다고 밝혔다. 전년 대비 매출과 영업이익이 각각 11.2%, 44.9% 감소했다. 특히 화장품 사업 실적이 크게 악화했다. 연간 매출은 3조2118억원, 영업이익은 3090억원으로 전년 대비 각각 27.7%, 64.7% 급감했다.그래픽=차준홍 기자cha.junhong@joongang.co.krLG생활건강 관계자는 “중국 내 코로나19가 재확산하면서 현지 영업점과 국내 면세점 등 주요 채널 매출이 부진했다”며 “또 경쟁 심화에 따른 비용 증가, 원자재 상승 여파에 대한 원가 부담 등으로 수익성이 나빠졌다”고 설명했다.아모레퍼시픽그룹은 지난해 4조4950억원의 매출과 2719억원의 영업이익을 거뒀다. 전년 대비 매출은 15.6%, 영업이익은 23.7% 감소했다. 역시 중국 소비 둔화와 국내 면세점 매출 하락 탓이 컸다.다만 4분기 매출만 보면 ‘희망’이 보인다는 의견도 나온다. 주력 계열사인 아모레퍼시픽은 지난해 4분기 매출 1조878억원, 영업이익 570억원을 기록했다. 외형은 전년 동기 대비해 줄었지만, 수익률은 123% 개선됐다.박은정 하나증권 연구원은 “중국 법인의 인건비·감가상각비·마케팅비가 전년 동기 대비 각각 30%·50%·40% 하락하는 등 효율화 효과로 흑자 전환했다”며 “2분기부터 회복되는 관광 수요와 함께 올해 한국·중국·미국·일본 전 지역에서 도약이 기대된다”고 분석했다.두 업체는 올해 글로벌 시장 다각화에 힘을 쏟을 것으로 전망된다. 핵심 지역은 북미다.아모레퍼시픽은 아시아 지역 매출은 하락했지만, 미국·일본·아세안·유럽에서는 견고한 성장세를 이어갔다고 밝혔다. 특히 지난해 북미에서 설화수와 라네즈, 이니스프리 등 주요 브랜드의 전체 매출이 83% 증가했다. 유럽에서는 라네즈의 매출이 37% 늘었다. 4분기만 놓고 보면 북미 매출이 99%, 유럽 매출이 69% 증가해 연간 성장률을 훨씬 웃돌았다.LG생활건강도 최근 문혜영 부사장을 미주 사업총괄로 영입하는 등 북미 시장 공략에 속도를 내고 있다. 문 부사장은 스타벅스·아마존 출신으로 현지에서LG생활건강의 북미 자회사인 더 에이본과 보인카, 더크렙샵 등 전체 사업을 관장할 예정이다."
2023-02-02,"중국 악재에 창백해진 ‘K-뷰티’ 빅2, 반등 카드는 ‘다각화’","국내 화장품 업계 양대 산맥인LG생활건강과 아모레퍼시픽이 지난해 나란히 부진한 경영 성적표를 받았다. 특히LG생활건강의 매출은 전년 대비 –11.2%를 기록해 18년 만에 역성장했다. 주력인 중국 시장에서 소비 둔화 직격탄을 맞으면서다. .실내 마스크 착용 의무화 해제 첫 날인 지난달 30일 오후 서울 시내 백화점을 찾은 시민들이 색조 화장품을 살펴보고 있다. 뉴시스━LG생건 영업이익 ‘반토막’2일LG생활건강은 지난해 매출 7조1858억원, 영업이익 7111억원을 기록했다고 밝혔다. 전년 대비 매출과 영업이익이 각각 11.2%, 44.9% 감소했다. 특히 화장품 사업 실적이 크게 악화했다. 연간 매출은 3조2118억원, 영업이익은 3090억원으로 전년 대비 각각 27.7%, 64.7% 급감했다.LG생활건강 관계자는 “중국 내 코로나19가 재확산하면서 현지 영업점과 국내 면세점 등 주요 채널 매출이 부진했다”며 “또 경쟁 심화에 따른 비용 증가, 원자재 상승 여파에 대한 원가 부담 등으로 수익성이 나빠졌다”고 설명했다.LG생활건강 로고━4분기 아모레 깜짝 실적, 주가도 반응아모레퍼시픽그룹은 지난해 4조4950억원의 매출과 2719억원의 영업이익을 거뒀다. 전년과 비교해 매출은 15.6%, 영업이익은 23.7% 감소했다. 역시 중국 소비 둔화와 국내 면세점 매출 하락 탓이 컸다.그래픽=차준홍 기자cha.junhong@joongang.co.kr다만 4분기 매출만 놓고 보면 희망이 보인다는 의견도 나온다. 주력 계열사인 아모레퍼시픽은 지난해 4분기 매출 1조878억원, 영업이익 570억원을 기록했다. 외형은 전년 동기 대비해 줄었지만, 수익률은 123% 개선됐다.박은정 하나증권 연구원은 “중국 법인의 인건비·감가상각비·마케팅비가 전년 동기 대비 각각 30%·50%·40% 하락하는 등 효율화 효과로 흑자 전환했다”며 “2분기부터 회복되는 관광 수요와 함께 올해 한국·중국·미국·일본 전 지역에서 도약이 기대된다”고 분석했다.아모레퍼시픽 용산 사옥 전경.━중국 의존도 줄이고 시장 다각화두 업체는 올해 글로벌 시장 다각화에 힘을 쏟을 것으로 전망된다. 핵심 지역은 북미다.아모레퍼시픽은 아시아 지역 매출은 하락했지만, 미국·일본·아세안·유럽에서는 견고한 성장세를 이어갔다고 밝혔다. 특히 지난해 북미에서 설화수와 라네즈, 이니스프리 등 주요 브랜드의 전체 매출이 83% 증가했다. 유럽에서는 라네즈의 매출이 37% 늘었다. 4분기만 놓고 보면 북미 매출이 99%, 유럽 매출이 69% 증가해 연간 성장률을 훨씬 웃돌았다. 미국 럭셔리 클린 뷰티 브랜드 ‘타타하퍼’를 인수하는 등 중장기적 성장 동력 마련에도 힘을 쏟았다.LG생활건강도 최근 문혜영 부사장을 미주 사업총괄로 영입하는 등 북미 시장 공략에 속도를 내고 있다. 문 부사장은 스타벅스·아마존 출신으로 현지에서LG생활건강의 북미 자회사인 더 에이본과 보인카, 더크렙샵 등 전체 사업을 관장할 예정이다."
2024-06-11,"[이은주의 아트&디자인] 부산박물관에서 만났다, 우리 곁의 지독한 수집가들","이은주 문화선임기자“모으는 것은 사람의 손으로 만드는 것이 대부분이다.(···)이들 수제품(手製品)에는 보다 아름다운 것, 보다 훌륭한 것을 추구하여 마지않는 집념이 서려 있다. 그리고 꿈이 있고 낭만이 있고 개성이 있고 인생이 있다. 이런 것을 생각하면서 바라보고 만져보고 비교도 해보며 망중한(忙中閑)을 즐기는 것이다.” 오래 전 어느 수집가가 남긴 글을 최근 부산박물관에서 만났습니다. 수집의 즐거움을 이토록 명료하게 표현한 이가 누구인지 궁금하시죠. 고(故) 이병철 삼성 회장입니다. ‘이건희·홍라희 컬렉션’에 앞서 수집의 묘미를 깊이 알고 즐긴 그가 있었습니다.지금 부산박물관(관장 정은우)에서 ‘수집가 전(傳) : 수집의 즐거움 공감의 기쁨’(7월 7일까지, 무료)이 열리고 있습니다. 전시는 고 이병철 회장과 고 이건희 회장은 물론 아모레퍼시픽의 고 서성환 회장과 서경배 회장, 화승의 고 현수명 회장과 현승훈 회장, 눌원문화재단의 신성수 이사장이 평생 수집해온 국보와 보물 10점을 포함해 고미술품 58점을 소개합니다.청자 음각 연화문유개 매병. 12세기 전반, 높이 43㎝, 입지름 6.3㎝, 밑지름 15.3㎝. 현존하는 청자 매병 중 유일하게 뚜껑을 갖추고 있다. 국보. [사진 부산박물관]고 이건희 회장 유족이 국립중앙박물관에 기증한 유물 23점과 리움미술관 소장품 3점, 그리고 아모레퍼시픽미술관이 소장한 백자 달항아리(보물) 등을 한자리에서 볼 수 있습니다.1960년대 ‘기차표 고무신’으로 날린 부산 기반의 화승그룹 부자(父子)의 남다른 수집 열정도 엿볼 수 있습니다. 현수명 회장은 무려 44년 전인 1977년, 자신이 수집해온 단원 김홍도 그림, 추사 김정희의 글씨와 고려청자 등 총 60건(69점)을 국가에 기증하고 세상을 떠났습니다. 그리고 그것은 이듬해 개관한 부산박물관의 귀한 소장품이 되었습니다. 이번 전시에서 고 현 회장이 기증한 백자 대형 항아리(보물)를 볼 수 있습니다.그의 장남 현승훈 회장의 백자 달항아리(부산광역시 유형문화유산)와 청자 음각 연화문 유개 매병(국보) 소장품도 압권입니다. 김환기 화백이 실제로 소장했던 달항아리가 얼마나 아름다운지 이번 전시에서 확인할 수 있습니다. 한편 매병 청자는 당당한 자태와 맑은 비색으로 12세기 고려 청자의 정수를 보여줍니다.동방유량 창업자인 고 신덕균 회장에 이어 사회 공헌을 실천하고 있는 눌원문화재단 신 이사장의 소장품도 ‘국립 박물관’ 급입니다. 1750년의 박문수 초상, 17세기 서예가 허목의 전서 글씨, 예안 김씨 가전 계회도 등이 모두 국가 지정 보물입니다.이번 전시에서 만나는 58점의 작품은 사실상 58개 이야기 그 이상입니다. “아름다운 것, 보다 훌륭한 것을 추구”한 이들에 대한 경외감, “내가 사두면 (문화유산이) 적어도 해외로 유출되지 않을 것”이라는 신념과 열정이 이룬 결실입니다. 미술품 수집가들이 그렇게 우리 곁으로 더 가까이 다가왔습니다."
2022-11-04,엇갈리는 3분기 실적...백화점·편의점·항공 웃고 뷰티는 울었다,"쇼핑 이미지. [사진 픽사베이]올해 3분기 실적에서 업종별 희비가 엇갈렸다. 고물가 속에서도 백화점·마트, 편의점 등은 호실적을 냈고, 코로나19로 어려움을 겪었던 업종 중 항공·여행은 실적이 개선됐지만 뷰티는 부진에서 벗어나지 못했다.━백화점은 패션 중심으로 매출 늘어4일 롯데쇼핑은 올해 3분기 매출 4조133억원, 영업이익 1501억원을 기록했다고 밝혔다. 지난해 3분기와 비교해 매출은 0.2%, 영업이익은 418.6% 늘었다.백화점은 패션 중심으로, 마트는 가공식품·주류 중심으로 매출과 영업이익이 크게 늘었다. 이커머스는 모바일 상품권 등을 강화하며 영업적자를 줄였다. 그러나 하이마트는 가전 시장 침체로 매출과 영업이익이 줄었다.지난 2년간 코로나로 위축됐던 해외 사업장은 정상화되고 있다. 베트남에서만 3분기 마트 48억, 백화점 12억의 영업이익을 기록하는 등 베트남·인도네시아의 마트·백화점이 흑자로 돌아섰다.롯데쇼핑 3분기 실적. 자료 롯데쇼핑최영준 롯데쇼핑 재무본부장은 “3분기 영업이익이 예상치를 상회한 건 주력 사업부인 백화점 외에도 마트·슈퍼·이커머스 등의 고른 실적 회복이 주요 원인”이라며 “향후 국내 경기 침체 우려가 있지만 해외 매장의 추가 실적 개선과 온라인 시장 성장이 기대된다”고 밝혔다.━편의점은 가정간편식·디저트 매출 늘어편의점CU를 운영하는BGF리테일은 올해 3분기 매출 2조557억원, 영업이익 915억원으로 전년 동기 대비 각각 11.9%, 31.7% 늘었다.BGF측은 매출과 영업이익이 늘어난 배경으로 ‘FF(신선식품),HMR(가정간편식), 디저트 매출 증가’와 ‘수익성 높은 우량 신규점 증가’,‘고마진 상품 구성비 증가’를 꼽았다.지난 9월 서울 시내 편의점의 간편식 판매대 모습. 연합뉴스4분기 전략에 대해선 “신성장HMR카테고리를 선제적으로 집중 육성해 시장을 선도할 것”이라고 밝혔다. 5조2000억원 규모의 오프라인HMR시장에서 편의점 채널의 시장 점유율이 늘고 있다는 설명이다.━항공·여행·호텔은 여행객 증가로 회복세코로나19로 큰 타격을 받았던 업종 중에선 항공·여행의 회복세가 뚜렷하다.대한항공의 3분기 매출은 3조6684억원, 영업이익은 8392억원으로 각각 전년 동기 대비 65%, 91% 늘었다. 영업이익은 분기 기준으로 사상 최대다. 고환율·고유가 속에서도 해외 여행객 증가로 실적이 개선됐다.대한항공 측은 “입국 전 코로나 검사 의무 폐지 등 출입국 규정이 완화되면서 해외 여행객이 늘어 여객 매출이 전년 동기보다 338% 증가했다”고 밝혔다. 4분기에도 여객 수요는 늘어날 전망이다. 다만LCC(저비용항공사)는 주력 노선인 일본 노선이 지난달에야 본격적으로 회복하기 시작한 만큼 3분기보다는 4분기에 손실 폭을 크게 줄일 수 있을 거란 전망이 제기된다.하나투어도 영업손실 폭을 줄였다. 3분기 매출은 374억원으로 전년 동기 대비 225% 늘었다. 영업손실은 218억원으로 전년보다 47억원 줄었다. 하나투어의 3분기 전체 송출객은 14만6000명으로 전 분기 대비 124% 늘었다. 코로나 이전인 2019년 3분기의 12% 수준을 회복했다.하나투어 관계자는 “여행 수요가 완전히 회복되진 않았지만 적자 폭이 줄었다”며 “일본 등 여러 국가에서 출입국 관련 제재가 완화돼 4분기에는 실적이 더 개선될 것”이라고 말했다.자료 법무부, 하나투어호텔신라도 3분기 매출이 1조3618억원, 영업이익은 266억원으로 각각 전년 같은 기간보다 41%, 27% 늘었다. 투숙률이 68~83%대로 지난해 같은 기간(48~64%)보다 높아지는 등 ‘호텔&레저’ 부문 영업이익(260억)이 2789% 늘었다. 다만 면세점 영업이익은 6억원으로 97% 감소했다. 4분기에는 면세 수요 변화에 맞춰 수익성을 개선한다는 목표다.━뷰티는 중국 소비 둔화로 매출·영업이익 감소반면 아모레퍼시픽과LG생활건강은 3분기에도 해외 매출의 절반을 차지하는 중국 봉쇄 충격파에서 헤어나오지 못했다.아모레퍼시픽은 올해 3분기 매출 1조218억원, 영업이익 330억원으로 각각 지난해 같은 기간과 비교해 15.9%, 36.2% 줄었다.LG생활건강도 3분기 매출 1조8703억원, 영업이익 1901억원으로 각각 7%, 44.5% 감소했다.양사 모두 올해 초 시작된 중국 봉쇄정책이 3분기에도 지속했다는 점, 원자재 가격 상승과 환율 영향으로 원가 부담이 가중됐다는 점, 면세점 채널이 부진했다는 점 등을 원인으로 꼽는다.두 회사는 중국 대신 북미·유럽·일본 시장을 공략 중이다. 아모레퍼시픽은 라네즈·이니스프리 등의 인기에 힘입어 북미 매출은 97%, 유럽 매출은 60% 늘었다.LG생활건강도 더크렘샵이 미국에서 신제품 출시와 채널 확대로 관심 고객 수를 늘려가고 있다.아모레퍼시픽 3분기 해외실적. 자료 아모레퍼시픽아모레퍼시픽 측은 “중국을 제외한 아시아 시장에서는 설화수·라네즈·이니스프리 등 주요 브랜드가 선전하며 매출이 20% 성장했다”며 “더마(Derma·피부과학)와 웰니스(Wellness·웰빙+피트니스) 등 잠재력 있는 비즈니스를 확장하고 이커머스, 콘텐트, 커뮤니티를 강화해 팬덤을 구축하겠다”고 밝혔다."
2023-11-23,"김웅기·서경배, 세계 200대 컬렉터","김환기의 ‘우주’.[사진 S2A]세계적인 미술전문지 ‘아트뉴스(ARTnews)’가 선정한 세계 200대 컬렉터(미술품 수집가)에 김웅기 글로벌세아 회장과 서경배 아모레퍼시픽 회장 등 한국인 2명이 포함됐다. 22일 아트뉴스에 따르면, 김 회장과 서 회장은 지난해에 이어 2년 연속 이 명단에 이름을 올렸다.김 회장은 2019년 크리스티 홍콩 경매에서 김환기의 ‘우주 5-IV-71 #200’을 당시 환율로 약 132억원(약 8800만 홍콩달러, 구매 수수료 포함)에 낙찰받은 것으로 유명하다. 김 회장이 이끄는 글로벌세아는 서울 영동대로 문화예술공간 S2A를 개관해 지난해 10월 김 회장이 소장한 ‘우주 5-IV-71 #200’을 포함해 김환기 전시 ‘환기의 노래, 그림이 되다’를 연 바 있다.한편 서 회장은 현대미술뿐 아니라 한국 전통 미술을 수집하는 것으로 유명하다. 지난 상반기MZ세대 관람객의 뜨거운 호응을 끌어낸 ‘조선 병풍의 나라 2’ 전시도 서 회장이 이끄는 아모레퍼시픽미술관이 기획했다. 이 전시에는 아모레퍼시픽 소장품을 비롯해 다양한 조선 병풍이 출품돼 눈길을 끌었다.김웅기과거 200대 컬렉터에 선정된 한국인으로는 고(故) 이건희 전 삼성 회장과 홍라희 전 삼성미술관 리움 관장 부부, 전필립 파라다이스 그룹 회장과 최윤정 파라다이스문화재단 이사장 부부, 아라리오갤러리와 미술관의 설립자 김창일 아라리오 회장, 국제화랑 이현숙 회장 등이 있다.한편 올해 선정된 세계 200대 컬렉터 중에는 미국 컬렉터가 102명으로 가장 많았다. 이어 영국(12명), 스위스(11명), 홍콩(8명), 독일(6명), 대만, 중국(각 5명), 싱가포르(4명) 등 순이다. 아트뉴스는 1990년부터 매년 컬렉터와 딜러, 경매 관계자, 큐레이터 등을 상대로 조사해 세계에서 가장 영향력 있는 컬렉터 200인을 선정해 발표해왔다.서경배한국미술품 감정연구센터(대표 이호숙·정준모)는 “여전히 미술 시장의 중심이 미국과 유럽에 있지만, 그 뒤를 따르는 홍콩과 중국 컬렉터도 큰 손을 자랑하고 있다”며 “대만과 싱가포르 컬렉터의 약진이 눈에 띈다”고 분석했다.정준모 대표는 “한국 컬렉터 역량이 국내에만 한정된 것은 국내 미술시장의 영세성, 미술품 수집에 대한 인식 부족과 국가의 정책적인 지원 부족도 원인”이라고 지적했다."
