date,title,content
2022-12-15,[경제계 인사] 고려아연 외,▲고려아연▷부회장 노진수▷사장 박기덕▷임원 권인대 이상근 안영탁 이상훈 김민철 최헌식▲차바이오텍▷사장 이현정▲아이에이치큐(IHQ)▷부사장 정박문 박종철▷전무 정혜전 권오준▷상무 김명래 정진용 김현수
2022-08-08,이젠 청와대서 소파 광고까지…상업적 활용 논란,"iHQ-신세계까사 ‘청와대 소파’ 영상 유튜브 공개신세계까사 “시민 쉼터 제공…홍보 아니야”종합미디어그룹 아이에이치큐(iHQ)가 5일 공개한 숏폼 영상에 청와대에서 신세계까사의 소파를 홍보하는 듯한 문구가 달려 논란이 일고 있다. 신세계까사 제공청와대를 배경으로 신세계그룹 계열 브랜드 소파를 홍보하는 영상이 공개돼 논란이 되고 있다. 윤석열 대통령 당선 뒤 시민에게 개방된 청와대가 상업적 목적으로 활용됐다는 지적이 나온다.신세계까사는 8일 청와대를 비롯한 다양한 시민 문화공간에서 자사의 소파를 이색 체험하는 ‘숏폼’ 형태의 콘텐츠를 공개한다고 밝혔다. 8분 남짓의 영상 콘텐츠는 미디어 엔터테인먼트 그룹 아이에이치큐(iHQ)의 온라인동영상서비스(OTT) 플랫폼인 ‘바바요’가 촬영·제작한 것으로 지난 5일 유튜브에 공개됐다.영상에는 청와대 본관 앞 대정원 인근에 설치된 하얀 소파에 앉아 쉬는 시민들의 모습이 담겼다. ‘대한민국 최초 청와대를 방문한 ○○소파!’라는 홍보 문구도 달렸다. 직접 앉아 본 시민들의 평가를 반영해 ‘이게 바로 구름 소파’,‘구름처럼 포근한 느낌’ 등 편안함을 강조하는 반응도 포함됐다.해당 영상을 공개한 아이에이치큐는 이날 보도자료를 통해 이 영상물을 ‘브랜디드 웹예능’이라고 언급했다. 특정 브랜드를 홍보하는 콘텐츠라는 뜻이다. 개방된 청와대를 상품 홍보 목적으로 활용한 것이다. 아이에이치큐는 문화재청에 촬영 허가를 받을 당시 청와대 개방 의미를 담기 위해 특별한 연출 없이 편안한 가구를 바탕으로 관람객 모습을 관찰 카메라 형태로 담겠다고 설명한 것으로 전해졌다.신세계까사는 시민들의 문화공간에 ‘쉼터’를 제공한 것일 뿐 광고 목적이 아니라고 주장했다. 신세계까사 관계자는 “방송사(iHQ)에서 뜻밖의 장소에서 뜻밖의 쉬는 장소를 만났을 때 사람들이 어떤 반응을 보이는지 힐링 관찰 영상을 찍으면 좋겠다는 제안이 들어와 소파를 협찬한 것”이라며 “상품을 광고하거나 브랜드를 홍보하기 위한 목적은 아니다”라고 말했다.이 영상을 확인한 문화재청은 아이에이치큐 쪽에 해당 콘텐츠를 내려달라고 요청한 상태인 것으로 전해졌다. 신세계까사 관계자는 “시민들의 공간에 휴식 시설을 제공한다는 공적 목적을 인정받아 문화재청에서 촬영허가가 나왔다고 알고 있다”며 “남산과 한강 같은 공간에서도 촬영이 됐는데 첫 번째 편이 청와대라서 오해의 소지가 있었다”고 말했다."
2023-02-28,"“손익분기점 피 마르지만, 장기상영 꿈꿔”…‘다음 소희’의 힘","인터뷰ㅣ제작자 김동하 트윈플러스파트너스 대표영화 <다음 소희> 스틸컷. 트윈플러스파트너스 제공“수연양의 죽음을 헛되이 하고 싶지 않습니다.”김동하 트윈플러스파트너스 대표가 말했다. 옆에 있던 정주리 감독도 “진정성을 갖고 잘해보겠다”고 했다. 묵묵히 듣던 수연양의 부친 홍순성씨가 입을 열었다. “그렇다면 저도 좋습니다. 그런데 딸아이 얘기를 영화로 만들면 재미가 있을까요?” 2021년 전주에서의 대화였다. 고등학교 졸업을 앞두고 대기업 통신사 콜센터에서 현장실습생으로 일하다 2017년 스스로 목숨을 끊은 홍수연양의 실화를 바탕으로 한 영화 <다음 소희>는 그렇게 해서 만들어질 수 있었다.<다음 소희>는 김 대표가 처음 제작한 영화다. 2012년 기자를 그만둘 때 막연히 품었던 바람을 10년 만에 이룬 것이다. 2003년부터 <파이낸셜뉴스>와 <머니투데이>에서 10년을 기자로 일해오면서 그는 업계를 몸소 경험하고 경제 저널리즘을 영화 등 다양한 매체로 풀어내고 싶어졌다. 영화 제작을 염두에 두고 엔터테인먼트사 아이에이치큐(IHQ)에 들어가 최고재무책임자(CFO)를 맡으며 벤처캐피탈 계열사를 통해 영화 투자 일도 했다.영화 <다음 소희>의 제작자 김동하 트윈플러스파트너스 대표. 김정효 기자hyopd@hani.co.kr2012년생 쌍둥이를 키우다 2015년 아이가 하나 더 생기면서 어깨가 더 무거워진 그는 그해 자신의 회사를 세웠다. 쌍둥이를 뜻하는 ‘트윈’,막내를 뜻하는 ‘플러스’,영화인들과의 협업을 뜻하는 ‘파트너스’를 조합해 회사 이름을 지었다. 자신이 이전에 쓴 웹소설 <명동>을 시나리오로 옮겨 영화화하고자 애썼다. 주식시장을 배경으로 돈을 무기 삼아 싸우는 이야기였다. 하지만 생각처럼 쉽지 않았다. 대신 <밀정> <군함도> <극한직업> <기생충> <헤어질 결심> <브로커> 등 다른 영화에 소액이나마 투자하면서 수익을 거뒀다. 지난 23일 서울 마포구 한겨레신문사에서 만난 김 대표는 “벌 때도 있지만 까먹을 때도 많아서 전체 수익은 크지 않다”고 귀띔했다. 경영학 박사 학위를 따고 한성대 미래융합사회과학대학 전임교수로 강의하면서 생계를 유지한다고 했다.김 대표는 영화 제작을 위해 책들을 살펴보다 김유철 작가의 <콜24>를 접했다. 홍수연양 사건을 모티브로 삼은 소설이다. ‘이 사건을 영화로 만들 수도 있겠구나’ 하면서도 ‘쉽진 않겠다’는 생각을 지울 수 없었다. 그래도 포기할 수 없었다. “노동·여성·취약계층·자살·청년취업·지역소외·세대문제 등 여러 가지가 중첩된 한국 사회를 보여준다고 생각했어요. 무엇보다 학생과 노동자 사이, 민간 영역과 공공 영역 사이에서 양쪽 모두로부터 소외된 개인의 이야기라고 봤어요. 경계에 선 취약계층이 한없이 무너져내리는 구조를 들여다보고 싶었죠.”영화 <다음 소희> 스틸컷. 트윈플러스파트너스 제공전작 <도희야>(2014)를 보고 ‘소수자 얘기를 잘하는구나’ 하며 점찍어둔 정 감독에게 연락했다. 흔쾌히 수락한 정 감독은 소설과는 상관없이 실화 자체에 대한 기사와 시사 프로그램 <그것이 알고 싶다>(SBS), 르포 책 <열여덟, 일터로 나가다>(허환주), <알지 못하는 아이의 죽음>(은유), <교복 위에 작업복을 입었다>(허태준) 등을 참고해 독특한 구조의 트리트먼트(영화 얼개를 정리한 글)를 가지고 왔다. 지금의 완성작처럼 현장실습생 소희가 겪는 이야기의 1부와 형사 유진이 소희의 흔적을 쫓는 과정의 2부로 나눈 구조였다. “주변에선 미스터리 구조나 장르물 등 상업영화 모양새로 해야 한다고 조언했지만, 저는 그 트리트먼트가 마음에 들었어요. 어느 한쪽의 잘못으로 몰아가는 게 아니라 경계에 서 있는 주변인의 상황을 여과 없이 보여주면서도 영화적으로 잘 표현한 것 같아서였죠. ‘이대로 갑시다’ 했어요.”정 감독과 <도희야>를 함께했던 배우 배두나가 유진 역에 캐스팅되면서 외부 투자도 받을 수 있었다. 김 대표의 돈 2억3000만원, 영화진흥위원회 독립영화 제작 지원금 2억7000만원에다 한국모태펀드 등 2개 기관의 투자금 약 10억원이 더해졌다. 그렇게 총제작비 15억원으로 영화를 완성했다. 기대 안 했던 칸국제영화제에 초청돼 호평받고, 미약하나마 국외 판매도 이뤄져 고무됐다.영화 <다음 소희> 스틸컷. 트윈플러스파트너스 제공하지만 국내 개봉은 또 다른 문제였다. “대형 배급사 등 여러 곳에 문의했지만, 잘 안됐어요. 결국 개인적으로 알던 배급팀을 통해 직접 배급하게 됐죠. 다행히 2월8일 개봉 당시 500개 넘는 상영관을 잡을 수 있었어요. 하지만 일주일 뒤 3분의 1로 줄었죠. 점점 더 줄어서 지금은 얼마 안 되는 상영관을 지키고자 노력 중입니다.”영화에 대한 호평과 입소문이 끊이지 않고 있지만, 개봉 19일째인 26일까지 누적 관객수는 8만5000여명(영진위 영화관입장권 통합전산망 기준)에 그쳤다. 이날 현재 스크린 수는 115개, 상영 횟수는 146회다. “극장이나 대중을 탓하고 싶진 않아요. 미디어와 영화 보신 분들의 호평과 관심에 감사할 따름이죠. 다만 걱정은 모태펀드의 선량한 투자자들에게 손실을 입히는 겁니다. 최소 20만 관객은 들어야 부가판권 매출까지 더해 손익분기점을 맞출 텐데, 쉽지 않네요.”영화 <다음 소희>의 제작자 김동하 트윈플러스파트너스 대표. 김정효 기자hyopd@hani.co.kr그래도 여전히 에스엔에스(SNS)에서의 입소문, 단체관람 문의 등이 꾸준히 이어진다는 점에서 힘을 얻는다. 영화 덕분에 국회에 계류 중이던 ‘현장실습생 보호법’ 처리에 속도가 붙었다는 소식에 보람도 느낀다. “제작자로서 감사한 일이죠. 이에 부응하기 위해서라도 규모는 작아도 꾸준히 장기 상영을 이어가고자 배급 차원에서 열심히 노력하고 있습니다.”"
2023-02-20,KT 차기 CEO에 외부 인사 18명 도전장…사내 후보자는 16명,"전직 임원에 국회의원·차관 출신까지구현모 대표 등 현직 부사장 이상 16명도오는 28일 후보 심사 대상자 압축압축 과정 거쳐 3월7일 최종 후보 결정케이티(KT)광화문빌딩 이스트(앞쪽건물)와 케이티 광화문빌딩 웨스트 전경. 연합뉴스케이티(KT) 차기 최고경영자(CEO) 후보 공개 모집에 외부 인사 18명이 지원했다. 이들은 구현모 대표를 비롯한 사내 자동 지원자군 16명과 함께 향후 3년간 케이티를 이끌 최고경영자 자리를 두고 경선 레이스를 펼친다.케이티는 지난 10일부터 20일 오후 1시까지 진행된 차기 대표이사 후보 공개 모집 결과, 외부 인사 18명이 지원했다고 20일 밝혔다. 외부 지원자(가나다순)는 권은희 전 국민의힘 의원(전 케이티 네트웍스 비즈부문장), 김기열 전 케이티에프(KTF) 부사장, 김성태 대통령직속 디지털플랫폼정부위원회 자문위원(전 자유한국당 의원), 김종훈 전 외교통상부 통상교섭본부장, 김진홍 전 케이티 스카이라이프 경영본부장, 김창훈 한양대 겸임교수, 남규택 전 케이티 마케팅부문장, 박윤영 전 케이티 기업부문장, 박종진 아이에이치큐(IHQ) 부회장, 박헌용 전 케이티그룹 희망나눔재단 이사장, 송정희 전 케이티 부사장, 윤종록 전 미래창조과학부 차관, 윤진식 전 산업자원부 장관, 임헌문 전 케이티 사장, 최두환 전 포스코아이시티(ICT) 사장, 최방섭 전 삼성전자 부사장, 한훈 전 케이티 경영기획부문장, 홍성란 산업은행 윤리준법부 자금세탁방지 전문위원 등이다.케이티 지배구조위원회는 규정에 따라 본사 및 주요 그룹사에서 일정 기간 근무한 부사장급 이상 임원 16명을 사내 지원자군으로 구성했다. 사내 지원자는 구현모 대표를 비롯해 강국현 커스터머부문장, 박종욱 경영기획부문장, 윤경림 그룹 트랜스포메이션부문장, 박병삼 윤리경영실장, 서창석 네트워크부문장, 송재호 인공지능·디지털전환(AI·DX)융합사업부문장, 신수정 엔터프라이즈부문장, 신현옥 경영지원부문장, 안상돈 법무실장, 우정민 아이티(IT)부문장 등 케이티 본사 임원 11명과 김철수 케이티스카이라이프 사장, 윤동식 케이티클라우드 사장, 정기호 케이티 알파 사장, 최원석 비씨(BC)카드 사장, 홍기섭 에이치씨엔(HCN) 사장 등 계열사 임원 5명이다.케이티 이사회 내 지배구조위원회는 인선자문단을 꾸려 서류심사를 통해 이 달 28일까지 이들 34명의 지원자 중 면접심사 대상자들을 추쳐 대표후보심사위에 올릴 계획이다. 이후 대표후보심사위원회가 면접심사를 통해 후보를 좁혀가는 방식으로 다음 달 7일까지 최종 후보를 선정해 이사회에 보고한다. 대표 후보자는 이사회 최종 확정과 다음 달 말 열리는 케이티 정기주총 승인 절차를 거쳐 확정된다.케이티(KT) 대표이사 선임 절차.KT제공앞서 케이티 이사회는 지난해 12월 초 자격심사를 거쳐 구 대표를 차기 대표이사 후보로 선정했으나 구 대표가 경선을 ‘역제안’하며 공모·경선 방식으로 다시 절차가 진행됐다. 이번에도 구 대표가 후보로 확정됐으나 최대주주인 국민연금이 구 대표가 배임·횡령 혐의로 재판을 받고 있는 점을 들어 반대한다는 의사를 밝힌데다 ‘셀프 연임’ 내지 ‘밀실 추천’ 논란까지 일자 백지화하고 원점에서 다시 선임 절차를 진행 중이다."
2022-12-14,12월15일 인사,⊙ 기획재정부 <전보> ◇국장급 △ 국유재산심의관 윤석호⊙ 과학기술정보통신부 <전보> ◇과장급 △디지털신산업제도과장 조민영 △소프트웨어산업과장 장두원⊙ 행정안전부 <전보> ◇과장급 △재난구호과장 박남기⊙ 금융감독원 <전보> ◇국실장 <국장> △기획조정 박지선 △금융시장안정 정우현 △생명보험검사 윤영준 △은행검사1 박충현 △은행검사2 백규정 △은행검사3 김정렬 △외환감독 이진 △저축은행검사 이현석 △기업공시 안승근 △기획조사 고영집 △회계감리1 윤정숙 △금융소비자보호총괄 이영로 △금융상품심사분석 김범수 △금융교육 이상아 △분쟁조정1 구본경 △분쟁조정3 황승기 △감사실 양진호 <지원장> △대구경북 윤덕진 △광주전남 조철 △대전충남 김명철 △인천 박형준 △경남 박중수 △강릉 엄일용 <사무소장> △뉴욕 박용호 △런던 이훈<직위부여> ◇국실장 <국장> △총무 서영일 △공보실 이태호 △국제업무(금융중심지지원센터 부센터장 겸) 이준교 △정보화전략 진태종 △법무실 김욱배 △디지털금융혁신 김부곤 △보험감독 문형진 △손해보험검사 원희정 △상호금융 정미선 △여신금융검사 이호진 △금융투자검사 김진석 △자산운용검사 김형순 △민생금융 이명규 △특별조사 한재혁 △회계감리2 이목희 <실장> △펀드신속심사 민봉기 △공시심사 오상완 △금융데이터 김충진 △자금세탁방지 이재석 △보험리스크제도 정해석 △감사인감리 김택주 △연금감독 김봉균 △포용금융 허진철 △금융사기전담대응단 임정환 <지원장> △부산울산 양진태 △제주 유진혁 △전북 유현석 △강원 한홍규 △충북 석준원 <사무소장> △북경 정관성 △하노이 박종춘<유임> ◇국실장 <국장> △인적자원개발실 김성욱 △감독총괄 이창운 △제재심의 서재완 △IT검사 장성옥 △은행감독 김준환 △신용감독 홍석린 △저축은행감독 이길성 △여신금융감독 이종오 △자본시장 감독 황선오 △자산운용감독 최강석 △자본시장조사 이승우 △회계관리 김철호 △금융민원총괄 서정보 △분쟁조정2 이무열 △감찰실 이주현 <실장> △비서 한구 △안전관리 백승필 △금융그룹감독 김형원 △보험영업검사 김금태 △자본시장특별사법경찰 권영발 △보험사기대응단 조정석 <사무소장> △동경 민경찬 △프랑크푸르트 채문석⊙ 한국원자력연구원 △부원장 임인철 △미래전략본부장 임채영 △경영기획본부장 천성호⊙ 한국전력거래소 <승진> △전력시장본부장 김상일 <처장> △경영지원 송석돈 △계통혁신 최홍석 <팀장> △기획처 전략기획 유석 △시장혁신처 수소시장 정선호 △시장운영처 시장고객총괄 정창현 △정보기술처 계통시스템 이봉길 <부장> △기획처 성과혁신팀 신용선 △중앙전력관제센터 중앙관제 정태영 <전보> △경인지사장 전경희 △KPX교육연구원장 박인석 <처장> △경영지원 송석돈 △계통혁신 최홍석 △시장운영 황봉환 △전력신사업 안병진 △정보기술 김광호 <실장> △감사 김광철 △시장감시 빈철원 <팀장> △기획처 전략기획 유석 △경영지원처 인사노무 조세철 △〃 재무경영 김염형 △안전관리실 안전총괄 한지연 △전력정책처 전력기술 이호승 △시장혁신처 수소시장 정선호 △시장운영처 시장고객총괄 정창현 △스마트그리드실 기술사업 전재룡 △정보기술처 계통시스템 이봉길 △중앙전력관제센터 수급운영 신기준 △〃 송전운영 류헌수 △〃 수요예측 허성일 <부장> △중앙전력관제센터 중앙관제 김진학 최석민 △기획처 전략기획팀 전략 이자겸 △경영지원처 인사노무팀 인사급여 문준상⊙ 아이에이치큐(IHQ) <승진> ◇부사장 △방송부문장 정박문 △엔터부문장 박종철 ◇전무 △ 모바일부문장 정혜전 △솔루션부문장 권오준 ◇상무 △ 방송부문 보도본부장 김명래 △〃 제작본부장 정진용 △솔루션부문 광고영업1본부장 김현수 ◇이사 △방송부문 편성기획본부장 정영근 △〃 기술영상본부장 김성훈 △〃 제작본부 제작2팀장 김대웅 △솔루션부문 광고영업2본부장 성명현 △〃광고기획팀장 진남우 △모바일부문 모바일개발본부장 박상용 △재무관리본부장 김현창 △경영전략본부 전략기획실장 박영찬⊙ 고려아연 <승진> △명예회장 최창근 △회장 최윤범 △부회장 노진수 △사장 박기덕 <선임> ◇임원 △기획본부장 이상근 <담당> △인사 권인대 △신소재사업 개발 안영탁 △원료 이상훈 △개발연구 김민철 최헌식⊙ 차바이오텍 <선임> △사장(연구개발 부문) 이현정
