date,title,content
2024-10-30,[시론] 첨단기술기업의 ‘AI 거품론’ 잠재우려면,"김용석 가천대 석좌교수 반도체교육원장2022년 11월 오픈AI의 생성형 인공지능(AI) 챗GPT가 공개되자 ‘AI혁명’이 몰고 올 혁신에 대한 기대감으로 세상이 환호했다. 엔비디아·애플·마이크로소프트·알파벳·아마존·테슬라·메타 등 ‘M7(매그니피센트 7)’으로 불리는 첨단 대형 기술 기업들의 주가 상승으로 이어졌다.그렇지만 지난여름 M7의 주가가 폭락했다. 최근 상당 부분 만회하고 있지만, 학계와 투자은행(IB) 업계를 중심으로 ‘AI산업 거품론’이 있다. 아마존·MS·메타·구글 같은 기업들은 엔비디아로부터GPU칩을 구매해 데이터센터를 구축·운영한다. 데이터센터의 고객은 오픈AI같은 서비스 기업인데, 투자에 비해 아직 충분히 수익을 못 낸다. 지금은AI칩을 개발·제조하는 엔비디아와 대만의TSMC만 큰 수익을 올리고 있다.HBM(고대역폭 메모리)을 공급하는SK하이닉스와 삼성전자도 혜택을 보고 있다.학계·투자업계에AI산업 회의론첨단산업 정착 시간 걸리기 마련응용AI분야에서 성과를 더 내야AI거품론을 보면 필자가 삼성에서 이동통신 칩세트를 개발하던 2000년 초가 떠오른다. 당시 전 세계 통신 관련 업체들은 꿈의 이동통신이라 불리던IMT-2000을 표준화·상용화하기 위해 노력하고 있었다. 당시엔 무선으로는 9.6kbps정도의 음성 통화를 하던 수준이었는데,IMT-2000은 최대 2.4Mbps의 데이터 전송 속도를 목표로 했다. 이 정도의 속도라면 실시간으로 양방향 영상통화가 가능한 수준이었다.하지만 실제 이 속도는 2006년이 돼서야 달성했다. 그때까지 ‘꿈의 이동통신’이나 ‘황금알을 낳은 거위’라는 낙관론도 있었지만, 다른 한쪽에서는 부정적인 시각이 오래 따라 다녔다. 킬러 서비스가 없다는 것이 가장 큰 비판이었다.IMT-2000 서비스를 본격 시작했을 때 얼마나 많은 가입자를 확보할 수 있을지 의문도 제기됐다. 세계 이동통신 표준 방식이 동기식과 비동기식으로 나뉘어 있는 것은 장비 제조사와 소비자 모두에게 투자비 부담을 준다는 점도 지적됐다.우여곡절 끝에IMT-2000은 걸음마 단계에 있던 모바일 인터넷을 높은 수준으로 가능하게 했다. 네이버(1999년), 페이스북(2004년), 트위터(2006년)의 탄생으로 모바일 포털 비즈니스가 본격화됐다. 2007년 아이폰의 등장이IMT-2000 서비스를 확산하는 데 아주 중요한 역할을 했다.결국 꿈의 이동통신이 정착하는 데는 최소 5년 이상의 시간이 필요했다. 이동통신망을 전 세계에 구축하는 것과AI데이터센터 구축은 인프라 선행 투자가 필요하다는 측면에서 닮았다.IMT-2000과 비교하면AI는 지금이 시작 단계다. 이제 막 시장이 열린 상황에서AI의 가치를 평가하는 것은 너무 이른 감이 있다.AI관련 투자를 지속해야 하는 이유다.AI산업이 안착하기 위해서는 어떤 노력이 필요할까. 첫째, ‘대규모 언어 모델(LLM)’에서 ‘경량화 언어 모델(sLLM)’로 개발을 더 가속해야 한다.sLLM은 매개변수가 적은 만큼LLM에 비해 더 적은 연산으로 훈련 시간과 비용·용량·전력 소모량이 훨씬 절감된다. 신경처리장치(NPU) 기반의 저전력AI반도체가 데이터센터에 활용될 수 있도록 기술개발을 해야 한다.둘째, 응용AI(산업용AI)에서 빠른 성과를 내야 한다. 온디바이스AI를 확대 적용하자는 것이다. 특히AI의 산업화 관점에서 이 부분이 매우 중요하다.PC나 스마트폰뿐 아니라 가전·자동차·드론 제품이나 공장·도시·의료기기기·국방 등 전 산업을AI화해야 한다. 금융·법률·교육·마케팅·영업이나 콘텐트 제작, 디자인, 비디오게임 개발도 활성화해야 한다.셋째, 새로운 서비스를 발굴해 고객이 스마트폰 모바일 기기나PC에서 충분히 활용할 수 있게 해줘야 한다. 그렇지만AI를 통해 세상에 없는 완전히 새로운 상품을 만들 수 있는 것이 아니고, 이미 소비자가 경험해 본 서비스에AI를 접목해 업그레이드하는 차원으로 진행해야 승산이 있다.AI가 산업화에 성공하려면 데이터센터 구축뿐 아니라 응용AI확대에 더 많이 노력하고 성과를 보여 줘야 한다. 진정한AI시대로 안착하려면 이 두 가지를 유념해야 한다.※ 외부 필진 기고는 본지의 편집 방향과 다를 수 있습니다.김용석 가천대 석좌교수·반도체교육원장"
2023-08-14,"중국 5위 부동산업체 디폴트 위기, 채권 10종 거래중단","중국의 대형 부동산 개발업체인 비구이위안(碧桂園·컨트리가든)이 디폴트(채무불이행) 위기를 맞으면서 세계경제에 빨간불이 켜졌다. 중국 부동산 시장은 중국 국내총생산(GDP)의 25%를 차지한다. 이 거대한 중국 부동산 시장이 흔들리면 이미 경고등이 켜진 중국 경제가 더 비틀거릴 수 있다는 우려가 나온다.블룸버그는 12일(현지시간) “비구이위안이 중국 경제에 새 위험을 초래하고 있다”고 보도했다. 사우스차이나모닝포스트(SCMP) 등에 따르면 비구이위안은 14일부터 역내 채권 가운데 최소 10종의 거래가 중단된다. 2021년과 2022년 선전과 상하이 증권거래소에 상장된 회사채 9종과 계열사 사모채권 1종이다.비구이위안은 지난 7일 만기가 돌아온 액면가 10억 달러 채권 2종에 대한 이자 2250만 달러(약 296억원)를 갚지 못하면서 10일부터 주가가 급락하기 시작했다. 30일간의 유예기간에도 상환 의무를 다하지 못하면 디폴트에 빠지게 된다. 비구이위안의 상반기 순손실은 최대 550억 위안(약 10조원)으로 예상된다. 지난해 상반기에는 19억1000만 위안(약 3479억원)의 순이익을 기록했다.비구이위안의 위기는 대형 부동산업체 ‘헝다(恆大)’와 대형 개발업체 완다(萬達)그룹의 불안으로 이미 침체한 중국 부동산 시장을 더 가라앉힐 수 있다.━비구이위안 충격파…부동산업계 ‘도미노 디폴트’ 우려세계적인 외환거래 업체인 오안다의 에드워드 모야 수석시장분석가는 “중국에서 가장 큰 부동산 업체 중 하나인 비구이위안이 무너지면 신뢰 위기가 발생해 부동산 시장 자체가 폭락할 수도 있다”고 말했다. 크리스티 헝 블룸버그인텔리전스 분석가는 “비구이위안이 헝다(에버그란데)보다 4배나 많은 프로젝트를 갖고 있기 때문에 이 회사의 디폴트는 중국 부동산 시장에 더 큰 파장을 낳을 것”이라고 했다. 비구이위안은 매출 기준으로 지난해 중국 부동산 개발업체 중 1위였고, 올해 상반기에도 5위를 기록했다.중국 소비자 · 생산자물가 추이 그래픽 이미지. [자료제공=국가통계국]중국 부동산 업계의 도미노 디폴트 가능성까지 나온다. 중국 주요 부동산 업체의 채무 상환 능력이 비구이위안보다 떨어지기 때문이다. 현금 수입으로 부채를 감당할 수 있는 능력을 나타내는 ‘현금보상비율’을 보면 비구이위안이 지난해 말 기준 93%였다. 이보다 현금보상비율이 낮은 위안양(遠洋·시노오션·12%)은 지난 2일 20억 위안(약 3650억원) 규모의 채권을 갚지 못했다. 유동성 경색이 지속하면 현금보상비율이 상대적으로 높은 다른 부동산 업체들까지 영향을 받을 수 있다는 게 전문가들의 진단이다.100대 업체, 7월 주택 판매액 33% 급감이미 중국 부동산 시장은 부진의 늪에서 좀처럼 벗어나지 못하고 있다. 월스트리트저널(WSJ)은 “중국의 주택 구매자들이 주택 가격 하락을 예상해 집을 사지 않고 기다린다”며 “이는 경제를 되살리려는 중국 당국의 노력을 복잡하게 만든다”고 전했다. 실제 중국 100대 부동산 개발업체의 올해 7월 신규주택 판매액은 전년 동기 대비 33.1% 급감했다.중국 부동산 시장의 위기는 최근 ‘D(디플레이션)의 공포’가 현실화하는 게 아니냐는 우려가 나온다. 지난달 중국의 소비자물가지수(CPI·-0.3%)와 생산자물가지수(PPI·-4.4%)는 2020년 11월 이후 처음으로 전년 동월 대비 동반 하락했다. 중국의 청년 실업률(6월 21.3%)은 관련 통계 작성 이후 가장 높은 수준이다.이런 중국 경제 상황은 세계경제에도 적신호로 해석된다. 뉴욕타임스(NYT)는 이날 “중국 경제의 약화는 브라질산 대두, 미국산 소고기, 이탈리아산 사치품 등 주요 상품에 대한 수요가 위축하고 있다는 신호”라며 “석유, 광물 및 기타 산업품에 대한 수요도 줄었다”고 보도했다. 호주 투자은행(IB) 맥쿼리의 래리 후 이코노미스트는 “중국의 경기 후퇴는 글로벌 경제 전망에 분명히 영향을 줄 것”이라며 “중국은 세계 1위 상품 소비국이기 때문에 그 영향은 아주 클 것”이라고 말했다.조 바이든 미국 대통령이 중국 경제를 ‘시한폭탄’에 비유했다. 지난 10일(현지시간) 미 유타주에서 열린 정치자금 모금 행사에서 바이든 대통령은 “중국이 똑딱거리는 시한폭탄(tickingtime-bomb)이라는 데 많은 사람이 동의하고 있다”며 “중국은 곤경에 빠져 있다”고 말했다.정근영 디자이너이어 “중국은 연간 8%의 성장률을 유지해 왔지만 이제는 연간 2%에 가깝다”고 지적했다. 바이든 대통령은 “악당들(badfolks)은 문제가 생기면 나쁜 짓을 한다”며 지난 6월 시진핑 중국 국가주석을 “독재자”라고 지칭한 데 이어 다시 중국 정부를 비판했다.그러자 중국 신화통신이 논평을 통해 “바이든 정부는 중국을 욕하는 것을 미국 경제를 살리는 정책적 대안으로 여기는 것인가”라며 반발했다. 주미 중국대사관은 “미국이 베이징을 희생양 삼아 분열과 대결을 부채질해선 안 된다”고 비판했다.바이든 대통령의 ‘시한폭탄’ 발언을 놓고 중국 측이 발끈했지만 중국 바깥은 물론 내부에서도 중국 경제에 대한 우려가 점점 커지고 있다. 글로벌 투자은행인 골드만삭스는 12일 중국 지방정부 부채 규모가 94조 위안(1경7100조원)에 달할 것으로 추산했다. 보고서에 따르면 중국 국무원은 정부 예산에 포함되지 않은 부채를 확인하고 재정 악화를 막기 위해 재정 상태가 가장 나쁜 10개 성(省)에 긴급 조사팀을 파견했다.중국 지방정부 부채 3년 만에 14%P 증가영국 경제 매체인 아시아파이낸셜(AF)에 따르면 중국의 지방정부 부채는GDP대비 2019년 62.2%(75조 위안)에서 지난해 76%(92조 위안)로 3년 만에 13.8%포인트 증가했다. 올해도 부채가 계속 늘면서 역대 최대치를 갱신했다. 인프라에 대한 과잉 투자와 토지 판매 수익 급감, 코로나19 비용 급등이 주요 원인으로 지목됐다.국제통화기금(IMF)은 전체 지방 부채 중 66조 위안(1경2000조원)이 인프라 프로젝트 자금을 조달하는 지방정부융자기구(LGFV)가 보유하고 있는 것으로 추산하고 있다. 이는 그간 지방정부가 벌여 놨던 사회간접자본(SOC) 투자가 악성 부채의 다수를 차지하고 있음을 시사한다.지난 7월 시진핑(習近平) 국가주석이 주재한 당 중앙정치국회의에서 정부가 지방 부채 대책 마련에 나설 것이란 발표도 나왔다. 골드만삭스는 “중국의 성장 둔화로 지방 정부 자체 재정을 통한 부채 상환이 쉽지 않을 것”이라고 했다. 부동산 위기가 확산하면 자금을 댄 은행, 아파트 선분양에 목돈을 넣었던 시민들 모두 거금을 잃게 된다."
2023-08-13,"中 부동산 5위업체 '비구이위안' 디폴트 위기…""세계경제 비상""","지난달 29일 중국 베이징의 아파트 건설 현장. 로이터=연합뉴스중국의 대형 부동산 개발업체인 비구이위안(碧桂園·컨트리가든)이 디폴트(채무불이행) 위기를 맞으면서 중국 부동산 업계에 ‘도미노 디폴트’ 우려가 번지고 있다. 다른 중국 주요 부동산 업체의 재정 상황도 나빠서다. 중국 부동산 시장은 중국 국내총생산(GDP)의 25%를 차지한다. 부동산 시장이 흔들리면 중국 경제도 위기에 빠질 수 있다는 의미다. 이미 경고등이 켜진 중국 경제에 또 다른 악재가 등장한 것이다.블룸버그는 12일(현지시간) “비구이위안이 중국 경제에 새로운 위험을 초래하고 있다”고 보도했다. 블룸버그에 따르면 비구이위안은 지난 7일 만기가 돌아온 액면가 10억 달러 채권 2종에 대한 이자 2250만 달러(약 296억원)를 갚지 못했다. 30일간의 유예기간에도 채무 의무를 다하지 못하면 디폴트에 빠지게 된다. 비구이위안의 상반기 순손실은 최대 550억 위안(약 10조원)으로 예상된다. 지난해 상반기에는 19억1000만 위안(약 3479억원)의 순이익을 기록했다.정근영 디자이너블룸버그통신과 사우스차이나모닝포스트(SCMP) 등 외신은 비구이위안이 14일부터 역내 채권 가운데 10종 이상이 거래를 중단하기로 했다고 보도했다. 2021년과 2022년 발행한 위안화 표시 채권 6종은 선전 증권거래소에서, 3종은 상하이 증권거래소에서 거래할 수 없게 된다. 또 비구이위안의 계열사 광둥텅웨건설공사의 회사채 1종과 비구이위안 사모채권 1종도 거래가 중단될 예정이다.비구이위안의 위기는 이미 침체한 중국 부동산 시장을 더 가라앉힐 수 있다는 우려가 나온다. 세계적인 외환거래업체인 오안다의 에드워드 모야 수석시장분석가는 “중국에서 가장 큰 부동산 업체 중 하나인 비구이위안이 무너지면 부동산 시장에 대한 신뢰 위기가 발생해 시장 자체가 폭락할 수도 있다”고 말했다. 크리스티 헝 블룸버그인텔리전스 분석가는 “비구이위안이 헝다(恆大·에버그란데)보다 4배나 많은 프로젝트를 갖고 있기 때문에 이 회사의 디폴트는 중국 부동산 시장에 더 큰 파장을 낳을 것”이라고 우려했다. 비구이위안은 매출 기준 지난해 중국 부동산 개발업체 중 1위였고 올해 상반기에도 5위를 기록했다.중국 부동산 업계의 도미노 디폴트 가능성까지 나온다. 중국 주요 부동산 업체의 채무 상환 능력이 비구이위안보다 떨어지기 때문이다. 현금 수입으로 부채를 감당할 수 있는 능력을 나타내는 ‘현금흐름보상비율’을 보면 비구이위안이 지난해 말 기준 93%였다. 이보다 현금흐름보상비율이 낮은 위안양(遠洋·시노오션·12%)은 지난 2일 20억 위안(약 3650억원) 규모의 채권을 갚지 못했다. 유동성 경색이 지속하면 현금흐름보상비율이 상대적으로 높은 다른 부동산 업체들까지 영향을 받을 수 있다는 게 전문가들의 진단이다.중국 비구이위안(컨트리가든). 로이터=연합뉴스이미 중국 부동산 시장은 부진의 늪에서 좀처럼 벗어나지 못하고 있다. 월스트리트저널(WSJ)은 “중국의 주택 구매자들이 주택 가격이 하락할 것으로 예상해 집을 사지 않고 기다린다”며 “이는 경제를 되살리려는 중국 당국의 노력을 복잡하게 만든다”고 전했다. 실제 중국 100대 부동산 개발업체의 올해 7월 신규주택 판매액은 전년 동기 대비 33.1% 급감했다.중국GDP의 약 25%를 차지하는 부동산 시장의 위기는 중국 경제에 또 다른 대형 악재로 꼽힌다. 이미 최근 중국 경제를 두고 ‘D(디플레이션)의 공포’가 현실화하는 게 아니냐는 우려가 나온다. 지난달 중국의 소비자물가지수(CPI·-0.3%)와 생산자물가지수(PPI·-4.4%)는 2020년 11월 이후 처음으로 전년 동월 대비 동반 하락했다. 중국의 청년 실업률(6월 21.3%)은 관련 통계 작성 이후 가장 높은 수준이다.중국 소비자 · 생산자물가 추이 그래픽 이미지. [자료제공=국가통계국]이런 중국 경제 상황은 세계 경제에도 적신호로 해석된다. 뉴욕타임스(NYT)는 이날 “중국 경제의 약화는 브라질산 대두, 미국산 소고기, 이탈리아 사치품 등 주요 상품에 대한 수요가 위축하고 있다는 신호”라며 “석유, 광물 및 기타 산업품에 대한 수요도 줄었다”라고 보도했다. 호주 투자은행(IB) 맥쿼리의 래리 후 이코노미스트는 “중국의 경기 후퇴는 글로벌 경제 전망에 분명히 영향을 줄 것”이라며 “중국은 세계 1위 상품 소비국이기 때문에 그 영향은 아주 클 것”이라고 말했다.앞서 조 바이든 미국 대통령도 지난 10일 중국 경제에 대해 “세계를 위협하는 시한폭탄과 같다”고 했다. 이와 관련WSJ은 “중국 경제 성장의 상당 부분이 부채로 부풀려진 거품이었다는 증거가 수년 동안 축적돼 왔다”고 지적했다."
2024-06-10,야놀자 미국 증시 상장 추진 소식에…SBI인베 주가 16%↑,"7일 블룸버그 “빠르면 7월 상장 추진” 보도서울 강남구 야놀자 본사 전경. 연합뉴스국내 여행 플랫폼 야놀자가 빠르면 오는 7월 중 미국 증시 상장을 추진한다는 소식에 관련주 주가가 급등하고 있다.10일 오후 12시50분께 한국거래소에서 에스비아이(SBI)인베스트먼트 주가는 전거래일 대비 16.93% 오른 1091원에 거래되고 있다. 개장 직후에는 25.40% 급등해 지난해 4월 이후 최고가인 1170까지 오르는 모습도 보였다.이날 에스비아이인베스트먼트 주가가 급등세를 보이는 건 직전 거래일인 지난 7일 오후 블룸버그 통신 보도를 통해 야놀자가 빠르면 7월 중 미국 증시 상장을 추진하고 있다는 내용이 알려지면서다. 블룸버그 통신은 익명의 관계자를 인용해 야놀자 기업 가치가 70억∼90억달러(약 9조6400억원∼12조4천억원)에 이를 것으로 추산된다고 전했다.에스비아이인베스트먼트는 지난 2016년(시리즈B)과 2018년(시리즈C) 두 차례에 걸쳐 모두 160억원을 야놀자에 투자했다. 야놀자는 이후 2021년 손정의 회장의 소프트뱅크 비전펀드로부터 약 2조3천억원을 투자받았다. 당시 비전펀드가 평가한 야놀자의 기업가치는 약 8조원이었다.자본금 확충을 토대로 2022년 인터파크 인수 등을 통해 몸집을 불려온 야놀자는 지난해부터 물밑에서 상장 준비를 해왔다. 지난해 12월 뉴욕증권거래소(NYSE) 임원 출신인 알렉산드르 이브라힘을 최고재무책임자(CFO)로 영입하더니, 지난 2월에는 미국 델라웨어주에 100% 출자 법인을 새로 만들었다. 앞서 델라웨어주에 지주회사를 차리고 뉴욕증권거래소 상장을 추진한 쿠팡 방식을 따라가는 듯한 모습이다.만약 야놀자가 내부 관계자 예상대로 10조원 안팎의 기업 가치를 인정받고 미국 증시에 안착하면, 에스비아이인베스트먼트 등 투자사 역시 보유 지분 매각을 통해 상당한 수혜를 입을 전망이다.이 같은 기대감에 힘입어 국내 상장된 또다른 야놀자 투자사인 아주아이비(IB)투자도 이날 한때 12.74% 오른 3585원에 거래되다가 오후 1시께 전 거래일 대비 4.25% 오른 3315원을 나타내고 있다."
2022-11-24,"SK, 연어·우유에 투자한다?…배양육·식물성 육류 기업에 눈돌려","식물성 고기·대체 유단백질 등‘지속가능식품’ 사업 다각화미국 기업 와일드타입이 개발한 세포배양 연어육.SK제공에스케이(SK)가 세포배양 고기 등 차세대 식품 사업 투자를 다각화하고 있다.에스케이는 세포배양 연어육을 개발한 미국 기업 와일드타입에 100억원을 투자한다고 24일 밝혔다. 와일드타입은 세포배양 기술로 실제 연어와 유사한 식감과 맛, 형태를 구현하는 데 성공해, 내년 상품화를 목표로 연어 스테이크, 필렛 등의 제품 출시를 준비하고 있다.에스케이는 또 대체 우유 단백질을 생산하는 미국 기업 퍼펙트데이, 한국의 매일유업과 함께 지속가능 식품 사업 협력 양해각서(MOU)를 체결하고 합작법인 설립을 추진하기로 했다. 앞서 에스케이는 2020년과 2021년 두 차례 퍼펙트데이에 1200억원을 투자했다. 대체유 단백질은 아이스크림·초콜릿·크림치즈 등의 원재료로 쓰인다. 퍼펙트데이는 세계 최초로 단백질 생성 유전자에 미생물을 결합한 발효 방식으로 단백질 생산에 성공한 업체다. 네슬레 등 글로벌 식품업체에 납품 중이다.에스케이가 지난해와 올해 500억원을 투자한 영국의 식물성 고기 생산업체 미트리스팜도 성장 잠재력을 평가받아 최근 아주IB투자로부터 100억원을 투자받았다. 에스케이는 이번 와일드타입 투자로 식물성 고기(미트리스팜), 미생물 발효 단백질(퍼펙트데이·네이처스 파인드)에 이어 세포배양 식품까지 아우르는 지속가능식품 포트폴리오를 구축했다고 밝혔다.김무환 에스케이 그린투자센터장은 “기후변화를 극복하기 위한 과정이 곧 미래 가치를 포착하는 기회가 될 수 있다. 지속가능 식품 등 그린 산업의 폭발적 성장에 대비해 주도권을 선점해 나갈 것”이라고 말했다."
