date,title,content
2024-07-10,"[쫌아는기자들] AI 거품, 830조원의 구멍에 대한 경고","“@주3회 발행하는 뉴스레터 [쫌아는기자들] 입니다. 전문은 유료 구독자에게 공개. 유료 가입(https://page.stibee.com/subscriptions/158656). 일부 보는 무료 가입(https://page.stibee.com/subscriptions/143087)”간만에 돌아온 쫌아는기자들의 아는 척, [쫌아는척]입니다. 오늘의 주제는 ‘AI버블’입니다. 얼마전 세콰이어캐피탈이 던진 질문, “AI에 대한 6000억 달러(약 830조원) 질문” 아티클에 이어 실리콘밸리에서AI버블을 경고하는 기사와 리포트가 하나둘씩 나오고 있습니다. 골드만삭스와JP모건 같은 투자회사에서도 회의론을 담은 리포트를 내고 있고요.보수적인IB,AI투자를 망설였던 세콰이어캐피탈의 ‘신포도 리포트’라고요? 최근 디인포메이션도AI버블에 대한 우려섞인 기사를 내놓기 시작했습니다. 디인포메이션은 누구보다 기술 산업, 스타트업에 가까운 입장에서 취재를 하는 매체인데요. 최근 기사는 스케일AI의 펀딩에 대한 회의론을 담았습니다. (원문 - 디인포메이션, 국내기사 - 오로라 실밸 특파원이 다양한 매체 우려를 담아 정리)쫌아는기자들의 프롬프트로 만든 만평 이미지.AI버블을 상징하는 만평을 그려달라고 했다. /DALL-E스케일AI의 이야기는 이렇습니다. 스케일AI는 지난 5월 아마존·메타·엔비디아 등AI빅테크와 액셀 등 벤처투자자(VC)들에게서 138억달러(약 19조원)의 기업 가치를 인정받으며 10억달러(약 1조3900억원)의 투자를 유치하는 데 성공했습니다. 2016년 설립된 이 회사가 지난 8년간 받은 누적 투자금은 6억달러의 두배 수준이죠. 지분 15%를 갖고 있는 중국계 이민자 출신인 알렉산더 왕 최고경영자(CEO)는 27세 나이에 ‘세계 최연소 억만장자’로 등극했고, 투자 직후 샌프란시스코 에어비앤비 소유 건물의 3개층을 임차하는 계약을 체결했는데 올해 샌프란시스코 부동산 빅계약으로 손에 꼽히면서 부동산 업계에서도 주목을 받았다고 합니다.스케일AI의 창업자 '알렉산더 왕'./포브스스케일AI는 데이터 라벨링을 하는 회사입니다.AI에 학습시킬 데이터를 분류하고, 데이터에 이름표와 주석을 달고, 불건전한 데이터를 제거하는 일이죠. 아프리카·동남아시아 등에서 저임금 인력을 고용해 데이터를 정리하고, 이를 대기업에 판매하는데 오픈AI와 같은AI기업들이 주요 고객사입니다. 올해 매출은 지난해(3억3000만달러)의 3배 수준인 10억달러를 돌파할 것으로 예상된다고요.문제는 이 사업의 수익성이 ‘지속가능하냐’는 것입니다. 디인포메이션의 분석과 관점은 “지속가능하지 않다”는 관점입니다. 디인포메이션의 핵심 주장을 좀 쉽게 정리, 의역해봤습니다.최근 펀딩은 스케일AI를 올해 예상 이익의 25배 이상으로 평가하고 있다. 이건 비상장 스타트업인 데이터브릭스보다 배율이 높다. 우리가 생각하는 합리적인 스케일AI의 가치는 100억 달러 이하다.스케일AI는 데이터브릭스와 같은 클라우드 소프트웨어 회사가 아니다. 다시 말해 매출이 구독형으로 계속 발생하지 않는다는 것이다.  고객은AI학습을 위해 라벨링된 데이터를 1회 제공받고, 모델 및 서비스 출시가 끝나면 계약을 종료할 수도 있다.스케일AI의 영업이익률은 53%가 예상된다. 이건 소프트웨어 회사인 데이터브릭스의 78%, 다른 클라우드 소프트웨어 회사들의 76%보다 낮다. 왜냐? 이들의 사업은 결국 저임금 노동자가 지탱하고 있다.실리콘밸리는 이러한 분석을 무시하고 베팅을 하고 있다.스케일AI에 대한 투자VC로는 악셀이 있습니다. 그리고 와이콤비네이터가 있죠. 스케일AI에 대한YC의 첫 투자는 샘 올트먼이CEO이던 시절 이뤄졌습니다. 올트먼은 그의 가장 강력한 지지자이기도 합니다.어쨌든 디인포메이션과 실리콘밸리의 우려 섞인 시선은 이겁니다. “진짜? 이 밸류가 맞아?AI에 대한 일시적 환상에 빠진 것이 아닐까?”요.1. 세콰이어캐피탈 “AI버블이 한계점에 도달했다”실리콘밸리의 톱VC,세콰이어캐피탈이 지난달 20일 낸 리포트입니다. 제목은 ‘”AI에 대한 6000억 달러(약 830조원) 질문- 원문” 입니다. 부제는 “AI버블이 한계점(tippingpoint)에 도달했다. 다음엔 무엇이 올 것인지 알아야 한다”입니다.이 아티클을 쓴 데이비드 칸의 접근은 아주 심플합니다. 그는 작년 11월에 이미 2000억(200B) 달러까지 질문이라는 아티클을 쓴 적 있습니다(원문). 이번 아티클은 과거 아티클의 후속이자, 거품이 더 가파르게 낀 것에 대한 경고에 가깝습니다. 세콰이어캐피탈이AI거품을 진단한 로직은 이렇습니다.엔비디아가GPU를 팝니다.AI데이터센터에 들어가기 위한 용도죠. 엔비디아가 A100, H100 등GPU로 버는 매출이 한해 10억원이라고 가정합니다.이GPU는 여러 기업의 데이터센터로갑니다. 데이터센터를GPU를 사기 위한 자본투자를 했겠죠. 여기에 전력비용 등 여러 운영 비용이 수반됩니다.GPU에 대한 투자 비용이 클라우드 혹은 데이터센터 기업 매출의 50%라고 가정하면, 그러면AI클라우드 서비스를 제공하는 기업들, 예를 들어AWS나Azure의 매출은 한해 최소 20억원을 되어야 할 겁니다.그렇다면 소비자들에게 최종AI서비스를 제공하는 기업들이 있겠죠? 오픈AI를 비롯해 맥도날드나 스타벅스가AI기반 서비스를 제공한다고 가정합니다.AI서비스를 제공하는 기업들은AI데이터 인프라 사용에 비용을 낼 겁니다. 최종 소프트웨어 마진율을 50% 가정하면, 소프트웨어 매출이 데이터센터 사용 비용의 2배, 그러니까 연 40억원을 벌어야 합니다.정리하면GPU10억원 매출은 최종적으로 시장에서 40억원을 지불할 사용자를 모아야 합니다. 그 사용자가 기업이든, 개인이든. 그런데 이 엔비디아의GPU매출 예상치가 지금 150B,1500억 달러에 달합니다. 그러면 최종적으로AI에 내야하는 돈은? 6000억 달러, 600B에 달합니다.그리고 세콰이어캐피탈은 다시 시장상황을 점검합니다.오픈AI의 매출을 봅시다. 최근 보도에 따르면 오픈AI의 작년 추정 매출은 약 340억 달러, 34B입니다. 챗GPT를 제외하고 우리가 넷플릭스나 스포티파이처럼AI서비스 여럿을 구독하나요? 아닐걸요. 소비자 지갑은 그렇게 열리지 않습니다.후하게 구글,MS,애플, 메타가AI에서 연 100억 달러 매출을 올린다고 가정하겠습니다. 그리고 테슬라와 바이트댄스, 알리바바나 텐센트도 연 50억 달러 매출을 올린다고 해볼게요. 그렇게 다 합해도 6000억 달러(칸이 가정한AI필요 매출치) - 1000억 달러(오픈AI매출 + 희망적으로 계산한 다른 빅테크의AI매출) = 5000억 달러, 한국돈으로 800조원이 넘는 구멍이 생깁니다.그렇게 내린 세콰이어와 칸의 결론은 이렇습니다. 지금 이 시장에는 저만한 구멍이 있고, 그 구멍에거품이 끼고 있다고요.  물론AI의 발전이 미칠 영향, 엔비디아의 기술적 역할에 대한 찬사도 있습니다. 하지만 우리가 지금 제대로 숫자를 세고 있는지 보자는 것입니다.그래픽=조선디자인랩 이연주2. “AI철도라고?” 세콰이어의 논리적 반박칸은 앞선 비슷한 아티클로 몇몇 반박을 받았나 봅니다. 급진적인AI투자론자들의 반박은 주로 “AI는 철도다! 철도 같은 인프라로 앞으로 깔리면 얼마나 큰 영향이 있을지 예측할 수 없다. 그러니 선제적으로 투자해야 한다”는 것으로 보입니다. 즉, 철도를 건설하면 나중에 기차와 목적지가 생길 것이며, 새로운 농산물 수출, 놀이공원, 쇼핑몰 등이 생긴다는 것입니다. 칸은 이 의견에 동의하지만, 몇 가지 중요한 점을 놓친다고 정중하게 반박합니다.GPU와 데이터센터는 독점 사업이 아니다예를 들어, 샌프란시스코와 로스앤젤레스를 연결하는 기찻길을 소유하고 있다면, 그 구간에 깔 수 있는 기찻길은 한정적이기 때문에 독점적인 가격 결정 권한을 가질 수 있습니다. 그러나GPU데이터 센터의 경우에는 이러한 독점적인 권한이 없습니다.GPU컴퓨팅은 점점 시간 단위로 측정되는 상품화되고 있습니다.CPU클라우드가 과점이 된 것과 달리,AI클라우드를 구축하는 새로운 기업들이 계속해서 시장에 진입하고 있습니다. 독점이나 과점이 없는 상태에서 높은 고정비용과 낮은 변동비용을 가진 사업(대표적으로 항공사)은 가격이 변동비 수준까지 하락하는 경우가 많습니다.우리가 투자한 기업이 루저(loser)일 확률이 더 높다철도와 같은 많은 새로운 기술에서는 투기적인 투자 열풍이 자본의 대규모 손실로 이어질 수 있습니다. 실제 미국의 철도 역사를 보면 많은 사람들이 철도 사업 투기 열풍으로 큰 손실을 입었다. 승자를 고르는 것은 어렵지만, 패자를 고르는 것은 훨씬 쉽다.GPU감가상각은 훨씬 빠르다엔비디아는 B100과 같은 차세대 칩을 출시한다고 합니다. 현재 최신GPU인 H100 칩의 가치가 3-4년 후에 크게 떨어질 것임을 의미합니다. 철도 같은 물리적 인프라는 ‘무어의 법칙’을 따르지 않습니다. (무어의 법칙은 반도체 칩의 성능이 약 18개월마다 두 배로 증가한다는 법칙, 그만큼 반도체는 투자하면 빠르게 기술과 양산 제품 성능이 발전한다는 것) 철도와 같은 물리적 인프라는 시간이 지나도 가치가 크게 감소하지 않고, 당신이 산GPU의 감가상각은 훨씬 빠르게 될 것입니다.“쫌아는기자들이 만드는, 뉴스레터 [스타트업]은 주 3회 발행하는 유료레터입니다. 오늘의 무료 콘텐츠는 여기까지 입니다. 나머지는 ‘질문’을 비롯해 일부만 공개합니다. 유료 구독하면 과거 3년간 모든 콘텐츠를 볼 수 있습니다.”3.AI기업들의 밸류는? 그래서VC들은 물렸을까?그래서 주목받는AI스타트업들을 찾아봤습니다....그래픽=조선디자인랩 이연주4. 골드만삭스 애널리스트 “AI가 1조짜리 문제를 해결할 수 있어?AI는 인터넷, 스마트폰보다 못한 발명품”쫌아는기자들은 여러AI리포트를 찾아봤습니다. 장밋빛 리포트는 대부분 그 이야기가 그 이야기..아는 이야기 뿐이었습니다. 오히려 버블을 우려하는 리포트들이 뾰족한 아이디어가 있더군요. 지난달 25일 골드만삭스도 ‘GENAI:TOOMUCHSPEND,TOOLITTLEBENEFIT?’라는 리포트를 냈습니다. 여러 내용이 담겨있지만 핵심은MIT의DaronAcemoglu교수와 골드만삭스의JimCovello애널리스트 인터뷰였습니다. 핵심 내용은 아래와 같습니다.....여기까지는AI에 대한 관점입니다. 리포트에서 제일 재미가 있었던 부분은AI수익성에 회의적인 애널리스트JimCovello의 인터뷰인데요. 골드만삭스도 그의 관점이 흥미로운지, 2페이지 정도 넉넉하게 그의 주장을 실었습니다. 핵심은 아래와 같습니다.....그래서 쫌아는기자들의 관점은 무엇이냐고요? 일단 이 레터는 챗GPT,클로드, 유닷컴,perplexity와 같은 여러AI서비스의 도움을 받았습니다. 일단 쫌아는기자들의 생산성에AI는 큰 기여를 하고 있습니다. 거품은 꺼질 때만 알 수 있습니다. 주식 투자 경험상, 항상 지금이 거품일 수도 있다는 마음의 준비, 경계심, 각오가 있어야만 하락장에서 멘탈을 잡을 수 있더군요."
2022-12-28,“하루 3700만명 확진” 中 코로나 확산에 세계증시 촉각,"반등했던 中증시 다시 꺾여“100만명 사망 가능성” 분석도중국 내 코로나바이러스 감염자가 폭증하는 가운데, 지난 23일 상하이 정안사에서 한 남성이 마스크와 투명 안면마스크를 쓴 채 향을 피우고 있다./로이터 연합뉴스코로나 오미크론 변이가 휩쓸던 올 1월 전 세계 하루 확진자 수는 400만명 수준이었다. 코로나 이후 최고 기록이다. 그런데 3주 전 사실상 ‘제로(0) 코로나’ 정책 포기를 선언한 중국에서 하루 확진자가 3700만명을 넘어섰다는 집계치가 중국 내부에서 나오고 있다.코로나 방역 완화 이후 중국은 급격한 속도로 코로나가 확산되고 있는 것으로 알려졌다. 당초 시장의 예상보다 중국의 리오프닝(방역 완화로 경제 활동 재개)이 앞당겨지면서 세계 2위 경제 대국 중국이 코로나 확산으로 받을 타격이 얼마나 커질 것인지, 또 얼마나 빨리 회복이 가능할지 등이 글로벌 금융 시장의 최대 관심사로 떠올랐다. 경기 부양 기대 속에 10월 말부터 12월 초까지 11% 반짝 반등했던 중국 증시는 코로나 확산 이후 상승분 절반을 반납했다.”빨리 맞은 매…빠른 반등 가능”중국 방역 당국이 제로 코로나 폐지와 함께PCR(유전자증폭) 검사도 폐지해 정확한 코로나 감염 통계를 확인할 길은 없는 상태다. 전문가들은 중국 내 지하철 이용자 수와 교통 혼잡도, 주택· 자동차 판매 등 다양한 수치를 동원해 숫자를 추정하고 있다. 의약품이 동나고 병원마다 환자가 밀려드는 상황을 감안하면 ‘사망자 100만명’ 추정이 근거 없는 추측이 아닐 수 있다는 말이 나온다. 26일 블룸버그통신은 중국 국무원 산하 국가위생건강위원회 자료를 인용해 “이달 들어 20일까지 총 2억4800만명이 감염됐으며, 20일 하루에만 감염자 수가 3700만명이었다”고 보도했다.현재까지 아시아 각국의 인구 대비 총 확진자 수 비율을 보면 한국이 53% 수준이고 홍콩·대만이 30%대, 일본이 20%대를 기록하고 있다. 메리츠증권은 내년 3월까지 중국인 약 30%가 감염되며 치사율이 아시아 평균치(0.16%)정도인 ‘기본 시나리오’에서 약 67만명 사망할 것으로 예상했다. 감염률이 한국처럼 50%가 되면 112만명 사망도 가능하다는 분석이다.이달 중순 있었던 중국 중앙경제공작회의에서 당국은 경기부양 의지를 표명했지만, 투자자들은 걱정 가득한 눈빛으로 바라보고 있다. 갑작스러운 전면 방역 해제가 소비와 생산 등 경제에 줄 타격을 우려하는 모습이다.이런 상황에서도 주요 투자은행(IB)들은 내년 중국 성장률이 5% 가까이 도달할 것으로 보고 있다. 스탠다드차타드가 5.8%, 뱅크오브아메리카가 5.5%를 내다보는 등 블룸버그가 집계한 77개 기관 평균치는 4.8%다. 올해 성장률 전망치 평균은 3%다.후이 샨 골드만삭스 중국 담당 이코노미스트는 최근 투자자 노트에서 “3년간 코로나 방역을 거친 중국이 예상보다 더 빠른 속도로 개방하고 있다”며 “재개방 초기에는 감염자가 늘어 생산 등 경제 지표에 부정적인 영향을 미치겠지만, 조만간 빠르게 반등할 것”이라고 말했다.미국CNBC도 26일(현지 시각)IB들의 내년 전망 보고서를 종합해 내년 3대 키워드를 꼽으면서 ‘디스인플레이션(물가상승률이 낮아지는 현상)’ ‘연준의 긴축 중단 및 달러 약세’ 그리고 ‘중국의 귀환’을 꼽았다.최설화 메리츠증권 연구원은 “중국이 백신 접종 등 준비 없이 바로 전면 완화에 돌입하면서 사람들이 스스로 자발적 거리 두기에 나서 경기 충격이 발생하고 있다”며 “이런 추세가 내년 1월까지 이어지고 2분기부터는 본격적인 소비 회복이 가능할 것”이라고 내다봤다.”구조적 문제 심각… 예전 같은 성장 없을 것”반대로 중국 내부에서 곯아가던 구조적 문제들이 코로나 사태로 증폭되면서 중국 경제의 앞날을 더 이상 ‘장밋빛’으로 낙관할 수 없다는 의견도 힘을 얻고 있다.노벨경제학상 수상자인 폴 크루그먼 뉴욕시립대 교수는 지난 23일 뉴욕타임스 칼럼에서 “단기 급성장한 중국의 미래는 지금까지와는 다를 것”이라고 주장했다. 수출로 쌓은 성장의 과실을 소수가 독점해 일반 국민은 나누지 못하는 불균형이 심각하고, 그간 내수경제를 떠받쳤던 부동산 버블도 더는 지속할 수 없다면서 이런 고질적 문제들이 한계에 달했다고 지적했다.중국의 생산가능 인구가 줄어드는 점도 중국 경제를 비관적으로 보는 근거 중 하나로 들었다. 크루그먼 교수는 “중국이 세계 경제 패권국이 되는 것을 보려면 아주 오래 기다려야 할 수도 있다”고 했다."
2023-12-19,"사학연금, VC블라인드 펀드 위탁운용사 3곳 선정","사학연금 나주 본사 사옥 외관사립학교교직원연금공단(사학연금)은VC블라인드 펀드를 운용할 위탁운용사로DSC인베스트먼트,IMM인베스트먼트, 아주IB투자 3곳을 최종 선정했다고 18일 밝혔다.사학연금 국내VC출자규모는 총 450억 원 이내로 3곳의 위탁운용사에 각 150억 원 출자할 예정이다. 10월 25일부터 제안서를 접수 받아 1차 정량평가 실시 후 6개 숏리스트를 선정하였다. 선정된 운용사를 대상으로 현장실사를 실시하였고, 그 결과를 토대로 12월 14일 대체투자위원회의 정성평가를 거쳐 3곳의 위탁운용사가 최종 확정되었다."
2023-08-07,"중기부, 벤처캐피탈 업계 간담회 개최","중소벤처기업부는 4일 여의도 63빌딩에서 벤처투자 시장 현황 진단과 활성화 방안을 모색하기 위한 ‘벤처캐피탈 업계 간담회’를 개최했다.간담회에는 오기웅 차관, 한국벤처캐피탈협회 윤건수 회장과 정성인 전 회장을 비롯해 아주IB투자, 스마일게이트인베스트먼트, 캡스톤파트너스와 같은 벤처캐피탈협회 부회장사 대표, 바인벤처스, 유니온투자파트너스 등 40대 젊은 벤처캐피탈 대표 등이 참석했다.이날 간담회에서는 벤처투자 시장 활성화를 위한 모태펀드의 역할과 벤처투자 시장의 건전성 제고를 위한 벤처캐피탈 관리‧감독 체계 개선 방안 등을 중점적으로 논의했다.오기웅 차관은 “현재 벤처투자 시장은 코로나 시기의 과잉 유동성과 비대면 분야 등에 대한 투자 집중에서 벗어나 딥테크·초격차 분야와 같은 새로운 분야에 대한 투자로 이어지는 분위기”라며, “벤처투자 시장 활성화와 건전한 생태계 조성을 위해 벤처캐피탈 업계의 적극적인 참여와 의견 개진을 부탁드리며, 정부도 간담회에서 나온 업계의 다양한 의견들을 면밀히 검토해 관련 정책에 반영하겠다”고 밝혔다."
2022-11-24,"‘친환경·생태계 보호’ 세포배양 연어육…SK, 지속가능식품 사업 다각화","와일드타입 연어 제품. 사진SKSK가 차세대 식품 시장으로 주목받는 지속가능 식품 사업에 나서며ESG(환경·사회·지배구조) 사업 경쟁력을 강화하기로 했다.SK는 세포배양 연어육을 개발한 미국 업체 와일드타입에 약 100억원을 투자한다고 24일 밝혔다.2016년 설립된 와일드타입은 세포배양 기술로 실제 연어와 유사한 식감과 맛, 형태를 구현하는 데 성공해 내년을 목표로 연어 스테이크, 필렛 등 제품 출시를 준비하고 있다. 아직 상업화 생산 전임에도 상품성을 인정받아 미국 주요 프랜차이즈 기업들과 공급 계약을 체결하기도 했다.이 업체의 제품은 지난 8월 최태원SK그룹 회장이 미국 출장 중 와일드타입을 방문한 뒤 사회관계망서비스(SNS)에서도 소개됐다. 최 회장은 친환경·생태계 보호에 기여할 수 있는 지속가능 식품으로 평가했다.세포배양으로 만들어낸 연어초밥. 사진 최태원SK그룹 회장 인스타그램 캡처아울러SK는 대체 유(乳)단백질을 생산하는 미국 퍼펙트데이 및 한국의 매일유업과 지속가능 식품 사업 협력 관련 양해각서(MOU)를 체결했다. 대체 유단백질 기반 제품 사업을 위한 합작법인 설립을 추진한다.SK는 앞서 2020년과 2021년 두 차례 퍼펙트데이에 약 1200억원을 투자한 바 있다. 퍼펙트데이는 세계 최초로 단백질 생성 유전자에 미생물을 결합한 발효 방식으로 단백질 생산에 성공한 업체다. 네슬레 등 여러 식품업체에 아이스크림, 초콜릿, 크림치즈 등의 원료가 되는 우유 단백질을 공급한다. 퍼펙트데이가 생산하는 유단백질은 탄소발자국 국제표준규격(ISO14067) 검토를 거쳐 온실가스 배출량 97% 절감, 물 사용량 99% 절감, 에너지 사용량 60% 절감 등 효과를 인정받았다.SK가 지난해와 올해 500억원을 투자한 영국의 식물성 고기 생산업체 미트리스팜도 세계 시장에서 성장 잠재력을 높이 평가받아 아주IB투자로부터 100억원의 투자 유치를 받았다. 미트리스팜은 현재 유럽 시장에서 햄버거 패티, 소시지 등 30여 개의 제품을 판매 중인 가운데 주력 제품인 다짐육은 영국 식물성 고기 시장 내 판매 1위를 달성했다.이번 와일드타입 투자로SK는 식물성 고기(미트리스팜), 미생물 발효 단백질(퍼펙트데이·네이처스파인드)에 이어 세포배양 식품까지 아우르는 지속가능 식품 포트폴리오를 구축하게 됐다.김무환SK그린투자센터장은 “기후변화를 극복하기 위한 과정이 곧 미래 가치를 포착하는 기회가 될 수 있다”며 “지속가능 식품 등 그린 산업의 폭발적 성장에 대비해 주도권을 선점해 나갈 것”이라고 말했다."
