date,title,content
2024-01-22,"얼어붙은 스타트업 투자, 그래도 가장 많은 투자한 곳은?","그래픽=조선디자인랩 정다운고금리 여파로 지난해 국내 스타트업 투자 시장 역시 얼어 붙은 상황에서도 바이오·의료 스타트업에 대한 인기는 여전히 높은 것으로 나타났다.22일 벤처 투자 정보업체 더브이씨에 따르면, 지난해 국내 스타트업 업계에서 투자 건수 기준 가장 많은 투자를 한 기관은 벤처캐피털(VC) 한국투자파트너스로 총 76건의 투자를 집행한 것으로 나타났다. 총 투자액은 2174억3000만원이었다. 대표적 투자처는 원스토어로, 작년 12월 컨소시엄을 통해 1258억원 규모 프리IPO(기업공개) 단계 투자에 참여했다. 한국투자파트너스는SK스퀘어와 네이버에 이은 원스토어 3대 주주가 됐다. 이차전지 반도체 설계 기업 오토실리콘과 피부 미용 스타트업 엑소코바이오 등에도 투자했다. 2위와 3위는 각각 씨엔티테크(74건·76억7000만원)와 블루포인트파트너스(67건·53억4000만원)로, 초기 스타트업에 집중 투자하는 액셀러레이터(AC)들이 차지했다.그래픽=조선디자인랩 정다운투자금액 기준으로는 사모펀드 운용기업인 스틱인베스트먼트가 1위를 차지했다. 투자 건수는 5건에 그쳤지만, 총 3100억원을 투자했다. 클라우드(가상 서버) 통합관리 플랫폼 기업 오케스트로에 대한 투자(1000억원)가 가장 컸다. 그 뒤를 한국투자파트너스와 사모펀드 프랙시스캐피탈파트너스(1건·2000억원)가 이었다. 더브이씨는 “사모펀드 기업들은 전반적으로 투자 금액에 비해 투자 건수가 매우 적었다”며 “대부분의 사모투자회사는 지난해 한 건의 투자를 집행하는데 그쳤다”고 설명했다.VC업계 인기 투자처는 바이오·의료 분야였다. 한국투자파트너스의 경우 바이오·의료 분야에만 20건의 투자를 진행했고 총 418억6000만원을 투입했다.VC기준 상위 10개 투자기업으로 꼽힌KB인베스트먼트와 신한벤처투자, 하나벤처스,IMM인베스트먼트, 아주IB투자, 에이티넘인베스트먼트,LB인베스트먼트 등 역시 바이오·의료 분야 투자 건수 비중이 가장 컸던 것으로 나타났다.KB인베스트먼트와 에이티넘인베스트먼트,LB인베스트먼트는 금액 측면에서도 바이오·의료 분야 비중이 가장 높았다.그래픽=조선디자인랩 정다운"
2023-01-04,[부음] ‘무기 개발 주역’ 육굉수 교수 별세 외,"‘무기 개발 주역’ 육굉수 교수국방과학연구소(ADD)가 생기기 전 국내 무기 개발에 힘쓴 육굉수(97) 인하대 기계공학과 명예교수가 2일 오후 8시49분 대전 을지대병원에서 노환으로 별세했다. 고인은 서울대 공대를 졸업한 뒤 1951년 국방부 조병창(노량진) 기술과장, 1953년 국방부 과학연구소 기계과장, 1961년 육군 기술연구소 과학통제관 겸 기계금속과장을 지냈다. 1970년ADD가 생기기 전 국내 무기 개발의 주역이었다는 평가를 받는다. 빈소는 고려대 안암병원, 발인은 5일 오전 10시다. (02)923-4442▲김성희별세,권순자남편상,김지원아주IB투자 대표·김지혁세민화학 대표 부친상,최유미한국전력 경영평가실장 시부상=2일17시30분 서울아산병원, 발인 5일7시, (02)3010-2000▲김하운별세,김형노광주CBS선임기자 부친상,김문영광주 용산초 교감 시부상=3일0시 광주광역시 국빈장례문화원, 발인 5일8시30분, (062)606-4000▲변옥희별세,박성재前 서울고검장 장모상=2일7시 서울성모병원, 발인 5일6시45분, (02)2258-5940▲윤봉한별세,윤영숙대전관광공사 관광컨버전스팀장·윤대근워커힐호텔 부조리장 부친상=3일1시 대전 을지대학병원, 발인 5일7시, (042)611-3980▲윤종안前동국대학교 회계학과 교수 별세,윤준한前한국경제연구원 연구원·윤혜은선화예중고 강사·윤혜진밀워키 위스콘신대학 교수 부친상,박규홍뉴라이프그룹 경영지원실 전무·최운섭밀워키 위스콘신대학 교수 장인상=2일17시58분 신촌세브란스병원, 발인 5일8시20분, (02)2227-7547"
2022-12-09,[방방곡곡] 영남 지역 7개 대학 실험실이 ‘창업산실’,"28개팀, 기술 창업 도전부산·울산·경남·대구 등 영남 지역 대학 실험실들이 연구 성과에 기반한 기술 창업에 도전하고 있다.유니스트와 디지스트가 지난 2일 대구에서 개최한 영남권 대학 실험실 창업 세미나에서 참석자들이 기념 촬영을 하고 있다. /유니스트유니스트(UNIST·울산과학기술원) 동남권 실험실창업혁신단은 9~10일 부산 기장군 아난티 힐튼호텔에서 공동 성과 발표회를 연다고 8일 밝혔다. 이 발표회에는 경남대, 경북대, 경상대, 동아대, 부경대, 유니스트, 인제대 등 부산·울산·경남·대구의 7개 대학 15개 창업팀과 실험실 창업선도대학 사업에 참여한 13개 창업팀 등 총 28개 팀이 참여한다.이들 28개 팀은 유니스트 동남권 실험실창업혁신단의 지원을 받아 대학 실험실에서 내놓은 연구 성과들을 기술 사업 아이템으로 발전시켜 창업에 도전하는 절차와 과정을 밟아왔다. 동남권 실험실창업혁신단 측은 “실험실창업혁신 사업에 참여한 팀들이 성과와 발전 방안을 공유하는 자리”라며 “이후 각자 성과와 발표회에서 공유한 지식 및 경험을 기반으로 창업에 나서게 될 것”이라고 말했다.유니스트와 디지스트(DGIST·대구경북과학기술원)는 지난 2일 영남권 실험실 창업유망기술팀 공동 데모데이 행사를 열었다. 행사엔 이들 두 학교 25개 실험실 창업 유망 기술팀이 참여했다. 이 중 8개 팀은 창업 아이템 사업성 평가회도 가졌다. 평가회엔 현대기술투자, 블루포인트파트너스, 아주IB투자 등 투자사와 법무법인 디라이트, 특허법인 유니슨 등이 참여해 심사와 투자 상담·사업화 컨설팅을 했다.권순용 유니스트 산학협력단장은 “영남권 대학들이 유망한 창업 기업을 배출해 지역의 미래 성장 동력이 되도록 지원하겠다”고 말했다."
2022-01-20,"마법에 걸린 그녀들의 고민, 펨테크가 자유롭게 하리니","[WEEKLYBIZ] 월경·임신·호르몬까지 해결, 해피문데이 창업한 김도진ICT(정보 통신 기술) 발달로 커진 디지털 헬스케어 시장에서 새로 떠오르는 산업이 있다. 월경과 임신, 모유 수유, 여성 질환, 갱년기, 폐경 등 여성 건강을 위한 각종 기술과 이를 활용한 서비스를 통칭하는 ‘펨테크(FemTech,FemaleTechnology)’다. 펨테크 시장의 역사는 길지 않다. 용어 자체도 생리 주기 앱 클루(Clue)를 개발한 독일 기업가 이다 틴이 2016년 처음 쓰면서 만들어졌다. 틀이 잡힌 지 5년밖에 되지 않았지만 시장 성장세는 가파르다. 시장조사 기관 글로벌 마켓 인사이츠는 2020년 225억달러(약 26조7500억원) 규모였던 세계 펨테크 시장이 오는 2027년에는 650억달러(약 77조3000억원) 이상으로 급격히 불어날 것이라 전망했다. 작년 8월에는 미국의 메이븐 클리닉(MavenClinic)이 1억1000만달러의 시리즈 D 투자를 유치하면서 세계 최초 펨테크 유니콘 기업(기업가치 10억달러 이상 스타트업)으로 거듭나기도 했다. 영국 경제지 이코노미스트는 “펨테크 기업들이 드디어 투자 붐을 즐기고 있다”고 했다.한국 투자시장에서도 최근 주목받은 펨테크 기업이 있다. 지난달 110억원 규모의 시리즈 B 투자를 유치한 해피문데이다. 유기농 순면 생리대 정기 구독 서비스로 시작해 생리 주기와 호르몬 변화를 측정·관리해주는 앱을 개발하는 등 본격적인 펨테크 기업으로 자리 잡은 해피문데이는 하나벤처스와 아주IB투자 등 투자 기관들에 “팸테크계의 수퍼 앱으로 자리매김할 것”이라는 평가를 받았다.WEEKLYBIZ가 국내 펨테크 선두 기업으로 꼽히는 해피문데이 김도진(31) 창업자 겸CEO(최고경영자)를 만나 인터뷰했다.기회가 된 생리대 유해 물질 파동김 대표의 나이는 스타트업 업계에서도 젊은 편이지만, 경력으로 치면 10년이 다 된 중견급이다. 중학생 때부터 기업가를 꿈꾸며 서울대 경영학과에 진학한 그는 “큰 기업의 경영 사례만 얘기하는 학교 안에서 배워 창업하는 건 아니라고 느꼈다”며 학생 시절부터 일찍이 경영 현장에 뛰어들었다. 2학년 1학기를 마치자마자 휴학을 하고 모바일 광고 스타트업(랙션)과 오픈서베이 같은 리서치 기업에서 일하며 업무를 배웠고, 졸업 한 학기를 남긴 시점에는 책 추천 서비스 스타트업 ‘어떤사람들’을 공동 창업하기도 했다. 김 대표는 “고생했던 첫 창업은 2년 정도 열심히 했지만 결국 실패했고 이후 벤처캐피털에 들어가 심사 업무를 1년 정도 맡았다”며 “이런 과정을 거치면서 창업이 얼마나 어려운지와 실패했을 때 받아들이는 법을 배우게 됐다”고 말했다. 이후 “실패하더라도 들인 투자와 시간이 후회되지 않게끔 사회에 도움이 될 만한 기업을 창업하겠다”며 만든 기업이 해피문데이다.국내 펨테크 선두기업 해피문데이 김도진 대표가 서울 성수동 사무실에서 자사 여성용품들을 소개하고 있다. 해피문데이는 지난달 벤처캐피털로부터 110억원 규모의 신규 투자를 유치했다. /박상훈 기자실패를 감수하겠다며 만든 스타트업이지만, 설립한 2017년부터 운 좋게 빠른 성장세를 탔다. 때마침 ‘생리대 유해 물질 파동’이 터졌기 때문이다. 시중 유명 생리대 제품들에서 발암 물질인 다양한 종류의 휘발성 유기화합물(VOCs)이 검출됐다는 소식에 소비자들이 새로운 생리대를 찾기 시작한 것이다. 그러면서 해피문데이가 1년이라는 시간을 들여 자체 개발한 유기농 생리대 제품이 관심을 받게 됐다.김 대표는 “유기농 생리대는 인조·합성섬유 대신 천연 재료인 목화를 사용하고 방수층에 고가의 통기성 필름을 쓰는 등 재료 선정과 공정에 더 큰 비용을 들여야 하는 만큼 시중 생리대보다 가격 경쟁력이 떨어진다”며 “이 점을 극복하려 정기 구독 서비스라는 직접 판매 채널을 통해 가격을 최대한 낮췄다”고 했다. 그는 “해피문데이 생리대는 패드당 400원 수준인데 이는 가장 저렴한 제품보다는 두 배쯤 비싸지만 해외 유기농 생리대에 비하면 절반 가격이어서 프리미엄 제품을 찾는 고객들에겐 오히려 저렴하다는 반응을 받고 있다”고 덧붙였다. 시장 반응은 실적에서도 나타났다. 김 대표는 “주요 판매 채널인 정기 구독 서비스의 연간 지속률이 85%에 달한다”며 “매년 생리대 수백만 장을 만들어 팔고 있는데 이미 2019년에 손익분기점을 넘겼다”고 말했다.“펨테크 빅데이터, 여성 질병 치료에 도움”해피문데이는 생리대 외에 탐폰과 질염 테스트기, 임신 테스트기 등 다양한 여성용품으로 제품군을 확장한 데 이어 2020년 9월 여성 맞춤형 건강 모바일 앱 ‘헤이문’을 출시하며 진정한 의미의 팸테크 기업으로 성장했다. 헤이문은 생리 주기 관리와 함께 각종 설문으로 호르몬 변화를 감지해 몸 상태를 진단하고 적합한 가이드 콘텐츠를 제공하는데, 다운로드 수가 이미 45만회를 돌파했다. 가령 ‘여성의 감기’라 불리는 질염 같은 여성 질환에 대한 가이드 콘텐츠는 간호학과 약학 전공자가 만들고 산부인과 전문의에게 자문하는 방식으로 정확성을 끌어올렸다. 김 대표는 “헤이문의 생리 주기 분석 배란일 예측 알고리즘은 개인 맞춤형이다 보니 기존 표준일 계산법 대비 정확도가 30~40% 정도 높다”며 “5만명의 월경 실주기 데이터를 가지고 검증한 결과”라고 설명했다.헤이문 앱화면국내 팸테크 산업은 아직 태동기이지만, 해피문데이를 필두로 스타트업들이 속속 등장하고 있다. 비대면 질염 및 성병 자가 검사 키트 ‘체킷’을 만드는 쓰리제이, 임신부·출산모를 위한 운동 코치 앱 ‘헤이마마’ 운영사 더패밀리랩, 전국 70여 산부인과·유방갑상선외과와 제휴해 전문의 개별 상담을 제공하는 여성용 헬스케어 앱 ‘닥터벨라’를 만든 모션랩스, 여성 전문 미디어·쇼핑몰 렛허, 머신러닝으로 개인화된 여성용품을 추천해주는 플랫폼 ‘먼슬리씽’을 개발한 씽즈 등이다. 작년 8월엔 이 펨테크 스타트업들이 모여 정보 교류와 사업 제휴를 위한 동맹을 맺기도 했다.김 대표는 “팸테크 기업에 모이는 여성에 대한 빅데이터는 관련 의료 분야 발전에도 큰 도움이 된다“며 “펨테크 기업이 더 많아져 산업 파이 자체를 더욱 키웠으면 좋겠다”고 말했다.WEEKLYBIZ를 이메일로 보내드립니다.Newsletter구독하기 ☞https://page.stibee.com/subscriptions/77676"
2024-09-25,“레고 블록처럼 반도체 조립… 최적의 AI칩 만든다”,"[딥테크 인사이드] [12] 반도체설계 스타트업 ‘프라임마스’반도체 설계 스타트업 '프라임마스'의 박일 대표가 3일 서울 강남구 압구정로 프라임마스 사무실에서 본지와 인터뷰를 갖고 있다. /박상훈 기자인공지능(AI) 서버는 일종의 대형 컴퓨터다. 중앙처리장치(CPU)와 그래픽처리장치(GPU)가 들어가는AI가속기가 있고, 그 주변으로 각종 메모리 반도체가 대거 탑재된다. 서버의 설계상CPU,GPU,D램 등은 모두 각자 들어갈 위치(슬롯)가 명확히 정해져 있다. 메모리 용량을 늘리기 위해 D램만 더 설치하고 싶어도, D램이 들어갈 수 있는 위치가 정해져 있어AI서버를 통째로 사야 했다. 이런 고민을 해결하는 방법이 최근 주목받는 ‘CXL(컴퓨트 익스프레스 링크)’라는 기술이다.창업 3년 차 반도체 설계 스타트업 프라임마스가 이 시장에 도전장을 던졌다. 미국IBM과 삼성전자,SK하이닉스를 모두 거친 박일(53) 대표가 2022년 말 창업했다. 박 대표는 “우리의CXL기술을 활용하면 서버를 추가로 구매하지 않아도 D램을 타사 대비 적게는 2배, 많게는 64배 더 탑재할 수 있다”고 했다.반도체 설계 스타트업 프라임마스의 박일 대표가 최근 서울 강남구 사무실에서 인터뷰 중 자사의 칩렛 시제품을 설명하고 있다. /박상훈 기자삼성전자에서 반도체 설계 업무를 했던 박 대표는 2015년SK하이닉스로 옮겨 창업 직전까지 D램 설루션 개발 부사장을 맡았다. 그는 “AI반도체 등 새로운 시장이 열리는 것을 보고 창업을 결심했다”며 “우리가 설계하는 반도체는 완전히 새로운 제품이기 때문에 항공모함과 같은 대기업보다 스타트업이 도전하기에 적합하다고 생각했다”고 말했다.프라임마스가 특히 집중하는 기술은CXL반도체를 가장 효율적으로 구현하기 위한 ‘칩렛(Chiplet)’이라는 기술이다. 여러 반도체를 레고 블록 맞추듯이 조립하면CXL메모리도 되고,AI가속기도 되는 기술이다.AI가속기를 만드는 기업이 핵심 반도체만 가지고 오면, 다른 부가적인 반도체들을 붙여 효율성이 높은AI가속기를 만들어 준다. 박 대표는 “AI가속기를 예로 들면GPU만 있다고 끝이 아니고, 고대역폭메모리(HBM) 등 다른 반도체도 탑재해야 하는데, 이들이 유기적으로 동작할 수 있도록 하는 데에도 비용과 시간이 어마어마하다”며 “마치 레고의 기본 블록처럼 다양한 반도체를 결합해 완성도 높은AI가속기를 만드는 게 칩렛 기술”이라고 말했다.그래픽=조선디자인랩 정다운프라임마스는 2026년부터 자체 칩 양산에 들어가,CXL메모리와AI가속기 시장을 공략한다는 계획이다. 특히 기업 맞춤형이나 저전력·고효율AI가속기용 칩을 개발하는 반도체 설계 기업들과 스타트업들이 주목하고 있는 것으로 알려졌다. 지난달 말에는 삼성전자가 프라임마스와 업무협약(MOU)을 맺고 차세대CXL메모리 설루션 개발에 협력하기로 했다. 박 대표는 “삼성전자와 협업은 미래 데이터센터 시장에서 우위를 확보하는 데 중요한 역할을 할 것”이라고 말했다. 본격적인 제품 생산은 이뤄지지 않았지만, 지금까지 타임폴리오자산운용, 인터베스트, 아주IB등으로부터 2150만달러(약 287억원) 투자를 유치했다. 박 대표는 “AI반도체 시장도 수익성이 중요해지는 만큼, 비용을 아끼면서 효율성을 높이는CXL과 칩렛 같은 기술 분야를 누가 선점하느냐가 중요해졌다”고 말했다."
