date,title,content
2022-02-17,"외국인들 돈 빼도 너무 뺀다, 개미 울리는 코스닥","15일까지 2조7865억 순매도 ‘역대최대’“오늘 코스닥이 깜짝 반등한 덕분에 마이너스(손실)가 좀 줄었네요. 하지만 아직 원금 회복하려면 멀었습니다.”16일 코스닥지수가 전날보다 4.6% 오른 878.15로 마감했지만, 위메이드나 에코프로비엠 등 코스닥 주요 종목을 보유한 주주들은 활짝 웃지 못했다. 올해 코스닥 하락 폭이 워낙 커서 손해를 보고 있는 상황이기 때문이다. 온라인 주주 게시판에는 아쉬움을 드러내는 글들이 많이 올라왔다.이날 코스닥지수 상승률은 2020년 6월 16일(6.1%) 이후 가장 높았다. 하지만 코스닥지수는 여전히 지난해 말(1033.98)보다 15.1% 하락한 상태다. 러시아가 우크라이나 접경 지대에서 군사훈련을 중단하고 일부 병력을 철수하면서 전쟁 발발 같은 최악의 상황은 피해가는 분위기다. 하지만 미국 연방준비제도(연준)가 물가 급등세를 잡기 위해 금리 인상 등 통화 긴축 정책을 강화할 가능성이 높기 때문에 앞으로 증시 전망을 낙관하기도 어렵다.역대급 외국인 ‘셀 코스닥’올해 코스닥시장 하락을 주도한 것은 외국인 투자자들이다. 외국인은 올 들어 지난 15일까지 코스닥 시장에서 2조7865억원을 순매도했다. 역대 최대 규모다. 2018년 같은 기간 순매도액(1조794억원)의 2배가 넘는다.국내외 금리가 상승하는 상황에서 연준이 인플레이션에 대응하기 위해 통화 긴축 정책의 고삐를 더 빠르게 조일 것이란 전망이 투자자들을 불안하게 하고 있다. 특히 금리 인상기에는 테크기업처럼 기업의 미래 성장성 등을 보고 투자하는 성장주들이 타격을 많이 입는다. 금리가 오르면 현재 가치로 환산한 기업의 미래 가치가 작아지기 때문이다. 정명지 삼성증권 투자정보팀장은 “금리 인상이 가속화될 것이라는 우려 속에 코스닥 시장에서는 성장주가 주를 이루기 때문에 외국인 매도세가 두드러져 보이는 것”이라며 “코스피 시장에서는 외국인들이 성장주를 많이 팔았지만, 반대로 금리 인상기에 수익을 낼 수 있는 금융주 등을 사들였기 때문에 순매도 규모가 적은 것”이라고 했다.지난달 코스피 시가총액 2위인LG에너지솔루션이 상장한 것도 코스닥시장에는 악재로 작용했다. 편득현NH투자증권WM마스터즈 전문위원은 “외국인 투자자들은 전반적인 증시 ‘조정’ 국면에서 국내 증시 투자 비중은 줄이면서도LG에너지솔루션 주식은 코스피 시장 내 비중만큼 사들여야 했다”며 “상대적으로 실적이 저조했던 코스닥 주식을 매각한 돈으로LG에너지솔루션을 사들인 것으로 보인다”고 했다.저가 매수 나선 개인 투자자 손실올 들어 지난 15일까지 개인 투자자들은 코스닥 시장에서 3조9570억원을 순매수했다. 주가가 하락하자 반등을 기대하면서 ‘저가 매수’에 나선 것이다. 하지만 주가가 계속 떨어지는 바람에 개인 투자자들의 수익률은 부진한 상태다.올 들어 종목별 평균 순매수 가격과 15일 종가를 비교해보면 개인 투자자들은 코스닥 시장 순매수 상위 5개 종목에서 모두 손실을 보고 있다. 개인 순매수 1위인 게임회사 위메이드 주식의 평균 순매수 가격은 13만4200원인데 15일 종가와 비교해보면 수익률은 -27.7% 수준일 것으로 추정된다. 16일 위메이드 주가가 전날보다 12.1% 높은 10만8700원까지 올랐지만, 여전히 개인 투자자들이 순매수한 가격에는 못 미치는 수준이다. 개인 투자자들은 카카오게임즈(수익률 -10.7%), 에코프로비엠(-8.7%), 엘앤에프(-9.1%), 펄어비스(-18.1%) 등 코스닥 배터리·게임주에 주로 투자했지만 대부분 마이너스 수익률을 기록하고 있다.당분간 코스닥 지수가 크게 반등하기는 어렵다는 전망도 나온다. 러시아군이 일부 철수하면서 전쟁 가능성이 낮아진 것은 주식 시장에는 반가운 소식이지만, 연준 등 각국 중앙은행이 물가 상승에 대응하기 위해 유동성 축소 조치에 나서야 하는 상황은 바뀌지 않았기 때문이다. 정명지 팀장은 “연준이 기준 금리 인상 외에도 양적 긴축(보유한 자산을 팔아 시중 자금을 회수하는 정책) 등도 추진할 텐데 시장에 어떤 충격을 줄지 예상하기 어려운 상황”이라며 “당분간 코스닥 지수가 지난해 말보다 높은 수준까지 상승하기는 어려울 수 있다”고 했다."
2022-02-09,“금융위기 터졌나” 셀스닥 미스터리… 외국인 순매도 2008년 이후 최대 [왕개미연구소],"“한국에 금융위기라도 터진 건가요? 왜 이렇게 코스닥에서 외국인들이 주식을 많이 파는 건가요?”(소액주주 A씨)올해 유난히 심해진 외국인의 셀스닥(Sell+코스닥)에 투자자들의 관심이 쏠리고 있다. 외국인의 거센 매도 공격이 이어지면서 작년 말 1000선에서 움직이던 코스닥지수는 이제 900선에 안착하는 것조차도 힘겨워진 상황이다.8일 한국거래소에 따르면, 올해 외국인 투자자들이 코스닥 시장에서 순매도한 금액은 8일까지 무려 2조4925억원에 달했다. 1년 중 아직 두 달도 채 지나지 않았는데, 글로벌 금융위기가 한창이던 지난 2008년 외국인의 1년간 코스닥 순매도 금액(3조4843억원)의 71%에 육박한다.외국인은 무슨 이유로 이렇게 코스닥 주식을 매도하는 것일까. 금리 인상 기조 속에 실적 대비 주가가 비싼 성장주가 많은 코스닥 선호도가 낮아졌기 때문이라고 해도 단기간 지나치게 순매도 금액이 많다는 점에 증시 전문가들은 주목하고 있다.그로스파인더 운영자인 장현호씨(전 펀드매니저)는 “코스닥 시총 탑10 내에는 2차전지 관련 기업(에코프로비엠, 엘앤에프, 천보 등)들이 다수 포진해 있는데,LG에너지솔루션이라는 괴물이 나타나면서 문제가 생겼다”면서 “코스닥 2차 전지 기업들을 팔아야 할 요인이 생겼는데, 이를 투자 기회로 삼은 숏포지션(공매도)이 꽤 늘어난 것이 코스닥 하락 원인으로 보여진다”고 말했다.실제로 지난 4일 기준 코스닥 시가총액 2위인 에코프로비엠의 공매도 잔고수량은 27만2200주로, 지난해 5월 공매도 재개 이후 사상 최대치를 기록했다. 코스닥 시총 3위인 엘앤에프 역시 지난달 28일 공매도 잔고수량이 최대치를 기록했고, 지난 4일 공매도 잔액은 사상 최고치를 찍었다.유튜브 ‘퀵시황’ 진행자인 한화투자증권 최경진 차장 역시LG에너지솔루션을 원인으로 꼽았다. 최 차장은 “LG에너지솔루션이 코스피 종목이라서 코스닥과는 아무 상관이 없다고 생각할 수 있지만, 한국 시장이 이머징 지수에서 차지하는 비중은 코스피와 코스닥을 합쳐 계산한다”면서 “LG엔솔을 포트에 담으려면 다른 주식 비중을 깎아내야 하는데 코스피 인덱스 전체를 매도하는 기관과 달리, 외국인은 코스닥만 집중 매도하고 있다”고 말했다.최 차장은 이어 “외국인의 코스닥 비중이 우리 생각보다 큰 것으로 여겨진다”면서 “게임, 반도체, 컨텐츠 등 업종을 가리지 않고 거의 전 업종에서 시총이 큰 종목들을 매도하고 있다”고 말했다.오는 14일LG에너지솔루션이MSCI지수에 조기 편입되고 나면, 수급 불균형 문제가 풀리면서 다소 상황이 나아질 것이라고 최 차장은 덧붙였다.연초에 터진 오스템임플란트의 대규모 횡령 사건 때문에 외국인이 실망해 떠나는 것이란 의견도 있다. 대형 증권사 관계자는 “시가총액 2조원이 넘어 코스닥 19위인 오스템임플란트가 사상 초유의 횡령 사고를 내면서 시장 신뢰도에 금이 갔다”면서 “국내 기업들의 내부 통제가 잘 이뤄지지 않는다는 것을 대외적으로 알린 것이어서 외국인들은 등을 돌릴 수밖에 없을 것”이라고 말했다.8일 서울 중구 하나은행 명동점 딜링룸 전광판에 코스닥 지수가 전거래일보다 0.46% 하락한 895.27을 나타내고 있다./뉴스1"
2022-01-26,“지옥문이 열렸다” 끝없는 악재 뉴스에 개미군단 비명,"[왕개미연구소]앞으로 개인 투자자들은 2022년 1월의 다이나믹한 한국 증시를 결코 잊지 못할 것이다. 계절적으로 1월 주식 시장은 호조라는 ‘1월 효과’를 완전히 뒤집었기 때문이다. 이달 25일까지 코스피는 9% 하락했는데, 남은 기간 반등하지 못한다면 최악의 1월 증시로 기록될 전망이다.2022년 새해가 시작되자마자, 한국 증시엔 역대급 폭탄이 줄줄이 떨어졌다.26일 개인 투자자들 사이에선 2022년 1월 한국 증시에서 생긴 이벤트들을 정리한 한 장의 사진이 화제였다./블로그 캡처오스템임플란트 횡령,HDC현대산업개발 아파트 붕괴, 메드팩토 임상 반려, 셀트리온 분식회계 의혹, 위메이드 위믹스 코인 대량 매도, 신라젠 상장폐지 결정, 카카오페이 경영진 사퇴,LG에너지솔루션 114조원 청약, 안트로젠 임상 실패, 에코프로비엠·효성티앤씨 공장 화재, 비트코인 4만달러 붕괴, 나스닥 1월 최악의 수익률, 공무원 공금 115억 횡령해 주식 투자, 에코프로비엠 내부자 거래 혐의...간단하게 정리한다고 했는데도 이렇게나 많은 일이 한 달 만에 일어났다. 금융 전문가들은 국내 증시에서 소액 주주들이 안심하고 장기 투자를 할 수 있도록, 상장사의 금융 불법 행위에 대한 강력한 처벌이 필요하다고 지적한다. ‘솜방망이 처벌’이라는 말이 나올 정도로 처벌이 미약하면, 개인 주주들을 울리는 금융 비리는 근절시킬 수 없다는 것이다.대형 증권사 관계자는 “지난해 9월 남부지검에 금융 증권범죄수사협력단을 다시 만든 것만 봐도 우리 사회에서 금융 범죄가 얼마나 빈번한지 알 수 있다”면서 “금융 범죄를 강력하게 처벌하는 사회적 분위기 조성이 필요하며 대선 후보들도 이런 문제에 관심을 갖고 소액 주주들을 위한 제도 마련에 나서주길 바란다”고 말했다.26일 오후 서울 중구 하나은행 본점 딜링룸에서 직원들이 업무를 보고 있다. 이날 코스피는 전날보다 0.41% 내린 2709.24에 장을 마쳤고, 코스닥지수는 882.09에 마감했다./연합뉴스한편, 가뜩이나 산적해 있는 해외 악재에 내부 악재들이 겹쳐지면서, 천하무적 개미 군단도 체력이 바닥나고 있다. 1년 전인 작년 1월에만 해도 국내 주식시장의 일 평균 거래대금은 26조원이 넘었는데, 이달은 10조원으로 62% 감소했다.26일 코스피는 전날보다 0.41% 내린 2709.24에 마감했다. 이날 외국인이 2500억원 가량 주식을 순매도했고, 기관도 적극적인 매매 없이 163억 순매도였다.투자자들은 오는 25~26일(현지 시간) 진행되는 미국 연방공개시장위원회(FOMC) 정례회의 결과를 기다리며 관망하는 모습이었다. 이날 코스피 거래대금은 8조8000억원으로, 1월 일평균 거래 대금에 못 미쳤다.27일 상장하는LG에너지솔루션이 증시 자금 블랙홀이 되어 수급이 꼬일 것이란 우려도 증시를 압박하는 요인이다.LG에너지솔루션은 공모가(30만원) 기준으로 시가총액이 70조원에 육박하는데, 상장하자마자 삼성전자(437조원), 하이닉스(85조5000억원)에 이어 코스피 시총 3위를 기록할 전망이다. 만약 상장일에 주가가 올라서 증권업계 예상대로 시총이 100조원까지 불어난다면 순식간에 코스피 시총 2위다."
2022-01-23,4명 사상 청주공장 화재 현장감식…‘유증기 폭발’ 가능성 등 조사,"지난 21일 직원 1명이 사망한 청주 자동차 배터리 공장 화재 현장 모습. /연합뉴스지난 21일 충북 청주 에코프로비엠 공장에서 발생한 화재로 1명이 숨지고 3명이 다친 사고의 원인을 규명하기 위한 현장 감식이 실시됐다. 경찰과 소방당국은 보일러실 내 유증기 폭발 가능성 등에 일단 무게를 두고 정확한 화재 원인을 조사중인 것으로 알려졌다. 국립과학수사연구원 등이 참여하는 공식 합동 감식은 오는 24일 오전 10시 이뤄질 예정이다.23일 소방당국 등에 따르면 전날 오전 실시된 현장 감식에는 경찰과 소방당국, 고용노동부와 금강유역환경청 등 유관 기관들이 참여했다. 최초 발화지점으로 추정되는 4층 보일러실을 중점 조사한 경찰과 소방당국은 보일러실 내 유증기 폭발 가능성 등에 일단 무게를 두고 화재 원인을 조사 중인 것으로 알려졌다. “화재 당시 공장에서 ‘펑’하는 폭발음이 연이어 들렸다”는 목격자 진술도 확보된 것으로 알려졌다.대전고용노동청은 지난 21일 공장에 대한 전면 작업 중지를 명령했고, 22일 업체 대표이사를 산업안전보건법 위반 혐의로 입건했다. 노동부는 이 업체가 유해·위험 설비에 대한 공정안전 보고서를 정부에 제출한 뒤 적합 판정을 받기 전 설비를 가동하다가 사고가 발생한 것으로 보고 있다.김경태 대전고용노동청장은 “화재 원인과 안전조치 위반 행위 등을 철저히 조사해 책임자를 엄정 조치할 것”이라며 “유사 사고가 재발하지 않도록 사고 예방에 최선을 다하겠다”고 말했다.지난 21일 오후 3시쯤 청주시 청원구 오창읍 2차전지 소재 기업인 에코프로비엠 공장 4층에서 불이 났다. 당시 건물 내부에 있던 직원 30여 명은 재빨리 대피해 화를 면했다. 하지만 4층에 있던 이 회사 직원 A(34)씨 등 4명은 즉시 대피하지 못했다. 대피하지 못한 A씨가 숨졌고, 나머지 2명은 소방당국에 의해 구조됐다. 다른 1명은 건물 밖으로 뛰어내리다 크게 다쳤다.경찰 관계자는 “합동 감식을 통해 화재 원인을 조사하고 공장 관계자 등을 상대로 공장 내 안전관리 준수 여부도 확인할 방침”이라고 말했다."
2022-01-21,"청주 오창 2차전지 제조 공장서 화재…1명 사망, 3명 부상","21일 오후 3시쯤 충북 청주시 청원군 오창읍 한 배터리 제조 공장서 화재가 발생해 소방당국이 진화에 나섰다. /뉴시스충북 청주시 오창과학산업단지 2차전지 제조공장에서 불이나 1명이 숨지고 3명이 다쳤다.21일 충북소방본부에 따르면 이날 오후 3시쯤 청주시 청원구 오창읍 에코프로비엠 청주공장에서 폭발과 함께 불이 났다. 이 사고로 4층에서 생산라인 관리 업무를 담당하던 A(34)씨가 숨졌고, 다른 근로자 3명이 중·경상을 입어 병원으로 이송돼 치료를 받고 있다.불이 난 에코프로비엠은 2차전지 소재 제조 기업으로 최근 코스닥 시가총액 1~2위에 올라있다.이날 불은 공장 4층 전기보일러실 부근에서 폭발과 함께 시작됐다. 목격자는 “공장에 검은 연기가 보이고 폭발이 있었다”고 119에 신고했다.신고를 받고 출동한 소방당국은 대응 1단계를 발령하고 진화에 나섰다가 오후 3시 40분쯤 대응 2단계로 격상, 소방인력 125명과 장비 44대를 투입해 진화 작업과 구조작업을 벌였다.불이 나자 공장에 있던 근로자 대부분이 대피했지만 A씨는 화재 발생 3시간 30분이 지나 4층에서 숨진 채 발견됐다. 근로자 1명은 불을 피해 4층에서 뛰어내려 부상을 입었다.소방 관계자는 “내부 구조가 복잡하고 붕괴 위험이 있어 현장 접근에 어려움이 있었다”고 말했다.경찰과 소방당국은 정확한 화재 원인을 조사하고 있다."
2023-11-01,"이차전지주 약세 언제까지...에코프로, 주당 60만원선도 붕괴","에코프로비엠 청주 오창 본사 전경(에코프로 제공) /뉴스1한때 황제주(주당 100만원이 넘는 주식)였던 이차전지 기업 에코프로 주가가 60만원선 아래로 내렸다.1일 에코프로 주가는 전일 대비 3.7% 내린 59만7000원에 거래를 마감했다. 종가 기준으로 에코프로 주가가 60만원을 밑돈 것은 지난 6월5일(56만6000원) 이후 처음이다. 이날 에코프로 주가는 장중 59만원까지 떨어지기도 했다.이차전지 투자 열풍이 식으면서 에코프로 주가는 큰 폭의 조정을 받고 있다. 지난 7월 말엔 주당 153만9000원까지 치솟기도 했지만 글로벌 전기차 시장의 성장세가 둔화되면서 주가가 연일 급락하는 중이다. 에코프로 주가는 10월 한 달 동안에만 31% 빠졌다.국내 다른 이차전지 종목들 주가도 내리막길을 걷고 있다. 지난달 포스코홀딩스와 에코프로비엠 주가는 각각 23%, 22% 하락했다. 글로벌 전기차 수요가 둔화하는데다 리튬 가격 하락, 중국의 흑연 수출 통제 등 악재가 쌓이며 주가에 부정적 영향을 미치고 있다.이차전지ETF(상장지수펀드)들도 급락하는 중이다.TIGER2차전지소재FnETF는 이날 2.4% 하락한 6830원에 거래를 마감했다. 상장 이후 최저가로, 최근 3개월 수익률이 -44.4%를 기록했다. 이밖에KODEX2차전지핵심소재10FnETF와SOL2차전지소부장FnETF는 지난 7월 말 고점 대비 각각 59%, 54%씩 내렸다."
2023-11-07,공매도 금지 이틀째엔 주가 급락… 에코프로 하루종일 오르락 내리락,"코스피가 7일 1% 넘게 하락 출발해 2,450대로 밀려났다. 지수는 전장보다 26.02포인트(1.04%) 내린 2,476.35에 개장한 뒤 낙폭을 키우고 있다. 사진은 7일 오전 서울 중구 하나은행 딜링룸/연합뉴스전날 공매도 전면 금지에 따라 급등했던 국내 증시가 하루 만에 하락했다. 일각에선 외국인이 공매도를 청산하기 위해 주식을 사면서 주가가 급등하는 현상이 끝났다는 분석도 나온다.7일 코스피는 전날보다 58.41포인트(2.33%) 급락한 2443.96에, 코스닥지수는 15.08포인트(1.8%) 내린 824.37에 거래를 마쳤다. 코스피는 하루 만에 2500선을 내주고 말았다. 이날 장중 한때 코스닥지수가 4%가량 급락하면서 오전 11시 48분쯤 프로그램 매도 호가 효력을 일시 정지하는 매도 사이드카(sidecar)가 발동되기도 했다. 전날엔 코스닥 지수가 급등해 매수 사이드카가 발동됐는데, 이틀 연속 사이드카가 발동한 것이다.전날 급등세를 보였던 이차전지주가 특히 부진한 모습을 보였다. 전날 25% 급등했던 엘앤에프가 15.3% 폭락했고, 포스코홀딩스(-11%),LG에너지솔루션(-10.2%), 포스코퓨처엠(-11%), 금양(-7.3%) 등도 큰 폭으로 내렸다. 전날 상한가를 기록한 에코프로 주가는 이날 ‘롤러코스터’를 탔다. 장 초반 급등세를 보이며 주가가 90만원을 넘어섰지만, 오후 들어 하락세로 전환해 80만원선이 무너졌다가 결국 장 막판 반등에 성공, 전날보다 3.7% 오른 85만9000원에 거래를 마쳤다. 에코프로와 함께 전날 상한가를 기록했던 에코프로비엠도 장 초반 ‘반짝’ 상승세를 보였지만, 이내 하락 전환해 현재는 전날보다 4.9% 급락했다.이차전지 외에 시가총액 상위 종목들도 대체로 하락세를 나타냈다. 유가증권시장에서 삼성전자가SK하이닉스가 2% 하락했고, 현대차(-1%), 네이버(-2.4%) 등도 주가가 내렸다. 코스닥시장에서도 셀트리온헬스케어(-2.7%),HLB(-1.8%),JYP엔터(-3.2%) 등의 주가가 내렸다.이날 주가가 약세를 보인 것은 전날 공매도 청산을 위해 주식을 사들였던 외국인들이 ‘팔자’세로 돌아섰기 때문이라는 분석이 나온다.전날 유가증권시장(코스피)에서 7100억원어치, 코스닥시장에서 4800억원어치 등 1조2000억원 가까이 순매수(매수가 매도보다 많은 것)하며 지수 상승을 이끌었던 외국인은 이날은 순매도로 돌아섰다. 외국인은 유가증권시장에서 1000억원, 코스닥시장에서 2400억원어치 순매도하는 등 3000억원 넘게 팔아치웠다.김대준 한국투자증권 연구원은 “숏커버(공매도 한 주식을 갚기 위해 되사는 것)가 완전히 끝났다고 확신할 수는 없지만, 6일 상당 부분 진행이 됐을 것”이라면서 “4~5일, 아주 길게 봐도 2주일이면 공매도 물량 청산이 끝날 것”이라고 말했다. 그는 이어 “공매도 금지 이슈는 수급과 관련된 단기 이벤트이고, 이 기간이 끝나면 주가는 결국 펀더멘털(기초여건)을 따라갈 것”이라고 덧붙였다.기관도 유가증권시장과 코스닥시장에서 각각 4000억원, 2200억원어치 순매도했다. 반면, 개인은 유가증권시장에서 4600억원, 코스닥시장에서 4700억원 등 9000억원 넘게 순매수했다.전날 1200원대로 내려왔던 달러화 대비 원화 환율은 전날보다 10.6원 오른 1307.9원에 마감했다."
2023-10-24,에코프로 前회장 계좌서 2995주 팔렸다... 알고보니 제3자 무단 매각,"에코프로측 “경찰 수사 진행중”이동채 전 에코프로 회장. / 에코프로 제공미공개 정보 이용 혐의가 확정돼 수감 중인 이동채 전 에코프로 회장의 보유 주식 일부를 제3자가 무단으로 매각하고 매각 대금을 인출하려 한 혐의가 포착됐다. 에코프로 측은 이같은 사실을 인지해 경찰에 수사를 의뢰했다.23일 금융감독원 전자공시시스템에 따르면 지난 16일과 17일, 19일 이 전 회장의 에코프로 지분 2995주가 매각됐다. 16일 215주(87만9000원), 17일 1000주(85만1349원)에, 19일 1740주(83만8185원)로, 금액으로는 24억9877만원 규모다. 이에 따라 이 전 회장의 지분은 18.84%에서 18.83%로 소폭 줄었다.에코프로는 공시에서 “상기 3건의 장내 매도는 보고자(이동채)의 명의 및 계좌정보가 제3자에게 무단 도용되어 보고자의 동의 없이 매도된 건”이라며 “현재 피해 사실을 바탕으로 경찰 수사가 진행되고 있으며, 수사 결과 및 관계부서와의 협의에 따라 본 공시는 정정될 수 있다”고 밝혔다. 에코프로는 특수관계인인 이 전 회장의 지분 매각 사실을 자본시장법 공시 의무 이행을 위해 이날 공시했다.에코프로는 최근 이 전 회장의 거래 증권사로부터 이 전 회장의 에코프로 주식 2995주가 매각된 사실을 통보받았다고 한다. 그러나 이 전 회장이 주식을 매각한 사실이 없으며, 추가 피해 방지를 위해 그의 모든 계좌에 대해 지급 정지 조치를 했다고 에코프로 측은 밝혔다.이 전 회장은 지난 2020~2021년 양극재 제조 계열사 에코프로비엠의 공급계약 정보를 금융감독원 전자공시시스템에 공개되기 전 차명 계좌로 미리 주식을 샀다가 되팔아 11억원의 시세차익을 챙긴 혐의로 실형을 확정받고 복역 중이다. 대법원은 지난 8월 이 전 회장에게 징역 2년과 벌금 22억원, 추징금 11억여원을 선고한 원심을 확정했다."
