date,title,content
2022-02-23,"“복잡한 정책 문제, 정치인이 한방에 해결할 순 없어”","24일 출범 서울대 국가미래전략원 초대 원장 김병연 교수 인터뷰김병연 서울대 국가미래전략원 원장이 21일 화상으로 본지와 인터뷰를 진행하고 있다/김명성 기자““우리나라는 대통령이 한마디 하면 주변 정치인들이 정책을 만들어 사회에 던졌다 실패하는 과정이 반복돼왔습니다. 이제는 정치인은 사회와 소통하고 국민을 설득하는 역할만 맡고, 필요한 정책은 전문가 그룹이 만들어야 합니다.”서울대 국가미래전략원 초대원장을 맡은 김병연 서울대 경제학부 교수는 22일 본지 인터뷰에서 새로 출범한 국가미래전략원이 연구의 독립성과 복합적 난제를 해결하는 최적의 기관이 될 것”이라며 이같이 말했다. “복잡한 정책 이슈를 전문성 없는 정치인들이 한방에 해결하겠다고 나서면 실패할 수 밖에 없고 한국 사회는 계속 무너지게 된다”는 것이다. 그는 “소득주도성장이나 비정규직의 정규직화 등이 다 그런 경우”라고도 했다.국가미래전략원은 서울대가 국가 발전을 위한 장기 연구과제를 수행하고 비전을 모색하기 위해 신설한 싱크탱크다. 2019년 출범한 본부 산하의 기존 국가전략위원회와 달리 독립적인 상설 조직으로 운영된다. 김병연 교수가 초대원장을 맡고, 반기문 전 유엔사무총장이 명예원장으로 위촉됐다. 영원무역 성기학 회장의 기부로 지난해 준공된 서울대 우석경제관 4층에 입주한 국가미래전략원은 오는 24일 개원식을 갖는다.김병연 서울대 교수는 22일 본지 인터뷰에서“정치인은 국민을 설득하고 필요한 정책은 전문가가 만들어야 한다”고 했다. 사진은 2019년 김 교수의 모습. 이번 인터뷰는 화상으로 진행했다. /이진한 기자김 원장은 “정치인들과 달리 전문가들은 이슈가 생기면 정책의 파급 효과 등을 세밀하게 이해하고, 조정해 효과적인 결과를 만들어 낼 수 있다”며 “국가미래전략원 설립 배경에는 이런 문제 의식이 있었다”고 했다. 그동안 서울대 안팎에서 ‘서울대의 사회적 기여가 부족하다’는 문제의식에 공감대가 컸다고 한다. 그는 국가미래전략원에 대해 “서울대 교수들이 우리 사회를 위해서 내가 일하지 않으면 안 되겠다는 절박함이 만들어낸 산물”이라고도 했다.국가미래전략원은 외교·안보·경제·사이버·과학기술 분야를 융합한 5개의 주제를 선정해 연구를 진행하게 된다. △세계 질서의 변화와 한반도 미래의 융복합적인 문제해결 △저출산 고령화 문제 △민주주의 위기 극복 △감염병 위기 대처 △과학기술의 미래연구 등이다.영국 옥스퍼드대에서 ‘사회주의 체제’ 연구로 박사학위를 받고 사회주의 및 체제 이행을 연구해온 김 원장은 손꼽히는 북한 경제 전문가다. 2006년부터 서울대 경제학부 교수로 재직하며 서울대 통일평화연구원 부원장을 맡았고, 2020년부터 원장으로 활동하고 있다. 통일과나눔재단 이사이기도 하다. 그는 지난 10여 년간 통일의식조사, 남북통합지수, 북한이탈주민 조사 등 북한경제 및 통일문제와 관련된 학술활동을 이어오고 있다.김 원장은 “통일평화 문제는 우리 국가의 주요 과제이기에 지속적으로 연구하고 정책을 제안하겠다”며 “통일평화연구원이 중견기업이라면 국가미래전략원은 벤처기업이라고 할 수 있다. 둘 사이의 시너지 효과가 날 것으로 본다”고 했다. 그는 또 “북한 문제는 언제 터질지 모르는 다이너마이트인데, 인구 문제는 터질 게 분명한 다이너마이트라는 말이 있다”며 “저출산 문제를 경제학적인 관점에서 다루면 답이 나오지 않기에 문화·인류학·철학적 관점에서 융·복합적으로 다룰 것”이라고 했다. 김 교수는 “전 세계가 민주주의 위기를 경험하고 있는 가운데 이를 극복하기 위해선 정치제도도 필요하지만 개인이 민주주의를 잘 이해하고 판단할 수 있는 시민교육이 중요하다”고도 했다"
2022-12-27,"영원무역·영원아웃도어, 숙명여대에 발전기금 10억 원 기부","영원무역과 영원아웃도어가 숙명여자대학교에 산학연 발전기금 10억 원을 기부했다.숙명여대는 지난 23일 서울 중구 영원무역 명동 빌딩에서 영원무역·영원아웃도어의 성기학 회장과 성래은 부회장, 숙명여대 장윤금 총장과 박종성 부총장 등 양 기관 관계자가 참여한 가운데 발전기금 전달식을 개최했다고 밝혔다.이번에 영원무역과 영원아웃도어가 기부한 10억 원은 ‘영원무역·영원아웃도어-숙명여대 산학연 발전기금’으로 조성돼 글로벌 미래인재 양성 및 창업 인큐베이터 혁신,ESG공동 실천을 위해 쓰이게 되며 채용 연계 인턴십등에도 지원될 예정이다.성기학 회장은 “미래세대의 주역인 학생들이 글로벌 마인드와 역량을 겸비한 창의적 인재로 성장하는데 조금이나마 보탬이 되길 희망한다”며 “15년째 이어온 숙명여대와의 산학협력을 통해 국내 의류·패션 산업 발전을 계속 도모해 나가며, 다양한 협업을 이어나갈 계획”이라고 밝혔다.숙명여대는 지난 2008년부터 영원무역과 산학협력을 맺고 평창동계올림픽 라이선스 상품 개발 프로젝트, 친환경 업사이클링 졸업작품전 진행 등 다양한 산학협력 프로그램을 15년째 전개하며 발전적인 파트너십을 구축해 왔다.또한 앞서 2021년 성기학 회장이 1억 원의 발전기금을 전달한 바 있으며, 숙명여대는 성 회장의 뜻을 기리고자 교내에  ‘영원무역 강의실’을 명명했다. 이번 발전기금 전달을 통해 양 기관은 우수 인재 양성은 물론, 친환경 제품 개발과 같은ESG기반의 산학협력 프로젝트를 계속 공고하게 이어나갈 계획이다.장윤금 총장은 “뉴노멀 시대, 디지털·인공지능 시대에 전문성과 직무경쟁력을 갖춘 글로벌 인재를 육성할 수 있도록 기부금을 소중하게 쓰겠다”고 말했다."
2024-10-18,한일 재계 “새로운 60년 준비하자”...조현준 “한일 관계 때가 무르익었다”,"류진 한국경제인협회 회장과 안덕근 산업통상자원부 장관, 도쿠라 마사카즈 경단련 회장을 비롯한 양국 기업인들이 18일FKI타워 컨퍼런스센터에서 열린 '제31회 한일재계회의'에 참석해 기념촬영을 하고 있다. 한경협과 경단련은 이날 회의에서 ▶OECD,APEC,G20, G7 등에서의 한일 간 협력을 위한 노력 ▶지속가능한 사회 실현 노력 ▶안정적 공급망 및 수소 등 청정에너지 협력 ▶신생산업 등에서의 국제표준 마련 협력 ▶한미일 경제 협력 강화 ▶AI양자컴퓨터 등에 있어 고도인재 활용협력 ▶스타트업 협력 ▶국교정상화 60주년 기념 다양한 세대·분야 협력 등의 내용을 담은 공동성명서를 채택했다. 사진 한경협내년 한일 국교 정상화 60주년을 앞두고 한국과 일본 재계가 협력을 위해 머리를 맞댔다. 한일재계는 ‘새로운 60년’을 만들어 가자는 데 뜻을 모으고 “양국 공동 번영을 위해 미래지향적인 협력을 지속하자”는 내용의 공동성명을 채택했다.한국경제인협회(한경협)와 일본경제단체연합회(경단련)는 18일 서울 여의도 한경협회관에서 31번째 ‘한일재계회의’를 개최했다. 한국 측에서는 류진 한경협 회장을 비롯해 조현준 효성 회장, 김윤 삼양홀딩스 회장, 이장한 종근당 회장, 김남구 한국투자금융지주 회장 등 기업인 17명이 참석했다. 일본 측에서는 도쿠라 마사카즈 게이단롄 회장을 비롯해 사와다 준 일본전신전화 회장, 효도 마사유키 스미모토상사 회장, 우치다 타카시 도쿄가스 회장 등 7명이 자리했다.(서울=뉴스1) 이승배 기자 = 조현준 효성 회장이 18일 서울 여의도FKI타워 컨퍼런스센터에서 열린 '제31회 한일재계회의'에 참석하고 있다. 2024.10.18/뉴스1이날 회의장을 찾은 조현준 회장은 “모든 비즈니스는 때가 있다. 한국과 일본은 때가 무르익었다”라며 “한국 기업인도, 일본 기업인도 꼭 지금 우리가 성과를 내야되겠다는 마음이 있다”고 말했다. 이어 “일본과 우리나라는 산업적으로 같이 고민해야 할 부분이 많다”며 “현재도 개별 회사 단위로는 협력이 지속되고 있으며, 앞으로 발전해야 할 부분도 많다”고 설명했다.또 조 회장은 한일 협력을 넘어 미국까지 3국의 협력이 필요한 시점이라 강조했다. 조 회장은 “국제 정세가 한국과 일본이 힘을 합치지 않으면 헤쳐나갈 수 없다. 미국 역시 한국과 일본, 미국이 힘을 합치는 것을 열망하고 있다”라며 “수소나 반도체,AI(인공지능), 양자역학 등도 같이 해결하지 않으면 이길 수가 없다”고 말했다.류진 한경협 회장은 개회사에서 내년이 한일 국교 정상화 60주년이라는 점을 언급하며 “사람으로 치면 이순(耳順)으로, 작은 일에도 흔들리지 않을 나이”라며 “한일 관계도 나이만큼 성숙해졌기에, 이제 공동 번영의 미래로 달려나갈 채비를 갖춘 것”이라고 했다. 도쿠라 게이단롄 회장은 “교착상태였던 한일관계가 윤석열 대통령의 취임을 계기로 크게 개선됐고, 지난해 12차례나 양국 셔틀 외교가 재개됐다”며 현 정부 들어 양국 관계 정상화와 그에 따른 경제협력이 복구된 점을 평가했다.이날 회의는 총 3개 세션으로 진행됐다. 첫 순서인 ‘지속가능한 사회 실현을 위한 한일 협력’ 세션에서는 한국과 일본의 수소 및 디지털 전환 협력에 관한 논의가 이뤄졌다. 참석자들은 수소를 가장 중요한 협력 분야로 지목하고 양국 정부 간 수소 협력 대화가 민간으로 확대돼야 한다는 의견을 같이했다. 이어 무역투자 분야 세션에서는 주요 광물 공동 비축제도를 마련, 어느 한 나라의 공급망에 위기가 발생하면 그 위험을 서로 분산하는 방안이 논의됐으며 한·미·일이 인도태평양경제프레임워크(IPEF)에서 협력을 추진해 지역 질서 형성에 기여하는 방안도 나왔다. 미래를 위한 협력 세션에서는 한일 인적교류를 원활히 하기 위해 지난 9월 양국 정상이 도입을 추진하기로 한 사전 입국 심사제를 내년에 개최되는 경주 아시아태평양경제협력체(APEC) 정상회의, 오사카·간사이 세계박람회와 연계해 조속히 도입하는 데 양측은 합의했다.류진 한국경제인협회 회장(오른쪽)과 도쿠라 마사카즈 경단련 회장이 18일FKI타워 컨퍼런스센터에서 열린 '제31회 한일재계회의'에 참석하기 위해 입장하고 있다. 사진 한경협양단체는 이번 회의에서 양국 공동 번영을 위한 미래지향적인 협력을 지속하자는 내용을 담은 공동성명을 채택했다. 공동성명에는 ▶경제협력개발기구(OECD),APEC,G20, G7 등에서의 한일 간 협력을 위한 노력 ▶지속가능한 사회 실현 노력 ▶안정적 공급망 및 수소 등 청정에너지 협력 ▶신생 산업 등에서의 국제표준 마련 협력 ▶한미일 경제협력 강화 ▶AI·양자컴퓨터 등에 있어 고도인재 활용 협력 ▶스타트업 협력 ▶국교정상화 60주년 기념 다양한 세대·분야 협력 등의 내용이 담겼다.양측은 미래지향적 한일관계 구축을 위해 지난해 각각 설립한 한일·일한미래파트너십기금 공동사업으로 한일 고교교사 교류사업과 스타트업 협력 포럼을 지속해서 추진하기로 했다. 또 60주년 기념사업을 함께 진행하고, 내년 일본 도쿄에서 제32회 한일재계회의를 열기로 합의했다.한편 이날 회의에는 지난달 새로 한경협 회장단에 합류한 김남구 회장, 성래은 영원무역그룹 부회장, 김정수 삼양식품 부회장이 나란히 참석했다. 새로 선임된 세 명의 부회장이 한경협 공식행사에 함께 모습을 보인 건 이번이 처음이다. 김남구 회장은 회장단 합류에 대해 “막 참여해서 이제부터 기여할 방향을 찾으려고 한다”고 말했다. 김정수 부회장은 “열심히 하겠다. 지금부터 기여하려고 한다”고 말했다."
2024-10-24,성래은 “K콘텐트 이어 이제 K패션의 차례”,"“득시무태(得時無怠), 좋은 시기가 찾아왔을 때 기회를 놓치지 말라는 말이 있다. K콘텐트, K뷰티에 이어 이제 K패션 차례다.”(성래은 한국패션산업협회장)K패션 브랜드의 해외 진출과 성장 전략을 논의하기 위해 국내 섬유·패션업계 관계자 300여 명이 한자리에 모였다. 23일 한국패션산업협회가 개최한 ‘2024 글로벌 패션포럼’을 통해서다. 협회는 산업통상자원부 지원을 받아 지난 2009년부터 해마다 포럼을 진행하고 있다.성래은 협회장(영원무역홀딩스 부회장)은 개회사에서 “이미 (전 세계적으로) K패션의 시대에 진입했다는 생각이 든다”며 “협회 차원에서 글로벌 투자사와 업무협약을 맺는 등 K패션의 지평을 넓히고자 노력하겠다”라고 말했다. 기조연설을 맡은 정지영 현대백화점 대표는 더현대 서울과 커넥트현대의 경험을 토대로 “가성비와 재미, 경험이 중요한 시대가 됐다”라며 “매력적인 리테일 플랫폼을 구현해 고객의 자발적 홍보를 이끌어내는 것이 필요하다”고 밝혔다.국내 시장 규모가 줄고 있는 만큼 패션업계가 해외 시장에 보다 적극적으로 나서야 한다는 지적도 나왔다. 유정현 대신증권 연구원은 유니클로 시가총액을 예로 들며 “소셜미디어를 통해 글로벌 소비가 단번에 동기화되고 있다. 한국 패션업계도 해외 진출을 통해 지속가능한 성장을 추구해야 한다”고 말했다.창의적인 글로벌 브랜드 육성이 필요하다는 의견도 있다. 패널 토론에 참석한 박주원 시몬느패션컴퍼니 대표는 “K뷰티는 까다로운 한국 소비자에게 단련된 브랜드들이라는 점이 성공 요인으로 꼽히고 있고 이는 K패션도 마찬가지다.”라고 말했다."
2024-10-23,"“이제는 K패션의 시대, 글로벌 진출 기회 잡아야”…글로벌패션포럼","23일 서울 삼성동 섬유센터에서 열린 ‘2024 글로벌 패션 포럼’에서 성래은 한국패션산업협회 회장이 개회사를 하고 있다. 사진 한국패션산업협회“득시무태(得時無怠), 좋은 시기가 찾아왔을 때 기회를 놓치지 말라는 말이 있다. K콘텐트, K뷰티에 이어 이제 K패션의 차례다.”(성래은 한국패션산업협회장)K패션 브랜드의 해외 진출과 성장 전략을 논의하기 위해 국내 섬유·패션업계 관계자 300여 명이 한자리에 모였다. 23일 한국패션산업협회가 개최한 ‘2024 글로벌 패션포럼’을 통해서다. 협회는 산업통상자원부의 지원을 받아 지난 2009년부터 해마다 포럼을 진행하고 있다.성래은 협회장(영원무역홀딩스 부회장)은 개회사에서 “이미 (전 세계적으로) K패션의 시대에 진입했다는 생각이 든다”며 “협회 차원에서 글로벌 투자사와 업무협약을 맺는 등 K패션의 지평을 넓히고자 노력하겠다”라고 말했다. 기조연설을 맡은 정지영 현대백화점 대표는 더현대 서울과 커넥트현대의 경험을 토대로 “가성비와 재미, 경험이 중요한 시대가 됐다”라며 “매력적인 리테일 플랫폼을 구현해 고객의 자발적 홍보를 이끌어내는 것이 필요하다”고 조언했다.━“내수 한계 K패션, 해외 진출 필수”23일 서울 삼성동 섬유센터에서 열린 ‘2024 글로벌 패션 포럼’에서 정지영 현대백화점 대표가 기조연설을 하고 있다. 사진 한국패션산업협회국내 시장 규모가 줄고 있는 만큼 패션업계가 해외 시장에 보다 적극적으로 나서야 한다는 지적도 나왔다. 유정현 대신증권 연구원은 “한국의 내수 소비는 수출과 같은 대외 변수에 크게 의존하는 한계가 있고 저출산으로 물건을 판매하는 시장이 구조적으로 줄어들 수밖에 없다”고 말했다.그는 유니클로의 시가총액을 예로 들며 국내 주식 시장에서는 패션 시장이 저평가돼 있다고 분석하며 “MZ세대가 주 고객층으로 성장하며 소셜 미디어를 통해 글로벌 소비가 단번에 동기화 되고 있다. 한국 패션업계도 해외 진출을 통해 고부가가치 산업으로서 지속가능한 성장을 추구해야 한다”고 강조했다.━“창의적인 브랜드 늘어야”23일 서울 삼성동 섬유센터에서 ‘2024 글로벌 패션 포럼’이 열렸다. 사진 한국패션산업협회성공적인 해외 진출을 위해 창의적인 글로벌 브랜드 육성이 필요하다는 의견도 있다. 패널 토론에 참석한 박주원 시몬느 패션 컴퍼니 대표는 “K뷰티는 까다로운 한국 소비자에게 단련된 브랜드들이라는 점이 성공 요인으로 꼽히고 있고 이는 K패션도 마찬가지다. K콘텐트를 보고 자란 세대가 세계 각국에 있다는 점도 강점”이라며 “한류 열풍으로 지금 K패션이 뭐든 내놓으면 잘되는 시기지만 정작 내세울 브랜드가 많지 않다는 게 문제”라고 말했다.유진성 모노타입 서비스 공동대표는 “봉제 산업이 발달했던 (한국 패션의) 역사로 인해 제조업적인 시각으로 패션 산업에 접근하는 것이 문제”라며 “독창성과 창의성을 앞세운 자신만의 브랜드를 확립해야 세계 시장에서 통할 것”이라고 말했다."
2024-09-02,[단독]한경협 회장단 합류한 '불닭볶음면 신화'…새 부회장 3인 보니,"한국경제인협회(한경협)가 김남구 한국투자금융지주 회장·김정수 삼양라운드스퀘어 대표·성래은 영원무역홀딩스 부회장 등 3명을 새 회장단 멤버로 추가할 예정이다. 사진은 서울 여의도 한경협 빌딩 앞 한경협 표지석. 연합뉴스한국경제인협회(한경협)가 김남구 한국투자금융지주 회장·김정수 삼양라운드스퀘어 부회장·성래은 영원무역홀딩스 부회장 등 3명을 새 부회장에 선임한다.1일 재계에 따르면 한경협 회장단은 오는 9일 서울 모처에서 신규 선임될 부회장들과 만찬 겸 회의를 가질 예정이다. 류진 한경협 회장(풍산그룹 회장) 주재로 열리는 이날 회의에서 부회장 3인 선임 안건에 대한 기존 회장단의 합의로 승인 여부가 결정된다. 재계 관계자는 “이날 새 부회장들과 기존 회장단이 첫 상견례를 하게 될 것”이라고 말했다.회장단 멤버 추가는 지난해 5월 발표했던 전국경제인연합회(전경련)의 혁신안 중 하나였다. 그동안 중장년·남성·제조업에 치우친 회장단 구성을 시대적 흐름에 맞춰 업종·성별·나이 등을 다양화 하겠다는 취지다.━새 멤버는 누구정근영 디자이너이번에 한경협 회장단에 합류하는 3명은 40~60대 초반, 여성, 금융권 등 다양한 배경을 지닌 오너 경영인이다.김남구 회장(61)은 김재철(90) 동원그룹 명예회장의 장남으로, 투자 전문 금융그룹을 키웠다. 대학 시절 원양어선을 탄 일화로도 유명하다. 김 회장은 과거 서울대에서 열린 취업설명회에서 “공부를 안 해 학교에서 잘릴 뻔 했다가 아무래도 이건 아닌 것 같아 배를 탔다”며 “하루 18시간 노동하고 6시간 자는 것을 몇 달 동안 했다”고 말했다. 고려대 졸업 후 동원산업 대리로 입사했다가 게이오대 유학 이후 한신증권(동원증권 전신)으로 입사해 2004년 사장에 올랐다. 주식중개매매에 강했던 동원증권은 2005년 자산관리 부문 강자인 한국투자증권을 인수하며 현재 자산규모 100조원에 이르는 금융그룹으로 성장했다.김정수 삼양라운드스퀘어(옛 삼양식품그룹) 대표 부회장(60)은 글로벌 K푸드의 대표 주자로 유명한 불닭볶음면 개발 주역이다. 고(故) 전중윤 삼양식품 창업자의 며느리이자 전인장 전 삼양식품 회장의 부인인 김 부회장은 가정주부로 지내다 1998년 회사가 어려워지자 경영에 뛰어들었다. 명동의 한 식당에서 사람들이 땀을 뻘뻘 흘려가면서 매운 음식을 먹는 모습에서 착안, ‘기존에 없는 매운맛’을 연구·개발해 불닭볶음면을 탄생시킨 것으로 유명하다. 매년 수출 실적을 경신하는 불닭볶음면 영향으로 삼양식품은 지난해 매출 1조원을 돌파(1조1929억원, 영업이익 1475억원)하며 수출 기업으로 변신했다. 월스트리트저널은 지난 1월 ‘66조원 라면 시장을 뒤흔든 여성’이라는 제목 기사에서 “김 부회장의 삶이 한국 드라마의 한 페이지를 찢고 나온 것 같다”고 표현하기도 했다.신규 부회장 중 가장 젊은 성래은 부회장(46)은 국내 아웃도어 1위 노스페이스를 비롯해 한국의 아웃도어 패션업계를 개척한 영원무역 창업주 성기학 회장의 둘째 딸이다. 스탠퍼드대 졸업 후 2002년 영원무역에 입사해 2016년 영원무역홀딩스 대표, 2020년 영원무역 사장을 거쳐 2022년부터 영원무역그룹 부회장을 맡고 있다. 지난해 저서 『영원한 수업』을 출간해 1974년 창업 후 50년째 흑자를 이어가는 영원무역의 경영 철학을 소개하기도 했다. 지난 2월부터는 한국패션산업협회장을 맡고 있다.━한경협 회장단은한경협 회장은 관례상 회장단에 속한 부회장 중 선출해왔다. 현재 회장단에는 김승연 한화그룹 회장, 이웅렬 코오롱 명예회장, 신동빈 롯데그룹 회장, 김윤 삼양그룹 회장, 김준기 전DB그룹 회장, 이장한 종근당 회장, 박정원 두산그룹 회장, 조원태 한진그룹 회장, 허태수GS그룹 회장, 조현준 효성 회장(선임연도 순)이 속해 있다. 류진 회장과 김창범 상근부회장까지 총 12명이다. 김승연 회장이 올해로 33년째 가장 오랜 기간 회장단에 참여 중이다. 한때 회장단을 떠났던 류진 회장은 지난해 다시 합류, 12년 만에 회장직을 내려놓은 허창수GS회장을 뒤이어 한경협을 이끌고 있다.한경협은 향후에도 재계의 새 얼굴을 꾸준히 부회장으로 영입하겠다는 계획이다. “한경협의 인적·물적 쇄신 노력이 부족한 것 아니냐”는 비판이 일각에서 나오는 가운데, 새 회장단을 통해 분위기 쇄신을 꾀할 것으로 보인다 . 류 회장은 지난해 12월 기자간담회에서 “현재 10명인 회장단을 25명까지 늘리겠다”라며 “과거에는 회장과 상근부회장 둘이서 결정했지만, 앞으로는 회장단이 모두 상의하며 결정하는 시스템을 구축하려고 노력 중”이라고 말했다."
2024-06-25,[사랑방] (재)서울국제법연구원·외교부 27일 포럼,(재)서울국제법연구원(이사장 윤병세)과 외교부는 27일 영원무역 명동사옥에서 ‘최근 무력충돌 사태에 대한 국제규범적 진단’을 주제로 제2회 서울 외교·거버넌스 포럼을 공동 개최한다.
