date,title,content
2024-04-19,[단독] 전청조 사칭수법 안통한다…'파라다이스'도 대기업집단,"카지노‧호텔 사업을 하는 파라다이스그룹과 방탄소년단(BTS)·뉴진스 등이 소속된 하이브가 올해 대기업집단으로 신규 지정될 예정이다. 보험사인 현대해상, 룰루레몬‧노스페이스의 주문자상표부착생산(OEM) 업체인 영원무역 등도 지정 가능성이 크다.하이브 소속 그룹 뉴진스가 지난달 22일 인천국제공항에서 열린 인천공항본부세관 홍보대사 위촉식에서 파이팅 포즈를 취하고 있다. 연합뉴스━자산총액 5조원 넘어 ‘공식 대기업’18일 업계 등에 따르면 파라다이스와 하이브는 공정거래위원회에 총수 일가를 비롯한 계열사 전체 자산이 5조원이 넘는 것으로 신고했다. 공정위는 다음 달 대규모기업집단 지정을 앞두고 이들 기업을 대기업집단으로 지정하는 쪽으로 가닥을 잡고, 막판 검토를 진행 중이다. 기업집단의 자산총액이 5조원이 넘으면 공시대상기업집단에 해당한다.대기업집단은 동일인(총수)은 물론, 그 특수관계인(친족 및 임원)의 주식 보유 현황에 대해서도 공시해야 한다. 2022년 공정거래법 시행령이 개정되면서 총수와 사실혼 관계에 있는 배우자, 그 자녀까지도 특수관계인에 포함된다. 파라다이스의 친족 현황 등이 드러나면 ‘제2의 전청조’ 사태도 줄어들 것이란 관측이 나온다. 카지노 사업으로 규모를 키운 파라다이스는 이전까지 총수 일가의 대외 노출이 적고, 공개된 정보가 많지 않아 전청조·전준주(왕진진) 등 사기꾼의 주된 사칭 대상으로 이용돼왔다.파라다이스그룹 혼외자를 사칭해 30억원대 사기 혐의를 벌인 전청조씨가 지난해 11월 서울 송파경찰서에서 나오고 있다. 연합뉴스━현대해상·영원무역·대명소노 포함파라다이스·하이브 외에 현대해상, 영원무역, 대명소노 등도 대기업집단 지정이 이뤄질 예정이다. 2차전지 관련 기업인 원익도 자산총액이 5조원 안팎에 걸쳐있다. 공정위는 다음 달 지정 발표 전까지 변동사항이 있는지 자료를 검토할 예정이다. 공정위 관계자는 “지정과 관련해 확정된 바는 없다”며 “기업집단이 제출한 자료를 살펴보고 있다”고 말했다.하이브는 엔터회사로는 첫 번째 대기업집단으로 이름을 올리게 된다. 하이브는 플레디스, 쏘스뮤직 등 다른 엔터테인먼트 기업을 인수하는 등 규모를 키워오면서 최근 사업보고서 기준 자산 규모가 5조3457억원으로 늘었다. 지정이 이뤄지면K-팝 산업의 글로벌 성장에 힘입어 엔터회사가 대기업으로 공식 인정받는 셈이다.대기업집단에서 제외됐던 현대해상의 경우 보험부채를 원가가 아닌 시가로 평가하는 것으로 회계기준이 바뀌면서 자산총액이 8조원대로 대폭 상승했다. 이에 따라 올해 기업집단 순위에서 보험 회사의 순위가 전반적으로 올라갈 예정이다. 리조트‧레저 사업이 주력인 대명소노는 코로나19 이후 매출이 회복하면서 자산이 늘었다는 풀이가 나온다.━‘5조 기준’ 15년 동일…규제 대상만 늘어기존에 중견기업급으로 분류되던 기업이 대기업집단에 대거 포함될 가능성이 커지면서 지정 기준 상향에 대한 요구도 거세질 예정이다. 한국경제에 큰 영향을 미치는 일부 재벌기업을 규제하겠다는 제도의 취지가 무색해졌다는 지적이 나오면서다.김영옥 기자실제 대기업집단 지정 첫해였던 1987년엔 지정 회사가 32곳에 불과했다. 2009년 지정 기준이 자산총액 5조원 이상으로 확정됐을 때만 해도 해당하는 대기업집단은 48곳이었다. 경제 규모는 성장하는데 기준은 15년간 그대로다보니 지난해 대기업집단은 82곳까지 늘었다. 올해는 이보다 늘어 90여곳에 육박할 예정이다.대기업집단 규제 대상이 무한정 늘어날 것이란 지적이 잇따르자 공정위는 공시대상기업집단 지정 기준을 국내총생산(GDP)에 연동하는 방식으로 변경하는 방안을 추진하고 있다. 그러나 아직 구체적인 안이 나오지 않은 데다 여소야대 지형으로 인해 규제 완화에 해당하는GDP연동 대기업집단 기준 상향은 법 통과가 어려울 것이란 전망이 나온다.한편 내·외국인 구분 없이 일정 요건을 충족하면 총수 지정이 가능하도록 하는 공정거래법 개정안은 규제심사에 막혀 있다. 현재 쿠팡의 총수는 쿠팡 법인으로, 미국 국적의 김범석 의장은 대기업집단 규제의 처벌 대상에서 빠져있다. 내국인에 대한 역차별이라는 지적이 올해도 나올 수 있다. 공정위 관계자는 “규제심사를 빨리 통과할 수 있도록 노력 중이다”고 말했다."
2024-05-03,자산 5조 넘은 하이브∙파라다이스…'대기업 집단' 90곳 어디,"지난 3월13일 한기정 공정거래위원회 위원장. 정부서울청사에서 열린 비상 경제장관회의에 참석해 해외 온라인 플랫폼 관련 소비자 보호대책과 관련한 발언을 하고 있다. 연합뉴스공정거래위원회(이하 공정위)가 올해는 당초보다 늦게 ‘대기업 집단’을 지정할 전망이다. 그 규모는 90곳에 육박할 가능성이 크다.2일 정부에 따르면 공정위는 오는 13~15일 중 ‘2024년 공시대상기업집단(대기업 집단)’과 그 각각의 ‘동일인(총수)’을 지정할 예정이다. 이 제도는 경제력이 소수의 경제주체에 집중되고 공정한 경쟁이 저해되는 걸 막기 위한 규제다. 공시 의무 등이 부과되고 총수의 사익 편취가 금지되는 게 골자다.앞서 공정위는 통상적으로 매년 5월1일에 대기업 집단과 총수를 지정해왔다. 그러다 2019년엔 4월8일 당시 조양호 한진그룹 회장이 돌연 사망하자 대기업 집단인 한진그룹의 총수를 재지정하는 문제 등 때문에 관련 지정일을 5월15일로 미뤘다. 그 이후 5년 만에 다시 한 번 일정이 지연되는 것이다.공정거래법 시행령 38조 3항에 따르면 공정위는 매년 5월1일까지 대기업 집단 등을 지정해야 하고, 부득이한 경우 기한을 5월15일까지로 연기할 수 있다.올해 대기업 집단 등의 지정이 지연되는 이유는, 현재 진행 중인 공정거래법 시행령 개정 작업을 마무리하고 이를 적용하기 위해서다. 해당 개정안에는 대기업 집단의 총수를 자연인이 아닌 법인으로 지정할 수 있는 조건을 구체화하는 내용이 담겨 있다.그 조건은 2가지로  ▶법인을 총수로 지정해도 자연인이 총수일 때와 비교해 대기업 집단 범위에 차이가 없고 ▶친족 등 특수관계인의 출자·경영·자금거래 관계가 단절되어 있는 경우이다. 이 조건을 만족해 법인이 총수로 지정돼도 향후 조건을 만족하지 못 하면 다시 자연인을 총수로 지정하도록 하는 조항도 들어갔다.이런 조치는 유통 대기업 집단인 쿠팡 등을 의식한 것으로 풀이된다. 쿠팡은 2021년부터 지난해까지 3년 연속 대기업 집단으로 지정되면서 매년 자연인(김범석 의장)이 아닌 법인이 총수로 지정됐다. 김 의장이 외국 국적자인데, 외국 국적자를 총수로 지정할 법적 근거가 마련돼 있지 않다는 이유에서다. 이를 계기로 내국인에 대한 역차별 논란이 일었다. 그러자 공정위가 내국인이든 외국인이든 구별 없이 법인을 총수로 지정할 수 있는 조건을 명확히 하면서 논란을 잠재우려는 것이다.공정거래법 시행령 개정 작업은 막바지에 접어들었다. 이날(2일) 차관회의를 통과했다. 다음 주 국무회의를 거치고, 사흘가량 후 관보에 게재될 예정이다.김영옥 기자올해도 쿠팡은 법인이 총수로 지정될 것으로 업계는 본다. 익명을 요구한 정부 관계자는 “쿠팡 외에 자연인이 총수로 지정됐던 대기업 집단 중에서도 한 자릿수가 법인 총수로 지정될 확률이 높다”고 전했다.올해 대기업 집단 지정 규모는 90곳에 육박할 것으로 전망된다. 지난해 82곳이 지정된 이후 올해 엔터테인먼트 업계 최초로 하이브를 비롯해 파라다이스·현대해상·영원무역·대명소노 등이 새로 편입될 것으로 분석되기 때문이다. 대기업 집단으로 지정하는 기준은 직전년도 대차대조표상 자산 총액이 5조원 이상인 경우다.매년 경제 규모가 성장하는데도 대기업 집단 지정 기준인 ‘자산총액 5조원’ 허들은 15년째 그대로라 갈수록 지정 규모가 커질 수밖에 없다. 신현윤 연세대 법학전문대학원 명예교수는 “1987년 제도가 처음 도입됐을 땐 ‘과도한 경제력 집중’을 막을 목적이었는데, 이제는 ‘보통의 경제력 집중’까지 규제하게 됐다”고 비판했다. 과도하지 않은 경제력 집중은 자본주의 체제에서 불가피하므로 이것까지 규제하는 건 지나치다는 의미다."
2024-02-05,"""13만 전자도 가능""...'밸류업' 한마디에 행동주의 움직였다","지난 2일 서울 명동 하나은행 본점 딜링룸에서 직원들이 업무를 보고 있다. 연합뉴스정부의 ‘기업 밸류업 프로그램’ 도입 기대감에 관련 상장지수펀드(ETF)와 주식, 펀드에 지속적으로 자금이 유입되고 있다. 증권가에선 국내 대표 상장사들이 주주가치를 제고할 경우 주가가 크게 오를 거라는 모의결과가 나오는 등 ‘코리아 디스카운트’ 해빙 분위기가 달아오르는 양상이다.4일 한국거래소에 따르면 지난달 29일부터 지난 2일까지 한 주 동안 한국투자신탁운용의 ‘ACE주주환원가치주액티브’ETF는 총 19만9034주, 23억5577만원 어치가 거래됐다. 거래량은 전주보다 34.4배, 거래대금은 36.9배 늘었다. 지난달 24일, 정부가 밸류업 프로그램을 도입하겠다고 발표한 게 결정적인 계기가 됐다. 이ETF는 기업의 순자산이나 수익성 대비 주가가 저평가돼 있고, 주주환원 확대 가능성이 있는 국내 상장사에 투자하는 상품으로, 현재 세아제강지주·크레버스·영원무역홀딩스 등을 담고 있다. 비슷한 성격의 ‘TRUSTON주주가치액티브ETF’(트러스톤자산운용) 역시 같은 기간 거래량과 거래대금이 두 배 가까이 늘었다.신재민 기자━저PBR주 광풍…장기 수익 가능할까업종별 수혜도 뚜렷하다. 지난달 24일부터 지난 2일까지 가장 주가가 많이 오른 섹터는 보험(25%) 금융(18.9%) 자동차(18.4%), 은행(18.1%) 등으로, 대표적인 저평가 지표인 주가순자산비율(PBR,주가를 주당 순자산가치로 나눈 수치) 1배 미만의 섹터였다. 롯데지주(27.7%) 엘지(26.2%) 등 장부 가치에 비해 주가가 낮다고 알려진 주요 그룹 지주사 주가가 급등했고, 사회책임투자(SRI)펀드와 가치주 펀드 설정액도 각각 122억원과 101억원 늘었다.정부가 증시 저평가 해소에 강한 의지를 보이면서, 한국거래소가 개발 검토중이라고 밝힌 ‘코리아 프리미엄 지수’(가칭)에도 때 이른 관심이 쏠리고 있다. 일본의 경우 지난해 7월 저평가 우량주 지수인 ‘JPX프라임 150’이 개발되자 지난 1월 이를 추종하는ETF가 시장에 나왔기 때문이다.신재민 기자관건은 이런 정책 수혜가 장기적으로 이어질 수 있느냐다. 밸류업 프로그램의 세부 내용 발표에 따라 추가 상승이 가능하지만, 기업의 수익성이나 불합리한 지배구조가 개선되지 않을 경우 주가가 원상 복귀할 가능성도 있다. 한 자산운용사 관계자는 “경제 전망이 안 좋은 상황에서 단기 정책만으로 주가가 계속 오르긴 어렵다”며 “국내 종목 대부분이 저평가돼 있는 만큼, 수익성과 현금 흐름 등 근본적인 지표가 우수한 종목 위주로 집중하지 않으면 백약이 무효”라고 조언했다.━“삼전 밸류업 시 13만 전자 가능”4일 서울 삼성전자 서초사옥에 걸린 삼성 깃발이 바람에 휘날리고 있다. 연합뉴스최근 개인 투자자들 사이에서 호응을 얻고 있는 ‘행동주의 큰손’들도 정부의 정책 개선 흐름에 적극 올라타고 있다. 한국기업거버넌스포럼은 금융위원장과 한국거래소 신임 이사장에게 보내는 공개서한에서 “삼성전자, 현대차,LG전자 등 간판 상장사들은 초일류 제품을 만들고 업종 최고의 경쟁력을 자랑하는데도 주가는 세계에서 가장 저평가돼 있다”며 주주가치 제고를 요구했다. 이 포럼은 상장사의ESG(환경·사회적책임·지배구조개선) 경영을 지향하는 국내 주요 펀드와 운용사들로 구성돼 있다.특히 포럼의 이남우 회장은 “코리아 디스카운트의 직접적인 피해자는 은퇴자금 부족으로 어려움을 겪을 국민”이라고 강조했다. 최근 10년간 한국 증시 총주주수익률(주식평가이익+배당소득)이 미국(12%), 일본(9%)의 절반 수준인 연 5%에 그친다는 것이다. 포럼 측은 한국의 직장인이 2024년 1월 1000만원을 국내 증시에 투자할 경우, 30년 후 4300만원이 되지만, 총주주수익률이 연 10%로 개선되면 원금을 1억7500만원으로 불릴 수 있다고 예를 들었다.한국을 대표하는 종목에 대한 모의 계산 결과도 내놨다. 현대자동차에는 ▶현금 8조원 투입해 우선주 전량 자사주 매입 및 소각 ▶삼성동 부지 제3자 매각 ▶현대건설 및KT지분 매각 등의 방안을, 삼성전자엔 ▶현금 50조원 투입해 우선주 전량 자사주 매입 및 일부 소각 ▶미국 주식예탁증서(ADR) 방식 상장 등의 밸류업 방안을 적용하는 방식이다. 포럼 측은 “(이를 실행할 경우) 현대차는PBR0.6배에서 1.0배로,주가 50만원으로 레벨업이 가능하다. 삼성전자 역시PBR은 1.4배에서 2.2배로, 주가는 13만원 이상이 가능하다”고 주장했다."
2023-12-04,[부고] 이덕광씨 外,"▶이덕광씨 별세, 유홍련씨 남편상, 이영호(현대건설 홍보실장)·영환씨 부친상, 박나연·이윤미씨 시아버지상=2일 부산대병원, 발인 5일 오전 6시30분, 051-240-7161▶정영자씨 별세, 전옥(영원무역 부장)·진배씨(JTBC뉴스콘텐트 부문 대표이사) 모친상, 강인열씨(개인사업) 장모상, 이윤희씨 시어머니상=3일 서울성모병원, 발인 6일 오전 9시30분, 2258-5940"
2023-12-27,"영원아웃도어, 숙명여대에 발전기금 3억원 전달","영원아웃도어 성기학 회장, 숙명여대 장윤금 총장, 영원아웃도어 성가은 부사장(우측부터)영원아웃도어(대표 성기학)가 숙명여자대학교(총장 장윤금)에 산학연 발전기금 3억원을 전달했다.영원아웃도어(대표 성기학)는 지난 12월 22일(금) 오후 서울 중구 소재의 영원무역 명동 빌딩에서 성기학 회장과 성가은 부사장 및 숙명여대 장윤금 총장, 오중산 산학협력단장, 이지형 교무처장, 송윤선 학생처장, 김영선 의류학과 교수 등 양측 관계자가 참여한 가운데, 산학연 발전기금 전달식을 진행했다고 26일(화) 밝혔다.영원아웃도어가 이번에 기부한 3억원은 ‘숙명여대 산학연 발전기금’으로 사용될 예정이다.성기학 회장은 “대한민국 패션 산업의 미래를 이끌어갈 학생들에게 작게나마 보탬이 되길 바란다”며 “오랜 시간 동안 파트너십을 유지해 온 숙명여대와 앞으로도 다양한 협업을 통해 국내 의류·패션 산업 발전을 함께 도모해 나가겠다”고 말했다.장윤금 총장은 “지난해에 이어 또 한 번 발전기금을 기부해 주셔서 감사드린다”며 “숙명여대 학생들이 여성 인재로서 새로운 시작을 하는데 이번 기부가 큰 도움이 될 것”이라고 말했다.”고 말했다.한편, 영원무역그룹은 지난 2008년부터 숙명여대와 산학협력을 맺고 의류학과를 중심으로 평창동계올림픽 라이선스 상품 개발 프로젝트, 친환경 업사이클링 졸업작품전 등 다양한 산학협력 프로그램을 지속적으로 진행하고 있다."
2023-06-28,"""이 풍진 세상 만났으니…"" 조순 전 부총리 1주기, 희망가 불렸다","고 조순 전 경제부총리 1주기 추도식이 28일 서울 영원무역 명동사옥에서 열렸다. [사진 이훈 프리랜서]━“하늘의 북극성처럼 방향 잡아주시던 스승━공직 맡을 때도 진영논리 벗어나 양심 지켜”고(故) 조순(1928~2022) 전 부총리의 소천 1주기 추도식이 28일 서울 영원무역 명동사옥 9층 강당에서 열렸다. 이날 행사는 정운찬 전 국무총리를 비롯해 김중수 전 한국은행 총재, 김동수 바른경제동인회 회장, 김승진 한국외대 명예교수, 민상기 서울대 명예교수, 서준호 서강대 명예교수, 이영선 전 한림대 총장, 박기봉 비봉출판사 사장, 좌승희 박정희학술원 원장 등 주로 고인의 서울대 경제학과 제자들이 중심이 돼 마련됐다.정운찬 전 총리는 추모사에서 “55년 동안 조순 선생님과 사제지간의 인연을 맺어온 제게는 아직도 선생님의 부재를 실감하기 어렵다”며 “때론 큰 바위 얼굴처럼 감히 범접하기 어려운 어른이셨지만 제자들이 길을 잃고 헤맬 때마다 하늘의 북극성이나 바다의 등대처럼 방향을 잡아주시고 빛을 비춰주신 스승이셨다”고 말했다.그는 “한국은행 총재, 서울시장, 한나라당 총재 등 인물사전에 나타난 업적만으로는 선생님의 인품이나 철학, 애국심과 제자 사랑을 알아보실 분들이 드물 것 같아 안타깝다”며 “나라가 어려울 때는 누구보다 깊이 고민하셨고 공직에 몸담으실 때는 진영논리에 치우치지 않는 학자적 양심을 지키셨으며, 비열한 태도를 보이는 이들에게도 선비처럼 의연하게 대처하셨다”고 회고했다.정 천 총리는 혼돈의 시대를 사는 현대인에게 가장 중요한 건 착지(着地)라는 최인호 작가의 말을 인용하며 “은퇴 후에도 항상 읽고 사색하시며 제자들에게 눈빛과 마음으로 사랑을 보여주신 선생님이야말로 성공적인 착지의 주인공'이라고 말했다.2022년 스승의 날 전후에 『경제학원론』의 공동저자들이 조순 전 부총리의 서울 봉천동 자택을 방문해 사진을 찍었다. 조 전 부총리와 제자들의 마지막 사진이다. 왼쪽부터 김영식 서울대 교수, 전성인 홍익대 교수, 조 전 부총리, 정운찬 동반성장연구소 이사장. [사진 정운찬 이사장 ]이날 행사에선 무용가인 박경량 국립국악원 전통예술문화학교 교수가 공연했고 제자들이 조순 선생 유묵집 등 3권의 책을 봉헌했다. 고인의 미 버클리대 동문인 김기환 전KDI원장, 성기학 영원무역 회장, 유장희 이화여대 명예교수(전 동반성장위원장), 이천표 서울대 경제학부 명예교수(전 한국국제경제학회 회장), 이정우 경북대 명예교수(전 청와대 정책실장) 등이 참석했다. 고인과 정 전 총리에 이어 『경제학원론』 후속 공저자로 참여한 전성인 홍익대 교수, 김영식 서울대 교수의 모습도 보였다.조순 전 부총리의 장남인 조기송 전 강원랜드 사장 등 유족과 제자들은 고인이 좋아했던 노래 ‘희망가’를 2절까지 함께 부르고 추도모임을 마쳤다. ”이 풍진(風塵) 세상을 만났으니 너의 희망이 무엇이냐/부귀와 영화를 누렸으면 희망이 족할까/.../세상만사가 춘몽 중에 또다시 꿈같도다“서경호 기자praxis@joongang.co.kr28일 서울 영원무역 명동사옥에서 열린 조순 전 부총리 소천 1주기 추도식 참석자들이 기념사진을 찍었다. 서경호 기자"
2023-06-29,“성공적 착지의 주인공” 조순 1주기 추도식,"고 조순 선생 1주기 추도식이 28일 서울 영원무역 명동사옥에서 열렸다. [사진 이훈 프리랜서]고(故) 조순(1928~2022) 전 부총리의 소천 1주기 추도식이 28일 서울 영원무역 명동사옥 9층 강당에서 열렸다. 이날 행사는 정운찬 전 국무총리를 비롯해 김중수 전 한국은행 총재, 김동수 바른경제동인회 회장 등 주로 고인의 서울대 경제학과 제자들이 중심이 돼 마련됐다.정운찬 전 총리는 추모사에서 혼돈의 시대를 사는 현대인에게 가장 중요한 건 착지(着地)라는 최인호 작가의 말을 인용하며 “은퇴 후에도 항상 읽고 사색하시며 제자들에게 눈빛과 마음으로 사랑을 보여주신 선생님이야말로 성공적인 착지의 주인공”이라고 말했다.유족과 제자 등 참석자들은 고인이 좋아했던 노래 ‘희망가’를 2절까지 함께 부르고 추도모임을 마쳤다. “이 풍진(風塵) 세상을 만났으니 너의 희망이 무엇이냐/부귀와 영화를 누렸으면 희망이 족할까”"
2023-06-26,[사랑방] 28일 조순 전 경제부총리 1주기 추념식,"조순고(故) 조순(사진) 전 경제부총리 1주기 행사가 오는 28일 오전 11시 서울 중구 영원무역 명동사옥에서 열린다. 추모책자 봉헌, 헌무, 추모사 낭독 등이 진행된다."
2023-03-29,[부고] 전병섭씨,"▶전병섭씨 별세, 전진배(JTBC보도담당 대표이사)·전옥씨(영원무역 부장) 부친상, 강인열씨(개인사업) 장인상, 이윤희씨 시아버지상=28일 서울아산병원, 발인 30일 오전 8시40분, 3010-2000"
2022-12-01,[인사] 대보그룹 外,◆대보그룹 ▶전무 정승인 ◆대보건설 ▶전무 이동우 ▶상무보 진상균 조영찬 이윤석 이병복 김영관◆KG그룹 ▶사장 이익원 ▶부사장 김재익 이종현 ▶전무 이선재 전승재 김재수 윤병석 ▶상무 조기연 한상무 유충균 백민재 고규대 ▶상무보 민영득 최현수 정철환 박상영 장호석 ▶이사대우 강나루 신금만 김도영 박종관 김하영 진승재 김종혜 이태정 이동진 ◆KG제로인 ▶대표이사 한수혁◆영원무역홀딩스 ▶부회장 성래은◆태영건설 ▶부사장 이승모 ▶전무 안치열 ▶상무 이현석 ▶상무보 김영수 김인섭 백두성 이봉재 임기형 정광섭 조현민◆현대해상 ▶부문장 이권도 한정근 박종필 진한승◆수협중앙회 ▶금융부대표 문진호 ▶이사회사무국장 박웅 ▶홍보실장 유정호◆대유에이텍 ▶전무 김현태 ▶상무 범형택 ◆대유에이피 ▶상무 김영남 ◆대유홀딩스 ▶상무 최광옥
2024-06-18,"영원무역, 총수 가족회사 신고 누락했나…공정위 현장조사","영원무역 현판의 모습. 연합뉴스아웃도어 브랜드 ‘노스페이스’ 등으로 유명한 영원무역에 공정거래위원회 조사관이 파견돼 현장 조사에 나섰다. 1년 전 공시대상기업집단(대기업집단) 지정 당시 총수 일가 계열사의 신고를 누락해 지정을 피했다는 혐의다.18일 관련 업계 말을 들어보면, 공정위는 이날 영원무역 명동빌딩에 조사관을 파견해 현장 조사에 착수했다. 공정위는 영원무역이 지난해 4월 대기업집단 지정을 앞두고 성기학 영원무역 회장의 친인척 계열회사들을 누락한 채 자료를 제출했다는 혐의를 검토하고 있는 것으로 전해졌다.지난해 영원무역은 자산총액(4조8300억원·2022년말 기준)이 5조원을 밑돌아 대기업집단 지정을 피했다. 대기업집단 지정을 피하기 위해 의도적으로 계열회사 자료 제출을 누락한 것 아니냐는 것이 공정위 판단이다.영원무역은 지난해 누락했던 계열회사 자료를 제출해 올해 5월 대기업집단에 지정됐다. 대기업집단으로 지정되면 계열회사 간 출자, 내부거래 현황을 정기적으로 공시해야 한다. 계열회사 간 부당 지원과 총수 일가의 사익편취도 감시받게 된다.앞서 공정위는 지난해 10월에도 성 회장의 자녀 회사 부당 지원 의혹으로 영원무역에 대한 현장 조사에 나선 바 있다."
