date,title,content
2023-01-06,회사 속이고 민노총 간부 社內 들여보낸 직원...대법 “징계 못한다” 논란,"대법 “견책도 무효”… 산업계 “막 들어와도 보고만 있으란 거냐”노조원이 회사를 속이고 외부 민주노총 조합원을 자사 보안 시설에 접근하도록 한 데 대해 회사가 경징계를 내렸는데, 이를 무효로 하라는 법원 판결이 나와 산업계가 술렁이고 있다. “앞으로는 아무나 막 들어와도 가만 보고만 있으란 것이냐”는 항변이다.한국남부발전 직원으로 민노총 발전노조 조합원인 박모씨는 2018년 11월 국가 중요 시설인 발전소가 있는 강원 삼척본부에, 이 회사 해직 조합원 1명과 발전노조 상급 단체인 공공운수노조 조합원 3명 등 4명을 인솔해 들어갔다. 회사에는 ‘노조 사무실 방문’이 목적이라고 밝혔고, 사 측은 노조 사무실을 벗어나지 않는다는 조건으로 출입을 승인했다. 그러나 이 4명은 노조 사무실에 잠시 들렀다가 회사 이사회가 열리고 있는 본관 건물로 이동해 시위를 벌였다. 사 측은 박씨에게 ‘인솔 책임 소홀’을 이유로 가장 낮은 수위의 ‘견책’ 징계를 했고, 박씨는 이 징계가 부당하다며 노동위원회에 구제 신청을 했다.강원지방노동위원회와 중앙노동위원회는 모두 “삼척본부는 국가 보안 시설로 출입이 엄격히 통제되는 곳임에도 박씨가 당초 약속과는 달리 출입 승인을 받지 않은 곳에 외부인이 출입·활동하도록 했다”며 징계가 정당하다고 판단했다. 이에 불복해 박씨가 낸 행정소송 1심도 노동위 손을 들어줬다.법원 판단은 2021년 2심에서 뒤집혔다. 서울고등법원은 “출입자들의 행위는 (이 사업장) 종사 근로자가 아닌 노조 본부 또는 상급 단체 조합원에게도 허용되는 조합 활동”이라며 “중요 시설 보호를 이유로 ‘(이 사업장) 종사 근로자가 아닌 노조원’ 출입을 전면 배제할 수는 없다”고 했다. 박씨가 사측을 속인 건 “남부발전의 과도한 출입 제한에 대응해 한 행위”라며 문제 삼지 않았다. 2심은 박씨에 대한 징계를 취소하라고 판결했고, 대법원은 지난해 10월 2심 판결을 확정했다. 이달 3일 중앙노동위는 법원 판결에 따라 앞서 판정을 뒤집어 남부발전에 박씨 징계를 취소하고 징계로 인해 박씨가 덜 받은 임금도 박씨에게 지급하라고 명령했다.과거 법원은 산별노조나 산별연맹 등 상급 단체의 조합원이 사업장에 출입하면서 벌어진 분쟁에서 사 측 손을 들어주는 경우가 많았다. 그러나 근래에는 상급 단체 조합원의 출입도 노조 활동의 일부분으로 보장해야 한다는 쪽으로 판결이 바뀌고 있다. 이런 추세는 2020년 노동조합법이 개정되면서 더 강해졌다는 게 재계 분석이다. 당시 법 개정으로 “사업장에 종사하는 근로자가 아닌 노조 조합원은 사용자의 효율적인 사업 운영에 지장을 주지 않는 범위에서 사업장 내에서 노조 활동을 할 수 있다”는 조항이 추가됐다. 이 조항을 근거로 법원이 상급 단체 조합원의 사업장 출입을 사실상 무제한으로 허용하는 판결을 내리고 있다는 것이다.실제 지난해 1월 법원은 2020년 민노총 금속노조 간부들이 대우조선해양 조선소에 사 측 제지를 무시하고 진입, 집회를 열어 주거 침입 혐의로 기소된 사건에서 무죄를 선고했다. 앞서 대법원도 금속노조 간부들이 사측 허락 없이 유성기업 공장에 들어간 것을 “정당한 조합 활동”이라며 무죄를 선고했다.고용노동부는 “개정 노조법의 취지는 상급 단체 조합원의 사업장 출입을 무제한 허용하자는 것이 아니다”라며 “노조 조합원이라는 이유만으로 해당 회사에 소속되지 않은 조합원들 출입이 아무런 제한 없이 보장된다고 보기는 어렵다”고 지적했다. “사안에 따라 (주거 침입·퇴거 불응 등) 형법 규정을 적용받을 수도 있음에 유의해야 한다”는 것이다. 고용부는 미국·독일·영국·호주·뉴질랜드 등도 외부인의 사업장 출입을 사 측이 엄격히 제한하고 있다고 설명했다. 미국에서는 출입 거부권이 사 측의 권리로 인정되고, 독일에서는 사 측에 사업장 내에서 어떤 활동을 할 것인지 사전 통보해야 하며, 사 측의 의사에 반해 사업장에 들어가면 주거침입·기물 손괴 등으로 간주된다.한국경영자총협회 측은 “법원이 상급 단체 조합원의 사업장 출입 가능 여부를 지나치게 폭넓게 해석하면서 기업이 외부인의 출입을 통제할 방법이 없어진 상황”이라고 했다. ‘외부 노조 간부의 출입을 막을 방법이 없느냐’는 기업들의 문의도 잇따르고 있다고 했다."
2022-07-19,일부 노조원 시너 갖고있어… 작업장 입구 110명이 지켜,"민주노총 금속노조 소속 대우조선해양 하청지회가 점거하고 있는 경남 거제 옥포조선소 제1독에 공권력 투입이 초읽기에 들어간 것으로 알려졌다. 한덕수 국무총리 주재로 18일 열린 ‘대우조선해양 사태’ 관련 관계 장관 회의에는 윤희근 경찰청장 후보자도 참석했다. 이날 회의에서는 “불법행위에 대해서는 엄정한 대응이 필요하다”는 의견이 나온 것으로 알려졌다. 참석자들은 특히 지역 경제에 끼치는 영향이 크다는 점에서 공권력 투입이 시급하다는 의견을 주고받은 것으로 전해졌다.정부와 경찰 관계자에 따르면 19일 윤 경찰청장 후보자와 이상민 행정안전부 장관은 헬기를 타고 옥포조선소에 직접 가서 현장 상황을 둘러볼 것으로 알려졌다. 경남경찰청장도 배석해 하청지회의 조선소 독 점거 상황 등에 대해 두 사람에게 보고할 계획인 것으로 전해졌다.경찰 등에 따르면, 민주노총 금속노조 소속 대우조선해양 하청지회 소속 7명은 지난달 2일부터 경남 거제 옥포 조선소의 제1독(dock·배를 만드는 작업장)을 무단 점거하고 있다. 그 가운데 하청지회 부지회장 유모씨는 1㎥ 크기의 철제 구조물에 스스로를 결박한 상태로 농성을 하고 있다. 또 노조원 110명이 그 앞을 돌아가면서 지키고 있다고 한다.경찰은 이와 관련해 하청지회 관계자들에게 업무방해 혐의로 22일까지 출석하라는 4차 출석 요구서를 보낸 상태다. 이에 응하지 않을 경우, 경찰은 법원에 이들에 대한 체포 영장을 발부받아 강제 수사에 돌입할 계획을 세우고 있다.다만 경찰이 경찰이나 농성자가 다치지 않고 조선소 독에 진입해 농성을 풀 수 있는지 여부가 관건이다. 현재 ‘결박 농성’을 벌이고 있는 부지회장 유씨는 시너 통을 갖고 있고, 다른 노조원 6명은 15m가 넘는 구조물에 올라가 있다. 또 이들을 지키는 110여 명 노조원의 저지를 뚫으려면 다수의 경찰 인력 투입이 불가피하다. 한 경찰 관계자는 “섣불리 공권력을 투입했다간 무거운 철제물이 많은 현장 특성상 사고가 날 우려가 있어 철저한 대비가 필요한 상황”이라고 했다. 2011년 유성기업 사태 이후 노조가 점거한 사업장에 공권력이 투입된 적은 없었다."
2023-08-13,"물폭탄이 남긴 '수억 빚더미'…""지원금 300만원뿐"" 中企의 눈물 [르포]","지난 8일 오후 충남 부여군 장암면 석동리 농업회사법인 비이에프부여㈜. 공장 입구에 종이상자를 포장하는 테이프가 어른 키만 한 높이로 쌓여 있었다. 원래는 상자에 담겨 있어야 하지만 지난달 중순 내린 비로 물에 젖어 못 쓰게 됐다. 직원들은 하나라도 더 써볼까 하는 마음에 햇볕에 테이프를 말렸다.지난달 14일 내린 폭우로 공장이 침수된 충남 부여군 소재 중소기업 비이에프부여㈜ 내부 모습. 직원들이 공장을 정리하고 재가동을 준비 중이다. 신진호 기자공장 안쪽으로 들어가자 의자와 각종 사무용품, 포장용 종이상자가 눈에 들어왔다. 물에 잠겨 흙투성이가 됐던 의자는 직원들이 물로 씻어내고 걸레로 닦아 제 모습을 찾았지만, 바퀴와 틈새에는 누런 흙이 남았다. 직원들은 “하루라도 빨리 의자에 앉아서 일해야 하는데 기약이 없다”고 하소연했다.━침수로 기계·설비 고장…폐업도 고려토마토 관련 제품을 가공하고 포장하는 설비는 상황이 더 심했다. 철재로 만든 기계 설비는 물에 잠겼던 흔적이 그대로 남았다. 전문가를 불러 기계를 수리하고 전기모터와 부품을 교체했지만, 재가동이 될지는 확신할 수 없다고 한다. 부여군과 비이에프부여㈜ 관계자는 폭우에 따른 침수 피해가 20억원에 달할 것으로 추정하고 있다. 공장을 재가동하려면 최소한 몇억원은 더 필요해 폐업도 불가피한 상황이다.공장은 2021년 10월 가동을 시작해 아직 2년이 되지 않았다. 제품을 하루 평균 4~5t 정도 생산한 뒤 쿠팡 등 오픈마켓과 기업·학교 등에 납품해왔다.지난달 14일 내린 폭우로 공장이 침수된 충남 부여군 소재 중소기업 비이에프부여㈜ 직원들이 물에 젖은 물건들을 말리고 있다. 신진호 기자비이에프부여㈜ 관계자는 “공장을 짓고 거래처에 대금을 지급하느라 여유 자금이 없다. 추가 대출을 받아야 하지만 금액이 제한적이라 사실은 막막한 상태”라고 말했다.━특별재난지역 선포, 중소기업은 지원 제외지난달 중순 충청과 경북 지역에 내린 폭우로 막대한 인명과 재산 피해가 발생했다. 정부는 충남 부여와 청양 등 전국 13개 지역을 ‘특별재난지역’으로 선포하고 경제적 지원과 함께 복구를 돕고 나섰다. 특별재난지역 선포로 농민은 농업 시설에 대한 피해 복구비, 소상공인은 생계지원금 등을 받게 됐다. 유실·매몰된 농경지를 복구하는 비용도 모두 정부가 지원한다. 반면 중소기업은 정부에서 지원하는 생계비 300만원이 전부다.충남 부여에서는 집중호우로 10개 중소기업이 피해를 봤다. 피해 금액만 37억2100만원에 달한다.지난달 14일 내린 폭우로 침수 피해를 입은 충남 부여군 소재 중소기업 비이에프부여㈜가 가동을 중단한 채 불이 꺼져 있다. 신진호 기자부여군 구룡면 태양리 소재 '유성기와'도 공장이 기계와 시설이 물에 잠겼다. 피해 규모는 4억6000만원 정도다. 배수 작업을 마치고 공장을 정리 중이지만 가동은 어려운 상황이다. 유성기업은 특히 공장에 쌓아 놓은 원자재 피해가 커서 가동에는 시간이 더 필요할 것으로 관계 당국은 전망했다.━현금 300만원 외 대출이 전부…결국 빚더미현행법상 중소기업을 지원하는 방안은 ‘소상공인 300만원 지원’ 뿐이다. 정부와 자치단체에서 지원하는 세금 납부 유예와 복구자금 대출 제도가 있다. 이런 제도는 나중에 어차피 기업 부담으로 돌아오기 도움이 안된다고 한다. 자치단체가 앞다퉈 “금융 지원 상담을 신속하게 진행, 자금을 제때 지원하겠다”고 했지만, 현장에서 공감하지 못하고 있다. 익명을 원한 한 중소기업 대표는 “지금 정부 대책은 기업을 하지 말라는 것과 다름없다”며 “투자 여력이 없는 중소기업 여건을 한 번만 고려해달라”고 말했다.지난달 17일 오후 박정현 충남 부여군수(가운데)가 침수 피해를 입은 장암면 소재 중소기업을 찾은 배창우 충남지방중소벤처기업청장(오른쪽)에게 피해 상황을 설명하고 있다. 연합뉴스박정현 부여군수는 피해 현장을 방문한 중소벤처기업부 관계자와 정진석 국회의원에게 정부 차원의 지원을 요청했다. 재난 피해를 본 중소기업에 대출 등 간접적인 지원이 아닌 재난지원금과 같은 직접적이고 효과적인 지원이 필요하다고도 했다. 부여군의회는 지난달 31일 ‘집중호우 피해에 따른 실질적인 중소기업 보상 대책 마련’을 촉구하는 건의안을 채택하고 이를 대통령실과 국무총리, 여야 대표, 행정안전부 장관, 중소벤처기업부 장관 등에 보냈다.━박정현 부여군수 ""자연재해 복구에 공장도 추가""박정현 군수는 “침수 피해 기업들은 공장 가동이 중단돼 거래가 끊기고 위약금을 무는 실정”이라며 “(행정안전부) 자연재해 복구비용 산정 기준에 공장 피해도 추가해야 한다”고 주장했다.지난달 14일 내린 폭우로 공장이 침수된 충남 부여군 중소기업 비이에프부여㈜ 내부 모습. [사진 부여군]"
2023-03-23,'MB정부 댓글공작' 前경찰간부 5명 2심도 집행유예,"이명박 정부시절 경찰의 온라인 여론조작을 지휘한 혐의로 지난해 대법원에서 징역 1년 6개월 형을 확정받은 조현오 전 경찰청장. 뉴스1이명박 정부 시절 조현오 전 경찰청장의 지휘 아래 댓글 여론공작에 관여한 혐의로 기소된 당시 고위 간부 5명이 항소심에서도 징역형의 집행유예를 선고받았다.서울고법 형사2부(이원범 한기수 남우현 부장판사)는 23일 직권남용권리행사방해 혐의로 기소된 황모 전 경찰청 보안국장에게 1심과 같이 징역 10개월에 집행유예 2년을 선고했다.함께 재판에 넘겨진 김모 전 경찰청 정보국장은 징역 8개월에 집행유예 2년이, 전직 경찰청 정보심의관과 대변인에겐 징역 6개월에 집행유예 1년이 각각 선고됐다. 재판부는 “피고인들의 행위는 명백히 헌법 질서에 반한다”며 “경찰에 대한 국민의 신뢰가 크게 훼손됐다”고 지적했다.다만 이들은 일부 댓글 작성 지시가 직권남용권리행사방해죄의 처벌 대상인 ‘의무 없는 일을 시키는 행위’에 해당하지 않는다는 이유로 감형받았다. 이에 대해 재판부는 “경찰 조직의 위계질서상 조현오 전 청장의 지시를 거부하기 어려웠던 점은 유리한 사정”이라고 부연했다.황 전 국장과 김 전 국장은 조 청장의 지시에 따라 댓글 작업이 이뤄지도록 실무를 지휘한 혐의를 받는다. 이들은 2010년 1월 서울청 정보 부서에서 100여명 규모의 ‘SPOL’(SeoulPoliceOpinionLeader)이란 댓글 전담팀을 만들고 매일 댓글 대응 결과를 보고받은 것으로 전해졌다. 이러한 행위는 이들이 각각 경찰청 보안국장과 정보국장으로 승진한 뒤에도 계속됐다.당시 경찰은 천안함 사건, 연평도 포격, 구제역, 김정일 사망, 유성기업 노동조합 파업, 반값 등록금, 한미 자유무역협정(FTA) 국회 비준, 한진중공업 희망버스, 제주 강정마을 사태, 정치인 수사 등 여러 사안에 걸쳐 댓글 대응을 한 것으로 조사됐다.한편 댓글 여론공작을 지휘한 조 전 청장은 이들보다 먼저 기소돼 지난해 6월 대법원에서 징역 1년 6개월 형이 확정됐다."
2022-06-30,‘경찰 댓글’ 조현오 전 청장 징역 1년 6월 확정…세 번째 실형,"이명박 정부 시절 경찰의 온라인 여론조작을 지휘한 혐의로 재판에 넘겨진 조현오 전 경찰청장이 지난해 2월 서울 서초동 서울고등법원에서 항소심 공판을 마친 뒤 법정을 나서고 있다. 뉴스1이명박 정부 시절 온라인 댓글 등을 통해 여론 조작 활동을 벌인 혐의를 받는 조현오 전 경찰청장에 대해 징역 1년 6개월형이 확정됐다. 30일 대법원 1부는 조 전 청장과 검찰의 상고를 기각한다고 밝혔다. 조 전 청장에겐 이번이 노무현 전 대통령에 대한 사자명예훼손 혐의로 징역 8개월, 별도 뇌물죄로 2년 6개월형을 확정받은데 이어 세 번째 실형이다.조 전 청장은 서울경찰청장에 부임한 2010년 여론대응팀을 신설해, 약 6개월간 소속 경찰관들이 정부 정책이나 경찰에 우호적인 여론을 조성하는 인터넷 댓글이나 트위터 글 900여개를 올리도록 지시한 혐의를 받는다. 경찰청장에 부임한 뒤에도 조직적인 여론 대응을 지시해 소속 경찰관들이 약 1년 8개월 동안 1만 1000여개 댓글과 트위터 글을 쓰도록 해 직권남용 혐의로 재판에 넘겨졌다.당시 경찰이 조직적으로 대응했던 이슈는 천안함 피격 사건, 연평도 포격 사건, 구제역 사태, 유성기업 파업, 반값등록금 운동, 한미 자유무역협정(FTA) 국회 비준, 한진중공업 희망 버스, 제주 강정마을 등인 것으로 조사됐다.1심 재판부는 모든 혐의를 인정해 징역 2년을 선고했다. 하지만 2심을 거치며 형이 1년 6개월로 줄었다. 2심 재판부는 경찰관 신분을 드러내고 쓴 댓글, 정부나 경찰에 우호적인 여론을 조성한 것으로 평가되지 않은 댓글 등 101개는 무죄로 봤다. 당시 재판부는 “피고인이 서울지방경찰청장과 경찰청장으로 재임한 기간이 27개월인데, 압수 수색으로 확인한 인터넷 게시물 중 기소한 댓글이 1만2800여개에 불과해 국정원이나 기무사 등 다른 기관의 여론조작 댓글보다 현저히 적다”라고도 밝혔다.대법원도 2심 재판부 판단에 문제가 없다고 봤다. 이번 대법원 판결로 조 전 청장에 대해서는 세 번째로 실형이 확정됐다. 조 전 청장은 재임 중 내부 강연을 통해 노무현 전 대통령에 차명계좌가 있다는 사자 명예훼손 발언을 한 혐의로 2014년 3월 징역 8개월을 확정받고 복역한 바 있다. 지난해 5월에는 부산지역 중견 건설사 실소유주로부터 뇌물 3000만원을 받은 혐의로 징역 2년 6월형이 확정돼 수감 중이다."
2022-02-15,"경찰청장 댓글 조작史…MB 경찰청장 조현오, 2심도 징역형","이명박 정부 시절 경찰의 온라인 댓글 등을 통한 여론 조작 활동에 개입한 혐의로 재판에 넘겨진 조현오 전 경찰청장이 2심에서도 실형을 선고받았다. 같은 날 예정됐던 박근혜 정부 시절 강신명·이철성 전 경찰청장의 1심 선고는 오는 4월로 연기됐다.이명박 정부 시절 경찰의 댓글 공작을 지휘한 혐의를 받는 조현오 전 경찰청장 [연합뉴스]━法 “국정원 등 여론 대응 비해 댓글 수 현저히 적어”서울고법 형사2부(윤승은‧김대현‧하태한 부장판사)는 15일 오후 직권남용 권리행사 방해 혐의로 기소된 조 전 청장에게 징역 2년을 선고한 원심을 파기하고 징역 1년 6개월을 선고했다.재판부는 “조 전 청장의 행위는 경찰이 조직적·계획적으로 국민의 의사형성 과정에 부당하게 개입한 것으로헌법 질서에 반하고, 경찰을 향한 국민의 기대와 신뢰를 저버리게 한 행위”라고 지적했다. 앞서 1심 재판부 역시 “경찰들로 하여금 일반인인 것처럼 댓글을 작성하게 한 행위는동기나 목적과 상관없이 국가기관이 몰래 개입한 것”이라며 “이는 정치 활동의 자유 등 기본권과 언론·출판의 자유를 침해하는 것이고, 정당한 지휘·감독권 행사라고 볼 수 없다”며 징역 2년을 선고했다.다만 2심 재판부는 “피고인이 서울지방경찰청장과 경찰청장으로 재임한 기간이 27개월인데, 압수수색으로 확인한 인터넷 게시물 중 기소한 댓글이 1만2800여개에 불과해 국정원이나 기무사 등다른 기관의 여론조작 댓글보다 현저히 적다”는 점을 짚었다. 또 “실제 전체 댓글 가운데 정부의 입장을 옹호하는 등의 댓글은 5%에 불과한 것으로 보인다”고 덧붙였다. 또 “공소 제기 댓글을 전부 유죄로 판단한 원심과 달리, 경찰관 신분을 밝히고 작성한 댓글 등 101개 댓글은 무죄로 판단했다”며 감형 이유를 밝혔다.조 전 청장은 서울경찰청장과 경찰청장으로 재직했던 2010~2012년 정부에 우호적 여론을 조성하려는 목적으로 경찰청 보안국과 정보국 소속 경찰관을 동원해 온라인에서 댓글을 달게 하며 사이버 여론대응 활동을 주도한 혐의로 기소됐다.상관의 지시를 받은 정보경찰들은 차명계정, 해외IP등을 이용해 일반인으로 위장한 뒤 천안함, 연평도 포격, 구제역, 유성기업 파업, 반값등록금, 한미 자유무역협정(FTA) 국회 비준, 한진중공업 희망 버스, 제주 강정마을 등 여론이 첨예하게 갈렸던 사회 현안과 관련해 정부나 경찰을 옹호하는 댓글 1만2880여개를 쓴 것으로 조사됐다.━조현오, 盧 사자명예훼손·뇌물 이어 세 번째 실형이명박 대통령이 청와대에서 조현오 신임 경찰청장에게 계급장을 달아주고 있다. [중앙포토]구체적으로는 한진중공업 희망버스에 대해 “얼마나 했으면 그 경찰인가 하는 사람들이 잡아가겠습니까? 우리 모두 상대방 입장에서 한번 생각해 보세요. 그냥 가만히 있는데 경찰들이 검거해서 가자고 합니까!”라거나 G20 회의를 앞두고 이른바 ‘음향대포’ 도입이 논란이 되자 “빨리 도입해 불법시위꾼들에게 사용했으면 좋겠다. ㅋㅋ” 등의 댓글을 단 것으로 조사됐다. 천안함 폭침 사건 관련해선 “정일이 좋아하는 나쁜 새끼들 북한으로 보내라, 등기택배로”는 등의 댓글을 작성하기도 했다.다만 조 전 청장 측은 1·2심 과정에서 “경찰에 대한 비난에 대응하는 것이 어떻게 정치공작이고 댓글공작인가”라며 “큰 틀에서 공익의 목적을 갖고 직무를 수행한다는 생각으로 한 행위로 직권남용의 고의가 있었는지 의문”이라는 취지로 주장했다. 또 “당시 시각으로 보면 조 전 청장의 행위는 필요성이 있고 정당한 목적으로 행해진 부분도 있다”고 했다.조 전 청장은 2020년 2월 이 사건 1심에서 징역 2년을 선고받고 법정구속됐다가 항소심 중 보석으로 석방돼 불구속 상태에서 재판을 받았다. 하지만 별도로 부산지역 중견 건설사 실소유주로부터 뇌물 3000만원을 받은 혐의로 지난해 5월 대법원에서 징역 2년 6월 유죄가 확정돼 수감 중이다.조 전 청장은 또 재임 중 노무현 전 대통령에 대한 사자 명예훼손 발언을 한 혐의로 2014년 3월 징역 8개월을 확정받고 복역한 바 있어 경찰 댓글 조작 사건까지 확정될 경우 세 번째 실형이다.박근혜정부 시절 정보경찰을 동원해 불법적으로 선거 및 정치에 개입하고 정부 비판 세력을 사찰한 혐의를 받는 강신명, 이철성 전 경찰청장 [뉴스1]━정치개입 혐의 강신명 전 경찰청장 등 변론재개…4월 재판한편 같은 날 예정됐던 박근혜 정부 시절 정보경찰의 정치개입에 관여한 혐의로 재판에 넘겨진 강신명 전 경찰청장등의 1심 선고는 오는 4월로 연기됐다.서울중앙지법 형사합의27부(부장판사 김선일)는 공직선거법 위반 등 혐의로 기소된 강 전 청장과 이철선 전 청장(당시 경찰청 차장) 등 8명의 선고 공판을 이날 진행할 예정이었지만, 변론을 재개하기로 결정했다. 강 전 청장 등 8명의 28차 공판은 오는 4월25일 진행될 예정이다.강 전 청장 등은 정보경찰을 동원해 2016년 4월 20대 총선 당시 ‘친박’(친 박근혜계) 의원들을 위해 선거 정보를 수집하고 대책을 수립하는 등 공무원의 선거관여 금지 규정을 위반한 혐의로 재판에 넘겨졌다."
