date,title,content
2022-05-24,SK이노·LG·현대차로… 돌아온 ‘바이 코리아’,"외국인 두달만에 순매수 전환하이닉스·카카오 등도 사들여일러스트=정다운지난주(16~20일) 코스피 시장에서 외국인 투자자들이 3500억원대 순매수를 기록했다. 3월 말부터 7주 연속 총 7조원이 넘는 매도세를 보이다가 8주 만에 순매수로 방향을 튼 것이다.선물시장에서도 외국인이 최근 2주 연속 순매수에 나섰다. 기관투자자도 2주 연속 순매수에 가세하면서 2월 이후 처음으로 외국인과 기관이 동반 순매수를 기록했다. 미국과 한국의 추가 금리 인상과 이에 따른 경기침체 우려 속에서도 증시 ‘바닥론’을 얘기하는 사람들이 최근 하나둘 등장하는 이유다.이경민 대신증권 연구원은 “사실 개별 종목으로 볼 때 5월 들어 외국인들이 대형주를 중심으로 차츰 지분율을 늘려왔다”면서 “상대적으로 한국 수출이 양호하고, 1분기 기업 실적도 좋았던 덕분”이라고 말했다. 경기침체 우려는 이미 주가에 반영됐고, 실적 대비 저평가된 대형 종목 위주로 외국인이 매집에 들어갔다는 분석이다.대신증권이 최근 주가가 많이 떨어졌고, 자기자본이익률(ROE)이 높으면서, 부채비율이 낮은 종목 중 외국인 투자자들이 지분율을 높여 온 종목을 꼽아봤더니SK이노베이션,LG,오뚜기, 삼성물산, 현대차, 현대로템, 삼성SDI,SK하이닉스, 카카오, 삼성전자 등이 이름을 올렸다.이들 10개 종목 중 연초 대비 주가하락 폭이 가장 크면서 12개월 당기순이익 전망치 변화율이 가장 높고, 동시에 외국인 지분이 가장 많이 늘어난 종목은 카카오였다. 이경민 연구원은 “이들은 외국인 투자자들이 선점한 종목들이라는 점에서 저평가가 해소될 때까지 관심을 가질 만하다”고 했다.업종 전체적으로 볼 때 실적 전망은 상향 조정됐지만, 주가는 거꾸로 하락한 분야로는IT가전(삼성SDI,LG전자, 삼영전자), 건설·건축(KCC,코오롱글로벌), 반도체(DB하이텍,SK하이닉스, 삼성전자),IT하드웨어(엠씨넥스, 코리아써키트, 이수페타시스) 등이 꼽혔다."
2024-12-02,"“정정신고서 내라”…금감원, 이수페타시스 5500억 유증도 제동","금융감독원이 ‘올빼미 공시’ 등의 논란을 빚었던 이수페타시스 유상증자 계획에 대해 “정정 신고서 제출하라”고 요구했다. 두산과 고려아연의 유상증자에 제동을 걸었던 것과 방식이다. 이수페타시스의 유상증자가 사실상 어려워졌다는 분석이 나온다.서울 여의도 금융감독원 전경. 중앙포토2일 금감원 전자공시시스템(DART)에 따르면 금감원은 18일 제출한 이수페타시스의 증권 신고서에 대해 정정을 요구했다고 공시했다. 금감원은 이날 공시에서 “이수페타시스가 제출한 증권 신고서를 심사한 결과 형식을 제대로 갖추지 않은 경우 또는 증권 신고서 중 중요 사항에 관해 거짓의 기재·표시가 있거나 기재·표시되지 않은 경우, 중요 사항의 기재·표시 내용이 불분명해 투자자의 합리적 투자 판단을 저해하거나 중대한 오해를 일으킬 수 있는 경우에 해당됐다”고 밝혔다.정정 요구를 받은 이수페타시스는 3개월 이내에 정정신고서를 내야 하는데, 그렇지 않을 경우 증권신고서 자체를 철회한 것으로 본다. 앞서 금감원은 두산과 고려아연 측에 이런 방식으로 정정신고서를 요구해 유상증자 계획을 철회시켰다.이수페타시스는 지난달 8일 장 마감 후 5498억원 규모의 유상증자 계획을 공시했다. 1주당 2만7350원에 신주 2010만3080주를 발행하는데, 기존 주주에게 먼저 신주를 배정한 뒤 실권주가 나오면 일반 투자자에게 공모를 진행하는 방식이다. 조달 자금 가운데 2998억원은 탄소나노튜브(CNT) 제조사인 제이오 인수에 활용할 계획이었다.문제는 시장에서 제이오의 인수 효과를 회의적으로 바라본다는 점이다. 제이오와 이수페타시스의 사업 영역이 다른 만큼 유상증자를 통해 주주 가치를 끌어올리기 힘들다는 분석이 많았다. 이 때문에 같은 그룹사 이수스페셜티케미컬 대신 이수페타시스가 주주 자금으로 제이오 인수에 나섰다는 주장도 나왔다. 이수페타시스 주가는 유상증자 계획 발표 전인 지난달 7일 3만3700원에서 이날 2만1100원까지 37.4%(1만2600원) 급락한 채 마감했다.공시 시점도 문제였다. 이수페타시스는 지난달 8일 유상증자 계획을 금요일 정규장 마감은 물론 시간 외 거래도 끝난 뒤에 냈다. ‘올빼미 공시’를 통해 주주들 반발을 최대한 피하려고 했다는 비판이 나왔다."
2024-11-18,"이수페타시스, 제이오 인수 추진","제이오 탄소나노튜브""제이오와 이수페타시스 모두 자신의 아이템이 시장에서 부각되지 못하는 상황 속에서도 묵묵히 한 우물을 팠고, 결국 성공했다는 점에서 상당한 공통점이 발견됩니다. 자신의 영역에서 최고의 경지에 오른 두 회사가 이번 인수 이후 어떻게 시너지를 창출하며 더 성장해 나갈지 기대됩니다.""이수페타시스와 인수 대상 기업인 제이오 모두 비슷한 성공 스토리를 가지고 있어, 복잡한 시장 환경을 돌파할 수 있는 시너지 창출이 기대된다는 전망이 나오고 있다.글로벌 '탄소나노튜브(CNT)' 선도 기업 제이오는CNT가 최초 발견된 지 10여 년밖에 안 된 2003년에 자체 개발에 착수하고 3년 만에 업계 최초로 직경 10nm(나노미터)의 다중벽(MW)CNT양산에 성공했다. 그리고 10년 뒤인 2014년에 세계 최초로 직경 6nm의 소수벽(TW)CNT대량 생산에 성공했다. 하지만 2010년대 중반까지CNT수요가 크지 않아 국내 대다수 제조사들이 시장을 떠났지만 제이오는 오히려 시장 리딩 기업으로의 도약을 꿈꾸며 투자를 확대했다.경쟁업체들이 문을 닫던 2015년 현재의 1공장을 준공해 연산 100톤의 생산능력을 확보했으며, 이차전지 제조사 니즈에 부합하는 비철계 다중벽CNT인 '10B'주력 양산을 시작했다. 이러한 노력의 결과 2020년 주력 고객사인SK온의 소재 승인을 받게 된다. 2021년부터 올해까지 3차례의 증설을 거치면서 2개의 대량양산 공장을 보유하게 됐고, 다중벽CNT양산 생산능력(Capa) 기준 세계 5위권 업체로 올라서게 됐다. 뚝심 경영이 빛난 순간이다.2025년부터는 최고 난이도 제품으로 꼽히는 단일벽(SW)CNT대량 양산을 시작할 계획이며, 이로써 전세계에서 유일하게CNT'풀 라인업(FullLine-up)'을 보유한 명실상부한 '글로벌 톱티어(Top-tier)' 기업이 될 전망이다.제이오 인수에 나서는 이수페타시스의 과거와 현재 또한 이러한 제이오의 성공 스토리와 상당히 닮아 있다. 이수페타시스는 이수그룹의 인쇄회로기판(PCB) 전문 제조 계열사로, 1989년 이후 35년이 넘게PCB한 우물만 파 왔다. 현재는PCB분야에서도 기판 층수가 18층 이상이 되는 ‘초고다층(MLB)’ 영역에서 전세계 1~2위를 다투는 회사로 자리매김했다.이수페타시스 역시 디스플레이, 모바일, 반도체 등의 국내 주류산업에 비해 오랫동안 큭 주목받지 못했던 것이 사실이다. 그러나 이미 2000년대부터 전세계 통신/네트워크 1위 기업 ‘시스코(Cisco)’의 우수파트너로 선정되는 등PCB업계 내에서는 ‘히든챔피언’으로서 인정받아 왔다. 그러던 중, 코로나19 사태를 겪으면서 비대면 수요가 급증했고, 이로 인해 전세계 데이터 송수신에 부하가 걸리면서 이수페타시스의 '고다층기판(MLB_)'이 점점 대중에게 부각되기 시작했다. 이어서AI시대로의 패러다임 전환이 빠르게 일어나면서, 글로벌 빅테크 기업에는 없어서는 안될 핵심부품 공급사로 거듭나게 됐다.이수페타시스 관계자는 ""두 회사는 시시각각 변하는 시류에 휩쓸리지 않고 확신을 갖고 꾸준히 연구개발을 지속한 결과 글로벌 리딩 기업으로 올라섰다는 공통점이 있다""며 ""이번 인수로 이수페타시스와 제이오 모두 한 단계 성장할 수 있는 시너지 기회를 확보하는 것은 물론 이수그룹 사업 포트폴리오 다변화에 핵심 역할을 하게 될 것으로 기대한다""고 밝혔다."
2024-11-14,[노트북을 열며] 밸류업 기업의 배신,"안효성 증권부 기자“한국 주식을 살 사람이 없다.” 한국 주식의 부진 이유에 대해 한 자산운용사 대표가 꺼낸 말이다. 외국인들은 한국 시장에서 돈을 빼기 바쁘고, 기관 역시 하락하는 한국 주식을 쉽게 담지 못한다. 개인들의 저가 매수도 예전 같지 않다는 것이다.개인 매수세가 예전만 못한 것은 미국 증시, 암호화폐 등 한국 증시를 떠나 눈을 돌릴 곳이 많기 때문이다. 한국 증시가 반등하면 다시 돌아올 투자자들도 많다. 다만 한 가지 우려되는 점은 투자자들 사이에서 한국 주식에 대한 불신과 기피가 하나의 투자 문화로 자리 잡고 있다는 점이다.한국 증시가 약세를 면치 못하는 가운데, 개인 투자자들 사이에서는 한국 증시에 대한 불신도 커지고 있다. [뉴스1]불신의 근거도 간단히 넘길 수 없다. 반도체 기판 회사인 이수페타시스가 지난 8일 장 마감 후 오후 6시44분에 낸 ‘올빼미 공시’를 살펴보자. 이 회사는 기존 주식 수의 32%, 5498억 원에 달하는 유상증자를 공시했다. 8일 종가 기준 시가총액(2조80억원)의 27.3%에 해당하는 액수다. 이 회사 주가는 11일 22.68%(7200원) 급락한 2만4550원에 거래를 마쳤다.주식 시장으로부터 자금을 조달하는 것은 자본시장의 당연한 역할이다. 문제는 소통 방식과 사용처다. 이 회사는 당일 오전 9시에 이사회를 열어 유상증자를 결정했는데, 정작 공시는 장 마감 후 진행됐다. 대규모 증자를 하면서도 주주와의 소통은 거의 없었다. 사용처에도 의문이 남는다. 이수페타시스는 유상증자 자금 중 2998억원을 2차전지 소재기업 제이오 인수에 사용할 계획이다. 회사 측은 “포트폴리오 다각화”라고 설명했지만 이를 곧이곧대로 믿는 이는 드물다. 반도체 기판 회사가 2차전지 소재업에 진출하는 것이 인수 시너지를 낼지 의문이라서다. 게다가 이수그룹은 이미 2차전지 소재업을 하는 이수스페셜티케미컬이라는 계열사를 보유하고 있다. 증권가에서도 “이해할 수 없는 결정”(메리츠증권)이라는 평가가 나오는 이유다.이수페타시스는 밸류업 우수기업으로 선정되어 ‘밸류업 지수’에 포함된 회사다. 대규모 유상증자 계획을 발표했다가 철회한 고려아연 역시 밸류업 지수에 포함된 기업이다. 밸류업을 잘한다고 선별된 기업마저 이런데, 다른 기업은 말할 필요가 없다. 주가가 오르면 유상증자 폭탄을 걱정해야 하고, 신사업이 잘 되면LG에너지솔루션과 같은 물적 분할과 쪼개기 상장을 걱정해야 하는 것이 한국 투자자의 현실이다. 이젠 한국 증시에 투자하라는 말도 민망할 지경이 됐다. 한국 주식시장을 이대로 둘 생각이라면, 차라리 미국 주식 투자에 대한 세금이라도 줄여주는 방안을 모색하는 것이 국민의 자산 형성에 더 도움 될 듯하다."
2023-07-02,2310원짜리가 2만원 육박했다…상반기 732% 폭등한 이 종목,"한국거래소 전경. 연합뉴스올해 상반기 코스닥 시장에서 가장 크게 오른 종목은 알에프세미였다.━알에프세미, 상반기 상승률 732%2일 한국거래소에 따르면 알에프세미는 지난해 말 2310원에서 지난달 1만9220원으로 거래를 마감하며 상승률 732%를 기록했다.알에프세미는 지난 3월 중국 이차전지 기업 진평전자를 대상으로 200억원 규모의 유상증자 결정을 공시하며 주가가 급등했다. 진평전자는 리튬인산철 배터리 생산 시설을 보유한 것으로 알려졌다.증시에서 이차전지 열풍을 주도한 에코프로 역시 632% 급등했다. 지난해 말 10만3000원이던 주가는 지난달 말 75만4000원까지 올랐다.루닛(390%),HLB이노베이션(374%), 제이엘케이(358%), 뷰노(355%), 레이크머티리얼즈(342%), 소룩스(329%) 등도 300%가 넘는 상승률을 보였다.이처럼 상반기 주가 상승률 상위권에 이차전지 관련 종목이 대거 이름을 올렸다.반면 코스닥 시장에서 가장 많이 하락한 종목은 채권자 파산신청이 있었던 뉴지랩파마로 집계됐다. 지난해 말 1만1450원에서 지난 3월 9일 1383원으로 87% 폭락한 이후 거래가 정지됐다.2위는 86% 하락한 노블엠앤비로 지난해 말 2995원에서 상장폐지 사유 발생으로 거래가 정지된 지난 4월 7일 411원까지 떨어졌다.3위는SG증권발 폭락 관련주인 선광이 차지했다. 지난해 말 13만4100원에서 2만1600원으로 83% 넘게 하락했다.이어 골드앤에스(-73%), 에스디생명공학(-72%), 올리패스(-70%), 스튜디오산타클로스(-68%), 국일제지(-63%), 제넨바이오(-63%), 메디콕스(-58%) 등의 순으로 낙폭이 컸다.━코스피 상승 1위, 400% 오른 이수페타시스유가증권시장에서 주가가 가장 많이 오른 종목은 반도체 기판 제조업체 이수페타시스였다. 이수페타시스 주가는 작년 말 5630원에서 상반기 마지막 거래일인 지난달 30일 2만8200원으로 400% 급등했다.미국 엔비디아발 반도체 열풍에 힘입어 주가가 급등한 것으로 풀이된다. 이 회사는 엔비디아 등을 주요 고객사로 확보한 것으로 전해졌다.2위는 영풍제지다. 작년 말 5291원에서 지난달 30일 2만3800원으로 349% 오름세를 기록했다. 지난달에는 전기차 사용 후 폐배터리 사업 등 신규사업 계획을 밝히면서 지난 한 달간 14% 이상 올랐다.3위는 이차전지 관련 철강주TCC스틸로 지난해 말 9350원에서 지난달 3만5000원으로 274% 상승했다. 이 업체는 원통형 이차전지 케이스용 니켈도금 강판 등을LG에너지솔루션과 삼성SDI에 공급하는 것으로 알려졌다.이어 코스모신소재(260%), 큐로(226%), 덕양산업(206%), 이수화학(188%), 조선내화(179%),DB(179%), 동원금속(174%) 등 순으로 높은 상승률을 보였다.코스피 시장에서 주가가 가장 많이 하락한 종목은 대성홀딩스였다. 지난해 말 10만9500원에서 지난달 1만4780원으로 86% 내렸다. 대성홀딩스는 지난 4월 소시에테제네랄(SG)증권발 주가 폭락 사태로 급락했다.2위와 3위 또한SG증권 사태 관련 종목인 서울가스(-84%)와 삼천리(-72%)였다.이어 카프로(-64%), 현대비앤지스틸우선주(-60%), 에스디바이오센서(-59%), 세방(-58%), 일동홀딩스(-56%),DB하이텍1우선주(-56%), 세원이앤씨(-54%) 등의 순으로 하락률이 높았다.하락률이 가장 큰 10개 종목 중 4개(대성홀딩스·서울가스·삼천리·세방)가SG증권발 폭락 관련 종목이었다."
2023-10-24,영풍제지 불똥…5000억 미수금 우려에 키움증권 24% 급락,"키움증권이 라덕연 사태에 이어 영풍제지발 대량 미수금 발생 위기에 처했다. [중앙포토]키움증권 주가가 23일 급락했다. 영풍제지 하한가 사태의 여파로 상반기 순이익을 뛰어넘는 대규모 미수금이 발생했기 때문이다. 지난 4월 차액결제거래(CFD) 서비스를 활용한 ‘라덕연 주가조작 사건’ 이후에도 리스크 관리를 허술하게 해 화를 키웠다는 분석도 나온다.이날 키움증권은 유가증권시장에서 전 거래일보다 23.95%(2만4000원) 내린 7만6300원에 거래를 마쳤다. 주가가 급락한 건 키움증권이 지난 20일 장 마감 이후 “영풍제지 하한가로 고객 위탁 계좌에서 4943억원의 미수금이 발생했다”고 공시한 영향이다. 미수금 규모만 키움증권의 상반기 순이익인 4258억원을 뛰어넘는 수준이다.실제 손실 금액은 영풍제지의 거래 재개 이후 반대매매가 종료되고 미수 고객들의 변제 여부에 따라 확정된다. 하지만 수천억원대 대규모 손실이 불가피할 전망이다.화를 키운 건 키움증권이 다른 증권사보다 영풍제지의 증거금률을 낮게 유지하면서다. 금융투자업계에 따르면 미래에셋증권과 한국투자증권,NH투자증권, 삼성증권 등 주요 대형 증권사들은 올해 초부터 지난 7월까지 영풍제지의 증거금을 100%로 상향 설정했다.업황이 부진한 제지업체인데 영풍제지의 주가가 뚜렷한 이유 없이 지난 11개월간 12배 넘게 오르며 주식 커뮤니티에서도 ‘작전’이 의심된다는 이야기가 파다했기 때문이다. 증권사가 증거금률을 100%로 설정하면 해당 종목은 오로지 현금으로만 매수할 수 있어 미수 거래가 차단된다.반면 키움증권은 영풍제지의 증거금률을 40%로 유지하다가 하한가 사태가 터진 이후인 지난 19일에서야 100%로 조정했다. 증거금률을 40%로 설정하면 현금 40만원만 있으면 주식 100만원어치를 살 수 있다. 나머지 60만원은 실제 주식이 계좌로 입고되는 날(거래일로부터 2영업일 후) 이전까지 납부하면 된다. 결제일까지 미수금을 내지 못하면 증권사가 주식을 강제로 처분(반대매매)하게 된다.이번 사태로 키움증권의 리스크 관리 능력이 다시 도마 위에 올랐다. 키움증권은 지난 4월 ‘라덕연 사태’가 벌어졌을 때CFD문제로 900억원대 대손충당금을 쌓았다.증권업계의 한 관계자는 “이미CFD문제로 업계가 리스크 관리에 만전을 기하고 있었는데, 당시 문제가 가장 컸던 키움증권만 유독 증거금률을 낮게 유지한 건 상당히 의문이 든다”고 말했다.나이스신용평가도 이날 키움증권과 관련한 보고서에서 “CFD사태에 이어 위탁매매 관련 대규모 비경상비용이 발생한 것이 올해 들어 두 번째”라며 “타 증권사가 선제적으로 증거금률을 인상한 점을 비춰볼 때 회사의 리스크 관리 역량과 신뢰도에 대한 우려가 커지고 있다”고 지적했다.키움증권은 뒤늦게 최근 주가가 급락한 2차 전지 종목 등에 대해 미수 거래와 신용융자를 차단하는 등 리스크 관리 강화 조치에 나섰다. 키움증권은 이날부터 포스코홀딩스와 한미반도체, 에코프로, 에코프로비엠, 포스코DX,레인보우로보틱스, 이수페타시스, 인벤티지랩 등 15개 종목의 신용융자와 담보대출을 막고 증거금률을 100%로 설정하기로 했다.키움증권 관계자는 “영풍제지는 투자주의 종목이긴 했지만 투자경고 종목은 아니어서 자체적인 기준에 따라 증거금을 100%까지 올리진 않았다”면서도 “주가가 비정상적으로 오르는 부분 등을 치밀하게 살폈어야 하는 부분에선 아쉬움이 있다”고 말했다. 또 “반대매매를 통해 미수금을 회수할 예정이며 고객의 변제에 따라 최종 미수채권 금액은 감소할 수 있다”고 밝혔다."
2023-10-23,"5000억 영풍제지 미수금 우려에 키움증권 24% 급락...""리스크 관리 빨간불""","키움증권 주가가 23일 급락했다. 영풍제지 하한가 사태의 여파로 상반기 순이익을 뛰어넘는 대규모 미수금이 발생했기 때문이다. 지난 4월 차액결제거래(CFD) 서비스를 활용한 ‘라덕연 주가조작 사건’ 이후에도 리스크 관리를 허술하게 해 화를 키웠다는 분석도 나온다.서울 영등포구 여의도 키움증권 본사 모습. 뉴스1이날 키움증권은 유가증권시장에서 전 거래일보다 23.95%(2만4000원) 내린 7만6300원에 거래를 마쳤다.주가가 급락한 건 키움증권이 지난 20일 장 마감 이후 “영풍제지 하한가로 고객 위탁 계좌에서 4943억원의 미수금이 발생했다”고 공시한 영향이다. 미수금 규모만 키움증권의 상반기 순이익인 4258억원을 뛰어넘는 수준이다.실제 손실 금액은 영풍제지의 거래 재개 이후 반대매매가 종료되고 미수 고객들의 변제 여부에 따라 확정된다. 하지만 수천억원대 대규모 손실이 불가피할 전망이다.화를 키운 건 키움증권이 다른 증권사보다 영풍제지의 증거금률을 낮게 유지하면서다. 금융투자업계에 따르면 미래에셋증권과 한국투자증권,NH투자증권, 삼성증권 등 주요 대형 증권사들은 올해 초부터 지난 7월까지 영풍제지의 증거금을 100%로 상향 설정했다.업황이 부진한 제지업체인데 영풍제지의 주가가 뚜렷한 이유 없이 지난 11개월간 12배 넘게 오르며 주식 커뮤니티에서도 ‘작전’이 의심된다는 이야기가 파다했기 때문이다. 증권사가 증거금률을 100%로 설정하면 해당 종목은 오로지 현금으로만 매수할 수 있어 미수 거래가 차단된다.반면 키움증권은 영풍제지의 증거금률을 40%로 유지하다가 하한가 사태가 터진 이후인 지난 19일에서야 100%로 조정했다. 증거금률을 40%로 설정하면 현금 40만원만 있으면 주식 100만원어치를 살 수 있다. 나머지 60만원은 실제 주식이 계좌로 입고되는 날(거래일로부터 2영업일 후) 이전까지 납부하면 된다. 결제일까지 미수금을 내지 못하면 증권사가 주식을 강제로 처분(반대매매)하게 된다.김경진 기자강승건KB증권 연구원은 “영풍제지의 거래정지 전 3일 평균 거래대금이 3464억원임을 고려할 때 미수 거래가 비정상적으로 큰 비중을 차지해 키움증권에 쏠림 현상이 나타났다”며 “일반적인 상황은 아니었다”고 말했다. 강 연구원은 이날 미수금을 반영해 키움증권의 올해 영업이익 추정치를 하향 조정하며 목표 주가를 13만원에서 12만3000원으로 내렸다.정민기 삼성증권 연구원도 키움증권 목표주가를 12만5000원에서 10만원으로 하향 조정하며 “담보 주식의 거래가 재개되더라도 연속으로 하한가가 발생할 경우 반대매매가 불가능한 상황이 발생할 수 있다”고 분석했다.이번 사태로 키움증권의 리스크 관리 능력이 다시 도마 위에 오르게 됐다. 키움증권은 지난 4월 ‘라덕연 사태’가 벌어졌을 때CFD문제로 900억원대 대손충당금을 쌓았다.증권업계의 한 관계자는 “이미CFD문제로 업계가 리스크 관리에 만전을 기하고 있었는데, 당시 문제가 가장 컸던 키움증권만 유독 증거금률을 낮게 유지한 건 상당히 의문이 든다”며 “증거금률을 낮게 유지하다 보니 키움증권으로 쏠림 현상이 일어났고, 나중엔 손을 써봤자 문제가 생길 수밖에 없는 상황이 된 것 같다”고 말했다.나이스신용평가도 이날 키움증권과 관련한 보고서에서 “CFD사태에 이어 위탁매매 관련 대규모 비경상비용이 발생한 것이 올해 들어 두 번째”라며 ""타 증권사가 선제적으로 증거금률을 인상한 점을 비춰볼 때 회사의 리스크 관리 역량과 신뢰도에 대한 우려가 커지고 있다”고 지적했다.키움증권은 뒤늦게 최근 주가가 급락한 2차 전지 종목 등에 대해 미수 거래와 신용융자를 차단하는 등 리스크 관리 강화 조치에 나섰다. 키움증권은 이날부터 포스코홀딩스와 한미반도체, 에코프로, 에코프로비엠, 포스코DX,레인보우로보틱스, 이수페타시스, 인벤티지랩 등 15개 종목의 신용융자와 담보대출을 막고 증거금률을 100%로 설정하기로 했다.키움증권 관계자는 “영풍제지는 투자주의 종목이긴 했지만 투자경고 종목은 아니어서 자체적인 기준에 따라 증거금을 100%까지 올리진 않았다”서도 “주가가 비정상적으로 오르는 부분 등을 치밀하게 살폈어야 하는 부분에선 아쉬움이 있다”고 말했다. 또 “반대매매를 통해 미수금을 회수할 예정이며 고객의 변제에 따라 최종 미수채권 금액은 감소할 수 있다”고 밝혔다."
