date,title,content
2024-12-02,"금감원, 이수페타시스 5500억 유상증자 제동…‘정정신고’ 요구","서울 여의도 금융감독원의 모습. 연합뉴스코스닥 상장사 이수페타시스가 5500억원 규모로 추진하던 유상증자에 금융감독원이 제동을 걸었다.2일 금융감독원 전자공시시스템을 보면, 금감원은 이날 오후 이수페타시스가 지난달 18일 제출한 유상증자 증권신고서에 대한 정정신고서 제출을 요구했다. 이에 따라, 이 회사의 유상증자 증권신고서는 수리되지 않은 것으로 간주되고 즉시 효력이 정지됐다.금감원은 “증권신고서의 형식을 제대로 갖추지 아니한 경우, 또는 그 증권신고서 중 중요사항에 관하여 거짓의 기재 또는 표시가 있거나 중요사항이 기재 또는 표시되지 아니한 경우와, 중요사항의 기재나 표시내용이 불분명하여 투자자의 합리적인 투자판단을 저해하거나 투자자에게 중대한 오해를 일으킬 수 있는 경우에 해당”하여 정정신고서 제출을 요구한다고 밝혔다. 이수페타시스가 3개월 안에 정전신고서를 제출하지 않으면, 증권신고서는 철회된 것으로 간주된다.반도체 기판 제조업체인 이수페타시스는 지난 달 8일 장 마감 후 공시를 통해, 이차전지 소재 기업 제이오의 지분 인수자금 마련(2998억원)과 시설자금 마련(2500억원)을 위해 총 5500억원 규모의 유상증자를 결정했다고 발표했다. 발행하는 신주의 수는 발행 주식 수의 31.8%에 달했다. 유상증자를 악재로 판단한 투자자들이 주식을 매각하면서 주가가 급락했고, 투자자들의 반발이 이어져왔다.이수페타시스 주가는 2일에도 5.38%(1200원) 떨어진 2만1100원에 거래를 마쳤다. 유상증자 공시 직전 주가(3만1750원)에 견줘 33.5%나 하락했다."
2024-12-17,금감원 정정신고 요구에도 ‘유상증자 갈등’ 출구 못 찾아,"이수페타시스·현대차증권 “강행”함용일 금융감독원 부원장이 지난 10월 31일 서울 영등포구 금융감독원에서 고려아연의 기습적인 유상증자 발표와 관련한 긴급 브리핑을 열고 있다. 연합뉴스회사의 유상증자 계획에 주가가 급락하면서 소액주주들이 거세게 반발하는 사례가 늘고 있지만, 갈등은 출구를 찾지 못하고 있다. 이수페타시스의 경우 금융감독원이 증권신고서 정정을 요구하며 제동을 걸었으나, 회사 쪽은 정정신고서를 제출하며 증자 강행에 나섰다. 금감원의 정정신고 요구를 받은 현대차증권도 이달 중 정정신고서를 제출하겠다고 밝혔다.이수페타시스는 11월8일 발행주식의 32% 이르는 신주를 발행해 기존 주주에 배정하는 5500억원 규모의 유상증자 계획을 발표했다. 이에 주가가 한때 33%나 급락하고 주주들의 반발이 이어졌다.금융감독원은 12월2일 정정보고서 제출을 요구했다. 경영권 분쟁 과정에서 유상증자로 자본을 확충하려던 고려아연이 금감원의 정정신고 요구에 증자를 철회한 사례가 있어, 이수페타시스 증자도 제동이 걸릴 것이라는 기대가 주주들 사이에 번졌다. 그러나 기대는 곧 물거품이 됐다.이수페타시스는 9일 뒤인 11일 정정신고서를 내고, 일정만 변경해 유상증자를 그대로 실시한다고 공시했다. 이수페타시스는 금감원의 정정신고 요구에 대해 ‘투자 위험’에 대한 설명 내용만 주로 보완했다.11월26일 2천억원 규모의 주주배정 유상증자를 결정한 현대차증권도 소액주주들의 반발이 거세다. 금융감독원은 13일 정정신고를 요구했다. 그러나 현대차증권 쪽은 “금감원의 정정요구사항에 대해 현재 보완·정정하고 있다”며 “절차에 따라 이달중 정정신고서를 제출할 예정”이라고 17일 밝혔다. 증자를 강행하겠다는 것이다.금감원은 정정신고를 요구할 때마다 “증권신고서의 형식을 제대로 갖추지 아니한 경우, 또는 그 증권신고서 중 중요사항에 관하여 거짓의 기재 또는 표시가 있거나 중요사항이 기재 또는 표시되지 아니한 경우와, 중요사항의 기재나 표시 내용이 불분명하여 투자자의 합리적인 투자판단을 저해하거나 투자자에게 중대한 오해를 일으킬 수 있는 경우에 해당”된다고 일반론적인 요건만 밝히고 있다. 이에 대해 현대차증권 쪽은 “투자위험요소 등 일부 내용에 대한 보완 요청이 있었다”고 설명했다. 증자를 철회해야 할 사유는 아니라는 것이다. 이들이 제출한 정정신고서에 대해 금감원이 재차 정정신고를 요구할지는 미지수다.소액주주들의 반발은 이어지고 있다. 이수페타시스 소액주주연대는 16일 ‘유상증자 증권신고서 반려 촉구 성명서’를 회사에 발송했다고 밝혔다. 이들은 주주행동 플랫폼 ‘액트’를 통해 지분 5.56%(350만7727주)를 모은 것으로 전해졌다. 향후 임시주주총회 소집 요구 등의 주주행동에 나설 계획이다. 현대차증권 주주들도 금감원에 민원 제기 운동을 벌이고 있다."
2024-12-25,"증권사들, 4분기 상장사 64% 목표주가 낮춰","‘유상증자’ 이수페타시스 50.1%↓ 가장 큰폭24일 오후 서울 중구 하나은행 본점 딜링룸에서 딜러가 업무를 보고 있다. 연합뉴스증권사들이 4분기 국내 경기 둔화 우려와 트럼프 2기 행정부의 관세 인상 불안감 등을 이유로 상장사 10곳 중 6곳 꼴로 목표주가를 낮춘 것으로 나타났다.25일 금융정보업체 에프앤가이드 집계를 보면, 증권사 3곳 이상이 목표주가를 제시한 281개 종목 중 지난 9월 말에 견줘 20일 현재 목표주가가 하향 조정된 종목이 63.7%에 이르는 179개로 나타났다. 목표주가가 상향 조정된 종목은 100개(35.6%)에 그쳤다. 2곳은 같은 수준을 유지했다.목표주가(목표가격)는 증권분석가가 기업의 내재가치와 시장 여건을 분석하여 일정 기간 안에 도달 가능성이 높다고 생각하는 주가 수준을 말한다.목표주가가 가장 큰폭으로 떨어진 종목은 이수페타시스였다. 평균 목표주가가 지난 9월 말 6만7250원에서 이달 3만3571원으로 50.1% 떨어졌다. 4분기 실적 전망이 나빠진 가운데, 이차전지 소재 기업 제이오 인수를 위한 대규모 유상증자 결정에 투자 위험이 부각된 까닭이다. 케이비(KB)증권은 11월27일 목표가격을 6만원에서 3만1천원으로 낮췄다.화장품 기업인 씨앤씨인터내셔널이 13만5천원에서 8만6429원으로 36.0% 낮아져 하향 조정폭이 두번째로 컸고, 인쇄회로기판업체인 심텍의 목표주가가 3만2천원에서 2만603원으로 35.6% 떨어져 그 뒤를 이었다.목표주가 하락률 상위 10개 종목 중 4개는 반도체 관련 기업, 3개는 화장품 관련 기업이었다. 반도체는 범용 메모리 수요 부진 등에 수익성 악화 우려로, 화장품 업종은 중국 소비 경기 침체와 미국 화장품 수출 정점 통과 우려가 반영된 영향으로 풀이된다.반면에 4분기 들어 평균 목표주가가 가장 큰폭으로 오른 종목은 엔터테인먼트 기업인 디어유로, 9월 말 3만3천원에서 이달 4만5375원으로 37.5% 상향 조정됐다. 비소세포폐암 치료제 ‘레이저티닙'(제품명 렉라자)의 미국 출시에 이어 다른 지역 출시가 기대되는 유한양행의 목표가가 34.4% 올라 뒤를 이었다. 방산주인 한화에어로스페이스는 32%, 현대로템은 25% 올랐다."
2024-12-03,‘현대차증권이 어떻게’…유상증자에 개미들 반발 거센 이유,"‘상법 개정’ 필요한 이유현대차증권 사옥. 회사 제공현대차증권이 지난달 26일 이사회 결의를 거쳐 공시한 유상증자 계획에 소액주주들의 반발이 매우 거세다. 포털 사이트 종목토론방에 비난 글이 쇄도하는 가운데, 한 주주는 ‘대통령실 국민제안’에 “부당한 유상증자를 막아달라”는 민원 신청을 접수했다고 3일 밝혔다. 국민권익위원회 국민신문고에 금융감독원을 상대로 릴레이 민원 제기에 나선 투자자들도 있다. 이런 거센 반발에는 그럴만한 이유가 있다고 개인투자자들은 말한다.‘밸류업 공시를 기대했는데, 거꾸로 회사가 주주에게 손을 벌렸다’는 배신감이 첫 손에 꼽힌다. 현대차증권은 자본금 1938억원에 순자산(자본총계)이 그 6.5배인 1조2699억원이다. 배당하지 않고 쌓아둔 이익잉여금도 5934억원에 이른다. 자금을 두둑히 쌓아둔 회사가 배당을 늘리기는 커녕 ‘주주를 현금인출기로 여겼다’는 것이다.현대차증권은 시가총액(공시일 기준)의 72%에 해당하는 2천억원을 유상증자로 조달해, 1천억원은 시설자금으로 쓰고, 225억원은 채무상환, 775억원은 기타자금으로 쓰겠다고 밝혔다. 그런 유상증자가 주가를 떨어뜨릴 것임을 누구보다 잘 아는 증권회사가 감행했다는 점도 개인투자자들이 거세게 반발하는 이유다. 올해 유상증자를 공시한 50개 상장사 가운데, 증권사는 현대차증권이 유일하다. 교보증권은 2020년 두 차례와 지난해 말 유상증자를 결정해 자본금을 키웠는데, 세 차례 모두 최대주주인 교보생명을 상대로 한 제3자 배정 유상증자였다.현대차증권이 과거 유상증자를 실시했을 때에 견줘 주가가 폭락해있다는 점도 불신을 키웠다. 현대차증권이 2009년 9월 주주 배정 유상증자를 실시할 때 주당 발행가액은 1만8900원이었다. 이번 공시 직전 주가는 8800원에 불과했다. 15년 동안 주가가 반토막난 셈이다. 당시엔 주주 배정 유상증자에 앞서 현대차가 제3자 배정 유상증자 방식으로 주당 2만3650원에 3.36%의 지분을 인수해, 기존 주주 부담을 덜어줬지만 이번에는 그런 안전판조차 없다.현대차증권에 앞서 11월8일 5500억원 규모의 유상증자를 결의한 이수페타시스는 주주들의 반발이 거센 가운데 2일 금융감독원이 정정신고를 요구하며 증권신고서 효력을 정지시켰다. 회사가 유상증자를 철회하지 않겠느냐는 기대가 퍼지며 3일 주가가 상한가에 근접한 26.8% 반등했다.현대차증권은 유상증자 공시 직전 8800원이던 주가가 2일 종가 7550원까지 거래일수로 나흘간 14.2% 하락했다. 금감원이 이수페타시스 유상증자에 제동을 걸자, 3일엔 2.65%(7750원) 반등했다. 그러나 회사가 신주배정기준일(1월3일) 이전에 유상증자를 철회’할 것이란 기대는 크지 않다. 현행법상 하자가 딱히 보이지 않기 때문이다.김우찬 경제개혁연대 소장(고려대 교수)은 “현행법은 유상증자 규모나 발행가에 구제적 제한을 두지 않아 이사회가 모든 결정을 내린다”며 “상법을 개정해 이사들이 주주들을 공평하게 대우하게 하고, 유상증자 남발을 방지해야 한다”고 말했다. 앞서 민주당은 이사의 충실 의무 대상에 일반 주주를 포함시키는 내용의 상법 개정안을 발의한 바 있다. 그러나 당초 상법 개정을 주장하던 정부·여당은 재계 반발에 밀려, 상장회사 합병과 물적분할 뒤 재상장 제도만 개선하는 자본시장법 개정안으로 입장을 바꾼 상태다. 정부의 자본시장법 개정안은 유상증자 등 일반주주 이익 침해 사례에는 적용되지 않는다."
2024-12-02,매주 한 건 ‘유상증자 폭탄’…“이래서 한국 증시를 떠난다”,"올해 공시 50곳 중 49곳 평균 18% 주가 ↓2024년 11월29일 서울 중구 하나은행 본점 딜링룸 현황판에 코스피 지수 등이 표시되고 있다. 이날 코스피 지수는 전 거래일 대비 48.76(1.95%) 내린 2,455.91에, 코스닥은 16.20(2.33%) 내린 678.19에 장을 마감했다. 연합뉴스지난 4월5일 금요일 주식시장 거래가 끝난 뒤, 코스닥 상장사인 에스지(SG)·한주라이트메탈·인성정보 등 3개 회사가 유상증자를 한다고 공시했다. 유상증자는 회사가 신주를 발행해 팔아 자본금을 늘리는 것을 말한다. 불길한 예감에, 토요일과 일요일 이틀간 주주들은 속을 태웠다. 아니나 다를까. 월요일인 8일 개장과 동시에 주가는 폭락했다. 이날 에스지가 26.12%, 한주라이트메달이 25.04%, 인성정보가 16.58% 떨어져 거래를 마쳤다.투자자들은 ‘유상증자 폭탄’이 터졌다고 했다. 회사의 ‘합법적인 유상증자’를 ‘폭탄’으로 받아들이는 데는 그럴만한 이유가 있다. 앞서 유상증가를 공시한 유에이프로젠바이오로직스(공시일 1월12일), 윈팩(2월28일)은 공시 뒤 첫 거래에서 주가가 하한가로 떨어졌다. 디엑스브이엑스(DXVX,5월29일), 이오플로우(8월21일), 디에이치(DH)오토웨어(8월22일), 큐로홀딩스(9월27일)도 하한가로 떨어졌다. 이오클로우는 다음날에도 13.09% 추가 하락했다.유상증자 공시가 주가 폭락으로 이어지는 것은 대기업이라고 다르지 않다. 지난 8일 금요일, 인쇄회로기판 제조업체인 유가증권시장 상장사 이수페타시스가 5500억원 규모의 유상증자를 한다고 공시했다. 3만1750원이던 주가는 월요일인 11일 2만4550원으로 22.68% 폭락했다.이에 개인투자자들의 원성이 아직 가라앉지 않은 가운데, 26일 현대차그룹 계열사로 주식시장 생리를 잘 아는 현대차증권이 장 마감 뒤 2천억원 규모의 유상증자 계획을 공시했다. 다음날 주가는 13.07%(1150원) 떨어진 7650원에 거래를 마쳤다. 52주(최근 1년) 신저가였다.1일 한겨레가 올들어 유상증자를 공시한 50개 상장사의 공시 뒤 첫거래일 주가를 분석해보니, 에스티큐브(9월3일 공시, +3.99%)를 제외한 49곳의 주가가 떨어진 것으로 나타났다. 평균 하락률은 17.6%에 이른다. 10% 이상 급락한 상장사가 36곳(73.5%)으로 넷 중 셋이었다. 하한가 6곳을 포함해 20% 이상 폭락한 상장사도 20개다.증자를 공시한 50개사는 유가증권시장 상장사가 8곳, 나머지 42곳은 코스닥 상장사다. 자금조달 목표 규모는 총 3조원이다. 전체 평균 조달 목표액은 600억원이다. 자금조달 목적은 유상증자에 대한 소액주주들의 불만을 짐작하게 한다. 코스닥 기업의 경우 절반 남짓(50.5%)이 운영자금 마련, 20%가 차입금 상환 목적이었다. 수익성 높은 투자를 확대하기 위해서라기보다, 회사가 굴러가는데 필요한 자금을 마련하기 위해 주주들에게 손을 벌렸단 얘기다. 이런 형태의 유상증자는 기존 주식의 가치 희석만 남긴다. 그래서 할인가에 발행하는 신주를 인수할 권리를 일찌감치 포기하고 다투어 주식을 팔아버린다. 이사회가 결의한 증자 계획을 주주총회에서 부결시키는 건 사실상 불가능하다고 보기 때문이다. 유상증자 공시 직후 주가가 급락한 배경이다.유가증권시장 상장사의 경우 자금조달 목적으로 시설자금 비율이 57.8%로 상대적으로 컸다. 하지만 설비를 확대하거나 인수합병(M&A) 자금을 유상증자로 조달하려는 경우에도 소액주주들의 기대를 얻기보다 불만을 살 때가 흔하다.이달초 유상증자를 공시해 주가가 급락한 이수페타시스는 증자로 조달하는 5500억원 가운데 2500억원을 시설자금으로, 3천억원은 2차전지 소재기업인 제이오 인수를 위해 쓸 계획이다. 공시 직후 2만4550원으로 폭락한 주가는 27일 2만1600원까지 더 떨어졌다. 증자 공시 전에 견줘 32%나 떨어진 것이다. 케이비(KB)증권 권태우 분석가는 지난달 28일 낸 보고서에서 “제이오 인수와 관련된 자금 조달이 주당순이익 희석을 초래하며 투자 리스크를 유발했다”며 목표주가를 기존 6만원에서 3만1천원으로 절반 가까이 낮췄다.매주 한 건 꼴로 떨어지는 ‘유상증자 폭탄’에 개미들의 분노가 포털사이트 주식 토론방을 채우고 있다. ‘이러니 국장(한국 증시)을 떠난다’,‘소액주주를 보호하기 위해 상법을 개정하라’는 내용의 글이 수없이 쌓여간다."
