date,title,content
2023-08-20,'에코형제' 2조원 던진 개미들…이달 들어 사들인 종목 톱10,"2차전지를 향한 ‘무조적인 사랑’을 보였던 개인투자자의 마음이 돌아서고 있다. 지난달부터 2차전지주의 대표주자인 에코프로와 에코프로비엠을 2조원가량 팔아치운 개인투자자가 이달 들어 삼성전자를 담고 있다. ‘포스트 2차전지’를 꿰찰 주도주의 향방에 시장의 관심이 쏠리고 있다.20일 한국거래소에 따르면 지난 1일부터 18일까지 개인투자자가 가장 많이 순매수한 종목은 삼성전자다. 9456억9769만원어치를 사들였다. 포스코홀딩스(5687억원)와 기아(3040억원),LG화학(2901억원), 삼성SDI(2535억원) 등이 뒤를 이었다.김영옥 기자지난달 개인투자자의 매수세가 2차전지에 집중됐던 것과는 사뭇 다른 모습이다. 지난 7월 한 달간 개인투자자는 포스코홀딩스(4조5232억원)을 그야말로 ‘폭풍 매수’했다.LG화학(5038억원)과LG에너지솔루션(3718억원), 포스코인터내셔널(3425억원) 등도 7월 개인투자자 순매수 상위권에 이름을 올렸다.━개인, 7월부터 '에코' 형제 2조원 넘게 순매도심지어 개인투자자는 지난달 2차전지 주도주인 에코프로와 에코프로비엠을 대거 팔아치웠다. 7월 한 달간 개인투자자의 순매도 상위 1위와 2위는 에코프로(1조856억원)와 에코프로비엠(1조816억원)이 차지했다. 이달 들어서도 ‘팔자’는 이어지고 있다. 개인투자자는 이달 들어 지난 18일까지 에코프로를 1061억원어치 순매도했다.김주원 기자김학균 신영증권 리서치센터장은 “2차전지 종목 가격이 급등하며 차익 실현하려는 개인 투자자 수요와 기관 투자자의 인덱스 추종 매입, 외국인·기관의 숏커버링(공매도 투자자가 손실을 줄이려 주식을 되사는 것) 수요가 겹치며 손바뀜이 나타난 것으로 보인다”고 분석했다.한국거래소에 따르면 7월 3일 기준 138만3484주에 달했던 에코프로 공매도 잔고는 8월 16일 기준 60만2758주로 절반 이상 줄었다. 에코프로비엠 공매도 잔고 역시 같은 기간 461만6507주에서 175만8099주로 줄었다.━한국화장품, 이달 들어 99% 상승2차전지로의 과도한 쏠림 현상이 완화되는 모습을 보이자 시장은 이제 ‘포스트 2차전지’를 찾고 있다. 증권가가 주목하는 종목은 반도체와 중국을 겨냥한 소비주, 자동차 분야 등 그동안 억눌렸던 종목이다.이경민 대신증권 투자전략팀장은 “2차전지주 쏠림현상으로 그동안 다른 종목의 주가가 눌려 전체적으로 시장이 부진했다”며 “그동안 상대적으로 주가가 부진했지만, 실적이나 수급이 견조한 반도체·자동차·기계 등에서 반등을 할 수 있다”고 전망했다.20일 서울 중구 명동의 화장품 매장 모습. [뉴스1]중국을 겨냥한 소비주에 대한 기대감은 엇갈린다. 지난 10일 중국 문화여유부가 한국행 단체관광의 빗장을 푼 뒤 화장품·카지노·호텔 관련 종목이 강하게 반등하는 등 주가 회복에 대한 기대가 커지고 있다.화장품주인 한국화장품은 지난 18일 기준, 이달 초 대비 99.11% 상승했고, 같은 기간 롯데관광개발과 호텔신라 주가는 각각 53.22%, 16.6%씩 상승했다.김주원 기자하지만 과거와 달리 상승 동력은 약할 수 있다는 분석도 나온다. 김학균 센터장은 “국내에서 중국의 수요를 겨냥한 소비주는 중국 부동산 시장에 대한 우려와 별개로 움직이는 시장인 데다 그동안 주가가 많이 억눌려 있어 반등세가 지속할 수 있지만, 2014~15년 당시보다 중국 국내 업체의 산업 경쟁력이 높아진 만큼 한국 소비주가 주도주로 부각되기에 한계가 있다”고 지적했다.최유준 신한투자증권 연구원도 “단체 관광 허용 자체는 긍정적인 재료지만 추석 전후와 중국 국경절 연휴 기간에 실제 어느 정도의 중국 관광객이 국내로 유입되느냐가 (주가에) 관건”이라고 전망했다.━반도체주, 23일 엔비디아 실적이 분수령반도체가 차기 주도주가 될 수 있다는 전망에도 무게가 실리고 있다. 인공지능(AI) 관련 모멘텀이 있는 데다, 기업의 2분기 실적에서 반도체 재고 정점 통과가 확인된 만큼 반도체가 주도주로 올라설 수 있다는 것이다. 분수령은 오는 23일(현지시간) 엔비디아의 실적 발표다.김주원 기자나정환NH투자증권 연구원은 “AI반도체 수요를 가늠할 수 있는 엔비디아의 실적이 23일 발표될 예정”이라며 “엔비디아가 양호한 실적 전망을 발표하면 글로벌 고대역메모리(HBM) 생산의 90%를 맡은 국내 반도체 기업의 실적 개선 기대감이 커질 것”이라고 전망했다.정명지 삼성증권 투자정보팀장도 “최근 이수페타시스와 한미반도체 등AI관련 반도체 소부장 종목이 부상하고 있다”""며 “AI테마가 사이클의 초기인 만큼AI관련 종목이 강세를 띨 가능성이 높다”고 말했다.바이오·헬스 업종의 주도주 부상도 주목할 부분이다. 한지영 키움증권 연구원은 “2차전지주를 둘러싼 ‘포모(FOMO·가격상승에서 소외되는 것에 대한 두려움)현상’이 완전히 사라지지 않은 만큼 향후에도 수급 공방이 전개될 것”이라며 “이 과정에서 이탈한 투자 수요가 바이오 업종으로 옮겨갈지를 지켜봐야 한다”고 말했다."
2023-05-30,"반도체에 꽂힌 외국인, 한국 주식 폭풍쇼핑","올해 외국인 투자자가 코스피 시장에서 12조원 넘는 ‘폭풍 매수’ 행진을 이어가고 있다. 역대 최대 규모다. 외국인의 러브콜은 삼성전자와 현대차, 이른바 ‘전차(電車) 군단’에 집중됐다.29일 한국거래소에 따르면 올 초(1월 2일)부터 이달 26일까지 외국인은 코스피 종목을 12조4991억원어치 순매수했다. 한국거래소에 따르면 1999년 관련 통계를 집계하기 시작한 뒤 가장 많은 순매수 규모다. 같은 기간 직전 최대 규모는 2004년으로 10조1584억원이었다. 외국인이 코스피 시가총액(약 2027조원)에 차지하는 비중은 올 초 30.8%에서 26일 기준, 32.2%로 늘어났다.그래픽=김주원 기자zoom@joongang.co.kr한국거래소에 따르면 올 초부터 26일까지 외국인 자금은 전차군단에 쏠렸다. 외국인 순매수 1위 기업은 삼성전자다. 외국인은 올해 들어 삼성전자를 9조8147억원으로 사들였다. 삼성전자에 이어 현대차가 순매수액 1조2703억원을 기록하며 2위에 올랐다. 뒤를 이어SK하이닉스(1조1146억원), 삼성SDI(9718억원), 기아(5504억원),LG전자(5202억원) 순이었다.외국인 수급에 힘입어 주가는 날개를 달았다. 삼성전자는 지난 26일 기준 연초 이후 27.1% 올라 7만300원에 거래를 마쳤다. 종가기준 지난해 3월 29일(7만200원) 이후 1년 2개월 만에 ‘7만전자’로 복귀했다. 삼성전자뿐 아니라SK하이닉스는 올해 들어 45.6% 뛰었고, 현대차(36.1%), 기아차(47.4%) 등은 연초 이후 30% 넘게 주가가 상승했다.한국 주식 쇼핑에 나선 외국인의 장바구니에 가장 많이 담긴 업종은 반도체였다. 특히 24일(현지시간) 엔비디아의 ‘어닝서프라이즈(깜짝 실적)’ 효과 이후 반도체 기업에 자금이 쏠렸다. 25일과 26일 이틀 동안 외국인은SK하이닉스를 7061억원, 삼성전자를 6169억원어치 사들였다. 엔비디아를 고객사로 둔 이수페타시스 역시 246억원이 몰리며 외국인 순매수 상위 종목 5위에 올랐다.최근 국내 반도체 기업은 세계 언론의 주목을 받고 있다. 중국 정부가 미국 최대 메모리 반도체 기업인 마이크론에 제재를 내린 것과 관련해서다. 미국 정계가 “그 빈자리를 한국이 채우면 안 된다”고 나선 데 이어, 중국 관영 매체는 이 같은 미국의 요구를 한국이 거절해야 한다고 주장했다. 국내 업계는 침묵을 지키며 상황을 예의주시하고 있는 모습이다.중국 관영매체인 글로벌 타임즈는 29일(현지시간) 칼럼을 통해 “한국의 반도체 기업이 중국 시장에서 (마이크론의) 빈자리를 메우는 것은 당연하다”며 “한국은 실용적인 선택을 해야 한다”고 주장했다. 월스트리트저널(WSJ)은 “한국이 불편한 위치에 놓이게 됐다”며 “한국의 반도체 기업은 중국에 대한 노출도가 크기 때문에 미국에서 오는 모든 압박이 고통스러울 것”이라고도 진단했다.삼성전자와SK하이닉스는 “공식 입장은 없다”며 말을 아끼고 있다. 29일 삼성전자 관계자는 “미·중 당국자의 발언과 관련 추이를 유심히 살펴보고 있다”며 조심스러워 했다.전문가는 마이크론의 빈자리가 크지 않을 것으로 보고 있다. 또 메모리 반도체의 특성상 그 빈자리도 자연스럽게 메워질 것이라는 분석이다. 안기현 한국반도체산업협회 전무는 “메모리 반도체는 업체별로 특정한 것이 아니고 똑같은 범용 제품이라 시장에서는 구분 없이 팔릴 수 있기에 한 회사의 빈자리를 채우지 말라 해서 할 수 있는 게 아니다”라며 “현재 다운턴(downturn) 상황과 마이크론의 중국 점유율을 고려할 때 빈 곳도 크지 않을 것”이라고 말했다.장상식 한국무역협회 동향분석실장은 “러시아-우크라이나 전쟁 때문에 러시아로 우회 수출이 늘어나는 것처럼 중국 쪽이 제3국을 거쳐서 한국 기업의 물량을 사가는 수도 있다”고 말했다. 결국 전략적인 침묵을 지키는 게 한국 반도체 업계에는 이득이란 얘기다."
2023-05-29,이런 폭풍 매수 처음…12조 사들인 외국인 장바구니 보니,"올해 외국인투자자가 코스피 시장에서 12조원 넘는 ‘폭풍 매수’ 행진을 이어가고 있다. 역대 최대 규모다. 외국인의 러브콜은 삼성전자와 현대차, 이른바 ‘전차(電車) 군단’에 집중됐다.29일 한국거래소에 따르면 올 초(1월 2일)부터 이달 26일까지 외국인은 코스피 종목을 12조4991억원어치 순매수했다. 한국거래소에 따르면 1999년 관련 통계를 집계하기 시작한 뒤 가장 많은 순매수 규모다. 같은 기간 직전 최대 규모는 2004년으로 10조1584억원이었다. 외국인이 코스피 시가총액(약 2027조원)에 차지하는 비중은 올 초 30.8%에서 26일 기준, 32.2%로 늘어났다.26일 오후 서울 중구 하나은행 딜링룸 전광판에 코스피 지수가 표시돼있다. [연합뉴스]━외인 올해 ‘삼전’9조원 넘게 순매수한국거래소에 따르면 올 초부터 26일까지 외국인 자금은 전기전자와 자동차를 중심으로 한 전차군단에 쏠렸다. 외국인 순매수 1위 기업은 삼성전자다. 외국인은 올해 들어 삼성전자를 9조8147억원으로 사들였다. 삼성전자에 이어 현대차가 순매수액 1조2703억원을 기록하며 2위에 올랐다. 뒤를 이어SK하이닉스(1조1146억원), 삼성SDI(9718억원), 기아(5504억원),LG전자(5202억원) 순이었다.외국인 수급에 힘입어 전차군단 주가는 날개를 달았다. 삼성전자는 지난 26일 기준 연초 이후 27.1% 올라 7만300원에 거래를 마쳤다. 종가기준 지난해 3월 29일(7만200원) 이후 1년 2개월 만에 ‘7만전자’로 복귀했다. 삼성전자뿐 아니라SK하이닉스는 올해 들어 45.6% 뛰었고, 현대차(36.1%), 기아차(47.4%) 등 자동차주는 연초 이후 30% 넘게 주가가 상승했다.반면 외국인은 2차전지 관련 종목은 ‘팔자’에 나섰다. 이달 26일 기준 외국인은 올해 들어 포스코홀딩스(-3조9234억원), 포스코퓨처엠(-4691억원),SK이노베이션(-2960억원) 등 2차전지 관련 기업을 잇따라 순매도했다.한국 주식 쇼핑에 나선 외국인의 장바구니에 가장 많이 담긴 업종은 반도체였다. 특히 24일(현지시간) 엔비디아의 ‘어닝서프라이즈(깜짝 실적)’ 효과 이후 반도체 기업에 자금이 쏠렸다. 25일과 26일 이틀 동안 외국인은SK하이닉스를 7061억원, 삼성전자를 6169억원어치 사들였다. 엔비디아를 고객사로 둔 이수페타시스 역시 246억원이 몰리며 외국인 순매수 상위 종목 5위에 올랐다.김동원KB증권 리서치본부장은 “충분한 반도체 생산능력과 풍부한 현금을 확보한 삼성전자가 반도체 하락 사이클이 끝나면 승자가 될 가능성이 크다”며 “특히 하반기부터 반도체 수급 개선이 예상보다 빨라지면서 외국인의 자금이 몰리고 있다”고 말했다.그래픽=김주원 기자zoom@joongang.co.kr━‘전차군단’ 전망 밝지만, 글로벌 경기 변수외국인 매수세가 이어지면서 ‘전차군단’에 대한 전망도 긍정적이다. 이혁진 삼성증권 연구원은 “반도체는 업황이 바닥을 통과 중인 가운데, 인공지능(AI) 테마와 외국인 수급을 바탕으로 추세적인 주가 상승이 기대된다”며 “특히 글로벌 증시 대장주인 엔비디아의 핵심 밸류 체인이 높은 삼성전자와 하이닉스 등이 수혜를 볼 수 있다”고 전망했다.송선재 하나증권 연구원은 “현대차와 기아의 경우 지난 3년 동안 글로벌 시장 점유율이 지속해서 상승하고, 중ㆍ고가의 중대형 차량 등의 판매가 높아지면서 판매 단가가 오르고 있어 매출에 긍정적”이라며 “여기에 현대차의 우선주 배당수익률이 8~9%에 달하는 등 주주환원 정책도 앞으로 주가에 매력적인 요소로 작용할 것”이라고 말했다.조 바이든 미국 대통령과 케빈 매카시 하원의장(오른쪽)은 국가 채무불이행(디폴트) 시한을 9일 앞둔 지난 27일(현지시간) 연방정부 부채한도 인상 협상에 잠정 합의했다. [AP=연합뉴스]다만, 이들이 대표적인 경기 민감주인만큼 앞으로 글로벌 이슈에 따라 하방 압력이 높아질 수 있다는 우려가 나온다. 김석환 미래에셋증권 연구원은 “현재 글로벌 증시는AI와 관련된 ‘빅테크’기업을 중심으로 쏠림 또는 과열 현상이 일어나고 있다는 점에 유의해야 한다”며 “글로벌 경기의 하방 압력이 높아져 있는 상황에서 미국 부채 한도 협상 후 국채 발행 증가로 미국이 시중의 유동성을 흡수하게 될 경우, 빅테크 기업에는 위험 요인으로 작용할 수 있다”고 조언했다."
2022-09-08,1000대 기업 CEO 이름 중 가장 흔한 이름은? ‘영준’ ‘정훈’ ‘용석’ 순,"1000대 기업CEO성(姓)씨 비중TOP10. 자료 한국CXO연구소국내 1000대 기업 최고경영자(CEO) 가운데 ‘영준’이란 이름을 가진CEO가 가장 많은 것으로 나타났다.기업분석전문 한국CXO연구소는 국내 1000대 기업의 올해 반기보고서에 등재된CEO급 1350명을 대상으로 한 ‘2022년 1000대 기업 대표이사 이름 및 월별 출생 현황 조사’ 결과를 8일 발표했다.조사 결과 국내 1000대 기업에서는 김(金)씨 성을 가진CEO가 270명(20%)으로 가장 많았다. 이어 이(李)씨가 197명(14.6%), 박(朴)씨 88명(6.5%)이었다. 또 정(鄭)씨(73명·5.4%), 최(崔)씨(67명·5%) 조(趙)씨(45명·3.3%), 강(姜)씨(35명·2.6%) 등이 뒤를 이었다.이 같은 결과는 국내 성씨별 인구와 무관치 않다. 2015년 기준 통계청이 발표한 인구총조사 결과에 의하면 김씨 성을 쓰는 국민은 1000만명이 넘어 21.5%로 비중이 가장 컸다. 이어 이씨 14.7%, 박씨 8.4%, 최씨 4.7%, 정씨 4.3%, 강씨 2.4%, 조씨 2.1%, 윤(尹)씨 2.1% 순으로 100만명이 넘었다.1000대 기업 내 동일 이름 최다CEO현황. 자료 한국CXO연구소이름의 중간 글자로는 ‘영’이 들어간CEO가 72명으로 가장 많았다. 한자는 ‘永(길 영)’을 쓰는 경우가 18명으로 가장 많았다. 이어 榮(영화·꽃 영) 15명, 英(꽃부리·뛰어날 영) 13명 순으로 조사됐다. ‘영’자 다음으로는 성(62명), 재(58명), 정(53명), 상(46명), 동(44명), 종(43명) 등의 글자를 가운데 이름에 많이 사용하고 있었다.이름의 마지막에는 ‘호’가 들어간CEO가 61명으로 가장 많았으며, 그중 한자는 ‘浩(넓을 호)’를 쓰는 경우가 16명으로 가장 많았다. 이어 석(57명), 수(55명), 영(46명), 식·환(각 44명), 준(42명), 규(40명) 순으로 파악됐다. ‘鎬(호경 호)’도 15명으로 비교적 많은 편에 속했다.다만 실제 ‘김영호(金永鎬)’라는 한자 이름을 쓰는CEO는 한 명도 없다고CXO연구소는 전했다.성(姓)에 상관없이 가장 많이 사용하고 있는 이름은 ‘영준’이었다.이영준 롯데케미칼 대표이사, 함영준 오뚜기 회장, 탁영준 에스엠 대표이사, 박영준 더네이쳐홀딩스 대표이사, 서영준 이수페타시스 대표이사, 이영준 삼양홀딩스 대표이사, 이영준국보디자인 대표이사 등 1000대 기업 대표이사 중 8명이 ‘영준’이라는 이름을 쓰고 있었다.‘정훈(7명)’,‘용석·승우(각 6명)’,‘재호(5명)’ 등의 이름을 사용하는CEO도 비교적 많은 편에 속했다.1000대 기업CEO성(姓)씨 비중TOP10. 자료 한국CXO연구소조사 대상CEO들이 많이 태어난 달은 1월(150명·11.1%)이었고 8월(134명·9.9%), 3월생(132명·9.8%) 순으로 많았다. 4월생(90명·5.4%)이 가장 적었고 12월생(91명·6.7%)과 6월생(98명·7.3%)도 100명 미만이었다."
2024-12-23,"이수페타시스 유상증자, 금감원 두번째 ‘제동’","정정신고서에 또 정정 요구서울 여의도 금융감독원. 연합뉴스주주들의 거센 반발에도 유상증자를 강행해온 이수페타시스에 대해 금융감독원이 두번째로 증권신고서 정정을 요구하며 제동을 걸었다.금감원은 이수페타시스가 지난 11일 제출한 유상증자 정정신고사를 심사한 뒤 “정정신고서 제출을 요구했다”고 23일 공시했다. 이에 따라 신고서의 효력이 즉각 정지됐다. 이수페타시스는 3개월 이내 정정신고서를 제출하지 않으면 철회한 것으로 간주된다.이수페타시스는 지난 11월8일 발행주식의 32% 이르는 신주를 발행해 기존 주주에 배정하는 5500억원 규모의 유상증자 계획을 발표했다. 이에 주가가 한때 최대 33% 하락하고 주주들의 반발이 이어졌다.금감원은 12월2일 정정보고서 제출을 요구하며 제동을 걸었으나, 회사는 9일 뒤인 11일 정정신고서를 내고 일정만 변경해 유상증자를 그대로 실시한다고 공시했다. 이에 소액주주연대가 임시주주총회 소집을 요구하는 등 반발이 더 거세져왔다."
2024-12-12,"이수페타시스 증자 강행 주가 급락, ‘유증폭탄’ 논란 재점화","금감원 정정신고 요구에 ‘투자위험’ 설명만 고쳐이수페타시스가 금융감독원의 정정신고 요구로 제동이 걸렸던 유상증자를 그대로 실시하기로 했다. 이에 주가가 급락하며 ‘유상증자 폭탄’ 논란이 다시 불붙고 있다.유가증권시장 상장사인 이수페타시스는 11일 정규시장 거래가 끝난 뒤 지난 11월8일 제출한 증권신고서를 정정해 신고했다고 공시했다. 이수페타시스는 정정신고에서 계획한 유상증자와 관련해 ‘투자위험요소’에 대한 설명 내용을 고쳤을 뿐, 발행주식 수 등 핵심 내용은 그대로 유지했다.산업용 인쇄회로기판(PCB) 전문업체인 이수페타시스는 기존주식 6324만여주의 32%에 해당하는 2010만여주의 신주를 발행한다. 애초 5500억원을 조달해 2500억원은 시설자금으로 쓰고, 3천억원은 2차전지용 탄소나노튜브 생산 기업인 제이오 인수에 쓸 계획이었으나, 주가 하락으로 자금조달 규모는 줄 것으로 보인다.유상증자에 참여하지 않으려는 주주들이 주식을 팔면서, 공시 전날인 11월7일 3만3700원이던 주가는 12월2일 2만1100원까지 하락했다. 이에 주주들의 반발이 더 거세졌다. 2일 금융감독원이 ‘정정신고’를 요구하며 제동을 걸자 주가는 3일 2만6750원으로 26.78% 급반등한 바 있다. 그러나 유상증자 고수 의사를 밝히자 12일 13.52% 떨어져 금감원 정정공시 요구 전 주가인 2만1100원으로 되돌아갔다.유상증자에 대한 주주들의 반발은 현대차증권에서도 이어지고 있다. 현대차증권은 지난달 26일 시가총액(공시일 기준)의 72%에 해당하는 2천억원을 주주배정 유상증자로 조달해, 1천억원은 시설자금으로 쓰고, 225억원은 채무상환, 775억원은 기타자금으로 쓰겠다고 공시했다. 공시일 8800원이던 주가는 12일 7550원으로 떨어져 있다.주주들은 ‘대통령실 국민제안’에 “부당한 유상증자를 막아달라”는 민원 신청을 접수하고, 국민권익위원회 국민신문고에 금융감독원을 상대로 릴레이 민원을 제기하는 등 반발하고 있다. 회사 쪽은 “연내에 기업 밸류업 프로그램 공시를 통해 중장기 비전을 제시할 것”이라며 주주들을 달래고 있다."
2024-12-03,"‘유상증자 제동’ 이수페타시스, 개장 동시에 주가 9% 급등","코스피가 소폭 내려 2450대에서 장을 마친 2일 오후 서울 중구 하나은행 본점 딜링룸에서 직원이 업무를 보고 있다. 연합뉴스금융감독원이 정정신고서 제출을 요구해 유상증자에 제동이 걸린 이수페타시스 주가가 3일 9% 넘게 올라 거래를 시작했다.한국거래소에 따르면 이수페타시스는 이날 개장 동시호가에서 전거래일 종가(2만1100원)보다 9.48%(2000원) 오른 2만3100원에 시초가를 형성했다.앞서 2일 금감원은 이 회사가 지난달 18일 제출한 유상증자 증권신고서에 대해 정정신고서 제출을 요구했다. 이에 따라, 이 회사의 유상증자 증권신고서는 수리되지 않은 것으로 간주되고 즉시 효력이 정지됐다.이수페타시스는 지난달 8일 장 마감 후 공시를 통해, 탄소나노튜브(CNT) 제조회사 제이오의 지분 인수자금 마련(2998억원)과 시설자금 마련(2500억원)을 위해 총 5500억원 규모의 유상증자를 결정했다고 발표했다.이에 주가가 급락해 개인투자자들의 반발이 거셌다. 주가는 2일 전거래일보다 5.38%(1200원) 떨어진 2만1100원에 거래를 마칠 때까지. 유상증자 공시 직전 주가(3만1750원)에 견줘 33.5%나 하락했다. 유상증자 공시 전에도 주가가 큰폭으로 떨어져, 선행 매매 의혹도 일었다.3일 주가 급반등은 금감원의 정정신고 요구를 받은 이수페타시스가 유상증자를 철회할 수도 있다는 기대를 반영한 것으로 보인다. 금감원은 11월6일 고려아연이 경영권 방어를 위해 추진하던 대규모 유상증자에 대해 증권신고서(10월30일 제출) 정정을 요구하며 효력을 정지시킨 바 있다. 고려아연은 11월13일 유상증자 계획을 철회했다."
