date,title,content
2023-08-11,급등세 이어가는 ‘유커’ 관련주...상승폭은 줄어,"중국이 자국민의 한국 단체여행을 허용하기로 함에 따라 국내 여행·호텔·면세업계의 기대감이 고조되는 가운데 11일 오전 서울 중구 롯데면세점 명동본점에서 외국인 관광객들이 입장을 위해 대기하고 있다. /연합뉴스중국인의 한국행 단체 관광이 재개된다는 소식에 11일 주식시장에서 화장품과 카지노, 면세점, 항공 등 유커(游客·중국인 관광객) 관련 기업들 주가가 이틀째 상승세를 이어가고 있다. 다만 상승폭이 전날보다 떨어지고 있다.11일 오후 2시 기준 한국화장품은 전날에 이어 상한가를 이어가고 있다. 코리아나(19.39%), 제이준코스메틱(22.54%), 리더스코스메틱(10.16%) 등 화장품주는 전날 상한가에 이어 이날도 급등하고 있다. 역시 10일 상한가였던 마녀공장(7.29%), 토니모리(5.39%), 잇츠한불(9.17%)은 상승세가 전날보다는 줄었다.화장품은 방한 중국인의 쇼핑 목록 1위다. 중국인 관광객의 40%가 20~30대 여성인 만큼, 앞으로 단체 관광이 재개되면 화장품 매출이 급증할 것이란 기대가 이틀 연속 반영되고 있다.중국인들에게 인기가 많은 ‘설화수’ 제조사 아모레퍼시픽 주가는 전날 7.76% 오른 데 이어 이날은 0.69% 올랐고, 브랜드 ‘후’ 제조사LG생활건강도 전날 13.31% 상승했지만 이날은 0.3% 오르며 상승세가 주춤해지고 있다.화장품주 외에 카지노주와 항공주, 소비주는 혼조세를 보이고 있다.제주 드림타워 내 카지노를 운영하는 롯데관광개발이 10일 상한가로 마감했는데 이날은 4.42% 주가가 빠졌다. ‘세븐럭’ 운영사인GKL(그랜드코리아레저)도 10일 20.45% 올랐다가 이날 0.06% 오르고 있고, 파라다이스는 전날 18.13% 오른 데 이어 이날은 1.64% 오르며 소폭 상승세를 이어가고 있다.면세점 매출 비율이 80%를 차지하는 호텔신라 주가는 전날 17.3% 상승한 데 이어 11일 2.3% 오르고 있다. 중국인의 1인당 평균 지출 경비는 외국인 평균보다 높다. 전날 큰 폭으로 뛰었던 현대백화점(1.99%), 글로벌텍스프리(0.11%)가 소폭 상승세를 이어가고 있고, 신세계(-1.18%)는 하락 중이다.대한항공 주가는 1.01% 올랐지만 아시아나항공은 3.2% 떨어지고 있다. 전날엔 아시아나항공(9.42%) 상승세가 대한항공(2.9%)보다 강했었다. 대한항공 계열인 저비용항공사 진에어는 이날 주가가 0.26% 빠지고 있다.여행사 중에는 노랑풍선(9.76%) 상승세가 강하고, 참좋은여행(6.88%)과 모두투어(1.97%)도 전날에 이어 상승 중이다."
2023-08-11,화장품·면세점·항공·여행株 일제히 폭등,"[6년 만에 돌아오는 유커]중국인의 한국행 단체 관광이 재개된다는 소식에 10일 주식시장에서 화장품과 카지노, 면세점, 항공 등 유커(游客·중국인 관광객) 관련 기업들 주가가 일제히 폭등했다. 11종목이 상한가(30% 상승)를 기록했는데 이 중 10개가 화장품 관련주였다. 이날 코스피가 0.14% 떨어지는 등 전체 증시는 하락세였지만, 중국인 관광 테마주만 ‘펄펄’ 난 것이다.이날 한국화장품과 코리아나, 리더스코스메틱, 토니모리, 잇츠한불, 제이준코스메틱, 마녀공장 등 10개 화장품주는 장 초반부터 상한가를 쳤다. 화장품은 방한 중국인의 쇼핑 목록 1위다. 전통적으로 중국인 관광객의 40%가 20~30대 여성인 만큼, 앞으로 단체 관광이 재개되면 화장품 매출이 급증할 것이란 기대가 반영됐다.중국인들에게 인기가 많은 ‘설화수’ 제조사 아모레퍼시픽 주가는 7.76% 올랐고,LG생활건강(브랜드 ‘후’)은 13.31% 상승했다.카지노주도 동반 상승했다. 제주 드림타워 내 카지노를 운영하는 롯데관광개발이 상한가로 장을 마쳤고 ‘세븐럭’ 운영사인GKL(그랜드코리아레저)이 20.45%, 파라다이스가 18.13% 올랐다.면세점 매출 비율이 80%를 차지하는 호텔신라 주가는 17.3% 상승했다. 한국관광공사에 따르면 한국을 방문한 중국인들의 1인당 평균 지출 경비는 1689달러(2019년)로 외국인 평균(1239.2달러)이나 일본인(675달러)보다 훨씬 많다. 그만큼 많은 돈을 쓰고 간다는 것이다. 이런 기대감에 현대백화점(+15.4%), 글로벌텍스프리(+15.59%), 신세계(+9.33%) 등 다른 소비주도 대부분 큰 폭으로 뛰었다.중국인 승객 증가 기대로 대한항공과 아시아나항공 주가는 각각 2.90%, 9.42% 올랐다. 저가 항공사인 에어부산(+12.16%), 티웨이항공(+6.56%), 진에어(+6.74%) 등도 들썩였다. 노랑풍선(+17.4%)과 하나투어(+10%), 모두투어(+6.62%) 등 여행사 주가도 일제히 강세를 보였다.글로벌 명품 업체 주가도 올랐다. 이날 유럽 증시에서 루이비통과 에르메스 등 명품 업체 주가는 1~2%대 상승세를 보였다. 골드만삭스에 따르면, 유럽 명품 판매의 약 25%를 중국 국적 소비자가 차지하고 있다."
2023-04-03,“삼성전자도 깜짝 놀랐네” 20년간 400배 오른 한국 주식 상승킹,"2003년부터 20년 동안의 한국 주식 상승률 분석40000% 대박 성과도 있지만 쪽박찬 경우도 수두룩[왕개미연구소]지난 달 29일 ‘20년 전에 사둔 100g 골드바, 지금 내다 팔았더니…'란 기사가 나가자, 한 독자가 기자에게 이메일을 보내왔다. 국내 증시에선 어떤 주식이 ‘20년 세월의 힘’을 느끼게 해줬는지 궁금하다는 질문이었다. 과연 어떤 종목이 20년 동안 기다린 보람을 느끼게 해줬을까.조선일보 [왕개미연구소]는 지난 1일NH투자증권에 의뢰해 2003년 3월 말 코스피·코스닥 상장사에 20년 초장기 투자를 했다고 가정하고 개별 주식의 성과를 분석해 봤다. 주가 상승률뿐만 아니라, 매년 받는 배당 수익까지 고려한 총수익을 기준으로 삼았다.그랬더니 포스코퓨처엠(옛 포스코케미칼), 미원상사, 엘앤에프, 다우데이타, 한솔케미칼, 금양 등 6개 기업이 지난 20년간 10000%가 넘는 수익률을 기록해 ‘100배주(株)’로 뽑혔다. 100배주는 전세계 모든 개인 투자자들의 로망으로, 100배주를 잡으면 목돈 100만원이 1억원 넘는 돈으로 불어난다. 미국에선 투자자가 100배 수익률을 낸 주식을 ‘헌드레드배거(100Baggers)’라고 부른다./일러스트=조선디자인랩 이연주하지만 모든 종목이 화려한 20년의 세월을 보낸 건 아니었다. 유가증권 시장의 경우, 146개 기업의 20년 투자 성적표는 코스피지수 상승률(206%)에도 못 미쳐 신통치 않았다. 특히 54개 기업은 20년 장기 수익률이 아예 마이너스(-)였다. 제이준코스메틱, 쎌마테라퓨틱스, 남광토건, 아센디오 등 4개 기업은 마이너스(-)100%로 사실상 원금이 다 날아갔는데, 무상감자 등이 이유인 것으로 보인다.우리나라 국민 500만명이 투자하고 있는 국민주(株) 삼성전자는 20년간 1250% 상승해 107위에 올랐다. 코스피 기준 상위 20%로, 고등학교 내신등급으로 환산하면 3등급(전체 9등급)이다.증시 전문가들은 지난 20년 동안의 한국 증시 성적표에 대해 어떤 의견을 줄까. 주식시장 상승과 하락을 다 겪으며 잔뼈가 굵은 고수 5명에게 소감을 들어봤다(이름 가나다 순).1️⃣백지윤 블래쉬자산운용 대표지난 20년간 상승률 상위종목 다수는 2차전지(포스코퓨처엠), 인터넷(네이버), 모바일게임(엔씨소프트) 등 시대의 큰 흐름을 읽고 그 분야에 회사의 역량을 집중해서 기업 가치를 극대화시킨 회사들이다. 한때 시가총액 상위권을 차지했지만 무리한 투자를 하거나 메가 트렌드를 제대로 읽지 못해 도태된 회사들도 보인다.2000년 이후 한국 주식시장은 1998년부터 2000년까지IT붐, 2000년 중반 차화정(자동차·화학·정유), 해운·조선주 열풍, 2014년 이후 모바일게임·바이오 주도장, 그리고 최근까지 이어지고 있는 2차전지 테마가 큰 흐름이었다고 볼 수 있다. 이런 큰 흐름 중에 하나만이라도 제대로 투자했다면 큰 부자가 될 수 있었다. 과거 20년 동안 그랬던 것처럼, ‘넥스트20년’에도 주식시장에 큰 흐름들이 여러 번 나올 것으로 보인다.한류가 확산되면서 에스엠,JYP등 엔터테인먼트 회사들이 글로벌 기업으로 도약하고 이 과정에서 주가도 많이 올랐는데, 한국 가수들의 인기를 소수 문화쯤으로 보고 크게 투자하지 않은 건 (개인적으로) 아쉽다.2️⃣심영철 웰시안닷컴 대표영화 <백투더퓨쳐>와 드라마 <재벌집막내아들>에서처럼 미래의 시세표를 알면 얼마나 좋을까 싶다. 멀리도 필요 없고, 당장 내일 상한가 종목만 알아도 준재벌이 될 수 있을 것이다.단기적인 주가 전망은 어렵지만 장기 트렌드는 조금만 공부해도 알 수 있다. 가령 요즘 시장에서 핫한 2차전지 테마는 몇 년 전부터 다 알고 있었던 것이다. 단기 급등 종목 찾기에 급급한 바람에 큰 흐름을 놓치지 말아야 한다.지난 20년 동안 큰 수익이 난 주식도 있지만 오히려 손해인 종목도 적지 않았다. 가령 90년대에 한국전력은 현재의 삼성전자처럼 한국 주식시장에서 변수가 아닌 상수였다. 시가총액이 전체의 20% 이상을 차지했던 한전이 시총 1등 자리를 놓칠 것이라곤 상상도 못했다. 주가도 강산처럼 10년이면 바뀌는 만큼, 장기 트렌드를 예측한 후 3-5개 테마의 종목에 분산해 투자하는 것이 개인 투자자들에겐 최선이다.3️⃣이건규 르네상스자산운용 대표높은 수익률을 보인 기업들의 특징은 신규 사업으로 화려한 변신에 성공한 업체들이었다. 특히 2차전지 소재, 반도체 소재 사업에서 성과를 나타낸 업체들이 상위권을 휩쓸었다.신약가치를 인정 받은 바이오 회사인 한올바이오파마, 불닭볶음면이라는 메가 히트 상품을 내놓은 삼양식품, 구조적인 성장을 보인NAVER,손해보험사, 기업체질 개선이 있었던 현대미포조선,SK하이닉스, 주주환원 정책에 앞섰던 영풍제지 등도 눈에 띈다.다소 의아스럽게 느껴지는 주식은 도시가스와 방직회사들이다. 산업이나 실적에 특별한 변화는 없었는데도 최근 2~3년새 주가가 급등하는 모습을 보였다. 시가총액이 낮으면서 거래량이 작은 주식들이어서 수급에 따른 이상 급등(작전)이라고 밖에는 설명하기 어렵다.주가가 큰폭으로 상승하기 위해서는 성장에 대한 확실한 기대감이 있어야 한다. 성장성이 높은 사업 분야에서 성과를 거둔 업체일수록 높은 상승세를 나타냈다. 2차전지에 대해서는 밸류에이션(기업가치) 논란이 있지만 최근 몇 년 사이 이 보다 높은 성장성을 나타낸 사업은 없었다는 점에서 높은 점수를 줄만하다.4️⃣이명열 한화생명 T&D팀 투자전문가대한민국 경제를 대표하는 대형 우량주들이 많이 올랐을 것 같은데, 의외의 종목들이 상위권에 포진해있어 놀랐다. 아무래도 최근 2차전지 관련주가 급등하다 보니, 포스코퓨처엠이나 한솔케미칼 등의 선전이 눈에 띈다.NAVER는 우리나라 국민 중에 안 쓰는 사람이 없고 오프라인에서 온라인으로 삶의 방식을 바꾼 기업인데, 앞으로도 이렇게 혁신을 가져오는 주식에 장기 투자하면 큰 수익을 낼 것이다. 최근 많은 사람들이 인공지능(AI) 테마에 주목하는 것도 이런 이유 때문이다.그런데 20년간 누적 수익률이 수천 퍼센트에서 수만 퍼센트에 달하지만, 이런 수익률을 실제로 실현한 개인 투자자는 매우 드물 것이다. 수십 퍼센트만 올라도 차익실현 유혹에 시달리고, 손실이 나면 버티기도 어럽기 때문이다.재무구조가 양호하고 매출과 순익 성장을 꾸준히 달성한 기업은 장기 투자하면 결국 수익이 난다는 사실도 확인할 수 있다. 반면 실적 향상이 뒷받침되지 않고 폭등한 테마주는 언제 폭락해도 이상하지 않으니 추격 매수는 자제해야 한다.세계적인 투자자 워런 버핏은 우량주에 장기 투자하는 것으로 유명하다. 지난 2월 버핏의 주주 서한에 따르면, 1965년 이후 작년까지 버크셔 해서웨이 주가는 연평균 19.8% 올랐다. 같은 기간 S&P500 수익률(9.9%)보다 두배 더 높았다./조선DB5️⃣편득현NH투자증권WM마스터즈 전문위원지난 20년간 한국 증시에서 가장 많이 오른 종목은 포스코퓨처엠이었다. 포스코그룹의 2차전지 소재 전문회사로, 리튬이온 배터리에 필요한 양극재와 음극재를 동시에 생산하고 있다. 지난 2003년 3월 말 주가가 674원(수정주가)이었고 지금은 26만1500원(올해 3월 말)이니까 주가만 보면 386배 올랐다. 배당금(3466원)까지 합치면 392배가 올랐다.다만 포스코퓨처엠 주가가 가장 많이 오른 시기는 최근 7년이다. 그런데 타임머신을 타고 7년 전으로 돌아간다고 해도 이 회사 주주가 될 수 있었을까. 쉽지 않아 보인다.지난 2016년 말 당시 포스코퓨처엠 시총은 7088억원이고 영업이익은 853억원으로, 주가는 적당한 수준이었다. 그런데 이듬해 영업이익은 불과 200억원도 늘지 않았는데, 주가는 3배가 뛰었다. 2018년부터 2020년까지 3년간 영업이익은 감소해서 600억원까지 줄어드는데, 시총은 2조원에서 8조원까지 오르는 미스터리가 발생했다.이후 2022년까지 이익은 1658억으로 2016년 대비 2배 올랐는데 주가는 20배 급등했다. 결론적으로 대다수 투자자들은 2016년으로 돌아가도 이 주식을 사는 결정을 내리기는 쉽지 않았을 것이다.한편, 20년 수익률 기준으로 상위권에 속한 기업들은 대부분 중소형주였다. 대형주는 외국인 투자자를 중심으로 밸류에이션(가치평가)이라는 엄격한 잣대가 작동해서 주가 상승에 제동이 걸린다. 하지만 중소형주는 그런 기준에서 상대적으로 자유로운 편이다."
2023-03-02,"궁지에 몰린 쌍방울 김성태, 계열사 매각 추진","검찰수사로 자금사정 어려워지자 검토‘불법 대북 송금’ 등으로 검찰 수사를 받게 돼 궁지에 몰린 김성태 전 쌍방울 회장이 핵심 계열사 매각을 검토 중인 것으로 1일 전해졌다. 김 전 회장은 쌍방울이 작년 5월부터 수사를 받는 와중에 해외 도피 생활을 하다가 지난 1월 국내로 압송됐다. 쌍방울은 검찰 수사 등으로 인해 신용 하락 등 기업 사정이 악화된 상태라고 한다.김 전 회장은 불법 대북 송금과 횡령·배임, 뇌물 공여 등의 혐의로 구속 기소돼 수원구치소에 수감돼 있다. 업계에 따르면, 김 전 회장은 면회 온 회사 임원들에게 계열사 매각 검토 방안을 보고 받은 것으로 전해졌다. 쌍방울 임원이 보고한 매각 대상 계열사에는 한 코스피(KOSPI) 상장 기업도 포함된 것으로 알려졌다. 김 전 회장은 매각 추진 계획을 보고한 임원에게 “회사 운영을 잘 부탁한다”고 했다는 말도 쌍방울 주변에서 흘러나왔다.쌍방울그룹은 광림(특수 장비 자동차 제조사), 쌍방울(속옷 업체), 비비안(속옷 업체),SBW생명과학(바이오 업체), 제이준코스메틱(화장품 업체), 디모아(소프트웨어 공급업체), 아이오케이(연예기획사), 미래산업 등 상장사 8곳을 거느리고 있다. 쌍방울 순환 출자의 정점에 있으며 김 전 회장이 가장 아끼는 계열사로 알려진 광림도 최근 한국거래소에서 거래 정지 처분을 받았다.법조인들은 “무자본 인수·합병으로 기업 몸집을 불려온 김 전 회장이 검찰 수사로 어려움을 맞게 된 것”이라고 했다"
2023-01-25,“마스크 벗는다” 메이크업 쇼 잇따라… 들썩이는 유통업계,"정부가 오는 30일부터 실내 마스크 착용 의무를 해제한다고 발표하면서 백화점과 화장품 업체들이 각종 시연 행사를 열고 고객을 맞기 위한 준비에 나섰다. 화장품 업체들은 코로나 기간엔 메이크업 제품을 입술이나 손등에 직접 발라보는 시연 행사를 자제해왔다. 화장품 업체들 주가도 ‘노 마스크’에 대한 기대감으로 상승세를 타고 있다.롯데백화점은 오는 29일까지 서울 남대문로 본점 지하 1층 광장에서 프랑스 화장품 ‘입생로랑 뷰티’의 신제품 ‘뉴 벨벳 틴트’를 소개하는 임시 매장을 연다고 밝혔다. 실내에서도 마스크를 벗게 되면 립스틱 같은 색조 화장품 판매가 증가할 것으로 보고 행사를 여는 것이다. 메이크업 쇼 외에 제품에 고객 이름을 새겨주는 서비스도 하고, 립스틱을 바른 뒤 사진을 찍을 수 있는 포토 부스도 들여놓는다. 잠실점도 이달 말까지 에스티로더·랑콤·겔랑·지방시뷰티·샬롯틸버리 매장에서 피부 진단과 색조 메이크업을 받을 수 있는 서비스를 진행한다.현대백화점은 오는 30일까지 서울 여의도 더현대서울 1층에서 일본 시세이도의 색조 브랜드 ‘나스(Nars)’의 메이크업 쇼를 진행한다. 다음 달 9~12일엔 같은 장소에서 프랑스 화장품 브랜드 ‘디올 뷰티’의 색조 화장품 신상품을 체험할 수 있는 임시 매장을 연다.화장품 업체 주가도 강세다. 아모레퍼시픽 주가는 지난 19일 2.4% 넘게 오른 데 이어 20일에도 1500원(1.02%)이 오르며 14만8500원을 기록했다. 제이준코스메틱은 20일 8850원으로 지난 18일보다 26.42%나 올랐고, 화장품 제조업체 코스나인도 20일 961원을 기록하며 18일보다 11.74%가 올랐다."
2024-06-03,지난달 거꾸로 간 국내 증시…종목 13.4%가 ‘52주 신저가’,"━잔인했던 5월 증시지난달 국내 증시 부진으로 1년 새 가장 낮은 주가를 기록한 ‘52주 신저가’ 종목이 속출했다. 2일 한국거래소에 따르면 지난달 중에 52주 신저가를 기록한 종목은 360개로 집계됐다. 코스피(953개)와 코스닥(1732개) 상장 종목 2685개 중 13.4%에 이른다. 지난달에 52주 신저가를 찍은 코스피 종목은 99개, 코스닥 종목은 261개였다.전기차 시장의 ‘캐즘(Chasm·일시적 수요 둔화)’ 여파로 2차전지 관련 종목이 줄줄이 신저가를 기록했다. 코스피 시장에서는 2차전지 ‘대장주’로 꼽히는 시가총액 3위LG에너지솔루션이 지난달 30일 장중 32만6000원으로 52주 신저가를 기록했다. 같은 날LG화학도 35만원으로 신저가를 썼다. 신용평가사인 S&P글로벌이 두 회사의 신용등급 전망을 ‘안정적’에서 ‘부정적’으로 하향 조정한 영향을 받았다. 코스닥 시가총액 1·2위인 2차전지 종목 에코프로비엠과 에코프로도 지난달 31일 각각 18만1500원, 8만8400원으로 52주 신저가를 나타냈다.이밖에 코스피에서는SK바이오사이언스·일동제약·하나제약 등 제약 업종과 현대제철·NI스틸 등 철강업에서 지난달 52주 신저가를 찍은 종목이 여럿 나왔다. ‘라인 야후 사태’ 여파 속에NAVER도 지난달 31일 17만원을 나타내며 52주 신저가를 나타냈다.이경민 대신증권 연구원은 “채권 금리 상승 여파에 2차 전지, 인터넷 업종 등을 중심으로 낮은 수익률이 나타났다”고 설명했다. 지난 한 달간 코스피는 2.06%, 코스닥지수는 3.33% 각각 하락했다.반면 양호한 주가 흐름을 보인 종목도 적지 않았다. 지난달 중에 52주 신고가를 기록한 종목은 총 274개(10.2%)였다. 화장품 및 음식료 관련 종목의 상승세가 두드러졌다.화장품 대장주 아모레퍼시픽은 지난달 31일 장중 20만500원까지 오르며 52주 신고가를 썼다. 제이준코스메틱·코스맥스·토니모리·한국콜마·한국화장품제조 와 같은 화장품 관련 주도 지난달에 52주 신고가를 갈아치웠다. 음식료 업종 중에선 삼양식품이 ‘불닭 열풍’에 힘입어 지난달 20일 장중 52주 신고가인 57만9000원을 기록했다. 한 달 새 주가는 20만원대에서 50만원대로 급등했다. 빙그레·오뚜기·풀무원·해태제과식품·동원F&B·CJ씨푸드도 52주 신고가를 새로 썼다. 대형주 중에선SK하이닉스와 현대차가 지난달에 52주 신고가를 경신했다.김영환NH투자증권 연구원은 “미국 빅테크 기업의 낙관적 실적 전망과 함께 한국의 수출 호조는 향후 주가에 긍정적인 영향을 끼칠 수 있다”며 “반면 미국 통화정책 불확실성은 변수가 될 수 있다”고 진단했다."
2024-06-02,5월 국내 증시 부진에…상장 종목중 13% '52주 신저가',"지난달 국내 증시 부진으로 1년 새 가장 낮은 주가를 기록한 ‘52주 신저가’ 종목이 속출했다.진나달 31일 코스피는 1.08포인트(0.04%) 오른 2636.52로 장을 마쳤다. 코스닥은 7.99포인트(0.96%) 오른 839.98이었다. 지난 한달간 코스피는 2.06%, 코스닥은 3.33% 각각 떨어졌다. 사진은 서울 중구 하나은행 본점 딜링룸 모습. 연합뉴스2일 한국거래소에 따르면 지난달 중에 52주 신저가를 기록한 종목은 360개로 집계됐다. 코스피(953개)와 코스닥(1732개) 상장 종목 2685개 중 13.4%에 이른다. 지난달에 52주 신저가를 찍은 코스피 종목은 99개, 코스닥 종목은 261개였다.전기차 시장의 ‘캐즘(Chasm‧일시적 수요 둔화)’ 여파로 2차전지 관련 종목이 줄줄이 신저가를 기록했다. 유가증권시장에서는 2차전지 ‘대장주’로 꼽히는 시가총액 3위LG에너지솔루션이 지난달 30일 장중 32만6000원으로 52주 신저가를 기록했다. 같은 날LG화학도 35만원으로 신저가를 썼다. 신용평가사인 S&P글로벌이 두 회사의 신용등급 전망을 ‘안정적’에서 ‘부정적’으로 하향 조정한 영향을 받았다. 코스닥 시가총액 1·2위인 2차전지 종목 에코프로비엠과 에코프로도 지난달 31일 각각 18만1500원, 8만8400원으로 52주 신저가를 나타냈다.이밖에 코스피에서는SK바이오사이언스·일동제약·하나제약 등 제약 업종과 현대제철·NI스틸 등 철강업에서 지난달 52주 신저가를 찍은 종목이 여럿 나왔다. ‘라인 야후 사태’ 여파 속에NAVER도 지난달 31일 17만원을 나타내며 52주 신저가를 나타냈다.이경민 대신증권 연구원은 “채권 금리 상승 여파에 2차 전지, 인터넷 업종 등을 중심으로 낮은 수익률이 나타났다.”라고 설명했다. 지난 한 달간 코스피는 2.06%, 코스닥지수는 3.33% 각각 하락했다.반면 양호한 주가 흐름을 보인 종목도 적지 않았다. 지난달 중에 52주 신고가를 기록한 종목은 총 274개(10.2%)였다. 화장품 및 음식료 관련 종목의 상승세가 두드러졌다.화장품 대장주 아모레퍼시픽은 지난달 31일 장중 20만500원까지 오르며 52주 신고가를 썼다. 제이준코스메틱·코스맥스·토니모리·한국콜마·한국화장품제조 와 같은 화장품 관련주도 지난달에 52주 신고가를 갈아치웠다. 음식료 업종 중에선 삼양식품이 ‘불닭 열풍’에 힘입어 지난달 20일 장중 52주 신고가인 57만9000원을 기록했다. 한 달 새 주가는 20만원대에서 50만원대로 급등했다. 빙그레·오뚜기·풀무원·해태제과식품·동원F&B·CJ씨푸드도 52주 신고가를 새로 썼다. 대형주 중에선SK하이닉스와 현대차가 지난달에 52주 신고가를 경신했다.김영환NH투자증권 연구원은 “미국 빅테크 기업의 낙관적 실적 전망과 함께 한국의 수출 호조는 향후 주가에 긍정적인 영향을 끼칠 수 있다”라며 “반면 미국 통화정책 불확실성은 변수가 될 수 있다”라고 진단했다."
