date,title,content
2023-03-27,"""머스크 와도 장관 못한다""…18년째 3000만원, 낡은 백지신탁","윤석열 대통령이 지난달 21일 서울 용산 대통령실 청사에서 열린 '꿈과 도전의 뉴스페이스 시대, 우주경제 개척자와의 대화'에서 발언하고 있다.   윤 대통령은 우주항공청 설립을 핵심과제로 삼고 있다. 연합뉴스노무현 정부 때인 2005년 도입된 백지신탁제도는 지난 18년 동안 고위공직자의 이해상충 문제를 막는 대표적 장치였지만 낡은 규정 때문에 역효과가 적지 않다.대표적인 사례가 윤석열 대통령이 추진하는 우주항공청 설립을 두고 벌어진 ‘백지신탁 예외’ 논란이다. 지난 15일 서울 강남구 과학기술컨벤션센터에서 열린 ‘우주항공청 설치 및 운영에 관한 특별법’ 제정 공청회에서는 “이해충돌 직무 관여 금지를 전제로 백지신탁 적용의 예외를 둔다”는 조항에 대한 질문이 이어졌다. 공직자가 항공 주식을 보유하는 것이 이해상충 아니냐는 논리였다.그러자 정부 측은 “100% 주식 보유를 허용하는 게 아니라 신고 의무 등을 둬 예외적으로 허용하는 것”이라고 설명했다. 민간 전문가를 영입하기 위해서는 이들의 보유 주식이 무조건적인 걸림돌이 되어서는 안 된다는 취지였다.그래픽=김경진 기자capkim@joongang.co.kr이런 상황은 정권마다 반복되고 있다. 문재인 정부 말인 2021년 5월 인사청문회 정국에서 윤건영 더불어민주당 의원은 “우리나라에 일론 머스크 테슬라 최고경영자, 빌 게이츠 마이크로소프트 창업자 같은 분이 계신다고 해도 그분들을 장관으로 쓸 수 없다”며 “주식을 다 팔아야 하기 때문”이라고 지적했다.━①처분 위주의 제도…신산업 분야에선 인재 발탁 장애물백지신탁은 고위공직자 본인과 직계 존·비속이 총 3000만원을 초과하는 주식을 보유할 경우, 직무관련성이 있으면 임명 후 2개월 안에 이를 백지신탁하거나 매각하도록 한 제도다. 이의가 있으면 인사혁신처 주식백지신탁심사위원회(이하 심사위)의 심사를 받아 예외를 인정받으면 된다. 하지만 예외 인정을 못 받으면 백지신탁·매각 중 하나를 택하는 구조다.지영미 질병관리청장이 22일 충북 청주시 흥덕구 오송읍 질병관리청에서 코로나 19 대응관련 브리핑을 하고 있다. 뉴스124일 공개된 3월 수시 공직자 재산공개에서 지영미 질병관리청장 본인과 배우자의 보유주식은 ‘0주’였다. 지 청장 배우자는 삼성바이오로직스(20주),SK바이오사이언스(30주), 에이비엘바이오(100주) 등 바이오 주식을 갖고 있었지만, 지난해 12월 지 청장이 임명되자 직무관련성 심사도 신청하지 않고 모두 팔았다. 전임자인 백경란 전 청장이 취임 이후에도 “심사 중”이라는 이유로 바이오 주식 수천만원어치를 보유해 논란을 일으킨 것을 의식했다는 말이 나온다. 윤태범 방송통신대 교수(행정학)는 “보유 주식이 직무와 관련성이 있는지는 당사자가 가장 잘 안다”며 “직무관련성 심사를 거치기 전에 자발적으로 처분하는 것이 이해상충을 피하는 방법일 수 있다”고 말했다.하지만 신산업 관련 민간 전문가에게서는 이런 사례가 나오기 어렵다는 지적이 많다. 이들이 창업 등의 이유로 관련 업체의 주요 주주인 사례가 많기 때문이다. 특히 백지신탁을 한다고 해도 “수탁 금융회사는 60일 이내에 수탁받은 주식을 처분한다”(공직자윤리법 14조의4)는 규정 때문에 주요 주주 자리를 잃을 가능성이 크다. 백지신탁을 하면 수탁 금융회사가 장내 매도나 블록딜(시간 외 대량매매) 방식으로 이를 매각하는 구조다. 박근혜 정부 시절인 2013년 코스닥 상장기업인 주성엔지니어링의 황철주 대표가 중소기업청장에 내정됐다가 사흘 만에 “회사와 주주를 버리고 청장을 택할 수 없다”며 사퇴한 것도 공직에 오르기 위해서는 기업 자체를 포기해야하는 상황이었기 때문이다.그래픽=김경진 기자capkim@joongang.co.kr익명을 원한 금융부처 고위인사는 “백지신탁을 맡겨도 수탁사가 60일 이내에 매각을 해야하기 때문에 공직자 입장에서는 ‘백지매각제도’에 가깝다”며 “재산권에 대한 침해일 수 있다”고 지적했다.그래서 일부 고위공직자는 재산권 침해를 이유로 백지신탁 결정에 불복하기도 한다. 오세훈 서울시장은 지난해 본인과 배우자가 보유한 8억원대 바이오 주식을 처분하라는 심사위 결정에 “고위공직자가 된다고 해서 재산상 손해를 감수해야 하는 것은 아니라고 생각한다”며 국민권익위원회에 행정심판을 청구해 기각이 되어서야 전량 매각했다. 차관급인 유병호 감사원 사무총장과 박성근 국무총리 비서실장은 배우자가 소유한 기업 주식을 백지신탁하라는 심사위 판단에 불복해 각각 행정소송과 행정심판을 제기한 상태다.━②18년 된 ‘3000만원’ 하한선…‘해외주식 미포함’도 문제2005년 법 제정 당시 정한 하한선 ‘3000만원 초과’ 기준이 18년째 유지되는 것도 현실성에 맞지 않는다는 지적이 나온다. 이는 한국에서 1인당 주식투자액 7245만원(예탁결제원·2020년 12월 기준)의 절반에 못 미친다. 2005년 당시 코스피 지수(연말 종가)는 1379.37이었지만 지난해 연말 종가는 2236.40으로 2배 가까이 증가한 점을 고려해야 한다는 목소리도 있다. 2005년 당시에도 은행연합회 등 민간에서는 하한선을 1억원으로 잡았었다.인사혁신처는 2021년 한국인사행정학회에 의뢰한 『이해충돌방지를 위한 백지신탁제도 운영 개선 방안』 연구용역 보고서를 통해 “각종 자산가격이 급등한 현 시점에는 하한선을 5000만원으로 올리는 것이 적합하다”고 지적했다.2013년 3월 황철주 중소기업청장 후보자가 경기 광주 오포읍 주성엔지니어링 본사에서 후보자 사퇴 의사를 밝히고 있다. 연합뉴스반면에 공직자 윤리성 강화를 위해 보완해야 할 점도 여럿 지적된다. 대표적 사례가 2005년 법 제정 당시부터 이어져 온 ‘해외주식 예외’ 규정이다. 이에따라 애플, 알리바바, 아마존 등의 해외주식을 3000만원 넘게 보유해도 백지신탁 대상이 아니다.하지만 고위공직자가 해외기업과 영향을 주고받는 경우가 있어 제도보완이 필요하다는 목소리도 있다. 2020년 김종갑 당시 한국전력 사장은 글로벌기업 지멘스의 주식 7339주(약 11억원)를 보유했는데 김 사장 취임 후 지멘스는 한전에서 3건(약 60억원)의 일감을 수주해 논란을 빚었다.━③늘어지는 적격심사 탓에 이해상충 논란 야기일각에서는 백지신탁심사위원회의 ‘느림보’ 심사가 이해상충 문제를 더 키운다는 지적도 있다. 현행 공직자윤리법은 “심사위는 1개월 이내에 직무관련성 여부를 청구인에게 통지하고, 필요하면 1개월 더 연장한다”고 규정했지만 실제론 3~4개월까지 심사가 늘어지는 경우가 허다하다.경제정의실천시민연합(경실련) 회원들이 지난 1월 26일 오전 서울 종로구 경실련에서 윤석열 정부의 장·차관 주식백지신탁 의무 이행 실태에 대해 발표하고 있다. 연합뉴스백지신탁을 했던 국회의원실의 한 관계자는 “심사 기간이 길어지다보면 고위공직자가 취임한 뒤 몇달 동안 관련 주식을 보유하기 돼 이해상충 문제가 저절로 생기게 된다”고 지적했다.차진아 고려대 법학전문대학원 교수는 “백지신탁 제도는 인재발탁 측면에서는 아쉬운 부분이 있다”며 “다만 국민정서상 필요하다는 여론이 많기 때문에 제도적 보완이 필요하다”고 말했다."
2022-12-14,[사랑방] 차순도 外,◆차순도 계명대 석좌교수가 13일 한국보건산업진흥원장으로 임명됐다.◆황철주 주성엔지니어링 대표이사가 13일 한국발명진흥회장으로 취임했다.◆KT&G가 지난 12일 고용노동부 주관 ‘2022 일자리창출 유공 정부포상’ 수여식에서 대통령 표창을 수상했다.
2022-06-30,"수원대 ""반도체 실무인력 양성 산실되겠다""","수원대는 국내 대학이나 연구소에서 반도체 공정에 대한 인식이 거의 없던 22년 전부터 정부와 경기도, 수원대학교로부터 약 70억 원의 지원을 받아 약 40종의 반도체공정 장비와 측정분석 장비를 갖춘 반도체 공정 팹을 구축해 운영하고 있다.수원, 화성, 용인, 오산 등에 자리한 국내 반도체 관련 기업들과 근접한 학교의 지역적 특성과 미래 인재 양성을 위한 대학 차원의 지속적인 지원 아래 기업과 연계한 반도체 관련 소자, 박막형 전자부품, 반도체 소재에 관한 연구개발, 생산, 분석업무를 진행해 오고 있으며 최근에는 반도체소재 국산화 추진에 따라LG디스플레이,SK이노베이션, 삼성SDI,듀폰코리아, 동진세미켐 등으로부터 소재 분석 업무도 활발하게 이뤄져 오고 있다.특히 기업 및 연구소, 국내외 대학생들을 대상으로 수원대 반도체 공정 팹을 이용하는 반도체 공정 실무교육의 경우 전기, 전자, 전자재료공학 분야별 이론교육과 공정 실습이 꾸준하게 실시되어 오고 있으며 그 과정에서 본교 재학생은 물론 협력 대학인 중국 산동대학생들을 대상으로 한 교육 및 청년취업아카데미, 경기도 취업브리지인력양성 사업 등 다양한 반도체 인력 양성프로그램이 수행된 바 있다.최근 급격하게 늘어나는 반도체 공정교육 수요에 대응해 5년 전부터는 전국의 대학생으로 대상을 확대하여 교내 교육 포함 매년 10회 이상 교육을 지속적으로 실시함으로서 국내 반도체 산업 실무인력 양성을 위한 대학의 역할을 꾸준하게 감당해 오고 있다. (최근 5년간 반도체공정 실무교육 실적 : 교내 약 400명, 교외 780명, 총 1,180명)각 전공 학과에서 학습한 반도체와 물성, 소자에 대한 핵심 기초 지식을 기반으로 반도체 공정 실습을 통한 실무교육을 경험한 학생들은, 삼성전자,SK하이닉스,DB하이텍을 비롯하여AMK,ASML,TEL,주성엔지니어링, 원익QnC,후공정 기업인Amkor,ASE,STATSChipPAC등 국내외 기업 반도체 공정, 필드, 장비,CS,개발 엔지니어로 훌륭하게 자리매김하고 있다.2022년부터는 2,3,4 학년 재학생을 대상으로 하는 ’시스템반도체 융합과정’을 개설해 자기 전공에 관계없이 반도체 관련 교육을 받을 수 있게 하고 있다. 이 과정의 주요한 특징은 본교에 설치된 생산라인을 이용해 철저한 실습 위주의 교육을 지향한다는 것이다. 또한 이 과정의 많은 부분을 실제 현업에 종사하는 인력이 맡음으로써 현장 위주의 교육을 실시하고 있다.2023년부터는 이제까지의 경험을 확대해 전기·전자 관련 졸업생을 대상으로 마이크로 학위과정을 운영할 계획을 세우고 있다. 이 과정은 이론교육과 관련 기업 실무 인턴교육으로 구성되는 과정으로 수료자는 관련 기업에 취업할 기회를 가지게 된다.앞으로도 수원대학교는 20여 년의 역사를 통해 축적해온 반도체 관련 인프라와 실무 교육 역량을 기반으로, 국가와 기업이 필요로 하는 전문화된 반도체 인력양성에 노력할 예정이다."
2024-12-16,“졸업생 3000명 이상 대학 중 취업률 4위…안주하지 않겠다”,"김웅희 인하대 대외부총장 인터뷰부총장 재직 이전에 인하인재개발원장을 역임한 바 있는 김웅희 대외부총장(오른쪽)은 지금도 취업 및 창업 특강을 몸소 챙기며 진두지휘하는 것으로 유명하다. 인하대 제공“학생들이 졸업 후 자신의 꿈과 진로를 향해 나아갈 수 있도록 최선을 다하겠습니다.”김웅희 인하대 대외부총장은 학생들의 더 나은 미래를 위한 지원이 대학의 가장 중요한 역할이라며 이렇게 말했다. 대학이 연구·교육과 함께 학생들의 진로와 취업 활동에 적극적으로 도움을 줄 수 있어야 한다는 것이다.실제 인하대는 대학일자리플러스센터, 현장실습지원센터,IPP(기업연계형 장기현장실습), 듀얼공동훈련센터 등을 통해 현장실습, 취업·진로 상담 등 다양한 학생 맞춤형 취업·진로 프로그램을 운영하고 있다. 특히, 대학일자리센터는 학생들에게 진로 설계, 취업 프로그램 정보 제공, 일대일 맞춤형 취업전략 상담, 취업 특강 등 취업 전 과정을 아우르는 원스톱 서비스를 제공해 만족도가 높다.그 성과는 교육부·한국교육개발원이 올해 초 발표한 ‘2022 고등교육기관 졸업자 취업통계조사’(2022년 12월 31일 기준)에서 뚜렷히 확인된다. 인하대는 졸업생 3000명 이상을 배출하는 전국 대학 중 성균관대(76.5%), 한양대(72.5%), 중앙대(72.4%)에 이어 취업률 4위(72.2%)를 기록했다.단순히 수치만 높은 게 아니라 취업의 질적 수준도 우수하다. 졸업생 취업자 중 대기업 취업 비율이 33.9%로 서울권 대학 평균보다 11.4%포인트 높다. 대학 졸업자가 일정 기간 이후에도 취업한 직장에서 계속 근무하고 있는지를 나타내는 유지취업률에서도 졸업생 3000명 이상 배출 대학 기준 5위를 기록했다.그는 “학년·학과별 특성 등 다양한 환경에 맞춘 취업·진로 프로그램 발굴을 위해 학생들의 목소리에 항상 귀를 기울이고 있다”며 “기업의 채용 트랜드에 대한 면밀한 분석을 바탕으로 실무형 인재 양성에 힘쓴 결과로 얻은 지금의 성과에 안주하지 않고 더욱 노력할 것”라고 말했다.인하대는 올해 1학기부터 다양한 전공 탐색을 바탕으로 학생들이 자신만의 맞춤형 학업 설계를 할 수 있도록 돕는 전공디자인센터를 만들어 운영하고 있다. 사진은 전공디자인센터 상담 모습. 인하대 제공부총장 재직 이전에 인하인재개발원장을 역임한 바 있는 그는, 지금도 취업 및 창업 특강을 몸소 챙기며 진두지휘한다. 그는 “최근에는 대한항공 인사담당자가 ‘2024년 항공산업의 취업동향과 전략’을 주제로 특강을 진행해 학생들의 뜨거운 호응을 얻었다”며 “학생들이 자신이 가야 할 길을 찾는 동안 든든한 길라잡이가 되어줄 각오가 돼 있다”고 강조했다.올해엔 첨단산업 분야에 특화된 ‘첨단산업 아카데미’ 프로그램을 새롭게 운영하면서 인공지능 개발과 반도체 설계를 중심으로 직무 훈련 기회를 확대하는 성과를 올리기도 했다. 그는 “앰코테크놀로지코리아㈜, (유)스태츠칩팩코리아, ㈜핑거, ㈜미디어로그, ㈜주성엔지니어링, ㈜카네비모빌리티 등 23개 기업이 참여하고 있는데, 만족도가 높다”고 설명했다.다양한 산업군의 기업과 협력해 학생들이 전공과 관련하 관심 분야에서 실무 경험을 쌓을 수 있는 표준 현장실습학기제(Co-op) 프로그램 역시 김 부총장 노력의 결과물이다. 매 학기 (주)한진, 금호석유화학(주), 한국철도기술연구원, 한국토지주택공사, (주)유진로봇 등 유수 기업과 함께하면서 학생들이 학점 취득과 동시에 실질적인 현장 경험을 쌓는 기회를 제공한다는 평가를 받고 있다.그는 “지금까지 쌓은 경험과 노하우를 바탕으로 학교에서 하는 현장·실무 경험이 졸업 후 학생들의 큰 자산이 될 수 있도록 지원 체계를 확고하게 만들어나갈 것”이라며 “현장실습학기제(Co-op) 등의 현장실습, 일학습병행 참여 기업의 지속적 발굴과 함께 학생들의 성과를 체계적으로 관리함으로써 학생들의 진로와 취업 선택에 실질적인 도움이 되도록 하겠다”고 말했다."
2023-10-09,국내 최고 수준의 교육 환경…학사학위 전공심화과정 인가,"연재 ㅣ ○○ 전문가, 이 대학 이 전공!대림대 반도체학과대림대 반도체학과는 최근 학사학위 전공심화과정 신규 인가를 받아 2024학년도부터 운영할 예정이다. 전문학사 3년 과정을 마치고 1년 동안 진행되는 학사학위 전공심화과정을 수료하면 4년제와 동등한 학사학위가 주어진다. 사진은 대림대 반도체학과 학생들이 수업을 받고 있는 모습. 대림대 제공인공지능, 빅데이터,VR/AR등 신기술 등장으로 일상생활 전반에 차세대 반도체를 탑재한 디지털 기술이 속속 적용되고 있다. 대림대 반도체학과는 이런 4차 산업혁명 시대의 변화를 주도하기 위해 2017년부터 반도체장비전공트랙을 운영하기 시작했으며, 최근 반도체학과를 신설해 차세대 반도체 분야 인재양성에 주력하고 있다. 반도체 관련 대기업 출신 교수진 7명을 확보해 반도체 장비 제조·유지보수, 반도체 생산, 회로설계, 테스트 및 계측에 대한 특화 교육을 하고 있다.2021년에 288㎡ 규모의 반도체 클린룸을, 2022년에는 반도체VR실습실과AR교육 체계를 구축해 ‘국내 최고 수준의 차세대 반도체 선도 전문학과’로서의 면모를 갖춰나가고 있다. 또한 산업현장에서 사용되는 반도체 설계 프로그램을 도입하고, 산업계로부터 실제 장비를 기증받아 교육에 활용하는 등 현장 중심 교육과정을 운영하고 있다.국내 반도체 기업의 인재양성 프로그램을 벤치마킹해 차세대 반도체 수요맞춤형 특화 교육모델인D-SEM(DaelimSemiconductorEducationModel)도 구축했다.D-SEM은 교육과정의 현장성 제고를 위해 산업체 전문가와 교원이 공동으로 하는 산학협동 강의와 산업체 현장에서 강의가 진행되는 현장교육,VR/AR및 영상을 활용하는 콘텐츠 활용 교육, 직무역량수준 인증제 등의 교육 체계로 구성돼 있다.반도체학과 학생들은 1학년 1학기 공통과정을 이수한 뒤 2학기에 희망에 따라 반도체장비전공과 반도체디자인전공을 선택하게 된다. 반도체장비전공은 국내 주요 반도체 장비 산업체와 반도체 생산 대기업에, 반도체디자인전공은 반도체 설계 업체 및 반도체 패키징, 테스트 전문업체에 취업한다.2학년부터는 산업체 전문가와 함께 산업 현장 문제 해결 프로젝트인 캡스톤디자인을 3회 수행한다. 그 결과를 직무능력성과 발표회에서 발표해 반도체 산업체와 학생을 양방향으로 매칭한 후 채용연계형 표준현장실습으로 연계하는SEMI-PUP프로그램을 운영해 취업의 질과 학생 및 산업체의 만족도를 동시에 충족시키고 있다.2017년 한국반도체산업협회와 반도체장비전공트랙 운영 협약을 시작으로 구축된 20여 개의 반도체 산업체 거버넌스를 기반으로 2021년에는 스태츠칩팩코리아, 앰코코리아, 네패스 등과 인재양성 협약을 맺는 등 폭넓은 협력체계를 구축했다. 2023년부터는 한국공기청정협회 지원으로 클린룸 운영관리자 양성 프로그램을 운영하는 한편EUV장비 생산업체인ASML에서 포토 공정 및 장비에 대한 특강을 지원받는 교육과정도 운영 중이다.한국공학교육인증원으로부터 공학기술교육(ETAC) 인증을 획득한 대림대 반도체학과는 국제적으로 인정받은 명실상부한 반도체 전문인력 양성 대학이다. 졸업생은 삼성전자,SK하이닉스, 서울반도체, 주성엔지니어링, 동진세미캠,SK실트론 등 국내 유수 대기업 취업 시 서류전형에서 우대를 받을 뿐 아니라 국제적으로 워싱턴 어코드 회원국의 졸업생과 동등한 자격을 가지게 돼 해외 유수 반도체 기업 취업 시 혜택을 받을 수 있다.최근에는 학사학위 전공심화과정 신규 인가를 받았으며, 2024학년도부터 운영할 예정이다. 전문학사 3년 과정을 마치고 1년 동안 진행되는 전공심화과정을 수료하면 4년제와 동등한 학사학위를 받을 수 있다.김상용 학과장은 “반도체 산업체의 수요를 바탕으로 실습 중심 교육을 하고 있으며, 학생들이 산업체가 요구하는 실력을 갖추도록 자격증 취득 등 자격 기반 교육과 함께 직무역량수준 인증제도를 운영하고 있다”며 “2023년 2월 졸업자 취업률이 96%(자체조사 기준)로 특화 교육의 효과가 나타나고 있으며 앞으로도 양질의 교육을 통해 학생과 기업 모두가 만족할 수 있는 차세대 반도체 전문기술인재를 양성하겠다”고 밝혔다."
2023-03-08,[유레카] 주식 백지신탁과 공직 윤리,"현행 공직자윤리법은 고위 공직자가 3천만원을 초과한 주식을 보유하고 있는 경우, 이를 금융기관에 맡겨(백지신탁) 60일 안에 처분하도록 하고 있다. 재산 처분을 제3자에게 맡겨 공적 직무와 개인적 이해 간의 충돌을 막도록 한 것이다. 주식 처분에 이의가 있으면 주식백지신탁심사위원회에 심사를 청구해 직무관련성 여부 판단을 받을 수 있다.백지신탁 제도는 애초 1983년 공직자윤리법 제정 당시엔 포함되지 않았다. 하지만 2003년 참여정부 출범 당시 진대제 정보통신부 장관 지명자의 주식 스톡옵션이 도마 위에 오르며 이해충돌 문제가 불거졌다. 당시 진 장관은 삼성전자에서 받은 70억원가량의 스톡옵션을 행사하면 1천억여원의 이익을 얻게 되는 상황이었다. 직무관련성 논란 끝에 그는 스톡옵션 행사를 포기했고, 이듬해 치러진 17대 총선에선 여야 모두 주식 백지신탁 제도를 앞다퉈 약속했다. 박근혜 당시 한나라당 대표는 “(자신의) 모든 재산을 백지신탁하고 국가와 국민을 위한 의정활동에만 전념하겠다”고 약속하기도 했다. 2005년 4월 주식 백지신탁제를 도입하는 내용의 공직자윤리법이 국회를 통과했다.일각에선 백지신탁 제도가 유능한 인재의 공직 진입을 막는다고 지적한다. 박근혜 정부의 첫 중소기업청장에 내정된 황철주 주성엔지니어링 대표는 주식 백지신탁 문제로 사흘 만에 공직을 포기했다. 주식처분 요구가 재산권 침해라는 주장도 끊이지 않는다. 배영식 전 새누리당 의원은 지난 2010년 본인·가족의 주식을 처분하라는 주식백지신탁심사위의 결정에 불복해 행정소송을 냈으나 1심에서 패소했다. 2심 재판부는 헌법재판소에 주식 백지신탁 관련 법 조항이 재산권을 침해하는지 등 여부에 대한 위헌 제청을 했고, 2012년 헌재는 합헌 결정을 내렸다.공직자들의 불복 소송이 시간끌기 수단으로 이용된다는 지적도 나온다. 소송 기간 동안 임기를 ‘무사히’ 마치고 취하하는 경우가 대부분이라는 것이다. 최근 박성근 국무총리비서실장은 건설사 대주주인 배우자의 회사 지분을 백지신탁하라는 결정에 불복해 행정심판을 제기했다. 유병호 감사원 사무총장도 배우자 주식 백지신탁 결정에 불복해 소송을 냈다. 불복 및 시간끌기 소송으로 백지신탁 제도가 무력화될까 우려된다."
