date,title,content
2024-10-31,국내 전자기업 덮친 ‘3C’… 3분기 너도나도 어닝쇼크,"18사 중 11사, 전망치 크게 밑돌아그래픽=김하경·adobefirefly국내 전자 기업 18곳 중 11곳(61%)의 올해 3분기 영업 이익이 증권가 전망치를 크게 밑도는 ‘어닝 쇼크’ 수준의 실적을 내놨다. 반면 어닝 서프라이즈(전망치 상회) 실적을 낸 기업은 3곳에 그쳤다. 기업 실적이 증권사 전망치를 벗어나는 경우는 심심찮게 발생하지만, 보통 어닝 쇼크 기업과 어닝 서프라이즈 기업 비율은 크게 차이 나지 않는다. 이번처럼 특정 업종에서 시장 전망치를 크게 밑도는 기업이 많이 나온 것은 이례적이다.전문가들은 전자·반도체 업종 어닝 쇼크의 원인으로 고객사(Client)와 비용(Cost), 중국(China) 변수를 꼽는다. 핵심 고객사의 실적 부진, 물류비·원자재 비용 상승, 중국의 추격과 경기 침체가 영향을 끼쳤다는 것이다. 전자 업종의 경우 내수보다 수출 의존도가 높아 이 같은 요인에 더 많이 노출됐다는 분석이다. 이른바 3C(Client·Cost·China) 리스크가 국내 전자 기업의 발목을 잡은 셈이다. 업계 관계자는 “이런 변수들이 당분간 해소될 가능성이 낮기 때문에, 4분기 실적도 매우 유동적일 것”이라고 말했다.그래픽=김하경3C 리스크에 흔들린 전자30일 금융 정보 업체 에프앤가이드에 따르면, 3분기 실적을 발표한 전자 및 반도체 업종 기업 중 증권사 전망치가 제시된 곳은 18사다. 이 중 영업 이익이 증권가 전망치에 미달한 기업은 13사였는데, 대다수(11사)가 전망치보다 10% 이상 낮은 어닝 쇼크였다. 어닝 서프라이즈 실적을 낸 기업(3사)의 거의 4배였다. 고대역폭 메모리(HBM) 필수 장비를 생산하며SK하이닉스와 긴밀한 한미반도체와 주성엔지니어링 정도만 깜짝 실적을 냈다.LG이노텍은 핵심 거래처인 애플의 예상치 못한 판매 부진의 영향을 받았다.LG이노텍에서 카메라 모듈 사업부의 매출 비율은 80%. 이 사업부 매출의 90%는 애플과의 거래에서 발생하는 것으로 알려져 있다. 지난달 출시된 아이폰 16 시리즈는 출시 첫 주 판매량이 3700만대로 전작보다 12.7% 줄었다. 판매 부진으로 재고가 쌓이다 보니LG이노텍의 주문량도 줄었다. 그 결과LG이노텍의 3분기 영업 이익은 1304억원으로 시장 전망치(2577억원)의 절반 수준이다.그래픽=김하경LS일렉트릭은 인공지능(AI) 데이터 센터 수혜 기업으로 주목받았다. 증권가에서는LS일렉트릭이 3분기에 791억원 이익을 낼 것으로 전망했지만, 실제로는 665억원에 그쳤다. 고객사들의 북미 시장 진출이 예상치 못하게 지연된 영향이다. 이동현 신한투자증권 애널리스트는 “LS일렉트릭의 국내 고객사들이 미국 대선을 앞두고 투자 집행을 주저하다 보니 3분기에 일시적으로 쇼크 수준의 실적을 냈던 것”이라며 “지연된 물량은 올해 4분기와 내년 1분기 실적에 반영될 것으로 보인다”고 분석했다.”국제 정치 불안도 영향”재계와 증권가에서는 이번처럼 시장 전망이 크게 빗나간 원인으로 지정학적 요인이 꼽힌다. 물류비가 급등해 수익성이 악화된LG전자가 대표적이다.LG전자는 가전제품 및 가전 구독 수요가 늘어나며 3분기 매출 22조1764억원으로 사상 최대 3분기 매출액을 기록했지만, 수익성은 기대에 못 미쳤다.LG전자 3분기 영업 이익은 7519억원으로 증권사 전망치(1조154억원)보다 26%가량 낮았다.LG전자 관계자는 “중동 지역 분쟁과 지난 5월 미국의 대중국 관세 인상 발표 여파로 수출입을 앞당기려는 각국 수요가 폭증하면서 글로벌 해상 운임이 크게 오른 영향을 받았다”고 밝혔다.미국의 대중 제재로 자극받은 중국의 반도체 굴기는 범용 D램 시장에 영향을 줬다. 중국 메모리 반도체 기업 창신메모리테크놀로지(CXMT)는 4년 새 D램 생산 능력을 5배 가까이 끌어올렸다. 스마트폰·PC판매 부진에CXMT의 물량 공세까지 더해져 D램 가격이 9월부터 하락하기 시작했다. 삼성전자는 3분기에 9조1000억원 이익을 냈지만, 시장 기대(10조7717억원)에는 못 미쳤다.4분기에도 중동 전쟁 등 지정학적 리스크가 해소되지 않고 있는 데다, 미국의 대중 제재 분위기도 이어지고 있기 때문에 기업 실적 부진은 계속될 것이라는 전망이 나온다. 전자 업계 관계자는 “미국 대선과 우크라이나 전쟁 등 전자 업종의 수출에 영향을 미칠 변수들이 여전히 남아 있다”며 “그 결과에 따라 기업들의 실적도 큰 영향을 받을 수밖에 없을 것”이라고 말했다."
2024-10-17,"[태평로] 재산 지키려 구민 버린 구청장, 출마는 왜 했나","주식 백지신탁 판결에 사퇴補選 치른 날 補選 또 확정이럴 거면 애초에 출마 말았어야돈과 권력 다 가질 순 없어문헌일 구로구청장이 지난 7월 23일 서울 구로구 한국산업단지공단 서울지역본부에서 열린 워라밸 행복산단 지원사업 발대식에 참석해 인사말을 하고 있다. /뉴시스구청장·군수 4명을 새로 뽑는 재·보궐선거가 열린 16일 또 한 명의 구청장이 사퇴했다. 문헌일 서울 구로구청장은 공직자윤리법에 따라 보유 중인 회사 주식을 백지신탁 하라는 법원 판결이 나오자 차라리 자리에서 물러나겠다고 했다. 문 구청장은 1990년대부터 구로구에 ‘문엔지니어링’이라는 정보통신 설비 회사를 설립, 운영해 왔다. 그가 보유한 주식은 4만8000주로 평가액은 170억원으로 알려졌다. 문 구청장은 2022년 국민의힘 후보로 지방선거에 출마하면서 회사 회장직은 내려놨지만 주식은 계속 보유했다. 인사혁신처는 작년 3월 주식을 매각하거나 백지신탁 하라고 결정했고, 문 구청장은 이에 불복해 소송을 냈지만 패소했다. 문 구청장은 “명예도 좋지만 평생 가꿔온 회사를 하루아침에 저버릴 수는 없다”며 구청장직을 버렸다. 구로구민 43만명에 대한 봉사 대신 자기 재산 170억원을 지키는 길을 택한 것이다. 그의 자리를 메우기 위한 보궐선거가 내년 4월 또 열린다.구청장직보다 개인 재산이 중하다면 애초에 왜 선거에 출마했는지 묻지 않을 수 없다. 문 구청장은 소송 과정에서 “본사를 구로구에서 금천구로 이전해 직무 관련성이 없다”고 주장했지만 법원은 받아들이지 않았다. 본사를 바로 옆 동네로 이전한 것을 백지신탁 회피용 꼼수로 봤을 것이다. 문 구청장은 “내 회사가 구로구와 관련된 일을 전혀 하지 않아 이런 일이 생길 줄 몰랐다”고도 했지만, 이 말도 그대로 믿기 어렵다. 그는 2014년부터 새누리당 구로을 당협위원장을 맡았다. 2016년, 2020년 총선에도 도전했다. 10년 넘게 정치권에 있는 사람이 2005년 도입된 주식 백지신탁 제도를 잘 몰랐다는 말을 믿을 수 있나. 고위 공직자는 직무 관련성 있는 주식을 3000만원어치 넘게 보유한 경우, 임명일로부터 두 달 안에 팔거나 금융기관에 백지신탁해 처분해야 한다. 공직 수행 과정에서 발생할 수 있는 이해충돌 가능성을 배제하기 위한 장치다. 노무현 정부에서 진대제 정보통신부 장관이 보유하고 있던 주식 65억원어치를 매각했고, 박근혜 정부에선 중소기업청장에 내정됐던 황철주 주성엔지니어링 대표가 백지신탁을 거부하고 중도 사퇴했다. 문 구청장은 일단 당선이 되고 나중에 백지신탁 처분이 내려지면 법원 소송을 통해 시간을 끌며 임기를 채우려는 속셈이었을 것이다. 현 정부에서 박성근 전 국무총리 비서실장과 유병호 전 감사원 사무총장이 백지신탁에 반발해 법원에 소송을 내며 상당 기간 자리를 지켰다.구청장 보궐선거를 한 번 치르는 데 수십억원이 들어간다. 지난 강서구청장 선거는 40억원이 들었다. 문 구청장은 자기 재산을 지키기 위해 국고에 수십억원의 손실을 끼치게 됐다. 이재명 민주당 대표는 그를 비난하며 “구청장이 돈 많은 사람들이 하는 취미활동이냐”며 “국민의힘이 사과하고 책임져야 한다”고 했다. 맞는 말이다. 하지만 이 대표와 민주당도 그런 말을 할 자격이 없다. 2021년 서울·부산시장 보선을 비롯해 그동안 민주당 잘못으로 다시 치른 선거가 부지기수다. 이번 재·보선도 국민의힘 소속이던 강화·금정은 단체장이 사망해 어쩔 수 없었지만, 민주당 소속이던 곡성은 전 군수가 선거법 위반으로 물러나 치러졌다.흔히 민주당에는 ‘먹고살기 위해’ 정치하는 사람이 많고, 국민의힘에는 ‘먹고살 만하니’ 정치하는 사람이 많다고 한다. 어느 쪽이든 돈과 권력을 모두 갖겠다는 사람이 국민에게 도움이 될 리가 없다. 돈이 중하다면 권력을 탐하지 말아야 하고, 권력을 잡으려면 돈에 초연해야 한다. 두 당을 보면 당분간 그런 사람 찾기가 쉽지 않을 것 같다.△매일 조선일보에 실린 칼럼 5개가 담긴 뉴스레터를 받아보세요. 세상에 대한 통찰을 얻을 수 있습니다. 구독하기 ☞https://page.stibee.com/subscriptions/91170"
2023-11-15,"TSMC도 쏜 반도체 회복 신호, 연말 삼전 8만전자 가나","상반기 내내 부진했던 반도체주(株)가 연말이 가까워지면서 뒷심을 발휘하고 있다. 국내 대표 반도체 종목 50개로 구성된KRX반도체 지수는 이달 1~14일 12.1% 올라 전체 28개KRX지수 중 가장 높은 상승률을 기록했다. 같은 기간 6~7%대인 코스피와 코스닥 상승률을 훌쩍 뛰어넘는다.10월 미국 소비자물가 상승률이 시장 예상을 밑돌면서 글로벌 증시가 환호한 15일에도 반도체 업종의 상승세는 두드러졌다. 이날 3% 넘게 오른SK하이닉스는 13만4200원을 터치하며 신고가를 갈아치웠다. 삼성전자도 1.9%오른 7만2200원에 거래를 마감해 5거래일 연속 ‘7만전자(주가가 7만원대인 삼성전자)’ 타이틀을 지켜냈다. 반도체 소재·부품·장비 기업 주가도 대부분 강세였다. 이날 마이크로컨텍솔과 에이직랜드가 상한가를 기록했고, 주성엔지니어링(7.4%), 한미반도체(4.7%),HPSP(4.2%) 등도 크게 올랐다.그래픽=박상훈‘반도체 러브콜’ 외국인이런 반도체주 상승 배경엔 ‘돌아온 외국인’이 있다. 지난달엔 반도체주에 별 관심이 없는 듯했던 외국인들이 최근 장바구니에 반도체주를 쓸어 담고 있다. 삼성전자는 원래 공매도 영향이 적은 주식이기도 하지만, 공매도 금지 후 출렁임이 심해진 이차전자주와 달리 삼성전자는 외국인의 러브콜을 받는 것이다. 한국거래소에 따르면 공매도가 전면 금지된 지난 6일 이후 14일까지 외국인이 국내 증시에서 가장 많이 산 종목은 삼성전자로 약 5060억원어치를 순매수(매수가 매도보다 많은 것)한 것으로 집계됐다.SK하이닉스(2890억원)는 해당 기간 하이브(4070억원)에 이어 외국인 순매수 3위를 차지했다. 지난달 외국인이 삼성전자를 5760억원가량 순매도했던 것과 비교하면 반도체에 대한 외국인들의 투자 심리가 바뀐 걸 알 수 있다.SK하이닉스 순매수액도 1260억원이었던 지난달보다 크게 늘었다.그래픽=박상훈반도체 혹한기 지나가나외국인은 반도체 업황이 턴어라운드한다는 신호가 곳곳에서 나타나자 주가 상승에 베팅하는 것으로 보인다. 그중 하나는 지난 2년여간 하락세였던 반도체 가격이 반등하기 시작한 점이다. 글로벌 스마트폰 시장과PC시장이 살아나면서 지난달 D램과 낸드플래시 가격은 2021년 7월 이후 처음 상승세로 돌아섰다.그간 메모리 반도체 시장에선 삼성전자 등 주요 업체의 감산 등에 힘입어 올 4분기부터 회복 국면에 접어들 것이란 전망이 나오긴 했다. 하지만 최근엔 파운드리(반도체 위탁생산)와AI(인공지능) 반도체 등 여타 부문에서도 긍정적 소식이 쏟아졌다.세계 최대 파운드리 업체인 대만TSMC의 10월 매출이 8개월 만에 증가세로 돌아선 게 대표적이다.TSMC는 지난달 매출이 전년 동기 대비 15.7% 증가한 2432억대만달러(약 10조원)를 달성했다.챗GPT등 생성형AI용 반도체를 생산하는 엔비디아가 출력 속도를 2배 높인 신형 칩을 지난 13일 공개한 것도 시장에 활력을 불어넣고 있다. 삼성전자와SK하이닉스는 엔비디아에 고대역폭메모리(HBM)를 공급하고 있다. 메모리 시장 회복에AI반도체 수요까지 겹치면 이들의 실적 반등 속도는 훨씬 빨라질 것이란 전망이다.연말 ‘8만전자’ 도약 시동 걸까증권가는 올 연말을 반도체 업황 회복의 분기점으로 본다. 김동원KB증권 연구원은 “메모리 반도체 출하량이 점차 증가하는 가운데 D램과 낸드 가격이 동시에 상승하고 있다”며 “4분기 삼성전자와SK하이닉스는 실적 개선의 중요한 전환점을 맞을 것”이라고 했다.금융 정보 업체 에프앤가이드에 따르면 증권가는 삼성전자의 4분기 영업이익을 전년 동기 대비 19%가량 줄어든 3조4842억원 정도로 추정하고 있다. 여전한 역성장이지만 감소 폭은 3분기(77%)에 비해 크게 좁혀진다고 보는 것이다.SK하이닉스도 4분기에 적자 폭을 크게 줄인 뒤, 내년 1분기에 3500억원대의 흑자 전환에 성공할 것으로 추정했다.다만 글로벌 경기 침체 가능성이 변수가 될 수 있다. 한국기업평가는 “중국의 경제 상황이 보다 급격한 침체 국면에 진입한다면 반도체 업황 개선 예상 시기가 내년 상반기로 늦춰질 가능성도 있다”고 분석했다."
2023-06-30,"이건희가 맞았다, 3류가 1류 무시하는 한국... 기업인 출신 장관 20년간 단 1.7%","[이진석의In&Out]“대한민국 기업인 출신 중에는 장관감이 없습니까?”민간의 활력을 대표하는 기업인 출신 장관이 더 늘어나야 한다는 지적이 나온다. 29일 본지 집계에 따르면, 노무현 정부 이후 임명된 239명의 국무위원 가운데 기업인 출신은 4명으로 1.7%에 불과하다. 20년간 기업인 출신이 임명된 것은 노무현 정부의 진대제 정보통신부 장관, 박근혜 정부 강은희 여성가족부 장관, 문재인 정부 유영민 과학기술정보통신부 장관과 현 정부의 이영 중소벤처기업부 장관 등이다.교수 출신이 58명으로 24.3%에 달하는 것과 비교하면 격차가 크다. 관료나 정치인 출신이 아닌 민간에서 임명되는 장관들은 대부분 교수 출신이기 때문이다.그래픽=박상훈그래픽=박상훈그래픽=박상훈◇3류 행정이 1류 기업 외면하나고(故) 이건희 회장은 지난 1995년 “한국 정치는 4류, 행정은 3류, 기업은 2류”라고 했지만, 한국 기업들은 당당히 1류로 성장했다. 반면, 한국 행정과 정치는 3류, 4류에서 더 추락했다는 지적을 받는다. 스위스 국제경영개발대학원(IMD)의 2023년 국가 경쟁력 평가에서 한국은 2년 연속 순위가 하락해 64개 조사 대상 국가 중 28위에 그쳤다. 정부 효율성은 그보다 10계단 떨어진 38위다.한 전직 장관은 “기업인 출신 장관이 드문 것은 여러 이유가 있겠지만, 정부의 실력이 민간에 뒤지는데 왜 민간에 도움을 청하지 않는지 모를 일”이라고 했다. 한 대기업 임원은 “기업인 출신 중에 장관감이 부족하다고 생각하지 않는다”면서 “혹시 관료와 교수는 선비이고, 기업인과 금융인은 정부 지시를 따르는 장인이나 상인으로 보는 사농공상의 서열 시각이 여전히 남아있기 때문은 아니냐”고 했다.◇국무위원 4명 중 1명이 교수 출신노무현 정부 이후 국무위원 4명 중 1명은 교수 출신이다. 문재인 정부가 27.5%로 가장 높았다. 임기 중 51명의 국무위원을 임명했는데 14명이 교수 출신이다. 현 정부는 19명의 국무위원을 임명했는데 교수 출신이 5명(26.3%)이다.한 전직 관료는 “문재인 정부에서 교수 출신 장관 비율이 가장 높았던 것은 탈원전 등 문제가 있는 목표 달성을 위해 관료들보다 자기편이라고 생각하는 교수 출신들을 기용하는 것이 낫다고 봤기 때문일 수 있다”고 했다.교수 출신이 중용되는 것은 ‘폴리페서(polifessor·정치인+교수)’ 성향을 보이는 일부 교수들이 입각하는 경우가 많은 데다 장기 휴직이 가능해 부담이 적다는 점 등이 원인으로 꼽힌다. 경제 부처의 한 국장은 “연구와 강의와는 성격이 다른 정책 추진, 조직 운영 등의 업무에 강점을 보이기도 어렵다고 본다”고 말했다.◇기업인 출신 국무위원 4명기업인 출신 장관이 극소수에 그치는 것은 정부 내에서 관료들의 영향력이 커서 기업인 출신을 선호하지 않는 이유도 있지만, 인사청문회 등에 대한 부담도 작용한다는 분석이 나온다. 2013년 박근혜 정부 때 미래창조과학부(현 과학기술정보통신부) 초대 장관 후보자로 김종훈 전 벨연구소 사장이 내정됐으나 미국 국적 소지 논란 등으로 자진 사퇴했다.경제 부처의 경우 과학기술, 중소기업 등 산업 분야에는 기용된 적이 있지만, 정부 경제팀의 핵심인 기획재정부, 금융위원회 등에는 기업인 출신이 임명된 적이 없었다. 전직 고위 경제 관료들은 “기획재정부의 세제나 예산 등 업무는 전문성이 높기 때문에 민간 출신 장관은 일을 배우다 그만두는 상황이 벌어질 것”이라며 “진입 장벽이 있을 수밖에 없다”고 설명한다.하지만 이런 주장에 대한 반론도 크다. 한 금융권 인사는 “차관, 1급, 국장, 과장 모두 나랏돈으로 월급 주면서 키웠으니 민간 출신 장관이 그들의 보좌를 받으면 되지 않겠느냐”면서 “장관이 과장급, 국장급 업무를 해야 하는 것이 아니지 않으냐”고 했다. 한 대기업 임원은 “기업인의 실력이 관료보다 뒤떨어지던 경제개발 초기와는 상황이 다르다”면서 “글로벌 네트워크나 시장에 대한 이해도 등에서 기업인이 관료들을 앞서면 앞서지 뒤지지는 않는다”고 했다.루빈·므누신… 골드만삭스 거친 재무장관 잇따라경영인 출신 장관 많은 미국유럽 등 주요 선진국들은 내각제여서 기본적으로 정치인 출신들이 장관에 임명되기 때문에 대통령제인 우리나라와 직접 비교가 어렵다. 같은 대통령제 국가로 범위를 좁히면 미국은 우리와 달리 기업인 출신 장관이 적지 않다.(왼쪽부터)로버트 루빈, 스티븐 므누신, 렉스 틸러슨, 윌버 로스클린턴 행정부의 로버트 루빈, 조지 W부시 행정부의 행크 폴슨, 트럼프 행정부의 스티븐 므누신 등은 모두 미국 최대 투자은행인 골드만삭스 출신 재무장관이다. 루빈과 폴슨은 회장을 지냈고, 므누신은 최고정보책임자(CIO)를 지냈다. 장관들을 많이 배출했다는 뜻에서 골드만삭스에 ‘거버먼트(government·정부)삭스’라는 별명이 붙을 정도다. 이에 대해 한 전직 경제 부처 장관은 “골드만삭스는 세계 경제를 무대로 일하는 유대인 자본의 정점에 있는 회사”라며 “그런 점에서 우리나라도 증권사 임원을 장관에 기용할 수 있지 않겠느냐는 식으로 단순 비교하는 것은 어렵다고 본다”고 했다.트럼프 행정부는 엑손모빌 최고경영자(CEO)를 지낸 렉스 틸러슨을 국무장관에 임명했고, 투자은행 윌버로스컴퍼니 회장을 지낸 윌버 로스 상무장관, 골드만삭스 사장을 지낸 게리 콘 백악관 국가경제위원회 위원장 등을 기용했다.국방장관에도 기업인 출신이 임명될 정도다. 케네디 행정부와 존슨 행정부에서 7년간 국방장관을 지낸 로버트 맥너마라는 2차 대전 당시 육군에서 복무하고 중령으로 예편한 뒤 포드에 입사해 포드 가문 이외의 인물로는 처음으로 사장에 올랐다. 당시 포드자동차 사장 연봉은 300만달러였고, 국방장관 연봉은 2만5000달러였던 것으로 알려졌다. 공직을 위해 고액 연봉을 포기한 것이다.그는 냉전 시대 소련과의 군비 경쟁에서 우위를 차지하기 위해 천문학적인 금액의 무기 개발 비용 등을 당연한 것처럼 여기던 미국 국방 예산의 팽창주의 성향을 막았다는 평가를 받는다. 국방 분야라는 특수성을 감안하지 않고 “시스템 분석 접근이라는 이름으로 무기 개발 및 구매 예산을 줄여 베테랑 군인들을 분개하게 만들었다”는 비판도 있지만, 국방 예산에 가격 대비 성능의 개념을 확대시켰다.한국 ‘기업인 장관’이 드문 건… 주식 백지신탁 탓기업인 출신 장관이 드문 이유로는 인사 청문회 부담 외에도 주식 백지신탁이 꼽힌다. 2013년 코스닥 상장사 주성엔지니어링의 황철주 대표는 박근혜 정부의 첫 중소기업청장에 지명됐지만, 사흘 만에 “회사와 주주를 버리고 청장을 택할 수 없다”며 자진 사퇴했다.고위 공직자가 배우자 등을 포함해 직무 연관성이 있는 주식을 3000만원 넘게 보유하고 있을 경우 임명 두 달 이내에 주식을 매각하거나, 수탁 기관(증권사)에 처분을 일임하는 백지신탁을 해야 한다. 신탁 후 수탁 기관은 60일 이내에 주식을 처분해야 한다. 신탁이라고 하지만, 사실상 강제 매각을 강요당한다. 기업 대주주나 주식을 많이 보유한 기업인들이 경제 관련 부처의 공직을 맡으려면 경영권이나 자산을 포기해야만 하는 처지에 몰리는 것이다. 인사혁신처 주식백지신탁심사위원회의 직무 관련성 심사에서 “관련이 없다”는 판정을 받아야만 매각이나 백지신탁을 면제받을 수 있다.주식 백지신탁 제도는 국무총리와 장·차관, 국회의원 등과 지방자치단체의 정무직 공무원, 기획재정부와 금융위원회의 일부 4급 이상 등에 적용된다. 직위나 직무로 인해 알게 된 정보를 이용해 주식 거래를 하거나 주가에 영향을 미치는 행위를 막겠다는 취지로 2005년 노무현 정부에서 도입됐다.도입 취지는 인정하지만, 기업인 출신의 입각에 장애물이 되는 만큼 강제 매각을 하지 않도록 개정하는 방안 등이 보완책으로 거론된다. 3000만원인 기준을 높이는 방안도 거론된다. 인사혁신처가 인사행정학회에 의뢰한 연구 용역 보고서 ‘이해 충돌 방지를 위한 백지신탁제도 운영 개선 방안’은 “주가 상승 등을 감안해 5000만원으로 높이는 것이 적합하다”는 의견을 제시했다. 하지만 2020년 기준 주식 투자자 1인당 투자 금액이 7000만원대인 것을 감안하면, 최고경영자(CEO) 출신 등의 입각을 위해서는 기준을 더 높여야 한다는 주장이 나온다."
