date,title,content
2023-11-09,"공매도 효과 '1일천하'? 치솟았던 증시 거래대금, 결국 제자리","개인투자자가 열광한 ‘공매도 금지 조치’의 주가 부양 효과가 기대에 미치지 못하는 모습이다. ‘숏 스퀴즈’(가격 하락에 베팅한 숏 포지션이 청산될 때, 손실을 줄이기 위한 매수가 생기면서 가격이 급등하는 현상)의 약발도 빠르게 떨어지고 있다.이날 발표된 공매도 관련 통계가 이를 뒷받침한다. 공매도 금지가 시행된 지난 6일 하루 동안 공매도 잔고 수량은 5% 증발했다. 공매도 잔고 금액은 오히려 늘어났지만, 이는 2차전지 종목 등이 상한가를 친 데 따른 ‘착시효과’다. 김대준 한국투자증권 연구원은 “사실상 ‘패닉 숏 커버링’은 끝난것으로 보인다”고 평가했다.증시 활력에도 별 효과가 없다는 분석이다. 공매도 금지 조치로 치솟았던 거래대금도 불과 이틀 만에 금지 전 수준으로 되돌아갔다. 코스피와 코스닥 지수도 다시 2400선과 800선을 위협받고 있다. 숫자로 공매도 금지 효과를 살펴봤다.정근영 디자이너━①공매도 잔고 5% 증발8일 공개된 통계에 따르면 공매도 잔고는 금지 첫날(6일) 수량 기준으로 5% 가까이 증발했다. 지난 6일 국내 증시(코스피+코스닥) 공매도 잔고 수량은 4억2162만주로 집계됐다. 공매도 금지 직전 거래일인 지난 3일(4억4263만 주)과 비교하면 2101만 주 감소했다.다만, 전체 공매도 잔고 금액은 1조4010억원 증가했다. 한국거래소 측은 이런 현상에 대해 “금액이 늘어난 건 새로운 공매도 포지션 증가가 아닌 주가 상승으로 인한 평가 금액이 증가한 영향”이라며 “공매도 잔고는 계속 줄어들 것”이라고 설명했다.무엇보다공매도는 일정 액수 이상이 돼야 ‘보고 의무’가 생겨 통계로 잡히기 시작한다. 지난 6일 주가 상승으로 보고 의무가 없던 기존 보유자까지 잡히게 되며 ‘착시 효과’가 있을 수 있다는 의미다. 실제로 더 많은 잔고가 줄었을 가능성이 있다.공매도 금지 첫날 공매도 잔고가 대폭 줄며 ‘숏 스퀴즈’로 인한 주가 상승효과는 더는 기대하기 어렵다는 해석이 우세하다. 김대준 연구원은 “(공매도) 금지 3일이 지났고 주가가 계속 올랐다면 분위기를 탔을 수도 있지만 이미 소강상태로 접어든 것으로 보인다”며 “예측하지 못했던 조치에 반응했던 지난 6일의 ‘패닉 숏커버’ 현상을 기대하기는 어렵다”고 말했다.실제로 지난 6일 주가가 많이 올랐던 2차전지 종목의 잔고도 일제히 줄었다. 에코프로비엠(5.16%→5.02%)과 에코프로(6.75%→6.44%),LG에너지솔루션(1.48%→1.32%) 등에서 모두 비슷한 흐름을 보였다. 2차전지 숏커버링은 대다수 진행됐다는 분석이 나오는 이유다.노동길 신한투자증권 연구원은 “대차잔고 상환비율이 높으면서 수익률이 높은 종목은 숏커버를 상당 부분 전개한 것으로 볼 수 있다”며 “숏커버 진행률이 비교적 높은 것으로 종목은 호텔신라, 두산퓨얼셀, 현대엘리베이터, 포스코퓨처엠, 에코프로, 에코프로비엠, 주성엔지니어링 등이다”라고 설명했다.━②회전율 1.1%…두 배 뛰어공매도 금지는 시장의 변동성을 크게 키웠다. ‘단타’가 많아질 때 높아지는 회전율이 2배 가까이 뛰어오른 것이다. 공매도가 금지된 지난 6일과 7일 시가총액 기준 회전율은 각각 1.1%와 1.01%로 공매도 금지 전인 지난 3일(0.65%)보다 2배로 늘었다. 회전율이 1%대로 올라선 것은 초전도체 등 테마 광풍이 불었던 지난 8월31일(1.14%) 이후 3개월 만에 처음이다.━③26조로 뛰었던 거래대금 다시 15조로 줄어공매도 금지 조치에 시장이 활기를 띠는 듯했지만 흐름은 오래 가지 못했다. 증시 거래대금도 공매도 금지 첫날인 지난 6일 급증했지만, 연일 계속 빠져나가는 모습이다. 공매도 금지 첫날인 지난 6일 거래대금은 26조5000억원으로 지난 3일(14조7692억원)보다 2배 수준으로 올랐다. 그러나 지난 7일에는 3조원 가까이 빠져나가며 23조6767억원으로 내려앉았고, 8일에는 15조9757억원까지 줄며 공매도 금지 전 수준으로 되돌아갔다.━④코스피·코스닥 ‘1일 천하’?(서울=뉴스1) 박지혜 기자 = 9일 오후 서울 중구 하나은행 딜링룸 전광판에 코스피지수가 전 거래일대비 5.46포인트(0.23%) 상승한 2427.08을 나타내고 있다. 이날 코스닥 지수는 전일보다 8.15포인트(1.00%) 내린 802.87로 마감했다. 2023.11.9/뉴스1공매도 금지로 인한 유가증권시장과 코스닥의 상승장은 ‘1일 천하’로 끝나는 모습이다. 실제로 코스피와 코스닥 지수는 지난 6일 하루 오른 뒤 맥을 못 추고 있다. 각각 2400선과 800선이 위태롭다.코스피는 지난 6일 5.66% 오르며 단숨에 2500선에 안착했지만, 7·8일 하락했고 9일에는 보합(0.23%) 수준에 그쳤다. 이날 장 중 한때 2413선까지 밀렸다.코스닥은 더 힘을 쓰지 못하고 있다. 공매도 금지 첫날 7.34% 상승했지만, 이후 3거래일 연속 내리막이다. 9일 1% 내린 802.97로 거래를 마치며 800선을 간신히 지켰다."
2023-09-13,‘소부장 미래포럼’ 발족…창립총회 개최,"국내 반도체·디스플레이 ‘소부장(소재·부품·장비)’ 업계의 대표 기업들이 현안 논의를 위한 ‘소부장 미래포럼’을 발족했다. 대표는 이재훈 전 산업부 차관(김앤장법률사무소 고문)이 맡는다. 소부장 미래포럼은 산업통상자원부가 후원하며, 추후 사단법인화 한 후 2개월마다 정기 모임을 가질 계획이다.소부장 미래포럼은 13일 오전 서울 여의도 전경련회관에서 창립 총회를 열고 단체를 발족했다. 이날 총회에는 김성원 국민의힘 의원, 김경만 더불어민주당 의원, 장영진 산업통상자원부 차관 등 정관계 인사와 황철주 주성엔지니어링 회장, 이준혁 동진쎄미켐 부회장, 이재호 테스 대표, 허국 후성 대표, 유원양 티이엠씨 대표 등 주요 소부장 업계 기업인55명이 참석했다.포럼은 이날 창립총회를 시작으로 2개월 간격으로 조찬 모임을 열며 당면 현안에 대해 논의한다.장 차관은 이날 창립총회에서 “국내 소부장 업계가 꾸준히 성장하면서 지난해 기준 국내 소부장 수출 규모는 3737억 달러에 달했다”며 “다만 미국과 일본의 대중 반도체 장비 수출 규제, 중국의 갈륨·게르마늄 수출 통제 맞대응 등으로 무역 의존도가 높은 소부장 산업이 예측하기 어려운 리스크에 직면하고 있다”고 진단했다.이재훈 대표는 인사말을 통해 “우리나라가 앞으로 끌고 나가야 할 산업은 국가전략산업으로서 그 기반이 소부장 업계다”라며, “소부장 업계의 니즈를 파악하고 이에 부합할 수 있는 일을 해나가는 것이 우리의 임무다”라고 강조했다."
2023-04-13,나사도 별로라던 이 회사의 반전…반도체 한파마저 녹인 비결,"“소재·부품·장비(소부장) 업체가 살아남는 길은 끊임없는 혁신밖에 없습니다.” 황철주(64) 주성엔지니어링 회장은 13일 창립 30주년을 맞아 서울 여의도 콘래드호텔에서 연 기업 설명회에서 이렇게 강조했다. 주성은 지난해 매출 4379억원, 영업이익 1239억원으로 사상 최대 실적을 거뒀다. 최근엔 주력 상품인 원자층증착장비(ALD)의 해외 수출이 가시화하는 등 성장세가 이어지고 있다.황철주 주성엔지니어링 회장이 13일 서울 여의도 콘래드호텔에서 열린 창립 30주년 기념 기업설명회에서 회사를 소개하고 있다 [주성엔지니어링 제공]주성은 ‘한국에서 만드는 나사 하나조차 반도체에 쓸 수 없다’는 혹평을 받던 지난 1993년 창업했다. 황 회장은 회의실에 ‘전쟁에 지면 노예가 되고, 경쟁에서 지면 거지가 된다’는 문구를 걸어두고 연구개발(R&D)로 승부했다. 지난해 말 기준으로 이 회사가 반도체·디스플레이·태양광 장비 분야에서 보유한 특허는 3045개에 이른다.대표 제품은 원자층증착장비(ALD)다.ALD증착은 원자 두께의 극히 얇은 막을 반도체 실리콘 원판(웨이퍼) 위에 씌우는 공정이다. 기존 화학기상증착(CVD) 기술과 비교해 아주 정교하고 미세한 공정까지 구현해내는 게 특징이다. 이 회사의 신규ALD장비인 ‘가이던스 시리즈’는 해외 유수의 반도체 기업과 공급 협상 중이다.시장에서는 주성이 로직·이미지·센서 등 다양한 활용이 가능한 비메모리 반도체 제조사에ALD장비를 공급하면 새로운 성장 모멘텀을 갖춘 것이라고 분석한다. 황 회장은 “공급처 다변화를 통해 미국의 어플라이드머터리얼즈(AMAT)·램리서치, 네덜란드의ASML같은 글로벌 소부장 업체로 성장하겠다”고 포부를 밝혔다.경기 용인에 위치한 주성엔지니어링 연구개발(R&D) 센터 등 벽면에 새겨진 문구 [주성엔지니어링 제공]황철주 주성엔지니어링 회장이ALD공정 등을 시찰하고 있다. [주성엔지니어링 제공]디스플레이와 태양광으로 사업도 차근히 진행 중이다. 반도체에서 상용화한ALD공법을 확대 도입하겠다는 의미다. 무기물을ALD방식으로 증착하는 차세대 디스플레이 기술 개발이 완성 단계다. 현재 12% 안팎인 태양광 발전 효율 수준을 35% 이상으로 3배 이상 끌어올릴 수 있는 신기술도 연구 중이다. 황 회장은 “향후 하늘은 나는 자동차 산업에서 먼저 주목할 것”이라며 “오로지 혁신으로 이뤄낸 성과다. 혁신을 실현하고 공유하는 것이 나의 사명”이라고 말했다."
2023-05-15,"한일비전포럼, 29차례 한·일관계 정상화 촉구…양국 ‘민간 소통창구’ 큰 역할 [기시다·홍석현 특별대담]","한일비전포럼은홍석현 회장 주도로 2019년 설치전·현직 고위 외교관, 전문가 참여한·일 화해 위한 실질적 해법 모색한일관계 개선을 위한 방안을 놓고 열띤 토론을 벌여온 한일비전포럼 모습. 2019년 출범해 지난 4년여간 모두 29차례 포럼을 열었다. 외교부 장관과 주일본 한국대사를 역임한 외교전문가와 정계 및 재계 인사와 한일문제 전문가들이 참석했다. 주한국 대사를 비롯해 일본측 전문가들도 다수 참석해 과거사 문제 해결과 양국 간 미래 협력 방안을 제시했다. 사진 김현동 기자한국에서는 지난 4년간 민간 외교 차원에서 한·일 관계 정상화 노력을 기울여 왔다. 한·일 관계가 삐걱대자 2019년 한반도평화만들기(이사장 홍석현) 산하에 한일비전포럼(위원장 신각수 전 주일대사)이 설치됐다. 외교부 장관과 주일대사를 역임한 전·현직 외교관과 정계·재계 인사, 한·일 전문가들이 참여했다.한일비전포럼에서 논의된 해법과 제안은 한국 정부는 물론 일본 총리관저에도 전달됐다. 스가 요시히데 총리는 큰 관심을 보였고, 기시다 후미오 총리로 정권이 바뀐 뒤에도 포럼은 한·일 간 소통의 창구가 됐다.포럼은 한·일 관계 개선을 위한 실질적이고 전략적 해법을 찾으며 지난 4년여간 모두 29차례 열렸다.참석자는 87명에 달했고, 세미나도 두 차례 개최됐다. 첫 포럼은 2019년 4월 15일 ‘한·일은 서로에게 왜 중요한가’를 주제로 시작했다. ‘한·일 과거사 현안 어떻게 해야 하나’ ‘미국의 동아시아 전략과 한·일 관계’ ‘한·일 기업 간 협력 네트워크’ 등이 연속적으로 논의됐다. 이 내용으로 연구 책자가 두 차례 발간됐다.한일관계 개선을 위한 방안을 놓고 열띤 토론을 벌여온 한일비전포럼 모습. 2019년 출범해 지난 4년여간 모두 29차례 포럼을 열었다. 외교부 장관과 주일본 한국대사를 역임한 외교전문가와 정계 및 재계 인사와 한일문제 전문가들이 참석했다. 주한국 대사를 비롯해 일본측 전문가들도 다수 참석해 과거사 문제 해결과 양국 간 미래 협력 방안을 제시했다. 사진 김현동 기자위기도 있었다. 2019년 8월 2일 아베 신조 정부에서 ‘화이트리스트’가 발표되면서 양국 관계가 악화일로를 치달았다. 그래도 포럼은 멈추지 않았다. 해법은 더 치열하게 모색되기 시작했다. 일제 강제 징용은 물론 국방·경제·문화 등 양국 관계를 우호적으로 돌려놓을 수 있는 모든 방안을 망라했다.지난해 4월에는 일본 정부 대변인 역할을 하는 관방장관을 역임한 가와무라 다케오 전 일한의원연맹 간사장이 한국을 찾아 포럼에 대해 직접 설명을 듣고 “일본에 돌아가 일본 정부도 뭔가 해야 한다는 분위기를 만들겠다”고 했다.한일비전포럼은 정쟁으로 대치하던 여야 정치인도 머리를 맞대게 만들었다. 문재인 정부 당시 여당(더불어민주당)이던 김진표 한일의원연맹 회장과 주일대사를 역임한 강창일 의원을 비롯해 다수의 민주당 의원이 참여했다. 또 우리 정부에서는 문재인 정부에 이어 윤석열 정부 들어서도 외교차관이 직접 참석하고 윤덕민 주일대사가 현지에 부임하기 직전 참석해 의견을 공유했다.포럼은 핵심 해법으로 제3자 대위 변제안을 제시했다.일본 정부에 부담을 지우지 말고 일본이 진정성 있는 사과와 반성을 하기를 촉구하자는 방안이었다. 지난 3월 윤석열 정부가 제시한 제3자 변제안이 나온 것은 지난 4년 줄기차게 열린 포럼의 귀결점이었다.한일비전포럼 참석자(참석 당시 직책 기준)홍석현 중앙홀딩스 회장, 한반도평화만들기 이사장신각수 전 주 일본 대사, 한일비전포럼 위원장박철희 서울대 국제대학원 교수, 한일비전포럼 간사, 현 국립외교원장강창일 국회의원, 전 주일 한국대사공로명 전 외무부 장관구자열LS그룹 회장, 현 한국무역협회 회장권태환 전 주 일본 무관기미야 다다시 도쿄대 교수김윤 삼양홀딩스 회장, 한일경제협회 회장김준SK이노베이션 사장김광두 국가미래연구원 원장김동열 중소기업연구원장김동환 금융연구원 부원장김두승 국방연구원 책임연구위원김민석 전 국방부 대변인김성곤 전 국회의원김세연 국회의원김진표 전 한일의원연맹 회장, 현 국회의장김한정 국회의원, 전 한일의원연맹 간사김현철 서울대 국제대학원 교수나가미네 야스마사 주한국 일본대사, 현 일본 최고재판소 재판관니시오카 타쓰시 일본대사관 공보문화원장박상규SK네트웍스 사장박영준 국방대 교수박철균 국방부 군비통제검증단장박태호 (법)광장 국제통상연구원장, 전 통상교섭본부장박홍규 고려대 교수서석숭 한일경제협회 상근부회장서형원 청암대 총장소에야 요시히데 게이오대 교수송기호 수륜아시아법률사무소 변호사송호근 전 서울대ㆍ포스텍 교수, 현 한림대 석좌교수신현호 대한변협 인권위원장, (법)해울 대표변호사심규선 일제강제동원피해자지원재단 이사장심윤조 국민대 정치대학원 교수, 전 국회의원아사바 유키 도시샤대 교수안호영 전 주 미국 대사양기호 성공회대 교수, 전 주고베 한국총영사관 총영사오코노기 마사오 게이오대 명예교수위성락 전 주 러시아 대사ㆍ한반도평화교섭본부 본부장, 현 한반도평화만들기 사무총장유명환 전 외교부 장관유의상 전 외교부 영토표기대사윤기 일본고향의집 이사장윤덕민 주일 한국대사윤상현 국회의원, 전 국회외통위원장윤창현 서울시립대 교수, 현 국회의원윤태성KAIST교수이근관 서울대 법학대학원 교수이명수 국회의원이상민 국회의원이숙종 성균관대 교수이신화 고려대 교수, 현 외교부 북한인권국제협력대사이우광 전 삼성경제연 연구원이원덕 국민대 교수이재민 서울대 법학대학원 교수, 현 무역위원회 위원장이종윤 전 한일경제협회 부회장이종현 롯데 전무이지평LG경제연구원 상근자문위원이하경 중앙일보 주필, 현 대기자이홍구 전 국무총리, 현 서울국제포럼 이사장이희옥 성균관대 교수임은정 공주대 교수임현 대검찰청 공안기획관장용호SK매터리얼스 사장장제국 동서대 총장, 현 한국대학교육협의회 회장정재정 서울시립대 명예교수, 전 동북아역사재단 이사장정진석 국회 부의장, 현 한일의원연맹 회장정혜경 일제강제동원·평화연구회 대표연구위원조관자 서울대학교 일본연구소 교수조성일 서울대 보건대학원 교수조세영 외교부 제1차관조태용 전 외교부 차관, 현 국가안보실장조현동 외교부 제1차관, 현 주미대사주완 김&장 법률사무소 변호사주현 전 청와대  중기비서관진창수 세종연구원 일본연구센터장천영우 전 대통령비서실 외교안보수석최광해 우리금융경영연구소 대표, 전 국제통화기금 대리대사최병일 이화여대 국제대학원 교수, 현 한국고등교육재단 사무총장최봉태 대한 변협 일제피해자인권특위위원장최상용 고려대 명예교수, 전 주일 한국대사최은미 아산정책연구원 박사한승주 전 외교부 장관홍규덕 숙명여대 교수, 현 주헝가리 한국대사황희 국회의원, 전 문화부 장관황철주 주성엔지니어링 회장후카가와 유키코 와세다대 교수"
2023-04-14,“소부장 살길은 혁신뿐” 특허만 3045개,"황철주“소재·부품·장비(소부장) 업체가 살아남는 길은 끊임없는 혁신밖에 없습니다.” 황철주(64·사진) 주성엔지니어링 회장은 13일 창립 30주년을 맞아 기업 설명회를 열고 이렇게 강조했다. 주성은 지난해 매출 4379억원, 영업이익 1239억원으로 사상 최대 실적을 거뒀다.주성은 ‘한국에서 만드는 나사 하나조차 반도체에 쓸 수 없다’는 혹평을 받던 지난 1993년 창업했다. 황 회장은 회의실에 ‘전쟁에 지면 노예가 되고, 경쟁에서 지면 거지가 된다’는 문구를 걸어두고 연구개발(R&D)로 승부했다. 지난해 말 기준으로 이 회사가 반도체·디스플레이·태양광 장비 분야에서 보유한 특허는 3045개에 이른다.대표 제품은 원자층증착장비(ALD)다.ALD증착은 원자 두께의 극히 얇은 막을 반도체 실리콘 원판(웨이퍼) 위에 씌우는 공정이다. 기존 화학기상증착(CVD) 기술과 비교해 아주 정교하고 미세한 공정까지 구현해내는 게 특징이다. 이 회사의 신규ALD장비인 ‘가이던스 시리즈’는 해외 유수의 반도체 기업과 공급 협상 중이다.황 회장은 “공급처 다변화를 통해 미국 어플라이드머터리얼즈·램리서치, 네덜란드ASML같은 글로벌 소부장 업체로 성장하겠다”며 “오로지 혁신으로 이뤄낸 성과다. 혁신을 실현하고 공유하는 것이 나의 사명”이라고 말했다."
