date,title,content
2023-01-04,반도체 세제지원 확대 효과… 삼성전자 4%·SK하이닉스 7% 상승,"지난해 10월 서울 강남구 코엑스에서 열린 제24회 반도체대전(SEDEX2022)에 반도체 웨이퍼가 전시돼 있는 모습. /뉴스14일 시가총액 1위 삼성전자와 3위SK하이닉스 주가가 각각 4%, 7% 넘게 급등했다. 전날 정부가 반도체 등 국가 전략기술 시설투자에 대한 세액공제율을 대폭 올리자, 외국인 투자자들이 대거 반도체주를 사려고 몰린 결과다.이날 유가증권시장에서 삼성전자는 전날보다 2400원(4.33%) 오른 5만7800원에 마감했다. 시가총액 400조원에 육박하는 무거운 주식이 하루에 이 정도 오른 것은 2021년 12월 1일(4.35% 상승) 이후 1년 1개월여 만이다. 하이닉스는 5400원(7.14%) 오른 8만1000원으로, 8만원대를 회복했다. 하이닉스의 하루 주가상승폭도 2021년 11월 22일(7.17%) 이후 최대였다. 외국인은 이날 삼성전자를 1767억원,SK하이닉스를 593억원 순매수했다.전날 정부는 반도체·배터리·백신·디스플레이 등 국가전략기술의 연간 시설 투자에 대한 세액공제율을 대기업 기준 현재 8%에서 15%로 높이기로 했다. 이와 별도로 올해 투자 증가분에 대해 10%의 추가 공제 혜택을 주는 등 최고 25%의 세액공제를 약속했다.정부 정책 수혜 기대감에 원익IPS(9.66%), 주성엔지니어링(6.6%) 등 반도체 밸류체인에 속한 중·소형주도 줄줄이 급등했다. 반도체주 급등에 힘입어 이날 코스피 지수는 전날보다 1.68% 오른 2255.98에, 코스닥은 1.29% 오른 683.67에 거래를 마쳤다."
2024-05-28,"R&D 13조 투자, 반도체 전문가가 장관…대만 이러니 잘 나간다 [현장에서]","""  “최고의 반도체 인력은 어차피 미국으로 가지만, 대만의 탄탄한 연구개발(R&D) 생태계 때문에 상당수 돌아옵니다. 젊은TSMC엔지니어들은 신주(대만 북부 반도체 중심지) 과학단지에서 커리어를 키우는 걸 선호하죠.”   ""지난 24일 서울대 국가미래전략원 주최로 열린 한국-대만 경제안보 세미나에서 롄셴밍 대만정치대 교수가 토론하고 있다. 사진 서울대 국가미래전략원대만 경제안보 전문가가 전한 ‘대만이 막대한 보조금 없이도 반도체 경쟁력을 유지하는 비결’이다. 지난 24일 서울대 국가미래전략원 주최로 서울대에서 열린 ‘한국-대만 반도체 산업 경제안보정책 협력’ 세미나는 새 총통 집권 1주일을 맞은 대만의 반도체 정책을 엿볼 수 있는 자리였다.『반도체 삼국지』의 저자인 권석준 성균관대 화공학부 교수와 대만 국가과학기술위원회(NSTC) 부속 과학기술 민주사회 연구센터(DSET)의 장치청 박사가 한국·대만 반도체 산업의 현황과 과제에 대해 발표하고, 박종희 서울대 정치외교학부 교수의 사회로 김병연 서울대 석좌교수, 롄셴밍 국립 대만정치대 교수, 연원호 대외경제정책연구원 경제안보팀장이 토론했다. 토론은 채텀하우스 룰(누가 어떤 발언을 했는지 비공개하는 외교 안보계의 규칙)로 진행됐다.토론자들은 한국과 대만이 공통적으로 처한 위기와 협력 가능성을 논의했다. 미국과 유럽 등은 막대한 보조금을 쏟아부으며 반도체 제조 공장을 자국에 유치하고, 중국은 ‘전 공정의 내재화’를 위해 한국·대만의 기술·인력을 빼 간다. 반도체로 나라를 지키는 대만의 전략은 ‘글로벌 R&D 중심지’였다.지난 20일 취임한 대만 라이칭더 신임 총통. 대만을 '실리콘의 섬'에서'AI의 섬'이 되게 하겠다고 말했다.EPA=연합뉴스━공장 보조금 없지만, R&D에 13조 투자대만도 한국처럼, 반도체 팹(fab) 직접 보조금을 주지 않고 세액 공제 방식을 고수한다. 다만 대만은 13조원을 R&D에 오롯이 투자한다. 대만 민진당 정부가 지난 3월 시작한 ‘대만 반도체 기반 산업 혁신 프로그램(TaiwanCBI)’은 10년간 3000억 대만달러(약 12조7000억원)를 쏟아붓는 사업이다. 반도체 설계와 인공지능(AI) 분야 해외 스타트업과 벤처 투자사를 대만에 불러들여 대만 산업계와 결합하고, 해외에 집적회로(IC) 설계 교육기지를 설립해 글로벌 반도체 전문가를 대만 손으로 길러낸다는 목표다. 최대 300만 달러(약 41억원)를 지원하는 해외 스타트업 경진대회는 접수를 시작했고, 체코 공대와 협력한 첫번째 유럽 교육 과정은 9월에 시작한다. 이날 대만 측 토론자는 “대만이 반도체 허브(Hub) 지위를 유지하는 길은 시장 주도, 혁신 주도 뿐”이라고 말했다.지난 24일 서울대 국가미래전략원 주최로 열린 한국-대만 경제안보 세미나에서 김병연 서울대 석좌교수가 토론하고 있다. 사진 서울대 국가미래전략원━한국 실패한 ‘소부장 장관’,대만 혁신 선봉이 정책을 이끄는 대만NSTC와 경제부, 국가발전위원회(NDC) 장관은 모두 반도체 전문가다. 특히,NDC장관은IBM과PwC반도체 컨설팅 전문가 출신, 경제부 장관은 반도체 소부장 업체 탑코(Topco)의 공동창업자다. 반도체 산업의 민간 기업인들이 산업 정책의 최전선에 선 것이다. 한국의 주성엔지니어링이나 원익 창업자가 산업부 장관이 된 격이다.대만 반도체 소부장 업체 창업자인 궈즈후이 신임 대만 경제부 장관. 사진 대만 경제부한국도 10년 전에 시도했다. 2013년 미래창조과학부 장관과 중소기업청장으로 창업가 출신인 김종훈 알카텔-루슨트 최고전략책임자(CSO) 겸 벨연구소 사장과 황철주 주성엔지니어링 대표가 각각 내정됐으나, 김 내정자는 가족·신상에 대한 과도한 검증을 이기지 못해서, 황 내정자는 주식 백지신탁을 해결하지 못해서 자진 사퇴했다.회사와 현지 언론에 따르면, 궈즈후이 경제부 장관은 850억원에 달하는 탑코 지분(4%)을 보유한 대주주였으나 지명 일주일 전에 지분을 아들이 운영하는 투자회사에 양도하는 것으로 문제를 해결했다. 그는 취임 전부터 대만 중소기업인에게 기존 산업을AI로 혁신하겠다는 포부를 밝혔고, 일본·미국·멕시코 등 대만 대기업이 진출하는 곳에 중소기업도 함께 진출할 수 있도록 과학단지를 세워주고 외교 업무도 대신 처리해주겠다고 약속했다.기업가 출신 공직자에 대한 이해충돌 논란은 없을까. 세미나 후에 롄셴밍 교수에게 질문했더니 그는 “새 정부는 반도체에 치우친 대만의 경쟁력을 다른 분야와 작은 기업들로 확장하려 한다”라고 말했다. 인접 산업과 중소기업을 키우려면 산업 현실을 아는 장관들이 필요하다는 얘기다. 그는 반문했다. “정부가TSMC만 챙긴다는 비판에서 벗어나기 위해서죠. 삼성이 있는 한국도 비슷한 상황 아닌가요?” 반도체 쏠림은 극복하면서 첨단 인력·기술은 확보하라는, 같은 숙제를 향해 잰 걸음으로 나선 대만이 던진 질문이었다.심서현 산업부 기자"
2023-06-12,"삼성전자 10% 뛸 때 20% 뛰었다, 소부장 히든 챔피언은…","━반도체 소·부·장 분석국내 증시의 주도주가 달라졌다. 올봄 2차전지 관련주가 시장을 끌고 왔다면 여름엔 반도체 섹터가 새로운 주도주로 떠오르고 있다. 한국거래소가 삼성전자 등 국내 대표 반도체 기업 15곳의 주가를 지수화한 ‘KRX반도체TOP15’ 지수는 최근 한 달 동안 10.4% 뛰었다. 같은 기간 2.1% 오른 코스피에 비하면 수익률이 5배가량 높았다.머니랩은 ‘반도체=삼성전자’라고 생각하는 개인투자자를 위해 반도체 소부장 섹터를 집중적으로 탐구했다. 증권가가 주목하는 반도체 소부장 기업은 반도체 공정에서 핵심 기술을 공급하는 곳이다. 웨이퍼 제작부터 금속 배선까지의 작업을 하는 곳을 전(前) 공정 기업, 그 이후 테스트와 패키징 작업을 담당하는 곳을 후(後) 공정 기업이라고 한다.그래픽=김영희 02@joongang.co.kr머니랩은 증권가에서 적극 ‘매수’ 의견을 제시하는 주요 반도체 전후 공정 기업을 소개한다. 물론 특정 종목을 매수 추천하는 것은 아니라는 점을 분명히 밝힌다.증권가의 관심을 한 몸에 받는 반도체 소부장 기업은 대체로 재무건전성이 매우 우량하다. 머니랩이 올 1분기 보고서를 분석한 15개 기업 중 13곳은 부채비율(부채총계/자본총계)이 100%가 안 된다. 또 현금 유동성을 나타내는 유동비율(유동자산/유동부채)도 12곳이 200%가 넘는다. 반도체 업황 악화에 고금리 환경을 맞았지만, 상당수가 잘 버티고 있다고 짐작할 수 있다.그래픽=김영희 02@joongang.co.kr반도체 소부장 기업의 수익성의 경우 ‘반도체의 겨울’이라 일컬어지는 올해에는 전반적으로 전년 대비 악화할 것으로 예상되는 곳이 많다. 증권업계 예상치를 보면 15곳 중 9곳이었다. 그러나 반도체 업황이 호황 국면에 접어들 것으로 예상되는 내년에는 15곳 모두 영업이익이 반등할 것으로 전망된다.그래픽=신재민 기자shin.jaemin@joongang.co.kr증권가에서 주목하는 기업도 내년도 실적 성장률이 가파른 곳들이다. 한국투자증권은 최선호주로 유진테크를, 차선호주로 피에스케이를 꼽았고,HPSP와 주성엔지니어링도 관심을 기울일 만한 종목으로 삼았다.유진테크는 증착 공정에서 웨이퍼에 금속 박막을 형성하는 장비를 제조하는 기업이다. 올해 매출의 70%는 삼성전자 쪽에서 나오고 있는데 삼성전자의 디램·낸드·파운드리 생산라인 모두에 제품을 공급하고 있다. 채민숙 한국투자증권 연구원은 “내년 이후에는 삼성전자 안에서 점유율을 높인 상태에서SK하이닉스의 장비 투자도 회복하면 이익 증가가 더 크게 나타날 수 있다”고 말했다.그래픽=김영희 02@joongang.co.kr피에스케이는 포토 공정에서 노광 작업을 한 뒤 남은 포토레지스트(PhotoRegist·빛을 쬐었을 때 형질이 변하는 물질) 제거에 쓰이는 드라이스트립 장비 제조사다. 세계 시장 점유율 1위를 기록 중이다. 한국투자증권은 이 회사의 내년도 영업이익이 전년 대비 56.9% 증가할 것으로 전망한다.HPSP는 이온 주입 공정에 쓰이는 고압 수소 가열·냉각(Annealing) 장비를 세계 최초로 개발한 기업이다. 고압 수소를 이용하면 기존과는 다르게 400도 이하의 온도에서 가열·냉각이 가능하다. 고온으로 인한 웨이퍼 손상을 막을 수 있다. 채민숙 연구원은 “고압 수소는 폭발성이 있어 장비 개발이 어렵고, 고객사 인증도 까다롭기 때문에HPSP의 독점력은 상당 기간 지속할 것”이라고 했다.그래픽=신재민 기자shin.jaemin@joongang.co.kr주성엔지니어링은 국내에서 증착 공정에 사용되는 박막 형성 장비ADL을 가장 먼저 개발한 기업이다. 유진투자증권은 이 회사의 내년도 영업이익이 전년 대비 164% 증가할 것으로 예상한다. 이승우 유진투자증권 연구원은 “미국과 대만 지역에 새로운 고객사를 확보하고 비메모리 분야에서 새롭게 장비 매출이 발생하는 등 고객사와 제품 라인업이 계속 확대될 것”이라고 밝혔다.합성쿼츠계의 ‘신흥 강자’로 거론되는 비씨엔씨도 기대주 중 한 곳이다. 조대형DS투자증권 연구원은 “미국 인텔사 쪽에서 발생하는 합성쿼츠의 올해 매출은 전년 대비 5배 이상 성장할 것으로 기대된다”며 “올 하반기부터 본격적으로 실적이 성장할 것”이라고 전망했다. 이 밖에 증권가가 주목하는 기업들로 원익IPS,파크시스템스, 한미반도체, 넥스틴, 티씨케이, 솔브레인 등도 있다.반도체 소부장 기업 주가 흐름은 대체로 삼성전자·SK하이닉스 등과 비슷하게 움직인다는 게 증시 전문가들의 분석이다. 주가 흐름이 비슷하다면 ‘차라리 대장주 삼성전자 주식을 사지, 뭐하러 소부장주에 투자하냐’고 반문할 수도 있겠다. 하지만 주가 반등 국면에서는 시가총액 규모가 작은 소부장주의 반등 폭이 더 클 수 있다. 실제로 지난 한 달(5월 4일~6월 4일) 삼성전자 주가가 10.9% 오를 때,HPSP는 22.5% 상승했고, 비씨엔씨와 한미반도체도 각각 21.3%, 18.4% 올랐다.이승우 연구원은 “올해 반도체 소부장주 대부분은 영업 실적이 좋지 않을 것으로 예상하는 데도 주가가 올랐다”며 “올 연말이나 내년부터 반도체 경기 사이클 전환이 시작될 것이란 기대감이 선반영되기 시작한 것”이라고 설명했다."
2024-10-17,[사설] 주식 못 팔겠다며 사퇴 구로구청장…구정이 가욋일인가,"━구로서 30년 경영, 직무연관성 없다며 소송도━국민의힘 공천서 못 걸러, 무공천 약속 지키길문헌일 구로구청장이 어제 자진 사퇴했다. 보유 주식을 팔지 못하겠다며 소송을 냈지만 패소하자 구청장직을 포기했다. 구청장 개인의 재산을 지키기 위해 수십억원의 세금을 들여 선거를 다시 치르게 됐다. 문 전 구청장은 2022년 지방선거에서 국민의힘 공천을 받아 출마했다. 구로구는 더불어민주당 소속 전임 구청장이 3연임에 성공한 지역인데, 지난 선거에서 문 전 구청장이 8000여 표 차로 민주당 후보를 따돌려 주목을 받았다. 그는 이 지역에서 30년 가까이 중견 정보통신 설비 회사를 운영해 왔다. 보유한 주식의 가치는 170억원에 이르는 것으로 알려졌다.공직자윤리법상 3000만원 이상의 주식은 공직자가 된 뒤 두 달 안에 팔거나 금융기관에 백지신탁해야 한다. 백지신탁도 수탁 기관이 최장 90일 이내에 매각하는 것이어서 크게 다를 바 없다. 문 전 구청장은 인사혁신처 산하 주식백지신탁 심사위원회에 자신의 주식과 구청장 직무가 연관성이 없다며 심사를 청구했지만 기각됐다. 이에 불복해 제기한 행정소송에서도 2심까지 패소하자 아예 구청장직을 내놓은 것이다.주식 백지신탁 제도는 공직자가 업무 처리 과정에서 주식을 보유한 회사와 이해가 충돌하는 것을 막기 위해 2004년 도입됐다. 취지 자체는 합당하지만, 종종 민간에서 두각을 나타낸 인재를 공직에 등용하는 데 걸림돌이 된다는 지적도 받아 왔다. 2013년 반도체 장비업체인 주성엔지니어링 황철주 회장이 중소기업청장에 내정됐다 백지신탁 문제로 사흘 만에 사퇴한 게 대표적 사례다.하지만 선출직 공직자의 경우 사정이 다르다. 유권자에게 봉사하기 위해 희생을 각오하며 나서는 직책이기 때문이다. 특히 기초단체의 경우 토지 이용과 환경, 세금 등 각종 규제의 시행 주체인 만큼 관내 기업과 이해충돌 소지가 다분하다. 수십 년간 기업을 경영해 온 사람이 이를 모를 리 없다.문 전 구청장은 회장 직위를 내려놓고 본사 주소를 옮기면 이해충돌 소지가 없을 것으로 판단했다고 한다. 잘 납득되지 않는 주장이다. 또 대주주로서 지분을 유지하겠다는 것은 임기 내내 경영에도 간여하겠다는 의지의 표현으로밖에 볼 수 없다. 구정(區政)이 회사를 운영하며 틈틈이 할 수 있는 취미활동 정도로 여긴 것은 아닌지 의심스럽다.문 전 구청장의 사퇴로 막대한 비용을 들여 내년 4월 보궐선거를 치러야 한다. 당선자가 나올 때까지 행정 공백이 불가피하고, 그나마 임기도 얼마 남지 않게 된다. 국민의힘은 공천에서 미리 거르지 못한 책임이 큰 만큼 지역 주민들에게 사과해야 한다. 아울러 당의 귀책사유로 재·보선을 치를 경우 공천하지 않겠다는 약속을 지키기 바란다."
2024-04-22,[새로운 시작 인천·경기] 대한민국 미래 먹거리 마련 … 세계 최고 반도체 중심도시 건설에 박차,"경기 용인특례시도로망 구축, 전문인력양성 등 계획SK하이닉스·삼성전자 팹 부지조성20여 년 걸쳐 300만 개 일자리 창출이상일 용인특례시장(왼쪽 둘째)이 반도체클러스터 산업단지에 전력을 공급하기 위한 수직구 터널 공사 현장을 둘러보고 있다. [사진 용인시]이상일 용인시장이 제3차 범정부 추진지원단 회의에서 교통 인프라 확충 등을 건의하고 있다.용인특례시는 ‘함께 만드는 미래 용인 르네상스’를 시정 비전으로 내걸고 세계 최고 반도체 중심도시 건설에 박차를 가하고 있다. 처인구 이동·남사읍 첨단 시스템반도체 국가산업단지와 원삼면 용인반도체클러스터 일반산업단지 등의 대형 프로젝트를 진행하면서다.해당 시설은 향후 20여 년에 걸쳐 300만 개 이상 일자리를 창출할 경기 남부 반도체 메가 클러스터의 중심이 될 전망이며, 용인시는 주변에 도로망과 철도망을 구축하고 반도체 마이스터고등학교를 비롯한 전문 인력 양성 시스템까지 갖춘다는 계획이다. 이상일 용인특례시장은 “중세도시 피렌체가 문예 부흥 운동으로 불리는 르네상스로 이탈리아를 강성하게 만든 것처럼 반도체 산업 경쟁력을 강화해 대한민국의 미래 먹거리를 마련하려는 것”이라고 전했다.첨단 시스템반도체 국가산업단지와 용인반도체클러스터는 정부가 지난해 3월 조성하겠다고 밝힌 ‘세계 최대 반도체 메가 클러스터’의 두 축이다. 윤석열 대통령이 지난 1월 경기 남부를 관통하는 세계 최대 반도체 메가 클러스터 조성에 622조원 투자가 예상된다고 밝힌 가운데 502조원이 용인에, 그중에서도 두 산업단지에 482조원이 투자된다.이동·남사읍 첨단 시스템반도체 국가산업단지 규모는 747만㎡로 올해 초 초단기 완공으로 화제가 된 대만TSMC의 일본 구마모토 1공장 부지(21만㎡)의 35.6배에 달한다. 원삼면 용인반도체클러스터는 415.6만㎡로 구마모토 1공장의 19.8배다.SK하이닉스의 팹(Fab) 4기가 들어설 용인반도체클러스터에선 내년 3월 1기 팹(Fab) 착공에 대비해 지금 한창 부지조성 공사를 진행 중이다. 이곳에 1차로 신축될 건축물은 연면적 367만㎡로 인천공항 1·2터미널을 합한 면적의 2배가 넘는다. 1기 팹만도 160만㎡나 되며, 79만㎡ 규모 생산지원시설(9동), 71만㎡ 규모 사무실(2동), 37만㎡의 상생협력센터, 20만㎡의 기숙사 등이 함께 건설된다.삼성전자가 6기의 팹을 건설할 첨단 시스템반도체 국가산단도 속도를 내고 있다. 한국토지주택공사(LH)가 사업 시행을 맡아 지난 17일 국토교통부에 산업단지계획 승인을 신청했다. 산단 계획이 승인되면 곧바로 토지 보상과 조성이 이뤄진다. 이와 관련해 윤석열 대통령은 지난 9일 반도체 현안 점검 회의에서 2026년 부지조성 공사를 시작할 수 있도록 환경영향평가, 보상 등의 절차도 2배 이상 속도를 내 시간을 단축하라고 강조한 바 있다.반도체 메가 클러스터는 두 산업단지를 중심으로 인근의 기존 메모리 팹과 소·부·장, 설계, 패키징 등 반도체 기업 및 관련 연구기관 등이 어우러져 시너지를 내도록 조성된다. 용인반도체클러스터협력화단지에 50개, 첨단 시스템반도체 국가산업단지에 150개 등 200여 소·부·장, 설계기업이 입주해 협업하게 된다. 용인반도체클러스터에는 이미 분양 대상 37필지 가운데 31필지에 주성엔지니어링, 원익IPS,솔브레인 등 29사가 입주하겠다며 시와 협약을 마친 상태다.용인이 세계 최대·최고 반도체 메가 클러스터의 중심으로 자리매김하면서 두 산업단지 인근에도 반도체 기업들이 속속 모여들고 있다. 기흥 미래첨단산업단지에는 국내 대표적 반도체 장비업체인 ㈜세메스가 자리 잡았고, 세계적 반도체 장비회사인 램리서치는 오는 7월 한국 본사를 R&D센터가 있는 기흥구 지곡동으로 옮길 예정이다. 세계 4대 반도체 장비업체로 꼽히는 도쿄일렉트론의 한국 법인 도쿄일렉트론코리아는 처인구 원삼면 원삼일반산단에 R&D센터를 건립할 예정이다. 반도체 검사장비 업체 ㈜고영테크놀로지는 올 하반기 서울 본사와 지주회사를 수지구 상현동 고영테크놀로지R&D센터로 통합·이전하며, 반도체 핵심 소재인EUV블랭크 마스크와 펠리클 업체인 에스앤에스텍은 첨단 시스템반도체 국가산단 인근 용인테크노밸리 일반산단에 오는 7월 신규 공장을 준공할 예정이다."
