date,title,content
2024-12-10,“언제 50%나 올랐지?”.. 경기 부양 기대감에 중국 ETF 훨훨,"中, 14년 만에 통화정책 완화 예고투자 대상 지수 따라 성과 달라져[왕개미연구소]지난 9일 미국 뉴욕 증시에서 중국 증시의 3배 수익률로 움직이는 상장지수펀드(ETF)가 하루에 24% 상승 마감했다. ‘디렉시온 데일리FTSE차이나 불 3X(티커명YINN)’란 상품이다. 올해 상승률 89%로, 강심장 한국인들이 즐겨 매수하는 상품이다. 메이퇀, 텐센트, 알리바바, 중국건설은행, 샤오미 등 중국 대형주에 투자한다. 중국 정부가 추가 경기 부양책을 내놓을 것이란 기대감에 자금이 몰리면서 이날 하루 거래량은 평소의 5배를 넘어섰다.‘바이 차이나(BuyChina)’ 흐름은 10일 열린 한국 증시에서도 비슷하게 나타났다. 이날 중국 증시에 투자하는ETF로 자금이 몰리며 상승세를 보였다.TIGER차이나항셍테크레버리지ETF가 9.1% 상승해 마감했고,KODEX차이나H레버리지ETF도 7% 넘게 오르며 장을 마쳤다.그래픽=백형선◇中, 14년 만에 통화정책 완화다음 달로 다가온 트럼프 미국 대통령 당선인의 백악관 복귀를 앞두고, 중국은 지난 9일 내년 경제정책 변화를 예고했다. 내년 경제정책 기조를 ‘내수 살리기’로 설정하고, 통화정책을 더욱 완화하겠다고 발표한 것이다. 이에 대해 블룸버그는 중국이 경기 부양을 목적으로 14년 만에 통화 정책을 완화하는 것이라고 보도했다.김경환 하나증권 연구원은 “9일 열린 중국 중앙정치국 회의에서 통화정책 기조를 14년 만에 처음으로 ‘안정’에서 ‘적절히 완화’로 바꾸었다“며 “내년도 부진한 내수 상황과 대외 금리 인하 사이클을 고려해 적극적인 완화 의지를 표명했다고 해석되면서 유동성 공급 기대감이 높아졌다”고 말했다.정정영 한화투자증권 연구원도 “중국 정부는 적극적인 수식어로 부양 의지를 강조했는데, 처음으로 차오창구이(超常規·파격적인) 같은 단어도 사용했다“면서 “부동산과 주식시장 안정화를 처음으로 직접 언급했다는 점도 주목해야 한다”고 말했다.중국의 내년 경제정책 방향은 9일 논의 결과를 바탕으로 11∼12일로 예정된 중앙경제공작회의에서 확정된다.그래픽=김의균중국ETF,1년 수익률 최대 50%10일 한국거래소에 따르면, 이달 기준 한국 주식시장에는 중국 증시에 투자하는ETF가 44개 상장돼 있다. 같은 중국에 투자하는ETF라도, 구체적인 투자 대상에 따라 수익률은 ​크게 달라진다.1년 수익률이 47.6%로 가장 높은 상품은 미래에셋운용의 ‘차이나CSI300레버리지ETF’다. 이 상품은 ‘중국판 S&P500′인CSI300 지수 움직임의 2배로 움직인다.CSI300 지수는 중국 본토 A주 중에서 시가총액이 가장 크면서 유동성이 높은 300종목으로 구성돼 있다. 마오타이, 공상은행, 중국은행, 중국텔레콤 등이 대표적이다.삼성자산운용의 ‘차이나HETF’는 레버리지 상품이 아니면서도 1년 수익률이 44%를 넘었다. 홍콩증권거래소에 상장된 중국 주식들로 구성된HSCEI지수에 투자한다. 대부분 국영기업으로, 금융과 에너지 업종 비율이 높다. 최근 1년간HSCEI지수는 33% 상승했는데, 차이나HETF는 환노출형 상품으로 환차익이 더해져서 추가적인 수익을 거둘 수 있었다.그래픽=백형선중국 투자, 앞으로의 전망은중국 증시에 대한 글로벌 투자은행(IB)의 전망은 엇갈린다. 중국 증시가 강력한 경기 부양책 효과로 당분간 상승세를 이어갈 것이라는 낙관적 전망이 있는가 하면, 반등은 일시적일 뿐이며 트럼프 재집권 시기에 추세적인 상승장을 이어가긴 어려울 것이란 지적도 많다.중국 옹호론자는 중국 증시가 여전히 저평가 상태인 데다 중국이 경기 부양을 위해 재정 대책을 계속 내놓을 가능성이 있다면서 랠리 가능성이 높다고 주장한다. 반면 중국 경제의 체력이 약화된 데다 4년 이상 지속된 부동산 위기, 급증한 지방정부 부채, 미국과의 무역 갈등 등 여러 문제가 남아 있어 상승에는 한계가 있다는 주장도 제기되고 있다.이스트스프링자산운용코리아는 10일 펴낸 보고서에서 “중국 증시는 매력적인 밸류에이션(가치평가)과 추가 재정·통화 부양책으로 하방이 지지될 것“이라며 “실적 성장 동력이 가시화한 종목에 선별적으로 투자하는 것이 좋다”고 조언했다.전종규 삼성증권 연구원은 “중국에선 두 가지 거시 경제 위험 요인인 디플레이션, 부채와 정부 정책 간의 힘겨루기가 이어지고 있다“면서 “올해 중국 정부의 경제성장률 목표는 5%로 설정되었지만 수요 둔화와 부동산 침체 환경을 감안한다면 목표 달성이 쉽지 않다”고 말했다."
2024-10-21,2600억 규모 ‘부산 미래성장 펀드’ 운용사 11곳 선정,"부산 연제구 연산동 부산시청 전경./뉴스1지역 사상 최대인 2600억원 규모의 ‘부산 미래성장 벤처펀드’ 운용사 11곳이 선정됐다.부산시와 중소벤처기업부는 ‘부산 미래성장 벤처펀드’의 자(子)펀드를 운용할 11개사를 확정했다고 21일 밝혔다.‘부산 미래성장 벤처펀드’는 지난 6월 부산시와 중기부, 금융기관 등이 1011억원 규모로 조성한 모(母)펀드와 이번에 선정된 11개사가 만드는 자펀드 등 총 2589억원으로 이뤄졌다. 11개 자펀드는 오는 연말까지 결성해 운용에 들어갈 예정이다.이번에 선정된 11개 자펀드 운용사는 부산 지역 스타트업 등에 주로 투자하는 ‘지역 리그’ 6개사와 부산과 여타 지역에 투자하는 ‘수도권 리그’ 5개사로 구성됐다. 지역 리그 6개사는 에스벤처스 부산대학교기술지주·나우아이비캐피탈BNK벤처투자·부산지역대학연합기술지주 부산창조경제혁신센터·시리즈벤처스 서울대기술지주 등이다.수도권 리그 5개사는 에이플투자파트너스·유안타인베스트먼트·코리아에셋투자증권 등이다. 수도권 리그는 운용 펀드 중 부산에 40%를 의무적으로 투자하도록 했다. 시 측은 “이는 수도권 자금을 부산으로 유입시키는 데 성공했다는 의미를 갖고 있다”고 말했다. 지역리그 분야 펀드는 679억원, 수도권리그 분야 펀드는 1910억원 규모다또 다음 달 중 해외를 상대로 투자하는 글로벌 리그 자펀드 운용사 1곳을 추가로 선정할 예정이다. ‘글로벌 리그’ 자펀드는 334억원 규모로 조성될 계획이다. 글로벌 리그 자펀드까지 더하면 ‘부산 미래성장 벤처펀드’의 총 규모는 3000억원 가량으로 늘어난다.박형준 부산시장은 “전례없는 지역 중심의 대규모 펀드인 ‘부산 미래성장 벤처펀드’는 부산 경제에 새로운 활력을 불어넣고 지속 가능한 발전을 위한 토대를 마련하는 든든한 마중물이 될 것”이라고 말했다."
2024-11-21,[WEEKLY BIZ LETTER] ‘희소성 전략 페라리...괴물 수퍼카 ‘F80′ 799대만 푼다,"WEEKLYBIZ뉴스레터 구독하기 ☞https://page.stibee.com/subscriptions/146096WEEKLYBIZLETTER#404(2024. 11. 19)돈이 보이는 경제 뉴스조선일보letter@chosun.com서울 중구 세종대로 21길 33 02-724-5114수신거부UnsubscribeMarket'희소성 전략' 페라리...괴물 수퍼카'F80′ 799대만 푼다이탈리아 수퍼카 브랜드 페라리의 지난 3분기 매출은 시장 예상치(18억유로)에 못 미쳤습니다. 그래도 지난해 대비 견조한 상승세는 이어졌습니다.내년 말부터 무려 53억원짜리(360만유로) 괴물 수퍼카 ‘F80′을 고객들에게 인도하겠다는 페라리의 앞날은, 페라리 엠블럼 속 도약하는 검은 말처럼 계속 도약할 수 있을까요.WEEKLYBIZ는 페라리가 미국 증권거래위원회(SEC)에 제출한 3분기 실적 보고서와 실적 발표회 녹취 등을 바탕으로 페라리의 실적과 성장 동력을 분석했습니다.김성모 기자READMOREInterview""팸테크 투자로 여성 건강 좋아지면, 韓GDP연간 150억달러 증가 효과""‘12억4000만달러 대(對) 4400만달러’글로벌 컨설팅 회사 맥킨지에 따르면, 지난해까지 5년 동안 남성 질환인 발기부전 치료 기술을 연구하는 스타트업은 여성 질환인 자궁내막증 관련 연구를 진행하는 스타트업의 28배 수준에 이르는 투자 자금을 확보했다. 헬스케어 투자에 심각한 성별 불균형이 있다는 뜻이다. 이에 이 같은 성별 불균형을 바로잡을 해법으로 ‘펨테크(FemTech·여성과 기술을 합친 말)’가 주목받고 있다.홍준기 기자READMOREMarket""중국 기술·부품 안 쓴 드론, 시속 250km로 적 드론 격추""드론이 현대전의 핵심 전력으로 떠오른 가운데, 국내 토종 드론 스타트업 니어스랩이 정찰과 적 드론 격추 등 다양한 임무를 수행할 수 있는 인공지능(AI) 드론을 내놔 주목받고 있습니다. 2015년 설립돼, 내년에 열리는 세계 최대 전자·정보기술 전시회 ‘CES2025′ 최고혁신상 수상자로 내정되기도 한 니어스랩의 누적 투자액은 약 300억원에 이릅니다.WEEKLYBIZ는 지난 11일 서울 송파구 니어스랩 본사에서 글로벌 드론 시장 공략에 나선 최재혁(37) 대표를 만났습니다.채제우 기자READMOREWeeklyBizColumn[Biz&Marketing] 욕망 자극하는 쇼핑 대신, 정신적 위로·공감은 어떨까11월에는 전 세계 소비자가 기다리는 최대 쇼핑 시즌이 시작됩니다. 중국에서는 온라인 쇼핑몰이 파격 할인을 제공하는 광군제가, 미국에서는 추수감사절 직후 블랙 프라이데이, 사이버 먼데이 할인 행사가 이어집니다. 한국에서도 자동차, 식품, 패션 등 다양한 기업이 참가하는 코리아 세일 페스타가 열립니다. 그런데 연중 최대 매출을 기록하는 특수 시즌에 다른 행보를 보이는 기업도 있습니다.미국의 아웃도어 브랜드REI는 블랙 프라이데이에 190여 개 매장의 문을 닫는 대신 직원 1만5000명에게 유급 휴가를 주는 ‘옵트 아웃사이드(OptOutside)’ 캠페인을 벌입니다.최순화 동덕여대 국제경영학과 교수READMORE[팝콘 경제학] '개미'는 모여봤자 '개미'일 뿐이라고?...대세의 힘은 강하다집단의 힘은 강합니다. 그들의 생각이 곧 현실이 되기 때문입니다. 대세라고도 할 수 있습니다. 찰스 다윈의 자연 선택설에 따르면 환경에 적응하지 못한 종(種)은 도태됩니다. 늘 변하는 환경 속에서 개인의 유일한 의무는 대세가 어디를 향하고 있는지 깨어 있는 것이 아닐까요.김준목 경제 칼럼니스트(미래에셋증권 고객자산배분팀)READMORE[지난WEEKLYBIZLETTER챙겨보기][#398]""통신 없인AI못 크고,AI없인 통신 못 버틴다""click[#399]""지금 중국은 가장 불확실하고 위험한 시기""click[#400]화석 발굴 개수로 돈 줬더니, 뼈 다 쪼개더라click[#401]""AI가 있는 한, 인간 뇌 지도 완성은 시간문제""click'마케팅 천재' 스위프트, 대중 보복심리 꿰뚫었다[#402]click'레드 스위프' 감세 속도전··· 美경제 부흥이냐, 빚더미냐[#403]click스팸함으로 간다구요?주소록에letter@chosun.com을 추가해주세요!스팸함으로 간다구요?주소록에letter@chosun.com을 추가해주세요!WEEKLYBIZ뉴스레터를 추천하고 싶다면 이 링크를 전달해 주세요☞https://page.stibee.com/subscriptions/146096공유하기게시하기웹에서 보기조선일보 다른 뉴스레터 구독위비 뉴스레터 구독조선일보중구 세종대로 21길 33 724-5114수신거부WEEKLYBIZ뉴스레터 구독하기 ☞https://page.stibee.com/subscriptions/146096"
2024-11-13,[경제계 인사] 코오롱인더스트리 대표이사 허성 외,"코오롱그룹의 주력 계열사 코오롱인더스트리 대표이사 사장에 허성 코오롱ENP대표이사 부사장이 승진 내정됐다. 이 회사는 화학·산업 소재의 제조부문과FnC(패션)부문으로 나뉘는데 허 신임 사장은 제조부문을 총괄한다.코오롱그룹은 12일 단행한 정기 사장단 인사에서 그룹의 중국 지주사 대표로 유석진 코오롱인더스트리FnC대표를 겸직 발령내, 글로벌 패션 시장을 본격 공략하기로 했다.BMW·볼보 등 수입차 딜러 사업을 하는 코오롱모빌리티그룹은 이번에 자동차사업과 신사업 부문으로 나눠, 각각 강이구 코오롱베니트 대표(겸직)와 최현석 전무를 각자 대표이사로 선임했다.플라스틱 등 소재기업인 코오롱ENP대표는 김영범 코오롱인더스트리 대표, 자동차 시트 등 원단 가공 전문기업인 코오롱글로텍 대표에는 재무를 총괄했던 정덕용 상무가 각각 내정됐다.▲㈜코오롱▷전무 이수진▷상무 박성중▷상무보 최유정▲코오롱인더스트리제조부문▷전무 박연호▷상무 공원석 김선태 나영일 배진철 이민혁▷상무보 김재철▲코오롱인더스트리FnC부문▷전무 문희숙 안태준▷상무 손형오▷상무보 김정은 김지택▲코오롱글로벌▷부사장 송혁재▲코오롱글로텍▷상무보 권영훈▲코오롱ENP▷상무보 김종오▲코오롱생명과학▷상무보 송영선▲로터스카스코리아▷상무보 김찬기▲코오롱미래기술원▷상무 최헌식노진서LX홀딩스 사장, 하우시스 대표 겸임LX그룹은 노진서LX홀딩스 사장이LX하우시스 대표이사를 겸임하기로 했다고 12일 밝혔다.노 사장은 한주우LX하우시스CPO(최고생산책임자)와 각자 대표를 맡는다.▲LX하우시스▷상무 김우홍 민병기 유혜종▲LX인터내셔널▷전무 강성철▷상무 최민▲LX판토스▷전무 김춘우▷상무 오근택 김성욱 최양옥▲LX세미콘▷부사장 나준호▷전무 윤호권 조장호▲미래에셋증권◇부문대표▷PWM김화중▷WM1 최준혁▷WM2 이성우▷연금RM1 류경식▷연금RM2 양희철▷연금RM3 이종길▷연금혁신 박신규▷투자전략 김민균▷그룹위험 관리 노용우▷Global경영관리 김승욱◇해외법인장▷미래에셋증권 런던법인 김민태◇부사장▷IB2부문 주용국▷파생부문 김연추◇전무▷채권부문 이재현▷리스크관리부문 이재용▷인재혁신부문 이기상▷미래에셋증권(인도) 유지상◇상무▷Trading사업추진본부JonathanRobertSweemer▷PassiveMarketMaking팀 장천기▷채권상품운용본부 배원준▷Equity투자금융팀 이건명▷고용보험기금운용본부 양우석▷Global경영관리본부 계경태▷Global전략팀 문지현▷투자센터창원WM류향수▷투자센터대구WM여재동▷투자센터판교WM오재환▷Sage솔루션2본부 김화중▷Sage솔루션1본부 류희석▷연금1부문RM2본부영업2팀 김현욱▷연금본부 최종진▷결제본부 김영윤▷리서치센터 박희찬▷정보보호본부 사재식▷WM혁신본부 손병호▷홍보팀 엄호천▷재무본부 임용석▷혁신추진단 김민진▷미래에셋증권(싱가포르) 성준엽▷미래에셋증권(홍콩) 이지연▷미래에셋증권(베트남) 이동원▲미래에셋생명◇부문대표▷GA영업 민유식◇전무▷대표이사 황문규◇상무▷자산운용본부 배영식▷디지털본부 이정기▷변액운용본부 위득환▲미래에셋자산운용◇전무▷채권운용2본부 신재훈▷법무실 박종찬▷홍보실 김범석▷미래에셋자산운용(홍콩) 조완연◇상무▷주식운용2본부 문일권▷전략ETF운용본부 이경준▷ITO부문 조정오▲에너지인프라자산운용◇상무▷운용본부 김용수▲미래에셋금융서비스◇전무▷경영혁신부문 김수진▲미래에셋캐피탈◇상무▷감사실 박인찬▷경영혁신본부 박광주▷신성장투자 1본부 이충환▷투자관리실 이재구▲미래에셋벤처투자◇전무▷PE본부 홍동희◇상무▷경영관리본부 박준엽"
2024-11-05,밸류업 상품 13종 출격… 증시 상승세 이끌까,"ETF12개,ETN1개 상장그래픽=백형선정부의 밸류업(가치 개선) 정책을 지원하기 위한 코리아 밸류업 지수가 탄생한 지 한 달여 만에 이를 바탕으로 하는 투자 상품인ETF(상장지수펀드) 12종과ETN(상장지수증권) 1종이 4일 일제히 출시됐다. 상장 규모는 약 5000억원이다.지난 9월 30일 발표된 코리아 밸류업 지수는 4일까지 1.45% 올랐다. 같은 기간 코스피(0.17% 하락)보다는 높지만, 시장이 깜짝 놀랄 만한 수준은 아니다. 관련ETF,ETN출시로 신규 자금이 들어와 밸류업 지수를 더욱 끌어올릴 수 있을지 관심이 모아지고 있다.그래픽=백형선KB금융 넣고, 고려아연 빼고ETF중 3개는 액티브형이다. 액티브형은 펀드 매니저가 적극적으로 운용해서 밸류업 지수보다 높은 운용 성과를 목표로 한다. 그러다 보니 밸류업 지수를 기준으로 해서 저평가됐거나 펀더멘털(기초 체력)이 개선된 종목은 비중을 확대하고, 고평가됐거나 펀더멘털이 하강한 종목은 비중을 축소했다. 또 새롭게 지수에 편입될 것으로 예상되는 종목은 선제적으로 편입했다.대표적으로 트러스톤자산운용의 ‘코리아밸류업액티브 상장지수펀드(ETF)’는 밸류업 지수에서 탈락한KB금융,NH투자증권, 삼성증권 같은 금융사와LS,LG전자,LG화학,LF등 범LG그룹 계열사들을 포함시켰다.KB금융의 비중은 5.83%로 현대차2우B((5.94%)에 이어 두 번째다.KB금융이 주가순자산비율(PBR) 요건 등을 충족시키지 못해 밸류업 지수에선 탈락했지만, 지난달 24일 발표한 밸류업 공시에 대한 긍정적인 평가로 지수 편입이 예상된다는 것이다.대신, 사모펀드MBK·영풍과 경영권 분쟁 중인 고려아연, 지배 구조 개편 중인 두산밥캣은 밸류업 지수에는 포함됐지만ETF투자 종목에서는 빠졌다. 경영권 분쟁과 지배 구조 개편 과정에서 주주 이익이 희생될 여지가 많다는 이유다. 삼성액티브자산운용의 ‘KoAct코리아밸류업액티브ETF’도KB금융을 넣고, 고려아연과 두산밥캣은 빼는 식으로 투자 종목군을 구성했다.액티브 펀드 중 타임폴리오자산운용의 ‘TIMEFOLIO코리아밸류업액티브ETF’는 특별히 기업들을 넣고 빼지는 않고 밸류업 지수 구성 종목 중 시가총액이 큰 기업들을 중심으로 투자한다.SK하이닉스가 14.96%로 가장 비중이 높고, 그다음이 삼성전자(9.17%), 현대차(7.56%) 순이다.패시브ETF는 수수료 경쟁운용사들이 가장 많이 출시한 상품은 패시브 펀드다. 패시브 펀드란, 펀드 매니저의 적극적인 개입 없이 밸류업 지수 움직임을 추종하는 것이다. 제품별로 특색 있게 만들기 어렵다 보니, 수수료 경쟁이 치열하다.현재 가장 낮은 보수를 받는 곳은 미래에셋자산운용의 ‘TIGER코리아밸류업ETF’와KB자산운용의 ‘상장하는 ‘RISE코리아밸류업ETF’다. 보수를 0.008%만 받는다. 그다음이 키움투자자산운용의 ‘KOSEF코리아밸류업ETF’와 한화자산운용의 ‘PLUS코리아밸류업ETF’로 보수는 0.009%다. 보수 ‘0.001%포인트’ 차이를 두고 최저 보수 경쟁이다. 김남기 미래에셋자산운용ETF운용부문 대표는 “동일 지수를 추종하더라도 투자 기간이 길어질수록 보수가 수익률에 영향을 끼치기 때문에 낮은 보수의 상품을 선택하는 것이 효과적”이라고 말했다.신한자산운용은 밸류업ETF중 유일하게 배당재투자 전략 상품인 ‘SOL코리아밸류업TR’을 출시했다. 배당재투자란, 투자자가 배당금을 회사 주식에 다시 투자할 수 있도록 하는 전략이다.삼성증권이 출시한 ‘삼성 코리아 밸류업TR상장지수증권(ETN)’은 운용사가 아닌 증권사가 운용하는 유일한 밸류업ETN이다. 이 상품도 배당금은 모두 재투자한다. 다만, 펀드가 청산되지 않는 한 만기가 없는 운용사의ETF들과 달리 삼성 코리아 밸류업TRETN은 만기일이 2034년 10월 30일이다. 김정현 신한자산운용ETF사업본부장은 “현재 밸류업 지수의 배당수익률은 2% 수준으로 매달 배당이 나오는 월배당 상품으로는 투자 매력도가 높지 않다”며 “배당재투자로 수익이 증폭되는 스노우볼 효과로 총수익을 극대화하는 게 효율적”이라고 말했다."
2024-07-18,"9월에 나올 밸류업 지수, 후보 종목 10개 뽑아봤더니","증권가 “밸류업 추종자금 1조 넘을 것”나만의 지수 ‘다이렉트 인덱싱’ 활용법[왕개미연구소]“가을에 나올 코리아 밸류업 지수는 추종 자금이 1조원은 족히 넘을 겁니다.“(펀드매니저 A씨)거래소가 9월에 선보일 ‘코리아 밸류업 지수’에 대한 관심이 높아지고 있다. 코리아 밸류업 지수는 정부가 한국 증시 저평가를 해소하기 위해 진행하고 있는 밸류업(기업 가치 개선) 정책의 일환이다. 통상 새 지수가 나오면 이를 추종하는 상장지수펀드(ETF) 등이 만들어지고, 국민연금과 같은 기관·외국인 자금이 유입돼 편입 종목 주가에는 호재다.다만 밸류업 지수가 어떤 기준으로 기업들을 골라 담을지는 자세히 알려지지 않았다. 정부와 거래소는 업계와 전문가들의 의견을 수렴해 수익성과 시장 평가가 양호한 기업들을 중심으로 만들겠다고만 밝혔다. 지난해 나온 일본판 밸류업 지수인 ‘JPX프라임150지수’를 참고할 것이란 예상도 있다. 이는 프라임 시장 내 1600여 상장사 중 자본 이익률(수익성 지표)과PBR(주가순자산비율) 등 지표가 우수한 기업 150곳으로 구성돼 있다.일러스트=조선디자인랩 정다운이미 발 빠른 여의도 펀드매니저들은 밸류업 지수 수혜를 받을 종목들로 포트폴리오를 교체하는 중이다. 개인들은 다가올 이벤트에 어떻게 대비하면 좋을까?전문가들은 미국 등 선진국에서 인기인 ‘다이렉트 인덱싱(DirectIndexing)’ 서비스를 고려해 보라고 권한다. 다이렉트 인덱싱이란, 개인 투자자가 직접 펀드매니저가 되어 개별 종목을 골라 맞춤형 포트폴리오를 만들고 투자하는 것이다. 기성복이 아니라 맞춤복을 원하는 투자자들에게 제격이다.국내 주식 다이렉트 인덱싱은 현재NH투자증권과KB증권 등 두 곳이 제공 중이다. 미래에셋증권도 지난 5월 서비스를 출시했는데, 현재는 미국 주식과 미국ETF로만 지수를 만들 수 있다. 국내 주식을 추가하는 방안은 검토 중이다.그래픽=조선디자인랩 정다운18일NH투자증권에 의뢰해 밸류업 수혜 유망주(株)들로 구성된 지수를 만들어 봤다. 각 증권사 앱에 마련돼 있는 ‘다이렉트 인덱싱’ 코너에 접속한 뒤, 투자자 스스로 순이익, 자본총계 등 62개 조건 중에서 본인 취향에 맞게 펀드를 만들 수 있다. 밸류업 지수 후보군과 관련해선,NH투자증권은 주가순자산비율(PBR·낮을수록 저평가)이 0.3~0.8배이면서 자기자본이익률(ROE)은 상위 30% 이내이고, 배당성향이 0~30%인 대형 우량주를 추천했다.장재영NH투자증권 자산관리전략부장은 “밸류업 수혜주로는 주가가 청산 가치에도 못 미치는 저PBR주가 자주 거론되는데, 저PBR주 중엔 밸류트랩(장기 저평가)에 빠져 돈도 못 버는 소외주가 많기 때문에 유의해야 한다”고 했다.이런 조건에 따라 ‘다이렉트 인덱싱’ 서비스에서 10개 대형주를 뽑아 봤더니, 현대차, 신한지주, 삼성물산, 현대모비스, 하나금융지주 등이 상위권에 포진했다<표 참고>. 최종적으로 지수를 만들고 나면, 과거 1년치 성과도 확인해 볼 수 있다. 계좌에서 내가 만든 지수로 자문계약을 하고 돈을 입금하면 끝이다. 리밸런싱(Rebalancing·정기적 변경) 주기는 1개월~1년 단위다. 수수료는 매매할 때만 0.01% 떼인다."
