date,title,content
2024-08-06,외국인 ‘셀코리아’ 시작됐나…하루 1.5조 주식 순매도 폭탄,"외국인의 ‘엑소더스(대탈출)’가 시작된 걸까. 미국발 경기침체 공포에 투자자들의 자금 이탈과 함께 국내 증시가 폭락하면서 외국인의 ‘셀코리아’ 움직임이 감지되고 있다.5일 한국거래소에 따르면 이날 오후 외국인들은 유가증권시장에서 주식 현물을 1조4700억원, 코스피200선물을 6900억원 순매도하는 등 매도 폭탄을 쏟아냈다. 이는 올 들어 최대 순매도 규모를 기록한 지난 5월 31일 1조3368억원을 크게 웃도는 액수다.신재민 기자주식 선물의 경우 외국인은 지난 2일 1조8922억원을 순매도해 지난해 8월 2일 이후 1년 만에 최대 매도 규모를 기록했다. 외국인들은 국내 증시가 연중 고점을 찍은 뒤 하향세를 나타내기 시작한 지난 7월 12일~8월 2일까지 국내 증시(코스피+코스닥시장)에서 총 2조5720억원어치의 주식을 순매도하며 지수를 끌어내렸다. 이는 같은 기간 기관들의 순매도액 8880억원의 3배에 달하는 규모로, 개인투자자들이 3조8190억원을 순매수했지만 지수 하락을 막기엔 역부족이었다. 이 기간 동안 외국인이 순매도 우위를 보인 날은 10일로, 순매수 우위를 보인 날(6일)보다 두 배 가까이 많았다.이에 따라 올해 상반기 정부의 ‘밸류업(증시부양)’ 정책과 맞물려 역대 최대 규모로 한국 증시를 사들인 외국인의 ‘바이 코리아’ 기조가 꺾인 것 아니냐는 관측이 제기된다. 외국인의 국내 상장 주식 보유액은 지난 6월 말 기준 859조2000억원으로, 전체 시가총액의 30% 비중을 차지하고 있다.신재민 기자금융감독원에 따르면 올 상반기 외국인의 국내 상장주식 순매수액은 총 22조9000억원으로, 통계를 집계하기 시작한 1988년 이후 최고치였다. 월별로도 외국인은 올해 들어 1월 2조9520억원, 2월 8조2410억원, 3월 5조1100억원, 4월 2조4110억원, 6월 5조2360억원 등 5월 순매도를 제외하고는 꾸준히 순매수세를 이어왔다. 하지만 7월 중순 이후 매도세가 확대되면서 7월 순매수액은 1조7150억원으로 크게 줄었다.이처럼 최근 발생한 외국인 자금의 급격한 이탈은 미국 빅테크(거대 기술기업) 주가 조정과 함께 미국 경기침체 우려 확산, 엔화 절상에 따른 엔 캐리 트레이드(엔화를 저리로 빌려 고수익 자산에 투자) 청산 본격화 등 유동성 환경이 급격히 악화된 탓이라는 분석이 나온다.여기에 하마스 최고 정치지도자 이스마일 하니예가 암살된 이후 악화일로인 중동 사태, 워런 버핏이 이끄는 버크셔해서웨이의 애플 지분 축소, 엔비디아의 신제품 설계 결함설 등 다수의 악재가 한꺼번에 겹쳤다.다만 전문가들은 이 같은 외국인 투매가 장기화하진 않을 것으로 보고 있다. 김석환 미래에셋증권 연구원은 “실제로 경기 침체가 오려면 유가가 더 내리고 구리 가격도 하락해야 하는데 구리의 경우 반등 중이고, 중국 증시도 선방하고 있다”며 “이번 매도세는 단기적인 현상일 가능성이 크다”고 말했다. 그는 이어 “한국 시간으로 이날 밤 발표되는 미 서비스업 지수가 시장 예상치에 부합할 경우 외국인 자금이 (한국 증시에) 돌아올 수 있을 것”이라고 덧붙였다."
2024-08-05,밸류업 기대한다더니…외국인 K증시 엑소더스 오나 ‘투매 쇼크’,"5일 오후 코스피 지수는 장중 8％ 넘게 급락하며 2450 아래로 내려가 20분간 거래가 중단되는 서킷브레이커가 발동됐다. 서킷브레이커는 전일 종가 지수 대비 8% 이상 하락한 상태가 1분간 지속하는 경우 발동된다. 연합뉴스외국인의 ‘엑소더스(대탈출)’가 시작된 걸까. 미국발 경기침체 공포에 투자자들의 자금 이탈과 함께 국내 증시가 폭락하면서 외국인의 ‘셀코리아’ 움직임이 감지되고 있다.5일 한국거래소에 따르면 이날 오후 외국인들은 유가증권시장에서 주식 현물을 1조4700억원, 코스피200선물을 6900억원 순매도하는 등 매도 폭탄을 쏟아냈다. 이는 올 들어 최대 순매도 규모를 기록한 지난 5월31일 1조3368억원을 크게 웃도는 액수다.주식 선물의 경우 외국인은 지난 2일 1조8922억원을 순매도해 지난해 8월2일 이후 1년 만에 최대 매도 규모를 기록했다. 외국인들은 국내 증시가 연중 고점을 찍은 뒤 하향세를 나타내기 시작한 지난 7월12일~8월2일까지 국내 증시(코스피+코스닥시장)에서 총 2조5720억원 어치의 주식을 순매도하며 지수를 끌어내렸다. 이는 같은 기간 기관들의 순매도액 8880억원의 3배에 달하는 규모로, 개인 투자자들이 3조8190억원을 순매수했지만 지수 하락을 막기엔 역부족이었다. 이 기간 동안 외국인이 순매도 우위를 보인 날은 10일로, 순매수 우위를 보인 날(6일)보다 두 배 가까이 많았다.이에 따라 올해 상반기 정부의 ‘밸류업(증시부양)’ 정책과 맞물려 역대 최대 규모로 한국 증시를 사들인 외국인의 ‘바이 코리아’ 기조가 꺾인 것 아니냐는 관측이 제기된다. 외국인의 국내 상장주식 보유액은 지난 6월 말 기준 859조2000억원으로, 전체 시가총액의 30% 비중을 차지하고 있다.금융감독원에 따르면 올 상반기 외국인의 국내 상장주식 순매수액은 총 22조9000억원으로, 통계를 집계하기 시작한 1988년 이후 최고치였다. 월별로도 외국인은 올해 들어 1월 2조9520억원, 2월 8조2410억원, 3월 5조1100억원, 4월 2조4110억원, 6월 5조2360억원 등 5월 순매도를 제외하고는 꾸준히 순매수세를 이어왔다. 하지만 7월 중순 이후 매도세가 확대되면서 7월 순매수액은 1조7150억원으로 크게 줄었다.이처럼 최근 발생한 외국인 자금의 급격한 이탈은 미국 빅테크(거대 기술기업) 주가 조정과 함께 미국 경기침체 우려 확산, 엔화 절상에 따른 엔 캐리 트레이드(엔화를 저리로 빌려 고수익 자산에 투자) 청산 본격화 등 유동성 환경이 급격히 악화된 탓이라는 분석이 나온다.여기에 하마스 최고 정치지도자 이스마일 하니예가 암살된 이후 악화일로인 중동 사태, 워런버핏이 이끄는 버크셔해서웨이의 애플 지분 축소, 엔비디아의 신제품 설계 결함설 등 다수의 악재가 한꺼번에 겹쳤다.다만 전문가들은 이 같은 외국인 투매가 장기화하진 않을 것으로 보고 있다. 김석환 미래에셋증권 연구원은 “실제로 경기 침체가 오려면 유가가 더 내리고 구리 가격도 하락해야 하는데 구리의 경우 반등 중이고, 중국 증시도 선방하고 있다”며 “이번 매도세는 단기적인 현상일 가능성이 크다”고 말했다. 그는 이어 “한국 시간으로 이날 밤 발표되는 미 서비스업 지수가 시장 예상치에 부합할 경우 외국인 자금이 (한국 증시에) 돌아올 수 있을 것”이라고 덧붙였다."
2022-12-27,반도체·금리에 발목잡힌 올 증시…외국인들 4조 ‘셀 코리아’,"외국인의 ‘셀 코리아’는 진행형이다. 올해에만 유가증권시장에서 4조원 넘는 주식을 팔아 치웠다. 반도체에 치우진 데다 금리 인상과 환율 등에 취약한 구조, 글로벌 스탠다드를 역행하는 각종 정책과 규제가 외국인이 한국 시장을 외면하는 요소로 꼽힌다.그래픽=김현서kim.hyeonseo12@joongang.co.kr26일 한국거래소에 따르면 외국인 투자자는 12월 들어 이날까지 1조3221억원을 순매도했다. 연간으로 보면 외국인은 4조1823억 원어치를 순매도했다. 외국인은 코로나 19가 본격화한 2020년 22조1808억원, 코스피가 사상 최고치를 기록했던 지난해 25조9984억원을 순매도한 데 이어 올해도 ‘팔자’ 행렬을 이어갔다.‘셀 코리아’는 ‘셀 반도체’의 동의어다. 삼성전자(18.9%)와SK하이닉스(3.1%)가 코스피에서 차지하는 비중은 20%가 넘는다. 반도체를 사고파는 외국인의 움직임에 시장은 울고 웃었다.외국인은 지난 9월까지 10조2111억 원어치의 삼성전자 주식을 던졌다. 하지만 지난 10월(1조5059억원)과 11월(7393억원)에는 다시 바구니에 담았다. 이 기간 코스피는 14.71% 상승했다. 하지만 이달 들어 다시 삼성전자를 팔아치우자(4076억원) 코스피 역시 6.28% 넘게 하락했다. 올 한해 외국인이 삼성전자를 순매도한 금액은 8조3737조원에 달한다.전 세계적인 반도체 업황 둔화로 매력이 사라진 탓이다. 이승우 유진투자증권 리서치센터장은 “경기가 좋을 때 글로벌 기업이 설비 투자를 많이 해 현재 재고가 많이 남은 상황”이라며 “(이에 대응하려면) 수요가 늘거나 공급을 줄이는 방법(감산)밖에 답이 없는데 삼성전자가 감산하지 않겠다는 상황이라 외국인의 반도체 업종에 대한 우려가 커지고 있는 상황”이라고 말했다.국내 증시가 금리 인상·환율·경기 침체 등 대외 변수에 취약한 것도 외국인 투자자 입장에서는 투자를 주저하게 하는 요인이다. 금리 인상기에는 한국 등 신흥국에 대한 투자 심리가 나빠지는 상황에서,IT관련 기술주 등 성장주를 중심으로 미래 실적에 대한 의구심이 커지면서 큰 폭의 조정을 받는다.서상영 미래에셋 미디어콘텐츠 본부장은 “한국 증시는 네이버·카카오 등IT업종과 이차전지 등 기술주가 많기 때문에 외국인 입장에서 금리 인상기에 매력이 떨어지는 것”이라고 분석했다.실제 올해 외국인 순매도 상위주에는 삼성전자(8조3737억원), 네이버(3조582억원), 카카오(1조6940억원), 에코프로비엠(8783억원), 카카오뱅크(6962억원) 등이 이름을 올렸다. 정명지 삼성증권 정보팀장은 “한국처럼 수출 비중이 큰 시장은 세계 경기의 선행 지표와 같은 역할을 한다”며 “세계 경기가 좋아지기 전에 먼저 오르고 경기가 나빠지면 다른 시장보다 언더퍼폼(시장 평균 하회)하는 경향이 있다”고 분석했다.글로벌 스탠다드와 맞지 않은 정책도 외국인이 한국 증시를 외면하게 하는 요소다. 골드만삭스·JP모건 등 전 세계 160개 글로벌 투자자·금융기관을 회원사로 둔 아시아증권산업금융시장협회(ASIFMA)는 지난달 한국 자본시장에 대한 백서를 통해 “코스피 시장의 외국인 지분율 하락은 시장 구조 문제와 관련이 있다”고 지적했다. 그러면서 백서는 ▶제한적인 원화 거래 ▶공매도 금지 조치 장기화 ▶글로벌 투자자들에게 제한된 정보 접근성 등을 대표적인 제약 사항으로 꼽았다."
2022-12-26,반도체·규제에 발목잡힌 韓 증시…외국인 올해 4조 셀 코리아,"26일 서울 중구 하나은행 명동점 딜링룸 전광판에 코스피 지수가 전 거래일보다 3.45포인트(0.15%) 오른 2317.14를 나타내고 있다. [뉴스1]외국인의 '셀 코리아'는 진행형이다. 올해에만 유가증권시장에서 4조원 넘는 주식을 팔아 치웠다. 반도체에 치우진 데다 금리 인상과 환율 등에 취약한 구조, 글로벌 스탠다드를 역행하는 각종 정책과 규제가 외국인이 한국 시장을 외면하는 요소로 꼽힌다.26일 한국거래소에 따르면 외국인 투자자는 12월 들어 이날까지 1조3221억원을 순매도했다. 연간으로 보면 외국인은 4조1823억원어치를 순매도했다. 외국인은 코로나 19가 본격화한 2020년 22조1808억원, 코스피가 사상 최고치를 기록했던 지난해 25조9984억원을 순매도한 데 이어 올해도 ‘팔자’ 행렬을 이어갔다.그래픽=김현서kim.hyeonseo12@joongang.co.kr━외국인 올해 삼전 8조원치 순매도'셀 코리아'는 '셀 반도체'의 동의어다. 삼성전자(18.9%)와SK하이닉스(3.1%)가 코스피에서 차지하는 비중은 20%가 넘는다. 이들 반도체 업체의 주가가 시장의 흐름을 가르는 주요 변수인 셈이다. 실제로 반도체를 사고파는 외국인의 움직임에 시장은 울고 웃었다.외국인은 지난 9월까지 10조2111억원어치의 삼성전자 주식을 던졌다. 하지만 지난 10월(1조5059억원)과 11월(7393억원)에는 다시 바구니에 담았다. 이 기간 코스피는 14.71% 상승했다. 하지만 이달 들어 다시 삼성전자를 팔아치우자(4076억원)’에 나서면서 코스피 역시 6.28% 넘게 하락했다.올 한해 외국인이 삼성전자를 순매도한 금액은 8조3737조원에 달한다. 삼성전자 주가는 올 초 대비 26.3% 떨어지며 ‘7만전자(7만8600원)’에서 ‘5만전자(5만7900원)’로 추락했다.외국인 투자자가 셀 반도체에 나선 것은 전 세계적인 반도체 업황 둔화로 매력이 사라진 탓이다. 황민성 삼성증권 연구원은 “코로나 19를 거치면서 전 세계적으로 스마트폰·가전 등의 수요를 당겨 쓴데다 향후 경기 둔화로 인한 수요에 대한 불확실성이 커졌기 때문”이라고 분석했다.서울의 한 삼성디지털프라자의 모습. 글로벌 수요 위축으로 반도체 업황이 둔화하면서 삼성전자 주가는 올들어 26.3% 하락했다. [뉴스1]이승우 유진투자증권 리서치센터장 역시 “경기가 좋을 때 글로벌 기업이 설비 투자를 많이 해 현재 재고가 많이 남은 상황”이라며 “(이에 대응하려면) 수요가 늘거나 공급을 줄이는 방법(감산)밖에 답이 없는데 삼성전자가 감산하지 않겠다는 상황이라 외국인의 반도체 업종에 대한 우려가 커지고 있는 상황”이라고 말했다.━금리 인상에 취약한 '성장주' 비중 높아국내 증시가 금리 인상·환율·경기 침체 등 대외 변수에 취약한 것도 외국인 투자자 입장에서는 투자를 주저하게 하는 요인이다. 금리 인상기에는 한국 등 신흥국에 대한 투자 심리가 나빠지는 상황에서,IT관련 기술주 등 성장주를 중심으로 미래 실적에 대한 의구심이 커지면서 큰 폭의 조정을 받는다.서상영 미래에셋 미디어콘텐츠 본부장은 “세계적으로 보더라도 코로나 19 이후 급격하게 올랐던 기술주들이 금리 인상 과정에서 조정을 거치고 있는 중”이라며 “한국 증시는 네이버·카카오 등IT업종과 이차전지 등 기술주가 많기 때문에 외국인 입장에서 금리 인상기에 매력이 떨어지는 것”이라고 분석했다.그래픽=김현서kim.hyeonseo12@joongang.co.kr실제 올해 외국인 순매도 상위주에는 삼성전자(8조3737억원), 네이버(3조582억원), 카카오(1조6940억원), 에코프로비엠(8783억원), 카카오뱅크(6962억원) 등이 이름을 올렸다.정명지 삼성증권 정보팀장은 “한국처럼 수출 비중이 큰 시장은 세계 경기의 선행 지표와 같은 역할을 한다”며 “세계 경기가 좋아지기 전에 먼저 오르고 경기가 나빠지면 다른 시장보다 언더퍼폼(시장 평균 하회)하는 경향이 있다”고 분석했다.━""원화 환전 어려움에 韓 증시 기피""정책 불확실성이 높은 부분도 외국인 입장에서 고개를 갸웃하게 하는 요소다. 국회는 지난 22일에야 금융투자소득세(금투세) 시행을 2년 유예하기로 최종 결정했다. 하지만 대주주 양도세 부과 여건 상향은 부결되는 등 양도세 회피 물량에 대한 투자자의 우려는 여전한 상황이다. 시장이 가장 싫어하는 불확실성이 투자자의 발목을 잡고 있는 형국이다.정책 요소는 글로벌 투자자들이 꾸준히 제기해 온 문제기도 하다. 골드만삭스·JP모건 등 전 세계 160개 글로벌 투자자·금융기관을 회원사로 둔 아시아증권산업금융시장협회(ASIFMA)는 지난달 한국 자본시장에 대한 백서를 통해 “코스피 시장의 외국인 지분율 하락은 시장 구조 문제와 관련이 있다”고 지적했다.그러면서 백서는 ▶제한적인 원화 거래 ▶공매도 금지 조치 장기화 ▶글로벌 투자자들에게 제한된 정보 접근성 등을 대표적인 제약 사항으로 꼽았다.황세운 자본시장연구원 선임연구위원은 “공매도의 경우 글로벌 스탠다드로 봤을 때 문제없는 행위가 한국 주식 시장에서는 제한되는 경우가 많다”며 “여기에 실시간 투자 정보 공개로 인한 전략 노출 문제, 원화 역외 거래의 어려움 등이 외국인 투자자들 입장에서 국내 증시를 기피하게 하는 요소”라고 지적했다."
2024-02-13,日증시 34년 만에 '불장'…10년 전 빅 픽처 '이토 보고서' 통했다 [코리아 디스카운트 끝내자 <1>],"지난 9일 도쿄에서 한 시민이 일본 증시 현황판 앞을 걸어가고 있다. 주말을 앞둔 이날 니케이225 지수는 34년 만에 3만7000선을 돌파했고, 3만6897.42로 마감했다. 연합뉴스""  34년만의 불장”  ""일본 증시가 30여년 만에 날아오르고 있다. 지난 9일 닛케이225는 장중 한 때 3만7000선을 돌파해 3만6897에 마감했다. 이 지수가 3만7000선을 넘은 건 1990년 2월 이후 처음이다.일본 증시의 환골탈태는 어느 날 갑자기 이뤄진 게 아니다. 일본 정부는 2013년부터 10년 넘게 증시 부양 프로그램을 진행해 왔다. 한국 금융당국이 추진중인 ‘밸류업 펀드(가칭 코리아프라임지수)’도 일본이 원조다. 일본은 지난해 수익성과 가치평가 지표가 우수한 기업들로 구성된 ‘JPX프라임 150’지수를 출시하고, 올 들어선 이 지수를 추종하는ETF(상장지수펀드)도 상장했다. 한국도 일시적인 대증요법이 아닌, 꾸준한 체질 개선에 나서야 한다는 목소리가 나온다.김영옥 기자━10년전 쏜 세번째 화살 ‘명중’2013년 출범한 아베 정부는 ‘잃어버린 30년’을 극복할 경제 성장 전략으로 ‘세 개의 화살(금융·재정·성장)’전략을 제시했다. 이중 세 번째 ‘성장전략’의 일환이 금융시장 글로벌화였다. 해외 투자자금을 유치해 경제 성장의 마중물로 쓰겠다는 구상이었다.아베 내각의 경제 책사였던 이토 구니오 히토츠바시대학 교수는 ‘주주권을 강화하는 기업 지배구조 개선이 일본 경제에 활력을 불러일으킬 수 있다’는 ‘이토 보고서’(2014년 8월)를 발표했다. 이토 교수는 자기자본수익률(ROE)에ESG(환경·사회·지배구조개선)를 곱한 ‘ROESG’개념을 처음으로 제시했다. 기업이 지속가능한 성장을 위해 수익성과ESG를 동시에 강화해야한다는 의미다. 이토 보고서는 개정을 거듭하며 지금도 일본의 대표기업 인증 기준인 ‘지속 가능성 전환(SX) 기업 ’선정에 활용되고 있다.━스튜어드십·거버넌스 쌍끌이 전략김지윤 기자일본 증시부양의 양대 정책은 ‘스튜어드십코드’와 ‘거버넌스코드’다. 스튜어드십코드에선 투자자들이 지속가능 이슈에 대해 기업과 적극 대화할 것을 강조했고, 거버넌스코드에선 기업이 사업 경쟁력 확보와 투자자 수익을 높이는 데 집중할 것을 강조했다.특히 일본공적연금(GPIF)이 2017년부터 “투자의사 결정에ESG요소를 반영한다”는 원칙으로 기금을 운용하면서, 일본 기업들도 ‘큰 손’을 유치하기 위해ESG정보를 공시하게 됐다.이후 기시다 내각은 ‘새로운 자본주의’를 선언하며 보다 직접적인 증시 부양책을 내놨다. 일본거래소는 지난해 3월 주가순자산비율(PBR) 1배 이하의 저평가된 상장기업을 대상으로 개선안을 요구했고, 기업들은 지난해에만 9조6000억엔(약 86조원)에 달하는 자사주를 매입하며 랠리에 방아쇠를 당겼다. 이에 외국인 투자자는 일본 증시에서 지난해 3조1000억엔 어치를, 올해 1월 한 달 동안에만 1조9000억엔 어치를 사들였다.━“저축에서 투자로”…증시에 몰리는 日개미올해부터 시행하는 소액투자 비과세제도(NISA) 개정안도 일본 증시에 호재가 될 것으로 기대된다. 비과세 적용기간 한도가 폐지되고, 총 투자 한도가 늘어나는 투자자 우대 정책이기 때문이다. 이지평 한국외대 융합일본지역학부 특임교수는 “일본은 예금 금리는 0%에 머물고 있는 반면 기업의 배당금은 늘고 있어 자산을 늘리려는 장기 투자자들이 늘어나기 시작했다”고 분석했다. 유진투자증권에 따르면 일본의 배당수익률은 1월24일 기준 2.2% 수준으로, 일본 예금금리(10년 정기예금) 0.2% 수준보다 훨씬 높다.지난 9일 도쿄의 일본 증시 현황판 앞을 지나가는 한 시민.AP=연합뉴스김우진 서울대 경영대학원 교수는 “정부 대책이 지수 개발 등 거래소 차원의 과제에 국한돼서는 근본적인 한국 저평가 문제를 해결할 수 없다”며 “지배구조 등 펀더멘털을 근본적으로 수술하겠다는 의지로, 장기적인 시각에서 접근해야 한다”고 강조했다.최진아 미래에셋증권 수석연구원도 “일본은 경제산업성·금융청·GPIF·학계·민간기관 등이 10년 넘게 하나로 뭉친 결과 이제야 지속가능 금융으로 시장 체질이 변하게 된 것”이라며 “나무보다 숲을 봐야 한다”고 조언한다."
