date,title,content
2022-06-10,"외국인 올해 32조 순매도… 한국 증시, 어쩌다 서러운 신세 됐나","[김은정의 뉴스 저격]  고질병 된 ‘코리아 디스카운트’9일 오전 서울 중구 하나은행 본점 딜링룸에서 직원들이 업무를 보고 있다. 이날 코스피지수는 전장보다 7.23포인트(0.28%) 내린 2618.92로 시작했고, 코스닥지수는 1.73포인트(0.20%) 내린 873.22에 개장했다./연합뉴스“한국에 살 만한 주식이 없습니다. 북핵 리스크 때문은 아니고요. 선진국 중엔 단연 미국이고 신흥국 중에서도 대만 같은 매력적인 나라가 있는데 굳이 한국을 사야 할 이유를 못 찾는 거죠.”(외국계 자산운용사 대표 A씨)32조원. 올 들어 이달 8일까지 외국인 투자자들이 한국 증시에서 순매도한 금액이다. 외국인들은 코스피와 코스닥 시장에 상장돼 있는 주식과 상장지수펀드(ETF), 선물·옵션 등을 모두 합쳐 4100조원어치를 사들였지만, 내다 판 금액이 4132조원으로 더 많았다. 이런 ‘셀(Sell) 코리아’ 행렬은 2000년 이후 몇 해를 제외하곤 계속되고 있다.올해 초부터 나타난 외국인들의 거센 매도 행렬은 각국 기준금리 인상 때문에 촉발된 것이긴 하지만, 한국 증시에서 이탈하는 자금은 유독 두드러지는 규모다. 한국 증시는 유사시 가장 먼저 돈을 빼가는 곳. 세계 투자자들 사이에서 그만큼 인기가 없다는 얘기다.한국 증시와 상장 기업들이 인기를 잃어간다는 건 단지 해당 기업에 투자한 주주들에게만 국한된 문제가 아니다. 우리 국민 전체의 노후도 달린 문제다. 국민연금이 국내 주식시장에 투자한 돈이 1분기 말 기준 157조원. 전체 국민연금(930조원) 적립금의 16.9%쯤 된다. 이 돈이 적정한 평가를 받으며 불어날수록 국민도 더 안락한 노후를 보낼 수 있다. ‘코리아 디스카운트(평가절하)’ 고질병은 얼마나 심각한 수준이고, 왜 고쳐지지 않는 걸까.그래픽=백형선한국 증시, 페루·칠레·남아공보다 저평가우리나라 경제 규모는 어느덧 세계 10위에 올라 선진국 소리를 듣고 있지만, 금융시장에서만큼은 선진국 클럽에 명함도 못 내미는 형편이다. 오히려 위상이 뒷걸음질하고 있다.실적이나 자산가치 대비 주가가 얼마나 평가받고 있는지를 보는 지표인PER(주가수익비율)과PBR(주가순자산비율)을 보면 민낯이 드러난다. 지난달 말 기준 코스피 전체PER은 9.9배,PBR은 1.0배 수준이었다. 주가를 주당순이익으로 나눈PER이 두 자릿수가 안 되는 나라는 세계적으로 찾아보기 어렵다. 전 세계 증시 평균PER이 17배, 미국은 21배, 신흥국 평균조차 12배다. 중국, 대만은 물론이고 경제 규모나 증시 규모가 우리보다 작은 칠레(12.4배), 남아공(11.1배), 페루(10.5배) 주식도 한국보다는 후한 평가를 받는다.시가총액이 장부가치 대비 몇 배 수준인지를 보는PBR은 더하다. 현재 한국 증시 전체PBR은 딱 1.0배. 현재 주가가 회사 자산을 다 팔고 청산했을 때 가치밖에 안 된다. 선진국 평균(2.8배)은 물론이고 신흥국 평균(1.6배)보다도 훨씬 낮다. 투자자들이 우리나라와 자주 비교하는 대만은 2.5배나 된다.사정이 이렇다 보니 세계 증시에서 한국 증시의 비율은 역주행 중이다. 세계 기관투자자들이 투자 지표로 삼는 대표적인 지수인MSCIACWI(모건스탠리캐피털인터내셔널 전 세계 지수)에는 선진 23국, 신흥 24국 등 47국의 약 3000종목이 담겨 있다. 이 지수 대비MSCI한국 지수의 비율은 2011년 2.6%에서 올 들어선 1.6%까지 떨어졌다.중국 성장세 약화되자 인기 잃어한국 증시도 반짝 인기를 끌던 때가 있었다. 중국 경제가 두 자릿수 성장률을 기록하며 폭풍 성장하던 2000년대, 세계 투자자들은 한국 증시로 몰렸다. 외국인 투자자들이 중국에 직접 투자하기 어려웠던 때라 한국이 대리(proxy) 투자처로 각광받았던 것이다.여기에 안주하던 한국 경제는 삼성전자·현대차 등 수출 제조업이 먹여 살리는 구조에서 탈피하지 못한 채 중국이 재채기하면 감기 걸리는 약골이 되어갔다. 한국 증시와 중국 증시의 상관계수는 2000년 이후 20년간 평균 0.84에 달한다. 상관계수가 1에 가깝다는 건 그만큼 강하게 연결된 시장이라는 의미다.중국이 외국인 투자자들에게 금융시장을 대폭 개방하면서 지금은 대리 투자처로서 역할을 잃었다. 최근에는 미·중 갈등과 중국 코로나 봉쇄 등이 겹치면서 중국 성장세가 급격히 식어 대(對)중국 산업 비중이 큰 우리나라 증시는 더욱 기피 대상이 되고 있다.최근 미국 중심의 탈(脫)세계화·탈중국 움직임이 가속화되면서 중국과 강하게 연동된 한국 증시는 더욱 어려움을 겪을 것이라는 우려도 크다. 서철수 미래에셋증권 리서치센터장은 “글로벌 공급망 분절에 따른 위험은 아직 우리 주식시장에 반영되지도 않았다”면서 “이런 움직임이 본격화하면 중국 다음으로 한국이 큰 타격을 받을 것”이라고 내다봤다.남발되는 ‘쪼개기 상장’도 저평가 원인또 다른 코리아 디스카운트 요인으로 지목되는 것은 기업들의 ‘쪼개기 상장’ 문제다. 올 초LG화학이 배터리 사업부를 분할해LG에너지솔루션을 상장한 게 대표적 사례다. 핵심 사업부를 빼내 따로 상장하면 기존 회사 주주들은 ‘앙꼬 없는 찐빵’을 든 신세가 되고, 해당 주식 평가가치는 뚝 떨어진다.카카오·네이버·SK등이 자회사·계열사를 줄줄이 상장시켜 기존 주주들을 허탈하게 만들고 있는데, 유독 우리 증시에서 이런 사례가 많아서 문제다. 남길남 자본시장연구원 선임연구위원에 따르면 2010년부터 지난해 사이 신규 상장기업 788곳 중 최대 주주가 또 다른 회사를 상장하거나 인수한 기업을 상장시킨 이른바 ‘모자(母子)기업 동시상장’ 사례가 20%인 157곳에 달했다. 찐빵에서 앙꼬를 빼내 자회사를 상장시키면 모회사 기업가치는 평균 33% 하락했다. 미국·일본 등 선진 시장에서 이런 사례가 없는 건 아니지만, 전체 상장기업 수 대비로는 한국이 10배는 많다는 게 연구원의 분석이다. 한국 기업들의 평균 배당 성향(20%대)과 배당 수익률(1%대)도 세계 최하위권이다.김우진 서울대 경영대 교수는 “구글은 바보라서 알짜 유튜브를 상장 안 하는 게 아니다.PC·휴대폰·플랫폼 등 각종 미래산업을 다 가진 애플도 몰라서 자회사를 상장 안 시키는 게 아니다”라며 “기존 주주의 이익을 현저히 침해하는 이런 동시상장·중복상장 문제가 고쳐지지 않는 한, 한국 증시 디스카운트 문제는 해소되지 않을 것”이라고 말했다.외국인들이 대부분의 한국 주식을 파는 중에도 최근KB·신한·하나·우리 같은 금융주를 주워 담는 것은 역설적이지만 이런 이유 때문이라는 지적도 있다. 이남우 전 메릴린치 한국 공동대표(현 연세대 교수)는 “외국인들이 대주주가 없는 금융주를 사고 있다는 점을 눈여겨볼 필요가 있다. 이들 종목은 쪼개기 상장 같은 거버넌스(지배구조) 리스크가 없기 때문”이라면서 “외국인들 입장에선 상대적으로 이런 문제에서 자유로운 대만에 투자하는 것을 편하게 생각할 수밖에 없다”고 말했다.[’MSCI선진국 지수’ 편입되면 나아질까]정부는 고질적인 코리아 디스카운트 해소 방편으로 ‘MSCI선진국 지수’ 편입에 기대를 걸고 있다. 하지만 이번이 첫 번째 도전은 아니다. 벌써 4수(修)째다.MSCI는 미국 투자은행인 모건스탠리캐피털인터내셔널사가 작성해 발표하는 지수로, 선진(DM)·신흥(EM)·프런티어시장(FM)으로 분류한다. 한국은 중국, 인도 등 25국과 함께 신흥 지수에 포함돼 있다. 한국은 국제통화기금(IMF)과 유엔 등 국제기구에서 선진국으로 분류되지만,MSCI기준에선 아직 신흥국 신세인 것이다. 외환시장 개방이 미흡하다는 등 시장 접근성이 떨어진다는 게 이유다.이 지수를 추종하는 글로벌 자금 규모는 작년 6월 말 기준 16조3000억달러(약 2480조원). 세계 전체 펀드 자산의 약 30%가 이 지수를 따라 움직인다. 한국이 선진국 지수에 편입된다면 선진국에 투자하는 국제 자금이 우리나라 증시로 흘러들게 된다. 자본시장연구원은 이 자금 규모가 50억~360억달러가량 될 걸로 예상한다.MSCI선진국 편입을 위해선 먼저 후보 국가 목록을 뜻하는 관찰 대상국(watchlist)으로 등재돼야 한다.MSCI는 매년 6월 리스트를 발표한다. 관찰 대상국에 오르더라도 최소 1년은 지나야 지수 편입 대상이 되고, 지수 편입은 편입 결정 1년 뒤에 이루어진다. 아무리 빨라도 2024년 이후에나 선진 지수 편입이 가능한 것이다. 이승호 자본시장연구원 선임연구위원은 “선진국 지수에 편입되더라도 자본 유입이나 주가 상승 같은 긍정적 효과가 단기간에 일어나기 어렵다”며 “지수 편입보다는 우리 주식시장의 체질을 강화하는 게 먼저”라고 지적했다."
2022-01-07,1880억 횡령 여파... 오스템임플란트 편입 펀드 줄줄이 신규 판매 중단,"오스템임플란트1880억원 횡령 사건이 벌어진 코스닥 상장사 오스템임플란트에 투자한 펀드들이 줄줄이 신규 판매 중단에 나서면서 파문이 확산되고 있다. 해당 펀드 기존 가입자들의 수익률 하락 가능성 등도 거론되는 상황이다.7일 메리츠증권은 투자자 보호를 위해 ‘IBK중소형주코리아30′ 등 오스템임플란트를 투자 목록에 포함한 펀드 33종의 신규 판매를 중단한다고 공지했다.앞서 신한금융투자는 오스템임플란트 편입 비율이 1% 이상인 펀드 17종에 대한 신규 가입을 제한한다고 공지했다. 해당 펀드 가입자들에게 개별 문자를 통해 “해당 종목 이슈의 향후 전개 상황에 따라 펀드 수익률 변동이 예상된다”고 안내했다. 하나금융투자도 오스템임플란트 편입 펀드 75종을 안내하고 판매를 중단한다고 밝혔다. 미래에셋·한국투자·대신 등 증권사들과KB국민·신한·하나·우리·NH농협 등 5대 은행들도 오스템임플란트가 편입된 펀드 판매를 중단하기로 했다.금융정보 업체 에프앤가이드에 따르면, 작년 9월 기준 오스템임플란트를 담고 있는 국내 펀드는 106개다. 오스템임플란트에 투자된 금액은 총 524억원으로 추산된다.오스템임플란트는 지난 3일부터 거래가 정지된 상태라 현재는 거래 중단 이전의 주가가 펀드 기준 가격에 반영되고 있지만, 횡령 손실이 확정되고 주식 거래가 재개되면 펀드 수익률 손실이 발생할 수 있어 펀드 가입자들의 피해가 우려된다.주식 거래 정지는 상장 적격성 실질 심사 대상 여부가 결정되는 24일까지 지속된다. 만일 실질 심사가 필요하다는 결정이 내려지고, 상장폐지 심사에 착수하면 주식 거래 정지는 최종 결정 때까지 연장된다.나석진 금융투자협회 자산운용부문 대표는 “오스템임플란트 편입 비율이 가장 큰 경우가 7%대로 그렇게 높지는 않다”며 “성급하게 환매하기보다 횡령액 중 회수 가능 규모가 얼마인지, 관리종목으로 지정돼 주요 지수에서 퇴출되는지 등을 확인한 뒤에 신중히 결정하는 것이 좋다”고 했다.하지만 펀드 투자자들의 불안감이 커지는 가운데, 2만여 명에 달하는 오스템임플란트 소액 주주 가운데 일부는 피해 보상 소송 움직임도 보이고 있다. 8일 오스템임플란트 창립 기념일을 앞두고 회사 익명 게시판에 “소액 주주들 빨간 피눈물 흘릴 때 우린 창립 기념일 기념하려고 빨간 랍스터 먹는다. 부럽지?”라는 글과 랍스터 요리 사진이 올려져 논란이 되고 있다."
2024-12-08,"""그날 밤 투자심리 꺾였다""…'코리아 엑소더스' 우려 확산","탄핵 정국이 장기화할 조짐을 보이면서 한국 증시에 짙은 그림자를 드리우고 있다. 수출 둔화와 내수 부진이라는 안팎의 어려움 속에 예상치 못한 정치적 불확실성까지 더해지면서, 당분간 웬만한 호재로는 증시 반등이 어렵지 않겠느냐는 비관론까지 제기되고 있다.윤석열 대통령의 탄핵안 표결이 의결정족수 부족으로 ‘투표 불성립’ 된 뒤 시장의 불안감은 커지고 있다. 7일 서울 여의도 국회 앞에서 열린 범국민촛불대행진에 참석한 시민들 모습. 김종호 기자지난 7일 국회에서 윤석열 대통령 탄핵소추안이 ‘투표 불성립’으로 폐기되면서 증권가의 불안감은 커졌다. 탄핵안 표결이 예고된 이후 자본시장에선 2016년 12월 박근혜 전 대통령의 탄핵 국면과 유사한 상황을 예상해 왔다. 당시엔 탄핵안이 국회에서 가결되면서 정치적 불확실성이 일단락되고 주가도 상승국면으로 접어들었다. 코스피는 탄핵안이 통과된 2016년 12월 9일 2024.69에서 헌법재판소가 탄핵을 결정한 2017년 3월 10일 2097.35까지 올랐다.목대균KCGI자산운용 운용총괄대표는 “정치적 불확실성이 계속될 경우 단기적으로는 투자 심리가 위축되고, 중·장기적으로 기업이익에도 영향을 미칠 것”이라며 “외국인투자자에게 한국 증시의 가격적인 매력이 부각되는 시점이지만, 정치적 불확실성에 투자를 망설일 수밖에 없다”고 말했다.정근영 디자이너경기 부양 정책 카드를 쓰는 데 실기(失期)할 수 있다는 우려도 커지고 있다. 마경환GB투자자문 대표는 “해외투자자를 비롯한 시장 참여자들이 과거에 탄핵을 경험해봤기 때문에 한국 주식과 채권을 투매하는 상황까지는 가지 않을 것”이라면서도 “불확실 상황이 길어질수록 경기 부양책 타이밍을 놓칠 수 있고, 새로 출범하는 미국 정부와 외교가 지연되는 등 반전의 모멘텀을 찾기가 더 어려워질 수 있다”고 말했다.이번 정치발 악재가 더욱 우려스러운 건 최근 한국 경제의 펀더멘털(기초체력) 자체가 좋지 않아서다. 내수 위축은 물론, 범용(레거시) 반도체 분야에서 중국의 추격 등 수출에도 부정적인 요인이 많다. 한국은행은 지난달 28일 발표한 경제 전망에서 내년 국내총생산(GDP) 성장률 전망치를 1.9%로 8월 전망치보다 0.2%포인트 낮춰 잡았다. 신영증권 김학균 리서치센터장은 “지금 경제 상황은 과거 탄핵 국면과는 다르다”며 “2016년 탄핵 때는 경기가 바닥을 치고 회복하는 국면이지만 현재는 경기가 고점에서 하락하고 있는 데다 내수 시장 역시 구조적인 충격이 쌓여 견디지 못하는 자영업자들이 속출하고 있다”고 말했다.정근영 디자이너이에 따라 외국인투자자의 ‘코리아 엑소더스(대탈출)’ 우려도 커지고 있다. 한국거래소에 따르면 지난 3일 모처럼 한국 증시에서 7970억원 ‘사자’에 나선 외국인들은 계엄 발표 다음날인 4일(수요일)부터 사흘 동안 1조원 어치를 순매도했다. 이한영 보고펀드자산운용 주식운용본부장은 “지난 3일 외국인 자금이 의미 있는 액수로 유입돼 반등을 기대했지만, 그날 밤 계엄 발표로 투자심리가 꺾였다”고 지적했다.외국계 투자은행(IB)들은 앞다퉈 한국 증시에 대해 부정적인 의견을 쏟아내고 있다. 홍콩계 증권사CLSA는 “7월 이후 실망스러운 움직임을 보여온 한국 주식에 정치 리스크가 추가됐다”며 “내년 한국 시장 비중을 줄이고, 그 시기도 앞당겨야 한다”는 투자 의견을 냈다. 모건스탠리도 “대통령 교체 가능성, 불확실한 정책 등이 시장 우려를 증폭시킬 수 있고 내수·투자 활동이 위축될 위험도 더 커졌다”고 진단했다. 모건스탠리는 이미 한국 주식에 대한 투자의견을 중립에서 비중축소(매도)로 낮췄다.정근영 디자이너전문가들은 향후 주가가 더 하락하더라도 ‘저가 매수’를 노린 신규 투자는 신중해야 한다고 조언했다. 김학균 센터장은 “한국 주식이 저평가 영역인 것은 맞지만, 저평가가 곧 주가 바닥이라는 의미는 아니다”며 “외적 환경이 나쁘면 더 하락할 수 있다는 가능성을 염두에 두고 신중하게 지켜봐야 한다”고 말했다. 목대균 대표는 “이미 주가 변동성이 커지기 시작한 만큼 기존 투자자라면 손절하기보다는 은행, 헬스케어 등 방어적인 주식을 눈여겨보는 게 좋을 것 같다”고 조언했다.특히 정치적 불확실성이 줄더라도 당분간 한국 증시의 상승 동력이 부족할 거란 전망이 나온다. 박희찬 미래에셋증권 리서치센터장은 “정치권의 변화가 한국 증시의 판도 자체를 바꾸지는 못할 것 같다. 지금으로선 주가가 많이 빠졌다는 이유만으로 한국 증시 투자를 적극적으로 권유하기 힘들다”고 말했다. 익명을 요청한 리서치센터장도 “대통령과 여당 뿐 아니라 야당에 대한 반대도 많은 상황”이라며 “탄핵안이 가결되거나 대통령이 퇴진한다고 해도 정치적 갈등과 불안이 여전해 반등을 기대하기 쉽지 않다”고 말했다."
2024-12-09,국내외 증권사의 한숨…“한국 증시 투자하라고 권유하기 어려운 상황”,"탄핵 정국이 장기화할 조짐을 보이면서 한국 증시에 짙은 그림자를 드리우고 있다. 수출 둔화와 내수 부진이라는 안팎의 어려움 속에 예상치 못한 정치적 불확실성까지 더해지면서, 당분간 웬만한 호재로는 증시 반등이 어렵지 않겠느냐는 비관론까지 제기되고 있다.지난 7일 국회에서 윤석열 대통령 탄핵소추안이 ‘투표 불성립’으로 폐기되면서 증권가의 불안감은 커졌다. 탄핵안 표결이 예고된 이후 자본시장에선 2016년 12월 박근혜 전 대통령의 탄핵 국면과 유사한 상황을 예상해 왔다. 당시엔 탄핵안이 국회에서 가결되면서 정치적 불확실성이 일단락되고 주가도 상승국면으로 접어들었다. 코스피는 탄핵안이 통과된 2016년 12월 9일 2024.69에서 헌법재판소가 탄핵을 결정한 2017년 3월 10일 2097.35까지 올랐다.목대균KCGI자산운용 운용총괄대표는 “정치적 불확실성이 계속될 경우 단기적으로는 투자 심리가 위축되고, 중·장기적으로 기업이익에도 영향을 미칠 것”이라며 “외국인투자자에게 한국 증시의 가격 측면의 매력이 부각되는 시점이지만, 정치적 불확실성에 투자를 망설일 수밖에 없다”고 말했다.경기 부양 정책 카드를 쓰는 데 실기(失期)할 수 있다는 우려도 커지고 있다. 마경환GB투자자문 대표는 “해외투자자를 비롯한 시장 참여자가 과거에 탄핵을 경험해봤기 때문에 한국 주식과 채권을 투매하는 상황까지는 가지 않을 것”이라면서도 “불확실 상황이 길어질수록 경기 부양책 타이밍을 놓칠 수 있고, 새로 출범하는 미국 정부와 외교가 지연되는 등 반전의 모멘텀을 찾기가 더 어려워질 수 있다”고 말했다.━외국인, 7970억 한국 주식 산 날 계엄 사태…바로 1조 팔아이번 정치발 악재가 더욱 우려스러운 건 최근 한국 경제의 펀더멘털(기초체력) 자체가 좋지 않아서다. 내수 위축은 물론, 범용(레거시) 반도체 분야에서 중국의 추격 등 수출에도 부정적인 요인이 많다. 한국은행은 지난달 28일 발표한 경제 전망에서 내년 국내총생산(GDP) 성장률 전망치를 1.9%로 8월 전망치보다 0.2%포인트 낮춰 잡았다. 신영증권 김학균 리서치센터장은 “지금 경제 상황은 과거 탄핵 국면과는 다르다”며 “2016년 탄핵 때는 경기가 바닥을 치고 회복하는 국면이지만 현재는 경기가 고점에서 하락하고 있는 데다 내수 시장 역시 구조적인 충격이 쌓여 견디지 못하는 자영업자들이 속출하고 있다”고 말했다.이에 따라 외국인투자자의 ‘코리아 엑소더스(대탈출)’ 우려도 커지고 있다. 한국거래소에 따르면 지난 3일 모처럼 한국 증시에서 7970억원 ‘사자’에 나선 외국인은 계엄 발표 다음 날인 4일(수요일)부터 사흘 동안 1조원 어치를 순매도했다. 이한영 보고펀드자산운용 주식운용본부장은 “지난 3일 외국인 자금이 의미 있는 액수로 유입돼 반등을 기대했지만, 그날 밤 계엄 발표로 투자심리가 꺾였다”고 지적했다.외국계 투자은행(IB)들은 앞다퉈 한국 증시에 대해 부정적인 의견을 쏟아내고 있다. 홍콩계 증권사CLSA는 “한국 주식에 정치 리스크가 추가됐다”며 “내년 한국 시장 비중을 줄이고, 그 시기도 앞당겨야 한다”는 투자 의견을 냈다. 모건스탠리는 이미 한국 주식에 대한 투자의견을 중립에서 비중축소(매도)로 낮췄다.박희찬 미래에셋증권 리서치센터장은 “정치권의 변화가 한국 증시의 판도 자체를 바꾸지는 못할 것 같다. 지금으로선 주가가 많이 내렸다는 이유만으로 한국 증시 투자를 적극적으로 권유하기 힘들다”고 말했다. 익명을 요청한 리서치센터장도 “대통령과 여당뿐 아니라 야당에 대한 반대도 많은 상황”이라며 “탄핵안이 가결되거나 대통령이 퇴진한다고 해도 정치적 갈등과 불안이 여전해 반등을 기대하기 쉽지 않다”고 말했다."
2024-12-26,"사람을품다, 영종도에 글로벌 케이팝 아카데미 열어","인천 영종도에 테이튼 오션 오피스텔을 시행한 주식회사 사람을품다 명추국회장은 해당 위치에 전 세계 청소년들을 위한 글로벌 아카데미를 유치했다.사진 제공 = 주식회사 사람을품다제니스씨앤엠은 영종도 운남동 테이튼 오션 오피스텔에서 배우 정준호와 중국의 후베이 청하이 문화 산업 개발 유한회사(HubeiChenghaiCulturalIndustryDevelopmentCo.,Ltd.)와 함께 아카데미 사업의 일환으로 차세대 세계 청소년들을 위한 새로운 시스템의 실전 스타 인큐베이터 아카데미 사업을 시작한다고 밝혔다.인천 영종도에 있는 제니스 글로컬 아카데미는 제니스씨앤엠과 ㈜사람을품다(명추국회장), 코리아에셋투자증권이 함께 협업해 미국 하와이 주립대와 연계한 국내 최대 규모의 글로벌 아카데미로 시작한다. 기숙과 학업을 병행하고 미국 대학 진학 기회를 제공하며, 기숙 시설은 외국 학생들을 위한 최신식으로 마련돼 있다. 또한 약 450명의 학생을 동시 수용이 가능한 호텔 수준을 자랑한다.제니스 글로컬 아카데미는 인천 영종 캠퍼스를 시작으로 향후 2030년까지 세계 500여 개의 아카데미를 열 계획이다. 한국, 중국, 일본과 파트너십을 통해 전 세계로 시스템을 확장해 글로벌 아카데미 플랫폼 비즈니스로 거듭나겠다는 포부다. 특히 홍콩 영화배우 주성치가 소속된 홍콩 상장사 빙고 그룹(BingoGroup)의 영화 및 콘텐츠 비즈니스를 관장하는 빙고 석세스 리미티드(BingoSuccessLimited)와 함께 협업해 발굴한 아티스트들의 상호 매니지먼트를 통해 중화권 및 세계로 아티스트들의 시장을 더욱 확대한다는 방침이다.지난 18일에 영종도 테이튼 오션 오피스텔 1층에서 열린 소프트 오프닝에는 많은 연예인, 엔터테인먼트 관계사, 미디어들이 참여해 협업을 다졌다.사진 제공 = 주식회사 사람을품다대한민국 정세의 불안과 경기 침체로 많은 투자자들의 움추림 속에서도 주식회사 사람을품다 명추국회장은 수익의 매체가 될 제니스 글로컬 아카데미와 같은 기업의 유치를 통하여 영종도 경제발전에 이바지할 예정이다.앞으로 제니스 글로컬 아카데미와 주식회사 사람을품다(명추국회장)의 행보가 기대되며 케이팝을 이끌어갈 전 세계 청소년들의 안위와 성장을 위해 앞장설 제니스 글로컬 아카데미 영종 캠퍼스의 발걸음 또한 기대하지 않을 수 없다."
