date,title,content
2023-08-10,6년 만에 유커 온다…中 한한령 해제에 주가 들썩인 이 업계,"0초0초광고 후 계속됩니다.다음 동영상subjectauthor취소6년 만에 유커 온다…中 한한령 해제에 주가 들썩인 이 업계중앙일보재생2,195재생 (space/k)재생00:530:00:00재생 (space/k)재생음소거 (m)음소거00:00/00:53실시간설정전체 화면 (f)해상도자동 480p자막사용 안함재생 속도1.0x (기본)인기 구간 표시해상도자동 (480p)720pHD480p360p270p144p자막설정사용 안함옵션글자 크기배경색재생 속도0.5x1.0x (기본)1.5x2.0x죄송합니다. 문제가 발생했습니다. 다시 시도해 주세요.도움말음소거 상태입니다.도움말라이선스디버그 정보 다운로드고화질 재생이 가능한 영상입니다.설정에서 해상도를 변경해보세요.더 알아보기00:00중국 정부가 코로나19 발생 3년여 만에 자국민의 해외 단체여행을 사실상 전면 허용하기로 함에 따라 국내 항공‧호텔‧면세 업계의 기대감이 커지고 있다. ‘유커’로 불리는 중국 단체관광객은 한때 연 800만 명을 넘기며 전체 방한 관광객의 절반가량을 차지했다. 시장에서는 “단비 같은 소식”이라는 반응이 나왔다.2018년 10월 서울 중구 신라면세점을 방문한 중국 '한아화장품' 임직원 단체 관광객들이 손 흔들어 반갑게 인사하고 있다. 연합뉴스10일 한국관광공사에 따르면 올해 상반기 방한한 중국 관광객은 54만6000명으로 지난해 동기보다 626.7% 증가했다. 코로나19 기간에는 17만~68만 명이었다. 2016년 806만8000명이었다가 10분의 1 이하로 급락한 것이다. 특히 2017년 3월 고고도미사일방어체계(THAAD·사드) 사태로 한국행 단체 비자 발급이 중단되며 그해 중국 관광객은 416만9000명으로 반 토막 수준이 됐다. 이후 2018년 479만 명, 2019년 602만 명으로 회복세를 보이다가 코로나19로 직격탄을 맞았다.━“중국 단체 관광객 씀씀이 커 매출에 도움”유커들이 대거 다시 한국을 찾을 것으로 예상되면서 관련 업계는 크게 반기는 분위기다. 당장 중국 단체 관광객을 유치할 인바운드(국내 유입 관광) 여행사들의 움직임이 활발하다. 중추절·국경절 황금연휴(9월 29일~10월 6일)를 앞두고 중국 관광객의 한국행(行)이 본격적으로 재개될 것으로 보여서다.한국과 중국으로 오가는 하늘길도 더 넓어질(증편) 것으로 보여 항공 업계도 분주해질 전망이다. 업계 관계자는 “국제선 중 리오프닝(경제활동 재개) 이후에도 중국 노선의 회복이 가장 더뎠다”며 “홍콩과 산둥반도 등 중국 노선 재취항 시기가 앞당겨질 가능성도 있다”고 말했다.2018년 4월 서울 중구 명동을 찾은 중국 관광객. 연합뉴스호텔·면세 업계도 반색하고 있다. 한 호텔 업체 관계자는 “코로나 엔데믹(감염병의 풍토병화)을 맞은 가운데 날개를 다는 것 아닐까 싶다”고 말했다. 코로나19 기간 중 ‘실적 절벽’을 경험한 면세업계는 ‘큰 손’인 중국인 단체 관광객의 귀환을 손꼽아 기다려왔다. 업계 관계자는 “현재는 일본과 동남아 관광객이 많지만 중국 단체관광객보다는 소비가 크지 않다”고 전했다. 중국 보따리상인 ‘다이궁’에 주는 높은 수수료도 낮출 수 있는 효과도 기대할 수 있다.━중국 단체관광객 관련 업체 주가도 강세한국면세점협회에 따르면 지난해 국내 면세점을 외국인 수는 156만3046명으로 코로나19 전인 2019년(2001만6150명)에 비해 10분의 1수준이었다. 같은 기간 외국인 매출도 20조8129억원에서 16조3901억원으로 21.3% 급감한 상태다.다만 실제 실적 회복에 반영되려면 시간이 걸릴 것이라는 관측도 있다. 한 면세점 업체 관계자는 “중국 경기가 좋지 않은 데다 현지에서 여행 상품이 나오고 한국 항공 노선도 신설돼야 한다”고 전했다.이날 중국이 한국행 단체관광을 허용하기로 결정했다는 소식에 관련 업체의 주가도 강세를 보였다. 그랜드코리아레저(GKL)는 전 거래일 대비 2700원(20.45%) 오른 1만5900원에 거래를 마쳤다. 롯데관광개발(29.99%)도 강세를 보였고, 코스닥시장에서는 파라다이스(18.13%)가 급등했다. 화장품과 여행 종목 주가도 큰 폭으로 올랐다. 유가증권시장에서 한국화장품(29.91%)‧토니모리(29.94%)‧아모레G(20%)‧아모레퍼시픽(7.76%)‧코스맥스(19.04%) 등이, 코스닥시장에서는 마녀공장(29.87%)‧클리오(22.9%) 등이 상승했다. 여행 업체 주가도 하나투어(10%)·노랑풍선(17.4%)‧참좋은여행(9.5%)‧모두투어(6.62%) 등이 동반 상승했다.지난 5월 인천국제공항 2터미널 내 면세점의 모습. 뉴스1"
2023-06-19,"일대일 식단, 맞춤형 화장품…‘초개인화’에 꽂힌 유통업계","16일 찾은 서울 강서구에 있는 아워홈 마곡식품연구센터 내 구내식당. 이곳에서 근무하는 임직원 500여 명 중 30명은 지난 4월부터 특별한 식사를 ‘구독’하고 있다. 전문가와 일대일 상담을 통해 ①당뇨·고혈압 등 질환 ②키·몸무게 ③가족력과 생활 습관 데이터 등을 통해 맞춤형 식사를 제공하는 것이다. 구독자 김진규(28) 씨는 “체중과 체지방 감량 효과가 기대 이상이었다”고 말했다.이 회사는 전국 850여 개 사업장에서 날마다 100만 끼니 이상의 식사를 제공한다. 여기서 한발 더 나아가 각 식단과 개인 데이터를 분석, 지금까지 260여 개의 ‘일대일 식단’을 개발했다.18일 식품·유통 업계에 따르면 최근 연구개발과 마케팅의 화두는 ‘초개인화’다. 초개인화는 개인화에서 진화한 개념이다. 개인화가 개인의 취향에 따른 맞춤형 서비스를 제안하는 정도라면, 초개인화는 개인 한 명을 보다 입체적으로 분석해 다양한 상황을 실시간으로 반영하는 한층 고도화한 기술이다.초개인화 시도는 이커머스 업계에서 가장 활발하다.G마켓은 지난 3월 모바일 앱 전면에 인공지능(AI) 기반의 개인화 서비스를 탑재했다. 예전 같으면 ‘30대 남성’ ‘20대 여성’ 식으로 고객군을 나눠 화면을 편집했다면, 이제는 개인의 관심사에 따라 각각 노출되는 상품의 순서가 모두 다르다. G마켓에 따르면 초개인화 기술이 적용된 고객의 경우 클릭효율(CTR·열린 페이지 수 대비 클릭 수)이 기존보다 20% 늘었고, 노출되는 상품 수도 15배 증가했다.롯데온도 이달 5일AI스타트업 업스테이지와 손잡고 ‘추천AI시스템을’ 도입했다. 인구통계학적 자료와 검색 데이터, 구매 상품에 대한 반응, 장바구니 내역 등 구체적 행동 패턴을 바탕으로 상품을 추천한다.화장품 업계에서도 초개인화 시도가 활발하다. 코스맥스는 지난 3월 맞춤형 화장품 플랫폼 ‘3WAAU(쓰리와우)’를 론칭했다. 홈페이지에서 일대일 문진 후 1260만 가지 조합 중 단 하나의 레시피를 제공하는 게 특징이다. 개인마다 다른 처방이 24시간 이내에 조제돼 배송된다.초개인화는 그간 대량생산으로 비용을 줄이는 ‘규모의 경제’로 성장해왔던 유통 업계가 공급자 → 소비자 중심으로 패러다임을 전환하고 있다는 것을 의미한다.이동일 세종대 경영학부 교수는 “세밀한 타게팅(표적화)으로 기업이 소비자와 더 밀접한 관계를 맺으려는 시도가 핵심”이라며 “다만 고객들이 자신의 취향에 갇히는 에코 체임버(같은 목소리가 메아리처럼 울리는 공간) 효과가 있을 수 있다는 점도 고려해야 한다”고 지적했다."
2023-06-18,"같은 식판에 담긴 밥과 김치인데 알고 보니 종류만 260개, 왜","유통가 화두는 개인화 넘어 ‘초개인화’아워홈은 지난달 개인별 맞춤 정기구독 서비스 '캘리스랩'을 론칭하고, 구내식당에서 1:1 맞춤 서비스를 진행하고 있다. 사진 아워홈16일 찾은 서울 강서구에 있는 아워홈 마곡식품연구센터 내 구내식당. 이곳에서 근무하는 임직원 500여 명 중 30명은 지난 4월부터 특별한 식사를 ‘구독’하고 있다. 전문가와 일대일 상담을 통해 ①당뇨·고혈압 등 질환을 체크하고 ②키·몸무게 등 신체 측정 결과를 반영하며 ③가족력과 생활 습관 데이터 등을 통해 맞춤형 식사를 제공하는 것이다. 가령 체중 감량이 필요하다고 분석된 ‘슬림핏’은 끼니당 칼로리를 500kcal이하로, 근육 강화가 요구되는 ‘머슬핏’은 단백질을 27g 이상으로 한다. 이어 4주 단위로 영영사와 개별 상담을 이어간다. 구독자 김진규(28)씨는 “체중과 체지방 감량 효과가 기대 이상이었다”고 말했다.캘리스랩 부스 한 편에 마련된 개인 건강 측정 기기. 여기에 건강검진 정보 등을 고려해 영양 상담이 이뤄진다. 유지연 기자━같은 식판에 놓인 같은 밥과 국이지만 ‘다르다’이 회사는 전국 850여 개 사업장에서 날마다 100만 끼니 이상의 식사를 제공한다. 여기서 한발 더 나아가 각 식단과 개인 데이터를 분석, 지금까지 260여 개의 ‘일대일 식단’을 개발했다. 정지현 아워홈 밀케어플랫폼사업부 담당은 “최근 고객사 직원 50여 명을 대상으로 4주 점심 구독 시험을 해봤더니 체질량지수(BMI)와 혈압 개선 효과가 있었다”며 “일반 식단가 대비 50%가량 비싸지만 다른 기업·아파트 단지 등에서 서비스 요청이 늘고 있다”고 말했다.당뇨, 고혈압 등 대사증후군 위험군일 경우 추천받는 케어식. 저염, 저당 조리법으로 500칼로리 이하로 제공된다. 사진 아워홈18일 식품·유통 업계에 따르면 최근 연구개발과 마케팅의 화두는 ‘초개인화’다. 초개인화는 개인화에서 진화한 개념이다. 개인화가 개인의 취향에 따른 맞춤형 서비스를 제안하는 정도라면, 초개인화는 개인 한 명을 보다 입체적으로 분석해 다양한 상황을 실시간으로 반영하는 한층 고도화한 기술이다. 같은 식판에 놓인 같은 밥과 국, 반찬을 먹는 구내식당 급식도 ‘개인 맞춤’을 표방하고 나섰다.신재민 기자초개인화 시도는 이커머스 업계에서 가장 활발하다. G마켓은 지난 3월 모바일 앱 전면에 인공지능(AI) 기반의 개인화 서비스를 탑재했다. 예전 같으면 ‘30대 남성’ ‘20대 여성’ 식으로 고객군을 나눠 화면을 편집했다면, 이제는 개인의 관심사에 따라 각각 노출되는 상품의 순서가 모두 다르다.이 회사 김선호AI프로덕트팀장은 “구매 및 조회 기록·고객 성향 등을 바탕으로 중‧단기 관심사와 최근 트렌드·계절감 등 외부 요인을 반영해 개인별 추천 랭킹을 만드는 것”며 “현재 약 10% 고객에게 적용하고 있다”고 설명했다. G마켓에 따르면 초개인화 기술이 적용된 고객의 경우 클릭효율(CTR·열린 페이지 수 대비 클릭 수)이 기존보다 20% 늘었고, 노출되는 상품 수도 15배 증가했다.━G마켓은 지난 3월 모바일 앱에 인공지능 기반의 개인화 서비스를 탑재했다. 사진 G마켓━클릭 20% 늘고, 노출되는 상품도 15배 늘었다롯데온도 이달 5일AI스타트업 업스테이지와 손잡고 ‘추천AI시스템을’ 도입했다. 인구통계학적 자료와 검색 데이터, 구매 상품에 대한 반응, 장바구니 내역 등 구체적 행동 패턴을 바탕으로 상품을 추천한다. 업스테이지 관계자는 “기존 개인화 모델이 청바지를 구매한 고객에게 다른 청바지를 추천하는 수준이었다면, 초개인화는 ‘흰색’ ‘레이스’ ‘블라우스’ 같은 색깔이나 형태 등 보다 디테일한 관심사를 파악해 상품을 소개한다”고 말했다.롯데온은AI스타트업 업스테이지와 손잡고 '추천AI서비스'를 도입했다. 사진 업스테이지━1260만 가지 조합 중 한 가지 제품 만들기도공산품의 대명사 격인 화장품 업계에서도 초개인화 시도가 활발하다. 코스맥스는 지난 3월 맞춤형 화장품 플랫폼 ‘3WAAU(쓰리와우)’를 론칭했다. 홈페이지에서 일대일 문진 후 1260만 가지 조합 중 단 하나의 레시피를 제공하는 게 특징이다. 개인마다 다른 처방이 24시간 내에 조제돼 배송된다. 현재는 샴푸·트리트먼트 등 헤어케어 제품을 서비스하고 있으며, 향후 기초 화장품으로 확대할 계획이다.코스맥스는 맞춤형 화장품 플랫폼 '3WAAU'를 론칭하고 1:1 문진 후 1260만가지 조합 중 하나의 상품을 조제해 제공한다. 사진 코스맥스초개인화는 그간 대량생산으로 비용을 줄이는 ‘규모의 경제’로 성장해왔던 유통 업계가 공급자→소비자 중심으로 패러다임을 전환하고 있다는 것을 의미한다. 이동일 세종대 경영학부 교수는 “세밀한 타기팅(표적화)으로 기업이 소비자와 더 밀접한 관계를 맺으려는 시도가 핵심”이라며 “다만 고객들이 자신의 취향에 갇히는 에코 챔버(같은 목소리가 메아리처럼 울리는 공간) 효과가 있을 수 있다는 점도 고려해야 한다”고 지적했다.신재민 기자"
2023-02-20,LG생건이 ‘통신전시회’ 참가하는 까닭은‧‧‧AI와 터치하는 뷰티업계,"LG생활건강이 오는 27일부터 열리는 스페인에서 열리는 모바일월드콩그레스(MWC) 2023에서 선보이는 미니 타투 프린터 ‘IMPRINTU’(임프린투). 국내 뷰티회사가 모바일 산업 분야 세계 최대 박람회인MWC에 참가하는 건 이번이 처음이다. 사진LG생활건강LG생활건강이 오는 27일(현지시간) 스페인 바르셀로나에서 개막하는 ‘모바일 월드 콩그레스(MWC) 2023’에 참가한다. 국내 뷰티회사가 모바일 산업 분야 세계 최대 전시회인MWC에 참가하는 건 이번이 처음이다.20일LG생건은 글로벌 뷰티테크 시장 공략을 위해 개발한 미니 타투 프린터 ‘임프린투(IMPRINTU)’를MWC에서 선보일 예정이라고 밝혔다.모바일 앱 기반의 임프린투는 고객이 앱에서 타투 디자인을 선택하거나 원하는 사진 또는 그림을 올리면 최대 600dpi의 고화질 이미지를 피부와 적합한 소재의 의류에 그려 넣는 기기다. 한 손에 쥘 만큼 작은 크기(95x61x78㎜)로, 이 회사 색조연구소에서 자체 개발한 피부 화장용 ‘비건 잉크’를 사용한다. 타투는 피부에 하루 정도 지속된다.이 앱에는LGAI연구원의 초거대 인공지능(AI) ‘EXAONE’(엑사원)이 생성한 이미지로 디자인된 도안도 업데이트될 예정이다. 이번에 처음 공개하는 도안 중에는LGAI아티스트 ‘틸다’의 감성이 들어간 도안도 있다.LG생건은 올해 2분기 국내·북미를 시작으로 유럽 등에 순차적으로 제품을 출시할 예정이다.김혜선LG생건 뷰티테크 프로젝트 브랜드매니저는 “MZ세대가 개성을 표현하려는 욕구가 다양하다는 점에 착안했다”며 “축적한 화장품 노하우와 기술력을 접목해 뷰티 제품 사용 경험을 혁신하겠다”고 강조했다.━AI,맞춤형 화장품 개발에 적용한편 뷰티 업계에서AI기술을 활용하는 곳이 늘고 있다. 한국콜마는 올 1분기 세종시에AI기술을 적용한 화장품 생산기지 착공에 나선다.AI빅데이터 분석을 통해 불량률이 가장 낮은 최적의 공정을 찾아내고, 이를 품목별로 표준화해 빠르게 적용하는 게 핵심이다.세종시 전의면에 위치한 콜마그룹 세종사업장 전경. 사진 한국콜마코스맥스는 숙명여대 연구팀과 공동 연구를 통해 바르지 않고도AI로 화장품의 사용감을 측정하는 텍스처 표준 측정 기술을 개발했다. 원하는 대로 사용감을 정밀하게 조정하는 맞춤형 화장품 개발에 적용할 계획이다. 고운세상코스메틱은AI피부 분석, 화장품 판독 서비스를 운영하고 있다."
2023-02-07,"대구한의대, 맞춤형 콜드체인 관리 기술 개발","대구한의대학교 화장품공학과 석사과정 1학년 추진옥 학생이 콜드체인 기술의 맞춤형 모니터링을 위한 캡슐 기반 신개념 비색 온도 모니터링 시스템 개발에 성공했다.이 연구는COVID-19 이후 중요성이 부각된 콜드체인 기술의 온도 모니터링을 위해 상변화 오일층이 포함된 캡슐 기반의 온도 감응형 방출 제어 시스템을 개발해 간편하게 제품의 온도 이탈을 감지할 수 있도록 했다. 또한 정교한 유체 제어가 가능한 미세유체공학 기반 기술의 장점을 활용해 간단한 상변화 오일의 조성 변경만으로 영하의 온도부터 상온까지 광범위한 영역에서 제품별 맞춤형 모니터링이 가능하다. 그 결과 제품마다 요구되는 최적의 온도가 다르지만 제한된 일부 온도 영역에서만 모니터링할 수 있었던 기존의 한계점을 극복할 수 있었다.이 연구는 간단한 조성 조절로 광범위한 온도 영역에서 온도 감응형 방출 제어가 가능한 시스템으로 콜드체인 모니터링 기술의 상용화를 위한 발판이 될 수 있을 것으로 평가된다. 또한 제약, 의료, 식품 및 화장품 등 활성 물질의 보호 및 보관, 방출 제어가 필요한 많은 산업에 널리 응용할 수 있는 것으로 기대된다.추진옥 학생은 한국생물공학회가 개최한 2022년 추계학술발표대회 및 국제 심포지엄에서 해당 연구인 '캡슐 기반의 맞춤형 비색 온도 모니터링 시스템'을 주제로 발표하여 연구의 우수성을 인정받아 코스맥스 우수논문발표상을 수상하기도 했다/이번 연구성과는 한국연구재단 기초연구실과 기본연구 사업의 지원으로 수행되었으며, 화학공학 분야 세계 최고 수준의SCI급 국제 학술지인 '케미컬 엔지니어링 저널’에 게재됐다."
2022-12-26,연말 증시 울상…중국 리오프닝 관련주는 들썩,"국내 증시에서 ‘산타 랠리(연말 연초 상승장)’에 대한 기대가 점차 사그라들고 있지만 ‘나 홀로 상승’을 이어가는 주식이 있다. 중국의 리오프닝(경제활동 재개) 수혜주로 거론되는 종목들이다. 중국이 이르면 내년 2월부터 코로나 봉쇄를 풀고 본격적인 경제 활동을 시작할 것이란 기대감이 앞서 반영된 결과다.그래픽=김경진 기자capkim@joongang.co.kr25일 한국거래소에 따르면 이달 들어 23일까지 코스피 지수는 -6.42%, 코스닥 지수는 -5.25% 하락했다. 이에 비해 중국 리오프닝 관련주로 꼽히는 화장품·면세·여행·항공 관련 주가는 고공행진을 이어가고 있다. 항공주인 제주항공과 진에어는 이 기간 26.9%, 20.1% 상승했고, 화장품주인 애경산업(24.2%)과 코스맥스(14.1%)도 큰 폭의 오름세를 보였다.이 기간 외국인 투자자 순매수 상위 10위 종목에는 에스엠(852억원), 호텔신라(818억원),JYPEnt.(594억), 아모레퍼시픽(445억원) 등 리오프닝 관련주가 대거 이름을 올렸다. 외국인은 이달 들어 코스피 종목을 1조2665억 원어치 내다 팔았는데 이들 주식만큼은 사들였다.이에 비해 개인투자자는 이 기간SK하이닉스(4190억원), 삼성전자(3060억원),LG에너지솔루션(2842억원), 기아(2037억원),LG화학(1868억원)을 집중적으로 매수했다. 하지만 반도체주인 삼성전자(-6.6%)와SK하이닉스(-8.5%)는 저조한 성적을 냈고, 이차전지 관련주인LG에너지솔루션(-22.4%)·LG화학(-17.6%)은 큰 폭의 하락세를 보였다.중국 수혜주가 랠리를 펼친 건 방역 완화로 침체한 중국 경기가 회복될 것이란 기대감에서다. 정명지 삼성증권 투자정보팀장은 “중국 증시는 시진핑 주석의 장기 집권 우려에 하락했지만, 반정부 시위에 시 주석의 강경한 입장이 변화하며 다시 급등했다”며 “리오프닝으로 3월엔 경제 활동이 활성화될 것이라는 기대감이 주식 시장에 미리 반영된 것”이라고 진단했다. 다만 실제 소비가 얼마나 빨리, 얼마나 강하게 반등할지는 지켜봐야 한다는 지적이 나온다."
