date,title,content
2023-03-17,"삼성전자 주식 가장 많은 국민, 수원 사는 40대 남자","작년말 상장법인 주주 모두 1441만명… 삼성전자 638만명지난해 코스피와 코스닥지수가 각각 25%, 35% 빠지는 등 국내 증시가 4년 만에 하락세로 돌아섰지만 상장사 주주는 전년보다 4.1% 증가하며 1400만명을 넘었다. 특히 ‘국민 주식’ 삼성전자의 주주는 14% 늘어나 600만명을 넘어섰다.주주 수 늘었지만, 1인당 보유 종목·주식은 줄어16일 한국예탁결제원에 따르면 지난해 12월 기준 상장법인 2509사의 주주는 1441만명으로 나타났다. 여러 기업 주식을 보유한 주주를 중복 집계하지 않고 1명으로 계산한 실제 소유자 수로, 전년 대비 4.1% 증가한 수치다. 이 중 법인을 제외한 개인 주주의 수는 1424만명으로 전년(1374만명) 대비 3.6% 증가했다. 1인당 평균 소유 종목은 5.85종목으로 전년보다 1.8% 줄었고 1인당 평균 소유 주식 수는 7688주로 0.8% 감소했다.주식시장별로는 코스피에서 주주 수가 전년 대비 4.4% 증가한 1288만명을 기록한 반면 코스닥에서는 0.5% 감소한 787만명을 기록했다. 코넥스 시장은 5만명으로 전년과 동일했다.주주별로 나눠보면 개인 주주가 1424만명으로 98.8%를 차지했고 법인 주주가 4만3000법인(0.3%), 외국인 주주가 3만3000명(0.2%)이었다. 소유 주식 수도 개인 주주가 561억주로 가장 많았지만, 차지하는 비율은 50.7%로 절반을 겨우 넘었다. 1인당 소유 주식 수가 법인이나 외국인보다 현저히 적었기 때문이다. 1인당 평균 소유 주식 수는 법인이 94만주로 가장 많았고, 외국인 41만주, 개인 3940주 순이었다. 법인과 외국인 주주가 소유한 주식 비율은 각각 36.7%, 12%에 달했다.삼전 주가 30% 하락에도 주주 14% 증가국내 투자자들이 가장 많이 소유한 주식은 삼성전자로 지난해 12월 말 기준 주주가 638만755명이었다. 이어 카카오(206만명), 현대자동차(120만명)순이다. 코스닥에서는 카카오게임즈의 주주가 29만명으로 가장 많았다.삼성전자는 작년 한 해 주가가 30%가량 하락해 연초 7만8000원대에서 연말 5만5000원대까지 떨어졌지만 주주 수는 전년(561만4490명) 대비 13.6% 증가했다. 2~3위인 카카오와 현대차의 주주도 각각 7.7%, 2.6% 증가했다.외국인 주주의 소유 주식이 50% 이상인 회사는 33사로 전년 대비 1사 줄었다. 외국인 주주가 가장 많은 회사는 동양생명보험(82%), 에쓰오일(77.3%), 락앤락(77.1%) 순이었다. 코스닥시장에서는 한국기업평가(75.4%), 휴젤(74.0%), 티씨케이(71.5%)순이었다.개인주주, 경기 수원시 40대 남성이 가장 많아개인투자자를 성별로 나눠보면 남성과 여성이 각각 743만명(52.2%), 681만명(47.8%)으로 비슷했지만, 소유주식 수는 남성이 399억주로 71.1%를 차지해 여성(162억주)보다 두 배 이상 많았다.연령대별로는 40대 주주가 327만명(22.9%)으로 가장 많았지만, 소유 주식 수는 50대가 192억주(34.2%)로 가장 많았다. 지역별로는 경기도에 가장 많은 주주(379만명, 26.3%)가 분포해 있었다. 소유 주식 수가 가장 많은 지역은 서울로 619억주(55.9%)를 소유한 것으로 나타났다.반면 세종특별자치시는 주주 수가 11만명(0.8%)으로 가장 적었다. 제주특별자치도는 소유 주식 수가 4.7억주(0.4%)로 최하위였다.거주지·성별·연령으로 세분화하면 주주가 가장 많은 집단은 경기 수원시에 사는 40대 남성(4만5400명)이었고, 경기 용인시 거주 40대 여성과 경기 수원시 거주 40대 여성이 모두 4만3000명대로 2, 3위에 올랐다. 하지만 소유 주식 수가 가장 많은 집단은 서울 강남구 거주 50대 남성으로 11억8000만주를 소유하고 있는 것으로 나타났다. 2위는 서울 강남구 거주 60대 남성으로 9억 4000만주였고, 3위는 경기 성남시 거주 50대 남성으로 7억7000만주를 소유한 것으로 나타났다."
2023-06-12,"삼성전자 10% 뛸 때 20% 뛰었다, 소부장 히든 챔피언은…","━반도체 소·부·장 분석국내 증시의 주도주가 달라졌다. 올봄 2차전지 관련주가 시장을 끌고 왔다면 여름엔 반도체 섹터가 새로운 주도주로 떠오르고 있다. 한국거래소가 삼성전자 등 국내 대표 반도체 기업 15곳의 주가를 지수화한 ‘KRX반도체TOP15’ 지수는 최근 한 달 동안 10.4% 뛰었다. 같은 기간 2.1% 오른 코스피에 비하면 수익률이 5배가량 높았다.머니랩은 ‘반도체=삼성전자’라고 생각하는 개인투자자를 위해 반도체 소부장 섹터를 집중적으로 탐구했다. 증권가가 주목하는 반도체 소부장 기업은 반도체 공정에서 핵심 기술을 공급하는 곳이다. 웨이퍼 제작부터 금속 배선까지의 작업을 하는 곳을 전(前) 공정 기업, 그 이후 테스트와 패키징 작업을 담당하는 곳을 후(後) 공정 기업이라고 한다.그래픽=김영희 02@joongang.co.kr머니랩은 증권가에서 적극 ‘매수’ 의견을 제시하는 주요 반도체 전후 공정 기업을 소개한다. 물론 특정 종목을 매수 추천하는 것은 아니라는 점을 분명히 밝힌다.증권가의 관심을 한 몸에 받는 반도체 소부장 기업은 대체로 재무건전성이 매우 우량하다. 머니랩이 올 1분기 보고서를 분석한 15개 기업 중 13곳은 부채비율(부채총계/자본총계)이 100%가 안 된다. 또 현금 유동성을 나타내는 유동비율(유동자산/유동부채)도 12곳이 200%가 넘는다. 반도체 업황 악화에 고금리 환경을 맞았지만, 상당수가 잘 버티고 있다고 짐작할 수 있다.그래픽=김영희 02@joongang.co.kr반도체 소부장 기업의 수익성의 경우 ‘반도체의 겨울’이라 일컬어지는 올해에는 전반적으로 전년 대비 악화할 것으로 예상되는 곳이 많다. 증권업계 예상치를 보면 15곳 중 9곳이었다. 그러나 반도체 업황이 호황 국면에 접어들 것으로 예상되는 내년에는 15곳 모두 영업이익이 반등할 것으로 전망된다.그래픽=신재민 기자shin.jaemin@joongang.co.kr증권가에서 주목하는 기업도 내년도 실적 성장률이 가파른 곳들이다. 한국투자증권은 최선호주로 유진테크를, 차선호주로 피에스케이를 꼽았고,HPSP와 주성엔지니어링도 관심을 기울일 만한 종목으로 삼았다.유진테크는 증착 공정에서 웨이퍼에 금속 박막을 형성하는 장비를 제조하는 기업이다. 올해 매출의 70%는 삼성전자 쪽에서 나오고 있는데 삼성전자의 디램·낸드·파운드리 생산라인 모두에 제품을 공급하고 있다. 채민숙 한국투자증권 연구원은 “내년 이후에는 삼성전자 안에서 점유율을 높인 상태에서SK하이닉스의 장비 투자도 회복하면 이익 증가가 더 크게 나타날 수 있다”고 말했다.그래픽=김영희 02@joongang.co.kr피에스케이는 포토 공정에서 노광 작업을 한 뒤 남은 포토레지스트(PhotoRegist·빛을 쬐었을 때 형질이 변하는 물질) 제거에 쓰이는 드라이스트립 장비 제조사다. 세계 시장 점유율 1위를 기록 중이다. 한국투자증권은 이 회사의 내년도 영업이익이 전년 대비 56.9% 증가할 것으로 전망한다.HPSP는 이온 주입 공정에 쓰이는 고압 수소 가열·냉각(Annealing) 장비를 세계 최초로 개발한 기업이다. 고압 수소를 이용하면 기존과는 다르게 400도 이하의 온도에서 가열·냉각이 가능하다. 고온으로 인한 웨이퍼 손상을 막을 수 있다. 채민숙 연구원은 “고압 수소는 폭발성이 있어 장비 개발이 어렵고, 고객사 인증도 까다롭기 때문에HPSP의 독점력은 상당 기간 지속할 것”이라고 했다.그래픽=신재민 기자shin.jaemin@joongang.co.kr주성엔지니어링은 국내에서 증착 공정에 사용되는 박막 형성 장비ADL을 가장 먼저 개발한 기업이다. 유진투자증권은 이 회사의 내년도 영업이익이 전년 대비 164% 증가할 것으로 예상한다. 이승우 유진투자증권 연구원은 “미국과 대만 지역에 새로운 고객사를 확보하고 비메모리 분야에서 새롭게 장비 매출이 발생하는 등 고객사와 제품 라인업이 계속 확대될 것”이라고 밝혔다.합성쿼츠계의 ‘신흥 강자’로 거론되는 비씨엔씨도 기대주 중 한 곳이다. 조대형DS투자증권 연구원은 “미국 인텔사 쪽에서 발생하는 합성쿼츠의 올해 매출은 전년 대비 5배 이상 성장할 것으로 기대된다”며 “올 하반기부터 본격적으로 실적이 성장할 것”이라고 전망했다. 이 밖에 증권가가 주목하는 기업들로 원익IPS,파크시스템스, 한미반도체, 넥스틴, 티씨케이, 솔브레인 등도 있다.반도체 소부장 기업 주가 흐름은 대체로 삼성전자·SK하이닉스 등과 비슷하게 움직인다는 게 증시 전문가들의 분석이다. 주가 흐름이 비슷하다면 ‘차라리 대장주 삼성전자 주식을 사지, 뭐하러 소부장주에 투자하냐’고 반문할 수도 있겠다. 하지만 주가 반등 국면에서는 시가총액 규모가 작은 소부장주의 반등 폭이 더 클 수 있다. 실제로 지난 한 달(5월 4일~6월 4일) 삼성전자 주가가 10.9% 오를 때,HPSP는 22.5% 상승했고, 비씨엔씨와 한미반도체도 각각 21.3%, 18.4% 올랐다.이승우 연구원은 “올해 반도체 소부장주 대부분은 영업 실적이 좋지 않을 것으로 예상하는 데도 주가가 올랐다”며 “올 연말이나 내년부터 반도체 경기 사이클 전환이 시작될 것이란 기대감이 선반영되기 시작한 것”이라고 설명했다."
2022-04-10,"[단독] 이창양 산업 장관 후보, ‘거수기 사외이사’ 13년간 8억 받았다","2009년부터 현재까지 하이닉스 등 3곳 사외이사인수위 합류 직후 엘지디스플레이 이사 재선임도이사회 안건 285건 중 ‘단 1건’만 수정 의견 제시“이해충돌 문제 자유롭지 않아” 일각 우려 목소리10일 산업통상자원부 장관 후보 지명된 대통령직인수위원회 경제2분과 간사 이창양 카이스트 교수. 공동취재사진, <한겨레> 자료 사진10일 새 정부의 산업통상자원부 장관으로 지명된 이창양 후보자(한국과학기술원 경영공학부 교수)가 에스케이(SK) 하이닉스·엘지(LG)디스플레이 등 3개 기업의 사외이사로 활동하면서 13년 동안 8억원에 가까운 보수를 받은 것으로 파악됐다. 특정 기업의 사외이사로서 수억원의 보수를 받은 뒤 국내 산업 정책 전반을 관장하는 부처의 장관을 맡는 것은 이해 충돌 소지가 있다는 우려가 나온다. 더욱이이 후보자는 대통령직인수위원회 경제2분과 간사로 위촉된 지 엿새 후에 엘지디스플레이 사외이사로 재선임돼 논란이 일기도 했다.이 후보자는 2009년 3월 일본 토카이카본코리아의 국내 자회사로 반도체 핵심소재를 생산하는 회사인 티씨케이(TCK)의 사외이사로 선임돼 데 이어 2014년 3월까지 5년 동안 사외이사를 맡았다. 이 후보자는 티씨케이 사외이사로 일하던 2012년 2월 에스케이 하이닉스 사외이사도 겸해 2018년 3월까지 6년간 일했다. 이듬해인 2019년 4월엔 엘지디스플레이 사외이사로 옮겨 3년 임기를 마친 뒤 지난달 23일 재선임됐다. <한겨레>가 각 기업의 사업보고서에 담긴 사외이사들의 평균보수액을 살펴봤더니, 이 후보자가 3개 업체로부터 받은 보수는 총 7억8390만원으로 나타났다. 사업보고서엔 개별 사외이사 보수액이 나오지 않지만, 통상적으로 각 사외이사에게 지급되는 보수는 별 차이가 없어 이 후보자가 실제 기업에서 수령한 금액도 평균보수액과 비슷한 수준일 것으로 보인다. 티씨케이의 사외이사 1년 평균보수액은 1890만~2400만원이었고, 에스케이 하이닉스는 5300만~7800만원, 엘지디스플레이는 7800만~9000만원이었다.이 후보자는 이처럼 오랫동안 사외이사로 일하면서도 이사회에 올라온 안건 총 285개 중 수정 의견을 낸 것은 단 1건에 불과했고, 나머지 284개 안건에 모두 찬성해 사실상 안건 찬성률이 100%였다. 그나마도 수정 의견을 낸 때는 2012년 3월5일 열린 에스케이 하이닉스 이사회에서 나머지 4명의 사외이사 모두 수정 의견을 제시해 ‘이사회 규정 등 개정의 건’이 수정 가결된 경우였다. 기업 경영에 대한 감시·견제와는 거리가 먼 ‘거수기’ 역할에 머물렀다는 비판이 나오는 이유다.장기간 기업 사외이사를 지낸 이 후보자의 경력은 업계 현안에 밝다는 장점은 있지만, 기업의 이익과 직결된 정책 틀을 짜는 산업통상자원부 장관을 수행하는 과정에서 이해 상충의 결과를 빚을 수 있다는 지적이 나온다. 박상인 서울대학교 행정대학원 교수는 “산업부 장관으로 일하면서 사외이사로 활동했던 회사의 편의를 봐주지 않겠냐는 우려가 나올 수밖에 없다. 반면 이 후보자가 일하지 않은 업종이나 기업에서는 불이익을 받을 수 있다는 의심을 가지기 쉽다”며 “이해충돌 문제에서 자유로울 수 없다”고 말했다.<한겨레>는 이 후보자의 입장을 듣기 위해 여러 차례 전화를 걸고 문자를 남겼지만, 이 후보자는 연락을 받지 않았다."
2022-04-15,"[단독] 이창양 산업 장관 후보, 사외이사 맡은 뒤 연구는 뒷전?","국내외 학술지 단독저자 논문 13건 중사외이사 맡은 2012년 이후엔 2건뿐이창양 산업통상자원부 장관 후보자. 공동취재사진, <한겨레> 자료 사진대학 교수 재직 중 13년여간 기업 사외이사를 맡으며 수억원대 보수를 받아 이해충돌 논란을 부른 이창양 산업통상자원부 후보자가 본격적인 기업 사외이사 활동을 시작한 뒤로는 학계에서의 연구 활동이 현저히 줄어든 것으로 파악됐다.14일 더불어민주당 서동용 의원이 이 후보자가 재직 중인 한국과학기술원(카이스트)로부터 제출받은 이 후보자의 참여 논문 및 학회 정보와 연구용역 현황을 보면, 이 후보자가 일본 토카이카본코리아의 국내 자회사인 티씨케이(TCK)와 에스케이(SK) 하이닉스 사외이사를 겸임하던 2012년 2월 이후 현재까지 학술지에 게재한 논문 수는 모두 15개다. 그 가운데 단독 저자 논문은 2012년과 2018년에 2건뿐이다. 2000년 5월 카이스트 경영공학부 교수로 임용된 뒤 2012년 이전까지 국제 학술지에 11건의 단독 논문을 게재한 것과는 대조적이다.이 후보자는 2000년대 초반 과학기술분야에서 높은 권위를 갖는 것으로 평가되는 국제전문학술지(SCI급) 저널에 논문을 꾸준히 게재했다. 하지만 사외이사 활동이 활발해진 시기로 접어들면서 최근 10년여간의 연구 성과는 감소 추세를 돌아섰다. 하이닉스 사외이사 활동 전인 2000∼2011년 이 후보자가 참여한 연구 논문 수는 24개로, 그 뒤 10년간 게재한 논문 수(15개)보다 훨씬 많다. 이 후보자의 학회 활동 또한 2008년 5월 미국 학술대회에서 발표한 논문 이후 14년간 한 차례도 없었다.주요 사외이사 활동기인 2012∼2022년까지 11년간 수행한 공동연구 13건 중 11건은 6명의 석·박사 지도 제자와 함께 쓴 논문이었다. 최근 3년동안 쓴 6건의 논문은 박사 학위 과정에 있는 지도 학생과 쓴 논문이었다. 카이스트는SCI급 저널에 논문을 실어야 박사 학위 취득이 가능하다는 점을 고려하면, 관례적으로 지도 교수 이름을 함께 넣었을 가능성도 있다.이 후보자의 연구 실적은 줄었지만 기업 및 정부 자문 활동은 활발해졌다. 이 후보자는 2012년 2월 에스케이 하이닉스 사외이사로 선임됐을 당시 일본 토카이카본코리아의 국내 자회사인 티씨케이(TCK) 사외이사직을 4년째 맡고 있기도 했다. 이 후보자는 2018년 3월까지 6년간 하이닉스 사외이사를 지낸 뒤 이듬해인 2019년 4월부터 엘지(LG)디스플레이 사외이사로 자리를 옮겼다. 그는 지난달 23일 재선임된 상태에서 장관 후보자로 지명된 뒤 사외이사직 사퇴 의사를 밝혔다. 이 후보자는 13년여간 사외이사를 맡으며 8억원에 가까운 보수를 지급받은 것으로 추정됐다. 아울러 2016∼2018년까지는 산업통상자원부 경제자문관과 금융위원회 신성장위원회 위원장 등도 역임했다.정량화된 수치만으로 연구 실적 전반을 평가할 순 없지만 이 후보자의 경우 23년간 학계에 있었던 점을 감안하면 발표한 연구량이 다른 연구자와 비교해 많은 편은 아니다. 이 후보자가 2000년 5월 카이스트 교수로 임용된 뒤 발표한 논문 수는 모두 39개로 연평균 1.7개 꼴로 논문을 썼다. 2002년 같은 학교·학부에 임용된 ㄱ교수는 임용 뒤 1저자 및 공동저자 등으로 83개의 논문을 투고해 연평균 약 4개의 논문을 썼고, 이 후보자보다 5년 늦게 임용된 ㄴ교수도 2005년부터 50개의 논문(연평균 2.7개)을 게재했다.이에 대해 서울 사립대 한 경영학과 교수는 “교수 임용시기에 비춰 투고한 논문 수가 적은 편인 건 맞다”며 “(후보자의) 활동 내역을 보면 논문을 자주 쓰진 못했을 것 같고, 최근 들어 꾸준히 지도 학생들과 함께 논문을 쓰는 방식으로 공저자로서 역할을 한 것 같다”고 말했다. 반면 또 다른 경영대 교수는 “대학마다 학술 실적을 측정하는 기준이 달라 일률적 평가를 하긴 어렵다. (후보자는) 공직 생활 등 실무가로서의 활동 기간이 길었고, 논문 게재 편수는 많지 않지만 수준 높은 국제학술지에 단독 투고하기도 해 실적 문제는 없어 보인다”고 밝혔다."
2023-03-16,"국내 상장주식 보유 개인 1424만명, 평균 3940주","개인 주식보유자 상위는 수원·용인 40대 남·녀지난 14일 서울 여의도 한국거래소의 시세현황판. 한국거래소 제공지난해 말 기준으로 국내 상장주식을 보유하고 있는 개인은 1424만명이며, 1인당 평균 3940주를 소유하고 있는 것으로 집계됐다.16일 한국예탁결제원이 발표한 2022년 12월 결산 상장법인(총 2509개사)의 주식소유현황 통계를 보면, 국내주식 소유자(중복소유자 제외)는 약 1441만명(기관·법인소유자 포함)으로 전년대비 4.1% 증가했다. 1인당 평균 소유종목은 5.85개다. 이 가운데 개인소유자는 1424만명, 법인소유자(기관)는 4만3천개 법인, 외국인소유자(법인)는 3만3천명이다. 보유 주체별 1인(법인)당 평균 소유주식수는 법인소유자가 94만주, 외국인소유자가 41만주, 개인소유자는 3940주였다.보유 주체별 소유주식수를 보면 유가증권시장은 법인이 271억주(44.2%)로 가장 많고, 개인 232억주, 외국인 110억주였다. 코스닥시장은 개인이 322억주(67.4%)로 가장 많고, 법인 133억주, 외국인 23억주로 집계됐다.종목별 보유자는 유가증권시장의 경우 삼성전자(638만755명), 카카오(206만6529명), 현대자동차(120만9826명) 순이고, 코스닥시장은 카카오게임즈(29만3904명), 셀트리온헬스케어(27만7691명), 에코프로비엠(22만5308명) 순이다.전체 주식수에서 외국인 소유주식이 50% 이상인 회사는 총 33개사다. 외국인 소유비율이 높은 종목은 동양생명보험(82.0%), 에쓰오일(S-OlL)(77.3%), 락앤락(77.1%), 한국기업평가(75.4%), 휴젤(74.0%), 티씨케이(71.5%) 등이었다.개인 소유자의 연령 분포를 보면 보유자수로는 40대가 327만명(22.9%)으로 가장 많고, 소유주식수로는 50대가 192억주(34.2%)로 가장 많았다. 20살 미만 비중의 경우 소유자수(75만5670명)는 5.3%, 소유주식수(2억7754만3598주)는 0.5%이고, 20대는 소유자수(180만1025명)는 12.7%, 소유주식수(10억7015만3969주)는 1.9%였다.전국 시군구별로 개인 주식소유자 상위는 경기도 수원시 40대 남자(4만5400명), 경기도 용인시 40대 여자(4만3800명), 경기도 수원시 40대 여자(4만3800명) 순으로 나타났다. 개인 소유 주식 수 상위는 서울 강남구 50대 남자(11억8천만주), 강남구 60대 남자(9억4천만주), 경기 성남시 50대 남자(7억7천만주) 순이었다.소유자(개인·법인·외국인 포함) 중에서 1종목 소유자가 444만명(30.8%), 2개 종목은 241만명(16.7%), 3개 종목은 157만명(10.9%)이었다. 대다수 소유자는 10개 종목 미만을 소유(1229만명, 85.3%)하고 있고, 10개종목 이상 소유자는 212만명(14.7%), 100개 종목~500개 종목 소유자는 3만661명, 1000개 종목 이상 소유자는 186명으로 집계됐다."
