date,title,content
2022-03-24,평균 연봉 1억 넘는 기업은 24곳… 카카오 1억7200만원 1위,"직원 평균 연봉이 1억원을 넘는 대기업이 2년 새 3배가 됐다. 지난해 직원 평균 급여가 가장 높은 대기업은 카카오로 1인당 1억7200만원을 받은 것으로 나타났다.한국경제연구원은 매출액 100대 비금융업 상장사들의 지난해 사업보고서를 분석한 결과, 직원 평균 연봉이 1억원을 넘는 기업은 총 24곳으로 나타났다고 23일 밝혔다. 2019년 8사, 2020년 12사에 비해 급증한 것이다.카카오의 평균 연봉은 2020년(1억800만원) 비해 60% 증가했다. 카카오측은 “스톡옵션 행사차익이 커서 연봉이 급격하게 늘어난 것처럼 보이는 것이다. 스톡옵션을 뺀 1인당 평균 급여액은 8900만원”이라고 설명했다. 지난해 카카오 임직원들이 스톡옵션 행사이익을 받은 돈은 모두 2490억원에 달하는 것으로 나타났다.SK텔레콤은 2020년보다 34% 늘어난 1억6200만원으로 2위였다. 2020년 1억2700만원으로 직원 평균 연봉 1위였던 삼성전자(1억4400만원)는 13% 증가하는데 그쳐 3위로 떨어졌다.‘평균 연봉 1억 클럽’에 가입하는 대기업 수는 매년 늘고 있다. 2019년 직원 평균 연봉이 1억원을 넘은 기업은SK텔레콤, 에쓰오일, 삼성전자,LG상사(현LX인터내셔널), 대한유화, 삼성SDS,삼성물산, 한화솔루션 8곳에 불과했다. 2020년에는 카카오, 네이버, 엔씨소프트 등IT·게임업계 회사들이 새롭게 편입됐고, 지난해에는 포스코·LG화학·롯데케미칼·HMM·팬오션 등 코로나 상황에서도 좋은 실적을 거둔 기업들이 대거 추가됐다.김용춘 고용정책팀장은 “연봉 1억원 이상 일자리가 계속 늘어가고 있는 것은 기업 경영 성적표가 좋았기 때문”이라며 “이는 좋은 일자리를 늘리기 위해 기업하기 좋은 환경을 만들어야 하는 것을 잘 보여주고 있다”고 말했다."
2022-01-18,실적전망 좋은 ‘해·조·기’  밑에서 낚아볼까,"연초 증시 약세…  낙폭 큰 종목들 ‘바텀 피싱’ 노려볼만정기선 현대중공업지주 대표가  지난 1월 5일 미국 라스베이거스'CES2022' 현장에서 그룹의 미래 비전을 발표하고 있다. /현대중공업그룹 제공연초 증시에서 기관 투자자들이 연일 주식을 내다 팔면서 주가가 약세를 면치 못하고 있다. 기관은 지난달 29일 배당 자격을 잃어 주가가 떨어지는 배당락일을 기점으로 14일까지 코스피에서 7조2510억원어치를 순매도(매도가 매수보다 많은 것)했다. 기관은 작년 말에 배당 차익을 노리고 현물을 매수하면서 선물(先物)을 매도하는 식으로 위험을 분산했는데, 배당 자격을 얻은 뒤에는 거꾸로 현물을 팔고 선물을 되사는 식으로 균형을 맞추고 있는 것이다.증권사들은 기관들이 추가로 내놓을 물량을 1조원 이내로 보고 있고, 매도세도 조만간 일단락될 것으로 전망하고 있다. 연초 주가 하락을 이끌었던 기관이 다시 주식 순매수에 나선다면 어떤 종목에 도움이 될까? 전문가들은 그동안 낙폭이 컸던 종목과 실적이 상향 조정되는 종목을 눈여겨봐야 한다고 조언한다. 영업이익 전망이 개선되는 종목을 주가가 낮아졌을 때 사는 이른바 ‘바텀 피싱(bottomfishing)’에 나서라는 것이다.낙폭 과대株 ‘바텀 피싱’배당 목적 이외에도 기관들은 역대급 공모주인LG에너지솔루션 투자 자금을 마련하기 위해 기존에 보유하고 있던 대형 종목들을 팔고 있다. 여기에 미국의 기준금리 조기 인상까지 더해져 당분간 주가가 지지부진한 흐름을 보일 것으로 예상된다.그러나 매도세가 마무리되면 낙폭이 컸던 중·대형주 위주로 반등세가 나타날 것이란 전망이 나온다. 하나금융투자는 “연초부터 3월까지는 기관이 많이 판 종목, 목표주가와 괴리가 큰 저평가 종목 등이 강세를 보이는 경향이 있다”고 분석했다. 전문가들은 주가만 싸져서는 안 되고 실적이 개선되는 종목이어야 장기간 안정적으로 성장 가능하다고 말한다. 특히 1분기 실적이 발표되는 4월부터는 이익 성장 동력(모멘텀)을 가진 종목이 높은 성과를 기록하는 현상이 자주 나타난다.하나금융투자에 따르면 주가가 싸졌으면서도 향후 영업이익이 개선될 것으로 전망되는 업종으로는 조선·생명보험·음식료·화학 등이 꼽혔다. 이들 업종들은 최근 1년 주가가 하락했지만 증권사 영업이익 전망치는 계속 오르고 있다. 조선 업종은 1년간 주가가 9.5% 하락했지만 최근 3개월 동안 연간 영업이익 추정치는 52.1% 상향 조정됐다. 기계(41.4%)·해운(18.2%)·생명보험(17.7%) 등의 이익 추정치도 큰 폭으로 올랐다.개별 종목으로는SK케미칼의 증권사 목표주가와 현재 주가 간 차이(괴리율)가 127.7%로 가장 컸다. 그만큼 해당 주식의 주가가 저평가돼 있고 향후 상승 가능성이 크다는 뜻이다.LG화학(68.6%)·현대중공업지주(55.9%)·팬오션(46.8%)·삼성생명(47.4%) 등도 목표주가와 현 주가 간 차이가 컸다.개별 종목 불확실성 감안해야하지만 주가가 싸졌더라도 개별 종목별로 고유 리스크(위험)가 있을 수 있기 때문에 투자에 유의해야 한다. 셀트리온은 최근 기관이 많이 팔았고, 목표주가와 현 주가 간 차이(40.5%)도 커서 향후 상승 가능성이 있어 보이지만 고의로 매출을 부풀린 분식회계 의혹으로 금융 당국의 조사를 받고 있다. 셀트리온·셀트리온헬스케어·셀트리온제약 등 셀트리온 3사 시가총액은 최근 이틀 새 7조원 이상 날아갔다. 카카오도 목표주가와 현 주가 간 차이가 39.7%로 벌어져 있긴 하지만 계열사 카카오페이 경영진의 900억원대 보유 주식 매도 논란으로 투자자들 신뢰를 회복하기까지 시간이 걸릴 것으로 보인다.과도한 바텀 피싱으로 ‘빚투(빚내서 투자)’가 다시 성행한다는 비판도 제기된다. 특히 빚투가 네이버·카카오·크래프톤 등 낙폭 과대 종목에 집중되는 모습이다. 올 들어 개인 투자자가 증권사에서 돈을 빌려 투자하는 신용거래융자 잔고가 많이 늘어난 종목은 크래프톤(831억원)·카카오(281억원)·네이버(261억원) 순이었다. 증권사들은 주가가 일정 비율 아래로 떨어질 경우 대출금을 회수하려 담보로 잡은 주식을 강제로 처분하는 반대매매에 나서기 때문에 대출받은 투자자의 손실이 커질 수 있다는 점에 주의해야 한다.☞바텀 피싱(bottomfishing)기업 가치보다 주가가 크게 하락했거나 매도 물량이 많은 주식을 바닥(bottom)에서 낚아올린다는 뜻이다. 반등 가능성이 높은 종목을 선정하는 것이 중요하다."
2023-12-20,"하림 “승자의 저주라던 팬오션 인수, 1년 뒤 신의 한 수로”","김홍국김홍국(사진) 하림그룹 회장이 국내 1위 해운사HMM인수 이후 “사업 규모를 더욱 키우겠다”는 의지를 드러냈다. 지난 18일 하림이HMM의 인수 우선협상대상자로 선정됨에 따라 김 회장은 시중 은행 4곳으로부터 3조원 규모 투자확약서를 받았다며 인수 자금 조달 계획도 밝혔다.김 회장은 19일 중앙일보와 통화에서 “작은 회사가 큰 회사를 인수한다며 우려하는데 오히려 회사 규모를 키우게 돼서 서로 좋은 일”이라며 “수익도 낼 수 있고 이로 인해 국가가 좋아지는 것이 저의 큰 보람”이라고 강조했다.하림그룹은 올해 공정거래위원회 집계 기준 자산 17조원을 보유해 대기업집단 중 27위 규모다.HMM은 자산이 이보다 8조8000억원 많은 25조8000억원으로 19위다. 지난해HMM은 매출 18조5868억원, 영업이익 9조9455억원으로 역대 최대 실적을 기록했다. 하림과HMM의 자산을 합치면 42조8000억원으로 불어난다. 하림이HMM을 최종 인수하면CJ그룹(40조7000억원)을 제치고KT(45조9000억원)에 이은 재계 13위로 올라선다. 코스닥에 상장된 하림의 이날 주가는 전일 대비 30% 오른 3775원을 기록했다. 코스피에서HMM도 5.1% 오른 1만8430원으로 마감했다.김주원 기자축산·식품업을 주로 하던 하림은 2015년에 국내 최대 벌크선사 팬오션(옛STX팬오션) 지분 58%를 1조80억원에 인수하며 해운업에 뛰어들었다. 이날 통화에서 김 회장은 “팬오션을 경영해보니 욕심을 부리면 안 되겠더라”며 “하림은 ‘지속성’을 강조하기 때문에 경영을 잘할 자신이 있다”고 말했다. 그러면서 “팬오션을 인수할 때도 사람들은 ‘승자의 저주’라고 했으나 1년 뒤에는 ‘신의 한 수’라고 하더라”고 자신감을 드러냈다. 팬오션은 국내 1위 벌크 해운사로 올해 상반기 기준 벌크선 301척을 운영하고 있으며 연간 화물 1억t(톤)을 전 세계에 운송하고 있다.인수 자금 확보 방안도 밝혔다. 현재 하림의 현금성 자산은 1조6000억원 정도에 불과하다. 김 회장은 “인수 자금을 예비입찰 전에 확보했다”며 “자금을 준비 안 해두고 인수에 나설 수는 없다”고 강조했다. 팬오션은 한진칼 주식 390만3973주를 1628억원에 처분하기도 했으며, 하림은 호반그룹과 손잡고 약 5000억원 규모로 팬오션 영구채 발행도 추진하고 있다.그러면서 “국민·우리·신한·농협 등 은행 4곳에서 투자확약서(LOC)를 받았다”면서 “3조원이 넘는 규모인데 다 쓰지 않고 2조원 정도만 쓸 계획”이라고 설명했다.HMM사업 규모를 더욱 키워 글로벌 경쟁력을 확보하겠다는 계획도 밝혔다. 그는 “한국 해운업을 세계 5위로 키우겠다는 구상을 갖고 있다”며 “세계 시장에서HMM의 영업 비율이 3% 정도밖에 안 되는 데 앞으로 이를 더 키울 것”이라고 강조했다.김주원 기자하림이 본 계약까지 무사히 마칠 수 있을지 불확실하다거나, ‘승자의 저주’를 우려하는 시각도 있다. 한종길 성결대 글로벌물류학부 교수는 “배보다 배꼽이 더 큰 격”이라며 “앞으로 10년간HMM내부에서 나오는 이익과 별개로 친환경 선박 투자 등에 10조원 이상을 투자해야 하는데 하림이 그럴 여유가 있는지 의문”이라고 밝혔다.HMM해운노조의 움직임도 본격화할 전망이다. 노조는 “하림의 곳간으로 전락할 것”이라며 인수에 반대하고 있다. 이들이 파업 카드를 꺼낼 가능성도 있다. 향후 해운업황은 경기침체와 금리 인상에 따른 수요 부진, 운송선박 공급 증가 등으로 하락세가 불가피한 것도 변수다."
2024-05-15,수에즈·파나마 양대 운하 막힌 뒤…해운사 1분기 매출 늘었다,"HMM이 국내에서 처음으로 바이오선박유 시범 운항을 하고 있다.HMM의 알헤시라스(Algeciras)호 모습. 사진HMM세계 곳곳에서 지정학적 리스크가 이어지며 해운업계가 1분기 특수를 누렸다. 수에즈와 파나마 운하 등 양대 운하가 후티 반군 사태와 가뭄으로 통행에 제한을 받으면서 해상 운임이 올랐기 때문이다.국내 최대 해운사HMM은 지난 14일 올 1분기 매출 2조3299억원, 영업이익 4070억원을 기록했다고 밝혔다. 전년 동기 대비 매출은 12%, 영업이익은 33% 증가했다.HMM은 16분기 연속 흑자 달성에 성공했다. 13일 실적을 발표한 팬오션은 지난 1분기 영업이익이 982억원을 기록해 전년 동기 대비 12.8% 하락했다고 공시했다. 매출은 9755억원으로 전년 동기와 비교해 2.1% 줄었다. 팬오션 측은 코로나19로 인한 해운 호황 효과가 지난해 상반기까지 이어진 탓에 상대적으로 올해 1분기 실적이 감소했다고 설명했다.━양대 운하 이용 제한에 운임 상승해운업계는 1분기를 해운업 비수기로 분류한다. 크리스마스 등 연말 성수기를 보낸 뒤라 물동량이 줄기 때문이다. 1분기 해운업계 실적 상승에는 비정상적으로 급등한 해운 운임 영향이 컸다. 수에즈·파나마 운하 등 양대 운하가 모두 막혔다. 수에즈 운하가 있는 홍해에선 지난해 말부터 예맨의 후티 반군이 유조선과 컨테이너선을 무차별 공격해 물류 대란으로 이어졌다. 현재 글로벌 해운사들은 수에즈 운하 대신 아프리카 최남단 희망봉으로 우회 중이다. 파나마 운하 역시 기록적인 가뭄으로 하루 선박 통과량이 기존(36척) 대비 60%(22척) 정도로 줄어들며 미국으로 향하는 운임이 급등했다. 상하이컨테이너운임지수(SCFI)는 지난해 1분기 950~1050 선이었지만, 올해 1분기엔 최대 2305를 기록해 2배 이상 올랐다. 여기에 최근 이스라엘과 이란이 다시 충돌하며SCFI상승세가 이어지고 있다.김경진 기자━경쟁력 강화로 변동성 대비국내 해운업계는 급변하는 해운 운임 시황에 대비하기 위해 사업 다각화를 준비 중이다.HMM은 초대형선을 투입해 규모의 경제를 이뤄 수익성을 높이겠다는 계획이다. 지난 2021년에 발주한 1만3000TEU급 초대형 컨테이너선 12척을 올해 1월부터 순차적으로 인도받아 올해 말까지 미주 노선에 투입할 예정이다. 장거리 노선에 친환경 고효율 초대형선을 투입할 경우 연료비 절감 효과가 크다. 팬오션은 벌크선 선대 확장 등을 통해 2분기부터는 본격적인 실적 개선에 나서기로 했다.HMM관계자는 “미국 경제 회복, 중국발 이커머스 물량 증가, 인플레이션 완화 등 소비 수요가 안정세를 보이며 주요 경제 지표는 양호하지만 지정학적 리스크로 인해 시장 상황이 급변할 가능성이 있다”며 “홍해 후티 반군 가 장기화하면서 희망봉 우회가 지속되고, 이에 따라 스케줄 지연과 운송 기간 증가 등 공급망 불안정으로 운임 변동성이 크다”고 말했다."
2024-03-31,운임 하락에 해운동맹 재편까지…생존전략 짜는 해운업계,"LA항의HMM컨테이너선. 사진HMM홍해발 물류난이 소강 국면을 보이면서 반짝 상승했던 국제 해운 운임이 다시 떨어지고 있다. 여기다 글로벌 해운 동맹 구도가 재편되면서 국내 해운사들은 수익성 확보와 미래 먹거리 선점이라는 숙제를 안게 됐다.━홍해발 해운특수 끝났다31일 해운업계에 따르면 최근 국내 해운사들의 가장 큰 고민은 운임지수 하락이다. 한국해양진흥공사에서 발표한 한국형 컨테이너운임 지수(KCCI)는 7주 연속 하락세다. 해진공이 지난 25일 발표한KCCI는 일주일 전보다 3.16% 하락한 2326을 기록했다. 고점이던 지난달 5일 2831과 비교하면 17.8% 떨어진 수치다. 상하이운임지수(SCFI) 역시 전 주 대비 2.28% 감소한 1732.57로 나타났다. 6주 연속 하락이다.박경민 기자홍해발 물류 사태에 따른 해운 특수는 오래가지 않았다. 오히려 해운사들이 과도하게 공급을 늘리면서 운임 하락을 이끌었다. 홍해 위기가 장기화하면서 선사와 화주들은 현재 상황에 익숙해졌다. 수에즈운하가 아닌 남아프리카 희망봉을 우회하는 항로가 굳어진 것도 운임 하락 원인으로 꼽힌다. 홍해 위기가 해결되고, 수에즈운하 항로가 다시 열리면 해운 운임은 더 떨어질 가능성도 있다.━해운 동맹 재편, 한국HMM은글로벌 해운 동맹이 빠르게 재편되고 있는 점도 국내 해운사들엔 부담이다. 동맹을 맺으면 전 세계로 가는 해운 서비스 항로를 공유해 더 많은 노선을 안정적으로 운영할 수 있고, 초대형 선박을 함께 사용하면서 건조 비용과 물류비용을 줄일 수 있다.현재 글로벌 해운 동맹은 크게 3개로 나뉜다. 2M(MSC·머스크)과 오션(CMACGM·코스코·에버그린), 디 얼라이언스(하팍로이드·ONE·HMM·양밍)다. 세계 최대 해운 동맹인 2M은 내년 해체를 공식화한 바 있다.MSC는 독자 노선을 택했고, 머스크는 하팍로이드와 새롭게 ‘제미니 협력’을 맺는다고 공식 발표했다.또 다른 동맹인 오션 얼라이언스는 해운 동맹 기한을 5년 더 연장했다. 문제는 디 얼라이언스에 속한HMM이다. 머스크와 하팍로이드가 새로운 해운 동맹을 만들기로 하면서 디 얼라이언스의 유지 여부가 불투명해졌기 때문이다.HMM관계자는 “디 얼라이언스 회원사 내부에서 협의를 진행 중”이라며 말을 아꼈다.━“사업 확장보다 포트폴리오 다각화”해운 침체기에 동맹 구도 변화까지 맞은 해운사들은 대책 마련에 분주한 모습이다.HMM은 장기 운송 계약 확대와 고수익 화물 개발을 올해 경영 전략으로 제시했다. 김경배HMM대표는 지난 28일 정기 주주총회에서 “초대형선 비율이 선복량 기준 78%로 글로벌 선사 중 가장 높은 수준”이라며 “규모의 경제와 함께 체질 개선을 이룰 수 있는 튼튼한 토대를 갖췄다”고 강조했다. 하반기 글로벌 해운 시장이 좋지 않은 상황에서 대형 선박을 중심으로 수익성을 높이는 방향으로 성장성을 끌어올린다는 계획으로 풀이된다.팬오션은 사업 다각화를 올해 성장 동력으로 꼽았다. 팬오션의 사업 부문은 컨테이너선, 탱커선, 곡물 거래 사업 등으로 나뉜다. 기존 주력 사업인 벌크선 사업에 집중하면서 올해부터 도입할LNG선 선대 확장,LNG관련 사업 영역 확대로 이익 창출에 나설 방침이다.팬오션은 올해 하반기부터 내년까지LNG선 9척을 순차적으로 도입할 예정이다. 회사는 이를 통해 연간 약 1000억원 이상의 영업이익 증가를 예상했다. 우수한 중앙대 국제물류학과 교수는 “국내 해운업계가 지속적으로 성장하기 위해서는 사업 확장보다 해운산업 내 포트폴리오 다각화와 터미널, 물류 시설 투자를 통한 경쟁력 확보에 집중해야 한다”고 말했다."
2024-02-08,"하림·산은 ‘HMM 경영권’ 이견…“새우, 결국 고래 못 삼켰다”","“새우(하림)는 결국 고래(HMM)를 삼키지 못했다-.”국내 최대 해운사인HMM(옛 현대상선)의 ‘새 주인’ 찾기가 무산됐다. 우선협상대상자로 선정된 하림그룹 컨소시엄(하림 자회사 팬오션-JKL파트너)과 정부(산업은행·해양진흥공사)의 주주 간 계약 협상이 불발되면서다. 7일 산업은행(이하 산은)에 따르면 “산은·해양진흥공사(이하 해진공)와 우선협상대상자는 7주에 걸친 협상 기간 상호 신뢰하에 성실히 협상에 임했으나, 일부 사항에 대한 이견으로 협상은 최종 결렬됐다”고 밝혔다.하림 주가 16% 급락, 팬오션 21% 급등하림 컨소시엄은 지난 12월HMM매각(지분 57.9%) 본입찰에서 6조4000억원을 써내 동원그룹을 제치고 우선협상대상자로 선정됐다. 하지만 본계약(주식매매 계약) 협상부터 삐걱거렸다. 협상 시한을 지난달 23일에서 이달 6일로 한차례 연장했지만, 양측의 입장 차이는 좁히지 못했다.투자은행(IB) 업계에선 매각 후 실질적인 ‘경영 주도권’을 둘러싼 줄다리기가 난항을 겪은 가장 큰 원인으로 꼽는다. 정부는HMM이 국가 해운산업에 차지하는 역할을 강조하며 확실한 ‘안전장치(경영권 안정)’를 담은 주주 간 계약을 요구한 것으로 알려졌다. 이에 맞서 하림 컨소시엄은 ‘잔여 영구채 주식 전환’을 3년간 늦춰달라고 요구했으나 매각 측 반대에 포기했다.정근영 디자이너산은·해진공이 보유한 1조6800억원 상당의 영구채가 올해와 내년 주식으로 전환(조기상환청구권 행사)하면 하림의 지분율은 57.9%에서 38.9%로 떨어진다. 반면 산은과 해진공은HMM매각 이후 영구채 전환권 행사로 2대 주주(지분 32.8%)로 남아 영향력을 행사할 수 있다. 배세호 하이투자증권 연구원은 “HMM잔여 영구채가 전환되면 (하림은)HMM의 독립경영을 보장받지 못할 것”이라고 분석했다.JKL파트너스의 ‘5년간 지분 매각 금지’ 조항에서도 양측은 평행선을 달렸다.JKL파트너스는 하림컨소시엄의 자금 지원사격을 맡은 재무적 투자자(FI)다. 자금을 조달한 뒤 회수해 수익을 내는FI특성을 반영해달라는 게 하림 측 요구였지만, 받아들여지지 않았다는 게IB측의 해석이다. 협상 과정에서 5년→3년으로 단축하는 중재안도 나왔지만, 규정에 예외를 둘 수 없다는 정부 입장이 강경했다고 한다.하림의 자금조달 능력에 대한 의구심이 매각이 무산된 원인 중 하나였다는 시각도 있다. 하림은 자회사인 팬오션을 통한 3조원 상당의 유상증자, 2조원 이상의 인수금융,JKL파트너스의 지원 등으로 6조4000억원 인수자금을 마련할 계획이었다. 한 재계 관계자는 “하림의 자금 여력이 충분했다면 지분매각 기한 단축 등에서 이견이 발생하지 않았을 것”이라고 말했다.하림그룹은 7일 입장문을 통해 “실질적인 경영권을 담보해 주지 않고 최대주주 지위만 갖도록 하는 거래는 어떤 민간 기업도 받아들이기 어려울 것”이라고 주장했다.앞으로HMM의 운명은 어떻게 될까. 매각이 불발되면서HMM의 지분 57.9%를 보유한 산은과 해진공이 다시 대주주로 남는다.IB업계에선 단기간 재매각에 나서긴 쉽지 않을 것으로 예측한다. 지난해와 달리 해운업황의 불확실성이 커졌기 때문이다. 먼저 세계 2위 선사인 머스크와 5위인 하파그로이드가 새 운항동맹(얼라이언스) ‘제미니’를 결성했다.HMM과 함께 ‘디얼라이언스’ 소속이던 하파그로이드가 빠져나가며HMM소속 운항 동맹은 경쟁력을 잃게 됐다.운항동맹은 해운사들이 특정 항로의 과잉 경쟁을 막기 위해 운임·영업조건 등을 약속한 일종의 카르텔이다. 자사 선박이 다니지 않는 항로는 동맹 선사를 활용하는 식으로 화물 최적화가 가능하다. 이 밖에도 홍해 선박 공격, 에너지 가격 상승 등도 불확실성을 가중시키는 요인이다. 김인현 고려대 법학전문대학원(해상법) 교수는 “새 주인은HMM소속 동맹 문제까지 해결해야 하므로 자본력에 더해 전문성까지 중요해진 상황”이라고 짚었다.전문가 “새 주인, 자본력·전문성 갖춰야”앞으로 누가HMM의 새 주인이 될 것인지도 관심사다.그간 후보로 거론돼온 현대차·포스코·한화·HD현대 등은 일단 가능성을 부인하면서도 상황을 예의주시하고 있다. 현대차그룹은HMM의 전신인 현대상선과 뿌리가 같고, 현대글로비스를 통해 물류·유통·해운사업을 하고 있다. 포스코는 물류량이 많아 해운사 인수 시 시너지를 낼 수 있고, 한화오션(대우조선해양)을 인수한 한화그룹이나 과거 현대상선의 최대주주였던HD현대그룹도HMM인수로 조선업과의 시너지를 기대할 수 있다.한편,HMM매각 무산 소식이 전해지면서 7일 하림 주가는 전날보다 16.18% 급락해 3135원에 거래를 마쳤다. 반면 하림 자회사인 팬오션 주가는 21.09% 치솟았다. 인수 자금을 마련해야 한다는 부담이 해소되면서다.HMM주가는 0.42% 소폭 하락한 1만9080원에 장을 마감했다."
