date,title,content
2022-04-06,"인수위 ""북미·동유럽산 곡물 수입…3~5개월치 재고 확보""","전 세계 밀 수출량의 30%를 차지하는 러시아와 우크라이나가 전쟁으로 수출을 제한하면서 주요 곡물가격이 급등하고 있다. 사진은 지난 1일 서울시내 한 대형마트에 진열된 밀가루. 뉴스1러시아의 우크라이나 침공 여파로 세계 곡물 가격이 급등하는 가운데 대통령직인수위원회가 관련 기업들과 대응 방향에 대해 논의했다.대통령직인수위원회 경제2분과는 6일 '글로벌 곡물 공급망 점검·대응 방향 모색을 위한 업계 간담회'를 개최했다고 밝혔다.인수위는 ""국내 곡물 수입·유통업체들이 수급에 차질이 빚어진 러시아와 우크라이나산 곡물 대신 북미, 타 동유럽 국가 산 곡물로 신속히 전환하고 있으며, 국내에서 필요로 하는 공급 물량의 3∼5개월 치의 재고를 확보한 것으로 확인됐다""고 밝혔다.업계는 ""국제 곡물 가격 상승에 따라 식품․외식 및 사료 업체 등의 원가 부담이 커지고 있다면서 밀가루, 사료 등의 가격 상승이 우려된다""고 말했다.이에 농산물 의제매입세액 공제 한도 및 공제 비율을 한시적으로라도 확대할 필요가 있다는 의견 등을 제시했다.더불어 중장기적으로 민간기업이 주도하는 해외 곡물 유통망 확보 지원 및 인센티브 부여, 기초 식량 작물의 비축 확대 및 위기 시 방출, 국내 생산기반 확충 필요 등에 대한 논의가 이어졌다.인수위는 ""오늘 논의된 내용을 관련 기관과 협의하여 보완‧발전시켜 나갈 것이며, 추후 국정과제에 반영할 계획""이라고 밝혔다.한편 이날 간담회에는 포스코인터내셔널, 팬오션,CJ,농협사료,SPC,롯데상사 등 곡물 수입과 유통, 해외농업개발을 담당하는 기업과 농림축산식품부 관계자, 인수위 경제2분과 왕윤종 인수위원을 비롯한 전문위원 등이 참석했다."
2023-12-18,"하림, HMM 품는다…6조4천억원 써내 동원 제쳐","산은, 인수 우선협상대상자 선정해운사 팬오션 운영 등 높은 평가HMM의 대형 컨테이너선.HMM제공하림그룹이 국내 최대 원양 컨테이너 선사 에이치엠엠(HMM·옛 현대상선)의 우선협상대상자로 선정됐다. 입찰에 함께 나선 동원그룹을 하림그룹이 누른 모양새지만, 최종 본계약 체결까지는 시간이 많이 남아 있는 탓에 최종 결정까지는 좀 더 지켜봐야 할 전망이다. 정부 고위 관계자는 “에이치엠엠 매각 절차는 우선협상대상자 선정이 끝이 아니다”라고 말했다.케이디비(KDB)산업은행과 한국해양진흥공사(이하 공사)는 18일 보도자료를 내어, 에이치엠엠 경영권 매각의 우선협상대상자로 팬오션(하림그룹의 해운 계열사)·제이케이엘(JKL)컨소시엄을 선정했다고 밝혔다. 이들은 향후 세부 계약 조건에 대해 협상한 뒤 내년 상반기 중 거래를 완료할 예정이다. 팬오션·제이케이엘(JKL)컨소시엄은 하림그룹이 이번 입찰에 내세운 입찰 대상자다.앞서 지난달 실시한 본입찰에는 하림그룹과 동원그룹이 참여했다. 하림그룹과 동원그룹 쪽은 지난달 23일 진행된 본입찰에 참여해 6조3천억~6조4천억대 가격을 적어낸 것으로 알려졌다. 하림그룹은 동원그룹보다 수백억원 가량 높은 가격을 제출한 것으로 전해졌다. 하림그룹 쪽은 매물로 나온 산은과 공사의 에이치엠엠 지분(57.9%, 주식 3억9879만156주)을 인수해 에이치엠엠의 최대주주에 오를 계획이다.이번 결정은 본입찰이 시작된 지 25일 만에야 이뤄졌다. 애초 이달 초로 예정됐던 일정이 늦어진 것은 매각 주체인 산은과 공사가 가진 1조6800억원 규모의 잔여 영구채 처리 때문이다. 하림그룹 쪽이 ‘에이치엠엠 잔여 영구채 주식 전환을 3년간 미뤄달라’는 등의 요구 사항을 내놨기 때문이다. 산은과 공사는 이에 난색을 보였다고 한다. 동원그룹도 ‘하림의 요구사항을 받아들인다면 대응을 위해 법적 검토에 들어가겠다’는 내용의 공문을 채권단에 보내기도 했다.이런 논란 속에 하림그룹 쪽은 요구사항을 모두 철회한 것으로 전해졌다. 또 정성평가 과정에서 하림그룹은 지난 2015년 팬오션을 인수합병(M&A)해 경영하고 있는 부분을 높게 평가받은 것으로 알려졌다. 아울러 선박을 활용한 자산 유동화와 영구채 발행 등을 통해 인수금융 없이 팬오션만으로 약 3조원 규모의 인수 자금 조달 계획을 세운 점이 유리하게 작용한 것으로 보인다.하림그룹이 에이치엠엠을 인수하게 되면, 국내 1위 벌크선사인 팬오션뿐 아니라 국내 1위이자 세계 8위 컨테이너선사인 에이치엠엠까지 거느리며 초대형 국적 선사로 도약할 수 있다. 에이치엠엠은 2016년 채권단 관리로 전환된 이후 7년여 만에 새 주인을 찾았다.산은 등 매각 주체는 이번 본계약 체결 시점을 내년 상반기로 제시했다. 본계약 체결에 앞서 하림그룹과 따져볼 지점들이 남아 있다는 것으로 해석할 수 있는 대목이다. 그 중 핵심은 하림그룹의 자금 동원력과 함께 애초 제안했던 잔여 영구채 처리 문제를 다시 제기할 가능성이다.대통령실 고위 관계자는 한겨레에 “정량·정성 평가 모든 면에서 하림그룹이 앞선 것으로 알고 있다. 다만 최종 본계약 체결까지는 시간이 제법 있어 그 사이에 다른 상황이 펼쳐질 여지도 있다”고 말했다."
2023-12-26,"하림 “HMM 유보금 10조원, 경쟁력 강화에 최우선 사용”","배당 최소화…팬오션·HMM합병 안 해국내 최대 원양 컨테이너 선사 에이치엠엠(HMM·옛 현대상선) 매각 우선 협상대상자로 선정된 하림그룹이 에이치엠엠이 보유한 유보금(현금자산)은 해운산업 경쟁력 강화를 위해 최우선으로 사용돼야 한다는 입장을 밝혔다. 선원노조 등이 하림그룹이 회사에 투자해야 할 유보금을 배당을 통해 받아 인수 자금 회수에 쓸 수 있다는 우려를 내자 공식 입장을 밝힌 셈이다.하림그룹은 26일 입장문을 내어 “에이치엠엠이 보유한 현금자산은 현재진행형인 해운 불황에 대응하고 미래 경쟁력을 위해 사용해야 한다는 게 그룹의 확고한 생각”이라며 “엠에스씨(MSC), 머스크 등 글로벌 해운사들은 막대한 현금을 보유하고 해운 불황에 대비하고 있다”고 밝혔다. 일각에서 배당을 통해 하림그룹이 10조원에 달하는 에이치엠엠의 유보금을 사용할 것이라는 우려가 나오자, 유보금은 다른 용도로 사용하지 않겠다는 확실한 입장을 표명한 것이다.하림그룹은 “불황이 예견되는 상황에서 에이치엠엠의 경쟁력을 키우기 위해서는 기본적으로 배당은 최소화하는 것이 바람직할 것”이라며 “과거 팬오션의 경쟁력 제고를 위해 인수합병 이후 5년 동안 배당을 하지 않은 전례가 있다”고 덧붙였다.사무금융노조 에이치엠엠지부와 에이치엠엠해원연합노조는 지난 22일 “10조원에 이르는 유보자금은 2016년 한진해운의 파산으로 망가진 대한민국의 해운산업을 재건할 종잣돈이자, 에이치엠엠의 국제경쟁력을 높이는데 필수불가결한 핵심 에너지”라면서 “하림이 자신들의 사업에 유용하는 것을 금해야 한다”고 주장했다.하림그룹이 에이치엠엠(HMM·옛 현대상선)의 새 주인을 찾기 위한 매각 본입찰에서 동원그룹을 제치고 우선협상대상자로 지난 18일 선정됐다.HMM제공하림은 또한 영구채 전환 유예를 통한 추가 배당을 받을 의도가 없다는 점도 분명히 했다. 하림 쪽은 “통상적인 절차에 따라 예비 입찰 단계부터 오버행(잠재적 과잉 물량 주식) 이슈 해소를 통한 이해관계자 보호를 위해 일정 기간 영구채 전환 유예와 관련한 의견을 제시했으며, 이는 협상 과정에서 충분히 논의될 것”이라고 덧붙였다.팬오션과 에이치엠엠의 합병이나 인위적 조정에 관한 추측에도 분명히 선을 그었다. 하림 쪽은 “기본적으로 계열사 간의 독립 경영과 선의의 경쟁을 촉진하는 경영원칙을 갖고 있다”며 “인수합병을 통해 하림그룹의 계열사가 된 많은 회사가 사료 부문(천하제일사료·선진·팜스코), 닭고기 부문(하림·올품·한강식품), 돼지고기 부문(선진포크·하이포크)에서 이전 회사명, 브랜드, 제품 등을 유지하고 있다”고 강조했다."
2023-12-20,"‘고래를 삼킨 닭’ 하림, ‘승자의 저주’ 넘어 순항할까","HMM정상화까지 산 넘어 산하림그룹이 국내 최대 컨테이너 선사 에이치엠엠(HMM·옛 현대상선)의 새 주인을 찾기 위한 매각 본입찰에서 동원그룹을 제치고 우선협상대상자로 선정됐지만, 최종 주식매매계약 체결은 물론 에이치엠엠을 정상화하는 데까지 넘어야 할 산이 적지 않다. 글로벌 경기 침체로 해운업황 부진이 이어지고 있는 데다, 수조원대에 이르는 인수 자금을 끌어와야 하는 하림의 자금 조달 능력에 의구심을 표하는 시각이 많기 때문이다. 인수 이후 초대형 국적사로서의 경쟁력 하락은 물론 그룹 전체가 어려워지는 ‘승자의 저주’에 빠질 수 있다는 우려의 목소리가 나온다.하림그룹이 에이치엠엠(HMM·옛 현대상선)의 새 주인을 찾기 위한 매각 본입찰에서 동원그룹을 제치고 우선협상대상자로 지난 18일 선정됐다.HMM제공하림은 19일 입장문을 내어 “성실한 협상을 통해 본계약을 체결할 수 있도록 최선을 다하겠다”며 “본계약을 맺게 되면, 벌크 전문 해운사인 (자회사) 팬오션과의 시너지를 통해 글로벌 경쟁력을 높여 안정감 있고 신뢰받는 국적선사로 발전시켜 나가겠다”고 했다. 앞서 채권단인 케이디비(KDB)산업은행과 한국해양진흥공사는 지난 18일 에이치엠엠 인수 우선협상 대상자로 팬오션(하림그룹)·제이케이엘(JKL)파트너스 컨소시엄을 선정한 바 있다.그러나 최근 해운시장이 침체 국면에 접어들면서 하림이 언급한 ‘인수 시너지’를 얻기 힘들 것이란 관측이 나온다. 코로나19 대유행 때 특수를 누린 해운업체들은 올해 글로벌 경기 침체와 선박 공급 확대에 따른 운임 하락 등으로 휘청이고 있다. 해상운송 운임 수준을 보여주는 상하이컨테이너운임지수(SCFI)는 지난 15일 기준 1093.52로 지난해 1월7일(5109.60)의 5분의 1 수준으로 폭락했다.이에 따라 에이치엠엠 실적도 위협받고 있다. 올 3분기 에이치엠엠 영업이익(758억원)은 전년 동기 대비 97% 급감했다. 더욱이 글로벌 기업들이 코로나19 대유행 때 발주한 컨테이너선이 내년부터 본격적으로 인도될 예정이어서 공급 과잉 등으로 해운업황은 단기간에 좋아지기는 어려울 것으로 보인다.자금 조달도 관건으로 꼽힌다. 하림이 본입찰에서 써낸 인수가는 6조4천억원 수준으로 알려져 있다. 하림의 현금성 자산 1조6천억원을 훌쩍 뛰어넘는 규모다. 컨소시엄을 꾸린 사모펀드 운용사 제이케이엘파트너스의 자금력에 의지해야 하는 셈이다. 이에 따라 하림은 우선협상대상자 선정 과정에서 원활한 자금 조달을 위해 채권단에 잔여 영구채(1조6800억원 규모) 주식전환을 3년간 미뤄달라고 요청했으나, 받아들여지지 않았다.문제는 하림이 앞으로 세부 계약 조건 협상 테이블에 이런 요구사항을 다시 올려놓을 수 있다는 점이다. 김홍국 하림 회장은 이날 연합뉴스 인터뷰에서 영구채 전환 요구와 관련해 “(채권단이) 안 받아줄 가능성이 높다”면서도 “(아직) 결정된 게 아니다”라고 협상의 여지를 열어뒀다. 이렇게 되면 경쟁 후보였던 동원그룹이 앞서 예고한 대로 법적 대응에 나서는 등 공정성 시비가 불거질 수 있다.하림의 재무부담이 커지고 있는 점도 걸림돌로 작용하고 있다. 하림은 현재 서울 양재동에 국내 최대 주상복합 물류단지를 조성하는 도시첨단물류단지 개발 사업도 추진 중이다. 총사업비만 6조4천억원에 이르는 초대형 사업이다.한편에서는 닭고기 공급 업체로 출발해 컨테이너선사 운영 경험이 없는 하림이 ‘고래’ 격인 글로벌 해운사를 제대로 운영할 수 있겠느냐는 의구심도 나온다. 해운업계 관계자는 “하림이 벌크선사인 팬오션 경영을 바탕으로 에이치엠엠 인수전에 나섰지만, 컨테이너선 사업과 벌크선 사업은 엄연히 다른 영역”이라며 “지금 상황은 닭이 고래를 삼킨 형국이다. 세계 2위 해운선사인 덴마크 머스크마저도 적자로 돌아선 상황에서 수조원의 차입금까지 떠안는 하림이 에이치엠엠을 안정적으로 이끌 수 있을지 의문”이라고 했다. 에이치엠엠 노동조합의 반발도 넘어야 할 과제다. 노조는 현금성 자산이 10조원에 이르는 에이치엠엠이 하림의 곳간으로 전락할 수 있다고 단체행동을 예고한 상태다.한편, 강도형 해양수산부 장관 후보자는 이날 국회 인사청문회에서 에이치엠엠 우선협상대상자 선정과 관련한 의원 질의에 “‘승자의 저주’가 일어나서는 안 된다고 생각한다. 장관이 된다면 (매각 계획을) 처음부터 꼼꼼히 한번 볼 생각”이라고 말했다."
2024-12-02,12월3일 인사,⊙ 금융위원회 △의사운영정보팀장 박성진⊙ 행정안전부 <전보> ◇과장급 △안전문화교육과장 이영인 △정부청사관리본부 시설총괄〃 최우식 △〃 대구청사관리소장 김갑용⊙ 문화체육관광부 <전보> △해외홍보콘텐츠과장 이순일⊙ 한국정경신문 △편집국장 겸 금융·투자국장 송의준⊙ 한국일보 △논설위원실장 정진황 △논설위원 최문선 이영창 이동현 △신문에디터 이왕구 박석원 ◇부문장 △정치국제 송용창 △사회정책 고찬유 △경제산업 한준규 △온라인총괄디렉터 이훈성 ◇부장 △사회 강철원 △사회정책 이진희 △전국 김창훈 △경제 이대혁 △문화 강지원 △엑설런스랩장 남상욱⊙ 일요주간 △부사장 김경훈⊙ 케이엔엔 ◇임원급 <본부장> △경남 박철훈 △신성장 김백수 △제작편성 전성호 △사업 단유정 △KNN미디어플러스 대표 추종탁 ◇국장 △보도 김성기 △서울보도 길재섭 △경남보도 표중규 △신성장 이영우 △제작 허민경 △편성라디오 이근호 △영상제작 국주호 △경남문화사업 이섬근 △취재부장 김상진⊙ 아산재단·서울아산병원 <아산재단> △보령아산병원장 이필량 ◇실장 △재단사무처 경영지원 박철완 △강릉아산병원 경영지원 겸 동부지역관리본부장 오성규 △정읍아산병원 경영지원 겸 서부지역관리본부장 김준형 <서울아산병원> △교육부원장 최인철 △관리부〃 정태경 △경영지원실장 윤천식 △운영지원〃 손종석⊙ 더팩트 △세종팀 부국장 박병립 △〃 부장 박은평⊙ 대원제약 <승진> ◇상무 △사업개발부 길선희 △신약연구부 황현환 ◇이사 △해외사업부 강종환⊙ 나이스그룹 <대표이사 내정> 나이스평가정보 △전무 김종윤 <승진> △부회장 신희부 △전무 안영복 △상무 김동구 김영일 △상무보 서혜정 이철현 조성호 박상순 나이스신용평가 <승진> △사장 김명수 △상무보 김학기 송기종 나이스 씨엠에스 <대표이사 내정> △전무 강명구 <전보> △상무 하철수 씨유엔 <대표이사 내정> △상무보 백상헌 서울전자통신 <대표이사 내정> △상무 남화성 <승진> △상무보 김영주 나이스홀딩스 <승진> △전무 김원우 △상무 이익중 △상무보 장호준 아인스미디어 <승진> △상무보 문세일 박준홍 한국전자금융 <승진> △상무 이상헌 △상무보 이창오 <전보> △상무 안병석 △상무보 최경호 나이스정보통신 <승진> △상무 하형수 <전보> △상무보 남경준 케이아이에스정보통신 <승진> △상무 이헌성 <전보> △상무 이승태 나이스디앤알 <승진> △상무보 문형민 오케이포스 <승진> △전무 김정윤 아이티엠반도체 <승진> △전무 김상엽 인해진 △상무 유재민 이성희 임강윤 임상섭 황보상직 △상무보 안상훈 유성진 정회원 최윤조 나이스디앤비 <전보> △상무 김기창 이기혁 나이스신용정보 <전보> △상무보 이창남⊙ 삼성그룹 <승진> 삼성에스디아이 △부사장 김윤태 남주영 박규성 △상무 김익수 김현욱 남중현 변상원 송정훈 안희정 유형우 황선욱 △마스터 송재혁 삼성에스디에스 △부사장 신계영 전민섭 황수영 △상무 김성범 노광빈 민대홍 서진우 이관희 이동섭 이명교 최병철 △마스터 홍승기 삼성글로벌리서치 △상무 이성혁 임명기 삼성전기 △부사장 김희열 오창열 △상무 강병우 김태영 박재성 손용훈 송용준 이민곤 조영일 △마스터 구경모 삼성디스플레이 △부사장 기창도 김봉한 윤지환 이호중 한준호 황의훈 △상무 강의식 김성철 김영석 김현영 박순룡 송봉섭 오현욱 최동완 한상면 <선임> △마스터 홍종호⊙ 에코프로그룹 <승진> 에코프로 △전무 이승환 이수호 김순주 에코프로비엠 △전무 방한민 최윤영 △상무 이현진 오동구 공보현 에코프로이엠 △부사장 이규봉 에코프로머티리얼즈 △전무 강동현 △상무 이성준⊙ 코웨이 <승진> ◇전무 △김형권 1사업본부장 <선임> ◇상무보 △김경훈 홈케어사업실장 △심재정 글로벌신사업TF장 △한두원 선행개발실장⊙ 팬오션 <승진> ◇상무 △대형선영업본부장 정상진 △벌크영업2〃 서보남 ◇상무보 △전용선사업실장 조양진⊙ 호반그룹 <승진> △부사장 김준석 △상무 서동진 호반건설 <선임> △개발사업실장 김시한 <승진> △상무 이규재 △상무보 오준균 △이사 김진기 유공상 호반산업 <승진> △전무 김용일 △이사 송진원 김주철 대한전선 <승진> △전무 백승호 △상무 남정세 △상무보 이균수 홍동석 △이사 한창석 최승호 한상유 호반호텔앤리조트 <선임> △리조트부문대표 강신주 ◇총지배인 △퍼시픽리솜 박광수 △스플라스리솜 김윤환 △포레스트리솜 이근수 <승진> △상무보 고균범 호반서서울(서서울CC) <승진> △상무 이은래 호반프라퍼티 <선임> △대표이사 김동남 전무 삼성금거래소 <승진> △상무 이영만⊙ 홈앤쇼핑 <승진> ◇전무 △경영지원본부 이성한 ◇상무 △방송본부 황의식
2024-10-04,10월5일 궂긴 소식,"◆ 육미선(전 충북도의원)씨 별세=4일 오전 9시34분 청주시장례식장. 발인 6일 오전 9시30분. (043)291-4444.◆ 강태윤씨 별세: 민정(엔에이치농협은행 제주본부 마케팅추진단장)씨 부친, 김원삼(에이케이홀딩스 인사팀 커뮤니케이션파트 부장)씨 장인=3일 오후 제주 부민장례식장. 발인 6일 오전 5시30분. (064)742-5000.◆ 이희주씨 별세: 고병우(전 건설부장관)씨 부인, 승범(전 금융위원장) 소영 소희 소정(HSBC은행 근무)씨 모친, 이상구 김남구(한국투자금융지주 회장) 이혁수(티라유텍 상무)씨 장모, 신지숙씨 시모=4일 서울성모병원. 발인 6일 오전 7시30분. (02)2258-5940.◆ 강완수씨 별세: 선경(한국사회복지공제회 이사장·서강대 신학대학원 사회복지학과 교수)씨 부친, 신승남(이화여대 법학전문대학원 명예교수)씨 장인=3일 오후 6시 서울아산병원. 발인 6일 오전 7시. (02)3010-2000.◆ 김복례씨 별세: 이순용(이데일리 의학전문기자) 선용 삼용 준용(건축설계사)씨 모친, 오승희 김화수 양주연 정지연씨 시모=3일 오후 8시 은평성모병원. 발인 7일 오전 5시30분. (02)2030-4467.◆ 최제민씨 별세: 헌수(대한약사회 대외협력실장) 용석(주식회사 이롬 부장)씨 부친=4일 오전 2시1분 서울성모병원. 발인 6일 오전 9시. (02)2258-5940.◆ 문준옥씨 별세: 병인(경북대 교수)씨 부친, 조양진(팬오션 전용선사업실장)씨 시부=4일 삼성서울병원. 발인 6일 오전 8시. (02)3410-3151."
2024-09-29,‘K-밸류업 지수’ 사흘 동안 2.4%↑…오늘부터 실시간 공개,"정은보 한국거래소 이사장이 5월24일 서울 여의도 한국거래소에서 ‘기업 밸류업, 자본시장 레벨업을 위한 한국거래소 핵심전략’을 발표하고 있다. 연합지난 24일 100개 구성 종목이 공개된 ‘코리아 밸류업 지수’가 사흘 동안 2.4% 오른 것으로 나타났다.29일 한국거래소의 개별지수 종합정보에 따르면, 27일 종가 기준 코리아 밸류업 지수는 1020.73으로 지수 공개 전인 24일 종가(996.66)보다 2.4% 상승했다. 이 지수는 거래소가 앞서 발표한 대로 올해 1월2일 1000을 기준으로 한다. 지수의 세부 종목 100개는 24일 장 마감 뒤 공개된 바 있다. 거래소는 30일부터 국내·외 투자자들에게 지수와 구성종목 주가 현황을 실시간 제공할 예정이다.밸류업 지수는 최근 며칠 동안 다른 지수에 비해 많이 오른 편이다. 지수가 우량 종목으로 구성된 점 등이 비슷하다는 평가를 받는 코스피200은 같은 기간 1.2% 올랐다. 코스피는 0.7% 상승하는 데 그쳤다. 코스닥 지수는 0.9% 올랐다.종목별로는 에코프로에이치엔(코스닥)이 20.65%로 가장 많이 올랐다. 그다음으로 효성티앤씨(15.95%·코스피), 한진칼(15.38%·코스피), 윤성에프앤씨(14.23%·코스닥), F&F(12.52%·코스피),SK하이닉스(12.42%·코스피), 팬오션(11.68%·코스피), 에스엠(10.24%·코스닥) 등이 뒤를 이었다.SK하이닉스를 비롯해 삼성전자(1.58%·코스피), 한미반도체(7.01%·코스피) 등 대형 반도체주도 올랐지만 이는 지수 편입 효과라기보다는 미국 반도체 기업 마이크론이 25일(현지시각) 시장 예상치를 넘는 실적을 발표한 영향이 큰 것으로 보인다.대표적 저평가주로 밸류업 수혜주로 꼽힌 금융주는 주가가 선반영됐다는 인식 때문인지 차익 실현 매물이 나오며 상대적으로 부진했다. 한 예로 신한지주와 삼성화재는 각각 0.35%, 2.62% 하락했다.한국투자증권(염동찬·신채림)은 최근 낸 보고서에서 밸류업 지수 종목이 코스피200, 케이알엑스300 등과 비교할 때 “최근 3년 성과의 경우 주식 시장 변동성이 증가한 2022년을 포함하면 마이너스 수익률을 기록했지만 다른 벤치마크 대비 양호한 모습을 보였다”며 “특히 밸류업 프로그램에 대한 기대가 커졌던 최근 1년 성과가 양호했다”라고 분석했다. 거래소는 11월 초 밸류업 지수를 따르는 상장지수펀드(ETF)를 상장시킬 계획이다."
