date,title,content
2023-04-07,3D 시뮬레이션으로 가구 등 미리 배치…  “이케아도 쓰게 할 겁니다”,"[세계로 뛰는 스타트업] (11) ‘어반베이스’ 하진우 대표·김덕중 부사장서울 강남구 어반베이스 사무실에서 김덕중(왼쪽) 부사장과 하진우 대표가AR(증강 현실) 인테리어 서비스를 시연해 보이고 있다. 하 대표가 들고 있는 태블릿 화면을 통해 가상의 소파를 자유롭게 이동시키며 가구 배치를 시뮬레이션 해볼 수 있다./박상훈 기자스마트폰 앱을 켠다. 스마트폰 화면에서 뜨는 방에 가상의 식탁이나 책장, 소파 등을 이리저리 배치해 본다. 맘에 들지 않으면 방 사진만 찍어 앱에 올리면 자신이 좋아하는 디자인을 파악한 인공지능(AI)이 상품을 추천해준다.마치 컴퓨터로 방 꾸미기 게임을 하는 듯한 이런 기술을 실제 인테리어에 활용하면서 세계로 뻗어나가는 스타트업이 있다. 3D 인테리어 플랫폼 서비스업체 ‘어반베이스’다. 전국 아파트 95%의 도면을 확보한 어반베이스는 이를 3D로 바꿔 가상공간에 각종 가구를 이리저리 배치해볼 수 있도록 했다.국내에선 퍼시스그룹, 까사미아, 롯데하이마트 등 주요 가구·가전 업체가 어반베이스의 소프트웨어를 활용하고 있다. 일본에 진출한 데 이어, 현재 싱가포르를 거쳐 북미와 유럽 진출도 추진 중이다. 어반베이스는 2021년 ‘100만불 수출의 탑’을 달성했고, 지난해 수출액은 전년 대비 약 3배 이상으로 늘었다.2014년 설립된 어반베이스는 공군 장교 선후배 사이인 하진우(41) 대표와 김덕중(40) 부사장이 전역 후 만난 예비역 장교 모임에서 사업 이야기를 나누다 의기투합해 만든 회사다. 당시 2D 도면을 3D로 자동으로 변환해주는 기술을 개발 중이던 하 대표가 사업 파트너를 찾고 있었는데, 이 얘기를 들은 김 부사장이 다니던 대기업에 사표를 던지고 함께했다고 한다. 두 사람은 투자 유치 성공에 이어 2015년 자동 변환 기술을 완성했고 이듬해부터VR(가상현실) 시뮬레이션 서비스,AR(증강현실) 분석 앱 서비스 등을 차례로 내놓았다.어반베이스에 따르면, 3D 인테리어 시장은 아직도 블루오션이다. 기술도 기술이지만, 도면을 확보하는 작업이 만만치 않아 비슷한 기능을 내세우는 서비스가 거의 없다고 한다.일본에 진출했을 땐 도면에 저작권이 없는 한국과 달리, 지역별로 여러 업체가 이미 도면 저작권을 보유한 상태여서 이들과 개별 계약을 해야 했다. 결국 도쿄 지역 주택 도면의 70%를 확보하는 데 성공하면서 ‘일본의 이케아’라 불리는 니토리, 광고 대기업 덴츠, 일본 3위 가구 브랜드 시마추 등도 손을 내밀어왔다. 이제는 일본 실적을 지렛대로 삼아 싱가포르에서 도면을 확보 중이다. 하 대표는 “외국인들이 이사를 자주 하는 곳이어서 수요가 크다는 점, 영어권 국가여서 북미 진출을 시험하는 차원이란 점을 모두 고려했다”고 말했다. 아직 정식으로 결정한 건 아니지만 고가 가구 시장이 큰 스페인의 주택 도면도 수집 중이다. 하 대표는 “플랫폼 기업의 기본은 ‘데이터’에 있다는 점을 새삼 깨닫는다”고 했다.어반베이스는 방대하게 쌓인 도면과 소비자 데이터를 바탕으로 인테리어 직접 시공, 가구 판매 중개 같은 파생 사업에도 진출했다. 빠르면 연내에 챗GPT같은AI의 조력을 받아 자동으로 가구나 인테리어 디자인을 해주는 기술도 도입할 예정이다. 하 대표는 “세계 1위 가구업체 이케아도 우리 3D 인테리어 플랫폼을 쓰도록 만드는 게 목표”라고 말했다."
2023-03-09,100만원 ‘냉각팬 의자’도 불티… 게이밍 가구가 쑥쑥 큰다,"‘게이머 2000만명 시대’,게임 특화 상품에 지갑열어경기도 평택에 사는 직장인 최영현(30)씨는 최근 게임용 의자를 109만원에 샀다. 시트 부분에 3단계 조절 쿨링팬이 달렸고 게임 종류에 따라 팔걸이도 9단계로 조절할 수 있는 의자다. 최씨는 “보통 3시간 정도 게임을 하는데 일반 의자는 허벅지에 땀이 차 불편했다”며 “새 의자는 자동차와 같은 쿨링시트가 있어 쾌적하게 게임을 즐길 수 있을 것 같아 과감하게 투자했다”고 말했다.국내 게임 인구가 2000만명을 넘어서면서 ‘게이밍 퍼니처(가구)’가 새로운 산업으로 뜨고, 게임 전용 모니터, 10만원대 마우스, 50만원이 넘는 게임용 무선 헤드셋 등 고가의 게임 기기가 인기를 끌고 있다. 업계 관계자는 “2000년대 초반PC방에서 스타크래프트를 즐겼던 세대가 구매력이 큰 4050 중년층이 되면서 게임뿐만 아니라 주변 산업도 함께 커지고 있다”고 말했다.의자 전문 브랜드 시디즈가 지난 6일 공식 출시한 게임용 의자 ‘시디즈GCPRO’.앉는 부분에 바람이 나오는 쿨링 시트가 장착돼 있어 장시간 게임을 즐길 수 있다. 109만원으로 비교적 고가인데도 사전 출시 2주 만에 초동 물량 200대가 다 팔렸다./시디즈게이밍 퍼니처 시장...새로운 산업으로퍼시스그룹의 의자 전문 브랜드 시디즈가 지난달 내놓은 게임용 의자는 2주 만에 사전 판매 물량 200대가 완판됐다. 시디즈 관계자는 “공장을 최대한 가동하고 있는데도 고객들이 주문 후 수령까지 3주 정도 기다려야 한다”고 말했다. 스웨덴의 가구 업체 이케아는 2021년 게이밍에 특화한 제품 컬렉션을 새로 만들고 상품을 내놨다. 책상과 의자는 물론 스탠드, 헤드셋 걸이, 책상에 부착할 수 있는 컵 홀더 등 게임용 인테리어 소품까지 선보였다.게임 전용 가구만 전문적으로 하는 브랜드도 있다. 싱가포르의 프로게이머 출신이 만든 시크릿랩이 내놓은 게임용 책상은 일반 책상보다 가로 길이가 길고, 높이 조절이 가능하다. 139만원짜리 프리미엄 책상 매그너스 프로는 책상 자체에 통합형 전원 공급 장치가 있어PC본체, 모니터, 스피커, 키보드 등 전선을 보이지 않게 한 번에 정리할 수 있어 인기를 끌고 있다. 또 장시간 게임을 즐길 수 있도록 통풍성이 뛰어나고 인체에 부담이 덜하도록 디자인한 게임 의자는 40가지에 달한다.게임 전용 모니터·키보드·헤드셋까지국내 디스플레이 업계에선 삼성과LG가 게이머를 공략하는 중형OLED시장에서 격전 중이다. 삼성전자와LG전자는 지난해 말 나란히OLED게이밍 모니터를 처음으로 출시했다. 반응 속도가 빠르고 슈팅이나 레이싱 게임처럼 화면 전환이 빠른 게임을 할 때도 잔상과 이미지 깨짐 없는 화면을 구현한다는 것을 장점으로 내세웠다. 일반LCD모니터보다 3~5배 비싸지만, 구매력 있는 게임 이용자들 사이에서 인기라고 한다. 업계 관계자는 “1인 가구가 늘고 글로벌 경기 침체로TV시장은 불황기에 접어들었지만 게이밍 모니터 시장은 고급화되며 나 홀로 성장하고 있다”고 말했다. 시장조사 업체 옴디아에 따르면 지난해 40인치대OLEDTV판매량은 117만대로 전년보다 23%나 증가했다.컴퓨터 주변 기기 업체들은 게임을 제대로 즐길 수 있도록 한 고급 키보드, 마우스, 헤드셋 제품을 출시하고 있다. 키보드의 경우 타격감이 좋게 설계하고 라이트가 들어오는 제품들이 많다. 오랜 시간 게임을 해도 손목에 무리가 가지 않도록 디자인된 게이밍 마우스는 10만원대에 팔린다. 고성능 게이밍 기기 전문 브랜드인 스틸시리즈는 지난해 아크티스 노바 프로 무선 헤드셋(54만9000원)을 국내에 출시해 인기를 끌었다.국내 게임 시장 규모는 매년 커지고 있다. 콘텐츠진흥원이 발간한 2022 대한민국 게임 백서에 따르면 2015년 10조7223억원이었던 시장 규모는 지난 2021년 20조9913억원으로 6년 만에 2배로 뛰었다."
2022-08-22,패션·유통업체들이 올여름 양양으로 몰려간 까닭은,"MZ세대 겨냥한 팝업스토어 러시한섬이 지난달 강원도 양양 서피비치에서 연 팝업스토어. 한섬 캐릭터 ‘핸써미’가 새겨진 기념품을 받기 위해 2000여 명의 사람이 몰렸는데 그중 90%가MZ세대였다. /한섬현대백화점그룹의 패션업체 한섬은 이번 여름 처음으로 ‘백사장’ 팝업스토어를 열었다. 지난달 29~31일까지 강원도 양양 서피비치에 ‘홀라! 한섬’이라고 쓰인 파란색 미니 버스를 세워놓고, 사진을 찍거나 퀴즈 이벤트에 참여하면 한섬의 캐릭터 ‘핸써미’가 새겨진 보냉백·텀블러·부채 등을 증정한 것이다. 이 팝업스토어에 3일간 2000명이 방문했는데, 그 중 90%가MZ세대였다. 한섬은 “젊은 세대도 친근하게 여길 수 있는 방법을 고민하다가 양양 서피비치에 팝업스토어를 열게 됐다”고 말했다.올 여름 패션·유통 업체들이 ‘강원도 양양’으로 몰려들었다. 유통업계에서는 “올 여름 가장 인기있었던 ‘팝업 스토어’ 성지가 바로 양양 서피비치”라고 말한다. 서핑을 즐기는 ‘서퍼족’들이 주로 찾는 강원도 양양 서피비치는 코로나 기간 해외를 나가지 않고도 해외 분위기를 느낄 수 있다는 소문이 나면서 유명 관광 명소로 떠올랐다. 특히MZ세대들 사이에서 인기를 끌면서, 주말에만 약 3만명이 서피비치를 방문하는 것으로 알려졌다. 젊은 고객층을 공략하고 싶어하는 업체들이 서피비치 등에 잇달아 팝업스토어 등을 열고 있다.롯데마트는 오는 9월 30일까지 양양 서피비치에서 ‘블랙위너수박’ 팝업스토어를 진행한다. 블랙위너수박으로 만든 주스와 과육을 잘라 만든 수박바를 판매한다. 롯데마트의MZ세대 사원들이 양양 서피비치를 마케팅 장소로 선정했다. 지난 15일 오픈 후 하루 평균 300명 이상이 방문하고 있다.LF의 패션브랜드 헤지스도 이달 5~7일 강원도 양양 서피비치에서 가을·겨울 시즌 가방과 한정판 비치백 등을 선보이는 팝업스토어를 열었다. 매장 자체를 선베드와 서핑보드 등 여름 관련 소품과 함께 헤지스의 대표 패턴인 ‘헤리아토’로 꾸몄다. 해외 맥주 브랜드 하이네켄도 신제품 ‘하이네켄 실버’ 출시를 기념한 팝업스토어를 인구해변에 있는 편의점GS25에 열고, 이달 말까지 운영한다.퍼시스그룹 계열의 책상 브랜드 데스커는 연말까지 양양에 ‘워케이션’(일과 휴가를 병행하는 것·work+vacation)이 가능한 공간을 마련해 기업 회원과 멤버십 회원이 이용할 수 있도록 했다."
2022-05-19,"개리야스·펫민번호· 펫스텝, 뭔지 아신다면…","반려견용 메리야스(러닝셔츠). /BYC개리야스, 반려견 의류 세탁기, 펫 스텝(계단)…. 반려동물과 함께 사는 가구가 늘어나면서 이들을 겨냥한 이색 제품과 서비스가 속속 나오고 있다.속옷 업체BYC는 지난 16일 반려견용 러닝셔츠를 출시했다. ‘개’와 ‘메리야스(러닝셔츠)’를 조합해 ‘개리야스’라는 별칭도 붙였다.BYC관계자는 “개는 체온이 높고 몸에 땀구멍이 없어 여름철 더위를 많이 탄다”며 “접촉 냉감 원단을 사용해 반려견이 시원함을 느낄 수 있게 만들었다”고 말했다.LG전자는 지난달부터 ‘LGUP가전’으로 출시된 트롬 세탁기·미니워시(소형 통돌이 세탁기)에 ‘펫케어 코스’를 지원하고 있다. 앱에서 소프트웨어를 업그레이드하면 펫케어 세탁을 할 수 있다. 손빨래 동작과 온수 헹굼을 여러 차례 반복하는 코스로 반려동물의 옷에 묻은 배변이나 흙 같은 생활 얼룩을 제거할 수 있다.LG전자 관계자는 “미니워시의 경우 반려동물 전용 세탁기로 활용할 수도 있다”고 말했다. 트롬 건조기 펫케어 코스도 이달 말부터 지원할 예정이다. 반려동물을 키우는 사람의 옷에 밴 반려동물의 체취와 냄새, 옷에 묻은 반려동물의 털을 제거하는 데 도움을 준다.반려동물용 이색상품 속속 출시가구업계는 사람과 동물이 함께 사용할 수 있는 반려동물용 가구를 내놓고 있다. 퍼시스그룹 일룸이 지난달 내놓은 ‘펫스텝(반려견이 소파를 오를 때 사용하는 계단)’은 기존 일룸 소파 제품과 디자인을 통일해 함께 놔둬도 미관을 해치지 않게 했다. 회사 관계자는 “캣타워(고양이 놀이용 구조물)를 접목한 책장, 거실 테이블 밑 공간을 활용한 고양이용 해먹 제품처럼 공간을 효율적으로 활용할 수 있는 제품들도 인기를 끌고 있다”고 말했다.반려동물 동반 입장을 허용하는 카페도 늘고 있다. 작년 7월 처음으로 반려동물과 함께 이용할 수 있는 매장을 연 커피빈은 이달까지 반려동물 매장을 9개로 늘렸다. 이들 매장에선 반려견을 위한 전용 방석과 식기 대여 서비스를 제공한다. 앱에서 반려동물의 생년월일과 성별 같은 정보를 기입하면 ‘펫민번호’를 발급하고, 반려동물 간식·음료를 살 때 적립 도장도 찍어준다. 스타벅스도 올해 초 경기도 남양주에 문을 연 더북한강R점에 펫파크 공간을 따로 조성했다."
2022-04-06,침대도 들썩,"가구업계 가격 줄줄이 올려이케아는 최대 25% 인상이케아 매장 모습. /이케아코리아본격적인 봄 이사철과 결혼철이 시작된 가운데 가구 가격이 줄줄이 오르고 있다. 코로나 장기화로 원자재 가격과 물류비, 인건비 등이 지속적으로 상승한 영향이다.저렴한 가격으로 젊은 층에게 인기가 좋은 이케아코리아는 최근 수납장, 식탁, 침대를 포함한 주요 품목 가격을 최대 25% 올렸다. 이케아코리아 관계자는 “전체 제품 중 10% 정도 가격을 조정했으며 일부 품목은 가격을 내렸다”며 “인하된 제품을 포함해 평균 가격 변동률은 3.5%”라고 말했다.국내 1위 가구업체 한샘은 지난 4일 침대·소파·책장·옷장을 포함한 주요 가구 가격을 평균 4% 인상했다. 지난 2·3월 창호·마루·부엌·욕실 품목 가격을 인상한 데 이어 이번엔 가구 가격을 올렸다. 퍼시스그룹의 의자 전문 브랜드 시디즈도 이달 1일부터 전체 품목의 절반 정도인 190여 개 품목 가격을 평균 5% 인상했다. 앞서 작년에는 현대리바트와 에이스침대, 시몬스, 일룸, 신세계까사 같은 주요 가구 업체가 줄줄이 가격을 인상했다.업체들은 원·부자재 가격과 제조비, 물류비 상승으로 가격 인상이 불가피하다는 입장이다. 한 가구업체 관계자는 “코로나 장기화와 물류난으로 각종 비용이 오른 상황에서 우크라이나 침공 여파까지 겹쳐 제품 가격을 올릴 수밖에 없었다”고 말했다."
2022-03-11,삼양그룹 2억 등 기업들 산불 피해 돕기 기부 이어져,"삼양그룹은 11일 동해안 산불 피해 지역민을 돕기 위한 성금 1억5000만원과 5000만원 상당의 의약품을 대한적십자사에 전달했다. 휴온스그룹도 성금 2억원을 사회복지공동모금회에 기부한다고 이날 밝혔다. 퍼시스그룹은 희망브리지 전국재해구호협회에 1억원을 기부했다.대유위니아그룹의 위니아딤채는 경북 울진 산불 피해 지역에 1억원 상당의 구호 물품을 전달했다. 현대글로비스는 희망브리지 전국재해구호협회의 긴급 구호품 5만2000여 개를 15차례에 걸쳐 산불 피해 지역에 무상으로 운송한 것을 포함, 앞으로도 구호품 운송이 필요할 때마다 지원할 계획이다. 롯데제과는 자사 과자 10만여개, 롯데칠성음료는 생수 2만2000개와 음료 1만2000개를 피해 지역에 보냈다. 풀무원샘물은 자사 생수 제품 1만개를 기부했다."
2022-03-04,"“우크라행 화물, 우회하라 터키로” 또 하나의 워룸, 물류 컨트롤센터","국내외 1000여 기업 물류 책임지는 삼성SDS판교캠퍼스지난 2일 삼성SDS판교캠퍼스 내 글로벌컨트롤센터(GCC). 가로 7.3m,세로 1.4m 대형 스크린에 러시아 쪽으로 향하는 선박 수백대가 표시됐다. 화면 중앙에는 ‘전쟁-레벨3-2022-02-25′이라는 비상경고 표시와 함께 전쟁 상황과 영향 범위를 보여주는 동심원 여러 개가 나타났다. 화면 속 컨테이너선을 클릭해 보니 러시아와 유럽으로 향하는 전자기기, 레진(플라스틱 원료), 각종 기계부품이 실려 있다는 정보가 나왔다. 삼성SDS의 물류사업을 총괄하는 오구일 부사장은 “실시간으로 현지 상황 데이터가 수집되면,AI(인공지능)가 도착 시간을 예측하고 문제가 생길 경우 우회 경로를 파악해 고객사와 곧바로 협의에 들어간다”며 “이곳은 전 세계 1000여 기업의 물류를 책임지는 워룸(WarRoom)”이라고 했다. 이날GCC에서는 우크라이나 남부 오데사항으로 가던 화물은 육상운송으로 전환해 터키를 거쳐 폴란드로 우회시켰고, 시베리아 횡단철도로 이동하던 화물은 우크라이나 대신 벨라루스와 폴란드 철도 노선으로 목적지를 변경했다.전세계 화물선·화물열차 정보 한눈에 - 지난 2일 경기도 성남시 삼성SDS판교캠퍼스에 있는 글로벌컨트롤센터에서 물류사업부 직원들이 전쟁 중인 우크라이나와 러시아 인근 물류 상황을 점검하고 있다. 이곳은 전 세계 1000여 기업 고객의 물류 흐름을 24시간 추적해 실시간으로 대응하는 물류 '워룸(Warroom)'이다. /고운호 기자러시아로 향하던 화물,AI가 실시간으로 우회시켜코로나 팬데믹(대유행)이 초래한 물류 대란에 러시아의 우크라이나 침공까지 더해지면서 글로벌 공급망이 위기를 맞았다. 전 세계 물류 흐름이 연쇄적으로 동맥경화를 일으키면서 인플레이션까지 초래하고 있다. 최근 물류 업계에서는AI·로봇·블록체인 같은 최신 기술로 이러한 문제를 풀려는 기업들이 주목받고 있다. 투자금도 몰린다. 글로벌 시장조사업체 피치북에 따르면 물류 기술 기업에 대한 글로벌 투자액은 2017년 60억달러(약 7조2228억원)에서 지난해(1~3분기) 243억달러(약 29조2523억원)로 늘었다.약 36평(119㎡) 규모인GCC안에서는 치열한 분석과 예측이 계속됐다. 오늘 도착해야 할 자재가 미리 도착하면 창고 보관비가 들고, 다음날 도착하면 지연비용을 물어야 하기 때문에 톱니바퀴 맞물리듯 정시에 모든 게 이뤄져야 한다는 것이다. 지난해 매출 13조6300억원 가운데 8조원가량을 물류사업에서 올린 삼성SDS는 물류 전 과정에IT를 접목했다. 컨테이너에는IoT(사물인터넷)를 접목해 문이 함부로 열리는지 감시하고, 빛에 민감한 화물은 센서로 광량을 실시간 점검한다. 네덜란드에 있는 2만평 규모의 초대형 물류창고에서는AI가 화물 상자를 어떤 방향으로, 어느 순서로 쌓는 것이 효율적인지 레고 맞추듯 하나하나 코치를 해준다. 삼성SDS관계자는 “그동안 베테랑 직원이 감으로 하던 일을 이제 신참 직원도 스마트 글라스를 쓰고AI의 지도를 받아 척척 할 수 있다”고 했다. 삼성SDS는 지난해 8월부터 중소·중견 기업을 타깃으로 한 물건 포장부터 배송까지 전 물류 과정을 간소화한 원스톱 물류 플랫폼(첼로 스퀘어) 사업도 시작했다.글로벌 공급망 위기, 기술로 해결유연한 공급망 확보가 핵심 경쟁력이 되면서 발이 묶인 기업들을 구하려는 물류 스타트업도 각광을 받고 있다. 기존 물류회사들은 기술기업들을 적극적으로 인수해 혁신을 꾀하고 있다. 2016년 창업한 토종 디지털 물류 스타트업 로지스팟은 마치 앱으로 택시를 부르듯이 10만여 대의 화물차를 예약하고 관리하는 서비스를 제공한다. 번거로운 팩스·메일 작업 없이 앱으로 위치 추적, 물품 상태 확인이 실시간으로 가능하다. 퍼시스·레노버·넥센타이어 등 700여 기업고객을 두고 있다. 배달 대행 스타트업들도 모세혈관처럼 퍼진 배달 라이더 네트워크를 활용한 물류 사업에 나섰다. 바로고·부릉·생각대로 배달대행 3사는 도심 골목골목에 소규모 자체 물류센터를 두고 배달 라이더가 음식을 배달하듯 물품을 배송하는 ‘라스트마일 물류’를 신사업으로 밀고 있다.해외에서는 물류로봇과 공급망을 유연하게 해주는 기술이 뜨고 있다. 캐나다 스타트업 어태보틱스는 물류창고에 상하좌우로 움직이는 자동화 로봇을 접목했다. 기존 로봇이 오직 수평으로만 움직이며 물건을 날랐다면, 어태보틱스 로봇은 여러 방향으로 움직이며 공간을 효율적으로 쓸 수 있게 해준다는 것이다. 미국 완성차업체 제너럴모터스(GM)는 지난해 물류사업 진출을 선언하고 물류 스타트업 브라이트드롭을 설립했다. 전동화 팰릿(화물 운반대)과 이를 원격 관리하는 소프트웨어를 개발한다."
2022-02-17,[부음] 김갑수씨 별세 외,"▲김갑수별세,김태현YTN문화부 부국장·김석현전주 신농씨한의원 원장·김도현신농씨앗 대표 모친상,박지현·이정아·윤영선시모상=16일11시 여의도성모병원, 발인 18일9시, (02)3779-1526▲김남표별세,김운수남편상,김태현퍼시스USA대표·김태화문경약돌돼지 대표·지은스님중앙승가대 교수·김차숙·김영이부친상,안용붕도화엔지니어링 부회장·황현갑하남요리제과학원 원장 장인상=15일13시20분 국립경찰병원, 발인 18일7시30분, (02)431-4400▲오광선별세,오대영가천대 사회과학대학 학장 부친상,나동숙한성대 한국어과정 강사 시부상=15일17시30분 서울아산병원, 발인 17일9시, (02)3010-2000▲전태운별세,전동철OBS경인TV콘텐츠제작팀장·전경희재미 회계사·전경숙봄음악원 대표·전경남동화작가 부친상,백태웅하와이대학 한국학연구소장·김태석·하영판더 숲디앤씨 대표 장인상,최승희메인공인중개법인 대표 시부상=16일15시 서울성모병원, 발인 18일8시10분, (02)2258-5940"
