date,title,content
2022-03-24,재택근무 시대 '배민'은 왜 사무실에 '수영장'을 만들었을까,"Editor'sNote배달의민족 운영사 우아한형제들의 신사옥 ‘더큰집’이 지난달 문을 열었습니다. 우아한형제들은 브랜드에 그들만의 문화와 감성을 잘 담아내기로 유명하죠. 신사옥도 마찬가지입니다. 서울 잠실 롯데타워 37·38층 총 1000평의 공간을 워킹·코워킹·서포팅 목적으로 나눠, ‘어디서든 일할 수 있고, 어떤 일이든 할 수 있는 곳’으로 꾸몄습니다.요즘 같은 재택근무 시대에 우아한형제들은 왜 이렇게 사무실에 공을 들였을까요? 폴인이 직접 찾아가 김철영 공간디자인실 이사에게 물어봤습니다. 김 이사는 ‘더큰집’을 “구성원 간의 협업(Co-working)을 강화하는 동시에, 재택근무도 잘할 수 있는 공간”이라고 설명했습니다.※ 이 기사는 ‘성장의 경험’을 나누는 콘텐트 구독 서비스 ‘폴인(fol:in)’과 사무환경 전문 기업 ‘퍼시스’가 함께 발행한“오피스의 미래를 묻다” 4화중 일부입니다.김철영 공간디자인실 이사가 우아한형제들의 신사옥 '더큰집'을 기획한 배경을 설명하고 있다. ⓒ 최지훈""구성원들을 어떻게, 다시 우리의 공간으로 데려올까?""우아한형제들은 항상 컨택트(Contact)가 중요해요. '어떻게 구성원들이 잘 컨택트할 수 있도록 만들 것인가?'라는 물음이 항상 머릿속을 떠다니죠. 스타트업이기 때문에 혁신이 중요하고, 혁신을 위해서는 융합과 소통이 필수니까요.그래서 오피스 공간도 구성원들이 잘 섞일 수 있는 방향으로 만들어 왔어요. 방이동 사옥(일명 '큰집')의 밍글링 스페이스 컨셉이 이를 잘 보여주는 사례입니다. 그런데 코로나19로 저희가 좋아하고 추구하는 '소통'이라는 가치는 졸지에 가장 위험한 요소가 되어버렸습니다. 지금까지와는 정반대의 상황에 놓이게 된 거죠. 내부적으로도 고민이 깊어졌습니다. (중략)팬데믹 이후 화면을 통해 서로를 만나는 행위가 이제는 일하는 경험으로서 중요해졌으니까요.회사는 안전을 위해 구성원들에게 재택근무를 권장하고, 일하는데 어려움을 겪지 않도록 재택지원비도 지급하고 있습니다. 그래도 재택근무의 불편함을 호소하는 의견이 계속 있었어요. 일하는 공간으로서 집이 갖는 한계가 있는 거죠. 집이 집으로서도, 일터로서도 불완전한 공간이 돼서 스트레스가 높아지는 거예요. 하루의 대부분을 밖에서 일하던 사람들이 집에서 지낸다는 것 자체가 이미 너무 힘든 일이기도 하고요. 특히 아이를 돌보는 학부모 구성원들이 가장 힘들어했습니다.그래서 이곳 롯데타워 사옥 더큰집은 '구성원을 어떻게, 다시 우리의 공간으로 데려올 것인가'를 주제로 삼고 총체적 커뮤니티의 장(holisticcommunityspace)으로 만들어졌습니다.'구성원들이 오지 않고는 못 배길 공간을 만들어야 한다'가 저희의 결론이었습니다.오피스라기보다는 일하는 공간이라는 포괄적인 관점에서 접근했어요. 저희가 기존에 잘했던 코워킹(Co-Working)을 강화하는 공간이면서 동시에 재택근무 또한 잘할 수 있게 돕는 환경적인 요소를 많이 반영했습니다. 스마트 워킹을 잘할 수 있는 공간으로 완성한 거죠.더큰집·북라인드·배려의 비트…'배민다운' 오피스우아한형제들 구성원 자녀들의 손글씨로 회의실 이름을 만들어 붙였다. '가족에게 부끄러운 짓은 하지말자'는 조직 철학을 담았다. ⓒ 최지훈방이동에 있는 '큰집'은 17개 층으로 이루어져 있어요. 한 층이 70평 정도 되고요. 큰집이 이렇게 수직으로 넓은 공간이었다면 '더큰집'은 수평으로 넓은 공간이에요. 1.5개 층을 사용 중인데 한 층이 1000평 정도 됩니다. 고민해야 할 포인트가 다를 수밖에 없었죠. 동선을 포함한 공간 프로그래밍에 더 깊은 고민이 필요했습니다.그래서 공간을 크게워킹(working), 코워킹(co-working), 서포팅(supporting) 3가지 성격으로 나누었습니다. 워킹 공간은 다시 일반적인 업무공간인 '노멀 오피스',카페나 라이브러리처럼 트인 공간인 '세미 오피스',1인 집중 업무공간인 '콘센트레이션 오피스'로 구분해 디자인했고요. 노멀 오피스를 가장 중심에 두고 그 외 공간을 뿌려가는 형식으로 배치하고, 외부인과 우리 구성원의 동선 디테일을 계획해 레이아웃을 완성했습니다.송파구에서 일이 더 잘되는 '11개의 공간'더큰집을 한마디로 설명하자면 '어디서든 일할 수 있고, 어떤 일이든 할 수 있는 공간'입니다. 먼저 워킹 공간부터 하나씩 설명해 드릴게요.① 노멀 오피스이곳은 모션데스크와 120도 데스크 구역으로 나뉩니다. 업무 성격에 따라 자유롭게 선택할 수 있어요. 적당한 높이의 스크린을 설치하되 '폴리카보네이트' 소재를 적용해 시야가 답답하지 않도록 구성했고요. 노멀 오피스에는 새소리, 자연의 소리, 음악 등 6~8가지 사운드를 믹스한 '배려의 비트'가 흘러나옵니다. 적당한 소음이 집중력을 높여주기도 하고, 동료와의 대화를 시도하기에 너무 적막하지 않도록 배려한 장치이기도 합니다.모션데스크가 배치된 노멀 오피스 공간. 폴리카보네이트 스크린을 사용해 업무 몰입도를 높이면서 시각적인 개방감도 확보했다. ⓒ 최지훈② 콘센트레이션 오피스모든 좌석이 1인석인 집중 업무공간입니다. 항상 풀 부킹이에요. 정말 인기가 많죠. 저희 오피스에서 가장 인기가 좋아서 '무리해서라도 이 공간을 더 많이 만들었어야 했나' 싶기도 합니다. 화상회의까지 바로 소화할 수 있는 곳도 있고, 약간은 개방감이 있게 디자인된 구역도 있습니다.1인석 집중 업무공간. 구성원들이 가장 많이 이용하는 곳이다. ⓒ 우아한형제들③ 라이브러리구성원들의 인생 책을 조사한 내용을 바탕으로 200~300권의 책을 전시했어요. 호기심을 갖고 책에 쉽게 접근할 수 있도록 표지가 보이는 방식으로 진열했습니다. 롯데타워는 아시다시피 아름다운 뷰를 가지고 있는데 맑은 날엔 오히려 눈이 부셔 블라인드를 내리게 되더라고요.'구성원들이 맑은 날에도 외부를 보게 할 수 없을까'라는 고민의 결과로 블라인드 역할을 하는 책장을 배치해, 눈부심은 덜하면서 외부를 즐길 수 있는 공간으로 완성했습니다. 그래서 북라인드라 이름 지었어요.여기서부터는 코워킹(Co-Woriking) 공간입니다. 많은 구성원이 한자리에 모여 의견을 교환하거나 아이디어를 자유롭게 나눌 수 있는 곳이죠.외부의 빛을 효과적으로 활용한 북(Book)라인드. ⓒ 최지훈④ 트랙룸대규모 인원이 모여 회의나 행사를 할 수 있는 공간이에요. 큰집에도 존재했던 공간인데 더 넓게 그리고 더 좋은 위치에 만들었습니다. 트랙 가장 높은 곳에 올라서면 한강 뷰가 파노라마처럼 펼쳐집니다. 창가 바로 앞엔 '수영장' 공간이 있어 색다른 분위기를 연출하죠. 마치 바캉스를 온 것처럼 시원한 기분을 느낄 수 있어요.많은 인원이 모여 컨퍼런스를 열거나 발표 행사를 하는 공간. ⓒ우아한형제들트랙룸 뒷편에 마련된 수영장 공간에서는 한강뷰 조망을 즐길 수 있다. ⓒ 최지훈⑤ 청평 같은 방저희는 공간에 항상 워크숍 룸을 만들어요. 일부러 가평이나 양평 등 서울에서 벗어난 곳으로 워크숍을 가서 리프레시하고 새로운 아이디어를 얻잖아요. 그런 의미에서 오피스와 완전히 다른 분위기로 만드는 공간입니다. '부잣집 거실'처럼 만드는 걸 목표로 하고요. 더큰집의 워크숍 룸 이름은 '청평 같은 방'입니다. 정확히는 스페인에 있을 법한 청평 같은 공간입니다.(웃음)일정 기간 대여해 외부 워크숍 공간처럼 사용할 수 있는 '청평 같은 방'.배달의민족 서비스를 이용해 음식을 즐길 수도 있다. ⓒ 우아한형제들⑥ 우물가구성원들이 비일상적으로 만날 수 있는 자유로운 공간입니다.이렇게 우리가 우연히 만나 이야기를 나누고 얼굴을 마주하는 부분이 사실 회의의 많은 부분을 줄여줘요.원래는 테이블에서 바로 물을 쓸 수 있도록 계획했었는데요. 지금 감염이나 위생에 대한 부분을 더 고려해야 하는 상황이다 보니 싱크대 부분은 벽 쪽에 별도로 설치하고, 여기서는 가볍게 활동할 수 있도록 만들었어요.구성원들의 '우연한 만남'을 장려하는 공간인 '우물가'.자연 소재를 적극 활용해 야외에 있는 듯한 느낌을 준다. ⓒ우아한형제들⑦ 미팅룸(중략)공간이 문화를 만든다우리 구성원들이 어떻게 생활하고 어떻게 일하는지, 일이 그들에게 어떤 의미인지를 공간을 만드는 저희가 계속 잘 알고 싶어요.공간은 다시 사람들의 사고방식과 행동의 변화를 불러와요. 제가 주간회의 때마다 반복하는 멘트가 있어요. 바로 '공간이 문화를 만든다'인데요. 김봉진 의장님도 동의하고 강조하시는 철학이기도 하죠.공간에 담은 의도와 가치는 사용하는 사람들에게 고스란히 전달되기 마련입니다.매일이 아니더라도 조직의 컬처 코드를 잘 녹여낸 공간을 반복해 경험하다보면 자연스럽게 '우리 회사의 문화는 이런 것이구나' 이해하고 유대감을 갖게 되는 것 같아요.어쩌면 지금처럼 서로 떨어져 일하는 시기에 더욱 절실해진 부분이죠. 저희가 공간에 끊임없이 투자하는 이유라고 말씀드릴 수 있을 것 같아요.※ 이 기사는 ‘성장의 경험’을 나누는 콘텐트 구독 서비스 ‘폴인(fol:in)’과 사무환경 전문 기업 ‘퍼시스’가 함께 발행한“오피스의 미래를 묻다” 4화중 일부입니다.더 많은 콘텐트를 보고 싶다면팬데믹 이후 오피스의 역할과 필요성이 새롭게 정의되고 있습니다. 사람들은 재택·원격근무를 통해 ‘오피스가 아닌 곳에서도 일할 수 있다’는 사실을 경험했습니다. 동시에 ‘동료와의 소통, 업무 몰입을 위한 최적의 공간은 역시 오피스’란 사실도 깨달았습니다. 그렇다면 여러 곳에 흩어져 일하는 사람들을 위한 ‘미래 오피스’는 어떤 모습이어야 할까요? 폴인이 퍼시스 사무환경연구팀과 함께 여러 회사의 공간 혁신 스토리를 들어봤습니다.▶ 지금 ‘폴인’에서 확인해 보세요"
2024-08-22,[비즈스토리] 항균·통기성 강화한 매트리스 … 덥고 습한 여름에도 잠이 솔솔~,"슬로우베드분리형 커버 지퍼로 직접 세탁 가능땀에 강한 스테인리스 스프링 적용‘이브닝 스타릿·스태리나잇’선보여퍼시스그룹 침대 매트리스 전문 브랜드 슬로우베드가 최근 출시한 신제품 이브닝 스타릿 매트리스슬로우베드 스태리나잇 시리즈 서울 매트리스. [사진 슬로우베드]슬로우베드 매트리스는 분리형 상단 커버와 스테인리스 스프링이 적용돼 관리가 용이하다.여름철 건강한 숙면을 위해서는 매트리스 등 침구류 관리가 필수다. 더운 여름에는 실내 온도·습도가 높아지는 데다, 열대야 탓에 자는 동안 땀과 피지의 분비가 늘어나기 때문이다. 특히 제대로 세탁·관리하지 않은 침구류를 사용하면 먼지, 진드기 등이 발생하기 쉬운 환경이 만들어지며 비위생적인 수면 환경으로 인해 수면의 질에도 영향을 받게 된다.이처럼 피부에 직접 닿는 침구류의 경우 여름철 위생 관리가 더욱 중요한데, 이불·베개 등과 달리 매트리스는 일상에서 직접 관리하기가 어렵다. 이에 슬로우베드(SLOUBED)는 집에서도 손쉽게 관리할 수 있고, 항균성과 통기성을 강화한 스테인리스 스프링 매트리스를 선보이며 덥고 습한 여름에도 쾌적한 수면 환경을 제공하고 있다.━항균 패딩으로 박테리아 등 위생 걱정 줄여슬로우베드의 스프링 매트리스에는 내구성이 강한 최고급 ‘302H 스테인리스 스프링’이 적용돼 습한 여름에 흘리는 땀에도 녹슬지 않아 매트리스를 장기간 새것처럼 깨끗하게 사용할 수 있다. 슬로우베드는 이 같은 스테인리스 스프링 매트리스 개발에 주력하고 있으며 최근 신제품 ‘이브닝 스타릿 매트리스’와 ‘스태리나잇 시리즈’를 출시했다.슬로우베드의 이브닝 스타릿 매트리스는 일상에서 손쉽게 위생을 관리할 수 있도록 만든 제품이다. 분리형 상단 커버가 있어 매트리스 헤드부에 위치한 지퍼로 탈부착해 직접 세탁할 수 있다. 이를 통해 침대 공간을 더욱 위생적인 수면 환경으로 유지할 수 있다. 또한 상단 커버 매트에 스위스 새니타이즈(Sanitized®)사의 항균 패딩을 적용해 박테리아, 생활균, 집먼지진드기, 악취 등의 위생 걱정을 줄였다. 분리형 상단 커버의 하단은 방수 처리해 보이지 않는 매트리스 속까지 외부 오염으로부터 보호한다.이브닝 스타릿 매트리스에는 최고급 스테인리스 소재와 더불어 슬로우베드의 자체 기술력으로 특수 설계한 하드 타입의 ‘E-WAS(Even-WeightActivatedStainless) 스프링’이 적용됐다. 슬로우베드 매트리스 중 가장 탄탄한 지지력을 자랑해 더운 여름밤 잦은 뒤척임에도 안정적인 탄성감을 제공한다.슬로우베드의 신제품 스태리나잇 시리즈는 현대인의 수면 패턴에 최적화된 소재 조합으로 탄생한 매트리스로, 공기가 순환하는 통기성과 오염을 막아주는 항균성을 강화해 더운 여름에도 쾌적하게 사용할 수 있다.스태리나잇 시리즈는 매트리스 4면을 스웨이드 타공 처리해 매트리스 속까지 공기가 순환할 수 있도록 제작됐으며, 안쪽 소재에도 통기성이 좋은 에어 메쉬를 적용해 더운 여름철 시원한 숙면을 돕는다. 커버에 적용된 울트라 리사이클 패딩은 섬유 가닥에 작은 구멍이 있어 가벼우면서 우수한 통기성은 물론 항균 처리된 소재로 제작돼 여름에 발생하기 쉬운 집먼지진드기, 곰팡이, 박테리아의 성장을 막는다.또한 스태리나잇 시리즈는 분리형 이너 퀼팅 커버를 적용해 잦은 세탁이 필요한 여름철에도 위생적인 관리가 가능하다. 이브닝 스타릿 매트리스와 같이 새니타이즈사 항균 패딩, 방수 원단도 적용돼 위생이 중요한 침대 공간을 더욱 청결하게 유지해 준다.━판매 금액 일부를 비영리 환경단체에 기부슬로우베드는 매트리스 전 품목 건당 판매 금액의 일부를 비영리 환경단체인 사단법인 자연의벗연구소에 기부할 예정이다. 기부금은 바다거북 보호를 위한 서식지 환경 개선 캠페인 ‘거북아, 놀당갑서’와 야생동물 빛공해 저감 캠페인 ‘밤하늘조각’ 운영 지원에 사용된다.한편 슬로우베드는 퍼시스그룹의 침대 매트리스 전문 브랜드로, 수면 본질에 충실한 제품과 서비스를 제공하고 있다. 또 사람과 환경의 건강한 상생에 대한 고민과 배려를 통해 가치 있는 오늘과 지속 가능한 내일을 만들기 위해 노력하고 있다. 또한 국내 최초로 친환경 순환 메모리폼인 레코텍폼을 개발하고 자체 생산한 제품에 친환경 포장재를 적용하는 등 새로운 자원 순환 사이클 구축에도 앞장서고 있다."
2024-02-29,"최태원, 대한상의 회장 3년 더…“AI·무역 경쟁, 지역 소멸 등 난제 풀 것”","최태원 서울상공회의소 회장 겸 대한상공회의소 회장이 29일 오후 서울 중구 상의회관에서 열린 서울상공회의소 정기의원총회에서 차기 회장으로 추대됐다. 연합뉴스최태원SK그룹 회장이 대한상공회의소 회장을 3년 더 이어가게 됐다. 29일 서울상공회의소는 서울 중구 상의회관에서 정기의원총회를 열고 제 25대 서울상의 회장으로 현 최 회장을 참석 의원 만장일치로 추대했다. 서울상의 회장이 대한상의 회장직을 겸하는 관례상, 최 회장은 25대 대한상의 회장으로도 사실상 내정됐다. 임기는 3년(2027년 2월까지)으로, 대한상의 회장은 한번만 연임 가능하다.이날 회의에는 김원 삼양사 부회장, 박승희 삼성전자 사장, 신현우 한화 사장, 이동우 롯데지주 부회장, 이순형 세아제강 회장, 이형희SK커뮤니케이션위원장, 정기옥 엘에스씨푸드 회장, 조용일 현대해상화재보험 부회장, 조현상 효성 부회장, 하범종LG사장, 한채양 이마트 대표이사, 현정은 현대그룹 회장 등 서울상의 의원 70여명이 참석했다.29일 서울 중구 상의회관에서 열린 서울상공회의소 정기의원총회에서 연임 추대된 최태원 서울상공회의소 회장 겸 대한상공회의소 회장이 임시의장인 이순형 세아제강 회장과 악수하고 있다. 연합뉴스최 회장은 지난 2021년 4대 그룹 총수 중 처음으로 대한상의 회장 직을 맡아, 지난 3년간 대통령 순방과 부산 엑스포 유치 등 국내외 정부 행사에 빠짐없이 참석해 왔다. 기업가정신협의체(ERT)를 발족하고 민·관 정책 소통 플랫폼을 개설하는 등, 경제계와 사회의 소통에 주력했다.이날 최 회장은 연임 확정후 인사말로 “초심으로 돌아가 서울상의를 잘 이끌어 나가겠다”라며 “앞으로 3년간 우리 경제·사회가 마주한 난제를 푸는 데 조금이나마 기여하는 것이 제 소임”이라는 포부를 밝혔다. “경제를 둘러싼 상황이 불과 몇 년 사이 완전히 새로운 장으로 접어들었다”라며 세계 시장의 분절화와 인공지능(AI) 등 첨단기술 선점 경쟁 등의 글로벌 추세와 저출산, 지역 소멸, 기후변화 대응 등의 국내 현안을 시급한 해결 과제로 언급하고, 해법을 마련하겠다고도 덧붙였다.이날 총회에서 삼성전자 박승희 사장,SK이형희 위원장,LG하범종 사장, 롯데지주 이동우 부회장, 한화 신현우 사장 등이 25대 부회장으로 재선출됐다. 감사로 제니엘 박인주 회장, 퍼시스 이종태 회장, 제이에스코퍼레이션 홍종훈 부사장이 연임됐다."
2023-04-28,"시몬스, 퇴사 후 동종업계 이직한 前직원 상대 가처분 소송","경기도 이천에 있는 시몬스침대 생산 공장 ‘시몬스 팩토리움’ 전경. 최선을 기자시몬스 침대는 올해 1월 퇴사 후 경쟁사인 퍼시스그룹 계열사 일룸(슬로우베드)으로 이직한 전 직원 A씨를 상대로 서울중앙지방법원에 전직금지 가처분 신청서를 제출했다고 28일 밝혔다.회사의 핵심 기술과 직결된 생산·연구개발(R&D) 관련 부서에 한해 퇴사 후 2년간 경쟁업체로 이직하지 않고 회사 기밀을 유출하지 않는다는 내용의 서약서에 서명했는데 A씨가 이를 어겼다는 게 시몬스 측 설명이다.A씨는 퇴사 전까지 3년간 생산물류 전략부문 품질경영부에 근무했다. 시몬스 재직 중 ▶제품 공정 검사 및 완제품 검사 ▶검사 기준서 및 표준서 작성 관리 ▶원자재 입고 검사 ▶공급업체 평가 △제품 품질 검증 계획 수립 및 실행 등의 업무를 담당했다.시몬스는 자사의 주요 설비·특허 관련 지식을 가지고 경쟁업체로 이직한 또 다른 직원을 상대로도 법적 조치에 나설 예정이다.시몬스 관계자는 ""이직은 개인의 의사이고 존중하지만, 기밀 유지 서약서까지 서명한 일부 생산 관련 직원들의 위반 행위는 함께 일한 동료들의 피땀 흘린 노고를 무시하는 행위이자 지식재산권 침해 행위가 될 수 있다""고 강조했다. 이어 ""난연 매트리스를 포함한 시몬스의 핵심 기술은 오랜 기간 쌓아온 노하우로 만든 시몬스만의 자산으로 어설픈 베끼기는 소비자에게 피해를 줄 수 있다""고 전했다."
2023-02-21,"서울대, 시니어산업 최고위 과정 신입생 모집","서울대학교에서는 다가오는 고령화 사회에 새롭게 대응하고 국내 시니어산업 경영인의 전문성 향상과 관련 산업 발전에 기여하기 위해 2023년 ‘웰에이징·시니어산업 최고위과정’ 제11기 신입생을 모집한다.한국의 고령화 속도는 세계에서 유례없이 가장 빠른 속도로 진행되어, 2025년에 65세 이상 인구비중이 24.3%로 초고령화 사회에 도달할 전망이다. 이는 시니어 계층이 거대 인구집단으로 성장을 예고하는 동시에, 시장경제 중심에서의 신 소비파워 계층의 등장을 의미한다. 급속하게 늘어나는 노인 인구의 증가는 노인 개인의 삶뿐만 아니라 사회 전반에 걸친 모든 변화를 주도하며, 이전 세대와 다른 가치관과 새로운 트렌드를 만들어 갈 것으로 예측된다. 따라서 지금이 시니어 시장의 컨텐츠와 서비스를 개발할 수 있는 전문 기업경영자의 양성이 필요한 시점이다.서울대학교 생활과학대학에서는 웰에이징·시니어산업을 선도하고 있는 최고경영자와 관련 전문인을 대상으로, 이론과 실무가 결합된 교육서비스를 제공하고 있다. 서울대학교 측은 “이 과정은 서울대학교 생활과학대학의 축적된 연구결과를 바탕으로 여러 분야의 전문 강사진을 통해 다양한 주제를 다루고 있으며, 세계적인 우수 기업 사례를 중심으로 시니어 산업의 실제와 컨설팅을 결합한 최상의 프로그램이라 자부한다. 또한 이 과정을 통해 포스트 코로나를 준비하는 국내 시니어산업 관련 기업의 경쟁력과 사업 역량 강화에 도움이 될 것으로 기대한다”고 전했다.과정 이수 후에는 서울대학교 총장 명의의 이수증서를 수여하며 서울대학교 총동창회원 자격이 부여된다. 또한 과정 수료생에 한해서 열린강좌를 통해 언제든지 무료 재교육을 받을 수 있는 평생 교육 제도를 운영하고 있으며, 이를 통해 재학생과 수료생간의 교류를 장려, 관련 비즈니스의 활성화를 꾀할 수 있을 것으로 기대된다. 정규수업 이외에도 워크숍, 국내 및 해외연수, 가족동반특강 등 다채로운 경영자 특강 뿐 아니라AWASB총동창회 주관의 산악회, 골프회 등의 취미활동을 통한 문화적 교류도 다양하게 진행이 되고 있다.2013년부터 2022년까지 10년간 총 520여명의 수료생을 배출하였으며, 주요 수료생으로는 정운찬 전 국무총리, 패션그룹형지 최병오 회장, 파나소닉코리아 노운하 전 대표이사, 더클래식 500의 박동현 전 사장, 프리드라이프 박헌준 전 회장, 보건복지부 사회보장위원회 이재용 사무국장, 아신의 김홍규 회장, 퍼시스 이종태 회장 등 이 있다.2023년도 제11기 과정 모집은 오는 3월 21일까지이며 강의 기간은 3월 28일부터 11월 21일까지 매주 화요일 오후 5시부터 8시 35분까지 진행되며, 수강 대상은 시니어산업 및 관련 업체의 임원급 이상의 경영자, 정부 및 각 공공기관의 시니어산업 정책결정자, 시니어산업 관련 창업을 준비하는 경영자 등이다."
