date,title,content
2023-05-04,‘SG발 폭락’ 8종목 급등락… 하림은 ‘매수 의견’ 나와,"지난주 ‘SG발 폭락 사태’로 주가에 타격을 받았던 8종목의 주가 향방에 관심이 쏠리고 있다. 폭락 직후 상승세로 돌아섰던 종목들이 다시 하락세로 돌아선 가운데 일부 종목에 대해선 증권사 ‘매수’ 보고서가 나왔다.3일 국내 증시에서 다올투자증권이 전날 대비 2.99% 상승했고, 삼천리도 0.71% 상승했다. 하지만 하림지주(-0.55%), 다우데이타(-1.15%), 서울가스(-4.09%), 대성홀딩스(-7.63%), 세방(-5.49%), 선광(-7.36%) 등은 하락했다. 앞서 8종목 중 하림지주와 다올투자증권은 24일 하루 하한가를 맞았고 다우데이타와 세방은 이틀 연속, 삼천리는 3일 연속, 대성홀딩스, 서울가스, 선광은 4일 연속 하한가를 맞았다.이들 종목은 반대매매(융자 상환을 위한 강제 매각) 물량이 모두 소화된 지난 28일 일제히 상승세로 돌아섰다. 하지만 이번 주 들어선 대부분 다시 주가가 떨어지고 있다. 증시 관계자는 “지난 28일에는 ‘하따(하한가 따라잡기)’에 나선 개인들이 몰리면서 주가가 반짝 올랐지만 이번 주엔 주가조작 이슈가 이어지며 투자 심리가 약화된 것 같다”고 했다.한편 하림지주에 대해서는 증권사의 매수 보고서가 나왔다. 김장원IBK투자증권 연구원은 2일 ‘과속이 문제지 본질은 아니다’라는 보고서에서 하림지주에 대한 투자의견을 ‘매수’로 유지하고 목표주가를 기존 1만4000원에서 1만5000원으로 상향 조정했다. 하림지주 주가는 3일 9030원에 마감했다. 김 연구원은 “과도한 변동성의 후유증으로 투자심리 안정을 위한 조정 기간의 필요성도 이해된다”면서도 “그렇지만 달라진 건 주가 그래프일 뿐 기업의 내용과 사업 계획은 변함이 없다”며 매수 의견 유지 이유를 설명했다."
2023-05-10,“SG발 폭락사태 일반투자자 피해 7000억 이상 추정”,"서울남부지검 금융증권범죄합동수사단과 금융위원회·금융감독원 합동수사팀이 주가조작을 주도한 의혹을 받는 투자컨설팅업체 H사 라덕연 대표 및 측근 변모씨와 안모씨를 9일 체포했다.  서울 양천구 서울남부지검의 모습. /연합뉴스지난달SG증권발(發) 무더기 주가 폭락 사태의 여파가 지속되는 가운데 7만여 명의 일반 투자자들이 7000억원 이상의 피해를 봤을 것이라는 추산이 국회에서 나왔다. 라덕연 H투자자문사 대표 등 주가 조작 의심 세력의 존재를 알지 못한 채 단순 투자자로 들어왔다가 엉겁결에 폭락 사태에 휩쓸린 개인 투자자들의 손실액을 추계한 것이다.국회와 정부는 이번 사태를 계기로 주가 조작으로 얻은 부당 이득의 최고 2배를 환수하는 내용 등을 담아 자본시장법을 개정하고 이상 거래 감시 시스템도 강화하기로 했다.일반 투자자 피해 7000억원 추정국회 정무위원회 소속 윤창현 국민의힘 의원이 10일 공개한 자료에 따르면, 지난달 24일 무더기 하한가를 맞은 8개 종목의 최근일 주주명부 기준 일반 투자자는 7만2514명이었다.종목별로 보면 대성홀딩스 3794명, 서울도시가스 3526명, 선광 3687명, 다우데이타 9354명, 하림지주 2만5531명, 다올투자증권 1만4403명, 세방 8800명, 삼천리 3519명 등이다. 주주명부가 작성된 일자는 대성홀딩스·서울도시가스·다우데이타·다올투자증권·삼천리는 지난 3월 31일, 선광·하림지주·세방은 작년 12월 31일이다.윤 의원은 “주식 차트 뒤에서 벌어진 증권 범죄는 꿈에도 생각 못 한 채 회사의 실적과 공시만 믿고 투자한 일반 개인투자자들이 피해를 봤다”고 했다.개인주주 피해액 7730억원은 주주명부 작성일부터 지난 8일까지 개인투자자들이 주식을 계속 보유하고 있었다는 가정 아래 추정한 것이다. 지난달 중순까지만 해도 오름세였던 8종목 주가는 지난달 24일 일제히 하한가를 기록하는 등 폭락한 뒤 회복하지 못하고 있다.이 기간 하락률은 대성홀딩스가 81%로 가장 높았다. 선광(-79.6%), 서울도시가스(-79.5%), 삼천리(-72.5%), 다우데이타(-67.8%), 세방(-62.3%), 하림지주(-43%), 다올투자증권(-28.3%) 순이다.주주명부 작성일에 해당 주식들을 샀다가 미처 팔지 못한 투자자들의 경우 예상치 못한 폭락의 피해를 본 셈이다. 윤 의원은 대주주와 기관투자자의 손실까지 반영한 총손실액을 총 8조977억원으로 추산했다.하지만 증권 업계 일각에서는 조심스러운 반응도 나온다. 추산 과정에서 설정한 기준일은 주가 조작이 의심되는 과정상 나타난 고점이어서 그때와 비교한 하락은 정상화 과정으로도 볼 수 있으므로 기준일을 주가 조작 전으로 잡아야 한다는 주장이다.이에 대해 윤 의원은 “증권사들 논리대로면 손실은 안 난 것으로 주가 조작도 없었다는 말이 된다”며 “엄연히 주가 조작으로 피해를 본 투자자들은 존재한다”고 반박했다.주가조작 이득의 최고 2배 환수국민의힘과 정부는 지난 9일 국회에서SG증권발 폭락 사태의 원인 규명과 대응책 마련을 위한 긴급 협의회를 열고 비슷한 사건을 미연에 방지하기 위해 자본시장법 개선 등을 추진키로 했다.국민의힘 박대출 정책위의장은 협의회를 마친 후 “주가조작 범죄에 대한 처벌 제재 수준을 대폭 강화할 계획”이라며 “기존 형사 처벌 외에 부당이득의 최고 2배를 환수하는 과징금 체제를 신설하는 내용으로 자본시장법을 조속히 개정해 처리하기로 했다”고 밝혔다. 주가조작 신고 포상금 한도도 현행 20억원에서 40억원으로 2배로 높이고, 자진 신고자 감경 제도를 도입하기로 했다.또, 증권 범죄를 저지르면 업계에 복귀하기 어렵도록 주가 조작이 적발되면 10년간 자본시장 거래를 제한하고 상장사 임원 선임을 제한하는 내용을 담은 자본시장법 개정안도 조속히 추진키로 했다.한국거래소의 이상 거래 감시 시스템도 대폭 강화한다. 현재는 가격이나 종목을 짜고 거래해 주가를 끌어올리는 통정거래 등 전형적인 주가 조작 행위를 잡기 위해 100일 이내에서 의심스러운 주가 움직임을 포착하도록 설계돼 있다.하지만 이번 주가 폭락 사태에선 주가 조작 세력들이 2~3년이라는 오랜 기간 주가를 올려 이전과 양상이 다르다는 분석이 나온다. 이에 따라 앞으로는 중장기 시세조종 등 비전형적 수법도 탐지할 수 있도록 시스템을 개선하기로 했다."
2023-04-28,"SG증권發 주가 폭락, 나흘새 8조 증발 “가수·의사 등 1000명이 전주 역할”","금융 당국 관계자들이 27일 오전 서울 강남구의 ‘SG증권 사태’ 관련 사무실을 압수 수색한 뒤 관련 압수품을 차량에 싣고 있다. 주가 조작 세력은 당국이 조사에 돌입하자 급히 특정 회사의 주식을 처분했고, 이들 종목의 시가 총액은 나흘 만에 8조원 이상 감소했다. /뉴스1금융 당국과 경찰은 27일 주가조작 의혹이 불거진 ‘SG증권발 주가 폭락 사태’ 관련 전방위 압수 수색에 나섰다. 이번 사태는 지난 24일 선광, 하림지주 등 8종목이 외국계 증권회사인 ‘소시에테제네랄(SG)’발 매물로 폭락하면서 불거졌다. 주가조작 세력이 이 종목들의 가격을 인위적으로 끌어올린 정황을 금융 당국이 포착하고 조사에 착수했는데, 이를 눈치챈 일당이 급히 주식을 매도해 주가가 폭락했을 가능성이 거론됐다. 8종목 주가는 나흘간 최대 75%가량 폭락했고, 시가총액은 8조원 이상 감소했다.금융위 자본시장조사총괄과는 이날 주가조작 세력으로 지목된 H투자컨설팅 업체 서울 사무실과 이 업체 명의로 된 S골프연습장, 업체 관계자의 주거지 등을 압수 수색했다. 금융 당국은 이들이 미리 짜고 주식을 높은 가격에 사주는 수법(통정매매)으로 주가를 끌어올린 정황을 발견한 것으로 알려졌다.앞서 25일 서울 강남경찰서는 문제의 주가조작 세력이 미등록 투자 자문 업체를 운영해 ‘자본시장법’을 위반한 것으로 보고 수사에 나섰다. 경찰은 H투자컨설팅 업체 사무실에서 휴대전화 200여 대를 압수했다. 경찰은 주가조작 세력이 이 휴대전화를 통해 ‘전주(錢主)’들의 명의로 개설한 증권 계좌로 시세조작을 한 것으로 보고 있다. 서울남부지검 금융증권범죄합동수사단도 24일 주가조작 세력 일당으로 의심되는 10명을 출국 금지 조치했다.이들 일당에게 투자해 사실상 ‘전주’ 역할을 했던 이들은 자신들도 피해를 봤다며 소송을 준비 중이다. 이들을 대리할 예정인 변호사는 본지 통화에서 “1000명 정도가 손해를 봤고 이 중 300명 정도는 의사라는 말도 있다”며 “청담동 전주들, 의사 등 전문직도 있고 손해액이 10억~100억원으로 다양하다”고 했다. 그러나 법조계에서는 “‘전주’ 역할을 한 사람들이 공범이었을 가능성도 있다”는 말이 나왔다. 주가조작 세력에게 돈을 맡긴 전주들이 주가가 올라 평가이익이 발생했을 때에는 가만히 있다가, 주가가 폭락하자 피해자라고 주장하고 나섰기 때문이다. 다만 전주들이 수익 창출 방법은 알지 못하고 주가 조작 일당의 ‘고수익 투자’라는 선전에 넘어갔을 가능성도 있다.이런 식으로 투자한 사람 중에는 가수 임창정씨 등 연예인도 다수 있는 것으로 전해졌다. 임씨는 “30억원을 투자했는데 지금은 1억8900만원이 남아 있다”고 주장하고 있다. 연예인들에게 투자를 권유한 이로는 S골프연습장의 임원인 골프 강사 안모씨가 거론된다. 남부지검은 사안의 중대성을 고려해 이번 사안을 ‘패스트트랙’으로 조만간 이첩받을 예정이다.사건이 수면 위로 드러난 건 지난 24일 주식시장에서 다올투자증권, 하림지주, 다우데이타, 세방, 삼천리, 대성홀딩스, 서울가스, 선광 8종목이 별다른 요인 없이 동시에 하한가를 기록하면서다. 급락 원인으로 외국계 증권사인SG증권의 차액결제거래(CFD) 계좌에서 발생한 대량 매도가 지목됐다. 이후 주가가 급락하자 이 계좌에 돈을 빌려준 증권사들이 대규모 반대매매(대출금 상환을 위해 담보로 잡은 주식을 강제매각하는 것)에 나서며 하락 폭을 키웠다는 분석이다.이 종목들은 대부분 작년부터 꾸준히 주가가 올랐다. 나흘 연속 하한가를 기록한 서울가스의 주가는 작년 4월 20일 18만3500원에서 지난 21일 46만7500원으로 1년 새 155% 올랐다. 같은 기간 삼천리는 358%, 대성홀딩스는 124%, 선광은 136% 상승했다. 그러나 서울가스는 4연속 하한가를 맞으며 27일 주가가 11만2700원으로 1년 전보다 오히려 39%가량 하락한 상태다.이들 종목은 꾸준히 주가가 오르는 과정에서 ‘소형 가치주’로 소문 나 개인 투자자들의 피해도 우려된다. 해당 기업들의 공시에 따르면 지난해 연말 기준 8종목의 소액주주 비율은 평균 30.43%다. 빚을 내서 투자한 개인들의 비율이 높은 것도 문제다. 지난 21일 기준으로 8종목의 평균 신용잔고율(대출받아 투자한 비율)은 10.29%로 유가증권시장 평균(0.98%)의 10배에 달했다.8종목을 담은 펀드의 수도 많아 피해는 더욱 확대될 전망이다. 금융정보 업체 에프앤가이드에 따르면 지난해 연말 기준 상장지수펀드(ETF)를 포함해 전체 105개 펀드가 해당 종목들을 담고 있다."
2023-04-26,"임창정도 “수십억 날렸다”, 6개 종목 외국계 증권발 주가조작 의혹","가수 임창정./뉴스1국내 상장사 6개 종목이 명확한 배경 없이 무더기로 급락세를 보이는 현상이 이틀째 계속됐다. 금융당국은 해당 종목에 주가 조작 정황이 있는지 조사에 착수했다. 가수 임창정도 이번 사태로 수십억원의 투자금을 날렸다고 주장했다.25일 삼천리, 대성홀딩스, 서울가스, 세방, 선광, 다우데이타 등 6개 종목의 주가는 이틀 연속으로 전 거래일 대비 가격 제한 폭(-30%)까지 떨어졌다. 다올투자증권과 하림지주도 각각 10%, 13% 하락하며 전날에 이어 이틀 연속으로 급락했다.이들 종목의 공통점은 외국계 증권사 소시에테제네랄(SG) 창구를 통해 대량 매도 물량이 집중됐다는 점이다.SG증권 창구를 통한 순매도 물량은 다올투자증권이 약 86만4000주, 하림지주가 99만3000주로 집계됐다.시장에서는 특정 사모펀드에 문제가 생겨 차액결제거래(CFD) 매물이 쏟아졌다는 추측과 주가 조작설 등이 제기됐다.CFD는 실제 주식을 보유하지 않고 시세 차액만 정산하는 장외파생상품으로, 위험성이 크다. 주가가 급락했는데 증거금이 부족하면 증권사가 반대매매(융자 상환을 위한 강제 매각)를 하고, 반대매매는 투자심리가 위축된 개인투자자들의 매매를 불러 다시 주가를 끌어내린다.일각에서는 주가 조작설도 제기됐다. 주가를 조작한 일당들이 투자자로부터 휴대전화를 받아서 투자자 명의로 3년에 걸쳐 하루에 1%씩 주가를 올렸다는 것이다. 실제로 삼천리의 최근 3년 시세를 보면 최저가 6만4000원에서 매일 조금씩 올라 최고 52만4000원을 찍었다. 주가조작 대상이 된 회사들은 유통 물량이 적어 일당들이 사전 가격 모의를 통해 주식을 사고파는 것이 쉬운 회사들이었다.SG증권을 통해 매도 물량이 집중되며 무더기 하한가를 기록한 종목들의 신용잔고율이 평균보다 높았다는 공통점도 있다. 신용잔고율이 높을수록 상장된 주식 중 신용으로 산 주식이 많다는 뜻이다.금융위원회는SG증권을 통해 매도 물량이 쏟아진 종목과 관련해 이번 거래가 정상적인 거래였는지 여부를 조사 중이라고 밝혔다. 특히 작전세력이 개입해 주가를 조작했다는 의혹과 관련해 집중적으로 들여다보고 있는 것으로 전해졌다. 서울남부지검도 작전세력 10명을 출국금지 조치하고 수사에 착수했다고 한다.JTBC는 주가조작 세력과 일부 투자자들이 금융당국의 조사를 사전에 눈치채고 일제히 돈을 뺀 것으로 보인다고 보도했다. 투자자는 수백명이 넘는데, 이들 중에는 의사와 변호사 같은 전문직뿐 아니라 연예인들도 있었다. 가수 임창정은 30억원을 투자하며 주가 조작 세력에게 자신과 아내의 신분증을 맡겨 대리투자할 수 있도록 했다고 한다. 그는 작전 세력이 운영하는 방송 채널에 출연했고, 이들이 인수한 해외 골프장에도 투자했으나 자신 역시 피해자라고 주장했다. 임창정은JTBC에 “저는 30억원어치를 샀는데 (일당이 신용매수를 해) 84억원어치 주식을 산지는 몰랐다”며 “어제 보니 반토막이 나 있었다”고 했다. 그는 “이틀 전에 20억원이 찍혀있던 계좌에 지금 1억8900만원만 남아있다. 내일은 마이너스 5억이 찍힐 것”이라며 수사나 조사에 최대한 협조하겠다고 밝혔다."
2023-04-24,공통점 없이 줄줄이 하한가... 외국계 증권사의 ‘수상한 매도’,"24일 오후 서울 중구 하나은행 딜링룸의 모습. 이날 코스피 지수는 전거래일 대비 20.90포인트(0.82%) 하락한 2,523.50에, 코스닥 지수는 13.59포인트(1.56%) 내린 855.23에 장을 마쳤다./뉴스124일 주식시장에서 여러 종목이 큰 이슈 없이 하한가를 기록했다. 배경에는 외국계 증권사의 대량 매도가 있었던 것으로 나타나 한국거래소가 내용 검토에 나섰다.이날 코스피와 코스닥시장에서 다올투자증권, 삼천리, 대성홀딩스, 서울가스, 세방, 하림지주, 선광, 다우데이타의 주가가 전 거래일 대비 가격 제한 폭(-30%)까지 내린 하한가로 마감했다.CJ도 장중 한때 전 거래일 대비 28.15% 급락했다가 낙폭을 줄여 12.70% 내린 9만4900원에 거래를 마쳤다.이들 종목은 업종상 공통점이 없으나 모두 매도 상위에 외국계 증권사인SG증권이 오른 것으로 확인됐다.SG증권은 이날CJ를 19만7806주 순매도했고 다올투자증권(61만6762주), 삼천리(1만3691주), 대성홀딩스(1만1909주), 서울가스(7639주), 세방(12만1925주), 하림지주(191만 2287주), 선광(4298주), 다우데이타(33만8115주) 등도 대량 매도했다.이날 오전부터SG증권을 통한 대량 매도가 발생하자 시장에선 다양한 추측이 나왔다. 우선 외국계 증권사와 거래하는 특정 사모펀드에서 레버리지(대출)를 일으켜 일부 종목의 주가 상승에 베팅했다가 갑자기 주가가 하락하자 팔자 물량을 쏟아 냈다는 것이다. 거래량이 적고 신용잔액이 많은 종목에서 반대매매(융자 상환을 위한 강제 매각)가 발생했기 때문이다. 이날 하한가를 기록한 종목들은 5일 평균 신용융자 잔고율이 다올투자증권 14.27%, 삼천리 10.77%, 세방 12.29% 등으로 대부분 높았다. 또SG증권이 향후 이들 종목의 주가 하락을 예상해 대량 공매도에 나선 것 아니냐는 추측도 나왔다.한국거래소 관계자는 “오늘 발생한SG증권 주문이 정상적인 것인지 확인 중”이라고 했다."
2024-02-07,HMM 협상 왜 결렬됐나... ‘실질적 경영권 요구’가 막판 걸림돌,"인수 부담 커져, 재매각 시점도 불투명하림은 20% 급락, 팬오션은 20% 급등/HMM제공국내 최대 해운사인HMM매각을 위한 주주 간 계약 협상이 6일 최종 결렬됐다. 매각 측인 산업은행·해양진흥공사(해진공)와 인수 우선협상대상자인 하림그룹·JKL컨소시엄은 기한을 연장해가며 협상을 이어갔지만, 정부의 ‘경영권 개입’ 등을 놓고 막판까지 줄다리기를 하다 결국 협상이 백지화됐다.◇막판 걸림돌은 ‘실질적 경영권’투자은행(IB) 업계에 따르면, 그간 배당 제한과 잔여 영구채 주식 전환 유예 등을 요구해온 하림 측은 협상 막바지에 이르러 매각 측 요구를 대부분 수용했다. 단, 마지막 단계에 걸림돌이 된 것은 ‘경영권 개입’ 부분이다.산은과 해진공은 “국가 기간산업이자 유일한 원양 국적선사를 매각하는 건인데다, 7조원 정도의 공적 자금을 투입하다 보니 보수적으로 볼 수밖에 없었다”는 입장이다. 이에 산은과 해진공은 하림에 일정 기간 경영권 관여를 요구한 것으로 알려졌다. 중요한 경영 사항에 대해서는 사전 협의나 동의를 받아야 한다는 내용 등이었다. 이에 하림이 ‘매각 측 요구를 다 받아줬는데 경영 간섭까지 받는 것은 과하다’는 입장을 보이면서 판이 깨지게 됐다.하림이 재무적 투자자(FI)인JKL파트너스의 ‘5년간 주식 보유 조건’을 예외로 해달라고 요구한 것도 이견이 좁혀지지 않았다. 주식 보유 기간을 3년으로 줄이자는 중재안도 있었지만 해진공이 5년을 고수했다.잔여 영구채 주식 전환 유예는 하림 측이 일찌감치 포기한 것으로 알려졌다. 산은·해진공이 보유한 1조6800억원어치의 영구채가 주식으로 전환되지 않을 경우 하림은 지분율 57.9% 수준을 유지할 수 있다. 반면 2025년까지 잔여 영구채가 전량 주식으로 전환되면 하림의 지분율은 38.9%로 떨어지고, 3년간 최대 2850억원의 배당금도 받지 못하게 된다. 이런 조건까지 받아들였는데도 매각 측이 마지막까지 경영권 개입을 요구하자 하림이 손을 털었다는 게 업계 평가다.전북 익산시 망성면 하림 2공장 전경. /뉴스1◇매각 측도 내내 엇박자매각 측도 속사정은 달랐다.HMM을 가급적 빨리 정리하고 싶은 산은과 최소한의 안전장치를 마련하고 싶은 해진공의 입장 차도 협상에 걸림돌이 됐다.강석훈 산업은행 회장은 작년 6월 기자간담회에서 “HMM주가가 1000원 움직이면 산은BIS자기자본비율이 0.07%포인트 움직인다”면서 “재무구조가 안정화되려면HMM매각이 중요하다”고 했다.HMM노조는 지난달 30일 국민의힘 한동훈 비상대책위원장에게 “산은은 구조조정 기업의 민영화라는 명목을 앞세워 산업 논리보다는 금융 논리로 공적 자금 회수에만 몰두한 나머지 자산 규모 26조원, 유보금만 10조원인HMM을 하림그룹에 6조4000억원에 졸속으로 넘겨버리려 한다”며 “무리해서 인수하겠다는 하림그룹의 잘못보다 우선협상대상자로 선정한 산은의 잘못이 더 크다”는 내용의 서한을 전달했다.반면, 해수부와 해진공은HMM이 국내 유일 대형 컨테이너 선사라는 특수한 지위 때문에 안전장치를 마련해야 한다는 입장이었다. 정부 관계자는 “HMM이 보유한 현금이 인수 자금의 원리금을 상환하는 데 쓰이는 게 아니라 해운업에 재투자될 수 있도록 하기 위해 여러 안전장치를 마련하려 했는데, 협상 과정에서 잘 받아들여지지 않았다”고 했다.서울 여의도 산업은행. /뉴스1◇새 주인, 찾을 수 있나…재매각 일정은?딜 관계자들은 재매각을 얘기하기는 이른 시점이라고 말한다. 현재 산은과 해진공이 보유한 1조6800억원어치의 영구채를 내년까지 다 주식으로 전환하게 되면 현재 7억주 수준인HMM의 발행주식 총수가 내년엔 10억주로 늘어난다. 매각 대금이 더 커져 매도가 더 어려워지게 되는 것이다. 한 업계 관계자는 “국내 10대 그룹이 아니면 인수가 어려워보인다”며 “매각은 상당 기간 어려울 것”이라고 전망했다.한편HMM인수에 실패한 하림 주가는 7일 장 초반 19.8% 하락한 3000원에 거래됐다. 하림지주는 2.7%, 피인수기업인HMM은 3.6% 하락 중이다. 반면 하림그룹 계열사이자HMM인수 주체로 나선 팬오션은 20% 넘게 급등했다. 하림이HMM인수자금 확보를 위해 팬오션 유상증자를 단행할 것이란 우려가 해소되며 주가에 긍정적으로 작용한 것이다."
2023-09-15,[단독] 상반기 주식 반대매매 1~7위는 모두 ‘라덕연 폭락주’,"7종목 2100억원 반대매매 당해신용거래 반대매매의 4분의 1지난 4월 ‘SG증권발 하한가 사태’로 주가가 폭락한 종목들에서 신용융자 반대매매로 인한 투자자 피해가 올 상반기(1~6월) 가장 큰 것으로 나타났다.14일 국회 정무위원회 소속 오기형 더불어민주당 의원실이 금융감독원으로부터 받은 자료에 따르면, 올 상반기 국내 증권사들의 신용융자 반대매매 금액 상위 10종목 가운데 1~7위가 모두SG증권발 사태에서 주가가 급락한 종목들이었다. 신용거래 반대매매란 투자자가 증권사로부터 돈을 빌려 주식을 산 경우에, 이후 이 주식의 평가가치가 떨어지면 증권사가 융자금을 보전하기 위해 이를 강제매각하는 절차다. 투자자는 대출금뿐만 아니라 투자 원금도 대부분 날리기 때문에 큰 손해를 입는다.상반기 1위는 삼천리로 477억원이 반대매매 당했고, 이어 다우데이타(462억원), 서울가스(380억원), 대성홀딩스(246억원), 세방(224억원), 선광(219억원), 하림지주(93억원) 순이었다. 7종목을 합친 금액은 약 2100억원으로, 상반기 신용거래 반대매매 총물량(7919억원)의 4분의 1 수준이었다.SG증권 사태는 라덕연 H투자자문사 대표 등이 이들 7종목을 비롯해 총 8종목의 주가를 인위적으로 조작해 올린 이후, 이들 주가가 갑자기 폭락해 벌어진 사건이다. 7 종목은 당시 나흘 동안 주가가 44~76%나 빠졌는데, 반대매매 대부분이 이때 발생했을 것으로 업계는 추정한다.김준석 자본시장연구원 선임연구위원은 “올해 반대매매 상위 종목들은 대부분 주가조작의 후폭풍으로 강제매각 당한 것이기 때문에 시세조종 세력을 믿었던 개미 투자자들의 피해가 막심할 것”이라고 말했다."
