date,title,content
2023-03-21,이재원·이부섭·조경일·하기환 서울대 총동창회 관악대상 수상,"이재원·이부섭·조경일·하기환서울대 총동창회(회장 김종섭)는 제25회 관악대상 수상자로 이재원 원앤씨 회장, 이부섭 동진쎄미켐 대표이사 회장, 조경일 하나제약 명예회장, 하기환 한남체인 회장 등 4명을 선정했다. 시상식은 24일 오후 6시 서울 중구 소공동 롯데호텔 크리스탈볼룸에서 열리는 정기총회에서 진행될 예정이다."
2022-04-11,"8개 제약사, 우크라이나에 30억 상당 의약품 후원","9일 경기 안산시 단원구 후원물품 집하장에서 글로벌생명나눔 관계자들이 우크라이나 후원 의약품을 포장하고 있다./제약바이오협회국내 8개 제약사가 우크라이나에 30억 상당의 의약품을 후원한다.한국제약바이오협회는 11일 “8개 회원사가 글로벌생명나눔을 통해 30억원 상당의 의약품, 의약외품, 건강기능식품 등을 우크라이나에 전달한다”고 밝혔다. 후원에 참여한 제약사는 ▲경동제약 ▲대웅제약 ▲동국제약 ▲일양약품 ▲제뉴파마 ▲퍼슨 ▲하나제약 ▲한미약품 8사다.제약사들은 항생제, 화상연고 등 우크라이나 대사관 긴급지원요청 의약품을 신속 지원키로 했다. 지난 9일 항생제 등 2억3000만원 상당은 포장을 마쳤으며, 추가 물품을 포함해 조만간 우크라이나 정부 군의무사령부에 항공편으로 전달할 예정이다.드미트로 포노마렌코 주한 우크라이나 대사는 “긴급 상황에서 의약품 등을 후원해주신 글로벌생명나눔과 한국제약바이오협회 회원사 여러분께 진심으로 감사의 말씀을 드린다”고 말했다.한편 이번 후원은 글로벌생명나눔이 우크라이나 본국과 난민촌 국민을 지원하기 위한 필수의약품 등 필요 물자를 협회에 요청함에 따라 이뤄졌다. 글로벌생명나눔은 해외 의료 빈곤지역, 해외 재난현장 등에 의료물품 및 의료기기를 지원하고 국제구호개발 관련 연구 등을 진행하는 국제구호 전문 비정부기구(NGO)다."
2024-06-03,지난달 거꾸로 간 국내 증시…종목 13.4%가 ‘52주 신저가’,"━잔인했던 5월 증시지난달 국내 증시 부진으로 1년 새 가장 낮은 주가를 기록한 ‘52주 신저가’ 종목이 속출했다. 2일 한국거래소에 따르면 지난달 중에 52주 신저가를 기록한 종목은 360개로 집계됐다. 코스피(953개)와 코스닥(1732개) 상장 종목 2685개 중 13.4%에 이른다. 지난달에 52주 신저가를 찍은 코스피 종목은 99개, 코스닥 종목은 261개였다.전기차 시장의 ‘캐즘(Chasm·일시적 수요 둔화)’ 여파로 2차전지 관련 종목이 줄줄이 신저가를 기록했다. 코스피 시장에서는 2차전지 ‘대장주’로 꼽히는 시가총액 3위LG에너지솔루션이 지난달 30일 장중 32만6000원으로 52주 신저가를 기록했다. 같은 날LG화학도 35만원으로 신저가를 썼다. 신용평가사인 S&P글로벌이 두 회사의 신용등급 전망을 ‘안정적’에서 ‘부정적’으로 하향 조정한 영향을 받았다. 코스닥 시가총액 1·2위인 2차전지 종목 에코프로비엠과 에코프로도 지난달 31일 각각 18만1500원, 8만8400원으로 52주 신저가를 나타냈다.이밖에 코스피에서는SK바이오사이언스·일동제약·하나제약 등 제약 업종과 현대제철·NI스틸 등 철강업에서 지난달 52주 신저가를 찍은 종목이 여럿 나왔다. ‘라인 야후 사태’ 여파 속에NAVER도 지난달 31일 17만원을 나타내며 52주 신저가를 나타냈다.이경민 대신증권 연구원은 “채권 금리 상승 여파에 2차 전지, 인터넷 업종 등을 중심으로 낮은 수익률이 나타났다”고 설명했다. 지난 한 달간 코스피는 2.06%, 코스닥지수는 3.33% 각각 하락했다.반면 양호한 주가 흐름을 보인 종목도 적지 않았다. 지난달 중에 52주 신고가를 기록한 종목은 총 274개(10.2%)였다. 화장품 및 음식료 관련 종목의 상승세가 두드러졌다.화장품 대장주 아모레퍼시픽은 지난달 31일 장중 20만500원까지 오르며 52주 신고가를 썼다. 제이준코스메틱·코스맥스·토니모리·한국콜마·한국화장품제조 와 같은 화장품 관련 주도 지난달에 52주 신고가를 갈아치웠다. 음식료 업종 중에선 삼양식품이 ‘불닭 열풍’에 힘입어 지난달 20일 장중 52주 신고가인 57만9000원을 기록했다. 한 달 새 주가는 20만원대에서 50만원대로 급등했다. 빙그레·오뚜기·풀무원·해태제과식품·동원F&B·CJ씨푸드도 52주 신고가를 새로 썼다. 대형주 중에선SK하이닉스와 현대차가 지난달에 52주 신고가를 경신했다.김영환NH투자증권 연구원은 “미국 빅테크 기업의 낙관적 실적 전망과 함께 한국의 수출 호조는 향후 주가에 긍정적인 영향을 끼칠 수 있다”며 “반면 미국 통화정책 불확실성은 변수가 될 수 있다”고 진단했다."
2024-06-02,5월 국내 증시 부진에…상장 종목중 13% '52주 신저가',"지난달 국내 증시 부진으로 1년 새 가장 낮은 주가를 기록한 ‘52주 신저가’ 종목이 속출했다.진나달 31일 코스피는 1.08포인트(0.04%) 오른 2636.52로 장을 마쳤다. 코스닥은 7.99포인트(0.96%) 오른 839.98이었다. 지난 한달간 코스피는 2.06%, 코스닥은 3.33% 각각 떨어졌다. 사진은 서울 중구 하나은행 본점 딜링룸 모습. 연합뉴스2일 한국거래소에 따르면 지난달 중에 52주 신저가를 기록한 종목은 360개로 집계됐다. 코스피(953개)와 코스닥(1732개) 상장 종목 2685개 중 13.4%에 이른다. 지난달에 52주 신저가를 찍은 코스피 종목은 99개, 코스닥 종목은 261개였다.전기차 시장의 ‘캐즘(Chasm‧일시적 수요 둔화)’ 여파로 2차전지 관련 종목이 줄줄이 신저가를 기록했다. 유가증권시장에서는 2차전지 ‘대장주’로 꼽히는 시가총액 3위LG에너지솔루션이 지난달 30일 장중 32만6000원으로 52주 신저가를 기록했다. 같은 날LG화학도 35만원으로 신저가를 썼다. 신용평가사인 S&P글로벌이 두 회사의 신용등급 전망을 ‘안정적’에서 ‘부정적’으로 하향 조정한 영향을 받았다. 코스닥 시가총액 1·2위인 2차전지 종목 에코프로비엠과 에코프로도 지난달 31일 각각 18만1500원, 8만8400원으로 52주 신저가를 나타냈다.이밖에 코스피에서는SK바이오사이언스·일동제약·하나제약 등 제약 업종과 현대제철·NI스틸 등 철강업에서 지난달 52주 신저가를 찍은 종목이 여럿 나왔다. ‘라인 야후 사태’ 여파 속에NAVER도 지난달 31일 17만원을 나타내며 52주 신저가를 나타냈다.이경민 대신증권 연구원은 “채권 금리 상승 여파에 2차 전지, 인터넷 업종 등을 중심으로 낮은 수익률이 나타났다.”라고 설명했다. 지난 한 달간 코스피는 2.06%, 코스닥지수는 3.33% 각각 하락했다.반면 양호한 주가 흐름을 보인 종목도 적지 않았다. 지난달 중에 52주 신고가를 기록한 종목은 총 274개(10.2%)였다. 화장품 및 음식료 관련 종목의 상승세가 두드러졌다.화장품 대장주 아모레퍼시픽은 지난달 31일 장중 20만500원까지 오르며 52주 신고가를 썼다. 제이준코스메틱·코스맥스·토니모리·한국콜마·한국화장품제조 와 같은 화장품 관련주도 지난달에 52주 신고가를 갈아치웠다. 음식료 업종 중에선 삼양식품이 ‘불닭 열풍’에 힘입어 지난달 20일 장중 52주 신고가인 57만9000원을 기록했다. 한 달 새 주가는 20만원대에서 50만원대로 급등했다. 빙그레·오뚜기·풀무원·해태제과식품·동원F&B·CJ씨푸드도 52주 신고가를 새로 썼다. 대형주 중에선SK하이닉스와 현대차가 지난달에 52주 신고가를 경신했다.김영환NH투자증권 연구원은 “미국 빅테크 기업의 낙관적 실적 전망과 함께 한국의 수출 호조는 향후 주가에 긍정적인 영향을 끼칠 수 있다”라며 “반면 미국 통화정책 불확실성은 변수가 될 수 있다”라고 진단했다."
2023-03-21,[사랑방] 서울대 총동창회 外,"◆서울대 총동창회(회장 김종섭)는 제25회 관악대상 수상자로 이재원 원앤씨 회장, 이부섭 동진쎄미켐 대표이사 회장, 조경일 하나제약 명예회장, 하기환 한남체인 회장 등 4명을 선정했다.◆한반도미래인구연구원(원장 이인실)은 오는 30일 대한상공회의소에서 한국인구학회와 함께 ‘인구감소시대 한국의 이민정책: 방향과 쟁점’을 주제로 연구원 출범 후 첫 세미나를 연다.◆사단법인 바른경제동인회(회장 박종규)는 오는 30일 오후 6시 서울 중구 소공동 롯데호텔에서 창립 30주년 기념식 및 정기총회를 개최한다.◆인천 옹진군(군수 문경복)은 20일 행정안전부와 ‘제2차 서해 5도 종합발전계획(2026~2035)’ 수립을 위한 업무협약을 체결했다."
2022-04-11,"국내 8개 제약사, 우크라이나에 30억원 규모 의약품 지원","지난 9일 경기 안산시 단원구 후원물품 집하장에서 글로벌생명나눔 관계자들이 우크라이나에 후원할 의약품을 포장하고 있다. 사진=한국제약바이오협회 제공·연합뉴스한국제약바이오협회는 회원사인 8개 제약사가 우크라이나에 30억원 상당의 의약품, 의약외품, 건강기능식품 등을 후원한다고 11일 밝혔다.후원에 참여한 제약사는 경동제약, 대웅제약, 동국제약, 일양약품, 제뉴파마, 퍼슨, 하나제약, 한미약품 (가나다순) 등 8개 사다.이들은 항생제, 화상연고 등 우크라이나 대사관의 긴급지원요청 의약품을 신속히 공급하기로 했다. 지난 9일 항생제 등의 포장을 마쳤으며, 추가 물품을 더해 조만간 우크라이나 정부의 군 의무사령부에 항공편으로 전달할 예정이다.이번 후원은 글로벌생명나눔이 우크라이나 본국 및 난민촌 국민을 지원하기 위한 필수의약품 등 필요 물자를 협회에 요청하면서 이뤄졌다. 글로벌생명나눔은 해외 의료 빈곤 지역, 해외 재난 현장 등에 의료물품 및 의료기기를 지원하고 국제구호개발 관련 연구 등을 진행하는 국제구호 전문 비정부기구(NGO)다."
2023-03-21,3월21일 알림,"◇자연의벗연구소, 사회적협동조합한강, 노을공원시민모임은 새달 20일 새만금 수라갯벌 지키기 활동을 기록한 다큐멘터리 영화 <수라>의 시사회를 인디스페이스에서 연다. 갯벌 생명들의 생태적 가치가 기후위기 시대에 우리에게 주는 메시지를 담고 있다. 누리집(https://forms.gle/uk8S2EB4LKsnKXMp8) 참고.자문밖문화포럼 제공◇ 자문밖문화포럼은 오는 26일까지 ‘제3기 자문밖아트레지던시’ 입주작가를 공모한다. 예술중심 융합창조 레지던시로, 미술·건축·디자인·패션·음악·연극·영화·기록 등의 분야를 대상으로 하며, 여타 창작을 바탕으로 융합할 수 있는 유관 분야도 지원 가능하다. 입주기간은 4월부터 12월까지이다. (02)6365-1388. 지원방식(http://jmbforum.org/2779/).장선경 간호사, 화순전남대병원 제공◇ 병원간호사회는 20일 제48회 정기 대의원 총회와 학술 세미나에서 장선경 화순전남대병원 의료 질 관리실 간호사 등 10명에게 ‘제2회 미래선도 간호사상'을 수여했다.◇ 한국국제협력단(KOICA)은 20일 올해 아시아, 아프리카, 중동, 독립국가연합, 중남미 지역 27개국을 대상으로 하는 환경·사회·민주적 의사소통(ESG) 청년 중기 봉사단 사업을 진행하기로 했다. 참가 대상은 만 19~39살 이하의 청년이고, 활동 기간은 5개월이다. 선발된 봉사단은 8월부터 국내 1개월, 국외 현장 4개월의 팀제 활동을 한다.◇ 포스코디엑스(DX)는 20일 경북 포항 본사에서 정기 주주총회와 이사회를 열고 사명을 포스코ICT에서 포스코DX로 변경하기로 확정했다. 정덕균 대표이사는 연임됐다. 허종열 경영기획실장은 사내이사로, 포스코홀딩스 김지용 미래기술연구원장은 기타 비상무이사로 신규 선임됐다.◇ 전남 목포문학관은 20일 올해의 상주작가로 조기호 시인을 선정했다. 한국문학관협회 주관 ‘2023년 문학관 상주작가 지원사업'에 5년 연속 수행기관으로 선정되어 사업비 2억4700여만원 전액을 국비로 지원받는다.◇ 서울대총동창회(회장 김종섭)는 제25회 관악대상 수상자로 이재원 원앤씨 회장, 이부섭 동진쎄미켐 대표이사 회장, 조경일 하나제약 명예회장, 하기환 한남체인 회장 등 4명을 선정했다.◇ 국립현대미술관은 21일부터 미술은행 소장품을 무상으로 대여·전시하는 ‘2023 나눔미술은행' 프로그램을 운영한다. 국립현대미술관 미술은행이 2019년부터 진행해 온 예술 나눔 사회공헌 프로그램이다. 전국 문화소외지역에 미술은행 소장품을 무료로 제공하는 것은 물론 작품 운송료·보험료·감상자료 등을 지원한다.◇ 국립한글박물관은 21일 화요일 오후 3시 인문학 강좌 프로그램인 ‘화요 한글문화 강좌' 첫 강의를 시작한다. 강의는 12월 19일까지 총 10회 열린다. 별도 신청 없이 박물관 유튜브(www.youtube.com/국립한글박물관)에서 볼 수 있다."
