date,title,content
2023-04-28,"금융위, 주가조작단 압수수색…“투자업체, 간판도 없이 운영”","금융위원회와 금융감독원·서울 남부지검 소속 직원 34명은 주가조작에 관여한 정황이 있는 세력의 사무실·자택 등을 압수수색했다. 한 투자컨설팅 업체가 이용하던 서울 강남구 건물. 김남준 기자금융 당국과 검찰이 주가조작 의심 세력에 대한 강제수사에 착수했다. 이들은 최근 주식시장을 흔들고 있는 일부 종목에 대한 하한가를 유발한 세력으로 지목되고 있다. 이에 앞서 서울남부지검 금융증권범죄합동수사단은 주가조작 의혹 관련자 10명에게 출국금지 조처를 내렸다.27일 금융위원회 자본시장조사총괄과와 금융감독원·서울 남부지검 소속 직원 34명은 서울 강남구에 위치한 한 투자컨설팅 업체의 사무실과 주가조작에 관여한 정황이 있는 인사의 자택 등을 압수수색했다. 또 이번 사건에 관여된 것으로 의심받고 있는 서울 강남구의 골프 업체와 서울 광진구의 한 식당도 압수수색 대상에 포함됐다.금융위 관계자는 “언론 보도에 난 주식 조작과 관련해 실체를 규명하기 위해 압수수색에 들어갔다”고 설명했다. 주가조작 의심 세력은 사무실 운영부터 주식 투자까지 각별한 보안을 유지하며 진행해 온 것으로 알려져 있다.이날 압수수색 대상이었던, 서울 강남구 한 사무실을 직접 찾아가 보니 인근 주민과 같은 건물을 쓰는 다른 층의 사람은 이들이 정확히 어떤 일을 해왔는지 몰랐다고 답했다. 해당 건물 다른 층에서 학원을 운영하는 A씨는 “남자 2명 정도가 왔다 갔다 하는 것만 봤다”면서 “최근에 갑자기 이사한 것만 안다”고 했다.특히 이들은 최근 이곳 건물로 이사했다가, 관련 보도가 나간 뒤 급하게 사무실을 정리한 것으로 알려졌다. 인근 부동산중개업소 관계자는 “해당 사무실은 원래 한 법당이 1년6개월 정도 임대해 쓰다가 최근에 나간 곳”이라면서 “사무실이 비어 있다 보니 최근 한 달 정도 짧게 빌려서 쓴 거 같다”고 했다. 실제 해당 사무실은 이렇다 할 간판도 없이 운영돼 오고 있었다. 오히려 건물 입구엔 예전 임차인이었던 법당 간판만 여전히 걸려 있었다.최근 외국계 증권사SG(소시에테제네랄)증권발(發) 이상 매도 물량에 서울가스·대성홀딩스·삼천리·선광·세방·다우데이타·다올투자증권·하림지주 8개 종목이 급락했다.한국거래소에 따르면 이들 8개 종목의 시가총액은 지난 24일부터 4거래일 만에 8조원 가까이 사라졌다. 지난 24일부터 나흘간 8개 종목의 주가는 평균 70%가량 떨어졌다. 서울가스 주가는 지난 21일 46만7500원에서 27일 11만2700원으로 수직 낙하했다. 4거래일 만에 75% 하락했다. 같은 기간 대성홀딩스도 13만100원에서 3만1300원으로 76% 하락했다. 선광(16만7700원→4만400원), 삼천리(49만7500원→12만4500원)의 낙폭도 각각 75% 수준이다.익명을 요구한 증권업계 관계자는 “주가를 인위적으로 끌어올렸다가 금융 당국의 조사가 시작됐다는 낌새를 눈치챘거나 세력 내 분쟁 같은 이유로 자금 일탈이 생기면서 한꺼번에 매물을 던졌고 수급 변동성이 커지면서 주가 폭락으로 이어졌을 것”이라고 말했다.특히 이들 세력이 2020년부터 투자자 명의로 휴대전화를 개통해 대리 투자를 하며, 내부 관계자끼리 주식 매매를 통해 주가를 끌어올리는 이른바 ‘통정매매’를 벌였다는 의혹까지 제기됐다. 또 주가 조작 과정에 정관계 인사, 연예인·고액 연봉의 전문직들도 참여한 것으로 전해졌다. 실제 가수 임창정씨도 이들 세력에 돈을 투자해 논란을 빚었다. 김익래 다우키움그룹 회장은 다우데이타 보유 주식을 폭락 직전 처분해 의혹이 제기되고 있다. 김 회장은 지난 20일 시간외매매로 다우데이타 140만 주(3.65%)를 주당 4만3245원에 처분해 605억원을 확보했다."
2023-04-27,"""법당 간판도 안떼고 운영""…임창정 의혹 주가조작 사무실 압색","금융당국과 검찰이 주가 조작 의심 세력에 대한 강제수사에 착수했다. 이들은 최근 주식시장을 흔들고 있는 일부 종목에 대한 하한가를 유발한 세력으로 지목되고 있다. 이에 앞서 서울남부지검 금융증권범죄합동수사단은 주가 조작 의혹 관련자 10명에게 출국 금지 조처를 내렸다.━금융당국·검찰 합동으로 압수수색27일 금융위원회 자본시장조사단은 주가 조작 의심 세력이 사무실로 쓴 서울 강남구 한 빌딩을 압수수색 했다. 김남준 기자27일 금융위원회 자본시장조사총괄과와 금융감독원·서울 남부지검 소속 직원 34명은 서울 강남구에 위치한 한 투자컨설팅업체의 사무실과 주가 조작에 관여한 정황이 있는 인사들의 자택 등을 압수수색했다. 또 이번 사건에 관여된 것으로 의심받고 있는 서울 강남구의 골프업체와 서울 광진구의 한 식당도 압수수색 대상에 포함됐다.금융위 관계자는 “언론 보도에 난 주식 조작 관련해 실체를 규명하기 위해 압수수색에 들어갔다”면서 “필요한 자료가 많아 여러 군데 동시에 압수수색을 진행했다”고 설명했다. 주가 조작 의심 세력들은 사무실 운영부터 주식 투자까지 각별한 보안을 유지하며 진행해 온 것으로 알려져 있다. 이 때문에 이날 압수수색도 이들의 행적의 실체를 규명하는 데 초점이 맞춰졌다.━“한 달 전 왔다 갑자기 이사”…예전 법당 간판만주가 조작 의심세력이 쓴 서울 강남구 사무실. 김남준 기자이날 압수수색 대상이었던, 서울 강남구 한 사무실을 직접 찾아가 보니 인근 주민들과 같은 건물을 쓰는 다른 층의 사람들은 이들이 정확히 어떤 일을 해왔는지 몰랐다고 답했다. 해당 건물 다른 층에서 학원을 운영하는 A씨는 “남자 2명 정도가 왔다 갔다 하는 것만 봤다”면서 “최근에 갑자기 이사를 한 것만 안다”고 했다.특히 이들은 최근에서야 이곳 건물로 이사했다가, 관련 보도가 나간 뒤 급하게 사무실을 정리한 것으로 알려졌다. 인근 부동산중개업소 관계자는 “해당 사무실은 원래 한 법당이 1년 6개월 정도 임대해 쓰다가 최근에 나간 곳”이라면서 “사무실이 비어 있다 보니 (주가 조작 의심 세력이) 최근 한 달 정도 짧게 빌려서 쓴 거 같다”고 했다. 실제 해당 사무실은 이렇다 할 간판도 없이 운영돼 오고 있었다. 오히려 건물 입구엔 예전 임차인이었던 법당 간판만 여전히 걸려 있었다.주가 조작 압수수색 사무실에 걸려 있는 법당 간판압수수색에 참여한 금융위 직원들은 장시간 동안 폐쇄회로(CC)TV를 살펴보며, 건물에 출입한 사람들의 인적 사안 등을 꼼꼼히 확인했다. 압수수색도 이른 오전부터 시작해 늦은 오후까지 이어졌다.━정관계 인사, 연예인까지 참여 ‘통정매매’ 조작 의심최근 외국계 증권사SG(소시에테제네랄) 증권 발(發) 이상 매도 물량에 서울가스·대성홀딩스·삼천리·선광·세방·다우데이타·다올투자증권·하림지주 8개 종목의 주가가 폭락했다. 이와 관련해 주가 조작 의심 세력들이 해당 종목의 매물을 급하게 팔면서, 주가가 급락했다는 주장이 나왔다.주가 조작 의심 세력에 관련돼 압수수색 대상이 된 서울 광진구의 한 식당. 27일 금융당국 한 관계자가 해당 식당 안에서 압수수색을 진행하고 있다. 김남준 기자특히 이들 세력이 2020년부터 투자자 명의로 휴대전화를 개통해 대리 투자를 하며, 내부 관계자끼리 주식 매매를 통해 주가를 끌어올리는 이른바 ‘통정매매’를 벌였다는 의혹까지 제기됐다. 이 과정에서 금융당국이 조사에 나서자, 눈치를 챈 일부 투자자들이 물량을 던지면서 주가가 급락했다는 것이다.일부 투자자들은 이번 압수수색에 포함된 골프업체와 식당에 고액의 골프 레슨비와 술값을 내는 방식으로 주식 투자 수익 수수료를 일부 대납한 것으로도 알려졌다. 또 주가 조작 과정에 정관계 인사, 연예인·고액 연봉의 전문직들도 참여한 것으로 전해졌다. 실제 가수 임창정씨도 이들 세력에 돈을 투자해 논란을 빚었다.━“신속 처리, 필요하면 제도 보완할 것”이와 관련해 금융위와 금감원·검찰은 최근 관련 제보 등을 입수하고 합동 수사를 벌이고 있다. 금융당국 관계자는 “통상 사안이 크지 않으면, 금감원이 관련자를 불러 조사하는 게 일반적이지만 이번 사안은 비교적 중대해 금감원과 달리 강제 수사 권한이 있는 금융위까지 나서서 압수수색을 진행하는 것”이라고 했다. 금융위는 오늘 압수수색 결과를 바탕으로 관련자 조사 등을 추가로 벌인다는 방침이다.한편 김주현 금융위원장은 이날 오후 은행연합회에서 열린 부동산 프로젝트파이낸싱(PF) 대주단 협약식 이후 기자들과 만나 “국민 입장에서 관계기관이 협력해서 신속히 사건을 처리하는 것이 가장 중요하다”며 “수사 결과에 따라 제도 보완 필요성이 제기되면 당연히 그렇게 할 예정”이라고 했다."
2023-04-25,"'작전' 세력에 투자한 임창정 ""나도 피해자, 30억→1.8억 됐다""","가수 임창정. 연합뉴스가수 임창정이 주가조작에 가담했다는 의혹과 관련해 “나도 피해자”라며 자신도 수십억 원의 손해를 봤다고 주장했다.25일JTBC에 따르면 임창정은 최근 주가가 급락한 일부 종목과 관련한 주가조작 의심 일당에 30억원을 맡겼고 이들과 함께 해외 골프장에도 투자금을 댔던 것으로 파악됐다.임창정은 자신이 설립한 연예기획사 지분 일부를 50억원에 파는 대신 30억원을 이들 일당에 재투자하기로 했고, 이를 위해 자신의 증권사 계정에 15억원, 부인의 계정에 나머지 15억원을 넣었다고 전했다. 또 자신과 부인의 신분증을 맡겨 해당 세력들이 임씨 부부 명의로 대리 투자할 수 있도록 했다.이후 임창정이 투자한 30억원은 한 달 반 만에 58억이 됐다. 하지만 이상한 낌새를 눈치채지는 못했다고 그는 전했다.임창정은 “당연히 ‘그 친구들이 하는 팀들이 하는 룰인가보다’ (하고) 저는 주식을 모르니 그렇게 다 해줬다”며 “돈 많으신 회장님들도 개인 돈을 불려주고 막 그런다고 (하니까) 그런데 제가 뭐 어떻게 그걸…”이라고 말했다.임씨에 따르면 이들 일당은 그가 투자한 30억원으로 신용매수까지 해 모두 84억원 어치 주식을 샀다. 임씨는 이 역시 몰랐다고 했다. 그는 “저는 30억원을 샀는데, 84억을 산 거였다. 몰랐다”고 말했다.임창정은 이른바 ‘작전세력’으로 불리는 이들 일당이 운영하는 방송 채널에 출연했고 이들이 인수한 해외 골프장에도 함께 투자한 것으로 전해졌다.임창정은 그러나 이틀 연속 폭락에 오히려 자신도 손해를 본 피해자라고 주장하면서, 수사나 조사에 최대한 협조하겠다고 밝혔다.임창정은 “(계좌가) 둘 다 반 토막이 나 있는 거다. 그랬더니 이게 ‘누군가에게 당했다’라는 표현”이라면서 “(30억원을 투자했는데) 1억 8900만원만 남았다. 내일부터는 마이너스 5억원이 될 것”이라고 했다.한편 금융위원회는 삼천리·하림지주·대성홀딩스 등 8개 상장사의 무더기 폭락 사태에 주가조작 세력이 개입했다는 의혹에 대해 본격적인 조사에 나섰다."
2022-07-28,"“가정간편식 50개로 확대, 닭고기 넘어 퍼스트 키친 될 것”","지난해 가정간편식 시장에 도전장을 낸 김홍국 하림그룹 회장은 “좋은 재료를 쓰고 공정을 첨단화해 가정식 그 자체(HMI·HomeMealItself)를 선보이겠다”고 말했다. 김경록 기자“신선한 식재료를 소비자가보다 더 싸게 사서 깨끗하고 맛있게 조리하는 거죠. 가정식 대체재(HMR·HomeMealReplacement)가 아니라 가정식 그 자체(HMI·HomeMealItself)라는 새로운 카테고리를 만들겠습니다.”지난 21일 서울 강남구 논현동 하림 타워에서 만난 김홍국(65) 하림지주 회장은 간편식 시장에서 하림의 비전에 대해 이렇게 밝혔다. 하림은 지난해 10월 ‘더 미식 장인라면’을 시작으로 올해 5월 ‘더 미식 밥’ 등 가정간편식 시장에 도전장을 냈다. 닭고기 생산을 넘어 종합식품기업으로 도약하겠다는 목표다.하림이 가정 간편식 시장에 진출하면서 내세운 것은 가정식 그 자체라는 의미의HMI다. 간편식이 빠르게 우리 밥상을 대체해가고 있지만, 여전히 가공식품에 대한 인식이 좋지 않다는 데서 기회를 봤다.하림은 닭고기와 돼지고기를 생산하는 기업이라는 이점을 활용했다. 김홍국 회장은 “인공 조미료를 전혀 쓰지 않고 닭뼈·돼지뼈·소뼈·대파를 20시간 저온에서 푹 고아 농축한 액상 수프를 담은 라면을 만들고, 즉석 밥도 밥과 물만 넣고 무균 공정으로 만들어 보존제가 들어가지 않는다”고 설명했다.그러면서 이런 음식을 만드는 하림의 식품 공장을 ‘퍼스트 키친(firstkitchen)’이라고 표현했다. 김 회장은 “집 주방에서 하는 요리를 공장에서 대신한다는 의미”라고 설명했다. “집은 퍼스트 키친에서 만든 요리를 데우거나 간단히 조리해 즐기는 세컨드 키친(secondkitchen)이 돼가고 있다”면서다.좋은 재료를 쓰고 공정을 첨단화한 만큼 값은 비싼 편이다. 장인라면은 개당 2200원으로 신라면 블랙(1700원)이나 오뚜기 진짬뽕(1700원)보다, 더 미식밥(2300원)은CJ제일제당 햇반보다 20% 이상 비싸다. 이에 대해 김 회장은 “품질이 프리미엄이기 때문”이라며 “국민 소득이 3만 달러를 넘어가는 시점에 가격이 비싸도 제대로 된 식자재로 만드는 음식을 선택할 것이라 확신한다”고 답했다.하림의 더 미식 라인은 향후 50여 개 품목으로 확대된다. 하반기에 아욱을 넣은 된장 라면과 김치라면, 부대찌개라면 등을 출시할 예정이다.김 회장은 맨손으로 양계 사업을 시작해 하림을 국내 축산업계 1위 기업으로 일군 대표적 자수성가형 사업가로 꼽힌다. 특히 지난 2015년 곡물 유통 사업을 위해 해운사 팬오션을 인수하면서 자산 10조원 규모의 대기업 집단에 포함됐다. 코로나19 기간 동안 해운업이 호황을 이어가면서 팬오션 인수가 신의 한 수였다는 평가를 받는다.김 회장은 27일 출범한 윤석열 정부의 첫 대통령 직속 위원회인 국민통합위원회의 경제·계층 분과 민간 위원으로 합류했다. 새 정부에 기업인으로서 바라는 점에 대해 김 회장은 “시장에 자유를 주는 게 중요하다. 방종이 아니라 스스로 통제도 하는 질서 자유주의”라며 “자유로운 기업 활동과 정상적 시장 원리가 작동하는 기업 환경이 만들어졌으면 한다”고 전했다.그는 “하림이 대기업으로 지정이 되면서 각종 규제를 받고 있는데 오히려JBS나 카길 등 자산 규모가 훨씬 큰 글로벌 식품 기업은 국내 사업에 아무런 규제가 없다”며 “해외 업체는 부당하면 세계무역기구(WTO)에 제소도 하는데, 국내 업체는 외려 모래주머니를 차고 사업하는 격”이라고 지적했다."
2022-07-27,“닭고기서 종합식품 회사로…간편식 50개 신제품 준비”,"김홍국 하림지주 회장 단독 인터뷰“가정에서 만든 음식은 좋고, 공장에서 만든 음식 그렇지 않다? 장소의 문제가 아니라 재료의 문제라고 생각합니다. 신선한 식재료를 소비자가보다 더 싸게 사서 더 깨끗하고 맛있게 조리하는 거죠. 가정식 대체재(HMR·HomeMealReplacement)가 아니라 가정식 그 자체(HMI·HomeMealItself)라는 새로운 카테고리를 만들겠습니다.”지난 21일 서울 강남구 논현동 하림타워에서 만난 김홍국(65) 하림지주 회장은 간편식 시장에서 하림의 비전에 대해 이렇게 얘기했다. 하림은 지난해 10월 ‘더 미식 장인라면’을 시작으로 올해 5월 ‘더 미식 밥’ 등 가정간편식 시장에 도전장을 냈다. 닭고기 생산을 넘어 종합식품기업으로 도약하겠다는 목표다.김홍국 하림그룹 회장이 21일 오전 서울 강남구 하림 사옥에서 중앙일보와 인터뷰하고 있다. 김경록 기자“고기 향 넣은 가짜 국물? 뼈 20시간 고았다”하림이 가정 간편식 시장에 진출하면서 내세운 것은 가정식 그 자체라는 의미의HMI다. 간편식이 빠르게 우리 밥상을 대체해가고 있지만, 여전히 가공식품에 대한 인식이 좋지 않다는 데서 기회를 봤다.하림은 닭고기와 돼지고기를 생산하는 기업이라는 이점을 활용, 이런 인식을 넘는 건강한 가정 간편식을 내세운다. 김홍국 회장은 “인공 조미료를 전혀 쓰지 않고 닭 뼈·돼지 뼈·소뼈·대파를 20시간 저온에서 푹 고아 농축한 액상 수프를 담은 라면을 만들고, 즉석 밥도 밥과 물만 넣고 무균 공정으로 만들어 보존제를 포함하지 않는다”고 설명했다.그러면서 이런 음식을 만드는 하림의 식품 공장을 ‘퍼스트 키친(firstkitchen)’이라고 표현했다. 김 회장은 “예전 집의 주방에서 하던 요리를 공장에서 대신한다는 의미”라고 설명했다. 이어 “집은 오히려 세컨드 키친(secondkitchen)이 됐다”며 “퍼스트 키친에서 만든 요리를 데우거나 간단히 조리해 즐기는 공간이다. 다만 재료 선택이나 공정에 더 공을 들였다”고 덧붙였다.좋은 재료를 쓰고 공정을 첨단화한 만큼 값은 비싼 편이다. 장인라면은 개당 2200원으로 신라면 블랙(1700원)이나 오뚜기 진짬뽕(1700원)보다, 더 미식밥(2300원)은CJ제일제당 햇반보다 20% 이상 비싸다. 이에 대해 김 회장은 “가격이 프리미엄이 아니라 품질이 프리미엄”이라며 “국민 소득이 3만 달러를 넘어가는 시점에 가격이 비싸도 제대로 된 식자재로 만드는 음식을 선택할 것이라 확신한다”고 답했다.하림은 이취가 없고 하얗게 탈색하지 않은 밥 고유의 색깔을 내새운 프리미엄 즉석밥 '더 미식 밥'을 출시했다. [사진 하림]하림의 더 미식 라인은 향후 50여 개 품목으로 확대된다. 하반기에 아욱을 넣은 된장 라면과 김치라면, 부대찌개 라면 등을 출시할 예정이다.“양재동 물류단지 5년 후 완공 목표”다만 최근 원자잿값과 물류비가 오르면서 국내 식품 기업의 상황은 녹록지 않은 편이다. 김 회장은 “국제 원자재 시장 불안 등으로 가격 인상 압력이 커지고 있는 건 사실”이라며 “각 계열사가 개별 상황에 맞게 잘 대응해 나갈 것”이라고 했다.하림그룹은 서울 양재동에 첨단물류단지를 계획하고 있다. e커머스(전자상거래)가 일상화하면서 폭발적으로 늘어난 도시 내 생활물류 수요에 효율적으로 대처하기 위해서다. 도심 물류단지는 국내선 처음 도입 및 시행되는 제도로 인허가권자인 서울시와 갈등을 빚으며 사업이 지연됐으나 지난해 감사원이 하림 측의 손을 들어주면서 재추진되고 있다.김 회장은 “도심 내에 물류단지가 생기면 물류비가 내려갈 뿐 아니라 물류 단계가 줄면서 포장 쓰레기와 탄소 배출이 줄어드는 효과가 있다”며 “2015년에 관련법이 만들어지면서 추진했는데, 비싼 땅에 물류 단지를 짓는 만큼 법에 정해진 용적률 혜택 등을 받은 것이 일부 오해가 있어 지연됐던 것”이라고 설명했다. 하림은 물류단지 건설에 약 5조원을 투자할 계획이다. 2027년 완공 목표다.양재동 도시첨단물류단지 조성 개요. [사진 하림산업]“시장에 자유 주는 게 중요”김 회장은 맨손으로 양계 사업을 시작해 하림을 업계 1위 기업으로 일군 대표적 자수성가형 사업가로 꼽힌다. 특히 지난 2015년 곡물 유통 사업을 위해 해운사 팬오션을 인수하면서 자산 10조원 규모의 대기업 집단에 포함됐다.코로나19 기간 동안 해운업이 호황을 이어가면서 팬오션 인수가 ‘신의 한 수’였다는 평가를 받는다. 다만 최근 대두한 해운업 침체 우려에 대해 김 회장은 “2009년부터 해운업 불황이 10년을 갔고, 2019년부터 조금씩 좋아졌다. 이번 호황도 적어도 3~4년은 더 갈 것”이라고 전망했다.그래픽=김현서kim.hyeonseo12@joongang.co.kr김 회장은 지난 5월 21일 조 바이든 미국 대통령 방한 환영 만찬이 열렸을 때 직접 참석하기도 했다. 지난 2011년 미 델라웨어주의 닭고기 회사 ‘엘런패밀리푸드’를 인수하면서 인연을 맺은 것이 계기가 됐다. 델라웨어는 바이든 대통령이 2009년까지 상원의원을 지낸 곳이다. 김 회장은 “환영 만찬에 참석하게 돼 영광이었다”면서 “미국 정치인들은 일자리와 직결된 기업 활동에 관해 관심을 갖고 지원하려 하기 때문에 하림을 특별히 기억해 부른 것으로 안다”고 했다.김홍국 하림그룹 회장이 21일 오전 서울 강남구 하림 사옥에서 중앙일보와 인터뷰하고 있다. 김경록 기자김 회장은 27일 출범한 윤석열 정부의 첫 대통령 직속 위원회인 국민통합위원회의 경제·계층 분과 민간 위원으로 선임됐다. 새 정부에 기업인으로서 바라는 점에 대해 김 회장은 “시장에 자유를 주는 게 중요하다. 방종이 아니라 스스로 통제도 하는 질서 자유주의”라며 “자유로운 기업 활동과 정상적 시장 원리가 작동하는 기업 환경이 만들어졌으면 한다”고 밝혔다.그는 “하림이 대기업으로 지정이 되면서 각종 규제를 받고 있는데 오히려JBS나 카길 등 자산 규모가 훨씬 큰 글로벌 식품 기업은 국내 사업에 아무런 규제가 없다”며 “해외 업체는 부당하면 세계무역기구(WTO)에 제소도 하는데, 국내 업체는 외려 모래주머니를 차고 사업하는 격”이라고 지적했다.김홍국 누구1957년 전라북도 익산에서 태어났다. 11살 때 외할머니가 사준 병아리 10마리로 시작해 하림의 모체인 ‘황등농장’의 농장주가 됐다. 1986년 하림식품을 설립한 뒤 2001년 천하제일사료·올품·엔에스쇼핑 등을 계열사로 편입시켰다. 이후 주원산오리·선진·엘런패밀리푸드·팬오션 등을 인수했다. 하림은 현재 자산 15조원으로 대기업 순위 27위에 올라 있다."
