date,title,content
2023-04-10,‘공매도 과열’ 지난주만 20회… 급상승 코스닥에 주의보,"작년의 2배 넘어… 반도체·2차전지·제약바이오 과열지정 많아이윤수 금융위원회 자본시장정책관이 지난해 7월 서울 종로구 정부서울청사에서 '불법 공매도 적발, 처벌 강화 및 공매도 관련 제도 보완방안'을 발표하고 있다.2022.7.28/뉴스1 ⓒNews1 이광호 기자코스닥이 가파르게 상승했지만 공매도 물량도 함께 쌓이고 있다. 그만큼 코스닥 과열에 대한 우려도 크다는 뜻이다.코스닥 하루 평균 공매도 거래액은 1월 835억원에서 4월 3064억원으로 4배 가깝게 급증했다. 올 들어 7일까지 코스닥 상승률은 30%로 코스피(11%)의 거의 3배에 달했다.9일 한국거래소에 따르면 이달 들어 5거래일(4월 3~7일) 간 공매도 과열 종목 지정이 20회 이뤄졌다. 작년 같은 기간(9회)의 2배 이상이다. 올 1~3월 공매도 과열 종목 지정도 210회로, 1년 전(64회)의 3배를 넘었다.공매도는 주식을 빌려서 팔았다가 주가가 떨어지면 되사서 갚아 차익을 남기는 투자 기법이다. 공매도가 집중되면 단기적으로 주가가 하락하는 경향이 있다. 코스닥 상승세를 주도 중인 개인 투자자들이 조심해야 하는 이유다.한국거래소는 과도한 시장 출렁임을 막기 위해 공매도가 급증한 종목을 과열 종목으로 지정하고, 다음 거래일에 공매도를 금지하고 있다. 최근 코스닥 시장의 반도체·2차전지·제약바이오 업종에서 공매도 주의보가 많이 발령됐다.5일 만에 공매도 과열 20회이달 공매도 과열 종목 지정 20회 중 19회가 코스닥 시장에서 이뤄졌다. 코스피는SK하이닉스 1회뿐이었다. 코스닥에서는 16개 기업이 과열 종목으로 지정됐는데, 네패스·엔켐·포스코ICT등 3곳은 2번씩 지정됐다.업종별로는 반도체가 8회로 가장 많았다.SK하이닉스·원익IPS·네패스·레이크머티리얼즈 등이 포함됐다. 올 들어KRX반도체 지수는 33% 급등했다. 최악의 실적에도 반도체 경기가 저점을 지나는 중으로 해석되며 낙관론이 투자자들 사이에 퍼졌기 때문으로 보인다.특히 레이크머티리얼즈의 경우 ‘직전 40일 공매도 평균 거래액 대비 당일 공매도 거래액 배율’이 19만배에 달하며 6일 과열 종목에 지정됐다. 공매도가 별로 없는 종목이었는데 이날 70억원어치 공매도가 집중되며 전날 9270원까지 올랐던 주가는 8580원으로 7% 넘게 떨어졌다.엔켐·피엔티 등 2차전지와 파마리서치·에이비엘바이오 등 제약·바이오 업종도 올 들어서만 4회 과열 종목에 지정되며 반도체 뒤를 이었다.올해 최다 과열 종목 지정은 코스닥 식품기업 하림지주와 반도체 장비업체 테스로, 각각 7회였다. 2차전지 관련 기업인 에코프로비엠과 모회사인 에코프로도 각 6회 지정됐다.코스닥 단기 급등 경고 신호공매도는 개인보다 정보와 자금력이 풍부한 외국인·기관들이 많이 한다. 최근 한 달 코스닥 공매도 하루 평균 거래액은 외국인(1660억원)·기관(1130억원)이 개인(70억원)보다 20배 안팎으로 많았다.전문가들은 종목의 본질 가치보다 주가가 과도하게 높은 경우 공매도의 타깃이 된다는 점에서 공매도를 과열 경고로 받아들일 필요가 있다고 지적한다. 한 증권사 관계자는 “단기 급등 종목에 공매도가 일어나면 단기 하락 폭이 커질 수 있으므로 ‘묻지 마’ 투자는 지양해야 한다”고 말했다. 작년 10월 네이버·카카오 주가가 급락했을 때 공매도 거래량이 대폭 늘며 개인 투자자들이 손실을 입기도 했다.현재 공매도 잔고가 가장 많이 쌓여 있는 코스닥 종목은 2차전지 업체 에코프로비엠(8140억원)과 엘앤에프(3460억원)다. 제약바이오 업체HLB(1380억원)가 그 뒤를 따른다. 공매도 잔고는 공매도 거래 후 아직 갚지 않은 주식을 말한다. 그만큼 주가 하락을 바라는 투자자가 많다는 뜻이다.◇공매도 재개 검토 꼬리 만 당국공매도로 인한 주가 하락 우려가 커지자 금융 당국도 신중한 자세다. 지난달 29일 블룸버그 인터뷰에서 “연내 공매도 금지 조치 해제를 검토할 것”이라고 밝힌 이복현 금융감독원장은 닷새 만에 신중 기조로 돌아섰다. 지난 3일 “금융시장이 불안정할 경우에는 공매도 재개 검토를 안 하겠다”고 한발 물러선 것이다. 정부는 2020년 3월 코로나 사태로 전 종목에 대한 공매도를 금지했다가, 2021년 5월 일부 대형 종목만 공매도를 재개했다."
2023-05-30,"한국 찾은 큰손 UAE 국부펀드, 뭘 사려고 하나 봤더니","에너지·농업기술 등 6분야 관심윤석열 대통령이 지난 1월31일 서울 강남구 한국무역협회에서 열린UAE투자유치 후속조치 점검회의를 주재하고 있다. /뉴스1이달 중순 세계 투자시장의 ‘큰손’인 아랍에미리트(UAE) 국부 펀드들이 한국을 찾아 투자처를 물색하고 돌아갔다. 주요 관심 분야는 2차전지·바이오·농업 기술 등이었다. 지난 1월 한국·UAE대통령은UAE가 한국에 300억달러(약 40조원)를 투자하는 방안에 합의했고, 그 일환으로UAE투자 사절단이 방한한 것이다.29일 정부와 금융투자업계에 따르면, 지난 15~16일 기획재정부가 서울 여의도에서 개최한 ‘아랍에미리트·한국 소버린 투자 파트너십 포럼’에UAE의 무바달라와 아부다비투자청(ADIA)·아부다비개발지주회사(ADQ)·아부다비투자위원회(ADIC) 등 투자 기관 4곳이 참여했다.무바달라는 이번 투자 협정에서UAE를 대표해 투자를 총괄·조정하는 역할을 맡은 국부 펀드다. 세계적으로 2840억달러(약 380조원)의 자금을 운용한다. 영국 한 대학의 실험실에까지 투자할 정도로 적극적으로 투자하는 것으로 알려졌다.이 기관들은 한국의 에너지와 정보 통신 기술·농업 기술·생명공학·항공우주·K컬처 등 6분야를 우선 투자 대상으로 삼았고, 약 20억달러(2조7000억원) 규모의 투자에 대한 검토에 착수했다.이는UAE가 중국에 약속한 총투자액(50억달러)의 40%에 해당하는 수준이다. 러시아에 대한 투자액(10억달러)과 비교하면 2배나 많다.UAE는 이번 투자를 시작으로 합의한 300억달러까지 단계적으로 실행에 옮긴다는 방침으로 알려졌다.이들은 이번에 한국 기업, 기관 40여 곳도 접촉했다. 삼성바이오로직스·SK바이오사이언스·카카오헬스케어·CJ·하림·한진·카카오엔터프라이즈·국민연금공단·한국투자공사(KIC) 등이 나섰고, 일부는 1대1로 협의했다. 16일엔 주요 증권사 대표들과 만났고, 미래에셋자산운용·IMM인베스트먼트 등 투자사도 면담했다.기재부와 한국 측 실무 책임 기관인 산업은행은 지난 3월UAE에서 투자 대상을 조율하기도 했다. 정부는 다음 달 투자협력위원회를 열어 그간 성과를 발표할 예정이다. 정부 관계자는 “투자할 만한 대상을 적극적으로UAE측에 알려준다는 방침”이라며 “투자 판단은UAE측에서 진행할 것”이라고 말했다."
2023-12-27,"하림 “HMM 보유 현금 10조, 배당에 안 쓸 것”","국내 최대 컨테이너 해운사HMM의 인수 우선협상대상자로 선정된 하림그룹이HMM의 현금 유보금(이익잉여금)을 글로벌 경쟁력 강화에 쓰겠다는 입장문을 26일 발표했다. 최근HMM해원연합노조(선원노조)를 중심으로 하림의 재무 안전성에 의문을 제기하는 목소리가 커지자 반박에 나선 것이다.이날 하림그룹은 입장문에서 “HMM이 보유한 현금 자산은 현재 진행형인 해운 불황에 대응하고 미래 경쟁력을 위해 사용해야 한다는 게 그룹의 확고한 생각”이라고 강조했다. 하림은 또 “불황이 예견되는 상황에서HMM의 경쟁력을 키우기 위해서는 기본적으로 배당은 최소화하는 것이 바람직할 것”이라며 “과거 팬오션의 경쟁력 제고를 위해 인수합병(M&A) 이후 5년 동안 배당을 하지 않은 전례가 있다”고 설명했다. 앞서 지난 22일HMM노조는 하림그룹이 인수할 경우 10조원에 달하는HMM의 유보금을 하림이 배당 자원으로 쓸 가능성을 차단해야 한다고 주장했다.지난 2015년 인수한 벌크선사 팬오션과HMM의 합병설도 적극 부인했다. 하림은 “팬오션과HMM의 합병, 또는 사업구조의 인위적인 조정은 없을 것”이라고 설명했다.하림그룹이 6조4000억원 규모의HMM인수전에 참여할 당시부터 그룹의 재무적 여력에 대해선 여러 우려가 나왔다. 인수 파트너인JKL파트너스와 인수금융 등을 제외하고도 하림 자체적으로 2조4000억원가량을 마련해야 한다. 그러나 지난 9월 공시 기준 하림지주가 보유한 현금성 자산은 662억원에 그친다. 하림은 팬오션 유상 증자 등을 통해 추가로 자금을 확보하겠다는 계획이다.현재 하림은 사업비 6조8000억원에 달하는 서울 서초구 양재동 물류단지 개발 사업도 추진하고 있다. 이날 서울시 물류단지계획심의위원회는 양재 도시첨단물류단지 개발사업에 대한 통합심의를 진행했다. 지난해 11월 하림지주의 자회사인 하림산업이 양재동 옛 화물터미널 일대 8만6000㎡ 부지에 지하 8층, 지상 최대 58층 규모의 물류 및 주거시설 등을 개발하는 내용의 사업 계획을 신청한 데 따른 것이다. 계획안은 이날 통합심의에서 조건부로 통과됐다. 이에따라 내년 1월쯤 물류단지 지정 승인 고시가 날 전망이다.결국 하림은HMM인수와 서울 물류단지 건설에 13조원 이상을 투입해야 하는 상황이다. 한종길 성결대 글로벌물류학과 교수는 “HMM에 수조 원을 투입해 경쟁력을 키워야 하는 상황이라 하림의 인수에 우려가 나오는 것”이라고 말했다. 하림그룹은 이에 대해 “양재동 물류단지와HMM인수는 별개 사업”이라고 강조했다."
2023-12-26,"하림 ""HMM의 10조원, 해운업에만 쓰겠다"" 먹튀 우려 해명","지난해 1월 6800TEU급 컨테이너선 ‘HMM홍콩호’가 광양항에서 국내 수출 기업의 화물을 싣고 있는 모습. 사진HMM국내 최대 컨테이너 해운사HMM의 인수 우선협상대상자로 선정된 하림그룹은HMM의 현금 유보금(이익잉여금)을 글로벌 경쟁력 강화에 쓰겠다는 입장문을 26일 발표했다. 최근HMM해원연합노조(선원노조)를 중심으로 하림의 재무 안전성에 의문을 제기하는 목소리가 커지자 반박에 나선 것이다.이날 하림그룹은 입장문에서 “HMM이 보유한 현금 자산은 현재 진행형인 해운 불황에 대응하고 미래 경쟁력을 위해 사용해야 한다는 게 그룹의 확고한 생각”이라며 “MSC‧머스크 등 글로벌 해운사들은 막대한 현금을 보유하고 해운 불황에 대비하고 있다”고 강조했다. 하림은 또 “불황이 예견되는 상황에서HMM의 경쟁력을 키우기 위해서는 기본적으로 배당은 최소화하는 것이 바람직할 것”이라며 “과거 팬오션의 경쟁력 제고를 위해 인수합병(M&A) 이후 5년 동안 배당을 하지 않은 전례가 있다”고 설명했다.앞서 지난 22일HMM노조는 하림그룹이 인수할 경우 10조원에 달하는HMM의 유보금을 하림이 배당 자원으로 쓸 가능성을 차단해야 한다고 주장했다.하림은 지난 2015년 인수한 벌크선사 팬오션과HMM의 합병설도 적극 부인했다 “팬오션과HMM의 합병, 또는 사업구조의 인위적인 조정은 없을 것”이라며 “(그룹의) 계열사가 된 많은 회사가 이전 회사명‧브랜드‧제품 등을 유지하고 있다”고 설명했다. 이어서 “팬오션과HMM도 독립 경영과 선의의 경쟁을 촉진한다는 원칙 아래 각사의 전통과 문화가 유지되도록 할 것”이라고 밝혔다.HMM해원노조원들이 하림그룹의 인수를 반대하는 내용을 담은 현수막을 배 위에서 펼치고 있다. 사진HMM해원노조하림그룹이 6조 4000억원 규모의HMM인수전에 참여할 당시부터 그룹의 재무적 여력에 대해선 여러 우려가 나왔다. 증권가에 따르면 인수 파트너인JKL파트너스와 인수금융 등을 통해 자금을 조달한다해도 하림 자체적으로 2조4000억원 가량을 마련해야 한다. 그러나 지난 9월 공시 기준 하림지주가 보유한 현금성 자산은 662억원에 그친다. 하림은 팬오션 유상 증자 등을 통해 추가로 자금을 확보하겠다는 계획이다.현재 하림은 사업비 6조8000억원에 달하는 서울 서초구 양재동 물류단지 개발 사업도 추진하고 있다. 이날 서울시 물류단지계획심의위원회는 양재 도시첨단물류단지 개발사업에 대한 통합심의를 진행했다. 지난해 11월 하림지주의 자회사인 하림산업이 양재동 옛 화물터미널 부지인 225번지 일대에 도시첨단물류단지를 개발하는 내용의 사업 계획을 신청한 데 따른 것이다. 하림그룹은 2016년 양재동 화물터미널 부지를 4525억원에 매입했다.하림산업의 사업 계획안에 따르면 양재동 도시첨단물류단지엔 8만6000㎡ 부지에 지하 8층, 지상 최대 58층 규모의 물류 및 주거시설 등이 설계됐다. 지하에는 물류 시설을 두고, 지상에는 마트 같은 판매 시설을 비롯해 오피스텔(49층)과 아파트(58층)를 짓겠다는 계획이다. 계획안이 이날 통합심의에서 조건부로 통과될 경우 조건에 따른 이행계획을 마련하는 절차를 거쳐 1∼2개월 뒤에 물류단지 지정 승인 고시가 난다.결국 하림은HMM인수와 서울 물류단지 건설에 13조원 이상을 투입해야 하는 상황이다. 한종길 성결대 글로벌물류학과 교수는 “1980년 이후 컨테이너 선사는 다른 업종 기업이 인수해 성공한 사례가 세계적으로 드물다”며 “세계 점유율 3%에 그치는HMM에 수조원을 투입해 경쟁력을 키워야 하는 상황이라 하림의 인수에 우려가 나오는 것”이라고 말했다. 하림그룹은 이에 대해 “물류 단지의 경우 위치가 좋아 사업성이 우수하기 때문에 투자 유치에 문제가 없다”며 “양재동 물류단지와HMM인수는 별개 사업”이라고 강조했다.지난 11월 서울 강남구CGV청담씨네시티에서 열린 '푸디버디' 브랜드 론칭 행사에서 김홍국 하림그룹 회장이 인터뷰를 하고 있다. 연합뉴스"
2023-05-02,개미들 위험한 ‘하따’…SG발 하한가종목 3000억 매수행렬,"전문가의 경고도 소용없었다. 지난달 24일부터SG(소시에테제네랄)증권 창구 등을 통해 쏟아진 매물 폭탄으로 무더기 하한가 사태가 벌어졌지만 개인투자자들은 이들 종목을 줍고 또 주웠다. 이른바 ‘하따’(하한가 따라잡기) 투자다.그래픽=김주원 기자zoom@joongang.co.kr1일 한국거래소에 따르면 개인투자자는 지난달 24~28일 코스피·코스닥 시장에서 무더기 하한가 사태가 빚어진 8개 종목(삼천리·다우데이터·하림지주·대성홀딩스·세방·선광·서울가스·다올투자증권) 중 다올투자증권을 제외한 7개 종목을 집중 매수했다. 이들 7개 종목의 순매수액은 2959억원에 달한다.지난달 24~28일 코스피·코스닥 시장의 개인 순매수 종목을 집계한 결과 무더기 하한가 종목 중 삼천리는 8위(771억8100만원)를 차지했다. 이어 다우데이타(597억7100만원·14위), 하림지주(438억8100만원·16위), 서울가스(307억6500만원·19위) 등이 상위권에 포진했다. 대성홀딩스(21위)와 세방(23위), 선광(24위) 등 7개 종목 모두 개인 순매수 25위권 안에 들었다.지난달 28일 개인투자자는 해당 종목을 ‘폭풍 매수’했다. 하한가 행진이 그치고 주가가 반등한 영향이다. 이날 개인은 4거래일 연속 하한가를 기록한 뒤 주가가 반등한 대성홀딩스(247억원)와 선광(240억원)을 가장 많이 사들였다. 코스피·코스닥 시장을 통틀어 10위(대성홀딩스)·11위(선광)에 달하는 규모다. 3거래일 연속 하한가로 직행했다가 4거래일 만에 하한가를 간신히 면했던 삼천리에는 이날 하루 224억원의 자금이 몰리며 순매수 13위를 기록했다.주가 하락 폭이 클수록 순매수액 규모도 컸다. 지난 24일부터 4거래일 연속 하한가 행진을 이어간 지난 27일까지 대성홀딩스(-75.9%)와 선광(-75.9%), 삼천리(-75%)의 주가는 급락했다. 반면에 지난 28일 개인이 순매도한 다올투자증권은 같은 기간 주가가 41.7% 떨어진 데 그쳤다.개인투자자의 매수세에 지난달 28일 7개 종목의 주가는 반등에 성공했다. 삼천리는 이날 22.9% 뛰었고, 서울가스(13.5%)와 세방(11.1%), 대성홀딩스(8.8%) 등도 큰 폭의 상승세를 기록했다.개인투자자가 무더기 하한가 종목의 집중 매수에 나선 건 기술적 반등을 노린 단기 투자라는 게 시장의 분석이다. 박소연 신영증권 투자전략부장은 “낙폭 과대 종목에 대한 단기 트레이딩 매수세로 판단된다”고 봤다. 하한가가 여러 번 나온 만큼 이젠 오를 것이란 막연한 기대감에 기댄 ‘하따’ 전략이다.황세운 자본시장연구원 선임연구위원은 “(무더기 하한가를 맞은 종목들은) 재무제표상 지난해 영업이익이 큰 폭으로 개선되지 않았는데도 지난 1년간 주가가 이상 급등했고, 증권가에서도 이상 급등 의견을 제시해 왔다”고 말했다.실제로 이들 종목에 대한 시장의 경고도 있었지만 개인투자자에겐 유명무실했던 것으로 나타났다. 유진투자증권은 지난해 5월 삼천리에 대한 투자 의견을 ‘중립’,목표 주가를 11만원으로 유지하다 지난해 11월엔 목표 주가를 유지하면서도 투자 의견을 ‘비중 축소’로 전환했다. 사실상 ‘매도’ 의견을 낸 셈이었다.최유준 신한투자증권 연구원은 “그동안 연이은 하락으로 기존 투자자들이 처분하지 못한 물량이 쏟아져 나올 가능성이 높은 만큼 투자에 유의해야 한다”고 경고했다."
2023-05-01,전문가 경고 들은척도 안했다…3000억 줍줍 '하따' 나선 개미들,"전문가의 경고도 소용없었다. 지난달 24일부터SG(소시에테제네랄)증권 창구 등을 통해 쏟아진 매물 폭탄으로 무더기 하한가 사태가 벌어졌지만, 개인투자자들은 이들 종목을 줍고 또 주웠다. 이른바 '하따(하한가 따라잡기)' 투자에 나선 것이다.28일 코스피ㆍ코스닥 지수. [연합뉴스]1일 한국거래소에 따르면 개인투자자는 지난달 24~28일 코스피·코스닥 시장에서 무더기 하한가 사태가 빚어진 8개 종목(삼천리·다우데이터·하림지주·대성홀딩스·세방·선광·서울가스·다올투자증권) 중 다올투자증권을 제외한 7개 종목을 집중 매수했다. 이들 7개 종목의 순매수액은 2959억원에 달한다.━지난주 개인, 2959억원어치 '하따'지난달 24~28일 코스피·코스닥 시장의 개인 순매수 종목을 집계한 결과 무더기 하한가 종목 중 삼천리는 8위(771억8100만원)를 차지했다. 이어 다우데이타(597억7100만원·14위), 하림지주(438억8100만원·16위), 서울가스(307억6500만원·19위) 등이 상위권에 포진했다. 대성홀딩스(21위)와 세방(23위), 선광(24위) 등 7개 종목 모두 개인 순매수 25위권 안에 들었다.그래픽=김주원 기자zoom@joongang.co.kr지난 28일 개인투자자는 해당 종목을 '폭풍 매수'했다. 하한가 행진이 그치고 주가가 반등한 영향이다. 이날 개인은 4거래일 연속 하한가를 기록한 뒤 주가가 반등한 대성홀딩스(247억원)와 선광(240억원)을 가장 많이 사들였다. 코스피·코스닥 시장을 통틀어 10위(대성홀딩스)·11위(선광)에 달하는 규모다. 3거래일 연속 하한가로 직행했다가 4거래일 만에 하한가를 간신히 면했던 삼천리에는 이날 하루 224억원의 자금이 몰리며 순매수 13위를 기록했다.주가 하락 폭이 클수록 순매수액 규모도 컸다. 지난 24일부터 4거래일 연속 하한가 행진을 이어간 지난 27일까지 대성홀딩스(-75.9%)와 선광(-75.9%), 삼천리(-75%)의 주가는 급락했다. 반면 지난 28일 개인이 순매도한 다올투자증권은 같은 기간 주가가 41.7% 떨어진 데 그쳤다.개인 투자자의 매수세에 지난 28일 7개 종목의 주가는 반등에 성공했다. 삼천리는 이날 22.9% 뛰었고, 서울가스(13.5%)와 세방(11.1%), 대성홀딩스(8.8%) 등도 큰 폭의 상승세를 기록했다.개인투자자가 무더기 하한가 종목의 집중 매수에 나선 건 기술적 반등을 노린 단기 투자라는 게 시장의 분석이다. 박소연 신영증권 투자전략부장은 ""낙폭과대 종목에 대한 단기 트레이딩 매수세로 판단된다""고 말했다. 하한가가 여러번 나온 만큼 이젠 오를 것이란 막연한 기대감에 기댄 '하따' 전략인 셈이다.황세운 자본시장연구원 선임연구위원은 ""(무더기 하한가를 맞은 종목들은) 재무제표상 지난해 영업이익이 큰 폭으로 개선되지 않았는데도 지난 1년간 주가가 이상 급등했고, 증권가에서도 이상 급등 의견을 제시해 왔다""며 ""최근 하한가 사태에도 기업의 적정 내재가치에 대한 고민 없이 섣불리 투자에 나서는 건 우려스럽다""고 말했다.━전문가 경고 무시, '학습효과' 부재실제로 이들 종목에 대한 시장의 경고도 있었지만, 개인투자자에겐 유명무실했던 것으로 나타났다.유진투자증권은 지난해 5월 삼천리에 대한 투자 의견을 '중립',목표 주가를 11만원으로 유지하다 지난해 11월엔 목표 주가를 유지하면서도 투자 의견을 '비중 축소'로 전환했다. 좀처럼 매도 의견을 내지 않는 증권가의 관행을 고려하면 사실상 '매도' 의견을 낸 셈이었다.나민식SK증권 연구원도 지난해 11월 삼천리에 대해 ""다소 과열된 주가 수준이라고 판단한다""는 내용의 리포트를 냈다.삼천리 주가━""추가 하락 가능성 커 매수 유의해야""개인이 무더기 하한가 종목의 '하따'에 나서며 매수를 이어가고 있지만 전문가들은 추가 하락 여지가 있는 만큼 섣부른 매수는 주의해야 한다고 경고하고 있다.개인의 매수가 몰린 7개 종목의 경우 여전히 신용융자잔고 비율이 높아 언제든 반대매매로 주가가 추가 하락할 가능성이 크기 때문이다. 지난달 28일 기준 세방의 신용융자잔고 비율은 12%에 달했다. 선광(11%)과 다우데이타(10.6%)의 신용융자잔고 비율도 10%를 웃돈다.그래픽=신재민 기자shin.jaemin@joongang.co.kr황 선임연구위원은 ""하한가를 여러 번 맞았기 때문에 마치 저평가된 종목처럼 보일 수 있지만 현재의 주가는 그동안의 버블(거품)이 꺼진 것으로 봐야 한다""며 ""1년 전과 비교하면 여전히 주가가 높은 수준으로 현재 가격보다 낮은 수준에서 안정화할 가능성이 높다""고 말했다.최유준 신한투자증권 연구원은 ""그동안 연이은 하락으로 기존 투자자들이 처분하지 못한 물량이 쏟아져 나올 가능성이 높다""며 ""물량 압박으로 인해 장중 변동성이 높아질 수 있는 만큼 투자에 유의해야 한다""고 말했다."
