date,title,content
2022-09-12,거품 우려에도 0.5초만에 완판…유통·광고업계 NFT 뜨겁다,"NFT이미지. 셔터스톡유통·광고 업계에서 대체불가능토큰(NFT·Non-FungibleToken)이 뜨거운 마케팅 화두다. 블록체인 기술 기반의 디지털 자산인NFT는 올 들어 가격이 급락하고 거래량이 줄어들며 일각에선 거품론이 제기됐으나, 국내 유통·광고 기업은 멤버십 연계 등 다양한 시도를 이어가며 주목받고 있다.━유통기업 캐릭터NFT완판 행진12일 업계에 따르면 유통 기업들이 내놓는NFT가 완판 사례를 이어가고 있다. 롯데홈쇼핑은 자체 캐릭터 ‘벨리곰’ 지적재산권(IP)에 멤버십 혜택을 연계한NFT를 지난달 17~18일 판매해 9500개 전량이 모두 팔렸다. 특히 지난달 18일엔 오픈과 동시에 0.5초 만에 완판됐다. 당일NFT거래소 ‘오픈씨’에서 암호화폐 ‘클레이튼’ 계열 중 거래 금액 국내 1위, 글로벌 16위를 차지했다.롯데홈쇼핑의 자체 캐릭터 ‘벨리곰’IP에 멤버십 혜택을 연계한NFT가 지난달 오픈 즉시 완판을 기록했다. 사진 롯데홈쇼핑롯데홈쇼핑 측은 “MZ세대(1980년대 초∼2000년대 초 출생)들이NFT에 대한 관심이 높은데 벨리곰 팬덤은 120만 명의 소셜미디어(SNS) 구독자를 보유한 데다 그룹 계열사의 실용적인 혜택도 있어 호응을 얻은 것”이라고 분석했다.NFT등급은 6단계로 나눴다. 최상위 등급인 ‘벨리’ 홀더에게는 롯데 시그니엘 숙박권 등이 제공된다.━NFT커뮤니티 채널에도 9만명 모여신세계도 지난 6월 신세계백화점 자체 캐릭터인 ‘푸빌라’를NFT로 제작해 1초 만에 1만 개 완판 기록을 세웠다. 이NFT도 6가지 등급에 따라 신세계백화점 라운지 입장 등의 혜택을 제공한다.NFT커뮤니티 ‘디스코드’  푸빌라 채널에는 9만 명이 모였다.푸빌라NFT.사진 신세계백화점신세계는 지난 7월엔 부산 센텀시티점에서 업계 최초로NFT페스티벌을 선보였다. 앞서 한글과컴퓨터와 오프라인 연계NFT상품 등을 개발하겠다는 협약도 맺었다. 신세계 측은 “온·오프라인 통합 백화점으로 ‘디지털 신세계’를 선보일 예정”이라고 밝혔다.이마트도NFT플랫폼 사업 구축을 준비 중인 ‘라인 넥스트’에 투자하기로 결정했다. 이마트뿐 아니라CJENM등 10개사가 전략적 투자자로 참여한다. 이마트 관계자는 “급성장하는NFT시장에서 새로운 기회를 창출하기 위해 파트너사로 참여하기로 했다”고 설명했다.갤러리아백화점이 지난 2일 발행한NFT150개도 1분 만에 완판됐다. 생명 존중 캠페인 ‘라잇! 라이프(Right!LIFE)’ 프로젝트의 일환으로, 수익금 전액은 동물 복지 기부금으로 쓰인다. 갤러리아 관계자는 “새로운 방식을 모색한 커뮤니케이션 채널”이라고 했다.갤러리아백화점이 생명존중 캠페인 ‘라잇! 라이프(Right!LIFE)’ 프로젝트의 일환으로 지난 2일 발행한NFT작품. 사진 갤러리아백화점━광고 회사가NFT모바일 상품권 출시광고 회사들도NFT사업에 잇따라 뛰어들고 있다. 삼성그룹 광고 계열사 제일기획은 두나무 자회사의 해외NFT거래소 ‘사이펄리’와 브랜드NFT사업 업무협약을 지난달 맺었다. 제일기획은 광고주 브랜드의NFT를 기획·제작하고, 사이펄리는 해당NFT를 자체 플랫폼에 맞춰 개발·운영한다.제일기획, 사이펄리 로고(왼쪽)와 사이펄리에서 제공하는NFT패키징 이미지. 사진 제일기획롯데그룹 계열 대홍기획은NFT에 기반한 모바일 상품권을 지난달 출시했다. 소유자만이 모바일 상품권 바코드를 확인할 수 있고, 사용 시 자동으로 바코드가 가려져 상품권 사용 여부를 직관적으로 확인할 수 있게 했다. 대홍기획은 티켓과 멤버십, 구독권, 명품 인증 분야에서도NFT프로젝트를 진행할 계획이다.대홍기획NFT모바일 상품권(사용 전후). 사진 대홍기획━“추종하는 커뮤니티가 중요”특히 대홍기획은 지난 5일 발간한 리포트 ‘커뮤니티 기반 비즈니스의 태동’에서 “2022년 마케팅 씬의 화두는 단연NFT”라고 진단했다.보고서는 2006년 잭 도시가 트위터 오픈 후 올렸던 최초의 트윗NFT와, 스포츠브랜드 아디다스가NFT프로젝트 업체 ‘지루한 원숭이들의 요트 클럽(BAYC,BoredApeYachtClub)’의 원숭이 캐릭터에 아디다스 트레이닝 복을 입힌NFT도 비교했다.트위터의 창업자 잭 도시가 처음으로 올린 트윗. 이미지 출처: 트위터아디다스가BAYC와 협업해 발매한NFT.사진 오픈시그러면서 최초의 트윗NFT가치가 35억원이었다가 1000만원 이하로 추락한 반면 아디다스 원숭이NFT는 300억원 매출을 올린 차이에 대해 “추종하는 커뮤니티의 유무”라고 꼬집었다. “NFT가치 형성의 핵심은 가치를 인정하는 사람들의 무리인 커뮤니티의 존재와, 가치를 인정하게 만드는 이유인 서사의 매력이 관건”이라는 분석이다.마케팅은 결국 브랜드를 선택하게 만들기 위한 일인데, 브랜드의 지속 성장을 위해서는 고객과 끈끈한 관계를 구축해야 하기에 브랜드 커뮤니티와 팬덤 구축에 도움이 되는NFT비즈니스를 창출하고 있다는 얘기다.전세계NFT시장 성장세 그래픽 이미지. [자료제공=스카이퀘스트]광고 업계가NFT에 주목할 수밖에 없는 실질적인 이유도 있다. 한 광고업계 관계자는 “NFT,메타버스 등으로 소비자 트렌드가 변화하면서 클라이언트(광고주)들이 관심을 보이고 마케팅 니즈가 높아져 광고회사들도 이를 새로운 사업 기회로 보고 있다”고 말했다."
2022-04-22,美 이어 웹젠·삼성도 임협 난항…“노사 문제 지나가는 소나기 아냐”,"미국 뉴욕 맨해튼의 애플 스토어 그랜드센트럴역점에서 쇼핑하는 사람들. [AFP=연합뉴스]최근 팬데믹 여파,MZ세대의 대거 등장 등이 임금 경쟁과 맞물려 국내·외 정보기술(IT) 업계를 중심으로 노동조합의 존재감이 커지고 있다. 전문가는 이런 움직임이 단기에 끝나지 않을 것이라며 기업의 적극적 대응을 강조했다.지난 20일(현지시간)AFP통신 등 외신은 미국 애틀랜타 북서부 킴벌랜드몰에 있는 애플 매장 직원들이 미국노동관계위원회에 노조 설립을 위한 찬반 투표 시행서를 제출했다고 보도했다. 위원회는 노조 설립 조건인 근로자의 30% 이상 찬성 여부를 검토한다. 애플 직원들을 지원하는 미국통신노조에 따르면 매장 직원의 70% 이상이 노조 결성에 찬성했다. 이번에 노조가 결성되면 애플 매장에서 첫 노조가 나오는 셈이다.━애플, 노조 설립 추진 본격화미국 뉴욕시 그랜드센트럴역에 있는 애플 매장 직원들 역시 노조 설립을 추진하고 있다. 이들 직원이 모인 ‘과일 가판대 노동자연합(FSWU)’은 “팬데믹과 이례적 고물가 시대 생활 수준을 유지하기 위해서”라고 이유를 밝혔다. 이들은 모든 근로자의 시급을 최소 30달러(약 3만7000원)로 인상해 달라고 사측에 요구했다. 워싱턴포스트에 따르면 애플은 현재 시간당 17~30달러 달러를 지급한다.노조 목소리 높이는 국내외IT기업. 그래픽=김영옥 기자yesok@joongang.co.kr세계 최대 전자상거래 업체 아마존에서도 노조 설립 움직임이 확산하고 있다. 지난 1일 뉴욕 스태튼아일랜드의 물류창고에서 노조 결성 찬반 투표가 통과되면서 처음으로 노조가 설립된 데 이어 앨라배마주 매서머, 뉴저지주 베이온 등의 물류창고에서도 투표가 추진되고 있다.지난해IT업계에서 노조 설립이 활발하게 이뤄진 한국에서도 노조의 목소리가 높아지는 모습이다.게임업체 웹젠의 노조(전국화학섬유식품산업노동조합 웹젠지회)는 지난 18일 다음 달 2일부터 파업을 시작하겠다고 밝혔다. 예정대로 실행되면 국내 게임업계 첫 파업이다.━게임사 웹젠, 업계 첫 파업 예고웹젠 노조는 올해 임금 교섭에서 사측에 직원 연봉 일괄 1000만원 인상, 팀장급 이하 인센티브 총액 공개를 요구하고 있다. 사측은 별도의 교섭 없이 임금 평균 10% 인상안을 제시했다. 이후 노조가 평균 16% 인상과 일시금 200만원 지급을 타협안으로 제시했지만 사측은 기존 안에 평가 B 이상 200만원 지급을 추가하는 안을 내놔 협상이 이뤄지지 않았다.노조 설립 투표를 위해 줄서 있는 미국 뉴욕 스태튼아일랜드의 아마존 직원들 [로이터=연합뉴스]노조 측은 “단순히 처우에 불만을 품어 일어난 이슈가 아니라 폭발적 성공을 보여준 게임업계에서 깜깜이 연봉 협상의 문제를 해결하겠다는 것”이라며 “웹젠 연봉이 7000만원 수준으로 알려졌지만 실제 평균 연봉은 5000만원이 되지 않는다”고 주장했다.삼성전자는 노조와 급여 체계 개편, 유급휴가 추가 등을 두고 교섭 중이지만 합의점을 찾지 못하고 있다. 매년 해온 노사협의회와의 임금 교섭 역시 난항이다. 임금 인상률 결정은 통상 매년 3월 중 마무리됐지만 올해 처음으로 4월로 미뤄졌다. 협의회 근로자위원은 두 자릿수 인상률을 요구한 반면 사측은 기본인상률 4%를 제안한 것으로 알려졌다.━관리 부재·MZ세대 등 배경으로 꼽혀노조 무풍지대로 불리던IT업계에서 노조 문제가 화두로 떠오른 것은 4~5년 전부터다. 네이버와 카카오에 처음 노조가 만들어진 게 2018년이다. 지난해 보상 체계에 대한 목소리가 커지면서LG전자에 사무직 노조가 새로 설립됐으며 한글과컴퓨터는 17년 만에 노조를 부활시켰다. 카카오뱅크에서도 노조가 결성됐다.게임업계 최초로 파업을 결의한 웹젠 노조 노영호 지회장이 지난 18일 오전 경기도 성남시 웹젠 본사 앞에서 '김태영 대표이사 대화 촉구 및 쟁의행위 예고 기자회견'을 하며 참석자들과 구호를 외치고 있다. [연합뉴스]김동원 고려대 경영학과 교수는 최근의 움직임을 두 갈래로 분석했다. 그는 “빅테크 기업이 몸집은 급격히 커졌지만 노무 문제를 다루는 시스템이 없어 관리가 성장을 따라가지 못한 것”이라며 “삼성·LG같은 기존 대기업에서는MZ세대가 대거 등장하면서 이슈가 불거졌다. 이들은 노동 운동에 큰 신념이 있다기보다 불공정하다고 생각하는 문제 해결에 나선 것”이라고 진단했다.이어 “최근 몇 년 사이IT산업이 주목받고 인력이 모인 것도 노사 이슈가 불거진 요인”이라며 “앞으로도 돈이 돌고 규모가 커질 분야라 지나가는 소나기는 아닐 것이다. 기업들이 노동 관련 부서를 키우고, 전문적으로 대응할 수 있게 투자해야 한다”고 덧붙였다. 노조에 대해서는 “임금 인상 등에서 너무 경쟁적이 되면 부메랑으로 돌아올 수 있다는 생각을 해야 한다”고 말했다."
2022-03-29,"2022 대한민국브랜드스타에 딤채, 삼성서울병원, 제주삼다수…위기에 또 강했다","에스원, 자이 등 각 부문 1위 선정기업 마케팅의 핵심...브랜드가치 제고신종 코로나바이러스 감염증(코로나19) 확산이나 우크라이나 전쟁과 같은 대형악재에도 딤채, 삼성서울병원, 제주삼다수 등 브랜드 강자의 입지는 흔들리지 않았다. 브랜드가치 평가회사인 브랜드스탁은 28일 국내 산업 부문별 브랜드가치 1위를 선정한 ‘2022 대한민국 브랜드스타’를 발표했다. 이번 조사는 브랜드스탁 브랜드증권시장에 상장된 총 230여개 품목의 1000여개 브랜드를 대상으로 이뤄졌다. 조사 기간은 1월 3일∼2월 28일이었다.김치냉장고 부문에서 1위를 차지한 위니아는 1995년 김치냉장고 딤채를 출시한 이후 김치냉장고라는 새로운 카테고리를 탄생시킨 지금까지 시장을 선도하며 김치냉장고 대명사로 불리고 있다. 김치냉장고 본연의 기술력과 함께 변화하는 트렌드를 반영하고자 하는 노력이 주목받고 있다.삼성서울병원은 미래의학 연구로 한국 의료계 발전방향을 제시하고 있다. [사진 삼성서울병원]종합병원 1위인 삼성서울병원은 ‘환자중심’ ‘고객만족’ 슬로건을 앞세우고 개원 이후 줄곧 국내 의료계 패러다임을 전환해 왔다.  ‘미래 의료의 중심SMC’라는 비전을 가지고 중증고난도환자를 맞춤 치료해 최고의 치료성과를 구현하는 병원이 되겠다는 각오다.제주삼다수는 제주의 청정 지하수를 원수로 하여 안전하고 깨끗한 제조 공정으로 수원지 환경 보전과 수질 관리에 노력하고 있다. 업계 최초 ‘먹는 물 수질검사기관’으로 지정되어 품질에 대한 공신력까지 확보했다.온ㆍ오프라인을 넘나들며 대한민국 트렌드를 선도하는 테마파크[사진 롯데월드 어드벤처]KB국민은행, 여명808, 롯데월드 어드벤처, 강북삼성병원, 한양사이버대학교, 코웨이 등도 경쟁 브랜드들을 압도하며 부문 1위를 유지했다. 위니아 에어워셔 가습기, 위니아 냉장고, 바디프랜드, 라클라우드, 노스페이스,BBQ치킨,KB국민카드, 서귀포잠수함, 넷마블, 에스원 등도 각 부문 1위 브랜드의 위치를 지켰다. 에스원은 40여년 간 기술 개발과 전문 인력 육성을 통해 개인은 물론 기업·공공기관에 보안, 건물관리,SI솔루션 등의 서비스를 제공하며 업계를 선도하고 있다.AI기술을 적용한 에스원의 무인 매장 솔루션이 인기를 얻고 있다. [사진 에스원]이밖에 피죤, 한글과컴퓨터, 자이, 쏠라이트배터리, 스타벅스, 위니아 세탁기, 위니아 전자레인지, E1, 오뚜기 카레 등이 부문 1위에 선정됐다. 아파트 부문 1위에 선정된GS건설의 자이는 새로운 형식의 주거 공간을 제안하고 수준 높은 문화를 선보이며 주거 브랜드를 넘어서는 라이프스타일 브랜드를 지향해 시장을 주도해 나가고 있다.새로운 시도로 건설업계 선도하는GS건설 ‘자이’ . [사진GS건설]브랜드스탁은 “기업 마케팅 전략의 핵심은 브랜드가치 제고이기 때문에 강력한 브랜드의 구축이 더욱 필요하다”며 “이를 통해 급변하는 시장에서도 지배자의 위치를 공고히 해 갈 수 있을 것”이라고 밝혔다.어떻게 선정했나대한민국 브랜드스타는 국내 산업 주요 부문별 브랜드가치 1위를 선정, 발표하는 브랜드 가치평가 인증제도다. 브랜드스탁의 브랜드가치 평가모델인BSTI(BrandStockTopIndex)를 바탕으로 선정됐다.BSTI는 대한민국의 각 부문별 대표 브랜드 1000여 개를 대상으로 브랜드스탁 증권거래소의 모의주식 거래를 통해 형성된 브랜드주가지수(70%)와 소비자조사지수(30%)를 결합한 브랜드가치 평가모델이며 1000점 만점이다.BSTI는 브랜드가치 평가모델로는 유일하게BM특허를 획득했다. 소비자조사지수는 브랜드스탁의 패널 회원 3만명을 대상으로 실시되는 소비자조사의 결과다. 각 브랜드에 대한 인지, 호감, 신뢰, 만족, 구매의도 등 5개 항목에 대해 응답한 결과를 바탕으로 항목별 가중치를 부여해 측정했다."
2022-02-28,빈소에선 목례만…부의금 대신 남기고 싶은 말 기록,"고 이어령 선생 빈소가 차려진 서울대병원 장례식장은 27일 생전 고인과 인연을 맺은 사람들의 발길이 이어졌다. 유족 측은 “당초 가족장으로 치르려다 문화체육관광부장(葬)으로 변경되고 빈소가 커지면서 밀려오는 화환이 걷잡을 수 없을 정도”라고 했다. 전날 문재인 대통령, 이재명 민주당 대선후보, 소리꾼 장사익, 88올림픽 ‘굴렁쇠 소년’ 배우 윤태웅 등이 빈소를 찾은 데 이어 이날 김부겸 총리, 정재승KAIST교수, 김덕수 사물놀이 명인, 나태주 시인 등이 문상했다. 오세훈 서울시장, 최재형 전 감사원장, 김현모 문화재청장도 빈소를 찾았다.이찬진 전 한글과컴퓨터 대표와 부인인 배우 김희애씨는 조문을 마친 후 고인의 부인인 강인숙 영인문학관장과 손을 붙들고 한동안 소리를 낮춰 이야기하며 눈물을 훔쳤다. 소설가 김홍신씨는 “선생님의 건강을 기원하며 108배 하겠다는 문자를 지인들에게 보내겠다고 선생님께 최근 문자를 드렸더니, 선생님의 답이 ‘나도’였다. 짧고 재치를 담은 건데, 웃기면서도 눈물이 나는 그 한마디가 오래 맴돌 것 같다”고 말했다.한편 교보문고에 따르면 별세 소식 이후 『이어령의 마지막 수업』(열림원) 등 고인과 관련된 서적의 판매량이 26일 하루 평소 주말보다 2.5배가량 많이 팔렸다."
2023-07-10,한컴 ‘아래아한글’도 액티브X 지원 종료,"12월31일 한글OCX공급·지원 중단23년만…고객 기술지원 핫라인 개설한글과컴퓨터 로고. 한글과컴퓨터 제공한글과컴퓨터(이하 한컴)가 아래아한글(이하 한글)의 액티브엑스(X) 지원을 올 연말 중단한다. 2000년 한글에 액티브엑스 지원 기능을 더한 지 23년 만이다.한컴은 액티브에스 지원을 위해 한글에서 제공해온 ‘한글OCX(OLECustomeXtension·OLE는ObjectLinkingandEmbedding약자) 컨트롤’의 공급과 기술지원을 12월31일자로 종료한다고 10일 공지했다.한글 오이엑스 컨트롤은 액티브엑스 기술을 지원하는 웹 서비스에서 한글 문서를 열람·편집·인쇄할 수 있게 해주는 기능이다. 한컴은 “웹 표준화 기술로 전환하기 위해, 2000년 한글 오시엑스 기술을 공개한 지 23년 만에 기술 지원 종료를 결정했다. 내년 1월1일부터는 한글 오시엑스 컨트롤을 제공하지 않으며, 기존에 공급된 한글 오시엑스 컨트롤도 동작하지 않게 된다”고 설명했다.액티브엑스란 마이크로소프트(MS) 웹브라우저 ‘인터넷익스플로러(IE)’에서 웹 서비스를 이용하는 데 필요한 응용 프로그램을 개인용컴퓨터(PC)에 설치해주는 기술을 말한다. 윈도 운영체제(OS)에 종속된 인터넷익스플로러에서만 실행되고 다른 웹브라우저에서는 사용할 수 없는 비표준 웹 기술인데다 액티브엑스 설치 과정에서 피시를 악성코드나 바이러스에 노출시키는 등 보안 취약 문제도 발견돼, 엠에스조차도 기술지원을 종료했다.우리나라도 2018년부터 공공기관 누리집에서 액티브엑스를 단계적으로 제거하고 있으며, 금융권과 민간 사업자들도 에이치엠엘(HTML)5 기반의 시스템으로 바꾸는 등 표준 웹 기술로의 전환을 가속화하고 있다.한컴은 “한글 오시엑스를 중단해도 일반 이용자들은 아무런 불편함이 없고, 기업이 시스템통합 사업자를 통해 그룹웨어를 구축하면서 한글 오시엑스를 채택한 뒤 아직 업데이트를 안한 경우 등에만 일부 문제가 될 수 있다”며 “액티브엑스 환경에서 한글 오시엑스 컨트롤을 아직 사용 중인 고객의 불편을 최소화하기 위해 핫라인을 개설해 기술 지원을 하고 있다”고 밝혔다."
2024-12-18,12월19일 인사,⊙ 문화체육관광부 <전보> ◇과장급 △홍보담당관 정윤재⊙ 한국토지신탁 △사장 김성진 <승진> ◇부사장 △도시·지원부문장 정명량 ◇전무 <본부장> △전략사업 심창우 △리츠사업 김치완 △도시재생2 배효진 ◇본부장(실장) △기획실장 공현기 △도시재생3본부장 정경찬 △신탁지원〃 이성훈⊙ 다우키움그룹 <승진> 키움증권 △상무 김경주 △이사 신수근 박재우 장미루 이영록 송정덕 한수연 키움투자자산운용 △상무 박세중 △이사 정치훈 키움캐피탈 △상무 김우석 △이사 김민석⊙ 금강공업그룹 <승진> 금강그룹 △전무 곽동명 윤수용 △상무보 박준영 변인섭 이제윤 안재경 이정완 이정웅 한창우 케이에스피 △이사대우 김성진 김형태⊙ 스틱인베스트먼트 <승진> △대표이사 강신우 ◇파트너 △그로쓰캐피탈본부 부본부장 이한주 △전략실 실장 이도행  △경영지원본부 본부장 공원표 ◇상무 △그로쓰캐피탈본부 이진형 △PE부문 이원진 이병도 김수지 △크레딧본부  안상민 △그로쓰캐피탈본부 수석심사역 임채훈 △PE부문 〃 이정호 신형준 △경영지원본부 수석매니저 김영애 <전보> △리스크관리실장 및ESG본부장 이준호 △〃 선임지원역 류태경 스틱벤처스 <승진> △투자본부 파트너 정보라 △〃 수석심사역 김민섭⊙ 하이트진로 <승진> ◇전무 △마케팅실 오성택 ◇상무 △영업부문 이정훈 △생산부문 백명규 ◇상무보 △영업부문 정용기 백정훈⊙ 한글과컴퓨터그룹 <승진> 한글과컴퓨터 △전무 진성식 정지환 한컴위드 △부사장 송상엽 △상무 천병갑 한컴라이프케어 △상무 김상묵 인치연 정관영
2024-07-18,‘가상화폐로 96억 비자금 혐의’ 김상철 한컴 회장 영장 기각,"비자금을 조성한 혐의로 사전구속영장이 청구된 김상철(71) 한글과컴퓨터 회장이 18일 수원지법 성남지원에서 열린 구속 전 피의자 심문(영장실질심사)을 마치고 법원을 나오고 있다. 연합뉴스계열사에서 발행한 가상화폐를 통해 96억원 상당의 비자금을 조성한 혐의를 받는 김상철(71) 한글과컴퓨터 회장에 대한 구속영장이 기각됐다.수원지법 성남지원 김세현 영장전담 부장판사는 18일 특정경제범죄 가중 처벌법 위반(배임) 혐의를 받는 김씨에 대한 구속 전 피의자심문(영장실질심사)을 마친 뒤 기각 결정했다. 김 부장판사는 “배임 관련해 방어권 보장 필요성이 있고, 공범 등에 대한 광범위한 증거 조사가 이뤄져 증거인멸의 염려가 없다”고 기각 이유를 밝혔다. 이어 “주거, 연령, 가족관계 등에 비춰 도주 우려가 없고 나머지 죄명에 대해서는 대체로 시인하고 피해가 회복한 점 등을 고려했다”고 덧붙였다.김씨는 한컴그룹 계열사인 블록체인 전문기업 한컴위드가 지분을 투자한 가상화폐 ‘아로와나토큰’으로 비자금을 조성해 회사에 손해를 끼친 혐의를 받는다. 김 회장은 한컴위드 지분 15.8%를 보유한 최대주주다. 검찰은 김 회장이 계열사 임직원 등과 공모해 회사 소유의 가상자산 96억원 상당을 임의로 사용한 것으로 보고 있다.현재 상장 폐지된 상태인 아로와나토큰은 2021년 4월20일 처음 상장한 지 30분 만에 최초 거래가인 50원에서 1075배인 5만3800원까지 치솟아 시세 조작 의혹이 불거졌다.앞서 배임 혐의 공범으로 먼저 기소된 김 회장의 차남(35·한컴위드 사내이사)과 토큰 발행업체인 아로와나테크 대표 정아무개(48)씨는 지난 11일 1심에서 각각 징역 3년, 징역 2년6개월을 선고받았다. 이들은 2021년 12월부터 2022년 6월까지 국내 가상자산 컨설팅 업자에게 아로와나토큰 1457만1천여개 매도를 의뢰해, 수수료 등을 공제한 정산금 80억3000만원 상당의 이더리움과 비트코인을 김씨 개인 전자지갑으로 전송받는 수법으로 비자금을 조성한 혐의를 받는다.또 2022년 3월 국외 가상자산 관련 업자에게 아로와나토큰 400만개의 운용과 매도를 의뢰한 뒤 운용수익금 15억7000만원 상당의 가상화폐를 김씨 개인 전자지갑으로 전송받은 혐의도 있다."
