date,title,content
2022-05-25,존리 “한국이 갑자기 선진 증시 되면 이런 일 벌어져”,"[방현철 박사의 머니머니] 존리 “MSCI선진국지수 편입, 마냥 좋은 건 아냐”25일 오후 5시 조선일보의 경제 유튜브 채널 ‘조선일보 머니’와 조선닷컴을 통해 공개된 ‘방현철 박사의 머니머니’에선 존리 메리츠자산운용 대표와 ‘코리아 디스카운트 해법’이라는 주제로 존리 대표의 투자 원칙에 대해서 알아 봤습니다.존리 대표는 코리아 디스카운트를 “한국에 상장돼 있다는 이유로 회사의 가치가 제대로 반영되지 않고 있는 것”이라고 정의했습니다. 그 원인으로 한반도의 지정학적 불안감과 한국 기업들의 불합리한 주주환원 정책을 들었습니다.국내에서 코리아 디스카운트 해소 방법의 하나로MSCI(모건스탠리캐피탈인터내셔널) 선진국지수에 편입돼야 한다는 논의가 있습니다.MSCI지수는 선진국, 신흥국, 프론티어 시장 등으로 나뉘어 있습니다. 현재 한국은 중국과 같이MSCI신흥국 지수에 포함돼 있는데, 2008년부터MSCI선진국지수 편입을 시도했습니다.그런데 존리 대표는 “MSCI선진국 지수로 가는 게 무조건 좋다는 생각은 조심해야 한다”고 했습니다. 선진국 지수에 포함되면 글로벌 펀드 매니저들이 삼성전자 등 대기업에만 손이 가고, 중견기업이나 중소기업들은 소외될 수 있다는 것입니다.한국경제연구원은 작년 5월 우리 증시가MSCI선진국증시로 승격되면, 외국인 주식 투자 자금이 추가로 159억~547억 달러 순유입 된다고 분석했습니다. 이에 코스피지수도 최고 4035까지 오를 수 있다고 했습니다. 그런데 증권 업계에서는MSCI신흥국지수에서 빠지면 일단 이 지수를 추종해서 한국에 투자하는 패시브자금 440억 달러가 빠질 것으로 보고 있습니다. 반면 선진국지수에 포함되면서 유입되는 패시브 자금은 이에 못 미치는 200억~300억 달러에 불과해 결국 130억~150억 달러 쯤의 순유출이 있을 수 있다고 보기도 합니다. 다만 종목을 선정해서 적극적으로 투자하는 글로벌 액티브 자금이 어떤 움직임을 보일 지는 가늠하기 힘듭니다. 그런데 존리 대표는MSCI선진국 지수에 편입되면 글로벌 펀드 매니저들이 삼성전자 등 대기업에만 투자할 가능성이 있다고 한 것입니다.대신 코리아 디스카운트 해소를 위해 국내 기업들의 주주환원 정책이 선진국 수준으로 되는 게 중요하다고 했습니다. 존리 대표는 “소액주주의 권리가 침해된다는 것은 한국 증시에 악영향을 미칠 수밖에 없다”며 “대주주나 소액주주를 가리지 않고 기업 이익을 공정하게 나눠야 한다”고 했습니다. 존리 대표는 “한국 주식 시장이 누구나 다 공평하게 돈을 벌 수 있는 시장이 돼야 한다”고 덧붙였습니다.존리 대표는 미국 월스트리트의 스커더 스티븐슨 앤 클라크, 라자드자산운용 등에서 펀드 매니저 등으로 일했습니다. 존리 대표는 한국으로 돌아와 2014년부터 메리츠자산운용 대표를 맡고 있습니다.‘방현철 박사의 머니머니’는 월·수·금요일 오후 5시 시장분석, 자산운용, 재테크 전문가, 증권가 고수들의 목소리를 듣는 시간입니다. 영상은 경제 유튜브 채널 ‘조선일보 머니’와 조선닷컴을 통해서 공개됩니다."
2022-08-16,올해 상반기 ‘연봉 킹’은?... 카카오 조수용·여민수 前대표 300억대,"스톡옵션 포함 각각 361억·332억재벌 총수 1위 롯데 신동빈 102억현역 전문경영인 1위는SK박성욱조수용, 여민수, 김제욱, 박성욱, 박정호.올해 상반기 재계 보수 1·2위는 카카오 퇴임 경영자들이 차지했다. 지난 2월 퇴임한 조수용·여민수 전 공동대표가 각각 361억4700만원, 332억1700만원을 받았다. 퇴직금은 각각 7억원, 2억원에 불과했지만 스톡옵션(주식매수선택권) 행사 이익이 컸다. 조 전 대표는 카카오 주가가 9만4100원일 때 행사가 1만7070~2만116원에 45만주를 매도해 337억5000만원을 벌었다. 여민수 전 대표도 같은 가격에 42만5000주를 팔아 318억2400만원 차익을 남겼다.두 사람 외에 카카오그룹에서는 수십억원대 스톡옵션 대박을 낸 전·현직 임직원이 다수 나왔다. 정의정 전 카카오 기술부문책임자가 95억6800만원, 김주원 전 카카오 공동체 컨센서스센터장이 77억3400만원을 받았다. 카카오페이 오승준 결제사업부문장이 39억7800만원, 이우춘·서세종 개발자가 각각 37억3900만원, 34억9700만원을 받았고 정규돈 카카오뱅크 최고기술책임자가 38억9700만원을 벌었다.이는 12월 결산 상장법인 반기보고서 제출 기한인 16일, 국내 주요 기업들이 오너·임원의 보수를 공시한 결과다. 각 기업의 반기보고서에는 보수 지급액 5억원 이상인 상위 5명의 개인별 액수가 공개된다.현역 전문경영인 중에서는 박성욱SK하이닉스 부회장이 가장 많은 보수를 받았다. 그는 올 상반기 급여와 상여를 각각 6억원씩 받았고, 올 초 스톡옵션 9만9600주를 행사해 84억2600만원의 차익을 얻었다. 박 부회장 외에도SK그룹 최고경영자들은 보수액 상위권을 휩쓸었다. 박정호SK하이닉스 부회장은SK하이닉스(44억7500만원), 텔레콤(28억원), 스퀘어(14억8400만원)에서 총 87억5900만원을 받았고, 지난 3월SK하이닉스 대표이사에서 자회사 솔리다임 의장으로 옮긴 이석희 사장은 퇴직금 46억원 포함, 84억2400만원을 받았다.SK바이오사이언스의 김훈 최고기술책임자(70억원)·안재용 대표(69억원), 조대식SK수펙스추구협의회 의장(58억원), 장동현SK㈜ 부회장(52억원) 등SK현직 경영진이 상위권에 이름을 올렸다.반면 삼성전자는 경영 일선에서 한 걸음 물러난 김기남 회장(32억원), 권오현(31억원)·윤부근(26억원)·고동진(〃)·신종균(〃) 고문이 보수 지급 1~5위를 차지했다. 현직 중에선 한종희 부회장이 20억원으로 가장 많았다. 삼성전자CEO들이 차지했던 연봉 상위권을SK그룹 최고경영자들이 대거 차지한 모양새다.주요 재벌 총수 중에선 신동빈 롯데그룹 회장이 가장 많은 보수를 받았다. 신 회장은 롯데지주·케미칼·제과·호텔 등 7개사에서 총 102억8500만원을 상반기 보수로 받았다. 작년 상반기(79억7200만원)보다 30% 가까이 늘었다. 롯데 측은 “롯데지주 실적 개선 등으로 상여금이 대폭 늘었다”고 밝혔다. 구광모LG그룹 회장 71억3900만원, 김승연 한화 회장 54억원,GS허태수 회장 53억6500만원, 이재현CJ회장 49억6800만원 순이었다. 최태원SK회장은SK㈜에서 17억5000만원을, 정의선 현대차그룹 회장이 작년 상반기와 같은 32억5000만원(현대차 20억원, 현대모비스 12억5000만원)을 받았다. 이재용 삼성전자 부회장은 2017년 3월부터 급여와 연봉을 받지 않는 ‘무보수 경영’을 이어가고 있다게임업계에서는 장현국 위메이드 대표가 상반기 86억2200만원으로 1위를 기록했다. 전문경영인인 장 대표는 카카오게임즈의 인기 게임 오딘 개발사에 투자한 공로로 상여금 81억2200만원을 수령했다. 이어 김택진 엔씨소프트 대표가 57억7000만원, 배동근 크래프톤 이사가 41억3100만원(스톡옵션 행사)을 기록했다.금융권에선 김제욱 에이티넘인베스트먼트 부사장이 262억8500만원을 받았다. 두나무·리디 등 스타트업 투자를 주도한 성과로 받은 인센티브만 261억200만원으로, 한국 벤처캐피탈 사상 최대 규모다. 이어 정일문 한국투자증권 사장이 상여 46억6477만원을 포함해 총 50억8917만원을 보수로 받았다. 이어 김진영 하이투자증권 사장이 36억3000만원, 최현만 미래에셋증권 회장이 34억8400만원의 보수를 받았다. 지난해 상반기 금융권 1위였던 정태영 현대카드 부회장은 25억3200만원을 받았다. 지난 3월 퇴임한 김정태 전 하나금융그룹 회장은 ‘특별공로금’ 등을 포함해 약 42억원을 받았다."
2022-02-16,국내 유력 VC 대표 9인이 본 올해 스타트업 시장 전망은,"투자 시장 전망·주목 분야 설문지난해 국내 스타트업 총 투자액이 12조원을 넘기며 ‘월 투자 1조원’ 시대가 열렸다. 2000년대 초반IT벤처 붐에 이어 제2 벤처 붐이 왔다는 말이 나올 정도로 호황을 맞은 것이다. 하지만 올해 들어 미국발 금리 인상 예고가 주식시장을 얼어붙게 만들면서 글로벌 스타트업 투자에 대한 우려도 나오고 있다. 월스트리트저널은 최근 “글로벌 투자사들은 최근 투자 기업 가치를 낮추고 있으며, 앞으로 스타트업은 자금 조달에 어려움을 겪을 것”이라는 전망을 내놓았다. 미국발 기술주 쇼크가 올해 국내 스타트업 투자 시장에 미칠 영향은 어떨까. 국내 유력 벤처캐피털 대표 9명에게 올해 투자 시장 전망과 주목하는 분야를 물었다. 이들은 “글로벌 시장은 조정 가능성이 있겠으나 국내 스타트업 시장은 계속 성장을 이어갈 것”이라며 “올해는 블록체인·NFT·헬스케어 분야를 주목하겠다”고 했다.VC대표 9명 중 8명, 제2 벤처 붐 올해도 간다벤처캐피털 대표 9명 중 알토스벤처스의 김한준 대표를 제외한 8명은 올해도 지난해 못지않은 투자 호황이 될 것으로 전망했다. 소프트뱅크 그룹의 글로벌 벤처투자를 총괄하는 소프트뱅크벤처스의 이준표 대표는 “글로벌을 무대로 하는 한국 기업들이 많이 나오고 있고, 기술적으로도 우수한 기업들의 도전이 계속되고 있다”며 “우리도 한국 기업 투자 비중을 늘리겠다”고 했다. 정신아 카카오벤처스 대표도 “올해도 제2 벤처 붐이 계속 갈 수밖에 없는 환경”이라고 했다. 기존 민간 투자사와 정부 자금뿐 아니라 대기업과 금융사, 심지어 언론사까지 벤처캐피털을 만들어 투자 시장에 진입하고 있다는 것이다. 유승운 스톤브릿지벤처스 대표는 “아날로그에서 디지털로 혁신할 분야가 여전히 많이 남아 있어 투자의 큰 흐름은 계속 좋아질 것”이라고 전망했다.현재의 투자 붐이 2000년대 초반IT버블 상황과는 다르다는 진단이 많았다. 한국벤처캐피탈협회장을 맡고있는 지성배IMM인베스트먼트 대표는 “기업과 투자사 모두 아마추어 같았던 20년 전 제1 벤처 붐과는 다르다”며 “이젠 우수한 기업의 인재뿐 아니라 자본도 성숙해져 올해도 지난해와 비슷한 흐름이 이어질 것”이라고 했다. 박기호LB인베스트먼트 대표도 “기업들의 역량과 기술이 닷컴버블 시기와 질적으로 다르다”고 말했다.단기적 투자 조정기 올 수도투자사 대표들 사이에서는 투자 총액은 계속 성장하겠지만, 기업 가치를 보수적으로 평가할 것이라는 의견이 우세했다. 남기문 스마일게이트벤처스 대표는 “시장에 돈이 많이 풀려 스타트업 가치가 높다는 우려가 거론되는 만큼, 단기적인 조정기를 거칠 것”이라고 했다. 하나금융그룹의CVC(기업형 벤처캐피털)을 이끌고 있는 김동환 하나벤처스 대표도 “지난해까지는 투자를 쉽게 했다면, 올해는 많은 벤처캐피털들이 진짜 실력을 보여 옥석을 가려내야 하는 한 해가 될 것”이라고 했다.투자사 대표들은 미국의 기술주 약세 현상을 예의 주시하고 있었다. 최근 나스닥에 상장한 메타버스·전기차·AI(인공지능) 기업들의 주가가 폭락하고, 이로 인해 기업공개(IPO) 시장까지 얼어붙으면서 기업과 투자사들의 엑시트(매각 또는 상장)에 부정적인 영향을 미치고 있다는 것이다. 이준표 대표는 “글로벌 벤처캐피털 중 일부는 이미 기업가치 조정에 들어갔고, 이 흐름이 지속되면 초기 투자 시장에도 영향을 줄 것”이라며 “조정 가능성에 대비하고 있다”고 했다. 미국에 본사를 두고 있는 알토스벤처스의 김한준 대표는 “향후 시장은 꽤 혼란스러울 것 같다”며 “자금 조달 시장은 위축과 과열을 반복하며 변동을 겪을 것”이라고 했다.“블록체인·헬스케어에 주목”이들이 꼽은 올해 유망 분야는 어디일까. 최근IT업계와 게임업계가 앞다퉈 뛰어드는 블록체인, 가상 화폐와 디지털 헬스케어 분야를 유망 분야로 꼽은 사람들이 많았다. 박기호 대표는 “우리를 비롯해 많은 국내 투자사들이 블록체인, 가상 화폐 분야에 보수적이었는데 이젠 실제 현실 세계에서 비즈니스를 하는 기업들을 눈여겨보고 있다”고 했다. 지성배 대표도 “이제는 긍정적으로 검토해야 할 때가 됐다”고 말했다. 국내 대표IT기업인 네이버와 카카오의 초기 투자를 이끄는 수장들도 블록체인과 디지털 헬스케어 분야를 꼽았다. 네이버의 초기 투자를 총괄하는 양상환 D2SF센터장은 “블록체인과 메타버스 분야에 집중하고 있다”며 “네이버의 다양한 서비스와 시너지를 내는 쪽으로 투자할 것”이라고 했다. 김동환 대표는 기업 고객을 노리는 구독형 소프트웨어, 유승운 대표는 디지털 치료제를 올해 눈여겨보는 투자 분야라고 했다."
2022-02-16,MSCI 편입돼도 주가 내리막… LG엔솔을 팔까말까,"지수편입 첫날, 주가 되레 급락영업이익 예상치 밑돌아 악재로LG에너지솔루션/2022.02.10/주완중 기자시가총액 2위로 화려하게 코스피에 입성한LG에너지솔루션 주가 전망이 흐려지고 있다.MSCI(모건스탠리캐피탈인터내셔널) 지수에 특례 편입된 첫날이었던 지난 15일 주가가 오히려 2.48% 급락했기 때문이다. 이날 외국인이LG엔솔을 1000억원 가까이 순매도했다.의무보유 확약물량(4만5281주)이 해제된 데다 우크라이나 전쟁 우려에 증시 전체가 휘청거린 영향이 컸지만, 기대 일색이었던 주가 전망에 부정적인 의견이 조금씩 더해지고 있다.지난 9일 홍콩계 증권사CLSA는LG에너지솔루션 목표 주가를 45만원, 투자 의견은 ‘매도’로 제시했다. 반도체 공급망 차질 등으로 전기차 산업의 실적이 저조할 가능성이 있다고 분석했다.LG에너지솔루션은 지난 8일 흑자 전환하긴 했지만, 작년 영업이익은 예상치를 58% 이상 밑도는 7685억원에 그쳤다. 이 같은 실적 공개 후 주가는 약세를 보였고, 16일 소폭 상승해 45만5500원으로 거래를 마쳤다.CLSA의 목표 주가 수준까지 다다랐다.SK증권도 지난 11일 투자 의견을 ‘매수’에서 ‘중립’으로 변경한 보고서를 냈다. 목표가는 이전과 같은 43만원을 유지했다. 올해는 성장보다 소재 가격 인상에 따른 원가 부담 상승이 예상된다고 했다.국민연금, 보험사 등 기관 투자자들은 지난달 27일 상장 후 6일 연속 순매수(매수가 매도보다 많은 것)하다가 4일 연속 순매도로 돌아섰다. 매수를 주도해온 국민연금 등 연기금은 순매수 규모가 5조원대에서 4조원대로 감소했다.다음 달 11일에는 코스피200 조기 편입, 4월에는 솔랙티브(Solactive)글로벌리튬지수 편입 등이 기다리고 있지만 우크라이나 정세 불안, 인플레이션 가속화 우려, 빠른 금리 인상 등 글로벌 악재가 쉽게 사라지지 않을 것으로 보여 주가 전망이 밝지 않다는 평가가 나온다. 금융정보업체 에프앤가이드에 따르면 증권사들의 평균 목표 주가는 52만2000원이다. 윤혁진SK증권 연구원은 “생각보다 낮은 매출 성장과 수익성이 올해 내내 투자자에게 근심거리가 될 것”이라고 말했다.내년에는 가파른 성장이 가능할 것이라는 의견이 많다. 일부 증권사들은LG에너지솔루션의 실적 부진에도 불구하고 향후 성장세가 뚜렷하다며 적극 ‘매수’를 권하고 있다. 현대차증권이 64만원을 제시했고, 이베스트투자(63만6000원), 메리츠(61만원), 한국투자(60만원) 등도 목표가를 60만원 이상으로 잡고 있다."
2022-02-16,MSCI 편입돼도 주가 내리막… LG엔솔을 팔까말까,"지수편입 첫날, 주가 되레 급락영업이익 예상치 밑돌아 악재로LG에너지솔루션/2022.02.10/주완중 기자시가총액 2위로 화려하게 코스피에 입성한LG에너지솔루션 주가 전망이 흐려지고 있다.MSCI(모건스탠리캐피탈인터내셔널) 지수에 특례 편입된 첫날이었던 지난 15일 주가가 오히려 2.48% 급락했기 때문이다. 이날 외국인이LG엔솔을 1000억원 가까이 순매도했다.의무보유 확약물량(4만5281주)이 해제된 데다 우크라이나 전쟁 우려에 증시 전체가 휘청거린 영향이 컸지만, 기대 일색이었던 주가 전망에 부정적인 의견이 조금씩 더해지고 있다.지난 9일 홍콩계 증권사CLSA는LG에너지솔루션 목표 주가를 45만원, 투자 의견은 ‘매도’로 제시했다. 반도체 공급망 차질 등으로 전기차 산업의 실적이 저조할 가능성이 있다고 분석했다.LG에너지솔루션은 지난 8일 흑자 전환하긴 했지만, 작년 영업이익은 예상치를 58% 이상 밑도는 7685억원에 그쳤다. 이 같은 실적 공개 후 주가는 약세를 보였고, 16일 소폭 상승해 45만5500원으로 거래를 마쳤다.CLSA의 목표 주가 수준까지 다다랐다.SK증권도 지난 11일 투자 의견을 ‘매수’에서 ‘중립’으로 변경한 보고서를 냈다. 목표가는 이전과 같은 43만원을 유지했다. 올해는 성장보다 소재 가격 인상에 따른 원가 부담 상승이 예상된다고 했다.국민연금, 보험사 등 기관 투자자들은 지난달 27일 상장 후 6일 연속 순매수(매수가 매도보다 많은 것)하다가 4일 연속 순매도로 돌아섰다. 매수를 주도해온 국민연금 등 연기금은 순매수 규모가 5조원대에서 4조원대로 감소했다.다음 달 11일에는 코스피200 조기 편입, 4월에는 솔랙티브(Solactive)글로벌리튬지수 편입 등이 기다리고 있지만 우크라이나 정세 불안, 인플레이션 가속화 우려, 빠른 금리 인상 등 글로벌 악재가 쉽게 사라지지 않을 것으로 보여 주가 전망이 밝지 않다는 평가가 나온다. 금융정보업체 에프앤가이드에 따르면 증권사들의 평균 목표 주가는 52만2000원이다. 윤혁진SK증권 연구원은 “생각보다 낮은 매출 성장과 수익성이 올해 내내 투자자에게 근심거리가 될 것”이라고 말했다.내년에는 가파른 성장이 가능할 것이라는 의견이 많다. 일부 증권사들은LG에너지솔루션의 실적 부진에도 불구하고 향후 성장세가 뚜렷하다며 적극 ‘매수’를 권하고 있다. 현대차증권이 64만원을 제시했고, 이베스트투자(63만6000원), 메리츠(61만원), 한국투자(60만원) 등도 목표가를 60만원 이상으로 잡고 있다."
2022-02-28,[부음] 김종란 별세 외,"▲김종란별세,이석기부인상,이동환모친상,이자스민前 국회의원 시모상=26일14시43분 이대목동병원, 발인 1일5시, (02)2650-2745▲김희자별세,안유민한양대 교수·안연민한국미술관 관장 모친상,장은재동덕여대 교수 장모상,장진복서울신문 사회2부 기자 외조모상=27일6시25분 한양대병원, 발인 1일8시40분, (02)2290-9442▲이경임별세,박준안·박래은·박소원·박민선모친상,이영걸前 한세대 총장비서실장·김광현前 조선일보AD본부장·김정환재미 장모상=26일11시30분 강남세브란스병원, 발인 28일9시30분, (02)2019-9003▲이정애별세,김지욱·김지성·김지영·김지정모친상,권길주하나카드 대표이사·한승장모상,김명숙·김한숙시모상=26일20시 인천시민장례식장, 발인 1일7시30분, (032)889-4644▲유택하前 풍산유씨 대종회장 별세,유광호자유민주연구학회장·유상호한국투자증권 부회장·유재호에프티텍스 대표·유상미부친상,김용주청운장학재단 이사장 장인상,박옥경·김소연·고정은시부상=27일6시 삼성서울병원, 발인 2일8시30분, (02)3410-3151▲윤찬용별세,윤인영현대캐피탈 차장 부친상,이석우조선일보 차장·채수열상도아이앤티 대표 장인상=27일1시30분 신촌세브란스병원, 발인 1일7시, (02)2227-7500▲지해동별세,조명순남편상,지차수세계일보 디지털미디어국 부국장·지효수구의현대종합상가운영회 소장·지영수2018연 총괄셰프 부친상,이인경·도경순·김병숙시부상=26일19시53분 건국대병원, 발인 1일12시50분, (02)2030-7909"
2022-02-08,차기 하나금융 회장에 함영주 부회장 내정,"함영주 하나금융그룹 차기 회장/하나금융하나금융지주 차기 회장으로 함영주 부회장이 지명됐다. 하나금융지주는 8일 회장후보추천위원회에서 함 부회장을 단독 추천했다고 밝혔다. 다음 달 말 열리는 주주총회를 거쳐 선임된다. 2012년부터 4연임하며 10년간 하나금융을 이끌어온 김정태 회장은 물러나게 된다.차기 회장 최종 후보는 함 부회장을 비롯해 박성호 하나은행장, 윤규선 하나캐피탈 사장, 이성용 전 베인앤드컴퍼니 한국 대표, 최희남 전 한국투자공사(KIC) 사장 등 5명이었다.1956년생인 함 부회장은 주로 영업 현장에서 경력을 키웠다. 하나은행 충청사업본부 부행장으로 근무하다 2015년 9월 하나은행과 외환은행 통합 직후 초대 은행장을 맡았다. 2019년 3월까지 근무한 뒤 하나금융 부회장으로 재직 중이다. 하나금융 관계자는 “함 부회장으로 의견이 모아졌기 때문에 시간을 끌지 않고 예상보다 빨리 결정이 내려진 것 같다”고 말했다.함 부회장은 ‘법률 리스크’를 안고 있다. 오는 16일 은행장 시절 해외 금리 연계 파생결합상품(DLF) 불완전 판매와 관련해 금융 당국으로부터 받은 징계를 취소해달라는 소송의 1심 선고가 있다. 또 25일에는 은행장 재직 중 신입 행원 채용에 부당한 영향력을 행사한 혐의에 대한 형사 재판의 1심 선고가 예정돼 있다.DLF관련 재판에서는 손태승 우리금융지주 회장이 1심에서 승소했고, 채용 비리 혐의와 관련해서는 조용병 신한금융 회장이 2심에서 무죄를 선고받았다. 금융권  “회장후보추천위원회는 비슷한 재판의 결과를 볼 때 함 부회장에 대한 법률적 리스크가 크지 않다고 판단한 것 같다”고 말했다."
2022-01-28,"하나금융, 함영주·박성호 등 차기 회장 후보군 5명 확정","하나금융그룹이 28일 차기 회장 최종후보군(숏 리스트) 5명을 확정했다.최종후보군에는 함영주 하나금융지주 부회장과 박성호 하나은행장, 윤규선 하나캐피탈 사장 등 내부 인사 3명과 이성용 전 베인앤드컴퍼니 코리아 대표, 최희남 전 한국투자공사 사장 등 외부 인사 2명이 이름을 올렸다.서울 을지로에 있는 하나금융지주 본관 건물김정태 현 회장은 연임하지 않겠다는 의사를 본인이 대내외적으로 밝힘에 따라 후보군에서 제외됐다. 회추위는 “금융업의 경계가 무너지고 있는 변화와 도전의 시기에, 안정적으로 하나금융그룹의 성장을 이끌면서 디지털 전환, 글로벌화,ESG등 그룹의 핵심 전략을 추진할 적임자들을 후보로 선정했다”고 밝혔다.회추위는 이들 최종후보군을 상대로 프리젠테이션 및 심층면접을 거쳐 2월 말쯤 새 회장 후보를 단독 선출할 계획이다.2012년부터 10년간 그룹을 이끌어 온 김 회장의 임기는 오는 3월 만료된다."
