date,title,content
2024-11-15,태국 마사지숍 생중계한 한국인… 제지한 업주 폭행 혐의로 체포,"지난 14일(현지 시각) 태국의 한 마사지숍에서 여성 업주를 폭행한 혐의로 체포된 한국인./ 방콕포스트태국의 한 마사지숍에서 라이브방송을 하던 한국인 남성이 이를 말리던 주인을 폭행한 혐의로 경찰에 체포됐다.15일(현지 시각) 방콕포스트 등에 따르면, 전날 오전 0시 36분쯤 태국 파타야 방라뭉의 한 마사지숍에서 한국인 남성 A씨가 40대 여성 업주를 폭행한 혐의로 체포됐다.이 업주는 A씨가 가게를 여러 차례 방문해 동의를 구하지 않고 라이브 방송을 켰다고 주장했다. 이 업주는 A씨가 관광객이어서 처음에는 참았다고 한다. 그러나 사건 당일 A씨가 갑자기 커튼을 여는 바람에 오일 마사지를 받던 고객이 놀랐고, 이에 A씨에게 영상을 찍지 말라며 경고했다고 한다.이 업주는 휴대전화를 들고 촬영하던 A씨를 밀쳤고, A씨는 업주의 팔을 잡아 바닥에 넘어뜨렸다고 한다. 업주는 이 폭행으로 어깨가 탈구된 상태다. 이 업주는 자신의 한국인 남자친구도 A씨에게 맞아 코뼈가 부러졌다고 주장했다.라이브 방송을 하던 한국인과 실랑이를 벌인 태국 마사지숍 업주가 들것에 실린 모습./방콕포스트A씨는 이같은 소동이 벌어지는 중에도 계속 라이브 방송을 이어갔다. 그는 경찰이 온 뒤에야 방송을 멈췄다고 매체는 전했다. 현지 매체들은 A씨가 휴대전화를 들고 경찰차에 타고 있는 사진과 영상을 보도하기도 했다. 파타야 경찰은 A씨에 대한 법적 절차를 진행 중이며 그의 신원은 공개하지 않기로 했다.최근 태국에서는 유튜버 등 한국인들이 무분별하게 라이브 방송을 해 구설에 오르고 있다. 지난달에는 태국에서 체포된 한국인 마약사범이 호송차와 유치장에서 라이브 방송을 해 논란이 일었다. 작년 3월에는 한국 남성이 거리에서 태국 여성에게 접근해 무단으로 촬영해 현지에서 공분을 사기도 했다.이에 주태국 한국대사관은 “동의를 얻지 않는 촬영 등은 개인정보보호 및 초상권 침해 등으로 태국 내에서 처벌 될 수 있다”며 “불미스러운 일로 국격을 훼손시키는 일이 없도록 각별히 유의해달라”고 당부한 바 있다."
2024-11-18,"한동훈, 중소기업중앙회 방문 “기업 간 격차 해소에 최선”","국민의힘 한동훈 대표는 18일 오후 서울 영등포구에 있는 중소기업중앙회를 방문해 김기문 회장 등과 간담회를 가졌다.국민의힘 한동훈 대표. /장련성 기자한 대표는 이날 간담회에서 “지난 8월 중소기업중앙회 회장단 여러분을 만났을 당시 대기업과 중소기업 간 격차 해소를 위해 최선을 다하겠다고 약속드렸다. 그 약속을 지키겠다고 다시 한번 다짐한다”고 했다. 앞서 한 대표는 지난 8월 서울 여의도 중앙당사에서 김 회장을 비롯한 중소기업중앙회 회장단을 접견했었다. 당시 한 대표는 “경제단체 중 처음으로 중소기업중앙회가 방문한 데 대해 감사하다”며 “우리 사회의 격차 해소를 위해, 특히 중소기업의 어려움을 해소하는 데 최선을 다하겠다”고 했었다.한 대표는 “앞으로 미중 갈등 격화가 예상되고 수출 전선에 큰 변화가 생길 수 있다. 중동 정세 격화되고 러시아-우크라이나 전쟁에 북한이 참전하는 상황까지 왔다”며 “중소기업 환경이 녹록치 않다는 뜻이다. 이런 상황 속에서 우리 당과 정부는 중소기업이 글로벌 무대에서 더 잘 뛰기 위해 노력하겠다”고 했다.한 대표는 “기준금리가 상당히 낮은 수준으로 유지되고 더 내려갈 수도 있는데도 기업이나 가계가 부담하는 대출금리는 내려가지 않고 있다”며 “예대마진(대출금리와 예금금리 차이) 차이가 이렇게 크게 오래 지속되게 되면 가계와 기업에 큰 부담이 된다”고 했다. 이어 “특히 중소기업의 연체가 늘어나는 이런 상황에선 더더욱 그렇다”며 “예대마진을 줄이는, 대출이자를 낮추는 방향의 움직임이 꼭 필요하다”고 했다.또한 한 대표는 “저출생 대응을 위해 일과 가정 양립에 대한 지원을 확대하고 있다”며 “육아휴직 활용이 어려운 중소기업의 부담을 덜어주기 위해 대체 인력 풀을 구성하고 기업이 금전적 부담을 덜도록 육아 휴직 시 대체인력금 지원을 신설할 계획”이라고 했다. 그러면서 “파견근로자 사용 시에도 대체인력금을 지원하고 기업의 자발적 참여를 위해 국세청 정기 세무조사 유예 등 인센티브도 강화할 계획”이라고 했다.이날 간담회에는 한 대표를 비롯해 국민의힘 김상훈 정책위의장 등이 참석했다. 중소기업계에선 김 회장과 윤학수 대한전문건설협회장, 이정한 한국여성경제인협회장, 송치영 소상공인연합회장, 최봉규 중소기업융합중앙회장, 김덕재 한국IT여성기업인협회장, 정광천 이노비즈협회장, 권혁홍 한국제지공업협동조합 이사장, 배조웅 한국레미콘공업협동조합연합회장 등 100여 명이 자리했다.김 회장은 한 대표에게 격차 해소와 민생 회복을 위한 중소기업 정책과제 45건을 전달했다. 이후 중소기업 단체장들은 기업 격차 해소를 위해 협동조합 공동사업 활성화 및 협의요청권 도입, 중소기업 상생금융지수 도입 등을 건의했다. 노동 격차 완화 방안으로 기업 상황에 맞는 근로시간의 합리적 개선, 중대재해처벌법 보완, 일·가정 양립을 위한 대체인력 지원 확대, 외국인 근로자 취업방식 등도 논의됐다. 또 중소기업계에선 중소기업 연구개발(R&D) 예산 복원 등의 요청도 나왔다.앞서 한 대표는 이날 오전 국회에서 열린 당 최고위원회의에서 “우리는 반사이익에 기대거나 오버하지 않겠다”며 “국민의 눈높이에 맞게 변화하고 쇄신하고 더 민생을 챙기겠다”고 말했다. 지난주 더불어민주당 이재명 대표의 공직선거법 위반 사건 1심 재판에서 징역 1년에 집행유예 2년이 선고된 것과 관계없이 집권 여당으로서 민생을 챙기겠다는 것으로 해석됐다."
2024-08-21,하루 새 날개 꺾인 ‘종다리’… 습식 사우나 몰고 온다,"제주에 강한 비바람 뿌린 후 소멸태풍을 피하고 싶어서… - 20일 오전 제주 서귀포시 중문해수욕장을 찾은 관광객들이 야자수 아래서 폭우를 피하고 있다. 이날 제9호 태풍 ‘종다리’가 한반도를 향해 북상하면서 제주도 일대에 강한 비바람을 뿌렸다. 이날 오전 11시부터 해안가 주민과 관광객 등을 대상으로 대피 명령이 내려졌다. 제주항을 오가는 여객선도 전부 결항했다. /뉴스1올여름 한반도에 상륙하는 첫 태풍인 9호 ‘종다리’가 20일 제주 부근에 많은 비를 뿌린 뒤 사실상 소멸했다. 고온 다습한 비구름을 머금고 온 ‘종다리’로 인해 21~22일 전국 곳곳에 하루 40~60㎜가량의 많은 비가 이어질 전망이다. 태풍이 남긴 뜨겁고 축축한 ‘열 폭탄’이 한반도에 남아 비가 그친 후 극심한 더위가 찾아올 것으로 보인다.기상청에 따르면, ‘종다리’는 20일 오후 9시 전남 신안군 흑산도 남남동쪽 약 30㎞ 해상에서 열대저압부로 약화했다. 열대저압부란 태풍이 되지 못하거나 태풍이 약화한 저기압을 뜻한다. 태풍은 적도 부근 열대 해상에서 만들어진 거대한 저기압이 중심 최대 풍속 초속 17m 이상으로 덩치를 키우면 붙는 이름인데, 풍속이 기준 아래로 떨어지면 열대저압부가 된다. 비바람을 소진하고 힘을 잃었다는 의미다.그래픽=양인성당초 ‘종다리’는 20일 밤 흑산도를 통과한 후 21일 새벽에 열대저압부로 약화해 충남 앞바다에서 동북쪽으로 경로를 바꿔 오전에 경기 남부 등 수도권, 오후에 강원 속초 인근에 닿을 것으로 예상됐다. 그러나 예상보다 더 빠르게 약화한 것이다. 현재 한반도 대기 상층에서 세력을 유지하고 있는 티베트고기압의 누르는 힘이 워낙 강하다 보니 태풍이 해상을 지나면서 덩치를 키우지 못했고 그만큼 힘도 빨리 빠졌기 때문으로 분석된다.‘종다리’가 이동하는 과정에서 남겨진 비구름대의 영향으로 21~22일 전국에 비가 예보됐다. 21일엔 수도권과 강원·충청권 등지에 30~80㎜, 22일에도 전국에 5~60㎜의 비가 내리겠다. 일부 지역에 따라서는 시간당 20~30㎜의 거센 비가 쏟아지고, 돌풍과 함께 천둥·번개도 치겠다. 앞서 열대저압부로 약화한 시점을 포함해 강수가 집중되는 시간은 영남권 20일 밤~21일 아침, 호남권 20일 오후~21일 아침, 충청권 21일 새벽~오전, 수도권 21일 오전, 강원도 21일 오전~오후다.비를 뿌리지만 날은 오히려 더워질 전망이다. 고온 다습한 수증기 덩어리가 내륙에 남겨지는 형태라 ‘습식 사우나’ 같은 무더위가 나타날 전망이다. 서울의 경우 21~23일 상대습도가 80~90%에 달하는 등 밤낮없이 체감 기온이 섭씨 30도 안팎으로 예보됐다.21일 아침 최저기온은 24~27도, 낮 최고기온은 29~35도로 예보됐다. 22일도 최저 24~28도, 최고 29~34도로 평년보다 기온이 높을 전망이다.‘종다리’는 예상보다 이르게 소멸했지만, 태풍이 세력을 유지한 상태에서 직접 영향권에 들었던 제주와 서남해안에는 20일 오후까지 강한 비바람이 몰아쳤다. 더구나 이달 20~23일은 한 해 중 바다의 수위가 가장 높은 ‘백중사리’ 기간으로, 제주엔 태풍까지 겹치면서 파고가 높았다. 제주도는 20일 오전 11시부터 해안가 주민, 관광객, 낚시객 등에게 대피 명령을 내렸다. 이날 오후 3시 27분쯤 제주시 한림읍 월령포구에서는 20대 남성 A씨가 바닷물에 빠졌다는 신고가 접수됐다. A씨는 일행 4명과 함께 물놀이하던 중 바다에서 빠져나오지 못하다가 인근에 있던 레저 업체에 의해 구조됐다.이날 오후 4시 이후 제주항을 오가는 여객선은 전부 결항했다. 한라산 일곱 코스의 탐방로도 전면 통제됐다.영남 남부 지역에선 강한 비에 공사장 흙더미가 유출되는 등 피해가 발생했다. 중앙재난안전대책본부에 따르면, 이날 오전 5시 40분쯤 경남 양산시 덕계동의 산업 단지 조성 공사 현장에서 흙더미가 도로 위에 쏟아졌다. 오전 7시 50분쯤에는 경북 경주시 불국동 주민 6명이 산사태 우려에 마을회관으로 대피했다가 1시간 뒤 귀가했다. 울산 울주군에선 한국제지·원산교차로 등에서 차량 13대가 침수됐다.☞열대저압부태풍으로 발달하지 못했거나 태풍에서 약화된 열대 저기압. 회오리바람의 중심 부근 최대 풍속이 초속 17m 미만이면 열대저압부, 이상이면 태풍으로 분류한다. 적도 부근 해양에서 고온 다습한 공기가 상승하며 만들어진다."
2024-08-20,"최대 93mm폭우 쏟아진 울산, 차량 침수 등 피해 속출","20일 오전 6시 26분쯤 울주군 온산읍 원산리 한국제지 앞 도로에 있던 차량 3대가 폭우로 침수됐다. /울산경찰청20일 오전 울산에 폭우가 쏟아지면서 차량 침수 등 피해가 잇따랐다. 주택에 사람이 갇히고, 도로에 물이 차올라 차량 여러 대가 침수됐다.울산시에 따르면 이날 오전 5시부터 9시까지 울산의 평균 강수량은 52.1㎜를 기록했다. 지역별로 간절곶이 93㎜로 가장 많이 내렸다. 이어 장생포 75㎜, 매곡 67㎜, 서동 51.4㎜, 두서 37.5㎜, 삼동 35.5㎜ 등 순으로 나타났다.이날 오전 6시 5분에는 울산 전역에 호우주의보가 발령됐고, 6시 55분과 8시에는 각각 울산 서부와 동부에 호우경보가 내려졌다.짧은 시간동안 많은 비가 내리면서 경찰에는 오전 9시 10분 기준 78건의 신고가 접수됐다. 신고 내용은 침수가 36건, 신호기 고장이 16건, 맨홀 위험 15건, 기타 3건 등이었다.또 이날 오전 6시 26분쯤 울주군 온산읍 원산리 한국제지 앞에서는 차량 3대가 침수돼 견인됐다. 경찰은 이 도로 구간의 양방향을 통제 중이다.소방에도 침수 등 28건의 신고가 접수됐다. 울주군 서생면에서는 이날 오전 7시 10분쯤 주택 1층에 있던 주민 1명과 차량에 고립돼 있던 시민 1명 등 2명이 구조됐다. 이밖에 울주군 청량초등학교 주변과 원산교차로도 통제가 이뤄졌다.울산시는 비상근무에 돌입해 현장에 인력을 배치하고, 침수된 구간에 대한 응급 복구작업을 진행 중이다."
2022-02-28,'전쟁 반대' 부산 러시아 총영사관 찾은 한국인 제지 당해,"28일 오후 부산 해운대구 구남로에서 러시아의 침략 전쟁을 중단할 것을 호소하는 집회에서 재한 우크라이나인들이 손팻말을 들고 있다 . 이번 집회는 부산 등지에서 거주하고 있는 우크라이나 유학생 등이 자발적으로 모여 개최했다. 연합뉴스러시아의 우크라이나 침공에 반대하는 한 한국인 남성이 부산 러시아 총영사관에 ‘전쟁 반대’ 의사를 전하기 위해 진입하려다 경찰에 제지당했다.28일 부산 중부경찰서에 따르면 이날 오전 10시 40분께 부산 중구 주부산 러시아연방 총영사관에 50대 한국인 남성 A씨가 진입을 시도했다.A씨는 “전쟁에 반대 의사를 전달하기 위해 영사관을 찾았다”고 말한 것으로 전해졌다.신고를 받고 출동한 경찰이 A씨를 제지했으며, 물리적 충돌은 없었다고 경찰은 밝혔다.경찰은 이런 일이 발생하자 러시아 총영사관 경비를 강화하고 나섰다.2시간에 한 번씩 하던 총영사관 주변 순찰을 1시간 단위로 바꾸고, 담당 경찰서 경비과장과 계장이 매일 2차례 현장을 점검하기로 했다.총영사관 경비도 의무경찰에서 정식 경찰로 대체했다.경찰은 부산지역 러시아ㆍ우크라이나 관련 집회 시위 등과 관련된 외사 정보활동도 강화하기로 했다.28일 오후 부산 해운대구 구남로에서 국내에 체류 중인 우크라이나인 20여 명이 '러시아-우크라이나 전쟁 규탄 및 중단 촉구' 집회를 열고 있다. 뉴스1이날 오후 7시에는 해운대 지하철역 인근에서 ‘러시아ㆍ우크라이나 전쟁 규탄 및 중단 촉구 집회’가 열렸다.이 집회에는 부산 등 국내에 거주하는 우크라이나 유학생과 직장인 등 30여명이 참석해 ‘우크라이나를 구해달라’,‘전쟁을 멈춰달라’,‘러 푸틴은 전쟁을 멈춰’라는 구호를 외쳤다.집회 도중 우크라이나 국가가 나올 때는 서로 부둥켜안고 눈물을 흘리기도 했다.대선 후보들을 향한 손팻말에는 ‘우크라이나 사태에 관심을 가져달라’고 쓰기도 했다.부산시에 따르면 현재 부산에 거주하는 러시아인은 1310명(2020년 11월 행안부 통계 기준)이다.우크라이나인에 대해서는 별도로 관리하는 통계가 없다고 부산시는 밝혔다."
2023-06-15,"감사 전하는 수단, 나이 어릴수록 SNS보단 손편지","한국제지연합회는 제7회 종이의 날을 맞아 ‘2023년 종이에 대한 국민 인식 조사’를 실시했다. 이번 설문조사는 마크로밀엠브레인에 의뢰해 지난달 26일부터 29일까지 전국 성인남녀 1000명을 대상으로 종이에 대한 인식과 이용 행태 대한 주제로 진행됐다.종이에 대한 인식 조사 결과 종이의 원료가 대부분 가정, 회사 등에서 분리배출된 종이로 만들어진다는 사실을 인지한 후 응답자의 85.2%가 ‘폐지’를 ‘종이자원’으로 불러야 한다고 응답했다. 또한 종이가 아마존 등 원시림 나무가 아닌 체계적으로 조성된 조림지에서 합법적인 방식으로 재배한 나무로 생산된다는 사실을 안 후 종이가 재생 가능한 친환경 자원인가에 대한 질문에 93.8%가 동의했다. 평소 종이를 재활용하는지 묻는 질문에는 응답자의 77.5%가 종이를 분리배출 한다고 답했으며, 이면지 활용이 71.9%를 차지했다.종이의 이용 행태에 대한 항목에서는 종이와 디지털 기기, 손 편지와 모바일 메신저에 대한 선호도를 조사했다. 먼저 암기, 문제 풀이 등 학습 능률 향상을 위해 ‘종이’와 ‘디지털 기기’ 중 무엇이 적합한 지 묻는 질문에 응답자의 72.5%가 종이를 선택했다.감사의 마음을 전하는 수단으로 ‘손 편지’와 ‘모바일 메신저’를 비교하는 항목에서 51.1%가 손 편지를 선택했다. 연령별로 살펴보면 20 대 60.8%, 30 대 60.5%, 40 대 51.9%, 50 대 41.0%로 나이가 어릴수록 손 편지를 선택한 비율이 높았다. 특히 20대와 30대는 어린 시절부터 디지털 환경에서 성장한 ‘디지털 네이티브’ 세대라는 점에서 손 편지를 선택한 것에 의미가 있다.이외에도 일상에서 가장 많이 사용하는 종이는 사무용지 38.1%, 종이 포장재 30.3%, 책 13.5%, 수첩 및 다이어리 7.1%, 종이컵 6.0%, 신문 및 잡지 4.7%로 나타났다. 종이를 사용하는 가장 큰 이유는 메모 가능 31.6%, 편리한 사용법 28.3%, 접근성 16.3% 가독성 10.2%, 간편한 휴대성 7.3% 환경 보호 5.1% 순이다.한국제지연합회 이복진 회장은 “종이는 처음 발명된 이래로 지난 2000여 년 동안 우리 인류에게 대체할 수 없는 생활의 필수품”이라며 “종이의 가치는 정보 기록이나 전달에 머무르지 않고, 친환경 대체재와 첨단 산업 소재로 영역을 끊임없이 확대하고 있다”고 설명했다.아울러 “우리나라는 세계 7위의 종이 생산 국가로, 산림 자원이 부족한 환경을 극복하기 위해 종이자원을 적극 활용해 왔다. 종이의 날은 이러한 제지 산업과 업계 종사자들의 노력을 기리고 종이에 대한 긍정적 인식을 고취하기 위해 제정됐다”며, “향후에도 제지 산업의 발전을 위해 친환경성과 지속가능성을 염두에 두고 다채로운 활동을 이어 나갈 것”이라고 말했다.종이의 날은 국내에서 기계로 종이를 처음 양산한 1902년 6월 16일을 기념해 한국제지연합회 등 유관단체가 제정했다."
2023-07-05,"A4에 빨간펜 여전한데...'페이퍼리스' 선언, 20년전과 다른 이유","현대모비스 직원들이 자율좌석제로 운영 중인 스마트오피스에서 화상 회의를 진행하는 모습. 연합뉴스“반드시 필요한 경우를 제외하고 문서를 통한 보고·회의를 지양하겠다. 모든 보직장은 솔선수범하는 모습을 보여달라.”지난 3일 한종희 삼성전자 부회장이 임직원들에게 보낸 e메일 내용이 알려지면서 기업의 ‘페이퍼리스(Paperless,종이 없는)’ 문화에 다시 재계의 관심이 쏠린다.한 부회장은 이날 “대부분의 업무 환경이 디지털화했음에도 아직 회의 자료를 종이로 출력하고, 보고 때도 대면해 보고서로 내용을 확인하는 관행을 쉽게 버리지 못하고 있다”며 “메신저나 이메일을 통해 신속하게 의사결정하고, 회의실에 갖춰져 있는 디지털 장비를 활용해 일하는 습관을 만들어 나가자”고 말했다.삼성전자가 지난달부터 추진해온 ‘노 페이퍼 워크플레이스’ 캠페인에 대한 참여를 최고경영자(CEO)가 다시 한번 유도한 것이다. 이 회사 관계자는 “페이퍼리스는 지난해 9월 발표한 환경경영전략 실행 방안 중 하나”라고 설명했다.━업무 효율화에서 기업문화 변화로기업들 사이에서 종이 사용을 줄이자는 캠페인이 벌어진 것은 최근의 일이 아니다. 2000년대 초반부터LG전자 등 많은 기업이 업무 효율화를 위해 전자문서 시스템을 도입해왔다. 이즈음에 전자결재 방식이 크게 확산했다.회의 문화도 과거와 크게 달라졌다. A대기업 임원은 “몇 년 전만 해도 임원회의 전 회의안을 종이로 출력해 자리마다 한 부씩 뒀지만 요즘엔 주로 개별 모니터를 이용한다”고 말했다. B대기업 임원도 “개인 태블릿에 띄운 회의자료를 수정해 바로 공유하는 문화가 어느 정도 자리 잡았다”고 전했다.한종희 삼성전자DX부문장(부회장)이 지난 3월 21일 서울 중구 '마실'에서 열린 '비스포크 라이프' 미디어데이에서 기조연설을 하고 있다. 사진 삼성전자=연합뉴스하지만 보고 때는 여전히 종이를 주로 쓴다는 게 기업 관계자들의 말이다. 자세한 수치나 도표 등을 함께 보면서 설명해야 할 때가 많아서다. 그럼에도 전반적으로 종이 사용은 줄어드는 추세다. 한국제지연합회에 따르면 인쇄용지 생산량은 2017년 274만2297t에서 지난해 242만166t으로 줄었다.이런 분위기 속에서 다시 기업들이 종이 없는 문화를 강조하는 것은ESG(환경·사회·지배구조) 경영 강화와도 관련 있다. 한 부회장 역시 “지구 위기를 극복하기 위한 동참”을 주문했다. 환경 보호를 위한 활동 중 하나라는 얘기다. 여기에 유연한 기업문화 조성이라는 목적이 더해졌다.SK이노베이션 등SK그룹 주요 계열사는 내부에서는 파워포인트 자료를 만들지 않고, A4 용지 한장으로 보고한다는 원칙을 지키고 있다. 출장 결재 때에도 정해진 품의서 양식 없이 이메일을 통해 출장 계획과 일정을 남긴 뒤 허가를 받으면 된다. 이 회사 관계자는 “기업문화 혁신을 가로막는 요인을 조사했을 때 불필요한 회의와 보고에 대한 불만이 많이 나왔다”며 “CEO역시 종이 자료가 아닌 온라인상PDF자료를 선호한다”고 말했다.김주원 기자━“비용 절감 효과는 크지 않아”재택근무 확산, 자율좌석제 도입 등도 페이퍼리스 문화에 영향을 끼쳤다. C기업 임원은 “나 외에 프린터 쓰는 직원을 본 적이 별로 없다. 종이가 떨어져도 내가 채워 넣는다”며 “이런 방향으로 계속 가면 정말 종이 없는 회사가 될 수도 있지 않겠나”라고 말했다.그렇다 해도 종이가 사라지지는 않을 것이라는 의견도 있다. D대기업 임원은 “아무래도 연령대가 높은 임원은 보고서를 출력해 가져오길 원하고, 빨간 펜으로 그으면서 본다”고 분위기를 전했다. 기업 관계자들은 “경기 불황으로 허리띠를 졸라매야 하는 상황이긴 하지만 기업의 경우 종이 절약이 비용 절감에는 큰 영향을 미치지 않는다”고 전했다.김광현 고려대 경영대학 교수는 “페이퍼리스 문화는 기업들의 탄소중립 달성을 위한 움직임인 동시에 기업문화 변화를 위한 상징적 시도로 볼 수 있다”며 “다만 실제 기업문화 변화로 이어지려면 단순히 종이량을 줄인다는 메시지보다 좀 더 상호적이면서 형식보다 내용에 초점을 맞춘다는 방향성을 공유하는 것이 중요하다”고 말했다."
