date,title,content
2024-01-26,지난해 스타트업 매우 추웠다… 2023년 투자금 ‘반 토막’,"2023년 스타트업 투자 금액 1년 전보다 절반 감소게티이미지뱅크지난해 스타트업 투자 금액이 2022년보다 절반 이상 줄어들었다는 조사 결과가 나왔다.스타트업 지원 기관인 ‘스타트업얼라이언스’가 26일 공개한 ‘2023년 한국 스타트업 투자 동향’ 보고서를 보면, 지난해 스타트업 총 투자 건수는 2022년(1765건)보다 27% 줄어든 1284건으로 5조3388억원 규모의 투자가 이뤄졌다. 2022년 투자 금액 11조1404억원에서 52% 감소했다.스타트업얼라이언스는 “지난해는 스타트업 투자 시장이 얼어붙으며 대규모 투자가 대폭 감소했다”면서 “10억 미만 투자 건수가 전체 투자 건 중 63%(817건)를 차지하며 초기 투자가 강세를 보였다”고 설명했다.투자 건수 상위 분야를 살펴보면, 헬스케어·제조·콘텐츠 및 소셜 분야 등인 것으로 나타났다. 스타트업얼라이언스는 투자 혹한기가 이어지며 중장기적으로 잠재적 가치가 있는 헬스케어 및 딥테크(과학·공학 기반의 원천기술 보유 기업) 분야에 투자가 몰린 것으로 분석했다. 지난해 토스뱅크가 2850억원 규모의 투자를 유치하는 등 금융 및 보험 분야에 가장 많은 금액(7330억원)의 투자가 이뤄졌다. 투자 업계 한 관계자는 “지난해 딥테크 분야에 집중적으로 모태펀드가 조성돼 투자가 몰린 것으로 보인다”며 “정부의 에이아이(AI·인공지능), 딥테크 분야 육성 기조에 맞춰 투자 흐름도 맞춰 간 것이라 생각한다”고 했다.분야별로 보면, 헬스케어에선 에이아이 정밀의료 서비스 ‘임프리메드’와 뇌 질환 에이아이 영상 진단 솔루션 ‘뉴로핏’이 각각 300억원과 200억원을 유치한 것으로 나타났다. 제조 분야의 경우 데이터 처리 가속기(DPU·DataProcessingUnit) 반도체를 개발하는 ‘망고부스트’가 700억원, 맞춤형 반도체 설계 솔루션 ‘세미파이브’가 680억원을 투자받았다. 콘텐츠 분야에선 영상 에이아이 기업 ‘트웰브랩스’가 한국 스타트업으로는 최초로 엔비디아로부터 투자를 유치하기도 했다. 1000억원 이상 대규모 투자를 유치한 스타트업은 토스뱅크, 무신사, 비욘드뮤직, 리벨리온, 오케스트로, 컬리, 디스트릭트 등 모두 9곳이었다.2022-2023년 스타트업 투자, 엑싯(인수합병 및 상장) 동향 비교. 스타트업얼라이언스 제공한편, 투자 혹한기 속에서도 향후 딥테크 등 원천 기술을 가진 스타트업에 돈이 계속 몰릴 것이라는 전망이 나온다. 스타트업 액셀러레이터(초기 투자사) 퓨처플레이의 류중희 대표는 “지난 10년여간 경제 호황기 대규모 투자금을 바탕으로 성장한 플랫폼 강자들이 이미 시장에 자리 잡은 상황에서, 신생 스타트업이 경쟁에서 승리하기 위해선 더 많은 비용을 써야만 한다. 하지만 기술 스타트업은 낮은 비용 효율에서 살아남기에 유리하다. 에이아이·로봇 등 원천 기술이 가진 창의성을 바탕으로 큰 효율을 내며 불황에도 시장에서의 게임 체인저를 노릴 수 있다”고 했다.스타트업얼라이언스는 지난해 1월부터 12월까지 언론보도를 기반으로 벤처캐피탈, 액셀러레이터(초기 투자사), 기업형 벤처캐피탈(CVC) 등 기관 투자를 받은 스타트업을 대상으로 자체 조사를 진행했다. 신약개발 및 대기업과 중견기업의 자회사 형태 스타트업, 엑싯(인수합병 및 상장)한 스타트업은 조사 대상에서 제외했다."
2023-09-25,"자본 확충 급한 토스뱅크, 2850억 유상증자 나선다","토스뱅크 제공토스뱅크가 2850억원 규모의 자본 확충에 나섰다. 건전성을 개선하고 ‘몸집 키우기’의 발판을 마련하려는 움직임이다.토스뱅크는 지난 22일 열린 이사회에서 2850억원 규모의 제3자 배정 유상증자를 결의했다고 25일 밝혔다. 이로써 토스뱅크의 납입자본금은 총 1조9350억원으로 늘어난다. 신규 발행 주식은 보통주 4384만주이며 주당 발행가는 6500원이다.이는 자본비율을 높이려는 움직임으로 풀이된다. 금융감독원 집계를 보면, 바젤1 기준을 적용한 토스뱅크의 자기자본비율(총자본비율)은 지난 6월 말 11.69%이다. 3개월 전보다 1.07%포인트 떨어진 데다, 금융당국의 경영지도비율 10.5%와의 차이도 크지 않다. 자본을 확충하지 않고서는 대출자산을 키우기 어려운 상황이었던 셈이다. 토스뱅크는 유상증자 후 자기자본비율이 13% 안팎으로 올라간다고 설명했다.유상증자로 최대주주 비바리퍼블리카의 지분율은 전환주 포함 28.42%로 낮아진다. 지난해 말 38.39%에서 꾸준히 하락하는 모습이다. 이번 유상증자에서 50억원어치(76만9231주)만 배정받으면서 지분율이 떨어진 것이다. 다른 주주인 한국투자캐피탈이 1080억원을 투입하며 가장 큰 규모로 참여한다. 기존 주주가 아니었던 알토스 코리아 오퍼튜니티 펀드 5·6에서도 400억원을 투자한다. 토스뱅크는 올해 3월에도 2천억원 규모의 유상증자를 실시했는데, 이때도 비바리퍼블리카는 89억원을 투입하는 데 그친 바 있다."
2023-03-17,2천억원 유상증자한다는 토스뱅크…불어난 임금비 부담,"후발주자 토뱅, 고연봉 개발자 대거 채용이 부메랑으로?토스뱅크 상호. 토스뱅크 제공인터넷전문은행 토스뱅크가 출범 1년 반만에 일곱번째 유상증자에 나선다. 불어난 인건비가 이번 자본확충의 또다른 배경이 아니냐는 해석도 나온다.토스뱅크는 17일 2천억원 규모의 유상증자를 추진한다고 밝혔다. 재무안정성을 높이고 사업 확장을 위한 종잣돈을 마련하기 위해서다. 구체적으로 발행가 6500원에 보통주 3077만주를 제3자 배정 방식으로 발행한다. 오는 30일로 예정된 자본금 납입일에 신규 투자자인 한국투자캐피탈을 포함해 하나은행 등 신주를 배정받은 주주들이 주식 인수대금을 모두 치르면, 토스뱅크의 납입자본금은 1조6500억원으로 불어난다. 토스뱅크는 “높아진 대외변동성으로 투자시장이 얼어붙은 가운데서도 높아진 기업가치를 인정받고 신규 주주까지 확보하는 성과를 달성할 수 있다”고 말했다.토스뱅크는 유상증자 결정 소식과 함께 ‘2022년 지배구조 및 보수체계 연차보고서’도 공시했다. 이를 보면, 지난해 이 은행의 임직원 보수총액은 462억6천만원으로 전년(139억7천만원) 대비 3.3배 증가했다. 임직원 1인당 평균 연봉을 기준으로는 6100만원에서 1억1900만원으로 두배 가까이 올랐다. 경쟁사인 카카오뱅크(29.2%)와 케이뱅크(38.3%)의 인건비 증가율과 비교하면 압도적으로 높은 수준이다.다만 토스뱅크가 2021년 10월부터 영업한 점을 염두에 두면, 같은 기간에 견준 임금총액 상승폭으로 보기는 어렵다. 그럼에도 토스뱅크가 인터넷전문은행 후발주자로서 출범 전후로 은행권과 아이티 업계에서 보수 수준이 높은 고연차 개발자를 대거 채용해 왔다는 점에서 임금 등 인건비가 경영 수지에 부담을 줄 수 있다는 우려도 일부에서 나온다. 비용 부담이 커 경영 수지가 지속적으로 나빠지게 되면 재무안정성이 흔들린다. 불어난 인건비가 유상증자의 또다른 배경일 수 있다는 얘기다.전문가들은 지금처럼 금융시장 변동성이 커 경영 환경이 악화되는 시기엔 지나친 인건비 지출은 바람직하지 않다고 지적한다. 이효섭 자본시장연구원 금융산업실장은 “글로벌 은행들도 비용을 줄이고 정부도 임직원 성과급 체계나 업적 평가 기준 개선을 검토하는 현재 같은 시기에 고액 연봉자를 많이 데려오려다 과도하게 비용을 집행한 부분은 긍정적인 모습으로 보기는 어렵다”고 말했다."
2023-12-17,부산·대구·경기 등 6개 PF사업 정상화에 2600억 투자,"여신금융협회, 참여사에 자금집행 요청정완규 신임 여신금융협회장이 지난해 10월 서울 중구 여신금융협회에서 취임 기자간담회에 참석해 발언하고 있다. 연합뉴스캐피탈사 등 여신전문업권이 부동산 프로젝트파이낸싱(PF) 사업장 정상화를 위해 마련한 지원펀드가 사업부지 인수 등 본격 투자에 돌입한다.여신금융협회는 17일 ‘피에프(PF) 정상화 지원펀드’에 출자금 납입을 완료하고 피에프 사업부지 인수 등 약 2600억원 투자에 돌입한다고 밝혔다.협회는 지난 12일 참여사와 펀드투자계약 체결을 완료하고, 13일 자금집행 요청을 마쳤다고 밝혔다. 운용사인 한국투자리얼에셋은 펀드 출시를 위해 피에프 사업장을 선별해 투자 타당성을 검토하고 현장실사를 마쳤다. 자금부족 등으로 사업진행이 일시적으로 어려워진 사업장 가운데 정상화가 가능한 사업장을 선별해, 부산·대구·경기 등 6개 사업장이 최종 선정됐다. 4개 사업장에는 투자 일정이 확정됐고 2개 사업장은 투자 일정을 조율하고 있다.4개 사업장은 선순위채권 매입과 중후순위 채권의 출자전환을 통한 사업부지 인수 방식이 될 예정이다, 2개 사업장은 사업자금(이자 또는 운영자금) 지원 방식으로 이뤄진다. 오는 1월 말까지 여전업권 출자금 1600억원에다 재무적 투자자의 투자금 1000억원(잠정)을 포함한 2600억원가량이 집행될 예정이다.정완규 여신금융협회장은 이번 펀드에 대해 “정상화 지원 펀드에 업계 최초로 재무적 투자자를 유치한 사례로 여전업권의 건전성을 제고할 뿐 아니라 시장자율 조정기능을 통해 사업장 재구조화 촉진에 기여할 것”이라고 밝혔다.지난 9월 여전업권은 시장 자율의 피에프 사업장 재구조화를 촉진하고자 주요 캐피탈사 주도의 펀드를 조성해 운영하기로 하고 출범식을 개최한 바 있다. 신한·하나·케이비(KB)·우리금융·아이비케이(IBK)·메리츠·비엔케이(BNK)·엔에이치(NH)농협·디지비(DBG) 등이 참여한다."
2022-09-22,국내 스타트업 지원 ‘한-미 공동 펀드’ 2억달러 조성,"중기부 주최 ‘한-미 스타트업 서밋’서 결성 협약이영 중소벤처기업부 장관(오른쪽)이 20일(현지시간) 미국 뉴욕 ‘피어(Pier) 17’에서 열린 ‘한·미 스타트업 서밋’ 행사장을 방문해 현장을 둘러보고 있다. 중소벤처기업부 제공국내 신생기업(K-스타트업)의 투자와 국외 진출을 뒷받침하는 2억1500만달러(약 3천억원) 규모의 한-미 공동 펀드가 조성된다.중소벤처기업부는 모태펀드를 운영하는 한국벤처투자와 미국의 벤처캐피탈 아르피에스(RPS) 벤처스, 밀레니엄 테크놀로지 밸류 파트너스, 어플라이드 벤처스가 총 2억1500만달러 규모의 공동 펀드를 조성해 국내 스타트업의 투자와 해외 진출을 지원하기로 약속했다고 22일 밝혔다. 공동 펀드는 국내 신생기업이 글로벌 벤처캐피털과 관계망을 형성하고, 이를 통한 투자유치뿐 아니라 세계시장으로 나아가는 데 큰 힘이 될 것으로 기대한다고 중기부는 밝혔다.이번 한-미 공동 펀드 결성 약속은 중기부가 미국 뉴욕 ‘피어(Pier) 17’에서 개최한 ‘한-미 스타트업 서밋’을 계기로 이뤄졌다. 서밋은 20일(현지시각)부터 이틀 동안 열렸으며, 21일에는 구글·오라클 등 미국의 글로벌 기업, 벤처캐피털, 스타트업과 현대자동차 등 한국의 글로벌 기업, 스타트업이 모여 글로벌 진출을 위한 공동 협력 방안을 모색하고 상호 협력하기로 뜻을 모았다.사전 행사로 열린 ‘글로벌 대기업 좌담회’에서 오라클 쪽은 내년부터 한국의 스타트업이 오라클 제품과 기술·경영 노하우를 활용해 성장할 수 있도록 한국 정부와 함께 스타트업 공동육성 프로그램을 기획·운영할 예정이며, 인공지능·클라우드 분야의 20개 스타트업을 지원할 계획이라고 밝혔다.이영 중기부 장관은 “미래 핵심 기술을 발전시키기 위한 스타트업의 역할이 중요하다는 것에 공감한다”며 “이번에 논의된 내용을 세밀히 검토해 정부와 대기업, 스타트업의 협력이 긴밀하게 이뤄질 수 있도록 적극 지원할 것”이라고 말했다. 이 장관은 이어 “이번 서밋을 통해 한-미 양국 스타트업 생태계 관계자들의 스타트업 지원 의지를 다시 확인하는 계기가 됐다. 한-미 스타트업 생태계 협력을 바탕으로 ‘K-스타트업’이 세계로 뻗어 나가 글로벌 유니콘(기업가치 1조원 신생기업)으로 성장하길 기대한다”고 덧붙였다."
2023-03-28,"현대캐피탈, ‘K-택소노미’ 따른 녹색채권 6천억 발행","현대캐피탈 사옥 로비 전경. 현대캐피탈 제공현대캐피탈이 올해 금융권에서는 처음으로 녹색채권을 발행했다. 6천억원 규모로 이뤄진 이번 발행은 올해부터 개정·시행된 한국형 녹색분류체계(K-택소노미)를 반영한 첫 사례다.현대캐피탈은 28일 6천억원 규모의 녹색채권을 발행했다고 밝혔다. 이번 채권 발행으로 조달한 6천억원은 전액 현대자동차그룹의 전기·수소 차량 구매 관련 대출 재원으로 쓰일 예정이다. 이번 채권 평가사인 나이스(NICE)신용평가사는 “약 2만대 가량의 친환경차량을 보급하는 효과가 있을 것으로 판단한다”고 했다.만기별로는 2년물 200억원, 2.5년물 1천억원, 3년물 700억원, 4년물 600억원, 5년물 3500억원으로 구성됐다. 발행금리는 연 3.897∼4.271%로 설정됐고, 2.5년물만 변동금리로 판매된다. 2.5년물 금리는 발행일 기준 3개월마다 돌아오는 이자지급일 직전 1영업일의 91일물CD금리(금융투자협회 고시 기준)에 0.7%포인트를 더한 금리가 적용될 예정이다. 이번 채권발행에는 케이비(KB)증권, 교보증권, 미래에셋증권, 한국투자증권, 하이투자증권, 키움증권 등 6개 증권사가 공동 인수단으로 참여했다.녹색채권은 온실가스 감축, 기후변화 적응 등 정부가 지정한 6대 환경목표 달성에 기여하는 경제활동에 투자할 목적으로 자금을 조달하는 채권을 말한다. 환경부는K-택소노미에 이 같은 경제활동 64개를 구체적으로 규정하고 있는데, 전기차 제조나 전기충전소 설치 같은 활동이 대표적이다. 녹색채권 발행사는 환경부가 승인한 기관의 심사를 거쳐 이에스지(ESG)채권 인정을 받아 녹색채권을 발행할 수 있다. 녹색채권은 상장수수료와 상장연부과금 등이 면제된다. 현대캐피탈의 이번 채권을 평가한 나이스신용평가사는 “활동기준, 인정기준, 배제기준, 보호기준을 모두 충족해 한국형 녹색분류체계에 적합하다”고 평가했다. 이 신용평가사는 이 채권에AA+ 등급을 부여했다. 한국신용평가와 한국기업평가는AA등급을 매겼다.이번 발행 규모는 지난해 이뤄진K-택소노미 시범사업 기간 동안 발행된 전체 녹색채권 발행 규모에 육박한다. 환경부가 지난해 12월 공개한 ‘한국형 녹색분류체계 시범사업’ 결과를 보면 지난 2021년 12월부터 지난해 12월까지 1년간 발행된 녹색채권 규모는 6400억원이다."
2023-06-08,"SK온, 5300억원 유치… 투자금 충전 ‘녹색불’ 켜지나","에스케이온 서산공장 외관. 사진 에스케이온 제공.에스케이(SK)이노베이션의 배터리 자회사 에스케이(SK)온이 투자금 5300억원을 추가 유치했다. 지난해부터 확보한 상장 전 투자 유치 금액이 목표치(4조원)를 넘어 5조원 가까이 모였다고 에스케이온은 설명했다.8일 에스케이(SK)이노베이션은 이사회를 열어 에스케이(SK)온 투자 유치를 위한 주주간 계약 체결의 건을 승인했다고 밝혔다. 직전 투자유치에 성공한 지 9일(영업일 기준) 만이다. 에스케이이노베이션, 에스케이온, 신규 재무적투자자 간의 계약으로, 에스케이온은 신규 투자자로부터 4억달러(약 5300억원) 가량을 받는다. 싱가포르에서 주로 활동하는 기업인 엔지제트(ENGZ) 홀딩스 등 3곳은 에스케이온이 발행하는 전환우선주(일정 기간 뒤 보통주로 전환할 수 있는 우선주)를 매입하는 방식으로 자금을 댄다.이날 결정된 투자까지 합하면 에스케이온은 지난해부터 최대 4조9700억원의 자금을 지분 투자 형태로 조달하게 된다. 에스케이온은 지난해부터 프리IPO(상장 전 투자유치)를 진행했는데 목표 금액은 4조원이었다. 에스케이온은 앞서 한국투자PE이스트브릿지컨소시엄에서 1조2000억원, 모회사SK이노베이션에서 2조원,MBK컨소시엄과SNB캐피탈에서 각 8억 달러(약 1조400억원), 1억4400만 달러(약 1900억원) 한도 투자를 유치한 바 있다.여기에 유로본드 1조2천억원, 현대차와 기아로부터의 차입금 2조원 등을 포함하면 에스케이온이 지난해 말부터 이달까지 확보한 자금은 최대 8조1700억원에 이른다. 유로본드는 타국 기업이 채권 발행 국가의 것이 아닌 통화로 발행, 유통하는 모든 채권을 의미한다.에스케이온은 이런 자금 조달 성과가 시장이 회사의 발전 가능성을 매우 높이 평가하고 있다는 방증이라고 설명했다. 에스케이온은 “세계 금융환경이 어려운 가운데 성공적으로 진행된 이번 상장 전 지분투자 유치는 전기차 배터리 시장의 성장 가능성, 에스케이온의 발전 가능성에 자본시장이 공감했다는 의미를 갖는다”고 설명했다.에스케이온은 중국, 헝가리 등에서의 자체 공장, 포드와 현대자동차그룹 등 완성차업체와 배터리 합작공장 건설을 추진하고 있다. 특히 포드와 현대차그룹과 함께 짓는 배터리 공장 건설을 위한 대규모 자금이 필요한 상황이었다. 에스케이온 쪽은 확보한 투자금을 바탕으로 2025년까지 연간 생산능력을 최소 220GWh로 확대하는데 속도를 내겠다고 밝혔다."
2023-05-24,SK온 1조2천억 투자 조달… 현대차에선 2조원 차입,"엠비케이(MBK)컨소시엄으로부터 1조500억원최태원 대한상의 회장(오른쪽)과 정의선 현대차그룹 회장이 2022년 5월24일 서울 중구 대한상공회의소에서 열린 신기업가정신 선포식에서 악수하고 있다. 연합뉴스에스케이(SK)이노베이션의 배터리 자회사 에스케이온이 현대차·기아로부터 2조원을 빌리고, 외부 투자자로부터 상장 전 지분투자 방식으로 최대 1조2400억원을 받기로 했다. 에스케이온이 이번 투자까지 조달한 금액(차입 포함)은 모두 6조4400억원에 이른다. 에스케이온이 미국 등에 배터리 생산능력을 확대하는 과정에서 투자 부담이 커지고 있는 상황으로 보인다.에스케이이노베이션은 24일 공시를 통해 에스케이온이 현대자동차와 기아로부터 2조원을 차입하는 것에 대해 채무보증을 한다고 밝혔다. 에스케이이노베이션은 “에스케이온이 다양한 재원확보 방법을 통해 자금 조달의 안정성을 제고하고 고객사는 배터리셀의 안정적 확보와 전략적 파트너십 강화 등 시너지 효과가 기대된다”고 밝혔다.에스케이온은 현대차 그룹과 함께 2025년까지 6조5000억원을 들여 미국 조지아주에 연간 35기가와트시(GWh) 생산규모의 전기차 배터리셀 합작공장을 짓기로 한 바 있다. 전기차 약 30만대에 탑재할 수 있는 규모다. 이 합작공장은 현대차그룹과 에스케이온이 투자총액의 50%를 절반씩 부담하고, 나머지 50%는 합작법인의 차입으로 조달할 계획이었다. 에스케이온이 출자할 금액은 1조6200억원이었다. 에스케이온 관계자는 “현대차·기아로부터 빌리는 돈 2조원의 용도는 밝히기 어렵다”고 말했다. 현대차 쪽도 “파트너사와의 협력강화를 위한 것”이라고 설명했다.이날 에스케이이노베이션은 이사회를 열어 에스케이온 투자유치를 위한 주주간 계약 체결의 건도 승인했다. 에스케이이노베이션과 에스케이온, 엠비케이(MBK)컨소시엄 간에 계약을 체결해, 에스케이온은 엠비케이컨소시엄으로부터 8억달러(약 1조500억원)를 한도로 투자 받을 예정이다. 엠비케이컨소시엄에는 미국, 중동 지역 등의 글로벌 재무적 투자자들이 참여한다.이와 더불어 한국투자피이(PE)이스트브릿지컨소시엄을 통해 투자를 논의중이던 사우디아라비아 최대 상업은행 사우디국립은행(SNB) 자회사 에스엔비캐피탈도 최대 1억4400만달러(약 1900억원)를 투자하기로 했다. 이에 따라 에스케이온이 받을 투자금은 모두 9억4400만 달러(약 1조2400억원)에 이른다. 에스케이온은 “세계 금융환경이 신규 자본유치에 부정적인 흐름을 이어가고 있지만, 전기차 배터리 사업의 성장성과 에스케이온의 기술 경쟁력이 자본시장에서 인정을 받은 것”이라고 밝혔다.에스케이온은 한국과 미국, 중국, 헝가리에서 전기차 배터리 공장을 운영하고 있으며, 2022년 88기가와트시인 연간 생산능력을 2025년 최소 220기가와트시로 늘릴 계획이다. 업계에선 통상 10기가와트시 규모의 배터리셀 생산능력 확장에 1조원 이상의 투자자금이 소요된다고 본다.에스케이온이 이번 투자까지 조달한 금액(차입 포함)은 모두 6조4400억원에 이른다. 앞서 한투피이(PE)이스트브릿지컨소시엄을 통해 1조2천억원, 모기업인 에스케이이노베이션으로부터 2조원을 투자받아 3조2천억원을 확보한 바 있다."
2023-04-27,“벤처투자사 여기 모였다”…서울 테헤란로에 ‘투자허브’ 개관,"‘서울창업허브 스케일업센터’ 개관투자사·액셀러레이터 입주 추진27일 개관한 서울창업허브 스케일업센터 경관. 서울시 제공서울시가 강남구 역삼동 테헤란로에 스타트업 전문시설 ‘서울창업허브 스케일업센터’를 개관한다. 스타트업 투자 지원을 위한 벤처투자사를 한곳에 모은 입주공간이다.27일 서울시는 “강남에 벤처캐피탈과 스타트업이 집적돼 있어 스타트업 성장의 중심지로 자리 잡았지만 관련 지원 공간은 전무한 상황”이라며 “민간 투자자, 액셀러레이터, 스타트업 간 투자 교류의 거점이 될 것”이라고 밝혔다.서울시는 최근 스타트업 투자 심리가 위축된 점을 고려해, 투자에 어려움을 겪는 우수 스타트업을 발굴하고 투자사와 적극 연계한다. 규모 있는 벤처투자사가 이곳에 입주할 수 있도록 서울시는 평당 사용료를 주변 시세의 80% 수준으로 조정해 입주기업을 공개 모집했다. 현재 이곳에는 벤처투자사 세 곳(하나벤처스, 빅뱅벤처스, 트라이앵글파트너스)과 액셀러레이터 두 곳(와이앤아처, 홍합밸리)이 입주해 있는데 앞으로 2~3개사를 추가 선발할 계획이다.서울시는 또 민간 투자기관과 함께 투자유치행사를 수시로 개최해 매년 10개 기업을 발굴, 최대 5천만원까지 사업지원금을 지원한다. 또 스타트업이 빠르게 성장할 수 있도록 1조4천억원 규모의 전용 펀드도 조성한다. 아울러IBK기업은행과 협력해 총 1천억원 규모IBK벤처대출상품을 지원한다. 한국금융투자협회와도 협약을 맺고 557개 회원사와 연계한 스타트업 데모데이(투자유치 행사) 등을 개최할 예정이다."
