date,title,content
2023-03-21,빌딩·한우·와인 이어 경주마도 질주… 조각투자 전성시대,"마사회 “조각투자 플랫폼 내년 출범”지난 14일 제주시 한국마사회 제주목장에서 올해 첫 국산 경주마 경매가 진행되고 있다. 소액 투자로 값비싼 경주마의 마주(馬主)가 될 수 있는 길이 열린다. 마사회는 주식 투자처럼 간편하게 경주마의 지분을 사고 팔 수 있는 조각 투자 플랫폼을 출범시킬 계획이다./연합뉴스“내 말[馬]이 이번 주말 과천 경마장에서 경기를 뛴다네. 부계 혈통이 좋고 체격도 커서, 승률이 높은 편이야. 얼마에 샀냐고? 10만원 투자했다네.”지금은 허풍처럼 들리는 이런 자랑이 현실이 될 가능성이 높아졌다. 부유층의 전유물로 여겨져 왔던 경주마에 일반인도 소액으로 ‘조각 투자’ 할 수 있는 방안이 추진되고 있기 때문이다.17일 금융투자 업계에 따르면, 한국마사회는 지난달 경주마에 대한 조각 투자 사업이 현행법상 가능한지 내부 검토를 진행한 결과 ‘가능하다’는 결론을 내린 것으로 알려졌다. 현행 자본시장법상 크라우드펀딩(인터넷 소액 모금)이나 투자계약증권(공동 사업에 투자 후 손익을 배분하는 증권) 등의 형식으로 다수의 투자자가 경주마에 지분 투자하는 것이 가능하다는 뜻이다. 마사회 관계자는 “향후 상품성 등에 대한 추가 검토를 바탕으로 이르면 내년 말까지 조각 투자 플랫폼을 출범시킬 계획”이라고 말했다.조각 투자란 개인이 혼자서 투자하기 어려운 고가의 자산들을 지분 형태로 쪼갠 뒤 여러 투자자가 공동으로 투자하는 방식이다. 최근 부동산과 음악 저작권 등 다양한 자산 시장에 불고 있는 조각 투자 열풍이, 평균 가격이 수천만 원대를 호가하는 경주마 시장까지 확산한 것이다. 금융투자 업계에선 “조각 투자 대상이 점점 다변화하면서 자산 종류를 가리지 않고 보편적인 투자 방식으로 자리매김하고 있다”는 말이 나온다.경주마·미술품·한우… 없는 게 없는 조각 투자 시장조각 투자는 요즘 금투 업계에서 가장 뜨거운 아이템 중 하나다. 소액으로 투자하고 싶은 ‘MZ세대(1980년대 초~2000년대 초 출생)’와 새 시장을 만들려는 핀테크 업체들의 수요가 맞아떨어지면서 관련 시장이 커지고 있다. 이미 상업용 부동산, 미술품, 음악 저작권, 한우, 시계·와인 등 고가품 등을 대상으로 한 조각 투자 플랫폼이 만들어졌다. 예술경영지원센터에 따르면 지난해 상반기 미술품 조각 투자 시장 규모는 545억원, 하반기는 그보다 많은 900억원으로 추정된다. 지난 2020년 출범한 한우 송아지 조각 투자 플랫폼인 ‘뱅카우’엔 2년 만에 송아지 1500여 마리가 투자 대상으로 등록됐다.이번에 도입될 경주마 조각 투자도 기존 조각 투자와 같은 ‘지분 투자’로 진행된다. 예를 들어, 투자금 10만원으로 시가 1억원짜리 경주마의 지분 0.1%를 취득할 수 있다. 이후 말 가치가 상승해 2억원이 되면 지분 가치도 20만원으로 올라, 차익을 보고 팔 수 있다. 또 경주마가 받아오는 경마 상금도 지분율만큼 나눠 받는다. 주식으로 치면 ‘시세 차익’과 ‘배당금’을 모두 노릴 수 있는 것이다. 미국과 일본 등에서는 이미 경주마 조각 투자가 이뤄지고 있다.토큰 증권 도입으로 더 커지는 시장최근 금융 당국은 조각 투자에 블록체인 기술을 결합한 ‘토큰 증권’을 도입하기로 했다. 기존 증권과 달리 거래 장부(원장)를 투자자들이 나눠 갖는 방식이다. 그간 법의 사각지대에 있었던 조각 투자를 제도권 안으로 넣으려는 조치이기도 하다. 토큰 증권이 조각 투자와 완전히 일치하는 것은 아니지만, 토큰 증권이 도입되면 대부분의 조각 투자는 토큰 증권으로 전환될 전망이기 때문이다. 특히 조각 투자 형태의NFT(Non-FungibleToken·대체 불가 토큰) 상당수가 토큰 증권으로 넘어갈 것으로 예상된다.증권 업계도 토큰 증권 플랫폼을 새로 구축하며 금융 당국에 화답하고 있다.KB증권은 작년 11월부터SKC&C와 토큰 증권 거래 플랫폼 구축을 준비해 올해 상반기 서비스를 출시할 예정이다. 또 신한증권과 에이판다파트너스가 공동으로 제안한 블록체인 기반 금전채권 신탁수익증권 거래 플랫폼은 지난해 12월 금융위원회의 혁신 서비스로 지정됐다. 미래에셋증권은 한국토지신탁과 업무협약(MOU)을 맺고 신탁수익증권 방식의 토큰 증권 서비스 제공을 위해 내부 시스템을 구축하고 있다.금투 업계 관계자는 “토큰 증권이 실제 법제화돼 조각 투자가 제도권으로 편입되면, 조각 투자 종류도 더 다양해지고 시장 규모도 확대될 수 있다”고 말했다."
2023-02-16,“토큰 증권 시장 선점하라” 증권사들 벌써부터 경쟁,"부동산·미술품·저작권 등 디지털 조각투자 곧 본격화“(부동산이나 미술품 등에 대한 조각 투자처럼) 최근 등장한 비정형적인 증권을 소액 발행하는 경우에는 기존처럼 증권사를 통해 중앙집중적으로 전자등록·관리되는 전자 증권 형태가 부적합해 새로운 발행 형태가 필요하다.”지난 6일 금융위원회는 ‘토큰 증권(ST·SecurityToken) 발행·유통 규율체계 정비 방안(이하 가이드라인)’을 발표하면서 토큰 증권의 필요성에 대해 이렇게 설명했다. 토큰 증권이 도입되면 미술품, 부동산, 음악 저작권 등 기존에는 잘게 쪼개서 거래하기 어려웠던 다양한 실물 자산을 디지털화해 주식처럼 거래할 수 있게 된다. 금융위가 가이드라인을 발표한 이후 증권사들은 새로운 먹거리를 선점하기 위해 빠르게 움직이고 있다.‘뭐든 조각 내서 팝니다’?토큰 증권은 블록체인의 가장 중요한 기능인 분산원장 기술을 기반으로 디지털화된 증권이다. 기존의 전자 증권은 증권사 중앙 서버에 모든 데이터가 기록·관리되는 반면 토큰 증권은 거래 장부(원장)를 참여자들이 나눠 갖는다는 것이다. 기술적인 배경은 비트코인 등 가상화폐와 같지만 실물 자산을 바탕으로 한다는 점이 다르다.금융위는 가이드라인에서 토큰 증권을 허용하는 한편, 앞으로 자본시장법에 따라 증권 규제를 적용한다고 밝혔다. 현행 자본시장법과 전자증권제도에는 블록체인 기술과 이를 활용한 비정형적인 증권(예컨대 토큰 증권)에 대한 규율이 없다. 당국의 이번 가이드라인은 법의 사각지대에 있었던 부동산, 미술품 등 조각 투자를 제도권 안으로 넣기 위한 조치로 볼 수 있다.토큰 증권이 조각 투자와 완전히 일치하는 것은 아니지만, 토큰 증권이 도입되면 대부분의 조각 투자는 토큰 증권으로 전환될 전망이다. 특히 조각 투자 형태의NFT(Non-FungibleToken·대체불가토큰) 상당수가 증권형 토큰으로 넘어갈 것으로 예상된다.NFT는 아직까지 공식적으로 당국의 허가를 받지 않았기 때문이다.증권사들 “수혜자는 나야 나”증권업계는 ‘토큰 증권 발행·유통’이 허가되면서 새로운 시장이 열릴 것으로 기대하고 있다. 주식뿐 아니라 부동산, 미술품, 귀금속 등 유형자산, 음악 저작권 등 무형자산까지 조각 투자가 가능해지면 중개할 상품이 기하급수적으로 늘어난다는 것이다. 한국금융연구원 보고서에 따르면 독일 금융서비스 플랫폼 기업인 피노아는 2027년까지 증권형 토큰 시장의 시가총액이 24조달러(약 2경9570조원)에 이를 것으로 전망했다.적극적으로 나서고 있는 주요 증권사는KB증권과 신한투자증권, 미래에셋증권 등이다.KB증권은 지난해 11월부터SKC&C와 토큰 증권 거래 플랫폼 구축을 준비해 올해 상반기 서비스를 출시할 예정이다. 신한증권은 에이판다파트너스와 함께 제안한 블록체인 기반 금전채권 신탁수익증권 거래 플랫폼이 지난해 12월 금융위원회 혁신 서비스로 지정됐다. 미래에셋증권은 한국토지신탁과 업무협약(MOU)을 맺어 신탁수익증권 방식의 토큰증권 서비스 제공을 위한 내부 시스템을 구축하고 있다.업계에서는 개인 고객 수가 업계 1위인 키움증권이 가장 큰 수혜자가 될 수 있다는 전망이 나온다. 조각 투자는 상대적으로 기관보다 개인들이 많이 이용할 공산이 높기 때문이다. 키움증권은 뮤직카우, 비브릭, 펀블, 카사, 테사 등 총 8개 기업과 협업해 증권형 토큰 유통 플랫폼을 준비 중이다.SK증권,NH투자증권, 대신증권, 하나증권, 교보증권, 한국투자증권 등도 조각 투자 플랫폼 기업과 손을 잡거나 인수를 추진 중이다.“국내STO잠재력 무궁무진”전문가들은 투자자산 다양화라는 측면에서STO(SecurityTokenOffering·토큰 증권 상장) 시장이 확대될 것으로 보고 있다.STO를 통해 일부 가상자산을 가장 먼저 제도권에 편입한 미국의 경우 토큰 증권을 신생 벤처기업의 자금 조달 수단으로 승인했다. 블록체인 기반 스타트업인 블록스택은 지난 2019년STO를 통해 2800만달러(약 358억8200억원)를 조달하기도 했다.국내 토큰 증권 시장도 빠르게 성장할 전망이다. 박혜진 대신증권 연구원은 “단순히 부동산만 놓고 보더라도 2022년 기준 한국 부동산 공시지가 총 합계는 7155조원이고 국내 미술시장 거래 규모는 1조400억원까지 성장했다”며 “개인거래 비중이 70%에 육박하는 한국 주식시장 규모가 2400조원임을 감안하면 국내에 수치화 시킬 수 있는 자산의 종류와 규모는 무궁무진하다”고 했다.☞토큰 증권블록체인 기술을 활용해 자본시장법상 증권을 디지털화한 것. 실물자산이 없는 가상화폐와 달리 부동산, 미술품, 음악 저작권 등 유·무형의 실물 자산과 연계돼 있다. 토큰 증권을 발행·유통하는 것을STO(SecurityTokenOffering) 사업이라고 한다."
2023-03-06,"전문성 낮은 조합 설립하는 대신… 재개발·재건축, 신탁 방식 선택 늘어","올 들어 서울 재개발·재건축 단지에서 신탁 방식으로 정비사업을 추진하는 곳이 늘고 있다. 부동산 경기 침체 여파로 자금 조달에 어려움을 겪는 데다, 공사비를 둘러싼 조합과 시공사 간 갈등이 잦아지면서 전문성과 자금력이 떨어지는 조합을 설립하는 대신 신탁사 문을 두드리는 것이다.5일 정비업계에 따르면, 서울 금천구 시흥동 ‘남서울럭키아파트 재건축 추진준비위원회’는 지난달 26일 금천구청에서 신탁사 현장 설명회를 개최했다. 한국토지신탁,KB자산신탁, 한국자산신탁이 설명회에 나서 신탁방식 정비사업의 장점과 신탁사별 정비사업 실적, 신용도, 사업 방식에 대해 설명했다. 정부의 재건축 규제 완화로 지난 1월 안전진단을 최종 통과한 남서울럭키아파트는 설명회에 참여한 주민들을 대상으로 설문조사를 거쳐 이달 중 우선협상대상 신탁사를 선정할 예정이다.서울 양천구 신월동 ‘신월시영아파트 재건축 추진준비위’ 역시 지난달 소유자를 대상으로 재건축 방식에 대한 설문조사를 실시했는데, 소유주의 91.8%가 ‘신탁’ 방식을 선택했다. 준비위는 오는 11일 여러 신탁사를 초청해 재건축 2차 사업설명회를 개최할 예정이다. 이 밖에 서울의 영등포구 양평동1가 ‘신동아아파트’,종로구 ‘창신10구역’,강서구 ‘방화2구역’,동작구 ‘상도14구역’ 등 여러 사업지에서 신탁 방식을 추진하고 있다.일반적인 재건축 사업은 주택 소유주로 구성된 조합이 시공사 선정과 각종 인허가, 분양 등 모든 절차를 맡아 진행한다. 반면, 신탁 방식은 신탁사가 수수료를 받고 소유자를 대신해 정비사업을 한다. 신탁사가 시행을 맡으면 추진위원회 구성에서 조합 설립 인가까지 걸리는 4년가량의 시간을 줄일 수 있고, 초기 사업비도 신탁사가 조달해 원활한 사업 진행이 가능하다. 다만, 신탁 수수료가 총 분양비의 2~4%에 달하고, 주민들의 이해도가 낮아 지금까지 신탁으로 정비사업을 추진하는 단지가 거의 없었다.그런데 최근 공사비 증액 등의 문제로 조합과 시공사 간 갈등이 심화하고, 공사가 연기되거나 중단될 위기에 처하는 단지도 늘면서 신탁 방식으로 눈을 돌리는 사업지가 늘고 있다. 한 신탁사 관계자는 “예전에는 신탁사에서 정비사업지를 찾아가 설명회 개최를 요청했는데, 요즘은 사업지에서 먼저 요청하는 경우가 더 많다”고 했다."
2024-07-11,"[단독] 수십억 배임 혐의…검찰, 한국토지신탁 회장 수사 착수","서울중앙지검이 차모 한국토지신탁 회장 일가에 대한 수사에 착수했다. 연합뉴스검찰이 한국토지신탁 비리 의혹과 관련해 A회장에 대한 수사에 착수한 것으로 파악됐다.10일 중앙일보 취재를 종합하면, 서울중앙지검 반부패수사3부(부장 이승학)는 지난달 초 금융감독원으로부터 한국토지신탁에 관한 조사 자료를 임의 제출받아 대주주인 A회장 등을 특정경제가중처벌법상 수재 및 배임 혐의 등으로 수사하고 있다.앞서 금융감독원은 지난 5월 8일 양대 부동산 신탁사인 한국토지신탁과 한국자산신탁 대주주 및 임직원들의 불법·불건전 사익 추구 행위 검사 결과를 발표했다. 당시 금감원은 “한 부동산 신탁사의 대주주 및 임직원들이 부동산 신탁 사업 관련 직무를 수행하며 분양대행업체 등 용역업체 대표 및 직무 관련자로부터 45억원 상당의 금품 및 법인카드 등을 수취하여 사적으로 사용했다”는 혐의(특경법상 수재)를 포함해 5가지 주요 검사 결과를 공개했다. 검찰이 금감원으로부터 넘겨받은 계좌 내역 등 자료를 토대로 살펴보고 있는 혐의 중에는 용역업체로부터 수취한 금품이 강원랜드 도박자금 등으로 흘러간 내용도 포함된 것으로 파악됐다.검찰은 이같은 금감원 조사를 단초로 A회장이 보유한 그룹사 전체를 전반적으로 들여다보겠다는 계획이다. A회장은 1990년대 초반 호남 지역 건설사를 시작으로 전자업체와 한국토지신탁을 인수합병(M&A)하면서 사세를 확장해왔다. 최근 들어 대기업 계열사인 건설사에 이어 조선회사까지 인수해 주목을 받았다. A회장의 가족과 주변인들은 그룹 주요 계열사의 전·현직 대표나 임원진에 다수 이름을 올렸다.한국토지신탁 관계자는 금감원 검사 결과와 검찰 수사 착수와 관련 중앙일보의 질의에 대해 “특별히 드릴 말씀이 없다”고 밝혔다."
2024-10-31,[단독] 이자만 37%…'용역업체 갑질' 한국자산신탁 직원 등 압색,"검찰이 31일 한국자산신탁 전·현직 직원들을 용역업체로부터 불법 금품을 수수한 혐의로 압수수색하고 있다. 연합뉴스검찰이 국내 대표 부동산신탁사 중 하나인 한국자산신탁 전·현직 직원들을 불법 금품수수 혐의로 31일 압수수색하고 있다. 이들은 용역업체 등으로부터 계약 유지 등의 명목으로 금품을 뜯어낸 혐의를 받는다.서울중앙지검 반부패수사3부(부장 이승학)는 이날 오전부터 한국자산신탁 전·현직 직원들의 주거지와 사무실 10여 곳을 특정경제범죄가중처벌법상 수재 및 사금융 알선, 대부업법 위반, 이자제한법 위반 등 혐의로 압수수색하고 있다. 올 상반기 금융감독원의 수사의뢰에 따른 것이다.금감원은 지난 5월 한국토지신탁과 한국자산신탁 2곳의 불법·불건전 행위 집중검사 결과 발표를 시작으로 정부 관리·감독의 사각지대로 꼽혔던 부동산신탁사들에 대한 기획 검사를 확대해왔다.금감원에 따르면 한국자산신탁 전·현직 직원들은 본인이나 가족이 소유한 개인법인을 통해 시행사 등에 토지매입자금 명목으로 25억원 상당을 대여·알선하고, 이자 명목으로 7억원을 받아냈다. 실 이자율이 법정 최고이자율(연 20%)을 뛰어넘는 37%에 달한다. 용역업체를 상대로 우월적 지위를 이용해 사실상의 ‘고리대금업’을 벌인 셈이다. 이 밖에도 용역업체 등에 무상으로 돈을 빌리거나 건네받은 혐의 등도 검찰 수사에 포함된 것으로 파악됐다.이날 압수수색은 개인 직원들의 비리 혐의를 중심으로 이뤄졌다. 다만 금감원 수사의뢰 대상에 대주주 일가 등의 별도 혐의가 포함된 만큼 수사는 확대될 것으로 보인다.앞서 서울중앙지검 반부패수사3부는 한국토지신탁 수사에 먼저 착수했다. 한국토지신탁 임직원이 분양대행업체 등 용역업체 대표와 직무 관련자로부터 100억원 상당의 금품과 법인카드를 받아 사적으로 사용한 혐의 등은 수사 마무리 국면인 것으로 전해졌다. 당초 금감원은 혐의액을 45억원 상당으로 파악했지만, 검찰 수사 과정에서 100억원대로 늘었다고 한다."
2024-12-18,12월19일 인사,⊙ 문화체육관광부 <전보> ◇과장급 △홍보담당관 정윤재⊙ 한국토지신탁 △사장 김성진 <승진> ◇부사장 △도시·지원부문장 정명량 ◇전무 <본부장> △전략사업 심창우 △리츠사업 김치완 △도시재생2 배효진 ◇본부장(실장) △기획실장 공현기 △도시재생3본부장 정경찬 △신탁지원〃 이성훈⊙ 다우키움그룹 <승진> 키움증권 △상무 김경주 △이사 신수근 박재우 장미루 이영록 송정덕 한수연 키움투자자산운용 △상무 박세중 △이사 정치훈 키움캐피탈 △상무 김우석 △이사 김민석⊙ 금강공업그룹 <승진> 금강그룹 △전무 곽동명 윤수용 △상무보 박준영 변인섭 이제윤 안재경 이정완 이정웅 한창우 케이에스피 △이사대우 김성진 김형태⊙ 스틱인베스트먼트 <승진> △대표이사 강신우 ◇파트너 △그로쓰캐피탈본부 부본부장 이한주 △전략실 실장 이도행  △경영지원본부 본부장 공원표 ◇상무 △그로쓰캐피탈본부 이진형 △PE부문 이원진 이병도 김수지 △크레딧본부  안상민 △그로쓰캐피탈본부 수석심사역 임채훈 △PE부문 〃 이정호 신형준 △경영지원본부 수석매니저 김영애 <전보> △리스크관리실장 및ESG본부장 이준호 △〃 선임지원역 류태경 스틱벤처스 <승진> △투자본부 파트너 정보라 △〃 수석심사역 김민섭⊙ 하이트진로 <승진> ◇전무 △마케팅실 오성택 ◇상무 △영업부문 이정훈 △생산부문 백명규 ◇상무보 △영업부문 정용기 백정훈⊙ 한글과컴퓨터그룹 <승진> 한글과컴퓨터 △전무 진성식 정지환 한컴위드 △부사장 송상엽 △상무 천병갑 한컴라이프케어 △상무 김상묵 인치연 정관영
2024-11-19,"검찰, ‘불법금품 수수’ 의혹 한국자산신탁 전 임직원 3명 구속영장 청구","서울중앙지검. 한겨레 자료사진검찰이 불법 금품 수수 혐의를 받는 한국자산신탁 전직 임직원 3명에게 구속영장을 청구했다.서울중앙지검 반부패수사3부(부장 이승학)는 특정경제범죄가중처벌법의 수재 혐의 등으로 한국자산신탁 전직 전무 백아무개씨 등 임직원 3명에 대해 구속영장을 청구했다고 19일 밝혔다. 이들은 분양대행업체에 일감 등을 주는 대가로 수천만 원에서 억대의 금품을 받았다는 혐의를 받는다.앞서 금융감독원은 지난 5월 한국자산신탁, 한국토지신탁 2곳의 불법·불건전 행위 집중 검사 결과를 발표하며 임직원들의 사익 추구 행위 등을 확인해 검찰에 수사 의뢰했다. 금감원 검사결과, 한국자산신탁 임직원들이 본인 소유 개인 법인 등을 이용해 시행사 등에 25억원가량의 토지매입자금을 빌려주거나 대출을 알선한 뒤 이자 명목으로 7억원 가량을 챙긴 것으로 드러났다. 일부 대출의 경우 이자율이 연 100%이라 실제 연 이자율이 37%에 달하는 등 최고이자율 제한(연20%)규정을 위반하기도 했다.금감원 수사 의뢰를 받은 검찰은 지난달 31일 한국자산신탁 직원들의 주거지 및 사무실 등 10여곳을 압수수색하고, 14일 백씨를 불러 피의자 조사를 진행했다."
