date,title,content
2022-10-24,"빗썸, ‘시세 조작 의혹’ 아로와나 졸속 투자유의 해제 …투자자 피해 우려","서울 강남구 빗썸 라이브센터 앞으로 한 시민이 지나가고 있다. /뉴스1가상화폐 거래소 빗썸코리아가 지난해 시세 조작 의혹을 받아 투자 유의 종목으로 지정됐던 ‘아로와나토큰’을 지정 해제하는 과정에서 아로와나토큰 상장사측의 의견만 청취한 것으로 나타났다. 의혹 당사자의 주장을 그대로 받아들여 다시 거래가 가능하도록 함으로써 일반 투자자들이 잠재적인 위험에 놓였다는 지적이 나온다.23일 빗썸이 국회 기획재정위원회 더불어민주당 양기대 의원실에 제출한 ‘거래지원 종료 검토 결과’ 회의록에 따르면 지난해 11월 빗썸측은 아로와나토큰을 투자 유의 종목에서 해제하면서 아로와나재단으로부터 받은 소명 자료를 별다른 확인 없이 통과시켰다. 문서에서 빗썸은 아로와나토큰을 둘러싼 의혹에 대해 “현재 고소장이 접수되어 수사 중이나 해당 수사 결과가 나오는데까지 장기간 진행되어야 해 실제 여부 파악이 어렵다”며 투자 유의 종목 지정 약 한 달 만에 아로와나토큰을 지정 해제 했다.한글과컴퓨터(한컴) 계열사인 한컴위드가 지분을 투자한 아로와나토큰은 지난해 4월 상장 30분만에 가격이 최초가인 50원에서 5만 3800원으로 1000배 넘게 치솟아 시세 조작 의혹을 받았다. 양 의원은 지난해 10월 국감에서 한컴그룹 김상철 회장이 시세 조작으로 얻은 이익으로 비자금을 조성했다는 의혹을 제기했고, 현재 경찰이 이를 수사 중이다. 남부지방경찰청은 지난 20일 김상철 한컴 그룹 회장의 비자금 조성 및 아로와나 토큰 시세 조종 혐의로 경기 성남시 한컴 본사 회장실과 비서실, 4층 한컴위드 사무실에 대한 압수수색을 벌였다.아로와나재단 측은 빗썸에 제출한 자료에서 비자금 문제와 관련해 “토큰 운영 및 서비스 개발 자금 충당을 위해 국내에서 거래소를 통해 정상적으로 토큰을 현금화하는 방안을 찾던 중 현금을 비자금으로 잘못 표현했을 뿐”이라며 “국정감사 이후에 재단은 경찰로부터 어떤 요청이나 통보를 받지 않았다”고 주장했다. 양 의원 측은 “아로와나재단이 경찰 조사를 받고 있는데도 아무런 통보를 받지 않았다고 하는 등 사실과 다른 내용을 주장했는데도 빗썸측이 이를 그대로 수용했다”며 “경찰 조사 결과 혐의가 사실로 드러날 경우 아로와나코인은 거래 중지가 될 공산이 높은데도 졸속으로 투자 유의 종목을 해제해 일반 투자자들이 이를 사고 팔도록 방관한 셈”이라고 했다."
2022-01-15,"벤처 1세대의  마지막 도전,  “그린시티 생태계 구축하겠다”","한글과컴퓨터 대표, 국회의원 출신  전하진의 새 도전디지털 기술로 탄소감축 생태계 구축 지표 개발태양광으로 원전 대체정책은 비현실적, 비경제적탄소감축을 통한 그린시티 만들기에 남은 인생을 바치겠다는  전하진SDX재단 이사장. 한글과컴퓨터 대표를 역임한 벤처 1세대이다./SDX재단제공픽셀시스템, 레가시, 네띠앙, 인케코퍼레이션, 지오이월드, 한글과컴퓨터, 본웨이브.전하진SDX재단 이사장이 대표를 맡았거나 창업했던 회사들이다. 금성사에서 시스템엔지니어로, 사회생활을 시작한 전 이사장은 서른 살에 사표를 던지고 ‘픽셀시스템’을 창업했다. 한글프리젠테이션 프로그램 등 소프트웨어를 개발하면서 벤처 1세대의 대표 주자로 떠올랐다. 그는 벤처 업계의 전폭적 지원으로, 1998년 부도위기에 처한 ‘한글과컴퓨터’의 구원투수로 투입됐다. 당시 스톡옵션으로 받은 주식이 폭등, 한때 500억원대 벼락부자라는 소리를 듣기도 했다. 30대 승승장구하던 그에게 시련과 실패가 기다리고 있었다. 전 재산을 던져 키우던 회사는 파산하고 밤샘하던 회사에서는 대주주에게 쫒겨 나기도 했다.좌절과 고난을 사색과 집필로 극복했다. ‘전하진의 e비즈니스 성공전략(2001년), ‘비즈엘리트의 시대가 온다’ (2008년), ‘청춘, 너는 미래를 가질 자격이 있다’ (2011년) 등의 저서들이 그렇게 나왔다.벤처에서 쌓은 경험과 저서로 뜻하지 않게 정계에 스카우트되기도 했다. 분당에서 출마, 19대 국회의원을 역임했다. 그는 △벤처기업육성에 관한 특별조치법 개정안 △중소기업창업 지원법 개정안 △특허법 개정안 등 벤처육성을 위한 다양한 입법 활동을 벌였다.그런 그가 인생의 마지막 도전이라는 각오로 뛰어든 분야는 탄소감축을 통한 ‘그린시티’ 실현이다. 디지털 전환기술(DX)을 기반으로 지속 가능한 발전(SD)을 추구하는SDX재단을 이끌고 있는 전 이사장은 “탄소감축은 인류의 생존을 위한 노력이며 우리 모두 자발적으로 참여할 수 있는 생태계를 조성하는 일이 필수적”이라며 “탄소감축을 생활화 할 수 있는 디지털 환경을 조성하는 생태계를 만들겠다”고 말했다.전하진 이사장은 1998년 당시 벤처업계를 대표해 부도위기에 처한 한글과컴퓨터의 구원투수로  투입됐다. 사진은 한글과컴퓨터 대표 당시의 전 이사장./SDX재단 제공- 탄소절감과 그린시티에 도전한 이유는?“새로운 분야에 도전하고 싶어 부동산으로 박사학위를 받았다. 논문이 ‘4차 산업 혁명시대의 새로운 주거환경에 관한 연구’이다. 4차 산업혁명이 가져올 거대한 변화의 태풍 속에서 인간의 삶이 어떻게 변화할 것인가에 대한 고민을 담아 쓴 논문이다. 인류가 지속가능한 성장을 하려면 첨단자족도시(Siti)가 필요하다는 결론을 내렸다. 첨단자족도시는 신재생에너지 등으로 에너지 자립기반을 갖추고, 온 오프라인의 교육이나 의료 등의 도시기능이 내재화되어야 한다. 자아실현을 위한 공동체 문화가 있는 지속가능한 작은 규모의 도시개념이다. 탄소감축 등 지속가능 발전을 위한 도전 없이는 인류의 미래가 없다고 생각한다. ""-정부도 탄소감축 정책을 펴고 있다.“탄소절감과 관련된 정부 정책은 주로 큰 규모의 배출을 하는 기업을 중점 관리하는 것이다. 물론 산업적 규제도 필요하지만, 전 국민이 참여, 탄소감축을 생활화할 수 있는 생태계 구축이 필수적이다.SDX재단은 디지털 전환기술과 탄소 감축을 접목시키는 연구를 하고 있다. 개인, 아파트단지. 지역, 자치단체에서 탄소절감에 나설 수 있는 유인을 제공하는 방안을 찾고 있다. 이를 위해 디지털 기술을 활용, 탄소감축활동을 평가하고 격려하고 보상도 해주는 모델을 만들고 있다.”-탄소감축 생태계 구축의 의미는?“지방자치단체와 기업의 탄소감축 활동 추진 의지 등을 평가하는 탄소감축지수(CarbonReductionIndex·CRI) 개발을 목표로CRI운영단을 최근 만들었다. 홍성웅 청주대 교수, 숭실대 안승호 교수, 프랑스 트루아공대 김준범 교수, 청주대 윤종욱 교수, 갤럽의 박병일 전 대표 등 전문가들이 참여했다. 개인, 아파트, 지역, 도시의 탄소배출 감축 노력을 지수화하는 지표이다. 탄소감축지수가 각 가장, 지역사회, 기업에 뿌리를 내리면 행동으로 이어질 수 있는 동인이 될 것이다. 지방자치단체나 기업들을 대상으로 구성원들의 탄소감축 행위에 대한 인식부터 구체적인 활동, 정책 수립 및 운영 등에 이르는 전반적인 상황들을 평가할 수 있는 지표로 발전시킬 계획이다.-구체적인 활동은?"" 여러 산업 분야에서 진행되고 있지만, 탄소 감축 노력을 일관성 있는 기준으로 측정하고, 실질적인 탄소감축량을 평가하는 것이 부족하다. 그래서 중소기업이나 개인에 대한 탄소감축 활동이 활성화될 수 있도록 탄소감축 활동 상황을 소개하고, 측정하는 플랫폼인 ‘그린플랫폼’을 구축 중에 있다. 개인들에게 ‘그리너스앱’을 보급, 탄소감축을 촉진하는 제품이나 서비스의 확산에 기여할 것으로 기대한다”-국회의원을 했다. 정치는 벤처와 어떻게 다른가?“정치도 벤처하고 비슷한 측면이 있다. 하지만 정치는 의자 뺐기고, 벤처는 의자 만들기이다. 의자를 빼앗기 위해 수단과 방법을 가리지 않는다. 나름의 벤처 정신이 없으면 못하는 일이다. 벤처는 새로운 의자를 만드는 일이다. 정치도 벤처처럼 의자 만들기를 해야 한다. ""-국회에서 가장 보람 있었던 일은“전기를 안 쓰는 것을 발전이라고 인식하는 전기사업법 개정안을 만들었다. 일명 전하진법이라고 하는데, 전력거래소가 전력을 거래할 때 이법에 따라 전력사용량이 크게 늘어날 것으로 예상되는 시점에 절전한 전력도 발전자원으로 거래하도록 하는 내용이다. 이른바 마이너스 전기(네가와트)를 사고 파는 것이다. 반대가 많아서 1년 6개월간 법 통과가 지연됐지만, 이후에 블랙아웃(대규모 정전)을 막는데 크게 기여했다. 이런 것이 법으로 할 수 있는 창조라고 생각한다.”전하진 이사장은 지방자치단체와 기업의 탄소감축 활동 추진 의지 등을 평가하는 탄소감축지수(CarbonReductionIndex·CRI) 개발을 목표로CRI운영단을  만들었다. 전문 연구자들이 참여한다./SDX재단 제공-정부의 탈원전 정책을 평가해달라“전력에는 기저발전과 첨두발전이 있다. 원전처럼 싸게 대량으로 생산하는 전력을 기전 발전으로 활용해야 한다.LNG나 태양광발전은 여전히 비싼 발전이며 24시간 공급을 하기 어려운 간헐전원이다.따라서 용도가 다르다 신재생에너지는 반드시 확대해야 하지만 피크관리나 분산전원으로 우선 사용해야 맞다. 정부는 간헐전원인 신재생에너지로 기저발전을 대체하려고 했다. 비용이 너무 많이 들고 지속적인 발전이 불가능하기 때문에 현재로서는 비현실적이다.”-창업으로 실패도 많이했다. 후회는 없나?“창업을 많이 했다. 성공하기도 했고 실패하기도 했다. 결코 편안한 삶은 아니었지만, 주체적으로 살았다. 한 직장에 있었다면 경제적으로는 편안했겠지만 답답해서 견디기 어려웠을 것이다. 과거에 대기업 스카우트제의 등 안정된 직장에 대한 유혹도 있었지만, 동물원의 호랑이보다 야생의 호랑이로 살기를 원했던 것 같다. 벤처 인생을 후회하지 않는다. ""-벤처에 도전하는 젊은이들에게 하고 싶은 말은?“이제 우리의 미래는 무한의 공간으로 빠르게 확장되고 있다. 미래는 상식이 새롭게 정의될 것이며, 결코 부모세대가 알려 줄 수 없는 방식으로 창조될 것이다. 자신만의 의지로 새로운 길을 개척해야 한다. 서부개척시대처럼 무한개척시대가 열려 있다. 정답을 찾지 말고 해답을 찾아야 한다.”"
2022-07-05,金 0.1g부터 폰으로 산다,"한컴, 거래 플랫폼 내놔한글과컴퓨터그룹의 지주사 역할을 하는 한컴위드가 디지털 금 거래 플랫폼인 ‘한컴디지털에셋’ 앱을 출시했다고 4일 밝혔다. 스마트폰 앱을 통해 금을 최소 0.1g의 작은 단위로 쪼개 살 수 있는 것이 특징이다. 국제 금 시세가 반영되는 월요일 오전 8시부터 금요일 자정까지 하루 24시간 거래할 수 있다. 앱은 구글과 애플 앱장터에서 다운로드 가능하다.서울 종로구 한국금거래소에서 직원이 금 관련 제품을 정돈하고 있다. /뉴스1앱을 이용하면 온라인으로 금을 사고팔 수 있다. 한컴금거래소가 발행한 금 디지털 상품권을 현금으로 사고파는 방식이다. 명목상 상품권을 거래하는 것이기 때문에 신용카드 결제는 안 되고 계좌이체만 가능하다. 금 상품권을 링크 전송 방식으로 다른 사람에게 선물할 수도 있다. 상품권은 언제든 현금이나 실물 금으로 찾을 수 있다.매수·매도 호가와 판매 수량은 앱에서 실시간 확인이 가능하다. 한컴위드 관계자는 “한컴디지털에셋 앱은 작년 한컴이 출시한 ‘골드모어’ 앱에 기능을 추가해 재출시한 서비스”라면서 “앞으로 금 외에 은까지 취급 자산 범위를 넓혀나갈 것”이라고 했다."
2022-06-10,“동물원·사무실·팬미팅 다 있습니다…여기는 메타버스입니다”,"메타버스 활용이 점점 다양해지고 있다. 국내 통신업계가 메타버스에 진출하면서 야생동물과 공룡을 만날 수 있는 동물원부터 업무 공간, 축제의 장 등으로 플랫폼이 변신하고 있는 것이다.SK텔레콤과LG유플러스,KT등 이동통신 3사도 기술 개발에 적극 나서고 있다. 이동통신 회사 본연의 미션이 ‘소통’인만큼 소셜 네트워크(Socialnetwork)를 추구하는 메타버스 플랫폼 개발에도 앞장서겠다는 계획이다.SK텔레콤은 국내 이동통신 3사 중 가장 먼저 메타버스 사업에 진출했다.SK텔레콤 자체 메타버스 플랫폼 ‘이프랜드’에서 벚꽃축제와 노래 자랑, 입학식 등이 열렸다. /SK텔레콤SK텔레콤은 2021년 7월 메타버스 플랫폼 ‘이프랜드’를 선보이며 이동통신 3사 가운데 가장 먼저 메타버스 시장에 뛰어들었다. 2022년에는 이프랜드에 게이미피케이션(Gamification) 요소 도입과 커뮤니티 기능을 강화한다는 방침이다. 또 이용자가 직접 제작할 수 있는 아바타와 공간 제작 플랫폼을 제공해 그 안에서 소품이나 아바타, 의상 등을 서로 사고 팔 수 있도록 할 계획이다. 쉽게 말해 경제 시스템을 도입하는 것이다.이프랜드는 ‘누구든 되고 싶고, 하고 싶고, 만나고 싶고, 가고 싶은 수많은 가능성인 ‘이프(if)’들이 현실이 되는 공간(land)’이라는 의미를 담고 있다. 자체 증강현실(AR), 가상현실(VR) 기술 플랫폼인 ‘T리얼 플랫폼’을 기반으로 탄생했다.이프랜드에서는 나를 대체하는 캐릭터인 아바타를 통해 어디든 갈 수 있고, 누구와도 만날 수 있다. 실제로 이곳에서 가상 캠퍼스 입학식이 열렸고, 기업 화상 회의와 댄스 축제, 동네 노래자랑, 대선 개표 방송 등이 진행됐다. K팝 팬미팅이나 벚꽃축제 등이 열리기도 했다.SK텔레콤은 플랫폼 해외 진출도 목전에 두고 있다. 독일 통신사 도이치텔레콤과 손잡고 ‘유럽판 이프랜드’를 구축해 2022년 독일을 시작으로 유럽 각 지역에서 이프랜드 마켓 테스트를 진행할 예정이다. 현지 합작회사를 설립해 유럽 통신 사업자들과 메타버스 사업 협력을 강화하는 방안도 검토하고 있는 것으로 알려졌다.LG유플러스가 선보인 어린이 맞춤형 메타버스 ‘U+키즈동물원’./유플러스LG유플러스도 메타버스 사업에 진출했다. 직장인과 어린이 등 특정 고객층에 특화한'U+가상오피스'와'U+키즈동물원’ 등을 선보였다. 코로나19로 재택근무가 일상화된 직장인과, 놀이하듯 즐기는 학습을 원하는 어린이 등을 위한 맞춤형 플랫폼이다.먼저 U+가상오피스는 직장인을 타깃으로 만든 업무용 메타버스다. 출근부터 퇴근까지 아침 인사와 개인 면담, 화상회의, 업무 협업 등 실제 사무실에서 이뤄지는 업무 활동을 할 수 있다. 기존의 오픈형 메타버스가 아바타나 개인 공간 꾸미기에 기능이 집중됐다면,LG유플러스는 ‘경험과 활동’에 중점을 두고 있다. 아바타를 통해 감정을 표현하고 음성과 입술 움직임을 일치시키는 등 소통의 몰입도에도 집중하고 있다.U+키즈동물원은 어린이들의 체험과 학습을 목표로 만들었다. 기린과 곰, 호랑이 등 30여종의 야생동물을 메타버스를 통해 만나볼 수 있다. 또 티라노사우르스와 브라키오사우르스 등 20여종의 공룡도 볼 수 있다. 이용자들은 가상 동물원을 체험하고, 인공지능(AI) 도우미 캐릭터 ‘NPC’(Non-Playercharacter)를 통해 동물 학습도 할 수 있다.KT역시 메타버스 플랫폼 출시를 준비 중이다. 지난 5월 19일 공식 석상에서 ‘지니버스’ 출시 계획을 밝혔다. ‘홈 서비스’를 기반으로MZ세대뿐 아니라 고령층 등 디지털 문화에서 소외된 이들까지 지니버스로 포용해 서비스를 제공한다는 방침이다.KT는 지니버스에 이용자와 자연스럽게 대화할 수 있는NPC를 탑재할 예정이다. 이는KT가 선보인AI통화비서의 다음 버전으로 볼 수 있다. 진화된AI를 구현하기 위해AI원팀에서 다자간 공동연구를 진행하고 있는 것으로 알려졌다.통신업계뿐 아니라 메타버스에 진출한 회사는 이미 많다. 게임업계에서는 엔씨소프트와 넷마블, 크래프톤, 스마일게이트, 컴투스 등이 게임을 기반으로 한 메타버스 플랫폼 구축에 열을 올리고 있다. 네이버가 출시한 메타버스 플랫폼 ‘제페토’는 국내 기업이 출시한 서비스 중 가장 성공한 사례로 꼽힌다. 제페토의 이용자는 3억명을 넘어섰다. 제페토는 최근 플랫폼에 가상자산을 연계하는 방안을 검토하고 있는 것으로 알려졌다.국내 소프트웨어 기업 한글과컴퓨터 역시 메타버스 플랫폼 ‘싸이타운’ 출시를 준비 중이다. 토종 소셜미디어인 ‘싸이월드’와 연동해 선보일 예정이다. 싸이월드는 한때 회원 수가 3200만명에 달했던 국내 소셜미디어다.한글과컴퓨터 메타버스 서비스 싸이타운 광장. /한글과컴퓨터싸이타운은 싸이월드의 각종 서비스를 3차원(3D) 아바타∙공간으로 선보인다. 싸이월드 아바타 ‘미니미’가 기존 이용자별 공간인 ‘미니룸’의 문을 열고 나가면 싸이타운에 접속할 수 있는 식으로 서비스가 구현될 예정이다. 소규모 ‘일촌’ 모임 공간인 ‘마이룸’과 불특정 다수가 동시접속할 수 있는 ‘스퀘어’를 들인다. 스퀘어에선 외부 업체들과 제휴해 메타버스에서 게임·영화·쇼핑·교육 콘텐츠를 제공한다.한컴은 싸이월드 운영사인 싸이월드제트와 함께 싸이타운에 자체 경제 시스템도 들일 계획이다. 플랫폼 아이템 제작 등 사용자의 활동에 따라 보상을 주는 ‘C2E(createtoearn·제작을 통해 돈벌기)’ 구조다. 이를 위해 싸이월드가 기존에 썼던 플랫폼 가상화폐 ‘도토리’를 코인으로 발행한다.기업들이 메타버스 진출에 적극적인 것은 사업 확장 가능성이 무궁무진하기 때문이다. 지난 5월 18일 경영컨설팅기업 애널리시스그룹(AnalysisGroup)이 발간한 ‘메타버스의 잠재적 글로벌 경제 영향력’ 보고서를 보면 메타버스 기술은 모바일 기술과 마찬가지로 교육과 의료, 제조업, 통신, 엔터테인먼트, 리테일에 걸친 다양한 경제 분야를 변화 시킬 수 있는 잠재력을 가지고 있어 광범위한 응용 분야에서 사용될 것으로 분석됐다.이런 사업성은 수치로도 확인된다. 글로벌 컨설팅 기업PwC는 글로벌 메타버스 시장 규모가 2021년 1485억 달러(약 179조원)를 기록했고, 2030년이면 1조5429억 달러(약 1850조원)까지 성장할 것으로 전망했다."
2022-05-27,국내 첫 지구관측 민간위성 ‘세종1호’ 쏘아올렸다,"5m 크기 물체까지 식별90분마다 지구 돌며 영상 전송한글과컴퓨터(한컴)가 26일 지구 관측용 민간 위성으로는 국내 최초인 ‘세종1호(Sejong-1)’를 성공적으로 발사했다고 26일 밝혔다. 세종1호는 카메라가 달린 초소형 위성으로 하루에 12~14바퀴 지구를 돌며 이미지를 촬영해 지상으로 전송하게 된다. 한컴그룹 관계자는 “해외 위성에 의존해 온 국내 민간 위성 데이터 시장에 새로운 이정표를 세웠다”고 했다.'세종 1호'를 실은 스페이스X 로켓이 26일 미국 플로리다주 케네디 우주센터에서 발사되고 있다. /스페이스X세종1호는 한국 시각 26일 오전 3시 35분(현지 시각 25일 오후 2시 35분) 미국 플로리다주 케이프 커내버럴 케네디 우주센터에서 민간 우주기업 스페이스X의 ‘팰컨9(FALCON9)’ 로켓에 실려 발사됐다. 발사 후 1시간 1분이 지나 팰컨9로부터 분리됐고, 이후 궤도에 안착해 지상국과 교신에 성공했다.한컴그룹은 우주사업을 위해 2020년 9월 국내 우주·드론 전문기업인 인스페이스를 인수했다. 지난해 말 미국 민간위성 기업 스파이어 글로벌에 의뢰해 세종 1호를 제작했다. 위성은 가로 10㎝, 세로 20㎝, 높이 30㎝이고, 무게는 10.8㎏이다. 지상으로부터 500㎞ 떨어진 궤도에서 90분에 한 바퀴씩 지구를 돌며 이미지를 수집하는데 5m 크기 물체까지 분간할 만큼 관측 정밀도가 높다.세종1호가 수집한 위성 사진·영상은 농업이나 재해 예방 등 다양한 분야에서 활용할 수 있다. 위성 이미지를 이용하면 특정 지역의 농작물 생산량을 추정하거나 작황을 한눈에 파악해 관리할 수 있고, 분쟁 지역의 병력·차량 이동도 실시간으로 확인할 수 있다. 세계 각국에서는 위성 이미지를 산불·홍수 등 재해 지역의 피해 면적 조사나 실물 경제 동향 분석에 활용하고 있다.한컴그룹은 앞으로 5년 동안 50기 이상의 인공위성을 발사해 군집 위성 체계를 구축하는 것이 목표다. 내년 상반기 세종 2호, 하반기 3·4호, 2024년에 5호를 발사할 예정이다. 4호 위성은 자체 기술로 제작하는 것을 목표로 하고 있다."
2022-03-17,한컴라이프케어 산불 성금 2억,한글과컴퓨터그룹 계열사인 한컴라이프케어는 16일 강원·경북 산불 피해 이재민들과 순직·공상 소방관들을 위한 성금 2억원을 사회복지공동모금회와 대한소방공제회에 전달했다.
