date,title,content
2023-12-05,"SPP 국제콘텐츠마켓 2023, 3천건 수출상담 이뤄져","오세훈 서울특별시장의 서울 창조산업에 대한 비전 발표서울시의 문화콘텐츠 산업 경쟁력을 만드는 중소기업 지원기관 서울경제진흥원(SBA,대표이사 김현우)이 개최한 ‘SPP국제콘텐츠마켓 2023’이 지난 11월 29일부터 30일까지 서울드래곤시티에서의 이틀간의 일정을 마치고 성황리에 막을 내렸다.SPP는 콘텐츠 全 영역에서 발굴·투자·유통 등 콘텐츠 산업을 활성화하기 위해 진행되는 글로벌 행사로, 2001년 첫 개최 이래 올해 23회째를 맞이하며 명실상부한 최대 규모의 콘텐츠 마켓으로 성장하고 있다.한라홀에서 진행된 콘텐츠 기업과 글로벌 바이어가 참여한 1:1 비즈니스 상담회에서는, 2,958건의 매칭 상담이 이루어졌고 3건의MOU를 통해 업무 협력을 위한 양해각서 체결 등 다양한 사업 추진이 이루어졌다.금번 행사는 싱가포르의Paramount,WarnerMedia,한국의 카카오엔터테인먼트, 일본의 크런치롤, 프랑스의MediaParticipations(MPP), 영국의Aardman,베트남의FPTPlay등 해외바이어 150여 개 사를 포함한 797개사가SPP2023에 참여했다.특히, 작년부터 확대된 게임 분야에서는Plaion,NeteaseGames,Gameforge,ElectronicArts,넷마블 등 국내외 리딩 기업부터 중소규모의 게임사까지 총 230여 개 사가 참여하여 다방면으로 비즈니스를 탐색하는 기회를 가졌다.또한,SPP2023 비즈니스 상담회 현장에서 3건의MOU가 이루어졌다. 그 내용으로는 한국 에이스에듀가 각각 인도네시아PT.CablenetAsia및 한국 크리에이터 스텔라김StellaKim과의 양해각서 체결, 한국 깜보스튜디오와 대만CreativeCenturyEntertainment간의 상호 업무 협력을 위한 양해각서를 체결하였다.한편 신라홀에서는 싱가포르와 프랑스의 콘텐츠 기업 및 시장 현황을 확인할 수 있는 싱가포르·프랑스 콘텐츠 투자·배급 세션이 진행됐다.세션1에서는 ‘유럽시장에서의 디지털 콘텐츠 : 트렌드와 기회’라는 주제로 프랑스MPPAinaraIpas대표의 발표가 진행되었으며, 세션2에서는 ‘싱가포르에서의 한국 콘텐츠 산업’이라는 주제로 싱가포르AugustMedia의JyotirmoySaha대표의 발표가 진행되었다. 이후 ‘해외 투자&배급’ 주제로 모더레이터로는 선우앤컴퍼니 강문주 대표가, 패널로는MPPAinaraIpas대표,AugustMedia의JyotirmoySaha대표, 케나즈의 이우재 대표가 패널로 참여하여 패널토크 및 질의응답이 진행되었다.또한SBA와 베이비샤크넥스트유니콘IP펀드(운용사 스마트스터디벤처스)가 공동 주최한 ‘2023IP크로스 영상화 스토리 공모전’ 시상식을 진행했다.해당 공모전은 웹툰, 웹소설을 드라마, 영화, 애니메이션으로 영상화하는 프로젝트를 발굴하여 스토리 개발 지원 및 투자 지원을 연계하기 위해 마련되었다.지정원작 부문에서는 ▲팀 제로: 지옥의왕-한국시나리오연구소가 선정됐다. 자유원작 부문에서는 ▲이제야 연애-덱스터픽쳐스, ▲악(惡)의 등교-스튜디오타겟(주)가 선정됐다. 수상작 3편의 프로젝트에는 2천만 원의 기획개발 지원금이 주어질 예정이다.또 다른 부대 프로그램으로 ‘서울 콘텐츠 투자협의체’와 연계하여 1일차에는 투자IR데이 및 협약식을, 2일차에는 투자상담회를 진행하였다.‘서울 콘텐츠 투자협의체’는 지난해SBA콘텐츠본부와 콘텐츠펀드 운용 투자사 15개 사와 추진된 협약으로, 협업을 통해 운용 중인 펀드와 연계하여 레버리지를 확대하고 우수IP홀더의 투자유치 활성화에 집중하고 있다.1일차에는 ‘2023 서울 콘텐츠 투자협의체 투자IR데이’를 개최하여 콘텐츠IR피칭을 진행하였으며, 발표기업 10개사를 심사하여 그중 최종 우수기업 5개 사(▲드림팩토리스튜디오, ▲라라스테이션, ▲아이필름코퍼레이션, ▲칵테일미디어, ▲키글)를 선정하였으며, 협약식에서는 서울 콘텐츠 투자협의체 연계 투자지원 프로그램 및 신규 투자협의체 참여 투자사를 소개하며SBA와 투자사 7개사(▲한국투자파트너스, ▲미시간벤처캐피탈, ▲피앤아이인베스트먼트, ▲ATU파트너스, ▲에스비파트너스, ▲NU액셀러레이터, ▲크릿벤처스)간의 공동 업무협약을 체결하였다. 또한, 2일차에는 투자사 23개사(VC26명)와 콘텐츠기업 76개사 간의 투자 상담회를 진행하여 총 222건의 투자 컨설팅이 이루어졌다.그리고 1일차 저녁 네트워킹 만찬에서는 오세훈 서울특별시장의 서울 창조산업에 대한 비전 발표가 이루어졌다.발표에서는 어려운 경제상황을 돌파하기 위한 서울경제 미래 동력으로 게임, 영화, 미디어, 웹툰, 확장현실(XR) 등을 중심으로 한 ‘창조산업’ 비전을 제시했다. 서울 창조산업의 핵심 전략으로 첫째, 남산·충무로 등 서울 일대에 창조산업 인프라 조성, 둘째, 웹툰과 게임‧e스포츠 산업 등 5대 핵심 산업 지원 강화, 셋째, 인재육성과 기업투자 강화 등 창조산업 생태계 조성 전략을 발표하였다.전대현 서울경제진흥원 콘텐츠본부장은 “SPP국제콘텐츠마켓 2023에서 비즈니스 상담회뿐 아니라 협약식, 투자 세션 등 다채로운 네트워킹 프로그램을 통해 참여 콘텐츠기업이 유의미한 결과를 얻었기를 바란다.”며 “SPP국제콘텐츠마켓이 앞으로도 글로벌 네트워킹 및 해외시장 진출의 발판의 역할을 하도록 더욱 노력하겠다.”고 밝혔다.SPP국제콘텐츠마켓 2023과 관련된 자세한 사항은SPP홈페이지를 통해 확인할 수 있다."
2023-11-20,"중기부, 하나금융과 민간 벤처모펀드 출범식 개최","중소벤처기업부는 20일 서울창업허브 스케일업센터에서 제1호 민간 벤처모펀드를 조성하는 하나금융그룹과 민간 벤처모펀드 출범식을 개최했다고 밝혔다.민간 벤처모펀드는 작년 11월, 이번 정부의 첫 번째 벤처대책인 「역동적 벤처투자 생태계 조성방안」을 통해 발표된 이후, 올해 3월 벤처투자법 개정안이 국회를 통과하여, 10월 19일 시행되었다.벤처모펀드는 창업·벤처기업에 투자하는 다수의 벤처 자펀드에 출자하는 재간접펀드를 의미하며, 모펀드의 안정성, 확장성, 전문성 측면의 강점을 토대로 민간 자본을 벤처투자 시장으로 유입하는 데 기여할 것으로 기대된다.민간 벤처모펀드 제도화 이후 하나금융그룹이 첫 번째로 펀드 조성에 나서면서, 본격적인 민간 벤처모펀드 시대 개막을 함께 알렸다.제1호 민간 벤처모펀드는 하나금융그룹의 100% 출자로 총 1,000억원 규모로 조성된다. 10대 초격차 분야에 중점 출자·투자하며, 하나벤처스가 10년간 운용할 계획이다.이번 행사에서는 중소벤처기업부와 하나금융그룹이 함께 민간 중심의 벤처생태계 전환의 마중물을 마련한다는 의미의 ‘마중물 세레모니’가 진행되었다.아울러, 한국벤처투자와 하나벤처스가 업무협약을 체결하면서, 대한민국 대표 정책 모펀드인 모태펀드를 18년간 운용한 한국벤처투자가 하나벤처스에 모펀드 운용 노하우를 전수하는 등 상호 협력을 약속하였다.출범행사 이후에는 벤처캐피탈 업계 및 학계와 함께 민간 벤처모펀드의 발전방향을 논의하는 패널토론이 진행되었다.퇴직연금 적립금의 벤처투자조합 출자 허용, 세제혜택 강화 등 민간 벤처모펀드 재원을 두텁게 마련하기 위한 제언과 함께 모펀드의 대형화를 위한 공모형 민간 벤처모펀드 제도 도입의 필요성 등을 논의하였다.이영 장관은 “민간 벤처모펀드는 장관 취임 이후, 벤처기업인의 시각으로 심혈을 기울여 탄생시킨 첫 번째 벤처정책이다. 발표 1년 만에 실제 결성까지 이루어져 감격스럽다. 민간 벤처모펀드 1호는 민간 주도 벤처투자 시장을 상징하는 기념비적인 펀드로서 업계의 이정표로 역할을 할 것으로 기대한다. 중소벤처기업부도 지원을 아끼지 않겠다”고 밝혔다."
2023-11-16,'개미의 반란'에 배당 늘리고 자사주 소각...주주환원 풍토 바뀔까,"‘개미의 반란’에 주요 상장사가 주주 챙기기에 적극적으로 나서고 있다. 배당을 주고 매입한 주식을 태우는(소각) 등 주주환원책을 내놓고 있다. 강해진 소액주주의 목소리와 거세지는 행동주의 펀드 공세, 정부 정책까지 뒷받침되면서다.그동안 국내 상장사의 부족한 주주환원은 ‘코리아 디스카운트’의 주요 요인으로 지적됐다. 하지만 올해 들어 자사주 소각이 1년 전보다 1.5배가량 늘어나는 등 적극적인 주주환원이 장기적인 추세로 자리 잡을 수 있다는 기대감도 커지고 있다.신재민 기자━잇따른 주주환원책, 자사주 소각 작년보다 1.5배대대적인 주주환원책을 발표한 곳은KT&G다. 지난 13일KT&G는 창사 이래 첫 ‘밸류데이’ 향후 3년간 1조8000억원의 현금 배당과 1조원 규모의 자사주 매입 소각 등 3조원 규모의 주주환원책을 발표했다.LG도 자회사에서 받은 배당과 상표권 및 임대수익에서 창출한 이익을 배당 재원으로 활용하고, 당기순이익의 50% 이상을 주주 환원에 사용하겠다고 지난 9일 밝혔다.KT역시 배당금을 최소 2022년 수준으로 보장하고, 분기배당을 도입한다.HL홀딩스는3년간 발행 주식의 6%에 달하는 자사주 소각을 약속했고, 한섬도 발행주식의 5%에 해당하는 자사주 소각 계획을 발표했다. 아세아시멘트 역시 중간배당을 주당 30원으로 확대하고 120억원 규모의 자사주 취득을 밝혔다.늘어나는 주주환원은 수치로도 확인된다. 한국거래소가 집계한 통계에 따르면 자사주 소각은 최근 5년 새 늘어나는 모습이다. 지난 15일 기준 올해 이뤄진 자사주 건수는 93건으로, 지난해(64건)보다 1.5배가량 늘었다. 2019년(25건)과 비교해 약 4배 증가한 것이다.금액으로 봐도 올해 자사주 소각 규모는 5조2700억원에 이른다. 지난해(3조1300억원)의 약 1.7배, 2019년(1조200억원)의 5배 수준으로 늘어났다.신재민 기자━힘세진 소액주주, 많아진 행동주의상장사의 주주환원이 늘어나는 건 커진 소액주주의 목소리와 이에 힘입어 늘어난 행동주의 펀드의 영향이다. 키움증권에 따르면 올해 상반기 기준 국내 증시에서 주주행동주의가 이뤄진 상장사 수는 50곳으로 지난 2021년(34곳)과 2022년(37곳)에 이어 증가하고 있다.실제로 적극적인 주주환원책을 내놓은KT&G는 올해 플래쉬라이트캐피탈파트너스(FCP) 등 여러 행동주의 펀드의 공격을 받았다. 아세아시멘트도VIP자산운용이 2년간 일반투자목적 공시 등을 통해 공개적으로 주주환원책을 요구해 온 회사다.류영재 서스틴베스트 대표는 “최근 개인주주들은 비상대책위 등의 이름으로 모임을 결성해 상장사에 직접 주주환원을 위한 면담을 요청하는 등 행동력이 대단하다”고 평가했다.주주환원을 뒷받침하는 정책도 꾸준히 나오고 있다. 금융위원회와 법무부는 올해 초 기업이 배당기준일을 주주총회 이후로 정하도록 유도하는 내용을 담은 ‘글로벌 스탠더드에 부합하는 배당절차 개선방안’'을 발표했다. 기업의 배당성향을 모른 책 투자하는 ‘깜깜이 투자’를 막기 위해서다. 이후 상장사들이 배당 성향 등을 미리 알리는 풍토가 자리 잡는 모습이다.박소연 신영증권 연구원은 “본격적인 배당 제도 개선을 앞두고 발 빠른 일부 기업이 선제적으로 (주주환원책을) 발표하는 모습”이라며 “지배구조보고서 가이드라인에도 ‘배당 예측 가능성을 제공했느냐’를 까다롭게 따지는 내용이 들어가면서 상장기업이 배당과 관련한 사안을 미리 밝힐 유인이 커졌다”고 설명했다.자사주 소각도 금융당국이 관심 있게 들여다보고 있는 부분이다. 김소영 금융위 부위원장은 최근 “공정 거래 기반 강화를 위해 자사주 제도 개선 등 추가적인 방안을 마련하겠다”고 재차 언급했다.━미국도 행동주의→자발적 주주환원으로 발전주주환원에 적극적인 기업을 골라 투자하는 상장지수펀드(ETF) 출시도 시장의 높은 관심을 방증한다. 한국투자신탁운용은 지난 3월 기존 ‘ACE차세대가치주액티브’의 종목명을 ‘한국투자ACE차세대가치주 액티브’로 바꾸며 주주환원에 적극적인 기업에 투자하는 방식으로 운용 전략을 바꿔 선보였다.한국투자신탁운용은 “투자자뿐만 아니라 제도적 움직임도 있는 만큼 주주환원과 거버넌스 개선에 관한 관심이 커질 것으로 판단해 해당 상품을 새롭게 선보였다”고 설명했다.이 펀드를 운용하는 김기백 매니저는 “이른바 자본 선진국이라는 미국도 1980년도에 행동주의 펀드와 일반주주의 각종 제안이 시작됐고, 이후 1990년부터 기업의 자발적인 배당과 자사주 매입 소각 등의 주주환원이 본격화하는 모습을 보였다”고 설명했다."
2023-11-17,배당 늘리고 주식 태우고…주주챙기기 새 바람,"‘개미의 반란’에 주요 상장사가 주주 챙기기에 적극적으로 나서고 있다. 배당을 주고 매입한 주식을 태우는(소각) 등 주주환원책을 내놓고 있다. 강해진 소액주주의 목소리와 거세지는 행동주의 펀드 공세, 정부 정책까지 뒷받침되면서다.그동안 국내 상장사의 부족한 주주환원은 ‘코리아 디스카운트’의 주요 요인으로 지적됐다. 하지만 올해 들어 자사주 소각이 1년 전보다 1.5배가량 늘어나는 등 적극적인 주주환원이 장기적인 추세로 자리 잡을 수 있다는 기대감도 커지고 있다.신재민 기자대대적인 주주환원책을 발표한 곳은KT&G다. 지난 13일KT&G는 창사 이래 첫 ‘밸류데이’에서 향후 3년간 1조8000억원의 현금 배당과 1조원 규모의 자사주 매입 소각 등 3조원 규모의 주주환원책을 발표했다.LG도 자회사에서 받은 배당과 상표권 및 임대수익에서 창출한 이익을 배당 재원으로 활용하고, 당기순이익의 50% 이상을 주주 환원에 사용하겠다고 지난 9일 밝혔다.KT역시 배당금을 최소 2022년 수준으로 보장하고, 분기배당을 도입한다.HL홀딩스는 3년간 발행 주식의 6%에 달하는 자사주 소각을 약속했고, 한섬도 발행주식의 5%에 해당하는 자사주 소각 계획을 발표했다. 아세아시멘트 역시 중간배당을 주당 30원으로 확대하고 120억원 규모의 자사주 취득을 밝혔다.늘어나는 주주환원은 수치로도 확인된다. 한국거래소가 집계한 통계에 따르면 자사주 소각은 최근 5년 새 늘어나는 모습이다. 지난 15일 기준 올해 이뤄진 자사주 소각 건수는 93건으로, 지난해(64건)보다 1.5배가량 늘었다. 2019년(25건)과 비교해 약 4배 증가한 것이다. 금액으로 봐도 올해 자사주 소각 규모는 5조2700억원에 이른다. 지난해(3조1300억원)의 약 1.7배, 2019년(1조200억원)의 5배 수준으로 늘어났다.상장사의 주주환원이 늘어나는 건 커진 소액주주의 목소리와 이에 힘입어 늘어난 행동주의 펀드의 영향이다. 키움증권에 따르면 올해 상반기 기준 국내 증시에서 주주행동주의가 이뤄진 상장사 수는 50곳으로 지난 2021년(34곳)과 2022년(37곳)에 이어 증가하고 있다.신재민 기자실제로 적극적인 주주환원책을 내놓은KT&G는 올해 플래쉬라이트캐피탈파트너스(FCP) 등 여러 행동주의 펀드의 공격을 받았다. 아세아시멘트도VIP자산운용이 2년간 일반투자목적 공시 등을 통해 공개적으로 주주환원책을 요구해 온 회사다.류영재 서스틴베스트 대표는 “최근 개인주주는 비상대책위 등의 이름으로 모임을 결성해 상장사에 직접 주주환원을 위한 면담을 요청하는 등 행동력이 대단하다”고 평가했다.주주환원을 뒷받침하는 정책도 꾸준히 나오고 있다. 금융위원회와 법무부는 올해 초 기업이 배당기준일을 주주총회 이후로 정하도록 유도하는 내용을 담은 ‘글로벌 스탠더드에 부합하는 배당절차 개선방안’을 발표했다. 기업의 배당성향을 모른 채 투자하는 ‘깜깜이 투자’를 막기 위해서다. 이후 상장사가 배당 성향 등을 미리 알리는 풍토가 자리 잡는 모습이다.박소연 신영증권 연구원은 “본격적인 배당 제도 개선을 앞두고 발 빠른 일부 기업이 선제적으로 (주주환원책을) 발표하고 있다”며 “지배구조보고서 가이드라인에도 ‘배당 예측 가능성을 제공했느냐’를 까다롭게 따지는 내용이 들어가면서 상장기업이 배당과 관련한 사안을 미리 밝힐 유인이 커졌다”고 설명했다.자사주 소각도 금융당국이 관심 있게 들여다보고 있는 부분이다. 김소영 금융위 부위원장은 최근 “공정 거래 기반 강화를 위해 자사주 제도 개선 등 추가적인 방안을 마련하겠다”고 재차 언급했다.주주환원에 적극적인 기업을 골라 투자하는 상장지수펀드(ETF) 출시도 시장의 높은 관심을 방증한다. 한국투자신탁운용은 지난 3월 기존 ‘ACE차세대가치주액티브’의 종목명을 ‘한국투자ACE차세대가치주 액티브’로 바꾸며 주주환원에 적극적인 기업에 투자하는 방식으로 운용 전략을 바꿔 선보였다."
2023-09-19,"온프레미스형 협업툴 플로우, 국내 100대 기업 점유율 20% 돌파","플로우의 개발사 마드라스체크(주)가 국내 100대 기업 내 사내 서버 설치(이하 온프레미스)형 협업툴 공급 점유율 20%를 달성했다고 19일 밝혔다.이는 최근 금융감독원이 코로나19사태로 유연하게 적용했던 논리적 망분리 규제가 강화되면 서 망분리 업무 환경 속 보안이 최우선되는 대기업, 금융사, 공공기관에서 온프레미스형 협업툴 플로우에 대한 의뢰가 급증했기 때문이라는 분석이다.마드라스체크에 따르면 ‘대한민국 100대 기업’ 순위에 포함된 100개 기업 중 20개 이상 기업에서 협업툴 플로우를 사내 공식 협업툴로 사용하거나 올해 내로 플로우를 사내 협업툴로 공식화하기 위해 기업 내부망 내 협업툴 플로우 서비스를 구축하여 적극적인 사용 테스트(POC)를 진행하고 있다. 이는 대기업 데이터 평가 제공 기관 시이오랭킹뉴스에서 제공한 2022년 전체 매출액 기업순위 기준에 따른 것이다.대한민국 100대 기업 중 공식적인 사내 협업툴 플로우를 사용하는 대표 대기업은 ▲KT,▲포스코, ▲현대모비스, ▲S-OIL,▲미래에셋증권 등이 있다.망분리 환경 속 대기업, 금융사, 공공기관은 자체적으로 관리하는 내부 서버에 설치/구축하는 서버 설치형(온프레미스)형 협업툴 사용이 필수적이다. 마드라스체크는 2016년 회사 창립때 부터 국내 협업툴 최초이자 유일 ▲사내 서버 설치형(온프레미스)형, ▲클라우드(SaaS)형, ▲프라이빗 클라우드 호스팅형 세가지 형태의 서비스를 모두 지원해 오고 있다. 그 결과 거대 경쟁사에 비해 빠르게 온프레미스형 협업툴 보급 기술을 보유한 플로우는 이미 국내 50개의 온프레미스형 공급 계약을 체결했다.국내 협업툴 시장이 형성된 2015년 이후 지난 8년동안 온프레미스형 기술을 지원하는 협업툴 개발사는 최근까지 마드라스체크가 유일했다고 회사 측은 전했다. 그 결과 현재 50개 이상의 대기업, 금융권, 공공기관과 온프레미스형 협업툴 공급을 계약하고 있다.2020년 협업툴 최초 제 1금융권 최초 공급 계약 '대구은행'에 이어 ▲DB금융투자, ▲KB캐피탈, ▲미래에셋증권, ▲한국투자증권, ▲부산은행, ▲대구은행, ▲경남은행, ▲한국거래소 등 국내 굵직한 금융사들과 온프레미스형 협업툴 공급 계약을 맺었다. 최근 ▲한국가스공사, ▲국회예산정책처, 등 다양한 공공기관과 계약하며 국내 1위 협업툴의 입지를 공공히 하고 있다.협업툴 플로우 이학준 대표는 “마드라스체크는 대한민국 최고의 협업툴 구축, 운영 노하우를 가지고 있다. 고객사는 최근에서야 구축형을 시작하거나SI방식으로 사업을 제안하는 공급사의 파일럿이 되기보다 시장에서 검증된 제품을 도입하고 싶어하기 때문에 플로우를 선택하는 고객이 더 빠르게 늘어날 것.” 이라고 말했다.한편 마드라스체크는K-협업 소프트웨어의 위상을 전 세계적으로 알리고자 올해 초 글로벌 시장에 진출하여 2023년 9월 기준 55개국, 45만 여개의 조직까지 협업툴 플로우를 사용을 확대하며 전 세계에서 업무 문화를 혁신을 주도하고 있다."
2023-06-22,"SK온 ""블루오벌SK, 美정부로부터 최대 11.8조 정책지원금 확보""","블루오벌 켄터키SK.사진SK온SK온과 미국 포드자동차의 전기차 배터리 생산 합작법인 블루오벌SK(BOSK)가 미국 정부로부터 최대 92억달러(약 11조8000억원) 규모의 대출을 지원받게 됐다.SK이노베이션의 배터리 자회사인SK온은 블루오벌SK가 미국 에너지부(DOE)로부터 최대 92억 달러 규모의 정책자금 차입 조건부 승인(ConditionalCommitment)을 얻었다고 22일 밝혔다.이번 금융 지원은DOE의 첨단기술차량제조(ATVM) 프로그램에 따라 이뤄진 것이다.ATVM프로그램은 지난 2007년 에너지독립안보법에 따라 만들어졌으며 자동차 및 관련 부품 제조 사업에 대출을 지원하는 프로그램이다.ATVM프로그램 차입 금리는 미국 국채 금리 수준으로 적용된다. 본 계약 체결 시 10년 만기 미국 국채 금리 수준의 저리로 차입이 가능해진다. 이에 따라 블루오벌SK는 이르면 올해 본계약을 체결한 뒤 최대 92억 달러를 최종 확보하게 된다.SK온에 따르면 블루오벌SK의 생산 능력에 대해DOE가 좋은 평가를 했기에 이런 결과가 가능했다고 한다.DOE는 블루오벌SK프로젝트가 미국 자동차 시장 전동화 및 공급망 강화에 큰 역할을 할 것으로 기대했다.DOE는ATVM프로그램 수혜자 선정을 위해 일정 심사 과정을 거친다. 기술력, 시장 영향력, 금융, 법률 등 다양한 분야에서 적격성 평가를 한다.블루오벌SK는 계약을 최종 완료하면 미국 켄터키 1,2 공장 및 테네시 등 총 3개의 공장 건설에 확보한 자금을 투자할 계획이다. 오는 2025년부터 순차적으로 상업 가동을 목표로 하는 블루오벌SK3개 공장은 총 120기가와트시(GWh) 이상에 달하는 생산 능력을 갖출 예정이다. 이는 대당 105킬로와트시(kWh) 배터리가 들어가는 전기차 기준 약 120만대를 매년 생산할 수 있는 규모다.앞서SK온은 지난해 7월 독일 무역보험기관인 오일러 헤르메스, 한국무역보험공사 및 한국수출입은행 등 공적수출신용기관(ECA)을 통해 헝가리 3공장 등 유럽 배터리 사업을 위한 투자자금 2조6000억원을 확보한 바 있다. 또SK이노베이션 출자 2조원, 한국투자PE이스트브릿지컨소시엄 1조2000억원,MBK컨소시엄 및 사우디SNB캐피탈로부터 1조1000억원, 싱가포르계 재무적투자자 5100억원, 유로본드 1조2000억원 등 성장 동력 마련을 위한 투자자금 확보를 이어가고 있다.SK온은 영업 현금흐름,JV를 통한 파트너사와의 분담, 투자국가의 인센티브 등 다양한 방법을 통해 투자재원을 확보할 계획이다.SK온 관계자는 “장세가 이번 정책지원자금 확보로 더욱 가팔라 질 것”이라며 “앞으로도 다양한 조달 방안을 활용해 글로벌 전기차 시장 리더십을 더욱 공고히 해나갈 것”이라고 밝혔다."
