date,title,content
2023-07-06,"기업들 페이퍼리스 선언, 보고서도 명함도 전자로…전무님만 아직 ‘빨간펜’","“반드시 필요한 경우를 제외하고 문서를 통한 보고·회의를 지양하겠다. 모든 보직장은 솔선수범하는 모습을 보여달라.”지난 3일 한종희 삼성전자 부회장이 임직원들에게 보낸 e메일 내용이 알려지면서 기업의 ‘페이퍼리스(Paperless,종이 없는)’ 문화에 다시 재계의 관심이 쏠린다. 한 부회장은 이날 “대부분의 업무 환경이 디지털화했음에도 아직 회의 자료를 종이로 출력하고, 보고 때도 대면해 보고서로 내용을 확인하는 관행을 쉽게 버리지 못하고 있다”며 “메신저나 e메일을 통해 신속하게 의사결정하고, 디지털 장비를 활용해 일하는 습관을 만들어 나가자”고 말했다.김주원 기자삼성전자가 지난달부터 추진해온 ‘노 페이퍼 워크플레이스’ 캠페인에 대한 참여를 최고경영자(CEO)가 다시 한번 유도한 것이다. 이 회사 관계자는 “페이퍼리스는 지난해 9월 발표한 환경경영전략 실행 방안 중 하나”라고 설명했다.기업들 사이에 종이 사용을 줄이자는 캠페인이 벌어진 것은 최근의 일이 아니다. 2000년대 초반부터LG전자 등 많은 기업이 업무 효율화를 위해 전자문서 시스템을 도입해왔다.회의 문화도 과거와 달라졌다. A대기업 임원은 “몇 년 전만 해도 임원회의 전 회의안을 종이로 출력해 자리마다 한 부씩 뒀지만 요즘엔 주로 개별 모니터를 이용한다”고 말했다.하지만 보고 때는 여전히 종이를 주로 쓴다는 게 기업 관계자들의 말이다. 자세한 수치나 도표 등을 함께 보면서 설명해야 할 때가 많아서다. 그럼에도 전반적으로 종이 사용은 줄어드는 추세다. 한국제지연합회에 따르면 인쇄용지 생산량은 2017년 274만2297t에서 지난해 242만166t으로 줄었다.기업들이 다시 종이 없는 문화를 강조하는 것은ESG(환경·사회·지배구조) 경영 강화와도 관련 있다. 한 부회장 역시 “지구 위기를 극복하기 위한 동참”을 주문했다. 환경 보호를 위한 활동 중 하나라는 얘기다. 여기에 유연한 기업문화 조성이라는 목적이 더해졌다.SK이노베이션 등SK그룹 주요 계열사는 내부에서는 파워포인트 자료를 만들지 않고, A4 용지 한장으로 보고한다는 원칙을 지키고 있다. 출장 결재 때에도 정해진 품의서 양식 없이 e메일을 통해 출장 계획과 일정을 남긴 뒤 허가를 받으면 된다. 이 회사 관계자는 “기업문화 혁신을 가로막는 요인을 조사했을 때 불필요한 회의와 보고에 대한 불만이 많이 나왔다”고 말했다.재택근무 확산, 자율좌석제 도입 등도 페이퍼리스 문화에 영향을 끼쳤다. B기업 임원은 “나 외에 프린터 쓰는 직원을 본 적이 별로 없다. 종이가 떨어져도 내가 채워 넣는다”며 “이런 방향으로 계속 가면 정말 종이 없는 회사가 될 수도 있지 않겠나”라고 말했다.그렇다 해도 종이가 사라지지는 않을 것이라는 의견도 있다. C대기업 임원은 “아무래도 연령대가 높은 임원은 보고서를 출력해 가져오길 원하고, 빨간 펜으로 그으면서 본다”고 분위기를 전했다.김광현 고려대 경영대학 교수는 “페이퍼리스 문화는 기업들의 탄소중립 달성을 위한 움직임인 동시에 기업문화 변화를 위한 상징적 시도로 볼 수 있다”며 “다만 실제 기업문화 변화로 이어지려면 단순히 종이량을 줄인다는 메시지보다 좀 더 상호적이면서 형식보다 내용에 초점을 맞춘다는 방향성을 공유하는 것이 중요하다”고 말했다."
2022-04-22,"제습제 없앤 김, 10만개씩 팔린다…지구의 날 '엠제코' 착한 소비","22일 지구의 날을 맞아 유통가의 친환경 행보가 분주하다. 환경을 중시하는 가치 소비 확산과 더불어 환경에 관심이 많은 이른바 엠제코(MZ세대+ECO)세대가 주요 소비층으로 떠오르면서다. 포장재를 가볍게 하고, 생분해 플라스틱 소재를 활용한 의류를 내놓는가 하면 플로깅부터 나무심기까지 고객 참여형 캠페인도 활발하다.22일 지구의 날을 맞아 유통, 패션 업계의 발빠른 친환경 행보가 눈길을 끌고 있다. H&M 재단은 2015년부터 매년 친환경 패션 아이디어 공모전 '글로벌 체인지 어워드'를 진행하고 있다. [사진 H&M]━포장재에 진심, 생활밀착형 친환경21일 관련 업계에 따르면 롯데마트는 대형마트 최초로 그린스타 인증을 받았다. 한국경영인증원이 한국리서치의 소비자 조사를 통해 품질·디자인·사용자 환경 등 다양한 친환경성을 인증받은 상품이나 서비스를 발굴해 인증을 부여하는 제도다. 롯데마트는 자체제작(PB) 상품을 제작할 때 쉽게 뗄 수 있는 스티커를 사용하고, 에코 절취선을 넣어 분리 배출을 쉽게 하는 등 친환경 포장 가이드라인을 준수하고 있다. 22일 지구의 날을 맞이해서 친환경 식탁 김 상품도 단독 출시했다. 지난해 플라스틱 용기와 제습제를 없앤 김이 1년간 약 10만여개 이상 판매된 것에 착안해 김의 묶음 포장재를 해양 생분해 플라스틱 소재(PHA)로 만든 ‘CJ명가 직화구이 김(20봉)’을 롯데마트 단독으로 선보였다.롯데마트는PB상품을 중심으로 친환경 포장 가이드라인을 준수하고 있다. [사진 롯데마트]현대백화점은 백화점 업계 최초로 100% 재활용 가능한 친환경 종이컵을 도입했다. 친환경 종이컵은 현대백화점 압구정본점 등 전국 16개 전 점포 우수 고객 라운지와 카페H에서 사용된다. 국내 제지 전문기업 ‘한국 제지’에서 개발한 수용성 코팅 제지 ‘그린 실드’를 사용해 별도의 코팅 분리 과정 없이 재활용과 생분해가 가능한 것이 특징이다. 현대백화점 관계자는 “일반적으로 사용되는 종이컵은 플라스틱 소재인 폴리에틸렌(PE) 코팅으로 인해 재활용이 어렵다”며 “매년 약 620만개에 달하던 종이컵 소비를 친환경 종이컵으로 대체할 계획”이라고 했다.현대백화점은 친환경 쇼핑백에 이어 100% 재활용 가능한 친환경 종이컵을 도입한다. [사진 현대백화점]━친환경 아이디어 모집, 착한 패션 봇물글로벌 패션 업체 H&M은 비영리 기구인 H&M 재단을 통해 ‘2022 글로벌 체인지 어워드’를 개최, 우승 다섯 팀을 선발해 총 1백만 유로(약 13억8000만원)의 상금을 수여했다. 친환경 패션 아이디어 대회로 의류 수명을 연장하는 세탁 솔루션, 소규모 면화 농가들이 생산량과 수입을 늘릴 수 있도록 돕는 인공지능(AI) 서비스, 재생 농업을 통해 만들어진 지구 친화적인 구스다운 대체재 등이 소개됐다.폐페트병 재활용에 이어 화장품 공병을 재활용해 가방을 만든 플리츠마마. [사진 플리츠마마]패션 브랜드 플리츠마마는 자연주의 화장품 브랜드 이니스프리와 협업해 나노백을 선보였다. 이니스프리가 지난해 공병 수거 캠페인을 통해 모은 투명한 화장품 병을 원료로 만든 가방이다. 플리츠마마는 주로 폐페트병을 재활용해 제품의 원료로 사용해왔다. 이번 협업을 통해 처음으로 화장품 공병이라는 새로운 원료의 재활용에 도전했다.캐주얼 패션 브랜드NBA는 지구의 날을 맞아 그린 캠페인을 실시, 옥수수 원사 원단에 자연 친화적 그래픽 디자인을 더한 티셔츠·바지·슬리퍼 등을 출시했다. 노스페이스도 페트병 20개를 재활용한 리사이클링 폴리에스터 소재를 적용한 친환경 백팩을 출시했다. 매립 시 물과 미생물에 의해 분해되는 생분해 폴리에스터 원사를 적용한 아노락과 반발 티셔츠 등도 있다.노스페이스는 생분해성 폴리에스터 원사를 사용한 티셔츠와 아노락을 내놨다. [사진 노스페이스]━쓰레기 줍기부터 나무 심기까지, 참여형 이벤트도소비자들이 직접 참여할 수 있는 이벤트형 캠페인을 여는 업체들도 많다. 이케아는 22일까지 온·오프라인 채널에서 판매한LED전구 1개 또는 매장 내 스웨덴푸드마켓에서 판매한 플랜트볼 1팩당 1000원의 기부금을 비영리 환경 보전 기관인 세계자연기금(WWF)에 전달할 예정이다.이케아는LED전구 등을 판매한 일부 금액을WWF에 기부할 예정이다. [사진 이케아]생활가전기업 필립스는 바이오 베이스 플라스틱을 활용해 제작한 전기 주전자·드립 커피머신·토스터로 구성된 친환경 에코 키친 세트를 출시했다. 제품의 주요 몸체 부분이 식물성 폐식용유를 재활용해 만들어진 플라스틱이다. 기업이나 단체와 연계한 나무 심기를 도와주는 에코매처와 협력해 제품 한 개 구매 시 나무 한 그루를 심어 선물하는 ‘에코 모닝 나무 심기 캠페인’도 진행한다.필립스는 바이오 베이스의 플라스틱을 활용한 에코 키친 세트를 출시했다. [사진 필립스]식품업체 오리온은 플로깅 캠페인을 실시한다. 가볍게 걷고 뛰면서 쓰레기를 줍는 ‘플로깅’을 1시간 이상한 뒤 인증 사진을 찍어 해시태그를 달아 개인 인스타그램에 올리면 자동 응모된다. 추첨을 통해 총 20명에게 ‘닥터유제주용암수’ 무라벨 500mL2팩을 증정한다."
2022-08-10,추석 앞두고 택배상자 ‘골판지’ 수요 증가…“공급 문제 없다”,"추석이 꼭 한 달 앞으로 다가온 가운데, 선물 수요가 늘면서 택배 상자를 만드는 골판지 수요가 함께 증가하고 있다. 지난해에는 추석을 한 달 앞둔 8월 골판지 수요가 월평균 대비 7% 증가했는데, 정부는 “이번 추석과 관련한 택배 상자용 골판지 수급에는 큰 문제가 없다”고 밝혔다.4일 서울 성동구 이마트 성수점에서 시민이 추석 선물 세트를 살펴보고 있다. 연합뉴스10일 산업통상자원부에 따르면 지난달 골판지 수요는 올해 월평균(43만6000t)보다 2.5% 증가한 44만7000t 수준이다. 택배 물량이 점점 늘고 있지만, 정부는 쿠팡 등 유통업체의 다회용 가방 사용이 늘며 골판지 수요가 지난해와 비슷한 수준일 것으로 예상했다.정부는 지난달 골판지 공급량이 47만3000t으로 수요보다 많다고 집계했다. 재고량도 20만t 이상을 유지하고 있다.골판지 가격도 올해 초와 비슷한 ㎡당 1000원 수준(사과상자 1개 기준 약 1400원)을 유지하는 중이다. 국제 펄프 가격이 1월 대비 약 17% 상승했지만, 골판지의 주원료인 폐지 가격은 국산과 수입산 모두 연초보다 떨어졌기 때문이다. 산업부는 수입 펄프를 섞어 만드는 고급 골판지의 경우 가격이 인상됐지만, 전체 골판지에서 차지하는 비중이 작아 시장 가격에 미치는 영향이 크지 않은 것으로 분석했다.산업부 관계자는 “골판지 공급이 원활하지 않을 경우에 가격 상승과 함께 소비자 불편을 초래한다”며 “민간 단체와 안정적 수급에 노력해 왔다”고 설명했다. 이날 산업부는 서울 한국제지연합회에서 한국골판지포장산업협동조합 등 4개 단체 관계자와 함께 골판지 수급 상황을 점검했다."
2022-08-18,"중기중앙회, 중기 규제개혁 대토론회 개최","중소기업중앙회는 17일 여의도 중기중앙회에서 ‘중소기업 규제개혁 대토론회’를 개최했다.이번 토론회는 중소기업의 일자리 창출과 투자 활성화를 가로막는 규제를 발굴하고 개선하기 위해 마련됐으며, 토론회에 앞서 중기중앙회 전 임직원이 지난 2개월간 전국의 중소기업 현장을 돌며 찾은 229건의 ‘중소기업 규제개혁 과제집’을 정부에 전달했다.이날 정부에서는 △한덕수 국무총리 △이영 중소벤처기업부 장관 △방문규 국무조정실장 △유제철 환경부 차관 △이원재 국토교통부 차관 △권오상 식약처 차장을 비롯해 농림부, 고용부, 국세청 등 규제 관련 부처 실‧국장과 △이현재 하남시장이 참석했으며,중소기업계에서는 △김기문 중기중앙회장 △권혁홍 중기중앙회 수석부회장(한국제지공업협동조합 이사장)을 비롯해 중소기업 관련 단체장, 업종별 협동조합 이사장 등 총 130여명이 참석했다.이날 토론회에서는 △과도한LED조명 재활용 의무율(생산자책임재활용제도) 완화 등 △전체 행정구역보다 규제지역으로 묶여있는 면적이 1.6배나 넓은 경기북부 지역 중첩규제 개선 등 △임의인증임에도 불구하고 지자체, 공공기관에서 사실상 의무인증처럼 활용되고 있는 환경표지인증 등 △ 안경, 붕대, 체온계 등 위해성이 낮은 의료기기까지 보고해야 하는 의료기기 공급내역 보고제도 등 8개 분야 12건의 규제에 대한 현장건의가 이뤄졌다.김기문 중기중앙회장은 “중소기업은 대기업보다 규제 대응역랑이 낮고 현장의 목소리를 전달할 통로가 없어 어려움을 겪고 있다”며 “오늘 229건의 중소기업 현장규제 개혁과제를 전달했는데, 앞으로도 현장규제를 지속적으로 발굴하고 정부와 적극 소통하겠다”고 밝혔다.이날 토론회 부대행사로 규제 관련 부처(산업부, 환경부, 고용부, 국토부, 중기부)가 참여한 현장부스가 설치‧운영됐으며 사전신청을 한 약 20건의 규제에 대한 현장상담도 이뤄졌다."
2022-04-13,쇼핑백‧종이컵‧포장지‧아이스팩까지…친환경 꽂힌 유통업계,"유통업계에 친환경 바람이 불고 있다. 사업 구조 개편뿐 아니라 쇼핑백, 종이컵, 포장지, 아이스팩까지 다양한 품목에 친환경 소재를 적용하고 있다.현대백화점은 100% 재활용을 할 수 있는 종이컵을 도입한다고 13일 밝혔다. 국내 백화점업계에서 친환경 종이컵 도입은 최초다. 이 종이컵은 국내 제지전문업체인 한국제지에서 개발한 수용성 코팅 제지인 ‘그린실드’(GreenShield)로 만들었다. 대개 종이컵은 플라스틱 소재인 폴리에틸렌(PE)으로 코팅해 재활용이 어렵고 잘 썩지 않았다.현대백화점 친환경 종이컵. [사진 현대백화점]그린실드를 적용한 종이컵은 재활용은 물론 생분해된다. 이 종이컵을 도입하면 연간 125t의 폴리에틸렌 사용을 줄일 수 있고 약 300t의 이산화탄소 감축 효과가 있다고 현대백화점은 설명했다. 이는 소나무(30년산) 4만4000그루가 1년간 흡수하는 이산화탄소량과 같은 수준이다. 현대백화점은 지난달 쇼핑백을 재활용 재질로 바꿨다. 현대백화점 관계자는 “매년 약 620만개에 달하던 기존 종이컵을 친환경 종이컵으로 대체할 계획”이라고 말했다.농심도 포장 재질을 친환경 소재로 바꾼다. 13일 농심은 둥지냉면 묶음 포장(4개) 방식을 비닐 재포장에서 띠지로 변경한다고 밝혔다. 지난해 6월 포장을 간소화한 생생우동에 이어 두 번째다. 앞으로 둥지냉면은 4개를 비닐 포장재로 재포장하는 대신 스티커 형태의 띠지로 4개를 묶는다.비닐 포장 대신 띠지를 두른 농심의 둥지냉면 묶음세트. [사진 농심]포장 방식 변경으로 연간 약 27t의 플라스틱 필름 사용량을 줄일 수 있을 것으로 농심은 예상한다. 농심 관계자는 “생생우동과 둥지냉면에 띠지를 우선 적용한 이유는 면이 트레이에 담겨있어 띠지 포장으로도 유통 과정에서 적치와 진열 등에 문제가 없기 때문”이라며 “친환경 포장재에 대한 다양한 방안을 고민하고 있다”고 말했다.마켓컬리도 재생수지를 활용한 아이스팩을 개발, 사용하고 있다. 폐비닐을 재활용한 이 아이스팩은 재활용하나 수지와 새 비닐을 혼합한 원단을 만들고 이를 워터 아이스팩의 필름으로 사용하는 방식이다. 마켓컬리는 “이 방식으로 연말까지 비닐 생산량 104t,비닐 생산 시 발생하는 이산화탄소 230t 절감 효과가 있을 것”이라고 밝혔다."
2024-08-20,아침 9시인데 칠흑 같은…폭우에 잠긴 울산,"[포토]20일 아침 울산에 내린 폭우로 울주군 온산읍 한국제지 앞 도로가 침수돼 차량이 물에 잠겨 있다. 엑스(X) 갈무리20일 새벽부터 울산에 폭우가 쏟아져 집에 사람이 갇히고 차가 침수되는 등 피해가 잇따랐다.전날 자정부터 이날 오전 9시 10분까지 울산 대표 관측지점인 울산기상대(중구 서동) 기준 43.0㎜의 비가 내렸다. 호우로 도로에 물이 차올라 차량 여러 대가 물에 잠기고, 주택 1층에 사람이 갇히기도 했다.20일 오전 울산시 울주군 온산읍의 한 도로변에 집중호우 영향으로 인접 옹벽에서 유출된 토사가 쏟아져 있다. 울주군 제공아침 6시 30분께 울산시 울주군 온산읍 원산리 한국제지 앞 도로에 폭우로 물이 차오르면서 차량 3대가 침수됐다. 경찰은 도로 양방향 통행을 통제하고, 침수 차량에 대한 견인 작업을 했다 아침 7시 10분에는 울주군 서생면의 한 주택에서 침수로 인해 1층 방에 있던 주민이 고립됐다 구조됐다. 현재 인명 피해는 없는 것으로 확인되고 있다."
2022-08-10,택배 물량 늘어도 골판지 수요 안정세…추석 앞두고 월 45만t,"“다회용 배송 상자 사용 증가 영향”게티이미지뱅크택배 물량의 꾸준한 증가에도 택배 상자용 골판지 수요는 안정세를 유지하고 있는 것으로 나타났다. 유통업체들이 여러 번 사용할 수 있는 다회용 배송 상자 사용을 늘린 탓으로 풀이된다.10일 산업통상자원부 자료를 보면, 7월 택배 상자용 골판지 수요(원지 내수 기준)는 44만7천t(톤)으로 집계됐다. 상반기 월평균 43만6천t보다 2.5% 늘어난 수준이다. 5월엔 42만7천t,6월엔 46만1천t이었다. 산업부는 “택배 물량 증가에도 불구하고 쿠팡 등 유통업체에서 일회용 택배 상자 대신 다회용 ‘프레시 백’ 사용 증가 등의 영향으로 (택배 상자용 골판지 수요는) 작년(8월 44만6천t)과 비슷한 수준”이라고 풀이했다.골판지 공급(원지 생산 기준)은 7월 기준 47만3천t,재고량은 예년 평균(24만t) 수준인 22만9천t에 이르는 것으로 집계됐다. 이는 골판지의 주원료인 폐지 공급이 원활했기 때문이라고 산업부는 분석했다. 폐지 월간 재고량은 지난해 10월 25만3천t,올해 1월 25만t,4월 27만2천t,7월 23만5천t 수준이다.골판지 가격은 연초와 동일한 ㎡당 1천원을 유지하고 있다고 산업부는 전했다. 사과 상자 1개 기준으로 1400원대 수준이다. 국제 펄프(UKP·미표백펄프) 가격이 1월 t당 738달러에서 6월 859달러로 17%가량 오른 것과 대조적인 흐름이다. 산업부는 “골판지의 주원료인 폐지 가격이 국산·수입산 모두 연초 대비 큰 변동 없이 유지됐기 때문”이라고 밝혔다. 수입 펄프를 섞어 만드는 고급 골판지 표면지는 국제 펄프값 상승으로 인해 8월부터 국내 가격이 t당 6만원가량 인상됐으나 골판지에 쓰이는 비중이 작아 가격에 큰 영향을 미치지 않았다고 덧붙였다.산업부는 이날 서울 강남구 한국제지연합회 회의실에서 제지연합회, 골판지포장산업협동조합 등 관계자들을 만나 골판지 수급 상황을 점검했다. 지난해엔 추석을 한 달 앞둔 8월 골판지 수요가 44만6천t으로 1~7월 평균(41만7천t)보다 7% 증가한 바 있다."
2022-05-16,그림 구겨던지는 예술가? 종잇값 급등에 붓질하기 무섭다,"국제 펄프 가격 급등…제지업계 종잇값 일제히 인상생활필수품 휴지 이어 미술용 종이∙캔버스 가격 올라“붓질 한번 잘못해 종이 버릴까”…나무판에 그리기도게티이미지뱅크.“그림 그릴 때마다 비싸진 재료 가격 때문에 ‘망치면 안 된다’는 생각이 절로 들어요.”대학에서 서양화를 전공한 화가 정다희(29)씨는 한달 전부터 그림 그릴 때 필요한 캔버스 구입을 망설이고 있다. 천과 목재 가격이 올라 캔버스 가격이 크게 오른 탓이다. “캔버스 가격이 너무 많이 올라 도저히 살 수가 없어요. 일단 가격이 내릴 때까지 버티려고 합니다. 재룟값을 벌기 위해 아르바이트 자리도 더 구하려고요.”국제 원자재 가격 상승으로 국제 펄프 가격이 급등하면서 종잇값이 들썩이고 있다. 최근 생활필수품인 화장지, 티슈 가격이 오르고 있는데, 지갑 사정이 넉넉지 않은 미대생들과 예술인들에게도 영향을 끼치고 있다.16일 서울 마포구 홍익대 근처 ㅎ화방 직원은 “2주 전 20만원 초반대였던 캔버스 가격이 지금은 28만8천원으로 8만∼9만원 정도 올랐다. 주로 학생들이 찾는 곳이라 최대한 가격을 올리지 않고 버티는 중인데, 물가가 계속 오르고 있어 이제는 가격을 올려야 하는 건 아닌지 고민”이라고 했다. 화방에서 재료를 고르던 서양화 전공 대학원생 윤아무개(24)씨는 “평소 천과 나무가 함께 있는 캔버스를 실습할 때 쓰곤 했는데 요즘엔 가격이 너무 올라서 2900원짜리 나무판으로 대신해 쓰고 있다”고 말했다. 한번 붓질을 잘못하면 종이를 그대로 버려야 하는 수채화, 동양화 전공 예술가들의 걱정은 더 깊다. 한 동양화 작가는 “그림 그릴 때마다 마음이 떨린다. 붓질 한 번 잘못했다가 한지나 종이 버리는 게 제일 마음이 아프다”고 했다.최근 주요 제지업체들은 펄프 가격 인상 압박을 못 이겨 일제히 종이 가격을 올리자 연쇄적으로 관련 제품 가격이 올랐다. 국내 1∙2위 제지기업인 한솔제지와 무림페이퍼는 지난 1일부터 종이 가격을 15% 인상했다. 무림페이퍼 쪽은 “코로나19 2년 동안 제지업계가 불황을 겪은 상황에서 펄프 등 원자재 가격이 오르면서 부득이하게 가격을 올릴 수밖에 없었다. 아직 확정된 건 아니지만 앞으로 물가가 더 오르면 또다시 가격을 인상할 수 있지 않을까 생각한다”고 말했다.산업통상자원부가 공개한 원자재 가격을 보면, 섬유나 종이를 만드는 데 들어가는 펄프 가격은 지난달 21일 기준 1톤당 840달러였다. 올해 초보다 15.86% 올랐다. 대한목재협회가 발표한 ‘2022년 3월 목재 가격 동향’을 보면 러시아산 제재목 가격은 1㎥당 최대 90만원으로, 지난해 같은 기간 54만원에 견줘 60% 이상 급등했다. 목재·펄프 주요 생산국 내부 요인과 러시아의 우크라이나 침공 영향이 복합적으로 작용한 것으로 분석된다. 한국제지연합회 쪽은 <한겨레>에 “산림자원이 넉넉하지 않은 우리나라 같은 경우 국제 펄프 가격에 직접적인 영향을 받을 수밖에 없다. 우크라이나에서 생산된 옥수수 전분이 고급 인쇄용지 표면의 틈새를 메꾸는 데 주로 사용되는데 최근 러시아·우크라이나 사태도 제지 가격에 큰 영향을 줬다”고 설명했다."
