date,title,content
2024-07-11,‘가상화폐로 90억원대 비자금 조성’ 한컴 차남 징역 3년 법정구속,"한글과컴퓨터 김상철 회장 아들 김모 씨가 지난해 12월 13일 오전 경기도 수원시 영통구 수원남부경찰서에서 검찰로 송치되고 있다. 연합뉴스회사에서 발행한 암호화폐를 팔아 비자금을 조성하고 사적으로 사용한 혐의로 기소된  ‘한글과컴퓨터’ 김상철 회장의 차남이 1심에서 실형을 선고받고 법정구속됐다.수원지법 성남지원 형사1부(허용구 부장판사)는 11일 특정경제범죄가중처벌법상 배임 혐의를 받는 김모씨(35)에게 징역 3년을 선고했다. 같은 혐의로 함께 기소된 한컴 계열사가 투자한 가상화폐 운용사 아로와나테크 대표 정모(48)씨에게는 징역 2년 6월이 선고됐다.지난 3월 조건부 보석으로 석방돼 불구속 재판을 받아온 이들은 이날 실형 선고로 법정 구속됐다.재판부는 이날 “한컴 그룹의 총수 아들과 자회사 대표가 일반인들의 투자금을 끌어모아 이를 유용한 형태를 고려하면 이 사건 범죄는 매우 중대하고 사회적 해악이 너무 커 엄하게 처벌할 필요가 있다”고 선고 이유를 설명했다.그러면서 “김씨는 피해 회사를 실질적으로 지배하는 김상철의 아들로 실질적 영향력을 이용해 피해 회사에 귀속돼야 할 수익 중 일부를 자신과 가족들을 위해 방만하게 사용했다”고 지적했다. 더불어 “피고인들은 사회적 지위가 있기 때문에 거기에 따른 책임이 따른다”며 “이름없는 절도 사건과 다르다”고 꾸짖었다.한컴그룹 계열사 이사 김씨와 이 계열사 대표 정씨는 지난 2021년 12월부터 2022년 6월까지 국내 가상자산 컨설팅 업자에게 아로와나토큰 1457만1000여개 매도를 의뢰해 수수료 등을 공제한 정산금 80억3000만원 상당의 이더리움과 비트코인을 김씨 개인 전자지갑으로 전송받는 수법으로 비자금을 조성한 혐의를 받는다. 또 2022년 3월 해외 가상자산 관련 업자에게 아로와나토큰 400만개의 운용과 매도를 의뢰한 후 운용수익금 15억7000만원 상당의 가상화폐를 김씨 개인 전자지갑으로 전송받은 혐의도 있다.검찰은 김씨가 조성한 비자금이 약 96억원에 달하며 그가 비자금으로NFT(Non-fungibletoken·대체불가능토큰) 구매, 주식매입, 신용카드 대금 지급, 백화점 물품 구매 등 개인적으로 사용했다고 봤다.아로와나토큰은 한컴 계열사인 블록체인 전문기업 한컴위드에서 지분을 투자한 가상화폐다. 한컴그룹 측 자금으로 인수된 아로와나테크는 아로와나토큰 총 5억개를 발행하면서 이를 디지털 6대 금융사업 플랫폼에서 이용할 수 있는 가상자산이라고 홍보했다.아로와나토큰은 2021년 4월 20일 국내 가상자산 거래소에 상장됐으나, 2022년 8월 9일 거래소는 이 가상화폐 상장을 폐지했다.검찰은 “선량한 투자자들이 상장된 아로와나토큰의 가치를 신뢰해 매수한 자금이 피고인들의 비자금 조성 및 개인적 사용에 이용됐다”며 이들을 재판에 넘겼다. 또 “그로 인해 토큰사업 실현 가능성이 희박해졌고 시세마저 급락하면서 투자자들에게 막대한 손실을 끼치는 등 사회적 비난 가능성이 크다”며 기소 이유를 밝혔다.검찰은 앞서 김씨에게 징역 9년을 구형했다."
2023-12-09,'한컴코인'도 터졌다…주인 9번 바뀐 '국민벤처'의 기구한 운명,"한글과컴퓨터의 기구한 역사에 또 한 페이지가 추가됐다. 김상철 한컴 회장의 아들 김모씨가 100억원대 ‘코인 비자금’을 조성한 혐의(업무상 배임·횡령)로 지난 5일 구속되면서다. 한컴은 “현재 경영진과는 무관하다”며 오너 리스크에 선을 긋지만, 내부 직원들 사이에선 “9번의 오너 교체 끝에 안정을 찾나 했더니 요즘 다시 침통한 분위기”라는 자조섞인 말이 나온다.경기 성남시 판교에 위치한 한글과컴퓨터 본사. 뉴스1━파란만장 한컴의 굴곡진 33년한컴은 1990년 설립 이래 숱한 부침(浮沈)을 겪었다. 마이크로소프트(MS) 오피스가 세계 워드프로세서 시장을 호령하던 1990년대 후반, 한컴은 국산 대항마 ‘아래아한글’로 국내 시장을 지켰다는 평가를 받았지만 불법 복제와 외환위기 사태가 겹치며 1998년 부도 위기에 내몰렸다. 당시 아래아한글 사용자 300만명 중 250만명 이상이 불법 복제판을 썼다.1998년 6월 19일 서울 역삼동 벤처기업협회의 아래아한글 지키기 사용자 1만원내기 운동 성금 접수창구에서 한 네티즌이 성금을 낸 뒤 엄지손가락을 내보이고 있다. 중앙포토경영난을 이기지 못하고MS에 한컴을 넘기려던 창업자 이찬진 사장은 아래아한글 살리기 운동본부(본부장 故이민화 전 메디슨 회장) 덕에 구사일생한다. 국내 대표 ‘벤처 1세대’였던 이민화 회장은 토종벤처를 살리겠다는 일념으로 2000년 한컴을 인수하지만, 정작 메디슨이 부도가 나며 한컴은 주인 없는 신세로 2년을 보내게 된다.2001년부터 2003년까지 한컴의 최대주주는 웨스트에비뉴에이전트(홍콩계 사모펀드)→티티엠→넥스젠캐피탈(아일랜드계 투자회사)→서울시스템으로 4번 바뀌었다. 그마저도 기존 최대주주가 보유지분 전량을 장내매각해 갑작스레 지분 1.57%짜리 최대주주가 되거나(티티엠), 경영 목적 없이 지분 8.62%만 사들여 최대주주에 등극하는 식(넥스젠캐피탈)이었다. 치열한 인수전이 아닌, 떠넘기기식 오너 교체가 거듭된 것이다.신재민 기자━프라임그룹 이후 사법리스크 끊이지 않아변곡점은 2003년 찾아왔다. 테크노마트·프라임저축은행 등으로 사세 확장을 꾀하던 프라임그룹이 경영 의지를 보이며 한컴을 인수한 것이다. 한IT업계 인사는 “당시 부동산 개발업자라고 하면 위법한 일에 손대야 클 수 있었다. 한컴의 ‘국민 벤처’ 이미지를 원했을 것”이라고 기억했다. 한컴·사이버패스·동아건설 등을 차례로 인수한 프라임그룹은 이내 계열사 15개를 거느린 중견그룹으로 전성기를 맞았다.2005년 신도림 테크노마트 개장 당시 나온 프라임그룹의TVCF.관계사에 '한글과컴퓨터'가 써있다. 중앙포토하지만 봄은 길지 않았다. 2008년 ‘프라임그룹 비자금 조성 의혹’이 대대적으로 불거졌다. 각종 정·관계 로비 의혹과 부실 대출, 배임·횡령 의혹 등이 연달아 터졌다. 백종헌 회장은 퇴임 1년차였던 정상명 전 검찰총장을 변호인으로 선임하는 등 사법리스크 대응에 총력을 기울였지만, 그해 11월 구속 기소됐다. 한컴에도 위기가 닥쳤다. 백 회장의 동생 백종진 한컴 대표가 회삿돈 수십억 원을 프라임그룹 계열사 주식을 인수하는 데 쓴 혐의(횡령)로 그해 9월 백 회장보다 먼저 구속 기소된 것이다. 백종진 대표는 2010년 경제사범 가운데선 이례적으로 징역 5년과 추징금 29억원이 확정됐다.지난 2008년 백종헌 프라임그룹 회장이 서울 마포구 서부지검에서 횡령 및 배임 혐의 등으로 소환조사를 받은 뒤 귀가하고 있다. 연합뉴스오너 부재 상태가 된 한컴은 2009년 삼보컴퓨터 컨소시엄(셀런)을 8번째 주인으로 맞는다. 그러나 한컴 인수를 위해 무리한 담보 대출 등을 감행했던 김영민 셀런 대표와 동생 김영익 한컴 대표가 1년도 안 돼 배임·횡령 혐의로 재판에 넘겨지면서 한컴은 또다시 매물 처지가 된다. 현재의 오너 일가가 나타난 것이 이때다.━김상철 일가의 등장, 그리고 13년 만의 오너리스크김상철 한컴 회장. 중앙포토각각 ‘M&A 전문가’ ‘미국 1세대 벤처사업가’로 알려져 있던 김상철 소프트포럼 회장과 김정실 캐피탈익스프레스 회장 부부는 2010년 9월 서울 도곡동 소프트포럼 사옥을 매각한 대금과 사재, 사모펀드 등을 끼워 670억원에 한컴을 인수했다. 김상철 체제에서 한컴은 마스크, 금 거래소, 노인요양원, 모빌리티 등 다분야 M&A를 통해 돈 되는 사업이라면 뭐든 과감히 뛰어드는 기업으로 변모했다. 매출은 2013년 685억원에서 2020년 4014억원까지 꾸준히 성장 곡선을 그렸다. 다만 최근 3년 실적은 2019~2020년에는 미치지 못한다.신재민 기자10여 년간 한컴을 안정시킨 김 회장은 2020년 장녀 김연수에게 경영권 승계 작업을 시작했다. 이듬해 취임한 김연수 한컴 대표는 지난해 7월 1000억원에 한컴MDS·한컴로보틱스·한컴모빌리티 등 계열사 12개를 매각하며 자신만의 사업을 정돈하고 있다. 이 과정에서 불거진 게 이번 ‘아로와나토큰 비자금 사태’다. 익명을 원한 복수의 법조계 및IT업계 인사는 “김 회장이 승계 구도에서 밀려난 아들 김씨를 챙겨주려다 탈이 난 것으로 안다”고 전했다. 검찰 관계자는 “경찰에서 사건이 송치되는 대로 김상철 회장의 연루 의혹 등도 검토할 예정”이라고 밝혔다.‘한컴 코인’이란 후광을 업고 2021년 발행된 아로와나토큰은 가상화폐 거래소 빗썸 상장 당일 50원이었던 시작가가 30분 만에 5만3000원대가 되는 등 1000배 이상이 뛰며 불법 시세조종 의혹을 받았다. 수사당국은 코인 브로커가 아로와나토큰 매도 차익으로 사들인 100억원대 비트코인, 이더리움, 미술NFT등이 회장 아들 김씨의 비자금이 된 것으로 보고 있다. 수원지법 성남지원 이도행 영장전담 부장판사는 지난 5일 “증거 인멸의 염려와 도망할 염려가 있다”며 김씨와 아로와나테크 대표 정모씨에게 구속영장을 발부했다."
2023-12-13,'한컴' 김상철 회장 아들 구속송치…100억원 비자금 관여 혐의,"회사에서 발행한 암호화폐를 팔아 비자금을 조성했다는 의혹을 받는 ‘한글과컴퓨터’ 김상철 회장의 아들이 검찰에 송치됐다.13일 오전 경기남부청 반부패·경제범죄수사대는 업무상 배임·횡령 혐의를 받는 김 회장의 아들 김모씨와 암호화폐 발행 업체 대표 정모씨를 구속 송치했다. 연합뉴스경기남부청 반부패·경제범죄수사대는 13일 업무상 배임·횡령 혐의를 받는 김 회장의 아들 김모씨와 암호화폐 발행 업체인 아로와나테크 대표 정모씨를 수원지검 성남지청에 구속 송치했다. 이날 오전 수원남부경찰서를 나온 김씨 등은 혐의 인정 여부를 묻는 취재진 질문에 아무런 답변을 하지 않은 채 호송차에 올랐다.김씨 등은 시세조종 의혹을 받는 아로와나토큰을 매도한 차익으로 비트코인 등을 사들여 100억원대 비자금을 조성한 혐의를 받고 있다. 2021년 4월 발행된 아로와나토큰은 한컴 계열사 한컴위드가 지분을 투자해 ‘한컴 코인’이라고 불리며 주목받은 코인이다. 이 코인은 거래소 빗썸 상장 당일 50원이었던 상장가가 30분만에 5만3800원까지 1075배나 치솟아 시세 조종 의혹을 받았다.경찰은 김씨 등이 내부 정보를 이용해 코인을 사고팔며 형성된 100억원대 비자금이 한컴위드 사내이사였던 김씨 계좌로 흘러들어간 정황을 포착한 것으로 파악됐다.김 회장과 아들 김씨의 혐의는 그간 8번에 걸쳐 오너가 바뀌어온 한컴의 역사와도 연관이 깊다. 1990년대 출시 당시부터 국산 워드프로세서로 큰 호응을 받았던 한컴의 ‘아래아한글’은 불법 복제와 외환위기로 1998년 부도 위기를 맞아 고(故) 이민화 전 매디슨 회장에게 인수됐다. 그러나 매디슨도 부도가 난 탓에 한컴은 이후에도 2003년까지 주인이 5번 교체되는 수난을 겪었다.2003년 프라임그룹의 인수 이후 안정기를 찾아가던 한컴은 2008년 프라임그룹 비자금 의혹으로 오너 부재 상태를 겪다 2009년 삼보컴퓨터에 인수됐고, 1년 후 다시 대표가 배임·횡령 혐의로 기소되면서 현재의 오너인 김상철 회장 일가에 인수됐다.2010년 한컴을 인수 김 회장 일가는 마스크, 금 거래소, 노인 요양원 등 다양한 사업에 뛰어들었다. 2021년 경영권 승계 과정에서 무렵 계열사를 정리하기 시작했다. 경찰은 아들 김씨뿐만 아니라 김 회장도 업무상 배임 등 혐의로 형사 입건하고 수사 중이다."
2024-07-17,"檢, 비자금 조성 혐의 김상철 한컴 회장 구속영장 청구","김상철 한글과컴퓨터그룹 회장. 중앙포토검찰이 가상화폐로 비자금을 조성한 의혹을 받는 김상철(71) 한글과컴퓨터그룹 회장에 대해 구속영장을 청구했다.수원지검 성남지청 형사3부(부장검사 강성기)는 지난 16일 김 회장에 대해 특정경제범죄가중처벌등에관한법률위반(배임) 혐의로 구속영장을 청구했다고 17일 밝혔다.김 회장에 대한 구속 전 피의자심문(영장실질심사)는 오는 18일 오전 11시 수원지법 성남지원에 열린다.김 회장은 ‘아로와나토큰’으로 비자금을 조성한 사건 전반을 주도한 혐의를 받고 있다.아로와나토큰은 한컴그룹 계열사이자 블록체인 전문기업 한컴위드가 지분을 투자한 가상화폐다. 2021년 4월 20일 첫 상장한 지 30분 만에 최초 거래가인 50원에서 1075배(10만7500%)인 5만3800원까지 치솟아 시세 조작 의혹이 불거졌다. 이와함께 김 회장이 아로와나토큰을 이용해 100억원 가까운 비자금을 조성했다는 의혹이 제기됐다.이에 경찰은 2022년 10월 한컴그룹 회장실과 한컴위드 본사, 김 회장 자택 등을 압수수색하는 등 수사를 벌여왔다. 이 사건을 수사 중인 경기남부경찰청 반부패·경제범죄수사대는 지난달 말 김 회장에 대한 사전구속영장을 검찰에 신청했다.검찰은 배임 혐의 여부 및 사건 기록 검토와 함께 김 회장의 차남 김씨 등의 1심 판결 선고 내용을 종합적으로 판단해 구속영장을 청구했다.한글과컴퓨터 김상철 회장 아들 김모 씨가 지난해 12월 13일 오전 경기도 수원시 영통구 수원남부경찰서에서 검찰로 송치되고 있다. 연합뉴스아로와나토큰을 이용해 비자금을 만드는 것에 관여했다는 의혹을 받는 김 회장의 차남이자 한컴위드 사내 이사인 김모씨(35)와 가상화폐 운용사 아로와나테크 대표 정모씨(48)는 지난해 12월 검찰에 송치했다. 김씨와 정씨는 지난 11일 이 사건 1심에서 징역 3년과 징역 2년 6월을 각각 선고받고 법정구속됐다.차남 김씨와 정씨는 지난 2021년 12월부터 2022년 6월까지 국내 가상자산 컨설팅 업자에게 아로와나토큰 1457만 1000여개 매도를 의뢰해 수수료 등을 공제한 정산금 80억3000만원 상당의 이더리움과 비트코인을 김씨 개인 전자지갑으로 전송받는 수법으로 비자금을 조성한 혐의를 받고 있다. 또 2022년 3월 해외 가상자산 관련 업자에게 아로와나토큰 400만개의 운용과 매도를 의뢰한 후 운용수익금 15억7000만원 상당의 가상화폐를 김씨 개인 전자지갑으로 전송받은 혐의도 있다. 이들이 이렇게 조성한 비자금은 96억원에 달하는데, 이 사건에 김 회장이 깊이 관여했다는 게 수사 당국의 판단이다."
2023-12-19,[박선영의 마켓 나우] 블록체인의 ‘야누스적 순간’,"박선영 동국대 교수(경제학)곧 새해다. 1월을 뜻하는 재뉴어리(January)는 야누스(Janus)에서 나왔다. 그리스에서 수입된 신(神)이 아니라 로마 고유의 신이었던 야누스는 얼굴이 둘이었다. 두 얼굴은 시종(始終), 출입, 안팎, 앞뒤, 관문, 전환, 과거와 미래를 상징했다. 기원전 3세기 주화를 장식했던 야누스는 화폐의 역사에 막 데뷔한 블록체인의 입지를 상징한다. 현재 블록체인은 과거 가상자산시장의 혼탁함을 정리하면서 미래 혁신의 가능성을 모색하는 결정적인 ‘야누스적 순간’에 서 있다.김지윤 기자먼저 과거의 정리와 반성이다. 최근 한글과컴퓨터 회장의 아들이 아로와나토큰의 시세조종으로 비자금을 조성한 혐의로 구속 송치됐다. 아로와나토큰은 한컴 계열사인 블록체인 전문기업 한컴위드가 지분을 투자한 가상자산으로 2021년 4월 20일 상장한 지 30분 만에 최초 거래가인 50원에서 1075배 5만3800원까지 치솟아 당시 시세조종 의혹이 파다했다. 그간 논란을 빚은 가상자산이 아로와나토큰뿐이겠는가? 다행히 내년 7월 시행예정인 ‘가상자산 이용자 보호 등에 관한 법률’의 시행령과 감독규정 제정안이 지난 11일 입법 예고됐다. 이 법이 성공하면 글로벌 가상자산시장의 규율체계에서도 모범이 될 것이다.동시에 블록체인은 미래금융의 혁신적인 전환 가능성을 제시한다. 디지털 화폐를 주제로 14·15일 기획재정부·한국은행·금융위원회·국제통화기금(IMF)이 공동주최하는 국제 콘퍼런스가 서울에서 열렸다. 이창용 한국은행 총재는 경제의 디지털화는 피할 수 없는 흐름으로, 중앙은행 디지털 화폐(CBDC) 도입 논의는 더 이상 미룰 수 없는 시급하고도 중요한 과제라고 강조했다. 내년 예정된 2단계CBDC파일럿테스트에서는 일반인 대상으로 예금토큰을 활용한 실거래 테스트도 예정돼 있다. 크리스탈리나 게오르기에바IMF총재 또한 첨단기술을 이용해 효율성·상호운용성·접근성이 뛰어난 금융시스템을 만드는 것이 목표임을 분명히 했다.블록체인 커뮤니티와 가상자산 시장에서 한국의 글로벌 영향력은 이미 상당하다. 블룸버그 등 매체에 따르면 11월 원화가 가상자산 시장에서 달러를 누르고 가장 거래량이 많은 법정통화가 됐다. 9월부터 현재까지 비트코인 거래에서 원화 거래량은 17%포인트 증가한 41%, 달러 거래량은 11%포인트 감소한 40%로 집계됐다. 최근 비트코인 가격상승에 국내 투자자들이 영향을 미쳤다고 분석된다. 국내 블록체인과 가상자산에 대한 관심을 미래 혁신에 대한 추진력으로 승화해야 한다. 과거를 청산하기 위한 제도적 기틀이 갖춰지고 미래를 준비하기 위한 파일럿테스트가 준비 중인 지금이 블록체인의 야누스적 순간이다.박선영 동국대 교수(경제학)"
2022-02-27,"나팔꽃 그린 유홍준, 눈물 쏟은 김희애…발길 이어지는 이어령 빈소","이어령 전 문화부 장관 빈소에 놓인 영정사진은 2019년 한 인터뷰를 위해 찍은 사진이다. 연합뉴스""선생님의 유일한 '웃는 표정' 사진입니다""27일 서울대학교병원 장례식장에 마련된 고 이어령 선생의 빈소에는 보라색 니트 차림에 편안한 표정을 지은 선생의 영정사진이 놓였다. 2019년 한 주간지 인터뷰 당시 사진작가 이동춘씨가 찍은 사진이다. '평론가는 웃지 않는다'는 신조를 가졌다는 선생의 사진 대다수가 근엄하고 날카로운 인상인 데 비해, 이 사진이 가장 '편안해 보여서' 골랐다고 했다. 영인문학관 관계자는 ""너무 옛날 사진 말고 2017~2021년 사진을 살폈는데, 선생님이 대개 인상을 쓰거나, 손짓을 하는 등 강렬한 사진이 많지만 이 사진을 찍을 때는 집에서 진행한 인터뷰여서인지 편안해 보인다""고 했다.장례식의 주인공이 환하게 웃는 빈소에는 27일 하루 종일 조화가 밀려들었다. 장례식장 관리자들이 화환에서 리본만 잘라내고 꽃을 치워도 두 시간이면 다시 통로가 꽉 찰 정도였다. 유족 관계자는 ""처음에는 가족장으로 치르며 조화도 거절했는데, 문화체육관광부장(葬)으로 변경되고, 빈소가 커지면서 화환이 계속 들어온다. 걷잡을 수 없을 정도""라고 전했다.━유홍준의 마지막 편지는 '나팔꽃'유홍준 전 청장은 급하게 그린 나팔꽃 그림을 더 곱게 마무리하고 싶다며 집에 가는 택시를 잡기 직전에 발길을 돌려 빈소에 다시 왔다. 나팔꽃 테두리와 덩쿨의 가장자리를 몇 번이고 덧칠하고 덩쿨손도 공들여 더 그린 뒤에야 편안한 표정으로 빈소를 떠났다. 김정연 기자빈소에서는 고인의 뜻에 따라 부의금은 받지 않는다. 문상객은 방명록만 작성하고, 절 없이 목례만 한다. 대신 유족은 '이어령 선생님께 올리는 글'이란 제목을 붙인 노트를 비치했다. 선생을 가까이 모셨던 사람들이나 문화예술계 인사들이 남기고 싶은 말을 적도록 했다.유홍준 전 문화재청장은 ""고인을 생각하면 떠오르는 이미지""라며 나팔꽃을 그렸다. 하지만 빈소를 나서 집에 돌아가던 발길을 돌려 다시 빈소로 돌아왔다. ""택시 타기 직전 문득 마무리를 덜 예쁘게 한 게 아쉽더라""며 나팔꽃과 이파리의 테두리를 덧칠하고 자신이 그림 그림을 휴대전화로 사진 찍어 돌아갔다.이어령 전 장관의 빈소를 찾은 유홍준 전 문화재청장과 김홍신 작가가 '이어령 선생님께 올리는 글' 책자에 쓴 마지막 편지. 김정연 기자━대통령, 총리, 시인, 배우… ""사회 아우른 문화의 큰 별""27일 이어령 전 장관 빈소를 찾은 김부겸 총리. 김정연 기자장례 첫날인 26일 문재인 대통령, 더불어민주당 이재명 대선후보, 소리꾼 장사익, 88올림픽 '굴렁쇠 소년' 배우 윤태웅 등이 빈소를 찾았다. 27일에는 김부겸 총리, 정재승 카이스트 교수, 김덕수 사물놀이 명인, 나태주 시인 등이 문상했다. 남궁진 전 장관의 ""지성의 큰 별이 아니라, 사회를 아우르는 문화의 큰 별이셨던 분""이라고 표현했다. 그런 만큼 다양한 사람들이 이어령 선생을 추모했다. 김부겸 총리는 ""중학교 때 문명비평적인 글을 고인을 통해 처음 접했고, 그 후 사석에서 몇 번 뵌 적이 있다""며 ""저희에게는 세대의 스승""이라고 했다. 오전 11시쯤 빈소를 찾은 정재승 카이스트 교수는 약 30분간 머물렀다. 지난해 여러 차례 학문에 관한 긴 대화를 나눴다고 했다. 오세훈 서울시장, 최재형 전 감사원장, 김현모 문화재청장도 빈소를 찾았다.오후 3시 40분쯤 빈소를 찾은 이찬진 전 한글과컴퓨터 대표와 부인인 배우 김희애씨는 조문 후 고인의 부인인 강인숙 영인문학관장의 손을 붙들고 한동안 목소리를 낮춰 이야기하며 눈물을 훔쳤다. 대화를 마친 후 눈이 붉어지고 코를 훌쩍일 정도였다. 이찬진 전 대표가 '한글과컴퓨터'를 창업했던 초기에 이어령 선생이 가능성을 알아보고 여러 지원을 해주며 인연이 시작됐다고 했다. 한 유족 관계자는 ""이찬진이라는 보석을 알아봐 준 사람이 선생님이었다. 아이들까지 데리고 왕래가 잦았던 만큼 상심도 큰 것 같다""고 전했다.이어령 전 장관 빈소에는 다양한 분야에서 조의를 표했다. 한국예술종합학교 등 문화예술계 기관과 단체를 비롯해 하이브,SM등 엔터테인먼트사, 배우 마동석의 '빅펀치픽쳐스' 조화도 있었다. 배우 고소영과 장동건 부부도 조화를 보냈다. 김정연 기자소설가 김홍신씨는""지난 1월 '김 선생은 나 대신 오래 살아서 문학을 일궈야 해, 먼저 가서 미안하다' 하시더니…""라며 눈물을 훔쳤다. ""최근 주변 지인들에게 '선생님의 건강을 기원하며 108배를 하겠다'는 내용의 문자를 보내겠다고 선생님께 문자 보냈더니 선생의 답이 '나도'였다. 짧고 재치를 담은 건데, 웃기면서도 눈물이 나는 선생의 마지막 말이 오래 맴돌 것 같다""고 말했다. 이어령 선생은 김홍신씨와 80년대 초부터 연을 쌓았지만, 이름을 부르지 않고 늘 '김 선생'으로 불렀다고 했다.27일 네이버 모바일 메인화면에도 이어령 선생을 추모하는 알림이 떴다. 네이버 캡쳐"
