date,title,content
2024-07-09,"현대車만 보던 계열사, 경쟁사 사로잡으며 ‘매출 100조’","[축적의 50년, 현대차의 기적][5·끝] 경쟁력 커진 4대 계열사다음 달 현대차·기아의 R&D(연구·개발) 역사가 50년을 맞는다. 반세기 만에 현대차그룹은 선진국의 자동차 기업들을 쫓아 지난해 2년 연속 글로벌 ‘톱3′ 자동차 기업에 오를 수 있었다. 이 축적의 50년은 자동차 산업이 우리 수출의 핵심 버팀목이자 국가 경제의 한 축으로 자리 잡는 데 기여했다. 본지는 기술력과 브랜드 전략, 디자인 업그레이드와 기업 문화 대전환 등 현대차그룹이 이룬 50년 경쟁력의 원천을 현장을 통해 살펴봤다. 마지막으로 현대차·기아가 키워낸 또 다른 경쟁력인 핵심 계열사들의 변화에 대해 살펴본다.배터리시스템 등 전기차 핵심 부품을 만드는 현대모비스, 엔진 주요 부품 등을 생산하는 현대위아, 자동차 시트와 변속기가 주력인 현대트랜시스, 완성차를 실어 전 세계로 운반하는 물류 기업 현대글로비스가 현대차그룹의 4대 핵심 계열사다. 이 4사의 매출이 지난해 처음으로 연 100조원을 돌파했다. 2020년 이후 3년 만에 1.6배로 급성장 중이다. 현대차·기아(작년 매출 262조원) 못잖게 일자리를 창출하며 한국 경제 발전에도 함께 기여한 셈이다.그래픽=양인성몸집만 커진 게 아니다. 이들은 현대차·기아만을 바라봤지만 이제 현대모비스는 독일 폴크스바겐을, 현대트랜시스는 미국 스텔란티스를, 글로비스는 세계적 유명 전기차 기업을 고객으로 확보했다. 그룹의 모든 자원을 ‘자동차’에 집중하는 ‘수직계열화’에서 ‘각자도생’ 전략으로 신사업을 발굴한 결과다.◇컨테이너 만들던 회사, 작년 해외 수주만 12조지난달 20일 울산 현대모비스의 ‘배터리 시스템(BSA)’ 생산 공장 2층에 들어서자 사람이 거의 보이지 않았다. 축구장 4개쯤 되는 약 8000평 공간에 약 60명만이 일하고 있었기 때문이다. 부품 조립 대부분을 로봇이 맡는다. 이날 언론에 처음 공개된 이 공장에서 만드는BSA는 배터리 온도와 출력 등을 제어해 전기차의 안전성과 효율성을 높이는 핵심 부품이다.이 회사는 1977년 현대정공이란 이름으로 설립될 때만 해도 컨테이너를 주로 만들던 회사였다. 2000년 전후에도 단순 차 부품 조립만 했다. 하지만 20년 가까이 기술개발에 매진해 지금은 자체 기술로 만든 배터리 시스템을 독일 폴크스바겐이 수조원에 사갈 정도가 됐다. 해외 기업에서 따낸 부품 계약이 작년 역대 최고인 92억2000만달러(약 12조7000억원)였다.현대글로비스도 2001년 ‘한국로지텍’으로 시작할 때 현대차·기아 제품만 주로 실어 날랐다. 지금은 현대차·기아가 아닌 기업의 자동차 운송 매출이 절반 가까이 된다. 현대트랜시스는 스텔란티스그룹에 2022년 7000억원 규모 변속기 계약을 따냈고, 지난 6월엔 사우디아라비아 전기차 업체 시어와 3조원 규모 ‘일체형 전기차 구동 시스템’ 공급을 수주했다. 현대위아도 지난해 해외 수주 1조원을 처음으로 돌파했다. 유럽과 북미 완성차 업체로부터 등속 조인트(엔진의 힘을 바퀴로 전달하는 장치) 공급 계약을 따낸 것이다.◇”해외에서 자기 자리 직접 찾아라”계열사들이 해외 수주를 늘리고 체질을 개선하는 것은 선택이 아닌 필수다. 전기차는 내연기관차보다 부품 숫자가 30~40%가량 적어, 부품 계열사들은 현대차·기아만 바라보고 있다가는 고사할 수밖에 없다.그런 까닭에 내연차 엔진 모듈이 주력 사업이었던 현대위아는 지금 전기차 부품 관련 열관리 사업에 적극적으로 나서고 있다. 현대글로비스도 자동차 물류를 넘어, ‘전기차 사용 후 배터리 재활용’ 사업에 주력하고 있다. 향후 성장이 예상되는 전기차 배터리를 운반하고 재활용까지 맡겠다는 것이다. 한 계열사 임원은 “계열사라고 해서 현대차·기아에서 나오는 일감을 이제 그냥 나눠주지 않는다”면서 “해외 시장에서 자기 자리를 스스로 찾겠다’는 정신으로 악착같이 노력하는 중”이라고 했다."
2024-06-20,"로봇이 주차하고 음료 배달까지...현대차, 서비스 시작","0초0초광고 후 계속됩니다.다음 동영상subjectauthor취소로봇이 주차하고 음료 배달까지...현대차, 서비스 시작조선일보재생7,552재생 (space/k)재생00:380:00:00재생 (space/k)재생음소거 (m)음소거00:00/00:38실시간설정전체 화면 (f)해상도자동 480p자막사용 안함재생 속도1.0x (기본)인기 구간 표시해상도자동 (480p)480p360p270p144p자막설정사용 안함옵션글자 크기배경색재생 속도0.5x1.0x (기본)1.5x2.0x죄송합니다. 문제가 발생했습니다. 다시 시도해 주세요.도움말음소거 상태입니다.도움말라이선스디버그 정보 다운로드고화질 재생이 가능한 영상입니다.설정에서 해상도를 변경해보세요.더 알아보기00:00로봇이 사람 대신 주차하고 음료를 배달하는 서비스가 서울 성수동 오피스 빌딩 ‘팩토리얼 성수’에 도입된다.현대위아가 개발한 주차 로봇이 팩토리얼 성수 지하주차장에서 차량을 주차하는 모습 / 현대차그룹현대차그룹은 20일 팩토리얼 성수에 로봇 주차, 로봇 배송 등을 적용한 서비스를 시작한다고 밝혔다.국내에서 주차 로봇이 상용화되는 건 이번이 처음이다. 현대위아가 개발한 주차 로봇이 도입됐다. 지정된 장소에 차를 세우면 얇고 넓은 로봇 두 개가 차량 밑으로 들어가, 각각 앞바퀴와 뒷바퀴를 들어 올린다. 이후 비어 있는 주차 공간을 파악해, 자동으로 차를 옮겨 주차시킨다. 로봇 두께는 110mm로, 최대 2.2톤 차량까지 들어 옮길 수 있다.현대위아는 최대 50대 주차 로봇을 동시에 관제할 수 있는 ‘스마트 주차 관제 시스템’도 개발했다. 이날 팩토리얼 성수에는 주차 로봇 2대(한 쌍)가 도입됐지만, 향후 필요에 따라 주차 로봇을 추가로 투입할 수 있다는 뜻이다. 현대위아 관계자는 “주차 로봇은 작년 현대차그룹 싱가포르혁신센터에서 상용화에 성공했고, 올해 미국 전기차 전용 공장에 대규모 도입을 준비하며 성능과 안전성 등을 충분히 검증했다”고 했다.올 3분기(7~9월) 팩토리얼 성수에선 주차 로봇이 현대차·기아의 ‘자동 충전 로봇’과 연계된다. 전기차를 지정된 장소에 놓으면 주차 로봇이 차를 충전구역으로 이동시키고, 자동 충전 로봇이 차량의 번호판을 인식한다. 이후 차량 상태를 점검해 충전하고, 충전이 완료되면 다시 주차 로봇이 일반 주차 자리로 차량을 이동시키는 형태의 서비스가 시작될 예정이다.이뿐만 아니다. 이날 팩토리얼 성수에선 현대차·기아가 개발한 배달 로봇 ‘달이 딜리버리’도 서비스를 시작했다. 고객이 모바일 앱을 통해 음료를 주문하면 달이 딜리버리가 지하 1층 카페에서 커피 등 음료를 수령, 고객이 있는 곳까지 음료를 배달해준다. 대형 트레이를 장착해 한 번에 커피 16잔, 10kg무게 물건까지 배달할 수 있다. 현대차가 자체 개발한PnD모듈(PlugandDriveModule) 덕분에 사람처럼 자유롭고, 안정적으로 움직일 수 있다. 이 모듈은 로봇의 흔들림을 잡아주고, 혼잡한 공간에서 장애물을 인식하고 빠르게 피할 수 있게 돕는다. 또 건물 엘리베이터, 출입문 등을 관제하는 시스템과 연동해 전체 층을 엘리베이터로 오가며 배송할 수 있다. 성인 평균 걸음인 최대 시속 4.32㎞로 움직인다.현대차·기아 관계자는 “달이 딜리버리의 본격 서비스 투입을 시작으로 팩토리얼 성수를 로봇 토탈 솔루션이 적용되는 최초의 건물로 만들어보고자 한다”고 했다.달이 딜리버리가 팩토리얼 성수에서 음료를 배달하는 모습. / 현대차그룹"
2024-04-29,"현대車 그늘 벗어나 각자도생... 현대모비스는 폴크스바겐, HL만도는 GM 수주 따냈다","현대차그룹 ‘그늘’ 벗어나 각자도생 나선 車 부품사들그래픽=양인성지난 23일(현지 시각) 스페인 나바라주에선 현대모비스가 유럽 시장에서 새 출발을 알리는 신호탄이 터졌다. 현대모비스는 이날 폴크스바겐에 전용 공급할 배터리시스템(BSA) 생산 시설을 착공했다. 배터리시스템은 배터리가 안전하고 효율적으로 작동하도록 돕는 전기차 핵심 부품이다. 현대모비스는 나바라주 공장에 대해 “글로벌 수주 확대라는 막중한 임무를 수행하는 곳”이라고 했다. 이미 스텔란티스그룹·벤츠와 손잡고 섀시 모듈(차 뼈대) 공장을 미국에 운영하고 있지만, 글로벌 자동차 업체 납품을 위해 유럽에 공장을 짓는 것은 이번이 처음이기 때문이다. 또 일반 부품이 아닌 전기차 전용 부품을 현대차그룹이 아닌 완성차 업체에 납품하는 것도 처음이다. 2년 뒤 공장이 완공되면, 연간 최대 36만대의 배터리시스템이 인근 폴크스바겐 공장으로 옮겨져 전기차에 탑재된다.현대모비스는 최근 해외 수주에 필사적이다. 전체 매출에서 현대차그룹이 차지하는 비율이 여전히 80%에 이르지만, 작년 북미와 유럽 등 해외 완성차 업체 대상 수주액은 92억2000만달러(약 12조7000억원)로 최고치를 찍었다. 작년 폴크스바겐과 수조 원대 배터리시스템 공급 계약을 체결한 덕분이다. 해외 수주 규모 중 가장 큰 수준이었다. 2020년 해외 완성차 업체와 맺은 수주액이 17억5000만달러(약 2조4000억원)였는데, 3년 사이 다섯 배 가까이 늘어난 것이다.국내 완성차 업체에 크게 의존해 온 자동차 부품사들이 해외 시장 개척을 통해 각자도생에 나서고 있다. 내연기관차 때와 달리 미래차 시대엔 자동차 부품 산업의 수직 계열화가 상대적으로 느슨해지기 때문에 새로운 시장 개척에 사활을 거는 것이다. 전기차는 내연기관차보다 부품 숫자가 많게는 40% 가까이 적다. 또 완성차 업체가 전기차 등 미래차에 들어가는 기술을 직접 개발하는 일이 늘면서, 부품사 입장에선 더 이상 특정 업체 부품만 생산하고 납품해서는 미래를 기약하기 어렵게 된 것이다.그래픽=양인성◇현대차 그늘 벗어나, 해외 수주 늘린다HL그룹(옛 한라그룹)의 계열사HL만도는 이달 미국 완성차 업체GM이 선정하는 ‘2023 올해의 우수 협력사’에 선정됐다. 4년 연속인데 지금까지 10회 선정됐다.HL만도는 제동과 조향 등을 만드는 자동차 부품사다. 매출에서 현대차그룹이 차지하는 비율은 2019년 59%에서 작년 42%로 줄었다. 반면,GM등 북미 완성차 업체로부터 나오는 매출 비율은 같은 기간 19%에서 29%로 올랐다. 작년 8조3900억원의 매출에서 중국 비율도 27%로 한국(44%) 다음으로 많았다. 국내 사업에선 300억원의 적자를 냈지만, 중국에서 1890억원 이익을 내는 등 해외 시장에서 선전한 덕에 2790억원의 이익을 냈다. 올 초에는 중국 자동차 부품기업 텐륜공업과 합자법인인 텐륜만도를 공식 출범하는 등 매출 다변화에 나서고 있다.BMW그룹은 작년 한국 협력 업체 30여 곳으로부터 부품 6조5350억원어치를 구매했다. 2010년에는 7119억원어치 한국 부품을 구매했는데, 14년 사이 그 규모가 9배가 된 것이다.GM에서 올해 선정한 ‘2023 올해의 우수 협력사’에는 한국 기업이 18개 이름을 올렸다. 전체 86개의 회사 중 한국 업체가 21%로 미국 다음으로 많았다.현대차그룹 의존도가 여전히 80~90%에 달하는 계열사들도 대규모 해외 수주에 적극적이다. 현대위아는 작년 유럽과 북미 완성차 업체로부터 1조450억원의 등속조인트를 수주했다. 해외 수주 1조원을 넘긴 건 작년이 처음이었다. 현대위아는 내연차 엔진 모듈이 주력 사업이었지만, 전기차 부품 관련 열관리 사업을 확대해 해외 수주에 적극적으로 나선다는 계획이다. 현대트랜시스는 스텔란티스그룹과 7000억원 규모의SUV변속기 공급 계약을 맺고, 작년 납품을 시작했다. 앞서 2019년에는 미국 전기차 기업 리비안에 들어가는 약 1조원 규모 자동차 시트 공급 계약을 따냈었다.◇전기차 전환, 부품사에 새로운 기회한국 부품사들의 각자도생 전략은 전체 부품사 매출·영업이익 증가와 수익성 증가로 연결되고 있다. 전반적으로 매출이나 영업 이익 측면에서 과거보다 견고한 기반을 갖게 된 것이다. 한국자동차산업협동조합에 따르면, 작년 자동차 부품 전문 상장사 86곳의 매출은 92조8297억원으로 전년보다 10% 늘었다. 영업이익은 3조9124억원으로 46% 급증했다. 수익성을 보여주는 지표인 영업이익률도 4.2%로 매년 증가 추세이다.전기차 기술을 바탕으로 해외 업체로부터 계약을 따내는 부품사도 잇따른다. 우신시스템은 작년 미국 리비안으로부터 1176만달러(약 162억원) 규모 전기차 차체 자동화 라인을 수주했다. 우신시스템은 자동차 자동화 라인 등을 만들어 왔는데, 4년여 전부터 전기차 관련 배터리 라인도 제작하고 있다.전기차 전환으로 부품사에 새로운 기회가 열렸다는 평가가 나온다. 한국자동차연구원의 ‘자동차 부품산업 실태조사’에 따르면 2022년 미래차 전용 부품 산업 사업체의 비율은 4%로 전년(0.8%)보다 급증했다. 전기차 전용 부품을 만드는 업체는 47개에서 322개, 자율주행차 관련 업체는 12개에서 237개로 늘었다. 같은 기간 내연차 전용 사업체 비율은 32.2%에서 26%로 감소했다."
2024-04-15,삼성전자·현대차는 아니다... 한국 억대 연봉 기업 톱 10은,"작년 12개 업종 매출 상위社 분석14일 본지가CXO연구소에 의뢰해 지난해 업종별 매출 상위 기업 120사의 직원(사원~부장)과 임원(상무·전무 등 미등기 임원) 연봉을 분석한 결과, 직원·임원 모두 전년보다 연봉이 감소한 것으로 나타났다. 2019년부터 2022년까지 매년 증가하던 전체 임직원 평균 연봉은 작년 줄어들었다. 반도체 등 주력 업종 실적 부진으로 소속 임직원 연봉이 감소한 게 영향을 미친 것으로 분석된다.◇임원·일반 직원 연봉 모두 줄었다조사 대상인 대기업 120사의 2023년 임직원은 78만5028명이다. 2019년 이후 가장 많은 숫자다. 2019년 64조3282억원이었던 임직원 인건비는 작년 79조5336억원으로 증가했다.총 인건비와 임직원은 증가세이지만 작년 1인당 평균 연봉은 2022년에 비해 줄었다. 2019년 조사 대상 기업의 임직원 평균 연봉은 8253만원이었다. 이후 8549만원(2020년), 9628만원(2021년), 1억196만원(2022년)으로 계속 증가했다. 하지만 지난해에는 1억131만원으로 전년보다 65만원 줄었다. 임원의 평균 연봉은 2022년 4억4685만원에서 작년 4억2727만원으로 줄었고, 직원 연봉은 9909만원에서 9855만원으로 감소했다.이번 조사 대상인 12업종 중에서 작년 직원 연봉 1위 업종은 자동차로 평균 1억1640만원을 받았다. 2022년 같은 조사에서 1위 업종은 전자였는데, 자동차가 이를 제친 것이다. 전자 업종 일반 직원 1인당 평균 연봉은 1억596만원으로 자동차, 금융, 정보통신에 이어 4위에 자리했다. 12업종 중 절반인 6업종은 전년 대비 연봉이 줄었다. 철강 업종의 일반 직원 연봉은 2022년 9790만원에서 작년 8707만원으로, 석유화학 업종은 9712만원에서 9679만원으로 감소했다.그래픽=박상훈◇직원 연봉 1억원 이상 기업 29곳임원을 제외한 일반 직원의 1인당 평균 연봉이 가장 많은 회사는 에쓰오일로 1억6832만원으로 조사됐다. 이어SK텔레콤, 삼성화재, 삼성증권,NH투자증권, 삼성생명, 삼성물산, 삼성SDS,기아, 포스코인터내셔널이 직원 연봉 상위 10위 안에 들었다. 직원 연봉이 평균 1억원 넘는 기업은 2019년 7곳에서 2020년 8곳, 2021년 19곳, 2022년 27곳으로 계속 늘었고, 지난해엔 29곳으로 조사됐다. 현대위아, 동양생명, 한온시스템, 현대건설, 서연이화, 대한항공 등 6사가 작년 직원 연봉 1억원 이상 목록에 추가됐다. 이 중 현대위아, 한온시스템, 서연이화 등 3사는 지난해 역대 최대 실적을 낸 현대차·기아의 부품 협력사들이다. 특히 현대차·기아에 범퍼부터 시트까지 핵심 내외장재를 공급하는 서연이화는 지난해 역대 최대인 3조원대 매출을 올리자 직원 연봉을 한 번에 16%(1385만원) 인상했다.‘반도체는 바닥, 자동차는 정점’이었던 작년 업황이 직원 연봉 순위에 그대로 반영됐다. 직원 연봉 톱10 기업에 삼성전자와SK하이닉스는 들지 못했지만, 기아(1억2576만원)는 포함됐다. 카카오, 엔씨소프트, 금호석유화학, 현대제철 등 4사는 2022년에는 직원 연봉 1억원 이상을 기록했지만, 작년에는 1억원을 넘지 못했다.삼성전자의 작년 인건비는 14조4782억원으로 2022년(15조5977억원)보다 1조1195억원 줄었다. 작년 창사 이래 최악의 실적을 기록한 삼성전자 반도체(DS) 부문의 초과이익 성과급(OPI·옛PS) 지급률은 0%였다. 삼성전자의 작년 직원 평균 연봉은 1억1522만원으로 전년(1억3080만원) 대비 1500만원 가까이 줄었다.SK하이닉스도 같은 기간 1100만원 감소했다.SK하이닉스 임원 연봉은 7억5517만원에서 5억6100만원으로 2억원 가까이 줄었다."
2023-07-06,비닐끈 폭탄으로 北드론 잡는다...‘하드킬’ 시험 영상 보니,"현대차그룹 계열사인 현대위아가 국내 최초로 ‘대 드론 체계’(ADS,AntiDroneSystem)를 이용해 드론을 ‘하드 킬’(HardKill) 하는 시험에 성공했다고 6일 밝혔다.0초0초광고 후 계속됩니다.다음 동영상subjectauthor취소비닐끈 폭탄으로 北드론 잡는다...‘하드킬’ 시험 영상 보니조선일보재생1.2K재생 (space/k)재생01:200:00:00재생 (space/k)재생음소거 (m)음소거00:00/01:20실시간설정전체 화면 (f)해상도자동 480p자막사용 안함재생 속도1.0x (기본)인기 구간 표시해상도자동 (480p)480p360p270p144p자막설정사용 안함옵션글자 크기배경색재생 속도0.5x1.0x (기본)1.5x2.0x죄송합니다. 문제가 발생했습니다. 다시 시도해 주세요.도움말음소거 상태입니다.도움말라이선스디버그 정보 다운로드고화질 재생이 가능한 영상입니다.설정에서 해상도를 변경해보세요.더 알아보기00:00드론을 무선으로 조종하는 전파를 방해해 드론이 정상적으로 날지 못하게 하는 것을 ‘소프트 킬(SoftKill)’이라고 하고, 직접 물리적인 타격을 줘서 요격하는 방식을 하드 킬이라고 구분한다. 현대위아는 두 가지 방식을 모두 사용할 수 있는ADS를 개발해왔는데 이번에 하드 킬 시험에 성공한 것이다.현대위아에 따르면 충청북도에 있는 한 시험장에서 이 같은 테스트를 했다. 발사한 뒤 공중에서 여러 파편으로 나뉘며 드론을 요격하는 ‘공중확산탄’(ABM,AirBurstMunition)과 ‘스트리머(Streamer)탄’을 모두 이용했다. 스트리머탄은 수십 개의 비닐끈을 장착한 탄으로 드론 근처에서 폭발하는데, 폭발 충격 또는 이때 발사되는 비닐끈을 드론 로터에 감는 방식으로 격추하는 게 특징이다.현대위아 관계자는 “전파 등을 쏴서 드론을 조종하지 못하게 하는 소프트킬이 어려운 경우와 소프트킬이 성공해 드론이 공중에서 헤매고 있는 상황을 모두 가정해서 드론을 격추하는데 성공했다”고 밝혔다. 현대위아가 만든 현장 영상에서는 방해전파를 쏘는 소프트킬을 먼저 시행해, 원격으로 드론을 조종하는 걸 차단하는 방식으로 드론을 움직이지 못하게 한 후 요격을 하는 장면이 담겼다.현대위아는 ‘원격사격통제체계(RCWS,RemoteControlWeaponSystem)’를 개발해 군에 공급하고 있는데,ADS역시 원격사격통제체계를 기반으로 개발하고 있다. 기술수준을 더 높여 이 분야를 신사업으로 삼는게 목표다."
