date,title,content
2024-08-08,"실적 공개한 현대리바트, 상반기 역대 최초로 매출 1조 넘어서","경기 용인 소재 현대리바트 스마트 워크 센터 전경. 현대리바트 제공가구사 현대리바트가 올해 상반기 실적에서 처음으로 반기 매출 1조원을 넘어섰다.8일 현대리바트에 따르면 올해 상반기(1~6월) 매출은 1조17억원으로 전년 동기 대비 30.3% 늘고, 영업이익은 150억원을 기록하며 흑자 전환했다. 2분기만 놓고 보면 영업이익은 82억원, 매출은 4970억원으로 집계됐다. 각각 작년 동기 대비 135%, 24.7% 증가한 수치다.현대리바트 관계자는 “주택거래량이 회복되고 빌트인 가구를 납품하는 수가 늘어나 기업과 소비자 간 거래(B2C)·기업 간 거래(B2B) 사업이 모두 성장했다”며 “반기 기준 역대 최대 매출을 달성하고 영업이익도 전년에 비해 늘었다”고 말했다.전날인 7일 신세계까사는 전년 동기 영업손실 53억에서 적자 폭을 줄여 올해 2분기 영업손실 5억원을 기록했다고 밝혔다.한편, 또 다른 경쟁사인 한샘은 오는 9일 실적 발표를 할 예정이다."
2024-11-01,‘형제경영’ 다지는 현대백화점,"동생 정교선 홈쇼핑 회장 승진형 정지선 그룹회장 경영 보좌백화점 등 주요사 대표는 유임정교선(50) 현대백화점그룹 부회장이 31일 현대백화점그룹 정기 임원 인사에서 현대홈쇼핑 회장으로 승진했다. 현대백화점그룹 부회장직은 유지하며 형인 정지선(52) 현대백화점그룹 회장을 보좌한다. 전날 신세계그룹이 이마트와 신세계백화점을 계열 분리한다고 발표한 것과 달리, 현대백화점그룹은 정지선 회장과 정교선 부회장의 ‘형제 경영’을 강화하고 있다는 분석이 나온다.정교선 현대백화점그룹 부회장 겸 현대홈쇼핑 대표이사 회장수년 전만 해도 시장에서는 정지선 회장과 정교선 부회장 형제가 각각 백화점과 식품을 중심으로 분리 경영에 나서지 않겠냐는 전망이 많았다. 하지만 지난해 11월 현대백화점그룹이 단일 지주회사로 현대지에프홀딩스를 출범하며 계열 분리 가능성을 불식시켰다. 현대지에프홀딩스는 유통·패션·식품 등 27개 자회사를 편입했다. 정지선 회장과 정교선 부회장은 각각 지주회사 지분 39.7%와 29.1%를 보유한 채 공동 경영을 이어가고 있다.유통 업계에서는 정지선 회장이 동생을 예우해 현대홈쇼핑 회장으로 승진시키며 형제 경영이 더욱 탄력을 받게 됐다는 평가가 나온다. 정교선 부회장은 2009년부터 현대홈쇼핑 대표를 맡고 있다. 현대백화점그룹은 “정교선 부회장은 정지선 회장을 보좌하며 단일 지주회사 체제의 지배구조를 기반으로 그룹 경영 전반을 함께 이끌어 나갈 예정”이라고 밝혔다.현대백화점그룹은 이날 인사에서 현대백화점, 현대홈쇼핑, 현대그린푸드, 현대리바트, 한섬 등 주력 계열사의 대표를 유임시켰다. 회사 관계자는 “이번 정기 임원 인사의 핵심 키워드는 안정 기조 속 미래 성장을 위한 변화 추구”라고 했다. 이와 함께 현대면세점 대표이사에 박장서 영업본부장을 내정했다. 건자재 기업인 현대L&C 신임 대표에는 이진원 현대그린푸드 푸드서비스사업본부장이, 매트리스 전문 기업 지누스 대표에는 정백재 현대L&C 대표가 내정됐다. 복지 설루션 기업인 현대이지웰 대표는 박종선 상품운영본부장이 맡는다.▲현대백화점▷부사장 김창섭▷전무 나원중 이원철 이승원▷상무 이원근 이기호 지준우 이희석 박세원 김우형 박영배 ▲현대홈쇼핑▷상무 임호연 ▲현대그린푸드▷전무 장재락▷상무 이준재 강대림 박신영 ▲현대리바트▷상무 안은길 ▲한섬▷전무 윤인수▷상무 서정현 여유정 ▲현대L&C▷상무 홍진석 ▲현대에버다임▷상무 김일석 ▲현대바이오랜드▷부사장 이희준▷상무 박종택 ▲현대퓨처넷▷부사장 김성일 ▲지누스▷상무 박영빈 ▲현대지에프홀딩스▷전무 김준영▷상무 김택년"
2024-05-17,"부동산 침체 이겨냈다, ‘가구 3인방’이 흑자 전환 성공한 비결","현대리바트·한샘·신세계까사, 1분기 흑자 전환비결은 교체 시기 예측한 고급화현대리바트와 한샘, 신세계까사 등 국내 ‘가구 3인방’이 올해 1분기 흑자 전환에 성공했다. 가구업은 코로나 팬데믹 당시 재택근무 등 실내 생활이 늘어난 것이 가구 교체 수요로 이어져 호황을 누렸다. 그러나 2022년부터 건설·부동산 경기가 꺾이면서 이사·인테리어 수요도 덩달아 위축됐고, 가구업계도 불황을 겪었다. 그런데 올 들어 부동산 경기가 크게 나아지지 않은 상황에서 이례적으로 실적 개선에 성공해냈다. 코로나 발발 초기에 팔린 가구들의 교체 주기가 돌아오는 상황에서 이런 수요를 겨냥한 가구업계가 고품질의 프리미엄 가구 판매에 집중한 것이 호실적으로 이어졌다는 분석이다.부동산 경기 침체에도 이례적 흑자긴 불황을 겪던 가구업계는 올 1분기 줄줄이 흑자로 돌아섰다. 현대리바트는 1분기 매출 5048억원, 영업이익 68억원을 기록했다. 지난해 1분기 76억원 적자를 기록했었는데, 올해 흑자 전환에 성공했다. 1분기 매출은 36.3%나 늘어 한샘을 제치고 업계 1위로 올라섰다. 한샘은 1분기 매출액이 지난해 같은 기간보다 3.5% 늘어난 4859억원, 영업이익은 130억원을 기록했다. 신세계까사도 매출액 685억원, 영업이익 10억원을 기록하며 2022년 1분기 이후 2년 만에 흑자 전환에 성공했다.그래픽=김하경가구업은 건설·부동산의 후방 산업으로, 부동산 경기의 영향을 많이 받는다. 계속된 고금리 기조로 부동산 경기 침체가 장기화하는 상황에서도 가구업계는 ‘B2C’(기업·소비자 간 거래)에서 매출을 대폭 끌어올려 실적을 개선했다. 현대리바트는 장롱 품목 매출이 전년 대비 28% 늘었고, 서재 가구 19%, 침대 16% 매출이 늘었다. 인테리어 시공 매출 역시 전년 대비 21% 증가했다. 한샘 역시 자녀용 가구 계약이 특히 많은 연초에 어린이와 청소년용 가구의 매출이 전년 대비 70% 이상 급증했다.가구업체들은 흑자 전환의 배경으로 “코로나 시기 바꿨던 가구의 교체 주기가 돌아온 것”을 꼽는다. 2020년 초부터 ‘사회적 거리 두기’로 인해 재택근무용 가구를 새로 사거나 몇 년 뒤 바꿀 예정이었던 가구를 미리 장만하는 사람이 많았다. 당시 가구업계엔 “코로나가 몇 년치 가구 수요를 앞당겼다”는 말이 나왔다. 올해 팬데믹 발발 5년째가 되면서 통상 5~10년으로 보는 가구 교체 주기가 시작됐다는 분석이 나온다. 현대리바트 관계자는 “2020년 초 비정상적으로 몰렸던 B2C 가구 수요가 4~5년이 되자 교체 주기가 도래했다”며 “이사 수요는 줄었지만, 기존 집을 부분 리모델링하는 인테리어 수요는 조금씩 회복되는 분위기”라고 말했다.가구업계는 이런 수요를 놓치지 않고 ‘고가 프리미엄’ 제품군을 전면에 내세우고 있다. 중·저가 제품을 많이 팔기보단 고가의 ‘똘똘한 제품’을 판매해 수익성을 개선하고 브랜드 이미지도 고급화하겠다는 전략이다. 발달한 데이터 분석 기술로 고객들의 구매 성향, 선호 품목 등에 대한 분석이 쉬워졌고, 고객의 가구 교체 시기에 한발 앞서 프리미엄 가구 출시와 홍보에 힘쓰는 중이다.현대리바트는 작년 10월 자체 프리미엄 가구 라인인 ‘리바트 마이스터 컬렉션’을 선보였다. 가구업계에서는 보기 어려운 호두나무·자작나무 등 천연 원목을 적용했다. 한샘은 올 2월 신규 프리미엄 붙박이장 브랜드 ‘시그니처’를 공개했고, 신세계까사는 2019년 선보인 프리미엄 가구 컬렉션 ‘라메종’을 리뉴얼하면서 재료를 한층 고급화했다.”불황 끝났다고 단정하긴 일러”다만 가구업계의 긴 불황이 끝났다고 보기엔 아직 이르다는 분석도 나온다. 가구업계에선 ‘B2B’(기업 간 거래) 매출도 중요한데, 아파트 등 주택 거래량은 물론 상가·사무실 이전 수요에 따른 거래가 좀처럼 회복되지 않아 본격적인 실적 턴어라운드를 확신하기는 어렵다는 설명이다.대형 가구업체와 달리 중소 가구업계의 상황은 더 악화되고 있는 것도 걱정스러운 부분이다. 고급 가구 수요는 프리미엄 제품을 내세우는 대형 업체에 빼앗기고, 중저가 시장에선 이케아 등 ‘박리다매’ 전략을 취하는 업체에 밀려 설 자리가 좁아지고 있다. 한 중소 가구업체 대표는 “전반적으로 손님이 많이 줄어든 데다가 새 가구를 찾는 사람들도 엄청 싸거나 아니면 최고급 가구를 찾는 양극화 현상이 심해져 살아남기 어렵다”고 했다."
2023-09-08,“3년된 소파도 무상AS”… 가구업계 전략은 고객 묶어두기,"코로나 반짝 호황 때 너무 많이 팔아… 신상 출시 대신 ‘록인 전략’“리바트 멤버스 고객을 대상으로 3년 동안 무상으로AS를 하겠습니다”.가구업체 현대리바트가 지난 1일부터 홈페이지와 앱 초기 화면에 띄운 공지사항이다. 매장을 찾는 고객들에게는 직접 설명을 하고 있다. 원래 리바트를 비롯한 가구업체들은 품질 보증 기간이 1년이다. 한국소비자원 기준에 따른 것이다. 그런데 이걸 2년이나 추가 확대했다. 기간만 늘린 게 아니다. 공짜로AS를 해주는 품목도 늘렸다. 쇼파, 침대, 서랍장 등 가구뿐만 아니라 리모델링 시공 패키지 상품까지 총 2500종으로 늘렸다. 현대리바트뿐만 아니다. 한샘, 인테리어 플랫폼 오늘의 집 등도 나서 ‘책임 보장제’ ‘보상 판매’ 같은 기존 고객들을 위한 사후 서비스를 도입했다. 왜일까.그래픽=이진영코로나 팬데믹 기간 급증했던 가구 소비 역풍에 대한 가구 업체들의 대응이다. 코로나 기간 집안 생활 기간이 늘면서 가구 업체는 호황을 맞았다. 하지만 통상 가구나 인테리어를 바꾸는 데까지 5~10년이 걸리기 때문에 너무 많이 팔린 게 역설적으로 ‘보릿고개’ 기간만 늘리는 셈이 된 것이다. 이를 돌파하기 위해 가구업체들은 보증 기간 늘리기, 보상판매 등을 선택한 것이다. 가구 교체기 이전이라도 해당 가구 브랜드와 접점을 늘리고, 이를 통해 고객 관리를 하겠다는 것이다. 유통업체들이 회원제 고객을 모아서 자기 브랜드에 대한 충성도를 높이려는 ‘록인’(Lockin) 전략이 가구 판매에서 적용되는 셈이다.코로나 기간 가구·가전 다 바꿨다…충성고객 ‘록인’ 전략현대리바트의AS기간 확대는 업계 최초다. 현대리바트는 이와 함께 멤버십 제도도 확대해 현대백화점 등에서 사용할 수 있는 ‘H.Point’와 통합 운영하기로 했다. 현대리바트 관계자는 “우리 제품을 이용해주는 고객에게 더 신뢰받기 위한 서비스”라며 “이달 한 달간 멤버십 회원 확대를 위해 이벤트도 진행한다”고 했다.1위 가구업체 한샘도 지난달 ‘인테리어 공사 보상판매’ 프로그램을 도입했다. 한샘 제품으로 시공한 부엌과 욕실, 수납장, 창호, 문, 중문 등을 일정 가격을 들여 다시 한샘 제품으로 리모델링하면 최대 1000만원 가격 할인을 받는다. 그간 업계는 주로 가구에만 보상판매를 적용했으나 한샘은 인테리어 공사 전반으로 확대 적용했다. 이전 공사 이력이 없어도 이사 예정인 집에 한샘리하우스 상품이 설치돼 있으면 보상판매 대상으로 인정하기로 했다. 한샘은 작년 10월부터 리모델링 공사 후 1년간은 무상으로AS서비스를 제공하는 ‘무한책임’ 서비스도 도입했다.인테리어 플랫폼 오늘의 집은 올 상반기 ‘시공책임보상제’를 도입해 시공업체 때문에 생긴 여러 인테리어 하자에 대해 보상을 하기로 했다. 오늘의 집은 고객만족팀을 신설해 인테리어 시공 관련 고객 불만 접수 시스템도 마련할 계획이다. 가전 업계도 가세했다.SK매직은 오래된 식기 세척기를 반납하면 새 제품을 반값에 할인하고, 안마 의자·의료기기 업체 세라젬도 안마의자 제품을 자사 특정 모델로 교체하면 최대 60만원을 할인해주는 보상 판매 제도를 운영 중이다.부동산 시장 회복도 가구업계 희소식작년 하반기부터 수요 감소 등 여파로 실적이 부진했던 가구업체들은 이 같은 전략으로 충성 고객을 확보하고 불황에서 탈출하겠단 전략이다. 한샘은 지난 2분기 매출 5147억9300만원, 영업이익 12억2600만원을 기록하며 4분기 만에 흑자 전환했다. 지난 1분기 적자를 낸 현대리바트도 2분기엔 영업이익 34억7600만원으로 흑자로 돌아섰다.최근엔 부동산 시장도 살아나는 조짐이 보이면서 하반기 실적 개선에 대한 기대도 커지고 있다. 국토교통부의 지난 6월 주택통계에 따르면 주택 매매 거래량(신고일 기준)은 총 5만2592건으로 전년 동월(5만304건) 대비 4.5% 증가하면서 부동산 거래가 바닥을 다지고 반등하고 있다는 평가가 나오고 있다."
2022-03-23,현대백화점 ‘아마존 매트리스 1위’ 지누스 인수,"리빙사업 강화위해 8900억에2012년 한섬 M&A 이후 최대“슬립테크 관련 추가 인수 검토”현대백화점그룹이 ‘아마존 매트리스 판매 1위’로 유명한 온라인 가구·매트리스 기업 지누스를 인수한다. 가구·인테리어 사업을 하는 현대리바트, 건자재 부문을 담당하는 현대 L&C와 함께 리빙 사업을 강화하려는 목적이다. 지누스 인수를 통해 2조5000억원 규모인 현대백화점그룹의 리빙 사업은 3조6000억원으로 커지게 된다.정지선 현대백화점그룹 회장현대백화점은 지누스 창업주 이윤재 회장과 특수관계인이 보유한 지분 30%와 경영권을 7747억원에 인수한다고 22일 밝혔다. 2012년 한섬 인수(4200억원) 이후 그룹 최대 규모 인수·합병이다. 현대백화점은 지분 인수와 별도로 인도네시아 제3공장 설립과 재무구조 강화를 위한 1200억원 규모의 신주 인수 계약도 체결했다. 신주 인수까지 포함하면 총 인수 대금은 8947억원이다.지누스 지분 인수는 정지선 현대백화점그룹 회장이 2030년까지 매출 40조원을 달성하겠다고 밝힌 ‘비전2030′에 따른 것이다. 현대백화점그룹은 2030년까지 현대리바트·현대L&C 등 리빙 사업 부문 매출을 5조원대로 성장시킨다는 계획이다. 현대백화점 관계자는 “이번 지분 인수를 통해 국내 오프라인 유통 중심의 백화점 사업을 온라인과 글로벌로 확장하고, 그룹의 리빙 부문과 시너지도 기대한다”고 말했다.경기도 성남에 본사를 둔 지누스는 온라인 가구·매트리스 기업이다. 2006년 미국을 시작으로 캐나다와 호주·일본·영국 등에 진출했다. 세계 최초로 침대 매트리스를 압축 포장해 상자에 담아 배송해주는 기술을 상용화했다. 현재 아마존에서 매트리스 판매 1위다. 지난해 매출 1조1238억원, 영업이익 743억원을 기록했다. 매트리스 매출이 전체 매출의 50% 이상이고, 글로벌 매출 비율은 97%에 육박한다. 지누스 창업주인 이윤재 회장은 경영권 매각 뒤에도 2대 주주이자 이사회 의장으로서 회사 경영에 참여한다. 현대백화점그룹은 지누스 전 직원의 고용을 100% 승계할 방침이다.현대백화점그룹은 앞으로 계열사와 협력해 지누스의 취급 품목을 거실, 홈오피스, 아웃도어 같은 일반 가구로 확대하겠다는 계획이다. 북미 중심의 지누스 사업 구조를 유럽, 남미, 일본 등으로 넓히고, 그룹 유통망을 활용해 지누스의 국내 사업도 확장할 계획이다. 회사 관계자는 “슬립 테크(수면 기술) 전문 기업에 대한 추가 인수나 협업도 검토하고 있다”고 말했다."
2022-03-22,"현대百, ‘아마존 매트리스 1위’ 지누스 7747억에 인수","현대백화점그룹이 ‘아마존 매트리스 판매 1위’로 유명한 온라인 가구·매트리스 기업 지누스를 인수한다. 가구·인테리어 사업을 하는 현대리바트, 건자재 부문을 담당하는 현대 L&C와 함께 리빙 사업 부문을 강화한다는 계획이다.현대백화점은 지누스 창업주 이윤재 회장과 특수관계인이 보유한 지분 30%를 7747억원에 인수한다고 22일 밝혔다. 경영권을 포함한 금액으로, 2012년 한섬 인수(4200억원) 이후 그룹 최대 규모의 인수합병이다. 현대백화점은 지분 인수와 별도로 이날 지누스와 인도네시아 제3공장 설립과 재무구조 강화를 위한 1200억원 규모의 신주 인수 계약도 체결했다. 신주 인수까지 고려하면 총 인수 금액은 8947억원이다.현대백화점그룹 관계자는 “국내 오프라인 유통 중심의 백화점 사업을 온라인과 글로벌로 확장하고 그룹 리빙 부문과 시너지도 낼 수 있을 것으로 판단했다”고 말했다.창업주인 이윤재 회장은 경영권 매각 뒤에도 지분 일부를 보유한 2대 주주이자 이사회 의장으로서 회사 경영에 참여할 예정이다. 현대백화점그룹은 지누스 전 직원의 고용을 100% 보장할 방침이라고 밝혔다.이윤재 지누스 창업주가 배송이 쉽도록 상자에 넣은 매트리스와 함께 포즈를 취하고 있다. /조선일보DB경기도 성남에 본사를 둔 지누스는 온라인 가구·매트리스 기업으로, 2006년 미국을 시작으로 캐나다와 호주, 일본, 영국 등에 진출했다. 세계 최초로 침대 매트리스를 압축 포장한 뒤 상자에 담아 배송해주는 기술을 상용화했다. 지난해 매출 1조1238억원에 영업이익 743억원을 기록했다. 매트리스 매출이 전체 매출의 50% 이상이고, 글로벌 매출 비중은 97%에 육박한다. 아마존 같은 온라인 채널을 통한 매출은 전체 매출의 80% 정도다.현대백화점그룹은 지누스 인수로 그룹 리빙 사업을 3조6000억원 규모로 키울 수 있게 됐다. 지난해 기준 현대리바트와 현대L&C의 매출이 각각 1조4066억원, 1조1100억원이다. 현대백화점그룹은 작년 발표한 ‘비전 2030′에서 “현재 2조5000억원 규모인 리빙 사업을 2030년까지 5조원대로 키우겠다”는 목표를 제시한 바 있다.현대백화점그룹은 계열사와의 협력을 통해 지누스의 취급 품목을 거실, 홈오피스, 아웃도어 같은 일반가구까지 확대한다는 계획이다. 북미 중심의 지누스 사업 구조도 유럽, 남미, 일본 등으로 넓히고, 그룹 유통망을 활용해 지누스의 국내 사업도 확장할 계획이다. 중장기적으로는 고부가가치 제품 기반의 수면시장 진출도 검토하고 있다. 회사 관계자는 “슬립 테크(수면 기술) 전문 기업에 대한 추가 인수나 협업을 검토하고 있다”고 말했다."
2024-07-19,"가전·가구가 손잡고, 편의점·피자도 ‘윈윈’","오프라인 위기에 ‘이종 업체’ 협업롯데하이마트 한샘광교점. /롯데하이마트롯데하이마트가 경기도 수원에 ‘롯데하이마트 한샘광교점’ 매장을 새로 열었다고 18일 밝혔다. 롯데하이마트 매장인데 가구 업체 ‘한샘’ 이름이 들어간 이유는 한샘디자인파크 수원광교점 4층에 터를 잡았기 때문이다. 단순히 대형 가구 매장의 공간에 가전 판매점이 들어간 게 아니다. 롯데하이마트가 취급하는 전자제품과 한샘의 가구, 인테리어를 한 공간에서 둘러보면서 전문가의 상담을 받고 살 수 있게 결합한 매장이다.오프라인 매장을 주력으로 운영하는 두 기업이 협업하는 사례가 늘고 있다. 전혀 다른 회사가 한 공간에서 소비자들을 유혹하고 있는 것이다. 유통 업계 관계자는 “외부 업체와 손을 잘 잡아야 온라인에 익숙해져 발길이 뜸한 소비자들을 모실 수 있다”고 말했다.외부 업체에 ‘어서 오십시오’를 외치는 기업은 증가하는 모양새다. 침대가 중점 사업인 에이스침대는 타사 브랜드의 소파를 잇따라 매장에 들이고 있다. 2021년 소파 브랜드 자코모 제품을 주요 매장에 들인 데 이어 작년에는 또 다른 소파 브랜드 에싸 제품을 매장에 배치했다. 가정 필수품인 침대와 소파를 한 공간에서 경험할 수 있도록 한 것이다. 현대리바트는 지난달 남양주시 별내점을 새로 열었는데, 같은 건물에는 삼성전자 오프라인 매장인 삼성스토어가 자리 잡고 있다. 리바트 제품과 삼성스토어 제품을 일정 금액 이상 구매하면 모바일 상품권을 주는 등 공동 판촉 행사를 하고 있다. 신세계까사 또한 삼성스토어와 5개 매장에서 협업을 하고 있다.편의점도 마찬가지다. 세븐일레븐은 구슬아이스크림 브랜드 ‘디핀다트코리아’와 손잡고 편의점 6곳을 구슬아이스크림 특화 매장으로 만들었다. 세븐일레븐은 연내에 100여 개 점포에 구슬 아이스크림 매장을 들인다는 계획이다. 앞서GS25는 작년 11월 1인 피자 브랜드(고피자)와 손잡은 뒤 8개월 만에 600여 매장에 오븐을 설치해서 피자를 팔고 있다.GS25 관계자는 “편의점은 차별화 먹거리 경쟁력을 확보하고 피자 브랜드는 판로 확대 및 브랜드 인지도를 높이는 전략”이라며 “이종 협업을 통해 윈윈 효과를 창출하고 있다”고 말했다."
2023-04-04,중고·반품사업 뛰어드는 유통업계,"11번가, 전문관 ‘리퍼블리’ 오픈현대리바트·백화점 등도 플랫폼유통업계가 저렴한 ‘중고’와 ‘반품’ 상품 판매 사업을 확장하고 있다.이커머스 업체 11번가는 반품·이월 상품 등을 모은 전문관 ‘리퍼블리’를 오픈했다고 3일 밝혔다. 리퍼블리는 단순 변심으로 인한 반품 상품을 비롯해 진열·이월·미세 흠집을 가진 상품 등 사용에는 아무런 문제가 없지만 일반 판매가 어려운 상품을 저렴하게 판매하는 전문관이다. 반품 상품을 전문으로 하는 170개 판매자를 입점시킨 11번가는 연말까지 판매자를 2배 이상 늘리고, 반품 상품 약 1500종을 보유한 전문관으로 키우겠다는 계획이다. 11번가는 제품에 대한 고객 신뢰 확보를 위해 등록된 상품 정보의 정확성, 배송 준수 여부 등 서비스 전반에 걸친 모니터링을 통해 기준에 미달하면 전문관에서 퇴출시키는 페널티 제도를 적용키로 했다.현대리바트도 지난달 가구 업체 최초로 중고 가구 플랫폼인 ‘오구가구’를 출시했다. 현대리바트는 “국내에서 버려지는 폐가구가 연간 5000톤에 달하는데 재활용 비율은 1% 미만에 그친다”며 “새로운 시장을 개척하는 동시에ESG경영까지 가능하다는 것이 장점”이라고 말했다. 오구가구는 전문 설치 기사가 직접 가구 해체부터 배송·설치까지 원스톱으로 해주도록 해 중고 가구 거래의 단점도 보완했다.백화점들도 중고 거래에 뛰어든 상황이다. 롯데는 잠실 롯데월드몰 2층에 네이버 중고 거래 플랫폼 크림의 오프라인 매장을 업계 최초로 열었고, 신세계는 자사 벤처캐피털을 통해 리셀(재판매) 플랫폼 번개장터에 투자하고 있다. 현대는 신촌점·미아점에 중고품 전용 매장을 열었다.가계의 소비 여력이 줄어들수록 저렴한 중고·반품 제품을 찾는 고객이 늘어날 것으로 전망된다. 한국은행에 따르면, 올해 우리나라 가계의 실질구매력은 전년 대비 0.7% 증가하는 데 그쳐 2022년(3%)보다 크게 둔화할 것으로 예상한다."
