date,title,content
2022-09-30,"[단독] 정년퇴직자 가족 우선 채용… 기업 40곳, 고용세습 여전","기아차·현대제철·STX엔진… 불공정 논란에도 단협 안고쳐최소 25개 회사가 민노총 소속, 삼양옵틱스 등 일부는 수정키로기아자동차·현대제철을 비롯한 40개 사업장에서 노사가 ‘고용 세습’ 조항을 포함한 단체협약을 유지하고 있는 것으로 확인됐다.29일 국회 환경노동위원회 국민의힘 이주환 의원실에 따르면 고용노동부가 올해 5~6월 조사한 100인 이상 사업장 1057곳 중 63개 사업장이 정년퇴직자나 장기근속자, 업무 외 상병(傷病)자, 직원 직계 가족을 우선 채용하는 단체협약 조항을 가지고 있었다. ‘우선·특별 채용 단체협약’ 사업장 명단이 공개된 건 처음이다./자료=국민의힘 이주환 의원실분석 결과, 63곳 중 40곳이 ‘정년퇴직자의 가족이나 피부양자를 우선 채용한다’는 단체협약 조항을 가지고 있었다. 중소기업이 많았지만, 현대제철과 현대위아,OCI포항공장, 효성 창원공장 등 대기업도 상당수 있었다. 원광대의대 산본병원, 인천기독병원, 한일병원, 건국대 충주병원 등 의료기관도 많았다. 기아차와 자일대우버스의 경우 정년퇴직자 외에 장기근속자 가족에 대해서도 우선 채용 조항이 있었다.세아창원특수강은 정년퇴직자 자녀나 형제자매에게 직원 공채 시 100점 만점에 10점 가산점을 주는 조항이 있었다. 삼안여객 등 5곳은 ‘노조나 직원 추천을 받아 채용한다’는 조항이 있었다. 이 중 현대성우오토모티브코리아의 경우 정년퇴직자 직계 자녀를 우선 채용하도록 했고, 이와 별도로 직원 자녀나 직원이 추천한 사람에게 가산점을 주도록 했다. 63곳 중 나머지 사업장들은 주로 산재가 아닌 업무 외 질병 사망자 가족을 우선 채용하도록 한 곳이다.정년퇴직자 가족을 우선 채용하는 단체협약은 수년 전부터 ‘현대판 음서제’라는 비판을 받아왔다. 기존 직원 가족이라는 이유로 채용되는 것이 다른 사람들의 기회를 박탈해 공정하지 않다는 이유에서다. 현행 고용정책기본법도 채용 때 합리적 이유 없는 차별을 금지하고, 취업 기회를 균등하게 보장하도록 규정하고 있다. 이를 근거로 정부 역시 해당 조항들의 위법 가능성이 크다고 보고 있다.다만, 산업재해 사망자 가족을 우선 채용한다는 단체협약에 대해 법원이 지난 2020년 “소중한 목숨을 잃은 근로자의 특별한 희생에 대한 보상이라 위법하지 않다”는 판단을 내렸다. 이런 이유로 정부가 문제가 있다고 판단한 63곳에는 산재 사망자에게만 혜택을 주는 곳은 들어 있지 않았다.정년퇴직자 가족을 우선 채용하는 조항을 가진 사업장의 노조 상당수는 민노총 소속이었다. 40곳 중 최소 25곳이 민노총 소속으로 확인됐다. 금속노조 산하 노조가 15곳으로 가장 많았고, 보건의료노조 산하가 5곳으로 뒤를 이었다.노동계에서는 이에 대해 “이미 사문화됐고, 단체협약으로 실제 채용된 사례는 거의 없다”고 주장한다. “수십 년 전, 공장에서 일하는 것을 다들 기피하던 시기에 사람을 모으기 위해 만들어진 경우가 대부분이고, 숙련공을 오래 붙잡아두기 위한 측면이 있었다”는 것이다.하지만 반론도 나온다. 한 노동계 인사는 “특혜 우선 채용을 했다 해도 회사도 이를 공개할 수 없기 때문에 밖에서는 내용을 알기 어렵다는 게 문제”라고 했다. 2018년 국회에서 “울산 한 회사에서 몇 년 동안 퇴직을 앞둔 조합원 자녀와 친인척, 지인 등 40명을 채용했다”는 주장이 나오기도 했다. “사문화된 조항이 맞는다면 왜 그동안 해당 조항을 그대로 뒀느냐”는 지적도 있다. 실제 기아차 노조(소하 지회)는 지난해 11월 회사가 5년 만에 생산직 신규 채용을 검토하자 단체협약을 근거로 ‘정년퇴직자와 25년 이상 장기근속자의 자녀를 우선 채용하라’고 회사에 요구했다.정부는 해당 조항들에 대해 시정 조치를 내리고 있는 중이다. 일부 사업장은 해당 조항을 삭제했거나(샤니·코카콜라음료), 내년에 삭제할 예정(삼양옵틱스)이다. 이주환 의원은 “고용세습은 합리적 이유 없는 차별이고, 노조원 가족이라는 이유만으로 일자리를 얻는다면 다른 청년들에게는 기회조차 박탈하는 불공정”이라고 했다."
2022-03-01,“전쟁이 지옥문 열었다” 큰손들 탈러시아 행렬 [왕개미연구소],"뱅크런, 루블화 가치 폭락 등 서방 주요국의 제재가 러시아에 엄청난 압박을 가할 것이란 전망이 나온다. 사진은 지난달 27일 러시아 모스크바의 한 은행ATM앞의 대기줄. /AP연합뉴스러시아의 전쟁 도발이 글로벌 투자자들을 패닉에 빠뜨리고 있다. 러시아 화폐 가치는 역대 최저 수준으로 떨어졌고, 러시아 현지 은행에는 뱅크런(예금 대규모 인출) 조짐마저 나타나고 있다. 서방 주요국의 경제 제재가 강화되면서 러시아에 진출한 글로벌 기업들의 직·간접적인 피해도 커질 전망이다.지난 28일 외환시장에서 미국 달러 대비 루블화 가치는 전날 대비 28% 폭락했다. 서방 국가들이 일부 러시아 은행을 국제은행간 통신협회(SWIFT·스위프트) 결제망에서 배제하는 등 제재안을 발표한 데 따른 것이다. 다급해진 러시아 중앙은행은 이날 기준금리를 9.5%에서 20%로 대폭 인상했고 주식시장도 하루 휴장했다.러시아에 대한 서방의 금융 제재가 발표되고 러시아가 핵 위협 카드를 꺼내면서 러시아 화폐 가치가 30% 가까이 폭락했다. 사진은 지난달 28일 서울 을지로 하나은행 본점에서 직원이 루블화를 정리하고 있는 모습./연합뉴스글로벌 큰손들은 경제 제재 일환으로 러시아 자산을 처분하고 나섰다.1조3000억 달러를 운용 중인 노르웨이 국부펀드(SWF)는 러시아 신규 투자를 중단하고, 기존 러시아 자산 에 대한 매각 절차를 시작한다고 지난달 27일 밝혔다. 노르웨이 국부펀드가 보유 중인 러시아 자산은 47개 기업의 주식과 국채인데, 작년 말 기준으로 250억 크로네(약 3조4000억원) 상당에 달하는 것으로 알려졌다.그 동안 노르웨이 정부는 국부펀드 투자에 정치가 영향을 미치지 않는다고 해왔지만, 러시아에 강경하게 대응해야 한다는 여론이 거세지자, 결국 투자 방침에도 변화가 생겼다.전세계 최대 연기금인 일본 공적연금(GPIF) 역시 지난 달 28일 러시아 관련 보유 자산이 2021년 3월 기준으로 약 2200억엔(약 2조 2931억원)에 달한다고 밝혔다. 국채와 회사채 등을 합친 채권이 약 500억엔, 주식이 약 1700억엔 가량인 것으로 알려졌다.GPIF의 운용 규모는 작년 말 기준 199조2518억엔(약 2077조원)이었다.주식 리스트에는 러시아의 우크라이나 침공으로 서방 국가들의 제재 대상이 된 러시아 최대 국영 은행인 ‘스베르방크’도 포함되어 있다.GPIF는 법령에 따라 개별주 직접 투자는 하지 않으며, 모든 투자 판단은 외부 운용회사에 일임하고 있다.한국 국민연금은 아직 정확한 액수를 밝히고 있진 않지만, 러시아 국채와 주식 등을 일부 보유하고 있는 것으로 알려졌다. 구체적으로는 노바텍(가스 생산업체)과 루크오일(석유 생산업체), 가스프롬(국영 에너지 기업) 등이다. 위탁 운용사가 대부분 보유하고 있다고 한다. 러시아 국채의 경우 신용등급이 일정 수준 이하로 떨어지면 강제 매각해야 한다.패닉에 빠진 러시아 금융시장에서 기회를 찾아야 한다는 목소리도 나온다. 사진은 지난 1998년 1월 7일자 조선일보 29면. 시중 자금난이 해소되지 않은 데다IMF(국제통화기금)의 고금리 정책으로 20％대 이자를 준다는 금융상품이 늘었다는 내용이다.영국 석유회사인 브리티시페트롤리엄(BP)은 지난달 27일 러시아 국영 석유회사 로스네프트 지분을 처분하기로 했다고 발표했다.BP는 지난 2013년 로스네프트에 투자해 지분 19.75%를 보유하고 있다. 외국 기업이 러시아에 투자한 금액으로는 사상 최대였다. 외신 보도에 따르면,BP는 이번 지분 매각으로 250억달러(약 30조원) 상당의 손실을 입을 것으로 추정된다.BP에 이어 노르웨이 국영 에너지 기업인 에퀴노르도 러시아 시장에서의 신규 투자를 중단하고, 러시아 합작회사를 매각한다고 로이터통신이 지난달 28일 보도했다. 미국 석유업체인 엑손 모빌도 러시아 사할린 유전사업 철수 압력을 받을 것이라는 보도도 나오고 있다.서구 은행들이 러시아에 빌려준 돈을 돌려받기 힘들 것이란 전망도 나온다. 국제결제은행(BIS)에 따르면 이탈리아와 프랑스, 미국 등 외국 은행이 러시아 기업에 대출한 금액은 1210억달러(약 146조원)에 달한다.러시아 모스크바 동부 외곽 노보랴잔스코예 거리에 있는 현대차 판매점./현대차 제공한국에선 러시아 투자 규모가 큰 현대차그룹이 직격탄을 맞는 모습이다. 증시가 가장 빠르게 반응했는데, 현대차그룹 내 종목들이 일제히 52주 신저가로 밀렸기 때문이다. 지난 달 28일 현대차는 장중 16만8000원까지 밀렸고, 기아도 장중 7만1500원까지 내렸다. 현대모비스, 현대위아 등 그룹 내 다른 주식들도 모두 이날 52주 신저가를 찍었다.임은영 삼성증권 연구원은 “서방 국가들의 러시아 경제 제재로 현대차와 기아의 러시아 수출은 당분간 어려울 것으로 예상된다”며 “현대차의 최대 손실은 2000억원, 기아의 최대손실은 2500억원으로 각각 추산했다."
2022-02-22,"차량용 반도체 공급난에, 자동차株 역주행","올해 현대차 12% 기아 4% 하락만도 등 車 부품업체도 힘못써외국인·기관 순매도도 한몫차량용 반도체 공급 부족 등의 여파로 올 들어 자동차 관련 주 주가가 약세를 보이고 있다. 21일 한국거래소에 따르면 올 들어 이날까지 현대차 주가는 11.5% 하락했고, 기아 주가도 4% 하락했다. 자동차 부품 업체인 현대모비스(-10.2%), 만도(-24.7%), 현대위아(-17.3) 등도 모두 두 자릿수 하락률을 기록했다.차량용 반도체 공급 부족에 따른 생산 차질이 자동차 제작사 외에 자동차 부품기업의 주가에도 악재로 작용하고 있다는 분석이 나온다. 최근 산업통상자원부가 발표한 ‘2022년 1월 자동차산업 동향’에 따르면, 지난달 국내 자동차 생산은 13.7% 감소했다. 수출도 6.4% 줄었다. 신차 출시를 위한 설비 공사로 일부 공장이 휴업을 한 영향도 있었지만, 차량용 반도체 수급난이 지속되고 있는 것 역시 자동차 생산에 영향을 주고 있다.외국인과 기관 투자자의 순매도도 주가가 약세를 보이는 원인 가운데 하나다. 외국인 투자자는 올 들어 현대차를 4510억원 순매도했고, 기관 투자자도 2950억원 순매도했다. 기관 투자자는 같은 기간 기아도 3040억원 순매도했다. 올 들어 외국인과 기관 투자자는 지난달 27일 상장한LG에너지솔루션을 매수할 자금을 마련하기 위해 국내 증시 대형주들을 많이 팔았는데, 이 때문에 현대차와 기아 주식을 순매도한 경우도 많았을 것으로 보인다.올 들어 해외 자동차 기업의 주가도 약세를 보이고 있다. 미국 전기차 기업 테슬라 주가도 지난해 말 1056.78달러에서 지난 18일 856.98달러까지 18.9% 하락했다. 포드 주가 역시 작년 말 20.77달러에서 18.04달러까지 하락했다."
2023-04-19,“현대차가 삼성전자 눌렀다” 덩달아 몸값 치솟는 이 회사들,"지난달 현대자동차 울산공장 수출 선적부두 인근 야적장에 완성차들이 대기하고 있는 모습. /뉴스1현대자동차의 올해 1분기(1~3월) 영업이익이 국내 상장사 가운데 가장 클 것으로 예상되는 가운데, 현대차 등에 납품하는 자동차 부품 업체들의 주가가 일제히 치솟고 있다. 1분기 어닝 쇼크(실적 저하 충격)를 맞은 삼성전자 대신 현대차가 ‘실적 왕(王)’ 자리를 꿰차자, 그와 관련한 부품주들이 일종의 ‘낙수 효과’를 누리고 있는 모습이다. 금투업계에선 “최근 과열 논란을 빚은 2차전지 종목의 대안으로, 실적이 받쳐주는 자동차 관련주를 주목해야 한다”는 말이 나온다.현대차그룹 소속의 자동차 부품사인 현대위아의 주가는 이달 들어 지난 17일까지 14% 상승했다. 차량 소프트웨어 전문 기업인 현대오토에버는 11% 올랐다. 같은 기간 코스피지수 상승률(4%)의 약 3배 수준이다. 현대차에 섀시(차량의 뼈대)와 발광다이오드를 각각 납품하는 화신(19%)과 에스엘(16%)도 주가가 급등하는 중이다.현대차에 납품하는 부품업체들 주가 치솟아최근 자동차 부품주가 주목받는 이유는 우선 현대차의 1분기 영업이익이 ‘국내 1위’를 달성할 것이란 기대감 덕분이다. 18일 금융정보업체 에프앤가이드에 따르면 현대차의 올 1분기 영업이익 컨센서스(3곳 이상 증권사 추정 평균)는 2조8587억원으로 집계된다. 컨센서스가 있는 상장사 237곳 중 1위다. 지난 7일 발표된 삼성전자의 1분기 잠정 영업이익(6000억원)의 4배를 넘는다. 1분기 영업이익 2등도 기아(컨센서스 2조2937억원)가 차지할 것으로 예상된다. 이럴 경우 현대차그룹의 양대 회사가 나란히 ‘투 톱’이 되는 것이다.작년 1분기만 해도 현대차의 영업이익(약 2조원)은 삼성전자(14조1200억원)에 크게 못 미쳤다. 그런데 이후 반도체 시장 불황 여파로 삼성전자는 타격을 받은 반면, 현대차는 ‘강달러’의 혜택을 톡톡히 봤다는 것이 업계의 평가다. 달러가 원화 대비 강세를 띠면, 미국 등 현지에서 수출되는 국산차의 가격 경쟁력이 높아지기 때문이다. 현대차와 기아는 미국에서 올해 1분기 38만2000여 대를 팔아 역대 1분기 중 최다 판매 실적을 거뒀다.‘완성차’가 웃자 ‘부품사’도 잔치를 벌였다. 컨센서스가 있는 자동차 부품사 8곳의 1분기 영업이익 전망은 총 1조632억원인데, 이는 작년 동기(6850억원) 대비 55%나 오른 것이다. 전체 상장사 237곳의 영업이익이 같은 기간 49% 줄어 오히려 반 토막이 난 것과 대비된다. 특히 전기차 부품 등을 생산하는 한온시스템은 작년 1분기 대비 영업이익 예상액이 136%나 늘었다. 장문수 현대차증권 연구원은 “완성차에서 큰 부품사, 작은 부품사로 호실적이 연쇄적으로 전달되는 현상”이라고 말했다.전문가 “환율 변수 유의해야”자동차 부품주의 향후 주가 전망도 양호한 편이다. 특히 지난 11일 현대차그룹이 오는 2030년까지 전기차 분야에 24조원을 투자하겠다고 밝히면서, 부품주의 추가 상승 여력도 충분하다는 분석이다. 김귀연 대신증권 연구원은 “자동차 부품주의 실적 개선은 하반기에 더 본격적으로 나타날 것”이라며 “부품주 비중을 확대하는 전략이 유효할 것으로 보인다”고 말했다.다만, 환율 등 거시경제 지표가 ‘변수’가 될 수 있다는 지적도 나온다. 현재 달러당 1300원대인 달러 대비 원화 환율이 1200원대로 떨어지는 등 원화 강세가 나타나면, 그만큼 현지 경쟁력이 떨어지게 되는 완성차 기업들의 실적이 한풀 꺾일 수 있다는 것이다. 장문수 연구원은 “부품사의 실적과 주가는 장기적으로 완성차 기업을 따라간다는 점을 유념하면서 투자해야 한다”고 말했다."
2023-02-21,현대차 그룹에 번지는 ‘성과급 갈등’… 계열사들 “우리만 왜 덜 받나” 불만,"[Biz톡]지난해 사상 최대 실적을 거둔 현대차·기아가 전 직원에게 ‘400만원+주식’의 특별성과급을 지급하기로 하자 그룹 내 다른 계열사들의 노조가 강력 반발하고 있습니다. 특히 계열사별로 성과급을 차등 지급하는 데 대해 “우리도 현대차·기아 직원들 못지않게 기여했는데 왜 불이익을 받느냐”고 불만을 터뜨립니다. 급기야 일부 노조는 사장실 점거 위협까지 하고 있습니다.현대차·기아 사장은 지난 17일 “현대차 직원은 400만원+주식 10주, 기아 직원은 400만원+주식 24주를 다음 달 2일 지급하겠다”고 밝혔습니다. 두 회사의 실적이 예상을 크게 뛰어넘자 노조가 임단협에서 정한 성과급 외에 추가로 특별성과급을 요구했고 회사가 이를 수용한 것입니다.그러자 핵심 부품 계열사인 현대모비스 노조가 특별성과급을 요구하고 나섰습니다. 이에 회사 측이 특별격려금 명목으로 300만원을 지급하겠다고 했는데, 노조는 “우리도 똑같이 달라”고 요구하는 겁니다. 노조 간부 3명은 지난 17일부터 나흘째 본사에서 “사장실 점거도 불사하겠다”며 투쟁 중입니다.현대모비스 노조는 현대차지부에 속해 있어 그동안 ‘2사 1노조, 동일 임금’ 원칙에 따라 현대차와 같은 임금과 성과급을 받았습니다. 지난 2000년 현대모비스가 생길 때 일부 현대차 직원이 옮겨가면서 이런 원칙을 만들었다고 합니다. 하지만 회사 측은 “현대차·기아는 성과가 있어서 주는 ‘특별성과급’이고, 현대모비스는 성과는 기대에 못 미쳤지만 50조원 넘는 매출을 달성한 노력을 격려하기 위한 ‘특별격려금’”이라고 설명합니다. 격려금이니 ‘2사 1노조 동일 임금’ 원칙과 무관하다는 겁니다.현대차그룹의 다른 계열사인 현대위아와 현대트랜시스 직원들도 지난 17일 각각 ‘특별포상금’과 ‘특별격려금’ 명목으로 300만원을 받았습니다. 두 회사 노조 역시 지난 16일 창원 본사 앞에서 현대차·기아 수준의 성과급을 요구하며 대규모 집회를 열기도 했습니다. 현대차그룹 관계자는 “좋은 의도로 지급한 격려금이 엉뚱하게 계열사 직원들 간 갈등의 불씨가 돼 씁쓸하다”며 “줘도 고민 안 줘도 고민”이라고 했습니다."
2022-11-01,현대차그룹 ‘협력사 온라인 채용박람회’ 열어,"현대차그룹은 11월 1일부터 11일까지 ‘현대차그룹 협력사 온라인 채용박람회’를 연다고 31일 밝혔다. 올해로 11회째를 맞는 이 협력사 채용박람회는 원활한 채용 과정이 진행되도록 현대차그룹이 운영과 재정 지원을 전담한다.코로나 확산 방지를 위해 온라인으로 진행되는 이번 채용박람회에는 현대차와 기아를 비롯해 현대모비스, 현대위아, 현대트랜시스, 현대로템, 현대오토에버, 현대엔지니어링 등 8개 그룹사의 440여 개 협력사가 참여한다. 구직자는 채용박람회 홈페이지를 통해 관심 있는 기업에 지원서를 작성해 제출하면 된다. 서류 합격자에게는 별도로 합격 안내가 통보되고 온라인으로 면접이 진행된다.현대차그룹은 채용박람회 홈페이지 내에 기업 정보뿐 아니라 현직자들의 생생한 직무 이야기를 들을 수 있는 별도의 공간을 마련했다. 또 자소서나 자기소개, 면접 방법 등 취업 관련 가이드도 제공한다. 현대차그룹 관계자는 “행사 종료 후엔 채용박람회 공식 홈페이지를 자동차 산업 분야에 특화된 채용 정보를 제공하는 곳으로 재단장할 예정”이라며 “자동차 시장에 양질의 일자리를 제공하는 행사가 되도록 할 것”이라고 했다."
2024-12-20,"현대차그룹, 이웃사랑 성금 350억원 전달…22년간 총 4290억원 기탁","현대차그룹이 지난 19일 서울 중구 사회복지공동모금회 사랑의열매 회관에서 열린 희망2025나눔캠페인 성금 전달식에서 350억원을 기탁했다고 20일 밝혔다. 장재훈 현대차그룹 사장, 김병준 사회복지공동모금회 회장이 기념 촬영하고 있다. 사진 현대차그룹현대차그룹이 연말을 맞아 이웃사랑 성금 350억원을 사회복지공동모금회에 전달했다.현대차그룹은 지난 19일 서울 중구에 있는 사회복지공동모금회 사랑의열매 회관에서 현대차그룹 장재훈 사장, 사회복지공동모금회 김병준 회장 등이 참석한 가운데 '희망2025나눔캠페인' 성금 전달식을 진행했다고 20일 밝혔다.사회복지공동모금회는 연말연시 어려운 이웃을 돕기 위해 매년 12월 1일부터 다음 해 1월 31일까지 희망나눔캠페인을 진행한다.현대차그룹은 2003년부터 매년 사회복지공동모금회에 성금을 전달해왔다. 올해까지 22년간 기탁한 성금 누적 총액은 4290억원이다.장재훈 사장은 “나눔을 통해 이웃을 돕고 다양한 사회문제를 해결하는 것 또한 기업의 중요한 역할이라는 생각에 올해도 성금을 기탁하게 됐다”며 “현대차그룹은 앞으로도 지속 가능한 미래를 향한 올바른 움직임을 계속하겠다”고 말했다.한편 현대차그룹의 현대엔지니어링(2억3000만원), 현대건설(2억2000만원), 현대모비스(1억원)도 임직원 성금과 노사 공동 특별사회공헌기금 등을 사회복지공동모금회에 전달했다.현대차 울산공장은 연말을 맞아 저소득층 아동을 대상으로 크리스마스 기념 식사와 선물을 제공하는 '파란산타' 프로그램을 진행했고, 기아는 서울 본사를 비롯해 경기 광명, 화성 등에서 봉사활동을 펼치는 '무브온' 프로젝트를 하고 있다. 현대위아는 사업장 인근 복지시설에 트럭을 개조한 밥차 1대를 포함해 차량 10대를 기증할 예정이다."
