date,title,content
2023-03-02,현대차 10년 만에 생산직 채용…몰리는 지원자에 홈피 멈췄다,"지난해 5월 현대차 울산공장 내 전기차 ‘아이오닉 5’ 생산라인에서 현장 근로자가 차를 점검하고 있다. 사진 현대차현대차가 10년 만에 생산직 신입사원 채용에 나서면서 서류 접수가 이뤄지는 채용 홈페이지에 접속 지연 현상이 벌어졌다.2일 자동차 업계에 따르면 이번 채용은 미래 자동차산업 경쟁력 확보와 직원 고용 안정을 위해 올해와 내년 생산직 700명을 공개 채용하기로 한 현대차 노사 합의에 따라 이뤄졌다. 지원 자격은 고등학교 졸업 이상으로 연령·성별 제한은 없다. 올해 채용 인력은 400명 정도다. 서류 접수는 이날부터 12일까지 11일간 현대차 채용 홈페이지에서 진행된다. 서류 합격자 발표는 이달 말이다.━고졸 이상으로 연령·성별 제한 없어면접 전형은 총 2개 차수로 진행되며 1차수는 다음 달부터 6월 초까지, 2차수는 5월부터 6월 말까지 각각 이뤄진다. 현대차는 차수별 1차 면접, 인성·적성검사, 2차 면접, 신체검사를 거쳐 7월 중 최종합격자를 발표한다. 합격자는 입사 교육을 거쳐 9월에서 10월 사이 현장에 배치될 예정이다.현대차는 이번 채용이 전동화 등 산업 구조 변화에 적극적으로 대응하기 위한 기술 인력 채용이라는 점을 강조했다. 또 10년 만에 실시하는 생산직 신입사원 채용인 만큼 공정하고 투명한 절차 아래 진행하겠다고 밝혔다. 현대차에 차량 부품을 공급하는 계열사인 현대위아도 이날 신산업 분야 위주로 연구개발 경력직을 채용한다고 밝혔다. 채용 규모는 세 자릿수에 가까운 수준으로 알려졌다.2일 오후 4시 현대차 채용 홈페이지에 뜬 안내문. 사진 현대차 홈페이지이날 현대차 채용 홈페이지는 정보를 얻거나 서류를 접수하고자 하는 지원자가 몰리면서 접속이 지연되는 현상이 나왔다. 이날 오후까지 ‘다수의 대기자가 있다’며 ‘현재 접속자가 많아 대기 중’이라는 문구가 떴다. 업계는 2만명이 넘는 지원자가 몰린 것으로 추정했다.현대차 생산직 채용 공고가 큰 관심을 받자 이를 두고 '킹산직(생산직의 왕)'이라는 말도 나오고 있다. 사무직을 아우르는 현대차의 평균 연봉은 2021년 기준 9600만원 정도다. 생산직의 평균 연봉은 이보다 더욱 높을 것으로 예상한다. 국내 생산직 연봉 수준이 최근 공개된 적은 없지만 2016년에 공개된 미국 앨라배마 공장의 생산직 평균 연봉은 9만 400달러(약 1억1888만원)에 달했다.━연봉 1억원 넘길 것으로 예상해 ‘킹산직’미국 급여에는 건강보험료와 각종 수당이 포함돼 단순 비교는 어렵지만 7년 전 근로자 연봉보다는 현재 임금이 더 높을 가능성이 크다. 참고로 지난해보다 5% 오른 올해 공무원 9급 1호봉 월급은 177만800원에 그친다. 단순 연봉만 비교해도 현대차 생산직의 매력은 상당하다. 여기에 지원자들은 현대차에 채용되면 장기간 일할 수 있다는 점도 매력으로 꼽는다. 현대차의 전체 근로자 6만6000여명의 지난해 평균 근속 연수는 18.9년이다.현대차 생산직 인기는 다른 업계에도 영향을 미치고 있다. 벌써부터 서점가에서는 현대차 생산직 수험서가 판매되기 시작했다. 온라인에서는 합격 족보와 같은 정보가 공유되고 있다. 이호근 대덕대 자동차학과 교수는 “전동화로 전환하면서 생산직 인력을 점차 줄여나가는 추세”라면서 “앞으로 생산직 채용 기회가 더욱 적을 수 있어서 지원자가 몰리는 것으로 보인다”고 말했다."
2022-04-23,“현대모비스도 격려금 받는대”…6만 계열사 직원 '올레' 터진 이유,"정의선 현대차그룹 회장이 지난해 초 타운홀 미팅에서 직원들에게 발언하고 있다. [사진 현대차]현대모비스가 전 직원에게 1인당 400만원의 격려금·독려금을 지급하기로 한 지난 20일. 현대차·기아를 제외한 현대차그룹에 재직 중인 6만여 명의 다른 그룹사 직원도 덩달아 신이 난 모습이었다.폐쇄형 커뮤니티 블라인드를 비롯한 각종 현대차그룹 관련 웹사이트에는 “축하한다” “고생했다” 같은 게시글이 줄줄이 올라왔다. 현대차·기아가 비슷한 격려금을 받을 때 노골적으로 불만을 터트리던 모습과는 정반대다.서울 역삼동SI타워에서 현대모비스 노동조합이 진행한 상경시위. [사진 현대모비스 노조]━[현장에서] 현대차그룹 특별격려금 둘러싼 내홍보너스 지급을 둘러싼 현대차 계열사 간 내홍의 발단은 지난해 초로 거슬러 올라간다. 주요 대기업에서 젊은 층을 중심으로 성과급 산정기준과 규모를 문제삼던 때였다. 현대차 내부에서도 “성과급이 낮다”며 불만이 터져나왔다. 정의선 현대차그룹 회장이 온라인 타운홀 미팅에서 “임직원들이 회사에 기여한 것에 비해 존중받지 못한다고 생각하게 해 죄송하다”고 사과까지 했다.지난해 7월 임금·단체협상 타결 이후 현대차·기아 직원 10만여 명은 1000만원 이상의 보너스를 받았다. 여기에는 품질향상·재해예방 격려금 명목으로 받은 현금 230만원도 포함돼 있다. 지난해 11월엔 일부 사무·연구직 간부 직원이 152억원의 특별 포상금을 받았다. 현대차 직원 2402명, 기아 645명이 각각 500만원씩 받았다.이런 상황에서 현대차·기아는 또 다시 돈다발을 풀었다. 지난달 초 전 직원에게 직급과 직무에 관계없이 ‘코로나19 특별격려금’ 명목으로 1인당 400만원을 지급했다.현대모비스 재직자로 추정되는 인물이 폐쇄형 커뮤니티 블라인드에 업로드한 글. 현대차와 기아에 지급한 400만원의 격려금을 '갈라치기'라고 비판하고 있다. [사진 블라인드 캡처]완성차 직원들은 신이 났지만 계열사 직원들은 달랐다. 민주노총 금속노조 현대로템지회는 “현대로템 경영실적은 연결재무제표상 지배기업 소유주 지분의 실적으로 반영된다”며 “현대차 실적은 현대로템 종업원이 함께 만들어온 결과물”이라고 주장하며 현대차·기아와 동일한 수준의 특별성과급 지급을 요구했다.현대모비스 노조는 아예 단체행동에 돌입했다. 울산·창원·진천 공장 노조원이 서울 역삼동 본사까지 몰려들었다. “똑같이 공채로 들어왔는데 일부 현대차 직원이 계열사 직원에게 갑(甲)처럼 무례하게 행동하는데 성과급까지 차등 지급 받아야 하나”라며 “차라리 부품도 현대차가 만들라고 하자”라는 말까지 나왔다.온라인에서도 들끓었다. 현대글로비스의 한 직원은 블라인드에서 “차체 프레임은 현대제철이 만들고, 부속품은 현대케피코·현대위아·현대트랜시스가 만들며, 완성차는 현대글로비스가 옮긴다”며 “400만원은 아니더라도 성의를 보여라”고 요구했다.현대차보다 더 실적이 좋은 계열사 직원은 ‘공정’과 ‘형평성’을 부르짖었다. 현대제철은 2020년 대비 지난해 영업이익이 3251%나 증가했다. 같은 기간 현대차(178%)·기아(145.1%)보다 증가율이 훨씬 높다. 현대제철 노조는 성명서에서 “24시간 고열, 분진, 소음 속에서 사투한 끝에 현대제철은 역대 최대의 영업이익을 달성했다”며 “실적에 대한 공정한 분배는 당연하다”고 주장했다.정의선 현대차그룹 수석부회장이 지난 2019년 서울 서초구 현대차그룹 본사 2층 대강당에서 타운홀 미팅을 마친 후 임직원과 기념촬영을 하고 있다. [사진 현대차그룹]━현대차 격려금 잔치에 상대적 박탈감이런 상황에서 현대모비스가 비(非)완성차 최초로 격려금을 받아내자 다른 계열사는 축제 분위기가 된 것이다. 격려금 지급을 두고 협상 중인 다른 계열사에 지렛대로 작용할 수 있다고 봤기 때문이다.이들은 특히 현대모비스가 직원에게 지급하는 금액이 현대차·기아와 같은 수준이라는 데 주목하고 있다. 애초 현대모비스는 현대차·기아보다 다소 적은 금액의 격려금을 지급하는 방안을 검토했다. 반발에 부딪히자 일부 금액(300만원)을 현금으로 지급한 뒤, 나머지는 상품권이나 주식을 지급하는 방법도 제안했다. “그룹사 전 계열사가 일제히 400만원을 요구할 가능성을 차단하기 위해서”라는 게 익명을 원한 현대차그룹 관계자의 추정이다.현대차 양재동 사옥 [사진 현대차]하지만 결과적으로 현대모비스 직원은 완성차 계열사와 완전히 같은 금액을 받게 됐다. 이를 두고 그룹사 직원들은 “그간 계열사 직원은 연봉이나 처우, 복지는 물론 사소한 혜택도 대부분 현대차보다 낮았다”며 “단지 400만원이 문제가 아니라 향후에도 현대차·기아와 동일한 대우를 받을 수 있는 계기를 열었다”고 해석하고 있다.현대차그룹 인사파트 관계자들의 해석은 다르다고 한다. 현대모비스 지급 총액은 인당 400만원이지만, 특별격려금은 인당 300만원으로, 현대차(400만원)와는 엄연히 차이가 있다는 것이다. 현대모비스가 추가로 지급하는 100만원은 ‘격려금’이 아니라, 창립기념일(7월 1일)을 맞아 자체 성과 창출을 독려하기 위한 별개의 ‘목표달성독려금’이라고 규정하고 있다.김필수 대림대 미래자동차학부 교수는 “현대차그룹 내에서 완성차 계열사가 부품 계열사를 차별한다는 인식이 팽배한 데, 현대차·기아만 특별대우를 받던 관행을 현대모비스가 깨뜨렸다는데 계열사 직원이 주목하고 있다”며 “이번 격려금 사태를 통해 현대차그룹이 사내 갈등·차별 관행을 개선하는 방안을 모색할 필요가 있다”고 말했다."
2022-04-20,현대모비스도 전 직원에 격려금…다른 계열사도 ‘기대’,"현대모비스 기술연구소 전경. [사진 현대모비스]현대차·기아에 이어 현대모비스 직원 1만여 명도 특별격려금을 받는다. 현대글로비스·현대제철 등 현대차그룹의 다른 계열사 직원에게도 격려금이 지급될 전망이다.20일 자동차업계 따르면, 김용근 민주노총 금속노조 현대차지부 현대모비스위원회 의장은 전 직원에게 ‘코로나19 위기 극복 위로금 400만원을 지급하기로 노사가 합의했다’고 공지했다.현대모비스에 따르면 이번 특별 보너스는 21일과 오는 7월 1일 두 차례에 나눠 각각 300만원, 100만원을 현금으로 지급된다. 회사 관계자는 “완성차의 품질 향상을 위해 노력한 직원들에게 300만원의 특별격려금을, 이와 별도로 자체 성과 창출을 독려하기 위해 목표달성 독려금 100만원을 지급하기로 했다”고 말했다.지난해 말 기준으로 현대모비스 직원은 1만383명이다. 이들에게 지급하는 격려금·독려금 규모는 415억3200만원이 될 것으로 보인다.앞서 지난달 초 현대차·기아가 코로나19 특별격려금을 지급한 바 있다. 임원을 제외한 전 직원에게 직급과 직무에 관계없이 인당 400만원을 정액으로 줬다.장재훈 현대차 사장은 당시 전 직원에게 이메일을 보내 “코로나19를 비롯해 어려운 국내·외 상황 속에서 우리 제품의 상품성과 안전, 그리고 뛰어난 품질을 전 세계적으로 인정받았다”며 격려금 지급을 알렸다. 송호성 기아 사장도 같은 날 “우리가 이룬 수많은 성취는 여러분의 부단한 노력과 위기 속에서 고군분투해왔던 순간들이 모여 이뤄낸 결과”라고 말했다.현대모비스 재직자로 추정되는 인물이 폐쇄형 커뮤니티 블라인드에 업로드한 글. 현대차와 기아에 지급한 400만원의 격려금을 '갈라치기'라고 비판하고 있다. [사진 블라인드 캡처]━그룹 계열사 ‘격려금 반발’ 잦아들까하지만 현대차·기아의 특별격려금 지급은 그룹 내 다른 계열사의 반발을 불러왔다. 현대모비스 울산·창원·진천 공장 노조원은 서울 강남구 역삼동 모비스 본사에서 상경 시위를 벌였다. 현대로템 노조도 “현대차와 동일한 수준의 격려금을 지급하지 않으면 단체행동에 나서겠다”는 성명을 발표했다. 폐쇄형 커뮤니티 블라인드 등을 통해 현대차그룹 계열사 임직원들은 “계열사 직원들의 노고를 무시하는 처사”라고 반발하기도 했다.이번에 현대모비스가 특별격려금 지급을 결정하면서, 다른 계열사도 보너스를 기대하는 분위기다. 코로나19에도 불구하고 지난해 실적이 좋았던 현대위아·현대제철 등에서도 격려금 지급을 요구하고 있다.현대차그룹 계열사 관계자는 “보통 현대차·기아가 무엇인가 결정하면 현대모비스→현대글로비스→현대건설·현대제철 등의 순서로 비슷한 결정이 이어지는 경우가 많다”며 “현대모비스가 물꼬를 텄으니 다른 계열사도 순차적으로 특별격려금을 받을 수 있을 것”이라고 내다봤다.다만 특별격려금의 지급 방식이나 금액은 계열사별로 다소 달라질 수 있다. 일부 계열사는 특별격려금의 일부를 비현금으로 지급하는 방식 등을 고려 중인 것으로 알려졌다."
2022-03-13,"출하량 줄고, 수익성 니빠졌지만…현대차 ‘러 손절’ 딜레마","러시아의 우크라이나 침공 사태로 대러시아 중소기업 수출 비중이 높은 자동차 업계의 타격이 우려되는 가운데 인천시 연수구 송도유원지 중고차 수출단지에 중고차가 가득 차 있다. [연합뉴스]현대자동차 러시아생산법인의 자동차 출하대수가 급감한 것으로 나타났다. 루블화 가치 폭락으로 수익성 악화도 우려된다. 러시아의 우크라이나 침공 사태 이후 국내 자동차가 타격을 입는 모습이다.13일 현대차에 따르면, 현대차 러시아생산법인의 지난달 자동차 출하대수는 1만7402대로, 전년 같은 기간(2만1004대) 대비 17.1% 감소했다. 현대차 상트페테르부르크 공장에선 현지 판매 1‧2위를 다투는 기아 리오와 현대차 쏠라리스‧크레타 등을 생산하고 있다.러시아 상트페테르부르크에 위치한 현대차 생산공장. [사진 현대차]이달에는 실적이 더 악화할 것으로 보인다. 현지 지장은 이달 1일부터 공장이 멈춰선 상태다. 자동차 업계는 현대차가 일단 이달 말까지 러시아 공장 운영을 중단하기로 한 것으로 관측하고 있다. 현대차 관계자는 이에 대해 “반도체·원자재 수급이 원활하지 않아 러시아 공장 가동을 중단한 상황”이라며 “재가동 시점은 알 수 없다”고 말했다.서방 제재로 러시아 현지는 공급망 혼란, 내수 위축이 본격화하고 있다. 완성차 시장 역시 된서리를 맞을 것으로 보인다. 한국자동차산업협회(KAMA)에 따르면 올해 러시아 자동차 수요가 지난해보다 29% 감소할 전망이다. 이러면 현대차는 6만2000대, 기아 7만 대의 판매 감소가 예상된다.연도별 현대차·기아 러시아 현지 판매량·비중. 그래픽 김현서 기자루블화의 가치가 곤두박질하면서 수익성 악화도 불가피하다. 현재 달러당 루블의 가치는 155루블 수준으로 전쟁 전(70~80루블) 대비 90%가량 하락했다. 부품 등을 달러화로 결제·수입하는 완성차 업체 입장에선 러시아 현지에서 루블화로 차를 팔면 팔수록 수익성이 악화한다는 의미다.현대차 입장에서는 그렇다고 발을 빼지도 못하는 딜레마에 빠져 있다. 이항구한국자동차연구원 연구위원은 “글로벌 자동차 제조사가 러시아에서 철수하는 상황에서 현대차만 남는다면 환차손은 물론 국제 신인도에 문제가 생길 수 있다”며 “그렇다고 러시아 시장을 떠나면 러시아와 우호적 관계를 유지하고 있는 중국 차가 현대차를 대체할 수 있다”고 말했다.생산‧판매 위축은 자동차부품 업계로 도미노처럼 번지고 있다. 현대차 조립 공장이 문을 닫으면서 이곳에 부품을 공급하는 현대모비스 러시아 모듈·부품 공장 등 현지 협력사도 생산 시설 가동을 멈춘 상태다.러시아 정부가 한국 등 48개국을 ‘비우호국가’로 지정하면서 부품사도 비상이 걸렸다. 비우호국가로 지정되면 러시아 기업이 외화 채무를 루블화로 상환할 수 있다. 지금까지 러시아에 수출하고 달러화로 결제받던 부품사가 앞으로는 거래대금을 루블화로 받게 될 수 있다는 의미다.러시아 자동차 시장 순위. 그래픽 김현서 기자지난해부터 러시아에서 엔진 공장을 가동 중인 현대위아 측은 “루블화 가치가 가파르게 하락하는 중이어서 다각도로 대처 방법을 찾는 중”이라며 “비우호국가 지정과 관련한 추가적인 제재 여부에 대해 주목하며 예의주시하고 있다”고 말했다.반도체 수급난은 더욱 심화할 전망이다. 반도체 생산에 필요한 자원 공급에 차질이 생길 여지가 남아있기 때문이다. 러시아 정부는 지난 10일(현지시간) 200여 개의 러시아산 상품 수출을 제한하는 조치를 발표했다. 당장 한국 자동차부품사에 직접적인 영향을 주는 상품은 포함되지 않았지만, 제한조치 품목이 확대될 경우 문제가 될 수 있다.러시아 최대 자동차 제조사인 르노닛산의라다도 지난 9일부터 차량 생산을 멈췄다. 당시 라다를 생산하는 자동차 제조사 아브토파즈는 “글로벌 반도체 부족 현상이 공장 가동 중단의 원인”이라고 밝혔다.러시아 상트페테르부르크에 위치한 현대차 생산공장에서 차량이 출고되고 있다. [사진 현대차]조의윤 한국무역협회 국제무역통상연구원 수석연구원은 “차량용 반도체·센서 제작에 필요한 귀금속인 팔라듐과 같은 품목의 반출을 러시아가 제한할 경우 한국 기업도 영향을 받을 수밖에 없다”고 설명했다.현대차가 미래차 산업 관점에서 우크라이나 침공 사태 ‘이후’를 대비해야 한다는 견해도 있다. 이항구 연구위원은 “러시아산이 15.1%를 차지하는 백금은 수소차 산업에, 5.3%를 차지하는 니켈은 전기차 산업에 영향을 준다”며 “이번 사태를 계기로 미래차 시장 점유율을 높일 수 있다. 한국은 정부 주도의 적극적인 자원 외교와 공급망‧시장 확보가 필요하다”고 말했다."
2022-01-16,"현대차, 설 앞두고 협력사 납품대금 1조4402억 조기지급","서울 양재동 현대차그룹 본사. 사진=현대차현대자동차그룹이 설을 앞두고 협력사의 자금 부담 완화를 위해 납품 대금 1조4402억원을 조기 지급한다고 16일 밝혔다.현대차그룹은 해당 대금을 당초 지급일보다 앞당겨 설 연휴 전에 지급한다. 이번 납품대금 조기 지급은 현대자동차·기아·현대모비스·현대건설·현대제철 ·현대위아 등에 부품과 원자재, 소모품을 납품하는 3000여개 협력사를 대상으로 진행된다. 협력사들은 현대자동차그룹으로부터 예정된 지급일보다 최대 26일 빨리 대금을 받을 수 있게 됐다.현대차그룹은 명절을 앞두고 협력사들의 자금 소요가 일시적으로 집중되는 부담을 해소하는 데 이번 납품 대금 조기 지급이 도움이 될 것으로 보고 있다. 또 1차 협력사들도 설 이전에 2·3차 협력사들에 납품 대금을 앞당겨 지급할 수 있도록 유도할 방침이다.현대차그룹은 협력사들의 자금난 해소를 위해 매년 명절 전 납품 대금을 선지급했고, 지난해 설과 추석에도 각각 1조8767억원, 1조2354억원을 조기 집행한 바 있다.현대차그룹 관계자는 ""자금 수요가 많은 설 명절을 맞아 협력사들의 납품 대금을 앞당겨 지급하기로 했다""며 ""신종 코로나바이러스 감염증(코로나19)으로 힘든 상황에서 협력사 임직원들이 따뜻한 명절을 보낼 수 있도록 노력할 것""이라고 말했다.또한, 현대자동차그룹은 전통시장 활성화 등 내수 진작을 위해 온누리상품권 74억원 어치를 구매해 그룹사 임직원에게 지급하는 한편, 1만5000개 우리 농산물을 구매할 수 있는 '임직원 온라인 쇼핑몰'도 이번 설에 운영한다."
2024-07-22,"고용승계 노동자에 임금 차별한 현대 위아…법원, 28억 배상 판결","<한겨레> 자료 사진회사 흡수 합병에 따라 고용 승계된 노동자의 근무 경력을 인정하지 않고 수당 등을 책정한 업체에 대해 법원이 ‘차별적 처우’라며 노동자의 손을 들어줬다.수원지법 민사17부(재판장 맹준영)는 지난 17일 현대자동차 계열사 현대위아 소속 노동자 ㄱ씨 등 87명이 회사를 상대로 제기한 손해배상청구 소송에서 원고 승소 판결했다. ㄱ씨 등은 2014년 현대위아가 자동차부품 제조기업 2곳을 흡수합병하면서 고용이 승계된 소속 노동자들이다. 이들은 “합병 이전부터 현대위아 소속 노동자와 같은 공장에서 동일한 노동을 했는데도, 회사 쪽이 근무 경력을 반영하지 않은 호봉을 책정하고, 생산장려수당 등을 지급하지 않았다”며 소송을 제기했다.재판부는 “원고와 피고인 회사의 소속 노동자는 본질에서 동일한 업무를 수행하고 있고, 이들 노동자 사이에 (입사) 경로의 차이는 현재 업무 수행과 객관적 관련성이 없다”면서 “피고는 원고들이 이전 회사에서 근무한 경력도 고려하지 않았다. 원고들에 대해서만 회사의 단체협약 등에서 정한 임금 산정 원칙을 배제할 만한 사정이 보이지 않는다”고 밝혔다. 이어 “피고는 합병에 따라 근로관계가 포괄적으로 승계된 노동자라는 점을 차별적 처우의 사유로 삼고 있는데, 그런 이유만으로 원고들에 대해 가장 중요한 근로조건 중 하나인 임금을 차별적으로 적용하는 것이 정당화된다고 보기 어렵다”고 덧붙였다. 법원이 책정한 손해배상액은 호봉에 따라 다시 계산한 미지급 임금과 생산장려수당 등 28억원가량이다."
2024-02-01,"현대위아, 서천시장 화재 피해 복구 성금 5천만원 전달",현대위아 제공현대위아가 충청남도 서천특화시장 화재 피해 복구를 위해 성금 5천만원을 전달했다고 밝혔다.현대위아는 1일 “설 명절을 앞두고 화재로 큰 피해를 입은 상인들을 돕기 위해 성금을 전달했다”고 밝혔다. 성금 5천만원은 임직원과 회사가 절반씩 부담했다. 임직원의 급여 1%를 모아 주변 이웃을 돕는 사내 사회공헌 프로그램 ‘1% 기적’을 통해 모은 2500만원과 회사 기금 2500만원을 더했다. 성금은 점포별 피해규모에 비례해 희망브리지 전국재해구호협회를 통해 지원될 예정이다.현대위아는 서천군으로부터 80여㎞ 떨어진 충남 서산시에 사업장을 두고 있다. 서천시장에선 지난달 22일 밤 11시8분께 큰 불이 나면서 점포 227개가 전소했다.
