date,title,content
2023-06-29,‘2023 국가서비스대상’ 영광의 부문별 수상자는? – 생활 일반①,"산업정책연구원(IPS)은 ‘2023 국가서비스대상(6thNationalServiceAwards)’을 통해 46개 기업/기관 55개 서비스를 선정했다.국가서비스대상은 매년 한 해 동안 부문별로 소비자들에게 가장 많이 선택받은 서비스를 평가해 소비자들에게 올바른 가이드를 제공하는 한편, 국내 경제 발전과 서비스 산업 경쟁력 향상에 기여하기 위해 마련된 시상제도로, 올해로 6회째를 맞이했다.이번에도 금융과 통신, 의료를 비롯해, 생활일반, 가전, 공공, 레저관광, 유통, 교육 등 총 9개 분야에 걸쳐 55개 우수 서비스가 수상의 영예를 안았다. 아래는 생활 일반부문 수상브랜드.━차별화된 가치와 격이 다른 주거문화 제공프리미엄 아파트 롯데건설㈜, 롯데캐슬 ★★★★★★롯데건설㈜의 롯데캐슬이 ‘2023 국가서비스대상’ 프리미엄 아파트 부문 대상에 선정됐다. 6년 연속이다.롯데캐슬은 ‘Prestigeoflife’라는 브랜드 아이덴티티 아래 차별화된 가치와 격이 다른 주거문화를 제공해왔다. 여러 조사에서 ‘품격있는’ ‘고급·세련된’ 이미지 항목에서 독보적으로 높은 점수를 얻고 있다. 최근에는 고객 소통에 힘쓰고 있다. 2021년 오픈한 롯데캐슬 공식 유튜브 채널 ‘오케롯캐’가 그 중심에 있다. 공모를 통해 채널명을 선정하는 등 ‘고객과 함께 성장하는 채널’이라는 콘셉트로 운영하며 6개월 만에 구독자 10만 명 돌파했다. 6월 현재 구독자 23만5000명, 누적 조회 수 약 1670만 회 등 급성장 중이다.디자인도 강점이다. 디자인 아이덴티티 ‘ModernLegacy’를 기반으로 ‘Classic’을 현대적으로 재해석함으로써 기품은 유지하되 보다 간결하며 실용적인 감각을 담고 있다. 2018년 새롭게 개발된 외관 디자인이 적용된 단지가 2022년 7월 ‘춘천 롯데캐슬 위너클래스’를 필두로 선보이며 큰 호응을 얻고 있다.━2년간 웹사이트 누적 방문객 1000만 돌파렌터카SK렌터카㈜,SK렌터카 ★★★★SK렌터카㈜가 ‘2023 국가서비스대상’ 렌터카 부문 대상에 선정됐다. 4년 연속이다.SK렌터카는 장기렌터카 온라인 다이렉트 서비스 ‘SK렌터카 다이렉트’를 중심으로 신차부터 중고차까지 다양한 선택지를 제공하고 있다.SK렌터카 다이렉트는 별도의 앱 설치 없이 3분이면 빠르고 간편하게 계약까지 가능하고, 견적을 내는 데는 1분이 채 걸리지 않는다. 지난 2021년 5월 출시 이후 현재까지 2년간 웹사이트 누적 방문객 1000만 명을 넘어섰다.SK렌터카는 최소 2년부터 최대 5년간 대여하는 ‘신차 장기렌터카’는 물론 중고차를 합리적인 가격으로 이용 가능한 ‘중고차 장기렌터카’ 서비스를 운영한다. 특히 업계 최초로 주행한 만큼 합리적으로 이용료를 지불하는 ‘SK렌터카 타고페이’와 중고차 대여 후 원하는 시점에 즉시 인수할 수 있는 ‘SK렌터카 타고바이’가 인기다. 차량에 대한 궁금증이나 불편사항을 해결해주는 전담 ‘카매니저’와 업체 최초로 차량 ‘인수센터’도 운영하고 있다.━김포공항·종합병원 등 방제관리 용역 수주해충방제/살균소독 서비스 ㈜삼양인터내셔날, 휴엔케어(HUENCARE) ★★★㈜삼양인터내셔날의 휴엔케어(HUENCARE)가 ‘2023 국가서비스대상’ 해충방제/살균소독 서비스 부문 대상에 선정됐다. 3년 연속이다.삼양인터내셔날이 환경사업 브랜드로 선보인 ‘휴엔케어’는 2014년부터 해충방제, 살균소독 서비스를 국내에 제공하고 있다.2014년 사업 론칭 이후 주요 국가시설 및 대형 공공시설을 포함해 국내 유수의 종합병원, 대형호텔, 식품 및 제약 제조시설, 다중이용시설, 기업이나 상업시설 등에 해충방제, 살균소독 서비스를 제공해왔다. 특히 2018년 평창동계올림픽 및 패럴림픽 대회 기간에 대회 전체의 소독방역 및 해충방제서비스를 제공했으며, 2019년 1월부터 김포국제공항, 2019년 6월부터 인천국제공항, 2020년 1월부터 김해국제공항을 대상으로 방제관리 용역을 수주했다. 2020년 1월 말 국내에 코로나19 확진자가 발생한 당시부터 사회 여러 분야에서 방역 활동에 앞장섰다.━장례를 넘어 고객 생애 전반 다양한 서비스상조 서비스 ㈜프리드라이프, 프리드라이프 ★★★★★㈜프리드라이프가 ‘2023 국가서비스대상’ 상조 서비스 부문 대상에 선정됐다. 5년 연속이다.프리드라이프는 장례를 넘어 고객의 전 생애에 걸쳐 다양한 서비스를 제공하는 토털 라이프케어 기업이다. 올해 4월에 선수금 2조원을 돌파했다.프리드라이프는 150여 개 지점 규모의 오프라인 영업채널을 기반으로 현대리바트·롯데하이마트 등 다양한 제휴채널과 결합상품을 제공한다. 특히 크루즈 여행, 웨딩, 수연, 홈 인테리어, 시니어 케어 등 생애주기별로 전환상품을 제공한다. 지난해에는MZ세대 가입자가 전년 대비 50% 이상 늘었다.최근에는 데이터 분석을 통한 고객경험 강화를 위해  ‘고객데이터 플랫폼(CDP)’을 도입했다. 또 24시간 모바일 장례 접수 서비스와QR코드를 활용한 디지털 추모관,AI추모 서비스를 선보이는 등 디지털 전환을 진행 중이다.프리드라이프는 홋카이도·사할린 강제노동자 유골 귀환사업 지원, 현충원 묘역정화 활동 등 다양한 사회공헌활동을 전개하고 있다.━대한민국 최초 학교 및 직장 인증 소개팅 앱소셜 네트워크 서비스 ㈜에이치소사이어티, 스카이피플㈜에이치소사이어티의 스카이피플이 ‘2023 국가서비스대상’ 소셜 네트워크 서비스 부문 대상에 선정됐다.에이치소사이어티가 개발한 스카이피플은 현재 유저 수 50만 명 이상의 대한민국 최초 학교 및 직장 인증 소개팅 앱이자 직장인들의 익명 커뮤니티 앱이다. 학교 및 직장 인증 소개팅 앱 중 국내 최다 이용자를 보유하고 있다. 2015년 출시 이후 9년간 50만 건의 인증을 통해 독보적인 검증시스템을 갖췄다. 제출한 모든 서류는 서버에서 완전히 삭제되며 개인정보 암호화, 관리자 접근통제 시스템 등 유저 개인정보를 최우선으로 한다. 허위 인증 등을 방지하기 위해 24시간 365일 전담 모니터링팀이 승인 과정을 전수 조사하고 검토한다. 특히 이용자들이 본인 인증을 하는 과정에서 같은 직장에 다니는 유저를 마주치지 않도록 같은 직장의 유저는 매칭에서 피할 수 있는 기능도 제공하고 있다.."
2023-05-09,대기업 새 사외이사에 관료출신 최다…검찰>국세청>판사>공정위,"국내 30대 그룹들이 공무원 출신 사외이사를 대거 신규 선임한 것으로 나타났다. 교수 등 학계 출신의 비중이 높았던 과거와 달리, 윤석열 정부 출범 이후 검찰을 포함한 관료 출신 비중이 높아졌다는 분석이다.국내 30대 그룹 사외이사 경력 분석. 리더스인덱스 자료 캡처9일 기업분석연구소 리더스인덱스는 국내 30대 그룹 중 사업보고서를 제출하는 219개 기업의 올해 정기 주주총회에서 신규 사외이사가 된 147명의 출신 이력을 조사한 결과를 발표했다.이에 따르면 30대 그룹의 신규 선임 사외이사 중 34.0%(50명)가 관료 출신으로 가장 높은 비중을 차지했다. 지난해 30.5%에 비해 3.5%포인트 증가했다.반면 지난해 31.7%로 가장 높은 비중을 차지했던 학계 출신은 올해 25.9%(38명)로 5.8%포인트 줄었다.신규 선임된 관료 출신 사외이사 중 검찰 출신이 12명으로 가장 많았다. 관료 출신 사외이사 4명 중 1명은 검찰 출신(24%)이었다.문무일 전 검찰총장은 삼성SDS사외이사에, 윤 대통령이 검찰총장으로 재직하던 당시 대검 차장검사를 지낸 구본선 변호사는 한화시스템과 한진의 사외이사로 각각 선임됐다. 구 변호사는 윤 대통령의 사법연수원 동기다.차경환 전 수원지검장은 롯데케이칼과 현대건설기계, 권순범 전 대구고검장은 고려아연, 이동렬 전 서울서부지검장은 현대위아의 사외이사로 선임 됐다. 이상호 전 대전지검장과 이건리 전 창원지검장은 각각 신세계그룹 계열사인 이마트와 광주신세계에 사외외사로 이름 올렸다.검찰 다음으로 사외이사 출신 비중이 많은 기관은 국세청(14.9%)이었다. 신규 사외이사로 전직 국세청 고위직을 선임한 기업 7곳 중 3곳은 현대백화점 그룹 계열사다. 현대그린푸드(임경구 전 국세청 조사국장), 현대리바트(유재철 전 중부지방국세청장), 현대이지웰(정현철 전 잠실세무서장) 등이다. 법원(판사) 출신 신규 사외이사는 12.8%, 공정거래위원회 출신은 8.5%로 조사됐다.그룹별로 보면 영풍그룹이 신규 사외이사 3명이 모두 관료 출신이다. 신세계그룹(신규 사외이사 10명 중 8명)과 현대백화점그룹(8명 중 6명)도 관료 출신의 비율이 높았다.신규로 선임된 사외이사 중 여성은 27명으로 전체의 18.4%를 차지했다. 여성 사외이사들의 경력은 학계 출신(63명), 관료(17.0%), 재계(16.3%), 법조(10.6%) 순으로 집계됐다."
2023-03-30,"“경기 위축된 지금이 투자 적기”…김진태 한샘 대표, 신개념 쇼룸 공개","김진대 한샘 대표는 “모든 경쟁자가 위축됐을 때가 과감한 투자를 통해 새로운 경쟁력 갖출 수 있는 절호의 기회”라며 “향후 부동산 경기가 회복되면 한샘이 가장 큰 혜택 볼 수 있을 것”이라고 말했다.김 대표는 30일 오전 서울 송파구 문정역 인근 ‘르피에드 오피스텔’에 새롭게 문을 연 ‘한샘디자인파크 송파점’ 오픈 행사를 찾아 이같이 밝혔다. 이어 “지난해 부진한 실적을 보였지만 신제품 개발이나 오프라인 매장 혁신, 디지털 전환, 고객 커뮤니케이션에 대한 투자는 더 강화할 것”이라며 “지난 1월보다 2월이, 2월보다 3월 실적이 좋고, 2분기도 그리 나쁘지 않을 것으로 전망한다”고 밝혔다.30일 오전 한샘디자인파크 송파점 오픈하우스에서 김진태 대표가 발언하고 있다. 사진 한샘━미로 같은 전시 공간, 체류 시간 늘려라이날 한샘이 공개한 디자인파크 송파점의 가장 큰 차별점은 공간 구성이다. 기존 가구 매장이 침실·거실 등 기능별로 구분해두고 많은 상품을 전시하는 데 중점을 뒀다면, 송파점은 테마 중심으로 공간을 미로처럼 구성해 마치 전시를 둘러보듯 탐색할 수 있도록 했다. ‘빛의 판타지’ ‘패턴의 블루스’ 등 테마는 총 6가지로, 각 테마를 적용한 침대·소파 등 상품을 복합적으로 전시했다.한샘은 30일 신개념 매장인 디자인파크 송파점을 공개했다. 갤러리처럼 공간을 탐색할 수 있도록 만든 것이 특징이다. 사진 한샘공간 사이사이 다양한 상품을 일목요연하게 정리해 둔 ‘아카이브존’도 뒀다. ‘패브릭 아카이브’에서는 전동 블라인드와 커튼 등의 소재를 직접 비교해보고 만져보며 공간을 구성해 볼 수 있고, ‘수납 아카이브’에서는 붙박이장·빌트인장을 소재별로 체험해 볼 수 있다.김윤희 한샘 홈퍼니싱사업본부장은 “과거 가구 매장이 판매하기 편한 방식으로 침대는 침대끼리, 소파는 소파끼리 모아둔 뒤 빠르게 보고 나가도록 설계했다면, 새로운 송파점은 큐레이션된 공간을 구석구석 돌아보며 자신의 취향을 발견할 수 있도록 차별화했다”고 설명했다.기능별로 가구와 인테리어 제품을 구분해두지 않고, 테마별로 복합 구성했다. 사진 한샘━입구엔 카페, ‘옴니 채널’ 적용디자인파크 송파점 입구에 들어서면 안내 데스크와 영업사원 대신 ‘카페 진정성’이 고객을 맞는다. 구매에 목적을 두지 않고도, 편안한 방문을 원하는 고객을 위한 ‘커뮤니티존’이다. 이 카페는 6개월간 운영 뒤 또 다른 형식으로 바뀔 예정이다.가구 구매 목적이 아니어도 공간읗 쉽게 방문할 수 있도록 커뮤니티존 역할을 하는 카페가 들어섰다. 유지연 기자온·오프라인의 쇼핑 경험을 연결하는 ‘옴니 채널(Omni-channel)’ 기술도 곳곳에 적용됐다. 소비자가 온라인·오프라인·모바일 등 다양한 채널을 넘나들며 상품을 검색하고 구매할 수 있도록 한 서비스다. 우선, 상품마다QR코드가 부착돼 있어 스마트폰 카메라로 찍으면 한샘몰 내의 상품과 연동할 수 있다. 한샘은 지난달 기존 한샘몰과 한샘닷컴을 통합한 디지털 플랫폼 ‘한샘몰’을 론칭했다.QR코드를 통해 전시된 상품 외의 다른 옵션(색·소재)도 쉽게 검색할 수 있다. 제품마다QR코드가 적용된 카드가 준비돼 있어, 마음에 드는 상품의QR카드만 가지고 집으로 돌아가 증강현실(AR)로 실제 집 곳곳에 배치해 본 뒤 한샘몰을 통해 주문할 수 있는 등 온·오프 연계를 극대화했다.QR코드가 적힌 카드가 제품마다 놓여있어, 전시 옵션 외의 다른 상품을 검색할 수 있고, 집에 가져가VR로 상품을 구현, 온라인몰 구매로 연결시키기도 한다. 유지연 기자━“다른 지역에도 신개념 매장 적용”최근 부동산 경기 침체와 엔데믹이 맞물리면서 인테리어·가구 업계는 실적이 크게 미끄러졌다. 코로나19 기간 집에서 머무는 시간이 늘어나면서 호황을 맞았던 것과는 반대 상황이다. 한샘은 지난해 영업적자 217억원으로 지난 2002년 상장 이래 첫 적자를 냈다.이처럼 인테리어 업계 전반 위기감 속에서 한샘의 신개념 오프라인 매장이 돌파구가 될 수 있을지 주목된다. 한샘은 앞으로 송파점과 같은 신개념 매장 확장을 계획하고 있다. 김진태 대표는 “지난달 출범한 한샘몰이 버전 1.0이고, 송파 디자인파크가 버전 2.0이라면, 앞으로 목동 등 다른 지역에서 버전 3.0을 시도할 것”이라며 “송파점도 이대로 머무르는 게 아니라 버전 2.1, 2.2로 계속 진화할 것”이라고 강조했다.현대리바트는 지난 3월 중고가구 거래 플랫폼 '오구가구'를 오픈했다. 사진 현대리바트한편 가구 업계는 불황 극복을 위해 안간힘을 쓰고 있다. 현대리바트는 중고가구 거래 플랫폼 ‘오구가구’를 론칭하고, 하이엔드 주방가구 사업 확대에 나서고 있다. 신세계까사는 압구정점과 서래마을점 두 곳을 특화 쇼핑 공간으로 재단장하는 등 오프라인 매장 정비에 나섰다."
2023-02-02,"검찰, 가구업체 10여곳 압수수색…1조원대 입찰담합 혐의","검찰이 신축 아파트의 빌트인(내장) 가구를 납품한 국내 가구업체들에 대해 수사에 들어갔다. 이들 업체의 행태가 아파트 분양가를 높였다는 게 검찰의 판단이다. 서울중앙지검 공정거래조사부(부장 이정섭)는 1일 한샘·현대리바트·에넥스·넥시스·우아미 등 가구업체 10여곳을 압수수색했다. 검찰은 이들 업체가 신축 아파트에 붙박이 형태로 들어가는 ‘특판가구’ 납품사를 정하는 과정에서 담합한 혐의(공정거래법·건설산업기본법 위반)가 있다고 보고 있다. 검찰은 이들이 담합으로 가격을 부풀려 납품한 아파트 공사현장이 500곳, 총 납품액 규모는 1조원에 달하는 것으로 추산하고 있다.검찰은 이번 사건을 단순히 가구업체 담합 사건이 아니라 민생침해 범죄로 보고 있다. 이들 업체의 담합으로 아파트 시공 비용이 오르고, 결과적으로 소비자들이 부담하는 아파트 분양가가 높아졌기 때문이다. 검찰 관계자는 “일반 시민들이 피해자”라고 설명했다.검찰의 이번 수사를 두고 공정거래위원회도 촉각을 곤두세우고 있다. 통상 공정거래법 위반 사건은 공정위가 먼저 조사한 후 검찰에 고발하면 검찰이 수사에 들어간다. 그러나 이번 사건은 공정위 고발 없이 검찰이 직접 인지해 수사에 들어갔다. 법조계 관계자는 “검찰이 인지한 시점과 공정위가 조사에 들어간 시점이 거의 비슷했는데 검찰이 더 빨리 움직였다”고 했다.검찰이 공정위 고발 사건에 대한 수사 강도를 높이는 점도 주목된다. 검찰은 최근 공정위가 ▶7대 제강사의 철강담합 ▶한국타이어 부당지원 등을 고발한 후 재(再)조사에 가깝게 수사 강도를 높여 처리하고 있다. 공정위 고발 내용을 법리에 맞게 다듬어 기소하는 수준의 기존 처리 방식과 다른 양상이다. 7대 제강사 철강 담합 사건의 경우 검찰은 담합에 가담한 철강사 임원들에 대해서도 공정위에 고발을 요청해, 애초 공정위 고발보다 처벌 범위를 확대했다. 한국타이어 부당지원 사건 역시 별도의 첩보 수집 등을 통해 조현범 한국타이어 회장의 배임 혐의 등으로 수사 범위를 넓히고 있다.검찰은 이번 가구업체 담합사건에 대해서도 공정위 조사와 별도 수사를 한 뒤 공정위에 고발요청을 할 예정이다. 공정거래법 위반 범죄는 공정위가 전속고발권을 갖고 있어 공정위 고발이 있어야만 검찰이 기소할 수 있다."
2023-02-01,"""아파트 분양가 올린 주범"" 공정위보다 검찰 먼저 나선 이유","검찰이 신축 아파트의 빌트인(내장) 가구를 납품한 국내 가구업체들에 대해 수사에 들어갔다. 이들 업체의 행태가 아파트 분양가를 높였다는 게 검찰의 판단이다.서울중앙지검 공정거래조사부(부장 이정섭)는 1일 한샘·현대리바트·에넥스·넥시스·우아미 등 가구업체 10여곳을 압수수색했다. 검찰은 이들 업체가 신축 아파트에 붙박이 형태로 들어가는 ‘특판가구’ 납품사를 정하는 과정에서 담합한 혐의(공정거래법·건설산업기본법 위반)가 있다고 보고 있다. 검찰은 이들이 담합으로 가격을 부풀려 납품한 아파트 공사현장이 500곳, 총 납품액 규모는 1조원에 달하는 것으로 추산하고 있다.서울 남산에서 바라본 용산과 여의도 일대 아파트 단지 모습. 연합뉴스검찰은 이번 사건을 단순히 가구업체 담합 사건이 아니라 민생침해 범죄로 보고 있다. 이들 업체의 담합으로 아파트 시공 비용이 오르고, 결과적으로 소비자들이 부담하는 아파트 분양가가 높아졌기 때문이다. 검찰 관계자는 “아파트를 분양 받은 일반 시민들이 피해자”라고 설명했다.검찰의 이번 수사를 두고 공정거래위원회도 촉각을 곤두세우고 있다. 통상 공정거래법 위반 사건은 공정위가 먼저 조사한 후 검찰에 고발하면 검찰이 비로소 수사에 들어간다. 그러나 이번 가구업체 담합 건은 공정위 고발 없이 검찰이 직접 인지해 수사에 들어갔다. 법조계 관계자는 “검찰이 인지한 시점과 공정위가 조사에 들어간 시점이 거의 비슷했는데 검찰이 더 빨리 움직였다”고 했다.서울 마포구 상암동 한샘 사옥. 사진 한샘검찰이 공정위 고발 사건에 대한 수사 강도를 높이는 점도 주목된다. 검찰은 최근 공정위가 ▶7대 제강사의 철강담합 ▶한국타이어 부당지원 등을 고발한 후 재(再)조사에 가깝게 수사 강도를 높여 처리하고 있다. 공정위 고발 내용을 법리에 맞게 다듬어 기소하는 수준의 기존 처리 방식과 다른 양상이다.7대 제강사 철강 담합 사건의 경우 검찰은 담합에 가담한 철강사 임원들에 대해서도 공정위에 고발을 요청해, 애초 공정위 고발보다 처벌 범위를 확대했다. 한국타이어 부당지원 사건 역시 별도의 첩보 수집 등을 통해 조현범 한국타이어 회장의 배임 혐의 등으로 수사 범위를 넓히고 있다.검찰은 이번 가구업체 담합사건에 대해서도 공정위 조사와 별도 수사를 한 뒤 공정위에 고발요청을 할 예정이다. 공정거래법 위반 범죄는 공정위가 전속고발권을 갖고 있어 공정위 고발이 있어야만 검찰이 기소할 수 있다."
2023-01-09,시몬스에 발끈한 에이스 공개저격…'형제 기업' 집안싸움 왜,"안성호(왼쪽) 에이스침대 대표와 안정호 시몬스 대표. 두 대표는 형제 사이다.침대 업계 1·2위이자 ‘형제 기업’으로 유명한 에이스침대와 시몬스가 가격 인상을 두고 정면으로 맞붙었다. 시몬스가 올해 가격 동결을 선언하면서, 다른 가구 업체들의 지난해 가격 인상 내용을 줄줄이 언급한 게 발단이다. 에이스침대는 최근 5년간 시몬스가 오히려 더 자주 가격을 올렸다고 반격했다.에이스침대는 9일 보도자료를 통해 “당사는 2017년 12월부터 지난해 12월까지 단 두 차례 가격을 인상했다”며 “최근 2년째 가격을 동결한다고 홍보하는 시몬스의 경우 2017년 말부터 여섯 차례, 특히 2021년에는 세 차례나 가격을 인상했다”고 밝혔다.또 에이스침대는 같은 기간 인기 매트리스 가격을 30~33% 인상했지만 시몬스는 65~87% 올렸다고 덧붙였다. 그러면서 “지난해 백화점 매장 매출이 1700억원을 돌파하며 불황에도 불구하고 업계 2위와의 격차를 벌렸다”고 강조했다.에이스침대 신세계백화점 경기점 ‘더스테이지’ 팝업스토어. 사진 에이스침대이는 시몬스가 지난 2일 발표한 ‘가격 동결’ 조치를 맞받아친 것이다. 당시 시몬스는 “에이스침대·템퍼·씰리침대·코웨이·한샘·현대리바트 등 침대·가구·렌탈 업계가 일제히 가격을 올리는 가운데 시몬스는 지난해에 이어 올해도 가격 인상 계획이 없다”고 밝혔다. 특히 업계 1위이자 경쟁사인 에이스침대를 겨냥해 ‘지난해 최대 20% 가격을 올렸다’고 언급했다.업계에선 경쟁 업체의 가격 인상을 직접 언급한 것은 이례적이라는 지적이 나온다. 상대방을 ‘공개 저격’하며 날을 세우고 있는 두 회사는 사실 형제가 오너경영인으로 있는 기업이다. 에이스침대는 창업주인 안유수 회장의 장남인 안성호 대표가, 시몬스는 차남인 안정호 대표가 이끌고 있다.시몬스 침대 광고. 사진 시몬스━지난해 라면 업계도 공개 저격 논란앞서 지난해 9월 라면 업계에서도 경쟁사 저격 논란이 일었다. 오뚜기가 라면 가격 인상을 밝히며 농심·팔도 등 경쟁 업체를 언급한 것이다.당시 오뚜기는 “이번 가격 조정에도 오뚜기 라면 가격은 주요 경쟁사보다 낮은 편”이라며 “2008년 이후 라면 4사의 가격 인상은 오뚜기가 2회로 가장 적었고 농심과 팔도가 각 4회, 삼양식품이 3회 인상했다”고 상세히 밝혔다. 업계 관계자는 “당시 ‘경쟁사의 가격 정책은 언급하지 않는다’는 불문율이 깨지면서 업계가 술렁였다”며 “오뚜기가 식품 가격 도미노 인상에 따른 소비자 불만을 의식한 것이라는 해석이 나오기도 했다”고 말했다."
