date,title,content
2023-02-01,"""아파트 분양가 올린 주범"" 공정위보다 검찰 먼저 나선 이유","검찰이 신축 아파트의 빌트인(내장) 가구를 납품한 국내 가구업체들에 대해 수사에 들어갔다. 이들 업체의 행태가 아파트 분양가를 높였다는 게 검찰의 판단이다.서울중앙지검 공정거래조사부(부장 이정섭)는 1일 한샘·현대리바트·에넥스·넥시스·우아미 등 가구업체 10여곳을 압수수색했다. 검찰은 이들 업체가 신축 아파트에 붙박이 형태로 들어가는 ‘특판가구’ 납품사를 정하는 과정에서 담합한 혐의(공정거래법·건설산업기본법 위반)가 있다고 보고 있다. 검찰은 이들이 담합으로 가격을 부풀려 납품한 아파트 공사현장이 500곳, 총 납품액 규모는 1조원에 달하는 것으로 추산하고 있다.서울 남산에서 바라본 용산과 여의도 일대 아파트 단지 모습. 연합뉴스검찰은 이번 사건을 단순히 가구업체 담합 사건이 아니라 민생침해 범죄로 보고 있다. 이들 업체의 담합으로 아파트 시공 비용이 오르고, 결과적으로 소비자들이 부담하는 아파트 분양가가 높아졌기 때문이다. 검찰 관계자는 “아파트를 분양 받은 일반 시민들이 피해자”라고 설명했다.검찰의 이번 수사를 두고 공정거래위원회도 촉각을 곤두세우고 있다. 통상 공정거래법 위반 사건은 공정위가 먼저 조사한 후 검찰에 고발하면 검찰이 비로소 수사에 들어간다. 그러나 이번 가구업체 담합 건은 공정위 고발 없이 검찰이 직접 인지해 수사에 들어갔다. 법조계 관계자는 “검찰이 인지한 시점과 공정위가 조사에 들어간 시점이 거의 비슷했는데 검찰이 더 빨리 움직였다”고 했다.서울 마포구 상암동 한샘 사옥. 사진 한샘검찰이 공정위 고발 사건에 대한 수사 강도를 높이는 점도 주목된다. 검찰은 최근 공정위가 ▶7대 제강사의 철강담합 ▶한국타이어 부당지원 등을 고발한 후 재(再)조사에 가깝게 수사 강도를 높여 처리하고 있다. 공정위 고발 내용을 법리에 맞게 다듬어 기소하는 수준의 기존 처리 방식과 다른 양상이다.7대 제강사 철강 담합 사건의 경우 검찰은 담합에 가담한 철강사 임원들에 대해서도 공정위에 고발을 요청해, 애초 공정위 고발보다 처벌 범위를 확대했다. 한국타이어 부당지원 사건 역시 별도의 첩보 수집 등을 통해 조현범 한국타이어 회장의 배임 혐의 등으로 수사 범위를 넓히고 있다.검찰은 이번 가구업체 담합사건에 대해서도 공정위 조사와 별도 수사를 한 뒤 공정위에 고발요청을 할 예정이다. 공정거래법 위반 범죄는 공정위가 전속고발권을 갖고 있어 공정위 고발이 있어야만 검찰이 기소할 수 있다."
2022-09-15,“온라인 강화” “오프라인 차별화” 가구 4사 ‘4色 활로’,"김윤희 한샘 R&D본부장이 지난달 31일 크리에이티브 데이 행사에서 매장 리뉴얼 및 전시 혁신 청사진을 소개해하고 있다. 사진 한샘코로나19 사태로 ‘롤러코스터 실적’을 경험한 가구 업계가 활로 찾기에 나섰다. 다만 업체마다 사업 방향과 타깃이 달라 4사4색(色) 전략이다. 한샘과 이케아가 ‘디지털 확대’를 선언했다면, 현대리바트와 신세계까사는 ‘매장 차별화’를 추진 중이다.━이케아 국내 진출 후 첫 마이너스 성장15일 이케아코리아는 2022회계연도(2021년 9월~2022년 8월) 매출 6168억원을 기록했다고 밝혔다. 지난해 6836억원과 비교하면 10% 감소했다. 2014년 1호점인 광명점을 열며 국내에 진출한지 8년 만에 첫 역성장이다. 매장 방문객은 7000만→6682만 명으로 감소했다.14일 진행된 이케아 코리아 기자간담회에서 프레드릭 요한손 이케아 코리아 대표가 지난 회계연도 주요 성과와 2023 회계연도 비즈니스 전략을 설명하고 있다. [사진 이케아]가구 업계 1위인 한샘도 올해 상반기 매출 1조262억원으로 지난해 동기 대비해 8.5% 줄었다. 영업이익은 121억7000만원으로 같은 기간 77% 감소했다. 현대리바트와 신세계까사는 매출은 늘었으나 수익성이 크게 나빠졌다.〈도표 참조〉이 같은 실적 악화는 코로나19 완화세와 부동산 거래 감소에 영향을 받은 것으로 풀이된다. 리오프닝(경제활동 재개)으로 재택근무가 줄면서 집 꾸미기 수요도 덩달아 쪼그라들었다. 부동산 경기 침체에 따른 영향도 컸다. 한국부동산원에 따르면 지난 2분기 전국의 아파트 매매 건수는 10만950건으로 지난해 같은 기간 대비 43.4% 감소했다.우크라이나 전쟁으로 인한 원자잿값 상승과 물류 대란은 수익성에 찬물을 끼얹었다. 프레드릭 요한슨 이케아코리아 대표는 “글로벌 공급망 대란으로 일부 인기 제품은 공급에 차질을 빚었다”고 말했다. 현대리바트 관계자도 “사무용 가구 판매 증가와 이라크·카타르 등 해외 공사 진행 등으로 매출은 늘었지만, 원자재 가격·물류비 인상으로 영업이익은 감소했다”고 말했다.그래픽=박경민 기자minn@joongang.co.kr━한샘은 ‘온·오프 연계’로 승부수업계는 매장을 특화하고, 온라인 사업을 강화하는 전략으로 대응에 나섰다. 전시가 중요한 가구 업계 특성상 오프라인 매장에 힘을 주기 마련인데, 이제는 이와 연계한 온라인몰을 통해서도 고객 접점을 확대하겠다는 얘기다.한샘은 지난달 말 밀레니얼 세대 고객을 겨냥한 전시 혁신 방안을 발표했다. 요컨대 ‘온·오프 결합’이다. 우선 고객 취향에 따라 주제를 나눠 디자인 중심으로 매장을 재설계한다. 또 3차원(3D) 설계 프로그램 등 디지털 기술을 더해 ‘실시간 체험 공간’으로 운영한다. 여기에 내년 론칭 예정인 한샘몰·한샘닷컴 통합 플랫폼과 유기적으로 결합한다는 방침이다.이케아코리아는 ‘옴니채널 전략’을 내놨다. 오프라인 매장뿐만 아니라 이케아 앱, 온라인 몰, 라이브방송 등으로 판매 채널을 늘린다. 이케아 관계자는 “최근 1년 새 온라인 매출은 12% 늘었다”며 “상담부터 결제가 가능한 전화·채팅·온라인 화상 서비스 등 원격 채널도 늘릴 계획”이라고 말했다.현대리바트는 해외 유명 디자이너와 협업해 하이엔드 가구를 선보이는 등 ‘프리미엄’에 집중할 예정이다. 지난 6월에는 이탈리아 하이엔드 가구 브랜드 ‘죠르제띠’ 매장을 개장했다. 리바트 측은 “하반기에는 토털 인테리어 유통망 확대, 해외 프리미엄 가구 라인업 강화 등을 통해 수익성에 나설 것”이라고 했다.현대리바트는 해외 디자이너와 협업, '아트앤디자인 프로젝트2022' 컬렉션을 선보였다. [사진 현대리바트]━신세계까사 “슈퍼마켓과 결합”신세계까사는 매장 차별화 작업에 주력한다. 체류형 복합 문화공간 ‘까사그란데’를 통해 식음료·문화예술·엔터테인먼트 등 이종 업체와 협업을 시도한다. 이달 말 새롭게 리뉴얼 오픈하는 까사미아 압구정점은 ‘슈퍼마켓 콘셉트’를 도입하는 등 기존의 전형적인 가구 매장에서 탈피한다는 구상이다."
2022-09-16,"짧았던 ‘집콕 수혜’…가구업계, 디지털로 활로 찾는다","고품질 3D 렌더링 기술을 적용한 한샘의 인테리어 설계 프로그램 ‘홈플래너’.[사진 한샘]코로나19 사태로 ‘롤러코스터 실적’을 경험한 가구 업계가 활로 찾기에 나섰다. 한샘과 이케아가 ‘디지털 확대’를 선언했고, 현대리바트와 신세계까사는 ‘매장 차별화’를 추진 중이다.15일 이케아코리아는 2022회계연도(2021년 9월~2022년 8월) 매출 6168억원을 기록했다고 밝혔다. 지난해 6836억원과 비교하면 10% 감소했다. 2014년 1호점인 광명점을 열며 국내에 진출한 지 8년 만에 첫 역성장이다. 같은 매장 방문객은 7000만→6682만 명으로 감소했다.가구업계 1위인 한샘도 올해 상반기 매출 1조262억원으로 지난해 동기 대비해 8.5% 줄었다. 영업이익은 121억7000만원으로 같은 기간 77% 감소했다. 현대리바트와 신세계까사는 매출은 늘었으나 수익성이 크게 나빠졌다.이 같은 실적 악화는 코로나19 완화세와 부동산 거래 감소에 영향을 받은 것으로 풀이된다. 리오프닝(경제활동 재개)으로 재택근무가 줄면서 집 꾸미기 수요도 덩달아 쪼그라들었다.업계는 매장을 특화하고, 온라인 사업을 강화하는 전략으로 대응에 나섰다.한샘은 지난달 말 밀레니얼 세대 고객을 겨냥한 전시 혁신 방안을 발표했다. 요컨대 ‘온·오프 결합’이다. 우선 고객 취향에 따라 주제를 나눠 디자인 중심으로 매장을 재설계한다. 또 3차원(3D) 설계 프로그램 등 디지털 기술을 더해 ‘실시간 체험 공간’으로 운영한다. 내년 론칭 예정인 한샘몰·한샘닷컴 통합 플랫폼과도 유기적으로 결합한다는 방침이다.이케아코리아는 ‘옴니채널 전략’을 내놨다. 오프라인 매장뿐만 아니라 이케아 앱, 온라인 몰, 라이브방송 등으로 판매 채널을 늘린다. 이케아 관계자는 “최근 1년 새 온라인 매출은 12% 늘었다”며 “상담부터 결제가 가능한 전화·채팅·온라인 화상 서비스 등 원격 채널도 늘릴 계획”이라고 말했다.현대리바트는 해외 유명 디자이너와 협업해 하이엔드 가구를 선보이는 등 ‘프리미엄’에 집중할 예정이다. 지난 6월에는 이탈리아 하이엔드 가구 브랜드 ‘죠르제띠’ 매장을 개장했다. 리바트 측은 “하반기에는 토털 인테리어 유통망 확대, 해외 프리미엄 가구 라인업 강화 등을 통해 수익성에 나설 것”이라고 했다.신세계까사는 매장 차별화 작업에 주력한다. 체류형 복합 문화공간 ‘까사그란데’를 통해 식음료·문화예술·엔터테인먼트 등 이종 업체와 협업을 시도한다. 이달 말 새롭게 리뉴얼 오픈하는 까사미아 압구정점은 ‘슈퍼마켓 콘셉트’를 도입하는 등 기존의 전형적인 가구 매장에서 탈피한다는 구상이다."
2022-02-23,"""우리집도 예쁘게""…1년새 44% 커졌다 '집테리어' 새 트렌드","“인터넷에서 본 예쁜 집처럼 고치고 싶어요.”요즘 집은 단순한 주거 공간 이상이다. 신종 코로나바이러스 감염증(코로나19)으로 재택근무, 홈스쿨링이 일반화하면서, 때로는 일터가 때로는 학교가 되기도 한다. 또 외출이 제한돼 놀이와 여가의 공간으로도 쓰인다.집에 머무는 시간이 늘고, 집에 요구하는 기능이 많아지면서 집 꾸미기에 관심을 갖는 사람들이 늘고 있다. 코로나19의 영향이 크지만, 전반적 소득 수준이 높아지면서 안락한 환경에 대한 수요가 높아진 이유도 있다. 방송을 통해 공개된 연예인들의 집 인테리어가 화제가 되기도 하고, 다양한 집 꾸미기 사례를 볼 수 있는 ‘오늘의 집’ 등 인테리어 플랫폼도 성업 중이다.━인테리어 공룡들, 토탈 시공 시장 두고 격돌한국건설산업연구원에 따르면 국내 인테리어·리모델링 시장은 올해 60조원에 이를 전망이다. 지난해 41조5000억원보다 44.5%나 증가했다. 토탈 인테리어 시공에 대한 관심도 뜨겁다. 집을 대대적으로 수리하거나 부분 리모델링을 원하는 사람들이 느는 데다 노후 주택 비중도 점차 늘고 있기 때문이다. 통계청이 발표한 ‘2020년 인구주택총조사’에 따르면, 건축된 지 20년이 넘은 주택은 910만1000가구로 전체 주택 수의 절반(49.1%)에 이른다. 향후 인테리어 수요가 적지 않을 전망이다.급성장하는 인테리어 시장 규모 그래픽 이미지. [자료제공=한국건설산업연구원]관련 업계는 급성장하는 인테리어 시장 공략에 나섰다. 22일 현대리바트는 새로운 토탈 인테리어 브랜드 ‘리바트 집테리어’를 선보였다. 주방 가구·욕실·창호·바닥재·벽지 등 리바트 모든 인테리어 제품에 대한 상담부터 공간 컨설팅·구매·시공·A/S까지 원스톱으로 제공하는 브랜드다. 현대리바트 관계자는 “가파르게 증가하고 있는 개인화된 맞춤형 공간에 대한 인테리어 수요를 겨냥해 공간 설계부터 최종 시공까지 한 번에 끝낼 수 있는 토탈 서비스”라고 설명했다.현대리바트가 토탈 시공 브랜드 '리바트 집테리어'를 선보였다. [사진 현대리바트]━생애 주기 맞춰 토털 패키지 제안리바트 집테리어는 취향에 따라 자재부터 시공 범위까지 자유롭게 고를 수 있는 인테리어 패키지 상품을 선보인다. 패키지엔 생애주기와 인테리어 트렌드를 반영했다. 총 4가지 콘셉트로, 미취학 자녀가 있는 3인 가족을 위해 파스텔톤의 색상과 모서리가 둥근 가구 등을 적용한 ‘에어리 소프트’,홈파티를 즐기는 신혼부부를 겨냥해 주방과 다이닝 기능을 강화한 ‘프렌치 글램’,대형 평형에 어울리는 고급스러움을 강조한 ‘리니어 시크’,미니멀한 디자인으로 재택·수납 등 공간 활용을 극대화한 ‘모던 내추럴’ 등이다.소비자가 자재와 가구를 직접 고를 수도 있다. 현대리바트의 주방(22종)·욕실(18종)·창호(4종)·마루(5종)·벽지(3종) 등 총 54종의 인테리어 가구 및 건자재를 직접 골라 집 전체를 바꾸거나 주방·거실·안방 등 일부만 인테리어 할 수도 있다.리바트 집테리어는 패키지 상품 뿐 아니라, 고객이 자재 및 가구를 직접 고를 수 있도록 하는 상품도 내놨다. [사진 현대리바트]2016년 일찌감치 패키지 방식의 토탈 인테리어 시공 시장에 뛰어든 한샘은 토탈 시공 브랜드 ‘리하우스’의 혁신과 고급화에 공을 들이고 있다. 대리점·대형 쇼룸 등 영업망 확대와 3D 상담 설계 등 디지털 혁신 전략으로 업계 선두를 유지하겠다는 방침이다. 특히 리하우스 대리점 채널 확대에 집중, 2019년 1월 86개에서 현재 기준 약 640개의 대리점을 확보했다. 리하우스 대리점의 증가는 리하우스 패키지 상품의 판매로 이어졌다.한샘 스타일 패키지 '리빙 온 네이처' 모델 하우스. [사진 한샘]━대형 쇼룸에서 최신 인테리어 경험 제공업계는 오프라인 매장에서 고객 경험에도 공을 들이고 있다. 한샘은 지난해 총 12개의 리하우스 대형 쇼룸을 확장 이전 및 신규 오픈했다. 쇼룸에 실제 아파트 공간을 쇼룸에 옮겨 놓아 최신 인테리어를 체험해 볼 수 있다. 한샘디자인파크 등 일부 매장에선 가상현실(VR) 기술을 활용한 3D 시뮬레이션 상담 프로그램을 운영하고 있다. 집 안의 모든 공간을 3D로 설계하고, 고품질 랜더링을 통해 시공 후 바뀔 집 모습을 미리 확인할 수 있도록 했다.한샘 홈플래너 2.0프로그램으로 랜더링한 스타일 패키지 사진. [사진 한샘]LX하우시스도 오프라인 매장 확대에 관심을 기울이고 있다. 지난해 롯데·신세계 백화점 등에 대형 쇼룸 ‘LX지인 스퀘어’를 입점시켰고, 일반 매장 ‘LX지인’도 지난해 100곳까지 확대했다. 소비자 접점을 늘릴 수 있는 오프라인 쇼룸을 통해 기존 B2B(기업 대 기업)가 아니라 B2C(기업 대 개인)로, 창호 중심에서 토탈 인테리어로 사업 구조를 다각화한다는 전략이다.LX하우시스도 창호 중심에서 토탈 인테리어로 사업 구조를 다각화하고 있다. [사진LX하우시스]"
2024-02-26,"침대는 과학? 이젠 예술...韓가구, 고급화로 日이케아와 맞짱","지난 22일 서울 홈플러스 영등포점 2층에 일본 가구·인테리어 기업 ‘니토리’ 한국 2호점이 문을 열었다. 전시장에서 관계자들이 전시품과 관련한 이야기를 나누고 있다. 연합뉴스3월 이사철을 앞둔 가구업계의 표정이 심상치 않다. 혼인·출산율이 저조한 데다 부동산 경기 침체가 겹치며 전통적인 성수기인 봄에도 실적 전망이 밝지만은 않아서다. 여기에 ‘일본의 이케아’로 불리는 ‘니토리’까지 국내에 상륙하며 경쟁은 더 치열해지고 있다. 상황이 녹록지 않자 국내 가구업계는 ‘고급화’ 카드를 꺼내 들고 있다.━日 최대 홈퍼니싱 업체, 국내 진출 본격화25일 홈플러스에 따르면 일본 최대 홈퍼니싱업체 니토리가 지난 22일 홈플러스 영등포점에 국내 2호점을 열었다. 지난해 11월 이마트 하월곡점에 1호점을 낸 이후 3개월 만이다. 1967년 일본에서 시작해 중국, 대만, 말레이시아, 미국 등 전 세계 약 900개 매장을 운영 중인 니토리는 침대, 소파 등 가구를 비롯해 침구, 수납용품, 생활용품 등 가정용 가구·인테리어 제품 전반을 판매하고 있다. 상품 기획부터 제조, 물류, 판매까지 전 과정을 통합 관리해 제품군을 늘리고 가격을 낮춘 것이 장점. 조립형 제품과 오프라인 쇼룸을 앞세운 점은 이케아와 닮은꼴이다.2호점 개장 행사에 참석한 타케다 마사노리 니토리홀딩스 회장은 “한국은 니토리의 성장을 위해 전략적으로 중요도가 높은 시장”이라며 “꾸준한 신규 출점과 빠른 점포망 구축으로 고객에게 사랑받을 수 있도록 노력하겠다”고 밝혔다. 니토리는 올해 국내 매장 수를 10개로 늘리는 등 2032년까지 200개 매장을 열 계획이다. 초기에는 입지가 좋은 대형마트 위주로 입점해 가족 단위 소비자를 공략한다는 전략이다.지난 2019년 서울 신촌 유플렉스 앞에서 열린 노노재팬 8.15 시민행진 준비단이 제작한 깃발. 뉴스1지난 2019년 이른바 ‘노노 재팬’으로 증폭됐던 일본산 불매 운동이 최근 수그러든 점은 니토리에 유리한 상황이다. 2020년 매출이 반토막 났던 한국 유니클로(일본 패스트리테일링, 한국 롯데쇼핑 합작 법인)는 2022년 반등에 성공하며 지난해에는 1조 매출(2023년 회계연도 기준 9219억원)을 눈앞에 두고 있다. 일본 양품기획과 롯데상사의 합작 법인인 무인양품도 2023년 회계연도(2022년 9월~2023년 8월) 영업이익 18억원을 기록하며 4년 여 만에 흑자 전환에 성공했다.━이케아 수익성 못 따라가는 국내파지난 1월 경기도 ‘스타필드 수원’ 6층에 문을 연 한샘의 홈퍼니싱 전문 매장. 사진 한샘국내 가구·인테리어 시장을 장악한 이케아에 이어 ‘일본판 이케아’ 니토리까지 상륙하자 토종 가구업체들의 고민은 커지고 있다. 한샘, 현대리바트 등은 홈리모델링 사업을 겸하고 있어 이케아보다 매출 규모가 큰데도 영업이익으로는 이케아를 따라가지 못하고 있다.지난해 이케아코리아는 경기 침체의 여파로 영업이익이 전년 대비 88%나 줄었는데도 가구업계 중에선 가장 많은 이익(2023 회계연도 기준 26억원)을 남겼다. 지난해 한샘은 대대적인 조직개편으로 흑자 전환에 성공(영업이익 19억4000만원)했지만 현대리바트(199억원 손실)와 신세계까사(169억원 손실)는 여전히 적자다.━고급화로 시장 개척 나서정근영 디자이너‘가성비’로 승부하는 해외파의 공습에 국내 가구업계는 ‘고급화’를 차별화 요소로 내세우고 있다. 불황기에는 저가의 가성비 제품과 초고가 제품으로 소비가 양극화된다는 점을 겨냥한 것이다. 신혼부부와 1인 가구 대신 중장년층 인테리어 수요를 노린 전략이다. 한샘은 지난 21일 일산 킨텍스에서 열린 건축 박람회 ‘코리아빌드’에서 신규 프리미엄 붙박이장 브랜드 ‘시그니처’를 공개했다. 나무와 금속, 가죽 질감을 구현한 표면재로 고급스러움을 더한 수납 가구를 개발했다는 설명이다.신세계까사도 지난 2019년 까사미아가 선보였던 프리미엄 가구 컬렉션 ‘라메종’을 리뉴얼했다. 신세계까사 관계자는 “가구를 넘어 예술 작품으로도 손색없는 제품을 선보이기 위해 기존의 ‘프렌치 모던’ 양식을 한층 강화한 라인업으로 재정비했다”고 설명했다. 현대리바트 관계자는 “글로벌 아티스트와 협업하는 등 ‘브랜드 고급화 전략’에 전사적으로 나서고 있다”며 “다양한 시도로 국내 가구 시장의 판도를 바꾸겠다”라고 말했다.실제로 가구·인테리어 시장의 성장세는 둔화하는 가운데, 고가 제품 매출은 증가하고 있다. 유통업계에 따르면 신세계 강남점에서는 지난해 생활 분야 매출이 전년 대비 20% 가량 성장했다. 1억 원짜리 해스텐스 침대, 3500만원짜리 덕시아나 침대 등 고가 제품이 실적 상승을 견인했다. 가구업계 관계자는 “시장 상황은 나빠지는데 경쟁은 더욱 치열해지고 있는 구조”라며 “고급화로 차별화해야 국내 가구 브랜드의 경쟁력이 살아날 것”이라고 말했다."
