date,title,content
2024-06-04,‘2조원대 담합’ 8개 가구업체 유죄…“공정성 침해하고 시장경제 발전 저해한 중대 범죄”,"최양하 전 한샘 회장은 무죄아파트 ‘붙박이(빌트인) 가구’ 입찰 과정에서 2조3000억원대 담합을 벌인 8개 가구업체와 전·현직 임직원에게 유죄가 선고됐다. 반면 최양하 전 한샘 회장은 회사의 담합 사실을 알고도 묵인한 혐의가 입증되지 않아 무죄를 선고받았다.서울중앙지법. /조선일보DB서울중앙지법 형사25부(재판장 지귀연)는 4일 건설산업기본법·공정거래법 위반 혐의로 기소된 한샘·한샘넥서스·넵스·에넥스·넥시스·우아미·선앤엘인테리어·리버스 등 8개 가구업체 임직원 중 최 전 회장을 제외한 11명에게 각각 징역 10개월에 집행유예 2년∼징역 1년에 집행유예 2년을 선고했다. 함께 기소된 각 법인에는 1억∼2억원의 벌금형이 선고됐다.재판 과정에서 한샘과 한샘넥서스 등 가구업체들은 대부분 공소사실을 인정하며 선처를 호소했다. 반면 최 전 회장 측은 “담합에 관여하거나 승인 내지 지시한 적이 없고 퇴사 후 담합 사실을 알게 됐다”며 혐의를 부인했다.재판부는 “담합은 입찰 공정성을 침해하고, 시장경제 발전을 저해해 국민 경제에 피해를 끼치는 중대한 범죄”라며 “이 사건과 같이 담합이 장기간 진행됐음에도 당국이나 수사 기관에서 발견하기조차 어려웠다. 얼핏 보아선 건설사 외엔 피해자가 없는 것처럼 보여 위험성을 간과하기 쉽다”고 했다.그러면서도 “다만 입찰 건설사들의 피해가 그다지 크지 않은 점, 피고인별 담합 참여 기간과 낙찰가 등을 고려해 형을 정했다”고 설명했다.최 전 회장에 대해선 “피고인이 (담합을) 알고 있었던 것은 아닌지 이를 묵인해온 게 아닌지 등 의심이 가는 다수 정황이 있다”면서도 “부하 직원들이 한목소리로 피고인이 담합에 대해 몰랐다고 진술한 점, 직원 일부는 최 전 회장 성격상 알았다면 영업을 중단 했을 것이라고 한 점, 문서 내용을 제대로 살피지 않은 채 비대면으로 전자 결재의 형태로 일괄 결재한 흔적이 보이는 점”을 바탕으로 무죄 선고 이유를 밝혔다.이들은 지난 2014년 1월부터 2022년 12월까지 24개 건설사가 발주한 전국 아파트 신축현장 783건의 주방·일반가구 등 빌트인 가구 입찰에서 낙찰예정자와 입찰가격 등을 합의해 써낸 혐의로 재판에 넘겨졌다.검찰에 따르면 낙찰 예정 업체는 전화와 이메일, 모바일 메신저로 입찰가격과 견적서를 공유했고, 이른바 ‘들러리’ 업체들은 낙찰 예정 업체보다 높은 가격을 써내는 식으로 공모했다. 검찰은 이러한 담합으로 건축비에 포함되는 가구비용이 높아져 장기간 아파트 분양가를 높이게 만드는 요인이 됐다고 판단했다. 이들이 담합한 입찰 규모는 총 2조3261억원에 달하는 것으로 조사됐다.이번 사건은 검찰이 시행한 ‘카르텔 형벌감면제도(리니언시)’에 따른 첫 직접 수사 사례이기도 하다. 최초로 담합을 자진 신고한 현대리바트는 리니언시 제도에 따라 기소를 면한 것으로 알려졌다."
2024-03-26,"이익 낸 돈으로 이자도 못내는 기업 수두룩...고금리, 업황 부진이 덮쳤다","국내 주요 기업 10곳 중 3곳이 지난해 벌어들인 영업이익으로 대출이자조차 감당하지 못하는 것으로 조사됐다. 기업 분석 연구소 리더스인덱스가 26일 매출 기준 상위 500대 기업 중 사업 보고서를 제출하고 최근 3년간 수치 비교가 가능한 265사를 분석한 결과 2023년 영업이익으로 이자 비용을 감당하지 못하는 기업은 28%인 74사로 집계됐다. 2022년(55사)보다 19사 늘었고, 2021년(26사)과 비교하면 3배 가까이로 증가한 수치다. 리더스인덱스는 “지난해 급격한 영업이익 감소와 높은 금리에 영업이익으로 이자 비용을 감당하지 못하는 대기업이 크게 증가했다”고 분석했다.조사 대상 기업의 지난해 전체 매출은 2714조7565억원으로 전년보다 1%(27조6189억원) 줄었는데, 영업이익은 113조407억원으로 26.3% 급감했다. 기업들 이자 비용은 2022년 31조1078억원에서 작년 52조2785억원으로 68.1% 증가했다. 평균 이자 보상 배율(영업이익을 이자 비용으로 나눈 것)은 4.9에서 2.2로 뚝 떨어졌다. 이자 보상 배율은 기업의 채무 상환 능력을 나타내는 지표다. 2021년 이자 보상 배율(9.2)과 비교하면 2년 사이에 이자를 갚을 능력이 4분의 1로 떨어진 셈이다. 조사 대상 기업의 86%인 228사는 이자 보상 배율이 전년보다 감소했다.지난해 이자 보상 배율이 가장 나빠진 업종은 삼성전자·SK하이닉스 등이 속한IT·전기·전자 업종이었다.IT·전기·전자 업종에 속한 기업 25사는 영업이익이 89% 감소하는 사이 이자 비용은 95.7% 증가했다. 이 업종의 이자 보상 배율은 21.1에서 1.2로 급격히 악화했다. 이어 제약, 운송, 석유화학 업종의 이자 보상 배율이 크게 악화한 것으로 조사됐다. 2022년에 이어 2년 연속 영업이익보다 이자 비용이 많이 든 기업은 32사로 태광산업, 현대미포조선, 신세계건설, 현대리바트,LG디스플레이, 이마트, 롯데쇼핑 등이 포함됐다."
2023-08-19,RM도 옷 사러 온다… 대한민국은 오늘도 ‘중고로운 평화나라’,"[아무튼, 주말]‘중고나라’ 출범 20년국내 중고 거래 20年史일러스트=김영석서울 서초동 ‘중고나라’ 회사 로비에는 웬 붉은 벽돌 하나가 전시돼 있다. 네이버카페에 ‘중고나라’가 막 개설된 2003년, 누군가 이곳에서 중고로 핸드폰을 샀는데 택배 상자를 열어보니 벽돌만 들어 있었다는 전설적 사건을 배경으로 한 자성의 의미다. 개인끼리 물건을 사고파는 온라인 장터가 막 태동한 시점이었다. 벽돌 옆 설명문을 살펴보자. “바야흐로 2003년, 중고나라의 전쟁은 이 벽돌 하나로부터 시작됐다... 이슈가 되면서 ‘오늘도 평화로운 중고나라’ 타이틀을 안고 중고나라는 최대 규모 중고 거래 플랫폼으로 성장했다.”대한민국 중고 거래 시장의 신호탄, 불안한 마음으로 네티즌끼리 연락처를 주고받던 이 중개소는 점차 제도화되며 빠르게 성장했다. 10년 만에 회원 1000만명을 넘겼다. 2014년 법인화가 진행됐고, 2021년에는 롯데쇼핑이 300억원을 투자해 지분 93.9%를 공동 인수했다. ‘번개장터’ ‘헬로마켓’ ‘당근마켓’ 등 후발 주자가 경쟁하며 중고 시장 확장의 새 전기가 열렸다.KB증권에 따르면, 2008년 4조원 수준이던 중고 시장 거래 규모는 올해 30조원을 넘길 것으로 추정된다.산삼부터 지게차까지… 없는 게 없다그래픽=송윤혜꼭 사야 하는데 구할 길 없을 때 이 ‘나라’로 향한다. 조선 시대 엽전 등 문화재급 골동품, 산에서 캔 자연산 산삼, 트랙터·덤프트럭·지게차…. 장르 불문 없는 것 빼고 다 있는, 중고 장터의 특장점 때문이다. 심지어 자기가 꾼 길몽(吉夢)을 1만원에 판다는 게시 글도 올라올 정도. 중고나라에는 물품이 1초에 1.7개 등록된다. 가수 김재중, 배우 박보영 등 ‘중고 거래 고수’를 자처하는 유명 연예인도 많다. 방탄소년단 리더RM이 중고나라에서 일본 브랜드 바지를 구매한 사실이 판매자의 폭로(?)로 알려지기도 했다.시장의 절반 가까이를 점유하는 건 패션 의류. 중고 플랫폼 ‘번개장터’가 지난 2월 발표한 ‘미래 중고 패션 트랜드 분석 보고서’에 따르면, 이용자의 78%가MZ세대였다. 번개장터 측은 “중고에 대한 거부감이 낮아 합리적 소비의 관점으로 중고 패션을 애용하는 것으로 나타났다”며 “고가 명품 부문에서도 다른 세대 대비 중고 거래 경험이 2배 이상 높았다”고 밝혔다. 빈티지에 대한 가치 소비 성향이 커지면서 ‘크림’ ‘솔드아웃’ 등 한정판 희귀 제품을 웃돈 붙여 파는 리셀(resell) 플랫폼도 자리를 잡았다. 이는 국제적 현상이다. 미국 보스턴컨설팅그룹은 세계 중고 의류 시장이 2025년 무렵에는 약 100조원 규모로 성장할 것으로 예측했다.중고 거래 일상화, 문화가 되다온라인 중고 거래를 소재로 삼은 웹 드라마 '오늘도 평화로운 중고나라'의 한 장면. /KODA중고 거래가 경제적으로 궁색한 행위로 비치던 때가 있었다. 회사원 한모(36)씨는 “과거엔 중고를 산다고 대놓고 밝히기 민망했던 게 사실”이라면서도 “이제는 당연한 생활의 일부로 인식된다는 게 가장 큰 변화”라고 말했다. 심리적 장벽이 사라지면서 이제는 환전 수수료를 아끼려 외화(外貨)까지 직거래하는 지경에 이르렀다. 소비자 조사 기업 컨슈머인사이트가 지난해 3577명을 대상으로 한 설문에 따르면, 60%가 온라인 중고 거래 경험이 있었다. 30대는 71%였다. 얼마 전 중고 플랫폼을 통해 승용차를 산 손모(38)씨는 “워낙 중고 거래에 익숙한 데다 값도 저렴해 큰 고민이 없었다”고 말했다.2015년 ‘당근마켓’이 등장하면서 판도가 바뀌었다. 거래의 범위를 전국 단위에서 ‘우리 동네’로 좁혀 더 촘촘한 연결망을 형성한 것이다. 정(情)적인 공간 구실도 하고 있다. ‘무료 나눔’ 기능 덕이다. 2018년 38만147건이던 당근마켓 무료 나눔은 지난해 786만798건으로 20배 가까이 증가했다. 코로나 대위기 당시 회사에서 받은 마스크를 건네거나, 나라에서 받은 ‘나랏미’(米)를 공짜로 나누려 한 기초생활수급자 등의 미담이 많다. 중고에는 사람의 지문이 묻어 있을 수밖에 없다. 중고 거래 중에 피어난 사랑, 2021년 웹 드라마 ‘오늘도 평화로운 중고나라’가 나온 이유일 것이다.기업들 팔 걷었다… 유료화 실험도업계의 판도를 바꾸며 연일 확장 중인 '당근마켓'은 그러나 만년 적자에 시달리고 있다. 지난해 매출이 499억원이었지만 영업 손실은 565억원이었다. /그래픽=조선디자인랩 정다운네이버는 지난해 북미 최대 중고 패션 거래 플랫폼 ‘포시마크’를 약 2조원에 인수했다. 네이버의 역대 가장 큰 인수 금액. 과잉 투자 우려가 나왔지만 올해 1분기 흑자로 전환했다. 신세계그룹 벤처캐피털 시그나이트파트너스는 ‘번개장터’에 투자했다. 중고 거래가 대세가 되자 대기업도 뛰어들기 시작한 것이다. 가구 업계도 리셀 사업에 열중하고 있다. 이케아는 중고 이케아 가구를 매입해 수리한 뒤 재판매하는 ‘바이백 서비스’를 운영하고, 현대리바트는 중고 가구 거래 플랫폼 ‘오구가구’를 지난 3월 출범시켰다. 알뜰 소비를 겨냥해 불황을 타개하려는 전략이다.정작 중고 플랫폼은 적자다. 거래 수수료 없이 기업 광고료가 수입 대부분을 차지하기 때문. 수익 모델은 뚜렷하지 않은 반면 고정비 지출은 크다. 업계 1위로 올라선 당근마켓은 지난해 매출 499억원을 기록하며 전년보다 94.3% 성장했지만, 영업 손실 역시 90억원 가까이 늘었다. 중고나라 영업 손실은 95억원으로 전년 대비 8배. 서비스 유료화 논의가 시작된 이유다. 당근마켓은 최근 광고비 3000원을 내면 관심 있을 이용자에게 우선 노출해주는 ‘24시간 이웃 광고’를 도입했다. 제주도에서만 시범 운영 중으로, 성공 여부에 따라 향후 업계의 새 척도가 될 전망이다.사기꾼 소굴? 정부도 나섰다온라인 중고 사기의 레전드급 사연으로 꼽히는 인증 사진. 무선 이어폰을 샀는데, 상자에 담겨온 건 콩나물이었다. /온라인 커뮤니티코미디 영화 ‘오늘도 평화로운’은 노트북 중고 거래 사기로 돈을 날린 주인공이 범인을 잡으러 중국으로 떠나는 복수극이다. 실제 감독(백승기)이 중고나라에서 사기를 당한 경험을 토대로 제작했다. 지난달에는 아이패드 등의 전자제품을 판다며 8000만원이나 되는 돈을 받아놓고 잠적한 20대가 징역 1년 10개월을 선고받고 법정 구속됐다. 사기는 중고 거래와 뗄 수 없는 오래된 키워드다. 고장 여부를 확인하려 밥솥 직거래 당시 판매자 앞에서 직접 쌀로 밥을 지어봤다는 후기는 그런 사정에 연유한다. 경찰청에 따르면 지난해 중고 직거래 사기는 8만4107건, 피해액만 2573억원이다.중고 사기가 전 국민적 사안이 되면서 판매자의 사기 이력을 조회할 수 있게 하거나, 구매자가 물건을 확인하면 플랫폼이 판매자에게 대금을 전송하는 안전 결제 시스템 등이 마련됐다. 그러나 사기는 더 교묘해지고 있다. 지난 6월 한국소비자원·공정거래위원회는 중고 플랫폼 4사와 협약을 체결해 분쟁 해결 절차를 마련·운영하기로 했다. 예를 들어 물건을 샀는데 수령 3일 이내에 중대 하자가 드러난 경우, 수리비 배상이나 전액 환불을 판매자에게 권고하는 식이다. 공정위 측은 “이번 협약을 계기로 온라인 중고 시장이 더 신뢰 높은 시장이 되길 기대한다”고 했다. 부디 오늘도 평화롭길."
2023-04-20,‘아파트 빌트인’ 2조3000억원대 담합...가구업체 8곳 무더기 기소,"이정섭 서울중앙지검 공정거래조사부 부장검사가 20일 오전 서울 서초구 서울고검 기자실에서 '특판가구 입찰담합' 수사 결과를 브리핑하고 있다./연합뉴스검찰이 신축 아파트에 설치되는 ‘붙박이 가구(빌트인)’ 입찰 과정에 2조3000억원대 담합(談合)을 한 혐의로 국내 유명 가구업체 8곳과 전·현직 임직원 12명을 불구속 기소했다. 이들이 9년간 담합하면서 가구 납품 가격을 평균 5% 높이면서 아파트 입주자들이 1150억원의 추가 부담을 지게 된 것으로 조사됐다.서울중앙지검 공정거래조사부(부장 이정섭)가 20일 공정거래법 위반 등 혐의로 불구속 기소한 가구업체에는 한샘, 한샘넥서스, 넵스, 에넥스, 넥시스, 우아미, 선앤엘인테리어, 리버스 등 8곳이 포함됐다. 같은 혐의로 불구속 기소된 전·현직 임직원은 최양하(73) 전 한샘 대표, 김범수(54) 전 넵스 대표, 최민호(50) 넥시스 대표 등 12명이다.이들은 2014년 1월부터 작년 12월까지 24개 건설사가 발주한 전국 아파트 신축 현장 783곳의 주방 및 일반 가구 공사 입찰에 참여해 낙찰 예정자와 입찰 가격 등을 사전에 합의한 혐의를 받고 있다. 가구업체 직원들이 제비뽑기 등으로 낙찰받을 순번을 정하고, 낙찰 예정 업체가 높은 가격에 뽑힐 수 있도록 나머지 업체들은 더 높은 가격으로 입찰해 줬다는 것이다.이 과정에서 가구 업체들은 전화, 이메일, 메신저 등으로 입찰 가격과 견적서를 공유했다. 이들의 단체 채팅방에서 한 업체 관계자가 ‘저번에 제비뽑기 한 대로 이번 현장은 저희 차례입니다. 42억5000만원에 들어갑니다’라고 하자, 다른 업체 관계자들이 ‘저희는 43억원 쓸게요’ ‘저희는 43억8000만원 쓰겠습니다’라고 하는 식의 내용을 검찰이 확보했다고 한다. 담합 대상 아파트에는 송파 헬리오시티, 롯데 시그니엘 등이 포함된 것으로 전해졌다.이날 기소된 가구 업체들이 9년간 담합으로 낙찰받은 계약 금액은 2조3261억원에 이른다고 한다. 이정섭 부장검사는 “가구 업체들이 자유경쟁으로 낙찰했을 때보다 5% 정도 상향된 금액으로 낙찰가 합의를 했다”면서 “담합이 9년간 이어지면서 아파트 분양가에 조금씩이라도 영향을 미쳐왔던 것”이라고 말했다. 가구 업체들의 담합으로 아파트 입주자들이 약 1150억원을 더 부담하게 됐다는 것이다.한편 이 사건 수사는 담합 사실을 가장 먼저 자진 신고한 업체에 대해 기소를 면제해 주는 ‘카르텔 형벌감면 제도(리니언시·leniency)’를 검찰이 적용한 첫 사례다. 애초 수사선상에 가구 업체 9곳이 올랐는데 이 가운데 현대리바트가 작년 5월 자진 신고를 하면서 이번에 기소를 면했다고 한다."
2023-02-01,"검찰, ‘신축 아파트 가구 담합’ 한샘 등 가구업체 10여 곳 압수수색","신축 아파트용 가구 입찰 담합 사건을 수사 중인 검찰이 1일 가구업체 한샘 등을 압수수색하며 강제 수사에 나섰다.서울 서초구 서울중앙지검./연합뉴서울중앙지검 공정거래조사부(부장 이정섭)는 이날 오전부터 한샘과 현대리바트, 에넥스, 넥시스 등 가구업체 10여곳에 수사관을 보내 담합 관련 자료들을 확보 중이다.이들 업체는 신축 아파트에 빌트인 형태로 들어가는 ‘특판 가구’ 납품 과정에서 가격 등을 담합해 공정거래법 등을 위반한 혐의 등을 받는다. 검찰은 압수물 분석을 마치면 관계자 소환에 나설 전망이다.통상 입찰 담합 사건의 경우 공정거래위원회가 조사해 고발하면 검찰이 수사에 나서는데, 이 사건은 검찰이 먼저 인지해 수사를 진행 중인 것으로 알려졌다. 공정위도 이 사건에 대해 조사 중이며 아직 고발은 하지 않았다."
2022-11-30,"매출 상위 기업 270곳 중 40곳, 영업이익으로 이자도 못 갚아","자료=CEO스코어국내 주요 대기업의 올해 3분기 이자비용이 6조원이 넘는 것으로 집계됐다. 이는 작년 3분기와 비교해 40%가량 늘어난 것으로, 기업 10곳 중 9곳꼴로 이자 부담액이 커졌다. 또 영업활동을 통해 벌어들인 이익으로 이자도 내지 못하는 기업 수가 지난해 3분기 35곳에서 올해 3분기에는 40곳으로 늘었다.30일 기업데이터연구소CEO스코어가 국내 매출 상위 500대 기업 중 분기보고서를 제출한 268곳을 대상으로 분기별 이자비용과 이자보상배율 등을 조사한 결과 이들 기업의 3분기 이자비용은 총 6조1540억원으로 작년 동기(4조3321억원) 대비 42.1% 증가했다. 3분기 이자비용이 가장 큰 곳은 한국전력공사(7223억원)였다. 이어 한국가스공사(2399억원), 삼성전자(2165억원), 포스코홀딩스(1716억원), 현대자동차(1489억원),SK하이닉스(1487억원) 등의 순으로, 이자비용에 1000억원 이상을 지출한 기업은 총 13곳이었다.조사 대상 기업 268곳 중 3분기 이자비용이 전년 동기 대비 증가한 기업은 236곳(88.1%)이나 됐다. 이중 이자비용이 가장 많이 증가한 곳은 한전으로, 작년보다 2312억원 늘었다. 포스코홀딩스(831억원),SK하이닉스(827억원), 가스공사(813억원), 삼성전자(795억원), 현대차(708억원), 한화(515억원) 등도 이자비용이 크게 늘었다. 이자비용이 증가한 데 반해 이들 기업의 영업이익은 34조7336억원으로 작년 같은 기간(49조4421억원)보다 29.7% 감소했다. 이에 따라 이들 기업의 올해 3분기 영업이익을 이자비용으로 나눈 이자보상배율은 5.6배로, 전년 동기(11.4배)의 절반 수준에 그쳤다. 이자보상배율이 전년 동기 대비 감소한 기업도 268곳 중 166곳(61.9%)이나 됐다. 이자보상배율은 기업이 부채에 대한 이자를 지급할 수 있는 능력을 판단하는 지표로, 값이 작을수록 이자에 대한 부담이 크고 수치가 1 미만으로 떨어지면 해당 기간 벌어들인 돈으로 이자를 감당하지 못한다는 의미다.이자보상배율이 1 미만인 기업은 작년 3분기 35곳에서 올해 3분기 40곳으로 5곳 늘었다. 특히 작년 3분기 이자보상배율이 1을 넘었던 현대중공업, 한진, 한화시스템,SKC,대한전선, 태영건설, 롯데하이마트, 현대리바트 등은 올해 3분기에는 1 미만을 기록했다. 넥센타이어와 가스공사, 금호타이어,HJ중공업,KCC건설, 한화에너지 등은 작년 3분기에 이어 올해 3분기에도 이자보상배율이 1을 넘지 못했다. 이와 달리 이자비용은 늘었지만 영업이익이 더 큰 폭으로 증가하면서 이자보상배율이 개선된 기업은 77곳으로 집계됐다.LG에너지솔루션은 이자비용 97억원이 늘었지만, 영업이익이 8946억원(흑자전환) 증가하면서 이자보상배율이 16.2배로 크게 올랐다. 이밖에 삼성물산(6.8배→13.8배)과 현대오일뱅크(5.7배→8.8배),GS칼텍스(10.6배→13.7배) 등도 개선됐다."
2023-01-03,시몬스 “침대값 또 동결”,"가구업계가 최근 제품 가격을 잇따라 올리고 있는 가운데, 침대업체 시몬스가 지난해에 이어 올해도 침대와 매트리스 제품 가격을 올리지 않겠다고 밝혔다.안정호 시몬스 대표는 2일 “지난해에 이어 올해도 가격 인상을 하지 않을 계획”이라면서 “힘든 때일수록 다 함께 가는 것, 오랫동안 소비자들에게 사랑받는 게 더 중요하다”고 밝혔다. 시몬스는 마케팅 비용 절감 같은 방법을 통해 가격 동결에 따른 부담을 소화한다는 방침이다. 시몬스는 2021년 원자재 및 물류비 상승을 이유로 제품 가격을 인상한 이후 지난해는 가격을 동결했다.시몬스와 달리 다른 가구업체들은 지난해 이후 제품 가격을 잇따라 올려왔다. 이케아코리아와 일룸은 지난해 세 차례 가격을 인상했고 씰리와 템퍼도 두 차례에 걸쳐 가격을 올렸다. 에이스침대, 신세계까사, 에몬스, 에넥스도 지난해 가격을 5~10%씩 인상했다.새해 들어서도 한샘이 2일부터 부엌·수납 가구 일부 모델의 문짝과 패널 가격을 평균 2.7% 올리겠다고 밝혔고 현대리바트도 이날부터 가정용 가구 브랜드의 소파, 침대, 의자 가격을 5% 정도 인상하기로 했다. 씰리도 조만간 침대·매트리스 가격을 10%가량 올리기로 한 것으로 알려졌다."
