date,title,content
2024-02-23,"‘형제 경영’ 효성, 조현준·조현상 독립 체제로…계열 분리 전망도","서울 마포구 효성그룹 본사. 연합뉴스형제 공동 경영 체제였던 효성그룹이 지주사를 신설하며 조현준 회장과 조현상 부회장 각자 독립 경영하는 체제로 전환한다. 재계는 조만간 계열 분리 절차도 시작될 것으로 예상했다.효성그룹 지주사인 ㈜효성은 23일 이사회를 열고 신규 지주회사 ‘효성신설지주’(가칭)를 설립하는 안건을 의결했다. 효성첨단소재·효성인포메이션시스템·효성홀딩스USA·효성토요타·비나물류법인(베트남)·광주일보 6개사에 대한 출자부문을 인적분할하는 방식을 통해서다.신설 지주사는 효성가(家) 삼남인 조현상 부회장이 맡는다. 효성티앤씨와 효성중공업·효성화학·효성ITX·효성TNS·FMK등이 남는 ㈜효성은 장남 조현준 회장이 이끈다. 분할 비율은 순자산 장부가액 기준으로 효성이 0.82%, 효성신설지주가 0.18%다. 분할 시 존속법인 효성의 매출 규모는 약 1조8000억원, 신설지주회사의 매출은 약 1조6000억원으로 추정된다.조 부회장과 함께 안성훈 효성중공업 부사장이 신설 지주사의 사내이사 겸 각자 대표이사를 맡는다. 신덕수 효성 전무도 사내이사로 합류한다. 사외이사에는 권오규 전 부총리 겸 재정경제부 장관, 오병희 전 서울대병원장, 이상엽 카이스트 부총장, 김진수 툴젠 고문을 내정했다.왼쪽부터 조현상 부회장, 조석래 명예회장, 조현준 회장. 사진 효성효성이 형제 공동 경영 체제를 구축한 것은 지주사 체제로 전환한 2018년이다. 공동 경영 체제이긴 했지만 형제의 주력 부문은 이미 분리돼 있었다. 조현준 회장은 섬유·건설·중공업을 책임졌고, 조현상 부회장은 첨단소재를 맡았다. 당시 형제간 경영 갈등의 소지를 없애면서 각자 경영능력을 판단해보려는 부친 조석래 명예회장의 의중이 반영됐다는 분석이 나왔다. 재계 관계자는 “이미 소유지분 차이를 통해 형제간 사업 영역은 사실상 나뉘어 있었다. 이제는 명확하게 계열사를 나눠도 될 시점이라고 조석래 회장이 판단한 것으로 보인다”고 말했다.추후 두 형제가 보유한 각 지주사 지분 정리를 통해 계열 분리와 경영권 완전 독립에 나설 것으로 재계는 예상한다. 현재 조현준 회장과 조현상 부회장은 효성 지분을 각자 21% 보유하고 있다. 형제가 비슷한 지분을 보유한 경우 승계 과정에서 갈등이 발생할 수 있지만, 이번 지주사 신설로 경영권 분쟁 소지가 없어졌다고 재계는 평가한다. 효성이 오는 6월 임시 주주총회를 열어 회사 분할 안건을 승인하면 7월 1일부터 두 개 지주사로 체제가 재편된다.고(故) 조홍제 창업주가 설립한 효성그룹은 2세 경영권 승계 과정에서도 계열 분리를 거쳤다. 1980년 그룹 계열 분리로 기존 효성은 첫째 아들인 조석래 회장이 이어받았고, 한국타이어는 조양래 회장에게 돌아갔다."
2023-12-28,[인사] 효성그룹,◆효성그룹 ◆㈜효성 ▶전무 강연수 이창엽 ▶상무보 임상수 이강준 ◆효성티앤씨㈜ ▶전무 주영돈 ▶상무 정준재 이성수 ▶상무보 김원배 ◆효성첨단소재㈜ ▶전무 이영준 ▶상무 곽경훈 ▶상무보 박중곤 ◆효성화학㈜ ▶상무보 ◆효성중공업㈜ ▶상무 장재성 ▶상무보 신성철 김재영 송기호
2023-12-13,GS‧효성 연말 이웃사랑 성금 기탁,"허태수GS그룹 회장. 사진GSGS그룹은 13일 이웃사랑 성금 40억원을 사회복지공동 모금회에 기탁했다고 밝혔다.GS는 2005년부터 사회복지공동모금회에 성금을 기탁해 왔다. 올해까지 기탁한 성금은 총 720억원에 달한다.GS관계자는 “연말을 맞아 어려운 이웃들이 꿈을 잃지 않고 밝은 미래를 만들어 갈수 있도록 함께 노력하겠다”며 “소외 받는 이웃들이 자립하여 희망을 갖고 살 수 있도록 지속적인 사회적 나눔 활동을 펼쳐 나가겠다”고 밝혔다.허태수GS회장은 평소 “사회가 더욱 따뜻하고 행복해질 수 있도록 사회 전체의 관심과 참여가 필요하며, 기업들도 나눔을 통한 사회적 역할에 솔선수범해야 한다”고 기업의 사회적 책임을 강조해왔다.조현준 효성그룹 회장. 사진 효성그룹효성그룹 역시 이날 사회복지공동모금회의 ‘희망2024나눔캠페인’에 성금 10억원을 기탁했다. 성금 모금에는 ㈜효성·효성티앤씨·효성중공업·효성첨단소재·효성화학 등 5개 사업 회사가 참여했다.조현준 효성 회장은 “추운 겨울이지만 도움이 필요한 이웃들에게 따뜻한 희망으로 다가가면 좋겠다”며 “앞으로도 나눔 활동에 앞장서 사회적 가치를 실천하는 기업으로 책임을 다해나갈 것”이라 말했다."
2023-07-21,에쓰오일·효성·배민·삼양 등…수해 복구에 기업들 온정 이어져,"21일 전라도 익산에 위치한 나바위성당에서SPC임직원들이 폭우 피해지역에 지원할 구호물품을 전달하고 있다. 사진SPC=연합뉴스한국타이어앤테크놀로지 임직원들은 20일 집중호우로 피해를 본 충북 청주시 오송읍을 찾아 피해 농가 토사와 부유물 제거, 침수 시설물 철거 및 복구 등 수해복구 활동을 진행했다. 사진 한국타이어=연합뉴스성금과 물품 기부 등 재계의 집중호우 피해 복구 지원이 연일 이어지고 있다.에쓰오일은 이재민 구호와 신속한 피해 복구를 위해 성금 5억원을 전국재해구호협회에 전달했다고 21일 밝혔다. 에쓰오일 관계자는 “집중호우와 산사태·침수 등으로 감당하기 어려운 피해를 본 수재민을 위로하고, 재난 구호와 피해 복구에 도움이 되도록 임직원 모두의 마음을 모았다”고 말했다.효성그룹은 지주사 ㈜효성과 효성티앤씨·효성중공업·효성첨단소재·효성화학이 함께 긴급 구호 성금 3억원을 마련했다고 밝혔다. 기부금은 대한적십자사를 통해 집중호우 피해 복구와 이재민을 위해 쓰인다. 조현준 효성 회장은 “이번 집중호우로 어려움을 겪고 계신 피해 지역 주민들이 빠르게 일상으로 복귀할 수 있도록 조금이나마 힘을 보태겠다”고 말했다.LX그룹은 희망브리지 전국재해구호협회를 통해 전국 수해 지역에 3억원 상당의 성금과 인테리어 자재를 전달했다. 인테리어 자재는LX하우시스의 벽지 제품으로 수해 지역 주택 개보수에 사용된다.배달의민족(배민) 앱을 운영하는 우아한형제들도 희망브리지 전국재해구호협회에 3억원을 기부했다. 또한 특별재난지역으로 선포된 전국 13개 지역에 있는 피해 입점 업주의 7월 한 달 치 광고비와 중개이용료를 전액 지원하기로 했다. 지원 대상 외식업주는 오는 31일까지 배민외식업광장 홈페이지에서 신청하면 된다. 24일부터는 배민 앱에서 모금 캠페인도 할 예정이다.집중호우로 피해가 집중됐던 충남 청양군 청남면 인양리 농경지가 19일 물에 잠겨 있다. 뉴스1삼양그룹은 대한적십자사에 성금 2억원과 5000만원 상당의 의약품을 기탁했다. 삼양사와 삼양패키징이 성금을 마련했으며 삼양홀딩스 바이오팜그룹은 붙이는 관절염 치료제 ‘류마스탑에스 플라스타 핫’을 지원했다. 성금과 의약품은 충남·충북·경북·전북의 피해 복구와 이재민 건강 관리 등에 활용된다.LIG그룹은 희망브리지 전국재해구호협회에 성금 1억원을 전달했다. 모금에는LIG와LIG넥스원·LIG정밀기술·LIG시스템·이노와이어리스·휴세코·서빅·화인·큐셀네트웍스·소프트원 등 10개 계열사가 참여했다. 한국타이어앤테크놀로지(한국타이어)는 서울사회복지공동모금회에 성금 1억원을 기탁하고, 희망브리지 전국재해구호협회에 세면도구와 속옷 등 생필품이 담긴 긴급 구호 키트를 전달했다.세종텔레콤 역시 집중호우 피해 복구를 위해 사랑의열매 사회복지공동모금회에 성금 1억원을 기부했으며 한국P&G는 집중호우로 침수와 시설 피해를 본 충북 청주 운천초, 대구 경원고의 복구를 지원하기 위해 성금 3000만원을 기부했다.식품·유통 기업도 나섰다. 아모레퍼시픽그룹은 사회복지공동모금회에 성금 2억원을 전달했다. 이상목 그룹 대표는 “이번 집중호우로 큰 피해를 본 모든 분께 진심으로 위로의 뜻을 전한다”며 “피해 현장의 원활한 복구와 이재민들의 조속한 일상 복귀에 도움이 되길 바란다”고 말했다.21일 충남 부여군 세도면 침수 피해 주택에서 부여군보건소 방역 차량이 감염병에 예방을 위한 방역소독을 하고 있다. 사진 부여군=연합뉴스도미노피자는 희망브리지 전국재해구호협회에 성금 1억원을 기탁했으며 전날 세종시 수해 복구 인력들에 피자를 전달한 데 이어 충북 청주시 이재민 대피소에도 피자를 제공했다. 지난 17일 대한적십자사를 통해 전북·충북·경북·충남 등에 빵과 생수 1만 개를 전달한SPC는 21일과 24일 각각SPC삼립 빵과 생수 총 1만2000개를 추가 지원하기로 했다.하림산업은 전날 익산시청과 익산푸드통합지원센터에 ‘더미식(The미식)’ 밥 등 구호 물품 2000개, 아워홈은 희망브리지 전국재해구호협회와 대한적십자사 충북지사를 통해 생수 2만3000병과 간편식 2000인분을 이재민과 복구 인력에 전달했다.LG에너지솔루션은 직원들이 직접 팔을 걷어붙였다. 충북 청주의LG에너지솔루션 오창 에너지플랜트 임직원 80여 명은 청주 흥덕구 오송읍 일대 주택 침수, 토사 유출 현장을 찾아 수해 복구 작업을 했다.한편 중앙재난안전대책본부는 이날 오전 11시 기준 호우로 대피한 사람(누적)은 16개 시도 140개 시군구에서 1만1691가구 1만7940명이라고 밝혔다. 이 가운데 1426가구 2200명은 경로당과 마을회관, 학교 같은 임시주거시설 등에 머무르고 있다."
2023-04-18,"한진 5억, 효성‧LS 3억, HL 2억…강릉 산불 피해 복구 성금","강원적십자사가 12일 강원 강릉시 아이스 아레나에 마련한 산불 피해 이재민 임시대피소에서 이동 급식 차량을 활용해 1천350명분의 급식을 지원하고 있다. 강원적십자사 제공.특별재난지역으로 선포된 강릉지역 산불 피해 복구와 이재민 지원을 위한 재계의 기부가 이어지고 있다.한진그룹은 18일 산불 피해 복구를 위해 성금 5억원을 사회복지공동모금회에 기탁했다고 밝혔다. 성금은 이재민을 지원하고 소실된 산림 자원을 복구하는 데 사용될 예정이다. 한진그룹 관계자는 “기탁한 성금이 피해 주민의 아픔을 극복하고 조속한 일상 회복을 돕는데 조금이나마 도움이 되길 바란다”고 말했다.효성그룹도 이날 성금 3억원을 대한적십자사에 전달했다고 밝혔다. 효성과 효성티앤씨, 효성중공업, 효성첨단소재, 효성화학이 함께 마련했다. 조현준 효성 회장은 “피해 현장 복구와 이재민들의 빠른 일상 회복에 도움이 되길 바란다”고 말했다.LS그룹도 3억원의 성금을 사회복지공동모금회에 기탁했다.LS전선,LS일렉트릭,LSMnM,LS엠트론, E1, 예스코홀딩스 등 6개 계열사가 참여했다.LS그룹 관계자는 “갑작스런 산불로 인해 피해를 본 강릉 시민의 아픔에 공감하며 주변의 관심과 지원이 절실한 상황”이라며 “작으나마 피해 복구에 힘을 보탬으로써 이재민들이 하루라도 빨리 일상으로 돌아가길 희망한다”고 말했다.HL그룹은 사회복지공동모금회를 통해 2억원을 기부한다. 그룹 차원 모금에는HL홀딩스,HL만도,HL클레무브,HLD&I 한라 등 지주사와 주요 계열사가 참여했다.아모레퍼시픽도 사회복지공동모금회를 통해 1억원을 기부한다. 또 아모레퍼시픽그룹은 3000만원 상당의 생활용품도 지원하기로 했다. 이상목 아모레퍼시픽그룹 대표는 “피해를 본 강릉 지역 주민에 깊은 위로를 전한다""며 ""피해 현장 복구와 이재민의 일상 회복에 도움이 됐으면 한다”고 말했다."
2022-03-11,"[사랑방] 효성, 산불 피해 복구 성금 3억원 전달",조현준효성그룹(회장 조현준·사진)은 10일 산불 피해 복구와 이재민 지원을 위해 성금 3억원을 대한적십자사에 전달했다. ㈜효성과 효성티앤씨·효성중공업·효성첨단소재·효성화학이 지원했다.
2022-01-26,"효성, 지난해 영업익 410% 증가… 2조 7702억으로 사상 최대","효성그룹이 사상 최대 실적을 기록했다. 26일 효성그룹은 지난해 매출 21조2804억원, 영업이익 2조7702억원을 올렸다고 발표했다. 매출은 전년대비 42.3%, 영업이익은 410.2% 증가했다. 조현준 회장 취임 5주년 만에 이룬 결실이다.조현준 효성그룹 회장. 사진공동취재단2020년에는 매출액 14조9536억원, 영업이익 5429억원이었다.효성그룹은 지주사인 주식회사 효성(매출 3조5389억원, 영업이익 6406억원)과 효성티앤씨)매출 8조5960억원, 영업이익 1조4237억원), 효성첨단신소재(매출 3조5978억원, 영업이익 4373억원), 효성중공업(매출 3조947억원, 영업이익 1201억원), 효성화학(매출 2조4530억원, 영업이익 1485억원)으로 구성돼 있다.효성티앤씨는 단일사업회사로 그룹사 중 유일하게 연간 영업이익과 당기순이익 1조원 이상을 달성하며 '1조 클럽'에 이름을 올렸다.크레오라(스판덱스) 부문의 경우 의류에 쓰이는 스판덱스의 혼용률 증가와 지난해 8월 증설한 터키 공장의 영향으로 영업이익이 크게 늘었다. 친환경 섬유 리젠 역시 친환경 소비에 대한 인식제고와 지자체 및 브랜드와의 협업으로 판매량이 지속 상승하고 있다.효성티앤씨는 올해 중국 닝샤 공장이 본격 가동된다. 향후 중국 내수시장에서 실적 증가를 기대하고 있다. 특히 브라질과 인도공장 증설로 글로벌 1위 업체로서의 위상도 더욱 단단해질 전망이다."
2022-01-11,[인사] ㈜효성 外,◆㈜효성 ▶부회장 구명신 김규영 ▶전무 이형욱 ▶상무 신동익 위희경 임효성 ▶상무보 김원일 한영성◆효성티앤씨㈜ ▶전무 심상룡 ▶상무 이정훈 ▶상무보 김상학 배재범 정영환 정준재 차유나◆효성첨단소재㈜ ▶전무 여예근 ▶상무 박찬 석병식 이태정 ▶상무보 김영수 서유석 이병진 홍경선◆효성화학㈜ ▶부사장 이천석 ▶상무보 권철현 김후원 이용호◆효성중공업㈜ ▶부사장 안성훈 ▶전무 배용배 ▶상무 최영식 ▶상무보 김기웅 김세진 박요섭 이철훈 조영준◆효성티앤에스㈜ ▶사장 손현식◆효성인포메이션시스템㈜ ▶상무보 이정우◆효성아이티엑스㈜ ▶부사장 남경환◆㈜에프엠케이 ▶부사장 김광철
2024-09-24,[이철민의 마켓 나우] M&A 시장이 가스업체들로 북적이는 이유,"이철민VIG파트너스 대표지난 9월 13일, 에어프로덕츠코리아와SK스페셜티라는 두 대형 가스 관련 기업의 경영권 매각 거래를 위한 예비 입찰이 있었다.MBK파트너스·한앤컴퍼니 등 국내 대형 사모펀드는 물론,KKR·브룩필드·칼라일 등 글로벌 사모펀드도 대거 참전한 것으로 알려졌다. 한편 효성화학이 보유하고 있는 특수가스 사업부의 매각도 진행 중인데, 최근 국내 사모펀드인IMM과 스틱의 컨소시엄이 우선협상 대상자로 선정된 상황이다.지난 몇 년간 가스 관련 기업들은 국내 M&A 시장의 단골 매물이었다. 2019년IMM의 린데코리아(현 에어퍼스트) 인수, 2020년 맥쿼리의 대성산업가스(현DIG에어가스) 인수, 지난해SGPE의 한국특수가스 인수와 블랙록의 에어퍼스트 지분 일부 인수 등이 대표적인 사례다. 이중 한국특수가스를 제외하면 모두 거래금액 1조원 이상의 초대형 M&A였는데, 대부분의 거래에 사모펀드들이 관여했다는 점이 눈에 띈다.에어프로덕츠·DIG에어가스·에어퍼스트 등은 ‘산업가스’ 분야로,SK스페셜티·효성 특수가스 사업부는 ‘특수가스’ 분야로 분류된다. 산업가스는 대규모 제조 업체들을 대상으로 장기 계약을 통해 산소·질소·수소·이산화탄소·아르곤 등을 파이프라인으로 공급한다. 특수가스는 중단기 계약에 기반하여 주로 반도체·디스플레이 등의 공장에 삼불화질소(NF３) 등 고순도·고정밀도 가스를 실린더나 탱크를 통해 공급한다.이러한 특성상, 산업가스는 장기간 안정적인 수익창출이 가능한 사업이라는 장점이, 특수가스는 첨단 산업 분야의 성장성이라는 장점이 매우 명확하다. 하지만 글로벌 기업의 자회사였던 에어프로덕츠나 린데코리아의 사례를 살펴보면, 국내의 특정 고객사를 위한 특정 가스에 집중된 매출 구조를 가지고 있어 글로벌 사업 포트폴리오와 시너지가 제한적이다. 국내 기업의 경우에도 그룹 내 다른 계열사들과 시너지가 거의 없다.이처럼 전략적인 가치가 크지 않기 때문에, 기업들은 매각을 통해 확보한 현금으로 주력 산업 분야에 재투자하거나 혹은 재무적인 어려움을 해결하려는 목적으로 팔고 있는 것이다. 물론 그 전제에는 매력적인 가격으로 매각이 가능한 시장 환경이 자리 잡고 있다. 앞서 언급한 업의 특성상 큰 매매차익을 거두기 어렵지만 손실이 발생할 가능성도 높지 않아, 사모펀드들이 과감하게 베팅을 할 수 있기 때문이다.안 그래도 이른바 ‘딜 가뭄’을 겪고 있는 사모펀드들의 입장에서는, 가스 관련 기업들을 이른바 ‘인프라성’ 투자의 좋은 대상으로 보고 있는 것이다. 최근 재활용이나 환경 관련 기업들의 M&A가 활발해지는 이유 역시 맥락이 비슷하다.이철민VIG파트너스 대표"
2022-07-19,"실적 전망 줄줄이 내리는데, 완성차·정유업계는 오르네","기업들의 2분기 실적 발표 시즌을 앞두고 국내 상장사들에 대한 기대치가 낮아지고 있다. 인플레이션과 경기 침체 우려로 투자 심리가 위축된 상황인 만큼 기업의 실적 확인을 통해 ‘옥석 가리기’가 필요하다는 게 증권업계 조언이다.18일 금융정보업체 에프앤가이드에 따르면 증권사 3곳 이상이 실적 추정치를 내놓은 코스피·코스닥 상장사 197곳의 2분기 영업이익 추정치는 51조8759억원으로 집계됐다. 이는 한 달 전 추정치(52억7606억원)보다 1.7% 줄어든 수치다. 실적 추정치가 하향 조정된 기업은 90곳, 상향 조정된 기업은 81곳이었다(적자 기업·실적 추정치 유지된 곳은 제외).그래픽=신재민 기자shin.jaemin@joongang.co.kr3분기 전망은 더욱 부정적으로 바뀌고 있다. 189곳의 3분기 영업이익 추정치는 50조4784억원으로 한 달 전 추정치(53조8933억원)보다 6.3% 줄었다. 3분기 실적 추정치가 하향 조정된 기업은 97곳, 상향 조정기업은 73곳이었다. 업종별로 보면 ▶디스플레이 ▶휴대폰 ▶반도체 ▶내구소비재 업종에 대한 낮아진 기대감이 전반적으로 실적 추정치를 끌어내리고 있다.코스피 대장주 삼성전자는 지난 7일 올 2분기 영업이익이 14조원을 기록했다고 밝혔다. 지난해 같은 기간보다 영업익이 11.38% 늘어나긴 했지만, 증권사들의 추정치 평균(15조2124억원)보다 크게 밑돌았다.시장에선 견고한 반도체 수요 덕분에 2분기 실적은 나름 선방했지만, 하반기부터는 경기 침체 영향으로 반도체 업황이 더욱 부진할 것이란 전망이 우세하다. 삼성전자의 올 3분기 영업이익 추정치(컨센서스)는 지난해 같은 기간보다 7.1% 줄어든 14조6944억원 수준으로 집계됐다. 한 달 전 추정치와 비교하면 14.4% 내려앉았다.다만 시장의 실적 눈높이가 낮아질 경우, 주가에는 호재로 작용하기도 한다. 삼성전자는 2분기 잠정 실적 발표 이후 “다소 부진하지만, 선방했다”는 평가가 이어지며 주가가 6만 원대를 회복했다. 이날도 전 거래일보다 3.17%(1900원) 상승한 6만1900원에 거래를 마쳤다.3분기 기준으로LG디스플레이(1157억원)의 영업이익 추정치는 한 달 전보다 66.3%나 떨어졌다. 효성화학(-24.8%), 풍산(-24.1%), 넷마블(-21.7%), 롯데케미칼(-19.1%), 하이브(-17.5%), 현대미포조선(-17.1%) 등도 실적 눈높이가 다소 큰 폭으로 낮아졌다.반면 실적 추정치가 높아진 업체도 있다. 완성차 업체들이 대표적이다. 오는 21일 2분기 실적 발표에 나서는 현대차는 영업이익 추정치가 한 달 전보다 6.7% 늘었고, 22일 실적 발표가 예정된 기아도 7% 증가했다. 3분기 영업이익 추정치도 각각 한 달 전보다 6.3%, 8.1% 늘었다.이밖에 2, 3분기 연속 실적 추정치가 상승하는 업체들로는S-Oil,에코프로비엠,SK이노베이션, 대한항공, 해성디에스 등이 있다.한지영 키움증권 연구원은 “코스피 이익 전망이 하향으로 돌아서기 시작한 건 실적에 대한 시장의 눈높이가 낮아지고 있다는 점을 시사한다”며 “기업의 실적이 대외 변수로 인해 달라졌는지 꼼꼼히 비교해보고, 미래에 대한 실적 전망치를 긍정적으로 제시하고 있는지를 잘 살펴 투자 결정을 해야 한다”고 조언했다."
