date,title,content
2022-04-29,소리는 요란했는데… 대기업 탄소중립 뒷걸음질,"작년 탄소배출 1년새 4.1% 늘어지난해 정부가 탄소중립기본법을 만들고, 기업이 앞다퉈 ‘탄소중립 선언’을 했지만, 주요 기업의 탄소 배출량은 오히려 늘어난 것으로 나타났다. 코로나 사태 이후 침체했던 글로벌 경기가 살아나면서 지난해 공장 가동률이 대폭 상승했기 때문이다. 전문가들은 사업이 잘될수록 탄소 배출이 많아지는 제조업 중심의 한국 산업 특성이 반영된 현상이라고 분석했다. 새 정부가 탄소중립 추진 전략과 실현 가능한 목표를 우리 산업 현실에 맞게 다시 짜야 한다는 지적이 나온다.매출 100대 기업, 지난해 탄소배출량 오히려 늘었다본지가 28일 매출 100대 기업 중 탄소 배출량을 공개한 54개 기업의 지난해 탄소 배출량을 조사해보니, 총 1억3605만t으로 2020년(1억3064만t)보다 4.1% 증가한 것으로 나타났다. 54개 기업 중 탄소 배출량을 줄인 곳은 두산중공업, 대우조선해양 등 16곳에 불과했다. 70% 이상인 38곳은 전년보다 탄소 배출량이 증가했다.탄소 배출량이 늘어난 기업 중에는 롯데케미칼, 여천NCC,효성티앤씨 등 석유 화학 회사가 많았다. 이 회사들은 2020년 코로나 사태 여파로 생산량이 급감했지만, 지난해에는 글로벌 경기가 회복되고 보복 소비 등의 여파로 세계적 호황을 맞았다. 공장 가동률이 90% 이상을 기록하며 코로나 이전 수준으로 생산량이 늘어나자 온실가스 배출량도 증가한 것이다. 롯데케미칼 등 3사의 작년 매출은 전년보다 각각 48%, 64%, 66% 급증했다.삼성전자,SK하이닉스 등 국내 대표 반도체 기업도 사정은 비슷했다. 삼성전자는 지난해TV등 디스플레이 제품에 재활용 플라스틱 사용을 늘리고, 제품 박스도 재활용 소재를 사용하기로 했다. 이런 시도에도 세계 최대 규모의 반도체 생산라인인 평택2라인이 2020년 8월 완공돼 본격 가동에 들어가자 탄소 배출량은 오히려 11% 증가했다. 업계에서는 현재 건설 중인 평택 3라인이 올 하반기 완공되면 올해 탄소 배출량은 더 늘어날 것으로 예상했다. 2030년까지 전 세계 탄소 배출량의 1%에 해당하는 2억t의 탄소를 감축하겠다고 발표한SK그룹에서, 주력 계열사인SK하이닉스의 탄소 배출량(518만t)이 전년보다 22만8000t(4.6%) 늘어난 것도 비슷한 이유에서다. 반면 탈원전으로 사업 환경이 나빠진 두산중공업, 지난해 조 단위 적자를 기록한 대우조선해양 등은 탄소 배출량이 크게 줄었다.기업 매출 증감에 비례해 탄소 배출량도 늘어나는 구조다. 54개 기업의 지난해 매출은 1098조원으로 2020년(874조원)보다 25% 이상 증가했다. 송재형 전국경제인연합회ESG(환경·사회·지배구조)팀장은 “지난해 주요 기업이 사용 전력 100%를 재생에너지로 충당하는 ‘RE100′ 캠페인에 앞다퉈 가입하는 등 다양한 탄소 저감 정책을 펼치고 있지만, 에너지를 많이 쓰는 한국 산업구조상 획기적인 기술 혁신 없이는 매출이 늘면 탄소 배출 역시 덩달아 높아질 수밖에 없다”고 말했다.2030년까지 40% 감축, 지킬 수 있나전문가들은 이 같은 현상에 대해 “실질적인 탄소중립을 위해서는 추진 전략과 단계적 목표 등을 보다 현실화하는 등 재논의가 필요하다”고 지적했다. 손양훈 인천대 교수는 “코로나로 위축됐던 경기가 살아나면서 가동률이 올라가고 탄소 발생량이 늘어나는 건 세계적인 현상”이라며 “가뜩이나 에너지 가격도 올라가면서 탄소중립보다 에너지 안보를 더 중요하게 여기는 마당에 한국적 현실을 고려하지 않고 탄소중립을 무리하게 추진하면 기업 부담은 더 커질 우려가 있다”고 했다.특히 문재인 정부가 올 3월 시행령을 통해 “2030년까지 탄소배출을 2018년보다 40% 줄이겠다”(2030NDC)며 법령으로 감축 목표를 못 박으면서 기업 부담은 더 커질 것이라는 우려가 나온다. 익명을 요구한 10대 기업 고위 임원은 “정부의 탄소중립 계획 수립 과정에서 가장 직접적인 영향을 받는 기업 의견 수렴은 거의 없었고 탄소중립위원회 구성도 일부 시민단체 등에 편향됐다”고 말했다."
2022-02-24,국내 최대 섬유소재 전시회 20돌… ‘대구국제섬유박람회’ 대구엑스코서 개최,"지난해 열린 대구국제섬유박람회의 개막식 모습. /대구시국내 최대 규모의 섬유소재 전시회가 대구에서 열린다.대구시와 경북도는 ‘2022 대구국제섬유박람회(PID·PreviewinDAEGU·이하PID)’를 3월2일부터 4일까지 대구 엑스코에서 개최한다고 24일 밝혔다.대구시와 경북도가 주최하고 대구경북섬유산업연합회가 주관하는PID는 2002년 시작해 올해로 20주년을 맞는다.본격적인 포스트 코로나 시대를 앞두고 열리는 이번 전시회는 온·오프라인의 하이브리드 방식으로 운영되는 것이 특징. 그동안 위축됐던 오프라인 비즈니스의 단계적 회복에 힘을 싣는다는 것이 주최측의 이야기다.특히 올해는 온라인 플랫폼 전시회를 지난 21일부터 사전에 열어 2800여 점의 참가업체 신소재를 국내외 바이어들에게 선보이고 있다.국내외 섬유업체 209개 사가 참여하는 이번PID는 ‘새로운 세계관(NEWWorldview)’을 테마로 정하고 다양한 신소재와 제품을 선보일 예정이다.기후재앙과 자원고발, 팬데믹의 위기상황에서 섬유패션산업이 지향할 가치와 방향을 모색하는 것도 올해PID에서 눈여겨 볼 부분이다. 때문에 기존과는 전혀 다른 환경에 대한 인식과 지속가능한 발전에 기반을 둔 첨단 신소재와 친환경, 탄소중립소재들이 총망라된다.이중 효성티앤씨, 코레쉬텍, 건백, 아이지에스에프 등 원사·직물·완제품 관련 기업들은 공동으로 재활용 폴리에스터와 나일론 및 스판덱스, 생분해성PLA(폴리락틱애시드), 탄소 및 그래핀 소재의 파이버와 원사 제품을 소개하는 한편 다양한 융·복합 소재를 제안한다.원창머티리얼, 해원통상, 대현티에프시, 예스텍스타일건설팅랩, 코로나텍스타일, 미광, 텍스아이, 삼성교역, 이조화섬 등은 재활용 및 생분해성 원사, 오가닉코튼, 원착사, 비불소 발수 및 코팅 기술 등을 적용한 아웃도어 분야용 친환경 원단들을 선보인다.또 한국섬유기계협회와 한국섬유기계융합연구원은 섬유설비 자동화와 클린팩토리 등 제조기반과 관련한 다양한 섬유기계들을 선보인다. 방염소재와 안전방호복도 소개될 예정이다.그밖에 공동관으로 참가하는 경북테크노파크의 보건·안전 섬유, 탄소중립생분해섬유소재산업협의회의 생분해제품, 한국환경산업협회의 업사이클링 제품, 천연염색 등은 탄소중립에 대응하는 섬유업계의 새로운 변화를 엿볼 수 있는 내용이다.한편PID본 전시에서는 21일 사전 오픈한 온라인 전시회와 오프라인 비즈니스와의 시너지효과를 극대화 하기 위해 전시 기간 3일간 중국, 미주, 유럽, 일본 등의 해외 화상 수출상담회를 개최한다. 일본 오사카에는PID소재 쇼룸을 설치, 바이어와의 매칭을 통해 전시현장과의 실질적인 상담성과를 높일 계획이다.부대행사로 산화그래핀 고품질 그래핀의 실용화에 대한 정보세미나, 업체별PT세미나, 2023 S/S 트렌드 세미나와 함께 패션쇼(2022 직물과 패션의 만남전), 국제 컨퍼런스 등이 동시에 진행된다.권영진 대구시장은 “이번 전시회릍 통해 지속성장을 위한 지역 섬유산업의 대전환을 위한 발판을 마련하고 향후 첨단 융복합 섬유소재산업의 육성과 환경친화,자동화기반의 산업생태계 조성, 디지털 기반의 마케팅 강화 등을 모색해 글로벌 경쟁력을 강화하는 기회가 되기를 바란다”고 말했다."
2022-02-03,주가 올랐다는데 왜 나만 손해봤지? ‘착시 주식’입니다,"다수 투자자들 고점에서 사들여… ‘체감 수익률’ 마이너스 속출작년 12월 계열사인 카카오페이 경영진이 900억원대 보유 주식을 매도하면서 투자자들의 외면 속에 카카오 주가가 급락했다. (왼쪽부터)카카오페이 이진CBO,장기주CFO,류영준CEO,신원근CSO,이승효CPO./카카오페이 제공지난해 주가가 많이 오른 주식을 보유한 투자자들은 돈을 많이 벌었을까? 꼭 그렇지는 않다. 연말 주가가 연초보다 많이 올랐다 하더라도 연중 최고점 근처에서 주식을 산 투자자들은 오히려 마이너스 수익률을 기록했기 때문이다. 결국 연간 주가 상승률보다는 언제 어느 가격에 샀느냐에 따라 투자자별 체감수익률이 달라지는 것이다.지난해 증시에서는 코스피200 종목 가운데 114개 종목이 연간으로 플러스 수익률을 기록했다. 연초 대비 연말 주가가 올랐다는 뜻이다.반면 체감수익률을 계산하면 얘기가 달라진다. 체감수익률은 해당 종목의 평균 매입 가격과 연말 주가를 비교하는 방식이다. 연간 계약 체결액을 총계약 건수로 나눠서 연평균 매입 가격을 구한다. 이러면 투자자들이 평균적으로 어떤 가격에 주식을 샀는지 알 수 있다.NH투자증권은 2일 “작년 연간 수익률이 플러스인 114개 코스피200 종목 중 체감수익률이 마이너스였던 종목이 67개(59%)로 절반을 넘었다”고 밝혔다. 기록상으론 주가가 연초보다 올랐지만 실제 투자자들이 매수한 가격은 연말 주가보다 높아서 손해를 본 ‘착시 주식’이 67개라는 것이다.코스피200 상승 종목 중 착시 주식 59%67개 착시 주식의 작년 연간 수익률 평균은 20.5%였고, 체감수익률 평균은 -9.9%였다. 두 수익률 간 격차인 착시 수치는 평균 30.4%포인트였다. 그만큼 착시 주식을 산 투자자들은 공개된 수익률과 본인 수익률 간에 괴리감을 느끼고 있다는 뜻이다.부동산에 비유하면 연초에 2억원에 거래됐던 아파트가 중간에 10억원까지 치솟았다가 연말에 7억원으로 떨어진 것과 비슷하다. 초기 2억원에 매입한 사람은 5억원을 벌었지만, 중간에 상투를 잡은 사람들은 3억원 손해를 본 셈이다.착시가 가장 컸던 종목은 기능성 섬유 업체인 효성티앤씨로 연간 주가 상승률은 146.9%였지만, 체감수익률이 -11.2%였다. 두 수익률 간 차이인 착시 수치는 158.1%포인트였다. 동국제강(109.5%포인트), 해운업체HMM(109.2%포인트)이 뒤를 이었다.최근 계열사 카카오페이 경영진의 900억원대 스톡옵션 매각 논란으로 주가가 급락한 카카오도 착시 주식 4위에 이름을 올렸다. 연초 후로는 43.9% 올랐지만 체감 수익률은 -29.6%로 두 수익률 격차가 73.5%포인트나 벌어졌다.업종별로는 섬유·자동차 등 ‘경기소비재’와 운송·건설 등 ‘산업재’가 각각 19개(28%)로 가장 많았고, 금속·화학 등 ‘소재’(9개)가 뒤를 이었다. 경기소비재는 작년 상반기에 코로나 회복 기대감 덕분에 주가가 올랐지만 하반기 들어 코로나 변이 확산에 따른 경기 악화로 부진에 빠졌다. 경기를 반영하는 산업재와 소재 업종도 비슷한 흐름을 보였다.반면 연말 주가가 연초에 비해서는 하락했지만, 체감수익률은 플러스(이익)였던 종목은 단 2개(1%)에 불과했다. 반도체 장비 업체SK스퀘어와 아시아나항공이었다.SK스퀘어는 연간 12.6% 떨어졌지만 체감으로는 0.3% 올랐고, 아시아나항공의 경우 연간으로는 0.5% 하락, 체감으로는 1.1% 상승률을 기록했다.일확천금 노린 부화뇌동 매매 피해야전문가들은 군중심리에 휩쓸려 충동적으로 투자하는 ‘부화뇌동 매매’를 유의하라고 조언한다. 주가가 급하게 오르는 기세에 현혹돼 투자했다가 고점에서 물려 큰 손해를 볼 수 있다는 말이다.착시 주식의 작년 연간 주가 흐름은 공통적으로 상반기에 급등해 정점을 찍은 뒤 하반기에 급락해 ‘산(山)’과 같은 모양을 이뤘다. 편득현NH투자증권 자산관리전략부 부부장은 “착시 주식들은 대부분 지난해 중반에 일확천금을 노린 부화뇌동 매매까지 더해져 주가가 과도하게 오르는 모습을 보였다”며 “시가총액이 큰 대형주나 배당주 위주로 장기·분산 투자하면 착시 주식을 상당 부분 피할 수 있다”고 조언했다.실제 국내 시총 1·3위인 삼성전자와SK하이닉스의 작년 연간 수익률과 체감수익률 격차는 각각 1.1%포인트, 3.4%포인트에 불과했다. 7~8%의 배당수익률(주가 대비 배당금 비율)이 예상되는 삼성증권(9%포인트),NH투자증권(10%포인트), 기업은행(11%포인트) 등도 연간 수익률과 체감수익률 간 격차가 10%포인트 안팎으로 작은 편이었다.☞착시 주식연말 주가가 연초보다는 큰 폭으로 올랐지만, 투자자들이 많이 매수한 시점은 연중 최고점 근처여서 실제로는 투자자들이 손해를 보고 있는 주식."
2022-01-31,하락장에서도 목표주가 10% 이상 오른 종목은?,"이엠텍·메리츠화재·이녹스첨단소재·LG이노텍 등 10% 이상 상승LG이노텍이 2020년 10월 개발한 고효율 자성소재./LG이노텍 제공최근 증시가 큰 폭의 조정을 받고 있지만 증권사 목표 주가가 오르는 종목들도 있다. 31일 금융 정보 업체 에프앤가이드에 따르면 27일 기준 증권사 3곳 이상이 목표주가를 제시한 코스피·코스닥 상장 기업 285개 중 작년 말보다 목표주가가 오른 종목은 75개였다.목표주가 상승 폭이 가장 큰 종목은 스마트폰 부품 및 전자담배제조사 이엠텍이었다. 증권사 목표주가 평균은 작년 말 3만6567원에서 지난 27일 4만7667원으로 30.4% 올랐다. 전자담배 고객사가 신규로 확대되면서 실적이 개선될 것으로 전망됐다.이 외에 메리츠화재(18.8%), 이녹스첨단소재(15.9%),LG이노텍(12.0%) 등의 목표주가가 10% 이상 상승했다. 메리츠화재는 자사주 매입·소각 정책과 2월 모건스탠리캐피털인터내셔널(MSCI) 지수 편입 가능성이 긍정적으로 평가됐다. 이녹스첨단소재와LG이노텍은 4분기 좋은 실적에 이어 성장이 이어질 것으로 전망됐다.SK하이닉스(7.6%)·LG디스플레이(4.4%)·삼성전자(2.4%) 등 대형주도 목표주가가 올랐다.목표주가가 상승한 종목은 실제 주가도 대체로 오름세였다. 작년 말부터 27일까지 이엠텍 주가는 3만1850원에서 3만4100원으로 7% 상승했고, 메리츠화재는 3만3550원에서 4만9900원으로 48.7%, 이녹스는 4만6150원에서 5만1300원으로 11.2% 올랐다. 다만LG이노텍은 36만4000원에서 33만1000원으로 9% 정도 주가가 떨어졌다.반면, 목표주가가 하락한 종목은 160개였고, 나머지 50개는 같은 수준을 유지했다. 하락 조정폭이 컸던 업종은 항공·화장품·여행 등 코로나 변이 확산 충격을 받은 리오프닝(경기 재개)주와 화학 관련주였다. 구체적으로 진에어의 목표주가 평균은 2만3333원에서 1만7600원으로 24.6% 떨어졌다. 중국 화장품 매출 부진의 직격탄을 맞은LG생활건강도 166만3125원에서 132만2727원으로 20.5% 하락 조정됐다.LG화학(-16.9%)·효성티앤씨(-16.4%)·세아베스틸(-15.2%)·대한유화(-14.0%)·모두투어(-13.8%)·코스맥스(-13.6%) 등 14 종목 목표주가가 10%대 하락을 기록했다.실제 주가는 같은 기간 진에어가 1만6700원에서 1만3250원으로 20.7%,LG생활건강은 109만7000원에서 94만8000원으로 13.6% 떨어졌다.LG화학은 61만5000원에서 61만원이 됐다."
2022-01-26,“지옥문이 열렸다” 끝없는 악재 뉴스에 개미군단 비명,"[왕개미연구소]앞으로 개인 투자자들은 2022년 1월의 다이나믹한 한국 증시를 결코 잊지 못할 것이다. 계절적으로 1월 주식 시장은 호조라는 ‘1월 효과’를 완전히 뒤집었기 때문이다. 이달 25일까지 코스피는 9% 하락했는데, 남은 기간 반등하지 못한다면 최악의 1월 증시로 기록될 전망이다.2022년 새해가 시작되자마자, 한국 증시엔 역대급 폭탄이 줄줄이 떨어졌다.26일 개인 투자자들 사이에선 2022년 1월 한국 증시에서 생긴 이벤트들을 정리한 한 장의 사진이 화제였다./블로그 캡처오스템임플란트 횡령,HDC현대산업개발 아파트 붕괴, 메드팩토 임상 반려, 셀트리온 분식회계 의혹, 위메이드 위믹스 코인 대량 매도, 신라젠 상장폐지 결정, 카카오페이 경영진 사퇴,LG에너지솔루션 114조원 청약, 안트로젠 임상 실패, 에코프로비엠·효성티앤씨 공장 화재, 비트코인 4만달러 붕괴, 나스닥 1월 최악의 수익률, 공무원 공금 115억 횡령해 주식 투자, 에코프로비엠 내부자 거래 혐의...간단하게 정리한다고 했는데도 이렇게나 많은 일이 한 달 만에 일어났다. 금융 전문가들은 국내 증시에서 소액 주주들이 안심하고 장기 투자를 할 수 있도록, 상장사의 금융 불법 행위에 대한 강력한 처벌이 필요하다고 지적한다. ‘솜방망이 처벌’이라는 말이 나올 정도로 처벌이 미약하면, 개인 주주들을 울리는 금융 비리는 근절시킬 수 없다는 것이다.대형 증권사 관계자는 “지난해 9월 남부지검에 금융 증권범죄수사협력단을 다시 만든 것만 봐도 우리 사회에서 금융 범죄가 얼마나 빈번한지 알 수 있다”면서 “금융 범죄를 강력하게 처벌하는 사회적 분위기 조성이 필요하며 대선 후보들도 이런 문제에 관심을 갖고 소액 주주들을 위한 제도 마련에 나서주길 바란다”고 말했다.26일 오후 서울 중구 하나은행 본점 딜링룸에서 직원들이 업무를 보고 있다. 이날 코스피는 전날보다 0.41% 내린 2709.24에 장을 마쳤고, 코스닥지수는 882.09에 마감했다./연합뉴스한편, 가뜩이나 산적해 있는 해외 악재에 내부 악재들이 겹쳐지면서, 천하무적 개미 군단도 체력이 바닥나고 있다. 1년 전인 작년 1월에만 해도 국내 주식시장의 일 평균 거래대금은 26조원이 넘었는데, 이달은 10조원으로 62% 감소했다.26일 코스피는 전날보다 0.41% 내린 2709.24에 마감했다. 이날 외국인이 2500억원 가량 주식을 순매도했고, 기관도 적극적인 매매 없이 163억 순매도였다.투자자들은 오는 25~26일(현지 시간) 진행되는 미국 연방공개시장위원회(FOMC) 정례회의 결과를 기다리며 관망하는 모습이었다. 이날 코스피 거래대금은 8조8000억원으로, 1월 일평균 거래 대금에 못 미쳤다.27일 상장하는LG에너지솔루션이 증시 자금 블랙홀이 되어 수급이 꼬일 것이란 우려도 증시를 압박하는 요인이다.LG에너지솔루션은 공모가(30만원) 기준으로 시가총액이 70조원에 육박하는데, 상장하자마자 삼성전자(437조원), 하이닉스(85조5000억원)에 이어 코스피 시총 3위를 기록할 전망이다. 만약 상장일에 주가가 올라서 증권업계 예상대로 시총이 100조원까지 불어난다면 순식간에 코스피 시총 2위다."
2024-12-13,"[Biz & Now] 효성티앤씨, 효성화학 특수가스 인수",효성티앤씨가 12일 이사회를 열고 효성화학㈜의 특수가스 사업 부문을 인수하기로 결정했다고 밝혔다. 외부 기관의 적정 평가를 통해 인수가는 총 9200억원으로 정해졌다. 효성티앤씨는 내년 1월 23일 임시주주총회를 열고 인수 안건을 의결할 예정이다. 영업양수도 계약 체결과 함께 자회사(가칭 효성네오켐)를 설립해 내년 1월 말까지 인수 절차를 마무리한다는 계획이다.
2024-12-15,"LG, 120억원 사회복지공동모금회에 기탁","GS그룹 40억원, 효성 8억원 기탁불황 속에서도 기업들의 나눔 행렬이 이어지고 있다.LG는 13일 서울 중구 사랑의열매 회관에서 120억원을 사회복지공동모금회에 기탁하는 이웃사랑성금 전달식을 가졌다고 15일 밝혔다. 전달식에는 김병준 사회복지공동모금회 회장과 하범종 ㈜LG경영지원부문장(사장) 등이 참석했다. 하범종 사장은 “어려운 이웃들이 희망과 용기를 가질 수 있도록 노력하는 것도 기업의 책임 중 하나”라며 “앞으로도LG가 가진 역량을 바탕으로 지속적인 공익사업을 펼쳐 사회로부터 신뢰받는 기업이 되도록 노력할 것”이라고 말했다.LG가 1999년부터 올해까지 25년간 모금회에 기탁한 액수는 약 2400억원에 달한다. 성금은 청소년 교육사업과 사회 취약계층의 기초생계 지원, 주거·교육 환경 개선 등에 쓰이고 있다.LG가 13일 서울 중구 사랑의열매회관에서 이웃사랑성금 전달식을 갖고 120억원을 사회복지공동모금회에 기탁했다. 사진LG이날LG의 기탁으로 서울 종로구 광화문광장의 ‘사랑의 온도탑’ 온도는 3도가량 올랐다. 모금회의 올 연말 모금 목표액은 4497억원으로 목표액의 1%인 약 45억원이 모일 때마다 수은주가 1도씩 상승한다.LG계열사들도 따뜻한 마음을 나누고 있다.LG전자·LG디스플레이·LG이노텍·LG화학·LG에너지솔루션·LG생활건강 등은 사업장 인근 이웃에 김장, 연탄, 생필품, 장학금, 후원금 등을 지원한다.LG유플러스는 협력사와 함께 홀로 사는 어르신을 위해 식료품 등을 담은 ‘사랑의 꾸러미’를 제작해 전달했다.LG계열사들은 임직원이 참여하는 ‘나부터 산타’ ‘나의 직업을 소개합니다’ 등의 공헌 행사도 열고 있다.GS그룹 역시 지난 11일 40억원을 모금회에 전달했다. 2005년부터 올해까지GS가 모금회에 낸 성금은 760억원에 이른다. 허태수GS그룹 회장은 “훌륭하고 지속 가능한 기업이 되기 위해선 공정하고 투명한 경영을 기본으로 사회공헌, 동반성장을 위한 다양한 활동을 실천해야 한다”라며 “기업도 사회적 역할에 솔선수범해야 한다”고 강조했다.지난 13일엔 효성그룹이 모금회에 8억원을 기탁했다. ㈜효성과 효성티앤씨㈜, 효성중공업㈜, 효성화학㈜ 등 4개 회사가 참여했다. 조현준 효성 회장은 “기업의 사회적 책임을 실천하며 함께 나누고 성장하는 사회를 위해 노력하겠다”라고 밝혔다."
2024-12-16,"LG 120억, GS 40억…이웃 향한 나눔 행렬","불황 속에서도 기업들의 나눔 행렬이 이어지고 있다.LG는 지난 13일 서울 중구 사랑의열매 회관에서 120억원을 사회복지공동모금회에 기탁하는 이웃사랑성금 전달식을 가졌다고 15일 밝혔다.LG가 1999년부터 올해까지 25년간 모금회에 기탁한 액수는 약 2400억원에 달한다. 성금은 청소년 교육사업과 사회 취약계층의 기초생계 지원, 주거·교육 환경 개선 등에 쓰이고 있다.LG전자·LG디스플레이 등LG계열사들도 사업장 인근 이웃에 김장, 연탄, 생필품, 장학금, 후원금 등을 지원한다.GS그룹 역시 지난 11일 40억원을 모금회에 전달했다. 2005년부터 올해까지GS가 모금회에 낸 성금은 760억원에 이른다.허태수GS그룹 회장은 “훌륭하고 지속 가능한 기업이 되기 위해선 공정하고 투명한 경영을 기본으로 사회공헌, 동반성장을 위한 활동을 실천해야 한다”고 강조했다.지난 13일엔 효성그룹이 모금회에 8억원을 기탁했다. ㈜효성과 효성티앤씨㈜, 효성중공업㈜, 효성화학㈜ 등 4개 회사가 참여했다.같은 날BNK금융그룹도 부산 사회복지공동모금회에 어려운 이웃을 위한 특별성금 1억원을 후원했다."
