date,title,content
2024-12-14,"효성그룹, 연말 맞아 이웃 사랑 성금 8억원 기탁","효성그룹이 연말을 맞아 이웃 사랑 성금 8억원을 사회복지공동모금회에 기탁했다고 13일 밝혔다. ㈜효성, 효성티앤씨, 효성중공업, 효성화학 4사가 참여했다. 조현준 효성 회장은 “기업의 사회적 책임을 실천하며 함께 나누고 성장하는 사회를 위해 노력하겠다”고 했다."
2024-07-01,"HS효성 출범, 계열 분리 수순… 조현준·조현상 ‘독립 경영’","HS효성 공식 출범을 앞둔 지난달 27일, 조현상(첫째 줄 오른쪽 둘째)HS효성 부회장이 출범 기념행사로 효성그룹 본사에서 직원들과 타운홀미팅을 갖고 셀카 촬영을 하는 모습. /HS효성효성그룹의 신설 지주사HS효성이 1일 공식 출범했다.HS효성은 고 조석래 명예회장의 삼남인 조현상 부회장이 이끄는 지주사로 지난 14일 주총에서 설립안이 승인됐다.HS효성은 이날부터 장남 조현준 회장이 이끄는 기존 지주사인 (주)효성과 인사·재무 조직을 분리해 독립 운영하며 사실상 계열 분리 수순을 밟게 됐다.HS효성은 회사 슬로건을 ‘가치 또 같이’로 정하고 출범 기념 행사로 ‘봉사활동’과 ‘임직원 타운홀 미팅’을 진행했다고 30일 밝혔다. 지난 27일 조현상HS효성 부회장은 서울 마포구 효성그룹 본사에서 임직원 타운홀미팅을 갖고 온·오프라인으로 참석한 전 세계 임직원 1000여 명으로부터 질의 응답을 받았다. 28일에는 조 부회장과 임직원 30여 명이 경기 여주의 장애인 스마트팜 푸르메소셜팜을 찾아 발달장애 청년들과 함께 농작물을 수확·가공·포장했다.HS효성은 초대 대표이사로 조 부회장과 안성훈 효성중공업 부사장을 선임했다.HS효성은HS효성첨단소재·HS효성인포메이션시스템·HS효성토요타 등을 담당한다. ㈜효성은 효성중공업·효성티앤씨·효성화학 등 그룹의 기존 주력 사업을 담당한다."
2024-06-15,효성 2개 지주사로 내달부터 독립 경영,"효성그룹이 오는 7월 1일부터 지주회사 2개 체제로 재편돼 조현준·조현상 형제가 각각 ‘독립 경영’에 나선다.효성은 14일 오전 서울 마포구 효성 본사에서 열린 임시 주주총회에서 신설 지주회사를 포함한 분할 계획 승인 안건이 원안대로 통과했다고 밝혔다. 효성은 앞서 지난 2월 이사회에서 효성첨단소재 등 6사에 대한 출자 부문을 인적분할해 신규 지주회사를 설립하기로 결의했다. 신설 지주회사 이름은HS효성이고 조현상 부회장이 대표이사로 내정됐다.다음 달부터 조현준 효성 회장이 기존 지주회사인 ㈜효성과 효성티앤씨, 효성중공업, 효성화학을 맡고, 조현상 부회장은 신설 지주회사HS효성과 효성첨단소재를 이끌게 된다. 그간 ‘형제 경영’으로 그룹을 이끌어 온 조현준 회장과 조현상 부회장이 사실상 독립 경영에 나서고, 향후 계열 분리로 이어질 것이라는 전망이다."
2024-06-14,"효성, ‘2개 지주사 재편’ 주총 승인…조현준·조현상 사실상 ‘독립 경영’","효성그룹이 2개 지주회사 체제로 재편하며 조현준·조현상 형제의 사실상 각각 ‘독립 경영’으로 운영된다.효성은 14일 오전 서울 마포구 효성빌딩에서 열린 임시 주주총회에서 신설지주를 포함한 분할계획 승인 안건이 원안대로 승인됐다고 밝혔다.서울 마포구 공덕동 효성 본사. /조선일보DB효성은 앞서 지난 2월 이사회에서 효성첨단소재를 중심으로 효성인포메이션시스템(HIS), 효성토요타 등 6개사에 대한 출자 부문을 인적분할해 신규 지주회사를 설립하는 분할 계획을 결의했다. 신설법인의 명칭은HS효성으로 정했고, 조현상 부회장을HS효성 대표이사로 내정했었다.이날 승인에 따라 오는 7월 1일부터 효성은 기존 지주사인 ㈜효성과 신설 지주사HS효성 등 2개 지주사 체제로 재편된다. 조현준 효성 회장이 기존 지주회사인 ㈜효성과 효성티앤씨, 효성중공업, 효성화학을 맡고, 조현상 부회장은 신설 지주인HS효성과 효성첨단소재를 이끈다. 이번을 계기로 그간 ‘형제 경영’으로 그룹을 이끌어 온 조현준 회장과 조현상 부회장이 독립 경영에 나서고 향후 계열 분리로 이어질 것이라는 전망이 나왔다.김규영 ㈜효성 대표이사 부회장은 이날 주총 인사말에서 “이번 지주사 분할은 그룹의 경영 안정성을 확보하고, 기술혁신 등으로 장기적인 성장과 주주가치 제고에도 긍정적인 영향을 미칠 것으로 기대된다”며 “각 계열사는 전문성 강화와 간소화된 의사결정 체계로 시장의 변화에 빠른 대응이 가능하고, 브랜드 이미지가 제고될 전망”이라고 밝혔다.김 부회장은 이어 “신설지주사HS효성은 모빌리티, 친환경 소재 등 다양한 신사업과 인수·합병(M&A) 등 글로벌 일류 기업으로 성장해 나갈 것”이라며 “회사를 더욱 발전시키고 높은 성과를 이뤄 주주가치를 극대화하는 데 앞장서겠다”고 했다."
2024-05-30,"고 조석래 명예회장 유언대로… 효성 3형제, 골고루 지분 상속받았다","왼쪽부터 조현준 효성 회장, 조현문 전 부사장, 조현상 부회장. /조선일보DB효성그룹 3형제가 고(故) 조석래 명예회장이 남긴 상속 지분을 골고루 상속 받았다. 이는 조 명예회장이 남긴 유언장에 적시된 내용에 따른 것으로 알려졌다.30일 효성 등의 공시에 따르면, 장남인 조현준 효성 회장은 ㈜효성과 효성 티앤씨 지분을 중심으로 상속 받았다. ㈜효성 지분이 22.59%에서 33.03%로 늘었으며, 효성티앤씨 지분은 14.59%에서 20.32%로 늘었다. 효성중공업 지분은 5.84%에서 14.89%, 효성화학 지분은 7.37%에서 12.40%로 증가했다.반면 조현상 부회장은 효성첨단소재 지분만 상속 받아 12.21%에서 22.53%로 늘었다. 조 명예회장의 유언대로 계열 분리를 진행하게 되는 것이다.㈜효성은 7월1일 기존 지주인 ㈜효성과 신설 지주인HS효성으로 인적분할을 추진하고 있다. 분할이 완료되면 조현준 회장은 기존 지주인 ㈜효성과 효성티앤씨, 효성중공업, 효성화학을 맡고, 조현상 부회장은 신설 지주인HS효성과 효성첨단소재를 이끌게 된다.한편, 차남인 조현문 전 부사장에게도 지분이 상속됐다. 효성티앤씨 지분 3.37%, 효성중공업 지분 1.50%, 효성화학 지분 1.26%이다.다만, 효성측은 조현문 전 부사장에게는 아직 지분 상속이 완료된 것은 아니라고 공시했다. 조 전 부사장은 유언장에 따른 상속에 대해 아직 수용 의사를 밝히지 않은 것으로 알려졌다."
2024-05-09,"효성중공업, 세계 최초 100% 수소 연료 발전기 본격 가동","효성중공업은 세계 최초로 수소만을 연료로 전기를 생산하는 수소엔진발전기를 본격적으로 가동했다고 9일 밝혔다.효성중공업은 지난달 중순부터 울산 효성화학 용연2공장에서 1㎿(메가와트) 수소엔진 발전기를 가동하고 있다고 9일 밝혔다. 사진은 효성중공업 수소엔진 발전기./연합뉴스효성중공업이 상용화에 성공한 수소엔진발전기는 울산 효성화학 용연2공장에 설치한 1MW(메가와트) 규모 발전기로 지난 4월 중순 가동을 시작했다. 효성중공업 관계자는 “그간 국내외 기업들이 천연가스, 석탄 등 다른 연료를 수소와 함께 사용하는 수소 혼소(混燒) 발전기를 개발한 적은 있지만, 100% 수소 발전기 상용화는 이번이 처음”이라고 설명했다.효성중공업의 1MW수소엔진발전기는 석탄 발전과 비교해 한 해 이산화탄소를 7000t 더 줄일 수 있을 것으로 예상한다. 우태희 효성중공업 대표는 “수소엔진발전기 상용화 성공은 그동안 효성중공업이 전력기기를 비롯해 수소 충전소 건립 및 운영, 액화 수소 공장 건립 등 수소 사업 부문에서 쌓아온 기술력과 노하우를 결집한 결과”라고 했다."
2023-12-27,효성 정기 임원 인사...신임 임원 8명 등 16명 승진,"효성은 27일 신임 임원 8명 발탁 등 2024년 정기 임원 승진 인사를 발표했다.승진 인사는 총 16명으로 효성기술원 스판덱스 포뮬레이션 개발 및 나이론폴리에스터원사연구 담당 강연수 상무, 효성 재무본부 재무회계 및 세무회계 담당 이창엽 상무, 효성티앤씨 동나이법인 나이론증설 담당 주영돈 상무, 효성첨단소재 신사업 담당 이영준 상무는 전무로 승진했다.신임 임원으로는 ㈜효성 비서실 임상수 상무보, 전략본부 경영전략팀 이강준 상무보 등이 발탁됐다. 여성 임원으로는 효성화학PP/DHPU기획관리팀 강정은PL이 상무보로 승진했다. 효성 관계자는 “철저한 책임의식을 바탕으로 글로벌 역량을 발휘하여 회사 이익 극대화에 기여한 인사들을 대상으로 이뤄졌다”고 설명했다.서울 마포구 효성 본사./조선DB<승진 인사 명단>□ ㈜효성▲전무효성기술원Spandexformulation개발 및 나이론폴리에스터원사연구 담당 강연수재무본부 재무회계 및 세무회계 담당 이창엽▲상무보비서실 임상수전략본부 경영전략팀 이강준□ 효성티앤씨㈜▲전무동나이법인 나이론증설 담당 주영돈▲상무나이론폴리에스터원사PU장 정준재중국 구매 담당 이성수▲상무보철강1PU냉연팀장 김원배□ 효성첨단소재㈜▲전무신사업 담당 이영준▲상무타이어보강재PU강선영업 담당 곽경훈▲상무보베트남법인 섬유타이어코드 공장장 박중곤□ 효성화학㈜▲상무보PP/DHPU기획관리팀장 강정은□ 효성중공업㈜▲상무전력PU변압기 담당 장재성▲상무보전력PU차단기개발 담당 신성철기전PU고압전동기 담당 김재영재무실 자금팀장 송기호"
2023-12-28,[경제계 인사] 효성,▲(주)효성▷전무 강연수 이창엽 ▷상무보 임상수 이강준▲효성티앤씨▷전무 주영돈 ▷상무 정준재 이성수 ▷상무보 김원배▲효성첨단소재▷전무 이영준 ▷상무 곽경훈 ▷상무보 박중곤▲효성화학▷상무보 강정은▲효성중공업▷상무 장재성 ▷상무보 신성철 김재영 송기호
2023-12-14,GS 40억·효성 10억 이웃사랑 성금… 동서·스타벅스·신세계도 동참,"GS는 13일 어렵고 소외된 이웃을 위해 써달라며 연말 이웃 사랑 성금 40억원을 사회복지공동모금회에 기탁했다.GS는 2005년부터 해마다 연말 성금을 기부해왔으며, 올해까지 낸 성금은 총 720억원에 이른다. 효성도 이날 사회복지공동모금회에 이웃 돕기 성금으로 10억원을 전달했다. ㈜효성·효성티앤씨·효성중공업·효성첨단소재·효성화학 5사가 함께 성금을 모았다.동서와 동서식품은 전날 8개 기관에 이웃 돕기 성금 9억700만원을 기탁했다. 스타벅스코리아도 초록우산 어린이재단에 임직원 기부금 등으로 조성한 산타 바리스타 희망 기금 9억3000여 만원을 기부했으며, 신세계인터내셔날은 재단법인 행복한나눔과 사회복지법인 함께하는재단 굿윌스토어에 5억원 상당 의류와 생활용품을 전달했다."
2023-10-27,효성 3분기 영업익 443억원…자회사 실적 개선에 흑자전환,효성첨단소재 탄소섬유 관련 전시부스/효성효성은 연결 기준 올해 3분기 영업이익이 443억원으로 지난해 동기(영업손실 512억원)와 비교해 흑자 전환한 것으로 잠정 집계됐다고 27일  공시했다.매출은 8051억원으로 작년 동기 대비 7.3% 감소했다. 순이익은 155억원으로 흑자로 돌아섰다. 효성 관계자는 “일부 지분법 자회사의 실적 개선에 힘입어 흑자 전환에 성공했다”고 말했다.효성중공업의 영업이익은 946억원으로 작년 동기보다 68.7% 증가했다. 특히 전력PU부문이 미국 생산법인 생산량 증대와 수익성 개선에 흑자로 전환했다. 효성화학은 베트남 공장  가동률 확대로 매출이 늘어 적자 폭이 지난해 3분기 1398억원에서 28억원으로 대폭 줄었다.효성티앤씨는 연결 기준 올해 3분기 영업이익이 506억원으로 지난해 동기(영업손실 1108억원)와 비교해 흑자전환한 것으로 잠정 집계됐다. 매출은 1조 9696억원으로 작년 동기 대비 9.1% 감소했다. 순이익은 59억원으로 흑자로  돌아섰다.
2023-09-11,"효성, 하반기 세자릿수 규모 대졸 신입사원 공채 실시","효성그룹 하반기 신입사원 공개 채용효성그룹은 11일 2023년 하반기 대졸 신입사원 공개 채용을 실시한다고 밝혔다. 지난 상반기에 이어 올해만 두 번째 채용이다.지주사와 효성티앤씨, 효성첨단소재, 효성중공업, 효성화학, 효성인포메이션시스템, 효성굿스프링스 등 6개의 계열사에서 약 200명의 인원을 채용 한다. 효성은 올 상반기에도 약 200명의 신입사원을 채용한 데 이어 하반기 또 대규모 인원을 채용한다. 원래 매년 한번 진행하던 공채를 상·하반기로 나눠서 진행하면서 채용 규모가 2배로 늘어났다.하반기 공채 모집 분야는 크게 6개 부문으로 영업(해외, 국내, 기술, 무역, 물류, 마케팅), 관리(구매, 재무,ESG,신사업, 인사/총무, 홍보), 생산기술(섬유, 화학, 중공업), R&D(섬유, 화학, 중공업, 펌프),IT(시스템 개발,영업,CS), 건설 시공 등 이다.지원서는 11일부터 22일까지 효성 채용홈페이지에서 접수할 수 있다. 지원서 접수 이후 서류 전형, 인적성 시험, 면접, 채용 검진을 거쳐 최종 합격자를 선발한다. 선발된 인원은 2024년 1월에 58기 효성 신입사원으로 정규 입사하게 된다.효성은 이번 채용을 위해 수도권 및 지방 지역에 있는 9개 대학을 대상으로 캠퍼스 리크루팅을 나가 채용 설명회를 진행한다. 채용 지원자들을 위해 9월 15일 온라인 채용 상담회도 운영한다.QR코드를 통해 사전 접수를 하면 누구나 참여 가능하다."
2023-01-31,효성 작년 영업이익 90% 급감...주요 계열사 성적도 부진,"28~30일 독일 뮌헨에서 열리는'ISPO2022'의 효성티앤씨 부스./효성티앤씨지난해 효성그룹 지주사 효성의 영업이익이 90% 급감했다. 주요계열사들도 부진한 성적을 거뒀다.효성은 연결 기준 작년 한 해 영업이익이 649억원으로 전년보다 89.8% 감소한 것으로 잠정 집계됐다고 31일 공시했다. 매출은 3조7193억원으로 전년 대비 5.2% 증가했다. 순이익은 248억원으로 95.4% 줄었다.4분기 영업손실은 138억원으로 전년 동기(영업이익 1453억원)와 비교해 적자 전환했다. 4분기 매출과 순손실은 각각 1조155억원과 257억원이었다. 효성 관계자는 “글로벌 경기 악화 및 수요 둔화에 따른 석유화학 계열 업황 부진으로 지분법 손익 부진이 지속되고 있다”고 설명했다.중공업을 제외한 효성그룹의 주요 계열사들도 영업이익이 감소한 것으로 나타났다.효성화학은 지난해 영업손실 3367억원의 적자를 냈다. 같은 기간 매출액은 2조8786억원으로 14.23% 늘었지만, 당기순손실은 4089억원을 기록했다. 4분기 매출액은 6821억원으로 5.18% 증가했지만 영업손실은 957억원으로 적자가 지속됐다. 이에 대해 효성화학 측은 “주력제품PP(폴리프로필렌)의 원재료인 프로판 가격이 안정세에 접어들면서 지난 분기 대비 적자폭이 줄어들었다”고 설명했다.효성티앤씨도 스판덱스 등 주력 제품의 수요 회복이 지연되면서 지난해 4분기 영업손실 432억원을 기록했다. 전년 4분기와 비교해 적자로 돌아섰다. 효성티앤씨 관계자는 “스판덱스의 경우 수요 회복 지연 영향으로 인한 판매량 감소가 있었다”며 “스판덱스 업황 개선, 공급과잉 둔화 기대, 중국 리오프닝 효과, 친환경 섬유 판매확대 등으로 실적이 개선될 것으로 전망된다”고 했다."
2023-06-07,사우디발 유가 상승 조짐에… 정유화학주 ‘들썩’,"사우디아라비아의 원유 저장 탱크. /연합뉴스사우디아라비아가 대규모 원유 감산을 예고한 여파로 국내 정유·화학주 주가가 오랜만에 기지개를 폈다. 지난 4월부터 줄곧 내림세인 국제 유가가 이번 감산 소식에 꿈틀대자, 유가와 같은 방향으로 움직이는 이들 종목의 주가도 뛴 것이다.석유화학 소재인 에틸렌을 생산하는 대한유화의 주가는 5일 전거래일보다 8.4% 급등한 14만7000원에 마감했다. 효성화학(4.6%)과 롯데케미칼(3.2%) 등 다른 화학 관련주도 강세를 보였다. 또 금호석유(3.1%)나 에쓰오일(1.8%),SK이노베이션(0.9%) 등 정유주 주가도 이날 코스피 상승률(0.5%)보다 큰 폭으로 올랐다.사우디아라비아의 추가 원유 감산 소식이 호재로 작용했다. 감산은 원유 가격 상승을 부르고, 원유 가격이 오르면 통상 석유제품 판매 가격도 같이 뛰어 정유·화학 종목의 수익성이 개선되기 때문이다. 지난 4일(현지 시각) 산유국 협의체인 ‘석유수출국기구(OPEC)플러스’는 사우디가 다음 달부터 한 달간 하루 100만 배럴의 원유 생산을 더 줄일 것이라고 밝혔다. 사우디는 이미 지난달부터 하루당 50만 배럴 규모로 감산 중인데, 감산 규모를 세 배로 늘린다는 것이다.이 소식에 서부텍사스유(WTI) 가격은 5일 장중 전거래일보다 5% 가까이 오른 배럴당 75.06달러까지 치솟았다.WTI가격은 지난 4월 중순 연고점(배럴당 83.26달러)을 기록한 뒤, 경기 침체 우려 등으로 한 달 반 동안 14%가량 떨어진 상태다. 모처럼 반등이었다.조선(造船) 관련주도 같이 들썩였다. 보통 유가가 오르면, 액화천연가스(LNG)의 가격 경쟁력이 높아져LNG를 운반하는 고부가가치 선박인LNG선의 수요가 늘어나기 때문이다. 선박 수요 증가는 조선 업체의 매출을 키운다. 현대미포조선 주가는 5일 전거래일보다 6.2% 뛴 8만1900원에 마감했다. 대우조선해양(5.5%)·HD한국조선해양(5.1%)도 상승했다."
2022-01-11,[경제계 인사] 효성그룹 부회장에 김규영·사장에 손현식 외,"효성그룹 부회장에 김규영·사장에 손현식효성그룹은 지주회사 효성 김규영 대표를 부회장으로, 효성티앤에스 손현식 대표를 사장으로 각각 승진시키는 것을 포함한 총 39명의 임원 승진 인사를 10일 발표했다. 김 부회장은 1972년 효성의 전신인 동양나이론에 입사해 스판덱스와 타이어코드의 세계 1위 도약을 이끌었다. 손 사장은 미국·러시아 등 해외에서 금융자동화기기(ATM) 시장을 개척했다.▲효성▷부회장 김규영 ▷부사장 구명신 ▷전무 이형욱 ▷상무 신동익 임효성 위희경 ▷상무보 김원일 한영성▲효성티앤씨▷전무 심상룡 ▷상무 이정훈 ▷상무보 배재범 정영환 정준재 김상학 차유나▲효성첨단소재▷전무 여예근 ▷상무 박찬 이태정 석병식 ▷상무보 서유석 이병진 홍경선 김영수▲효성화학▷부사장 이천석 ▷상무보 이용호 김후원 권철현▲효성중공업▷부사장 안성훈 ▷전무 배용배 ▷상무 최영식 ▷상무보 조영준 이철훈 박요섭 김세진 김기웅▲효성티앤에스▷사장 손현식▲효성인포메이션시스템▷상무보 이정우▲효성아이티엑스▷부사장 남경환▲에프엠케이▷부사장 김광철"
2022-01-10,"효성 김규영 부회장 승진,  2022년 임원인사 [명단]","김규영 효성 부회장효성은 10일 2022년 정기임원 승진 인사를 단행했다.효성은 지주회사 ㈜효성 김규영 대표이사의 부회장 승진과 효성티앤에스㈜ 손현식 대표이사의 사장 승진 등 총 39명 규모의 승진 인사를 발표했다.이번 인사는 철저한 성과주의 원칙에 따라 이뤄졌다. 특히 △장기화된 코로나 19 등 불안정한 경제 환경 속에서도 사상 최대 실적을 달성하는 등 성장에 기여한 인사들과 △VOC(고객의 목소리, 경청)를 바탕으로 고객 가치 경영을 실현할 수 있는 인사들을 대폭 승진 시켰다.신임 김규영 부회장은 1972년 동양나이론(효성 전신)에 신입사원으로 입사해 언양공장장, 섬유 부문CTO,중국 총괄 사장, 타이어보강재 부문CTO를 역임하는 등 50년 간 효성의 성장을 이끈 산 증인이다. 특히 스판덱스 국내 기업 최초 자체 개발 프로젝트에 참여하는 등 효성의 주력 사업인 스판덱스와 타이어코드의 글로벌 1위 도약을 이끈 대표적인 기술 전문 경영인이다. 특히 김 부회장은 2018년 지주사 체제로 전환된 이후 그룹 지주사 대표이사를 맡으며 안정적인 경영을 해왔다.효성티앤에스 손현식 사장효성티앤에스㈜ 손현식 사장은 미국, 러시아 등 금융자동화기기(ATM) 사업의 글로벌화를 이끌어낸 전문 경영인이다. 지난 1977년 동양나이론에 처음 입사한 이후 효성티앤에스 구미공장장과 금융사업 총괄담당 등을 역임하며 사상 최대 실적을 달성하는 등 사업을 크게 성장 시켰으며, 핀테크 등 다양한 신규 사업을 통해 지속 성장의 기반을 마련했다는 평가를 받았다.<승진 인사 명단>□ ㈜효성부회장 김규영부사장 구명신전무 이형욱상무 신동익상무 임효성상무 위희경상무보 김원일상무보 한영성□ 효성티앤씨㈜전무 심상룡상무 이정훈상무보 배재범상무보 정영환상무보 정준재상무보 김상학상무보 차유나□ 효성첨단소재㈜전무 여예근상무 박찬상무 이태정상무 석병식상무보 서유석상무보 이병진상무보 홍경선상무보 김영수□ 효성화학㈜부사장 이천석상무보 이용호상무보 김후원상무보 권철현□ 효성중공업㈜부사장 안성훈전무 배용배상무 최영식상무보 조영준상무보 이철훈상무보 박요섭상무보 김세진상무보 김기웅□ 효성티앤에스㈜사장 손현식□ 효성인포메이션시스템㈜상무보 이정우□ 효성아이티엑스㈜부사장 남경환□ ㈜에프엠케이부사장 김광철"
2024-11-29,[경제계 인사] 롯데웰푸드 외,▲롯데웰푸드▷전무 배성우▷상무 진헌탁 최인태 최호형 ▲롯데칠성음료▷상무 정용주 ▲롯데지알에스▷상무 이승주 ▲롯데상사▷상무 이세호 ▲롯데쇼핑◇백화점사업부▷전무 김원재▷상무 강우진 윤우욱 정동필◇마트사업부▷상무 신수경 ▲코리아세븐▷상무 문대우 ▲롯데하이마트▷상무 김보경 ▲한국에스티엘▷전무 김진엽 ▲에프알엘코리아▷전무 정현석 ▲롯데케미칼◇기초소재사업▷상무 권조현 김해철 유승용 윤종규◇첨단소재사업▷상무 권기혜 이한수 ▲롯데정밀화학▷상무 윤희용 ▲롯데이네오스화학▷상무 성규철 ▲LCTitan▷상무 장선표 ▲롯데엠시시▷상무 이태환 ▲롯데알미늄▷상무 정창명 ▲호텔롯데▷상무 권정근 ▲롯데건설▷전무 고용주▷상무 강민종 차길봉 한정호 홍상균 ▲롯데렌탈▷전무 김경봉▷상무 이광호 이규필 ▲롯데이노베이트▷전무 김경엽▷상무 이원종 ▲롯데글로벌로지스▷상무 권순근 ▲롯데물산▷상무 신창훈 ▲캐논코리아▷상무 전형준 ▲롯데미래전략연구소▷상무 이승환 ▲롯데바이오로직스▷상무 임태형 ▲롯데지주▷부사장 임성복▷전무 김동하 박왕근 최영준▷상무 변영오 심형섭 장병철▲효성굿스프링스▷부사장 김태형 ▲㈜효성▷전무 이태근 이반석 김용근▷상무A 정성훈▷상무B 정홍주 조부영 ▲효성티앤씨▷전무 안준모 이인덕▷상무A 손해성 장기수 김성수 유소라 유상훈▷상무B 전신우 엄기용 이현호 ▲효성화학▷전무 조성민▷상무A 차경용 김후원 ▲효성중공업▷전무 한상태 이창호▷상무A 이해정 이주은 조현철▷상무B 정재훈 박성원 ▲효성티앤에스▷상무A 이훈 정상윤 김건오▷상무B 차진환
