date,title,content
2023-01-24,효성화학이 찬물 끼얹은 비우량물 시장…‘금리 하락세’ 덕 볼까,"박종식 기자anaki@hani.co.kr회사채 시장이 레고랜드 사태 이전의 온기를 대부분 회복하면서 비우량물을 둘러싼 기대감도 높아지고 있다. 다만 시장에서는 효성화학처럼 실적이 부진한 비우량 기업들의 경우 계속해서 자금 조달에 어려움을 겪을 가능성이 높다고 본다. 향후 시장금리의 안정세가 이어져 비우량물을 향한 투자 열기가 되살아날지 주목된다.24일 금융투자협회 집계를 보면, 회사채(AA-)와 국고채 3년물 간 신용 스프레드(금리 격차)는 지난 20일 1.08%포인트를 기록했다. 레고랜드 사태 직전인 지난해 9월28일(1.09%포인트)보다 0.01%포인트 좁혀진 것으로, 시장이 평가하는 회사채의 신용위험이 그만큼 개선됐다는 얘기다. 레고랜드 사태로 얼어붙었던 회사채 시장이 온기를 대부분 회복한 모습이다. 제2금융권이 발행하는 기타금융채(AA0)와 국고채 간 스프레드도 같은 기간 0.07%포인트 축소됐다.발행시장에서는 우량 등급을 중심으로 투자 열기가 달아오르고 있다. 한국예탁결제원 집계를 보면, 새해 들어 지난 19일까지 발행된 일반 회사채는 총 4조1210억원어치에 이른다. 이 중 사모발행 등을 제외한 3조9700억원은 모두AA-등급 이상의 우량물이었다. 지난 18일 롯데제과(AA0)는 수요예측 흥행에 힘입어 원래 계획했던 물량의 2배에 이르는 3000억원어치 회사채를 찍어냈다.반면 비우량물에 대한 우려 섞인 시선은 여전하다. 특히 효성화학의 전량 미매각 사태가 찬물을 끼얹었다는 분석이 많다. 효성화학(A0)은 총 1200억원 규모의 회사채 발행을 위해 지난 17일 수요예측을 진행했으나 단 한 건의 주문도 받지 못했다. 베트남 투자로 차입금 부담이 커진데다가 비우량물 전반에 대한 투자심리 위축이 계속된 영향으로 풀이된다. 하루 뒤 신세계푸드(A+)가 500억원어치 수요예측을 성공적으로 마무리했지만 긴장감은 여전한 모양새다. A등급 내에서도 차별화가 나타나면서 실적이 부진한 기업들은 미매각을 면치 못할 것이라는 전망이 나온다.증권가에서는 시장금리 안정세의 지속 여부가 관건이라고 본다. 금리 하락세가 계속되면 비우량물로도 온기가 확산될 것이라는 것이다. 우량물 금리가 지나치게 떨어질 경우 투자수익 저하를 우려한 투자자들이 비우량물로 눈길을 돌릴 것이라는 기대도 있다. 최근 우량물 발행 금리는 3%대 후반까지 떨어진 상황이다. 설 연휴 직전 발행 금리가 연 3.85%로 내려온 한국전력공사채권(한전채)이 대표적이다. 금융당국의 비우량물 지원 강화도 기대할 만한 요인이다.다만 실제로 시장금리 내림세가 계속될 가능성은 낮다는 평가가 많다. 최근 하락세를 주도해온 건 한국은행의 연내 기준금리 인하에 대한 기대감이다. 이 기대가 좌절될 경우 금리 반등이 불가피하다는 얘기다. 임재균 케이비(KB)증권 연구원은 지난 20일 낸 보고서에서 “(기준금리 인하에 대한 시장의 기대가) 현실화할 가능성은 낮다고 본다”며 “현 수준의 국고채 금리 하락은 과도하다고 판단한다”고 했다."
2022-10-17,"효성, 기후변화 대응 위한 재무정보 공개 지지 선언","지주사와 4개 계열사 모두 참여조현준 “글로벌 기준 리드할 것”효성. 연합뉴스효성 지주사와 주요 계열사들이 기후변화 관련 재무정보 공개협의체(TCFD·이하 티시에프디) 지지를 선언했다.효성은 “최근 이에스지(ESG) 경영 추진위원회 의결을 통해 기후변화 관련 재무정보 공개협의체 지지를 선언했다”고 17일 밝혔다. 지주사 효성과 효성티앤씨, 효성중공업, 효성첨단소재, 효성화학 등 주요 계열사 4곳이 참여했다.티시에프디는 국제기구인 금융안정위원회(FSB)가 세계 주요 경제국(G20) 요청에 따라 기후 관련 재무정보 공시를 확대하기 위해 만들었다. 금융안정위원회는 2017년 금융기관과 비금융기관 등의 기후 관련 정보에 기초한 자본 이용을 지원하기 위해, 재무보고서를 통해 ‘거버넌스, 전략, 위험관리, 지표와 목표’에 대해 보고하도록 하고 있다. 지난 6월 기준 한국을 포함한 95개 나라의 3400개 이상 기관이 티시에프디 지지 선언에 동참했다.지지 선언 이후 기업과 금융회사 등이 기후위기 관련 정보 공시에 대한 국제적 압력에 대응하기 위한 역량 강화 차원에서 만든 민간 플랫폼 ‘한국 티시에프디 얼라이언스’도 지난 6월 출범했다. 이날 현재 금융회사 19곳, 일반기업 38곳, 기관 2곳 등 59곳이 참여했다. 금융회사로는 케이비(KB)금융지주, 신한금융지주, 하나금융지주, 농협금융지주, 삼성생명, 교보생명, 삼성화재, 미래에셋증권, 삼성증권 등이, 일반 기업으로는 에스케이(SK), 현대자동차, 기아, 케이티(KT), 엘지(LG)화학, 롯데케미칼, 현대중공업 등이 참여했다. 효성은 지지 이후 얼라인언스 가입까지 한 상태이다.조현준 효성 회장은 “환경·사회·지배구조(ESG) 개선을 위한 경영에서도 글로벌 스탠다드를 리드할 것”이라고 밝혔다."
2024-11-28,11월29일 인사,⊙ 국토교통부 ◇과장급 <전보> △공항운영과장 박상민 △철도지하화통합개발기획단장 유삼술⊙ 민주평화통일자문회의 사무처 ◇과장급 <전보> △위원지원국 미주지역과장 서기관 이승봉⊙ 특허청 <승진> ◇과학기술서기관 △산업재산인력과 김준일 △산업재산정보정책과 이주미 △식품생물자원심사과 박영관 △주거기반심사과 이승주 △기초재료화학심사과 김광철△동력기술심사과 김용안 ◇서기관 △상표심사정책과 김완곤 △국제상표심사팀 이준재 △심판정책과 최은림⊙ 한국신문윤리위원회 △이사 이태규⊙ 에스케이증권 <승진> ◇상무 △기업금융1본부장 김진태 △대체투자〃 윤보현 △IT인프라〃 조은아 △리서치센터장 최도연 ◇상무보 △리스크관리본부장 임지정 △압구정PIB센터장 김수한 △스마트금융〃 송귀자 <부장> △ESG지원 김미현 △법인영업 김준한 △Passive영업 박근환 △경영관리 원종훈 <선임> ◇이사대우 △대전PIB센터장 김진국 <보임 변경> ◇부사장 △IB총괄 유성훈 ◇상무보 △1영업본부장 황인극 △2〃 유성호 △경인지점장 김수한 △강남금융센터장 조광희 ◇이사대우 △FICC파생본부장 김승기 △준법감시〃 조정훈 △남양주지점장 김진웅 △전주〃 조은주 △분당금융센터장 서영일 △멀티금융2부장 이호근⊙ 디비자산운용·디비금융투자·디비저축은행 <승진> 디비자산운용 ◇부사장 △관리부문장 최종천 ◇상무 △LDI운용3본부장 이상훈 △채권운용〃 오종록 디비금융투자 ◇부사장 △IB사업부장 황세연 ◇상무 △부동산금융본부장 정동철 △감사실장 김성수 ◇담당 <본부장> △1지역 강지훈 △기업금융1 한철웅 △FAS김대용 △FICC금융 김영창 △IT문만수 △리서치센터장 이병건 <보임> △S&T사업부장 권봉철 상무 디비저축은행 △경영지원실장 임훈재 상무⊙ 효성그룹 ◇전무 △재무본부IR담당 이태근 △커뮤니케이션실CSR담당 이반석 △재무본부 내부회계제도담당 김용근 ◇상무A △지원본부 인사담당 정성훈 ◇상무B △중공업연구소HVDC연구팀장 정홍주 △생산기술센터CAE〃 조부영 효성굿스프링스 ◇부사장 △HGSPU장 김태형 효성티앤씨 ◇전무 △중국 가흥·취저우·닝샤 스판덱스 생산총괄 안준모 △밀라노법인장 이인덕 ◇상무A △터키법인 영업담당 손해성 △경영전략실 경영관리팀 장기수 △홍보담당 김성수 △스판덱스PU섬유마케팅담당 유소라 △〃 구미공장장 유상훈 ◇상무B △가흥화공법인 재무부문 총경리 전신우 △밀라노법인 엄기용 △스판덱스PUDiaper영업팀장 이현호 효성화학 ◇전무 △POK사업단장 조성민 ◇상무A △효성 비나케미칼즈법인PP담당 차경용 △OpticalFilmPU옥산공장장 김후원 효성중공업 ◇전무 △건설PU마케팅담당 한상태 △재무실장 이창호 ◇상무A △준법지원담당 이해정 △웰링턴사업단 총괄매니저 이주은 △피츠버그법인장 조현철 ◇상무B △전력PU전장담당 정재훈 △건설PU공사2팀장 박성원 효성티앤에스 ◇상무A △기술연구소장 이훈 △러시아법인장 정상윤 △NHA〃 김건오 ◇상무B △HFSVINA생산기술팀장 차진환⊙ 롯데그룹 <승진> 롯데웰푸드 △전무 배성우 △상무 진헌탁 최인태 최호형 △상무보 강성택 김미송 권영일 황자영 롯데칠성음료 △상무 정용주 △상무보 신해모 우태식 이주한 롯데지알에스 △상무 이승주 △상무보 김진우 롯데상사 △상무 이세호 △상무보 김세련 롯데쇼핑 백화점사업부 △전무 김원재 △상무 강우진 윤우욱 정동필 △상무보 김동섭 박상우 박준홍 유현권 롯데쇼핑 마트사업부 △상무 신수경 △상무보 김동호 심영석 표정수 롯데쇼핑 e커머스사업부 △상무보 김장훈 정진욱 코리아세븐 △상무 문대우 △상무보 이동은 롯데홈쇼핑 △상무보 김연수 롯데하이마트 △상무 김보경 △상무보 정상국 한국에스티엘 △전무 김진엽 △상무 윤우욱에프알엘코리아 △전무 정현석 롯데멤버스 △상무보 강성진 롯데피플네트웍스 △상무 최인태 롯데베르살리스엘라스토머스 △상무 김해철 롯데케미칼 기초소재사업 △사장 이영준△상무 권조현 김해철 유승용 윤종규 △상무보 김영번 김재호 김주익 김철수 박성준 박성진 박진의 박재선 배지훈 롯데케미칼 첨단소재사업 △부사장 황민재 △상무 권기혜 이한수 △상무보 강태곤 고성욱 안재석 롯데케미칼타이탄 △상무 장선표 롯데정밀화학 △부사장 정승원△상무 윤희용 △상무보 최병욱 황석민 롯데에너지머티리얼즈 △상무보 조성욱롯데이네오스화학 △상무 성규철장선표 △상무보 정재규 롯데엠시시 △상무 이태환 롯데알미늄 △상무 정창명 △상무보 이상엽 호텔롯데 △상무 권정근 △상무보 양재혁 호텔롯데 롯데면세점 △전무 김동하 △상무보 심재우 호텔롯데 롯데월드 △상무보 이해열 롯데건설 △전무 고용주 △상무 강민종 차길봉 한정호 홍상균 △상무보 김명준 김종태 이승환 최정일 롯데렌탈 △전무 김경봉 △상무 이광호 이규필 △상무보 정동주 롯데이노베이트 △전무 김경엽 △상무 이원종 △상무보 김경장 이창윤 이환희 전숭녕 추경일 롯데글로벌로지스 △상무 권순근 △상무보 강병윤 안재용 이용감 롯데캐피탈 △상무보 홍종성 롯데물산 △상무 신창훈 롯데에이엠씨 △상무보 김민영 대홍기획 △상무보 박승규 한근조 캐논코리아 △상무 전형준 △상무보 김희준 롯데미래전략연구소 △상무 이승환 롯데자산개발 △상무보 김정원 롯데바이오로직스 △상무 임태형 롯데지주 △사장 노준형 △부사장 신유열임성복 △전무 김동하 박왕근 최영준 △상무 변영오 심형섭 장병철 △상무보 김민성 박상섭 <보임> 호텔롯데 △부사장 정호석 호텔롯데 롯데월드 △전무 권오상 롯데벤처스 △전무 김승욱 롯데중앙연구소 △상무 윤원주 롯데엠시시 △상무 박경선 롯데지에스화학 △상무 정종식 롯데아사히주류 △상무보 최준영 에프알엘코리아 △상무보 최우제
2024-11-28,11월29일 인사,⊙ 국토교통부 ◇과장급 <전보> △공항운영과장 박상민 △철도지하화통합개발기획단장 유삼술⊙ 민주평화통일자문회의 사무처 ◇과장급 <전보> △위원지원국 미주지역과장 서기관 이승봉⊙ 특허청 <승진> ◇과학기술서기관 △산업재산인력과 김준일 △산업재산정보정책과 이주미 △식품생물자원심사과 박영관 △주거기반심사과 이승주 △기초재료화학심사과 김광철△동력기술심사과 김용안 ◇서기관 △상표심사정책과 김완곤 △국제상표심사팀 이준재 △심판정책과 최은림⊙ 한국신문윤리위원회 △이사 이태규⊙ 에스케이증권 <승진> ◇상무 △기업금융1본부장 김진태 △대체투자〃 윤보현 △IT인프라〃 조은아 △리서치센터장 최도연 ◇상무보 △리스크관리본부장 임지정 △압구정PIB센터장 김수한 △스마트금융〃 송귀자 <부장> △ESG지원 김미현 △법인영업 김준한 △Passive영업 박근환 △경영관리 원종훈 <선임> ◇이사대우 △대전PIB센터장 김진국 <보임 변경> ◇부사장 △IB총괄 유성훈 ◇상무보 △1영업본부장 황인극 △2〃 유성호 △경인지점장 김수한 △강남금융센터장 조광희 ◇이사대우 △FICC파생본부장 김승기 △준법감시〃 조정훈 △남양주지점장 김진웅 △전주〃 조은주 △분당금융센터장 서영일 △멀티금융2부장 이호근⊙ 디비자산운용·디비금융투자·디비저축은행 <승진> 디비자산운용 ◇부사장 △관리부문장 최종천 ◇상무 △LDI운용3본부장 이상훈 △채권운용〃 오종록 디비금융투자 ◇부사장 △IB사업부장 황세연 ◇상무 △부동산금융본부장 정동철 △감사실장 김성수 ◇담당 <본부장> △1지역 강지훈 △기업금융1 한철웅 △FAS김대용 △FICC금융 김영창 △IT문만수 △리서치센터장 이병건 <보임> △S&T사업부장 권봉철 상무 디비저축은행 △경영지원실장 임훈재 상무⊙ 효성그룹 ◇전무 △재무본부IR담당 이태근 △커뮤니케이션실CSR담당 이반석 △재무본부 내부회계제도담당 김용근 ◇상무A △지원본부 인사담당 정성훈 ◇상무B △중공업연구소HVDC연구팀장 정홍주 △생산기술센터CAE〃 조부영 효성굿스프링스 ◇부사장 △HGSPU장 김태형 효성티앤씨 ◇전무 △중국 가흥·취저우·닝샤 스판덱스 생산총괄 안준모 △밀라노법인장 이인덕 ◇상무A △터키법인 영업담당 손해성 △경영전략실 경영관리팀 장기수 △홍보담당 김성수 △스판덱스PU섬유마케팅담당 유소라 △〃 구미공장장 유상훈 ◇상무B △가흥화공법인 재무부문 총경리 전신우 △밀라노법인 엄기용 △스판덱스PUDiaper영업팀장 이현호 효성화학 ◇전무 △POK사업단장 조성민 ◇상무A △효성 비나케미칼즈법인PP담당 차경용 △OpticalFilmPU옥산공장장 김후원 효성중공업 ◇전무 △건설PU마케팅담당 한상태 △재무실장 이창호 ◇상무A △준법지원담당 이해정 △웰링턴사업단 총괄매니저 이주은 △피츠버그법인장 조현철 ◇상무B △전력PU전장담당 정재훈 △건설PU공사2팀장 박성원 효성티앤에스 ◇상무A △기술연구소장 이훈 △러시아법인장 정상윤 △NHA〃 김건오 ◇상무B △HFSVINA생산기술팀장 차진환⊙ 롯데그룹 <승진> 롯데웰푸드 △전무 배성우 △상무 진헌탁 최인태 최호형 △상무보 강성택 김미송 권영일 황자영 롯데칠성음료 △상무 정용주 △상무보 신해모 우태식 이주한 롯데지알에스 △상무 이승주 △상무보 김진우 롯데상사 △상무 이세호 △상무보 김세련 롯데쇼핑 백화점사업부 △전무 김원재 △상무 강우진 윤우욱 정동필 △상무보 김동섭 박상우 박준홍 유현권 롯데쇼핑 마트사업부 △상무 신수경 △상무보 김동호 심영석 표정수 롯데쇼핑 e커머스사업부 △상무보 김장훈 정진욱 코리아세븐 △상무 문대우 △상무보 이동은 롯데홈쇼핑 △상무보 김연수 롯데하이마트 △상무 김보경 △상무보 정상국 한국에스티엘 △전무 김진엽 △상무 윤우욱에프알엘코리아 △전무 정현석 롯데멤버스 △상무보 강성진 롯데피플네트웍스 △상무 최인태 롯데베르살리스엘라스토머스 △상무 김해철 롯데케미칼 기초소재사업 △사장 이영준△상무 권조현 김해철 유승용 윤종규 △상무보 김영번 김재호 김주익 김철수 박성준 박성진 박진의 박재선 배지훈 롯데케미칼 첨단소재사업 △부사장 황민재 △상무 권기혜 이한수 △상무보 강태곤 고성욱 안재석 롯데케미칼타이탄 △상무 장선표 롯데정밀화학 △부사장 정승원△상무 윤희용 △상무보 최병욱 황석민 롯데에너지머티리얼즈 △상무보 조성욱롯데이네오스화학 △상무 성규철장선표 △상무보 정재규 롯데엠시시 △상무 이태환 롯데알미늄 △상무 정창명 △상무보 이상엽 호텔롯데 △상무 권정근 △상무보 양재혁 호텔롯데 롯데면세점 △전무 김동하 △상무보 심재우 호텔롯데 롯데월드 △상무보 이해열 롯데건설 △전무 고용주 △상무 강민종 차길봉 한정호 홍상균 △상무보 김명준 김종태 이승환 최정일 롯데렌탈 △전무 김경봉 △상무 이광호 이규필 △상무보 정동주 롯데이노베이트 △전무 김경엽 △상무 이원종 △상무보 김경장 이창윤 이환희 전숭녕 추경일 롯데글로벌로지스 △상무 권순근 △상무보 강병윤 안재용 이용감 롯데캐피탈 △상무보 홍종성 롯데물산 △상무 신창훈 롯데에이엠씨 △상무보 김민영 대홍기획 △상무보 박승규 한근조 캐논코리아 △상무 전형준 △상무보 김희준 롯데미래전략연구소 △상무 이승환 롯데자산개발 △상무보 김정원 롯데바이오로직스 △상무 임태형 롯데지주 △사장 노준형 △부사장 신유열임성복 △전무 김동하 박왕근 최영준 △상무 변영오 심형섭 장병철 △상무보 김민성 박상섭 <보임> 호텔롯데 △부사장 정호석 호텔롯데 롯데월드 △전무 권오상 롯데벤처스 △전무 김승욱 롯데중앙연구소 △상무 윤원주 롯데엠시시 △상무 박경선 롯데지에스화학 △상무 정종식 롯데아사히주류 △상무보 최준영 에프알엘코리아 △상무보 최우제
2023-12-13,12월14일 알림,"◇ 경기평택항만공사는 경기도, 한국국제물류협회와 함께 13일 한국국제물류협회 연수실에서 ‘더 고른 취업 기회가 넘치고, 더 좋은 변화가 가득한 일자리 창출’을 위한 ‘2023 경기도 해운물류 청년취업아카데미 2차’ 수료식을 했다.◇ 해양수산부는 13일 ‘제17회 장보고대상’ 대통령상에 해운제도 선진화에 힘써 온 한국해운협회를 선정했다. 국무총리상에는 대한민국 대표 해류도를 제작해 중등 교과에서 보급한 박경애 서울대 교수를, 해수부장관상에는 해양 교육자료 개발 등에 힘쓴 박상희 한밭초 교사를 선정했다. 시상식은 14일 로얄호텔서울에서 열린다.◇ 한국추리작가협회는 13일 제39회 한국추리문학상 황금펜상에 박소해의 단편 ‘해녀의 아들'을 선정했다. 황금펜상 후보작과 수상작은 ‘한국추리문학상 황금펜상 수상 작품집 2023'으로 출간된다. 시상식은 오는 16일 한국출판인회의 강당에서 열린다.◇ 대한무용협회는 지난 8일 서울 대학로 아르코예술극장 대극장에서 ‘2023 대한민국무용대상' 결선 경연과 시상식을 열고 대통령상에 최상철현대무용단의 ‘그들의 논쟁'을 선정했다. 문화체육관광부 장관상에는 휴먼스탕스의 ‘돌',한국문화예술위원회 위원장상에는 프로젝트 에스의 ‘광시곡',한국문화예술회관연합회 회장상에는 정형일 발레크리에이티브의 ‘엣지 오브 앵글'을 뽑았다.◇ 지에스(GS)그룹은 13일 연말을 맞아 사회복지공동모금회에 이웃사랑 성금 40억원을 기탁했다.◇ 효성그룹은 13일 사회복지공동모금회의 ‘희망2024나눔캠페인'에 성금 10억원을 기탁했다. 성금 모금에는 효성, 효성티앤씨, 효성중공업, 효성첨단소재, 효성화학 등 5개 사업 회사가 참여했다. 성금은 6·25 참전용사의 주거 안정을 위한 나라 사랑 보금자리 지원 사업, 경력 보유 여성 취업 활성화 지원, 지역 아동센터 영어 교육 지원 등에 쓰인다."
