date,title,content
2024-07-19,"[경제계 인사] 효성티앤에스 대표 최방섭, ITX 대표 홍혜진",효성티앤에스는 신임 대표이사에 최방섭 전 삼성전자 전략마케팅실장을 선임했다고 18일 밝혔다. 효성ITX대표이사엔 홍혜진 ㈜효성IT전략실장이 선임됐다.
2023-05-27,"스타트업 인터뷰, 고피자 임재원, 파두 남이현 이지효, 센트비 최성욱, 베스핀 이한주","뉴스레터 '스타트업'의 2023년 5월 인터뷰 목록. 유료 구독은 링크 클릭.https://page.stibee.com/subscriptions/158656[고피자의 임재원] 한국에 단 하나도 없다는 외식업 몸값 1조원에 도전“피자집이 무슨 스타트업이냐? 이런 시선은 견딜 수 있었어요. 제일 힘들었던 것은 투자심사를 통과하는 일이죠. 심사역이 아무리 고피자의 가능성을 발견해도 투자사의 상급자, 대표님들이 고개를 갸우뚱해요. 한국에서는 외식업으로 성공한 사례가 없으니까요. 어렵게VC나 투자사 대표님들이 고피자의 가능성을 발견했다 쳐요. 그런데 계약서 쓰는 날 투자가 깨진 일도 있어요.LP에서 반대를 한 경우까지 있었고요. 지금까지 딜이 깨진 투자의 90%가 고피자가 피자를 만들기 때문에 불발됐죠. 그럴땐 이런 생각도 했어요. 아, 피자하지 말 것을 그랬나.”고피자는 최근 광화문 인근으로 이사를 왔습니다. 고피자 임재원 대표를 지난주 저녁 7시에 만났습니다. 자연스럽게 본사 1층 고피자 매장에서 임 대표가 피자를 주문했습니다. “새로 업그레이드된 도우를 꼭 먹어봐야 한다”고 합니다. 2호는 페퍼로니 피자, 임 대표는 불고기 피자를 시켰습니다. 최근 도우가 맛있어지면서 원데이 원피자를 하고 있다면서요.쫌아는기자들 시즌1에서 만났던 임재원 대표와 인터뷰는 2021년 3월이었습니다. 2년이 지났습니다. 고피자의 매장은 100호점을 넘겼고, 당시 고피자는 코로나의 한 가운데 해외 점포를 열었던 상황이었습니다. 인도에 점포를 열고도 기계를 보내지 못해 골머리를 앓고 있었죠. 이제 고피자의 인도 점포는 20개를 돌파했고, 곧 해외 매장 50호점 돌파도 눈앞이라고 합니다. 시총 1조원의 벽을 넘긴 적이 없다는 한국 외식업 기업의 벽. 고피자는 유니콘으로 그 벽을 뚫을 수 있을까요.목차입니다.1. “인도 20곳, 싱가포르 20곳.. 올해 해외 매출이 국내 매출 역전한다”2. “도우 맛이 절만, 피자 반죽에만 100억원 넘게 투자한 이유”3. “매출 1등은 매장 2평, 직원 2명 근무하는 판교점... 하루 매출 최대 450만원”4. “고피자의 최종 목적지는 미국.. 나스닥서 누구도 못 넘은 몸값 1조원 외식업 목표”5. “10만명 당 식당 1300개 한국에서 외식업이 어려운 이유, 챗GPT가 넘볼 수 없는 외식 산업”[파두의 남이현 이지효] 나스닥이 아닌 한국 상장하는 이유스타트업의 1년은 적어도 대기업의 3년치, 아니 5년치 변화를 한꺼번에 겪지 않나 싶습니다. 아예 피봇해 다른 기업이 되기도 합니다. 스타트업 인터뷰야말도 ‘신선도’가 가장 중요한 콘텐츠입니다. 자칫 ‘아웃오브데이터’로, 현재의 진짜 모습을 놓칠지도 모릅니다.작년 1월에 만난 파두를 올 5월에 또 만났습니다. 작년 1월에 만났을 때는 막 시제품이 나오는 단계였는데, 1년만에 정말 많은 일이 일어났습니다. 유니콘이 됐고, 하반기 코스닥 상장을 위해 상장 예비심사 청구까지 완료한 상태였죠. 2015년 창업한 파두는 팹리스(반도체 설계) 최초의 유니콘 기업입니다. 베인앤드컴퍼니IT전자 분야 파트너 출신인 이지효 대표와SK텔레콤 융합기술원 반도체 연구원 출신인 남이현 대표가 합심해 세운 스타트업이죠.@인터뷰 마지막에는 2022년 1월의 파두, 그리고 5월의 파두 인터뷰(신문 지면 공개 버전)를 덧붙였습니다. 혹시라도 파두를 처음 접하신 구독자 분들은 ‘레터 익스클루시브 콘텐츠’을 읽기 전에 먼저 ‘공개 인터뷰’ 2편을 보시길 권합니다.-목차입니다.1. “사실 미국 투자 받으려고 돌아다녔다. 당시 미국 분위기는 ‘반도체 재미없다’ 였다”2. “구로공단에서 찾은 반도체 인재... 미국이면 연봉 70만불 인재.. 파두는 올해 4억원 넘게 드린다”3. 한국에 반도체 인재가 없다?... 해외 고객사들은 ‘좋은 제품 만들어줘서 고맙다’4. 인텔 인정받은 국내 반도체 스타트업, 이제SK하이닉스도 납품5. 국내 반도체 첫 유니콘.. “시총 100조 기업과 붙어 이겨보고파”[센트비의 최성욱] 5가지 페인포인트사실 ‘센트비’는 스타트업 동네에선 꽤 알려진 곳입니다. 핀테크 스타트업이기도 했고, 과거 비트코인을 활용한 서비스였던 탓에 주목받기도 했습니다. 불편하고 비싼, 해외 송금 서비스를 혁신하는 스타트업입니다. 그런데 해외 송금 스타트업은 한때 국내에도 셀 수 없이 많았습니다. 말하자면, 센트비는 ‘살아남은 자’입다. 이번 인터뷰는 최성욱 대표의 눈에 띄는 외모의 이유와 같은 질문과 답변은 없습니다. 오직, 센트비란 스타트업이 풀고 싶었던 숙제와 현재 상황, 그리고 살아남은 이유에만 집중합니다. 센트비의 5가지 페인포인트입니다. ‘외환 환전과 송금의 세계’를 최 대표가 보여드립니다.-목차입니다.1. ‘은행으로 2억 송금하면 수수료 300만원.... 센트비는 100만원’2. 풀링과 프리펀딩... ‘프리펀딩은 성장과 도태의 지점’3. 센트비를 센트비로 키운 비밀, 넷팅의 개념4. 중소기업과 스타트업을 위한, 환리스크 헤지5. 미국엔 3분기에 진출[베스핀글로벌의 이한주] 투자 유치 노하우의 공유 “물고기가 많은데로 가라. 누구보다 빨리 가라”90분의 인터뷰 동안, 85분간 베스핀 글로벌의 전략을 들었지만, 기억에 남은 문장은 중간에 잠깐 5분 동안 등장한 말들입니다. 이한주 베스핀글로벌 창업가는 “그 사이클이 옵니다. 지금이 스타트하기에 좋은 때입니다. 아무도 모르니까, 아무도 전문가가 아니니까, 지금 내가 손 들고, ‘내가 생성AI의 이런 분야 전문가가 되겠다’고 하면, 바로 그 사람이 전문가가 될 겁니다. 남보다 공부 열심히 하고 더 많이 시도하니까요.”라고 말합니다.다들 고통받는 지금이기에 이 표현이 더욱 강렬하게 기억에 남았을 겁니다. 이한주 베스핀글로벌 창업자와의 첫 인연은 6년 전입니다. 2017년 7월에 보내온 보도자료를 받고 단신을 썼습니다. 내용은 이랬습니다.<클라우드(가상공간)용 소프트웨어업체 베스핀글로벌이 중국과 국내 벤처캐피털업체에서 170억원의 투자를 유치했다고 밝혔다. 투자에는 중국레전드캐피털과 국내 프리미어파트너스, 알토스벤처스, 효성ITX등이 참여했다. 기업가치는 1700억원을 인정받았다. 2015년 12월 설립된 베스핀글로벌은 기업들이 클라우드서비스를 활용할 때 필요한 소프트웨어를 공급하는 회사다. 베스핀글로벌의 이한주대표는 “서울·베이징·상하이에 사무실을 두고 국내외기업 150여 곳을고객사로 확보했다”고말했다.>스타트업의 열풍에 올라탄, 스타트업 한 곳으로 보였습니다. 이한주 대표를 직접 만나곤, 백전노장임에 놀랐습니다. 연쇄창업자인데, 엔지니어 베이스라기보다는 비저너리에 가까웠습니다. ‘파도를 탈 줄 아는 사람’이란 느낌이랄까요. 2015년에 법인 설립한 베스핀글로벌은 2016년 9월에 ‘옵스나우’라는 프로덕트를 내놨습니다. 흔히 말하는 ‘클라우드MSP’입니다. 당시는 흔한 표현이 아니었습니다. 클라우드는 당시로는 ‘챗GPT’만큼이나, ‘여하간 세상을 바꿀 무언가’로 통하던 시기입니다.스타트업 혹한기인 작년 12월에 1400억원 투자 유치 소식을 알렸습니다. 중동의 e&엔터프라이즈에서 시리즈C를 받았습니다. 베스핀글로벌 이한주 대표에게 ‘스타트업 혹한기를 맞닥뜨린, 후배 창업가에게 할 조언’,‘투자 유치, 어떻게 접근할지’를 먼저 물었습니다.그는 조언할 자격 있습니다. 중동까지 달려가서 투자를 받았기 때문만은 아닙니다. 이 대표의 첫 창업은 1998년입니다. 미국 시카고대 생물학 대학원에서 유전자 치료를 전공하다가 그만두고 ‘호스트웨이’라는 웹호스팅 업체를 창업했습니다. 그의 표현대로, “뭔지 모르지만 인터넷은 세상을 바꿀 존재라는건 다들 알던 시절”이었습니다. 창업 15년만인 2013년 미국 사모펀드에 5억달러를 받고 매각했습니다. 스파크랩이란 액셀러레이터를 운영하며, 꽤 많은 스타트업에 투자하고 있습니다. 무엇보다 2015년에 다시 창업의 길을 택했습니다.-목차1. “접을꺼면 빨리 접자.AI라는 럭비공이 어디로 튈지 모르지만 새로운 기회가 왔다.”2. 해외 시장 타깃은 미국... 미국 중견기업 시장에선 베스핀이 수퍼맨인 이유3.SK텔레콤과 베스핀은 그동안 무슨 일을 했을까4. 클라우드MSP에서AIMSP의 가능성...”5개월동안 메달렸다...챗GPT,이거 안 하면 우리도 망한다”5. 챗GPT로 개발해보니... 그 귀찮은 ‘주석’을 달아준다6. 인수합병은 추진한다...대상은 자신만의 데이터가 있는 곳7. 3년내IPO하겠다..꿈은 엑센추어보다 큰 회사.. “죽을때까지 하자”가 목표"
2023-10-25,[강찬호 논설위원이 간다] 사기 고발한 업체 다시 찾는 코미디 같은 정부 용역,"맹점투성이 정부 조달·용역 체계강찬호 논설위원하청회사를 사기 혐의로 민·형사 고발한 기업이 그 회사에 계속 하청을 주는 경우는 상상할 수 없다. 그러나 정부기관에선 이런 일이 자주 일어난다. 법규·제도의 허점과 하청업체의 ‘독점적’ 위치 때문이라지만 국민 눈높이에선 납득하기 어렵다. 올해 국세청 국정감사에서 제기된 의혹 사례를 통해 맹점을 짚어본다.형사고발 해놓고는 용역계약 체결국세청은 최근 한 용역업체와 전체 규모가 485억원에 달하는 정보화 사업 계약을 체결했다. 문제는 이 업체가 인건비를 부풀려 대금을 과다 청구한 혐의로 국세청이 조달청에 신고했을 뿐만 아니라 민사소송과 형사고발까지 한 곳이라는 사실이다. 이런 사실은 국민의힘 송언석 의원(재선·김천)에 의해 밝혀졌다.‘부정당’ 제재 받고도 수주 참가가처분 소송으로 자격 유지 꼼수고발해놓고 할 수 없이 수의계약“정부 조달 방식 시급히 개선해야”김창기 국세청장이 지난 10일 국세청 국정감사에서 답변하고있다. 김 청장은 지난해 국감에서 유플러스아이티에 대해 국세청이 사기 혐의로 형사고발했다고 밝힌 바 있다. [뉴시스]송 의원에 따르면 국세청은 지난해 1월 7일 용역비 20억4000만원을 과다청구한 혐의로 홈택스 상담 수탁업체인 유플러스아이티와 효성ITX를 ‘불공정 조달 행위’로 조달청에 신고했다. 이에 따라 2022년 12월 8일 조달청은 유플러스아이티를 ‘부정당 업자’로 지정했고, 업체는 이에 불복해 행정소송이 진행 중이다.이어 국세청은 지난해 6월 30일 유플러스아이티에 대해 17억1000만원, 효성ITX에 대해 6000만원 등 과다청구한 용역비 17억7000만원을 배상하라는 소송을 제기했다. 이뿐 아니다. 송 의원에 따르면 국세청은 지난해 8월 25일 유플러스아이티에 대해 가압류 조치를 했고, 지난해 10월 11일엔 형사고발까지 했다. “퇴사자의 퇴사일자를 바꿔 결원 비율을 허용 범위 안에 있는 것처럼 조작한 혐의는 사기죄 고발감”이란 법무 조언을 받은 결과였다.그러나 국세청은 지난해 1월 불공정 행위 신고를 한 이후 지난 5월까지 1년 4개월 동안 유플러스아이티와 사업 8건을 계약했다. 전체 계약액은 485억7268만원에 달한다는 것이 송 의원의 지적이다. 이 중 7건이 수의계약이었다. 또 총액이 126억원에 달하는 3건의 계약은 국세청이 민사소송을 제기한 이후 체결됐다고 송 의원은 지적했다. 다만 복수 업체들이 공동 수주한 사업들이라 유플러스아이티만의 계약액은 203억원 선으로 집계됐다.업체는 “인건비 부풀린 적 없다”유플러스아이티 고위 관계자에게 물었다.Q : 신고당한 뒤에도 8건을 국세청에 수주했다는 지적이 맞나.A :“거의 맞다. 다만 우리가 수주한 사업액은 전체액(485억원)의 3분의 1선이다. 또 지난해 수주한 사업은 그 전해에 체결됐고, 올해 수주한 사업은 2건뿐이다. 국세청 발주 사업은 성격상 전문업체를 써야 하는 점도 고려해 달라.”Q : 콜센터 근무 인원을 부풀린 의혹도 있는데.A :“아니다. 전체 인원의 5% 이내에선 결원이 돼도 인정이 된다. 또 상담 업무는 난이도가 높아 6주간 교육받은 뒤 투입되는데, 교육받는 이들을 근무자로 인정할 필요성도 고려해야 한다.”Q : 휴직자의 아이디를 도용해 유령 근무자를 만들어 대금을 청구했다는 의혹은?A :“오해다. 교육받는 도중에 나가는(휴직하는) 이들이 있는데 아이디 부여 절차가 까다롭다 보니 신규 충원자에게 휴직자 아이디를 임시로 쓰게 한 것뿐이다.”국세청 “우리도 답답”국세청 관계자에게 물었다.Q : 민사소송에다 형사고발까지 한 업체와 계약을 이어간 이유는.A :“문제의 사례들은 1개 업체(유플러스아이티)만 단독 응찰해 연속 유찰된 것이다. 이러면 국가계약법에 따라 단독 응찰한 업체를 외부 위원들이 평가해 적합하다고 판정되면 수의계약을 하게 된다. 이 과정은 조달청이 맡고, 국세청은 관여할 수 없다.”국세청이 유플러스아이티를 불공정 행위로 조달청에 신고한 지 열흘여만에 해당 업체가 “사업에 적합하다”는 평가 결과를 조달청에 보낸 공문. [사진 송언석 의원실]Q : 유플러스아이티를 불공정 행위자로 조달청에 신고한 지 열흘 만에 그 업체가 ‘사업에 적합하다’는 공문을 조달청에 보냈다. 코미디 아닌가.A :“우리도 답답하다. 그러나 현행 법규상으론 조달청에 신고해도 ‘부정당 행위’란 판정이 나기 전엔 응찰을 제한할 방법이 없다. 또 부정당 행위로 판정이 나도 해당 업체가 집행정지 가처분 신청을 내면 법원이 인용하는 경우가 많아 업체의 응찰권은 유지된다. 유플러스아이티도 판정 난지 며칠 만에 가처분이 인용돼 응찰권이 유지돼왔다.”Q : 응찰을 제한할 다른 방법은 없나.A :“조달청과 업체 간에 진행 중인 행정소송이 유일한 해법이다. 단, 조달청이 이겨야만 응찰이 제한될 수 있다. 게다가 재판 완료까지 시간이 꽤 걸릴 것이다. 국세청이 제기한 민·형사 소송도 응찰을 제한하는 효과는 없다.”Q : 유플러스아이티만 단독 응찰해 수의계약이 불가피했다는 건데 대안이 없나.A :“국세청도 경쟁을 유도하려고 많이 노력했다. 그러나 문제의 사업은 세법이 바뀔 때마다 그 내용을 시스템에 반영하는 것인데, 세법이 어렵다 보니 전문성이 요구된다. 게다가 관련 업체가 워낙 소수다 보니 수의계약이 이어진 듯하다. 국세청뿐 아니라 정부기관 대부분이 하청업체와 관련해 이런 문제점을 안고 있다. 조달청이 관련 법규를 개정하거나 불공정 업체 신고 판정 기간을 단축하는 등 개선책 논의에 나섰으면 한다.”송언석 “부정당 업체 규제강화 해야”국회에서 질의중인 송언석 국민의힘 의원(재선, 김천)이번 국세청 사례는 ‘빙산의 일각’이다. 지난 6년간 조달청으로부터 부정당업자 제재를 받은 기업들이 집행정지 가처분을 받아낸 뒤 정부 사업 입찰을 따낸 계약 액수가 2조8000억원을 넘는다고 더불어민주당 한병도 의원(재선·익산을)이 조달청 국감 자료를 인용해 밝혔다.이에 따르면 부정당 제재를 받은 기업이 집행정지 기간 중 국가사업을 따낸 금액은 2018년 708억원, 2019년 2876억원, 2020년 8157억원, 2021년 9553억원, 2022년 5045억원, 2023년(6월까지) 2157억원 등 6년간 총 2조8496억원으로 집계됐다. 그중 상위 5개사의 비중이 48.2%(1조3749억원)에 달했다고 한다. 이들이 집행정지 기간 중 따낸 계약은 200건에 달한다.A사는 3년 5개월의 집행정지 기간 중 총 50건의 입찰에 참여하여 5432억원 상당의 계약을 체결했고, B사도 2231억원 규모의 계약을 취했다. C사(22건, 2107억원)와 D사(92건, 2050억원), E사(29건, 1929억원)도 집행정지 기간 중 2000억원 내외의 계약을 따냈다.한 의원은 “조달청 제재를 받아도 법원의 가처분이 인용되면 즉각 응찰 자격이 생긴 결과”라며 “조달청의 부정당 업자 제재가 무용지물이 된 것이나 다름없다. 조달청은 입찰 제한 강화 등 법령을 개정해야 할 것”이라고 했다.송언석 의원에 따르면 2018~2022년 5년간 부정당업자로 제재받은 2130건 가운데 집행정지를 신청한 건수가 601건인데, 인용된 건수가 480건으로 인용률이 81.2%에 달한다. 하지만 조달청과 제재 업체 간 진짜 싸움인 행정소송에선 조달청의 승소가 298건, 패소가 90건으로 승소 건수가 3배 이상 많은 것으로 나타났다. 결국 부정당 행위가 법정에서 최종 인정되더라도 재판 완료까지 상당한 시간이 걸리는 점을 악용해 일단 집행정지 가처분만 인용되면 응찰을 계속해 정부 사업을 따내는 기업들이 상당하다는 얘기다.송 의원은 “게다가 조달청이 최종판결에서 승소하더라도 이미 낙찰받은 사업에 대해 계약을 취소하거나 제재를 가하는 것은 어려운 것도 문제”라며 “부정당 행위가 최종 확정된 업체를 제대로 규제할 대책 마련이 시급하다”고 했다.조달청 “수의계약 논란 해소 추진”이와 관련해 조달청은 일단은 유찰사업의 수의계약 논란부터 해소한다는 입장이다. 조달청은 24일 ‘조달평가 공정성·전문성 제고 방안’을 추진한다고 밝혔다. 조달청 관계자는 “단일업체의 응찰로 인해 유찰된 사업은 그동안 수요기관(정부기관)이 무작위로 선정한 평가 위원들이 해당 단일 업체의 적합성을 평가해왔지만 전문성 부족 및 유착 의혹 등으로 애로가 많았다”고 말했다. 이 관계자는 “이 문제 해결을 위해 조달청이 전문성과 투명성을 갖춘 평가 대행 서비스를 이달 말부터 제공할 것”이라고 했다. 그는 “기업은 온라인으로 사업 계획을 발표하고, 평가위원은 평가집행자의 감독하에 대면 회의로 이를 평가하도록 해 투명성을 높일 계획”이라고 말했다."
2024-02-23,"‘형제 경영’ 효성, 조현준·조현상 독립 체제로…계열 분리 전망도","서울 마포구 효성그룹 본사. 연합뉴스형제 공동 경영 체제였던 효성그룹이 지주사를 신설하며 조현준 회장과 조현상 부회장 각자 독립 경영하는 체제로 전환한다. 재계는 조만간 계열 분리 절차도 시작될 것으로 예상했다.효성그룹 지주사인 ㈜효성은 23일 이사회를 열고 신규 지주회사 ‘효성신설지주’(가칭)를 설립하는 안건을 의결했다. 효성첨단소재·효성인포메이션시스템·효성홀딩스USA·효성토요타·비나물류법인(베트남)·광주일보 6개사에 대한 출자부문을 인적분할하는 방식을 통해서다.신설 지주사는 효성가(家) 삼남인 조현상 부회장이 맡는다. 효성티앤씨와 효성중공업·효성화학·효성ITX·효성TNS·FMK등이 남는 ㈜효성은 장남 조현준 회장이 이끈다. 분할 비율은 순자산 장부가액 기준으로 효성이 0.82%, 효성신설지주가 0.18%다. 분할 시 존속법인 효성의 매출 규모는 약 1조8000억원, 신설지주회사의 매출은 약 1조6000억원으로 추정된다.조 부회장과 함께 안성훈 효성중공업 부사장이 신설 지주사의 사내이사 겸 각자 대표이사를 맡는다. 신덕수 효성 전무도 사내이사로 합류한다. 사외이사에는 권오규 전 부총리 겸 재정경제부 장관, 오병희 전 서울대병원장, 이상엽 카이스트 부총장, 김진수 툴젠 고문을 내정했다.왼쪽부터 조현상 부회장, 조석래 명예회장, 조현준 회장. 사진 효성효성이 형제 공동 경영 체제를 구축한 것은 지주사 체제로 전환한 2018년이다. 공동 경영 체제이긴 했지만 형제의 주력 부문은 이미 분리돼 있었다. 조현준 회장은 섬유·건설·중공업을 책임졌고, 조현상 부회장은 첨단소재를 맡았다. 당시 형제간 경영 갈등의 소지를 없애면서 각자 경영능력을 판단해보려는 부친 조석래 명예회장의 의중이 반영됐다는 분석이 나왔다. 재계 관계자는 “이미 소유지분 차이를 통해 형제간 사업 영역은 사실상 나뉘어 있었다. 이제는 명확하게 계열사를 나눠도 될 시점이라고 조석래 회장이 판단한 것으로 보인다”고 말했다.추후 두 형제가 보유한 각 지주사 지분 정리를 통해 계열 분리와 경영권 완전 독립에 나설 것으로 재계는 예상한다. 현재 조현준 회장과 조현상 부회장은 효성 지분을 각자 21% 보유하고 있다. 형제가 비슷한 지분을 보유한 경우 승계 과정에서 갈등이 발생할 수 있지만, 이번 지주사 신설로 경영권 분쟁 소지가 없어졌다고 재계는 평가한다. 효성이 오는 6월 임시 주주총회를 열어 회사 분할 안건을 승인하면 7월 1일부터 두 개 지주사로 체제가 재편된다.고(故) 조홍제 창업주가 설립한 효성그룹은 2세 경영권 승계 과정에서도 계열 분리를 거쳤다. 1980년 그룹 계열 분리로 기존 효성은 첫째 아들인 조석래 회장이 이어받았고, 한국타이어는 조양래 회장에게 돌아갔다."
