date,title,content
2022-11-15,"상장사 10곳 중 3곳, 이익 10% 이상 추락 ‘어닝 쇼크’","3분기 실적 발표 마무리… “내년 전체 상장사 이익 감소 전망”기업들의 3분기 실적 발표가 마무리되어 가는 가운데 상장사 3곳 중 1곳은 실제 실적이 시장의 전망치에 크게 못 미치는 ‘어닝 쇼크(earningshock·실적 충격)’를 낸 것으로 집계됐다. 올 들어 급격하게 상승한 금리와 글로벌 경기 둔화 등으로 상반기까지 견조한 실적을 내온 기업들도 흔들리는 모습이다./자료=에프앤가이드  그래픽=백형선14일 금융정보 업체 에프앤가이드에 따르면, 이날까지 실적을 발표한 상장사 중 증권사 3곳 이상의 컨센서스(실적 전망치 평균)가 있는 180개 기업 가운데 87곳의 실적이 전망치보다 낮았다. 전망치보다 10% 이상 실적이 나빠 ‘어닝 쇼크’라고 할 만한 기업은 57곳으로 전체의 31.6%에 달했다. 상장사들의 실적 발표는 98%(금액 기준)에 달해 남은 기업들의 실적 발표가 전반적인 분위기를 바꾸지는 못할 전망이다. 전문가들은 내년에도 국내 상장사들의 이익 감소가 있을 것으로 보고 있다.시총 상위도 줄줄이 어닝쇼크전망치에 비해 가장 저조한 실적을 낸 기업은 중견 카메라 모듈 기업 엠씨넥스였다. 이 기업은 3분기 102억원의 영업이익을 낼 것으로 전망됐지만 실제로는 1억원에 그쳤다. 엠씨넥스는 삼성전자에 스마트폰용 카메라 모듈을 공급하는 대표적인 협력사 중 하나로 올해 휴대폰 시장 수요 감소의 직격탄을 맞았다. 삼성전자의 3분기 영업 이익은 10조8520억원으로 전망치보다 8.6% 낮았다.삼성전자를 포함해 시총 상위 기업 중 상당수가 전망치를 하회하는 실적을 기록했다.SK하이닉스는 3분기 영업이익 1조 6556억원을 기록해 전망치를 23.2% 하회했고 현대차(1조5518억원)와 기아(7682억원)는 전망치보다 실제 영업이익이 각각 45.5%, 60,7%씩 낮았다. 카카오(-16%), 포스코홀딩스(-39%),LG전자(-14%) 등도 전망치보다 10% 이상 실적이 나빴다.김재은NH투자증권 연구원은 “반도체 업종의 실적 하향은 4분기에도 지속될 것으로 보이고,SK하이닉스의 경우는 내년에도 연간으로 적자를 볼 가능성이 있다는 전망까지 나오기 시작했다”고 말했다.석유화학업계·증권업계 ‘휘청’증권사 전망치가 3개 미만인 기업까지 범위를 넓히면 전망치 대비 실제 영업이익이 가장 낮은 기업은 효성화학이다. 3분기 영업이익은 전망치가 118억원이었는데 실제로는 1398억원의 영업손실을 봤다. 석유화학 기업들은 올해 대부분 실적이 나빴다. 유가 상승으로 원자재 가격은 오르는 데 반해 상승분을 제품에 반영하지 못했고, 불황 때문에 전반적으로 수요도 하락했기 때문이다. 롯데케미칼은 영업손실 4239억원을 기록해 전망치(-1184억원)보다 2배 이상 손실이 컸고 금호석유화학은 영업이익 2305억원으로 예상치보다 14.8% 낮았다.반면 석유화학 기업 중에서도 전기차 배터리 소재와 태양광 등 미래 먹거리를 키운 기업은 실적이 좋았다. 한화솔루션은 3484억원,LG화학은 9012억원의 영업이익을 기록해 전망치 대비 각각 27%, 5.8% 높았다.지난해 사상 최고의 실적을 기록했던 증권사들의 실적도 불과 1년 만에 무너졌다.NH투자증권은 3분기 영업이익 685억원을 기록해 전망치(1689억원) 대비 괴리율이 -59.4%를 기록했다. 미래에셋(-34.2%), 삼성증권(-17.6%), 키움증권(-5.3%) 등 대형사들이 모두 전망치를 밑도는 실적을 냈다. 주요 증권사들의 지난해 동기 대비 영업이익 증감률은 미래에셋(-62.3%),NH투자(-77.0%), 한국투자(-76.1%), 삼성증권(-57.0%), 키움증권(-44.1%) 등이다. 지난해에는 증권사 5곳이 영업이익 1조원을 넘겼지만 올해는 누적 이익이 3분기까지 8000억원을 넘은 기업이 메리츠증권(8235억원)뿐이다.내년 실적 전망치도 하향 조정기업들의 내년 실적 전망치도 계속 하향 조정되고 있다. 에프앤가이드에 따르면 14일 컨센서스가 존재하는 코스피 상장사 179곳의 내년 예상 영업이익은 총 194조5666억원으로 올해보다 0.16% 적을 전망이다. 순이익은 147조9227억원으로 올해보다 2.56% 낮아질 것으로 전망됐다. 이 전망치는 한 달 전만 해도 각각 213조3558억원과 162조3562억원으로 올해보다 증가할 것으로 예상됐는데 한 달 만에 감소세로 돌아선 것이다.이영원 흥국증권 연구원은 “3분기 전망치에 어긋나는 실적이 발표된 뒤 이익 전망의 급격한 조정이 있었다”면서 “내년에도 둔화가 예상되는 상황”이라고 말했다."
2022-10-26,"기업들 1년내 갚을 돈 532조… LG는 워룸 운영, 현대차는 투자축소","자금줄 마른 대기업 비상 경영체제 돌입LG전자는 다음 달부터 워룸(War-room·전시작전상황실)을 만들기로 했다.TV등 주요 제품 수요 위축의 직격탄을 맞은LG전자는 내년 경영 환경이 더 악화될 것으로 보고 각 사업부와 본사의 핵심 직원들을 모아 경영 현황 점검과 대책 수립에 나서기로 했다. 최근 제주도에서 열린SK그룹CEO세미나 분위기도 심각했던 것으로 알려졌다. 최태원 회장은 이 자리에서 “위기가 올 거 같다. 중국·대만 관계, 북한 핵실험 등 지정학적 요인까지 겹쳐 자금 경색이 더 심해질 수 있다”며 각 계열사CEO들에게 위기 관리 매뉴얼을 준비하라고 강하게 독려했다.레고랜드에서 촉발된 자금 경색이 급속히 확산되자 대기업도 비상이 걸렸다. 주요 그룹들은 올해 급격한 금리 인상 여파가 6개월 뒤 본격화되면 이미 하강 국면으로 접어든 경영 실적이 내년에는 더 고꾸라질 것으로 예상했다. 여기에 더해 시장 자금마저 급속하게 얼어붙자, 계열사별 자금 상황을 일단위로 점검하면서 기업 줄도산이라는 최악의 상황까지 대비하고 있다.사상 최대로 치솟은 기업 단기 차입금워룸 만들고, 투자 줄이고, 단기 자금 끌어 쓰고, 흑자 도산 우려까지포스코그룹은 지난달부터 주요 계열사CFO(최고재무책임자)들이 2주에 한 번 모여 비상경영대응팀 회의를 열고 있다. 환율 움직임이 심상치 않고 금리 인상 폭이 커지자, 계열사별로 재고 자산과 회사채·대출 현황을 주기적으로 점검하고 운용 자금 관리에 나선 것이다. 삼성그룹도 계열사별 회사채 현황 파악에 나섰고, 롯데그룹은 그룹 차원에서 최근 자금 이슈가 발생했던 롯데건설에 대해 자금 운용 상황을 매일 보고받고 있는 것으로 알려졌다.일부 대기업은 대규모 투자 계획을 연기하거나 철회했다. 현대차는 24일 “올해 투자 계획을 연초 9조2000억원에서 대외 변동성 확대에 따른 유동성 관리 차원에서 8조9000억원으로 하향 조정했다”고 밝혔다.SK하이닉스도 최근 4조3000억원 규모의 청주 신규 반도체 공장(M17) 증설 투자를 보류했고, 한화솔루션도 지난달 1600억원 규모의 공장 설립 계획을 철회했다. 재계 관계자는 “지금 같은 금리·자금 상황에선 10~20% 이상의 영업이익률을 보장할 수 없으면 차라리 신규 투자를 하지 않는 것이 낫다”고 말했다.기업들이 긴축 경영에 속속 뛰어들었지만, 지난해부터 최근까지 이어진 저금리 상황에서 1년 안에 갚아야 하는 단기차입금은 이미 역대 최대 규모(지난 6월 말 532조5193억원)다. 작년 말보다 54조3447억원(11.36%) 급증해 통계 작성 이래 최대 증가 폭을 기록했다. 정부가 50조원 이상의 유동성을 긴급 공급하기로 했지만, 기업들 사이에서는 “어림도 없다”는 말이 나오는 것도 이 때문이다. 그동안 시장 자금이 풍부해 여러 가지 사업을 공격적으로 진행했는데, 갑자기 자금 시장이 경색되다 보니 빌려 놓은 대출을 제때 갚지 못하는 ‘흑자도산’이 발생하는 것 아니냐는 우려도 커지고 있다.건설 업계 위기감 최고조… 지방에선 ‘줄도산’ 공포효성그룹 계열사인 효성화학·효성중공업 등 대기업도 회사채 발행이 어려워지자 최근 신용보증기금의 보증을 받아 겨우 자금을 조달했다. 신용보증기금의 프라이머리 채권담보부증권(P-CBO)을 통해 자금을 조달하는 것은 중소기업이나 자금 사정이 열악한 기업이 쓰는 자금 조달 방식이다.건설업계는 위기감이 최고조에 달해 있다. 금리가 올라 자금 조달 비용이 커졌는데 미분양은 가파르게 늘고 있어, 일부 현장에서 부실이 발생하면 연쇄적으로 돈줄이 막힐 수 있기 때문이다. 7000억원대 자금을 계열사 유상증자와 차입으로 조달한 롯데건설 같은 대기업은 그나마 나은 편이지만 지방 건설사 상황은 더 심각하다. 대구에서 아파트를 분양 중인 한 중견 건설사 대표는 “80% 정도가 미분양 상태인데, 해소될 기미가 보이지 않고 있다”며 “대출 연장이 되지 않으면 1년도 못 버틸 것 같다”고 말했다."
2022-11-17,"3高 파도 닥쳤다, 상장사 25%가 적자","3분기 실적 쇼크기업 601곳 중 153곳이 적자작년보다 매출액 늘었지만 영업이익 -26%, 순익 -37%경기도 평택시 포승읍 평택항 수출 야적장에 컨테이너가 쌓여있는 모습./뉴스1지난 3분기(7~9월) 국내 코스피 상장사 601곳 중 153곳(25.5%)이 적자를 기록했다. 적자 기업 153개 중 85개는 2분기부터 적자 상태가 이어진 기업이고,LG디스플레이, 넷마블, 효성화학, 롯데쇼핑 등 68개 기업은 3분기에 새로 적자 수렁에 빠졌다. 코스피 상장사들의 3분기 매출액은 작년보다 늘었다. 물가가 뛰어 제품 가격도 올라갔기 때문이다. 그러나 영업이익과 순이익은 급감했다. 고환율·고물가·고금리의 ‘3고(高)’로 원자재와 인건비, 자금 조달 비용 등 각종 비용이 크게 늘어난 탓에 두 자리대 감소를 기록했다.16일 한국거래소와 한국상장사협의회가 집계한 12월 결산법인 3분기 실적에 따르면, 분석 대상 601개 기업의 연결 기준 매출액은 726조원으로 작년보다 23.4% 늘었다. 이에 비해 영업이익은 39조3666억원, 순이익은 27조6733억원으로 작년 3분기보다 각각 26%와 37.3% 감소했다.사상 최대 손실을 내고 있는 한국전력과 반도체 경기 하강으로 이익이 줄어들고 있는 시가총액 1위 기업 삼성전자를 제외하고 봐도 기업들의 경영 성적표는 빨간불이다. 한전·삼전 두 기업을 제외한 나머지 코스피 상장사들의 3분기 영업이익은 작년보다 6%, 순이익은 26.5% 각각 줄어들었다.기업들이 얼마나 실속을 차렸는지를 나타내는 지표도 일제히 악화됐다. 매출액 대비 영업이익률은 5.42%로 전년(8.05%)보다 크게 감소했다. 매출액 대비 순이익률도 6.3%에서 3.8%로 떨어졌다. 1000원어치를 팔았을 때 1년 전엔 세금과 각종 비용을 제한 뒤 실제 손에 쥔 돈이 63원이었다면, 올 3분기엔 같은 매출을 올려도 실제론 38원밖에 못 남겼다는 얘기다. 환율과 금리 급등으로 원자재 값과 조달 비용이 오르면서 전방위적인 비용 압박이 생기며 본격적으로 기업들을 옥죄기 시작한 것이다.문제는 금리 급등에 따른 경기 침체가 본격화하는 연말과 내년이다. 지금까지는 가격이 올라도 소비를 크게 줄이지 않았다면, 본격적으로 경기가 꺾여 소비 자체가 줄어들면 매출마저 타격받아 더 큰 이익 감소가 우려되기 때문이다."
2022-01-13,[경제계 인사] 대우건설 대표이사에 백정완 외,"대우건설 대표이사에 백정완대우건설은 신임 대표이사로 백정완 주택건축사업본부장(전무)을 내정했다고 12일 밝혔다. 백 내정자는 중흥그룹의 대우건설 인수 절차가 마무리된 후 이사회 의결을 거쳐 정식 선임될 예정이다.효성티앤씨 대표에 김치형효성그룹이 12일 효성티앤씨 대표이사로 김치형 부사장을, 효성첨단소재 대표로 이건종 부사장을 각각 내정했다고 밝혔다. 효성화학 대표인 이 부사장은 효성첨단소재 대표를 겸직한다.▲한국거래소▷시장감시위원장(상임이사) 김근익▷상임이사 양태영▷청산결제본부장(전무) 정석호▲미국육류수출협회▷아시아태평양지역부사장 양지혜▷한국지사장 박준일"
2024-12-13,"[Biz & Now] 효성티앤씨, 효성화학 특수가스 인수",효성티앤씨가 12일 이사회를 열고 효성화학㈜의 특수가스 사업 부문을 인수하기로 결정했다고 밝혔다. 외부 기관의 적정 평가를 통해 인수가는 총 9200억원으로 정해졌다. 효성티앤씨는 내년 1월 23일 임시주주총회를 열고 인수 안건을 의결할 예정이다. 영업양수도 계약 체결과 함께 자회사(가칭 효성네오켐)를 설립해 내년 1월 말까지 인수 절차를 마무리한다는 계획이다.
2024-11-24,삼성발 반도체 부진에…효성화학 특수가스 사업부 매각 무산,"효성화학 울산 공장 전경. 사진 효성화학최근 반도체 업황 부진의 여파로 효성화학의 특수가스 사업부 매각이 무산되면서 특수가스 기업들의 인수합병(M&A)에 관심이 커지고 있다. 효성화학 특수가스 사업부 매출의 상당 비중을 차지하는 삼성전자의 실적 부진이 매각 거래에까지 영향을 미치며 현재SK가 추진 중인SK스페셜티의 매각에도 관심이 모인다.지난 20일 효성화학은 지난 20일 특수가스 사업부 매각 관련 스틱인베스트먼트 및 아이엠엠프라이빗에쿼티(IMMPE) 컨소시엄에 대한 우선협상대상자 선정을 철회했다고 공시했다. 효성화학은 “우선협상대상자와 특수가스 사업 매각 계약 체결을 위한 협의를 진행했으나, 상호 합의에 이르지 못해 우선협상대상자 선정을 철회했다”고 설명했다.━매각 불발되며 다시 원점으로효성화학의 특수가스 부문은 반도체·디스플레이 제조 공정에서 발생하는 이물질을 세척하는 데 쓰는 삼불화질소(NF3)를 생산한다. 효성화학은 생산라인 증설을 통해 지난 1월 가동을 시작한 충북 옥산공장을 포함해 연산 8000톤(t) 규모의 생산시설을 갖추고 있다. 생산량 기준으로 글로벌 1위SK스페셜티, 2위 중국 페릭에 이은 글로벌 3위다.장기 계약으로 수익구조가 안정적인 가스업체는 M&A 시장에서 인기 매물로 통한다. 시장조사기관 마켓인사이트리포트에 따르면 반도체 시장 전반의 성장에 따라 글로벌NF3 시장의 규모가 2022년 14억2430만달러에서 2029년 34억910만달러로 2배 이상 성장할 것으로 예상되는 만큼 시장 전망도 밝은 편이다.하지만 효성화학의 특수가스 부문은 매출의 상당 부분을 삼성전자에 의존하고 있어, 삼성의 실적 부진 영향을 받는 편이다. 내년도 실적 전망도 불투명해지면서 1조3000억원까지 거론됐던 매각가는 계속 하락했다. 5개월간의 협상에서도 가격에 대한 이견이 좁혀지지 않으면서 매각이 불발됐다. 수가스업계 국내 2위인 에어프로덕츠코리아 역시 삼성전자 평택캠퍼스 5공장(P5) 건설 중단 등의 이유로 진행되던 매각 거래가 무산됐다.━효성티앤씨, 인수 검토 중효성화학 측은 “매각을 지속 추진하기 위해 다른 투자자들과 협의를 진행 중”이라는 입장이다. 하지만 자본잠식 위험을 목전에 둔 효성화학에 남은 시간이 많지 않다. 석유화학 업황 부진에 효성화학은 11개 분기 연속 영업손실 기록 중이며 올해만(9월 기준) 누적 1117억원 적자를 봤다. 효성화학의 자본금은 9월 말 기준으로 325억원에 불과하다. 1년 내 갚아야 할 유동부채는 1조3765억원에 달한다. 업계 관계자는 “이번 매각 거래가 진행된 5개월동안에도 수백억의 이자가 발생한 상황”이라고 말했다.효성그룹은 내부 계열사간 매각도 검토하기 시작했다. 화학부문 계열사인 효성티앤씨는 22일 “효성화학으로부터 특수가스 사업부에 대한 인수의향질의서를 수령해 내부적으로 검토 중”이라고 공시했다. 효성 그룹 차원에서도 외부에 헐값 매각하기보단 계열사가 사들여 알짜 투자사업부를 지키면서 효성화학의 유동성 문제를 해결하는 게 나을 수 있다. 하지만 효성화학의 재무부담을 티앤씨가 떠안게 될 거란 우려에 이날 효성티앤씨의 주가는 전일 대비 20.63% 급락한 21만3500원에 마감했다. 효성티앤씨는 “아직 구체적으로 결정된 사항은 없다”고 말했다.━몸값 4조SK스페셜티 매각은M&A 시장의 시선은SK스페셜티로 향하고 있다.SK스페셜티는SK㈜가 지분 100%를 보유한 자회사로, 지난해 매출 6817억원 영업이익 1471억원을 기록했다. 고강도 리밸런싱을 진행하고 있는SK그룹은 특수가스 분야 세계 1위인SK스페셜티를 매각해 현금을 확보하기로 결정, 지난 9월 우선협상대상자에 사모펀드 한앤컴퍼니를 선정했다. 효성화학과 달리SK스페셜티는SK하이닉스를 포함한 그룹 계열사들이 주 고객이라 올해도 수익성이 좋은 편이다. 업계에선 매각이 순조롭게 진행될 것이라는 전망이 많다.SK스페셜티의 기업가치를 4조원대로 추정된다. 다만SK㈜는SK스페셜티의 일부 지분은 계속 보유할 계획이어서, 실제 매각 지분과 금액은 협상 결과에 따라 정해질 예정이다."
2024-08-22,형제간 사고 팔고... 지분 정리에 속도내는 효성家,"효성그룹이 2개 지주회사로 재편하며 조현준·조현상 형제의 독립 경영에 속도를 낸다. 사진은 서울 공덕의 효성빌딩 모습. 연합뉴스효성그룹이 2개 지주회사 체제로 분할한 가운데, 조현준 효성 회장과 조현상HS효성 부회장의 지분 교환이 속도를 내고 있다. 조 회장은 지난 3월 작고한 조석래 효성 선대회장의 장남, 조 부회장은 삼남이다.22일 금융감독원 전자공시시스템에 따르면, 조현준 회장은 최근 3일에 걸쳐 자신이 보유하고 있던 신설 지주사HS효성의 지분 33.03%를 모두 조 부회장에게 넘겼다. 지난 19일 조 회장이 가진HS효성 보통주 일부(36만9176주)를 조현상 부회장의 효성 보통주(40만6459주)와 맞교환했고, 21일엔 남아있던 86만1411주도 블록딜(시간외 대량매매) 방식으로 조 부회장에게 모두 매각했다. 이에 조현상 부회장의HS효성 지분은 55.08%로 늘었다.조 회장은 기존 지주사 효성의 최대주주(42.02%)이지만 조현상HS효성 부회장도 효성 지분 14.06%를 아직 갖고 있어, 형제간 지분 매각은 당분간 계속될 전망이다. 공정거래법상 친족 간 계열 분리를 위해서는 상장사 기준 상호 보유 지분을 3% 미만으로 낮춰야 한다.계열 분리가 마무리되고 있는 만큼, 향후 두 형제의 독자 경영에 관심이 주목된다. 신설 지주사인HS효성은HS효성첨단소재,HS효성인포메이션시스템(HIS),HS효성토요타, 광주일보 등 6개 계열사를 두고 있으며 전체 매출규모는 7조원대다.조현준 효성그룹 회장(왼쪽)과 조현상 부회장(오른쪽)이 1일 서울 중구 롯데호텔에서 열린 한·베트남 비즈니스 포럼에서 팜 민 찐 베트남 총리의 연설을 경청하고 있다. 뉴스1핵심은 매출 3조원대인HS효성첨단소재다. 세계 시장 점유율 1위인 타이어코드(타이어 보강재)를 통해 안정적인 매출을 내고 있고, 최근에는 탄소섬유를 신산업으로 키우고 있다. 탄소섬유는 철보다 무게는 4분의 1수준이나 강도는 10배 높아 태양광 단열재, 항공기 동체 등에 쓰이는 고부가가치 신소재다.HS효성인포메이션시스템(HIS)은AI기반 정보기술(IT) 서비스 기업이다. 최근엔 데이터센터 내 모든 인프라를 가상화하고 소프트웨어로 자동 관리하는 ‘소프트웨어 정의 데이터센터(SDDC)’ 구현과 클라우드 기반 재해 복구 분야에서도 성장세를 이어가고 있다. 조 부회장은 지난달 한 행사에서 기자들과 만나 “지금 우리가 하는 포트폴리오 관련 투자를 계속 할 것”이라고 말했다.조현준 회장이 이끄는 효성그룹의 주력 계열사는 효성화학, 효성중공업, 효성티앤씨 등 9개사로, 화학·중공업·섬유가 주력이다. 전체 매출 규모는 17조원. 글로벌 전략 인프라의 중요성이 커지면서 변압기·차단기·전동기 사업을 하는 효성중공업의 향후 성장성이 주목된다. 효성중공업은 이날 회사가 보유한 빅데이터와AI기술을 활용해 부산대학교와 전력설비 자산관리 및 예방 진단 사업 고도화를 위한 산학협력 협약을 체결했다고 밝혔다.다만 석유화학 업황 영향으로 3년째 적자인 효성화학의 실적 개선은 과제다. 효성 관계자는 “스판덱스·중전기기·화학제품 등 주력 제품을 중심으로 글로벌 신시장 개척에 적극 나서고 바이오·핀테크 등 신사업 육성에 집중할 것”이라고 말했다.한편, 형제들과 갈등한 고 조석래 선대회장의 차남 조현문 전 효성 부사장은 상속 재산으로 공익재단 설립을 준비 중이다. 조 전 부사장은 지난 15일 “조현준 효성 회장 등 공동상속인이 공익재단 설립에 최종적으로 동의했다”며 “계열분리와 이를 위해 필수적인 지분 정리 등에 대해 계속해서 협상을 이어나가기로 뜻을 모았다”라고 밝혔다."
2024-08-23,효성 ‘조·조 시대’…형제 계열분리 거의 끝났다,"효성그룹이 2개 지주회사 체제로 분할한 가운데 조현준 효성 회장과 조현상HS효성 부회장 간 지분 교환이 속도를 내고 있다. 조 회장은 지난 3월 작고한 조석래 효성 선대회장의 장남, 조 부회장은 삼남이다.22일 금융감독원 전자공시시스템에 따르면 조 회장은 최근 3일에 걸쳐 자신이 보유하고 있던 신설 지주사HS효성 지분 33.03%를 모두 조 부회장에게 넘겼다. 지난 19일 조 회장이 가진HS효성 보통주 일부(36만9176주)를 조 부회장의 효성 보통주(40만6459주)와 맞교환했고, 21일엔 남아있던 86만1411주도 블록딜(시간 외 대량매매) 방식으로 조 부회장에게 모두 매각했다. 이에 조 부회장의HS효성 지분은 55.08%로 늘었다.조 회장은 기존 지주사 효성의 최대주주(42.02%)이지만, 조 부회장도 효성 지분 14.06%를 아직 갖고 있어 형제간 지분 매각은 당분간 계속될 전망이다. 공정거래법상 친족 간 계열 분리를 위해서는 상장사 기준 상호 보유 지분을 3% 미만으로 낮춰야 한다.향후 두 형제의 독자 경영에 관심이 주목된다. 신설 지주사인HS효성은HS효성첨단소재·HS효성인포메이션시스템(HIS)·HS효성토요타·광주일보 등 6개 계열사를 두고 있으며 전체 매출규모는 7조원대다. 효성그룹의 주력 계열사는 효성화학·효성중공업·효성티앤씨 등 9개사로 화학·중공업·섬유가 주력이다. 전체 매출 규모는 17조원이다.두 형제와 갈등한 차남 조현문 전 효성 부사장은 상속 재산으로 공익재단 설립을 준비 중이다. 조 전 부사장은 지난 15일 “조현준 효성 회장 등 공동상속인이 공익재단 설립에 최종적으로 동의했다”며 “계열 분리와 이를 위해 필수적인 지분 정리 등에 대해 계속 협상을 이어나가기로 뜻을 모았다”라고 밝혔다."
