date,title,content
2022-03-09,개미 눈치 본다…한주에 5만원 '역대급 배당금' 기업 어디,"주식 차트 이미지. [셔터스톡]본격적인 정기주주총회 시즌을 앞두고 상장사들이 배당금을 크게 늘리고 있다. 동학 개미의 목소리가 커지고, 최근 국내 증시가 휘청거리자 기업들이 주주환원 정책 기조가 보다 뚜렷해지는 모습이다.주요 대기업 중에는 효성그룹이 눈에 띈다. 효성티앤씨는 보통주 한 주에 5만원을 현금 배당할 계획이다. 2020년 주당 5000원에서 10배로 늘렸다. 배당금 총액이 2157억원이다. 주요 상장사 중 주당 배당금이 가장 많이 늘었다. 효성첨단소재도 주당 배당금 1만원을 지급하겠다고 공시했다.효성티앤씨는 스판덱스 수요 급증에 힘입어 지난해 1조4237억원의 영업이익을 기록했다. 재계에선 효성티앤씨의 실적이 좋기도 했지만 조현준 효성그룹 회장과 조현상 부회장의 사내이사 선임 추진과 연결 지어 해석하기도 한다. 효성티앤씨와 효성첨단소재는 오는 17일 주총을 앞두고 각각 조 회장과 조 부회장의 사내이사 선임 안건을 공시했다.다만 여론이 부담이다. 경제개혁연대는 8일 논평을 통해 두 사람의 과거 처벌 전력을 거론하며 “사내이사 후보로 부적절하다. 국민연금 등 기관투자가와 주주들은 해당 안건에 대해 반대해야 한다”고 주장했다.효성 측은 “지난해 효성티앤씨가 순이익이 많이 났기 때문에 배당금을 늘린 것”이라고 설명했다. 오너 일가가 계열사 사내이사로 추가로 나서는 데 대해선 “대규모 설비 증설을 계획하는 등 보다 빠른 결정으로 사업을 키우겠다는 뜻”이라고 말했다.효성. [연합뉴스]금호석유화학은 25일 주총을 앞두고 보통주는 주당 1만원, 우선주는 주당 1만50원으로 역대 최고액의 배당안을 통과시켰다. 전년도의 보통주 주당 4200원, 우선주 주당 4250원 배당과 비교하면 2배 이상 늘렸다.이는 회사 측과 경영권 분쟁 중인 박철완 전 금호석화 상무의 주주제안을 의식한 배당안으로 해석됐다. 박찬구 금호석유화학 회장의 조카인 박 전 상무는 지난달 주주제안을 발송하며 회사 경영에 복귀하겠다는 의지를 밝혔다. 박 전 상무는 금호석화 주식 8.5%를 보유한 개인 최대주주로 특수관계인 지분까지 합치면 10.22%를 갖고 있다. 박찬구 회장은 특수관계인을 포함해 14.9%의 지분을 확보하고 있다.박 전 상무는 보통주 주당 1만4900원, 우선주 주당 1만4950원의 배당을 제안했다. 회사 측은 “이럴 경우 배당금 총액은 4184억원으로 지난 3개년도(2018~2020년) 배당 총액의 2배가 넘는 수준으로, 안정적이고 예측 가능한 수준의 주주환원을 지향하는 회사의 정책과 괴리가 있다”고 반박했다.금호석유화학 지분구조. 그래픽=김영옥 기자yesok@joongang.co.kr지배구조 관련 이슈가 있는 기업도 배당에 적극적이다. 카카오는 주당 53원, 총 230억원을 배당금으로 사용하기로 했다. 설립 후 첫 배당이다. 또 향후 3년간 잉여현금흐름의 15~30%를 재원으로 이 중 5%를 현금배당, 10~25%를 자사주 매입과 소각에 투입하기로 했다. 시장에선 최근 계열사 경영진의 ‘스톡옵션 먹튀’ 논란 이후 주가가 30%가량 하락하자 주주환원 정책을 제시한 것으로 풀이한다.이 밖에도ESG(환경·사회·지배구조) 강화 기조 속에서 지난해 경영 실적이 개선된 기업 등이 배당 확대에 나서고 있다.SK하이닉스는 주당 1540원으로 배당금을 결정했다. 전년 대비해 30% 이상 늘린 액수다. 포스코 역시 배당금을 전년 대비해 두 배 올렸다.기업데이터연구소CEO스코어에 따르면 국내 상장사 중 지난달 28일까지 배당을 발표한 853개사 중 배당금을 전년보다 늘린 기업은 66.6%(568곳)이다. 1조원 이상 배당 기업은 삼성전자와 현대자동차, 포스코, 기아,KB금융,SK하이닉스, 신한지주 등 7곳이다. 지난해엔 삼성전자가 유일했다. 상장사들의 전체 배당금 규모는 40조원을 넘어설 것으로 관측된다.김우찬 고려대 경영학과 교수는 “한국 기업들의 배당 성향은 미국‧유럽‧중국보다 낮고, 낮은 배당 성향은 한국 증시 저평가의 원인 중 하나”라면서도 “주주 입장에서는 세금을 내야 하는 배당보다는 주가 상승을 선호하는 것도 사실이어서 기업은 여러 방향으로 주주환원을 위해 노력해야 할 것”이라고 말했다."
2022-01-30,"유재석 한복, 9만원대 신동빈 회장 운동화…MZ 지갑 연 이유","지난해 12월 전북 전주시 전주사회혁신센터에서 모던한복 브랜드 리슬의 황이슬 대표가 효성티앤씨의 폐페트병 재활용 섬유인 '리젠'으로 만든 한복을 들고 있다. [사진 효성티앤씨]지난해 12월 효성티앤씨는 페트병 재활용 섬유 ‘리젠’으로 만든 한복 10여 종을 공개했다.MBC예능프로그램 ‘놀면 뭐하니’에서 유재석이 입은 한복으로 알려진 모던한복 브랜드 ‘리슬’과 협업하면서다.김용섭 효성티앤씨 대표는 “한복에 페트병 리사이클 섬유를 적용한 것은 새로운 시도”라며 “페트병도 한국 고유의 멋을 살리는 훌륭한 자원이 될 수 있다는 것을 보여줬다”고 자평했다.━페트병으로 만든 재생 섬유 각광다 쓴 페트병으로 만든 재생 섬유가 친환경 바람을 타고 각광 받고 있다. 물건 하나를 사도 환경과 윤리를 생각하는MZ세대(밀레니얼·Z세대)의 가치소비가 불러온 결과다. 지속가능한 제품을 위해 아낌없이 지갑을 여는 소비자가 늘자 석유화학업계도 폐페트병을 활용한 재생 섬유 시장에 잇따라 뛰어들고 있다.효성그룹의 화학섬유 계열사인 효성티앤씨는 지난 2008년부터 페트병을 재활용해 만든 친환경 폴리에스터 섬유를 생산하고 있다. 재활용 폴리에스터 섬유는 폐페트병을 수거해 세척한 뒤 작은 플라스틱 조각으로 파쇄하고 녹여 뽑아낸 실로 짠다. 평균 단가는 일반 폴리에스터 섬유의 약 1.5배 수준이다.━효성티엔씨 리젠, 4년새 판매량 10배 늘어고객이 친환경 폴리에스터 리젠을 소재로 한 의류 제품을 살펴보고 있다. [연합뉴스]그런데도 지난해 효성티앤씨의 리젠 섬유 판매량은 2017년과 비교해 10배가량 늘었다. 최근ESG(환경·사회·지배구조) 경영 기조가 확산하고 친환경 소비에 대한 관심이 커진 덕분이다.효성티앤씨는 직접 친환경 의류브랜드 ‘G3H10’을 선보이고 리젠으로 만든 후드·맨투맨 등을 판매하는가 하면 노스페이스, 플리츠마마, 무신사 등에도 친환경 폴리에스터 섬유를 공급하고 있다. 현대중공업그룹은 오는 6월부터 사업장에 단계적으로 친환경 자원재순환 근무복을 도입하기로 했다. 현대리바트가 리젠 섬유를 활용해 이를 제작할 예정이다.━페트병으로 만든 ‘신동빈 운동화’서울 성동구LAR매장에서 직원이 폐페트병 소재로 만든 운동화를 선보이고 있다.   이 운동화는 롯데케미칼의 플라스틱 자원선순환 사업인 '프로젝트 루프'를 통해 제작된 제품으로, 신동빈 롯데그룹 회장이 평소 자주 신는 제품으로 알려졌다. [연합뉴스]롯데케미칼도 올해부터 폐플라스틱 순환 사업을 위한 ‘프로젝트 루프’ 활동을 본격 시작한다. 롯데케미칼은 지난 2020년부터 시범사업을 통해 페트병을 재활용해 만든 가방, 신발, 재킷, 노트북 파우치 등을 선보였다.지난해 12월에는 플라스틱 장난감을 회수해 재생 소재를 생산하는 코끼리공장, 폐어망으로 재생 플라스틱 원료를 만드는 포어시스 등과 협약을 맺고 이들의 활동을 지원하기로 했다. 최근 신동빈 롯데그룹 회장이 신어 화제가 됐던 9만7000원짜리 친환경 운동화도 프로젝트 루프에 참여한 친환경 사회적 기업LAR의 제품이다.김교현 롯데케미칼 부회장은 “폐플라스틱 이슈는 대기업과 스타트업, 지자체, 시민사회가 함께 해결해야 한다”며 사업 취지를 설명했다.━SK케미칼, 플라스틱 녹여 친환경 원사 생산SK케미칼이 휴비스와 협업해 생산 예정인 화학적 재활용 폴리에스터 원사. [사진SK케미칼]SK케미칼도 화학섬유소재 기업 휴비스와 손잡고 친환경 폴리에스터 섬유 생산에 뛰어들었다. 기존에 생산되던 재생 폴리에스터 섬유는 폐페트병을 물리적으로 분해해 재활용했지만SK케미칼은 폐플라스틱과 중고의류를 고열로 녹여 원료 상태로 되돌린 뒤 폴리에스터 원사를 뽑아낸다.SK케미칼가 화학적 분해를 거친 페트 소재를 휴비스에 공급하면 휴비스가 재활용 폴리에스터 원사 ‘에코에버CR’을 생산하는 방식이다.정재준SK케미칼 신사업개발실장은 “버려지는 플라스틱에 대한 사회적 관심이 늘면서 친환경 소재 여부가 소비자의 구매 결정에 중요한 요소가 됐다”며 “화섬업계가 집중하고 있는 친환경 섬유·의류 시장을 시작으로 화학적 재활용 페트 사업을 확대할 계획”이라고 말했다.페트병 등 플라스틱을 재활용해 만든 재생 폴리에스터 섬유는 전 세계 패션 업계에서도 주목하고 있는 소재다. 지난해 아디다스·갭·바나나리퍼블릭 등 글로벌 패션 기업들은 2025년까지 폴리에스터 섬유 중 재활용 제품의 비중을 45%까지 늘리겠다고 발표했다.양지원 한국무역협회 연구원은 “글로벌 폴리에스터 섬유 시장에서 재활용 폴리에스터 섬유가 차지하는 비중이 2020년 15%에서 2030년 20%로 늘어날 전망”이라며 “정부가 친환경 소재 연구 개발을 적극적으로 지원할 필요가 있다”고 말했다."
2022-03-02,상장사 67% 배당금 늘렸다…3434억 받은 이재용 개인 1위,"이재용 삼성전자 부회장이 아랍에미리트(UAE) 출장을 위해 지난해 12월 6일 오후 서울김포비지니스항공센터를 통해 출국하고 있다.    [연합뉴스]국내 상장사 3곳 중 2곳이 배당 규모를 예년보다 늘린 것으로 집계됐다. 개인별 배당금 순위에서는 이재용 삼성전자 부회장 등 삼성 일가가 1~4위에 올랐다.2일 기업데이터 연구소CEO스코어가 국내 상장사 중 지난달 말까지 배당(중간배당 포함)을 발표한 853개사의 2021년 회계연도 기준 배당금을 조사한 결과다. 배당금을 지난해보다 늘린 기업은 66.6%(총 568곳)로 집계됐다. 2020년(46.2%, 1226곳 중 567곳)보다 20.4%포인트 높아진 수치다.가장 많은 배당금을 받은 사람은 이재용 삼성전자 부회장이다. 삼성물산과 삼성전자, 삼성생명, 삼성SDS,삼성화재 등 5개사에서 총 3434억원을 수령했다. 이어 홍라희 전 리움 관장(1760억원), 이부진 호텔신라 사장(1579억원), 이서현 삼성복지재단 이사장(1268억원) 순이었다.정몽준 아산재단 이사장(1166억원), 정몽구 현대차그룹 명예회장(1094억원), 최태원SK회장(1041억원) 등 3명도 1000억원 이상의 배당금을 받았다.[자료CEO스코어]━기아 배당금 4000억→1조2000억기업별로는 기아가 2020년 4009억원에서 지난해 1조2028억으로 8019억원(200%) 늘어 배당금 증가 폭이 가장 컸다. 이어 포스코(6653억원, 107.3%)와 현대차(5151억원, 65.6%),KB금융(4559억원, 66.1%), 우리금융지주(3944억원, 151.7%)가 배당금 증가액 ‘톱5’에 이름을 올렸다.배당금이 가장 많이 감소한 기업은 삼성전자로 2020년 20조3381억원에서 지난해 9조8094억원으로 10조5286억원(51.8%) 줄었다. 다만 특별배당 요인을 빼면 1902억원(2%) 증가했다. 이어 메리츠증권(-1507억원, -67.7%), 메리츠금융지주(-921억원, -77.7%), 메리츠화재(-841억원, -55.7%),LG전자(-630억원, -29.1%), 서울도시가스(-583억원, –89.6%) 순으로 감소 폭이 컸다.━효성티앤씨, 주당 배당금 5000원→5만원전년과 비교해 주당 배당금이 많이 증가한 기업은 효성티앤씨다. 지난해 주당 5만원을 배당해 2020년 5000원에서 10배로 증가했다. 지난해 신규 배당을 실시한 효성첨단소재가 0원에서 1만원으로 증가해 2위였고, 포스코(9000원, 112.5%), 광주신세계(5000원, 142.9%), 한국쉘석유(5000원, 35.7%) 순이었다.시가 배당률은 주당 2720원을 배당한 이크레더블이 13.5%로 가장 높았다. 효성티앤씨(9.3%, 5만원)와 동양생명(9.0%, 620원), 현대중공업지주(9.0%, 5550원),LX인터내셔널(8.6%, 2300원)도 8%가 넘는 시가 배당률을 기록하며 상위권으로 집계됐다.[자료CEO스코어]━“주주환원 정책으로 주주 달래기”조사 대상 853개의 배당금 총액은 38조3232억원이었다. 2020년 43조3310억원보다 5조78억원(11.6%) 적지만, 당시 삼성전자가 이례적으로 지급한 특별배당금 10조7188억원을 제외하면 5조7110억원(17.5%) 늘어난 수치다. 2019년 배당금 31조7701억원과 비교해서도 6조5531억원(20.6%) 증가했다.아직 배당 결정을 공시하지 않은 기업들을 고려하면 최종 배당금 규모는 40조원을 넘어설 전망이다.CEO스코어 측은 “최근 글로벌 환경·사회·지배구조(ESG) 경영 강화 기조 속에 미국발 긴축 여파로 국내 증시까지 휘청이자 기업들이 적극적인 주주환원 정책을 통해 주주 달래기에 나선 것”으로 분석했다."
2024-11-28,"한국사회복지협의회, 지역사회공헌 기업·기관 626개소 선정","한국사회복지협의회는 27일 서울드래곤시티호텔에서 ‘제6회 지역사회공헌 인정의 날’ 기념식을 열었다.한국사회복지협의회(회장 김성이)는 ‘2024 지역사회공헌 인정제’를 통해 지역사회공헌 인정기업과 기관 총 626개소를 선정했다고 27일 밝혔다.보건복지부와 한국사회복지협의회가 공동으로 주관하는 ‘지역사회공헌 인정제(CorporateSocialResponsibilityintheCommunity)’는 지역 사회공헌 활동을 펼친 기업과 기관을 발굴해 그 공로를 지역사회가 인정해 주는 제도이다.시행 6년째인 올해는 678개 기업과 기관이 신청하였고,ESG(환경경영·사회적책임경영·투명경영)를 반영한 25개 심사지표 평가를 통해 최종 626개소가 인정기업·기관으로 선정됐다.지역별로 인정받은 기업·기관은 서울 148개소, 부산 22개소, 대구 37개소, 인천 33개소, 광주 21개소, 대전 22개소, 울산 24개소, 세종 13개소, 경기 90개소, 강원 29개소, 충북 22개소, 충남 17개소, 전북 27개소, 전남 34개소, 경북 35개소, 경남 30개소, 제주 22개소이며 이중 66개 기업·기관이 2019년부터 2024년까지 6년 연속 인정을 받았다.이와 관련해 한국사회복지협의회는 27일 서울드래곤시티 그랜드볼룸 한라홀에서 김성이 한국사회복지협의회장, 은성호 보건복지부 인구사회서비스정책실장, 이장우 생명보험사회공헌재단 이사장, 박진서 한국인정지원센터 대표이사 등이 참석한 가운데‘제6회 2024 지역사회공헌 인정의 날’ 기념식을 개최했다.이날 행사에서는 인정기업·기관에 대한 인정패 수여와 더불어 사회공헌 우수단체와 우수 프로그램에 대한 포상도 이뤄졌다. 사회공헌 우수단체로는 ㈜벡스코, 달성군시설관리공단, 인천광역시서구시설관리공단, 주식회사 인그래픽스, 한국조폐공사, 울산과학기술원, 세종중앙신용협동조합, 세종도시교통공사, 과천도시공사, 강원테크노파크, ㈜공공디자인이즘, 농업회사법인(주)백제,HD현대인프라코어(주) 군산, 한전케이피에스 주식회사, 영천시시설관리공단, 한국남동발전, 공무원연금공단 등 17개소가 선정돼 보건복지부장관 표창을 받았다.우수 프로그램을 운영한 신한카드 주식회사, 한국무역보험공사, 현대모비스㈜, 머크 주식회사, 은평구시설관리공단, 예금보험공사, 국민건강보험공단 부산울산경남지역본부, 부산시중앙신용협동조합, (사)한국건강관리협회 경상북도지부, 달구벌신용협동조합, 인천광역시중구시설관리공단, 인천국제공항보안(주), 상무수치과의원, 주식회사 바이오쓰리에스, 한국연구재단, 한국철도공사, 효성티앤씨(주) 울산공장, 울산광역시 북구 시설관리공단, 울산광역시중구도시관리공단, 중소기업기술정보진흥원, 세종특별자치시시설관리공단, (재)안산시청소년재단, 에코남양주협동조합, 경기관광공사, 수원도시공사, 한국동서발전(주) 동해발전본부, 평창군시설관리공단, 한국전력공사 충북본부, 한국소비자원, ㈜에코프로, 해양환경공단 대산지사, 순수본(주), (유)플러스건설, 한국수력원자력(주) 한빛원자력본부, 여수광양항만공사, 한전엠씨에스 주식회사, 한국전력공사, 재단법인 경상북도 환경연수원, 구미도시공사, 한국전력공사 경남본부, 한국세라믹기술원, 한국마사회 제주본부, 제민신용협동조합 등 43개소는 보건복지부장관상을 수상했다.또 임직원 자원봉사 실적이 우수한 지에스리테일, 현대모비스, 삼익신용협동조합, 인천관광공사, 한국동서발전(주), 한국식품안전관리인증원, 전북특별자치도 마음사랑병원, 여수시도시관리공단, 한국전력거래소, 제주관광공사 등 10개소는 생명보험사회공헌재단에서 수여하는 특별상을 받았다.김성이 한국사회복지협의회장은 “헌신적인 사회공헌활동으로 지역사회의 긍정적인 변화를 이끌어가고 있는 인정기업과 기관에 감사드린다”며 “지역사회공헌 인정제를 통해 기업·기관의 건강한 사회공헌 문화를 구축하고 지속가능한 복지사회를 만들어 가는데 더욱 힘쓰겠다”고 밝혔다.한편, 지역사회공헌 인정기업·기관에는 인정 승인일부터 1년간 인정제 엠블럼 사용권한이 부여되고, 사회공헌 교육·포럼·컨설팅 등 개인과 조직을 위한 역량강화 프로그램 혜택이 제공된다.지역사회공헌 인정제에는 신용보증기금, 기술보증기금, 국민일보, 중소벤처기업진흥공단, 소상공인시장진흥공단, 농협중앙회, 법무법인디엘지, 한국무역보험공사, 한국환경보전원, 한국표준협회,DGB금융그룹, 대한경영학회, 농협은행, 중소벤처기업인증원(KOSRE), 생명보험사회공헌재단, 한국인정지원센터(KAB) 등 16개 후원기관이 인센티브 제공에 참여하고 있다."
2023-10-17,쓰레기로 세금 막아라…‘친환경’ ‘바이오’ 속도내는 석화 업계,"국내 석유화학 업계가 불과 1년여 앞으로 다가온 글로벌 ‘탈(脫)탄소’ 시장에 대응하기 위해 바이오 연료와 재활용 플라스틱 등 친환경 사업에 박차를 가하고 있다.17일SK그룹의 에너지 계열사인SK트레이딩인터내셔널(SK트레이딩)은 16일 국내 최대 폐자원 기반 원료 업체인 대경오앤티과 주식매매 계약을 체결했다고 밝혔다. 대경오앤티는 도축 부산물에서 나오는 동물성 지방과 음식점 등에서 발생하는 폐식용유를 바이오 디젤, 바이오 항공유의 원료로 공급하는 업체다. 이번 투자는 컨소시엄 형태이며SK트레이딩이 지분 40%를,KDB산업은행과 유진프라이빗에쿼티가 60%를 보유한다.━2025년 유럽서 ‘바이오’연료 의무화SK트레이딩이 대경오앤티를 인수한 가장 큰 목적은 ‘바이오 항공유’ 의무화가 눈앞에 닥쳤기 때문이다. 항공기는 배터리 밀도의 한계와 안정성 등의 문제로 자동차처럼 배터리와 연료전지로 화석연료를 대체하지 못하고, 액체 연료를 사용해야 한다.이에 유럽연합(EU)은 2025년부터EU회원국 공항에서 급유하는 항공기들이 기존 항공유 대비 탄소 배출량을 80% 줄일 수 있는 바이오 항공유, 즉 지속가능 항공연료(SAF)를 최소 2% 이상 의무적으로 포함하도록 했다.EU는SAF의무 사용 비율은 2030년 6%, 2035년 20%, 2050년 70%로 늘려갈 계획이다. 업계에선 2050년SAF시장이 4020억 달러(약 540조원) 규모로 커질 것으로 보고 있다.바이오 항공유 제조설비가 들어선SK에너지 울산컴플렉스 전경. 사진SK에너지관건은 동물성 지방과 폐식용유(UCO) 등 바이오 항공유의 원료 확보다.SK는SK트레이딩이 올해 3월 중국UCO전문업체인 진샹 투자와 이번 대경오앤티 투자로 확보한 원료를 사용해SK에너지 공장에서 바이오 항공유를 만들 계획이다. 서석원SK트레이딩 사장은 “이번 투자로 한국과 중국을 아우르는 바이오 항공유 원료 확보 기반을 마련하게 됐다”고 말했다.━탄소세에 플라스틱세까지…‘친환경’ 필수효성그룹도 조현준 회장의 지휘로 바이오 연료 신사업에 나섰다. 효성티앤씨는 최근 ‘수소화 식물성 오일(HVO) 태스크포스’를 만들고 바이오 디젤에 이은 차세대 바이오 연료 개발에 돌입했다. 또EU가 2026년부터 탄소 함유량에 따라 역내 수입품에 ‘탄소세’를 부과하기로 하면서 바이오 소재 사업에 속도를 내고 있다. 효성티앤씨는 최근 세계 최초로 옥수수에서 추출한 원료를 가공해 만든 바이오 스판덱스인 ‘크레오라 바이오베이스드’를 상용화하며 선제 대응에 나선 상태다.옥수수에서 추출한 원료로 만든 효성티앤씨의 바이오 스판덱스. 사진 효성롯데케미칼 역시 지난달 친환경 소재 브랜드인 ‘에코시드’를 출시하고, 2030년까지 재활용 소재와 바이오플라스틱 소재 등 에코시드 100만t을 공급하겠다는 목표를 밝혔다.플라스틱세 도입도 가시권에 들어온 상태다.EU집행위원회는 플라스틱 포장재의 재활용 수준을 2025년까지 50%, 2030년까지 55%로 늘리는 것이 목표로 하고 있다.이에LG화학은 지난 16일 아모레퍼시픽과 친환경 포장용기 개발과 공급을 위한 업무 협약을 맺었다.LG화학이 재활용·열분해유, 바이오 기반의 플라스틱 원료를 공급하면 아모레퍼시픽이 화장품과 생활용품 포장재에 친환경 소재를 적용하는 식이다.'지속가능한 친환경 패키지 개발MOU체결식'에 참가한LG화학NCCPO사업부장 양선민 전무(오른쪽)와 아모레퍼시픽SCM유닛장 강명구 전무. 사진LG화학SK케미칼 역시 글로벌 화장품 브랜드 에스티로더의 화장품 용기에 자사 재활용 소재를 사용하는 ‘순환 재활용 솔루션 공급에 관한 협력 의향서(LOI)’를 체결했다고 이날 밝혔다. 순환 재활용은 폐플라스틱을 화학적으로 분해해 플라스틱 원재료 단위로 바꾸는 기술로, 플라스틱 쓰레기 문제 해결에 중요한 기술로 손꼽힌다.SK케미칼 순환재활용 소재로 만든 화장품 용기. 사진SK케미칼안재현SK케미칼 사장은 “이번 협약으로 바비브라운·아베다·크리니크·라메르 등 에스티로더 브랜드에도 재활용 솔루션이 적용될 것으로 기대한다”며 “지속가능한 화장품 용기 생태계 조성에 힘쓸 것”이라고 말했다."
