date,title,content
2022-05-19,금리 올라도 우는 보험사…재무건전성 비상에 채권 발행까지,"금리 상승에도 보험사들이 웃지 못하고 있다. 금리가 오르며 자산 운용 수익은 늘었지만, 보유 채권 가치 급락으로 재무건전성에 빨간불이 켜지면서다. 지난 1분기 말 기준 재무건전성 지표가 금융당국의 권고치를 밑도는 보험사도 속출하고 있다. 자본 확충을 위해 매년 4~6%대 이자를 줘야 하는 후순위채권 발행에 나서는 보험사도 늘고 있다.시장금리가 오르며 보험사들의 재무건전성이 악화되고 있다. 셔터스톡19일 보험업계에 따르면 올해 1분기 실적을 발표한 보험사들의 지급여력비율(RBC)이 일제히 급락했다.DGB생명의 1분기RBC는 84.5%로 100%를 밑돌았다. 지난해 말(223.6%)보다 139.1%포인트 하락했다. 다만DGB생명은 300억원의 유상증자를 통해RBC를 108.5%로 높인 상태다.금융당국의 권고치(150%)를 밑도는 보험사도 속출하고 있다. 국내 5위 생명보험사인 농협생명의RBC는 131.5%로 지난해 말보다 79%포인트 하락했다. 한화손해보험(122.8%)과DB생명(139.14%), 흥국화재(146.65%) 등도 150%를 밑돌았다. 지난해 말RBC가 150% 미만으로 떨어진 보험사는 최근 부실 금융기관으로 지정된MG손해보험이 유일했다.RBC는 보험사가 각종 리스크로 입을 수 있는 손실금액(요구자본)과 이런 손실금액에 대처할 수 있는 자본(가용자본)의 비율이다. 보험사가 보험금 지급 요청을 한꺼번에 받았을 때 지급할 수 있는 능력을 나타내는 지표로 통한다.RBC가 높을수록 탄탄한 보험사다. 보험업법상 100%만 넘으면 되지만, 금융 당국은 사전 관리 차원에서 150% 이상을 권고하고 있다.그래픽=전유진yuki@joongang.co.krRBC하락은 금리 상승으로 보험사가 보유한 채권 가격이 하락하며 발생한 평가 손실 때문이다. 보험사 자산의 절반가량을 차지하는 채권 가격이 떨어지면 가용자본이 줄어든다. 그 결과RBC가 하락한다.한국기업평가는 지난 4월 보고서에서 올해 1분기 시장 금리 상승으로 보험사의RBC가 평균 30%포인트 이상 내려간 것으로 추정했다. 국고채 10년물 금리는 지난해 말 연 2.25%에서 올해 1분기 말 2.969%로 0.71%포인트 상승했다.보험사가 금리 전망을 잘못해 보유 채권을 만기보유증권에서 매도가능증권으로 분류한 경우도RBC악화의 요인이다. 만기보유증권은 채권을 살 때 가격으로 가치를 평가해 금리가 올라도 평가액이 변하지 않는다. 반면 매도가능증권은 금리 등락에 따라 평가액이 변한다. 금리 하락기에는 채권 평가액이 올라가며RBC가 개선되지만, 상승기에는 채권 평가액이 줄게 된다.농협생명의 경우 금리 하락이 장기간 이어질 것으로 예상하고 2020년 3분기에 보유채권을 만기보유증권에서 매도가능증권으로 재분류했다. 그 결과 2020년 3분기에는RBC가 전분기 대비 121.24%포인트나 올랐지만, 현재는RBC가 급락해 어려움을 겪고 있다.보험사는RBC하락을 막기 위해 신종자본증권이나 후순위채 등 자본성증권을 발행하고 있다. 한국기업평가에 따르면 올해 들어 지난달 22일까지 보험사들은 총 2조2691억원 어치의 자본성증권을 발행했다. 지난해 전체 발행액(2조9000억원)의 78% 수준이다. 농협생명은 올해에만 유상증자(6000억원)와 후순위채권 발행(8300억원) 등으로 1조4300억원을 자금을 조달했다.이렇게 발행한 후순위채권 등은 보험사의 장기 체력을 갉아먹는다. 농협생명이 지난 3월 3일 발행한 후순위채권 6000억원의 경우 만기 10년에 표면이율이 4.35%이다. 농협생명의 올해 1분기 자산운용 수익률(2.98%)보다 높다. 노건엽 보험연구원 연구위원은 “자본성 증권은 이율이 높아 장기적으로는 보험사의 수익성이 나빠진다”고 말했다.그래픽=김경진 기자capkim@joongang.co.krRBC하락은 올해 내내 이어질 수 있다. 미국 연방준비제도(Fed)가 긴축에 나서며 시장 금리가 뛰고 있어서다. 보험사가 추가로 자본을 확충하지 않으면RBC비율 추가 하락은 불보듯 뻔한 상황이다. 한국기업평가 송미정 연구원은 보고서에서 “금리 전망을 고려하면 2분기 이후 보험사의 자본확충 필요는 더 커질 것”이라고 분석했다.보험업계는 내년 신지급여력제도(K-ICS)가 도입되면 상황이 달라질 것으로 예상한다.K-ICS는 자산과 부채를 모두 시가로 평가한다. 금리가 상승하면 보험부채도 줄어드는 구조라 재무건전성도 개선된다. 삼성생명은 금리가 0.5%포인트 오를 경우 현재 제도에서는RBC가 35% 감소하지만,K-ICS로 평가할 경우 지급 여력이 10%포인트 이상이 올라가는 걸로 추정했다.보험업계 관계자는 “올해가 지나면 사라질RBC비율을 맞추기 위해 고금리를 약속하는 채권 발행이 이어지고 있다”며 “금융당국이RBC비율 관련 유예 조치나K-ICS조기 조입 등의 대책을 내놔야 한다”고 말했다. 다만 금융당국 관계자는 ""RBC추이에 따라 적절한 조치를 검토하고 있다""면서도 ""보험사들의 자본확충 등 자구 노력이 선행될 필요가 있다""고 말했다."
2024-12-12,개인정보 ‘꼼수 수집’ 손해보험사 4곳에 과징금 92억원,"현대해상화재보험 누리집 갈무리고객 개인정보를 ‘꼼수’로 수집한 뒤 이를 마케팅에 활용한 주요 자동차 손해보험사들이 과징금 92억여원을 물게 됐다.개인정보보호위원회는 12일 전날 전체회의에서 개인정보보호법을 위반한 현대해상화재보험과 악사(AXA)손해보험 등 12개 손해보험사에 과징금 및 시정명령 처분을 의결했다고 밝혔다.개보위 제재 대상에 포함된 손해보험사는 현대해상화재보험, 악사손해보험, 하나손해보험, 엠지(MG)손해보험, 롯데손해보험, 삼성화재해상보험, 디비(DB)손해보험, 케이비(KB)손해보험, 메리츠화재해상보험, 한화손해보험, 흥국화재해상보험, 캐롯손해보험 등이다.개보위는 조사 결과 현대해상화재보험, 악사손해보험, 하나손해보험, 엠지손해보험 등 4개 기업에 92억770만원의 과징금을 부과했다. 이들 업체는 상품 소개를 위한 동의란에 ‘미동의’ 의사를 표시한 이용자들을 상대로 선택 변경을 유도하는 팝업창(재유도 팝업창)을 운영했다. 하지만 팝업창에 ‘상품 소개 항목에 동의’라는 모호한 문구만 기재했기 때문에 고객들은 마케팅 활용을 위한 개인정보 제공·수집 등에 동의한다는 걸 제대로 알 수 없었다. 그 결과 이용자가 재유도 팝업창에서 ‘확인’(동의) 버튼을 누르면, 개인정보 수집·이용뿐만 아니라 개인정보의 제3자 제공 및 광고성 정보 수신을 모두 승인한 것으로 처리됐다.현대해상화재보험, 악사(AXA)손해보험, 하나손해보험, 엠지손해보험 등 4개 업체가 고객 개인정보를 ‘꼼수’로 수집하기 위해 운영한 동의 변경 재유도 팝업창. 개인정보보호위원회 제공4개 손해보험사가 이런 방식으로 재유도 팝업창을 운영하는 동안 이용자의 마케팅 동의율은 최대 30%포인트(31.42%→61.71%) 급증했다. 보험사가 수집한 고객 개인정보는 자동차보험뿐만 아니라 운전자보험, 건강보험, 치아보험 등 해당 업체의 다른 보험 마케팅에도 활용됐는데, 개보위는 이 과정에서 회사 개인정보보호책임자(CPO)의 검토 등 내부 통제가 제대로 작동하지 않은 점도 확인했다.또 이들 4개 업체를 포함한 12개 보험사는 ‘자동차 보험료 계산 서비스’를 제공하면서 이용자의 이름, 주민등록번호, 휴대전화번호를 수집했다. 이들 보험사들은 고객이 보험료 계산을 중단하거나 계산 뒤 계약을 체결하지 않은 경우에도 법적 근거 없이 수집한 개인정보를 1년간 보유해 개보위의 시정명령 처분을 받았다. 1년 넘게 이용자 정보를 파기하지 않은 롯데손해보험의 경우 과태료 540만원이 부과됐다.개보위는 “적법한 동의를 받기 위해서는 정보 주체에게 명확히 알리고 자유롭게 결정권을 행사하도록 해야 한다”며 “개인정보보호책임자는 개인정보 유출 방지를 위한 안전 조처와 함께 적법한 개인정보 처리를 위한 내부통제시스템 구축해야 한다”고 했다."
2024-12-16,12월17일 알림,"◇ 해양수산부는 17일 한국언론회관에서 ‘제18회 장보고대상' 시상식을 연다. 대상인 대통령상은 한국김산업연합회가 받는다. 국무총리상은 이진한 고려대 교수에게, 해수부 장관상은 다큐멘터리 영화 ‘고래와 나'를 촬영한 김동식 감독, 국회 농림축산식품해양수산위원장상은 완도수산고에게 각각 돌아갔다.◇ 목원대는 조재윤 사범대 국어교육과 교수가 한국화법학회 신임 회장으로 선임됐다고 16일 밝혔다. 임기는 내년 1월부터 2년이다.◇ 소상공인시장진흥공단은 지난 13일 일산 킨텍스에서 열린 ‘제13회 대한민국 교육기부 대상' 시상식에서 부총리 겸 교육부 장관 표창을 받았다고 16일 밝혔다. 어린이와 청소년이 전통시장에 직접 방문해 지역사회 실물경제와 역사, 문화를 학습할 수 있도록 다양한 프로그램을 기획하고 운영한 공로를 인정받았다.◇ 한국교통안전공단은 지난 10일 그랜드 클라우드 콘퍼런스 2024에서 ‘클라우드 산업 발전 유공 과학기술정보통신부 장관상'을 받았다. 총 23개 정보시스템을 공공 클라우드로 전환하고 민간 클라우드와 업무협약을 맺는 등의 공로를 인정받았다.◇ 한미사이언스는 원료의약품 전문 회사 한미정밀화학이 제1회 ‘2024년 대한민국 일·생활 균형 우수기업'으로 선정됐다고 16일 밝혔다.◇ 에이치에스에이디는 ‘2024 대한민국 디지털 광고대상(KODAF2024)'에서 대상 2개, 금상 1개, 동상 2개, 우수상 1개 등 본상 총 6개를 받았다고 16일 밝혔다.◇ 반도건설은 16일 경기도 안산시 근로복지공단 안산병원에서 건설현장에서 다친 근로자의 치료비와 생계비를 위한 지원금 전달식을 했다. 전달식에는 김용철 반도건설 사장, 임호영 안산병원장, 오진석 재해근로자 등이 참석했다.◇ 흥국화재는 지난 14일 부산 동구 좌천동 매축지 마을에서 흥국화재 사내 봉사 동아리 ‘흥줍킹' 소속 직원과 가족 35명이 연탄 1천장을 24가구에 직접 배달하고, 부산연탄은행에 연탄 1천장을 추가로 기부했다고 밝혔다.◇ 하림은 초록우산에 2500만원 상당의 제품을 기부했다고 16일 밝혔다. 초록우산은 기부 제품을 수도권 아동 양육시설과 취약계층 아동 가정에 전달할 예정이다.◇ 유네스코한국위원회는 지난 13일 서울 중구 유네스코회관에서 서울사대부설여중 3학년 학생들과 국어교사 최인영씨가 시집 ‘안녕, 하고 시를 만났다' 인세를 전달했다고 밝혔다. 이 시집은 서울사대부설여중 3학년이 수업 시간에 직접 쓴 시를 모은 문집이다. 후원금은 전 세계 교육 격차를 해소하는 데 쓰일 예정이다.◇ 양산부산대병원은 전 프로야구 롯데 자이언츠 선수 이대호가 부산대어린이병원을 방문해 소아암 환아를 위한 치료비 500만원과 사인볼 100개를 전달했다고 16일 밝혔다."
2023-06-06,"‘배당 매력’ 우선주, 상장폐지 위기 종목 나온 이유는","서울 여의도 증권가. 게티이미지뱅크삼성중공업 등 유가증권시장 일부 상장기업의 우선주가 시장에서 퇴출당할 위기다. 금융당국이 지난 2020년 규제를 강화한 이후 무더기 우선주 상장폐지 사례가 등장할 것으로 보인다. 상장 폐지 전 주가 급변동 가능성 탓에 투자자들은 유의할 필요가 있다.6일 한국거래소에 따르면, 유가증권시장본부는 지난 1일 디비(DB)하이텍1우, 삼성중공우, 에스케이(SK)네트웍스우, 현대비앤지스틸우, 흥국화재2우비(B) 등 5개 종목에 대해 상장폐지 우려가 있다고 예고 공시했다. 우선주는 의결권이 없는 대신 보통주보다 배당에서 우선순위에 있는 주식이다. 기업 입장에선 대주주의 지분 희석 없이 자금을 조달할 수 있다는 이점이 있다.이들 종목이 상장폐지 위기에 처한 것은 상장규정 요건을 충족하지 못해서다. 상장규정은 특정 종목의 상장주식 수가 2개 반기(6개월) 연속으로 20만주를 밑돌 경우에는 상장폐지하도록 하고 있다. 이들 우선주의 5월 말 기준 상장주식 수는 모두 20만주에 미치지 못한다. 이달 말까지 상장 기준을 맞추지 못하면 다음달 3일부터 상장폐지 절차가 진행된다. 앞서 이들 종목과 함께 올해 초 관리종목에 지정됐던 남양유업과 소프트센은 각각 유상증자와 액면분할을 통해 우선주 상장폐지 위기에서 벗어난 바 있다.우선주의 신규 상장 및 유지 요건이 강화된 것은 지난 2020년 7월이다. 당시 삼성중공업 우선주가 단기 급등하면서 과열 현상을 보인 게 계기였다. 유통 물량이 적은 탓에 가격 변동성이 커지면서 투기 바람이 불었다는 뜻이다. 당시 삼성중공업의 보통주는 6억주, 우선주는 11만주였다.당국의 규정 개정은 유통 우선주의 수량 확대를 유도하는 것이었다. 구체적으로 진입(신규 발행) 최소요건은 50만주 이상에서 100만주 이상으로, 퇴출(상장폐지) 요건은 2개 반기 연속 5만주 미만에서 20만주 미만으로 강화했다. 1년여의 유예 기간을 거쳐 2021년 10월부터 시행됐다. 유예 기간에는 10만주 이상을 퇴출 기준으로 삼았다.이번에 거래소로부터 상장폐지 우려 예고를 받은 기업 5곳은 유예 기간이 끝난 뒤인 지난해 하반기 말 기준으로 20만주 기준을 충족하지 못해 올해 1월2일자로 관리종목에 지정된 바 있다. 상장폐지를 피하려면 증자나 액면분할 등을 통해 유통주식 수를 늘리면 되지만 시장에선 해당 기업들이 우선주를 살리기 위해 이런 조처를 할 여지는 낮다고 본다. 주식을 일정 비율로 쪼개는 것을 뜻하는 액면분할은 보통주도 함께 진행해야 하는 부담이 있고, 유상증자는 기존 주식 가치의 희석을 감수해야 한다는 이유에서다.다음달부터 상장폐지 절차를 밟게 되면 주가 변동성은 급격히 커질 수 있다. 실제 케이지(KG)스틸우, 동양3우비(B), 신원우 등은 상장폐지 전 52주 신고가와 신저가를 오가는 등 널뛰기 양상을 보인 바 있다. 특히 상장폐지에 앞서 진행되는 정리매매 기간(통상 7거래일)엔 가격제한폭(상·하한 30%)도 적용되지 않는다."
2023-01-17,보험사 신용대출 평균금리 최고 13%…서민 대출 어려워져,"지난해 보험사 순이익 8조원 넘을 것으로 예상게티이미지뱅크고금리 현상이 계속되면서 보험사 신용대출 평균 금리도 최고 13%에 육박했다. 보험사는 대출 심사가 필요 없는 약관 대출도 줄이고 있어 급전이 필요한 서민들이 어려움을 겪을 전망이다.17일 생명보험협회와 손해보험협회 등에 따르면 지난해 11월 기준 손해보험사들의 무증빙형 일반신용대출 평균 금리는 케이비(KB)손해보험이 12.98%로 가장 높았고, 흥국화재도 12.71%에 달했다. 전달과 비교해 케이비손해보험 평균 금리는 0.3%포인트, 흥국화재 평균 금리는 0.37%포인트 각각 높아졌다.신용점수가 900점을 초과하는 우량 고객의 무증빙형 일반신용대출 평균 금리도 10%를 넘어서고 있다. 지난해 11월 기준 케이비손해보험의 평균 금리는 10.35%를 나타냈다. 흥국화재(9.50%)와 현대해상(8.86%) 등의 평균 금리도 10%에 근접해지고 있다. 케이비손해보험 관계자는 “중저신용자들을 대상으로 중금리 대출을 시행하고 있기 때문에 상대적으로 평균 금리가 높게 산출됐다”며 “다른 신용대출을 취급하는 곳에서 거절하는 낮은 신용등급의 소비자들도 폭넓게 받고 있다”고 말했다.같은 기간 생명보험사 중에서는 교보생명의 일반신용대출 평균 금리가 10.35%로 가장 높았다. 한화생명(10.10%), 흥국생명(9.85%), 신한라이프(9.56%), 삼성생명(9.39%)이 그 뒤를 이었다. 한 보험사 관계자는 “채권금리가 가파르게 오르면서 보험사들도 대출금리를 올리고 있는 상황”이라며 “보험대출을 받는 다수가 취약차주로, 신용점수가 낮은 경향이 있어 회사 건전성 관리상 금리가 높을 수 밖에 없다”고 말했다.이런 가운데 보험사들은 대출 심사가 필요 없고 중도 상환 수수료나 연체 이자도 없어 급전이 필요한 고객이 주로 찾는 약관 대출도 줄이고 있다. 약관 대출은 해약환급금의 일정 범위 내에서 비교적 낮은 이자로 대출을 받을 수 있어 급전이 필요할 때 사람들이 많이 찾는다. 현대해상은 최근 일부 보장성 상품의 약관대출 한도를 해약환급금의 60%에서 만기에 따라 0~60% 이내 범위로 차등 적용하기로 했다. 신한라이프도 최근 일부 상품의 약관대출 한도를 해약환급금의 95%에서 90%로 하향 조정했다.생∙손보사들은 지난해 총 8조원이 넘는 순이익을 거둔 것으로 추정돼 대출 문턱 높이기가 너무 과도하다는 비판도 나온다. 지난해 1~3분기 전체 생명보험사의 순이익은 2조9437억원, 손해보험사는 4조8174억원을 각각 기록했다."
