date,title,content
2022-01-16,"주담대 금리 6%, 신용대출 5% 시대 목전에···속 타는 영끌·빚투족","지난 14일 한국은행이 두 달만에 기준금리를 0.25%포인트 추가 인상하면서 대출자들의 한숨이 커지고 있다. 시중은행의 주택담보대출 금리는 6%, 신용대출 금리는 5% 돌파를 목전에 두고 있다. 변동금리 대출자가 82.3%로 8년만에 최대치를 기록한 가운데, 시장 예상대로 한은이 연내에 두 차례 이상 기준금리를 더 올릴 경우 ‘영끌’(영혼까지 끌어모은다는 뜻) 대출자들의 이자 부담이 눈덩이처럼 불어날 것으로 보인다.서울 시내 한 은행에 붙은 대출 안내 현수막/연합뉴스◇주담대 금리 6%, 신용대출 금리 5% 돌파 시간문제16일 금융권에 따르면KB국민·신한·하나·우리은행의 주담대 변동금리(신규 코픽스 연동)는 연 3.570~5.070% 수준이다. 1년여 전인 2020년 12월 31일(2.520~4.054%)과 비교해 상·하단이 1%포인트 넘게 인상됐다.같은 기간 고정형 주담대 금리도 급격히 뛰었다. 2020년 말 2.690~4.200%에서 3.750~5.510%로 역시 1%포인트 이상 올랐다. 특히 최근 14일만에 최고 금리가 0.532%포인트 뛰는 등 오름폭이 크다. 신용대출은 현재 3.440~4.730% 수준으로 1년여만에 0.790~0.970%포인트 상승했다.◇변동금리 대출 비중, 8년만에 최대···금리 인상 직격탄기준금리 인상이 예상됐지만 작년 11월 예금은행의 신규 가계대출 가운데 변동금리 비중은 82.3%까지 늘어난 상태다. 7년 10개월만에 최대치다. 최근까지 변동금리가 고정금리보다 낮게 형성됐던데다 저금리가 장기화되며 금리가 급격히 오르지는 않을 것이라는 인식이 강했기 때문이다. 이들은 시중은행 금리 인상에 직격탄을 맞을 수 밖에 없다.한국은행은 대출금리가 0.25%포인트 인상될 경우 가계의 연간 대출 이자부담이 3조2000억원 증가할 것으로 추정하고 있다. 또 대출자 1인당 연간 이자 부담은 16만1000원 늘어나는 것으로 분석했다. 이 계산대로라면 지난 1년간 시중은행 대출금리가 약 1%포인트 뛰었기 때문에 전체 대출 이자 규모는 이미 12조8000억원, 1인당 이자액은 64만4000원 늘었다.만약 시장의 예상대로 한은이 기준금리를 0.25%포인트씩 두 번 올려 연말 기준금리가 1.75%로 올라선다고 가정하면 가계 전체 이자는 올해에만 9조6000억원, 1인당 이자액은 48만3000원 더 늘어날 것으로 추정된다.◇2금융권 이용하는 저신용자 대출 금리도 껑충 뛰어이런 가운데 1금융권에서 대출받기 어려워 보험사 등 2금융권을 이용해 온 중·저신용자들의 금리 부담은 더 커지고 있다. 기준금리 인상 등을 반영한 보험사 신용대출 평균 금리는 2년만에 10%에 육박한 상태다. 작년 11월 흥국화재의 무증빙형 신용대출 금리는 10.18%를 기록하기도 했다.저신용자 카드론 금리는 법정 최고금리인 20%에 근접했다. 작년 11월 말 삼성카드의 신용등급 9~10등급 차주 평균 금리는 19.52%였고, 현대카드는 19.35%였다. 본격적인 금리 인상기에 접어든만큼 카드론 대출 금리는 더 오르고 저신용자들은 아예 카드론 승인이 나지 않을 가능성이 크다."
2022-02-11,흥국생명 임형준·흥국화재 임규준 대표이사 내정,"흥국생명과 흥국화재는 새 대표이사에 임형준(60) 전 한국은행 부총재보와 임규준(59) 전 금융위원회 대변인을 각각 내정했다고 11일 발표했다.임형준 흥국생명 대표 내정자와 임규준 흥국화재 대표 내정자. 연합뉴스임형준 흥국생명 대표 내정자는 연세대와 연세대 대학원을 졸업하고 1987년 한은에 입행했다. 한은에서 금융시장국, 통화정책국 등을 거쳐 경영담당 부총재보를 지냈다. 현재KB생명보험 상근감사를 맡고 있다.임규준 흥국화재 대표 내정자는 연세대 출신으로, 1987년 매일경제신문 기자로 입사해 매일경제신문과MBN에서 국제부장, 부동산부장, 증권부장, 경제부장, 국장 등을 지냈다. 2016∼2019년 금융위 대변인(국장)을 지내는 등 언론과 정부 부처에서 활동했다. 현재 금융채권자조정위원회 사무국장으로 재직 중이다.두 내정자는 다음 달 열리는 정기주주총회와 이사회를 거쳐 정식 선임된다."
2022-11-15,"검찰, 'LH 발주 보험 담합' 손보사 7곳 압수수색","사진은 서울 서초동 대검찰청 모습. 뉴스1검찰이 한국토지주택공사(LH)가 발주한 임대주택 보험 입찰에서 담합을 벌인 혐의를 받는 손해보험사들에 대해 압수수색에 나섰다.서울중앙지검 공정거래조사부(이정섭 부장검사)는 15일 오전KB손해보험, 삼성화재보험,MG손해보험, 한화손해보험, 흥국화재보험, 메리츠화재보험, 코리안리재보험 등 7개 보험사 본사에 검사와 수사관을 보내 담합 관련 자료를 확보 중이다.검찰은 이들 사무실에 검사와 수사관을 보내 회계 장부 등 입찰 관련 자료를 확보 중이다.이들은 2018년LH가 발주한 임대주택 등 재산종합보험 입찰에서 들러리를 세우고 고의로 입찰에 불참하는 방식으로 담합한 혐의(공정거래법 위반)를 받는다."
2022-04-24,"포항지진 손해 만회하려 담합…손보사 8곳 과징금 17억, 2곳은 고발","한국토지주택공사(LH)가 발주한 임대주택 보험 입찰에서 낙찰자를 담합한 8개 손해보험사가 공정거래위원회의 제재를 받았다.장혜림 공정거래위원회 입찰담합조사과장이 지난 22일 세종시 정부세종청사에서 한국토지주택공사가 발주한 재산종합보험 및 전세임대주택 화재보험 입찰에서 ㈜케이비손해보험, 공기업인스컨설팅(주) 등 8개 보험사가 들러리 참가 또는 입찰 불참과 같은 방법으로 담합한 행위 제재와 관련해 브리핑하고 있다. 연합뉴스24일 공정위는LH의 임대주택 보험 입찰에서 '들러리 참가'나 입찰 불참으로 담합한 8개 손해보험사에 과징금 17억6400만원을 부과했다고 밝혔다. 아울러 담합을 주도한KB손해보험과 공기업인스컨설팅을 검찰에 고발했다.LH는 2018년 임대주택 재산종합보험과 전세임대주택 화재보험을 담당할 보험사를 입찰에 부쳤다.LH는 매년 약 100만 가구의 임대주택을 대상으로 자연재해 등 각종 안전사고로 발생할 수 있는 손해를 종합적으로 보상하는 재산종합 보험을 든다. 이를 위해 매년 보험사들을 상대로 입찰을 진행한다.공정위에 따르면 담합을 주도한KB손해보험은 2017년LH의 재산종합보험과 화재보험 입찰을 낙찰받았다. 그러나 그해 11월 발생한 포항지진으로 약 100억원의 손해가 발생하자 이를 만회하기 위해 2018년 입찰을 낙찰받고자 공기업인스와 담합을 모의하고 실행했다. 공기업인스는KB공동수급체의 모집인 역할을 하면서 들러리 섭외 등의 역할을 맡았다.이들은 재산종합보험 입찰에서 삼성화재보험을 들러리로 섭외하고 한화손해보험와 흥국화재보험은 입찰에 불참하게 했다. 대신 삼성화재보험과 한화손해보험에는 낙찰예정자인KB공동수급체의 지분 일부를 재보험사인 코리안리를 경유해 재재보험으로 인수하도록 했다.MG손해보험과DB손해보험은KB공동수급체에 참여하는 방식으로 입찰 담합에 가담했다.입찰 결과KB공동수급체는 낙찰금액은 2017년 대비 4.3배, 설계가 대비 투찰률은 2017년 49.9%에서 2019년 93.0%로 상승했다. 화재보험 입찰에서는 한화손해보험과 메리츠화재보험을 입찰에 불참하도록 하고KB공동수급체 지분 일부를 배정했다.MG손해보험도 한화와 메리츠의 입찰 불참 등을 인지하고KB공동수급체에 참여하는 방식으로 입찰담함에 참여했다. 입찰 결과 낙찰금액은 2.17년 대비 2.5배, 투찰률은 93.7%로 전년 대비 급격하게 상승했다.공정위는 이번 조치는 보험사들이 들러리 및 입찰 불참 대가로 재보험을 인수하도록 하거나 청약서를 위조해 지분을 배정받는 방법으로 담합 대가를 제공하는 행위를 적발한 데 의의가 있다고 밝혔다."
2024-02-14,[알면 쏠쏠한 경제 비크닉] 보험사 상품 한눈에 비교한다…자동차보험 비교 플랫폼 활용법,"[셔터스톡]자동차 보험 만기일이 다가오면 고민에 빠지게 된다. 더 많은 보장을 해주면서도 더 싼 상품으로 갈아타고 싶지만, 보장 내용이 복잡하고 보안프로그램 설치, 보장내용 입력 등도 불편하기 때문이다. 하지만 이제 간편하게 보험사 별 상품을 비교하고 가입할 수 있게 됐다.지난달 자동차보험 비교·추천 서비스가 시작됐다. 네이버파이낸셜(네이버페이), 카카오페이, 비바리퍼블리카, 뱅크샐러드, 해빗팩토리, 쿠콘, 핀크 등 7개 플랫폼이 참여했다. 해당 플랫폼에서 본인인증을 거치면 여러 보험회사 상품의 보험료를 한눈에 비교할 수 있다.메리츠화재, 롯데손해보험, 흥국화재, 삼성화재, 현대해상,KB손해보험,DB손해보험, 하나손해보험, 캐롯손해보험,AXA손해보험 등 10곳이 참여했다.네이버에서 이 서비스를 이용하려면 네이버페이에 접속해 보험 메뉴를 누르고 ‘1분 만에 최저가 보험 찾기’ 버튼을 클릭하면 된다. 카카오에선 카카오페이에 접속한 후 전체 탭의 보험 영역에 들어가 ‘자동차보험 비교하기’를 누르면 된다. 본인인증을 거치면 마이데이터에 등록된 보험 만기일, 차량번호 등을 불러온다. 추가로 운전자 범위나 운전 점수 등을 입력하면 가격이 낮은 순서대로 보험사 상품이 표시된다.보험상품을 선택하면, 보험사 웹페이지로 넘어가 가입 절차로 이어진다. 각 플랫폼에서 입력한 정보가 그대로 넘어오기 때문에 다시 개인 정보나 가입 조건을 입력할 필요가 없다.보험상품을 비교·추천해주는 서비스는 점차 확대될 예정이다. 실손의료보험, 여행자보험 등도 여러 플랫폼에서 비교해주는 서비스가 연내 나올 예정이다.‘알면 쏠쏠한 경제 비크닉’은 따뜻한 경제 지식을 전합니다. B급 투자자를 A급으로 끌어올리는 그 날까지, 비크닉이 함께 합니다."
2023-12-17,태광산업 대표에 ‘오너측근’ 성회용…이호진 전 회장 복귀 빨라지나,"성회용 태광산업 신임 대표. 사진 태광그룹태광그룹은 모회사인 태광산업 대표에 성회용(59) 티캐스트 대표를 선임했다. 성 신임대표는 이호진(61) 전 태광그룹 회장의 측근으로, 이 전 회장의 경영복귀를 앞둔 포석이라는 해석이 나온다.태광그룹은 17일 이같은 내용의 2024년 임원 인사를 발표했다. 성 대표는 지난 6월 태광의 미디어콘텐트 기업인 티캐스트 대표로 합류해 계열사 대표 협의체인 경영협의회 부의장을 맡고 있다.성 대표는 태광 합류 전부터오너인 이 전 회장과 친분을 쌓고 신임을 받아 온 것으로 알려졌다. 그는 태광그룹이 지난 10월ESG(환경·사회·지배구조) 중심 경영을 위해 출범시킨 미래위원회의 위원장도 겸하고 있다.이호진 전 태광그룹 회장이 12일 서초구 서울고등법원에서 특정경제범죄가중처벌등에관한법률위반(횡령) 등 항소심 1회 공판을 마치고 법정을 나서며 취재진 질문에 답하고 있다. 뉴스1태광그룹은 “성 대표가 경제 및 산업은 물론 사회 전반에 깊이 있는 식견을 갖고 있다”며 “불확실한 경영 환경을 돌파하고 그룹의 새로운 비전과 사업전략을 수립할 적임자”라고 선임 배경을 설명했다.특히 이번 인사에선 이충효(52) 티캐스트 경영기획팀장이 상무보로 승진하며 태광그룹 73년 역사상 처음으로 내부 승진에 의한 첫 여성 임원이 됐다. 대한화섬 신임 대표에는 오용근 태광산업 전무가, 티캐스트 대표에는 엄재용 티캐스트 경영지원실장이 선임됐다.티캐스트 이충효 상무보. 사진 태광그룹현재 태광그룹은 이 전 회장의 횡령·배임 의혹으로 경찰의 세 번째 압수수색을 당하면서 오너리스크가 다시 불거지고 있다. 경찰은 이 전 회장이 그룹 계열사를 동원해 비자금을 조성하고 태광CC를 통해 계열사 공사비를 부당하게 지원한 것으로 보고 수사에 나섰다.지난10월 24일 서울경찰청 반부패공공범죄수사대가 업무상 횡령·배임 의혹을 받는 태광그룹 이호진 전 회장의 자택과 사무실을 압수수색 중이다. 이날 압수수색 중인 태광그룹 사무실이 위치한 서울 종로구 흥국생명 빌딩의 모습. 연합뉴스횡령·배임 등의 혐의로 수감됐던 이 전 회장은 지난 8월 광복절 특별사면으로 복권돼 경영 복귀의 길이 열렸다. 태광은 특사 이후 전 계열사 감사에 나서고, 그룹 실세로 불리던 김기유 티시스 대표를 해임했다. 이 전 회장이 복귀 수순을 밟을 것이란 전망이 나오는 이유다.최근엔 ‘미래위원회’출범과 함께ESG경영 5개년 계획을 발표하는 등 그룹 분위기 쇄신에도 공을 들이고 있다. 이에 따라 이번 성 대표 선임을 계기로 이 전 회장의 경영 복귀가 속도를 낼지 주목하고 있다. 이와 관련 태광그룹 관계자는 “ESG경영 강화와 성장동력 확보를 위해 조직의 체질과 사업구조를 지속해서 개선해 나갈 방침”이라고 말했다. 다음은 태광그룹 인사.◆ 태광산업 ▶대표 성회용 ▶상무 이명철 ▶상무보 이두열 황태영◆ 대한화섬 ▶대표 오용근◆티캐스트 ▶대표 엄재용 ▶상무보 이충효◆흥국생명 ▶전무 허정민 ▶상무 오세일 ▶상무보 강현호 김정배◆흥국화재 ▶전무 유진우 ▶상무 최강환 ▶상무보 김주희 정영구◆흥국증권 ▶상무보 박성진◆고려저축은행 ▶상무보 김정기"
2023-12-21,내년 차 보험료 2만원가량 내린다…보험업계 ‘5000억 상생’,"대형 손해보험사들이 내년 자동차보험료 2.5~2.6% 인하 계획을 밝히며 금융당국의 ‘상생금융’에 동참했다. 지난해 4월과 올 2월에 이은 3년 연속 인하다. 그러나 보험업계선 “과감한 인하에 나설 만큼 시장 상황이 좋지 않다”는 우려의 목소리도 나온다.정근영 디자이너20일KB손해보험은 내년 2월 중순 이후 계약부터 개인 자동차 보험료를 2.6% 인하하겠다고 밝혔다. 가정용·배달용 이륜차 보험료 등도 내년 1월 중순 이후 계약부터 평균 10.3% 인하할 계획이다. 삼성화재도 개인 자동차 보험료 2.6%, 이륜차 보험료 8% 수준의 인하안을 검토하고 있다. 현대해상과DB손해보험은 개인 자동차 보험료 2.5% 인하안을 발표했고, 중소형사 중엔 메리츠화재와 한화손보·롯데손보가 각각 3%·2.5%·2.4% 인하 계획을 밝혔다.평균 자동차 보험료가 약 72만원이란 점을 고려하면 2.5~3% 인하율에 따라 1만8000원~2만2000원 가량이 인하되는 셈이다. 시장점유율 85%를 차지하는 대형사 네 곳(삼성화재·현대해상·KB손보·DB손보)이 모두 2.5~2.6% 인하안을 발표하면서, 업계는 약 5000억원 가량의 상생 금융 효과가 발생할 것으로 전망하고 있다.정근영 디자이너지난 6일 김주현 금융위원장과 이복현 금융감독원장은 보험사 최고경영자(CEO)들을 만나 “서민 경제가 어려움을 겪는 시기에 사회적 책임을 다해야 한다”며 상생금융 동참을 당부한 바 있다. 손보사의 자동차보험 손익이 2021년 이후 3년째 흑자 기조를 지속해온 데다, 손해율(가입자들이 보험사에 낸 보험료에서 보험사가 지급한 보험금 비중)도 안정적으로 유지된 영향이 컸다. 올 10월까지 4대 대형 손보사의 누적 손해율 평균은 78.6%로 양호한 수치를 보였다. 업계에선 자동차보험 손익분기점에 해당하는 손해율을 80%선으로 보고 있다.보험사들은 “자동차보험 손해율이 개선된 만큼 소비자들의 경제적 고통을 분담하겠다”며 인하 배경을 설명하고 있지만, 속내는 복잡하다. 그간 누적된 보험료 인하 효과가 나타나면서 올 하반기 들어 평균 손해율이 증가해 비용이 늘어나고 있어서다. 손보업계에 따르면 4대 대형 손보사의 평균 손해율은 올 9월 82%를 보인 뒤 지난 달엔 86.4%를 나타냈다. 9개 손보사(삼성화재·현대해상·KB손보·DB손보·메리츠화재·한화손보·롯데손보·흥국화재·MG손보)로 범위를 넓혀 계산하면 지난달 평균 손해율은 94%가 넘는다.한 보험업계 관계자는 “동절기엔 폭설 등 계절적 요인으로 손해율이 더 오를 수 있다”며 “업계 내에선 연말 손해율 집계까지 보고 1%대 정도로 인하율을 정하는 게 적절하다는 목소리도 있었다”고 전했다.최근 3년간은 코로나19 대유행 여파로 차량 운행량이 줄어들면서 흑자가 가능했지만, 향후 시장 전망은 낙관하기 어렵다는 목소리도 있다. 또 다른 보험업계 관계자는 “자동차 사고 건수가 다시 코로나19 이전 수준을 회복하고 있고, 치료비 등 인당 보험금 지급액도 늘어나는 상황”이라며 “향후 적자 폭 확대가 불가피하다”고 말했다. 금융감독원에 따르면 올 상반기 자동차보험 영업손익은 5559억원 흑자를 보였는데, 지난해 상반기(6265억원)보다 흑자 폭이 축소됐다.그러나 업계는 상생금융에 전 금융권이 동참하는 만큼 추가 사업 발굴에도 속도감 있게 나서겠단 계획이다. 지난 18일에는 내년 실손보험료 인상률을 최소한으로 하는 안을 꺼냈다. 보험계약대출 금리수준을 조정하고 이자납입을 유예하는 안 등도 거론된다."
2023-12-20,"차 보험료 2.2만원 내린다…3년 연속 인하, 보험업계 속앓이","셔터스톡대형 손해보험사들이 내년 자동차보험료 2.5~2.6% 인하 계획을 밝히며 금융당국의 ‘상생금융’에 동참했다. 지난해 4월과 올 2월에 이은 3년 연속 인하다. 그러나 보험업계선 “과감한 인하에 나설 만큼 시장 상황이 좋지 않다”는 우려의 목소리도 나온다.20일KB손해보험은 내년 2월 중순 이후 계약부터 개인 자동차 보험료를 2.6% 인하하겠다고 밝혔다. 가정용‧배달용 이륜차 보험료 등도 내년 1월 중순 이후 계약부터 평균 10.3% 인하할 계획이다. 삼성화재도 개인 자동차 보험료 2.6%, 이륜차 보험료 8% 수준의 인하안을 검토하고 있다. 현대해상과DB손해보험은 개인 자동차 보험료 2.5% 인하안을 발표했고, 중소형사 중엔 메리츠화재와 한화손보·롯데손보가 각각 3%‧2.5%·2.4% 인하 계획을 밝혔다.평균 자동차 보험료가 약 72만원이란 점을 고려하면 2.5~3% 인하율에 따라 1만8000원~2만2000원 가량이 인하되는 셈이다. 시장점유율 85%를 차지하는 대형사 네 곳(삼성화재‧현대해상‧KB손보‧DB손보)이 모두 2.5~2.6% 인하안을 발표하면서, 업계는 약 5000억원 가량의 상생 금융 효과가 발생할 것으로 전망하고 있다.정근영 디자이너지난 6일 김주현 금융위원장과 이복현 금융감독원장은 보험사CEO들을 만나 “서민 경제가 어려움을 겪는 시기에 사회적 책임을 다해야 한다”며 상생금융 동참을 당부한 바 있다. 손보사의 자동차보험 손익이 2021년 이후 3년째 흑자 기조를 지속해온 데다, 손해율(가입자들이 보험사에 낸 보험료에서 보험사가 지급한 보험금 비중)도 안정적으로 유지된 영향이 컸다. 올 10월까지 4대 대형 손보사의 누적 손해율 평균은 78.6%로 양호한 수치를 보였다. 업계에선 자동차보험 손익분기점에 해당하는 손해율을 80%선으로 보고 있다.보험사들은 “자동차보험 손해율이 개선된 만큼 소비자들의 경제적 고통을 분담하겠다”며 인하 배경을 설명하고 있지만, 속내는 복잡하다. 그간 누적된 보험료 인하 효과가 나타나면서 올 하반기 들어 평균 손해율이 증가해 비용이 늘어나고 있어서다. 손보업계에 따르면 4대 대형 손보사의 평균 손해율은 올 9월 82%를 보인 뒤 지난 달엔 86.4%를 나타냈다. 9개 손보사(삼성화재·현대해상·KB손보·DB손보·메리츠화재·한화손보·롯데손보·흥국화재·MG손보)로 범위를 넓혀 계산하면 지난달 평균 손해율은 94%가 넘는다.한 보험업계 관계자는 “올 여름엔 장마로 인한 침수 사고가 적어 손해율이 일시적으로 낮아졌지만 동절기엔 폭설 등 계절적 요인으로 손해율이 더 오를 수 있다”며 “업계 내에선 연말 손해율 집계까지 보고 1%대 정도로 인하율을 정하는 게 적절하다는 목소리도 있었다”고 전했다.정근영 디자이너최근 3년간은 신종 코로나바이러스 감염증(코로나19) 대유행 여파로 차량 운행량이 줄어들면서 흑자가 가능했지만, 향후 시장 전망은 낙관하기 어렵다는 목소리도 있다. 또 다른 보험업계 관계자는 “자동차 사고 건수가 다시 코로나19 이전 수준을 회복하고 있고, 치료비 등 인당 보험금 지급액도 늘어나는 상황”이라며 “향후 적자 폭 확대가 불가피하다”고 말했다. 금융감독원에 따르면 올 상반기 자동차보험 영업손익은 5559억원 흑자를 보였는데, 지난해 상반기(6265억원)보다 흑자 폭이 축소됐다.그러나 업계는 상생금융에 전 금융권이 동참하는 만큼 추가 사업 발굴에도 속도감 있게 나서겠단 계획이다. 지난 18일에는 내년 실손보험료 인상률을 최소한으로 하는 안을 꺼냈다. 내년 전체 인상률 평균을 약 1.5%수준으로 산출했는데, 이는 2022년(약 14.2%)과 지난해(약 8.9%)에 비하면 크게 낮아진 수치다. 보험계약대출 금리수준을 조정하고 이자납입을 유예하는 안 등도 거론된다."
2023-10-30,[부고] 고규창씨 外,"▶고규창씨(전 행정안전부 차관·전 충북도 행정부지사) 별세, 박정은씨 남편상, 고승화·승연(TV조선 사회부 기자)·경진씨 부친상=29일 충북대병원, 발인 31일 오전 10시, 043-269-6969▶김영례씨 별세, 문병천(전 흥국화재 대표)·병옥(전 전자신문인터넷 이사)·영복·영숙·영란씨 모친상, 이무송·현종규·이도용씨 장모상=28일 삼성서울병원, 발인 31일 오전 5시, 3410-3151▶박성자씨 별세, 박재우씨(한국외대 명예교수) 부인상, 박천형·소영씨 모친상=26일 강남세브란스병원, 발인 30일, 2019-4000▶박우순씨 별세, 김우진씨(전 전북교통방송 편성제작국장) 모친상=29일 전주효사랑장례문화원, 발인 31일 오전 9시30분, 063-250-4444▶안용선씨 별세, 박상재(한국아동문학인협회 이사장)·영재씨(보령제약 이사) 모친상=29일 이대목동병원, 발인 31일 오전 7시30분, 2650-5121"
2023-07-18,"[Biz & Now] 기업들, 수해지역 온정…보험료 미뤄주고 라면·생수 지원","수해 피해 지역에 복구 성금과 구호 물품을 보내는 기업들의 온정이 이어지고 있다. 두산그룹은 생필품 지원과 침수된 가옥·도로 복구 등을 위해 희망브리지 전국재해구호협회에 성금 5억원을 기탁했다고 17일 밝혔다. 반도문화재단과 현대해상, 카카오뱅크도 각각 1억원을 재해구호협회에 기부했다. 권홍사 반도문화재단 이사장은 “수재민과 지역 소상공인에게 힘이 되기 바란다”고 말했다. 한화생명과 흥국생명·흥국화재는 피해 지역 고객을 대상으로 일부 보험료 납입 및 대출 원리금 상환을 일정 기간 유예하기로 했다. 농심은 경북·충북 지역에 라면과 생수 등으로 구성된 ‘이머전시(비상) 푸드팩’ 2500세트를 지원했다.SPC행복한재단은 전북·충북·경북·충남 지역 등에 18일까지 빵과 생수 총 1만 개를 전달할 예정이다. 삼양식품은 전북 익산 지역 주민에게 라면 5000여 개를 지원했다. 지역생활 커뮤니티 당근마켓은 ‘수해 지역 이웃돕기 캠페인’을 진행 중이다."
