date,title,content
2023-06-20,"공정위, 은행·보험 이어 증권사도 조사…수수료 등 담합 혐의","공정거래위원회가 대형 증권사의 담합에 대한 전방위적 조사에 들어갔다. 앞서 은행과 보험업계에 대한 담합 의혹 조사에 착수한 이후 증권업계에까지 칼을 빼들면서 금융업 전반을 ‘정조준’하는 모양새다.━대형 증권사 전방위 현장조사20일 업계에 따르면 공정위는 이날 오전 키움증권·메리츠증권·KB증권·NH투자증권·삼성증권 등 주요 증권사 본점에 조사관을 보내 현장조사를 진행하고 있다. 조사 대상엔 증권사와 자산운용사가 회원사로 있는 금융투자협회도 포함됐다. 공정위는 이들 증권사로부터 신용융자 금리와 국내‧외 주식매매 수수료 결정과 관련한 자료를 확보하고 있는 것으로 알려졌다.서울 여의도 키움증권 본사 모습. 뉴스1금리나 수수료를 정하는 과정에서 증권사끼리의 담합이 있었는지를 확인하기 위해서다. 이를 포함해 예탁금 이용료율 등 증권사 업무 전반에 대해서도 살펴볼 것으로 보인다. 기준금리가 상승한 데 비해 증권사 대부분이 예탁금에 대한 이자인 예탁금 이용료율은 소폭 올리는 데 그쳤다는 지적이 수차례 제기된 바 있다.이번 조사는 증권업계 전반으로 확대될 가능성이 있다. 예탁금 이용료율, 신용융자는 사실상 전 증권사와 연관돼있기 때문이다. 하지만 증권업계는 담합 가능성이 크지 않다고 반박한다. 수십 개 회사가 경쟁하는 증권 시장에서 증권사끼리 담합할 유인이 크지 않다는 이유에서다.━尹 “금융사 지대추구 막아라” 후속조치공정위가 금융업계 전반에 대한 조사에 착수한 건 지난 2월 윤석열 대통령의 발언 이후다. 당시 윤 대통령은 “모든 수단을 열어놓고 통신‧금융사의 과도한 지대추구를 막을 방안을 강구하라”고 지시했다. 같은 달 윤 대통령은 또다시 “금융과 통신은 국민의 삶과 떼려야 뗄 수 없는 필수 서비스로, 공정한 경쟁이 보장되지 않으면 그 피해는 힘없는 서민에게 돌아갈 것”이라는 당부를 하기도 했다.윤석열 대통령이 19일 오후(현지시간) 프랑스 파리 시내 호텔에서 열린 프랑스 동포 만찬 간담회에서 격려사를 하고 있다. 뉴스1이후 공정위는 2월 말 은행 6곳(KB국민‧신한‧우리‧하나‧NH농협‧IBK기업은행)에 대한 현장조사를 벌였다. 지난 12일엔 시중은행 4곳을 특정해 2차 현장조사를 벌이면서 압박 강도를 높였다. 대출금리와 수수료 담합 혐의로 특정해 4대 은행이 정보를 교환하는 식으로 담합해 공정거래법 위반이 있었는지 찾기 위해서다.━은행·보험 조사 진행 중공정위는 지난 5월엔 손해보험사의 보험 상품 담합 의혹과 관련해 현장조사에 나섰다. 손해보험협회와 현대해상‧DB손해보험‧메리츠화재‧흥국화재 등이 조사 대상이었다. 백내장 수술 실손 의료보험금 지급 심사뿐 아니라 보험사끼리 실손의료보험 지급 기준을 논의하면서 담합을 논의했는지 등을 확인하는 목적이었다. 일각에선 4월 공정위가 조사와 정책 부서를 분리하면서 조사 강도가 더욱 세졌다는 평가가 나온다."
2023-07-12,"캄보디아 만삭 아내, 보험 약관 다 이해하고 싸인했을까?","2014년 8월 경부고속도로 천안IC부근에서 교통사고를 위장해 캄보디아 국적의 아내를 살해한 혐의로 기소된 A씨 사건을 심리한 1심 재판부가 2015년 현장검증에 나선 모습. 연합뉴스보험금을 노리고 고의로 교통사고를 내 캄보디아 국적의 아내를 숨지게 한 혐의를 받았다가 무죄가 확정된 남편 A씨가 최근 보험금 청구 소송에서 잇따라 승소하자 보험업계가 긴장하고 있다. 법원은 “아내가 보험 계약 내용을 충분히 이해한 뒤에 청약서에 자필로 서명했다”는 이유를 들며 남편 손을 들어주고 있다. 하지만 보험사들은 “계약 금액이 이례적인 만큼, 자필 서명 효력을 더 엄격하게 따져볼 필요가 있다”는 입장이다.2014년 8월 A씨는 승합차를 운전하다 경부고속도로 갓길에 멈춰 서있던 8t 화물차를 들이받았고, 조수석에 타고 있던 아내 B씨는 현장에서 숨졌다. A씨는 2008년부터 2014년까지 보험회사 11곳에서 생명보험 25건에 가입한 것으로 조사됐다. 보험 계약의 수익자는 A씨, 피보험자는 B씨로 A씨에게 돌아갈 보험금은 총 95억여원이었다. 검찰은 A씨가 B씨에게 수면유도제를 먹이고 안전벨트를 풀어두었고, 사고 직전 상향등을 켜 화물차의 위치를 확인한 점 등을 들어 보험사기로 봤다. 하지만 2017년 대법원은 A씨의 졸음운전 주장을 받아들여 살인과 사기 혐의를 무죄로 판단했다. “A씨가 수면유도제를 먹이거나 안전벨트를 풀었다는 증거가 없고, 월 360만원의 보험료를 지출할 정도로 수입이 충분했다”는 것이다.━""아내가 계약 다 이해 후 서명"" 판결에 속 타는 보험사들A씨는 보험사 11곳을 상대로 보험금 청구 소송에 돌입해 현재까지 9곳에 대해 승소 판결을 받아낸 상태다. 지난 6일 서울고등법원은 A씨가 미래에셋생명보험을 상대로 낸 소송에서 “B씨가 보험 계약 내용을 충분히 이해하고 자필로 서명했다”고 보고 계약이 유효하다고 봤다. A씨 손을 들어준 다른 하급심 판결들도 비슷한 취지다. 앞서 보험사들은 “A씨가 고의로 사고를 냈고, 애초에 이런 목적을 갖고 보험에 가입했기 때문에 계약 자체가 무효”라고 주장해 왔지만, 형사 사건이 무죄로 결론 나면서 힘을 잃었다.하급심 판결에 불복한 보험사들은 “B씨가 약관 내용을 잘 이해하지 못한 채 서명했다”는 주장에 초점을 맞추고 남은 소송에 대응하고 있다. “B씨가 평소 병원에 가거나 콜센터에 전화할 때 ‘무슨 말인지 모르겠다’는 이야기를 자주 했다”는 정황들을 내놓는 것이다. 한 보험사 관계자는 “약관은 한국인도 이해하기 어려운데 외국인이 얼마나 잘 이해하고 서명을 했을지 의문”이라며 “아내가 죽은 뒤라 확인하기도 어려워 곤란하다”고 말했다. 또 다른 보험사 관계자는 “형사 사건은 증거가 엄격하게 판단돼 무죄라 하더라도, 민사 사건에서는 계약 효력을 다퉈볼 여지가 충분히 고려돼야 한다”고 말했다.당시 B씨의 한국어 능력에 대한 절대적인 판단 기준이 없다 보니 법원 최종 결론이 달라질 가능성은 존재한다. 실제로 B씨가 한국에 온 지 몇 달밖에 안 된 시점에 체결된 라이나생명 계약은 무효라고 본 판결도 있다. ""B씨가 한국어를 잘 하지 못해 보험 계약 내용을 이해하지 못했는데도 A씨가 시키는 대로 서명했을 뿐""이라고 판단한 것이다. 흥국화재도 계약 절차 당시 문제가 있다고 주장해 1심에서 승소한 상태다.━보험금 싸움 단골 손님, '자필 서명'가입 당시에는 가볍게 지나가기 쉬운 ‘자필 서명’이 문제 되는 것은 이 사건뿐 아니다. 보험설계사가 가입자 대신 서명을 하는 바람에 계약이 무효가 돼 정당한 보험금을 못 받는 경우가 가장 흔하다. 반대로 가입자가 “자필 서명한 적 없다”며 보험료를 돌려 달라고 하는 일도 생긴다. 한 보험사 관계자는 “회사 입장에서는 설계사가 잘못하는 건 없는지, 고객이 사기 치는 건 없는지 모두 유심히 들여다봐야 하는 영역”이라며 “자필 서명에 대한 불필요한 분쟁을 줄이기 위해 지문 인식 등 기술적인 보완책도 고민하고 있다”고 했다.다만 “본인 동의 절차를 까다롭게 만드는 방식의 대책만이 정답은 아니다”라는 게 업계 목소리다. 한 보험사 관계자는 “자필 서명이 매번 문제 되다 보니 계약 당시 휴대폰 위치 추적을 하자는 이야기도 나오지만, 절차가 복잡해지면 보험이 꼭 필요한 이들이 피해 볼 가능성이 있다”고 말했다. 남편 A씨 사건 판결문에는 “아내 B씨가 내용을 잘 이해할 수 있도록 보험사가 통역 서비스를 지원했어야 한다”는 대목도 등장하지만, 보험사 관계자들은 “통역까지 해야 한다고 하면 비용 지출이 부담스러워 아무도 외국인에 대한 보험 계약을 체결하지 않으려고 할 것”이라고 짚었다.대신 보험사기를 조기에 발견해 신속하게 대처하자는 방향에 대해서는 업계와 금융당국 모두 공감하고 있다. 10일 보건복지부, 경찰청, 금융감독원, 보험협회 등은 보험조사협의회를 열고 중복·과다 보험 방지를 위한 인수심사 가이드라인을 마련하자는 데에 뜻을 모았다. 사망담보 가입금액과 소득, 납부 능력을 보다 엄격하게 들여다봐 심사를 강화하자는 게 골자다."
2022-12-19,"태광그룹 “10년간 12조 투자, 7000명 신규채용 나설 것”","태광그룹CI.사진 태광산업태광그룹이 향후 10년간 제조·금융·서비스 부문에 약 12조원을 투자하고, 7000명을 신규채용하겠다고 밝혔다. 대규모 투자를 통해 주력사업을 강화하고 그룹의 미래 먹거리를 찾는다는 구상이다.태광그룹은 19일 태광산업 등 석유화학·섬유 분야에 10조원, 흥국생명 등 금융 계열사에 2조원 등을 투자한다고 밝혔다.세부적으로 석유화학 부문에 약 4조원을 투자해 친환경·고기능성 소재 중심으로 신사업을 육성하고, 섬유사업부문 신규 사업에 1조5000억원을 투입한다. 또 저융점섬유(LMF) 국내 증산, 나일론 설비교체 등 기존사업 개선에 2조4000억원을 투자하고, 현재 투자가 진행 중인 스판덱스·아라미드(열·강도가 강한 합성섬유로 방탄복 등에 사용) 공장 증설에도 속도를 낼 방침이다.금융계열사 중 보험회사인 흥국생명·흥국화재에는 인공지능(AI)을 통한 계약 인수·보험금 지급 등 차세대 시스템을 신설한다. 고려저축은행·예가람저축은행 등도 금융 플랫폼과 정보보안시스템을 고도화하고AI콜센터 등을 신규 구축하기로 했다.미디어 계열사인 티캐스트와 티알엔에도 약 2300억원을 투입해 자체 콘텐트 개발에 나서고, 인터넷·모바일 쇼핑몰 인프라를 투자할 계획이라고 밝혔다.태광그룹 관계자는 “향후 10년간 집행하는 대규모 투자를 바탕으로 주력사업 강화, 기술 혁신, 미래 먹거리 발굴에 매진할 계획”이라며 “신규 일자리 창출을 통해 그동안 정체됐던 그룹 재도약과 투자 선순환 구조를 만들겠다”고 말했다."
2022-12-26,"할인은 기본, 동화책 공모전도…어린이보험 고객 확보전","창작동화 공모전을 진행한NH농협손보. [사진 각 사]NH농협손해보험은 5세 아이들이 볼 수 있는 동화책을 만들기 위해 공모전을 열어 이달 16일 수상작을 선정했다.NH손보는 내년 중 5권의 동화책을 내 어린이보험 가입자에게 지급하는 등 홍보에 사용할 예정이다.KB손해보험은 이달부터 어린이보험 신규 가입자에게 보험료를 최대 12% 할인해주고 있다. 여기에 유명 의료인을 광고모델로 내세웠다.어린이보험 시장을 둔 보험사들의 경쟁이 치열해지고 있다. 어린이보험은 15세 이하 어린이·청소년을 대상으로 질병과 상해를 당했을 때 보험금을 주는 상품이다.보험사들이 2018년부터 어린이보험 가입연령을 만 30세까지 확대하며 ‘어른이 보험’으로도 인기를 끌고 있다. 3대 중대 질환(암·뇌혈관질환·심혈관질환) 등 성인용 보험에 들어있는 대다수 항목을 최장 100세까지 보장받을 수 있는데, 보험료는 오히려 20%가량 저렴하다. 경제적 여유가 부족한 사회 초년생 등에게 인기를 끌고 있다.유명 의료인을 광고모델로 기용한KB손보. [사진 각 사]어린이보험은 현대해상이 업계 1위를 지키고 있다. 현대해상은 2004년 업계 최초로 어린이보험 상품을 내놓은 후 올해 5월까지 460만 건이 판매됐다. 지난해 태어난 출생아 2명 중 1명은 현대해상 어린이보험 상품에 가입했다.최근에는 후발 주자들의 추격도 거세다.KB손보는 자녀 심리서비스를 제공하는 등 어린이·청소년 정신질환 관련한 보장을 늘려 고객 확보에 나서고 있다. 삼성화재도 지난 9월 출시된 어린이보험에 암 등에 적용되는 보험금에 가입 후 5년마다 10%씩 보장금이 올라가는 방식을 도입했다.올해 새로운 상품을 개발해 일정 기간 독점적인 상품판매 권리(배타적 사용권)를 획득하는 보험사들도 많다. 현대해상은 내향성 손발톱 치료와 틱장애 약물치료로,KB손보는 정신질환 치료비, 신경성식욕부진, 폭식증 등에 배타적 사용권을 인정받았다. 소형사인 흥국화재도 신생아 난청 진단비에 배타적 사용권을 확보했다.그래픽=김주원 기자zoom@joongang.co.kr보험사 입장에서는 어린이보험은 실손의료보험 등 다른 보험에 비해 남는 게 많은 보험이다. 보험연구원이 올해 1월 2010~2019년 사이 세대별 보험가입 등을 조사한 결과 장기손해보험의 보험가입자 평균연령은 2010년 38세에서 2019년 43.7세까지 높아지는 보험 가입자의 고령화도 심해지고 있다. 어린이 보험은 젊은 층 잠재 고객을 끌어모을 수 있다. 보험업계 관계자는 “어린이보험으로 잠재고객 확보는 물론, 가족 전체를 고객으로 둘 수 있다는 점도 장점이다”고 말했다.손해율도 성인 보험에 비해 아직은 낮은 상태다. 어린이·청소년은 어른보다 중증 질환에 걸릴 위험이 낮다. 보험업계 관계자는 “어린이보험은 병원 이용이 잦은 4세 이전에는 손해율이 다소 높지만, 이후 5~20세 구간은 성인 보험에 비해 손해율이 낮다”고 말했다.특히 내년부터 도입되는 새 국제회계기준(IFRS-17)도 보험사들이 어린이보험 판매에 열을 올리는 이유다.IFRS-17은 부채가 시가로 평가돼 저축성보험보다는 보장성보험을 파는 것이 유리하다. 어린이보험은 운전자보험과 암 보험 등과 함께 대표적인 보장성보험이다. 게다가 어린이보험은 부모가 자녀를 위해 가입해주는 보험인 만큼 중도 해지가 적고 유지 기간도 길다. 각 증권사도 어린이보험 비중이 높은 보험사가IFRS-17 도입의 수혜를 입을 것으로 보고 있다."
2022-12-25,"동화책 만들고, 오은영 앞세우고…어린이보험 경쟁 치열","NH농협손해보험은 5세 아이들이 볼 수 있는 동화책을 만들기 위해 공모전을 열어 이달 16일 수상작을 선정했다.NH손보는 내년 중 5권의 동화책을 내 어린이보험 가입자에게 지급하는 등 홍보에 사용할 예정이다.KB손해보험은 이달부터 어린이보험 신규 가입자에게 보험료를 최대 12% 할인해주고 있다.KB손보는 올해 초부터 오은영 정신의학과 박사를 어린이보험 광고모델로 쓰는 등 신규 고객 확보에 적극적으로 나서고 있다.KB손해보험은 어린이보험 시장 점유율을 높이기 위해 올해부터 정신의학과 박사를 광고모델로 쓰고 있다.KB손해보험어린이보험 시장을 둔 보험사들의 경쟁이 치열해지고 있다. 어린이보험은 15세 이하 어린이ㆍ청소년을 대상으로 질병과 상해를 당했을 때 보험금을 주는 상품이다.보험사들이 2018년부터 어린이보험 가입연령을 만 30세까지 확대하며 ‘어른이 보험’으로도 인기를 끌고 있다. 3대 중대 질환(암ㆍ뇌혈관질환ㆍ심혈관질환) 등 성인용 보험에 들어있는 대다수 항목을 최장 100세까지 보장받을 수 있는데, 보험료는 오히려 20%가량 저렴하다. 경제적 여유가 부족한 사회 초년생 등에게 인기를 끌고 있다.그래픽=김주원 기자zoom@joongang.co.kr어린이보험은 현대해상이 업계 1위를 지키고 있다. 현대해상은 2004년 업계 최초로 어린이보험 상품을 내놓은 후 올해 5월까지 460만 건이 판매됐다. 지난해 태어난 출생아 2명 중 1명은 현대해상 어린이보험 상품에 가입했다.최근에는 후발 주자들의 추격도 거세다.KB손보는 자녀 심리서비스를 제공하는 등 어린이ㆍ청소년 정신질환 관련한 보장을 늘려 고객 확보에 나서고 있다. 삼성화재도 지난 9월 출시된 어린이보험에 암 등에 적용되는 보험금에 가입 후 5년 마다 10%씩 보장금이 올라가는 방식을 도입했다.올해 새로운 상품을 개발해 일정 기간 독점적인 상품판매 권리(배타적 사용권)를 획득하는 보험사들도 많다. 현대해상은 내향성 손발톱 치료와 틱장애 약물치료로,KB손보는 정신질환 치료비, 신경성식욕부진, 폭식증 등에 배타적 사용권을 인정받았다. 소형사인 흥국화재도 신생아 난청 진단비에 배타적 사용권을 확보했다.그래픽=김주원 기자zoom@joongang.co.kr보험사 입장에서는 어린이보험은 실손의료보험 등 다른 보험에 비해 남는 게 많은 보험이다. 보험연구원이 올해 1월 2010~2019년 사이 세대별 보험가입 등을 조사한 결과 장기손해보험의 보험가입자 평균연령은 2010년 38세에서 2019년 43.7세까지 높아지는 보험 가입자의 고령화도 심해지고 있다. 어린이 보험은 젊은 층 잠재 고객을 끌어모을 수 있다. 보험업계 관계자는 “어린이보험으로 잠재고객 확보는 물론, 가족 전체를 고객으로 둘 수 있다는 점도 장점이다”고 말했다.손해율도 성인 보험에 비해 아직은 낮은 상태다. 어린이ㆍ청소년은 어른보다 중증 질환에 걸릴 위험이 낮다. 보험업계 관계자는 “어린이보험은 병원 이용이 잦은 4세 이전에는 손해율이 다소 높지만, 이후 5~20세 구간은 성인 보험에 비해 손해율이 낮다”고 말했다.특히 내년부터 도입되는 새 국제회계기준(IFRS-17)도 보험사들이 어린이보험 판매에 열을 올리는 이유다.IFRS-17은 부채가 시가로 평가돼 저축성보험보다는 보장성보험을 파는 것이 유리하다. 어린이보험은 운전자보험과 암 보험 등과 함께 대표적인 보장성보험이다. 게다가 어린이보험은 부모가 자녀를 위해 가입해주는 보험인 만큼 중도 해지가 적고 유지 기간도 길다. 각 증권사들도 어린이보험 비중이 높은 보험사가IFRS-17 도입의 수혜를 입을 것으로 보고 있다."
2022-05-20,금리 오르는데도 재무건전성 빨간불 켜진 보험사,"금리 상승에도 보험사들이 웃지 못하고 있다. 금리가 오르며 자산 운용 수익은 늘었지만, 보유 채권 가치 급락으로 재무 건전성에 빨간불이 켜지면서다.19일 보험업계에 따르면 올해 1분기 실적을 발표한 보험사들의 지급여력비율(RBC)이 일제히 급락했다.DGB생명의 1분기RBC는 84.5%로 100%를 밑돌았다. 지난해 말(223.6%)보다 139.1%포인트 하락했다. 다만DGB생명은 300억원의 유상증자를 통해RBC를 108.5%로 높인 상태다.그래픽=전유진yuki@joongang.co.kr금융당국의 권고치(150%)를 밑도는 보험사도 속출하고 있다. 국내 5위 생명보험사인 농협생명의RBC는 131.5%로 지난해 말보다 79%포인트 하락했다. 한화손해보험(122.8%)과DB생명(139.14%), 흥국화재(146.65%) 등도 150%를 밑돌았다.RBC는 보험사가 각종 리스크로 입을 수 있는 손실금액(요구자본)과 이런 손실금액에 대처할 수 있는 자본(가용자본)의 비율이다. 보험업법상 100%만 넘으면 되지만, 금융 당국은 사전 관리 차원에서 150% 이상을 권고하고 있다.RBC하락은 금리 상승으로 보험사가 보유한 채권 가격이 하락하며 발생한 평가 손실 때문이다. 채권은 보험사 자산의 절반가량을 차지한다. 한국기업평가는 지난 4월 보고서에서 올해 1분기 시장 금리 상승으로 보험사의RBC가 평균 30%포인트 이상 내려간 것으로 추정했다.보험사는RBC하락을 막기 위해 신종자본증권이나 후순위채 등 자본성증권을 발행하고 있다. 한국기업평가에 따르면 올해 들어 지난달 22일까지 보험사들은 총 2조2691억원 어치의 자본성증권을 발행했다. 지난해 전체 발행액(2조9000억원)의 78% 수준이다.이렇게 발행한 후순위채권 등은 보험사의 장기 체력을 갉아먹는다. 농협생명이 지난 3월 3일 발행한 후순위채권 6000억원의 경우 만기 10년에 표면이율이 4.35%이다. 농협생명의 올해 1분기 자산운용 수익률(2.98%)보다 높다.보험업계는 내년 자산과 부채를 모두 시가로 평가하는 신지급여력제도(K-ICS)가 도입되면 상황이 달라질 것으로 예상한다. 금리가 상승하면 보험부채도 줄어드는 구조라 재무건전성도 개선된다.보험업계 관계자는 “올해가 지나면 사라질RBC비율을 맞추기 위해 고금리를 약속하는 채권 발행이 이어지고 있다”며 “금융당국이RBC비율 관련 유예 조치나K-ICS조기 조입 등의 대책을 내놔야 한다”고 말했다. 금융당국 관계자는 “RBC추이에 따라 적절한 조치를 검토하고 있다”면서도 “보험사들의 자본확충 등 자구 노력이 선행될 필요가 있다”고 말했다."
